{
  "metadata": {
    "timestamp": 1736562648627,
    "page": 146,
    "hasNextPage": true,
    "endCursor": "Y3Vyc29yOjE5MA==",
    "completionStatus": "IN_PROGRESS"
  },
  "repositories": [
    {
      "nameWithOwner": "relax/relax",
      "stars": 8160,
      "defaultBranch": "master",
      "files": [
        {
          "name": ".babelrc",
          "type": "blob",
          "size": 0.091796875,
          "content": "{\n  \"presets\": [\"react\", \"es2015\", \"stage-0\"],\n  \"plugins\": [\"transform-decorators-legacy\"]\n}\n"
        },
        {
          "name": ".dockerignore",
          "type": "blob",
          "size": 0.060546875,
          "content": ".relaxrc\nbuild/\ndocker/\nnode_modules/\nuploads/\npublic/media/*\n"
        },
        {
          "name": ".eslintrc",
          "type": "blob",
          "size": 1.7578125,
          "content": "{\n  \"extends\": \"airbnb\",\n  \"parser\": \"babel-eslint\",\n  \"rules\": {\n    \"object-curly-spacing\": [2, \"never\"],\n    \"space-before-function-paren\": [2, \"always\"],\n    \"comma-dangle\": [2, \"never\"],\n    \"max-len\": [1, 115, 2, {\n      \"ignoreUrls\": true,\n      \"ignoreComments\": false\n    }],\n    \"no-unused-expressions\": [2, { \"allowShortCircuit\": true }],\n    \"no-use-before-define\": [2, { \"functions\": false, \"classes\": true }],\n    \"no-param-reassign\": [2, {\"props\": false}],\n    \"react/prefer-stateless-function\": 0,\n    \"consistent-return\": 0,\n    \"new-cap\": [2, {\"capIsNewExceptions\": [\"ObjectId\"]}],\n    \"jsx-quotes\": 0,\n    \"react/jsx-no-bind\": [2, {\n      \"ignoreRefs\": true,\n      \"allowArrowFunctions\": false,\n      \"allowBind\": false\n    }],\n    \"react/sort-comp\": [2, {         // https://github.com/yannickcr/eslint-plugin-react/blob/master/docs/rules/sort-comp.md\n      \"order\": [\n        \"lifecycle\",\n        \"everything-else\",\n        \"renderstuff\"\n      ],\n      \"groups\": {\n        \"lifecycle\": [\n          \"displayName\",\n          \"fragments\",\n          \"panelSettings\",\n          \"propTypes\",\n          \"contextTypes\",\n          \"childContextTypes\",\n          \"mixins\",\n          \"statics\",\n          \"defaultProps\",\n          \"defaultChildren\",\n          \"propsSchema\",\n          \"settings\",\n          \"style\",\n          \"constructor\",\n          \"getDefaultProps\",\n          \"getInitState\",\n          \"init\",\n          \"getChildContext\",\n          \"componentWillMount\",\n          \"componentDidMount\",\n          \"componentWillReceiveProps\",\n          \"shouldComponentUpdate\",\n          \"componentWillUpdate\",\n          \"componentDidUpdate\",\n          \"componentWillUnmount\"\n        ],\n        \"renderstuff\": [\n          \"render\",\n          \"/^render.+$/\"\n        ]\n      }\n    }]\n  }\n}\n"
        },
        {
          "name": ".gitignore",
          "type": "blob",
          "size": 0.6513671875,
          "content": "# Config\n.relaxrc\n\n# Logs\nlogs\n*.log\n\n# Runtime data\npids\n*.pid\n*.seed\n\n# Directory for instrumented libs generated by jscoverage/JSCover\nlib-cov\n\n# Coverage directory used by tools like istanbul\ncoverage\n\n# Grunt intermediate storage (http://gruntjs.com/creating-plugins#storing-task-files)\n.grunt\n\n# Compiled binary addons (http://nodejs.org/api/addons.html)\nbuild\nbuild/Release\n\n# Dependency directory\n# Commenting this out is preferred by some people, see\n# https://www.npmjs.org/doc/misc/npm-faq.html#should-i-check-my-node_modules-folder-into-git-\nnode_modules\n\n#Webstorm Config\n.idea\n\n# Users Environment Variables\n.lock-wscript\n\n/public/\ndist/\n.tmp\n.DS_Store\n"
        },
        {
          "name": ".npmignore",
          "type": "blob",
          "size": 0.0791015625,
          "content": ".relaxrc\ndocker/\ndocs/\nlib/\nuploads/\nbuild/\npublic/media/*\npackage.json.tmp\n.tmp\n"
        },
        {
          "name": ".relaxrc.sample",
          "type": "blob",
          "size": 0.08984375,
          "content": "{\n  \"port\": 8080,\n  \"devPort\": 8181,\n  \"db\": {\n    \"uri\": \"mongodb://localhost/relax\"\n  }\n}\n"
        },
        {
          "name": ".travis.yml",
          "type": "blob",
          "size": 1.0830078125,
          "content": "sudo: required\nservices:\n  - docker\nnotifications:\n  slack: relaxcms:Fr4KeA1SELAxxfd5H9acm2dX\nbefore_install:\n  - curl -L https://releases.rancher.com/compose/v0.11.0-rc14/rancher-compose-linux-amd64-v0.11.0-rc14.tar.gz > rancher-compose.tar.gz\n  - tar -xvzf rancher-compose.tar.gz\n  - rm *.gz\n  - chmod +x rancher-compose-v0.11.0-rc14/rancher-compose\n  - sudo mv rancher-compose-v0.11.0-rc14/rancher-compose /usr/local/bin\n  - rm -r rancher-compose-v0.11.0-rc14\n  - docker build -t relax/relax .\n  - docker build -t relax/nginx docker/nginx\nscript:\n  - docker run relax/relax npm run eslint\n  - docker run relax/relax npm test\nafter_success:\n  - if [ \"$TRAVIS_BRANCH\" == \"master\" ]; then\n    docker login -e=\"$DOCKER_EMAIL\" -u=\"$DOCKER_USERNAME\" -p=\"$DOCKER_PASSWORD\";\n    docker push relax/relax;\n    docker push relax/nginx;\n    fi\n  - if [ \"$TRAVIS_BRANCH\" == \"master\" ]; then\n    cd docker;\n    rancher-compose -f docker-compose-staging.yml --url http://rancher.getrelax.io --access-key $RANCHER_ACCESS_KEY --secret-key $RANCHER_SECRET_KEY -p relax up -d --confirm-upgrade --pull --force-upgrade;\n    fi\n"
        },
        {
          "name": "Dockerfile",
          "type": "blob",
          "size": 0.2509765625,
          "content": "FROM node:6-wheezy\nMAINTAINER José Magalhães <magalhas@gmail.com>\n\nENV relax_db__uri=\"mongodb://mongo/relax\"\nEXPOSE 8080\n\nWORKDIR /app\n\n# Copy source\nADD . ./\n\n# Expose media folder\nVOLUME /app/public/media\n\n# Build\nRUN yarn && yarn build\n\nCMD yarn start\n"
        },
        {
          "name": "LICENSE",
          "type": "blob",
          "size": 34.3232421875,
          "content": "                    GNU GENERAL PUBLIC LICENSE\n                       Version 3, 29 June 2007\n\n Copyright (C) 2007 Free Software Foundation, Inc. <http://fsf.org/>\n Everyone is permitted to copy and distribute verbatim copies\n of this license document, but changing it is not allowed.\n\n                            Preamble\n\n  The GNU General Public License is a free, copyleft license for\nsoftware and other kinds of works.\n\n  The licenses for most software and other practical works are designed\nto take away your freedom to share and change the works.  By contrast,\nthe GNU General Public License is intended to guarantee your freedom to\nshare and change all versions of a program--to make sure it remains free\nsoftware for all its users.  We, the Free Software Foundation, use the\nGNU General Public License for most of our software; it applies also to\nany other work released this way by its authors.  You can apply it to\nyour programs, too.\n\n  When we speak of free software, we are referring to freedom, not\nprice.  Our General Public Licenses are designed to make sure that you\nhave the freedom to distribute copies of free software (and charge for\nthem if you wish), that you receive source code or can get it if you\nwant it, that you can change the software or use pieces of it in new\nfree programs, and that you know you can do these things.\n\n  To protect your rights, we need to prevent others from denying you\nthese rights or asking you to surrender the rights.  Therefore, you have\ncertain responsibilities if you distribute copies of the software, or if\nyou modify it: responsibilities to respect the freedom of others.\n\n  For example, if you distribute copies of such a program, whether\ngratis or for a fee, you must pass on to the recipients the same\nfreedoms that you received.  You must make sure that they, too, receive\nor can get the source code.  And you must show them these terms so they\nknow their rights.\n\n  Developers that use the GNU GPL protect your rights with two steps:\n(1) assert copyright on the software, and (2) offer you this License\ngiving you legal permission to copy, distribute and/or modify it.\n\n  For the developers' and authors' protection, the GPL clearly explains\nthat there is no warranty for this free software.  For both users' and\nauthors' sake, the GPL requires that modified versions be marked as\nchanged, so that their problems will not be attributed erroneously to\nauthors of previous versions.\n\n  Some devices are designed to deny users access to install or run\nmodified versions of the software inside them, although the manufacturer\ncan do so.  This is fundamentally incompatible with the aim of\nprotecting users' freedom to change the software.  The systematic\npattern of such abuse occurs in the area of products for individuals to\nuse, which is precisely where it is most unacceptable.  Therefore, we\nhave designed this version of the GPL to prohibit the practice for those\nproducts.  If such problems arise substantially in other domains, we\nstand ready to extend this provision to those domains in future versions\nof the GPL, as needed to protect the freedom of users.\n\n  Finally, every program is threatened constantly by software patents.\nStates should not allow patents to restrict development and use of\nsoftware on general-purpose computers, but in those that do, we wish to\navoid the special danger that patents applied to a free program could\nmake it effectively proprietary.  To prevent this, the GPL assures that\npatents cannot be used to render the program non-free.\n\n  The precise terms and conditions for copying, distribution and\nmodification follow.\n\n                       TERMS AND CONDITIONS\n\n  0. Definitions.\n\n  \"This License\" refers to version 3 of the GNU General Public License.\n\n  \"Copyright\" also means copyright-like laws that apply to other kinds of\nworks, such as semiconductor masks.\n\n  \"The Program\" refers to any copyrightable work licensed under this\nLicense.  Each licensee is addressed as \"you\".  \"Licensees\" and\n\"recipients\" may be individuals or organizations.\n\n  To \"modify\" a work means to copy from or adapt all or part of the work\nin a fashion requiring copyright permission, other than the making of an\nexact copy.  The resulting work is called a \"modified version\" of the\nearlier work or a work \"based on\" the earlier work.\n\n  A \"covered work\" means either the unmodified Program or a work based\non the Program.\n\n  To \"propagate\" a work means to do anything with it that, without\npermission, would make you directly or secondarily liable for\ninfringement under applicable copyright law, except executing it on a\ncomputer or modifying a private copy.  Propagation includes copying,\ndistribution (with or without modification), making available to the\npublic, and in some countries other activities as well.\n\n  To \"convey\" a work means any kind of propagation that enables other\nparties to make or receive copies.  Mere interaction with a user through\na computer network, with no transfer of a copy, is not conveying.\n\n  An interactive user interface displays \"Appropriate Legal Notices\"\nto the extent that it includes a convenient and prominently visible\nfeature that (1) displays an appropriate copyright notice, and (2)\ntells the user that there is no warranty for the work (except to the\nextent that warranties are provided), that licensees may convey the\nwork under this License, and how to view a copy of this License.  If\nthe interface presents a list of user commands or options, such as a\nmenu, a prominent item in the list meets this criterion.\n\n  1. Source Code.\n\n  The \"source code\" for a work means the preferred form of the work\nfor making modifications to it.  \"Object code\" means any non-source\nform of a work.\n\n  A \"Standard Interface\" means an interface that either is an official\nstandard defined by a recognized standards body, or, in the case of\ninterfaces specified for a particular programming language, one that\nis widely used among developers working in that language.\n\n  The \"System Libraries\" of an executable work include anything, other\nthan the work as a whole, that (a) is included in the normal form of\npackaging a Major Component, but which is not part of that Major\nComponent, and (b) serves only to enable use of the work with that\nMajor Component, or to implement a Standard Interface for which an\nimplementation is available to the public in source code form.  A\n\"Major Component\", in this context, means a major essential component\n(kernel, window system, and so on) of the specific operating system\n(if any) on which the executable work runs, or a compiler used to\nproduce the work, or an object code interpreter used to run it.\n\n  The \"Corresponding Source\" for a work in object code form means all\nthe source code needed to generate, install, and (for an executable\nwork) run the object code and to modify the work, including scripts to\ncontrol those activities.  However, it does not include the work's\nSystem Libraries, or general-purpose tools or generally available free\nprograms which are used unmodified in performing those activities but\nwhich are not part of the work.  For example, Corresponding Source\nincludes interface definition files associated with source files for\nthe work, and the source code for shared libraries and dynamically\nlinked subprograms that the work is specifically designed to require,\nsuch as by intimate data communication or control flow between those\nsubprograms and other parts of the work.\n\n  The Corresponding Source need not include anything that users\ncan regenerate automatically from other parts of the Corresponding\nSource.\n\n  The Corresponding Source for a work in source code form is that\nsame work.\n\n  2. Basic Permissions.\n\n  All rights granted under this License are granted for the term of\ncopyright on the Program, and are irrevocable provided the stated\nconditions are met.  This License explicitly affirms your unlimited\npermission to run the unmodified Program.  The output from running a\ncovered work is covered by this License only if the output, given its\ncontent, constitutes a covered work.  This License acknowledges your\nrights of fair use or other equivalent, as provided by copyright law.\n\n  You may make, run and propagate covered works that you do not\nconvey, without conditions so long as your license otherwise remains\nin force.  You may convey covered works to others for the sole purpose\nof having them make modifications exclusively for you, or provide you\nwith facilities for running those works, provided that you comply with\nthe terms of this License in conveying all material for which you do\nnot control copyright.  Those thus making or running the covered works\nfor you must do so exclusively on your behalf, under your direction\nand control, on terms that prohibit them from making any copies of\nyour copyrighted material outside their relationship with you.\n\n  Conveying under any other circumstances is permitted solely under\nthe conditions stated below.  Sublicensing is not allowed; section 10\nmakes it unnecessary.\n\n  3. Protecting Users' Legal Rights From Anti-Circumvention Law.\n\n  No covered work shall be deemed part of an effective technological\nmeasure under any applicable law fulfilling obligations under article\n11 of the WIPO copyright treaty adopted on 20 December 1996, or\nsimilar laws prohibiting or restricting circumvention of such\nmeasures.\n\n  When you convey a covered work, you waive any legal power to forbid\ncircumvention of technological measures to the extent such circumvention\nis effected by exercising rights under this License with respect to\nthe covered work, and you disclaim any intention to limit operation or\nmodification of the work as a means of enforcing, against the work's\nusers, your or third parties' legal rights to forbid circumvention of\ntechnological measures.\n\n  4. Conveying Verbatim Copies.\n\n  You may convey verbatim copies of the Program's source code as you\nreceive it, in any medium, provided that you conspicuously and\nappropriately publish on each copy an appropriate copyright notice;\nkeep intact all notices stating that this License and any\nnon-permissive terms added in accord with section 7 apply to the code;\nkeep intact all notices of the absence of any warranty; and give all\nrecipients a copy of this License along with the Program.\n\n  You may charge any price or no price for each copy that you convey,\nand you may offer support or warranty protection for a fee.\n\n  5. Conveying Modified Source Versions.\n\n  You may convey a work based on the Program, or the modifications to\nproduce it from the Program, in the form of source code under the\nterms of section 4, provided that you also meet all of these conditions:\n\n    a) The work must carry prominent notices stating that you modified\n    it, and giving a relevant date.\n\n    b) The work must carry prominent notices stating that it is\n    released under this License and any conditions added under section\n    7.  This requirement modifies the requirement in section 4 to\n    \"keep intact all notices\".\n\n    c) You must license the entire work, as a whole, under this\n    License to anyone who comes into possession of a copy.  This\n    License will therefore apply, along with any applicable section 7\n    additional terms, to the whole of the work, and all its parts,\n    regardless of how they are packaged.  This License gives no\n    permission to license the work in any other way, but it does not\n    invalidate such permission if you have separately received it.\n\n    d) If the work has interactive user interfaces, each must display\n    Appropriate Legal Notices; however, if the Program has interactive\n    interfaces that do not display Appropriate Legal Notices, your\n    work need not make them do so.\n\n  A compilation of a covered work with other separate and independent\nworks, which are not by their nature extensions of the covered work,\nand which are not combined with it such as to form a larger program,\nin or on a volume of a storage or distribution medium, is called an\n\"aggregate\" if the compilation and its resulting copyright are not\nused to limit the access or legal rights of the compilation's users\nbeyond what the individual works permit.  Inclusion of a covered work\nin an aggregate does not cause this License to apply to the other\nparts of the aggregate.\n\n  6. Conveying Non-Source Forms.\n\n  You may convey a covered work in object code form under the terms\nof sections 4 and 5, provided that you also convey the\nmachine-readable Corresponding Source under the terms of this License,\nin one of these ways:\n\n    a) Convey the object code in, or embodied in, a physical product\n    (including a physical distribution medium), accompanied by the\n    Corresponding Source fixed on a durable physical medium\n    customarily used for software interchange.\n\n    b) Convey the object code in, or embodied in, a physical product\n    (including a physical distribution medium), accompanied by a\n    written offer, valid for at least three years and valid for as\n    long as you offer spare parts or customer support for that product\n    model, to give anyone who possesses the object code either (1) a\n    copy of the Corresponding Source for all the software in the\n    product that is covered by this License, on a durable physical\n    medium customarily used for software interchange, for a price no\n    more than your reasonable cost of physically performing this\n    conveying of source, or (2) access to copy the\n    Corresponding Source from a network server at no charge.\n\n    c) Convey individual copies of the object code with a copy of the\n    written offer to provide the Corresponding Source.  This\n    alternative is allowed only occasionally and noncommercially, and\n    only if you received the object code with such an offer, in accord\n    with subsection 6b.\n\n    d) Convey the object code by offering access from a designated\n    place (gratis or for a charge), and offer equivalent access to the\n    Corresponding Source in the same way through the same place at no\n    further charge.  You need not require recipients to copy the\n    Corresponding Source along with the object code.  If the place to\n    copy the object code is a network server, the Corresponding Source\n    may be on a different server (operated by you or a third party)\n    that supports equivalent copying facilities, provided you maintain\n    clear directions next to the object code saying where to find the\n    Corresponding Source.  Regardless of what server hosts the\n    Corresponding Source, you remain obligated to ensure that it is\n    available for as long as needed to satisfy these requirements.\n\n    e) Convey the object code using peer-to-peer transmission, provided\n    you inform other peers where the object code and Corresponding\n    Source of the work are being offered to the general public at no\n    charge under subsection 6d.\n\n  A separable portion of the object code, whose source code is excluded\nfrom the Corresponding Source as a System Library, need not be\nincluded in conveying the object code work.\n\n  A \"User Product\" is either (1) a \"consumer product\", which means any\ntangible personal property which is normally used for personal, family,\nor household purposes, or (2) anything designed or sold for incorporation\ninto a dwelling.  In determining whether a product is a consumer product,\ndoubtful cases shall be resolved in favor of coverage.  For a particular\nproduct received by a particular user, \"normally used\" refers to a\ntypical or common use of that class of product, regardless of the status\nof the particular user or of the way in which the particular user\nactually uses, or expects or is expected to use, the product.  A product\nis a consumer product regardless of whether the product has substantial\ncommercial, industrial or non-consumer uses, unless such uses represent\nthe only significant mode of use of the product.\n\n  \"Installation Information\" for a User Product means any methods,\nprocedures, authorization keys, or other information required to install\nand execute modified versions of a covered work in that User Product from\na modified version of its Corresponding Source.  The information must\nsuffice to ensure that the continued functioning of the modified object\ncode is in no case prevented or interfered with solely because\nmodification has been made.\n\n  If you convey an object code work under this section in, or with, or\nspecifically for use in, a User Product, and the conveying occurs as\npart of a transaction in which the right of possession and use of the\nUser Product is transferred to the recipient in perpetuity or for a\nfixed term (regardless of how the transaction is characterized), the\nCorresponding Source conveyed under this section must be accompanied\nby the Installation Information.  But this requirement does not apply\nif neither you nor any third party retains the ability to install\nmodified object code on the User Product (for example, the work has\nbeen installed in ROM).\n\n  The requirement to provide Installation Information does not include a\nrequirement to continue to provide support service, warranty, or updates\nfor a work that has been modified or installed by the recipient, or for\nthe User Product in which it has been modified or installed.  Access to a\nnetwork may be denied when the modification itself materially and\nadversely affects the operation of the network or violates the rules and\nprotocols for communication across the network.\n\n  Corresponding Source conveyed, and Installation Information provided,\nin accord with this section must be in a format that is publicly\ndocumented (and with an implementation available to the public in\nsource code form), and must require no special password or key for\nunpacking, reading or copying.\n\n  7. Additional Terms.\n\n  \"Additional permissions\" are terms that supplement the terms of this\nLicense by making exceptions from one or more of its conditions.\nAdditional permissions that are applicable to the entire Program shall\nbe treated as though they were included in this License, to the extent\nthat they are valid under applicable law.  If additional permissions\napply only to part of the Program, that part may be used separately\nunder those permissions, but the entire Program remains governed by\nthis License without regard to the additional permissions.\n\n  When you convey a copy of a covered work, you may at your option\nremove any additional permissions from that copy, or from any part of\nit.  (Additional permissions may be written to require their own\nremoval in certain cases when you modify the work.)  You may place\nadditional permissions on material, added by you to a covered work,\nfor which you have or can give appropriate copyright permission.\n\n  Notwithstanding any other provision of this License, for material you\nadd to a covered work, you may (if authorized by the copyright holders of\nthat material) supplement the terms of this License with terms:\n\n    a) Disclaiming warranty or limiting liability differently from the\n    terms of sections 15 and 16 of this License; or\n\n    b) Requiring preservation of specified reasonable legal notices or\n    author attributions in that material or in the Appropriate Legal\n    Notices displayed by works containing it; or\n\n    c) Prohibiting misrepresentation of the origin of that material, or\n    requiring that modified versions of such material be marked in\n    reasonable ways as different from the original version; or\n\n    d) Limiting the use for publicity purposes of names of licensors or\n    authors of the material; or\n\n    e) Declining to grant rights under trademark law for use of some\n    trade names, trademarks, or service marks; or\n\n    f) Requiring indemnification of licensors and authors of that\n    material by anyone who conveys the material (or modified versions of\n    it) with contractual assumptions of liability to the recipient, for\n    any liability that these contractual assumptions directly impose on\n    those licensors and authors.\n\n  All other non-permissive additional terms are considered \"further\nrestrictions\" within the meaning of section 10.  If the Program as you\nreceived it, or any part of it, contains a notice stating that it is\ngoverned by this License along with a term that is a further\nrestriction, you may remove that term.  If a license document contains\na further restriction but permits relicensing or conveying under this\nLicense, you may add to a covered work material governed by the terms\nof that license document, provided that the further restriction does\nnot survive such relicensing or conveying.\n\n  If you add terms to a covered work in accord with this section, you\nmust place, in the relevant source files, a statement of the\nadditional terms that apply to those files, or a notice indicating\nwhere to find the applicable terms.\n\n  Additional terms, permissive or non-permissive, may be stated in the\nform of a separately written license, or stated as exceptions;\nthe above requirements apply either way.\n\n  8. Termination.\n\n  You may not propagate or modify a covered work except as expressly\nprovided under this License.  Any attempt otherwise to propagate or\nmodify it is void, and will automatically terminate your rights under\nthis License (including any patent licenses granted under the third\nparagraph of section 11).\n\n  However, if you cease all violation of this License, then your\nlicense from a particular copyright holder is reinstated (a)\nprovisionally, unless and until the copyright holder explicitly and\nfinally terminates your license, and (b) permanently, if the copyright\nholder fails to notify you of the violation by some reasonable means\nprior to 60 days after the cessation.\n\n  Moreover, your license from a particular copyright holder is\nreinstated permanently if the copyright holder notifies you of the\nviolation by some reasonable means, this is the first time you have\nreceived notice of violation of this License (for any work) from that\ncopyright holder, and you cure the violation prior to 30 days after\nyour receipt of the notice.\n\n  Termination of your rights under this section does not terminate the\nlicenses of parties who have received copies or rights from you under\nthis License.  If your rights have been terminated and not permanently\nreinstated, you do not qualify to receive new licenses for the same\nmaterial under section 10.\n\n  9. Acceptance Not Required for Having Copies.\n\n  You are not required to accept this License in order to receive or\nrun a copy of the Program.  Ancillary propagation of a covered work\noccurring solely as a consequence of using peer-to-peer transmission\nto receive a copy likewise does not require acceptance.  However,\nnothing other than this License grants you permission to propagate or\nmodify any covered work.  These actions infringe copyright if you do\nnot accept this License.  Therefore, by modifying or propagating a\ncovered work, you indicate your acceptance of this License to do so.\n\n  10. Automatic Licensing of Downstream Recipients.\n\n  Each time you convey a covered work, the recipient automatically\nreceives a license from the original licensors, to run, modify and\npropagate that work, subject to this License.  You are not responsible\nfor enforcing compliance by third parties with this License.\n\n  An \"entity transaction\" is a transaction transferring control of an\norganization, or substantially all assets of one, or subdividing an\norganization, or merging organizations.  If propagation of a covered\nwork results from an entity transaction, each party to that\ntransaction who receives a copy of the work also receives whatever\nlicenses to the work the party's predecessor in interest had or could\ngive under the previous paragraph, plus a right to possession of the\nCorresponding Source of the work from the predecessor in interest, if\nthe predecessor has it or can get it with reasonable efforts.\n\n  You may not impose any further restrictions on the exercise of the\nrights granted or affirmed under this License.  For example, you may\nnot impose a license fee, royalty, or other charge for exercise of\nrights granted under this License, and you may not initiate litigation\n(including a cross-claim or counterclaim in a lawsuit) alleging that\nany patent claim is infringed by making, using, selling, offering for\nsale, or importing the Program or any portion of it.\n\n  11. Patents.\n\n  A \"contributor\" is a copyright holder who authorizes use under this\nLicense of the Program or a work on which the Program is based.  The\nwork thus licensed is called the contributor's \"contributor version\".\n\n  A contributor's \"essential patent claims\" are all patent claims\nowned or controlled by the contributor, whether already acquired or\nhereafter acquired, that would be infringed by some manner, permitted\nby this License, of making, using, or selling its contributor version,\nbut do not include claims that would be infringed only as a\nconsequence of further modification of the contributor version.  For\npurposes of this definition, \"control\" includes the right to grant\npatent sublicenses in a manner consistent with the requirements of\nthis License.\n\n  Each contributor grants you a non-exclusive, worldwide, royalty-free\npatent license under the contributor's essential patent claims, to\nmake, use, sell, offer for sale, import and otherwise run, modify and\npropagate the contents of its contributor version.\n\n  In the following three paragraphs, a \"patent license\" is any express\nagreement or commitment, however denominated, not to enforce a patent\n(such as an express permission to practice a patent or covenant not to\nsue for patent infringement).  To \"grant\" such a patent license to a\nparty means to make such an agreement or commitment not to enforce a\npatent against the party.\n\n  If you convey a covered work, knowingly relying on a patent license,\nand the Corresponding Source of the work is not available for anyone\nto copy, free of charge and under the terms of this License, through a\npublicly available network server or other readily accessible means,\nthen you must either (1) cause the Corresponding Source to be so\navailable, or (2) arrange to deprive yourself of the benefit of the\npatent license for this particular work, or (3) arrange, in a manner\nconsistent with the requirements of this License, to extend the patent\nlicense to downstream recipients.  \"Knowingly relying\" means you have\nactual knowledge that, but for the patent license, your conveying the\ncovered work in a country, or your recipient's use of the covered work\nin a country, would infringe one or more identifiable patents in that\ncountry that you have reason to believe are valid.\n\n  If, pursuant to or in connection with a single transaction or\narrangement, you convey, or propagate by procuring conveyance of, a\ncovered work, and grant a patent license to some of the parties\nreceiving the covered work authorizing them to use, propagate, modify\nor convey a specific copy of the covered work, then the patent license\nyou grant is automatically extended to all recipients of the covered\nwork and works based on it.\n\n  A patent license is \"discriminatory\" if it does not include within\nthe scope of its coverage, prohibits the exercise of, or is\nconditioned on the non-exercise of one or more of the rights that are\nspecifically granted under this License.  You may not convey a covered\nwork if you are a party to an arrangement with a third party that is\nin the business of distributing software, under which you make payment\nto the third party based on the extent of your activity of conveying\nthe work, and under which the third party grants, to any of the\nparties who would receive the covered work from you, a discriminatory\npatent license (a) in connection with copies of the covered work\nconveyed by you (or copies made from those copies), or (b) primarily\nfor and in connection with specific products or compilations that\ncontain the covered work, unless you entered into that arrangement,\nor that patent license was granted, prior to 28 March 2007.\n\n  Nothing in this License shall be construed as excluding or limiting\nany implied license or other defenses to infringement that may\notherwise be available to you under applicable patent law.\n\n  12. No Surrender of Others' Freedom.\n\n  If conditions are imposed on you (whether by court order, agreement or\notherwise) that contradict the conditions of this License, they do not\nexcuse you from the conditions of this License.  If you cannot convey a\ncovered work so as to satisfy simultaneously your obligations under this\nLicense and any other pertinent obligations, then as a consequence you may\nnot convey it at all.  For example, if you agree to terms that obligate you\nto collect a royalty for further conveying from those to whom you convey\nthe Program, the only way you could satisfy both those terms and this\nLicense would be to refrain entirely from conveying the Program.\n\n  13. Use with the GNU Affero General Public License.\n\n  Notwithstanding any other provision of this License, you have\npermission to link or combine any covered work with a work licensed\nunder version 3 of the GNU Affero General Public License into a single\ncombined work, and to convey the resulting work.  The terms of this\nLicense will continue to apply to the part which is the covered work,\nbut the special requirements of the GNU Affero General Public License,\nsection 13, concerning interaction through a network will apply to the\ncombination as such.\n\n  14. Revised Versions of this License.\n\n  The Free Software Foundation may publish revised and/or new versions of\nthe GNU General Public License from time to time.  Such new versions will\nbe similar in spirit to the present version, but may differ in detail to\naddress new problems or concerns.\n\n  Each version is given a distinguishing version number.  If the\nProgram specifies that a certain numbered version of the GNU General\nPublic License \"or any later version\" applies to it, you have the\noption of following the terms and conditions either of that numbered\nversion or of any later version published by the Free Software\nFoundation.  If the Program does not specify a version number of the\nGNU General Public License, you may choose any version ever published\nby the Free Software Foundation.\n\n  If the Program specifies that a proxy can decide which future\nversions of the GNU General Public License can be used, that proxy's\npublic statement of acceptance of a version permanently authorizes you\nto choose that version for the Program.\n\n  Later license versions may give you additional or different\npermissions.  However, no additional obligations are imposed on any\nauthor or copyright holder as a result of your choosing to follow a\nlater version.\n\n  15. Disclaimer of Warranty.\n\n  THERE IS NO WARRANTY FOR THE PROGRAM, TO THE EXTENT PERMITTED BY\nAPPLICABLE LAW.  EXCEPT WHEN OTHERWISE STATED IN WRITING THE COPYRIGHT\nHOLDERS AND/OR OTHER PARTIES PROVIDE THE PROGRAM \"AS IS\" WITHOUT WARRANTY\nOF ANY KIND, EITHER EXPRESSED OR IMPLIED, INCLUDING, BUT NOT LIMITED TO,\nTHE IMPLIED WARRANTIES OF MERCHANTABILITY AND FITNESS FOR A PARTICULAR\nPURPOSE.  THE ENTIRE RISK AS TO THE QUALITY AND PERFORMANCE OF THE PROGRAM\nIS WITH YOU.  SHOULD THE PROGRAM PROVE DEFECTIVE, YOU ASSUME THE COST OF\nALL NECESSARY SERVICING, REPAIR OR CORRECTION.\n\n  16. Limitation of Liability.\n\n  IN NO EVENT UNLESS REQUIRED BY APPLICABLE LAW OR AGREED TO IN WRITING\nWILL ANY COPYRIGHT HOLDER, OR ANY OTHER PARTY WHO MODIFIES AND/OR CONVEYS\nTHE PROGRAM AS PERMITTED ABOVE, BE LIABLE TO YOU FOR DAMAGES, INCLUDING ANY\nGENERAL, SPECIAL, INCIDENTAL OR CONSEQUENTIAL DAMAGES ARISING OUT OF THE\nUSE OR INABILITY TO USE THE PROGRAM (INCLUDING BUT NOT LIMITED TO LOSS OF\nDATA OR DATA BEING RENDERED INACCURATE OR LOSSES SUSTAINED BY YOU OR THIRD\nPARTIES OR A FAILURE OF THE PROGRAM TO OPERATE WITH ANY OTHER PROGRAMS),\nEVEN IF SUCH HOLDER OR OTHER PARTY HAS BEEN ADVISED OF THE POSSIBILITY OF\nSUCH DAMAGES.\n\n  17. Interpretation of Sections 15 and 16.\n\n  If the disclaimer of warranty and limitation of liability provided\nabove cannot be given local legal effect according to their terms,\nreviewing courts shall apply local law that most closely approximates\nan absolute waiver of all civil liability in connection with the\nProgram, unless a warranty or assumption of liability accompanies a\ncopy of the Program in return for a fee.\n\n                     END OF TERMS AND CONDITIONS\n\n            How to Apply These Terms to Your New Programs\n\n  If you develop a new program, and you want it to be of the greatest\npossible use to the public, the best way to achieve this is to make it\nfree software which everyone can redistribute and change under these terms.\n\n  To do so, attach the following notices to the program.  It is safest\nto attach them to the start of each source file to most effectively\nstate the exclusion of warranty; and each file should have at least\nthe \"copyright\" line and a pointer to where the full notice is found.\n\n    <one line to give the program's name and a brief idea of what it does.>\n    Copyright (C) <year>  <name of author>\n\n    This program is free software: you can redistribute it and/or modify\n    it under the terms of the GNU General Public License as published by\n    the Free Software Foundation, either version 3 of the License, or\n    (at your option) any later version.\n\n    This program is distributed in the hope that it will be useful,\n    but WITHOUT ANY WARRANTY; without even the implied warranty of\n    MERCHANTABILITY or FITNESS FOR A PARTICULAR PURPOSE.  See the\n    GNU General Public License for more details.\n\n    You should have received a copy of the GNU General Public License\n    along with this program.  If not, see <http://www.gnu.org/licenses/>.\n\nAlso add information on how to contact you by electronic and paper mail.\n\n  If the program does terminal interaction, make it output a short\nnotice like this when it starts in an interactive mode:\n\n    <program>  Copyright (C) <year>  <name of author>\n    This program comes with ABSOLUTELY NO WARRANTY; for details type `show w'.\n    This is free software, and you are welcome to redistribute it\n    under certain conditions; type `show c' for details.\n\nThe hypothetical commands `show w' and `show c' should show the appropriate\nparts of the General Public License.  Of course, your program's commands\nmight be different; for a GUI interface, you would use an \"about box\".\n\n  You should also get your employer (if you work as a programmer) or school,\nif any, to sign a \"copyright disclaimer\" for the program, if necessary.\nFor more information on this, and how to apply and follow the GNU GPL, see\n<http://www.gnu.org/licenses/>.\n\n  The GNU General Public License does not permit incorporating your program\ninto proprietary programs.  If your program is a subroutine library, you\nmay consider it more useful to permit linking proprietary applications with\nthe library.  If this is what you want to do, use the GNU Lesser General\nPublic License instead of this License.  But first, please read\n<http://www.gnu.org/philosophy/why-not-lgpl.html>.\n"
        },
        {
          "name": "README.md",
          "type": "blob",
          "size": 3.5888671875,
          "content": "**IMPORTANT NOTE:** This project is no longer maintained or active. In the meantime we've started a simillar but different project that we felt was lacking and should exist, a professional tool for web developers and designers, a Unity for the web. After more than 4 years in the making we've now launched on [ProductHunt](https://www.producthunt.com/posts/clutch-3). Clutch is a low code tool that streamlines a professional team workflow and allows them to move together and faster. Go check it out and join us in our [community slack](https://join.slack.com/t/clutch-community/shared_invite/zt-s33mb7is-sC_8Ruk31n~bO~_PCTPa7Q), eager to hear everyone's feedback and thoughts. The tool is free to use!\n\n\nWhat is Relax\n-------\n\nRelax is a powerful new generation CMS on top of\n[React](https://facebook.github.io/react/) and [Node.js](https://nodejs.org/en/)\nwhich aims for a better way of building websites.\n\nIt features a live page builder based on components and a smart and easy way of\nbinding dynamic data to them.\n\nOur goal with Relax is to update the world with a new standard, having as the basic premise that anyone should be able to create a website without having to code.\n\nWe're currently working on releasing the beta version which should come up in December. If you want to collaborate in the meantime or just say anything join us at [Relax Slack](http://slack-relax.herokuapp.com/).\n\nRelax isn't yet ready for production, stay tuned for releases, beta version will come soon. You can see what we're working on [here](https://github.com/relax/relax/projects/1) and what's missing in the [beta milestone](https://github.com/relax/relax/milestone/1).\n\nInstallation\n-------\n\n### Dependencies\n\nRelax uses [sharp](https://github.com/lovell/sharp) to resize images.\nIf you're using OS X and have libvips installed globally, e.g. via brew,\nit may cause problems with sharp's compilation. You may need to uninstall\nvia `brew remove libvips`. See https://github.com/lovell/sharp/issues/602\nfor more information.\n\nYou'll also need [`yarn`](https://yarnpkg.com) and [MongoDB](https://www.mongodb.org/).\n\n### How to Relax\n\nSince we are yet to tag our first release, git clone this repository and run the following commands:\n\n```bash\nyarn\nyarn build\nyarn start\n```\n\nBy default the application runs at port `8080`. Go ahead and visit\n`http://localhost:8080/admin/init`, here you can setup the first user and you're ready to relax.\n\n\n### Configuration\n\nTo configure the application you can use a `.relaxrc` file. You can place it\nnext to the application, on any parent folder, in your `HOME` folder, etc.\n\nYou can find a sample with the default values [here](.relaxrc.sample).\n\n\nContributing\n-------\n\n### Build and start\n\n#### Development\n\nWhile in development it's convenient to keep your application running while\nwatching for changes, for that you can run `yarn dev`.\n\nThe application will automatically restart when needed and keep your bundles\nup to date.\n\n#### Production\n\nTo build your assets ready to go for production run `yarn build` and `yarn start` to start the application.\n\n##### With Docker\n\nTo use our latest docker image you just have to have MongoDB running on a\ndifferent container and link it to Relax.\n\nTo start MongoDB in the background you can run  `docker run -d --name mongo mongo`.\nAfterwards run `docker run -p 8080:8080 --link mongo -it relax/relax` to start\nRelax on `http://localhost:8080`.\n\nFor more information about Docker please check their\n[documentation](https://docs.docker.com/).\n\nLicense\n-------\n\nRelax is [GPL-3 licensed](LICENSE).\n\n\nTroubleshooting\n---------------\n\nPlease create [an issue](https://github.com/relax/relax/issues/new).\n"
        },
        {
          "name": "ROADMAP.md",
          "type": "blob",
          "size": 2.2197265625,
          "content": "Roadmap\n=======\n\nv1.0.0-Beta (Spring 2016)\n-------------------------\n\nSince the start of the project we've been through some major refactors in\norder to achieve the desired stack and experience to finally have a first stable\nrelease.\n\nWe've changed from a RESTful API into a GraphQL API, while also changing the data\narchitecture in the front end to include Redux.\n\nOur first dashboard was also not designed at all because our focus was mainly on\nthe page builder. We're now finally tuning up the entire admin experience\nso that we can make it as relaxed as possible.\n\nBelow you can find the major things that are still in the road we're going through to\nreach the beta release, there are of course other minor issues that can be found\n[here](https://github.com/relax/relax/milestones/1.0.0-Beta).\n\n**What must be done:**\n- [ ] Dashboard (*ongoing*) (#214)\n  - [ ] Settings\n  - [ ] Pages\n  - [ ] Menus\n  - [ ] Schemas\n  - [ ] Fonts\n  - [ ] Users\n  - [ ] Media\n  - [ ] Symbols\n- [ ] Link Element\n  - [ ] Allow to navigate to another page\n  - [ ] Allow to go an absolute URL\n  - [ ] Allow anchoring (with sections)\n- [ ] Forms\n  - [ ] Compose e-mail and set where the e-mail should be sent to\n- [ ] Symbols Management\n  - [x] Manage through context menu (#208)\n  - [ ] Edit symbol content (#209)\n  - [ ] Delete symbol through context menu\n- [ ] Page Templates (#133)\n  - [ ] Save page as template\n  - [ ] Use template as a schema *single* template\n  - [ ] Use template as a starting point to a page\n- [ ] Input option types (#158)\n- [ ] Schema entry *singles* (#127)\n- [ ] Import/export database\n  - [ ] Export theme (#56)\n  - [ ] Export data\n  - [ ] Export all\n- [ ] Users\n  - [ ] Recover password\n  - [ ] Change password\n  - [ ] Edit basic info\n- [ ] Third party elements API (#55)\n- [ ] Developer API Documentation (#53)\n\n**If we have time:**\n- [ ] Link forms to schemas (#124)\n- [ ] User account activation\n- [ ] User roles management\n- [ ] Schema entry single override template (#128)\n- [ ] Docker image (#213)\n\nThere are no optional issues, we really want to have everything as polished as\npossible for the first release.\n\nFeel free to create missing issues or discuss some of the features in the issues\nsection or with us over Slack. All help and feedback is welcome.\n"
        },
        {
          "name": "__mocks__",
          "type": "tree",
          "content": null
        },
        {
          "name": "app.js",
          "type": "blob",
          "size": 0.9169921875,
          "content": "import 'babel-polyfill';\n\nimport mongoose from 'mongoose';\n\nimport app from './lib/server';\nimport config from './config';\nimport logger from './lib/server/logger';\nimport migrate from './lib/server/migrate';\nimport padStart from 'lodash/padStart';\n\nconst outline = padStart('', 20, '-');\nlogger.debug(`\\n${outline}\\nRelax Status\\n${outline}`);\n\n// Connect mongoose\nif (!config.db) {\n  throw new Error('DB: Configuration for MongoDB required');\n}\nmongoose.Promise = global.Promise; // Use native promises\nmongoose.connect(config.db.uri, config.db, (err) => {\n  if (err) {\n    logger.debug('DB: Not Connected');\n  } else {\n    logger.debug('DB: Connected');\n  }\n});\n\n// Run migrations\nmigrate()\n  .then(() => {\n    // Start server\n    const server = app.listen(config.port, () => {\n      const port = server.address().port;\n      logger.debug('URL: http://localhost:%s', port);\n      logger.debug('PORT: %s', port);\n    });\n  })\n  .done();\n"
        },
        {
          "name": "assets",
          "type": "tree",
          "content": null
        },
        {
          "name": "config.js",
          "type": "blob",
          "size": 0.4765625,
          "content": "var rc = require('rc');\n\nmodule.exports = rc('relax', {\n  port: process.env.PORT || 8080,\n  devPort: process.env.DEV_PORT || 8181,\n  db: {\n    uri: process.env.RELAX_MONGO_URI || 'mongodb://localhost/relax'\n  },\n  session: {\n    secret: process.env.RELAX_SESSION_SECRET || 'Is very secret'\n  },\n  logger: {\n    transports: {\n      Console: {\n        level: 'debug',\n        handleExceptions: true,\n        json: false,\n        colorize: true\n      }\n    },\n    exitOnError: false\n  }\n});\n"
        },
        {
          "name": "docker",
          "type": "tree",
          "content": null
        },
        {
          "name": "docs",
          "type": "tree",
          "content": null
        },
        {
          "name": "lib",
          "type": "tree",
          "content": null
        },
        {
          "name": "migrations",
          "type": "tree",
          "content": null
        },
        {
          "name": "package.json",
          "type": "blob",
          "size": 4.8896484375,
          "content": "{\n  \"name\": \"relax\",\n  \"version\": \"0.0.0\",\n  \"description\": \"New generation CMS on top of React and Node.js\",\n  \"license\": \"GPL-3.0\",\n  \"repository\": {\n    \"type\": \"git\",\n    \"url\": \"https://github.com/relax/relax.git\"\n  },\n  \"scripts\": {\n    \"build\": \"cross-env NODE_ENV=production webpack --config ./webpack/prod/webpack.config.js\",\n    \"start\": \"cross-env NODE_ENV=production node build/app\",\n    \"startDev\": \"cross-env NODE_ENV=development node build/app\",\n    \"dev\": \"concurrently \\\"yarn webpackServer\\\" \\\"yarn watchServer\\\"\",\n    \"watchServer\": \"nodemon -e js,jsx,json -w app.js -w lib -i lib/client -x \\\"webpack --config ./webpack/dev/webpack.node.config.js && yarn startDev\\\"\",\n    \"webpackServer\": \"webpack-dev-server --config ./webpack/dev/webpack.browser.config.js --inline --hot --quiet --display-error-details\",\n    \"eslint\": \"eslint ./lib --ext .js --ext .jsx\",\n    \"test\": \"jest\"\n  },\n  \"dependencies\": {\n    \"babel-plugin-lodash\": \"^3.2.9\",\n    \"babel-polyfill\": \"^6.3.14\",\n    \"bluebird\": \"^3.4.0\",\n    \"body-parser\": \"^1.13.3\",\n    \"boolean\": \"^0.1.1\",\n    \"classnames\": \"^2.1.3\",\n    \"color-thief\": \"git+https://github.com/relax/color-thief.git\",\n    \"colr\": \"^1.2.2\",\n    \"connect-mongo\": \"^0.8.2\",\n    \"del\": \"^2.2.0\",\n    \"ease-component\": \"^1.0.0\",\n    \"express\": \"^4.13.3\",\n    \"express-graphql\": \"^0.4.0\",\n    \"express-session\": \"^1.11.3\",\n    \"file-size\": \"^1.0.0\",\n    \"graphql\": \"^0.4.7\",\n    \"graphql-type-json\": \"^0.1.2\",\n    \"history\": \"1.17.0\",\n    \"hoist-non-react-statics\": \"^1.2.0\",\n    \"invariant\": \"^2.2.0\",\n    \"js-md5\": \"^0.3.0\",\n    \"kerberos\": \"^0.0.21\",\n    \"keymaster\": \"git+https://github.com/relax/keymaster.git\",\n    \"lodash\": \"^4.16.6\",\n    \"medium-editor\": \"git+https://github.com/relax/medium-editor.git\",\n    \"mkdirp\": \"^0.5.1\",\n    \"moment\": \"^2.10.6\",\n    \"mongoose\": \"^4.1.12\",\n    \"morgan\": \"^1.6.1\",\n    \"multer\": \"^1.0.6\",\n    \"nodemailer\": \"^1.5.0\",\n    \"passport\": \"^0.3.0\",\n    \"passport-local\": \"^1.0.0\",\n    \"passport-local-mongoose\": \"^3.1.0\",\n    \"prop-types\": \"^15.5.10\",\n    \"query-string\": \"^3.0.0\",\n    \"raf\": \"^3.3.0\",\n    \"rc\": \"^1.1.1\",\n    \"react\": \"^15.4.1\",\n    \"react-dom\": \"^15.4.1\",\n    \"react-dropzone\": \"^3.2.2\",\n    \"react-gemini-scrollbar\": \"^2.0.1\",\n    \"react-google-maps\": \"^4.6.0\",\n    \"react-redux\": \"^5.0.1\",\n    \"react-router\": \"2.8.1\",\n    \"redux\": \"^3.6.0\",\n    \"redux-combine-actions\": \"^0.1.2\",\n    \"redux-logger\": \"^2.0.4\",\n    \"redux-router\": \"^2.1.2\",\n    \"redux-thunk\": \"^1.0.0\",\n    \"relate-js\": \"0.7.6\",\n    \"relax-fragments\": \"0.1.1\",\n    \"relax-jss\": \"0.2.1\",\n    \"relax-velocity-animate\": \"1.0.0\",\n    \"semver\": \"^5.0.3\",\n    \"serialize-javascript\": \"^1.1.2\",\n    \"shallowequal\": \"^0.2.2\",\n    \"sharp\": \"^0.16.1\",\n    \"slug\": \"^0.9.1\",\n    \"superagent\": \"^1.6.1\",\n    \"warning\": \"^2.1.0\",\n    \"winston\": \"^2.1.0\"\n  },\n  \"devDependencies\": {\n    \"autoprefixer\": \"^6.3.6\",\n    \"babel-core\": \"6.4.5\",\n    \"babel-eslint\": \"6.0.2\",\n    \"babel-loader\": \"6.2.2\",\n    \"babel-plugin-react-transform\": \"2.0.0\",\n    \"babel-plugin-transform-decorators-legacy\": \"1.3.4\",\n    \"babel-plugin-transform-react-constant-elements\": \"6.9.1\",\n    \"babel-plugin-transform-react-inline-elements\": \"6.8.0\",\n    \"babel-preset-es2015\": \"6.3.13\",\n    \"babel-preset-react\": \"6.3.13\",\n    \"babel-preset-stage-0\": \"6.3.13\",\n    \"concurrently\": \"^3.1.0\",\n    \"copy-webpack-plugin\": \"^2.1.3\",\n    \"cross-env\": \"^1.0.7\",\n    \"css-loader\": \"^0.23.1\",\n    \"eslint\": \"^2.8.0\",\n    \"eslint-config-airbnb\": \"^7.0.0\",\n    \"eslint-plugin-jsx-a11y\": \"^0.6.2\",\n    \"eslint-plugin-react\": \"^4.2.2\",\n    \"extract-text-webpack-plugin\": \"^1.0.1\",\n    \"file-loader\": \"^0.8.4\",\n    \"import-sort-style-renke\": \"^2.4.0\",\n    \"jest\": \"^18.0.0\",\n    \"json-loader\": \"^0.5.3\",\n    \"less\": \"^2.6.0\",\n    \"less-loader\": \"^2.2.2\",\n    \"nodemon\": \"^1.8.1\",\n    \"null-loader\": \"^0.1.1\",\n    \"postcss-loader\": \"^0.9.1\",\n    \"react-transform-catch-errors\": \"^1.0.2\",\n    \"react-transform-hmr\": \"^1.0.2\",\n    \"redbox-react\": \"^1.2.0\",\n    \"source-map-support\": \"^0.4.0\",\n    \"style-loader\": \"^0.13.0\",\n    \"unicode\": \"^0.6.1\",\n    \"url-loader\": \"^0.5.6\",\n    \"webpack\": \"^1.12.6\",\n    \"webpack-dev-server\": \"^1.12.1\",\n    \"webpack-hot-middleware\": \"^2.5.0\",\n    \"webpack-node-externals\": \"^1.2.0\"\n  },\n  \"importSort\": {\n    \".js, .jsx, .es6, .es\": {\n      \"parser\": \"babylon\",\n      \"style\": \"renke\"\n    }\n  },\n  \"jest\": {\n    \"moduleFileExtensions\": [\n      \"js\",\n      \"jsx\"\n    ],\n    \"moduleDirectories\": [\n      \"node_modules\",\n      \"bower_components\",\n      \"shared\"\n    ],\n    \"moduleNameMapper\": {\n      \"\\\\.(jpg|jpeg|png|gif|eot|otf|webp|svg|ttf|woff|woff2|mp4|webm|wav|mp3|m4a|aac|oga)$\": \"<rootDir>/__mocks__/file-mock.js\",\n      \"\\\\.(css|less)$\": \"<rootDir>/__mocks__/style-mock.js\"\n    },\n    \"testPathIgnorePatterns\": [\n      \"/node_modules/\",\n      \"/_fixtures\"\n    ],\n    \"collectCoverage\": true,\n    \"coverageReporters\": [\n      \"json\",\n      \"html\",\n      \"text-summary\"\n    ],\n    \"collectCoverageFrom\": [\n      \"lib/**/reducers/**/*.js\"\n    ]\n  }\n}\n"
        },
        {
          "name": "uploads",
          "type": "tree",
          "content": null
        },
        {
          "name": "webpack",
          "type": "tree",
          "content": null
        },
        {
          "name": "yarn.lock",
          "type": "blob",
          "size": 217.2900390625,
          "content": "# THIS IS AN AUTOGENERATED FILE. DO NOT EDIT THIS FILE DIRECTLY.\n# yarn lockfile v1\n\n\nBase64@~0.2.0:\n  version \"0.2.1\"\n  resolved \"https://registry.yarnpkg.com/Base64/-/Base64-0.2.1.tgz#ba3a4230708e186705065e66babdd4c35cf60028\"\n\nabab@^1.0.0:\n  version \"1.0.3\"\n  resolved \"https://registry.yarnpkg.com/abab/-/abab-1.0.3.tgz#b81de5f7274ec4e756d797cd834f303642724e5d\"\n\nabbrev@1:\n  version \"1.0.9\"\n  resolved \"https://registry.yarnpkg.com/abbrev/-/abbrev-1.0.9.tgz#91b4792588a7738c25f35dd6f63752a2f8776135\"\n\naccepts@~1.3.3:\n  version \"1.3.3\"\n  resolved \"https://registry.yarnpkg.com/accepts/-/accepts-1.3.3.tgz#c3ca7434938648c3e0d9c1e328dd68b622c284ca\"\n  dependencies:\n    mime-types \"~2.1.11\"\n    negotiator \"0.6.1\"\n\nacorn-globals@^1.0.4:\n  version \"1.0.9\"\n  resolved \"https://registry.yarnpkg.com/acorn-globals/-/acorn-globals-1.0.9.tgz#55bb5e98691507b74579d0513413217c380c54cf\"\n  dependencies:\n    acorn \"^2.1.0\"\n\nacorn-jsx@^3.0.0:\n  version \"3.0.1\"\n  resolved \"https://registry.yarnpkg.com/acorn-jsx/-/acorn-jsx-3.0.1.tgz#afdf9488fb1ecefc8348f6fb22f464e32a58b36b\"\n  dependencies:\n    acorn \"^3.0.4\"\n\nacorn@^2.1.0, acorn@^2.4.0:\n  version \"2.7.0\"\n  resolved \"https://registry.yarnpkg.com/acorn/-/acorn-2.7.0.tgz#ab6e7d9d886aaca8b085bc3312b79a198433f0e7\"\n\nacorn@^3.0.0, acorn@^3.0.4:\n  version \"3.3.0\"\n  resolved \"https://registry.yarnpkg.com/acorn/-/acorn-3.3.0.tgz#45e37fb39e8da3f25baee3ff5369e2bb5f22017a\"\n\nacorn@^4.0.1:\n  version \"4.0.3\"\n  resolved \"https://registry.yarnpkg.com/acorn/-/acorn-4.0.3.tgz#1a3e850b428e73ba6b09d1cc527f5aaad4d03ef1\"\n\naddressparser@^0.3.2:\n  version \"0.3.2\"\n  resolved \"https://registry.yarnpkg.com/addressparser/-/addressparser-0.3.2.tgz#59873f35e8fcf6c7361c10239261d76e15348bb2\"\n\najv-keywords@^1.0.0:\n  version \"1.1.1\"\n  resolved \"https://registry.yarnpkg.com/ajv-keywords/-/ajv-keywords-1.1.1.tgz#02550bc605a3e576041565628af972e06c549d50\"\n\najv@^4.7.0:\n  version \"4.9.0\"\n  resolved \"https://registry.yarnpkg.com/ajv/-/ajv-4.9.0.tgz#5a358085747b134eb567d6d15e015f1d7802f45c\"\n  dependencies:\n    co \"^4.6.0\"\n    json-stable-stringify \"^1.0.1\"\n\nalign-text@^0.1.1, align-text@^0.1.3:\n  version \"0.1.4\"\n  resolved \"https://registry.yarnpkg.com/align-text/-/align-text-0.1.4.tgz#0cd90a561093f35d0a99256c22b7069433fad117\"\n  dependencies:\n    kind-of \"^3.0.2\"\n    longest \"^1.0.1\"\n    repeat-string \"^1.5.2\"\n\nalphanum-sort@^1.0.1, alphanum-sort@^1.0.2:\n  version \"1.0.2\"\n  resolved \"https://registry.yarnpkg.com/alphanum-sort/-/alphanum-sort-1.0.2.tgz#97a1119649b211ad33691d9f9f486a8ec9fbe0a3\"\n\namdefine@>=0.0.4:\n  version \"1.0.1\"\n  resolved \"https://registry.yarnpkg.com/amdefine/-/amdefine-1.0.1.tgz#4a5282ac164729e93619bcfd3ad151f817ce91f5\"\n\nansi-escapes@^1.1.0, ansi-escapes@^1.4.0:\n  version \"1.4.0\"\n  resolved \"https://registry.yarnpkg.com/ansi-escapes/-/ansi-escapes-1.4.0.tgz#d3a8a83b319aa67793662b13e761c7911422306e\"\n\nansi-html@0.0.6:\n  version \"0.0.6\"\n  resolved \"https://registry.yarnpkg.com/ansi-html/-/ansi-html-0.0.6.tgz#bda8e33dd2ee1c20f54c08eb405713cbfc0ed80e\"\n\nansi-regex@^0.2.0, ansi-regex@^0.2.1:\n  version \"0.2.1\"\n  resolved \"https://registry.yarnpkg.com/ansi-regex/-/ansi-regex-0.2.1.tgz#0d8e946967a3d8143f93e24e298525fc1b2235f9\"\n\nansi-regex@^2.0.0:\n  version \"2.0.0\"\n  resolved \"https://registry.yarnpkg.com/ansi-regex/-/ansi-regex-2.0.0.tgz#c5061b6e0ef8a81775e50f5d66151bf6bf371107\"\n\nansi-styles@^1.1.0:\n  version \"1.1.0\"\n  resolved \"https://registry.yarnpkg.com/ansi-styles/-/ansi-styles-1.1.0.tgz#eaecbf66cd706882760b2f4691582b8f55d7a7de\"\n\nansi-styles@^2.2.1:\n  version \"2.2.1\"\n  resolved \"https://registry.yarnpkg.com/ansi-styles/-/ansi-styles-2.2.1.tgz#b432dd3358b634cf75e1e4664368240533c1ddbe\"\n\nansicolors@~0.2.1:\n  version \"0.2.1\"\n  resolved \"https://registry.yarnpkg.com/ansicolors/-/ansicolors-0.2.1.tgz#be089599097b74a5c9c4a84a0cdbcdb62bd87aef\"\n\nanymatch@^1.3.0:\n  version \"1.3.0\"\n  resolved \"https://registry.yarnpkg.com/anymatch/-/anymatch-1.3.0.tgz#a3e52fa39168c825ff57b0248126ce5a8ff95507\"\n  dependencies:\n    arrify \"^1.0.0\"\n    micromatch \"^2.1.5\"\n\nappend-field@^0.1.0:\n  version \"0.1.0\"\n  resolved \"https://registry.yarnpkg.com/append-field/-/append-field-0.1.0.tgz#6ddc58fa083c7bc545d3c5995b2830cc2366d44a\"\n\nappend-transform@^0.3.0:\n  version \"0.3.0\"\n  resolved \"https://registry.yarnpkg.com/append-transform/-/append-transform-0.3.0.tgz#d6933ce4a85f09445d9ccc4cc119051b7381a813\"\n\naproba@^1.0.3:\n  version \"1.0.4\"\n  resolved \"https://registry.yarnpkg.com/aproba/-/aproba-1.0.4.tgz#2713680775e7614c8ba186c065d4e2e52d1072c0\"\n\nare-we-there-yet@~1.1.2:\n  version \"1.1.2\"\n  resolved \"https://registry.yarnpkg.com/are-we-there-yet/-/are-we-there-yet-1.1.2.tgz#80e470e95a084794fe1899262c5667c6e88de1b3\"\n  dependencies:\n    delegates \"^1.0.0\"\n    readable-stream \"^2.0.0 || ^1.1.13\"\n\nargparse@^1.0.7:\n  version \"1.0.9\"\n  resolved \"https://registry.yarnpkg.com/argparse/-/argparse-1.0.9.tgz#73d83bc263f86e97f8cc4f6bae1b0e90a7d22c86\"\n  dependencies:\n    sprintf-js \"~1.0.2\"\n\narr-diff@^2.0.0:\n  version \"2.0.0\"\n  resolved \"https://registry.yarnpkg.com/arr-diff/-/arr-diff-2.0.0.tgz#8f3b827f955a8bd669697e4a4256ac3ceae356cf\"\n  dependencies:\n    arr-flatten \"^1.0.1\"\n\narr-flatten@^1.0.1:\n  version \"1.0.1\"\n  resolved \"https://registry.yarnpkg.com/arr-flatten/-/arr-flatten-1.0.1.tgz#e5ffe54d45e19f32f216e91eb99c8ce892bb604b\"\n\narray-differ@^1.0.0:\n  version \"1.0.0\"\n  resolved \"https://registry.yarnpkg.com/array-differ/-/array-differ-1.0.0.tgz#eff52e3758249d33be402b8bb8e564bb2b5d4031\"\n\narray-equal@^1.0.0:\n  version \"1.0.0\"\n  resolved \"https://registry.yarnpkg.com/array-equal/-/array-equal-1.0.0.tgz#8c2a5ef2472fd9ea742b04c77a75093ba2757c93\"\n\narray-find@^1.0.0:\n  version \"1.0.0\"\n  resolved \"https://registry.yarnpkg.com/array-find/-/array-find-1.0.0.tgz#6c8e286d11ed768327f8e62ecee87353ca3e78b8\"\n\narray-flatten@1.1.1:\n  version \"1.1.1\"\n  resolved \"https://registry.yarnpkg.com/array-flatten/-/array-flatten-1.1.1.tgz#9a5f699051b1e7073328f2a008968b64ea2955d2\"\n\narray-union@^1.0.1:\n  version \"1.0.2\"\n  resolved \"https://registry.yarnpkg.com/array-union/-/array-union-1.0.2.tgz#9a34410e4f4e3da23dea375be5be70f24778ec39\"\n  dependencies:\n    array-uniq \"^1.0.1\"\n\narray-uniq@^1.0.1:\n  version \"1.0.3\"\n  resolved \"https://registry.yarnpkg.com/array-uniq/-/array-uniq-1.0.3.tgz#af6ac877a25cc7f74e058894753858dfdb24fdb6\"\n\narray-unique@^0.2.1:\n  version \"0.2.1\"\n  resolved \"https://registry.yarnpkg.com/array-unique/-/array-unique-0.2.1.tgz#a1d97ccafcbc2625cc70fadceb36a50c58b01a53\"\n\narrify@^1.0.0, arrify@^1.0.1:\n  version \"1.0.1\"\n  resolved \"https://registry.yarnpkg.com/arrify/-/arrify-1.0.1.tgz#898508da2226f380df904728456849c1501a4b0d\"\n\nasap@~2.0.3:\n  version \"2.0.5\"\n  resolved \"https://registry.yarnpkg.com/asap/-/asap-2.0.5.tgz#522765b50c3510490e52d7dcfe085ef9ba96958f\"\n\nasn1@~0.2.3:\n  version \"0.2.3\"\n  resolved \"https://registry.yarnpkg.com/asn1/-/asn1-0.2.3.tgz#dac8787713c9966849fc8180777ebe9c1ddf3b86\"\n\nassert-plus@^0.2.0:\n  version \"0.2.0\"\n  resolved \"https://registry.yarnpkg.com/assert-plus/-/assert-plus-0.2.0.tgz#d74e1b87e7affc0db8aadb7021f3fe48101ab234\"\n\nassert-plus@^1.0.0:\n  version \"1.0.0\"\n  resolved \"https://registry.yarnpkg.com/assert-plus/-/assert-plus-1.0.0.tgz#f12e0f3c5d77b0b1cdd9146942e4e96c1e4dd525\"\n\nassert@^1.1.1:\n  version \"1.4.1\"\n  resolved \"https://registry.yarnpkg.com/assert/-/assert-1.4.1.tgz#99912d591836b5a6f5b345c0f07eefc08fc65d91\"\n  dependencies:\n    util \"0.10.3\"\n\nasync-each@^1.0.0:\n  version \"1.0.1\"\n  resolved \"https://registry.yarnpkg.com/async-each/-/async-each-1.0.1.tgz#19d386a1d9edc6e7c1c85d388aedbcc56d33602d\"\n\nasync@1.x, async@^1.3.0, async@^1.4.0, async@^1.4.2, async@^1.5.0:\n  version \"1.5.2\"\n  resolved \"https://registry.yarnpkg.com/async/-/async-1.5.2.tgz#ec6a61ae56480c0c3cb241c95618e20892f9672a\"\n\nasync@2.1.2:\n  version \"2.1.2\"\n  resolved \"https://registry.yarnpkg.com/async/-/async-2.1.2.tgz#612a4ab45ef42a70cde806bad86ee6db047e8385\"\n  dependencies:\n    lodash \"^4.14.0\"\n\nasync@^0.9.0:\n  version \"0.9.2\"\n  resolved \"https://registry.yarnpkg.com/async/-/async-0.9.2.tgz#aea74d5e61c1f899613bf64bda66d4c78f2fd17d\"\n\nasync@~0.2.6:\n  version \"0.2.10\"\n  resolved \"https://registry.yarnpkg.com/async/-/async-0.2.10.tgz#b6bbe0b0674b9d719708ca38de8c237cb526c3d1\"\n\nasync@~1.0.0:\n  version \"1.0.0\"\n  resolved \"https://registry.yarnpkg.com/async/-/async-1.0.0.tgz#f8fc04ca3a13784ade9e1641af98578cfbd647a9\"\n\nasynckit@^0.4.0:\n  version \"0.4.0\"\n  resolved \"https://registry.yarnpkg.com/asynckit/-/asynckit-0.4.0.tgz#c79ed97f7f34cb8f2ba1bc9790bcc366474b4b79\"\n\nattr-accept@^1.0.3:\n  version \"1.1.0\"\n  resolved \"https://registry.yarnpkg.com/attr-accept/-/attr-accept-1.1.0.tgz#b5cd35227f163935a8f1de10ed3eba16941f6be6\"\n\nautoprefixer@^6.3.1, autoprefixer@^6.3.6:\n  version \"6.5.3\"\n  resolved \"https://registry.yarnpkg.com/autoprefixer/-/autoprefixer-6.5.3.tgz#2d853af66d04449fcf50db3066279ab54c3e4b01\"\n  dependencies:\n    browserslist \"~1.4.0\"\n    caniuse-db \"^1.0.30000578\"\n    normalize-range \"^0.1.2\"\n    num2fraction \"^1.2.2\"\n    postcss \"^5.2.5\"\n    postcss-value-parser \"^3.2.3\"\n\naws-sign2@~0.6.0:\n  version \"0.6.0\"\n  resolved \"https://registry.yarnpkg.com/aws-sign2/-/aws-sign2-0.6.0.tgz#14342dd38dbcc94d0e5b87d763cd63612c0e794f\"\n\naws4@^1.2.1:\n  version \"1.5.0\"\n  resolved \"https://registry.yarnpkg.com/aws4/-/aws4-1.5.0.tgz#0a29ffb79c31c9e712eeb087e8e7a64b4a56d755\"\n\nbabel-code-frame@^6.16.0, babel-code-frame@^6.3.13:\n  version \"6.16.0\"\n  resolved \"https://registry.yarnpkg.com/babel-code-frame/-/babel-code-frame-6.16.0.tgz#f90e60da0862909d3ce098733b5d3987c97cb8de\"\n  dependencies:\n    chalk \"^1.1.0\"\n    esutils \"^2.0.2\"\n    js-tokens \"^2.0.0\"\n\nbabel-core@6.4.5:\n  version \"6.4.5\"\n  resolved \"https://registry.yarnpkg.com/babel-core/-/babel-core-6.4.5.tgz#5973f9418cd97fde664186f288c16dc4edb65f4f\"\n  dependencies:\n    babel-code-frame \"^6.3.13\"\n    babel-generator \"^6.4.5\"\n    babel-helpers \"^6.4.5\"\n    babel-messages \"^6.3.13\"\n    babel-register \"^6.3.13\"\n    babel-runtime \"^5.0.0\"\n    babel-template \"^6.3.13\"\n    babel-traverse \"^6.4.5\"\n    babel-types \"^6.4.5\"\n    babylon \"^6.4.5\"\n    convert-source-map \"^1.1.0\"\n    debug \"^2.1.1\"\n    json5 \"^0.4.0\"\n    lodash \"^3.10.0\"\n    minimatch \"^2.0.3\"\n    path-exists \"^1.0.0\"\n    path-is-absolute \"^1.0.0\"\n    private \"^0.1.6\"\n    shebang-regex \"^1.0.0\"\n    slash \"^1.0.0\"\n    source-map \"^0.5.0\"\n\nbabel-core@^6.0.0, babel-core@^6.18.0:\n  version \"6.18.2\"\n  resolved \"https://registry.yarnpkg.com/babel-core/-/babel-core-6.18.2.tgz#d8bb14dd6986fa4f3566a26ceda3964fa0e04e5b\"\n  dependencies:\n    babel-code-frame \"^6.16.0\"\n    babel-generator \"^6.18.0\"\n    babel-helpers \"^6.16.0\"\n    babel-messages \"^6.8.0\"\n    babel-register \"^6.18.0\"\n    babel-runtime \"^6.9.1\"\n    babel-template \"^6.16.0\"\n    babel-traverse \"^6.18.0\"\n    babel-types \"^6.18.0\"\n    babylon \"^6.11.0\"\n    convert-source-map \"^1.1.0\"\n    debug \"^2.1.1\"\n    json5 \"^0.5.0\"\n    lodash \"^4.2.0\"\n    minimatch \"^3.0.2\"\n    path-is-absolute \"^1.0.0\"\n    private \"^0.1.6\"\n    slash \"^1.0.0\"\n    source-map \"^0.5.0\"\n\nbabel-eslint@6.0.2:\n  version \"6.0.2\"\n  resolved \"https://registry.yarnpkg.com/babel-eslint/-/babel-eslint-6.0.2.tgz#030650af8ceeb4e9d0ef4dadb8303f622349e97f\"\n  dependencies:\n    babel-traverse \"^6.0.20\"\n    babel-types \"^6.0.19\"\n    babylon \"^6.0.18\"\n    lodash.assign \"^3.2.0\"\n    lodash.pick \"^3.1.0\"\n\nbabel-generator@^6.18.0, babel-generator@^6.4.5:\n  version \"6.19.0\"\n  resolved \"https://registry.yarnpkg.com/babel-generator/-/babel-generator-6.19.0.tgz#9b2f244204777a3d6810ec127c673c87b349fac5\"\n  dependencies:\n    babel-messages \"^6.8.0\"\n    babel-runtime \"^6.9.0\"\n    babel-types \"^6.19.0\"\n    detect-indent \"^4.0.0\"\n    jsesc \"^1.3.0\"\n    lodash \"^4.2.0\"\n    source-map \"^0.5.0\"\n\nbabel-helper-bindify-decorators@^6.18.0:\n  version \"6.18.0\"\n  resolved \"https://registry.yarnpkg.com/babel-helper-bindify-decorators/-/babel-helper-bindify-decorators-6.18.0.tgz#fc00c573676a6e702fffa00019580892ec8780a5\"\n  dependencies:\n    babel-runtime \"^6.0.0\"\n    babel-traverse \"^6.18.0\"\n    babel-types \"^6.18.0\"\n\nbabel-helper-builder-binary-assignment-operator-visitor@^6.8.0:\n  version \"6.18.0\"\n  resolved \"https://registry.yarnpkg.com/babel-helper-builder-binary-assignment-operator-visitor/-/babel-helper-builder-binary-assignment-operator-visitor-6.18.0.tgz#8ae814989f7a53682152e3401a04fabd0bb333a6\"\n  dependencies:\n    babel-helper-explode-assignable-expression \"^6.18.0\"\n    babel-runtime \"^6.0.0\"\n    babel-types \"^6.18.0\"\n\nbabel-helper-builder-react-jsx@^6.8.0:\n  version \"6.18.0\"\n  resolved \"https://registry.yarnpkg.com/babel-helper-builder-react-jsx/-/babel-helper-builder-react-jsx-6.18.0.tgz#ab02f19a2eb7ace936dd87fa55896d02be59bf71\"\n  dependencies:\n    babel-runtime \"^6.9.0\"\n    babel-types \"^6.18.0\"\n    esutils \"^2.0.0\"\n    lodash \"^4.2.0\"\n\nbabel-helper-call-delegate@^6.18.0:\n  version \"6.18.0\"\n  resolved \"https://registry.yarnpkg.com/babel-helper-call-delegate/-/babel-helper-call-delegate-6.18.0.tgz#05b14aafa430884b034097ef29e9f067ea4133bd\"\n  dependencies:\n    babel-helper-hoist-variables \"^6.18.0\"\n    babel-runtime \"^6.0.0\"\n    babel-traverse \"^6.18.0\"\n    babel-types \"^6.18.0\"\n\nbabel-helper-define-map@^6.18.0, babel-helper-define-map@^6.8.0:\n  version \"6.18.0\"\n  resolved \"https://registry.yarnpkg.com/babel-helper-define-map/-/babel-helper-define-map-6.18.0.tgz#8d6c85dc7fbb4c19be3de40474d18e97c3676ec2\"\n  dependencies:\n    babel-helper-function-name \"^6.18.0\"\n    babel-runtime \"^6.9.0\"\n    babel-types \"^6.18.0\"\n    lodash \"^4.2.0\"\n\nbabel-helper-explode-assignable-expression@^6.18.0:\n  version \"6.18.0\"\n  resolved \"https://registry.yarnpkg.com/babel-helper-explode-assignable-expression/-/babel-helper-explode-assignable-expression-6.18.0.tgz#14b8e8c2d03ad735d4b20f1840b24cd1f65239fe\"\n  dependencies:\n    babel-runtime \"^6.0.0\"\n    babel-traverse \"^6.18.0\"\n    babel-types \"^6.18.0\"\n\nbabel-helper-explode-class@^6.8.0:\n  version \"6.18.0\"\n  resolved \"https://registry.yarnpkg.com/babel-helper-explode-class/-/babel-helper-explode-class-6.18.0.tgz#c44f76f4fa23b9c5d607cbac5d4115e7a76f62cb\"\n  dependencies:\n    babel-helper-bindify-decorators \"^6.18.0\"\n    babel-runtime \"^6.0.0\"\n    babel-traverse \"^6.18.0\"\n    babel-types \"^6.18.0\"\n\nbabel-helper-function-name@^6.18.0, babel-helper-function-name@^6.8.0:\n  version \"6.18.0\"\n  resolved \"https://registry.yarnpkg.com/babel-helper-function-name/-/babel-helper-function-name-6.18.0.tgz#68ec71aeba1f3e28b2a6f0730190b754a9bf30e6\"\n  dependencies:\n    babel-helper-get-function-arity \"^6.18.0\"\n    babel-runtime \"^6.0.0\"\n    babel-template \"^6.8.0\"\n    babel-traverse \"^6.18.0\"\n    babel-types \"^6.18.0\"\n\nbabel-helper-get-function-arity@^6.18.0:\n  version \"6.18.0\"\n  resolved \"https://registry.yarnpkg.com/babel-helper-get-function-arity/-/babel-helper-get-function-arity-6.18.0.tgz#a5b19695fd3f9cdfc328398b47dafcd7094f9f24\"\n  dependencies:\n    babel-runtime \"^6.0.0\"\n    babel-types \"^6.18.0\"\n\nbabel-helper-hoist-variables@^6.18.0:\n  version \"6.18.0\"\n  resolved \"https://registry.yarnpkg.com/babel-helper-hoist-variables/-/babel-helper-hoist-variables-6.18.0.tgz#a835b5ab8b46d6de9babefae4d98ea41e866b82a\"\n  dependencies:\n    babel-runtime \"^6.0.0\"\n    babel-types \"^6.18.0\"\n\nbabel-helper-optimise-call-expression@^6.18.0:\n  version \"6.18.0\"\n  resolved \"https://registry.yarnpkg.com/babel-helper-optimise-call-expression/-/babel-helper-optimise-call-expression-6.18.0.tgz#9261d0299ee1a4f08a6dd28b7b7c777348fd8f0f\"\n  dependencies:\n    babel-runtime \"^6.0.0\"\n    babel-types \"^6.18.0\"\n\nbabel-helper-regex@^6.8.0:\n  version \"6.18.0\"\n  resolved \"https://registry.yarnpkg.com/babel-helper-regex/-/babel-helper-regex-6.18.0.tgz#ae0ebfd77de86cb2f1af258e2cc20b5fe893ecc6\"\n  dependencies:\n    babel-runtime \"^6.9.0\"\n    babel-types \"^6.18.0\"\n    lodash \"^4.2.0\"\n\nbabel-helper-remap-async-to-generator@^6.16.0, babel-helper-remap-async-to-generator@^6.16.2:\n  version \"6.18.0\"\n  resolved \"https://registry.yarnpkg.com/babel-helper-remap-async-to-generator/-/babel-helper-remap-async-to-generator-6.18.0.tgz#336cdf3cab650bb191b02fc16a3708e7be7f9ce5\"\n  dependencies:\n    babel-helper-function-name \"^6.18.0\"\n    babel-runtime \"^6.0.0\"\n    babel-template \"^6.16.0\"\n    babel-traverse \"^6.18.0\"\n    babel-types \"^6.18.0\"\n\nbabel-helper-replace-supers@^6.18.0, babel-helper-replace-supers@^6.8.0:\n  version \"6.18.0\"\n  resolved \"https://registry.yarnpkg.com/babel-helper-replace-supers/-/babel-helper-replace-supers-6.18.0.tgz#28ec69877be4144dbd64f4cc3a337e89f29a924e\"\n  dependencies:\n    babel-helper-optimise-call-expression \"^6.18.0\"\n    babel-messages \"^6.8.0\"\n    babel-runtime \"^6.0.0\"\n    babel-template \"^6.16.0\"\n    babel-traverse \"^6.18.0\"\n    babel-types \"^6.18.0\"\n\nbabel-helpers@^6.16.0, babel-helpers@^6.4.5:\n  version \"6.16.0\"\n  resolved \"https://registry.yarnpkg.com/babel-helpers/-/babel-helpers-6.16.0.tgz#1095ec10d99279460553e67eb3eee9973d3867e3\"\n  dependencies:\n    babel-runtime \"^6.0.0\"\n    babel-template \"^6.16.0\"\n\nbabel-jest@^18.0.0:\n  version \"18.0.0\"\n  resolved \"https://registry.yarnpkg.com/babel-jest/-/babel-jest-18.0.0.tgz#17ebba8cb3285c906d859e8707e4e79795fb65e3\"\n  dependencies:\n    babel-core \"^6.0.0\"\n    babel-plugin-istanbul \"^3.0.0\"\n    babel-preset-jest \"^18.0.0\"\n\nbabel-loader@6.2.2:\n  version \"6.2.2\"\n  resolved \"https://registry.yarnpkg.com/babel-loader/-/babel-loader-6.2.2.tgz#31f46096afa5cd6fde2e750348e19cdef87d5d24\"\n  dependencies:\n    loader-utils \"^0.2.11\"\n    mkdirp \"^0.5.1\"\n    object-assign \"^4.0.1\"\n\nbabel-messages@^6.3.13, babel-messages@^6.8.0:\n  version \"6.8.0\"\n  resolved \"https://registry.yarnpkg.com/babel-messages/-/babel-messages-6.8.0.tgz#bf504736ca967e6d65ef0adb5a2a5f947c8e0eb9\"\n  dependencies:\n    babel-runtime \"^6.0.0\"\n\nbabel-plugin-check-es2015-constants@^6.3.13:\n  version \"6.8.0\"\n  resolved \"https://registry.yarnpkg.com/babel-plugin-check-es2015-constants/-/babel-plugin-check-es2015-constants-6.8.0.tgz#dbf024c32ed37bfda8dee1e76da02386a8d26fe7\"\n  dependencies:\n    babel-runtime \"^6.0.0\"\n\nbabel-plugin-istanbul@^3.0.0:\n  version \"3.0.0\"\n  resolved \"https://registry.yarnpkg.com/babel-plugin-istanbul/-/babel-plugin-istanbul-3.0.0.tgz#da7324520ae0b8a44b6a078e72e883374a9fab76\"\n  dependencies:\n    find-up \"^1.1.2\"\n    istanbul-lib-instrument \"^1.1.4\"\n    object-assign \"^4.1.0\"\n    test-exclude \"^3.2.2\"\n\nbabel-plugin-jest-hoist@^18.0.0:\n  version \"18.0.0\"\n  resolved \"https://registry.yarnpkg.com/babel-plugin-jest-hoist/-/babel-plugin-jest-hoist-18.0.0.tgz#4150e70ecab560e6e7344adc849498072d34e12a\"\n\nbabel-plugin-lodash@^3.2.9:\n  version \"3.2.9\"\n  resolved \"https://registry.yarnpkg.com/babel-plugin-lodash/-/babel-plugin-lodash-3.2.9.tgz#062f85aa7810fbb4374a1a7372ecc44b09168760\"\n  dependencies:\n    glob \"^7.0.6\"\n    lodash \"^4.15.0\"\n\nbabel-plugin-react-transform@2.0.0:\n  version \"2.0.0\"\n  resolved \"https://registry.yarnpkg.com/babel-plugin-react-transform/-/babel-plugin-react-transform-2.0.0.tgz#1d9d9f7001da9b355359f8f92c5de5a921293d9b\"\n  dependencies:\n    array-find \"^1.0.0\"\n\nbabel-plugin-syntax-async-functions@^6.8.0:\n  version \"6.13.0\"\n  resolved \"https://registry.yarnpkg.com/babel-plugin-syntax-async-functions/-/babel-plugin-syntax-async-functions-6.13.0.tgz#cad9cad1191b5ad634bf30ae0872391e0647be95\"\n\nbabel-plugin-syntax-async-generators@^6.5.0:\n  version \"6.13.0\"\n  resolved \"https://registry.yarnpkg.com/babel-plugin-syntax-async-generators/-/babel-plugin-syntax-async-generators-6.13.0.tgz#6bc963ebb16eccbae6b92b596eb7f35c342a8b9a\"\n\nbabel-plugin-syntax-class-constructor-call@^6.18.0:\n  version \"6.18.0\"\n  resolved \"https://registry.yarnpkg.com/babel-plugin-syntax-class-constructor-call/-/babel-plugin-syntax-class-constructor-call-6.18.0.tgz#9cb9d39fe43c8600bec8146456ddcbd4e1a76416\"\n\nbabel-plugin-syntax-class-properties@^6.8.0:\n  version \"6.13.0\"\n  resolved \"https://registry.yarnpkg.com/babel-plugin-syntax-class-properties/-/babel-plugin-syntax-class-properties-6.13.0.tgz#d7eb23b79a317f8543962c505b827c7d6cac27de\"\n\nbabel-plugin-syntax-decorators@^6.1.18, babel-plugin-syntax-decorators@^6.13.0:\n  version \"6.13.0\"\n  resolved \"https://registry.yarnpkg.com/babel-plugin-syntax-decorators/-/babel-plugin-syntax-decorators-6.13.0.tgz#312563b4dbde3cc806cee3e416cceeaddd11ac0b\"\n\nbabel-plugin-syntax-do-expressions@^6.8.0:\n  version \"6.13.0\"\n  resolved \"https://registry.yarnpkg.com/babel-plugin-syntax-do-expressions/-/babel-plugin-syntax-do-expressions-6.13.0.tgz#5747756139aa26d390d09410b03744ba07e4796d\"\n\nbabel-plugin-syntax-dynamic-import@^6.18.0:\n  version \"6.18.0\"\n  resolved \"https://registry.yarnpkg.com/babel-plugin-syntax-dynamic-import/-/babel-plugin-syntax-dynamic-import-6.18.0.tgz#8d6a26229c83745a9982a441051572caa179b1da\"\n\nbabel-plugin-syntax-exponentiation-operator@^6.8.0:\n  version \"6.13.0\"\n  resolved \"https://registry.yarnpkg.com/babel-plugin-syntax-exponentiation-operator/-/babel-plugin-syntax-exponentiation-operator-6.13.0.tgz#9ee7e8337290da95288201a6a57f4170317830de\"\n\nbabel-plugin-syntax-export-extensions@^6.8.0:\n  version \"6.13.0\"\n  resolved \"https://registry.yarnpkg.com/babel-plugin-syntax-export-extensions/-/babel-plugin-syntax-export-extensions-6.13.0.tgz#70a1484f0f9089a4e84ad44bac353c95b9b12721\"\n\nbabel-plugin-syntax-flow@^6.18.0, babel-plugin-syntax-flow@^6.3.13:\n  version \"6.18.0\"\n  resolved \"https://registry.yarnpkg.com/babel-plugin-syntax-flow/-/babel-plugin-syntax-flow-6.18.0.tgz#4c3ab20a2af26aa20cd25995c398c4eb70310c8d\"\n\nbabel-plugin-syntax-function-bind@^6.8.0:\n  version \"6.13.0\"\n  resolved \"https://registry.yarnpkg.com/babel-plugin-syntax-function-bind/-/babel-plugin-syntax-function-bind-6.13.0.tgz#48c495f177bdf31a981e732f55adc0bdd2601f46\"\n\nbabel-plugin-syntax-jsx@^6.3.13, babel-plugin-syntax-jsx@^6.8.0:\n  version \"6.18.0\"\n  resolved \"https://registry.yarnpkg.com/babel-plugin-syntax-jsx/-/babel-plugin-syntax-jsx-6.18.0.tgz#0af32a9a6e13ca7a3fd5069e62d7b0f58d0d8946\"\n\nbabel-plugin-syntax-object-rest-spread@^6.8.0:\n  version \"6.13.0\"\n  resolved \"https://registry.yarnpkg.com/babel-plugin-syntax-object-rest-spread/-/babel-plugin-syntax-object-rest-spread-6.13.0.tgz#fd6536f2bce13836ffa3a5458c4903a597bb3bf5\"\n\nbabel-plugin-syntax-trailing-function-commas@^6.3.13:\n  version \"6.13.0\"\n  resolved \"https://registry.yarnpkg.com/babel-plugin-syntax-trailing-function-commas/-/babel-plugin-syntax-trailing-function-commas-6.13.0.tgz#2b84b7d53dd744f94ff1fad7669406274b23f541\"\n\nbabel-plugin-transform-async-generator-functions@^6.17.0:\n  version \"6.17.0\"\n  resolved \"https://registry.yarnpkg.com/babel-plugin-transform-async-generator-functions/-/babel-plugin-transform-async-generator-functions-6.17.0.tgz#d0b5a2b2f0940f2b245fa20a00519ed7bc6cae54\"\n  dependencies:\n    babel-helper-remap-async-to-generator \"^6.16.2\"\n    babel-plugin-syntax-async-generators \"^6.5.0\"\n    babel-runtime \"^6.0.0\"\n\nbabel-plugin-transform-async-to-generator@^6.16.0:\n  version \"6.16.0\"\n  resolved \"https://registry.yarnpkg.com/babel-plugin-transform-async-to-generator/-/babel-plugin-transform-async-to-generator-6.16.0.tgz#19ec36cb1486b59f9f468adfa42ce13908ca2999\"\n  dependencies:\n    babel-helper-remap-async-to-generator \"^6.16.0\"\n    babel-plugin-syntax-async-functions \"^6.8.0\"\n    babel-runtime \"^6.0.0\"\n\nbabel-plugin-transform-class-constructor-call@^6.3.13:\n  version \"6.18.0\"\n  resolved \"https://registry.yarnpkg.com/babel-plugin-transform-class-constructor-call/-/babel-plugin-transform-class-constructor-call-6.18.0.tgz#80855e38a1ab47b8c6c647f8ea1bcd2c00ca3aae\"\n  dependencies:\n    babel-plugin-syntax-class-constructor-call \"^6.18.0\"\n    babel-runtime \"^6.0.0\"\n    babel-template \"^6.8.0\"\n\nbabel-plugin-transform-class-properties@^6.18.0:\n  version \"6.19.0\"\n  resolved \"https://registry.yarnpkg.com/babel-plugin-transform-class-properties/-/babel-plugin-transform-class-properties-6.19.0.tgz#1274b349abaadc835164e2004f4a2444a2788d5f\"\n  dependencies:\n    babel-helper-function-name \"^6.18.0\"\n    babel-plugin-syntax-class-properties \"^6.8.0\"\n    babel-runtime \"^6.9.1\"\n    babel-template \"^6.15.0\"\n\nbabel-plugin-transform-decorators-legacy@1.3.4:\n  version \"1.3.4\"\n  resolved \"https://registry.yarnpkg.com/babel-plugin-transform-decorators-legacy/-/babel-plugin-transform-decorators-legacy-1.3.4.tgz#741b58f6c5bce9e6027e0882d9c994f04f366925\"\n  dependencies:\n    babel-plugin-syntax-decorators \"^6.1.18\"\n    babel-runtime \"^6.2.0\"\n    babel-template \"^6.3.0\"\n\nbabel-plugin-transform-decorators@^6.13.0:\n  version \"6.13.0\"\n  resolved \"https://registry.yarnpkg.com/babel-plugin-transform-decorators/-/babel-plugin-transform-decorators-6.13.0.tgz#82d65c1470ae83e2d13eebecb0a1c2476d62da9d\"\n  dependencies:\n    babel-helper-define-map \"^6.8.0\"\n    babel-helper-explode-class \"^6.8.0\"\n    babel-plugin-syntax-decorators \"^6.13.0\"\n    babel-runtime \"^6.0.0\"\n    babel-template \"^6.8.0\"\n    babel-types \"^6.13.0\"\n\nbabel-plugin-transform-do-expressions@^6.3.13:\n  version \"6.8.0\"\n  resolved \"https://registry.yarnpkg.com/babel-plugin-transform-do-expressions/-/babel-plugin-transform-do-expressions-6.8.0.tgz#fda692af339835cc255bb7544efb8f7c1306c273\"\n  dependencies:\n    babel-plugin-syntax-do-expressions \"^6.8.0\"\n    babel-runtime \"^6.0.0\"\n\nbabel-plugin-transform-es2015-arrow-functions@^6.3.13:\n  version \"6.8.0\"\n  resolved \"https://registry.yarnpkg.com/babel-plugin-transform-es2015-arrow-functions/-/babel-plugin-transform-es2015-arrow-functions-6.8.0.tgz#5b63afc3181bdc9a8c4d481b5a4f3f7d7fef3d9d\"\n  dependencies:\n    babel-runtime \"^6.0.0\"\n\nbabel-plugin-transform-es2015-block-scoped-functions@^6.3.13:\n  version \"6.8.0\"\n  resolved \"https://registry.yarnpkg.com/babel-plugin-transform-es2015-block-scoped-functions/-/babel-plugin-transform-es2015-block-scoped-functions-6.8.0.tgz#ed95d629c4b5a71ae29682b998f70d9833eb366d\"\n  dependencies:\n    babel-runtime \"^6.0.0\"\n\nbabel-plugin-transform-es2015-block-scoping@^6.3.13:\n  version \"6.18.0\"\n  resolved \"https://registry.yarnpkg.com/babel-plugin-transform-es2015-block-scoping/-/babel-plugin-transform-es2015-block-scoping-6.18.0.tgz#3bfdcfec318d46df22525cdea88f1978813653af\"\n  dependencies:\n    babel-runtime \"^6.9.0\"\n    babel-template \"^6.15.0\"\n    babel-traverse \"^6.18.0\"\n    babel-types \"^6.18.0\"\n    lodash \"^4.2.0\"\n\nbabel-plugin-transform-es2015-classes@^6.3.13:\n  version \"6.18.0\"\n  resolved \"https://registry.yarnpkg.com/babel-plugin-transform-es2015-classes/-/babel-plugin-transform-es2015-classes-6.18.0.tgz#ffe7a17321bf83e494dcda0ae3fc72df48ffd1d9\"\n  dependencies:\n    babel-helper-define-map \"^6.18.0\"\n    babel-helper-function-name \"^6.18.0\"\n    babel-helper-optimise-call-expression \"^6.18.0\"\n    babel-helper-replace-supers \"^6.18.0\"\n    babel-messages \"^6.8.0\"\n    babel-runtime \"^6.9.0\"\n    babel-template \"^6.14.0\"\n    babel-traverse \"^6.18.0\"\n    babel-types \"^6.18.0\"\n\nbabel-plugin-transform-es2015-computed-properties@^6.3.13:\n  version \"6.8.0\"\n  resolved \"https://registry.yarnpkg.com/babel-plugin-transform-es2015-computed-properties/-/babel-plugin-transform-es2015-computed-properties-6.8.0.tgz#f51010fd61b3bd7b6b60a5fdfd307bb7a5279870\"\n  dependencies:\n    babel-helper-define-map \"^6.8.0\"\n    babel-runtime \"^6.0.0\"\n    babel-template \"^6.8.0\"\n\nbabel-plugin-transform-es2015-destructuring@^6.3.13:\n  version \"6.19.0\"\n  resolved \"https://registry.yarnpkg.com/babel-plugin-transform-es2015-destructuring/-/babel-plugin-transform-es2015-destructuring-6.19.0.tgz#ff1d911c4b3f4cab621bd66702a869acd1900533\"\n  dependencies:\n    babel-runtime \"^6.9.0\"\n\nbabel-plugin-transform-es2015-for-of@^6.3.13:\n  version \"6.18.0\"\n  resolved \"https://registry.yarnpkg.com/babel-plugin-transform-es2015-for-of/-/babel-plugin-transform-es2015-for-of-6.18.0.tgz#4c517504db64bf8cfc119a6b8f177211f2028a70\"\n  dependencies:\n    babel-runtime \"^6.0.0\"\n\nbabel-plugin-transform-es2015-function-name@^6.3.13:\n  version \"6.9.0\"\n  resolved \"https://registry.yarnpkg.com/babel-plugin-transform-es2015-function-name/-/babel-plugin-transform-es2015-function-name-6.9.0.tgz#8c135b17dbd064e5bba56ec511baaee2fca82719\"\n  dependencies:\n    babel-helper-function-name \"^6.8.0\"\n    babel-runtime \"^6.9.0\"\n    babel-types \"^6.9.0\"\n\nbabel-plugin-transform-es2015-literals@^6.3.13:\n  version \"6.8.0\"\n  resolved \"https://registry.yarnpkg.com/babel-plugin-transform-es2015-literals/-/babel-plugin-transform-es2015-literals-6.8.0.tgz#50aa2e5c7958fc2ab25d74ec117e0cc98f046468\"\n  dependencies:\n    babel-runtime \"^6.0.0\"\n\nbabel-plugin-transform-es2015-modules-commonjs@^6.3.13:\n  version \"6.18.0\"\n  resolved \"https://registry.yarnpkg.com/babel-plugin-transform-es2015-modules-commonjs/-/babel-plugin-transform-es2015-modules-commonjs-6.18.0.tgz#c15ae5bb11b32a0abdcc98a5837baa4ee8d67bcc\"\n  dependencies:\n    babel-plugin-transform-strict-mode \"^6.18.0\"\n    babel-runtime \"^6.0.0\"\n    babel-template \"^6.16.0\"\n    babel-types \"^6.18.0\"\n\nbabel-plugin-transform-es2015-object-super@^6.3.13:\n  version \"6.8.0\"\n  resolved \"https://registry.yarnpkg.com/babel-plugin-transform-es2015-object-super/-/babel-plugin-transform-es2015-object-super-6.8.0.tgz#1b858740a5a4400887c23dcff6f4d56eea4a24c5\"\n  dependencies:\n    babel-helper-replace-supers \"^6.8.0\"\n    babel-runtime \"^6.0.0\"\n\nbabel-plugin-transform-es2015-parameters@^6.3.13:\n  version \"6.18.0\"\n  resolved \"https://registry.yarnpkg.com/babel-plugin-transform-es2015-parameters/-/babel-plugin-transform-es2015-parameters-6.18.0.tgz#9b2cfe238c549f1635ba27fc1daa858be70608b1\"\n  dependencies:\n    babel-helper-call-delegate \"^6.18.0\"\n    babel-helper-get-function-arity \"^6.18.0\"\n    babel-runtime \"^6.9.0\"\n    babel-template \"^6.16.0\"\n    babel-traverse \"^6.18.0\"\n    babel-types \"^6.18.0\"\n\nbabel-plugin-transform-es2015-shorthand-properties@^6.3.13:\n  version \"6.18.0\"\n  resolved \"https://registry.yarnpkg.com/babel-plugin-transform-es2015-shorthand-properties/-/babel-plugin-transform-es2015-shorthand-properties-6.18.0.tgz#e2ede3b7df47bf980151926534d1dd0cbea58f43\"\n  dependencies:\n    babel-runtime \"^6.0.0\"\n    babel-types \"^6.18.0\"\n\nbabel-plugin-transform-es2015-spread@^6.3.13:\n  version \"6.8.0\"\n  resolved \"https://registry.yarnpkg.com/babel-plugin-transform-es2015-spread/-/babel-plugin-transform-es2015-spread-6.8.0.tgz#0217f737e3b821fa5a669f187c6ed59205f05e9c\"\n  dependencies:\n    babel-runtime \"^6.0.0\"\n\nbabel-plugin-transform-es2015-sticky-regex@^6.3.13:\n  version \"6.8.0\"\n  resolved \"https://registry.yarnpkg.com/babel-plugin-transform-es2015-sticky-regex/-/babel-plugin-transform-es2015-sticky-regex-6.8.0.tgz#e73d300a440a35d5c64f5c2a344dc236e3df47be\"\n  dependencies:\n    babel-helper-regex \"^6.8.0\"\n    babel-runtime \"^6.0.0\"\n    babel-types \"^6.8.0\"\n\nbabel-plugin-transform-es2015-template-literals@^6.3.13:\n  version \"6.8.0\"\n  resolved \"https://registry.yarnpkg.com/babel-plugin-transform-es2015-template-literals/-/babel-plugin-transform-es2015-template-literals-6.8.0.tgz#86eb876d0a2c635da4ec048b4f7de9dfc897e66b\"\n  dependencies:\n    babel-runtime \"^6.0.0\"\n\nbabel-plugin-transform-es2015-typeof-symbol@^6.3.13:\n  version \"6.18.0\"\n  resolved \"https://registry.yarnpkg.com/babel-plugin-transform-es2015-typeof-symbol/-/babel-plugin-transform-es2015-typeof-symbol-6.18.0.tgz#0b14c48629c90ff47a0650077f6aa699bee35798\"\n  dependencies:\n    babel-runtime \"^6.0.0\"\n\nbabel-plugin-transform-es2015-unicode-regex@^6.3.13:\n  version \"6.11.0\"\n  resolved \"https://registry.yarnpkg.com/babel-plugin-transform-es2015-unicode-regex/-/babel-plugin-transform-es2015-unicode-regex-6.11.0.tgz#6298ceabaad88d50a3f4f392d8de997260f6ef2c\"\n  dependencies:\n    babel-helper-regex \"^6.8.0\"\n    babel-runtime \"^6.0.0\"\n    regexpu-core \"^2.0.0\"\n\nbabel-plugin-transform-exponentiation-operator@^6.3.13:\n  version \"6.8.0\"\n  resolved \"https://registry.yarnpkg.com/babel-plugin-transform-exponentiation-operator/-/babel-plugin-transform-exponentiation-operator-6.8.0.tgz#db25742e9339eade676ca9acec46f955599a68a4\"\n  dependencies:\n    babel-helper-builder-binary-assignment-operator-visitor \"^6.8.0\"\n    babel-plugin-syntax-exponentiation-operator \"^6.8.0\"\n    babel-runtime \"^6.0.0\"\n\nbabel-plugin-transform-export-extensions@^6.3.13:\n  version \"6.8.0\"\n  resolved \"https://registry.yarnpkg.com/babel-plugin-transform-export-extensions/-/babel-plugin-transform-export-extensions-6.8.0.tgz#fa80ff655b636549431bfd38f6b817bd82e47f5b\"\n  dependencies:\n    babel-plugin-syntax-export-extensions \"^6.8.0\"\n    babel-runtime \"^6.0.0\"\n\nbabel-plugin-transform-flow-strip-types@^6.3.13:\n  version \"6.18.0\"\n  resolved \"https://registry.yarnpkg.com/babel-plugin-transform-flow-strip-types/-/babel-plugin-transform-flow-strip-types-6.18.0.tgz#4d3e642158661e9b40db457c004a30817fa32592\"\n  dependencies:\n    babel-plugin-syntax-flow \"^6.18.0\"\n    babel-runtime \"^6.0.0\"\n\nbabel-plugin-transform-function-bind@^6.3.13:\n  version \"6.8.0\"\n  resolved \"https://registry.yarnpkg.com/babel-plugin-transform-function-bind/-/babel-plugin-transform-function-bind-6.8.0.tgz#e7f334ce69f50d28fe850a822eaaab9fa4f4d821\"\n  dependencies:\n    babel-plugin-syntax-function-bind \"^6.8.0\"\n    babel-runtime \"^6.0.0\"\n\nbabel-plugin-transform-object-rest-spread@^6.16.0:\n  version \"6.19.0\"\n  resolved \"https://registry.yarnpkg.com/babel-plugin-transform-object-rest-spread/-/babel-plugin-transform-object-rest-spread-6.19.0.tgz#f6ac428ee3cb4c6aa00943ed1422ce813603b34c\"\n  dependencies:\n    babel-plugin-syntax-object-rest-spread \"^6.8.0\"\n    babel-runtime \"^6.0.0\"\n\nbabel-plugin-transform-react-constant-elements@6.9.1:\n  version \"6.9.1\"\n  resolved \"https://registry.yarnpkg.com/babel-plugin-transform-react-constant-elements/-/babel-plugin-transform-react-constant-elements-6.9.1.tgz#125b86d96cb322e2139b607fd749ad5fbb17f005\"\n  dependencies:\n    babel-runtime \"^6.9.1\"\n\nbabel-plugin-transform-react-display-name@^6.3.13:\n  version \"6.8.0\"\n  resolved \"https://registry.yarnpkg.com/babel-plugin-transform-react-display-name/-/babel-plugin-transform-react-display-name-6.8.0.tgz#f7a084977383d728bdbdc2835bba0159577f660e\"\n  dependencies:\n    babel-runtime \"^6.0.0\"\n\nbabel-plugin-transform-react-inline-elements@6.8.0:\n  version \"6.8.0\"\n  resolved \"https://registry.yarnpkg.com/babel-plugin-transform-react-inline-elements/-/babel-plugin-transform-react-inline-elements-6.8.0.tgz#fc2d8fec1f2f87e5c4961ac367610039f325bbe6\"\n  dependencies:\n    babel-runtime \"^6.0.0\"\n\nbabel-plugin-transform-react-jsx-source@^6.3.13:\n  version \"6.9.0\"\n  resolved \"https://registry.yarnpkg.com/babel-plugin-transform-react-jsx-source/-/babel-plugin-transform-react-jsx-source-6.9.0.tgz#af684a05c2067a86e0957d4f343295ccf5dccf00\"\n  dependencies:\n    babel-plugin-syntax-jsx \"^6.8.0\"\n    babel-runtime \"^6.9.0\"\n\nbabel-plugin-transform-react-jsx@^6.3.13:\n  version \"6.8.0\"\n  resolved \"https://registry.yarnpkg.com/babel-plugin-transform-react-jsx/-/babel-plugin-transform-react-jsx-6.8.0.tgz#94759942f70af18c617189aa7f3593f1644a71ab\"\n  dependencies:\n    babel-helper-builder-react-jsx \"^6.8.0\"\n    babel-plugin-syntax-jsx \"^6.8.0\"\n    babel-runtime \"^6.0.0\"\n\nbabel-plugin-transform-regenerator@^6.3.13:\n  version \"6.16.1\"\n  resolved \"https://registry.yarnpkg.com/babel-plugin-transform-regenerator/-/babel-plugin-transform-regenerator-6.16.1.tgz#a75de6b048a14154aae14b0122756c5bed392f59\"\n  dependencies:\n    babel-runtime \"^6.9.0\"\n    babel-types \"^6.16.0\"\n    private \"~0.1.5\"\n\nbabel-plugin-transform-strict-mode@^6.18.0:\n  version \"6.18.0\"\n  resolved \"https://registry.yarnpkg.com/babel-plugin-transform-strict-mode/-/babel-plugin-transform-strict-mode-6.18.0.tgz#df7cf2991fe046f44163dcd110d5ca43bc652b9d\"\n  dependencies:\n    babel-runtime \"^6.0.0\"\n    babel-types \"^6.18.0\"\n\nbabel-polyfill@^6.3.14:\n  version \"6.16.0\"\n  resolved \"https://registry.yarnpkg.com/babel-polyfill/-/babel-polyfill-6.16.0.tgz#2d45021df87e26a374b6d4d1a9c65964d17f2422\"\n  dependencies:\n    babel-runtime \"^6.9.1\"\n    core-js \"^2.4.0\"\n    regenerator-runtime \"^0.9.5\"\n\nbabel-preset-es2015@6.3.13:\n  version \"6.3.13\"\n  resolved \"https://registry.yarnpkg.com/babel-preset-es2015/-/babel-preset-es2015-6.3.13.tgz#97dce7ef292e18cb9b2b7545d80c593c28d9517f\"\n  dependencies:\n    babel-plugin-check-es2015-constants \"^6.3.13\"\n    babel-plugin-transform-es2015-arrow-functions \"^6.3.13\"\n    babel-plugin-transform-es2015-block-scoped-functions \"^6.3.13\"\n    babel-plugin-transform-es2015-block-scoping \"^6.3.13\"\n    babel-plugin-transform-es2015-classes \"^6.3.13\"\n    babel-plugin-transform-es2015-computed-properties \"^6.3.13\"\n    babel-plugin-transform-es2015-destructuring \"^6.3.13\"\n    babel-plugin-transform-es2015-for-of \"^6.3.13\"\n    babel-plugin-transform-es2015-function-name \"^6.3.13\"\n    babel-plugin-transform-es2015-literals \"^6.3.13\"\n    babel-plugin-transform-es2015-modules-commonjs \"^6.3.13\"\n    babel-plugin-transform-es2015-object-super \"^6.3.13\"\n    babel-plugin-transform-es2015-parameters \"^6.3.13\"\n    babel-plugin-transform-es2015-shorthand-properties \"^6.3.13\"\n    babel-plugin-transform-es2015-spread \"^6.3.13\"\n    babel-plugin-transform-es2015-sticky-regex \"^6.3.13\"\n    babel-plugin-transform-es2015-template-literals \"^6.3.13\"\n    babel-plugin-transform-es2015-typeof-symbol \"^6.3.13\"\n    babel-plugin-transform-es2015-unicode-regex \"^6.3.13\"\n    babel-plugin-transform-regenerator \"^6.3.13\"\n\nbabel-preset-jest@^18.0.0:\n  version \"18.0.0\"\n  resolved \"https://registry.yarnpkg.com/babel-preset-jest/-/babel-preset-jest-18.0.0.tgz#84faf8ca3ec65aba7d5e3f59bbaed935ab24049e\"\n  dependencies:\n    babel-plugin-jest-hoist \"^18.0.0\"\n\nbabel-preset-react@6.3.13:\n  version \"6.3.13\"\n  resolved \"https://registry.yarnpkg.com/babel-preset-react/-/babel-preset-react-6.3.13.tgz#13d55e06a65faaaa07c39bf63a9d836e032116fa\"\n  dependencies:\n    babel-plugin-syntax-flow \"^6.3.13\"\n    babel-plugin-syntax-jsx \"^6.3.13\"\n    babel-plugin-transform-flow-strip-types \"^6.3.13\"\n    babel-plugin-transform-react-display-name \"^6.3.13\"\n    babel-plugin-transform-react-jsx \"^6.3.13\"\n    babel-plugin-transform-react-jsx-source \"^6.3.13\"\n\nbabel-preset-stage-0@6.3.13:\n  version \"6.3.13\"\n  resolved \"https://registry.yarnpkg.com/babel-preset-stage-0/-/babel-preset-stage-0-6.3.13.tgz#78a37c56f0b3988f2a79932dcb0ceb8ff377b0d1\"\n  dependencies:\n    babel-plugin-transform-do-expressions \"^6.3.13\"\n    babel-plugin-transform-function-bind \"^6.3.13\"\n    babel-preset-stage-1 \"^6.3.13\"\n\nbabel-preset-stage-1@^6.3.13:\n  version \"6.16.0\"\n  resolved \"https://registry.yarnpkg.com/babel-preset-stage-1/-/babel-preset-stage-1-6.16.0.tgz#9d31fbbdae7b17c549fd3ac93e3cf6902695e479\"\n  dependencies:\n    babel-plugin-transform-class-constructor-call \"^6.3.13\"\n    babel-plugin-transform-export-extensions \"^6.3.13\"\n    babel-preset-stage-2 \"^6.16.0\"\n\nbabel-preset-stage-2@^6.16.0:\n  version \"6.18.0\"\n  resolved \"https://registry.yarnpkg.com/babel-preset-stage-2/-/babel-preset-stage-2-6.18.0.tgz#9eb7bf9a8e91c68260d5ba7500493caaada4b5b5\"\n  dependencies:\n    babel-plugin-syntax-dynamic-import \"^6.18.0\"\n    babel-plugin-transform-class-properties \"^6.18.0\"\n    babel-plugin-transform-decorators \"^6.13.0\"\n    babel-preset-stage-3 \"^6.17.0\"\n\nbabel-preset-stage-3@^6.17.0:\n  version \"6.17.0\"\n  resolved \"https://registry.yarnpkg.com/babel-preset-stage-3/-/babel-preset-stage-3-6.17.0.tgz#b6638e46db6e91e3f889013d8ce143917c685e39\"\n  dependencies:\n    babel-plugin-syntax-trailing-function-commas \"^6.3.13\"\n    babel-plugin-transform-async-generator-functions \"^6.17.0\"\n    babel-plugin-transform-async-to-generator \"^6.16.0\"\n    babel-plugin-transform-exponentiation-operator \"^6.3.13\"\n    babel-plugin-transform-object-rest-spread \"^6.16.0\"\n\nbabel-register@^6.18.0, babel-register@^6.3.13:\n  version \"6.18.0\"\n  resolved \"https://registry.yarnpkg.com/babel-register/-/babel-register-6.18.0.tgz#892e2e03865078dd90ad2c715111ec4449b32a68\"\n  dependencies:\n    babel-core \"^6.18.0\"\n    babel-runtime \"^6.11.6\"\n    core-js \"^2.4.0\"\n    home-or-tmp \"^2.0.0\"\n    lodash \"^4.2.0\"\n    mkdirp \"^0.5.1\"\n    source-map-support \"^0.4.2\"\n\nbabel-runtime@^5.0.0, babel-runtime@^5.8.x:\n  version \"5.8.38\"\n  resolved \"https://registry.yarnpkg.com/babel-runtime/-/babel-runtime-5.8.38.tgz#1c0b02eb63312f5f087ff20450827b425c9d4c19\"\n  dependencies:\n    core-js \"^1.0.0\"\n\nbabel-runtime@^6.0.0, babel-runtime@^6.11.6, babel-runtime@^6.2.0, babel-runtime@^6.9.0, babel-runtime@^6.9.1:\n  version \"6.18.0\"\n  resolved \"https://registry.yarnpkg.com/babel-runtime/-/babel-runtime-6.18.0.tgz#0f4177ffd98492ef13b9f823e9994a02584c9078\"\n  dependencies:\n    core-js \"^2.4.0\"\n    regenerator-runtime \"^0.9.5\"\n\nbabel-template@^6.14.0, babel-template@^6.15.0, babel-template@^6.16.0, babel-template@^6.3.0, babel-template@^6.3.13, babel-template@^6.8.0:\n  version \"6.16.0\"\n  resolved \"https://registry.yarnpkg.com/babel-template/-/babel-template-6.16.0.tgz#e149dd1a9f03a35f817ddbc4d0481988e7ebc8ca\"\n  dependencies:\n    babel-runtime \"^6.9.0\"\n    babel-traverse \"^6.16.0\"\n    babel-types \"^6.16.0\"\n    babylon \"^6.11.0\"\n    lodash \"^4.2.0\"\n\nbabel-traverse@^6.0.20, babel-traverse@^6.16.0, babel-traverse@^6.18.0, babel-traverse@^6.4.5:\n  version \"6.19.0\"\n  resolved \"https://registry.yarnpkg.com/babel-traverse/-/babel-traverse-6.19.0.tgz#68363fb821e26247d52a519a84b2ceab8df4f55a\"\n  dependencies:\n    babel-code-frame \"^6.16.0\"\n    babel-messages \"^6.8.0\"\n    babel-runtime \"^6.9.0\"\n    babel-types \"^6.19.0\"\n    babylon \"^6.11.0\"\n    debug \"^2.2.0\"\n    globals \"^9.0.0\"\n    invariant \"^2.2.0\"\n    lodash \"^4.2.0\"\n\nbabel-types@^6.0.19, babel-types@^6.13.0, babel-types@^6.16.0, babel-types@^6.18.0, babel-types@^6.19.0, babel-types@^6.4.5, babel-types@^6.8.0, babel-types@^6.9.0:\n  version \"6.19.0\"\n  resolved \"https://registry.yarnpkg.com/babel-types/-/babel-types-6.19.0.tgz#8db2972dbed01f1192a8b602ba1e1e4c516240b9\"\n  dependencies:\n    babel-runtime \"^6.9.1\"\n    esutils \"^2.0.2\"\n    lodash \"^4.2.0\"\n    to-fast-properties \"^1.0.1\"\n\nbabylon@^6.0.18, babylon@^6.11.0, babylon@^6.13.0, babylon@^6.4.5:\n  version \"6.14.1\"\n  resolved \"https://registry.yarnpkg.com/babylon/-/babylon-6.14.1.tgz#956275fab72753ad9b3435d7afe58f8bf0a29815\"\n\nbalanced-match@^0.4.1, balanced-match@^0.4.2:\n  version \"0.4.2\"\n  resolved \"https://registry.yarnpkg.com/balanced-match/-/balanced-match-0.4.2.tgz#cb3f3e3c732dc0f01ee70b403f302e61d7709838\"\n\nbalanced-match@~0.1.0:\n  version \"0.1.0\"\n  resolved \"https://registry.yarnpkg.com/balanced-match/-/balanced-match-0.1.0.tgz#b504bd05869b39259dd0c5efc35d843176dccc4a\"\n\nbase64-js@^1.0.2:\n  version \"1.2.0\"\n  resolved \"https://registry.yarnpkg.com/base64-js/-/base64-js-1.2.0.tgz#a39992d723584811982be5e290bb6a53d86700f1\"\n\nbase64-url@1.3.3:\n  version \"1.3.3\"\n  resolved \"https://registry.yarnpkg.com/base64-url/-/base64-url-1.3.3.tgz#f8b6c537f09a4fc58c99cb86e0b0e9c61461a20f\"\n\nbasic-auth@~1.0.3:\n  version \"1.0.4\"\n  resolved \"https://registry.yarnpkg.com/basic-auth/-/basic-auth-1.0.4.tgz#030935b01de7c9b94a824b29f3fccb750d3a5290\"\n\nbatch@0.5.3:\n  version \"0.5.3\"\n  resolved \"https://registry.yarnpkg.com/batch/-/batch-0.5.3.tgz#3f3414f380321743bfc1042f9a83ff1d5824d464\"\n\nbcrypt-pbkdf@^1.0.0:\n  version \"1.0.0\"\n  resolved \"https://registry.yarnpkg.com/bcrypt-pbkdf/-/bcrypt-pbkdf-1.0.0.tgz#3ca76b85241c7170bf7d9703e7b9aa74630040d4\"\n  dependencies:\n    tweetnacl \"^0.14.3\"\n\nbig.js@^3.1.3:\n  version \"3.1.3\"\n  resolved \"https://registry.yarnpkg.com/big.js/-/big.js-3.1.3.tgz#4cada2193652eb3ca9ec8e55c9015669c9806978\"\n\nbinary-extensions@^1.0.0:\n  version \"1.7.0\"\n  resolved \"https://registry.yarnpkg.com/binary-extensions/-/binary-extensions-1.7.0.tgz#6c1610db163abfb34edfe42fa423343a1e01185d\"\n\nblock-stream@*:\n  version \"0.0.9\"\n  resolved \"https://registry.yarnpkg.com/block-stream/-/block-stream-0.0.9.tgz#13ebfe778a03205cfe03751481ebb4b3300c126a\"\n  dependencies:\n    inherits \"~2.0.0\"\n\nbluebird@2.10.2:\n  version \"2.10.2\"\n  resolved \"https://registry.yarnpkg.com/bluebird/-/bluebird-2.10.2.tgz#024a5517295308857f14f91f1106fc3b555f446b\"\n\nbluebird@2.9.6:\n  version \"2.9.6\"\n  resolved \"https://registry.yarnpkg.com/bluebird/-/bluebird-2.9.6.tgz#1fc3a6b1685267dc121b5ec89b32ce069d81ab7d\"\n\nbluebird@^2.10.2:\n  version \"2.11.0\"\n  resolved \"https://registry.yarnpkg.com/bluebird/-/bluebird-2.11.0.tgz#534b9033c022c9579c56ba3b3e5a5caafbb650e1\"\n\nbluebird@^3.4.0, bluebird@^3.4.6:\n  version \"3.4.6\"\n  resolved \"https://registry.yarnpkg.com/bluebird/-/bluebird-3.4.6.tgz#01da8d821d87813d158967e743d5fe6c62cf8c0f\"\n\nbody-parser@^1.13.3:\n  version \"1.15.2\"\n  resolved \"https://registry.yarnpkg.com/body-parser/-/body-parser-1.15.2.tgz#d7578cf4f1d11d5f6ea804cef35dc7a7ff6dae67\"\n  dependencies:\n    bytes \"2.4.0\"\n    content-type \"~1.0.2\"\n    debug \"~2.2.0\"\n    depd \"~1.1.0\"\n    http-errors \"~1.5.0\"\n    iconv-lite \"0.4.13\"\n    on-finished \"~2.3.0\"\n    qs \"6.2.0\"\n    raw-body \"~2.1.7\"\n    type-is \"~1.6.13\"\n\nboolean@^0.1.1:\n  version \"0.1.1\"\n  resolved \"https://registry.yarnpkg.com/boolean/-/boolean-0.1.1.tgz#8b65c9b656160bdb72ea2b3bbd4969918bf7f2d9\"\n\nboom@2.x.x:\n  version \"2.10.1\"\n  resolved \"https://registry.yarnpkg.com/boom/-/boom-2.10.1.tgz#39c8918ceff5799f83f9492a848f625add0c766f\"\n  dependencies:\n    hoek \"2.x.x\"\n\nbrace-expansion@^1.0.0:\n  version \"1.1.6\"\n  resolved \"https://registry.yarnpkg.com/brace-expansion/-/brace-expansion-1.1.6.tgz#7197d7eaa9b87e648390ea61fc66c84427420df9\"\n  dependencies:\n    balanced-match \"^0.4.1\"\n    concat-map \"0.0.1\"\n\nbraces@^1.8.2:\n  version \"1.8.5\"\n  resolved \"https://registry.yarnpkg.com/braces/-/braces-1.8.5.tgz#ba77962e12dff969d6b76711e914b737857bf6a7\"\n  dependencies:\n    expand-range \"^1.8.1\"\n    preserve \"^0.2.0\"\n    repeat-element \"^1.1.2\"\n\nbrowser-resolve@^1.11.2:\n  version \"1.11.2\"\n  resolved \"https://registry.yarnpkg.com/browser-resolve/-/browser-resolve-1.11.2.tgz#8ff09b0a2c421718a1051c260b32e48f442938ce\"\n  dependencies:\n    resolve \"1.1.7\"\n\nbrowserify-zlib@~0.1.4:\n  version \"0.1.4\"\n  resolved \"https://registry.yarnpkg.com/browserify-zlib/-/browserify-zlib-0.1.4.tgz#bb35f8a519f600e0fa6b8485241c979d0141fb2d\"\n  dependencies:\n    pako \"~0.2.0\"\n\nbrowserslist@~1.4.0:\n  version \"1.4.0\"\n  resolved \"https://registry.yarnpkg.com/browserslist/-/browserslist-1.4.0.tgz#9cfdcf5384d9158f5b70da2aa00b30e8ff019049\"\n  dependencies:\n    caniuse-db \"^1.0.30000539\"\n\nbser@^1.0.2:\n  version \"1.0.2\"\n  resolved \"https://registry.yarnpkg.com/bser/-/bser-1.0.2.tgz#381116970b2a6deea5646dd15dd7278444b56169\"\n  dependencies:\n    node-int64 \"^0.4.0\"\n\nbson@~0.4.20:\n  version \"0.4.23\"\n  resolved \"https://registry.yarnpkg.com/bson/-/bson-0.4.23.tgz#e65a2e3c7507ffade4109bc7575a76e50f8da915\"\n\nbson@~0.5.4, bson@~0.5.6:\n  version \"0.5.6\"\n  resolved \"https://registry.yarnpkg.com/bson/-/bson-0.5.6.tgz#e03de80a692c28fca4396f0d14c97069bd2b73a6\"\n\nbuffer-shims@^1.0.0:\n  version \"1.0.0\"\n  resolved \"https://registry.yarnpkg.com/buffer-shims/-/buffer-shims-1.0.0.tgz#9978ce317388c649ad8793028c3477ef044a8b51\"\n\nbuffer@^4.9.0:\n  version \"4.9.1\"\n  resolved \"https://registry.yarnpkg.com/buffer/-/buffer-4.9.1.tgz#6d1bb601b07a4efced97094132093027c95bc298\"\n  dependencies:\n    base64-js \"^1.0.2\"\n    ieee754 \"^1.1.4\"\n    isarray \"^1.0.0\"\n\n\"bufferjs@>= 2.0.0\":\n  version \"3.0.1\"\n  resolved \"https://registry.yarnpkg.com/bufferjs/-/bufferjs-3.0.1.tgz#0692e829cb10a10550e647390b035eb06c38e8ef\"\n\n\"bufferstream@>= 0.6.2\":\n  version \"0.6.2\"\n  resolved \"https://registry.yarnpkg.com/bufferstream/-/bufferstream-0.6.2.tgz#a5f27e10d3c760084d14b35126615007319e3731\"\n  dependencies:\n    bufferjs \">= 2.0.0\"\n  optionalDependencies:\n    buffertools \">= 1.0.3\"\n\n\"buffertools@>= 1.0.3\":\n  version \"2.1.4\"\n  resolved \"https://registry.yarnpkg.com/buffertools/-/buffertools-2.1.4.tgz#62d4e1584c0090a0c7d3587f25934a84b8b38de4\"\n\nbuildmail@^2.0.0:\n  version \"2.0.0\"\n  resolved \"https://registry.yarnpkg.com/buildmail/-/buildmail-2.0.0.tgz#f0b7b0a59e9a4a1b5066bbfa051d248f3832eece\"\n  dependencies:\n    addressparser \"^0.3.2\"\n    libbase64 \"^0.1.0\"\n    libmime \"^1.2.0\"\n    libqp \"^1.1.0\"\n    needle \"^0.10.0\"\n\nbuiltin-modules@^1.0.0:\n  version \"1.1.1\"\n  resolved \"https://registry.yarnpkg.com/builtin-modules/-/builtin-modules-1.1.1.tgz#270f076c5a72c02f5b65a47df94c5fe3a278892f\"\n\nbusboy@^0.2.11:\n  version \"0.2.13\"\n  resolved \"https://registry.yarnpkg.com/busboy/-/busboy-0.2.13.tgz#90fc4f6a3967d815616fc976bfa8e56aed0c58b6\"\n  dependencies:\n    dicer \"0.2.5\"\n    readable-stream \"1.1.x\"\n\nbytes@2.3.0:\n  version \"2.3.0\"\n  resolved \"https://registry.yarnpkg.com/bytes/-/bytes-2.3.0.tgz#d5b680a165b6201739acb611542aabc2d8ceb070\"\n\nbytes@2.4.0:\n  version \"2.4.0\"\n  resolved \"https://registry.yarnpkg.com/bytes/-/bytes-2.4.0.tgz#7d97196f9d5baf7f6935e25985549edd2a6c2339\"\n\ncaller-path@^0.1.0:\n  version \"0.1.0\"\n  resolved \"https://registry.yarnpkg.com/caller-path/-/caller-path-0.1.0.tgz#94085ef63581ecd3daa92444a8fe94e82577751f\"\n  dependencies:\n    callsites \"^0.2.0\"\n\ncallsites@^0.2.0:\n  version \"0.2.0\"\n  resolved \"https://registry.yarnpkg.com/callsites/-/callsites-0.2.0.tgz#afab96262910a7f33c19a5775825c69f34e350ca\"\n\ncallsites@^2.0.0:\n  version \"2.0.0\"\n  resolved \"https://registry.yarnpkg.com/callsites/-/callsites-2.0.0.tgz#06eb84f00eea413da86affefacbffb36093b3c50\"\n\ncamelcase@^1.0.2:\n  version \"1.2.1\"\n  resolved \"https://registry.yarnpkg.com/camelcase/-/camelcase-1.2.1.tgz#9bb5304d2e0b56698b2c758b08a3eaa9daa58a39\"\n\ncamelcase@^3.0.0:\n  version \"3.0.0\"\n  resolved \"https://registry.yarnpkg.com/camelcase/-/camelcase-3.0.0.tgz#32fc4b9fcdaf845fcdf7e73bb97cac2261f0ab0a\"\n\ncan-use-dom@^0.1.0:\n  version \"0.1.0\"\n  resolved \"https://registry.yarnpkg.com/can-use-dom/-/can-use-dom-0.1.0.tgz#22cc4a34a0abc43950f42c6411024a3f6366b45a\"\n\ncaniuse-db@^1.0.30000539, caniuse-db@^1.0.30000578:\n  version \"1.0.30000584\"\n  resolved \"https://registry.yarnpkg.com/caniuse-db/-/caniuse-db-1.0.30000584.tgz#cfbce897a48145fa73f96d893025581e838648c4\"\n\ncardinal@^1.0.0:\n  version \"1.0.0\"\n  resolved \"https://registry.yarnpkg.com/cardinal/-/cardinal-1.0.0.tgz#50e21c1b0aa37729f9377def196b5a9cec932ee9\"\n  dependencies:\n    ansicolors \"~0.2.1\"\n    redeyed \"~1.0.0\"\n\ncaseless@~0.11.0:\n  version \"0.11.0\"\n  resolved \"https://registry.yarnpkg.com/caseless/-/caseless-0.11.0.tgz#715b96ea9841593cc33067923f5ec60ebda4f7d7\"\n\ncenter-align@^0.1.1:\n  version \"0.1.3\"\n  resolved \"https://registry.yarnpkg.com/center-align/-/center-align-0.1.3.tgz#aa0d32629b6ee972200411cbd4461c907bc2b7ad\"\n  dependencies:\n    align-text \"^0.1.3\"\n    lazy-cache \"^1.0.3\"\n\nchalk@0.5.1:\n  version \"0.5.1\"\n  resolved \"https://registry.yarnpkg.com/chalk/-/chalk-0.5.1.tgz#663b3a648b68b55d04690d49167aa837858f2174\"\n  dependencies:\n    ansi-styles \"^1.1.0\"\n    escape-string-regexp \"^1.0.0\"\n    has-ansi \"^0.1.0\"\n    strip-ansi \"^0.3.0\"\n    supports-color \"^0.2.0\"\n\nchalk@^1.0.0, chalk@^1.1.0, chalk@^1.1.1, chalk@^1.1.3:\n  version \"1.1.3\"\n  resolved \"https://registry.yarnpkg.com/chalk/-/chalk-1.1.3.tgz#a8115c55e4a702fe4d150abd3872822a7e09fc98\"\n  dependencies:\n    ansi-styles \"^2.2.1\"\n    escape-string-regexp \"^1.0.2\"\n    has-ansi \"^2.0.0\"\n    strip-ansi \"^3.0.0\"\n    supports-color \"^2.0.0\"\n\nchokidar@^1.0.0, chokidar@^1.4.3:\n  version \"1.6.1\"\n  resolved \"https://registry.yarnpkg.com/chokidar/-/chokidar-1.6.1.tgz#2f4447ab5e96e50fb3d789fd90d4c72e0e4c70c2\"\n  dependencies:\n    anymatch \"^1.3.0\"\n    async-each \"^1.0.0\"\n    glob-parent \"^2.0.0\"\n    inherits \"^2.0.1\"\n    is-binary-path \"^1.0.0\"\n    is-glob \"^2.0.0\"\n    path-is-absolute \"^1.0.0\"\n    readdirp \"^2.0.0\"\n  optionalDependencies:\n    fsevents \"^1.0.0\"\n\nci-info@^1.0.0:\n  version \"1.0.0\"\n  resolved \"https://registry.yarnpkg.com/ci-info/-/ci-info-1.0.0.tgz#dc5285f2b4e251821683681c381c3388f46ec534\"\n\ncircular-json@^0.3.0:\n  version \"0.3.1\"\n  resolved \"https://registry.yarnpkg.com/circular-json/-/circular-json-0.3.1.tgz#be8b36aefccde8b3ca7aa2d6afc07a37242c0d2d\"\n\nclap@^1.0.9:\n  version \"1.1.1\"\n  resolved \"https://registry.yarnpkg.com/clap/-/clap-1.1.1.tgz#a8a93e0bfb7581ac199c4f001a5525a724ce696d\"\n  dependencies:\n    chalk \"^1.1.3\"\n\nclassnames@^2.1.3:\n  version \"2.2.5\"\n  resolved \"https://registry.yarnpkg.com/classnames/-/classnames-2.2.5.tgz#fb3801d453467649ef3603c7d61a02bd129bde6d\"\n\ncli-cursor@^1.0.1:\n  version \"1.0.2\"\n  resolved \"https://registry.yarnpkg.com/cli-cursor/-/cli-cursor-1.0.2.tgz#64da3f7d56a54412e59794bd62dc35295e8f2987\"\n  dependencies:\n    restore-cursor \"^1.0.1\"\n\ncli-table@^0.3.1:\n  version \"0.3.1\"\n  resolved \"https://registry.yarnpkg.com/cli-table/-/cli-table-0.3.1.tgz#f53b05266a8b1a0b934b3d0821e6e2dc5914ae23\"\n  dependencies:\n    colors \"1.0.3\"\n\ncli-usage@^0.1.1:\n  version \"0.1.4\"\n  resolved \"https://registry.yarnpkg.com/cli-usage/-/cli-usage-0.1.4.tgz#7c01e0dc706c234b39c933838c8e20b2175776e2\"\n  dependencies:\n    marked \"^0.3.6\"\n    marked-terminal \"^1.6.2\"\n\ncli-width@^2.0.0:\n  version \"2.1.0\"\n  resolved \"https://registry.yarnpkg.com/cli-width/-/cli-width-2.1.0.tgz#b234ca209b29ef66fc518d9b98d5847b00edf00a\"\n\ncliui@^2.1.0:\n  version \"2.1.0\"\n  resolved \"https://registry.yarnpkg.com/cliui/-/cliui-2.1.0.tgz#4b475760ff80264c762c3a1719032e91c7fea0d1\"\n  dependencies:\n    center-align \"^0.1.1\"\n    right-align \"^0.1.1\"\n    wordwrap \"0.0.2\"\n\ncliui@^3.2.0:\n  version \"3.2.0\"\n  resolved \"https://registry.yarnpkg.com/cliui/-/cliui-3.2.0.tgz#120601537a916d29940f934da3b48d585a39213d\"\n  dependencies:\n    string-width \"^1.0.1\"\n    strip-ansi \"^3.0.1\"\n    wrap-ansi \"^2.0.0\"\n\nclone@^1.0.2:\n  version \"1.0.2\"\n  resolved \"https://registry.yarnpkg.com/clone/-/clone-1.0.2.tgz#260b7a99ebb1edfe247538175f783243cb19d149\"\n\nco@^4.6.0:\n  version \"4.6.0\"\n  resolved \"https://registry.yarnpkg.com/co/-/co-4.6.0.tgz#6ea6bdf3d853ae54ccb8e47bfa0bf3f9031fb184\"\n\ncoa@~1.0.1:\n  version \"1.0.1\"\n  resolved \"https://registry.yarnpkg.com/coa/-/coa-1.0.1.tgz#7f959346cfc8719e3f7233cd6852854a7c67d8a3\"\n  dependencies:\n    q \"^1.1.2\"\n\ncode-point-at@^1.0.0:\n  version \"1.1.0\"\n  resolved \"https://registry.yarnpkg.com/code-point-at/-/code-point-at-1.1.0.tgz#0d070b4d043a5bea33a2f1a40e2edb3d9a4ccf77\"\n\ncolor-convert@^1.3.0:\n  version \"1.8.2\"\n  resolved \"https://registry.yarnpkg.com/color-convert/-/color-convert-1.8.2.tgz#be868184d7c8631766d54e7078e2672d7c7e3339\"\n  dependencies:\n    color-name \"^1.1.1\"\n\ncolor-name@^1.0.0, color-name@^1.1.1:\n  version \"1.1.1\"\n  resolved \"https://registry.yarnpkg.com/color-name/-/color-name-1.1.1.tgz#4b1415304cf50028ea81643643bd82ea05803689\"\n\ncolor-string@^0.3.0:\n  version \"0.3.0\"\n  resolved \"https://registry.yarnpkg.com/color-string/-/color-string-0.3.0.tgz#27d46fb67025c5c2fa25993bfbf579e47841b991\"\n  dependencies:\n    color-name \"^1.0.0\"\n\n\"color-thief@git+https://github.com/relax/color-thief.git\":\n  version \"2.0.1\"\n  resolved \"git+https://github.com/relax/color-thief.git#26ee1d4c1e4e6a0c5876c6abd55569fe65dd6477\"\n\ncolor@^0.11.0, color@^0.11.3:\n  version \"0.11.4\"\n  resolved \"https://registry.yarnpkg.com/color/-/color-0.11.4.tgz#6d7b5c74fb65e841cd48792ad1ed5e07b904d764\"\n  dependencies:\n    clone \"^1.0.2\"\n    color-convert \"^1.3.0\"\n    color-string \"^0.3.0\"\n\ncolormin@^1.0.5:\n  version \"1.1.2\"\n  resolved \"https://registry.yarnpkg.com/colormin/-/colormin-1.1.2.tgz#ea2f7420a72b96881a38aae59ec124a6f7298133\"\n  dependencies:\n    color \"^0.11.0\"\n    css-color-names \"0.0.4\"\n    has \"^1.0.1\"\n\ncolors@1.0.3, colors@1.0.x:\n  version \"1.0.3\"\n  resolved \"https://registry.yarnpkg.com/colors/-/colors-1.0.3.tgz#0433f44d809680fdeb60ed260f1b0c262e82a40b\"\n\ncolors@~1.1.2:\n  version \"1.1.2\"\n  resolved \"https://registry.yarnpkg.com/colors/-/colors-1.1.2.tgz#168a4701756b6a7f51a12ce0c97bfa28c084ed63\"\n\ncolr-convert@^1.0.5:\n  version \"1.0.5\"\n  resolved \"https://registry.yarnpkg.com/colr-convert/-/colr-convert-1.0.5.tgz#b4a22c9322dfa238d2a80aa90736c11271841b71\"\n\ncolr@^1.2.2:\n  version \"1.2.2\"\n  resolved \"https://registry.yarnpkg.com/colr/-/colr-1.2.2.tgz#6003289b8e3c53f60824ec7bbc08e033878ad4f6\"\n  dependencies:\n    colr-convert \"^1.0.5\"\n\ncombined-stream@^1.0.5, combined-stream@~1.0.5:\n  version \"1.0.5\"\n  resolved \"https://registry.yarnpkg.com/combined-stream/-/combined-stream-1.0.5.tgz#938370a57b4a51dea2c77c15d5c5fdf895164009\"\n  dependencies:\n    delayed-stream \"~1.0.0\"\n\ncommander@2.6.0:\n  version \"2.6.0\"\n  resolved \"https://registry.yarnpkg.com/commander/-/commander-2.6.0.tgz#9df7e52fb2a0cb0fb89058ee80c3104225f37e1d\"\n\ncommander@^2.9.0:\n  version \"2.9.0\"\n  resolved \"https://registry.yarnpkg.com/commander/-/commander-2.9.0.tgz#9c99094176e12240cb22d6c5146098400fe0f7d4\"\n  dependencies:\n    graceful-readlink \">= 1.0.0\"\n\ncomponent-emitter@~1.2.0:\n  version \"1.2.1\"\n  resolved \"https://registry.yarnpkg.com/component-emitter/-/component-emitter-1.2.1.tgz#137918d6d78283f7df7a6b7c5a63e140e69425e6\"\n\ncompressible@~2.0.8:\n  version \"2.0.9\"\n  resolved \"https://registry.yarnpkg.com/compressible/-/compressible-2.0.9.tgz#6daab4e2b599c2770dd9e21e7a891b1c5a755425\"\n  dependencies:\n    mime-db \">= 1.24.0 < 2\"\n\ncompression@^1.5.2:\n  version \"1.6.2\"\n  resolved \"https://registry.yarnpkg.com/compression/-/compression-1.6.2.tgz#cceb121ecc9d09c52d7ad0c3350ea93ddd402bc3\"\n  dependencies:\n    accepts \"~1.3.3\"\n    bytes \"2.3.0\"\n    compressible \"~2.0.8\"\n    debug \"~2.2.0\"\n    on-headers \"~1.0.1\"\n    vary \"~1.1.0\"\n\nconcat-map@0.0.1:\n  version \"0.0.1\"\n  resolved \"https://registry.yarnpkg.com/concat-map/-/concat-map-0.0.1.tgz#d8a96bd77fd68df7793a73036a3ba0d5405d477b\"\n\nconcat-stream@^1.4.6, concat-stream@^1.5.0:\n  version \"1.5.2\"\n  resolved \"https://registry.yarnpkg.com/concat-stream/-/concat-stream-1.5.2.tgz#708978624d856af41a5a741defdd261da752c266\"\n  dependencies:\n    inherits \"~2.0.1\"\n    readable-stream \"~2.0.0\"\n    typedarray \"~0.0.5\"\n\nconcurrently@^3.1.0:\n  version \"3.1.0\"\n  resolved \"https://registry.yarnpkg.com/concurrently/-/concurrently-3.1.0.tgz#dc5ef0459090012604756668894c04b434ef90d1\"\n  dependencies:\n    bluebird \"2.9.6\"\n    chalk \"0.5.1\"\n    commander \"2.6.0\"\n    lodash \"^4.5.1\"\n    moment \"^2.11.2\"\n    rx \"2.3.24\"\n    spawn-default-shell \"^1.1.0\"\n    tree-kill \"^1.1.0\"\n\nconfigstore@^1.0.0:\n  version \"1.4.0\"\n  resolved \"https://registry.yarnpkg.com/configstore/-/configstore-1.4.0.tgz#c35781d0501d268c25c54b8b17f6240e8a4fb021\"\n  dependencies:\n    graceful-fs \"^4.1.2\"\n    mkdirp \"^0.5.0\"\n    object-assign \"^4.0.1\"\n    os-tmpdir \"^1.0.0\"\n    osenv \"^0.1.0\"\n    uuid \"^2.0.1\"\n    write-file-atomic \"^1.1.2\"\n    xdg-basedir \"^2.0.0\"\n\nconnect-history-api-fallback@^1.3.0:\n  version \"1.3.0\"\n  resolved \"https://registry.yarnpkg.com/connect-history-api-fallback/-/connect-history-api-fallback-1.3.0.tgz#e51d17f8f0ef0db90a64fdb47de3051556e9f169\"\n\nconnect-mongo@^0.8.2:\n  version \"0.8.2\"\n  resolved \"https://registry.yarnpkg.com/connect-mongo/-/connect-mongo-0.8.2.tgz#c92878eec0c5a5a6625b79a0c214f37f861fc6e0\"\n  dependencies:\n    debug \">= 0.7.0\"\n    depd \">= 0.4.0\"\n    lodash \"*\"\n    mongodb \">= 1.2.0 <2.1.0\"\n\nconsole-browserify@^1.1.0:\n  version \"1.1.0\"\n  resolved \"https://registry.yarnpkg.com/console-browserify/-/console-browserify-1.1.0.tgz#f0241c45730a9fc6323b206dbf38edc741d0bb10\"\n  dependencies:\n    date-now \"^0.1.4\"\n\nconsole-control-strings@^1.0.0, console-control-strings@~1.1.0:\n  version \"1.1.0\"\n  resolved \"https://registry.yarnpkg.com/console-control-strings/-/console-control-strings-1.1.0.tgz#3d7cf4464db6446ea644bf4b39507f9851008e8e\"\n\nconstants-browserify@0.0.1:\n  version \"0.0.1\"\n  resolved \"https://registry.yarnpkg.com/constants-browserify/-/constants-browserify-0.0.1.tgz#92577db527ba6c4cf0a4568d84bc031f441e21f2\"\n\ncontent-disposition@0.5.1:\n  version \"0.5.1\"\n  resolved \"https://registry.yarnpkg.com/content-disposition/-/content-disposition-0.5.1.tgz#87476c6a67c8daa87e32e87616df883ba7fb071b\"\n\ncontent-type-parser@^1.0.1:\n  version \"1.0.1\"\n  resolved \"https://registry.yarnpkg.com/content-type-parser/-/content-type-parser-1.0.1.tgz#c3e56988c53c65127fb46d4032a3a900246fdc94\"\n\ncontent-type@~1.0.1, content-type@~1.0.2:\n  version \"1.0.2\"\n  resolved \"https://registry.yarnpkg.com/content-type/-/content-type-1.0.2.tgz#b7d113aee7a8dd27bd21133c4dc2529df1721eed\"\n\nconvert-source-map@^1.1.0:\n  version \"1.3.0\"\n  resolved \"https://registry.yarnpkg.com/convert-source-map/-/convert-source-map-1.3.0.tgz#e9f3e9c6e2728efc2676696a70eb382f73106a67\"\n\ncookie-signature@1.0.6:\n  version \"1.0.6\"\n  resolved \"https://registry.yarnpkg.com/cookie-signature/-/cookie-signature-1.0.6.tgz#e303a882b342cc3ee8ca513a79999734dab3ae2c\"\n\ncookie@0.3.1:\n  version \"0.3.1\"\n  resolved \"https://registry.yarnpkg.com/cookie/-/cookie-0.3.1.tgz#e7e0a1f9ef43b4c8ba925c5c5a96e806d16873bb\"\n\ncookiejar@2.0.6:\n  version \"2.0.6\"\n  resolved \"https://registry.yarnpkg.com/cookiejar/-/cookiejar-2.0.6.tgz#0abf356ad00d1c5a219d88d44518046dd026acfe\"\n\ncopy-webpack-plugin@^2.1.3:\n  version \"2.1.6\"\n  resolved \"https://registry.yarnpkg.com/copy-webpack-plugin/-/copy-webpack-plugin-2.1.6.tgz#4f88c388fceaf2b7ab0bb239c7d6222c829c9f60\"\n  dependencies:\n    bluebird \"^2.10.2\"\n    fs-extra \"^0.26.4\"\n    glob \"^6.0.4\"\n    lodash \"^4.3.0\"\n    minimatch \"^3.0.0\"\n    node-dir \"^0.1.10\"\n\ncore-js@^1.0.0:\n  version \"1.2.7\"\n  resolved \"https://registry.yarnpkg.com/core-js/-/core-js-1.2.7.tgz#652294c14651db28fa93bd2d5ff2983a4f08c636\"\n\ncore-js@^2.4.0:\n  version \"2.4.1\"\n  resolved \"https://registry.yarnpkg.com/core-js/-/core-js-2.4.1.tgz#4de911e667b0eae9124e34254b53aea6fc618d3e\"\n\ncore-util-is@~1.0.0:\n  version \"1.0.2\"\n  resolved \"https://registry.yarnpkg.com/core-util-is/-/core-util-is-1.0.2.tgz#b5fd54220aa2bc5ab57aab7140c940754503c1a7\"\n\ncrc@3.4.1:\n  version \"3.4.1\"\n  resolved \"https://registry.yarnpkg.com/crc/-/crc-3.4.1.tgz#65d5830b1a2569557cfb324c0e679998521473ee\"\n\ncross-env@^1.0.7:\n  version \"1.0.8\"\n  resolved \"https://registry.yarnpkg.com/cross-env/-/cross-env-1.0.8.tgz#2bde748efc780f56ddf07ea69fcad875357774ce\"\n  dependencies:\n    cross-spawn \"^3.0.1\"\n    lodash.assign \"^3.2.0\"\n\ncross-spawn@^3.0.1:\n  version \"3.0.1\"\n  resolved \"https://registry.yarnpkg.com/cross-spawn/-/cross-spawn-3.0.1.tgz#1256037ecb9f0c5f79e3d6ef135e30770184b982\"\n  dependencies:\n    lru-cache \"^4.0.1\"\n    which \"^1.2.9\"\n\ncryptiles@2.x.x:\n  version \"2.0.5\"\n  resolved \"https://registry.yarnpkg.com/cryptiles/-/cryptiles-2.0.5.tgz#3bdfecdc608147c1c67202fa291e7dca59eaa3b8\"\n  dependencies:\n    boom \"2.x.x\"\n\ncrypto-browserify@~3.2.6:\n  version \"3.2.8\"\n  resolved \"https://registry.yarnpkg.com/crypto-browserify/-/crypto-browserify-3.2.8.tgz#b9b11dbe6d9651dd882a01e6cc467df718ecf189\"\n  dependencies:\n    pbkdf2-compat \"2.0.1\"\n    ripemd160 \"0.2.0\"\n    sha.js \"2.2.6\"\n\ncss-color-names@0.0.4:\n  version \"0.0.4\"\n  resolved \"https://registry.yarnpkg.com/css-color-names/-/css-color-names-0.0.4.tgz#808adc2e79cf84738069b646cb20ec27beb629e0\"\n\ncss-loader@^0.23.1:\n  version \"0.23.1\"\n  resolved \"https://registry.yarnpkg.com/css-loader/-/css-loader-0.23.1.tgz#9fa23f2b5c0965235910ad5ecef3b8a36390fe50\"\n  dependencies:\n    css-selector-tokenizer \"^0.5.1\"\n    cssnano \">=2.6.1 <4\"\n    loader-utils \"~0.2.2\"\n    lodash.camelcase \"^3.0.1\"\n    object-assign \"^4.0.1\"\n    postcss \"^5.0.6\"\n    postcss-modules-extract-imports \"^1.0.0\"\n    postcss-modules-local-by-default \"^1.0.1\"\n    postcss-modules-scope \"^1.0.0\"\n    postcss-modules-values \"^1.1.0\"\n    source-list-map \"^0.1.4\"\n\ncss-selector-tokenizer@^0.5.1:\n  version \"0.5.4\"\n  resolved \"https://registry.yarnpkg.com/css-selector-tokenizer/-/css-selector-tokenizer-0.5.4.tgz#139bafd34a35fd0c1428487049e0699e6f6a2c21\"\n  dependencies:\n    cssesc \"^0.1.0\"\n    fastparse \"^1.1.1\"\n\ncss-selector-tokenizer@^0.6.0:\n  version \"0.6.0\"\n  resolved \"https://registry.yarnpkg.com/css-selector-tokenizer/-/css-selector-tokenizer-0.6.0.tgz#6445f582c7930d241dcc5007a43d6fcb8f073152\"\n  dependencies:\n    cssesc \"^0.1.0\"\n    fastparse \"^1.1.1\"\n    regexpu-core \"^1.0.0\"\n\ncssesc@^0.1.0:\n  version \"0.1.0\"\n  resolved \"https://registry.yarnpkg.com/cssesc/-/cssesc-0.1.0.tgz#c814903e45623371a0477b40109aaafbeeaddbb4\"\n\n\"cssnano@>=2.6.1 <4\":\n  version \"3.8.0\"\n  resolved \"https://registry.yarnpkg.com/cssnano/-/cssnano-3.8.0.tgz#bb90ac5292f42b679d9a05f6da0e9697556bb80d\"\n  dependencies:\n    autoprefixer \"^6.3.1\"\n    decamelize \"^1.1.2\"\n    defined \"^1.0.0\"\n    has \"^1.0.1\"\n    object-assign \"^4.0.1\"\n    postcss \"^5.0.14\"\n    postcss-calc \"^5.2.0\"\n    postcss-colormin \"^2.1.8\"\n    postcss-convert-values \"^2.3.4\"\n    postcss-discard-comments \"^2.0.4\"\n    postcss-discard-duplicates \"^2.0.1\"\n    postcss-discard-empty \"^2.0.1\"\n    postcss-discard-overridden \"^0.1.1\"\n    postcss-discard-unused \"^2.2.1\"\n    postcss-filter-plugins \"^2.0.0\"\n    postcss-merge-idents \"^2.1.5\"\n    postcss-merge-longhand \"^2.0.1\"\n    postcss-merge-rules \"^2.0.3\"\n    postcss-minify-font-values \"^1.0.2\"\n    postcss-minify-gradients \"^1.0.1\"\n    postcss-minify-params \"^1.0.4\"\n    postcss-minify-selectors \"^2.0.4\"\n    postcss-normalize-charset \"^1.1.0\"\n    postcss-normalize-url \"^3.0.7\"\n    postcss-ordered-values \"^2.1.0\"\n    postcss-reduce-idents \"^2.2.2\"\n    postcss-reduce-initial \"^1.0.0\"\n    postcss-reduce-transforms \"^1.0.3\"\n    postcss-svgo \"^2.1.1\"\n    postcss-unique-selectors \"^2.0.2\"\n    postcss-value-parser \"^3.2.3\"\n    postcss-zindex \"^2.0.1\"\n\ncsso@~2.2.1:\n  version \"2.2.1\"\n  resolved \"https://registry.yarnpkg.com/csso/-/csso-2.2.1.tgz#51fbb5347e50e81e6ed51668a48490ae6fe2afe2\"\n  dependencies:\n    clap \"^1.0.9\"\n    source-map \"^0.5.3\"\n\ncssom@0.3.x, \"cssom@>= 0.3.0 < 0.4.0\":\n  version \"0.3.1\"\n  resolved \"https://registry.yarnpkg.com/cssom/-/cssom-0.3.1.tgz#c9e37ef2490e64f6d1baa10fda852257082c25d3\"\n\n\"cssstyle@>= 0.2.36 < 0.3.0\":\n  version \"0.2.37\"\n  resolved \"https://registry.yarnpkg.com/cssstyle/-/cssstyle-0.2.37.tgz#541097234cb2513c83ceed3acddc27ff27987d54\"\n  dependencies:\n    cssom \"0.3.x\"\n\ncycle@1.0.x:\n  version \"1.0.3\"\n  resolved \"https://registry.yarnpkg.com/cycle/-/cycle-1.0.3.tgz#21e80b2be8580f98b468f379430662b046c34ad2\"\n\nd@^0.1.1, d@~0.1.1:\n  version \"0.1.1\"\n  resolved \"https://registry.yarnpkg.com/d/-/d-0.1.1.tgz#da184c535d18d8ee7ba2aa229b914009fae11309\"\n  dependencies:\n    es5-ext \"~0.10.2\"\n\ndashdash@^1.12.0:\n  version \"1.14.0\"\n  resolved \"https://registry.yarnpkg.com/dashdash/-/dashdash-1.14.0.tgz#29e486c5418bf0f356034a993d51686a33e84141\"\n  dependencies:\n    assert-plus \"^1.0.0\"\n\ndate-now@^0.1.4:\n  version \"0.1.4\"\n  resolved \"https://registry.yarnpkg.com/date-now/-/date-now-0.1.4.tgz#eaf439fd4d4848ad74e5cc7dbef200672b9e345b\"\n\ndebug@2, debug@2.2.0, \"debug@>= 0.7.0\", debug@^2.1.1, debug@^2.1.2, debug@^2.2.0, debug@~2.2.0:\n  version \"2.2.0\"\n  resolved \"https://registry.yarnpkg.com/debug/-/debug-2.2.0.tgz#f87057e995b1a1f6ae6a4960664137bc56f039da\"\n  dependencies:\n    ms \"0.7.1\"\n\ndecamelize@^1.0.0, decamelize@^1.1.1, decamelize@^1.1.2:\n  version \"1.2.0\"\n  resolved \"https://registry.yarnpkg.com/decamelize/-/decamelize-1.2.0.tgz#f6534d15148269b20352e7bee26f501f9a191290\"\n\ndeep-diff@0.3.4:\n  version \"0.3.4\"\n  resolved \"https://registry.yarnpkg.com/deep-diff/-/deep-diff-0.3.4.tgz#aac5c39952236abe5f037a2349060ba01b00ae48\"\n\ndeep-equal@^1.0.0, deep-equal@^1.0.1:\n  version \"1.0.1\"\n  resolved \"https://registry.yarnpkg.com/deep-equal/-/deep-equal-1.0.1.tgz#f5d260292b660e084eff4cdbc9f08ad3247448b5\"\n\ndeep-extend@~0.4.0:\n  version \"0.4.1\"\n  resolved \"https://registry.yarnpkg.com/deep-extend/-/deep-extend-0.4.1.tgz#efe4113d08085f4e6f9687759810f807469e2253\"\n\ndeep-is@~0.1.3:\n  version \"0.1.3\"\n  resolved \"https://registry.yarnpkg.com/deep-is/-/deep-is-0.1.3.tgz#b369d6fb5dbc13eecf524f91b070feedc357cf34\"\n\ndefined@^1.0.0:\n  version \"1.0.0\"\n  resolved \"https://registry.yarnpkg.com/defined/-/defined-1.0.0.tgz#c98d9bcef75674188e110969151199e39b1fa693\"\n\ndel@^2.0.2, del@^2.2.0:\n  version \"2.2.2\"\n  resolved \"https://registry.yarnpkg.com/del/-/del-2.2.2.tgz#c12c981d067846c84bcaf862cff930d907ffd1a8\"\n  dependencies:\n    globby \"^5.0.0\"\n    is-path-cwd \"^1.0.0\"\n    is-path-in-cwd \"^1.0.0\"\n    object-assign \"^4.0.1\"\n    pify \"^2.0.0\"\n    pinkie-promise \"^2.0.0\"\n    rimraf \"^2.2.8\"\n\ndelayed-stream@~1.0.0:\n  version \"1.0.0\"\n  resolved \"https://registry.yarnpkg.com/delayed-stream/-/delayed-stream-1.0.0.tgz#df3ae199acadfb7d440aaae0b29e2272b24ec619\"\n\ndelegates@^1.0.0:\n  version \"1.0.0\"\n  resolved \"https://registry.yarnpkg.com/delegates/-/delegates-1.0.0.tgz#84c6e159b81904fdca59a0ef44cd870d31250f9a\"\n\n\"depd@>= 0.4.0\", depd@~1.1.0:\n  version \"1.1.0\"\n  resolved \"https://registry.yarnpkg.com/depd/-/depd-1.1.0.tgz#e1bd82c6aab6ced965b97b88b17ed3e528ca18c3\"\n\ndestroy@~1.0.4:\n  version \"1.0.4\"\n  resolved \"https://registry.yarnpkg.com/destroy/-/destroy-1.0.4.tgz#978857442c44749e4206613e37946205826abd80\"\n\ndetect-indent@^4.0.0:\n  version \"4.0.0\"\n  resolved \"https://registry.yarnpkg.com/detect-indent/-/detect-indent-4.0.0.tgz#f76d064352cdf43a1cb6ce619c4ee3a9475de208\"\n  dependencies:\n    repeating \"^2.0.0\"\n\ndicer@0.2.5:\n  version \"0.2.5\"\n  resolved \"https://registry.yarnpkg.com/dicer/-/dicer-0.2.5.tgz#5996c086bb33218c812c090bddc09cd12facb70f\"\n  dependencies:\n    readable-stream \"1.1.x\"\n    streamsearch \"0.1.2\"\n\ndiff@^3.0.0:\n  version \"3.1.0\"\n  resolved \"https://registry.yarnpkg.com/diff/-/diff-3.1.0.tgz#9406c73a401e6c2b3ba901c5e2c44eb6a60c5385\"\n\ndoctrine@^1.2.2:\n  version \"1.5.0\"\n  resolved \"https://registry.yarnpkg.com/doctrine/-/doctrine-1.5.0.tgz#379dce730f6166f76cefa4e6707a159b02c5a6fa\"\n  dependencies:\n    esutils \"^2.0.2\"\n    isarray \"^1.0.0\"\n\ndom-walk@^0.1.0:\n  version \"0.1.1\"\n  resolved \"https://registry.yarnpkg.com/dom-walk/-/dom-walk-0.1.1.tgz#672226dc74c8f799ad35307df936aba11acd6018\"\n\ndomain-browser@^1.1.1:\n  version \"1.1.7\"\n  resolved \"https://registry.yarnpkg.com/domain-browser/-/domain-browser-1.1.7.tgz#867aa4b093faa05f1de08c06f4d7b21fdf8698bc\"\n\nduplexer@~0.1.1:\n  version \"0.1.1\"\n  resolved \"https://registry.yarnpkg.com/duplexer/-/duplexer-0.1.1.tgz#ace6ff808c1ce66b57d1ebf97977acb02334cfc1\"\n\nduplexify@^3.2.0:\n  version \"3.5.0\"\n  resolved \"https://registry.yarnpkg.com/duplexify/-/duplexify-3.5.0.tgz#1aa773002e1578457e9d9d4a50b0ccaaebcbd604\"\n  dependencies:\n    end-of-stream \"1.0.0\"\n    inherits \"^2.0.1\"\n    readable-stream \"^2.0.0\"\n    stream-shift \"^1.0.0\"\n\nease-component@^1.0.0:\n  version \"1.0.0\"\n  resolved \"https://registry.yarnpkg.com/ease-component/-/ease-component-1.0.0.tgz#b375726db0b5b04595b77440396fec7daa5d77c9\"\n\necc-jsbn@~0.1.1:\n  version \"0.1.1\"\n  resolved \"https://registry.yarnpkg.com/ecc-jsbn/-/ecc-jsbn-0.1.1.tgz#0fc73a9ed5f0d53c38193398523ef7e543777505\"\n  dependencies:\n    jsbn \"~0.1.0\"\n\nee-first@1.1.1:\n  version \"1.1.1\"\n  resolved \"https://registry.yarnpkg.com/ee-first/-/ee-first-1.1.1.tgz#590c61156b0ae2f4f0255732a158b266bc56b21d\"\n\nemojis-list@^2.0.0:\n  version \"2.1.0\"\n  resolved \"https://registry.yarnpkg.com/emojis-list/-/emojis-list-2.1.0.tgz#4daa4d9db00f9819880c79fa457ae5b09a1fd389\"\n\nencodeurl@~1.0.1:\n  version \"1.0.1\"\n  resolved \"https://registry.yarnpkg.com/encodeurl/-/encodeurl-1.0.1.tgz#79e3d58655346909fe6f0f45a5de68103b294d20\"\n\nencoding@^0.1.11:\n  version \"0.1.12\"\n  resolved \"https://registry.yarnpkg.com/encoding/-/encoding-0.1.12.tgz#538b66f3ee62cd1ab51ec323829d1f9480c74beb\"\n  dependencies:\n    iconv-lite \"~0.4.13\"\n\nend-of-stream@1.0.0:\n  version \"1.0.0\"\n  resolved \"https://registry.yarnpkg.com/end-of-stream/-/end-of-stream-1.0.0.tgz#d4596e702734a93e40e9af864319eabd99ff2f0e\"\n  dependencies:\n    once \"~1.3.0\"\n\nenhanced-resolve@~0.9.0:\n  version \"0.9.1\"\n  resolved \"https://registry.yarnpkg.com/enhanced-resolve/-/enhanced-resolve-0.9.1.tgz#4d6e689b3725f86090927ccc86cd9f1635b89e2e\"\n  dependencies:\n    graceful-fs \"^4.1.2\"\n    memory-fs \"^0.2.0\"\n    tapable \"^0.1.8\"\n\n\"errno@>=0.1.1 <0.2.0-0\", errno@^0.1.1, errno@^0.1.3:\n  version \"0.1.4\"\n  resolved \"https://registry.yarnpkg.com/errno/-/errno-0.1.4.tgz#b896e23a9e5e8ba33871fc996abd3635fc9a1c7d\"\n  dependencies:\n    prr \"~0.0.0\"\n\nerror-ex@^1.2.0:\n  version \"1.3.0\"\n  resolved \"https://registry.yarnpkg.com/error-ex/-/error-ex-1.3.0.tgz#e67b43f3e82c96ea3a584ffee0b9fc3325d802d9\"\n  dependencies:\n    is-arrayish \"^0.2.1\"\n\nerror-stack-parser@^1.3.6:\n  version \"1.3.6\"\n  resolved \"https://registry.yarnpkg.com/error-stack-parser/-/error-stack-parser-1.3.6.tgz#e0e73b93e417138d1cd7c0b746b1a4a14854c292\"\n  dependencies:\n    stackframe \"^0.3.1\"\n\nes5-ext@^0.10.7, es5-ext@^0.10.8, es5-ext@~0.10.11, es5-ext@~0.10.2, es5-ext@~0.10.7:\n  version \"0.10.12\"\n  resolved \"https://registry.yarnpkg.com/es5-ext/-/es5-ext-0.10.12.tgz#aa84641d4db76b62abba5e45fd805ecbab140047\"\n  dependencies:\n    es6-iterator \"2\"\n    es6-symbol \"~3.1\"\n\nes6-iterator@2:\n  version \"2.0.0\"\n  resolved \"https://registry.yarnpkg.com/es6-iterator/-/es6-iterator-2.0.0.tgz#bd968567d61635e33c0b80727613c9cb4b096bac\"\n  dependencies:\n    d \"^0.1.1\"\n    es5-ext \"^0.10.7\"\n    es6-symbol \"3\"\n\nes6-map@^0.1.3:\n  version \"0.1.4\"\n  resolved \"https://registry.yarnpkg.com/es6-map/-/es6-map-0.1.4.tgz#a34b147be224773a4d7da8072794cefa3632b897\"\n  dependencies:\n    d \"~0.1.1\"\n    es5-ext \"~0.10.11\"\n    es6-iterator \"2\"\n    es6-set \"~0.1.3\"\n    es6-symbol \"~3.1.0\"\n    event-emitter \"~0.3.4\"\n\nes6-promise@2.1.1:\n  version \"2.1.1\"\n  resolved \"https://registry.yarnpkg.com/es6-promise/-/es6-promise-2.1.1.tgz#03e8f3c7297928e5478d6ab1d0643251507bdedd\"\n\nes6-promise@3.2.1:\n  version \"3.2.1\"\n  resolved \"https://registry.yarnpkg.com/es6-promise/-/es6-promise-3.2.1.tgz#ec56233868032909207170c39448e24449dd1fc4\"\n\nes6-promise@^3.0.2:\n  version \"3.3.1\"\n  resolved \"https://registry.yarnpkg.com/es6-promise/-/es6-promise-3.3.1.tgz#a08cdde84ccdbf34d027a1451bc91d4bcd28a613\"\n\nes6-set@~0.1.3:\n  version \"0.1.4\"\n  resolved \"https://registry.yarnpkg.com/es6-set/-/es6-set-0.1.4.tgz#9516b6761c2964b92ff479456233a247dc707ce8\"\n  dependencies:\n    d \"~0.1.1\"\n    es5-ext \"~0.10.11\"\n    es6-iterator \"2\"\n    es6-symbol \"3\"\n    event-emitter \"~0.3.4\"\n\nes6-symbol@3, es6-symbol@~3.1, es6-symbol@~3.1.0:\n  version \"3.1.0\"\n  resolved \"https://registry.yarnpkg.com/es6-symbol/-/es6-symbol-3.1.0.tgz#94481c655e7a7cad82eba832d97d5433496d7ffa\"\n  dependencies:\n    d \"~0.1.1\"\n    es5-ext \"~0.10.11\"\n\nes6-weak-map@^2.0.1:\n  version \"2.0.1\"\n  resolved \"https://registry.yarnpkg.com/es6-weak-map/-/es6-weak-map-2.0.1.tgz#0d2bbd8827eb5fb4ba8f97fbfea50d43db21ea81\"\n  dependencies:\n    d \"^0.1.1\"\n    es5-ext \"^0.10.8\"\n    es6-iterator \"2\"\n    es6-symbol \"3\"\n\nescape-html@~1.0.3:\n  version \"1.0.3\"\n  resolved \"https://registry.yarnpkg.com/escape-html/-/escape-html-1.0.3.tgz#0258eae4d3d0c0974de1c169188ef0051d1d1988\"\n\nescape-string-regexp@^1.0.0, escape-string-regexp@^1.0.2, escape-string-regexp@^1.0.5:\n  version \"1.0.5\"\n  resolved \"https://registry.yarnpkg.com/escape-string-regexp/-/escape-string-regexp-1.0.5.tgz#1b61c0562190a8dff6ae3bb2cf0200ca130b86d4\"\n\nescodegen@^1.6.1:\n  version \"1.8.1\"\n  resolved \"https://registry.yarnpkg.com/escodegen/-/escodegen-1.8.1.tgz#5a5b53af4693110bebb0867aa3430dd3b70a1018\"\n  dependencies:\n    esprima \"^2.7.1\"\n    estraverse \"^1.9.1\"\n    esutils \"^2.0.2\"\n    optionator \"^0.8.1\"\n  optionalDependencies:\n    source-map \"~0.2.0\"\n\nescope@^3.6.0:\n  version \"3.6.0\"\n  resolved \"https://registry.yarnpkg.com/escope/-/escope-3.6.0.tgz#e01975e812781a163a6dadfdd80398dc64c889c3\"\n  dependencies:\n    es6-map \"^0.1.3\"\n    es6-weak-map \"^2.0.1\"\n    esrecurse \"^4.1.0\"\n    estraverse \"^4.1.1\"\n\neslint-config-airbnb@^7.0.0:\n  version \"7.0.0\"\n  resolved \"https://registry.yarnpkg.com/eslint-config-airbnb/-/eslint-config-airbnb-7.0.0.tgz#ea20532459694b59a78e608fd2f62ba2b60a3d57\"\n\neslint-plugin-jsx-a11y@^0.6.2:\n  version \"0.6.2\"\n  resolved \"https://registry.yarnpkg.com/eslint-plugin-jsx-a11y/-/eslint-plugin-jsx-a11y-0.6.2.tgz#e4f0125df05aa713627fddf5dd861524b57083f0\"\n\neslint-plugin-react@^4.2.2:\n  version \"4.3.0\"\n  resolved \"https://registry.yarnpkg.com/eslint-plugin-react/-/eslint-plugin-react-4.3.0.tgz#c79aac8069d62de27887c13b8298d592088de378\"\n\neslint@^2.8.0:\n  version \"2.13.1\"\n  resolved \"https://registry.yarnpkg.com/eslint/-/eslint-2.13.1.tgz#e4cc8fa0f009fb829aaae23855a29360be1f6c11\"\n  dependencies:\n    chalk \"^1.1.3\"\n    concat-stream \"^1.4.6\"\n    debug \"^2.1.1\"\n    doctrine \"^1.2.2\"\n    es6-map \"^0.1.3\"\n    escope \"^3.6.0\"\n    espree \"^3.1.6\"\n    estraverse \"^4.2.0\"\n    esutils \"^2.0.2\"\n    file-entry-cache \"^1.1.1\"\n    glob \"^7.0.3\"\n    globals \"^9.2.0\"\n    ignore \"^3.1.2\"\n    imurmurhash \"^0.1.4\"\n    inquirer \"^0.12.0\"\n    is-my-json-valid \"^2.10.0\"\n    is-resolvable \"^1.0.0\"\n    js-yaml \"^3.5.1\"\n    json-stable-stringify \"^1.0.0\"\n    levn \"^0.3.0\"\n    lodash \"^4.0.0\"\n    mkdirp \"^0.5.0\"\n    optionator \"^0.8.1\"\n    path-is-absolute \"^1.0.0\"\n    path-is-inside \"^1.0.1\"\n    pluralize \"^1.2.1\"\n    progress \"^1.1.8\"\n    require-uncached \"^1.0.2\"\n    shelljs \"^0.6.0\"\n    strip-json-comments \"~1.0.1\"\n    table \"^3.7.8\"\n    text-table \"~0.2.0\"\n    user-home \"^2.0.0\"\n\nespree@^3.1.6:\n  version \"3.3.2\"\n  resolved \"https://registry.yarnpkg.com/espree/-/espree-3.3.2.tgz#dbf3fadeb4ecb4d4778303e50103b3d36c88b89c\"\n  dependencies:\n    acorn \"^4.0.1\"\n    acorn-jsx \"^3.0.0\"\n\nesprima@^2.6.0, esprima@^2.7.1:\n  version \"2.7.3\"\n  resolved \"https://registry.yarnpkg.com/esprima/-/esprima-2.7.3.tgz#96e3b70d5779f6ad49cd032673d1c312767ba581\"\n\nesprima@~3.0.0:\n  version \"3.0.0\"\n  resolved \"https://registry.yarnpkg.com/esprima/-/esprima-3.0.0.tgz#53cf247acda77313e551c3aa2e73342d3fb4f7d9\"\n\nesrecurse@^4.1.0:\n  version \"4.1.0\"\n  resolved \"https://registry.yarnpkg.com/esrecurse/-/esrecurse-4.1.0.tgz#4713b6536adf7f2ac4f327d559e7756bff648220\"\n  dependencies:\n    estraverse \"~4.1.0\"\n    object-assign \"^4.0.1\"\n\nestraverse@^1.9.1:\n  version \"1.9.3\"\n  resolved \"https://registry.yarnpkg.com/estraverse/-/estraverse-1.9.3.tgz#af67f2dc922582415950926091a4005d29c9bb44\"\n\nestraverse@^4.1.1, estraverse@^4.2.0:\n  version \"4.2.0\"\n  resolved \"https://registry.yarnpkg.com/estraverse/-/estraverse-4.2.0.tgz#0dee3fed31fcd469618ce7342099fc1afa0bdb13\"\n\nestraverse@~4.1.0:\n  version \"4.1.1\"\n  resolved \"https://registry.yarnpkg.com/estraverse/-/estraverse-4.1.1.tgz#f6caca728933a850ef90661d0e17982ba47111a2\"\n\nesutils@^2.0.0, esutils@^2.0.2:\n  version \"2.0.2\"\n  resolved \"https://registry.yarnpkg.com/esutils/-/esutils-2.0.2.tgz#0abf4f1caa5bcb1f7a9d8acc6dea4faaa04bac9b\"\n\netag@~1.7.0:\n  version \"1.7.0\"\n  resolved \"https://registry.yarnpkg.com/etag/-/etag-1.7.0.tgz#03d30b5f67dd6e632d2945d30d6652731a34d5d8\"\n\nevent-emitter@~0.3.4:\n  version \"0.3.4\"\n  resolved \"https://registry.yarnpkg.com/event-emitter/-/event-emitter-0.3.4.tgz#8d63ddfb4cfe1fae3b32ca265c4c720222080bb5\"\n  dependencies:\n    d \"~0.1.1\"\n    es5-ext \"~0.10.7\"\n\nevent-stream@~3.3.0:\n  version \"3.3.4\"\n  resolved \"https://registry.yarnpkg.com/event-stream/-/event-stream-3.3.4.tgz#4ab4c9a0f5a54db9338b4c34d86bfce8f4b35571\"\n  dependencies:\n    duplexer \"~0.1.1\"\n    from \"~0\"\n    map-stream \"~0.1.0\"\n    pause-stream \"0.0.11\"\n    split \"0.3\"\n    stream-combiner \"~0.0.4\"\n    through \"~2.3.1\"\n\neventemitter3@1.x.x:\n  version \"1.2.0\"\n  resolved \"https://registry.yarnpkg.com/eventemitter3/-/eventemitter3-1.2.0.tgz#1c86991d816ad1e504750e73874224ecf3bec508\"\n\nevents@^1.0.0:\n  version \"1.1.1\"\n  resolved \"https://registry.yarnpkg.com/events/-/events-1.1.1.tgz#9ebdb7635ad099c70dcc4c2a1f5004288e8bd924\"\n\neventsource@~0.1.6:\n  version \"0.1.6\"\n  resolved \"https://registry.yarnpkg.com/eventsource/-/eventsource-0.1.6.tgz#0acede849ed7dd1ccc32c811bb11b944d4f29232\"\n  dependencies:\n    original \">=0.0.5\"\n\nexec-sh@^0.2.0:\n  version \"0.2.0\"\n  resolved \"https://registry.yarnpkg.com/exec-sh/-/exec-sh-0.2.0.tgz#14f75de3f20d286ef933099b2ce50a90359cef10\"\n  dependencies:\n    merge \"^1.1.3\"\n\nexit-hook@^1.0.0:\n  version \"1.1.1\"\n  resolved \"https://registry.yarnpkg.com/exit-hook/-/exit-hook-1.1.1.tgz#f05ca233b48c05d54fff07765df8507e95c02ff8\"\n\nexpand-brackets@^0.1.4:\n  version \"0.1.5\"\n  resolved \"https://registry.yarnpkg.com/expand-brackets/-/expand-brackets-0.1.5.tgz#df07284e342a807cd733ac5af72411e581d1177b\"\n  dependencies:\n    is-posix-bracket \"^0.1.0\"\n\nexpand-range@^1.8.1:\n  version \"1.8.2\"\n  resolved \"https://registry.yarnpkg.com/expand-range/-/expand-range-1.8.2.tgz#a299effd335fe2721ebae8e257ec79644fc85337\"\n  dependencies:\n    fill-range \"^2.1.0\"\n\nexpress-graphql@^0.4.0:\n  version \"0.4.13\"\n  resolved \"https://registry.yarnpkg.com/express-graphql/-/express-graphql-0.4.13.tgz#bb99901dc181a1a74ccab494606f7a021ec7e30d\"\n  dependencies:\n    content-type \"~1.0.1\"\n    http-errors \"~1.3.1\"\n    raw-body \"~2.1.2\"\n\nexpress-session@^1.11.3:\n  version \"1.14.2\"\n  resolved \"https://registry.yarnpkg.com/express-session/-/express-session-1.14.2.tgz#6bcf586ed6d1dc37b02570087756c9de7b80b275\"\n  dependencies:\n    cookie \"0.3.1\"\n    cookie-signature \"1.0.6\"\n    crc \"3.4.1\"\n    debug \"~2.2.0\"\n    depd \"~1.1.0\"\n    on-headers \"~1.0.1\"\n    parseurl \"~1.3.1\"\n    uid-safe \"~2.1.3\"\n    utils-merge \"1.0.0\"\n\nexpress@^4.13.3:\n  version \"4.14.0\"\n  resolved \"https://registry.yarnpkg.com/express/-/express-4.14.0.tgz#c1ee3f42cdc891fb3dc650a8922d51ec847d0d66\"\n  dependencies:\n    accepts \"~1.3.3\"\n    array-flatten \"1.1.1\"\n    content-disposition \"0.5.1\"\n    content-type \"~1.0.2\"\n    cookie \"0.3.1\"\n    cookie-signature \"1.0.6\"\n    debug \"~2.2.0\"\n    depd \"~1.1.0\"\n    encodeurl \"~1.0.1\"\n    escape-html \"~1.0.3\"\n    etag \"~1.7.0\"\n    finalhandler \"0.5.0\"\n    fresh \"0.3.0\"\n    merge-descriptors \"1.0.1\"\n    methods \"~1.1.2\"\n    on-finished \"~2.3.0\"\n    parseurl \"~1.3.1\"\n    path-to-regexp \"0.1.7\"\n    proxy-addr \"~1.1.2\"\n    qs \"6.2.0\"\n    range-parser \"~1.2.0\"\n    send \"0.14.1\"\n    serve-static \"~1.11.1\"\n    type-is \"~1.6.13\"\n    utils-merge \"1.0.0\"\n    vary \"~1.1.0\"\n\nextend@3.0.0, extend@~3.0.0:\n  version \"3.0.0\"\n  resolved \"https://registry.yarnpkg.com/extend/-/extend-3.0.0.tgz#5a474353b9f3353ddd8176dfd37b91c83a46f1d4\"\n\nextglob@^0.3.1:\n  version \"0.3.2\"\n  resolved \"https://registry.yarnpkg.com/extglob/-/extglob-0.3.2.tgz#2e18ff3d2f49ab2765cec9023f011daa8d8349a1\"\n  dependencies:\n    is-extglob \"^1.0.0\"\n\nextract-text-webpack-plugin@^1.0.1:\n  version \"1.0.1\"\n  resolved \"https://registry.yarnpkg.com/extract-text-webpack-plugin/-/extract-text-webpack-plugin-1.0.1.tgz#c95bf3cbaac49dc96f1dc6e072549fbb654ccd2c\"\n  dependencies:\n    async \"^1.5.0\"\n    loader-utils \"^0.2.3\"\n    webpack-sources \"^0.1.0\"\n\nextsprintf@1.0.2:\n  version \"1.0.2\"\n  resolved \"https://registry.yarnpkg.com/extsprintf/-/extsprintf-1.0.2.tgz#e1080e0658e300b06294990cc70e1502235fd550\"\n\neyes@0.1.x:\n  version \"0.1.8\"\n  resolved \"https://registry.yarnpkg.com/eyes/-/eyes-0.1.8.tgz#62cf120234c683785d902348a800ef3e0cc20bc0\"\n\nfast-levenshtein@~2.0.4:\n  version \"2.0.5\"\n  resolved \"https://registry.yarnpkg.com/fast-levenshtein/-/fast-levenshtein-2.0.5.tgz#bd33145744519ab1c36c3ee9f31f08e9079b67f2\"\n\nfastparse@^1.1.1:\n  version \"1.1.1\"\n  resolved \"https://registry.yarnpkg.com/fastparse/-/fastparse-1.1.1.tgz#d1e2643b38a94d7583b479060e6c4affc94071f8\"\n\nfaye-websocket@^0.10.0:\n  version \"0.10.0\"\n  resolved \"https://registry.yarnpkg.com/faye-websocket/-/faye-websocket-0.10.0.tgz#4e492f8d04dfb6f89003507f6edbf2d501e7c6f4\"\n  dependencies:\n    websocket-driver \">=0.5.1\"\n\nfaye-websocket@~0.11.0:\n  version \"0.11.0\"\n  resolved \"https://registry.yarnpkg.com/faye-websocket/-/faye-websocket-0.11.0.tgz#d9ccf0e789e7db725d74bc4877d23aa42972ac50\"\n  dependencies:\n    websocket-driver \">=0.5.1\"\n\nfb-watchman@^1.8.0, fb-watchman@^1.9.0:\n  version \"1.9.0\"\n  resolved \"https://registry.yarnpkg.com/fb-watchman/-/fb-watchman-1.9.0.tgz#6f268f1f347a6b3c875d1e89da7e1ed79adfc0ec\"\n  dependencies:\n    bser \"^1.0.2\"\n\nfbjs@^0.8.1, fbjs@^0.8.4:\n  version \"0.8.6\"\n  resolved \"https://registry.yarnpkg.com/fbjs/-/fbjs-0.8.6.tgz#7eb67d6986b2d5007a9b6e92e0e7cb6f75cad290\"\n  dependencies:\n    core-js \"^1.0.0\"\n    isomorphic-fetch \"^2.1.1\"\n    loose-envify \"^1.0.0\"\n    object-assign \"^4.1.0\"\n    promise \"^7.1.1\"\n    ua-parser-js \"^0.7.9\"\n\nfbjs@^0.8.9:\n  version \"0.8.14\"\n  resolved \"https://registry.yarnpkg.com/fbjs/-/fbjs-0.8.14.tgz#d1dbe2be254c35a91e09f31f9cd50a40b2a0ed1c\"\n  dependencies:\n    core-js \"^1.0.0\"\n    isomorphic-fetch \"^2.1.1\"\n    loose-envify \"^1.0.0\"\n    object-assign \"^4.1.0\"\n    promise \"^7.1.1\"\n    setimmediate \"^1.0.5\"\n    ua-parser-js \"^0.7.9\"\n\nfigures@^1.3.5:\n  version \"1.7.0\"\n  resolved \"https://registry.yarnpkg.com/figures/-/figures-1.7.0.tgz#cbe1e3affcf1cd44b80cadfed28dc793a9701d2e\"\n  dependencies:\n    escape-string-regexp \"^1.0.5\"\n    object-assign \"^4.1.0\"\n\nfile-entry-cache@^1.1.1:\n  version \"1.3.1\"\n  resolved \"https://registry.yarnpkg.com/file-entry-cache/-/file-entry-cache-1.3.1.tgz#44c61ea607ae4be9c1402f41f44270cbfe334ff8\"\n  dependencies:\n    flat-cache \"^1.2.1\"\n    object-assign \"^4.0.1\"\n\nfile-loader@^0.8.4:\n  version \"0.8.5\"\n  resolved \"https://registry.yarnpkg.com/file-loader/-/file-loader-0.8.5.tgz#9275d031fe780f27d47f5f4af02bd43713cc151b\"\n  dependencies:\n    loader-utils \"~0.2.5\"\n\nfile-size@^1.0.0:\n  version \"1.0.0\"\n  resolved \"https://registry.yarnpkg.com/file-size/-/file-size-1.0.0.tgz#3338267d5d206bbf60f4df60c19d7ed3813a4657\"\n\nfilename-regex@^2.0.0:\n  version \"2.0.0\"\n  resolved \"https://registry.yarnpkg.com/filename-regex/-/filename-regex-2.0.0.tgz#996e3e80479b98b9897f15a8a58b3d084e926775\"\n\nfileset@0.2.x:\n  version \"0.2.1\"\n  resolved \"https://registry.yarnpkg.com/fileset/-/fileset-0.2.1.tgz#588ef8973c6623b2a76df465105696b96aac8067\"\n  dependencies:\n    glob \"5.x\"\n    minimatch \"2.x\"\n\nfill-range@^2.1.0:\n  version \"2.2.3\"\n  resolved \"https://registry.yarnpkg.com/fill-range/-/fill-range-2.2.3.tgz#50b77dfd7e469bc7492470963699fe7a8485a723\"\n  dependencies:\n    is-number \"^2.1.0\"\n    isobject \"^2.0.0\"\n    randomatic \"^1.1.3\"\n    repeat-element \"^1.1.2\"\n    repeat-string \"^1.5.2\"\n\nfinalhandler@0.5.0:\n  version \"0.5.0\"\n  resolved \"https://registry.yarnpkg.com/finalhandler/-/finalhandler-0.5.0.tgz#e9508abece9b6dba871a6942a1d7911b91911ac7\"\n  dependencies:\n    debug \"~2.2.0\"\n    escape-html \"~1.0.3\"\n    on-finished \"~2.3.0\"\n    statuses \"~1.3.0\"\n    unpipe \"~1.0.0\"\n\nfind-up@^1.0.0, find-up@^1.1.2:\n  version \"1.1.2\"\n  resolved \"https://registry.yarnpkg.com/find-up/-/find-up-1.1.2.tgz#6b2e9822b1a2ce0a60ab64d610eccad53cb24d0f\"\n  dependencies:\n    path-exists \"^2.0.0\"\n    pinkie-promise \"^2.0.0\"\n\nflat-cache@^1.2.1:\n  version \"1.2.1\"\n  resolved \"https://registry.yarnpkg.com/flat-cache/-/flat-cache-1.2.1.tgz#6c837d6225a7de5659323740b36d5361f71691ff\"\n  dependencies:\n    circular-json \"^0.3.0\"\n    del \"^2.0.2\"\n    graceful-fs \"^4.1.2\"\n    write \"^0.2.1\"\n\nflatten@^1.0.2:\n  version \"1.0.2\"\n  resolved \"https://registry.yarnpkg.com/flatten/-/flatten-1.0.2.tgz#dae46a9d78fbe25292258cc1e780a41d95c03782\"\n\nfor-in@^0.1.5:\n  version \"0.1.6\"\n  resolved \"https://registry.yarnpkg.com/for-in/-/for-in-0.1.6.tgz#c9f96e89bfad18a545af5ec3ed352a1d9e5b4dc8\"\n\nfor-own@^0.1.4:\n  version \"0.1.4\"\n  resolved \"https://registry.yarnpkg.com/for-own/-/for-own-0.1.4.tgz#0149b41a39088c7515f51ebe1c1386d45f935072\"\n  dependencies:\n    for-in \"^0.1.5\"\n\nforever-agent@~0.6.1:\n  version \"0.6.1\"\n  resolved \"https://registry.yarnpkg.com/forever-agent/-/forever-agent-0.6.1.tgz#fbc71f0c41adeb37f96c577ad1ed42d8fdacca91\"\n\nform-data@1.0.0-rc3:\n  version \"1.0.0-rc3\"\n  resolved \"https://registry.yarnpkg.com/form-data/-/form-data-1.0.0-rc3.tgz#d35bc62e7fbc2937ae78f948aaa0d38d90607577\"\n  dependencies:\n    async \"^1.4.0\"\n    combined-stream \"^1.0.5\"\n    mime-types \"^2.1.3\"\n\nform-data@~2.1.1:\n  version \"2.1.2\"\n  resolved \"https://registry.yarnpkg.com/form-data/-/form-data-2.1.2.tgz#89c3534008b97eada4cbb157d58f6f5df025eae4\"\n  dependencies:\n    asynckit \"^0.4.0\"\n    combined-stream \"^1.0.5\"\n    mime-types \"^2.1.12\"\n\nformidable@~1.0.14:\n  version \"1.0.17\"\n  resolved \"https://registry.yarnpkg.com/formidable/-/formidable-1.0.17.tgz#ef5491490f9433b705faa77249c99029ae348559\"\n\nforwarded@~0.1.0:\n  version \"0.1.0\"\n  resolved \"https://registry.yarnpkg.com/forwarded/-/forwarded-0.1.0.tgz#19ef9874c4ae1c297bcf078fde63a09b66a84363\"\n\nfresh@0.3.0:\n  version \"0.3.0\"\n  resolved \"https://registry.yarnpkg.com/fresh/-/fresh-0.3.0.tgz#651f838e22424e7566de161d8358caa199f83d4f\"\n\nfrom@~0:\n  version \"0.1.3\"\n  resolved \"https://registry.yarnpkg.com/from/-/from-0.1.3.tgz#ef63ac2062ac32acf7862e0d40b44b896f22f3bc\"\n\nfs-extra@^0.26.4:\n  version \"0.26.7\"\n  resolved \"https://registry.yarnpkg.com/fs-extra/-/fs-extra-0.26.7.tgz#9ae1fdd94897798edab76d0918cf42d0c3184fa9\"\n  dependencies:\n    graceful-fs \"^4.1.2\"\n    jsonfile \"^2.1.0\"\n    klaw \"^1.0.0\"\n    path-is-absolute \"^1.0.0\"\n    rimraf \"^2.2.8\"\n\nfs.realpath@^1.0.0:\n  version \"1.0.0\"\n  resolved \"https://registry.yarnpkg.com/fs.realpath/-/fs.realpath-1.0.0.tgz#1504ad2523158caa40db4a2787cb01411994ea4f\"\n\nfsevents@^1.0.0:\n  version \"1.0.15\"\n  resolved \"https://registry.yarnpkg.com/fsevents/-/fsevents-1.0.15.tgz#fa63f590f3c2ad91275e4972a6cea545fb0aae44\"\n  dependencies:\n    nan \"^2.3.0\"\n    node-pre-gyp \"^0.6.29\"\n\nfstream-ignore@~1.0.5:\n  version \"1.0.5\"\n  resolved \"https://registry.yarnpkg.com/fstream-ignore/-/fstream-ignore-1.0.5.tgz#9c31dae34767018fe1d249b24dada67d092da105\"\n  dependencies:\n    fstream \"^1.0.0\"\n    inherits \"2\"\n    minimatch \"^3.0.0\"\n\nfstream@^1.0.0, fstream@^1.0.2, fstream@~1.0.10:\n  version \"1.0.10\"\n  resolved \"https://registry.yarnpkg.com/fstream/-/fstream-1.0.10.tgz#604e8a92fe26ffd9f6fae30399d4984e1ab22822\"\n  dependencies:\n    graceful-fs \"^4.1.2\"\n    inherits \"~2.0.0\"\n    mkdirp \">=0.5 0\"\n    rimraf \"2\"\n\nfunction-bind@^1.0.2:\n  version \"1.1.0\"\n  resolved \"https://registry.yarnpkg.com/function-bind/-/function-bind-1.1.0.tgz#16176714c801798e4e8f2cf7f7529467bb4a5771\"\n\ngauge@~2.7.1:\n  version \"2.7.1\"\n  resolved \"https://registry.yarnpkg.com/gauge/-/gauge-2.7.1.tgz#388473894fe8be5e13ffcdb8b93e4ed0616428c7\"\n  dependencies:\n    aproba \"^1.0.3\"\n    console-control-strings \"^1.0.0\"\n    has-color \"^0.1.7\"\n    has-unicode \"^2.0.0\"\n    object-assign \"^4.1.0\"\n    signal-exit \"^3.0.0\"\n    string-width \"^1.0.1\"\n    strip-ansi \"^3.0.1\"\n    wide-align \"^1.1.0\"\n\ngemini-scrollbar@1.3.x:\n  version \"1.3.2\"\n  resolved \"https://registry.yarnpkg.com/gemini-scrollbar/-/gemini-scrollbar-1.3.2.tgz#aa9692a829eec4efcc05975e7378decd3f9916ed\"\n\ngenerate-function@^2.0.0:\n  version \"2.0.0\"\n  resolved \"https://registry.yarnpkg.com/generate-function/-/generate-function-2.0.0.tgz#6858fe7c0969b7d4e9093337647ac79f60dfbe74\"\n\ngenerate-object-property@^1.1.0:\n  version \"1.2.0\"\n  resolved \"https://registry.yarnpkg.com/generate-object-property/-/generate-object-property-1.2.0.tgz#9c0e1c40308ce804f4783618b937fa88f99d50d0\"\n  dependencies:\n    is-property \"^1.0.0\"\n\ngeneraterr@^1.2.0:\n  version \"1.5.0\"\n  resolved \"https://registry.yarnpkg.com/generaterr/-/generaterr-1.5.0.tgz#b0ceb6cc5164df2a061338cc340a8615395c52fc\"\n\nget-caller-file@^1.0.1:\n  version \"1.0.2\"\n  resolved \"https://registry.yarnpkg.com/get-caller-file/-/get-caller-file-1.0.2.tgz#f702e63127e7e231c160a80c1554acb70d5047e5\"\n\ngetpass@^0.1.1:\n  version \"0.1.6\"\n  resolved \"https://registry.yarnpkg.com/getpass/-/getpass-0.1.6.tgz#283ffd9fc1256840875311c1b60e8c40187110e6\"\n  dependencies:\n    assert-plus \"^1.0.0\"\n\nglob-base@^0.3.0:\n  version \"0.3.0\"\n  resolved \"https://registry.yarnpkg.com/glob-base/-/glob-base-0.3.0.tgz#dbb164f6221b1c0b1ccf82aea328b497df0ea3c4\"\n  dependencies:\n    glob-parent \"^2.0.0\"\n    is-glob \"^2.0.0\"\n\nglob-parent@^2.0.0:\n  version \"2.0.0\"\n  resolved \"https://registry.yarnpkg.com/glob-parent/-/glob-parent-2.0.0.tgz#81383d72db054fcccf5336daa902f182f6edbb28\"\n  dependencies:\n    is-glob \"^2.0.0\"\n\nglob@5.x:\n  version \"5.0.15\"\n  resolved \"https://registry.yarnpkg.com/glob/-/glob-5.0.15.tgz#1bc936b9e02f4a603fcc222ecf7633d30b8b93b1\"\n  dependencies:\n    inflight \"^1.0.4\"\n    inherits \"2\"\n    minimatch \"2 || 3\"\n    once \"^1.3.0\"\n    path-is-absolute \"^1.0.0\"\n\nglob@^6.0.4:\n  version \"6.0.4\"\n  resolved \"https://registry.yarnpkg.com/glob/-/glob-6.0.4.tgz#0f08860f6a155127b2fadd4f9ce24b1aab6e4d22\"\n  dependencies:\n    inflight \"^1.0.4\"\n    inherits \"2\"\n    minimatch \"2 || 3\"\n    once \"^1.3.0\"\n    path-is-absolute \"^1.0.0\"\n\nglob@^7.0.3, glob@^7.0.5, glob@^7.0.6:\n  version \"7.1.1\"\n  resolved \"https://registry.yarnpkg.com/glob/-/glob-7.1.1.tgz#805211df04faaf1c63a3600306cdf5ade50b2ec8\"\n  dependencies:\n    fs.realpath \"^1.0.0\"\n    inflight \"^1.0.4\"\n    inherits \"2\"\n    minimatch \"^3.0.2\"\n    once \"^1.3.0\"\n    path-is-absolute \"^1.0.0\"\n\nglobal@^4.3.0:\n  version \"4.3.1\"\n  resolved \"https://registry.yarnpkg.com/global/-/global-4.3.1.tgz#5f757908c7cbabce54f386ae440e11e26b7916df\"\n  dependencies:\n    min-document \"^2.19.0\"\n    process \"~0.5.1\"\n\nglobals@^9.0.0, globals@^9.2.0:\n  version \"9.13.0\"\n  resolved \"https://registry.yarnpkg.com/globals/-/globals-9.13.0.tgz#d97706b61600d8dbe94708c367d3fdcf48470b8f\"\n\nglobby@^5.0.0:\n  version \"5.0.0\"\n  resolved \"https://registry.yarnpkg.com/globby/-/globby-5.0.0.tgz#ebd84667ca0dbb330b99bcfc68eac2bc54370e0d\"\n  dependencies:\n    array-union \"^1.0.1\"\n    arrify \"^1.0.0\"\n    glob \"^7.0.3\"\n    object-assign \"^4.0.1\"\n    pify \"^2.0.0\"\n    pinkie-promise \"^2.0.0\"\n\ngoogle-maps-infobox@^1.1.13:\n  version \"1.1.13\"\n  resolved \"https://registry.yarnpkg.com/google-maps-infobox/-/google-maps-infobox-1.1.13.tgz#eb3a453220db4cab4e1f404e37da71e2155e24d7\"\n\ngot@^3.2.0:\n  version \"3.3.1\"\n  resolved \"https://registry.yarnpkg.com/got/-/got-3.3.1.tgz#e5d0ed4af55fc3eef4d56007769d98192bcb2eca\"\n  dependencies:\n    duplexify \"^3.2.0\"\n    infinity-agent \"^2.0.0\"\n    is-redirect \"^1.0.0\"\n    is-stream \"^1.0.0\"\n    lowercase-keys \"^1.0.0\"\n    nested-error-stacks \"^1.0.0\"\n    object-assign \"^3.0.0\"\n    prepend-http \"^1.0.0\"\n    read-all-stream \"^3.0.0\"\n    timed-out \"^2.0.0\"\n\ngraceful-fs@^4.1.2, graceful-fs@^4.1.6, graceful-fs@^4.1.9:\n  version \"4.1.10\"\n  resolved \"https://registry.yarnpkg.com/graceful-fs/-/graceful-fs-4.1.10.tgz#f2d720c22092f743228775c75e3612632501f131\"\n\n\"graceful-readlink@>= 1.0.0\":\n  version \"1.0.1\"\n  resolved \"https://registry.yarnpkg.com/graceful-readlink/-/graceful-readlink-1.0.1.tgz#4cafad76bc62f02fa039b2f94e9a3dd3a391a725\"\n\ngraphql-type-json@^0.1.2:\n  version \"0.1.4\"\n  resolved \"https://registry.yarnpkg.com/graphql-type-json/-/graphql-type-json-0.1.4.tgz#89f13f5d32ce08c9a76c79fdf9c1968384d81a4e\"\n\ngraphql@^0.4.7:\n  version \"0.4.18\"\n  resolved \"https://registry.yarnpkg.com/graphql/-/graphql-0.4.18.tgz#80b923f2d801e5373df99316b9c5829f206c482c\"\n  dependencies:\n    babel-runtime \"^5.8.x\"\n\ngrowly@^1.2.0:\n  version \"1.3.0\"\n  resolved \"https://registry.yarnpkg.com/growly/-/growly-1.3.0.tgz#f10748cbe76af964b7c96c93c6bcc28af120c081\"\n\nhandlebars@^4.0.3:\n  version \"4.0.6\"\n  resolved \"https://registry.yarnpkg.com/handlebars/-/handlebars-4.0.6.tgz#2ce4484850537f9c97a8026d5399b935c4ed4ed7\"\n  dependencies:\n    async \"^1.4.0\"\n    optimist \"^0.6.1\"\n    source-map \"^0.4.4\"\n  optionalDependencies:\n    uglify-js \"^2.6\"\n\nhar-validator@~2.0.6:\n  version \"2.0.6\"\n  resolved \"https://registry.yarnpkg.com/har-validator/-/har-validator-2.0.6.tgz#cdcbc08188265ad119b6a5a7c8ab70eecfb5d27d\"\n  dependencies:\n    chalk \"^1.1.1\"\n    commander \"^2.9.0\"\n    is-my-json-valid \"^2.12.4\"\n    pinkie-promise \"^2.0.0\"\n\nhas-ansi@^0.1.0:\n  version \"0.1.0\"\n  resolved \"https://registry.yarnpkg.com/has-ansi/-/has-ansi-0.1.0.tgz#84f265aae8c0e6a88a12d7022894b7568894c62e\"\n  dependencies:\n    ansi-regex \"^0.2.0\"\n\nhas-ansi@^2.0.0:\n  version \"2.0.0\"\n  resolved \"https://registry.yarnpkg.com/has-ansi/-/has-ansi-2.0.0.tgz#34f5049ce1ecdf2b0649af3ef24e45ed35416d91\"\n  dependencies:\n    ansi-regex \"^2.0.0\"\n\nhas-color@^0.1.7:\n  version \"0.1.7\"\n  resolved \"https://registry.yarnpkg.com/has-color/-/has-color-0.1.7.tgz#67144a5260c34fc3cca677d041daf52fe7b78b2f\"\n\nhas-flag@^1.0.0:\n  version \"1.0.0\"\n  resolved \"https://registry.yarnpkg.com/has-flag/-/has-flag-1.0.0.tgz#9d9e793165ce017a00f00418c43f942a7b1d11fa\"\n\nhas-unicode@^2.0.0:\n  version \"2.0.1\"\n  resolved \"https://registry.yarnpkg.com/has-unicode/-/has-unicode-2.0.1.tgz#e0e6fe6a28cf51138855e086d1691e771de2a8b9\"\n\nhas@^1.0.1:\n  version \"1.0.1\"\n  resolved \"https://registry.yarnpkg.com/has/-/has-1.0.1.tgz#8461733f538b0837c9361e39a9ab9e9704dc2f28\"\n  dependencies:\n    function-bind \"^1.0.2\"\n\nhawk@~3.1.3:\n  version \"3.1.3\"\n  resolved \"https://registry.yarnpkg.com/hawk/-/hawk-3.1.3.tgz#078444bd7c1640b0fe540d2c9b73d59678e8e1c4\"\n  dependencies:\n    boom \"2.x.x\"\n    cryptiles \"2.x.x\"\n    hoek \"2.x.x\"\n    sntp \"1.x.x\"\n\nhistory@1.17.0:\n  version \"1.17.0\"\n  resolved \"https://registry.yarnpkg.com/history/-/history-1.17.0.tgz#c5483caa5a1d1fea00a1a7d8d19b874016711d29\"\n  dependencies:\n    deep-equal \"^1.0.0\"\n    invariant \"^2.0.0\"\n    query-string \"^3.0.0\"\n    warning \"^2.0.0\"\n\nhistory@^2.1.2:\n  version \"2.1.2\"\n  resolved \"https://registry.yarnpkg.com/history/-/history-2.1.2.tgz#4aa2de897a0e4867e4539843be6ecdb2986bfdec\"\n  dependencies:\n    deep-equal \"^1.0.0\"\n    invariant \"^2.0.0\"\n    query-string \"^3.0.0\"\n    warning \"^2.0.0\"\n\nhoek@2.x.x:\n  version \"2.16.3\"\n  resolved \"https://registry.yarnpkg.com/hoek/-/hoek-2.16.3.tgz#20bb7403d3cea398e91dc4710a8ff1b8274a25ed\"\n\nhoist-non-react-statics, hoist-non-react-statics@^1.0.3, hoist-non-react-statics@^1.1.0, hoist-non-react-statics@^1.2.0:\n  version \"1.2.0\"\n  resolved \"https://registry.yarnpkg.com/hoist-non-react-statics/-/hoist-non-react-statics-1.2.0.tgz#aa448cf0986d55cc40773b17174b7dd066cb7cfb\"\n\nhome-or-tmp@^2.0.0:\n  version \"2.0.0\"\n  resolved \"https://registry.yarnpkg.com/home-or-tmp/-/home-or-tmp-2.0.0.tgz#e36c3f2d2cae7d746a857e38d18d5f32a7882db8\"\n  dependencies:\n    os-homedir \"^1.0.0\"\n    os-tmpdir \"^1.0.1\"\n\nhooks-fixed@1.2.0:\n  version \"1.2.0\"\n  resolved \"https://registry.yarnpkg.com/hooks-fixed/-/hooks-fixed-1.2.0.tgz#0d2772d4d7d685ff9244724a9f0b5b2559aac96b\"\n\nhosted-git-info@^2.1.4:\n  version \"2.1.5\"\n  resolved \"https://registry.yarnpkg.com/hosted-git-info/-/hosted-git-info-2.1.5.tgz#0ba81d90da2e25ab34a332e6ec77936e1598118b\"\n\nhtml-comment-regex@^1.1.0:\n  version \"1.1.1\"\n  resolved \"https://registry.yarnpkg.com/html-comment-regex/-/html-comment-regex-1.1.1.tgz#668b93776eaae55ebde8f3ad464b307a4963625e\"\n\nhtml-encoding-sniffer@^1.0.1:\n  version \"1.0.1\"\n  resolved \"https://registry.yarnpkg.com/html-encoding-sniffer/-/html-encoding-sniffer-1.0.1.tgz#79bf7a785ea495fe66165e734153f363ff5437da\"\n  dependencies:\n    whatwg-encoding \"^1.0.1\"\n\nhtml-entities@^1.2.0:\n  version \"1.2.0\"\n  resolved \"https://registry.yarnpkg.com/html-entities/-/html-entities-1.2.0.tgz#41948caf85ce82fed36e4e6a0ed371a6664379e2\"\n\nhttp-browserify@^1.3.2:\n  version \"1.7.0\"\n  resolved \"https://registry.yarnpkg.com/http-browserify/-/http-browserify-1.7.0.tgz#33795ade72df88acfbfd36773cefeda764735b20\"\n  dependencies:\n    Base64 \"~0.2.0\"\n    inherits \"~2.0.1\"\n\nhttp-errors@~1.3.1:\n  version \"1.3.1\"\n  resolved \"https://registry.yarnpkg.com/http-errors/-/http-errors-1.3.1.tgz#197e22cdebd4198585e8694ef6786197b91ed942\"\n  dependencies:\n    inherits \"~2.0.1\"\n    statuses \"1\"\n\nhttp-errors@~1.5.0:\n  version \"1.5.1\"\n  resolved \"https://registry.yarnpkg.com/http-errors/-/http-errors-1.5.1.tgz#788c0d2c1de2c81b9e6e8c01843b6b97eb920750\"\n  dependencies:\n    inherits \"2.0.3\"\n    setprototypeof \"1.0.2\"\n    statuses \">= 1.3.1 < 2\"\n\nhttp-proxy-middleware@~0.17.1:\n  version \"0.17.2\"\n  resolved \"https://registry.yarnpkg.com/http-proxy-middleware/-/http-proxy-middleware-0.17.2.tgz#572d517a6d2fb1063a469de294eed96066352007\"\n  dependencies:\n    http-proxy \"^1.15.1\"\n    is-glob \"^3.0.0\"\n    lodash \"^4.16.2\"\n    micromatch \"^2.3.11\"\n\nhttp-proxy@^1.15.1:\n  version \"1.15.2\"\n  resolved \"https://registry.yarnpkg.com/http-proxy/-/http-proxy-1.15.2.tgz#642fdcaffe52d3448d2bda3b0079e9409064da31\"\n  dependencies:\n    eventemitter3 \"1.x.x\"\n    requires-port \"1.x.x\"\n\nhttp-signature@~1.1.0:\n  version \"1.1.1\"\n  resolved \"https://registry.yarnpkg.com/http-signature/-/http-signature-1.1.1.tgz#df72e267066cd0ac67fb76adf8e134a8fbcf91bf\"\n  dependencies:\n    assert-plus \"^0.2.0\"\n    jsprim \"^1.2.2\"\n    sshpk \"^1.7.0\"\n\nhttps-browserify@0.0.0:\n  version \"0.0.0\"\n  resolved \"https://registry.yarnpkg.com/https-browserify/-/https-browserify-0.0.0.tgz#b3ffdfe734b2a3d4a9efd58e8654c91fce86eafd\"\n\niconv-lite@0.4.13, iconv-lite@^0.4.13, iconv-lite@^0.4.4, iconv-lite@~0.4.13:\n  version \"0.4.13\"\n  resolved \"https://registry.yarnpkg.com/iconv-lite/-/iconv-lite-0.4.13.tgz#1f88aba4ab0b1508e8312acc39345f36e992e2f2\"\n\nicss-replace-symbols@^1.0.2:\n  version \"1.0.2\"\n  resolved \"https://registry.yarnpkg.com/icss-replace-symbols/-/icss-replace-symbols-1.0.2.tgz#cb0b6054eb3af6edc9ab1d62d01933e2d4c8bfa5\"\n\nieee754@^1.1.4:\n  version \"1.1.8\"\n  resolved \"https://registry.yarnpkg.com/ieee754/-/ieee754-1.1.8.tgz#be33d40ac10ef1926701f6f08a2d86fbfd1ad3e4\"\n\nignore-by-default@^1.0.0:\n  version \"1.0.1\"\n  resolved \"https://registry.yarnpkg.com/ignore-by-default/-/ignore-by-default-1.0.1.tgz#48ca6d72f6c6a3af00a9ad4ae6876be3889e2b09\"\n\nignore@^3.1.2:\n  version \"3.2.0\"\n  resolved \"https://registry.yarnpkg.com/ignore/-/ignore-3.2.0.tgz#8d88f03c3002a0ac52114db25d2c673b0bf1e435\"\n\nimage-size@~0.5.0:\n  version \"0.5.0\"\n  resolved \"https://registry.yarnpkg.com/image-size/-/image-size-0.5.0.tgz#be7aed1c37b5ac3d9ba1d66a24b4c47ff8397651\"\n\nimport-sort-style-renke@^2.4.0:\n  version \"2.4.0\"\n  resolved \"https://registry.yarnpkg.com/import-sort-style-renke/-/import-sort-style-renke-2.4.0.tgz#405bb9e6a533d5d75cba20f8936521f1f9e67a09\"\n\nimurmurhash@^0.1.4:\n  version \"0.1.4\"\n  resolved \"https://registry.yarnpkg.com/imurmurhash/-/imurmurhash-0.1.4.tgz#9218b9b2b928a238b13dc4fb6b6d576f231453ea\"\n\nindexes-of@^1.0.1:\n  version \"1.0.1\"\n  resolved \"https://registry.yarnpkg.com/indexes-of/-/indexes-of-1.0.1.tgz#f30f716c8e2bd346c7b67d3df3915566a7c05607\"\n\nindexof@0.0.1:\n  version \"0.0.1\"\n  resolved \"https://registry.yarnpkg.com/indexof/-/indexof-0.0.1.tgz#82dc336d232b9062179d05ab3293a66059fd435d\"\n\ninfinity-agent@^2.0.0:\n  version \"2.0.3\"\n  resolved \"https://registry.yarnpkg.com/infinity-agent/-/infinity-agent-2.0.3.tgz#45e0e2ff7a9eb030b27d62b74b3744b7a7ac4216\"\n\ninflight@^1.0.4:\n  version \"1.0.6\"\n  resolved \"https://registry.yarnpkg.com/inflight/-/inflight-1.0.6.tgz#49bd6331d7d02d0c09bc910a1075ba8165b56df9\"\n  dependencies:\n    once \"^1.3.0\"\n    wrappy \"1\"\n\ninherits@2, inherits@2.0.3, inherits@^2.0.1, inherits@~2.0.0, inherits@~2.0.1:\n  version \"2.0.3\"\n  resolved \"https://registry.yarnpkg.com/inherits/-/inherits-2.0.3.tgz#633c2c83e3da42a502f52466022480f4208261de\"\n\ninherits@2.0.1:\n  version \"2.0.1\"\n  resolved \"https://registry.yarnpkg.com/inherits/-/inherits-2.0.1.tgz#b17d08d326b4423e568eff719f91b0b1cbdf69f1\"\n\nini@~1.3.0:\n  version \"1.3.4\"\n  resolved \"https://registry.yarnpkg.com/ini/-/ini-1.3.4.tgz#0537cb79daf59b59a1a517dff706c86ec039162e\"\n\ninquirer@^0.12.0:\n  version \"0.12.0\"\n  resolved \"https://registry.yarnpkg.com/inquirer/-/inquirer-0.12.0.tgz#1ef2bfd63504df0bc75785fff8c2c41df12f077e\"\n  dependencies:\n    ansi-escapes \"^1.1.0\"\n    ansi-regex \"^2.0.0\"\n    chalk \"^1.0.0\"\n    cli-cursor \"^1.0.1\"\n    cli-width \"^2.0.0\"\n    figures \"^1.3.5\"\n    lodash \"^4.3.0\"\n    readline2 \"^1.0.1\"\n    run-async \"^0.1.0\"\n    rx-lite \"^3.1.2\"\n    string-width \"^1.0.1\"\n    strip-ansi \"^3.0.0\"\n    through \"^2.3.6\"\n\ninterpret@^0.6.4:\n  version \"0.6.6\"\n  resolved \"https://registry.yarnpkg.com/interpret/-/interpret-0.6.6.tgz#fecd7a18e7ce5ca6abfb953e1f86213a49f1625b\"\n\ninvariant@^2.0.0, invariant@^2.1.1, invariant@^2.2.0, invariant@^2.2.1:\n  version \"2.2.2\"\n  resolved \"https://registry.yarnpkg.com/invariant/-/invariant-2.2.2.tgz#9e1f56ac0acdb6bf303306f338be3b204ae60360\"\n  dependencies:\n    loose-envify \"^1.0.0\"\n\ninvert-kv@^1.0.0:\n  version \"1.0.0\"\n  resolved \"https://registry.yarnpkg.com/invert-kv/-/invert-kv-1.0.0.tgz#104a8e4aaca6d3d8cd157a8ef8bfab2d7a3ffdb6\"\n\nipaddr.js@1.1.1:\n  version \"1.1.1\"\n  resolved \"https://registry.yarnpkg.com/ipaddr.js/-/ipaddr.js-1.1.1.tgz#c791d95f52b29c1247d5df80ada39b8a73647230\"\n\nis-absolute-url@^2.0.0:\n  version \"2.0.0\"\n  resolved \"https://registry.yarnpkg.com/is-absolute-url/-/is-absolute-url-2.0.0.tgz#9c4b20b0e5c0cbef9a479a367ede6f991679f359\"\n\nis-arrayish@^0.2.1:\n  version \"0.2.1\"\n  resolved \"https://registry.yarnpkg.com/is-arrayish/-/is-arrayish-0.2.1.tgz#77c99840527aa8ecb1a8ba697b80645a7a926a9d\"\n\nis-binary-path@^1.0.0:\n  version \"1.0.1\"\n  resolved \"https://registry.yarnpkg.com/is-binary-path/-/is-binary-path-1.0.1.tgz#75f16642b480f187a711c814161fd3a4a7655898\"\n  dependencies:\n    binary-extensions \"^1.0.0\"\n\nis-buffer@^1.0.2:\n  version \"1.1.4\"\n  resolved \"https://registry.yarnpkg.com/is-buffer/-/is-buffer-1.1.4.tgz#cfc86ccd5dc5a52fa80489111c6920c457e2d98b\"\n\nis-builtin-module@^1.0.0:\n  version \"1.0.0\"\n  resolved \"https://registry.yarnpkg.com/is-builtin-module/-/is-builtin-module-1.0.0.tgz#540572d34f7ac3119f8f76c30cbc1b1e037affbe\"\n  dependencies:\n    builtin-modules \"^1.0.0\"\n\nis-ci@^1.0.9:\n  version \"1.0.10\"\n  resolved \"https://registry.yarnpkg.com/is-ci/-/is-ci-1.0.10.tgz#f739336b2632365061a9d48270cd56ae3369318e\"\n  dependencies:\n    ci-info \"^1.0.0\"\n\nis-dotfile@^1.0.0:\n  version \"1.0.2\"\n  resolved \"https://registry.yarnpkg.com/is-dotfile/-/is-dotfile-1.0.2.tgz#2c132383f39199f8edc268ca01b9b007d205cc4d\"\n\nis-equal-shallow@^0.1.3:\n  version \"0.1.3\"\n  resolved \"https://registry.yarnpkg.com/is-equal-shallow/-/is-equal-shallow-0.1.3.tgz#2238098fc221de0bcfa5d9eac4c45d638aa1c534\"\n  dependencies:\n    is-primitive \"^2.0.0\"\n\nis-extendable@^0.1.1:\n  version \"0.1.1\"\n  resolved \"https://registry.yarnpkg.com/is-extendable/-/is-extendable-0.1.1.tgz#62b110e289a471418e3ec36a617d472e301dfc89\"\n\nis-extglob@^1.0.0:\n  version \"1.0.0\"\n  resolved \"https://registry.yarnpkg.com/is-extglob/-/is-extglob-1.0.0.tgz#ac468177c4943405a092fc8f29760c6ffc6206c0\"\n\nis-extglob@^2.1.0:\n  version \"2.1.0\"\n  resolved \"https://registry.yarnpkg.com/is-extglob/-/is-extglob-2.1.0.tgz#33411a482b046bf95e6b0cb27ee2711af4cf15ad\"\n\nis-finite@^1.0.0:\n  version \"1.0.2\"\n  resolved \"https://registry.yarnpkg.com/is-finite/-/is-finite-1.0.2.tgz#cc6677695602be550ef11e8b4aa6305342b6d0aa\"\n  dependencies:\n    number-is-nan \"^1.0.0\"\n\nis-fullwidth-code-point@^1.0.0:\n  version \"1.0.0\"\n  resolved \"https://registry.yarnpkg.com/is-fullwidth-code-point/-/is-fullwidth-code-point-1.0.0.tgz#ef9e31386f031a7f0d643af82fde50c457ef00cb\"\n  dependencies:\n    number-is-nan \"^1.0.0\"\n\nis-fullwidth-code-point@^2.0.0:\n  version \"2.0.0\"\n  resolved \"https://registry.yarnpkg.com/is-fullwidth-code-point/-/is-fullwidth-code-point-2.0.0.tgz#a3b30a5c4f199183167aaab93beefae3ddfb654f\"\n\nis-glob@^2.0.0, is-glob@^2.0.1:\n  version \"2.0.1\"\n  resolved \"https://registry.yarnpkg.com/is-glob/-/is-glob-2.0.1.tgz#d096f926a3ded5600f3fdfd91198cb0888c2d863\"\n  dependencies:\n    is-extglob \"^1.0.0\"\n\nis-glob@^3.0.0:\n  version \"3.1.0\"\n  resolved \"https://registry.yarnpkg.com/is-glob/-/is-glob-3.1.0.tgz#7ba5ae24217804ac70707b96922567486cc3e84a\"\n  dependencies:\n    is-extglob \"^2.1.0\"\n\nis-my-json-valid@^2.10.0, is-my-json-valid@^2.12.4:\n  version \"2.15.0\"\n  resolved \"https://registry.yarnpkg.com/is-my-json-valid/-/is-my-json-valid-2.15.0.tgz#936edda3ca3c211fd98f3b2d3e08da43f7b2915b\"\n  dependencies:\n    generate-function \"^2.0.0\"\n    generate-object-property \"^1.1.0\"\n    jsonpointer \"^4.0.0\"\n    xtend \"^4.0.0\"\n\nis-npm@^1.0.0:\n  version \"1.0.0\"\n  resolved \"https://registry.yarnpkg.com/is-npm/-/is-npm-1.0.0.tgz#f2fb63a65e4905b406c86072765a1a4dc793b9f4\"\n\nis-number@^2.0.2, is-number@^2.1.0:\n  version \"2.1.0\"\n  resolved \"https://registry.yarnpkg.com/is-number/-/is-number-2.1.0.tgz#01fcbbb393463a548f2f466cce16dece49db908f\"\n  dependencies:\n    kind-of \"^3.0.2\"\n\nis-path-cwd@^1.0.0:\n  version \"1.0.0\"\n  resolved \"https://registry.yarnpkg.com/is-path-cwd/-/is-path-cwd-1.0.0.tgz#d225ec23132e89edd38fda767472e62e65f1106d\"\n\nis-path-in-cwd@^1.0.0:\n  version \"1.0.0\"\n  resolved \"https://registry.yarnpkg.com/is-path-in-cwd/-/is-path-in-cwd-1.0.0.tgz#6477582b8214d602346094567003be8a9eac04dc\"\n  dependencies:\n    is-path-inside \"^1.0.0\"\n\nis-path-inside@^1.0.0:\n  version \"1.0.0\"\n  resolved \"https://registry.yarnpkg.com/is-path-inside/-/is-path-inside-1.0.0.tgz#fc06e5a1683fbda13de667aff717bbc10a48f37f\"\n  dependencies:\n    path-is-inside \"^1.0.1\"\n\nis-plain-obj@^1.0.0:\n  version \"1.1.0\"\n  resolved \"https://registry.yarnpkg.com/is-plain-obj/-/is-plain-obj-1.1.0.tgz#71a50c8429dfca773c92a390a4a03b39fcd51d3e\"\n\nis-posix-bracket@^0.1.0:\n  version \"0.1.1\"\n  resolved \"https://registry.yarnpkg.com/is-posix-bracket/-/is-posix-bracket-0.1.1.tgz#3334dc79774368e92f016e6fbc0a88f5cd6e6bc4\"\n\nis-primitive@^2.0.0:\n  version \"2.0.0\"\n  resolved \"https://registry.yarnpkg.com/is-primitive/-/is-primitive-2.0.0.tgz#207bab91638499c07b2adf240a41a87210034575\"\n\nis-property@^1.0.0:\n  version \"1.0.2\"\n  resolved \"https://registry.yarnpkg.com/is-property/-/is-property-1.0.2.tgz#57fe1c4e48474edd65b09911f26b1cd4095dda84\"\n\nis-redirect@^1.0.0:\n  version \"1.0.0\"\n  resolved \"https://registry.yarnpkg.com/is-redirect/-/is-redirect-1.0.0.tgz#1d03dded53bd8db0f30c26e4f95d36fc7c87dc24\"\n\nis-resolvable@^1.0.0:\n  version \"1.0.0\"\n  resolved \"https://registry.yarnpkg.com/is-resolvable/-/is-resolvable-1.0.0.tgz#8df57c61ea2e3c501408d100fb013cf8d6e0cc62\"\n  dependencies:\n    tryit \"^1.0.1\"\n\nis-stream@^1.0.0, is-stream@^1.0.1:\n  version \"1.1.0\"\n  resolved \"https://registry.yarnpkg.com/is-stream/-/is-stream-1.1.0.tgz#12d4a3dd4e68e0b79ceb8dbc84173ae80d91ca44\"\n\nis-svg@^2.0.0:\n  version \"2.1.0\"\n  resolved \"https://registry.yarnpkg.com/is-svg/-/is-svg-2.1.0.tgz#cf61090da0d9efbcab8722deba6f032208dbb0e9\"\n  dependencies:\n    html-comment-regex \"^1.1.0\"\n\nis-typedarray@~1.0.0:\n  version \"1.0.0\"\n  resolved \"https://registry.yarnpkg.com/is-typedarray/-/is-typedarray-1.0.0.tgz#e479c80858df0c1b11ddda6940f96011fcda4a9a\"\n\nis-utf8@^0.2.0:\n  version \"0.2.1\"\n  resolved \"https://registry.yarnpkg.com/is-utf8/-/is-utf8-0.2.1.tgz#4b0da1442104d1b336340e80797e865cf39f7d72\"\n\nisarray@0.0.1:\n  version \"0.0.1\"\n  resolved \"https://registry.yarnpkg.com/isarray/-/isarray-0.0.1.tgz#8a18acfca9a8f4177e09abfc6038939b05d1eedf\"\n\nisarray@1.0.0, isarray@^1.0.0, isarray@~1.0.0:\n  version \"1.0.0\"\n  resolved \"https://registry.yarnpkg.com/isarray/-/isarray-1.0.0.tgz#bb935d48582cba168c06834957a54a3e07124f11\"\n\nisexe@^1.1.1:\n  version \"1.1.2\"\n  resolved \"https://registry.yarnpkg.com/isexe/-/isexe-1.1.2.tgz#36f3e22e60750920f5e7241a476a8c6a42275ad0\"\n\nisobject@^2.0.0:\n  version \"2.1.0\"\n  resolved \"https://registry.yarnpkg.com/isobject/-/isobject-2.1.0.tgz#f065561096a3f1da2ef46272f815c840d87e0c89\"\n  dependencies:\n    isarray \"1.0.0\"\n\nisomorphic-fetch@^2.1.1:\n  version \"2.2.1\"\n  resolved \"https://registry.yarnpkg.com/isomorphic-fetch/-/isomorphic-fetch-2.2.1.tgz#611ae1acf14f5e81f729507472819fe9733558a9\"\n  dependencies:\n    node-fetch \"^1.0.1\"\n    whatwg-fetch \">=0.10.0\"\n\nisstream@0.1.x, isstream@~0.1.2:\n  version \"0.1.2\"\n  resolved \"https://registry.yarnpkg.com/isstream/-/isstream-0.1.2.tgz#47e63f7af55afa6f92e1500e690eb8b8529c099a\"\n\nistanbul-api@^1.0.0-aplha.10:\n  version \"1.0.0-aplha.10\"\n  resolved \"https://registry.yarnpkg.com/istanbul-api/-/istanbul-api-1.0.0-aplha.10.tgz#902edf5cf5404e0eba7e00ef46408488a0d3e337\"\n  dependencies:\n    async \"1.x\"\n    clone \"^1.0.2\"\n    fileset \"0.2.x\"\n    istanbul-lib-coverage \"^1.0.0-alpha\"\n    istanbul-lib-hook \"^1.0.0-alpha\"\n    istanbul-lib-instrument \"^1.0.0-alpha\"\n    istanbul-lib-report \"^1.0.0-alpha\"\n    istanbul-lib-source-maps \"^1.0.0-alpha\"\n    istanbul-reports \"^1.0.0-alpha\"\n    js-yaml \"3.x\"\n    mkdirp \"0.5.x\"\n    once \"1.x\"\n\nistanbul-lib-coverage@^1.0.0, istanbul-lib-coverage@^1.0.0-alpha, istanbul-lib-coverage@^1.0.0-alpha.0:\n  version \"1.0.0\"\n  resolved \"https://registry.yarnpkg.com/istanbul-lib-coverage/-/istanbul-lib-coverage-1.0.0.tgz#c3f9b6d226da12424064cce87fce0fb57fdfa7a2\"\n\nistanbul-lib-hook@^1.0.0-alpha:\n  version \"1.0.0-alpha.4\"\n  resolved \"https://registry.yarnpkg.com/istanbul-lib-hook/-/istanbul-lib-hook-1.0.0-alpha.4.tgz#8c5bb9f6fbd8526e0ae6cf639af28266906b938f\"\n  dependencies:\n    append-transform \"^0.3.0\"\n\nistanbul-lib-instrument@^1.0.0-alpha, istanbul-lib-instrument@^1.1.1, istanbul-lib-instrument@^1.1.4:\n  version \"1.3.0\"\n  resolved \"https://registry.yarnpkg.com/istanbul-lib-instrument/-/istanbul-lib-instrument-1.3.0.tgz#19f0a973397454989b98330333063a5b56df0e58\"\n  dependencies:\n    babel-generator \"^6.18.0\"\n    babel-template \"^6.16.0\"\n    babel-traverse \"^6.18.0\"\n    babel-types \"^6.18.0\"\n    babylon \"^6.13.0\"\n    istanbul-lib-coverage \"^1.0.0\"\n    semver \"^5.3.0\"\n\nistanbul-lib-report@^1.0.0-alpha:\n  version \"1.0.0-alpha.3\"\n  resolved \"https://registry.yarnpkg.com/istanbul-lib-report/-/istanbul-lib-report-1.0.0-alpha.3.tgz#32d5f6ec7f33ca3a602209e278b2e6ff143498af\"\n  dependencies:\n    async \"^1.4.2\"\n    istanbul-lib-coverage \"^1.0.0-alpha\"\n    mkdirp \"^0.5.1\"\n    path-parse \"^1.0.5\"\n    rimraf \"^2.4.3\"\n    supports-color \"^3.1.2\"\n\nistanbul-lib-source-maps@^1.0.0-alpha:\n  version \"1.1.0\"\n  resolved \"https://registry.yarnpkg.com/istanbul-lib-source-maps/-/istanbul-lib-source-maps-1.1.0.tgz#9d429218f35b823560ea300a96ff0c3bbdab785f\"\n  dependencies:\n    istanbul-lib-coverage \"^1.0.0-alpha.0\"\n    mkdirp \"^0.5.1\"\n    rimraf \"^2.4.4\"\n    source-map \"^0.5.3\"\n\nistanbul-reports@^1.0.0-alpha:\n  version \"1.0.0\"\n  resolved \"https://registry.yarnpkg.com/istanbul-reports/-/istanbul-reports-1.0.0.tgz#24b4eb2b1d29d50f103b369bd422f6e640aa0777\"\n  dependencies:\n    handlebars \"^4.0.3\"\n\njest:\n  version \"18.0.0\"\n  resolved \"https://registry.yarnpkg.com/jest/-/jest-18.0.0.tgz#ef12f70befe0fcb30f1c61c0ae58748706267d4b\"\n  dependencies:\n    jest-cli \"^18.0.0\"\n\njest-changed-files@^17.0.2:\n  version \"17.0.2\"\n  resolved \"https://registry.yarnpkg.com/jest-changed-files/-/jest-changed-files-17.0.2.tgz#f5657758736996f590a51b87e5c9369d904ba7b7\"\n\njest-cli@^18.0.0:\n  version \"18.0.0\"\n  resolved \"https://registry.yarnpkg.com/jest-cli/-/jest-cli-18.0.0.tgz#11d141f5e9158d4f02c5c303815b5280f6887c55\"\n  dependencies:\n    ansi-escapes \"^1.4.0\"\n    callsites \"^2.0.0\"\n    chalk \"^1.1.1\"\n    graceful-fs \"^4.1.6\"\n    is-ci \"^1.0.9\"\n    istanbul-api \"^1.0.0-aplha.10\"\n    istanbul-lib-coverage \"^1.0.0\"\n    istanbul-lib-instrument \"^1.1.1\"\n    jest-changed-files \"^17.0.2\"\n    jest-config \"^18.0.0\"\n    jest-environment-jsdom \"^18.0.0\"\n    jest-file-exists \"^17.0.0\"\n    jest-haste-map \"^18.0.0\"\n    jest-jasmine2 \"^18.0.0\"\n    jest-mock \"^18.0.0\"\n    jest-resolve \"^18.0.0\"\n    jest-resolve-dependencies \"^18.0.0\"\n    jest-runtime \"^18.0.0\"\n    jest-snapshot \"^18.0.0\"\n    jest-util \"^18.0.0\"\n    json-stable-stringify \"^1.0.0\"\n    node-notifier \"^4.6.1\"\n    sane \"~1.4.1\"\n    strip-ansi \"^3.0.1\"\n    throat \"^3.0.0\"\n    which \"^1.1.1\"\n    worker-farm \"^1.3.1\"\n    yargs \"^6.3.0\"\n\njest-config@^18.0.0:\n  version \"18.0.0\"\n  resolved \"https://registry.yarnpkg.com/jest-config/-/jest-config-18.0.0.tgz#21473ab68fef2fa79760d05419859b3c320e55e9\"\n  dependencies:\n    chalk \"^1.1.1\"\n    jest-environment-jsdom \"^18.0.0\"\n    jest-environment-node \"^18.0.0\"\n    jest-jasmine2 \"^18.0.0\"\n    jest-mock \"^18.0.0\"\n    jest-resolve \"^18.0.0\"\n    jest-util \"^18.0.0\"\n    json-stable-stringify \"^1.0.0\"\n\njest-diff@^18.0.0:\n  version \"18.0.0\"\n  resolved \"https://registry.yarnpkg.com/jest-diff/-/jest-diff-18.0.0.tgz#f24b6f8bedaae425548511ab45edbfb9fee930b7\"\n  dependencies:\n    chalk \"^1.1.3\"\n    diff \"^3.0.0\"\n    jest-matcher-utils \"^18.0.0\"\n    pretty-format \"^18.0.0\"\n\njest-environment-jsdom@^18.0.0:\n  version \"18.0.0\"\n  resolved \"https://registry.yarnpkg.com/jest-environment-jsdom/-/jest-environment-jsdom-18.0.0.tgz#7341266285abce09f13f60e9b49de899802b76c5\"\n  dependencies:\n    jest-mock \"^18.0.0\"\n    jest-util \"^18.0.0\"\n    jsdom \"^9.8.1\"\n\njest-environment-node@^18.0.0:\n  version \"18.0.0\"\n  resolved \"https://registry.yarnpkg.com/jest-environment-node/-/jest-environment-node-18.0.0.tgz#6f4947b324d6b4e17df20b1998f532c161a2821d\"\n  dependencies:\n    jest-mock \"^18.0.0\"\n    jest-util \"^18.0.0\"\n\njest-file-exists@^17.0.0:\n  version \"17.0.0\"\n  resolved \"https://registry.yarnpkg.com/jest-file-exists/-/jest-file-exists-17.0.0.tgz#7f63eb73a1c43a13f461be261768b45af2cdd169\"\n\njest-haste-map@^18.0.0:\n  version \"18.0.0\"\n  resolved \"https://registry.yarnpkg.com/jest-haste-map/-/jest-haste-map-18.0.0.tgz#707d3b5ae3bcbda971c39e8b911d20ad8502c748\"\n  dependencies:\n    fb-watchman \"^1.9.0\"\n    graceful-fs \"^4.1.6\"\n    multimatch \"^2.1.0\"\n    sane \"~1.4.1\"\n    worker-farm \"^1.3.1\"\n\njest-jasmine2@^18.0.0:\n  version \"18.0.0\"\n  resolved \"https://registry.yarnpkg.com/jest-jasmine2/-/jest-jasmine2-18.0.0.tgz#05a35ee8cf61dd6d6d04826aa0e5915a2167a877\"\n  dependencies:\n    graceful-fs \"^4.1.6\"\n    jest-matcher-utils \"^18.0.0\"\n    jest-matchers \"^18.0.0\"\n    jest-snapshot \"^18.0.0\"\n    jest-util \"^18.0.0\"\n\njest-matcher-utils@^18.0.0:\n  version \"18.0.0\"\n  resolved \"https://registry.yarnpkg.com/jest-matcher-utils/-/jest-matcher-utils-18.0.0.tgz#74ad046aeb9414094fc6cd0d313847e4311f8538\"\n  dependencies:\n    chalk \"^1.1.3\"\n    pretty-format \"^18.0.0\"\n\njest-matchers@^18.0.0:\n  version \"18.0.0\"\n  resolved \"https://registry.yarnpkg.com/jest-matchers/-/jest-matchers-18.0.0.tgz#d081e2dfd556a0c9f11c7fdc26dc1702fad50189\"\n  dependencies:\n    jest-diff \"^18.0.0\"\n    jest-matcher-utils \"^18.0.0\"\n    jest-util \"^18.0.0\"\n\njest-mock@^18.0.0:\n  version \"18.0.0\"\n  resolved \"https://registry.yarnpkg.com/jest-mock/-/jest-mock-18.0.0.tgz#5c248846ea33fa558b526f5312ab4a6765e489b3\"\n\njest-resolve-dependencies@^18.0.0:\n  version \"18.0.0\"\n  resolved \"https://registry.yarnpkg.com/jest-resolve-dependencies/-/jest-resolve-dependencies-18.0.0.tgz#a2980a634ae2554d8ed5922686883a2988979b70\"\n  dependencies:\n    jest-file-exists \"^17.0.0\"\n    jest-resolve \"^18.0.0\"\n\njest-resolve@^18.0.0:\n  version \"18.0.0\"\n  resolved \"https://registry.yarnpkg.com/jest-resolve/-/jest-resolve-18.0.0.tgz#a47b0b939d8c53fc79e907db0a5110384432f3c8\"\n  dependencies:\n    browser-resolve \"^1.11.2\"\n    jest-file-exists \"^17.0.0\"\n    jest-haste-map \"^18.0.0\"\n    resolve \"^1.1.6\"\n\njest-runtime@^18.0.0:\n  version \"18.0.0\"\n  resolved \"https://registry.yarnpkg.com/jest-runtime/-/jest-runtime-18.0.0.tgz#fff982dffe061b89bbea5c3b6f4d3fbf7b3cf56e\"\n  dependencies:\n    babel-core \"^6.0.0\"\n    babel-jest \"^18.0.0\"\n    babel-plugin-istanbul \"^3.0.0\"\n    chalk \"^1.1.3\"\n    graceful-fs \"^4.1.6\"\n    jest-config \"^18.0.0\"\n    jest-file-exists \"^17.0.0\"\n    jest-haste-map \"^18.0.0\"\n    jest-mock \"^18.0.0\"\n    jest-resolve \"^18.0.0\"\n    jest-snapshot \"^18.0.0\"\n    jest-util \"^18.0.0\"\n    json-stable-stringify \"^1.0.0\"\n    multimatch \"^2.1.0\"\n    yargs \"^6.3.0\"\n\njest-snapshot@^18.0.0:\n  version \"18.0.0\"\n  resolved \"https://registry.yarnpkg.com/jest-snapshot/-/jest-snapshot-18.0.0.tgz#3602c6b13cbf5788fd101bf0d73fc76104b88486\"\n  dependencies:\n    jest-diff \"^18.0.0\"\n    jest-file-exists \"^17.0.0\"\n    jest-matcher-utils \"^18.0.0\"\n    jest-util \"^18.0.0\"\n    natural-compare \"^1.4.0\"\n    pretty-format \"^18.0.0\"\n\njest-util@^18.0.0:\n  version \"18.0.0\"\n  resolved \"https://registry.yarnpkg.com/jest-util/-/jest-util-18.0.0.tgz#4ef7c397ad7e1ac8f9c63a482c12a31df5e376a7\"\n  dependencies:\n    chalk \"^1.1.1\"\n    diff \"^3.0.0\"\n    graceful-fs \"^4.1.6\"\n    jest-file-exists \"^17.0.0\"\n    jest-mock \"^18.0.0\"\n    mkdirp \"^0.5.1\"\n\njodid25519@^1.0.0:\n  version \"1.0.2\"\n  resolved \"https://registry.yarnpkg.com/jodid25519/-/jodid25519-1.0.2.tgz#06d4912255093419477d425633606e0e90782967\"\n  dependencies:\n    jsbn \"~0.1.0\"\n\n\"jquery@>= 1.4.3\":\n  version \"3.1.1\"\n  resolved \"https://registry.yarnpkg.com/jquery/-/jquery-3.1.1.tgz#347c1c21c7e004115e0a4da32cece041fad3c8a3\"\n\njs-base64@^2.1.9:\n  version \"2.1.9\"\n  resolved \"https://registry.yarnpkg.com/js-base64/-/js-base64-2.1.9.tgz#f0e80ae039a4bd654b5f281fc93f04a914a7fcce\"\n\njs-md5@^0.3.0:\n  version \"0.3.0\"\n  resolved \"https://registry.yarnpkg.com/js-md5/-/js-md5-0.3.0.tgz#56a6d70037bca65aff7f14ca43724e47a7825d12\"\n\njs-tokens@^2.0.0:\n  version \"2.0.0\"\n  resolved \"https://registry.yarnpkg.com/js-tokens/-/js-tokens-2.0.0.tgz#79903f5563ee778cc1162e6dcf1a0027c97f9cb5\"\n\njs-tokens@^3.0.0:\n  version \"3.0.2\"\n  resolved \"https://registry.yarnpkg.com/js-tokens/-/js-tokens-3.0.2.tgz#9866df395102130e38f7f996bceb65443209c25b\"\n\njs-yaml@3.x, js-yaml@^3.5.1:\n  version \"3.7.0\"\n  resolved \"https://registry.yarnpkg.com/js-yaml/-/js-yaml-3.7.0.tgz#5c967ddd837a9bfdca5f2de84253abe8a1c03b80\"\n  dependencies:\n    argparse \"^1.0.7\"\n    esprima \"^2.6.0\"\n\njs-yaml@~3.6.1:\n  version \"3.6.1\"\n  resolved \"https://registry.yarnpkg.com/js-yaml/-/js-yaml-3.6.1.tgz#6e5fe67d8b205ce4d22fad05b7781e8dadcc4b30\"\n  dependencies:\n    argparse \"^1.0.7\"\n    esprima \"^2.6.0\"\n\njsbn@~0.1.0:\n  version \"0.1.0\"\n  resolved \"https://registry.yarnpkg.com/jsbn/-/jsbn-0.1.0.tgz#650987da0dd74f4ebf5a11377a2aa2d273e97dfd\"\n\njsdom@^9.8.1:\n  version \"9.8.3\"\n  resolved \"https://registry.yarnpkg.com/jsdom/-/jsdom-9.8.3.tgz#fde29c109c32a1131e0b6c65914e64198f97c370\"\n  dependencies:\n    abab \"^1.0.0\"\n    acorn \"^2.4.0\"\n    acorn-globals \"^1.0.4\"\n    array-equal \"^1.0.0\"\n    content-type-parser \"^1.0.1\"\n    cssom \">= 0.3.0 < 0.4.0\"\n    cssstyle \">= 0.2.36 < 0.3.0\"\n    escodegen \"^1.6.1\"\n    html-encoding-sniffer \"^1.0.1\"\n    iconv-lite \"^0.4.13\"\n    nwmatcher \">= 1.3.7 < 2.0.0\"\n    parse5 \"^1.5.1\"\n    request \"^2.55.0\"\n    sax \"^1.1.4\"\n    symbol-tree \">= 3.1.0 < 4.0.0\"\n    tough-cookie \"^2.3.1\"\n    webidl-conversions \"^3.0.1\"\n    whatwg-encoding \"^1.0.1\"\n    whatwg-url \"^3.0.0\"\n    xml-name-validator \">= 2.0.1 < 3.0.0\"\n\njsesc@^1.3.0:\n  version \"1.3.0\"\n  resolved \"https://registry.yarnpkg.com/jsesc/-/jsesc-1.3.0.tgz#46c3fec8c1892b12b0833db9bc7622176dbab34b\"\n\njsesc@~0.5.0:\n  version \"0.5.0\"\n  resolved \"https://registry.yarnpkg.com/jsesc/-/jsesc-0.5.0.tgz#e7dee66e35d6fc16f710fe91d5cf69f70f08911d\"\n\njson-loader@^0.5.3:\n  version \"0.5.4\"\n  resolved \"https://registry.yarnpkg.com/json-loader/-/json-loader-0.5.4.tgz#8baa1365a632f58a3c46d20175fc6002c96e37de\"\n\njson-schema@0.2.3:\n  version \"0.2.3\"\n  resolved \"https://registry.yarnpkg.com/json-schema/-/json-schema-0.2.3.tgz#b480c892e59a2f05954ce727bd3f2a4e882f9e13\"\n\njson-stable-stringify@^1.0.0, json-stable-stringify@^1.0.1:\n  version \"1.0.1\"\n  resolved \"https://registry.yarnpkg.com/json-stable-stringify/-/json-stable-stringify-1.0.1.tgz#9a759d39c5f2ff503fd5300646ed445f88c4f9af\"\n  dependencies:\n    jsonify \"~0.0.0\"\n\njson-stringify-safe@~5.0.1:\n  version \"5.0.1\"\n  resolved \"https://registry.yarnpkg.com/json-stringify-safe/-/json-stringify-safe-5.0.1.tgz#1296a2d58fd45f19a0f6ce01d65701e2c735b6eb\"\n\njson3@^3.3.2:\n  version \"3.3.2\"\n  resolved \"https://registry.yarnpkg.com/json3/-/json3-3.3.2.tgz#3c0434743df93e2f5c42aee7b19bcb483575f4e1\"\n\njson5@^0.4.0:\n  version \"0.4.0\"\n  resolved \"https://registry.yarnpkg.com/json5/-/json5-0.4.0.tgz#054352e4c4c80c86c0923877d449de176a732c8d\"\n\njson5@^0.5.0:\n  version \"0.5.0\"\n  resolved \"https://registry.yarnpkg.com/json5/-/json5-0.5.0.tgz#9b20715b026cbe3778fd769edccd822d8332a5b2\"\n\njsonfile@^2.1.0:\n  version \"2.4.0\"\n  resolved \"https://registry.yarnpkg.com/jsonfile/-/jsonfile-2.4.0.tgz#3736a2b428b87bbda0cc83b53fa3d633a35c2ae8\"\n  optionalDependencies:\n    graceful-fs \"^4.1.6\"\n\njsonify@~0.0.0:\n  version \"0.0.0\"\n  resolved \"https://registry.yarnpkg.com/jsonify/-/jsonify-0.0.0.tgz#2c74b6ee41d93ca51b7b5aaee8f503631d252a73\"\n\njsonpointer@^4.0.0:\n  version \"4.0.0\"\n  resolved \"https://registry.yarnpkg.com/jsonpointer/-/jsonpointer-4.0.0.tgz#6661e161d2fc445f19f98430231343722e1fcbd5\"\n\njsprim@^1.2.2:\n  version \"1.3.1\"\n  resolved \"https://registry.yarnpkg.com/jsprim/-/jsprim-1.3.1.tgz#2a7256f70412a29ee3670aaca625994c4dcff252\"\n  dependencies:\n    extsprintf \"1.0.2\"\n    json-schema \"0.2.3\"\n    verror \"1.3.6\"\n\nkareem@1.1.3:\n  version \"1.1.3\"\n  resolved \"https://registry.yarnpkg.com/kareem/-/kareem-1.1.3.tgz#0877610d8879c38da62d1dbafde4e17f2692f041\"\n\nkerberos@^0.0.21:\n  version \"0.0.21\"\n  resolved \"https://registry.yarnpkg.com/kerberos/-/kerberos-0.0.21.tgz#414f7f947d45afff10406018f233bf471a1d1195\"\n  dependencies:\n    nan \"~2.3\"\n\n\"keymaster@git+https://github.com/relax/keymaster.git\":\n  version \"1.6.3\"\n  resolved \"git+https://github.com/relax/keymaster.git#192f4f587a42953227d9529cf6e6149ef1234395\"\n\nkind-of@^3.0.2:\n  version \"3.0.4\"\n  resolved \"https://registry.yarnpkg.com/kind-of/-/kind-of-3.0.4.tgz#7b8ecf18a4e17f8269d73b501c9f232c96887a74\"\n  dependencies:\n    is-buffer \"^1.0.2\"\n\nklaw@^1.0.0:\n  version \"1.3.1\"\n  resolved \"https://registry.yarnpkg.com/klaw/-/klaw-1.3.1.tgz#4088433b46b3b1ba259d78785d8e96f73ba02439\"\n  optionalDependencies:\n    graceful-fs \"^4.1.9\"\n\nlatest-version@^1.0.0:\n  version \"1.0.1\"\n  resolved \"https://registry.yarnpkg.com/latest-version/-/latest-version-1.0.1.tgz#72cfc46e3e8d1be651e1ebb54ea9f6ea96f374bb\"\n  dependencies:\n    package-json \"^1.0.0\"\n\nlazy-cache@^1.0.3:\n  version \"1.0.4\"\n  resolved \"https://registry.yarnpkg.com/lazy-cache/-/lazy-cache-1.0.4.tgz#a1d78fc3a50474cb80845d3b3b6e1da49a446e8e\"\n\nlcid@^1.0.0:\n  version \"1.0.0\"\n  resolved \"https://registry.yarnpkg.com/lcid/-/lcid-1.0.0.tgz#308accafa0bc483a3867b4b6f2b9506251d1b835\"\n  dependencies:\n    invert-kv \"^1.0.0\"\n\nless-loader@^2.2.2:\n  version \"2.2.3\"\n  resolved \"https://registry.yarnpkg.com/less-loader/-/less-loader-2.2.3.tgz#b6d8f8139c8493df09d992a93a00734b08f84528\"\n  dependencies:\n    loader-utils \"^0.2.5\"\n\nless@^2.6.0:\n  version \"2.7.1\"\n  resolved \"https://registry.yarnpkg.com/less/-/less-2.7.1.tgz#6cbfea22b3b830304e9a5fb371d54fa480c9d7cf\"\n  optionalDependencies:\n    errno \"^0.1.1\"\n    graceful-fs \"^4.1.2\"\n    image-size \"~0.5.0\"\n    mime \"^1.2.11\"\n    mkdirp \"^0.5.0\"\n    promise \"^7.1.1\"\n    source-map \"^0.5.3\"\n\nlevn@^0.3.0, levn@~0.3.0:\n  version \"0.3.0\"\n  resolved \"https://registry.yarnpkg.com/levn/-/levn-0.3.0.tgz#3b09924edf9f083c0490fdd4c0bc4421e04764ee\"\n  dependencies:\n    prelude-ls \"~1.1.2\"\n    type-check \"~0.3.2\"\n\nlibbase64@^0.1.0:\n  version \"0.1.0\"\n  resolved \"https://registry.yarnpkg.com/libbase64/-/libbase64-0.1.0.tgz#62351a839563ac5ff5bd26f12f60e9830bb751e6\"\n\nlibmime@^1.2.0:\n  version \"1.2.0\"\n  resolved \"https://registry.yarnpkg.com/libmime/-/libmime-1.2.0.tgz#8d84b4f3b225b3704410236ef494906436ba742b\"\n  dependencies:\n    iconv-lite \"^0.4.13\"\n    libbase64 \"^0.1.0\"\n    libqp \"^1.1.0\"\n\nlibqp@^1.1.0:\n  version \"1.1.0\"\n  resolved \"https://registry.yarnpkg.com/libqp/-/libqp-1.1.0.tgz#f5e6e06ad74b794fb5b5b66988bf728ef1dedbe8\"\n\nload-json-file@^1.0.0:\n  version \"1.1.0\"\n  resolved \"https://registry.yarnpkg.com/load-json-file/-/load-json-file-1.1.0.tgz#956905708d58b4bab4c2261b04f59f31c99374c0\"\n  dependencies:\n    graceful-fs \"^4.1.2\"\n    parse-json \"^2.2.0\"\n    pify \"^2.0.0\"\n    pinkie-promise \"^2.0.0\"\n    strip-bom \"^2.0.0\"\n\nloader-utils@0.2.x, loader-utils@^0.2.11, loader-utils@^0.2.14, loader-utils@^0.2.3, loader-utils@^0.2.5, loader-utils@^0.2.7, loader-utils@~0.2.2, loader-utils@~0.2.5:\n  version \"0.2.16\"\n  resolved \"https://registry.yarnpkg.com/loader-utils/-/loader-utils-0.2.16.tgz#f08632066ed8282835dff88dfb52704765adee6d\"\n  dependencies:\n    big.js \"^3.1.3\"\n    emojis-list \"^2.0.0\"\n    json5 \"^0.5.0\"\n    object-assign \"^4.0.1\"\n\nlodash-es@^4.2.0, lodash-es@^4.2.1:\n  version \"4.17.3\"\n  resolved \"https://registry.yarnpkg.com/lodash-es/-/lodash-es-4.17.3.tgz#567a08d2f0c91d92b31ce35c5565e1f337fb81db\"\n\nlodash._arraycopy@^3.0.0:\n  version \"3.0.0\"\n  resolved \"https://registry.yarnpkg.com/lodash._arraycopy/-/lodash._arraycopy-3.0.0.tgz#76e7b7c1f1fb92547374878a562ed06a3e50f6e1\"\n\nlodash._arrayeach@^3.0.0:\n  version \"3.0.0\"\n  resolved \"https://registry.yarnpkg.com/lodash._arrayeach/-/lodash._arrayeach-3.0.0.tgz#bab156b2a90d3f1bbd5c653403349e5e5933ef9e\"\n\nlodash._baseassign@^3.0.0:\n  version \"3.2.0\"\n  resolved \"https://registry.yarnpkg.com/lodash._baseassign/-/lodash._baseassign-3.2.0.tgz#8c38a099500f215ad09e59f1722fd0c52bfe0a4e\"\n  dependencies:\n    lodash._basecopy \"^3.0.0\"\n    lodash.keys \"^3.0.0\"\n\nlodash._baseclone@^3.0.0:\n  version \"3.3.0\"\n  resolved \"https://registry.yarnpkg.com/lodash._baseclone/-/lodash._baseclone-3.3.0.tgz#303519bf6393fe7e42f34d8b630ef7794e3542b7\"\n  dependencies:\n    lodash._arraycopy \"^3.0.0\"\n    lodash._arrayeach \"^3.0.0\"\n    lodash._baseassign \"^3.0.0\"\n    lodash._basefor \"^3.0.0\"\n    lodash.isarray \"^3.0.0\"\n    lodash.keys \"^3.0.0\"\n\nlodash._basecopy@^3.0.0:\n  version \"3.0.1\"\n  resolved \"https://registry.yarnpkg.com/lodash._basecopy/-/lodash._basecopy-3.0.1.tgz#8da0e6a876cf344c0ad8a54882111dd3c5c7ca36\"\n\nlodash._baseeach@^3.0.0:\n  version \"3.0.4\"\n  resolved \"https://registry.yarnpkg.com/lodash._baseeach/-/lodash._baseeach-3.0.4.tgz#cf8706572ca144e8d9d75227c990da982f932af3\"\n  dependencies:\n    lodash.keys \"^3.0.0\"\n\nlodash._baseflatten@^3.0.0:\n  version \"3.1.4\"\n  resolved \"https://registry.yarnpkg.com/lodash._baseflatten/-/lodash._baseflatten-3.1.4.tgz#0770ff80131af6e34f3b511796a7ba5214e65ff7\"\n  dependencies:\n    lodash.isarguments \"^3.0.0\"\n    lodash.isarray \"^3.0.0\"\n\nlodash._basefor@^3.0.0:\n  version \"3.0.3\"\n  resolved \"https://registry.yarnpkg.com/lodash._basefor/-/lodash._basefor-3.0.3.tgz#7550b4e9218ef09fad24343b612021c79b4c20c2\"\n\nlodash._baseisequal@^3.0.0:\n  version \"3.0.7\"\n  resolved \"https://registry.yarnpkg.com/lodash._baseisequal/-/lodash._baseisequal-3.0.7.tgz#d8025f76339d29342767dcc887ce5cb95a5b51f1\"\n  dependencies:\n    lodash.isarray \"^3.0.0\"\n    lodash.istypedarray \"^3.0.0\"\n    lodash.keys \"^3.0.0\"\n\nlodash._bindcallback@^3.0.0:\n  version \"3.0.1\"\n  resolved \"https://registry.yarnpkg.com/lodash._bindcallback/-/lodash._bindcallback-3.0.1.tgz#e531c27644cf8b57a99e17ed95b35c748789392e\"\n\nlodash._createassigner@^3.0.0:\n  version \"3.1.1\"\n  resolved \"https://registry.yarnpkg.com/lodash._createassigner/-/lodash._createassigner-3.1.1.tgz#838a5bae2fdaca63ac22dee8e19fa4e6d6970b11\"\n  dependencies:\n    lodash._bindcallback \"^3.0.0\"\n    lodash._isiterateecall \"^3.0.0\"\n    lodash.restparam \"^3.0.0\"\n\nlodash._createcompounder@^3.0.0:\n  version \"3.0.0\"\n  resolved \"https://registry.yarnpkg.com/lodash._createcompounder/-/lodash._createcompounder-3.0.0.tgz#5dd2cb55372d6e70e0e2392fb2304d6631091075\"\n  dependencies:\n    lodash.deburr \"^3.0.0\"\n    lodash.words \"^3.0.0\"\n\nlodash._getnative@^3.0.0:\n  version \"3.9.1\"\n  resolved \"https://registry.yarnpkg.com/lodash._getnative/-/lodash._getnative-3.9.1.tgz#570bc7dede46d61cdcde687d65d3eecbaa3aaff5\"\n\nlodash._isiterateecall@^3.0.0:\n  version \"3.0.9\"\n  resolved \"https://registry.yarnpkg.com/lodash._isiterateecall/-/lodash._isiterateecall-3.0.9.tgz#5203ad7ba425fae842460e696db9cf3e6aac057c\"\n\nlodash._pickbyarray@^3.0.0:\n  version \"3.0.2\"\n  resolved \"https://registry.yarnpkg.com/lodash._pickbyarray/-/lodash._pickbyarray-3.0.2.tgz#1f898d9607eb560b0e167384b77c7c6d108aa4c5\"\n\nlodash._pickbycallback@^3.0.0:\n  version \"3.0.0\"\n  resolved \"https://registry.yarnpkg.com/lodash._pickbycallback/-/lodash._pickbycallback-3.0.0.tgz#ff61b9a017a7b3af7d30e6c53de28afa19b8750a\"\n  dependencies:\n    lodash._basefor \"^3.0.0\"\n    lodash.keysin \"^3.0.0\"\n\nlodash._root@^3.0.0:\n  version \"3.0.1\"\n  resolved \"https://registry.yarnpkg.com/lodash._root/-/lodash._root-3.0.1.tgz#fba1c4524c19ee9a5f8136b4609f017cf4ded692\"\n\nlodash.assign@^3.0.0, lodash.assign@^3.2.0:\n  version \"3.2.0\"\n  resolved \"https://registry.yarnpkg.com/lodash.assign/-/lodash.assign-3.2.0.tgz#3ce9f0234b4b2223e296b8fa0ac1fee8ebca64fa\"\n  dependencies:\n    lodash._baseassign \"^3.0.0\"\n    lodash._createassigner \"^3.0.0\"\n    lodash.keys \"^3.0.0\"\n\nlodash.assign@^4.2.0:\n  version \"4.2.0\"\n  resolved \"https://registry.yarnpkg.com/lodash.assign/-/lodash.assign-4.2.0.tgz#0d99f3ccd7a6d261d19bdaeb9245005d285808e7\"\n\nlodash.camelcase@^3.0.1:\n  version \"3.0.1\"\n  resolved \"https://registry.yarnpkg.com/lodash.camelcase/-/lodash.camelcase-3.0.1.tgz#932c8b87f8a4377897c67197533282f97aeac298\"\n  dependencies:\n    lodash._createcompounder \"^3.0.0\"\n\nlodash.clonedeep@^3.0.0:\n  version \"3.0.2\"\n  resolved \"https://registry.yarnpkg.com/lodash.clonedeep/-/lodash.clonedeep-3.0.2.tgz#a0a1e40d82a5ea89ff5b147b8444ed63d92827db\"\n  dependencies:\n    lodash._baseclone \"^3.0.0\"\n    lodash._bindcallback \"^3.0.0\"\n\nlodash.deburr@^3.0.0:\n  version \"3.2.0\"\n  resolved \"https://registry.yarnpkg.com/lodash.deburr/-/lodash.deburr-3.2.0.tgz#6da8f54334a366a7cf4c4c76ef8d80aa1b365ed5\"\n  dependencies:\n    lodash._root \"^3.0.0\"\n\nlodash.defaults@^3.1.2:\n  version \"3.1.2\"\n  resolved \"https://registry.yarnpkg.com/lodash.defaults/-/lodash.defaults-3.1.2.tgz#c7308b18dbf8bc9372d701a73493c61192bd2e2c\"\n  dependencies:\n    lodash.assign \"^3.0.0\"\n    lodash.restparam \"^3.0.0\"\n\nlodash.foreach@^3.0.3:\n  version \"3.0.3\"\n  resolved \"https://registry.yarnpkg.com/lodash.foreach/-/lodash.foreach-3.0.3.tgz#6fd7efb79691aecd67fdeac2761c98e701d6c39a\"\n  dependencies:\n    lodash._arrayeach \"^3.0.0\"\n    lodash._baseeach \"^3.0.0\"\n    lodash._bindcallback \"^3.0.0\"\n    lodash.isarray \"^3.0.0\"\n\nlodash.indexof@^4.0.5:\n  version \"4.0.5\"\n  resolved \"https://registry.yarnpkg.com/lodash.indexof/-/lodash.indexof-4.0.5.tgz#53714adc2cddd6ed87638f893aa9b6c24e31ef3c\"\n\nlodash.isarguments@^3.0.0:\n  version \"3.1.0\"\n  resolved \"https://registry.yarnpkg.com/lodash.isarguments/-/lodash.isarguments-3.1.0.tgz#2f573d85c6a24289ff00663b491c1d338ff3458a\"\n\nlodash.isarray@^3.0.0:\n  version \"3.0.4\"\n  resolved \"https://registry.yarnpkg.com/lodash.isarray/-/lodash.isarray-3.0.4.tgz#79e4eb88c36a8122af86f844aa9bcd851b5fbb55\"\n\nlodash.isequal@^3.0.4:\n  version \"3.0.4\"\n  resolved \"https://registry.yarnpkg.com/lodash.isequal/-/lodash.isequal-3.0.4.tgz#1c35eb3b6ef0cd1ff51743e3ea3cf7fdffdacb64\"\n  dependencies:\n    lodash._baseisequal \"^3.0.0\"\n    lodash._bindcallback \"^3.0.0\"\n\nlodash.isplainobject@^3.0.0:\n  version \"3.2.0\"\n  resolved \"https://registry.yarnpkg.com/lodash.isplainobject/-/lodash.isplainobject-3.2.0.tgz#9a8238ae16b200432960cd7346512d0123fbf4c5\"\n  dependencies:\n    lodash._basefor \"^3.0.0\"\n    lodash.isarguments \"^3.0.0\"\n    lodash.keysin \"^3.0.0\"\n\nlodash.istypedarray@^3.0.0:\n  version \"3.0.6\"\n  resolved \"https://registry.yarnpkg.com/lodash.istypedarray/-/lodash.istypedarray-3.0.6.tgz#c9a477498607501d8e8494d283b87c39281cef62\"\n\nlodash.keys@^3.0.0, lodash.keys@^3.1.2:\n  version \"3.1.2\"\n  resolved \"https://registry.yarnpkg.com/lodash.keys/-/lodash.keys-3.1.2.tgz#4dbc0472b156be50a0b286855d1bd0b0c656098a\"\n  dependencies:\n    lodash._getnative \"^3.0.0\"\n    lodash.isarguments \"^3.0.0\"\n    lodash.isarray \"^3.0.0\"\n\nlodash.keysin@^3.0.0:\n  version \"3.0.8\"\n  resolved \"https://registry.yarnpkg.com/lodash.keysin/-/lodash.keysin-3.0.8.tgz#22c4493ebbedb1427962a54b445b2c8a767fb47f\"\n  dependencies:\n    lodash.isarguments \"^3.0.0\"\n    lodash.isarray \"^3.0.0\"\n\nlodash.merge@^3.3.2:\n  version \"3.3.2\"\n  resolved \"https://registry.yarnpkg.com/lodash.merge/-/lodash.merge-3.3.2.tgz#0d90d93ed637b1878437bb3e21601260d7afe994\"\n  dependencies:\n    lodash._arraycopy \"^3.0.0\"\n    lodash._arrayeach \"^3.0.0\"\n    lodash._createassigner \"^3.0.0\"\n    lodash._getnative \"^3.0.0\"\n    lodash.isarguments \"^3.0.0\"\n    lodash.isarray \"^3.0.0\"\n    lodash.isplainobject \"^3.0.0\"\n    lodash.istypedarray \"^3.0.0\"\n    lodash.keys \"^3.0.0\"\n    lodash.keysin \"^3.0.0\"\n    lodash.toplainobject \"^3.0.0\"\n\nlodash.pick@^3.1.0:\n  version \"3.1.0\"\n  resolved \"https://registry.yarnpkg.com/lodash.pick/-/lodash.pick-3.1.0.tgz#f252a855b2046b61bcd3904b26f76bd2efc65550\"\n  dependencies:\n    lodash._baseflatten \"^3.0.0\"\n    lodash._bindcallback \"^3.0.0\"\n    lodash._pickbyarray \"^3.0.0\"\n    lodash._pickbycallback \"^3.0.0\"\n    lodash.restparam \"^3.0.0\"\n\nlodash.restparam@^3.0.0:\n  version \"3.6.1\"\n  resolved \"https://registry.yarnpkg.com/lodash.restparam/-/lodash.restparam-3.6.1.tgz#936a4e309ef330a7645ed4145986c85ae5b20805\"\n\nlodash.toplainobject@^3.0.0:\n  version \"3.0.0\"\n  resolved \"https://registry.yarnpkg.com/lodash.toplainobject/-/lodash.toplainobject-3.0.0.tgz#28790ad942d293d78aa663a07ecf7f52ca04198d\"\n  dependencies:\n    lodash._basecopy \"^3.0.0\"\n    lodash.keysin \"^3.0.0\"\n\nlodash.words@^3.0.0:\n  version \"3.2.0\"\n  resolved \"https://registry.yarnpkg.com/lodash.words/-/lodash.words-3.2.0.tgz#4e2a8649bc08745b17c695b1a3ce8fee596623b3\"\n  dependencies:\n    lodash._root \"^3.0.0\"\n\nlodash@*, lodash@^4.0.0, lodash@^4.14.0, lodash@^4.15.0, lodash@^4.16.2, lodash@^4.16.6, lodash@^4.2.0, lodash@^4.2.1, lodash@^4.3.0, lodash@^4.5.1, lodash@^4.6.1:\n  version \"4.17.2\"\n  resolved \"https://registry.yarnpkg.com/lodash/-/lodash-4.17.2.tgz#34a3055babe04ce42467b607d700072c7ff6bf42\"\n\nlodash@^3.10.0:\n  version \"3.10.1\"\n  resolved \"https://registry.yarnpkg.com/lodash/-/lodash-3.10.1.tgz#5bf45e8e49ba4189e17d482789dfd15bd140b7b6\"\n\nlongest@^1.0.1:\n  version \"1.0.1\"\n  resolved \"https://registry.yarnpkg.com/longest/-/longest-1.0.1.tgz#30a0b2da38f73770e8294a0d22e6625ed77d0097\"\n\nloose-envify@^1.0.0, loose-envify@^1.1.0, loose-envify@^1.2.0:\n  version \"1.3.0\"\n  resolved \"https://registry.yarnpkg.com/loose-envify/-/loose-envify-1.3.0.tgz#6b26248c42f6d4fa4b0d8542f78edfcde35642a8\"\n  dependencies:\n    js-tokens \"^2.0.0\"\n\nloose-envify@^1.3.1:\n  version \"1.3.1\"\n  resolved \"https://registry.yarnpkg.com/loose-envify/-/loose-envify-1.3.1.tgz#d1a8ad33fa9ce0e713d65fdd0ac8b748d478c848\"\n  dependencies:\n    js-tokens \"^3.0.0\"\n\nlowercase-keys@^1.0.0:\n  version \"1.0.0\"\n  resolved \"https://registry.yarnpkg.com/lowercase-keys/-/lowercase-keys-1.0.0.tgz#4e3366b39e7f5457e35f1324bdf6f88d0bfc7306\"\n\nlru-cache@^4.0.1:\n  version \"4.0.1\"\n  resolved \"https://registry.yarnpkg.com/lru-cache/-/lru-cache-4.0.1.tgz#1343955edaf2e37d9b9e7ee7241e27c4b9fb72be\"\n  dependencies:\n    pseudomap \"^1.0.1\"\n    yallist \"^2.0.0\"\n\nmacaddress@^0.2.8:\n  version \"0.2.8\"\n  resolved \"https://registry.yarnpkg.com/macaddress/-/macaddress-0.2.8.tgz#5904dc537c39ec6dbefeae902327135fa8511f12\"\n\nmailcomposer@^2.1.0:\n  version \"2.1.0\"\n  resolved \"https://registry.yarnpkg.com/mailcomposer/-/mailcomposer-2.1.0.tgz#a6531822899614fee899c92226d81e2b9cbb183d\"\n  dependencies:\n    buildmail \"^2.0.0\"\n    libmime \"^1.2.0\"\n\nmakeerror@1.0.x:\n  version \"1.0.11\"\n  resolved \"https://registry.yarnpkg.com/makeerror/-/makeerror-1.0.11.tgz#e01a5c9109f2af79660e4e8b9587790184f5a96c\"\n  dependencies:\n    tmpl \"1.0.x\"\n\nmap-stream@~0.1.0:\n  version \"0.1.0\"\n  resolved \"https://registry.yarnpkg.com/map-stream/-/map-stream-0.1.0.tgz#e56aa94c4c8055a16404a0674b78f215f7c8e194\"\n\nmarked-terminal@^1.6.2:\n  version \"1.7.0\"\n  resolved \"https://registry.yarnpkg.com/marked-terminal/-/marked-terminal-1.7.0.tgz#c8c460881c772c7604b64367007ee5f77f125904\"\n  dependencies:\n    cardinal \"^1.0.0\"\n    chalk \"^1.1.3\"\n    cli-table \"^0.3.1\"\n    lodash.assign \"^4.2.0\"\n    node-emoji \"^1.4.1\"\n\nmarked@^0.3.6:\n  version \"0.3.6\"\n  resolved \"https://registry.yarnpkg.com/marked/-/marked-0.3.6.tgz#b2c6c618fccece4ef86c4fc6cb8a7cbf5aeda8d7\"\n\nmarker-clusterer-plus@^2.1.4:\n  version \"2.1.4\"\n  resolved \"https://registry.yarnpkg.com/marker-clusterer-plus/-/marker-clusterer-plus-2.1.4.tgz#f8eff74d599dab3b7d0e3fed5264ea0e704f5d67\"\n\nmath-expression-evaluator@^1.2.14:\n  version \"1.2.14\"\n  resolved \"https://registry.yarnpkg.com/math-expression-evaluator/-/math-expression-evaluator-1.2.14.tgz#39511771ed9602405fba9affff17eb4d2a3843ab\"\n  dependencies:\n    lodash.indexof \"^4.0.5\"\n\nmedia-typer@0.3.0:\n  version \"0.3.0\"\n  resolved \"https://registry.yarnpkg.com/media-typer/-/media-typer-0.3.0.tgz#8710d7af0aa626f8fffa1ce00168545263255748\"\n\n\"medium-editor@git+https://github.com/relax/medium-editor.git\":\n  version \"5.5.4\"\n  resolved \"git+https://github.com/relax/medium-editor.git#5bc0ef4d0d68965c52257790c6b4f85851dac7a9\"\n\nmemory-fs@^0.2.0:\n  version \"0.2.0\"\n  resolved \"https://registry.yarnpkg.com/memory-fs/-/memory-fs-0.2.0.tgz#f2bb25368bc121e391c2520de92969caee0a0290\"\n\nmemory-fs@~0.3.0:\n  version \"0.3.0\"\n  resolved \"https://registry.yarnpkg.com/memory-fs/-/memory-fs-0.3.0.tgz#7bcc6b629e3a43e871d7e29aca6ae8a7f15cbb20\"\n  dependencies:\n    errno \"^0.1.3\"\n    readable-stream \"^2.0.1\"\n\nmerge-descriptors@1.0.1:\n  version \"1.0.1\"\n  resolved \"https://registry.yarnpkg.com/merge-descriptors/-/merge-descriptors-1.0.1.tgz#b00aaa556dd8b44568150ec9d1b953f3f90cbb61\"\n\nmerge@^1.1.3:\n  version \"1.2.0\"\n  resolved \"https://registry.yarnpkg.com/merge/-/merge-1.2.0.tgz#7531e39d4949c281a66b8c5a6e0265e8b05894da\"\n\nmethods@~1.1.1, methods@~1.1.2:\n  version \"1.1.2\"\n  resolved \"https://registry.yarnpkg.com/methods/-/methods-1.1.2.tgz#5529a4d67654134edcc5266656835b0f851afcee\"\n\nmicromatch@^2.1.5, micromatch@^2.3.11:\n  version \"2.3.11\"\n  resolved \"https://registry.yarnpkg.com/micromatch/-/micromatch-2.3.11.tgz#86677c97d1720b363431d04d0d15293bd38c1565\"\n  dependencies:\n    arr-diff \"^2.0.0\"\n    array-unique \"^0.2.1\"\n    braces \"^1.8.2\"\n    expand-brackets \"^0.1.4\"\n    extglob \"^0.3.1\"\n    filename-regex \"^2.0.0\"\n    is-extglob \"^1.0.0\"\n    is-glob \"^2.0.1\"\n    kind-of \"^3.0.2\"\n    normalize-path \"^2.0.1\"\n    object.omit \"^2.0.0\"\n    parse-glob \"^3.0.4\"\n    regex-cache \"^0.4.2\"\n\n\"mime-db@>= 1.24.0 < 2\", mime-db@~1.24.0:\n  version \"1.24.0\"\n  resolved \"https://registry.yarnpkg.com/mime-db/-/mime-db-1.24.0.tgz#e2d13f939f0016c6e4e9ad25a8652f126c467f0c\"\n\nmime-types@^2.1.12, mime-types@^2.1.3, mime-types@~2.1.11, mime-types@~2.1.7:\n  version \"2.1.12\"\n  resolved \"https://registry.yarnpkg.com/mime-types/-/mime-types-2.1.12.tgz#152ba256777020dd4663f54c2e7bc26381e71729\"\n  dependencies:\n    mime-db \"~1.24.0\"\n\nmime@1.2.x:\n  version \"1.2.11\"\n  resolved \"https://registry.yarnpkg.com/mime/-/mime-1.2.11.tgz#58203eed86e3a5ef17aed2b7d9ebd47f0a60dd10\"\n\nmime@1.3.4, mime@^1.2.11, mime@^1.3.4:\n  version \"1.3.4\"\n  resolved \"https://registry.yarnpkg.com/mime/-/mime-1.3.4.tgz#115f9e3b6b3daf2959983cb38f149a2d40eb5d53\"\n\nmin-document@^2.19.0:\n  version \"2.19.0\"\n  resolved \"https://registry.yarnpkg.com/min-document/-/min-document-2.19.0.tgz#7bd282e3f5842ed295bb748cdd9f1ffa2c824685\"\n  dependencies:\n    dom-walk \"^0.1.0\"\n\n\"minimatch@2 || 3\", minimatch@^3.0.0, minimatch@^3.0.2:\n  version \"3.0.3\"\n  resolved \"https://registry.yarnpkg.com/minimatch/-/minimatch-3.0.3.tgz#2a4e4090b96b2db06a9d7df01055a62a77c9b774\"\n  dependencies:\n    brace-expansion \"^1.0.0\"\n\nminimatch@2.x, minimatch@^2.0.3:\n  version \"2.0.10\"\n  resolved \"https://registry.yarnpkg.com/minimatch/-/minimatch-2.0.10.tgz#8d087c39c6b38c001b97fca7ce6d0e1e80afbac7\"\n  dependencies:\n    brace-expansion \"^1.0.0\"\n\nminimist@0.0.8, minimist@~0.0.1:\n  version \"0.0.8\"\n  resolved \"https://registry.yarnpkg.com/minimist/-/minimist-0.0.8.tgz#857fcabfc3397d2625b8228262e86aa7a011b05d\"\n\nminimist@^1.1.1, minimist@^1.2.0:\n  version \"1.2.0\"\n  resolved \"https://registry.yarnpkg.com/minimist/-/minimist-1.2.0.tgz#a35008b20f41383eec1fb914f4cd5df79a264284\"\n\nmkdirp@0.5.x, \"mkdirp@>=0.5 0\", mkdirp@^0.5.0, mkdirp@^0.5.1, mkdirp@~0.5.0, mkdirp@~0.5.1:\n  version \"0.5.1\"\n  resolved \"https://registry.yarnpkg.com/mkdirp/-/mkdirp-0.5.1.tgz#30057438eac6cf7f8c4767f38648d6697d75c903\"\n  dependencies:\n    minimist \"0.0.8\"\n\nmoment@^2.10.6, moment@^2.11.2:\n  version \"2.16.0\"\n  resolved \"https://registry.yarnpkg.com/moment/-/moment-2.16.0.tgz#f38f2c97c9889b0ee18fc6cc392e1e443ad2da8e\"\n\nmongodb-core@1.2.31:\n  version \"1.2.31\"\n  resolved \"https://registry.yarnpkg.com/mongodb-core/-/mongodb-core-1.2.31.tgz#f1e6405f03d40846fdb838a702507affa3cb2c39\"\n  dependencies:\n    bson \"~0.4.20\"\n\nmongodb-core@2.0.13:\n  version \"2.0.13\"\n  resolved \"https://registry.yarnpkg.com/mongodb-core/-/mongodb-core-2.0.13.tgz#f9394b588dce0e579482e53d74dbc7d7a9d4519c\"\n  dependencies:\n    bson \"~0.5.6\"\n    require_optional \"~1.0.0\"\n\nmongodb@2.2.11:\n  version \"2.2.11\"\n  resolved \"https://registry.yarnpkg.com/mongodb/-/mongodb-2.2.11.tgz#a828b036fe6a437a35e723af5f81781c4976306c\"\n  dependencies:\n    es6-promise \"3.2.1\"\n    mongodb-core \"2.0.13\"\n    readable-stream \"2.1.5\"\n\n\"mongodb@>= 1.2.0 <2.1.0\":\n  version \"2.0.55\"\n  resolved \"https://registry.yarnpkg.com/mongodb/-/mongodb-2.0.55.tgz#a09dd77259f6bba69f7dd592a011c11aa5761097\"\n  dependencies:\n    es6-promise \"2.1.1\"\n    mongodb-core \"1.2.31\"\n    readable-stream \"1.0.31\"\n\nmongoose@^4.1.12:\n  version \"4.6.8\"\n  resolved \"https://registry.yarnpkg.com/mongoose/-/mongoose-4.6.8.tgz#1fbb69b4de8623a3e3ee63a89425a227c5d24da9\"\n  dependencies:\n    async \"2.1.2\"\n    bson \"~0.5.4\"\n    hooks-fixed \"1.2.0\"\n    kareem \"1.1.3\"\n    mongodb \"2.2.11\"\n    mpath \"0.2.1\"\n    mpromise \"0.5.5\"\n    mquery \"2.0.0\"\n    ms \"0.7.1\"\n    muri \"1.1.1\"\n    regexp-clone \"0.0.1\"\n    sliced \"1.0.1\"\n\nmorgan@^1.6.1:\n  version \"1.7.0\"\n  resolved \"https://registry.yarnpkg.com/morgan/-/morgan-1.7.0.tgz#eb10ca8e50d1abe0f8d3dad5c0201d052d981c62\"\n  dependencies:\n    basic-auth \"~1.0.3\"\n    debug \"~2.2.0\"\n    depd \"~1.1.0\"\n    on-finished \"~2.3.0\"\n    on-headers \"~1.0.1\"\n\nmpath@0.2.1:\n  version \"0.2.1\"\n  resolved \"https://registry.yarnpkg.com/mpath/-/mpath-0.2.1.tgz#3a4e829359801de96309c27a6b2e102e89f9e96e\"\n\nmpromise@0.5.5:\n  version \"0.5.5\"\n  resolved \"https://registry.yarnpkg.com/mpromise/-/mpromise-0.5.5.tgz#f5b24259d763acc2257b0a0c8c6d866fd51732e6\"\n\nmquery@2.0.0:\n  version \"2.0.0\"\n  resolved \"https://registry.yarnpkg.com/mquery/-/mquery-2.0.0.tgz#b5abc850b90dffc3e10ae49b4b6e7a479752df22\"\n  dependencies:\n    bluebird \"2.10.2\"\n    debug \"2.2.0\"\n    regexp-clone \"0.0.1\"\n    sliced \"0.0.5\"\n\nms@0.7.1:\n  version \"0.7.1\"\n  resolved \"https://registry.yarnpkg.com/ms/-/ms-0.7.1.tgz#9cd13c03adbff25b65effde7ce864ee952017098\"\n\nmulter@^1.0.6:\n  version \"1.2.0\"\n  resolved \"https://registry.yarnpkg.com/multer/-/multer-1.2.0.tgz#5be1a45259fb04d2753d33c7c2a1caf5224705a2\"\n  dependencies:\n    append-field \"^0.1.0\"\n    busboy \"^0.2.11\"\n    concat-stream \"^1.5.0\"\n    mkdirp \"^0.5.1\"\n    object-assign \"^3.0.0\"\n    on-finished \"^2.3.0\"\n    type-is \"^1.6.4\"\n    xtend \"^4.0.0\"\n\nmultimatch@^2.1.0:\n  version \"2.1.0\"\n  resolved \"https://registry.yarnpkg.com/multimatch/-/multimatch-2.1.0.tgz#9c7906a22fb4c02919e2f5f75161b4cdbd4b2a2b\"\n  dependencies:\n    array-differ \"^1.0.0\"\n    array-union \"^1.0.1\"\n    arrify \"^1.0.0\"\n    minimatch \"^3.0.0\"\n\nmuri@1.1.1:\n  version \"1.1.1\"\n  resolved \"https://registry.yarnpkg.com/muri/-/muri-1.1.1.tgz#64bd904eaf8ff89600c994441fad3c5195905ac2\"\n\nmute-stream@0.0.5:\n  version \"0.0.5\"\n  resolved \"https://registry.yarnpkg.com/mute-stream/-/mute-stream-0.0.5.tgz#8fbfabb0a98a253d3184331f9e8deb7372fac6c0\"\n\nnan@^2.3.0, nan@^2.4.0:\n  version \"2.4.0\"\n  resolved \"https://registry.yarnpkg.com/nan/-/nan-2.4.0.tgz#fb3c59d45fe4effe215f0b890f8adf6eb32d2232\"\n\nnan@~2.3:\n  version \"2.3.5\"\n  resolved \"https://registry.yarnpkg.com/nan/-/nan-2.3.5.tgz#822a0dc266290ce4cd3a12282ca3e7e364668a08\"\n\nnatural-compare@^1.4.0:\n  version \"1.4.0\"\n  resolved \"https://registry.yarnpkg.com/natural-compare/-/natural-compare-1.4.0.tgz#4abebfeed7541f2c27acfb29bdbbd15c8d5ba4f7\"\n\nneedle@^0.10.0:\n  version \"0.10.0\"\n  resolved \"https://registry.yarnpkg.com/needle/-/needle-0.10.0.tgz#16a24d63f2a61152eb74cce1d12af85c507577d4\"\n  dependencies:\n    debug \"^2.1.2\"\n    iconv-lite \"^0.4.4\"\n\nneedle@^0.11.0:\n  version \"0.11.0\"\n  resolved \"https://registry.yarnpkg.com/needle/-/needle-0.11.0.tgz#02a71b008eaf7d55ae89fb9fd7685b7b88d7bc29\"\n  dependencies:\n    debug \"^2.1.2\"\n    iconv-lite \"^0.4.4\"\n\nnegotiator@0.6.1:\n  version \"0.6.1\"\n  resolved \"https://registry.yarnpkg.com/negotiator/-/negotiator-0.6.1.tgz#2b327184e8992101177b28563fb5e7102acd0ca9\"\n\nnested-error-stacks@^1.0.0:\n  version \"1.0.2\"\n  resolved \"https://registry.yarnpkg.com/nested-error-stacks/-/nested-error-stacks-1.0.2.tgz#19f619591519f096769a5ba9a86e6eeec823c3cf\"\n  dependencies:\n    inherits \"~2.0.1\"\n\nnode-dir@^0.1.10:\n  version \"0.1.16\"\n  resolved \"https://registry.yarnpkg.com/node-dir/-/node-dir-0.1.16.tgz#d2ef583aa50b90d93db8cdd26fcea58353957fe4\"\n  dependencies:\n    minimatch \"^3.0.2\"\n\nnode-emoji@^1.4.1:\n  version \"1.4.3\"\n  resolved \"https://registry.yarnpkg.com/node-emoji/-/node-emoji-1.4.3.tgz#5272f70b823c4df6d7c39f84fd8203f35b3e5d36\"\n  dependencies:\n    string.prototype.codepointat \"^0.2.0\"\n\nnode-fetch@^1.0.1:\n  version \"1.6.3\"\n  resolved \"https://registry.yarnpkg.com/node-fetch/-/node-fetch-1.6.3.tgz#dc234edd6489982d58e8f0db4f695029abcd8c04\"\n  dependencies:\n    encoding \"^0.1.11\"\n    is-stream \"^1.0.1\"\n\nnode-int64@^0.4.0:\n  version \"0.4.0\"\n  resolved \"https://registry.yarnpkg.com/node-int64/-/node-int64-0.4.0.tgz#87a9065cdb355d3182d8f94ce11188b825c68a3b\"\n\nnode-libs-browser@^0.6.0:\n  version \"0.6.0\"\n  resolved \"https://registry.yarnpkg.com/node-libs-browser/-/node-libs-browser-0.6.0.tgz#244806d44d319e048bc8607b5cc4eaf9a29d2e3c\"\n  dependencies:\n    assert \"^1.1.1\"\n    browserify-zlib \"~0.1.4\"\n    buffer \"^4.9.0\"\n    console-browserify \"^1.1.0\"\n    constants-browserify \"0.0.1\"\n    crypto-browserify \"~3.2.6\"\n    domain-browser \"^1.1.1\"\n    events \"^1.0.0\"\n    http-browserify \"^1.3.2\"\n    https-browserify \"0.0.0\"\n    os-browserify \"~0.1.2\"\n    path-browserify \"0.0.0\"\n    process \"^0.11.0\"\n    punycode \"^1.2.4\"\n    querystring-es3 \"~0.2.0\"\n    readable-stream \"^1.1.13\"\n    stream-browserify \"^1.0.0\"\n    string_decoder \"~0.10.25\"\n    timers-browserify \"^1.0.1\"\n    tty-browserify \"0.0.0\"\n    url \"~0.10.1\"\n    util \"~0.10.3\"\n    vm-browserify \"0.0.4\"\n\nnode-notifier@^4.6.1:\n  version \"4.6.1\"\n  resolved \"https://registry.yarnpkg.com/node-notifier/-/node-notifier-4.6.1.tgz#056d14244f3dcc1ceadfe68af9cff0c5473a33f3\"\n  dependencies:\n    cli-usage \"^0.1.1\"\n    growly \"^1.2.0\"\n    lodash.clonedeep \"^3.0.0\"\n    minimist \"^1.1.1\"\n    semver \"^5.1.0\"\n    shellwords \"^0.1.0\"\n    which \"^1.0.5\"\n\nnode-pre-gyp@^0.6.29:\n  version \"0.6.31\"\n  resolved \"https://registry.yarnpkg.com/node-pre-gyp/-/node-pre-gyp-0.6.31.tgz#d8a00ddaa301a940615dbcc8caad4024d58f6017\"\n  dependencies:\n    mkdirp \"~0.5.1\"\n    nopt \"~3.0.6\"\n    npmlog \"^4.0.0\"\n    rc \"~1.1.6\"\n    request \"^2.75.0\"\n    rimraf \"~2.5.4\"\n    semver \"~5.3.0\"\n    tar \"~2.2.1\"\n    tar-pack \"~3.3.0\"\n\nnode-uuid@~1.4.7:\n  version \"1.4.7\"\n  resolved \"https://registry.yarnpkg.com/node-uuid/-/node-uuid-1.4.7.tgz#6da5a17668c4b3dd59623bda11cf7fa4c1f60a6f\"\n\nnodemailer-direct-transport@^1.1.0:\n  version \"1.1.0\"\n  resolved \"https://registry.yarnpkg.com/nodemailer-direct-transport/-/nodemailer-direct-transport-1.1.0.tgz#a2f78708ee6f16ea0573fc82949d138ff172f624\"\n  dependencies:\n    smtp-connection \"^1.3.1\"\n\nnodemailer-smtp-transport@^1.1.0:\n  version \"1.1.0\"\n  resolved \"https://registry.yarnpkg.com/nodemailer-smtp-transport/-/nodemailer-smtp-transport-1.1.0.tgz#e6c37f31885ab3080e7ded3cf528c4ad7e691398\"\n  dependencies:\n    clone \"^1.0.2\"\n    nodemailer-wellknown \"^0.1.7\"\n    smtp-connection \"^1.3.7\"\n\nnodemailer-wellknown@^0.1.7:\n  version \"0.1.10\"\n  resolved \"https://registry.yarnpkg.com/nodemailer-wellknown/-/nodemailer-wellknown-0.1.10.tgz#586db8101db30cb4438eb546737a41aad0cf13d5\"\n\nnodemailer@^1.5.0:\n  version \"1.11.0\"\n  resolved \"https://registry.yarnpkg.com/nodemailer/-/nodemailer-1.11.0.tgz#4e69cb39b03015b1d1ef0c78a815412b9e976f79\"\n  dependencies:\n    libmime \"^1.2.0\"\n    mailcomposer \"^2.1.0\"\n    needle \"^0.11.0\"\n    nodemailer-direct-transport \"^1.1.0\"\n    nodemailer-smtp-transport \"^1.1.0\"\n\nnodemon@^1.8.1:\n  version \"1.11.0\"\n  resolved \"https://registry.yarnpkg.com/nodemon/-/nodemon-1.11.0.tgz#226c562bd2a7b13d3d7518b49ad4828a3623d06c\"\n  dependencies:\n    chokidar \"^1.4.3\"\n    debug \"^2.2.0\"\n    es6-promise \"^3.0.2\"\n    ignore-by-default \"^1.0.0\"\n    lodash.defaults \"^3.1.2\"\n    minimatch \"^3.0.0\"\n    ps-tree \"^1.0.1\"\n    touch \"1.0.0\"\n    undefsafe \"0.0.3\"\n    update-notifier \"0.5.0\"\n\nnopt@~1.0.10:\n  version \"1.0.10\"\n  resolved \"https://registry.yarnpkg.com/nopt/-/nopt-1.0.10.tgz#6ddd21bd2a31417b92727dd585f8a6f37608ebee\"\n  dependencies:\n    abbrev \"1\"\n\nnopt@~3.0.6:\n  version \"3.0.6\"\n  resolved \"https://registry.yarnpkg.com/nopt/-/nopt-3.0.6.tgz#c6465dbf08abcd4db359317f79ac68a646b28ff9\"\n  dependencies:\n    abbrev \"1\"\n\nnormalize-package-data@^2.3.2:\n  version \"2.3.5\"\n  resolved \"https://registry.yarnpkg.com/normalize-package-data/-/normalize-package-data-2.3.5.tgz#8d924f142960e1777e7ffe170543631cc7cb02df\"\n  dependencies:\n    hosted-git-info \"^2.1.4\"\n    is-builtin-module \"^1.0.0\"\n    semver \"2 || 3 || 4 || 5\"\n    validate-npm-package-license \"^3.0.1\"\n\nnormalize-path@^2.0.1:\n  version \"2.0.1\"\n  resolved \"https://registry.yarnpkg.com/normalize-path/-/normalize-path-2.0.1.tgz#47886ac1662760d4261b7d979d241709d3ce3f7a\"\n\nnormalize-range@^0.1.2:\n  version \"0.1.2\"\n  resolved \"https://registry.yarnpkg.com/normalize-range/-/normalize-range-0.1.2.tgz#2d10c06bdfd312ea9777695a4d28439456b75942\"\n\nnormalize-url@^1.4.0:\n  version \"1.8.0\"\n  resolved \"https://registry.yarnpkg.com/normalize-url/-/normalize-url-1.8.0.tgz#a9550b079aa3523c85d78df24eef1959fce359ab\"\n  dependencies:\n    object-assign \"^4.0.1\"\n    prepend-http \"^1.0.0\"\n    query-string \"^4.1.0\"\n    sort-keys \"^1.0.0\"\n\nnpmlog@^4.0.0:\n  version \"4.0.1\"\n  resolved \"https://registry.yarnpkg.com/npmlog/-/npmlog-4.0.1.tgz#d14f503b4cd79710375553004ba96e6662fbc0b8\"\n  dependencies:\n    are-we-there-yet \"~1.1.2\"\n    console-control-strings \"~1.1.0\"\n    gauge \"~2.7.1\"\n    set-blocking \"~2.0.0\"\n\nnull-loader@^0.1.1:\n  version \"0.1.1\"\n  resolved \"https://registry.yarnpkg.com/null-loader/-/null-loader-0.1.1.tgz#17be9abfcd3ff0e1512f6fc4afcb1f5039378fae\"\n\nnum2fraction@^1.2.2:\n  version \"1.2.2\"\n  resolved \"https://registry.yarnpkg.com/num2fraction/-/num2fraction-1.2.2.tgz#6f682b6a027a4e9ddfa4564cd2589d1d4e669ede\"\n\nnumber-is-nan@^1.0.0:\n  version \"1.0.1\"\n  resolved \"https://registry.yarnpkg.com/number-is-nan/-/number-is-nan-1.0.1.tgz#097b602b53422a522c1afb8790318336941a011d\"\n\n\"nwmatcher@>= 1.3.7 < 2.0.0\":\n  version \"1.3.9\"\n  resolved \"https://registry.yarnpkg.com/nwmatcher/-/nwmatcher-1.3.9.tgz#8bab486ff7fa3dfd086656bbe8b17116d3692d2a\"\n\noauth-sign@~0.8.1:\n  version \"0.8.2\"\n  resolved \"https://registry.yarnpkg.com/oauth-sign/-/oauth-sign-0.8.2.tgz#46a6ab7f0aead8deae9ec0565780b7d4efeb9d43\"\n\nobject-assign@^3.0.0:\n  version \"3.0.0\"\n  resolved \"https://registry.yarnpkg.com/object-assign/-/object-assign-3.0.0.tgz#9bedd5ca0897949bca47e7ff408062d549f587f2\"\n\nobject-assign@^4.0.1, object-assign@^4.1.0:\n  version \"4.1.0\"\n  resolved \"https://registry.yarnpkg.com/object-assign/-/object-assign-4.1.0.tgz#7a3b3d0e98063d43f4c03f2e8ae6cd51a86883a0\"\n\nobject.omit@^2.0.0:\n  version \"2.0.1\"\n  resolved \"https://registry.yarnpkg.com/object.omit/-/object.omit-2.0.1.tgz#1a9c744829f39dbb858c76ca3579ae2a54ebd1fa\"\n  dependencies:\n    for-own \"^0.1.4\"\n    is-extendable \"^0.1.1\"\n\non-finished@^2.3.0, on-finished@~2.3.0:\n  version \"2.3.0\"\n  resolved \"https://registry.yarnpkg.com/on-finished/-/on-finished-2.3.0.tgz#20f1336481b083cd75337992a16971aa2d906947\"\n  dependencies:\n    ee-first \"1.1.1\"\n\non-headers@~1.0.1:\n  version \"1.0.1\"\n  resolved \"https://registry.yarnpkg.com/on-headers/-/on-headers-1.0.1.tgz#928f5d0f470d49342651ea6794b0857c100693f7\"\n\nonce@1.x, once@^1.3.0:\n  version \"1.4.0\"\n  resolved \"https://registry.yarnpkg.com/once/-/once-1.4.0.tgz#583b1aa775961d4b113ac17d9c50baef9dd76bd1\"\n  dependencies:\n    wrappy \"1\"\n\nonce@~1.3.0, once@~1.3.3:\n  version \"1.3.3\"\n  resolved \"https://registry.yarnpkg.com/once/-/once-1.3.3.tgz#b2e261557ce4c314ec8304f3fa82663e4297ca20\"\n  dependencies:\n    wrappy \"1\"\n\nonetime@^1.0.0:\n  version \"1.1.0\"\n  resolved \"https://registry.yarnpkg.com/onetime/-/onetime-1.1.0.tgz#a1f7838f8314c516f05ecefcbc4ccfe04b4ed789\"\n\nopen@0.0.5:\n  version \"0.0.5\"\n  resolved \"https://registry.yarnpkg.com/open/-/open-0.0.5.tgz#42c3e18ec95466b6bf0dc42f3a2945c3f0cad8fc\"\n\noptimist@^0.6.1, optimist@~0.6.0, optimist@~0.6.1:\n  version \"0.6.1\"\n  resolved \"https://registry.yarnpkg.com/optimist/-/optimist-0.6.1.tgz#da3ea74686fa21a19a111c326e90eb15a0196686\"\n  dependencies:\n    minimist \"~0.0.1\"\n    wordwrap \"~0.0.2\"\n\noptionator@^0.8.1:\n  version \"0.8.2\"\n  resolved \"https://registry.yarnpkg.com/optionator/-/optionator-0.8.2.tgz#364c5e409d3f4d6301d6c0b4c05bba50180aeb64\"\n  dependencies:\n    deep-is \"~0.1.3\"\n    fast-levenshtein \"~2.0.4\"\n    levn \"~0.3.0\"\n    prelude-ls \"~1.1.2\"\n    type-check \"~0.3.2\"\n    wordwrap \"~1.0.0\"\n\noriginal@>=0.0.5:\n  version \"1.0.0\"\n  resolved \"https://registry.yarnpkg.com/original/-/original-1.0.0.tgz#9147f93fa1696d04be61e01bd50baeaca656bd3b\"\n  dependencies:\n    url-parse \"1.0.x\"\n\nos-browserify@~0.1.2:\n  version \"0.1.2\"\n  resolved \"https://registry.yarnpkg.com/os-browserify/-/os-browserify-0.1.2.tgz#49ca0293e0b19590a5f5de10c7f265a617d8fe54\"\n\nos-homedir@^1.0.0:\n  version \"1.0.2\"\n  resolved \"https://registry.yarnpkg.com/os-homedir/-/os-homedir-1.0.2.tgz#ffbc4988336e0e833de0c168c7ef152121aa7fb3\"\n\nos-locale@^1.4.0:\n  version \"1.4.0\"\n  resolved \"https://registry.yarnpkg.com/os-locale/-/os-locale-1.4.0.tgz#20f9f17ae29ed345e8bde583b13d2009803c14d9\"\n  dependencies:\n    lcid \"^1.0.0\"\n\nos-tmpdir@^1.0.0, os-tmpdir@^1.0.1:\n  version \"1.0.2\"\n  resolved \"https://registry.yarnpkg.com/os-tmpdir/-/os-tmpdir-1.0.2.tgz#bbe67406c79aa85c5cfec766fe5734555dfa1274\"\n\nosenv@^0.1.0:\n  version \"0.1.3\"\n  resolved \"https://registry.yarnpkg.com/osenv/-/osenv-0.1.3.tgz#83cf05c6d6458fc4d5ac6362ea325d92f2754217\"\n  dependencies:\n    os-homedir \"^1.0.0\"\n    os-tmpdir \"^1.0.0\"\n\npackage-json@^1.0.0:\n  version \"1.2.0\"\n  resolved \"https://registry.yarnpkg.com/package-json/-/package-json-1.2.0.tgz#c8ecac094227cdf76a316874ed05e27cc939a0e0\"\n  dependencies:\n    got \"^3.2.0\"\n    registry-url \"^3.0.0\"\n\npako@~0.2.0:\n  version \"0.2.9\"\n  resolved \"https://registry.yarnpkg.com/pako/-/pako-0.2.9.tgz#f3f7522f4ef782348da8161bad9ecfd51bf83a75\"\n\nparse-glob@^3.0.4:\n  version \"3.0.4\"\n  resolved \"https://registry.yarnpkg.com/parse-glob/-/parse-glob-3.0.4.tgz#b2c376cfb11f35513badd173ef0bb6e3a388391c\"\n  dependencies:\n    glob-base \"^0.3.0\"\n    is-dotfile \"^1.0.0\"\n    is-extglob \"^1.0.0\"\n    is-glob \"^2.0.0\"\n\nparse-json@^2.2.0:\n  version \"2.2.0\"\n  resolved \"https://registry.yarnpkg.com/parse-json/-/parse-json-2.2.0.tgz#f480f40434ef80741f8469099f8dea18f55a4dc9\"\n  dependencies:\n    error-ex \"^1.2.0\"\n\nparse5@^1.5.1:\n  version \"1.5.1\"\n  resolved \"https://registry.yarnpkg.com/parse5/-/parse5-1.5.1.tgz#9b7f3b0de32be78dc2401b17573ccaf0f6f59d94\"\n\nparseurl@~1.3.1:\n  version \"1.3.1\"\n  resolved \"https://registry.yarnpkg.com/parseurl/-/parseurl-1.3.1.tgz#c8ab8c9223ba34888aa64a297b28853bec18da56\"\n\npassport-local-mongoose@^3.1.0:\n  version \"3.1.0\"\n  resolved \"https://registry.yarnpkg.com/passport-local-mongoose/-/passport-local-mongoose-3.1.0.tgz#9da8d0b792870c384502eeb1f7d30e34bff142c6\"\n  dependencies:\n    generaterr \"^1.2.0\"\n    passport-local \"^1.0.0\"\n    scmp \"^1.0.0\"\n\npassport-local@^1.0.0:\n  version \"1.0.0\"\n  resolved \"https://registry.yarnpkg.com/passport-local/-/passport-local-1.0.0.tgz#1fe63268c92e75606626437e3b906662c15ba6ee\"\n  dependencies:\n    passport-strategy \"1.x.x\"\n\npassport-strategy@1.x.x:\n  version \"1.0.0\"\n  resolved \"https://registry.yarnpkg.com/passport-strategy/-/passport-strategy-1.0.0.tgz#b5539aa8fc225a3d1ad179476ddf236b440f52e4\"\n\npassport@^0.3.0:\n  version \"0.3.2\"\n  resolved \"https://registry.yarnpkg.com/passport/-/passport-0.3.2.tgz#9dd009f915e8fe095b0124a01b8f82da07510102\"\n  dependencies:\n    passport-strategy \"1.x.x\"\n    pause \"0.0.1\"\n\npath-browserify@0.0.0:\n  version \"0.0.0\"\n  resolved \"https://registry.yarnpkg.com/path-browserify/-/path-browserify-0.0.0.tgz#a0b870729aae214005b7d5032ec2cbbb0fb4451a\"\n\npath-exists@^1.0.0:\n  version \"1.0.0\"\n  resolved \"https://registry.yarnpkg.com/path-exists/-/path-exists-1.0.0.tgz#d5a8998eb71ef37a74c34eb0d9eba6e878eea081\"\n\npath-exists@^2.0.0:\n  version \"2.1.0\"\n  resolved \"https://registry.yarnpkg.com/path-exists/-/path-exists-2.1.0.tgz#0feb6c64f0fc518d9a754dd5efb62c7022761f4b\"\n  dependencies:\n    pinkie-promise \"^2.0.0\"\n\npath-is-absolute@^1.0.0:\n  version \"1.0.1\"\n  resolved \"https://registry.yarnpkg.com/path-is-absolute/-/path-is-absolute-1.0.1.tgz#174b9268735534ffbc7ace6bf53a5a9e1b5c5f5f\"\n\npath-is-inside@^1.0.1:\n  version \"1.0.2\"\n  resolved \"https://registry.yarnpkg.com/path-is-inside/-/path-is-inside-1.0.2.tgz#365417dede44430d1c11af61027facf074bdfc53\"\n\npath-parse@^1.0.5:\n  version \"1.0.5\"\n  resolved \"https://registry.yarnpkg.com/path-parse/-/path-parse-1.0.5.tgz#3c1adf871ea9cd6c9431b6ea2bd74a0ff055c4c1\"\n\npath-to-regexp@0.1.7:\n  version \"0.1.7\"\n  resolved \"https://registry.yarnpkg.com/path-to-regexp/-/path-to-regexp-0.1.7.tgz#df604178005f522f15eb4490e7247a1bfaa67f8c\"\n\npath-type@^1.0.0:\n  version \"1.1.0\"\n  resolved \"https://registry.yarnpkg.com/path-type/-/path-type-1.1.0.tgz#59c44f7ee491da704da415da5a4070ba4f8fe441\"\n  dependencies:\n    graceful-fs \"^4.1.2\"\n    pify \"^2.0.0\"\n    pinkie-promise \"^2.0.0\"\n\npause-stream@0.0.11:\n  version \"0.0.11\"\n  resolved \"https://registry.yarnpkg.com/pause-stream/-/pause-stream-0.0.11.tgz#fe5a34b0cbce12b5aa6a2b403ee2e73b602f1445\"\n  dependencies:\n    through \"~2.3\"\n\npause@0.0.1:\n  version \"0.0.1\"\n  resolved \"https://registry.yarnpkg.com/pause/-/pause-0.0.1.tgz#1d408b3fdb76923b9543d96fb4c9dfd535d9cb5d\"\n\npbkdf2-compat@2.0.1:\n  version \"2.0.1\"\n  resolved \"https://registry.yarnpkg.com/pbkdf2-compat/-/pbkdf2-compat-2.0.1.tgz#b6e0c8fa99494d94e0511575802a59a5c142f288\"\n\nperformance-now@~0.2.0:\n  version \"0.2.0\"\n  resolved \"https://registry.yarnpkg.com/performance-now/-/performance-now-0.2.0.tgz#33ef30c5c77d4ea21c5a53869d91b56d8f2555e5\"\n\npify@^2.0.0:\n  version \"2.3.0\"\n  resolved \"https://registry.yarnpkg.com/pify/-/pify-2.3.0.tgz#ed141a6ac043a849ea588498e7dca8b15330e90c\"\n\npinkie-promise@^2.0.0:\n  version \"2.0.1\"\n  resolved \"https://registry.yarnpkg.com/pinkie-promise/-/pinkie-promise-2.0.1.tgz#2135d6dfa7a358c069ac9b178776288228450ffa\"\n  dependencies:\n    pinkie \"^2.0.0\"\n\npinkie@^2.0.0:\n  version \"2.0.4\"\n  resolved \"https://registry.yarnpkg.com/pinkie/-/pinkie-2.0.4.tgz#72556b80cfa0d48a974e80e77248e80ed4f7f870\"\n\npluralize@^1.2.1:\n  version \"1.2.1\"\n  resolved \"https://registry.yarnpkg.com/pluralize/-/pluralize-1.2.1.tgz#d1a21483fd22bb41e58a12fa3421823140897c45\"\n\npostcss-calc@^5.2.0:\n  version \"5.3.1\"\n  resolved \"https://registry.yarnpkg.com/postcss-calc/-/postcss-calc-5.3.1.tgz#77bae7ca928ad85716e2fda42f261bf7c1d65b5e\"\n  dependencies:\n    postcss \"^5.0.2\"\n    postcss-message-helpers \"^2.0.0\"\n    reduce-css-calc \"^1.2.6\"\n\npostcss-colormin@^2.1.8:\n  version \"2.2.1\"\n  resolved \"https://registry.yarnpkg.com/postcss-colormin/-/postcss-colormin-2.2.1.tgz#dc5421b6ae6f779ef6bfd47352b94abe59d0316b\"\n  dependencies:\n    colormin \"^1.0.5\"\n    postcss \"^5.0.13\"\n    postcss-value-parser \"^3.2.3\"\n\npostcss-convert-values@^2.3.4:\n  version \"2.4.1\"\n  resolved \"https://registry.yarnpkg.com/postcss-convert-values/-/postcss-convert-values-2.4.1.tgz#45dce4d4e33b7d967b97a4d937f270ea98d2fe7a\"\n  dependencies:\n    postcss \"^5.0.11\"\n    postcss-value-parser \"^3.1.2\"\n\npostcss-discard-comments@^2.0.4:\n  version \"2.0.4\"\n  resolved \"https://registry.yarnpkg.com/postcss-discard-comments/-/postcss-discard-comments-2.0.4.tgz#befe89fafd5b3dace5ccce51b76b81514be00e3d\"\n  dependencies:\n    postcss \"^5.0.14\"\n\npostcss-discard-duplicates@^2.0.1:\n  version \"2.0.2\"\n  resolved \"https://registry.yarnpkg.com/postcss-discard-duplicates/-/postcss-discard-duplicates-2.0.2.tgz#02be520e91571ffb10738766a981d5770989bb32\"\n  dependencies:\n    postcss \"^5.0.4\"\n\npostcss-discard-empty@^2.0.1:\n  version \"2.1.0\"\n  resolved \"https://registry.yarnpkg.com/postcss-discard-empty/-/postcss-discard-empty-2.1.0.tgz#d2b4bd9d5ced5ebd8dcade7640c7d7cd7f4f92b5\"\n  dependencies:\n    postcss \"^5.0.14\"\n\npostcss-discard-overridden@^0.1.1:\n  version \"0.1.1\"\n  resolved \"https://registry.yarnpkg.com/postcss-discard-overridden/-/postcss-discard-overridden-0.1.1.tgz#8b1eaf554f686fb288cd874c55667b0aa3668d58\"\n  dependencies:\n    postcss \"^5.0.16\"\n\npostcss-discard-unused@^2.2.1:\n  version \"2.2.2\"\n  resolved \"https://registry.yarnpkg.com/postcss-discard-unused/-/postcss-discard-unused-2.2.2.tgz#5d72f7d05d11de0a9589e001958067ccae1b4931\"\n  dependencies:\n    postcss \"^5.0.14\"\n    uniqs \"^2.0.0\"\n\npostcss-filter-plugins@^2.0.0:\n  version \"2.0.2\"\n  resolved \"https://registry.yarnpkg.com/postcss-filter-plugins/-/postcss-filter-plugins-2.0.2.tgz#6d85862534d735ac420e4a85806e1f5d4286d84c\"\n  dependencies:\n    postcss \"^5.0.4\"\n    uniqid \"^4.0.0\"\n\npostcss-loader@^0.9.1:\n  version \"0.9.1\"\n  resolved \"https://registry.yarnpkg.com/postcss-loader/-/postcss-loader-0.9.1.tgz#87a3e70f58e46d68a75badc6725d9ea4773fd1d7\"\n  dependencies:\n    loader-utils \"^0.2.14\"\n    postcss \"^5.0.19\"\n\npostcss-merge-idents@^2.1.5:\n  version \"2.1.7\"\n  resolved \"https://registry.yarnpkg.com/postcss-merge-idents/-/postcss-merge-idents-2.1.7.tgz#4c5530313c08e1d5b3bbf3d2bbc747e278eea270\"\n  dependencies:\n    has \"^1.0.1\"\n    postcss \"^5.0.10\"\n    postcss-value-parser \"^3.1.1\"\n\npostcss-merge-longhand@^2.0.1:\n  version \"2.0.1\"\n  resolved \"https://registry.yarnpkg.com/postcss-merge-longhand/-/postcss-merge-longhand-2.0.1.tgz#ff59b5dec6d586ce2cea183138f55c5876fa9cdc\"\n  dependencies:\n    postcss \"^5.0.4\"\n\npostcss-merge-rules@^2.0.3:\n  version \"2.0.10\"\n  resolved \"https://registry.yarnpkg.com/postcss-merge-rules/-/postcss-merge-rules-2.0.10.tgz#54b360be804e7e69a5c7222635247b92a3569e9b\"\n  dependencies:\n    postcss \"^5.0.4\"\n    vendors \"^1.0.0\"\n\npostcss-message-helpers@^2.0.0:\n  version \"2.0.0\"\n  resolved \"https://registry.yarnpkg.com/postcss-message-helpers/-/postcss-message-helpers-2.0.0.tgz#a4f2f4fab6e4fe002f0aed000478cdf52f9ba60e\"\n\npostcss-minify-font-values@^1.0.2:\n  version \"1.0.5\"\n  resolved \"https://registry.yarnpkg.com/postcss-minify-font-values/-/postcss-minify-font-values-1.0.5.tgz#4b58edb56641eba7c8474ab3526cafd7bbdecb69\"\n  dependencies:\n    object-assign \"^4.0.1\"\n    postcss \"^5.0.4\"\n    postcss-value-parser \"^3.0.2\"\n\npostcss-minify-gradients@^1.0.1:\n  version \"1.0.5\"\n  resolved \"https://registry.yarnpkg.com/postcss-minify-gradients/-/postcss-minify-gradients-1.0.5.tgz#5dbda11373703f83cfb4a3ea3881d8d75ff5e6e1\"\n  dependencies:\n    postcss \"^5.0.12\"\n    postcss-value-parser \"^3.3.0\"\n\npostcss-minify-params@^1.0.4:\n  version \"1.0.5\"\n  resolved \"https://registry.yarnpkg.com/postcss-minify-params/-/postcss-minify-params-1.0.5.tgz#82d602643b8616a61fb3634d7ede0289836d67f9\"\n  dependencies:\n    alphanum-sort \"^1.0.1\"\n    postcss \"^5.0.2\"\n    postcss-value-parser \"^3.0.2\"\n    uniqs \"^2.0.0\"\n\npostcss-minify-selectors@^2.0.4:\n  version \"2.0.7\"\n  resolved \"https://registry.yarnpkg.com/postcss-minify-selectors/-/postcss-minify-selectors-2.0.7.tgz#bfb9248fe14db33770f036572de6b4897c48d81c\"\n  dependencies:\n    alphanum-sort \"^1.0.2\"\n    has \"^1.0.1\"\n    postcss \"^5.0.14\"\n    postcss-selector-parser \"^2.0.0\"\n\npostcss-modules-extract-imports@^1.0.0:\n  version \"1.0.1\"\n  resolved \"https://registry.yarnpkg.com/postcss-modules-extract-imports/-/postcss-modules-extract-imports-1.0.1.tgz#8fb3fef9a6dd0420d3f6d4353cf1ff73f2b2a341\"\n  dependencies:\n    postcss \"^5.0.4\"\n\npostcss-modules-local-by-default@^1.0.1:\n  version \"1.1.1\"\n  resolved \"https://registry.yarnpkg.com/postcss-modules-local-by-default/-/postcss-modules-local-by-default-1.1.1.tgz#29a10673fa37d19251265ca2ba3150d9040eb4ce\"\n  dependencies:\n    css-selector-tokenizer \"^0.6.0\"\n    postcss \"^5.0.4\"\n\npostcss-modules-scope@^1.0.0:\n  version \"1.0.2\"\n  resolved \"https://registry.yarnpkg.com/postcss-modules-scope/-/postcss-modules-scope-1.0.2.tgz#ff977395e5e06202d7362290b88b1e8cd049de29\"\n  dependencies:\n    css-selector-tokenizer \"^0.6.0\"\n    postcss \"^5.0.4\"\n\npostcss-modules-values@^1.1.0:\n  version \"1.2.2\"\n  resolved \"https://registry.yarnpkg.com/postcss-modules-values/-/postcss-modules-values-1.2.2.tgz#f0e7d476fe1ed88c5e4c7f97533a3e772ad94ca1\"\n  dependencies:\n    icss-replace-symbols \"^1.0.2\"\n    postcss \"^5.0.14\"\n\npostcss-normalize-charset@^1.1.0:\n  version \"1.1.1\"\n  resolved \"https://registry.yarnpkg.com/postcss-normalize-charset/-/postcss-normalize-charset-1.1.1.tgz#ef9ee71212d7fe759c78ed162f61ed62b5cb93f1\"\n  dependencies:\n    postcss \"^5.0.5\"\n\npostcss-normalize-url@^3.0.7:\n  version \"3.0.7\"\n  resolved \"https://registry.yarnpkg.com/postcss-normalize-url/-/postcss-normalize-url-3.0.7.tgz#6bd90d0a4bc5a1df22c26ea65c53257dc3829f4e\"\n  dependencies:\n    is-absolute-url \"^2.0.0\"\n    normalize-url \"^1.4.0\"\n    postcss \"^5.0.14\"\n    postcss-value-parser \"^3.2.3\"\n\npostcss-ordered-values@^2.1.0:\n  version \"2.2.2\"\n  resolved \"https://registry.yarnpkg.com/postcss-ordered-values/-/postcss-ordered-values-2.2.2.tgz#be8b511741fab2dac8e614a2302e9d10267b0771\"\n  dependencies:\n    postcss \"^5.0.4\"\n    postcss-value-parser \"^3.0.1\"\n\npostcss-reduce-idents@^2.2.2:\n  version \"2.3.1\"\n  resolved \"https://registry.yarnpkg.com/postcss-reduce-idents/-/postcss-reduce-idents-2.3.1.tgz#024e8e219f52773313408573db9645ba62d2d2fe\"\n  dependencies:\n    postcss \"^5.0.4\"\n    postcss-value-parser \"^3.0.2\"\n\npostcss-reduce-initial@^1.0.0:\n  version \"1.0.0\"\n  resolved \"https://registry.yarnpkg.com/postcss-reduce-initial/-/postcss-reduce-initial-1.0.0.tgz#8f739b938289ef2e48936d7101783e4741ca9bbb\"\n  dependencies:\n    postcss \"^5.0.4\"\n\npostcss-reduce-transforms@^1.0.3:\n  version \"1.0.4\"\n  resolved \"https://registry.yarnpkg.com/postcss-reduce-transforms/-/postcss-reduce-transforms-1.0.4.tgz#ff76f4d8212437b31c298a42d2e1444025771ae1\"\n  dependencies:\n    has \"^1.0.1\"\n    postcss \"^5.0.8\"\n    postcss-value-parser \"^3.0.1\"\n\npostcss-selector-parser@^2.0.0:\n  version \"2.2.2\"\n  resolved \"https://registry.yarnpkg.com/postcss-selector-parser/-/postcss-selector-parser-2.2.2.tgz#3d70f5adda130da51c7c0c2fc023f56b1374fe08\"\n  dependencies:\n    flatten \"^1.0.2\"\n    indexes-of \"^1.0.1\"\n    uniq \"^1.0.1\"\n\npostcss-svgo@^2.1.1:\n  version \"2.1.5\"\n  resolved \"https://registry.yarnpkg.com/postcss-svgo/-/postcss-svgo-2.1.5.tgz#46fc0363f01bab6a36a9abb01c229fcc45363094\"\n  dependencies:\n    is-svg \"^2.0.0\"\n    postcss \"^5.0.14\"\n    postcss-value-parser \"^3.2.3\"\n    svgo \"^0.7.0\"\n\npostcss-unique-selectors@^2.0.2:\n  version \"2.0.2\"\n  resolved \"https://registry.yarnpkg.com/postcss-unique-selectors/-/postcss-unique-selectors-2.0.2.tgz#981d57d29ddcb33e7b1dfe1fd43b8649f933ca1d\"\n  dependencies:\n    alphanum-sort \"^1.0.1\"\n    postcss \"^5.0.4\"\n    uniqs \"^2.0.0\"\n\npostcss-value-parser@^3.0.1, postcss-value-parser@^3.0.2, postcss-value-parser@^3.1.1, postcss-value-parser@^3.1.2, postcss-value-parser@^3.2.3, postcss-value-parser@^3.3.0:\n  version \"3.3.0\"\n  resolved \"https://registry.yarnpkg.com/postcss-value-parser/-/postcss-value-parser-3.3.0.tgz#87f38f9f18f774a4ab4c8a232f5c5ce8872a9d15\"\n\npostcss-zindex@^2.0.1:\n  version \"2.1.1\"\n  resolved \"https://registry.yarnpkg.com/postcss-zindex/-/postcss-zindex-2.1.1.tgz#ea3fbe656c9738aa8729e2ee96ec2a46089b720f\"\n  dependencies:\n    postcss \"^5.0.4\"\n    uniqs \"^2.0.0\"\n\npostcss@^5.0.10, postcss@^5.0.11, postcss@^5.0.12, postcss@^5.0.13, postcss@^5.0.14, postcss@^5.0.16, postcss@^5.0.19, postcss@^5.0.2, postcss@^5.0.4, postcss@^5.0.5, postcss@^5.0.6, postcss@^5.0.8, postcss@^5.2.5:\n  version \"5.2.5\"\n  resolved \"https://registry.yarnpkg.com/postcss/-/postcss-5.2.5.tgz#ec428c27dffc7fac65961340a9b022fa4af5f056\"\n  dependencies:\n    chalk \"^1.1.3\"\n    js-base64 \"^2.1.9\"\n    source-map \"^0.5.6\"\n    supports-color \"^3.1.2\"\n\nprelude-ls@~1.1.2:\n  version \"1.1.2\"\n  resolved \"https://registry.yarnpkg.com/prelude-ls/-/prelude-ls-1.1.2.tgz#21932a549f5e52ffd9a827f570e04be62a97da54\"\n\nprepend-http@^1.0.0:\n  version \"1.0.4\"\n  resolved \"https://registry.yarnpkg.com/prepend-http/-/prepend-http-1.0.4.tgz#d4f4562b0ce3696e41ac52d0e002e57a635dc6dc\"\n\npreserve@^0.2.0:\n  version \"0.2.0\"\n  resolved \"https://registry.yarnpkg.com/preserve/-/preserve-0.2.0.tgz#815ed1f6ebc65926f865b310c0713bcb3315ce4b\"\n\npretty-format@^18.0.0:\n  version \"18.0.0\"\n  resolved \"https://registry.yarnpkg.com/pretty-format/-/pretty-format-18.0.0.tgz#5f45c59fe2ed6749d46765429679670b08b21137\"\n  dependencies:\n    ansi-styles \"^2.2.1\"\n\nprivate@^0.1.6, private@~0.1.5:\n  version \"0.1.6\"\n  resolved \"https://registry.yarnpkg.com/private/-/private-0.1.6.tgz#55c6a976d0f9bafb9924851350fe47b9b5fbb7c1\"\n\nprocess-nextick-args@~1.0.6:\n  version \"1.0.7\"\n  resolved \"https://registry.yarnpkg.com/process-nextick-args/-/process-nextick-args-1.0.7.tgz#150e20b756590ad3f91093f25a4f2ad8bff30ba3\"\n\nprocess@^0.11.0, process@~0.11.0:\n  version \"0.11.9\"\n  resolved \"https://registry.yarnpkg.com/process/-/process-0.11.9.tgz#7bd5ad21aa6253e7da8682264f1e11d11c0318c1\"\n\nprocess@~0.5.1:\n  version \"0.5.2\"\n  resolved \"https://registry.yarnpkg.com/process/-/process-0.5.2.tgz#1638d8a8e34c2f440a91db95ab9aeb677fc185cf\"\n\nprogress@^1.1.8:\n  version \"1.1.8\"\n  resolved \"https://registry.yarnpkg.com/progress/-/progress-1.1.8.tgz#e260c78f6161cdd9b0e56cc3e0a85de17c7a57be\"\n\npromise@^7.1.1:\n  version \"7.1.1\"\n  resolved \"https://registry.yarnpkg.com/promise/-/promise-7.1.1.tgz#489654c692616b8aa55b0724fa809bb7db49c5bf\"\n  dependencies:\n    asap \"~2.0.3\"\n\nprop-types@^15.5.10:\n  version \"15.5.10\"\n  resolved \"https://registry.yarnpkg.com/prop-types/-/prop-types-15.5.10.tgz#2797dfc3126182e3a95e3dfbb2e893ddd7456154\"\n  dependencies:\n    fbjs \"^0.8.9\"\n    loose-envify \"^1.3.1\"\n\nproxy-addr@~1.1.2:\n  version \"1.1.2\"\n  resolved \"https://registry.yarnpkg.com/proxy-addr/-/proxy-addr-1.1.2.tgz#b4cc5f22610d9535824c123aef9d3cf73c40ba37\"\n  dependencies:\n    forwarded \"~0.1.0\"\n    ipaddr.js \"1.1.1\"\n\nprr@~0.0.0:\n  version \"0.0.0\"\n  resolved \"https://registry.yarnpkg.com/prr/-/prr-0.0.0.tgz#1a84b85908325501411853d0081ee3fa86e2926a\"\n\nps-tree@^1.0.1:\n  version \"1.1.0\"\n  resolved \"https://registry.yarnpkg.com/ps-tree/-/ps-tree-1.1.0.tgz#b421b24140d6203f1ed3c76996b4427b08e8c014\"\n  dependencies:\n    event-stream \"~3.3.0\"\n\npseudomap@^1.0.1:\n  version \"1.0.2\"\n  resolved \"https://registry.yarnpkg.com/pseudomap/-/pseudomap-1.0.2.tgz#f052a28da70e618917ef0a8ac34c1ae5a68286b3\"\n\npunycode@1.3.2:\n  version \"1.3.2\"\n  resolved \"https://registry.yarnpkg.com/punycode/-/punycode-1.3.2.tgz#9653a036fb7c1ee42342f2325cceefea3926c48d\"\n\npunycode@^1.2.4, punycode@^1.4.1:\n  version \"1.4.1\"\n  resolved \"https://registry.yarnpkg.com/punycode/-/punycode-1.4.1.tgz#c0d5a63b2718800ad8e1eb0fa5269c84dd41845e\"\n\nq@^1.1.2, q@^1.4.1:\n  version \"1.4.1\"\n  resolved \"https://registry.yarnpkg.com/q/-/q-1.4.1.tgz#55705bcd93c5f3673530c2c2cbc0c2b3addc286e\"\n\nqs@2.3.3:\n  version \"2.3.3\"\n  resolved \"https://registry.yarnpkg.com/qs/-/qs-2.3.3.tgz#e9e85adbe75da0bbe4c8e0476a086290f863b404\"\n\nqs@6.2.0:\n  version \"6.2.0\"\n  resolved \"https://registry.yarnpkg.com/qs/-/qs-6.2.0.tgz#3b7848c03c2dece69a9522b0fae8c4126d745f3b\"\n\nqs@~6.3.0:\n  version \"6.3.0\"\n  resolved \"https://registry.yarnpkg.com/qs/-/qs-6.3.0.tgz#f403b264f23bc01228c74131b407f18d5ea5d442\"\n\nquery-string@^3.0.0:\n  version \"3.0.3\"\n  resolved \"https://registry.yarnpkg.com/query-string/-/query-string-3.0.3.tgz#ae2e14b4d05071d4e9b9eb4873c35b0dcd42e638\"\n  dependencies:\n    strict-uri-encode \"^1.0.0\"\n\nquery-string@^4.1.0:\n  version \"4.2.3\"\n  resolved \"https://registry.yarnpkg.com/query-string/-/query-string-4.2.3.tgz#9f27273d207a25a8ee4c7b8c74dcd45d556db822\"\n  dependencies:\n    object-assign \"^4.1.0\"\n    strict-uri-encode \"^1.0.0\"\n\nquerystring-es3@~0.2.0:\n  version \"0.2.1\"\n  resolved \"https://registry.yarnpkg.com/querystring-es3/-/querystring-es3-0.2.1.tgz#9ec61f79049875707d69414596fd907a4d711e73\"\n\nquerystring@0.2.0, querystring@^0.2.0:\n  version \"0.2.0\"\n  resolved \"https://registry.yarnpkg.com/querystring/-/querystring-0.2.0.tgz#b209849203bb25df820da756e747005878521620\"\n\nquerystringify@0.0.x:\n  version \"0.0.4\"\n  resolved \"https://registry.yarnpkg.com/querystringify/-/querystringify-0.0.4.tgz#0cf7f84f9463ff0ae51c4c4b142d95be37724d9c\"\n\nraf@^3.3.0:\n  version \"3.3.0\"\n  resolved \"https://registry.yarnpkg.com/raf/-/raf-3.3.0.tgz#93845eeffc773f8129039f677f80a36044eee2c3\"\n  dependencies:\n    performance-now \"~0.2.0\"\n\nrandom-bytes@~1.0.0:\n  version \"1.0.0\"\n  resolved \"https://registry.yarnpkg.com/random-bytes/-/random-bytes-1.0.0.tgz#4f68a1dc0ae58bd3fb95848c30324db75d64360b\"\n\nrandomatic@^1.1.3:\n  version \"1.1.5\"\n  resolved \"https://registry.yarnpkg.com/randomatic/-/randomatic-1.1.5.tgz#5e9ef5f2d573c67bd2b8124ae90b5156e457840b\"\n  dependencies:\n    is-number \"^2.0.2\"\n    kind-of \"^3.0.2\"\n\nrange-parser@^1.0.3, range-parser@~1.2.0:\n  version \"1.2.0\"\n  resolved \"https://registry.yarnpkg.com/range-parser/-/range-parser-1.2.0.tgz#f49be6b487894ddc40dcc94a322f611092e00d5e\"\n\nraw-body@~2.1.2, raw-body@~2.1.7:\n  version \"2.1.7\"\n  resolved \"https://registry.yarnpkg.com/raw-body/-/raw-body-2.1.7.tgz#adfeace2e4fb3098058014d08c072dcc59758774\"\n  dependencies:\n    bytes \"2.4.0\"\n    iconv-lite \"0.4.13\"\n    unpipe \"1.0.0\"\n\nrc@^1.0.1, rc@^1.1.1, rc@~1.1.6:\n  version \"1.1.6\"\n  resolved \"https://registry.yarnpkg.com/rc/-/rc-1.1.6.tgz#43651b76b6ae53b5c802f1151fa3fc3b059969c9\"\n  dependencies:\n    deep-extend \"~0.4.0\"\n    ini \"~1.3.0\"\n    minimist \"^1.2.0\"\n    strip-json-comments \"~1.0.4\"\n\nreact:\n  version \"15.4.1\"\n  resolved \"https://registry.yarnpkg.com/react/-/react-15.4.1.tgz#498e918602677a3983cd0fd206dfe700389a0dd6\"\n  dependencies:\n    fbjs \"^0.8.4\"\n    loose-envify \"^1.1.0\"\n    object-assign \"^4.1.0\"\n\nreact-deep-force-update@^1.0.0:\n  version \"1.0.1\"\n  resolved \"https://registry.yarnpkg.com/react-deep-force-update/-/react-deep-force-update-1.0.1.tgz#f911b5be1d2a6fe387507dd6e9a767aa2924b4c7\"\n\nreact-dom:\n  version \"15.4.1\"\n  resolved \"https://registry.yarnpkg.com/react-dom/-/react-dom-15.4.1.tgz#d54c913261aaedb17adc20410d029dcc18a1344a\"\n  dependencies:\n    fbjs \"^0.8.1\"\n    loose-envify \"^1.1.0\"\n    object-assign \"^4.1.0\"\n\nreact-dropzone@^3.2.2:\n  version \"3.7.3\"\n  resolved \"https://registry.yarnpkg.com/react-dropzone/-/react-dropzone-3.7.3.tgz#7852b6652a43afc7fa072021f3369123ea4a61e0\"\n  dependencies:\n    attr-accept \"^1.0.3\"\n\nreact-gemini-scrollbar@^2.0.1:\n  version \"2.1.5\"\n  resolved \"https://registry.yarnpkg.com/react-gemini-scrollbar/-/react-gemini-scrollbar-2.1.5.tgz#bffff23f03b0bb09e633d8ea66f4160ac34682f5\"\n  dependencies:\n    gemini-scrollbar \"1.3.x\"\n\nreact-google-maps@^4.6.0:\n  version \"4.11.0\"\n  resolved \"https://registry.yarnpkg.com/react-google-maps/-/react-google-maps-4.11.0.tgz#077a7d937685b5ff359d0b6ebb54505adec68712\"\n  dependencies:\n    can-use-dom \"^0.1.0\"\n    google-maps-infobox \"^1.1.13\"\n    invariant \"^2.1.1\"\n    lodash.isequal \"^3.0.4\"\n    marker-clusterer-plus \"^2.1.4\"\n    react-prop-types-element-of-type \"^2.1.0\"\n    scriptjs \"^2.5.8\"\n    warning \"^2.1.0\"\n\nreact-prop-types-element-of-type@^2.1.0:\n  version \"2.2.0\"\n  resolved \"https://registry.yarnpkg.com/react-prop-types-element-of-type/-/react-prop-types-element-of-type-2.2.0.tgz#bcc332d3903c2259cf68c28a81c4a663faba59ac\"\n\nreact-proxy@^1.1.7:\n  version \"1.1.8\"\n  resolved \"https://registry.yarnpkg.com/react-proxy/-/react-proxy-1.1.8.tgz#9dbfd9d927528c3aa9f444e4558c37830ab8c26a\"\n  dependencies:\n    lodash \"^4.6.1\"\n    react-deep-force-update \"^1.0.0\"\n\nreact-redux:\n  version \"5.0.1\"\n  resolved \"https://registry.yarnpkg.com/react-redux/-/react-redux-5.0.1.tgz#84a41bd4cdd180452bb6922bc79ad25bd5abb7c4\"\n  dependencies:\n    hoist-non-react-statics \"^1.0.3\"\n    invariant \"^2.0.0\"\n    lodash \"^4.2.0\"\n    lodash-es \"^4.2.0\"\n    loose-envify \"^1.1.0\"\n\nreact-router@2.8.1:\n  version \"2.8.1\"\n  resolved \"https://registry.yarnpkg.com/react-router/-/react-router-2.8.1.tgz#73e9491f6ceb316d0f779829081863e378ee4ed7\"\n  dependencies:\n    history \"^2.1.2\"\n    hoist-non-react-statics \"^1.2.0\"\n    invariant \"^2.2.1\"\n    loose-envify \"^1.2.0\"\n    warning \"^3.0.0\"\n\nreact-transform-catch-errors@^1.0.2:\n  version \"1.0.2\"\n  resolved \"https://registry.yarnpkg.com/react-transform-catch-errors/-/react-transform-catch-errors-1.0.2.tgz#1b4d4a76e97271896fc16fe3086c793ec88a9eeb\"\n\nreact-transform-hmr@^1.0.2:\n  version \"1.0.4\"\n  resolved \"https://registry.yarnpkg.com/react-transform-hmr/-/react-transform-hmr-1.0.4.tgz#e1a40bd0aaefc72e8dfd7a7cda09af85066397bb\"\n  dependencies:\n    global \"^4.3.0\"\n    react-proxy \"^1.1.7\"\n\nread-all-stream@^3.0.0:\n  version \"3.1.0\"\n  resolved \"https://registry.yarnpkg.com/read-all-stream/-/read-all-stream-3.1.0.tgz#35c3e177f2078ef789ee4bfafa4373074eaef4fa\"\n  dependencies:\n    pinkie-promise \"^2.0.0\"\n    readable-stream \"^2.0.0\"\n\nread-pkg-up@^1.0.1:\n  version \"1.0.1\"\n  resolved \"https://registry.yarnpkg.com/read-pkg-up/-/read-pkg-up-1.0.1.tgz#9d63c13276c065918d57f002a57f40a1b643fb02\"\n  dependencies:\n    find-up \"^1.0.0\"\n    read-pkg \"^1.0.0\"\n\nread-pkg@^1.0.0:\n  version \"1.1.0\"\n  resolved \"https://registry.yarnpkg.com/read-pkg/-/read-pkg-1.1.0.tgz#f5ffaa5ecd29cb31c0474bca7d756b6bb29e3f28\"\n  dependencies:\n    load-json-file \"^1.0.0\"\n    normalize-package-data \"^2.3.2\"\n    path-type \"^1.0.0\"\n\nreadable-stream@1.0.27-1:\n  version \"1.0.27-1\"\n  resolved \"https://registry.yarnpkg.com/readable-stream/-/readable-stream-1.0.27-1.tgz#6b67983c20357cefd07f0165001a16d710d91078\"\n  dependencies:\n    core-util-is \"~1.0.0\"\n    inherits \"~2.0.1\"\n    isarray \"0.0.1\"\n    string_decoder \"~0.10.x\"\n\nreadable-stream@1.0.31:\n  version \"1.0.31\"\n  resolved \"https://registry.yarnpkg.com/readable-stream/-/readable-stream-1.0.31.tgz#8f2502e0bc9e3b0da1b94520aabb4e2603ecafae\"\n  dependencies:\n    core-util-is \"~1.0.0\"\n    inherits \"~2.0.1\"\n    isarray \"0.0.1\"\n    string_decoder \"~0.10.x\"\n\nreadable-stream@1.1.x, readable-stream@^1.0.27-1, readable-stream@^1.1.13:\n  version \"1.1.14\"\n  resolved \"https://registry.yarnpkg.com/readable-stream/-/readable-stream-1.1.14.tgz#7cf4c54ef648e3813084c636dd2079e166c081d9\"\n  dependencies:\n    core-util-is \"~1.0.0\"\n    inherits \"~2.0.1\"\n    isarray \"0.0.1\"\n    string_decoder \"~0.10.x\"\n\nreadable-stream@2.1.5, readable-stream@^2.0.0, \"readable-stream@^2.0.0 || ^1.1.13\", readable-stream@^2.0.1, readable-stream@^2.0.2, readable-stream@~2.1.4:\n  version \"2.1.5\"\n  resolved \"https://registry.yarnpkg.com/readable-stream/-/readable-stream-2.1.5.tgz#66fa8b720e1438b364681f2ad1a63c618448c9d0\"\n  dependencies:\n    buffer-shims \"^1.0.0\"\n    core-util-is \"~1.0.0\"\n    inherits \"~2.0.1\"\n    isarray \"~1.0.0\"\n    process-nextick-args \"~1.0.6\"\n    string_decoder \"~0.10.x\"\n    util-deprecate \"~1.0.1\"\n\nreadable-stream@~2.0.0:\n  version \"2.0.6\"\n  resolved \"https://registry.yarnpkg.com/readable-stream/-/readable-stream-2.0.6.tgz#8f90341e68a53ccc928788dacfcd11b36eb9b78e\"\n  dependencies:\n    core-util-is \"~1.0.0\"\n    inherits \"~2.0.1\"\n    isarray \"~1.0.0\"\n    process-nextick-args \"~1.0.6\"\n    string_decoder \"~0.10.x\"\n    util-deprecate \"~1.0.1\"\n\nreaddirp@^2.0.0:\n  version \"2.1.0\"\n  resolved \"https://registry.yarnpkg.com/readdirp/-/readdirp-2.1.0.tgz#4ed0ad060df3073300c48440373f72d1cc642d78\"\n  dependencies:\n    graceful-fs \"^4.1.2\"\n    minimatch \"^3.0.2\"\n    readable-stream \"^2.0.2\"\n    set-immediate-shim \"^1.0.1\"\n\nreadline2@^1.0.1:\n  version \"1.0.1\"\n  resolved \"https://registry.yarnpkg.com/readline2/-/readline2-1.0.1.tgz#41059608ffc154757b715d9989d199ffbf372e35\"\n  dependencies:\n    code-point-at \"^1.0.0\"\n    is-fullwidth-code-point \"^1.0.0\"\n    mute-stream \"0.0.5\"\n\nredbox-react@^1.2.0:\n  version \"1.3.3\"\n  resolved \"https://registry.yarnpkg.com/redbox-react/-/redbox-react-1.3.3.tgz#63ec9c2cb9c620c46e2b9f8543b4898f1b787e41\"\n  dependencies:\n    error-stack-parser \"^1.3.6\"\n    object-assign \"^4.0.1\"\n\nredeyed@~1.0.0:\n  version \"1.0.1\"\n  resolved \"https://registry.yarnpkg.com/redeyed/-/redeyed-1.0.1.tgz#e96c193b40c0816b00aec842698e61185e55498a\"\n  dependencies:\n    esprima \"~3.0.0\"\n\nreduce-component@1.0.1:\n  version \"1.0.1\"\n  resolved \"https://registry.yarnpkg.com/reduce-component/-/reduce-component-1.0.1.tgz#e0c93542c574521bea13df0f9488ed82ab77c5da\"\n\nreduce-css-calc@^1.2.6:\n  version \"1.3.0\"\n  resolved \"https://registry.yarnpkg.com/reduce-css-calc/-/reduce-css-calc-1.3.0.tgz#747c914e049614a4c9cfbba629871ad1d2927716\"\n  dependencies:\n    balanced-match \"^0.4.2\"\n    math-expression-evaluator \"^1.2.14\"\n    reduce-function-call \"^1.0.1\"\n\nreduce-function-call@^1.0.1:\n  version \"1.0.1\"\n  resolved \"https://registry.yarnpkg.com/reduce-function-call/-/reduce-function-call-1.0.1.tgz#fa02e126e695824263cab91d3a5b0fdc1dd27a9a\"\n  dependencies:\n    balanced-match \"~0.1.0\"\n\nredux-combine-actions@^0.1.2:\n  version \"0.1.2\"\n  resolved \"https://registry.yarnpkg.com/redux-combine-actions/-/redux-combine-actions-0.1.2.tgz#052829a08458481db5e1b80f369976fd73b3a9e4\"\n\nredux-logger@^2.0.4:\n  version \"2.7.4\"\n  resolved \"https://registry.yarnpkg.com/redux-logger/-/redux-logger-2.7.4.tgz#891e5d29e7f111d08b5781a237b9965b5858c7f8\"\n  dependencies:\n    deep-diff \"0.3.4\"\n\nredux-router@^2.1.2:\n  version \"2.1.2\"\n  resolved \"https://registry.yarnpkg.com/redux-router/-/redux-router-2.1.2.tgz#034724bad08f41baf754db4d22e2d858adb64f11\"\n  dependencies:\n    deep-equal \"^1.0.1\"\n\nredux-thunk@^1.0.0:\n  version \"1.0.3\"\n  resolved \"https://registry.yarnpkg.com/redux-thunk/-/redux-thunk-1.0.3.tgz#778aa0099eea0595031ab6b39165f6670d8d26bd\"\n\nredux@^3.6.0:\n  version \"3.6.0\"\n  resolved \"https://registry.yarnpkg.com/redux/-/redux-3.6.0.tgz#887c2b3d0b9bd86eca2be70571c27654c19e188d\"\n  dependencies:\n    lodash \"^4.2.1\"\n    lodash-es \"^4.2.1\"\n    loose-envify \"^1.1.0\"\n    symbol-observable \"^1.0.2\"\n\nregenerate@^1.2.1:\n  version \"1.3.2\"\n  resolved \"https://registry.yarnpkg.com/regenerate/-/regenerate-1.3.2.tgz#d1941c67bad437e1be76433add5b385f95b19260\"\n\nregenerator-runtime@^0.9.5:\n  version \"0.9.6\"\n  resolved \"https://registry.yarnpkg.com/regenerator-runtime/-/regenerator-runtime-0.9.6.tgz#d33eb95d0d2001a4be39659707c51b0cb71ce029\"\n\nregex-cache@^0.4.2:\n  version \"0.4.3\"\n  resolved \"https://registry.yarnpkg.com/regex-cache/-/regex-cache-0.4.3.tgz#9b1a6c35d4d0dfcef5711ae651e8e9d3d7114145\"\n  dependencies:\n    is-equal-shallow \"^0.1.3\"\n    is-primitive \"^2.0.0\"\n\nregexp-clone@0.0.1:\n  version \"0.0.1\"\n  resolved \"https://registry.yarnpkg.com/regexp-clone/-/regexp-clone-0.0.1.tgz#a7c2e09891fdbf38fbb10d376fb73003e68ac589\"\n\nregexpu-core@^1.0.0:\n  version \"1.0.0\"\n  resolved \"https://registry.yarnpkg.com/regexpu-core/-/regexpu-core-1.0.0.tgz#86a763f58ee4d7c2f6b102e4764050de7ed90c6b\"\n  dependencies:\n    regenerate \"^1.2.1\"\n    regjsgen \"^0.2.0\"\n    regjsparser \"^0.1.4\"\n\nregexpu-core@^2.0.0:\n  version \"2.0.0\"\n  resolved \"https://registry.yarnpkg.com/regexpu-core/-/regexpu-core-2.0.0.tgz#49d038837b8dcf8bfa5b9a42139938e6ea2ae240\"\n  dependencies:\n    regenerate \"^1.2.1\"\n    regjsgen \"^0.2.0\"\n    regjsparser \"^0.1.4\"\n\nregistry-url@^3.0.0:\n  version \"3.1.0\"\n  resolved \"https://registry.yarnpkg.com/registry-url/-/registry-url-3.1.0.tgz#3d4ef870f73dde1d77f0cf9a381432444e174942\"\n  dependencies:\n    rc \"^1.0.1\"\n\nregjsgen@^0.2.0:\n  version \"0.2.0\"\n  resolved \"https://registry.yarnpkg.com/regjsgen/-/regjsgen-0.2.0.tgz#6c016adeac554f75823fe37ac05b92d5a4edb1f7\"\n\nregjsparser@^0.1.4:\n  version \"0.1.5\"\n  resolved \"https://registry.yarnpkg.com/regjsparser/-/regjsparser-0.1.5.tgz#7ee8f84dc6fa792d3fd0ae228d24bd949ead205c\"\n  dependencies:\n    jsesc \"~0.5.0\"\n\nrelate-js@0.7.6:\n  version \"0.7.6\"\n  resolved \"https://registry.yarnpkg.com/relate-js/-/relate-js-0.7.6.tgz#36b52e3525f1594d3087bba1edd7af96ee5ff858\"\n  dependencies:\n    hoist-non-react-statics \"^1.1.0\"\n    invariant \"^2.2.0\"\n    lodash \"^4.16.6\"\n    q \"^1.4.1\"\n    relax-fragments \"^0.1.4\"\n    superagent \"^1.7.2\"\n    warning \"^2.1.0\"\n\nrelax-fragments@0.1.1:\n  version \"0.1.1\"\n  resolved \"https://registry.yarnpkg.com/relax-fragments/-/relax-fragments-0.1.1.tgz#e5525582c1973bd2e1516cd65de82dc9de21504a\"\n  dependencies:\n    lodash.foreach \"^3.0.3\"\n    lodash.merge \"^3.3.2\"\n\nrelax-fragments@^0.1.4:\n  version \"0.1.4\"\n  resolved \"https://registry.yarnpkg.com/relax-fragments/-/relax-fragments-0.1.4.tgz#db78f120c2403cb551574f64cb0c6ce3ead19566\"\n  dependencies:\n    lodash.foreach \"^3.0.3\"\n    lodash.merge \"^3.3.2\"\n\nrelax-jss@0.2.1:\n  version \"0.2.1\"\n  resolved \"https://registry.yarnpkg.com/relax-jss/-/relax-jss-0.2.1.tgz#203dc7804a1972f87df0d2f4d0c3f36173dab495\"\n  dependencies:\n    lodash.foreach \"^3.0.3\"\n\nrelax-velocity-animate@1.0.0:\n  version \"1.0.0\"\n  resolved \"https://registry.yarnpkg.com/relax-velocity-animate/-/relax-velocity-animate-1.0.0.tgz#930a41b4f8ffddff6e152c7448c06dc89bf7573d\"\n  dependencies:\n    jquery \">= 1.4.3\"\n\nrepeat-element@^1.1.2:\n  version \"1.1.2\"\n  resolved \"https://registry.yarnpkg.com/repeat-element/-/repeat-element-1.1.2.tgz#ef089a178d1483baae4d93eb98b4f9e4e11d990a\"\n\nrepeat-string@^1.5.2:\n  version \"1.6.1\"\n  resolved \"https://registry.yarnpkg.com/repeat-string/-/repeat-string-1.6.1.tgz#8dcae470e1c88abc2d600fff4a776286da75e637\"\n\nrepeating@^1.1.2:\n  version \"1.1.3\"\n  resolved \"https://registry.yarnpkg.com/repeating/-/repeating-1.1.3.tgz#3d4114218877537494f97f77f9785fab810fa4ac\"\n  dependencies:\n    is-finite \"^1.0.0\"\n\nrepeating@^2.0.0:\n  version \"2.0.1\"\n  resolved \"https://registry.yarnpkg.com/repeating/-/repeating-2.0.1.tgz#5214c53a926d3552707527fbab415dbc08d06dda\"\n  dependencies:\n    is-finite \"^1.0.0\"\n\nrequest@^2.55.0, request@^2.75.0:\n  version \"2.78.0\"\n  resolved \"https://registry.yarnpkg.com/request/-/request-2.78.0.tgz#e1c8dec346e1c81923b24acdb337f11decabe9cc\"\n  dependencies:\n    aws-sign2 \"~0.6.0\"\n    aws4 \"^1.2.1\"\n    caseless \"~0.11.0\"\n    combined-stream \"~1.0.5\"\n    extend \"~3.0.0\"\n    forever-agent \"~0.6.1\"\n    form-data \"~2.1.1\"\n    har-validator \"~2.0.6\"\n    hawk \"~3.1.3\"\n    http-signature \"~1.1.0\"\n    is-typedarray \"~1.0.0\"\n    isstream \"~0.1.2\"\n    json-stringify-safe \"~5.0.1\"\n    mime-types \"~2.1.7\"\n    node-uuid \"~1.4.7\"\n    oauth-sign \"~0.8.1\"\n    qs \"~6.3.0\"\n    stringstream \"~0.0.4\"\n    tough-cookie \"~2.3.0\"\n    tunnel-agent \"~0.4.1\"\n\nrequire-directory@^2.1.1:\n  version \"2.1.1\"\n  resolved \"https://registry.yarnpkg.com/require-directory/-/require-directory-2.1.1.tgz#8c64ad5fd30dab1c976e2344ffe7f792a6a6df42\"\n\nrequire-main-filename@^1.0.1:\n  version \"1.0.1\"\n  resolved \"https://registry.yarnpkg.com/require-main-filename/-/require-main-filename-1.0.1.tgz#97f717b69d48784f5f526a6c5aa8ffdda055a4d1\"\n\nrequire-uncached@^1.0.2:\n  version \"1.0.3\"\n  resolved \"https://registry.yarnpkg.com/require-uncached/-/require-uncached-1.0.3.tgz#4e0d56d6c9662fd31e43011c4b95aa49955421d3\"\n  dependencies:\n    caller-path \"^0.1.0\"\n    resolve-from \"^1.0.0\"\n\nrequire_optional@~1.0.0:\n  version \"1.0.0\"\n  resolved \"https://registry.yarnpkg.com/require_optional/-/require_optional-1.0.0.tgz#52a86137a849728eb60a55533617f8f914f59abf\"\n  dependencies:\n    resolve-from \"^2.0.0\"\n    semver \"^5.1.0\"\n\nrequires-port@1.0.x, requires-port@1.x.x:\n  version \"1.0.0\"\n  resolved \"https://registry.yarnpkg.com/requires-port/-/requires-port-1.0.0.tgz#925d2601d39ac485e091cf0da5c6e694dc3dcaff\"\n\nresolve-from@^1.0.0:\n  version \"1.0.1\"\n  resolved \"https://registry.yarnpkg.com/resolve-from/-/resolve-from-1.0.1.tgz#26cbfe935d1aeeeabb29bc3fe5aeb01e93d44226\"\n\nresolve-from@^2.0.0:\n  version \"2.0.0\"\n  resolved \"https://registry.yarnpkg.com/resolve-from/-/resolve-from-2.0.0.tgz#9480ab20e94ffa1d9e80a804c7ea147611966b57\"\n\nresolve@1.1.7:\n  version \"1.1.7\"\n  resolved \"https://registry.yarnpkg.com/resolve/-/resolve-1.1.7.tgz#203114d82ad2c5ed9e8e0411b3932875e889e97b\"\n\nresolve@^1.1.6:\n  version \"1.2.0\"\n  resolved \"https://registry.yarnpkg.com/resolve/-/resolve-1.2.0.tgz#9589c3f2f6149d1417a40becc1663db6ec6bc26c\"\n\nrestore-cursor@^1.0.1:\n  version \"1.0.1\"\n  resolved \"https://registry.yarnpkg.com/restore-cursor/-/restore-cursor-1.0.1.tgz#34661f46886327fed2991479152252df92daa541\"\n  dependencies:\n    exit-hook \"^1.0.0\"\n    onetime \"^1.0.0\"\n\nright-align@^0.1.1:\n  version \"0.1.3\"\n  resolved \"https://registry.yarnpkg.com/right-align/-/right-align-0.1.3.tgz#61339b722fe6a3515689210d24e14c96148613ef\"\n  dependencies:\n    align-text \"^0.1.1\"\n\nrimraf@2, rimraf@^2.2.8, rimraf@^2.4.3, rimraf@^2.4.4, rimraf@~2.5.1, rimraf@~2.5.4:\n  version \"2.5.4\"\n  resolved \"https://registry.yarnpkg.com/rimraf/-/rimraf-2.5.4.tgz#96800093cbf1a0c86bd95b4625467535c29dfa04\"\n  dependencies:\n    glob \"^7.0.5\"\n\nripemd160@0.2.0:\n  version \"0.2.0\"\n  resolved \"https://registry.yarnpkg.com/ripemd160/-/ripemd160-0.2.0.tgz#2bf198bde167cacfa51c0a928e84b68bbe171fce\"\n\nrun-async@^0.1.0:\n  version \"0.1.0\"\n  resolved \"https://registry.yarnpkg.com/run-async/-/run-async-0.1.0.tgz#c8ad4a5e110661e402a7d21b530e009f25f8e389\"\n  dependencies:\n    once \"^1.3.0\"\n\nrx-lite@^3.1.2:\n  version \"3.1.2\"\n  resolved \"https://registry.yarnpkg.com/rx-lite/-/rx-lite-3.1.2.tgz#19ce502ca572665f3b647b10939f97fd1615f102\"\n\nrx@2.3.24:\n  version \"2.3.24\"\n  resolved \"https://registry.yarnpkg.com/rx/-/rx-2.3.24.tgz#14f950a4217d7e35daa71bbcbe58eff68ea4b2b7\"\n\nsane@~1.4.1:\n  version \"1.4.1\"\n  resolved \"https://registry.yarnpkg.com/sane/-/sane-1.4.1.tgz#88f763d74040f5f0c256b6163db399bf110ac715\"\n  dependencies:\n    exec-sh \"^0.2.0\"\n    fb-watchman \"^1.8.0\"\n    minimatch \"^3.0.2\"\n    minimist \"^1.1.1\"\n    walker \"~1.0.5\"\n    watch \"~0.10.0\"\n\nsax@^1.1.4, sax@~1.2.1:\n  version \"1.2.1\"\n  resolved \"https://registry.yarnpkg.com/sax/-/sax-1.2.1.tgz#7b8e656190b228e81a66aea748480d828cd2d37a\"\n\nscmp@^1.0.0:\n  version \"1.0.2\"\n  resolved \"https://registry.yarnpkg.com/scmp/-/scmp-1.0.2.tgz#bc4e4e2713252b04210cdff9cef3ade2c8fa7370\"\n\nscriptjs@^2.5.8:\n  version \"2.5.8\"\n  resolved \"https://registry.yarnpkg.com/scriptjs/-/scriptjs-2.5.8.tgz#d0c43955c2e6bad33b6e4edf7b53b8965aa7ca5f\"\n\nsemver-diff@^2.0.0:\n  version \"2.1.0\"\n  resolved \"https://registry.yarnpkg.com/semver-diff/-/semver-diff-2.1.0.tgz#4bbb8437c8d37e4b0cf1a68fd726ec6d645d6d36\"\n  dependencies:\n    semver \"^5.0.3\"\n\n\"semver@2 || 3 || 4 || 5\", semver@^5.0.3, semver@^5.1.0, semver@^5.3.0, semver@~5.3.0:\n  version \"5.3.0\"\n  resolved \"https://registry.yarnpkg.com/semver/-/semver-5.3.0.tgz#9b2ce5d3de02d17c6012ad326aa6b4d0cf54f94f\"\n\nsend@0.14.1:\n  version \"0.14.1\"\n  resolved \"https://registry.yarnpkg.com/send/-/send-0.14.1.tgz#a954984325392f51532a7760760e459598c89f7a\"\n  dependencies:\n    debug \"~2.2.0\"\n    depd \"~1.1.0\"\n    destroy \"~1.0.4\"\n    encodeurl \"~1.0.1\"\n    escape-html \"~1.0.3\"\n    etag \"~1.7.0\"\n    fresh \"0.3.0\"\n    http-errors \"~1.5.0\"\n    mime \"1.3.4\"\n    ms \"0.7.1\"\n    on-finished \"~2.3.0\"\n    range-parser \"~1.2.0\"\n    statuses \"~1.3.0\"\n\nserialize-javascript@^1.1.2:\n  version \"1.3.0\"\n  resolved \"https://registry.yarnpkg.com/serialize-javascript/-/serialize-javascript-1.3.0.tgz#86a4f3752f5c7e47295449b0bbb63d64ba533f05\"\n\nserve-index@^1.7.2:\n  version \"1.8.0\"\n  resolved \"https://registry.yarnpkg.com/serve-index/-/serve-index-1.8.0.tgz#7c5d96c13fb131101f93c1c5774f8516a1e78d3b\"\n  dependencies:\n    accepts \"~1.3.3\"\n    batch \"0.5.3\"\n    debug \"~2.2.0\"\n    escape-html \"~1.0.3\"\n    http-errors \"~1.5.0\"\n    mime-types \"~2.1.11\"\n    parseurl \"~1.3.1\"\n\nserve-static@~1.11.1:\n  version \"1.11.1\"\n  resolved \"https://registry.yarnpkg.com/serve-static/-/serve-static-1.11.1.tgz#d6cce7693505f733c759de57befc1af76c0f0805\"\n  dependencies:\n    encodeurl \"~1.0.1\"\n    escape-html \"~1.0.3\"\n    parseurl \"~1.3.1\"\n    send \"0.14.1\"\n\nset-blocking@^2.0.0, set-blocking@~2.0.0:\n  version \"2.0.0\"\n  resolved \"https://registry.yarnpkg.com/set-blocking/-/set-blocking-2.0.0.tgz#045f9782d011ae9a6803ddd382b24392b3d890f7\"\n\nset-immediate-shim@^1.0.1:\n  version \"1.0.1\"\n  resolved \"https://registry.yarnpkg.com/set-immediate-shim/-/set-immediate-shim-1.0.1.tgz#4b2b1b27eb808a9f8dcc481a58e5e56f599f3f61\"\n\nsetimmediate@^1.0.5:\n  version \"1.0.5\"\n  resolved \"https://registry.yarnpkg.com/setimmediate/-/setimmediate-1.0.5.tgz#290cbb232e306942d7d7ea9b83732ab7856f8285\"\n\nsetprototypeof@1.0.2:\n  version \"1.0.2\"\n  resolved \"https://registry.yarnpkg.com/setprototypeof/-/setprototypeof-1.0.2.tgz#81a552141ec104b88e89ce383103ad5c66564d08\"\n\nsha.js@2.2.6:\n  version \"2.2.6\"\n  resolved \"https://registry.yarnpkg.com/sha.js/-/sha.js-2.2.6.tgz#17ddeddc5f722fb66501658895461977867315ba\"\n\nshallowequal@^0.2.2:\n  version \"0.2.2\"\n  resolved \"https://registry.yarnpkg.com/shallowequal/-/shallowequal-0.2.2.tgz#1e32fd5bcab6ad688a4812cb0cc04efc75c7014e\"\n  dependencies:\n    lodash.keys \"^3.1.2\"\n\nsharp@^0.16.1:\n  version \"0.16.2\"\n  resolved \"https://registry.yarnpkg.com/sharp/-/sharp-0.16.2.tgz#99381fb9dfbeaa89aa6d13ac77c5756b1e56e9e1\"\n  dependencies:\n    bluebird \"^3.4.6\"\n    color \"^0.11.3\"\n    nan \"^2.4.0\"\n    request \"^2.75.0\"\n    semver \"^5.3.0\"\n    tar \"^2.2.1\"\n\nshebang-regex@^1.0.0:\n  version \"1.0.0\"\n  resolved \"https://registry.yarnpkg.com/shebang-regex/-/shebang-regex-1.0.0.tgz#da42f49740c0b42db2ca9728571cb190c98efea3\"\n\nshelljs@^0.6.0:\n  version \"0.6.1\"\n  resolved \"https://registry.yarnpkg.com/shelljs/-/shelljs-0.6.1.tgz#ec6211bed1920442088fe0f70b2837232ed2c8a8\"\n\nshellwords@^0.1.0:\n  version \"0.1.0\"\n  resolved \"https://registry.yarnpkg.com/shellwords/-/shellwords-0.1.0.tgz#66afd47b6a12932d9071cbfd98a52e785cd0ba14\"\n\nsignal-exit@^3.0.0:\n  version \"3.0.1\"\n  resolved \"https://registry.yarnpkg.com/signal-exit/-/signal-exit-3.0.1.tgz#5a4c884992b63a7acd9badb7894c3ee9cfccad81\"\n\nslash@^1.0.0:\n  version \"1.0.0\"\n  resolved \"https://registry.yarnpkg.com/slash/-/slash-1.0.0.tgz#c41f2f6c39fc16d1cd17ad4b5d896114ae470d55\"\n\nslice-ansi@0.0.4:\n  version \"0.0.4\"\n  resolved \"https://registry.yarnpkg.com/slice-ansi/-/slice-ansi-0.0.4.tgz#edbf8903f66f7ce2f8eafd6ceed65e264c831b35\"\n\nsliced@0.0.5:\n  version \"0.0.5\"\n  resolved \"https://registry.yarnpkg.com/sliced/-/sliced-0.0.5.tgz#5edc044ca4eb6f7816d50ba2fc63e25d8fe4707f\"\n\nsliced@1.0.1:\n  version \"1.0.1\"\n  resolved \"https://registry.yarnpkg.com/sliced/-/sliced-1.0.1.tgz#0b3a662b5d04c3177b1926bea82b03f837a2ef41\"\n\nslide@^1.1.5:\n  version \"1.1.6\"\n  resolved \"https://registry.yarnpkg.com/slide/-/slide-1.1.6.tgz#56eb027d65b4d2dce6cb2e2d32c4d4afc9e1d707\"\n\nslug@^0.9.1:\n  version \"0.9.1\"\n  resolved \"https://registry.yarnpkg.com/slug/-/slug-0.9.1.tgz#af08f608a7c11516b61778aa800dce84c518cfda\"\n  dependencies:\n    unicode \">= 0.3.1\"\n\nsmtp-connection@^1.3.1, smtp-connection@^1.3.7:\n  version \"1.3.8\"\n  resolved \"https://registry.yarnpkg.com/smtp-connection/-/smtp-connection-1.3.8.tgz#55832c2160cfb3086e1dcd87fd1c19fa61b7f536\"\n\nsntp@1.x.x:\n  version \"1.0.9\"\n  resolved \"https://registry.yarnpkg.com/sntp/-/sntp-1.0.9.tgz#6541184cc90aeea6c6e7b35e2659082443c66198\"\n  dependencies:\n    hoek \"2.x.x\"\n\nsockjs-client@^1.0.3:\n  version \"1.1.1\"\n  resolved \"https://registry.yarnpkg.com/sockjs-client/-/sockjs-client-1.1.1.tgz#284843e9a9784d7c474b1571b3240fca9dda4bb0\"\n  dependencies:\n    debug \"^2.2.0\"\n    eventsource \"~0.1.6\"\n    faye-websocket \"~0.11.0\"\n    inherits \"^2.0.1\"\n    json3 \"^3.3.2\"\n    url-parse \"^1.1.1\"\n\nsockjs@^0.3.15:\n  version \"0.3.18\"\n  resolved \"https://registry.yarnpkg.com/sockjs/-/sockjs-0.3.18.tgz#d9b289316ca7df77595ef299e075f0f937eb4207\"\n  dependencies:\n    faye-websocket \"^0.10.0\"\n    uuid \"^2.0.2\"\n\nsort-keys@^1.0.0:\n  version \"1.1.2\"\n  resolved \"https://registry.yarnpkg.com/sort-keys/-/sort-keys-1.1.2.tgz#441b6d4d346798f1b4e49e8920adfba0e543f9ad\"\n  dependencies:\n    is-plain-obj \"^1.0.0\"\n\nsource-list-map@^0.1.4, source-list-map@~0.1.0:\n  version \"0.1.6\"\n  resolved \"https://registry.yarnpkg.com/source-list-map/-/source-list-map-0.1.6.tgz#e1e6f94f0b40c4d28dcf8f5b8766e0e45636877f\"\n\nsource-map-support@^0.4.0, source-map-support@^0.4.2:\n  version \"0.4.6\"\n  resolved \"https://registry.yarnpkg.com/source-map-support/-/source-map-support-0.4.6.tgz#32552aa64b458392a85eab3b0b5ee61527167aeb\"\n  dependencies:\n    source-map \"^0.5.3\"\n\nsource-map@^0.4.4, source-map@~0.4.1:\n  version \"0.4.4\"\n  resolved \"https://registry.yarnpkg.com/source-map/-/source-map-0.4.4.tgz#eba4f5da9c0dc999de68032d8b4f76173652036b\"\n  dependencies:\n    amdefine \">=0.0.4\"\n\nsource-map@^0.5.0, source-map@^0.5.3, source-map@^0.5.6, source-map@~0.5.1, source-map@~0.5.3:\n  version \"0.5.6\"\n  resolved \"https://registry.yarnpkg.com/source-map/-/source-map-0.5.6.tgz#75ce38f52bf0733c5a7f0c118d81334a2bb5f412\"\n\nsource-map@~0.2.0:\n  version \"0.2.0\"\n  resolved \"https://registry.yarnpkg.com/source-map/-/source-map-0.2.0.tgz#dab73fbcfc2ba819b4de03bd6f6eaa48164b3f9d\"\n  dependencies:\n    amdefine \">=0.0.4\"\n\nspawn-default-shell@^1.1.0:\n  version \"1.1.0\"\n  resolved \"https://registry.yarnpkg.com/spawn-default-shell/-/spawn-default-shell-1.1.0.tgz#095439d44c4b7c0aff56a53929fbaab87878e7c6\"\n\nspdx-correct@~1.0.0:\n  version \"1.0.2\"\n  resolved \"https://registry.yarnpkg.com/spdx-correct/-/spdx-correct-1.0.2.tgz#4b3073d933ff51f3912f03ac5519498a4150db40\"\n  dependencies:\n    spdx-license-ids \"^1.0.2\"\n\nspdx-expression-parse@~1.0.0:\n  version \"1.0.4\"\n  resolved \"https://registry.yarnpkg.com/spdx-expression-parse/-/spdx-expression-parse-1.0.4.tgz#9bdf2f20e1f40ed447fbe273266191fced51626c\"\n\nspdx-license-ids@^1.0.2:\n  version \"1.2.2\"\n  resolved \"https://registry.yarnpkg.com/spdx-license-ids/-/spdx-license-ids-1.2.2.tgz#c9df7a3424594ade6bd11900d596696dc06bac57\"\n\nsplit@0.3:\n  version \"0.3.3\"\n  resolved \"https://registry.yarnpkg.com/split/-/split-0.3.3.tgz#cd0eea5e63a211dfff7eb0f091c4133e2d0dd28f\"\n  dependencies:\n    through \"2\"\n\nsprintf-js@~1.0.2:\n  version \"1.0.3\"\n  resolved \"https://registry.yarnpkg.com/sprintf-js/-/sprintf-js-1.0.3.tgz#04e6926f662895354f3dd015203633b857297e2c\"\n\nsshpk@^1.7.0:\n  version \"1.10.1\"\n  resolved \"https://registry.yarnpkg.com/sshpk/-/sshpk-1.10.1.tgz#30e1a5d329244974a1af61511339d595af6638b0\"\n  dependencies:\n    asn1 \"~0.2.3\"\n    assert-plus \"^1.0.0\"\n    dashdash \"^1.12.0\"\n    getpass \"^0.1.1\"\n  optionalDependencies:\n    bcrypt-pbkdf \"^1.0.0\"\n    ecc-jsbn \"~0.1.1\"\n    jodid25519 \"^1.0.0\"\n    jsbn \"~0.1.0\"\n    tweetnacl \"~0.14.0\"\n\nstack-trace@0.0.x:\n  version \"0.0.9\"\n  resolved \"https://registry.yarnpkg.com/stack-trace/-/stack-trace-0.0.9.tgz#a8f6eaeca90674c333e7c43953f275b451510695\"\n\nstackframe@^0.3.1:\n  version \"0.3.1\"\n  resolved \"https://registry.yarnpkg.com/stackframe/-/stackframe-0.3.1.tgz#33aa84f1177a5548c8935533cbfeb3420975f5a4\"\n\nstatuses@1, \"statuses@>= 1.3.1 < 2\", statuses@~1.3.0:\n  version \"1.3.1\"\n  resolved \"https://registry.yarnpkg.com/statuses/-/statuses-1.3.1.tgz#faf51b9eb74aaef3b3acf4ad5f61abf24cb7b93e\"\n\nstream-browserify@^1.0.0:\n  version \"1.0.0\"\n  resolved \"https://registry.yarnpkg.com/stream-browserify/-/stream-browserify-1.0.0.tgz#bf9b4abfb42b274d751479e44e0ff2656b6f1193\"\n  dependencies:\n    inherits \"~2.0.1\"\n    readable-stream \"^1.0.27-1\"\n\nstream-cache@~0.0.1:\n  version \"0.0.2\"\n  resolved \"https://registry.yarnpkg.com/stream-cache/-/stream-cache-0.0.2.tgz#1ac5ad6832428ca55667dbdee395dad4e6db118f\"\n\nstream-combiner@~0.0.4:\n  version \"0.0.4\"\n  resolved \"https://registry.yarnpkg.com/stream-combiner/-/stream-combiner-0.0.4.tgz#4d5e433c185261dde623ca3f44c586bcf5c4ad14\"\n  dependencies:\n    duplexer \"~0.1.1\"\n\nstream-shift@^1.0.0:\n  version \"1.0.0\"\n  resolved \"https://registry.yarnpkg.com/stream-shift/-/stream-shift-1.0.0.tgz#d5c752825e5367e786f78e18e445ea223a155952\"\n\nstreamsearch@0.1.2:\n  version \"0.1.2\"\n  resolved \"https://registry.yarnpkg.com/streamsearch/-/streamsearch-0.1.2.tgz#808b9d0e56fc273d809ba57338e929919a1a9f1a\"\n\nstrict-uri-encode@^1.0.0:\n  version \"1.1.0\"\n  resolved \"https://registry.yarnpkg.com/strict-uri-encode/-/strict-uri-encode-1.1.0.tgz#279b225df1d582b1f54e65addd4352e18faa0713\"\n\nstring-length@^1.0.0:\n  version \"1.0.1\"\n  resolved \"https://registry.yarnpkg.com/string-length/-/string-length-1.0.1.tgz#56970fb1c38558e9e70b728bf3de269ac45adfac\"\n  dependencies:\n    strip-ansi \"^3.0.0\"\n\nstring-width@^1.0.1, string-width@^1.0.2:\n  version \"1.0.2\"\n  resolved \"https://registry.yarnpkg.com/string-width/-/string-width-1.0.2.tgz#118bdf5b8cdc51a2a7e70d211e07e2b0b9b107d3\"\n  dependencies:\n    code-point-at \"^1.0.0\"\n    is-fullwidth-code-point \"^1.0.0\"\n    strip-ansi \"^3.0.0\"\n\nstring-width@^2.0.0:\n  version \"2.0.0\"\n  resolved \"https://registry.yarnpkg.com/string-width/-/string-width-2.0.0.tgz#635c5436cc72a6e0c387ceca278d4e2eec52687e\"\n  dependencies:\n    is-fullwidth-code-point \"^2.0.0\"\n    strip-ansi \"^3.0.0\"\n\nstring.prototype.codepointat@^0.2.0:\n  version \"0.2.0\"\n  resolved \"https://registry.yarnpkg.com/string.prototype.codepointat/-/string.prototype.codepointat-0.2.0.tgz#6b26e9bd3afcaa7be3b4269b526de1b82000ac78\"\n\nstring_decoder@~0.10.25, string_decoder@~0.10.x:\n  version \"0.10.31\"\n  resolved \"https://registry.yarnpkg.com/string_decoder/-/string_decoder-0.10.31.tgz#62e203bc41766c6c28c9fc84301dab1c5310fa94\"\n\nstringstream@~0.0.4:\n  version \"0.0.5\"\n  resolved \"https://registry.yarnpkg.com/stringstream/-/stringstream-0.0.5.tgz#4e484cd4de5a0bbbee18e46307710a8a81621878\"\n\nstrip-ansi@^0.3.0:\n  version \"0.3.0\"\n  resolved \"https://registry.yarnpkg.com/strip-ansi/-/strip-ansi-0.3.0.tgz#25f48ea22ca79187f3174a4db8759347bb126220\"\n  dependencies:\n    ansi-regex \"^0.2.1\"\n\nstrip-ansi@^3.0.0, strip-ansi@^3.0.1:\n  version \"3.0.1\"\n  resolved \"https://registry.yarnpkg.com/strip-ansi/-/strip-ansi-3.0.1.tgz#6a385fb8853d952d5ff05d0e8aaf94278dc63dcf\"\n  dependencies:\n    ansi-regex \"^2.0.0\"\n\nstrip-bom@^2.0.0:\n  version \"2.0.0\"\n  resolved \"https://registry.yarnpkg.com/strip-bom/-/strip-bom-2.0.0.tgz#6219a85616520491f35788bdbf1447a99c7e6b0e\"\n  dependencies:\n    is-utf8 \"^0.2.0\"\n\nstrip-json-comments@~1.0.1, strip-json-comments@~1.0.4:\n  version \"1.0.4\"\n  resolved \"https://registry.yarnpkg.com/strip-json-comments/-/strip-json-comments-1.0.4.tgz#1e15fbcac97d3ee99bf2d73b4c656b082bbafb91\"\n\nstyle-loader@^0.13.0:\n  version \"0.13.1\"\n  resolved \"https://registry.yarnpkg.com/style-loader/-/style-loader-0.13.1.tgz#468280efbc0473023cd3a6cd56e33b5a1d7fc3a9\"\n  dependencies:\n    loader-utils \"^0.2.7\"\n\nsuperagent@^1.6.1, superagent@^1.7.2:\n  version \"1.8.4\"\n  resolved \"https://registry.yarnpkg.com/superagent/-/superagent-1.8.4.tgz#68b2c8a400f1753ddb39410906899e42f420fd3a\"\n  dependencies:\n    component-emitter \"~1.2.0\"\n    cookiejar \"2.0.6\"\n    debug \"2\"\n    extend \"3.0.0\"\n    form-data \"1.0.0-rc3\"\n    formidable \"~1.0.14\"\n    methods \"~1.1.1\"\n    mime \"1.3.4\"\n    qs \"2.3.3\"\n    readable-stream \"1.0.27-1\"\n    reduce-component \"1.0.1\"\n\nsupports-color@^0.2.0:\n  version \"0.2.0\"\n  resolved \"https://registry.yarnpkg.com/supports-color/-/supports-color-0.2.0.tgz#d92de2694eb3f67323973d7ae3d8b55b4c22190a\"\n\nsupports-color@^2.0.0:\n  version \"2.0.0\"\n  resolved \"https://registry.yarnpkg.com/supports-color/-/supports-color-2.0.0.tgz#535d045ce6b6363fa40117084629995e9df324c7\"\n\nsupports-color@^3.1.0, supports-color@^3.1.1, supports-color@^3.1.2:\n  version \"3.1.2\"\n  resolved \"https://registry.yarnpkg.com/supports-color/-/supports-color-3.1.2.tgz#72a262894d9d408b956ca05ff37b2ed8a6e2a2d5\"\n  dependencies:\n    has-flag \"^1.0.0\"\n\nsvgo@^0.7.0:\n  version \"0.7.1\"\n  resolved \"https://registry.yarnpkg.com/svgo/-/svgo-0.7.1.tgz#287320fed972cb097e72c2bb1685f96fe08f8034\"\n  dependencies:\n    coa \"~1.0.1\"\n    colors \"~1.1.2\"\n    csso \"~2.2.1\"\n    js-yaml \"~3.6.1\"\n    mkdirp \"~0.5.1\"\n    sax \"~1.2.1\"\n    whet.extend \"~0.9.9\"\n\nsymbol-observable@^1.0.2:\n  version \"1.0.4\"\n  resolved \"https://registry.yarnpkg.com/symbol-observable/-/symbol-observable-1.0.4.tgz#29bf615d4aa7121bdd898b22d4b3f9bc4e2aa03d\"\n\n\"symbol-tree@>= 3.1.0 < 4.0.0\":\n  version \"3.2.0\"\n  resolved \"https://registry.yarnpkg.com/symbol-tree/-/symbol-tree-3.2.0.tgz#2183fcd165fc30048b3421aad29ada7a339ea566\"\n\ntable@^3.7.8:\n  version \"3.8.3\"\n  resolved \"https://registry.yarnpkg.com/table/-/table-3.8.3.tgz#2bbc542f0fda9861a755d3947fefd8b3f513855f\"\n  dependencies:\n    ajv \"^4.7.0\"\n    ajv-keywords \"^1.0.0\"\n    chalk \"^1.1.1\"\n    lodash \"^4.0.0\"\n    slice-ansi \"0.0.4\"\n    string-width \"^2.0.0\"\n\ntapable@^0.1.8, tapable@~0.1.8:\n  version \"0.1.10\"\n  resolved \"https://registry.yarnpkg.com/tapable/-/tapable-0.1.10.tgz#29c35707c2b70e50d07482b5d202e8ed446dafd4\"\n\ntar-pack@~3.3.0:\n  version \"3.3.0\"\n  resolved \"https://registry.yarnpkg.com/tar-pack/-/tar-pack-3.3.0.tgz#30931816418f55afc4d21775afdd6720cee45dae\"\n  dependencies:\n    debug \"~2.2.0\"\n    fstream \"~1.0.10\"\n    fstream-ignore \"~1.0.5\"\n    once \"~1.3.3\"\n    readable-stream \"~2.1.4\"\n    rimraf \"~2.5.1\"\n    tar \"~2.2.1\"\n    uid-number \"~0.0.6\"\n\ntar@^2.2.1, tar@~2.2.1:\n  version \"2.2.1\"\n  resolved \"https://registry.yarnpkg.com/tar/-/tar-2.2.1.tgz#8e4d2a256c0e2185c6b18ad694aec968b83cb1d1\"\n  dependencies:\n    block-stream \"*\"\n    fstream \"^1.0.2\"\n    inherits \"2\"\n\ntest-exclude@^3.2.2:\n  version \"3.3.0\"\n  resolved \"https://registry.yarnpkg.com/test-exclude/-/test-exclude-3.3.0.tgz#7a17ca1239988c98367b0621456dbb7d4bc38977\"\n  dependencies:\n    arrify \"^1.0.1\"\n    micromatch \"^2.3.11\"\n    object-assign \"^4.1.0\"\n    read-pkg-up \"^1.0.1\"\n    require-main-filename \"^1.0.1\"\n\ntext-table@~0.2.0:\n  version \"0.2.0\"\n  resolved \"https://registry.yarnpkg.com/text-table/-/text-table-0.2.0.tgz#7f5ee823ae805207c00af2df4a84ec3fcfa570b4\"\n\nthroat@^3.0.0:\n  version \"3.0.0\"\n  resolved \"https://registry.yarnpkg.com/throat/-/throat-3.0.0.tgz#e7c64c867cbb3845f10877642f7b60055b8ec0d6\"\n\nthrough@2, through@^2.3.6, through@~2.3, through@~2.3.1:\n  version \"2.3.8\"\n  resolved \"https://registry.yarnpkg.com/through/-/through-2.3.8.tgz#0dd4c9ffaabc357960b1b724115d7e0e86a2e1f5\"\n\ntimed-out@^2.0.0:\n  version \"2.0.0\"\n  resolved \"https://registry.yarnpkg.com/timed-out/-/timed-out-2.0.0.tgz#f38b0ae81d3747d628001f41dafc652ace671c0a\"\n\ntimers-browserify@^1.0.1:\n  version \"1.4.2\"\n  resolved \"https://registry.yarnpkg.com/timers-browserify/-/timers-browserify-1.4.2.tgz#c9c58b575be8407375cb5e2462dacee74359f41d\"\n  dependencies:\n    process \"~0.11.0\"\n\ntmpl@1.0.x:\n  version \"1.0.4\"\n  resolved \"https://registry.yarnpkg.com/tmpl/-/tmpl-1.0.4.tgz#23640dd7b42d00433911140820e5cf440e521dd1\"\n\nto-fast-properties@^1.0.1:\n  version \"1.0.2\"\n  resolved \"https://registry.yarnpkg.com/to-fast-properties/-/to-fast-properties-1.0.2.tgz#f3f5c0c3ba7299a7ef99427e44633257ade43320\"\n\ntouch@1.0.0:\n  version \"1.0.0\"\n  resolved \"https://registry.yarnpkg.com/touch/-/touch-1.0.0.tgz#449cbe2dbae5a8c8038e30d71fa0ff464947c4de\"\n  dependencies:\n    nopt \"~1.0.10\"\n\ntough-cookie@^2.3.1, tough-cookie@~2.3.0:\n  version \"2.3.2\"\n  resolved \"https://registry.yarnpkg.com/tough-cookie/-/tough-cookie-2.3.2.tgz#f081f76e4c85720e6c37a5faced737150d84072a\"\n  dependencies:\n    punycode \"^1.4.1\"\n\ntr46@~0.0.3:\n  version \"0.0.3\"\n  resolved \"https://registry.yarnpkg.com/tr46/-/tr46-0.0.3.tgz#8184fd347dac9cdc185992f3a6622e14b9d9ab6a\"\n\ntree-kill@^1.1.0:\n  version \"1.1.0\"\n  resolved \"https://registry.yarnpkg.com/tree-kill/-/tree-kill-1.1.0.tgz#c963dcf03722892ec59cba569e940b71954d1729\"\n\ntryit@^1.0.1:\n  version \"1.0.3\"\n  resolved \"https://registry.yarnpkg.com/tryit/-/tryit-1.0.3.tgz#393be730a9446fd1ead6da59a014308f36c289cb\"\n\ntty-browserify@0.0.0:\n  version \"0.0.0\"\n  resolved \"https://registry.yarnpkg.com/tty-browserify/-/tty-browserify-0.0.0.tgz#a157ba402da24e9bf957f9aa69d524eed42901a6\"\n\ntunnel-agent@~0.4.1:\n  version \"0.4.3\"\n  resolved \"https://registry.yarnpkg.com/tunnel-agent/-/tunnel-agent-0.4.3.tgz#6373db76909fe570e08d73583365ed828a74eeeb\"\n\ntweetnacl@^0.14.3, tweetnacl@~0.14.0:\n  version \"0.14.3\"\n  resolved \"https://registry.yarnpkg.com/tweetnacl/-/tweetnacl-0.14.3.tgz#3da382f670f25ded78d7b3d1792119bca0b7132d\"\n\ntype-check@~0.3.2:\n  version \"0.3.2\"\n  resolved \"https://registry.yarnpkg.com/type-check/-/type-check-0.3.2.tgz#5884cab512cf1d355e3fb784f30804b2b520db72\"\n  dependencies:\n    prelude-ls \"~1.1.2\"\n\ntype-is@^1.6.4, type-is@~1.6.13:\n  version \"1.6.13\"\n  resolved \"https://registry.yarnpkg.com/type-is/-/type-is-1.6.13.tgz#6e83ba7bc30cd33a7bb0b7fb00737a2085bf9d08\"\n  dependencies:\n    media-typer \"0.3.0\"\n    mime-types \"~2.1.11\"\n\ntypedarray@~0.0.5:\n  version \"0.0.6\"\n  resolved \"https://registry.yarnpkg.com/typedarray/-/typedarray-0.0.6.tgz#867ac74e3864187b1d3d47d996a78ec5c8830777\"\n\nua-parser-js@^0.7.9:\n  version \"0.7.12\"\n  resolved \"https://registry.yarnpkg.com/ua-parser-js/-/ua-parser-js-0.7.12.tgz#04c81a99bdd5dc52263ea29d24c6bf8d4818a4bb\"\n\nuglify-js@^2.6, uglify-js@~2.7.3:\n  version \"2.7.4\"\n  resolved \"https://registry.yarnpkg.com/uglify-js/-/uglify-js-2.7.4.tgz#a295a0de12b6a650c031c40deb0dc40b14568bd2\"\n  dependencies:\n    async \"~0.2.6\"\n    source-map \"~0.5.1\"\n    uglify-to-browserify \"~1.0.0\"\n    yargs \"~3.10.0\"\n\nuglify-to-browserify@~1.0.0:\n  version \"1.0.2\"\n  resolved \"https://registry.yarnpkg.com/uglify-to-browserify/-/uglify-to-browserify-1.0.2.tgz#6e0924d6bda6b5afe349e39a6d632850a0f882b7\"\n\nuid-number@~0.0.6:\n  version \"0.0.6\"\n  resolved \"https://registry.yarnpkg.com/uid-number/-/uid-number-0.0.6.tgz#0ea10e8035e8eb5b8e4449f06da1c730663baa81\"\n\nuid-safe@~2.1.3:\n  version \"2.1.3\"\n  resolved \"https://registry.yarnpkg.com/uid-safe/-/uid-safe-2.1.3.tgz#077e264a00b3187936b270bb7376a26473631071\"\n  dependencies:\n    base64-url \"1.3.3\"\n    random-bytes \"~1.0.0\"\n\nundefsafe@0.0.3:\n  version \"0.0.3\"\n  resolved \"https://registry.yarnpkg.com/undefsafe/-/undefsafe-0.0.3.tgz#ecca3a03e56b9af17385baac812ac83b994a962f\"\n\n\"unicode@>= 0.3.1\", unicode@^0.6.1:\n  version \"0.6.1\"\n  resolved \"https://registry.yarnpkg.com/unicode/-/unicode-0.6.1.tgz#ec69e3c4537e2b9650b826133bcb068f0445d0bc\"\n  dependencies:\n    bufferstream \">= 0.6.2\"\n\nuniq@^1.0.1:\n  version \"1.0.1\"\n  resolved \"https://registry.yarnpkg.com/uniq/-/uniq-1.0.1.tgz#b31c5ae8254844a3a8281541ce2b04b865a734ff\"\n\nuniqid@^4.0.0:\n  version \"4.1.0\"\n  resolved \"https://registry.yarnpkg.com/uniqid/-/uniqid-4.1.0.tgz#33d9679f65022f48988a03fd24e7dcaf8f109eca\"\n  dependencies:\n    macaddress \"^0.2.8\"\n\nuniqs@^2.0.0:\n  version \"2.0.0\"\n  resolved \"https://registry.yarnpkg.com/uniqs/-/uniqs-2.0.0.tgz#ffede4b36b25290696e6e165d4a59edb998e6b02\"\n\nunpipe@1.0.0, unpipe@~1.0.0:\n  version \"1.0.0\"\n  resolved \"https://registry.yarnpkg.com/unpipe/-/unpipe-1.0.0.tgz#b2bf4ee8514aae6165b4817829d21b2ef49904ec\"\n\nupdate-notifier@0.5.0:\n  version \"0.5.0\"\n  resolved \"https://registry.yarnpkg.com/update-notifier/-/update-notifier-0.5.0.tgz#07b5dc2066b3627ab3b4f530130f7eddda07a4cc\"\n  dependencies:\n    chalk \"^1.0.0\"\n    configstore \"^1.0.0\"\n    is-npm \"^1.0.0\"\n    latest-version \"^1.0.0\"\n    repeating \"^1.1.2\"\n    semver-diff \"^2.0.0\"\n    string-length \"^1.0.0\"\n\nurl-loader@^0.5.6:\n  version \"0.5.7\"\n  resolved \"https://registry.yarnpkg.com/url-loader/-/url-loader-0.5.7.tgz#67e8779759f8000da74994906680c943a9b0925d\"\n  dependencies:\n    loader-utils \"0.2.x\"\n    mime \"1.2.x\"\n\nurl-parse@1.0.x:\n  version \"1.0.5\"\n  resolved \"https://registry.yarnpkg.com/url-parse/-/url-parse-1.0.5.tgz#0854860422afdcfefeb6c965c662d4800169927b\"\n  dependencies:\n    querystringify \"0.0.x\"\n    requires-port \"1.0.x\"\n\nurl-parse@^1.1.1:\n  version \"1.1.7\"\n  resolved \"https://registry.yarnpkg.com/url-parse/-/url-parse-1.1.7.tgz#025cff999653a459ab34232147d89514cc87d74a\"\n  dependencies:\n    querystringify \"0.0.x\"\n    requires-port \"1.0.x\"\n\nurl@~0.10.1:\n  version \"0.10.3\"\n  resolved \"https://registry.yarnpkg.com/url/-/url-0.10.3.tgz#021e4d9c7705f21bbf37d03ceb58767402774c64\"\n  dependencies:\n    punycode \"1.3.2\"\n    querystring \"0.2.0\"\n\nuser-home@^2.0.0:\n  version \"2.0.0\"\n  resolved \"https://registry.yarnpkg.com/user-home/-/user-home-2.0.0.tgz#9c70bfd8169bc1dcbf48604e0f04b8b49cde9e9f\"\n  dependencies:\n    os-homedir \"^1.0.0\"\n\nutil-deprecate@~1.0.1:\n  version \"1.0.2\"\n  resolved \"https://registry.yarnpkg.com/util-deprecate/-/util-deprecate-1.0.2.tgz#450d4dc9fa70de732762fbd2d4a28981419a0ccf\"\n\nutil@0.10.3, util@~0.10.3:\n  version \"0.10.3\"\n  resolved \"https://registry.yarnpkg.com/util/-/util-0.10.3.tgz#7afb1afe50805246489e3db7fe0ed379336ac0f9\"\n  dependencies:\n    inherits \"2.0.1\"\n\nutils-merge@1.0.0:\n  version \"1.0.0\"\n  resolved \"https://registry.yarnpkg.com/utils-merge/-/utils-merge-1.0.0.tgz#0294fb922bb9375153541c4f7096231f287c8af8\"\n\nuuid@^2.0.1, uuid@^2.0.2:\n  version \"2.0.3\"\n  resolved \"https://registry.yarnpkg.com/uuid/-/uuid-2.0.3.tgz#67e2e863797215530dff318e5bf9dcebfd47b21a\"\n\nvalidate-npm-package-license@^3.0.1:\n  version \"3.0.1\"\n  resolved \"https://registry.yarnpkg.com/validate-npm-package-license/-/validate-npm-package-license-3.0.1.tgz#2804babe712ad3379459acfbe24746ab2c303fbc\"\n  dependencies:\n    spdx-correct \"~1.0.0\"\n    spdx-expression-parse \"~1.0.0\"\n\nvary@~1.1.0:\n  version \"1.1.0\"\n  resolved \"https://registry.yarnpkg.com/vary/-/vary-1.1.0.tgz#e1e5affbbd16ae768dd2674394b9ad3022653140\"\n\nvendors@^1.0.0:\n  version \"1.0.1\"\n  resolved \"https://registry.yarnpkg.com/vendors/-/vendors-1.0.1.tgz#37ad73c8ee417fb3d580e785312307d274847f22\"\n\nverror@1.3.6:\n  version \"1.3.6\"\n  resolved \"https://registry.yarnpkg.com/verror/-/verror-1.3.6.tgz#cff5df12946d297d2baaefaa2689e25be01c005c\"\n  dependencies:\n    extsprintf \"1.0.2\"\n\nvm-browserify@0.0.4:\n  version \"0.0.4\"\n  resolved \"https://registry.yarnpkg.com/vm-browserify/-/vm-browserify-0.0.4.tgz#5d7ea45bbef9e4a6ff65f95438e0a87c357d5a73\"\n  dependencies:\n    indexof \"0.0.1\"\n\nwalker@~1.0.5:\n  version \"1.0.7\"\n  resolved \"https://registry.yarnpkg.com/walker/-/walker-1.0.7.tgz#2f7f9b8fd10d677262b18a884e28d19618e028fb\"\n  dependencies:\n    makeerror \"1.0.x\"\n\nwarning@^2.0.0, warning@^2.1.0:\n  version \"2.1.0\"\n  resolved \"https://registry.yarnpkg.com/warning/-/warning-2.1.0.tgz#21220d9c63afc77a8c92111e011af705ce0c6901\"\n  dependencies:\n    loose-envify \"^1.0.0\"\n\nwarning@^3.0.0:\n  version \"3.0.0\"\n  resolved \"https://registry.yarnpkg.com/warning/-/warning-3.0.0.tgz#32e5377cb572de4ab04753bdf8821c01ed605b7c\"\n  dependencies:\n    loose-envify \"^1.0.0\"\n\nwatch@~0.10.0:\n  version \"0.10.0\"\n  resolved \"https://registry.yarnpkg.com/watch/-/watch-0.10.0.tgz#77798b2da0f9910d595f1ace5b0c2258521f21dc\"\n\nwatchpack@^0.2.1:\n  version \"0.2.9\"\n  resolved \"https://registry.yarnpkg.com/watchpack/-/watchpack-0.2.9.tgz#62eaa4ab5e5ba35fdfc018275626e3c0f5e3fb0b\"\n  dependencies:\n    async \"^0.9.0\"\n    chokidar \"^1.0.0\"\n    graceful-fs \"^4.1.2\"\n\nwebidl-conversions@^3.0.0, webidl-conversions@^3.0.1:\n  version \"3.0.1\"\n  resolved \"https://registry.yarnpkg.com/webidl-conversions/-/webidl-conversions-3.0.1.tgz#24534275e2a7bc6be7bc86611cc16ae0a5654871\"\n\nwebpack-core@~0.6.0:\n  version \"0.6.8\"\n  resolved \"https://registry.yarnpkg.com/webpack-core/-/webpack-core-0.6.8.tgz#edf9135de00a6a3c26dd0f14b208af0aa4af8d0a\"\n  dependencies:\n    source-list-map \"~0.1.0\"\n    source-map \"~0.4.1\"\n\nwebpack-dev-middleware@^1.4.0:\n  version \"1.8.4\"\n  resolved \"https://registry.yarnpkg.com/webpack-dev-middleware/-/webpack-dev-middleware-1.8.4.tgz#e8765c9122887ce9e3abd4cc9c3eb31b61e0948d\"\n  dependencies:\n    memory-fs \"~0.3.0\"\n    mime \"^1.3.4\"\n    path-is-absolute \"^1.0.0\"\n    range-parser \"^1.0.3\"\n\nwebpack-dev-server@^1.12.1:\n  version \"1.16.2\"\n  resolved \"https://registry.yarnpkg.com/webpack-dev-server/-/webpack-dev-server-1.16.2.tgz#8bebc2c4ce1c45a15c72dd769d9ba08db306a793\"\n  dependencies:\n    compression \"^1.5.2\"\n    connect-history-api-fallback \"^1.3.0\"\n    express \"^4.13.3\"\n    http-proxy-middleware \"~0.17.1\"\n    open \"0.0.5\"\n    optimist \"~0.6.1\"\n    serve-index \"^1.7.2\"\n    sockjs \"^0.3.15\"\n    sockjs-client \"^1.0.3\"\n    stream-cache \"~0.0.1\"\n    strip-ansi \"^3.0.0\"\n    supports-color \"^3.1.1\"\n    webpack-dev-middleware \"^1.4.0\"\n\nwebpack-hot-middleware@^2.5.0:\n  version \"2.13.2\"\n  resolved \"https://registry.yarnpkg.com/webpack-hot-middleware/-/webpack-hot-middleware-2.13.2.tgz#6500b15e6d4f1a9590f8df708183f4d2ac2c3e9e\"\n  dependencies:\n    ansi-html \"0.0.6\"\n    html-entities \"^1.2.0\"\n    querystring \"^0.2.0\"\n    strip-ansi \"^3.0.0\"\n\nwebpack-node-externals@^1.2.0:\n  version \"1.5.4\"\n  resolved \"https://registry.yarnpkg.com/webpack-node-externals/-/webpack-node-externals-1.5.4.tgz#ea05ba17108a23e776c35c42e7bb0e86c225be00\"\n\nwebpack-sources@^0.1.0:\n  version \"0.1.3\"\n  resolved \"https://registry.yarnpkg.com/webpack-sources/-/webpack-sources-0.1.3.tgz#15ce2fb79d0a1da727444ba7c757bf164294f310\"\n  dependencies:\n    source-list-map \"~0.1.0\"\n    source-map \"~0.5.3\"\n\nwebpack@^1.12.6:\n  version \"1.13.3\"\n  resolved \"https://registry.yarnpkg.com/webpack/-/webpack-1.13.3.tgz#e79c46fe5a37c5ca70084ba0894c595cdcb42815\"\n  dependencies:\n    acorn \"^3.0.0\"\n    async \"^1.3.0\"\n    clone \"^1.0.2\"\n    enhanced-resolve \"~0.9.0\"\n    interpret \"^0.6.4\"\n    loader-utils \"^0.2.11\"\n    memory-fs \"~0.3.0\"\n    mkdirp \"~0.5.0\"\n    node-libs-browser \"^0.6.0\"\n    optimist \"~0.6.0\"\n    supports-color \"^3.1.0\"\n    tapable \"~0.1.8\"\n    uglify-js \"~2.7.3\"\n    watchpack \"^0.2.1\"\n    webpack-core \"~0.6.0\"\n\nwebsocket-driver@>=0.5.1:\n  version \"0.6.5\"\n  resolved \"https://registry.yarnpkg.com/websocket-driver/-/websocket-driver-0.6.5.tgz#5cb2556ceb85f4373c6d8238aa691c8454e13a36\"\n  dependencies:\n    websocket-extensions \">=0.1.1\"\n\nwebsocket-extensions@>=0.1.1:\n  version \"0.1.1\"\n  resolved \"https://registry.yarnpkg.com/websocket-extensions/-/websocket-extensions-0.1.1.tgz#76899499c184b6ef754377c2dbb0cd6cb55d29e7\"\n\nwhatwg-encoding@^1.0.1:\n  version \"1.0.1\"\n  resolved \"https://registry.yarnpkg.com/whatwg-encoding/-/whatwg-encoding-1.0.1.tgz#3c6c451a198ee7aec55b1ec61d0920c67801a5f4\"\n  dependencies:\n    iconv-lite \"0.4.13\"\n\nwhatwg-fetch@>=0.10.0:\n  version \"2.0.1\"\n  resolved \"https://registry.yarnpkg.com/whatwg-fetch/-/whatwg-fetch-2.0.1.tgz#078b9461bbe91cea73cbce8bb122a05f9e92b772\"\n\nwhatwg-url@^3.0.0:\n  version \"3.1.0\"\n  resolved \"https://registry.yarnpkg.com/whatwg-url/-/whatwg-url-3.1.0.tgz#7bdcae490f921aef6451fb6739ec6bbd8e907bf6\"\n  dependencies:\n    tr46 \"~0.0.3\"\n    webidl-conversions \"^3.0.0\"\n\nwhet.extend@~0.9.9:\n  version \"0.9.9\"\n  resolved \"https://registry.yarnpkg.com/whet.extend/-/whet.extend-0.9.9.tgz#f877d5bf648c97e5aa542fadc16d6a259b9c11a1\"\n\nwhich-module@^1.0.0:\n  version \"1.0.0\"\n  resolved \"https://registry.yarnpkg.com/which-module/-/which-module-1.0.0.tgz#bba63ca861948994ff307736089e3b96026c2a4f\"\n\nwhich@^1.0.5, which@^1.1.1, which@^1.2.9:\n  version \"1.2.12\"\n  resolved \"https://registry.yarnpkg.com/which/-/which-1.2.12.tgz#de67b5e450269f194909ef23ece4ebe416fa1192\"\n  dependencies:\n    isexe \"^1.1.1\"\n\nwide-align@^1.1.0:\n  version \"1.1.0\"\n  resolved \"https://registry.yarnpkg.com/wide-align/-/wide-align-1.1.0.tgz#40edde802a71fea1f070da3e62dcda2e7add96ad\"\n  dependencies:\n    string-width \"^1.0.1\"\n\nwindow-size@0.1.0:\n  version \"0.1.0\"\n  resolved \"https://registry.yarnpkg.com/window-size/-/window-size-0.1.0.tgz#5438cd2ea93b202efa3a19fe8887aee7c94f9c9d\"\n\nwindow-size@^0.2.0:\n  version \"0.2.0\"\n  resolved \"https://registry.yarnpkg.com/window-size/-/window-size-0.2.0.tgz#b4315bb4214a3d7058ebeee892e13fa24d98b075\"\n\nwinston@^2.1.0:\n  version \"2.3.0\"\n  resolved \"https://registry.yarnpkg.com/winston/-/winston-2.3.0.tgz#207faaab6fccf3fe493743dd2b03dbafc7ceb78c\"\n  dependencies:\n    async \"~1.0.0\"\n    colors \"1.0.x\"\n    cycle \"1.0.x\"\n    eyes \"0.1.x\"\n    isstream \"0.1.x\"\n    stack-trace \"0.0.x\"\n\nwordwrap@0.0.2:\n  version \"0.0.2\"\n  resolved \"https://registry.yarnpkg.com/wordwrap/-/wordwrap-0.0.2.tgz#b79669bb42ecb409f83d583cad52ca17eaa1643f\"\n\nwordwrap@~0.0.2:\n  version \"0.0.3\"\n  resolved \"https://registry.yarnpkg.com/wordwrap/-/wordwrap-0.0.3.tgz#a3d5da6cd5c0bc0008d37234bbaf1bed63059107\"\n\nwordwrap@~1.0.0:\n  version \"1.0.0\"\n  resolved \"https://registry.yarnpkg.com/wordwrap/-/wordwrap-1.0.0.tgz#27584810891456a4171c8d0226441ade90cbcaeb\"\n\nworker-farm@^1.3.1:\n  version \"1.3.1\"\n  resolved \"https://registry.yarnpkg.com/worker-farm/-/worker-farm-1.3.1.tgz#4333112bb49b17aa050b87895ca6b2cacf40e5ff\"\n  dependencies:\n    errno \">=0.1.1 <0.2.0-0\"\n    xtend \">=4.0.0 <4.1.0-0\"\n\nwrap-ansi@^2.0.0:\n  version \"2.0.0\"\n  resolved \"https://registry.yarnpkg.com/wrap-ansi/-/wrap-ansi-2.0.0.tgz#7d30f8f873f9a5bbc3a64dabc8d177e071ae426f\"\n  dependencies:\n    string-width \"^1.0.1\"\n\nwrappy@1:\n  version \"1.0.2\"\n  resolved \"https://registry.yarnpkg.com/wrappy/-/wrappy-1.0.2.tgz#b5243d8f3ec1aa35f1364605bc0d1036e30ab69f\"\n\nwrite-file-atomic@^1.1.2:\n  version \"1.2.0\"\n  resolved \"https://registry.yarnpkg.com/write-file-atomic/-/write-file-atomic-1.2.0.tgz#14c66d4e4cb3ca0565c28cf3b7a6f3e4d5938fab\"\n  dependencies:\n    graceful-fs \"^4.1.2\"\n    imurmurhash \"^0.1.4\"\n    slide \"^1.1.5\"\n\nwrite@^0.2.1:\n  version \"0.2.1\"\n  resolved \"https://registry.yarnpkg.com/write/-/write-0.2.1.tgz#5fc03828e264cea3fe91455476f7a3c566cb0757\"\n  dependencies:\n    mkdirp \"^0.5.1\"\n\nxdg-basedir@^2.0.0:\n  version \"2.0.0\"\n  resolved \"https://registry.yarnpkg.com/xdg-basedir/-/xdg-basedir-2.0.0.tgz#edbc903cc385fc04523d966a335504b5504d1bd2\"\n  dependencies:\n    os-homedir \"^1.0.0\"\n\n\"xml-name-validator@>= 2.0.1 < 3.0.0\":\n  version \"2.0.1\"\n  resolved \"https://registry.yarnpkg.com/xml-name-validator/-/xml-name-validator-2.0.1.tgz#4d8b8f1eccd3419aa362061becef515e1e559635\"\n\n\"xtend@>=4.0.0 <4.1.0-0\", xtend@^4.0.0:\n  version \"4.0.1\"\n  resolved \"https://registry.yarnpkg.com/xtend/-/xtend-4.0.1.tgz#a5c6d532be656e23db820efb943a1f04998d63af\"\n\ny18n@^3.2.1:\n  version \"3.2.1\"\n  resolved \"https://registry.yarnpkg.com/y18n/-/y18n-3.2.1.tgz#6d15fba884c08679c0d77e88e7759e811e07fa41\"\n\nyallist@^2.0.0:\n  version \"2.0.0\"\n  resolved \"https://registry.yarnpkg.com/yallist/-/yallist-2.0.0.tgz#306c543835f09ee1a4cb23b7bce9ab341c91cdd4\"\n\nyargs-parser@^4.2.0:\n  version \"4.2.0\"\n  resolved \"https://registry.yarnpkg.com/yargs-parser/-/yargs-parser-4.2.0.tgz#6ced869cd05a3dca6a1eaee38b68aeed4b0b4101\"\n  dependencies:\n    camelcase \"^3.0.0\"\n\nyargs@^6.3.0:\n  version \"6.5.0\"\n  resolved \"https://registry.yarnpkg.com/yargs/-/yargs-6.5.0.tgz#a902e23a1f0fe912b2a03f6131b7ed740c9718ff\"\n  dependencies:\n    camelcase \"^3.0.0\"\n    cliui \"^3.2.0\"\n    decamelize \"^1.1.1\"\n    get-caller-file \"^1.0.1\"\n    os-locale \"^1.4.0\"\n    read-pkg-up \"^1.0.1\"\n    require-directory \"^2.1.1\"\n    require-main-filename \"^1.0.1\"\n    set-blocking \"^2.0.0\"\n    string-width \"^1.0.2\"\n    which-module \"^1.0.0\"\n    window-size \"^0.2.0\"\n    y18n \"^3.2.1\"\n    yargs-parser \"^4.2.0\"\n\nyargs@~3.10.0:\n  version \"3.10.0\"\n  resolved \"https://registry.yarnpkg.com/yargs/-/yargs-3.10.0.tgz#f7ee7bd857dd7c1d2d38c0e74efbd681d1431fd1\"\n  dependencies:\n    camelcase \"^1.0.2\"\n    cliui \"^2.1.0\"\n    decamelize \"^1.0.0\"\n    window-size \"0.1.0\"\n"
        }
      ]
    }
  ]
}