{
  "metadata": {
    "timestamp": 1736562047306,
    "page": 806,
    "hasNextPage": true,
    "endCursor": "Y3Vyc29yOjgxMA==",
    "completionStatus": "IN_PROGRESS"
  },
  "repositories": [
    {
      "nameWithOwner": "NickPiscitelli/Glider.js",
      "stars": 3290,
      "defaultBranch": "master",
      "files": [
        {
          "name": ".editorconfig",
          "type": "blob",
          "size": 0.1435546875,
          "content": "root = true\n\n[*]\nindent_style = space\nindent_size = 2\nend_of_line = lf\ncharset = utf-8\ntrim_trailing_whitespace = true\ninsert_final_newline = true\n"
        },
        {
          "name": ".gitignore",
          "type": "blob",
          "size": 0.025390625,
          "content": "node_modules\n.config\n.npm\n"
        },
        {
          "name": "LICENSE.txt",
          "type": "blob",
          "size": 0.9990234375,
          "content": "Permission is hereby granted, free of charge, to any person obtaining a copy of this software and associated documentation files (the \"Software\"), to deal in the Software without restriction, including without limitation the rights to use, copy, modify, merge, publish, distribute, sublicense, and/or sell copies of the Software, and to permit persons to whom the Software is furnished to do so, subject to the following conditions:\n\nThe above copyright notice and this permission notice shall be included in all copies or substantial portions of the Software.\n\nTHE SOFTWARE IS PROVIDED \"AS IS\", WITHOUT WARRANTY OF ANY KIND, EXPRESS OR IMPLIED, INCLUDING BUT NOT LIMITED TO THE WARRANTIES OF MERCHANTABILITY, FITNESS FOR A PARTICULAR PURPOSE AND NONINFRINGEMENT. IN NO EVENT SHALL THE AUTHORS OR COPYRIGHT HOLDERS BE LIABLE FOR ANY CLAIM, DAMAGES OR OTHER LIABILITY, WHETHER IN AN ACTION OF CONTRACT, TORT OR OTHERWISE, ARISING FROM, OUT OF OR IN CONNECTION WITH THE SOFTWARE OR THE USE OR OTHER DEALINGS IN THE SOFTWARE.\n"
        },
        {
          "name": "README.md",
          "type": "blob",
          "size": 5.1337890625,
          "content": "# Glider.js\n\nLatest Version: 1.7.8\nA fast, light-weight, dependency free, responsive, accessible, extendable, native scrolling list with paging controls, methods and events. (< 2.8kb gzipped!)\n\nDemos and full documentation available on Github Pages: https://nickpiscitelli.github.io/Glider.js/\n\n##### Quick Start\n\nInclude glider.min.css:\n\n```html\n<link rel=\"stylesheet\" href=\"glider.min.css\">\nor\n<link rel=\"stylesheet\" href=\"https://cdn.jsdelivr.net/npm/glider-js@1/glider.min.css\">\n```\n\nInclude Glider.js:\n\n```html\n<script src=\"glider.min.js\"></script>\nor\n<script src=\"https://cdn.jsdelivr.net/npm/glider-js@1/glider.min.js\"></script>\n```\n\nExample HTML:\n\n```html\n<div class=\"glider\">\n  <div> 1 </div>\n  <div> 2 </div>\n  <div> 3 </div>\n  <div> 4 </div>\n  <div> 5 </div>\n  <div> 6 </div>\n</div>\n```\n\nGlider.js Initialization\n\n```javascript\nnew Glider(document.querySelector('.glider'));\n```\n\nGlider.js Initialization w/ full options:\n\n```javascript\nnew Glider(document.querySelector('.glider'), {\n\n  // `auto` allows automatic responsive\n  // width calculations\n  slidesToShow: 'auto',\n  slidesToScroll: 'auto',\n\n  // should have been named `itemMinWidth`\n  // slides grow to fit the container viewport\n  // ignored unless `slidesToShow` is set to `auto`\n  itemWidth: undefined,\n\n  // if true, slides wont be resized to fit viewport\n  // requires `itemWidth` to be set\n  // * this may cause fractional slides\n  exactWidth: false,\n\n  // speed aggravator - higher is slower\n  duration: .5,\n\n  // dot container element or selector\n  dots: 'CSS Selector',\n\n  // arrow container elements or selector\n  arrows: {\n    prev: 'CSS Selector',\n    // may also pass element directly\n    next: document.querySelector('CSS Selector')\n  },\n\n  // allow mouse dragging\n  draggable: false,\n  // how much to scroll with each mouse delta\n  dragVelocity: 3.3,\n\n  // use any custom easing function\n  // compatible with most easing plugins\n  easing: function (x, t, b, c, d) {\n    return c*(t/=d)*t + b;\n  },\n\n  // event control\n  scrollPropagate: false,\n  eventPropagate: true,\n\n  // Force centering slide after scroll event\n  scrollLock: false,\n  // how long to wait after scroll event before locking\n  // if too low, it might interrupt normal scrolling\n  scrollLockDelay: 150,\n\n  // Force centering slide after resize event\n  resizeLock: true,\n\n  // Glider.js breakpoints are mobile-first\n  responsive: [\n    {\n      breakpoint: 900,\n      settings: {\n        slidesToShow: 2,\n        slidesToScroll: 2\n      }\n    },\n    {\n      breakpoint: 575,\n      settings: {\n        slidesToShow: 3,\n        slidesToScroll: 3\n      }\n    }\n  ]\n});\n ```\n\nChange options:\n\n```javascript\nGlider(document.querySelector(element_path)).setOption({\n  name: value,\n  ...\n});\n\n// optionally call refresh\nGlider(document.querySelector(element_path)).refresh();\n```\n\nBind event:\n\n```javascript\ndocument.querySelector(element_path).addEventListener('glider-slide-visible', function(event){\n  // `this` is bound to the glider element\n  // custom data located at `event.detail`\n  // access to Glider object via `Glider(this)`\n  ...\n});\n```\n\nDestroy with:\n\n```javascript\nGlider(document.querySelector(element_path)).destroy();\n```\n\n#### Install using package managers NPM / YARN\n\n```\n$ npm install glider-js\n```\n\n```\n$ yarn add glider-js\n```\n\n#### Browser support\n\nGlider.js should run on all modern browsers. Support for older browser can be achieved by polyfilling `document.classList`, `window.requestAnimationFrame`, `Object.assign` and `CustomEvent`\n\nInclude `glider-compat.min.js` to load the aforementioned polyfills\n\n#### Native Scrollbars\n\nMost browsers now support the `scrollbar-width` property allowing us to avoid the messy hack below.\n\n**NOTE:** This feature is marked as experimental and may not work in all browsers.\n\n```\n.glider-track {\n  scrollbar-width: none;\n}\n```\n\n\nSince Glider.js uses native scrolling, the browser wants to apply the standard scrollbar to the glider. In most cases, this is fine since the scrollbar can be hidden with CSS and Glider.js does so when appropriate. In browsers such as Firefox though, the scrollbars cannot be hidden with CSS and require additional markup to hide.\n\nTo hide the scrollbars in Firefox, you'll want to wrap your glider with `<div class=\"glider-wrap\">` and apply the following CSS/JS:\n\n```css\n@-moz-document url-prefix() {\n  .glider-track {\n    margin-bottom: 17px;\n  }\n  .glider-wrap {\n    overflow: hidden;\n  }\n}\n```\n\n```javascript\ndocument.addEventListener('glider-loaded', hideFFScrollBars);\ndocument.addEventListener('glider-refresh', hideFFScrollBars);\nfunction hideFFScrollBars(e){\n  var scrollbarHeight = 17; // Currently 17, may change with updates\n  if(/firefox/i.test(navigator.userAgent)){\n    // We only need to appy to desktop. Firefox for mobile uses\n    // a different rendering engine (WebKit)\n    if (window.innerWidth > 575){\n      e.target.parentNode.style.height = (e.target.offsetHeight - scrollbarHeight) + 'px'\n    }\n  }\n}\n```\n\n#### Packages using Glider.js :rocket:\n\n- [react-glider](https://www.npmjs.com/package/react-glider) - A react wrapper for Glider.js written in typescript. \n\n#### Dependencies\n\nNone :)\n\n#### License\n\nCopyright (c) 2018 Nick Piscitelli\n\nLicensed under the MIT license.\n\nIt's all yours.\n"
        },
        {
          "name": "docs",
          "type": "tree",
          "content": null
        },
        {
          "name": "glider-compat.min.js",
          "type": "blob",
          "size": 4.1767578125,
          "content": "\"document\"in self&&(\"classList\"in document.createElement(\"_\")&&(!document.createElementNS||\"classList\"in document.createElementNS(\"http://www.w3.org/2000/svg\",\"g\"))||!function(b){if(\"Element\"in b){b=b.Element.prototype;var d=Object,g=String.prototype.trim||function(){return this.replace(/^\\s+|\\s+$/g,\"\")},a=Array.prototype.indexOf||function(l){for(var f=0,a=this.length;a>f;f++)if(f in this&&this[f]===l)return f;return-1},c=function(a,f){this.name=a;this.code=DOMException[a];this.message=f},h=function(l,\nf){if(\"\"===f)throw new c(\"SYNTAX_ERR\",\"The token must not be empty.\");if(/\\s/.test(f))throw new c(\"INVALID_CHARACTER_ERR\",\"The token must not contain space characters.\");return a.call(l,f)},k=function(a){var f=g.call(a.getAttribute(\"class\")||\"\");f=f?f.split(/\\s+/):[];for(var b=0,h=f.length;h>b;b++)this.push(f[b]);this._updateClassName=function(){a.setAttribute(\"class\",this.toString())}},e=k.prototype=[],m=function(){return new k(this)};if(c.prototype=Error.prototype,e.item=function(a){return this[a]||\nnull},e.contains=function(a){return~h(this,a+\"\")},e.add=function(){var a=arguments,f=0,b=a.length,c=!1;do{var e=a[f]+\"\";~h(this,e)||(this.push(e),c=!0)}while(++f<b);c&&this._updateClassName()},e.remove=function(){var a,b=arguments,c=0,e=b.length,k=!1;do{var d=b[c]+\"\";for(a=h(this,d);~a;)this.splice(a,1),k=!0,a=h(this,d)}while(++c<e);k&&this._updateClassName()},e.toggle=function(a,b){var h=this.contains(a),c=h?!0!==b&&\"remove\":!1!==b&&\"add\";return c&&this[c](a),!0===b||!1===b?b:!h},e.replace=function(a,\nb){var c=h(a+\"\");~c&&(this.splice(c,1,b),this._updateClassName())},e.toString=function(){return this.join(\" \")},d.defineProperty){e={get:m,enumerable:!0,configurable:!0};try{d.defineProperty(b,\"classList\",e)}catch(l){void 0!==l.number&&-2146823252!==l.number||(e.enumerable=!1,d.defineProperty(b,\"classList\",e))}}else d.prototype.__defineGetter__&&b.__defineGetter__(\"classList\",m)}}(self),function(){var b=document.createElement(\"_\");if(b.classList.add(\"c1\",\"c2\"),!b.classList.contains(\"c2\")){var d=function(a){var b=\nDOMTokenList.prototype[a];DOMTokenList.prototype[a]=function(a){var c,h=arguments.length;for(c=0;h>c;c++)a=arguments[c],b.call(this,a)}};d(\"add\");d(\"remove\")}if(b.classList.toggle(\"c3\",!1),b.classList.contains(\"c3\")){var g=DOMTokenList.prototype.toggle;DOMTokenList.prototype.toggle=function(a,b){return 1 in arguments&&!this.contains(a)==!b?b:g.call(this,a)}}\"replace\"in document.createElement(\"_\").classList||(DOMTokenList.prototype.replace=function(a,b){var c=this.toString().split(\" \"),d=c.indexOf(a+\n\"\");~d&&(c=c.slice(d),this.remove.apply(this,c),this.add(b),this.add.apply(this,c.slice(1)))});b=null}());\n(function(){if(\"undefined\"!==typeof window)try{var b=new window.CustomEvent(\"test\",{cancelable:!0});b.preventDefault();if(!0!==b.defaultPrevented)throw Error(\"Could not prevent default\");}catch(d){b=function(b,a){a=a||{bubbles:!1,cancelable:!1,detail:void 0};var c=document.createEvent(\"CustomEvent\");c.initCustomEvent(b,a.bubbles,a.cancelable,a.detail);var d=c.preventDefault;c.preventDefault=function(){d.call(this);try{Object.defineProperty(this,\"defaultPrevented\",{get:function(){return!0}})}catch(k){this.defaultPrevented=\n!0}};return c},b.prototype=window.Event.prototype,window.CustomEvent=b}})();\nObject.assign||Object.defineProperty(Object,\"assign\",{enumerable:!1,configurable:!0,writable:!0,value:function(b){if(void 0===b||null===b)throw new TypeError(\"Cannot convert first argument to object\");for(var d=Object(b),g=1;g<arguments.length;g++){var a=arguments[g];if(void 0!==a&&null!==a){a=Object(a);for(var c=Object.keys(Object(a)),h=0,k=c.length;h<k;h++){var e=c[h],m=Object.getOwnPropertyDescriptor(a,e);void 0!==m&&m.enumerable&&(d[e]=a[e])}}}return d}});\n(function(){for(var b=0,d=[\"ms\",\"moz\",\"webkit\",\"o\"],g=0;g<d.length&&!window.requestAnimationFrame;++g)window.requestAnimationFrame=window[d[g]+\"RequestAnimationFrame\"],window.cancelAnimationFrame=window[d[g]+\"CancelAnimationFrame\"]||window[d[g]+\"CancelRequestAnimationFrame\"];window.requestAnimationFrame||(window.requestAnimationFrame=function(a,c){var d=(new Date).getTime(),g=Math.max(0,16-(d-b)),e=window.setTimeout(function(){a(d+g)},g);b=d+g;return e});window.cancelAnimationFrame||(window.cancelAnimationFrame=\nfunction(a){clearTimeout(a)})})();\n"
        },
        {
          "name": "glider.css",
          "type": "blob",
          "size": 2.234375,
          "content": ".glider-contain {\n  width: 100%;\n  margin: 0 auto;\n  position: relative;\n}\n.glider {\n  margin: 0 auto;\n  position: relative;\n  overflow-y: hidden;\n  -webkit-overflow-scrolling: touch;\n  -ms-overflow-style: none;\n  transform: translateZ(0);\n}\n.glider-track {\n  transform: translateZ(0);\n  width: 100%;\n  margin: 0;\n  padding: 0;\n  display: flex;\n  z-index: 1;\n}\n.glider.draggable {\n  user-select: none;\n  cursor: -webkit-grab;\n  cursor: grab;\n}\n.glider.draggable .glider-slide img {\n  user-select: none;\n  pointer-events: none;\n}\n.glider.drag {\n  cursor: -webkit-grabbing;\n  cursor: grabbing;\n}\n.glider-slide {\n  user-select: none;\n  justify-content: center;\n  align-content: center;\n  width: 100%;\n}\n.glider-slide img {\n  max-width: 100%;\n}\n.glider::-webkit-scrollbar {\n  opacity: 0;\n  height: 0;\n}\n.glider-prev,\n.glider-next {\n  user-select: none;\n  position: absolute;\n  outline: none;\n  background: none;\n  padding: 0;\n  z-index: 2;\n  font-size: 40px;\n  text-decoration: none;\n  left: -23px;\n  border: 0;\n  top: 30%;\n  cursor: pointer;\n  color: #666;\n  opacity: 1;\n  line-height: 1;\n  transition: opacity 0.5s cubic-bezier(0.17, 0.67, 0.83, 0.67),\n    color 0.5s cubic-bezier(0.17, 0.67, 0.83, 0.67);\n}\n.glider-prev:hover,\n.glider-next:hover,\n.glider-prev:focus,\n.glider-next:focus {\n  color: #a89cc8;\n}\n.glider-next {\n  right: -23px;\n  left: auto;\n}\n.glider-next.disabled,\n.glider-prev.disabled {\n  opacity: 0.25;\n  color: #666;\n  cursor: default;\n}\n.glider-slide {\n  min-width: 150px;\n}\n.glider-hide {\n  opacity: 0;\n}\n.glider-dots {\n  user-select: none;\n  display: flex;\n  flex-wrap: wrap;\n  justify-content: center;\n  margin: 0 auto;\n  padding: 0;\n}\n.glider-dot {\n  border: 0;\n  padding: 0;\n  user-select: none;\n  outline: none;\n  display: block;\n  cursor: pointer;\n  color: #ccc;\n  border-radius: 999px;\n  background: #ccc;\n  width: 12px;\n  height: 12px;\n  margin: 7px;\n}\n.glider-dot:hover,\n.glider-dot:focus,\n.glider-dot.active {\n  background: #a89cc8;\n}\n@media (max-width: 36em) {\n  .glider::-webkit-scrollbar {\n    opacity: 1;\n    -webkit-appearance: none;\n    width: 7px;\n    height: 3px;\n  }\n  .glider::-webkit-scrollbar-thumb {\n    opacity: 1;\n    border-radius: 99px;\n    background-color: rgba(156, 156, 156, 0.25);\n    box-shadow: 0 0 1px rgba(255, 255, 255, 0.25);\n  }\n}\n"
        },
        {
          "name": "glider.js",
          "type": "blob",
          "size": 15.4052734375,
          "content": "/* @preserve\n    _____ __ _     __                _\n   / ___// /(_)___/ /___  ____      (_)___\n  / (_ // // // _  // -_)/ __/_    / /(_-<\n  \\___//_//_/ \\_,_/ \\__//_/  (_)__/ //___/\n                              |___/\n\n  Version: 1.7.4\n  Author: Nick Piscitelli (pickykneee)\n  Website: https://nickpiscitelli.com\n  Documentation: http://nickpiscitelli.github.io/Glider.js\n  License: MIT License\n  Release Date: October 25th, 2018\n\n*/\n\n/* global define */\n\n(function (factory) {\n  typeof define === 'function' && define.amd\n    ? define(factory)\n    : typeof exports === 'object'\n      ? (module.exports = factory())\n      : factory()\n})(function () {\n  ('use strict') // eslint-disable-line no-unused-expressions\n\n  /* globals window:true */\n  var _window = typeof window !== 'undefined' ? window : this\n\n  var Glider = (_window.Glider = function (element, settings) {\n    var _ = this\n\n    if (element._glider) return element._glider\n\n    _.ele = element\n    _.ele.classList.add('glider')\n\n    // expose glider object to its DOM element\n    _.ele._glider = _\n\n    // merge user setting with defaults\n    _.opt = Object.assign(\n      {},\n      {\n        slidesToScroll: 1,\n        slidesToShow: 1,\n        resizeLock: true,\n        duration: 0.5,\n        passiveListeners: false,\n        // easeInQuad\n        easing: function (x, t, b, c, d) {\n          return c * (t /= d) * t + b\n        }\n      },\n      settings\n    )\n\n    // set defaults\n    _.animate_id = _.page = _.slide = 0\n    _.arrows = {}\n\n    // preserve original options to\n    // extend breakpoint settings\n    _._opt = _.opt\n\n    if (_.opt.skipTrack) {\n      // first and only child is the track\n      _.track = _.ele.children[0]\n    } else {\n      // create track and wrap slides\n      _.track = document.createElement('div')\n      _.ele.appendChild(_.track)\n      while (_.ele.children.length !== 1) {\n        _.track.appendChild(_.ele.children[0])\n      }\n    }\n\n    _.track.classList.add('glider-track')\n\n    // start glider\n    _.init()\n\n    // set events\n    _.resize = _.init.bind(_, true)\n    _.event(\n      _.ele,\n      'add',\n      {\n        scroll: _.updateControls.bind(_)\n      },\n      { passive: _.opt.passiveListeners }\n    )\n    _.event(_window, 'add', {\n      resize: _.resize\n    })\n  })\n\n  var gliderPrototype = Glider.prototype\n  gliderPrototype.init = function (refresh, paging) {\n    var _ = this\n\n    var width = 0\n\n    var height = 0\n\n    _.slides = _.track.children;\n\n    [].forEach.call(_.slides, function (_, i) {\n      _.classList.add('glider-slide')\n      _.setAttribute('data-gslide', i)\n    })\n\n    _.containerWidth = _.ele.clientWidth\n\n    var breakpointChanged = _.settingsBreakpoint()\n    if (!paging) paging = breakpointChanged\n\n    if (\n      _.opt.slidesToShow === 'auto' ||\n      typeof _.opt._autoSlide !== 'undefined'\n    ) {\n      var slideCount = _.containerWidth / _.opt.itemWidth\n\n      _.opt._autoSlide = _.opt.slidesToShow = _.opt.exactWidth\n        ? slideCount\n        : Math.max(1, Math.floor(slideCount))\n    }\n    if (_.opt.slidesToScroll === 'auto') {\n      _.opt.slidesToScroll = Math.floor(_.opt.slidesToShow)\n    }\n\n    _.itemWidth = _.opt.exactWidth\n      ? _.opt.itemWidth\n      : _.containerWidth / _.opt.slidesToShow;\n\n    // set slide dimensions\n    [].forEach.call(_.slides, function (__) {\n      __.style.height = 'auto'\n      __.style.width = _.itemWidth + 'px'\n      width += _.itemWidth\n      height = Math.max(__.offsetHeight, height)\n    })\n\n    _.track.style.width = width + 'px'\n    _.trackWidth = width\n    _.isDrag = false\n    _.preventClick = false\n    _.move = false\n\n    _.opt.resizeLock && _.scrollTo(_.slide * _.itemWidth, 0)\n\n    if (breakpointChanged || paging) {\n      _.bindArrows()\n      _.buildDots()\n      _.bindDrag()\n    }\n\n    _.updateControls()\n\n    _.emit(refresh ? 'refresh' : 'loaded')\n  }\n\n  gliderPrototype.bindDrag = function () {\n    var _ = this\n    _.mouse = _.mouse || _.handleMouse.bind(_)\n\n    var mouseup = function () {\n      _.mouseDown = undefined\n      _.ele.classList.remove('drag')\n      if (_.isDrag) {\n        _.preventClick = true\n      }\n      _.isDrag = false\n    }\n\n    const move = function () {\n      _.move = true\n    }\n\n    var events = {\n      mouseup: mouseup,\n      mouseleave: mouseup,\n      mousedown: function (e) {\n        e.preventDefault()\n        e.stopPropagation()\n        _.mouseDown = e.clientX\n        _.ele.classList.add('drag')\n        _.move = false\n        setTimeout(move, 300)\n      },\n      touchstart: function (e) {\n        _.ele.classList.add('drag')\n        _.move = false\n        setTimeout(move, 300)\n      },\n      mousemove: _.mouse,\n      click: function (e) {\n        if (_.preventClick && _.move) {\n          e.preventDefault()\n          e.stopPropagation()\n        }\n        _.preventClick = false\n        _.move = false\n      }\n    }\n\n    _.ele.classList.toggle('draggable', _.opt.draggable === true)\n    _.event(_.ele, 'remove', events)\n    if (_.opt.draggable) {\n      _.event(_.ele, 'add', events, {\n        passive: _.opt.passiveListeners\n      })\n    }\n  }\n\n  gliderPrototype.buildDots = function () {\n    var _ = this\n\n    if (!_.opt.dots) {\n      if (_.dots) _.dots.innerHTML = ''\n      return\n    }\n\n    if (typeof _.opt.dots === 'string') {\n      _.dots = document.querySelector(_.opt.dots)\n    } else _.dots = _.opt.dots\n    if (!_.dots) return\n\n    _.dots.innerHTML = ''\n    _.dots.setAttribute('role', 'tablist')\n    _.dots.classList.add('glider-dots')\n\n    for (var i = 0; i < Math.ceil(_.slides.length / _.opt.slidesToShow); ++i) {\n      var dot = document.createElement('button')\n      dot.dataset.index = i\n      dot.setAttribute('aria-label', 'Page ' + (i + 1))\n      dot.setAttribute('role', 'tab')\n      dot.className = 'glider-dot ' + (i ? '' : 'active')\n      _.event(dot, 'add', {\n        click: _.scrollItem.bind(_, i, true)\n      })\n      _.dots.appendChild(dot)\n    }\n  }\n\n  gliderPrototype.bindArrows = function () {\n    var _ = this\n    if (!_.opt.arrows) {\n      Object.keys(_.arrows).forEach(function (direction) {\n        var element = _.arrows[direction]\n        _.event(element, 'remove', { click: element._func })\n      })\n      return\n    }\n    ['prev', 'next'].forEach(function (direction) {\n      var arrow = _.opt.arrows[direction]\n      if (arrow) {\n        if (typeof arrow === 'string') arrow = document.querySelector(arrow)\n        if (arrow) {\n          arrow._func = arrow._func || _.scrollItem.bind(_, direction)\n          _.event(arrow, 'remove', {\n            click: arrow._func\n          })\n          _.event(arrow, 'add', {\n            click: arrow._func\n          })\n          _.arrows[direction] = arrow\n        }\n      }\n    })\n  }\n\n  gliderPrototype.updateControls = function (event) {\n    var _ = this\n\n    if (event && !_.opt.scrollPropagate) {\n      event.stopPropagation()\n    }\n\n    var disableArrows = _.containerWidth >= _.trackWidth\n\n    if (!_.opt.rewind) {\n      if (_.arrows.prev) {\n        _.arrows.prev.classList.toggle(\n          'disabled',\n          _.ele.scrollLeft <= 0 || disableArrows\n        )\n\n        _.arrows.prev.setAttribute(\n          'aria-disabled',\n          _.arrows.prev.classList.contains('disabled')\n        )\n      }\n      if (_.arrows.next) {\n        _.arrows.next.classList.toggle(\n          'disabled',\n          Math.ceil(_.ele.scrollLeft + _.containerWidth) >=\n            Math.floor(_.trackWidth) || disableArrows\n        )\n\n        _.arrows.next.setAttribute(\n          'aria-disabled',\n          _.arrows.next.classList.contains('disabled')\n        )\n      }\n    }\n\n    _.slide = Math.round(_.ele.scrollLeft / _.itemWidth)\n    _.page = Math.round(_.ele.scrollLeft / _.containerWidth)\n\n    var middle = _.slide + Math.floor(Math.floor(_.opt.slidesToShow) / 2)\n\n    var extraMiddle = Math.floor(_.opt.slidesToShow) % 2 ? 0 : middle + 1\n    if (Math.floor(_.opt.slidesToShow) === 1) {\n      extraMiddle = 0\n    }\n\n    // the last page may be less than one half of a normal page width so\n    // the page is rounded down. when at the end, force the page to turn\n    if (_.ele.scrollLeft + _.containerWidth >= Math.floor(_.trackWidth)) {\n      _.page = _.dots ? _.dots.children.length - 1 : 0\n    }\n\n    [].forEach.call(_.slides, function (slide, index) {\n      var slideClasses = slide.classList\n\n      var wasVisible = slideClasses.contains('visible')\n\n      var start = _.ele.scrollLeft\n\n      var end = _.ele.scrollLeft + _.containerWidth\n\n      var itemStart = _.itemWidth * index\n\n      var itemEnd = itemStart + _.itemWidth;\n\n      [].forEach.call(slideClasses, function (className) {\n        /^left|right/.test(className) && slideClasses.remove(className)\n      })\n      slideClasses.toggle('active', _.slide === index)\n      if (middle === index || (extraMiddle && extraMiddle === index)) {\n        slideClasses.add('center')\n      } else {\n        slideClasses.remove('center')\n        slideClasses.add(\n          [\n            index < middle ? 'left' : 'right',\n            Math.abs(index - (index < middle ? middle : extraMiddle || middle))\n          ].join('-')\n        )\n      }\n\n      var isVisible =\n        Math.ceil(itemStart) >= Math.floor(start) &&\n        Math.floor(itemEnd) <= Math.ceil(end)\n      slideClasses.toggle('visible', isVisible)\n      if (isVisible !== wasVisible) {\n        _.emit('slide-' + (isVisible ? 'visible' : 'hidden'), {\n          slide: index\n        })\n      }\n    })\n    if (_.dots) {\n      [].forEach.call(_.dots.children, function (dot, index) {\n        dot.classList.toggle('active', _.page === index)\n      })\n    }\n\n    if (event && _.opt.scrollLock) {\n      clearTimeout(_.scrollLock)\n      _.scrollLock = setTimeout(function () {\n        clearTimeout(_.scrollLock)\n        // dont attempt to scroll less than a pixel fraction - causes looping\n        if (Math.abs(_.ele.scrollLeft / _.itemWidth - _.slide) > 0.02) {\n          if (!_.mouseDown) {\n            // Only scroll if not at the end (#94)\n            if (_.trackWidth > _.containerWidth + _.ele.scrollLeft) {\n              _.scrollItem(_.getCurrentSlide())\n            }\n          }\n        }\n      }, _.opt.scrollLockDelay || 250)\n    }\n  }\n\n  gliderPrototype.getCurrentSlide = function () {\n    var _ = this\n    return _.round(_.ele.scrollLeft / _.itemWidth)\n  }\n\n  gliderPrototype.scrollItem = function (slide, dot, e) {\n    if (e) e.preventDefault()\n\n    var _ = this\n\n    var originalSlide = slide\n    ++_.animate_id\n\n    var prevSlide = _.slide\n    var position\n\n    if (dot === true) {\n      slide = Math.round((slide * _.containerWidth) / _.itemWidth)\n      position = slide * _.itemWidth\n    } else {\n      if (typeof slide === 'string') {\n        var backwards = slide === 'prev'\n\n        // use precise location if fractional slides are on\n        if (_.opt.slidesToScroll % 1 || _.opt.slidesToShow % 1) {\n          slide = _.getCurrentSlide()\n        } else {\n          slide = _.slide\n        }\n\n        if (backwards) slide -= _.opt.slidesToScroll\n        else slide += _.opt.slidesToScroll\n\n        if (_.opt.rewind) {\n          var scrollLeft = _.ele.scrollLeft\n          slide =\n            backwards && !scrollLeft\n              ? _.slides.length\n              : !backwards &&\n                scrollLeft + _.containerWidth >= Math.floor(_.trackWidth)\n                ? 0\n                : slide\n        }\n      }\n\n      slide = Math.max(Math.min(slide, _.slides.length), 0)\n\n      _.slide = slide\n      position = _.itemWidth * slide\n    }\n\n    _.emit('scroll-item', { prevSlide, slide })\n\n    _.scrollTo(\n      position,\n      _.opt.duration * Math.abs(_.ele.scrollLeft - position),\n      function () {\n        _.updateControls()\n        _.emit('animated', {\n          value: originalSlide,\n          type:\n            typeof originalSlide === 'string' ? 'arrow' : dot ? 'dot' : 'slide'\n        })\n      }\n    )\n\n    return false\n  }\n\n  gliderPrototype.settingsBreakpoint = function () {\n    var _ = this\n\n    var resp = _._opt.responsive\n\n    if (resp) {\n      // Sort the breakpoints in mobile first order\n      resp.sort(function (a, b) {\n        return b.breakpoint - a.breakpoint\n      })\n\n      for (var i = 0; i < resp.length; ++i) {\n        var size = resp[i]\n        if (_window.innerWidth >= size.breakpoint) {\n          if (_.breakpoint !== size.breakpoint) {\n            _.opt = Object.assign({}, _._opt, size.settings)\n            _.breakpoint = size.breakpoint\n            return true\n          }\n          return false\n        }\n      }\n    }\n    // set back to defaults in case they were overriden\n    var breakpointChanged = _.breakpoint !== 0\n    _.opt = Object.assign({}, _._opt)\n    _.breakpoint = 0\n    return breakpointChanged\n  }\n\n  gliderPrototype.scrollTo = function (scrollTarget, scrollDuration, callback) {\n    var _ = this\n\n    var start = new Date().getTime()\n\n    var animateIndex = _.animate_id\n\n    var animate = function () {\n      var now = new Date().getTime() - start\n      _.ele.scrollLeft =\n        _.ele.scrollLeft +\n        (scrollTarget - _.ele.scrollLeft) *\n          _.opt.easing(0, now, 0, 1, scrollDuration)\n      if (now < scrollDuration && animateIndex === _.animate_id) {\n        _window.requestAnimationFrame(animate)\n      } else {\n        _.ele.scrollLeft = scrollTarget\n        callback && callback.call(_)\n      }\n    }\n\n    _window.requestAnimationFrame(animate)\n  }\n\n  gliderPrototype.removeItem = function (index) {\n    var _ = this\n\n    if (_.slides.length) {\n      _.track.removeChild(_.slides[index])\n      _.refresh(true)\n      _.emit('remove')\n    }\n  }\n\n  gliderPrototype.addItem = function (ele) {\n    var _ = this\n\n    _.track.appendChild(ele)\n    _.refresh(true)\n    _.emit('add')\n  }\n\n  gliderPrototype.handleMouse = function (e) {\n    var _ = this\n    if (_.mouseDown) {\n      _.isDrag = true\n      _.ele.scrollLeft +=\n        (_.mouseDown - e.clientX) * (_.opt.dragVelocity || 3.3)\n      _.mouseDown = e.clientX\n    }\n  }\n\n  // used to round to the nearest 0.XX fraction\n  gliderPrototype.round = function (double) {\n    var _ = this\n    var step = _.opt.slidesToScroll % 1 || 1\n    var inv = 1.0 / step\n    return Math.round(double * inv) / inv\n  }\n\n  gliderPrototype.refresh = function (paging) {\n    var _ = this\n    _.init(true, paging)\n  }\n\n  gliderPrototype.setOption = function (opt, global) {\n    var _ = this\n\n    if (_.breakpoint && !global) {\n      _._opt.responsive.forEach(function (v) {\n        if (v.breakpoint === _.breakpoint) {\n          v.settings = Object.assign({}, v.settings, opt)\n        }\n      })\n    } else {\n      _._opt = Object.assign({}, _._opt, opt)\n    }\n\n    _.breakpoint = 0\n    _.settingsBreakpoint()\n  }\n\n  gliderPrototype.destroy = function () {\n    var _ = this\n\n    var replace = _.ele.cloneNode(true)\n\n    var clear = function (ele) {\n      ele.removeAttribute('style');\n      [].forEach.call(ele.classList, function (className) {\n        /^glider/.test(className) && ele.classList.remove(className)\n      })\n    }\n    // remove track if it was created by glider\n    if (!_.opt.skipTrack) {\n      replace.children[0].outerHTML = replace.children[0].innerHTML\n    }\n    clear(replace);\n    [].forEach.call(replace.getElementsByTagName('*'), clear)\n    _.ele.parentNode.replaceChild(replace, _.ele)\n    _.event(_window, 'remove', {\n      resize: _.resize\n    })\n    _.emit('destroy')\n  }\n\n  gliderPrototype.emit = function (name, arg) {\n    var _ = this\n\n    var e = new _window.CustomEvent('glider-' + name, {\n      bubbles: !_.opt.eventPropagate,\n      detail: arg\n    })\n    _.ele.dispatchEvent(e)\n  }\n\n  gliderPrototype.event = function (ele, type, args) {\n    var eventHandler = ele[type + 'EventListener'].bind(ele)\n    Object.keys(args).forEach(function (k) {\n      eventHandler(k, args[k])\n    })\n  }\n\n  return Glider\n})\n"
        },
        {
          "name": "glider.min.css",
          "type": "blob",
          "size": 1.802734375,
          "content": ".glider,.glider-contain{margin:0 auto;position:relative}.glider,.glider-track{transform:translateZ(0)}.glider-dot,.glider-next,.glider-prev{border:0;padding:0;user-select:none;outline:0}.glider-contain{width:100%}.glider{overflow-y:hidden;-webkit-overflow-scrolling:touch;-ms-overflow-style:none}.glider-track{width:100%;margin:0;padding:0;display:flex;z-index:1}.glider.draggable{user-select:none;cursor:-webkit-grab;cursor:grab}.glider.draggable .glider-slide img{user-select:none;pointer-events:none}.glider.drag{cursor:-webkit-grabbing;cursor:grabbing}.glider-slide{user-select:none;justify-content:center;align-content:center;width:100%;min-width:150px}.glider-slide img{max-width:100%}.glider::-webkit-scrollbar{opacity:0;height:0}.glider-next,.glider-prev{position:absolute;background:0 0;z-index:2;font-size:40px;text-decoration:none;left:-23px;top:30%;cursor:pointer;color:#666;opacity:1;line-height:1;transition:opacity .5s cubic-bezier(.17,.67,.83,.67),color .5s cubic-bezier(.17,.67,.83,.67)}.glider-next:focus,.glider-next:hover,.glider-prev:focus,.glider-prev:hover{color:#ccc}.glider-next{right:-23px;left:auto}.glider-next.disabled,.glider-prev.disabled{opacity:.25;color:#666;cursor:default}.glider-hide{opacity:0}.glider-dots{user-select:none;display:flex;flex-wrap:wrap;justify-content:center;margin:0 auto;padding:0}.glider-dot{display:block;cursor:pointer;color:#ccc;border-radius:999px;background:#ccc;width:12px;height:12px;margin:7px}.glider-dot:focus,.glider-dot:hover{background:#ddd}.glider-dot.active{background:#a89cc8}@media(max-width:36em){.glider::-webkit-scrollbar{opacity:1;-webkit-appearance:none;width:7px;height:3px}.glider::-webkit-scrollbar-thumb{opacity:1;border-radius:99px;background-color:rgba(156,156,156,.25);-webkit-box-shadow:0 0 1px rgba(255,255,255,.25);box-shadow:0 0 1px rgba(255,255,255,.25)}}\n"
        },
        {
          "name": "glider.min.js",
          "type": "blob",
          "size": 8.4375,
          "content": "/* @preserve\n    _____ __ _     __                _\n   / ___// /(_)___/ /___  ____      (_)___\n  / (_ // // // _  // -_)/ __/_    / /(_-<\n  \\___//_//_/ \\_,_/ \\__//_/  (_)__/ //___/\n                              |___/\n\n  Version: 1.7.4\n  Author: Nick Piscitelli (pickykneee)\n  Website: https://nickpiscitelli.com\n  Documentation: http://nickpiscitelli.github.io/Glider.js\n  License: MIT License\n  Release Date: October 25th, 2018\n\n*/\n!function(e){\"function\"==typeof define&&define.amd?define(e):\"object\"==typeof exports?module.exports=e():e()}(function(){var a=\"undefined\"!=typeof window?window:this,e=a.Glider=function(e,t){var i=this;if(e._glider)return e._glider;if(i.ele=e,i.ele.classList.add(\"glider\"),(i.ele._glider=i).opt=Object.assign({},{slidesToScroll:1,slidesToShow:1,resizeLock:!0,duration:.5,passiveListeners:!1,easing:function(e,t,i,o,s){return o*(t/=s)*t+i}},t),i.animate_id=i.page=i.slide=0,i.arrows={},i._opt=i.opt,i.opt.skipTrack)i.track=i.ele.children[0];else for(i.track=document.createElement(\"div\"),i.ele.appendChild(i.track);1!==i.ele.children.length;)i.track.appendChild(i.ele.children[0]);i.track.classList.add(\"glider-track\"),i.init(),i.resize=i.init.bind(i,!0),i.event(i.ele,\"add\",{scroll:i.updateControls.bind(i)},{passive:i.opt.passiveListeners}),i.event(a,\"add\",{resize:i.resize})},t=e.prototype;return t.init=function(e,t){var i,o=this,s=0,r=0,l=(o.slides=o.track.children,[].forEach.call(o.slides,function(e,t){e.classList.add(\"glider-slide\"),e.setAttribute(\"data-gslide\",t)}),o.containerWidth=o.ele.clientWidth,o.settingsBreakpoint());t=t||l,\"auto\"!==o.opt.slidesToShow&&void 0===o.opt._autoSlide||(i=o.containerWidth/o.opt.itemWidth,o.opt._autoSlide=o.opt.slidesToShow=o.opt.exactWidth?i:Math.max(1,Math.floor(i))),\"auto\"===o.opt.slidesToScroll&&(o.opt.slidesToScroll=Math.floor(o.opt.slidesToShow)),o.itemWidth=o.opt.exactWidth?o.opt.itemWidth:o.containerWidth/o.opt.slidesToShow,[].forEach.call(o.slides,function(e){e.style.height=\"auto\",e.style.width=o.itemWidth+\"px\",s+=o.itemWidth,r=Math.max(e.offsetHeight,r)}),o.track.style.width=s+\"px\",o.trackWidth=s,o.isDrag=!1,o.preventClick=!1,o.move=!1,o.opt.resizeLock&&o.scrollTo(o.slide*o.itemWidth,0),(l||t)&&(o.bindArrows(),o.buildDots(),o.bindDrag()),o.updateControls(),o.emit(e?\"refresh\":\"loaded\")},t.bindDrag=function(){function e(){t.mouseDown=void 0,t.ele.classList.remove(\"drag\"),t.isDrag&&(t.preventClick=!0),t.isDrag=!1}var t=this;t.mouse=t.mouse||t.handleMouse.bind(t);function i(){t.move=!0}var o={mouseup:e,mouseleave:e,mousedown:function(e){e.preventDefault(),e.stopPropagation(),t.mouseDown=e.clientX,t.ele.classList.add(\"drag\"),t.move=!1,setTimeout(i,300)},touchstart:function(e){t.ele.classList.add(\"drag\"),t.move=!1,setTimeout(i,300)},mousemove:t.mouse,click:function(e){t.preventClick&&t.move&&(e.preventDefault(),e.stopPropagation()),t.preventClick=!1,t.move=!1}};t.ele.classList.toggle(\"draggable\",!0===t.opt.draggable),t.event(t.ele,\"remove\",o),t.opt.draggable&&t.event(t.ele,\"add\",o,{passive:t.opt.passiveListeners})},t.buildDots=function(){var e=this;if(e.opt.dots){if(\"string\"==typeof e.opt.dots?e.dots=document.querySelector(e.opt.dots):e.dots=e.opt.dots,e.dots){e.dots.innerHTML=\"\",e.dots.setAttribute(\"role\",\"tablist\"),e.dots.classList.add(\"glider-dots\");for(var t=0;t<Math.ceil(e.slides.length/e.opt.slidesToShow);++t){var i=document.createElement(\"button\");i.dataset.index=t,i.setAttribute(\"aria-label\",\"Page \"+(t+1)),i.setAttribute(\"role\",\"tab\"),i.className=\"glider-dot \"+(t?\"\":\"active\"),e.event(i,\"add\",{click:e.scrollItem.bind(e,t,!0)}),e.dots.appendChild(i)}}}else e.dots&&(e.dots.innerHTML=\"\")},t.bindArrows=function(){var i=this;i.opt.arrows?[\"prev\",\"next\"].forEach(function(e){var t=i.opt.arrows[e];(t=t&&(\"string\"==typeof t?document.querySelector(t):t))&&(t._func=t._func||i.scrollItem.bind(i,e),i.event(t,\"remove\",{click:t._func}),i.event(t,\"add\",{click:t._func}),i.arrows[e]=t)}):Object.keys(i.arrows).forEach(function(e){e=i.arrows[e];i.event(e,\"remove\",{click:e._func})})},t.updateControls=function(e){var n=this,t=(e&&!n.opt.scrollPropagate&&e.stopPropagation(),n.containerWidth>=n.trackWidth),a=(n.opt.rewind||(n.arrows.prev&&(n.arrows.prev.classList.toggle(\"disabled\",n.ele.scrollLeft<=0||t),n.arrows.prev.setAttribute(\"aria-disabled\",n.arrows.prev.classList.contains(\"disabled\"))),n.arrows.next&&(n.arrows.next.classList.toggle(\"disabled\",Math.ceil(n.ele.scrollLeft+n.containerWidth)>=Math.floor(n.trackWidth)||t),n.arrows.next.setAttribute(\"aria-disabled\",n.arrows.next.classList.contains(\"disabled\")))),n.slide=Math.round(n.ele.scrollLeft/n.itemWidth),n.page=Math.round(n.ele.scrollLeft/n.containerWidth),n.slide+Math.floor(Math.floor(n.opt.slidesToShow)/2)),d=Math.floor(n.opt.slidesToShow)%2?0:a+1;1===Math.floor(n.opt.slidesToShow)&&(d=0),n.ele.scrollLeft+n.containerWidth>=Math.floor(n.trackWidth)&&(n.page=n.dots?n.dots.children.length-1:0),[].forEach.call(n.slides,function(e,t){var i=e.classList,e=i.contains(\"visible\"),o=n.ele.scrollLeft,s=n.ele.scrollLeft+n.containerWidth,r=n.itemWidth*t,l=r+n.itemWidth,r=([].forEach.call(i,function(e){/^left|right/.test(e)&&i.remove(e)}),i.toggle(\"active\",n.slide===t),a===t||d&&d===t?i.add(\"center\"):(i.remove(\"center\"),i.add([t<a?\"left\":\"right\",Math.abs(t-(!(t<a)&&d||a))].join(\"-\"))),Math.ceil(r)>=Math.floor(o)&&Math.floor(l)<=Math.ceil(s));i.toggle(\"visible\",r),r!==e&&n.emit(\"slide-\"+(r?\"visible\":\"hidden\"),{slide:t})}),n.dots&&[].forEach.call(n.dots.children,function(e,t){e.classList.toggle(\"active\",n.page===t)}),e&&n.opt.scrollLock&&(clearTimeout(n.scrollLock),n.scrollLock=setTimeout(function(){clearTimeout(n.scrollLock),.02<Math.abs(n.ele.scrollLeft/n.itemWidth-n.slide)&&(n.mouseDown||n.trackWidth>n.containerWidth+n.ele.scrollLeft&&n.scrollItem(n.getCurrentSlide()))},n.opt.scrollLockDelay||250))},t.getCurrentSlide=function(){return this.round(this.ele.scrollLeft/this.itemWidth)},t.scrollItem=function(e,t,i){i&&i.preventDefault();var o,s=this,r=e,i=(++s.animate_id,s.slide),l=!0===t?(e=Math.round(e*s.containerWidth/s.itemWidth))*s.itemWidth:(\"string\"==typeof e&&(l=\"prev\"===e,e=s.opt.slidesToScroll%1||s.opt.slidesToShow%1?s.getCurrentSlide():s.slide,l?e-=s.opt.slidesToScroll:e+=s.opt.slidesToScroll,s.opt.rewind&&(o=s.ele.scrollLeft,e=l&&!o?s.slides.length:!l&&o+s.containerWidth>=Math.floor(s.trackWidth)?0:e)),e=Math.max(Math.min(e,s.slides.length),0),s.slide=e,s.itemWidth*e);return s.emit(\"scroll-item\",{prevSlide:i,slide:e}),s.scrollTo(l,s.opt.duration*Math.abs(s.ele.scrollLeft-l),function(){s.updateControls(),s.emit(\"animated\",{value:r,type:\"string\"==typeof r?\"arrow\":t?\"dot\":\"slide\"})}),!1},t.settingsBreakpoint=function(){var e=this,t=e._opt.responsive;if(t){t.sort(function(e,t){return t.breakpoint-e.breakpoint});for(var i=0;i<t.length;++i){var o=t[i];if(a.innerWidth>=o.breakpoint)return e.breakpoint!==o.breakpoint&&(e.opt=Object.assign({},e._opt,o.settings),e.breakpoint=o.breakpoint,!0)}}var s=0!==e.breakpoint;return e.opt=Object.assign({},e._opt),e.breakpoint=0,s},t.scrollTo=function(t,i,o){var s=this,r=(new Date).getTime(),l=s.animate_id,n=function(){var e=(new Date).getTime()-r;s.ele.scrollLeft=s.ele.scrollLeft+(t-s.ele.scrollLeft)*s.opt.easing(0,e,0,1,i),e<i&&l===s.animate_id?a.requestAnimationFrame(n):(s.ele.scrollLeft=t,o&&o.call(s))};a.requestAnimationFrame(n)},t.removeItem=function(e){var t=this;t.slides.length&&(t.track.removeChild(t.slides[e]),t.refresh(!0),t.emit(\"remove\"))},t.addItem=function(e){this.track.appendChild(e),this.refresh(!0),this.emit(\"add\")},t.handleMouse=function(e){var t=this;t.mouseDown&&(t.isDrag=!0,t.ele.scrollLeft+=(t.mouseDown-e.clientX)*(t.opt.dragVelocity||3.3),t.mouseDown=e.clientX)},t.round=function(e){var t=1/(this.opt.slidesToScroll%1||1);return Math.round(e*t)/t},t.refresh=function(e){this.init(!0,e)},t.setOption=function(t,e){var i=this;i.breakpoint&&!e?i._opt.responsive.forEach(function(e){e.breakpoint===i.breakpoint&&(e.settings=Object.assign({},e.settings,t))}):i._opt=Object.assign({},i._opt,t),i.breakpoint=0,i.settingsBreakpoint()},t.destroy=function(){function e(t){t.removeAttribute(\"style\"),[].forEach.call(t.classList,function(e){/^glider/.test(e)&&t.classList.remove(e)})}var t=this,i=t.ele.cloneNode(!0);t.opt.skipTrack||(i.children[0].outerHTML=i.children[0].innerHTML),e(i),[].forEach.call(i.getElementsByTagName(\"*\"),e),t.ele.parentNode.replaceChild(i,t.ele),t.event(a,\"remove\",{resize:t.resize}),t.emit(\"destroy\")},t.emit=function(e,t){e=new a.CustomEvent(\"glider-\"+e,{bubbles:!this.opt.eventPropagate,detail:t});this.ele.dispatchEvent(e)},t.event=function(e,t,i){var o=e[t+\"EventListener\"].bind(e);Object.keys(i).forEach(function(e){o(e,i[e])})},e});"
        },
        {
          "name": "index.html",
          "type": "blob",
          "size": 5.2353515625,
          "content": "<!doctype html>\n<html>\n  <head>\n    <meta name=\"viewport\" content=\"width=device-width, initial-scale=1, shrink-to-fit=no\"> <style type=\"text/css\">@-ms-viewport{width:auto!important;}</style>\n    <link rel=\"stylesheet\" type=\"text/css\" href=\"glider.css\" />\n    <script src=\"glider.js\"></script>\n    <script>\n      window.addEventListener('load',function(){\n        document.querySelector('.glider').addEventListener('glider-slide-visible', function(event){\n            var glider = Glider(this);\n            console.log('Slide Visible %s', event.detail.slide)\n        });\n        document.querySelector('.glider').addEventListener('glider-slide-hidden', function(event){\n            console.log('Slide Hidden %s', event.detail.slide)\n        });\n        document.querySelector('.glider').addEventListener('glider-refresh', function(event){\n            console.log('Refresh')\n        });\n        document.querySelector('.glider').addEventListener('glider-loaded', function(event){\n            console.log('Loaded')\n        });\n\n        window._ = new Glider(document.querySelector('.glider'), {\n            slidesToShow: 1, //'auto',\n            slidesToScroll: 1,\n            itemWidth: 150,\n            draggable: true,\n            scrollLock: false,\n            dots: '#dots',\n            rewind: true,\n            arrows: {\n                prev: '.glider-prev',\n                next: '.glider-next'\n            },\n            responsive: [\n                {\n                    breakpoint: 800,\n                    settings: {\n                        slidesToScroll: 'auto',\n                        itemWidth: 300,\n                        slidesToShow: 'auto',\n                        exactWidth: true\n                    }\n                },\n                {\n                    breakpoint: 700,\n                    settings: {\n                        slidesToScroll: 4,\n                        slidesToShow: 4,\n                        dots: false,\n                        arrows: false,\n                    }\n                },\n                {\n                    breakpoint: 600,\n                    settings: {\n                        slidesToScroll: 3,\n                        slidesToShow: 3\n                    }\n                },\n                {\n                    breakpoint: 500,\n                    settings: {\n                        slidesToScroll: 2,\n                        slidesToShow: 2,\n                        dots: false,\n                        arrows: false,\n                        scrollLock: true\n                    }\n                }\n            ]\n        });\n      });\n    </script>\n\n\n    <!--\n        Used to frame the glider on the page\n\n        Not necessary for Glider.js\n    -->\n    <style type=\"text/css\">\n        * {\n            box-sizing: border-box\n        }\n        html, body {\n            width: 100%;\n            overflow: hidden;\n        }\n        .glider-contain {\n            width: 90%;\n            max-width: 997px;\n            margin: 0 auto;\n        }\n        .glider-slide {\n            display: flex;\n            justify-content: center;\n            align-items: center;\n            min-height: 300px;\n            border: 3px solid currentColor;\n            background-image: url('logo.svg');\n            background-size:contain;\n            background-repeat: no-repeat;\n            background-position: center;\n\n        }\n        .glider-slide img {\n            width: 100%;\n        }\n        .glider-slide .slide-title {\n            font-family: Inter, Roboto, 'Helvetica Neue', 'Arial Nova', 'Nimbus Sans', Arial, sans-serif;\n            /* https://modernfontstacks.com/ */\n            font-size: 3rem;\n            position: relative;\n            top: 100px;\n        }\n\n        .glider-slide:nth-child(4n+1){\n            color:#8cc9f0;\n        }\n        .glider-slide:nth-child(4n+2) {\n            color:#a89cc8;\n        }\n        .glider-slide:nth-child(4n+3) {\n            color:#efa8b0;\n        }\n        .glider-slide:nth-child(4n) {\n            color:#9ef096;\n        }\n     \n\n        \n    </style>\n  </head>\n  <body>\n    <div class=\"glider-contain\">\n        <div class=\"glider\">\n            <div><span class=\"slide-title\">Slide 1</span></div>\n            <div><span class=\"slide-title\">Slide 2</span></div>\n            <div><span class=\"slide-title\">Slide 3</span></div>\n            <div><span class=\"slide-title\">Slide 4</span></div>\n            <div><span class=\"slide-title\">Slide 5</span></div>\n            <div><span class=\"slide-title\">Slide 6</span></div>\n            <div><span class=\"slide-title\">Slide 7</span></div>\n            <div><span class=\"slide-title\">Slide 8</span></div>\n            <div><span class=\"slide-title\">Slide 9</span></div>\n            <div><span class=\"slide-title\">Slide 10</span></div>\n            <div><span class=\"slide-title\">Slide 11</span></div>\n            <div><span class=\"slide-title\">Slide 12</span></div>\n            <div><span class=\"slide-title\">Slide 13</span></div>\n            <div><span class=\"slide-title\">Slide 14</span></div>\n            <div><span class=\"slide-title\">Slide 15</span></div>\n            <div><span class=\"slide-title\">Slide 16</span></div>\n        </div>\n        <button class=\"glider-prev\">&laquo;</button>\n        <button class=\"glider-next\">&raquo;</button>\n        <div id=\"dots\"></div>\n    </div>\n  </body>\n</html>\n"
        },
        {
          "name": "logo.svg",
          "type": "blob",
          "size": 1.259765625,
          "content": "<?xml version=\"1.0\" encoding=\"utf-8\"?>\r\n<!DOCTYPE svg PUBLIC \"-//W3C//DTD SVG 1.1//EN\" \"http://www.w3.org/Graphics/SVG/1.1/DTD/svg11.dtd\">\r\n<svg version=\"1.1\" id=\"Layer_1\" xmlns=\"http://www.w3.org/2000/svg\" xmlns:xlink=\"http://www.w3.org/1999/xlink\" x=\"0px\" y=\"0px\" width=\"85px\" height=\"85px\" viewBox=\"0 0 80 80\" enable-background=\"new 0 0 80 80\" xml:space=\"preserve\">\r\n\t<g>\r\n\t\t<path fill=\"#FFFFFF\" d=\"M40,0c22.091,0,40,17.909,40,40S62.091,80,40,80S0,62.091,0,40S17.909,0,40,0z\"/>\r\n\t</g>\r\n\t<g>\r\n\t\t<path fill=\"#8cc9f0\" d=\"M50.378,32.576c0,1.005-0.815,1.821-1.821,1.821c-1.005,0-1.82-0.816-1.82-1.821\r\n\t\t\tc0-1.005,0.815-1.821,1.82-1.821C49.563,30.755,50.378,31.571,50.378,32.576z M54.627,27.113c0-0.341-0.304-0.607-0.646-0.607\r\n\t\t\tc-6.601,0-10.223,1.518-14.964,6.241c-1.081,1.1-2.2,2.352-3.338,3.699l-7.188,0.379c-0.19,0.019-0.379,0.133-0.493,0.304\r\n\t\t\tl-4.249,7.284c-0.133,0.228-0.095,0.53,0.095,0.739l1.214,1.215c0.114,0.113,0.285,0.17,0.437,0.17c0.057,0,0.114,0,0.17-0.02\r\n\t\t\tl5.235-1.611l5.33,5.33l-1.612,5.236c-0.057,0.209,0,0.437,0.152,0.606l1.214,1.214c0.133,0.114,0.284,0.171,0.436,0.171\r\n\t\t\tc0.114,0,0.208-0.021,0.304-0.075l7.283-4.25c0.171-0.113,0.284-0.304,0.305-0.492l0.379-7.19c1.347-1.138,2.599-2.257,3.699-3.339\r\n\t\t\tC52.882,37.603,54.627,33.411,54.627,27.113z\"/>\r\n\t</g>\r\n</svg>"
        },
        {
          "name": "package-lock.json",
          "type": "blob",
          "size": 162.9892578125,
          "content": "{\n  \"name\": \"glider-js\",\n  \"version\": \"1.7.9\",\n  \"lockfileVersion\": 3,\n  \"requires\": true,\n  \"packages\": {\n    \"\": {\n      \"name\": \"glider-js\",\n      \"version\": \"1.7.9\",\n      \"license\": \"MIT\",\n      \"devDependencies\": {\n        \"http-server\": \"^0.11.1\",\n        \"husky\": \"1.2.0\",\n        \"lint-staged\": \"8.1.0\",\n        \"prettier\": \"1.15.2\",\n        \"standard\": \"12.0.1\",\n        \"uglify-js\": \"^3.15.3\"\n      }\n    },\n    \"node_modules/@iamstarkov/listr-update-renderer\": {\n      \"version\": \"0.4.1\",\n      \"resolved\": \"https://registry.npmjs.org/@iamstarkov/listr-update-renderer/-/listr-update-renderer-0.4.1.tgz\",\n      \"integrity\": \"sha512-IJyxQWsYDEkf8C8QthBn5N8tIUR9V9je6j3sMIpAkonaadjbvxmRC6RAhpa3RKxndhNnU2M6iNbtJwd7usQYIA==\",\n      \"dev\": true,\n      \"dependencies\": {\n        \"chalk\": \"^1.1.3\",\n        \"cli-truncate\": \"^0.2.1\",\n        \"elegant-spinner\": \"^1.0.1\",\n        \"figures\": \"^1.7.0\",\n        \"indent-string\": \"^3.0.0\",\n        \"log-symbols\": \"^1.0.2\",\n        \"log-update\": \"^2.3.0\",\n        \"strip-ansi\": \"^3.0.1\"\n      },\n      \"engines\": {\n        \"node\": \">=4\"\n      },\n      \"peerDependencies\": {\n        \"listr\": \"^0.14.2\"\n      }\n    },\n    \"node_modules/@iamstarkov/listr-update-renderer/node_modules/chalk\": {\n      \"version\": \"1.1.3\",\n      \"resolved\": \"https://registry.npmjs.org/chalk/-/chalk-1.1.3.tgz\",\n      \"integrity\": \"sha1-qBFcVeSnAv5NFQq9OHKCKn4J/Jg=\",\n      \"dev\": true,\n      \"dependencies\": {\n        \"ansi-styles\": \"^2.2.1\",\n        \"escape-string-regexp\": \"^1.0.2\",\n        \"has-ansi\": \"^2.0.0\",\n        \"strip-ansi\": \"^3.0.0\",\n        \"supports-color\": \"^2.0.0\"\n      },\n      \"engines\": {\n        \"node\": \">=0.10.0\"\n      }\n    },\n    \"node_modules/@iamstarkov/listr-update-renderer/node_modules/log-symbols\": {\n      \"version\": \"1.0.2\",\n      \"resolved\": \"https://registry.npmjs.org/log-symbols/-/log-symbols-1.0.2.tgz\",\n      \"integrity\": \"sha1-N2/3tY6jCGoPCfrMdGF+ylAeGhg=\",\n      \"dev\": true,\n      \"dependencies\": {\n        \"chalk\": \"^1.0.0\"\n      },\n      \"engines\": {\n        \"node\": \">=0.10.0\"\n      }\n    },\n    \"node_modules/@samverschueren/stream-to-observable\": {\n      \"version\": \"0.3.0\",\n      \"resolved\": \"https://registry.npmjs.org/@samverschueren/stream-to-observable/-/stream-to-observable-0.3.0.tgz\",\n      \"integrity\": \"sha512-MI4Xx6LHs4Webyvi6EbspgyAb4D2Q2VtnCQ1blOJcoLS6mVa8lNN2rkIy1CVxfTUpoyIbCTkXES1rLXztFD1lg==\",\n      \"dev\": true,\n      \"dependencies\": {\n        \"any-observable\": \"^0.3.0\"\n      },\n      \"engines\": {\n        \"node\": \">=6\"\n      }\n    },\n    \"node_modules/acorn\": {\n      \"version\": \"6.4.1\",\n      \"resolved\": \"https://registry.npmjs.org/acorn/-/acorn-6.4.1.tgz\",\n      \"integrity\": \"sha512-ZVA9k326Nwrj3Cj9jlh3wGFutC2ZornPNARZwsNYqQYgN0EsV2d53w5RN/co65Ohn4sUAUtb1rSUAOD6XN9idA==\",\n      \"dev\": true,\n      \"bin\": {\n        \"acorn\": \"bin/acorn\"\n      },\n      \"engines\": {\n        \"node\": \">=0.4.0\"\n      }\n    },\n    \"node_modules/acorn-jsx\": {\n      \"version\": \"5.0.1\",\n      \"resolved\": \"https://registry.npmjs.org/acorn-jsx/-/acorn-jsx-5.0.1.tgz\",\n      \"integrity\": \"sha512-HJ7CfNHrfJLlNTzIEUTj43LNWGkqpRLxm3YjAlcD0ACydk9XynzYsCBHxut+iqt+1aBXkx9UP/w/ZqMr13XIzg==\",\n      \"dev\": true,\n      \"peerDependencies\": {\n        \"acorn\": \"^6.0.0\"\n      }\n    },\n    \"node_modules/ajv\": {\n      \"version\": \"6.10.0\",\n      \"resolved\": \"https://registry.npmjs.org/ajv/-/ajv-6.10.0.tgz\",\n      \"integrity\": \"sha512-nffhOpkymDECQyR0mnsUtoCE8RlX38G0rYP+wgLWFyZuUyuuojSSvi/+euOiQBIn63whYwYVIIH1TvE3tu4OEg==\",\n      \"dev\": true,\n      \"dependencies\": {\n        \"fast-deep-equal\": \"^2.0.1\",\n        \"fast-json-stable-stringify\": \"^2.0.0\",\n        \"json-schema-traverse\": \"^0.4.1\",\n        \"uri-js\": \"^4.2.2\"\n      }\n    },\n    \"node_modules/ajv-keywords\": {\n      \"version\": \"3.4.0\",\n      \"resolved\": \"https://registry.npmjs.org/ajv-keywords/-/ajv-keywords-3.4.0.tgz\",\n      \"integrity\": \"sha512-aUjdRFISbuFOl0EIZc+9e4FfZp0bDZgAdOOf30bJmw8VM9v84SHyVyxDfbWxpGYbdZD/9XoKxfHVNmxPkhwyGw==\",\n      \"dev\": true,\n      \"peerDependencies\": {\n        \"ajv\": \"^6.9.1\"\n      }\n    },\n    \"node_modules/ansi-escapes\": {\n      \"version\": \"3.2.0\",\n      \"resolved\": \"https://registry.npmjs.org/ansi-escapes/-/ansi-escapes-3.2.0.tgz\",\n      \"integrity\": \"sha512-cBhpre4ma+U0T1oM5fXg7Dy1Jw7zzwv7lt/GoCpr+hDQJoYnKVPLL4dCvSEFMmQurOQvSrwT7SL/DAlhBI97RQ==\",\n      \"dev\": true,\n      \"engines\": {\n        \"node\": \">=4\"\n      }\n    },\n    \"node_modules/ansi-regex\": {\n      \"version\": \"2.1.1\",\n      \"resolved\": \"https://registry.npmjs.org/ansi-regex/-/ansi-regex-2.1.1.tgz\",\n      \"integrity\": \"sha1-w7M6te42DYbg5ijwRorn7yfWVN8=\",\n      \"dev\": true,\n      \"engines\": {\n        \"node\": \">=0.10.0\"\n      }\n    },\n    \"node_modules/ansi-styles\": {\n      \"version\": \"2.2.1\",\n      \"resolved\": \"https://registry.npmjs.org/ansi-styles/-/ansi-styles-2.2.1.tgz\",\n      \"integrity\": \"sha1-tDLdM1i2NM914eRmQ2gkBTPB3b4=\",\n      \"dev\": true,\n      \"engines\": {\n        \"node\": \">=0.10.0\"\n      }\n    },\n    \"node_modules/any-observable\": {\n      \"version\": \"0.3.0\",\n      \"resolved\": \"https://registry.npmjs.org/any-observable/-/any-observable-0.3.0.tgz\",\n      \"integrity\": \"sha512-/FQM1EDkTsf63Ub2C6O7GuYFDsSXUwsaZDurV0np41ocwq0jthUAYCmhBX9f+KwlaCgIuWyr/4WlUQUBfKfZog==\",\n      \"dev\": true,\n      \"engines\": {\n        \"node\": \">=6\"\n      }\n    },\n    \"node_modules/argparse\": {\n      \"version\": \"1.0.10\",\n      \"resolved\": \"https://registry.npmjs.org/argparse/-/argparse-1.0.10.tgz\",\n      \"integrity\": \"sha512-o5Roy6tNG4SL/FOkCAN6RzjiakZS25RLYFrcMttJqbdd8BWrnA+fGz57iN5Pb06pvBGvl5gQ0B48dJlslXvoTg==\",\n      \"dev\": true,\n      \"dependencies\": {\n        \"sprintf-js\": \"~1.0.2\"\n      }\n    },\n    \"node_modules/arr-diff\": {\n      \"version\": \"4.0.0\",\n      \"resolved\": \"https://registry.npmjs.org/arr-diff/-/arr-diff-4.0.0.tgz\",\n      \"integrity\": \"sha1-1kYQdP6/7HHn4VI1dhoyml3HxSA=\",\n      \"dev\": true,\n      \"engines\": {\n        \"node\": \">=0.10.0\"\n      }\n    },\n    \"node_modules/arr-flatten\": {\n      \"version\": \"1.1.0\",\n      \"resolved\": \"https://registry.npmjs.org/arr-flatten/-/arr-flatten-1.1.0.tgz\",\n      \"integrity\": \"sha512-L3hKV5R/p5o81R7O02IGnwpDmkp6E982XhtbuwSe3O4qOtMMMtodicASA1Cny2U+aCXcNpml+m4dPsvsJ3jatg==\",\n      \"dev\": true,\n      \"engines\": {\n        \"node\": \">=0.10.0\"\n      }\n    },\n    \"node_modules/arr-union\": {\n      \"version\": \"3.1.0\",\n      \"resolved\": \"https://registry.npmjs.org/arr-union/-/arr-union-3.1.0.tgz\",\n      \"integrity\": \"sha1-45sJrqne+Gao8gbiiK9jkZuuOcQ=\",\n      \"dev\": true,\n      \"engines\": {\n        \"node\": \">=0.10.0\"\n      }\n    },\n    \"node_modules/array-includes\": {\n      \"version\": \"3.0.3\",\n      \"resolved\": \"https://registry.npmjs.org/array-includes/-/array-includes-3.0.3.tgz\",\n      \"integrity\": \"sha1-GEtI9i2S10UrsxsyMWXH+L0CJm0=\",\n      \"dev\": true,\n      \"dependencies\": {\n        \"define-properties\": \"^1.1.2\",\n        \"es-abstract\": \"^1.7.0\"\n      },\n      \"engines\": {\n        \"node\": \">= 0.4\"\n      }\n    },\n    \"node_modules/array-union\": {\n      \"version\": \"1.0.2\",\n      \"resolved\": \"https://registry.npmjs.org/array-union/-/array-union-1.0.2.tgz\",\n      \"integrity\": \"sha1-mjRBDk9OPaI96jdb5b5w8kd47Dk=\",\n      \"dev\": true,\n      \"dependencies\": {\n        \"array-uniq\": \"^1.0.1\"\n      },\n      \"engines\": {\n        \"node\": \">=0.10.0\"\n      }\n    },\n    \"node_modules/array-uniq\": {\n      \"version\": \"1.0.3\",\n      \"resolved\": \"https://registry.npmjs.org/array-uniq/-/array-uniq-1.0.3.tgz\",\n      \"integrity\": \"sha1-r2rId6Jcx/dOBYiUdThY39sk/bY=\",\n      \"dev\": true,\n      \"engines\": {\n        \"node\": \">=0.10.0\"\n      }\n    },\n    \"node_modules/array-unique\": {\n      \"version\": \"0.3.2\",\n      \"resolved\": \"https://registry.npmjs.org/array-unique/-/array-unique-0.3.2.tgz\",\n      \"integrity\": \"sha1-qJS3XUvE9s1nnvMkSp/Y9Gri1Cg=\",\n      \"dev\": true,\n      \"engines\": {\n        \"node\": \">=0.10.0\"\n      }\n    },\n    \"node_modules/arrify\": {\n      \"version\": \"1.0.1\",\n      \"resolved\": \"https://registry.npmjs.org/arrify/-/arrify-1.0.1.tgz\",\n      \"integrity\": \"sha1-iYUI2iIm84DfkEcoRWhJwVAaSw0=\",\n      \"dev\": true,\n      \"engines\": {\n        \"node\": \">=0.10.0\"\n      }\n    },\n    \"node_modules/assign-symbols\": {\n      \"version\": \"1.0.0\",\n      \"resolved\": \"https://registry.npmjs.org/assign-symbols/-/assign-symbols-1.0.0.tgz\",\n      \"integrity\": \"sha1-WWZ/QfrdTyDMvCu5a41Pf3jsA2c=\",\n      \"dev\": true,\n      \"engines\": {\n        \"node\": \">=0.10.0\"\n      }\n    },\n    \"node_modules/async\": {\n      \"version\": \"1.5.2\",\n      \"resolved\": \"https://registry.npmjs.org/async/-/async-1.5.2.tgz\",\n      \"integrity\": \"sha1-7GphrlZIDAw8skHJVhjiCJL5Zyo=\",\n      \"dev\": true\n    },\n    \"node_modules/atob\": {\n      \"version\": \"2.1.2\",\n      \"resolved\": \"https://registry.npmjs.org/atob/-/atob-2.1.2.tgz\",\n      \"integrity\": \"sha512-Wm6ukoaOGJi/73p/cl2GvLjTI5JM1k/O14isD73YML8StrH/7/lRFgmg8nICZgD3bZZvjwCGxtMOD3wWNAu8cg==\",\n      \"dev\": true,\n      \"bin\": {\n        \"atob\": \"bin/atob.js\"\n      },\n      \"engines\": {\n        \"node\": \">= 4.5.0\"\n      }\n    },\n    \"node_modules/babel-code-frame\": {\n      \"version\": \"6.26.0\",\n      \"resolved\": \"https://registry.npmjs.org/babel-code-frame/-/babel-code-frame-6.26.0.tgz\",\n      \"integrity\": \"sha1-Y/1D99weO7fONZR9uP42mj9Yx0s=\",\n      \"dev\": true,\n      \"dependencies\": {\n        \"chalk\": \"^1.1.3\",\n        \"esutils\": \"^2.0.2\",\n        \"js-tokens\": \"^3.0.2\"\n      }\n    },\n    \"node_modules/babel-code-frame/node_modules/chalk\": {\n      \"version\": \"1.1.3\",\n      \"resolved\": \"https://registry.npmjs.org/chalk/-/chalk-1.1.3.tgz\",\n      \"integrity\": \"sha1-qBFcVeSnAv5NFQq9OHKCKn4J/Jg=\",\n      \"dev\": true,\n      \"dependencies\": {\n        \"ansi-styles\": \"^2.2.1\",\n        \"escape-string-regexp\": \"^1.0.2\",\n        \"has-ansi\": \"^2.0.0\",\n        \"strip-ansi\": \"^3.0.0\",\n        \"supports-color\": \"^2.0.0\"\n      },\n      \"engines\": {\n        \"node\": \">=0.10.0\"\n      }\n    },\n    \"node_modules/balanced-match\": {\n      \"version\": \"1.0.0\",\n      \"resolved\": \"https://registry.npmjs.org/balanced-match/-/balanced-match-1.0.0.tgz\",\n      \"integrity\": \"sha1-ibTRmasr7kneFk6gK4nORi1xt2c=\",\n      \"dev\": true\n    },\n    \"node_modules/base\": {\n      \"version\": \"0.11.2\",\n      \"resolved\": \"https://registry.npmjs.org/base/-/base-0.11.2.tgz\",\n      \"integrity\": \"sha512-5T6P4xPgpp0YDFvSWwEZ4NoE3aM4QBQXDzmVbraCkFj8zHM+mba8SyqB5DbZWyR7mYHo6Y7BdQo3MoA4m0TeQg==\",\n      \"dev\": true,\n      \"dependencies\": {\n        \"cache-base\": \"^1.0.1\",\n        \"class-utils\": \"^0.3.5\",\n        \"component-emitter\": \"^1.2.1\",\n        \"define-property\": \"^1.0.0\",\n        \"isobject\": \"^3.0.1\",\n        \"mixin-deep\": \"^1.2.0\",\n        \"pascalcase\": \"^0.1.1\"\n      },\n      \"engines\": {\n        \"node\": \">=0.10.0\"\n      }\n    },\n    \"node_modules/base/node_modules/define-property\": {\n      \"version\": \"1.0.0\",\n      \"resolved\": \"https://registry.npmjs.org/define-property/-/define-property-1.0.0.tgz\",\n      \"integrity\": \"sha1-dp66rz9KY6rTr56NMEybvnm/sOY=\",\n      \"dev\": true,\n      \"dependencies\": {\n        \"is-descriptor\": \"^1.0.0\"\n      },\n      \"engines\": {\n        \"node\": \">=0.10.0\"\n      }\n    },\n    \"node_modules/base/node_modules/is-accessor-descriptor\": {\n      \"version\": \"1.0.0\",\n      \"resolved\": \"https://registry.npmjs.org/is-accessor-descriptor/-/is-accessor-descriptor-1.0.0.tgz\",\n      \"integrity\": \"sha512-m5hnHTkcVsPfqx3AKlyttIPb7J+XykHvJP2B9bZDjlhLIoEq4XoK64Vg7boZlVWYK6LUY94dYPEE7Lh0ZkZKcQ==\",\n      \"deprecated\": \"Please upgrade to v1.0.1\",\n      \"dev\": true,\n      \"dependencies\": {\n        \"kind-of\": \"^6.0.0\"\n      },\n      \"engines\": {\n        \"node\": \">=0.10.0\"\n      }\n    },\n    \"node_modules/base/node_modules/is-data-descriptor\": {\n      \"version\": \"1.0.0\",\n      \"resolved\": \"https://registry.npmjs.org/is-data-descriptor/-/is-data-descriptor-1.0.0.tgz\",\n      \"integrity\": \"sha512-jbRXy1FmtAoCjQkVmIVYwuuqDFUbaOeDjmed1tOGPrsMhtJA4rD9tkgA0F1qJ3gRFRXcHYVkdeaP50Q5rE/jLQ==\",\n      \"deprecated\": \"Please upgrade to v1.0.1\",\n      \"dev\": true,\n      \"dependencies\": {\n        \"kind-of\": \"^6.0.0\"\n      },\n      \"engines\": {\n        \"node\": \">=0.10.0\"\n      }\n    },\n    \"node_modules/base/node_modules/is-descriptor\": {\n      \"version\": \"1.0.2\",\n      \"resolved\": \"https://registry.npmjs.org/is-descriptor/-/is-descriptor-1.0.2.tgz\",\n      \"integrity\": \"sha512-2eis5WqQGV7peooDyLmNEPUrps9+SXX5c9pL3xEB+4e9HnGuDa7mB7kHxHw4CbqS9k1T2hOH3miL8n8WtiYVtg==\",\n      \"dev\": true,\n      \"dependencies\": {\n        \"is-accessor-descriptor\": \"^1.0.0\",\n        \"is-data-descriptor\": \"^1.0.0\",\n        \"kind-of\": \"^6.0.2\"\n      },\n      \"engines\": {\n        \"node\": \">=0.10.0\"\n      }\n    },\n    \"node_modules/brace-expansion\": {\n      \"version\": \"1.1.11\",\n      \"resolved\": \"https://registry.npmjs.org/brace-expansion/-/brace-expansion-1.1.11.tgz\",\n      \"integrity\": \"sha512-iCuPHDFgrHX7H2vEI/5xpz07zSHB00TpugqhmYtVmMO6518mCuRMoOYFldEBl0g187ufozdaHgWKcYFb61qGiA==\",\n      \"dev\": true,\n      \"dependencies\": {\n        \"balanced-match\": \"^1.0.0\",\n        \"concat-map\": \"0.0.1\"\n      }\n    },\n    \"node_modules/braces\": {\n      \"version\": \"2.3.2\",\n      \"resolved\": \"https://registry.npmjs.org/braces/-/braces-2.3.2.tgz\",\n      \"integrity\": \"sha512-aNdbnj9P8PjdXU4ybaWLK2IF3jc/EoDYbC7AazW6to3TRsfXxscC9UXOB5iDiEQrkyIbWp2SLQda4+QAa7nc3w==\",\n      \"dev\": true,\n      \"dependencies\": {\n        \"arr-flatten\": \"^1.1.0\",\n        \"array-unique\": \"^0.3.2\",\n        \"extend-shallow\": \"^2.0.1\",\n        \"fill-range\": \"^4.0.0\",\n        \"isobject\": \"^3.0.1\",\n        \"repeat-element\": \"^1.1.2\",\n        \"snapdragon\": \"^0.8.1\",\n        \"snapdragon-node\": \"^2.0.1\",\n        \"split-string\": \"^3.0.2\",\n        \"to-regex\": \"^3.0.1\"\n      },\n      \"engines\": {\n        \"node\": \">=0.10.0\"\n      }\n    },\n    \"node_modules/braces/node_modules/extend-shallow\": {\n      \"version\": \"2.0.1\",\n      \"resolved\": \"https://registry.npmjs.org/extend-shallow/-/extend-shallow-2.0.1.tgz\",\n      \"integrity\": \"sha1-Ua99YUrZqfYQ6huvu5idaxxWiQ8=\",\n      \"dev\": true,\n      \"dependencies\": {\n        \"is-extendable\": \"^0.1.0\"\n      },\n      \"engines\": {\n        \"node\": \">=0.10.0\"\n      }\n    },\n    \"node_modules/cache-base\": {\n      \"version\": \"1.0.1\",\n      \"resolved\": \"https://registry.npmjs.org/cache-base/-/cache-base-1.0.1.tgz\",\n      \"integrity\": \"sha512-AKcdTnFSWATd5/GCPRxr2ChwIJ85CeyrEyjRHlKxQ56d4XJMGym0uAiKn0xbLOGOl3+yRpOTi484dVCEc5AUzQ==\",\n      \"dev\": true,\n      \"dependencies\": {\n        \"collection-visit\": \"^1.0.0\",\n        \"component-emitter\": \"^1.2.1\",\n        \"get-value\": \"^2.0.6\",\n        \"has-value\": \"^1.0.0\",\n        \"isobject\": \"^3.0.1\",\n        \"set-value\": \"^2.0.0\",\n        \"to-object-path\": \"^0.3.0\",\n        \"union-value\": \"^1.0.0\",\n        \"unset-value\": \"^1.0.0\"\n      },\n      \"engines\": {\n        \"node\": \">=0.10.0\"\n      }\n    },\n    \"node_modules/caller-callsite\": {\n      \"version\": \"2.0.0\",\n      \"resolved\": \"https://registry.npmjs.org/caller-callsite/-/caller-callsite-2.0.0.tgz\",\n      \"integrity\": \"sha1-hH4PzgoiN1CpoCfFSzNzGtMVQTQ=\",\n      \"dev\": true,\n      \"dependencies\": {\n        \"callsites\": \"^2.0.0\"\n      },\n      \"engines\": {\n        \"node\": \">=4\"\n      }\n    },\n    \"node_modules/caller-path\": {\n      \"version\": \"2.0.0\",\n      \"resolved\": \"https://registry.npmjs.org/caller-path/-/caller-path-2.0.0.tgz\",\n      \"integrity\": \"sha1-Ro+DBE42mrIBD6xfBs7uFbsssfQ=\",\n      \"dev\": true,\n      \"dependencies\": {\n        \"caller-callsite\": \"^2.0.0\"\n      },\n      \"engines\": {\n        \"node\": \">=4\"\n      }\n    },\n    \"node_modules/callsites\": {\n      \"version\": \"2.0.0\",\n      \"resolved\": \"https://registry.npmjs.org/callsites/-/callsites-2.0.0.tgz\",\n      \"integrity\": \"sha1-BuuE8A7qQT2oav/vrL/7Ngk7PFA=\",\n      \"dev\": true,\n      \"engines\": {\n        \"node\": \">=4\"\n      }\n    },\n    \"node_modules/chalk\": {\n      \"version\": \"2.4.2\",\n      \"resolved\": \"https://registry.npmjs.org/chalk/-/chalk-2.4.2.tgz\",\n      \"integrity\": \"sha512-Mti+f9lpJNcwF4tWV8/OrTTtF1gZi+f8FqlyAdouralcFWFQWF2+NgCHShjkCb+IFBLq9buZwE1xckQU4peSuQ==\",\n      \"dev\": true,\n      \"dependencies\": {\n        \"ansi-styles\": \"^3.2.1\",\n        \"escape-string-regexp\": \"^1.0.5\",\n        \"supports-color\": \"^5.3.0\"\n      },\n      \"engines\": {\n        \"node\": \">=4\"\n      }\n    },\n    \"node_modules/chalk/node_modules/ansi-styles\": {\n      \"version\": \"3.2.1\",\n      \"resolved\": \"https://registry.npmjs.org/ansi-styles/-/ansi-styles-3.2.1.tgz\",\n      \"integrity\": \"sha512-VT0ZI6kZRdTh8YyJw3SMbYm/u+NqfsAxEpWO0Pf9sq8/e94WxxOpPKx9FR1FlyCtOVDNOQ+8ntlqFxiRc+r5qA==\",\n      \"dev\": true,\n      \"dependencies\": {\n        \"color-convert\": \"^1.9.0\"\n      },\n      \"engines\": {\n        \"node\": \">=4\"\n      }\n    },\n    \"node_modules/chalk/node_modules/supports-color\": {\n      \"version\": \"5.5.0\",\n      \"resolved\": \"https://registry.npmjs.org/supports-color/-/supports-color-5.5.0.tgz\",\n      \"integrity\": \"sha512-QjVjwdXIt408MIiAqCX4oUKsgU2EqAGzs2Ppkm4aQYbjm+ZEWEcW4SfFNTr4uMNZma0ey4f5lgLrkB0aX0QMow==\",\n      \"dev\": true,\n      \"dependencies\": {\n        \"has-flag\": \"^3.0.0\"\n      },\n      \"engines\": {\n        \"node\": \">=4\"\n      }\n    },\n    \"node_modules/chardet\": {\n      \"version\": \"0.4.2\",\n      \"resolved\": \"https://registry.npmjs.org/chardet/-/chardet-0.4.2.tgz\",\n      \"integrity\": \"sha1-tUc7M9yXxCTl2Y3IfVXU2KKci/I=\",\n      \"dev\": true\n    },\n    \"node_modules/ci-info\": {\n      \"version\": \"1.6.0\",\n      \"resolved\": \"https://registry.npmjs.org/ci-info/-/ci-info-1.6.0.tgz\",\n      \"integrity\": \"sha512-vsGdkwSCDpWmP80ncATX7iea5DWQemg1UgCW5J8tqjU3lYw4FBYuj89J0CTVomA7BEfvSZd84GmHko+MxFQU2A==\",\n      \"dev\": true\n    },\n    \"node_modules/circular-json\": {\n      \"version\": \"0.3.3\",\n      \"resolved\": \"https://registry.npmjs.org/circular-json/-/circular-json-0.3.3.tgz\",\n      \"integrity\": \"sha512-UZK3NBx2Mca+b5LsG7bY183pHWt5Y1xts4P3Pz7ENTwGVnJOUWbRb3ocjvX7hx9tq/yTAdclXm9sZ38gNuem4A==\",\n      \"deprecated\": \"CircularJSON is in maintenance only, flatted is its successor.\",\n      \"dev\": true\n    },\n    \"node_modules/class-utils\": {\n      \"version\": \"0.3.6\",\n      \"resolved\": \"https://registry.npmjs.org/class-utils/-/class-utils-0.3.6.tgz\",\n      \"integrity\": \"sha512-qOhPa/Fj7s6TY8H8esGu5QNpMMQxz79h+urzrNYN6mn+9BnxlDGf5QZ+XeCDsxSjPqsSR56XOZOJmpeurnLMeg==\",\n      \"dev\": true,\n      \"dependencies\": {\n        \"arr-union\": \"^3.1.0\",\n        \"define-property\": \"^0.2.5\",\n        \"isobject\": \"^3.0.0\",\n        \"static-extend\": \"^0.1.1\"\n      },\n      \"engines\": {\n        \"node\": \">=0.10.0\"\n      }\n    },\n    \"node_modules/class-utils/node_modules/define-property\": {\n      \"version\": \"0.2.5\",\n      \"resolved\": \"https://registry.npmjs.org/define-property/-/define-property-0.2.5.tgz\",\n      \"integrity\": \"sha1-w1se+RjsPJkPmlvFe+BKrOxcgRY=\",\n      \"dev\": true,\n      \"dependencies\": {\n        \"is-descriptor\": \"^0.1.0\"\n      },\n      \"engines\": {\n        \"node\": \">=0.10.0\"\n      }\n    },\n    \"node_modules/cli-cursor\": {\n      \"version\": \"2.1.0\",\n      \"resolved\": \"https://registry.npmjs.org/cli-cursor/-/cli-cursor-2.1.0.tgz\",\n      \"integrity\": \"sha1-s12sN2R5+sw+lHR9QdDQ9SOP/LU=\",\n      \"dev\": true,\n      \"dependencies\": {\n        \"restore-cursor\": \"^2.0.0\"\n      },\n      \"engines\": {\n        \"node\": \">=4\"\n      }\n    },\n    \"node_modules/cli-truncate\": {\n      \"version\": \"0.2.1\",\n      \"resolved\": \"https://registry.npmjs.org/cli-truncate/-/cli-truncate-0.2.1.tgz\",\n      \"integrity\": \"sha1-nxXPuwcFAFNpIWxiasfQWrkN1XQ=\",\n      \"dev\": true,\n      \"dependencies\": {\n        \"slice-ansi\": \"0.0.4\",\n        \"string-width\": \"^1.0.1\"\n      },\n      \"engines\": {\n        \"node\": \">=0.10.0\"\n      }\n    },\n    \"node_modules/cli-width\": {\n      \"version\": \"2.2.0\",\n      \"resolved\": \"https://registry.npmjs.org/cli-width/-/cli-width-2.2.0.tgz\",\n      \"integrity\": \"sha1-/xnt6Kml5XkyQUewwR8PvLq+1jk=\",\n      \"dev\": true\n    },\n    \"node_modules/code-point-at\": {\n      \"version\": \"1.1.0\",\n      \"resolved\": \"https://registry.npmjs.org/code-point-at/-/code-point-at-1.1.0.tgz\",\n      \"integrity\": \"sha1-DQcLTQQ6W+ozovGkDi7bPZpMz3c=\",\n      \"dev\": true,\n      \"engines\": {\n        \"node\": \">=0.10.0\"\n      }\n    },\n    \"node_modules/collection-visit\": {\n      \"version\": \"1.0.0\",\n      \"resolved\": \"https://registry.npmjs.org/collection-visit/-/collection-visit-1.0.0.tgz\",\n      \"integrity\": \"sha1-S8A3PBZLwykbTTaMgpzxqApZ3KA=\",\n      \"dev\": true,\n      \"dependencies\": {\n        \"map-visit\": \"^1.0.0\",\n        \"object-visit\": \"^1.0.0\"\n      },\n      \"engines\": {\n        \"node\": \">=0.10.0\"\n      }\n    },\n    \"node_modules/color-convert\": {\n      \"version\": \"1.9.3\",\n      \"resolved\": \"https://registry.npmjs.org/color-convert/-/color-convert-1.9.3.tgz\",\n      \"integrity\": \"sha512-QfAUtd+vFdAtFQcC8CCyYt1fYWxSqAiK2cSD6zDB8N3cpsEBAvRxp9zOGg6G/SHHJYAT88/az/IuDGALsNVbGg==\",\n      \"dev\": true,\n      \"dependencies\": {\n        \"color-name\": \"1.1.3\"\n      }\n    },\n    \"node_modules/color-name\": {\n      \"version\": \"1.1.3\",\n      \"resolved\": \"https://registry.npmjs.org/color-name/-/color-name-1.1.3.tgz\",\n      \"integrity\": \"sha1-p9BVi9icQveV3UIyj3QIMcpTvCU=\",\n      \"dev\": true\n    },\n    \"node_modules/colors\": {\n      \"version\": \"1.0.3\",\n      \"resolved\": \"https://registry.npmjs.org/colors/-/colors-1.0.3.tgz\",\n      \"integrity\": \"sha1-BDP0TYCWgP3rYO0mDxsMJi6CpAs=\",\n      \"dev\": true,\n      \"engines\": {\n        \"node\": \">=0.1.90\"\n      }\n    },\n    \"node_modules/commander\": {\n      \"version\": \"2.20.0\",\n      \"resolved\": \"https://registry.npmjs.org/commander/-/commander-2.20.0.tgz\",\n      \"integrity\": \"sha512-7j2y+40w61zy6YC2iRNpUe/NwhNyoXrYpHMrSunaMG64nRnaf96zO/KMQR4OyN/UnE5KLyEBnKHd4aG3rskjpQ==\",\n      \"dev\": true\n    },\n    \"node_modules/component-emitter\": {\n      \"version\": \"1.3.0\",\n      \"resolved\": \"https://registry.npmjs.org/component-emitter/-/component-emitter-1.3.0.tgz\",\n      \"integrity\": \"sha512-Rd3se6QB+sO1TwqZjscQrurpEPIfO0/yYnSin6Q/rD3mOutHvUrCAhJub3r90uNb+SESBuE0QYoB90YdfatsRg==\",\n      \"dev\": true\n    },\n    \"node_modules/concat-map\": {\n      \"version\": \"0.0.1\",\n      \"resolved\": \"https://registry.npmjs.org/concat-map/-/concat-map-0.0.1.tgz\",\n      \"integrity\": \"sha1-2Klr13/Wjfd5OnMDajug1UBdR3s=\",\n      \"dev\": true\n    },\n    \"node_modules/contains-path\": {\n      \"version\": \"0.1.0\",\n      \"resolved\": \"https://registry.npmjs.org/contains-path/-/contains-path-0.1.0.tgz\",\n      \"integrity\": \"sha1-/ozxhP9mcLa67wGp1IYaXL7EEgo=\",\n      \"dev\": true,\n      \"engines\": {\n        \"node\": \">=0.10.0\"\n      }\n    },\n    \"node_modules/copy-descriptor\": {\n      \"version\": \"0.1.1\",\n      \"resolved\": \"https://registry.npmjs.org/copy-descriptor/-/copy-descriptor-0.1.1.tgz\",\n      \"integrity\": \"sha1-Z29us8OZl8LuGsOpJP1hJHSPV40=\",\n      \"dev\": true,\n      \"engines\": {\n        \"node\": \">=0.10.0\"\n      }\n    },\n    \"node_modules/corser\": {\n      \"version\": \"2.0.1\",\n      \"resolved\": \"https://registry.npmjs.org/corser/-/corser-2.0.1.tgz\",\n      \"integrity\": \"sha1-jtolLsqrWEDc2XXOuQ2TcMgZ/4c=\",\n      \"dev\": true,\n      \"engines\": {\n        \"node\": \">= 0.4.0\"\n      }\n    },\n    \"node_modules/cosmiconfig\": {\n      \"version\": \"5.2.1\",\n      \"resolved\": \"https://registry.npmjs.org/cosmiconfig/-/cosmiconfig-5.2.1.tgz\",\n      \"integrity\": \"sha512-H65gsXo1SKjf8zmrJ67eJk8aIRKV5ff2D4uKZIBZShbhGSpEmsQOPW/SKMKYhSTrqR7ufy6RP69rPogdaPh/kA==\",\n      \"dev\": true,\n      \"dependencies\": {\n        \"import-fresh\": \"^2.0.0\",\n        \"is-directory\": \"^0.3.1\",\n        \"js-yaml\": \"^3.13.1\",\n        \"parse-json\": \"^4.0.0\"\n      },\n      \"engines\": {\n        \"node\": \">=4\"\n      }\n    },\n    \"node_modules/cross-spawn\": {\n      \"version\": \"6.0.5\",\n      \"resolved\": \"https://registry.npmjs.org/cross-spawn/-/cross-spawn-6.0.5.tgz\",\n      \"integrity\": \"sha512-eTVLrBSt7fjbDygz805pMnstIs2VTBNkRm0qxZd+M7A5XDdxVRWO5MxGBXZhjY4cqLYLdtrGqRf8mBPmzwSpWQ==\",\n      \"dev\": true,\n      \"dependencies\": {\n        \"nice-try\": \"^1.0.4\",\n        \"path-key\": \"^2.0.1\",\n        \"semver\": \"^5.5.0\",\n        \"shebang-command\": \"^1.2.0\",\n        \"which\": \"^1.2.9\"\n      },\n      \"engines\": {\n        \"node\": \">=4.8\"\n      }\n    },\n    \"node_modules/date-fns\": {\n      \"version\": \"1.30.1\",\n      \"resolved\": \"https://registry.npmjs.org/date-fns/-/date-fns-1.30.1.tgz\",\n      \"integrity\": \"sha512-hBSVCvSmWC+QypYObzwGOd9wqdDpOt+0wl0KbU+R+uuZBS1jN8VsD1ss3irQDknRj5NvxiTF6oj/nDRnN/UQNw==\",\n      \"dev\": true\n    },\n    \"node_modules/debug\": {\n      \"version\": \"3.2.6\",\n      \"resolved\": \"https://registry.npmjs.org/debug/-/debug-3.2.6.tgz\",\n      \"integrity\": \"sha512-mel+jf7nrtEl5Pn1Qx46zARXKDpBbvzezse7p7LqINmdoIk8PYP5SySaxEmYv6TZ0JyEKA1hsCId6DIhgITtWQ==\",\n      \"deprecated\": \"Debug versions >=3.2.0 <3.2.7 || >=4 <4.3.1 have a low-severity ReDos regression when used in a Node.js environment. It is recommended you upgrade to 3.2.7 or 4.3.1. (https://github.com/visionmedia/debug/issues/797)\",\n      \"dev\": true,\n      \"dependencies\": {\n        \"ms\": \"^2.1.1\"\n      }\n    },\n    \"node_modules/debug-log\": {\n      \"version\": \"1.0.1\",\n      \"resolved\": \"https://registry.npmjs.org/debug-log/-/debug-log-1.0.1.tgz\",\n      \"integrity\": \"sha1-IwdjLUwEOCuN+KMvcLiVBG1SdF8=\",\n      \"dev\": true,\n      \"engines\": {\n        \"node\": \">=0.10.0\"\n      }\n    },\n    \"node_modules/decode-uri-component\": {\n      \"version\": \"0.2.0\",\n      \"resolved\": \"https://registry.npmjs.org/decode-uri-component/-/decode-uri-component-0.2.0.tgz\",\n      \"integrity\": \"sha1-6zkTMzRYd1y4TNGh+uBiEGu4dUU=\",\n      \"dev\": true,\n      \"engines\": {\n        \"node\": \">=0.10\"\n      }\n    },\n    \"node_modules/dedent\": {\n      \"version\": \"0.7.0\",\n      \"resolved\": \"https://registry.npmjs.org/dedent/-/dedent-0.7.0.tgz\",\n      \"integrity\": \"sha1-JJXduvbrh0q7Dhvp3yLS5aVEMmw=\",\n      \"dev\": true\n    },\n    \"node_modules/deep-is\": {\n      \"version\": \"0.1.3\",\n      \"resolved\": \"https://registry.npmjs.org/deep-is/-/deep-is-0.1.3.tgz\",\n      \"integrity\": \"sha1-s2nW+128E+7PUk+RsHD+7cNXzzQ=\",\n      \"dev\": true\n    },\n    \"node_modules/define-properties\": {\n      \"version\": \"1.1.3\",\n      \"resolved\": \"https://registry.npmjs.org/define-properties/-/define-properties-1.1.3.tgz\",\n      \"integrity\": \"sha512-3MqfYKj2lLzdMSf8ZIZE/V+Zuy+BgD6f164e8K2w7dgnpKArBDerGYpM46IYYcjnkdPNMjPk9A6VFB8+3SKlXQ==\",\n      \"dev\": true,\n      \"dependencies\": {\n        \"object-keys\": \"^1.0.12\"\n      },\n      \"engines\": {\n        \"node\": \">= 0.4\"\n      }\n    },\n    \"node_modules/define-property\": {\n      \"version\": \"2.0.2\",\n      \"resolved\": \"https://registry.npmjs.org/define-property/-/define-property-2.0.2.tgz\",\n      \"integrity\": \"sha512-jwK2UV4cnPpbcG7+VRARKTZPUWowwXA8bzH5NP6ud0oeAxyYPuGZUAC7hMugpCdz4BeSZl2Dl9k66CHJ/46ZYQ==\",\n      \"dev\": true,\n      \"dependencies\": {\n        \"is-descriptor\": \"^1.0.2\",\n        \"isobject\": \"^3.0.1\"\n      },\n      \"engines\": {\n        \"node\": \">=0.10.0\"\n      }\n    },\n    \"node_modules/define-property/node_modules/is-accessor-descriptor\": {\n      \"version\": \"1.0.0\",\n      \"resolved\": \"https://registry.npmjs.org/is-accessor-descriptor/-/is-accessor-descriptor-1.0.0.tgz\",\n      \"integrity\": \"sha512-m5hnHTkcVsPfqx3AKlyttIPb7J+XykHvJP2B9bZDjlhLIoEq4XoK64Vg7boZlVWYK6LUY94dYPEE7Lh0ZkZKcQ==\",\n      \"deprecated\": \"Please upgrade to v1.0.1\",\n      \"dev\": true,\n      \"dependencies\": {\n        \"kind-of\": \"^6.0.0\"\n      },\n      \"engines\": {\n        \"node\": \">=0.10.0\"\n      }\n    },\n    \"node_modules/define-property/node_modules/is-data-descriptor\": {\n      \"version\": \"1.0.0\",\n      \"resolved\": \"https://registry.npmjs.org/is-data-descriptor/-/is-data-descriptor-1.0.0.tgz\",\n      \"integrity\": \"sha512-jbRXy1FmtAoCjQkVmIVYwuuqDFUbaOeDjmed1tOGPrsMhtJA4rD9tkgA0F1qJ3gRFRXcHYVkdeaP50Q5rE/jLQ==\",\n      \"deprecated\": \"Please upgrade to v1.0.1\",\n      \"dev\": true,\n      \"dependencies\": {\n        \"kind-of\": \"^6.0.0\"\n      },\n      \"engines\": {\n        \"node\": \">=0.10.0\"\n      }\n    },\n    \"node_modules/define-property/node_modules/is-descriptor\": {\n      \"version\": \"1.0.2\",\n      \"resolved\": \"https://registry.npmjs.org/is-descriptor/-/is-descriptor-1.0.2.tgz\",\n      \"integrity\": \"sha512-2eis5WqQGV7peooDyLmNEPUrps9+SXX5c9pL3xEB+4e9HnGuDa7mB7kHxHw4CbqS9k1T2hOH3miL8n8WtiYVtg==\",\n      \"dev\": true,\n      \"dependencies\": {\n        \"is-accessor-descriptor\": \"^1.0.0\",\n        \"is-data-descriptor\": \"^1.0.0\",\n        \"kind-of\": \"^6.0.2\"\n      },\n      \"engines\": {\n        \"node\": \">=0.10.0\"\n      }\n    },\n    \"node_modules/deglob\": {\n      \"version\": \"2.1.1\",\n      \"resolved\": \"https://registry.npmjs.org/deglob/-/deglob-2.1.1.tgz\",\n      \"integrity\": \"sha512-2kjwuGGonL7gWE1XU4Fv79+vVzpoQCl0V+boMwWtOQJV2AGDabCwez++nB1Nli/8BabAfZQ/UuHPlp6AymKdWw==\",\n      \"dev\": true,\n      \"dependencies\": {\n        \"find-root\": \"^1.0.0\",\n        \"glob\": \"^7.0.5\",\n        \"ignore\": \"^3.0.9\",\n        \"pkg-config\": \"^1.1.0\",\n        \"run-parallel\": \"^1.1.2\",\n        \"uniq\": \"^1.0.1\"\n      }\n    },\n    \"node_modules/deglob/node_modules/ignore\": {\n      \"version\": \"3.3.10\",\n      \"resolved\": \"https://registry.npmjs.org/ignore/-/ignore-3.3.10.tgz\",\n      \"integrity\": \"sha512-Pgs951kaMm5GXP7MOvxERINe3gsaVjUWFm+UZPSq9xYriQAksyhg0csnS0KXSNRD5NmNdapXEpjxG49+AKh/ug==\",\n      \"dev\": true\n    },\n    \"node_modules/del\": {\n      \"version\": \"3.0.0\",\n      \"resolved\": \"https://registry.npmjs.org/del/-/del-3.0.0.tgz\",\n      \"integrity\": \"sha1-U+z2mf/LyzljdpGrE7rxYIGXZuU=\",\n      \"dev\": true,\n      \"dependencies\": {\n        \"globby\": \"^6.1.0\",\n        \"is-path-cwd\": \"^1.0.0\",\n        \"is-path-in-cwd\": \"^1.0.0\",\n        \"p-map\": \"^1.1.1\",\n        \"pify\": \"^3.0.0\",\n        \"rimraf\": \"^2.2.8\"\n      },\n      \"engines\": {\n        \"node\": \">=4\"\n      }\n    },\n    \"node_modules/doctrine\": {\n      \"version\": \"2.1.0\",\n      \"resolved\": \"https://registry.npmjs.org/doctrine/-/doctrine-2.1.0.tgz\",\n      \"integrity\": \"sha512-35mSku4ZXK0vfCuHEDAwt55dg2jNajHZ1odvF+8SSr82EsZY4QmXfuWso8oEd8zRhVObSN18aM0CjSdoBX7zIw==\",\n      \"dev\": true,\n      \"dependencies\": {\n        \"esutils\": \"^2.0.2\"\n      },\n      \"engines\": {\n        \"node\": \">=0.10.0\"\n      }\n    },\n    \"node_modules/ecstatic\": {\n      \"version\": \"3.3.2\",\n      \"resolved\": \"https://registry.npmjs.org/ecstatic/-/ecstatic-3.3.2.tgz\",\n      \"integrity\": \"sha512-fLf9l1hnwrHI2xn9mEDT7KIi22UDqA2jaCwyCbSUJh9a1V+LEUSL/JO/6TIz/QyuBURWUHrFL5Kg2TtO1bkkog==\",\n      \"deprecated\": \"This package is unmaintained and deprecated. See the GH Issue 259.\",\n      \"dev\": true,\n      \"dependencies\": {\n        \"he\": \"^1.1.1\",\n        \"mime\": \"^1.6.0\",\n        \"minimist\": \"^1.1.0\",\n        \"url-join\": \"^2.0.5\"\n      },\n      \"bin\": {\n        \"ecstatic\": \"lib/ecstatic.js\"\n      }\n    },\n    \"node_modules/elegant-spinner\": {\n      \"version\": \"1.0.1\",\n      \"resolved\": \"https://registry.npmjs.org/elegant-spinner/-/elegant-spinner-1.0.1.tgz\",\n      \"integrity\": \"sha1-2wQ1IcldfjA/2PNFvtwzSc+wcp4=\",\n      \"dev\": true,\n      \"engines\": {\n        \"node\": \">=0.10.0\"\n      }\n    },\n    \"node_modules/end-of-stream\": {\n      \"version\": \"1.4.1\",\n      \"resolved\": \"https://registry.npmjs.org/end-of-stream/-/end-of-stream-1.4.1.tgz\",\n      \"integrity\": \"sha512-1MkrZNvWTKCaigbn+W15elq2BB/L22nqrSY5DKlo3X6+vclJm8Bb5djXJBmEX6fS3+zCh/F4VBK5Z2KxJt4s2Q==\",\n      \"dev\": true,\n      \"dependencies\": {\n        \"once\": \"^1.4.0\"\n      }\n    },\n    \"node_modules/error-ex\": {\n      \"version\": \"1.3.2\",\n      \"resolved\": \"https://registry.npmjs.org/error-ex/-/error-ex-1.3.2.tgz\",\n      \"integrity\": \"sha512-7dFHNmqeFSEt2ZBsCriorKnn3Z2pj+fd9kmI6QoWw4//DL+icEBfc0U7qJCisqrTsKTjw4fNFy2pW9OqStD84g==\",\n      \"dev\": true,\n      \"dependencies\": {\n        \"is-arrayish\": \"^0.2.1\"\n      }\n    },\n    \"node_modules/es-abstract\": {\n      \"version\": \"1.13.0\",\n      \"resolved\": \"https://registry.npmjs.org/es-abstract/-/es-abstract-1.13.0.tgz\",\n      \"integrity\": \"sha512-vDZfg/ykNxQVwup/8E1BZhVzFfBxs9NqMzGcvIJrqg5k2/5Za2bWo40dK2J1pgLngZ7c+Shh8lwYtLGyrwPutg==\",\n      \"dev\": true,\n      \"dependencies\": {\n        \"es-to-primitive\": \"^1.2.0\",\n        \"function-bind\": \"^1.1.1\",\n        \"has\": \"^1.0.3\",\n        \"is-callable\": \"^1.1.4\",\n        \"is-regex\": \"^1.0.4\",\n        \"object-keys\": \"^1.0.12\"\n      },\n      \"engines\": {\n        \"node\": \">= 0.4\"\n      }\n    },\n    \"node_modules/es-to-primitive\": {\n      \"version\": \"1.2.0\",\n      \"resolved\": \"https://registry.npmjs.org/es-to-primitive/-/es-to-primitive-1.2.0.tgz\",\n      \"integrity\": \"sha512-qZryBOJjV//LaxLTV6UC//WewneB3LcXOL9NP++ozKVXsIIIpm/2c13UDiD9Jp2eThsecw9m3jPqDwTyobcdbg==\",\n      \"dev\": true,\n      \"dependencies\": {\n        \"is-callable\": \"^1.1.4\",\n        \"is-date-object\": \"^1.0.1\",\n        \"is-symbol\": \"^1.0.2\"\n      },\n      \"engines\": {\n        \"node\": \">= 0.4\"\n      }\n    },\n    \"node_modules/escape-string-regexp\": {\n      \"version\": \"1.0.5\",\n      \"resolved\": \"https://registry.npmjs.org/escape-string-regexp/-/escape-string-regexp-1.0.5.tgz\",\n      \"integrity\": \"sha1-G2HAViGQqN/2rjuyzwIAyhMLhtQ=\",\n      \"dev\": true,\n      \"engines\": {\n        \"node\": \">=0.8.0\"\n      }\n    },\n    \"node_modules/eslint\": {\n      \"version\": \"5.4.0\",\n      \"resolved\": \"https://registry.npmjs.org/eslint/-/eslint-5.4.0.tgz\",\n      \"integrity\": \"sha512-UIpL91XGex3qtL6qwyCQJar2j3osKxK9e3ano3OcGEIRM4oWIpCkDg9x95AXEC2wMs7PnxzOkPZ2gq+tsMS9yg==\",\n      \"dev\": true,\n      \"dependencies\": {\n        \"ajv\": \"^6.5.0\",\n        \"babel-code-frame\": \"^6.26.0\",\n        \"chalk\": \"^2.1.0\",\n        \"cross-spawn\": \"^6.0.5\",\n        \"debug\": \"^3.1.0\",\n        \"doctrine\": \"^2.1.0\",\n        \"eslint-scope\": \"^4.0.0\",\n        \"eslint-utils\": \"^1.3.1\",\n        \"eslint-visitor-keys\": \"^1.0.0\",\n        \"espree\": \"^4.0.0\",\n        \"esquery\": \"^1.0.1\",\n        \"esutils\": \"^2.0.2\",\n        \"file-entry-cache\": \"^2.0.0\",\n        \"functional-red-black-tree\": \"^1.0.1\",\n        \"glob\": \"^7.1.2\",\n        \"globals\": \"^11.7.0\",\n        \"ignore\": \"^4.0.2\",\n        \"imurmurhash\": \"^0.1.4\",\n        \"inquirer\": \"^5.2.0\",\n        \"is-resolvable\": \"^1.1.0\",\n        \"js-yaml\": \"^3.11.0\",\n        \"json-stable-stringify-without-jsonify\": \"^1.0.1\",\n        \"levn\": \"^0.3.0\",\n        \"lodash\": \"^4.17.5\",\n        \"minimatch\": \"^3.0.4\",\n        \"mkdirp\": \"^0.5.1\",\n        \"natural-compare\": \"^1.4.0\",\n        \"optionator\": \"^0.8.2\",\n        \"path-is-inside\": \"^1.0.2\",\n        \"pluralize\": \"^7.0.0\",\n        \"progress\": \"^2.0.0\",\n        \"regexpp\": \"^2.0.0\",\n        \"require-uncached\": \"^1.0.3\",\n        \"semver\": \"^5.5.0\",\n        \"strip-ansi\": \"^4.0.0\",\n        \"strip-json-comments\": \"^2.0.1\",\n        \"table\": \"^4.0.3\",\n        \"text-table\": \"^0.2.0\"\n      },\n      \"bin\": {\n        \"eslint\": \"bin/eslint.js\"\n      },\n      \"engines\": {\n        \"node\": \"^6.14.0 || ^8.10.0 || >=9.10.0\"\n      }\n    },\n    \"node_modules/eslint-config-standard\": {\n      \"version\": \"12.0.0\",\n      \"resolved\": \"https://registry.npmjs.org/eslint-config-standard/-/eslint-config-standard-12.0.0.tgz\",\n      \"integrity\": \"sha512-COUz8FnXhqFitYj4DTqHzidjIL/t4mumGZto5c7DrBpvWoie+Sn3P4sLEzUGeYhRElWuFEf8K1S1EfvD1vixCQ==\",\n      \"dev\": true,\n      \"peerDependencies\": {\n        \"eslint\": \">=5.0.0\",\n        \"eslint-plugin-import\": \">=2.13.0\",\n        \"eslint-plugin-node\": \">=7.0.0\",\n        \"eslint-plugin-promise\": \">=4.0.0\",\n        \"eslint-plugin-standard\": \">=4.0.0\"\n      }\n    },\n    \"node_modules/eslint-config-standard-jsx\": {\n      \"version\": \"6.0.2\",\n      \"resolved\": \"https://registry.npmjs.org/eslint-config-standard-jsx/-/eslint-config-standard-jsx-6.0.2.tgz\",\n      \"integrity\": \"sha512-D+YWAoXw+2GIdbMBRAzWwr1ZtvnSf4n4yL0gKGg7ShUOGXkSOLerI17K4F6LdQMJPNMoWYqepzQD/fKY+tXNSg==\",\n      \"dev\": true,\n      \"peerDependencies\": {\n        \"eslint\": \">=5.0.0\",\n        \"eslint-plugin-react\": \">=7.11.1\"\n      }\n    },\n    \"node_modules/eslint-import-resolver-node\": {\n      \"version\": \"0.3.2\",\n      \"resolved\": \"https://registry.npmjs.org/eslint-import-resolver-node/-/eslint-import-resolver-node-0.3.2.tgz\",\n      \"integrity\": \"sha512-sfmTqJfPSizWu4aymbPr4Iidp5yKm8yDkHp+Ir3YiTHiiDfxh69mOUsmiqW6RZ9zRXFaF64GtYmN7e+8GHBv6Q==\",\n      \"dev\": true,\n      \"dependencies\": {\n        \"debug\": \"^2.6.9\",\n        \"resolve\": \"^1.5.0\"\n      }\n    },\n    \"node_modules/eslint-import-resolver-node/node_modules/debug\": {\n      \"version\": \"2.6.9\",\n      \"resolved\": \"https://registry.npmjs.org/debug/-/debug-2.6.9.tgz\",\n      \"integrity\": \"sha512-bC7ElrdJaJnPbAP+1EotYvqZsb3ecl5wi6Bfi6BJTUcNowp6cvspg0jXznRTKDjm/E7AdgFBVeAPVMNcKGsHMA==\",\n      \"dev\": true,\n      \"dependencies\": {\n        \"ms\": \"2.0.0\"\n      }\n    },\n    \"node_modules/eslint-import-resolver-node/node_modules/ms\": {\n      \"version\": \"2.0.0\",\n      \"resolved\": \"https://registry.npmjs.org/ms/-/ms-2.0.0.tgz\",\n      \"integrity\": \"sha1-VgiurfwAvmwpAd9fmGF4jeDVl8g=\",\n      \"dev\": true\n    },\n    \"node_modules/eslint-module-utils\": {\n      \"version\": \"2.4.0\",\n      \"resolved\": \"https://registry.npmjs.org/eslint-module-utils/-/eslint-module-utils-2.4.0.tgz\",\n      \"integrity\": \"sha512-14tltLm38Eu3zS+mt0KvILC3q8jyIAH518MlG+HO0p+yK885Lb1UHTY/UgR91eOyGdmxAPb+OLoW4znqIT6Ndw==\",\n      \"dev\": true,\n      \"dependencies\": {\n        \"debug\": \"^2.6.8\",\n        \"pkg-dir\": \"^2.0.0\"\n      },\n      \"engines\": {\n        \"node\": \">=4\"\n      }\n    },\n    \"node_modules/eslint-module-utils/node_modules/debug\": {\n      \"version\": \"2.6.9\",\n      \"resolved\": \"https://registry.npmjs.org/debug/-/debug-2.6.9.tgz\",\n      \"integrity\": \"sha512-bC7ElrdJaJnPbAP+1EotYvqZsb3ecl5wi6Bfi6BJTUcNowp6cvspg0jXznRTKDjm/E7AdgFBVeAPVMNcKGsHMA==\",\n      \"dev\": true,\n      \"dependencies\": {\n        \"ms\": \"2.0.0\"\n      }\n    },\n    \"node_modules/eslint-module-utils/node_modules/find-up\": {\n      \"version\": \"2.1.0\",\n      \"resolved\": \"https://registry.npmjs.org/find-up/-/find-up-2.1.0.tgz\",\n      \"integrity\": \"sha1-RdG35QbHF93UgndaK3eSCjwMV6c=\",\n      \"dev\": true,\n      \"dependencies\": {\n        \"locate-path\": \"^2.0.0\"\n      },\n      \"engines\": {\n        \"node\": \">=4\"\n      }\n    },\n    \"node_modules/eslint-module-utils/node_modules/locate-path\": {\n      \"version\": \"2.0.0\",\n      \"resolved\": \"https://registry.npmjs.org/locate-path/-/locate-path-2.0.0.tgz\",\n      \"integrity\": \"sha1-K1aLJl7slExtnA3pw9u7ygNUzY4=\",\n      \"dev\": true,\n      \"dependencies\": {\n        \"p-locate\": \"^2.0.0\",\n        \"path-exists\": \"^3.0.0\"\n      },\n      \"engines\": {\n        \"node\": \">=4\"\n      }\n    },\n    \"node_modules/eslint-module-utils/node_modules/ms\": {\n      \"version\": \"2.0.0\",\n      \"resolved\": \"https://registry.npmjs.org/ms/-/ms-2.0.0.tgz\",\n      \"integrity\": \"sha1-VgiurfwAvmwpAd9fmGF4jeDVl8g=\",\n      \"dev\": true\n    },\n    \"node_modules/eslint-module-utils/node_modules/p-limit\": {\n      \"version\": \"1.3.0\",\n      \"resolved\": \"https://registry.npmjs.org/p-limit/-/p-limit-1.3.0.tgz\",\n      \"integrity\": \"sha512-vvcXsLAJ9Dr5rQOPk7toZQZJApBl2K4J6dANSsEuh6QI41JYcsS/qhTGa9ErIUUgK3WNQoJYvylxvjqmiqEA9Q==\",\n      \"dev\": true,\n      \"dependencies\": {\n        \"p-try\": \"^1.0.0\"\n      },\n      \"engines\": {\n        \"node\": \">=4\"\n      }\n    },\n    \"node_modules/eslint-module-utils/node_modules/p-locate\": {\n      \"version\": \"2.0.0\",\n      \"resolved\": \"https://registry.npmjs.org/p-locate/-/p-locate-2.0.0.tgz\",\n      \"integrity\": \"sha1-IKAQOyIqcMj9OcwuWAaA893l7EM=\",\n      \"dev\": true,\n      \"dependencies\": {\n        \"p-limit\": \"^1.1.0\"\n      },\n      \"engines\": {\n        \"node\": \">=4\"\n      }\n    },\n    \"node_modules/eslint-module-utils/node_modules/p-try\": {\n      \"version\": \"1.0.0\",\n      \"resolved\": \"https://registry.npmjs.org/p-try/-/p-try-1.0.0.tgz\",\n      \"integrity\": \"sha1-y8ec26+P1CKOE/Yh8rGiN8GyB7M=\",\n      \"dev\": true,\n      \"engines\": {\n        \"node\": \">=4\"\n      }\n    },\n    \"node_modules/eslint-module-utils/node_modules/pkg-dir\": {\n      \"version\": \"2.0.0\",\n      \"resolved\": \"https://registry.npmjs.org/pkg-dir/-/pkg-dir-2.0.0.tgz\",\n      \"integrity\": \"sha1-9tXREJ4Z1j7fQo4L1X4Sd3YVM0s=\",\n      \"dev\": true,\n      \"dependencies\": {\n        \"find-up\": \"^2.1.0\"\n      },\n      \"engines\": {\n        \"node\": \">=4\"\n      }\n    },\n    \"node_modules/eslint-plugin-es\": {\n      \"version\": \"1.4.0\",\n      \"resolved\": \"https://registry.npmjs.org/eslint-plugin-es/-/eslint-plugin-es-1.4.0.tgz\",\n      \"integrity\": \"sha512-XfFmgFdIUDgvaRAlaXUkxrRg5JSADoRC8IkKLc/cISeR3yHVMefFHQZpcyXXEUUPHfy5DwviBcrfqlyqEwlQVw==\",\n      \"dev\": true,\n      \"dependencies\": {\n        \"eslint-utils\": \"^1.3.0\",\n        \"regexpp\": \"^2.0.1\"\n      },\n      \"engines\": {\n        \"node\": \">=6.5.0\"\n      },\n      \"peerDependencies\": {\n        \"eslint\": \">=4.19.1\"\n      }\n    },\n    \"node_modules/eslint-plugin-import\": {\n      \"version\": \"2.14.0\",\n      \"resolved\": \"https://registry.npmjs.org/eslint-plugin-import/-/eslint-plugin-import-2.14.0.tgz\",\n      \"integrity\": \"sha512-FpuRtniD/AY6sXByma2Wr0TXvXJ4nA/2/04VPlfpmUDPOpOY264x+ILiwnrk/k4RINgDAyFZByxqPUbSQ5YE7g==\",\n      \"dev\": true,\n      \"dependencies\": {\n        \"contains-path\": \"^0.1.0\",\n        \"debug\": \"^2.6.8\",\n        \"doctrine\": \"1.5.0\",\n        \"eslint-import-resolver-node\": \"^0.3.1\",\n        \"eslint-module-utils\": \"^2.2.0\",\n        \"has\": \"^1.0.1\",\n        \"lodash\": \"^4.17.4\",\n        \"minimatch\": \"^3.0.3\",\n        \"read-pkg-up\": \"^2.0.0\",\n        \"resolve\": \"^1.6.0\"\n      },\n      \"engines\": {\n        \"node\": \">=4\"\n      },\n      \"peerDependencies\": {\n        \"eslint\": \"2.x - 5.x\"\n      }\n    },\n    \"node_modules/eslint-plugin-import/node_modules/debug\": {\n      \"version\": \"2.6.9\",\n      \"resolved\": \"https://registry.npmjs.org/debug/-/debug-2.6.9.tgz\",\n      \"integrity\": \"sha512-bC7ElrdJaJnPbAP+1EotYvqZsb3ecl5wi6Bfi6BJTUcNowp6cvspg0jXznRTKDjm/E7AdgFBVeAPVMNcKGsHMA==\",\n      \"dev\": true,\n      \"dependencies\": {\n        \"ms\": \"2.0.0\"\n      }\n    },\n    \"node_modules/eslint-plugin-import/node_modules/doctrine\": {\n      \"version\": \"1.5.0\",\n      \"resolved\": \"https://registry.npmjs.org/doctrine/-/doctrine-1.5.0.tgz\",\n      \"integrity\": \"sha1-N53Ocw9hZvds76TmcHoVmwLFpvo=\",\n      \"dev\": true,\n      \"dependencies\": {\n        \"esutils\": \"^2.0.2\",\n        \"isarray\": \"^1.0.0\"\n      },\n      \"engines\": {\n        \"node\": \">=0.10.0\"\n      }\n    },\n    \"node_modules/eslint-plugin-import/node_modules/ms\": {\n      \"version\": \"2.0.0\",\n      \"resolved\": \"https://registry.npmjs.org/ms/-/ms-2.0.0.tgz\",\n      \"integrity\": \"sha1-VgiurfwAvmwpAd9fmGF4jeDVl8g=\",\n      \"dev\": true\n    },\n    \"node_modules/eslint-plugin-node\": {\n      \"version\": \"7.0.1\",\n      \"resolved\": \"https://registry.npmjs.org/eslint-plugin-node/-/eslint-plugin-node-7.0.1.tgz\",\n      \"integrity\": \"sha512-lfVw3TEqThwq0j2Ba/Ckn2ABdwmL5dkOgAux1rvOk6CO7A6yGyPI2+zIxN6FyNkp1X1X/BSvKOceD6mBWSj4Yw==\",\n      \"dev\": true,\n      \"dependencies\": {\n        \"eslint-plugin-es\": \"^1.3.1\",\n        \"eslint-utils\": \"^1.3.1\",\n        \"ignore\": \"^4.0.2\",\n        \"minimatch\": \"^3.0.4\",\n        \"resolve\": \"^1.8.1\",\n        \"semver\": \"^5.5.0\"\n      },\n      \"engines\": {\n        \"node\": \">=6\"\n      },\n      \"peerDependencies\": {\n        \"eslint\": \">=4.19.1\"\n      }\n    },\n    \"node_modules/eslint-plugin-promise\": {\n      \"version\": \"4.0.1\",\n      \"resolved\": \"https://registry.npmjs.org/eslint-plugin-promise/-/eslint-plugin-promise-4.0.1.tgz\",\n      \"integrity\": \"sha512-Si16O0+Hqz1gDHsys6RtFRrW7cCTB6P7p3OJmKp3Y3dxpQE2qwOA7d3xnV+0mBmrPoi0RBnxlCKvqu70te6wjg==\",\n      \"dev\": true,\n      \"engines\": {\n        \"node\": \">=6\"\n      }\n    },\n    \"node_modules/eslint-plugin-react\": {\n      \"version\": \"7.11.1\",\n      \"resolved\": \"https://registry.npmjs.org/eslint-plugin-react/-/eslint-plugin-react-7.11.1.tgz\",\n      \"integrity\": \"sha512-cVVyMadRyW7qsIUh3FHp3u6QHNhOgVrLQYdQEB1bPWBsgbNCHdFAeNMquBMCcZJu59eNthX053L70l7gRt4SCw==\",\n      \"dev\": true,\n      \"dependencies\": {\n        \"array-includes\": \"^3.0.3\",\n        \"doctrine\": \"^2.1.0\",\n        \"has\": \"^1.0.3\",\n        \"jsx-ast-utils\": \"^2.0.1\",\n        \"prop-types\": \"^15.6.2\"\n      },\n      \"engines\": {\n        \"node\": \">=4\"\n      },\n      \"peerDependencies\": {\n        \"eslint\": \"^3.0.0 || ^4.0.0 || ^5.0.0\"\n      }\n    },\n    \"node_modules/eslint-plugin-standard\": {\n      \"version\": \"4.0.0\",\n      \"resolved\": \"https://registry.npmjs.org/eslint-plugin-standard/-/eslint-plugin-standard-4.0.0.tgz\",\n      \"integrity\": \"sha512-OwxJkR6TQiYMmt1EsNRMe5qG3GsbjlcOhbGUBY4LtavF9DsLaTcoR+j2Tdjqi23oUwKNUqX7qcn5fPStafMdlA==\",\n      \"dev\": true,\n      \"peerDependencies\": {\n        \"eslint\": \">=5.0.0\"\n      }\n    },\n    \"node_modules/eslint-scope\": {\n      \"version\": \"4.0.3\",\n      \"resolved\": \"https://registry.npmjs.org/eslint-scope/-/eslint-scope-4.0.3.tgz\",\n      \"integrity\": \"sha512-p7VutNr1O/QrxysMo3E45FjYDTeXBy0iTltPFNSqKAIfjDSXC+4dj+qfyuD8bfAXrW/y6lW3O76VaYNPKfpKrg==\",\n      \"dev\": true,\n      \"dependencies\": {\n        \"esrecurse\": \"^4.1.0\",\n        \"estraverse\": \"^4.1.1\"\n      },\n      \"engines\": {\n        \"node\": \">=4.0.0\"\n      }\n    },\n    \"node_modules/eslint-utils\": {\n      \"version\": \"1.4.3\",\n      \"resolved\": \"https://registry.npmjs.org/eslint-utils/-/eslint-utils-1.4.3.tgz\",\n      \"integrity\": \"sha512-fbBN5W2xdY45KulGXmLHZ3c3FHfVYmKg0IrAKGOkT/464PQsx2UeIzfz1RmEci+KLm1bBaAzZAh8+/E+XAeZ8Q==\",\n      \"dev\": true,\n      \"dependencies\": {\n        \"eslint-visitor-keys\": \"^1.1.0\"\n      },\n      \"engines\": {\n        \"node\": \">=6\"\n      }\n    },\n    \"node_modules/eslint-utils/node_modules/eslint-visitor-keys\": {\n      \"version\": \"1.1.0\",\n      \"resolved\": \"https://registry.npmjs.org/eslint-visitor-keys/-/eslint-visitor-keys-1.1.0.tgz\",\n      \"integrity\": \"sha512-8y9YjtM1JBJU/A9Kc+SbaOV4y29sSWckBwMHa+FGtVj5gN/sbnKDf6xJUl+8g7FAij9LVaP8C24DUiH/f/2Z9A==\",\n      \"dev\": true,\n      \"engines\": {\n        \"node\": \">=4\"\n      }\n    },\n    \"node_modules/eslint-visitor-keys\": {\n      \"version\": \"1.0.0\",\n      \"resolved\": \"https://registry.npmjs.org/eslint-visitor-keys/-/eslint-visitor-keys-1.0.0.tgz\",\n      \"integrity\": \"sha512-qzm/XxIbxm/FHyH341ZrbnMUpe+5Bocte9xkmFMzPMjRaZMcXww+MpBptFvtU+79L362nqiLhekCxCxDPaUMBQ==\",\n      \"dev\": true,\n      \"engines\": {\n        \"node\": \">=4\"\n      }\n    },\n    \"node_modules/eslint/node_modules/ansi-regex\": {\n      \"version\": \"3.0.0\",\n      \"resolved\": \"https://registry.npmjs.org/ansi-regex/-/ansi-regex-3.0.0.tgz\",\n      \"integrity\": \"sha1-7QMXwyIGT3lGbAKWa922Bas32Zg=\",\n      \"dev\": true,\n      \"engines\": {\n        \"node\": \">=4\"\n      }\n    },\n    \"node_modules/eslint/node_modules/strip-ansi\": {\n      \"version\": \"4.0.0\",\n      \"resolved\": \"https://registry.npmjs.org/strip-ansi/-/strip-ansi-4.0.0.tgz\",\n      \"integrity\": \"sha1-qEeQIusaw2iocTibY1JixQXuNo8=\",\n      \"dev\": true,\n      \"dependencies\": {\n        \"ansi-regex\": \"^3.0.0\"\n      },\n      \"engines\": {\n        \"node\": \">=4\"\n      }\n    },\n    \"node_modules/espree\": {\n      \"version\": \"4.1.0\",\n      \"resolved\": \"https://registry.npmjs.org/espree/-/espree-4.1.0.tgz\",\n      \"integrity\": \"sha512-I5BycZW6FCVIub93TeVY1s7vjhP9CY6cXCznIRfiig7nRviKZYdRnj/sHEWC6A7WE9RDWOFq9+7OsWSYz8qv2w==\",\n      \"dev\": true,\n      \"dependencies\": {\n        \"acorn\": \"^6.0.2\",\n        \"acorn-jsx\": \"^5.0.0\",\n        \"eslint-visitor-keys\": \"^1.0.0\"\n      },\n      \"engines\": {\n        \"node\": \">=6.0.0\"\n      }\n    },\n    \"node_modules/esprima\": {\n      \"version\": \"4.0.1\",\n      \"resolved\": \"https://registry.npmjs.org/esprima/-/esprima-4.0.1.tgz\",\n      \"integrity\": \"sha512-eGuFFw7Upda+g4p+QHvnW0RyTX/SVeJBDM/gCtMARO0cLuT2HcEKnTPvhjV6aGeqrCB/sbNop0Kszm0jsaWU4A==\",\n      \"dev\": true,\n      \"bin\": {\n        \"esparse\": \"bin/esparse.js\",\n        \"esvalidate\": \"bin/esvalidate.js\"\n      },\n      \"engines\": {\n        \"node\": \">=4\"\n      }\n    },\n    \"node_modules/esquery\": {\n      \"version\": \"1.0.1\",\n      \"resolved\": \"https://registry.npmjs.org/esquery/-/esquery-1.0.1.tgz\",\n      \"integrity\": \"sha512-SmiyZ5zIWH9VM+SRUReLS5Q8a7GxtRdxEBVZpm98rJM7Sb+A9DVCndXfkeFUd3byderg+EbDkfnevfCwynWaNA==\",\n      \"dev\": true,\n      \"dependencies\": {\n        \"estraverse\": \"^4.0.0\"\n      },\n      \"engines\": {\n        \"node\": \">=0.6\"\n      }\n    },\n    \"node_modules/esrecurse\": {\n      \"version\": \"4.2.1\",\n      \"resolved\": \"https://registry.npmjs.org/esrecurse/-/esrecurse-4.2.1.tgz\",\n      \"integrity\": \"sha512-64RBB++fIOAXPw3P9cy89qfMlvZEXZkqqJkjqqXIvzP5ezRZjW+lPWjw35UX/3EhUPFYbg5ER4JYgDw4007/DQ==\",\n      \"dev\": true,\n      \"dependencies\": {\n        \"estraverse\": \"^4.1.0\"\n      },\n      \"engines\": {\n        \"node\": \">=4.0\"\n      }\n    },\n    \"node_modules/estraverse\": {\n      \"version\": \"4.2.0\",\n      \"resolved\": \"https://registry.npmjs.org/estraverse/-/estraverse-4.2.0.tgz\",\n      \"integrity\": \"sha1-De4/7TH81GlhjOc0IJn8GvoL2xM=\",\n      \"dev\": true,\n      \"engines\": {\n        \"node\": \">=0.10.0\"\n      }\n    },\n    \"node_modules/esutils\": {\n      \"version\": \"2.0.2\",\n      \"resolved\": \"https://registry.npmjs.org/esutils/-/esutils-2.0.2.tgz\",\n      \"integrity\": \"sha1-Cr9PHKpbyx96nYrMbepPqqBLrJs=\",\n      \"dev\": true,\n      \"engines\": {\n        \"node\": \">=0.10.0\"\n      }\n    },\n    \"node_modules/execa\": {\n      \"version\": \"1.0.0\",\n      \"resolved\": \"https://registry.npmjs.org/execa/-/execa-1.0.0.tgz\",\n      \"integrity\": \"sha512-adbxcyWV46qiHyvSp50TKt05tB4tK3HcmF7/nxfAdhnox83seTDbwnaqKO4sXRy7roHAIFqJP/Rw/AuEbX61LA==\",\n      \"dev\": true,\n      \"dependencies\": {\n        \"cross-spawn\": \"^6.0.0\",\n        \"get-stream\": \"^4.0.0\",\n        \"is-stream\": \"^1.1.0\",\n        \"npm-run-path\": \"^2.0.0\",\n        \"p-finally\": \"^1.0.0\",\n        \"signal-exit\": \"^3.0.0\",\n        \"strip-eof\": \"^1.0.0\"\n      },\n      \"engines\": {\n        \"node\": \">=6\"\n      }\n    },\n    \"node_modules/expand-brackets\": {\n      \"version\": \"2.1.4\",\n      \"resolved\": \"https://registry.npmjs.org/expand-brackets/-/expand-brackets-2.1.4.tgz\",\n      \"integrity\": \"sha1-t3c14xXOMPa27/D4OwQVGiJEliI=\",\n      \"dev\": true,\n      \"dependencies\": {\n        \"debug\": \"^2.3.3\",\n        \"define-property\": \"^0.2.5\",\n        \"extend-shallow\": \"^2.0.1\",\n        \"posix-character-classes\": \"^0.1.0\",\n        \"regex-not\": \"^1.0.0\",\n        \"snapdragon\": \"^0.8.1\",\n        \"to-regex\": \"^3.0.1\"\n      },\n      \"engines\": {\n        \"node\": \">=0.10.0\"\n      }\n    },\n    \"node_modules/expand-brackets/node_modules/debug\": {\n      \"version\": \"2.6.9\",\n      \"resolved\": \"https://registry.npmjs.org/debug/-/debug-2.6.9.tgz\",\n      \"integrity\": \"sha512-bC7ElrdJaJnPbAP+1EotYvqZsb3ecl5wi6Bfi6BJTUcNowp6cvspg0jXznRTKDjm/E7AdgFBVeAPVMNcKGsHMA==\",\n      \"dev\": true,\n      \"dependencies\": {\n        \"ms\": \"2.0.0\"\n      }\n    },\n    \"node_modules/expand-brackets/node_modules/define-property\": {\n      \"version\": \"0.2.5\",\n      \"resolved\": \"https://registry.npmjs.org/define-property/-/define-property-0.2.5.tgz\",\n      \"integrity\": \"sha1-w1se+RjsPJkPmlvFe+BKrOxcgRY=\",\n      \"dev\": true,\n      \"dependencies\": {\n        \"is-descriptor\": \"^0.1.0\"\n      },\n      \"engines\": {\n        \"node\": \">=0.10.0\"\n      }\n    },\n    \"node_modules/expand-brackets/node_modules/extend-shallow\": {\n      \"version\": \"2.0.1\",\n      \"resolved\": \"https://registry.npmjs.org/extend-shallow/-/extend-shallow-2.0.1.tgz\",\n      \"integrity\": \"sha1-Ua99YUrZqfYQ6huvu5idaxxWiQ8=\",\n      \"dev\": true,\n      \"dependencies\": {\n        \"is-extendable\": \"^0.1.0\"\n      },\n      \"engines\": {\n        \"node\": \">=0.10.0\"\n      }\n    },\n    \"node_modules/expand-brackets/node_modules/ms\": {\n      \"version\": \"2.0.0\",\n      \"resolved\": \"https://registry.npmjs.org/ms/-/ms-2.0.0.tgz\",\n      \"integrity\": \"sha1-VgiurfwAvmwpAd9fmGF4jeDVl8g=\",\n      \"dev\": true\n    },\n    \"node_modules/extend-shallow\": {\n      \"version\": \"3.0.2\",\n      \"resolved\": \"https://registry.npmjs.org/extend-shallow/-/extend-shallow-3.0.2.tgz\",\n      \"integrity\": \"sha1-Jqcarwc7OfshJxcnRhMcJwQCjbg=\",\n      \"dev\": true,\n      \"dependencies\": {\n        \"assign-symbols\": \"^1.0.0\",\n        \"is-extendable\": \"^1.0.1\"\n      },\n      \"engines\": {\n        \"node\": \">=0.10.0\"\n      }\n    },\n    \"node_modules/extend-shallow/node_modules/is-extendable\": {\n      \"version\": \"1.0.1\",\n      \"resolved\": \"https://registry.npmjs.org/is-extendable/-/is-extendable-1.0.1.tgz\",\n      \"integrity\": \"sha512-arnXMxT1hhoKo9k1LZdmlNyJdDDfy2v0fXjFlmok4+i8ul/6WlbVge9bhM74OpNPQPMGUToDtz+KXa1PneJxOA==\",\n      \"dev\": true,\n      \"dependencies\": {\n        \"is-plain-object\": \"^2.0.4\"\n      },\n      \"engines\": {\n        \"node\": \">=0.10.0\"\n      }\n    },\n    \"node_modules/external-editor\": {\n      \"version\": \"2.2.0\",\n      \"resolved\": \"https://registry.npmjs.org/external-editor/-/external-editor-2.2.0.tgz\",\n      \"integrity\": \"sha512-bSn6gvGxKt+b7+6TKEv1ZycHleA7aHhRHyAqJyp5pbUFuYYNIzpZnQDk7AsYckyWdEnTeAnay0aCy2aV6iTk9A==\",\n      \"dev\": true,\n      \"dependencies\": {\n        \"chardet\": \"^0.4.0\",\n        \"iconv-lite\": \"^0.4.17\",\n        \"tmp\": \"^0.0.33\"\n      },\n      \"engines\": {\n        \"node\": \">=0.12\"\n      }\n    },\n    \"node_modules/extglob\": {\n      \"version\": \"2.0.4\",\n      \"resolved\": \"https://registry.npmjs.org/extglob/-/extglob-2.0.4.tgz\",\n      \"integrity\": \"sha512-Nmb6QXkELsuBr24CJSkilo6UHHgbekK5UiZgfE6UHD3Eb27YC6oD+bhcT+tJ6cl8dmsgdQxnWlcry8ksBIBLpw==\",\n      \"dev\": true,\n      \"dependencies\": {\n        \"array-unique\": \"^0.3.2\",\n        \"define-property\": \"^1.0.0\",\n        \"expand-brackets\": \"^2.1.4\",\n        \"extend-shallow\": \"^2.0.1\",\n        \"fragment-cache\": \"^0.2.1\",\n        \"regex-not\": \"^1.0.0\",\n        \"snapdragon\": \"^0.8.1\",\n        \"to-regex\": \"^3.0.1\"\n      },\n      \"engines\": {\n        \"node\": \">=0.10.0\"\n      }\n    },\n    \"node_modules/extglob/node_modules/define-property\": {\n      \"version\": \"1.0.0\",\n      \"resolved\": \"https://registry.npmjs.org/define-property/-/define-property-1.0.0.tgz\",\n      \"integrity\": \"sha1-dp66rz9KY6rTr56NMEybvnm/sOY=\",\n      \"dev\": true,\n      \"dependencies\": {\n        \"is-descriptor\": \"^1.0.0\"\n      },\n      \"engines\": {\n        \"node\": \">=0.10.0\"\n      }\n    },\n    \"node_modules/extglob/node_modules/extend-shallow\": {\n      \"version\": \"2.0.1\",\n      \"resolved\": \"https://registry.npmjs.org/extend-shallow/-/extend-shallow-2.0.1.tgz\",\n      \"integrity\": \"sha1-Ua99YUrZqfYQ6huvu5idaxxWiQ8=\",\n      \"dev\": true,\n      \"dependencies\": {\n        \"is-extendable\": \"^0.1.0\"\n      },\n      \"engines\": {\n        \"node\": \">=0.10.0\"\n      }\n    },\n    \"node_modules/extglob/node_modules/is-accessor-descriptor\": {\n      \"version\": \"1.0.0\",\n      \"resolved\": \"https://registry.npmjs.org/is-accessor-descriptor/-/is-accessor-descriptor-1.0.0.tgz\",\n      \"integrity\": \"sha512-m5hnHTkcVsPfqx3AKlyttIPb7J+XykHvJP2B9bZDjlhLIoEq4XoK64Vg7boZlVWYK6LUY94dYPEE7Lh0ZkZKcQ==\",\n      \"deprecated\": \"Please upgrade to v1.0.1\",\n      \"dev\": true,\n      \"dependencies\": {\n        \"kind-of\": \"^6.0.0\"\n      },\n      \"engines\": {\n        \"node\": \">=0.10.0\"\n      }\n    },\n    \"node_modules/extglob/node_modules/is-data-descriptor\": {\n      \"version\": \"1.0.0\",\n      \"resolved\": \"https://registry.npmjs.org/is-data-descriptor/-/is-data-descriptor-1.0.0.tgz\",\n      \"integrity\": \"sha512-jbRXy1FmtAoCjQkVmIVYwuuqDFUbaOeDjmed1tOGPrsMhtJA4rD9tkgA0F1qJ3gRFRXcHYVkdeaP50Q5rE/jLQ==\",\n      \"deprecated\": \"Please upgrade to v1.0.1\",\n      \"dev\": true,\n      \"dependencies\": {\n        \"kind-of\": \"^6.0.0\"\n      },\n      \"engines\": {\n        \"node\": \">=0.10.0\"\n      }\n    },\n    \"node_modules/extglob/node_modules/is-descriptor\": {\n      \"version\": \"1.0.2\",\n      \"resolved\": \"https://registry.npmjs.org/is-descriptor/-/is-descriptor-1.0.2.tgz\",\n      \"integrity\": \"sha512-2eis5WqQGV7peooDyLmNEPUrps9+SXX5c9pL3xEB+4e9HnGuDa7mB7kHxHw4CbqS9k1T2hOH3miL8n8WtiYVtg==\",\n      \"dev\": true,\n      \"dependencies\": {\n        \"is-accessor-descriptor\": \"^1.0.0\",\n        \"is-data-descriptor\": \"^1.0.0\",\n        \"kind-of\": \"^6.0.2\"\n      },\n      \"engines\": {\n        \"node\": \">=0.10.0\"\n      }\n    },\n    \"node_modules/fast-deep-equal\": {\n      \"version\": \"2.0.1\",\n      \"resolved\": \"https://registry.npmjs.org/fast-deep-equal/-/fast-deep-equal-2.0.1.tgz\",\n      \"integrity\": \"sha1-ewUhjd+WZ79/Nwv3/bLLFf3Qqkk=\",\n      \"dev\": true\n    },\n    \"node_modules/fast-json-stable-stringify\": {\n      \"version\": \"2.0.0\",\n      \"resolved\": \"https://registry.npmjs.org/fast-json-stable-stringify/-/fast-json-stable-stringify-2.0.0.tgz\",\n      \"integrity\": \"sha1-1RQsDK7msRifh9OnYREGT4bIu/I=\",\n      \"dev\": true\n    },\n    \"node_modules/fast-levenshtein\": {\n      \"version\": \"2.0.6\",\n      \"resolved\": \"https://registry.npmjs.org/fast-levenshtein/-/fast-levenshtein-2.0.6.tgz\",\n      \"integrity\": \"sha1-PYpcZog6FqMMqGQ+hR8Zuqd5eRc=\",\n      \"dev\": true\n    },\n    \"node_modules/figures\": {\n      \"version\": \"1.7.0\",\n      \"resolved\": \"https://registry.npmjs.org/figures/-/figures-1.7.0.tgz\",\n      \"integrity\": \"sha1-y+Hjr/zxzUS4DK3+0o3Hk6lwHS4=\",\n      \"dev\": true,\n      \"dependencies\": {\n        \"escape-string-regexp\": \"^1.0.5\",\n        \"object-assign\": \"^4.1.0\"\n      },\n      \"engines\": {\n        \"node\": \">=0.10.0\"\n      }\n    },\n    \"node_modules/file-entry-cache\": {\n      \"version\": \"2.0.0\",\n      \"resolved\": \"https://registry.npmjs.org/file-entry-cache/-/file-entry-cache-2.0.0.tgz\",\n      \"integrity\": \"sha1-w5KZDD5oR4PYOLjISkXYoEhFg2E=\",\n      \"dev\": true,\n      \"dependencies\": {\n        \"flat-cache\": \"^1.2.1\",\n        \"object-assign\": \"^4.0.1\"\n      },\n      \"engines\": {\n        \"node\": \">=0.10.0\"\n      }\n    },\n    \"node_modules/fill-range\": {\n      \"version\": \"4.0.0\",\n      \"resolved\": \"https://registry.npmjs.org/fill-range/-/fill-range-4.0.0.tgz\",\n      \"integrity\": \"sha1-1USBHUKPmOsGpj3EAtJAPDKMOPc=\",\n      \"dev\": true,\n      \"dependencies\": {\n        \"extend-shallow\": \"^2.0.1\",\n        \"is-number\": \"^3.0.0\",\n        \"repeat-string\": \"^1.6.1\",\n        \"to-regex-range\": \"^2.1.0\"\n      },\n      \"engines\": {\n        \"node\": \">=0.10.0\"\n      }\n    },\n    \"node_modules/fill-range/node_modules/extend-shallow\": {\n      \"version\": \"2.0.1\",\n      \"resolved\": \"https://registry.npmjs.org/extend-shallow/-/extend-shallow-2.0.1.tgz\",\n      \"integrity\": \"sha1-Ua99YUrZqfYQ6huvu5idaxxWiQ8=\",\n      \"dev\": true,\n      \"dependencies\": {\n        \"is-extendable\": \"^0.1.0\"\n      },\n      \"engines\": {\n        \"node\": \">=0.10.0\"\n      }\n    },\n    \"node_modules/find-parent-dir\": {\n      \"version\": \"0.3.0\",\n      \"resolved\": \"https://registry.npmjs.org/find-parent-dir/-/find-parent-dir-0.3.0.tgz\",\n      \"integrity\": \"sha1-M8RLQpqysvBkYpnF+fcY83b/jVQ=\",\n      \"dev\": true\n    },\n    \"node_modules/find-root\": {\n      \"version\": \"1.1.0\",\n      \"resolved\": \"https://registry.npmjs.org/find-root/-/find-root-1.1.0.tgz\",\n      \"integrity\": \"sha512-NKfW6bec6GfKc0SGx1e07QZY9PE99u0Bft/0rzSD5k3sO/vwkVUpDUKVm5Gpp5Ue3YfShPFTX2070tDs5kB9Ng==\",\n      \"dev\": true\n    },\n    \"node_modules/find-up\": {\n      \"version\": \"3.0.0\",\n      \"resolved\": \"https://registry.npmjs.org/find-up/-/find-up-3.0.0.tgz\",\n      \"integrity\": \"sha512-1yD6RmLI1XBfxugvORwlck6f75tYL+iR0jqwsOrOxMZyGYqUuDhJ0l4AXdO1iX/FTs9cBAMEk1gWSEx1kSbylg==\",\n      \"dev\": true,\n      \"dependencies\": {\n        \"locate-path\": \"^3.0.0\"\n      },\n      \"engines\": {\n        \"node\": \">=6\"\n      }\n    },\n    \"node_modules/flat-cache\": {\n      \"version\": \"1.3.4\",\n      \"resolved\": \"https://registry.npmjs.org/flat-cache/-/flat-cache-1.3.4.tgz\",\n      \"integrity\": \"sha512-VwyB3Lkgacfik2vhqR4uv2rvebqmDvFu4jlN/C1RzWoJEo8I7z4Q404oiqYCkq41mni8EzQnm95emU9seckwtg==\",\n      \"dev\": true,\n      \"dependencies\": {\n        \"circular-json\": \"^0.3.1\",\n        \"graceful-fs\": \"^4.1.2\",\n        \"rimraf\": \"~2.6.2\",\n        \"write\": \"^0.2.1\"\n      },\n      \"engines\": {\n        \"node\": \">=0.10.0\"\n      }\n    },\n    \"node_modules/follow-redirects\": {\n      \"version\": \"1.7.0\",\n      \"resolved\": \"https://registry.npmjs.org/follow-redirects/-/follow-redirects-1.7.0.tgz\",\n      \"integrity\": \"sha512-m/pZQy4Gj287eNy94nivy5wchN3Kp+Q5WgUPNy5lJSZ3sgkVKSYV/ZChMAQVIgx1SqfZ2zBZtPA2YlXIWxxJOQ==\",\n      \"dev\": true,\n      \"dependencies\": {\n        \"debug\": \"^3.2.6\"\n      },\n      \"engines\": {\n        \"node\": \">=4.0\"\n      }\n    },\n    \"node_modules/for-in\": {\n      \"version\": \"1.0.2\",\n      \"resolved\": \"https://registry.npmjs.org/for-in/-/for-in-1.0.2.tgz\",\n      \"integrity\": \"sha1-gQaNKVqBQuwKxybG4iAMMPttXoA=\",\n      \"dev\": true,\n      \"engines\": {\n        \"node\": \">=0.10.0\"\n      }\n    },\n    \"node_modules/fragment-cache\": {\n      \"version\": \"0.2.1\",\n      \"resolved\": \"https://registry.npmjs.org/fragment-cache/-/fragment-cache-0.2.1.tgz\",\n      \"integrity\": \"sha1-QpD60n8T6Jvn8zeZxrxaCr//DRk=\",\n      \"dev\": true,\n      \"dependencies\": {\n        \"map-cache\": \"^0.2.2\"\n      },\n      \"engines\": {\n        \"node\": \">=0.10.0\"\n      }\n    },\n    \"node_modules/fs.realpath\": {\n      \"version\": \"1.0.0\",\n      \"resolved\": \"https://registry.npmjs.org/fs.realpath/-/fs.realpath-1.0.0.tgz\",\n      \"integrity\": \"sha1-FQStJSMVjKpA20onh8sBQRmU6k8=\",\n      \"dev\": true\n    },\n    \"node_modules/function-bind\": {\n      \"version\": \"1.1.1\",\n      \"resolved\": \"https://registry.npmjs.org/function-bind/-/function-bind-1.1.1.tgz\",\n      \"integrity\": \"sha512-yIovAzMX49sF8Yl58fSCWJ5svSLuaibPxXQJFLmBObTuCr0Mf1KiPopGM9NiFjiYBCbfaa2Fh6breQ6ANVTI0A==\",\n      \"dev\": true\n    },\n    \"node_modules/functional-red-black-tree\": {\n      \"version\": \"1.0.1\",\n      \"resolved\": \"https://registry.npmjs.org/functional-red-black-tree/-/functional-red-black-tree-1.0.1.tgz\",\n      \"integrity\": \"sha1-GwqzvVU7Kg1jmdKcDj6gslIHgyc=\",\n      \"dev\": true\n    },\n    \"node_modules/g-status\": {\n      \"version\": \"2.0.2\",\n      \"resolved\": \"https://registry.npmjs.org/g-status/-/g-status-2.0.2.tgz\",\n      \"integrity\": \"sha512-kQoE9qH+T1AHKgSSD0Hkv98bobE90ILQcXAF4wvGgsr7uFqNvwmh8j+Lq3l0RVt3E3HjSbv2B9biEGcEtpHLCA==\",\n      \"dev\": true,\n      \"dependencies\": {\n        \"arrify\": \"^1.0.1\",\n        \"matcher\": \"^1.0.0\",\n        \"simple-git\": \"^1.85.0\"\n      },\n      \"engines\": {\n        \"node\": \">=6\"\n      }\n    },\n    \"node_modules/get-own-enumerable-property-symbols\": {\n      \"version\": \"3.0.0\",\n      \"resolved\": \"https://registry.npmjs.org/get-own-enumerable-property-symbols/-/get-own-enumerable-property-symbols-3.0.0.tgz\",\n      \"integrity\": \"sha512-CIJYJC4GGF06TakLg8z4GQKvDsx9EMspVxOYih7LerEL/WosUnFIww45CGfxfeKHqlg3twgUrYRT1O3WQqjGCg==\",\n      \"dev\": true\n    },\n    \"node_modules/get-stdin\": {\n      \"version\": \"6.0.0\",\n      \"resolved\": \"https://registry.npmjs.org/get-stdin/-/get-stdin-6.0.0.tgz\",\n      \"integrity\": \"sha512-jp4tHawyV7+fkkSKyvjuLZswblUtz+SQKzSWnBbii16BuZksJlU1wuBYXY75r+duh/llF1ur6oNwi+2ZzjKZ7g==\",\n      \"dev\": true,\n      \"engines\": {\n        \"node\": \">=4\"\n      }\n    },\n    \"node_modules/get-stream\": {\n      \"version\": \"4.1.0\",\n      \"resolved\": \"https://registry.npmjs.org/get-stream/-/get-stream-4.1.0.tgz\",\n      \"integrity\": \"sha512-GMat4EJ5161kIy2HevLlr4luNjBgvmj413KaQA7jt4V8B4RDsfpHk7WQ9GVqfYyyx8OS/L66Kox+rJRNklLK7w==\",\n      \"dev\": true,\n      \"dependencies\": {\n        \"pump\": \"^3.0.0\"\n      },\n      \"engines\": {\n        \"node\": \">=6\"\n      }\n    },\n    \"node_modules/get-value\": {\n      \"version\": \"2.0.6\",\n      \"resolved\": \"https://registry.npmjs.org/get-value/-/get-value-2.0.6.tgz\",\n      \"integrity\": \"sha1-3BXKHGcjh8p2vTesCjlbogQqLCg=\",\n      \"dev\": true,\n      \"engines\": {\n        \"node\": \">=0.10.0\"\n      }\n    },\n    \"node_modules/glob\": {\n      \"version\": \"7.1.4\",\n      \"resolved\": \"https://registry.npmjs.org/glob/-/glob-7.1.4.tgz\",\n      \"integrity\": \"sha512-hkLPepehmnKk41pUGm3sYxoFs/umurYfYJCerbXEyFIWcAzvpipAgVkBqqT9RBKMGjnq6kMuyYwha6csxbiM1A==\",\n      \"dev\": true,\n      \"dependencies\": {\n        \"fs.realpath\": \"^1.0.0\",\n        \"inflight\": \"^1.0.4\",\n        \"inherits\": \"2\",\n        \"minimatch\": \"^3.0.4\",\n        \"once\": \"^1.3.0\",\n        \"path-is-absolute\": \"^1.0.0\"\n      },\n      \"engines\": {\n        \"node\": \"*\"\n      }\n    },\n    \"node_modules/globals\": {\n      \"version\": \"11.12.0\",\n      \"resolved\": \"https://registry.npmjs.org/globals/-/globals-11.12.0.tgz\",\n      \"integrity\": \"sha512-WOBp/EEGUiIsJSp7wcv/y6MO+lV9UoncWqxuFfm8eBwzWNgyfBd6Gz+IeKQ9jCmyhoH99g15M3T+QaVHFjizVA==\",\n      \"dev\": true,\n      \"engines\": {\n        \"node\": \">=4\"\n      }\n    },\n    \"node_modules/globby\": {\n      \"version\": \"6.1.0\",\n      \"resolved\": \"https://registry.npmjs.org/globby/-/globby-6.1.0.tgz\",\n      \"integrity\": \"sha1-9abXDoOV4hyFj7BInWTfAkJNUGw=\",\n      \"dev\": true,\n      \"dependencies\": {\n        \"array-union\": \"^1.0.1\",\n        \"glob\": \"^7.0.3\",\n        \"object-assign\": \"^4.0.1\",\n        \"pify\": \"^2.0.0\",\n        \"pinkie-promise\": \"^2.0.0\"\n      },\n      \"engines\": {\n        \"node\": \">=0.10.0\"\n      }\n    },\n    \"node_modules/globby/node_modules/pify\": {\n      \"version\": \"2.3.0\",\n      \"resolved\": \"https://registry.npmjs.org/pify/-/pify-2.3.0.tgz\",\n      \"integrity\": \"sha1-7RQaasBDqEnqWISY59yosVMw6Qw=\",\n      \"dev\": true,\n      \"engines\": {\n        \"node\": \">=0.10.0\"\n      }\n    },\n    \"node_modules/graceful-fs\": {\n      \"version\": \"4.1.15\",\n      \"resolved\": \"https://registry.npmjs.org/graceful-fs/-/graceful-fs-4.1.15.tgz\",\n      \"integrity\": \"sha512-6uHUhOPEBgQ24HM+r6b/QwWfZq+yiFcipKFrOFiBEnWdy5sdzYoi+pJeQaPI5qOLRFqWmAXUPQNsielzdLoecA==\",\n      \"dev\": true\n    },\n    \"node_modules/has\": {\n      \"version\": \"1.0.3\",\n      \"resolved\": \"https://registry.npmjs.org/has/-/has-1.0.3.tgz\",\n      \"integrity\": \"sha512-f2dvO0VU6Oej7RkWJGrehjbzMAjFp5/VKPp5tTpWIV4JHHZK1/BxbFRtf/siA2SWTe09caDmVtYYzWEIbBS4zw==\",\n      \"dev\": true,\n      \"dependencies\": {\n        \"function-bind\": \"^1.1.1\"\n      },\n      \"engines\": {\n        \"node\": \">= 0.4.0\"\n      }\n    },\n    \"node_modules/has-ansi\": {\n      \"version\": \"2.0.0\",\n      \"resolved\": \"https://registry.npmjs.org/has-ansi/-/has-ansi-2.0.0.tgz\",\n      \"integrity\": \"sha1-NPUEnOHs3ysGSa8+8k5F7TVBbZE=\",\n      \"dev\": true,\n      \"dependencies\": {\n        \"ansi-regex\": \"^2.0.0\"\n      },\n      \"engines\": {\n        \"node\": \">=0.10.0\"\n      }\n    },\n    \"node_modules/has-flag\": {\n      \"version\": \"3.0.0\",\n      \"resolved\": \"https://registry.npmjs.org/has-flag/-/has-flag-3.0.0.tgz\",\n      \"integrity\": \"sha1-tdRU3CGZriJWmfNGfloH87lVuv0=\",\n      \"dev\": true,\n      \"engines\": {\n        \"node\": \">=4\"\n      }\n    },\n    \"node_modules/has-symbols\": {\n      \"version\": \"1.0.0\",\n      \"resolved\": \"https://registry.npmjs.org/has-symbols/-/has-symbols-1.0.0.tgz\",\n      \"integrity\": \"sha1-uhqPGvKg/DllD1yFA2dwQSIGO0Q=\",\n      \"dev\": true,\n      \"engines\": {\n        \"node\": \">= 0.4\"\n      }\n    },\n    \"node_modules/has-value\": {\n      \"version\": \"1.0.0\",\n      \"resolved\": \"https://registry.npmjs.org/has-value/-/has-value-1.0.0.tgz\",\n      \"integrity\": \"sha1-GLKB2lhbHFxR3vJMkw7SmgvmsXc=\",\n      \"dev\": true,\n      \"dependencies\": {\n        \"get-value\": \"^2.0.6\",\n        \"has-values\": \"^1.0.0\",\n        \"isobject\": \"^3.0.0\"\n      },\n      \"engines\": {\n        \"node\": \">=0.10.0\"\n      }\n    },\n    \"node_modules/has-values\": {\n      \"version\": \"1.0.0\",\n      \"resolved\": \"https://registry.npmjs.org/has-values/-/has-values-1.0.0.tgz\",\n      \"integrity\": \"sha1-lbC2P+whRmGab+V/51Yo1aOe/k8=\",\n      \"dev\": true,\n      \"dependencies\": {\n        \"is-number\": \"^3.0.0\",\n        \"kind-of\": \"^4.0.0\"\n      },\n      \"engines\": {\n        \"node\": \">=0.10.0\"\n      }\n    },\n    \"node_modules/has-values/node_modules/kind-of\": {\n      \"version\": \"4.0.0\",\n      \"resolved\": \"https://registry.npmjs.org/kind-of/-/kind-of-4.0.0.tgz\",\n      \"integrity\": \"sha1-IIE989cSkosgc3hpGkUGb65y3Vc=\",\n      \"dev\": true,\n      \"dependencies\": {\n        \"is-buffer\": \"^1.1.5\"\n      },\n      \"engines\": {\n        \"node\": \">=0.10.0\"\n      }\n    },\n    \"node_modules/he\": {\n      \"version\": \"1.2.0\",\n      \"resolved\": \"https://registry.npmjs.org/he/-/he-1.2.0.tgz\",\n      \"integrity\": \"sha512-F/1DnUGPopORZi0ni+CvrCgHQ5FyEAHRLSApuYWMmrbSwoN2Mn/7k+Gl38gJnR7yyDZk6WLXwiGod1JOWNDKGw==\",\n      \"dev\": true,\n      \"bin\": {\n        \"he\": \"bin/he\"\n      }\n    },\n    \"node_modules/hosted-git-info\": {\n      \"version\": \"2.8.9\",\n      \"resolved\": \"https://registry.npmjs.org/hosted-git-info/-/hosted-git-info-2.8.9.tgz\",\n      \"integrity\": \"sha512-mxIDAb9Lsm6DoOJ7xH+5+X4y1LU/4Hi50L9C5sIswK3JzULS4bwk1FvjdBgvYR4bzT4tuUQiC15FE2f5HbLvYw==\",\n      \"dev\": true\n    },\n    \"node_modules/http-proxy\": {\n      \"version\": \"1.18.1\",\n      \"resolved\": \"https://registry.npmjs.org/http-proxy/-/http-proxy-1.18.1.tgz\",\n      \"integrity\": \"sha512-7mz/721AbnJwIVbnaSv1Cz3Am0ZLT/UBwkC92VlxhXv/k/BBQfM2fXElQNC27BVGr0uwUpplYPQM9LnaBMR5NQ==\",\n      \"dev\": true,\n      \"dependencies\": {\n        \"eventemitter3\": \"^4.0.0\",\n        \"follow-redirects\": \"^1.0.0\",\n        \"requires-port\": \"^1.0.0\"\n      },\n      \"engines\": {\n        \"node\": \">=8.0.0\"\n      }\n    },\n    \"node_modules/http-proxy/node_modules/eventemitter3\": {\n      \"version\": \"4.0.7\",\n      \"resolved\": \"https://registry.npmjs.org/eventemitter3/-/eventemitter3-4.0.7.tgz\",\n      \"integrity\": \"sha512-8guHBZCwKnFhYdHr2ysuRWErTwhoN2X8XELRlrRwpmfeY2jjuUN4taQMsULKUVo1K4DvZl+0pgfyoysHxvmvEw==\",\n      \"dev\": true\n    },\n    \"node_modules/http-server\": {\n      \"version\": \"0.11.1\",\n      \"resolved\": \"https://registry.npmjs.org/http-server/-/http-server-0.11.1.tgz\",\n      \"integrity\": \"sha512-6JeGDGoujJLmhjiRGlt8yK8Z9Kl0vnl/dQoQZlc4oeqaUoAKQg94NILLfrY3oWzSyFaQCVNTcKE5PZ3cH8VP9w==\",\n      \"dev\": true,\n      \"dependencies\": {\n        \"colors\": \"1.0.3\",\n        \"corser\": \"~2.0.0\",\n        \"ecstatic\": \"^3.0.0\",\n        \"http-proxy\": \"^1.8.1\",\n        \"opener\": \"~1.4.0\",\n        \"optimist\": \"0.6.x\",\n        \"portfinder\": \"^1.0.13\",\n        \"union\": \"~0.4.3\"\n      },\n      \"bin\": {\n        \"hs\": \"bin/http-server\",\n        \"http-server\": \"bin/http-server\"\n      }\n    },\n    \"node_modules/husky\": {\n      \"version\": \"1.2.0\",\n      \"resolved\": \"https://registry.npmjs.org/husky/-/husky-1.2.0.tgz\",\n      \"integrity\": \"sha512-/ib3+iycykXC0tYIxsyqierikVa9DA2DrT32UEirqNEFVqOj1bFMTgP3jAz8HM7FgC/C8pc/BTUa9MV2GEkZaA==\",\n      \"dev\": true,\n      \"hasInstallScript\": true,\n      \"dependencies\": {\n        \"cosmiconfig\": \"^5.0.6\",\n        \"execa\": \"^1.0.0\",\n        \"find-up\": \"^3.0.0\",\n        \"get-stdin\": \"^6.0.0\",\n        \"is-ci\": \"^1.2.1\",\n        \"pkg-dir\": \"^3.0.0\",\n        \"please-upgrade-node\": \"^3.1.1\",\n        \"read-pkg\": \"^4.0.1\",\n        \"run-node\": \"^1.0.0\",\n        \"slash\": \"^2.0.0\"\n      },\n      \"bin\": {\n        \"husky-upgrade\": \"lib/upgrader/bin.js\"\n      },\n      \"engines\": {\n        \"node\": \">=6\"\n      }\n    },\n    \"node_modules/iconv-lite\": {\n      \"version\": \"0.4.24\",\n      \"resolved\": \"https://registry.npmjs.org/iconv-lite/-/iconv-lite-0.4.24.tgz\",\n      \"integrity\": \"sha512-v3MXnZAcvnywkTUEZomIActle7RXXeedOR31wwl7VlyoXO4Qi9arvSenNQWne1TcRwhCL1HwLI21bEqdpj8/rA==\",\n      \"dev\": true,\n      \"dependencies\": {\n        \"safer-buffer\": \">= 2.1.2 < 3\"\n      },\n      \"engines\": {\n        \"node\": \">=0.10.0\"\n      }\n    },\n    \"node_modules/ignore\": {\n      \"version\": \"4.0.6\",\n      \"resolved\": \"https://registry.npmjs.org/ignore/-/ignore-4.0.6.tgz\",\n      \"integrity\": \"sha512-cyFDKrqc/YdcWFniJhzI42+AzS+gNwmUzOSFcRCQYwySuBBBy/KjuxWLZ/FHEH6Moq1NizMOBWyTcv8O4OZIMg==\",\n      \"dev\": true,\n      \"engines\": {\n        \"node\": \">= 4\"\n      }\n    },\n    \"node_modules/import-fresh\": {\n      \"version\": \"2.0.0\",\n      \"resolved\": \"https://registry.npmjs.org/import-fresh/-/import-fresh-2.0.0.tgz\",\n      \"integrity\": \"sha1-2BNVwVYS04bGH53dOSLUMEgipUY=\",\n      \"dev\": true,\n      \"dependencies\": {\n        \"caller-path\": \"^2.0.0\",\n        \"resolve-from\": \"^3.0.0\"\n      },\n      \"engines\": {\n        \"node\": \">=4\"\n      }\n    },\n    \"node_modules/imurmurhash\": {\n      \"version\": \"0.1.4\",\n      \"resolved\": \"https://registry.npmjs.org/imurmurhash/-/imurmurhash-0.1.4.tgz\",\n      \"integrity\": \"sha1-khi5srkoojixPcT7a21XbyMUU+o=\",\n      \"dev\": true,\n      \"engines\": {\n        \"node\": \">=0.8.19\"\n      }\n    },\n    \"node_modules/indent-string\": {\n      \"version\": \"3.2.0\",\n      \"resolved\": \"https://registry.npmjs.org/indent-string/-/indent-string-3.2.0.tgz\",\n      \"integrity\": \"sha1-Sl/W0nzDMvN+VBmlBNu4NxBckok=\",\n      \"dev\": true,\n      \"engines\": {\n        \"node\": \">=4\"\n      }\n    },\n    \"node_modules/inflight\": {\n      \"version\": \"1.0.6\",\n      \"resolved\": \"https://registry.npmjs.org/inflight/-/inflight-1.0.6.tgz\",\n      \"integrity\": \"sha1-Sb1jMdfQLQwJvJEKEHW6gWW1bfk=\",\n      \"dev\": true,\n      \"dependencies\": {\n        \"once\": \"^1.3.0\",\n        \"wrappy\": \"1\"\n      }\n    },\n    \"node_modules/inherits\": {\n      \"version\": \"2.0.3\",\n      \"resolved\": \"https://registry.npmjs.org/inherits/-/inherits-2.0.3.tgz\",\n      \"integrity\": \"sha1-Yzwsg+PaQqUC9SRmAiSA9CCCYd4=\",\n      \"dev\": true\n    },\n    \"node_modules/inquirer\": {\n      \"version\": \"5.2.0\",\n      \"resolved\": \"https://registry.npmjs.org/inquirer/-/inquirer-5.2.0.tgz\",\n      \"integrity\": \"sha512-E9BmnJbAKLPGonz0HeWHtbKf+EeSP93paWO3ZYoUpq/aowXvYGjjCSuashhXPpzbArIjBbji39THkxTz9ZeEUQ==\",\n      \"dev\": true,\n      \"dependencies\": {\n        \"ansi-escapes\": \"^3.0.0\",\n        \"chalk\": \"^2.0.0\",\n        \"cli-cursor\": \"^2.1.0\",\n        \"cli-width\": \"^2.0.0\",\n        \"external-editor\": \"^2.1.0\",\n        \"figures\": \"^2.0.0\",\n        \"lodash\": \"^4.3.0\",\n        \"mute-stream\": \"0.0.7\",\n        \"run-async\": \"^2.2.0\",\n        \"rxjs\": \"^5.5.2\",\n        \"string-width\": \"^2.1.0\",\n        \"strip-ansi\": \"^4.0.0\",\n        \"through\": \"^2.3.6\"\n      },\n      \"engines\": {\n        \"node\": \">=6.0.0\"\n      }\n    },\n    \"node_modules/inquirer/node_modules/ansi-regex\": {\n      \"version\": \"3.0.0\",\n      \"resolved\": \"https://registry.npmjs.org/ansi-regex/-/ansi-regex-3.0.0.tgz\",\n      \"integrity\": \"sha1-7QMXwyIGT3lGbAKWa922Bas32Zg=\",\n      \"dev\": true,\n      \"engines\": {\n        \"node\": \">=4\"\n      }\n    },\n    \"node_modules/inquirer/node_modules/figures\": {\n      \"version\": \"2.0.0\",\n      \"resolved\": \"https://registry.npmjs.org/figures/-/figures-2.0.0.tgz\",\n      \"integrity\": \"sha1-OrGi0qYsi/tDGgyUy3l6L84nyWI=\",\n      \"dev\": true,\n      \"dependencies\": {\n        \"escape-string-regexp\": \"^1.0.5\"\n      },\n      \"engines\": {\n        \"node\": \">=4\"\n      }\n    },\n    \"node_modules/inquirer/node_modules/is-fullwidth-code-point\": {\n      \"version\": \"2.0.0\",\n      \"resolved\": \"https://registry.npmjs.org/is-fullwidth-code-point/-/is-fullwidth-code-point-2.0.0.tgz\",\n      \"integrity\": \"sha1-o7MKXE8ZkYMWeqq5O+764937ZU8=\",\n      \"dev\": true,\n      \"engines\": {\n        \"node\": \">=4\"\n      }\n    },\n    \"node_modules/inquirer/node_modules/rxjs\": {\n      \"version\": \"5.5.12\",\n      \"resolved\": \"https://registry.npmjs.org/rxjs/-/rxjs-5.5.12.tgz\",\n      \"integrity\": \"sha512-xx2itnL5sBbqeeiVgNPVuQQ1nC8Jp2WfNJhXWHmElW9YmrpS9UVnNzhP3EH3HFqexO5Tlp8GhYY+WEcqcVMvGw==\",\n      \"dev\": true,\n      \"dependencies\": {\n        \"symbol-observable\": \"1.0.1\"\n      },\n      \"engines\": {\n        \"npm\": \">=2.0.0\"\n      }\n    },\n    \"node_modules/inquirer/node_modules/string-width\": {\n      \"version\": \"2.1.1\",\n      \"resolved\": \"https://registry.npmjs.org/string-width/-/string-width-2.1.1.tgz\",\n      \"integrity\": \"sha512-nOqH59deCq9SRHlxq1Aw85Jnt4w6KvLKqWVik6oA9ZklXLNIOlqg4F2yrT1MVaTjAqvVwdfeZ7w7aCvJD7ugkw==\",\n      \"dev\": true,\n      \"dependencies\": {\n        \"is-fullwidth-code-point\": \"^2.0.0\",\n        \"strip-ansi\": \"^4.0.0\"\n      },\n      \"engines\": {\n        \"node\": \">=4\"\n      }\n    },\n    \"node_modules/inquirer/node_modules/strip-ansi\": {\n      \"version\": \"4.0.0\",\n      \"resolved\": \"https://registry.npmjs.org/strip-ansi/-/strip-ansi-4.0.0.tgz\",\n      \"integrity\": \"sha1-qEeQIusaw2iocTibY1JixQXuNo8=\",\n      \"dev\": true,\n      \"dependencies\": {\n        \"ansi-regex\": \"^3.0.0\"\n      },\n      \"engines\": {\n        \"node\": \">=4\"\n      }\n    },\n    \"node_modules/inquirer/node_modules/symbol-observable\": {\n      \"version\": \"1.0.1\",\n      \"resolved\": \"https://registry.npmjs.org/symbol-observable/-/symbol-observable-1.0.1.tgz\",\n      \"integrity\": \"sha1-g0D8RwLDEi310iKI+IKD9RPT/dQ=\",\n      \"dev\": true,\n      \"engines\": {\n        \"node\": \">=0.10.0\"\n      }\n    },\n    \"node_modules/is-accessor-descriptor\": {\n      \"version\": \"0.1.6\",\n      \"resolved\": \"https://registry.npmjs.org/is-accessor-descriptor/-/is-accessor-descriptor-0.1.6.tgz\",\n      \"integrity\": \"sha1-qeEss66Nh2cn7u84Q/igiXtcmNY=\",\n      \"deprecated\": \"Please upgrade to v0.1.7\",\n      \"dev\": true,\n      \"dependencies\": {\n        \"kind-of\": \"^3.0.2\"\n      },\n      \"engines\": {\n        \"node\": \">=0.10.0\"\n      }\n    },\n    \"node_modules/is-accessor-descriptor/node_modules/kind-of\": {\n      \"version\": \"3.2.2\",\n      \"resolved\": \"https://registry.npmjs.org/kind-of/-/kind-of-3.2.2.tgz\",\n      \"integrity\": \"sha1-MeohpzS6ubuw8yRm2JOupR5KPGQ=\",\n      \"dev\": true,\n      \"dependencies\": {\n        \"is-buffer\": \"^1.1.5\"\n      },\n      \"engines\": {\n        \"node\": \">=0.10.0\"\n      }\n    },\n    \"node_modules/is-arrayish\": {\n      \"version\": \"0.2.1\",\n      \"resolved\": \"https://registry.npmjs.org/is-arrayish/-/is-arrayish-0.2.1.tgz\",\n      \"integrity\": \"sha1-d8mYQFJ6qOyxqLppe4BkWnqSap0=\",\n      \"dev\": true\n    },\n    \"node_modules/is-buffer\": {\n      \"version\": \"1.1.6\",\n      \"resolved\": \"https://registry.npmjs.org/is-buffer/-/is-buffer-1.1.6.tgz\",\n      \"integrity\": \"sha512-NcdALwpXkTm5Zvvbk7owOUSvVvBKDgKP5/ewfXEznmQFfs4ZRmanOeKBTjRVjka3QFoN6XJ+9F3USqfHqTaU5w==\",\n      \"dev\": true\n    },\n    \"node_modules/is-callable\": {\n      \"version\": \"1.1.4\",\n      \"resolved\": \"https://registry.npmjs.org/is-callable/-/is-callable-1.1.4.tgz\",\n      \"integrity\": \"sha512-r5p9sxJjYnArLjObpjA4xu5EKI3CuKHkJXMhT7kwbpUyIFD1n5PMAsoPvWnvtZiNz7LjkYDRZhd7FlI0eMijEA==\",\n      \"dev\": true,\n      \"engines\": {\n        \"node\": \">= 0.4\"\n      }\n    },\n    \"node_modules/is-ci\": {\n      \"version\": \"1.2.1\",\n      \"resolved\": \"https://registry.npmjs.org/is-ci/-/is-ci-1.2.1.tgz\",\n      \"integrity\": \"sha512-s6tfsaQaQi3JNciBH6shVqEDvhGut0SUXr31ag8Pd8BBbVVlcGfWhpPmEOoM6RJ5TFhbypvf5yyRw/VXW1IiWg==\",\n      \"dev\": true,\n      \"dependencies\": {\n        \"ci-info\": \"^1.5.0\"\n      },\n      \"bin\": {\n        \"is-ci\": \"bin.js\"\n      }\n    },\n    \"node_modules/is-data-descriptor\": {\n      \"version\": \"0.1.4\",\n      \"resolved\": \"https://registry.npmjs.org/is-data-descriptor/-/is-data-descriptor-0.1.4.tgz\",\n      \"integrity\": \"sha1-C17mSDiOLIYCgueT8YVv7D8wG1Y=\",\n      \"deprecated\": \"Please upgrade to v0.1.5\",\n      \"dev\": true,\n      \"dependencies\": {\n        \"kind-of\": \"^3.0.2\"\n      },\n      \"engines\": {\n        \"node\": \">=0.10.0\"\n      }\n    },\n    \"node_modules/is-data-descriptor/node_modules/kind-of\": {\n      \"version\": \"3.2.2\",\n      \"resolved\": \"https://registry.npmjs.org/kind-of/-/kind-of-3.2.2.tgz\",\n      \"integrity\": \"sha1-MeohpzS6ubuw8yRm2JOupR5KPGQ=\",\n      \"dev\": true,\n      \"dependencies\": {\n        \"is-buffer\": \"^1.1.5\"\n      },\n      \"engines\": {\n        \"node\": \">=0.10.0\"\n      }\n    },\n    \"node_modules/is-date-object\": {\n      \"version\": \"1.0.1\",\n      \"resolved\": \"https://registry.npmjs.org/is-date-object/-/is-date-object-1.0.1.tgz\",\n      \"integrity\": \"sha1-mqIOtq7rv/d/vTPnTKAbM1gdOhY=\",\n      \"dev\": true,\n      \"engines\": {\n        \"node\": \">= 0.4\"\n      }\n    },\n    \"node_modules/is-descriptor\": {\n      \"version\": \"0.1.6\",\n      \"resolved\": \"https://registry.npmjs.org/is-descriptor/-/is-descriptor-0.1.6.tgz\",\n      \"integrity\": \"sha512-avDYr0SB3DwO9zsMov0gKCESFYqCnE4hq/4z3TdUlukEy5t9C0YRq7HLrsN52NAcqXKaepeCD0n+B0arnVG3Hg==\",\n      \"dev\": true,\n      \"dependencies\": {\n        \"is-accessor-descriptor\": \"^0.1.6\",\n        \"is-data-descriptor\": \"^0.1.4\",\n        \"kind-of\": \"^5.0.0\"\n      },\n      \"engines\": {\n        \"node\": \">=0.10.0\"\n      }\n    },\n    \"node_modules/is-descriptor/node_modules/kind-of\": {\n      \"version\": \"5.1.0\",\n      \"resolved\": \"https://registry.npmjs.org/kind-of/-/kind-of-5.1.0.tgz\",\n      \"integrity\": \"sha512-NGEErnH6F2vUuXDh+OlbcKW7/wOcfdRHaZ7VWtqCztfHri/++YKmP51OdWeGPuqCOba6kk2OTe5d02VmTB80Pw==\",\n      \"dev\": true,\n      \"engines\": {\n        \"node\": \">=0.10.0\"\n      }\n    },\n    \"node_modules/is-directory\": {\n      \"version\": \"0.3.1\",\n      \"resolved\": \"https://registry.npmjs.org/is-directory/-/is-directory-0.3.1.tgz\",\n      \"integrity\": \"sha1-YTObbyR1/Hcv2cnYP1yFddwVSuE=\",\n      \"dev\": true,\n      \"engines\": {\n        \"node\": \">=0.10.0\"\n      }\n    },\n    \"node_modules/is-extendable\": {\n      \"version\": \"0.1.1\",\n      \"resolved\": \"https://registry.npmjs.org/is-extendable/-/is-extendable-0.1.1.tgz\",\n      \"integrity\": \"sha1-YrEQ4omkcUGOPsNqYX1HLjAd/Ik=\",\n      \"dev\": true,\n      \"engines\": {\n        \"node\": \">=0.10.0\"\n      }\n    },\n    \"node_modules/is-extglob\": {\n      \"version\": \"2.1.1\",\n      \"resolved\": \"https://registry.npmjs.org/is-extglob/-/is-extglob-2.1.1.tgz\",\n      \"integrity\": \"sha1-qIwCU1eR8C7TfHahueqXc8gz+MI=\",\n      \"dev\": true,\n      \"engines\": {\n        \"node\": \">=0.10.0\"\n      }\n    },\n    \"node_modules/is-fullwidth-code-point\": {\n      \"version\": \"1.0.0\",\n      \"resolved\": \"https://registry.npmjs.org/is-fullwidth-code-point/-/is-fullwidth-code-point-1.0.0.tgz\",\n      \"integrity\": \"sha1-754xOG8DGn8NZDr4L95QxFfvAMs=\",\n      \"dev\": true,\n      \"dependencies\": {\n        \"number-is-nan\": \"^1.0.0\"\n      },\n      \"engines\": {\n        \"node\": \">=0.10.0\"\n      }\n    },\n    \"node_modules/is-glob\": {\n      \"version\": \"4.0.1\",\n      \"resolved\": \"https://registry.npmjs.org/is-glob/-/is-glob-4.0.1.tgz\",\n      \"integrity\": \"sha512-5G0tKtBTFImOqDnLB2hG6Bp2qcKEFduo4tZu9MT/H6NQv/ghhy30o55ufafxJ/LdH79LLs2Kfrn85TLKyA7BUg==\",\n      \"dev\": true,\n      \"dependencies\": {\n        \"is-extglob\": \"^2.1.1\"\n      },\n      \"engines\": {\n        \"node\": \">=0.10.0\"\n      }\n    },\n    \"node_modules/is-number\": {\n      \"version\": \"3.0.0\",\n      \"resolved\": \"https://registry.npmjs.org/is-number/-/is-number-3.0.0.tgz\",\n      \"integrity\": \"sha1-JP1iAaR4LPUFYcgQJ2r8fRLXEZU=\",\n      \"dev\": true,\n      \"dependencies\": {\n        \"kind-of\": \"^3.0.2\"\n      },\n      \"engines\": {\n        \"node\": \">=0.10.0\"\n      }\n    },\n    \"node_modules/is-number/node_modules/kind-of\": {\n      \"version\": \"3.2.2\",\n      \"resolved\": \"https://registry.npmjs.org/kind-of/-/kind-of-3.2.2.tgz\",\n      \"integrity\": \"sha1-MeohpzS6ubuw8yRm2JOupR5KPGQ=\",\n      \"dev\": true,\n      \"dependencies\": {\n        \"is-buffer\": \"^1.1.5\"\n      },\n      \"engines\": {\n        \"node\": \">=0.10.0\"\n      }\n    },\n    \"node_modules/is-obj\": {\n      \"version\": \"1.0.1\",\n      \"resolved\": \"https://registry.npmjs.org/is-obj/-/is-obj-1.0.1.tgz\",\n      \"integrity\": \"sha1-PkcprB9f3gJc19g6iW2rn09n2w8=\",\n      \"dev\": true,\n      \"engines\": {\n        \"node\": \">=0.10.0\"\n      }\n    },\n    \"node_modules/is-observable\": {\n      \"version\": \"1.1.0\",\n      \"resolved\": \"https://registry.npmjs.org/is-observable/-/is-observable-1.1.0.tgz\",\n      \"integrity\": \"sha512-NqCa4Sa2d+u7BWc6CukaObG3Fh+CU9bvixbpcXYhy2VvYS7vVGIdAgnIS5Ks3A/cqk4rebLJ9s8zBstT2aKnIA==\",\n      \"dev\": true,\n      \"dependencies\": {\n        \"symbol-observable\": \"^1.1.0\"\n      },\n      \"engines\": {\n        \"node\": \">=4\"\n      }\n    },\n    \"node_modules/is-path-cwd\": {\n      \"version\": \"1.0.0\",\n      \"resolved\": \"https://registry.npmjs.org/is-path-cwd/-/is-path-cwd-1.0.0.tgz\",\n      \"integrity\": \"sha1-0iXsIxMuie3Tj9p2dHLmLmXxEG0=\",\n      \"dev\": true,\n      \"engines\": {\n        \"node\": \">=0.10.0\"\n      }\n    },\n    \"node_modules/is-path-in-cwd\": {\n      \"version\": \"1.0.1\",\n      \"resolved\": \"https://registry.npmjs.org/is-path-in-cwd/-/is-path-in-cwd-1.0.1.tgz\",\n      \"integrity\": \"sha512-FjV1RTW48E7CWM7eE/J2NJvAEEVektecDBVBE5Hh3nM1Jd0kvhHtX68Pr3xsDf857xt3Y4AkwVULK1Vku62aaQ==\",\n      \"dev\": true,\n      \"dependencies\": {\n        \"is-path-inside\": \"^1.0.0\"\n      },\n      \"engines\": {\n        \"node\": \">=0.10.0\"\n      }\n    },\n    \"node_modules/is-path-inside\": {\n      \"version\": \"1.0.1\",\n      \"resolved\": \"https://registry.npmjs.org/is-path-inside/-/is-path-inside-1.0.1.tgz\",\n      \"integrity\": \"sha1-jvW33lBDej/cprToZe96pVy0gDY=\",\n      \"dev\": true,\n      \"dependencies\": {\n        \"path-is-inside\": \"^1.0.1\"\n      },\n      \"engines\": {\n        \"node\": \">=0.10.0\"\n      }\n    },\n    \"node_modules/is-plain-object\": {\n      \"version\": \"2.0.4\",\n      \"resolved\": \"https://registry.npmjs.org/is-plain-object/-/is-plain-object-2.0.4.tgz\",\n      \"integrity\": \"sha512-h5PpgXkWitc38BBMYawTYMWJHFZJVnBquFE57xFpjB8pJFiF6gZ+bU+WyI/yqXiFR5mdLsgYNaPe8uao6Uv9Og==\",\n      \"dev\": true,\n      \"dependencies\": {\n        \"isobject\": \"^3.0.1\"\n      },\n      \"engines\": {\n        \"node\": \">=0.10.0\"\n      }\n    },\n    \"node_modules/is-promise\": {\n      \"version\": \"2.1.0\",\n      \"resolved\": \"https://registry.npmjs.org/is-promise/-/is-promise-2.1.0.tgz\",\n      \"integrity\": \"sha1-eaKp7OfwlugPNtKy87wWwf9L8/o=\",\n      \"dev\": true\n    },\n    \"node_modules/is-regex\": {\n      \"version\": \"1.0.4\",\n      \"resolved\": \"https://registry.npmjs.org/is-regex/-/is-regex-1.0.4.tgz\",\n      \"integrity\": \"sha1-VRdIm1RwkbCTDglWVM7SXul+lJE=\",\n      \"dev\": true,\n      \"dependencies\": {\n        \"has\": \"^1.0.1\"\n      },\n      \"engines\": {\n        \"node\": \">= 0.4\"\n      }\n    },\n    \"node_modules/is-regexp\": {\n      \"version\": \"1.0.0\",\n      \"resolved\": \"https://registry.npmjs.org/is-regexp/-/is-regexp-1.0.0.tgz\",\n      \"integrity\": \"sha1-/S2INUXEa6xaYz57mgnof6LLUGk=\",\n      \"dev\": true,\n      \"engines\": {\n        \"node\": \">=0.10.0\"\n      }\n    },\n    \"node_modules/is-resolvable\": {\n      \"version\": \"1.1.0\",\n      \"resolved\": \"https://registry.npmjs.org/is-resolvable/-/is-resolvable-1.1.0.tgz\",\n      \"integrity\": \"sha512-qgDYXFSR5WvEfuS5dMj6oTMEbrrSaM0CrFk2Yiq/gXnBvD9pMa2jGXxyhGLfvhZpuMZe18CJpFxAt3CRs42NMg==\",\n      \"dev\": true\n    },\n    \"node_modules/is-stream\": {\n      \"version\": \"1.1.0\",\n      \"resolved\": \"https://registry.npmjs.org/is-stream/-/is-stream-1.1.0.tgz\",\n      \"integrity\": \"sha1-EtSj3U5o4Lec6428hBc66A2RykQ=\",\n      \"dev\": true,\n      \"engines\": {\n        \"node\": \">=0.10.0\"\n      }\n    },\n    \"node_modules/is-symbol\": {\n      \"version\": \"1.0.2\",\n      \"resolved\": \"https://registry.npmjs.org/is-symbol/-/is-symbol-1.0.2.tgz\",\n      \"integrity\": \"sha512-HS8bZ9ox60yCJLH9snBpIwv9pYUAkcuLhSA1oero1UB5y9aiQpRA8y2ex945AOtCZL1lJDeIk3G5LthswI46Lw==\",\n      \"dev\": true,\n      \"dependencies\": {\n        \"has-symbols\": \"^1.0.0\"\n      },\n      \"engines\": {\n        \"node\": \">= 0.4\"\n      }\n    },\n    \"node_modules/is-windows\": {\n      \"version\": \"1.0.2\",\n      \"resolved\": \"https://registry.npmjs.org/is-windows/-/is-windows-1.0.2.tgz\",\n      \"integrity\": \"sha512-eXK1UInq2bPmjyX6e3VHIzMLobc4J94i4AWn+Hpq3OU5KkrRC96OAcR3PRJ/pGu6m8TRnBHP9dkXQVsT/COVIA==\",\n      \"dev\": true,\n      \"engines\": {\n        \"node\": \">=0.10.0\"\n      }\n    },\n    \"node_modules/isarray\": {\n      \"version\": \"1.0.0\",\n      \"resolved\": \"https://registry.npmjs.org/isarray/-/isarray-1.0.0.tgz\",\n      \"integrity\": \"sha1-u5NdSFgsuhaMBoNJV6VKPgcSTxE=\",\n      \"dev\": true\n    },\n    \"node_modules/isexe\": {\n      \"version\": \"2.0.0\",\n      \"resolved\": \"https://registry.npmjs.org/isexe/-/isexe-2.0.0.tgz\",\n      \"integrity\": \"sha1-6PvzdNxVb/iUehDcsFctYz8s+hA=\",\n      \"dev\": true\n    },\n    \"node_modules/isobject\": {\n      \"version\": \"3.0.1\",\n      \"resolved\": \"https://registry.npmjs.org/isobject/-/isobject-3.0.1.tgz\",\n      \"integrity\": \"sha1-TkMekrEalzFjaqH5yNHMvP2reN8=\",\n      \"dev\": true,\n      \"engines\": {\n        \"node\": \">=0.10.0\"\n      }\n    },\n    \"node_modules/jest-get-type\": {\n      \"version\": \"22.4.3\",\n      \"resolved\": \"https://registry.npmjs.org/jest-get-type/-/jest-get-type-22.4.3.tgz\",\n      \"integrity\": \"sha512-/jsz0Y+V29w1chdXVygEKSz2nBoHoYqNShPe+QgxSNjAuP1i8+k4LbQNrfoliKej0P45sivkSCh7yiD6ubHS3w==\",\n      \"dev\": true\n    },\n    \"node_modules/jest-validate\": {\n      \"version\": \"23.6.0\",\n      \"resolved\": \"https://registry.npmjs.org/jest-validate/-/jest-validate-23.6.0.tgz\",\n      \"integrity\": \"sha512-OFKapYxe72yz7agrDAWi8v2WL8GIfVqcbKRCLbRG9PAxtzF9b1SEDdTpytNDN12z2fJynoBwpMpvj2R39plI2A==\",\n      \"dev\": true,\n      \"dependencies\": {\n        \"chalk\": \"^2.0.1\",\n        \"jest-get-type\": \"^22.1.0\",\n        \"leven\": \"^2.1.0\",\n        \"pretty-format\": \"^23.6.0\"\n      }\n    },\n    \"node_modules/js-tokens\": {\n      \"version\": \"3.0.2\",\n      \"resolved\": \"https://registry.npmjs.org/js-tokens/-/js-tokens-3.0.2.tgz\",\n      \"integrity\": \"sha1-mGbfOVECEw449/mWvOtlRDIJwls=\",\n      \"dev\": true\n    },\n    \"node_modules/js-yaml\": {\n      \"version\": \"3.13.1\",\n      \"resolved\": \"https://registry.npmjs.org/js-yaml/-/js-yaml-3.13.1.tgz\",\n      \"integrity\": \"sha512-YfbcO7jXDdyj0DGxYVSlSeQNHbD7XPWvrVWeVUujrQEoZzWJIRrCPoyk6kL6IAjAG2IolMK4T0hNUe0HOUs5Jw==\",\n      \"dev\": true,\n      \"dependencies\": {\n        \"argparse\": \"^1.0.7\",\n        \"esprima\": \"^4.0.0\"\n      },\n      \"bin\": {\n        \"js-yaml\": \"bin/js-yaml.js\"\n      }\n    },\n    \"node_modules/json-parse-better-errors\": {\n      \"version\": \"1.0.2\",\n      \"resolved\": \"https://registry.npmjs.org/json-parse-better-errors/-/json-parse-better-errors-1.0.2.tgz\",\n      \"integrity\": \"sha512-mrqyZKfX5EhL7hvqcV6WG1yYjnjeuYDzDhhcAAUrq8Po85NBQBJP+ZDUT75qZQ98IkUoBqdkExkukOU7Ts2wrw==\",\n      \"dev\": true\n    },\n    \"node_modules/json-schema-traverse\": {\n      \"version\": \"0.4.1\",\n      \"resolved\": \"https://registry.npmjs.org/json-schema-traverse/-/json-schema-traverse-0.4.1.tgz\",\n      \"integrity\": \"sha512-xbbCH5dCYU5T8LcEhhuh7HJ88HXuW3qsI3Y0zOZFKfZEHcpWiHU/Jxzk629Brsab/mMiHQti9wMP+845RPe3Vg==\",\n      \"dev\": true\n    },\n    \"node_modules/json-stable-stringify-without-jsonify\": {\n      \"version\": \"1.0.1\",\n      \"resolved\": \"https://registry.npmjs.org/json-stable-stringify-without-jsonify/-/json-stable-stringify-without-jsonify-1.0.1.tgz\",\n      \"integrity\": \"sha1-nbe1lJatPzz+8wp1FC0tkwrXJlE=\",\n      \"dev\": true\n    },\n    \"node_modules/jsx-ast-utils\": {\n      \"version\": \"2.1.0\",\n      \"resolved\": \"https://registry.npmjs.org/jsx-ast-utils/-/jsx-ast-utils-2.1.0.tgz\",\n      \"integrity\": \"sha512-yDGDG2DS4JcqhA6blsuYbtsT09xL8AoLuUR2Gb5exrw7UEM19sBcOTq+YBBhrNbl0PUC4R4LnFu+dHg2HKeVvA==\",\n      \"dev\": true,\n      \"dependencies\": {\n        \"array-includes\": \"^3.0.3\"\n      },\n      \"engines\": {\n        \"node\": \">=4.0\"\n      }\n    },\n    \"node_modules/kind-of\": {\n      \"version\": \"6.0.2\",\n      \"resolved\": \"https://registry.npmjs.org/kind-of/-/kind-of-6.0.2.tgz\",\n      \"integrity\": \"sha512-s5kLOcnH0XqDO+FvuaLX8DDjZ18CGFk7VygH40QoKPUQhW4e2rvM0rwUq0t8IQDOwYSeLK01U90OjzBTme2QqA==\",\n      \"dev\": true,\n      \"engines\": {\n        \"node\": \">=0.10.0\"\n      }\n    },\n    \"node_modules/leven\": {\n      \"version\": \"2.1.0\",\n      \"resolved\": \"https://registry.npmjs.org/leven/-/leven-2.1.0.tgz\",\n      \"integrity\": \"sha1-wuep93IJTe6dNCAq6KzORoeHVYA=\",\n      \"dev\": true,\n      \"engines\": {\n        \"node\": \">=0.10.0\"\n      }\n    },\n    \"node_modules/levn\": {\n      \"version\": \"0.3.0\",\n      \"resolved\": \"https://registry.npmjs.org/levn/-/levn-0.3.0.tgz\",\n      \"integrity\": \"sha1-OwmSTt+fCDwEkP3UwLxEIeBHZO4=\",\n      \"dev\": true,\n      \"dependencies\": {\n        \"prelude-ls\": \"~1.1.2\",\n        \"type-check\": \"~0.3.2\"\n      },\n      \"engines\": {\n        \"node\": \">= 0.8.0\"\n      }\n    },\n    \"node_modules/lint-staged\": {\n      \"version\": \"8.1.0\",\n      \"resolved\": \"https://registry.npmjs.org/lint-staged/-/lint-staged-8.1.0.tgz\",\n      \"integrity\": \"sha512-yfSkyJy7EuVsaoxtUSEhrD81spdJOe/gMTGea3XaV7HyoRhTb9Gdlp6/JppRZERvKSEYXP9bjcmq6CA5oL2lYQ==\",\n      \"dev\": true,\n      \"dependencies\": {\n        \"@iamstarkov/listr-update-renderer\": \"0.4.1\",\n        \"chalk\": \"^2.3.1\",\n        \"commander\": \"^2.14.1\",\n        \"cosmiconfig\": \"5.0.6\",\n        \"debug\": \"^3.1.0\",\n        \"dedent\": \"^0.7.0\",\n        \"del\": \"^3.0.0\",\n        \"execa\": \"^1.0.0\",\n        \"find-parent-dir\": \"^0.3.0\",\n        \"g-status\": \"^2.0.2\",\n        \"is-glob\": \"^4.0.0\",\n        \"is-windows\": \"^1.0.2\",\n        \"jest-validate\": \"^23.5.0\",\n        \"listr\": \"^0.14.2\",\n        \"lodash\": \"^4.17.5\",\n        \"log-symbols\": \"^2.2.0\",\n        \"micromatch\": \"^3.1.8\",\n        \"npm-which\": \"^3.0.1\",\n        \"p-map\": \"^1.1.1\",\n        \"path-is-inside\": \"^1.0.2\",\n        \"pify\": \"^3.0.0\",\n        \"please-upgrade-node\": \"^3.0.2\",\n        \"staged-git-files\": \"1.1.2\",\n        \"string-argv\": \"^0.0.2\",\n        \"stringify-object\": \"^3.2.2\"\n      },\n      \"bin\": {\n        \"lint-staged\": \"index.js\"\n      }\n    },\n    \"node_modules/lint-staged/node_modules/cosmiconfig\": {\n      \"version\": \"5.0.6\",\n      \"resolved\": \"https://registry.npmjs.org/cosmiconfig/-/cosmiconfig-5.0.6.tgz\",\n      \"integrity\": \"sha512-6DWfizHriCrFWURP1/qyhsiFvYdlJzbCzmtFWh744+KyWsJo5+kPzUZZaMRSSItoYc0pxFX7gEO7ZC1/gN/7AQ==\",\n      \"dev\": true,\n      \"dependencies\": {\n        \"is-directory\": \"^0.3.1\",\n        \"js-yaml\": \"^3.9.0\",\n        \"parse-json\": \"^4.0.0\"\n      },\n      \"engines\": {\n        \"node\": \">=4\"\n      }\n    },\n    \"node_modules/listr\": {\n      \"version\": \"0.14.3\",\n      \"resolved\": \"https://registry.npmjs.org/listr/-/listr-0.14.3.tgz\",\n      \"integrity\": \"sha512-RmAl7su35BFd/xoMamRjpIE4j3v+L28o8CT5YhAXQJm1fD+1l9ngXY8JAQRJ+tFK2i5njvi0iRUKV09vPwA0iA==\",\n      \"dev\": true,\n      \"dependencies\": {\n        \"@samverschueren/stream-to-observable\": \"^0.3.0\",\n        \"is-observable\": \"^1.1.0\",\n        \"is-promise\": \"^2.1.0\",\n        \"is-stream\": \"^1.1.0\",\n        \"listr-silent-renderer\": \"^1.1.1\",\n        \"listr-update-renderer\": \"^0.5.0\",\n        \"listr-verbose-renderer\": \"^0.5.0\",\n        \"p-map\": \"^2.0.0\",\n        \"rxjs\": \"^6.3.3\"\n      },\n      \"engines\": {\n        \"node\": \">=6\"\n      }\n    },\n    \"node_modules/listr-silent-renderer\": {\n      \"version\": \"1.1.1\",\n      \"resolved\": \"https://registry.npmjs.org/listr-silent-renderer/-/listr-silent-renderer-1.1.1.tgz\",\n      \"integrity\": \"sha1-kktaN1cVN3C/Go4/v3S4u/P5JC4=\",\n      \"dev\": true,\n      \"engines\": {\n        \"node\": \">=4\"\n      }\n    },\n    \"node_modules/listr-update-renderer\": {\n      \"version\": \"0.5.0\",\n      \"resolved\": \"https://registry.npmjs.org/listr-update-renderer/-/listr-update-renderer-0.5.0.tgz\",\n      \"integrity\": \"sha512-tKRsZpKz8GSGqoI/+caPmfrypiaq+OQCbd+CovEC24uk1h952lVj5sC7SqyFUm+OaJ5HN/a1YLt5cit2FMNsFA==\",\n      \"dev\": true,\n      \"dependencies\": {\n        \"chalk\": \"^1.1.3\",\n        \"cli-truncate\": \"^0.2.1\",\n        \"elegant-spinner\": \"^1.0.1\",\n        \"figures\": \"^1.7.0\",\n        \"indent-string\": \"^3.0.0\",\n        \"log-symbols\": \"^1.0.2\",\n        \"log-update\": \"^2.3.0\",\n        \"strip-ansi\": \"^3.0.1\"\n      },\n      \"engines\": {\n        \"node\": \">=6\"\n      },\n      \"peerDependencies\": {\n        \"listr\": \"^0.14.2\"\n      }\n    },\n    \"node_modules/listr-update-renderer/node_modules/chalk\": {\n      \"version\": \"1.1.3\",\n      \"resolved\": \"https://registry.npmjs.org/chalk/-/chalk-1.1.3.tgz\",\n      \"integrity\": \"sha1-qBFcVeSnAv5NFQq9OHKCKn4J/Jg=\",\n      \"dev\": true,\n      \"dependencies\": {\n        \"ansi-styles\": \"^2.2.1\",\n        \"escape-string-regexp\": \"^1.0.2\",\n        \"has-ansi\": \"^2.0.0\",\n        \"strip-ansi\": \"^3.0.0\",\n        \"supports-color\": \"^2.0.0\"\n      },\n      \"engines\": {\n        \"node\": \">=0.10.0\"\n      }\n    },\n    \"node_modules/listr-update-renderer/node_modules/log-symbols\": {\n      \"version\": \"1.0.2\",\n      \"resolved\": \"https://registry.npmjs.org/log-symbols/-/log-symbols-1.0.2.tgz\",\n      \"integrity\": \"sha1-N2/3tY6jCGoPCfrMdGF+ylAeGhg=\",\n      \"dev\": true,\n      \"dependencies\": {\n        \"chalk\": \"^1.0.0\"\n      },\n      \"engines\": {\n        \"node\": \">=0.10.0\"\n      }\n    },\n    \"node_modules/listr-verbose-renderer\": {\n      \"version\": \"0.5.0\",\n      \"resolved\": \"https://registry.npmjs.org/listr-verbose-renderer/-/listr-verbose-renderer-0.5.0.tgz\",\n      \"integrity\": \"sha512-04PDPqSlsqIOaaaGZ+41vq5FejI9auqTInicFRndCBgE3bXG8D6W1I+mWhk+1nqbHmyhla/6BUrd5OSiHwKRXw==\",\n      \"dev\": true,\n      \"dependencies\": {\n        \"chalk\": \"^2.4.1\",\n        \"cli-cursor\": \"^2.1.0\",\n        \"date-fns\": \"^1.27.2\",\n        \"figures\": \"^2.0.0\"\n      },\n      \"engines\": {\n        \"node\": \">=4\"\n      }\n    },\n    \"node_modules/listr-verbose-renderer/node_modules/figures\": {\n      \"version\": \"2.0.0\",\n      \"resolved\": \"https://registry.npmjs.org/figures/-/figures-2.0.0.tgz\",\n      \"integrity\": \"sha1-OrGi0qYsi/tDGgyUy3l6L84nyWI=\",\n      \"dev\": true,\n      \"dependencies\": {\n        \"escape-string-regexp\": \"^1.0.5\"\n      },\n      \"engines\": {\n        \"node\": \">=4\"\n      }\n    },\n    \"node_modules/listr/node_modules/p-map\": {\n      \"version\": \"2.1.0\",\n      \"resolved\": \"https://registry.npmjs.org/p-map/-/p-map-2.1.0.tgz\",\n      \"integrity\": \"sha512-y3b8Kpd8OAN444hxfBbFfj1FY/RjtTd8tzYwhUqNYXx0fXx2iX4maP4Qr6qhIKbQXI02wTLAda4fYUbDagTUFw==\",\n      \"dev\": true,\n      \"engines\": {\n        \"node\": \">=6\"\n      }\n    },\n    \"node_modules/load-json-file\": {\n      \"version\": \"2.0.0\",\n      \"resolved\": \"https://registry.npmjs.org/load-json-file/-/load-json-file-2.0.0.tgz\",\n      \"integrity\": \"sha1-eUfkIUmvgNaWy/eXvKq8/h/inKg=\",\n      \"dev\": true,\n      \"dependencies\": {\n        \"graceful-fs\": \"^4.1.2\",\n        \"parse-json\": \"^2.2.0\",\n        \"pify\": \"^2.0.0\",\n        \"strip-bom\": \"^3.0.0\"\n      },\n      \"engines\": {\n        \"node\": \">=4\"\n      }\n    },\n    \"node_modules/load-json-file/node_modules/parse-json\": {\n      \"version\": \"2.2.0\",\n      \"resolved\": \"https://registry.npmjs.org/parse-json/-/parse-json-2.2.0.tgz\",\n      \"integrity\": \"sha1-9ID0BDTvgHQfhGkJn43qGPVaTck=\",\n      \"dev\": true,\n      \"dependencies\": {\n        \"error-ex\": \"^1.2.0\"\n      },\n      \"engines\": {\n        \"node\": \">=0.10.0\"\n      }\n    },\n    \"node_modules/load-json-file/node_modules/pify\": {\n      \"version\": \"2.3.0\",\n      \"resolved\": \"https://registry.npmjs.org/pify/-/pify-2.3.0.tgz\",\n      \"integrity\": \"sha1-7RQaasBDqEnqWISY59yosVMw6Qw=\",\n      \"dev\": true,\n      \"engines\": {\n        \"node\": \">=0.10.0\"\n      }\n    },\n    \"node_modules/locate-path\": {\n      \"version\": \"3.0.0\",\n      \"resolved\": \"https://registry.npmjs.org/locate-path/-/locate-path-3.0.0.tgz\",\n      \"integrity\": \"sha512-7AO748wWnIhNqAuaty2ZWHkQHRSNfPVIsPIfwEOWO22AmaoVrWavlOcMR5nzTLNYvp36X220/maaRsrec1G65A==\",\n      \"dev\": true,\n      \"dependencies\": {\n        \"p-locate\": \"^3.0.0\",\n        \"path-exists\": \"^3.0.0\"\n      },\n      \"engines\": {\n        \"node\": \">=6\"\n      }\n    },\n    \"node_modules/lodash\": {\n      \"version\": \"4.17.21\",\n      \"resolved\": \"https://registry.npmjs.org/lodash/-/lodash-4.17.21.tgz\",\n      \"integrity\": \"sha512-v2kDEe57lecTulaDIuNTPy3Ry4gLGJ6Z1O3vE1krgXZNrsQ+LFTGHVxVjcXPs17LhbZVGedAJv8XZ1tvj5FvSg==\",\n      \"dev\": true\n    },\n    \"node_modules/log-symbols\": {\n      \"version\": \"2.2.0\",\n      \"resolved\": \"https://registry.npmjs.org/log-symbols/-/log-symbols-2.2.0.tgz\",\n      \"integrity\": \"sha512-VeIAFslyIerEJLXHziedo2basKbMKtTw3vfn5IzG0XTjhAVEJyNHnL2p7vc+wBDSdQuUpNw3M2u6xb9QsAY5Eg==\",\n      \"dev\": true,\n      \"dependencies\": {\n        \"chalk\": \"^2.0.1\"\n      },\n      \"engines\": {\n        \"node\": \">=4\"\n      }\n    },\n    \"node_modules/log-update\": {\n      \"version\": \"2.3.0\",\n      \"resolved\": \"https://registry.npmjs.org/log-update/-/log-update-2.3.0.tgz\",\n      \"integrity\": \"sha1-iDKP19HOeTiykoN0bwsbwSayRwg=\",\n      \"dev\": true,\n      \"dependencies\": {\n        \"ansi-escapes\": \"^3.0.0\",\n        \"cli-cursor\": \"^2.0.0\",\n        \"wrap-ansi\": \"^3.0.1\"\n      },\n      \"engines\": {\n        \"node\": \">=4\"\n      }\n    },\n    \"node_modules/loose-envify\": {\n      \"version\": \"1.4.0\",\n      \"resolved\": \"https://registry.npmjs.org/loose-envify/-/loose-envify-1.4.0.tgz\",\n      \"integrity\": \"sha512-lyuxPGr/Wfhrlem2CL/UcnUc1zcqKAImBDzukY7Y5F/yQiNdko6+fRLevlw1HgMySw7f611UIY408EtxRSoK3Q==\",\n      \"dev\": true,\n      \"dependencies\": {\n        \"js-tokens\": \"^3.0.0 || ^4.0.0\"\n      },\n      \"bin\": {\n        \"loose-envify\": \"cli.js\"\n      }\n    },\n    \"node_modules/map-cache\": {\n      \"version\": \"0.2.2\",\n      \"resolved\": \"https://registry.npmjs.org/map-cache/-/map-cache-0.2.2.tgz\",\n      \"integrity\": \"sha1-wyq9C9ZSXZsFFkW7TyasXcmKDb8=\",\n      \"dev\": true,\n      \"engines\": {\n        \"node\": \">=0.10.0\"\n      }\n    },\n    \"node_modules/map-visit\": {\n      \"version\": \"1.0.0\",\n      \"resolved\": \"https://registry.npmjs.org/map-visit/-/map-visit-1.0.0.tgz\",\n      \"integrity\": \"sha1-7Nyo8TFE5mDxtb1B8S80edmN+48=\",\n      \"dev\": true,\n      \"dependencies\": {\n        \"object-visit\": \"^1.0.0\"\n      },\n      \"engines\": {\n        \"node\": \">=0.10.0\"\n      }\n    },\n    \"node_modules/matcher\": {\n      \"version\": \"1.1.1\",\n      \"resolved\": \"https://registry.npmjs.org/matcher/-/matcher-1.1.1.tgz\",\n      \"integrity\": \"sha512-+BmqxWIubKTRKNWx/ahnCkk3mG8m7OturVlqq6HiojGJTd5hVYbgZm6WzcYPCoB+KBT4Vd6R7WSRG2OADNaCjg==\",\n      \"dev\": true,\n      \"dependencies\": {\n        \"escape-string-regexp\": \"^1.0.4\"\n      },\n      \"engines\": {\n        \"node\": \">=4\"\n      }\n    },\n    \"node_modules/micromatch\": {\n      \"version\": \"3.1.10\",\n      \"resolved\": \"https://registry.npmjs.org/micromatch/-/micromatch-3.1.10.tgz\",\n      \"integrity\": \"sha512-MWikgl9n9M3w+bpsY3He8L+w9eF9338xRl8IAO5viDizwSzziFEyUzo2xrrloB64ADbTf8uA8vRqqttDTOmccg==\",\n      \"dev\": true,\n      \"dependencies\": {\n        \"arr-diff\": \"^4.0.0\",\n        \"array-unique\": \"^0.3.2\",\n        \"braces\": \"^2.3.1\",\n        \"define-property\": \"^2.0.2\",\n        \"extend-shallow\": \"^3.0.2\",\n        \"extglob\": \"^2.0.4\",\n        \"fragment-cache\": \"^0.2.1\",\n        \"kind-of\": \"^6.0.2\",\n        \"nanomatch\": \"^1.2.9\",\n        \"object.pick\": \"^1.3.0\",\n        \"regex-not\": \"^1.0.0\",\n        \"snapdragon\": \"^0.8.1\",\n        \"to-regex\": \"^3.0.2\"\n      },\n      \"engines\": {\n        \"node\": \">=0.10.0\"\n      }\n    },\n    \"node_modules/mime\": {\n      \"version\": \"1.6.0\",\n      \"resolved\": \"https://registry.npmjs.org/mime/-/mime-1.6.0.tgz\",\n      \"integrity\": \"sha512-x0Vn8spI+wuJ1O6S7gnbaQg8Pxh4NNHb7KSINmEWKiPE4RKOplvijn+NkmYmmRgP68mc70j2EbeTFRsrswaQeg==\",\n      \"dev\": true,\n      \"bin\": {\n        \"mime\": \"cli.js\"\n      },\n      \"engines\": {\n        \"node\": \">=4\"\n      }\n    },\n    \"node_modules/mimic-fn\": {\n      \"version\": \"1.2.0\",\n      \"resolved\": \"https://registry.npmjs.org/mimic-fn/-/mimic-fn-1.2.0.tgz\",\n      \"integrity\": \"sha512-jf84uxzwiuiIVKiOLpfYk7N46TSy8ubTonmneY9vrpHNAnp0QBt2BxWV9dO3/j+BoVAb+a5G6YDPW3M5HOdMWQ==\",\n      \"dev\": true,\n      \"engines\": {\n        \"node\": \">=4\"\n      }\n    },\n    \"node_modules/minimatch\": {\n      \"version\": \"3.0.4\",\n      \"resolved\": \"https://registry.npmjs.org/minimatch/-/minimatch-3.0.4.tgz\",\n      \"integrity\": \"sha512-yJHVQEhyqPLUTgt9B83PXu6W3rx4MvvHvSUvToogpwoGDOUQ+yDrR0HRot+yOCdCO7u4hX3pWft6kWBBcqh0UA==\",\n      \"dev\": true,\n      \"dependencies\": {\n        \"brace-expansion\": \"^1.1.7\"\n      },\n      \"engines\": {\n        \"node\": \"*\"\n      }\n    },\n    \"node_modules/minimist\": {\n      \"version\": \"1.2.0\",\n      \"resolved\": \"https://registry.npmjs.org/minimist/-/minimist-1.2.0.tgz\",\n      \"integrity\": \"sha1-o1AIsg9BOD7sH7kU9M1d95omQoQ=\",\n      \"dev\": true\n    },\n    \"node_modules/mixin-deep\": {\n      \"version\": \"1.3.2\",\n      \"resolved\": \"https://registry.npmjs.org/mixin-deep/-/mixin-deep-1.3.2.tgz\",\n      \"integrity\": \"sha512-WRoDn//mXBiJ1H40rqa3vH0toePwSsGb45iInWlTySa+Uu4k3tYUSxa2v1KqAiLtvlrSzaExqS1gtk96A9zvEA==\",\n      \"dev\": true,\n      \"dependencies\": {\n        \"for-in\": \"^1.0.2\",\n        \"is-extendable\": \"^1.0.1\"\n      },\n      \"engines\": {\n        \"node\": \">=0.10.0\"\n      }\n    },\n    \"node_modules/mixin-deep/node_modules/is-extendable\": {\n      \"version\": \"1.0.1\",\n      \"resolved\": \"https://registry.npmjs.org/is-extendable/-/is-extendable-1.0.1.tgz\",\n      \"integrity\": \"sha512-arnXMxT1hhoKo9k1LZdmlNyJdDDfy2v0fXjFlmok4+i8ul/6WlbVge9bhM74OpNPQPMGUToDtz+KXa1PneJxOA==\",\n      \"dev\": true,\n      \"dependencies\": {\n        \"is-plain-object\": \"^2.0.4\"\n      },\n      \"engines\": {\n        \"node\": \">=0.10.0\"\n      }\n    },\n    \"node_modules/mkdirp\": {\n      \"version\": \"0.5.1\",\n      \"resolved\": \"https://registry.npmjs.org/mkdirp/-/mkdirp-0.5.1.tgz\",\n      \"integrity\": \"sha1-MAV0OOrGz3+MR2fzhkjWaX11yQM=\",\n      \"deprecated\": \"Legacy versions of mkdirp are no longer supported. Please update to mkdirp 1.x. (Note that the API surface has changed to use Promises in 1.x.)\",\n      \"dev\": true,\n      \"dependencies\": {\n        \"minimist\": \"0.0.8\"\n      },\n      \"bin\": {\n        \"mkdirp\": \"bin/cmd.js\"\n      }\n    },\n    \"node_modules/mkdirp/node_modules/minimist\": {\n      \"version\": \"0.0.8\",\n      \"resolved\": \"https://registry.npmjs.org/minimist/-/minimist-0.0.8.tgz\",\n      \"integrity\": \"sha1-hX/Kv8M5fSYluCKCYuhqp6ARsF0=\",\n      \"dev\": true\n    },\n    \"node_modules/ms\": {\n      \"version\": \"2.1.2\",\n      \"resolved\": \"https://registry.npmjs.org/ms/-/ms-2.1.2.tgz\",\n      \"integrity\": \"sha512-sGkPx+VjMtmA6MX27oA4FBFELFCZZ4S4XqeGOXCv68tT+jb3vk/RyaKWP0PTKyWtmLSM0b+adUTEvbs1PEaH2w==\",\n      \"dev\": true\n    },\n    \"node_modules/mute-stream\": {\n      \"version\": \"0.0.7\",\n      \"resolved\": \"https://registry.npmjs.org/mute-stream/-/mute-stream-0.0.7.tgz\",\n      \"integrity\": \"sha1-MHXOk7whuPq0PhvE2n6BFe0ee6s=\",\n      \"dev\": true\n    },\n    \"node_modules/nanomatch\": {\n      \"version\": \"1.2.13\",\n      \"resolved\": \"https://registry.npmjs.org/nanomatch/-/nanomatch-1.2.13.tgz\",\n      \"integrity\": \"sha512-fpoe2T0RbHwBTBUOftAfBPaDEi06ufaUai0mE6Yn1kacc3SnTErfb/h+X94VXzI64rKFHYImXSvdwGGCmwOqCA==\",\n      \"dev\": true,\n      \"dependencies\": {\n        \"arr-diff\": \"^4.0.0\",\n        \"array-unique\": \"^0.3.2\",\n        \"define-property\": \"^2.0.2\",\n        \"extend-shallow\": \"^3.0.2\",\n        \"fragment-cache\": \"^0.2.1\",\n        \"is-windows\": \"^1.0.2\",\n        \"kind-of\": \"^6.0.2\",\n        \"object.pick\": \"^1.3.0\",\n        \"regex-not\": \"^1.0.0\",\n        \"snapdragon\": \"^0.8.1\",\n        \"to-regex\": \"^3.0.1\"\n      },\n      \"engines\": {\n        \"node\": \">=0.10.0\"\n      }\n    },\n    \"node_modules/natural-compare\": {\n      \"version\": \"1.4.0\",\n      \"resolved\": \"https://registry.npmjs.org/natural-compare/-/natural-compare-1.4.0.tgz\",\n      \"integrity\": \"sha1-Sr6/7tdUHywnrPspvbvRXI1bpPc=\",\n      \"dev\": true\n    },\n    \"node_modules/nice-try\": {\n      \"version\": \"1.0.5\",\n      \"resolved\": \"https://registry.npmjs.org/nice-try/-/nice-try-1.0.5.tgz\",\n      \"integrity\": \"sha512-1nh45deeb5olNY7eX82BkPO7SSxR5SSYJiPTrTdFUVYwAl8CKMA5N9PjTYkHiRjisVcxcQ1HXdLhx2qxxJzLNQ==\",\n      \"dev\": true\n    },\n    \"node_modules/normalize-package-data\": {\n      \"version\": \"2.5.0\",\n      \"resolved\": \"https://registry.npmjs.org/normalize-package-data/-/normalize-package-data-2.5.0.tgz\",\n      \"integrity\": \"sha512-/5CMN3T0R4XTj4DcGaexo+roZSdSFW/0AOOTROrjxzCG1wrWXEsGbRKevjlIL+ZDE4sZlJr5ED4YW0yqmkK+eA==\",\n      \"dev\": true,\n      \"dependencies\": {\n        \"hosted-git-info\": \"^2.1.4\",\n        \"resolve\": \"^1.10.0\",\n        \"semver\": \"2 || 3 || 4 || 5\",\n        \"validate-npm-package-license\": \"^3.0.1\"\n      }\n    },\n    \"node_modules/npm-path\": {\n      \"version\": \"2.0.4\",\n      \"resolved\": \"https://registry.npmjs.org/npm-path/-/npm-path-2.0.4.tgz\",\n      \"integrity\": \"sha512-IFsj0R9C7ZdR5cP+ET342q77uSRdtWOlWpih5eC+lu29tIDbNEgDbzgVJ5UFvYHWhxDZ5TFkJafFioO0pPQjCw==\",\n      \"dev\": true,\n      \"dependencies\": {\n        \"which\": \"^1.2.10\"\n      },\n      \"bin\": {\n        \"npm-path\": \"bin/npm-path\"\n      },\n      \"engines\": {\n        \"node\": \">=0.8\"\n      }\n    },\n    \"node_modules/npm-run-path\": {\n      \"version\": \"2.0.2\",\n      \"resolved\": \"https://registry.npmjs.org/npm-run-path/-/npm-run-path-2.0.2.tgz\",\n      \"integrity\": \"sha1-NakjLfo11wZ7TLLd8jV7GHFTbF8=\",\n      \"dev\": true,\n      \"dependencies\": {\n        \"path-key\": \"^2.0.0\"\n      },\n      \"engines\": {\n        \"node\": \">=4\"\n      }\n    },\n    \"node_modules/npm-which\": {\n      \"version\": \"3.0.1\",\n      \"resolved\": \"https://registry.npmjs.org/npm-which/-/npm-which-3.0.1.tgz\",\n      \"integrity\": \"sha1-kiXybsOihcIJyuZ8OxGmtKtxQKo=\",\n      \"dev\": true,\n      \"dependencies\": {\n        \"commander\": \"^2.9.0\",\n        \"npm-path\": \"^2.0.2\",\n        \"which\": \"^1.2.10\"\n      },\n      \"bin\": {\n        \"npm-which\": \"bin/npm-which.js\"\n      },\n      \"engines\": {\n        \"node\": \">=4.2.0\"\n      }\n    },\n    \"node_modules/number-is-nan\": {\n      \"version\": \"1.0.1\",\n      \"resolved\": \"https://registry.npmjs.org/number-is-nan/-/number-is-nan-1.0.1.tgz\",\n      \"integrity\": \"sha1-CXtgK1NCKlIsGvuHkDGDNpQaAR0=\",\n      \"dev\": true,\n      \"engines\": {\n        \"node\": \">=0.10.0\"\n      }\n    },\n    \"node_modules/object-assign\": {\n      \"version\": \"4.1.1\",\n      \"resolved\": \"https://registry.npmjs.org/object-assign/-/object-assign-4.1.1.tgz\",\n      \"integrity\": \"sha1-IQmtx5ZYh8/AXLvUQsrIv7s2CGM=\",\n      \"dev\": true,\n      \"engines\": {\n        \"node\": \">=0.10.0\"\n      }\n    },\n    \"node_modules/object-copy\": {\n      \"version\": \"0.1.0\",\n      \"resolved\": \"https://registry.npmjs.org/object-copy/-/object-copy-0.1.0.tgz\",\n      \"integrity\": \"sha1-fn2Fi3gb18mRpBupde04EnVOmYw=\",\n      \"dev\": true,\n      \"dependencies\": {\n        \"copy-descriptor\": \"^0.1.0\",\n        \"define-property\": \"^0.2.5\",\n        \"kind-of\": \"^3.0.3\"\n      },\n      \"engines\": {\n        \"node\": \">=0.10.0\"\n      }\n    },\n    \"node_modules/object-copy/node_modules/define-property\": {\n      \"version\": \"0.2.5\",\n      \"resolved\": \"https://registry.npmjs.org/define-property/-/define-property-0.2.5.tgz\",\n      \"integrity\": \"sha1-w1se+RjsPJkPmlvFe+BKrOxcgRY=\",\n      \"dev\": true,\n      \"dependencies\": {\n        \"is-descriptor\": \"^0.1.0\"\n      },\n      \"engines\": {\n        \"node\": \">=0.10.0\"\n      }\n    },\n    \"node_modules/object-copy/node_modules/kind-of\": {\n      \"version\": \"3.2.2\",\n      \"resolved\": \"https://registry.npmjs.org/kind-of/-/kind-of-3.2.2.tgz\",\n      \"integrity\": \"sha1-MeohpzS6ubuw8yRm2JOupR5KPGQ=\",\n      \"dev\": true,\n      \"dependencies\": {\n        \"is-buffer\": \"^1.1.5\"\n      },\n      \"engines\": {\n        \"node\": \">=0.10.0\"\n      }\n    },\n    \"node_modules/object-keys\": {\n      \"version\": \"1.1.1\",\n      \"resolved\": \"https://registry.npmjs.org/object-keys/-/object-keys-1.1.1.tgz\",\n      \"integrity\": \"sha512-NuAESUOUMrlIXOfHKzD6bpPu3tYt3xvjNdRIQ+FeT0lNb4K8WR70CaDxhuNguS2XG+GjkyMwOzsN5ZktImfhLA==\",\n      \"dev\": true,\n      \"engines\": {\n        \"node\": \">= 0.4\"\n      }\n    },\n    \"node_modules/object-visit\": {\n      \"version\": \"1.0.1\",\n      \"resolved\": \"https://registry.npmjs.org/object-visit/-/object-visit-1.0.1.tgz\",\n      \"integrity\": \"sha1-95xEk68MU3e1n+OdOV5BBC3QRbs=\",\n      \"dev\": true,\n      \"dependencies\": {\n        \"isobject\": \"^3.0.0\"\n      },\n      \"engines\": {\n        \"node\": \">=0.10.0\"\n      }\n    },\n    \"node_modules/object.pick\": {\n      \"version\": \"1.3.0\",\n      \"resolved\": \"https://registry.npmjs.org/object.pick/-/object.pick-1.3.0.tgz\",\n      \"integrity\": \"sha1-h6EKxMFpS9Lhy/U1kaZhQftd10c=\",\n      \"dev\": true,\n      \"dependencies\": {\n        \"isobject\": \"^3.0.1\"\n      },\n      \"engines\": {\n        \"node\": \">=0.10.0\"\n      }\n    },\n    \"node_modules/once\": {\n      \"version\": \"1.4.0\",\n      \"resolved\": \"https://registry.npmjs.org/once/-/once-1.4.0.tgz\",\n      \"integrity\": \"sha1-WDsap3WWHUsROsF9nFC6753Xa9E=\",\n      \"dev\": true,\n      \"dependencies\": {\n        \"wrappy\": \"1\"\n      }\n    },\n    \"node_modules/onetime\": {\n      \"version\": \"2.0.1\",\n      \"resolved\": \"https://registry.npmjs.org/onetime/-/onetime-2.0.1.tgz\",\n      \"integrity\": \"sha1-BnQoIw/WdEOyeUsiu6UotoZ5YtQ=\",\n      \"dev\": true,\n      \"dependencies\": {\n        \"mimic-fn\": \"^1.0.0\"\n      },\n      \"engines\": {\n        \"node\": \">=4\"\n      }\n    },\n    \"node_modules/opener\": {\n      \"version\": \"1.4.3\",\n      \"resolved\": \"https://registry.npmjs.org/opener/-/opener-1.4.3.tgz\",\n      \"integrity\": \"sha1-XG2ixdflgx6P+jlklQ+NZnSskLg=\",\n      \"dev\": true,\n      \"bin\": {\n        \"opener\": \"opener.js\"\n      }\n    },\n    \"node_modules/optimist\": {\n      \"version\": \"0.6.1\",\n      \"resolved\": \"https://registry.npmjs.org/optimist/-/optimist-0.6.1.tgz\",\n      \"integrity\": \"sha1-2j6nRob6IaGaERwybpDrFaAZZoY=\",\n      \"dev\": true,\n      \"dependencies\": {\n        \"minimist\": \"~0.0.1\",\n        \"wordwrap\": \"~0.0.2\"\n      }\n    },\n    \"node_modules/optimist/node_modules/minimist\": {\n      \"version\": \"0.0.10\",\n      \"resolved\": \"https://registry.npmjs.org/minimist/-/minimist-0.0.10.tgz\",\n      \"integrity\": \"sha1-3j+YVD2/lggr5IrRoMfNqDYwHc8=\",\n      \"dev\": true\n    },\n    \"node_modules/optionator\": {\n      \"version\": \"0.8.2\",\n      \"resolved\": \"https://registry.npmjs.org/optionator/-/optionator-0.8.2.tgz\",\n      \"integrity\": \"sha1-NkxeQJ0/TWMB1sC0wFu6UBgK62Q=\",\n      \"dev\": true,\n      \"dependencies\": {\n        \"deep-is\": \"~0.1.3\",\n        \"fast-levenshtein\": \"~2.0.4\",\n        \"levn\": \"~0.3.0\",\n        \"prelude-ls\": \"~1.1.2\",\n        \"type-check\": \"~0.3.2\",\n        \"wordwrap\": \"~1.0.0\"\n      },\n      \"engines\": {\n        \"node\": \">= 0.8.0\"\n      }\n    },\n    \"node_modules/optionator/node_modules/wordwrap\": {\n      \"version\": \"1.0.0\",\n      \"resolved\": \"https://registry.npmjs.org/wordwrap/-/wordwrap-1.0.0.tgz\",\n      \"integrity\": \"sha1-J1hIEIkUVqQXHI0CJkQa3pDLyus=\",\n      \"dev\": true\n    },\n    \"node_modules/os-tmpdir\": {\n      \"version\": \"1.0.2\",\n      \"resolved\": \"https://registry.npmjs.org/os-tmpdir/-/os-tmpdir-1.0.2.tgz\",\n      \"integrity\": \"sha1-u+Z0BseaqFxc/sdm/lc0VV36EnQ=\",\n      \"dev\": true,\n      \"engines\": {\n        \"node\": \">=0.10.0\"\n      }\n    },\n    \"node_modules/p-finally\": {\n      \"version\": \"1.0.0\",\n      \"resolved\": \"https://registry.npmjs.org/p-finally/-/p-finally-1.0.0.tgz\",\n      \"integrity\": \"sha1-P7z7FbiZpEEjs0ttzBi3JDNqLK4=\",\n      \"dev\": true,\n      \"engines\": {\n        \"node\": \">=4\"\n      }\n    },\n    \"node_modules/p-limit\": {\n      \"version\": \"2.2.0\",\n      \"resolved\": \"https://registry.npmjs.org/p-limit/-/p-limit-2.2.0.tgz\",\n      \"integrity\": \"sha512-pZbTJpoUsCzV48Mc9Nh51VbwO0X9cuPFE8gYwx9BTCt9SF8/b7Zljd2fVgOxhIF/HDTKgpVzs+GPhyKfjLLFRQ==\",\n      \"dev\": true,\n      \"dependencies\": {\n        \"p-try\": \"^2.0.0\"\n      },\n      \"engines\": {\n        \"node\": \">=6\"\n      }\n    },\n    \"node_modules/p-locate\": {\n      \"version\": \"3.0.0\",\n      \"resolved\": \"https://registry.npmjs.org/p-locate/-/p-locate-3.0.0.tgz\",\n      \"integrity\": \"sha512-x+12w/To+4GFfgJhBEpiDcLozRJGegY+Ei7/z0tSLkMmxGZNybVMSfWj9aJn8Z5Fc7dBUNJOOVgPv2H7IwulSQ==\",\n      \"dev\": true,\n      \"dependencies\": {\n        \"p-limit\": \"^2.0.0\"\n      },\n      \"engines\": {\n        \"node\": \">=6\"\n      }\n    },\n    \"node_modules/p-map\": {\n      \"version\": \"1.2.0\",\n      \"resolved\": \"https://registry.npmjs.org/p-map/-/p-map-1.2.0.tgz\",\n      \"integrity\": \"sha512-r6zKACMNhjPJMTl8KcFH4li//gkrXWfbD6feV8l6doRHlzljFWGJ2AP6iKaCJXyZmAUMOPtvbW7EXkbWO/pLEA==\",\n      \"dev\": true,\n      \"engines\": {\n        \"node\": \">=4\"\n      }\n    },\n    \"node_modules/p-try\": {\n      \"version\": \"2.2.0\",\n      \"resolved\": \"https://registry.npmjs.org/p-try/-/p-try-2.2.0.tgz\",\n      \"integrity\": \"sha512-R4nPAVTAU0B9D35/Gk3uJf/7XYbQcyohSKdvAxIRSNghFl4e71hVoGnBNQz9cWaXxO2I10KTC+3jMdvvoKw6dQ==\",\n      \"dev\": true,\n      \"engines\": {\n        \"node\": \">=6\"\n      }\n    },\n    \"node_modules/parse-json\": {\n      \"version\": \"4.0.0\",\n      \"resolved\": \"https://registry.npmjs.org/parse-json/-/parse-json-4.0.0.tgz\",\n      \"integrity\": \"sha1-vjX1Qlvh9/bHRxhPmKeIy5lHfuA=\",\n      \"dev\": true,\n      \"dependencies\": {\n        \"error-ex\": \"^1.3.1\",\n        \"json-parse-better-errors\": \"^1.0.1\"\n      },\n      \"engines\": {\n        \"node\": \">=4\"\n      }\n    },\n    \"node_modules/pascalcase\": {\n      \"version\": \"0.1.1\",\n      \"resolved\": \"https://registry.npmjs.org/pascalcase/-/pascalcase-0.1.1.tgz\",\n      \"integrity\": \"sha1-s2PlXoAGym/iF4TS2yK9FdeRfxQ=\",\n      \"dev\": true,\n      \"engines\": {\n        \"node\": \">=0.10.0\"\n      }\n    },\n    \"node_modules/path-exists\": {\n      \"version\": \"3.0.0\",\n      \"resolved\": \"https://registry.npmjs.org/path-exists/-/path-exists-3.0.0.tgz\",\n      \"integrity\": \"sha1-zg6+ql94yxiSXqfYENe1mwEP1RU=\",\n      \"dev\": true,\n      \"engines\": {\n        \"node\": \">=4\"\n      }\n    },\n    \"node_modules/path-is-absolute\": {\n      \"version\": \"1.0.1\",\n      \"resolved\": \"https://registry.npmjs.org/path-is-absolute/-/path-is-absolute-1.0.1.tgz\",\n      \"integrity\": \"sha1-F0uSaHNVNP+8es5r9TpanhtcX18=\",\n      \"dev\": true,\n      \"engines\": {\n        \"node\": \">=0.10.0\"\n      }\n    },\n    \"node_modules/path-is-inside\": {\n      \"version\": \"1.0.2\",\n      \"resolved\": \"https://registry.npmjs.org/path-is-inside/-/path-is-inside-1.0.2.tgz\",\n      \"integrity\": \"sha1-NlQX3t5EQw0cEa9hAn+s8HS9/FM=\",\n      \"dev\": true\n    },\n    \"node_modules/path-key\": {\n      \"version\": \"2.0.1\",\n      \"resolved\": \"https://registry.npmjs.org/path-key/-/path-key-2.0.1.tgz\",\n      \"integrity\": \"sha1-QRyttXTFoUDTpLGRDUDYDMn0C0A=\",\n      \"dev\": true,\n      \"engines\": {\n        \"node\": \">=4\"\n      }\n    },\n    \"node_modules/path-parse\": {\n      \"version\": \"1.0.7\",\n      \"resolved\": \"https://registry.npmjs.org/path-parse/-/path-parse-1.0.7.tgz\",\n      \"integrity\": \"sha512-LDJzPVEEEPR+y48z93A0Ed0yXb8pAByGWo/k5YYdYgpY2/2EsOsksJrq7lOHxryrVOn1ejG6oAp8ahvOIQD8sw==\",\n      \"dev\": true\n    },\n    \"node_modules/path-type\": {\n      \"version\": \"2.0.0\",\n      \"resolved\": \"https://registry.npmjs.org/path-type/-/path-type-2.0.0.tgz\",\n      \"integrity\": \"sha1-8BLMuEFbcJb8LaoQVMPXI4lZTHM=\",\n      \"dev\": true,\n      \"dependencies\": {\n        \"pify\": \"^2.0.0\"\n      },\n      \"engines\": {\n        \"node\": \">=4\"\n      }\n    },\n    \"node_modules/path-type/node_modules/pify\": {\n      \"version\": \"2.3.0\",\n      \"resolved\": \"https://registry.npmjs.org/pify/-/pify-2.3.0.tgz\",\n      \"integrity\": \"sha1-7RQaasBDqEnqWISY59yosVMw6Qw=\",\n      \"dev\": true,\n      \"engines\": {\n        \"node\": \">=0.10.0\"\n      }\n    },\n    \"node_modules/pify\": {\n      \"version\": \"3.0.0\",\n      \"resolved\": \"https://registry.npmjs.org/pify/-/pify-3.0.0.tgz\",\n      \"integrity\": \"sha1-5aSs0sEB/fPZpNB/DbxNtJ3SgXY=\",\n      \"dev\": true,\n      \"engines\": {\n        \"node\": \">=4\"\n      }\n    },\n    \"node_modules/pinkie\": {\n      \"version\": \"2.0.4\",\n      \"resolved\": \"https://registry.npmjs.org/pinkie/-/pinkie-2.0.4.tgz\",\n      \"integrity\": \"sha1-clVrgM+g1IqXToDnckjoDtT3+HA=\",\n      \"dev\": true,\n      \"engines\": {\n        \"node\": \">=0.10.0\"\n      }\n    },\n    \"node_modules/pinkie-promise\": {\n      \"version\": \"2.0.1\",\n      \"resolved\": \"https://registry.npmjs.org/pinkie-promise/-/pinkie-promise-2.0.1.tgz\",\n      \"integrity\": \"sha1-ITXW36ejWMBprJsXh3YogihFD/o=\",\n      \"dev\": true,\n      \"dependencies\": {\n        \"pinkie\": \"^2.0.0\"\n      },\n      \"engines\": {\n        \"node\": \">=0.10.0\"\n      }\n    },\n    \"node_modules/pkg-conf\": {\n      \"version\": \"2.1.0\",\n      \"resolved\": \"https://registry.npmjs.org/pkg-conf/-/pkg-conf-2.1.0.tgz\",\n      \"integrity\": \"sha1-ISZRTKbyq/69FoWW3xi6V4Z/AFg=\",\n      \"dev\": true,\n      \"dependencies\": {\n        \"find-up\": \"^2.0.0\",\n        \"load-json-file\": \"^4.0.0\"\n      },\n      \"engines\": {\n        \"node\": \">=4\"\n      }\n    },\n    \"node_modules/pkg-conf/node_modules/find-up\": {\n      \"version\": \"2.1.0\",\n      \"resolved\": \"https://registry.npmjs.org/find-up/-/find-up-2.1.0.tgz\",\n      \"integrity\": \"sha1-RdG35QbHF93UgndaK3eSCjwMV6c=\",\n      \"dev\": true,\n      \"dependencies\": {\n        \"locate-path\": \"^2.0.0\"\n      },\n      \"engines\": {\n        \"node\": \">=4\"\n      }\n    },\n    \"node_modules/pkg-conf/node_modules/load-json-file\": {\n      \"version\": \"4.0.0\",\n      \"resolved\": \"https://registry.npmjs.org/load-json-file/-/load-json-file-4.0.0.tgz\",\n      \"integrity\": \"sha1-L19Fq5HjMhYjT9U62rZo607AmTs=\",\n      \"dev\": true,\n      \"dependencies\": {\n        \"graceful-fs\": \"^4.1.2\",\n        \"parse-json\": \"^4.0.0\",\n        \"pify\": \"^3.0.0\",\n        \"strip-bom\": \"^3.0.0\"\n      },\n      \"engines\": {\n        \"node\": \">=4\"\n      }\n    },\n    \"node_modules/pkg-conf/node_modules/locate-path\": {\n      \"version\": \"2.0.0\",\n      \"resolved\": \"https://registry.npmjs.org/locate-path/-/locate-path-2.0.0.tgz\",\n      \"integrity\": \"sha1-K1aLJl7slExtnA3pw9u7ygNUzY4=\",\n      \"dev\": true,\n      \"dependencies\": {\n        \"p-locate\": \"^2.0.0\",\n        \"path-exists\": \"^3.0.0\"\n      },\n      \"engines\": {\n        \"node\": \">=4\"\n      }\n    },\n    \"node_modules/pkg-conf/node_modules/p-limit\": {\n      \"version\": \"1.3.0\",\n      \"resolved\": \"https://registry.npmjs.org/p-limit/-/p-limit-1.3.0.tgz\",\n      \"integrity\": \"sha512-vvcXsLAJ9Dr5rQOPk7toZQZJApBl2K4J6dANSsEuh6QI41JYcsS/qhTGa9ErIUUgK3WNQoJYvylxvjqmiqEA9Q==\",\n      \"dev\": true,\n      \"dependencies\": {\n        \"p-try\": \"^1.0.0\"\n      },\n      \"engines\": {\n        \"node\": \">=4\"\n      }\n    },\n    \"node_modules/pkg-conf/node_modules/p-locate\": {\n      \"version\": \"2.0.0\",\n      \"resolved\": \"https://registry.npmjs.org/p-locate/-/p-locate-2.0.0.tgz\",\n      \"integrity\": \"sha1-IKAQOyIqcMj9OcwuWAaA893l7EM=\",\n      \"dev\": true,\n      \"dependencies\": {\n        \"p-limit\": \"^1.1.0\"\n      },\n      \"engines\": {\n        \"node\": \">=4\"\n      }\n    },\n    \"node_modules/pkg-conf/node_modules/p-try\": {\n      \"version\": \"1.0.0\",\n      \"resolved\": \"https://registry.npmjs.org/p-try/-/p-try-1.0.0.tgz\",\n      \"integrity\": \"sha1-y8ec26+P1CKOE/Yh8rGiN8GyB7M=\",\n      \"dev\": true,\n      \"engines\": {\n        \"node\": \">=4\"\n      }\n    },\n    \"node_modules/pkg-config\": {\n      \"version\": \"1.1.1\",\n      \"resolved\": \"https://registry.npmjs.org/pkg-config/-/pkg-config-1.1.1.tgz\",\n      \"integrity\": \"sha1-VX7yLXPaPIg3EHdmxS6tq94pj+Q=\",\n      \"dev\": true,\n      \"dependencies\": {\n        \"debug-log\": \"^1.0.0\",\n        \"find-root\": \"^1.0.0\",\n        \"xtend\": \"^4.0.1\"\n      },\n      \"engines\": {\n        \"node\": \">=0.10\"\n      }\n    },\n    \"node_modules/pkg-dir\": {\n      \"version\": \"3.0.0\",\n      \"resolved\": \"https://registry.npmjs.org/pkg-dir/-/pkg-dir-3.0.0.tgz\",\n      \"integrity\": \"sha512-/E57AYkoeQ25qkxMj5PBOVgF8Kiu/h7cYS30Z5+R7WaiCCBfLq58ZI/dSeaEKb9WVJV5n/03QwrN3IeWIFllvw==\",\n      \"dev\": true,\n      \"dependencies\": {\n        \"find-up\": \"^3.0.0\"\n      },\n      \"engines\": {\n        \"node\": \">=6\"\n      }\n    },\n    \"node_modules/please-upgrade-node\": {\n      \"version\": \"3.1.1\",\n      \"resolved\": \"https://registry.npmjs.org/please-upgrade-node/-/please-upgrade-node-3.1.1.tgz\",\n      \"integrity\": \"sha512-KY1uHnQ2NlQHqIJQpnh/i54rKkuxCEBx+voJIS/Mvb+L2iYd2NMotwduhKTMjfC1uKoX3VXOxLjIYG66dfJTVQ==\",\n      \"dev\": true,\n      \"dependencies\": {\n        \"semver-compare\": \"^1.0.0\"\n      }\n    },\n    \"node_modules/pluralize\": {\n      \"version\": \"7.0.0\",\n      \"resolved\": \"https://registry.npmjs.org/pluralize/-/pluralize-7.0.0.tgz\",\n      \"integrity\": \"sha512-ARhBOdzS3e41FbkW/XWrTEtukqqLoK5+Z/4UeDaLuSW+39JPeFgs4gCGqsrJHVZX0fUrx//4OF0K1CUGwlIFow==\",\n      \"dev\": true,\n      \"engines\": {\n        \"node\": \">=4\"\n      }\n    },\n    \"node_modules/portfinder\": {\n      \"version\": \"1.0.20\",\n      \"resolved\": \"https://registry.npmjs.org/portfinder/-/portfinder-1.0.20.tgz\",\n      \"integrity\": \"sha512-Yxe4mTyDzTd59PZJY4ojZR8F+E5e97iq2ZOHPz3HDgSvYC5siNad2tLooQ5y5QHyQhc3xVqvyk/eNA3wuoa7Sw==\",\n      \"dev\": true,\n      \"dependencies\": {\n        \"async\": \"^1.5.2\",\n        \"debug\": \"^2.2.0\",\n        \"mkdirp\": \"0.5.x\"\n      },\n      \"engines\": {\n        \"node\": \">= 0.12.0\"\n      }\n    },\n    \"node_modules/portfinder/node_modules/debug\": {\n      \"version\": \"2.6.9\",\n      \"resolved\": \"https://registry.npmjs.org/debug/-/debug-2.6.9.tgz\",\n      \"integrity\": \"sha512-bC7ElrdJaJnPbAP+1EotYvqZsb3ecl5wi6Bfi6BJTUcNowp6cvspg0jXznRTKDjm/E7AdgFBVeAPVMNcKGsHMA==\",\n      \"dev\": true,\n      \"dependencies\": {\n        \"ms\": \"2.0.0\"\n      }\n    },\n    \"node_modules/portfinder/node_modules/ms\": {\n      \"version\": \"2.0.0\",\n      \"resolved\": \"https://registry.npmjs.org/ms/-/ms-2.0.0.tgz\",\n      \"integrity\": \"sha1-VgiurfwAvmwpAd9fmGF4jeDVl8g=\",\n      \"dev\": true\n    },\n    \"node_modules/posix-character-classes\": {\n      \"version\": \"0.1.1\",\n      \"resolved\": \"https://registry.npmjs.org/posix-character-classes/-/posix-character-classes-0.1.1.tgz\",\n      \"integrity\": \"sha1-AerA/jta9xoqbAL+q7jB/vfgDqs=\",\n      \"dev\": true,\n      \"engines\": {\n        \"node\": \">=0.10.0\"\n      }\n    },\n    \"node_modules/prelude-ls\": {\n      \"version\": \"1.1.2\",\n      \"resolved\": \"https://registry.npmjs.org/prelude-ls/-/prelude-ls-1.1.2.tgz\",\n      \"integrity\": \"sha1-IZMqVJ9eUv/ZqCf1cOBL5iqX2lQ=\",\n      \"dev\": true,\n      \"engines\": {\n        \"node\": \">= 0.8.0\"\n      }\n    },\n    \"node_modules/prettier\": {\n      \"version\": \"1.15.2\",\n      \"resolved\": \"https://registry.npmjs.org/prettier/-/prettier-1.15.2.tgz\",\n      \"integrity\": \"sha512-YgPLFFA0CdKL4Eg2IHtUSjzj/BWgszDHiNQAe0VAIBse34148whfdzLagRL+QiKS+YfK5ftB6X4v/MBw8yCoug==\",\n      \"dev\": true,\n      \"bin\": {\n        \"prettier\": \"bin-prettier.js\"\n      },\n      \"engines\": {\n        \"node\": \">=4\"\n      }\n    },\n    \"node_modules/pretty-format\": {\n      \"version\": \"23.6.0\",\n      \"resolved\": \"https://registry.npmjs.org/pretty-format/-/pretty-format-23.6.0.tgz\",\n      \"integrity\": \"sha512-zf9NV1NSlDLDjycnwm6hpFATCGl/K1lt0R/GdkAK2O5LN/rwJoB+Mh93gGJjut4YbmecbfgLWVGSTCr0Ewvvbw==\",\n      \"dev\": true,\n      \"dependencies\": {\n        \"ansi-regex\": \"^3.0.0\",\n        \"ansi-styles\": \"^3.2.0\"\n      }\n    },\n    \"node_modules/pretty-format/node_modules/ansi-regex\": {\n      \"version\": \"3.0.0\",\n      \"resolved\": \"https://registry.npmjs.org/ansi-regex/-/ansi-regex-3.0.0.tgz\",\n      \"integrity\": \"sha1-7QMXwyIGT3lGbAKWa922Bas32Zg=\",\n      \"dev\": true,\n      \"engines\": {\n        \"node\": \">=4\"\n      }\n    },\n    \"node_modules/pretty-format/node_modules/ansi-styles\": {\n      \"version\": \"3.2.1\",\n      \"resolved\": \"https://registry.npmjs.org/ansi-styles/-/ansi-styles-3.2.1.tgz\",\n      \"integrity\": \"sha512-VT0ZI6kZRdTh8YyJw3SMbYm/u+NqfsAxEpWO0Pf9sq8/e94WxxOpPKx9FR1FlyCtOVDNOQ+8ntlqFxiRc+r5qA==\",\n      \"dev\": true,\n      \"dependencies\": {\n        \"color-convert\": \"^1.9.0\"\n      },\n      \"engines\": {\n        \"node\": \">=4\"\n      }\n    },\n    \"node_modules/progress\": {\n      \"version\": \"2.0.3\",\n      \"resolved\": \"https://registry.npmjs.org/progress/-/progress-2.0.3.tgz\",\n      \"integrity\": \"sha512-7PiHtLll5LdnKIMw100I+8xJXR5gW2QwWYkT6iJva0bXitZKa/XMrSbdmg3r2Xnaidz9Qumd0VPaMrZlF9V9sA==\",\n      \"dev\": true,\n      \"engines\": {\n        \"node\": \">=0.4.0\"\n      }\n    },\n    \"node_modules/prop-types\": {\n      \"version\": \"15.7.2\",\n      \"resolved\": \"https://registry.npmjs.org/prop-types/-/prop-types-15.7.2.tgz\",\n      \"integrity\": \"sha512-8QQikdH7//R2vurIJSutZ1smHYTcLpRWEOlHnzcWHmBYrOGUysKwSsrC89BCiFj3CbrfJ/nXFdJepOVrY1GCHQ==\",\n      \"dev\": true,\n      \"dependencies\": {\n        \"loose-envify\": \"^1.4.0\",\n        \"object-assign\": \"^4.1.1\",\n        \"react-is\": \"^16.8.1\"\n      }\n    },\n    \"node_modules/pump\": {\n      \"version\": \"3.0.0\",\n      \"resolved\": \"https://registry.npmjs.org/pump/-/pump-3.0.0.tgz\",\n      \"integrity\": \"sha512-LwZy+p3SFs1Pytd/jYct4wpv49HiYCqd9Rlc5ZVdk0V+8Yzv6jR5Blk3TRmPL1ft69TxP0IMZGJ+WPFU2BFhww==\",\n      \"dev\": true,\n      \"dependencies\": {\n        \"end-of-stream\": \"^1.1.0\",\n        \"once\": \"^1.3.1\"\n      }\n    },\n    \"node_modules/punycode\": {\n      \"version\": \"2.1.1\",\n      \"resolved\": \"https://registry.npmjs.org/punycode/-/punycode-2.1.1.tgz\",\n      \"integrity\": \"sha512-XRsRjdf+j5ml+y/6GKHPZbrF/8p2Yga0JPtdqTIY2Xe5ohJPD9saDJJLPvp9+NSBprVvevdXZybnj2cv8OEd0A==\",\n      \"dev\": true,\n      \"engines\": {\n        \"node\": \">=6\"\n      }\n    },\n    \"node_modules/qs\": {\n      \"version\": \"2.3.3\",\n      \"resolved\": \"https://registry.npmjs.org/qs/-/qs-2.3.3.tgz\",\n      \"integrity\": \"sha1-6eha2+ddoLvkyOBHaghikPhjtAQ=\",\n      \"dev\": true\n    },\n    \"node_modules/react-is\": {\n      \"version\": \"16.8.6\",\n      \"resolved\": \"https://registry.npmjs.org/react-is/-/react-is-16.8.6.tgz\",\n      \"integrity\": \"sha512-aUk3bHfZ2bRSVFFbbeVS4i+lNPZr3/WM5jT2J5omUVV1zzcs1nAaf3l51ctA5FFvCRbhrH0bdAsRRQddFJZPtA==\",\n      \"dev\": true\n    },\n    \"node_modules/read-pkg\": {\n      \"version\": \"4.0.1\",\n      \"resolved\": \"https://registry.npmjs.org/read-pkg/-/read-pkg-4.0.1.tgz\",\n      \"integrity\": \"sha1-ljYlN48+HE1IyFhytabsfV0JMjc=\",\n      \"dev\": true,\n      \"dependencies\": {\n        \"normalize-package-data\": \"^2.3.2\",\n        \"parse-json\": \"^4.0.0\",\n        \"pify\": \"^3.0.0\"\n      },\n      \"engines\": {\n        \"node\": \">=6\"\n      }\n    },\n    \"node_modules/read-pkg-up\": {\n      \"version\": \"2.0.0\",\n      \"resolved\": \"https://registry.npmjs.org/read-pkg-up/-/read-pkg-up-2.0.0.tgz\",\n      \"integrity\": \"sha1-a3KoBImE4MQeeVEP1en6mbO1Sb4=\",\n      \"dev\": true,\n      \"dependencies\": {\n        \"find-up\": \"^2.0.0\",\n        \"read-pkg\": \"^2.0.0\"\n      },\n      \"engines\": {\n        \"node\": \">=4\"\n      }\n    },\n    \"node_modules/read-pkg-up/node_modules/find-up\": {\n      \"version\": \"2.1.0\",\n      \"resolved\": \"https://registry.npmjs.org/find-up/-/find-up-2.1.0.tgz\",\n      \"integrity\": \"sha1-RdG35QbHF93UgndaK3eSCjwMV6c=\",\n      \"dev\": true,\n      \"dependencies\": {\n        \"locate-path\": \"^2.0.0\"\n      },\n      \"engines\": {\n        \"node\": \">=4\"\n      }\n    },\n    \"node_modules/read-pkg-up/node_modules/locate-path\": {\n      \"version\": \"2.0.0\",\n      \"resolved\": \"https://registry.npmjs.org/locate-path/-/locate-path-2.0.0.tgz\",\n      \"integrity\": \"sha1-K1aLJl7slExtnA3pw9u7ygNUzY4=\",\n      \"dev\": true,\n      \"dependencies\": {\n        \"p-locate\": \"^2.0.0\",\n        \"path-exists\": \"^3.0.0\"\n      },\n      \"engines\": {\n        \"node\": \">=4\"\n      }\n    },\n    \"node_modules/read-pkg-up/node_modules/p-limit\": {\n      \"version\": \"1.3.0\",\n      \"resolved\": \"https://registry.npmjs.org/p-limit/-/p-limit-1.3.0.tgz\",\n      \"integrity\": \"sha512-vvcXsLAJ9Dr5rQOPk7toZQZJApBl2K4J6dANSsEuh6QI41JYcsS/qhTGa9ErIUUgK3WNQoJYvylxvjqmiqEA9Q==\",\n      \"dev\": true,\n      \"dependencies\": {\n        \"p-try\": \"^1.0.0\"\n      },\n      \"engines\": {\n        \"node\": \">=4\"\n      }\n    },\n    \"node_modules/read-pkg-up/node_modules/p-locate\": {\n      \"version\": \"2.0.0\",\n      \"resolved\": \"https://registry.npmjs.org/p-locate/-/p-locate-2.0.0.tgz\",\n      \"integrity\": \"sha1-IKAQOyIqcMj9OcwuWAaA893l7EM=\",\n      \"dev\": true,\n      \"dependencies\": {\n        \"p-limit\": \"^1.1.0\"\n      },\n      \"engines\": {\n        \"node\": \">=4\"\n      }\n    },\n    \"node_modules/read-pkg-up/node_modules/p-try\": {\n      \"version\": \"1.0.0\",\n      \"resolved\": \"https://registry.npmjs.org/p-try/-/p-try-1.0.0.tgz\",\n      \"integrity\": \"sha1-y8ec26+P1CKOE/Yh8rGiN8GyB7M=\",\n      \"dev\": true,\n      \"engines\": {\n        \"node\": \">=4\"\n      }\n    },\n    \"node_modules/read-pkg-up/node_modules/read-pkg\": {\n      \"version\": \"2.0.0\",\n      \"resolved\": \"https://registry.npmjs.org/read-pkg/-/read-pkg-2.0.0.tgz\",\n      \"integrity\": \"sha1-jvHAYjxqbbDcZxPEv6xGMysjaPg=\",\n      \"dev\": true,\n      \"dependencies\": {\n        \"load-json-file\": \"^2.0.0\",\n        \"normalize-package-data\": \"^2.3.2\",\n        \"path-type\": \"^2.0.0\"\n      },\n      \"engines\": {\n        \"node\": \">=4\"\n      }\n    },\n    \"node_modules/regex-not\": {\n      \"version\": \"1.0.2\",\n      \"resolved\": \"https://registry.npmjs.org/regex-not/-/regex-not-1.0.2.tgz\",\n      \"integrity\": \"sha512-J6SDjUgDxQj5NusnOtdFxDwN/+HWykR8GELwctJ7mdqhcyy1xEc4SRFHUXvxTp661YaVKAjfRLZ9cCqS6tn32A==\",\n      \"dev\": true,\n      \"dependencies\": {\n        \"extend-shallow\": \"^3.0.2\",\n        \"safe-regex\": \"^1.1.0\"\n      },\n      \"engines\": {\n        \"node\": \">=0.10.0\"\n      }\n    },\n    \"node_modules/regexpp\": {\n      \"version\": \"2.0.1\",\n      \"resolved\": \"https://registry.npmjs.org/regexpp/-/regexpp-2.0.1.tgz\",\n      \"integrity\": \"sha512-lv0M6+TkDVniA3aD1Eg0DVpfU/booSu7Eev3TDO/mZKHBfVjgCGTV4t4buppESEYDtkArYFOxTJWv6S5C+iaNw==\",\n      \"dev\": true,\n      \"engines\": {\n        \"node\": \">=6.5.0\"\n      }\n    },\n    \"node_modules/repeat-element\": {\n      \"version\": \"1.1.3\",\n      \"resolved\": \"https://registry.npmjs.org/repeat-element/-/repeat-element-1.1.3.tgz\",\n      \"integrity\": \"sha512-ahGq0ZnV5m5XtZLMb+vP76kcAM5nkLqk0lpqAuojSKGgQtn4eRi4ZZGm2olo2zKFH+sMsWaqOCW1dqAnOru72g==\",\n      \"dev\": true,\n      \"engines\": {\n        \"node\": \">=0.10.0\"\n      }\n    },\n    \"node_modules/repeat-string\": {\n      \"version\": \"1.6.1\",\n      \"resolved\": \"https://registry.npmjs.org/repeat-string/-/repeat-string-1.6.1.tgz\",\n      \"integrity\": \"sha1-jcrkcOHIirwtYA//Sndihtp15jc=\",\n      \"dev\": true,\n      \"engines\": {\n        \"node\": \">=0.10\"\n      }\n    },\n    \"node_modules/require-uncached\": {\n      \"version\": \"1.0.3\",\n      \"resolved\": \"https://registry.npmjs.org/require-uncached/-/require-uncached-1.0.3.tgz\",\n      \"integrity\": \"sha1-Tg1W1slmL9MeQwEcS5WqSZVUIdM=\",\n      \"dev\": true,\n      \"dependencies\": {\n        \"caller-path\": \"^0.1.0\",\n        \"resolve-from\": \"^1.0.0\"\n      },\n      \"engines\": {\n        \"node\": \">=0.10.0\"\n      }\n    },\n    \"node_modules/require-uncached/node_modules/caller-path\": {\n      \"version\": \"0.1.0\",\n      \"resolved\": \"https://registry.npmjs.org/caller-path/-/caller-path-0.1.0.tgz\",\n      \"integrity\": \"sha1-lAhe9jWB7NPaqSREqP6U6CV3dR8=\",\n      \"dev\": true,\n      \"dependencies\": {\n        \"callsites\": \"^0.2.0\"\n      },\n      \"engines\": {\n        \"node\": \">=0.10.0\"\n      }\n    },\n    \"node_modules/require-uncached/node_modules/callsites\": {\n      \"version\": \"0.2.0\",\n      \"resolved\": \"https://registry.npmjs.org/callsites/-/callsites-0.2.0.tgz\",\n      \"integrity\": \"sha1-r6uWJikQp/M8GaV3WCXGnzTjUMo=\",\n      \"dev\": true,\n      \"engines\": {\n        \"node\": \">=0.10.0\"\n      }\n    },\n    \"node_modules/require-uncached/node_modules/resolve-from\": {\n      \"version\": \"1.0.1\",\n      \"resolved\": \"https://registry.npmjs.org/resolve-from/-/resolve-from-1.0.1.tgz\",\n      \"integrity\": \"sha1-Jsv+k10a7uq7Kbw/5a6wHpPUQiY=\",\n      \"dev\": true,\n      \"engines\": {\n        \"node\": \">=0.10.0\"\n      }\n    },\n    \"node_modules/requires-port\": {\n      \"version\": \"1.0.0\",\n      \"resolved\": \"https://registry.npmjs.org/requires-port/-/requires-port-1.0.0.tgz\",\n      \"integrity\": \"sha1-kl0mAdOaxIXgkc8NpcbmlNw9yv8=\",\n      \"dev\": true\n    },\n    \"node_modules/resolve\": {\n      \"version\": \"1.11.0\",\n      \"resolved\": \"https://registry.npmjs.org/resolve/-/resolve-1.11.0.tgz\",\n      \"integrity\": \"sha512-WL2pBDjqT6pGUNSUzMw00o4T7If+z4H2x3Gz893WoUQ5KW8Vr9txp00ykiP16VBaZF5+j/OcXJHZ9+PCvdiDKw==\",\n      \"dev\": true,\n      \"dependencies\": {\n        \"path-parse\": \"^1.0.6\"\n      }\n    },\n    \"node_modules/resolve-from\": {\n      \"version\": \"3.0.0\",\n      \"resolved\": \"https://registry.npmjs.org/resolve-from/-/resolve-from-3.0.0.tgz\",\n      \"integrity\": \"sha1-six699nWiBvItuZTM17rywoYh0g=\",\n      \"dev\": true,\n      \"engines\": {\n        \"node\": \">=4\"\n      }\n    },\n    \"node_modules/resolve-url\": {\n      \"version\": \"0.2.1\",\n      \"resolved\": \"https://registry.npmjs.org/resolve-url/-/resolve-url-0.2.1.tgz\",\n      \"integrity\": \"sha1-LGN/53yJOv0qZj/iGqkIAGjiBSo=\",\n      \"deprecated\": \"https://github.com/lydell/resolve-url#deprecated\",\n      \"dev\": true\n    },\n    \"node_modules/restore-cursor\": {\n      \"version\": \"2.0.0\",\n      \"resolved\": \"https://registry.npmjs.org/restore-cursor/-/restore-cursor-2.0.0.tgz\",\n      \"integrity\": \"sha1-n37ih/gv0ybU/RYpI9YhKe7g368=\",\n      \"dev\": true,\n      \"dependencies\": {\n        \"onetime\": \"^2.0.0\",\n        \"signal-exit\": \"^3.0.2\"\n      },\n      \"engines\": {\n        \"node\": \">=4\"\n      }\n    },\n    \"node_modules/ret\": {\n      \"version\": \"0.1.15\",\n      \"resolved\": \"https://registry.npmjs.org/ret/-/ret-0.1.15.tgz\",\n      \"integrity\": \"sha512-TTlYpa+OL+vMMNG24xSlQGEJ3B/RzEfUlLct7b5G/ytav+wPrplCpVMFuwzXbkecJrb6IYo1iFb0S9v37754mg==\",\n      \"dev\": true,\n      \"engines\": {\n        \"node\": \">=0.12\"\n      }\n    },\n    \"node_modules/rimraf\": {\n      \"version\": \"2.6.3\",\n      \"resolved\": \"https://registry.npmjs.org/rimraf/-/rimraf-2.6.3.tgz\",\n      \"integrity\": \"sha512-mwqeW5XsA2qAejG46gYdENaxXjx9onRNCfn7L0duuP4hCuTIi/QO7PDK07KJfp1d+izWPrzEJDcSqBa0OZQriA==\",\n      \"dev\": true,\n      \"dependencies\": {\n        \"glob\": \"^7.1.3\"\n      },\n      \"bin\": {\n        \"rimraf\": \"bin.js\"\n      }\n    },\n    \"node_modules/run-async\": {\n      \"version\": \"2.3.0\",\n      \"resolved\": \"https://registry.npmjs.org/run-async/-/run-async-2.3.0.tgz\",\n      \"integrity\": \"sha1-A3GrSuC91yDUFm19/aZP96RFpsA=\",\n      \"dev\": true,\n      \"dependencies\": {\n        \"is-promise\": \"^2.1.0\"\n      },\n      \"engines\": {\n        \"node\": \">=0.12.0\"\n      }\n    },\n    \"node_modules/run-node\": {\n      \"version\": \"1.0.0\",\n      \"resolved\": \"https://registry.npmjs.org/run-node/-/run-node-1.0.0.tgz\",\n      \"integrity\": \"sha512-kc120TBlQ3mih1LSzdAJXo4xn/GWS2ec0l3S+syHDXP9uRr0JAT8Qd3mdMuyjqCzeZktgP3try92cEgf9Nks8A==\",\n      \"dev\": true,\n      \"bin\": {\n        \"run-node\": \"run-node\"\n      },\n      \"engines\": {\n        \"node\": \">=4\"\n      }\n    },\n    \"node_modules/run-parallel\": {\n      \"version\": \"1.1.9\",\n      \"resolved\": \"https://registry.npmjs.org/run-parallel/-/run-parallel-1.1.9.tgz\",\n      \"integrity\": \"sha512-DEqnSRTDw/Tc3FXf49zedI638Z9onwUotBMiUFKmrO2sdFKIbXamXGQ3Axd4qgphxKB4kw/qP1w5kTxnfU1B9Q==\",\n      \"dev\": true\n    },\n    \"node_modules/rxjs\": {\n      \"version\": \"6.5.2\",\n      \"resolved\": \"https://registry.npmjs.org/rxjs/-/rxjs-6.5.2.tgz\",\n      \"integrity\": \"sha512-HUb7j3kvb7p7eCUHE3FqjoDsC1xfZQ4AHFWfTKSpZ+sAhhz5X1WX0ZuUqWbzB2QhSLp3DoLUG+hMdEDKqWo2Zg==\",\n      \"dev\": true,\n      \"dependencies\": {\n        \"tslib\": \"^1.9.0\"\n      },\n      \"engines\": {\n        \"npm\": \">=2.0.0\"\n      }\n    },\n    \"node_modules/safe-regex\": {\n      \"version\": \"1.1.0\",\n      \"resolved\": \"https://registry.npmjs.org/safe-regex/-/safe-regex-1.1.0.tgz\",\n      \"integrity\": \"sha1-QKNmnzsHfR6UPURinhV91IAjvy4=\",\n      \"dev\": true,\n      \"dependencies\": {\n        \"ret\": \"~0.1.10\"\n      }\n    },\n    \"node_modules/safer-buffer\": {\n      \"version\": \"2.1.2\",\n      \"resolved\": \"https://registry.npmjs.org/safer-buffer/-/safer-buffer-2.1.2.tgz\",\n      \"integrity\": \"sha512-YZo3K82SD7Riyi0E1EQPojLz7kpepnSQI9IyPbHHg1XXXevb5dJI7tpyN2ADxGcQbHG7vcyRHk0cbwqcQriUtg==\",\n      \"dev\": true\n    },\n    \"node_modules/semver\": {\n      \"version\": \"5.7.0\",\n      \"resolved\": \"https://registry.npmjs.org/semver/-/semver-5.7.0.tgz\",\n      \"integrity\": \"sha512-Ya52jSX2u7QKghxeoFGpLwCtGlt7j0oY9DYb5apt9nPlJ42ID+ulTXESnt/qAQcoSERyZ5sl3LDIOw0nAn/5DA==\",\n      \"dev\": true,\n      \"bin\": {\n        \"semver\": \"bin/semver\"\n      }\n    },\n    \"node_modules/semver-compare\": {\n      \"version\": \"1.0.0\",\n      \"resolved\": \"https://registry.npmjs.org/semver-compare/-/semver-compare-1.0.0.tgz\",\n      \"integrity\": \"sha1-De4hahyUGrN+nvsXiPavxf9VN/w=\",\n      \"dev\": true\n    },\n    \"node_modules/set-value\": {\n      \"version\": \"2.0.1\",\n      \"resolved\": \"https://registry.npmjs.org/set-value/-/set-value-2.0.1.tgz\",\n      \"integrity\": \"sha512-JxHc1weCN68wRY0fhCoXpyK55m/XPHafOmK4UWD7m2CI14GMcFypt4w/0+NV5f/ZMby2F6S2wwA7fgynh9gWSw==\",\n      \"dev\": true,\n      \"dependencies\": {\n        \"extend-shallow\": \"^2.0.1\",\n        \"is-extendable\": \"^0.1.1\",\n        \"is-plain-object\": \"^2.0.3\",\n        \"split-string\": \"^3.0.1\"\n      },\n      \"engines\": {\n        \"node\": \">=0.10.0\"\n      }\n    },\n    \"node_modules/set-value/node_modules/extend-shallow\": {\n      \"version\": \"2.0.1\",\n      \"resolved\": \"https://registry.npmjs.org/extend-shallow/-/extend-shallow-2.0.1.tgz\",\n      \"integrity\": \"sha1-Ua99YUrZqfYQ6huvu5idaxxWiQ8=\",\n      \"dev\": true,\n      \"dependencies\": {\n        \"is-extendable\": \"^0.1.0\"\n      },\n      \"engines\": {\n        \"node\": \">=0.10.0\"\n      }\n    },\n    \"node_modules/shebang-command\": {\n      \"version\": \"1.2.0\",\n      \"resolved\": \"https://registry.npmjs.org/shebang-command/-/shebang-command-1.2.0.tgz\",\n      \"integrity\": \"sha1-RKrGW2lbAzmJaMOfNj/uXer98eo=\",\n      \"dev\": true,\n      \"dependencies\": {\n        \"shebang-regex\": \"^1.0.0\"\n      },\n      \"engines\": {\n        \"node\": \">=0.10.0\"\n      }\n    },\n    \"node_modules/shebang-regex\": {\n      \"version\": \"1.0.0\",\n      \"resolved\": \"https://registry.npmjs.org/shebang-regex/-/shebang-regex-1.0.0.tgz\",\n      \"integrity\": \"sha1-2kL0l0DAtC2yypcoVxyxkMmO/qM=\",\n      \"dev\": true,\n      \"engines\": {\n        \"node\": \">=0.10.0\"\n      }\n    },\n    \"node_modules/signal-exit\": {\n      \"version\": \"3.0.2\",\n      \"resolved\": \"https://registry.npmjs.org/signal-exit/-/signal-exit-3.0.2.tgz\",\n      \"integrity\": \"sha1-tf3AjxKH6hF4Yo5BXiUTK3NkbG0=\",\n      \"dev\": true\n    },\n    \"node_modules/simple-git\": {\n      \"version\": \"1.115.0\",\n      \"resolved\": \"https://registry.npmjs.org/simple-git/-/simple-git-1.115.0.tgz\",\n      \"integrity\": \"sha512-PXcDVDgXifUE7/M2xUfQQ8uG3r73+kYRyPmsbc/iWwUrPbOASHt8p+HEbu85k546qmXixbcSPDg83kegw1vqcA==\",\n      \"dev\": true,\n      \"dependencies\": {\n        \"debug\": \"^4.0.1\"\n      }\n    },\n    \"node_modules/simple-git/node_modules/debug\": {\n      \"version\": \"4.1.1\",\n      \"resolved\": \"https://registry.npmjs.org/debug/-/debug-4.1.1.tgz\",\n      \"integrity\": \"sha512-pYAIzeRo8J6KPEaJ0VWOh5Pzkbw/RetuzehGM7QRRX5he4fPHx2rdKMB256ehJCkX+XRQm16eZLqLNS8RSZXZw==\",\n      \"deprecated\": \"Debug versions >=3.2.0 <3.2.7 || >=4 <4.3.1 have a low-severity ReDos regression when used in a Node.js environment. It is recommended you upgrade to 3.2.7 or 4.3.1. (https://github.com/visionmedia/debug/issues/797)\",\n      \"dev\": true,\n      \"dependencies\": {\n        \"ms\": \"^2.1.1\"\n      }\n    },\n    \"node_modules/slash\": {\n      \"version\": \"2.0.0\",\n      \"resolved\": \"https://registry.npmjs.org/slash/-/slash-2.0.0.tgz\",\n      \"integrity\": \"sha512-ZYKh3Wh2z1PpEXWr0MpSBZ0V6mZHAQfYevttO11c51CaWjGTaadiKZ+wVt1PbMlDV5qhMFslpZCemhwOK7C89A==\",\n      \"dev\": true,\n      \"engines\": {\n        \"node\": \">=6\"\n      }\n    },\n    \"node_modules/slice-ansi\": {\n      \"version\": \"0.0.4\",\n      \"resolved\": \"https://registry.npmjs.org/slice-ansi/-/slice-ansi-0.0.4.tgz\",\n      \"integrity\": \"sha1-7b+JA/ZvfOL46v1s7tZeJkyDGzU=\",\n      \"dev\": true,\n      \"engines\": {\n        \"node\": \">=0.10.0\"\n      }\n    },\n    \"node_modules/snapdragon\": {\n      \"version\": \"0.8.2\",\n      \"resolved\": \"https://registry.npmjs.org/snapdragon/-/snapdragon-0.8.2.tgz\",\n      \"integrity\": \"sha512-FtyOnWN/wCHTVXOMwvSv26d+ko5vWlIDD6zoUJ7LW8vh+ZBC8QdljveRP+crNrtBwioEUWy/4dMtbBjA4ioNlg==\",\n      \"dev\": true,\n      \"dependencies\": {\n        \"base\": \"^0.11.1\",\n        \"debug\": \"^2.2.0\",\n        \"define-property\": \"^0.2.5\",\n        \"extend-shallow\": \"^2.0.1\",\n        \"map-cache\": \"^0.2.2\",\n        \"source-map\": \"^0.5.6\",\n        \"source-map-resolve\": \"^0.5.0\",\n        \"use\": \"^3.1.0\"\n      },\n      \"engines\": {\n        \"node\": \">=0.10.0\"\n      }\n    },\n    \"node_modules/snapdragon-node\": {\n      \"version\": \"2.1.1\",\n      \"resolved\": \"https://registry.npmjs.org/snapdragon-node/-/snapdragon-node-2.1.1.tgz\",\n      \"integrity\": \"sha512-O27l4xaMYt/RSQ5TR3vpWCAB5Kb/czIcqUFOM/C4fYcLnbZUc1PkjTAMjof2pBWaSTwOUd6qUHcFGVGj7aIwnw==\",\n      \"dev\": true,\n      \"dependencies\": {\n        \"define-property\": \"^1.0.0\",\n        \"isobject\": \"^3.0.0\",\n        \"snapdragon-util\": \"^3.0.1\"\n      },\n      \"engines\": {\n        \"node\": \">=0.10.0\"\n      }\n    },\n    \"node_modules/snapdragon-node/node_modules/define-property\": {\n      \"version\": \"1.0.0\",\n      \"resolved\": \"https://registry.npmjs.org/define-property/-/define-property-1.0.0.tgz\",\n      \"integrity\": \"sha1-dp66rz9KY6rTr56NMEybvnm/sOY=\",\n      \"dev\": true,\n      \"dependencies\": {\n        \"is-descriptor\": \"^1.0.0\"\n      },\n      \"engines\": {\n        \"node\": \">=0.10.0\"\n      }\n    },\n    \"node_modules/snapdragon-node/node_modules/is-accessor-descriptor\": {\n      \"version\": \"1.0.0\",\n      \"resolved\": \"https://registry.npmjs.org/is-accessor-descriptor/-/is-accessor-descriptor-1.0.0.tgz\",\n      \"integrity\": \"sha512-m5hnHTkcVsPfqx3AKlyttIPb7J+XykHvJP2B9bZDjlhLIoEq4XoK64Vg7boZlVWYK6LUY94dYPEE7Lh0ZkZKcQ==\",\n      \"deprecated\": \"Please upgrade to v1.0.1\",\n      \"dev\": true,\n      \"dependencies\": {\n        \"kind-of\": \"^6.0.0\"\n      },\n      \"engines\": {\n        \"node\": \">=0.10.0\"\n      }\n    },\n    \"node_modules/snapdragon-node/node_modules/is-data-descriptor\": {\n      \"version\": \"1.0.0\",\n      \"resolved\": \"https://registry.npmjs.org/is-data-descriptor/-/is-data-descriptor-1.0.0.tgz\",\n      \"integrity\": \"sha512-jbRXy1FmtAoCjQkVmIVYwuuqDFUbaOeDjmed1tOGPrsMhtJA4rD9tkgA0F1qJ3gRFRXcHYVkdeaP50Q5rE/jLQ==\",\n      \"deprecated\": \"Please upgrade to v1.0.1\",\n      \"dev\": true,\n      \"dependencies\": {\n        \"kind-of\": \"^6.0.0\"\n      },\n      \"engines\": {\n        \"node\": \">=0.10.0\"\n      }\n    },\n    \"node_modules/snapdragon-node/node_modules/is-descriptor\": {\n      \"version\": \"1.0.2\",\n      \"resolved\": \"https://registry.npmjs.org/is-descriptor/-/is-descriptor-1.0.2.tgz\",\n      \"integrity\": \"sha512-2eis5WqQGV7peooDyLmNEPUrps9+SXX5c9pL3xEB+4e9HnGuDa7mB7kHxHw4CbqS9k1T2hOH3miL8n8WtiYVtg==\",\n      \"dev\": true,\n      \"dependencies\": {\n        \"is-accessor-descriptor\": \"^1.0.0\",\n        \"is-data-descriptor\": \"^1.0.0\",\n        \"kind-of\": \"^6.0.2\"\n      },\n      \"engines\": {\n        \"node\": \">=0.10.0\"\n      }\n    },\n    \"node_modules/snapdragon-util\": {\n      \"version\": \"3.0.1\",\n      \"resolved\": \"https://registry.npmjs.org/snapdragon-util/-/snapdragon-util-3.0.1.tgz\",\n      \"integrity\": \"sha512-mbKkMdQKsjX4BAL4bRYTj21edOf8cN7XHdYUJEe+Zn99hVEYcMvKPct1IqNe7+AZPirn8BCDOQBHQZknqmKlZQ==\",\n      \"dev\": true,\n      \"dependencies\": {\n        \"kind-of\": \"^3.2.0\"\n      },\n      \"engines\": {\n        \"node\": \">=0.10.0\"\n      }\n    },\n    \"node_modules/snapdragon-util/node_modules/kind-of\": {\n      \"version\": \"3.2.2\",\n      \"resolved\": \"https://registry.npmjs.org/kind-of/-/kind-of-3.2.2.tgz\",\n      \"integrity\": \"sha1-MeohpzS6ubuw8yRm2JOupR5KPGQ=\",\n      \"dev\": true,\n      \"dependencies\": {\n        \"is-buffer\": \"^1.1.5\"\n      },\n      \"engines\": {\n        \"node\": \">=0.10.0\"\n      }\n    },\n    \"node_modules/snapdragon/node_modules/debug\": {\n      \"version\": \"2.6.9\",\n      \"resolved\": \"https://registry.npmjs.org/debug/-/debug-2.6.9.tgz\",\n      \"integrity\": \"sha512-bC7ElrdJaJnPbAP+1EotYvqZsb3ecl5wi6Bfi6BJTUcNowp6cvspg0jXznRTKDjm/E7AdgFBVeAPVMNcKGsHMA==\",\n      \"dev\": true,\n      \"dependencies\": {\n        \"ms\": \"2.0.0\"\n      }\n    },\n    \"node_modules/snapdragon/node_modules/define-property\": {\n      \"version\": \"0.2.5\",\n      \"resolved\": \"https://registry.npmjs.org/define-property/-/define-property-0.2.5.tgz\",\n      \"integrity\": \"sha1-w1se+RjsPJkPmlvFe+BKrOxcgRY=\",\n      \"dev\": true,\n      \"dependencies\": {\n        \"is-descriptor\": \"^0.1.0\"\n      },\n      \"engines\": {\n        \"node\": \">=0.10.0\"\n      }\n    },\n    \"node_modules/snapdragon/node_modules/extend-shallow\": {\n      \"version\": \"2.0.1\",\n      \"resolved\": \"https://registry.npmjs.org/extend-shallow/-/extend-shallow-2.0.1.tgz\",\n      \"integrity\": \"sha1-Ua99YUrZqfYQ6huvu5idaxxWiQ8=\",\n      \"dev\": true,\n      \"dependencies\": {\n        \"is-extendable\": \"^0.1.0\"\n      },\n      \"engines\": {\n        \"node\": \">=0.10.0\"\n      }\n    },\n    \"node_modules/snapdragon/node_modules/ms\": {\n      \"version\": \"2.0.0\",\n      \"resolved\": \"https://registry.npmjs.org/ms/-/ms-2.0.0.tgz\",\n      \"integrity\": \"sha1-VgiurfwAvmwpAd9fmGF4jeDVl8g=\",\n      \"dev\": true\n    },\n    \"node_modules/source-map\": {\n      \"version\": \"0.5.7\",\n      \"resolved\": \"https://registry.npmjs.org/source-map/-/source-map-0.5.7.tgz\",\n      \"integrity\": \"sha1-igOdLRAh0i0eoUyA2OpGi6LvP8w=\",\n      \"dev\": true,\n      \"engines\": {\n        \"node\": \">=0.10.0\"\n      }\n    },\n    \"node_modules/source-map-resolve\": {\n      \"version\": \"0.5.2\",\n      \"resolved\": \"https://registry.npmjs.org/source-map-resolve/-/source-map-resolve-0.5.2.tgz\",\n      \"integrity\": \"sha512-MjqsvNwyz1s0k81Goz/9vRBe9SZdB09Bdw+/zYyO+3CuPk6fouTaxscHkgtE8jKvf01kVfl8riHzERQ/kefaSA==\",\n      \"deprecated\": \"See https://github.com/lydell/source-map-resolve#deprecated\",\n      \"dev\": true,\n      \"dependencies\": {\n        \"atob\": \"^2.1.1\",\n        \"decode-uri-component\": \"^0.2.0\",\n        \"resolve-url\": \"^0.2.1\",\n        \"source-map-url\": \"^0.4.0\",\n        \"urix\": \"^0.1.0\"\n      }\n    },\n    \"node_modules/source-map-url\": {\n      \"version\": \"0.4.0\",\n      \"resolved\": \"https://registry.npmjs.org/source-map-url/-/source-map-url-0.4.0.tgz\",\n      \"integrity\": \"sha1-PpNdfd1zYxuXZZlW1VEo6HtQhKM=\",\n      \"deprecated\": \"See https://github.com/lydell/source-map-url#deprecated\",\n      \"dev\": true\n    },\n    \"node_modules/spdx-correct\": {\n      \"version\": \"3.1.0\",\n      \"resolved\": \"https://registry.npmjs.org/spdx-correct/-/spdx-correct-3.1.0.tgz\",\n      \"integrity\": \"sha512-lr2EZCctC2BNR7j7WzJ2FpDznxky1sjfxvvYEyzxNyb6lZXHODmEoJeFu4JupYlkfha1KZpJyoqiJ7pgA1qq8Q==\",\n      \"dev\": true,\n      \"dependencies\": {\n        \"spdx-expression-parse\": \"^3.0.0\",\n        \"spdx-license-ids\": \"^3.0.0\"\n      }\n    },\n    \"node_modules/spdx-exceptions\": {\n      \"version\": \"2.2.0\",\n      \"resolved\": \"https://registry.npmjs.org/spdx-exceptions/-/spdx-exceptions-2.2.0.tgz\",\n      \"integrity\": \"sha512-2XQACfElKi9SlVb1CYadKDXvoajPgBVPn/gOQLrTvHdElaVhr7ZEbqJaRnJLVNeaI4cMEAgVCeBMKF6MWRDCRA==\",\n      \"dev\": true\n    },\n    \"node_modules/spdx-expression-parse\": {\n      \"version\": \"3.0.0\",\n      \"resolved\": \"https://registry.npmjs.org/spdx-expression-parse/-/spdx-expression-parse-3.0.0.tgz\",\n      \"integrity\": \"sha512-Yg6D3XpRD4kkOmTpdgbUiEJFKghJH03fiC1OPll5h/0sO6neh2jqRDVHOQ4o/LMea0tgCkbMgea5ip/e+MkWyg==\",\n      \"dev\": true,\n      \"dependencies\": {\n        \"spdx-exceptions\": \"^2.1.0\",\n        \"spdx-license-ids\": \"^3.0.0\"\n      }\n    },\n    \"node_modules/spdx-license-ids\": {\n      \"version\": \"3.0.4\",\n      \"resolved\": \"https://registry.npmjs.org/spdx-license-ids/-/spdx-license-ids-3.0.4.tgz\",\n      \"integrity\": \"sha512-7j8LYJLeY/Yb6ACbQ7F76qy5jHkp0U6jgBfJsk97bwWlVUnUWsAgpyaCvo17h0/RQGnQ036tVDomiwoI4pDkQA==\",\n      \"dev\": true\n    },\n    \"node_modules/split-string\": {\n      \"version\": \"3.1.0\",\n      \"resolved\": \"https://registry.npmjs.org/split-string/-/split-string-3.1.0.tgz\",\n      \"integrity\": \"sha512-NzNVhJDYpwceVVii8/Hu6DKfD2G+NrQHlS/V/qgv763EYudVwEcMQNxd2lh+0VrUByXN/oJkl5grOhYWvQUYiw==\",\n      \"dev\": true,\n      \"dependencies\": {\n        \"extend-shallow\": \"^3.0.0\"\n      },\n      \"engines\": {\n        \"node\": \">=0.10.0\"\n      }\n    },\n    \"node_modules/sprintf-js\": {\n      \"version\": \"1.0.3\",\n      \"resolved\": \"https://registry.npmjs.org/sprintf-js/-/sprintf-js-1.0.3.tgz\",\n      \"integrity\": \"sha1-BOaSb2YolTVPPdAVIDYzuFcpfiw=\",\n      \"dev\": true\n    },\n    \"node_modules/staged-git-files\": {\n      \"version\": \"1.1.2\",\n      \"resolved\": \"https://registry.npmjs.org/staged-git-files/-/staged-git-files-1.1.2.tgz\",\n      \"integrity\": \"sha512-0Eyrk6uXW6tg9PYkhi/V/J4zHp33aNyi2hOCmhFLqLTIhbgqWn5jlSzI+IU0VqrZq6+DbHcabQl/WP6P3BG0QA==\",\n      \"dev\": true,\n      \"bin\": {\n        \"sgf\": \"bin/cli.js\"\n      }\n    },\n    \"node_modules/standard\": {\n      \"version\": \"12.0.1\",\n      \"resolved\": \"https://registry.npmjs.org/standard/-/standard-12.0.1.tgz\",\n      \"integrity\": \"sha512-UqdHjh87OG2gUrNCSM4QRLF5n9h3TFPwrCNyVlkqu31Hej0L/rc8hzKqVvkb2W3x0WMq7PzZdkLfEcBhVOR6lg==\",\n      \"dev\": true,\n      \"dependencies\": {\n        \"eslint\": \"~5.4.0\",\n        \"eslint-config-standard\": \"12.0.0\",\n        \"eslint-config-standard-jsx\": \"6.0.2\",\n        \"eslint-plugin-import\": \"~2.14.0\",\n        \"eslint-plugin-node\": \"~7.0.1\",\n        \"eslint-plugin-promise\": \"~4.0.0\",\n        \"eslint-plugin-react\": \"~7.11.1\",\n        \"eslint-plugin-standard\": \"~4.0.0\",\n        \"standard-engine\": \"~9.0.0\"\n      },\n      \"bin\": {\n        \"standard\": \"bin/cmd.js\"\n      },\n      \"engines\": {\n        \"node\": \">=4\"\n      }\n    },\n    \"node_modules/standard-engine\": {\n      \"version\": \"9.0.0\",\n      \"resolved\": \"https://registry.npmjs.org/standard-engine/-/standard-engine-9.0.0.tgz\",\n      \"integrity\": \"sha512-ZfNfCWZ2Xq67VNvKMPiVMKHnMdvxYzvZkf1AH8/cw2NLDBm5LRsxMqvEJpsjLI/dUosZ3Z1d6JlHDp5rAvvk2w==\",\n      \"dev\": true,\n      \"dependencies\": {\n        \"deglob\": \"^2.1.0\",\n        \"get-stdin\": \"^6.0.0\",\n        \"minimist\": \"^1.1.0\",\n        \"pkg-conf\": \"^2.0.0\"\n      }\n    },\n    \"node_modules/static-extend\": {\n      \"version\": \"0.1.2\",\n      \"resolved\": \"https://registry.npmjs.org/static-extend/-/static-extend-0.1.2.tgz\",\n      \"integrity\": \"sha1-YICcOcv/VTNyJv1eC1IPNB8ftcY=\",\n      \"dev\": true,\n      \"dependencies\": {\n        \"define-property\": \"^0.2.5\",\n        \"object-copy\": \"^0.1.0\"\n      },\n      \"engines\": {\n        \"node\": \">=0.10.0\"\n      }\n    },\n    \"node_modules/static-extend/node_modules/define-property\": {\n      \"version\": \"0.2.5\",\n      \"resolved\": \"https://registry.npmjs.org/define-property/-/define-property-0.2.5.tgz\",\n      \"integrity\": \"sha1-w1se+RjsPJkPmlvFe+BKrOxcgRY=\",\n      \"dev\": true,\n      \"dependencies\": {\n        \"is-descriptor\": \"^0.1.0\"\n      },\n      \"engines\": {\n        \"node\": \">=0.10.0\"\n      }\n    },\n    \"node_modules/string-argv\": {\n      \"version\": \"0.0.2\",\n      \"resolved\": \"https://registry.npmjs.org/string-argv/-/string-argv-0.0.2.tgz\",\n      \"integrity\": \"sha1-2sMECGkMIfPDYwo/86BYd73L1zY=\",\n      \"dev\": true,\n      \"engines\": {\n        \"node\": \">=0.6.19\"\n      }\n    },\n    \"node_modules/string-width\": {\n      \"version\": \"1.0.2\",\n      \"resolved\": \"https://registry.npmjs.org/string-width/-/string-width-1.0.2.tgz\",\n      \"integrity\": \"sha1-EYvfW4zcUaKn5w0hHgfisLmxB9M=\",\n      \"dev\": true,\n      \"dependencies\": {\n        \"code-point-at\": \"^1.0.0\",\n        \"is-fullwidth-code-point\": \"^1.0.0\",\n        \"strip-ansi\": \"^3.0.0\"\n      },\n      \"engines\": {\n        \"node\": \">=0.10.0\"\n      }\n    },\n    \"node_modules/stringify-object\": {\n      \"version\": \"3.3.0\",\n      \"resolved\": \"https://registry.npmjs.org/stringify-object/-/stringify-object-3.3.0.tgz\",\n      \"integrity\": \"sha512-rHqiFh1elqCQ9WPLIC8I0Q/g/wj5J1eMkyoiD6eoQApWHP0FtlK7rqnhmabL5VUY9JQCcqwwvlOaSuutekgyrw==\",\n      \"dev\": true,\n      \"dependencies\": {\n        \"get-own-enumerable-property-symbols\": \"^3.0.0\",\n        \"is-obj\": \"^1.0.1\",\n        \"is-regexp\": \"^1.0.0\"\n      },\n      \"engines\": {\n        \"node\": \">=4\"\n      }\n    },\n    \"node_modules/strip-ansi\": {\n      \"version\": \"3.0.1\",\n      \"resolved\": \"https://registry.npmjs.org/strip-ansi/-/strip-ansi-3.0.1.tgz\",\n      \"integrity\": \"sha1-ajhfuIU9lS1f8F0Oiq+UJ43GPc8=\",\n      \"dev\": true,\n      \"dependencies\": {\n        \"ansi-regex\": \"^2.0.0\"\n      },\n      \"engines\": {\n        \"node\": \">=0.10.0\"\n      }\n    },\n    \"node_modules/strip-bom\": {\n      \"version\": \"3.0.0\",\n      \"resolved\": \"https://registry.npmjs.org/strip-bom/-/strip-bom-3.0.0.tgz\",\n      \"integrity\": \"sha1-IzTBjpx1n3vdVv3vfprj1YjmjtM=\",\n      \"dev\": true,\n      \"engines\": {\n        \"node\": \">=4\"\n      }\n    },\n    \"node_modules/strip-eof\": {\n      \"version\": \"1.0.0\",\n      \"resolved\": \"https://registry.npmjs.org/strip-eof/-/strip-eof-1.0.0.tgz\",\n      \"integrity\": \"sha1-u0P/VZim6wXYm1n80SnJgzE2Br8=\",\n      \"dev\": true,\n      \"engines\": {\n        \"node\": \">=0.10.0\"\n      }\n    },\n    \"node_modules/strip-json-comments\": {\n      \"version\": \"2.0.1\",\n      \"resolved\": \"https://registry.npmjs.org/strip-json-comments/-/strip-json-comments-2.0.1.tgz\",\n      \"integrity\": \"sha1-PFMZQukIwml8DsNEhYwobHygpgo=\",\n      \"dev\": true,\n      \"engines\": {\n        \"node\": \">=0.10.0\"\n      }\n    },\n    \"node_modules/supports-color\": {\n      \"version\": \"2.0.0\",\n      \"resolved\": \"https://registry.npmjs.org/supports-color/-/supports-color-2.0.0.tgz\",\n      \"integrity\": \"sha1-U10EXOa2Nj+kARcIRimZXp3zJMc=\",\n      \"dev\": true,\n      \"engines\": {\n        \"node\": \">=0.8.0\"\n      }\n    },\n    \"node_modules/symbol-observable\": {\n      \"version\": \"1.2.0\",\n      \"resolved\": \"https://registry.npmjs.org/symbol-observable/-/symbol-observable-1.2.0.tgz\",\n      \"integrity\": \"sha512-e900nM8RRtGhlV36KGEU9k65K3mPb1WV70OdjfxlG2EAuM1noi/E/BaW/uMhL7bPEssK8QV57vN3esixjUvcXQ==\",\n      \"dev\": true,\n      \"engines\": {\n        \"node\": \">=0.10.0\"\n      }\n    },\n    \"node_modules/table\": {\n      \"version\": \"4.0.3\",\n      \"resolved\": \"https://registry.npmjs.org/table/-/table-4.0.3.tgz\",\n      \"integrity\": \"sha512-S7rnFITmBH1EnyKcvxBh1LjYeQMmnZtCXSEbHcH6S0NoKit24ZuFO/T1vDcLdYsLQkM188PVVhQmzKIuThNkKg==\",\n      \"dev\": true,\n      \"dependencies\": {\n        \"ajv\": \"^6.0.1\",\n        \"ajv-keywords\": \"^3.0.0\",\n        \"chalk\": \"^2.1.0\",\n        \"lodash\": \"^4.17.4\",\n        \"slice-ansi\": \"1.0.0\",\n        \"string-width\": \"^2.1.1\"\n      },\n      \"engines\": {\n        \"node\": \">=4.0.0\"\n      }\n    },\n    \"node_modules/table/node_modules/ansi-regex\": {\n      \"version\": \"3.0.0\",\n      \"resolved\": \"https://registry.npmjs.org/ansi-regex/-/ansi-regex-3.0.0.tgz\",\n      \"integrity\": \"sha1-7QMXwyIGT3lGbAKWa922Bas32Zg=\",\n      \"dev\": true,\n      \"engines\": {\n        \"node\": \">=4\"\n      }\n    },\n    \"node_modules/table/node_modules/is-fullwidth-code-point\": {\n      \"version\": \"2.0.0\",\n      \"resolved\": \"https://registry.npmjs.org/is-fullwidth-code-point/-/is-fullwidth-code-point-2.0.0.tgz\",\n      \"integrity\": \"sha1-o7MKXE8ZkYMWeqq5O+764937ZU8=\",\n      \"dev\": true,\n      \"engines\": {\n        \"node\": \">=4\"\n      }\n    },\n    \"node_modules/table/node_modules/slice-ansi\": {\n      \"version\": \"1.0.0\",\n      \"resolved\": \"https://registry.npmjs.org/slice-ansi/-/slice-ansi-1.0.0.tgz\",\n      \"integrity\": \"sha512-POqxBK6Lb3q6s047D/XsDVNPnF9Dl8JSaqe9h9lURl0OdNqy/ujDrOiIHtsqXMGbWWTIomRzAMaTyawAU//Reg==\",\n      \"dev\": true,\n      \"dependencies\": {\n        \"is-fullwidth-code-point\": \"^2.0.0\"\n      },\n      \"engines\": {\n        \"node\": \">=4\"\n      }\n    },\n    \"node_modules/table/node_modules/string-width\": {\n      \"version\": \"2.1.1\",\n      \"resolved\": \"https://registry.npmjs.org/string-width/-/string-width-2.1.1.tgz\",\n      \"integrity\": \"sha512-nOqH59deCq9SRHlxq1Aw85Jnt4w6KvLKqWVik6oA9ZklXLNIOlqg4F2yrT1MVaTjAqvVwdfeZ7w7aCvJD7ugkw==\",\n      \"dev\": true,\n      \"dependencies\": {\n        \"is-fullwidth-code-point\": \"^2.0.0\",\n        \"strip-ansi\": \"^4.0.0\"\n      },\n      \"engines\": {\n        \"node\": \">=4\"\n      }\n    },\n    \"node_modules/table/node_modules/strip-ansi\": {\n      \"version\": \"4.0.0\",\n      \"resolved\": \"https://registry.npmjs.org/strip-ansi/-/strip-ansi-4.0.0.tgz\",\n      \"integrity\": \"sha1-qEeQIusaw2iocTibY1JixQXuNo8=\",\n      \"dev\": true,\n      \"dependencies\": {\n        \"ansi-regex\": \"^3.0.0\"\n      },\n      \"engines\": {\n        \"node\": \">=4\"\n      }\n    },\n    \"node_modules/text-table\": {\n      \"version\": \"0.2.0\",\n      \"resolved\": \"https://registry.npmjs.org/text-table/-/text-table-0.2.0.tgz\",\n      \"integrity\": \"sha1-f17oI66AUgfACvLfSoTsP8+lcLQ=\",\n      \"dev\": true\n    },\n    \"node_modules/through\": {\n      \"version\": \"2.3.8\",\n      \"resolved\": \"https://registry.npmjs.org/through/-/through-2.3.8.tgz\",\n      \"integrity\": \"sha1-DdTJ/6q8NXlgsbckEV1+Doai4fU=\",\n      \"dev\": true\n    },\n    \"node_modules/tmp\": {\n      \"version\": \"0.0.33\",\n      \"resolved\": \"https://registry.npmjs.org/tmp/-/tmp-0.0.33.tgz\",\n      \"integrity\": \"sha512-jRCJlojKnZ3addtTOjdIqoRuPEKBvNXcGYqzO6zWZX8KfKEpnGY5jfggJQ3EjKuu8D4bJRr0y+cYJFmYbImXGw==\",\n      \"dev\": true,\n      \"dependencies\": {\n        \"os-tmpdir\": \"~1.0.2\"\n      },\n      \"engines\": {\n        \"node\": \">=0.6.0\"\n      }\n    },\n    \"node_modules/to-object-path\": {\n      \"version\": \"0.3.0\",\n      \"resolved\": \"https://registry.npmjs.org/to-object-path/-/to-object-path-0.3.0.tgz\",\n      \"integrity\": \"sha1-KXWIt7Dn4KwI4E5nL4XB9JmeF68=\",\n      \"dev\": true,\n      \"dependencies\": {\n        \"kind-of\": \"^3.0.2\"\n      },\n      \"engines\": {\n        \"node\": \">=0.10.0\"\n      }\n    },\n    \"node_modules/to-object-path/node_modules/kind-of\": {\n      \"version\": \"3.2.2\",\n      \"resolved\": \"https://registry.npmjs.org/kind-of/-/kind-of-3.2.2.tgz\",\n      \"integrity\": \"sha1-MeohpzS6ubuw8yRm2JOupR5KPGQ=\",\n      \"dev\": true,\n      \"dependencies\": {\n        \"is-buffer\": \"^1.1.5\"\n      },\n      \"engines\": {\n        \"node\": \">=0.10.0\"\n      }\n    },\n    \"node_modules/to-regex\": {\n      \"version\": \"3.0.2\",\n      \"resolved\": \"https://registry.npmjs.org/to-regex/-/to-regex-3.0.2.tgz\",\n      \"integrity\": \"sha512-FWtleNAtZ/Ki2qtqej2CXTOayOH9bHDQF+Q48VpWyDXjbYxA4Yz8iDB31zXOBUlOHHKidDbqGVrTUvQMPmBGBw==\",\n      \"dev\": true,\n      \"dependencies\": {\n        \"define-property\": \"^2.0.2\",\n        \"extend-shallow\": \"^3.0.2\",\n        \"regex-not\": \"^1.0.2\",\n        \"safe-regex\": \"^1.1.0\"\n      },\n      \"engines\": {\n        \"node\": \">=0.10.0\"\n      }\n    },\n    \"node_modules/to-regex-range\": {\n      \"version\": \"2.1.1\",\n      \"resolved\": \"https://registry.npmjs.org/to-regex-range/-/to-regex-range-2.1.1.tgz\",\n      \"integrity\": \"sha1-fIDBe53+vlmeJzZ+DU3VWQFB2zg=\",\n      \"dev\": true,\n      \"dependencies\": {\n        \"is-number\": \"^3.0.0\",\n        \"repeat-string\": \"^1.6.1\"\n      },\n      \"engines\": {\n        \"node\": \">=0.10.0\"\n      }\n    },\n    \"node_modules/tslib\": {\n      \"version\": \"1.10.0\",\n      \"resolved\": \"https://registry.npmjs.org/tslib/-/tslib-1.10.0.tgz\",\n      \"integrity\": \"sha512-qOebF53frne81cf0S9B41ByenJ3/IuH8yJKngAX35CmiZySA0khhkovshKK+jGCaMnVomla7gVlIcc3EvKPbTQ==\",\n      \"dev\": true\n    },\n    \"node_modules/type-check\": {\n      \"version\": \"0.3.2\",\n      \"resolved\": \"https://registry.npmjs.org/type-check/-/type-check-0.3.2.tgz\",\n      \"integrity\": \"sha1-WITKtRLPHTVeP7eE8wgEsrUg23I=\",\n      \"dev\": true,\n      \"dependencies\": {\n        \"prelude-ls\": \"~1.1.2\"\n      },\n      \"engines\": {\n        \"node\": \">= 0.8.0\"\n      }\n    },\n    \"node_modules/uglify-js\": {\n      \"version\": \"3.15.3\",\n      \"resolved\": \"https://registry.npmjs.org/uglify-js/-/uglify-js-3.15.3.tgz\",\n      \"integrity\": \"sha512-6iCVm2omGJbsu3JWac+p6kUiOpg3wFO2f8lIXjfEb8RrmLjzog1wTPMmwKB7swfzzqxj9YM+sGUM++u1qN4qJg==\",\n      \"dev\": true,\n      \"bin\": {\n        \"uglifyjs\": \"bin/uglifyjs\"\n      },\n      \"engines\": {\n        \"node\": \">=0.8.0\"\n      }\n    },\n    \"node_modules/union\": {\n      \"version\": \"0.4.6\",\n      \"resolved\": \"https://registry.npmjs.org/union/-/union-0.4.6.tgz\",\n      \"integrity\": \"sha1-GY+9rrolTniLDvy2MLwR8kopWeA=\",\n      \"dev\": true,\n      \"dependencies\": {\n        \"qs\": \"~2.3.3\"\n      },\n      \"engines\": {\n        \"node\": \">= 0.8.0\"\n      }\n    },\n    \"node_modules/union-value\": {\n      \"version\": \"1.0.1\",\n      \"resolved\": \"https://registry.npmjs.org/union-value/-/union-value-1.0.1.tgz\",\n      \"integrity\": \"sha512-tJfXmxMeWYnczCVs7XAEvIV7ieppALdyepWMkHkwciRpZraG/xwT+s2JN8+pr1+8jCRf80FFzvr+MpQeeoF4Xg==\",\n      \"dev\": true,\n      \"dependencies\": {\n        \"arr-union\": \"^3.1.0\",\n        \"get-value\": \"^2.0.6\",\n        \"is-extendable\": \"^0.1.1\",\n        \"set-value\": \"^2.0.1\"\n      },\n      \"engines\": {\n        \"node\": \">=0.10.0\"\n      }\n    },\n    \"node_modules/uniq\": {\n      \"version\": \"1.0.1\",\n      \"resolved\": \"https://registry.npmjs.org/uniq/-/uniq-1.0.1.tgz\",\n      \"integrity\": \"sha1-sxxa6CVIRKOoKBVBzisEuGWnNP8=\",\n      \"dev\": true\n    },\n    \"node_modules/unset-value\": {\n      \"version\": \"1.0.0\",\n      \"resolved\": \"https://registry.npmjs.org/unset-value/-/unset-value-1.0.0.tgz\",\n      \"integrity\": \"sha1-g3aHP30jNRef+x5vw6jtDfyKtVk=\",\n      \"dev\": true,\n      \"dependencies\": {\n        \"has-value\": \"^0.3.1\",\n        \"isobject\": \"^3.0.0\"\n      },\n      \"engines\": {\n        \"node\": \">=0.10.0\"\n      }\n    },\n    \"node_modules/unset-value/node_modules/has-value\": {\n      \"version\": \"0.3.1\",\n      \"resolved\": \"https://registry.npmjs.org/has-value/-/has-value-0.3.1.tgz\",\n      \"integrity\": \"sha1-ex9YutpiyoJ+wKIHgCVlSEWZXh8=\",\n      \"dev\": true,\n      \"dependencies\": {\n        \"get-value\": \"^2.0.3\",\n        \"has-values\": \"^0.1.4\",\n        \"isobject\": \"^2.0.0\"\n      },\n      \"engines\": {\n        \"node\": \">=0.10.0\"\n      }\n    },\n    \"node_modules/unset-value/node_modules/has-value/node_modules/isobject\": {\n      \"version\": \"2.1.0\",\n      \"resolved\": \"https://registry.npmjs.org/isobject/-/isobject-2.1.0.tgz\",\n      \"integrity\": \"sha1-8GVWEJaj8dou9GJy+BXIQNh+DIk=\",\n      \"dev\": true,\n      \"dependencies\": {\n        \"isarray\": \"1.0.0\"\n      },\n      \"engines\": {\n        \"node\": \">=0.10.0\"\n      }\n    },\n    \"node_modules/unset-value/node_modules/has-values\": {\n      \"version\": \"0.1.4\",\n      \"resolved\": \"https://registry.npmjs.org/has-values/-/has-values-0.1.4.tgz\",\n      \"integrity\": \"sha1-bWHeldkd/Km5oCCJrThL/49it3E=\",\n      \"dev\": true,\n      \"engines\": {\n        \"node\": \">=0.10.0\"\n      }\n    },\n    \"node_modules/uri-js\": {\n      \"version\": \"4.2.2\",\n      \"resolved\": \"https://registry.npmjs.org/uri-js/-/uri-js-4.2.2.tgz\",\n      \"integrity\": \"sha512-KY9Frmirql91X2Qgjry0Wd4Y+YTdrdZheS8TFwvkbLWf/G5KNJDCh6pKL5OZctEW4+0Baa5idK2ZQuELRwPznQ==\",\n      \"dev\": true,\n      \"dependencies\": {\n        \"punycode\": \"^2.1.0\"\n      }\n    },\n    \"node_modules/urix\": {\n      \"version\": \"0.1.0\",\n      \"resolved\": \"https://registry.npmjs.org/urix/-/urix-0.1.0.tgz\",\n      \"integrity\": \"sha1-2pN/emLiH+wf0Y1Js1wpNQZ6bHI=\",\n      \"deprecated\": \"Please see https://github.com/lydell/urix#deprecated\",\n      \"dev\": true\n    },\n    \"node_modules/url-join\": {\n      \"version\": \"2.0.5\",\n      \"resolved\": \"https://registry.npmjs.org/url-join/-/url-join-2.0.5.tgz\",\n      \"integrity\": \"sha1-WvIvGMBSoACkjXuCxenC4v7tpyg=\",\n      \"dev\": true\n    },\n    \"node_modules/use\": {\n      \"version\": \"3.1.1\",\n      \"resolved\": \"https://registry.npmjs.org/use/-/use-3.1.1.tgz\",\n      \"integrity\": \"sha512-cwESVXlO3url9YWlFW/TA9cshCEhtu7IKJ/p5soJ/gGpj7vbvFrAY/eIioQ6Dw23KjZhYgiIo8HOs1nQ2vr/oQ==\",\n      \"dev\": true,\n      \"engines\": {\n        \"node\": \">=0.10.0\"\n      }\n    },\n    \"node_modules/validate-npm-package-license\": {\n      \"version\": \"3.0.4\",\n      \"resolved\": \"https://registry.npmjs.org/validate-npm-package-license/-/validate-npm-package-license-3.0.4.tgz\",\n      \"integrity\": \"sha512-DpKm2Ui/xN7/HQKCtpZxoRWBhZ9Z0kqtygG8XCgNQ8ZlDnxuQmWhj566j8fN4Cu3/JmbhsDo7fcAJq4s9h27Ew==\",\n      \"dev\": true,\n      \"dependencies\": {\n        \"spdx-correct\": \"^3.0.0\",\n        \"spdx-expression-parse\": \"^3.0.0\"\n      }\n    },\n    \"node_modules/which\": {\n      \"version\": \"1.3.1\",\n      \"resolved\": \"https://registry.npmjs.org/which/-/which-1.3.1.tgz\",\n      \"integrity\": \"sha512-HxJdYWq1MTIQbJ3nw0cqssHoTNU267KlrDuGZ1WYlxDStUtKUhOaJmh112/TZmHxxUfuJqPXSOm7tDyas0OSIQ==\",\n      \"dev\": true,\n      \"dependencies\": {\n        \"isexe\": \"^2.0.0\"\n      },\n      \"bin\": {\n        \"which\": \"bin/which\"\n      }\n    },\n    \"node_modules/wordwrap\": {\n      \"version\": \"0.0.3\",\n      \"resolved\": \"https://registry.npmjs.org/wordwrap/-/wordwrap-0.0.3.tgz\",\n      \"integrity\": \"sha1-o9XabNXAvAAI03I0u68b7WMFkQc=\",\n      \"dev\": true,\n      \"engines\": {\n        \"node\": \">=0.4.0\"\n      }\n    },\n    \"node_modules/wrap-ansi\": {\n      \"version\": \"3.0.1\",\n      \"resolved\": \"https://registry.npmjs.org/wrap-ansi/-/wrap-ansi-3.0.1.tgz\",\n      \"integrity\": \"sha1-KIoE2H7aXChuBg3+jxNc6NAH+Lo=\",\n      \"dev\": true,\n      \"dependencies\": {\n        \"string-width\": \"^2.1.1\",\n        \"strip-ansi\": \"^4.0.0\"\n      },\n      \"engines\": {\n        \"node\": \">=4\"\n      }\n    },\n    \"node_modules/wrap-ansi/node_modules/ansi-regex\": {\n      \"version\": \"3.0.0\",\n      \"resolved\": \"https://registry.npmjs.org/ansi-regex/-/ansi-regex-3.0.0.tgz\",\n      \"integrity\": \"sha1-7QMXwyIGT3lGbAKWa922Bas32Zg=\",\n      \"dev\": true,\n      \"engines\": {\n        \"node\": \">=4\"\n      }\n    },\n    \"node_modules/wrap-ansi/node_modules/is-fullwidth-code-point\": {\n      \"version\": \"2.0.0\",\n      \"resolved\": \"https://registry.npmjs.org/is-fullwidth-code-point/-/is-fullwidth-code-point-2.0.0.tgz\",\n      \"integrity\": \"sha1-o7MKXE8ZkYMWeqq5O+764937ZU8=\",\n      \"dev\": true,\n      \"engines\": {\n        \"node\": \">=4\"\n      }\n    },\n    \"node_modules/wrap-ansi/node_modules/string-width\": {\n      \"version\": \"2.1.1\",\n      \"resolved\": \"https://registry.npmjs.org/string-width/-/string-width-2.1.1.tgz\",\n      \"integrity\": \"sha512-nOqH59deCq9SRHlxq1Aw85Jnt4w6KvLKqWVik6oA9ZklXLNIOlqg4F2yrT1MVaTjAqvVwdfeZ7w7aCvJD7ugkw==\",\n      \"dev\": true,\n      \"dependencies\": {\n        \"is-fullwidth-code-point\": \"^2.0.0\",\n        \"strip-ansi\": \"^4.0.0\"\n      },\n      \"engines\": {\n        \"node\": \">=4\"\n      }\n    },\n    \"node_modules/wrap-ansi/node_modules/strip-ansi\": {\n      \"version\": \"4.0.0\",\n      \"resolved\": \"https://registry.npmjs.org/strip-ansi/-/strip-ansi-4.0.0.tgz\",\n      \"integrity\": \"sha1-qEeQIusaw2iocTibY1JixQXuNo8=\",\n      \"dev\": true,\n      \"dependencies\": {\n        \"ansi-regex\": \"^3.0.0\"\n      },\n      \"engines\": {\n        \"node\": \">=4\"\n      }\n    },\n    \"node_modules/wrappy\": {\n      \"version\": \"1.0.2\",\n      \"resolved\": \"https://registry.npmjs.org/wrappy/-/wrappy-1.0.2.tgz\",\n      \"integrity\": \"sha1-tSQ9jz7BqjXxNkYFvA0QNuMKtp8=\",\n      \"dev\": true\n    },\n    \"node_modules/write\": {\n      \"version\": \"0.2.1\",\n      \"resolved\": \"https://registry.npmjs.org/write/-/write-0.2.1.tgz\",\n      \"integrity\": \"sha1-X8A4KOJkzqP+kUVUdvejxWbLB1c=\",\n      \"dev\": true,\n      \"dependencies\": {\n        \"mkdirp\": \"^0.5.1\"\n      },\n      \"engines\": {\n        \"node\": \">=0.10.0\"\n      }\n    },\n    \"node_modules/xtend\": {\n      \"version\": \"4.0.1\",\n      \"resolved\": \"https://registry.npmjs.org/xtend/-/xtend-4.0.1.tgz\",\n      \"integrity\": \"sha1-pcbVMr5lbiPbgg77lDofBJmNY68=\",\n      \"dev\": true,\n      \"engines\": {\n        \"node\": \">=0.4\"\n      }\n    }\n  }\n}\n"
        },
        {
          "name": "package.json",
          "type": "blob",
          "size": 1.296875,
          "content": "{\n  \"name\": \"glider-js\",\n  \"version\": \"1.7.9\",\n  \"description\": \"A fast, lightweight carousel alternative\",\n  \"main\": \"glider.js\",\n  \"directories\": {\n    \"doc\": \"docs\"\n  },\n  \"scripts\": {\n    \"start\": \"http-server docs/\",\n    \"test\": \"\\\"echo \\\\\\\"Error: no test specified\\\\\\\" && exit 1\\\"\"\n  },\n  \"repository\": {\n    \"type\": \"git\",\n    \"url\": \"git+https://github.com/NickPiscitelli/Glider.js.git\"\n  },\n  \"keywords\": [\n    \"carousel\",\n    \"scrolling\",\n    \"list\",\n    \"paging\"\n  ],\n  \"author\": \"Nick Piscitelli\",\n  \"license\": \"MIT\",\n  \"bugs\": {\n    \"url\": \"https://github.com/NickPiscitelli/Glider.js/issues\"\n  },\n  \"homepage\": \"https://github.com/NickPiscitelli/Glider.js#readme\",\n  \"devDependencies\": {\n    \"http-server\": \"^0.11.1\",\n    \"husky\": \"1.2.0\",\n    \"lint-staged\": \"8.1.0\",\n    \"prettier\": \"1.15.2\",\n    \"standard\": \"12.0.1\",\n    \"uglify-js\": \"^3.15.3\"\n  },\n  \"husky\": {\n    \"hooks\": {\n      \"pre-commit\": \"lint-staged\"\n    }\n  },\n  \"lint-staged\": {\n    \"linters\": {\n      \"glider.js\": [\n        \"prettier --write\",\n        \"standard --fix\",\n        \"uglifyjs --compress --mangle --comments -o glider.min.js --\",\n        \"uglifyjs --compress --mangle --comments -o docs/assets/js/glider.min.js --\",\n        \"git add glider.min.js docs/assets/js/glider.min.js\"\n      ]\n    },\n    \"ignore\": [\n      \"*.min.js\"\n    ]\n  }\n}\n"
        },
        {
          "name": "yarn.lock",
          "type": "blob",
          "size": 92.0400390625,
          "content": "# THIS IS AN AUTOGENERATED FILE. DO NOT EDIT THIS FILE DIRECTLY.\n# yarn lockfile v1\n\n\n\"@iamstarkov/listr-update-renderer@0.4.1\":\n  version \"0.4.1\"\n  resolved \"https://registry.npmjs.org/@iamstarkov/listr-update-renderer/-/listr-update-renderer-0.4.1.tgz\"\n  integrity sha512-IJyxQWsYDEkf8C8QthBn5N8tIUR9V9je6j3sMIpAkonaadjbvxmRC6RAhpa3RKxndhNnU2M6iNbtJwd7usQYIA==\n  dependencies:\n    chalk \"^1.1.3\"\n    cli-truncate \"^0.2.1\"\n    elegant-spinner \"^1.0.1\"\n    figures \"^1.7.0\"\n    indent-string \"^3.0.0\"\n    log-symbols \"^1.0.2\"\n    log-update \"^2.3.0\"\n    strip-ansi \"^3.0.1\"\n\n\"@samverschueren/stream-to-observable@^0.3.0\":\n  version \"0.3.0\"\n  resolved \"https://registry.npmjs.org/@samverschueren/stream-to-observable/-/stream-to-observable-0.3.0.tgz\"\n  integrity sha512-MI4Xx6LHs4Webyvi6EbspgyAb4D2Q2VtnCQ1blOJcoLS6mVa8lNN2rkIy1CVxfTUpoyIbCTkXES1rLXztFD1lg==\n  dependencies:\n    any-observable \"^0.3.0\"\n\nacorn-jsx@^5.0.0:\n  version \"5.0.1\"\n  resolved \"https://registry.npmjs.org/acorn-jsx/-/acorn-jsx-5.0.1.tgz\"\n  integrity sha512-HJ7CfNHrfJLlNTzIEUTj43LNWGkqpRLxm3YjAlcD0ACydk9XynzYsCBHxut+iqt+1aBXkx9UP/w/ZqMr13XIzg==\n\nacorn@^6.0.0, acorn@^6.0.2:\n  version \"6.4.1\"\n  resolved \"https://registry.npmjs.org/acorn/-/acorn-6.4.1.tgz\"\n  integrity sha512-ZVA9k326Nwrj3Cj9jlh3wGFutC2ZornPNARZwsNYqQYgN0EsV2d53w5RN/co65Ohn4sUAUtb1rSUAOD6XN9idA==\n\najv-keywords@^3.0.0:\n  version \"3.4.0\"\n  resolved \"https://registry.npmjs.org/ajv-keywords/-/ajv-keywords-3.4.0.tgz\"\n  integrity sha512-aUjdRFISbuFOl0EIZc+9e4FfZp0bDZgAdOOf30bJmw8VM9v84SHyVyxDfbWxpGYbdZD/9XoKxfHVNmxPkhwyGw==\n\najv@^6.0.1, ajv@^6.5.0, ajv@^6.9.1:\n  version \"6.10.0\"\n  resolved \"https://registry.npmjs.org/ajv/-/ajv-6.10.0.tgz\"\n  integrity sha512-nffhOpkymDECQyR0mnsUtoCE8RlX38G0rYP+wgLWFyZuUyuuojSSvi/+euOiQBIn63whYwYVIIH1TvE3tu4OEg==\n  dependencies:\n    fast-deep-equal \"^2.0.1\"\n    fast-json-stable-stringify \"^2.0.0\"\n    json-schema-traverse \"^0.4.1\"\n    uri-js \"^4.2.2\"\n\nansi-escapes@^3.0.0:\n  version \"3.2.0\"\n  resolved \"https://registry.npmjs.org/ansi-escapes/-/ansi-escapes-3.2.0.tgz\"\n  integrity sha512-cBhpre4ma+U0T1oM5fXg7Dy1Jw7zzwv7lt/GoCpr+hDQJoYnKVPLL4dCvSEFMmQurOQvSrwT7SL/DAlhBI97RQ==\n\nansi-regex@^2.0.0:\n  version \"2.1.1\"\n  resolved \"https://registry.npmjs.org/ansi-regex/-/ansi-regex-2.1.1.tgz\"\n  integrity sha1-w7M6te42DYbg5ijwRorn7yfWVN8=\n\nansi-regex@^3.0.0:\n  version \"3.0.0\"\n  resolved \"https://registry.npmjs.org/ansi-regex/-/ansi-regex-3.0.0.tgz\"\n  integrity sha1-7QMXwyIGT3lGbAKWa922Bas32Zg=\n\nansi-styles@^2.2.1:\n  version \"2.2.1\"\n  resolved \"https://registry.npmjs.org/ansi-styles/-/ansi-styles-2.2.1.tgz\"\n  integrity sha1-tDLdM1i2NM914eRmQ2gkBTPB3b4=\n\nansi-styles@^3.2.0:\n  version \"3.2.1\"\n  resolved \"https://registry.npmjs.org/ansi-styles/-/ansi-styles-3.2.1.tgz\"\n  integrity sha512-VT0ZI6kZRdTh8YyJw3SMbYm/u+NqfsAxEpWO0Pf9sq8/e94WxxOpPKx9FR1FlyCtOVDNOQ+8ntlqFxiRc+r5qA==\n  dependencies:\n    color-convert \"^1.9.0\"\n\nansi-styles@^3.2.1:\n  version \"3.2.1\"\n  resolved \"https://registry.npmjs.org/ansi-styles/-/ansi-styles-3.2.1.tgz\"\n  integrity sha512-VT0ZI6kZRdTh8YyJw3SMbYm/u+NqfsAxEpWO0Pf9sq8/e94WxxOpPKx9FR1FlyCtOVDNOQ+8ntlqFxiRc+r5qA==\n  dependencies:\n    color-convert \"^1.9.0\"\n\nany-observable@^0.3.0:\n  version \"0.3.0\"\n  resolved \"https://registry.npmjs.org/any-observable/-/any-observable-0.3.0.tgz\"\n  integrity sha512-/FQM1EDkTsf63Ub2C6O7GuYFDsSXUwsaZDurV0np41ocwq0jthUAYCmhBX9f+KwlaCgIuWyr/4WlUQUBfKfZog==\n\nargparse@^1.0.7:\n  version \"1.0.10\"\n  resolved \"https://registry.npmjs.org/argparse/-/argparse-1.0.10.tgz\"\n  integrity sha512-o5Roy6tNG4SL/FOkCAN6RzjiakZS25RLYFrcMttJqbdd8BWrnA+fGz57iN5Pb06pvBGvl5gQ0B48dJlslXvoTg==\n  dependencies:\n    sprintf-js \"~1.0.2\"\n\narr-diff@^4.0.0:\n  version \"4.0.0\"\n  resolved \"https://registry.npmjs.org/arr-diff/-/arr-diff-4.0.0.tgz\"\n  integrity sha1-1kYQdP6/7HHn4VI1dhoyml3HxSA=\n\narr-flatten@^1.1.0:\n  version \"1.1.0\"\n  resolved \"https://registry.npmjs.org/arr-flatten/-/arr-flatten-1.1.0.tgz\"\n  integrity sha512-L3hKV5R/p5o81R7O02IGnwpDmkp6E982XhtbuwSe3O4qOtMMMtodicASA1Cny2U+aCXcNpml+m4dPsvsJ3jatg==\n\narr-union@^3.1.0:\n  version \"3.1.0\"\n  resolved \"https://registry.npmjs.org/arr-union/-/arr-union-3.1.0.tgz\"\n  integrity sha1-45sJrqne+Gao8gbiiK9jkZuuOcQ=\n\narray-includes@^3.0.3:\n  version \"3.0.3\"\n  resolved \"https://registry.npmjs.org/array-includes/-/array-includes-3.0.3.tgz\"\n  integrity sha1-GEtI9i2S10UrsxsyMWXH+L0CJm0=\n  dependencies:\n    define-properties \"^1.1.2\"\n    es-abstract \"^1.7.0\"\n\narray-union@^1.0.1:\n  version \"1.0.2\"\n  resolved \"https://registry.npmjs.org/array-union/-/array-union-1.0.2.tgz\"\n  integrity sha1-mjRBDk9OPaI96jdb5b5w8kd47Dk=\n  dependencies:\n    array-uniq \"^1.0.1\"\n\narray-uniq@^1.0.1:\n  version \"1.0.3\"\n  resolved \"https://registry.npmjs.org/array-uniq/-/array-uniq-1.0.3.tgz\"\n  integrity sha1-r2rId6Jcx/dOBYiUdThY39sk/bY=\n\narray-unique@^0.3.2:\n  version \"0.3.2\"\n  resolved \"https://registry.npmjs.org/array-unique/-/array-unique-0.3.2.tgz\"\n  integrity sha1-qJS3XUvE9s1nnvMkSp/Y9Gri1Cg=\n\narrify@^1.0.1:\n  version \"1.0.1\"\n  resolved \"https://registry.npmjs.org/arrify/-/arrify-1.0.1.tgz\"\n  integrity sha1-iYUI2iIm84DfkEcoRWhJwVAaSw0=\n\nassign-symbols@^1.0.0:\n  version \"1.0.0\"\n  resolved \"https://registry.npmjs.org/assign-symbols/-/assign-symbols-1.0.0.tgz\"\n  integrity sha1-WWZ/QfrdTyDMvCu5a41Pf3jsA2c=\n\nasync@^1.5.2:\n  version \"1.5.2\"\n  resolved \"https://registry.npmjs.org/async/-/async-1.5.2.tgz\"\n  integrity sha1-7GphrlZIDAw8skHJVhjiCJL5Zyo=\n\natob@^2.1.1:\n  version \"2.1.2\"\n  resolved \"https://registry.npmjs.org/atob/-/atob-2.1.2.tgz\"\n  integrity sha512-Wm6ukoaOGJi/73p/cl2GvLjTI5JM1k/O14isD73YML8StrH/7/lRFgmg8nICZgD3bZZvjwCGxtMOD3wWNAu8cg==\n\nbabel-code-frame@^6.26.0:\n  version \"6.26.0\"\n  resolved \"https://registry.npmjs.org/babel-code-frame/-/babel-code-frame-6.26.0.tgz\"\n  integrity sha1-Y/1D99weO7fONZR9uP42mj9Yx0s=\n  dependencies:\n    chalk \"^1.1.3\"\n    esutils \"^2.0.2\"\n    js-tokens \"^3.0.2\"\n\nbalanced-match@^1.0.0:\n  version \"1.0.0\"\n  resolved \"https://registry.npmjs.org/balanced-match/-/balanced-match-1.0.0.tgz\"\n  integrity sha1-ibTRmasr7kneFk6gK4nORi1xt2c=\n\nbase@^0.11.1:\n  version \"0.11.2\"\n  resolved \"https://registry.npmjs.org/base/-/base-0.11.2.tgz\"\n  integrity sha512-5T6P4xPgpp0YDFvSWwEZ4NoE3aM4QBQXDzmVbraCkFj8zHM+mba8SyqB5DbZWyR7mYHo6Y7BdQo3MoA4m0TeQg==\n  dependencies:\n    cache-base \"^1.0.1\"\n    class-utils \"^0.3.5\"\n    component-emitter \"^1.2.1\"\n    define-property \"^1.0.0\"\n    isobject \"^3.0.1\"\n    mixin-deep \"^1.2.0\"\n    pascalcase \"^0.1.1\"\n\nbrace-expansion@^1.1.7:\n  version \"1.1.11\"\n  resolved \"https://registry.npmjs.org/brace-expansion/-/brace-expansion-1.1.11.tgz\"\n  integrity sha512-iCuPHDFgrHX7H2vEI/5xpz07zSHB00TpugqhmYtVmMO6518mCuRMoOYFldEBl0g187ufozdaHgWKcYFb61qGiA==\n  dependencies:\n    balanced-match \"^1.0.0\"\n    concat-map \"0.0.1\"\n\nbraces@^2.3.1:\n  version \"2.3.2\"\n  resolved \"https://registry.npmjs.org/braces/-/braces-2.3.2.tgz\"\n  integrity sha512-aNdbnj9P8PjdXU4ybaWLK2IF3jc/EoDYbC7AazW6to3TRsfXxscC9UXOB5iDiEQrkyIbWp2SLQda4+QAa7nc3w==\n  dependencies:\n    arr-flatten \"^1.1.0\"\n    array-unique \"^0.3.2\"\n    extend-shallow \"^2.0.1\"\n    fill-range \"^4.0.0\"\n    isobject \"^3.0.1\"\n    repeat-element \"^1.1.2\"\n    snapdragon \"^0.8.1\"\n    snapdragon-node \"^2.0.1\"\n    split-string \"^3.0.2\"\n    to-regex \"^3.0.1\"\n\ncache-base@^1.0.1:\n  version \"1.0.1\"\n  resolved \"https://registry.npmjs.org/cache-base/-/cache-base-1.0.1.tgz\"\n  integrity sha512-AKcdTnFSWATd5/GCPRxr2ChwIJ85CeyrEyjRHlKxQ56d4XJMGym0uAiKn0xbLOGOl3+yRpOTi484dVCEc5AUzQ==\n  dependencies:\n    collection-visit \"^1.0.0\"\n    component-emitter \"^1.2.1\"\n    get-value \"^2.0.6\"\n    has-value \"^1.0.0\"\n    isobject \"^3.0.1\"\n    set-value \"^2.0.0\"\n    to-object-path \"^0.3.0\"\n    union-value \"^1.0.0\"\n    unset-value \"^1.0.0\"\n\ncaller-callsite@^2.0.0:\n  version \"2.0.0\"\n  resolved \"https://registry.npmjs.org/caller-callsite/-/caller-callsite-2.0.0.tgz\"\n  integrity sha1-hH4PzgoiN1CpoCfFSzNzGtMVQTQ=\n  dependencies:\n    callsites \"^2.0.0\"\n\ncaller-path@^0.1.0:\n  version \"0.1.0\"\n  resolved \"https://registry.npmjs.org/caller-path/-/caller-path-0.1.0.tgz\"\n  integrity sha1-lAhe9jWB7NPaqSREqP6U6CV3dR8=\n  dependencies:\n    callsites \"^0.2.0\"\n\ncaller-path@^2.0.0:\n  version \"2.0.0\"\n  resolved \"https://registry.npmjs.org/caller-path/-/caller-path-2.0.0.tgz\"\n  integrity sha1-Ro+DBE42mrIBD6xfBs7uFbsssfQ=\n  dependencies:\n    caller-callsite \"^2.0.0\"\n\ncallsites@^0.2.0:\n  version \"0.2.0\"\n  resolved \"https://registry.npmjs.org/callsites/-/callsites-0.2.0.tgz\"\n  integrity sha1-r6uWJikQp/M8GaV3WCXGnzTjUMo=\n\ncallsites@^2.0.0:\n  version \"2.0.0\"\n  resolved \"https://registry.npmjs.org/callsites/-/callsites-2.0.0.tgz\"\n  integrity sha1-BuuE8A7qQT2oav/vrL/7Ngk7PFA=\n\nchalk@^1.0.0, chalk@^1.1.3:\n  version \"1.1.3\"\n  resolved \"https://registry.npmjs.org/chalk/-/chalk-1.1.3.tgz\"\n  integrity sha1-qBFcVeSnAv5NFQq9OHKCKn4J/Jg=\n  dependencies:\n    ansi-styles \"^2.2.1\"\n    escape-string-regexp \"^1.0.2\"\n    has-ansi \"^2.0.0\"\n    strip-ansi \"^3.0.0\"\n    supports-color \"^2.0.0\"\n\nchalk@^2.0.0, chalk@^2.0.1, chalk@^2.1.0, chalk@^2.3.1, chalk@^2.4.1:\n  version \"2.4.2\"\n  resolved \"https://registry.npmjs.org/chalk/-/chalk-2.4.2.tgz\"\n  integrity sha512-Mti+f9lpJNcwF4tWV8/OrTTtF1gZi+f8FqlyAdouralcFWFQWF2+NgCHShjkCb+IFBLq9buZwE1xckQU4peSuQ==\n  dependencies:\n    ansi-styles \"^3.2.1\"\n    escape-string-regexp \"^1.0.5\"\n    supports-color \"^5.3.0\"\n\nchardet@^0.4.0:\n  version \"0.4.2\"\n  resolved \"https://registry.npmjs.org/chardet/-/chardet-0.4.2.tgz\"\n  integrity sha1-tUc7M9yXxCTl2Y3IfVXU2KKci/I=\n\nci-info@^1.5.0:\n  version \"1.6.0\"\n  resolved \"https://registry.npmjs.org/ci-info/-/ci-info-1.6.0.tgz\"\n  integrity sha512-vsGdkwSCDpWmP80ncATX7iea5DWQemg1UgCW5J8tqjU3lYw4FBYuj89J0CTVomA7BEfvSZd84GmHko+MxFQU2A==\n\ncircular-json@^0.3.1:\n  version \"0.3.3\"\n  resolved \"https://registry.npmjs.org/circular-json/-/circular-json-0.3.3.tgz\"\n  integrity sha512-UZK3NBx2Mca+b5LsG7bY183pHWt5Y1xts4P3Pz7ENTwGVnJOUWbRb3ocjvX7hx9tq/yTAdclXm9sZ38gNuem4A==\n\nclass-utils@^0.3.5:\n  version \"0.3.6\"\n  resolved \"https://registry.npmjs.org/class-utils/-/class-utils-0.3.6.tgz\"\n  integrity sha512-qOhPa/Fj7s6TY8H8esGu5QNpMMQxz79h+urzrNYN6mn+9BnxlDGf5QZ+XeCDsxSjPqsSR56XOZOJmpeurnLMeg==\n  dependencies:\n    arr-union \"^3.1.0\"\n    define-property \"^0.2.5\"\n    isobject \"^3.0.0\"\n    static-extend \"^0.1.1\"\n\ncli-cursor@^2.0.0, cli-cursor@^2.1.0:\n  version \"2.1.0\"\n  resolved \"https://registry.npmjs.org/cli-cursor/-/cli-cursor-2.1.0.tgz\"\n  integrity sha1-s12sN2R5+sw+lHR9QdDQ9SOP/LU=\n  dependencies:\n    restore-cursor \"^2.0.0\"\n\ncli-truncate@^0.2.1:\n  version \"0.2.1\"\n  resolved \"https://registry.npmjs.org/cli-truncate/-/cli-truncate-0.2.1.tgz\"\n  integrity sha1-nxXPuwcFAFNpIWxiasfQWrkN1XQ=\n  dependencies:\n    slice-ansi \"0.0.4\"\n    string-width \"^1.0.1\"\n\ncli-width@^2.0.0:\n  version \"2.2.0\"\n  resolved \"https://registry.npmjs.org/cli-width/-/cli-width-2.2.0.tgz\"\n  integrity sha1-/xnt6Kml5XkyQUewwR8PvLq+1jk=\n\ncode-point-at@^1.0.0:\n  version \"1.1.0\"\n  resolved \"https://registry.npmjs.org/code-point-at/-/code-point-at-1.1.0.tgz\"\n  integrity sha1-DQcLTQQ6W+ozovGkDi7bPZpMz3c=\n\ncollection-visit@^1.0.0:\n  version \"1.0.0\"\n  resolved \"https://registry.npmjs.org/collection-visit/-/collection-visit-1.0.0.tgz\"\n  integrity sha1-S8A3PBZLwykbTTaMgpzxqApZ3KA=\n  dependencies:\n    map-visit \"^1.0.0\"\n    object-visit \"^1.0.0\"\n\ncolor-convert@^1.9.0:\n  version \"1.9.3\"\n  resolved \"https://registry.npmjs.org/color-convert/-/color-convert-1.9.3.tgz\"\n  integrity sha512-QfAUtd+vFdAtFQcC8CCyYt1fYWxSqAiK2cSD6zDB8N3cpsEBAvRxp9zOGg6G/SHHJYAT88/az/IuDGALsNVbGg==\n  dependencies:\n    color-name \"1.1.3\"\n\ncolor-name@1.1.3:\n  version \"1.1.3\"\n  resolved \"https://registry.npmjs.org/color-name/-/color-name-1.1.3.tgz\"\n  integrity sha1-p9BVi9icQveV3UIyj3QIMcpTvCU=\n\ncolors@1.0.3:\n  version \"1.0.3\"\n  resolved \"https://registry.npmjs.org/colors/-/colors-1.0.3.tgz\"\n  integrity sha1-BDP0TYCWgP3rYO0mDxsMJi6CpAs=\n\ncommander@^2.14.1, commander@^2.9.0:\n  version \"2.20.0\"\n  resolved \"https://registry.npmjs.org/commander/-/commander-2.20.0.tgz\"\n  integrity sha512-7j2y+40w61zy6YC2iRNpUe/NwhNyoXrYpHMrSunaMG64nRnaf96zO/KMQR4OyN/UnE5KLyEBnKHd4aG3rskjpQ==\n\ncomponent-emitter@^1.2.1:\n  version \"1.3.0\"\n  resolved \"https://registry.npmjs.org/component-emitter/-/component-emitter-1.3.0.tgz\"\n  integrity sha512-Rd3se6QB+sO1TwqZjscQrurpEPIfO0/yYnSin6Q/rD3mOutHvUrCAhJub3r90uNb+SESBuE0QYoB90YdfatsRg==\n\nconcat-map@0.0.1:\n  version \"0.0.1\"\n  resolved \"https://registry.npmjs.org/concat-map/-/concat-map-0.0.1.tgz\"\n  integrity sha1-2Klr13/Wjfd5OnMDajug1UBdR3s=\n\ncontains-path@^0.1.0:\n  version \"0.1.0\"\n  resolved \"https://registry.npmjs.org/contains-path/-/contains-path-0.1.0.tgz\"\n  integrity sha1-/ozxhP9mcLa67wGp1IYaXL7EEgo=\n\ncopy-descriptor@^0.1.0:\n  version \"0.1.1\"\n  resolved \"https://registry.npmjs.org/copy-descriptor/-/copy-descriptor-0.1.1.tgz\"\n  integrity sha1-Z29us8OZl8LuGsOpJP1hJHSPV40=\n\ncorser@~2.0.0:\n  version \"2.0.1\"\n  resolved \"https://registry.npmjs.org/corser/-/corser-2.0.1.tgz\"\n  integrity sha1-jtolLsqrWEDc2XXOuQ2TcMgZ/4c=\n\ncosmiconfig@^5.0.6:\n  version \"5.2.1\"\n  resolved \"https://registry.npmjs.org/cosmiconfig/-/cosmiconfig-5.2.1.tgz\"\n  integrity sha512-H65gsXo1SKjf8zmrJ67eJk8aIRKV5ff2D4uKZIBZShbhGSpEmsQOPW/SKMKYhSTrqR7ufy6RP69rPogdaPh/kA==\n  dependencies:\n    import-fresh \"^2.0.0\"\n    is-directory \"^0.3.1\"\n    js-yaml \"^3.13.1\"\n    parse-json \"^4.0.0\"\n\ncosmiconfig@5.0.6:\n  version \"5.0.6\"\n  resolved \"https://registry.npmjs.org/cosmiconfig/-/cosmiconfig-5.0.6.tgz\"\n  integrity sha512-6DWfizHriCrFWURP1/qyhsiFvYdlJzbCzmtFWh744+KyWsJo5+kPzUZZaMRSSItoYc0pxFX7gEO7ZC1/gN/7AQ==\n  dependencies:\n    is-directory \"^0.3.1\"\n    js-yaml \"^3.9.0\"\n    parse-json \"^4.0.0\"\n\ncross-spawn@^6.0.0, cross-spawn@^6.0.5:\n  version \"6.0.5\"\n  resolved \"https://registry.npmjs.org/cross-spawn/-/cross-spawn-6.0.5.tgz\"\n  integrity sha512-eTVLrBSt7fjbDygz805pMnstIs2VTBNkRm0qxZd+M7A5XDdxVRWO5MxGBXZhjY4cqLYLdtrGqRf8mBPmzwSpWQ==\n  dependencies:\n    nice-try \"^1.0.4\"\n    path-key \"^2.0.1\"\n    semver \"^5.5.0\"\n    shebang-command \"^1.2.0\"\n    which \"^1.2.9\"\n\ndate-fns@^1.27.2:\n  version \"1.30.1\"\n  resolved \"https://registry.npmjs.org/date-fns/-/date-fns-1.30.1.tgz\"\n  integrity sha512-hBSVCvSmWC+QypYObzwGOd9wqdDpOt+0wl0KbU+R+uuZBS1jN8VsD1ss3irQDknRj5NvxiTF6oj/nDRnN/UQNw==\n\ndebug-log@^1.0.0:\n  version \"1.0.1\"\n  resolved \"https://registry.npmjs.org/debug-log/-/debug-log-1.0.1.tgz\"\n  integrity sha1-IwdjLUwEOCuN+KMvcLiVBG1SdF8=\n\ndebug@^2.2.0:\n  version \"2.6.9\"\n  resolved \"https://registry.npmjs.org/debug/-/debug-2.6.9.tgz\"\n  integrity sha512-bC7ElrdJaJnPbAP+1EotYvqZsb3ecl5wi6Bfi6BJTUcNowp6cvspg0jXznRTKDjm/E7AdgFBVeAPVMNcKGsHMA==\n  dependencies:\n    ms \"2.0.0\"\n\ndebug@^2.3.3:\n  version \"2.6.9\"\n  resolved \"https://registry.npmjs.org/debug/-/debug-2.6.9.tgz\"\n  integrity sha512-bC7ElrdJaJnPbAP+1EotYvqZsb3ecl5wi6Bfi6BJTUcNowp6cvspg0jXznRTKDjm/E7AdgFBVeAPVMNcKGsHMA==\n  dependencies:\n    ms \"2.0.0\"\n\ndebug@^2.6.8:\n  version \"2.6.9\"\n  resolved \"https://registry.npmjs.org/debug/-/debug-2.6.9.tgz\"\n  integrity sha512-bC7ElrdJaJnPbAP+1EotYvqZsb3ecl5wi6Bfi6BJTUcNowp6cvspg0jXznRTKDjm/E7AdgFBVeAPVMNcKGsHMA==\n  dependencies:\n    ms \"2.0.0\"\n\ndebug@^2.6.9:\n  version \"2.6.9\"\n  resolved \"https://registry.npmjs.org/debug/-/debug-2.6.9.tgz\"\n  integrity sha512-bC7ElrdJaJnPbAP+1EotYvqZsb3ecl5wi6Bfi6BJTUcNowp6cvspg0jXznRTKDjm/E7AdgFBVeAPVMNcKGsHMA==\n  dependencies:\n    ms \"2.0.0\"\n\ndebug@^3.1.0, debug@^3.2.6:\n  version \"3.2.6\"\n  resolved \"https://registry.npmjs.org/debug/-/debug-3.2.6.tgz\"\n  integrity sha512-mel+jf7nrtEl5Pn1Qx46zARXKDpBbvzezse7p7LqINmdoIk8PYP5SySaxEmYv6TZ0JyEKA1hsCId6DIhgITtWQ==\n  dependencies:\n    ms \"^2.1.1\"\n\ndebug@^4.0.1:\n  version \"4.1.1\"\n  resolved \"https://registry.npmjs.org/debug/-/debug-4.1.1.tgz\"\n  integrity sha512-pYAIzeRo8J6KPEaJ0VWOh5Pzkbw/RetuzehGM7QRRX5he4fPHx2rdKMB256ehJCkX+XRQm16eZLqLNS8RSZXZw==\n  dependencies:\n    ms \"^2.1.1\"\n\ndecode-uri-component@^0.2.0:\n  version \"0.2.0\"\n  resolved \"https://registry.npmjs.org/decode-uri-component/-/decode-uri-component-0.2.0.tgz\"\n  integrity sha1-6zkTMzRYd1y4TNGh+uBiEGu4dUU=\n\ndedent@^0.7.0:\n  version \"0.7.0\"\n  resolved \"https://registry.npmjs.org/dedent/-/dedent-0.7.0.tgz\"\n  integrity sha1-JJXduvbrh0q7Dhvp3yLS5aVEMmw=\n\ndeep-is@~0.1.3:\n  version \"0.1.3\"\n  resolved \"https://registry.npmjs.org/deep-is/-/deep-is-0.1.3.tgz\"\n  integrity sha1-s2nW+128E+7PUk+RsHD+7cNXzzQ=\n\ndefine-properties@^1.1.2:\n  version \"1.1.3\"\n  resolved \"https://registry.npmjs.org/define-properties/-/define-properties-1.1.3.tgz\"\n  integrity sha512-3MqfYKj2lLzdMSf8ZIZE/V+Zuy+BgD6f164e8K2w7dgnpKArBDerGYpM46IYYcjnkdPNMjPk9A6VFB8+3SKlXQ==\n  dependencies:\n    object-keys \"^1.0.12\"\n\ndefine-property@^0.2.5:\n  version \"0.2.5\"\n  resolved \"https://registry.npmjs.org/define-property/-/define-property-0.2.5.tgz\"\n  integrity sha1-w1se+RjsPJkPmlvFe+BKrOxcgRY=\n  dependencies:\n    is-descriptor \"^0.1.0\"\n\ndefine-property@^1.0.0:\n  version \"1.0.0\"\n  resolved \"https://registry.npmjs.org/define-property/-/define-property-1.0.0.tgz\"\n  integrity sha1-dp66rz9KY6rTr56NMEybvnm/sOY=\n  dependencies:\n    is-descriptor \"^1.0.0\"\n\ndefine-property@^2.0.2:\n  version \"2.0.2\"\n  resolved \"https://registry.npmjs.org/define-property/-/define-property-2.0.2.tgz\"\n  integrity sha512-jwK2UV4cnPpbcG7+VRARKTZPUWowwXA8bzH5NP6ud0oeAxyYPuGZUAC7hMugpCdz4BeSZl2Dl9k66CHJ/46ZYQ==\n  dependencies:\n    is-descriptor \"^1.0.2\"\n    isobject \"^3.0.1\"\n\ndeglob@^2.1.0:\n  version \"2.1.1\"\n  resolved \"https://registry.npmjs.org/deglob/-/deglob-2.1.1.tgz\"\n  integrity sha512-2kjwuGGonL7gWE1XU4Fv79+vVzpoQCl0V+boMwWtOQJV2AGDabCwez++nB1Nli/8BabAfZQ/UuHPlp6AymKdWw==\n  dependencies:\n    find-root \"^1.0.0\"\n    glob \"^7.0.5\"\n    ignore \"^3.0.9\"\n    pkg-config \"^1.1.0\"\n    run-parallel \"^1.1.2\"\n    uniq \"^1.0.1\"\n\ndel@^3.0.0:\n  version \"3.0.0\"\n  resolved \"https://registry.npmjs.org/del/-/del-3.0.0.tgz\"\n  integrity sha1-U+z2mf/LyzljdpGrE7rxYIGXZuU=\n  dependencies:\n    globby \"^6.1.0\"\n    is-path-cwd \"^1.0.0\"\n    is-path-in-cwd \"^1.0.0\"\n    p-map \"^1.1.1\"\n    pify \"^3.0.0\"\n    rimraf \"^2.2.8\"\n\ndoctrine@^2.1.0:\n  version \"2.1.0\"\n  resolved \"https://registry.npmjs.org/doctrine/-/doctrine-2.1.0.tgz\"\n  integrity sha512-35mSku4ZXK0vfCuHEDAwt55dg2jNajHZ1odvF+8SSr82EsZY4QmXfuWso8oEd8zRhVObSN18aM0CjSdoBX7zIw==\n  dependencies:\n    esutils \"^2.0.2\"\n\ndoctrine@1.5.0:\n  version \"1.5.0\"\n  resolved \"https://registry.npmjs.org/doctrine/-/doctrine-1.5.0.tgz\"\n  integrity sha1-N53Ocw9hZvds76TmcHoVmwLFpvo=\n  dependencies:\n    esutils \"^2.0.2\"\n    isarray \"^1.0.0\"\n\necstatic@^3.0.0:\n  version \"3.3.2\"\n  resolved \"https://registry.npmjs.org/ecstatic/-/ecstatic-3.3.2.tgz\"\n  integrity sha512-fLf9l1hnwrHI2xn9mEDT7KIi22UDqA2jaCwyCbSUJh9a1V+LEUSL/JO/6TIz/QyuBURWUHrFL5Kg2TtO1bkkog==\n  dependencies:\n    he \"^1.1.1\"\n    mime \"^1.6.0\"\n    minimist \"^1.1.0\"\n    url-join \"^2.0.5\"\n\nelegant-spinner@^1.0.1:\n  version \"1.0.1\"\n  resolved \"https://registry.npmjs.org/elegant-spinner/-/elegant-spinner-1.0.1.tgz\"\n  integrity sha1-2wQ1IcldfjA/2PNFvtwzSc+wcp4=\n\nend-of-stream@^1.1.0:\n  version \"1.4.1\"\n  resolved \"https://registry.npmjs.org/end-of-stream/-/end-of-stream-1.4.1.tgz\"\n  integrity sha512-1MkrZNvWTKCaigbn+W15elq2BB/L22nqrSY5DKlo3X6+vclJm8Bb5djXJBmEX6fS3+zCh/F4VBK5Z2KxJt4s2Q==\n  dependencies:\n    once \"^1.4.0\"\n\nerror-ex@^1.2.0, error-ex@^1.3.1:\n  version \"1.3.2\"\n  resolved \"https://registry.npmjs.org/error-ex/-/error-ex-1.3.2.tgz\"\n  integrity sha512-7dFHNmqeFSEt2ZBsCriorKnn3Z2pj+fd9kmI6QoWw4//DL+icEBfc0U7qJCisqrTsKTjw4fNFy2pW9OqStD84g==\n  dependencies:\n    is-arrayish \"^0.2.1\"\n\nes-abstract@^1.7.0:\n  version \"1.13.0\"\n  resolved \"https://registry.npmjs.org/es-abstract/-/es-abstract-1.13.0.tgz\"\n  integrity sha512-vDZfg/ykNxQVwup/8E1BZhVzFfBxs9NqMzGcvIJrqg5k2/5Za2bWo40dK2J1pgLngZ7c+Shh8lwYtLGyrwPutg==\n  dependencies:\n    es-to-primitive \"^1.2.0\"\n    function-bind \"^1.1.1\"\n    has \"^1.0.3\"\n    is-callable \"^1.1.4\"\n    is-regex \"^1.0.4\"\n    object-keys \"^1.0.12\"\n\nes-to-primitive@^1.2.0:\n  version \"1.2.0\"\n  resolved \"https://registry.npmjs.org/es-to-primitive/-/es-to-primitive-1.2.0.tgz\"\n  integrity sha512-qZryBOJjV//LaxLTV6UC//WewneB3LcXOL9NP++ozKVXsIIIpm/2c13UDiD9Jp2eThsecw9m3jPqDwTyobcdbg==\n  dependencies:\n    is-callable \"^1.1.4\"\n    is-date-object \"^1.0.1\"\n    is-symbol \"^1.0.2\"\n\nescape-string-regexp@^1.0.2, escape-string-regexp@^1.0.4, escape-string-regexp@^1.0.5:\n  version \"1.0.5\"\n  resolved \"https://registry.npmjs.org/escape-string-regexp/-/escape-string-regexp-1.0.5.tgz\"\n  integrity sha1-G2HAViGQqN/2rjuyzwIAyhMLhtQ=\n\neslint-config-standard-jsx@6.0.2:\n  version \"6.0.2\"\n  resolved \"https://registry.npmjs.org/eslint-config-standard-jsx/-/eslint-config-standard-jsx-6.0.2.tgz\"\n  integrity sha512-D+YWAoXw+2GIdbMBRAzWwr1ZtvnSf4n4yL0gKGg7ShUOGXkSOLerI17K4F6LdQMJPNMoWYqepzQD/fKY+tXNSg==\n\neslint-config-standard@12.0.0:\n  version \"12.0.0\"\n  resolved \"https://registry.npmjs.org/eslint-config-standard/-/eslint-config-standard-12.0.0.tgz\"\n  integrity sha512-COUz8FnXhqFitYj4DTqHzidjIL/t4mumGZto5c7DrBpvWoie+Sn3P4sLEzUGeYhRElWuFEf8K1S1EfvD1vixCQ==\n\neslint-import-resolver-node@^0.3.1:\n  version \"0.3.2\"\n  resolved \"https://registry.npmjs.org/eslint-import-resolver-node/-/eslint-import-resolver-node-0.3.2.tgz\"\n  integrity sha512-sfmTqJfPSizWu4aymbPr4Iidp5yKm8yDkHp+Ir3YiTHiiDfxh69mOUsmiqW6RZ9zRXFaF64GtYmN7e+8GHBv6Q==\n  dependencies:\n    debug \"^2.6.9\"\n    resolve \"^1.5.0\"\n\neslint-module-utils@^2.2.0:\n  version \"2.4.0\"\n  resolved \"https://registry.npmjs.org/eslint-module-utils/-/eslint-module-utils-2.4.0.tgz\"\n  integrity sha512-14tltLm38Eu3zS+mt0KvILC3q8jyIAH518MlG+HO0p+yK885Lb1UHTY/UgR91eOyGdmxAPb+OLoW4znqIT6Ndw==\n  dependencies:\n    debug \"^2.6.8\"\n    pkg-dir \"^2.0.0\"\n\neslint-plugin-es@^1.3.1:\n  version \"1.4.0\"\n  resolved \"https://registry.npmjs.org/eslint-plugin-es/-/eslint-plugin-es-1.4.0.tgz\"\n  integrity sha512-XfFmgFdIUDgvaRAlaXUkxrRg5JSADoRC8IkKLc/cISeR3yHVMefFHQZpcyXXEUUPHfy5DwviBcrfqlyqEwlQVw==\n  dependencies:\n    eslint-utils \"^1.3.0\"\n    regexpp \"^2.0.1\"\n\neslint-plugin-import@>=2.13.0, eslint-plugin-import@~2.14.0:\n  version \"2.14.0\"\n  resolved \"https://registry.npmjs.org/eslint-plugin-import/-/eslint-plugin-import-2.14.0.tgz\"\n  integrity sha512-FpuRtniD/AY6sXByma2Wr0TXvXJ4nA/2/04VPlfpmUDPOpOY264x+ILiwnrk/k4RINgDAyFZByxqPUbSQ5YE7g==\n  dependencies:\n    contains-path \"^0.1.0\"\n    debug \"^2.6.8\"\n    doctrine \"1.5.0\"\n    eslint-import-resolver-node \"^0.3.1\"\n    eslint-module-utils \"^2.2.0\"\n    has \"^1.0.1\"\n    lodash \"^4.17.4\"\n    minimatch \"^3.0.3\"\n    read-pkg-up \"^2.0.0\"\n    resolve \"^1.6.0\"\n\neslint-plugin-node@>=7.0.0, eslint-plugin-node@~7.0.1:\n  version \"7.0.1\"\n  resolved \"https://registry.npmjs.org/eslint-plugin-node/-/eslint-plugin-node-7.0.1.tgz\"\n  integrity sha512-lfVw3TEqThwq0j2Ba/Ckn2ABdwmL5dkOgAux1rvOk6CO7A6yGyPI2+zIxN6FyNkp1X1X/BSvKOceD6mBWSj4Yw==\n  dependencies:\n    eslint-plugin-es \"^1.3.1\"\n    eslint-utils \"^1.3.1\"\n    ignore \"^4.0.2\"\n    minimatch \"^3.0.4\"\n    resolve \"^1.8.1\"\n    semver \"^5.5.0\"\n\neslint-plugin-promise@>=4.0.0, eslint-plugin-promise@~4.0.0:\n  version \"4.0.1\"\n  resolved \"https://registry.npmjs.org/eslint-plugin-promise/-/eslint-plugin-promise-4.0.1.tgz\"\n  integrity sha512-Si16O0+Hqz1gDHsys6RtFRrW7cCTB6P7p3OJmKp3Y3dxpQE2qwOA7d3xnV+0mBmrPoi0RBnxlCKvqu70te6wjg==\n\neslint-plugin-react@>=7.11.1, eslint-plugin-react@~7.11.1:\n  version \"7.11.1\"\n  resolved \"https://registry.npmjs.org/eslint-plugin-react/-/eslint-plugin-react-7.11.1.tgz\"\n  integrity sha512-cVVyMadRyW7qsIUh3FHp3u6QHNhOgVrLQYdQEB1bPWBsgbNCHdFAeNMquBMCcZJu59eNthX053L70l7gRt4SCw==\n  dependencies:\n    array-includes \"^3.0.3\"\n    doctrine \"^2.1.0\"\n    has \"^1.0.3\"\n    jsx-ast-utils \"^2.0.1\"\n    prop-types \"^15.6.2\"\n\neslint-plugin-standard@>=4.0.0, eslint-plugin-standard@~4.0.0:\n  version \"4.0.0\"\n  resolved \"https://registry.npmjs.org/eslint-plugin-standard/-/eslint-plugin-standard-4.0.0.tgz\"\n  integrity sha512-OwxJkR6TQiYMmt1EsNRMe5qG3GsbjlcOhbGUBY4LtavF9DsLaTcoR+j2Tdjqi23oUwKNUqX7qcn5fPStafMdlA==\n\neslint-scope@^4.0.0:\n  version \"4.0.3\"\n  resolved \"https://registry.npmjs.org/eslint-scope/-/eslint-scope-4.0.3.tgz\"\n  integrity sha512-p7VutNr1O/QrxysMo3E45FjYDTeXBy0iTltPFNSqKAIfjDSXC+4dj+qfyuD8bfAXrW/y6lW3O76VaYNPKfpKrg==\n  dependencies:\n    esrecurse \"^4.1.0\"\n    estraverse \"^4.1.1\"\n\neslint-utils@^1.3.0, eslint-utils@^1.3.1:\n  version \"1.4.3\"\n  resolved \"https://registry.npmjs.org/eslint-utils/-/eslint-utils-1.4.3.tgz\"\n  integrity sha512-fbBN5W2xdY45KulGXmLHZ3c3FHfVYmKg0IrAKGOkT/464PQsx2UeIzfz1RmEci+KLm1bBaAzZAh8+/E+XAeZ8Q==\n  dependencies:\n    eslint-visitor-keys \"^1.1.0\"\n\neslint-visitor-keys@^1.0.0:\n  version \"1.0.0\"\n  resolved \"https://registry.npmjs.org/eslint-visitor-keys/-/eslint-visitor-keys-1.0.0.tgz\"\n  integrity sha512-qzm/XxIbxm/FHyH341ZrbnMUpe+5Bocte9xkmFMzPMjRaZMcXww+MpBptFvtU+79L362nqiLhekCxCxDPaUMBQ==\n\neslint-visitor-keys@^1.1.0:\n  version \"1.1.0\"\n  resolved \"https://registry.npmjs.org/eslint-visitor-keys/-/eslint-visitor-keys-1.1.0.tgz\"\n  integrity sha512-8y9YjtM1JBJU/A9Kc+SbaOV4y29sSWckBwMHa+FGtVj5gN/sbnKDf6xJUl+8g7FAij9LVaP8C24DUiH/f/2Z9A==\n\n\"eslint@^3.0.0 || ^4.0.0 || ^5.0.0\", eslint@>=4.19.1, eslint@>=5.0.0, eslint@~5.4.0, \"eslint@2.x - 5.x\":\n  version \"5.4.0\"\n  resolved \"https://registry.npmjs.org/eslint/-/eslint-5.4.0.tgz\"\n  integrity sha512-UIpL91XGex3qtL6qwyCQJar2j3osKxK9e3ano3OcGEIRM4oWIpCkDg9x95AXEC2wMs7PnxzOkPZ2gq+tsMS9yg==\n  dependencies:\n    ajv \"^6.5.0\"\n    babel-code-frame \"^6.26.0\"\n    chalk \"^2.1.0\"\n    cross-spawn \"^6.0.5\"\n    debug \"^3.1.0\"\n    doctrine \"^2.1.0\"\n    eslint-scope \"^4.0.0\"\n    eslint-utils \"^1.3.1\"\n    eslint-visitor-keys \"^1.0.0\"\n    espree \"^4.0.0\"\n    esquery \"^1.0.1\"\n    esutils \"^2.0.2\"\n    file-entry-cache \"^2.0.0\"\n    functional-red-black-tree \"^1.0.1\"\n    glob \"^7.1.2\"\n    globals \"^11.7.0\"\n    ignore \"^4.0.2\"\n    imurmurhash \"^0.1.4\"\n    inquirer \"^5.2.0\"\n    is-resolvable \"^1.1.0\"\n    js-yaml \"^3.11.0\"\n    json-stable-stringify-without-jsonify \"^1.0.1\"\n    levn \"^0.3.0\"\n    lodash \"^4.17.5\"\n    minimatch \"^3.0.4\"\n    mkdirp \"^0.5.1\"\n    natural-compare \"^1.4.0\"\n    optionator \"^0.8.2\"\n    path-is-inside \"^1.0.2\"\n    pluralize \"^7.0.0\"\n    progress \"^2.0.0\"\n    regexpp \"^2.0.0\"\n    require-uncached \"^1.0.3\"\n    semver \"^5.5.0\"\n    strip-ansi \"^4.0.0\"\n    strip-json-comments \"^2.0.1\"\n    table \"^4.0.3\"\n    text-table \"^0.2.0\"\n\nespree@^4.0.0:\n  version \"4.1.0\"\n  resolved \"https://registry.npmjs.org/espree/-/espree-4.1.0.tgz\"\n  integrity sha512-I5BycZW6FCVIub93TeVY1s7vjhP9CY6cXCznIRfiig7nRviKZYdRnj/sHEWC6A7WE9RDWOFq9+7OsWSYz8qv2w==\n  dependencies:\n    acorn \"^6.0.2\"\n    acorn-jsx \"^5.0.0\"\n    eslint-visitor-keys \"^1.0.0\"\n\nesprima@^4.0.0:\n  version \"4.0.1\"\n  resolved \"https://registry.npmjs.org/esprima/-/esprima-4.0.1.tgz\"\n  integrity sha512-eGuFFw7Upda+g4p+QHvnW0RyTX/SVeJBDM/gCtMARO0cLuT2HcEKnTPvhjV6aGeqrCB/sbNop0Kszm0jsaWU4A==\n\nesquery@^1.0.1:\n  version \"1.0.1\"\n  resolved \"https://registry.npmjs.org/esquery/-/esquery-1.0.1.tgz\"\n  integrity sha512-SmiyZ5zIWH9VM+SRUReLS5Q8a7GxtRdxEBVZpm98rJM7Sb+A9DVCndXfkeFUd3byderg+EbDkfnevfCwynWaNA==\n  dependencies:\n    estraverse \"^4.0.0\"\n\nesrecurse@^4.1.0:\n  version \"4.2.1\"\n  resolved \"https://registry.npmjs.org/esrecurse/-/esrecurse-4.2.1.tgz\"\n  integrity sha512-64RBB++fIOAXPw3P9cy89qfMlvZEXZkqqJkjqqXIvzP5ezRZjW+lPWjw35UX/3EhUPFYbg5ER4JYgDw4007/DQ==\n  dependencies:\n    estraverse \"^4.1.0\"\n\nestraverse@^4.0.0, estraverse@^4.1.0, estraverse@^4.1.1:\n  version \"4.2.0\"\n  resolved \"https://registry.npmjs.org/estraverse/-/estraverse-4.2.0.tgz\"\n  integrity sha1-De4/7TH81GlhjOc0IJn8GvoL2xM=\n\nesutils@^2.0.2:\n  version \"2.0.2\"\n  resolved \"https://registry.npmjs.org/esutils/-/esutils-2.0.2.tgz\"\n  integrity sha1-Cr9PHKpbyx96nYrMbepPqqBLrJs=\n\neventemitter3@^4.0.0:\n  version \"4.0.7\"\n  resolved \"https://registry.npmjs.org/eventemitter3/-/eventemitter3-4.0.7.tgz\"\n  integrity sha512-8guHBZCwKnFhYdHr2ysuRWErTwhoN2X8XELRlrRwpmfeY2jjuUN4taQMsULKUVo1K4DvZl+0pgfyoysHxvmvEw==\n\nexeca@^1.0.0:\n  version \"1.0.0\"\n  resolved \"https://registry.npmjs.org/execa/-/execa-1.0.0.tgz\"\n  integrity sha512-adbxcyWV46qiHyvSp50TKt05tB4tK3HcmF7/nxfAdhnox83seTDbwnaqKO4sXRy7roHAIFqJP/Rw/AuEbX61LA==\n  dependencies:\n    cross-spawn \"^6.0.0\"\n    get-stream \"^4.0.0\"\n    is-stream \"^1.1.0\"\n    npm-run-path \"^2.0.0\"\n    p-finally \"^1.0.0\"\n    signal-exit \"^3.0.0\"\n    strip-eof \"^1.0.0\"\n\nexpand-brackets@^2.1.4:\n  version \"2.1.4\"\n  resolved \"https://registry.npmjs.org/expand-brackets/-/expand-brackets-2.1.4.tgz\"\n  integrity sha1-t3c14xXOMPa27/D4OwQVGiJEliI=\n  dependencies:\n    debug \"^2.3.3\"\n    define-property \"^0.2.5\"\n    extend-shallow \"^2.0.1\"\n    posix-character-classes \"^0.1.0\"\n    regex-not \"^1.0.0\"\n    snapdragon \"^0.8.1\"\n    to-regex \"^3.0.1\"\n\nextend-shallow@^2.0.1:\n  version \"2.0.1\"\n  resolved \"https://registry.npmjs.org/extend-shallow/-/extend-shallow-2.0.1.tgz\"\n  integrity sha1-Ua99YUrZqfYQ6huvu5idaxxWiQ8=\n  dependencies:\n    is-extendable \"^0.1.0\"\n\nextend-shallow@^3.0.0, extend-shallow@^3.0.2:\n  version \"3.0.2\"\n  resolved \"https://registry.npmjs.org/extend-shallow/-/extend-shallow-3.0.2.tgz\"\n  integrity sha1-Jqcarwc7OfshJxcnRhMcJwQCjbg=\n  dependencies:\n    assign-symbols \"^1.0.0\"\n    is-extendable \"^1.0.1\"\n\nexternal-editor@^2.1.0:\n  version \"2.2.0\"\n  resolved \"https://registry.npmjs.org/external-editor/-/external-editor-2.2.0.tgz\"\n  integrity sha512-bSn6gvGxKt+b7+6TKEv1ZycHleA7aHhRHyAqJyp5pbUFuYYNIzpZnQDk7AsYckyWdEnTeAnay0aCy2aV6iTk9A==\n  dependencies:\n    chardet \"^0.4.0\"\n    iconv-lite \"^0.4.17\"\n    tmp \"^0.0.33\"\n\nextglob@^2.0.4:\n  version \"2.0.4\"\n  resolved \"https://registry.npmjs.org/extglob/-/extglob-2.0.4.tgz\"\n  integrity sha512-Nmb6QXkELsuBr24CJSkilo6UHHgbekK5UiZgfE6UHD3Eb27YC6oD+bhcT+tJ6cl8dmsgdQxnWlcry8ksBIBLpw==\n  dependencies:\n    array-unique \"^0.3.2\"\n    define-property \"^1.0.0\"\n    expand-brackets \"^2.1.4\"\n    extend-shallow \"^2.0.1\"\n    fragment-cache \"^0.2.1\"\n    regex-not \"^1.0.0\"\n    snapdragon \"^0.8.1\"\n    to-regex \"^3.0.1\"\n\nfast-deep-equal@^2.0.1:\n  version \"2.0.1\"\n  resolved \"https://registry.npmjs.org/fast-deep-equal/-/fast-deep-equal-2.0.1.tgz\"\n  integrity sha1-ewUhjd+WZ79/Nwv3/bLLFf3Qqkk=\n\nfast-json-stable-stringify@^2.0.0:\n  version \"2.0.0\"\n  resolved \"https://registry.npmjs.org/fast-json-stable-stringify/-/fast-json-stable-stringify-2.0.0.tgz\"\n  integrity sha1-1RQsDK7msRifh9OnYREGT4bIu/I=\n\nfast-levenshtein@~2.0.4:\n  version \"2.0.6\"\n  resolved \"https://registry.npmjs.org/fast-levenshtein/-/fast-levenshtein-2.0.6.tgz\"\n  integrity sha1-PYpcZog6FqMMqGQ+hR8Zuqd5eRc=\n\nfigures@^1.7.0:\n  version \"1.7.0\"\n  resolved \"https://registry.npmjs.org/figures/-/figures-1.7.0.tgz\"\n  integrity sha1-y+Hjr/zxzUS4DK3+0o3Hk6lwHS4=\n  dependencies:\n    escape-string-regexp \"^1.0.5\"\n    object-assign \"^4.1.0\"\n\nfigures@^2.0.0:\n  version \"2.0.0\"\n  resolved \"https://registry.npmjs.org/figures/-/figures-2.0.0.tgz\"\n  integrity sha1-OrGi0qYsi/tDGgyUy3l6L84nyWI=\n  dependencies:\n    escape-string-regexp \"^1.0.5\"\n\nfile-entry-cache@^2.0.0:\n  version \"2.0.0\"\n  resolved \"https://registry.npmjs.org/file-entry-cache/-/file-entry-cache-2.0.0.tgz\"\n  integrity sha1-w5KZDD5oR4PYOLjISkXYoEhFg2E=\n  dependencies:\n    flat-cache \"^1.2.1\"\n    object-assign \"^4.0.1\"\n\nfill-range@^4.0.0:\n  version \"4.0.0\"\n  resolved \"https://registry.npmjs.org/fill-range/-/fill-range-4.0.0.tgz\"\n  integrity sha1-1USBHUKPmOsGpj3EAtJAPDKMOPc=\n  dependencies:\n    extend-shallow \"^2.0.1\"\n    is-number \"^3.0.0\"\n    repeat-string \"^1.6.1\"\n    to-regex-range \"^2.1.0\"\n\nfind-parent-dir@^0.3.0:\n  version \"0.3.0\"\n  resolved \"https://registry.npmjs.org/find-parent-dir/-/find-parent-dir-0.3.0.tgz\"\n  integrity sha1-M8RLQpqysvBkYpnF+fcY83b/jVQ=\n\nfind-root@^1.0.0:\n  version \"1.1.0\"\n  resolved \"https://registry.npmjs.org/find-root/-/find-root-1.1.0.tgz\"\n  integrity sha512-NKfW6bec6GfKc0SGx1e07QZY9PE99u0Bft/0rzSD5k3sO/vwkVUpDUKVm5Gpp5Ue3YfShPFTX2070tDs5kB9Ng==\n\nfind-up@^2.0.0:\n  version \"2.1.0\"\n  resolved \"https://registry.npmjs.org/find-up/-/find-up-2.1.0.tgz\"\n  integrity sha1-RdG35QbHF93UgndaK3eSCjwMV6c=\n  dependencies:\n    locate-path \"^2.0.0\"\n\nfind-up@^2.1.0:\n  version \"2.1.0\"\n  resolved \"https://registry.npmjs.org/find-up/-/find-up-2.1.0.tgz\"\n  integrity sha1-RdG35QbHF93UgndaK3eSCjwMV6c=\n  dependencies:\n    locate-path \"^2.0.0\"\n\nfind-up@^3.0.0:\n  version \"3.0.0\"\n  resolved \"https://registry.npmjs.org/find-up/-/find-up-3.0.0.tgz\"\n  integrity sha512-1yD6RmLI1XBfxugvORwlck6f75tYL+iR0jqwsOrOxMZyGYqUuDhJ0l4AXdO1iX/FTs9cBAMEk1gWSEx1kSbylg==\n  dependencies:\n    locate-path \"^3.0.0\"\n\nflat-cache@^1.2.1:\n  version \"1.3.4\"\n  resolved \"https://registry.npmjs.org/flat-cache/-/flat-cache-1.3.4.tgz\"\n  integrity sha512-VwyB3Lkgacfik2vhqR4uv2rvebqmDvFu4jlN/C1RzWoJEo8I7z4Q404oiqYCkq41mni8EzQnm95emU9seckwtg==\n  dependencies:\n    circular-json \"^0.3.1\"\n    graceful-fs \"^4.1.2\"\n    rimraf \"~2.6.2\"\n    write \"^0.2.1\"\n\nfollow-redirects@^1.0.0:\n  version \"1.7.0\"\n  resolved \"https://registry.npmjs.org/follow-redirects/-/follow-redirects-1.7.0.tgz\"\n  integrity sha512-m/pZQy4Gj287eNy94nivy5wchN3Kp+Q5WgUPNy5lJSZ3sgkVKSYV/ZChMAQVIgx1SqfZ2zBZtPA2YlXIWxxJOQ==\n  dependencies:\n    debug \"^3.2.6\"\n\nfor-in@^1.0.2:\n  version \"1.0.2\"\n  resolved \"https://registry.npmjs.org/for-in/-/for-in-1.0.2.tgz\"\n  integrity sha1-gQaNKVqBQuwKxybG4iAMMPttXoA=\n\nfragment-cache@^0.2.1:\n  version \"0.2.1\"\n  resolved \"https://registry.npmjs.org/fragment-cache/-/fragment-cache-0.2.1.tgz\"\n  integrity sha1-QpD60n8T6Jvn8zeZxrxaCr//DRk=\n  dependencies:\n    map-cache \"^0.2.2\"\n\nfs.realpath@^1.0.0:\n  version \"1.0.0\"\n  resolved \"https://registry.npmjs.org/fs.realpath/-/fs.realpath-1.0.0.tgz\"\n  integrity sha1-FQStJSMVjKpA20onh8sBQRmU6k8=\n\nfunction-bind@^1.1.1:\n  version \"1.1.1\"\n  resolved \"https://registry.npmjs.org/function-bind/-/function-bind-1.1.1.tgz\"\n  integrity sha512-yIovAzMX49sF8Yl58fSCWJ5svSLuaibPxXQJFLmBObTuCr0Mf1KiPopGM9NiFjiYBCbfaa2Fh6breQ6ANVTI0A==\n\nfunctional-red-black-tree@^1.0.1:\n  version \"1.0.1\"\n  resolved \"https://registry.npmjs.org/functional-red-black-tree/-/functional-red-black-tree-1.0.1.tgz\"\n  integrity sha1-GwqzvVU7Kg1jmdKcDj6gslIHgyc=\n\ng-status@^2.0.2:\n  version \"2.0.2\"\n  resolved \"https://registry.npmjs.org/g-status/-/g-status-2.0.2.tgz\"\n  integrity sha512-kQoE9qH+T1AHKgSSD0Hkv98bobE90ILQcXAF4wvGgsr7uFqNvwmh8j+Lq3l0RVt3E3HjSbv2B9biEGcEtpHLCA==\n  dependencies:\n    arrify \"^1.0.1\"\n    matcher \"^1.0.0\"\n    simple-git \"^1.85.0\"\n\nget-own-enumerable-property-symbols@^3.0.0:\n  version \"3.0.0\"\n  resolved \"https://registry.npmjs.org/get-own-enumerable-property-symbols/-/get-own-enumerable-property-symbols-3.0.0.tgz\"\n  integrity sha512-CIJYJC4GGF06TakLg8z4GQKvDsx9EMspVxOYih7LerEL/WosUnFIww45CGfxfeKHqlg3twgUrYRT1O3WQqjGCg==\n\nget-stdin@^6.0.0:\n  version \"6.0.0\"\n  resolved \"https://registry.npmjs.org/get-stdin/-/get-stdin-6.0.0.tgz\"\n  integrity sha512-jp4tHawyV7+fkkSKyvjuLZswblUtz+SQKzSWnBbii16BuZksJlU1wuBYXY75r+duh/llF1ur6oNwi+2ZzjKZ7g==\n\nget-stream@^4.0.0:\n  version \"4.1.0\"\n  resolved \"https://registry.npmjs.org/get-stream/-/get-stream-4.1.0.tgz\"\n  integrity sha512-GMat4EJ5161kIy2HevLlr4luNjBgvmj413KaQA7jt4V8B4RDsfpHk7WQ9GVqfYyyx8OS/L66Kox+rJRNklLK7w==\n  dependencies:\n    pump \"^3.0.0\"\n\nget-value@^2.0.3, get-value@^2.0.6:\n  version \"2.0.6\"\n  resolved \"https://registry.npmjs.org/get-value/-/get-value-2.0.6.tgz\"\n  integrity sha1-3BXKHGcjh8p2vTesCjlbogQqLCg=\n\nglob@^7.0.3, glob@^7.0.5, glob@^7.1.2, glob@^7.1.3:\n  version \"7.1.4\"\n  resolved \"https://registry.npmjs.org/glob/-/glob-7.1.4.tgz\"\n  integrity sha512-hkLPepehmnKk41pUGm3sYxoFs/umurYfYJCerbXEyFIWcAzvpipAgVkBqqT9RBKMGjnq6kMuyYwha6csxbiM1A==\n  dependencies:\n    fs.realpath \"^1.0.0\"\n    inflight \"^1.0.4\"\n    inherits \"2\"\n    minimatch \"^3.0.4\"\n    once \"^1.3.0\"\n    path-is-absolute \"^1.0.0\"\n\nglobals@^11.7.0:\n  version \"11.12.0\"\n  resolved \"https://registry.npmjs.org/globals/-/globals-11.12.0.tgz\"\n  integrity sha512-WOBp/EEGUiIsJSp7wcv/y6MO+lV9UoncWqxuFfm8eBwzWNgyfBd6Gz+IeKQ9jCmyhoH99g15M3T+QaVHFjizVA==\n\nglobby@^6.1.0:\n  version \"6.1.0\"\n  resolved \"https://registry.npmjs.org/globby/-/globby-6.1.0.tgz\"\n  integrity sha1-9abXDoOV4hyFj7BInWTfAkJNUGw=\n  dependencies:\n    array-union \"^1.0.1\"\n    glob \"^7.0.3\"\n    object-assign \"^4.0.1\"\n    pify \"^2.0.0\"\n    pinkie-promise \"^2.0.0\"\n\ngraceful-fs@^4.1.2:\n  version \"4.1.15\"\n  resolved \"https://registry.npmjs.org/graceful-fs/-/graceful-fs-4.1.15.tgz\"\n  integrity sha512-6uHUhOPEBgQ24HM+r6b/QwWfZq+yiFcipKFrOFiBEnWdy5sdzYoi+pJeQaPI5qOLRFqWmAXUPQNsielzdLoecA==\n\nhas-ansi@^2.0.0:\n  version \"2.0.0\"\n  resolved \"https://registry.npmjs.org/has-ansi/-/has-ansi-2.0.0.tgz\"\n  integrity sha1-NPUEnOHs3ysGSa8+8k5F7TVBbZE=\n  dependencies:\n    ansi-regex \"^2.0.0\"\n\nhas-flag@^3.0.0:\n  version \"3.0.0\"\n  resolved \"https://registry.npmjs.org/has-flag/-/has-flag-3.0.0.tgz\"\n  integrity sha1-tdRU3CGZriJWmfNGfloH87lVuv0=\n\nhas-symbols@^1.0.0:\n  version \"1.0.0\"\n  resolved \"https://registry.npmjs.org/has-symbols/-/has-symbols-1.0.0.tgz\"\n  integrity sha1-uhqPGvKg/DllD1yFA2dwQSIGO0Q=\n\nhas-value@^0.3.1:\n  version \"0.3.1\"\n  resolved \"https://registry.npmjs.org/has-value/-/has-value-0.3.1.tgz\"\n  integrity sha1-ex9YutpiyoJ+wKIHgCVlSEWZXh8=\n  dependencies:\n    get-value \"^2.0.3\"\n    has-values \"^0.1.4\"\n    isobject \"^2.0.0\"\n\nhas-value@^1.0.0:\n  version \"1.0.0\"\n  resolved \"https://registry.npmjs.org/has-value/-/has-value-1.0.0.tgz\"\n  integrity sha1-GLKB2lhbHFxR3vJMkw7SmgvmsXc=\n  dependencies:\n    get-value \"^2.0.6\"\n    has-values \"^1.0.0\"\n    isobject \"^3.0.0\"\n\nhas-values@^0.1.4:\n  version \"0.1.4\"\n  resolved \"https://registry.npmjs.org/has-values/-/has-values-0.1.4.tgz\"\n  integrity sha1-bWHeldkd/Km5oCCJrThL/49it3E=\n\nhas-values@^1.0.0:\n  version \"1.0.0\"\n  resolved \"https://registry.npmjs.org/has-values/-/has-values-1.0.0.tgz\"\n  integrity sha1-lbC2P+whRmGab+V/51Yo1aOe/k8=\n  dependencies:\n    is-number \"^3.0.0\"\n    kind-of \"^4.0.0\"\n\nhas@^1.0.1, has@^1.0.3:\n  version \"1.0.3\"\n  resolved \"https://registry.npmjs.org/has/-/has-1.0.3.tgz\"\n  integrity sha512-f2dvO0VU6Oej7RkWJGrehjbzMAjFp5/VKPp5tTpWIV4JHHZK1/BxbFRtf/siA2SWTe09caDmVtYYzWEIbBS4zw==\n  dependencies:\n    function-bind \"^1.1.1\"\n\nhe@^1.1.1:\n  version \"1.2.0\"\n  resolved \"https://registry.npmjs.org/he/-/he-1.2.0.tgz\"\n  integrity sha512-F/1DnUGPopORZi0ni+CvrCgHQ5FyEAHRLSApuYWMmrbSwoN2Mn/7k+Gl38gJnR7yyDZk6WLXwiGod1JOWNDKGw==\n\nhosted-git-info@^2.1.4:\n  version \"2.8.9\"\n  resolved \"https://registry.npmjs.org/hosted-git-info/-/hosted-git-info-2.8.9.tgz\"\n  integrity sha512-mxIDAb9Lsm6DoOJ7xH+5+X4y1LU/4Hi50L9C5sIswK3JzULS4bwk1FvjdBgvYR4bzT4tuUQiC15FE2f5HbLvYw==\n\nhttp-proxy@^1.8.1:\n  version \"1.18.1\"\n  resolved \"https://registry.npmjs.org/http-proxy/-/http-proxy-1.18.1.tgz\"\n  integrity sha512-7mz/721AbnJwIVbnaSv1Cz3Am0ZLT/UBwkC92VlxhXv/k/BBQfM2fXElQNC27BVGr0uwUpplYPQM9LnaBMR5NQ==\n  dependencies:\n    eventemitter3 \"^4.0.0\"\n    follow-redirects \"^1.0.0\"\n    requires-port \"^1.0.0\"\n\nhttp-server@^0.11.1:\n  version \"0.11.1\"\n  resolved \"https://registry.npmjs.org/http-server/-/http-server-0.11.1.tgz\"\n  integrity sha512-6JeGDGoujJLmhjiRGlt8yK8Z9Kl0vnl/dQoQZlc4oeqaUoAKQg94NILLfrY3oWzSyFaQCVNTcKE5PZ3cH8VP9w==\n  dependencies:\n    colors \"1.0.3\"\n    corser \"~2.0.0\"\n    ecstatic \"^3.0.0\"\n    http-proxy \"^1.8.1\"\n    opener \"~1.4.0\"\n    optimist \"0.6.x\"\n    portfinder \"^1.0.13\"\n    union \"~0.4.3\"\n\nhusky@1.2.0:\n  version \"1.2.0\"\n  resolved \"https://registry.npmjs.org/husky/-/husky-1.2.0.tgz\"\n  integrity sha512-/ib3+iycykXC0tYIxsyqierikVa9DA2DrT32UEirqNEFVqOj1bFMTgP3jAz8HM7FgC/C8pc/BTUa9MV2GEkZaA==\n  dependencies:\n    cosmiconfig \"^5.0.6\"\n    execa \"^1.0.0\"\n    find-up \"^3.0.0\"\n    get-stdin \"^6.0.0\"\n    is-ci \"^1.2.1\"\n    pkg-dir \"^3.0.0\"\n    please-upgrade-node \"^3.1.1\"\n    read-pkg \"^4.0.1\"\n    run-node \"^1.0.0\"\n    slash \"^2.0.0\"\n\niconv-lite@^0.4.17:\n  version \"0.4.24\"\n  resolved \"https://registry.npmjs.org/iconv-lite/-/iconv-lite-0.4.24.tgz\"\n  integrity sha512-v3MXnZAcvnywkTUEZomIActle7RXXeedOR31wwl7VlyoXO4Qi9arvSenNQWne1TcRwhCL1HwLI21bEqdpj8/rA==\n  dependencies:\n    safer-buffer \">= 2.1.2 < 3\"\n\nignore@^3.0.9:\n  version \"3.3.10\"\n  resolved \"https://registry.npmjs.org/ignore/-/ignore-3.3.10.tgz\"\n  integrity sha512-Pgs951kaMm5GXP7MOvxERINe3gsaVjUWFm+UZPSq9xYriQAksyhg0csnS0KXSNRD5NmNdapXEpjxG49+AKh/ug==\n\nignore@^4.0.2:\n  version \"4.0.6\"\n  resolved \"https://registry.npmjs.org/ignore/-/ignore-4.0.6.tgz\"\n  integrity sha512-cyFDKrqc/YdcWFniJhzI42+AzS+gNwmUzOSFcRCQYwySuBBBy/KjuxWLZ/FHEH6Moq1NizMOBWyTcv8O4OZIMg==\n\nimport-fresh@^2.0.0:\n  version \"2.0.0\"\n  resolved \"https://registry.npmjs.org/import-fresh/-/import-fresh-2.0.0.tgz\"\n  integrity sha1-2BNVwVYS04bGH53dOSLUMEgipUY=\n  dependencies:\n    caller-path \"^2.0.0\"\n    resolve-from \"^3.0.0\"\n\nimurmurhash@^0.1.4:\n  version \"0.1.4\"\n  resolved \"https://registry.npmjs.org/imurmurhash/-/imurmurhash-0.1.4.tgz\"\n  integrity sha1-khi5srkoojixPcT7a21XbyMUU+o=\n\nindent-string@^3.0.0:\n  version \"3.2.0\"\n  resolved \"https://registry.npmjs.org/indent-string/-/indent-string-3.2.0.tgz\"\n  integrity sha1-Sl/W0nzDMvN+VBmlBNu4NxBckok=\n\ninflight@^1.0.4:\n  version \"1.0.6\"\n  resolved \"https://registry.npmjs.org/inflight/-/inflight-1.0.6.tgz\"\n  integrity sha1-Sb1jMdfQLQwJvJEKEHW6gWW1bfk=\n  dependencies:\n    once \"^1.3.0\"\n    wrappy \"1\"\n\ninherits@2:\n  version \"2.0.3\"\n  resolved \"https://registry.npmjs.org/inherits/-/inherits-2.0.3.tgz\"\n  integrity sha1-Yzwsg+PaQqUC9SRmAiSA9CCCYd4=\n\ninquirer@^5.2.0:\n  version \"5.2.0\"\n  resolved \"https://registry.npmjs.org/inquirer/-/inquirer-5.2.0.tgz\"\n  integrity sha512-E9BmnJbAKLPGonz0HeWHtbKf+EeSP93paWO3ZYoUpq/aowXvYGjjCSuashhXPpzbArIjBbji39THkxTz9ZeEUQ==\n  dependencies:\n    ansi-escapes \"^3.0.0\"\n    chalk \"^2.0.0\"\n    cli-cursor \"^2.1.0\"\n    cli-width \"^2.0.0\"\n    external-editor \"^2.1.0\"\n    figures \"^2.0.0\"\n    lodash \"^4.3.0\"\n    mute-stream \"0.0.7\"\n    run-async \"^2.2.0\"\n    rxjs \"^5.5.2\"\n    string-width \"^2.1.0\"\n    strip-ansi \"^4.0.0\"\n    through \"^2.3.6\"\n\nis-accessor-descriptor@^0.1.6:\n  version \"0.1.6\"\n  resolved \"https://registry.npmjs.org/is-accessor-descriptor/-/is-accessor-descriptor-0.1.6.tgz\"\n  integrity sha1-qeEss66Nh2cn7u84Q/igiXtcmNY=\n  dependencies:\n    kind-of \"^3.0.2\"\n\nis-accessor-descriptor@^1.0.0:\n  version \"1.0.0\"\n  resolved \"https://registry.npmjs.org/is-accessor-descriptor/-/is-accessor-descriptor-1.0.0.tgz\"\n  integrity sha512-m5hnHTkcVsPfqx3AKlyttIPb7J+XykHvJP2B9bZDjlhLIoEq4XoK64Vg7boZlVWYK6LUY94dYPEE7Lh0ZkZKcQ==\n  dependencies:\n    kind-of \"^6.0.0\"\n\nis-arrayish@^0.2.1:\n  version \"0.2.1\"\n  resolved \"https://registry.npmjs.org/is-arrayish/-/is-arrayish-0.2.1.tgz\"\n  integrity sha1-d8mYQFJ6qOyxqLppe4BkWnqSap0=\n\nis-buffer@^1.1.5:\n  version \"1.1.6\"\n  resolved \"https://registry.npmjs.org/is-buffer/-/is-buffer-1.1.6.tgz\"\n  integrity sha512-NcdALwpXkTm5Zvvbk7owOUSvVvBKDgKP5/ewfXEznmQFfs4ZRmanOeKBTjRVjka3QFoN6XJ+9F3USqfHqTaU5w==\n\nis-callable@^1.1.4:\n  version \"1.1.4\"\n  resolved \"https://registry.npmjs.org/is-callable/-/is-callable-1.1.4.tgz\"\n  integrity sha512-r5p9sxJjYnArLjObpjA4xu5EKI3CuKHkJXMhT7kwbpUyIFD1n5PMAsoPvWnvtZiNz7LjkYDRZhd7FlI0eMijEA==\n\nis-ci@^1.2.1:\n  version \"1.2.1\"\n  resolved \"https://registry.npmjs.org/is-ci/-/is-ci-1.2.1.tgz\"\n  integrity sha512-s6tfsaQaQi3JNciBH6shVqEDvhGut0SUXr31ag8Pd8BBbVVlcGfWhpPmEOoM6RJ5TFhbypvf5yyRw/VXW1IiWg==\n  dependencies:\n    ci-info \"^1.5.0\"\n\nis-data-descriptor@^0.1.4:\n  version \"0.1.4\"\n  resolved \"https://registry.npmjs.org/is-data-descriptor/-/is-data-descriptor-0.1.4.tgz\"\n  integrity sha1-C17mSDiOLIYCgueT8YVv7D8wG1Y=\n  dependencies:\n    kind-of \"^3.0.2\"\n\nis-data-descriptor@^1.0.0:\n  version \"1.0.0\"\n  resolved \"https://registry.npmjs.org/is-data-descriptor/-/is-data-descriptor-1.0.0.tgz\"\n  integrity sha512-jbRXy1FmtAoCjQkVmIVYwuuqDFUbaOeDjmed1tOGPrsMhtJA4rD9tkgA0F1qJ3gRFRXcHYVkdeaP50Q5rE/jLQ==\n  dependencies:\n    kind-of \"^6.0.0\"\n\nis-date-object@^1.0.1:\n  version \"1.0.1\"\n  resolved \"https://registry.npmjs.org/is-date-object/-/is-date-object-1.0.1.tgz\"\n  integrity sha1-mqIOtq7rv/d/vTPnTKAbM1gdOhY=\n\nis-descriptor@^0.1.0:\n  version \"0.1.6\"\n  resolved \"https://registry.npmjs.org/is-descriptor/-/is-descriptor-0.1.6.tgz\"\n  integrity sha512-avDYr0SB3DwO9zsMov0gKCESFYqCnE4hq/4z3TdUlukEy5t9C0YRq7HLrsN52NAcqXKaepeCD0n+B0arnVG3Hg==\n  dependencies:\n    is-accessor-descriptor \"^0.1.6\"\n    is-data-descriptor \"^0.1.4\"\n    kind-of \"^5.0.0\"\n\nis-descriptor@^1.0.0:\n  version \"1.0.2\"\n  resolved \"https://registry.npmjs.org/is-descriptor/-/is-descriptor-1.0.2.tgz\"\n  integrity sha512-2eis5WqQGV7peooDyLmNEPUrps9+SXX5c9pL3xEB+4e9HnGuDa7mB7kHxHw4CbqS9k1T2hOH3miL8n8WtiYVtg==\n  dependencies:\n    is-accessor-descriptor \"^1.0.0\"\n    is-data-descriptor \"^1.0.0\"\n    kind-of \"^6.0.2\"\n\nis-descriptor@^1.0.2:\n  version \"1.0.2\"\n  resolved \"https://registry.npmjs.org/is-descriptor/-/is-descriptor-1.0.2.tgz\"\n  integrity sha512-2eis5WqQGV7peooDyLmNEPUrps9+SXX5c9pL3xEB+4e9HnGuDa7mB7kHxHw4CbqS9k1T2hOH3miL8n8WtiYVtg==\n  dependencies:\n    is-accessor-descriptor \"^1.0.0\"\n    is-data-descriptor \"^1.0.0\"\n    kind-of \"^6.0.2\"\n\nis-directory@^0.3.1:\n  version \"0.3.1\"\n  resolved \"https://registry.npmjs.org/is-directory/-/is-directory-0.3.1.tgz\"\n  integrity sha1-YTObbyR1/Hcv2cnYP1yFddwVSuE=\n\nis-extendable@^0.1.0, is-extendable@^0.1.1:\n  version \"0.1.1\"\n  resolved \"https://registry.npmjs.org/is-extendable/-/is-extendable-0.1.1.tgz\"\n  integrity sha1-YrEQ4omkcUGOPsNqYX1HLjAd/Ik=\n\nis-extendable@^1.0.1:\n  version \"1.0.1\"\n  resolved \"https://registry.npmjs.org/is-extendable/-/is-extendable-1.0.1.tgz\"\n  integrity sha512-arnXMxT1hhoKo9k1LZdmlNyJdDDfy2v0fXjFlmok4+i8ul/6WlbVge9bhM74OpNPQPMGUToDtz+KXa1PneJxOA==\n  dependencies:\n    is-plain-object \"^2.0.4\"\n\nis-extglob@^2.1.1:\n  version \"2.1.1\"\n  resolved \"https://registry.npmjs.org/is-extglob/-/is-extglob-2.1.1.tgz\"\n  integrity sha1-qIwCU1eR8C7TfHahueqXc8gz+MI=\n\nis-fullwidth-code-point@^1.0.0:\n  version \"1.0.0\"\n  resolved \"https://registry.npmjs.org/is-fullwidth-code-point/-/is-fullwidth-code-point-1.0.0.tgz\"\n  integrity sha1-754xOG8DGn8NZDr4L95QxFfvAMs=\n  dependencies:\n    number-is-nan \"^1.0.0\"\n\nis-fullwidth-code-point@^2.0.0:\n  version \"2.0.0\"\n  resolved \"https://registry.npmjs.org/is-fullwidth-code-point/-/is-fullwidth-code-point-2.0.0.tgz\"\n  integrity sha1-o7MKXE8ZkYMWeqq5O+764937ZU8=\n\nis-glob@^4.0.0:\n  version \"4.0.1\"\n  resolved \"https://registry.npmjs.org/is-glob/-/is-glob-4.0.1.tgz\"\n  integrity sha512-5G0tKtBTFImOqDnLB2hG6Bp2qcKEFduo4tZu9MT/H6NQv/ghhy30o55ufafxJ/LdH79LLs2Kfrn85TLKyA7BUg==\n  dependencies:\n    is-extglob \"^2.1.1\"\n\nis-number@^3.0.0:\n  version \"3.0.0\"\n  resolved \"https://registry.npmjs.org/is-number/-/is-number-3.0.0.tgz\"\n  integrity sha1-JP1iAaR4LPUFYcgQJ2r8fRLXEZU=\n  dependencies:\n    kind-of \"^3.0.2\"\n\nis-obj@^1.0.1:\n  version \"1.0.1\"\n  resolved \"https://registry.npmjs.org/is-obj/-/is-obj-1.0.1.tgz\"\n  integrity sha1-PkcprB9f3gJc19g6iW2rn09n2w8=\n\nis-observable@^1.1.0:\n  version \"1.1.0\"\n  resolved \"https://registry.npmjs.org/is-observable/-/is-observable-1.1.0.tgz\"\n  integrity sha512-NqCa4Sa2d+u7BWc6CukaObG3Fh+CU9bvixbpcXYhy2VvYS7vVGIdAgnIS5Ks3A/cqk4rebLJ9s8zBstT2aKnIA==\n  dependencies:\n    symbol-observable \"^1.1.0\"\n\nis-path-cwd@^1.0.0:\n  version \"1.0.0\"\n  resolved \"https://registry.npmjs.org/is-path-cwd/-/is-path-cwd-1.0.0.tgz\"\n  integrity sha1-0iXsIxMuie3Tj9p2dHLmLmXxEG0=\n\nis-path-in-cwd@^1.0.0:\n  version \"1.0.1\"\n  resolved \"https://registry.npmjs.org/is-path-in-cwd/-/is-path-in-cwd-1.0.1.tgz\"\n  integrity sha512-FjV1RTW48E7CWM7eE/J2NJvAEEVektecDBVBE5Hh3nM1Jd0kvhHtX68Pr3xsDf857xt3Y4AkwVULK1Vku62aaQ==\n  dependencies:\n    is-path-inside \"^1.0.0\"\n\nis-path-inside@^1.0.0:\n  version \"1.0.1\"\n  resolved \"https://registry.npmjs.org/is-path-inside/-/is-path-inside-1.0.1.tgz\"\n  integrity sha1-jvW33lBDej/cprToZe96pVy0gDY=\n  dependencies:\n    path-is-inside \"^1.0.1\"\n\nis-plain-object@^2.0.3, is-plain-object@^2.0.4:\n  version \"2.0.4\"\n  resolved \"https://registry.npmjs.org/is-plain-object/-/is-plain-object-2.0.4.tgz\"\n  integrity sha512-h5PpgXkWitc38BBMYawTYMWJHFZJVnBquFE57xFpjB8pJFiF6gZ+bU+WyI/yqXiFR5mdLsgYNaPe8uao6Uv9Og==\n  dependencies:\n    isobject \"^3.0.1\"\n\nis-promise@^2.1.0:\n  version \"2.1.0\"\n  resolved \"https://registry.npmjs.org/is-promise/-/is-promise-2.1.0.tgz\"\n  integrity sha1-eaKp7OfwlugPNtKy87wWwf9L8/o=\n\nis-regex@^1.0.4:\n  version \"1.0.4\"\n  resolved \"https://registry.npmjs.org/is-regex/-/is-regex-1.0.4.tgz\"\n  integrity sha1-VRdIm1RwkbCTDglWVM7SXul+lJE=\n  dependencies:\n    has \"^1.0.1\"\n\nis-regexp@^1.0.0:\n  version \"1.0.0\"\n  resolved \"https://registry.npmjs.org/is-regexp/-/is-regexp-1.0.0.tgz\"\n  integrity sha1-/S2INUXEa6xaYz57mgnof6LLUGk=\n\nis-resolvable@^1.1.0:\n  version \"1.1.0\"\n  resolved \"https://registry.npmjs.org/is-resolvable/-/is-resolvable-1.1.0.tgz\"\n  integrity sha512-qgDYXFSR5WvEfuS5dMj6oTMEbrrSaM0CrFk2Yiq/gXnBvD9pMa2jGXxyhGLfvhZpuMZe18CJpFxAt3CRs42NMg==\n\nis-stream@^1.1.0:\n  version \"1.1.0\"\n  resolved \"https://registry.npmjs.org/is-stream/-/is-stream-1.1.0.tgz\"\n  integrity sha1-EtSj3U5o4Lec6428hBc66A2RykQ=\n\nis-symbol@^1.0.2:\n  version \"1.0.2\"\n  resolved \"https://registry.npmjs.org/is-symbol/-/is-symbol-1.0.2.tgz\"\n  integrity sha512-HS8bZ9ox60yCJLH9snBpIwv9pYUAkcuLhSA1oero1UB5y9aiQpRA8y2ex945AOtCZL1lJDeIk3G5LthswI46Lw==\n  dependencies:\n    has-symbols \"^1.0.0\"\n\nis-windows@^1.0.2:\n  version \"1.0.2\"\n  resolved \"https://registry.npmjs.org/is-windows/-/is-windows-1.0.2.tgz\"\n  integrity sha512-eXK1UInq2bPmjyX6e3VHIzMLobc4J94i4AWn+Hpq3OU5KkrRC96OAcR3PRJ/pGu6m8TRnBHP9dkXQVsT/COVIA==\n\nisarray@^1.0.0, isarray@1.0.0:\n  version \"1.0.0\"\n  resolved \"https://registry.npmjs.org/isarray/-/isarray-1.0.0.tgz\"\n  integrity sha1-u5NdSFgsuhaMBoNJV6VKPgcSTxE=\n\nisexe@^2.0.0:\n  version \"2.0.0\"\n  resolved \"https://registry.npmjs.org/isexe/-/isexe-2.0.0.tgz\"\n  integrity sha1-6PvzdNxVb/iUehDcsFctYz8s+hA=\n\nisobject@^2.0.0:\n  version \"2.1.0\"\n  resolved \"https://registry.npmjs.org/isobject/-/isobject-2.1.0.tgz\"\n  integrity sha1-8GVWEJaj8dou9GJy+BXIQNh+DIk=\n  dependencies:\n    isarray \"1.0.0\"\n\nisobject@^3.0.0, isobject@^3.0.1:\n  version \"3.0.1\"\n  resolved \"https://registry.npmjs.org/isobject/-/isobject-3.0.1.tgz\"\n  integrity sha1-TkMekrEalzFjaqH5yNHMvP2reN8=\n\njest-get-type@^22.1.0:\n  version \"22.4.3\"\n  resolved \"https://registry.npmjs.org/jest-get-type/-/jest-get-type-22.4.3.tgz\"\n  integrity sha512-/jsz0Y+V29w1chdXVygEKSz2nBoHoYqNShPe+QgxSNjAuP1i8+k4LbQNrfoliKej0P45sivkSCh7yiD6ubHS3w==\n\njest-validate@^23.5.0:\n  version \"23.6.0\"\n  resolved \"https://registry.npmjs.org/jest-validate/-/jest-validate-23.6.0.tgz\"\n  integrity sha512-OFKapYxe72yz7agrDAWi8v2WL8GIfVqcbKRCLbRG9PAxtzF9b1SEDdTpytNDN12z2fJynoBwpMpvj2R39plI2A==\n  dependencies:\n    chalk \"^2.0.1\"\n    jest-get-type \"^22.1.0\"\n    leven \"^2.1.0\"\n    pretty-format \"^23.6.0\"\n\n\"js-tokens@^3.0.0 || ^4.0.0\", js-tokens@^3.0.2:\n  version \"3.0.2\"\n  resolved \"https://registry.npmjs.org/js-tokens/-/js-tokens-3.0.2.tgz\"\n  integrity sha1-mGbfOVECEw449/mWvOtlRDIJwls=\n\njs-yaml@^3.11.0, js-yaml@^3.13.1, js-yaml@^3.9.0:\n  version \"3.13.1\"\n  resolved \"https://registry.npmjs.org/js-yaml/-/js-yaml-3.13.1.tgz\"\n  integrity sha512-YfbcO7jXDdyj0DGxYVSlSeQNHbD7XPWvrVWeVUujrQEoZzWJIRrCPoyk6kL6IAjAG2IolMK4T0hNUe0HOUs5Jw==\n  dependencies:\n    argparse \"^1.0.7\"\n    esprima \"^4.0.0\"\n\njson-parse-better-errors@^1.0.1:\n  version \"1.0.2\"\n  resolved \"https://registry.npmjs.org/json-parse-better-errors/-/json-parse-better-errors-1.0.2.tgz\"\n  integrity sha512-mrqyZKfX5EhL7hvqcV6WG1yYjnjeuYDzDhhcAAUrq8Po85NBQBJP+ZDUT75qZQ98IkUoBqdkExkukOU7Ts2wrw==\n\njson-schema-traverse@^0.4.1:\n  version \"0.4.1\"\n  resolved \"https://registry.npmjs.org/json-schema-traverse/-/json-schema-traverse-0.4.1.tgz\"\n  integrity sha512-xbbCH5dCYU5T8LcEhhuh7HJ88HXuW3qsI3Y0zOZFKfZEHcpWiHU/Jxzk629Brsab/mMiHQti9wMP+845RPe3Vg==\n\njson-stable-stringify-without-jsonify@^1.0.1:\n  version \"1.0.1\"\n  resolved \"https://registry.npmjs.org/json-stable-stringify-without-jsonify/-/json-stable-stringify-without-jsonify-1.0.1.tgz\"\n  integrity sha1-nbe1lJatPzz+8wp1FC0tkwrXJlE=\n\njsx-ast-utils@^2.0.1:\n  version \"2.1.0\"\n  resolved \"https://registry.npmjs.org/jsx-ast-utils/-/jsx-ast-utils-2.1.0.tgz\"\n  integrity sha512-yDGDG2DS4JcqhA6blsuYbtsT09xL8AoLuUR2Gb5exrw7UEM19sBcOTq+YBBhrNbl0PUC4R4LnFu+dHg2HKeVvA==\n  dependencies:\n    array-includes \"^3.0.3\"\n\nkind-of@^3.0.2:\n  version \"3.2.2\"\n  resolved \"https://registry.npmjs.org/kind-of/-/kind-of-3.2.2.tgz\"\n  integrity sha1-MeohpzS6ubuw8yRm2JOupR5KPGQ=\n  dependencies:\n    is-buffer \"^1.1.5\"\n\nkind-of@^3.0.3:\n  version \"3.2.2\"\n  resolved \"https://registry.npmjs.org/kind-of/-/kind-of-3.2.2.tgz\"\n  integrity sha1-MeohpzS6ubuw8yRm2JOupR5KPGQ=\n  dependencies:\n    is-buffer \"^1.1.5\"\n\nkind-of@^3.2.0:\n  version \"3.2.2\"\n  resolved \"https://registry.npmjs.org/kind-of/-/kind-of-3.2.2.tgz\"\n  integrity sha1-MeohpzS6ubuw8yRm2JOupR5KPGQ=\n  dependencies:\n    is-buffer \"^1.1.5\"\n\nkind-of@^4.0.0:\n  version \"4.0.0\"\n  resolved \"https://registry.npmjs.org/kind-of/-/kind-of-4.0.0.tgz\"\n  integrity sha1-IIE989cSkosgc3hpGkUGb65y3Vc=\n  dependencies:\n    is-buffer \"^1.1.5\"\n\nkind-of@^5.0.0:\n  version \"5.1.0\"\n  resolved \"https://registry.npmjs.org/kind-of/-/kind-of-5.1.0.tgz\"\n  integrity sha512-NGEErnH6F2vUuXDh+OlbcKW7/wOcfdRHaZ7VWtqCztfHri/++YKmP51OdWeGPuqCOba6kk2OTe5d02VmTB80Pw==\n\nkind-of@^6.0.0, kind-of@^6.0.2:\n  version \"6.0.2\"\n  resolved \"https://registry.npmjs.org/kind-of/-/kind-of-6.0.2.tgz\"\n  integrity sha512-s5kLOcnH0XqDO+FvuaLX8DDjZ18CGFk7VygH40QoKPUQhW4e2rvM0rwUq0t8IQDOwYSeLK01U90OjzBTme2QqA==\n\nleven@^2.1.0:\n  version \"2.1.0\"\n  resolved \"https://registry.npmjs.org/leven/-/leven-2.1.0.tgz\"\n  integrity sha1-wuep93IJTe6dNCAq6KzORoeHVYA=\n\nlevn@^0.3.0, levn@~0.3.0:\n  version \"0.3.0\"\n  resolved \"https://registry.npmjs.org/levn/-/levn-0.3.0.tgz\"\n  integrity sha1-OwmSTt+fCDwEkP3UwLxEIeBHZO4=\n  dependencies:\n    prelude-ls \"~1.1.2\"\n    type-check \"~0.3.2\"\n\nlint-staged@8.1.0:\n  version \"8.1.0\"\n  resolved \"https://registry.npmjs.org/lint-staged/-/lint-staged-8.1.0.tgz\"\n  integrity sha512-yfSkyJy7EuVsaoxtUSEhrD81spdJOe/gMTGea3XaV7HyoRhTb9Gdlp6/JppRZERvKSEYXP9bjcmq6CA5oL2lYQ==\n  dependencies:\n    \"@iamstarkov/listr-update-renderer\" \"0.4.1\"\n    chalk \"^2.3.1\"\n    commander \"^2.14.1\"\n    cosmiconfig \"5.0.6\"\n    debug \"^3.1.0\"\n    dedent \"^0.7.0\"\n    del \"^3.0.0\"\n    execa \"^1.0.0\"\n    find-parent-dir \"^0.3.0\"\n    g-status \"^2.0.2\"\n    is-glob \"^4.0.0\"\n    is-windows \"^1.0.2\"\n    jest-validate \"^23.5.0\"\n    listr \"^0.14.2\"\n    lodash \"^4.17.5\"\n    log-symbols \"^2.2.0\"\n    micromatch \"^3.1.8\"\n    npm-which \"^3.0.1\"\n    p-map \"^1.1.1\"\n    path-is-inside \"^1.0.2\"\n    pify \"^3.0.0\"\n    please-upgrade-node \"^3.0.2\"\n    staged-git-files \"1.1.2\"\n    string-argv \"^0.0.2\"\n    stringify-object \"^3.2.2\"\n\nlistr-silent-renderer@^1.1.1:\n  version \"1.1.1\"\n  resolved \"https://registry.npmjs.org/listr-silent-renderer/-/listr-silent-renderer-1.1.1.tgz\"\n  integrity sha1-kktaN1cVN3C/Go4/v3S4u/P5JC4=\n\nlistr-update-renderer@^0.5.0:\n  version \"0.5.0\"\n  resolved \"https://registry.npmjs.org/listr-update-renderer/-/listr-update-renderer-0.5.0.tgz\"\n  integrity sha512-tKRsZpKz8GSGqoI/+caPmfrypiaq+OQCbd+CovEC24uk1h952lVj5sC7SqyFUm+OaJ5HN/a1YLt5cit2FMNsFA==\n  dependencies:\n    chalk \"^1.1.3\"\n    cli-truncate \"^0.2.1\"\n    elegant-spinner \"^1.0.1\"\n    figures \"^1.7.0\"\n    indent-string \"^3.0.0\"\n    log-symbols \"^1.0.2\"\n    log-update \"^2.3.0\"\n    strip-ansi \"^3.0.1\"\n\nlistr-verbose-renderer@^0.5.0:\n  version \"0.5.0\"\n  resolved \"https://registry.npmjs.org/listr-verbose-renderer/-/listr-verbose-renderer-0.5.0.tgz\"\n  integrity sha512-04PDPqSlsqIOaaaGZ+41vq5FejI9auqTInicFRndCBgE3bXG8D6W1I+mWhk+1nqbHmyhla/6BUrd5OSiHwKRXw==\n  dependencies:\n    chalk \"^2.4.1\"\n    cli-cursor \"^2.1.0\"\n    date-fns \"^1.27.2\"\n    figures \"^2.0.0\"\n\nlistr@^0.14.2:\n  version \"0.14.3\"\n  resolved \"https://registry.npmjs.org/listr/-/listr-0.14.3.tgz\"\n  integrity sha512-RmAl7su35BFd/xoMamRjpIE4j3v+L28o8CT5YhAXQJm1fD+1l9ngXY8JAQRJ+tFK2i5njvi0iRUKV09vPwA0iA==\n  dependencies:\n    \"@samverschueren/stream-to-observable\" \"^0.3.0\"\n    is-observable \"^1.1.0\"\n    is-promise \"^2.1.0\"\n    is-stream \"^1.1.0\"\n    listr-silent-renderer \"^1.1.1\"\n    listr-update-renderer \"^0.5.0\"\n    listr-verbose-renderer \"^0.5.0\"\n    p-map \"^2.0.0\"\n    rxjs \"^6.3.3\"\n\nload-json-file@^2.0.0:\n  version \"2.0.0\"\n  resolved \"https://registry.npmjs.org/load-json-file/-/load-json-file-2.0.0.tgz\"\n  integrity sha1-eUfkIUmvgNaWy/eXvKq8/h/inKg=\n  dependencies:\n    graceful-fs \"^4.1.2\"\n    parse-json \"^2.2.0\"\n    pify \"^2.0.0\"\n    strip-bom \"^3.0.0\"\n\nload-json-file@^4.0.0:\n  version \"4.0.0\"\n  resolved \"https://registry.npmjs.org/load-json-file/-/load-json-file-4.0.0.tgz\"\n  integrity sha1-L19Fq5HjMhYjT9U62rZo607AmTs=\n  dependencies:\n    graceful-fs \"^4.1.2\"\n    parse-json \"^4.0.0\"\n    pify \"^3.0.0\"\n    strip-bom \"^3.0.0\"\n\nlocate-path@^2.0.0:\n  version \"2.0.0\"\n  resolved \"https://registry.npmjs.org/locate-path/-/locate-path-2.0.0.tgz\"\n  integrity sha1-K1aLJl7slExtnA3pw9u7ygNUzY4=\n  dependencies:\n    p-locate \"^2.0.0\"\n    path-exists \"^3.0.0\"\n\nlocate-path@^3.0.0:\n  version \"3.0.0\"\n  resolved \"https://registry.npmjs.org/locate-path/-/locate-path-3.0.0.tgz\"\n  integrity sha512-7AO748wWnIhNqAuaty2ZWHkQHRSNfPVIsPIfwEOWO22AmaoVrWavlOcMR5nzTLNYvp36X220/maaRsrec1G65A==\n  dependencies:\n    p-locate \"^3.0.0\"\n    path-exists \"^3.0.0\"\n\nlodash@^4.17.4, lodash@^4.17.5, lodash@^4.3.0:\n  version \"4.17.21\"\n  resolved \"https://registry.npmjs.org/lodash/-/lodash-4.17.21.tgz\"\n  integrity sha512-v2kDEe57lecTulaDIuNTPy3Ry4gLGJ6Z1O3vE1krgXZNrsQ+LFTGHVxVjcXPs17LhbZVGedAJv8XZ1tvj5FvSg==\n\nlog-symbols@^1.0.2:\n  version \"1.0.2\"\n  resolved \"https://registry.npmjs.org/log-symbols/-/log-symbols-1.0.2.tgz\"\n  integrity sha1-N2/3tY6jCGoPCfrMdGF+ylAeGhg=\n  dependencies:\n    chalk \"^1.0.0\"\n\nlog-symbols@^2.2.0:\n  version \"2.2.0\"\n  resolved \"https://registry.npmjs.org/log-symbols/-/log-symbols-2.2.0.tgz\"\n  integrity sha512-VeIAFslyIerEJLXHziedo2basKbMKtTw3vfn5IzG0XTjhAVEJyNHnL2p7vc+wBDSdQuUpNw3M2u6xb9QsAY5Eg==\n  dependencies:\n    chalk \"^2.0.1\"\n\nlog-update@^2.3.0:\n  version \"2.3.0\"\n  resolved \"https://registry.npmjs.org/log-update/-/log-update-2.3.0.tgz\"\n  integrity sha1-iDKP19HOeTiykoN0bwsbwSayRwg=\n  dependencies:\n    ansi-escapes \"^3.0.0\"\n    cli-cursor \"^2.0.0\"\n    wrap-ansi \"^3.0.1\"\n\nloose-envify@^1.4.0:\n  version \"1.4.0\"\n  resolved \"https://registry.npmjs.org/loose-envify/-/loose-envify-1.4.0.tgz\"\n  integrity sha512-lyuxPGr/Wfhrlem2CL/UcnUc1zcqKAImBDzukY7Y5F/yQiNdko6+fRLevlw1HgMySw7f611UIY408EtxRSoK3Q==\n  dependencies:\n    js-tokens \"^3.0.0 || ^4.0.0\"\n\nmap-cache@^0.2.2:\n  version \"0.2.2\"\n  resolved \"https://registry.npmjs.org/map-cache/-/map-cache-0.2.2.tgz\"\n  integrity sha1-wyq9C9ZSXZsFFkW7TyasXcmKDb8=\n\nmap-visit@^1.0.0:\n  version \"1.0.0\"\n  resolved \"https://registry.npmjs.org/map-visit/-/map-visit-1.0.0.tgz\"\n  integrity sha1-7Nyo8TFE5mDxtb1B8S80edmN+48=\n  dependencies:\n    object-visit \"^1.0.0\"\n\nmatcher@^1.0.0:\n  version \"1.1.1\"\n  resolved \"https://registry.npmjs.org/matcher/-/matcher-1.1.1.tgz\"\n  integrity sha512-+BmqxWIubKTRKNWx/ahnCkk3mG8m7OturVlqq6HiojGJTd5hVYbgZm6WzcYPCoB+KBT4Vd6R7WSRG2OADNaCjg==\n  dependencies:\n    escape-string-regexp \"^1.0.4\"\n\nmicromatch@^3.1.8:\n  version \"3.1.10\"\n  resolved \"https://registry.npmjs.org/micromatch/-/micromatch-3.1.10.tgz\"\n  integrity sha512-MWikgl9n9M3w+bpsY3He8L+w9eF9338xRl8IAO5viDizwSzziFEyUzo2xrrloB64ADbTf8uA8vRqqttDTOmccg==\n  dependencies:\n    arr-diff \"^4.0.0\"\n    array-unique \"^0.3.2\"\n    braces \"^2.3.1\"\n    define-property \"^2.0.2\"\n    extend-shallow \"^3.0.2\"\n    extglob \"^2.0.4\"\n    fragment-cache \"^0.2.1\"\n    kind-of \"^6.0.2\"\n    nanomatch \"^1.2.9\"\n    object.pick \"^1.3.0\"\n    regex-not \"^1.0.0\"\n    snapdragon \"^0.8.1\"\n    to-regex \"^3.0.2\"\n\nmime@^1.6.0:\n  version \"1.6.0\"\n  resolved \"https://registry.npmjs.org/mime/-/mime-1.6.0.tgz\"\n  integrity sha512-x0Vn8spI+wuJ1O6S7gnbaQg8Pxh4NNHb7KSINmEWKiPE4RKOplvijn+NkmYmmRgP68mc70j2EbeTFRsrswaQeg==\n\nmimic-fn@^1.0.0:\n  version \"1.2.0\"\n  resolved \"https://registry.npmjs.org/mimic-fn/-/mimic-fn-1.2.0.tgz\"\n  integrity sha512-jf84uxzwiuiIVKiOLpfYk7N46TSy8ubTonmneY9vrpHNAnp0QBt2BxWV9dO3/j+BoVAb+a5G6YDPW3M5HOdMWQ==\n\nminimatch@^3.0.3, minimatch@^3.0.4:\n  version \"3.0.4\"\n  resolved \"https://registry.npmjs.org/minimatch/-/minimatch-3.0.4.tgz\"\n  integrity sha512-yJHVQEhyqPLUTgt9B83PXu6W3rx4MvvHvSUvToogpwoGDOUQ+yDrR0HRot+yOCdCO7u4hX3pWft6kWBBcqh0UA==\n  dependencies:\n    brace-expansion \"^1.1.7\"\n\nminimist@^1.1.0:\n  version \"1.2.0\"\n  resolved \"https://registry.npmjs.org/minimist/-/minimist-1.2.0.tgz\"\n  integrity sha1-o1AIsg9BOD7sH7kU9M1d95omQoQ=\n\nminimist@~0.0.1:\n  version \"0.0.10\"\n  resolved \"https://registry.npmjs.org/minimist/-/minimist-0.0.10.tgz\"\n  integrity sha1-3j+YVD2/lggr5IrRoMfNqDYwHc8=\n\nminimist@0.0.8:\n  version \"0.0.8\"\n  resolved \"https://registry.npmjs.org/minimist/-/minimist-0.0.8.tgz\"\n  integrity sha1-hX/Kv8M5fSYluCKCYuhqp6ARsF0=\n\nmixin-deep@^1.2.0:\n  version \"1.3.2\"\n  resolved \"https://registry.npmjs.org/mixin-deep/-/mixin-deep-1.3.2.tgz\"\n  integrity sha512-WRoDn//mXBiJ1H40rqa3vH0toePwSsGb45iInWlTySa+Uu4k3tYUSxa2v1KqAiLtvlrSzaExqS1gtk96A9zvEA==\n  dependencies:\n    for-in \"^1.0.2\"\n    is-extendable \"^1.0.1\"\n\nmkdirp@^0.5.1, mkdirp@0.5.x:\n  version \"0.5.1\"\n  resolved \"https://registry.npmjs.org/mkdirp/-/mkdirp-0.5.1.tgz\"\n  integrity sha1-MAV0OOrGz3+MR2fzhkjWaX11yQM=\n  dependencies:\n    minimist \"0.0.8\"\n\nms@^2.1.1:\n  version \"2.1.2\"\n  resolved \"https://registry.npmjs.org/ms/-/ms-2.1.2.tgz\"\n  integrity sha512-sGkPx+VjMtmA6MX27oA4FBFELFCZZ4S4XqeGOXCv68tT+jb3vk/RyaKWP0PTKyWtmLSM0b+adUTEvbs1PEaH2w==\n\nms@2.0.0:\n  version \"2.0.0\"\n  resolved \"https://registry.npmjs.org/ms/-/ms-2.0.0.tgz\"\n  integrity sha1-VgiurfwAvmwpAd9fmGF4jeDVl8g=\n\nmute-stream@0.0.7:\n  version \"0.0.7\"\n  resolved \"https://registry.npmjs.org/mute-stream/-/mute-stream-0.0.7.tgz\"\n  integrity sha1-MHXOk7whuPq0PhvE2n6BFe0ee6s=\n\nnanomatch@^1.2.9:\n  version \"1.2.13\"\n  resolved \"https://registry.npmjs.org/nanomatch/-/nanomatch-1.2.13.tgz\"\n  integrity sha512-fpoe2T0RbHwBTBUOftAfBPaDEi06ufaUai0mE6Yn1kacc3SnTErfb/h+X94VXzI64rKFHYImXSvdwGGCmwOqCA==\n  dependencies:\n    arr-diff \"^4.0.0\"\n    array-unique \"^0.3.2\"\n    define-property \"^2.0.2\"\n    extend-shallow \"^3.0.2\"\n    fragment-cache \"^0.2.1\"\n    is-windows \"^1.0.2\"\n    kind-of \"^6.0.2\"\n    object.pick \"^1.3.0\"\n    regex-not \"^1.0.0\"\n    snapdragon \"^0.8.1\"\n    to-regex \"^3.0.1\"\n\nnatural-compare@^1.4.0:\n  version \"1.4.0\"\n  resolved \"https://registry.npmjs.org/natural-compare/-/natural-compare-1.4.0.tgz\"\n  integrity sha1-Sr6/7tdUHywnrPspvbvRXI1bpPc=\n\nnice-try@^1.0.4:\n  version \"1.0.5\"\n  resolved \"https://registry.npmjs.org/nice-try/-/nice-try-1.0.5.tgz\"\n  integrity sha512-1nh45deeb5olNY7eX82BkPO7SSxR5SSYJiPTrTdFUVYwAl8CKMA5N9PjTYkHiRjisVcxcQ1HXdLhx2qxxJzLNQ==\n\nnormalize-package-data@^2.3.2:\n  version \"2.5.0\"\n  resolved \"https://registry.npmjs.org/normalize-package-data/-/normalize-package-data-2.5.0.tgz\"\n  integrity sha512-/5CMN3T0R4XTj4DcGaexo+roZSdSFW/0AOOTROrjxzCG1wrWXEsGbRKevjlIL+ZDE4sZlJr5ED4YW0yqmkK+eA==\n  dependencies:\n    hosted-git-info \"^2.1.4\"\n    resolve \"^1.10.0\"\n    semver \"2 || 3 || 4 || 5\"\n    validate-npm-package-license \"^3.0.1\"\n\nnpm-path@^2.0.2:\n  version \"2.0.4\"\n  resolved \"https://registry.npmjs.org/npm-path/-/npm-path-2.0.4.tgz\"\n  integrity sha512-IFsj0R9C7ZdR5cP+ET342q77uSRdtWOlWpih5eC+lu29tIDbNEgDbzgVJ5UFvYHWhxDZ5TFkJafFioO0pPQjCw==\n  dependencies:\n    which \"^1.2.10\"\n\nnpm-run-path@^2.0.0:\n  version \"2.0.2\"\n  resolved \"https://registry.npmjs.org/npm-run-path/-/npm-run-path-2.0.2.tgz\"\n  integrity sha1-NakjLfo11wZ7TLLd8jV7GHFTbF8=\n  dependencies:\n    path-key \"^2.0.0\"\n\nnpm-which@^3.0.1:\n  version \"3.0.1\"\n  resolved \"https://registry.npmjs.org/npm-which/-/npm-which-3.0.1.tgz\"\n  integrity sha1-kiXybsOihcIJyuZ8OxGmtKtxQKo=\n  dependencies:\n    commander \"^2.9.0\"\n    npm-path \"^2.0.2\"\n    which \"^1.2.10\"\n\nnumber-is-nan@^1.0.0:\n  version \"1.0.1\"\n  resolved \"https://registry.npmjs.org/number-is-nan/-/number-is-nan-1.0.1.tgz\"\n  integrity sha1-CXtgK1NCKlIsGvuHkDGDNpQaAR0=\n\nobject-assign@^4.0.1, object-assign@^4.1.0, object-assign@^4.1.1:\n  version \"4.1.1\"\n  resolved \"https://registry.npmjs.org/object-assign/-/object-assign-4.1.1.tgz\"\n  integrity sha1-IQmtx5ZYh8/AXLvUQsrIv7s2CGM=\n\nobject-copy@^0.1.0:\n  version \"0.1.0\"\n  resolved \"https://registry.npmjs.org/object-copy/-/object-copy-0.1.0.tgz\"\n  integrity sha1-fn2Fi3gb18mRpBupde04EnVOmYw=\n  dependencies:\n    copy-descriptor \"^0.1.0\"\n    define-property \"^0.2.5\"\n    kind-of \"^3.0.3\"\n\nobject-keys@^1.0.12:\n  version \"1.1.1\"\n  resolved \"https://registry.npmjs.org/object-keys/-/object-keys-1.1.1.tgz\"\n  integrity sha512-NuAESUOUMrlIXOfHKzD6bpPu3tYt3xvjNdRIQ+FeT0lNb4K8WR70CaDxhuNguS2XG+GjkyMwOzsN5ZktImfhLA==\n\nobject-visit@^1.0.0:\n  version \"1.0.1\"\n  resolved \"https://registry.npmjs.org/object-visit/-/object-visit-1.0.1.tgz\"\n  integrity sha1-95xEk68MU3e1n+OdOV5BBC3QRbs=\n  dependencies:\n    isobject \"^3.0.0\"\n\nobject.pick@^1.3.0:\n  version \"1.3.0\"\n  resolved \"https://registry.npmjs.org/object.pick/-/object.pick-1.3.0.tgz\"\n  integrity sha1-h6EKxMFpS9Lhy/U1kaZhQftd10c=\n  dependencies:\n    isobject \"^3.0.1\"\n\nonce@^1.3.0, once@^1.3.1, once@^1.4.0:\n  version \"1.4.0\"\n  resolved \"https://registry.npmjs.org/once/-/once-1.4.0.tgz\"\n  integrity sha1-WDsap3WWHUsROsF9nFC6753Xa9E=\n  dependencies:\n    wrappy \"1\"\n\nonetime@^2.0.0:\n  version \"2.0.1\"\n  resolved \"https://registry.npmjs.org/onetime/-/onetime-2.0.1.tgz\"\n  integrity sha1-BnQoIw/WdEOyeUsiu6UotoZ5YtQ=\n  dependencies:\n    mimic-fn \"^1.0.0\"\n\nopener@~1.4.0:\n  version \"1.4.3\"\n  resolved \"https://registry.npmjs.org/opener/-/opener-1.4.3.tgz\"\n  integrity sha1-XG2ixdflgx6P+jlklQ+NZnSskLg=\n\noptimist@0.6.x:\n  version \"0.6.1\"\n  resolved \"https://registry.npmjs.org/optimist/-/optimist-0.6.1.tgz\"\n  integrity sha1-2j6nRob6IaGaERwybpDrFaAZZoY=\n  dependencies:\n    minimist \"~0.0.1\"\n    wordwrap \"~0.0.2\"\n\noptionator@^0.8.2:\n  version \"0.8.2\"\n  resolved \"https://registry.npmjs.org/optionator/-/optionator-0.8.2.tgz\"\n  integrity sha1-NkxeQJ0/TWMB1sC0wFu6UBgK62Q=\n  dependencies:\n    deep-is \"~0.1.3\"\n    fast-levenshtein \"~2.0.4\"\n    levn \"~0.3.0\"\n    prelude-ls \"~1.1.2\"\n    type-check \"~0.3.2\"\n    wordwrap \"~1.0.0\"\n\nos-tmpdir@~1.0.2:\n  version \"1.0.2\"\n  resolved \"https://registry.npmjs.org/os-tmpdir/-/os-tmpdir-1.0.2.tgz\"\n  integrity sha1-u+Z0BseaqFxc/sdm/lc0VV36EnQ=\n\np-finally@^1.0.0:\n  version \"1.0.0\"\n  resolved \"https://registry.npmjs.org/p-finally/-/p-finally-1.0.0.tgz\"\n  integrity sha1-P7z7FbiZpEEjs0ttzBi3JDNqLK4=\n\np-limit@^1.1.0:\n  version \"1.3.0\"\n  resolved \"https://registry.npmjs.org/p-limit/-/p-limit-1.3.0.tgz\"\n  integrity sha512-vvcXsLAJ9Dr5rQOPk7toZQZJApBl2K4J6dANSsEuh6QI41JYcsS/qhTGa9ErIUUgK3WNQoJYvylxvjqmiqEA9Q==\n  dependencies:\n    p-try \"^1.0.0\"\n\np-limit@^2.0.0:\n  version \"2.2.0\"\n  resolved \"https://registry.npmjs.org/p-limit/-/p-limit-2.2.0.tgz\"\n  integrity sha512-pZbTJpoUsCzV48Mc9Nh51VbwO0X9cuPFE8gYwx9BTCt9SF8/b7Zljd2fVgOxhIF/HDTKgpVzs+GPhyKfjLLFRQ==\n  dependencies:\n    p-try \"^2.0.0\"\n\np-locate@^2.0.0:\n  version \"2.0.0\"\n  resolved \"https://registry.npmjs.org/p-locate/-/p-locate-2.0.0.tgz\"\n  integrity sha1-IKAQOyIqcMj9OcwuWAaA893l7EM=\n  dependencies:\n    p-limit \"^1.1.0\"\n\np-locate@^3.0.0:\n  version \"3.0.0\"\n  resolved \"https://registry.npmjs.org/p-locate/-/p-locate-3.0.0.tgz\"\n  integrity sha512-x+12w/To+4GFfgJhBEpiDcLozRJGegY+Ei7/z0tSLkMmxGZNybVMSfWj9aJn8Z5Fc7dBUNJOOVgPv2H7IwulSQ==\n  dependencies:\n    p-limit \"^2.0.0\"\n\np-map@^1.1.1:\n  version \"1.2.0\"\n  resolved \"https://registry.npmjs.org/p-map/-/p-map-1.2.0.tgz\"\n  integrity sha512-r6zKACMNhjPJMTl8KcFH4li//gkrXWfbD6feV8l6doRHlzljFWGJ2AP6iKaCJXyZmAUMOPtvbW7EXkbWO/pLEA==\n\np-map@^2.0.0:\n  version \"2.1.0\"\n  resolved \"https://registry.npmjs.org/p-map/-/p-map-2.1.0.tgz\"\n  integrity sha512-y3b8Kpd8OAN444hxfBbFfj1FY/RjtTd8tzYwhUqNYXx0fXx2iX4maP4Qr6qhIKbQXI02wTLAda4fYUbDagTUFw==\n\np-try@^1.0.0:\n  version \"1.0.0\"\n  resolved \"https://registry.npmjs.org/p-try/-/p-try-1.0.0.tgz\"\n  integrity sha1-y8ec26+P1CKOE/Yh8rGiN8GyB7M=\n\np-try@^2.0.0:\n  version \"2.2.0\"\n  resolved \"https://registry.npmjs.org/p-try/-/p-try-2.2.0.tgz\"\n  integrity sha512-R4nPAVTAU0B9D35/Gk3uJf/7XYbQcyohSKdvAxIRSNghFl4e71hVoGnBNQz9cWaXxO2I10KTC+3jMdvvoKw6dQ==\n\nparse-json@^2.2.0:\n  version \"2.2.0\"\n  resolved \"https://registry.npmjs.org/parse-json/-/parse-json-2.2.0.tgz\"\n  integrity sha1-9ID0BDTvgHQfhGkJn43qGPVaTck=\n  dependencies:\n    error-ex \"^1.2.0\"\n\nparse-json@^4.0.0:\n  version \"4.0.0\"\n  resolved \"https://registry.npmjs.org/parse-json/-/parse-json-4.0.0.tgz\"\n  integrity sha1-vjX1Qlvh9/bHRxhPmKeIy5lHfuA=\n  dependencies:\n    error-ex \"^1.3.1\"\n    json-parse-better-errors \"^1.0.1\"\n\npascalcase@^0.1.1:\n  version \"0.1.1\"\n  resolved \"https://registry.npmjs.org/pascalcase/-/pascalcase-0.1.1.tgz\"\n  integrity sha1-s2PlXoAGym/iF4TS2yK9FdeRfxQ=\n\npath-exists@^3.0.0:\n  version \"3.0.0\"\n  resolved \"https://registry.npmjs.org/path-exists/-/path-exists-3.0.0.tgz\"\n  integrity sha1-zg6+ql94yxiSXqfYENe1mwEP1RU=\n\npath-is-absolute@^1.0.0:\n  version \"1.0.1\"\n  resolved \"https://registry.npmjs.org/path-is-absolute/-/path-is-absolute-1.0.1.tgz\"\n  integrity sha1-F0uSaHNVNP+8es5r9TpanhtcX18=\n\npath-is-inside@^1.0.1, path-is-inside@^1.0.2:\n  version \"1.0.2\"\n  resolved \"https://registry.npmjs.org/path-is-inside/-/path-is-inside-1.0.2.tgz\"\n  integrity sha1-NlQX3t5EQw0cEa9hAn+s8HS9/FM=\n\npath-key@^2.0.0, path-key@^2.0.1:\n  version \"2.0.1\"\n  resolved \"https://registry.npmjs.org/path-key/-/path-key-2.0.1.tgz\"\n  integrity sha1-QRyttXTFoUDTpLGRDUDYDMn0C0A=\n\npath-parse@^1.0.6:\n  version \"1.0.7\"\n  resolved \"https://registry.npmjs.org/path-parse/-/path-parse-1.0.7.tgz\"\n  integrity sha512-LDJzPVEEEPR+y48z93A0Ed0yXb8pAByGWo/k5YYdYgpY2/2EsOsksJrq7lOHxryrVOn1ejG6oAp8ahvOIQD8sw==\n\npath-type@^2.0.0:\n  version \"2.0.0\"\n  resolved \"https://registry.npmjs.org/path-type/-/path-type-2.0.0.tgz\"\n  integrity sha1-8BLMuEFbcJb8LaoQVMPXI4lZTHM=\n  dependencies:\n    pify \"^2.0.0\"\n\npify@^2.0.0:\n  version \"2.3.0\"\n  resolved \"https://registry.npmjs.org/pify/-/pify-2.3.0.tgz\"\n  integrity sha1-7RQaasBDqEnqWISY59yosVMw6Qw=\n\npify@^3.0.0:\n  version \"3.0.0\"\n  resolved \"https://registry.npmjs.org/pify/-/pify-3.0.0.tgz\"\n  integrity sha1-5aSs0sEB/fPZpNB/DbxNtJ3SgXY=\n\npinkie-promise@^2.0.0:\n  version \"2.0.1\"\n  resolved \"https://registry.npmjs.org/pinkie-promise/-/pinkie-promise-2.0.1.tgz\"\n  integrity sha1-ITXW36ejWMBprJsXh3YogihFD/o=\n  dependencies:\n    pinkie \"^2.0.0\"\n\npinkie@^2.0.0:\n  version \"2.0.4\"\n  resolved \"https://registry.npmjs.org/pinkie/-/pinkie-2.0.4.tgz\"\n  integrity sha1-clVrgM+g1IqXToDnckjoDtT3+HA=\n\npkg-conf@^2.0.0:\n  version \"2.1.0\"\n  resolved \"https://registry.npmjs.org/pkg-conf/-/pkg-conf-2.1.0.tgz\"\n  integrity sha1-ISZRTKbyq/69FoWW3xi6V4Z/AFg=\n  dependencies:\n    find-up \"^2.0.0\"\n    load-json-file \"^4.0.0\"\n\npkg-config@^1.1.0:\n  version \"1.1.1\"\n  resolved \"https://registry.npmjs.org/pkg-config/-/pkg-config-1.1.1.tgz\"\n  integrity sha1-VX7yLXPaPIg3EHdmxS6tq94pj+Q=\n  dependencies:\n    debug-log \"^1.0.0\"\n    find-root \"^1.0.0\"\n    xtend \"^4.0.1\"\n\npkg-dir@^2.0.0:\n  version \"2.0.0\"\n  resolved \"https://registry.npmjs.org/pkg-dir/-/pkg-dir-2.0.0.tgz\"\n  integrity sha1-9tXREJ4Z1j7fQo4L1X4Sd3YVM0s=\n  dependencies:\n    find-up \"^2.1.0\"\n\npkg-dir@^3.0.0:\n  version \"3.0.0\"\n  resolved \"https://registry.npmjs.org/pkg-dir/-/pkg-dir-3.0.0.tgz\"\n  integrity sha512-/E57AYkoeQ25qkxMj5PBOVgF8Kiu/h7cYS30Z5+R7WaiCCBfLq58ZI/dSeaEKb9WVJV5n/03QwrN3IeWIFllvw==\n  dependencies:\n    find-up \"^3.0.0\"\n\nplease-upgrade-node@^3.0.2, please-upgrade-node@^3.1.1:\n  version \"3.1.1\"\n  resolved \"https://registry.npmjs.org/please-upgrade-node/-/please-upgrade-node-3.1.1.tgz\"\n  integrity sha512-KY1uHnQ2NlQHqIJQpnh/i54rKkuxCEBx+voJIS/Mvb+L2iYd2NMotwduhKTMjfC1uKoX3VXOxLjIYG66dfJTVQ==\n  dependencies:\n    semver-compare \"^1.0.0\"\n\npluralize@^7.0.0:\n  version \"7.0.0\"\n  resolved \"https://registry.npmjs.org/pluralize/-/pluralize-7.0.0.tgz\"\n  integrity sha512-ARhBOdzS3e41FbkW/XWrTEtukqqLoK5+Z/4UeDaLuSW+39JPeFgs4gCGqsrJHVZX0fUrx//4OF0K1CUGwlIFow==\n\nportfinder@^1.0.13:\n  version \"1.0.20\"\n  resolved \"https://registry.npmjs.org/portfinder/-/portfinder-1.0.20.tgz\"\n  integrity sha512-Yxe4mTyDzTd59PZJY4ojZR8F+E5e97iq2ZOHPz3HDgSvYC5siNad2tLooQ5y5QHyQhc3xVqvyk/eNA3wuoa7Sw==\n  dependencies:\n    async \"^1.5.2\"\n    debug \"^2.2.0\"\n    mkdirp \"0.5.x\"\n\nposix-character-classes@^0.1.0:\n  version \"0.1.1\"\n  resolved \"https://registry.npmjs.org/posix-character-classes/-/posix-character-classes-0.1.1.tgz\"\n  integrity sha1-AerA/jta9xoqbAL+q7jB/vfgDqs=\n\nprelude-ls@~1.1.2:\n  version \"1.1.2\"\n  resolved \"https://registry.npmjs.org/prelude-ls/-/prelude-ls-1.1.2.tgz\"\n  integrity sha1-IZMqVJ9eUv/ZqCf1cOBL5iqX2lQ=\n\nprettier@1.15.2:\n  version \"1.15.2\"\n  resolved \"https://registry.npmjs.org/prettier/-/prettier-1.15.2.tgz\"\n  integrity sha512-YgPLFFA0CdKL4Eg2IHtUSjzj/BWgszDHiNQAe0VAIBse34148whfdzLagRL+QiKS+YfK5ftB6X4v/MBw8yCoug==\n\npretty-format@^23.6.0:\n  version \"23.6.0\"\n  resolved \"https://registry.npmjs.org/pretty-format/-/pretty-format-23.6.0.tgz\"\n  integrity sha512-zf9NV1NSlDLDjycnwm6hpFATCGl/K1lt0R/GdkAK2O5LN/rwJoB+Mh93gGJjut4YbmecbfgLWVGSTCr0Ewvvbw==\n  dependencies:\n    ansi-regex \"^3.0.0\"\n    ansi-styles \"^3.2.0\"\n\nprogress@^2.0.0:\n  version \"2.0.3\"\n  resolved \"https://registry.npmjs.org/progress/-/progress-2.0.3.tgz\"\n  integrity sha512-7PiHtLll5LdnKIMw100I+8xJXR5gW2QwWYkT6iJva0bXitZKa/XMrSbdmg3r2Xnaidz9Qumd0VPaMrZlF9V9sA==\n\nprop-types@^15.6.2:\n  version \"15.7.2\"\n  resolved \"https://registry.npmjs.org/prop-types/-/prop-types-15.7.2.tgz\"\n  integrity sha512-8QQikdH7//R2vurIJSutZ1smHYTcLpRWEOlHnzcWHmBYrOGUysKwSsrC89BCiFj3CbrfJ/nXFdJepOVrY1GCHQ==\n  dependencies:\n    loose-envify \"^1.4.0\"\n    object-assign \"^4.1.1\"\n    react-is \"^16.8.1\"\n\npump@^3.0.0:\n  version \"3.0.0\"\n  resolved \"https://registry.npmjs.org/pump/-/pump-3.0.0.tgz\"\n  integrity sha512-LwZy+p3SFs1Pytd/jYct4wpv49HiYCqd9Rlc5ZVdk0V+8Yzv6jR5Blk3TRmPL1ft69TxP0IMZGJ+WPFU2BFhww==\n  dependencies:\n    end-of-stream \"^1.1.0\"\n    once \"^1.3.1\"\n\npunycode@^2.1.0:\n  version \"2.1.1\"\n  resolved \"https://registry.npmjs.org/punycode/-/punycode-2.1.1.tgz\"\n  integrity sha512-XRsRjdf+j5ml+y/6GKHPZbrF/8p2Yga0JPtdqTIY2Xe5ohJPD9saDJJLPvp9+NSBprVvevdXZybnj2cv8OEd0A==\n\nqs@~2.3.3:\n  version \"2.3.3\"\n  resolved \"https://registry.npmjs.org/qs/-/qs-2.3.3.tgz\"\n  integrity sha1-6eha2+ddoLvkyOBHaghikPhjtAQ=\n\nreact-is@^16.8.1:\n  version \"16.8.6\"\n  resolved \"https://registry.npmjs.org/react-is/-/react-is-16.8.6.tgz\"\n  integrity sha512-aUk3bHfZ2bRSVFFbbeVS4i+lNPZr3/WM5jT2J5omUVV1zzcs1nAaf3l51ctA5FFvCRbhrH0bdAsRRQddFJZPtA==\n\nread-pkg-up@^2.0.0:\n  version \"2.0.0\"\n  resolved \"https://registry.npmjs.org/read-pkg-up/-/read-pkg-up-2.0.0.tgz\"\n  integrity sha1-a3KoBImE4MQeeVEP1en6mbO1Sb4=\n  dependencies:\n    find-up \"^2.0.0\"\n    read-pkg \"^2.0.0\"\n\nread-pkg@^2.0.0:\n  version \"2.0.0\"\n  resolved \"https://registry.npmjs.org/read-pkg/-/read-pkg-2.0.0.tgz\"\n  integrity sha1-jvHAYjxqbbDcZxPEv6xGMysjaPg=\n  dependencies:\n    load-json-file \"^2.0.0\"\n    normalize-package-data \"^2.3.2\"\n    path-type \"^2.0.0\"\n\nread-pkg@^4.0.1:\n  version \"4.0.1\"\n  resolved \"https://registry.npmjs.org/read-pkg/-/read-pkg-4.0.1.tgz\"\n  integrity sha1-ljYlN48+HE1IyFhytabsfV0JMjc=\n  dependencies:\n    normalize-package-data \"^2.3.2\"\n    parse-json \"^4.0.0\"\n    pify \"^3.0.0\"\n\nregex-not@^1.0.0, regex-not@^1.0.2:\n  version \"1.0.2\"\n  resolved \"https://registry.npmjs.org/regex-not/-/regex-not-1.0.2.tgz\"\n  integrity sha512-J6SDjUgDxQj5NusnOtdFxDwN/+HWykR8GELwctJ7mdqhcyy1xEc4SRFHUXvxTp661YaVKAjfRLZ9cCqS6tn32A==\n  dependencies:\n    extend-shallow \"^3.0.2\"\n    safe-regex \"^1.1.0\"\n\nregexpp@^2.0.0, regexpp@^2.0.1:\n  version \"2.0.1\"\n  resolved \"https://registry.npmjs.org/regexpp/-/regexpp-2.0.1.tgz\"\n  integrity sha512-lv0M6+TkDVniA3aD1Eg0DVpfU/booSu7Eev3TDO/mZKHBfVjgCGTV4t4buppESEYDtkArYFOxTJWv6S5C+iaNw==\n\nrepeat-element@^1.1.2:\n  version \"1.1.3\"\n  resolved \"https://registry.npmjs.org/repeat-element/-/repeat-element-1.1.3.tgz\"\n  integrity sha512-ahGq0ZnV5m5XtZLMb+vP76kcAM5nkLqk0lpqAuojSKGgQtn4eRi4ZZGm2olo2zKFH+sMsWaqOCW1dqAnOru72g==\n\nrepeat-string@^1.6.1:\n  version \"1.6.1\"\n  resolved \"https://registry.npmjs.org/repeat-string/-/repeat-string-1.6.1.tgz\"\n  integrity sha1-jcrkcOHIirwtYA//Sndihtp15jc=\n\nrequire-uncached@^1.0.3:\n  version \"1.0.3\"\n  resolved \"https://registry.npmjs.org/require-uncached/-/require-uncached-1.0.3.tgz\"\n  integrity sha1-Tg1W1slmL9MeQwEcS5WqSZVUIdM=\n  dependencies:\n    caller-path \"^0.1.0\"\n    resolve-from \"^1.0.0\"\n\nrequires-port@^1.0.0:\n  version \"1.0.0\"\n  resolved \"https://registry.npmjs.org/requires-port/-/requires-port-1.0.0.tgz\"\n  integrity sha1-kl0mAdOaxIXgkc8NpcbmlNw9yv8=\n\nresolve-from@^1.0.0:\n  version \"1.0.1\"\n  resolved \"https://registry.npmjs.org/resolve-from/-/resolve-from-1.0.1.tgz\"\n  integrity sha1-Jsv+k10a7uq7Kbw/5a6wHpPUQiY=\n\nresolve-from@^3.0.0:\n  version \"3.0.0\"\n  resolved \"https://registry.npmjs.org/resolve-from/-/resolve-from-3.0.0.tgz\"\n  integrity sha1-six699nWiBvItuZTM17rywoYh0g=\n\nresolve-url@^0.2.1:\n  version \"0.2.1\"\n  resolved \"https://registry.npmjs.org/resolve-url/-/resolve-url-0.2.1.tgz\"\n  integrity sha1-LGN/53yJOv0qZj/iGqkIAGjiBSo=\n\nresolve@^1.10.0, resolve@^1.5.0, resolve@^1.6.0, resolve@^1.8.1:\n  version \"1.11.0\"\n  resolved \"https://registry.npmjs.org/resolve/-/resolve-1.11.0.tgz\"\n  integrity sha512-WL2pBDjqT6pGUNSUzMw00o4T7If+z4H2x3Gz893WoUQ5KW8Vr9txp00ykiP16VBaZF5+j/OcXJHZ9+PCvdiDKw==\n  dependencies:\n    path-parse \"^1.0.6\"\n\nrestore-cursor@^2.0.0:\n  version \"2.0.0\"\n  resolved \"https://registry.npmjs.org/restore-cursor/-/restore-cursor-2.0.0.tgz\"\n  integrity sha1-n37ih/gv0ybU/RYpI9YhKe7g368=\n  dependencies:\n    onetime \"^2.0.0\"\n    signal-exit \"^3.0.2\"\n\nret@~0.1.10:\n  version \"0.1.15\"\n  resolved \"https://registry.npmjs.org/ret/-/ret-0.1.15.tgz\"\n  integrity sha512-TTlYpa+OL+vMMNG24xSlQGEJ3B/RzEfUlLct7b5G/ytav+wPrplCpVMFuwzXbkecJrb6IYo1iFb0S9v37754mg==\n\nrimraf@^2.2.8, rimraf@~2.6.2:\n  version \"2.6.3\"\n  resolved \"https://registry.npmjs.org/rimraf/-/rimraf-2.6.3.tgz\"\n  integrity sha512-mwqeW5XsA2qAejG46gYdENaxXjx9onRNCfn7L0duuP4hCuTIi/QO7PDK07KJfp1d+izWPrzEJDcSqBa0OZQriA==\n  dependencies:\n    glob \"^7.1.3\"\n\nrun-async@^2.2.0:\n  version \"2.3.0\"\n  resolved \"https://registry.npmjs.org/run-async/-/run-async-2.3.0.tgz\"\n  integrity sha1-A3GrSuC91yDUFm19/aZP96RFpsA=\n  dependencies:\n    is-promise \"^2.1.0\"\n\nrun-node@^1.0.0:\n  version \"1.0.0\"\n  resolved \"https://registry.npmjs.org/run-node/-/run-node-1.0.0.tgz\"\n  integrity sha512-kc120TBlQ3mih1LSzdAJXo4xn/GWS2ec0l3S+syHDXP9uRr0JAT8Qd3mdMuyjqCzeZktgP3try92cEgf9Nks8A==\n\nrun-parallel@^1.1.2:\n  version \"1.1.9\"\n  resolved \"https://registry.npmjs.org/run-parallel/-/run-parallel-1.1.9.tgz\"\n  integrity sha512-DEqnSRTDw/Tc3FXf49zedI638Z9onwUotBMiUFKmrO2sdFKIbXamXGQ3Axd4qgphxKB4kw/qP1w5kTxnfU1B9Q==\n\nrxjs@^5.5.2:\n  version \"5.5.12\"\n  resolved \"https://registry.npmjs.org/rxjs/-/rxjs-5.5.12.tgz\"\n  integrity sha512-xx2itnL5sBbqeeiVgNPVuQQ1nC8Jp2WfNJhXWHmElW9YmrpS9UVnNzhP3EH3HFqexO5Tlp8GhYY+WEcqcVMvGw==\n  dependencies:\n    symbol-observable \"1.0.1\"\n\nrxjs@^6.3.3:\n  version \"6.5.2\"\n  resolved \"https://registry.npmjs.org/rxjs/-/rxjs-6.5.2.tgz\"\n  integrity sha512-HUb7j3kvb7p7eCUHE3FqjoDsC1xfZQ4AHFWfTKSpZ+sAhhz5X1WX0ZuUqWbzB2QhSLp3DoLUG+hMdEDKqWo2Zg==\n  dependencies:\n    tslib \"^1.9.0\"\n\nsafe-regex@^1.1.0:\n  version \"1.1.0\"\n  resolved \"https://registry.npmjs.org/safe-regex/-/safe-regex-1.1.0.tgz\"\n  integrity sha1-QKNmnzsHfR6UPURinhV91IAjvy4=\n  dependencies:\n    ret \"~0.1.10\"\n\n\"safer-buffer@>= 2.1.2 < 3\":\n  version \"2.1.2\"\n  resolved \"https://registry.npmjs.org/safer-buffer/-/safer-buffer-2.1.2.tgz\"\n  integrity sha512-YZo3K82SD7Riyi0E1EQPojLz7kpepnSQI9IyPbHHg1XXXevb5dJI7tpyN2ADxGcQbHG7vcyRHk0cbwqcQriUtg==\n\nsemver-compare@^1.0.0:\n  version \"1.0.0\"\n  resolved \"https://registry.npmjs.org/semver-compare/-/semver-compare-1.0.0.tgz\"\n  integrity sha1-De4hahyUGrN+nvsXiPavxf9VN/w=\n\nsemver@^5.5.0, \"semver@2 || 3 || 4 || 5\":\n  version \"5.7.0\"\n  resolved \"https://registry.npmjs.org/semver/-/semver-5.7.0.tgz\"\n  integrity sha512-Ya52jSX2u7QKghxeoFGpLwCtGlt7j0oY9DYb5apt9nPlJ42ID+ulTXESnt/qAQcoSERyZ5sl3LDIOw0nAn/5DA==\n\nset-value@^2.0.0, set-value@^2.0.1:\n  version \"2.0.1\"\n  resolved \"https://registry.npmjs.org/set-value/-/set-value-2.0.1.tgz\"\n  integrity sha512-JxHc1weCN68wRY0fhCoXpyK55m/XPHafOmK4UWD7m2CI14GMcFypt4w/0+NV5f/ZMby2F6S2wwA7fgynh9gWSw==\n  dependencies:\n    extend-shallow \"^2.0.1\"\n    is-extendable \"^0.1.1\"\n    is-plain-object \"^2.0.3\"\n    split-string \"^3.0.1\"\n\nshebang-command@^1.2.0:\n  version \"1.2.0\"\n  resolved \"https://registry.npmjs.org/shebang-command/-/shebang-command-1.2.0.tgz\"\n  integrity sha1-RKrGW2lbAzmJaMOfNj/uXer98eo=\n  dependencies:\n    shebang-regex \"^1.0.0\"\n\nshebang-regex@^1.0.0:\n  version \"1.0.0\"\n  resolved \"https://registry.npmjs.org/shebang-regex/-/shebang-regex-1.0.0.tgz\"\n  integrity sha1-2kL0l0DAtC2yypcoVxyxkMmO/qM=\n\nsignal-exit@^3.0.0, signal-exit@^3.0.2:\n  version \"3.0.2\"\n  resolved \"https://registry.npmjs.org/signal-exit/-/signal-exit-3.0.2.tgz\"\n  integrity sha1-tf3AjxKH6hF4Yo5BXiUTK3NkbG0=\n\nsimple-git@^1.85.0:\n  version \"1.115.0\"\n  resolved \"https://registry.npmjs.org/simple-git/-/simple-git-1.115.0.tgz\"\n  integrity sha512-PXcDVDgXifUE7/M2xUfQQ8uG3r73+kYRyPmsbc/iWwUrPbOASHt8p+HEbu85k546qmXixbcSPDg83kegw1vqcA==\n  dependencies:\n    debug \"^4.0.1\"\n\nslash@^2.0.0:\n  version \"2.0.0\"\n  resolved \"https://registry.npmjs.org/slash/-/slash-2.0.0.tgz\"\n  integrity sha512-ZYKh3Wh2z1PpEXWr0MpSBZ0V6mZHAQfYevttO11c51CaWjGTaadiKZ+wVt1PbMlDV5qhMFslpZCemhwOK7C89A==\n\nslice-ansi@0.0.4:\n  version \"0.0.4\"\n  resolved \"https://registry.npmjs.org/slice-ansi/-/slice-ansi-0.0.4.tgz\"\n  integrity sha1-7b+JA/ZvfOL46v1s7tZeJkyDGzU=\n\nslice-ansi@1.0.0:\n  version \"1.0.0\"\n  resolved \"https://registry.npmjs.org/slice-ansi/-/slice-ansi-1.0.0.tgz\"\n  integrity sha512-POqxBK6Lb3q6s047D/XsDVNPnF9Dl8JSaqe9h9lURl0OdNqy/ujDrOiIHtsqXMGbWWTIomRzAMaTyawAU//Reg==\n  dependencies:\n    is-fullwidth-code-point \"^2.0.0\"\n\nsnapdragon-node@^2.0.1:\n  version \"2.1.1\"\n  resolved \"https://registry.npmjs.org/snapdragon-node/-/snapdragon-node-2.1.1.tgz\"\n  integrity sha512-O27l4xaMYt/RSQ5TR3vpWCAB5Kb/czIcqUFOM/C4fYcLnbZUc1PkjTAMjof2pBWaSTwOUd6qUHcFGVGj7aIwnw==\n  dependencies:\n    define-property \"^1.0.0\"\n    isobject \"^3.0.0\"\n    snapdragon-util \"^3.0.1\"\n\nsnapdragon-util@^3.0.1:\n  version \"3.0.1\"\n  resolved \"https://registry.npmjs.org/snapdragon-util/-/snapdragon-util-3.0.1.tgz\"\n  integrity sha512-mbKkMdQKsjX4BAL4bRYTj21edOf8cN7XHdYUJEe+Zn99hVEYcMvKPct1IqNe7+AZPirn8BCDOQBHQZknqmKlZQ==\n  dependencies:\n    kind-of \"^3.2.0\"\n\nsnapdragon@^0.8.1:\n  version \"0.8.2\"\n  resolved \"https://registry.npmjs.org/snapdragon/-/snapdragon-0.8.2.tgz\"\n  integrity sha512-FtyOnWN/wCHTVXOMwvSv26d+ko5vWlIDD6zoUJ7LW8vh+ZBC8QdljveRP+crNrtBwioEUWy/4dMtbBjA4ioNlg==\n  dependencies:\n    base \"^0.11.1\"\n    debug \"^2.2.0\"\n    define-property \"^0.2.5\"\n    extend-shallow \"^2.0.1\"\n    map-cache \"^0.2.2\"\n    source-map \"^0.5.6\"\n    source-map-resolve \"^0.5.0\"\n    use \"^3.1.0\"\n\nsource-map-resolve@^0.5.0:\n  version \"0.5.2\"\n  resolved \"https://registry.npmjs.org/source-map-resolve/-/source-map-resolve-0.5.2.tgz\"\n  integrity sha512-MjqsvNwyz1s0k81Goz/9vRBe9SZdB09Bdw+/zYyO+3CuPk6fouTaxscHkgtE8jKvf01kVfl8riHzERQ/kefaSA==\n  dependencies:\n    atob \"^2.1.1\"\n    decode-uri-component \"^0.2.0\"\n    resolve-url \"^0.2.1\"\n    source-map-url \"^0.4.0\"\n    urix \"^0.1.0\"\n\nsource-map-url@^0.4.0:\n  version \"0.4.0\"\n  resolved \"https://registry.npmjs.org/source-map-url/-/source-map-url-0.4.0.tgz\"\n  integrity sha1-PpNdfd1zYxuXZZlW1VEo6HtQhKM=\n\nsource-map@^0.5.6:\n  version \"0.5.7\"\n  resolved \"https://registry.npmjs.org/source-map/-/source-map-0.5.7.tgz\"\n  integrity sha1-igOdLRAh0i0eoUyA2OpGi6LvP8w=\n\nspdx-correct@^3.0.0:\n  version \"3.1.0\"\n  resolved \"https://registry.npmjs.org/spdx-correct/-/spdx-correct-3.1.0.tgz\"\n  integrity sha512-lr2EZCctC2BNR7j7WzJ2FpDznxky1sjfxvvYEyzxNyb6lZXHODmEoJeFu4JupYlkfha1KZpJyoqiJ7pgA1qq8Q==\n  dependencies:\n    spdx-expression-parse \"^3.0.0\"\n    spdx-license-ids \"^3.0.0\"\n\nspdx-exceptions@^2.1.0:\n  version \"2.2.0\"\n  resolved \"https://registry.npmjs.org/spdx-exceptions/-/spdx-exceptions-2.2.0.tgz\"\n  integrity sha512-2XQACfElKi9SlVb1CYadKDXvoajPgBVPn/gOQLrTvHdElaVhr7ZEbqJaRnJLVNeaI4cMEAgVCeBMKF6MWRDCRA==\n\nspdx-expression-parse@^3.0.0:\n  version \"3.0.0\"\n  resolved \"https://registry.npmjs.org/spdx-expression-parse/-/spdx-expression-parse-3.0.0.tgz\"\n  integrity sha512-Yg6D3XpRD4kkOmTpdgbUiEJFKghJH03fiC1OPll5h/0sO6neh2jqRDVHOQ4o/LMea0tgCkbMgea5ip/e+MkWyg==\n  dependencies:\n    spdx-exceptions \"^2.1.0\"\n    spdx-license-ids \"^3.0.0\"\n\nspdx-license-ids@^3.0.0:\n  version \"3.0.4\"\n  resolved \"https://registry.npmjs.org/spdx-license-ids/-/spdx-license-ids-3.0.4.tgz\"\n  integrity sha512-7j8LYJLeY/Yb6ACbQ7F76qy5jHkp0U6jgBfJsk97bwWlVUnUWsAgpyaCvo17h0/RQGnQ036tVDomiwoI4pDkQA==\n\nsplit-string@^3.0.1, split-string@^3.0.2:\n  version \"3.1.0\"\n  resolved \"https://registry.npmjs.org/split-string/-/split-string-3.1.0.tgz\"\n  integrity sha512-NzNVhJDYpwceVVii8/Hu6DKfD2G+NrQHlS/V/qgv763EYudVwEcMQNxd2lh+0VrUByXN/oJkl5grOhYWvQUYiw==\n  dependencies:\n    extend-shallow \"^3.0.0\"\n\nsprintf-js@~1.0.2:\n  version \"1.0.3\"\n  resolved \"https://registry.npmjs.org/sprintf-js/-/sprintf-js-1.0.3.tgz\"\n  integrity sha1-BOaSb2YolTVPPdAVIDYzuFcpfiw=\n\nstaged-git-files@1.1.2:\n  version \"1.1.2\"\n  resolved \"https://registry.npmjs.org/staged-git-files/-/staged-git-files-1.1.2.tgz\"\n  integrity sha512-0Eyrk6uXW6tg9PYkhi/V/J4zHp33aNyi2hOCmhFLqLTIhbgqWn5jlSzI+IU0VqrZq6+DbHcabQl/WP6P3BG0QA==\n\nstandard-engine@~9.0.0:\n  version \"9.0.0\"\n  resolved \"https://registry.npmjs.org/standard-engine/-/standard-engine-9.0.0.tgz\"\n  integrity sha512-ZfNfCWZ2Xq67VNvKMPiVMKHnMdvxYzvZkf1AH8/cw2NLDBm5LRsxMqvEJpsjLI/dUosZ3Z1d6JlHDp5rAvvk2w==\n  dependencies:\n    deglob \"^2.1.0\"\n    get-stdin \"^6.0.0\"\n    minimist \"^1.1.0\"\n    pkg-conf \"^2.0.0\"\n\nstandard@12.0.1:\n  version \"12.0.1\"\n  resolved \"https://registry.npmjs.org/standard/-/standard-12.0.1.tgz\"\n  integrity sha512-UqdHjh87OG2gUrNCSM4QRLF5n9h3TFPwrCNyVlkqu31Hej0L/rc8hzKqVvkb2W3x0WMq7PzZdkLfEcBhVOR6lg==\n  dependencies:\n    eslint \"~5.4.0\"\n    eslint-config-standard \"12.0.0\"\n    eslint-config-standard-jsx \"6.0.2\"\n    eslint-plugin-import \"~2.14.0\"\n    eslint-plugin-node \"~7.0.1\"\n    eslint-plugin-promise \"~4.0.0\"\n    eslint-plugin-react \"~7.11.1\"\n    eslint-plugin-standard \"~4.0.0\"\n    standard-engine \"~9.0.0\"\n\nstatic-extend@^0.1.1:\n  version \"0.1.2\"\n  resolved \"https://registry.npmjs.org/static-extend/-/static-extend-0.1.2.tgz\"\n  integrity sha1-YICcOcv/VTNyJv1eC1IPNB8ftcY=\n  dependencies:\n    define-property \"^0.2.5\"\n    object-copy \"^0.1.0\"\n\nstring-argv@^0.0.2:\n  version \"0.0.2\"\n  resolved \"https://registry.npmjs.org/string-argv/-/string-argv-0.0.2.tgz\"\n  integrity sha1-2sMECGkMIfPDYwo/86BYd73L1zY=\n\nstring-width@^1.0.1:\n  version \"1.0.2\"\n  resolved \"https://registry.npmjs.org/string-width/-/string-width-1.0.2.tgz\"\n  integrity sha1-EYvfW4zcUaKn5w0hHgfisLmxB9M=\n  dependencies:\n    code-point-at \"^1.0.0\"\n    is-fullwidth-code-point \"^1.0.0\"\n    strip-ansi \"^3.0.0\"\n\nstring-width@^2.1.0:\n  version \"2.1.1\"\n  resolved \"https://registry.npmjs.org/string-width/-/string-width-2.1.1.tgz\"\n  integrity sha512-nOqH59deCq9SRHlxq1Aw85Jnt4w6KvLKqWVik6oA9ZklXLNIOlqg4F2yrT1MVaTjAqvVwdfeZ7w7aCvJD7ugkw==\n  dependencies:\n    is-fullwidth-code-point \"^2.0.0\"\n    strip-ansi \"^4.0.0\"\n\nstring-width@^2.1.1:\n  version \"2.1.1\"\n  resolved \"https://registry.npmjs.org/string-width/-/string-width-2.1.1.tgz\"\n  integrity sha512-nOqH59deCq9SRHlxq1Aw85Jnt4w6KvLKqWVik6oA9ZklXLNIOlqg4F2yrT1MVaTjAqvVwdfeZ7w7aCvJD7ugkw==\n  dependencies:\n    is-fullwidth-code-point \"^2.0.0\"\n    strip-ansi \"^4.0.0\"\n\nstringify-object@^3.2.2:\n  version \"3.3.0\"\n  resolved \"https://registry.npmjs.org/stringify-object/-/stringify-object-3.3.0.tgz\"\n  integrity sha512-rHqiFh1elqCQ9WPLIC8I0Q/g/wj5J1eMkyoiD6eoQApWHP0FtlK7rqnhmabL5VUY9JQCcqwwvlOaSuutekgyrw==\n  dependencies:\n    get-own-enumerable-property-symbols \"^3.0.0\"\n    is-obj \"^1.0.1\"\n    is-regexp \"^1.0.0\"\n\nstrip-ansi@^3.0.0, strip-ansi@^3.0.1:\n  version \"3.0.1\"\n  resolved \"https://registry.npmjs.org/strip-ansi/-/strip-ansi-3.0.1.tgz\"\n  integrity sha1-ajhfuIU9lS1f8F0Oiq+UJ43GPc8=\n  dependencies:\n    ansi-regex \"^2.0.0\"\n\nstrip-ansi@^4.0.0:\n  version \"4.0.0\"\n  resolved \"https://registry.npmjs.org/strip-ansi/-/strip-ansi-4.0.0.tgz\"\n  integrity sha1-qEeQIusaw2iocTibY1JixQXuNo8=\n  dependencies:\n    ansi-regex \"^3.0.0\"\n\nstrip-bom@^3.0.0:\n  version \"3.0.0\"\n  resolved \"https://registry.npmjs.org/strip-bom/-/strip-bom-3.0.0.tgz\"\n  integrity sha1-IzTBjpx1n3vdVv3vfprj1YjmjtM=\n\nstrip-eof@^1.0.0:\n  version \"1.0.0\"\n  resolved \"https://registry.npmjs.org/strip-eof/-/strip-eof-1.0.0.tgz\"\n  integrity sha1-u0P/VZim6wXYm1n80SnJgzE2Br8=\n\nstrip-json-comments@^2.0.1:\n  version \"2.0.1\"\n  resolved \"https://registry.npmjs.org/strip-json-comments/-/strip-json-comments-2.0.1.tgz\"\n  integrity sha1-PFMZQukIwml8DsNEhYwobHygpgo=\n\nsupports-color@^2.0.0:\n  version \"2.0.0\"\n  resolved \"https://registry.npmjs.org/supports-color/-/supports-color-2.0.0.tgz\"\n  integrity sha1-U10EXOa2Nj+kARcIRimZXp3zJMc=\n\nsupports-color@^5.3.0:\n  version \"5.5.0\"\n  resolved \"https://registry.npmjs.org/supports-color/-/supports-color-5.5.0.tgz\"\n  integrity sha512-QjVjwdXIt408MIiAqCX4oUKsgU2EqAGzs2Ppkm4aQYbjm+ZEWEcW4SfFNTr4uMNZma0ey4f5lgLrkB0aX0QMow==\n  dependencies:\n    has-flag \"^3.0.0\"\n\nsymbol-observable@^1.1.0:\n  version \"1.2.0\"\n  resolved \"https://registry.npmjs.org/symbol-observable/-/symbol-observable-1.2.0.tgz\"\n  integrity sha512-e900nM8RRtGhlV36KGEU9k65K3mPb1WV70OdjfxlG2EAuM1noi/E/BaW/uMhL7bPEssK8QV57vN3esixjUvcXQ==\n\nsymbol-observable@1.0.1:\n  version \"1.0.1\"\n  resolved \"https://registry.npmjs.org/symbol-observable/-/symbol-observable-1.0.1.tgz\"\n  integrity sha1-g0D8RwLDEi310iKI+IKD9RPT/dQ=\n\ntable@^4.0.3:\n  version \"4.0.3\"\n  resolved \"https://registry.npmjs.org/table/-/table-4.0.3.tgz\"\n  integrity sha512-S7rnFITmBH1EnyKcvxBh1LjYeQMmnZtCXSEbHcH6S0NoKit24ZuFO/T1vDcLdYsLQkM188PVVhQmzKIuThNkKg==\n  dependencies:\n    ajv \"^6.0.1\"\n    ajv-keywords \"^3.0.0\"\n    chalk \"^2.1.0\"\n    lodash \"^4.17.4\"\n    slice-ansi \"1.0.0\"\n    string-width \"^2.1.1\"\n\ntext-table@^0.2.0:\n  version \"0.2.0\"\n  resolved \"https://registry.npmjs.org/text-table/-/text-table-0.2.0.tgz\"\n  integrity sha1-f17oI66AUgfACvLfSoTsP8+lcLQ=\n\nthrough@^2.3.6:\n  version \"2.3.8\"\n  resolved \"https://registry.npmjs.org/through/-/through-2.3.8.tgz\"\n  integrity sha1-DdTJ/6q8NXlgsbckEV1+Doai4fU=\n\ntmp@^0.0.33:\n  version \"0.0.33\"\n  resolved \"https://registry.npmjs.org/tmp/-/tmp-0.0.33.tgz\"\n  integrity sha512-jRCJlojKnZ3addtTOjdIqoRuPEKBvNXcGYqzO6zWZX8KfKEpnGY5jfggJQ3EjKuu8D4bJRr0y+cYJFmYbImXGw==\n  dependencies:\n    os-tmpdir \"~1.0.2\"\n\nto-object-path@^0.3.0:\n  version \"0.3.0\"\n  resolved \"https://registry.npmjs.org/to-object-path/-/to-object-path-0.3.0.tgz\"\n  integrity sha1-KXWIt7Dn4KwI4E5nL4XB9JmeF68=\n  dependencies:\n    kind-of \"^3.0.2\"\n\nto-regex-range@^2.1.0:\n  version \"2.1.1\"\n  resolved \"https://registry.npmjs.org/to-regex-range/-/to-regex-range-2.1.1.tgz\"\n  integrity sha1-fIDBe53+vlmeJzZ+DU3VWQFB2zg=\n  dependencies:\n    is-number \"^3.0.0\"\n    repeat-string \"^1.6.1\"\n\nto-regex@^3.0.1, to-regex@^3.0.2:\n  version \"3.0.2\"\n  resolved \"https://registry.npmjs.org/to-regex/-/to-regex-3.0.2.tgz\"\n  integrity sha512-FWtleNAtZ/Ki2qtqej2CXTOayOH9bHDQF+Q48VpWyDXjbYxA4Yz8iDB31zXOBUlOHHKidDbqGVrTUvQMPmBGBw==\n  dependencies:\n    define-property \"^2.0.2\"\n    extend-shallow \"^3.0.2\"\n    regex-not \"^1.0.2\"\n    safe-regex \"^1.1.0\"\n\ntslib@^1.9.0:\n  version \"1.10.0\"\n  resolved \"https://registry.npmjs.org/tslib/-/tslib-1.10.0.tgz\"\n  integrity sha512-qOebF53frne81cf0S9B41ByenJ3/IuH8yJKngAX35CmiZySA0khhkovshKK+jGCaMnVomla7gVlIcc3EvKPbTQ==\n\ntype-check@~0.3.2:\n  version \"0.3.2\"\n  resolved \"https://registry.npmjs.org/type-check/-/type-check-0.3.2.tgz\"\n  integrity sha1-WITKtRLPHTVeP7eE8wgEsrUg23I=\n  dependencies:\n    prelude-ls \"~1.1.2\"\n\nuglify-js@^3.15.3:\n  version \"3.15.3\"\n  resolved \"https://registry.npmjs.org/uglify-js/-/uglify-js-3.15.3.tgz\"\n  integrity sha512-6iCVm2omGJbsu3JWac+p6kUiOpg3wFO2f8lIXjfEb8RrmLjzog1wTPMmwKB7swfzzqxj9YM+sGUM++u1qN4qJg==\n\nunion-value@^1.0.0:\n  version \"1.0.1\"\n  resolved \"https://registry.npmjs.org/union-value/-/union-value-1.0.1.tgz\"\n  integrity sha512-tJfXmxMeWYnczCVs7XAEvIV7ieppALdyepWMkHkwciRpZraG/xwT+s2JN8+pr1+8jCRf80FFzvr+MpQeeoF4Xg==\n  dependencies:\n    arr-union \"^3.1.0\"\n    get-value \"^2.0.6\"\n    is-extendable \"^0.1.1\"\n    set-value \"^2.0.1\"\n\nunion@~0.4.3:\n  version \"0.4.6\"\n  resolved \"https://registry.npmjs.org/union/-/union-0.4.6.tgz\"\n  integrity sha1-GY+9rrolTniLDvy2MLwR8kopWeA=\n  dependencies:\n    qs \"~2.3.3\"\n\nuniq@^1.0.1:\n  version \"1.0.1\"\n  resolved \"https://registry.npmjs.org/uniq/-/uniq-1.0.1.tgz\"\n  integrity sha1-sxxa6CVIRKOoKBVBzisEuGWnNP8=\n\nunset-value@^1.0.0:\n  version \"1.0.0\"\n  resolved \"https://registry.npmjs.org/unset-value/-/unset-value-1.0.0.tgz\"\n  integrity sha1-g3aHP30jNRef+x5vw6jtDfyKtVk=\n  dependencies:\n    has-value \"^0.3.1\"\n    isobject \"^3.0.0\"\n\nuri-js@^4.2.2:\n  version \"4.2.2\"\n  resolved \"https://registry.npmjs.org/uri-js/-/uri-js-4.2.2.tgz\"\n  integrity sha512-KY9Frmirql91X2Qgjry0Wd4Y+YTdrdZheS8TFwvkbLWf/G5KNJDCh6pKL5OZctEW4+0Baa5idK2ZQuELRwPznQ==\n  dependencies:\n    punycode \"^2.1.0\"\n\nurix@^0.1.0:\n  version \"0.1.0\"\n  resolved \"https://registry.npmjs.org/urix/-/urix-0.1.0.tgz\"\n  integrity sha1-2pN/emLiH+wf0Y1Js1wpNQZ6bHI=\n\nurl-join@^2.0.5:\n  version \"2.0.5\"\n  resolved \"https://registry.npmjs.org/url-join/-/url-join-2.0.5.tgz\"\n  integrity sha1-WvIvGMBSoACkjXuCxenC4v7tpyg=\n\nuse@^3.1.0:\n  version \"3.1.1\"\n  resolved \"https://registry.npmjs.org/use/-/use-3.1.1.tgz\"\n  integrity sha512-cwESVXlO3url9YWlFW/TA9cshCEhtu7IKJ/p5soJ/gGpj7vbvFrAY/eIioQ6Dw23KjZhYgiIo8HOs1nQ2vr/oQ==\n\nvalidate-npm-package-license@^3.0.1:\n  version \"3.0.4\"\n  resolved \"https://registry.npmjs.org/validate-npm-package-license/-/validate-npm-package-license-3.0.4.tgz\"\n  integrity sha512-DpKm2Ui/xN7/HQKCtpZxoRWBhZ9Z0kqtygG8XCgNQ8ZlDnxuQmWhj566j8fN4Cu3/JmbhsDo7fcAJq4s9h27Ew==\n  dependencies:\n    spdx-correct \"^3.0.0\"\n    spdx-expression-parse \"^3.0.0\"\n\nwhich@^1.2.10, which@^1.2.9:\n  version \"1.3.1\"\n  resolved \"https://registry.npmjs.org/which/-/which-1.3.1.tgz\"\n  integrity sha512-HxJdYWq1MTIQbJ3nw0cqssHoTNU267KlrDuGZ1WYlxDStUtKUhOaJmh112/TZmHxxUfuJqPXSOm7tDyas0OSIQ==\n  dependencies:\n    isexe \"^2.0.0\"\n\nwordwrap@~0.0.2:\n  version \"0.0.3\"\n  resolved \"https://registry.npmjs.org/wordwrap/-/wordwrap-0.0.3.tgz\"\n  integrity sha1-o9XabNXAvAAI03I0u68b7WMFkQc=\n\nwordwrap@~1.0.0:\n  version \"1.0.0\"\n  resolved \"https://registry.npmjs.org/wordwrap/-/wordwrap-1.0.0.tgz\"\n  integrity sha1-J1hIEIkUVqQXHI0CJkQa3pDLyus=\n\nwrap-ansi@^3.0.1:\n  version \"3.0.1\"\n  resolved \"https://registry.npmjs.org/wrap-ansi/-/wrap-ansi-3.0.1.tgz\"\n  integrity sha1-KIoE2H7aXChuBg3+jxNc6NAH+Lo=\n  dependencies:\n    string-width \"^2.1.1\"\n    strip-ansi \"^4.0.0\"\n\nwrappy@1:\n  version \"1.0.2\"\n  resolved \"https://registry.npmjs.org/wrappy/-/wrappy-1.0.2.tgz\"\n  integrity sha1-tSQ9jz7BqjXxNkYFvA0QNuMKtp8=\n\nwrite@^0.2.1:\n  version \"0.2.1\"\n  resolved \"https://registry.npmjs.org/write/-/write-0.2.1.tgz\"\n  integrity sha1-X8A4KOJkzqP+kUVUdvejxWbLB1c=\n  dependencies:\n    mkdirp \"^0.5.1\"\n\nxtend@^4.0.1:\n  version \"4.0.1\"\n  resolved \"https://registry.npmjs.org/xtend/-/xtend-4.0.1.tgz\"\n  integrity sha1-pcbVMr5lbiPbgg77lDofBJmNY68=\n"
        }
      ]
    }
  ]
}