{
  "metadata": {
    "timestamp": 1736561778034,
    "page": 414,
    "hasNextPage": true,
    "endCursor": "Y3Vyc29yOjQyMA==",
    "completionStatus": "IN_PROGRESS"
  },
  "repositories": [
    {
      "nameWithOwner": "Okazari/Rythm.js",
      "stars": 3935,
      "defaultBranch": "master",
      "files": [
        {
          "name": ".babelrc",
          "type": "blob",
          "size": 0.10546875,
          "content": "{\n  \"plugins\": [\n    \"external-helpers\", \n    \"transform-class-properties\"\n  ],\n  \"presets\": [ \"es2015\" ]\n}\n"
        },
        {
          "name": ".editorconfig",
          "type": "blob",
          "size": 0.2470703125,
          "content": "# EditorConfig is awesome: http://EditorConfig.org\n\n# top-most EditorConfig file\nroot = true\n\n# Unix-style newlines with a newline ending every file\n[*]\nend_of_line = lf\ninsert_final_newline = true\n\ncharset = utf-8\n\nindent_style = space\nindent_size = 2\n"
        },
        {
          "name": ".eslintrc",
          "type": "blob",
          "size": 0.1142578125,
          "content": "{\n  \"parser\": \"babel-eslint\",\n  \"extends\": \"eslint:recommended\",\n  \"env\": {\n    \"node\": true,\n    \"mocha\": true\n  }\n}"
        },
        {
          "name": ".gitignore",
          "type": "blob",
          "size": 0.7353515625,
          "content": "# Logs\nlogs\n*.log\nnpm-debug.log*\n\n# Runtime data\npids\n*.pid\n*.seed\n\n# We doesn't need to share built file, but we need rythm.js for demo page.\nrythm.js.map\nrythm.min.js.map\nrythm.min.js\n\n# Directory for instrumented libs generated by jscoverage/JSCover\nlib-cov\n\n# Coverage directory used by tools like istanbul\ncoverage\n\n# Grunt intermediate storage (http://gruntjs.com/creating-plugins#storing-task-files)\n.grunt\n\n# node-waf configuration\n.lock-wscript\n\n# Compiled binary addons (http://nodejs.org/api/addons.html)\nbuild/Release\n\n# Dependency directory\nnode_modules\n\n# Optional npm cache directory\n.npm\n\n# Optional REPL history\n.node_repl_history\n\n# PHP is occasionnally useful, but not this time\n*.php\n\n### OSX ###\n*.DS_Store\n.AppleDouble\n.LSOverride\n"
        },
        {
          "name": ".prettierrc",
          "type": "blob",
          "size": 0.0947265625,
          "content": "{\n    \"printWidth\": 80,\n    \"singleQuote\": true,\n    \"trailingComma\": \"es5\",\n    \"semi\": false\n}\n"
        },
        {
          "name": ".travis.yml",
          "type": "blob",
          "size": 0.0673828125,
          "content": "language: node_js\nnode_js:\n  - \"node\"\nbranches:\n  only:\n    - master\n"
        },
        {
          "name": "CODE_OF_CONDUCT.md",
          "type": "blob",
          "size": 3.150390625,
          "content": "# Contributor Covenant Code of Conduct\n\n## Our Pledge\n\nIn the interest of fostering an open and welcoming environment, we as contributors and maintainers pledge to making participation in our project and our community a harassment-free experience for everyone, regardless of age, body size, disability, ethnicity, gender identity and expression, level of experience, nationality, personal appearance, race, religion, or sexual identity and orientation.\n\n## Our Standards\n\nExamples of behavior that contributes to creating a positive environment include:\n\n* Using welcoming and inclusive language\n* Being respectful of differing viewpoints and experiences\n* Gracefully accepting constructive criticism\n* Focusing on what is best for the community\n* Showing empathy towards other community members\n\nExamples of unacceptable behavior by participants include:\n\n* The use of sexualized language or imagery and unwelcome sexual attention or advances\n* Trolling, insulting/derogatory comments, and personal or political attacks\n* Public or private harassment\n* Publishing others' private information, such as a physical or electronic address, without explicit permission\n* Other conduct which could reasonably be considered inappropriate in a professional setting\n\n## Our Responsibilities\n\nProject maintainers are responsible for clarifying the standards of acceptable behavior and are expected to take appropriate and fair corrective action in response to any instances of unacceptable behavior.\n\nProject maintainers have the right and responsibility to remove, edit, or reject comments, commits, code, wiki edits, issues, and other contributions that are not aligned to this Code of Conduct, or to ban temporarily or permanently any contributor for other behaviors that they deem inappropriate, threatening, offensive, or harmful.\n\n## Scope\n\nThis Code of Conduct applies both within project spaces and in public spaces when an individual is representing the project or its community. Examples of representing a project or community include using an official project e-mail address, posting via an official social media account, or acting as an appointed representative at an online or offline event. Representation of a project may be further defined and clarified by project maintainers.\n\n## Enforcement\n\nInstances of abusive, harassing, or otherwise unacceptable behavior may be reported by contacting the project team at plouzennec.benjamin@gmail.com. The project team will review and investigate all complaints, and will respond in a way that it deems appropriate to the circumstances. The project team is obligated to maintain confidentiality with regard to the reporter of an incident. Further details of specific enforcement policies may be posted separately.\n\nProject maintainers who do not follow or enforce the Code of Conduct in good faith may face temporary or permanent repercussions as determined by other members of the project's leadership.\n\n## Attribution\n\nThis Code of Conduct is adapted from the [Contributor Covenant][homepage], version 1.4, available at [http://contributor-covenant.org/version/1/4][version]\n\n[homepage]: http://contributor-covenant.org\n[version]: http://contributor-covenant.org/version/1/4/\n"
        },
        {
          "name": "CONTRIBUTING.md",
          "type": "blob",
          "size": 1.4228515625,
          "content": "Contribute\n==========\n\nAny pull request will be apreciated. You can start coding on this project following this steps :\n + Fork the project\n + Clone your repository\n + run ```npm install```\n + run ```npm start``` in the main folder to launch a development webserver.\n + Enjoy the rythm.\n\nAdding new dance type\n---------\n\nIn v2.2.x adding a new dance type is pretty easy\n+ Create a new file in `src\\dances`\n+ This file must export your custom dance type function\n+ This file must export a reset function\n\nFor example, here is the content of `jump.js file`\n\n```js\n/* The function signature is :\n * @elem: The HTML element target you want to apply your effect to\n * @value: The current pulse ratio (percentage between 0 and 1)\n * @options: The option object user can give as last argument of addRythm function\n */\nexport default (elem, value, options = {}) => {\n  const max = options.max || 30\n  const min = options.min || 0\n  const jump = (max - min) * value\n  elem.style.transform = `translateY(${-jump}px)`\n}\n\n/* The reset function signature is :\n * @elem: The element to reset\n */\nexport const reset = elem => {\n  elem.style.transform = ''\n}\n```\n+ Import it and register it into the constructor of `Dancer.js` file\n```js\nimport jump, { reset as resetJump } from './dances/jump.js'\nclass Dancer {\n  constructor() {\n    this.registerDance('jump', jump, resetJump)\n  }\n}\n```\n\n+ Commit it and create a PR. Then look at everyone enjoying your contribution :) !\n"
        },
        {
          "name": "CONTRIBUTING_KR.md",
          "type": "blob",
          "size": 1.5771484375,
          "content": "기여하기\n==========\n어떤 Pull Request든 환영합니다. 당신은 이러한 방법으로 프로젝트에 코딩을 시작할수 있습니다.\n + 프로젝트를 Fork합니다.\n + 당신의 Repositoty에 Clone합니다.\n + npm install 을 실행합니다.\n + 개발 웹서버를 설치하기 위해 메인 폴더에서 npm start를 실행합니다.\n + 리듬을 즐기세요!\n\n새로운 댄스 추가하기\n---------\n\n2.2.x 버전에서 댄스 추가는 쉽습니다,\n+ `src\\dances`에 새로운 폴더를 생성합니다.\n+ 이 파일은 당신의 새로운 춤 함수를 반드시 export해야 합니다.\n+ 이 파일은 reset 함수를 반드시 export해야 합니다.\n\n여기에 jump.js의 예시가 있습니다.\n\n```js\n/* The function signature is :\n * @elem: 당신이 효과를 지정할 html 요소\n * @value: 현재 pulse 비율 (0부터 1까지 설정가능)\n * @options: 당신이 마지막 인자로 줄 수 있는 옵션\n */\nexport default (elem, value, options = {}) => {\n  const max = options.max || 30\n  const min = options.min || 0\n  const jump = (max - min) * value\n  elem.style.transform = `translateY(${-jump}px)`\n}\n\n/* The reset function signature is :\n * @elem: The element to reset\n */\nexport const reset = elem => {\n  elem.style.transform = ''\n}\n```\n+ Import 하고 Dancer.js파일의 생성자에 등록합니다.\n```js\nimport jump, { reset as resetJump } from './dances/jump.js'\nclass Dancer {\n  constructor() {\n    this.registerDance('jump', jump, resetJump)\n  }\n}\n```\n+ Commit을 하고 PR를 만드세요. 그리고 모두가 당신의 기여를 즐기는 것을 보세요! :)\n"
        },
        {
          "name": "LICENSE",
          "type": "blob",
          "size": 34.3173828125,
          "content": "                    GNU GENERAL PUBLIC LICENSE\n                       Version 3, 29 June 2007\n\n Copyright (C) 2007 Free Software Foundation, Inc. <http://fsf.org/>\n Everyone is permitted to copy and distribute verbatim copies\n of this license document, but changing it is not allowed.\n\n                            Preamble\n\n  The GNU General Public License is a free, copyleft license for\nsoftware and other kinds of works.\n\n  The licenses for most software and other practical works are designed\nto take away your freedom to share and change the works.  By contrast,\nthe GNU General Public License is intended to guarantee your freedom to\nshare and change all versions of a program--to make sure it remains free\nsoftware for all its users.  We, the Free Software Foundation, use the\nGNU General Public License for most of our software; it applies also to\nany other work released this way by its authors.  You can apply it to\nyour programs, too.\n\n  When we speak of free software, we are referring to freedom, not\nprice.  Our General Public Licenses are designed to make sure that you\nhave the freedom to distribute copies of free software (and charge for\nthem if you wish), that you receive source code or can get it if you\nwant it, that you can change the software or use pieces of it in new\nfree programs, and that you know you can do these things.\n\n  To protect your rights, we need to prevent others from denying you\nthese rights or asking you to surrender the rights.  Therefore, you have\ncertain responsibilities if you distribute copies of the software, or if\nyou modify it: responsibilities to respect the freedom of others.\n\n  For example, if you distribute copies of such a program, whether\ngratis or for a fee, you must pass on to the recipients the same\nfreedoms that you received.  You must make sure that they, too, receive\nor can get the source code.  And you must show them these terms so they\nknow their rights.\n\n  Developers that use the GNU GPL protect your rights with two steps:\n(1) assert copyright on the software, and (2) offer you this License\ngiving you legal permission to copy, distribute and/or modify it.\n\n  For the developers' and authors' protection, the GPL clearly explains\nthat there is no warranty for this free software.  For both users' and\nauthors' sake, the GPL requires that modified versions be marked as\nchanged, so that their problems will not be attributed erroneously to\nauthors of previous versions.\n\n  Some devices are designed to deny users access to install or run\nmodified versions of the software inside them, although the manufacturer\ncan do so.  This is fundamentally incompatible with the aim of\nprotecting users' freedom to change the software.  The systematic\npattern of such abuse occurs in the area of products for individuals to\nuse, which is precisely where it is most unacceptable.  Therefore, we\nhave designed this version of the GPL to prohibit the practice for those\nproducts.  If such problems arise substantially in other domains, we\nstand ready to extend this provision to those domains in future versions\nof the GPL, as needed to protect the freedom of users.\n\n  Finally, every program is threatened constantly by software patents.\nStates should not allow patents to restrict development and use of\nsoftware on general-purpose computers, but in those that do, we wish to\navoid the special danger that patents applied to a free program could\nmake it effectively proprietary.  To prevent this, the GPL assures that\npatents cannot be used to render the program non-free.\n\n  The precise terms and conditions for copying, distribution and\nmodification follow.\n\n                       TERMS AND CONDITIONS\n\n  0. Definitions.\n\n  \"This License\" refers to version 3 of the GNU General Public License.\n\n  \"Copyright\" also means copyright-like laws that apply to other kinds of\nworks, such as semiconductor masks.\n\n  \"The Program\" refers to any copyrightable work licensed under this\nLicense.  Each licensee is addressed as \"you\".  \"Licensees\" and\n\"recipients\" may be individuals or organizations.\n\n  To \"modify\" a work means to copy from or adapt all or part of the work\nin a fashion requiring copyright permission, other than the making of an\nexact copy.  The resulting work is called a \"modified version\" of the\nearlier work or a work \"based on\" the earlier work.\n\n  A \"covered work\" means either the unmodified Program or a work based\non the Program.\n\n  To \"propagate\" a work means to do anything with it that, without\npermission, would make you directly or secondarily liable for\ninfringement under applicable copyright law, except executing it on a\ncomputer or modifying a private copy.  Propagation includes copying,\ndistribution (with or without modification), making available to the\npublic, and in some countries other activities as well.\n\n  To \"convey\" a work means any kind of propagation that enables other\nparties to make or receive copies.  Mere interaction with a user through\na computer network, with no transfer of a copy, is not conveying.\n\n  An interactive user interface displays \"Appropriate Legal Notices\"\nto the extent that it includes a convenient and prominently visible\nfeature that (1) displays an appropriate copyright notice, and (2)\ntells the user that there is no warranty for the work (except to the\nextent that warranties are provided), that licensees may convey the\nwork under this License, and how to view a copy of this License.  If\nthe interface presents a list of user commands or options, such as a\nmenu, a prominent item in the list meets this criterion.\n\n  1. Source Code.\n\n  The \"source code\" for a work means the preferred form of the work\nfor making modifications to it.  \"Object code\" means any non-source\nform of a work.\n\n  A \"Standard Interface\" means an interface that either is an official\nstandard defined by a recognized standards body, or, in the case of\ninterfaces specified for a particular programming language, one that\nis widely used among developers working in that language.\n\n  The \"System Libraries\" of an executable work include anything, other\nthan the work as a whole, that (a) is included in the normal form of\npackaging a Major Component, but which is not part of that Major\nComponent, and (b) serves only to enable use of the work with that\nMajor Component, or to implement a Standard Interface for which an\nimplementation is available to the public in source code form.  A\n\"Major Component\", in this context, means a major essential component\n(kernel, window system, and so on) of the specific operating system\n(if any) on which the executable work runs, or a compiler used to\nproduce the work, or an object code interpreter used to run it.\n\n  The \"Corresponding Source\" for a work in object code form means all\nthe source code needed to generate, install, and (for an executable\nwork) run the object code and to modify the work, including scripts to\ncontrol those activities.  However, it does not include the work's\nSystem Libraries, or general-purpose tools or generally available free\nprograms which are used unmodified in performing those activities but\nwhich are not part of the work.  For example, Corresponding Source\nincludes interface definition files associated with source files for\nthe work, and the source code for shared libraries and dynamically\nlinked subprograms that the work is specifically designed to require,\nsuch as by intimate data communication or control flow between those\nsubprograms and other parts of the work.\n\n  The Corresponding Source need not include anything that users\ncan regenerate automatically from other parts of the Corresponding\nSource.\n\n  The Corresponding Source for a work in source code form is that\nsame work.\n\n  2. Basic Permissions.\n\n  All rights granted under this License are granted for the term of\ncopyright on the Program, and are irrevocable provided the stated\nconditions are met.  This License explicitly affirms your unlimited\npermission to run the unmodified Program.  The output from running a\ncovered work is covered by this License only if the output, given its\ncontent, constitutes a covered work.  This License acknowledges your\nrights of fair use or other equivalent, as provided by copyright law.\n\n  You may make, run and propagate covered works that you do not\nconvey, without conditions so long as your license otherwise remains\nin force.  You may convey covered works to others for the sole purpose\nof having them make modifications exclusively for you, or provide you\nwith facilities for running those works, provided that you comply with\nthe terms of this License in conveying all material for which you do\nnot control copyright.  Those thus making or running the covered works\nfor you must do so exclusively on your behalf, under your direction\nand control, on terms that prohibit them from making any copies of\nyour copyrighted material outside their relationship with you.\n\n  Conveying under any other circumstances is permitted solely under\nthe conditions stated below.  Sublicensing is not allowed; section 10\nmakes it unnecessary.\n\n  3. Protecting Users' Legal Rights From Anti-Circumvention Law.\n\n  No covered work shall be deemed part of an effective technological\nmeasure under any applicable law fulfilling obligations under article\n11 of the WIPO copyright treaty adopted on 20 December 1996, or\nsimilar laws prohibiting or restricting circumvention of such\nmeasures.\n\n  When you convey a covered work, you waive any legal power to forbid\ncircumvention of technological measures to the extent such circumvention\nis effected by exercising rights under this License with respect to\nthe covered work, and you disclaim any intention to limit operation or\nmodification of the work as a means of enforcing, against the work's\nusers, your or third parties' legal rights to forbid circumvention of\ntechnological measures.\n\n  4. Conveying Verbatim Copies.\n\n  You may convey verbatim copies of the Program's source code as you\nreceive it, in any medium, provided that you conspicuously and\nappropriately publish on each copy an appropriate copyright notice;\nkeep intact all notices stating that this License and any\nnon-permissive terms added in accord with section 7 apply to the code;\nkeep intact all notices of the absence of any warranty; and give all\nrecipients a copy of this License along with the Program.\n\n  You may charge any price or no price for each copy that you convey,\nand you may offer support or warranty protection for a fee.\n\n  5. Conveying Modified Source Versions.\n\n  You may convey a work based on the Program, or the modifications to\nproduce it from the Program, in the form of source code under the\nterms of section 4, provided that you also meet all of these conditions:\n\n    a) The work must carry prominent notices stating that you modified\n    it, and giving a relevant date.\n\n    b) The work must carry prominent notices stating that it is\n    released under this License and any conditions added under section\n    7.  This requirement modifies the requirement in section 4 to\n    \"keep intact all notices\".\n\n    c) You must license the entire work, as a whole, under this\n    License to anyone who comes into possession of a copy.  This\n    License will therefore apply, along with any applicable section 7\n    additional terms, to the whole of the work, and all its parts,\n    regardless of how they are packaged.  This License gives no\n    permission to license the work in any other way, but it does not\n    invalidate such permission if you have separately received it.\n\n    d) If the work has interactive user interfaces, each must display\n    Appropriate Legal Notices; however, if the Program has interactive\n    interfaces that do not display Appropriate Legal Notices, your\n    work need not make them do so.\n\n  A compilation of a covered work with other separate and independent\nworks, which are not by their nature extensions of the covered work,\nand which are not combined with it such as to form a larger program,\nin or on a volume of a storage or distribution medium, is called an\n\"aggregate\" if the compilation and its resulting copyright are not\nused to limit the access or legal rights of the compilation's users\nbeyond what the individual works permit.  Inclusion of a covered work\nin an aggregate does not cause this License to apply to the other\nparts of the aggregate.\n\n  6. Conveying Non-Source Forms.\n\n  You may convey a covered work in object code form under the terms\nof sections 4 and 5, provided that you also convey the\nmachine-readable Corresponding Source under the terms of this License,\nin one of these ways:\n\n    a) Convey the object code in, or embodied in, a physical product\n    (including a physical distribution medium), accompanied by the\n    Corresponding Source fixed on a durable physical medium\n    customarily used for software interchange.\n\n    b) Convey the object code in, or embodied in, a physical product\n    (including a physical distribution medium), accompanied by a\n    written offer, valid for at least three years and valid for as\n    long as you offer spare parts or customer support for that product\n    model, to give anyone who possesses the object code either (1) a\n    copy of the Corresponding Source for all the software in the\n    product that is covered by this License, on a durable physical\n    medium customarily used for software interchange, for a price no\n    more than your reasonable cost of physically performing this\n    conveying of source, or (2) access to copy the\n    Corresponding Source from a network server at no charge.\n\n    c) Convey individual copies of the object code with a copy of the\n    written offer to provide the Corresponding Source.  This\n    alternative is allowed only occasionally and noncommercially, and\n    only if you received the object code with such an offer, in accord\n    with subsection 6b.\n\n    d) Convey the object code by offering access from a designated\n    place (gratis or for a charge), and offer equivalent access to the\n    Corresponding Source in the same way through the same place at no\n    further charge.  You need not require recipients to copy the\n    Corresponding Source along with the object code.  If the place to\n    copy the object code is a network server, the Corresponding Source\n    may be on a different server (operated by you or a third party)\n    that supports equivalent copying facilities, provided you maintain\n    clear directions next to the object code saying where to find the\n    Corresponding Source.  Regardless of what server hosts the\n    Corresponding Source, you remain obligated to ensure that it is\n    available for as long as needed to satisfy these requirements.\n\n    e) Convey the object code using peer-to-peer transmission, provided\n    you inform other peers where the object code and Corresponding\n    Source of the work are being offered to the general public at no\n    charge under subsection 6d.\n\n  A separable portion of the object code, whose source code is excluded\nfrom the Corresponding Source as a System Library, need not be\nincluded in conveying the object code work.\n\n  A \"User Product\" is either (1) a \"consumer product\", which means any\ntangible personal property which is normally used for personal, family,\nor household purposes, or (2) anything designed or sold for incorporation\ninto a dwelling.  In determining whether a product is a consumer product,\ndoubtful cases shall be resolved in favor of coverage.  For a particular\nproduct received by a particular user, \"normally used\" refers to a\ntypical or common use of that class of product, regardless of the status\nof the particular user or of the way in which the particular user\nactually uses, or expects or is expected to use, the product.  A product\nis a consumer product regardless of whether the product has substantial\ncommercial, industrial or non-consumer uses, unless such uses represent\nthe only significant mode of use of the product.\n\n  \"Installation Information\" for a User Product means any methods,\nprocedures, authorization keys, or other information required to install\nand execute modified versions of a covered work in that User Product from\na modified version of its Corresponding Source.  The information must\nsuffice to ensure that the continued functioning of the modified object\ncode is in no case prevented or interfered with solely because\nmodification has been made.\n\n  If you convey an object code work under this section in, or with, or\nspecifically for use in, a User Product, and the conveying occurs as\npart of a transaction in which the right of possession and use of the\nUser Product is transferred to the recipient in perpetuity or for a\nfixed term (regardless of how the transaction is characterized), the\nCorresponding Source conveyed under this section must be accompanied\nby the Installation Information.  But this requirement does not apply\nif neither you nor any third party retains the ability to install\nmodified object code on the User Product (for example, the work has\nbeen installed in ROM).\n\n  The requirement to provide Installation Information does not include a\nrequirement to continue to provide support service, warranty, or updates\nfor a work that has been modified or installed by the recipient, or for\nthe User Product in which it has been modified or installed.  Access to a\nnetwork may be denied when the modification itself materially and\nadversely affects the operation of the network or violates the rules and\nprotocols for communication across the network.\n\n  Corresponding Source conveyed, and Installation Information provided,\nin accord with this section must be in a format that is publicly\ndocumented (and with an implementation available to the public in\nsource code form), and must require no special password or key for\nunpacking, reading or copying.\n\n  7. Additional Terms.\n\n  \"Additional permissions\" are terms that supplement the terms of this\nLicense by making exceptions from one or more of its conditions.\nAdditional permissions that are applicable to the entire Program shall\nbe treated as though they were included in this License, to the extent\nthat they are valid under applicable law.  If additional permissions\napply only to part of the Program, that part may be used separately\nunder those permissions, but the entire Program remains governed by\nthis License without regard to the additional permissions.\n\n  When you convey a copy of a covered work, you may at your option\nremove any additional permissions from that copy, or from any part of\nit.  (Additional permissions may be written to require their own\nremoval in certain cases when you modify the work.)  You may place\nadditional permissions on material, added by you to a covered work,\nfor which you have or can give appropriate copyright permission.\n\n  Notwithstanding any other provision of this License, for material you\nadd to a covered work, you may (if authorized by the copyright holders of\nthat material) supplement the terms of this License with terms:\n\n    a) Disclaiming warranty or limiting liability differently from the\n    terms of sections 15 and 16 of this License; or\n\n    b) Requiring preservation of specified reasonable legal notices or\n    author attributions in that material or in the Appropriate Legal\n    Notices displayed by works containing it; or\n\n    c) Prohibiting misrepresentation of the origin of that material, or\n    requiring that modified versions of such material be marked in\n    reasonable ways as different from the original version; or\n\n    d) Limiting the use for publicity purposes of names of licensors or\n    authors of the material; or\n\n    e) Declining to grant rights under trademark law for use of some\n    trade names, trademarks, or service marks; or\n\n    f) Requiring indemnification of licensors and authors of that\n    material by anyone who conveys the material (or modified versions of\n    it) with contractual assumptions of liability to the recipient, for\n    any liability that these contractual assumptions directly impose on\n    those licensors and authors.\n\n  All other non-permissive additional terms are considered \"further\nrestrictions\" within the meaning of section 10.  If the Program as you\nreceived it, or any part of it, contains a notice stating that it is\ngoverned by this License along with a term that is a further\nrestriction, you may remove that term.  If a license document contains\na further restriction but permits relicensing or conveying under this\nLicense, you may add to a covered work material governed by the terms\nof that license document, provided that the further restriction does\nnot survive such relicensing or conveying.\n\n  If you add terms to a covered work in accord with this section, you\nmust place, in the relevant source files, a statement of the\nadditional terms that apply to those files, or a notice indicating\nwhere to find the applicable terms.\n\n  Additional terms, permissive or non-permissive, may be stated in the\nform of a separately written license, or stated as exceptions;\nthe above requirements apply either way.\n\n  8. Termination.\n\n  You may not propagate or modify a covered work except as expressly\nprovided under this License.  Any attempt otherwise to propagate or\nmodify it is void, and will automatically terminate your rights under\nthis License (including any patent licenses granted under the third\nparagraph of section 11).\n\n  However, if you cease all violation of this License, then your\nlicense from a particular copyright holder is reinstated (a)\nprovisionally, unless and until the copyright holder explicitly and\nfinally terminates your license, and (b) permanently, if the copyright\nholder fails to notify you of the violation by some reasonable means\nprior to 60 days after the cessation.\n\n  Moreover, your license from a particular copyright holder is\nreinstated permanently if the copyright holder notifies you of the\nviolation by some reasonable means, this is the first time you have\nreceived notice of violation of this License (for any work) from that\ncopyright holder, and you cure the violation prior to 30 days after\nyour receipt of the notice.\n\n  Termination of your rights under this section does not terminate the\nlicenses of parties who have received copies or rights from you under\nthis License.  If your rights have been terminated and not permanently\nreinstated, you do not qualify to receive new licenses for the same\nmaterial under section 10.\n\n  9. Acceptance Not Required for Having Copies.\n\n  You are not required to accept this License in order to receive or\nrun a copy of the Program.  Ancillary propagation of a covered work\noccurring solely as a consequence of using peer-to-peer transmission\nto receive a copy likewise does not require acceptance.  However,\nnothing other than this License grants you permission to propagate or\nmodify any covered work.  These actions infringe copyright if you do\nnot accept this License.  Therefore, by modifying or propagating a\ncovered work, you indicate your acceptance of this License to do so.\n\n  10. Automatic Licensing of Downstream Recipients.\n\n  Each time you convey a covered work, the recipient automatically\nreceives a license from the original licensors, to run, modify and\npropagate that work, subject to this License.  You are not responsible\nfor enforcing compliance by third parties with this License.\n\n  An \"entity transaction\" is a transaction transferring control of an\norganization, or substantially all assets of one, or subdividing an\norganization, or merging organizations.  If propagation of a covered\nwork results from an entity transaction, each party to that\ntransaction who receives a copy of the work also receives whatever\nlicenses to the work the party's predecessor in interest had or could\ngive under the previous paragraph, plus a right to possession of the\nCorresponding Source of the work from the predecessor in interest, if\nthe predecessor has it or can get it with reasonable efforts.\n\n  You may not impose any further restrictions on the exercise of the\nrights granted or affirmed under this License.  For example, you may\nnot impose a license fee, royalty, or other charge for exercise of\nrights granted under this License, and you may not initiate litigation\n(including a cross-claim or counterclaim in a lawsuit) alleging that\nany patent claim is infringed by making, using, selling, offering for\nsale, or importing the Program or any portion of it.\n\n  11. Patents.\n\n  A \"contributor\" is a copyright holder who authorizes use under this\nLicense of the Program or a work on which the Program is based.  The\nwork thus licensed is called the contributor's \"contributor version\".\n\n  A contributor's \"essential patent claims\" are all patent claims\nowned or controlled by the contributor, whether already acquired or\nhereafter acquired, that would be infringed by some manner, permitted\nby this License, of making, using, or selling its contributor version,\nbut do not include claims that would be infringed only as a\nconsequence of further modification of the contributor version.  For\npurposes of this definition, \"control\" includes the right to grant\npatent sublicenses in a manner consistent with the requirements of\nthis License.\n\n  Each contributor grants you a non-exclusive, worldwide, royalty-free\npatent license under the contributor's essential patent claims, to\nmake, use, sell, offer for sale, import and otherwise run, modify and\npropagate the contents of its contributor version.\n\n  In the following three paragraphs, a \"patent license\" is any express\nagreement or commitment, however denominated, not to enforce a patent\n(such as an express permission to practice a patent or covenant not to\nsue for patent infringement).  To \"grant\" such a patent license to a\nparty means to make such an agreement or commitment not to enforce a\npatent against the party.\n\n  If you convey a covered work, knowingly relying on a patent license,\nand the Corresponding Source of the work is not available for anyone\nto copy, free of charge and under the terms of this License, through a\npublicly available network server or other readily accessible means,\nthen you must either (1) cause the Corresponding Source to be so\navailable, or (2) arrange to deprive yourself of the benefit of the\npatent license for this particular work, or (3) arrange, in a manner\nconsistent with the requirements of this License, to extend the patent\nlicense to downstream recipients.  \"Knowingly relying\" means you have\nactual knowledge that, but for the patent license, your conveying the\ncovered work in a country, or your recipient's use of the covered work\nin a country, would infringe one or more identifiable patents in that\ncountry that you have reason to believe are valid.\n\n  If, pursuant to or in connection with a single transaction or\narrangement, you convey, or propagate by procuring conveyance of, a\ncovered work, and grant a patent license to some of the parties\nreceiving the covered work authorizing them to use, propagate, modify\nor convey a specific copy of the covered work, then the patent license\nyou grant is automatically extended to all recipients of the covered\nwork and works based on it.\n\n  A patent license is \"discriminatory\" if it does not include within\nthe scope of its coverage, prohibits the exercise of, or is\nconditioned on the non-exercise of one or more of the rights that are\nspecifically granted under this License.  You may not convey a covered\nwork if you are a party to an arrangement with a third party that is\nin the business of distributing software, under which you make payment\nto the third party based on the extent of your activity of conveying\nthe work, and under which the third party grants, to any of the\nparties who would receive the covered work from you, a discriminatory\npatent license (a) in connection with copies of the covered work\nconveyed by you (or copies made from those copies), or (b) primarily\nfor and in connection with specific products or compilations that\ncontain the covered work, unless you entered into that arrangement,\nor that patent license was granted, prior to 28 March 2007.\n\n  Nothing in this License shall be construed as excluding or limiting\nany implied license or other defenses to infringement that may\notherwise be available to you under applicable patent law.\n\n  12. No Surrender of Others' Freedom.\n\n  If conditions are imposed on you (whether by court order, agreement or\notherwise) that contradict the conditions of this License, they do not\nexcuse you from the conditions of this License.  If you cannot convey a\ncovered work so as to satisfy simultaneously your obligations under this\nLicense and any other pertinent obligations, then as a consequence you may\nnot convey it at all.  For example, if you agree to terms that obligate you\nto collect a royalty for further conveying from those to whom you convey\nthe Program, the only way you could satisfy both those terms and this\nLicense would be to refrain entirely from conveying the Program.\n\n  13. Use with the GNU Affero General Public License.\n\n  Notwithstanding any other provision of this License, you have\npermission to link or combine any covered work with a work licensed\nunder version 3 of the GNU Affero General Public License into a single\ncombined work, and to convey the resulting work.  The terms of this\nLicense will continue to apply to the part which is the covered work,\nbut the special requirements of the GNU Affero General Public License,\nsection 13, concerning interaction through a network will apply to the\ncombination as such.\n\n  14. Revised Versions of this License.\n\n  The Free Software Foundation may publish revised and/or new versions of\nthe GNU General Public License from time to time.  Such new versions will\nbe similar in spirit to the present version, but may differ in detail to\naddress new problems or concerns.\n\n  Each version is given a distinguishing version number.  If the\nProgram specifies that a certain numbered version of the GNU General\nPublic License \"or any later version\" applies to it, you have the\noption of following the terms and conditions either of that numbered\nversion or of any later version published by the Free Software\nFoundation.  If the Program does not specify a version number of the\nGNU General Public License, you may choose any version ever published\nby the Free Software Foundation.\n\n  If the Program specifies that a proxy can decide which future\nversions of the GNU General Public License can be used, that proxy's\npublic statement of acceptance of a version permanently authorizes you\nto choose that version for the Program.\n\n  Later license versions may give you additional or different\npermissions.  However, no additional obligations are imposed on any\nauthor or copyright holder as a result of your choosing to follow a\nlater version.\n\n  15. Disclaimer of Warranty.\n\n  THERE IS NO WARRANTY FOR THE PROGRAM, TO THE EXTENT PERMITTED BY\nAPPLICABLE LAW.  EXCEPT WHEN OTHERWISE STATED IN WRITING THE COPYRIGHT\nHOLDERS AND/OR OTHER PARTIES PROVIDE THE PROGRAM \"AS IS\" WITHOUT WARRANTY\nOF ANY KIND, EITHER EXPRESSED OR IMPLIED, INCLUDING, BUT NOT LIMITED TO,\nTHE IMPLIED WARRANTIES OF MERCHANTABILITY AND FITNESS FOR A PARTICULAR\nPURPOSE.  THE ENTIRE RISK AS TO THE QUALITY AND PERFORMANCE OF THE PROGRAM\nIS WITH YOU.  SHOULD THE PROGRAM PROVE DEFECTIVE, YOU ASSUME THE COST OF\nALL NECESSARY SERVICING, REPAIR OR CORRECTION.\n\n  16. Limitation of Liability.\n\n  IN NO EVENT UNLESS REQUIRED BY APPLICABLE LAW OR AGREED TO IN WRITING\nWILL ANY COPYRIGHT HOLDER, OR ANY OTHER PARTY WHO MODIFIES AND/OR CONVEYS\nTHE PROGRAM AS PERMITTED ABOVE, BE LIABLE TO YOU FOR DAMAGES, INCLUDING ANY\nGENERAL, SPECIAL, INCIDENTAL OR CONSEQUENTIAL DAMAGES ARISING OUT OF THE\nUSE OR INABILITY TO USE THE PROGRAM (INCLUDING BUT NOT LIMITED TO LOSS OF\nDATA OR DATA BEING RENDERED INACCURATE OR LOSSES SUSTAINED BY YOU OR THIRD\nPARTIES OR A FAILURE OF THE PROGRAM TO OPERATE WITH ANY OTHER PROGRAMS),\nEVEN IF SUCH HOLDER OR OTHER PARTY HAS BEEN ADVISED OF THE POSSIBILITY OF\nSUCH DAMAGES.\n\n  17. Interpretation of Sections 15 and 16.\n\n  If the disclaimer of warranty and limitation of liability provided\nabove cannot be given local legal effect according to their terms,\nreviewing courts shall apply local law that most closely approximates\nan absolute waiver of all civil liability in connection with the\nProgram, unless a warranty or assumption of liability accompanies a\ncopy of the Program in return for a fee.\n\n                     END OF TERMS AND CONDITIONS\n\n            How to Apply These Terms to Your New Programs\n\n  If you develop a new program, and you want it to be of the greatest\npossible use to the public, the best way to achieve this is to make it\nfree software which everyone can redistribute and change under these terms.\n\n  To do so, attach the following notices to the program.  It is safest\nto attach them to the start of each source file to most effectively\nstate the exclusion of warranty; and each file should have at least\nthe \"copyright\" line and a pointer to where the full notice is found.\n\n    {one line to give the program's name and a brief idea of what it does.}\n    Copyright (C) {year}  {name of author}\n\n    This program is free software: you can redistribute it and/or modify\n    it under the terms of the GNU General Public License as published by\n    the Free Software Foundation, either version 3 of the License, or\n    (at your option) any later version.\n\n    This program is distributed in the hope that it will be useful,\n    but WITHOUT ANY WARRANTY; without even the implied warranty of\n    MERCHANTABILITY or FITNESS FOR A PARTICULAR PURPOSE.  See the\n    GNU General Public License for more details.\n\n    You should have received a copy of the GNU General Public License\n    along with this program.  If not, see <http://www.gnu.org/licenses/>.\n\nAlso add information on how to contact you by electronic and paper mail.\n\n  If the program does terminal interaction, make it output a short\nnotice like this when it starts in an interactive mode:\n\n    {project}  Copyright (C) {year}  {fullname}\n    This program comes with ABSOLUTELY NO WARRANTY; for details type `show w'.\n    This is free software, and you are welcome to redistribute it\n    under certain conditions; type `show c' for details.\n\nThe hypothetical commands `show w' and `show c' should show the appropriate\nparts of the General Public License.  Of course, your program's commands\nmight be different; for a GUI interface, you would use an \"about box\".\n\n  You should also get your employer (if you work as a programmer) or school,\nif any, to sign a \"copyright disclaimer\" for the program, if necessary.\nFor more information on this, and how to apply and follow the GNU GPL, see\n<http://www.gnu.org/licenses/>.\n\n  The GNU General Public License does not permit incorporating your program\ninto proprietary programs.  If your program is a subroutine library, you\nmay consider it more useful to permit linking proprietary applications with\nthe library.  If this is what you want to do, use the GNU Lesser General\nPublic License instead of this License.  But first, please read\n<http://www.gnu.org/philosophy/why-not-lgpl.html>.\n"
        },
        {
          "name": "README.md",
          "type": "blob",
          "size": 9.5693359375,
          "content": "# Contribute\n\n\n<♫/> Rythm.js - v2.2.6\n======================\n\n[![Build Status](https://travis-ci.org/Okazari/Rythm.js.svg?branch=master)](https://travis-ci.org/Okazari/Rythm.js)\n\nDemo at: [https://okazari.github.io/Rythm.js/](https://okazari.github.io/Rythm.js/)\n\nA JavaScript library that makes your page dance.\n\n\nGetting started\n===============\n\nInstall with npm:\n\n```sh\nnpm install rythm.js\n```\n\nOr get from a CDN:\n\n```\nhttps://unpkg.com/rythm.js/\nhttps://cdnjs.cloudflare.com/ajax/libs/rythm.js/2.2.6/rythm.min.js\n```\n\nGood old way\n------------\n\nImport rythm into your page:\n\n```html\n<script type=\"text/javascript\" src=\"/path/to/rythm.min.js\"></script>\n```\n\nAdd one of the rythm css classes to indicate which element will dance:\n\n```html\n<div class=\"rythm-bass\"></div>\n```\n\nCreate a rythm object and give it your audio URL then use the start function:\n\n```js\nvar rythm = new Rythm()\nrythm.setMusic('path/to/sample.mp3')\nrythm.start()\n```\n\nES6 module\n----------\n\n```js\nimport Rythm from 'rythm.js'\nconst rythm = new Rythm()\nrythm.setMusic('path/to/sample.mp3')\nrythm.start()\n```\n\n\nAPI documentation\n=================\n\nRythm object\n------------\n\n```js\nconst rythm = new Rythm()\n\n/* The starting scale is the minimum scale your element will take (Scale ratio is startingScale + (pulseRatio * currentPulse)).\n * Value in percentage between 0 and 1\n * Default: 0.75\n */\nrythm.startingScale = value\n\n/* The pulse ratio is be the maximum additional scale your element will take (Scale ratio is startingScale + (pulseRatio * currentPulse)).\n * Value in percentage between 0 and 1\n * Default: 0.30\n */\nrythm.pulseRatio = value\n\n/* The max value history represent the number of passed value that will be stored to evaluate the current pulse.\n * Int value, minimum 1\n * Default: 100\n */\nrythm.maxValueHistory = value\n\n/* Set the music the page will dance to\n * @audioUrl: '../example/mysong.mp3'\n */\nrythm.setMusic(audioUrl)\n\n/* Used to collaborate with other players library.\n * You can connect Rythm to an audioElement, and then control the audio with your other player\n */\nrythm.connectExternalAudioElement(audioElement)\n\n/* Adjust audio gain\n * @value: Number\n */\nrythm.setGain(value)\n\n/* Add your own rythm-class\n * @elementClass: Class that you want to link your rythm to\n * @danceType: Use any of the built-in effect or give your own function\n * @startValue: The starting frequency of your rythm\n * @nbValue: The number of frequency of your rythm\n * 1024 Frequencies, your rythm will react to the average of your selected frequencies.\n * Examples: bass 0-10 ; medium 150-40 ; high 500-100\n */\nrythm.addRythm(elementClass, danceType, startValue, nbValue)\n\n/* Plug your computer microphone to rythm.js.\n * This function returns a Promise object that is resolved when the microphone is up.\n * Require your website to be run in HTTPS\n */\nrythm.plugMicrophone().then(function(){...})\n\n// Let's dance\nrythm.start()\n\n/* Stop the party\n * @freeze: Set this to true if you want to prevent the elements to reset to their initial position\n */\nrythm.stop(freeze)\n```\n\nBuilt-in classes with \"pulse\" effect\n------------------------------------\n\n+ rythm-bass\n+ rythm-medium\n+ rythm-high\n\nCustom-classes\n--------------\n\nYou can use the `addRythm` function to make your own classes listen to specific frequencies.\nHere is how the basics classes are created:\n+ `addRythm('rythm-bass', 'pulse', 0, 10)`\n+ `addRythm('rythm-medium', 'pulse', 150, 40)`\n+ `addRythm('rythm-high', 'pulse', 500, 100)`\n\nDance types available\n---------------------\n\nFor more control of theses dance types, you can give a configuration object as last argument to `addRythm`:\n\n```js\naddRythm('rythm-high', 'shake', 500, 100, { direction:'left', min: 20, max: 300 })\n```\n\nHere are the built-in dances and their options:\n+ pulse\n  + min: Minimum value given to `transform: scale()`. Default: `0.75`\n  + max: Maximum value given to `transform: scale()`. Default: `1.25`\n+ jump\n  + min: Minimum value given to `transform: translateY()`. Default: `0`\n  + max: Maximum value given to `transform: translateY()`. Default: `30`\n+ shake\n  + min: Minimum value given to `transform: translateX()`. Default: `-15`\n  + max: Maximum value given to `transform: translateX()`. Default: `15`\n  + direction: `left` for a right to left move, `right` for a left to right move. Default: `right`\n+ twist\n  + min: Minimum value given to `transform: rotate()`. Default: `-20`\n  + max: Maximum value given to `transform: rotate()`. Default: `20`\n  + direction: `left` for a right to left move, `right` for a left to right move. Default: `right`\n+ vanish\n  + min: Minimum value (between 0 and 1) given to `opacity`. Default: `0`\n  + max: Maximum value (between 0 and 1) given to `opacity`. Default: `1`\n  + reverse: Boolean to reverse the effect. Default: `false` (Higher the pulse is, the more visible it will be)\n+ borderColor\n  + from: Array of integer between 0 and 255 corresponding to a RGB color. Default: `[0,0,0]`\n  + to: Array of integer between 0 and 255 corresponding to a RGB color. Default: `[255,255,255]`\n+ color\n  + from: Array of integer between 0 and 255 corresponding to a RGB color. Default: `[0,0,0]`\n  + to: Array of integer between 0 and 255 corresponding to a RGB color. Default: `[255,255,255]`\n+ radius\n  + min: Minimum value given to `border-radius`. Default: `0`\n  + max: Maximum value given to `border-radius`. Default: `25`\n  + reverse: Boolean to make effect from max to min. Default: `false`\n+ blur\n  + min: Minimum value given to `filter: blur()`. Default: `0`\n  + max: Maximum value given to `filter: blur()`. Default: `8`\n  + reverse: Boolean to make effect from max to min. Default: `false`\n+ swing\n  + curve: Whether the element should curve `up` or `down`. Default: `down`\n  + direction: Whether the element should swing `right` or `left`. Default: `right`\n  + radius: How far the element will swing. Default: `20`\n+ kern\n  + min: Minimum value given to `letter-spacing`. Default: `0`\n  + max: Maximum value given to `letter-spacing`. Default: `25`\n  + reverse: Boolean to make effect from max to min. Default: `false`\n+ neon\n  + from: Array of integer between 0 and 255 corresponding to a RGB color. Default: `[0,0,0]`\n  + to: Array of integer between 0 and 255 corresponding to a RGB color. Default: `[255,255,255]`\n+ borderWidth\n  + min: Minimum value given to `border-width`. Default: `0`\n  + max: Maximum value given to `border-width`. Default: `5`\n+ fontSize\n  + min: Minimum value given to `font-width`. Default: `0.8`\n  + max: Maximum value given to `font-width`. Default: `1.2`\n+ tilt\n  + min: Minimum value given to `tilt`. Default: `20`\n  + max: Maximum value given to `tilt`. Default: `25`\n  + reverse: Boolean to make effect from max to min. Default: `false`\n+ fontColor\n  + from: Array of integer between 0 and 255 corresponding to a RGB color. Default: `[0,0,0]`\n  + to: Array of integer between 0 and 255 corresponding to a RGB color. Default: `[255,255,255]`\n\nTo see each visual effect, you can go to the [Demo](https://okazari.github.io/Rythm.js/).\n\nCustom dance type\n-----------------\n\nIf you want to use your own dance type, you need to give an object as the 2nd argument of `addRythm` instead of a built in dance key.\n\nThis object must have two properties:\n - dance: The custom function to make elements dance\n - reset: The associated custom function that will be called to reset element style\n\n```js\n/* The custom function signature is\n * @elem: The HTML element target you want to apply your effect to\n * @value: The current pulse ratio (percentage between 0 and 1)\n * @options: The option object user can give as last argument of addRythm function\n */\nconst pulse = (elem, value, options = {}) => {\n  const max = options.max || 1.25\n  const min = options.min || 0.75\n  const scale = (max - min) * value\n  elem.style.transform = `scale(${min + scale})`\n}\n\n/* The reset function signature is\n * @elem: The element to reset\n */\nconst resetPulse = elem => {\n  elem.style.transform = ''\n}\n\naddRythm('my-css-class', { dance: pulse, reset: resetPulse }, 150, 40)\n```\n\n\nFeatures\n========\n\n + Your HTML can dance by using any of the available dance types.\n + You can use custom functions to build you own dance type (and if it looks awesome! Feel free to make a PR ;) )\n\n\nContribute\n==========\n\nAny pull request will be appreciated. You can start coding on this project following these steps:\n + Fork the project\n + Clone your repository\n + Run ```npm install```\n + Run ```npm start``` in the main folder to launch a development web server\n + Enjoy the rythm\n\nAdding new dance type\n---------------------\n\nIn v2.2.x adding a new dance type is pretty easy:\n+ Create a new file in `src\\dances`\n+ This file must export your custom dance type function\n+ This file must export a reset function\n\nFor example, here is the content of `jump.js` file:\n\n```js\n/* The function signature is\n * @elem: The HTML element target you want to apply your effect to\n * @value: The current pulse ratio (percentage between 0 and 1)\n * @options: The option object user can give as last argument of addRythm function\n */\nexport default (elem, value, options = {}) => {\n  const max = options.max || 30\n  const min = options.min || 0\n  const jump = (max - min) * value\n  elem.style.transform = `translateY(${-jump}px)`\n}\n\n/* The reset function signature is\n * @elem: The element to reset\n */\nexport const reset = elem => {\n  elem.style.transform = ''\n}\n```\n\n+ Import it and register it into the constructor of `Dancer.js` file:\n\n```js\nimport jump, { reset as resetJump } from './dances/jump.js'\nclass Dancer {\n  constructor() {\n    this.registerDance('jump', jump, resetJump)\n  }\n}\n```\n\n+ Commit it and create a PR. Then look at everyone enjoying your contribution :) !\n\nLicense: GNU GPL\n\nAuthor: [@OkazariBzh](https://twitter.com/OkazariBzh)\n"
        },
        {
          "name": "build.js",
          "type": "blob",
          "size": 2.4228515625,
          "content": "const babelrc = require('babelrc-rollup');\nconst commandLineArgs = require('command-line-args');\nconst rollup = require('rollup');\nconst babel = require('rollup-plugin-babel');\nconst uglify = require('rollup-plugin-uglify');\nconst watch = require('rollup-watch');\nconst { minify } = require('uglify-es');\n\nconst pkg = require('./package.json');\n\nconst entry = './src/index.js';\nconst moduleName = 'Rythm';\nconst destDefault = './rythm.js';\nconst destMinify = './rythm.min.js';\nconst pluginsDefault = [babel(babelrc.default())];\nconst external = Object.keys(pkg.dependencies);\nconst format = 'umd';\n\nconst optionDefs = [\n  {\n    name: 'watch',\n    alias: 'w',\n    type: Boolean\n  }\n];\nconst options = commandLineArgs(optionDefs);\n\nif (options.watch) {\n  const config = (dest, plugins) => {\n    return {\n      entry: entry,\n      dest: dest,\n      format: format,\n      moduleName: moduleName,\n      sourceMap: true,\n      plugins: plugins\n    };\n  };\n\n  const configDefault = config(destDefault, pluginsDefault);\n  const configMinify = config(destMinify, [\n    ...pluginsDefault,\n    uglify({}, minify)\n  ]);\n\n  const watcherDefault = watch(rollup, configDefault);\n  const watcherMinify = watch(rollup, configMinify);\n\n  const stderr = console.error.bind(console);\n\n  const eventHandler = (event, filename) => {\n    switch (event.code) {\n      case 'STARTING':\n        stderr('checking rollup-watch version...');\n        break;\n      case 'BUILD_START':\n        stderr(`bundling ${filename}...`);\n        break;\n      case 'BUILD_END':\n        stderr(\n          `${filename} bundled in ${event.duration}ms. Watching for changes...`\n        );\n        break;\n      case 'ERROR':\n        stderr(`error: ${event.error}`);\n        break;\n      default:\n        stderr(`unknown event: ${event}`);\n    }\n  };\n\n  watcherDefault.on('event', event => eventHandler(event, destDefault));\n  watcherMinify.on('event', event => eventHandler(event, destMinify));\n} else {\n  rollup\n    .rollup({\n      entry: entry,\n      plugins: pluginsDefault,\n      external: external\n    })\n    .then(bundle => {\n      bundle.write({\n        format: format,\n        moduleName: moduleName,\n        dest: destDefault\n      });\n    });\n\n  rollup\n    .rollup({\n      entry: entry,\n      plugins: [...pluginsDefault, uglify({}, minify)],\n      external: external\n    })\n    .then(bundle => {\n      bundle.write({\n        format: format,\n        moduleName: moduleName,\n        dest: destMinify\n      });\n    });\n}\n"
        },
        {
          "name": "demo",
          "type": "tree",
          "content": null
        },
        {
          "name": "index.html",
          "type": "blob",
          "size": 15.6923828125,
          "content": "<!DOCTYPE html>\n<html>\n  <head>\n    <meta charset=\"utf-8\">\n    <title>Rythm.js</title>\n    <link rel=\"stylesheet\" href=\"./demo/rythm.css\" media=\"screen\" title=\"no title\" charset=\"utf-8\">\n  </head>\n  <body>\n    <div class=\"container\">\n      <h1 class=\"shake3\">\n        Rythm.js - v2.2.6\n      </h1>\n      <h2>\n        A javascript library that makes your page dance.\n      </h2>\n      <div id=\"quote\">\n        <div class=\"quote-title\">Random quote about Rythm.js</div>\n        <div id=\"quote-text\">\n        </div>\n        <div id=\"quote-author\">\n        </div>\n      </div>\n      <div id='player'>\n        <button id='start'>Start Demo</button>\n        <button id='stop'>Stop Demo</button>\n        <button id='mic'>Use Microphone</button>\n      </div>\n      <div>\n        <a class=\"twist3\" href=\"https://github.com/Okazari/Rythm.js\">View on github</a>\n        <a class=\"twist1\" href=\"https://github.com/Okazari/Rythm.js/releases\">Release notes</a>\n      </div>\n      <h1>\n        Basic usage\n      </h1>\n      <section>\n        <div class=\"demo\">\n          <div class=\"rythm rythm-bass\">♫</div>\n          <pre class=\"prettyprint\">\n            use css class 'rythm-bass'\n          </pre>\n        </div>\n        <div class=\"demo\">\n          <div class=\"rythm rythm-medium\">♫</div>\n          <pre class=\"prettyprint\">\n            use css class 'rythm-medium'\n          </pre>\n        </div>\n        <div class=\"demo\">\n          <div class=\"rythm rythm-high\">♫</div>\n          <pre class=\"prettyprint\">\n            use css class 'rythm-high'\n          </pre>\n        </div>\n      </section>\n      <h1>\n        Added in v2.2.5\n      </h1>\n      <section>\n        <h3>\n          Tilt\n        </h3>\n        <div class=\"demo\">\n          <div class=\"rythm tilt1\">♫</div>\n          <pre class=\"prettyprint\">\n            rythm.addRythm('tilt1', 'tilt', 0, 10)\n          </pre>\n        </div>\n        <div class=\"demo\">\n          <div class=\"rythm tilt2\">♫</div>\n          <pre class=\"prettyprint\">\n            rythm.addRythm('tilt2', 'tilt', 0, 10, {\n              reverse : true\n            })\n          </pre>\n        </div>\n      </section>\n      <section>\n        <h3>\n          Font-color\n        </h3>\n        <div class=\"demo\">\n          <div class=\"rythm font fontColor1\">\n            <div class=\"font__placeholder\"></div>Font-color !\n          </div>\n          <pre class=\"prettyprint\">\n            rythm.addRythm('fontColor1', 'color', 0, 10)\n          </pre>\n        </div>\n        <div class=\"demo\">\n          <div class=\"rythm font fontColor2\">\n            <div class=\"font__placeholder\"></div>Font-color !\n          </div>\n          <pre class=\"prettyprint\">\n            rythm.addRythm('fontColor2', 'color', 0, 10, {\n              from: [0,0,255],\n              to:[255,0,255]\n            })\n          </pre>\n        </div>\n      </section>\n      <h1>\n        Added in v2.2.4\n      </h1>\n      <section>\n        <h3>\n          Font-size\n        </h3>\n        <div class=\"demo\">\n          <div class=\"rythm font fontSize1\">\n            <div class=\"font__placeholder\"></div>Font-dance !\n          </div>\n          <pre class=\"prettyprint\">\n            rythm.addRythm('fontSize1', 'fontSize', 0, 2)\n          </pre>\n        </div>\n        <div class=\"demo\">\n          <div class=\"rythm font fontSize2\">\n\t          <div class=\"font__placeholder\"></div>Font-dance !\n          </div>\n          <pre class=\"prettyprint\">\n            rythm.addRythm('fontSize', 'fontSize', 0, 2, {\n              min: 0.5,\n              max: 2\n            })\n          </pre>\n        </div>\n      </section>\n      <h1>\n        Added in v2.2.3\n      </h1>\n      <section>\n        <h3>\n          Border-Width\n        </h3>\n        <div class=\"demo\">\n          <div class=\"rythm\">\n            <div class=\"borderWidth1\"></div>\n          </div>\n          <pre class=\"prettyprint\">\n                  rythm.addRythm('borderWidth1', 'borderWidth', 0, 2)\n                </pre>\n        </div>\n        <div class=\"demo\">\n          <div class=\"rythm\">\n            <div class=\"borderWidth2\"></div>\n          </div>\n          <pre class=\"prettyprint\">\n            rythm.addRythm('borderWidth2', 'borderWidth', 0, 2, {\n              min: 2,\n              max: 10\n            })\n          </pre>\n        </div>\n      </section>\n      <h1>\n        Added in v2.2.2\n      </h1>\n      <section>\n        <h3>\n          Neon\n        </h3>\n        <div class=\"demo\">\n          <div class=\"rythm neon1\"></div>\n          <pre class=\"prettyprint\">\n            rythm.addRythm('neon1', 'neon', 0, 10)\n          </pre>\n        </div>\n        <div class=\"demo\">\n          <div class=\"rythm neon2\"></div>\n          <pre class=\"prettyprint\">\n            rythm.addRythm('neon2', 'neon', 0, 10, {\n              from: [0,0,255],\n              to:[255,0,255]\n            })\n          </pre>\n        </div>\n        <div class=\"demo\">\n          <div class=\"rythm neon3\"></div>\n          <pre class=\"prettyprint\">\n            rythm.addRythm('neon3', 'neon', 0, 10, {\n              from: [255,255,0],\n              to:[255,0,0]\n            })</pre>\n        </div>\n      </section>\n      <section>\n        <h3>\n          Border-Color\n        </h3>\n        <div class=\"demo\">\n          <div class=\"rythm borderColor1\"></div>\n          <pre class=\"prettyprint\">\n            rythm.addRythm('borderColor1', 'borderColor', 0, 10)\n          </pre>\n        </div>\n        <div class=\"demo\">\n          <div class=\"rythm borderColor2\"></div>\n          <pre class=\"prettyprint\">\n            rythm.addRythm('borderColor2', 'borderColor', 0, 10, {\n              from: [0,0,255],\n              to:[255,0,255]\n            })\n          </pre>\n        </div>\n        <div class=\"demo\">\n          <div class=\"rythm borderColor3\"></div>\n          <pre class=\"prettyprint\">\n            rythm.addRythm('borderColor3', 'color', 0, 10, {\n              from: [255,255,0],\n              to:[255,0,0]\n            })\n          </pre>\n        </div>\n      </section>\n      <section>\n        <h3>\n          Kern\n        </h3>\n        <div class=\"demo\">\n          <div class=\"rythm font kern1\">𐇑🕪 rythm.js</div>\n          <pre class=\"prettyprint\">\n            rythm.addRythm('kern1', 'kern', 0, 10 , {\n              min: -5,\n              max: 5\n            })\n          </pre>\n        </div>\n        <div class=\"demo\">\n          <div class=\"rythm font kern2\">𐇑🕪 rythm.js</div>\n          <pre class=\"prettyprint\">\n            rythm.addRythm('kern2', 'kern', 0, 10 , {\n              min: -5,\n              max: 5,\n              reverse: true,\n            })\n          </pre>\n        </div>\n      </section>\n      <h1>\n        Added in v2.2.1\n      </h1>\n      <section>\n        <h3>\n          Blur\n        </h3>\n        <div class=\"demo\">\n          <div class=\"rythm blur1\">♫</div>\n          <pre class=\"prettyprint\">\n            rythm.addRythm('blur1', 'blur', 0, 10)\n          </pre>\n        </div>\n        <div class=\"demo\">\n          <div class=\"rythm blur2\">♫</div>\n          <pre class=\"prettyprint\">\n            rythm.addRythm('blur2', 'blur', 0, 10, {\n              reverse: true\n            })\n          </pre>\n        </div>\n        <div class=\"demo\">\n          <div class=\"rythm blur3\">♫</div>\n          <pre class=\"prettyprint\">\n            rythm.addRythm('blur3', 'blur', 0, 10, {\n              max: 16\n            })</pre>\n        </div>\n      </section>\n      <section>\n        <h3>\n          Swing\n        </h3>\n        <div class=\"demo\">\n          <div class=\"rythm swing1\">♫</div>\n          <pre class=\"prettyprint\">\n            rythm.addRythm('swing1', 'swing', 0, 10)\n          </pre>\n        </div>\n        <div class=\"demo\">\n          <div class=\"rythm swing2\">♫</div>\n          <pre class=\"prettyprint\">\n            rythm.addRythm('swing2', 'swing', 0, 10, {\n              curve: 'up',\n            })\n          </pre>\n        </div>\n        <div class=\"demo\">\n          <div class=\"rythm swing3\">♫</div>\n          <pre class=\"prettyprint\">\n            rythm.addRythm('swing3', 'swing', 0, 10, {\n              direction: 'left',\n            })\n          </pre>\n        </div>\n        <div class=\"demo\">\n          <div class=\"rythm swing4\">♫</div>\n          <pre class=\"prettyprint\">\n            rythm.addRythm('swing4', 'swing', 0, 10, {\n              radius: 10,\n            })\n          </pre>\n        </div>\n      </section>\n      <h1>\n        Added in v2.2.0\n      </h1>\n      <section>\n        <h3>Border-Radius</h3>\n        <div class=\"demo\">\n          <div class=\"rythm radius1\"></div>\n          <pre class=\"prettyprint\">\n            rythm.addRythm('radius1', 'radius', 0, 10, {\n              min: 0,\n              max: 30\n            })\n          </pre>\n        </div>\n        <div class=\"demo\">\n          <div class=\"rythm radius2\"></div>\n          <pre class=\"prettyprint\">\n            rythm.addRythm('radius1', 'radius', 0, 10, {\n              reverse: true,\n              min: 0,\n              max: 30\n            })\n          </pre>\n        </div>\n      </section>\n      <h1>\n        Added in v2.0.0\n      </h1>\n      <section>\n        <h3>\n          Pulse\n        </h3>\n        <div class=\"demo\">\n          <div class=\"rythm pulse1\">♫</div>\n          <pre class=\"prettyprint\">\n            rythm.addRythm('pulse1', 'pulse', 0, 10)\n          </pre>\n        </div>\n        <div class=\"demo\">\n          <div class=\"rythm pulse2\">♫</div>\n          <pre class=\"prettyprint\">\n            rythm.addRythm('pulse2', 'pulse', 0, 10, {\n              min: 0.1,\n              max: 1\n            })\n          </pre>\n        </div>\n        <div class=\"demo\">\n          <div class=\"rythm pulse3\">♫</div>\n          <pre class=\"prettyprint\">\n            rythm.addRythm('pulse3', 'pulse', 0, 10, {\n              min: 1,\n              max: 1.75\n            })\n          </pre>\n        </div>\n      </section>\n      <section>\n        <h3>\n          Jump\n        </h3>\n        <div class=\"demo\">\n          <div class=\"rythm jump1\">♫</div>\n          <pre class=\"prettyprint\">\n            rythm.addRythm('jump1', 'jump', 0, 10)\n          </pre>\n        </div>\n        <div class=\"demo\">\n          <div class=\"rythm jump2\">♫</div>\n          <pre class=\"prettyprint\">\n            rythm.addRythm('jump2', 'jump', 150, 40, {\n              min: -20,\n              max: 20\n            })\n          </pre>\n        </div>\n      </section>\n      <section>\n        <h3>\n          Shake\n        </h3>\n        <div class=\"demo\">\n          <div class=\"rythm shake1\">♫</div>\n          <pre class=\"prettyprint\">\n            rythm.addRythm('shake1', 'shake', 0, 10)\n          </pre>\n        </div>\n        <div class=\"demo\">\n          <div class=\"rythm shake2\">♫</div>\n          <pre class=\"prettyprint\">\n            rythm.addRythm('shake2', 'shake', 150, 40, {\n              min: 0,\n              max: 20\n            })\n          </pre>\n        </div>\n        <div class=\"demo\">\n          <div class=\"rythm shake3\">♫</div>\n          <pre class=\"prettyprint\">\n            rythm.addRythm('shake3', 'shake', 0, 10, {\n              direction: 'left'\n            })\n          </pre>\n        </div>\n      </section>\n      <section>\n        <h3>\n          Twist\n        </h3>\n        <div class=\"demo\">\n          <div class=\"rythm twist1\">♫</div>\n          <pre class=\"prettyprint\">\n            rythm.addRythm('twist1', 'twist', 0, 10)\n          </pre>\n        </div>\n        <div class=\"demo\">\n          <div class=\"rythm twist2\">♫</div>\n          <pre class=\"prettyprint\">\n            rythm.addRythm('twist2', 'twist', 0, 10, {\n              min: 20,\n              max: 180\n            })\n          </pre>\n        </div>\n        <div class=\"demo\">\n          <div class=\"rythm twist3\">♫</div>\n          <pre class=\"prettyprint\">\n            rythm.addRythm('twist3', 'twist', 0, 10, {\n              direction: 'left'\n            })\n          </pre>\n        </div>\n      </section>\n      <section>\n        <h3>\n          Vanish\n        </h3>\n        <div class=\"demo\">\n          <div class=\"rythm vanish vanish1\">♫</div>\n          <pre class=\"prettyprint\">\n            rythm.addRythm('vanish1', 'vanish', 0, 10)\n          </pre>\n        </div>\n        <div class=\"demo\">\n          <div class=\"rythm vanish vanish2\">♫</div>\n          <pre class=\"prettyprint\">\n            rythm.addRythm('vanish2', 'vanish', 0, 10, {\n              reverse: true\n            })\n          </pre>\n        </div>\n      </section>\n      <section>\n        <h3>\n          Background-Color\n        </h3>\n        <div class=\"demo\">\n          <div class=\"rythm color1\"></div>\n          <pre class=\"prettyprint\">\n            rythm.addRythm('color1', 'color', 0, 10)\n          </pre>\n        </div>\n        <div class=\"demo\">\n          <div class=\"rythm color2\"></div>\n          <pre class=\"prettyprint\">\n            rythm.addRythm('color2', 'color', 0, 10, {\n              from: [0,0,255],\n              to:[255,0,255]\n            })\n          </pre>\n        </div>\n        <div class=\"demo\">\n          <div class=\"rythm color3\"></div>\n          <pre class=\"prettyprint\">\n            rythm.addRythm('color3', 'color', 0, 10, {\n              from: [255,255,0],\n              to:[255,0,0]\n            })</pre>\n        </div>\n      </section>\n      <div id='playerBottom'>\n          <button id='startBottom'>Start Demo</button>\n          <button id='stopBottom'>Stop Demo</button>\n          <button id='micBottom'>Use Microphone</button>\n        </div>\n      <div>\n      <div id=\"shout\" class=\"shout\">\n      </div>\n    </div>\n\t\t<script type=\"text/javascript\" src=\"https://cdn.jsdelivr.net/npm/scrollingelement@1.5.2/scrollingelement.min.js\"></script>\n    <script src=\"https://cdn.rawgit.com/google/code-prettify/master/loader/run_prettify.js\"></script>\n    <script type=\"text/javascript\">\n      const quotes = [\n        { text: \"I hope you're collecting what people song into the microphone. My wife just laid down a pretty sweet riff.\", author: \"jk3us\" },\n        { text: \"I think there's a bug, it also makes me dance.\", author: \"moogeekfull-stack\" },\n        { text: \"Where was this when I was making Geocities pages!?\", author: \"shabibbles\" },\n        { text: \"It's fun for a demo. But if I ever find it used on a web page I visit, I shall track the owner down and place them in isolation for life.\", author: \"crispinb\" },\n        { text: \"Jesus christ it's 1994 again\", author: \"WeaponizedMath\" },\n        { text: \"I don't know what it is but I like it!!!\", author: \"blairanderson\" },\n        { text: \"Turned on microphone, started finger drumming on laptop. This was more fun than I expected it to be.\", author: \"harel\" },\n        { text: \"This will be everywhere on April Fools 2018.\", author: \"prawn\" },\n        { text: \"Why.js\", author: \"Robby517\" },\n        { text: \"Blink tag 2: godzilla strikes back\", author: \"@erez\" },\n        { text: \"<Marque> tag back with vengeance\", author: \"@udayms\" },\n        { text: \"I. need. this. On. all. my. websites.\", author: \"@Lordmau5\" },\n        { text: \"With great power comes great responsibility. Or just obnoxious fun.\", author: \"@TheMeteorChef\" },\n        { text: \"I both recognize the obnoxiousness of this AND want to use it everywhere\", author: \"@ekmpls\" },\n        { text: \"lolwat.js\", author: \"@psychronautron\" },\n        { text: \"At this point, we're coming full circle back to my 1997 AngelFire site on Ultima Online... I'm OK with it.\", author: \"@ryanpoe85\" },\n        { text: \"<blink> tag on steroids!\", author: \"@master_mitch\" },\n        { text: \"This is why I love internet\", author: \"@builtbymiken\" },\n        { text: \"Played around with[...]. accidentally created a nightmare\", author: \"@becckitt\" },\n      ]\n      const quote = quotes[Math.floor(Math.random() * quotes.length)]\n      document.getElementById('quote-author').innerText = quote.author\n      document.getElementById('quote-text').innerText = quote.text\n    </script>\n\t\t<script type=\"text/javascript\" src=\"./rythm.js\"></script>\n    <script type=\"text/javascript\" src=\"./demo/example.js\"></script>\n  </body>\n</html>\n"
        },
        {
          "name": "package-lock.json",
          "type": "blob",
          "size": 213.234375,
          "content": "{\n  \"name\": \"rythm.js\",\n  \"version\": \"2.2.6\",\n  \"lockfileVersion\": 3,\n  \"requires\": true,\n  \"packages\": {\n    \"\": {\n      \"name\": \"rythm.js\",\n      \"version\": \"2.2.6\",\n      \"license\": \"GPL-3.0\",\n      \"dependencies\": {\n        \"watch-http-server\": \"^0.7.6\"\n      },\n      \"devDependencies\": {\n        \"babel-eslint\": \"^7.1.1\",\n        \"babel-plugin-external-helpers\": \"^6.22.0\",\n        \"babel-plugin-transform-class-properties\": \"^6.23.0\",\n        \"babel-preset-es2015\": \"^6.22.0\",\n        \"babel-register\": \"^6.23.0\",\n        \"babelrc-rollup\": \"^3.0.0\",\n        \"command-line-args\": \"^4.0.7\",\n        \"concurrently\": \"^3.3.0\",\n        \"eslint\": \"^3.15.0\",\n        \"gulp\": \"^3.9.1\",\n        \"gulp-webserver\": \"^0.9.1\",\n        \"husky\": \"^0.14.3\",\n        \"lint-staged\": \"^4.3.0\",\n        \"prettier\": \"^1.7.4\",\n        \"rollup\": \"^0.41.4\",\n        \"rollup-plugin-babel\": \"^2.7.1\",\n        \"rollup-plugin-uglify\": \"^2.0.1\",\n        \"rollup-watch\": \"^3.2.2\",\n        \"uglify-es\": \"^3.0.28\"\n      }\n    },\n    \"node_modules/accepts\": {\n      \"version\": \"1.3.4\",\n      \"resolved\": \"https://registry.npmjs.org/accepts/-/accepts-1.3.4.tgz\",\n      \"integrity\": \"sha1-hiRnWMfdbSGmR0/whKR0DsBesh8=\",\n      \"dev\": true,\n      \"dependencies\": {\n        \"mime-types\": \"~2.1.16\",\n        \"negotiator\": \"0.6.1\"\n      },\n      \"engines\": {\n        \"node\": \">= 0.6\"\n      }\n    },\n    \"node_modules/acorn\": {\n      \"version\": \"5.1.2\",\n      \"resolved\": \"https://registry.npmjs.org/acorn/-/acorn-5.1.2.tgz\",\n      \"integrity\": \"sha512-o96FZLJBPY1lvTuJylGA9Bk3t/GKPPJG8H0ydQQl01crzwJgspa4AEIq/pVTXigmK0PHVQhiAtn8WMBLL9D2WA==\",\n      \"dev\": true,\n      \"bin\": {\n        \"acorn\": \"bin/acorn\"\n      },\n      \"engines\": {\n        \"node\": \">=0.4.0\"\n      }\n    },\n    \"node_modules/acorn-jsx\": {\n      \"version\": \"3.0.1\",\n      \"resolved\": \"https://registry.npmjs.org/acorn-jsx/-/acorn-jsx-3.0.1.tgz\",\n      \"integrity\": \"sha1-r9+UiPsezvyDSPb7IvRk4ypYs2s=\",\n      \"dev\": true,\n      \"dependencies\": {\n        \"acorn\": \"^3.0.4\"\n      }\n    },\n    \"node_modules/acorn-jsx/node_modules/acorn\": {\n      \"version\": \"3.3.0\",\n      \"resolved\": \"https://registry.npmjs.org/acorn/-/acorn-3.3.0.tgz\",\n      \"integrity\": \"sha1-ReN/s56No/JbruP/U2niu18iAXo=\",\n      \"dev\": true,\n      \"bin\": {\n        \"acorn\": \"bin/acorn\"\n      },\n      \"engines\": {\n        \"node\": \">=0.4.0\"\n      }\n    },\n    \"node_modules/ajv\": {\n      \"version\": \"4.11.8\",\n      \"resolved\": \"https://registry.npmjs.org/ajv/-/ajv-4.11.8.tgz\",\n      \"integrity\": \"sha1-gv+wKynmYq5TvcIK8VlHcGc5xTY=\",\n      \"dev\": true,\n      \"dependencies\": {\n        \"co\": \"^4.6.0\",\n        \"json-stable-stringify\": \"^1.0.1\"\n      }\n    },\n    \"node_modules/ajv-keywords\": {\n      \"version\": \"1.5.1\",\n      \"resolved\": \"https://registry.npmjs.org/ajv-keywords/-/ajv-keywords-1.5.1.tgz\",\n      \"integrity\": \"sha1-MU3QpLM2j609/NxU7eYXG4htrzw=\",\n      \"dev\": true,\n      \"peerDependencies\": {\n        \"ajv\": \">=4.10.0\"\n      }\n    },\n    \"node_modules/ansi-escapes\": {\n      \"version\": \"1.4.0\",\n      \"resolved\": \"https://registry.npmjs.org/ansi-escapes/-/ansi-escapes-1.4.0.tgz\",\n      \"integrity\": \"sha1-06ioOzGapneTZisT52HHkRQiMG4=\",\n      \"dev\": true,\n      \"engines\": {\n        \"node\": \">=0.10.0\"\n      }\n    },\n    \"node_modules/ansi-regex\": {\n      \"version\": \"2.1.1\",\n      \"resolved\": \"https://registry.npmjs.org/ansi-regex/-/ansi-regex-2.1.1.tgz\",\n      \"integrity\": \"sha1-w7M6te42DYbg5ijwRorn7yfWVN8=\",\n      \"dev\": true,\n      \"engines\": {\n        \"node\": \">=0.10.0\"\n      }\n    },\n    \"node_modules/ansi-styles\": {\n      \"version\": \"2.2.1\",\n      \"resolved\": \"https://registry.npmjs.org/ansi-styles/-/ansi-styles-2.2.1.tgz\",\n      \"integrity\": \"sha1-tDLdM1i2NM914eRmQ2gkBTPB3b4=\",\n      \"dev\": true,\n      \"engines\": {\n        \"node\": \">=0.10.0\"\n      }\n    },\n    \"node_modules/app-root-path\": {\n      \"version\": \"2.0.1\",\n      \"resolved\": \"https://registry.npmjs.org/app-root-path/-/app-root-path-2.0.1.tgz\",\n      \"integrity\": \"sha1-zWLc+OT9WkF+/GZNLlsQZTxlG0Y=\",\n      \"dev\": true,\n      \"engines\": {\n        \"node\": \">= 4.0.0\"\n      }\n    },\n    \"node_modules/archy\": {\n      \"version\": \"1.0.0\",\n      \"resolved\": \"https://registry.npmjs.org/archy/-/archy-1.0.0.tgz\",\n      \"integrity\": \"sha1-+cjBN1fMHde8N5rHeyxipcKGjEA=\",\n      \"dev\": true\n    },\n    \"node_modules/argparse\": {\n      \"version\": \"1.0.9\",\n      \"resolved\": \"https://registry.npmjs.org/argparse/-/argparse-1.0.9.tgz\",\n      \"integrity\": \"sha1-c9g7wmP4bpf4zE9rrhsOkKfSLIY=\",\n      \"dev\": true,\n      \"dependencies\": {\n        \"sprintf-js\": \"~1.0.2\"\n      }\n    },\n    \"node_modules/arr-diff\": {\n      \"version\": \"2.0.0\",\n      \"resolved\": \"https://registry.npmjs.org/arr-diff/-/arr-diff-2.0.0.tgz\",\n      \"integrity\": \"sha1-jzuCf5Vai9ZpaX5KQlasPOrjVs8=\",\n      \"dev\": true,\n      \"dependencies\": {\n        \"arr-flatten\": \"^1.0.1\"\n      },\n      \"engines\": {\n        \"node\": \">=0.10.0\"\n      }\n    },\n    \"node_modules/arr-flatten\": {\n      \"version\": \"1.1.0\",\n      \"resolved\": \"https://registry.npmjs.org/arr-flatten/-/arr-flatten-1.1.0.tgz\",\n      \"integrity\": \"sha512-L3hKV5R/p5o81R7O02IGnwpDmkp6E982XhtbuwSe3O4qOtMMMtodicASA1Cny2U+aCXcNpml+m4dPsvsJ3jatg==\",\n      \"dev\": true,\n      \"engines\": {\n        \"node\": \">=0.10.0\"\n      }\n    },\n    \"node_modules/array-back\": {\n      \"version\": \"2.0.0\",\n      \"resolved\": \"https://registry.npmjs.org/array-back/-/array-back-2.0.0.tgz\",\n      \"integrity\": \"sha512-eJv4pLLufP3g5kcZry0j6WXpIbzYw9GUB4mVJZno9wfwiBxbizTnHCw3VJb07cBihbFX48Y7oSrW9y+gt4glyw==\",\n      \"dev\": true,\n      \"dependencies\": {\n        \"typical\": \"^2.6.1\"\n      },\n      \"engines\": {\n        \"node\": \">=4\"\n      }\n    },\n    \"node_modules/array-differ\": {\n      \"version\": \"1.0.0\",\n      \"resolved\": \"https://registry.npmjs.org/array-differ/-/array-differ-1.0.0.tgz\",\n      \"integrity\": \"sha1-7/UuN1gknTO+QCuLuOVkuytdQDE=\",\n      \"dev\": true,\n      \"engines\": {\n        \"node\": \">=0.10.0\"\n      }\n    },\n    \"node_modules/array-each\": {\n      \"version\": \"1.0.1\",\n      \"resolved\": \"https://registry.npmjs.org/array-each/-/array-each-1.0.1.tgz\",\n      \"integrity\": \"sha1-p5SvDAWrF1KEbudTofIRoFugxE8=\",\n      \"dev\": true,\n      \"engines\": {\n        \"node\": \">=0.10.0\"\n      }\n    },\n    \"node_modules/array-find-index\": {\n      \"version\": \"1.0.2\",\n      \"resolved\": \"https://registry.npmjs.org/array-find-index/-/array-find-index-1.0.2.tgz\",\n      \"integrity\": \"sha1-3wEKoSh+Fku9pvlyOwqWoexBh6E=\",\n      \"dev\": true,\n      \"engines\": {\n        \"node\": \">=0.10.0\"\n      }\n    },\n    \"node_modules/array-slice\": {\n      \"version\": \"1.0.0\",\n      \"resolved\": \"https://registry.npmjs.org/array-slice/-/array-slice-1.0.0.tgz\",\n      \"integrity\": \"sha1-5zA08A3MH0CHYAj9IP6ud71LfC8=\",\n      \"dev\": true,\n      \"engines\": {\n        \"node\": \">=0.10.0\"\n      }\n    },\n    \"node_modules/array-union\": {\n      \"version\": \"1.0.2\",\n      \"resolved\": \"https://registry.npmjs.org/array-union/-/array-union-1.0.2.tgz\",\n      \"integrity\": \"sha1-mjRBDk9OPaI96jdb5b5w8kd47Dk=\",\n      \"dev\": true,\n      \"dependencies\": {\n        \"array-uniq\": \"^1.0.1\"\n      },\n      \"engines\": {\n        \"node\": \">=0.10.0\"\n      }\n    },\n    \"node_modules/array-uniq\": {\n      \"version\": \"1.0.3\",\n      \"resolved\": \"https://registry.npmjs.org/array-uniq/-/array-uniq-1.0.3.tgz\",\n      \"integrity\": \"sha1-r2rId6Jcx/dOBYiUdThY39sk/bY=\",\n      \"dev\": true,\n      \"engines\": {\n        \"node\": \">=0.10.0\"\n      }\n    },\n    \"node_modules/array-unique\": {\n      \"version\": \"0.2.1\",\n      \"resolved\": \"https://registry.npmjs.org/array-unique/-/array-unique-0.2.1.tgz\",\n      \"integrity\": \"sha1-odl8yvy8JiXMcPrc6zalDFiwGlM=\",\n      \"dev\": true,\n      \"engines\": {\n        \"node\": \">=0.10.0\"\n      }\n    },\n    \"node_modules/arrify\": {\n      \"version\": \"1.0.1\",\n      \"resolved\": \"https://registry.npmjs.org/arrify/-/arrify-1.0.1.tgz\",\n      \"integrity\": \"sha1-iYUI2iIm84DfkEcoRWhJwVAaSw0=\",\n      \"dev\": true,\n      \"engines\": {\n        \"node\": \">=0.10.0\"\n      }\n    },\n    \"node_modules/async-each\": {\n      \"version\": \"0.1.6\",\n      \"resolved\": \"https://registry.npmjs.org/async-each/-/async-each-0.1.6.tgz\",\n      \"integrity\": \"sha512-+AOhqLFrKKsf3E6oWhYzSX/YPEZztxHi6W3TU6LoQFuZjzSt5tqITd0ZJh2Qy3vsWoFj6HTIEBRKqPiS70HzjQ==\"\n    },\n    \"node_modules/babel-code-frame\": {\n      \"version\": \"6.26.0\",\n      \"resolved\": \"https://registry.npmjs.org/babel-code-frame/-/babel-code-frame-6.26.0.tgz\",\n      \"integrity\": \"sha1-Y/1D99weO7fONZR9uP42mj9Yx0s=\",\n      \"dev\": true,\n      \"dependencies\": {\n        \"chalk\": \"^1.1.3\",\n        \"esutils\": \"^2.0.2\",\n        \"js-tokens\": \"^3.0.2\"\n      }\n    },\n    \"node_modules/babel-core\": {\n      \"version\": \"6.26.0\",\n      \"resolved\": \"https://registry.npmjs.org/babel-core/-/babel-core-6.26.0.tgz\",\n      \"integrity\": \"sha1-rzL3izGm/O8RnIew/Y2XU/A6C7g=\",\n      \"dev\": true,\n      \"dependencies\": {\n        \"babel-code-frame\": \"^6.26.0\",\n        \"babel-generator\": \"^6.26.0\",\n        \"babel-helpers\": \"^6.24.1\",\n        \"babel-messages\": \"^6.23.0\",\n        \"babel-register\": \"^6.26.0\",\n        \"babel-runtime\": \"^6.26.0\",\n        \"babel-template\": \"^6.26.0\",\n        \"babel-traverse\": \"^6.26.0\",\n        \"babel-types\": \"^6.26.0\",\n        \"babylon\": \"^6.18.0\",\n        \"convert-source-map\": \"^1.5.0\",\n        \"debug\": \"^2.6.8\",\n        \"json5\": \"^0.5.1\",\n        \"lodash\": \"^4.17.4\",\n        \"minimatch\": \"^3.0.4\",\n        \"path-is-absolute\": \"^1.0.1\",\n        \"private\": \"^0.1.7\",\n        \"slash\": \"^1.0.0\",\n        \"source-map\": \"^0.5.6\"\n      }\n    },\n    \"node_modules/babel-eslint\": {\n      \"version\": \"7.2.3\",\n      \"resolved\": \"https://registry.npmjs.org/babel-eslint/-/babel-eslint-7.2.3.tgz\",\n      \"integrity\": \"sha1-sv4tgBJkcPXBlELcdXJTqJdxCCc=\",\n      \"deprecated\": \"babel-eslint is now @babel/eslint-parser. This package will no longer receive updates.\",\n      \"dev\": true,\n      \"dependencies\": {\n        \"babel-code-frame\": \"^6.22.0\",\n        \"babel-traverse\": \"^6.23.1\",\n        \"babel-types\": \"^6.23.0\",\n        \"babylon\": \"^6.17.0\"\n      },\n      \"engines\": {\n        \"node\": \">=4\"\n      }\n    },\n    \"node_modules/babel-generator\": {\n      \"version\": \"6.26.0\",\n      \"resolved\": \"https://registry.npmjs.org/babel-generator/-/babel-generator-6.26.0.tgz\",\n      \"integrity\": \"sha1-rBriAHC3n248odMmlhMFN3TyDcU=\",\n      \"dev\": true,\n      \"dependencies\": {\n        \"babel-messages\": \"^6.23.0\",\n        \"babel-runtime\": \"^6.26.0\",\n        \"babel-types\": \"^6.26.0\",\n        \"detect-indent\": \"^4.0.0\",\n        \"jsesc\": \"^1.3.0\",\n        \"lodash\": \"^4.17.4\",\n        \"source-map\": \"^0.5.6\",\n        \"trim-right\": \"^1.0.1\"\n      }\n    },\n    \"node_modules/babel-generator/node_modules/jsesc\": {\n      \"version\": \"1.3.0\",\n      \"resolved\": \"https://registry.npmjs.org/jsesc/-/jsesc-1.3.0.tgz\",\n      \"integrity\": \"sha1-RsP+yMGJKxKwgz25vHYiF226s0s=\",\n      \"dev\": true,\n      \"bin\": {\n        \"jsesc\": \"bin/jsesc\"\n      }\n    },\n    \"node_modules/babel-helper-call-delegate\": {\n      \"version\": \"6.24.1\",\n      \"resolved\": \"https://registry.npmjs.org/babel-helper-call-delegate/-/babel-helper-call-delegate-6.24.1.tgz\",\n      \"integrity\": \"sha1-7Oaqzdx25Bw0YfiL/Fdb0Nqi340=\",\n      \"dev\": true,\n      \"dependencies\": {\n        \"babel-helper-hoist-variables\": \"^6.24.1\",\n        \"babel-runtime\": \"^6.22.0\",\n        \"babel-traverse\": \"^6.24.1\",\n        \"babel-types\": \"^6.24.1\"\n      }\n    },\n    \"node_modules/babel-helper-define-map\": {\n      \"version\": \"6.26.0\",\n      \"resolved\": \"https://registry.npmjs.org/babel-helper-define-map/-/babel-helper-define-map-6.26.0.tgz\",\n      \"integrity\": \"sha1-pfVtq0GiX5fstJjH66ypgZ+Vvl8=\",\n      \"dev\": true,\n      \"dependencies\": {\n        \"babel-helper-function-name\": \"^6.24.1\",\n        \"babel-runtime\": \"^6.26.0\",\n        \"babel-types\": \"^6.26.0\",\n        \"lodash\": \"^4.17.4\"\n      }\n    },\n    \"node_modules/babel-helper-function-name\": {\n      \"version\": \"6.24.1\",\n      \"resolved\": \"https://registry.npmjs.org/babel-helper-function-name/-/babel-helper-function-name-6.24.1.tgz\",\n      \"integrity\": \"sha1-00dbjAPtmCQqJbSDUasYOZ01gKk=\",\n      \"dev\": true,\n      \"dependencies\": {\n        \"babel-helper-get-function-arity\": \"^6.24.1\",\n        \"babel-runtime\": \"^6.22.0\",\n        \"babel-template\": \"^6.24.1\",\n        \"babel-traverse\": \"^6.24.1\",\n        \"babel-types\": \"^6.24.1\"\n      }\n    },\n    \"node_modules/babel-helper-get-function-arity\": {\n      \"version\": \"6.24.1\",\n      \"resolved\": \"https://registry.npmjs.org/babel-helper-get-function-arity/-/babel-helper-get-function-arity-6.24.1.tgz\",\n      \"integrity\": \"sha1-j3eCqpNAfEHTqlCQj4mwMbG2hT0=\",\n      \"dev\": true,\n      \"dependencies\": {\n        \"babel-runtime\": \"^6.22.0\",\n        \"babel-types\": \"^6.24.1\"\n      }\n    },\n    \"node_modules/babel-helper-hoist-variables\": {\n      \"version\": \"6.24.1\",\n      \"resolved\": \"https://registry.npmjs.org/babel-helper-hoist-variables/-/babel-helper-hoist-variables-6.24.1.tgz\",\n      \"integrity\": \"sha1-HssnaJydJVE+rbyZFKc/VAi+enY=\",\n      \"dev\": true,\n      \"dependencies\": {\n        \"babel-runtime\": \"^6.22.0\",\n        \"babel-types\": \"^6.24.1\"\n      }\n    },\n    \"node_modules/babel-helper-optimise-call-expression\": {\n      \"version\": \"6.24.1\",\n      \"resolved\": \"https://registry.npmjs.org/babel-helper-optimise-call-expression/-/babel-helper-optimise-call-expression-6.24.1.tgz\",\n      \"integrity\": \"sha1-96E0J7qfc/j0+pk8VKl4gtEkQlc=\",\n      \"dev\": true,\n      \"dependencies\": {\n        \"babel-runtime\": \"^6.22.0\",\n        \"babel-types\": \"^6.24.1\"\n      }\n    },\n    \"node_modules/babel-helper-regex\": {\n      \"version\": \"6.26.0\",\n      \"resolved\": \"https://registry.npmjs.org/babel-helper-regex/-/babel-helper-regex-6.26.0.tgz\",\n      \"integrity\": \"sha1-MlxZ+QL4LyS3T6zu0DY5VPZJXnI=\",\n      \"dev\": true,\n      \"dependencies\": {\n        \"babel-runtime\": \"^6.26.0\",\n        \"babel-types\": \"^6.26.0\",\n        \"lodash\": \"^4.17.4\"\n      }\n    },\n    \"node_modules/babel-helper-replace-supers\": {\n      \"version\": \"6.24.1\",\n      \"resolved\": \"https://registry.npmjs.org/babel-helper-replace-supers/-/babel-helper-replace-supers-6.24.1.tgz\",\n      \"integrity\": \"sha1-v22/5Dk40XNpohPKiov3S2qQqxo=\",\n      \"dev\": true,\n      \"dependencies\": {\n        \"babel-helper-optimise-call-expression\": \"^6.24.1\",\n        \"babel-messages\": \"^6.23.0\",\n        \"babel-runtime\": \"^6.22.0\",\n        \"babel-template\": \"^6.24.1\",\n        \"babel-traverse\": \"^6.24.1\",\n        \"babel-types\": \"^6.24.1\"\n      }\n    },\n    \"node_modules/babel-helpers\": {\n      \"version\": \"6.24.1\",\n      \"resolved\": \"https://registry.npmjs.org/babel-helpers/-/babel-helpers-6.24.1.tgz\",\n      \"integrity\": \"sha1-NHHenK7DiOXIUOWX5Yom3fN2ArI=\",\n      \"dev\": true,\n      \"dependencies\": {\n        \"babel-runtime\": \"^6.22.0\",\n        \"babel-template\": \"^6.24.1\"\n      }\n    },\n    \"node_modules/babel-messages\": {\n      \"version\": \"6.23.0\",\n      \"resolved\": \"https://registry.npmjs.org/babel-messages/-/babel-messages-6.23.0.tgz\",\n      \"integrity\": \"sha1-8830cDhYA1sqKVHG7F7fbGLyYw4=\",\n      \"dev\": true,\n      \"dependencies\": {\n        \"babel-runtime\": \"^6.22.0\"\n      }\n    },\n    \"node_modules/babel-plugin-check-es2015-constants\": {\n      \"version\": \"6.22.0\",\n      \"resolved\": \"https://registry.npmjs.org/babel-plugin-check-es2015-constants/-/babel-plugin-check-es2015-constants-6.22.0.tgz\",\n      \"integrity\": \"sha1-NRV7EBQm/S/9PaP3XH0ekYNbv4o=\",\n      \"dev\": true,\n      \"dependencies\": {\n        \"babel-runtime\": \"^6.22.0\"\n      }\n    },\n    \"node_modules/babel-plugin-external-helpers\": {\n      \"version\": \"6.22.0\",\n      \"resolved\": \"https://registry.npmjs.org/babel-plugin-external-helpers/-/babel-plugin-external-helpers-6.22.0.tgz\",\n      \"integrity\": \"sha1-IoX0iwK9Xe3oUXXK+MYuhq3M76E=\",\n      \"dev\": true,\n      \"dependencies\": {\n        \"babel-runtime\": \"^6.22.0\"\n      }\n    },\n    \"node_modules/babel-plugin-syntax-class-properties\": {\n      \"version\": \"6.13.0\",\n      \"resolved\": \"https://registry.npmjs.org/babel-plugin-syntax-class-properties/-/babel-plugin-syntax-class-properties-6.13.0.tgz\",\n      \"integrity\": \"sha1-1+sjt5oxf4VDlixQW4J8fWysJ94=\",\n      \"dev\": true\n    },\n    \"node_modules/babel-plugin-transform-class-properties\": {\n      \"version\": \"6.24.1\",\n      \"resolved\": \"https://registry.npmjs.org/babel-plugin-transform-class-properties/-/babel-plugin-transform-class-properties-6.24.1.tgz\",\n      \"integrity\": \"sha1-anl2PqYdM9NvN7YRqp3vgagbRqw=\",\n      \"dev\": true,\n      \"dependencies\": {\n        \"babel-helper-function-name\": \"^6.24.1\",\n        \"babel-plugin-syntax-class-properties\": \"^6.8.0\",\n        \"babel-runtime\": \"^6.22.0\",\n        \"babel-template\": \"^6.24.1\"\n      }\n    },\n    \"node_modules/babel-plugin-transform-es2015-arrow-functions\": {\n      \"version\": \"6.22.0\",\n      \"resolved\": \"https://registry.npmjs.org/babel-plugin-transform-es2015-arrow-functions/-/babel-plugin-transform-es2015-arrow-functions-6.22.0.tgz\",\n      \"integrity\": \"sha1-RSaSy3EdX3ncf4XkQM5BufJE0iE=\",\n      \"dev\": true,\n      \"dependencies\": {\n        \"babel-runtime\": \"^6.22.0\"\n      }\n    },\n    \"node_modules/babel-plugin-transform-es2015-block-scoped-functions\": {\n      \"version\": \"6.22.0\",\n      \"resolved\": \"https://registry.npmjs.org/babel-plugin-transform-es2015-block-scoped-functions/-/babel-plugin-transform-es2015-block-scoped-functions-6.22.0.tgz\",\n      \"integrity\": \"sha1-u8UbSflk1wy42OC5ToICRs46YUE=\",\n      \"dev\": true,\n      \"dependencies\": {\n        \"babel-runtime\": \"^6.22.0\"\n      }\n    },\n    \"node_modules/babel-plugin-transform-es2015-block-scoping\": {\n      \"version\": \"6.26.0\",\n      \"resolved\": \"https://registry.npmjs.org/babel-plugin-transform-es2015-block-scoping/-/babel-plugin-transform-es2015-block-scoping-6.26.0.tgz\",\n      \"integrity\": \"sha1-1w9SmcEwjQXBL0Y4E7CgnnOxiV8=\",\n      \"dev\": true,\n      \"dependencies\": {\n        \"babel-runtime\": \"^6.26.0\",\n        \"babel-template\": \"^6.26.0\",\n        \"babel-traverse\": \"^6.26.0\",\n        \"babel-types\": \"^6.26.0\",\n        \"lodash\": \"^4.17.4\"\n      }\n    },\n    \"node_modules/babel-plugin-transform-es2015-classes\": {\n      \"version\": \"6.24.1\",\n      \"resolved\": \"https://registry.npmjs.org/babel-plugin-transform-es2015-classes/-/babel-plugin-transform-es2015-classes-6.24.1.tgz\",\n      \"integrity\": \"sha1-WkxYpQyclGHlZLSyo7+ryXolhNs=\",\n      \"dev\": true,\n      \"dependencies\": {\n        \"babel-helper-define-map\": \"^6.24.1\",\n        \"babel-helper-function-name\": \"^6.24.1\",\n        \"babel-helper-optimise-call-expression\": \"^6.24.1\",\n        \"babel-helper-replace-supers\": \"^6.24.1\",\n        \"babel-messages\": \"^6.23.0\",\n        \"babel-runtime\": \"^6.22.0\",\n        \"babel-template\": \"^6.24.1\",\n        \"babel-traverse\": \"^6.24.1\",\n        \"babel-types\": \"^6.24.1\"\n      }\n    },\n    \"node_modules/babel-plugin-transform-es2015-computed-properties\": {\n      \"version\": \"6.24.1\",\n      \"resolved\": \"https://registry.npmjs.org/babel-plugin-transform-es2015-computed-properties/-/babel-plugin-transform-es2015-computed-properties-6.24.1.tgz\",\n      \"integrity\": \"sha1-b+Ko0WiV1WNPTNmZttNICjCBWbM=\",\n      \"dev\": true,\n      \"dependencies\": {\n        \"babel-runtime\": \"^6.22.0\",\n        \"babel-template\": \"^6.24.1\"\n      }\n    },\n    \"node_modules/babel-plugin-transform-es2015-destructuring\": {\n      \"version\": \"6.23.0\",\n      \"resolved\": \"https://registry.npmjs.org/babel-plugin-transform-es2015-destructuring/-/babel-plugin-transform-es2015-destructuring-6.23.0.tgz\",\n      \"integrity\": \"sha1-mXux8auWf2gtKwh2/jWNYOdlxW0=\",\n      \"dev\": true,\n      \"dependencies\": {\n        \"babel-runtime\": \"^6.22.0\"\n      }\n    },\n    \"node_modules/babel-plugin-transform-es2015-duplicate-keys\": {\n      \"version\": \"6.24.1\",\n      \"resolved\": \"https://registry.npmjs.org/babel-plugin-transform-es2015-duplicate-keys/-/babel-plugin-transform-es2015-duplicate-keys-6.24.1.tgz\",\n      \"integrity\": \"sha1-c+s9MQypaePvnskcU3QabxV2Qj4=\",\n      \"dev\": true,\n      \"dependencies\": {\n        \"babel-runtime\": \"^6.22.0\",\n        \"babel-types\": \"^6.24.1\"\n      }\n    },\n    \"node_modules/babel-plugin-transform-es2015-for-of\": {\n      \"version\": \"6.23.0\",\n      \"resolved\": \"https://registry.npmjs.org/babel-plugin-transform-es2015-for-of/-/babel-plugin-transform-es2015-for-of-6.23.0.tgz\",\n      \"integrity\": \"sha1-9HyVsrYT3x0+zC/bdXNiPHUkhpE=\",\n      \"dev\": true,\n      \"dependencies\": {\n        \"babel-runtime\": \"^6.22.0\"\n      }\n    },\n    \"node_modules/babel-plugin-transform-es2015-function-name\": {\n      \"version\": \"6.24.1\",\n      \"resolved\": \"https://registry.npmjs.org/babel-plugin-transform-es2015-function-name/-/babel-plugin-transform-es2015-function-name-6.24.1.tgz\",\n      \"integrity\": \"sha1-g0yJhTvDaxrw86TF26qU/Y6sqos=\",\n      \"dev\": true,\n      \"dependencies\": {\n        \"babel-helper-function-name\": \"^6.24.1\",\n        \"babel-runtime\": \"^6.22.0\",\n        \"babel-types\": \"^6.24.1\"\n      }\n    },\n    \"node_modules/babel-plugin-transform-es2015-literals\": {\n      \"version\": \"6.22.0\",\n      \"resolved\": \"https://registry.npmjs.org/babel-plugin-transform-es2015-literals/-/babel-plugin-transform-es2015-literals-6.22.0.tgz\",\n      \"integrity\": \"sha1-T1SgLWzWbPkVKAAZox0xklN3yi4=\",\n      \"dev\": true,\n      \"dependencies\": {\n        \"babel-runtime\": \"^6.22.0\"\n      }\n    },\n    \"node_modules/babel-plugin-transform-es2015-modules-amd\": {\n      \"version\": \"6.24.1\",\n      \"resolved\": \"https://registry.npmjs.org/babel-plugin-transform-es2015-modules-amd/-/babel-plugin-transform-es2015-modules-amd-6.24.1.tgz\",\n      \"integrity\": \"sha1-Oz5UAXI5hC1tGcMBHEvS8AoA0VQ=\",\n      \"dev\": true,\n      \"dependencies\": {\n        \"babel-plugin-transform-es2015-modules-commonjs\": \"^6.24.1\",\n        \"babel-runtime\": \"^6.22.0\",\n        \"babel-template\": \"^6.24.1\"\n      }\n    },\n    \"node_modules/babel-plugin-transform-es2015-modules-commonjs\": {\n      \"version\": \"6.26.0\",\n      \"resolved\": \"https://registry.npmjs.org/babel-plugin-transform-es2015-modules-commonjs/-/babel-plugin-transform-es2015-modules-commonjs-6.26.0.tgz\",\n      \"integrity\": \"sha1-DYOUApt9xqvhqX7xgeAHWN0uXYo=\",\n      \"dev\": true,\n      \"dependencies\": {\n        \"babel-plugin-transform-strict-mode\": \"^6.24.1\",\n        \"babel-runtime\": \"^6.26.0\",\n        \"babel-template\": \"^6.26.0\",\n        \"babel-types\": \"^6.26.0\"\n      }\n    },\n    \"node_modules/babel-plugin-transform-es2015-modules-systemjs\": {\n      \"version\": \"6.24.1\",\n      \"resolved\": \"https://registry.npmjs.org/babel-plugin-transform-es2015-modules-systemjs/-/babel-plugin-transform-es2015-modules-systemjs-6.24.1.tgz\",\n      \"integrity\": \"sha1-/4mhQrkRmpBhlfXxBuzzBdlAfSM=\",\n      \"dev\": true,\n      \"dependencies\": {\n        \"babel-helper-hoist-variables\": \"^6.24.1\",\n        \"babel-runtime\": \"^6.22.0\",\n        \"babel-template\": \"^6.24.1\"\n      }\n    },\n    \"node_modules/babel-plugin-transform-es2015-modules-umd\": {\n      \"version\": \"6.24.1\",\n      \"resolved\": \"https://registry.npmjs.org/babel-plugin-transform-es2015-modules-umd/-/babel-plugin-transform-es2015-modules-umd-6.24.1.tgz\",\n      \"integrity\": \"sha1-rJl+YoXNGO1hdq22B9YCNErThGg=\",\n      \"dev\": true,\n      \"dependencies\": {\n        \"babel-plugin-transform-es2015-modules-amd\": \"^6.24.1\",\n        \"babel-runtime\": \"^6.22.0\",\n        \"babel-template\": \"^6.24.1\"\n      }\n    },\n    \"node_modules/babel-plugin-transform-es2015-object-super\": {\n      \"version\": \"6.24.1\",\n      \"resolved\": \"https://registry.npmjs.org/babel-plugin-transform-es2015-object-super/-/babel-plugin-transform-es2015-object-super-6.24.1.tgz\",\n      \"integrity\": \"sha1-JM72muIcuDp/hgPa0CH1cusnj40=\",\n      \"dev\": true,\n      \"dependencies\": {\n        \"babel-helper-replace-supers\": \"^6.24.1\",\n        \"babel-runtime\": \"^6.22.0\"\n      }\n    },\n    \"node_modules/babel-plugin-transform-es2015-parameters\": {\n      \"version\": \"6.24.1\",\n      \"resolved\": \"https://registry.npmjs.org/babel-plugin-transform-es2015-parameters/-/babel-plugin-transform-es2015-parameters-6.24.1.tgz\",\n      \"integrity\": \"sha1-V6w1GrScrxSpfNE7CfZv3wpiXys=\",\n      \"dev\": true,\n      \"dependencies\": {\n        \"babel-helper-call-delegate\": \"^6.24.1\",\n        \"babel-helper-get-function-arity\": \"^6.24.1\",\n        \"babel-runtime\": \"^6.22.0\",\n        \"babel-template\": \"^6.24.1\",\n        \"babel-traverse\": \"^6.24.1\",\n        \"babel-types\": \"^6.24.1\"\n      }\n    },\n    \"node_modules/babel-plugin-transform-es2015-shorthand-properties\": {\n      \"version\": \"6.24.1\",\n      \"resolved\": \"https://registry.npmjs.org/babel-plugin-transform-es2015-shorthand-properties/-/babel-plugin-transform-es2015-shorthand-properties-6.24.1.tgz\",\n      \"integrity\": \"sha1-JPh11nIch2YbvZmkYi5R8U3jiqA=\",\n      \"dev\": true,\n      \"dependencies\": {\n        \"babel-runtime\": \"^6.22.0\",\n        \"babel-types\": \"^6.24.1\"\n      }\n    },\n    \"node_modules/babel-plugin-transform-es2015-spread\": {\n      \"version\": \"6.22.0\",\n      \"resolved\": \"https://registry.npmjs.org/babel-plugin-transform-es2015-spread/-/babel-plugin-transform-es2015-spread-6.22.0.tgz\",\n      \"integrity\": \"sha1-1taKmfia7cRTbIGlQujdnxdG+NE=\",\n      \"dev\": true,\n      \"dependencies\": {\n        \"babel-runtime\": \"^6.22.0\"\n      }\n    },\n    \"node_modules/babel-plugin-transform-es2015-sticky-regex\": {\n      \"version\": \"6.24.1\",\n      \"resolved\": \"https://registry.npmjs.org/babel-plugin-transform-es2015-sticky-regex/-/babel-plugin-transform-es2015-sticky-regex-6.24.1.tgz\",\n      \"integrity\": \"sha1-AMHNsaynERLN8M9hJsLta0V8zbw=\",\n      \"dev\": true,\n      \"dependencies\": {\n        \"babel-helper-regex\": \"^6.24.1\",\n        \"babel-runtime\": \"^6.22.0\",\n        \"babel-types\": \"^6.24.1\"\n      }\n    },\n    \"node_modules/babel-plugin-transform-es2015-template-literals\": {\n      \"version\": \"6.22.0\",\n      \"resolved\": \"https://registry.npmjs.org/babel-plugin-transform-es2015-template-literals/-/babel-plugin-transform-es2015-template-literals-6.22.0.tgz\",\n      \"integrity\": \"sha1-qEs0UPfp+PH2g51taH2oS7EjbY0=\",\n      \"dev\": true,\n      \"dependencies\": {\n        \"babel-runtime\": \"^6.22.0\"\n      }\n    },\n    \"node_modules/babel-plugin-transform-es2015-typeof-symbol\": {\n      \"version\": \"6.23.0\",\n      \"resolved\": \"https://registry.npmjs.org/babel-plugin-transform-es2015-typeof-symbol/-/babel-plugin-transform-es2015-typeof-symbol-6.23.0.tgz\",\n      \"integrity\": \"sha1-3sCfHN3/lLUqxz1QXITfWdzOs3I=\",\n      \"dev\": true,\n      \"dependencies\": {\n        \"babel-runtime\": \"^6.22.0\"\n      }\n    },\n    \"node_modules/babel-plugin-transform-es2015-unicode-regex\": {\n      \"version\": \"6.24.1\",\n      \"resolved\": \"https://registry.npmjs.org/babel-plugin-transform-es2015-unicode-regex/-/babel-plugin-transform-es2015-unicode-regex-6.24.1.tgz\",\n      \"integrity\": \"sha1-04sS9C6nMj9yk4fxinxa4frrNek=\",\n      \"dev\": true,\n      \"dependencies\": {\n        \"babel-helper-regex\": \"^6.24.1\",\n        \"babel-runtime\": \"^6.22.0\",\n        \"regexpu-core\": \"^2.0.0\"\n      }\n    },\n    \"node_modules/babel-plugin-transform-regenerator\": {\n      \"version\": \"6.26.0\",\n      \"resolved\": \"https://registry.npmjs.org/babel-plugin-transform-regenerator/-/babel-plugin-transform-regenerator-6.26.0.tgz\",\n      \"integrity\": \"sha1-4HA2lvveJ/Cj78rPi03KL3s6jy8=\",\n      \"dev\": true,\n      \"dependencies\": {\n        \"regenerator-transform\": \"^0.10.0\"\n      }\n    },\n    \"node_modules/babel-plugin-transform-strict-mode\": {\n      \"version\": \"6.24.1\",\n      \"resolved\": \"https://registry.npmjs.org/babel-plugin-transform-strict-mode/-/babel-plugin-transform-strict-mode-6.24.1.tgz\",\n      \"integrity\": \"sha1-1fr3qleKZbvlkc9e2uBKDGcCB1g=\",\n      \"dev\": true,\n      \"dependencies\": {\n        \"babel-runtime\": \"^6.22.0\",\n        \"babel-types\": \"^6.24.1\"\n      }\n    },\n    \"node_modules/babel-preset-es2015\": {\n      \"version\": \"6.24.1\",\n      \"resolved\": \"https://registry.npmjs.org/babel-preset-es2015/-/babel-preset-es2015-6.24.1.tgz\",\n      \"integrity\": \"sha1-1EBQ1rwsn+6nAqrzjXJ6AhBTiTk=\",\n      \"deprecated\": \"🙌  Thanks for using Babel: we recommend using babel-preset-env now: please read https://babeljs.io/env to update!\",\n      \"dev\": true,\n      \"dependencies\": {\n        \"babel-plugin-check-es2015-constants\": \"^6.22.0\",\n        \"babel-plugin-transform-es2015-arrow-functions\": \"^6.22.0\",\n        \"babel-plugin-transform-es2015-block-scoped-functions\": \"^6.22.0\",\n        \"babel-plugin-transform-es2015-block-scoping\": \"^6.24.1\",\n        \"babel-plugin-transform-es2015-classes\": \"^6.24.1\",\n        \"babel-plugin-transform-es2015-computed-properties\": \"^6.24.1\",\n        \"babel-plugin-transform-es2015-destructuring\": \"^6.22.0\",\n        \"babel-plugin-transform-es2015-duplicate-keys\": \"^6.24.1\",\n        \"babel-plugin-transform-es2015-for-of\": \"^6.22.0\",\n        \"babel-plugin-transform-es2015-function-name\": \"^6.24.1\",\n        \"babel-plugin-transform-es2015-literals\": \"^6.22.0\",\n        \"babel-plugin-transform-es2015-modules-amd\": \"^6.24.1\",\n        \"babel-plugin-transform-es2015-modules-commonjs\": \"^6.24.1\",\n        \"babel-plugin-transform-es2015-modules-systemjs\": \"^6.24.1\",\n        \"babel-plugin-transform-es2015-modules-umd\": \"^6.24.1\",\n        \"babel-plugin-transform-es2015-object-super\": \"^6.24.1\",\n        \"babel-plugin-transform-es2015-parameters\": \"^6.24.1\",\n        \"babel-plugin-transform-es2015-shorthand-properties\": \"^6.24.1\",\n        \"babel-plugin-transform-es2015-spread\": \"^6.22.0\",\n        \"babel-plugin-transform-es2015-sticky-regex\": \"^6.24.1\",\n        \"babel-plugin-transform-es2015-template-literals\": \"^6.22.0\",\n        \"babel-plugin-transform-es2015-typeof-symbol\": \"^6.22.0\",\n        \"babel-plugin-transform-es2015-unicode-regex\": \"^6.24.1\",\n        \"babel-plugin-transform-regenerator\": \"^6.24.1\"\n      }\n    },\n    \"node_modules/babel-register\": {\n      \"version\": \"6.26.0\",\n      \"resolved\": \"https://registry.npmjs.org/babel-register/-/babel-register-6.26.0.tgz\",\n      \"integrity\": \"sha1-btAhFz4vy0htestFxgCahW9kcHE=\",\n      \"dev\": true,\n      \"dependencies\": {\n        \"babel-core\": \"^6.26.0\",\n        \"babel-runtime\": \"^6.26.0\",\n        \"core-js\": \"^2.5.0\",\n        \"home-or-tmp\": \"^2.0.0\",\n        \"lodash\": \"^4.17.4\",\n        \"mkdirp\": \"^0.5.1\",\n        \"source-map-support\": \"^0.4.15\"\n      }\n    },\n    \"node_modules/babel-runtime\": {\n      \"version\": \"6.26.0\",\n      \"resolved\": \"https://registry.npmjs.org/babel-runtime/-/babel-runtime-6.26.0.tgz\",\n      \"integrity\": \"sha1-llxwWGaOgrVde/4E/yM3vItWR/4=\",\n      \"dev\": true,\n      \"dependencies\": {\n        \"core-js\": \"^2.4.0\",\n        \"regenerator-runtime\": \"^0.11.0\"\n      }\n    },\n    \"node_modules/babel-template\": {\n      \"version\": \"6.26.0\",\n      \"resolved\": \"https://registry.npmjs.org/babel-template/-/babel-template-6.26.0.tgz\",\n      \"integrity\": \"sha1-3gPi0WOWsGn0bdn/+FIfsaDjXgI=\",\n      \"dev\": true,\n      \"dependencies\": {\n        \"babel-runtime\": \"^6.26.0\",\n        \"babel-traverse\": \"^6.26.0\",\n        \"babel-types\": \"^6.26.0\",\n        \"babylon\": \"^6.18.0\",\n        \"lodash\": \"^4.17.4\"\n      }\n    },\n    \"node_modules/babel-traverse\": {\n      \"version\": \"6.26.0\",\n      \"resolved\": \"https://registry.npmjs.org/babel-traverse/-/babel-traverse-6.26.0.tgz\",\n      \"integrity\": \"sha1-RqnL1+3MYsjlwGTi0tjQ9ANXZu4=\",\n      \"dev\": true,\n      \"dependencies\": {\n        \"babel-code-frame\": \"^6.26.0\",\n        \"babel-messages\": \"^6.23.0\",\n        \"babel-runtime\": \"^6.26.0\",\n        \"babel-types\": \"^6.26.0\",\n        \"babylon\": \"^6.18.0\",\n        \"debug\": \"^2.6.8\",\n        \"globals\": \"^9.18.0\",\n        \"invariant\": \"^2.2.2\",\n        \"lodash\": \"^4.17.4\"\n      }\n    },\n    \"node_modules/babel-types\": {\n      \"version\": \"6.26.0\",\n      \"resolved\": \"https://registry.npmjs.org/babel-types/-/babel-types-6.26.0.tgz\",\n      \"integrity\": \"sha1-o7Bz+Uq0nrb6Vc1lInozQ4BjJJc=\",\n      \"dev\": true,\n      \"dependencies\": {\n        \"babel-runtime\": \"^6.26.0\",\n        \"esutils\": \"^2.0.2\",\n        \"lodash\": \"^4.17.4\",\n        \"to-fast-properties\": \"^1.0.3\"\n      }\n    },\n    \"node_modules/babelrc-rollup\": {\n      \"version\": \"3.0.0\",\n      \"resolved\": \"https://registry.npmjs.org/babelrc-rollup/-/babelrc-rollup-3.0.0.tgz\",\n      \"integrity\": \"sha1-/Ozb4+tkAM9OdpIzwXhqL6/otWw=\",\n      \"dev\": true,\n      \"dependencies\": {\n        \"resolve\": \"^1.1.7\"\n      }\n    },\n    \"node_modules/babylon\": {\n      \"version\": \"6.18.0\",\n      \"resolved\": \"https://registry.npmjs.org/babylon/-/babylon-6.18.0.tgz\",\n      \"integrity\": \"sha512-q/UEjfGJ2Cm3oKV71DJz9d25TPnq5rhBVL2Q4fA5wcC3jcrdn7+SssEybFIxwAvvP+YCsCYNKughoF33GxgycQ==\",\n      \"dev\": true,\n      \"bin\": {\n        \"babylon\": \"bin/babylon.js\"\n      }\n    },\n    \"node_modules/balanced-match\": {\n      \"version\": \"1.0.0\",\n      \"resolved\": \"https://registry.npmjs.org/balanced-match/-/balanced-match-1.0.0.tgz\",\n      \"integrity\": \"sha1-ibTRmasr7kneFk6gK4nORi1xt2c=\",\n      \"dev\": true\n    },\n    \"node_modules/batch\": {\n      \"version\": \"0.6.1\",\n      \"resolved\": \"https://registry.npmjs.org/batch/-/batch-0.6.1.tgz\",\n      \"integrity\": \"sha1-3DQxT05nkxgJP8dgJyUl+UvyXBY=\",\n      \"dev\": true\n    },\n    \"node_modules/beeper\": {\n      \"version\": \"1.1.1\",\n      \"resolved\": \"https://registry.npmjs.org/beeper/-/beeper-1.1.1.tgz\",\n      \"integrity\": \"sha1-5tXqjF2tABMEpwsiY4RH9pyy+Ak=\",\n      \"dev\": true,\n      \"engines\": {\n        \"node\": \">=0.10.0\"\n      }\n    },\n    \"node_modules/body-parser\": {\n      \"version\": \"1.8.4\",\n      \"resolved\": \"https://registry.npmjs.org/body-parser/-/body-parser-1.8.4.tgz\",\n      \"integrity\": \"sha1-1JfgS8E7P5qL2McLsM3Bby4CiJg=\",\n      \"dev\": true,\n      \"dependencies\": {\n        \"bytes\": \"1.0.0\",\n        \"depd\": \"0.4.5\",\n        \"iconv-lite\": \"0.4.4\",\n        \"media-typer\": \"0.3.0\",\n        \"on-finished\": \"2.1.0\",\n        \"qs\": \"2.2.4\",\n        \"raw-body\": \"1.3.0\",\n        \"type-is\": \"~1.5.1\"\n      },\n      \"engines\": {\n        \"node\": \">= 0.8\"\n      }\n    },\n    \"node_modules/body-parser/node_modules/depd\": {\n      \"version\": \"0.4.5\",\n      \"resolved\": \"https://registry.npmjs.org/depd/-/depd-0.4.5.tgz\",\n      \"integrity\": \"sha1-GmZLUziLSmVz6K5ntfdnxpPKl/E=\",\n      \"dev\": true,\n      \"engines\": {\n        \"node\": \">= 0.6\"\n      }\n    },\n    \"node_modules/body-parser/node_modules/ee-first\": {\n      \"version\": \"1.0.5\",\n      \"resolved\": \"https://registry.npmjs.org/ee-first/-/ee-first-1.0.5.tgz\",\n      \"integrity\": \"sha1-jJshKJjYzZ8alDZlDOe+ICyen/A=\",\n      \"dev\": true\n    },\n    \"node_modules/body-parser/node_modules/on-finished\": {\n      \"version\": \"2.1.0\",\n      \"resolved\": \"https://registry.npmjs.org/on-finished/-/on-finished-2.1.0.tgz\",\n      \"integrity\": \"sha1-DFOfCSkej/rd4MiiWFD7LO3HAi0=\",\n      \"dev\": true,\n      \"dependencies\": {\n        \"ee-first\": \"1.0.5\"\n      }\n    },\n    \"node_modules/body-parser/node_modules/qs\": {\n      \"version\": \"2.2.4\",\n      \"resolved\": \"https://registry.npmjs.org/qs/-/qs-2.2.4.tgz\",\n      \"integrity\": \"sha1-Lp+800tUDjQhySTs0B6QqpdTGcg=\",\n      \"dev\": true\n    },\n    \"node_modules/brace-expansion\": {\n      \"version\": \"1.1.8\",\n      \"resolved\": \"https://registry.npmjs.org/brace-expansion/-/brace-expansion-1.1.8.tgz\",\n      \"integrity\": \"sha1-wHshHHyVLsH479Uad+8NHTmQopI=\",\n      \"dev\": true,\n      \"dependencies\": {\n        \"balanced-match\": \"^1.0.0\",\n        \"concat-map\": \"0.0.1\"\n      }\n    },\n    \"node_modules/braces\": {\n      \"version\": \"1.8.5\",\n      \"resolved\": \"https://registry.npmjs.org/braces/-/braces-1.8.5.tgz\",\n      \"integrity\": \"sha1-uneWLhLf+WnWt2cR6RS3N4V79qc=\",\n      \"dev\": true,\n      \"dependencies\": {\n        \"expand-range\": \"^1.8.1\",\n        \"preserve\": \"^0.2.0\",\n        \"repeat-element\": \"^1.1.2\"\n      },\n      \"engines\": {\n        \"node\": \">=0.10.0\"\n      }\n    },\n    \"node_modules/builtin-modules\": {\n      \"version\": \"1.1.1\",\n      \"resolved\": \"https://registry.npmjs.org/builtin-modules/-/builtin-modules-1.1.1.tgz\",\n      \"integrity\": \"sha1-Jw8HbFpywC9bZaR9+Uxf46J4iS8=\",\n      \"dev\": true,\n      \"engines\": {\n        \"node\": \">=0.10.0\"\n      }\n    },\n    \"node_modules/bytes\": {\n      \"version\": \"1.0.0\",\n      \"resolved\": \"https://registry.npmjs.org/bytes/-/bytes-1.0.0.tgz\",\n      \"integrity\": \"sha1-NWnt6Lo0MV+rmcPpLLBMciDeH6g=\",\n      \"dev\": true\n    },\n    \"node_modules/caller-path\": {\n      \"version\": \"0.1.0\",\n      \"resolved\": \"https://registry.npmjs.org/caller-path/-/caller-path-0.1.0.tgz\",\n      \"integrity\": \"sha1-lAhe9jWB7NPaqSREqP6U6CV3dR8=\",\n      \"dev\": true,\n      \"dependencies\": {\n        \"callsites\": \"^0.2.0\"\n      },\n      \"engines\": {\n        \"node\": \">=0.10.0\"\n      }\n    },\n    \"node_modules/callsites\": {\n      \"version\": \"0.2.0\",\n      \"resolved\": \"https://registry.npmjs.org/callsites/-/callsites-0.2.0.tgz\",\n      \"integrity\": \"sha1-r6uWJikQp/M8GaV3WCXGnzTjUMo=\",\n      \"dev\": true,\n      \"engines\": {\n        \"node\": \">=0.10.0\"\n      }\n    },\n    \"node_modules/camelcase\": {\n      \"version\": \"2.1.1\",\n      \"resolved\": \"https://registry.npmjs.org/camelcase/-/camelcase-2.1.1.tgz\",\n      \"integrity\": \"sha1-fB0W1nmhu+WcoCys7PsBHiAfWh8=\",\n      \"dev\": true,\n      \"engines\": {\n        \"node\": \">=0.10.0\"\n      }\n    },\n    \"node_modules/camelcase-keys\": {\n      \"version\": \"2.1.0\",\n      \"resolved\": \"https://registry.npmjs.org/camelcase-keys/-/camelcase-keys-2.1.0.tgz\",\n      \"integrity\": \"sha1-MIvur/3ygRkFHvodkyITyRuPkuc=\",\n      \"dev\": true,\n      \"dependencies\": {\n        \"camelcase\": \"^2.0.0\",\n        \"map-obj\": \"^1.0.0\"\n      },\n      \"engines\": {\n        \"node\": \">=0.10.0\"\n      }\n    },\n    \"node_modules/chalk\": {\n      \"version\": \"1.1.3\",\n      \"resolved\": \"https://registry.npmjs.org/chalk/-/chalk-1.1.3.tgz\",\n      \"integrity\": \"sha1-qBFcVeSnAv5NFQq9OHKCKn4J/Jg=\",\n      \"dev\": true,\n      \"dependencies\": {\n        \"ansi-styles\": \"^2.2.1\",\n        \"escape-string-regexp\": \"^1.0.2\",\n        \"has-ansi\": \"^2.0.0\",\n        \"strip-ansi\": \"^3.0.0\",\n        \"supports-color\": \"^2.0.0\"\n      },\n      \"engines\": {\n        \"node\": \">=0.10.0\"\n      }\n    },\n    \"node_modules/chokidar\": {\n      \"version\": \"0.12.6\",\n      \"resolved\": \"https://registry.npmjs.org/chokidar/-/chokidar-0.12.6.tgz\",\n      \"integrity\": \"sha512-nMQqT43NJ46Yc75wx9pQ7p/yhzg/5qXHPcgHKUcTLCdcUr1xMUM92SSY4sfGNpJ2zRHQqUsk1hnlP4GW8mm0Aw==\",\n      \"deprecated\": \"Chokidar 2 will break on node v14+. Upgrade to chokidar 3 with 15x less dependencies.\",\n      \"dependencies\": {\n        \"async-each\": \"~0.1.5\",\n        \"readdirp\": \"~1.3.0\"\n      },\n      \"optionalDependencies\": {\n        \"fsevents\": \"~0.3.1\"\n      }\n    },\n    \"node_modules/ci-info\": {\n      \"version\": \"1.1.1\",\n      \"resolved\": \"https://registry.npmjs.org/ci-info/-/ci-info-1.1.1.tgz\",\n      \"integrity\": \"sha512-vHDDF/bP9RYpTWtUhpJRhCFdvvp3iDWvEbuDbWgvjUrNGV1MXJrE0MPcwGtEled04m61iwdBLUIHZtDgzWS4ZQ==\",\n      \"dev\": true\n    },\n    \"node_modules/circular-json\": {\n      \"version\": \"0.3.3\",\n      \"resolved\": \"https://registry.npmjs.org/circular-json/-/circular-json-0.3.3.tgz\",\n      \"integrity\": \"sha512-UZK3NBx2Mca+b5LsG7bY183pHWt5Y1xts4P3Pz7ENTwGVnJOUWbRb3ocjvX7hx9tq/yTAdclXm9sZ38gNuem4A==\",\n      \"deprecated\": \"CircularJSON is in maintenance only, flatted is its successor.\",\n      \"dev\": true\n    },\n    \"node_modules/cli-cursor\": {\n      \"version\": \"1.0.2\",\n      \"resolved\": \"https://registry.npmjs.org/cli-cursor/-/cli-cursor-1.0.2.tgz\",\n      \"integrity\": \"sha1-ZNo/fValRBLll5S9Ytw1KV6PKYc=\",\n      \"dev\": true,\n      \"dependencies\": {\n        \"restore-cursor\": \"^1.0.1\"\n      },\n      \"engines\": {\n        \"node\": \">=0.10.0\"\n      }\n    },\n    \"node_modules/cli-spinners\": {\n      \"version\": \"0.1.2\",\n      \"resolved\": \"https://registry.npmjs.org/cli-spinners/-/cli-spinners-0.1.2.tgz\",\n      \"integrity\": \"sha1-u3ZNiOGF+54eaiofGXcjGPYF4xw=\",\n      \"dev\": true,\n      \"engines\": {\n        \"node\": \">=0.10.0\"\n      }\n    },\n    \"node_modules/cli-truncate\": {\n      \"version\": \"0.2.1\",\n      \"resolved\": \"https://registry.npmjs.org/cli-truncate/-/cli-truncate-0.2.1.tgz\",\n      \"integrity\": \"sha1-nxXPuwcFAFNpIWxiasfQWrkN1XQ=\",\n      \"dev\": true,\n      \"dependencies\": {\n        \"slice-ansi\": \"0.0.4\",\n        \"string-width\": \"^1.0.1\"\n      },\n      \"engines\": {\n        \"node\": \">=0.10.0\"\n      }\n    },\n    \"node_modules/cli-width\": {\n      \"version\": \"2.2.0\",\n      \"resolved\": \"https://registry.npmjs.org/cli-width/-/cli-width-2.2.0.tgz\",\n      \"integrity\": \"sha1-/xnt6Kml5XkyQUewwR8PvLq+1jk=\",\n      \"dev\": true\n    },\n    \"node_modules/clone\": {\n      \"version\": \"1.0.2\",\n      \"resolved\": \"https://registry.npmjs.org/clone/-/clone-1.0.2.tgz\",\n      \"integrity\": \"sha1-Jgt6meux7f4kdTgXX3gyQ8sZ0Uk=\",\n      \"deprecated\": \"XSS vulnerability fixed in v1.0.3\",\n      \"dev\": true,\n      \"engines\": {\n        \"node\": \">=0.8\"\n      }\n    },\n    \"node_modules/clone-stats\": {\n      \"version\": \"0.0.1\",\n      \"resolved\": \"https://registry.npmjs.org/clone-stats/-/clone-stats-0.0.1.tgz\",\n      \"integrity\": \"sha1-uI+UqCzzi4eR1YBG6kAprYjKmdE=\",\n      \"dev\": true\n    },\n    \"node_modules/co\": {\n      \"version\": \"4.6.0\",\n      \"resolved\": \"https://registry.npmjs.org/co/-/co-4.6.0.tgz\",\n      \"integrity\": \"sha1-bqa989hTrlTMuOR7+gvz+QMfsYQ=\",\n      \"dev\": true,\n      \"engines\": {\n        \"iojs\": \">= 1.0.0\",\n        \"node\": \">= 0.12.0\"\n      }\n    },\n    \"node_modules/code-point-at\": {\n      \"version\": \"1.1.0\",\n      \"resolved\": \"https://registry.npmjs.org/code-point-at/-/code-point-at-1.1.0.tgz\",\n      \"integrity\": \"sha1-DQcLTQQ6W+ozovGkDi7bPZpMz3c=\",\n      \"dev\": true,\n      \"engines\": {\n        \"node\": \">=0.10.0\"\n      }\n    },\n    \"node_modules/color-convert\": {\n      \"version\": \"1.9.0\",\n      \"resolved\": \"https://registry.npmjs.org/color-convert/-/color-convert-1.9.0.tgz\",\n      \"integrity\": \"sha1-Gsz5fdc5uYO/mU1W/sj5WFNkG3o=\",\n      \"dev\": true,\n      \"dependencies\": {\n        \"color-name\": \"^1.1.1\"\n      }\n    },\n    \"node_modules/color-name\": {\n      \"version\": \"1.1.3\",\n      \"resolved\": \"https://registry.npmjs.org/color-name/-/color-name-1.1.3.tgz\",\n      \"integrity\": \"sha1-p9BVi9icQveV3UIyj3QIMcpTvCU=\",\n      \"dev\": true\n    },\n    \"node_modules/colors\": {\n      \"version\": \"1.0.3\",\n      \"resolved\": \"https://registry.npmjs.org/colors/-/colors-1.0.3.tgz\",\n      \"integrity\": \"sha512-pFGrxThWcWQ2MsAz6RtgeWe4NK2kUE1WfsrvvlctdII745EW9I0yflqhe7++M5LEc7bV2c/9/5zc8sFcpL0Drw==\",\n      \"engines\": {\n        \"node\": \">=0.1.90\"\n      }\n    },\n    \"node_modules/command-line-args\": {\n      \"version\": \"4.0.7\",\n      \"resolved\": \"https://registry.npmjs.org/command-line-args/-/command-line-args-4.0.7.tgz\",\n      \"integrity\": \"sha512-aUdPvQRAyBvQd2n7jXcsMDz68ckBJELXNzBybCHOibUWEg0mWTnaYCSRU8h9R+aNRSvDihJtssSRCiDRpLaezA==\",\n      \"dev\": true,\n      \"dependencies\": {\n        \"array-back\": \"^2.0.0\",\n        \"find-replace\": \"^1.0.3\",\n        \"typical\": \"^2.6.1\"\n      },\n      \"bin\": {\n        \"command-line-args\": \"bin/cli.js\"\n      }\n    },\n    \"node_modules/commander\": {\n      \"version\": \"2.6.0\",\n      \"resolved\": \"https://registry.npmjs.org/commander/-/commander-2.6.0.tgz\",\n      \"integrity\": \"sha1-nfflL7Kgyw+4kFjugMMQQiXzfh0=\",\n      \"dev\": true,\n      \"engines\": {\n        \"node\": \">= 0.6.x\"\n      }\n    },\n    \"node_modules/concat-map\": {\n      \"version\": \"0.0.1\",\n      \"resolved\": \"https://registry.npmjs.org/concat-map/-/concat-map-0.0.1.tgz\",\n      \"integrity\": \"sha1-2Klr13/Wjfd5OnMDajug1UBdR3s=\",\n      \"dev\": true\n    },\n    \"node_modules/concat-stream\": {\n      \"version\": \"1.6.0\",\n      \"resolved\": \"https://registry.npmjs.org/concat-stream/-/concat-stream-1.6.0.tgz\",\n      \"integrity\": \"sha1-CqxmL9Ur54lk1VMvaUeE5wEQrPc=\",\n      \"dev\": true,\n      \"engines\": [\n        \"node >= 0.8\"\n      ],\n      \"dependencies\": {\n        \"inherits\": \"^2.0.3\",\n        \"readable-stream\": \"^2.2.2\",\n        \"typedarray\": \"^0.0.6\"\n      }\n    },\n    \"node_modules/concurrently\": {\n      \"version\": \"3.5.0\",\n      \"resolved\": \"https://registry.npmjs.org/concurrently/-/concurrently-3.5.0.tgz\",\n      \"integrity\": \"sha1-jPG3cHppFqeKT/W3e7BN7FSzebI=\",\n      \"dev\": true,\n      \"dependencies\": {\n        \"chalk\": \"0.5.1\",\n        \"commander\": \"2.6.0\",\n        \"date-fns\": \"^1.23.0\",\n        \"lodash\": \"^4.5.1\",\n        \"rx\": \"2.3.24\",\n        \"spawn-command\": \"^0.0.2-1\",\n        \"supports-color\": \"^3.2.3\",\n        \"tree-kill\": \"^1.1.0\"\n      },\n      \"bin\": {\n        \"concurrent\": \"src/main.js\",\n        \"concurrently\": \"src/main.js\"\n      },\n      \"engines\": {\n        \"node\": \">=4.0.0\"\n      }\n    },\n    \"node_modules/concurrently/node_modules/ansi-regex\": {\n      \"version\": \"0.2.1\",\n      \"resolved\": \"https://registry.npmjs.org/ansi-regex/-/ansi-regex-0.2.1.tgz\",\n      \"integrity\": \"sha1-DY6UaWej2BQ/k+JOKYUl/BsiNfk=\",\n      \"dev\": true,\n      \"engines\": {\n        \"node\": \">=0.10.0\"\n      }\n    },\n    \"node_modules/concurrently/node_modules/ansi-styles\": {\n      \"version\": \"1.1.0\",\n      \"resolved\": \"https://registry.npmjs.org/ansi-styles/-/ansi-styles-1.1.0.tgz\",\n      \"integrity\": \"sha1-6uy/Zs1waIJ2Cy9GkVgrj1XXp94=\",\n      \"dev\": true,\n      \"engines\": {\n        \"node\": \">=0.10.0\"\n      }\n    },\n    \"node_modules/concurrently/node_modules/chalk\": {\n      \"version\": \"0.5.1\",\n      \"resolved\": \"https://registry.npmjs.org/chalk/-/chalk-0.5.1.tgz\",\n      \"integrity\": \"sha1-Zjs6ZItotV0EaQ1JFnqoN4WPIXQ=\",\n      \"dev\": true,\n      \"dependencies\": {\n        \"ansi-styles\": \"^1.1.0\",\n        \"escape-string-regexp\": \"^1.0.0\",\n        \"has-ansi\": \"^0.1.0\",\n        \"strip-ansi\": \"^0.3.0\",\n        \"supports-color\": \"^0.2.0\"\n      },\n      \"engines\": {\n        \"node\": \">=0.10.0\"\n      }\n    },\n    \"node_modules/concurrently/node_modules/chalk/node_modules/supports-color\": {\n      \"version\": \"0.2.0\",\n      \"resolved\": \"https://registry.npmjs.org/supports-color/-/supports-color-0.2.0.tgz\",\n      \"integrity\": \"sha1-2S3iaU6z9nMjlz1649i1W0wiGQo=\",\n      \"dev\": true,\n      \"bin\": {\n        \"supports-color\": \"cli.js\"\n      },\n      \"engines\": {\n        \"node\": \">=0.10.0\"\n      }\n    },\n    \"node_modules/concurrently/node_modules/has-ansi\": {\n      \"version\": \"0.1.0\",\n      \"resolved\": \"https://registry.npmjs.org/has-ansi/-/has-ansi-0.1.0.tgz\",\n      \"integrity\": \"sha1-hPJlqujA5qiKEtcCKJS3VoiUxi4=\",\n      \"dev\": true,\n      \"dependencies\": {\n        \"ansi-regex\": \"^0.2.0\"\n      },\n      \"bin\": {\n        \"has-ansi\": \"cli.js\"\n      },\n      \"engines\": {\n        \"node\": \">=0.10.0\"\n      }\n    },\n    \"node_modules/concurrently/node_modules/strip-ansi\": {\n      \"version\": \"0.3.0\",\n      \"resolved\": \"https://registry.npmjs.org/strip-ansi/-/strip-ansi-0.3.0.tgz\",\n      \"integrity\": \"sha1-JfSOoiynkYfzF0pNuHWTR7sSYiA=\",\n      \"dev\": true,\n      \"dependencies\": {\n        \"ansi-regex\": \"^0.2.1\"\n      },\n      \"bin\": {\n        \"strip-ansi\": \"cli.js\"\n      },\n      \"engines\": {\n        \"node\": \">=0.10.0\"\n      }\n    },\n    \"node_modules/concurrently/node_modules/supports-color\": {\n      \"version\": \"3.2.3\",\n      \"resolved\": \"https://registry.npmjs.org/supports-color/-/supports-color-3.2.3.tgz\",\n      \"integrity\": \"sha1-ZawFBLOVQXHYpklGsq48u4pfVPY=\",\n      \"dev\": true,\n      \"dependencies\": {\n        \"has-flag\": \"^1.0.0\"\n      },\n      \"engines\": {\n        \"node\": \">=0.8.0\"\n      }\n    },\n    \"node_modules/connect\": {\n      \"version\": \"3.6.3\",\n      \"resolved\": \"https://registry.npmjs.org/connect/-/connect-3.6.3.tgz\",\n      \"integrity\": \"sha512-GLSZqgjVxPvGYVD/2vz//gS201MEXk4b7t3nHV6OVnTdDNWi/Gm7Rpxs/ybvljPWvULys/wrzIV3jB3YvEc3nQ==\",\n      \"dev\": true,\n      \"dependencies\": {\n        \"debug\": \"2.6.8\",\n        \"finalhandler\": \"1.0.4\",\n        \"parseurl\": \"~1.3.1\",\n        \"utils-merge\": \"1.0.0\"\n      },\n      \"engines\": {\n        \"node\": \">= 0.10.0\"\n      }\n    },\n    \"node_modules/connect-livereload\": {\n      \"version\": \"0.4.1\",\n      \"resolved\": \"https://registry.npmjs.org/connect-livereload/-/connect-livereload-0.4.1.tgz\",\n      \"integrity\": \"sha1-D4oagWvJuv+uRjfM6pF0Yv41kXo=\",\n      \"dev\": true,\n      \"engines\": {\n        \"node\": \"*\"\n      }\n    },\n    \"node_modules/convert-source-map\": {\n      \"version\": \"1.5.0\",\n      \"resolved\": \"https://registry.npmjs.org/convert-source-map/-/convert-source-map-1.5.0.tgz\",\n      \"integrity\": \"sha1-ms1whRxtXf3ZPZKC5e35SgP/RrU=\",\n      \"dev\": true\n    },\n    \"node_modules/core-js\": {\n      \"version\": \"2.5.1\",\n      \"resolved\": \"https://registry.npmjs.org/core-js/-/core-js-2.5.1.tgz\",\n      \"integrity\": \"sha1-rmh03GaTd4m4B1T/VCjfZoGcpQs=\",\n      \"deprecated\": \"core-js@<3.23.3 is no longer maintained and not recommended for usage due to the number of issues. Because of the V8 engine whims, feature detection in old core-js versions could cause a slowdown up to 100x even if nothing is polyfilled. Some versions have web compatibility issues. Please, upgrade your dependencies to the actual version of core-js.\",\n      \"dev\": true\n    },\n    \"node_modules/core-util-is\": {\n      \"version\": \"1.0.2\",\n      \"resolved\": \"https://registry.npmjs.org/core-util-is/-/core-util-is-1.0.2.tgz\",\n      \"integrity\": \"sha1-tf1UIgqivFq1eqtxQMlAdUUDwac=\"\n    },\n    \"node_modules/cosmiconfig\": {\n      \"version\": \"1.1.0\",\n      \"resolved\": \"https://registry.npmjs.org/cosmiconfig/-/cosmiconfig-1.1.0.tgz\",\n      \"integrity\": \"sha1-DeoPmATv37kp+7GxiOJVU+oFPTc=\",\n      \"dev\": true,\n      \"dependencies\": {\n        \"graceful-fs\": \"^4.1.2\",\n        \"js-yaml\": \"^3.4.3\",\n        \"minimist\": \"^1.2.0\",\n        \"object-assign\": \"^4.0.1\",\n        \"os-homedir\": \"^1.0.1\",\n        \"parse-json\": \"^2.2.0\",\n        \"pinkie-promise\": \"^2.0.0\",\n        \"require-from-string\": \"^1.1.0\"\n      }\n    },\n    \"node_modules/cosmiconfig/node_modules/minimist\": {\n      \"version\": \"1.2.0\",\n      \"resolved\": \"https://registry.npmjs.org/minimist/-/minimist-1.2.0.tgz\",\n      \"integrity\": \"sha1-o1AIsg9BOD7sH7kU9M1d95omQoQ=\",\n      \"dev\": true\n    },\n    \"node_modules/cross-spawn\": {\n      \"version\": \"5.1.0\",\n      \"resolved\": \"https://registry.npmjs.org/cross-spawn/-/cross-spawn-5.1.0.tgz\",\n      \"integrity\": \"sha1-6L0O/uWPz/b4+UUQoKVUu/ojVEk=\",\n      \"dev\": true,\n      \"dependencies\": {\n        \"lru-cache\": \"^4.0.1\",\n        \"shebang-command\": \"^1.2.0\",\n        \"which\": \"^1.2.9\"\n      }\n    },\n    \"node_modules/cross-spawn/node_modules/lru-cache\": {\n      \"version\": \"4.1.1\",\n      \"resolved\": \"https://registry.npmjs.org/lru-cache/-/lru-cache-4.1.1.tgz\",\n      \"integrity\": \"sha512-q4spe4KTfsAS1SUHLO0wz8Qiyf1+vMIAgpRYioFYDMNqKfHQbg+AVDH3i4fvpl71/P1L0dBl+fQi+P37UYf0ew==\",\n      \"dev\": true,\n      \"dependencies\": {\n        \"pseudomap\": \"^1.0.2\",\n        \"yallist\": \"^2.1.2\"\n      }\n    },\n    \"node_modules/currently-unhandled\": {\n      \"version\": \"0.4.1\",\n      \"resolved\": \"https://registry.npmjs.org/currently-unhandled/-/currently-unhandled-0.4.1.tgz\",\n      \"integrity\": \"sha1-mI3zP+qxke95mmE2nddsF635V+o=\",\n      \"dev\": true,\n      \"dependencies\": {\n        \"array-find-index\": \"^1.0.1\"\n      },\n      \"engines\": {\n        \"node\": \">=0.10.0\"\n      }\n    },\n    \"node_modules/d\": {\n      \"version\": \"1.0.0\",\n      \"resolved\": \"https://registry.npmjs.org/d/-/d-1.0.0.tgz\",\n      \"integrity\": \"sha1-dUu1v+VUUdpppYuU1F9MWwRi1Y8=\",\n      \"dev\": true,\n      \"dependencies\": {\n        \"es5-ext\": \"^0.10.9\"\n      }\n    },\n    \"node_modules/date-fns\": {\n      \"version\": \"1.28.5\",\n      \"resolved\": \"https://registry.npmjs.org/date-fns/-/date-fns-1.28.5.tgz\",\n      \"integrity\": \"sha1-JXz8RdMi30XvVlhmWWfuhBzXP68=\",\n      \"dev\": true\n    },\n    \"node_modules/dateformat\": {\n      \"version\": \"2.0.0\",\n      \"resolved\": \"https://registry.npmjs.org/dateformat/-/dateformat-2.0.0.tgz\",\n      \"integrity\": \"sha1-J0Pjq7XD/CRi5SfcpEXgTp9N7hc=\",\n      \"dev\": true,\n      \"engines\": {\n        \"node\": \"*\"\n      }\n    },\n    \"node_modules/debug\": {\n      \"version\": \"2.6.8\",\n      \"resolved\": \"https://registry.npmjs.org/debug/-/debug-2.6.8.tgz\",\n      \"integrity\": \"sha1-5zFTHKLt4n0YgiJCfaF4IdaP9Pw=\",\n      \"dev\": true,\n      \"dependencies\": {\n        \"ms\": \"2.0.0\"\n      }\n    },\n    \"node_modules/decamelize\": {\n      \"version\": \"1.2.0\",\n      \"resolved\": \"https://registry.npmjs.org/decamelize/-/decamelize-1.2.0.tgz\",\n      \"integrity\": \"sha1-9lNNFRSCabIDUue+4m9QH5oZEpA=\",\n      \"dev\": true,\n      \"engines\": {\n        \"node\": \">=0.10.0\"\n      }\n    },\n    \"node_modules/deep-is\": {\n      \"version\": \"0.1.3\",\n      \"resolved\": \"https://registry.npmjs.org/deep-is/-/deep-is-0.1.3.tgz\",\n      \"integrity\": \"sha1-s2nW+128E+7PUk+RsHD+7cNXzzQ=\",\n      \"dev\": true\n    },\n    \"node_modules/defaults\": {\n      \"version\": \"1.0.3\",\n      \"resolved\": \"https://registry.npmjs.org/defaults/-/defaults-1.0.3.tgz\",\n      \"integrity\": \"sha1-xlYFHpgX2f8I7YgUd/P+QBnz730=\",\n      \"dev\": true,\n      \"dependencies\": {\n        \"clone\": \"^1.0.2\"\n      }\n    },\n    \"node_modules/del\": {\n      \"version\": \"2.2.2\",\n      \"resolved\": \"https://registry.npmjs.org/del/-/del-2.2.2.tgz\",\n      \"integrity\": \"sha1-wSyYHQZ4RshLyvhiz/kw2Qf/0ag=\",\n      \"dev\": true,\n      \"dependencies\": {\n        \"globby\": \"^5.0.0\",\n        \"is-path-cwd\": \"^1.0.0\",\n        \"is-path-in-cwd\": \"^1.0.0\",\n        \"object-assign\": \"^4.0.1\",\n        \"pify\": \"^2.0.0\",\n        \"pinkie-promise\": \"^2.0.0\",\n        \"rimraf\": \"^2.2.8\"\n      },\n      \"engines\": {\n        \"node\": \">=0.10.0\"\n      }\n    },\n    \"node_modules/depd\": {\n      \"version\": \"1.1.1\",\n      \"resolved\": \"https://registry.npmjs.org/depd/-/depd-1.1.1.tgz\",\n      \"integrity\": \"sha1-V4O04cRZ8G+lyif5kfPQbnoxA1k=\",\n      \"dev\": true,\n      \"engines\": {\n        \"node\": \">= 0.6\"\n      }\n    },\n    \"node_modules/deprecated\": {\n      \"version\": \"0.0.1\",\n      \"resolved\": \"https://registry.npmjs.org/deprecated/-/deprecated-0.0.1.tgz\",\n      \"integrity\": \"sha1-+cmvVGSvoeepcUWKi97yqpTVuxk=\",\n      \"dev\": true,\n      \"engines\": {\n        \"node\": \">= 0.9\"\n      }\n    },\n    \"node_modules/destroy\": {\n      \"version\": \"1.0.4\",\n      \"resolved\": \"https://registry.npmjs.org/destroy/-/destroy-1.0.4.tgz\",\n      \"integrity\": \"sha1-l4hXRCxEdJ5CBmE+N5RiBYJqvYA=\",\n      \"dev\": true\n    },\n    \"node_modules/detect-file\": {\n      \"version\": \"0.1.0\",\n      \"resolved\": \"https://registry.npmjs.org/detect-file/-/detect-file-0.1.0.tgz\",\n      \"integrity\": \"sha1-STXe39lIhkjgBrASlWbpOGcR6mM=\",\n      \"dev\": true,\n      \"dependencies\": {\n        \"fs-exists-sync\": \"^0.1.0\"\n      },\n      \"engines\": {\n        \"node\": \">=0.10.0\"\n      }\n    },\n    \"node_modules/detect-indent\": {\n      \"version\": \"4.0.0\",\n      \"resolved\": \"https://registry.npmjs.org/detect-indent/-/detect-indent-4.0.0.tgz\",\n      \"integrity\": \"sha1-920GQ1LN9Docts5hnE7jqUdd4gg=\",\n      \"dev\": true,\n      \"dependencies\": {\n        \"repeating\": \"^2.0.0\"\n      },\n      \"engines\": {\n        \"node\": \">=0.10.0\"\n      }\n    },\n    \"node_modules/doctrine\": {\n      \"version\": \"2.0.0\",\n      \"resolved\": \"https://registry.npmjs.org/doctrine/-/doctrine-2.0.0.tgz\",\n      \"integrity\": \"sha1-xz2NKQnSIpHhoAejlYBNqLZl/mM=\",\n      \"dev\": true,\n      \"dependencies\": {\n        \"esutils\": \"^2.0.2\",\n        \"isarray\": \"^1.0.0\"\n      },\n      \"engines\": {\n        \"node\": \">=0.10.0\"\n      }\n    },\n    \"node_modules/duplexer2\": {\n      \"version\": \"0.0.2\",\n      \"resolved\": \"https://registry.npmjs.org/duplexer2/-/duplexer2-0.0.2.tgz\",\n      \"integrity\": \"sha1-xhTc9n4vsUmVqRcR5aYX6KYKMds=\",\n      \"dev\": true,\n      \"dependencies\": {\n        \"readable-stream\": \"~1.1.9\"\n      }\n    },\n    \"node_modules/duplexer2/node_modules/isarray\": {\n      \"version\": \"0.0.1\",\n      \"resolved\": \"https://registry.npmjs.org/isarray/-/isarray-0.0.1.tgz\",\n      \"integrity\": \"sha1-ihis/Kmo9Bd+Cav8YDiTmwXR7t8=\",\n      \"dev\": true\n    },\n    \"node_modules/duplexer2/node_modules/readable-stream\": {\n      \"version\": \"1.1.14\",\n      \"resolved\": \"https://registry.npmjs.org/readable-stream/-/readable-stream-1.1.14.tgz\",\n      \"integrity\": \"sha1-fPTFTvZI44EwhMY23SB54WbAgdk=\",\n      \"dev\": true,\n      \"dependencies\": {\n        \"core-util-is\": \"~1.0.0\",\n        \"inherits\": \"~2.0.1\",\n        \"isarray\": \"0.0.1\",\n        \"string_decoder\": \"~0.10.x\"\n      }\n    },\n    \"node_modules/duplexer2/node_modules/string_decoder\": {\n      \"version\": \"0.10.31\",\n      \"resolved\": \"https://registry.npmjs.org/string_decoder/-/string_decoder-0.10.31.tgz\",\n      \"integrity\": \"sha1-YuIDvEF2bGwoyfyEMB2rHFMQ+pQ=\",\n      \"dev\": true\n    },\n    \"node_modules/ee-first\": {\n      \"version\": \"1.1.1\",\n      \"resolved\": \"https://registry.npmjs.org/ee-first/-/ee-first-1.1.1.tgz\",\n      \"integrity\": \"sha1-WQxhFWsK4vTwJVcyoViyZrxWsh0=\",\n      \"dev\": true\n    },\n    \"node_modules/elegant-spinner\": {\n      \"version\": \"1.0.1\",\n      \"resolved\": \"https://registry.npmjs.org/elegant-spinner/-/elegant-spinner-1.0.1.tgz\",\n      \"integrity\": \"sha1-2wQ1IcldfjA/2PNFvtwzSc+wcp4=\",\n      \"dev\": true,\n      \"engines\": {\n        \"node\": \">=0.10.0\"\n      }\n    },\n    \"node_modules/encodeurl\": {\n      \"version\": \"1.0.1\",\n      \"resolved\": \"https://registry.npmjs.org/encodeurl/-/encodeurl-1.0.1.tgz\",\n      \"integrity\": \"sha1-eePVhlU0aQn+bw9Fpd5oEDspTSA=\",\n      \"dev\": true,\n      \"engines\": {\n        \"node\": \">= 0.8\"\n      }\n    },\n    \"node_modules/end-of-stream\": {\n      \"version\": \"0.1.5\",\n      \"resolved\": \"https://registry.npmjs.org/end-of-stream/-/end-of-stream-0.1.5.tgz\",\n      \"integrity\": \"sha1-jhdyBsPICDfYVjLouTWd/osvbq8=\",\n      \"dev\": true,\n      \"dependencies\": {\n        \"once\": \"~1.3.0\"\n      }\n    },\n    \"node_modules/end-of-stream/node_modules/once\": {\n      \"version\": \"1.3.3\",\n      \"resolved\": \"https://registry.npmjs.org/once/-/once-1.3.3.tgz\",\n      \"integrity\": \"sha1-suJhVXzkwxTsgwTz+oJmPkKXyiA=\",\n      \"dev\": true,\n      \"dependencies\": {\n        \"wrappy\": \"1\"\n      }\n    },\n    \"node_modules/error-ex\": {\n      \"version\": \"1.3.1\",\n      \"resolved\": \"https://registry.npmjs.org/error-ex/-/error-ex-1.3.1.tgz\",\n      \"integrity\": \"sha1-+FWobOYa3E6GIcPNoh56dhLDqNw=\",\n      \"dev\": true,\n      \"dependencies\": {\n        \"is-arrayish\": \"^0.2.1\"\n      }\n    },\n    \"node_modules/es5-ext\": {\n      \"version\": \"0.10.30\",\n      \"resolved\": \"https://registry.npmjs.org/es5-ext/-/es5-ext-0.10.30.tgz\",\n      \"integrity\": \"sha1-cUGhaDZpfbq/qq7uQUlc4p9SyTk=\",\n      \"dev\": true,\n      \"dependencies\": {\n        \"es6-iterator\": \"2\",\n        \"es6-symbol\": \"~3.1\"\n      }\n    },\n    \"node_modules/es6-iterator\": {\n      \"version\": \"2.0.1\",\n      \"resolved\": \"https://registry.npmjs.org/es6-iterator/-/es6-iterator-2.0.1.tgz\",\n      \"integrity\": \"sha1-jjGcnwRTv1ddN0lAplWSDlnKVRI=\",\n      \"dev\": true,\n      \"dependencies\": {\n        \"d\": \"1\",\n        \"es5-ext\": \"^0.10.14\",\n        \"es6-symbol\": \"^3.1\"\n      }\n    },\n    \"node_modules/es6-map\": {\n      \"version\": \"0.1.5\",\n      \"resolved\": \"https://registry.npmjs.org/es6-map/-/es6-map-0.1.5.tgz\",\n      \"integrity\": \"sha1-kTbgUD3MBqMBaQ8LsU/042TpSfA=\",\n      \"dev\": true,\n      \"dependencies\": {\n        \"d\": \"1\",\n        \"es5-ext\": \"~0.10.14\",\n        \"es6-iterator\": \"~2.0.1\",\n        \"es6-set\": \"~0.1.5\",\n        \"es6-symbol\": \"~3.1.1\",\n        \"event-emitter\": \"~0.3.5\"\n      }\n    },\n    \"node_modules/es6-set\": {\n      \"version\": \"0.1.5\",\n      \"resolved\": \"https://registry.npmjs.org/es6-set/-/es6-set-0.1.5.tgz\",\n      \"integrity\": \"sha1-0rPsXU2ADO2BjbU40ol02wpzzLE=\",\n      \"dev\": true,\n      \"dependencies\": {\n        \"d\": \"1\",\n        \"es5-ext\": \"~0.10.14\",\n        \"es6-iterator\": \"~2.0.1\",\n        \"es6-symbol\": \"3.1.1\",\n        \"event-emitter\": \"~0.3.5\"\n      }\n    },\n    \"node_modules/es6-symbol\": {\n      \"version\": \"3.1.1\",\n      \"resolved\": \"https://registry.npmjs.org/es6-symbol/-/es6-symbol-3.1.1.tgz\",\n      \"integrity\": \"sha1-vwDvT9q2uhtG7Le2KbTH7VcVzHc=\",\n      \"dev\": true,\n      \"dependencies\": {\n        \"d\": \"1\",\n        \"es5-ext\": \"~0.10.14\"\n      }\n    },\n    \"node_modules/es6-weak-map\": {\n      \"version\": \"2.0.2\",\n      \"resolved\": \"https://registry.npmjs.org/es6-weak-map/-/es6-weak-map-2.0.2.tgz\",\n      \"integrity\": \"sha1-XjqzIlH/0VOKH45f+hNXdy+S2W8=\",\n      \"dev\": true,\n      \"dependencies\": {\n        \"d\": \"1\",\n        \"es5-ext\": \"^0.10.14\",\n        \"es6-iterator\": \"^2.0.1\",\n        \"es6-symbol\": \"^3.1.1\"\n      }\n    },\n    \"node_modules/escape-html\": {\n      \"version\": \"1.0.3\",\n      \"resolved\": \"https://registry.npmjs.org/escape-html/-/escape-html-1.0.3.tgz\",\n      \"integrity\": \"sha1-Aljq5NPQwJdN4cFpGI7wBR0dGYg=\",\n      \"dev\": true\n    },\n    \"node_modules/escape-string-regexp\": {\n      \"version\": \"1.0.5\",\n      \"resolved\": \"https://registry.npmjs.org/escape-string-regexp/-/escape-string-regexp-1.0.5.tgz\",\n      \"integrity\": \"sha1-G2HAViGQqN/2rjuyzwIAyhMLhtQ=\",\n      \"dev\": true,\n      \"engines\": {\n        \"node\": \">=0.8.0\"\n      }\n    },\n    \"node_modules/escope\": {\n      \"version\": \"3.6.0\",\n      \"resolved\": \"https://registry.npmjs.org/escope/-/escope-3.6.0.tgz\",\n      \"integrity\": \"sha1-4Bl16BJ4GhY6ba392AOY3GTIicM=\",\n      \"dev\": true,\n      \"dependencies\": {\n        \"es6-map\": \"^0.1.3\",\n        \"es6-weak-map\": \"^2.0.1\",\n        \"esrecurse\": \"^4.1.0\",\n        \"estraverse\": \"^4.1.1\"\n      },\n      \"engines\": {\n        \"node\": \">=0.4.0\"\n      }\n    },\n    \"node_modules/eslint\": {\n      \"version\": \"3.19.0\",\n      \"resolved\": \"https://registry.npmjs.org/eslint/-/eslint-3.19.0.tgz\",\n      \"integrity\": \"sha1-yPxiAcf0DdCJQbh8CFdnOGpnmsw=\",\n      \"dev\": true,\n      \"dependencies\": {\n        \"babel-code-frame\": \"^6.16.0\",\n        \"chalk\": \"^1.1.3\",\n        \"concat-stream\": \"^1.5.2\",\n        \"debug\": \"^2.1.1\",\n        \"doctrine\": \"^2.0.0\",\n        \"escope\": \"^3.6.0\",\n        \"espree\": \"^3.4.0\",\n        \"esquery\": \"^1.0.0\",\n        \"estraverse\": \"^4.2.0\",\n        \"esutils\": \"^2.0.2\",\n        \"file-entry-cache\": \"^2.0.0\",\n        \"glob\": \"^7.0.3\",\n        \"globals\": \"^9.14.0\",\n        \"ignore\": \"^3.2.0\",\n        \"imurmurhash\": \"^0.1.4\",\n        \"inquirer\": \"^0.12.0\",\n        \"is-my-json-valid\": \"^2.10.0\",\n        \"is-resolvable\": \"^1.0.0\",\n        \"js-yaml\": \"^3.5.1\",\n        \"json-stable-stringify\": \"^1.0.0\",\n        \"levn\": \"^0.3.0\",\n        \"lodash\": \"^4.0.0\",\n        \"mkdirp\": \"^0.5.0\",\n        \"natural-compare\": \"^1.4.0\",\n        \"optionator\": \"^0.8.2\",\n        \"path-is-inside\": \"^1.0.1\",\n        \"pluralize\": \"^1.2.1\",\n        \"progress\": \"^1.1.8\",\n        \"require-uncached\": \"^1.0.2\",\n        \"shelljs\": \"^0.7.5\",\n        \"strip-bom\": \"^3.0.0\",\n        \"strip-json-comments\": \"~2.0.1\",\n        \"table\": \"^3.7.8\",\n        \"text-table\": \"~0.2.0\",\n        \"user-home\": \"^2.0.0\"\n      },\n      \"bin\": {\n        \"eslint\": \"bin/eslint.js\"\n      },\n      \"engines\": {\n        \"node\": \">=4\"\n      }\n    },\n    \"node_modules/espree\": {\n      \"version\": \"3.5.0\",\n      \"resolved\": \"https://registry.npmjs.org/espree/-/espree-3.5.0.tgz\",\n      \"integrity\": \"sha1-mDWGJb3QVYYeon4oZ+pyn69GPY0=\",\n      \"dev\": true,\n      \"dependencies\": {\n        \"acorn\": \"^5.1.1\",\n        \"acorn-jsx\": \"^3.0.0\"\n      },\n      \"engines\": {\n        \"node\": \">=0.10.0\"\n      }\n    },\n    \"node_modules/esprima\": {\n      \"version\": \"4.0.0\",\n      \"resolved\": \"https://registry.npmjs.org/esprima/-/esprima-4.0.0.tgz\",\n      \"integrity\": \"sha512-oftTcaMu/EGrEIu904mWteKIv8vMuOgGYo7EhVJJN00R/EED9DCua/xxHRdYnKtcECzVg7xOWhflvJMnqcFZjw==\",\n      \"dev\": true,\n      \"bin\": {\n        \"esparse\": \"bin/esparse.js\",\n        \"esvalidate\": \"bin/esvalidate.js\"\n      },\n      \"engines\": {\n        \"node\": \">=4\"\n      }\n    },\n    \"node_modules/esquery\": {\n      \"version\": \"1.0.0\",\n      \"resolved\": \"https://registry.npmjs.org/esquery/-/esquery-1.0.0.tgz\",\n      \"integrity\": \"sha1-z7qLV9f7qT8XKYqKAGoEzaE9gPo=\",\n      \"dev\": true,\n      \"dependencies\": {\n        \"estraverse\": \"^4.0.0\"\n      },\n      \"engines\": {\n        \"node\": \">=0.6\"\n      }\n    },\n    \"node_modules/esrecurse\": {\n      \"version\": \"4.2.0\",\n      \"resolved\": \"https://registry.npmjs.org/esrecurse/-/esrecurse-4.2.0.tgz\",\n      \"integrity\": \"sha1-+pVo2Y04I/mkHZHpAtyrnqblsWM=\",\n      \"dev\": true,\n      \"dependencies\": {\n        \"estraverse\": \"^4.1.0\",\n        \"object-assign\": \"^4.0.1\"\n      },\n      \"engines\": {\n        \"node\": \">=0.10.0\"\n      }\n    },\n    \"node_modules/estraverse\": {\n      \"version\": \"4.2.0\",\n      \"resolved\": \"https://registry.npmjs.org/estraverse/-/estraverse-4.2.0.tgz\",\n      \"integrity\": \"sha1-De4/7TH81GlhjOc0IJn8GvoL2xM=\",\n      \"dev\": true,\n      \"engines\": {\n        \"node\": \">=0.10.0\"\n      }\n    },\n    \"node_modules/estree-walker\": {\n      \"version\": \"0.2.1\",\n      \"resolved\": \"https://registry.npmjs.org/estree-walker/-/estree-walker-0.2.1.tgz\",\n      \"integrity\": \"sha1-va/oCVOD2EFNXcLs9MkXO225QS4=\",\n      \"dev\": true\n    },\n    \"node_modules/esutils\": {\n      \"version\": \"2.0.2\",\n      \"resolved\": \"https://registry.npmjs.org/esutils/-/esutils-2.0.2.tgz\",\n      \"integrity\": \"sha1-Cr9PHKpbyx96nYrMbepPqqBLrJs=\",\n      \"dev\": true,\n      \"engines\": {\n        \"node\": \">=0.10.0\"\n      }\n    },\n    \"node_modules/etag\": {\n      \"version\": \"1.8.0\",\n      \"resolved\": \"https://registry.npmjs.org/etag/-/etag-1.8.0.tgz\",\n      \"integrity\": \"sha1-b2Ma7zNtbEY2K1F2QETOIWvjwFE=\",\n      \"dev\": true,\n      \"engines\": {\n        \"node\": \">= 0.6\"\n      }\n    },\n    \"node_modules/event-emitter\": {\n      \"version\": \"0.3.5\",\n      \"resolved\": \"https://registry.npmjs.org/event-emitter/-/event-emitter-0.3.5.tgz\",\n      \"integrity\": \"sha1-34xp7vFkeSPHFXuc6DhAYQsCzDk=\",\n      \"dev\": true,\n      \"dependencies\": {\n        \"d\": \"1\",\n        \"es5-ext\": \"~0.10.14\"\n      }\n    },\n    \"node_modules/execa\": {\n      \"version\": \"0.8.0\",\n      \"resolved\": \"https://registry.npmjs.org/execa/-/execa-0.8.0.tgz\",\n      \"integrity\": \"sha1-2NdrvBtVIX7RkP1t1J08d07PyNo=\",\n      \"dev\": true,\n      \"dependencies\": {\n        \"cross-spawn\": \"^5.0.1\",\n        \"get-stream\": \"^3.0.0\",\n        \"is-stream\": \"^1.1.0\",\n        \"npm-run-path\": \"^2.0.0\",\n        \"p-finally\": \"^1.0.0\",\n        \"signal-exit\": \"^3.0.0\",\n        \"strip-eof\": \"^1.0.0\"\n      },\n      \"engines\": {\n        \"node\": \">=4\"\n      }\n    },\n    \"node_modules/exit-hook\": {\n      \"version\": \"1.1.1\",\n      \"resolved\": \"https://registry.npmjs.org/exit-hook/-/exit-hook-1.1.1.tgz\",\n      \"integrity\": \"sha1-8FyiM7SMBdVP/wd2XfhQfpXAL/g=\",\n      \"dev\": true,\n      \"engines\": {\n        \"node\": \">=0.10.0\"\n      }\n    },\n    \"node_modules/expand-brackets\": {\n      \"version\": \"0.1.5\",\n      \"resolved\": \"https://registry.npmjs.org/expand-brackets/-/expand-brackets-0.1.5.tgz\",\n      \"integrity\": \"sha1-3wcoTjQqgHzXM6xa9yQR5YHRF3s=\",\n      \"dev\": true,\n      \"dependencies\": {\n        \"is-posix-bracket\": \"^0.1.0\"\n      },\n      \"engines\": {\n        \"node\": \">=0.10.0\"\n      }\n    },\n    \"node_modules/expand-range\": {\n      \"version\": \"1.8.2\",\n      \"resolved\": \"https://registry.npmjs.org/expand-range/-/expand-range-1.8.2.tgz\",\n      \"integrity\": \"sha1-opnv/TNf4nIeuujiV+x5ZE/IUzc=\",\n      \"dev\": true,\n      \"dependencies\": {\n        \"fill-range\": \"^2.1.0\"\n      },\n      \"engines\": {\n        \"node\": \">=0.10.0\"\n      }\n    },\n    \"node_modules/expand-tilde\": {\n      \"version\": \"1.2.2\",\n      \"resolved\": \"https://registry.npmjs.org/expand-tilde/-/expand-tilde-1.2.2.tgz\",\n      \"integrity\": \"sha1-C4HrqJflo9MdHD0QL48BRB5VlEk=\",\n      \"dev\": true,\n      \"dependencies\": {\n        \"os-homedir\": \"^1.0.1\"\n      },\n      \"engines\": {\n        \"node\": \">=0.10.0\"\n      }\n    },\n    \"node_modules/extend\": {\n      \"version\": \"3.0.1\",\n      \"resolved\": \"https://registry.npmjs.org/extend/-/extend-3.0.1.tgz\",\n      \"integrity\": \"sha1-p1Xqe8Gt/MWjHOfnYtuq3F5jZEQ=\",\n      \"dev\": true\n    },\n    \"node_modules/extglob\": {\n      \"version\": \"0.3.2\",\n      \"resolved\": \"https://registry.npmjs.org/extglob/-/extglob-0.3.2.tgz\",\n      \"integrity\": \"sha1-Lhj/PS9JqydlzskCPwEdqo2DSaE=\",\n      \"dev\": true,\n      \"dependencies\": {\n        \"is-extglob\": \"^1.0.0\"\n      },\n      \"engines\": {\n        \"node\": \">=0.10.0\"\n      }\n    },\n    \"node_modules/fancy-log\": {\n      \"version\": \"1.3.0\",\n      \"resolved\": \"https://registry.npmjs.org/fancy-log/-/fancy-log-1.3.0.tgz\",\n      \"integrity\": \"sha1-Rb4X0Cu5kX1gzP/UmVyZnmyMmUg=\",\n      \"dev\": true,\n      \"dependencies\": {\n        \"chalk\": \"^1.1.1\",\n        \"time-stamp\": \"^1.0.0\"\n      },\n      \"engines\": {\n        \"node\": \">= 0.10\"\n      }\n    },\n    \"node_modules/fast-levenshtein\": {\n      \"version\": \"2.0.6\",\n      \"resolved\": \"https://registry.npmjs.org/fast-levenshtein/-/fast-levenshtein-2.0.6.tgz\",\n      \"integrity\": \"sha1-PYpcZog6FqMMqGQ+hR8Zuqd5eRc=\",\n      \"dev\": true\n    },\n    \"node_modules/faye-websocket\": {\n      \"version\": \"0.7.3\",\n      \"resolved\": \"https://registry.npmjs.org/faye-websocket/-/faye-websocket-0.7.3.tgz\",\n      \"integrity\": \"sha1-zEB0x/Sk39A69U3WXDVLE1EyzhE=\",\n      \"dev\": true,\n      \"dependencies\": {\n        \"websocket-driver\": \">=0.3.6\"\n      },\n      \"engines\": {\n        \"node\": \">=0.4.0\"\n      }\n    },\n    \"node_modules/figures\": {\n      \"version\": \"1.7.0\",\n      \"resolved\": \"https://registry.npmjs.org/figures/-/figures-1.7.0.tgz\",\n      \"integrity\": \"sha1-y+Hjr/zxzUS4DK3+0o3Hk6lwHS4=\",\n      \"dev\": true,\n      \"dependencies\": {\n        \"escape-string-regexp\": \"^1.0.5\",\n        \"object-assign\": \"^4.1.0\"\n      },\n      \"engines\": {\n        \"node\": \">=0.10.0\"\n      }\n    },\n    \"node_modules/file-entry-cache\": {\n      \"version\": \"2.0.0\",\n      \"resolved\": \"https://registry.npmjs.org/file-entry-cache/-/file-entry-cache-2.0.0.tgz\",\n      \"integrity\": \"sha1-w5KZDD5oR4PYOLjISkXYoEhFg2E=\",\n      \"dev\": true,\n      \"dependencies\": {\n        \"flat-cache\": \"^1.2.1\",\n        \"object-assign\": \"^4.0.1\"\n      },\n      \"engines\": {\n        \"node\": \">=0.10.0\"\n      }\n    },\n    \"node_modules/filename-regex\": {\n      \"version\": \"2.0.1\",\n      \"resolved\": \"https://registry.npmjs.org/filename-regex/-/filename-regex-2.0.1.tgz\",\n      \"integrity\": \"sha1-wcS5vuPglyXdsQa3XB4wH+LxiyY=\",\n      \"dev\": true,\n      \"engines\": {\n        \"node\": \">=0.10.0\"\n      }\n    },\n    \"node_modules/fill-range\": {\n      \"version\": \"2.2.3\",\n      \"resolved\": \"https://registry.npmjs.org/fill-range/-/fill-range-2.2.3.tgz\",\n      \"integrity\": \"sha1-ULd9/X5Gm8dJJHCWNpn+eoSFpyM=\",\n      \"dev\": true,\n      \"dependencies\": {\n        \"is-number\": \"^2.1.0\",\n        \"isobject\": \"^2.0.0\",\n        \"randomatic\": \"^1.1.3\",\n        \"repeat-element\": \"^1.1.2\",\n        \"repeat-string\": \"^1.5.2\"\n      },\n      \"engines\": {\n        \"node\": \">=0.10.0\"\n      }\n    },\n    \"node_modules/finalhandler\": {\n      \"version\": \"1.0.4\",\n      \"resolved\": \"https://registry.npmjs.org/finalhandler/-/finalhandler-1.0.4.tgz\",\n      \"integrity\": \"sha512-16l/r8RgzlXKmFOhZpHBztvye+lAhC5SU7hXavnerC9UfZqZxxXl3BzL8MhffPT3kF61lj9Oav2LKEzh0ei7tg==\",\n      \"dev\": true,\n      \"dependencies\": {\n        \"debug\": \"2.6.8\",\n        \"encodeurl\": \"~1.0.1\",\n        \"escape-html\": \"~1.0.3\",\n        \"on-finished\": \"~2.3.0\",\n        \"parseurl\": \"~1.3.1\",\n        \"statuses\": \"~1.3.1\",\n        \"unpipe\": \"~1.0.0\"\n      },\n      \"engines\": {\n        \"node\": \">= 0.8\"\n      }\n    },\n    \"node_modules/find-index\": {\n      \"version\": \"0.1.1\",\n      \"resolved\": \"https://registry.npmjs.org/find-index/-/find-index-0.1.1.tgz\",\n      \"integrity\": \"sha1-Z101iyyjiS15Whq0cjL4tuLg3eQ=\",\n      \"dev\": true\n    },\n    \"node_modules/find-replace\": {\n      \"version\": \"1.0.3\",\n      \"resolved\": \"https://registry.npmjs.org/find-replace/-/find-replace-1.0.3.tgz\",\n      \"integrity\": \"sha1-uI5zZNLZyVlVnziMZmcNYTBEH6A=\",\n      \"dev\": true,\n      \"dependencies\": {\n        \"array-back\": \"^1.0.4\",\n        \"test-value\": \"^2.1.0\"\n      },\n      \"engines\": {\n        \"node\": \">=4.0.0\"\n      }\n    },\n    \"node_modules/find-replace/node_modules/array-back\": {\n      \"version\": \"1.0.4\",\n      \"resolved\": \"https://registry.npmjs.org/array-back/-/array-back-1.0.4.tgz\",\n      \"integrity\": \"sha1-ZEun8JX3/898Q7Xw3DnTwfA8Bjs=\",\n      \"dev\": true,\n      \"dependencies\": {\n        \"typical\": \"^2.6.0\"\n      },\n      \"engines\": {\n        \"node\": \">=0.12.0\"\n      }\n    },\n    \"node_modules/find-up\": {\n      \"version\": \"1.1.2\",\n      \"resolved\": \"https://registry.npmjs.org/find-up/-/find-up-1.1.2.tgz\",\n      \"integrity\": \"sha1-ay6YIrGizgpgq2TWEOzK1TyyTQ8=\",\n      \"dev\": true,\n      \"dependencies\": {\n        \"path-exists\": \"^2.0.0\",\n        \"pinkie-promise\": \"^2.0.0\"\n      },\n      \"engines\": {\n        \"node\": \">=0.10.0\"\n      }\n    },\n    \"node_modules/findup-sync\": {\n      \"version\": \"0.4.3\",\n      \"resolved\": \"https://registry.npmjs.org/findup-sync/-/findup-sync-0.4.3.tgz\",\n      \"integrity\": \"sha1-QAQ5Kee8YK3wt/SCfExudaDeyhI=\",\n      \"dev\": true,\n      \"dependencies\": {\n        \"detect-file\": \"^0.1.0\",\n        \"is-glob\": \"^2.0.1\",\n        \"micromatch\": \"^2.3.7\",\n        \"resolve-dir\": \"^0.1.0\"\n      },\n      \"engines\": {\n        \"node\": \">= 0.8.0\"\n      }\n    },\n    \"node_modules/fined\": {\n      \"version\": \"1.1.0\",\n      \"resolved\": \"https://registry.npmjs.org/fined/-/fined-1.1.0.tgz\",\n      \"integrity\": \"sha1-s33IRLdqL15wgeiE98CuNE8VNHY=\",\n      \"dev\": true,\n      \"dependencies\": {\n        \"expand-tilde\": \"^2.0.2\",\n        \"is-plain-object\": \"^2.0.3\",\n        \"object.defaults\": \"^1.1.0\",\n        \"object.pick\": \"^1.2.0\",\n        \"parse-filepath\": \"^1.0.1\"\n      },\n      \"engines\": {\n        \"node\": \">= 0.10\"\n      }\n    },\n    \"node_modules/fined/node_modules/expand-tilde\": {\n      \"version\": \"2.0.2\",\n      \"resolved\": \"https://registry.npmjs.org/expand-tilde/-/expand-tilde-2.0.2.tgz\",\n      \"integrity\": \"sha1-l+gBqgUt8CRU3kawK/YhZCzchQI=\",\n      \"dev\": true,\n      \"dependencies\": {\n        \"homedir-polyfill\": \"^1.0.1\"\n      },\n      \"engines\": {\n        \"node\": \">=0.10.0\"\n      }\n    },\n    \"node_modules/first-chunk-stream\": {\n      \"version\": \"1.0.0\",\n      \"resolved\": \"https://registry.npmjs.org/first-chunk-stream/-/first-chunk-stream-1.0.0.tgz\",\n      \"integrity\": \"sha1-Wb+1DNkF9g18OUzT2ayqtOatk04=\",\n      \"dev\": true,\n      \"engines\": {\n        \"node\": \">=0.10.0\"\n      }\n    },\n    \"node_modules/flagged-respawn\": {\n      \"version\": \"0.3.2\",\n      \"resolved\": \"https://registry.npmjs.org/flagged-respawn/-/flagged-respawn-0.3.2.tgz\",\n      \"integrity\": \"sha1-/xke3c1wiKZ1smEP/8l2vpuAdLU=\",\n      \"dev\": true,\n      \"engines\": {\n        \"node\": \">= 0.8.0\"\n      }\n    },\n    \"node_modules/flat-cache\": {\n      \"version\": \"1.2.2\",\n      \"resolved\": \"https://registry.npmjs.org/flat-cache/-/flat-cache-1.2.2.tgz\",\n      \"integrity\": \"sha1-+oZxTnLCHbiGAXYezy9VXRq8a5Y=\",\n      \"dev\": true,\n      \"dependencies\": {\n        \"circular-json\": \"^0.3.1\",\n        \"del\": \"^2.0.2\",\n        \"graceful-fs\": \"^4.1.2\",\n        \"write\": \"^0.2.1\"\n      },\n      \"engines\": {\n        \"node\": \">=0.10.0\"\n      }\n    },\n    \"node_modules/for-in\": {\n      \"version\": \"1.0.2\",\n      \"resolved\": \"https://registry.npmjs.org/for-in/-/for-in-1.0.2.tgz\",\n      \"integrity\": \"sha1-gQaNKVqBQuwKxybG4iAMMPttXoA=\",\n      \"dev\": true,\n      \"engines\": {\n        \"node\": \">=0.10.0\"\n      }\n    },\n    \"node_modules/for-own\": {\n      \"version\": \"0.1.5\",\n      \"resolved\": \"https://registry.npmjs.org/for-own/-/for-own-0.1.5.tgz\",\n      \"integrity\": \"sha1-UmXGgaTylNq78XyVCbZ2OqhFEM4=\",\n      \"dev\": true,\n      \"dependencies\": {\n        \"for-in\": \"^1.0.1\"\n      },\n      \"engines\": {\n        \"node\": \">=0.10.0\"\n      }\n    },\n    \"node_modules/fresh\": {\n      \"version\": \"0.5.0\",\n      \"resolved\": \"https://registry.npmjs.org/fresh/-/fresh-0.5.0.tgz\",\n      \"integrity\": \"sha1-9HTKXmqSRtb9jglTz6m5yAWvp44=\",\n      \"dev\": true,\n      \"engines\": {\n        \"node\": \">= 0.6\"\n      }\n    },\n    \"node_modules/fs-exists-sync\": {\n      \"version\": \"0.1.0\",\n      \"resolved\": \"https://registry.npmjs.org/fs-exists-sync/-/fs-exists-sync-0.1.0.tgz\",\n      \"integrity\": \"sha1-mC1ok6+RjnLQjeyehnP/K1qNat0=\",\n      \"dev\": true,\n      \"engines\": {\n        \"node\": \">=0.10.0\"\n      }\n    },\n    \"node_modules/fs.realpath\": {\n      \"version\": \"1.0.0\",\n      \"resolved\": \"https://registry.npmjs.org/fs.realpath/-/fs.realpath-1.0.0.tgz\",\n      \"integrity\": \"sha1-FQStJSMVjKpA20onh8sBQRmU6k8=\",\n      \"dev\": true\n    },\n    \"node_modules/fsevents\": {\n      \"version\": \"0.3.8\",\n      \"resolved\": \"https://registry.npmjs.org/fsevents/-/fsevents-0.3.8.tgz\",\n      \"integrity\": \"sha512-3vlmn1QaPoqSnhnorLFlp3+r3dUCZ8eZlaew+H8QhqB+0YBc9HSITh9wiZo76KYYExTC9DwG6otE/OzwbBLVIw==\",\n      \"deprecated\": \"\\\"Please update to latest v2.3 or v2.2\\\"\",\n      \"hasInstallScript\": true,\n      \"optional\": true,\n      \"os\": [\n        \"darwin\"\n      ],\n      \"dependencies\": {\n        \"nan\": \"^2.0.2\"\n      },\n      \"engines\": {\n        \"node\": \">=0.8.0\"\n      }\n    },\n    \"node_modules/gaze\": {\n      \"version\": \"0.5.2\",\n      \"resolved\": \"https://registry.npmjs.org/gaze/-/gaze-0.5.2.tgz\",\n      \"integrity\": \"sha1-QLcJU30k0dRXZ9takIaJ3+aaxE8=\",\n      \"dev\": true,\n      \"dependencies\": {\n        \"globule\": \"~0.1.0\"\n      },\n      \"engines\": {\n        \"node\": \">= 0.8.0\"\n      }\n    },\n    \"node_modules/generate-function\": {\n      \"version\": \"2.0.0\",\n      \"resolved\": \"https://registry.npmjs.org/generate-function/-/generate-function-2.0.0.tgz\",\n      \"integrity\": \"sha1-aFj+fAlpt9TpCTM3ZHrHn2DfvnQ=\",\n      \"dev\": true\n    },\n    \"node_modules/generate-object-property\": {\n      \"version\": \"1.2.0\",\n      \"resolved\": \"https://registry.npmjs.org/generate-object-property/-/generate-object-property-1.2.0.tgz\",\n      \"integrity\": \"sha1-nA4cQDCM6AT0eDYYuTf6iPmdUNA=\",\n      \"dev\": true,\n      \"dependencies\": {\n        \"is-property\": \"^1.0.0\"\n      }\n    },\n    \"node_modules/get-own-enumerable-property-symbols\": {\n      \"version\": \"2.0.1\",\n      \"resolved\": \"https://registry.npmjs.org/get-own-enumerable-property-symbols/-/get-own-enumerable-property-symbols-2.0.1.tgz\",\n      \"integrity\": \"sha512-TtY/sbOemiMKPRUDDanGCSgBYe7Mf0vbRsWnBZ+9yghpZ1MvcpSpuZFjHdEeY/LZjZy0vdLjS77L6HosisFiug==\",\n      \"dev\": true\n    },\n    \"node_modules/get-stdin\": {\n      \"version\": \"4.0.1\",\n      \"resolved\": \"https://registry.npmjs.org/get-stdin/-/get-stdin-4.0.1.tgz\",\n      \"integrity\": \"sha1-uWjGsKBDhDJJAui/Gl3zJXmkUP4=\",\n      \"dev\": true,\n      \"engines\": {\n        \"node\": \">=0.10.0\"\n      }\n    },\n    \"node_modules/get-stream\": {\n      \"version\": \"3.0.0\",\n      \"resolved\": \"https://registry.npmjs.org/get-stream/-/get-stream-3.0.0.tgz\",\n      \"integrity\": \"sha1-jpQ9E1jcN1VQVOy+LtsFqhdO3hQ=\",\n      \"dev\": true,\n      \"engines\": {\n        \"node\": \">=4\"\n      }\n    },\n    \"node_modules/glob\": {\n      \"version\": \"7.1.2\",\n      \"resolved\": \"https://registry.npmjs.org/glob/-/glob-7.1.2.tgz\",\n      \"integrity\": \"sha512-MJTUg1kjuLeQCJ+ccE4Vpa6kKVXkPYJ2mOCQyUuKLcLQsdrMCpBPUi8qVE6+YuaJkozeA9NusTAw3hLr8Xe5EQ==\",\n      \"deprecated\": \"Glob versions prior to v9 are no longer supported\",\n      \"dev\": true,\n      \"dependencies\": {\n        \"fs.realpath\": \"^1.0.0\",\n        \"inflight\": \"^1.0.4\",\n        \"inherits\": \"2\",\n        \"minimatch\": \"^3.0.4\",\n        \"once\": \"^1.3.0\",\n        \"path-is-absolute\": \"^1.0.0\"\n      },\n      \"engines\": {\n        \"node\": \"*\"\n      }\n    },\n    \"node_modules/glob-base\": {\n      \"version\": \"0.3.0\",\n      \"resolved\": \"https://registry.npmjs.org/glob-base/-/glob-base-0.3.0.tgz\",\n      \"integrity\": \"sha1-27Fk9iIbHAscz4Kuoyi0l98Oo8Q=\",\n      \"dev\": true,\n      \"dependencies\": {\n        \"glob-parent\": \"^2.0.0\",\n        \"is-glob\": \"^2.0.0\"\n      },\n      \"engines\": {\n        \"node\": \">=0.10.0\"\n      }\n    },\n    \"node_modules/glob-parent\": {\n      \"version\": \"2.0.0\",\n      \"resolved\": \"https://registry.npmjs.org/glob-parent/-/glob-parent-2.0.0.tgz\",\n      \"integrity\": \"sha1-gTg9ctsFT8zPUzbaqQLxgvbtuyg=\",\n      \"dev\": true,\n      \"dependencies\": {\n        \"is-glob\": \"^2.0.0\"\n      }\n    },\n    \"node_modules/glob-stream\": {\n      \"version\": \"3.1.18\",\n      \"resolved\": \"https://registry.npmjs.org/glob-stream/-/glob-stream-3.1.18.tgz\",\n      \"integrity\": \"sha1-kXCl8St5Awb9/lmPMT+PeVT9FDs=\",\n      \"dev\": true,\n      \"dependencies\": {\n        \"glob\": \"^4.3.1\",\n        \"glob2base\": \"^0.0.12\",\n        \"minimatch\": \"^2.0.1\",\n        \"ordered-read-streams\": \"^0.1.0\",\n        \"through2\": \"^0.6.1\",\n        \"unique-stream\": \"^1.0.0\"\n      },\n      \"engines\": {\n        \"node\": \">= 0.9\"\n      }\n    },\n    \"node_modules/glob-stream/node_modules/glob\": {\n      \"version\": \"4.5.3\",\n      \"resolved\": \"https://registry.npmjs.org/glob/-/glob-4.5.3.tgz\",\n      \"integrity\": \"sha1-xstz0yJsHv7wTePFbQEvAzd+4V8=\",\n      \"deprecated\": \"Glob versions prior to v9 are no longer supported\",\n      \"dev\": true,\n      \"dependencies\": {\n        \"inflight\": \"^1.0.4\",\n        \"inherits\": \"2\",\n        \"minimatch\": \"^2.0.1\",\n        \"once\": \"^1.3.0\"\n      },\n      \"engines\": {\n        \"node\": \"*\"\n      }\n    },\n    \"node_modules/glob-stream/node_modules/isarray\": {\n      \"version\": \"0.0.1\",\n      \"resolved\": \"https://registry.npmjs.org/isarray/-/isarray-0.0.1.tgz\",\n      \"integrity\": \"sha1-ihis/Kmo9Bd+Cav8YDiTmwXR7t8=\",\n      \"dev\": true\n    },\n    \"node_modules/glob-stream/node_modules/minimatch\": {\n      \"version\": \"2.0.10\",\n      \"resolved\": \"https://registry.npmjs.org/minimatch/-/minimatch-2.0.10.tgz\",\n      \"integrity\": \"sha1-jQh8OcazjAAbl/ynzm0OHoCvusc=\",\n      \"deprecated\": \"Please update to minimatch 3.0.2 or higher to avoid a RegExp DoS issue\",\n      \"dev\": true,\n      \"dependencies\": {\n        \"brace-expansion\": \"^1.0.0\"\n      },\n      \"engines\": {\n        \"node\": \"*\"\n      }\n    },\n    \"node_modules/glob-stream/node_modules/readable-stream\": {\n      \"version\": \"1.0.34\",\n      \"resolved\": \"https://registry.npmjs.org/readable-stream/-/readable-stream-1.0.34.tgz\",\n      \"integrity\": \"sha1-Elgg40vIQtLyqq+v5MKRbuMsFXw=\",\n      \"dev\": true,\n      \"dependencies\": {\n        \"core-util-is\": \"~1.0.0\",\n        \"inherits\": \"~2.0.1\",\n        \"isarray\": \"0.0.1\",\n        \"string_decoder\": \"~0.10.x\"\n      }\n    },\n    \"node_modules/glob-stream/node_modules/string_decoder\": {\n      \"version\": \"0.10.31\",\n      \"resolved\": \"https://registry.npmjs.org/string_decoder/-/string_decoder-0.10.31.tgz\",\n      \"integrity\": \"sha1-YuIDvEF2bGwoyfyEMB2rHFMQ+pQ=\",\n      \"dev\": true\n    },\n    \"node_modules/glob-stream/node_modules/through2\": {\n      \"version\": \"0.6.5\",\n      \"resolved\": \"https://registry.npmjs.org/through2/-/through2-0.6.5.tgz\",\n      \"integrity\": \"sha1-QaucZ7KdVyCQcUEOHXp6lozTrUg=\",\n      \"dev\": true,\n      \"dependencies\": {\n        \"readable-stream\": \">=1.0.33-1 <1.1.0-0\",\n        \"xtend\": \">=4.0.0 <4.1.0-0\"\n      }\n    },\n    \"node_modules/glob-watcher\": {\n      \"version\": \"0.0.6\",\n      \"resolved\": \"https://registry.npmjs.org/glob-watcher/-/glob-watcher-0.0.6.tgz\",\n      \"integrity\": \"sha1-uVtKjfdLOcgymLDAXJeLTZo7cQs=\",\n      \"dev\": true,\n      \"dependencies\": {\n        \"gaze\": \"^0.5.1\"\n      },\n      \"engines\": {\n        \"node\": \">= 0.9\"\n      }\n    },\n    \"node_modules/glob2base\": {\n      \"version\": \"0.0.12\",\n      \"resolved\": \"https://registry.npmjs.org/glob2base/-/glob2base-0.0.12.tgz\",\n      \"integrity\": \"sha1-nUGbPijxLoOjYhZKJ3BVkiycDVY=\",\n      \"dev\": true,\n      \"dependencies\": {\n        \"find-index\": \"^0.1.1\"\n      },\n      \"engines\": {\n        \"node\": \">= 0.10\"\n      }\n    },\n    \"node_modules/global-modules\": {\n      \"version\": \"0.2.3\",\n      \"resolved\": \"https://registry.npmjs.org/global-modules/-/global-modules-0.2.3.tgz\",\n      \"integrity\": \"sha1-6lo77ULG1s6ZWk+KEmm12uIjgo0=\",\n      \"dev\": true,\n      \"dependencies\": {\n        \"global-prefix\": \"^0.1.4\",\n        \"is-windows\": \"^0.2.0\"\n      },\n      \"engines\": {\n        \"node\": \">=0.10.0\"\n      }\n    },\n    \"node_modules/global-prefix\": {\n      \"version\": \"0.1.5\",\n      \"resolved\": \"https://registry.npmjs.org/global-prefix/-/global-prefix-0.1.5.tgz\",\n      \"integrity\": \"sha1-jTvGuNo8qBEqFg2NSW/wRiv+948=\",\n      \"dev\": true,\n      \"dependencies\": {\n        \"homedir-polyfill\": \"^1.0.0\",\n        \"ini\": \"^1.3.4\",\n        \"is-windows\": \"^0.2.0\",\n        \"which\": \"^1.2.12\"\n      },\n      \"engines\": {\n        \"node\": \">=0.10.0\"\n      }\n    },\n    \"node_modules/globals\": {\n      \"version\": \"9.18.0\",\n      \"resolved\": \"https://registry.npmjs.org/globals/-/globals-9.18.0.tgz\",\n      \"integrity\": \"sha512-S0nG3CLEQiY/ILxqtztTWH/3iRRdyBLw6KMDxnKMchrtbj2OFmehVh0WUCfW3DUrIgx/qFrJPICrq4Z4sTR9UQ==\",\n      \"dev\": true,\n      \"engines\": {\n        \"node\": \">=0.10.0\"\n      }\n    },\n    \"node_modules/globby\": {\n      \"version\": \"5.0.0\",\n      \"resolved\": \"https://registry.npmjs.org/globby/-/globby-5.0.0.tgz\",\n      \"integrity\": \"sha1-69hGZ8oNuzMLmbz8aOrCvFQ3Dg0=\",\n      \"dev\": true,\n      \"dependencies\": {\n        \"array-union\": \"^1.0.1\",\n        \"arrify\": \"^1.0.0\",\n        \"glob\": \"^7.0.3\",\n        \"object-assign\": \"^4.0.1\",\n        \"pify\": \"^2.0.0\",\n        \"pinkie-promise\": \"^2.0.0\"\n      },\n      \"engines\": {\n        \"node\": \">=0.10.0\"\n      }\n    },\n    \"node_modules/globule\": {\n      \"version\": \"0.1.0\",\n      \"resolved\": \"https://registry.npmjs.org/globule/-/globule-0.1.0.tgz\",\n      \"integrity\": \"sha1-2cjt3h2nnRJaFRt5UzuXhnY0auU=\",\n      \"dev\": true,\n      \"dependencies\": {\n        \"glob\": \"~3.1.21\",\n        \"lodash\": \"~1.0.1\",\n        \"minimatch\": \"~0.2.11\"\n      },\n      \"engines\": {\n        \"node\": \">= 0.8.0\"\n      }\n    },\n    \"node_modules/globule/node_modules/glob\": {\n      \"version\": \"3.1.21\",\n      \"resolved\": \"https://registry.npmjs.org/glob/-/glob-3.1.21.tgz\",\n      \"integrity\": \"sha1-0p4KBV3qUTj00H7UDomC6DwgZs0=\",\n      \"deprecated\": \"Glob versions prior to v9 are no longer supported\",\n      \"dev\": true,\n      \"dependencies\": {\n        \"graceful-fs\": \"~1.2.0\",\n        \"inherits\": \"1\",\n        \"minimatch\": \"~0.2.11\"\n      },\n      \"engines\": {\n        \"node\": \"*\"\n      }\n    },\n    \"node_modules/globule/node_modules/graceful-fs\": {\n      \"version\": \"1.2.3\",\n      \"resolved\": \"https://registry.npmjs.org/graceful-fs/-/graceful-fs-1.2.3.tgz\",\n      \"integrity\": \"sha1-FaSAaldUfLLS2/J/QuiajDRRs2Q=\",\n      \"deprecated\": \"please upgrade to graceful-fs 4 for compatibility with current and future versions of Node.js\",\n      \"dev\": true,\n      \"engines\": {\n        \"node\": \">=0.4.0\"\n      }\n    },\n    \"node_modules/globule/node_modules/inherits\": {\n      \"version\": \"1.0.2\",\n      \"resolved\": \"https://registry.npmjs.org/inherits/-/inherits-1.0.2.tgz\",\n      \"integrity\": \"sha1-ykMJ2t7mtUzAuNJH6NfHoJdb3Js=\",\n      \"dev\": true\n    },\n    \"node_modules/globule/node_modules/lodash\": {\n      \"version\": \"1.0.2\",\n      \"resolved\": \"https://registry.npmjs.org/lodash/-/lodash-1.0.2.tgz\",\n      \"integrity\": \"sha1-j1dWDIO1n8JwvT1WG2kAQ0MOJVE=\",\n      \"dev\": true,\n      \"engines\": [\n        \"node\",\n        \"rhino\"\n      ]\n    },\n    \"node_modules/globule/node_modules/minimatch\": {\n      \"version\": \"0.2.14\",\n      \"resolved\": \"https://registry.npmjs.org/minimatch/-/minimatch-0.2.14.tgz\",\n      \"integrity\": \"sha1-x054BXT2PG+aCQ6Q775u9TpqdWo=\",\n      \"deprecated\": \"Please update to minimatch 3.0.2 or higher to avoid a RegExp DoS issue\",\n      \"dev\": true,\n      \"dependencies\": {\n        \"lru-cache\": \"2\",\n        \"sigmund\": \"~1.0.0\"\n      },\n      \"engines\": {\n        \"node\": \"*\"\n      }\n    },\n    \"node_modules/glogg\": {\n      \"version\": \"1.0.0\",\n      \"resolved\": \"https://registry.npmjs.org/glogg/-/glogg-1.0.0.tgz\",\n      \"integrity\": \"sha1-f+DxmfV6yQbPUS/urY+Q7kooT8U=\",\n      \"dev\": true,\n      \"dependencies\": {\n        \"sparkles\": \"^1.0.0\"\n      },\n      \"engines\": {\n        \"node\": \">= 0.10\"\n      }\n    },\n    \"node_modules/graceful-fs\": {\n      \"version\": \"4.1.11\",\n      \"resolved\": \"https://registry.npmjs.org/graceful-fs/-/graceful-fs-4.1.11.tgz\",\n      \"integrity\": \"sha1-Dovf5NHduIVNZOBOp8AOKgJuVlg=\",\n      \"dev\": true,\n      \"engines\": {\n        \"node\": \">=0.4.0\"\n      }\n    },\n    \"node_modules/gulp\": {\n      \"version\": \"3.9.1\",\n      \"resolved\": \"https://registry.npmjs.org/gulp/-/gulp-3.9.1.tgz\",\n      \"integrity\": \"sha1-VxzkWSjdQK9lFPxAEYZgFsE4RbQ=\",\n      \"dev\": true,\n      \"dependencies\": {\n        \"archy\": \"^1.0.0\",\n        \"chalk\": \"^1.0.0\",\n        \"deprecated\": \"^0.0.1\",\n        \"gulp-util\": \"^3.0.0\",\n        \"interpret\": \"^1.0.0\",\n        \"liftoff\": \"^2.1.0\",\n        \"minimist\": \"^1.1.0\",\n        \"orchestrator\": \"^0.3.0\",\n        \"pretty-hrtime\": \"^1.0.0\",\n        \"semver\": \"^4.1.0\",\n        \"tildify\": \"^1.0.0\",\n        \"v8flags\": \"^2.0.2\",\n        \"vinyl-fs\": \"^0.3.0\"\n      },\n      \"bin\": {\n        \"gulp\": \"bin/gulp.js\"\n      },\n      \"engines\": {\n        \"node\": \">= 0.9\"\n      }\n    },\n    \"node_modules/gulp-util\": {\n      \"version\": \"3.0.8\",\n      \"resolved\": \"https://registry.npmjs.org/gulp-util/-/gulp-util-3.0.8.tgz\",\n      \"integrity\": \"sha1-AFTh50RQLifATBh8PsxQXdVLu08=\",\n      \"deprecated\": \"gulp-util is deprecated - replace it, following the guidelines at https://medium.com/gulpjs/gulp-util-ca3b1f9f9ac5\",\n      \"dev\": true,\n      \"dependencies\": {\n        \"array-differ\": \"^1.0.0\",\n        \"array-uniq\": \"^1.0.2\",\n        \"beeper\": \"^1.0.0\",\n        \"chalk\": \"^1.0.0\",\n        \"dateformat\": \"^2.0.0\",\n        \"fancy-log\": \"^1.1.0\",\n        \"gulplog\": \"^1.0.0\",\n        \"has-gulplog\": \"^0.1.0\",\n        \"lodash._reescape\": \"^3.0.0\",\n        \"lodash._reevaluate\": \"^3.0.0\",\n        \"lodash._reinterpolate\": \"^3.0.0\",\n        \"lodash.template\": \"^3.0.0\",\n        \"minimist\": \"^1.1.0\",\n        \"multipipe\": \"^0.1.2\",\n        \"object-assign\": \"^3.0.0\",\n        \"replace-ext\": \"0.0.1\",\n        \"through2\": \"^2.0.0\",\n        \"vinyl\": \"^0.5.0\"\n      },\n      \"engines\": {\n        \"node\": \">=0.10\"\n      }\n    },\n    \"node_modules/gulp-util/node_modules/minimist\": {\n      \"version\": \"1.2.0\",\n      \"resolved\": \"https://registry.npmjs.org/minimist/-/minimist-1.2.0.tgz\",\n      \"integrity\": \"sha1-o1AIsg9BOD7sH7kU9M1d95omQoQ=\",\n      \"dev\": true\n    },\n    \"node_modules/gulp-util/node_modules/object-assign\": {\n      \"version\": \"3.0.0\",\n      \"resolved\": \"https://registry.npmjs.org/object-assign/-/object-assign-3.0.0.tgz\",\n      \"integrity\": \"sha1-m+3VygiXlJvKR+f/QIBi1Un1h/I=\",\n      \"dev\": true,\n      \"engines\": {\n        \"node\": \">=0.10.0\"\n      }\n    },\n    \"node_modules/gulp-webserver\": {\n      \"version\": \"0.9.1\",\n      \"resolved\": \"https://registry.npmjs.org/gulp-webserver/-/gulp-webserver-0.9.1.tgz\",\n      \"integrity\": \"sha1-4JmSFl2XxYZWFtZCoWAVKbA2cGQ=\",\n      \"dev\": true,\n      \"dependencies\": {\n        \"connect\": \"^3.0.1\",\n        \"connect-livereload\": \"^0.4.0\",\n        \"gulp-util\": \"^2.2.19\",\n        \"isarray\": \"0.0.1\",\n        \"node.extend\": \"^1.0.10\",\n        \"open\": \"^0.0.5\",\n        \"proxy-middleware\": \"^0.5.0\",\n        \"serve-index\": \"^1.1.4\",\n        \"serve-static\": \"^1.3.0\",\n        \"through2\": \"^0.5.1\",\n        \"tiny-lr\": \"0.1.4\",\n        \"watch\": \"^0.11.0\"\n      }\n    },\n    \"node_modules/gulp-webserver/node_modules/ansi-regex\": {\n      \"version\": \"0.2.1\",\n      \"resolved\": \"https://registry.npmjs.org/ansi-regex/-/ansi-regex-0.2.1.tgz\",\n      \"integrity\": \"sha1-DY6UaWej2BQ/k+JOKYUl/BsiNfk=\",\n      \"dev\": true,\n      \"engines\": {\n        \"node\": \">=0.10.0\"\n      }\n    },\n    \"node_modules/gulp-webserver/node_modules/ansi-styles\": {\n      \"version\": \"1.1.0\",\n      \"resolved\": \"https://registry.npmjs.org/ansi-styles/-/ansi-styles-1.1.0.tgz\",\n      \"integrity\": \"sha1-6uy/Zs1waIJ2Cy9GkVgrj1XXp94=\",\n      \"dev\": true,\n      \"engines\": {\n        \"node\": \">=0.10.0\"\n      }\n    },\n    \"node_modules/gulp-webserver/node_modules/chalk\": {\n      \"version\": \"0.5.1\",\n      \"resolved\": \"https://registry.npmjs.org/chalk/-/chalk-0.5.1.tgz\",\n      \"integrity\": \"sha1-Zjs6ZItotV0EaQ1JFnqoN4WPIXQ=\",\n      \"dev\": true,\n      \"dependencies\": {\n        \"ansi-styles\": \"^1.1.0\",\n        \"escape-string-regexp\": \"^1.0.0\",\n        \"has-ansi\": \"^0.1.0\",\n        \"strip-ansi\": \"^0.3.0\",\n        \"supports-color\": \"^0.2.0\"\n      },\n      \"engines\": {\n        \"node\": \">=0.10.0\"\n      }\n    },\n    \"node_modules/gulp-webserver/node_modules/dateformat\": {\n      \"version\": \"1.0.12\",\n      \"resolved\": \"https://registry.npmjs.org/dateformat/-/dateformat-1.0.12.tgz\",\n      \"integrity\": \"sha1-nxJLZ1lMk3/3BpMuSmQsyo27/uk=\",\n      \"dev\": true,\n      \"dependencies\": {\n        \"get-stdin\": \"^4.0.1\",\n        \"meow\": \"^3.3.0\"\n      },\n      \"bin\": {\n        \"dateformat\": \"bin/cli.js\"\n      },\n      \"engines\": {\n        \"node\": \"*\"\n      }\n    },\n    \"node_modules/gulp-webserver/node_modules/gulp-util\": {\n      \"version\": \"2.2.20\",\n      \"resolved\": \"https://registry.npmjs.org/gulp-util/-/gulp-util-2.2.20.tgz\",\n      \"integrity\": \"sha1-1xRuVyiRC9jwR6awseVJvCLb1kw=\",\n      \"deprecated\": \"gulp-util is deprecated - replace it, following the guidelines at https://medium.com/gulpjs/gulp-util-ca3b1f9f9ac5\",\n      \"dev\": true,\n      \"dependencies\": {\n        \"chalk\": \"^0.5.0\",\n        \"dateformat\": \"^1.0.7-1.2.3\",\n        \"lodash._reinterpolate\": \"^2.4.1\",\n        \"lodash.template\": \"^2.4.1\",\n        \"minimist\": \"^0.2.0\",\n        \"multipipe\": \"^0.1.0\",\n        \"through2\": \"^0.5.0\",\n        \"vinyl\": \"^0.2.1\"\n      },\n      \"engines\": {\n        \"node\": \">= 0.9\"\n      }\n    },\n    \"node_modules/gulp-webserver/node_modules/has-ansi\": {\n      \"version\": \"0.1.0\",\n      \"resolved\": \"https://registry.npmjs.org/has-ansi/-/has-ansi-0.1.0.tgz\",\n      \"integrity\": \"sha1-hPJlqujA5qiKEtcCKJS3VoiUxi4=\",\n      \"dev\": true,\n      \"dependencies\": {\n        \"ansi-regex\": \"^0.2.0\"\n      },\n      \"bin\": {\n        \"has-ansi\": \"cli.js\"\n      },\n      \"engines\": {\n        \"node\": \">=0.10.0\"\n      }\n    },\n    \"node_modules/gulp-webserver/node_modules/isarray\": {\n      \"version\": \"0.0.1\",\n      \"resolved\": \"https://registry.npmjs.org/isarray/-/isarray-0.0.1.tgz\",\n      \"integrity\": \"sha1-ihis/Kmo9Bd+Cav8YDiTmwXR7t8=\",\n      \"dev\": true\n    },\n    \"node_modules/gulp-webserver/node_modules/lodash._reinterpolate\": {\n      \"version\": \"2.4.1\",\n      \"resolved\": \"https://registry.npmjs.org/lodash._reinterpolate/-/lodash._reinterpolate-2.4.1.tgz\",\n      \"integrity\": \"sha1-TxInqlqHEfxjL1sHofRgequLMiI=\",\n      \"dev\": true\n    },\n    \"node_modules/gulp-webserver/node_modules/lodash.escape\": {\n      \"version\": \"2.4.1\",\n      \"resolved\": \"https://registry.npmjs.org/lodash.escape/-/lodash.escape-2.4.1.tgz\",\n      \"integrity\": \"sha1-LOEsXghNsKV92l5dHu659dF1o7Q=\",\n      \"dev\": true,\n      \"dependencies\": {\n        \"lodash._escapehtmlchar\": \"~2.4.1\",\n        \"lodash._reunescapedhtml\": \"~2.4.1\",\n        \"lodash.keys\": \"~2.4.1\"\n      }\n    },\n    \"node_modules/gulp-webserver/node_modules/lodash.keys\": {\n      \"version\": \"2.4.1\",\n      \"resolved\": \"https://registry.npmjs.org/lodash.keys/-/lodash.keys-2.4.1.tgz\",\n      \"integrity\": \"sha1-SN6kbfj/djKxDXBrissmWR4rNyc=\",\n      \"dev\": true,\n      \"dependencies\": {\n        \"lodash._isnative\": \"~2.4.1\",\n        \"lodash._shimkeys\": \"~2.4.1\",\n        \"lodash.isobject\": \"~2.4.1\"\n      }\n    },\n    \"node_modules/gulp-webserver/node_modules/lodash.template\": {\n      \"version\": \"2.4.1\",\n      \"resolved\": \"https://registry.npmjs.org/lodash.template/-/lodash.template-2.4.1.tgz\",\n      \"integrity\": \"sha1-nmEQB+32KRKal0qzxIuBez4c8g0=\",\n      \"dev\": true,\n      \"dependencies\": {\n        \"lodash._escapestringchar\": \"~2.4.1\",\n        \"lodash._reinterpolate\": \"~2.4.1\",\n        \"lodash.defaults\": \"~2.4.1\",\n        \"lodash.escape\": \"~2.4.1\",\n        \"lodash.keys\": \"~2.4.1\",\n        \"lodash.templatesettings\": \"~2.4.1\",\n        \"lodash.values\": \"~2.4.1\"\n      }\n    },\n    \"node_modules/gulp-webserver/node_modules/lodash.templatesettings\": {\n      \"version\": \"2.4.1\",\n      \"resolved\": \"https://registry.npmjs.org/lodash.templatesettings/-/lodash.templatesettings-2.4.1.tgz\",\n      \"integrity\": \"sha1-6nbHXRHrhtTb6JqDiTu4YZKaxpk=\",\n      \"dev\": true,\n      \"dependencies\": {\n        \"lodash._reinterpolate\": \"~2.4.1\",\n        \"lodash.escape\": \"~2.4.1\"\n      }\n    },\n    \"node_modules/gulp-webserver/node_modules/minimist\": {\n      \"version\": \"0.2.0\",\n      \"resolved\": \"https://registry.npmjs.org/minimist/-/minimist-0.2.0.tgz\",\n      \"integrity\": \"sha1-Tf/lJdriuGTGbC4jxicdev3s784=\",\n      \"dev\": true\n    },\n    \"node_modules/gulp-webserver/node_modules/readable-stream\": {\n      \"version\": \"1.0.34\",\n      \"resolved\": \"https://registry.npmjs.org/readable-stream/-/readable-stream-1.0.34.tgz\",\n      \"integrity\": \"sha1-Elgg40vIQtLyqq+v5MKRbuMsFXw=\",\n      \"dev\": true,\n      \"dependencies\": {\n        \"core-util-is\": \"~1.0.0\",\n        \"inherits\": \"~2.0.1\",\n        \"isarray\": \"0.0.1\",\n        \"string_decoder\": \"~0.10.x\"\n      }\n    },\n    \"node_modules/gulp-webserver/node_modules/string_decoder\": {\n      \"version\": \"0.10.31\",\n      \"resolved\": \"https://registry.npmjs.org/string_decoder/-/string_decoder-0.10.31.tgz\",\n      \"integrity\": \"sha1-YuIDvEF2bGwoyfyEMB2rHFMQ+pQ=\",\n      \"dev\": true\n    },\n    \"node_modules/gulp-webserver/node_modules/strip-ansi\": {\n      \"version\": \"0.3.0\",\n      \"resolved\": \"https://registry.npmjs.org/strip-ansi/-/strip-ansi-0.3.0.tgz\",\n      \"integrity\": \"sha1-JfSOoiynkYfzF0pNuHWTR7sSYiA=\",\n      \"dev\": true,\n      \"dependencies\": {\n        \"ansi-regex\": \"^0.2.1\"\n      },\n      \"bin\": {\n        \"strip-ansi\": \"cli.js\"\n      },\n      \"engines\": {\n        \"node\": \">=0.10.0\"\n      }\n    },\n    \"node_modules/gulp-webserver/node_modules/supports-color\": {\n      \"version\": \"0.2.0\",\n      \"resolved\": \"https://registry.npmjs.org/supports-color/-/supports-color-0.2.0.tgz\",\n      \"integrity\": \"sha1-2S3iaU6z9nMjlz1649i1W0wiGQo=\",\n      \"dev\": true,\n      \"bin\": {\n        \"supports-color\": \"cli.js\"\n      },\n      \"engines\": {\n        \"node\": \">=0.10.0\"\n      }\n    },\n    \"node_modules/gulp-webserver/node_modules/through2\": {\n      \"version\": \"0.5.1\",\n      \"resolved\": \"https://registry.npmjs.org/through2/-/through2-0.5.1.tgz\",\n      \"integrity\": \"sha1-390BLrnHAOIyP9M084rGIqs3Lac=\",\n      \"dev\": true,\n      \"dependencies\": {\n        \"readable-stream\": \"~1.0.17\",\n        \"xtend\": \"~3.0.0\"\n      }\n    },\n    \"node_modules/gulp-webserver/node_modules/vinyl\": {\n      \"version\": \"0.2.3\",\n      \"resolved\": \"https://registry.npmjs.org/vinyl/-/vinyl-0.2.3.tgz\",\n      \"integrity\": \"sha1-vKk4IJWC7FpJrVOKAPofEl5RMlI=\",\n      \"dev\": true,\n      \"dependencies\": {\n        \"clone-stats\": \"~0.0.1\"\n      },\n      \"engines\": {\n        \"node\": \">= 0.9\"\n      }\n    },\n    \"node_modules/gulp-webserver/node_modules/xtend\": {\n      \"version\": \"3.0.0\",\n      \"resolved\": \"https://registry.npmjs.org/xtend/-/xtend-3.0.0.tgz\",\n      \"integrity\": \"sha1-XM50B7r2Qsunvs2laBEcST9ZZlo=\",\n      \"dev\": true,\n      \"engines\": {\n        \"node\": \">=0.4\"\n      }\n    },\n    \"node_modules/gulp/node_modules/minimist\": {\n      \"version\": \"1.2.0\",\n      \"resolved\": \"https://registry.npmjs.org/minimist/-/minimist-1.2.0.tgz\",\n      \"integrity\": \"sha1-o1AIsg9BOD7sH7kU9M1d95omQoQ=\",\n      \"dev\": true\n    },\n    \"node_modules/gulplog\": {\n      \"version\": \"1.0.0\",\n      \"resolved\": \"https://registry.npmjs.org/gulplog/-/gulplog-1.0.0.tgz\",\n      \"integrity\": \"sha1-4oxNRdBey77YGDY86PnFkmIp/+U=\",\n      \"dev\": true,\n      \"dependencies\": {\n        \"glogg\": \"^1.0.0\"\n      },\n      \"engines\": {\n        \"node\": \">= 0.10\"\n      }\n    },\n    \"node_modules/has-ansi\": {\n      \"version\": \"2.0.0\",\n      \"resolved\": \"https://registry.npmjs.org/has-ansi/-/has-ansi-2.0.0.tgz\",\n      \"integrity\": \"sha1-NPUEnOHs3ysGSa8+8k5F7TVBbZE=\",\n      \"dev\": true,\n      \"dependencies\": {\n        \"ansi-regex\": \"^2.0.0\"\n      },\n      \"engines\": {\n        \"node\": \">=0.10.0\"\n      }\n    },\n    \"node_modules/has-flag\": {\n      \"version\": \"1.0.0\",\n      \"resolved\": \"https://registry.npmjs.org/has-flag/-/has-flag-1.0.0.tgz\",\n      \"integrity\": \"sha1-nZ55MWXOAXoA8AQYxD+UKnsdEfo=\",\n      \"dev\": true,\n      \"engines\": {\n        \"node\": \">=0.10.0\"\n      }\n    },\n    \"node_modules/has-gulplog\": {\n      \"version\": \"0.1.0\",\n      \"resolved\": \"https://registry.npmjs.org/has-gulplog/-/has-gulplog-0.1.0.tgz\",\n      \"integrity\": \"sha1-ZBTIKRNpfaUVkDl9r7EvIpZ4Ec4=\",\n      \"dev\": true,\n      \"dependencies\": {\n        \"sparkles\": \"^1.0.0\"\n      },\n      \"engines\": {\n        \"node\": \">= 0.10\"\n      }\n    },\n    \"node_modules/he\": {\n      \"version\": \"0.4.1\",\n      \"resolved\": \"https://registry.npmjs.org/he/-/he-0.4.1.tgz\",\n      \"integrity\": \"sha512-wFn1JlcsgbcWEawQ6A1GztgNRRl6UyEtaARIDpAeH3c35T/9id/QQKvap1NAz6Yk2oKrKwXQZZFERS0tl9E0Jg==\",\n      \"bin\": {\n        \"he\": \"bin/he\"\n      }\n    },\n    \"node_modules/home-or-tmp\": {\n      \"version\": \"2.0.0\",\n      \"resolved\": \"https://registry.npmjs.org/home-or-tmp/-/home-or-tmp-2.0.0.tgz\",\n      \"integrity\": \"sha1-42w/LSyufXRqhX440Y1fMqeILbg=\",\n      \"dev\": true,\n      \"dependencies\": {\n        \"os-homedir\": \"^1.0.0\",\n        \"os-tmpdir\": \"^1.0.1\"\n      },\n      \"engines\": {\n        \"node\": \">=0.10.0\"\n      }\n    },\n    \"node_modules/homedir-polyfill\": {\n      \"version\": \"1.0.1\",\n      \"resolved\": \"https://registry.npmjs.org/homedir-polyfill/-/homedir-polyfill-1.0.1.tgz\",\n      \"integrity\": \"sha1-TCu8inWJmP7r9e1oWA921GdotLw=\",\n      \"dev\": true,\n      \"dependencies\": {\n        \"parse-passwd\": \"^1.0.0\"\n      },\n      \"engines\": {\n        \"node\": \">=0.10.0\"\n      }\n    },\n    \"node_modules/hosted-git-info\": {\n      \"version\": \"2.5.0\",\n      \"resolved\": \"https://registry.npmjs.org/hosted-git-info/-/hosted-git-info-2.5.0.tgz\",\n      \"integrity\": \"sha512-pNgbURSuab90KbTqvRPsseaTxOJCZBD0a7t+haSN33piP9cCM4l0CqdzAif2hUqm716UovKB2ROmiabGAKVXyg==\",\n      \"dev\": true\n    },\n    \"node_modules/http-errors\": {\n      \"version\": \"1.6.2\",\n      \"resolved\": \"https://registry.npmjs.org/http-errors/-/http-errors-1.6.2.tgz\",\n      \"integrity\": \"sha1-CgAsyFcHGSp+eUbO7cERVfYOxzY=\",\n      \"dev\": true,\n      \"dependencies\": {\n        \"depd\": \"1.1.1\",\n        \"inherits\": \"2.0.3\",\n        \"setprototypeof\": \"1.0.3\",\n        \"statuses\": \">= 1.3.1 < 2\"\n      },\n      \"engines\": {\n        \"node\": \">= 0.6\"\n      }\n    },\n    \"node_modules/husky\": {\n      \"version\": \"0.14.3\",\n      \"resolved\": \"https://registry.npmjs.org/husky/-/husky-0.14.3.tgz\",\n      \"integrity\": \"sha512-e21wivqHpstpoiWA/Yi8eFti8E+sQDSS53cpJsPptPs295QTOQR0ZwnHo2TXy1XOpZFD9rPOd3NpmqTK6uMLJA==\",\n      \"dev\": true,\n      \"hasInstallScript\": true,\n      \"dependencies\": {\n        \"is-ci\": \"^1.0.10\",\n        \"normalize-path\": \"^1.0.0\",\n        \"strip-indent\": \"^2.0.0\"\n      },\n      \"engines\": {\n        \"node\": \">=4\"\n      }\n    },\n    \"node_modules/husky/node_modules/normalize-path\": {\n      \"version\": \"1.0.0\",\n      \"resolved\": \"https://registry.npmjs.org/normalize-path/-/normalize-path-1.0.0.tgz\",\n      \"integrity\": \"sha1-MtDkcvkf80VwHBWoMRAY07CpA3k=\",\n      \"dev\": true,\n      \"engines\": {\n        \"node\": \">=0.10.0\"\n      }\n    },\n    \"node_modules/husky/node_modules/strip-indent\": {\n      \"version\": \"2.0.0\",\n      \"resolved\": \"https://registry.npmjs.org/strip-indent/-/strip-indent-2.0.0.tgz\",\n      \"integrity\": \"sha1-XvjbKV0B5u1sv3qrlpmNeCJSe2g=\",\n      \"dev\": true,\n      \"engines\": {\n        \"node\": \">=4\"\n      }\n    },\n    \"node_modules/iconv-lite\": {\n      \"version\": \"0.4.4\",\n      \"resolved\": \"https://registry.npmjs.org/iconv-lite/-/iconv-lite-0.4.4.tgz\",\n      \"integrity\": \"sha1-6V8uQdsHNfwhZS94J6XuMuY8g6g=\",\n      \"dev\": true,\n      \"engines\": {\n        \"node\": \">=0.8.0\"\n      }\n    },\n    \"node_modules/ignore\": {\n      \"version\": \"3.3.5\",\n      \"resolved\": \"https://registry.npmjs.org/ignore/-/ignore-3.3.5.tgz\",\n      \"integrity\": \"sha512-JLH93mL8amZQhh/p6mfQgVBH3M6epNq3DfsXsTSuSrInVjwyYlFE1nv2AgfRCC8PoOhM0jwQ5v8s9LgbK7yGDw==\",\n      \"dev\": true\n    },\n    \"node_modules/imurmurhash\": {\n      \"version\": \"0.1.4\",\n      \"resolved\": \"https://registry.npmjs.org/imurmurhash/-/imurmurhash-0.1.4.tgz\",\n      \"integrity\": \"sha1-khi5srkoojixPcT7a21XbyMUU+o=\",\n      \"dev\": true,\n      \"engines\": {\n        \"node\": \">=0.8.19\"\n      }\n    },\n    \"node_modules/indent-string\": {\n      \"version\": \"2.1.0\",\n      \"resolved\": \"https://registry.npmjs.org/indent-string/-/indent-string-2.1.0.tgz\",\n      \"integrity\": \"sha1-ji1INIdCEhtKghi3oTfppSBJ3IA=\",\n      \"dev\": true,\n      \"dependencies\": {\n        \"repeating\": \"^2.0.0\"\n      },\n      \"engines\": {\n        \"node\": \">=0.10.0\"\n      }\n    },\n    \"node_modules/inflight\": {\n      \"version\": \"1.0.6\",\n      \"resolved\": \"https://registry.npmjs.org/inflight/-/inflight-1.0.6.tgz\",\n      \"integrity\": \"sha1-Sb1jMdfQLQwJvJEKEHW6gWW1bfk=\",\n      \"deprecated\": \"This module is not supported, and leaks memory. Do not use it. Check out lru-cache if you want a good and tested way to coalesce async requests by a key value, which is much more comprehensive and powerful.\",\n      \"dev\": true,\n      \"dependencies\": {\n        \"once\": \"^1.3.0\",\n        \"wrappy\": \"1\"\n      }\n    },\n    \"node_modules/inherits\": {\n      \"version\": \"2.0.3\",\n      \"resolved\": \"https://registry.npmjs.org/inherits/-/inherits-2.0.3.tgz\",\n      \"integrity\": \"sha1-Yzwsg+PaQqUC9SRmAiSA9CCCYd4=\"\n    },\n    \"node_modules/ini\": {\n      \"version\": \"1.3.4\",\n      \"resolved\": \"https://registry.npmjs.org/ini/-/ini-1.3.4.tgz\",\n      \"integrity\": \"sha1-BTfLedr1m1mhpRff9wbIbsA5Fi4=\",\n      \"deprecated\": \"Please update to ini >=1.3.6 to avoid a prototype pollution issue\",\n      \"dev\": true,\n      \"engines\": {\n        \"node\": \"*\"\n      }\n    },\n    \"node_modules/inquirer\": {\n      \"version\": \"0.12.0\",\n      \"resolved\": \"https://registry.npmjs.org/inquirer/-/inquirer-0.12.0.tgz\",\n      \"integrity\": \"sha1-HvK/1jUE3wvHV4X/+MLEHfEvB34=\",\n      \"dev\": true,\n      \"dependencies\": {\n        \"ansi-escapes\": \"^1.1.0\",\n        \"ansi-regex\": \"^2.0.0\",\n        \"chalk\": \"^1.0.0\",\n        \"cli-cursor\": \"^1.0.1\",\n        \"cli-width\": \"^2.0.0\",\n        \"figures\": \"^1.3.5\",\n        \"lodash\": \"^4.3.0\",\n        \"readline2\": \"^1.0.1\",\n        \"run-async\": \"^0.1.0\",\n        \"rx-lite\": \"^3.1.2\",\n        \"string-width\": \"^1.0.1\",\n        \"strip-ansi\": \"^3.0.0\",\n        \"through\": \"^2.3.6\"\n      }\n    },\n    \"node_modules/interpret\": {\n      \"version\": \"1.0.3\",\n      \"resolved\": \"https://registry.npmjs.org/interpret/-/interpret-1.0.3.tgz\",\n      \"integrity\": \"sha1-y8NcYu7uc/Gat7EKgBURQBr8D5A=\",\n      \"dev\": true\n    },\n    \"node_modules/invariant\": {\n      \"version\": \"2.2.2\",\n      \"resolved\": \"https://registry.npmjs.org/invariant/-/invariant-2.2.2.tgz\",\n      \"integrity\": \"sha1-nh9WrArNtr8wMwbzOL47IErmA2A=\",\n      \"dev\": true,\n      \"dependencies\": {\n        \"loose-envify\": \"^1.0.0\"\n      }\n    },\n    \"node_modules/is\": {\n      \"version\": \"3.2.1\",\n      \"resolved\": \"https://registry.npmjs.org/is/-/is-3.2.1.tgz\",\n      \"integrity\": \"sha1-0Kwq1V63sL7JJqUmb2xmKqqD3KU=\",\n      \"dev\": true,\n      \"engines\": {\n        \"node\": \"*\"\n      }\n    },\n    \"node_modules/is-absolute\": {\n      \"version\": \"0.2.6\",\n      \"resolved\": \"https://registry.npmjs.org/is-absolute/-/is-absolute-0.2.6.tgz\",\n      \"integrity\": \"sha1-IN5p89uULvLYe5wto28XIjWxtes=\",\n      \"dev\": true,\n      \"dependencies\": {\n        \"is-relative\": \"^0.2.1\",\n        \"is-windows\": \"^0.2.0\"\n      },\n      \"engines\": {\n        \"node\": \">=0.10.0\"\n      }\n    },\n    \"node_modules/is-arrayish\": {\n      \"version\": \"0.2.1\",\n      \"resolved\": \"https://registry.npmjs.org/is-arrayish/-/is-arrayish-0.2.1.tgz\",\n      \"integrity\": \"sha1-d8mYQFJ6qOyxqLppe4BkWnqSap0=\",\n      \"dev\": true\n    },\n    \"node_modules/is-buffer\": {\n      \"version\": \"1.1.5\",\n      \"resolved\": \"https://registry.npmjs.org/is-buffer/-/is-buffer-1.1.5.tgz\",\n      \"integrity\": \"sha1-Hzsm72E7IUuIy8ojzGwB2Hlh7sw=\",\n      \"deprecated\": \"This version of 'is-buffer' is out-of-date. You must update to v1.1.6 or newer\",\n      \"dev\": true\n    },\n    \"node_modules/is-builtin-module\": {\n      \"version\": \"1.0.0\",\n      \"resolved\": \"https://registry.npmjs.org/is-builtin-module/-/is-builtin-module-1.0.0.tgz\",\n      \"integrity\": \"sha1-VAVy0096wxGfj3bDDLwbHgN6/74=\",\n      \"dev\": true,\n      \"dependencies\": {\n        \"builtin-modules\": \"^1.0.0\"\n      },\n      \"engines\": {\n        \"node\": \">=0.10.0\"\n      }\n    },\n    \"node_modules/is-ci\": {\n      \"version\": \"1.0.10\",\n      \"resolved\": \"https://registry.npmjs.org/is-ci/-/is-ci-1.0.10.tgz\",\n      \"integrity\": \"sha1-9zkzayYyNlBhqdSCcM1WrjNpMY4=\",\n      \"dev\": true,\n      \"dependencies\": {\n        \"ci-info\": \"^1.0.0\"\n      }\n    },\n    \"node_modules/is-dotfile\": {\n      \"version\": \"1.0.3\",\n      \"resolved\": \"https://registry.npmjs.org/is-dotfile/-/is-dotfile-1.0.3.tgz\",\n      \"integrity\": \"sha1-pqLzL/0t+wT1yiXs0Pa4PPeYoeE=\",\n      \"dev\": true,\n      \"engines\": {\n        \"node\": \">=0.10.0\"\n      }\n    },\n    \"node_modules/is-equal-shallow\": {\n      \"version\": \"0.1.3\",\n      \"resolved\": \"https://registry.npmjs.org/is-equal-shallow/-/is-equal-shallow-0.1.3.tgz\",\n      \"integrity\": \"sha1-IjgJj8Ih3gvPpdnqxMRdY4qhxTQ=\",\n      \"dev\": true,\n      \"dependencies\": {\n        \"is-primitive\": \"^2.0.0\"\n      },\n      \"engines\": {\n        \"node\": \">=0.10.0\"\n      }\n    },\n    \"node_modules/is-extendable\": {\n      \"version\": \"0.1.1\",\n      \"resolved\": \"https://registry.npmjs.org/is-extendable/-/is-extendable-0.1.1.tgz\",\n      \"integrity\": \"sha1-YrEQ4omkcUGOPsNqYX1HLjAd/Ik=\",\n      \"dev\": true,\n      \"engines\": {\n        \"node\": \">=0.10.0\"\n      }\n    },\n    \"node_modules/is-extglob\": {\n      \"version\": \"1.0.0\",\n      \"resolved\": \"https://registry.npmjs.org/is-extglob/-/is-extglob-1.0.0.tgz\",\n      \"integrity\": \"sha1-rEaBd8SUNAWgkvyPKXYMb/xiBsA=\",\n      \"dev\": true,\n      \"engines\": {\n        \"node\": \">=0.10.0\"\n      }\n    },\n    \"node_modules/is-finite\": {\n      \"version\": \"1.0.2\",\n      \"resolved\": \"https://registry.npmjs.org/is-finite/-/is-finite-1.0.2.tgz\",\n      \"integrity\": \"sha1-zGZ3aVYCvlUO8R6LSqYwU0K20Ko=\",\n      \"dev\": true,\n      \"dependencies\": {\n        \"number-is-nan\": \"^1.0.0\"\n      },\n      \"engines\": {\n        \"node\": \">=0.10.0\"\n      }\n    },\n    \"node_modules/is-fullwidth-code-point\": {\n      \"version\": \"1.0.0\",\n      \"resolved\": \"https://registry.npmjs.org/is-fullwidth-code-point/-/is-fullwidth-code-point-1.0.0.tgz\",\n      \"integrity\": \"sha1-754xOG8DGn8NZDr4L95QxFfvAMs=\",\n      \"dev\": true,\n      \"dependencies\": {\n        \"number-is-nan\": \"^1.0.0\"\n      },\n      \"engines\": {\n        \"node\": \">=0.10.0\"\n      }\n    },\n    \"node_modules/is-glob\": {\n      \"version\": \"2.0.1\",\n      \"resolved\": \"https://registry.npmjs.org/is-glob/-/is-glob-2.0.1.tgz\",\n      \"integrity\": \"sha1-0Jb5JqPe1WAPP9/ZEZjLCIjC2GM=\",\n      \"dev\": true,\n      \"dependencies\": {\n        \"is-extglob\": \"^1.0.0\"\n      },\n      \"engines\": {\n        \"node\": \">=0.10.0\"\n      }\n    },\n    \"node_modules/is-my-json-valid\": {\n      \"version\": \"2.16.1\",\n      \"resolved\": \"https://registry.npmjs.org/is-my-json-valid/-/is-my-json-valid-2.16.1.tgz\",\n      \"integrity\": \"sha512-ochPsqWS1WXj8ZnMIV0vnNXooaMhp7cyL4FMSIPKTtnV0Ha/T19G2b9kkhcNsabV9bxYkze7/aLZJb/bYuFduQ==\",\n      \"deprecated\": \"catastrophic backtracking in regexes could potentially lead to REDOS attack, upgrade to 2.17.2 as soon as possible\",\n      \"dev\": true,\n      \"dependencies\": {\n        \"generate-function\": \"^2.0.0\",\n        \"generate-object-property\": \"^1.1.0\",\n        \"jsonpointer\": \"^4.0.0\",\n        \"xtend\": \"^4.0.0\"\n      }\n    },\n    \"node_modules/is-number\": {\n      \"version\": \"2.1.0\",\n      \"resolved\": \"https://registry.npmjs.org/is-number/-/is-number-2.1.0.tgz\",\n      \"integrity\": \"sha1-Afy7s5NGOlSPL0ZszhbezknbkI8=\",\n      \"dev\": true,\n      \"dependencies\": {\n        \"kind-of\": \"^3.0.2\"\n      },\n      \"engines\": {\n        \"node\": \">=0.10.0\"\n      }\n    },\n    \"node_modules/is-obj\": {\n      \"version\": \"1.0.1\",\n      \"resolved\": \"https://registry.npmjs.org/is-obj/-/is-obj-1.0.1.tgz\",\n      \"integrity\": \"sha1-PkcprB9f3gJc19g6iW2rn09n2w8=\",\n      \"dev\": true,\n      \"engines\": {\n        \"node\": \">=0.10.0\"\n      }\n    },\n    \"node_modules/is-path-cwd\": {\n      \"version\": \"1.0.0\",\n      \"resolved\": \"https://registry.npmjs.org/is-path-cwd/-/is-path-cwd-1.0.0.tgz\",\n      \"integrity\": \"sha1-0iXsIxMuie3Tj9p2dHLmLmXxEG0=\",\n      \"dev\": true,\n      \"engines\": {\n        \"node\": \">=0.10.0\"\n      }\n    },\n    \"node_modules/is-path-in-cwd\": {\n      \"version\": \"1.0.0\",\n      \"resolved\": \"https://registry.npmjs.org/is-path-in-cwd/-/is-path-in-cwd-1.0.0.tgz\",\n      \"integrity\": \"sha1-ZHdYK4IU1gI0YJRWcAO+ip6sBNw=\",\n      \"dev\": true,\n      \"dependencies\": {\n        \"is-path-inside\": \"^1.0.0\"\n      },\n      \"engines\": {\n        \"node\": \">=0.10.0\"\n      }\n    },\n    \"node_modules/is-path-inside\": {\n      \"version\": \"1.0.0\",\n      \"resolved\": \"https://registry.npmjs.org/is-path-inside/-/is-path-inside-1.0.0.tgz\",\n      \"integrity\": \"sha1-/AbloWg/vaE95mev9xe7wQpI838=\",\n      \"dev\": true,\n      \"dependencies\": {\n        \"path-is-inside\": \"^1.0.1\"\n      },\n      \"engines\": {\n        \"node\": \">=0.10.0\"\n      }\n    },\n    \"node_modules/is-plain-object\": {\n      \"version\": \"2.0.4\",\n      \"resolved\": \"https://registry.npmjs.org/is-plain-object/-/is-plain-object-2.0.4.tgz\",\n      \"integrity\": \"sha512-h5PpgXkWitc38BBMYawTYMWJHFZJVnBquFE57xFpjB8pJFiF6gZ+bU+WyI/yqXiFR5mdLsgYNaPe8uao6Uv9Og==\",\n      \"dev\": true,\n      \"dependencies\": {\n        \"isobject\": \"^3.0.1\"\n      },\n      \"engines\": {\n        \"node\": \">=0.10.0\"\n      }\n    },\n    \"node_modules/is-plain-object/node_modules/isobject\": {\n      \"version\": \"3.0.1\",\n      \"resolved\": \"https://registry.npmjs.org/isobject/-/isobject-3.0.1.tgz\",\n      \"integrity\": \"sha1-TkMekrEalzFjaqH5yNHMvP2reN8=\",\n      \"dev\": true,\n      \"engines\": {\n        \"node\": \">=0.10.0\"\n      }\n    },\n    \"node_modules/is-posix-bracket\": {\n      \"version\": \"0.1.1\",\n      \"resolved\": \"https://registry.npmjs.org/is-posix-bracket/-/is-posix-bracket-0.1.1.tgz\",\n      \"integrity\": \"sha1-MzTceXdDaOkvAW5vvAqI9c1ua8Q=\",\n      \"dev\": true,\n      \"engines\": {\n        \"node\": \">=0.10.0\"\n      }\n    },\n    \"node_modules/is-primitive\": {\n      \"version\": \"2.0.0\",\n      \"resolved\": \"https://registry.npmjs.org/is-primitive/-/is-primitive-2.0.0.tgz\",\n      \"integrity\": \"sha1-IHurkWOEmcB7Kt8kCkGochADRXU=\",\n      \"dev\": true,\n      \"engines\": {\n        \"node\": \">=0.10.0\"\n      }\n    },\n    \"node_modules/is-promise\": {\n      \"version\": \"2.1.0\",\n      \"resolved\": \"https://registry.npmjs.org/is-promise/-/is-promise-2.1.0.tgz\",\n      \"integrity\": \"sha1-eaKp7OfwlugPNtKy87wWwf9L8/o=\",\n      \"dev\": true\n    },\n    \"node_modules/is-property\": {\n      \"version\": \"1.0.2\",\n      \"resolved\": \"https://registry.npmjs.org/is-property/-/is-property-1.0.2.tgz\",\n      \"integrity\": \"sha1-V/4cTkhHTt1lsJkR8msc1Ald2oQ=\",\n      \"dev\": true\n    },\n    \"node_modules/is-regexp\": {\n      \"version\": \"1.0.0\",\n      \"resolved\": \"https://registry.npmjs.org/is-regexp/-/is-regexp-1.0.0.tgz\",\n      \"integrity\": \"sha1-/S2INUXEa6xaYz57mgnof6LLUGk=\",\n      \"dev\": true,\n      \"engines\": {\n        \"node\": \">=0.10.0\"\n      }\n    },\n    \"node_modules/is-relative\": {\n      \"version\": \"0.2.1\",\n      \"resolved\": \"https://registry.npmjs.org/is-relative/-/is-relative-0.2.1.tgz\",\n      \"integrity\": \"sha1-0n9MfVFtF1+2ENuEu+7yPDvJeqU=\",\n      \"dev\": true,\n      \"dependencies\": {\n        \"is-unc-path\": \"^0.1.1\"\n      },\n      \"engines\": {\n        \"node\": \">=0.10.0\"\n      }\n    },\n    \"node_modules/is-resolvable\": {\n      \"version\": \"1.0.0\",\n      \"resolved\": \"https://registry.npmjs.org/is-resolvable/-/is-resolvable-1.0.0.tgz\",\n      \"integrity\": \"sha1-jfV8YeouPFAUCNEA+wE8+NbgzGI=\",\n      \"dev\": true,\n      \"dependencies\": {\n        \"tryit\": \"^1.0.1\"\n      }\n    },\n    \"node_modules/is-stream\": {\n      \"version\": \"1.1.0\",\n      \"resolved\": \"https://registry.npmjs.org/is-stream/-/is-stream-1.1.0.tgz\",\n      \"integrity\": \"sha1-EtSj3U5o4Lec6428hBc66A2RykQ=\",\n      \"dev\": true,\n      \"engines\": {\n        \"node\": \">=0.10.0\"\n      }\n    },\n    \"node_modules/is-unc-path\": {\n      \"version\": \"0.1.2\",\n      \"resolved\": \"https://registry.npmjs.org/is-unc-path/-/is-unc-path-0.1.2.tgz\",\n      \"integrity\": \"sha1-arBTpyVzwQJQ/0FqOBTDUXivObk=\",\n      \"dev\": true,\n      \"dependencies\": {\n        \"unc-path-regex\": \"^0.1.0\"\n      },\n      \"engines\": {\n        \"node\": \">=0.10.0\"\n      }\n    },\n    \"node_modules/is-utf8\": {\n      \"version\": \"0.2.1\",\n      \"resolved\": \"https://registry.npmjs.org/is-utf8/-/is-utf8-0.2.1.tgz\",\n      \"integrity\": \"sha1-Sw2hRCEE0bM2NA6AeX6GXPOffXI=\",\n      \"dev\": true\n    },\n    \"node_modules/is-windows\": {\n      \"version\": \"0.2.0\",\n      \"resolved\": \"https://registry.npmjs.org/is-windows/-/is-windows-0.2.0.tgz\",\n      \"integrity\": \"sha1-3hqm1j6indJIc3tp8f+LgALSEIw=\",\n      \"dev\": true,\n      \"engines\": {\n        \"node\": \">=0.10.0\"\n      }\n    },\n    \"node_modules/isarray\": {\n      \"version\": \"1.0.0\",\n      \"resolved\": \"https://registry.npmjs.org/isarray/-/isarray-1.0.0.tgz\",\n      \"integrity\": \"sha1-u5NdSFgsuhaMBoNJV6VKPgcSTxE=\",\n      \"dev\": true\n    },\n    \"node_modules/isexe\": {\n      \"version\": \"2.0.0\",\n      \"resolved\": \"https://registry.npmjs.org/isexe/-/isexe-2.0.0.tgz\",\n      \"integrity\": \"sha1-6PvzdNxVb/iUehDcsFctYz8s+hA=\",\n      \"dev\": true\n    },\n    \"node_modules/isobject\": {\n      \"version\": \"2.1.0\",\n      \"resolved\": \"https://registry.npmjs.org/isobject/-/isobject-2.1.0.tgz\",\n      \"integrity\": \"sha1-8GVWEJaj8dou9GJy+BXIQNh+DIk=\",\n      \"dev\": true,\n      \"dependencies\": {\n        \"isarray\": \"1.0.0\"\n      },\n      \"engines\": {\n        \"node\": \">=0.10.0\"\n      }\n    },\n    \"node_modules/jest-get-type\": {\n      \"version\": \"21.2.0\",\n      \"resolved\": \"https://registry.npmjs.org/jest-get-type/-/jest-get-type-21.2.0.tgz\",\n      \"integrity\": \"sha512-y2fFw3C+D0yjNSDp7ab1kcd6NUYfy3waPTlD8yWkAtiocJdBRQqNoRqVfMNxgj+IjT0V5cBIHJO0z9vuSSZ43Q==\",\n      \"dev\": true\n    },\n    \"node_modules/jest-validate\": {\n      \"version\": \"21.2.1\",\n      \"resolved\": \"https://registry.npmjs.org/jest-validate/-/jest-validate-21.2.1.tgz\",\n      \"integrity\": \"sha512-k4HLI1rZQjlU+EC682RlQ6oZvLrE5SCh3brseQc24vbZTxzT/k/3urar5QMCVgjadmSO7lECeGdc6YxnM3yEGg==\",\n      \"dev\": true,\n      \"dependencies\": {\n        \"chalk\": \"^2.0.1\",\n        \"jest-get-type\": \"^21.2.0\",\n        \"leven\": \"^2.1.0\",\n        \"pretty-format\": \"^21.2.1\"\n      }\n    },\n    \"node_modules/jest-validate/node_modules/ansi-styles\": {\n      \"version\": \"3.2.0\",\n      \"resolved\": \"https://registry.npmjs.org/ansi-styles/-/ansi-styles-3.2.0.tgz\",\n      \"integrity\": \"sha512-NnSOmMEYtVR2JVMIGTzynRkkaxtiq1xnFBcdQD/DnNCYPoEPsVJhM98BDyaoNOQIi7p4okdi3E27eN7GQbsUug==\",\n      \"dev\": true,\n      \"dependencies\": {\n        \"color-convert\": \"^1.9.0\"\n      },\n      \"engines\": {\n        \"node\": \">=4\"\n      }\n    },\n    \"node_modules/jest-validate/node_modules/chalk\": {\n      \"version\": \"2.2.0\",\n      \"resolved\": \"https://registry.npmjs.org/chalk/-/chalk-2.2.0.tgz\",\n      \"integrity\": \"sha512-0BMM/2hG3ZaoPfR6F+h/oWpZtsh3b/s62TjSM6MGCJWEbJDN1acqCXvyhhZsDSVFklpebUoQ5O1kKC7lOzrn9g==\",\n      \"dev\": true,\n      \"dependencies\": {\n        \"ansi-styles\": \"^3.1.0\",\n        \"escape-string-regexp\": \"^1.0.5\",\n        \"supports-color\": \"^4.0.0\"\n      },\n      \"engines\": {\n        \"node\": \">=4\"\n      }\n    },\n    \"node_modules/jest-validate/node_modules/has-flag\": {\n      \"version\": \"2.0.0\",\n      \"resolved\": \"https://registry.npmjs.org/has-flag/-/has-flag-2.0.0.tgz\",\n      \"integrity\": \"sha1-6CB68cx7MNRGzHC3NLXovhj4jVE=\",\n      \"dev\": true,\n      \"engines\": {\n        \"node\": \">=0.10.0\"\n      }\n    },\n    \"node_modules/jest-validate/node_modules/supports-color\": {\n      \"version\": \"4.5.0\",\n      \"resolved\": \"https://registry.npmjs.org/supports-color/-/supports-color-4.5.0.tgz\",\n      \"integrity\": \"sha1-vnoN5ITexcXN34s9WRJQRJEvY1s=\",\n      \"dev\": true,\n      \"dependencies\": {\n        \"has-flag\": \"^2.0.0\"\n      },\n      \"engines\": {\n        \"node\": \">=4\"\n      }\n    },\n    \"node_modules/js-tokens\": {\n      \"version\": \"3.0.2\",\n      \"resolved\": \"https://registry.npmjs.org/js-tokens/-/js-tokens-3.0.2.tgz\",\n      \"integrity\": \"sha1-mGbfOVECEw449/mWvOtlRDIJwls=\",\n      \"dev\": true\n    },\n    \"node_modules/js-yaml\": {\n      \"version\": \"3.9.1\",\n      \"resolved\": \"https://registry.npmjs.org/js-yaml/-/js-yaml-3.9.1.tgz\",\n      \"integrity\": \"sha512-CbcG379L1e+mWBnLvHWWeLs8GyV/EMw862uLI3c+GxVyDHWZcjZinwuBd3iW2pgxgIlksW/1vNJa4to+RvDOww==\",\n      \"dev\": true,\n      \"dependencies\": {\n        \"argparse\": \"^1.0.7\",\n        \"esprima\": \"^4.0.0\"\n      },\n      \"bin\": {\n        \"js-yaml\": \"bin/js-yaml.js\"\n      }\n    },\n    \"node_modules/jsesc\": {\n      \"version\": \"0.5.0\",\n      \"resolved\": \"https://registry.npmjs.org/jsesc/-/jsesc-0.5.0.tgz\",\n      \"integrity\": \"sha1-597mbjXW/Bb3EP6R1c9p9w8IkR0=\",\n      \"dev\": true,\n      \"bin\": {\n        \"jsesc\": \"bin/jsesc\"\n      }\n    },\n    \"node_modules/json-stable-stringify\": {\n      \"version\": \"1.0.1\",\n      \"resolved\": \"https://registry.npmjs.org/json-stable-stringify/-/json-stable-stringify-1.0.1.tgz\",\n      \"integrity\": \"sha1-mnWdOcXy/1A/1TAGRu1EX4jE+a8=\",\n      \"dev\": true,\n      \"dependencies\": {\n        \"jsonify\": \"~0.0.0\"\n      }\n    },\n    \"node_modules/json5\": {\n      \"version\": \"0.5.1\",\n      \"resolved\": \"https://registry.npmjs.org/json5/-/json5-0.5.1.tgz\",\n      \"integrity\": \"sha1-Hq3nrMASA0rYTiOWdn6tn6VJWCE=\",\n      \"dev\": true,\n      \"bin\": {\n        \"json5\": \"lib/cli.js\"\n      }\n    },\n    \"node_modules/jsonify\": {\n      \"version\": \"0.0.0\",\n      \"resolved\": \"https://registry.npmjs.org/jsonify/-/jsonify-0.0.0.tgz\",\n      \"integrity\": \"sha1-LHS27kHZPKUbe1qu6PUDYx0lKnM=\",\n      \"dev\": true,\n      \"engines\": {\n        \"node\": \"*\"\n      }\n    },\n    \"node_modules/jsonpointer\": {\n      \"version\": \"4.0.1\",\n      \"resolved\": \"https://registry.npmjs.org/jsonpointer/-/jsonpointer-4.0.1.tgz\",\n      \"integrity\": \"sha1-T9kss04OnbPInIYi7PUfm5eMbLk=\",\n      \"dev\": true,\n      \"engines\": {\n        \"node\": \">=0.10.0\"\n      }\n    },\n    \"node_modules/kind-of\": {\n      \"version\": \"3.2.2\",\n      \"resolved\": \"https://registry.npmjs.org/kind-of/-/kind-of-3.2.2.tgz\",\n      \"integrity\": \"sha1-MeohpzS6ubuw8yRm2JOupR5KPGQ=\",\n      \"dev\": true,\n      \"dependencies\": {\n        \"is-buffer\": \"^1.1.5\"\n      },\n      \"engines\": {\n        \"node\": \">=0.10.0\"\n      }\n    },\n    \"node_modules/leven\": {\n      \"version\": \"2.1.0\",\n      \"resolved\": \"https://registry.npmjs.org/leven/-/leven-2.1.0.tgz\",\n      \"integrity\": \"sha1-wuep93IJTe6dNCAq6KzORoeHVYA=\",\n      \"dev\": true,\n      \"engines\": {\n        \"node\": \">=0.10.0\"\n      }\n    },\n    \"node_modules/levn\": {\n      \"version\": \"0.3.0\",\n      \"resolved\": \"https://registry.npmjs.org/levn/-/levn-0.3.0.tgz\",\n      \"integrity\": \"sha1-OwmSTt+fCDwEkP3UwLxEIeBHZO4=\",\n      \"dev\": true,\n      \"dependencies\": {\n        \"prelude-ls\": \"~1.1.2\",\n        \"type-check\": \"~0.3.2\"\n      },\n      \"engines\": {\n        \"node\": \">= 0.8.0\"\n      }\n    },\n    \"node_modules/liftoff\": {\n      \"version\": \"2.3.0\",\n      \"resolved\": \"https://registry.npmjs.org/liftoff/-/liftoff-2.3.0.tgz\",\n      \"integrity\": \"sha1-qY8v9nGD2Lp8+soQVIvX/wVQs4U=\",\n      \"dev\": true,\n      \"dependencies\": {\n        \"extend\": \"^3.0.0\",\n        \"findup-sync\": \"^0.4.2\",\n        \"fined\": \"^1.0.1\",\n        \"flagged-respawn\": \"^0.3.2\",\n        \"lodash.isplainobject\": \"^4.0.4\",\n        \"lodash.isstring\": \"^4.0.1\",\n        \"lodash.mapvalues\": \"^4.4.0\",\n        \"rechoir\": \"^0.6.2\",\n        \"resolve\": \"^1.1.7\"\n      },\n      \"engines\": {\n        \"node\": \">= 0.8\"\n      }\n    },\n    \"node_modules/lint-staged\": {\n      \"version\": \"4.3.0\",\n      \"resolved\": \"https://registry.npmjs.org/lint-staged/-/lint-staged-4.3.0.tgz\",\n      \"integrity\": \"sha512-C/Zxslg0VRbsxwmCu977iIs+QyrmW2cyRCPUV5NDFYOH/jtRFHH8ch7ua2fH0voI/nVC3Tpg7DykfgMZySliKw==\",\n      \"dev\": true,\n      \"dependencies\": {\n        \"app-root-path\": \"^2.0.0\",\n        \"chalk\": \"^2.1.0\",\n        \"commander\": \"^2.11.0\",\n        \"cosmiconfig\": \"^1.1.0\",\n        \"execa\": \"^0.8.0\",\n        \"is-glob\": \"^4.0.0\",\n        \"jest-validate\": \"^21.1.0\",\n        \"listr\": \"^0.12.0\",\n        \"lodash\": \"^4.17.4\",\n        \"log-symbols\": \"^2.0.0\",\n        \"minimatch\": \"^3.0.0\",\n        \"npm-which\": \"^3.0.1\",\n        \"p-map\": \"^1.1.1\",\n        \"staged-git-files\": \"0.0.4\",\n        \"stringify-object\": \"^3.2.0\"\n      },\n      \"bin\": {\n        \"lint-staged\": \"index.js\"\n      },\n      \"engines\": {\n        \"node\": \">=4.2.0\"\n      }\n    },\n    \"node_modules/lint-staged/node_modules/ansi-styles\": {\n      \"version\": \"3.2.0\",\n      \"resolved\": \"https://registry.npmjs.org/ansi-styles/-/ansi-styles-3.2.0.tgz\",\n      \"integrity\": \"sha512-NnSOmMEYtVR2JVMIGTzynRkkaxtiq1xnFBcdQD/DnNCYPoEPsVJhM98BDyaoNOQIi7p4okdi3E27eN7GQbsUug==\",\n      \"dev\": true,\n      \"dependencies\": {\n        \"color-convert\": \"^1.9.0\"\n      },\n      \"engines\": {\n        \"node\": \">=4\"\n      }\n    },\n    \"node_modules/lint-staged/node_modules/chalk\": {\n      \"version\": \"2.2.0\",\n      \"resolved\": \"https://registry.npmjs.org/chalk/-/chalk-2.2.0.tgz\",\n      \"integrity\": \"sha512-0BMM/2hG3ZaoPfR6F+h/oWpZtsh3b/s62TjSM6MGCJWEbJDN1acqCXvyhhZsDSVFklpebUoQ5O1kKC7lOzrn9g==\",\n      \"dev\": true,\n      \"dependencies\": {\n        \"ansi-styles\": \"^3.1.0\",\n        \"escape-string-regexp\": \"^1.0.5\",\n        \"supports-color\": \"^4.0.0\"\n      },\n      \"engines\": {\n        \"node\": \">=4\"\n      }\n    },\n    \"node_modules/lint-staged/node_modules/commander\": {\n      \"version\": \"2.11.0\",\n      \"resolved\": \"https://registry.npmjs.org/commander/-/commander-2.11.0.tgz\",\n      \"integrity\": \"sha512-b0553uYA5YAEGgyYIGYROzKQ7X5RAqedkfjiZxwi0kL1g3bOaBNNZfYkzt/CL0umgD5wc9Jec2FbB98CjkMRvQ==\",\n      \"dev\": true\n    },\n    \"node_modules/lint-staged/node_modules/has-flag\": {\n      \"version\": \"2.0.0\",\n      \"resolved\": \"https://registry.npmjs.org/has-flag/-/has-flag-2.0.0.tgz\",\n      \"integrity\": \"sha1-6CB68cx7MNRGzHC3NLXovhj4jVE=\",\n      \"dev\": true,\n      \"engines\": {\n        \"node\": \">=0.10.0\"\n      }\n    },\n    \"node_modules/lint-staged/node_modules/is-extglob\": {\n      \"version\": \"2.1.1\",\n      \"resolved\": \"https://registry.npmjs.org/is-extglob/-/is-extglob-2.1.1.tgz\",\n      \"integrity\": \"sha1-qIwCU1eR8C7TfHahueqXc8gz+MI=\",\n      \"dev\": true,\n      \"engines\": {\n        \"node\": \">=0.10.0\"\n      }\n    },\n    \"node_modules/lint-staged/node_modules/is-glob\": {\n      \"version\": \"4.0.0\",\n      \"resolved\": \"https://registry.npmjs.org/is-glob/-/is-glob-4.0.0.tgz\",\n      \"integrity\": \"sha1-lSHHaEXMJhCoUgPd8ICpWML/q8A=\",\n      \"dev\": true,\n      \"dependencies\": {\n        \"is-extglob\": \"^2.1.1\"\n      },\n      \"engines\": {\n        \"node\": \">=0.10.0\"\n      }\n    },\n    \"node_modules/lint-staged/node_modules/supports-color\": {\n      \"version\": \"4.5.0\",\n      \"resolved\": \"https://registry.npmjs.org/supports-color/-/supports-color-4.5.0.tgz\",\n      \"integrity\": \"sha1-vnoN5ITexcXN34s9WRJQRJEvY1s=\",\n      \"dev\": true,\n      \"dependencies\": {\n        \"has-flag\": \"^2.0.0\"\n      },\n      \"engines\": {\n        \"node\": \">=4\"\n      }\n    },\n    \"node_modules/listr\": {\n      \"version\": \"0.12.0\",\n      \"resolved\": \"https://registry.npmjs.org/listr/-/listr-0.12.0.tgz\",\n      \"integrity\": \"sha1-a84sD1YD+klYDqF81qAMwOX6RRo=\",\n      \"dev\": true,\n      \"dependencies\": {\n        \"chalk\": \"^1.1.3\",\n        \"cli-truncate\": \"^0.2.1\",\n        \"figures\": \"^1.7.0\",\n        \"indent-string\": \"^2.1.0\",\n        \"is-promise\": \"^2.1.0\",\n        \"is-stream\": \"^1.1.0\",\n        \"listr-silent-renderer\": \"^1.1.1\",\n        \"listr-update-renderer\": \"^0.2.0\",\n        \"listr-verbose-renderer\": \"^0.4.0\",\n        \"log-symbols\": \"^1.0.2\",\n        \"log-update\": \"^1.0.2\",\n        \"ora\": \"^0.2.3\",\n        \"p-map\": \"^1.1.1\",\n        \"rxjs\": \"^5.0.0-beta.11\",\n        \"stream-to-observable\": \"^0.1.0\",\n        \"strip-ansi\": \"^3.0.1\"\n      },\n      \"engines\": {\n        \"node\": \">=4\"\n      }\n    },\n    \"node_modules/listr-silent-renderer\": {\n      \"version\": \"1.1.1\",\n      \"resolved\": \"https://registry.npmjs.org/listr-silent-renderer/-/listr-silent-renderer-1.1.1.tgz\",\n      \"integrity\": \"sha1-kktaN1cVN3C/Go4/v3S4u/P5JC4=\",\n      \"dev\": true,\n      \"engines\": {\n        \"node\": \">=4\"\n      }\n    },\n    \"node_modules/listr-update-renderer\": {\n      \"version\": \"0.2.0\",\n      \"resolved\": \"https://registry.npmjs.org/listr-update-renderer/-/listr-update-renderer-0.2.0.tgz\",\n      \"integrity\": \"sha1-yoDhd5tOcCZoB+ju0a1qvjmFUPk=\",\n      \"dev\": true,\n      \"dependencies\": {\n        \"chalk\": \"^1.1.3\",\n        \"cli-truncate\": \"^0.2.1\",\n        \"elegant-spinner\": \"^1.0.1\",\n        \"figures\": \"^1.7.0\",\n        \"indent-string\": \"^3.0.0\",\n        \"log-symbols\": \"^1.0.2\",\n        \"log-update\": \"^1.0.2\",\n        \"strip-ansi\": \"^3.0.1\"\n      },\n      \"engines\": {\n        \"node\": \">=4\"\n      }\n    },\n    \"node_modules/listr-update-renderer/node_modules/indent-string\": {\n      \"version\": \"3.2.0\",\n      \"resolved\": \"https://registry.npmjs.org/indent-string/-/indent-string-3.2.0.tgz\",\n      \"integrity\": \"sha1-Sl/W0nzDMvN+VBmlBNu4NxBckok=\",\n      \"dev\": true,\n      \"engines\": {\n        \"node\": \">=4\"\n      }\n    },\n    \"node_modules/listr-update-renderer/node_modules/log-symbols\": {\n      \"version\": \"1.0.2\",\n      \"resolved\": \"https://registry.npmjs.org/log-symbols/-/log-symbols-1.0.2.tgz\",\n      \"integrity\": \"sha1-N2/3tY6jCGoPCfrMdGF+ylAeGhg=\",\n      \"dev\": true,\n      \"dependencies\": {\n        \"chalk\": \"^1.0.0\"\n      },\n      \"engines\": {\n        \"node\": \">=0.10.0\"\n      }\n    },\n    \"node_modules/listr-verbose-renderer\": {\n      \"version\": \"0.4.0\",\n      \"resolved\": \"https://registry.npmjs.org/listr-verbose-renderer/-/listr-verbose-renderer-0.4.0.tgz\",\n      \"integrity\": \"sha1-RNwBuww0oDxXIVTU0Izemx3FYg8=\",\n      \"dev\": true,\n      \"dependencies\": {\n        \"chalk\": \"^1.1.3\",\n        \"cli-cursor\": \"^1.0.2\",\n        \"date-fns\": \"^1.27.2\",\n        \"figures\": \"^1.7.0\"\n      },\n      \"engines\": {\n        \"node\": \">=4\"\n      }\n    },\n    \"node_modules/listr/node_modules/log-symbols\": {\n      \"version\": \"1.0.2\",\n      \"resolved\": \"https://registry.npmjs.org/log-symbols/-/log-symbols-1.0.2.tgz\",\n      \"integrity\": \"sha1-N2/3tY6jCGoPCfrMdGF+ylAeGhg=\",\n      \"dev\": true,\n      \"dependencies\": {\n        \"chalk\": \"^1.0.0\"\n      },\n      \"engines\": {\n        \"node\": \">=0.10.0\"\n      }\n    },\n    \"node_modules/load-json-file\": {\n      \"version\": \"1.1.0\",\n      \"resolved\": \"https://registry.npmjs.org/load-json-file/-/load-json-file-1.1.0.tgz\",\n      \"integrity\": \"sha1-lWkFcI1YtLq0wiYbBPWfMcmTdMA=\",\n      \"dev\": true,\n      \"dependencies\": {\n        \"graceful-fs\": \"^4.1.2\",\n        \"parse-json\": \"^2.2.0\",\n        \"pify\": \"^2.0.0\",\n        \"pinkie-promise\": \"^2.0.0\",\n        \"strip-bom\": \"^2.0.0\"\n      },\n      \"engines\": {\n        \"node\": \">=0.10.0\"\n      }\n    },\n    \"node_modules/load-json-file/node_modules/strip-bom\": {\n      \"version\": \"2.0.0\",\n      \"resolved\": \"https://registry.npmjs.org/strip-bom/-/strip-bom-2.0.0.tgz\",\n      \"integrity\": \"sha1-YhmoVhZSBJHzV4i9vxRHqZx+aw4=\",\n      \"dev\": true,\n      \"dependencies\": {\n        \"is-utf8\": \"^0.2.0\"\n      },\n      \"engines\": {\n        \"node\": \">=0.10.0\"\n      }\n    },\n    \"node_modules/lodash\": {\n      \"version\": \"4.17.4\",\n      \"resolved\": \"https://registry.npmjs.org/lodash/-/lodash-4.17.4.tgz\",\n      \"integrity\": \"sha1-eCA6TRwyiuHYbcpkYONptX9AVa4=\",\n      \"dev\": true\n    },\n    \"node_modules/lodash._basecopy\": {\n      \"version\": \"3.0.1\",\n      \"resolved\": \"https://registry.npmjs.org/lodash._basecopy/-/lodash._basecopy-3.0.1.tgz\",\n      \"integrity\": \"sha1-jaDmqHbPNEwK2KVIghEd08XHyjY=\",\n      \"dev\": true\n    },\n    \"node_modules/lodash._basetostring\": {\n      \"version\": \"3.0.1\",\n      \"resolved\": \"https://registry.npmjs.org/lodash._basetostring/-/lodash._basetostring-3.0.1.tgz\",\n      \"integrity\": \"sha1-0YYdh3+CSlL2aYMtyvPuFVZqB9U=\",\n      \"dev\": true\n    },\n    \"node_modules/lodash._basevalues\": {\n      \"version\": \"3.0.0\",\n      \"resolved\": \"https://registry.npmjs.org/lodash._basevalues/-/lodash._basevalues-3.0.0.tgz\",\n      \"integrity\": \"sha1-W3dXYoAr3j0yl1A+JjAIIP32Ybc=\",\n      \"dev\": true\n    },\n    \"node_modules/lodash._escapehtmlchar\": {\n      \"version\": \"2.4.1\",\n      \"resolved\": \"https://registry.npmjs.org/lodash._escapehtmlchar/-/lodash._escapehtmlchar-2.4.1.tgz\",\n      \"integrity\": \"sha1-32fDu2t+jh6DGrSL+geVuSr+iZ0=\",\n      \"dev\": true,\n      \"dependencies\": {\n        \"lodash._htmlescapes\": \"~2.4.1\"\n      }\n    },\n    \"node_modules/lodash._escapestringchar\": {\n      \"version\": \"2.4.1\",\n      \"resolved\": \"https://registry.npmjs.org/lodash._escapestringchar/-/lodash._escapestringchar-2.4.1.tgz\",\n      \"integrity\": \"sha1-7P4iYYoq3lC/7qQ5N+Ud9m8O23I=\",\n      \"dev\": true\n    },\n    \"node_modules/lodash._getnative\": {\n      \"version\": \"3.9.1\",\n      \"resolved\": \"https://registry.npmjs.org/lodash._getnative/-/lodash._getnative-3.9.1.tgz\",\n      \"integrity\": \"sha1-VwvH3t5G1hzc3mh9ZdPuy6o6r/U=\",\n      \"dev\": true\n    },\n    \"node_modules/lodash._htmlescapes\": {\n      \"version\": \"2.4.1\",\n      \"resolved\": \"https://registry.npmjs.org/lodash._htmlescapes/-/lodash._htmlescapes-2.4.1.tgz\",\n      \"integrity\": \"sha1-MtFL8IRLbeb4tioFG09nwii2JMs=\",\n      \"dev\": true\n    },\n    \"node_modules/lodash._isiterateecall\": {\n      \"version\": \"3.0.9\",\n      \"resolved\": \"https://registry.npmjs.org/lodash._isiterateecall/-/lodash._isiterateecall-3.0.9.tgz\",\n      \"integrity\": \"sha1-UgOte6Ql+uhCRg5pbbnPPmqsBXw=\",\n      \"dev\": true\n    },\n    \"node_modules/lodash._isnative\": {\n      \"version\": \"2.4.1\",\n      \"resolved\": \"https://registry.npmjs.org/lodash._isnative/-/lodash._isnative-2.4.1.tgz\",\n      \"integrity\": \"sha1-PqZAS3hKe+g2x7V1gOHN95sUgyw=\",\n      \"dev\": true\n    },\n    \"node_modules/lodash._objecttypes\": {\n      \"version\": \"2.4.1\",\n      \"resolved\": \"https://registry.npmjs.org/lodash._objecttypes/-/lodash._objecttypes-2.4.1.tgz\",\n      \"integrity\": \"sha1-fAt/admKH3ZSn4kLDNsbTf7BHBE=\",\n      \"dev\": true\n    },\n    \"node_modules/lodash._reescape\": {\n      \"version\": \"3.0.0\",\n      \"resolved\": \"https://registry.npmjs.org/lodash._reescape/-/lodash._reescape-3.0.0.tgz\",\n      \"integrity\": \"sha1-Kx1vXf4HyKNVdT5fJ/rH8c3hYWo=\",\n      \"dev\": true\n    },\n    \"node_modules/lodash._reevaluate\": {\n      \"version\": \"3.0.0\",\n      \"resolved\": \"https://registry.npmjs.org/lodash._reevaluate/-/lodash._reevaluate-3.0.0.tgz\",\n      \"integrity\": \"sha1-WLx0xAZklTrgsSTYBpltrKQx4u0=\",\n      \"dev\": true\n    },\n    \"node_modules/lodash._reinterpolate\": {\n      \"version\": \"3.0.0\",\n      \"resolved\": \"https://registry.npmjs.org/lodash._reinterpolate/-/lodash._reinterpolate-3.0.0.tgz\",\n      \"integrity\": \"sha1-DM8tiRZq8Ds2Y8eWU4t1rG4RTZ0=\",\n      \"dev\": true\n    },\n    \"node_modules/lodash._reunescapedhtml\": {\n      \"version\": \"2.4.1\",\n      \"resolved\": \"https://registry.npmjs.org/lodash._reunescapedhtml/-/lodash._reunescapedhtml-2.4.1.tgz\",\n      \"integrity\": \"sha1-dHxPxAED6zu4oJduVx96JlnpO6c=\",\n      \"dev\": true,\n      \"dependencies\": {\n        \"lodash._htmlescapes\": \"~2.4.1\",\n        \"lodash.keys\": \"~2.4.1\"\n      }\n    },\n    \"node_modules/lodash._reunescapedhtml/node_modules/lodash.keys\": {\n      \"version\": \"2.4.1\",\n      \"resolved\": \"https://registry.npmjs.org/lodash.keys/-/lodash.keys-2.4.1.tgz\",\n      \"integrity\": \"sha1-SN6kbfj/djKxDXBrissmWR4rNyc=\",\n      \"dev\": true,\n      \"dependencies\": {\n        \"lodash._isnative\": \"~2.4.1\",\n        \"lodash._shimkeys\": \"~2.4.1\",\n        \"lodash.isobject\": \"~2.4.1\"\n      }\n    },\n    \"node_modules/lodash._root\": {\n      \"version\": \"3.0.1\",\n      \"resolved\": \"https://registry.npmjs.org/lodash._root/-/lodash._root-3.0.1.tgz\",\n      \"integrity\": \"sha1-+6HEUkwZ7ppfgTa0YJ8BfPTe1pI=\",\n      \"dev\": true\n    },\n    \"node_modules/lodash._shimkeys\": {\n      \"version\": \"2.4.1\",\n      \"resolved\": \"https://registry.npmjs.org/lodash._shimkeys/-/lodash._shimkeys-2.4.1.tgz\",\n      \"integrity\": \"sha1-bpzJZm/wgfC1psl4uD4kLmlJ0gM=\",\n      \"dev\": true,\n      \"dependencies\": {\n        \"lodash._objecttypes\": \"~2.4.1\"\n      }\n    },\n    \"node_modules/lodash.defaults\": {\n      \"version\": \"2.4.1\",\n      \"resolved\": \"https://registry.npmjs.org/lodash.defaults/-/lodash.defaults-2.4.1.tgz\",\n      \"integrity\": \"sha1-p+iIXwXmiFEUS24SqPNngCa8TFQ=\",\n      \"dev\": true,\n      \"dependencies\": {\n        \"lodash._objecttypes\": \"~2.4.1\",\n        \"lodash.keys\": \"~2.4.1\"\n      }\n    },\n    \"node_modules/lodash.defaults/node_modules/lodash.keys\": {\n      \"version\": \"2.4.1\",\n      \"resolved\": \"https://registry.npmjs.org/lodash.keys/-/lodash.keys-2.4.1.tgz\",\n      \"integrity\": \"sha1-SN6kbfj/djKxDXBrissmWR4rNyc=\",\n      \"dev\": true,\n      \"dependencies\": {\n        \"lodash._isnative\": \"~2.4.1\",\n        \"lodash._shimkeys\": \"~2.4.1\",\n        \"lodash.isobject\": \"~2.4.1\"\n      }\n    },\n    \"node_modules/lodash.escape\": {\n      \"version\": \"3.2.0\",\n      \"resolved\": \"https://registry.npmjs.org/lodash.escape/-/lodash.escape-3.2.0.tgz\",\n      \"integrity\": \"sha1-mV7g3BjBtIzJLv+ucaEKq1tIdpg=\",\n      \"dev\": true,\n      \"dependencies\": {\n        \"lodash._root\": \"^3.0.0\"\n      }\n    },\n    \"node_modules/lodash.isarguments\": {\n      \"version\": \"3.1.0\",\n      \"resolved\": \"https://registry.npmjs.org/lodash.isarguments/-/lodash.isarguments-3.1.0.tgz\",\n      \"integrity\": \"sha1-L1c9hcaiQon/AGY7SRwdM4/zRYo=\",\n      \"dev\": true\n    },\n    \"node_modules/lodash.isarray\": {\n      \"version\": \"3.0.4\",\n      \"resolved\": \"https://registry.npmjs.org/lodash.isarray/-/lodash.isarray-3.0.4.tgz\",\n      \"integrity\": \"sha1-eeTriMNqgSKvhvhEqpvNhRtfu1U=\",\n      \"dev\": true\n    },\n    \"node_modules/lodash.isobject\": {\n      \"version\": \"2.4.1\",\n      \"resolved\": \"https://registry.npmjs.org/lodash.isobject/-/lodash.isobject-2.4.1.tgz\",\n      \"integrity\": \"sha1-Wi5H/mmVPx7mMafrof5k0tBlWPU=\",\n      \"dev\": true,\n      \"dependencies\": {\n        \"lodash._objecttypes\": \"~2.4.1\"\n      }\n    },\n    \"node_modules/lodash.isplainobject\": {\n      \"version\": \"4.0.6\",\n      \"resolved\": \"https://registry.npmjs.org/lodash.isplainobject/-/lodash.isplainobject-4.0.6.tgz\",\n      \"integrity\": \"sha1-fFJqUtibRcRcxpC4gWO+BJf1UMs=\",\n      \"dev\": true\n    },\n    \"node_modules/lodash.isstring\": {\n      \"version\": \"4.0.1\",\n      \"resolved\": \"https://registry.npmjs.org/lodash.isstring/-/lodash.isstring-4.0.1.tgz\",\n      \"integrity\": \"sha1-1SfftUVuynzJu5XV2ur4i6VKVFE=\",\n      \"dev\": true\n    },\n    \"node_modules/lodash.keys\": {\n      \"version\": \"3.1.2\",\n      \"resolved\": \"https://registry.npmjs.org/lodash.keys/-/lodash.keys-3.1.2.tgz\",\n      \"integrity\": \"sha1-TbwEcrFWvlCgsoaFXRvQsMZWCYo=\",\n      \"dev\": true,\n      \"dependencies\": {\n        \"lodash._getnative\": \"^3.0.0\",\n        \"lodash.isarguments\": \"^3.0.0\",\n        \"lodash.isarray\": \"^3.0.0\"\n      }\n    },\n    \"node_modules/lodash.mapvalues\": {\n      \"version\": \"4.6.0\",\n      \"resolved\": \"https://registry.npmjs.org/lodash.mapvalues/-/lodash.mapvalues-4.6.0.tgz\",\n      \"integrity\": \"sha1-G6+lAF3p3W9PJmaMMMo3IwzJaJw=\",\n      \"dev\": true\n    },\n    \"node_modules/lodash.restparam\": {\n      \"version\": \"3.6.1\",\n      \"resolved\": \"https://registry.npmjs.org/lodash.restparam/-/lodash.restparam-3.6.1.tgz\",\n      \"integrity\": \"sha1-k2pOMJ7zMKdkXtQUWYbIWuWyCAU=\",\n      \"dev\": true\n    },\n    \"node_modules/lodash.template\": {\n      \"version\": \"3.6.2\",\n      \"resolved\": \"https://registry.npmjs.org/lodash.template/-/lodash.template-3.6.2.tgz\",\n      \"integrity\": \"sha1-+M3sxhaaJVvpCYrosMU9N4kx0U8=\",\n      \"dev\": true,\n      \"dependencies\": {\n        \"lodash._basecopy\": \"^3.0.0\",\n        \"lodash._basetostring\": \"^3.0.0\",\n        \"lodash._basevalues\": \"^3.0.0\",\n        \"lodash._isiterateecall\": \"^3.0.0\",\n        \"lodash._reinterpolate\": \"^3.0.0\",\n        \"lodash.escape\": \"^3.0.0\",\n        \"lodash.keys\": \"^3.0.0\",\n        \"lodash.restparam\": \"^3.0.0\",\n        \"lodash.templatesettings\": \"^3.0.0\"\n      }\n    },\n    \"node_modules/lodash.templatesettings\": {\n      \"version\": \"3.1.1\",\n      \"resolved\": \"https://registry.npmjs.org/lodash.templatesettings/-/lodash.templatesettings-3.1.1.tgz\",\n      \"integrity\": \"sha1-+zB4RHU7Zrnxr6VOJix0UwfbqOU=\",\n      \"dev\": true,\n      \"dependencies\": {\n        \"lodash._reinterpolate\": \"^3.0.0\",\n        \"lodash.escape\": \"^3.0.0\"\n      }\n    },\n    \"node_modules/lodash.values\": {\n      \"version\": \"2.4.1\",\n      \"resolved\": \"https://registry.npmjs.org/lodash.values/-/lodash.values-2.4.1.tgz\",\n      \"integrity\": \"sha1-q/UUQ2s8twUAFieXjLzzCxKA7qQ=\",\n      \"dev\": true,\n      \"dependencies\": {\n        \"lodash.keys\": \"~2.4.1\"\n      }\n    },\n    \"node_modules/lodash.values/node_modules/lodash.keys\": {\n      \"version\": \"2.4.1\",\n      \"resolved\": \"https://registry.npmjs.org/lodash.keys/-/lodash.keys-2.4.1.tgz\",\n      \"integrity\": \"sha1-SN6kbfj/djKxDXBrissmWR4rNyc=\",\n      \"dev\": true,\n      \"dependencies\": {\n        \"lodash._isnative\": \"~2.4.1\",\n        \"lodash._shimkeys\": \"~2.4.1\",\n        \"lodash.isobject\": \"~2.4.1\"\n      }\n    },\n    \"node_modules/log-symbols\": {\n      \"version\": \"2.1.0\",\n      \"resolved\": \"https://registry.npmjs.org/log-symbols/-/log-symbols-2.1.0.tgz\",\n      \"integrity\": \"sha512-zLeLrzMA1A2vRF1e/0Mo+LNINzi6jzBylHj5WqvQ/WK/5WCZt8si9SyN4p9llr/HRYvVR1AoXHRHl4WTHyQAzQ==\",\n      \"dev\": true,\n      \"dependencies\": {\n        \"chalk\": \"^2.0.1\"\n      },\n      \"engines\": {\n        \"node\": \">=4\"\n      }\n    },\n    \"node_modules/log-symbols/node_modules/ansi-styles\": {\n      \"version\": \"3.2.0\",\n      \"resolved\": \"https://registry.npmjs.org/ansi-styles/-/ansi-styles-3.2.0.tgz\",\n      \"integrity\": \"sha512-NnSOmMEYtVR2JVMIGTzynRkkaxtiq1xnFBcdQD/DnNCYPoEPsVJhM98BDyaoNOQIi7p4okdi3E27eN7GQbsUug==\",\n      \"dev\": true,\n      \"dependencies\": {\n        \"color-convert\": \"^1.9.0\"\n      },\n      \"engines\": {\n        \"node\": \">=4\"\n      }\n    },\n    \"node_modules/log-symbols/node_modules/chalk\": {\n      \"version\": \"2.2.0\",\n      \"resolved\": \"https://registry.npmjs.org/chalk/-/chalk-2.2.0.tgz\",\n      \"integrity\": \"sha512-0BMM/2hG3ZaoPfR6F+h/oWpZtsh3b/s62TjSM6MGCJWEbJDN1acqCXvyhhZsDSVFklpebUoQ5O1kKC7lOzrn9g==\",\n      \"dev\": true,\n      \"dependencies\": {\n        \"ansi-styles\": \"^3.1.0\",\n        \"escape-string-regexp\": \"^1.0.5\",\n        \"supports-color\": \"^4.0.0\"\n      },\n      \"engines\": {\n        \"node\": \">=4\"\n      }\n    },\n    \"node_modules/log-symbols/node_modules/has-flag\": {\n      \"version\": \"2.0.0\",\n      \"resolved\": \"https://registry.npmjs.org/has-flag/-/has-flag-2.0.0.tgz\",\n      \"integrity\": \"sha1-6CB68cx7MNRGzHC3NLXovhj4jVE=\",\n      \"dev\": true,\n      \"engines\": {\n        \"node\": \">=0.10.0\"\n      }\n    },\n    \"node_modules/log-symbols/node_modules/supports-color\": {\n      \"version\": \"4.5.0\",\n      \"resolved\": \"https://registry.npmjs.org/supports-color/-/supports-color-4.5.0.tgz\",\n      \"integrity\": \"sha1-vnoN5ITexcXN34s9WRJQRJEvY1s=\",\n      \"dev\": true,\n      \"dependencies\": {\n        \"has-flag\": \"^2.0.0\"\n      },\n      \"engines\": {\n        \"node\": \">=4\"\n      }\n    },\n    \"node_modules/log-update\": {\n      \"version\": \"1.0.2\",\n      \"resolved\": \"https://registry.npmjs.org/log-update/-/log-update-1.0.2.tgz\",\n      \"integrity\": \"sha1-GZKfZMQJPS0ucHWh2tivWcKWuNE=\",\n      \"dev\": true,\n      \"dependencies\": {\n        \"ansi-escapes\": \"^1.0.0\",\n        \"cli-cursor\": \"^1.0.2\"\n      },\n      \"engines\": {\n        \"node\": \">=0.10.0\"\n      }\n    },\n    \"node_modules/loose-envify\": {\n      \"version\": \"1.3.1\",\n      \"resolved\": \"https://registry.npmjs.org/loose-envify/-/loose-envify-1.3.1.tgz\",\n      \"integrity\": \"sha1-0aitM/qc4OcT1l/dCsi3SNR4yEg=\",\n      \"dev\": true,\n      \"dependencies\": {\n        \"js-tokens\": \"^3.0.0\"\n      },\n      \"bin\": {\n        \"loose-envify\": \"cli.js\"\n      }\n    },\n    \"node_modules/loud-rejection\": {\n      \"version\": \"1.6.0\",\n      \"resolved\": \"https://registry.npmjs.org/loud-rejection/-/loud-rejection-1.6.0.tgz\",\n      \"integrity\": \"sha1-W0b4AUft7leIcPCG0Eghz5mOVR8=\",\n      \"dev\": true,\n      \"dependencies\": {\n        \"currently-unhandled\": \"^0.4.1\",\n        \"signal-exit\": \"^3.0.0\"\n      },\n      \"engines\": {\n        \"node\": \">=0.10.0\"\n      }\n    },\n    \"node_modules/lru-cache\": {\n      \"version\": \"2.7.3\",\n      \"resolved\": \"https://registry.npmjs.org/lru-cache/-/lru-cache-2.7.3.tgz\",\n      \"integrity\": \"sha1-bUUk6LlV+V1PW1iFHOId1y+06VI=\"\n    },\n    \"node_modules/map-cache\": {\n      \"version\": \"0.2.2\",\n      \"resolved\": \"https://registry.npmjs.org/map-cache/-/map-cache-0.2.2.tgz\",\n      \"integrity\": \"sha1-wyq9C9ZSXZsFFkW7TyasXcmKDb8=\",\n      \"dev\": true,\n      \"engines\": {\n        \"node\": \">=0.10.0\"\n      }\n    },\n    \"node_modules/map-obj\": {\n      \"version\": \"1.0.1\",\n      \"resolved\": \"https://registry.npmjs.org/map-obj/-/map-obj-1.0.1.tgz\",\n      \"integrity\": \"sha1-2TPOuSBdgr3PSIb2dCvcK03qFG0=\",\n      \"dev\": true,\n      \"engines\": {\n        \"node\": \">=0.10.0\"\n      }\n    },\n    \"node_modules/media-typer\": {\n      \"version\": \"0.3.0\",\n      \"resolved\": \"https://registry.npmjs.org/media-typer/-/media-typer-0.3.0.tgz\",\n      \"integrity\": \"sha1-hxDXrwqmJvj/+hzgAWhUUmMlV0g=\",\n      \"dev\": true,\n      \"engines\": {\n        \"node\": \">= 0.6\"\n      }\n    },\n    \"node_modules/meow\": {\n      \"version\": \"3.7.0\",\n      \"resolved\": \"https://registry.npmjs.org/meow/-/meow-3.7.0.tgz\",\n      \"integrity\": \"sha1-cstmi0JSKCkKu/qFaJJYcwioAfs=\",\n      \"dev\": true,\n      \"dependencies\": {\n        \"camelcase-keys\": \"^2.0.0\",\n        \"decamelize\": \"^1.1.2\",\n        \"loud-rejection\": \"^1.0.0\",\n        \"map-obj\": \"^1.0.1\",\n        \"minimist\": \"^1.1.3\",\n        \"normalize-package-data\": \"^2.3.4\",\n        \"object-assign\": \"^4.0.1\",\n        \"read-pkg-up\": \"^1.0.1\",\n        \"redent\": \"^1.0.0\",\n        \"trim-newlines\": \"^1.0.0\"\n      },\n      \"engines\": {\n        \"node\": \">=0.10.0\"\n      }\n    },\n    \"node_modules/meow/node_modules/minimist\": {\n      \"version\": \"1.2.0\",\n      \"resolved\": \"https://registry.npmjs.org/minimist/-/minimist-1.2.0.tgz\",\n      \"integrity\": \"sha1-o1AIsg9BOD7sH7kU9M1d95omQoQ=\",\n      \"dev\": true\n    },\n    \"node_modules/micromatch\": {\n      \"version\": \"2.3.11\",\n      \"resolved\": \"https://registry.npmjs.org/micromatch/-/micromatch-2.3.11.tgz\",\n      \"integrity\": \"sha1-hmd8l9FyCzY0MdBNDRUpO9OMFWU=\",\n      \"dev\": true,\n      \"dependencies\": {\n        \"arr-diff\": \"^2.0.0\",\n        \"array-unique\": \"^0.2.1\",\n        \"braces\": \"^1.8.2\",\n        \"expand-brackets\": \"^0.1.4\",\n        \"extglob\": \"^0.3.1\",\n        \"filename-regex\": \"^2.0.0\",\n        \"is-extglob\": \"^1.0.0\",\n        \"is-glob\": \"^2.0.1\",\n        \"kind-of\": \"^3.0.2\",\n        \"normalize-path\": \"^2.0.1\",\n        \"object.omit\": \"^2.0.0\",\n        \"parse-glob\": \"^3.0.4\",\n        \"regex-cache\": \"^0.4.2\"\n      },\n      \"engines\": {\n        \"node\": \">=0.10.0\"\n      }\n    },\n    \"node_modules/mime\": {\n      \"version\": \"1.3.4\",\n      \"resolved\": \"https://registry.npmjs.org/mime/-/mime-1.3.4.tgz\",\n      \"integrity\": \"sha1-EV+eO2s9rylZmDyzjxSaLUDrXVM=\",\n      \"dev\": true,\n      \"bin\": {\n        \"mime\": \"cli.js\"\n      }\n    },\n    \"node_modules/mime-db\": {\n      \"version\": \"1.30.0\",\n      \"resolved\": \"https://registry.npmjs.org/mime-db/-/mime-db-1.30.0.tgz\",\n      \"integrity\": \"sha1-dMZD2i3Z1qRTmZY0ZbJtXKfXHwE=\",\n      \"dev\": true,\n      \"engines\": {\n        \"node\": \">= 0.6\"\n      }\n    },\n    \"node_modules/mime-types\": {\n      \"version\": \"2.1.17\",\n      \"resolved\": \"https://registry.npmjs.org/mime-types/-/mime-types-2.1.17.tgz\",\n      \"integrity\": \"sha1-Cdejk/A+mVp5+K+Fe3Cp4KsWVXo=\",\n      \"dev\": true,\n      \"dependencies\": {\n        \"mime-db\": \"~1.30.0\"\n      },\n      \"engines\": {\n        \"node\": \">= 0.6\"\n      }\n    },\n    \"node_modules/minimatch\": {\n      \"version\": \"3.0.4\",\n      \"resolved\": \"https://registry.npmjs.org/minimatch/-/minimatch-3.0.4.tgz\",\n      \"integrity\": \"sha512-yJHVQEhyqPLUTgt9B83PXu6W3rx4MvvHvSUvToogpwoGDOUQ+yDrR0HRot+yOCdCO7u4hX3pWft6kWBBcqh0UA==\",\n      \"dev\": true,\n      \"dependencies\": {\n        \"brace-expansion\": \"^1.1.7\"\n      },\n      \"engines\": {\n        \"node\": \"*\"\n      }\n    },\n    \"node_modules/minimist\": {\n      \"version\": \"0.0.8\",\n      \"resolved\": \"https://registry.npmjs.org/minimist/-/minimist-0.0.8.tgz\",\n      \"integrity\": \"sha1-hX/Kv8M5fSYluCKCYuhqp6ARsF0=\"\n    },\n    \"node_modules/mkdirp\": {\n      \"version\": \"0.5.1\",\n      \"resolved\": \"https://registry.npmjs.org/mkdirp/-/mkdirp-0.5.1.tgz\",\n      \"integrity\": \"sha1-MAV0OOrGz3+MR2fzhkjWaX11yQM=\",\n      \"deprecated\": \"Legacy versions of mkdirp are no longer supported. Please update to mkdirp 1.x. (Note that the API surface has changed to use Promises in 1.x.)\",\n      \"dev\": true,\n      \"dependencies\": {\n        \"minimist\": \"0.0.8\"\n      },\n      \"bin\": {\n        \"mkdirp\": \"bin/cmd.js\"\n      }\n    },\n    \"node_modules/ms\": {\n      \"version\": \"2.0.0\",\n      \"resolved\": \"https://registry.npmjs.org/ms/-/ms-2.0.0.tgz\",\n      \"integrity\": \"sha1-VgiurfwAvmwpAd9fmGF4jeDVl8g=\",\n      \"dev\": true\n    },\n    \"node_modules/multipipe\": {\n      \"version\": \"0.1.2\",\n      \"resolved\": \"https://registry.npmjs.org/multipipe/-/multipipe-0.1.2.tgz\",\n      \"integrity\": \"sha1-Ko8t33Du1WTf8tV/HhoTfZ8FB4s=\",\n      \"dev\": true,\n      \"dependencies\": {\n        \"duplexer2\": \"0.0.2\"\n      }\n    },\n    \"node_modules/mute-stream\": {\n      \"version\": \"0.0.5\",\n      \"resolved\": \"https://registry.npmjs.org/mute-stream/-/mute-stream-0.0.5.tgz\",\n      \"integrity\": \"sha1-j7+rsKmKJT0xhDMfno3rc3L6xsA=\",\n      \"dev\": true\n    },\n    \"node_modules/nan\": {\n      \"version\": \"2.20.0\",\n      \"resolved\": \"https://registry.npmjs.org/nan/-/nan-2.20.0.tgz\",\n      \"integrity\": \"sha512-bk3gXBZDGILuuo/6sKtr0DQmSThYHLtNCdSdXk9YkxD/jK6X2vmCyyXBBxyqZ4XcnzTyYEAThfX3DCEnLf6igw==\",\n      \"optional\": true\n    },\n    \"node_modules/natives\": {\n      \"version\": \"1.1.0\",\n      \"resolved\": \"https://registry.npmjs.org/natives/-/natives-1.1.0.tgz\",\n      \"integrity\": \"sha1-6f+EFBimsux6SV6TmYT3jxY+bjE=\",\n      \"deprecated\": \"This module relies on Node.js's internals and will break at some point. Do not use it, and update to graceful-fs@4.x.\",\n      \"dev\": true\n    },\n    \"node_modules/natural-compare\": {\n      \"version\": \"1.4.0\",\n      \"resolved\": \"https://registry.npmjs.org/natural-compare/-/natural-compare-1.4.0.tgz\",\n      \"integrity\": \"sha1-Sr6/7tdUHywnrPspvbvRXI1bpPc=\",\n      \"dev\": true\n    },\n    \"node_modules/negotiator\": {\n      \"version\": \"0.6.1\",\n      \"resolved\": \"https://registry.npmjs.org/negotiator/-/negotiator-0.6.1.tgz\",\n      \"integrity\": \"sha1-KzJxhOiZIQEXeyhWP7XnECrNDKk=\",\n      \"dev\": true,\n      \"engines\": {\n        \"node\": \">= 0.6\"\n      }\n    },\n    \"node_modules/node.extend\": {\n      \"version\": \"1.1.6\",\n      \"resolved\": \"https://registry.npmjs.org/node.extend/-/node.extend-1.1.6.tgz\",\n      \"integrity\": \"sha1-p7iCyC1sk6SGOlUEvV3o7IYli5Y=\",\n      \"dev\": true,\n      \"dependencies\": {\n        \"is\": \"^3.1.0\"\n      },\n      \"engines\": {\n        \"node\": \">=0.4.0\"\n      }\n    },\n    \"node_modules/normalize-package-data\": {\n      \"version\": \"2.4.0\",\n      \"resolved\": \"https://registry.npmjs.org/normalize-package-data/-/normalize-package-data-2.4.0.tgz\",\n      \"integrity\": \"sha512-9jjUFbTPfEy3R/ad/2oNbKtW9Hgovl5O1FvFWKkKblNXoN/Oou6+9+KKohPK13Yc3/TyunyWhJp6gvRNR/PPAw==\",\n      \"dev\": true,\n      \"dependencies\": {\n        \"hosted-git-info\": \"^2.1.4\",\n        \"is-builtin-module\": \"^1.0.0\",\n        \"semver\": \"2 || 3 || 4 || 5\",\n        \"validate-npm-package-license\": \"^3.0.1\"\n      }\n    },\n    \"node_modules/normalize-path\": {\n      \"version\": \"2.1.1\",\n      \"resolved\": \"https://registry.npmjs.org/normalize-path/-/normalize-path-2.1.1.tgz\",\n      \"integrity\": \"sha1-GrKLVW4Zg2Oowab35vogE3/mrtk=\",\n      \"dev\": true,\n      \"dependencies\": {\n        \"remove-trailing-separator\": \"^1.0.1\"\n      },\n      \"engines\": {\n        \"node\": \">=0.10.0\"\n      }\n    },\n    \"node_modules/npm-path\": {\n      \"version\": \"2.0.3\",\n      \"resolved\": \"https://registry.npmjs.org/npm-path/-/npm-path-2.0.3.tgz\",\n      \"integrity\": \"sha1-Fc/04ciaONp39W9gVbJPl137K74=\",\n      \"dev\": true,\n      \"dependencies\": {\n        \"which\": \"^1.2.10\"\n      },\n      \"bin\": {\n        \"npm-path\": \"bin/npm-path\"\n      },\n      \"engines\": {\n        \"node\": \">=4.2.0\"\n      }\n    },\n    \"node_modules/npm-run-path\": {\n      \"version\": \"2.0.2\",\n      \"resolved\": \"https://registry.npmjs.org/npm-run-path/-/npm-run-path-2.0.2.tgz\",\n      \"integrity\": \"sha1-NakjLfo11wZ7TLLd8jV7GHFTbF8=\",\n      \"dev\": true,\n      \"dependencies\": {\n        \"path-key\": \"^2.0.0\"\n      },\n      \"engines\": {\n        \"node\": \">=4\"\n      }\n    },\n    \"node_modules/npm-which\": {\n      \"version\": \"3.0.1\",\n      \"resolved\": \"https://registry.npmjs.org/npm-which/-/npm-which-3.0.1.tgz\",\n      \"integrity\": \"sha1-kiXybsOihcIJyuZ8OxGmtKtxQKo=\",\n      \"dev\": true,\n      \"dependencies\": {\n        \"commander\": \"^2.9.0\",\n        \"npm-path\": \"^2.0.2\",\n        \"which\": \"^1.2.10\"\n      },\n      \"bin\": {\n        \"npm-which\": \"bin/npm-which.js\"\n      },\n      \"engines\": {\n        \"node\": \">=4.2.0\"\n      }\n    },\n    \"node_modules/npm-which/node_modules/commander\": {\n      \"version\": \"2.11.0\",\n      \"resolved\": \"https://registry.npmjs.org/commander/-/commander-2.11.0.tgz\",\n      \"integrity\": \"sha512-b0553uYA5YAEGgyYIGYROzKQ7X5RAqedkfjiZxwi0kL1g3bOaBNNZfYkzt/CL0umgD5wc9Jec2FbB98CjkMRvQ==\",\n      \"dev\": true\n    },\n    \"node_modules/number-is-nan\": {\n      \"version\": \"1.0.1\",\n      \"resolved\": \"https://registry.npmjs.org/number-is-nan/-/number-is-nan-1.0.1.tgz\",\n      \"integrity\": \"sha1-CXtgK1NCKlIsGvuHkDGDNpQaAR0=\",\n      \"dev\": true,\n      \"engines\": {\n        \"node\": \">=0.10.0\"\n      }\n    },\n    \"node_modules/object-assign\": {\n      \"version\": \"4.1.1\",\n      \"resolved\": \"https://registry.npmjs.org/object-assign/-/object-assign-4.1.1.tgz\",\n      \"integrity\": \"sha1-IQmtx5ZYh8/AXLvUQsrIv7s2CGM=\",\n      \"dev\": true,\n      \"engines\": {\n        \"node\": \">=0.10.0\"\n      }\n    },\n    \"node_modules/object.defaults\": {\n      \"version\": \"1.1.0\",\n      \"resolved\": \"https://registry.npmjs.org/object.defaults/-/object.defaults-1.1.0.tgz\",\n      \"integrity\": \"sha1-On+GgzS0B96gbaFtiNXNKeQ1/s8=\",\n      \"dev\": true,\n      \"dependencies\": {\n        \"array-each\": \"^1.0.1\",\n        \"array-slice\": \"^1.0.0\",\n        \"for-own\": \"^1.0.0\",\n        \"isobject\": \"^3.0.0\"\n      },\n      \"engines\": {\n        \"node\": \">=0.10.0\"\n      }\n    },\n    \"node_modules/object.defaults/node_modules/for-own\": {\n      \"version\": \"1.0.0\",\n      \"resolved\": \"https://registry.npmjs.org/for-own/-/for-own-1.0.0.tgz\",\n      \"integrity\": \"sha1-xjMy9BXO3EsE2/5wz4NklMU8tEs=\",\n      \"dev\": true,\n      \"dependencies\": {\n        \"for-in\": \"^1.0.1\"\n      },\n      \"engines\": {\n        \"node\": \">=0.10.0\"\n      }\n    },\n    \"node_modules/object.defaults/node_modules/isobject\": {\n      \"version\": \"3.0.1\",\n      \"resolved\": \"https://registry.npmjs.org/isobject/-/isobject-3.0.1.tgz\",\n      \"integrity\": \"sha1-TkMekrEalzFjaqH5yNHMvP2reN8=\",\n      \"dev\": true,\n      \"engines\": {\n        \"node\": \">=0.10.0\"\n      }\n    },\n    \"node_modules/object.omit\": {\n      \"version\": \"2.0.1\",\n      \"resolved\": \"https://registry.npmjs.org/object.omit/-/object.omit-2.0.1.tgz\",\n      \"integrity\": \"sha1-Gpx0SCnznbuFjHbKNXmuKlTr0fo=\",\n      \"dev\": true,\n      \"dependencies\": {\n        \"for-own\": \"^0.1.4\",\n        \"is-extendable\": \"^0.1.1\"\n      },\n      \"engines\": {\n        \"node\": \">=0.10.0\"\n      }\n    },\n    \"node_modules/object.pick\": {\n      \"version\": \"1.3.0\",\n      \"resolved\": \"https://registry.npmjs.org/object.pick/-/object.pick-1.3.0.tgz\",\n      \"integrity\": \"sha1-h6EKxMFpS9Lhy/U1kaZhQftd10c=\",\n      \"dev\": true,\n      \"dependencies\": {\n        \"isobject\": \"^3.0.1\"\n      },\n      \"engines\": {\n        \"node\": \">=0.10.0\"\n      }\n    },\n    \"node_modules/object.pick/node_modules/isobject\": {\n      \"version\": \"3.0.1\",\n      \"resolved\": \"https://registry.npmjs.org/isobject/-/isobject-3.0.1.tgz\",\n      \"integrity\": \"sha1-TkMekrEalzFjaqH5yNHMvP2reN8=\",\n      \"dev\": true,\n      \"engines\": {\n        \"node\": \">=0.10.0\"\n      }\n    },\n    \"node_modules/on-finished\": {\n      \"version\": \"2.3.0\",\n      \"resolved\": \"https://registry.npmjs.org/on-finished/-/on-finished-2.3.0.tgz\",\n      \"integrity\": \"sha1-IPEzZIGwg811M3mSoWlxqi2QaUc=\",\n      \"dev\": true,\n      \"dependencies\": {\n        \"ee-first\": \"1.1.1\"\n      },\n      \"engines\": {\n        \"node\": \">= 0.8\"\n      }\n    },\n    \"node_modules/once\": {\n      \"version\": \"1.4.0\",\n      \"resolved\": \"https://registry.npmjs.org/once/-/once-1.4.0.tgz\",\n      \"integrity\": \"sha1-WDsap3WWHUsROsF9nFC6753Xa9E=\",\n      \"dev\": true,\n      \"dependencies\": {\n        \"wrappy\": \"1\"\n      }\n    },\n    \"node_modules/onetime\": {\n      \"version\": \"1.1.0\",\n      \"resolved\": \"https://registry.npmjs.org/onetime/-/onetime-1.1.0.tgz\",\n      \"integrity\": \"sha1-ofeDj4MUxRbwXs78vEzP4EtO14k=\",\n      \"dev\": true,\n      \"engines\": {\n        \"node\": \">=0.10.0\"\n      }\n    },\n    \"node_modules/open\": {\n      \"version\": \"0.0.5\",\n      \"resolved\": \"https://registry.npmjs.org/open/-/open-0.0.5.tgz\",\n      \"integrity\": \"sha1-QsPhjslUZra/DcQvOilFw/DK2Pw=\",\n      \"dev\": true,\n      \"engines\": {\n        \"node\": \">= 0.6.0\"\n      }\n    },\n    \"node_modules/opener\": {\n      \"version\": \"1.4.3\",\n      \"resolved\": \"https://registry.npmjs.org/opener/-/opener-1.4.3.tgz\",\n      \"integrity\": \"sha512-4Im9TrPJcjAYyGR5gBe3yZnBzw5n3Bfh1ceHHGNOpMurINKc6RdSIPXMyon4BZacJbJc36lLkhipioGbWh5pwg==\",\n      \"bin\": {\n        \"opener\": \"opener.js\"\n      }\n    },\n    \"node_modules/optimist\": {\n      \"version\": \"0.6.1\",\n      \"resolved\": \"https://registry.npmjs.org/optimist/-/optimist-0.6.1.tgz\",\n      \"integrity\": \"sha512-snN4O4TkigujZphWLN0E//nQmm7790RYaE53DdL7ZYwee2D8DDo9/EyYiKUfN3rneWUjhJnueija3G9I2i0h3g==\",\n      \"dependencies\": {\n        \"minimist\": \"~0.0.1\",\n        \"wordwrap\": \"~0.0.2\"\n      }\n    },\n    \"node_modules/optimist/node_modules/wordwrap\": {\n      \"version\": \"0.0.3\",\n      \"resolved\": \"https://registry.npmjs.org/wordwrap/-/wordwrap-0.0.3.tgz\",\n      \"integrity\": \"sha512-1tMA907+V4QmxV7dbRvb4/8MaRALK6q9Abid3ndMYnbyo8piisCmeONVqVSXqQA3KaP4SLt5b7ud6E2sqP8TFw==\",\n      \"engines\": {\n        \"node\": \">=0.4.0\"\n      }\n    },\n    \"node_modules/optionator\": {\n      \"version\": \"0.8.2\",\n      \"resolved\": \"https://registry.npmjs.org/optionator/-/optionator-0.8.2.tgz\",\n      \"integrity\": \"sha1-NkxeQJ0/TWMB1sC0wFu6UBgK62Q=\",\n      \"dev\": true,\n      \"dependencies\": {\n        \"deep-is\": \"~0.1.3\",\n        \"fast-levenshtein\": \"~2.0.4\",\n        \"levn\": \"~0.3.0\",\n        \"prelude-ls\": \"~1.1.2\",\n        \"type-check\": \"~0.3.2\",\n        \"wordwrap\": \"~1.0.0\"\n      },\n      \"engines\": {\n        \"node\": \">= 0.8.0\"\n      }\n    },\n    \"node_modules/options\": {\n      \"version\": \"0.0.6\",\n      \"resolved\": \"https://registry.npmjs.org/options/-/options-0.0.6.tgz\",\n      \"integrity\": \"sha512-bOj3L1ypm++N+n7CEbbe473A414AB7z+amKYshRb//iuL3MpdDCLhPnw6aVTdKB9g5ZRVHIEp8eUln6L2NUStg==\",\n      \"engines\": {\n        \"node\": \">=0.4.0\"\n      }\n    },\n    \"node_modules/ora\": {\n      \"version\": \"0.2.3\",\n      \"resolved\": \"https://registry.npmjs.org/ora/-/ora-0.2.3.tgz\",\n      \"integrity\": \"sha1-N1J9Igrc1Tw5tzVx11QVbV22V6Q=\",\n      \"dev\": true,\n      \"dependencies\": {\n        \"chalk\": \"^1.1.1\",\n        \"cli-cursor\": \"^1.0.2\",\n        \"cli-spinners\": \"^0.1.2\",\n        \"object-assign\": \"^4.0.1\"\n      },\n      \"engines\": {\n        \"node\": \">=0.10.0\"\n      }\n    },\n    \"node_modules/orchestrator\": {\n      \"version\": \"0.3.8\",\n      \"resolved\": \"https://registry.npmjs.org/orchestrator/-/orchestrator-0.3.8.tgz\",\n      \"integrity\": \"sha1-FOfp4nZPcxX7rBhOUGx6pt+UrX4=\",\n      \"dev\": true,\n      \"dependencies\": {\n        \"end-of-stream\": \"~0.1.5\",\n        \"sequencify\": \"~0.0.7\",\n        \"stream-consume\": \"~0.1.0\"\n      }\n    },\n    \"node_modules/ordered-read-streams\": {\n      \"version\": \"0.1.0\",\n      \"resolved\": \"https://registry.npmjs.org/ordered-read-streams/-/ordered-read-streams-0.1.0.tgz\",\n      \"integrity\": \"sha1-/VZamvjrRHO6abbtijQ1LLVS8SY=\",\n      \"dev\": true\n    },\n    \"node_modules/os-homedir\": {\n      \"version\": \"1.0.2\",\n      \"resolved\": \"https://registry.npmjs.org/os-homedir/-/os-homedir-1.0.2.tgz\",\n      \"integrity\": \"sha1-/7xJiDNuDoM94MFox+8VISGqf7M=\",\n      \"dev\": true,\n      \"engines\": {\n        \"node\": \">=0.10.0\"\n      }\n    },\n    \"node_modules/os-tmpdir\": {\n      \"version\": \"1.0.2\",\n      \"resolved\": \"https://registry.npmjs.org/os-tmpdir/-/os-tmpdir-1.0.2.tgz\",\n      \"integrity\": \"sha1-u+Z0BseaqFxc/sdm/lc0VV36EnQ=\",\n      \"dev\": true,\n      \"engines\": {\n        \"node\": \">=0.10.0\"\n      }\n    },\n    \"node_modules/p-finally\": {\n      \"version\": \"1.0.0\",\n      \"resolved\": \"https://registry.npmjs.org/p-finally/-/p-finally-1.0.0.tgz\",\n      \"integrity\": \"sha1-P7z7FbiZpEEjs0ttzBi3JDNqLK4=\",\n      \"dev\": true,\n      \"engines\": {\n        \"node\": \">=4\"\n      }\n    },\n    \"node_modules/p-map\": {\n      \"version\": \"1.2.0\",\n      \"resolved\": \"https://registry.npmjs.org/p-map/-/p-map-1.2.0.tgz\",\n      \"integrity\": \"sha512-r6zKACMNhjPJMTl8KcFH4li//gkrXWfbD6feV8l6doRHlzljFWGJ2AP6iKaCJXyZmAUMOPtvbW7EXkbWO/pLEA==\",\n      \"dev\": true,\n      \"engines\": {\n        \"node\": \">=4\"\n      }\n    },\n    \"node_modules/parse-filepath\": {\n      \"version\": \"1.0.1\",\n      \"resolved\": \"https://registry.npmjs.org/parse-filepath/-/parse-filepath-1.0.1.tgz\",\n      \"integrity\": \"sha1-FZ1hVdQ5BNFsEO9piRHaHpGWm3M=\",\n      \"dev\": true,\n      \"dependencies\": {\n        \"is-absolute\": \"^0.2.3\",\n        \"map-cache\": \"^0.2.0\",\n        \"path-root\": \"^0.1.1\"\n      },\n      \"engines\": {\n        \"node\": \">=0.8\"\n      }\n    },\n    \"node_modules/parse-glob\": {\n      \"version\": \"3.0.4\",\n      \"resolved\": \"https://registry.npmjs.org/parse-glob/-/parse-glob-3.0.4.tgz\",\n      \"integrity\": \"sha1-ssN2z7EfNVE7rdFz7wu246OIORw=\",\n      \"dev\": true,\n      \"dependencies\": {\n        \"glob-base\": \"^0.3.0\",\n        \"is-dotfile\": \"^1.0.0\",\n        \"is-extglob\": \"^1.0.0\",\n        \"is-glob\": \"^2.0.0\"\n      },\n      \"engines\": {\n        \"node\": \">=0.10.0\"\n      }\n    },\n    \"node_modules/parse-json\": {\n      \"version\": \"2.2.0\",\n      \"resolved\": \"https://registry.npmjs.org/parse-json/-/parse-json-2.2.0.tgz\",\n      \"integrity\": \"sha1-9ID0BDTvgHQfhGkJn43qGPVaTck=\",\n      \"dev\": true,\n      \"dependencies\": {\n        \"error-ex\": \"^1.2.0\"\n      },\n      \"engines\": {\n        \"node\": \">=0.10.0\"\n      }\n    },\n    \"node_modules/parse-passwd\": {\n      \"version\": \"1.0.0\",\n      \"resolved\": \"https://registry.npmjs.org/parse-passwd/-/parse-passwd-1.0.0.tgz\",\n      \"integrity\": \"sha1-bVuTSkVpk7I9N/QKOC1vFmao5cY=\",\n      \"dev\": true,\n      \"engines\": {\n        \"node\": \">=0.10.0\"\n      }\n    },\n    \"node_modules/parseurl\": {\n      \"version\": \"1.3.1\",\n      \"resolved\": \"https://registry.npmjs.org/parseurl/-/parseurl-1.3.1.tgz\",\n      \"integrity\": \"sha1-yKuMkiO6NIiKpkopeyiFO+wY2lY=\",\n      \"dev\": true,\n      \"engines\": {\n        \"node\": \">= 0.8\"\n      }\n    },\n    \"node_modules/path-exists\": {\n      \"version\": \"2.1.0\",\n      \"resolved\": \"https://registry.npmjs.org/path-exists/-/path-exists-2.1.0.tgz\",\n      \"integrity\": \"sha1-D+tsZPD8UY2adU3V77YscCJ2H0s=\",\n      \"dev\": true,\n      \"dependencies\": {\n        \"pinkie-promise\": \"^2.0.0\"\n      },\n      \"engines\": {\n        \"node\": \">=0.10.0\"\n      }\n    },\n    \"node_modules/path-is-absolute\": {\n      \"version\": \"1.0.1\",\n      \"resolved\": \"https://registry.npmjs.org/path-is-absolute/-/path-is-absolute-1.0.1.tgz\",\n      \"integrity\": \"sha1-F0uSaHNVNP+8es5r9TpanhtcX18=\",\n      \"dev\": true,\n      \"engines\": {\n        \"node\": \">=0.10.0\"\n      }\n    },\n    \"node_modules/path-is-inside\": {\n      \"version\": \"1.0.2\",\n      \"resolved\": \"https://registry.npmjs.org/path-is-inside/-/path-is-inside-1.0.2.tgz\",\n      \"integrity\": \"sha1-NlQX3t5EQw0cEa9hAn+s8HS9/FM=\",\n      \"dev\": true\n    },\n    \"node_modules/path-key\": {\n      \"version\": \"2.0.1\",\n      \"resolved\": \"https://registry.npmjs.org/path-key/-/path-key-2.0.1.tgz\",\n      \"integrity\": \"sha1-QRyttXTFoUDTpLGRDUDYDMn0C0A=\",\n      \"dev\": true,\n      \"engines\": {\n        \"node\": \">=4\"\n      }\n    },\n    \"node_modules/path-parse\": {\n      \"version\": \"1.0.5\",\n      \"resolved\": \"https://registry.npmjs.org/path-parse/-/path-parse-1.0.5.tgz\",\n      \"integrity\": \"sha1-PBrfhx6pzWyUMbbqK9dKD/BVxME=\",\n      \"dev\": true\n    },\n    \"node_modules/path-root\": {\n      \"version\": \"0.1.1\",\n      \"resolved\": \"https://registry.npmjs.org/path-root/-/path-root-0.1.1.tgz\",\n      \"integrity\": \"sha1-mkpoFMrBwM1zNgqV8yCDyOpHRbc=\",\n      \"dev\": true,\n      \"dependencies\": {\n        \"path-root-regex\": \"^0.1.0\"\n      },\n      \"engines\": {\n        \"node\": \">=0.10.0\"\n      }\n    },\n    \"node_modules/path-root-regex\": {\n      \"version\": \"0.1.2\",\n      \"resolved\": \"https://registry.npmjs.org/path-root-regex/-/path-root-regex-0.1.2.tgz\",\n      \"integrity\": \"sha1-v8zcjfWxLcUsi0PsONGNcsBLqW0=\",\n      \"dev\": true,\n      \"engines\": {\n        \"node\": \">=0.10.0\"\n      }\n    },\n    \"node_modules/path-type\": {\n      \"version\": \"1.1.0\",\n      \"resolved\": \"https://registry.npmjs.org/path-type/-/path-type-1.1.0.tgz\",\n      \"integrity\": \"sha1-WcRPfuSR2nBNpBXaWkBwuk+P5EE=\",\n      \"dev\": true,\n      \"dependencies\": {\n        \"graceful-fs\": \"^4.1.2\",\n        \"pify\": \"^2.0.0\",\n        \"pinkie-promise\": \"^2.0.0\"\n      },\n      \"engines\": {\n        \"node\": \">=0.10.0\"\n      }\n    },\n    \"node_modules/pify\": {\n      \"version\": \"2.3.0\",\n      \"resolved\": \"https://registry.npmjs.org/pify/-/pify-2.3.0.tgz\",\n      \"integrity\": \"sha1-7RQaasBDqEnqWISY59yosVMw6Qw=\",\n      \"dev\": true,\n      \"engines\": {\n        \"node\": \">=0.10.0\"\n      }\n    },\n    \"node_modules/pinkie\": {\n      \"version\": \"2.0.4\",\n      \"resolved\": \"https://registry.npmjs.org/pinkie/-/pinkie-2.0.4.tgz\",\n      \"integrity\": \"sha1-clVrgM+g1IqXToDnckjoDtT3+HA=\",\n      \"dev\": true,\n      \"engines\": {\n        \"node\": \">=0.10.0\"\n      }\n    },\n    \"node_modules/pinkie-promise\": {\n      \"version\": \"2.0.1\",\n      \"resolved\": \"https://registry.npmjs.org/pinkie-promise/-/pinkie-promise-2.0.1.tgz\",\n      \"integrity\": \"sha1-ITXW36ejWMBprJsXh3YogihFD/o=\",\n      \"dev\": true,\n      \"dependencies\": {\n        \"pinkie\": \"^2.0.0\"\n      },\n      \"engines\": {\n        \"node\": \">=0.10.0\"\n      }\n    },\n    \"node_modules/pluralize\": {\n      \"version\": \"1.2.1\",\n      \"resolved\": \"https://registry.npmjs.org/pluralize/-/pluralize-1.2.1.tgz\",\n      \"integrity\": \"sha1-0aIUg/0iu0HlihL6NCGCMUCJfEU=\",\n      \"dev\": true\n    },\n    \"node_modules/portfinder\": {\n      \"version\": \"0.2.1\",\n      \"resolved\": \"https://registry.npmjs.org/portfinder/-/portfinder-0.2.1.tgz\",\n      \"integrity\": \"sha512-U7dHe7mfMMP5cIwbqBHh/likunxAEiBsQLiThUWjyeRK6/C3um2uk+VGiekUW8q3h+s793gdNfagCM3aaXMeOg==\",\n      \"dependencies\": {\n        \"mkdirp\": \"0.0.x\"\n      },\n      \"engines\": {\n        \"node\": \">= 0.4.0\"\n      }\n    },\n    \"node_modules/portfinder/node_modules/mkdirp\": {\n      \"version\": \"0.0.7\",\n      \"resolved\": \"https://registry.npmjs.org/mkdirp/-/mkdirp-0.0.7.tgz\",\n      \"integrity\": \"sha512-r4Ml2CH2Kl4B0+Lwq1SVru0vjMxdtR+UEb938WTQcsnU+EJz8dUV/HY0LTZh466nUSljia9cvqW3LZLWs3l8LQ==\",\n      \"deprecated\": \"Legacy versions of mkdirp are no longer supported. Please update to mkdirp 1.x. (Note that the API surface has changed to use Promises in 1.x.)\",\n      \"engines\": {\n        \"node\": \"*\"\n      }\n    },\n    \"node_modules/prelude-ls\": {\n      \"version\": \"1.1.2\",\n      \"resolved\": \"https://registry.npmjs.org/prelude-ls/-/prelude-ls-1.1.2.tgz\",\n      \"integrity\": \"sha1-IZMqVJ9eUv/ZqCf1cOBL5iqX2lQ=\",\n      \"dev\": true,\n      \"engines\": {\n        \"node\": \">= 0.8.0\"\n      }\n    },\n    \"node_modules/preserve\": {\n      \"version\": \"0.2.0\",\n      \"resolved\": \"https://registry.npmjs.org/preserve/-/preserve-0.2.0.tgz\",\n      \"integrity\": \"sha1-gV7R9uvGWSb4ZbMQwHE7yzMVzks=\",\n      \"dev\": true,\n      \"engines\": {\n        \"node\": \">=0.10.0\"\n      }\n    },\n    \"node_modules/prettier\": {\n      \"version\": \"1.7.4\",\n      \"resolved\": \"https://registry.npmjs.org/prettier/-/prettier-1.7.4.tgz\",\n      \"integrity\": \"sha1-XoYkrpNjyA+V7GRFhOzfVddPk/o=\",\n      \"dev\": true,\n      \"bin\": {\n        \"prettier\": \"bin/prettier.js\"\n      },\n      \"engines\": {\n        \"node\": \">=4\"\n      }\n    },\n    \"node_modules/pretty-format\": {\n      \"version\": \"21.2.1\",\n      \"resolved\": \"https://registry.npmjs.org/pretty-format/-/pretty-format-21.2.1.tgz\",\n      \"integrity\": \"sha512-ZdWPGYAnYfcVP8yKA3zFjCn8s4/17TeYH28MXuC8vTp0o21eXjbFGcOAXZEaDaOFJjc3h2qa7HQNHNshhvoh2A==\",\n      \"dev\": true,\n      \"dependencies\": {\n        \"ansi-regex\": \"^3.0.0\",\n        \"ansi-styles\": \"^3.2.0\"\n      }\n    },\n    \"node_modules/pretty-format/node_modules/ansi-regex\": {\n      \"version\": \"3.0.0\",\n      \"resolved\": \"https://registry.npmjs.org/ansi-regex/-/ansi-regex-3.0.0.tgz\",\n      \"integrity\": \"sha1-7QMXwyIGT3lGbAKWa922Bas32Zg=\",\n      \"dev\": true,\n      \"engines\": {\n        \"node\": \">=4\"\n      }\n    },\n    \"node_modules/pretty-format/node_modules/ansi-styles\": {\n      \"version\": \"3.2.0\",\n      \"resolved\": \"https://registry.npmjs.org/ansi-styles/-/ansi-styles-3.2.0.tgz\",\n      \"integrity\": \"sha512-NnSOmMEYtVR2JVMIGTzynRkkaxtiq1xnFBcdQD/DnNCYPoEPsVJhM98BDyaoNOQIi7p4okdi3E27eN7GQbsUug==\",\n      \"dev\": true,\n      \"dependencies\": {\n        \"color-convert\": \"^1.9.0\"\n      },\n      \"engines\": {\n        \"node\": \">=4\"\n      }\n    },\n    \"node_modules/pretty-hrtime\": {\n      \"version\": \"1.0.3\",\n      \"resolved\": \"https://registry.npmjs.org/pretty-hrtime/-/pretty-hrtime-1.0.3.tgz\",\n      \"integrity\": \"sha1-t+PqQkNaTJsnWdmeDyAesZWALuE=\",\n      \"dev\": true,\n      \"engines\": {\n        \"node\": \">= 0.8\"\n      }\n    },\n    \"node_modules/private\": {\n      \"version\": \"0.1.7\",\n      \"resolved\": \"https://registry.npmjs.org/private/-/private-0.1.7.tgz\",\n      \"integrity\": \"sha1-aM5eih7woju1cMwoU3tTMqumPvE=\",\n      \"dev\": true,\n      \"engines\": {\n        \"node\": \">= 0.6\"\n      }\n    },\n    \"node_modules/process-nextick-args\": {\n      \"version\": \"1.0.7\",\n      \"resolved\": \"https://registry.npmjs.org/process-nextick-args/-/process-nextick-args-1.0.7.tgz\",\n      \"integrity\": \"sha1-FQ4gt1ZZCtP5EJPyWk8q2L/zC6M=\",\n      \"dev\": true\n    },\n    \"node_modules/progress\": {\n      \"version\": \"1.1.8\",\n      \"resolved\": \"https://registry.npmjs.org/progress/-/progress-1.1.8.tgz\",\n      \"integrity\": \"sha1-4mDHj2Fhzdmw5WzD4Khd4Xx6V74=\",\n      \"dev\": true,\n      \"engines\": {\n        \"node\": \">=0.4.0\"\n      }\n    },\n    \"node_modules/proxy-middleware\": {\n      \"version\": \"0.5.1\",\n      \"resolved\": \"https://registry.npmjs.org/proxy-middleware/-/proxy-middleware-0.5.1.tgz\",\n      \"integrity\": \"sha1-2iTV1Ywd3xPa0jfH7KUDhJ6uqQM=\",\n      \"dev\": true,\n      \"engines\": {\n        \"node\": \">=0.8.0\"\n      }\n    },\n    \"node_modules/pseudomap\": {\n      \"version\": \"1.0.2\",\n      \"resolved\": \"https://registry.npmjs.org/pseudomap/-/pseudomap-1.0.2.tgz\",\n      \"integrity\": \"sha1-8FKijacOYYkX7wqKw0wa5aaChrM=\",\n      \"dev\": true\n    },\n    \"node_modules/qs\": {\n      \"version\": \"2.2.5\",\n      \"resolved\": \"https://registry.npmjs.org/qs/-/qs-2.2.5.tgz\",\n      \"integrity\": \"sha1-EIirr53MCuWuRbcJ5sa1iIsjkjw=\",\n      \"dev\": true\n    },\n    \"node_modules/randomatic\": {\n      \"version\": \"1.1.7\",\n      \"resolved\": \"https://registry.npmjs.org/randomatic/-/randomatic-1.1.7.tgz\",\n      \"integrity\": \"sha512-D5JUjPyJbaJDkuAazpVnSfVkLlpeO3wDlPROTMLGKG1zMFNFRgrciKo1ltz/AzNTkqE0HzDx655QOL51N06how==\",\n      \"dev\": true,\n      \"dependencies\": {\n        \"is-number\": \"^3.0.0\",\n        \"kind-of\": \"^4.0.0\"\n      },\n      \"engines\": {\n        \"node\": \">= 0.10.0\"\n      }\n    },\n    \"node_modules/randomatic/node_modules/is-number\": {\n      \"version\": \"3.0.0\",\n      \"resolved\": \"https://registry.npmjs.org/is-number/-/is-number-3.0.0.tgz\",\n      \"integrity\": \"sha1-JP1iAaR4LPUFYcgQJ2r8fRLXEZU=\",\n      \"dev\": true,\n      \"dependencies\": {\n        \"kind-of\": \"^3.0.2\"\n      },\n      \"engines\": {\n        \"node\": \">=0.10.0\"\n      }\n    },\n    \"node_modules/randomatic/node_modules/is-number/node_modules/kind-of\": {\n      \"version\": \"3.2.2\",\n      \"resolved\": \"https://registry.npmjs.org/kind-of/-/kind-of-3.2.2.tgz\",\n      \"integrity\": \"sha1-MeohpzS6ubuw8yRm2JOupR5KPGQ=\",\n      \"dev\": true,\n      \"dependencies\": {\n        \"is-buffer\": \"^1.1.5\"\n      },\n      \"engines\": {\n        \"node\": \">=0.10.0\"\n      }\n    },\n    \"node_modules/randomatic/node_modules/kind-of\": {\n      \"version\": \"4.0.0\",\n      \"resolved\": \"https://registry.npmjs.org/kind-of/-/kind-of-4.0.0.tgz\",\n      \"integrity\": \"sha1-IIE989cSkosgc3hpGkUGb65y3Vc=\",\n      \"dev\": true,\n      \"dependencies\": {\n        \"is-buffer\": \"^1.1.5\"\n      },\n      \"engines\": {\n        \"node\": \">=0.10.0\"\n      }\n    },\n    \"node_modules/range-parser\": {\n      \"version\": \"1.2.0\",\n      \"resolved\": \"https://registry.npmjs.org/range-parser/-/range-parser-1.2.0.tgz\",\n      \"integrity\": \"sha1-9JvmtIeJTdxA3MlKMi9hEJLgDV4=\",\n      \"dev\": true,\n      \"engines\": {\n        \"node\": \">= 0.6\"\n      }\n    },\n    \"node_modules/raw-body\": {\n      \"version\": \"1.3.0\",\n      \"resolved\": \"https://registry.npmjs.org/raw-body/-/raw-body-1.3.0.tgz\",\n      \"integrity\": \"sha1-l4IwoValVI9C7vFN4i0PT2EAg9E=\",\n      \"dev\": true,\n      \"dependencies\": {\n        \"bytes\": \"1\",\n        \"iconv-lite\": \"0.4.4\"\n      },\n      \"engines\": {\n        \"node\": \">= 0.8.0\"\n      }\n    },\n    \"node_modules/read-pkg\": {\n      \"version\": \"1.1.0\",\n      \"resolved\": \"https://registry.npmjs.org/read-pkg/-/read-pkg-1.1.0.tgz\",\n      \"integrity\": \"sha1-9f+qXs0pyzHAR0vKfXVra7KePyg=\",\n      \"dev\": true,\n      \"dependencies\": {\n        \"load-json-file\": \"^1.0.0\",\n        \"normalize-package-data\": \"^2.3.2\",\n        \"path-type\": \"^1.0.0\"\n      },\n      \"engines\": {\n        \"node\": \">=0.10.0\"\n      }\n    },\n    \"node_modules/read-pkg-up\": {\n      \"version\": \"1.0.1\",\n      \"resolved\": \"https://registry.npmjs.org/read-pkg-up/-/read-pkg-up-1.0.1.tgz\",\n      \"integrity\": \"sha1-nWPBMnbAZZGNV/ACpX9AobZD+wI=\",\n      \"dev\": true,\n      \"dependencies\": {\n        \"find-up\": \"^1.0.0\",\n        \"read-pkg\": \"^1.0.0\"\n      },\n      \"engines\": {\n        \"node\": \">=0.10.0\"\n      }\n    },\n    \"node_modules/readable-stream\": {\n      \"version\": \"2.3.3\",\n      \"resolved\": \"https://registry.npmjs.org/readable-stream/-/readable-stream-2.3.3.tgz\",\n      \"integrity\": \"sha512-m+qzzcn7KUxEmd1gMbchF+Y2eIUbieUaxkWtptyHywrX0rE8QEYqPC07Vuy4Wm32/xE16NcdBctb8S0Xe/5IeQ==\",\n      \"dev\": true,\n      \"dependencies\": {\n        \"core-util-is\": \"~1.0.0\",\n        \"inherits\": \"~2.0.3\",\n        \"isarray\": \"~1.0.0\",\n        \"process-nextick-args\": \"~1.0.6\",\n        \"safe-buffer\": \"~5.1.1\",\n        \"string_decoder\": \"~1.0.3\",\n        \"util-deprecate\": \"~1.0.1\"\n      }\n    },\n    \"node_modules/readdirp\": {\n      \"version\": \"1.3.0\",\n      \"resolved\": \"https://registry.npmjs.org/readdirp/-/readdirp-1.3.0.tgz\",\n      \"integrity\": \"sha512-H1BGeo9VW8nmdwGo64SKRQgNNZwEuqtVUHijOoTDYIpqJGNKU65JaRXL3iqa/8tmVJ9jfoKY+soTznq0cOruTw==\",\n      \"dependencies\": {\n        \"graceful-fs\": \"~2.0.0\",\n        \"minimatch\": \"~0.2.12\",\n        \"readable-stream\": \"~1.0.26-2\"\n      },\n      \"engines\": {\n        \"node\": \">=0.6\"\n      }\n    },\n    \"node_modules/readdirp/node_modules/graceful-fs\": {\n      \"version\": \"2.0.3\",\n      \"resolved\": \"https://registry.npmjs.org/graceful-fs/-/graceful-fs-2.0.3.tgz\",\n      \"integrity\": \"sha512-hcj/NTUWv+C3MbqrVb9F+aH6lvTwEHJdx2foBxlrVq5h6zE8Bfu4pv4CAAqbDcZrw/9Ak5lsRXlY9Ao8/F0Tuw==\",\n      \"deprecated\": \"please upgrade to graceful-fs 4 for compatibility with current and future versions of Node.js\",\n      \"engines\": {\n        \"node\": \">=0.4.0\"\n      }\n    },\n    \"node_modules/readdirp/node_modules/isarray\": {\n      \"version\": \"0.0.1\",\n      \"resolved\": \"https://registry.npmjs.org/isarray/-/isarray-0.0.1.tgz\",\n      \"integrity\": \"sha512-D2S+3GLxWH+uhrNEcoh/fnmYeP8E8/zHl644d/jdA0g2uyXvy3sb0qxotE+ne0LtccHknQzWwZEzhak7oJ0COQ==\"\n    },\n    \"node_modules/readdirp/node_modules/minimatch\": {\n      \"version\": \"0.2.14\",\n      \"resolved\": \"https://registry.npmjs.org/minimatch/-/minimatch-0.2.14.tgz\",\n      \"integrity\": \"sha512-zZ+Jy8lVWlvqqeM8iZB7w7KmQkoJn8djM585z88rywrEbzoqawVa9FR5p2hwD+y74nfuKOjmNvi9gtWJNLqHvA==\",\n      \"deprecated\": \"Please update to minimatch 3.0.2 or higher to avoid a RegExp DoS issue\",\n      \"dependencies\": {\n        \"lru-cache\": \"2\",\n        \"sigmund\": \"~1.0.0\"\n      },\n      \"engines\": {\n        \"node\": \"*\"\n      }\n    },\n    \"node_modules/readdirp/node_modules/readable-stream\": {\n      \"version\": \"1.0.34\",\n      \"resolved\": \"https://registry.npmjs.org/readable-stream/-/readable-stream-1.0.34.tgz\",\n      \"integrity\": \"sha512-ok1qVCJuRkNmvebYikljxJA/UEsKwLl2nI1OmaqAu4/UE+h0wKCHok4XkL/gvi39OacXvw59RJUOFUkDib2rHg==\",\n      \"dependencies\": {\n        \"core-util-is\": \"~1.0.0\",\n        \"inherits\": \"~2.0.1\",\n        \"isarray\": \"0.0.1\",\n        \"string_decoder\": \"~0.10.x\"\n      }\n    },\n    \"node_modules/readdirp/node_modules/string_decoder\": {\n      \"version\": \"0.10.31\",\n      \"resolved\": \"https://registry.npmjs.org/string_decoder/-/string_decoder-0.10.31.tgz\",\n      \"integrity\": \"sha512-ev2QzSzWPYmy9GuqfIVildA4OdcGLeFZQrq5ys6RtiuF+RQQiZWr8TZNyAcuVXyQRYfEO+MsoB/1BuQVhOJuoQ==\"\n    },\n    \"node_modules/readline2\": {\n      \"version\": \"1.0.1\",\n      \"resolved\": \"https://registry.npmjs.org/readline2/-/readline2-1.0.1.tgz\",\n      \"integrity\": \"sha1-QQWWCP/BVHV7cV2ZidGZ/783LjU=\",\n      \"dev\": true,\n      \"dependencies\": {\n        \"code-point-at\": \"^1.0.0\",\n        \"is-fullwidth-code-point\": \"^1.0.0\",\n        \"mute-stream\": \"0.0.5\"\n      }\n    },\n    \"node_modules/rechoir\": {\n      \"version\": \"0.6.2\",\n      \"resolved\": \"https://registry.npmjs.org/rechoir/-/rechoir-0.6.2.tgz\",\n      \"integrity\": \"sha1-hSBLVNuoLVdC4oyWdW70OvUOM4Q=\",\n      \"dev\": true,\n      \"dependencies\": {\n        \"resolve\": \"^1.1.6\"\n      },\n      \"engines\": {\n        \"node\": \">= 0.10\"\n      }\n    },\n    \"node_modules/redent\": {\n      \"version\": \"1.0.0\",\n      \"resolved\": \"https://registry.npmjs.org/redent/-/redent-1.0.0.tgz\",\n      \"integrity\": \"sha1-z5Fqsf1fHxbfsggi3W7H9zDCr94=\",\n      \"dev\": true,\n      \"dependencies\": {\n        \"indent-string\": \"^2.1.0\",\n        \"strip-indent\": \"^1.0.1\"\n      },\n      \"engines\": {\n        \"node\": \">=0.10.0\"\n      }\n    },\n    \"node_modules/regenerate\": {\n      \"version\": \"1.3.2\",\n      \"resolved\": \"https://registry.npmjs.org/regenerate/-/regenerate-1.3.2.tgz\",\n      \"integrity\": \"sha1-0ZQcZ7rUN+G+dkM63Vs4X5WxkmA=\",\n      \"dev\": true\n    },\n    \"node_modules/regenerator-runtime\": {\n      \"version\": \"0.11.0\",\n      \"resolved\": \"https://registry.npmjs.org/regenerator-runtime/-/regenerator-runtime-0.11.0.tgz\",\n      \"integrity\": \"sha512-/aA0kLeRb5N9K0d4fw7ooEbI+xDe+DKD499EQqygGqeS8N3xto15p09uY2xj7ixP81sNPXvRLnAQIqdVStgb1A==\",\n      \"dev\": true\n    },\n    \"node_modules/regenerator-transform\": {\n      \"version\": \"0.10.1\",\n      \"resolved\": \"https://registry.npmjs.org/regenerator-transform/-/regenerator-transform-0.10.1.tgz\",\n      \"integrity\": \"sha512-PJepbvDbuK1xgIgnau7Y90cwaAmO/LCLMI2mPvaXq2heGMR3aWW5/BQvYrhJ8jgmQjXewXvBjzfqKcVOmhjZ6Q==\",\n      \"dev\": true,\n      \"dependencies\": {\n        \"babel-runtime\": \"^6.18.0\",\n        \"babel-types\": \"^6.19.0\",\n        \"private\": \"^0.1.6\"\n      }\n    },\n    \"node_modules/regex-cache\": {\n      \"version\": \"0.4.4\",\n      \"resolved\": \"https://registry.npmjs.org/regex-cache/-/regex-cache-0.4.4.tgz\",\n      \"integrity\": \"sha512-nVIZwtCjkC9YgvWkpM55B5rBhBYRZhAaJbgcFYXXsHnbZ9UZI9nnVWYZpBlCqv9ho2eZryPnWrZGsOdPwVWXWQ==\",\n      \"dev\": true,\n      \"dependencies\": {\n        \"is-equal-shallow\": \"^0.1.3\"\n      },\n      \"engines\": {\n        \"node\": \">=0.10.0\"\n      }\n    },\n    \"node_modules/regexpu-core\": {\n      \"version\": \"2.0.0\",\n      \"resolved\": \"https://registry.npmjs.org/regexpu-core/-/regexpu-core-2.0.0.tgz\",\n      \"integrity\": \"sha1-SdA4g3uNz4v6W5pCE5k45uoq4kA=\",\n      \"dev\": true,\n      \"dependencies\": {\n        \"regenerate\": \"^1.2.1\",\n        \"regjsgen\": \"^0.2.0\",\n        \"regjsparser\": \"^0.1.4\"\n      }\n    },\n    \"node_modules/regjsgen\": {\n      \"version\": \"0.2.0\",\n      \"resolved\": \"https://registry.npmjs.org/regjsgen/-/regjsgen-0.2.0.tgz\",\n      \"integrity\": \"sha1-bAFq3qxVT3WCP+N6wFuS1aTtsfc=\",\n      \"dev\": true\n    },\n    \"node_modules/regjsparser\": {\n      \"version\": \"0.1.5\",\n      \"resolved\": \"https://registry.npmjs.org/regjsparser/-/regjsparser-0.1.5.tgz\",\n      \"integrity\": \"sha1-fuj4Tcb6eS0/0K4ijSS9lJ6tIFw=\",\n      \"dev\": true,\n      \"dependencies\": {\n        \"jsesc\": \"~0.5.0\"\n      },\n      \"bin\": {\n        \"regjsparser\": \"bin/parser\"\n      }\n    },\n    \"node_modules/remove-trailing-separator\": {\n      \"version\": \"1.1.0\",\n      \"resolved\": \"https://registry.npmjs.org/remove-trailing-separator/-/remove-trailing-separator-1.1.0.tgz\",\n      \"integrity\": \"sha1-wkvOKig62tW8P1jg1IJJuSN52O8=\",\n      \"dev\": true\n    },\n    \"node_modules/repeat-element\": {\n      \"version\": \"1.1.2\",\n      \"resolved\": \"https://registry.npmjs.org/repeat-element/-/repeat-element-1.1.2.tgz\",\n      \"integrity\": \"sha1-7wiaF40Ug7quTZPrmLT55OEdmQo=\",\n      \"dev\": true,\n      \"engines\": {\n        \"node\": \">=0.10.0\"\n      }\n    },\n    \"node_modules/repeat-string\": {\n      \"version\": \"1.6.1\",\n      \"resolved\": \"https://registry.npmjs.org/repeat-string/-/repeat-string-1.6.1.tgz\",\n      \"integrity\": \"sha1-jcrkcOHIirwtYA//Sndihtp15jc=\",\n      \"dev\": true,\n      \"engines\": {\n        \"node\": \">=0.10\"\n      }\n    },\n    \"node_modules/repeating\": {\n      \"version\": \"2.0.1\",\n      \"resolved\": \"https://registry.npmjs.org/repeating/-/repeating-2.0.1.tgz\",\n      \"integrity\": \"sha1-UhTFOpJtNVJwdSf7q0FdvAjQbdo=\",\n      \"dev\": true,\n      \"dependencies\": {\n        \"is-finite\": \"^1.0.0\"\n      },\n      \"engines\": {\n        \"node\": \">=0.10.0\"\n      }\n    },\n    \"node_modules/replace-ext\": {\n      \"version\": \"0.0.1\",\n      \"resolved\": \"https://registry.npmjs.org/replace-ext/-/replace-ext-0.0.1.tgz\",\n      \"integrity\": \"sha1-KbvZIHinOfC8zitO5B6DeVNSKSQ=\",\n      \"dev\": true,\n      \"engines\": {\n        \"node\": \">= 0.4\"\n      }\n    },\n    \"node_modules/require-from-string\": {\n      \"version\": \"1.2.1\",\n      \"resolved\": \"https://registry.npmjs.org/require-from-string/-/require-from-string-1.2.1.tgz\",\n      \"integrity\": \"sha1-UpyczvJzgK3+yaL5ZbZJu+5jZBg=\",\n      \"dev\": true,\n      \"engines\": {\n        \"node\": \">=0.10.0\"\n      }\n    },\n    \"node_modules/require-relative\": {\n      \"version\": \"0.8.7\",\n      \"resolved\": \"https://registry.npmjs.org/require-relative/-/require-relative-0.8.7.tgz\",\n      \"integrity\": \"sha1-eZlTn8ngR6N5KPoZb44VY9q9Nt4=\",\n      \"dev\": true\n    },\n    \"node_modules/require-uncached\": {\n      \"version\": \"1.0.3\",\n      \"resolved\": \"https://registry.npmjs.org/require-uncached/-/require-uncached-1.0.3.tgz\",\n      \"integrity\": \"sha1-Tg1W1slmL9MeQwEcS5WqSZVUIdM=\",\n      \"dev\": true,\n      \"dependencies\": {\n        \"caller-path\": \"^0.1.0\",\n        \"resolve-from\": \"^1.0.0\"\n      },\n      \"engines\": {\n        \"node\": \">=0.10.0\"\n      }\n    },\n    \"node_modules/resolve\": {\n      \"version\": \"1.4.0\",\n      \"resolved\": \"https://registry.npmjs.org/resolve/-/resolve-1.4.0.tgz\",\n      \"integrity\": \"sha512-aW7sVKPufyHqOmyyLzg/J+8606v5nevBgaliIlV7nUpVMsDnoBGV/cbSLNjZAg9q0Cfd/+easKVKQ8vOu8fn1Q==\",\n      \"dev\": true,\n      \"dependencies\": {\n        \"path-parse\": \"^1.0.5\"\n      }\n    },\n    \"node_modules/resolve-dir\": {\n      \"version\": \"0.1.1\",\n      \"resolved\": \"https://registry.npmjs.org/resolve-dir/-/resolve-dir-0.1.1.tgz\",\n      \"integrity\": \"sha1-shklmlYC+sXFxJatiUpujMQwJh4=\",\n      \"dev\": true,\n      \"dependencies\": {\n        \"expand-tilde\": \"^1.2.2\",\n        \"global-modules\": \"^0.2.3\"\n      },\n      \"engines\": {\n        \"node\": \">=0.10.0\"\n      }\n    },\n    \"node_modules/resolve-from\": {\n      \"version\": \"1.0.1\",\n      \"resolved\": \"https://registry.npmjs.org/resolve-from/-/resolve-from-1.0.1.tgz\",\n      \"integrity\": \"sha1-Jsv+k10a7uq7Kbw/5a6wHpPUQiY=\",\n      \"dev\": true,\n      \"engines\": {\n        \"node\": \">=0.10.0\"\n      }\n    },\n    \"node_modules/restore-cursor\": {\n      \"version\": \"1.0.1\",\n      \"resolved\": \"https://registry.npmjs.org/restore-cursor/-/restore-cursor-1.0.1.tgz\",\n      \"integrity\": \"sha1-NGYfRohjJ/7SmRR5FSJS35LapUE=\",\n      \"dev\": true,\n      \"dependencies\": {\n        \"exit-hook\": \"^1.0.0\",\n        \"onetime\": \"^1.0.0\"\n      },\n      \"engines\": {\n        \"node\": \">=0.10.0\"\n      }\n    },\n    \"node_modules/rimraf\": {\n      \"version\": \"2.6.1\",\n      \"resolved\": \"https://registry.npmjs.org/rimraf/-/rimraf-2.6.1.tgz\",\n      \"integrity\": \"sha1-wjOOxkPfeht/5cVPqG9XQopV8z0=\",\n      \"deprecated\": \"Rimraf versions prior to v4 are no longer supported\",\n      \"dev\": true,\n      \"dependencies\": {\n        \"glob\": \"^7.0.5\"\n      },\n      \"bin\": {\n        \"rimraf\": \"bin.js\"\n      }\n    },\n    \"node_modules/rollup\": {\n      \"version\": \"0.41.6\",\n      \"resolved\": \"https://registry.npmjs.org/rollup/-/rollup-0.41.6.tgz\",\n      \"integrity\": \"sha1-4NBUl4d6OYwQTYFtJzOnGKepTio=\",\n      \"dev\": true,\n      \"dependencies\": {\n        \"source-map-support\": \"^0.4.0\"\n      },\n      \"bin\": {\n        \"rollup\": \"bin/rollup\"\n      }\n    },\n    \"node_modules/rollup-plugin-babel\": {\n      \"version\": \"2.7.1\",\n      \"resolved\": \"https://registry.npmjs.org/rollup-plugin-babel/-/rollup-plugin-babel-2.7.1.tgz\",\n      \"integrity\": \"sha1-FlKBl7D5OKFTb0RoPHqT1XMYL1c=\",\n      \"deprecated\": \"This package has been deprecated and is no longer maintained. Please use @rollup/plugin-babel.\",\n      \"dev\": true,\n      \"dependencies\": {\n        \"babel-core\": \"6\",\n        \"babel-plugin-transform-es2015-classes\": \"^6.9.0\",\n        \"object-assign\": \"^4.1.0\",\n        \"rollup-pluginutils\": \"^1.5.0\"\n      }\n    },\n    \"node_modules/rollup-plugin-uglify\": {\n      \"version\": \"2.0.1\",\n      \"resolved\": \"https://registry.npmjs.org/rollup-plugin-uglify/-/rollup-plugin-uglify-2.0.1.tgz\",\n      \"integrity\": \"sha1-Z7N60e/a+9g69MNrQMGJ7khmyWk=\",\n      \"dev\": true,\n      \"dependencies\": {\n        \"uglify-js\": \"^3.0.9\"\n      }\n    },\n    \"node_modules/rollup-plugin-uglify/node_modules/commander\": {\n      \"version\": \"2.11.0\",\n      \"resolved\": \"https://registry.npmjs.org/commander/-/commander-2.11.0.tgz\",\n      \"integrity\": \"sha512-b0553uYA5YAEGgyYIGYROzKQ7X5RAqedkfjiZxwi0kL1g3bOaBNNZfYkzt/CL0umgD5wc9Jec2FbB98CjkMRvQ==\",\n      \"dev\": true\n    },\n    \"node_modules/rollup-plugin-uglify/node_modules/uglify-js\": {\n      \"version\": \"3.0.28\",\n      \"resolved\": \"https://registry.npmjs.org/uglify-js/-/uglify-js-3.0.28.tgz\",\n      \"integrity\": \"sha512-0h/qGay016GG2lVav3Kz174F3T2Vjlz2v6HCt+WDQpoXfco0hWwF5gHK9yh88mUYvIC+N7Z8NT8WpjSp1yoqGA==\",\n      \"dev\": true,\n      \"dependencies\": {\n        \"commander\": \"~2.11.0\",\n        \"source-map\": \"~0.5.1\"\n      },\n      \"bin\": {\n        \"uglifyjs\": \"bin/uglifyjs\"\n      },\n      \"engines\": {\n        \"node\": \">=0.8.0\"\n      }\n    },\n    \"node_modules/rollup-pluginutils\": {\n      \"version\": \"1.5.2\",\n      \"resolved\": \"https://registry.npmjs.org/rollup-pluginutils/-/rollup-pluginutils-1.5.2.tgz\",\n      \"integrity\": \"sha1-HhVud4+UtyVb+hs9AXi+j1xVJAg=\",\n      \"dev\": true,\n      \"dependencies\": {\n        \"estree-walker\": \"^0.2.1\",\n        \"minimatch\": \"^3.0.2\"\n      }\n    },\n    \"node_modules/rollup-watch\": {\n      \"version\": \"3.2.2\",\n      \"resolved\": \"https://registry.npmjs.org/rollup-watch/-/rollup-watch-3.2.2.tgz\",\n      \"integrity\": \"sha1-XldCMunvNtqRd/RpRtgIDLJnNUs=\",\n      \"deprecated\": \"rollup-watch functionality is now included in Rollup itself\",\n      \"dev\": true,\n      \"dependencies\": {\n        \"require-relative\": \"0.8.7\"\n      }\n    },\n    \"node_modules/run-async\": {\n      \"version\": \"0.1.0\",\n      \"resolved\": \"https://registry.npmjs.org/run-async/-/run-async-0.1.0.tgz\",\n      \"integrity\": \"sha1-yK1KXhEGYeQCp9IbUw4AnyX444k=\",\n      \"dev\": true,\n      \"dependencies\": {\n        \"once\": \"^1.3.0\"\n      }\n    },\n    \"node_modules/rx\": {\n      \"version\": \"2.3.24\",\n      \"resolved\": \"https://registry.npmjs.org/rx/-/rx-2.3.24.tgz\",\n      \"integrity\": \"sha1-FPlQpCF9fjXapxu8vljv9o6ksrc=\",\n      \"dev\": true\n    },\n    \"node_modules/rx-lite\": {\n      \"version\": \"3.1.2\",\n      \"resolved\": \"https://registry.npmjs.org/rx-lite/-/rx-lite-3.1.2.tgz\",\n      \"integrity\": \"sha1-Gc5QLKVyZl87ZHsQk5+X/RYV8QI=\",\n      \"dev\": true\n    },\n    \"node_modules/rxjs\": {\n      \"version\": \"5.5.0\",\n      \"resolved\": \"https://registry.npmjs.org/rxjs/-/rxjs-5.5.0.tgz\",\n      \"integrity\": \"sha512-vmvP5y/oJIJmXKHY36PIjVeI/46Sny6BMBa7/ou2zsNz1PiqU/Gtcz1GujnHz5Qlxncv+J9VlWmttnshqFj3Kg==\",\n      \"dev\": true,\n      \"dependencies\": {\n        \"symbol-observable\": \"^1.0.1\"\n      },\n      \"engines\": {\n        \"npm\": \">=2.0.0\"\n      }\n    },\n    \"node_modules/safe-buffer\": {\n      \"version\": \"5.1.1\",\n      \"resolved\": \"https://registry.npmjs.org/safe-buffer/-/safe-buffer-5.1.1.tgz\",\n      \"integrity\": \"sha512-kKvNJn6Mm93gAczWVJg7wH+wGYWNrDHdWvpUmHyEsgCtIwwo3bqPtV4tR5tuPaUhTOo/kvhVwd8XwwOllGYkbg==\",\n      \"dev\": true\n    },\n    \"node_modules/semver\": {\n      \"version\": \"4.3.6\",\n      \"resolved\": \"https://registry.npmjs.org/semver/-/semver-4.3.6.tgz\",\n      \"integrity\": \"sha1-MAvG4OhjdPe6YQaLWx7NV/xlMto=\",\n      \"dev\": true,\n      \"bin\": {\n        \"semver\": \"bin/semver\"\n      }\n    },\n    \"node_modules/send\": {\n      \"version\": \"0.15.4\",\n      \"resolved\": \"https://registry.npmjs.org/send/-/send-0.15.4.tgz\",\n      \"integrity\": \"sha1-mF+qPihLAnPHkzZKNcZze9k5Bbk=\",\n      \"dev\": true,\n      \"dependencies\": {\n        \"debug\": \"2.6.8\",\n        \"depd\": \"~1.1.1\",\n        \"destroy\": \"~1.0.4\",\n        \"encodeurl\": \"~1.0.1\",\n        \"escape-html\": \"~1.0.3\",\n        \"etag\": \"~1.8.0\",\n        \"fresh\": \"0.5.0\",\n        \"http-errors\": \"~1.6.2\",\n        \"mime\": \"1.3.4\",\n        \"ms\": \"2.0.0\",\n        \"on-finished\": \"~2.3.0\",\n        \"range-parser\": \"~1.2.0\",\n        \"statuses\": \"~1.3.1\"\n      },\n      \"engines\": {\n        \"node\": \">= 0.8.0\"\n      }\n    },\n    \"node_modules/sequencify\": {\n      \"version\": \"0.0.7\",\n      \"resolved\": \"https://registry.npmjs.org/sequencify/-/sequencify-0.0.7.tgz\",\n      \"integrity\": \"sha1-kM/xnQLgcCf9dn9erT57ldHnOAw=\",\n      \"dev\": true,\n      \"engines\": {\n        \"node\": \">= 0.4\"\n      }\n    },\n    \"node_modules/serve-index\": {\n      \"version\": \"1.9.0\",\n      \"resolved\": \"https://registry.npmjs.org/serve-index/-/serve-index-1.9.0.tgz\",\n      \"integrity\": \"sha1-0rKA/FYNYW7oG0i/D6gqvtJIXOc=\",\n      \"dev\": true,\n      \"dependencies\": {\n        \"accepts\": \"~1.3.3\",\n        \"batch\": \"0.6.1\",\n        \"debug\": \"2.6.8\",\n        \"escape-html\": \"~1.0.3\",\n        \"http-errors\": \"~1.6.1\",\n        \"mime-types\": \"~2.1.15\",\n        \"parseurl\": \"~1.3.1\"\n      },\n      \"engines\": {\n        \"node\": \">= 0.8.0\"\n      }\n    },\n    \"node_modules/serve-static\": {\n      \"version\": \"1.12.4\",\n      \"resolved\": \"https://registry.npmjs.org/serve-static/-/serve-static-1.12.4.tgz\",\n      \"integrity\": \"sha1-m2qpjutyU8Tu3Ewfb9vKYJkBqWE=\",\n      \"dev\": true,\n      \"dependencies\": {\n        \"encodeurl\": \"~1.0.1\",\n        \"escape-html\": \"~1.0.3\",\n        \"parseurl\": \"~1.3.1\",\n        \"send\": \"0.15.4\"\n      },\n      \"engines\": {\n        \"node\": \">= 0.8.0\"\n      }\n    },\n    \"node_modules/setprototypeof\": {\n      \"version\": \"1.0.3\",\n      \"resolved\": \"https://registry.npmjs.org/setprototypeof/-/setprototypeof-1.0.3.tgz\",\n      \"integrity\": \"sha1-ZlZ+NwQ+608E2RvWWMDL77VbjgQ=\",\n      \"dev\": true\n    },\n    \"node_modules/sexstatic\": {\n      \"version\": \"0.6.2\",\n      \"resolved\": \"https://registry.npmjs.org/sexstatic/-/sexstatic-0.6.2.tgz\",\n      \"integrity\": \"sha512-r/E1YWB6q6/SYepc8cdn1lk/CdAXYvVqohGNYbkhPMmqdhhJlHEgcchBqSKHfph46aLW7QDTHuV7O9sXstsASQ==\",\n      \"dependencies\": {\n        \"he\": \"~0.4.1\",\n        \"mime\": \"1.2.x\",\n        \"minimist\": \"~0.0.5\"\n      },\n      \"bin\": {\n        \"sexstatic\": \"lib/sexstatic.js\"\n      }\n    },\n    \"node_modules/sexstatic/node_modules/mime\": {\n      \"version\": \"1.2.11\",\n      \"resolved\": \"https://registry.npmjs.org/mime/-/mime-1.2.11.tgz\",\n      \"integrity\": \"sha512-Ysa2F/nqTNGHhhm9MV8ure4+Hc+Y8AWiqUdHxsO7xu8zc92ND9f3kpALHjaP026Ft17UfxrMt95c50PLUeynBw==\"\n    },\n    \"node_modules/shebang-command\": {\n      \"version\": \"1.2.0\",\n      \"resolved\": \"https://registry.npmjs.org/shebang-command/-/shebang-command-1.2.0.tgz\",\n      \"integrity\": \"sha1-RKrGW2lbAzmJaMOfNj/uXer98eo=\",\n      \"dev\": true,\n      \"dependencies\": {\n        \"shebang-regex\": \"^1.0.0\"\n      },\n      \"engines\": {\n        \"node\": \">=0.10.0\"\n      }\n    },\n    \"node_modules/shebang-regex\": {\n      \"version\": \"1.0.0\",\n      \"resolved\": \"https://registry.npmjs.org/shebang-regex/-/shebang-regex-1.0.0.tgz\",\n      \"integrity\": \"sha1-2kL0l0DAtC2yypcoVxyxkMmO/qM=\",\n      \"dev\": true,\n      \"engines\": {\n        \"node\": \">=0.10.0\"\n      }\n    },\n    \"node_modules/shelljs\": {\n      \"version\": \"0.7.8\",\n      \"resolved\": \"https://registry.npmjs.org/shelljs/-/shelljs-0.7.8.tgz\",\n      \"integrity\": \"sha1-3svPh0sNHl+3LhSxZKloMEjprLM=\",\n      \"dev\": true,\n      \"dependencies\": {\n        \"glob\": \"^7.0.0\",\n        \"interpret\": \"^1.0.0\",\n        \"rechoir\": \"^0.6.2\"\n      },\n      \"bin\": {\n        \"shjs\": \"bin/shjs\"\n      },\n      \"engines\": {\n        \"iojs\": \"*\",\n        \"node\": \">=0.11.0\"\n      }\n    },\n    \"node_modules/sigmund\": {\n      \"version\": \"1.0.1\",\n      \"resolved\": \"https://registry.npmjs.org/sigmund/-/sigmund-1.0.1.tgz\",\n      \"integrity\": \"sha1-P/IfGYytIXX587eBhT/ZTQ0ZtZA=\"\n    },\n    \"node_modules/signal-exit\": {\n      \"version\": \"3.0.2\",\n      \"resolved\": \"https://registry.npmjs.org/signal-exit/-/signal-exit-3.0.2.tgz\",\n      \"integrity\": \"sha1-tf3AjxKH6hF4Yo5BXiUTK3NkbG0=\",\n      \"dev\": true\n    },\n    \"node_modules/slash\": {\n      \"version\": \"1.0.0\",\n      \"resolved\": \"https://registry.npmjs.org/slash/-/slash-1.0.0.tgz\",\n      \"integrity\": \"sha1-xB8vbDn8FtHNF61LXYlhFK5HDVU=\",\n      \"dev\": true,\n      \"engines\": {\n        \"node\": \">=0.10.0\"\n      }\n    },\n    \"node_modules/slice-ansi\": {\n      \"version\": \"0.0.4\",\n      \"resolved\": \"https://registry.npmjs.org/slice-ansi/-/slice-ansi-0.0.4.tgz\",\n      \"integrity\": \"sha1-7b+JA/ZvfOL46v1s7tZeJkyDGzU=\",\n      \"dev\": true,\n      \"engines\": {\n        \"node\": \">=0.10.0\"\n      }\n    },\n    \"node_modules/source-map\": {\n      \"version\": \"0.5.7\",\n      \"resolved\": \"https://registry.npmjs.org/source-map/-/source-map-0.5.7.tgz\",\n      \"integrity\": \"sha1-igOdLRAh0i0eoUyA2OpGi6LvP8w=\",\n      \"dev\": true,\n      \"engines\": {\n        \"node\": \">=0.10.0\"\n      }\n    },\n    \"node_modules/source-map-support\": {\n      \"version\": \"0.4.17\",\n      \"resolved\": \"https://registry.npmjs.org/source-map-support/-/source-map-support-0.4.17.tgz\",\n      \"integrity\": \"sha512-30c1Ch8FSjV0FwC253iftbbj0dU/OXoSg1LAEGZJUlGgjTNj6cu+DVqJWWIZJY5RXLWV4eFtR+4ouo0VIOYOTg==\",\n      \"dev\": true,\n      \"dependencies\": {\n        \"source-map\": \"^0.5.6\"\n      }\n    },\n    \"node_modules/sparkles\": {\n      \"version\": \"1.0.0\",\n      \"resolved\": \"https://registry.npmjs.org/sparkles/-/sparkles-1.0.0.tgz\",\n      \"integrity\": \"sha1-Gsu/tZJDbRC76PeFt8xvgoFQEsM=\",\n      \"dev\": true,\n      \"engines\": {\n        \"node\": \">= 0.10\"\n      }\n    },\n    \"node_modules/spawn-command\": {\n      \"version\": \"0.0.2-1\",\n      \"resolved\": \"https://registry.npmjs.org/spawn-command/-/spawn-command-0.0.2-1.tgz\",\n      \"integrity\": \"sha1-YvXpRmmBwbeW3Fkpk34RycaSG9A=\",\n      \"dev\": true\n    },\n    \"node_modules/spdx-correct\": {\n      \"version\": \"1.0.2\",\n      \"resolved\": \"https://registry.npmjs.org/spdx-correct/-/spdx-correct-1.0.2.tgz\",\n      \"integrity\": \"sha1-SzBz2TP/UfORLwOsVRlJikFQ20A=\",\n      \"dev\": true,\n      \"dependencies\": {\n        \"spdx-license-ids\": \"^1.0.2\"\n      }\n    },\n    \"node_modules/spdx-expression-parse\": {\n      \"version\": \"1.0.4\",\n      \"resolved\": \"https://registry.npmjs.org/spdx-expression-parse/-/spdx-expression-parse-1.0.4.tgz\",\n      \"integrity\": \"sha1-m98vIOH0DtRH++JzJmGR/O1RYmw=\",\n      \"dev\": true\n    },\n    \"node_modules/spdx-license-ids\": {\n      \"version\": \"1.2.2\",\n      \"resolved\": \"https://registry.npmjs.org/spdx-license-ids/-/spdx-license-ids-1.2.2.tgz\",\n      \"integrity\": \"sha1-yd96NCRZSt5r0RkA1ZZpbcBrrFc=\",\n      \"dev\": true\n    },\n    \"node_modules/sprintf-js\": {\n      \"version\": \"1.0.3\",\n      \"resolved\": \"https://registry.npmjs.org/sprintf-js/-/sprintf-js-1.0.3.tgz\",\n      \"integrity\": \"sha1-BOaSb2YolTVPPdAVIDYzuFcpfiw=\",\n      \"dev\": true\n    },\n    \"node_modules/staged-git-files\": {\n      \"version\": \"0.0.4\",\n      \"resolved\": \"https://registry.npmjs.org/staged-git-files/-/staged-git-files-0.0.4.tgz\",\n      \"integrity\": \"sha1-15fhtVHKemOd7AI33G60u5vhfTU=\",\n      \"dev\": true\n    },\n    \"node_modules/statuses\": {\n      \"version\": \"1.3.1\",\n      \"resolved\": \"https://registry.npmjs.org/statuses/-/statuses-1.3.1.tgz\",\n      \"integrity\": \"sha1-+vUbnrdKrvOzrPStX2Gr8ky3uT4=\",\n      \"dev\": true,\n      \"engines\": {\n        \"node\": \">= 0.6\"\n      }\n    },\n    \"node_modules/stream-consume\": {\n      \"version\": \"0.1.0\",\n      \"resolved\": \"https://registry.npmjs.org/stream-consume/-/stream-consume-0.1.0.tgz\",\n      \"integrity\": \"sha1-pB6tGm1ggc63n2WwYZAbbY89HQ8=\",\n      \"dev\": true\n    },\n    \"node_modules/stream-to-observable\": {\n      \"version\": \"0.1.0\",\n      \"resolved\": \"https://registry.npmjs.org/stream-to-observable/-/stream-to-observable-0.1.0.tgz\",\n      \"integrity\": \"sha1-Rb8dny19wJvtgfHDB8Qw5ouEz/4=\",\n      \"dev\": true,\n      \"engines\": {\n        \"node\": \">=0.12.0\"\n      }\n    },\n    \"node_modules/string_decoder\": {\n      \"version\": \"1.0.3\",\n      \"resolved\": \"https://registry.npmjs.org/string_decoder/-/string_decoder-1.0.3.tgz\",\n      \"integrity\": \"sha512-4AH6Z5fzNNBcH+6XDMfA/BTt87skxqJlO0lAh3Dker5zThcAxG6mKz+iGu308UKoPPQ8Dcqx/4JhujzltRa+hQ==\",\n      \"dev\": true,\n      \"dependencies\": {\n        \"safe-buffer\": \"~5.1.0\"\n      }\n    },\n    \"node_modules/string-width\": {\n      \"version\": \"1.0.2\",\n      \"resolved\": \"https://registry.npmjs.org/string-width/-/string-width-1.0.2.tgz\",\n      \"integrity\": \"sha1-EYvfW4zcUaKn5w0hHgfisLmxB9M=\",\n      \"dev\": true,\n      \"dependencies\": {\n        \"code-point-at\": \"^1.0.0\",\n        \"is-fullwidth-code-point\": \"^1.0.0\",\n        \"strip-ansi\": \"^3.0.0\"\n      },\n      \"engines\": {\n        \"node\": \">=0.10.0\"\n      }\n    },\n    \"node_modules/stringify-object\": {\n      \"version\": \"3.2.1\",\n      \"resolved\": \"https://registry.npmjs.org/stringify-object/-/stringify-object-3.2.1.tgz\",\n      \"integrity\": \"sha512-jPcQYw/52HUPP8uOE4kkjxl5bB9LfHkKCTptIk3qw7ozP5XMIMlHMLjt00GGSwW6DJAf/njY5EU6Vpwl4LlBKQ==\",\n      \"dev\": true,\n      \"dependencies\": {\n        \"get-own-enumerable-property-symbols\": \"^2.0.1\",\n        \"is-obj\": \"^1.0.1\",\n        \"is-regexp\": \"^1.0.0\"\n      },\n      \"engines\": {\n        \"node\": \">=4\"\n      }\n    },\n    \"node_modules/strip-ansi\": {\n      \"version\": \"3.0.1\",\n      \"resolved\": \"https://registry.npmjs.org/strip-ansi/-/strip-ansi-3.0.1.tgz\",\n      \"integrity\": \"sha1-ajhfuIU9lS1f8F0Oiq+UJ43GPc8=\",\n      \"dev\": true,\n      \"dependencies\": {\n        \"ansi-regex\": \"^2.0.0\"\n      },\n      \"engines\": {\n        \"node\": \">=0.10.0\"\n      }\n    },\n    \"node_modules/strip-bom\": {\n      \"version\": \"3.0.0\",\n      \"resolved\": \"https://registry.npmjs.org/strip-bom/-/strip-bom-3.0.0.tgz\",\n      \"integrity\": \"sha1-IzTBjpx1n3vdVv3vfprj1YjmjtM=\",\n      \"dev\": true,\n      \"engines\": {\n        \"node\": \">=4\"\n      }\n    },\n    \"node_modules/strip-eof\": {\n      \"version\": \"1.0.0\",\n      \"resolved\": \"https://registry.npmjs.org/strip-eof/-/strip-eof-1.0.0.tgz\",\n      \"integrity\": \"sha1-u0P/VZim6wXYm1n80SnJgzE2Br8=\",\n      \"dev\": true,\n      \"engines\": {\n        \"node\": \">=0.10.0\"\n      }\n    },\n    \"node_modules/strip-indent\": {\n      \"version\": \"1.0.1\",\n      \"resolved\": \"https://registry.npmjs.org/strip-indent/-/strip-indent-1.0.1.tgz\",\n      \"integrity\": \"sha1-DHlipq3vp7vUrDZkYKY4VSrhoKI=\",\n      \"dev\": true,\n      \"dependencies\": {\n        \"get-stdin\": \"^4.0.1\"\n      },\n      \"bin\": {\n        \"strip-indent\": \"cli.js\"\n      },\n      \"engines\": {\n        \"node\": \">=0.10.0\"\n      }\n    },\n    \"node_modules/strip-json-comments\": {\n      \"version\": \"2.0.1\",\n      \"resolved\": \"https://registry.npmjs.org/strip-json-comments/-/strip-json-comments-2.0.1.tgz\",\n      \"integrity\": \"sha1-PFMZQukIwml8DsNEhYwobHygpgo=\",\n      \"dev\": true,\n      \"engines\": {\n        \"node\": \">=0.10.0\"\n      }\n    },\n    \"node_modules/supports-color\": {\n      \"version\": \"2.0.0\",\n      \"resolved\": \"https://registry.npmjs.org/supports-color/-/supports-color-2.0.0.tgz\",\n      \"integrity\": \"sha1-U10EXOa2Nj+kARcIRimZXp3zJMc=\",\n      \"dev\": true,\n      \"engines\": {\n        \"node\": \">=0.8.0\"\n      }\n    },\n    \"node_modules/symbol-observable\": {\n      \"version\": \"1.0.4\",\n      \"resolved\": \"https://registry.npmjs.org/symbol-observable/-/symbol-observable-1.0.4.tgz\",\n      \"integrity\": \"sha1-Kb9hXUqnEhvdiYsi1LP5vE4qoD0=\",\n      \"dev\": true,\n      \"engines\": {\n        \"node\": \">=0.10.0\"\n      }\n    },\n    \"node_modules/table\": {\n      \"version\": \"3.8.3\",\n      \"resolved\": \"https://registry.npmjs.org/table/-/table-3.8.3.tgz\",\n      \"integrity\": \"sha1-K7xULw/amGGnVdOUf+/Ys/UThV8=\",\n      \"dev\": true,\n      \"dependencies\": {\n        \"ajv\": \"^4.7.0\",\n        \"ajv-keywords\": \"^1.0.0\",\n        \"chalk\": \"^1.1.1\",\n        \"lodash\": \"^4.0.0\",\n        \"slice-ansi\": \"0.0.4\",\n        \"string-width\": \"^2.0.0\"\n      }\n    },\n    \"node_modules/table/node_modules/ansi-regex\": {\n      \"version\": \"3.0.0\",\n      \"resolved\": \"https://registry.npmjs.org/ansi-regex/-/ansi-regex-3.0.0.tgz\",\n      \"integrity\": \"sha1-7QMXwyIGT3lGbAKWa922Bas32Zg=\",\n      \"dev\": true,\n      \"engines\": {\n        \"node\": \">=4\"\n      }\n    },\n    \"node_modules/table/node_modules/is-fullwidth-code-point\": {\n      \"version\": \"2.0.0\",\n      \"resolved\": \"https://registry.npmjs.org/is-fullwidth-code-point/-/is-fullwidth-code-point-2.0.0.tgz\",\n      \"integrity\": \"sha1-o7MKXE8ZkYMWeqq5O+764937ZU8=\",\n      \"dev\": true,\n      \"engines\": {\n        \"node\": \">=4\"\n      }\n    },\n    \"node_modules/table/node_modules/string-width\": {\n      \"version\": \"2.1.1\",\n      \"resolved\": \"https://registry.npmjs.org/string-width/-/string-width-2.1.1.tgz\",\n      \"integrity\": \"sha512-nOqH59deCq9SRHlxq1Aw85Jnt4w6KvLKqWVik6oA9ZklXLNIOlqg4F2yrT1MVaTjAqvVwdfeZ7w7aCvJD7ugkw==\",\n      \"dev\": true,\n      \"dependencies\": {\n        \"is-fullwidth-code-point\": \"^2.0.0\",\n        \"strip-ansi\": \"^4.0.0\"\n      },\n      \"engines\": {\n        \"node\": \">=4\"\n      }\n    },\n    \"node_modules/table/node_modules/strip-ansi\": {\n      \"version\": \"4.0.0\",\n      \"resolved\": \"https://registry.npmjs.org/strip-ansi/-/strip-ansi-4.0.0.tgz\",\n      \"integrity\": \"sha1-qEeQIusaw2iocTibY1JixQXuNo8=\",\n      \"dev\": true,\n      \"dependencies\": {\n        \"ansi-regex\": \"^3.0.0\"\n      },\n      \"engines\": {\n        \"node\": \">=4\"\n      }\n    },\n    \"node_modules/test-value\": {\n      \"version\": \"2.1.0\",\n      \"resolved\": \"https://registry.npmjs.org/test-value/-/test-value-2.1.0.tgz\",\n      \"integrity\": \"sha1-Edpv9nDzRxpztiXKTz/c97t0gpE=\",\n      \"dev\": true,\n      \"dependencies\": {\n        \"array-back\": \"^1.0.3\",\n        \"typical\": \"^2.6.0\"\n      },\n      \"engines\": {\n        \"node\": \">=0.10.0\"\n      }\n    },\n    \"node_modules/test-value/node_modules/array-back\": {\n      \"version\": \"1.0.4\",\n      \"resolved\": \"https://registry.npmjs.org/array-back/-/array-back-1.0.4.tgz\",\n      \"integrity\": \"sha1-ZEun8JX3/898Q7Xw3DnTwfA8Bjs=\",\n      \"dev\": true,\n      \"dependencies\": {\n        \"typical\": \"^2.6.0\"\n      },\n      \"engines\": {\n        \"node\": \">=0.12.0\"\n      }\n    },\n    \"node_modules/text-table\": {\n      \"version\": \"0.2.0\",\n      \"resolved\": \"https://registry.npmjs.org/text-table/-/text-table-0.2.0.tgz\",\n      \"integrity\": \"sha1-f17oI66AUgfACvLfSoTsP8+lcLQ=\",\n      \"dev\": true\n    },\n    \"node_modules/through\": {\n      \"version\": \"2.3.8\",\n      \"resolved\": \"https://registry.npmjs.org/through/-/through-2.3.8.tgz\",\n      \"integrity\": \"sha1-DdTJ/6q8NXlgsbckEV1+Doai4fU=\",\n      \"dev\": true\n    },\n    \"node_modules/through2\": {\n      \"version\": \"2.0.3\",\n      \"resolved\": \"https://registry.npmjs.org/through2/-/through2-2.0.3.tgz\",\n      \"integrity\": \"sha1-AARWmzfHx0ujnEPzzteNGtlBQL4=\",\n      \"dev\": true,\n      \"dependencies\": {\n        \"readable-stream\": \"^2.1.5\",\n        \"xtend\": \"~4.0.1\"\n      }\n    },\n    \"node_modules/tildify\": {\n      \"version\": \"1.2.0\",\n      \"resolved\": \"https://registry.npmjs.org/tildify/-/tildify-1.2.0.tgz\",\n      \"integrity\": \"sha1-3OwD9V3Km3qj5bBPIYF+tW5jWIo=\",\n      \"dev\": true,\n      \"dependencies\": {\n        \"os-homedir\": \"^1.0.0\"\n      },\n      \"engines\": {\n        \"node\": \">=0.10.0\"\n      }\n    },\n    \"node_modules/time-stamp\": {\n      \"version\": \"1.1.0\",\n      \"resolved\": \"https://registry.npmjs.org/time-stamp/-/time-stamp-1.1.0.tgz\",\n      \"integrity\": \"sha1-dkpaEa9QVhkhsTPztE5hhofg9cM=\",\n      \"dev\": true,\n      \"engines\": {\n        \"node\": \">=0.10.0\"\n      }\n    },\n    \"node_modules/tiny-lr\": {\n      \"version\": \"0.1.4\",\n      \"resolved\": \"https://registry.npmjs.org/tiny-lr/-/tiny-lr-0.1.4.tgz\",\n      \"integrity\": \"sha1-bkHX5n39CHjl4LN+N6BtZ+MJ/00=\",\n      \"dev\": true,\n      \"dependencies\": {\n        \"body-parser\": \"~1.8.0\",\n        \"debug\": \"~0.8.1\",\n        \"faye-websocket\": \"~0.7.2\",\n        \"parseurl\": \"~1.3.0\",\n        \"qs\": \"~2.2.3\"\n      }\n    },\n    \"node_modules/tiny-lr/node_modules/debug\": {\n      \"version\": \"0.8.1\",\n      \"resolved\": \"https://registry.npmjs.org/debug/-/debug-0.8.1.tgz\",\n      \"integrity\": \"sha1-IP9NJvXkIstoobrLu2EDmtjBwTA=\",\n      \"dev\": true,\n      \"engines\": {\n        \"node\": \"*\"\n      }\n    },\n    \"node_modules/to-fast-properties\": {\n      \"version\": \"1.0.3\",\n      \"resolved\": \"https://registry.npmjs.org/to-fast-properties/-/to-fast-properties-1.0.3.tgz\",\n      \"integrity\": \"sha1-uDVx+k2MJbguIxsG46MFXeTKGkc=\",\n      \"dev\": true,\n      \"engines\": {\n        \"node\": \">=0.10.0\"\n      }\n    },\n    \"node_modules/tree-kill\": {\n      \"version\": \"1.1.0\",\n      \"resolved\": \"https://registry.npmjs.org/tree-kill/-/tree-kill-1.1.0.tgz\",\n      \"integrity\": \"sha1-yWPc8DciiS7FnLpWnpQLcZVNFyk=\",\n      \"dev\": true,\n      \"bin\": {\n        \"tree-kill\": \"cli.js\"\n      }\n    },\n    \"node_modules/trim-newlines\": {\n      \"version\": \"1.0.0\",\n      \"resolved\": \"https://registry.npmjs.org/trim-newlines/-/trim-newlines-1.0.0.tgz\",\n      \"integrity\": \"sha1-WIeWa7WCpFA6QetST301ARgVphM=\",\n      \"dev\": true,\n      \"engines\": {\n        \"node\": \">=0.10.0\"\n      }\n    },\n    \"node_modules/trim-right\": {\n      \"version\": \"1.0.1\",\n      \"resolved\": \"https://registry.npmjs.org/trim-right/-/trim-right-1.0.1.tgz\",\n      \"integrity\": \"sha1-yy4SAwZ+DI3h9hQJS5/kVwTqYAM=\",\n      \"dev\": true,\n      \"engines\": {\n        \"node\": \">=0.10.0\"\n      }\n    },\n    \"node_modules/tryit\": {\n      \"version\": \"1.0.3\",\n      \"resolved\": \"https://registry.npmjs.org/tryit/-/tryit-1.0.3.tgz\",\n      \"integrity\": \"sha1-OTvnMKlEb9Hq1tpZoBQwjzbCics=\",\n      \"dev\": true\n    },\n    \"node_modules/type-check\": {\n      \"version\": \"0.3.2\",\n      \"resolved\": \"https://registry.npmjs.org/type-check/-/type-check-0.3.2.tgz\",\n      \"integrity\": \"sha1-WITKtRLPHTVeP7eE8wgEsrUg23I=\",\n      \"dev\": true,\n      \"dependencies\": {\n        \"prelude-ls\": \"~1.1.2\"\n      },\n      \"engines\": {\n        \"node\": \">= 0.8.0\"\n      }\n    },\n    \"node_modules/type-is\": {\n      \"version\": \"1.5.7\",\n      \"resolved\": \"https://registry.npmjs.org/type-is/-/type-is-1.5.7.tgz\",\n      \"integrity\": \"sha1-uTaKWTzG730GReeLL0xky+zQXpA=\",\n      \"dev\": true,\n      \"dependencies\": {\n        \"media-typer\": \"0.3.0\",\n        \"mime-types\": \"~2.0.9\"\n      },\n      \"engines\": {\n        \"node\": \">= 0.6\"\n      }\n    },\n    \"node_modules/type-is/node_modules/mime-db\": {\n      \"version\": \"1.12.0\",\n      \"resolved\": \"https://registry.npmjs.org/mime-db/-/mime-db-1.12.0.tgz\",\n      \"integrity\": \"sha1-PQxjGA9FjrENMlqqN9fFiuMS6dc=\",\n      \"dev\": true,\n      \"engines\": {\n        \"node\": \">= 0.6\"\n      }\n    },\n    \"node_modules/type-is/node_modules/mime-types\": {\n      \"version\": \"2.0.14\",\n      \"resolved\": \"https://registry.npmjs.org/mime-types/-/mime-types-2.0.14.tgz\",\n      \"integrity\": \"sha1-MQ4VnbI+B3+Lsit0jav6SVcUCqY=\",\n      \"dev\": true,\n      \"dependencies\": {\n        \"mime-db\": \"~1.12.0\"\n      },\n      \"engines\": {\n        \"node\": \">= 0.6\"\n      }\n    },\n    \"node_modules/typedarray\": {\n      \"version\": \"0.0.6\",\n      \"resolved\": \"https://registry.npmjs.org/typedarray/-/typedarray-0.0.6.tgz\",\n      \"integrity\": \"sha1-hnrHTjhkGHsdPUfZlqeOxciDB3c=\",\n      \"dev\": true\n    },\n    \"node_modules/typical\": {\n      \"version\": \"2.6.1\",\n      \"resolved\": \"https://registry.npmjs.org/typical/-/typical-2.6.1.tgz\",\n      \"integrity\": \"sha1-XAgOXWYcu+OCWdLnCjxyU+hziB0=\",\n      \"dev\": true\n    },\n    \"node_modules/uglify-es\": {\n      \"version\": \"3.0.28\",\n      \"resolved\": \"https://registry.npmjs.org/uglify-es/-/uglify-es-3.0.28.tgz\",\n      \"integrity\": \"sha512-xw1hJsSp361OO0Sq0XvNyTI2wfQ4eKNljfSYyeYX/dz9lKEDj+DK+A8CzB0NmoCwWX1MnEx9f16HlkKXyG65CQ==\",\n      \"deprecated\": \"support for ECMAScript is superseded by `uglify-js` as of v3.13.0\",\n      \"dev\": true,\n      \"dependencies\": {\n        \"commander\": \"~2.11.0\",\n        \"source-map\": \"~0.5.1\"\n      },\n      \"bin\": {\n        \"uglifyjs\": \"bin/uglifyjs\"\n      },\n      \"engines\": {\n        \"node\": \">=0.8.0\"\n      }\n    },\n    \"node_modules/uglify-es/node_modules/commander\": {\n      \"version\": \"2.11.0\",\n      \"resolved\": \"https://registry.npmjs.org/commander/-/commander-2.11.0.tgz\",\n      \"integrity\": \"sha512-b0553uYA5YAEGgyYIGYROzKQ7X5RAqedkfjiZxwi0kL1g3bOaBNNZfYkzt/CL0umgD5wc9Jec2FbB98CjkMRvQ==\",\n      \"dev\": true\n    },\n    \"node_modules/ultron\": {\n      \"version\": \"1.0.2\",\n      \"resolved\": \"https://registry.npmjs.org/ultron/-/ultron-1.0.2.tgz\",\n      \"integrity\": \"sha512-QMpnpVtYaWEeY+MwKDN/UdKlE/LsFZXM5lO1u7GaZzNgmIbGixHEmVMIKT+vqYOALu3m5GYQy9kz4Xu4IVn7Ow==\"\n    },\n    \"node_modules/unc-path-regex\": {\n      \"version\": \"0.1.2\",\n      \"resolved\": \"https://registry.npmjs.org/unc-path-regex/-/unc-path-regex-0.1.2.tgz\",\n      \"integrity\": \"sha1-5z3T17DXxe2G+6xrCufYxqadUPo=\",\n      \"dev\": true,\n      \"engines\": {\n        \"node\": \">=0.10.0\"\n      }\n    },\n    \"node_modules/union\": {\n      \"version\": \"0.4.6\",\n      \"resolved\": \"https://registry.npmjs.org/union/-/union-0.4.6.tgz\",\n      \"integrity\": \"sha512-2qtrvSgD0GKotLRCNYkIMUOzoaHjXKCtbAP0kc5Po6D+RWTBb+BxlcHlHCYcf+Y+YM7eQicPgAg9mnWQvtoFVA==\",\n      \"dependencies\": {\n        \"qs\": \"~2.3.3\"\n      },\n      \"engines\": {\n        \"node\": \">= 0.8.0\"\n      }\n    },\n    \"node_modules/union/node_modules/qs\": {\n      \"version\": \"2.3.3\",\n      \"resolved\": \"https://registry.npmjs.org/qs/-/qs-2.3.3.tgz\",\n      \"integrity\": \"sha512-f5M0HQqZWkzU8GELTY8LyMrGkr3bPjKoFtTkwUEqJQbcljbeK8M7mliP9Ia2xoOI6oMerp+QPS7oYJtpGmWe/A==\"\n    },\n    \"node_modules/unique-stream\": {\n      \"version\": \"1.0.0\",\n      \"resolved\": \"https://registry.npmjs.org/unique-stream/-/unique-stream-1.0.0.tgz\",\n      \"integrity\": \"sha1-1ZpKdUJ0R9mqbJHnAmP40mpLEEs=\",\n      \"dev\": true\n    },\n    \"node_modules/unpipe\": {\n      \"version\": \"1.0.0\",\n      \"resolved\": \"https://registry.npmjs.org/unpipe/-/unpipe-1.0.0.tgz\",\n      \"integrity\": \"sha1-sr9O6FFKrmFltIF4KdIbLvSZBOw=\",\n      \"dev\": true,\n      \"engines\": {\n        \"node\": \">= 0.8\"\n      }\n    },\n    \"node_modules/user-home\": {\n      \"version\": \"2.0.0\",\n      \"resolved\": \"https://registry.npmjs.org/user-home/-/user-home-2.0.0.tgz\",\n      \"integrity\": \"sha1-nHC/2Babwdy/SGBODwS4tJzenp8=\",\n      \"dev\": true,\n      \"dependencies\": {\n        \"os-homedir\": \"^1.0.0\"\n      },\n      \"engines\": {\n        \"node\": \">=0.10.0\"\n      }\n    },\n    \"node_modules/util-deprecate\": {\n      \"version\": \"1.0.2\",\n      \"resolved\": \"https://registry.npmjs.org/util-deprecate/-/util-deprecate-1.0.2.tgz\",\n      \"integrity\": \"sha1-RQ1Nyfpw3nMnYvvS1KKJgUGaDM8=\",\n      \"dev\": true\n    },\n    \"node_modules/utils-merge\": {\n      \"version\": \"1.0.0\",\n      \"resolved\": \"https://registry.npmjs.org/utils-merge/-/utils-merge-1.0.0.tgz\",\n      \"integrity\": \"sha1-ApT7kiu5N1FTVBxPcJYjHyh8ivg=\",\n      \"dev\": true,\n      \"engines\": {\n        \"node\": \">= 0.4.0\"\n      }\n    },\n    \"node_modules/v8flags\": {\n      \"version\": \"2.1.1\",\n      \"resolved\": \"https://registry.npmjs.org/v8flags/-/v8flags-2.1.1.tgz\",\n      \"integrity\": \"sha1-qrGh+jDUX4jdMhFIh1rALAtV5bQ=\",\n      \"dev\": true,\n      \"dependencies\": {\n        \"user-home\": \"^1.1.1\"\n      },\n      \"engines\": {\n        \"node\": \">= 0.10.0\"\n      }\n    },\n    \"node_modules/v8flags/node_modules/user-home\": {\n      \"version\": \"1.1.1\",\n      \"resolved\": \"https://registry.npmjs.org/user-home/-/user-home-1.1.1.tgz\",\n      \"integrity\": \"sha1-K1viOjK2Onyd640PKNSFcko98ZA=\",\n      \"dev\": true,\n      \"bin\": {\n        \"user-home\": \"cli.js\"\n      },\n      \"engines\": {\n        \"node\": \">=0.10.0\"\n      }\n    },\n    \"node_modules/validate-npm-package-license\": {\n      \"version\": \"3.0.1\",\n      \"resolved\": \"https://registry.npmjs.org/validate-npm-package-license/-/validate-npm-package-license-3.0.1.tgz\",\n      \"integrity\": \"sha1-KAS6vnEq0zeUWaz74kdGqywwP7w=\",\n      \"dev\": true,\n      \"dependencies\": {\n        \"spdx-correct\": \"~1.0.0\",\n        \"spdx-expression-parse\": \"~1.0.0\"\n      }\n    },\n    \"node_modules/vinyl\": {\n      \"version\": \"0.5.3\",\n      \"resolved\": \"https://registry.npmjs.org/vinyl/-/vinyl-0.5.3.tgz\",\n      \"integrity\": \"sha1-sEVbOPxeDPMNQyUTLkYZcMIJHN4=\",\n      \"dev\": true,\n      \"dependencies\": {\n        \"clone\": \"^1.0.0\",\n        \"clone-stats\": \"^0.0.1\",\n        \"replace-ext\": \"0.0.1\"\n      },\n      \"engines\": {\n        \"node\": \">= 0.9\"\n      }\n    },\n    \"node_modules/vinyl-fs\": {\n      \"version\": \"0.3.14\",\n      \"resolved\": \"https://registry.npmjs.org/vinyl-fs/-/vinyl-fs-0.3.14.tgz\",\n      \"integrity\": \"sha1-mmhRzhysHBzqX+hsCTHWIMLPqeY=\",\n      \"dev\": true,\n      \"dependencies\": {\n        \"defaults\": \"^1.0.0\",\n        \"glob-stream\": \"^3.1.5\",\n        \"glob-watcher\": \"^0.0.6\",\n        \"graceful-fs\": \"^3.0.0\",\n        \"mkdirp\": \"^0.5.0\",\n        \"strip-bom\": \"^1.0.0\",\n        \"through2\": \"^0.6.1\",\n        \"vinyl\": \"^0.4.0\"\n      },\n      \"engines\": {\n        \"node\": \">= 0.10\"\n      }\n    },\n    \"node_modules/vinyl-fs/node_modules/clone\": {\n      \"version\": \"0.2.0\",\n      \"resolved\": \"https://registry.npmjs.org/clone/-/clone-0.2.0.tgz\",\n      \"integrity\": \"sha1-xhJqkK1Pctv1rNskPMN3JP6T/B8=\",\n      \"dev\": true,\n      \"engines\": {\n        \"node\": \"*\"\n      }\n    },\n    \"node_modules/vinyl-fs/node_modules/graceful-fs\": {\n      \"version\": \"3.0.11\",\n      \"resolved\": \"https://registry.npmjs.org/graceful-fs/-/graceful-fs-3.0.11.tgz\",\n      \"integrity\": \"sha1-dhPHeKGv6mLyXGMKCG1/Osu92Bg=\",\n      \"deprecated\": \"please upgrade to graceful-fs 4 for compatibility with current and future versions of Node.js\",\n      \"dev\": true,\n      \"dependencies\": {\n        \"natives\": \"^1.1.0\"\n      },\n      \"engines\": {\n        \"node\": \">=0.4.0\"\n      }\n    },\n    \"node_modules/vinyl-fs/node_modules/isarray\": {\n      \"version\": \"0.0.1\",\n      \"resolved\": \"https://registry.npmjs.org/isarray/-/isarray-0.0.1.tgz\",\n      \"integrity\": \"sha1-ihis/Kmo9Bd+Cav8YDiTmwXR7t8=\",\n      \"dev\": true\n    },\n    \"node_modules/vinyl-fs/node_modules/readable-stream\": {\n      \"version\": \"1.0.34\",\n      \"resolved\": \"https://registry.npmjs.org/readable-stream/-/readable-stream-1.0.34.tgz\",\n      \"integrity\": \"sha1-Elgg40vIQtLyqq+v5MKRbuMsFXw=\",\n      \"dev\": true,\n      \"dependencies\": {\n        \"core-util-is\": \"~1.0.0\",\n        \"inherits\": \"~2.0.1\",\n        \"isarray\": \"0.0.1\",\n        \"string_decoder\": \"~0.10.x\"\n      }\n    },\n    \"node_modules/vinyl-fs/node_modules/string_decoder\": {\n      \"version\": \"0.10.31\",\n      \"resolved\": \"https://registry.npmjs.org/string_decoder/-/string_decoder-0.10.31.tgz\",\n      \"integrity\": \"sha1-YuIDvEF2bGwoyfyEMB2rHFMQ+pQ=\",\n      \"dev\": true\n    },\n    \"node_modules/vinyl-fs/node_modules/strip-bom\": {\n      \"version\": \"1.0.0\",\n      \"resolved\": \"https://registry.npmjs.org/strip-bom/-/strip-bom-1.0.0.tgz\",\n      \"integrity\": \"sha1-hbiGLzhEtabV7IRnqTWYFzo295Q=\",\n      \"dev\": true,\n      \"dependencies\": {\n        \"first-chunk-stream\": \"^1.0.0\",\n        \"is-utf8\": \"^0.2.0\"\n      },\n      \"bin\": {\n        \"strip-bom\": \"cli.js\"\n      },\n      \"engines\": {\n        \"node\": \">=0.10.0\"\n      }\n    },\n    \"node_modules/vinyl-fs/node_modules/through2\": {\n      \"version\": \"0.6.5\",\n      \"resolved\": \"https://registry.npmjs.org/through2/-/through2-0.6.5.tgz\",\n      \"integrity\": \"sha1-QaucZ7KdVyCQcUEOHXp6lozTrUg=\",\n      \"dev\": true,\n      \"dependencies\": {\n        \"readable-stream\": \">=1.0.33-1 <1.1.0-0\",\n        \"xtend\": \">=4.0.0 <4.1.0-0\"\n      }\n    },\n    \"node_modules/vinyl-fs/node_modules/vinyl\": {\n      \"version\": \"0.4.6\",\n      \"resolved\": \"https://registry.npmjs.org/vinyl/-/vinyl-0.4.6.tgz\",\n      \"integrity\": \"sha1-LzVsh6VQolVGHza76ypbqL94SEc=\",\n      \"dev\": true,\n      \"dependencies\": {\n        \"clone\": \"^0.2.0\",\n        \"clone-stats\": \"^0.0.1\"\n      },\n      \"engines\": {\n        \"node\": \">= 0.9\"\n      }\n    },\n    \"node_modules/watch\": {\n      \"version\": \"0.11.0\",\n      \"resolved\": \"https://registry.npmjs.org/watch/-/watch-0.11.0.tgz\",\n      \"integrity\": \"sha1-6NugkbdFZ5mjr1eXi5hud+EyBAY=\",\n      \"dev\": true,\n      \"engines\": [\n        \"node >=0.1.95\"\n      ]\n    },\n    \"node_modules/watch-http-server\": {\n      \"version\": \"0.7.6\",\n      \"resolved\": \"https://registry.npmjs.org/watch-http-server/-/watch-http-server-0.7.6.tgz\",\n      \"integrity\": \"sha512-RFDwutg6npqy8R1//vLkPXnfEvkwM51PdEZkwVpttz1tYW4JVzlOXJlfEd32QwLmzCt2EgCTdnlyx0wvJGpHeg==\",\n      \"dependencies\": {\n        \"chokidar\": \"^0.12.4\",\n        \"colors\": \"1.0.3\",\n        \"opener\": \"~1.4.0\",\n        \"optimist\": \"0.6.x\",\n        \"portfinder\": \"0.2.x\",\n        \"sexstatic\": \"~0.6.x\",\n        \"union\": \"~0.4.3\",\n        \"ws\": \"^0.6.3\"\n      },\n      \"bin\": {\n        \"watch-http-server\": \"bin/http-server\",\n        \"watchhttpserver\": \"bin/http-server\",\n        \"whs\": \"bin/http-server\"\n      }\n    },\n    \"node_modules/websocket-driver\": {\n      \"version\": \"0.6.5\",\n      \"resolved\": \"https://registry.npmjs.org/websocket-driver/-/websocket-driver-0.6.5.tgz\",\n      \"integrity\": \"sha1-XLJVbOuF9Dc8bYI4qmkchFThOjY=\",\n      \"dev\": true,\n      \"dependencies\": {\n        \"websocket-extensions\": \">=0.1.1\"\n      },\n      \"engines\": {\n        \"node\": \">=0.6.0\"\n      }\n    },\n    \"node_modules/websocket-extensions\": {\n      \"version\": \"0.1.1\",\n      \"resolved\": \"https://registry.npmjs.org/websocket-extensions/-/websocket-extensions-0.1.1.tgz\",\n      \"integrity\": \"sha1-domUmcGEtu91Q3fC27DNbLVdKec=\",\n      \"dev\": true,\n      \"engines\": {\n        \"node\": \">=0.6.0\"\n      }\n    },\n    \"node_modules/which\": {\n      \"version\": \"1.3.0\",\n      \"resolved\": \"https://registry.npmjs.org/which/-/which-1.3.0.tgz\",\n      \"integrity\": \"sha512-xcJpopdamTuY5duC/KnTTNBraPK54YwpenP4lzxU8H91GudWpFv38u0CKjclE1Wi2EH2EDz5LRcHcKbCIzqGyg==\",\n      \"dev\": true,\n      \"dependencies\": {\n        \"isexe\": \"^2.0.0\"\n      },\n      \"bin\": {\n        \"which\": \"bin/which\"\n      }\n    },\n    \"node_modules/wordwrap\": {\n      \"version\": \"1.0.0\",\n      \"resolved\": \"https://registry.npmjs.org/wordwrap/-/wordwrap-1.0.0.tgz\",\n      \"integrity\": \"sha1-J1hIEIkUVqQXHI0CJkQa3pDLyus=\",\n      \"dev\": true\n    },\n    \"node_modules/wrappy\": {\n      \"version\": \"1.0.2\",\n      \"resolved\": \"https://registry.npmjs.org/wrappy/-/wrappy-1.0.2.tgz\",\n      \"integrity\": \"sha1-tSQ9jz7BqjXxNkYFvA0QNuMKtp8=\",\n      \"dev\": true\n    },\n    \"node_modules/write\": {\n      \"version\": \"0.2.1\",\n      \"resolved\": \"https://registry.npmjs.org/write/-/write-0.2.1.tgz\",\n      \"integrity\": \"sha1-X8A4KOJkzqP+kUVUdvejxWbLB1c=\",\n      \"dev\": true,\n      \"dependencies\": {\n        \"mkdirp\": \"^0.5.1\"\n      },\n      \"engines\": {\n        \"node\": \">=0.10.0\"\n      }\n    },\n    \"node_modules/ws\": {\n      \"version\": \"0.6.5\",\n      \"resolved\": \"https://registry.npmjs.org/ws/-/ws-0.6.5.tgz\",\n      \"integrity\": \"sha512-USH6S6I3kVLbZQ3+MwoC1gSGeQ9NTT5SCqhbtqLLJjPa+nv0I7zzzPyQSVAm10NzyMHa2rD4ZGnIbnFgarSQWg==\",\n      \"hasInstallScript\": true,\n      \"dependencies\": {\n        \"nan\": \"1.4.x\",\n        \"options\": \">=0.0.5\",\n        \"ultron\": \"1.0.x\"\n      }\n    },\n    \"node_modules/ws/node_modules/nan\": {\n      \"version\": \"1.4.3\",\n      \"resolved\": \"https://registry.npmjs.org/nan/-/nan-1.4.3.tgz\",\n      \"integrity\": \"sha512-sZJUTDM4+nDMorRUb2WS0nv5ihun+xqlHhKgKCKi0s4nI/tj5NVHlEm13hEySdZ15iAORPaJ50Gv6yi93bPPIw==\"\n    },\n    \"node_modules/xtend\": {\n      \"version\": \"4.0.1\",\n      \"resolved\": \"https://registry.npmjs.org/xtend/-/xtend-4.0.1.tgz\",\n      \"integrity\": \"sha1-pcbVMr5lbiPbgg77lDofBJmNY68=\",\n      \"dev\": true,\n      \"engines\": {\n        \"node\": \">=0.4\"\n      }\n    },\n    \"node_modules/yallist\": {\n      \"version\": \"2.1.2\",\n      \"resolved\": \"https://registry.npmjs.org/yallist/-/yallist-2.1.2.tgz\",\n      \"integrity\": \"sha1-HBH5IY8HYImkfdUS+TxmmaaoHVI=\",\n      \"dev\": true\n    }\n  }\n}\n"
        },
        {
          "name": "package.json",
          "type": "blob",
          "size": 1.447265625,
          "content": "{\n  \"name\": \"rythm.js\",\n  \"version\": \"2.2.6\",\n  \"description\": \"\",\n  \"main\": \"rythm.js\",\n  \"files\": [\n    \"rythm.js\",\n    \"rythm.min.js\"\n  ],\n  \"scripts\": {\n    \"start\": \"concurrently --kill-others  \\\"watch-http-server -o .\\\" \\\"npm run build -- -w\\\"\",\n    \"serve\": \"gulp serve\",\n    \"prepublish\": \"npm run build\",\n    \"test\": \"echo \\\"No test specified\\\" && exit 0\",\n    \"build\": \"node build.js\",\n    \"prettier\": \"prettier src/**/*.js --write --config .prettierrc\",\n    \"precommit\": \"lint-staged\"\n  },\n  \"repository\": {\n    \"type\": \"git\",\n    \"url\": \"https://github.com/Okazari/Rythm.js\"\n  },\n  \"author\": \"Benjamin Plouzennec <plouzennec.benjamin@gmail.com>\",\n  \"license\": \"GPL-3.0\",\n  \"dependencies\": {\n    \"watch-http-server\": \"^0.7.6\"\n  },\n  \"devDependencies\": {\n    \"babel-eslint\": \"^7.1.1\",\n    \"babel-plugin-external-helpers\": \"^6.22.0\",\n    \"babel-plugin-transform-class-properties\": \"^6.23.0\",\n    \"babel-preset-es2015\": \"^6.22.0\",\n    \"babel-register\": \"^6.23.0\",\n    \"babelrc-rollup\": \"^3.0.0\",\n    \"command-line-args\": \"^4.0.7\",\n    \"concurrently\": \"^3.3.0\",\n    \"eslint\": \"^3.15.0\",\n    \"gulp\": \"^3.9.1\",\n    \"gulp-webserver\": \"^0.9.1\",\n    \"husky\": \"^0.14.3\",\n    \"lint-staged\": \"^4.3.0\",\n    \"prettier\": \"^1.7.4\",\n    \"rollup\": \"^0.41.4\",\n    \"rollup-plugin-babel\": \"^2.7.1\",\n    \"rollup-plugin-uglify\": \"^2.0.1\",\n    \"rollup-watch\": \"^3.2.2\",\n    \"uglify-es\": \"^3.0.28\"\n  },\n  \"lint-staged\": {\n    \"*.{js,css}\": [\n      \"prettier --write\",\n      \"git add\"\n    ]\n  }\n}\n"
        },
        {
          "name": "rythm.js",
          "type": "blob",
          "size": 19.544921875,
          "content": ";(function(global, factory) {\n  typeof exports === 'object' && typeof module !== 'undefined'\n    ? (module.exports = factory())\n    : typeof define === 'function' && define.amd\n      ? define(factory)\n      : (global.Rythm = factory())\n})(this, function() {\n  'use strict'\n\n  var classCallCheck = function(instance, Constructor) {\n    if (!(instance instanceof Constructor)) {\n      throw new TypeError('Cannot call a class as a function')\n    }\n  }\n\n  var createClass = (function() {\n    function defineProperties(target, props) {\n      for (var i = 0; i < props.length; i++) {\n        var descriptor = props[i]\n        descriptor.enumerable = descriptor.enumerable || false\n        descriptor.configurable = true\n        if ('value' in descriptor) descriptor.writable = true\n        Object.defineProperty(target, descriptor.key, descriptor)\n      }\n    }\n\n    return function(Constructor, protoProps, staticProps) {\n      if (protoProps) defineProperties(Constructor.prototype, protoProps)\n      if (staticProps) defineProperties(Constructor, staticProps)\n      return Constructor\n    }\n  })()\n\n  var Analyser = function Analyser() {\n    var _this = this\n\n    classCallCheck(this, Analyser)\n\n    this.initialise = function(analyser) {\n      _this.analyser = analyser\n      _this.analyser.fftSize = 2048\n    }\n\n    this.reset = function() {\n      _this.hzHistory = []\n      _this.frequences = new Uint8Array(_this.analyser.frequencyBinCount)\n    }\n\n    this.analyse = function() {\n      _this.analyser.getByteFrequencyData(_this.frequences)\n      for (var i = 0; i < _this.frequences.length; i++) {\n        if (!_this.hzHistory[i]) {\n          _this.hzHistory[i] = []\n        }\n        if (_this.hzHistory[i].length > _this.maxValueHistory) {\n          _this.hzHistory[i].shift()\n        }\n        _this.hzHistory[i].push(_this.frequences[i])\n      }\n    }\n\n    this.getRangeAverageRatio = function(startingValue, nbValue) {\n      var total = 0\n      for (var i = startingValue; i < nbValue + startingValue; i++) {\n        total += _this.getFrequenceRatio(i)\n      }\n      return total / nbValue\n    }\n\n    this.getFrequenceRatio = function(index) {\n      var min = 255\n      var max = 0\n      _this.hzHistory[index].forEach(function(value) {\n        if (value < min) {\n          min = value\n        }\n        if (value > max) {\n          max = value\n        }\n      })\n      var scale = max - min\n      var actualValue = _this.frequences[index] - min\n      var percentage = scale === 0 ? 0 : actualValue / scale\n      return _this.startingScale + _this.pulseRatio * percentage\n    }\n\n    this.startingScale = 0\n    this.pulseRatio = 1\n    this.maxValueHistory = 100\n    this.hzHistory = []\n  }\n\n  var Analyser$1 = new Analyser()\n\n  var Player = function Player(forceAudioContext) {\n    var _this = this\n\n    classCallCheck(this, Player)\n\n    this.createSourceFromAudioElement = function(audioElement) {\n      audioElement.setAttribute(\n        'rythm-connected',\n        _this.connectedSources.length\n      )\n      var source = _this.audioCtx.createMediaElementSource(audioElement)\n      _this.connectedSources.push(source)\n      return source\n    }\n\n    this.connectExternalAudioElement = function(audioElement) {\n      _this.audio = audioElement\n      _this.currentInputType = _this.inputTypeList['EXTERNAL']\n      var connectedIndex = audioElement.getAttribute('rythm-connected')\n      if (!connectedIndex) {\n        _this.source = _this.createSourceFromAudioElement(_this.audio)\n      } else {\n        _this.source = _this.connectedSources[connectedIndex]\n      }\n      _this.connectSource(_this.source)\n    }\n\n    this.connectSource = function(source) {\n      source.connect(_this.gain)\n      _this.gain.connect(Analyser$1.analyser)\n      if (_this.currentInputType !== _this.inputTypeList['STREAM']) {\n        Analyser$1.analyser.connect(_this.audioCtx.destination)\n        _this.audio.addEventListener('ended', _this.stop)\n      } else {\n        Analyser$1.analyser.disconnect()\n      }\n    }\n\n    this.setMusic = function(trackUrl) {\n      _this.audio = new Audio(trackUrl)\n      _this.currentInputType = _this.inputTypeList['TRACK']\n      _this.source = _this.createSourceFromAudioElement(_this.audio)\n      _this.connectSource(_this.source)\n    }\n\n    this.setGain = function(value) {\n      _this.gain.gain.value = value\n    }\n\n    this.plugMicrophone = function() {\n      return _this.getMicrophoneStream().then(function(stream) {\n        _this.audio = stream\n        _this.currentInputType = _this.inputTypeList['STREAM']\n        _this.source = _this.audioCtx.createMediaStreamSource(stream)\n        _this.connectSource(_this.source)\n      })\n    }\n\n    this.getMicrophoneStream = function() {\n      navigator.getUserMedia =\n        navigator.getUserMedia ||\n        navigator.webkitGetUserMedia ||\n        navigator.mozGetUserMedia ||\n        navigator.msGetUserMedia\n      return new Promise(function(resolve, reject) {\n        navigator.getUserMedia(\n          { audio: true },\n          function(medias) {\n            return resolve(medias)\n          },\n          function(error) {\n            return reject(error)\n          }\n        )\n      })\n    }\n\n    this.start = function() {\n      if (_this.currentInputType === _this.inputTypeList['TRACK']) {\n        if (_this.audioCtx.state === 'suspended') {\n          _this.audioCtx.resume().then(function() {\n            return _this.audio.play()\n          })\n        } else {\n          _this.audio.play()\n        }\n      }\n    }\n\n    this.stop = function() {\n      if (_this.currentInputType === _this.inputTypeList['TRACK']) {\n        _this.audio.pause()\n      } else if (_this.currentInputType === _this.inputTypeList['STREAM']) {\n        _this.audio.getAudioTracks()[0].enabled = false\n      }\n    }\n\n    this.browserAudioCtx = window.AudioContext || window.webkitAudioContext\n    this.audioCtx = forceAudioContext || new this.browserAudioCtx()\n    this.connectedSources = []\n    Analyser$1.initialise(this.audioCtx.createAnalyser())\n    this.gain = this.audioCtx.createGain()\n    this.source = {}\n    this.audio = {}\n    this.hzHistory = []\n    this.inputTypeList = {\n      TRACK: 0,\n      STREAM: 1,\n      EXTERNAL: 2,\n    }\n  }\n\n  var pulse = function(elem, value) {\n    var options =\n      arguments.length > 2 && arguments[2] !== undefined ? arguments[2] : {}\n\n    var max = !isNaN(options.max) ? options.max : 1.25\n    var min = !isNaN(options.min) ? options.min : 0.75\n    var scale = (max - min) * value\n    elem.style.transform = 'scale(' + (min + scale) + ') translateZ(0)'\n  }\n\n  var reset = function reset(elem) {\n    elem.style.transform = ''\n  }\n\n  var shake = function(elem, value) {\n    var options =\n      arguments.length > 2 && arguments[2] !== undefined ? arguments[2] : {}\n\n    var max = !isNaN(options.max) ? options.max : 15\n    var min = !isNaN(options.min) ? options.min : -15\n    if (options.direction === 'left') {\n      max = -max\n      min = -min\n    }\n    var twist = (max - min) * value\n    elem.style.transform = 'translate3d(' + (min + twist) + 'px, 0, 0)'\n  }\n\n  var reset$1 = function reset(elem) {\n    elem.style.transform = ''\n  }\n\n  var jump = function(elem, value) {\n    var options =\n      arguments.length > 2 && arguments[2] !== undefined ? arguments[2] : {}\n\n    var max = !isNaN(options.max) ? options.max : 30\n    var min = !isNaN(options.min) ? options.min : 0\n    var jump = (max - min) * value\n    elem.style.transform = 'translate3d(0, ' + -jump + 'px, 0)'\n  }\n\n  var reset$2 = function reset(elem) {\n    elem.style.transform = ''\n  }\n\n  var twist = function(elem, value) {\n    var options =\n      arguments.length > 2 && arguments[2] !== undefined ? arguments[2] : {}\n\n    var max = !isNaN(options.max) ? options.max : 20\n    var min = !isNaN(options.min) ? options.min : -20\n    if (options.direction === 'left') {\n      max = -max\n      min = -min\n    }\n    var twist = (max - min) * value\n    elem.style.transform = 'rotate(' + (min + twist) + 'deg) translateZ(0)'\n  }\n\n  var reset$3 = function reset(elem) {\n    elem.style.transform = ''\n  }\n\n  var vanish = function(elem, value) {\n    var options =\n      arguments.length > 2 && arguments[2] !== undefined ? arguments[2] : {}\n\n    var max = !isNaN(options.max) ? options.max : 1\n    var min = !isNaN(options.min) ? options.min : 0\n    var vanish = (max - min) * value\n    if (options.reverse) {\n      elem.style.opacity = max - vanish\n    } else {\n      elem.style.opacity = min + vanish\n    }\n  }\n\n  var reset$4 = function reset(elem) {\n    elem.style.opacity = ''\n  }\n\n  var borderColor = function(elem, value) {\n    var options =\n      arguments.length > 2 && arguments[2] !== undefined ? arguments[2] : {}\n\n    var from = options.from || [0, 0, 0]\n    var to = options.to || [255, 255, 255]\n    var scaleR = (to[0] - from[0]) * value\n    var scaleG = (to[1] - from[1]) * value\n    var scaleB = (to[2] - from[2]) * value\n    elem.style.borderColor =\n      'rgb(' +\n      Math.floor(to[0] - scaleR) +\n      ', ' +\n      Math.floor(to[1] - scaleG) +\n      ', ' +\n      Math.floor(to[2] - scaleB) +\n      ')'\n  }\n\n  var reset$5 = function reset(elem) {\n    elem.style.borderColor = ''\n  }\n\n  var color = function(elem, value) {\n    var options =\n      arguments.length > 2 && arguments[2] !== undefined ? arguments[2] : {}\n\n    var from = options.from || [0, 0, 0]\n    var to = options.to || [255, 255, 255]\n    var scaleR = (to[0] - from[0]) * value\n    var scaleG = (to[1] - from[1]) * value\n    var scaleB = (to[2] - from[2]) * value\n    elem.style.backgroundColor =\n      'rgb(' +\n      Math.floor(to[0] - scaleR) +\n      ', ' +\n      Math.floor(to[1] - scaleG) +\n      ', ' +\n      Math.floor(to[2] - scaleB) +\n      ')'\n  }\n\n  var reset$6 = function reset(elem) {\n    elem.style.backgroundColor = ''\n  }\n\n  var radius = function(elem, value) {\n    var options =\n      arguments.length > 2 && arguments[2] !== undefined ? arguments[2] : {}\n\n    var max = !isNaN(options.max) ? options.max : 25\n    var min = !isNaN(options.min) ? options.min : 0\n    var borderRadius = (max - min) * value\n    if (options.reverse) {\n      borderRadius = max - borderRadius\n    } else {\n      borderRadius = min + borderRadius\n    }\n    elem.style.borderRadius = borderRadius + 'px'\n  }\n\n  var reset$7 = function reset(elem) {\n    elem.style.borderRadius = ''\n  }\n\n  var blur = function(elem, value) {\n    var options =\n      arguments.length > 2 && arguments[2] !== undefined ? arguments[2] : {}\n\n    var max = !isNaN(options.max) ? options.max : 8\n    var min = !isNaN(options.min) ? options.min : 0\n    var blur = (max - min) * value\n    if (options.reverse) {\n      blur = max - blur\n    } else {\n      blur = min + blur\n    }\n    elem.style.filter = 'blur(' + blur + 'px)'\n  }\n\n  var reset$8 = function reset(elem) {\n    elem.style.filter = ''\n  }\n\n  var coefficientMap = {\n    up: -1,\n    down: 1,\n    left: 1,\n    right: -1,\n  }\n\n  var swing = function(elem, value) {\n    var options =\n      arguments.length > 2 && arguments[2] !== undefined ? arguments[2] : {}\n\n    var radius = !isNaN(options.radius) ? options.radius : 20\n    var direction = Object.keys(coefficientMap).includes(options.direction)\n      ? options.direction\n      : 'right'\n    var curve = Object.keys(coefficientMap).includes(options.curve)\n      ? options.curve\n      : 'down'\n    var _ref = [coefficientMap[direction], coefficientMap[curve]],\n      xCoefficient = _ref[0],\n      yCoefficient = _ref[1]\n\n    elem.style.transform =\n      'translate3d(' +\n      xCoefficient * radius * Math.cos(value * Math.PI) +\n      'px, ' +\n      yCoefficient * radius * Math.sin(value * Math.PI) +\n      'px, 0)'\n  }\n\n  var reset$9 = function reset(elem) {\n    elem.style.transform = ''\n  }\n\n  var neon = function(elem, value) {\n    var options =\n      arguments.length > 2 && arguments[2] !== undefined ? arguments[2] : {}\n\n    var from = options.from || [0, 0, 0]\n    var to = options.to || [255, 255, 255]\n    var scaleR = (to[0] - from[0]) * value\n    var scaleG = (to[1] - from[1]) * value\n    var scaleB = (to[2] - from[2]) * value\n    elem.style.boxShadow =\n      '0 0 1em rgb(' +\n      Math.floor(to[0] - scaleR) +\n      ', ' +\n      Math.floor(to[1] - scaleG) +\n      ', ' +\n      Math.floor(to[2] - scaleB) +\n      ')'\n  }\n\n  var reset$10 = function reset(elem) {\n    elem.style.boxShadow = ''\n  }\n\n  var kern = function(elem, value) {\n    var options =\n      arguments.length > 2 && arguments[2] !== undefined ? arguments[2] : {}\n\n    var max = !isNaN(options.max) ? options.max : 25\n    var min = !isNaN(options.min) ? options.min : 0\n    var kern = (max - min) * value\n    if (options.reverse) {\n      kern = max - kern\n    } else {\n      kern = min + kern\n    }\n    elem.style.letterSpacing = kern + 'px'\n  }\n\n  var reset$11 = function reset(elem) {\n    elem.style.letterSpacing = ''\n  }\n\n  var fontSize = function(elem, value) {\n    var options =\n      arguments.length > 2 && arguments[2] !== undefined ? arguments[2] : {}\n\n    var max = !isNaN(options.max) ? options.max : 0.8\n    var min = !isNaN(options.min) ? options.min : 1.2\n    var fontSize = (max - min) * value + min\n    elem.style.fontSize = fontSize + 'em'\n  }\n\n  var reset$12 = function reset(elem) {\n    elem.style.fontSize = '1em'\n  }\n\n  var borderWidth = function(elem, value) {\n    var options =\n      arguments.length > 2 && arguments[2] !== undefined ? arguments[2] : {}\n\n    var max = !isNaN(options.max) ? options.max : 5\n    var min = !isNaN(options.min) ? options.min : 0\n    var borderWidth = (max - min) * value + min\n    elem.style.borderWidth = borderWidth + 'px'\n  }\n\n  var reset$13 = function reset(elem) {\n    elem.style.borderWidth = ''\n  }\n\n  var tilt = function(elem, value) {\n    var options =\n      arguments.length > 2 && arguments[2] !== undefined ? arguments[2] : {}\n\n    var max = !isNaN(options.max) ? options.max : 25\n    var min = !isNaN(options.min) ? options.min : 20\n    var rotate3d = (max - min) * value\n    if (options.reverse) {\n      rotate3d = max - rotate3d\n    }\n    elem.style.transform = 'matrix(1, ' + Math.sin(rotate3d) + ', 0, 1 , 0 ,0)'\n  }\n\n  var reset$14 = function reset(elem) {\n    elem.style.transform = ''\n  }\n\n  var fontColor = function(elem, value) {\n    var options =\n      arguments.length > 2 && arguments[2] !== undefined ? arguments[2] : {}\n\n    var from = options.from || [0, 0, 0]\n    var to = options.to || [255, 255, 255]\n    var scaleR = (to[0] - from[0]) * value\n    var scaleG = (to[1] - from[1]) * value\n    var scaleB = (to[2] - from[2]) * value\n    elem.style.color =\n      'rgb(' +\n      Math.floor(to[0] - scaleR) +\n      ', ' +\n      Math.floor(to[1] - scaleG) +\n      ', ' +\n      Math.floor(to[2] - scaleB) +\n      ')'\n  }\n\n  var reset$15 = function reset(elem) {\n    elem.style.color = ''\n  }\n\n  var Dancer = (function() {\n    function Dancer() {\n      classCallCheck(this, Dancer)\n\n      this.resets = {}\n      this.dances = {}\n      this.registerDance('size', pulse, reset)\n      this.registerDance('pulse', pulse, reset)\n      this.registerDance('shake', shake, reset$1)\n      this.registerDance('jump', jump, reset$2)\n      this.registerDance('twist', twist, reset$3)\n      this.registerDance('vanish', vanish, reset$4)\n      this.registerDance('color', color, reset$6)\n      this.registerDance('borderColor', borderColor, reset$5)\n      this.registerDance('radius', radius, reset$7)\n      this.registerDance('blur', blur, reset$8)\n      this.registerDance('swing', swing, reset$9)\n      this.registerDance('neon', neon, reset$10)\n      this.registerDance('kern', kern, reset$11)\n      this.registerDance('borderWidth', borderWidth, reset$13)\n      this.registerDance('fontSize', fontSize, reset$12)\n      this.registerDance('tilt', tilt, reset$14)\n      this.registerDance('fontColor', fontColor, reset$15)\n    }\n\n    createClass(Dancer, [\n      {\n        key: 'registerDance',\n        value: function registerDance(type, dance) {\n          var reset$$1 =\n            arguments.length > 2 && arguments[2] !== undefined\n              ? arguments[2]\n              : function() {}\n\n          this.dances[type] = dance\n          this.resets[type] = reset$$1\n        },\n      },\n      {\n        key: 'dance',\n        value: function dance(type, className, ratio, options) {\n          var dance = type\n          if (typeof type === 'string') {\n            //In case of a built in dance\n            dance = this.dances[type] || this.dances['pulse']\n          } else {\n            //In case of a custom dance\n            dance = type.dance\n          }\n          var elements = document.getElementsByClassName(className)\n          Array.from(elements).forEach(function(elem) {\n            return dance(elem, ratio, options)\n          })\n        },\n      },\n      {\n        key: 'reset',\n        value: function reset$$1(type, className) {\n          var reset$$1 = type\n          if (typeof type === 'string') {\n            //In case of a built in dance\n            reset$$1 = this.resets[type] || this.resets['pulse']\n          } else {\n            //In case of a custom dance\n            reset$$1 = type.reset\n          }\n          var elements = document.getElementsByClassName(className)\n          Array.from(elements).forEach(function(elem) {\n            return reset$$1(elem)\n          })\n        },\n      },\n    ])\n    return Dancer\n  })()\n\n  var dancer = new Dancer()\n\n  var Rythm$1 = function Rythm(forceAudioContext) {\n    var _this = this\n\n    classCallCheck(this, Rythm)\n\n    this.connectExternalAudioElement = function(audioElement) {\n      return _this.player.connectExternalAudioElement(audioElement)\n    }\n\n    this.setMusic = function(url) {\n      return _this.player.setMusic(url)\n    }\n\n    this.plugMicrophone = function() {\n      return _this.player.plugMicrophone()\n    }\n\n    this.setGain = function(value) {\n      return _this.player.setGain(value)\n    }\n\n    this.connectSource = function(source) {\n      return _this.player.connectSource(source)\n    }\n\n    this.addRythm = function(elementClass, type, startValue, nbValue, options) {\n      _this.rythms.push({\n        elementClass: elementClass,\n        type: type,\n        startValue: startValue,\n        nbValue: nbValue,\n        options: options,\n      })\n    }\n\n    this.start = function() {\n      _this.stopped = false\n      _this.player.start()\n      _this.analyser.reset()\n      _this.renderRythm()\n    }\n\n    this.renderRythm = function() {\n      if (_this.stopped) return\n      _this.analyser.analyse()\n      _this.rythms.forEach(function(mappingItem) {\n        var type = mappingItem.type,\n          elementClass = mappingItem.elementClass,\n          nbValue = mappingItem.nbValue,\n          startValue = mappingItem.startValue,\n          options = mappingItem.options\n\n        _this.dancer.dance(\n          type,\n          elementClass,\n          _this.analyser.getRangeAverageRatio(startValue, nbValue),\n          options\n        )\n      })\n      _this.animationFrameRequest = requestAnimationFrame(_this.renderRythm)\n    }\n\n    this.resetRythm = function() {\n      _this.rythms.forEach(function(mappingItem) {\n        var type = mappingItem.type,\n          elementClass = mappingItem.elementClass,\n          nbValue = mappingItem.nbValue,\n          startValue = mappingItem.startValue,\n          options = mappingItem.options\n\n        _this.dancer.reset(type, elementClass)\n      })\n    }\n\n    this.stop = function(freeze) {\n      _this.stopped = true\n      _this.player.stop()\n      if (_this.animationFrameRequest)\n        cancelAnimationFrame(_this.animationFrameRequest)\n      if (!freeze) _this.resetRythm()\n    }\n\n    this.player = new Player(forceAudioContext)\n    this.analyser = Analyser$1\n    this.maxValueHistory = Analyser$1.maxValueHistory\n    this.dancer = dancer\n    this.rythms = []\n    this.addRythm('rythm-bass', 'pulse', 0, 10)\n    this.addRythm('rythm-medium', 'pulse', 150, 40)\n    this.addRythm('rythm-high', 'pulse', 400, 200)\n    this.animationFrameRequest = void 0\n  }\n\n  return Rythm$1\n})\n//# sourceMappingURL=rythm.js.map\n"
        },
        {
          "name": "samples",
          "type": "tree",
          "content": null
        },
        {
          "name": "src",
          "type": "tree",
          "content": null
        },
        {
          "name": "yarn.lock",
          "type": "blob",
          "size": 129.58984375,
          "content": "# THIS IS AN AUTOGENERATED FILE. DO NOT EDIT THIS FILE DIRECTLY.\n# yarn lockfile v1\n\n\naccepts@~1.3.3:\n  version \"1.3.4\"\n  resolved \"https://registry.npmjs.org/accepts/-/accepts-1.3.4.tgz\"\n  integrity sha1-hiRnWMfdbSGmR0/whKR0DsBesh8=\n  dependencies:\n    mime-types \"~2.1.16\"\n    negotiator \"0.6.1\"\n\nacorn-jsx@^3.0.0:\n  version \"3.0.1\"\n  resolved \"https://registry.npmjs.org/acorn-jsx/-/acorn-jsx-3.0.1.tgz\"\n  integrity sha1-r9+UiPsezvyDSPb7IvRk4ypYs2s=\n  dependencies:\n    acorn \"^3.0.4\"\n\nacorn@^3.0.4:\n  version \"3.3.0\"\n  resolved \"https://registry.npmjs.org/acorn/-/acorn-3.3.0.tgz\"\n  integrity sha1-ReN/s56No/JbruP/U2niu18iAXo=\n\nacorn@^5.1.1:\n  version \"5.1.2\"\n  resolved \"https://registry.npmjs.org/acorn/-/acorn-5.1.2.tgz\"\n  integrity sha512-o96FZLJBPY1lvTuJylGA9Bk3t/GKPPJG8H0ydQQl01crzwJgspa4AEIq/pVTXigmK0PHVQhiAtn8WMBLL9D2WA==\n\najv-keywords@^1.0.0:\n  version \"1.5.1\"\n  resolved \"https://registry.npmjs.org/ajv-keywords/-/ajv-keywords-1.5.1.tgz\"\n  integrity sha1-MU3QpLM2j609/NxU7eYXG4htrzw=\n\najv@^4.7.0, ajv@>=4.10.0:\n  version \"4.11.8\"\n  resolved \"https://registry.npmjs.org/ajv/-/ajv-4.11.8.tgz\"\n  integrity sha1-gv+wKynmYq5TvcIK8VlHcGc5xTY=\n  dependencies:\n    co \"^4.6.0\"\n    json-stable-stringify \"^1.0.1\"\n\nansi-escapes@^1.0.0, ansi-escapes@^1.1.0:\n  version \"1.4.0\"\n  resolved \"https://registry.npmjs.org/ansi-escapes/-/ansi-escapes-1.4.0.tgz\"\n  integrity sha1-06ioOzGapneTZisT52HHkRQiMG4=\n\nansi-regex@^0.2.0, ansi-regex@^0.2.1:\n  version \"0.2.1\"\n  resolved \"https://registry.npmjs.org/ansi-regex/-/ansi-regex-0.2.1.tgz\"\n  integrity sha1-DY6UaWej2BQ/k+JOKYUl/BsiNfk=\n\nansi-regex@^2.0.0:\n  version \"2.1.1\"\n  resolved \"https://registry.npmjs.org/ansi-regex/-/ansi-regex-2.1.1.tgz\"\n  integrity sha1-w7M6te42DYbg5ijwRorn7yfWVN8=\n\nansi-regex@^3.0.0:\n  version \"3.0.0\"\n  resolved \"https://registry.npmjs.org/ansi-regex/-/ansi-regex-3.0.0.tgz\"\n  integrity sha1-7QMXwyIGT3lGbAKWa922Bas32Zg=\n\nansi-styles@^1.1.0:\n  version \"1.1.0\"\n  resolved \"https://registry.npmjs.org/ansi-styles/-/ansi-styles-1.1.0.tgz\"\n  integrity sha1-6uy/Zs1waIJ2Cy9GkVgrj1XXp94=\n\nansi-styles@^2.2.1:\n  version \"2.2.1\"\n  resolved \"https://registry.npmjs.org/ansi-styles/-/ansi-styles-2.2.1.tgz\"\n  integrity sha1-tDLdM1i2NM914eRmQ2gkBTPB3b4=\n\nansi-styles@^3.1.0:\n  version \"3.2.0\"\n  resolved \"https://registry.npmjs.org/ansi-styles/-/ansi-styles-3.2.0.tgz\"\n  integrity sha512-NnSOmMEYtVR2JVMIGTzynRkkaxtiq1xnFBcdQD/DnNCYPoEPsVJhM98BDyaoNOQIi7p4okdi3E27eN7GQbsUug==\n  dependencies:\n    color-convert \"^1.9.0\"\n\nansi-styles@^3.2.0:\n  version \"3.2.0\"\n  resolved \"https://registry.npmjs.org/ansi-styles/-/ansi-styles-3.2.0.tgz\"\n  integrity sha512-NnSOmMEYtVR2JVMIGTzynRkkaxtiq1xnFBcdQD/DnNCYPoEPsVJhM98BDyaoNOQIi7p4okdi3E27eN7GQbsUug==\n  dependencies:\n    color-convert \"^1.9.0\"\n\napp-root-path@^2.0.0:\n  version \"2.0.1\"\n  resolved \"https://registry.npmjs.org/app-root-path/-/app-root-path-2.0.1.tgz\"\n  integrity sha1-zWLc+OT9WkF+/GZNLlsQZTxlG0Y=\n\narchy@^1.0.0:\n  version \"1.0.0\"\n  resolved \"https://registry.npmjs.org/archy/-/archy-1.0.0.tgz\"\n  integrity sha1-+cjBN1fMHde8N5rHeyxipcKGjEA=\n\nargparse@^1.0.7:\n  version \"1.0.9\"\n  resolved \"https://registry.npmjs.org/argparse/-/argparse-1.0.9.tgz\"\n  integrity sha1-c9g7wmP4bpf4zE9rrhsOkKfSLIY=\n  dependencies:\n    sprintf-js \"~1.0.2\"\n\narr-diff@^2.0.0:\n  version \"2.0.0\"\n  resolved \"https://registry.npmjs.org/arr-diff/-/arr-diff-2.0.0.tgz\"\n  integrity sha1-jzuCf5Vai9ZpaX5KQlasPOrjVs8=\n  dependencies:\n    arr-flatten \"^1.0.1\"\n\narr-flatten@^1.0.1:\n  version \"1.1.0\"\n  resolved \"https://registry.npmjs.org/arr-flatten/-/arr-flatten-1.1.0.tgz\"\n  integrity sha512-L3hKV5R/p5o81R7O02IGnwpDmkp6E982XhtbuwSe3O4qOtMMMtodicASA1Cny2U+aCXcNpml+m4dPsvsJ3jatg==\n\narray-back@^1.0.3:\n  version \"1.0.4\"\n  resolved \"https://registry.npmjs.org/array-back/-/array-back-1.0.4.tgz\"\n  integrity sha1-ZEun8JX3/898Q7Xw3DnTwfA8Bjs=\n  dependencies:\n    typical \"^2.6.0\"\n\narray-back@^1.0.4:\n  version \"1.0.4\"\n  resolved \"https://registry.npmjs.org/array-back/-/array-back-1.0.4.tgz\"\n  integrity sha1-ZEun8JX3/898Q7Xw3DnTwfA8Bjs=\n  dependencies:\n    typical \"^2.6.0\"\n\narray-back@^2.0.0:\n  version \"2.0.0\"\n  resolved \"https://registry.npmjs.org/array-back/-/array-back-2.0.0.tgz\"\n  integrity sha512-eJv4pLLufP3g5kcZry0j6WXpIbzYw9GUB4mVJZno9wfwiBxbizTnHCw3VJb07cBihbFX48Y7oSrW9y+gt4glyw==\n  dependencies:\n    typical \"^2.6.1\"\n\narray-differ@^1.0.0:\n  version \"1.0.0\"\n  resolved \"https://registry.npmjs.org/array-differ/-/array-differ-1.0.0.tgz\"\n  integrity sha1-7/UuN1gknTO+QCuLuOVkuytdQDE=\n\narray-each@^1.0.1:\n  version \"1.0.1\"\n  resolved \"https://registry.npmjs.org/array-each/-/array-each-1.0.1.tgz\"\n  integrity sha1-p5SvDAWrF1KEbudTofIRoFugxE8=\n\narray-find-index@^1.0.1:\n  version \"1.0.2\"\n  resolved \"https://registry.npmjs.org/array-find-index/-/array-find-index-1.0.2.tgz\"\n  integrity sha1-3wEKoSh+Fku9pvlyOwqWoexBh6E=\n\narray-slice@^1.0.0:\n  version \"1.0.0\"\n  resolved \"https://registry.npmjs.org/array-slice/-/array-slice-1.0.0.tgz\"\n  integrity sha1-5zA08A3MH0CHYAj9IP6ud71LfC8=\n\narray-union@^1.0.1:\n  version \"1.0.2\"\n  resolved \"https://registry.npmjs.org/array-union/-/array-union-1.0.2.tgz\"\n  integrity sha1-mjRBDk9OPaI96jdb5b5w8kd47Dk=\n  dependencies:\n    array-uniq \"^1.0.1\"\n\narray-uniq@^1.0.1, array-uniq@^1.0.2:\n  version \"1.0.3\"\n  resolved \"https://registry.npmjs.org/array-uniq/-/array-uniq-1.0.3.tgz\"\n  integrity sha1-r2rId6Jcx/dOBYiUdThY39sk/bY=\n\narray-unique@^0.2.1:\n  version \"0.2.1\"\n  resolved \"https://registry.npmjs.org/array-unique/-/array-unique-0.2.1.tgz\"\n  integrity sha1-odl8yvy8JiXMcPrc6zalDFiwGlM=\n\narrify@^1.0.0:\n  version \"1.0.1\"\n  resolved \"https://registry.npmjs.org/arrify/-/arrify-1.0.1.tgz\"\n  integrity sha1-iYUI2iIm84DfkEcoRWhJwVAaSw0=\n\nasync-each@~0.1.5:\n  version \"0.1.6\"\n  resolved \"https://registry.npmjs.org/async-each/-/async-each-0.1.6.tgz\"\n  integrity sha512-+AOhqLFrKKsf3E6oWhYzSX/YPEZztxHi6W3TU6LoQFuZjzSt5tqITd0ZJh2Qy3vsWoFj6HTIEBRKqPiS70HzjQ==\n\nbabel-code-frame@^6.16.0, babel-code-frame@^6.22.0, babel-code-frame@^6.26.0:\n  version \"6.26.0\"\n  resolved \"https://registry.npmjs.org/babel-code-frame/-/babel-code-frame-6.26.0.tgz\"\n  integrity sha1-Y/1D99weO7fONZR9uP42mj9Yx0s=\n  dependencies:\n    chalk \"^1.1.3\"\n    esutils \"^2.0.2\"\n    js-tokens \"^3.0.2\"\n\nbabel-core@^6.26.0, babel-core@6:\n  version \"6.26.0\"\n  resolved \"https://registry.npmjs.org/babel-core/-/babel-core-6.26.0.tgz\"\n  integrity sha1-rzL3izGm/O8RnIew/Y2XU/A6C7g=\n  dependencies:\n    babel-code-frame \"^6.26.0\"\n    babel-generator \"^6.26.0\"\n    babel-helpers \"^6.24.1\"\n    babel-messages \"^6.23.0\"\n    babel-register \"^6.26.0\"\n    babel-runtime \"^6.26.0\"\n    babel-template \"^6.26.0\"\n    babel-traverse \"^6.26.0\"\n    babel-types \"^6.26.0\"\n    babylon \"^6.18.0\"\n    convert-source-map \"^1.5.0\"\n    debug \"^2.6.8\"\n    json5 \"^0.5.1\"\n    lodash \"^4.17.4\"\n    minimatch \"^3.0.4\"\n    path-is-absolute \"^1.0.1\"\n    private \"^0.1.7\"\n    slash \"^1.0.0\"\n    source-map \"^0.5.6\"\n\nbabel-eslint@^7.1.1:\n  version \"7.2.3\"\n  resolved \"https://registry.npmjs.org/babel-eslint/-/babel-eslint-7.2.3.tgz\"\n  integrity sha1-sv4tgBJkcPXBlELcdXJTqJdxCCc=\n  dependencies:\n    babel-code-frame \"^6.22.0\"\n    babel-traverse \"^6.23.1\"\n    babel-types \"^6.23.0\"\n    babylon \"^6.17.0\"\n\nbabel-generator@^6.26.0:\n  version \"6.26.0\"\n  resolved \"https://registry.npmjs.org/babel-generator/-/babel-generator-6.26.0.tgz\"\n  integrity sha1-rBriAHC3n248odMmlhMFN3TyDcU=\n  dependencies:\n    babel-messages \"^6.23.0\"\n    babel-runtime \"^6.26.0\"\n    babel-types \"^6.26.0\"\n    detect-indent \"^4.0.0\"\n    jsesc \"^1.3.0\"\n    lodash \"^4.17.4\"\n    source-map \"^0.5.6\"\n    trim-right \"^1.0.1\"\n\nbabel-helper-call-delegate@^6.24.1:\n  version \"6.24.1\"\n  resolved \"https://registry.npmjs.org/babel-helper-call-delegate/-/babel-helper-call-delegate-6.24.1.tgz\"\n  integrity sha1-7Oaqzdx25Bw0YfiL/Fdb0Nqi340=\n  dependencies:\n    babel-helper-hoist-variables \"^6.24.1\"\n    babel-runtime \"^6.22.0\"\n    babel-traverse \"^6.24.1\"\n    babel-types \"^6.24.1\"\n\nbabel-helper-define-map@^6.24.1:\n  version \"6.26.0\"\n  resolved \"https://registry.npmjs.org/babel-helper-define-map/-/babel-helper-define-map-6.26.0.tgz\"\n  integrity sha1-pfVtq0GiX5fstJjH66ypgZ+Vvl8=\n  dependencies:\n    babel-helper-function-name \"^6.24.1\"\n    babel-runtime \"^6.26.0\"\n    babel-types \"^6.26.0\"\n    lodash \"^4.17.4\"\n\nbabel-helper-function-name@^6.24.1:\n  version \"6.24.1\"\n  resolved \"https://registry.npmjs.org/babel-helper-function-name/-/babel-helper-function-name-6.24.1.tgz\"\n  integrity sha1-00dbjAPtmCQqJbSDUasYOZ01gKk=\n  dependencies:\n    babel-helper-get-function-arity \"^6.24.1\"\n    babel-runtime \"^6.22.0\"\n    babel-template \"^6.24.1\"\n    babel-traverse \"^6.24.1\"\n    babel-types \"^6.24.1\"\n\nbabel-helper-get-function-arity@^6.24.1:\n  version \"6.24.1\"\n  resolved \"https://registry.npmjs.org/babel-helper-get-function-arity/-/babel-helper-get-function-arity-6.24.1.tgz\"\n  integrity sha1-j3eCqpNAfEHTqlCQj4mwMbG2hT0=\n  dependencies:\n    babel-runtime \"^6.22.0\"\n    babel-types \"^6.24.1\"\n\nbabel-helper-hoist-variables@^6.24.1:\n  version \"6.24.1\"\n  resolved \"https://registry.npmjs.org/babel-helper-hoist-variables/-/babel-helper-hoist-variables-6.24.1.tgz\"\n  integrity sha1-HssnaJydJVE+rbyZFKc/VAi+enY=\n  dependencies:\n    babel-runtime \"^6.22.0\"\n    babel-types \"^6.24.1\"\n\nbabel-helper-optimise-call-expression@^6.24.1:\n  version \"6.24.1\"\n  resolved \"https://registry.npmjs.org/babel-helper-optimise-call-expression/-/babel-helper-optimise-call-expression-6.24.1.tgz\"\n  integrity sha1-96E0J7qfc/j0+pk8VKl4gtEkQlc=\n  dependencies:\n    babel-runtime \"^6.22.0\"\n    babel-types \"^6.24.1\"\n\nbabel-helper-regex@^6.24.1:\n  version \"6.26.0\"\n  resolved \"https://registry.npmjs.org/babel-helper-regex/-/babel-helper-regex-6.26.0.tgz\"\n  integrity sha1-MlxZ+QL4LyS3T6zu0DY5VPZJXnI=\n  dependencies:\n    babel-runtime \"^6.26.0\"\n    babel-types \"^6.26.0\"\n    lodash \"^4.17.4\"\n\nbabel-helper-replace-supers@^6.24.1:\n  version \"6.24.1\"\n  resolved \"https://registry.npmjs.org/babel-helper-replace-supers/-/babel-helper-replace-supers-6.24.1.tgz\"\n  integrity sha1-v22/5Dk40XNpohPKiov3S2qQqxo=\n  dependencies:\n    babel-helper-optimise-call-expression \"^6.24.1\"\n    babel-messages \"^6.23.0\"\n    babel-runtime \"^6.22.0\"\n    babel-template \"^6.24.1\"\n    babel-traverse \"^6.24.1\"\n    babel-types \"^6.24.1\"\n\nbabel-helpers@^6.24.1:\n  version \"6.24.1\"\n  resolved \"https://registry.npmjs.org/babel-helpers/-/babel-helpers-6.24.1.tgz\"\n  integrity sha1-NHHenK7DiOXIUOWX5Yom3fN2ArI=\n  dependencies:\n    babel-runtime \"^6.22.0\"\n    babel-template \"^6.24.1\"\n\nbabel-messages@^6.23.0:\n  version \"6.23.0\"\n  resolved \"https://registry.npmjs.org/babel-messages/-/babel-messages-6.23.0.tgz\"\n  integrity sha1-8830cDhYA1sqKVHG7F7fbGLyYw4=\n  dependencies:\n    babel-runtime \"^6.22.0\"\n\nbabel-plugin-check-es2015-constants@^6.22.0:\n  version \"6.22.0\"\n  resolved \"https://registry.npmjs.org/babel-plugin-check-es2015-constants/-/babel-plugin-check-es2015-constants-6.22.0.tgz\"\n  integrity sha1-NRV7EBQm/S/9PaP3XH0ekYNbv4o=\n  dependencies:\n    babel-runtime \"^6.22.0\"\n\nbabel-plugin-external-helpers@^6.22.0:\n  version \"6.22.0\"\n  resolved \"https://registry.npmjs.org/babel-plugin-external-helpers/-/babel-plugin-external-helpers-6.22.0.tgz\"\n  integrity sha1-IoX0iwK9Xe3oUXXK+MYuhq3M76E=\n  dependencies:\n    babel-runtime \"^6.22.0\"\n\nbabel-plugin-syntax-class-properties@^6.8.0:\n  version \"6.13.0\"\n  resolved \"https://registry.npmjs.org/babel-plugin-syntax-class-properties/-/babel-plugin-syntax-class-properties-6.13.0.tgz\"\n  integrity sha1-1+sjt5oxf4VDlixQW4J8fWysJ94=\n\nbabel-plugin-transform-class-properties@^6.23.0:\n  version \"6.24.1\"\n  resolved \"https://registry.npmjs.org/babel-plugin-transform-class-properties/-/babel-plugin-transform-class-properties-6.24.1.tgz\"\n  integrity sha1-anl2PqYdM9NvN7YRqp3vgagbRqw=\n  dependencies:\n    babel-helper-function-name \"^6.24.1\"\n    babel-plugin-syntax-class-properties \"^6.8.0\"\n    babel-runtime \"^6.22.0\"\n    babel-template \"^6.24.1\"\n\nbabel-plugin-transform-es2015-arrow-functions@^6.22.0:\n  version \"6.22.0\"\n  resolved \"https://registry.npmjs.org/babel-plugin-transform-es2015-arrow-functions/-/babel-plugin-transform-es2015-arrow-functions-6.22.0.tgz\"\n  integrity sha1-RSaSy3EdX3ncf4XkQM5BufJE0iE=\n  dependencies:\n    babel-runtime \"^6.22.0\"\n\nbabel-plugin-transform-es2015-block-scoped-functions@^6.22.0:\n  version \"6.22.0\"\n  resolved \"https://registry.npmjs.org/babel-plugin-transform-es2015-block-scoped-functions/-/babel-plugin-transform-es2015-block-scoped-functions-6.22.0.tgz\"\n  integrity sha1-u8UbSflk1wy42OC5ToICRs46YUE=\n  dependencies:\n    babel-runtime \"^6.22.0\"\n\nbabel-plugin-transform-es2015-block-scoping@^6.24.1:\n  version \"6.26.0\"\n  resolved \"https://registry.npmjs.org/babel-plugin-transform-es2015-block-scoping/-/babel-plugin-transform-es2015-block-scoping-6.26.0.tgz\"\n  integrity sha1-1w9SmcEwjQXBL0Y4E7CgnnOxiV8=\n  dependencies:\n    babel-runtime \"^6.26.0\"\n    babel-template \"^6.26.0\"\n    babel-traverse \"^6.26.0\"\n    babel-types \"^6.26.0\"\n    lodash \"^4.17.4\"\n\nbabel-plugin-transform-es2015-classes@^6.24.1, babel-plugin-transform-es2015-classes@^6.9.0:\n  version \"6.24.1\"\n  resolved \"https://registry.npmjs.org/babel-plugin-transform-es2015-classes/-/babel-plugin-transform-es2015-classes-6.24.1.tgz\"\n  integrity sha1-WkxYpQyclGHlZLSyo7+ryXolhNs=\n  dependencies:\n    babel-helper-define-map \"^6.24.1\"\n    babel-helper-function-name \"^6.24.1\"\n    babel-helper-optimise-call-expression \"^6.24.1\"\n    babel-helper-replace-supers \"^6.24.1\"\n    babel-messages \"^6.23.0\"\n    babel-runtime \"^6.22.0\"\n    babel-template \"^6.24.1\"\n    babel-traverse \"^6.24.1\"\n    babel-types \"^6.24.1\"\n\nbabel-plugin-transform-es2015-computed-properties@^6.24.1:\n  version \"6.24.1\"\n  resolved \"https://registry.npmjs.org/babel-plugin-transform-es2015-computed-properties/-/babel-plugin-transform-es2015-computed-properties-6.24.1.tgz\"\n  integrity sha1-b+Ko0WiV1WNPTNmZttNICjCBWbM=\n  dependencies:\n    babel-runtime \"^6.22.0\"\n    babel-template \"^6.24.1\"\n\nbabel-plugin-transform-es2015-destructuring@^6.22.0:\n  version \"6.23.0\"\n  resolved \"https://registry.npmjs.org/babel-plugin-transform-es2015-destructuring/-/babel-plugin-transform-es2015-destructuring-6.23.0.tgz\"\n  integrity sha1-mXux8auWf2gtKwh2/jWNYOdlxW0=\n  dependencies:\n    babel-runtime \"^6.22.0\"\n\nbabel-plugin-transform-es2015-duplicate-keys@^6.24.1:\n  version \"6.24.1\"\n  resolved \"https://registry.npmjs.org/babel-plugin-transform-es2015-duplicate-keys/-/babel-plugin-transform-es2015-duplicate-keys-6.24.1.tgz\"\n  integrity sha1-c+s9MQypaePvnskcU3QabxV2Qj4=\n  dependencies:\n    babel-runtime \"^6.22.0\"\n    babel-types \"^6.24.1\"\n\nbabel-plugin-transform-es2015-for-of@^6.22.0:\n  version \"6.23.0\"\n  resolved \"https://registry.npmjs.org/babel-plugin-transform-es2015-for-of/-/babel-plugin-transform-es2015-for-of-6.23.0.tgz\"\n  integrity sha1-9HyVsrYT3x0+zC/bdXNiPHUkhpE=\n  dependencies:\n    babel-runtime \"^6.22.0\"\n\nbabel-plugin-transform-es2015-function-name@^6.24.1:\n  version \"6.24.1\"\n  resolved \"https://registry.npmjs.org/babel-plugin-transform-es2015-function-name/-/babel-plugin-transform-es2015-function-name-6.24.1.tgz\"\n  integrity sha1-g0yJhTvDaxrw86TF26qU/Y6sqos=\n  dependencies:\n    babel-helper-function-name \"^6.24.1\"\n    babel-runtime \"^6.22.0\"\n    babel-types \"^6.24.1\"\n\nbabel-plugin-transform-es2015-literals@^6.22.0:\n  version \"6.22.0\"\n  resolved \"https://registry.npmjs.org/babel-plugin-transform-es2015-literals/-/babel-plugin-transform-es2015-literals-6.22.0.tgz\"\n  integrity sha1-T1SgLWzWbPkVKAAZox0xklN3yi4=\n  dependencies:\n    babel-runtime \"^6.22.0\"\n\nbabel-plugin-transform-es2015-modules-amd@^6.24.1:\n  version \"6.24.1\"\n  resolved \"https://registry.npmjs.org/babel-plugin-transform-es2015-modules-amd/-/babel-plugin-transform-es2015-modules-amd-6.24.1.tgz\"\n  integrity sha1-Oz5UAXI5hC1tGcMBHEvS8AoA0VQ=\n  dependencies:\n    babel-plugin-transform-es2015-modules-commonjs \"^6.24.1\"\n    babel-runtime \"^6.22.0\"\n    babel-template \"^6.24.1\"\n\nbabel-plugin-transform-es2015-modules-commonjs@^6.24.1:\n  version \"6.26.0\"\n  resolved \"https://registry.npmjs.org/babel-plugin-transform-es2015-modules-commonjs/-/babel-plugin-transform-es2015-modules-commonjs-6.26.0.tgz\"\n  integrity sha1-DYOUApt9xqvhqX7xgeAHWN0uXYo=\n  dependencies:\n    babel-plugin-transform-strict-mode \"^6.24.1\"\n    babel-runtime \"^6.26.0\"\n    babel-template \"^6.26.0\"\n    babel-types \"^6.26.0\"\n\nbabel-plugin-transform-es2015-modules-systemjs@^6.24.1:\n  version \"6.24.1\"\n  resolved \"https://registry.npmjs.org/babel-plugin-transform-es2015-modules-systemjs/-/babel-plugin-transform-es2015-modules-systemjs-6.24.1.tgz\"\n  integrity sha1-/4mhQrkRmpBhlfXxBuzzBdlAfSM=\n  dependencies:\n    babel-helper-hoist-variables \"^6.24.1\"\n    babel-runtime \"^6.22.0\"\n    babel-template \"^6.24.1\"\n\nbabel-plugin-transform-es2015-modules-umd@^6.24.1:\n  version \"6.24.1\"\n  resolved \"https://registry.npmjs.org/babel-plugin-transform-es2015-modules-umd/-/babel-plugin-transform-es2015-modules-umd-6.24.1.tgz\"\n  integrity sha1-rJl+YoXNGO1hdq22B9YCNErThGg=\n  dependencies:\n    babel-plugin-transform-es2015-modules-amd \"^6.24.1\"\n    babel-runtime \"^6.22.0\"\n    babel-template \"^6.24.1\"\n\nbabel-plugin-transform-es2015-object-super@^6.24.1:\n  version \"6.24.1\"\n  resolved \"https://registry.npmjs.org/babel-plugin-transform-es2015-object-super/-/babel-plugin-transform-es2015-object-super-6.24.1.tgz\"\n  integrity sha1-JM72muIcuDp/hgPa0CH1cusnj40=\n  dependencies:\n    babel-helper-replace-supers \"^6.24.1\"\n    babel-runtime \"^6.22.0\"\n\nbabel-plugin-transform-es2015-parameters@^6.24.1:\n  version \"6.24.1\"\n  resolved \"https://registry.npmjs.org/babel-plugin-transform-es2015-parameters/-/babel-plugin-transform-es2015-parameters-6.24.1.tgz\"\n  integrity sha1-V6w1GrScrxSpfNE7CfZv3wpiXys=\n  dependencies:\n    babel-helper-call-delegate \"^6.24.1\"\n    babel-helper-get-function-arity \"^6.24.1\"\n    babel-runtime \"^6.22.0\"\n    babel-template \"^6.24.1\"\n    babel-traverse \"^6.24.1\"\n    babel-types \"^6.24.1\"\n\nbabel-plugin-transform-es2015-shorthand-properties@^6.24.1:\n  version \"6.24.1\"\n  resolved \"https://registry.npmjs.org/babel-plugin-transform-es2015-shorthand-properties/-/babel-plugin-transform-es2015-shorthand-properties-6.24.1.tgz\"\n  integrity sha1-JPh11nIch2YbvZmkYi5R8U3jiqA=\n  dependencies:\n    babel-runtime \"^6.22.0\"\n    babel-types \"^6.24.1\"\n\nbabel-plugin-transform-es2015-spread@^6.22.0:\n  version \"6.22.0\"\n  resolved \"https://registry.npmjs.org/babel-plugin-transform-es2015-spread/-/babel-plugin-transform-es2015-spread-6.22.0.tgz\"\n  integrity sha1-1taKmfia7cRTbIGlQujdnxdG+NE=\n  dependencies:\n    babel-runtime \"^6.22.0\"\n\nbabel-plugin-transform-es2015-sticky-regex@^6.24.1:\n  version \"6.24.1\"\n  resolved \"https://registry.npmjs.org/babel-plugin-transform-es2015-sticky-regex/-/babel-plugin-transform-es2015-sticky-regex-6.24.1.tgz\"\n  integrity sha1-AMHNsaynERLN8M9hJsLta0V8zbw=\n  dependencies:\n    babel-helper-regex \"^6.24.1\"\n    babel-runtime \"^6.22.0\"\n    babel-types \"^6.24.1\"\n\nbabel-plugin-transform-es2015-template-literals@^6.22.0:\n  version \"6.22.0\"\n  resolved \"https://registry.npmjs.org/babel-plugin-transform-es2015-template-literals/-/babel-plugin-transform-es2015-template-literals-6.22.0.tgz\"\n  integrity sha1-qEs0UPfp+PH2g51taH2oS7EjbY0=\n  dependencies:\n    babel-runtime \"^6.22.0\"\n\nbabel-plugin-transform-es2015-typeof-symbol@^6.22.0:\n  version \"6.23.0\"\n  resolved \"https://registry.npmjs.org/babel-plugin-transform-es2015-typeof-symbol/-/babel-plugin-transform-es2015-typeof-symbol-6.23.0.tgz\"\n  integrity sha1-3sCfHN3/lLUqxz1QXITfWdzOs3I=\n  dependencies:\n    babel-runtime \"^6.22.0\"\n\nbabel-plugin-transform-es2015-unicode-regex@^6.24.1:\n  version \"6.24.1\"\n  resolved \"https://registry.npmjs.org/babel-plugin-transform-es2015-unicode-regex/-/babel-plugin-transform-es2015-unicode-regex-6.24.1.tgz\"\n  integrity sha1-04sS9C6nMj9yk4fxinxa4frrNek=\n  dependencies:\n    babel-helper-regex \"^6.24.1\"\n    babel-runtime \"^6.22.0\"\n    regexpu-core \"^2.0.0\"\n\nbabel-plugin-transform-regenerator@^6.24.1:\n  version \"6.26.0\"\n  resolved \"https://registry.npmjs.org/babel-plugin-transform-regenerator/-/babel-plugin-transform-regenerator-6.26.0.tgz\"\n  integrity sha1-4HA2lvveJ/Cj78rPi03KL3s6jy8=\n  dependencies:\n    regenerator-transform \"^0.10.0\"\n\nbabel-plugin-transform-strict-mode@^6.24.1:\n  version \"6.24.1\"\n  resolved \"https://registry.npmjs.org/babel-plugin-transform-strict-mode/-/babel-plugin-transform-strict-mode-6.24.1.tgz\"\n  integrity sha1-1fr3qleKZbvlkc9e2uBKDGcCB1g=\n  dependencies:\n    babel-runtime \"^6.22.0\"\n    babel-types \"^6.24.1\"\n\nbabel-preset-es2015@^6.22.0:\n  version \"6.24.1\"\n  resolved \"https://registry.npmjs.org/babel-preset-es2015/-/babel-preset-es2015-6.24.1.tgz\"\n  integrity sha1-1EBQ1rwsn+6nAqrzjXJ6AhBTiTk=\n  dependencies:\n    babel-plugin-check-es2015-constants \"^6.22.0\"\n    babel-plugin-transform-es2015-arrow-functions \"^6.22.0\"\n    babel-plugin-transform-es2015-block-scoped-functions \"^6.22.0\"\n    babel-plugin-transform-es2015-block-scoping \"^6.24.1\"\n    babel-plugin-transform-es2015-classes \"^6.24.1\"\n    babel-plugin-transform-es2015-computed-properties \"^6.24.1\"\n    babel-plugin-transform-es2015-destructuring \"^6.22.0\"\n    babel-plugin-transform-es2015-duplicate-keys \"^6.24.1\"\n    babel-plugin-transform-es2015-for-of \"^6.22.0\"\n    babel-plugin-transform-es2015-function-name \"^6.24.1\"\n    babel-plugin-transform-es2015-literals \"^6.22.0\"\n    babel-plugin-transform-es2015-modules-amd \"^6.24.1\"\n    babel-plugin-transform-es2015-modules-commonjs \"^6.24.1\"\n    babel-plugin-transform-es2015-modules-systemjs \"^6.24.1\"\n    babel-plugin-transform-es2015-modules-umd \"^6.24.1\"\n    babel-plugin-transform-es2015-object-super \"^6.24.1\"\n    babel-plugin-transform-es2015-parameters \"^6.24.1\"\n    babel-plugin-transform-es2015-shorthand-properties \"^6.24.1\"\n    babel-plugin-transform-es2015-spread \"^6.22.0\"\n    babel-plugin-transform-es2015-sticky-regex \"^6.24.1\"\n    babel-plugin-transform-es2015-template-literals \"^6.22.0\"\n    babel-plugin-transform-es2015-typeof-symbol \"^6.22.0\"\n    babel-plugin-transform-es2015-unicode-regex \"^6.24.1\"\n    babel-plugin-transform-regenerator \"^6.24.1\"\n\nbabel-register@^6.23.0, babel-register@^6.26.0:\n  version \"6.26.0\"\n  resolved \"https://registry.npmjs.org/babel-register/-/babel-register-6.26.0.tgz\"\n  integrity sha1-btAhFz4vy0htestFxgCahW9kcHE=\n  dependencies:\n    babel-core \"^6.26.0\"\n    babel-runtime \"^6.26.0\"\n    core-js \"^2.5.0\"\n    home-or-tmp \"^2.0.0\"\n    lodash \"^4.17.4\"\n    mkdirp \"^0.5.1\"\n    source-map-support \"^0.4.15\"\n\nbabel-runtime@^6.18.0, babel-runtime@^6.22.0, babel-runtime@^6.26.0:\n  version \"6.26.0\"\n  resolved \"https://registry.npmjs.org/babel-runtime/-/babel-runtime-6.26.0.tgz\"\n  integrity sha1-llxwWGaOgrVde/4E/yM3vItWR/4=\n  dependencies:\n    core-js \"^2.4.0\"\n    regenerator-runtime \"^0.11.0\"\n\nbabel-template@^6.24.1, babel-template@^6.26.0:\n  version \"6.26.0\"\n  resolved \"https://registry.npmjs.org/babel-template/-/babel-template-6.26.0.tgz\"\n  integrity sha1-3gPi0WOWsGn0bdn/+FIfsaDjXgI=\n  dependencies:\n    babel-runtime \"^6.26.0\"\n    babel-traverse \"^6.26.0\"\n    babel-types \"^6.26.0\"\n    babylon \"^6.18.0\"\n    lodash \"^4.17.4\"\n\nbabel-traverse@^6.23.1, babel-traverse@^6.24.1, babel-traverse@^6.26.0:\n  version \"6.26.0\"\n  resolved \"https://registry.npmjs.org/babel-traverse/-/babel-traverse-6.26.0.tgz\"\n  integrity sha1-RqnL1+3MYsjlwGTi0tjQ9ANXZu4=\n  dependencies:\n    babel-code-frame \"^6.26.0\"\n    babel-messages \"^6.23.0\"\n    babel-runtime \"^6.26.0\"\n    babel-types \"^6.26.0\"\n    babylon \"^6.18.0\"\n    debug \"^2.6.8\"\n    globals \"^9.18.0\"\n    invariant \"^2.2.2\"\n    lodash \"^4.17.4\"\n\nbabel-types@^6.19.0, babel-types@^6.23.0, babel-types@^6.24.1, babel-types@^6.26.0:\n  version \"6.26.0\"\n  resolved \"https://registry.npmjs.org/babel-types/-/babel-types-6.26.0.tgz\"\n  integrity sha1-o7Bz+Uq0nrb6Vc1lInozQ4BjJJc=\n  dependencies:\n    babel-runtime \"^6.26.0\"\n    esutils \"^2.0.2\"\n    lodash \"^4.17.4\"\n    to-fast-properties \"^1.0.3\"\n\nbabelrc-rollup@^3.0.0:\n  version \"3.0.0\"\n  resolved \"https://registry.npmjs.org/babelrc-rollup/-/babelrc-rollup-3.0.0.tgz\"\n  integrity sha1-/Ozb4+tkAM9OdpIzwXhqL6/otWw=\n  dependencies:\n    resolve \"^1.1.7\"\n\nbabylon@^6.17.0, babylon@^6.18.0:\n  version \"6.18.0\"\n  resolved \"https://registry.npmjs.org/babylon/-/babylon-6.18.0.tgz\"\n  integrity sha512-q/UEjfGJ2Cm3oKV71DJz9d25TPnq5rhBVL2Q4fA5wcC3jcrdn7+SssEybFIxwAvvP+YCsCYNKughoF33GxgycQ==\n\nbalanced-match@^1.0.0:\n  version \"1.0.0\"\n  resolved \"https://registry.npmjs.org/balanced-match/-/balanced-match-1.0.0.tgz\"\n  integrity sha1-ibTRmasr7kneFk6gK4nORi1xt2c=\n\nbatch@0.6.1:\n  version \"0.6.1\"\n  resolved \"https://registry.npmjs.org/batch/-/batch-0.6.1.tgz\"\n  integrity sha1-3DQxT05nkxgJP8dgJyUl+UvyXBY=\n\nbeeper@^1.0.0:\n  version \"1.1.1\"\n  resolved \"https://registry.npmjs.org/beeper/-/beeper-1.1.1.tgz\"\n  integrity sha1-5tXqjF2tABMEpwsiY4RH9pyy+Ak=\n\nbody-parser@~1.8.0:\n  version \"1.8.4\"\n  resolved \"https://registry.npmjs.org/body-parser/-/body-parser-1.8.4.tgz\"\n  integrity sha1-1JfgS8E7P5qL2McLsM3Bby4CiJg=\n  dependencies:\n    bytes \"1.0.0\"\n    depd \"0.4.5\"\n    iconv-lite \"0.4.4\"\n    media-typer \"0.3.0\"\n    on-finished \"2.1.0\"\n    qs \"2.2.4\"\n    raw-body \"1.3.0\"\n    type-is \"~1.5.1\"\n\nbrace-expansion@^1.0.0, brace-expansion@^1.1.7:\n  version \"1.1.8\"\n  resolved \"https://registry.npmjs.org/brace-expansion/-/brace-expansion-1.1.8.tgz\"\n  integrity sha1-wHshHHyVLsH479Uad+8NHTmQopI=\n  dependencies:\n    balanced-match \"^1.0.0\"\n    concat-map \"0.0.1\"\n\nbraces@^1.8.2:\n  version \"1.8.5\"\n  resolved \"https://registry.npmjs.org/braces/-/braces-1.8.5.tgz\"\n  integrity sha1-uneWLhLf+WnWt2cR6RS3N4V79qc=\n  dependencies:\n    expand-range \"^1.8.1\"\n    preserve \"^0.2.0\"\n    repeat-element \"^1.1.2\"\n\nbuiltin-modules@^1.0.0:\n  version \"1.1.1\"\n  resolved \"https://registry.npmjs.org/builtin-modules/-/builtin-modules-1.1.1.tgz\"\n  integrity sha1-Jw8HbFpywC9bZaR9+Uxf46J4iS8=\n\nbytes@1, bytes@1.0.0:\n  version \"1.0.0\"\n  resolved \"https://registry.npmjs.org/bytes/-/bytes-1.0.0.tgz\"\n  integrity sha1-NWnt6Lo0MV+rmcPpLLBMciDeH6g=\n\ncaller-path@^0.1.0:\n  version \"0.1.0\"\n  resolved \"https://registry.npmjs.org/caller-path/-/caller-path-0.1.0.tgz\"\n  integrity sha1-lAhe9jWB7NPaqSREqP6U6CV3dR8=\n  dependencies:\n    callsites \"^0.2.0\"\n\ncallsites@^0.2.0:\n  version \"0.2.0\"\n  resolved \"https://registry.npmjs.org/callsites/-/callsites-0.2.0.tgz\"\n  integrity sha1-r6uWJikQp/M8GaV3WCXGnzTjUMo=\n\ncamelcase-keys@^2.0.0:\n  version \"2.1.0\"\n  resolved \"https://registry.npmjs.org/camelcase-keys/-/camelcase-keys-2.1.0.tgz\"\n  integrity sha1-MIvur/3ygRkFHvodkyITyRuPkuc=\n  dependencies:\n    camelcase \"^2.0.0\"\n    map-obj \"^1.0.0\"\n\ncamelcase@^2.0.0:\n  version \"2.1.1\"\n  resolved \"https://registry.npmjs.org/camelcase/-/camelcase-2.1.1.tgz\"\n  integrity sha1-fB0W1nmhu+WcoCys7PsBHiAfWh8=\n\nchalk@^0.5.0:\n  version \"0.5.1\"\n  resolved \"https://registry.npmjs.org/chalk/-/chalk-0.5.1.tgz\"\n  integrity sha1-Zjs6ZItotV0EaQ1JFnqoN4WPIXQ=\n  dependencies:\n    ansi-styles \"^1.1.0\"\n    escape-string-regexp \"^1.0.0\"\n    has-ansi \"^0.1.0\"\n    strip-ansi \"^0.3.0\"\n    supports-color \"^0.2.0\"\n\nchalk@^1.0.0, chalk@^1.1.1, chalk@^1.1.3:\n  version \"1.1.3\"\n  resolved \"https://registry.npmjs.org/chalk/-/chalk-1.1.3.tgz\"\n  integrity sha1-qBFcVeSnAv5NFQq9OHKCKn4J/Jg=\n  dependencies:\n    ansi-styles \"^2.2.1\"\n    escape-string-regexp \"^1.0.2\"\n    has-ansi \"^2.0.0\"\n    strip-ansi \"^3.0.0\"\n    supports-color \"^2.0.0\"\n\nchalk@^2.0.1:\n  version \"2.2.0\"\n  resolved \"https://registry.npmjs.org/chalk/-/chalk-2.2.0.tgz\"\n  integrity sha512-0BMM/2hG3ZaoPfR6F+h/oWpZtsh3b/s62TjSM6MGCJWEbJDN1acqCXvyhhZsDSVFklpebUoQ5O1kKC7lOzrn9g==\n  dependencies:\n    ansi-styles \"^3.1.0\"\n    escape-string-regexp \"^1.0.5\"\n    supports-color \"^4.0.0\"\n\nchalk@^2.1.0:\n  version \"2.2.0\"\n  resolved \"https://registry.npmjs.org/chalk/-/chalk-2.2.0.tgz\"\n  integrity sha512-0BMM/2hG3ZaoPfR6F+h/oWpZtsh3b/s62TjSM6MGCJWEbJDN1acqCXvyhhZsDSVFklpebUoQ5O1kKC7lOzrn9g==\n  dependencies:\n    ansi-styles \"^3.1.0\"\n    escape-string-regexp \"^1.0.5\"\n    supports-color \"^4.0.0\"\n\nchalk@0.5.1:\n  version \"0.5.1\"\n  resolved \"https://registry.npmjs.org/chalk/-/chalk-0.5.1.tgz\"\n  integrity sha1-Zjs6ZItotV0EaQ1JFnqoN4WPIXQ=\n  dependencies:\n    ansi-styles \"^1.1.0\"\n    escape-string-regexp \"^1.0.0\"\n    has-ansi \"^0.1.0\"\n    strip-ansi \"^0.3.0\"\n    supports-color \"^0.2.0\"\n\nchokidar@^0.12.4:\n  version \"0.12.6\"\n  resolved \"https://registry.npmjs.org/chokidar/-/chokidar-0.12.6.tgz\"\n  integrity sha512-nMQqT43NJ46Yc75wx9pQ7p/yhzg/5qXHPcgHKUcTLCdcUr1xMUM92SSY4sfGNpJ2zRHQqUsk1hnlP4GW8mm0Aw==\n  dependencies:\n    async-each \"~0.1.5\"\n    readdirp \"~1.3.0\"\n  optionalDependencies:\n    fsevents \"~0.3.1\"\n\nci-info@^1.0.0:\n  version \"1.1.1\"\n  resolved \"https://registry.npmjs.org/ci-info/-/ci-info-1.1.1.tgz\"\n  integrity sha512-vHDDF/bP9RYpTWtUhpJRhCFdvvp3iDWvEbuDbWgvjUrNGV1MXJrE0MPcwGtEled04m61iwdBLUIHZtDgzWS4ZQ==\n\ncircular-json@^0.3.1:\n  version \"0.3.3\"\n  resolved \"https://registry.npmjs.org/circular-json/-/circular-json-0.3.3.tgz\"\n  integrity sha512-UZK3NBx2Mca+b5LsG7bY183pHWt5Y1xts4P3Pz7ENTwGVnJOUWbRb3ocjvX7hx9tq/yTAdclXm9sZ38gNuem4A==\n\ncli-cursor@^1.0.1, cli-cursor@^1.0.2:\n  version \"1.0.2\"\n  resolved \"https://registry.npmjs.org/cli-cursor/-/cli-cursor-1.0.2.tgz\"\n  integrity sha1-ZNo/fValRBLll5S9Ytw1KV6PKYc=\n  dependencies:\n    restore-cursor \"^1.0.1\"\n\ncli-spinners@^0.1.2:\n  version \"0.1.2\"\n  resolved \"https://registry.npmjs.org/cli-spinners/-/cli-spinners-0.1.2.tgz\"\n  integrity sha1-u3ZNiOGF+54eaiofGXcjGPYF4xw=\n\ncli-truncate@^0.2.1:\n  version \"0.2.1\"\n  resolved \"https://registry.npmjs.org/cli-truncate/-/cli-truncate-0.2.1.tgz\"\n  integrity sha1-nxXPuwcFAFNpIWxiasfQWrkN1XQ=\n  dependencies:\n    slice-ansi \"0.0.4\"\n    string-width \"^1.0.1\"\n\ncli-width@^2.0.0:\n  version \"2.2.0\"\n  resolved \"https://registry.npmjs.org/cli-width/-/cli-width-2.2.0.tgz\"\n  integrity sha1-/xnt6Kml5XkyQUewwR8PvLq+1jk=\n\nclone-stats@^0.0.1, clone-stats@~0.0.1:\n  version \"0.0.1\"\n  resolved \"https://registry.npmjs.org/clone-stats/-/clone-stats-0.0.1.tgz\"\n  integrity sha1-uI+UqCzzi4eR1YBG6kAprYjKmdE=\n\nclone@^0.2.0:\n  version \"0.2.0\"\n  resolved \"https://registry.npmjs.org/clone/-/clone-0.2.0.tgz\"\n  integrity sha1-xhJqkK1Pctv1rNskPMN3JP6T/B8=\n\nclone@^1.0.0, clone@^1.0.2:\n  version \"1.0.2\"\n  resolved \"https://registry.npmjs.org/clone/-/clone-1.0.2.tgz\"\n  integrity sha1-Jgt6meux7f4kdTgXX3gyQ8sZ0Uk=\n\nco@^4.6.0:\n  version \"4.6.0\"\n  resolved \"https://registry.npmjs.org/co/-/co-4.6.0.tgz\"\n  integrity sha1-bqa989hTrlTMuOR7+gvz+QMfsYQ=\n\ncode-point-at@^1.0.0:\n  version \"1.1.0\"\n  resolved \"https://registry.npmjs.org/code-point-at/-/code-point-at-1.1.0.tgz\"\n  integrity sha1-DQcLTQQ6W+ozovGkDi7bPZpMz3c=\n\ncolor-convert@^1.9.0:\n  version \"1.9.0\"\n  resolved \"https://registry.npmjs.org/color-convert/-/color-convert-1.9.0.tgz\"\n  integrity sha1-Gsz5fdc5uYO/mU1W/sj5WFNkG3o=\n  dependencies:\n    color-name \"^1.1.1\"\n\ncolor-name@^1.1.1:\n  version \"1.1.3\"\n  resolved \"https://registry.npmjs.org/color-name/-/color-name-1.1.3.tgz\"\n  integrity sha1-p9BVi9icQveV3UIyj3QIMcpTvCU=\n\ncolors@1.0.3:\n  version \"1.0.3\"\n  resolved \"https://registry.npmjs.org/colors/-/colors-1.0.3.tgz\"\n  integrity sha512-pFGrxThWcWQ2MsAz6RtgeWe4NK2kUE1WfsrvvlctdII745EW9I0yflqhe7++M5LEc7bV2c/9/5zc8sFcpL0Drw==\n\ncommand-line-args@^4.0.7:\n  version \"4.0.7\"\n  resolved \"https://registry.npmjs.org/command-line-args/-/command-line-args-4.0.7.tgz\"\n  integrity sha512-aUdPvQRAyBvQd2n7jXcsMDz68ckBJELXNzBybCHOibUWEg0mWTnaYCSRU8h9R+aNRSvDihJtssSRCiDRpLaezA==\n  dependencies:\n    array-back \"^2.0.0\"\n    find-replace \"^1.0.3\"\n    typical \"^2.6.1\"\n\ncommander@^2.11.0:\n  version \"2.11.0\"\n  resolved \"https://registry.npmjs.org/commander/-/commander-2.11.0.tgz\"\n  integrity sha512-b0553uYA5YAEGgyYIGYROzKQ7X5RAqedkfjiZxwi0kL1g3bOaBNNZfYkzt/CL0umgD5wc9Jec2FbB98CjkMRvQ==\n\ncommander@^2.9.0:\n  version \"2.11.0\"\n  resolved \"https://registry.npmjs.org/commander/-/commander-2.11.0.tgz\"\n  integrity sha512-b0553uYA5YAEGgyYIGYROzKQ7X5RAqedkfjiZxwi0kL1g3bOaBNNZfYkzt/CL0umgD5wc9Jec2FbB98CjkMRvQ==\n\ncommander@~2.11.0:\n  version \"2.11.0\"\n  resolved \"https://registry.npmjs.org/commander/-/commander-2.11.0.tgz\"\n  integrity sha512-b0553uYA5YAEGgyYIGYROzKQ7X5RAqedkfjiZxwi0kL1g3bOaBNNZfYkzt/CL0umgD5wc9Jec2FbB98CjkMRvQ==\n\ncommander@2.6.0:\n  version \"2.6.0\"\n  resolved \"https://registry.npmjs.org/commander/-/commander-2.6.0.tgz\"\n  integrity sha1-nfflL7Kgyw+4kFjugMMQQiXzfh0=\n\nconcat-map@0.0.1:\n  version \"0.0.1\"\n  resolved \"https://registry.npmjs.org/concat-map/-/concat-map-0.0.1.tgz\"\n  integrity sha1-2Klr13/Wjfd5OnMDajug1UBdR3s=\n\nconcat-stream@^1.5.2:\n  version \"1.6.0\"\n  resolved \"https://registry.npmjs.org/concat-stream/-/concat-stream-1.6.0.tgz\"\n  integrity sha1-CqxmL9Ur54lk1VMvaUeE5wEQrPc=\n  dependencies:\n    inherits \"^2.0.3\"\n    readable-stream \"^2.2.2\"\n    typedarray \"^0.0.6\"\n\nconcurrently@^3.3.0:\n  version \"3.5.0\"\n  resolved \"https://registry.npmjs.org/concurrently/-/concurrently-3.5.0.tgz\"\n  integrity sha1-jPG3cHppFqeKT/W3e7BN7FSzebI=\n  dependencies:\n    chalk \"0.5.1\"\n    commander \"2.6.0\"\n    date-fns \"^1.23.0\"\n    lodash \"^4.5.1\"\n    rx \"2.3.24\"\n    spawn-command \"^0.0.2-1\"\n    supports-color \"^3.2.3\"\n    tree-kill \"^1.1.0\"\n\nconnect-livereload@^0.4.0:\n  version \"0.4.1\"\n  resolved \"https://registry.npmjs.org/connect-livereload/-/connect-livereload-0.4.1.tgz\"\n  integrity sha1-D4oagWvJuv+uRjfM6pF0Yv41kXo=\n\nconnect@^3.0.1:\n  version \"3.6.3\"\n  resolved \"https://registry.npmjs.org/connect/-/connect-3.6.3.tgz\"\n  integrity sha512-GLSZqgjVxPvGYVD/2vz//gS201MEXk4b7t3nHV6OVnTdDNWi/Gm7Rpxs/ybvljPWvULys/wrzIV3jB3YvEc3nQ==\n  dependencies:\n    debug \"2.6.8\"\n    finalhandler \"1.0.4\"\n    parseurl \"~1.3.1\"\n    utils-merge \"1.0.0\"\n\nconvert-source-map@^1.5.0:\n  version \"1.5.0\"\n  resolved \"https://registry.npmjs.org/convert-source-map/-/convert-source-map-1.5.0.tgz\"\n  integrity sha1-ms1whRxtXf3ZPZKC5e35SgP/RrU=\n\ncore-js@^2.4.0, core-js@^2.5.0:\n  version \"2.5.1\"\n  resolved \"https://registry.npmjs.org/core-js/-/core-js-2.5.1.tgz\"\n  integrity sha1-rmh03GaTd4m4B1T/VCjfZoGcpQs=\n\ncore-util-is@~1.0.0:\n  version \"1.0.2\"\n  resolved \"https://registry.npmjs.org/core-util-is/-/core-util-is-1.0.2.tgz\"\n  integrity sha1-tf1UIgqivFq1eqtxQMlAdUUDwac=\n\ncosmiconfig@^1.1.0:\n  version \"1.1.0\"\n  resolved \"https://registry.npmjs.org/cosmiconfig/-/cosmiconfig-1.1.0.tgz\"\n  integrity sha1-DeoPmATv37kp+7GxiOJVU+oFPTc=\n  dependencies:\n    graceful-fs \"^4.1.2\"\n    js-yaml \"^3.4.3\"\n    minimist \"^1.2.0\"\n    object-assign \"^4.0.1\"\n    os-homedir \"^1.0.1\"\n    parse-json \"^2.2.0\"\n    pinkie-promise \"^2.0.0\"\n    require-from-string \"^1.1.0\"\n\ncross-spawn@^5.0.1:\n  version \"5.1.0\"\n  resolved \"https://registry.npmjs.org/cross-spawn/-/cross-spawn-5.1.0.tgz\"\n  integrity sha1-6L0O/uWPz/b4+UUQoKVUu/ojVEk=\n  dependencies:\n    lru-cache \"^4.0.1\"\n    shebang-command \"^1.2.0\"\n    which \"^1.2.9\"\n\ncurrently-unhandled@^0.4.1:\n  version \"0.4.1\"\n  resolved \"https://registry.npmjs.org/currently-unhandled/-/currently-unhandled-0.4.1.tgz\"\n  integrity sha1-mI3zP+qxke95mmE2nddsF635V+o=\n  dependencies:\n    array-find-index \"^1.0.1\"\n\nd@1:\n  version \"1.0.0\"\n  resolved \"https://registry.npmjs.org/d/-/d-1.0.0.tgz\"\n  integrity sha1-dUu1v+VUUdpppYuU1F9MWwRi1Y8=\n  dependencies:\n    es5-ext \"^0.10.9\"\n\ndate-fns@^1.23.0, date-fns@^1.27.2:\n  version \"1.28.5\"\n  resolved \"https://registry.npmjs.org/date-fns/-/date-fns-1.28.5.tgz\"\n  integrity sha1-JXz8RdMi30XvVlhmWWfuhBzXP68=\n\ndateformat@^1.0.7-1.2.3:\n  version \"1.0.12\"\n  resolved \"https://registry.npmjs.org/dateformat/-/dateformat-1.0.12.tgz\"\n  integrity sha1-nxJLZ1lMk3/3BpMuSmQsyo27/uk=\n  dependencies:\n    get-stdin \"^4.0.1\"\n    meow \"^3.3.0\"\n\ndateformat@^2.0.0:\n  version \"2.0.0\"\n  resolved \"https://registry.npmjs.org/dateformat/-/dateformat-2.0.0.tgz\"\n  integrity sha1-J0Pjq7XD/CRi5SfcpEXgTp9N7hc=\n\ndebug@^2.1.1, debug@^2.6.8, debug@2.6.8:\n  version \"2.6.8\"\n  resolved \"https://registry.npmjs.org/debug/-/debug-2.6.8.tgz\"\n  integrity sha1-5zFTHKLt4n0YgiJCfaF4IdaP9Pw=\n  dependencies:\n    ms \"2.0.0\"\n\ndebug@~0.8.1:\n  version \"0.8.1\"\n  resolved \"https://registry.npmjs.org/debug/-/debug-0.8.1.tgz\"\n  integrity sha1-IP9NJvXkIstoobrLu2EDmtjBwTA=\n\ndecamelize@^1.1.2:\n  version \"1.2.0\"\n  resolved \"https://registry.npmjs.org/decamelize/-/decamelize-1.2.0.tgz\"\n  integrity sha1-9lNNFRSCabIDUue+4m9QH5oZEpA=\n\ndeep-is@~0.1.3:\n  version \"0.1.3\"\n  resolved \"https://registry.npmjs.org/deep-is/-/deep-is-0.1.3.tgz\"\n  integrity sha1-s2nW+128E+7PUk+RsHD+7cNXzzQ=\n\ndefaults@^1.0.0:\n  version \"1.0.3\"\n  resolved \"https://registry.npmjs.org/defaults/-/defaults-1.0.3.tgz\"\n  integrity sha1-xlYFHpgX2f8I7YgUd/P+QBnz730=\n  dependencies:\n    clone \"^1.0.2\"\n\ndel@^2.0.2:\n  version \"2.2.2\"\n  resolved \"https://registry.npmjs.org/del/-/del-2.2.2.tgz\"\n  integrity sha1-wSyYHQZ4RshLyvhiz/kw2Qf/0ag=\n  dependencies:\n    globby \"^5.0.0\"\n    is-path-cwd \"^1.0.0\"\n    is-path-in-cwd \"^1.0.0\"\n    object-assign \"^4.0.1\"\n    pify \"^2.0.0\"\n    pinkie-promise \"^2.0.0\"\n    rimraf \"^2.2.8\"\n\ndepd@~1.1.1, depd@1.1.1:\n  version \"1.1.1\"\n  resolved \"https://registry.npmjs.org/depd/-/depd-1.1.1.tgz\"\n  integrity sha1-V4O04cRZ8G+lyif5kfPQbnoxA1k=\n\ndepd@0.4.5:\n  version \"0.4.5\"\n  resolved \"https://registry.npmjs.org/depd/-/depd-0.4.5.tgz\"\n  integrity sha1-GmZLUziLSmVz6K5ntfdnxpPKl/E=\n\ndeprecated@^0.0.1:\n  version \"0.0.1\"\n  resolved \"https://registry.npmjs.org/deprecated/-/deprecated-0.0.1.tgz\"\n  integrity sha1-+cmvVGSvoeepcUWKi97yqpTVuxk=\n\ndestroy@~1.0.4:\n  version \"1.0.4\"\n  resolved \"https://registry.npmjs.org/destroy/-/destroy-1.0.4.tgz\"\n  integrity sha1-l4hXRCxEdJ5CBmE+N5RiBYJqvYA=\n\ndetect-file@^0.1.0:\n  version \"0.1.0\"\n  resolved \"https://registry.npmjs.org/detect-file/-/detect-file-0.1.0.tgz\"\n  integrity sha1-STXe39lIhkjgBrASlWbpOGcR6mM=\n  dependencies:\n    fs-exists-sync \"^0.1.0\"\n\ndetect-indent@^4.0.0:\n  version \"4.0.0\"\n  resolved \"https://registry.npmjs.org/detect-indent/-/detect-indent-4.0.0.tgz\"\n  integrity sha1-920GQ1LN9Docts5hnE7jqUdd4gg=\n  dependencies:\n    repeating \"^2.0.0\"\n\ndoctrine@^2.0.0:\n  version \"2.0.0\"\n  resolved \"https://registry.npmjs.org/doctrine/-/doctrine-2.0.0.tgz\"\n  integrity sha1-xz2NKQnSIpHhoAejlYBNqLZl/mM=\n  dependencies:\n    esutils \"^2.0.2\"\n    isarray \"^1.0.0\"\n\nduplexer2@0.0.2:\n  version \"0.0.2\"\n  resolved \"https://registry.npmjs.org/duplexer2/-/duplexer2-0.0.2.tgz\"\n  integrity sha1-xhTc9n4vsUmVqRcR5aYX6KYKMds=\n  dependencies:\n    readable-stream \"~1.1.9\"\n\nee-first@1.0.5:\n  version \"1.0.5\"\n  resolved \"https://registry.npmjs.org/ee-first/-/ee-first-1.0.5.tgz\"\n  integrity sha1-jJshKJjYzZ8alDZlDOe+ICyen/A=\n\nee-first@1.1.1:\n  version \"1.1.1\"\n  resolved \"https://registry.npmjs.org/ee-first/-/ee-first-1.1.1.tgz\"\n  integrity sha1-WQxhFWsK4vTwJVcyoViyZrxWsh0=\n\nelegant-spinner@^1.0.1:\n  version \"1.0.1\"\n  resolved \"https://registry.npmjs.org/elegant-spinner/-/elegant-spinner-1.0.1.tgz\"\n  integrity sha1-2wQ1IcldfjA/2PNFvtwzSc+wcp4=\n\nencodeurl@~1.0.1:\n  version \"1.0.1\"\n  resolved \"https://registry.npmjs.org/encodeurl/-/encodeurl-1.0.1.tgz\"\n  integrity sha1-eePVhlU0aQn+bw9Fpd5oEDspTSA=\n\nend-of-stream@~0.1.5:\n  version \"0.1.5\"\n  resolved \"https://registry.npmjs.org/end-of-stream/-/end-of-stream-0.1.5.tgz\"\n  integrity sha1-jhdyBsPICDfYVjLouTWd/osvbq8=\n  dependencies:\n    once \"~1.3.0\"\n\nerror-ex@^1.2.0:\n  version \"1.3.1\"\n  resolved \"https://registry.npmjs.org/error-ex/-/error-ex-1.3.1.tgz\"\n  integrity sha1-+FWobOYa3E6GIcPNoh56dhLDqNw=\n  dependencies:\n    is-arrayish \"^0.2.1\"\n\nes5-ext@^0.10.14, es5-ext@^0.10.9, es5-ext@~0.10.14:\n  version \"0.10.30\"\n  resolved \"https://registry.npmjs.org/es5-ext/-/es5-ext-0.10.30.tgz\"\n  integrity sha1-cUGhaDZpfbq/qq7uQUlc4p9SyTk=\n  dependencies:\n    es6-iterator \"2\"\n    es6-symbol \"~3.1\"\n\nes6-iterator@^2.0.1, es6-iterator@~2.0.1, es6-iterator@2:\n  version \"2.0.1\"\n  resolved \"https://registry.npmjs.org/es6-iterator/-/es6-iterator-2.0.1.tgz\"\n  integrity sha1-jjGcnwRTv1ddN0lAplWSDlnKVRI=\n  dependencies:\n    d \"1\"\n    es5-ext \"^0.10.14\"\n    es6-symbol \"^3.1\"\n\nes6-map@^0.1.3:\n  version \"0.1.5\"\n  resolved \"https://registry.npmjs.org/es6-map/-/es6-map-0.1.5.tgz\"\n  integrity sha1-kTbgUD3MBqMBaQ8LsU/042TpSfA=\n  dependencies:\n    d \"1\"\n    es5-ext \"~0.10.14\"\n    es6-iterator \"~2.0.1\"\n    es6-set \"~0.1.5\"\n    es6-symbol \"~3.1.1\"\n    event-emitter \"~0.3.5\"\n\nes6-set@~0.1.5:\n  version \"0.1.5\"\n  resolved \"https://registry.npmjs.org/es6-set/-/es6-set-0.1.5.tgz\"\n  integrity sha1-0rPsXU2ADO2BjbU40ol02wpzzLE=\n  dependencies:\n    d \"1\"\n    es5-ext \"~0.10.14\"\n    es6-iterator \"~2.0.1\"\n    es6-symbol \"3.1.1\"\n    event-emitter \"~0.3.5\"\n\nes6-symbol@^3.1, es6-symbol@^3.1.1, es6-symbol@~3.1, es6-symbol@~3.1.1, es6-symbol@3.1.1:\n  version \"3.1.1\"\n  resolved \"https://registry.npmjs.org/es6-symbol/-/es6-symbol-3.1.1.tgz\"\n  integrity sha1-vwDvT9q2uhtG7Le2KbTH7VcVzHc=\n  dependencies:\n    d \"1\"\n    es5-ext \"~0.10.14\"\n\nes6-weak-map@^2.0.1:\n  version \"2.0.2\"\n  resolved \"https://registry.npmjs.org/es6-weak-map/-/es6-weak-map-2.0.2.tgz\"\n  integrity sha1-XjqzIlH/0VOKH45f+hNXdy+S2W8=\n  dependencies:\n    d \"1\"\n    es5-ext \"^0.10.14\"\n    es6-iterator \"^2.0.1\"\n    es6-symbol \"^3.1.1\"\n\nescape-html@~1.0.3:\n  version \"1.0.3\"\n  resolved \"https://registry.npmjs.org/escape-html/-/escape-html-1.0.3.tgz\"\n  integrity sha1-Aljq5NPQwJdN4cFpGI7wBR0dGYg=\n\nescape-string-regexp@^1.0.0, escape-string-regexp@^1.0.2, escape-string-regexp@^1.0.5:\n  version \"1.0.5\"\n  resolved \"https://registry.npmjs.org/escape-string-regexp/-/escape-string-regexp-1.0.5.tgz\"\n  integrity sha1-G2HAViGQqN/2rjuyzwIAyhMLhtQ=\n\nescope@^3.6.0:\n  version \"3.6.0\"\n  resolved \"https://registry.npmjs.org/escope/-/escope-3.6.0.tgz\"\n  integrity sha1-4Bl16BJ4GhY6ba392AOY3GTIicM=\n  dependencies:\n    es6-map \"^0.1.3\"\n    es6-weak-map \"^2.0.1\"\n    esrecurse \"^4.1.0\"\n    estraverse \"^4.1.1\"\n\neslint@^3.15.0:\n  version \"3.19.0\"\n  resolved \"https://registry.npmjs.org/eslint/-/eslint-3.19.0.tgz\"\n  integrity sha1-yPxiAcf0DdCJQbh8CFdnOGpnmsw=\n  dependencies:\n    babel-code-frame \"^6.16.0\"\n    chalk \"^1.1.3\"\n    concat-stream \"^1.5.2\"\n    debug \"^2.1.1\"\n    doctrine \"^2.0.0\"\n    escope \"^3.6.0\"\n    espree \"^3.4.0\"\n    esquery \"^1.0.0\"\n    estraverse \"^4.2.0\"\n    esutils \"^2.0.2\"\n    file-entry-cache \"^2.0.0\"\n    glob \"^7.0.3\"\n    globals \"^9.14.0\"\n    ignore \"^3.2.0\"\n    imurmurhash \"^0.1.4\"\n    inquirer \"^0.12.0\"\n    is-my-json-valid \"^2.10.0\"\n    is-resolvable \"^1.0.0\"\n    js-yaml \"^3.5.1\"\n    json-stable-stringify \"^1.0.0\"\n    levn \"^0.3.0\"\n    lodash \"^4.0.0\"\n    mkdirp \"^0.5.0\"\n    natural-compare \"^1.4.0\"\n    optionator \"^0.8.2\"\n    path-is-inside \"^1.0.1\"\n    pluralize \"^1.2.1\"\n    progress \"^1.1.8\"\n    require-uncached \"^1.0.2\"\n    shelljs \"^0.7.5\"\n    strip-bom \"^3.0.0\"\n    strip-json-comments \"~2.0.1\"\n    table \"^3.7.8\"\n    text-table \"~0.2.0\"\n    user-home \"^2.0.0\"\n\nespree@^3.4.0:\n  version \"3.5.0\"\n  resolved \"https://registry.npmjs.org/espree/-/espree-3.5.0.tgz\"\n  integrity sha1-mDWGJb3QVYYeon4oZ+pyn69GPY0=\n  dependencies:\n    acorn \"^5.1.1\"\n    acorn-jsx \"^3.0.0\"\n\nesprima@^4.0.0:\n  version \"4.0.0\"\n  resolved \"https://registry.npmjs.org/esprima/-/esprima-4.0.0.tgz\"\n  integrity sha512-oftTcaMu/EGrEIu904mWteKIv8vMuOgGYo7EhVJJN00R/EED9DCua/xxHRdYnKtcECzVg7xOWhflvJMnqcFZjw==\n\nesquery@^1.0.0:\n  version \"1.0.0\"\n  resolved \"https://registry.npmjs.org/esquery/-/esquery-1.0.0.tgz\"\n  integrity sha1-z7qLV9f7qT8XKYqKAGoEzaE9gPo=\n  dependencies:\n    estraverse \"^4.0.0\"\n\nesrecurse@^4.1.0:\n  version \"4.2.0\"\n  resolved \"https://registry.npmjs.org/esrecurse/-/esrecurse-4.2.0.tgz\"\n  integrity sha1-+pVo2Y04I/mkHZHpAtyrnqblsWM=\n  dependencies:\n    estraverse \"^4.1.0\"\n    object-assign \"^4.0.1\"\n\nestraverse@^4.0.0, estraverse@^4.1.0, estraverse@^4.1.1, estraverse@^4.2.0:\n  version \"4.2.0\"\n  resolved \"https://registry.npmjs.org/estraverse/-/estraverse-4.2.0.tgz\"\n  integrity sha1-De4/7TH81GlhjOc0IJn8GvoL2xM=\n\nestree-walker@^0.2.1:\n  version \"0.2.1\"\n  resolved \"https://registry.npmjs.org/estree-walker/-/estree-walker-0.2.1.tgz\"\n  integrity sha1-va/oCVOD2EFNXcLs9MkXO225QS4=\n\nesutils@^2.0.2:\n  version \"2.0.2\"\n  resolved \"https://registry.npmjs.org/esutils/-/esutils-2.0.2.tgz\"\n  integrity sha1-Cr9PHKpbyx96nYrMbepPqqBLrJs=\n\netag@~1.8.0:\n  version \"1.8.0\"\n  resolved \"https://registry.npmjs.org/etag/-/etag-1.8.0.tgz\"\n  integrity sha1-b2Ma7zNtbEY2K1F2QETOIWvjwFE=\n\nevent-emitter@~0.3.5:\n  version \"0.3.5\"\n  resolved \"https://registry.npmjs.org/event-emitter/-/event-emitter-0.3.5.tgz\"\n  integrity sha1-34xp7vFkeSPHFXuc6DhAYQsCzDk=\n  dependencies:\n    d \"1\"\n    es5-ext \"~0.10.14\"\n\nexeca@^0.8.0:\n  version \"0.8.0\"\n  resolved \"https://registry.npmjs.org/execa/-/execa-0.8.0.tgz\"\n  integrity sha1-2NdrvBtVIX7RkP1t1J08d07PyNo=\n  dependencies:\n    cross-spawn \"^5.0.1\"\n    get-stream \"^3.0.0\"\n    is-stream \"^1.1.0\"\n    npm-run-path \"^2.0.0\"\n    p-finally \"^1.0.0\"\n    signal-exit \"^3.0.0\"\n    strip-eof \"^1.0.0\"\n\nexit-hook@^1.0.0:\n  version \"1.1.1\"\n  resolved \"https://registry.npmjs.org/exit-hook/-/exit-hook-1.1.1.tgz\"\n  integrity sha1-8FyiM7SMBdVP/wd2XfhQfpXAL/g=\n\nexpand-brackets@^0.1.4:\n  version \"0.1.5\"\n  resolved \"https://registry.npmjs.org/expand-brackets/-/expand-brackets-0.1.5.tgz\"\n  integrity sha1-3wcoTjQqgHzXM6xa9yQR5YHRF3s=\n  dependencies:\n    is-posix-bracket \"^0.1.0\"\n\nexpand-range@^1.8.1:\n  version \"1.8.2\"\n  resolved \"https://registry.npmjs.org/expand-range/-/expand-range-1.8.2.tgz\"\n  integrity sha1-opnv/TNf4nIeuujiV+x5ZE/IUzc=\n  dependencies:\n    fill-range \"^2.1.0\"\n\nexpand-tilde@^1.2.2:\n  version \"1.2.2\"\n  resolved \"https://registry.npmjs.org/expand-tilde/-/expand-tilde-1.2.2.tgz\"\n  integrity sha1-C4HrqJflo9MdHD0QL48BRB5VlEk=\n  dependencies:\n    os-homedir \"^1.0.1\"\n\nexpand-tilde@^2.0.2:\n  version \"2.0.2\"\n  resolved \"https://registry.npmjs.org/expand-tilde/-/expand-tilde-2.0.2.tgz\"\n  integrity sha1-l+gBqgUt8CRU3kawK/YhZCzchQI=\n  dependencies:\n    homedir-polyfill \"^1.0.1\"\n\nextend@^3.0.0:\n  version \"3.0.1\"\n  resolved \"https://registry.npmjs.org/extend/-/extend-3.0.1.tgz\"\n  integrity sha1-p1Xqe8Gt/MWjHOfnYtuq3F5jZEQ=\n\nextglob@^0.3.1:\n  version \"0.3.2\"\n  resolved \"https://registry.npmjs.org/extglob/-/extglob-0.3.2.tgz\"\n  integrity sha1-Lhj/PS9JqydlzskCPwEdqo2DSaE=\n  dependencies:\n    is-extglob \"^1.0.0\"\n\nfancy-log@^1.1.0:\n  version \"1.3.0\"\n  resolved \"https://registry.npmjs.org/fancy-log/-/fancy-log-1.3.0.tgz\"\n  integrity sha1-Rb4X0Cu5kX1gzP/UmVyZnmyMmUg=\n  dependencies:\n    chalk \"^1.1.1\"\n    time-stamp \"^1.0.0\"\n\nfast-levenshtein@~2.0.4:\n  version \"2.0.6\"\n  resolved \"https://registry.npmjs.org/fast-levenshtein/-/fast-levenshtein-2.0.6.tgz\"\n  integrity sha1-PYpcZog6FqMMqGQ+hR8Zuqd5eRc=\n\nfaye-websocket@~0.7.2:\n  version \"0.7.3\"\n  resolved \"https://registry.npmjs.org/faye-websocket/-/faye-websocket-0.7.3.tgz\"\n  integrity sha1-zEB0x/Sk39A69U3WXDVLE1EyzhE=\n  dependencies:\n    websocket-driver \">=0.3.6\"\n\nfigures@^1.3.5, figures@^1.7.0:\n  version \"1.7.0\"\n  resolved \"https://registry.npmjs.org/figures/-/figures-1.7.0.tgz\"\n  integrity sha1-y+Hjr/zxzUS4DK3+0o3Hk6lwHS4=\n  dependencies:\n    escape-string-regexp \"^1.0.5\"\n    object-assign \"^4.1.0\"\n\nfile-entry-cache@^2.0.0:\n  version \"2.0.0\"\n  resolved \"https://registry.npmjs.org/file-entry-cache/-/file-entry-cache-2.0.0.tgz\"\n  integrity sha1-w5KZDD5oR4PYOLjISkXYoEhFg2E=\n  dependencies:\n    flat-cache \"^1.2.1\"\n    object-assign \"^4.0.1\"\n\nfilename-regex@^2.0.0:\n  version \"2.0.1\"\n  resolved \"https://registry.npmjs.org/filename-regex/-/filename-regex-2.0.1.tgz\"\n  integrity sha1-wcS5vuPglyXdsQa3XB4wH+LxiyY=\n\nfill-range@^2.1.0:\n  version \"2.2.3\"\n  resolved \"https://registry.npmjs.org/fill-range/-/fill-range-2.2.3.tgz\"\n  integrity sha1-ULd9/X5Gm8dJJHCWNpn+eoSFpyM=\n  dependencies:\n    is-number \"^2.1.0\"\n    isobject \"^2.0.0\"\n    randomatic \"^1.1.3\"\n    repeat-element \"^1.1.2\"\n    repeat-string \"^1.5.2\"\n\nfinalhandler@1.0.4:\n  version \"1.0.4\"\n  resolved \"https://registry.npmjs.org/finalhandler/-/finalhandler-1.0.4.tgz\"\n  integrity sha512-16l/r8RgzlXKmFOhZpHBztvye+lAhC5SU7hXavnerC9UfZqZxxXl3BzL8MhffPT3kF61lj9Oav2LKEzh0ei7tg==\n  dependencies:\n    debug \"2.6.8\"\n    encodeurl \"~1.0.1\"\n    escape-html \"~1.0.3\"\n    on-finished \"~2.3.0\"\n    parseurl \"~1.3.1\"\n    statuses \"~1.3.1\"\n    unpipe \"~1.0.0\"\n\nfind-index@^0.1.1:\n  version \"0.1.1\"\n  resolved \"https://registry.npmjs.org/find-index/-/find-index-0.1.1.tgz\"\n  integrity sha1-Z101iyyjiS15Whq0cjL4tuLg3eQ=\n\nfind-replace@^1.0.3:\n  version \"1.0.3\"\n  resolved \"https://registry.npmjs.org/find-replace/-/find-replace-1.0.3.tgz\"\n  integrity sha1-uI5zZNLZyVlVnziMZmcNYTBEH6A=\n  dependencies:\n    array-back \"^1.0.4\"\n    test-value \"^2.1.0\"\n\nfind-up@^1.0.0:\n  version \"1.1.2\"\n  resolved \"https://registry.npmjs.org/find-up/-/find-up-1.1.2.tgz\"\n  integrity sha1-ay6YIrGizgpgq2TWEOzK1TyyTQ8=\n  dependencies:\n    path-exists \"^2.0.0\"\n    pinkie-promise \"^2.0.0\"\n\nfindup-sync@^0.4.2:\n  version \"0.4.3\"\n  resolved \"https://registry.npmjs.org/findup-sync/-/findup-sync-0.4.3.tgz\"\n  integrity sha1-QAQ5Kee8YK3wt/SCfExudaDeyhI=\n  dependencies:\n    detect-file \"^0.1.0\"\n    is-glob \"^2.0.1\"\n    micromatch \"^2.3.7\"\n    resolve-dir \"^0.1.0\"\n\nfined@^1.0.1:\n  version \"1.1.0\"\n  resolved \"https://registry.npmjs.org/fined/-/fined-1.1.0.tgz\"\n  integrity sha1-s33IRLdqL15wgeiE98CuNE8VNHY=\n  dependencies:\n    expand-tilde \"^2.0.2\"\n    is-plain-object \"^2.0.3\"\n    object.defaults \"^1.1.0\"\n    object.pick \"^1.2.0\"\n    parse-filepath \"^1.0.1\"\n\nfirst-chunk-stream@^1.0.0:\n  version \"1.0.0\"\n  resolved \"https://registry.npmjs.org/first-chunk-stream/-/first-chunk-stream-1.0.0.tgz\"\n  integrity sha1-Wb+1DNkF9g18OUzT2ayqtOatk04=\n\nflagged-respawn@^0.3.2:\n  version \"0.3.2\"\n  resolved \"https://registry.npmjs.org/flagged-respawn/-/flagged-respawn-0.3.2.tgz\"\n  integrity sha1-/xke3c1wiKZ1smEP/8l2vpuAdLU=\n\nflat-cache@^1.2.1:\n  version \"1.2.2\"\n  resolved \"https://registry.npmjs.org/flat-cache/-/flat-cache-1.2.2.tgz\"\n  integrity sha1-+oZxTnLCHbiGAXYezy9VXRq8a5Y=\n  dependencies:\n    circular-json \"^0.3.1\"\n    del \"^2.0.2\"\n    graceful-fs \"^4.1.2\"\n    write \"^0.2.1\"\n\nfor-in@^1.0.1:\n  version \"1.0.2\"\n  resolved \"https://registry.npmjs.org/for-in/-/for-in-1.0.2.tgz\"\n  integrity sha1-gQaNKVqBQuwKxybG4iAMMPttXoA=\n\nfor-own@^0.1.4:\n  version \"0.1.5\"\n  resolved \"https://registry.npmjs.org/for-own/-/for-own-0.1.5.tgz\"\n  integrity sha1-UmXGgaTylNq78XyVCbZ2OqhFEM4=\n  dependencies:\n    for-in \"^1.0.1\"\n\nfor-own@^1.0.0:\n  version \"1.0.0\"\n  resolved \"https://registry.npmjs.org/for-own/-/for-own-1.0.0.tgz\"\n  integrity sha1-xjMy9BXO3EsE2/5wz4NklMU8tEs=\n  dependencies:\n    for-in \"^1.0.1\"\n\nfresh@0.5.0:\n  version \"0.5.0\"\n  resolved \"https://registry.npmjs.org/fresh/-/fresh-0.5.0.tgz\"\n  integrity sha1-9HTKXmqSRtb9jglTz6m5yAWvp44=\n\nfs-exists-sync@^0.1.0:\n  version \"0.1.0\"\n  resolved \"https://registry.npmjs.org/fs-exists-sync/-/fs-exists-sync-0.1.0.tgz\"\n  integrity sha1-mC1ok6+RjnLQjeyehnP/K1qNat0=\n\nfs.realpath@^1.0.0:\n  version \"1.0.0\"\n  resolved \"https://registry.npmjs.org/fs.realpath/-/fs.realpath-1.0.0.tgz\"\n  integrity sha1-FQStJSMVjKpA20onh8sBQRmU6k8=\n\ngaze@^0.5.1:\n  version \"0.5.2\"\n  resolved \"https://registry.npmjs.org/gaze/-/gaze-0.5.2.tgz\"\n  integrity sha1-QLcJU30k0dRXZ9takIaJ3+aaxE8=\n  dependencies:\n    globule \"~0.1.0\"\n\ngenerate-function@^2.0.0:\n  version \"2.0.0\"\n  resolved \"https://registry.npmjs.org/generate-function/-/generate-function-2.0.0.tgz\"\n  integrity sha1-aFj+fAlpt9TpCTM3ZHrHn2DfvnQ=\n\ngenerate-object-property@^1.1.0:\n  version \"1.2.0\"\n  resolved \"https://registry.npmjs.org/generate-object-property/-/generate-object-property-1.2.0.tgz\"\n  integrity sha1-nA4cQDCM6AT0eDYYuTf6iPmdUNA=\n  dependencies:\n    is-property \"^1.0.0\"\n\nget-own-enumerable-property-symbols@^2.0.1:\n  version \"2.0.1\"\n  resolved \"https://registry.npmjs.org/get-own-enumerable-property-symbols/-/get-own-enumerable-property-symbols-2.0.1.tgz\"\n  integrity sha512-TtY/sbOemiMKPRUDDanGCSgBYe7Mf0vbRsWnBZ+9yghpZ1MvcpSpuZFjHdEeY/LZjZy0vdLjS77L6HosisFiug==\n\nget-stdin@^4.0.1:\n  version \"4.0.1\"\n  resolved \"https://registry.npmjs.org/get-stdin/-/get-stdin-4.0.1.tgz\"\n  integrity sha1-uWjGsKBDhDJJAui/Gl3zJXmkUP4=\n\nget-stream@^3.0.0:\n  version \"3.0.0\"\n  resolved \"https://registry.npmjs.org/get-stream/-/get-stream-3.0.0.tgz\"\n  integrity sha1-jpQ9E1jcN1VQVOy+LtsFqhdO3hQ=\n\nglob-base@^0.3.0:\n  version \"0.3.0\"\n  resolved \"https://registry.npmjs.org/glob-base/-/glob-base-0.3.0.tgz\"\n  integrity sha1-27Fk9iIbHAscz4Kuoyi0l98Oo8Q=\n  dependencies:\n    glob-parent \"^2.0.0\"\n    is-glob \"^2.0.0\"\n\nglob-parent@^2.0.0:\n  version \"2.0.0\"\n  resolved \"https://registry.npmjs.org/glob-parent/-/glob-parent-2.0.0.tgz\"\n  integrity sha1-gTg9ctsFT8zPUzbaqQLxgvbtuyg=\n  dependencies:\n    is-glob \"^2.0.0\"\n\nglob-stream@^3.1.5:\n  version \"3.1.18\"\n  resolved \"https://registry.npmjs.org/glob-stream/-/glob-stream-3.1.18.tgz\"\n  integrity sha1-kXCl8St5Awb9/lmPMT+PeVT9FDs=\n  dependencies:\n    glob \"^4.3.1\"\n    glob2base \"^0.0.12\"\n    minimatch \"^2.0.1\"\n    ordered-read-streams \"^0.1.0\"\n    through2 \"^0.6.1\"\n    unique-stream \"^1.0.0\"\n\nglob-watcher@^0.0.6:\n  version \"0.0.6\"\n  resolved \"https://registry.npmjs.org/glob-watcher/-/glob-watcher-0.0.6.tgz\"\n  integrity sha1-uVtKjfdLOcgymLDAXJeLTZo7cQs=\n  dependencies:\n    gaze \"^0.5.1\"\n\nglob@^4.3.1:\n  version \"4.5.3\"\n  resolved \"https://registry.npmjs.org/glob/-/glob-4.5.3.tgz\"\n  integrity sha1-xstz0yJsHv7wTePFbQEvAzd+4V8=\n  dependencies:\n    inflight \"^1.0.4\"\n    inherits \"2\"\n    minimatch \"^2.0.1\"\n    once \"^1.3.0\"\n\nglob@^7.0.0, glob@^7.0.3, glob@^7.0.5:\n  version \"7.1.2\"\n  resolved \"https://registry.npmjs.org/glob/-/glob-7.1.2.tgz\"\n  integrity sha512-MJTUg1kjuLeQCJ+ccE4Vpa6kKVXkPYJ2mOCQyUuKLcLQsdrMCpBPUi8qVE6+YuaJkozeA9NusTAw3hLr8Xe5EQ==\n  dependencies:\n    fs.realpath \"^1.0.0\"\n    inflight \"^1.0.4\"\n    inherits \"2\"\n    minimatch \"^3.0.4\"\n    once \"^1.3.0\"\n    path-is-absolute \"^1.0.0\"\n\nglob@~3.1.21:\n  version \"3.1.21\"\n  resolved \"https://registry.npmjs.org/glob/-/glob-3.1.21.tgz\"\n  integrity sha1-0p4KBV3qUTj00H7UDomC6DwgZs0=\n  dependencies:\n    graceful-fs \"~1.2.0\"\n    inherits \"1\"\n    minimatch \"~0.2.11\"\n\nglob2base@^0.0.12:\n  version \"0.0.12\"\n  resolved \"https://registry.npmjs.org/glob2base/-/glob2base-0.0.12.tgz\"\n  integrity sha1-nUGbPijxLoOjYhZKJ3BVkiycDVY=\n  dependencies:\n    find-index \"^0.1.1\"\n\nglobal-modules@^0.2.3:\n  version \"0.2.3\"\n  resolved \"https://registry.npmjs.org/global-modules/-/global-modules-0.2.3.tgz\"\n  integrity sha1-6lo77ULG1s6ZWk+KEmm12uIjgo0=\n  dependencies:\n    global-prefix \"^0.1.4\"\n    is-windows \"^0.2.0\"\n\nglobal-prefix@^0.1.4:\n  version \"0.1.5\"\n  resolved \"https://registry.npmjs.org/global-prefix/-/global-prefix-0.1.5.tgz\"\n  integrity sha1-jTvGuNo8qBEqFg2NSW/wRiv+948=\n  dependencies:\n    homedir-polyfill \"^1.0.0\"\n    ini \"^1.3.4\"\n    is-windows \"^0.2.0\"\n    which \"^1.2.12\"\n\nglobals@^9.14.0, globals@^9.18.0:\n  version \"9.18.0\"\n  resolved \"https://registry.npmjs.org/globals/-/globals-9.18.0.tgz\"\n  integrity sha512-S0nG3CLEQiY/ILxqtztTWH/3iRRdyBLw6KMDxnKMchrtbj2OFmehVh0WUCfW3DUrIgx/qFrJPICrq4Z4sTR9UQ==\n\nglobby@^5.0.0:\n  version \"5.0.0\"\n  resolved \"https://registry.npmjs.org/globby/-/globby-5.0.0.tgz\"\n  integrity sha1-69hGZ8oNuzMLmbz8aOrCvFQ3Dg0=\n  dependencies:\n    array-union \"^1.0.1\"\n    arrify \"^1.0.0\"\n    glob \"^7.0.3\"\n    object-assign \"^4.0.1\"\n    pify \"^2.0.0\"\n    pinkie-promise \"^2.0.0\"\n\nglobule@~0.1.0:\n  version \"0.1.0\"\n  resolved \"https://registry.npmjs.org/globule/-/globule-0.1.0.tgz\"\n  integrity sha1-2cjt3h2nnRJaFRt5UzuXhnY0auU=\n  dependencies:\n    glob \"~3.1.21\"\n    lodash \"~1.0.1\"\n    minimatch \"~0.2.11\"\n\nglogg@^1.0.0:\n  version \"1.0.0\"\n  resolved \"https://registry.npmjs.org/glogg/-/glogg-1.0.0.tgz\"\n  integrity sha1-f+DxmfV6yQbPUS/urY+Q7kooT8U=\n  dependencies:\n    sparkles \"^1.0.0\"\n\ngraceful-fs@^3.0.0:\n  version \"3.0.11\"\n  resolved \"https://registry.npmjs.org/graceful-fs/-/graceful-fs-3.0.11.tgz\"\n  integrity sha1-dhPHeKGv6mLyXGMKCG1/Osu92Bg=\n  dependencies:\n    natives \"^1.1.0\"\n\ngraceful-fs@^4.1.2:\n  version \"4.1.11\"\n  resolved \"https://registry.npmjs.org/graceful-fs/-/graceful-fs-4.1.11.tgz\"\n  integrity sha1-Dovf5NHduIVNZOBOp8AOKgJuVlg=\n\ngraceful-fs@~1.2.0:\n  version \"1.2.3\"\n  resolved \"https://registry.npmjs.org/graceful-fs/-/graceful-fs-1.2.3.tgz\"\n  integrity sha1-FaSAaldUfLLS2/J/QuiajDRRs2Q=\n\ngraceful-fs@~2.0.0:\n  version \"2.0.3\"\n  resolved \"https://registry.npmjs.org/graceful-fs/-/graceful-fs-2.0.3.tgz\"\n  integrity sha512-hcj/NTUWv+C3MbqrVb9F+aH6lvTwEHJdx2foBxlrVq5h6zE8Bfu4pv4CAAqbDcZrw/9Ak5lsRXlY9Ao8/F0Tuw==\n\ngulp-util@^2.2.19:\n  version \"2.2.20\"\n  resolved \"https://registry.npmjs.org/gulp-util/-/gulp-util-2.2.20.tgz\"\n  integrity sha1-1xRuVyiRC9jwR6awseVJvCLb1kw=\n  dependencies:\n    chalk \"^0.5.0\"\n    dateformat \"^1.0.7-1.2.3\"\n    lodash._reinterpolate \"^2.4.1\"\n    lodash.template \"^2.4.1\"\n    minimist \"^0.2.0\"\n    multipipe \"^0.1.0\"\n    through2 \"^0.5.0\"\n    vinyl \"^0.2.1\"\n\ngulp-util@^3.0.0:\n  version \"3.0.8\"\n  resolved \"https://registry.npmjs.org/gulp-util/-/gulp-util-3.0.8.tgz\"\n  integrity sha1-AFTh50RQLifATBh8PsxQXdVLu08=\n  dependencies:\n    array-differ \"^1.0.0\"\n    array-uniq \"^1.0.2\"\n    beeper \"^1.0.0\"\n    chalk \"^1.0.0\"\n    dateformat \"^2.0.0\"\n    fancy-log \"^1.1.0\"\n    gulplog \"^1.0.0\"\n    has-gulplog \"^0.1.0\"\n    lodash._reescape \"^3.0.0\"\n    lodash._reevaluate \"^3.0.0\"\n    lodash._reinterpolate \"^3.0.0\"\n    lodash.template \"^3.0.0\"\n    minimist \"^1.1.0\"\n    multipipe \"^0.1.2\"\n    object-assign \"^3.0.0\"\n    replace-ext \"0.0.1\"\n    through2 \"^2.0.0\"\n    vinyl \"^0.5.0\"\n\ngulp-webserver@^0.9.1:\n  version \"0.9.1\"\n  resolved \"https://registry.npmjs.org/gulp-webserver/-/gulp-webserver-0.9.1.tgz\"\n  integrity sha1-4JmSFl2XxYZWFtZCoWAVKbA2cGQ=\n  dependencies:\n    connect \"^3.0.1\"\n    connect-livereload \"^0.4.0\"\n    gulp-util \"^2.2.19\"\n    isarray \"0.0.1\"\n    node.extend \"^1.0.10\"\n    open \"^0.0.5\"\n    proxy-middleware \"^0.5.0\"\n    serve-index \"^1.1.4\"\n    serve-static \"^1.3.0\"\n    through2 \"^0.5.1\"\n    tiny-lr \"0.1.4\"\n    watch \"^0.11.0\"\n\ngulp@^3.9.1:\n  version \"3.9.1\"\n  resolved \"https://registry.npmjs.org/gulp/-/gulp-3.9.1.tgz\"\n  integrity sha1-VxzkWSjdQK9lFPxAEYZgFsE4RbQ=\n  dependencies:\n    archy \"^1.0.0\"\n    chalk \"^1.0.0\"\n    deprecated \"^0.0.1\"\n    gulp-util \"^3.0.0\"\n    interpret \"^1.0.0\"\n    liftoff \"^2.1.0\"\n    minimist \"^1.1.0\"\n    orchestrator \"^0.3.0\"\n    pretty-hrtime \"^1.0.0\"\n    semver \"^4.1.0\"\n    tildify \"^1.0.0\"\n    v8flags \"^2.0.2\"\n    vinyl-fs \"^0.3.0\"\n\ngulplog@^1.0.0:\n  version \"1.0.0\"\n  resolved \"https://registry.npmjs.org/gulplog/-/gulplog-1.0.0.tgz\"\n  integrity sha1-4oxNRdBey77YGDY86PnFkmIp/+U=\n  dependencies:\n    glogg \"^1.0.0\"\n\nhas-ansi@^0.1.0:\n  version \"0.1.0\"\n  resolved \"https://registry.npmjs.org/has-ansi/-/has-ansi-0.1.0.tgz\"\n  integrity sha1-hPJlqujA5qiKEtcCKJS3VoiUxi4=\n  dependencies:\n    ansi-regex \"^0.2.0\"\n\nhas-ansi@^2.0.0:\n  version \"2.0.0\"\n  resolved \"https://registry.npmjs.org/has-ansi/-/has-ansi-2.0.0.tgz\"\n  integrity sha1-NPUEnOHs3ysGSa8+8k5F7TVBbZE=\n  dependencies:\n    ansi-regex \"^2.0.0\"\n\nhas-flag@^1.0.0:\n  version \"1.0.0\"\n  resolved \"https://registry.npmjs.org/has-flag/-/has-flag-1.0.0.tgz\"\n  integrity sha1-nZ55MWXOAXoA8AQYxD+UKnsdEfo=\n\nhas-flag@^2.0.0:\n  version \"2.0.0\"\n  resolved \"https://registry.npmjs.org/has-flag/-/has-flag-2.0.0.tgz\"\n  integrity sha1-6CB68cx7MNRGzHC3NLXovhj4jVE=\n\nhas-gulplog@^0.1.0:\n  version \"0.1.0\"\n  resolved \"https://registry.npmjs.org/has-gulplog/-/has-gulplog-0.1.0.tgz\"\n  integrity sha1-ZBTIKRNpfaUVkDl9r7EvIpZ4Ec4=\n  dependencies:\n    sparkles \"^1.0.0\"\n\nhe@~0.4.1:\n  version \"0.4.1\"\n  resolved \"https://registry.npmjs.org/he/-/he-0.4.1.tgz\"\n  integrity sha512-wFn1JlcsgbcWEawQ6A1GztgNRRl6UyEtaARIDpAeH3c35T/9id/QQKvap1NAz6Yk2oKrKwXQZZFERS0tl9E0Jg==\n\nhome-or-tmp@^2.0.0:\n  version \"2.0.0\"\n  resolved \"https://registry.npmjs.org/home-or-tmp/-/home-or-tmp-2.0.0.tgz\"\n  integrity sha1-42w/LSyufXRqhX440Y1fMqeILbg=\n  dependencies:\n    os-homedir \"^1.0.0\"\n    os-tmpdir \"^1.0.1\"\n\nhomedir-polyfill@^1.0.0, homedir-polyfill@^1.0.1:\n  version \"1.0.1\"\n  resolved \"https://registry.npmjs.org/homedir-polyfill/-/homedir-polyfill-1.0.1.tgz\"\n  integrity sha1-TCu8inWJmP7r9e1oWA921GdotLw=\n  dependencies:\n    parse-passwd \"^1.0.0\"\n\nhosted-git-info@^2.1.4:\n  version \"2.5.0\"\n  resolved \"https://registry.npmjs.org/hosted-git-info/-/hosted-git-info-2.5.0.tgz\"\n  integrity sha512-pNgbURSuab90KbTqvRPsseaTxOJCZBD0a7t+haSN33piP9cCM4l0CqdzAif2hUqm716UovKB2ROmiabGAKVXyg==\n\nhttp-errors@~1.6.1, http-errors@~1.6.2:\n  version \"1.6.2\"\n  resolved \"https://registry.npmjs.org/http-errors/-/http-errors-1.6.2.tgz\"\n  integrity sha1-CgAsyFcHGSp+eUbO7cERVfYOxzY=\n  dependencies:\n    depd \"1.1.1\"\n    inherits \"2.0.3\"\n    setprototypeof \"1.0.3\"\n    statuses \">= 1.3.1 < 2\"\n\nhusky@^0.14.3:\n  version \"0.14.3\"\n  resolved \"https://registry.npmjs.org/husky/-/husky-0.14.3.tgz\"\n  integrity sha512-e21wivqHpstpoiWA/Yi8eFti8E+sQDSS53cpJsPptPs295QTOQR0ZwnHo2TXy1XOpZFD9rPOd3NpmqTK6uMLJA==\n  dependencies:\n    is-ci \"^1.0.10\"\n    normalize-path \"^1.0.0\"\n    strip-indent \"^2.0.0\"\n\niconv-lite@0.4.4:\n  version \"0.4.4\"\n  resolved \"https://registry.npmjs.org/iconv-lite/-/iconv-lite-0.4.4.tgz\"\n  integrity sha1-6V8uQdsHNfwhZS94J6XuMuY8g6g=\n\nignore@^3.2.0:\n  version \"3.3.5\"\n  resolved \"https://registry.npmjs.org/ignore/-/ignore-3.3.5.tgz\"\n  integrity sha512-JLH93mL8amZQhh/p6mfQgVBH3M6epNq3DfsXsTSuSrInVjwyYlFE1nv2AgfRCC8PoOhM0jwQ5v8s9LgbK7yGDw==\n\nimurmurhash@^0.1.4:\n  version \"0.1.4\"\n  resolved \"https://registry.npmjs.org/imurmurhash/-/imurmurhash-0.1.4.tgz\"\n  integrity sha1-khi5srkoojixPcT7a21XbyMUU+o=\n\nindent-string@^2.1.0:\n  version \"2.1.0\"\n  resolved \"https://registry.npmjs.org/indent-string/-/indent-string-2.1.0.tgz\"\n  integrity sha1-ji1INIdCEhtKghi3oTfppSBJ3IA=\n  dependencies:\n    repeating \"^2.0.0\"\n\nindent-string@^3.0.0:\n  version \"3.2.0\"\n  resolved \"https://registry.npmjs.org/indent-string/-/indent-string-3.2.0.tgz\"\n  integrity sha1-Sl/W0nzDMvN+VBmlBNu4NxBckok=\n\ninflight@^1.0.4:\n  version \"1.0.6\"\n  resolved \"https://registry.npmjs.org/inflight/-/inflight-1.0.6.tgz\"\n  integrity sha1-Sb1jMdfQLQwJvJEKEHW6gWW1bfk=\n  dependencies:\n    once \"^1.3.0\"\n    wrappy \"1\"\n\ninherits@^2.0.3, inherits@~2.0.1, inherits@~2.0.3, inherits@2, inherits@2.0.3:\n  version \"2.0.3\"\n  resolved \"https://registry.npmjs.org/inherits/-/inherits-2.0.3.tgz\"\n  integrity sha1-Yzwsg+PaQqUC9SRmAiSA9CCCYd4=\n\ninherits@1:\n  version \"1.0.2\"\n  resolved \"https://registry.npmjs.org/inherits/-/inherits-1.0.2.tgz\"\n  integrity sha1-ykMJ2t7mtUzAuNJH6NfHoJdb3Js=\n\nini@^1.3.4:\n  version \"1.3.4\"\n  resolved \"https://registry.npmjs.org/ini/-/ini-1.3.4.tgz\"\n  integrity sha1-BTfLedr1m1mhpRff9wbIbsA5Fi4=\n\ninquirer@^0.12.0:\n  version \"0.12.0\"\n  resolved \"https://registry.npmjs.org/inquirer/-/inquirer-0.12.0.tgz\"\n  integrity sha1-HvK/1jUE3wvHV4X/+MLEHfEvB34=\n  dependencies:\n    ansi-escapes \"^1.1.0\"\n    ansi-regex \"^2.0.0\"\n    chalk \"^1.0.0\"\n    cli-cursor \"^1.0.1\"\n    cli-width \"^2.0.0\"\n    figures \"^1.3.5\"\n    lodash \"^4.3.0\"\n    readline2 \"^1.0.1\"\n    run-async \"^0.1.0\"\n    rx-lite \"^3.1.2\"\n    string-width \"^1.0.1\"\n    strip-ansi \"^3.0.0\"\n    through \"^2.3.6\"\n\ninterpret@^1.0.0:\n  version \"1.0.3\"\n  resolved \"https://registry.npmjs.org/interpret/-/interpret-1.0.3.tgz\"\n  integrity sha1-y8NcYu7uc/Gat7EKgBURQBr8D5A=\n\ninvariant@^2.2.2:\n  version \"2.2.2\"\n  resolved \"https://registry.npmjs.org/invariant/-/invariant-2.2.2.tgz\"\n  integrity sha1-nh9WrArNtr8wMwbzOL47IErmA2A=\n  dependencies:\n    loose-envify \"^1.0.0\"\n\nis-absolute@^0.2.3:\n  version \"0.2.6\"\n  resolved \"https://registry.npmjs.org/is-absolute/-/is-absolute-0.2.6.tgz\"\n  integrity sha1-IN5p89uULvLYe5wto28XIjWxtes=\n  dependencies:\n    is-relative \"^0.2.1\"\n    is-windows \"^0.2.0\"\n\nis-arrayish@^0.2.1:\n  version \"0.2.1\"\n  resolved \"https://registry.npmjs.org/is-arrayish/-/is-arrayish-0.2.1.tgz\"\n  integrity sha1-d8mYQFJ6qOyxqLppe4BkWnqSap0=\n\nis-buffer@^1.1.5:\n  version \"1.1.5\"\n  resolved \"https://registry.npmjs.org/is-buffer/-/is-buffer-1.1.5.tgz\"\n  integrity sha1-Hzsm72E7IUuIy8ojzGwB2Hlh7sw=\n\nis-builtin-module@^1.0.0:\n  version \"1.0.0\"\n  resolved \"https://registry.npmjs.org/is-builtin-module/-/is-builtin-module-1.0.0.tgz\"\n  integrity sha1-VAVy0096wxGfj3bDDLwbHgN6/74=\n  dependencies:\n    builtin-modules \"^1.0.0\"\n\nis-ci@^1.0.10:\n  version \"1.0.10\"\n  resolved \"https://registry.npmjs.org/is-ci/-/is-ci-1.0.10.tgz\"\n  integrity sha1-9zkzayYyNlBhqdSCcM1WrjNpMY4=\n  dependencies:\n    ci-info \"^1.0.0\"\n\nis-dotfile@^1.0.0:\n  version \"1.0.3\"\n  resolved \"https://registry.npmjs.org/is-dotfile/-/is-dotfile-1.0.3.tgz\"\n  integrity sha1-pqLzL/0t+wT1yiXs0Pa4PPeYoeE=\n\nis-equal-shallow@^0.1.3:\n  version \"0.1.3\"\n  resolved \"https://registry.npmjs.org/is-equal-shallow/-/is-equal-shallow-0.1.3.tgz\"\n  integrity sha1-IjgJj8Ih3gvPpdnqxMRdY4qhxTQ=\n  dependencies:\n    is-primitive \"^2.0.0\"\n\nis-extendable@^0.1.1:\n  version \"0.1.1\"\n  resolved \"https://registry.npmjs.org/is-extendable/-/is-extendable-0.1.1.tgz\"\n  integrity sha1-YrEQ4omkcUGOPsNqYX1HLjAd/Ik=\n\nis-extglob@^1.0.0:\n  version \"1.0.0\"\n  resolved \"https://registry.npmjs.org/is-extglob/-/is-extglob-1.0.0.tgz\"\n  integrity sha1-rEaBd8SUNAWgkvyPKXYMb/xiBsA=\n\nis-extglob@^2.1.1:\n  version \"2.1.1\"\n  resolved \"https://registry.npmjs.org/is-extglob/-/is-extglob-2.1.1.tgz\"\n  integrity sha1-qIwCU1eR8C7TfHahueqXc8gz+MI=\n\nis-finite@^1.0.0:\n  version \"1.0.2\"\n  resolved \"https://registry.npmjs.org/is-finite/-/is-finite-1.0.2.tgz\"\n  integrity sha1-zGZ3aVYCvlUO8R6LSqYwU0K20Ko=\n  dependencies:\n    number-is-nan \"^1.0.0\"\n\nis-fullwidth-code-point@^1.0.0:\n  version \"1.0.0\"\n  resolved \"https://registry.npmjs.org/is-fullwidth-code-point/-/is-fullwidth-code-point-1.0.0.tgz\"\n  integrity sha1-754xOG8DGn8NZDr4L95QxFfvAMs=\n  dependencies:\n    number-is-nan \"^1.0.0\"\n\nis-fullwidth-code-point@^2.0.0:\n  version \"2.0.0\"\n  resolved \"https://registry.npmjs.org/is-fullwidth-code-point/-/is-fullwidth-code-point-2.0.0.tgz\"\n  integrity sha1-o7MKXE8ZkYMWeqq5O+764937ZU8=\n\nis-glob@^2.0.0, is-glob@^2.0.1:\n  version \"2.0.1\"\n  resolved \"https://registry.npmjs.org/is-glob/-/is-glob-2.0.1.tgz\"\n  integrity sha1-0Jb5JqPe1WAPP9/ZEZjLCIjC2GM=\n  dependencies:\n    is-extglob \"^1.0.0\"\n\nis-glob@^4.0.0:\n  version \"4.0.0\"\n  resolved \"https://registry.npmjs.org/is-glob/-/is-glob-4.0.0.tgz\"\n  integrity sha1-lSHHaEXMJhCoUgPd8ICpWML/q8A=\n  dependencies:\n    is-extglob \"^2.1.1\"\n\nis-my-json-valid@^2.10.0:\n  version \"2.16.1\"\n  resolved \"https://registry.npmjs.org/is-my-json-valid/-/is-my-json-valid-2.16.1.tgz\"\n  integrity sha512-ochPsqWS1WXj8ZnMIV0vnNXooaMhp7cyL4FMSIPKTtnV0Ha/T19G2b9kkhcNsabV9bxYkze7/aLZJb/bYuFduQ==\n  dependencies:\n    generate-function \"^2.0.0\"\n    generate-object-property \"^1.1.0\"\n    jsonpointer \"^4.0.0\"\n    xtend \"^4.0.0\"\n\nis-number@^2.1.0:\n  version \"2.1.0\"\n  resolved \"https://registry.npmjs.org/is-number/-/is-number-2.1.0.tgz\"\n  integrity sha1-Afy7s5NGOlSPL0ZszhbezknbkI8=\n  dependencies:\n    kind-of \"^3.0.2\"\n\nis-number@^3.0.0:\n  version \"3.0.0\"\n  resolved \"https://registry.npmjs.org/is-number/-/is-number-3.0.0.tgz\"\n  integrity sha1-JP1iAaR4LPUFYcgQJ2r8fRLXEZU=\n  dependencies:\n    kind-of \"^3.0.2\"\n\nis-obj@^1.0.1:\n  version \"1.0.1\"\n  resolved \"https://registry.npmjs.org/is-obj/-/is-obj-1.0.1.tgz\"\n  integrity sha1-PkcprB9f3gJc19g6iW2rn09n2w8=\n\nis-path-cwd@^1.0.0:\n  version \"1.0.0\"\n  resolved \"https://registry.npmjs.org/is-path-cwd/-/is-path-cwd-1.0.0.tgz\"\n  integrity sha1-0iXsIxMuie3Tj9p2dHLmLmXxEG0=\n\nis-path-in-cwd@^1.0.0:\n  version \"1.0.0\"\n  resolved \"https://registry.npmjs.org/is-path-in-cwd/-/is-path-in-cwd-1.0.0.tgz\"\n  integrity sha1-ZHdYK4IU1gI0YJRWcAO+ip6sBNw=\n  dependencies:\n    is-path-inside \"^1.0.0\"\n\nis-path-inside@^1.0.0:\n  version \"1.0.0\"\n  resolved \"https://registry.npmjs.org/is-path-inside/-/is-path-inside-1.0.0.tgz\"\n  integrity sha1-/AbloWg/vaE95mev9xe7wQpI838=\n  dependencies:\n    path-is-inside \"^1.0.1\"\n\nis-plain-object@^2.0.3:\n  version \"2.0.4\"\n  resolved \"https://registry.npmjs.org/is-plain-object/-/is-plain-object-2.0.4.tgz\"\n  integrity sha512-h5PpgXkWitc38BBMYawTYMWJHFZJVnBquFE57xFpjB8pJFiF6gZ+bU+WyI/yqXiFR5mdLsgYNaPe8uao6Uv9Og==\n  dependencies:\n    isobject \"^3.0.1\"\n\nis-posix-bracket@^0.1.0:\n  version \"0.1.1\"\n  resolved \"https://registry.npmjs.org/is-posix-bracket/-/is-posix-bracket-0.1.1.tgz\"\n  integrity sha1-MzTceXdDaOkvAW5vvAqI9c1ua8Q=\n\nis-primitive@^2.0.0:\n  version \"2.0.0\"\n  resolved \"https://registry.npmjs.org/is-primitive/-/is-primitive-2.0.0.tgz\"\n  integrity sha1-IHurkWOEmcB7Kt8kCkGochADRXU=\n\nis-promise@^2.1.0:\n  version \"2.1.0\"\n  resolved \"https://registry.npmjs.org/is-promise/-/is-promise-2.1.0.tgz\"\n  integrity sha1-eaKp7OfwlugPNtKy87wWwf9L8/o=\n\nis-property@^1.0.0:\n  version \"1.0.2\"\n  resolved \"https://registry.npmjs.org/is-property/-/is-property-1.0.2.tgz\"\n  integrity sha1-V/4cTkhHTt1lsJkR8msc1Ald2oQ=\n\nis-regexp@^1.0.0:\n  version \"1.0.0\"\n  resolved \"https://registry.npmjs.org/is-regexp/-/is-regexp-1.0.0.tgz\"\n  integrity sha1-/S2INUXEa6xaYz57mgnof6LLUGk=\n\nis-relative@^0.2.1:\n  version \"0.2.1\"\n  resolved \"https://registry.npmjs.org/is-relative/-/is-relative-0.2.1.tgz\"\n  integrity sha1-0n9MfVFtF1+2ENuEu+7yPDvJeqU=\n  dependencies:\n    is-unc-path \"^0.1.1\"\n\nis-resolvable@^1.0.0:\n  version \"1.0.0\"\n  resolved \"https://registry.npmjs.org/is-resolvable/-/is-resolvable-1.0.0.tgz\"\n  integrity sha1-jfV8YeouPFAUCNEA+wE8+NbgzGI=\n  dependencies:\n    tryit \"^1.0.1\"\n\nis-stream@^1.1.0:\n  version \"1.1.0\"\n  resolved \"https://registry.npmjs.org/is-stream/-/is-stream-1.1.0.tgz\"\n  integrity sha1-EtSj3U5o4Lec6428hBc66A2RykQ=\n\nis-unc-path@^0.1.1:\n  version \"0.1.2\"\n  resolved \"https://registry.npmjs.org/is-unc-path/-/is-unc-path-0.1.2.tgz\"\n  integrity sha1-arBTpyVzwQJQ/0FqOBTDUXivObk=\n  dependencies:\n    unc-path-regex \"^0.1.0\"\n\nis-utf8@^0.2.0:\n  version \"0.2.1\"\n  resolved \"https://registry.npmjs.org/is-utf8/-/is-utf8-0.2.1.tgz\"\n  integrity sha1-Sw2hRCEE0bM2NA6AeX6GXPOffXI=\n\nis-windows@^0.2.0:\n  version \"0.2.0\"\n  resolved \"https://registry.npmjs.org/is-windows/-/is-windows-0.2.0.tgz\"\n  integrity sha1-3hqm1j6indJIc3tp8f+LgALSEIw=\n\nis@^3.1.0:\n  version \"3.2.1\"\n  resolved \"https://registry.npmjs.org/is/-/is-3.2.1.tgz\"\n  integrity sha1-0Kwq1V63sL7JJqUmb2xmKqqD3KU=\n\nisarray@^1.0.0, isarray@~1.0.0, isarray@1.0.0:\n  version \"1.0.0\"\n  resolved \"https://registry.npmjs.org/isarray/-/isarray-1.0.0.tgz\"\n  integrity sha1-u5NdSFgsuhaMBoNJV6VKPgcSTxE=\n\nisarray@0.0.1:\n  version \"0.0.1\"\n  resolved \"https://registry.npmjs.org/isarray/-/isarray-0.0.1.tgz\"\n  integrity sha1-ihis/Kmo9Bd+Cav8YDiTmwXR7t8=\n\nisexe@^2.0.0:\n  version \"2.0.0\"\n  resolved \"https://registry.npmjs.org/isexe/-/isexe-2.0.0.tgz\"\n  integrity sha1-6PvzdNxVb/iUehDcsFctYz8s+hA=\n\nisobject@^2.0.0:\n  version \"2.1.0\"\n  resolved \"https://registry.npmjs.org/isobject/-/isobject-2.1.0.tgz\"\n  integrity sha1-8GVWEJaj8dou9GJy+BXIQNh+DIk=\n  dependencies:\n    isarray \"1.0.0\"\n\nisobject@^3.0.0:\n  version \"3.0.1\"\n  resolved \"https://registry.npmjs.org/isobject/-/isobject-3.0.1.tgz\"\n  integrity sha1-TkMekrEalzFjaqH5yNHMvP2reN8=\n\nisobject@^3.0.1:\n  version \"3.0.1\"\n  resolved \"https://registry.npmjs.org/isobject/-/isobject-3.0.1.tgz\"\n  integrity sha1-TkMekrEalzFjaqH5yNHMvP2reN8=\n\njest-get-type@^21.2.0:\n  version \"21.2.0\"\n  resolved \"https://registry.npmjs.org/jest-get-type/-/jest-get-type-21.2.0.tgz\"\n  integrity sha512-y2fFw3C+D0yjNSDp7ab1kcd6NUYfy3waPTlD8yWkAtiocJdBRQqNoRqVfMNxgj+IjT0V5cBIHJO0z9vuSSZ43Q==\n\njest-validate@^21.1.0:\n  version \"21.2.1\"\n  resolved \"https://registry.npmjs.org/jest-validate/-/jest-validate-21.2.1.tgz\"\n  integrity sha512-k4HLI1rZQjlU+EC682RlQ6oZvLrE5SCh3brseQc24vbZTxzT/k/3urar5QMCVgjadmSO7lECeGdc6YxnM3yEGg==\n  dependencies:\n    chalk \"^2.0.1\"\n    jest-get-type \"^21.2.0\"\n    leven \"^2.1.0\"\n    pretty-format \"^21.2.1\"\n\njs-tokens@^3.0.0, js-tokens@^3.0.2:\n  version \"3.0.2\"\n  resolved \"https://registry.npmjs.org/js-tokens/-/js-tokens-3.0.2.tgz\"\n  integrity sha1-mGbfOVECEw449/mWvOtlRDIJwls=\n\njs-yaml@^3.4.3, js-yaml@^3.5.1:\n  version \"3.9.1\"\n  resolved \"https://registry.npmjs.org/js-yaml/-/js-yaml-3.9.1.tgz\"\n  integrity sha512-CbcG379L1e+mWBnLvHWWeLs8GyV/EMw862uLI3c+GxVyDHWZcjZinwuBd3iW2pgxgIlksW/1vNJa4to+RvDOww==\n  dependencies:\n    argparse \"^1.0.7\"\n    esprima \"^4.0.0\"\n\njsesc@^1.3.0:\n  version \"1.3.0\"\n  resolved \"https://registry.npmjs.org/jsesc/-/jsesc-1.3.0.tgz\"\n  integrity sha1-RsP+yMGJKxKwgz25vHYiF226s0s=\n\njsesc@~0.5.0:\n  version \"0.5.0\"\n  resolved \"https://registry.npmjs.org/jsesc/-/jsesc-0.5.0.tgz\"\n  integrity sha1-597mbjXW/Bb3EP6R1c9p9w8IkR0=\n\njson-stable-stringify@^1.0.0, json-stable-stringify@^1.0.1:\n  version \"1.0.1\"\n  resolved \"https://registry.npmjs.org/json-stable-stringify/-/json-stable-stringify-1.0.1.tgz\"\n  integrity sha1-mnWdOcXy/1A/1TAGRu1EX4jE+a8=\n  dependencies:\n    jsonify \"~0.0.0\"\n\njson5@^0.5.1:\n  version \"0.5.1\"\n  resolved \"https://registry.npmjs.org/json5/-/json5-0.5.1.tgz\"\n  integrity sha1-Hq3nrMASA0rYTiOWdn6tn6VJWCE=\n\njsonify@~0.0.0:\n  version \"0.0.0\"\n  resolved \"https://registry.npmjs.org/jsonify/-/jsonify-0.0.0.tgz\"\n  integrity sha1-LHS27kHZPKUbe1qu6PUDYx0lKnM=\n\njsonpointer@^4.0.0:\n  version \"4.0.1\"\n  resolved \"https://registry.npmjs.org/jsonpointer/-/jsonpointer-4.0.1.tgz\"\n  integrity sha1-T9kss04OnbPInIYi7PUfm5eMbLk=\n\nkind-of@^3.0.2:\n  version \"3.2.2\"\n  resolved \"https://registry.npmjs.org/kind-of/-/kind-of-3.2.2.tgz\"\n  integrity sha1-MeohpzS6ubuw8yRm2JOupR5KPGQ=\n  dependencies:\n    is-buffer \"^1.1.5\"\n\nkind-of@^4.0.0:\n  version \"4.0.0\"\n  resolved \"https://registry.npmjs.org/kind-of/-/kind-of-4.0.0.tgz\"\n  integrity sha1-IIE989cSkosgc3hpGkUGb65y3Vc=\n  dependencies:\n    is-buffer \"^1.1.5\"\n\nleven@^2.1.0:\n  version \"2.1.0\"\n  resolved \"https://registry.npmjs.org/leven/-/leven-2.1.0.tgz\"\n  integrity sha1-wuep93IJTe6dNCAq6KzORoeHVYA=\n\nlevn@^0.3.0, levn@~0.3.0:\n  version \"0.3.0\"\n  resolved \"https://registry.npmjs.org/levn/-/levn-0.3.0.tgz\"\n  integrity sha1-OwmSTt+fCDwEkP3UwLxEIeBHZO4=\n  dependencies:\n    prelude-ls \"~1.1.2\"\n    type-check \"~0.3.2\"\n\nliftoff@^2.1.0:\n  version \"2.3.0\"\n  resolved \"https://registry.npmjs.org/liftoff/-/liftoff-2.3.0.tgz\"\n  integrity sha1-qY8v9nGD2Lp8+soQVIvX/wVQs4U=\n  dependencies:\n    extend \"^3.0.0\"\n    findup-sync \"^0.4.2\"\n    fined \"^1.0.1\"\n    flagged-respawn \"^0.3.2\"\n    lodash.isplainobject \"^4.0.4\"\n    lodash.isstring \"^4.0.1\"\n    lodash.mapvalues \"^4.4.0\"\n    rechoir \"^0.6.2\"\n    resolve \"^1.1.7\"\n\nlint-staged@^4.3.0:\n  version \"4.3.0\"\n  resolved \"https://registry.npmjs.org/lint-staged/-/lint-staged-4.3.0.tgz\"\n  integrity sha512-C/Zxslg0VRbsxwmCu977iIs+QyrmW2cyRCPUV5NDFYOH/jtRFHH8ch7ua2fH0voI/nVC3Tpg7DykfgMZySliKw==\n  dependencies:\n    app-root-path \"^2.0.0\"\n    chalk \"^2.1.0\"\n    commander \"^2.11.0\"\n    cosmiconfig \"^1.1.0\"\n    execa \"^0.8.0\"\n    is-glob \"^4.0.0\"\n    jest-validate \"^21.1.0\"\n    listr \"^0.12.0\"\n    lodash \"^4.17.4\"\n    log-symbols \"^2.0.0\"\n    minimatch \"^3.0.0\"\n    npm-which \"^3.0.1\"\n    p-map \"^1.1.1\"\n    staged-git-files \"0.0.4\"\n    stringify-object \"^3.2.0\"\n\nlistr-silent-renderer@^1.1.1:\n  version \"1.1.1\"\n  resolved \"https://registry.npmjs.org/listr-silent-renderer/-/listr-silent-renderer-1.1.1.tgz\"\n  integrity sha1-kktaN1cVN3C/Go4/v3S4u/P5JC4=\n\nlistr-update-renderer@^0.2.0:\n  version \"0.2.0\"\n  resolved \"https://registry.npmjs.org/listr-update-renderer/-/listr-update-renderer-0.2.0.tgz\"\n  integrity sha1-yoDhd5tOcCZoB+ju0a1qvjmFUPk=\n  dependencies:\n    chalk \"^1.1.3\"\n    cli-truncate \"^0.2.1\"\n    elegant-spinner \"^1.0.1\"\n    figures \"^1.7.0\"\n    indent-string \"^3.0.0\"\n    log-symbols \"^1.0.2\"\n    log-update \"^1.0.2\"\n    strip-ansi \"^3.0.1\"\n\nlistr-verbose-renderer@^0.4.0:\n  version \"0.4.0\"\n  resolved \"https://registry.npmjs.org/listr-verbose-renderer/-/listr-verbose-renderer-0.4.0.tgz\"\n  integrity sha1-RNwBuww0oDxXIVTU0Izemx3FYg8=\n  dependencies:\n    chalk \"^1.1.3\"\n    cli-cursor \"^1.0.2\"\n    date-fns \"^1.27.2\"\n    figures \"^1.7.0\"\n\nlistr@^0.12.0:\n  version \"0.12.0\"\n  resolved \"https://registry.npmjs.org/listr/-/listr-0.12.0.tgz\"\n  integrity sha1-a84sD1YD+klYDqF81qAMwOX6RRo=\n  dependencies:\n    chalk \"^1.1.3\"\n    cli-truncate \"^0.2.1\"\n    figures \"^1.7.0\"\n    indent-string \"^2.1.0\"\n    is-promise \"^2.1.0\"\n    is-stream \"^1.1.0\"\n    listr-silent-renderer \"^1.1.1\"\n    listr-update-renderer \"^0.2.0\"\n    listr-verbose-renderer \"^0.4.0\"\n    log-symbols \"^1.0.2\"\n    log-update \"^1.0.2\"\n    ora \"^0.2.3\"\n    p-map \"^1.1.1\"\n    rxjs \"^5.0.0-beta.11\"\n    stream-to-observable \"^0.1.0\"\n    strip-ansi \"^3.0.1\"\n\nload-json-file@^1.0.0:\n  version \"1.1.0\"\n  resolved \"https://registry.npmjs.org/load-json-file/-/load-json-file-1.1.0.tgz\"\n  integrity sha1-lWkFcI1YtLq0wiYbBPWfMcmTdMA=\n  dependencies:\n    graceful-fs \"^4.1.2\"\n    parse-json \"^2.2.0\"\n    pify \"^2.0.0\"\n    pinkie-promise \"^2.0.0\"\n    strip-bom \"^2.0.0\"\n\nlodash._basecopy@^3.0.0:\n  version \"3.0.1\"\n  resolved \"https://registry.npmjs.org/lodash._basecopy/-/lodash._basecopy-3.0.1.tgz\"\n  integrity sha1-jaDmqHbPNEwK2KVIghEd08XHyjY=\n\nlodash._basetostring@^3.0.0:\n  version \"3.0.1\"\n  resolved \"https://registry.npmjs.org/lodash._basetostring/-/lodash._basetostring-3.0.1.tgz\"\n  integrity sha1-0YYdh3+CSlL2aYMtyvPuFVZqB9U=\n\nlodash._basevalues@^3.0.0:\n  version \"3.0.0\"\n  resolved \"https://registry.npmjs.org/lodash._basevalues/-/lodash._basevalues-3.0.0.tgz\"\n  integrity sha1-W3dXYoAr3j0yl1A+JjAIIP32Ybc=\n\nlodash._escapehtmlchar@~2.4.1:\n  version \"2.4.1\"\n  resolved \"https://registry.npmjs.org/lodash._escapehtmlchar/-/lodash._escapehtmlchar-2.4.1.tgz\"\n  integrity sha1-32fDu2t+jh6DGrSL+geVuSr+iZ0=\n  dependencies:\n    lodash._htmlescapes \"~2.4.1\"\n\nlodash._escapestringchar@~2.4.1:\n  version \"2.4.1\"\n  resolved \"https://registry.npmjs.org/lodash._escapestringchar/-/lodash._escapestringchar-2.4.1.tgz\"\n  integrity sha1-7P4iYYoq3lC/7qQ5N+Ud9m8O23I=\n\nlodash._getnative@^3.0.0:\n  version \"3.9.1\"\n  resolved \"https://registry.npmjs.org/lodash._getnative/-/lodash._getnative-3.9.1.tgz\"\n  integrity sha1-VwvH3t5G1hzc3mh9ZdPuy6o6r/U=\n\nlodash._htmlescapes@~2.4.1:\n  version \"2.4.1\"\n  resolved \"https://registry.npmjs.org/lodash._htmlescapes/-/lodash._htmlescapes-2.4.1.tgz\"\n  integrity sha1-MtFL8IRLbeb4tioFG09nwii2JMs=\n\nlodash._isiterateecall@^3.0.0:\n  version \"3.0.9\"\n  resolved \"https://registry.npmjs.org/lodash._isiterateecall/-/lodash._isiterateecall-3.0.9.tgz\"\n  integrity sha1-UgOte6Ql+uhCRg5pbbnPPmqsBXw=\n\nlodash._isnative@~2.4.1:\n  version \"2.4.1\"\n  resolved \"https://registry.npmjs.org/lodash._isnative/-/lodash._isnative-2.4.1.tgz\"\n  integrity sha1-PqZAS3hKe+g2x7V1gOHN95sUgyw=\n\nlodash._objecttypes@~2.4.1:\n  version \"2.4.1\"\n  resolved \"https://registry.npmjs.org/lodash._objecttypes/-/lodash._objecttypes-2.4.1.tgz\"\n  integrity sha1-fAt/admKH3ZSn4kLDNsbTf7BHBE=\n\nlodash._reescape@^3.0.0:\n  version \"3.0.0\"\n  resolved \"https://registry.npmjs.org/lodash._reescape/-/lodash._reescape-3.0.0.tgz\"\n  integrity sha1-Kx1vXf4HyKNVdT5fJ/rH8c3hYWo=\n\nlodash._reevaluate@^3.0.0:\n  version \"3.0.0\"\n  resolved \"https://registry.npmjs.org/lodash._reevaluate/-/lodash._reevaluate-3.0.0.tgz\"\n  integrity sha1-WLx0xAZklTrgsSTYBpltrKQx4u0=\n\nlodash._reinterpolate@^2.4.1, lodash._reinterpolate@~2.4.1:\n  version \"2.4.1\"\n  resolved \"https://registry.npmjs.org/lodash._reinterpolate/-/lodash._reinterpolate-2.4.1.tgz\"\n  integrity sha1-TxInqlqHEfxjL1sHofRgequLMiI=\n\nlodash._reinterpolate@^3.0.0:\n  version \"3.0.0\"\n  resolved \"https://registry.npmjs.org/lodash._reinterpolate/-/lodash._reinterpolate-3.0.0.tgz\"\n  integrity sha1-DM8tiRZq8Ds2Y8eWU4t1rG4RTZ0=\n\nlodash._reunescapedhtml@~2.4.1:\n  version \"2.4.1\"\n  resolved \"https://registry.npmjs.org/lodash._reunescapedhtml/-/lodash._reunescapedhtml-2.4.1.tgz\"\n  integrity sha1-dHxPxAED6zu4oJduVx96JlnpO6c=\n  dependencies:\n    lodash._htmlescapes \"~2.4.1\"\n    lodash.keys \"~2.4.1\"\n\nlodash._root@^3.0.0:\n  version \"3.0.1\"\n  resolved \"https://registry.npmjs.org/lodash._root/-/lodash._root-3.0.1.tgz\"\n  integrity sha1-+6HEUkwZ7ppfgTa0YJ8BfPTe1pI=\n\nlodash._shimkeys@~2.4.1:\n  version \"2.4.1\"\n  resolved \"https://registry.npmjs.org/lodash._shimkeys/-/lodash._shimkeys-2.4.1.tgz\"\n  integrity sha1-bpzJZm/wgfC1psl4uD4kLmlJ0gM=\n  dependencies:\n    lodash._objecttypes \"~2.4.1\"\n\nlodash.defaults@~2.4.1:\n  version \"2.4.1\"\n  resolved \"https://registry.npmjs.org/lodash.defaults/-/lodash.defaults-2.4.1.tgz\"\n  integrity sha1-p+iIXwXmiFEUS24SqPNngCa8TFQ=\n  dependencies:\n    lodash._objecttypes \"~2.4.1\"\n    lodash.keys \"~2.4.1\"\n\nlodash.escape@^3.0.0:\n  version \"3.2.0\"\n  resolved \"https://registry.npmjs.org/lodash.escape/-/lodash.escape-3.2.0.tgz\"\n  integrity sha1-mV7g3BjBtIzJLv+ucaEKq1tIdpg=\n  dependencies:\n    lodash._root \"^3.0.0\"\n\nlodash.escape@~2.4.1:\n  version \"2.4.1\"\n  resolved \"https://registry.npmjs.org/lodash.escape/-/lodash.escape-2.4.1.tgz\"\n  integrity sha1-LOEsXghNsKV92l5dHu659dF1o7Q=\n  dependencies:\n    lodash._escapehtmlchar \"~2.4.1\"\n    lodash._reunescapedhtml \"~2.4.1\"\n    lodash.keys \"~2.4.1\"\n\nlodash.isarguments@^3.0.0:\n  version \"3.1.0\"\n  resolved \"https://registry.npmjs.org/lodash.isarguments/-/lodash.isarguments-3.1.0.tgz\"\n  integrity sha1-L1c9hcaiQon/AGY7SRwdM4/zRYo=\n\nlodash.isarray@^3.0.0:\n  version \"3.0.4\"\n  resolved \"https://registry.npmjs.org/lodash.isarray/-/lodash.isarray-3.0.4.tgz\"\n  integrity sha1-eeTriMNqgSKvhvhEqpvNhRtfu1U=\n\nlodash.isobject@~2.4.1:\n  version \"2.4.1\"\n  resolved \"https://registry.npmjs.org/lodash.isobject/-/lodash.isobject-2.4.1.tgz\"\n  integrity sha1-Wi5H/mmVPx7mMafrof5k0tBlWPU=\n  dependencies:\n    lodash._objecttypes \"~2.4.1\"\n\nlodash.isplainobject@^4.0.4:\n  version \"4.0.6\"\n  resolved \"https://registry.npmjs.org/lodash.isplainobject/-/lodash.isplainobject-4.0.6.tgz\"\n  integrity sha1-fFJqUtibRcRcxpC4gWO+BJf1UMs=\n\nlodash.isstring@^4.0.1:\n  version \"4.0.1\"\n  resolved \"https://registry.npmjs.org/lodash.isstring/-/lodash.isstring-4.0.1.tgz\"\n  integrity sha1-1SfftUVuynzJu5XV2ur4i6VKVFE=\n\nlodash.keys@^3.0.0:\n  version \"3.1.2\"\n  resolved \"https://registry.npmjs.org/lodash.keys/-/lodash.keys-3.1.2.tgz\"\n  integrity sha1-TbwEcrFWvlCgsoaFXRvQsMZWCYo=\n  dependencies:\n    lodash._getnative \"^3.0.0\"\n    lodash.isarguments \"^3.0.0\"\n    lodash.isarray \"^3.0.0\"\n\nlodash.keys@~2.4.1:\n  version \"2.4.1\"\n  resolved \"https://registry.npmjs.org/lodash.keys/-/lodash.keys-2.4.1.tgz\"\n  integrity sha1-SN6kbfj/djKxDXBrissmWR4rNyc=\n  dependencies:\n    lodash._isnative \"~2.4.1\"\n    lodash._shimkeys \"~2.4.1\"\n    lodash.isobject \"~2.4.1\"\n\nlodash.mapvalues@^4.4.0:\n  version \"4.6.0\"\n  resolved \"https://registry.npmjs.org/lodash.mapvalues/-/lodash.mapvalues-4.6.0.tgz\"\n  integrity sha1-G6+lAF3p3W9PJmaMMMo3IwzJaJw=\n\nlodash.restparam@^3.0.0:\n  version \"3.6.1\"\n  resolved \"https://registry.npmjs.org/lodash.restparam/-/lodash.restparam-3.6.1.tgz\"\n  integrity sha1-k2pOMJ7zMKdkXtQUWYbIWuWyCAU=\n\nlodash.template@^2.4.1:\n  version \"2.4.1\"\n  resolved \"https://registry.npmjs.org/lodash.template/-/lodash.template-2.4.1.tgz\"\n  integrity sha1-nmEQB+32KRKal0qzxIuBez4c8g0=\n  dependencies:\n    lodash._escapestringchar \"~2.4.1\"\n    lodash._reinterpolate \"~2.4.1\"\n    lodash.defaults \"~2.4.1\"\n    lodash.escape \"~2.4.1\"\n    lodash.keys \"~2.4.1\"\n    lodash.templatesettings \"~2.4.1\"\n    lodash.values \"~2.4.1\"\n\nlodash.template@^3.0.0:\n  version \"3.6.2\"\n  resolved \"https://registry.npmjs.org/lodash.template/-/lodash.template-3.6.2.tgz\"\n  integrity sha1-+M3sxhaaJVvpCYrosMU9N4kx0U8=\n  dependencies:\n    lodash._basecopy \"^3.0.0\"\n    lodash._basetostring \"^3.0.0\"\n    lodash._basevalues \"^3.0.0\"\n    lodash._isiterateecall \"^3.0.0\"\n    lodash._reinterpolate \"^3.0.0\"\n    lodash.escape \"^3.0.0\"\n    lodash.keys \"^3.0.0\"\n    lodash.restparam \"^3.0.0\"\n    lodash.templatesettings \"^3.0.0\"\n\nlodash.templatesettings@^3.0.0:\n  version \"3.1.1\"\n  resolved \"https://registry.npmjs.org/lodash.templatesettings/-/lodash.templatesettings-3.1.1.tgz\"\n  integrity sha1-+zB4RHU7Zrnxr6VOJix0UwfbqOU=\n  dependencies:\n    lodash._reinterpolate \"^3.0.0\"\n    lodash.escape \"^3.0.0\"\n\nlodash.templatesettings@~2.4.1:\n  version \"2.4.1\"\n  resolved \"https://registry.npmjs.org/lodash.templatesettings/-/lodash.templatesettings-2.4.1.tgz\"\n  integrity sha1-6nbHXRHrhtTb6JqDiTu4YZKaxpk=\n  dependencies:\n    lodash._reinterpolate \"~2.4.1\"\n    lodash.escape \"~2.4.1\"\n\nlodash.values@~2.4.1:\n  version \"2.4.1\"\n  resolved \"https://registry.npmjs.org/lodash.values/-/lodash.values-2.4.1.tgz\"\n  integrity sha1-q/UUQ2s8twUAFieXjLzzCxKA7qQ=\n  dependencies:\n    lodash.keys \"~2.4.1\"\n\nlodash@^4.0.0, lodash@^4.17.4, lodash@^4.3.0, lodash@^4.5.1:\n  version \"4.17.4\"\n  resolved \"https://registry.npmjs.org/lodash/-/lodash-4.17.4.tgz\"\n  integrity sha1-eCA6TRwyiuHYbcpkYONptX9AVa4=\n\nlodash@~1.0.1:\n  version \"1.0.2\"\n  resolved \"https://registry.npmjs.org/lodash/-/lodash-1.0.2.tgz\"\n  integrity sha1-j1dWDIO1n8JwvT1WG2kAQ0MOJVE=\n\nlog-symbols@^1.0.2:\n  version \"1.0.2\"\n  resolved \"https://registry.npmjs.org/log-symbols/-/log-symbols-1.0.2.tgz\"\n  integrity sha1-N2/3tY6jCGoPCfrMdGF+ylAeGhg=\n  dependencies:\n    chalk \"^1.0.0\"\n\nlog-symbols@^2.0.0:\n  version \"2.1.0\"\n  resolved \"https://registry.npmjs.org/log-symbols/-/log-symbols-2.1.0.tgz\"\n  integrity sha512-zLeLrzMA1A2vRF1e/0Mo+LNINzi6jzBylHj5WqvQ/WK/5WCZt8si9SyN4p9llr/HRYvVR1AoXHRHl4WTHyQAzQ==\n  dependencies:\n    chalk \"^2.0.1\"\n\nlog-update@^1.0.2:\n  version \"1.0.2\"\n  resolved \"https://registry.npmjs.org/log-update/-/log-update-1.0.2.tgz\"\n  integrity sha1-GZKfZMQJPS0ucHWh2tivWcKWuNE=\n  dependencies:\n    ansi-escapes \"^1.0.0\"\n    cli-cursor \"^1.0.2\"\n\nloose-envify@^1.0.0:\n  version \"1.3.1\"\n  resolved \"https://registry.npmjs.org/loose-envify/-/loose-envify-1.3.1.tgz\"\n  integrity sha1-0aitM/qc4OcT1l/dCsi3SNR4yEg=\n  dependencies:\n    js-tokens \"^3.0.0\"\n\nloud-rejection@^1.0.0:\n  version \"1.6.0\"\n  resolved \"https://registry.npmjs.org/loud-rejection/-/loud-rejection-1.6.0.tgz\"\n  integrity sha1-W0b4AUft7leIcPCG0Eghz5mOVR8=\n  dependencies:\n    currently-unhandled \"^0.4.1\"\n    signal-exit \"^3.0.0\"\n\nlru-cache@^4.0.1:\n  version \"4.1.1\"\n  resolved \"https://registry.npmjs.org/lru-cache/-/lru-cache-4.1.1.tgz\"\n  integrity sha512-q4spe4KTfsAS1SUHLO0wz8Qiyf1+vMIAgpRYioFYDMNqKfHQbg+AVDH3i4fvpl71/P1L0dBl+fQi+P37UYf0ew==\n  dependencies:\n    pseudomap \"^1.0.2\"\n    yallist \"^2.1.2\"\n\nlru-cache@2:\n  version \"2.7.3\"\n  resolved \"https://registry.npmjs.org/lru-cache/-/lru-cache-2.7.3.tgz\"\n  integrity sha1-bUUk6LlV+V1PW1iFHOId1y+06VI=\n\nmap-cache@^0.2.0:\n  version \"0.2.2\"\n  resolved \"https://registry.npmjs.org/map-cache/-/map-cache-0.2.2.tgz\"\n  integrity sha1-wyq9C9ZSXZsFFkW7TyasXcmKDb8=\n\nmap-obj@^1.0.0, map-obj@^1.0.1:\n  version \"1.0.1\"\n  resolved \"https://registry.npmjs.org/map-obj/-/map-obj-1.0.1.tgz\"\n  integrity sha1-2TPOuSBdgr3PSIb2dCvcK03qFG0=\n\nmedia-typer@0.3.0:\n  version \"0.3.0\"\n  resolved \"https://registry.npmjs.org/media-typer/-/media-typer-0.3.0.tgz\"\n  integrity sha1-hxDXrwqmJvj/+hzgAWhUUmMlV0g=\n\nmeow@^3.3.0:\n  version \"3.7.0\"\n  resolved \"https://registry.npmjs.org/meow/-/meow-3.7.0.tgz\"\n  integrity sha1-cstmi0JSKCkKu/qFaJJYcwioAfs=\n  dependencies:\n    camelcase-keys \"^2.0.0\"\n    decamelize \"^1.1.2\"\n    loud-rejection \"^1.0.0\"\n    map-obj \"^1.0.1\"\n    minimist \"^1.1.3\"\n    normalize-package-data \"^2.3.4\"\n    object-assign \"^4.0.1\"\n    read-pkg-up \"^1.0.1\"\n    redent \"^1.0.0\"\n    trim-newlines \"^1.0.0\"\n\nmicromatch@^2.3.7:\n  version \"2.3.11\"\n  resolved \"https://registry.npmjs.org/micromatch/-/micromatch-2.3.11.tgz\"\n  integrity sha1-hmd8l9FyCzY0MdBNDRUpO9OMFWU=\n  dependencies:\n    arr-diff \"^2.0.0\"\n    array-unique \"^0.2.1\"\n    braces \"^1.8.2\"\n    expand-brackets \"^0.1.4\"\n    extglob \"^0.3.1\"\n    filename-regex \"^2.0.0\"\n    is-extglob \"^1.0.0\"\n    is-glob \"^2.0.1\"\n    kind-of \"^3.0.2\"\n    normalize-path \"^2.0.1\"\n    object.omit \"^2.0.0\"\n    parse-glob \"^3.0.4\"\n    regex-cache \"^0.4.2\"\n\nmime-db@~1.12.0:\n  version \"1.12.0\"\n  resolved \"https://registry.npmjs.org/mime-db/-/mime-db-1.12.0.tgz\"\n  integrity sha1-PQxjGA9FjrENMlqqN9fFiuMS6dc=\n\nmime-db@~1.30.0:\n  version \"1.30.0\"\n  resolved \"https://registry.npmjs.org/mime-db/-/mime-db-1.30.0.tgz\"\n  integrity sha1-dMZD2i3Z1qRTmZY0ZbJtXKfXHwE=\n\nmime-types@~2.0.9:\n  version \"2.0.14\"\n  resolved \"https://registry.npmjs.org/mime-types/-/mime-types-2.0.14.tgz\"\n  integrity sha1-MQ4VnbI+B3+Lsit0jav6SVcUCqY=\n  dependencies:\n    mime-db \"~1.12.0\"\n\nmime-types@~2.1.15, mime-types@~2.1.16:\n  version \"2.1.17\"\n  resolved \"https://registry.npmjs.org/mime-types/-/mime-types-2.1.17.tgz\"\n  integrity sha1-Cdejk/A+mVp5+K+Fe3Cp4KsWVXo=\n  dependencies:\n    mime-db \"~1.30.0\"\n\nmime@1.2.x:\n  version \"1.2.11\"\n  resolved \"https://registry.npmjs.org/mime/-/mime-1.2.11.tgz\"\n  integrity sha512-Ysa2F/nqTNGHhhm9MV8ure4+Hc+Y8AWiqUdHxsO7xu8zc92ND9f3kpALHjaP026Ft17UfxrMt95c50PLUeynBw==\n\nmime@1.3.4:\n  version \"1.3.4\"\n  resolved \"https://registry.npmjs.org/mime/-/mime-1.3.4.tgz\"\n  integrity sha1-EV+eO2s9rylZmDyzjxSaLUDrXVM=\n\nminimatch@^2.0.1:\n  version \"2.0.10\"\n  resolved \"https://registry.npmjs.org/minimatch/-/minimatch-2.0.10.tgz\"\n  integrity sha1-jQh8OcazjAAbl/ynzm0OHoCvusc=\n  dependencies:\n    brace-expansion \"^1.0.0\"\n\nminimatch@^3.0.0, minimatch@^3.0.2, minimatch@^3.0.4:\n  version \"3.0.4\"\n  resolved \"https://registry.npmjs.org/minimatch/-/minimatch-3.0.4.tgz\"\n  integrity sha512-yJHVQEhyqPLUTgt9B83PXu6W3rx4MvvHvSUvToogpwoGDOUQ+yDrR0HRot+yOCdCO7u4hX3pWft6kWBBcqh0UA==\n  dependencies:\n    brace-expansion \"^1.1.7\"\n\nminimatch@~0.2.11:\n  version \"0.2.14\"\n  resolved \"https://registry.npmjs.org/minimatch/-/minimatch-0.2.14.tgz\"\n  integrity sha1-x054BXT2PG+aCQ6Q775u9TpqdWo=\n  dependencies:\n    lru-cache \"2\"\n    sigmund \"~1.0.0\"\n\nminimatch@~0.2.12:\n  version \"0.2.14\"\n  resolved \"https://registry.npmjs.org/minimatch/-/minimatch-0.2.14.tgz\"\n  integrity sha512-zZ+Jy8lVWlvqqeM8iZB7w7KmQkoJn8djM585z88rywrEbzoqawVa9FR5p2hwD+y74nfuKOjmNvi9gtWJNLqHvA==\n  dependencies:\n    lru-cache \"2\"\n    sigmund \"~1.0.0\"\n\nminimist@^0.2.0:\n  version \"0.2.0\"\n  resolved \"https://registry.npmjs.org/minimist/-/minimist-0.2.0.tgz\"\n  integrity sha1-Tf/lJdriuGTGbC4jxicdev3s784=\n\nminimist@^1.1.0:\n  version \"1.2.0\"\n  resolved \"https://registry.npmjs.org/minimist/-/minimist-1.2.0.tgz\"\n  integrity sha1-o1AIsg9BOD7sH7kU9M1d95omQoQ=\n\nminimist@^1.1.3:\n  version \"1.2.0\"\n  resolved \"https://registry.npmjs.org/minimist/-/minimist-1.2.0.tgz\"\n  integrity sha1-o1AIsg9BOD7sH7kU9M1d95omQoQ=\n\nminimist@^1.2.0:\n  version \"1.2.0\"\n  resolved \"https://registry.npmjs.org/minimist/-/minimist-1.2.0.tgz\"\n  integrity sha1-o1AIsg9BOD7sH7kU9M1d95omQoQ=\n\nminimist@~0.0.1, minimist@~0.0.5, minimist@0.0.8:\n  version \"0.0.8\"\n  resolved \"https://registry.npmjs.org/minimist/-/minimist-0.0.8.tgz\"\n  integrity sha1-hX/Kv8M5fSYluCKCYuhqp6ARsF0=\n\nmkdirp@^0.5.0, mkdirp@^0.5.1:\n  version \"0.5.1\"\n  resolved \"https://registry.npmjs.org/mkdirp/-/mkdirp-0.5.1.tgz\"\n  integrity sha1-MAV0OOrGz3+MR2fzhkjWaX11yQM=\n  dependencies:\n    minimist \"0.0.8\"\n\nmkdirp@0.0.x:\n  version \"0.0.7\"\n  resolved \"https://registry.npmjs.org/mkdirp/-/mkdirp-0.0.7.tgz\"\n  integrity sha512-r4Ml2CH2Kl4B0+Lwq1SVru0vjMxdtR+UEb938WTQcsnU+EJz8dUV/HY0LTZh466nUSljia9cvqW3LZLWs3l8LQ==\n\nms@2.0.0:\n  version \"2.0.0\"\n  resolved \"https://registry.npmjs.org/ms/-/ms-2.0.0.tgz\"\n  integrity sha1-VgiurfwAvmwpAd9fmGF4jeDVl8g=\n\nmultipipe@^0.1.0, multipipe@^0.1.2:\n  version \"0.1.2\"\n  resolved \"https://registry.npmjs.org/multipipe/-/multipipe-0.1.2.tgz\"\n  integrity sha1-Ko8t33Du1WTf8tV/HhoTfZ8FB4s=\n  dependencies:\n    duplexer2 \"0.0.2\"\n\nmute-stream@0.0.5:\n  version \"0.0.5\"\n  resolved \"https://registry.npmjs.org/mute-stream/-/mute-stream-0.0.5.tgz\"\n  integrity sha1-j7+rsKmKJT0xhDMfno3rc3L6xsA=\n\nnan@1.4.x:\n  version \"1.4.3\"\n  resolved \"https://registry.npmjs.org/nan/-/nan-1.4.3.tgz\"\n  integrity sha512-sZJUTDM4+nDMorRUb2WS0nv5ihun+xqlHhKgKCKi0s4nI/tj5NVHlEm13hEySdZ15iAORPaJ50Gv6yi93bPPIw==\n\nnatives@^1.1.0:\n  version \"1.1.0\"\n  resolved \"https://registry.npmjs.org/natives/-/natives-1.1.0.tgz\"\n  integrity sha1-6f+EFBimsux6SV6TmYT3jxY+bjE=\n\nnatural-compare@^1.4.0:\n  version \"1.4.0\"\n  resolved \"https://registry.npmjs.org/natural-compare/-/natural-compare-1.4.0.tgz\"\n  integrity sha1-Sr6/7tdUHywnrPspvbvRXI1bpPc=\n\nnegotiator@0.6.1:\n  version \"0.6.1\"\n  resolved \"https://registry.npmjs.org/negotiator/-/negotiator-0.6.1.tgz\"\n  integrity sha1-KzJxhOiZIQEXeyhWP7XnECrNDKk=\n\nnode.extend@^1.0.10:\n  version \"1.1.6\"\n  resolved \"https://registry.npmjs.org/node.extend/-/node.extend-1.1.6.tgz\"\n  integrity sha1-p7iCyC1sk6SGOlUEvV3o7IYli5Y=\n  dependencies:\n    is \"^3.1.0\"\n\nnormalize-package-data@^2.3.2, normalize-package-data@^2.3.4:\n  version \"2.4.0\"\n  resolved \"https://registry.npmjs.org/normalize-package-data/-/normalize-package-data-2.4.0.tgz\"\n  integrity sha512-9jjUFbTPfEy3R/ad/2oNbKtW9Hgovl5O1FvFWKkKblNXoN/Oou6+9+KKohPK13Yc3/TyunyWhJp6gvRNR/PPAw==\n  dependencies:\n    hosted-git-info \"^2.1.4\"\n    is-builtin-module \"^1.0.0\"\n    semver \"2 || 3 || 4 || 5\"\n    validate-npm-package-license \"^3.0.1\"\n\nnormalize-path@^1.0.0:\n  version \"1.0.0\"\n  resolved \"https://registry.npmjs.org/normalize-path/-/normalize-path-1.0.0.tgz\"\n  integrity sha1-MtDkcvkf80VwHBWoMRAY07CpA3k=\n\nnormalize-path@^2.0.1:\n  version \"2.1.1\"\n  resolved \"https://registry.npmjs.org/normalize-path/-/normalize-path-2.1.1.tgz\"\n  integrity sha1-GrKLVW4Zg2Oowab35vogE3/mrtk=\n  dependencies:\n    remove-trailing-separator \"^1.0.1\"\n\nnpm-path@^2.0.2:\n  version \"2.0.3\"\n  resolved \"https://registry.npmjs.org/npm-path/-/npm-path-2.0.3.tgz\"\n  integrity sha1-Fc/04ciaONp39W9gVbJPl137K74=\n  dependencies:\n    which \"^1.2.10\"\n\nnpm-run-path@^2.0.0:\n  version \"2.0.2\"\n  resolved \"https://registry.npmjs.org/npm-run-path/-/npm-run-path-2.0.2.tgz\"\n  integrity sha1-NakjLfo11wZ7TLLd8jV7GHFTbF8=\n  dependencies:\n    path-key \"^2.0.0\"\n\nnpm-which@^3.0.1:\n  version \"3.0.1\"\n  resolved \"https://registry.npmjs.org/npm-which/-/npm-which-3.0.1.tgz\"\n  integrity sha1-kiXybsOihcIJyuZ8OxGmtKtxQKo=\n  dependencies:\n    commander \"^2.9.0\"\n    npm-path \"^2.0.2\"\n    which \"^1.2.10\"\n\nnumber-is-nan@^1.0.0:\n  version \"1.0.1\"\n  resolved \"https://registry.npmjs.org/number-is-nan/-/number-is-nan-1.0.1.tgz\"\n  integrity sha1-CXtgK1NCKlIsGvuHkDGDNpQaAR0=\n\nobject-assign@^3.0.0:\n  version \"3.0.0\"\n  resolved \"https://registry.npmjs.org/object-assign/-/object-assign-3.0.0.tgz\"\n  integrity sha1-m+3VygiXlJvKR+f/QIBi1Un1h/I=\n\nobject-assign@^4.0.1, object-assign@^4.1.0:\n  version \"4.1.1\"\n  resolved \"https://registry.npmjs.org/object-assign/-/object-assign-4.1.1.tgz\"\n  integrity sha1-IQmtx5ZYh8/AXLvUQsrIv7s2CGM=\n\nobject.defaults@^1.1.0:\n  version \"1.1.0\"\n  resolved \"https://registry.npmjs.org/object.defaults/-/object.defaults-1.1.0.tgz\"\n  integrity sha1-On+GgzS0B96gbaFtiNXNKeQ1/s8=\n  dependencies:\n    array-each \"^1.0.1\"\n    array-slice \"^1.0.0\"\n    for-own \"^1.0.0\"\n    isobject \"^3.0.0\"\n\nobject.omit@^2.0.0:\n  version \"2.0.1\"\n  resolved \"https://registry.npmjs.org/object.omit/-/object.omit-2.0.1.tgz\"\n  integrity sha1-Gpx0SCnznbuFjHbKNXmuKlTr0fo=\n  dependencies:\n    for-own \"^0.1.4\"\n    is-extendable \"^0.1.1\"\n\nobject.pick@^1.2.0:\n  version \"1.3.0\"\n  resolved \"https://registry.npmjs.org/object.pick/-/object.pick-1.3.0.tgz\"\n  integrity sha1-h6EKxMFpS9Lhy/U1kaZhQftd10c=\n  dependencies:\n    isobject \"^3.0.1\"\n\non-finished@~2.3.0:\n  version \"2.3.0\"\n  resolved \"https://registry.npmjs.org/on-finished/-/on-finished-2.3.0.tgz\"\n  integrity sha1-IPEzZIGwg811M3mSoWlxqi2QaUc=\n  dependencies:\n    ee-first \"1.1.1\"\n\non-finished@2.1.0:\n  version \"2.1.0\"\n  resolved \"https://registry.npmjs.org/on-finished/-/on-finished-2.1.0.tgz\"\n  integrity sha1-DFOfCSkej/rd4MiiWFD7LO3HAi0=\n  dependencies:\n    ee-first \"1.0.5\"\n\nonce@^1.3.0:\n  version \"1.4.0\"\n  resolved \"https://registry.npmjs.org/once/-/once-1.4.0.tgz\"\n  integrity sha1-WDsap3WWHUsROsF9nFC6753Xa9E=\n  dependencies:\n    wrappy \"1\"\n\nonce@~1.3.0:\n  version \"1.3.3\"\n  resolved \"https://registry.npmjs.org/once/-/once-1.3.3.tgz\"\n  integrity sha1-suJhVXzkwxTsgwTz+oJmPkKXyiA=\n  dependencies:\n    wrappy \"1\"\n\nonetime@^1.0.0:\n  version \"1.1.0\"\n  resolved \"https://registry.npmjs.org/onetime/-/onetime-1.1.0.tgz\"\n  integrity sha1-ofeDj4MUxRbwXs78vEzP4EtO14k=\n\nopen@^0.0.5:\n  version \"0.0.5\"\n  resolved \"https://registry.npmjs.org/open/-/open-0.0.5.tgz\"\n  integrity sha1-QsPhjslUZra/DcQvOilFw/DK2Pw=\n\nopener@~1.4.0:\n  version \"1.4.3\"\n  resolved \"https://registry.npmjs.org/opener/-/opener-1.4.3.tgz\"\n  integrity sha512-4Im9TrPJcjAYyGR5gBe3yZnBzw5n3Bfh1ceHHGNOpMurINKc6RdSIPXMyon4BZacJbJc36lLkhipioGbWh5pwg==\n\noptimist@0.6.x:\n  version \"0.6.1\"\n  resolved \"https://registry.npmjs.org/optimist/-/optimist-0.6.1.tgz\"\n  integrity sha512-snN4O4TkigujZphWLN0E//nQmm7790RYaE53DdL7ZYwee2D8DDo9/EyYiKUfN3rneWUjhJnueija3G9I2i0h3g==\n  dependencies:\n    minimist \"~0.0.1\"\n    wordwrap \"~0.0.2\"\n\noptionator@^0.8.2:\n  version \"0.8.2\"\n  resolved \"https://registry.npmjs.org/optionator/-/optionator-0.8.2.tgz\"\n  integrity sha1-NkxeQJ0/TWMB1sC0wFu6UBgK62Q=\n  dependencies:\n    deep-is \"~0.1.3\"\n    fast-levenshtein \"~2.0.4\"\n    levn \"~0.3.0\"\n    prelude-ls \"~1.1.2\"\n    type-check \"~0.3.2\"\n    wordwrap \"~1.0.0\"\n\noptions@>=0.0.5:\n  version \"0.0.6\"\n  resolved \"https://registry.npmjs.org/options/-/options-0.0.6.tgz\"\n  integrity sha512-bOj3L1ypm++N+n7CEbbe473A414AB7z+amKYshRb//iuL3MpdDCLhPnw6aVTdKB9g5ZRVHIEp8eUln6L2NUStg==\n\nora@^0.2.3:\n  version \"0.2.3\"\n  resolved \"https://registry.npmjs.org/ora/-/ora-0.2.3.tgz\"\n  integrity sha1-N1J9Igrc1Tw5tzVx11QVbV22V6Q=\n  dependencies:\n    chalk \"^1.1.1\"\n    cli-cursor \"^1.0.2\"\n    cli-spinners \"^0.1.2\"\n    object-assign \"^4.0.1\"\n\norchestrator@^0.3.0:\n  version \"0.3.8\"\n  resolved \"https://registry.npmjs.org/orchestrator/-/orchestrator-0.3.8.tgz\"\n  integrity sha1-FOfp4nZPcxX7rBhOUGx6pt+UrX4=\n  dependencies:\n    end-of-stream \"~0.1.5\"\n    sequencify \"~0.0.7\"\n    stream-consume \"~0.1.0\"\n\nordered-read-streams@^0.1.0:\n  version \"0.1.0\"\n  resolved \"https://registry.npmjs.org/ordered-read-streams/-/ordered-read-streams-0.1.0.tgz\"\n  integrity sha1-/VZamvjrRHO6abbtijQ1LLVS8SY=\n\nos-homedir@^1.0.0, os-homedir@^1.0.1:\n  version \"1.0.2\"\n  resolved \"https://registry.npmjs.org/os-homedir/-/os-homedir-1.0.2.tgz\"\n  integrity sha1-/7xJiDNuDoM94MFox+8VISGqf7M=\n\nos-tmpdir@^1.0.1:\n  version \"1.0.2\"\n  resolved \"https://registry.npmjs.org/os-tmpdir/-/os-tmpdir-1.0.2.tgz\"\n  integrity sha1-u+Z0BseaqFxc/sdm/lc0VV36EnQ=\n\np-finally@^1.0.0:\n  version \"1.0.0\"\n  resolved \"https://registry.npmjs.org/p-finally/-/p-finally-1.0.0.tgz\"\n  integrity sha1-P7z7FbiZpEEjs0ttzBi3JDNqLK4=\n\np-map@^1.1.1:\n  version \"1.2.0\"\n  resolved \"https://registry.npmjs.org/p-map/-/p-map-1.2.0.tgz\"\n  integrity sha512-r6zKACMNhjPJMTl8KcFH4li//gkrXWfbD6feV8l6doRHlzljFWGJ2AP6iKaCJXyZmAUMOPtvbW7EXkbWO/pLEA==\n\nparse-filepath@^1.0.1:\n  version \"1.0.1\"\n  resolved \"https://registry.npmjs.org/parse-filepath/-/parse-filepath-1.0.1.tgz\"\n  integrity sha1-FZ1hVdQ5BNFsEO9piRHaHpGWm3M=\n  dependencies:\n    is-absolute \"^0.2.3\"\n    map-cache \"^0.2.0\"\n    path-root \"^0.1.1\"\n\nparse-glob@^3.0.4:\n  version \"3.0.4\"\n  resolved \"https://registry.npmjs.org/parse-glob/-/parse-glob-3.0.4.tgz\"\n  integrity sha1-ssN2z7EfNVE7rdFz7wu246OIORw=\n  dependencies:\n    glob-base \"^0.3.0\"\n    is-dotfile \"^1.0.0\"\n    is-extglob \"^1.0.0\"\n    is-glob \"^2.0.0\"\n\nparse-json@^2.2.0:\n  version \"2.2.0\"\n  resolved \"https://registry.npmjs.org/parse-json/-/parse-json-2.2.0.tgz\"\n  integrity sha1-9ID0BDTvgHQfhGkJn43qGPVaTck=\n  dependencies:\n    error-ex \"^1.2.0\"\n\nparse-passwd@^1.0.0:\n  version \"1.0.0\"\n  resolved \"https://registry.npmjs.org/parse-passwd/-/parse-passwd-1.0.0.tgz\"\n  integrity sha1-bVuTSkVpk7I9N/QKOC1vFmao5cY=\n\nparseurl@~1.3.0, parseurl@~1.3.1:\n  version \"1.3.1\"\n  resolved \"https://registry.npmjs.org/parseurl/-/parseurl-1.3.1.tgz\"\n  integrity sha1-yKuMkiO6NIiKpkopeyiFO+wY2lY=\n\npath-exists@^2.0.0:\n  version \"2.1.0\"\n  resolved \"https://registry.npmjs.org/path-exists/-/path-exists-2.1.0.tgz\"\n  integrity sha1-D+tsZPD8UY2adU3V77YscCJ2H0s=\n  dependencies:\n    pinkie-promise \"^2.0.0\"\n\npath-is-absolute@^1.0.0, path-is-absolute@^1.0.1:\n  version \"1.0.1\"\n  resolved \"https://registry.npmjs.org/path-is-absolute/-/path-is-absolute-1.0.1.tgz\"\n  integrity sha1-F0uSaHNVNP+8es5r9TpanhtcX18=\n\npath-is-inside@^1.0.1:\n  version \"1.0.2\"\n  resolved \"https://registry.npmjs.org/path-is-inside/-/path-is-inside-1.0.2.tgz\"\n  integrity sha1-NlQX3t5EQw0cEa9hAn+s8HS9/FM=\n\npath-key@^2.0.0:\n  version \"2.0.1\"\n  resolved \"https://registry.npmjs.org/path-key/-/path-key-2.0.1.tgz\"\n  integrity sha1-QRyttXTFoUDTpLGRDUDYDMn0C0A=\n\npath-parse@^1.0.5:\n  version \"1.0.5\"\n  resolved \"https://registry.npmjs.org/path-parse/-/path-parse-1.0.5.tgz\"\n  integrity sha1-PBrfhx6pzWyUMbbqK9dKD/BVxME=\n\npath-root-regex@^0.1.0:\n  version \"0.1.2\"\n  resolved \"https://registry.npmjs.org/path-root-regex/-/path-root-regex-0.1.2.tgz\"\n  integrity sha1-v8zcjfWxLcUsi0PsONGNcsBLqW0=\n\npath-root@^0.1.1:\n  version \"0.1.1\"\n  resolved \"https://registry.npmjs.org/path-root/-/path-root-0.1.1.tgz\"\n  integrity sha1-mkpoFMrBwM1zNgqV8yCDyOpHRbc=\n  dependencies:\n    path-root-regex \"^0.1.0\"\n\npath-type@^1.0.0:\n  version \"1.1.0\"\n  resolved \"https://registry.npmjs.org/path-type/-/path-type-1.1.0.tgz\"\n  integrity sha1-WcRPfuSR2nBNpBXaWkBwuk+P5EE=\n  dependencies:\n    graceful-fs \"^4.1.2\"\n    pify \"^2.0.0\"\n    pinkie-promise \"^2.0.0\"\n\npify@^2.0.0:\n  version \"2.3.0\"\n  resolved \"https://registry.npmjs.org/pify/-/pify-2.3.0.tgz\"\n  integrity sha1-7RQaasBDqEnqWISY59yosVMw6Qw=\n\npinkie-promise@^2.0.0:\n  version \"2.0.1\"\n  resolved \"https://registry.npmjs.org/pinkie-promise/-/pinkie-promise-2.0.1.tgz\"\n  integrity sha1-ITXW36ejWMBprJsXh3YogihFD/o=\n  dependencies:\n    pinkie \"^2.0.0\"\n\npinkie@^2.0.0:\n  version \"2.0.4\"\n  resolved \"https://registry.npmjs.org/pinkie/-/pinkie-2.0.4.tgz\"\n  integrity sha1-clVrgM+g1IqXToDnckjoDtT3+HA=\n\npluralize@^1.2.1:\n  version \"1.2.1\"\n  resolved \"https://registry.npmjs.org/pluralize/-/pluralize-1.2.1.tgz\"\n  integrity sha1-0aIUg/0iu0HlihL6NCGCMUCJfEU=\n\nportfinder@0.2.x:\n  version \"0.2.1\"\n  resolved \"https://registry.npmjs.org/portfinder/-/portfinder-0.2.1.tgz\"\n  integrity sha512-U7dHe7mfMMP5cIwbqBHh/likunxAEiBsQLiThUWjyeRK6/C3um2uk+VGiekUW8q3h+s793gdNfagCM3aaXMeOg==\n  dependencies:\n    mkdirp \"0.0.x\"\n\nprelude-ls@~1.1.2:\n  version \"1.1.2\"\n  resolved \"https://registry.npmjs.org/prelude-ls/-/prelude-ls-1.1.2.tgz\"\n  integrity sha1-IZMqVJ9eUv/ZqCf1cOBL5iqX2lQ=\n\npreserve@^0.2.0:\n  version \"0.2.0\"\n  resolved \"https://registry.npmjs.org/preserve/-/preserve-0.2.0.tgz\"\n  integrity sha1-gV7R9uvGWSb4ZbMQwHE7yzMVzks=\n\nprettier@^1.7.4:\n  version \"1.7.4\"\n  resolved \"https://registry.npmjs.org/prettier/-/prettier-1.7.4.tgz\"\n  integrity sha1-XoYkrpNjyA+V7GRFhOzfVddPk/o=\n\npretty-format@^21.2.1:\n  version \"21.2.1\"\n  resolved \"https://registry.npmjs.org/pretty-format/-/pretty-format-21.2.1.tgz\"\n  integrity sha512-ZdWPGYAnYfcVP8yKA3zFjCn8s4/17TeYH28MXuC8vTp0o21eXjbFGcOAXZEaDaOFJjc3h2qa7HQNHNshhvoh2A==\n  dependencies:\n    ansi-regex \"^3.0.0\"\n    ansi-styles \"^3.2.0\"\n\npretty-hrtime@^1.0.0:\n  version \"1.0.3\"\n  resolved \"https://registry.npmjs.org/pretty-hrtime/-/pretty-hrtime-1.0.3.tgz\"\n  integrity sha1-t+PqQkNaTJsnWdmeDyAesZWALuE=\n\nprivate@^0.1.6, private@^0.1.7:\n  version \"0.1.7\"\n  resolved \"https://registry.npmjs.org/private/-/private-0.1.7.tgz\"\n  integrity sha1-aM5eih7woju1cMwoU3tTMqumPvE=\n\nprocess-nextick-args@~1.0.6:\n  version \"1.0.7\"\n  resolved \"https://registry.npmjs.org/process-nextick-args/-/process-nextick-args-1.0.7.tgz\"\n  integrity sha1-FQ4gt1ZZCtP5EJPyWk8q2L/zC6M=\n\nprogress@^1.1.8:\n  version \"1.1.8\"\n  resolved \"https://registry.npmjs.org/progress/-/progress-1.1.8.tgz\"\n  integrity sha1-4mDHj2Fhzdmw5WzD4Khd4Xx6V74=\n\nproxy-middleware@^0.5.0:\n  version \"0.5.1\"\n  resolved \"https://registry.npmjs.org/proxy-middleware/-/proxy-middleware-0.5.1.tgz\"\n  integrity sha1-2iTV1Ywd3xPa0jfH7KUDhJ6uqQM=\n\npseudomap@^1.0.2:\n  version \"1.0.2\"\n  resolved \"https://registry.npmjs.org/pseudomap/-/pseudomap-1.0.2.tgz\"\n  integrity sha1-8FKijacOYYkX7wqKw0wa5aaChrM=\n\nqs@~2.2.3:\n  version \"2.2.5\"\n  resolved \"https://registry.npmjs.org/qs/-/qs-2.2.5.tgz\"\n  integrity sha1-EIirr53MCuWuRbcJ5sa1iIsjkjw=\n\nqs@~2.3.3:\n  version \"2.3.3\"\n  resolved \"https://registry.npmjs.org/qs/-/qs-2.3.3.tgz\"\n  integrity sha512-f5M0HQqZWkzU8GELTY8LyMrGkr3bPjKoFtTkwUEqJQbcljbeK8M7mliP9Ia2xoOI6oMerp+QPS7oYJtpGmWe/A==\n\nqs@2.2.4:\n  version \"2.2.4\"\n  resolved \"https://registry.npmjs.org/qs/-/qs-2.2.4.tgz\"\n  integrity sha1-Lp+800tUDjQhySTs0B6QqpdTGcg=\n\nrandomatic@^1.1.3:\n  version \"1.1.7\"\n  resolved \"https://registry.npmjs.org/randomatic/-/randomatic-1.1.7.tgz\"\n  integrity sha512-D5JUjPyJbaJDkuAazpVnSfVkLlpeO3wDlPROTMLGKG1zMFNFRgrciKo1ltz/AzNTkqE0HzDx655QOL51N06how==\n  dependencies:\n    is-number \"^3.0.0\"\n    kind-of \"^4.0.0\"\n\nrange-parser@~1.2.0:\n  version \"1.2.0\"\n  resolved \"https://registry.npmjs.org/range-parser/-/range-parser-1.2.0.tgz\"\n  integrity sha1-9JvmtIeJTdxA3MlKMi9hEJLgDV4=\n\nraw-body@1.3.0:\n  version \"1.3.0\"\n  resolved \"https://registry.npmjs.org/raw-body/-/raw-body-1.3.0.tgz\"\n  integrity sha1-l4IwoValVI9C7vFN4i0PT2EAg9E=\n  dependencies:\n    bytes \"1\"\n    iconv-lite \"0.4.4\"\n\nread-pkg-up@^1.0.1:\n  version \"1.0.1\"\n  resolved \"https://registry.npmjs.org/read-pkg-up/-/read-pkg-up-1.0.1.tgz\"\n  integrity sha1-nWPBMnbAZZGNV/ACpX9AobZD+wI=\n  dependencies:\n    find-up \"^1.0.0\"\n    read-pkg \"^1.0.0\"\n\nread-pkg@^1.0.0:\n  version \"1.1.0\"\n  resolved \"https://registry.npmjs.org/read-pkg/-/read-pkg-1.1.0.tgz\"\n  integrity sha1-9f+qXs0pyzHAR0vKfXVra7KePyg=\n  dependencies:\n    load-json-file \"^1.0.0\"\n    normalize-package-data \"^2.3.2\"\n    path-type \"^1.0.0\"\n\nreadable-stream@^2.1.5, readable-stream@^2.2.2:\n  version \"2.3.3\"\n  resolved \"https://registry.npmjs.org/readable-stream/-/readable-stream-2.3.3.tgz\"\n  integrity sha512-m+qzzcn7KUxEmd1gMbchF+Y2eIUbieUaxkWtptyHywrX0rE8QEYqPC07Vuy4Wm32/xE16NcdBctb8S0Xe/5IeQ==\n  dependencies:\n    core-util-is \"~1.0.0\"\n    inherits \"~2.0.3\"\n    isarray \"~1.0.0\"\n    process-nextick-args \"~1.0.6\"\n    safe-buffer \"~5.1.1\"\n    string_decoder \"~1.0.3\"\n    util-deprecate \"~1.0.1\"\n\n\"readable-stream@>=1.0.33-1 <1.1.0-0\":\n  version \"1.0.34\"\n  resolved \"https://registry.npmjs.org/readable-stream/-/readable-stream-1.0.34.tgz\"\n  integrity sha1-Elgg40vIQtLyqq+v5MKRbuMsFXw=\n  dependencies:\n    core-util-is \"~1.0.0\"\n    inherits \"~2.0.1\"\n    isarray \"0.0.1\"\n    string_decoder \"~0.10.x\"\n\nreadable-stream@~1.0.17:\n  version \"1.0.34\"\n  resolved \"https://registry.npmjs.org/readable-stream/-/readable-stream-1.0.34.tgz\"\n  integrity sha1-Elgg40vIQtLyqq+v5MKRbuMsFXw=\n  dependencies:\n    core-util-is \"~1.0.0\"\n    inherits \"~2.0.1\"\n    isarray \"0.0.1\"\n    string_decoder \"~0.10.x\"\n\nreadable-stream@~1.0.26-2:\n  version \"1.0.34\"\n  resolved \"https://registry.npmjs.org/readable-stream/-/readable-stream-1.0.34.tgz\"\n  integrity sha512-ok1qVCJuRkNmvebYikljxJA/UEsKwLl2nI1OmaqAu4/UE+h0wKCHok4XkL/gvi39OacXvw59RJUOFUkDib2rHg==\n  dependencies:\n    core-util-is \"~1.0.0\"\n    inherits \"~2.0.1\"\n    isarray \"0.0.1\"\n    string_decoder \"~0.10.x\"\n\nreadable-stream@~1.1.9:\n  version \"1.1.14\"\n  resolved \"https://registry.npmjs.org/readable-stream/-/readable-stream-1.1.14.tgz\"\n  integrity sha1-fPTFTvZI44EwhMY23SB54WbAgdk=\n  dependencies:\n    core-util-is \"~1.0.0\"\n    inherits \"~2.0.1\"\n    isarray \"0.0.1\"\n    string_decoder \"~0.10.x\"\n\nreaddirp@~1.3.0:\n  version \"1.3.0\"\n  resolved \"https://registry.npmjs.org/readdirp/-/readdirp-1.3.0.tgz\"\n  integrity sha512-H1BGeo9VW8nmdwGo64SKRQgNNZwEuqtVUHijOoTDYIpqJGNKU65JaRXL3iqa/8tmVJ9jfoKY+soTznq0cOruTw==\n  dependencies:\n    graceful-fs \"~2.0.0\"\n    minimatch \"~0.2.12\"\n    readable-stream \"~1.0.26-2\"\n\nreadline2@^1.0.1:\n  version \"1.0.1\"\n  resolved \"https://registry.npmjs.org/readline2/-/readline2-1.0.1.tgz\"\n  integrity sha1-QQWWCP/BVHV7cV2ZidGZ/783LjU=\n  dependencies:\n    code-point-at \"^1.0.0\"\n    is-fullwidth-code-point \"^1.0.0\"\n    mute-stream \"0.0.5\"\n\nrechoir@^0.6.2:\n  version \"0.6.2\"\n  resolved \"https://registry.npmjs.org/rechoir/-/rechoir-0.6.2.tgz\"\n  integrity sha1-hSBLVNuoLVdC4oyWdW70OvUOM4Q=\n  dependencies:\n    resolve \"^1.1.6\"\n\nredent@^1.0.0:\n  version \"1.0.0\"\n  resolved \"https://registry.npmjs.org/redent/-/redent-1.0.0.tgz\"\n  integrity sha1-z5Fqsf1fHxbfsggi3W7H9zDCr94=\n  dependencies:\n    indent-string \"^2.1.0\"\n    strip-indent \"^1.0.1\"\n\nregenerate@^1.2.1:\n  version \"1.3.2\"\n  resolved \"https://registry.npmjs.org/regenerate/-/regenerate-1.3.2.tgz\"\n  integrity sha1-0ZQcZ7rUN+G+dkM63Vs4X5WxkmA=\n\nregenerator-runtime@^0.11.0:\n  version \"0.11.0\"\n  resolved \"https://registry.npmjs.org/regenerator-runtime/-/regenerator-runtime-0.11.0.tgz\"\n  integrity sha512-/aA0kLeRb5N9K0d4fw7ooEbI+xDe+DKD499EQqygGqeS8N3xto15p09uY2xj7ixP81sNPXvRLnAQIqdVStgb1A==\n\nregenerator-transform@^0.10.0:\n  version \"0.10.1\"\n  resolved \"https://registry.npmjs.org/regenerator-transform/-/regenerator-transform-0.10.1.tgz\"\n  integrity sha512-PJepbvDbuK1xgIgnau7Y90cwaAmO/LCLMI2mPvaXq2heGMR3aWW5/BQvYrhJ8jgmQjXewXvBjzfqKcVOmhjZ6Q==\n  dependencies:\n    babel-runtime \"^6.18.0\"\n    babel-types \"^6.19.0\"\n    private \"^0.1.6\"\n\nregex-cache@^0.4.2:\n  version \"0.4.4\"\n  resolved \"https://registry.npmjs.org/regex-cache/-/regex-cache-0.4.4.tgz\"\n  integrity sha512-nVIZwtCjkC9YgvWkpM55B5rBhBYRZhAaJbgcFYXXsHnbZ9UZI9nnVWYZpBlCqv9ho2eZryPnWrZGsOdPwVWXWQ==\n  dependencies:\n    is-equal-shallow \"^0.1.3\"\n\nregexpu-core@^2.0.0:\n  version \"2.0.0\"\n  resolved \"https://registry.npmjs.org/regexpu-core/-/regexpu-core-2.0.0.tgz\"\n  integrity sha1-SdA4g3uNz4v6W5pCE5k45uoq4kA=\n  dependencies:\n    regenerate \"^1.2.1\"\n    regjsgen \"^0.2.0\"\n    regjsparser \"^0.1.4\"\n\nregjsgen@^0.2.0:\n  version \"0.2.0\"\n  resolved \"https://registry.npmjs.org/regjsgen/-/regjsgen-0.2.0.tgz\"\n  integrity sha1-bAFq3qxVT3WCP+N6wFuS1aTtsfc=\n\nregjsparser@^0.1.4:\n  version \"0.1.5\"\n  resolved \"https://registry.npmjs.org/regjsparser/-/regjsparser-0.1.5.tgz\"\n  integrity sha1-fuj4Tcb6eS0/0K4ijSS9lJ6tIFw=\n  dependencies:\n    jsesc \"~0.5.0\"\n\nremove-trailing-separator@^1.0.1:\n  version \"1.1.0\"\n  resolved \"https://registry.npmjs.org/remove-trailing-separator/-/remove-trailing-separator-1.1.0.tgz\"\n  integrity sha1-wkvOKig62tW8P1jg1IJJuSN52O8=\n\nrepeat-element@^1.1.2:\n  version \"1.1.2\"\n  resolved \"https://registry.npmjs.org/repeat-element/-/repeat-element-1.1.2.tgz\"\n  integrity sha1-7wiaF40Ug7quTZPrmLT55OEdmQo=\n\nrepeat-string@^1.5.2:\n  version \"1.6.1\"\n  resolved \"https://registry.npmjs.org/repeat-string/-/repeat-string-1.6.1.tgz\"\n  integrity sha1-jcrkcOHIirwtYA//Sndihtp15jc=\n\nrepeating@^2.0.0:\n  version \"2.0.1\"\n  resolved \"https://registry.npmjs.org/repeating/-/repeating-2.0.1.tgz\"\n  integrity sha1-UhTFOpJtNVJwdSf7q0FdvAjQbdo=\n  dependencies:\n    is-finite \"^1.0.0\"\n\nreplace-ext@0.0.1:\n  version \"0.0.1\"\n  resolved \"https://registry.npmjs.org/replace-ext/-/replace-ext-0.0.1.tgz\"\n  integrity sha1-KbvZIHinOfC8zitO5B6DeVNSKSQ=\n\nrequire-from-string@^1.1.0:\n  version \"1.2.1\"\n  resolved \"https://registry.npmjs.org/require-from-string/-/require-from-string-1.2.1.tgz\"\n  integrity sha1-UpyczvJzgK3+yaL5ZbZJu+5jZBg=\n\nrequire-relative@0.8.7:\n  version \"0.8.7\"\n  resolved \"https://registry.npmjs.org/require-relative/-/require-relative-0.8.7.tgz\"\n  integrity sha1-eZlTn8ngR6N5KPoZb44VY9q9Nt4=\n\nrequire-uncached@^1.0.2:\n  version \"1.0.3\"\n  resolved \"https://registry.npmjs.org/require-uncached/-/require-uncached-1.0.3.tgz\"\n  integrity sha1-Tg1W1slmL9MeQwEcS5WqSZVUIdM=\n  dependencies:\n    caller-path \"^0.1.0\"\n    resolve-from \"^1.0.0\"\n\nresolve-dir@^0.1.0:\n  version \"0.1.1\"\n  resolved \"https://registry.npmjs.org/resolve-dir/-/resolve-dir-0.1.1.tgz\"\n  integrity sha1-shklmlYC+sXFxJatiUpujMQwJh4=\n  dependencies:\n    expand-tilde \"^1.2.2\"\n    global-modules \"^0.2.3\"\n\nresolve-from@^1.0.0:\n  version \"1.0.1\"\n  resolved \"https://registry.npmjs.org/resolve-from/-/resolve-from-1.0.1.tgz\"\n  integrity sha1-Jsv+k10a7uq7Kbw/5a6wHpPUQiY=\n\nresolve@^1.1.6, resolve@^1.1.7:\n  version \"1.4.0\"\n  resolved \"https://registry.npmjs.org/resolve/-/resolve-1.4.0.tgz\"\n  integrity sha512-aW7sVKPufyHqOmyyLzg/J+8606v5nevBgaliIlV7nUpVMsDnoBGV/cbSLNjZAg9q0Cfd/+easKVKQ8vOu8fn1Q==\n  dependencies:\n    path-parse \"^1.0.5\"\n\nrestore-cursor@^1.0.1:\n  version \"1.0.1\"\n  resolved \"https://registry.npmjs.org/restore-cursor/-/restore-cursor-1.0.1.tgz\"\n  integrity sha1-NGYfRohjJ/7SmRR5FSJS35LapUE=\n  dependencies:\n    exit-hook \"^1.0.0\"\n    onetime \"^1.0.0\"\n\nrimraf@^2.2.8:\n  version \"2.6.1\"\n  resolved \"https://registry.npmjs.org/rimraf/-/rimraf-2.6.1.tgz\"\n  integrity sha1-wjOOxkPfeht/5cVPqG9XQopV8z0=\n  dependencies:\n    glob \"^7.0.5\"\n\nrollup-plugin-babel@^2.7.1:\n  version \"2.7.1\"\n  resolved \"https://registry.npmjs.org/rollup-plugin-babel/-/rollup-plugin-babel-2.7.1.tgz\"\n  integrity sha1-FlKBl7D5OKFTb0RoPHqT1XMYL1c=\n  dependencies:\n    babel-core \"6\"\n    babel-plugin-transform-es2015-classes \"^6.9.0\"\n    object-assign \"^4.1.0\"\n    rollup-pluginutils \"^1.5.0\"\n\nrollup-plugin-uglify@^2.0.1:\n  version \"2.0.1\"\n  resolved \"https://registry.npmjs.org/rollup-plugin-uglify/-/rollup-plugin-uglify-2.0.1.tgz\"\n  integrity sha1-Z7N60e/a+9g69MNrQMGJ7khmyWk=\n  dependencies:\n    uglify-js \"^3.0.9\"\n\nrollup-pluginutils@^1.5.0:\n  version \"1.5.2\"\n  resolved \"https://registry.npmjs.org/rollup-pluginutils/-/rollup-pluginutils-1.5.2.tgz\"\n  integrity sha1-HhVud4+UtyVb+hs9AXi+j1xVJAg=\n  dependencies:\n    estree-walker \"^0.2.1\"\n    minimatch \"^3.0.2\"\n\nrollup-watch@^3.2.2:\n  version \"3.2.2\"\n  resolved \"https://registry.npmjs.org/rollup-watch/-/rollup-watch-3.2.2.tgz\"\n  integrity sha1-XldCMunvNtqRd/RpRtgIDLJnNUs=\n  dependencies:\n    require-relative \"0.8.7\"\n\nrollup@^0.41.4:\n  version \"0.41.6\"\n  resolved \"https://registry.npmjs.org/rollup/-/rollup-0.41.6.tgz\"\n  integrity sha1-4NBUl4d6OYwQTYFtJzOnGKepTio=\n  dependencies:\n    source-map-support \"^0.4.0\"\n\nrun-async@^0.1.0:\n  version \"0.1.0\"\n  resolved \"https://registry.npmjs.org/run-async/-/run-async-0.1.0.tgz\"\n  integrity sha1-yK1KXhEGYeQCp9IbUw4AnyX444k=\n  dependencies:\n    once \"^1.3.0\"\n\nrx-lite@^3.1.2:\n  version \"3.1.2\"\n  resolved \"https://registry.npmjs.org/rx-lite/-/rx-lite-3.1.2.tgz\"\n  integrity sha1-Gc5QLKVyZl87ZHsQk5+X/RYV8QI=\n\nrx@2.3.24:\n  version \"2.3.24\"\n  resolved \"https://registry.npmjs.org/rx/-/rx-2.3.24.tgz\"\n  integrity sha1-FPlQpCF9fjXapxu8vljv9o6ksrc=\n\nrxjs@^5.0.0-beta.11:\n  version \"5.5.0\"\n  resolved \"https://registry.npmjs.org/rxjs/-/rxjs-5.5.0.tgz\"\n  integrity sha512-vmvP5y/oJIJmXKHY36PIjVeI/46Sny6BMBa7/ou2zsNz1PiqU/Gtcz1GujnHz5Qlxncv+J9VlWmttnshqFj3Kg==\n  dependencies:\n    symbol-observable \"^1.0.1\"\n\nsafe-buffer@~5.1.0, safe-buffer@~5.1.1:\n  version \"5.1.1\"\n  resolved \"https://registry.npmjs.org/safe-buffer/-/safe-buffer-5.1.1.tgz\"\n  integrity sha512-kKvNJn6Mm93gAczWVJg7wH+wGYWNrDHdWvpUmHyEsgCtIwwo3bqPtV4tR5tuPaUhTOo/kvhVwd8XwwOllGYkbg==\n\nsemver@^4.1.0, \"semver@2 || 3 || 4 || 5\":\n  version \"4.3.6\"\n  resolved \"https://registry.npmjs.org/semver/-/semver-4.3.6.tgz\"\n  integrity sha1-MAvG4OhjdPe6YQaLWx7NV/xlMto=\n\nsend@0.15.4:\n  version \"0.15.4\"\n  resolved \"https://registry.npmjs.org/send/-/send-0.15.4.tgz\"\n  integrity sha1-mF+qPihLAnPHkzZKNcZze9k5Bbk=\n  dependencies:\n    debug \"2.6.8\"\n    depd \"~1.1.1\"\n    destroy \"~1.0.4\"\n    encodeurl \"~1.0.1\"\n    escape-html \"~1.0.3\"\n    etag \"~1.8.0\"\n    fresh \"0.5.0\"\n    http-errors \"~1.6.2\"\n    mime \"1.3.4\"\n    ms \"2.0.0\"\n    on-finished \"~2.3.0\"\n    range-parser \"~1.2.0\"\n    statuses \"~1.3.1\"\n\nsequencify@~0.0.7:\n  version \"0.0.7\"\n  resolved \"https://registry.npmjs.org/sequencify/-/sequencify-0.0.7.tgz\"\n  integrity sha1-kM/xnQLgcCf9dn9erT57ldHnOAw=\n\nserve-index@^1.1.4:\n  version \"1.9.0\"\n  resolved \"https://registry.npmjs.org/serve-index/-/serve-index-1.9.0.tgz\"\n  integrity sha1-0rKA/FYNYW7oG0i/D6gqvtJIXOc=\n  dependencies:\n    accepts \"~1.3.3\"\n    batch \"0.6.1\"\n    debug \"2.6.8\"\n    escape-html \"~1.0.3\"\n    http-errors \"~1.6.1\"\n    mime-types \"~2.1.15\"\n    parseurl \"~1.3.1\"\n\nserve-static@^1.3.0:\n  version \"1.12.4\"\n  resolved \"https://registry.npmjs.org/serve-static/-/serve-static-1.12.4.tgz\"\n  integrity sha1-m2qpjutyU8Tu3Ewfb9vKYJkBqWE=\n  dependencies:\n    encodeurl \"~1.0.1\"\n    escape-html \"~1.0.3\"\n    parseurl \"~1.3.1\"\n    send \"0.15.4\"\n\nsetprototypeof@1.0.3:\n  version \"1.0.3\"\n  resolved \"https://registry.npmjs.org/setprototypeof/-/setprototypeof-1.0.3.tgz\"\n  integrity sha1-ZlZ+NwQ+608E2RvWWMDL77VbjgQ=\n\nsexstatic@~0.6.x:\n  version \"0.6.2\"\n  resolved \"https://registry.npmjs.org/sexstatic/-/sexstatic-0.6.2.tgz\"\n  integrity sha512-r/E1YWB6q6/SYepc8cdn1lk/CdAXYvVqohGNYbkhPMmqdhhJlHEgcchBqSKHfph46aLW7QDTHuV7O9sXstsASQ==\n  dependencies:\n    he \"~0.4.1\"\n    mime \"1.2.x\"\n    minimist \"~0.0.5\"\n\nshebang-command@^1.2.0:\n  version \"1.2.0\"\n  resolved \"https://registry.npmjs.org/shebang-command/-/shebang-command-1.2.0.tgz\"\n  integrity sha1-RKrGW2lbAzmJaMOfNj/uXer98eo=\n  dependencies:\n    shebang-regex \"^1.0.0\"\n\nshebang-regex@^1.0.0:\n  version \"1.0.0\"\n  resolved \"https://registry.npmjs.org/shebang-regex/-/shebang-regex-1.0.0.tgz\"\n  integrity sha1-2kL0l0DAtC2yypcoVxyxkMmO/qM=\n\nshelljs@^0.7.5:\n  version \"0.7.8\"\n  resolved \"https://registry.npmjs.org/shelljs/-/shelljs-0.7.8.tgz\"\n  integrity sha1-3svPh0sNHl+3LhSxZKloMEjprLM=\n  dependencies:\n    glob \"^7.0.0\"\n    interpret \"^1.0.0\"\n    rechoir \"^0.6.2\"\n\nsigmund@~1.0.0:\n  version \"1.0.1\"\n  resolved \"https://registry.npmjs.org/sigmund/-/sigmund-1.0.1.tgz\"\n  integrity sha1-P/IfGYytIXX587eBhT/ZTQ0ZtZA=\n\nsignal-exit@^3.0.0:\n  version \"3.0.2\"\n  resolved \"https://registry.npmjs.org/signal-exit/-/signal-exit-3.0.2.tgz\"\n  integrity sha1-tf3AjxKH6hF4Yo5BXiUTK3NkbG0=\n\nslash@^1.0.0:\n  version \"1.0.0\"\n  resolved \"https://registry.npmjs.org/slash/-/slash-1.0.0.tgz\"\n  integrity sha1-xB8vbDn8FtHNF61LXYlhFK5HDVU=\n\nslice-ansi@0.0.4:\n  version \"0.0.4\"\n  resolved \"https://registry.npmjs.org/slice-ansi/-/slice-ansi-0.0.4.tgz\"\n  integrity sha1-7b+JA/ZvfOL46v1s7tZeJkyDGzU=\n\nsource-map-support@^0.4.0, source-map-support@^0.4.15:\n  version \"0.4.17\"\n  resolved \"https://registry.npmjs.org/source-map-support/-/source-map-support-0.4.17.tgz\"\n  integrity sha512-30c1Ch8FSjV0FwC253iftbbj0dU/OXoSg1LAEGZJUlGgjTNj6cu+DVqJWWIZJY5RXLWV4eFtR+4ouo0VIOYOTg==\n  dependencies:\n    source-map \"^0.5.6\"\n\nsource-map@^0.5.6, source-map@~0.5.1:\n  version \"0.5.7\"\n  resolved \"https://registry.npmjs.org/source-map/-/source-map-0.5.7.tgz\"\n  integrity sha1-igOdLRAh0i0eoUyA2OpGi6LvP8w=\n\nsparkles@^1.0.0:\n  version \"1.0.0\"\n  resolved \"https://registry.npmjs.org/sparkles/-/sparkles-1.0.0.tgz\"\n  integrity sha1-Gsu/tZJDbRC76PeFt8xvgoFQEsM=\n\nspawn-command@^0.0.2-1:\n  version \"0.0.2-1\"\n  resolved \"https://registry.npmjs.org/spawn-command/-/spawn-command-0.0.2-1.tgz\"\n  integrity sha1-YvXpRmmBwbeW3Fkpk34RycaSG9A=\n\nspdx-correct@~1.0.0:\n  version \"1.0.2\"\n  resolved \"https://registry.npmjs.org/spdx-correct/-/spdx-correct-1.0.2.tgz\"\n  integrity sha1-SzBz2TP/UfORLwOsVRlJikFQ20A=\n  dependencies:\n    spdx-license-ids \"^1.0.2\"\n\nspdx-expression-parse@~1.0.0:\n  version \"1.0.4\"\n  resolved \"https://registry.npmjs.org/spdx-expression-parse/-/spdx-expression-parse-1.0.4.tgz\"\n  integrity sha1-m98vIOH0DtRH++JzJmGR/O1RYmw=\n\nspdx-license-ids@^1.0.2:\n  version \"1.2.2\"\n  resolved \"https://registry.npmjs.org/spdx-license-ids/-/spdx-license-ids-1.2.2.tgz\"\n  integrity sha1-yd96NCRZSt5r0RkA1ZZpbcBrrFc=\n\nsprintf-js@~1.0.2:\n  version \"1.0.3\"\n  resolved \"https://registry.npmjs.org/sprintf-js/-/sprintf-js-1.0.3.tgz\"\n  integrity sha1-BOaSb2YolTVPPdAVIDYzuFcpfiw=\n\nstaged-git-files@0.0.4:\n  version \"0.0.4\"\n  resolved \"https://registry.npmjs.org/staged-git-files/-/staged-git-files-0.0.4.tgz\"\n  integrity sha1-15fhtVHKemOd7AI33G60u5vhfTU=\n\n\"statuses@>= 1.3.1 < 2\", statuses@~1.3.1:\n  version \"1.3.1\"\n  resolved \"https://registry.npmjs.org/statuses/-/statuses-1.3.1.tgz\"\n  integrity sha1-+vUbnrdKrvOzrPStX2Gr8ky3uT4=\n\nstream-consume@~0.1.0:\n  version \"0.1.0\"\n  resolved \"https://registry.npmjs.org/stream-consume/-/stream-consume-0.1.0.tgz\"\n  integrity sha1-pB6tGm1ggc63n2WwYZAbbY89HQ8=\n\nstream-to-observable@^0.1.0:\n  version \"0.1.0\"\n  resolved \"https://registry.npmjs.org/stream-to-observable/-/stream-to-observable-0.1.0.tgz\"\n  integrity sha1-Rb8dny19wJvtgfHDB8Qw5ouEz/4=\n\nstring_decoder@~0.10.x:\n  version \"0.10.31\"\n  resolved \"https://registry.npmjs.org/string_decoder/-/string_decoder-0.10.31.tgz\"\n  integrity sha1-YuIDvEF2bGwoyfyEMB2rHFMQ+pQ=\n\nstring_decoder@~1.0.3:\n  version \"1.0.3\"\n  resolved \"https://registry.npmjs.org/string_decoder/-/string_decoder-1.0.3.tgz\"\n  integrity sha512-4AH6Z5fzNNBcH+6XDMfA/BTt87skxqJlO0lAh3Dker5zThcAxG6mKz+iGu308UKoPPQ8Dcqx/4JhujzltRa+hQ==\n  dependencies:\n    safe-buffer \"~5.1.0\"\n\nstring-width@^1.0.1:\n  version \"1.0.2\"\n  resolved \"https://registry.npmjs.org/string-width/-/string-width-1.0.2.tgz\"\n  integrity sha1-EYvfW4zcUaKn5w0hHgfisLmxB9M=\n  dependencies:\n    code-point-at \"^1.0.0\"\n    is-fullwidth-code-point \"^1.0.0\"\n    strip-ansi \"^3.0.0\"\n\nstring-width@^2.0.0:\n  version \"2.1.1\"\n  resolved \"https://registry.npmjs.org/string-width/-/string-width-2.1.1.tgz\"\n  integrity sha512-nOqH59deCq9SRHlxq1Aw85Jnt4w6KvLKqWVik6oA9ZklXLNIOlqg4F2yrT1MVaTjAqvVwdfeZ7w7aCvJD7ugkw==\n  dependencies:\n    is-fullwidth-code-point \"^2.0.0\"\n    strip-ansi \"^4.0.0\"\n\nstringify-object@^3.2.0:\n  version \"3.2.1\"\n  resolved \"https://registry.npmjs.org/stringify-object/-/stringify-object-3.2.1.tgz\"\n  integrity sha512-jPcQYw/52HUPP8uOE4kkjxl5bB9LfHkKCTptIk3qw7ozP5XMIMlHMLjt00GGSwW6DJAf/njY5EU6Vpwl4LlBKQ==\n  dependencies:\n    get-own-enumerable-property-symbols \"^2.0.1\"\n    is-obj \"^1.0.1\"\n    is-regexp \"^1.0.0\"\n\nstrip-ansi@^0.3.0:\n  version \"0.3.0\"\n  resolved \"https://registry.npmjs.org/strip-ansi/-/strip-ansi-0.3.0.tgz\"\n  integrity sha1-JfSOoiynkYfzF0pNuHWTR7sSYiA=\n  dependencies:\n    ansi-regex \"^0.2.1\"\n\nstrip-ansi@^3.0.0, strip-ansi@^3.0.1:\n  version \"3.0.1\"\n  resolved \"https://registry.npmjs.org/strip-ansi/-/strip-ansi-3.0.1.tgz\"\n  integrity sha1-ajhfuIU9lS1f8F0Oiq+UJ43GPc8=\n  dependencies:\n    ansi-regex \"^2.0.0\"\n\nstrip-ansi@^4.0.0:\n  version \"4.0.0\"\n  resolved \"https://registry.npmjs.org/strip-ansi/-/strip-ansi-4.0.0.tgz\"\n  integrity sha1-qEeQIusaw2iocTibY1JixQXuNo8=\n  dependencies:\n    ansi-regex \"^3.0.0\"\n\nstrip-bom@^1.0.0:\n  version \"1.0.0\"\n  resolved \"https://registry.npmjs.org/strip-bom/-/strip-bom-1.0.0.tgz\"\n  integrity sha1-hbiGLzhEtabV7IRnqTWYFzo295Q=\n  dependencies:\n    first-chunk-stream \"^1.0.0\"\n    is-utf8 \"^0.2.0\"\n\nstrip-bom@^2.0.0:\n  version \"2.0.0\"\n  resolved \"https://registry.npmjs.org/strip-bom/-/strip-bom-2.0.0.tgz\"\n  integrity sha1-YhmoVhZSBJHzV4i9vxRHqZx+aw4=\n  dependencies:\n    is-utf8 \"^0.2.0\"\n\nstrip-bom@^3.0.0:\n  version \"3.0.0\"\n  resolved \"https://registry.npmjs.org/strip-bom/-/strip-bom-3.0.0.tgz\"\n  integrity sha1-IzTBjpx1n3vdVv3vfprj1YjmjtM=\n\nstrip-eof@^1.0.0:\n  version \"1.0.0\"\n  resolved \"https://registry.npmjs.org/strip-eof/-/strip-eof-1.0.0.tgz\"\n  integrity sha1-u0P/VZim6wXYm1n80SnJgzE2Br8=\n\nstrip-indent@^1.0.1:\n  version \"1.0.1\"\n  resolved \"https://registry.npmjs.org/strip-indent/-/strip-indent-1.0.1.tgz\"\n  integrity sha1-DHlipq3vp7vUrDZkYKY4VSrhoKI=\n  dependencies:\n    get-stdin \"^4.0.1\"\n\nstrip-indent@^2.0.0:\n  version \"2.0.0\"\n  resolved \"https://registry.npmjs.org/strip-indent/-/strip-indent-2.0.0.tgz\"\n  integrity sha1-XvjbKV0B5u1sv3qrlpmNeCJSe2g=\n\nstrip-json-comments@~2.0.1:\n  version \"2.0.1\"\n  resolved \"https://registry.npmjs.org/strip-json-comments/-/strip-json-comments-2.0.1.tgz\"\n  integrity sha1-PFMZQukIwml8DsNEhYwobHygpgo=\n\nsupports-color@^0.2.0:\n  version \"0.2.0\"\n  resolved \"https://registry.npmjs.org/supports-color/-/supports-color-0.2.0.tgz\"\n  integrity sha1-2S3iaU6z9nMjlz1649i1W0wiGQo=\n\nsupports-color@^2.0.0:\n  version \"2.0.0\"\n  resolved \"https://registry.npmjs.org/supports-color/-/supports-color-2.0.0.tgz\"\n  integrity sha1-U10EXOa2Nj+kARcIRimZXp3zJMc=\n\nsupports-color@^3.2.3:\n  version \"3.2.3\"\n  resolved \"https://registry.npmjs.org/supports-color/-/supports-color-3.2.3.tgz\"\n  integrity sha1-ZawFBLOVQXHYpklGsq48u4pfVPY=\n  dependencies:\n    has-flag \"^1.0.0\"\n\nsupports-color@^4.0.0:\n  version \"4.5.0\"\n  resolved \"https://registry.npmjs.org/supports-color/-/supports-color-4.5.0.tgz\"\n  integrity sha1-vnoN5ITexcXN34s9WRJQRJEvY1s=\n  dependencies:\n    has-flag \"^2.0.0\"\n\nsymbol-observable@^1.0.1:\n  version \"1.0.4\"\n  resolved \"https://registry.npmjs.org/symbol-observable/-/symbol-observable-1.0.4.tgz\"\n  integrity sha1-Kb9hXUqnEhvdiYsi1LP5vE4qoD0=\n\ntable@^3.7.8:\n  version \"3.8.3\"\n  resolved \"https://registry.npmjs.org/table/-/table-3.8.3.tgz\"\n  integrity sha1-K7xULw/amGGnVdOUf+/Ys/UThV8=\n  dependencies:\n    ajv \"^4.7.0\"\n    ajv-keywords \"^1.0.0\"\n    chalk \"^1.1.1\"\n    lodash \"^4.0.0\"\n    slice-ansi \"0.0.4\"\n    string-width \"^2.0.0\"\n\ntest-value@^2.1.0:\n  version \"2.1.0\"\n  resolved \"https://registry.npmjs.org/test-value/-/test-value-2.1.0.tgz\"\n  integrity sha1-Edpv9nDzRxpztiXKTz/c97t0gpE=\n  dependencies:\n    array-back \"^1.0.3\"\n    typical \"^2.6.0\"\n\ntext-table@~0.2.0:\n  version \"0.2.0\"\n  resolved \"https://registry.npmjs.org/text-table/-/text-table-0.2.0.tgz\"\n  integrity sha1-f17oI66AUgfACvLfSoTsP8+lcLQ=\n\nthrough@^2.3.6:\n  version \"2.3.8\"\n  resolved \"https://registry.npmjs.org/through/-/through-2.3.8.tgz\"\n  integrity sha1-DdTJ/6q8NXlgsbckEV1+Doai4fU=\n\nthrough2@^0.5.0, through2@^0.5.1:\n  version \"0.5.1\"\n  resolved \"https://registry.npmjs.org/through2/-/through2-0.5.1.tgz\"\n  integrity sha1-390BLrnHAOIyP9M084rGIqs3Lac=\n  dependencies:\n    readable-stream \"~1.0.17\"\n    xtend \"~3.0.0\"\n\nthrough2@^0.6.1:\n  version \"0.6.5\"\n  resolved \"https://registry.npmjs.org/through2/-/through2-0.6.5.tgz\"\n  integrity sha1-QaucZ7KdVyCQcUEOHXp6lozTrUg=\n  dependencies:\n    readable-stream \">=1.0.33-1 <1.1.0-0\"\n    xtend \">=4.0.0 <4.1.0-0\"\n\nthrough2@^2.0.0:\n  version \"2.0.3\"\n  resolved \"https://registry.npmjs.org/through2/-/through2-2.0.3.tgz\"\n  integrity sha1-AARWmzfHx0ujnEPzzteNGtlBQL4=\n  dependencies:\n    readable-stream \"^2.1.5\"\n    xtend \"~4.0.1\"\n\ntildify@^1.0.0:\n  version \"1.2.0\"\n  resolved \"https://registry.npmjs.org/tildify/-/tildify-1.2.0.tgz\"\n  integrity sha1-3OwD9V3Km3qj5bBPIYF+tW5jWIo=\n  dependencies:\n    os-homedir \"^1.0.0\"\n\ntime-stamp@^1.0.0:\n  version \"1.1.0\"\n  resolved \"https://registry.npmjs.org/time-stamp/-/time-stamp-1.1.0.tgz\"\n  integrity sha1-dkpaEa9QVhkhsTPztE5hhofg9cM=\n\ntiny-lr@0.1.4:\n  version \"0.1.4\"\n  resolved \"https://registry.npmjs.org/tiny-lr/-/tiny-lr-0.1.4.tgz\"\n  integrity sha1-bkHX5n39CHjl4LN+N6BtZ+MJ/00=\n  dependencies:\n    body-parser \"~1.8.0\"\n    debug \"~0.8.1\"\n    faye-websocket \"~0.7.2\"\n    parseurl \"~1.3.0\"\n    qs \"~2.2.3\"\n\nto-fast-properties@^1.0.3:\n  version \"1.0.3\"\n  resolved \"https://registry.npmjs.org/to-fast-properties/-/to-fast-properties-1.0.3.tgz\"\n  integrity sha1-uDVx+k2MJbguIxsG46MFXeTKGkc=\n\ntree-kill@^1.1.0:\n  version \"1.1.0\"\n  resolved \"https://registry.npmjs.org/tree-kill/-/tree-kill-1.1.0.tgz\"\n  integrity sha1-yWPc8DciiS7FnLpWnpQLcZVNFyk=\n\ntrim-newlines@^1.0.0:\n  version \"1.0.0\"\n  resolved \"https://registry.npmjs.org/trim-newlines/-/trim-newlines-1.0.0.tgz\"\n  integrity sha1-WIeWa7WCpFA6QetST301ARgVphM=\n\ntrim-right@^1.0.1:\n  version \"1.0.1\"\n  resolved \"https://registry.npmjs.org/trim-right/-/trim-right-1.0.1.tgz\"\n  integrity sha1-yy4SAwZ+DI3h9hQJS5/kVwTqYAM=\n\ntryit@^1.0.1:\n  version \"1.0.3\"\n  resolved \"https://registry.npmjs.org/tryit/-/tryit-1.0.3.tgz\"\n  integrity sha1-OTvnMKlEb9Hq1tpZoBQwjzbCics=\n\ntype-check@~0.3.2:\n  version \"0.3.2\"\n  resolved \"https://registry.npmjs.org/type-check/-/type-check-0.3.2.tgz\"\n  integrity sha1-WITKtRLPHTVeP7eE8wgEsrUg23I=\n  dependencies:\n    prelude-ls \"~1.1.2\"\n\ntype-is@~1.5.1:\n  version \"1.5.7\"\n  resolved \"https://registry.npmjs.org/type-is/-/type-is-1.5.7.tgz\"\n  integrity sha1-uTaKWTzG730GReeLL0xky+zQXpA=\n  dependencies:\n    media-typer \"0.3.0\"\n    mime-types \"~2.0.9\"\n\ntypedarray@^0.0.6:\n  version \"0.0.6\"\n  resolved \"https://registry.npmjs.org/typedarray/-/typedarray-0.0.6.tgz\"\n  integrity sha1-hnrHTjhkGHsdPUfZlqeOxciDB3c=\n\ntypical@^2.6.0, typical@^2.6.1:\n  version \"2.6.1\"\n  resolved \"https://registry.npmjs.org/typical/-/typical-2.6.1.tgz\"\n  integrity sha1-XAgOXWYcu+OCWdLnCjxyU+hziB0=\n\nuglify-es@^3.0.28:\n  version \"3.0.28\"\n  resolved \"https://registry.npmjs.org/uglify-es/-/uglify-es-3.0.28.tgz\"\n  integrity sha512-xw1hJsSp361OO0Sq0XvNyTI2wfQ4eKNljfSYyeYX/dz9lKEDj+DK+A8CzB0NmoCwWX1MnEx9f16HlkKXyG65CQ==\n  dependencies:\n    commander \"~2.11.0\"\n    source-map \"~0.5.1\"\n\nuglify-js@^3.0.9:\n  version \"3.0.28\"\n  resolved \"https://registry.npmjs.org/uglify-js/-/uglify-js-3.0.28.tgz\"\n  integrity sha512-0h/qGay016GG2lVav3Kz174F3T2Vjlz2v6HCt+WDQpoXfco0hWwF5gHK9yh88mUYvIC+N7Z8NT8WpjSp1yoqGA==\n  dependencies:\n    commander \"~2.11.0\"\n    source-map \"~0.5.1\"\n\nultron@1.0.x:\n  version \"1.0.2\"\n  resolved \"https://registry.npmjs.org/ultron/-/ultron-1.0.2.tgz\"\n  integrity sha512-QMpnpVtYaWEeY+MwKDN/UdKlE/LsFZXM5lO1u7GaZzNgmIbGixHEmVMIKT+vqYOALu3m5GYQy9kz4Xu4IVn7Ow==\n\nunc-path-regex@^0.1.0:\n  version \"0.1.2\"\n  resolved \"https://registry.npmjs.org/unc-path-regex/-/unc-path-regex-0.1.2.tgz\"\n  integrity sha1-5z3T17DXxe2G+6xrCufYxqadUPo=\n\nunion@~0.4.3:\n  version \"0.4.6\"\n  resolved \"https://registry.npmjs.org/union/-/union-0.4.6.tgz\"\n  integrity sha512-2qtrvSgD0GKotLRCNYkIMUOzoaHjXKCtbAP0kc5Po6D+RWTBb+BxlcHlHCYcf+Y+YM7eQicPgAg9mnWQvtoFVA==\n  dependencies:\n    qs \"~2.3.3\"\n\nunique-stream@^1.0.0:\n  version \"1.0.0\"\n  resolved \"https://registry.npmjs.org/unique-stream/-/unique-stream-1.0.0.tgz\"\n  integrity sha1-1ZpKdUJ0R9mqbJHnAmP40mpLEEs=\n\nunpipe@~1.0.0:\n  version \"1.0.0\"\n  resolved \"https://registry.npmjs.org/unpipe/-/unpipe-1.0.0.tgz\"\n  integrity sha1-sr9O6FFKrmFltIF4KdIbLvSZBOw=\n\nuser-home@^1.1.1:\n  version \"1.1.1\"\n  resolved \"https://registry.npmjs.org/user-home/-/user-home-1.1.1.tgz\"\n  integrity sha1-K1viOjK2Onyd640PKNSFcko98ZA=\n\nuser-home@^2.0.0:\n  version \"2.0.0\"\n  resolved \"https://registry.npmjs.org/user-home/-/user-home-2.0.0.tgz\"\n  integrity sha1-nHC/2Babwdy/SGBODwS4tJzenp8=\n  dependencies:\n    os-homedir \"^1.0.0\"\n\nutil-deprecate@~1.0.1:\n  version \"1.0.2\"\n  resolved \"https://registry.npmjs.org/util-deprecate/-/util-deprecate-1.0.2.tgz\"\n  integrity sha1-RQ1Nyfpw3nMnYvvS1KKJgUGaDM8=\n\nutils-merge@1.0.0:\n  version \"1.0.0\"\n  resolved \"https://registry.npmjs.org/utils-merge/-/utils-merge-1.0.0.tgz\"\n  integrity sha1-ApT7kiu5N1FTVBxPcJYjHyh8ivg=\n\nv8flags@^2.0.2:\n  version \"2.1.1\"\n  resolved \"https://registry.npmjs.org/v8flags/-/v8flags-2.1.1.tgz\"\n  integrity sha1-qrGh+jDUX4jdMhFIh1rALAtV5bQ=\n  dependencies:\n    user-home \"^1.1.1\"\n\nvalidate-npm-package-license@^3.0.1:\n  version \"3.0.1\"\n  resolved \"https://registry.npmjs.org/validate-npm-package-license/-/validate-npm-package-license-3.0.1.tgz\"\n  integrity sha1-KAS6vnEq0zeUWaz74kdGqywwP7w=\n  dependencies:\n    spdx-correct \"~1.0.0\"\n    spdx-expression-parse \"~1.0.0\"\n\nvinyl-fs@^0.3.0:\n  version \"0.3.14\"\n  resolved \"https://registry.npmjs.org/vinyl-fs/-/vinyl-fs-0.3.14.tgz\"\n  integrity sha1-mmhRzhysHBzqX+hsCTHWIMLPqeY=\n  dependencies:\n    defaults \"^1.0.0\"\n    glob-stream \"^3.1.5\"\n    glob-watcher \"^0.0.6\"\n    graceful-fs \"^3.0.0\"\n    mkdirp \"^0.5.0\"\n    strip-bom \"^1.0.0\"\n    through2 \"^0.6.1\"\n    vinyl \"^0.4.0\"\n\nvinyl@^0.2.1:\n  version \"0.2.3\"\n  resolved \"https://registry.npmjs.org/vinyl/-/vinyl-0.2.3.tgz\"\n  integrity sha1-vKk4IJWC7FpJrVOKAPofEl5RMlI=\n  dependencies:\n    clone-stats \"~0.0.1\"\n\nvinyl@^0.4.0:\n  version \"0.4.6\"\n  resolved \"https://registry.npmjs.org/vinyl/-/vinyl-0.4.6.tgz\"\n  integrity sha1-LzVsh6VQolVGHza76ypbqL94SEc=\n  dependencies:\n    clone \"^0.2.0\"\n    clone-stats \"^0.0.1\"\n\nvinyl@^0.5.0:\n  version \"0.5.3\"\n  resolved \"https://registry.npmjs.org/vinyl/-/vinyl-0.5.3.tgz\"\n  integrity sha1-sEVbOPxeDPMNQyUTLkYZcMIJHN4=\n  dependencies:\n    clone \"^1.0.0\"\n    clone-stats \"^0.0.1\"\n    replace-ext \"0.0.1\"\n\nwatch-http-server@^0.7.6:\n  version \"0.7.6\"\n  resolved \"https://registry.npmjs.org/watch-http-server/-/watch-http-server-0.7.6.tgz\"\n  integrity sha512-RFDwutg6npqy8R1//vLkPXnfEvkwM51PdEZkwVpttz1tYW4JVzlOXJlfEd32QwLmzCt2EgCTdnlyx0wvJGpHeg==\n  dependencies:\n    chokidar \"^0.12.4\"\n    colors \"1.0.3\"\n    opener \"~1.4.0\"\n    optimist \"0.6.x\"\n    portfinder \"0.2.x\"\n    sexstatic \"~0.6.x\"\n    union \"~0.4.3\"\n    ws \"^0.6.3\"\n\nwatch@^0.11.0:\n  version \"0.11.0\"\n  resolved \"https://registry.npmjs.org/watch/-/watch-0.11.0.tgz\"\n  integrity sha1-6NugkbdFZ5mjr1eXi5hud+EyBAY=\n\nwebsocket-driver@>=0.3.6:\n  version \"0.6.5\"\n  resolved \"https://registry.npmjs.org/websocket-driver/-/websocket-driver-0.6.5.tgz\"\n  integrity sha1-XLJVbOuF9Dc8bYI4qmkchFThOjY=\n  dependencies:\n    websocket-extensions \">=0.1.1\"\n\nwebsocket-extensions@>=0.1.1:\n  version \"0.1.1\"\n  resolved \"https://registry.npmjs.org/websocket-extensions/-/websocket-extensions-0.1.1.tgz\"\n  integrity sha1-domUmcGEtu91Q3fC27DNbLVdKec=\n\nwhich@^1.2.10, which@^1.2.12, which@^1.2.9:\n  version \"1.3.0\"\n  resolved \"https://registry.npmjs.org/which/-/which-1.3.0.tgz\"\n  integrity sha512-xcJpopdamTuY5duC/KnTTNBraPK54YwpenP4lzxU8H91GudWpFv38u0CKjclE1Wi2EH2EDz5LRcHcKbCIzqGyg==\n  dependencies:\n    isexe \"^2.0.0\"\n\nwordwrap@~0.0.2:\n  version \"0.0.3\"\n  resolved \"https://registry.npmjs.org/wordwrap/-/wordwrap-0.0.3.tgz\"\n  integrity sha512-1tMA907+V4QmxV7dbRvb4/8MaRALK6q9Abid3ndMYnbyo8piisCmeONVqVSXqQA3KaP4SLt5b7ud6E2sqP8TFw==\n\nwordwrap@~1.0.0:\n  version \"1.0.0\"\n  resolved \"https://registry.npmjs.org/wordwrap/-/wordwrap-1.0.0.tgz\"\n  integrity sha1-J1hIEIkUVqQXHI0CJkQa3pDLyus=\n\nwrappy@1:\n  version \"1.0.2\"\n  resolved \"https://registry.npmjs.org/wrappy/-/wrappy-1.0.2.tgz\"\n  integrity sha1-tSQ9jz7BqjXxNkYFvA0QNuMKtp8=\n\nwrite@^0.2.1:\n  version \"0.2.1\"\n  resolved \"https://registry.npmjs.org/write/-/write-0.2.1.tgz\"\n  integrity sha1-X8A4KOJkzqP+kUVUdvejxWbLB1c=\n  dependencies:\n    mkdirp \"^0.5.1\"\n\nws@^0.6.3:\n  version \"0.6.5\"\n  resolved \"https://registry.npmjs.org/ws/-/ws-0.6.5.tgz\"\n  integrity sha512-USH6S6I3kVLbZQ3+MwoC1gSGeQ9NTT5SCqhbtqLLJjPa+nv0I7zzzPyQSVAm10NzyMHa2rD4ZGnIbnFgarSQWg==\n  dependencies:\n    nan \"1.4.x\"\n    options \">=0.0.5\"\n    ultron \"1.0.x\"\n\nxtend@^4.0.0, \"xtend@>=4.0.0 <4.1.0-0\", xtend@~4.0.1:\n  version \"4.0.1\"\n  resolved \"https://registry.npmjs.org/xtend/-/xtend-4.0.1.tgz\"\n  integrity sha1-pcbVMr5lbiPbgg77lDofBJmNY68=\n\nxtend@~3.0.0:\n  version \"3.0.0\"\n  resolved \"https://registry.npmjs.org/xtend/-/xtend-3.0.0.tgz\"\n  integrity sha1-XM50B7r2Qsunvs2laBEcST9ZZlo=\n\nyallist@^2.1.2:\n  version \"2.1.2\"\n  resolved \"https://registry.npmjs.org/yallist/-/yallist-2.1.2.tgz\"\n  integrity sha1-HBH5IY8HYImkfdUS+TxmmaaoHVI=\n"
        }
      ]
    }
  ]
}