{
  "metadata": {
    "timestamp": 1736711584122,
    "page": 151,
    "hasNextPage": true,
    "endCursor": "Y3Vyc29yOjE2MA==",
    "completionStatus": "IN_PROGRESS"
  },
  "repositories": [
    {
      "nameWithOwner": "Tencent/tmt-workflow",
      "stars": 2172,
      "defaultBranch": "master",
      "files": [
        {
          "name": ".gitignore",
          "type": "blob",
          "size": 0.0634765625,
          "content": ".DS_Store\nnode_modules\nnpm-debug.log\n.idea\n.zip\ndev\ndist\n.history"
        },
        {
          "name": ".tmtworkflowrc",
          "type": "blob",
          "size": 0.8125,
          "content": "{\n\t\"ftp\": {\n\t\t\"host\": \"xx.xx.xx.xx\",\n\t\t\"port\": \"8021\",\n\t\t\"user\": \"tmt\",\n\t\t\"pass\": \"password\",\n\t\t\"remotePath\": \"remotePath\",\n\t\t\"includeHtml\": true\n\t\t//ftp 上传是否包含 html\n\t},\n\t\"sftp\": {\n\t\t\"host\": \"xx.xx.xx.xx\",\n\t\t\"port\": \"xx\",\n\t\t\"user\": \"tmt\",\n\t\t\"password\": \"password\",\n\t\t\"remotePath\": \"\",\n\t\t\"includeHtml\": true\n\t},\n\t\"livereload\": {\n\t\t\"available\": true,\n\t\t//开启自动刷新\n\t\t\"port\": 8080,\n\t\t\"startPath\": \"html/TmTIndex.html\"\n\t},\n\t//路径相对于 tasks/plugins 目录\n\t\"plugins\": {\n\t\t\"build_devAfter\": [\n\t\t\t\"TmTIndex\"\n\t\t],\n\t\t\"build_distAfter\": [],\n\t\t\"ftpAfter\": [\n\t\t\t\"ftp\"\n\t\t]\n\t},\n\t\"lazyDir\": [\n\t\t\"../slice\"\n\t],\n\t//gulp-lazyImageCSS 寻找目录(https://github.com/weixin/gulp-lazyimagecss)\n\n\t\"supportWebp\": false,\n\t\"supportREM\": false,\n\t\"supportChanged\": false,\n\t\"reversion\": true,\n    \"SVGGracefulDegradation\": true\n}\n"
        },
        {
          "name": ".travis.yml",
          "type": "blob",
          "size": 0.353515625,
          "content": "language: node_js\ncache:\n  yarn: true\n  directories:\n    - node_modules\n\nmatrix:\n  include:\n    - node_js: \"10\"\n    - node_js: \"9\"\n      os: osx\n    - node_js: \"8\"\n      os: osx\n    - node_js: \"7\"\n      os: linux\n    - node_js: \"6\"\n      os: linux\n    - node_js: \"5\"\n      os: linux\n\nbefore_script:\n  - npm install -g gulp\n  - cd project\n\nscript: gulp build_dist"
        },
        {
          "name": "LICENSE.txt",
          "type": "blob",
          "size": 1.7138671875,
          "content": "Tencent is pleased to support the open source community by making tmt-workflow available.  \r\nCopyright (C) 2017 THL A29 Limited, a Tencent company.  All rights reserved.\r\nIf you have downloaded a copy of the tmt-workflow binary from Tencent, please note that the tmt-workflow binary is licensed under the MIT License.\r\nIf you have downloaded a copy of the tmt-workflow source code from Tencent, please note that tmt-workflow source code is licensed under the MIT License.  Your integration of tmt-workflow into your own projects may require compliance with the MIT License.\r\nA copy of the MIT License is included in this file.\r\n\r\n\r\nTerms of the MIT License:\r\n--------------------------------------------------------------------\r\nPermission is hereby granted, free of charge, to any person obtaining a copy of this software and associated documentation files (the \"Software\"), to deal in the Software without restriction, including without limitation the rights to use, copy, modify, merge, publish, distribute, sublicense, and/or sell copies of the Software, and to permit persons to whom the Software is furnished to do so, subject to the following conditions:\r\n\r\nThe above copyright notice and this permission notice shall be included in all copies or substantial portions of the Software.\r\n\r\nTHE SOFTWARE IS PROVIDED \"AS IS\", WITHOUT WARRANTY OF ANY KIND, EXPRESS OR IMPLIED, INCLUDING BUT NOT LIMITED TO THE WARRANTIES OF MERCHANTABILITY, FITNESS FOR A PARTICULAR PURPOSE AND NONINFRINGEMENT. IN NO EVENT SHALL THE AUTHORS OR COPYRIGHT HOLDERS BE LIABLE FOR ANY CLAIM, DAMAGES OR OTHER LIABILITY, WHETHER IN AN ACTION OF CONTRACT, TORT OR OTHERWISE, ARISING FROM, OUT OF OR IN CONNECTION WITH THE SOFTWARE OR THE USE OR OTHER DEALINGS IN THE SOFTWARE."
        },
        {
          "name": "README.md",
          "type": "blob",
          "size": 11.2294921875,
          "content": "## 项目迁移说明\n\n由于业务调整，本项目不再更新，感谢大家一直以来的支持。  \n后续需求会合并到 [Feflow](https://github.com/Tencent/feflow) 项目进行开发迭代，请移步：\n\n* Github: https://github.com/Tencent/feflow\n* 官网：https://feflowjs.com/\n\n# tmt-workflow [![Version Number](https://img.shields.io/npm/v/generator-workflow.svg?style=flat)](https://github.com/Tencent/tmt-workflow/ \"Version Number\")\n\n[![Build Status](https://api.travis-ci.org/Tencent/tmt-workflow.svg)](https://travis-ci.org/Tencent/tmt-workflow \"Build Status\")\n[![Win Build status](https://img.shields.io/appveyor/ci/littledu/tmt-workflow.svg?label=Win%20build&style=flat)](https://ci.appveyor.com/project/littledu/tmt-workflow) \n[![devDependencies](https://img.shields.io/david/dev/weixin/tmt-workflow.svg?style=flat)](https://ci.appveyor.com/project/weixin/tmt-workflow \"devDependencies\") \n[![License](https://img.shields.io/badge/license-MIT-blue.svg?style=flat)](http://opensource.org/licenses/MIT \"Feel free to contribute.\") \n\n> 一个基于 [Gulp](https://github.com/gulpjs/gulp)、高效、跨平台(macOS & Win)、可定制的前端工作流程。  \n> 现已推出 GUI 桌面工具：[WeFlow](http://weflow.io/)，无需安装任何环境依赖即可使用，官网下载：http://weflow.io/\n\n## 功能特性\n\n- 自动化流程\n  - [Less/Sass -> CSS](https://github.com/Tencent/tmt-workflow/wiki/%E2%92%8C-Less-%E7%BC%96%E8%AF%91)\n  - [CSS Autoprefixer 前缀自动补全](https://github.com/Tencent/tmt-workflow/wiki/%E2%92%8D-Autoprefixer)\n  - [自动生成图片 CSS 属性，width & height 等](https://github.com/Tencent/gulp-lazyimagecss)\n  - [自动内联 SVG 到 CSS](https://github.com/Tencent/gulp-svg-inline)\n  - [CSS 压缩 cssnano](https://github.com/ben-eb/cssnano)\n  - [CSS Sprite 雪碧图合成](https://github.com/Tencent/tmt-workflow/wiki/%E2%92%8E-CSS-Sprite)\n  - [Retina @2x & @3x 自动生成适配](https://github.com/Tencent/tmt-workflow/wiki/%E2%92%8E-CSS-Sprite)\n  - [imagemin 图片压缩](https://github.com/sindresorhus/gulp-imagemin)\n  - [JS 合并压缩](https://github.com/Tencent/tmt-workflow/wiki/%E2%92%8F-JS-%E5%90%88%E5%B9%B6%E5%8E%8B%E7%BC%A9)\n  - [EJS 模版语言](https://github.com/Tencent/tmt-workflow/wiki/%E2%92%90-EJS-%E6%A8%A1%E7%89%88%E8%AF%AD%E8%A8%80)  \n- 调试 & 部署\n  - [监听文件变动，自动刷新浏览器 (LiveReload)](https://github.com/Tencent/tmt-workflow/wiki/%E2%92%91-LiveReload)\n  - [FTP 发布部署](https://github.com/Tencent/tmt-workflow/wiki/%E2%92%92-FTP-%E5%8F%91%E5%B8%83%E9%83%A8%E7%BD%B2)\n  - [ZIP 项目打包](https://github.com/Tencent/tmt-workflow/wiki/%E2%92%93-ZIP-%E6%89%93%E5%8C%85)\n- 解决方案集成\n  - [px -> rem 兼容适配方案](https://github.com/Tencent/tmt-workflow/wiki/%E2%92%94-REM-%E8%A7%A3%E5%86%B3%E6%96%B9%E6%A1%88)\n  - [智能 WebP 解决方案](https://github.com/Tencent/tmt-workflow/wiki/%E2%92%95-WEBP-%E8%A7%A3%E5%86%B3%E6%96%B9%E6%A1%88)\n  - [SVG 整体解决方案](https://github.com/Tencent/tmt-workflow/wiki/%E2%92%9A-SVG%E6%95%B4%E4%BD%93%E8%A7%A3%E5%86%B3%E6%96%B9%E6%A1%88)\n  - [去缓存文件 Reversion (MD5) 解决方案](https://github.com/Tencent/tmt-workflow/wiki/%E2%92%96-Reversion-%E8%A7%A3%E5%86%B3%E6%96%B9%E6%A1%88)\n\n## 快速开始\n\n请确保已安装 [Node.js](https://nodejs.org/) (已支持到最新版，如：v5+, v8, v9 等) \n\n1. 全局安装 [Gulp](https://github.com/gulpjs/gulp)，执行：`npm install gulp-cli -g`\n2. 点击下载 [tmt-workflow](https://github.com/Tencent/tmt-workflow/archive/master.zip)，进入根目录执行： `npm install`\n\n> 推荐使用 `yarn` 安装环境依赖，详见[yarn](https://yarnpkg.com)\n> 注1：Windows 用户请先安装 [git](http://git-scm.com/)，然后在 [Git Bash](http://git-for-windows.github.io/) 下执行 `npm install` 即可（非 `CMD`）。 \n>  \n> 注2：如遇 `npm install` 网络问题，推荐尝试 [cnpm](http://npm.taobao.org/) 或 [NPM腾讯云分流](https://cloud.tencent.com/document/product/213/8623#.E4.BD.BF.E7.94.A8.E8.85.BE.E8.AE.AF.E4.BA.91.E9.95.9C.E5.83.8F.E6.BA.90.E5.8A.A0.E9.80.9Fnpm) 安装环境依赖\n\n## 目录结构\n\n#### 工作流目录结构\n\n````bash\ntmt-workflow/\n│\n├── _tasks          \t\t// Gulp 任务目录\n│   ├── TaskBuildDev.js     // gulp build_dev\n│   ├── TaskBuildDist.js    // gulp build_dist\n│   ├── TaskFTP.js      \t// gulp ftp\n│   ├── TaskZip.js      \t// gulp zip\n│   │\n│   ├── common\n│   │   └── webp.js\n│   │\n│   ├── index.js\n│   │\n│   ├── lib\n│   │   └── util.js\n│   │\n│   └── plugins       \t\t// 插件目录\n│       ├── TmTIndex.js\n│       └── ftp.js\n│\n├── package.json\n│\n└── project         \t\t  // 项目目录，详见下述项目结构 ↓↓↓\n    ├── src\n    ├── dev\n    ├── dist\n    └── gulpfile.js\n````\n\n#### 项目目录结构\n\n\n````bash\nproject/                          // 项目目录\n├── gulpfile.js                   // Gulp 工作流配置文件\n│\n├── src                           // 源文件目录，`gulp build_dev`阶段会监听此目录下的文件变动\n│   ├── css                       // 存放 Less 文件的目录，只有 style-*.less 的文件名会被编译\n│   │   └── lib/\n│   │   │   ├── lib-reset.less\n│   │   │   ├── lib-mixins.less\n│   │   │   └── lib-rem.less\n│   │   └── style-index.less        // CSS 编译出口文件\n│   │ \n│   ├── html\n│   ├── media                     // 存放媒体文件，如 bgm.mp3 abc.font 1.mp4 等\n│   ├── img                       // 存放背景图等无需合并雪碧图处理的图片\n│   └── slice                     // 切片图片素材，将会进行雪碧图合并，同名 @2x 图片也会合并\n│       ├── icon-shake.png\n│       └── icon-shake@2x.png\n│\n├── dev                           // 开发目录，由 `gulp build_dev` 任务生成\n│   ├── css\n│   ├── html\n│   ├── media\n│   ├── img\n│   └── slice                     // 开发阶段，仅从 src/slice 拷贝至此，不做合并雪碧图处理\n│\n└── dist                          // 生产目录，由 `gulp build_dist` 任务生成\n    ├── css\n    ├── html\n    ├── media\n    ├── img\n    └── sprite                    // 将 /src/slice 合并雪碧图，根据 /css 文件名，命名为 style-*.png \n        ├── style-index.png\n        └── style-index@2x.png\n````\n\n## 配置文件 `.tmtworkflowrc`\n\n`.tmtworkflowrc` 配置文件为**隐藏文件**，位于工作流根目录，可存放配置信息或开启相关功能，[详见WiKi](https://github.com/Tencent/tmt-workflow/wiki/%E2%92%8A-%E9%85%8D%E7%BD%AE%E6%96%87%E4%BB%B6%E8%AF%B4%E6%98%8E)。  \n_如：FTP 配置信息、开启 WebP功能，开启 REM 支持等。_\n\n```bash\n{\n  // FTP 发布配置\n  \"ftp\": {\n    \"host\": \"xx.xx.xx.xx\",\n    \"port\": \"8021\",\n    \"user\": \"tmt\",\n    \"pass\": \"password\",\n    \"remotePath\": \"remotePath\",         // 默认上传至根目录，此属性可指定子目录路径\n    \"includeHtml\": true                 // FTP 上传时是否包含 .html 文件\n  },\n\n  // 浏览器自动刷新\n  \"livereload\": {\n     \"available\": true,                 // 开启\n     \"port\": 8080,\n     \"startPath\": \"html/TmTIndex.html\"  // 启动时自动打开的路径\n  },\n\n  // 插件功能\n\n  // 路径相对于 tasks/plugins 目录\n  \"plugins\": {\n    \"build_devAfter\": [\"TmTIndex\"],     // build_dev 任务执行完成后，自动执行\n    \"build_distAfter\": [],              // build_dist 任务执行完成后，自动执行\n    \"ftpAfter\": [\"ftp\"]                 // ftp 任务执行完成后，自动执行\n  },\n\n  \"lazyDir\": [\"../slice\"],              // gulp-lazyImageCSS 启用目录\n  \n  \"supportWebp\": false,                 // 开启 WebP 解决方案\n\n  \"supportREM\": false,                  // 开启 REM 适配方案，自动转换 px -> rem\n\n  \"supportChanged\": false,              // 开启 只编译有变动的文件\n\n  \"reversion\": false                    // 开启 新文件名 md5 功能\n}\n```\n\n## 任务说明\n\n> 注1：**`./src`** 为源文件(开发目录)，`/dev` 和 `/dist` 目录为流程**自动**生成的**临时目录**。  \n> 注2：`FTP` 和 `zip` 任务执行后会**自动删除** `/dist` 目录。\n\n**1. 开发任务 `gulp build_dev`**\n\n按照`目录结构`创建好项目后，执行 `gulp build_dev` 生成开发文件位于 `/dev`，包含以下过程\n\n- 完成 `ejs -> html` 和 `less -> css` 编译\n- 自动监听文件改动，触发浏览器刷新  \n\n_注：浏览器刷新功能可在 `.tmtworkflowrc` 中进行配置_\n\n**执行后 Demo 预览：**[project/dev/html/index.html](http://weixin.github.io/tmt-workflow/project/dev/html/index.html)\n\n**2. 生产任务 `gulp build_dist`**\n\n开发完成后，执行 `gulp build_dist` 生成最终文件到 `/dist` 目录，包含以下过程：\n\n- LESS/EJS 编译\n- CSS/JS/IMG 压缩合并\n- slice 图片合并成雪碧图\n- SVG 内联压缩打包合并\n- 文件添加版本号\n- WebP 图片支持\n\n**执行后 Demo 预览：**[project/dist/html/index.html](http://weixin.github.io/tmt-workflow/project/dist/html/index.html)\n\n**3. FTP 部署 `gulp ftp`**  \n\n依赖于 `生产任务`，执行后，会先执行 `gulp build_dist` ，然后将其生成的 `/dist` 目录上传至 `.tmtworkflowrc` 指定的 `FTP` 服务器。\n\n**4. 打包任务 `gulp zip`**  \n\n将 `gulp build_dist` 生成 `dist` 目录压缩成 `zip` 格式。\n\n更多详细说明 [参见 WiKi](https://github.com/Tencent/tmt-workflow/wiki/%E2%92%8B-%E4%BB%BB%E5%8A%A1%E4%BB%8B%E7%BB%8D)\n\n## 使用预览\n\n推荐配合 [WebStorm](https://www.jetbrains.com/webstorm/) 等编辑器的 [Gulp 任务管理器](https://www.jetbrains.com/webstorm/help/using-gulp-task-runner.html) 使用，体验更佳。\n\n也可配合桌面工具：[WeFlow]，无需安装环境依赖，获得可视化的操作体验。\n\n![tmt-workflow yo](https://cloud.githubusercontent.com/assets/1049575/13744821/77a67476-ea25-11e5-9cf3-eebf56ffbe03.gif)\n\n## 其它说明\n\n`tmt-workflow` 具有良好的`定制性`和`扩展性`，用户可针对自身团队的具体需求，参看以下文档进行定制：\n\n* [任务的动态加载机制（高级）](https://github.com/Tencent/tmt-workflow/wiki/%E2%92%97-%E4%BB%BB%E5%8A%A1%E7%9A%84%E5%8A%A8%E6%80%81%E5%8A%A0%E8%BD%BD%E6%9C%BA%E5%88%B6%EF%BC%88%E9%AB%98%E7%BA%A7%EF%BC%89)\n* [自定义任务（高级）](https://github.com/Tencent/tmt-workflow/wiki/%E2%92%98-%E8%87%AA%E5%AE%9A%E4%B9%89%E4%BB%BB%E5%8A%A1%EF%BC%88%E9%AB%98%E7%BA%A7%EF%BC%89)\n* [自定义插件（高级](https://github.com/Tencent/tmt-workflow/wiki/%E2%92%99-%E8%87%AA%E5%AE%9A%E4%B9%89%E6%8F%92%E4%BB%B6%EF%BC%88%E9%AB%98%E7%BA%A7%EF%BC%89)\n\n## 参与贡献\n \n如果你有 `Bug反馈` 或 `功能建议`，请创建 [Issue](https://github.com/Tencent/tmt-workflow/issues) 或发送 [Pull Request](https://github.com/Tencent/tmt-workflow/pulls)，非常感谢。\n\n[腾讯开源激励计划](https://opensource.tencent.com/contribution) 鼓励开发者的参与和贡献，期待你的加入。\n\n## License\n\n所有代码采用 [MIT License](http://opensource.org/licenses/MIT) 开源，可根据自身团队和项目特点 `fork` 进行定制。\n"
        },
        {
          "name": "_tasks",
          "type": "tree",
          "content": null
        },
        {
          "name": "appveyor.yml",
          "type": "blob",
          "size": 0.830078125,
          "content": "\n# AppVeyor file\n# http://www.appveyor.com/docs/lang/nodejs-iojs\n# http://www.appveyor.com/docs/appveyor-yml\n\nversion: \"{build}\"\n\nclone_depth: 10\n\nenvironment:\n  matrix:\n    - nodejs_version: 5.0.0\n# Install scripts. (runs after repo cloning)\ninstall:\n  # Get the latest stable version of Node.js or io.js\n  - ps: Install-Product node $env:nodejs_version\n  - npm cache clean\n  - npm install -g gulp\n  # install modules\n  - npm install\n\n# Post-install test scripts.\ntest_script:\n  # Output useful info for debugging.\n  - node --version && npm --version\n  # run tests\n  - cd project\n  - gulp build_dist\n\n# Don't actually build.\nbuild: off\n\nmatrix:\n  fast_finish: true\n\ncache:\n  - C:\\Users\\appveyor\\AppData\\Roaming\\npm-cache -> package.json         # npm cache\n  - node_modules -> package.json                                        # local npm modules\n"
        },
        {
          "name": "package.json",
          "type": "blob",
          "size": 2.169921875,
          "content": "{\n    \"name\": \"tmt-workflow\",\n    \"version\": \"1.5.8\",\n    \"dependencies\": {\n        \"autoprefixer\": \"^6.3.3\",\n        \"babel-core\": \"^6.10.4\",\n        \"babel-loader\": \"^6.2.4\",\n        \"babel-preset-es2015\": \"^6.9.0\",\n        \"babel-preset-stage-2\": \"^6.11.0\",\n        \"browser-sync\": \"^2.11.1\",\n        \"cheerio\": \"^0.22.0\",\n        \"crypto-md5\": \"^1.0.0\",\n        \"del\": \"^2.2.0\",\n        \"gulp\": \"^4.0.0\",\n        \"gulp-babel\": \"^6.1.2\",\n        \"gulp-cssnano\": \"^2.1.1\",\n        \"gulp-ejs\": \"^2.1.1\",\n        \"gulp-ftp\": \"^1.1.0\",\n        \"gulp-if\": \"^2.0.0\",\n        \"gulp-imagemin\": \"^2.4.0\",\n        \"gulp-lazyimagecss\": \"^2.0.0\",\n        \"gulp-less\": \"^3.0.5\",\n        \"gulp-postcss\": \"^6.0.1\",\n        \"gulp-posthtml\": \"^1.5.2\",\n        \"gulp-rename\": \"^1.2.2\",\n        \"gulp-replace\": \"^0.5.4\",\n        \"gulp-rev-all\": \"^1.0.0\",\n        \"gulp-rev-delete-original\": \"^0.1.0\",\n        \"gulp-sass\": \"^2.3.2\",\n        \"gulp-sftp\": \"^0.1.4\",\n        \"gulp-svg-inline\": \"^1.0.1\",\n        \"gulp-svg-sprite\": \"^1.3.6\",\n        \"gulp-svgmin\": \"^1.2.3\",\n        \"gulp-tmtsprite\": \"^0.0.23\",\n        \"gulp-uglify\": \"^1.5.3\",\n        \"gulp-usemin\": \"^0.3.23\",\n        \"gulp-util\": \"^3.0.7\",\n        \"gulp-webp\": \"^2.3.0\",\n        \"gulp-zip\": \"^3.2.0\",\n        \"imagemin-pngquant\": \"^4.2.2\",\n        \"lodash\": \"^4.5.1\",\n        \"postcss-pxtorem\": \"^3.3.1\",\n        \"posthtml-px2rem\": \"^0.0.3\",\n        \"quick-local-ip\": \"^1.0.7\",\n        \"rc\": \"^1.1.6\",\n        \"rd\": \"^0.0.2\",\n        \"svg-to-png\": \"^3.1.2\",\n        \"through2\": \"^2.0.3\",\n        \"tmt-ejs-helper\": \"^0.0.1\",\n        \"vinyl\": \"^2.0.1\",\n        \"webpack\": \"^2.2.1\",\n        \"webpack-stream\": \"^3.2.0\"\n    },\n    \"description\": \"A f2e project workflow based on Gulp\",\n    \"repository\": {\n        \"type\": \"git\",\n        \"url\": \"https://github.com/weixin/tmt-workflow\"\n    },\n    \"keywords\": [\n        \"Workflow\",\n        \"F2E\",\n        \"Less\",\n        \"CSS\",\n        \"Tencent\",\n        \"Wechat\",\n        \"WeiXin\",\n        \"Sprite\",\n        \"WebP\",\n        \"REM\"\n    ],\n    \"license\": \"MIT\",\n    \"bugs\": {\n        \"url\": \"https://github.com/weixin/tmt-workflow\"\n    },\n    \"homepage\": \"https://github.com/weixin/tmt-workflow\",\n    \"readmeFilename\": \"README.md\"\n}"
        },
        {
          "name": "project-webpack",
          "type": "tree",
          "content": null
        },
        {
          "name": "project",
          "type": "tree",
          "content": null
        },
        {
          "name": "yarn.lock",
          "type": "blob",
          "size": 294.837890625,
          "content": "# THIS IS AN AUTOGENERATED FILE. DO NOT EDIT THIS FILE DIRECTLY.\n# yarn lockfile v1\n\n\nabbrev@1:\n  version \"1.1.1\"\n  resolved \"https://registry.yarnpkg.com/abbrev/-/abbrev-1.1.1.tgz#f8f2c887ad10bf67f634f005b6987fed3179aac8\"\n\naccepts@~1.3.4:\n  version \"1.3.5\"\n  resolved \"https://registry.yarnpkg.com/accepts/-/accepts-1.3.5.tgz#eb777df6011723a3b14e8a72c0805c8e86746bd2\"\n  dependencies:\n    mime-types \"~2.1.18\"\n    negotiator \"0.6.1\"\n\naccord@^0.28.0:\n  version \"0.28.0\"\n  resolved \"https://registry.yarnpkg.com/accord/-/accord-0.28.0.tgz#bec516a2f722e7d50f5f9f42f81b77f3b95448ba\"\n  dependencies:\n    convert-source-map \"^1.5.0\"\n    glob \"^7.0.5\"\n    indx \"^0.2.3\"\n    lodash.clone \"^4.3.2\"\n    lodash.defaults \"^4.0.1\"\n    lodash.flatten \"^4.2.0\"\n    lodash.merge \"^4.4.0\"\n    lodash.partialright \"^4.1.4\"\n    lodash.pick \"^4.2.1\"\n    lodash.uniq \"^4.3.0\"\n    resolve \"^1.5.0\"\n    semver \"^5.3.0\"\n    uglify-js \"^2.8.22\"\n    when \"^3.7.8\"\n\nacorn-dynamic-import@^2.0.0:\n  version \"2.0.2\"\n  resolved \"https://registry.yarnpkg.com/acorn-dynamic-import/-/acorn-dynamic-import-2.0.2.tgz#c752bd210bef679501b6c6cb7fc84f8f47158cc4\"\n  dependencies:\n    acorn \"^4.0.3\"\n\nacorn@^3.0.0:\n  version \"3.3.0\"\n  resolved \"https://registry.yarnpkg.com/acorn/-/acorn-3.3.0.tgz#45e37fb39e8da3f25baee3ff5369e2bb5f22017a\"\n\nacorn@^4.0.3:\n  version \"4.0.13\"\n  resolved \"https://registry.yarnpkg.com/acorn/-/acorn-4.0.13.tgz#105495ae5361d697bd195c825192e1ad7f253787\"\n\nacorn@^5.0.0:\n  version \"5.7.1\"\n  resolved \"https://registry.yarnpkg.com/acorn/-/acorn-5.7.1.tgz#f095829297706a7c9776958c0afc8930a9b9d9d8\"\n\nafter@0.8.2:\n  version \"0.8.2\"\n  resolved \"https://registry.yarnpkg.com/after/-/after-0.8.2.tgz#fedb394f9f0e02aa9768e702bda23b505fae7e1f\"\n\najv-keywords@^1.1.1:\n  version \"1.5.1\"\n  resolved \"https://registry.yarnpkg.com/ajv-keywords/-/ajv-keywords-1.5.1.tgz#314dd0a4b3368fad3dfcdc54ede6171b886daf3c\"\n\najv@^4.7.0, ajv@^4.9.1:\n  version \"4.11.8\"\n  resolved \"https://registry.yarnpkg.com/ajv/-/ajv-4.11.8.tgz#82ffb02b29e662ae53bdc20af15947706739c536\"\n  dependencies:\n    co \"^4.6.0\"\n    json-stable-stringify \"^1.0.1\"\n\najv@^5.1.0:\n  version \"5.5.2\"\n  resolved \"https://registry.yarnpkg.com/ajv/-/ajv-5.5.2.tgz#73b5eeca3fab653e3d3f9422b341ad42205dc965\"\n  dependencies:\n    co \"^4.6.0\"\n    fast-deep-equal \"^1.0.0\"\n    fast-json-stable-stringify \"^2.0.0\"\n    json-schema-traverse \"^0.3.0\"\n\nalign-text@^0.1.1, align-text@^0.1.3:\n  version \"0.1.4\"\n  resolved \"https://registry.yarnpkg.com/align-text/-/align-text-0.1.4.tgz#0cd90a561093f35d0a99256c22b7069433fad117\"\n  dependencies:\n    kind-of \"^3.0.2\"\n    longest \"^1.0.1\"\n    repeat-string \"^1.5.2\"\n\nalphanum-sort@^1.0.1, alphanum-sort@^1.0.2:\n  version \"1.0.2\"\n  resolved \"https://registry.yarnpkg.com/alphanum-sort/-/alphanum-sort-1.0.2.tgz#97a1119649b211ad33691d9f9f486a8ec9fbe0a3\"\n\namdefine@>=0.0.4:\n  version \"1.0.1\"\n  resolved \"https://registry.yarnpkg.com/amdefine/-/amdefine-1.0.1.tgz#4a5282ac164729e93619bcfd3ad151f817ce91f5\"\n\nansi-colors@^1.0.1:\n  version \"1.1.0\"\n  resolved \"https://registry.yarnpkg.com/ansi-colors/-/ansi-colors-1.1.0.tgz#6374b4dd5d4718ff3ce27a671a3b1cad077132a9\"\n  dependencies:\n    ansi-wrap \"^0.1.0\"\n\nansi-cyan@^0.1.1:\n  version \"0.1.1\"\n  resolved \"https://registry.yarnpkg.com/ansi-cyan/-/ansi-cyan-0.1.1.tgz#538ae528af8982f28ae30d86f2f17456d2609873\"\n  dependencies:\n    ansi-wrap \"0.1.0\"\n\nansi-gray@^0.1.1:\n  version \"0.1.1\"\n  resolved \"https://registry.yarnpkg.com/ansi-gray/-/ansi-gray-0.1.1.tgz#2962cf54ec9792c48510a3deb524436861ef7251\"\n  dependencies:\n    ansi-wrap \"0.1.0\"\n\nansi-red@^0.1.1:\n  version \"0.1.1\"\n  resolved \"https://registry.yarnpkg.com/ansi-red/-/ansi-red-0.1.1.tgz#8c638f9d1080800a353c9c28c8a81ca4705d946c\"\n  dependencies:\n    ansi-wrap \"0.1.0\"\n\nansi-regex@^2.0.0:\n  version \"2.1.1\"\n  resolved \"https://registry.yarnpkg.com/ansi-regex/-/ansi-regex-2.1.1.tgz#c3b33ab5ee360d86e0e628f0468ae7ef27d654df\"\n\nansi-regex@^3.0.0:\n  version \"3.0.0\"\n  resolved \"https://registry.yarnpkg.com/ansi-regex/-/ansi-regex-3.0.0.tgz#ed0317c322064f79466c02966bddb605ab37d998\"\n\nansi-styles@^2.2.1:\n  version \"2.2.1\"\n  resolved \"https://registry.yarnpkg.com/ansi-styles/-/ansi-styles-2.2.1.tgz#b432dd3358b634cf75e1e4664368240533c1ddbe\"\n\nansi-styles@^3.2.1:\n  version \"3.2.1\"\n  resolved \"https://registry.yarnpkg.com/ansi-styles/-/ansi-styles-3.2.1.tgz#41fbb20243e50b12be0f04b8dedbf07520ce841d\"\n  dependencies:\n    color-convert \"^1.9.0\"\n\nansi-wrap@0.1.0, ansi-wrap@^0.1.0:\n  version \"0.1.0\"\n  resolved \"https://registry.yarnpkg.com/ansi-wrap/-/ansi-wrap-0.1.0.tgz#a82250ddb0015e9a27ca82e82ea603bbfa45efaf\"\n\nanymatch@^1.3.0:\n  version \"1.3.2\"\n  resolved \"https://registry.yarnpkg.com/anymatch/-/anymatch-1.3.2.tgz#553dcb8f91e3c889845dfdba34c77721b90b9d7a\"\n  dependencies:\n    micromatch \"^2.1.5\"\n    normalize-path \"^2.0.0\"\n\nanymatch@^2.0.0:\n  version \"2.0.0\"\n  resolved \"https://registry.yarnpkg.com/anymatch/-/anymatch-2.0.0.tgz#bcb24b4f37934d9aa7ac17b4adaf89e7c76ef2eb\"\n  dependencies:\n    micromatch \"^3.1.4\"\n    normalize-path \"^2.1.1\"\n\nappend-buffer@^1.0.2:\n  version \"1.0.2\"\n  resolved \"https://registry.yarnpkg.com/append-buffer/-/append-buffer-1.0.2.tgz#d8220cf466081525efea50614f3de6514dfa58f1\"\n  dependencies:\n    buffer-equal \"^1.0.0\"\n\naproba@^1.0.3:\n  version \"1.2.0\"\n  resolved \"https://registry.yarnpkg.com/aproba/-/aproba-1.2.0.tgz#6802e6264efd18c790a1b0d517f0f2627bf2c94a\"\n\narchive-type@^3.0.0, archive-type@^3.0.1:\n  version \"3.2.0\"\n  resolved \"https://registry.yarnpkg.com/archive-type/-/archive-type-3.2.0.tgz#9cd9c006957ebe95fadad5bd6098942a813737f6\"\n  dependencies:\n    file-type \"^3.1.0\"\n\narchy@^1.0.0:\n  version \"1.0.0\"\n  resolved \"https://registry.yarnpkg.com/archy/-/archy-1.0.0.tgz#f9c8c13757cc1dd7bc379ac77b2c62a5c2868c40\"\n\nare-we-there-yet@~1.1.2:\n  version \"1.1.5\"\n  resolved \"https://registry.yarnpkg.com/are-we-there-yet/-/are-we-there-yet-1.1.5.tgz#4b35c2944f062a8bfcda66410760350fe9ddfc21\"\n  dependencies:\n    delegates \"^1.0.0\"\n    readable-stream \"^2.0.6\"\n\nargparse@^1.0.7:\n  version \"1.0.10\"\n  resolved \"https://registry.yarnpkg.com/argparse/-/argparse-1.0.10.tgz#bcd6791ea5ae09725e17e5ad988134cd40b3d911\"\n  dependencies:\n    sprintf-js \"~1.0.2\"\n\narr-diff@^1.0.1:\n  version \"1.1.0\"\n  resolved \"https://registry.yarnpkg.com/arr-diff/-/arr-diff-1.1.0.tgz#687c32758163588fef7de7b36fabe495eb1a399a\"\n  dependencies:\n    arr-flatten \"^1.0.1\"\n    array-slice \"^0.2.3\"\n\narr-diff@^2.0.0:\n  version \"2.0.0\"\n  resolved \"https://registry.yarnpkg.com/arr-diff/-/arr-diff-2.0.0.tgz#8f3b827f955a8bd669697e4a4256ac3ceae356cf\"\n  dependencies:\n    arr-flatten \"^1.0.1\"\n\narr-diff@^4.0.0:\n  version \"4.0.0\"\n  resolved \"https://registry.yarnpkg.com/arr-diff/-/arr-diff-4.0.0.tgz#d6461074febfec71e7e15235761a329a5dc7c520\"\n\narr-filter@^1.1.1:\n  version \"1.1.2\"\n  resolved \"https://registry.yarnpkg.com/arr-filter/-/arr-filter-1.1.2.tgz#43fdddd091e8ef11aa4c45d9cdc18e2dff1711ee\"\n  dependencies:\n    make-iterator \"^1.0.0\"\n\narr-flatten@^1.0.1, arr-flatten@^1.1.0:\n  version \"1.1.0\"\n  resolved \"https://registry.yarnpkg.com/arr-flatten/-/arr-flatten-1.1.0.tgz#36048bbff4e7b47e136644316c99669ea5ae91f1\"\n\narr-map@^2.0.0, arr-map@^2.0.2:\n  version \"2.0.2\"\n  resolved \"https://registry.yarnpkg.com/arr-map/-/arr-map-2.0.2.tgz#3a77345ffc1cf35e2a91825601f9e58f2e24cac4\"\n  dependencies:\n    make-iterator \"^1.0.0\"\n\narr-union@^2.0.1:\n  version \"2.1.0\"\n  resolved \"https://registry.yarnpkg.com/arr-union/-/arr-union-2.1.0.tgz#20f9eab5ec70f5c7d215b1077b1c39161d292c7d\"\n\narr-union@^3.1.0:\n  version \"3.1.0\"\n  resolved \"https://registry.yarnpkg.com/arr-union/-/arr-union-3.1.0.tgz#e39b09aea9def866a8f206e288af63919bae39c4\"\n\narray-differ@^1.0.0:\n  version \"1.0.0\"\n  resolved \"https://registry.yarnpkg.com/array-differ/-/array-differ-1.0.0.tgz#eff52e3758249d33be402b8bb8e564bb2b5d4031\"\n\narray-each@^1.0.0, array-each@^1.0.1:\n  version \"1.0.1\"\n  resolved \"https://registry.yarnpkg.com/array-each/-/array-each-1.0.1.tgz#a794af0c05ab1752846ee753a1f211a05ba0c44f\"\n\narray-find-index@^1.0.1:\n  version \"1.0.2\"\n  resolved \"https://registry.yarnpkg.com/array-find-index/-/array-find-index-1.0.2.tgz#df010aa1287e164bbda6f9723b0a96a1ec4187a1\"\n\narray-initial@^1.0.0:\n  version \"1.1.0\"\n  resolved \"https://registry.yarnpkg.com/array-initial/-/array-initial-1.1.0.tgz#2fa74b26739371c3947bd7a7adc73be334b3d795\"\n  dependencies:\n    array-slice \"^1.0.0\"\n    is-number \"^4.0.0\"\n\narray-last@^1.1.1:\n  version \"1.3.0\"\n  resolved \"https://registry.yarnpkg.com/array-last/-/array-last-1.3.0.tgz#7aa77073fec565ddab2493f5f88185f404a9d336\"\n  dependencies:\n    is-number \"^4.0.0\"\n\narray-slice@^0.2.3:\n  version \"0.2.3\"\n  resolved \"https://registry.yarnpkg.com/array-slice/-/array-slice-0.2.3.tgz#dd3cfb80ed7973a75117cdac69b0b99ec86186f5\"\n\narray-slice@^1.0.0:\n  version \"1.1.0\"\n  resolved \"https://registry.yarnpkg.com/array-slice/-/array-slice-1.1.0.tgz#e368ea15f89bc7069f7ffb89aec3a6c7d4ac22d4\"\n\narray-sort@^1.0.0:\n  version \"1.0.0\"\n  resolved \"https://registry.yarnpkg.com/array-sort/-/array-sort-1.0.0.tgz#e4c05356453f56f53512a7d1d6123f2c54c0a88a\"\n  dependencies:\n    default-compare \"^1.0.0\"\n    get-value \"^2.0.6\"\n    kind-of \"^5.0.2\"\n\narray-union@^1.0.1:\n  version \"1.0.2\"\n  resolved \"https://registry.yarnpkg.com/array-union/-/array-union-1.0.2.tgz#9a34410e4f4e3da23dea375be5be70f24778ec39\"\n  dependencies:\n    array-uniq \"^1.0.1\"\n\narray-uniq@^1.0.0, array-uniq@^1.0.1, array-uniq@^1.0.2:\n  version \"1.0.3\"\n  resolved \"https://registry.yarnpkg.com/array-uniq/-/array-uniq-1.0.3.tgz#af6ac877a25cc7f74e058894753858dfdb24fdb6\"\n\narray-unique@^0.2.1:\n  version \"0.2.1\"\n  resolved \"https://registry.yarnpkg.com/array-unique/-/array-unique-0.2.1.tgz#a1d97ccafcbc2625cc70fadceb36a50c58b01a53\"\n\narray-unique@^0.3.2:\n  version \"0.3.2\"\n  resolved \"https://registry.yarnpkg.com/array-unique/-/array-unique-0.3.2.tgz#a894b75d4bc4f6cd679ef3244a9fd8f46ae2d428\"\n\narraybuffer.slice@~0.0.7:\n  version \"0.0.7\"\n  resolved \"https://registry.yarnpkg.com/arraybuffer.slice/-/arraybuffer.slice-0.0.7.tgz#3bbc4275dd584cc1b10809b89d4e8b63a69e7675\"\n\narrify@^1.0.0:\n  version \"1.0.1\"\n  resolved \"https://registry.yarnpkg.com/arrify/-/arrify-1.0.1.tgz#898508da2226f380df904728456849c1501a4b0d\"\n\nasap@~2.0.3:\n  version \"2.0.6\"\n  resolved \"https://registry.yarnpkg.com/asap/-/asap-2.0.6.tgz#e50347611d7e690943208bbdafebcbc2fb866d46\"\n\nasn1.js@^4.0.0:\n  version \"4.10.1\"\n  resolved \"https://registry.yarnpkg.com/asn1.js/-/asn1.js-4.10.1.tgz#b9c2bf5805f1e64aadeed6df3a2bfafb5a73f5a0\"\n  dependencies:\n    bn.js \"^4.0.0\"\n    inherits \"^2.0.1\"\n    minimalistic-assert \"^1.0.0\"\n\nasn1@0.1.11:\n  version \"0.1.11\"\n  resolved \"https://registry.yarnpkg.com/asn1/-/asn1-0.1.11.tgz#559be18376d08a4ec4dbe80877d27818639b2df7\"\n\nasn1@0.2.1:\n  version \"0.2.1\"\n  resolved \"https://registry.yarnpkg.com/asn1/-/asn1-0.2.1.tgz#ecc73f75d31ea3c6ed9d47428db35fecc7b2c6dc\"\n\nasn1@~0.2.3:\n  version \"0.2.4\"\n  resolved \"https://registry.yarnpkg.com/asn1/-/asn1-0.2.4.tgz#8d2475dfab553bb33e77b54e59e880bb8ce23136\"\n  dependencies:\n    safer-buffer \"~2.1.0\"\n\nassert-plus@1.0.0, assert-plus@^1.0.0:\n  version \"1.0.0\"\n  resolved \"https://registry.yarnpkg.com/assert-plus/-/assert-plus-1.0.0.tgz#f12e0f3c5d77b0b1cdd9146942e4e96c1e4dd525\"\n\nassert-plus@^0.1.5:\n  version \"0.1.5\"\n  resolved \"https://registry.yarnpkg.com/assert-plus/-/assert-plus-0.1.5.tgz#ee74009413002d84cec7219c6ac811812e723160\"\n\nassert-plus@^0.2.0:\n  version \"0.2.0\"\n  resolved \"https://registry.yarnpkg.com/assert-plus/-/assert-plus-0.2.0.tgz#d74e1b87e7affc0db8aadb7021f3fe48101ab234\"\n\nassert@^1.1.1:\n  version \"1.4.1\"\n  resolved \"https://registry.yarnpkg.com/assert/-/assert-1.4.1.tgz#99912d591836b5a6f5b345c0f07eefc08fc65d91\"\n  dependencies:\n    util \"0.10.3\"\n\nassign-symbols@^1.0.0:\n  version \"1.0.0\"\n  resolved \"https://registry.yarnpkg.com/assign-symbols/-/assign-symbols-1.0.0.tgz#59667f41fadd4f20ccbc2bb96b8d4f7f78ec0367\"\n\nasync-done@^1.2.0, async-done@^1.2.2:\n  version \"1.3.1\"\n  resolved \"https://registry.yarnpkg.com/async-done/-/async-done-1.3.1.tgz#14b7b73667b864c8f02b5b253fc9c6eddb777f3e\"\n  dependencies:\n    end-of-stream \"^1.1.0\"\n    once \"^1.3.2\"\n    process-nextick-args \"^1.0.7\"\n    stream-exhaust \"^1.0.1\"\n\nasync-each-series@0.1.1:\n  version \"0.1.1\"\n  resolved \"https://registry.yarnpkg.com/async-each-series/-/async-each-series-0.1.1.tgz#7617c1917401fd8ca4a28aadce3dbae98afeb432\"\n\nasync-each-series@^1.1.0:\n  version \"1.1.0\"\n  resolved \"https://registry.yarnpkg.com/async-each-series/-/async-each-series-1.1.0.tgz#f42fd8155d38f21a5b8ea07c28e063ed1700b138\"\n\nasync-each@^1.0.0:\n  version \"1.0.1\"\n  resolved \"https://registry.yarnpkg.com/async-each/-/async-each-1.0.1.tgz#19d386a1d9edc6e7c1c85d388aedbcc56d33602d\"\n\nasync-each@^1.0.1:\n  version \"1.0.2\"\n  resolved \"https://registry.yarnpkg.com/async-each/-/async-each-1.0.2.tgz#8b8a7ca2a658f927e9f307d6d1a42f4199f0f735\"\n\nasync-foreach@^0.1.3:\n  version \"0.1.3\"\n  resolved \"https://registry.yarnpkg.com/async-foreach/-/async-foreach-0.1.3.tgz#36121f845c0578172de419a97dbeb1d16ec34542\"\n\nasync-limiter@~1.0.0:\n  version \"1.0.0\"\n  resolved \"https://registry.yarnpkg.com/async-limiter/-/async-limiter-1.0.0.tgz#78faed8c3d074ab81f22b4e985d79e8738f720f8\"\n\nasync-settle@^1.0.0:\n  version \"1.0.0\"\n  resolved \"https://registry.yarnpkg.com/async-settle/-/async-settle-1.0.0.tgz#1d0a914bb02575bec8a8f3a74e5080f72b2c0c6b\"\n  dependencies:\n    async-done \"^1.2.2\"\n\nasync@1.5.2, async@^1.3.0, async@^1.5.0:\n  version \"1.5.2\"\n  resolved \"https://registry.yarnpkg.com/async/-/async-1.5.2.tgz#ec6a61ae56480c0c3cb241c95618e20892f9672a\"\n\nasync@^0.9.0, async@~0.9.0:\n  version \"0.9.2\"\n  resolved \"https://registry.yarnpkg.com/async/-/async-0.9.2.tgz#aea74d5e61c1f899613bf64bda66d4c78f2fd17d\"\n\nasync@^2.1.2, async@^2.6.0, async@^2.6.1:\n  version \"2.6.1\"\n  resolved \"https://registry.yarnpkg.com/async/-/async-2.6.1.tgz#b245a23ca71930044ec53fa46aa00a3e87c6a610\"\n  dependencies:\n    lodash \"^4.17.10\"\n\nasync@~0.2.10, async@~0.2.6:\n  version \"0.2.10\"\n  resolved \"https://registry.yarnpkg.com/async/-/async-0.2.10.tgz#b6bbe0b0674b9d719708ca38de8c237cb526c3d1\"\n\nasync@~1.0.0:\n  version \"1.0.0\"\n  resolved \"https://registry.yarnpkg.com/async/-/async-1.0.0.tgz#f8fc04ca3a13784ade9e1641af98578cfbd647a9\"\n\nasynckit@^0.4.0:\n  version \"0.4.0\"\n  resolved \"https://registry.yarnpkg.com/asynckit/-/asynckit-0.4.0.tgz#c79ed97f7f34cb8f2ba1bc9790bcc366474b4b79\"\n\natob@^2.1.1:\n  version \"2.1.1\"\n  resolved \"https://registry.yarnpkg.com/atob/-/atob-2.1.1.tgz#ae2d5a729477f289d60dd7f96a6314a22dd6c22a\"\n\nautoprefixer@^6.3.1, autoprefixer@^6.3.3:\n  version \"6.7.7\"\n  resolved \"https://registry.yarnpkg.com/autoprefixer/-/autoprefixer-6.7.7.tgz#1dbd1c835658e35ce3f9984099db00585c782014\"\n  dependencies:\n    browserslist \"^1.7.6\"\n    caniuse-db \"^1.0.30000634\"\n    normalize-range \"^0.1.2\"\n    num2fraction \"^1.2.2\"\n    postcss \"^5.2.16\"\n    postcss-value-parser \"^3.2.3\"\n\naws-sign2@~0.5.0:\n  version \"0.5.0\"\n  resolved \"https://registry.yarnpkg.com/aws-sign2/-/aws-sign2-0.5.0.tgz#c57103f7a17fc037f02d7c2e64b602ea223f7d63\"\n\naws-sign2@~0.6.0:\n  version \"0.6.0\"\n  resolved \"https://registry.yarnpkg.com/aws-sign2/-/aws-sign2-0.6.0.tgz#14342dd38dbcc94d0e5b87d763cd63612c0e794f\"\n\naws-sign2@~0.7.0:\n  version \"0.7.0\"\n  resolved \"https://registry.yarnpkg.com/aws-sign2/-/aws-sign2-0.7.0.tgz#b46e890934a9591f2d2f6f86d7e6a9f1b3fe76a8\"\n\naws4@^1.2.1, aws4@^1.6.0:\n  version \"1.7.0\"\n  resolved \"https://registry.yarnpkg.com/aws4/-/aws4-1.7.0.tgz#d4d0e9b9dbfca77bf08eeb0a8a471550fe39e289\"\n\naxios@0.17.1:\n  version \"0.17.1\"\n  resolved \"https://registry.yarnpkg.com/axios/-/axios-0.17.1.tgz#2d8e3e5d0bdbd7327f91bc814f5c57660f81824d\"\n  dependencies:\n    follow-redirects \"^1.2.5\"\n    is-buffer \"^1.1.5\"\n\nbabel-code-frame@^6.26.0:\n  version \"6.26.0\"\n  resolved \"https://registry.yarnpkg.com/babel-code-frame/-/babel-code-frame-6.26.0.tgz#63fd43f7dc1e3bb7ce35947db8fe369a3f58c74b\"\n  dependencies:\n    chalk \"^1.1.3\"\n    esutils \"^2.0.2\"\n    js-tokens \"^3.0.2\"\n\nbabel-core@^6.10.4, babel-core@^6.23.1, babel-core@^6.26.0:\n  version \"6.26.3\"\n  resolved \"https://registry.yarnpkg.com/babel-core/-/babel-core-6.26.3.tgz#b2e2f09e342d0f0c88e2f02e067794125e75c207\"\n  dependencies:\n    babel-code-frame \"^6.26.0\"\n    babel-generator \"^6.26.0\"\n    babel-helpers \"^6.24.1\"\n    babel-messages \"^6.23.0\"\n    babel-register \"^6.26.0\"\n    babel-runtime \"^6.26.0\"\n    babel-template \"^6.26.0\"\n    babel-traverse \"^6.26.0\"\n    babel-types \"^6.26.0\"\n    babylon \"^6.18.0\"\n    convert-source-map \"^1.5.1\"\n    debug \"^2.6.9\"\n    json5 \"^0.5.1\"\n    lodash \"^4.17.4\"\n    minimatch \"^3.0.4\"\n    path-is-absolute \"^1.0.1\"\n    private \"^0.1.8\"\n    slash \"^1.0.0\"\n    source-map \"^0.5.7\"\n\nbabel-generator@^6.26.0:\n  version \"6.26.1\"\n  resolved \"https://registry.yarnpkg.com/babel-generator/-/babel-generator-6.26.1.tgz#1844408d3b8f0d35a404ea7ac180f087a601bd90\"\n  dependencies:\n    babel-messages \"^6.23.0\"\n    babel-runtime \"^6.26.0\"\n    babel-types \"^6.26.0\"\n    detect-indent \"^4.0.0\"\n    jsesc \"^1.3.0\"\n    lodash \"^4.17.4\"\n    source-map \"^0.5.7\"\n    trim-right \"^1.0.1\"\n\nbabel-helper-bindify-decorators@^6.24.1:\n  version \"6.24.1\"\n  resolved \"https://registry.yarnpkg.com/babel-helper-bindify-decorators/-/babel-helper-bindify-decorators-6.24.1.tgz#14c19e5f142d7b47f19a52431e52b1ccbc40a330\"\n  dependencies:\n    babel-runtime \"^6.22.0\"\n    babel-traverse \"^6.24.1\"\n    babel-types \"^6.24.1\"\n\nbabel-helper-builder-binary-assignment-operator-visitor@^6.24.1:\n  version \"6.24.1\"\n  resolved \"https://registry.yarnpkg.com/babel-helper-builder-binary-assignment-operator-visitor/-/babel-helper-builder-binary-assignment-operator-visitor-6.24.1.tgz#cce4517ada356f4220bcae8a02c2b346f9a56664\"\n  dependencies:\n    babel-helper-explode-assignable-expression \"^6.24.1\"\n    babel-runtime \"^6.22.0\"\n    babel-types \"^6.24.1\"\n\nbabel-helper-call-delegate@^6.24.1:\n  version \"6.24.1\"\n  resolved \"https://registry.yarnpkg.com/babel-helper-call-delegate/-/babel-helper-call-delegate-6.24.1.tgz#ece6aacddc76e41c3461f88bfc575bd0daa2df8d\"\n  dependencies:\n    babel-helper-hoist-variables \"^6.24.1\"\n    babel-runtime \"^6.22.0\"\n    babel-traverse \"^6.24.1\"\n    babel-types \"^6.24.1\"\n\nbabel-helper-define-map@^6.24.1:\n  version \"6.26.0\"\n  resolved \"https://registry.yarnpkg.com/babel-helper-define-map/-/babel-helper-define-map-6.26.0.tgz#a5f56dab41a25f97ecb498c7ebaca9819f95be5f\"\n  dependencies:\n    babel-helper-function-name \"^6.24.1\"\n    babel-runtime \"^6.26.0\"\n    babel-types \"^6.26.0\"\n    lodash \"^4.17.4\"\n\nbabel-helper-explode-assignable-expression@^6.24.1:\n  version \"6.24.1\"\n  resolved \"https://registry.yarnpkg.com/babel-helper-explode-assignable-expression/-/babel-helper-explode-assignable-expression-6.24.1.tgz#f25b82cf7dc10433c55f70592d5746400ac22caa\"\n  dependencies:\n    babel-runtime \"^6.22.0\"\n    babel-traverse \"^6.24.1\"\n    babel-types \"^6.24.1\"\n\nbabel-helper-explode-class@^6.24.1:\n  version \"6.24.1\"\n  resolved \"https://registry.yarnpkg.com/babel-helper-explode-class/-/babel-helper-explode-class-6.24.1.tgz#7dc2a3910dee007056e1e31d640ced3d54eaa9eb\"\n  dependencies:\n    babel-helper-bindify-decorators \"^6.24.1\"\n    babel-runtime \"^6.22.0\"\n    babel-traverse \"^6.24.1\"\n    babel-types \"^6.24.1\"\n\nbabel-helper-function-name@^6.24.1:\n  version \"6.24.1\"\n  resolved \"https://registry.yarnpkg.com/babel-helper-function-name/-/babel-helper-function-name-6.24.1.tgz#d3475b8c03ed98242a25b48351ab18399d3580a9\"\n  dependencies:\n    babel-helper-get-function-arity \"^6.24.1\"\n    babel-runtime \"^6.22.0\"\n    babel-template \"^6.24.1\"\n    babel-traverse \"^6.24.1\"\n    babel-types \"^6.24.1\"\n\nbabel-helper-get-function-arity@^6.24.1:\n  version \"6.24.1\"\n  resolved \"https://registry.yarnpkg.com/babel-helper-get-function-arity/-/babel-helper-get-function-arity-6.24.1.tgz#8f7782aa93407c41d3aa50908f89b031b1b6853d\"\n  dependencies:\n    babel-runtime \"^6.22.0\"\n    babel-types \"^6.24.1\"\n\nbabel-helper-hoist-variables@^6.24.1:\n  version \"6.24.1\"\n  resolved \"https://registry.yarnpkg.com/babel-helper-hoist-variables/-/babel-helper-hoist-variables-6.24.1.tgz#1ecb27689c9d25513eadbc9914a73f5408be7a76\"\n  dependencies:\n    babel-runtime \"^6.22.0\"\n    babel-types \"^6.24.1\"\n\nbabel-helper-optimise-call-expression@^6.24.1:\n  version \"6.24.1\"\n  resolved \"https://registry.yarnpkg.com/babel-helper-optimise-call-expression/-/babel-helper-optimise-call-expression-6.24.1.tgz#f7a13427ba9f73f8f4fa993c54a97882d1244257\"\n  dependencies:\n    babel-runtime \"^6.22.0\"\n    babel-types \"^6.24.1\"\n\nbabel-helper-regex@^6.24.1:\n  version \"6.26.0\"\n  resolved \"https://registry.yarnpkg.com/babel-helper-regex/-/babel-helper-regex-6.26.0.tgz#325c59f902f82f24b74faceed0363954f6495e72\"\n  dependencies:\n    babel-runtime \"^6.26.0\"\n    babel-types \"^6.26.0\"\n    lodash \"^4.17.4\"\n\nbabel-helper-remap-async-to-generator@^6.24.1:\n  version \"6.24.1\"\n  resolved \"https://registry.yarnpkg.com/babel-helper-remap-async-to-generator/-/babel-helper-remap-async-to-generator-6.24.1.tgz#5ec581827ad723fecdd381f1c928390676e4551b\"\n  dependencies:\n    babel-helper-function-name \"^6.24.1\"\n    babel-runtime \"^6.22.0\"\n    babel-template \"^6.24.1\"\n    babel-traverse \"^6.24.1\"\n    babel-types \"^6.24.1\"\n\nbabel-helper-replace-supers@^6.24.1:\n  version \"6.24.1\"\n  resolved \"https://registry.yarnpkg.com/babel-helper-replace-supers/-/babel-helper-replace-supers-6.24.1.tgz#bf6dbfe43938d17369a213ca8a8bf74b6a90ab1a\"\n  dependencies:\n    babel-helper-optimise-call-expression \"^6.24.1\"\n    babel-messages \"^6.23.0\"\n    babel-runtime \"^6.22.0\"\n    babel-template \"^6.24.1\"\n    babel-traverse \"^6.24.1\"\n    babel-types \"^6.24.1\"\n\nbabel-helpers@^6.24.1:\n  version \"6.24.1\"\n  resolved \"https://registry.yarnpkg.com/babel-helpers/-/babel-helpers-6.24.1.tgz#3471de9caec388e5c850e597e58a26ddf37602b2\"\n  dependencies:\n    babel-runtime \"^6.22.0\"\n    babel-template \"^6.24.1\"\n\nbabel-loader@^6.2.4:\n  version \"6.4.1\"\n  resolved \"https://registry.yarnpkg.com/babel-loader/-/babel-loader-6.4.1.tgz#0b34112d5b0748a8dcdbf51acf6f9bd42d50b8ca\"\n  dependencies:\n    find-cache-dir \"^0.1.1\"\n    loader-utils \"^0.2.16\"\n    mkdirp \"^0.5.1\"\n    object-assign \"^4.0.1\"\n\nbabel-messages@^6.23.0:\n  version \"6.23.0\"\n  resolved \"https://registry.yarnpkg.com/babel-messages/-/babel-messages-6.23.0.tgz#f3cdf4703858035b2a2951c6ec5edf6c62f2630e\"\n  dependencies:\n    babel-runtime \"^6.22.0\"\n\nbabel-plugin-check-es2015-constants@^6.22.0:\n  version \"6.22.0\"\n  resolved \"https://registry.yarnpkg.com/babel-plugin-check-es2015-constants/-/babel-plugin-check-es2015-constants-6.22.0.tgz#35157b101426fd2ffd3da3f75c7d1e91835bbf8a\"\n  dependencies:\n    babel-runtime \"^6.22.0\"\n\nbabel-plugin-syntax-async-functions@^6.8.0:\n  version \"6.13.0\"\n  resolved \"https://registry.yarnpkg.com/babel-plugin-syntax-async-functions/-/babel-plugin-syntax-async-functions-6.13.0.tgz#cad9cad1191b5ad634bf30ae0872391e0647be95\"\n\nbabel-plugin-syntax-async-generators@^6.5.0:\n  version \"6.13.0\"\n  resolved \"https://registry.yarnpkg.com/babel-plugin-syntax-async-generators/-/babel-plugin-syntax-async-generators-6.13.0.tgz#6bc963ebb16eccbae6b92b596eb7f35c342a8b9a\"\n\nbabel-plugin-syntax-class-properties@^6.8.0:\n  version \"6.13.0\"\n  resolved \"https://registry.yarnpkg.com/babel-plugin-syntax-class-properties/-/babel-plugin-syntax-class-properties-6.13.0.tgz#d7eb23b79a317f8543962c505b827c7d6cac27de\"\n\nbabel-plugin-syntax-decorators@^6.13.0:\n  version \"6.13.0\"\n  resolved \"https://registry.yarnpkg.com/babel-plugin-syntax-decorators/-/babel-plugin-syntax-decorators-6.13.0.tgz#312563b4dbde3cc806cee3e416cceeaddd11ac0b\"\n\nbabel-plugin-syntax-dynamic-import@^6.18.0:\n  version \"6.18.0\"\n  resolved \"https://registry.yarnpkg.com/babel-plugin-syntax-dynamic-import/-/babel-plugin-syntax-dynamic-import-6.18.0.tgz#8d6a26229c83745a9982a441051572caa179b1da\"\n\nbabel-plugin-syntax-exponentiation-operator@^6.8.0:\n  version \"6.13.0\"\n  resolved \"https://registry.yarnpkg.com/babel-plugin-syntax-exponentiation-operator/-/babel-plugin-syntax-exponentiation-operator-6.13.0.tgz#9ee7e8337290da95288201a6a57f4170317830de\"\n\nbabel-plugin-syntax-object-rest-spread@^6.8.0:\n  version \"6.13.0\"\n  resolved \"https://registry.yarnpkg.com/babel-plugin-syntax-object-rest-spread/-/babel-plugin-syntax-object-rest-spread-6.13.0.tgz#fd6536f2bce13836ffa3a5458c4903a597bb3bf5\"\n\nbabel-plugin-syntax-trailing-function-commas@^6.22.0:\n  version \"6.22.0\"\n  resolved \"https://registry.yarnpkg.com/babel-plugin-syntax-trailing-function-commas/-/babel-plugin-syntax-trailing-function-commas-6.22.0.tgz#ba0360937f8d06e40180a43fe0d5616fff532cf3\"\n\nbabel-plugin-transform-async-generator-functions@^6.24.1:\n  version \"6.24.1\"\n  resolved \"https://registry.yarnpkg.com/babel-plugin-transform-async-generator-functions/-/babel-plugin-transform-async-generator-functions-6.24.1.tgz#f058900145fd3e9907a6ddf28da59f215258a5db\"\n  dependencies:\n    babel-helper-remap-async-to-generator \"^6.24.1\"\n    babel-plugin-syntax-async-generators \"^6.5.0\"\n    babel-runtime \"^6.22.0\"\n\nbabel-plugin-transform-async-to-generator@^6.24.1:\n  version \"6.24.1\"\n  resolved \"https://registry.yarnpkg.com/babel-plugin-transform-async-to-generator/-/babel-plugin-transform-async-to-generator-6.24.1.tgz#6536e378aff6cb1d5517ac0e40eb3e9fc8d08761\"\n  dependencies:\n    babel-helper-remap-async-to-generator \"^6.24.1\"\n    babel-plugin-syntax-async-functions \"^6.8.0\"\n    babel-runtime \"^6.22.0\"\n\nbabel-plugin-transform-class-properties@^6.24.1:\n  version \"6.24.1\"\n  resolved \"https://registry.yarnpkg.com/babel-plugin-transform-class-properties/-/babel-plugin-transform-class-properties-6.24.1.tgz#6a79763ea61d33d36f37b611aa9def81a81b46ac\"\n  dependencies:\n    babel-helper-function-name \"^6.24.1\"\n    babel-plugin-syntax-class-properties \"^6.8.0\"\n    babel-runtime \"^6.22.0\"\n    babel-template \"^6.24.1\"\n\nbabel-plugin-transform-decorators@^6.24.1:\n  version \"6.24.1\"\n  resolved \"https://registry.yarnpkg.com/babel-plugin-transform-decorators/-/babel-plugin-transform-decorators-6.24.1.tgz#788013d8f8c6b5222bdf7b344390dfd77569e24d\"\n  dependencies:\n    babel-helper-explode-class \"^6.24.1\"\n    babel-plugin-syntax-decorators \"^6.13.0\"\n    babel-runtime \"^6.22.0\"\n    babel-template \"^6.24.1\"\n    babel-types \"^6.24.1\"\n\nbabel-plugin-transform-es2015-arrow-functions@^6.22.0:\n  version \"6.22.0\"\n  resolved \"https://registry.yarnpkg.com/babel-plugin-transform-es2015-arrow-functions/-/babel-plugin-transform-es2015-arrow-functions-6.22.0.tgz#452692cb711d5f79dc7f85e440ce41b9f244d221\"\n  dependencies:\n    babel-runtime \"^6.22.0\"\n\nbabel-plugin-transform-es2015-block-scoped-functions@^6.22.0:\n  version \"6.22.0\"\n  resolved \"https://registry.yarnpkg.com/babel-plugin-transform-es2015-block-scoped-functions/-/babel-plugin-transform-es2015-block-scoped-functions-6.22.0.tgz#bbc51b49f964d70cb8d8e0b94e820246ce3a6141\"\n  dependencies:\n    babel-runtime \"^6.22.0\"\n\nbabel-plugin-transform-es2015-block-scoping@^6.24.1:\n  version \"6.26.0\"\n  resolved \"https://registry.yarnpkg.com/babel-plugin-transform-es2015-block-scoping/-/babel-plugin-transform-es2015-block-scoping-6.26.0.tgz#d70f5299c1308d05c12f463813b0a09e73b1895f\"\n  dependencies:\n    babel-runtime \"^6.26.0\"\n    babel-template \"^6.26.0\"\n    babel-traverse \"^6.26.0\"\n    babel-types \"^6.26.0\"\n    lodash \"^4.17.4\"\n\nbabel-plugin-transform-es2015-classes@^6.24.1:\n  version \"6.24.1\"\n  resolved \"https://registry.yarnpkg.com/babel-plugin-transform-es2015-classes/-/babel-plugin-transform-es2015-classes-6.24.1.tgz#5a4c58a50c9c9461e564b4b2a3bfabc97a2584db\"\n  dependencies:\n    babel-helper-define-map \"^6.24.1\"\n    babel-helper-function-name \"^6.24.1\"\n    babel-helper-optimise-call-expression \"^6.24.1\"\n    babel-helper-replace-supers \"^6.24.1\"\n    babel-messages \"^6.23.0\"\n    babel-runtime \"^6.22.0\"\n    babel-template \"^6.24.1\"\n    babel-traverse \"^6.24.1\"\n    babel-types \"^6.24.1\"\n\nbabel-plugin-transform-es2015-computed-properties@^6.24.1:\n  version \"6.24.1\"\n  resolved \"https://registry.yarnpkg.com/babel-plugin-transform-es2015-computed-properties/-/babel-plugin-transform-es2015-computed-properties-6.24.1.tgz#6fe2a8d16895d5634f4cd999b6d3480a308159b3\"\n  dependencies:\n    babel-runtime \"^6.22.0\"\n    babel-template \"^6.24.1\"\n\nbabel-plugin-transform-es2015-destructuring@^6.22.0:\n  version \"6.23.0\"\n  resolved \"https://registry.yarnpkg.com/babel-plugin-transform-es2015-destructuring/-/babel-plugin-transform-es2015-destructuring-6.23.0.tgz#997bb1f1ab967f682d2b0876fe358d60e765c56d\"\n  dependencies:\n    babel-runtime \"^6.22.0\"\n\nbabel-plugin-transform-es2015-duplicate-keys@^6.24.1:\n  version \"6.24.1\"\n  resolved \"https://registry.yarnpkg.com/babel-plugin-transform-es2015-duplicate-keys/-/babel-plugin-transform-es2015-duplicate-keys-6.24.1.tgz#73eb3d310ca969e3ef9ec91c53741a6f1576423e\"\n  dependencies:\n    babel-runtime \"^6.22.0\"\n    babel-types \"^6.24.1\"\n\nbabel-plugin-transform-es2015-for-of@^6.22.0:\n  version \"6.23.0\"\n  resolved \"https://registry.yarnpkg.com/babel-plugin-transform-es2015-for-of/-/babel-plugin-transform-es2015-for-of-6.23.0.tgz#f47c95b2b613df1d3ecc2fdb7573623c75248691\"\n  dependencies:\n    babel-runtime \"^6.22.0\"\n\nbabel-plugin-transform-es2015-function-name@^6.24.1:\n  version \"6.24.1\"\n  resolved \"https://registry.yarnpkg.com/babel-plugin-transform-es2015-function-name/-/babel-plugin-transform-es2015-function-name-6.24.1.tgz#834c89853bc36b1af0f3a4c5dbaa94fd8eacaa8b\"\n  dependencies:\n    babel-helper-function-name \"^6.24.1\"\n    babel-runtime \"^6.22.0\"\n    babel-types \"^6.24.1\"\n\nbabel-plugin-transform-es2015-literals@^6.22.0:\n  version \"6.22.0\"\n  resolved \"https://registry.yarnpkg.com/babel-plugin-transform-es2015-literals/-/babel-plugin-transform-es2015-literals-6.22.0.tgz#4f54a02d6cd66cf915280019a31d31925377ca2e\"\n  dependencies:\n    babel-runtime \"^6.22.0\"\n\nbabel-plugin-transform-es2015-modules-amd@^6.24.1:\n  version \"6.24.1\"\n  resolved \"https://registry.yarnpkg.com/babel-plugin-transform-es2015-modules-amd/-/babel-plugin-transform-es2015-modules-amd-6.24.1.tgz#3b3e54017239842d6d19c3011c4bd2f00a00d154\"\n  dependencies:\n    babel-plugin-transform-es2015-modules-commonjs \"^6.24.1\"\n    babel-runtime \"^6.22.0\"\n    babel-template \"^6.24.1\"\n\nbabel-plugin-transform-es2015-modules-commonjs@^6.24.1:\n  version \"6.26.2\"\n  resolved \"https://registry.yarnpkg.com/babel-plugin-transform-es2015-modules-commonjs/-/babel-plugin-transform-es2015-modules-commonjs-6.26.2.tgz#58a793863a9e7ca870bdc5a881117ffac27db6f3\"\n  dependencies:\n    babel-plugin-transform-strict-mode \"^6.24.1\"\n    babel-runtime \"^6.26.0\"\n    babel-template \"^6.26.0\"\n    babel-types \"^6.26.0\"\n\nbabel-plugin-transform-es2015-modules-systemjs@^6.24.1:\n  version \"6.24.1\"\n  resolved \"https://registry.yarnpkg.com/babel-plugin-transform-es2015-modules-systemjs/-/babel-plugin-transform-es2015-modules-systemjs-6.24.1.tgz#ff89a142b9119a906195f5f106ecf305d9407d23\"\n  dependencies:\n    babel-helper-hoist-variables \"^6.24.1\"\n    babel-runtime \"^6.22.0\"\n    babel-template \"^6.24.1\"\n\nbabel-plugin-transform-es2015-modules-umd@^6.24.1:\n  version \"6.24.1\"\n  resolved \"https://registry.yarnpkg.com/babel-plugin-transform-es2015-modules-umd/-/babel-plugin-transform-es2015-modules-umd-6.24.1.tgz#ac997e6285cd18ed6176adb607d602344ad38468\"\n  dependencies:\n    babel-plugin-transform-es2015-modules-amd \"^6.24.1\"\n    babel-runtime \"^6.22.0\"\n    babel-template \"^6.24.1\"\n\nbabel-plugin-transform-es2015-object-super@^6.24.1:\n  version \"6.24.1\"\n  resolved \"https://registry.yarnpkg.com/babel-plugin-transform-es2015-object-super/-/babel-plugin-transform-es2015-object-super-6.24.1.tgz#24cef69ae21cb83a7f8603dad021f572eb278f8d\"\n  dependencies:\n    babel-helper-replace-supers \"^6.24.1\"\n    babel-runtime \"^6.22.0\"\n\nbabel-plugin-transform-es2015-parameters@^6.24.1:\n  version \"6.24.1\"\n  resolved \"https://registry.yarnpkg.com/babel-plugin-transform-es2015-parameters/-/babel-plugin-transform-es2015-parameters-6.24.1.tgz#57ac351ab49caf14a97cd13b09f66fdf0a625f2b\"\n  dependencies:\n    babel-helper-call-delegate \"^6.24.1\"\n    babel-helper-get-function-arity \"^6.24.1\"\n    babel-runtime \"^6.22.0\"\n    babel-template \"^6.24.1\"\n    babel-traverse \"^6.24.1\"\n    babel-types \"^6.24.1\"\n\nbabel-plugin-transform-es2015-shorthand-properties@^6.24.1:\n  version \"6.24.1\"\n  resolved \"https://registry.yarnpkg.com/babel-plugin-transform-es2015-shorthand-properties/-/babel-plugin-transform-es2015-shorthand-properties-6.24.1.tgz#24f875d6721c87661bbd99a4622e51f14de38aa0\"\n  dependencies:\n    babel-runtime \"^6.22.0\"\n    babel-types \"^6.24.1\"\n\nbabel-plugin-transform-es2015-spread@^6.22.0:\n  version \"6.22.0\"\n  resolved \"https://registry.yarnpkg.com/babel-plugin-transform-es2015-spread/-/babel-plugin-transform-es2015-spread-6.22.0.tgz#d6d68a99f89aedc4536c81a542e8dd9f1746f8d1\"\n  dependencies:\n    babel-runtime \"^6.22.0\"\n\nbabel-plugin-transform-es2015-sticky-regex@^6.24.1:\n  version \"6.24.1\"\n  resolved \"https://registry.yarnpkg.com/babel-plugin-transform-es2015-sticky-regex/-/babel-plugin-transform-es2015-sticky-regex-6.24.1.tgz#00c1cdb1aca71112cdf0cf6126c2ed6b457ccdbc\"\n  dependencies:\n    babel-helper-regex \"^6.24.1\"\n    babel-runtime \"^6.22.0\"\n    babel-types \"^6.24.1\"\n\nbabel-plugin-transform-es2015-template-literals@^6.22.0:\n  version \"6.22.0\"\n  resolved \"https://registry.yarnpkg.com/babel-plugin-transform-es2015-template-literals/-/babel-plugin-transform-es2015-template-literals-6.22.0.tgz#a84b3450f7e9f8f1f6839d6d687da84bb1236d8d\"\n  dependencies:\n    babel-runtime \"^6.22.0\"\n\nbabel-plugin-transform-es2015-typeof-symbol@^6.22.0:\n  version \"6.23.0\"\n  resolved \"https://registry.yarnpkg.com/babel-plugin-transform-es2015-typeof-symbol/-/babel-plugin-transform-es2015-typeof-symbol-6.23.0.tgz#dec09f1cddff94b52ac73d505c84df59dcceb372\"\n  dependencies:\n    babel-runtime \"^6.22.0\"\n\nbabel-plugin-transform-es2015-unicode-regex@^6.24.1:\n  version \"6.24.1\"\n  resolved \"https://registry.yarnpkg.com/babel-plugin-transform-es2015-unicode-regex/-/babel-plugin-transform-es2015-unicode-regex-6.24.1.tgz#d38b12f42ea7323f729387f18a7c5ae1faeb35e9\"\n  dependencies:\n    babel-helper-regex \"^6.24.1\"\n    babel-runtime \"^6.22.0\"\n    regexpu-core \"^2.0.0\"\n\nbabel-plugin-transform-exponentiation-operator@^6.24.1:\n  version \"6.24.1\"\n  resolved \"https://registry.yarnpkg.com/babel-plugin-transform-exponentiation-operator/-/babel-plugin-transform-exponentiation-operator-6.24.1.tgz#2ab0c9c7f3098fa48907772bb813fe41e8de3a0e\"\n  dependencies:\n    babel-helper-builder-binary-assignment-operator-visitor \"^6.24.1\"\n    babel-plugin-syntax-exponentiation-operator \"^6.8.0\"\n    babel-runtime \"^6.22.0\"\n\nbabel-plugin-transform-object-rest-spread@^6.22.0:\n  version \"6.26.0\"\n  resolved \"https://registry.yarnpkg.com/babel-plugin-transform-object-rest-spread/-/babel-plugin-transform-object-rest-spread-6.26.0.tgz#0f36692d50fef6b7e2d4b3ac1478137a963b7b06\"\n  dependencies:\n    babel-plugin-syntax-object-rest-spread \"^6.8.0\"\n    babel-runtime \"^6.26.0\"\n\nbabel-plugin-transform-regenerator@^6.24.1:\n  version \"6.26.0\"\n  resolved \"https://registry.yarnpkg.com/babel-plugin-transform-regenerator/-/babel-plugin-transform-regenerator-6.26.0.tgz#e0703696fbde27f0a3efcacf8b4dca2f7b3a8f2f\"\n  dependencies:\n    regenerator-transform \"^0.10.0\"\n\nbabel-plugin-transform-strict-mode@^6.24.1:\n  version \"6.24.1\"\n  resolved \"https://registry.yarnpkg.com/babel-plugin-transform-strict-mode/-/babel-plugin-transform-strict-mode-6.24.1.tgz#d5faf7aa578a65bbe591cf5edae04a0c67020758\"\n  dependencies:\n    babel-runtime \"^6.22.0\"\n    babel-types \"^6.24.1\"\n\nbabel-preset-es2015@^6.9.0:\n  version \"6.24.1\"\n  resolved \"https://registry.yarnpkg.com/babel-preset-es2015/-/babel-preset-es2015-6.24.1.tgz#d44050d6bc2c9feea702aaf38d727a0210538939\"\n  dependencies:\n    babel-plugin-check-es2015-constants \"^6.22.0\"\n    babel-plugin-transform-es2015-arrow-functions \"^6.22.0\"\n    babel-plugin-transform-es2015-block-scoped-functions \"^6.22.0\"\n    babel-plugin-transform-es2015-block-scoping \"^6.24.1\"\n    babel-plugin-transform-es2015-classes \"^6.24.1\"\n    babel-plugin-transform-es2015-computed-properties \"^6.24.1\"\n    babel-plugin-transform-es2015-destructuring \"^6.22.0\"\n    babel-plugin-transform-es2015-duplicate-keys \"^6.24.1\"\n    babel-plugin-transform-es2015-for-of \"^6.22.0\"\n    babel-plugin-transform-es2015-function-name \"^6.24.1\"\n    babel-plugin-transform-es2015-literals \"^6.22.0\"\n    babel-plugin-transform-es2015-modules-amd \"^6.24.1\"\n    babel-plugin-transform-es2015-modules-commonjs \"^6.24.1\"\n    babel-plugin-transform-es2015-modules-systemjs \"^6.24.1\"\n    babel-plugin-transform-es2015-modules-umd \"^6.24.1\"\n    babel-plugin-transform-es2015-object-super \"^6.24.1\"\n    babel-plugin-transform-es2015-parameters \"^6.24.1\"\n    babel-plugin-transform-es2015-shorthand-properties \"^6.24.1\"\n    babel-plugin-transform-es2015-spread \"^6.22.0\"\n    babel-plugin-transform-es2015-sticky-regex \"^6.24.1\"\n    babel-plugin-transform-es2015-template-literals \"^6.22.0\"\n    babel-plugin-transform-es2015-typeof-symbol \"^6.22.0\"\n    babel-plugin-transform-es2015-unicode-regex \"^6.24.1\"\n    babel-plugin-transform-regenerator \"^6.24.1\"\n\nbabel-preset-stage-2@^6.11.0:\n  version \"6.24.1\"\n  resolved \"https://registry.yarnpkg.com/babel-preset-stage-2/-/babel-preset-stage-2-6.24.1.tgz#d9e2960fb3d71187f0e64eec62bc07767219bdc1\"\n  dependencies:\n    babel-plugin-syntax-dynamic-import \"^6.18.0\"\n    babel-plugin-transform-class-properties \"^6.24.1\"\n    babel-plugin-transform-decorators \"^6.24.1\"\n    babel-preset-stage-3 \"^6.24.1\"\n\nbabel-preset-stage-3@^6.24.1:\n  version \"6.24.1\"\n  resolved \"https://registry.yarnpkg.com/babel-preset-stage-3/-/babel-preset-stage-3-6.24.1.tgz#836ada0a9e7a7fa37cb138fb9326f87934a48395\"\n  dependencies:\n    babel-plugin-syntax-trailing-function-commas \"^6.22.0\"\n    babel-plugin-transform-async-generator-functions \"^6.24.1\"\n    babel-plugin-transform-async-to-generator \"^6.24.1\"\n    babel-plugin-transform-exponentiation-operator \"^6.24.1\"\n    babel-plugin-transform-object-rest-spread \"^6.22.0\"\n\nbabel-register@^6.26.0:\n  version \"6.26.0\"\n  resolved \"https://registry.yarnpkg.com/babel-register/-/babel-register-6.26.0.tgz#6ed021173e2fcb486d7acb45c6009a856f647071\"\n  dependencies:\n    babel-core \"^6.26.0\"\n    babel-runtime \"^6.26.0\"\n    core-js \"^2.5.0\"\n    home-or-tmp \"^2.0.0\"\n    lodash \"^4.17.4\"\n    mkdirp \"^0.5.1\"\n    source-map-support \"^0.4.15\"\n\nbabel-runtime@^6.18.0, babel-runtime@^6.22.0, babel-runtime@^6.26.0:\n  version \"6.26.0\"\n  resolved \"https://registry.yarnpkg.com/babel-runtime/-/babel-runtime-6.26.0.tgz#965c7058668e82b55d7bfe04ff2337bc8b5647fe\"\n  dependencies:\n    core-js \"^2.4.0\"\n    regenerator-runtime \"^0.11.0\"\n\nbabel-template@^6.24.1, babel-template@^6.26.0:\n  version \"6.26.0\"\n  resolved \"https://registry.yarnpkg.com/babel-template/-/babel-template-6.26.0.tgz#de03e2d16396b069f46dd9fff8521fb1a0e35e02\"\n  dependencies:\n    babel-runtime \"^6.26.0\"\n    babel-traverse \"^6.26.0\"\n    babel-types \"^6.26.0\"\n    babylon \"^6.18.0\"\n    lodash \"^4.17.4\"\n\nbabel-traverse@^6.24.1, babel-traverse@^6.26.0:\n  version \"6.26.0\"\n  resolved \"https://registry.yarnpkg.com/babel-traverse/-/babel-traverse-6.26.0.tgz#46a9cbd7edcc62c8e5c064e2d2d8d0f4035766ee\"\n  dependencies:\n    babel-code-frame \"^6.26.0\"\n    babel-messages \"^6.23.0\"\n    babel-runtime \"^6.26.0\"\n    babel-types \"^6.26.0\"\n    babylon \"^6.18.0\"\n    debug \"^2.6.8\"\n    globals \"^9.18.0\"\n    invariant \"^2.2.2\"\n    lodash \"^4.17.4\"\n\nbabel-types@^6.19.0, babel-types@^6.24.1, babel-types@^6.26.0:\n  version \"6.26.0\"\n  resolved \"https://registry.yarnpkg.com/babel-types/-/babel-types-6.26.0.tgz#a3b073f94ab49eb6fa55cd65227a334380632497\"\n  dependencies:\n    babel-runtime \"^6.26.0\"\n    esutils \"^2.0.2\"\n    lodash \"^4.17.4\"\n    to-fast-properties \"^1.0.3\"\n\nbabylon@^6.18.0:\n  version \"6.18.0\"\n  resolved \"https://registry.yarnpkg.com/babylon/-/babylon-6.18.0.tgz#af2f3b88fa6f5c1e4c634d1a0f8eac4f55b395e3\"\n\nbach@^1.0.0:\n  version \"1.2.0\"\n  resolved \"https://registry.yarnpkg.com/bach/-/bach-1.2.0.tgz#4b3ce96bf27134f79a1b414a51c14e34c3bd9880\"\n  dependencies:\n    arr-filter \"^1.1.1\"\n    arr-flatten \"^1.0.1\"\n    arr-map \"^2.0.0\"\n    array-each \"^1.0.0\"\n    array-initial \"^1.0.0\"\n    array-last \"^1.1.1\"\n    async-done \"^1.2.2\"\n    async-settle \"^1.0.0\"\n    now-and-later \"^2.0.0\"\n\nbacko2@1.0.2:\n  version \"1.0.2\"\n  resolved \"https://registry.yarnpkg.com/backo2/-/backo2-1.0.2.tgz#31ab1ac8b129363463e35b3ebb69f4dfcfba7947\"\n\nbalanced-match@^0.4.2:\n  version \"0.4.2\"\n  resolved \"https://registry.yarnpkg.com/balanced-match/-/balanced-match-0.4.2.tgz#cb3f3e3c732dc0f01ee70b403f302e61d7709838\"\n\nbalanced-match@^1.0.0:\n  version \"1.0.0\"\n  resolved \"https://registry.yarnpkg.com/balanced-match/-/balanced-match-1.0.0.tgz#89b4d199ab2bee49de164ea02b89ce462d71b767\"\n\nbase64-arraybuffer@0.1.5:\n  version \"0.1.5\"\n  resolved \"https://registry.yarnpkg.com/base64-arraybuffer/-/base64-arraybuffer-0.1.5.tgz#73926771923b5a19747ad666aa5cd4bf9c6e9ce8\"\n\nbase64-js@^1.0.2:\n  version \"1.3.0\"\n  resolved \"https://registry.yarnpkg.com/base64-js/-/base64-js-1.3.0.tgz#cab1e6118f051095e58b5281aea8c1cd22bfc0e3\"\n\nbase64id@1.0.0:\n  version \"1.0.0\"\n  resolved \"https://registry.yarnpkg.com/base64id/-/base64id-1.0.0.tgz#47688cb99bb6804f0e06d3e763b1c32e57d8e6b6\"\n\nbase@^0.11.1:\n  version \"0.11.2\"\n  resolved \"https://registry.yarnpkg.com/base/-/base-0.11.2.tgz#7bde5ced145b6d551a90db87f83c558b4eb48a8f\"\n  dependencies:\n    cache-base \"^1.0.1\"\n    class-utils \"^0.3.5\"\n    component-emitter \"^1.2.1\"\n    define-property \"^1.0.0\"\n    isobject \"^3.0.1\"\n    mixin-deep \"^1.2.0\"\n    pascalcase \"^0.1.1\"\n\nbatch@0.6.1:\n  version \"0.6.1\"\n  resolved \"https://registry.yarnpkg.com/batch/-/batch-0.6.1.tgz#dc34314f4e679318093fc760272525f94bf25c16\"\n\nbcrypt-pbkdf@^1.0.0:\n  version \"1.0.2\"\n  resolved \"https://registry.yarnpkg.com/bcrypt-pbkdf/-/bcrypt-pbkdf-1.0.2.tgz#a4301d389b6a43f9b67ff3ca11a3f6637e360e9e\"\n  dependencies:\n    tweetnacl \"^0.14.3\"\n\nbeeper@^1.0.0:\n  version \"1.1.1\"\n  resolved \"https://registry.yarnpkg.com/beeper/-/beeper-1.1.1.tgz#e6d5ea8c5dad001304a70b22638447f69cb2f809\"\n\nbetter-assert@~1.0.0:\n  version \"1.0.2\"\n  resolved \"https://registry.yarnpkg.com/better-assert/-/better-assert-1.0.2.tgz#40866b9e1b9e0b55b481894311e68faffaebc522\"\n  dependencies:\n    callsite \"1.0.0\"\n\nbig.js@^3.1.3:\n  version \"3.2.0\"\n  resolved \"https://registry.yarnpkg.com/big.js/-/big.js-3.2.0.tgz#a5fc298b81b9e0dca2e458824784b65c52ba588e\"\n\nbignumber.js@^2.1.0:\n  version \"2.4.0\"\n  resolved \"https://registry.yarnpkg.com/bignumber.js/-/bignumber.js-2.4.0.tgz#838a992da9f9d737e0f4b2db0be62bb09dd0c5e8\"\n\nbin-build@^2.0.0:\n  version \"2.2.0\"\n  resolved \"https://registry.yarnpkg.com/bin-build/-/bin-build-2.2.0.tgz#11f8dd61f70ffcfa2bdcaa5b46f5e8fedd4221cc\"\n  dependencies:\n    archive-type \"^3.0.1\"\n    decompress \"^3.0.0\"\n    download \"^4.1.2\"\n    exec-series \"^1.0.0\"\n    rimraf \"^2.2.6\"\n    tempfile \"^1.0.0\"\n    url-regex \"^3.0.0\"\n\nbin-check@^2.0.0:\n  version \"2.0.0\"\n  resolved \"https://registry.yarnpkg.com/bin-check/-/bin-check-2.0.0.tgz#86f8e6f4253893df60dc316957f5af02acb05930\"\n  dependencies:\n    executable \"^1.0.0\"\n\nbin-pack@~1.0.1:\n  version \"1.0.2\"\n  resolved \"https://registry.yarnpkg.com/bin-pack/-/bin-pack-1.0.2.tgz#c2a014edbf0bed70a3292062ed46577b96120679\"\n\nbin-version-check@^2.1.0:\n  version \"2.1.0\"\n  resolved \"https://registry.yarnpkg.com/bin-version-check/-/bin-version-check-2.1.0.tgz#e4e5df290b9069f7d111324031efc13fdd11a5b0\"\n  dependencies:\n    bin-version \"^1.0.0\"\n    minimist \"^1.1.0\"\n    semver \"^4.0.3\"\n    semver-truncate \"^1.0.0\"\n\nbin-version@^1.0.0:\n  version \"1.0.4\"\n  resolved \"https://registry.yarnpkg.com/bin-version/-/bin-version-1.0.4.tgz#9eb498ee6fd76f7ab9a7c160436f89579435d78e\"\n  dependencies:\n    find-versions \"^1.0.0\"\n\nbin-wrapper@^3.0.0, bin-wrapper@^3.0.1:\n  version \"3.0.2\"\n  resolved \"https://registry.yarnpkg.com/bin-wrapper/-/bin-wrapper-3.0.2.tgz#67d3306262e4b1a5f2f88ee23464f6a655677aeb\"\n  dependencies:\n    bin-check \"^2.0.0\"\n    bin-version-check \"^2.1.0\"\n    download \"^4.0.0\"\n    each-async \"^1.1.1\"\n    lazy-req \"^1.0.0\"\n    os-filter-obj \"^1.0.0\"\n\nbinary-extensions@^1.0.0:\n  version \"1.11.0\"\n  resolved \"https://registry.yarnpkg.com/binary-extensions/-/binary-extensions-1.11.0.tgz#46aa1751fb6a2f93ee5e689bb1087d4b14c6c205\"\n\nbinaryextensions@~1.0.0:\n  version \"1.0.1\"\n  resolved \"https://registry.yarnpkg.com/binaryextensions/-/binaryextensions-1.0.1.tgz#1e637488b35b58bda5f4774bf96a5212a8c90755\"\n\nbl@^1.0.0:\n  version \"1.2.2\"\n  resolved \"https://registry.yarnpkg.com/bl/-/bl-1.2.2.tgz#a160911717103c07410cef63ef51b397c025af9c\"\n  dependencies:\n    readable-stream \"^2.3.5\"\n    safe-buffer \"^5.1.1\"\n\nblob@0.0.4:\n  version \"0.0.4\"\n  resolved \"https://registry.yarnpkg.com/blob/-/blob-0.0.4.tgz#bcf13052ca54463f30f9fc7e95b9a47630a94921\"\n\nblock-stream@*:\n  version \"0.0.9\"\n  resolved \"https://registry.yarnpkg.com/block-stream/-/block-stream-0.0.9.tgz#13ebfe778a03205cfe03751481ebb4b3300c126a\"\n  dependencies:\n    inherits \"~2.0.0\"\n\nbmp-js@0.0.3:\n  version \"0.0.3\"\n  resolved \"https://registry.yarnpkg.com/bmp-js/-/bmp-js-0.0.3.tgz#64113e9c7cf1202b376ed607bf30626ebe57b18a\"\n\nbn.js@^4.0.0, bn.js@^4.1.0, bn.js@^4.1.1, bn.js@^4.4.0:\n  version \"4.11.8\"\n  resolved \"https://registry.yarnpkg.com/bn.js/-/bn.js-4.11.8.tgz#2cde09eb5ee341f484746bb0309b3253b1b1442f\"\n\nboolbase@^1.0.0, boolbase@~1.0.0:\n  version \"1.0.0\"\n  resolved \"https://registry.yarnpkg.com/boolbase/-/boolbase-1.0.0.tgz#68dff5fbe60c51eb37725ea9e3ed310dcc1e776e\"\n\nboom@0.4.x:\n  version \"0.4.2\"\n  resolved \"https://registry.yarnpkg.com/boom/-/boom-0.4.2.tgz#7a636e9ded4efcefb19cef4947a3c67dfaee911b\"\n  dependencies:\n    hoek \"0.9.x\"\n\nboom@2.x.x:\n  version \"2.10.1\"\n  resolved \"https://registry.yarnpkg.com/boom/-/boom-2.10.1.tgz#39c8918ceff5799f83f9492a848f625add0c766f\"\n  dependencies:\n    hoek \"2.x.x\"\n\nbrace-expansion@^1.0.0, brace-expansion@^1.1.7:\n  version \"1.1.11\"\n  resolved \"https://registry.yarnpkg.com/brace-expansion/-/brace-expansion-1.1.11.tgz#3c7fcbf529d87226f3d2f52b966ff5271eb441dd\"\n  dependencies:\n    balanced-match \"^1.0.0\"\n    concat-map \"0.0.1\"\n\nbraces@^1.8.2:\n  version \"1.8.5\"\n  resolved \"https://registry.yarnpkg.com/braces/-/braces-1.8.5.tgz#ba77962e12dff969d6b76711e914b737857bf6a7\"\n  dependencies:\n    expand-range \"^1.8.1\"\n    preserve \"^0.2.0\"\n    repeat-element \"^1.1.2\"\n\nbraces@^2.3.0, braces@^2.3.1, braces@^2.3.2:\n  version \"2.3.2\"\n  resolved \"https://registry.yarnpkg.com/braces/-/braces-2.3.2.tgz#5979fd3f14cd531565e5fa2df1abfff1dfaee729\"\n  dependencies:\n    arr-flatten \"^1.1.0\"\n    array-unique \"^0.3.2\"\n    extend-shallow \"^2.0.1\"\n    fill-range \"^4.0.0\"\n    isobject \"^3.0.1\"\n    repeat-element \"^1.1.2\"\n    snapdragon \"^0.8.1\"\n    snapdragon-node \"^2.0.1\"\n    split-string \"^3.0.2\"\n    to-regex \"^3.0.1\"\n\nbrorand@^1.0.1:\n  version \"1.1.0\"\n  resolved \"https://registry.yarnpkg.com/brorand/-/brorand-1.1.0.tgz#12c25efe40a45e3c323eb8675a0a0ce57b22371f\"\n\nbrowser-sync-ui@v1.0.1:\n  version \"1.0.1\"\n  resolved \"https://registry.yarnpkg.com/browser-sync-ui/-/browser-sync-ui-1.0.1.tgz#9740527b26d1d7ace259acc0c79e5b5e37d0fdf2\"\n  dependencies:\n    async-each-series \"0.1.1\"\n    connect-history-api-fallback \"^1.1.0\"\n    immutable \"^3.7.6\"\n    server-destroy \"1.0.1\"\n    socket.io-client \"2.0.4\"\n    stream-throttle \"^0.1.3\"\n\nbrowser-sync@^2.11.1:\n  version \"2.24.6\"\n  resolved \"https://registry.yarnpkg.com/browser-sync/-/browser-sync-2.24.6.tgz#dacb9b2d8f985cfc4e55b9ca881f5a5970617ee8\"\n  dependencies:\n    browser-sync-ui v1.0.1\n    bs-recipes \"1.3.4\"\n    chokidar \"1.7.0\"\n    connect \"3.6.6\"\n    connect-history-api-fallback \"^1.5.0\"\n    dev-ip \"^1.0.1\"\n    easy-extender \"2.3.2\"\n    eazy-logger \"3.0.2\"\n    etag \"^1.8.1\"\n    fresh \"^0.5.2\"\n    fs-extra \"3.0.1\"\n    http-proxy \"1.15.2\"\n    immutable \"3.8.2\"\n    localtunnel \"1.9.0\"\n    micromatch \"2.3.11\"\n    opn \"4.0.2\"\n    portscanner \"2.1.1\"\n    qs \"6.2.3\"\n    raw-body \"^2.3.2\"\n    resp-modifier \"6.0.2\"\n    rx \"4.1.0\"\n    serve-index \"1.9.1\"\n    serve-static \"1.13.2\"\n    server-destroy \"1.0.1\"\n    socket.io \"2.1.1\"\n    ua-parser-js \"0.7.17\"\n    yargs \"6.4.0\"\n\nbrowserify-aes@0.4.0:\n  version \"0.4.0\"\n  resolved \"https://registry.yarnpkg.com/browserify-aes/-/browserify-aes-0.4.0.tgz#067149b668df31c4b58533e02d01e806d8608e2c\"\n  dependencies:\n    inherits \"^2.0.1\"\n\nbrowserify-aes@^1.0.0, browserify-aes@^1.0.4:\n  version \"1.2.0\"\n  resolved \"https://registry.yarnpkg.com/browserify-aes/-/browserify-aes-1.2.0.tgz#326734642f403dabc3003209853bb70ad428ef48\"\n  dependencies:\n    buffer-xor \"^1.0.3\"\n    cipher-base \"^1.0.0\"\n    create-hash \"^1.1.0\"\n    evp_bytestokey \"^1.0.3\"\n    inherits \"^2.0.1\"\n    safe-buffer \"^5.0.1\"\n\nbrowserify-cipher@^1.0.0:\n  version \"1.0.1\"\n  resolved \"https://registry.yarnpkg.com/browserify-cipher/-/browserify-cipher-1.0.1.tgz#8d6474c1b870bfdabcd3bcfcc1934a10e94f15f0\"\n  dependencies:\n    browserify-aes \"^1.0.4\"\n    browserify-des \"^1.0.0\"\n    evp_bytestokey \"^1.0.0\"\n\nbrowserify-des@^1.0.0:\n  version \"1.0.2\"\n  resolved \"https://registry.yarnpkg.com/browserify-des/-/browserify-des-1.0.2.tgz#3af4f1f59839403572f1c66204375f7a7f703e9c\"\n  dependencies:\n    cipher-base \"^1.0.1\"\n    des.js \"^1.0.0\"\n    inherits \"^2.0.1\"\n    safe-buffer \"^5.1.2\"\n\nbrowserify-rsa@^4.0.0:\n  version \"4.0.1\"\n  resolved \"https://registry.yarnpkg.com/browserify-rsa/-/browserify-rsa-4.0.1.tgz#21e0abfaf6f2029cf2fafb133567a701d4135524\"\n  dependencies:\n    bn.js \"^4.1.0\"\n    randombytes \"^2.0.1\"\n\nbrowserify-sign@^4.0.0:\n  version \"4.0.4\"\n  resolved \"https://registry.yarnpkg.com/browserify-sign/-/browserify-sign-4.0.4.tgz#aa4eb68e5d7b658baa6bf6a57e630cbd7a93d298\"\n  dependencies:\n    bn.js \"^4.1.1\"\n    browserify-rsa \"^4.0.0\"\n    create-hash \"^1.1.0\"\n    create-hmac \"^1.1.2\"\n    elliptic \"^6.0.0\"\n    inherits \"^2.0.1\"\n    parse-asn1 \"^5.0.0\"\n\nbrowserify-zlib@^0.1.4:\n  version \"0.1.4\"\n  resolved \"https://registry.yarnpkg.com/browserify-zlib/-/browserify-zlib-0.1.4.tgz#bb35f8a519f600e0fa6b8485241c979d0141fb2d\"\n  dependencies:\n    pako \"~0.2.0\"\n\nbrowserify-zlib@^0.2.0:\n  version \"0.2.0\"\n  resolved \"https://registry.yarnpkg.com/browserify-zlib/-/browserify-zlib-0.2.0.tgz#2869459d9aa3be245fe8fe2ca1f46e2e7f54d73f\"\n  dependencies:\n    pako \"~1.0.5\"\n\nbrowserslist@^1.3.6, browserslist@^1.5.2, browserslist@^1.7.6:\n  version \"1.7.7\"\n  resolved \"https://registry.yarnpkg.com/browserslist/-/browserslist-1.7.7.tgz#0bd76704258be829b2398bb50e4b62d1a166b0b9\"\n  dependencies:\n    caniuse-db \"^1.0.30000639\"\n    electron-to-chromium \"^1.2.7\"\n\nbs-recipes@1.3.4:\n  version \"1.3.4\"\n  resolved \"https://registry.yarnpkg.com/bs-recipes/-/bs-recipes-1.3.4.tgz#0d2d4d48a718c8c044769fdc4f89592dc8b69585\"\n\nbuffer-alloc-unsafe@^1.1.0:\n  version \"1.1.0\"\n  resolved \"https://registry.yarnpkg.com/buffer-alloc-unsafe/-/buffer-alloc-unsafe-1.1.0.tgz#bd7dc26ae2972d0eda253be061dba992349c19f0\"\n\nbuffer-alloc@^1.1.0, buffer-alloc@^1.2.0:\n  version \"1.2.0\"\n  resolved \"https://registry.yarnpkg.com/buffer-alloc/-/buffer-alloc-1.2.0.tgz#890dd90d923a873e08e10e5fd51a57e5b7cce0ec\"\n  dependencies:\n    buffer-alloc-unsafe \"^1.1.0\"\n    buffer-fill \"^1.0.0\"\n\nbuffer-crc32@~0.2.3:\n  version \"0.2.13\"\n  resolved \"https://registry.yarnpkg.com/buffer-crc32/-/buffer-crc32-0.2.13.tgz#0d333e3f00eac50aa1454abd30ef8c2a5d9a7242\"\n\nbuffer-equal@0.0.1:\n  version \"0.0.1\"\n  resolved \"https://registry.yarnpkg.com/buffer-equal/-/buffer-equal-0.0.1.tgz#91bc74b11ea405bc916bc6aa908faafa5b4aac4b\"\n\nbuffer-equal@^1.0.0:\n  version \"1.0.0\"\n  resolved \"https://registry.yarnpkg.com/buffer-equal/-/buffer-equal-1.0.0.tgz#59616b498304d556abd466966b22eeda3eca5fbe\"\n\nbuffer-fill@^1.0.0:\n  version \"1.0.0\"\n  resolved \"https://registry.yarnpkg.com/buffer-fill/-/buffer-fill-1.0.0.tgz#f8f78b76789888ef39f205cd637f68e702122b2c\"\n\nbuffer-from@^1.0.0:\n  version \"1.1.1\"\n  resolved \"https://registry.yarnpkg.com/buffer-from/-/buffer-from-1.1.1.tgz#32713bc028f75c02fdb710d7c7bcec1f2c6070ef\"\n\nbuffer-to-vinyl@^1.0.0:\n  version \"1.1.0\"\n  resolved \"https://registry.yarnpkg.com/buffer-to-vinyl/-/buffer-to-vinyl-1.1.0.tgz#00f15faee3ab7a1dda2cde6d9121bffdd07b2262\"\n  dependencies:\n    file-type \"^3.1.0\"\n    readable-stream \"^2.0.2\"\n    uuid \"^2.0.1\"\n    vinyl \"^1.0.0\"\n\nbuffer-xor@^1.0.3:\n  version \"1.0.3\"\n  resolved \"https://registry.yarnpkg.com/buffer-xor/-/buffer-xor-1.0.3.tgz#26e61ed1422fb70dd42e6e36729ed51d855fe8d9\"\n\nbuffer@^4.3.0, buffer@^4.9.0:\n  version \"4.9.1\"\n  resolved \"https://registry.yarnpkg.com/buffer/-/buffer-4.9.1.tgz#6d1bb601b07a4efced97094132093027c95bc298\"\n  dependencies:\n    base64-js \"^1.0.2\"\n    ieee754 \"^1.1.4\"\n    isarray \"^1.0.0\"\n\nbuffers@~0.1.1:\n  version \"0.1.1\"\n  resolved \"https://registry.yarnpkg.com/buffers/-/buffers-0.1.1.tgz#b24579c3bed4d6d396aeee6d9a8ae7f5482ab7bb\"\n\nbuiltin-modules@^1.0.0:\n  version \"1.1.1\"\n  resolved \"https://registry.yarnpkg.com/builtin-modules/-/builtin-modules-1.1.1.tgz#270f076c5a72c02f5b65a47df94c5fe3a278892f\"\n\nbuiltin-status-codes@^3.0.0:\n  version \"3.0.0\"\n  resolved \"https://registry.yarnpkg.com/builtin-status-codes/-/builtin-status-codes-3.0.0.tgz#85982878e21b98e1c66425e03d0174788f569ee8\"\n\nbytes@3.0.0:\n  version \"3.0.0\"\n  resolved \"https://registry.yarnpkg.com/bytes/-/bytes-3.0.0.tgz#d32815404d689699f85a4ea4fa8755dd13a96048\"\n\ncache-base@^1.0.1:\n  version \"1.0.1\"\n  resolved \"https://registry.yarnpkg.com/cache-base/-/cache-base-1.0.1.tgz#0a7f46416831c8b662ee36fe4e7c59d76f666ab2\"\n  dependencies:\n    collection-visit \"^1.0.0\"\n    component-emitter \"^1.2.1\"\n    get-value \"^2.0.6\"\n    has-value \"^1.0.0\"\n    isobject \"^3.0.1\"\n    set-value \"^2.0.0\"\n    to-object-path \"^0.3.0\"\n    union-value \"^1.0.0\"\n    unset-value \"^1.0.0\"\n\ncallsite@1.0.0:\n  version \"1.0.0\"\n  resolved \"https://registry.yarnpkg.com/callsite/-/callsite-1.0.0.tgz#280398e5d664bd74038b6f0905153e6e8af1bc20\"\n\ncamelcase-keys@^1.0.0:\n  version \"1.0.0\"\n  resolved \"https://registry.yarnpkg.com/camelcase-keys/-/camelcase-keys-1.0.0.tgz#bd1a11bf9b31a1ce493493a930de1a0baf4ad7ec\"\n  dependencies:\n    camelcase \"^1.0.1\"\n    map-obj \"^1.0.0\"\n\ncamelcase-keys@^2.0.0:\n  version \"2.1.0\"\n  resolved \"https://registry.yarnpkg.com/camelcase-keys/-/camelcase-keys-2.1.0.tgz#308beeaffdf28119051efa1d932213c91b8f92e7\"\n  dependencies:\n    camelcase \"^2.0.0\"\n    map-obj \"^1.0.0\"\n\ncamelcase@^1.0.1, camelcase@^1.0.2:\n  version \"1.2.1\"\n  resolved \"https://registry.yarnpkg.com/camelcase/-/camelcase-1.2.1.tgz#9bb5304d2e0b56698b2c758b08a3eaa9daa58a39\"\n\ncamelcase@^2.0.0:\n  version \"2.1.1\"\n  resolved \"https://registry.yarnpkg.com/camelcase/-/camelcase-2.1.1.tgz#7c1d16d679a1bbe59ca02cacecfb011e201f5a1f\"\n\ncamelcase@^3.0.0:\n  version \"3.0.0\"\n  resolved \"https://registry.yarnpkg.com/camelcase/-/camelcase-3.0.0.tgz#32fc4b9fcdaf845fcdf7e73bb97cac2261f0ab0a\"\n\ncamelcase@^4.1.0:\n  version \"4.1.0\"\n  resolved \"https://registry.yarnpkg.com/camelcase/-/camelcase-4.1.0.tgz#d545635be1e33c542649c69173e5de6acfae34dd\"\n\ncaniuse-api@^1.5.2:\n  version \"1.6.1\"\n  resolved \"https://registry.yarnpkg.com/caniuse-api/-/caniuse-api-1.6.1.tgz#b534e7c734c4f81ec5fbe8aca2ad24354b962c6c\"\n  dependencies:\n    browserslist \"^1.3.6\"\n    caniuse-db \"^1.0.30000529\"\n    lodash.memoize \"^4.1.2\"\n    lodash.uniq \"^4.5.0\"\n\ncaniuse-db@^1.0.30000529, caniuse-db@^1.0.30000634, caniuse-db@^1.0.30000639:\n  version \"1.0.30000874\"\n  resolved \"https://registry.yarnpkg.com/caniuse-db/-/caniuse-db-1.0.30000874.tgz#49edc0262efdc6c49d4d962bb16d1f0c790fa44e\"\n\ncapture-stack-trace@^1.0.0:\n  version \"1.0.0\"\n  resolved \"https://registry.yarnpkg.com/capture-stack-trace/-/capture-stack-trace-1.0.0.tgz#4a6fa07399c26bba47f0b2496b4d0fb408c5550d\"\n\ncaseless@~0.12.0:\n  version \"0.12.0\"\n  resolved \"https://registry.yarnpkg.com/caseless/-/caseless-0.12.0.tgz#1b681c21ff84033c826543090689420d187151dc\"\n\ncaw@^1.0.1:\n  version \"1.2.0\"\n  resolved \"https://registry.yarnpkg.com/caw/-/caw-1.2.0.tgz#ffb226fe7efc547288dc62ee3e97073c212d1034\"\n  dependencies:\n    get-proxy \"^1.0.1\"\n    is-obj \"^1.0.0\"\n    object-assign \"^3.0.0\"\n    tunnel-agent \"^0.4.0\"\n\ncenter-align@^0.1.1:\n  version \"0.1.3\"\n  resolved \"https://registry.yarnpkg.com/center-align/-/center-align-0.1.3.tgz#aa0d32629b6ee972200411cbd4461c907bc2b7ad\"\n  dependencies:\n    align-text \"^0.1.3\"\n    lazy-cache \"^1.0.3\"\n\nchalk@^1.0.0, chalk@^1.1.1, chalk@^1.1.3:\n  version \"1.1.3\"\n  resolved \"https://registry.yarnpkg.com/chalk/-/chalk-1.1.3.tgz#a8115c55e4a702fe4d150abd3872822a7e09fc98\"\n  dependencies:\n    ansi-styles \"^2.2.1\"\n    escape-string-regexp \"^1.0.2\"\n    has-ansi \"^2.0.0\"\n    strip-ansi \"^3.0.0\"\n    supports-color \"^2.0.0\"\n\nchalk@^2.4.1:\n  version \"2.4.1\"\n  resolved \"https://registry.yarnpkg.com/chalk/-/chalk-2.4.1.tgz#18c49ab16a037b6eb0152cc83e3471338215b66e\"\n  dependencies:\n    ansi-styles \"^3.2.1\"\n    escape-string-regexp \"^1.0.5\"\n    supports-color \"^5.3.0\"\n\ncheerio@^0.22.0:\n  version \"0.22.0\"\n  resolved \"https://registry.yarnpkg.com/cheerio/-/cheerio-0.22.0.tgz#a9baa860a3f9b595a6b81b1a86873121ed3a269e\"\n  dependencies:\n    css-select \"~1.2.0\"\n    dom-serializer \"~0.1.0\"\n    entities \"~1.1.1\"\n    htmlparser2 \"^3.9.1\"\n    lodash.assignin \"^4.0.9\"\n    lodash.bind \"^4.1.4\"\n    lodash.defaults \"^4.0.1\"\n    lodash.filter \"^4.4.0\"\n    lodash.flatten \"^4.2.0\"\n    lodash.foreach \"^4.3.0\"\n    lodash.map \"^4.4.0\"\n    lodash.merge \"^4.4.0\"\n    lodash.pick \"^4.2.1\"\n    lodash.reduce \"^4.4.0\"\n    lodash.reject \"^4.4.0\"\n    lodash.some \"^4.4.0\"\n\nchokidar@1.7.0, chokidar@^1.0.0:\n  version \"1.7.0\"\n  resolved \"https://registry.yarnpkg.com/chokidar/-/chokidar-1.7.0.tgz#798e689778151c8076b4b360e5edd28cda2bb468\"\n  dependencies:\n    anymatch \"^1.3.0\"\n    async-each \"^1.0.0\"\n    glob-parent \"^2.0.0\"\n    inherits \"^2.0.1\"\n    is-binary-path \"^1.0.0\"\n    is-glob \"^2.0.0\"\n    path-is-absolute \"^1.0.0\"\n    readdirp \"^2.0.0\"\n  optionalDependencies:\n    fsevents \"^1.0.0\"\n\nchokidar@^2.0.0:\n  version \"2.1.2\"\n  resolved \"https://registry.yarnpkg.com/chokidar/-/chokidar-2.1.2.tgz#9c23ea40b01638439e0513864d362aeacc5ad058\"\n  dependencies:\n    anymatch \"^2.0.0\"\n    async-each \"^1.0.1\"\n    braces \"^2.3.2\"\n    glob-parent \"^3.1.0\"\n    inherits \"^2.0.3\"\n    is-binary-path \"^1.0.0\"\n    is-glob \"^4.0.0\"\n    normalize-path \"^3.0.0\"\n    path-is-absolute \"^1.0.0\"\n    readdirp \"^2.2.1\"\n    upath \"^1.1.0\"\n  optionalDependencies:\n    fsevents \"^1.2.7\"\n\nchokidar@^2.0.2:\n  version \"2.0.4\"\n  resolved \"https://registry.yarnpkg.com/chokidar/-/chokidar-2.0.4.tgz#356ff4e2b0e8e43e322d18a372460bbcf3accd26\"\n  dependencies:\n    anymatch \"^2.0.0\"\n    async-each \"^1.0.0\"\n    braces \"^2.3.0\"\n    glob-parent \"^3.1.0\"\n    inherits \"^2.0.1\"\n    is-binary-path \"^1.0.0\"\n    is-glob \"^4.0.0\"\n    lodash.debounce \"^4.0.8\"\n    normalize-path \"^2.1.1\"\n    path-is-absolute \"^1.0.0\"\n    readdirp \"^2.0.0\"\n    upath \"^1.0.5\"\n  optionalDependencies:\n    fsevents \"^1.2.2\"\n\nchownr@^1.0.1:\n  version \"1.0.1\"\n  resolved \"https://registry.yarnpkg.com/chownr/-/chownr-1.0.1.tgz#e2a75042a9551908bebd25b8523d5f9769d79181\"\n\ncipher-base@^1.0.0, cipher-base@^1.0.1, cipher-base@^1.0.3:\n  version \"1.0.4\"\n  resolved \"https://registry.yarnpkg.com/cipher-base/-/cipher-base-1.0.4.tgz#8760e4ecc272f4c363532f926d874aae2c1397de\"\n  dependencies:\n    inherits \"^2.0.1\"\n    safe-buffer \"^5.0.1\"\n\nclap@^1.0.9:\n  version \"1.2.3\"\n  resolved \"https://registry.yarnpkg.com/clap/-/clap-1.2.3.tgz#4f36745b32008492557f46412d66d50cb99bce51\"\n  dependencies:\n    chalk \"^1.1.3\"\n\nclass-utils@^0.3.5:\n  version \"0.3.6\"\n  resolved \"https://registry.yarnpkg.com/class-utils/-/class-utils-0.3.6.tgz#f93369ae8b9a7ce02fd41faad0ca83033190c463\"\n  dependencies:\n    arr-union \"^3.1.0\"\n    define-property \"^0.2.5\"\n    isobject \"^3.0.0\"\n    static-extend \"^0.1.1\"\n\ncliui@^2.1.0:\n  version \"2.1.0\"\n  resolved \"https://registry.yarnpkg.com/cliui/-/cliui-2.1.0.tgz#4b475760ff80264c762c3a1719032e91c7fea0d1\"\n  dependencies:\n    center-align \"^0.1.1\"\n    right-align \"^0.1.1\"\n    wordwrap \"0.0.2\"\n\ncliui@^3.2.0:\n  version \"3.2.0\"\n  resolved \"https://registry.yarnpkg.com/cliui/-/cliui-3.2.0.tgz#120601537a916d29940f934da3b48d585a39213d\"\n  dependencies:\n    string-width \"^1.0.1\"\n    strip-ansi \"^3.0.1\"\n    wrap-ansi \"^2.0.0\"\n\ncliui@^4.0.0:\n  version \"4.1.0\"\n  resolved \"https://registry.yarnpkg.com/cliui/-/cliui-4.1.0.tgz#348422dbe82d800b3022eef4f6ac10bf2e4d1b49\"\n  dependencies:\n    string-width \"^2.1.1\"\n    strip-ansi \"^4.0.0\"\n    wrap-ansi \"^2.0.0\"\n\nclone-buffer@^1.0.0:\n  version \"1.0.0\"\n  resolved \"https://registry.yarnpkg.com/clone-buffer/-/clone-buffer-1.0.0.tgz#e3e25b207ac4e701af721e2cb5a16792cac3dc58\"\n\nclone-stats@^0.0.1:\n  version \"0.0.1\"\n  resolved \"https://registry.yarnpkg.com/clone-stats/-/clone-stats-0.0.1.tgz#b88f94a82cf38b8791d58046ea4029ad88ca99d1\"\n\nclone-stats@^1.0.0:\n  version \"1.0.0\"\n  resolved \"https://registry.yarnpkg.com/clone-stats/-/clone-stats-1.0.0.tgz#b3782dff8bb5474e18b9b6bf0fdfe782f8777680\"\n\nclone@^0.2.0:\n  version \"0.2.0\"\n  resolved \"https://registry.yarnpkg.com/clone/-/clone-0.2.0.tgz#c6126a90ad4f72dbf5acdb243cc37724fe93fc1f\"\n\nclone@^1.0.0, clone@^1.0.2:\n  version \"1.0.4\"\n  resolved \"https://registry.yarnpkg.com/clone/-/clone-1.0.4.tgz#da309cc263df15994c688ca902179ca3c7cd7c7e\"\n\nclone@^2.1.1:\n  version \"2.1.2\"\n  resolved \"https://registry.yarnpkg.com/clone/-/clone-2.1.2.tgz#1b7f4b9f591f1e8f83670401600345a02887435f\"\n\ncloneable-readable@^1.0.0:\n  version \"1.1.2\"\n  resolved \"https://registry.yarnpkg.com/cloneable-readable/-/cloneable-readable-1.1.2.tgz#d591dee4a8f8bc15da43ce97dceeba13d43e2a65\"\n  dependencies:\n    inherits \"^2.0.1\"\n    process-nextick-args \"^2.0.0\"\n    readable-stream \"^2.3.5\"\n\nco@3.1.0:\n  version \"3.1.0\"\n  resolved \"https://registry.yarnpkg.com/co/-/co-3.1.0.tgz#4ea54ea5a08938153185e15210c68d9092bc1b78\"\n\nco@^4.6.0:\n  version \"4.6.0\"\n  resolved \"https://registry.yarnpkg.com/co/-/co-4.6.0.tgz#6ea6bdf3d853ae54ccb8e47bfa0bf3f9031fb184\"\n\ncoa@~1.0.1:\n  version \"1.0.4\"\n  resolved \"https://registry.yarnpkg.com/coa/-/coa-1.0.4.tgz#a9ef153660d6a86a8bdec0289a5c684d217432fd\"\n  dependencies:\n    q \"^1.1.2\"\n\ncoa@~2.0.1:\n  version \"2.0.1\"\n  resolved \"https://registry.yarnpkg.com/coa/-/coa-2.0.1.tgz#f3f8b0b15073e35d70263fb1042cb2c023db38af\"\n  dependencies:\n    q \"^1.1.2\"\n\ncode-point-at@^1.0.0:\n  version \"1.1.0\"\n  resolved \"https://registry.yarnpkg.com/code-point-at/-/code-point-at-1.1.0.tgz#0d070b4d043a5bea33a2f1a40e2edb3d9a4ccf77\"\n\ncollection-map@^1.0.0:\n  version \"1.0.0\"\n  resolved \"https://registry.yarnpkg.com/collection-map/-/collection-map-1.0.0.tgz#aea0f06f8d26c780c2b75494385544b2255af18c\"\n  dependencies:\n    arr-map \"^2.0.2\"\n    for-own \"^1.0.0\"\n    make-iterator \"^1.0.0\"\n\ncollection-visit@^1.0.0:\n  version \"1.0.0\"\n  resolved \"https://registry.yarnpkg.com/collection-visit/-/collection-visit-1.0.0.tgz#4bc0373c164bc3291b4d368c829cf1a80a59dca0\"\n  dependencies:\n    map-visit \"^1.0.0\"\n    object-visit \"^1.0.0\"\n\ncolor-convert@^1.3.0, color-convert@^1.9.0, color-convert@^1.9.1:\n  version \"1.9.2\"\n  resolved \"https://registry.yarnpkg.com/color-convert/-/color-convert-1.9.2.tgz#49881b8fba67df12a96bdf3f56c0aab9e7913147\"\n  dependencies:\n    color-name \"1.1.1\"\n\ncolor-name@1.1.1:\n  version \"1.1.1\"\n  resolved \"https://registry.yarnpkg.com/color-name/-/color-name-1.1.1.tgz#4b1415304cf50028ea81643643bd82ea05803689\"\n\ncolor-name@^1.0.0:\n  version \"1.1.3\"\n  resolved \"https://registry.yarnpkg.com/color-name/-/color-name-1.1.3.tgz#a7d0558bd89c42f795dd42328f740831ca53bc25\"\n\ncolor-string@^0.3.0:\n  version \"0.3.0\"\n  resolved \"https://registry.yarnpkg.com/color-string/-/color-string-0.3.0.tgz#27d46fb67025c5c2fa25993bfbf579e47841b991\"\n  dependencies:\n    color-name \"^1.0.0\"\n\ncolor-string@^1.5.2:\n  version \"1.5.3\"\n  resolved \"https://registry.yarnpkg.com/color-string/-/color-string-1.5.3.tgz#c9bbc5f01b58b5492f3d6857459cb6590ce204cc\"\n  dependencies:\n    color-name \"^1.0.0\"\n    simple-swizzle \"^0.2.2\"\n\ncolor-support@^1.1.3:\n  version \"1.1.3\"\n  resolved \"https://registry.yarnpkg.com/color-support/-/color-support-1.1.3.tgz#93834379a1cc9a0c61f82f52f0d04322251bd5a2\"\n\ncolor@^0.11.0:\n  version \"0.11.4\"\n  resolved \"https://registry.yarnpkg.com/color/-/color-0.11.4.tgz#6d7b5c74fb65e841cd48792ad1ed5e07b904d764\"\n  dependencies:\n    clone \"^1.0.2\"\n    color-convert \"^1.3.0\"\n    color-string \"^0.3.0\"\n\ncolor@^3.0.0:\n  version \"3.0.0\"\n  resolved \"https://registry.yarnpkg.com/color/-/color-3.0.0.tgz#d920b4328d534a3ac8295d68f7bd4ba6c427be9a\"\n  dependencies:\n    color-convert \"^1.9.1\"\n    color-string \"^1.5.2\"\n\ncolormin@^1.0.5:\n  version \"1.1.2\"\n  resolved \"https://registry.yarnpkg.com/colormin/-/colormin-1.1.2.tgz#ea2f7420a72b96881a38aae59ec124a6f7298133\"\n  dependencies:\n    color \"^0.11.0\"\n    css-color-names \"0.0.4\"\n    has \"^1.0.1\"\n\ncolors@1.0.x:\n  version \"1.0.3\"\n  resolved \"https://registry.yarnpkg.com/colors/-/colors-1.0.3.tgz#0433f44d809680fdeb60ed260f1b0c262e82a40b\"\n\ncolors@~1.1.2:\n  version \"1.1.2\"\n  resolved \"https://registry.yarnpkg.com/colors/-/colors-1.1.2.tgz#168a4701756b6a7f51a12ce0c97bfa28c084ed63\"\n\ncombined-stream@1.0.6, combined-stream@^1.0.5, combined-stream@~1.0.5:\n  version \"1.0.6\"\n  resolved \"https://registry.yarnpkg.com/combined-stream/-/combined-stream-1.0.6.tgz#723e7df6e801ac5613113a7e445a9b69cb632818\"\n  dependencies:\n    delayed-stream \"~1.0.0\"\n\ncombined-stream@~0.0.4:\n  version \"0.0.7\"\n  resolved \"https://registry.yarnpkg.com/combined-stream/-/combined-stream-0.0.7.tgz#0137e657baa5a7541c57ac37ac5fc07d73b4dc1f\"\n  dependencies:\n    delayed-stream \"0.0.5\"\n\ncommander@0.6.1:\n  version \"0.6.1\"\n  resolved \"https://registry.yarnpkg.com/commander/-/commander-0.6.1.tgz#fa68a14f6a945d54dbbe50d8cdb3320e9e3b1a06\"\n\ncommander@2.3.0:\n  version \"2.3.0\"\n  resolved \"https://registry.yarnpkg.com/commander/-/commander-2.3.0.tgz#fd430e889832ec353b9acd1de217c11cb3eef873\"\n\ncommander@^2.2.0:\n  version \"2.17.0\"\n  resolved \"https://registry.yarnpkg.com/commander/-/commander-2.17.0.tgz#9d07b25e2a6f198b76d8b756a0e8a9604a6a1a60\"\n\ncommander@~2.8.1:\n  version \"2.8.1\"\n  resolved \"https://registry.yarnpkg.com/commander/-/commander-2.8.1.tgz#06be367febfda0c330aa1e2a072d3dc9762425d4\"\n  dependencies:\n    graceful-readlink \">= 1.0.0\"\n\ncommondir@^1.0.1:\n  version \"1.0.1\"\n  resolved \"https://registry.yarnpkg.com/commondir/-/commondir-1.0.1.tgz#ddd800da0c66127393cca5950ea968a3aaf1253b\"\n\ncomponent-bind@1.0.0:\n  version \"1.0.0\"\n  resolved \"https://registry.yarnpkg.com/component-bind/-/component-bind-1.0.0.tgz#00c608ab7dcd93897c0009651b1d3a8e1e73bbd1\"\n\ncomponent-emitter@1.2.1, component-emitter@^1.2.1:\n  version \"1.2.1\"\n  resolved \"https://registry.yarnpkg.com/component-emitter/-/component-emitter-1.2.1.tgz#137918d6d78283f7df7a6b7c5a63e140e69425e6\"\n\ncomponent-inherit@0.0.3:\n  version \"0.0.3\"\n  resolved \"https://registry.yarnpkg.com/component-inherit/-/component-inherit-0.0.3.tgz#645fc4adf58b72b649d5cae65135619db26ff143\"\n\nconcat-map@0.0.1:\n  version \"0.0.1\"\n  resolved \"https://registry.yarnpkg.com/concat-map/-/concat-map-0.0.1.tgz#d8a96bd77fd68df7793a73036a3ba0d5405d477b\"\n\nconcat-stream@1.6.2, concat-stream@^1.4.6, concat-stream@^1.4.7, concat-stream@^1.6.0:\n  version \"1.6.2\"\n  resolved \"https://registry.yarnpkg.com/concat-stream/-/concat-stream-1.6.2.tgz#904bdf194cd3122fc675c77fc4ac3d4ff0fd1a34\"\n  dependencies:\n    buffer-from \"^1.0.0\"\n    inherits \"^2.0.3\"\n    readable-stream \"^2.2.2\"\n    typedarray \"^0.0.6\"\n\nconcat-with-sourcemaps@^1.0.0:\n  version \"1.1.0\"\n  resolved \"https://registry.yarnpkg.com/concat-with-sourcemaps/-/concat-with-sourcemaps-1.1.0.tgz#d4ea93f05ae25790951b99e7b3b09e3908a4082e\"\n  dependencies:\n    source-map \"^0.6.1\"\n\nconnect-history-api-fallback@^1.1.0, connect-history-api-fallback@^1.5.0:\n  version \"1.5.0\"\n  resolved \"https://registry.yarnpkg.com/connect-history-api-fallback/-/connect-history-api-fallback-1.5.0.tgz#b06873934bc5e344fef611a196a6faae0aee015a\"\n\nconnect@3.6.6:\n  version \"3.6.6\"\n  resolved \"https://registry.yarnpkg.com/connect/-/connect-3.6.6.tgz#09eff6c55af7236e137135a72574858b6786f524\"\n  dependencies:\n    debug \"2.6.9\"\n    finalhandler \"1.1.0\"\n    parseurl \"~1.3.2\"\n    utils-merge \"1.0.1\"\n\nconsole-browserify@^1.1.0:\n  version \"1.1.0\"\n  resolved \"https://registry.yarnpkg.com/console-browserify/-/console-browserify-1.1.0.tgz#f0241c45730a9fc6323b206dbf38edc741d0bb10\"\n  dependencies:\n    date-now \"^0.1.4\"\n\nconsole-control-strings@^1.0.0, console-control-strings@~1.1.0:\n  version \"1.1.0\"\n  resolved \"https://registry.yarnpkg.com/console-control-strings/-/console-control-strings-1.1.0.tgz#3d7cf4464db6446ea644bf4b39507f9851008e8e\"\n\nconsole-stream@^0.1.1:\n  version \"0.1.1\"\n  resolved \"https://registry.yarnpkg.com/console-stream/-/console-stream-0.1.1.tgz#a095fe07b20465955f2fafd28b5d72bccd949d44\"\n\nconstants-browserify@^1.0.0:\n  version \"1.0.0\"\n  resolved \"https://registry.yarnpkg.com/constants-browserify/-/constants-browserify-1.0.0.tgz#c20b96d8c617748aaf1c16021760cd27fcb8cb75\"\n\nconvert-source-map@^1.1.1, convert-source-map@^1.5.0, convert-source-map@^1.5.1:\n  version \"1.5.1\"\n  resolved \"https://registry.yarnpkg.com/convert-source-map/-/convert-source-map-1.5.1.tgz#b8278097b9bc229365de5c62cf5fcaed8b5599e5\"\n\ncookie@0.3.1:\n  version \"0.3.1\"\n  resolved \"https://registry.yarnpkg.com/cookie/-/cookie-0.3.1.tgz#e7e0a1f9ef43b4c8ba925c5c5a96e806d16873bb\"\n\ncopy-descriptor@^0.1.0:\n  version \"0.1.1\"\n  resolved \"https://registry.yarnpkg.com/copy-descriptor/-/copy-descriptor-0.1.1.tgz#676f6eb3c39997c2ee1ac3a924fd6124748f578d\"\n\ncopy-props@^2.0.1:\n  version \"2.0.4\"\n  resolved \"https://registry.yarnpkg.com/copy-props/-/copy-props-2.0.4.tgz#93bb1cadfafd31da5bb8a9d4b41f471ec3a72dfe\"\n  dependencies:\n    each-props \"^1.3.0\"\n    is-plain-object \"^2.0.1\"\n\ncore-js@^2.4.0, core-js@^2.5.0:\n  version \"2.5.7\"\n  resolved \"https://registry.yarnpkg.com/core-js/-/core-js-2.5.7.tgz#f972608ff0cead68b841a16a932d0b183791814e\"\n\ncore-util-is@1.0.2, core-util-is@~1.0.0:\n  version \"1.0.2\"\n  resolved \"https://registry.yarnpkg.com/core-util-is/-/core-util-is-1.0.2.tgz#b5fd54220aa2bc5ab57aab7140c940754503c1a7\"\n\ncosmiconfig@^2.1.0, cosmiconfig@^2.1.1:\n  version \"2.2.2\"\n  resolved \"https://registry.yarnpkg.com/cosmiconfig/-/cosmiconfig-2.2.2.tgz#6173cebd56fac042c1f4390edf7af6c07c7cb892\"\n  dependencies:\n    is-directory \"^0.3.1\"\n    js-yaml \"^3.4.3\"\n    minimist \"^1.2.0\"\n    object-assign \"^4.1.0\"\n    os-homedir \"^1.0.1\"\n    parse-json \"^2.2.0\"\n    require-from-string \"^1.1.0\"\n\ncreate-ecdh@^4.0.0:\n  version \"4.0.3\"\n  resolved \"https://registry.yarnpkg.com/create-ecdh/-/create-ecdh-4.0.3.tgz#c9111b6f33045c4697f144787f9254cdc77c45ff\"\n  dependencies:\n    bn.js \"^4.1.0\"\n    elliptic \"^6.0.0\"\n\ncreate-error-class@^3.0.1:\n  version \"3.0.2\"\n  resolved \"https://registry.yarnpkg.com/create-error-class/-/create-error-class-3.0.2.tgz#06be7abef947a3f14a30fd610671d401bca8b7b6\"\n  dependencies:\n    capture-stack-trace \"^1.0.0\"\n\ncreate-hash@^1.1.0, create-hash@^1.1.2:\n  version \"1.2.0\"\n  resolved \"https://registry.yarnpkg.com/create-hash/-/create-hash-1.2.0.tgz#889078af11a63756bcfb59bd221996be3a9ef196\"\n  dependencies:\n    cipher-base \"^1.0.1\"\n    inherits \"^2.0.1\"\n    md5.js \"^1.3.4\"\n    ripemd160 \"^2.0.1\"\n    sha.js \"^2.4.0\"\n\ncreate-hmac@^1.1.0, create-hmac@^1.1.2, create-hmac@^1.1.4:\n  version \"1.1.7\"\n  resolved \"https://registry.yarnpkg.com/create-hmac/-/create-hmac-1.1.7.tgz#69170c78b3ab957147b2b8b04572e47ead2243ff\"\n  dependencies:\n    cipher-base \"^1.0.3\"\n    create-hash \"^1.1.0\"\n    inherits \"^2.0.1\"\n    ripemd160 \"^2.0.0\"\n    safe-buffer \"^5.0.1\"\n    sha.js \"^2.4.8\"\n\ncross-spawn@^3.0.0:\n  version \"3.0.1\"\n  resolved \"https://registry.yarnpkg.com/cross-spawn/-/cross-spawn-3.0.1.tgz#1256037ecb9f0c5f79e3d6ef135e30770184b982\"\n  dependencies:\n    lru-cache \"^4.0.1\"\n    which \"^1.2.9\"\n\ncross-spawn@^5.0.1:\n  version \"5.1.0\"\n  resolved \"https://registry.yarnpkg.com/cross-spawn/-/cross-spawn-5.1.0.tgz#e8bd0efee58fcff6f8f94510a0a554bbfa235449\"\n  dependencies:\n    lru-cache \"^4.0.1\"\n    shebang-command \"^1.2.0\"\n    which \"^1.2.9\"\n\ncryptiles@0.2.x:\n  version \"0.2.2\"\n  resolved \"https://registry.yarnpkg.com/cryptiles/-/cryptiles-0.2.2.tgz#ed91ff1f17ad13d3748288594f8a48a0d26f325c\"\n  dependencies:\n    boom \"0.4.x\"\n\ncryptiles@2.x.x:\n  version \"2.0.5\"\n  resolved \"https://registry.yarnpkg.com/cryptiles/-/cryptiles-2.0.5.tgz#3bdfecdc608147c1c67202fa291e7dca59eaa3b8\"\n  dependencies:\n    boom \"2.x.x\"\n\ncrypto-browserify@3.3.0:\n  version \"3.3.0\"\n  resolved \"https://registry.yarnpkg.com/crypto-browserify/-/crypto-browserify-3.3.0.tgz#b9fc75bb4a0ed61dcf1cd5dae96eb30c9c3e506c\"\n  dependencies:\n    browserify-aes \"0.4.0\"\n    pbkdf2-compat \"2.0.1\"\n    ripemd160 \"0.2.0\"\n    sha.js \"2.2.6\"\n\ncrypto-browserify@^3.11.0:\n  version \"3.12.0\"\n  resolved \"https://registry.yarnpkg.com/crypto-browserify/-/crypto-browserify-3.12.0.tgz#396cf9f3137f03e4b8e532c58f698254e00f80ec\"\n  dependencies:\n    browserify-cipher \"^1.0.0\"\n    browserify-sign \"^4.0.0\"\n    create-ecdh \"^4.0.0\"\n    create-hash \"^1.1.0\"\n    create-hmac \"^1.1.0\"\n    diffie-hellman \"^5.0.0\"\n    inherits \"^2.0.1\"\n    pbkdf2 \"^3.0.3\"\n    public-encrypt \"^4.0.0\"\n    randombytes \"^2.0.0\"\n    randomfill \"^1.0.3\"\n\ncrypto-md5@^1.0.0:\n  version \"1.0.0\"\n  resolved \"https://registry.yarnpkg.com/crypto-md5/-/crypto-md5-1.0.0.tgz#ccc8da750c753c7edcbabc542967472a384e86bb\"\n\ncss-color-names@0.0.4:\n  version \"0.0.4\"\n  resolved \"https://registry.yarnpkg.com/css-color-names/-/css-color-names-0.0.4.tgz#808adc2e79cf84738069b646cb20ec27beb629e0\"\n\ncss-select-base-adapter@~0.1.0:\n  version \"0.1.0\"\n  resolved \"https://registry.yarnpkg.com/css-select-base-adapter/-/css-select-base-adapter-0.1.0.tgz#0102b3d14630df86c3eb9fa9f5456270106cf990\"\n\ncss-select@~1.2.0:\n  version \"1.2.0\"\n  resolved \"https://registry.yarnpkg.com/css-select/-/css-select-1.2.0.tgz#2b3a110539c5355f1cd8d314623e870b121ec858\"\n  dependencies:\n    boolbase \"~1.0.0\"\n    css-what \"2.1\"\n    domutils \"1.5.1\"\n    nth-check \"~1.0.1\"\n\ncss-select@~1.3.0-rc0:\n  version \"1.3.0-rc0\"\n  resolved \"https://registry.yarnpkg.com/css-select/-/css-select-1.3.0-rc0.tgz#6f93196aaae737666ea1036a8cb14a8fcb7a9231\"\n  dependencies:\n    boolbase \"^1.0.0\"\n    css-what \"2.1\"\n    domutils \"1.5.1\"\n    nth-check \"^1.0.1\"\n\ncss-selector-parser@^1.3.0:\n  version \"1.3.0\"\n  resolved \"https://registry.yarnpkg.com/css-selector-parser/-/css-selector-parser-1.3.0.tgz#5f1ad43e2d8eefbfdc304fcd39a521664943e3eb\"\n\ncss-tree@1.0.0-alpha.29:\n  version \"1.0.0-alpha.29\"\n  resolved \"https://registry.yarnpkg.com/css-tree/-/css-tree-1.0.0-alpha.29.tgz#3fa9d4ef3142cbd1c301e7664c1f352bd82f5a39\"\n  dependencies:\n    mdn-data \"~1.1.0\"\n    source-map \"^0.5.3\"\n\ncss-tree@1.0.0-alpha25:\n  version \"1.0.0-alpha25\"\n  resolved \"https://registry.yarnpkg.com/css-tree/-/css-tree-1.0.0-alpha25.tgz#1bbfabfbf6eeef4f01d9108ff2edd0be2fe35597\"\n  dependencies:\n    mdn-data \"^1.0.0\"\n    source-map \"^0.5.3\"\n\ncss-url-regex@^1.1.0:\n  version \"1.1.0\"\n  resolved \"https://registry.yarnpkg.com/css-url-regex/-/css-url-regex-1.1.0.tgz#83834230cc9f74c457de59eebd1543feeb83b7ec\"\n\ncss-what@2.1:\n  version \"2.1.0\"\n  resolved \"https://registry.yarnpkg.com/css-what/-/css-what-2.1.0.tgz#9467d032c38cfaefb9f2d79501253062f87fa1bd\"\n\ncss@^2.2.1:\n  version \"2.2.3\"\n  resolved \"https://registry.yarnpkg.com/css/-/css-2.2.3.tgz#f861f4ba61e79bedc962aa548e5780fd95cbc6be\"\n  dependencies:\n    inherits \"^2.0.1\"\n    source-map \"^0.1.38\"\n    source-map-resolve \"^0.5.1\"\n    urix \"^0.1.0\"\n\ncssmin@^0.4.3:\n  version \"0.4.3\"\n  resolved \"https://registry.yarnpkg.com/cssmin/-/cssmin-0.4.3.tgz#c9194077e0ebdacd691d5f59015b9d819f38d015\"\n\ncssnano@^3.0.0:\n  version \"3.10.0\"\n  resolved \"https://registry.yarnpkg.com/cssnano/-/cssnano-3.10.0.tgz#4f38f6cea2b9b17fa01490f23f1dc68ea65c1c38\"\n  dependencies:\n    autoprefixer \"^6.3.1\"\n    decamelize \"^1.1.2\"\n    defined \"^1.0.0\"\n    has \"^1.0.1\"\n    object-assign \"^4.0.1\"\n    postcss \"^5.0.14\"\n    postcss-calc \"^5.2.0\"\n    postcss-colormin \"^2.1.8\"\n    postcss-convert-values \"^2.3.4\"\n    postcss-discard-comments \"^2.0.4\"\n    postcss-discard-duplicates \"^2.0.1\"\n    postcss-discard-empty \"^2.0.1\"\n    postcss-discard-overridden \"^0.1.1\"\n    postcss-discard-unused \"^2.2.1\"\n    postcss-filter-plugins \"^2.0.0\"\n    postcss-merge-idents \"^2.1.5\"\n    postcss-merge-longhand \"^2.0.1\"\n    postcss-merge-rules \"^2.0.3\"\n    postcss-minify-font-values \"^1.0.2\"\n    postcss-minify-gradients \"^1.0.1\"\n    postcss-minify-params \"^1.0.4\"\n    postcss-minify-selectors \"^2.0.4\"\n    postcss-normalize-charset \"^1.1.0\"\n    postcss-normalize-url \"^3.0.7\"\n    postcss-ordered-values \"^2.1.0\"\n    postcss-reduce-idents \"^2.2.2\"\n    postcss-reduce-initial \"^1.0.0\"\n    postcss-reduce-transforms \"^1.0.3\"\n    postcss-svgo \"^2.1.1\"\n    postcss-unique-selectors \"^2.0.2\"\n    postcss-value-parser \"^3.2.3\"\n    postcss-zindex \"^2.0.1\"\n\ncsso@^3.5.0:\n  version \"3.5.1\"\n  resolved \"https://registry.yarnpkg.com/csso/-/csso-3.5.1.tgz#7b9eb8be61628973c1b261e169d2f024008e758b\"\n  dependencies:\n    css-tree \"1.0.0-alpha.29\"\n\ncsso@~2.0.0:\n  version \"2.0.0\"\n  resolved \"https://registry.yarnpkg.com/csso/-/csso-2.0.0.tgz#178b43a44621221c27756086f531e02f42900ee8\"\n  dependencies:\n    clap \"^1.0.9\"\n    source-map \"^0.5.3\"\n\ncsso@~2.3.1:\n  version \"2.3.2\"\n  resolved \"https://registry.yarnpkg.com/csso/-/csso-2.3.2.tgz#ddd52c587033f49e94b71fc55569f252e8ff5f85\"\n  dependencies:\n    clap \"^1.0.9\"\n    source-map \"^0.5.3\"\n\ncssom@^0.3.2:\n  version \"0.3.4\"\n  resolved \"https://registry.yarnpkg.com/cssom/-/cssom-0.3.4.tgz#8cd52e8a3acfd68d3aed38ee0a640177d2f9d797\"\n\nctype@0.5.3:\n  version \"0.5.3\"\n  resolved \"https://registry.yarnpkg.com/ctype/-/ctype-0.5.3.tgz#82c18c2461f74114ef16c135224ad0b9144ca12f\"\n\ncurrently-unhandled@^0.4.1:\n  version \"0.4.1\"\n  resolved \"https://registry.yarnpkg.com/currently-unhandled/-/currently-unhandled-0.4.1.tgz#988df33feab191ef799a61369dd76c17adf957ea\"\n  dependencies:\n    array-find-index \"^1.0.1\"\n\ncwebp-bin@^3.1.0:\n  version \"3.2.0\"\n  resolved \"https://registry.yarnpkg.com/cwebp-bin/-/cwebp-bin-3.2.0.tgz#ae02df453d8c15341b1d8d499a5226bcf3bf4a6f\"\n  dependencies:\n    bin-build \"^2.0.0\"\n    bin-wrapper \"^3.0.1\"\n    logalot \"^2.0.0\"\n\ncycle@1.0.x:\n  version \"1.0.3\"\n  resolved \"https://registry.yarnpkg.com/cycle/-/cycle-1.0.3.tgz#21e80b2be8580f98b468f379430662b046c34ad2\"\n\nd@1:\n  version \"1.0.0\"\n  resolved \"https://registry.yarnpkg.com/d/-/d-1.0.0.tgz#754bb5bfe55451da69a58b94d45f4c5b0462d58f\"\n  dependencies:\n    es5-ext \"^0.10.9\"\n\ndashdash@^1.12.0:\n  version \"1.14.1\"\n  resolved \"https://registry.yarnpkg.com/dashdash/-/dashdash-1.14.1.tgz#853cfa0f7cbe2fed5de20326b8dd581035f6e2f0\"\n  dependencies:\n    assert-plus \"^1.0.0\"\n\ndate-now@^0.1.4:\n  version \"0.1.4\"\n  resolved \"https://registry.yarnpkg.com/date-now/-/date-now-0.1.4.tgz#eaf439fd4d4848ad74e5cc7dbef200672b9e345b\"\n\ndateformat@^1.0.11:\n  version \"1.0.12\"\n  resolved \"https://registry.yarnpkg.com/dateformat/-/dateformat-1.0.12.tgz#9f124b67594c937ff706932e4a642cca8dbbfee9\"\n  dependencies:\n    get-stdin \"^4.0.1\"\n    meow \"^3.3.0\"\n\ndateformat@^2.0.0:\n  version \"2.2.0\"\n  resolved \"https://registry.yarnpkg.com/dateformat/-/dateformat-2.2.0.tgz#4065e2013cf9fb916ddfd82efb506ad4c6769062\"\n\ndateformat@^3.0.3:\n  version \"3.0.3\"\n  resolved \"https://registry.yarnpkg.com/dateformat/-/dateformat-3.0.3.tgz#a6e37499a4d9a9cf85ef5872044d62901c9889ae\"\n\ndeap@^1.0.0:\n  version \"1.0.1\"\n  resolved \"https://registry.yarnpkg.com/deap/-/deap-1.0.1.tgz#0646e9e1a095ffe8a9e404d68d1f76dcf57e66fb\"\n\ndebug@2.2.0:\n  version \"2.2.0\"\n  resolved \"https://registry.yarnpkg.com/debug/-/debug-2.2.0.tgz#f87057e995b1a1f6ae6a4960664137bc56f039da\"\n  dependencies:\n    ms \"0.7.1\"\n\ndebug@2.6.8:\n  version \"2.6.8\"\n  resolved \"https://registry.yarnpkg.com/debug/-/debug-2.6.8.tgz#e731531ca2ede27d188222427da17821d68ff4fc\"\n  dependencies:\n    ms \"2.0.0\"\n\ndebug@2.6.9, debug@^2.1.2, debug@^2.2.0, debug@^2.3.3, debug@^2.6.8, debug@^2.6.9, debug@~2.6.4:\n  version \"2.6.9\"\n  resolved \"https://registry.yarnpkg.com/debug/-/debug-2.6.9.tgz#5d128515df134ff327e90a4c93f4e077a536341f\"\n  dependencies:\n    ms \"2.0.0\"\n\ndebug@^3.1.0, debug@~3.1.0:\n  version \"3.1.0\"\n  resolved \"https://registry.yarnpkg.com/debug/-/debug-3.1.0.tgz#5bb5a0672628b64149566ba16819e61518c67261\"\n  dependencies:\n    ms \"2.0.0\"\n\ndecamelize@^1.0.0, decamelize@^1.1.1, decamelize@^1.1.2:\n  version \"1.2.0\"\n  resolved \"https://registry.yarnpkg.com/decamelize/-/decamelize-1.2.0.tgz#f6534d15148269b20352e7bee26f501f9a191290\"\n\ndecode-uri-component@^0.2.0:\n  version \"0.2.0\"\n  resolved \"https://registry.yarnpkg.com/decode-uri-component/-/decode-uri-component-0.2.0.tgz#eb3913333458775cb84cd1a1fae062106bb87545\"\n\ndecompress-tar@^3.0.0:\n  version \"3.1.0\"\n  resolved \"https://registry.yarnpkg.com/decompress-tar/-/decompress-tar-3.1.0.tgz#217c789f9b94450efaadc5c5e537978fc333c466\"\n  dependencies:\n    is-tar \"^1.0.0\"\n    object-assign \"^2.0.0\"\n    strip-dirs \"^1.0.0\"\n    tar-stream \"^1.1.1\"\n    through2 \"^0.6.1\"\n    vinyl \"^0.4.3\"\n\ndecompress-tarbz2@^3.0.0:\n  version \"3.1.0\"\n  resolved \"https://registry.yarnpkg.com/decompress-tarbz2/-/decompress-tarbz2-3.1.0.tgz#8b23935681355f9f189d87256a0f8bdd96d9666d\"\n  dependencies:\n    is-bzip2 \"^1.0.0\"\n    object-assign \"^2.0.0\"\n    seek-bzip \"^1.0.3\"\n    strip-dirs \"^1.0.0\"\n    tar-stream \"^1.1.1\"\n    through2 \"^0.6.1\"\n    vinyl \"^0.4.3\"\n\ndecompress-targz@^3.0.0:\n  version \"3.1.0\"\n  resolved \"https://registry.yarnpkg.com/decompress-targz/-/decompress-targz-3.1.0.tgz#b2c13df98166268991b715d6447f642e9696f5a0\"\n  dependencies:\n    is-gzip \"^1.0.0\"\n    object-assign \"^2.0.0\"\n    strip-dirs \"^1.0.0\"\n    tar-stream \"^1.1.1\"\n    through2 \"^0.6.1\"\n    vinyl \"^0.4.3\"\n\ndecompress-unzip@^3.0.0:\n  version \"3.4.0\"\n  resolved \"https://registry.yarnpkg.com/decompress-unzip/-/decompress-unzip-3.4.0.tgz#61475b4152066bbe3fee12f9d629d15fe6478eeb\"\n  dependencies:\n    is-zip \"^1.0.0\"\n    read-all-stream \"^3.0.0\"\n    stat-mode \"^0.2.0\"\n    strip-dirs \"^1.0.0\"\n    through2 \"^2.0.0\"\n    vinyl \"^1.0.0\"\n    yauzl \"^2.2.1\"\n\ndecompress@^3.0.0:\n  version \"3.0.0\"\n  resolved \"https://registry.yarnpkg.com/decompress/-/decompress-3.0.0.tgz#af1dd50d06e3bfc432461d37de11b38c0d991bed\"\n  dependencies:\n    buffer-to-vinyl \"^1.0.0\"\n    concat-stream \"^1.4.6\"\n    decompress-tar \"^3.0.0\"\n    decompress-tarbz2 \"^3.0.0\"\n    decompress-targz \"^3.0.0\"\n    decompress-unzip \"^3.0.0\"\n    stream-combiner2 \"^1.1.1\"\n    vinyl-assign \"^1.0.1\"\n    vinyl-fs \"^2.2.0\"\n\ndeep-extend@^0.6.0:\n  version \"0.6.0\"\n  resolved \"https://registry.yarnpkg.com/deep-extend/-/deep-extend-0.6.0.tgz#c4fa7c95404a17a9c3e8ca7e1537312b736330ac\"\n\ndefault-compare@^1.0.0:\n  version \"1.0.0\"\n  resolved \"https://registry.yarnpkg.com/default-compare/-/default-compare-1.0.0.tgz#cb61131844ad84d84788fb68fd01681ca7781a2f\"\n  dependencies:\n    kind-of \"^5.0.2\"\n\ndefault-resolution@^2.0.0:\n  version \"2.0.0\"\n  resolved \"https://registry.yarnpkg.com/default-resolution/-/default-resolution-2.0.0.tgz#bcb82baa72ad79b426a76732f1a81ad6df26d684\"\n\ndefaults@^1.0.0:\n  version \"1.0.3\"\n  resolved \"https://registry.yarnpkg.com/defaults/-/defaults-1.0.3.tgz#c656051e9817d9ff08ed881477f3fe4019f3ef7d\"\n  dependencies:\n    clone \"^1.0.2\"\n\ndefine-properties@^1.1.2:\n  version \"1.1.2\"\n  resolved \"https://registry.yarnpkg.com/define-properties/-/define-properties-1.1.2.tgz#83a73f2fea569898fb737193c8f873caf6d45c94\"\n  dependencies:\n    foreach \"^2.0.5\"\n    object-keys \"^1.0.8\"\n\ndefine-property@^0.2.5:\n  version \"0.2.5\"\n  resolved \"https://registry.yarnpkg.com/define-property/-/define-property-0.2.5.tgz#c35b1ef918ec3c990f9a5bc57be04aacec5c8116\"\n  dependencies:\n    is-descriptor \"^0.1.0\"\n\ndefine-property@^1.0.0:\n  version \"1.0.0\"\n  resolved \"https://registry.yarnpkg.com/define-property/-/define-property-1.0.0.tgz#769ebaaf3f4a63aad3af9e8d304c9bbe79bfb0e6\"\n  dependencies:\n    is-descriptor \"^1.0.0\"\n\ndefine-property@^2.0.2:\n  version \"2.0.2\"\n  resolved \"https://registry.yarnpkg.com/define-property/-/define-property-2.0.2.tgz#d459689e8d654ba77e02a817f8710d702cb16e9d\"\n  dependencies:\n    is-descriptor \"^1.0.2\"\n    isobject \"^3.0.1\"\n\ndefined@^1.0.0:\n  version \"1.0.0\"\n  resolved \"https://registry.yarnpkg.com/defined/-/defined-1.0.0.tgz#c98d9bcef75674188e110969151199e39b1fa693\"\n\ndel@^2.2.0:\n  version \"2.2.2\"\n  resolved \"https://registry.yarnpkg.com/del/-/del-2.2.2.tgz#c12c981d067846c84bcaf862cff930d907ffd1a8\"\n  dependencies:\n    globby \"^5.0.0\"\n    is-path-cwd \"^1.0.0\"\n    is-path-in-cwd \"^1.0.0\"\n    object-assign \"^4.0.1\"\n    pify \"^2.0.0\"\n    pinkie-promise \"^2.0.0\"\n    rimraf \"^2.2.8\"\n\ndelayed-stream@0.0.5:\n  version \"0.0.5\"\n  resolved \"https://registry.yarnpkg.com/delayed-stream/-/delayed-stream-0.0.5.tgz#d4b1f43a93e8296dfe02694f4680bc37a313c73f\"\n\ndelayed-stream@~1.0.0:\n  version \"1.0.0\"\n  resolved \"https://registry.yarnpkg.com/delayed-stream/-/delayed-stream-1.0.0.tgz#df3ae199acadfb7d440aaae0b29e2272b24ec619\"\n\ndelegates@^1.0.0:\n  version \"1.0.0\"\n  resolved \"https://registry.yarnpkg.com/delegates/-/delegates-1.0.0.tgz#84c6e159b81904fdca59a0ef44cd870d31250f9a\"\n\ndepd@~1.1.2:\n  version \"1.1.2\"\n  resolved \"https://registry.yarnpkg.com/depd/-/depd-1.1.2.tgz#9bcd52e14c097763e749b274c4346ed2e560b5a9\"\n\ndes.js@^1.0.0:\n  version \"1.0.0\"\n  resolved \"https://registry.yarnpkg.com/des.js/-/des.js-1.0.0.tgz#c074d2e2aa6a8a9a07dbd61f9a15c2cd83ec8ecc\"\n  dependencies:\n    inherits \"^2.0.1\"\n    minimalistic-assert \"^1.0.0\"\n\ndestroy@~1.0.4:\n  version \"1.0.4\"\n  resolved \"https://registry.yarnpkg.com/destroy/-/destroy-1.0.4.tgz#978857442c44749e4206613e37946205826abd80\"\n\ndetect-file@^1.0.0:\n  version \"1.0.0\"\n  resolved \"https://registry.yarnpkg.com/detect-file/-/detect-file-1.0.0.tgz#f0d66d03672a825cb1b73bdb3fe62310c8e552b7\"\n\ndetect-indent@^4.0.0:\n  version \"4.0.0\"\n  resolved \"https://registry.yarnpkg.com/detect-indent/-/detect-indent-4.0.0.tgz#f76d064352cdf43a1cb6ce619c4ee3a9475de208\"\n  dependencies:\n    repeating \"^2.0.0\"\n\ndetect-libc@^1.0.2:\n  version \"1.0.3\"\n  resolved \"https://registry.yarnpkg.com/detect-libc/-/detect-libc-1.0.3.tgz#fa137c4bd698edf55cd5cd02ac559f91a4c4ba9b\"\n\ndev-ip@^1.0.1:\n  version \"1.0.1\"\n  resolved \"https://registry.yarnpkg.com/dev-ip/-/dev-ip-1.0.1.tgz#a76a3ed1855be7a012bb8ac16cb80f3c00dc28f0\"\n\ndiff@1.4.0:\n  version \"1.4.0\"\n  resolved \"https://registry.yarnpkg.com/diff/-/diff-1.4.0.tgz#7f28d2eb9ee7b15a97efd89ce63dcfdaa3ccbabf\"\n\ndiffie-hellman@^5.0.0:\n  version \"5.0.3\"\n  resolved \"https://registry.yarnpkg.com/diffie-hellman/-/diffie-hellman-5.0.3.tgz#40e8ee98f55a2149607146921c63e1ae5f3d2875\"\n  dependencies:\n    bn.js \"^4.1.0\"\n    miller-rabin \"^4.0.0\"\n    randombytes \"^2.0.0\"\n\ndom-serializer@0, dom-serializer@~0.1.0:\n  version \"0.1.0\"\n  resolved \"https://registry.yarnpkg.com/dom-serializer/-/dom-serializer-0.1.0.tgz#073c697546ce0780ce23be4a28e293e40bc30c82\"\n  dependencies:\n    domelementtype \"~1.1.1\"\n    entities \"~1.1.1\"\n\ndom-walk@^0.1.0:\n  version \"0.1.1\"\n  resolved \"https://registry.yarnpkg.com/dom-walk/-/dom-walk-0.1.1.tgz#672226dc74c8f799ad35307df936aba11acd6018\"\n\ndomain-browser@^1.1.1:\n  version \"1.2.0\"\n  resolved \"https://registry.yarnpkg.com/domain-browser/-/domain-browser-1.2.0.tgz#3d31f50191a6749dd1375a7f522e823d42e54eda\"\n\ndomelementtype@1, domelementtype@^1.3.0:\n  version \"1.3.0\"\n  resolved \"https://registry.yarnpkg.com/domelementtype/-/domelementtype-1.3.0.tgz#b17aed82e8ab59e52dd9c19b1756e0fc187204c2\"\n\ndomelementtype@~1.1.1:\n  version \"1.1.3\"\n  resolved \"https://registry.yarnpkg.com/domelementtype/-/domelementtype-1.1.3.tgz#bd28773e2642881aec51544924299c5cd822185b\"\n\ndomhandler@^2.3.0:\n  version \"2.4.2\"\n  resolved \"https://registry.yarnpkg.com/domhandler/-/domhandler-2.4.2.tgz#8805097e933d65e85546f726d60f5eb88b44f803\"\n  dependencies:\n    domelementtype \"1\"\n\ndomutils@1.5.1:\n  version \"1.5.1\"\n  resolved \"https://registry.yarnpkg.com/domutils/-/domutils-1.5.1.tgz#dcd8488a26f563d61079e48c9f7b7e32373682cf\"\n  dependencies:\n    dom-serializer \"0\"\n    domelementtype \"1\"\n\ndomutils@^1.5.1:\n  version \"1.7.0\"\n  resolved \"https://registry.yarnpkg.com/domutils/-/domutils-1.7.0.tgz#56ea341e834e06e6748af7a1cb25da67ea9f8c2a\"\n  dependencies:\n    dom-serializer \"0\"\n    domelementtype \"1\"\n\ndownload@^4.0.0, download@^4.1.2:\n  version \"4.4.3\"\n  resolved \"https://registry.yarnpkg.com/download/-/download-4.4.3.tgz#aa55fdad392d95d4b68e8c2be03e0c2aa21ba9ac\"\n  dependencies:\n    caw \"^1.0.1\"\n    concat-stream \"^1.4.7\"\n    each-async \"^1.0.0\"\n    filenamify \"^1.0.1\"\n    got \"^5.0.0\"\n    gulp-decompress \"^1.2.0\"\n    gulp-rename \"^1.2.0\"\n    is-url \"^1.2.0\"\n    object-assign \"^4.0.1\"\n    read-all-stream \"^3.0.0\"\n    readable-stream \"^2.0.2\"\n    stream-combiner2 \"^1.1.1\"\n    vinyl \"^1.0.0\"\n    vinyl-fs \"^2.2.0\"\n    ware \"^1.2.0\"\n\nduplexer2@0.0.2:\n  version \"0.0.2\"\n  resolved \"https://registry.yarnpkg.com/duplexer2/-/duplexer2-0.0.2.tgz#c614dcf67e2fb14995a91711e5a617e8a60a31db\"\n  dependencies:\n    readable-stream \"~1.1.9\"\n\nduplexer2@^0.1.4, duplexer2@~0.1.0:\n  version \"0.1.4\"\n  resolved \"https://registry.yarnpkg.com/duplexer2/-/duplexer2-0.1.4.tgz#8b12dab878c0d69e3e7891051662a32fc6bddcc1\"\n  dependencies:\n    readable-stream \"^2.0.2\"\n\nduplexer@~0.1.1:\n  version \"0.1.1\"\n  resolved \"https://registry.yarnpkg.com/duplexer/-/duplexer-0.1.1.tgz#ace6ff808c1ce66b57d1ebf97977acb02334cfc1\"\n\nduplexify@^3.2.0, duplexify@^3.5.0, duplexify@^3.6.0:\n  version \"3.6.0\"\n  resolved \"https://registry.yarnpkg.com/duplexify/-/duplexify-3.6.0.tgz#592903f5d80b38d037220541264d69a198fb3410\"\n  dependencies:\n    end-of-stream \"^1.0.0\"\n    inherits \"^2.0.1\"\n    readable-stream \"^2.0.0\"\n    stream-shift \"^1.0.0\"\n\neach-async@^1.0.0, each-async@^1.1.1:\n  version \"1.1.1\"\n  resolved \"https://registry.yarnpkg.com/each-async/-/each-async-1.1.1.tgz#dee5229bdf0ab6ba2012a395e1b869abf8813473\"\n  dependencies:\n    onetime \"^1.0.0\"\n    set-immediate-shim \"^1.0.0\"\n\neach-props@^1.3.0:\n  version \"1.3.2\"\n  resolved \"https://registry.yarnpkg.com/each-props/-/each-props-1.3.2.tgz#ea45a414d16dd5cfa419b1a81720d5ca06892333\"\n  dependencies:\n    is-plain-object \"^2.0.1\"\n    object.defaults \"^1.1.0\"\n\neasy-extender@2.3.2:\n  version \"2.3.2\"\n  resolved \"https://registry.yarnpkg.com/easy-extender/-/easy-extender-2.3.2.tgz#3d3248febe2b159607316d8f9cf491c16648221d\"\n  dependencies:\n    lodash \"^3.10.1\"\n\neazy-logger@3.0.2:\n  version \"3.0.2\"\n  resolved \"https://registry.yarnpkg.com/eazy-logger/-/eazy-logger-3.0.2.tgz#a325aa5e53d13a2225889b2ac4113b2b9636f4fc\"\n  dependencies:\n    tfunk \"^3.0.1\"\n\necc-jsbn@~0.1.1:\n  version \"0.1.2\"\n  resolved \"https://registry.yarnpkg.com/ecc-jsbn/-/ecc-jsbn-0.1.2.tgz#3a83a904e54353287874c564b7549386849a98c9\"\n  dependencies:\n    jsbn \"~0.1.0\"\n    safer-buffer \"^2.1.0\"\n\nee-first@1.1.1:\n  version \"1.1.1\"\n  resolved \"https://registry.yarnpkg.com/ee-first/-/ee-first-1.1.1.tgz#590c61156b0ae2f4f0255732a158b266bc56b21d\"\n\nejs@2.5.5:\n  version \"2.5.5\"\n  resolved \"https://registry.yarnpkg.com/ejs/-/ejs-2.5.5.tgz#6ef4e954ea7dcf54f66aad2fe7aa421932d9ed77\"\n\nejs@^2.3.1:\n  version \"2.6.1\"\n  resolved \"https://registry.yarnpkg.com/ejs/-/ejs-2.6.1.tgz#498ec0d495655abc6f23cd61868d926464071aa0\"\n\nelectron-to-chromium@^1.2.7:\n  version \"1.3.55\"\n  resolved \"https://registry.yarnpkg.com/electron-to-chromium/-/electron-to-chromium-1.3.55.tgz#f150e10b20b77d9d41afcca312efe0c3b1a7fdce\"\n\nelliptic@^6.0.0:\n  version \"6.4.0\"\n  resolved \"https://registry.yarnpkg.com/elliptic/-/elliptic-6.4.0.tgz#cac9af8762c85836187003c8dfe193e5e2eae5df\"\n  dependencies:\n    bn.js \"^4.4.0\"\n    brorand \"^1.0.1\"\n    hash.js \"^1.0.0\"\n    hmac-drbg \"^1.0.0\"\n    inherits \"^2.0.1\"\n    minimalistic-assert \"^1.0.0\"\n    minimalistic-crypto-utils \"^1.0.0\"\n\nemojis-list@^2.0.0:\n  version \"2.1.0\"\n  resolved \"https://registry.yarnpkg.com/emojis-list/-/emojis-list-2.1.0.tgz#4daa4d9db00f9819880c79fa457ae5b09a1fd389\"\n\nencodeurl@~1.0.1, encodeurl@~1.0.2:\n  version \"1.0.2\"\n  resolved \"https://registry.yarnpkg.com/encodeurl/-/encodeurl-1.0.2.tgz#ad3ff4c86ec2d029322f5a02c3a9a606c95b3f59\"\n\nend-of-stream@^1.0.0, end-of-stream@^1.1.0:\n  version \"1.4.1\"\n  resolved \"https://registry.yarnpkg.com/end-of-stream/-/end-of-stream-1.4.1.tgz#ed29634d19baba463b6ce6b80a37213eab71ec43\"\n  dependencies:\n    once \"^1.4.0\"\n\nengine.io-client@~3.1.0:\n  version \"3.1.6\"\n  resolved \"https://registry.yarnpkg.com/engine.io-client/-/engine.io-client-3.1.6.tgz#5bdeb130f8b94a50ac5cbeb72583e7a4a063ddfd\"\n  dependencies:\n    component-emitter \"1.2.1\"\n    component-inherit \"0.0.3\"\n    debug \"~3.1.0\"\n    engine.io-parser \"~2.1.1\"\n    has-cors \"1.1.0\"\n    indexof \"0.0.1\"\n    parseqs \"0.0.5\"\n    parseuri \"0.0.5\"\n    ws \"~3.3.1\"\n    xmlhttprequest-ssl \"~1.5.4\"\n    yeast \"0.1.2\"\n\nengine.io-client@~3.2.0:\n  version \"3.2.1\"\n  resolved \"https://registry.yarnpkg.com/engine.io-client/-/engine.io-client-3.2.1.tgz#6f54c0475de487158a1a7c77d10178708b6add36\"\n  dependencies:\n    component-emitter \"1.2.1\"\n    component-inherit \"0.0.3\"\n    debug \"~3.1.0\"\n    engine.io-parser \"~2.1.1\"\n    has-cors \"1.1.0\"\n    indexof \"0.0.1\"\n    parseqs \"0.0.5\"\n    parseuri \"0.0.5\"\n    ws \"~3.3.1\"\n    xmlhttprequest-ssl \"~1.5.4\"\n    yeast \"0.1.2\"\n\nengine.io-parser@~2.1.0, engine.io-parser@~2.1.1:\n  version \"2.1.2\"\n  resolved \"https://registry.yarnpkg.com/engine.io-parser/-/engine.io-parser-2.1.2.tgz#4c0f4cff79aaeecbbdcfdea66a823c6085409196\"\n  dependencies:\n    after \"0.8.2\"\n    arraybuffer.slice \"~0.0.7\"\n    base64-arraybuffer \"0.1.5\"\n    blob \"0.0.4\"\n    has-binary2 \"~1.0.2\"\n\nengine.io@~3.2.0:\n  version \"3.2.0\"\n  resolved \"https://registry.yarnpkg.com/engine.io/-/engine.io-3.2.0.tgz#54332506f42f2edc71690d2f2a42349359f3bf7d\"\n  dependencies:\n    accepts \"~1.3.4\"\n    base64id \"1.0.0\"\n    cookie \"0.3.1\"\n    debug \"~3.1.0\"\n    engine.io-parser \"~2.1.0\"\n    ws \"~3.3.1\"\n\nenhanced-resolve@^3.3.0:\n  version \"3.4.1\"\n  resolved \"https://registry.yarnpkg.com/enhanced-resolve/-/enhanced-resolve-3.4.1.tgz#0421e339fd71419b3da13d129b3979040230476e\"\n  dependencies:\n    graceful-fs \"^4.1.2\"\n    memory-fs \"^0.4.0\"\n    object-assign \"^4.0.1\"\n    tapable \"^0.2.7\"\n\nenhanced-resolve@~0.9.0:\n  version \"0.9.1\"\n  resolved \"https://registry.yarnpkg.com/enhanced-resolve/-/enhanced-resolve-0.9.1.tgz#4d6e689b3725f86090927ccc86cd9f1635b89e2e\"\n  dependencies:\n    graceful-fs \"^4.1.2\"\n    memory-fs \"^0.2.0\"\n    tapable \"^0.1.8\"\n\nentities@^1.1.1, entities@~1.1.1:\n  version \"1.1.1\"\n  resolved \"https://registry.yarnpkg.com/entities/-/entities-1.1.1.tgz#6e5c2d0a5621b5dadaecef80b90edfb5cd7772f0\"\n\nerrno@^0.1.1, errno@^0.1.3:\n  version \"0.1.7\"\n  resolved \"https://registry.yarnpkg.com/errno/-/errno-0.1.7.tgz#4684d71779ad39af177e3f007996f7c67c852618\"\n  dependencies:\n    prr \"~1.0.1\"\n\nerror-ex@^1.2.0:\n  version \"1.3.2\"\n  resolved \"https://registry.yarnpkg.com/error-ex/-/error-ex-1.3.2.tgz#b4ac40648107fdcdcfae242f428bea8a14d4f1bf\"\n  dependencies:\n    is-arrayish \"^0.2.1\"\n\nes-abstract@^1.5.1, es-abstract@^1.6.1:\n  version \"1.12.0\"\n  resolved \"https://registry.yarnpkg.com/es-abstract/-/es-abstract-1.12.0.tgz#9dbbdd27c6856f0001421ca18782d786bf8a6165\"\n  dependencies:\n    es-to-primitive \"^1.1.1\"\n    function-bind \"^1.1.1\"\n    has \"^1.0.1\"\n    is-callable \"^1.1.3\"\n    is-regex \"^1.0.4\"\n\nes-to-primitive@^1.1.1:\n  version \"1.1.1\"\n  resolved \"https://registry.yarnpkg.com/es-to-primitive/-/es-to-primitive-1.1.1.tgz#45355248a88979034b6792e19bb81f2b7975dd0d\"\n  dependencies:\n    is-callable \"^1.1.1\"\n    is-date-object \"^1.0.1\"\n    is-symbol \"^1.0.1\"\n\nes5-ext@^0.10.14, es5-ext@^0.10.35, es5-ext@^0.10.9, es5-ext@~0.10.14:\n  version \"0.10.45\"\n  resolved \"https://registry.yarnpkg.com/es5-ext/-/es5-ext-0.10.45.tgz#0bfdf7b473da5919d5adf3bd25ceb754fccc3653\"\n  dependencies:\n    es6-iterator \"~2.0.3\"\n    es6-symbol \"~3.1.1\"\n    next-tick \"1\"\n\nes6-iterator@^2.0.1, es6-iterator@~2.0.3:\n  version \"2.0.3\"\n  resolved \"https://registry.yarnpkg.com/es6-iterator/-/es6-iterator-2.0.3.tgz#a7de889141a05a94b0854403b2d0a0fbfa98f3b7\"\n  dependencies:\n    d \"1\"\n    es5-ext \"^0.10.35\"\n    es6-symbol \"^3.1.1\"\n\nes6-promise@^3.0.2:\n  version \"3.3.1\"\n  resolved \"https://registry.yarnpkg.com/es6-promise/-/es6-promise-3.3.1.tgz#a08cdde84ccdbf34d027a1451bc91d4bcd28a613\"\n\nes6-promise@^4.0.3:\n  version \"4.2.4\"\n  resolved \"https://registry.yarnpkg.com/es6-promise/-/es6-promise-4.2.4.tgz#dc4221c2b16518760bd8c39a52d8f356fc00ed29\"\n\nes6-symbol@^3.1.1, es6-symbol@~3.1.1:\n  version \"3.1.1\"\n  resolved \"https://registry.yarnpkg.com/es6-symbol/-/es6-symbol-3.1.1.tgz#bf00ef4fdab6ba1b46ecb7b629b4c7ed5715cc77\"\n  dependencies:\n    d \"1\"\n    es5-ext \"~0.10.14\"\n\nes6-weak-map@^2.0.1:\n  version \"2.0.2\"\n  resolved \"https://registry.yarnpkg.com/es6-weak-map/-/es6-weak-map-2.0.2.tgz#5e3ab32251ffd1538a1f8e5ffa1357772f92d96f\"\n  dependencies:\n    d \"1\"\n    es5-ext \"^0.10.14\"\n    es6-iterator \"^2.0.1\"\n    es6-symbol \"^3.1.1\"\n\nescape-html@~1.0.3:\n  version \"1.0.3\"\n  resolved \"https://registry.yarnpkg.com/escape-html/-/escape-html-1.0.3.tgz#0258eae4d3d0c0974de1c169188ef0051d1d1988\"\n\nescape-string-regexp@1.0.2:\n  version \"1.0.2\"\n  resolved \"https://registry.yarnpkg.com/escape-string-regexp/-/escape-string-regexp-1.0.2.tgz#4dbc2fe674e71949caf3fb2695ce7f2dc1d9a8d1\"\n\nescape-string-regexp@^1.0.2, escape-string-regexp@^1.0.3, escape-string-regexp@^1.0.5:\n  version \"1.0.5\"\n  resolved \"https://registry.yarnpkg.com/escape-string-regexp/-/escape-string-regexp-1.0.5.tgz#1b61c0562190a8dff6ae3bb2cf0200ca130b86d4\"\n\nesprima@^2.6.0:\n  version \"2.7.3\"\n  resolved \"https://registry.yarnpkg.com/esprima/-/esprima-2.7.3.tgz#96e3b70d5779f6ad49cd032673d1c312767ba581\"\n\nesprima@^4.0.0:\n  version \"4.0.1\"\n  resolved \"https://registry.yarnpkg.com/esprima/-/esprima-4.0.1.tgz#13b04cdb3e6c5d19df91ab6987a8695619b0aa71\"\n\nesutils@^2.0.2:\n  version \"2.0.2\"\n  resolved \"https://registry.yarnpkg.com/esutils/-/esutils-2.0.2.tgz#0abf4f1caa5bcb1f7a9d8acc6dea4faaa04bac9b\"\n\netag@^1.8.1, etag@~1.8.1:\n  version \"1.8.1\"\n  resolved \"https://registry.yarnpkg.com/etag/-/etag-1.8.1.tgz#41ae2eeb65efa62268aebfea83ac7d79299b0887\"\n\neventemitter3@1.x.x:\n  version \"1.2.0\"\n  resolved \"https://registry.yarnpkg.com/eventemitter3/-/eventemitter3-1.2.0.tgz#1c86991d816ad1e504750e73874224ecf3bec508\"\n\nevents@^1.0.0:\n  version \"1.1.1\"\n  resolved \"https://registry.yarnpkg.com/events/-/events-1.1.1.tgz#9ebdb7635ad099c70dcc4c2a1f5004288e8bd924\"\n\nevp_bytestokey@^1.0.0, evp_bytestokey@^1.0.3:\n  version \"1.0.3\"\n  resolved \"https://registry.yarnpkg.com/evp_bytestokey/-/evp_bytestokey-1.0.3.tgz#7fcbdb198dc71959432efe13842684e0525acb02\"\n  dependencies:\n    md5.js \"^1.3.4\"\n    safe-buffer \"^5.1.1\"\n\nexec-buffer@^2.0.0:\n  version \"2.0.1\"\n  resolved \"https://registry.yarnpkg.com/exec-buffer/-/exec-buffer-2.0.1.tgz#0028a31be0b1460b61d075f96af4583b9e335ea0\"\n  dependencies:\n    rimraf \"^2.2.6\"\n    tempfile \"^1.0.0\"\n\nexec-series@^1.0.0:\n  version \"1.0.3\"\n  resolved \"https://registry.yarnpkg.com/exec-series/-/exec-series-1.0.3.tgz#6d257a9beac482a872c7783bc8615839fc77143a\"\n  dependencies:\n    async-each-series \"^1.1.0\"\n    object-assign \"^4.1.0\"\n\nexeca@^0.7.0:\n  version \"0.7.0\"\n  resolved \"https://registry.yarnpkg.com/execa/-/execa-0.7.0.tgz#944becd34cc41ee32a63a9faf27ad5a65fc59777\"\n  dependencies:\n    cross-spawn \"^5.0.1\"\n    get-stream \"^3.0.0\"\n    is-stream \"^1.1.0\"\n    npm-run-path \"^2.0.0\"\n    p-finally \"^1.0.0\"\n    signal-exit \"^3.0.0\"\n    strip-eof \"^1.0.0\"\n\nexecutable@^1.0.0:\n  version \"1.1.0\"\n  resolved \"https://registry.yarnpkg.com/executable/-/executable-1.1.0.tgz#877980e9112f3391066da37265de7ad8434ab4d9\"\n  dependencies:\n    meow \"^3.1.0\"\n\nexif-parser@^0.1.9:\n  version \"0.1.12\"\n  resolved \"https://registry.yarnpkg.com/exif-parser/-/exif-parser-0.1.12.tgz#58a9d2d72c02c1f6f02a0ef4a9166272b7760922\"\n\nexpand-brackets@^0.1.4:\n  version \"0.1.5\"\n  resolved \"https://registry.yarnpkg.com/expand-brackets/-/expand-brackets-0.1.5.tgz#df07284e342a807cd733ac5af72411e581d1177b\"\n  dependencies:\n    is-posix-bracket \"^0.1.0\"\n\nexpand-brackets@^2.1.4:\n  version \"2.1.4\"\n  resolved \"https://registry.yarnpkg.com/expand-brackets/-/expand-brackets-2.1.4.tgz#b77735e315ce30f6b6eff0f83b04151a22449622\"\n  dependencies:\n    debug \"^2.3.3\"\n    define-property \"^0.2.5\"\n    extend-shallow \"^2.0.1\"\n    posix-character-classes \"^0.1.0\"\n    regex-not \"^1.0.0\"\n    snapdragon \"^0.8.1\"\n    to-regex \"^3.0.1\"\n\nexpand-range@^1.8.1:\n  version \"1.8.2\"\n  resolved \"https://registry.yarnpkg.com/expand-range/-/expand-range-1.8.2.tgz#a299effd335fe2721ebae8e257ec79644fc85337\"\n  dependencies:\n    fill-range \"^2.1.0\"\n\nexpand-tilde@^2.0.0, expand-tilde@^2.0.2:\n  version \"2.0.2\"\n  resolved \"https://registry.yarnpkg.com/expand-tilde/-/expand-tilde-2.0.2.tgz#97e801aa052df02454de46b02bf621642cdc8502\"\n  dependencies:\n    homedir-polyfill \"^1.0.1\"\n\nextend-shallow@^1.1.2:\n  version \"1.1.4\"\n  resolved \"https://registry.yarnpkg.com/extend-shallow/-/extend-shallow-1.1.4.tgz#19d6bf94dfc09d76ba711f39b872d21ff4dd9071\"\n  dependencies:\n    kind-of \"^1.1.0\"\n\nextend-shallow@^2.0.1:\n  version \"2.0.1\"\n  resolved \"https://registry.yarnpkg.com/extend-shallow/-/extend-shallow-2.0.1.tgz#51af7d614ad9a9f610ea1bafbb989d6b1c56890f\"\n  dependencies:\n    is-extendable \"^0.1.0\"\n\nextend-shallow@^3.0.0, extend-shallow@^3.0.2:\n  version \"3.0.2\"\n  resolved \"https://registry.yarnpkg.com/extend-shallow/-/extend-shallow-3.0.2.tgz#26a71aaf073b39fb2127172746131c2704028db8\"\n  dependencies:\n    assign-symbols \"^1.0.0\"\n    is-extendable \"^1.0.1\"\n\nextend@^3.0.0, extend@~3.0.0, extend@~3.0.1:\n  version \"3.0.2\"\n  resolved \"https://registry.yarnpkg.com/extend/-/extend-3.0.2.tgz#f8b1136b4071fbd8eb140aff858b1019ec2915fa\"\n\nextend@~1.2.1:\n  version \"1.2.1\"\n  resolved \"https://registry.yarnpkg.com/extend/-/extend-1.2.1.tgz#a0f5fd6cfc83a5fe49ef698d60ec8a624dd4576c\"\n\nextglob@^0.3.1:\n  version \"0.3.2\"\n  resolved \"https://registry.yarnpkg.com/extglob/-/extglob-0.3.2.tgz#2e18ff3d2f49ab2765cec9023f011daa8d8349a1\"\n  dependencies:\n    is-extglob \"^1.0.0\"\n\nextglob@^2.0.4:\n  version \"2.0.4\"\n  resolved \"https://registry.yarnpkg.com/extglob/-/extglob-2.0.4.tgz#ad00fe4dc612a9232e8718711dc5cb5ab0285543\"\n  dependencies:\n    array-unique \"^0.3.2\"\n    define-property \"^1.0.0\"\n    expand-brackets \"^2.1.4\"\n    extend-shallow \"^2.0.1\"\n    fragment-cache \"^0.2.1\"\n    regex-not \"^1.0.0\"\n    snapdragon \"^0.8.1\"\n    to-regex \"^3.0.1\"\n\nextract-zip@^1.6.5:\n  version \"1.6.7\"\n  resolved \"https://registry.yarnpkg.com/extract-zip/-/extract-zip-1.6.7.tgz#a840b4b8af6403264c8db57f4f1a74333ef81fe9\"\n  dependencies:\n    concat-stream \"1.6.2\"\n    debug \"2.6.9\"\n    mkdirp \"0.5.1\"\n    yauzl \"2.4.1\"\n\nextsprintf@1.3.0:\n  version \"1.3.0\"\n  resolved \"https://registry.yarnpkg.com/extsprintf/-/extsprintf-1.3.0.tgz#96918440e3041a7a414f8c52e3c574eb3c3e1e05\"\n\nextsprintf@^1.2.0:\n  version \"1.4.0\"\n  resolved \"https://registry.yarnpkg.com/extsprintf/-/extsprintf-1.4.0.tgz#e2689f8f356fad62cca65a3a91c5df5f9551692f\"\n\neyes@0.1.x:\n  version \"0.1.8\"\n  resolved \"https://registry.yarnpkg.com/eyes/-/eyes-0.1.8.tgz#62cf120234c683785d902348a800ef3e0cc20bc0\"\n\nfancy-log@^1.0.0, fancy-log@^1.1.0, fancy-log@^1.3.2:\n  version \"1.3.2\"\n  resolved \"https://registry.yarnpkg.com/fancy-log/-/fancy-log-1.3.2.tgz#f41125e3d84f2e7d89a43d06d958c8f78be16be1\"\n  dependencies:\n    ansi-gray \"^0.1.1\"\n    color-support \"^1.1.3\"\n    time-stamp \"^1.0.0\"\n\nfast-deep-equal@^1.0.0:\n  version \"1.1.0\"\n  resolved \"https://registry.yarnpkg.com/fast-deep-equal/-/fast-deep-equal-1.1.0.tgz#c053477817c86b51daa853c81e059b733d023614\"\n\nfast-json-stable-stringify@^2.0.0:\n  version \"2.0.0\"\n  resolved \"https://registry.yarnpkg.com/fast-json-stable-stringify/-/fast-json-stable-stringify-2.0.0.tgz#d5142c0caee6b1189f87d3a76111064f86c8bbf2\"\n\nfd-slicer@~1.0.1:\n  version \"1.0.1\"\n  resolved \"https://registry.yarnpkg.com/fd-slicer/-/fd-slicer-1.0.1.tgz#8b5bcbd9ec327c5041bf9ab023fd6750f1177e65\"\n  dependencies:\n    pend \"~1.2.0\"\n\nfd-slicer@~1.1.0:\n  version \"1.1.0\"\n  resolved \"https://registry.yarnpkg.com/fd-slicer/-/fd-slicer-1.1.0.tgz#25c7c89cb1f9077f8891bbe61d8f390eae256f1e\"\n  dependencies:\n    pend \"~1.2.0\"\n\nfigures@^1.3.5:\n  version \"1.7.0\"\n  resolved \"https://registry.yarnpkg.com/figures/-/figures-1.7.0.tgz#cbe1e3affcf1cd44b80cadfed28dc793a9701d2e\"\n  dependencies:\n    escape-string-regexp \"^1.0.5\"\n    object-assign \"^4.1.0\"\n\nfile-type@^3.1.0:\n  version \"3.9.0\"\n  resolved \"https://registry.yarnpkg.com/file-type/-/file-type-3.9.0.tgz#257a078384d1db8087bc449d107d52a52672b9e9\"\n\nfilename-regex@^2.0.0:\n  version \"2.0.1\"\n  resolved \"https://registry.yarnpkg.com/filename-regex/-/filename-regex-2.0.1.tgz#c1c4b9bee3e09725ddb106b75c1e301fe2f18b26\"\n\nfilename-reserved-regex@^1.0.0:\n  version \"1.0.0\"\n  resolved \"https://registry.yarnpkg.com/filename-reserved-regex/-/filename-reserved-regex-1.0.0.tgz#e61cf805f0de1c984567d0386dc5df50ee5af7e4\"\n\nfilenamify@^1.0.1:\n  version \"1.2.1\"\n  resolved \"https://registry.yarnpkg.com/filenamify/-/filenamify-1.2.1.tgz#a9f2ffd11c503bed300015029272378f1f1365a5\"\n  dependencies:\n    filename-reserved-regex \"^1.0.0\"\n    strip-outer \"^1.0.0\"\n    trim-repeated \"^1.0.0\"\n\nfill-range@^2.1.0:\n  version \"2.2.4\"\n  resolved \"https://registry.yarnpkg.com/fill-range/-/fill-range-2.2.4.tgz#eb1e773abb056dcd8df2bfdf6af59b8b3a936565\"\n  dependencies:\n    is-number \"^2.1.0\"\n    isobject \"^2.0.0\"\n    randomatic \"^3.0.0\"\n    repeat-element \"^1.1.2\"\n    repeat-string \"^1.5.2\"\n\nfill-range@^4.0.0:\n  version \"4.0.0\"\n  resolved \"https://registry.yarnpkg.com/fill-range/-/fill-range-4.0.0.tgz#d544811d428f98eb06a63dc402d2403c328c38f7\"\n  dependencies:\n    extend-shallow \"^2.0.1\"\n    is-number \"^3.0.0\"\n    repeat-string \"^1.6.1\"\n    to-regex-range \"^2.1.0\"\n\nfinalhandler@1.1.0:\n  version \"1.1.0\"\n  resolved \"https://registry.yarnpkg.com/finalhandler/-/finalhandler-1.1.0.tgz#ce0b6855b45853e791b2fcc680046d88253dd7f5\"\n  dependencies:\n    debug \"2.6.9\"\n    encodeurl \"~1.0.1\"\n    escape-html \"~1.0.3\"\n    on-finished \"~2.3.0\"\n    parseurl \"~1.3.2\"\n    statuses \"~1.3.1\"\n    unpipe \"~1.0.0\"\n\nfind-cache-dir@^0.1.1:\n  version \"0.1.1\"\n  resolved \"https://registry.yarnpkg.com/find-cache-dir/-/find-cache-dir-0.1.1.tgz#c8defae57c8a52a8a784f9e31c57c742e993a0b9\"\n  dependencies:\n    commondir \"^1.0.1\"\n    mkdirp \"^0.5.1\"\n    pkg-dir \"^1.0.0\"\n\nfind-index@^0.1.1:\n  version \"0.1.1\"\n  resolved \"https://registry.yarnpkg.com/find-index/-/find-index-0.1.1.tgz#675d358b2ca3892d795a1ab47232f8b6e2e0dde4\"\n\nfind-up@^1.0.0:\n  version \"1.1.2\"\n  resolved \"https://registry.yarnpkg.com/find-up/-/find-up-1.1.2.tgz#6b2e9822b1a2ce0a60ab64d610eccad53cb24d0f\"\n  dependencies:\n    path-exists \"^2.0.0\"\n    pinkie-promise \"^2.0.0\"\n\nfind-up@^2.1.0:\n  version \"2.1.0\"\n  resolved \"https://registry.yarnpkg.com/find-up/-/find-up-2.1.0.tgz#45d1b7e506c717ddd482775a2b77920a3c0c57a7\"\n  dependencies:\n    locate-path \"^2.0.0\"\n\nfind-versions@^1.0.0:\n  version \"1.2.1\"\n  resolved \"https://registry.yarnpkg.com/find-versions/-/find-versions-1.2.1.tgz#cbde9f12e38575a0af1be1b9a2c5d5fd8f186b62\"\n  dependencies:\n    array-uniq \"^1.0.0\"\n    get-stdin \"^4.0.1\"\n    meow \"^3.5.0\"\n    semver-regex \"^1.0.0\"\n\nfindup-sync@^2.0.0:\n  version \"2.0.0\"\n  resolved \"https://registry.yarnpkg.com/findup-sync/-/findup-sync-2.0.0.tgz#9326b1488c22d1a6088650a86901b2d9a90a2cbc\"\n  dependencies:\n    detect-file \"^1.0.0\"\n    is-glob \"^3.1.0\"\n    micromatch \"^3.0.4\"\n    resolve-dir \"^1.0.1\"\n\nfined@^1.0.1:\n  version \"1.1.0\"\n  resolved \"https://registry.yarnpkg.com/fined/-/fined-1.1.0.tgz#b37dc844b76a2f5e7081e884f7c0ae344f153476\"\n  dependencies:\n    expand-tilde \"^2.0.2\"\n    is-plain-object \"^2.0.3\"\n    object.defaults \"^1.1.0\"\n    object.pick \"^1.2.0\"\n    parse-filepath \"^1.0.1\"\n\nfirst-chunk-stream@^1.0.0:\n  version \"1.0.0\"\n  resolved \"https://registry.yarnpkg.com/first-chunk-stream/-/first-chunk-stream-1.0.0.tgz#59bfb50cd905f60d7c394cd3d9acaab4e6ad934e\"\n\nflagged-respawn@^1.0.0:\n  version \"1.0.0\"\n  resolved \"https://registry.yarnpkg.com/flagged-respawn/-/flagged-respawn-1.0.0.tgz#4e79ae9b2eb38bf86b3bb56bf3e0a56aa5fcabd7\"\n\nflatten@^1.0.2:\n  version \"1.0.2\"\n  resolved \"https://registry.yarnpkg.com/flatten/-/flatten-1.0.2.tgz#dae46a9d78fbe25292258cc1e780a41d95c03782\"\n\nflush-write-stream@^1.0.2:\n  version \"1.0.3\"\n  resolved \"https://registry.yarnpkg.com/flush-write-stream/-/flush-write-stream-1.0.3.tgz#c5d586ef38af6097650b49bc41b55fabb19f35bd\"\n  dependencies:\n    inherits \"^2.0.1\"\n    readable-stream \"^2.0.4\"\n\nfollow-redirects@^1.2.5:\n  version \"1.5.2\"\n  resolved \"https://registry.yarnpkg.com/follow-redirects/-/follow-redirects-1.5.2.tgz#5a9d80e0165957e5ef0c1210678fc5c4acb9fb03\"\n  dependencies:\n    debug \"^3.1.0\"\n\nfor-each@^0.3.2:\n  version \"0.3.3\"\n  resolved \"https://registry.yarnpkg.com/for-each/-/for-each-0.3.3.tgz#69b447e88a0a5d32c3e7084f3f1710034b21376e\"\n  dependencies:\n    is-callable \"^1.1.3\"\n\nfor-in@^1.0.1, for-in@^1.0.2:\n  version \"1.0.2\"\n  resolved \"https://registry.yarnpkg.com/for-in/-/for-in-1.0.2.tgz#81068d295a8142ec0ac726c6e2200c30fb6d5e80\"\n\nfor-own@^0.1.4:\n  version \"0.1.5\"\n  resolved \"https://registry.yarnpkg.com/for-own/-/for-own-0.1.5.tgz#5265c681a4f294dabbf17c9509b6763aa84510ce\"\n  dependencies:\n    for-in \"^1.0.1\"\n\nfor-own@^1.0.0:\n  version \"1.0.0\"\n  resolved \"https://registry.yarnpkg.com/for-own/-/for-own-1.0.0.tgz#c63332f415cedc4b04dbfe70cf836494c53cb44b\"\n  dependencies:\n    for-in \"^1.0.1\"\n\nforeach@^2.0.5:\n  version \"2.0.5\"\n  resolved \"https://registry.yarnpkg.com/foreach/-/foreach-2.0.5.tgz#0bee005018aeb260d0a3af3ae658dd0136ec1b99\"\n\nforever-agent@~0.5.0:\n  version \"0.5.2\"\n  resolved \"https://registry.yarnpkg.com/forever-agent/-/forever-agent-0.5.2.tgz#6d0e09c4921f94a27f63d3b49c5feff1ea4c5130\"\n\nforever-agent@~0.6.1:\n  version \"0.6.1\"\n  resolved \"https://registry.yarnpkg.com/forever-agent/-/forever-agent-0.6.1.tgz#fbc71f0c41adeb37f96c577ad1ed42d8fdacca91\"\n\nfork-stream@^0.0.4:\n  version \"0.0.4\"\n  resolved \"https://registry.yarnpkg.com/fork-stream/-/fork-stream-0.0.4.tgz#db849fce77f6708a5f8f386ae533a0907b54ae70\"\n\nform-data@~0.1.0:\n  version \"0.1.4\"\n  resolved \"https://registry.yarnpkg.com/form-data/-/form-data-0.1.4.tgz#91abd788aba9702b1aabfa8bc01031a2ac9e3b12\"\n  dependencies:\n    async \"~0.9.0\"\n    combined-stream \"~0.0.4\"\n    mime \"~1.2.11\"\n\nform-data@~2.1.1:\n  version \"2.1.4\"\n  resolved \"https://registry.yarnpkg.com/form-data/-/form-data-2.1.4.tgz#33c183acf193276ecaa98143a69e94bfee1750d1\"\n  dependencies:\n    asynckit \"^0.4.0\"\n    combined-stream \"^1.0.5\"\n    mime-types \"^2.1.12\"\n\nform-data@~2.3.1:\n  version \"2.3.2\"\n  resolved \"https://registry.yarnpkg.com/form-data/-/form-data-2.3.2.tgz#4970498be604c20c005d4f5c23aecd21d6b49099\"\n  dependencies:\n    asynckit \"^0.4.0\"\n    combined-stream \"1.0.6\"\n    mime-types \"^2.1.12\"\n\nfragment-cache@^0.2.1:\n  version \"0.2.1\"\n  resolved \"https://registry.yarnpkg.com/fragment-cache/-/fragment-cache-0.2.1.tgz#4290fad27f13e89be7f33799c6bc5a0abfff0d19\"\n  dependencies:\n    map-cache \"^0.2.2\"\n\nfresh@0.5.2, fresh@^0.5.2:\n  version \"0.5.2\"\n  resolved \"https://registry.yarnpkg.com/fresh/-/fresh-0.5.2.tgz#3d8cadd90d976569fa835ab1f8e4b23a105605a7\"\n\nfs-constants@^1.0.0:\n  version \"1.0.0\"\n  resolved \"https://registry.yarnpkg.com/fs-constants/-/fs-constants-1.0.0.tgz#6be0de9be998ce16af8afc24497b9ee9b7ccd9ad\"\n\nfs-extra@3.0.1:\n  version \"3.0.1\"\n  resolved \"https://registry.yarnpkg.com/fs-extra/-/fs-extra-3.0.1.tgz#3794f378c58b342ea7dbbb23095109c4b3b62291\"\n  dependencies:\n    graceful-fs \"^4.1.2\"\n    jsonfile \"^3.0.0\"\n    universalify \"^0.1.0\"\n\nfs-extra@^1.0.0:\n  version \"1.0.0\"\n  resolved \"https://registry.yarnpkg.com/fs-extra/-/fs-extra-1.0.0.tgz#cd3ce5f7e7cb6145883fcae3191e9877f8587950\"\n  dependencies:\n    graceful-fs \"^4.1.2\"\n    jsonfile \"^2.1.0\"\n    klaw \"^1.0.0\"\n\nfs-minipass@^1.2.5:\n  version \"1.2.5\"\n  resolved \"https://registry.yarnpkg.com/fs-minipass/-/fs-minipass-1.2.5.tgz#06c277218454ec288df77ada54a03b8702aacb9d\"\n  dependencies:\n    minipass \"^2.2.1\"\n\nfs-mkdirp-stream@^1.0.0:\n  version \"1.0.0\"\n  resolved \"https://registry.yarnpkg.com/fs-mkdirp-stream/-/fs-mkdirp-stream-1.0.0.tgz#0b7815fc3201c6a69e14db98ce098c16935259eb\"\n  dependencies:\n    graceful-fs \"^4.1.11\"\n    through2 \"^2.0.3\"\n\nfs.realpath@^1.0.0:\n  version \"1.0.0\"\n  resolved \"https://registry.yarnpkg.com/fs.realpath/-/fs.realpath-1.0.0.tgz#1504ad2523158caa40db4a2787cb01411994ea4f\"\n\nfsevents@^1.0.0, fsevents@^1.2.2:\n  version \"1.2.4\"\n  resolved \"https://registry.yarnpkg.com/fsevents/-/fsevents-1.2.4.tgz#f41dcb1af2582af3692da36fc55cbd8e1041c426\"\n  dependencies:\n    nan \"^2.9.2\"\n    node-pre-gyp \"^0.10.0\"\n\nfsevents@^1.2.7:\n  version \"1.2.7\"\n  resolved \"https://registry.yarnpkg.com/fsevents/-/fsevents-1.2.7.tgz#4851b664a3783e52003b3c66eb0eee1074933aa4\"\n  dependencies:\n    nan \"^2.9.2\"\n    node-pre-gyp \"^0.10.0\"\n\nfstream@^1.0.0, fstream@^1.0.2:\n  version \"1.0.11\"\n  resolved \"https://registry.yarnpkg.com/fstream/-/fstream-1.0.11.tgz#5c1fb1f117477114f0632a0eb4b71b3cb0fd3171\"\n  dependencies:\n    graceful-fs \"^4.1.2\"\n    inherits \"~2.0.0\"\n    mkdirp \">=0.5 0\"\n    rimraf \"2\"\n\nftp-response-parser@^1.0.1:\n  version \"1.0.1\"\n  resolved \"https://registry.yarnpkg.com/ftp-response-parser/-/ftp-response-parser-1.0.1.tgz#3b9d33f8edd5fb8e4700b8f778c462e5b1581f89\"\n  dependencies:\n    readable-stream \"^1.0.31\"\n\nfunction-bind@^1.1.0, function-bind@^1.1.1:\n  version \"1.1.1\"\n  resolved \"https://registry.yarnpkg.com/function-bind/-/function-bind-1.1.1.tgz#a56899d3ea3c9bab874bb9773b7c5ede92f4895d\"\n\ngauge@~2.7.3:\n  version \"2.7.4\"\n  resolved \"https://registry.yarnpkg.com/gauge/-/gauge-2.7.4.tgz#2c03405c7538c39d7eb37b317022e325fb018bf7\"\n  dependencies:\n    aproba \"^1.0.3\"\n    console-control-strings \"^1.0.0\"\n    has-unicode \"^2.0.0\"\n    object-assign \"^4.1.0\"\n    signal-exit \"^3.0.0\"\n    string-width \"^1.0.1\"\n    strip-ansi \"^3.0.1\"\n    wide-align \"^1.1.0\"\n\ngaze@^0.5.1:\n  version \"0.5.2\"\n  resolved \"https://registry.yarnpkg.com/gaze/-/gaze-0.5.2.tgz#40b709537d24d1d45767db5a908689dfe69ac44f\"\n  dependencies:\n    globule \"~0.1.0\"\n\ngaze@^1.0.0:\n  version \"1.1.3\"\n  resolved \"https://registry.yarnpkg.com/gaze/-/gaze-1.1.3.tgz#c441733e13b927ac8c0ff0b4c3b033f28812924a\"\n  dependencies:\n    globule \"^1.0.0\"\n\nget-caller-file@^1.0.1:\n  version \"1.0.3\"\n  resolved \"https://registry.yarnpkg.com/get-caller-file/-/get-caller-file-1.0.3.tgz#f978fa4c90d1dfe7ff2d6beda2a515e713bdcf4a\"\n\nget-proxy@^1.0.1:\n  version \"1.1.0\"\n  resolved \"https://registry.yarnpkg.com/get-proxy/-/get-proxy-1.1.0.tgz#894854491bc591b0f147d7ae570f5c678b7256eb\"\n  dependencies:\n    rc \"^1.1.2\"\n\nget-stdin@^3.0.0:\n  version \"3.0.2\"\n  resolved \"https://registry.yarnpkg.com/get-stdin/-/get-stdin-3.0.2.tgz#c1ced24b9039b38ded85bdf161e57713b6dd4abe\"\n\nget-stdin@^4.0.1:\n  version \"4.0.1\"\n  resolved \"https://registry.yarnpkg.com/get-stdin/-/get-stdin-4.0.1.tgz#b968c6b0a04384324902e8bf1a5df32579a450fe\"\n\nget-stream@^3.0.0:\n  version \"3.0.0\"\n  resolved \"https://registry.yarnpkg.com/get-stream/-/get-stream-3.0.0.tgz#8e943d1358dc37555054ecbe2edb05aa174ede14\"\n\nget-value@^2.0.3, get-value@^2.0.6:\n  version \"2.0.6\"\n  resolved \"https://registry.yarnpkg.com/get-value/-/get-value-2.0.6.tgz#dc15ca1c672387ca76bd37ac0a395ba2042a2c28\"\n\ngetpass@^0.1.1:\n  version \"0.1.7\"\n  resolved \"https://registry.yarnpkg.com/getpass/-/getpass-0.1.7.tgz#5eff8e3e684d569ae4cb2b1282604e8ba62149fa\"\n  dependencies:\n    assert-plus \"^1.0.0\"\n\ngifsicle@^3.0.0:\n  version \"3.0.4\"\n  resolved \"https://registry.yarnpkg.com/gifsicle/-/gifsicle-3.0.4.tgz#f45cb5ed10165b665dc929e0e9328b6c821dfa3b\"\n  dependencies:\n    bin-build \"^2.0.0\"\n    bin-wrapper \"^3.0.0\"\n    logalot \"^2.0.0\"\n\nglob-base@^0.3.0:\n  version \"0.3.0\"\n  resolved \"https://registry.yarnpkg.com/glob-base/-/glob-base-0.3.0.tgz#dbb164f6221b1c0b1ccf82aea328b497df0ea3c4\"\n  dependencies:\n    glob-parent \"^2.0.0\"\n    is-glob \"^2.0.0\"\n\nglob-parent@^2.0.0:\n  version \"2.0.0\"\n  resolved \"https://registry.yarnpkg.com/glob-parent/-/glob-parent-2.0.0.tgz#81383d72db054fcccf5336daa902f182f6edbb28\"\n  dependencies:\n    is-glob \"^2.0.0\"\n\nglob-parent@^3.0.0, glob-parent@^3.1.0:\n  version \"3.1.0\"\n  resolved \"https://registry.yarnpkg.com/glob-parent/-/glob-parent-3.1.0.tgz#9e6af6299d8d3bd2bd40430832bd113df906c5ae\"\n  dependencies:\n    is-glob \"^3.1.0\"\n    path-dirname \"^1.0.0\"\n\nglob-stream@^3.1.5:\n  version \"3.1.18\"\n  resolved \"https://registry.yarnpkg.com/glob-stream/-/glob-stream-3.1.18.tgz#9170a5f12b790306fdfe598f313f8f7954fd143b\"\n  dependencies:\n    glob \"^4.3.1\"\n    glob2base \"^0.0.12\"\n    minimatch \"^2.0.1\"\n    ordered-read-streams \"^0.1.0\"\n    through2 \"^0.6.1\"\n    unique-stream \"^1.0.0\"\n\nglob-stream@^5.3.2:\n  version \"5.3.5\"\n  resolved \"https://registry.yarnpkg.com/glob-stream/-/glob-stream-5.3.5.tgz#a55665a9a8ccdc41915a87c701e32d4e016fad22\"\n  dependencies:\n    extend \"^3.0.0\"\n    glob \"^5.0.3\"\n    glob-parent \"^3.0.0\"\n    micromatch \"^2.3.7\"\n    ordered-read-streams \"^0.3.0\"\n    through2 \"^0.6.0\"\n    to-absolute-glob \"^0.1.1\"\n    unique-stream \"^2.0.2\"\n\nglob-stream@^6.1.0:\n  version \"6.1.0\"\n  resolved \"https://registry.yarnpkg.com/glob-stream/-/glob-stream-6.1.0.tgz#7045c99413b3eb94888d83ab46d0b404cc7bdde4\"\n  dependencies:\n    extend \"^3.0.0\"\n    glob \"^7.1.1\"\n    glob-parent \"^3.1.0\"\n    is-negated-glob \"^1.0.0\"\n    ordered-read-streams \"^1.0.0\"\n    pumpify \"^1.3.5\"\n    readable-stream \"^2.1.5\"\n    remove-trailing-separator \"^1.0.1\"\n    to-absolute-glob \"^2.0.0\"\n    unique-stream \"^2.0.2\"\n\nglob-watcher@^0.0.6:\n  version \"0.0.6\"\n  resolved \"https://registry.yarnpkg.com/glob-watcher/-/glob-watcher-0.0.6.tgz#b95b4a8df74b39c83298b0c05c978b4d9a3b710b\"\n  dependencies:\n    gaze \"^0.5.1\"\n\nglob-watcher@^5.0.0:\n  version \"5.0.3\"\n  resolved \"https://registry.yarnpkg.com/glob-watcher/-/glob-watcher-5.0.3.tgz#88a8abf1c4d131eb93928994bc4a593c2e5dd626\"\n  dependencies:\n    anymatch \"^2.0.0\"\n    async-done \"^1.2.0\"\n    chokidar \"^2.0.0\"\n    is-negated-glob \"^1.0.0\"\n    just-debounce \"^1.0.0\"\n    object.defaults \"^1.1.0\"\n\nglob2base@^0.0.12:\n  version \"0.0.12\"\n  resolved \"https://registry.yarnpkg.com/glob2base/-/glob2base-0.0.12.tgz#9d419b3e28f12e83a362164a277055922c9c0d56\"\n  dependencies:\n    find-index \"^0.1.1\"\n\nglob@3.2.11:\n  version \"3.2.11\"\n  resolved \"https://registry.yarnpkg.com/glob/-/glob-3.2.11.tgz#4a973f635b9190f715d10987d5c00fd2815ebe3d\"\n  dependencies:\n    inherits \"2\"\n    minimatch \"0.3\"\n\nglob@^4.3.1:\n  version \"4.5.3\"\n  resolved \"https://registry.yarnpkg.com/glob/-/glob-4.5.3.tgz#c6cb73d3226c1efef04de3c56d012f03377ee15f\"\n  dependencies:\n    inflight \"^1.0.4\"\n    inherits \"2\"\n    minimatch \"^2.0.1\"\n    once \"^1.3.0\"\n\nglob@^5.0.3:\n  version \"5.0.15\"\n  resolved \"https://registry.yarnpkg.com/glob/-/glob-5.0.15.tgz#1bc936b9e02f4a603fcc222ecf7633d30b8b93b1\"\n  dependencies:\n    inflight \"^1.0.4\"\n    inherits \"2\"\n    minimatch \"2 || 3\"\n    once \"^1.3.0\"\n    path-is-absolute \"^1.0.0\"\n\nglob@^7.0.0, glob@^7.0.3, glob@^7.0.5, glob@^7.1.1, glob@^7.1.2, glob@~7.1.1:\n  version \"7.1.2\"\n  resolved \"https://registry.yarnpkg.com/glob/-/glob-7.1.2.tgz#c19c9df9a028702d678612384a6552404c636d15\"\n  dependencies:\n    fs.realpath \"^1.0.0\"\n    inflight \"^1.0.4\"\n    inherits \"2\"\n    minimatch \"^3.0.4\"\n    once \"^1.3.0\"\n    path-is-absolute \"^1.0.0\"\n\nglob@~3.1.21:\n  version \"3.1.21\"\n  resolved \"https://registry.yarnpkg.com/glob/-/glob-3.1.21.tgz#d29e0a055dea5138f4d07ed40e8982e83c2066cd\"\n  dependencies:\n    graceful-fs \"~1.2.0\"\n    inherits \"1\"\n    minimatch \"~0.2.11\"\n\nglobal-modules@^1.0.0:\n  version \"1.0.0\"\n  resolved \"https://registry.yarnpkg.com/global-modules/-/global-modules-1.0.0.tgz#6d770f0eb523ac78164d72b5e71a8877265cc3ea\"\n  dependencies:\n    global-prefix \"^1.0.1\"\n    is-windows \"^1.0.1\"\n    resolve-dir \"^1.0.0\"\n\nglobal-prefix@^1.0.1:\n  version \"1.0.2\"\n  resolved \"https://registry.yarnpkg.com/global-prefix/-/global-prefix-1.0.2.tgz#dbf743c6c14992593c655568cb66ed32c0122ebe\"\n  dependencies:\n    expand-tilde \"^2.0.2\"\n    homedir-polyfill \"^1.0.1\"\n    ini \"^1.3.4\"\n    is-windows \"^1.0.1\"\n    which \"^1.2.14\"\n\nglobal@~4.3.0:\n  version \"4.3.2\"\n  resolved \"https://registry.yarnpkg.com/global/-/global-4.3.2.tgz#e76989268a6c74c38908b1305b10fc0e394e9d0f\"\n  dependencies:\n    min-document \"^2.19.0\"\n    process \"~0.5.1\"\n\nglobals@^9.18.0:\n  version \"9.18.0\"\n  resolved \"https://registry.yarnpkg.com/globals/-/globals-9.18.0.tgz#aa3896b3e69b487f17e31ed2143d69a8e30c2d8a\"\n\nglobby@^5.0.0:\n  version \"5.0.0\"\n  resolved \"https://registry.yarnpkg.com/globby/-/globby-5.0.0.tgz#ebd84667ca0dbb330b99bcfc68eac2bc54370e0d\"\n  dependencies:\n    array-union \"^1.0.1\"\n    arrify \"^1.0.0\"\n    glob \"^7.0.3\"\n    object-assign \"^4.0.1\"\n    pify \"^2.0.0\"\n    pinkie-promise \"^2.0.0\"\n\nglobule@^1.0.0:\n  version \"1.2.1\"\n  resolved \"https://registry.yarnpkg.com/globule/-/globule-1.2.1.tgz#5dffb1b191f22d20797a9369b49eab4e9839696d\"\n  dependencies:\n    glob \"~7.1.1\"\n    lodash \"~4.17.10\"\n    minimatch \"~3.0.2\"\n\nglobule@~0.1.0:\n  version \"0.1.0\"\n  resolved \"https://registry.yarnpkg.com/globule/-/globule-0.1.0.tgz#d9c8edde1da79d125a151b79533b978676346ae5\"\n  dependencies:\n    glob \"~3.1.21\"\n    lodash \"~1.0.1\"\n    minimatch \"~0.2.11\"\n\nglogg@^1.0.0:\n  version \"1.0.1\"\n  resolved \"https://registry.yarnpkg.com/glogg/-/glogg-1.0.1.tgz#dcf758e44789cc3f3d32c1f3562a3676e6a34810\"\n  dependencies:\n    sparkles \"^1.0.0\"\n\ngot@^5.0.0:\n  version \"5.7.1\"\n  resolved \"https://registry.yarnpkg.com/got/-/got-5.7.1.tgz#5f81635a61e4a6589f180569ea4e381680a51f35\"\n  dependencies:\n    create-error-class \"^3.0.1\"\n    duplexer2 \"^0.1.4\"\n    is-redirect \"^1.0.0\"\n    is-retry-allowed \"^1.0.0\"\n    is-stream \"^1.0.0\"\n    lowercase-keys \"^1.0.0\"\n    node-status-codes \"^1.0.0\"\n    object-assign \"^4.0.1\"\n    parse-json \"^2.1.0\"\n    pinkie-promise \"^2.0.0\"\n    read-all-stream \"^3.0.0\"\n    readable-stream \"^2.0.5\"\n    timed-out \"^3.0.0\"\n    unzip-response \"^1.0.2\"\n    url-parse-lax \"^1.0.0\"\n\ngraceful-fs@^3.0.0:\n  version \"3.0.11\"\n  resolved \"https://registry.yarnpkg.com/graceful-fs/-/graceful-fs-3.0.11.tgz#7613c778a1afea62f25c630a086d7f3acbbdd818\"\n  dependencies:\n    natives \"^1.1.0\"\n\ngraceful-fs@^4.0.0, graceful-fs@^4.1.11, graceful-fs@^4.1.2, graceful-fs@^4.1.6, graceful-fs@^4.1.9:\n  version \"4.1.11\"\n  resolved \"https://registry.yarnpkg.com/graceful-fs/-/graceful-fs-4.1.11.tgz#0e8bdfe4d1ddb8854d64e04ea7c00e2a026e5658\"\n\ngraceful-fs@~1.2.0:\n  version \"1.2.3\"\n  resolved \"https://registry.yarnpkg.com/graceful-fs/-/graceful-fs-1.2.3.tgz#15a4806a57547cb2d2dbf27f42e89a8c3451b364\"\n\n\"graceful-readlink@>= 1.0.0\":\n  version \"1.0.1\"\n  resolved \"https://registry.yarnpkg.com/graceful-readlink/-/graceful-readlink-1.0.1.tgz#4cafad76bc62f02fa039b2f94e9a3dd3a391a725\"\n\ngrowl@1.9.2:\n  version \"1.9.2\"\n  resolved \"https://registry.yarnpkg.com/growl/-/growl-1.9.2.tgz#0ea7743715db8d8de2c5ede1775e1b45ac85c02f\"\n\ngulp-babel@^6.1.2:\n  version \"6.1.3\"\n  resolved \"https://registry.yarnpkg.com/gulp-babel/-/gulp-babel-6.1.3.tgz#5aad8acb0db6b7f2f0be19eeee9528f2064df631\"\n  dependencies:\n    babel-core \"^6.23.1\"\n    object-assign \"^4.0.1\"\n    plugin-error \"^1.0.1\"\n    replace-ext \"0.0.1\"\n    through2 \"^2.0.0\"\n    vinyl-sourcemaps-apply \"^0.2.0\"\n\ngulp-cli@^2.0.0:\n  version \"2.0.1\"\n  resolved \"https://registry.yarnpkg.com/gulp-cli/-/gulp-cli-2.0.1.tgz#7847e220cb3662f2be8a6d572bf14e17be5a994b\"\n  dependencies:\n    ansi-colors \"^1.0.1\"\n    archy \"^1.0.0\"\n    array-sort \"^1.0.0\"\n    color-support \"^1.1.3\"\n    concat-stream \"^1.6.0\"\n    copy-props \"^2.0.1\"\n    fancy-log \"^1.3.2\"\n    gulplog \"^1.0.0\"\n    interpret \"^1.1.0\"\n    isobject \"^3.0.1\"\n    liftoff \"^2.5.0\"\n    matchdep \"^2.0.0\"\n    mute-stdout \"^1.0.0\"\n    pretty-hrtime \"^1.0.0\"\n    replace-homedir \"^1.0.0\"\n    semver-greatest-satisfied-range \"^1.1.0\"\n    v8flags \"^3.0.1\"\n    yargs \"^7.1.0\"\n\ngulp-concat@~2.6.1:\n  version \"2.6.1\"\n  resolved \"https://registry.yarnpkg.com/gulp-concat/-/gulp-concat-2.6.1.tgz#633d16c95d88504628ad02665663cee5a4793353\"\n  dependencies:\n    concat-with-sourcemaps \"^1.0.0\"\n    through2 \"^2.0.0\"\n    vinyl \"^2.0.0\"\n\ngulp-cssnano@^2.1.1:\n  version \"2.1.3\"\n  resolved \"https://registry.yarnpkg.com/gulp-cssnano/-/gulp-cssnano-2.1.3.tgz#02007e2817af09b3688482b430ad7db807aebf72\"\n  dependencies:\n    buffer-from \"^1.0.0\"\n    cssnano \"^3.0.0\"\n    object-assign \"^4.0.1\"\n    plugin-error \"^1.0.1\"\n    vinyl-sourcemaps-apply \"^0.2.1\"\n\ngulp-decompress@^1.2.0:\n  version \"1.2.0\"\n  resolved \"https://registry.yarnpkg.com/gulp-decompress/-/gulp-decompress-1.2.0.tgz#8eeb65a5e015f8ed8532cafe28454960626f0dc7\"\n  dependencies:\n    archive-type \"^3.0.0\"\n    decompress \"^3.0.0\"\n    gulp-util \"^3.0.1\"\n    readable-stream \"^2.0.2\"\n\ngulp-ejs@^2.1.1:\n  version \"2.3.0\"\n  resolved \"https://registry.yarnpkg.com/gulp-ejs/-/gulp-ejs-2.3.0.tgz#648d7087b80c372e9586254665d10dfe300ba92f\"\n  dependencies:\n    ejs \"2.5.5\"\n    gulp-util \"3.0.7\"\n    object-assign \"^4.1.0\"\n    through2 \"2.0.3\"\n\ngulp-ftp@^1.1.0:\n  version \"1.1.0\"\n  resolved \"https://registry.yarnpkg.com/gulp-ftp/-/gulp-ftp-1.1.0.tgz#114887c755d5554de08d4fd5ab81ab7cfbad7763\"\n  dependencies:\n    chalk \"^1.0.0\"\n    gulp-util \"^3.0.0\"\n    jsftp \"^1.3.0\"\n    jsftp-mkdirp \"^1.0.0\"\n    object-assign \"^4.0.1\"\n    parents \"^1.0.0\"\n    plur \"^2.1.0\"\n    through2 \"^2.0.0\"\n\ngulp-if@^2.0.0:\n  version \"2.0.2\"\n  resolved \"https://registry.yarnpkg.com/gulp-if/-/gulp-if-2.0.2.tgz#a497b7e7573005041caa2bc8b7dda3c80444d629\"\n  dependencies:\n    gulp-match \"^1.0.3\"\n    ternary-stream \"^2.0.1\"\n    through2 \"^2.0.1\"\n\ngulp-imagemin@^2.4.0:\n  version \"2.4.0\"\n  resolved \"https://registry.yarnpkg.com/gulp-imagemin/-/gulp-imagemin-2.4.0.tgz#f85948a77af532b4115dc9fbfac04af863a758ba\"\n  dependencies:\n    chalk \"^1.0.0\"\n    gulp-util \"^3.0.0\"\n    imagemin \"^4.0.0\"\n    object-assign \"^4.0.1\"\n    plur \"^2.0.0\"\n    pretty-bytes \"^2.0.1\"\n    through2-concurrent \"^1.1.0\"\n\ngulp-lazyimagecss@^2.0.0:\n  version \"2.0.8\"\n  resolved \"https://registry.yarnpkg.com/gulp-lazyimagecss/-/gulp-lazyimagecss-2.0.8.tgz#f9aaf508ccc9782a638af890eb971edc0e36c7f2\"\n  dependencies:\n    async \"^1.5.0\"\n    css \"^2.2.1\"\n    lodash \"^3.10.1\"\n    through2 \"^2.0.0\"\n    vinyl \"^1.1.0\"\n\ngulp-less@^3.0.5:\n  version \"3.5.0\"\n  resolved \"https://registry.yarnpkg.com/gulp-less/-/gulp-less-3.5.0.tgz#8014f469ddfc6544d7dda50098def0371bbb4f78\"\n  dependencies:\n    accord \"^0.28.0\"\n    less \"2.6.x || ^2.7.1\"\n    object-assign \"^4.0.1\"\n    plugin-error \"^0.1.2\"\n    replace-ext \"^1.0.0\"\n    through2 \"^2.0.0\"\n    vinyl-sourcemaps-apply \"^0.2.0\"\n\ngulp-match@^1.0.3:\n  version \"1.0.3\"\n  resolved \"https://registry.yarnpkg.com/gulp-match/-/gulp-match-1.0.3.tgz#91c7c0d7f29becd6606d57d80a7f8776a87aba8e\"\n  dependencies:\n    minimatch \"^3.0.3\"\n\ngulp-postcss@^6.0.1:\n  version \"6.4.0\"\n  resolved \"https://registry.yarnpkg.com/gulp-postcss/-/gulp-postcss-6.4.0.tgz#78a32e3c87aa6cdcec5ae1c905e196d478e8c5d5\"\n  dependencies:\n    gulp-util \"^3.0.8\"\n    postcss \"^5.2.12\"\n    postcss-load-config \"^1.2.0\"\n    vinyl-sourcemaps-apply \"^0.2.1\"\n\ngulp-posthtml@^1.5.2:\n  version \"1.5.2\"\n  resolved \"https://registry.yarnpkg.com/gulp-posthtml/-/gulp-posthtml-1.5.2.tgz#5e33b75bcfde51c39ce7d29e70679835592efe2d\"\n  dependencies:\n    gulp-util \"^3.0.6\"\n    posthtml \"^0.8.0\"\n    through2 \"^2.0.0\"\n\ngulp-rename@^1.2.0, gulp-rename@^1.2.2:\n  version \"1.4.0\"\n  resolved \"https://registry.yarnpkg.com/gulp-rename/-/gulp-rename-1.4.0.tgz#de1c718e7c4095ae861f7296ef4f3248648240bd\"\n\ngulp-replace@^0.5.4:\n  version \"0.5.4\"\n  resolved \"https://registry.yarnpkg.com/gulp-replace/-/gulp-replace-0.5.4.tgz#69a67914bbd13c562bff14f504a403796aa0daa9\"\n  dependencies:\n    istextorbinary \"1.0.2\"\n    readable-stream \"^2.0.1\"\n    replacestream \"^4.0.0\"\n\ngulp-rev-all@^1.0.0:\n  version \"1.0.0\"\n  resolved \"https://registry.yarnpkg.com/gulp-rev-all/-/gulp-rev-all-1.0.0.tgz#365105b1ee7c3d1bf543bdafb4bf04e07d793045\"\n  dependencies:\n    chalk \"^2.4.1\"\n    fancy-log \"^1.3.2\"\n    isbinaryfile \"^3.0.2\"\n    merge \"^1.2.0\"\n    plugin-error \"^1.0.1\"\n    through2 \"^2.0.3\"\n    vinyl \"^2.1.0\"\n\ngulp-rev-delete-original@^0.1.0:\n  version \"0.1.0\"\n  resolved \"https://registry.yarnpkg.com/gulp-rev-delete-original/-/gulp-rev-delete-original-0.1.0.tgz#84577ddd4d571384a73e21607eecd80f658c5647\"\n  dependencies:\n    rimraf \"^2.3.4\"\n    through2 \"^0.6.5\"\n\ngulp-sass@^2.3.2:\n  version \"2.3.2\"\n  resolved \"https://registry.yarnpkg.com/gulp-sass/-/gulp-sass-2.3.2.tgz#82b7ab90fe902cdc34c04f180d92f2c34902dd52\"\n  dependencies:\n    gulp-util \"^3.0\"\n    lodash.clonedeep \"^4.3.2\"\n    node-sass \"^3.4.2\"\n    through2 \"^2.0.0\"\n    vinyl-sourcemaps-apply \"^0.2.0\"\n\ngulp-sftp@^0.1.4:\n  version \"0.1.5\"\n  resolved \"https://registry.yarnpkg.com/gulp-sftp/-/gulp-sftp-0.1.5.tgz#57afec28b23823465d9ac44deba2f02de8dc5c70\"\n  dependencies:\n    async \"~0.9.0\"\n    gulp-util \"~3.0.0\"\n    object-assign \"~0.3.1\"\n    parents \"~1.0.0\"\n    ssh2 \"~0.3.3\"\n    through2 \"~0.4.2\"\n\ngulp-sourcemaps@1.6.0:\n  version \"1.6.0\"\n  resolved \"https://registry.yarnpkg.com/gulp-sourcemaps/-/gulp-sourcemaps-1.6.0.tgz#b86ff349d801ceb56e1d9e7dc7bbcb4b7dee600c\"\n  dependencies:\n    convert-source-map \"^1.1.1\"\n    graceful-fs \"^4.1.2\"\n    strip-bom \"^2.0.0\"\n    through2 \"^2.0.0\"\n    vinyl \"^1.0.0\"\n\ngulp-svg-inline@^1.0.1:\n  version \"1.0.1\"\n  resolved \"https://registry.yarnpkg.com/gulp-svg-inline/-/gulp-svg-inline-1.0.1.tgz#8ac781c12287db457a982be3a159f31a8d12d24e\"\n  dependencies:\n    async \"~0.2.10\"\n    buffers \"~0.1.1\"\n    extend \"~1.2.1\"\n    mime \"~1.2.11\"\n    request \"~2.33.0\"\n    through2 \"~0.4.1\"\n\ngulp-svg-sprite@^1.3.6:\n  version \"1.4.0\"\n  resolved \"https://registry.yarnpkg.com/gulp-svg-sprite/-/gulp-svg-sprite-1.4.0.tgz#d942ba508b128050e3227f10be8f58c2ee0243bd\"\n  dependencies:\n    plugin-error \"^1.0.1\"\n    svg-sprite \"~1.4.0\"\n    through2 \"^2.0.3\"\n\ngulp-svgmin@^1.2.3:\n  version \"1.2.4\"\n  resolved \"https://registry.yarnpkg.com/gulp-svgmin/-/gulp-svgmin-1.2.4.tgz#a4aa9e2615cf1105ef555aea86e86296cc20e273\"\n  dependencies:\n    gulp-util \"^3.0.4\"\n    svgo \"^0.7.0\"\n\ngulp-tmtsprite@^0.0.23:\n  version \"0.0.23\"\n  resolved \"https://registry.yarnpkg.com/gulp-tmtsprite/-/gulp-tmtsprite-0.0.23.tgz#9909ebec94c418fb9e8b0ae056fdb257ac12f553\"\n  dependencies:\n    async \"^2.6.1\"\n    color \"^3.0.0\"\n    jimp \"^0.2.28\"\n    layout \"^2.2.0\"\n    lodash \"^4.17.10\"\n    through2 \"^2.0.3\"\n    vinyl \"^2.2.0\"\n\ngulp-uglify@^1.5.3:\n  version \"1.5.4\"\n  resolved \"https://registry.yarnpkg.com/gulp-uglify/-/gulp-uglify-1.5.4.tgz#524788d87666d09f9d0c21fb2177f90039a658c9\"\n  dependencies:\n    deap \"^1.0.0\"\n    fancy-log \"^1.0.0\"\n    gulp-util \"^3.0.0\"\n    isobject \"^2.0.0\"\n    through2 \"^2.0.0\"\n    uglify-js \"2.6.4\"\n    uglify-save-license \"^0.4.1\"\n    vinyl-sourcemaps-apply \"^0.2.0\"\n\ngulp-usemin@^0.3.23:\n  version \"0.3.29\"\n  resolved \"https://registry.yarnpkg.com/gulp-usemin/-/gulp-usemin-0.3.29.tgz#f6846dc2903ff094b813c9edcc84c6c01761802e\"\n  dependencies:\n    glob \"~7.1.1\"\n    gulp-concat \"~2.6.1\"\n    plugin-error \"~1.0.1\"\n    through2 \"~2.0.3\"\n    vinyl \"~2.1.0\"\n\ngulp-util@3.0.7:\n  version \"3.0.7\"\n  resolved \"https://registry.yarnpkg.com/gulp-util/-/gulp-util-3.0.7.tgz#78925c4b8f8b49005ac01a011c557e6218941cbb\"\n  dependencies:\n    array-differ \"^1.0.0\"\n    array-uniq \"^1.0.2\"\n    beeper \"^1.0.0\"\n    chalk \"^1.0.0\"\n    dateformat \"^1.0.11\"\n    fancy-log \"^1.1.0\"\n    gulplog \"^1.0.0\"\n    has-gulplog \"^0.1.0\"\n    lodash._reescape \"^3.0.0\"\n    lodash._reevaluate \"^3.0.0\"\n    lodash._reinterpolate \"^3.0.0\"\n    lodash.template \"^3.0.0\"\n    minimist \"^1.1.0\"\n    multipipe \"^0.1.2\"\n    object-assign \"^3.0.0\"\n    replace-ext \"0.0.1\"\n    through2 \"^2.0.0\"\n    vinyl \"^0.5.0\"\n\ngulp-util@^3.0, gulp-util@^3.0.0, gulp-util@^3.0.1, gulp-util@^3.0.4, gulp-util@^3.0.6, gulp-util@^3.0.7, gulp-util@^3.0.8, gulp-util@~3.0.0:\n  version \"3.0.8\"\n  resolved \"https://registry.yarnpkg.com/gulp-util/-/gulp-util-3.0.8.tgz#0054e1e744502e27c04c187c3ecc505dd54bbb4f\"\n  dependencies:\n    array-differ \"^1.0.0\"\n    array-uniq \"^1.0.2\"\n    beeper \"^1.0.0\"\n    chalk \"^1.0.0\"\n    dateformat \"^2.0.0\"\n    fancy-log \"^1.1.0\"\n    gulplog \"^1.0.0\"\n    has-gulplog \"^0.1.0\"\n    lodash._reescape \"^3.0.0\"\n    lodash._reevaluate \"^3.0.0\"\n    lodash._reinterpolate \"^3.0.0\"\n    lodash.template \"^3.0.0\"\n    minimist \"^1.1.0\"\n    multipipe \"^0.1.2\"\n    object-assign \"^3.0.0\"\n    replace-ext \"0.0.1\"\n    through2 \"^2.0.0\"\n    vinyl \"^0.5.0\"\n\ngulp-webp@^2.3.0:\n  version \"2.3.0\"\n  resolved \"https://registry.yarnpkg.com/gulp-webp/-/gulp-webp-2.3.0.tgz#c5137fa207525d19ed9cf5d0c4808996072c2ed1\"\n  dependencies:\n    gulp-util \"^3.0.0\"\n    imagemin-webp \"^3.0.1\"\n    modify-error-event \"^1.0.0\"\n\ngulp-zip@^3.2.0:\n  version \"3.2.0\"\n  resolved \"https://registry.yarnpkg.com/gulp-zip/-/gulp-zip-3.2.0.tgz#ebd198dae6dc2d5f44d814569c8ec42118a93ef9\"\n  dependencies:\n    chalk \"^1.0.0\"\n    concat-stream \"^1.4.7\"\n    gulp-util \"^3.0.0\"\n    through2 \"^2.0.1\"\n    yazl \"^2.1.0\"\n\ngulp@^4.0.0:\n  version \"4.0.0\"\n  resolved \"https://registry.yarnpkg.com/gulp/-/gulp-4.0.0.tgz#95766c601dade4a77ed3e7b2b6dc03881b596366\"\n  dependencies:\n    glob-watcher \"^5.0.0\"\n    gulp-cli \"^2.0.0\"\n    undertaker \"^1.0.0\"\n    vinyl-fs \"^3.0.0\"\n\ngulplog@^1.0.0:\n  version \"1.0.0\"\n  resolved \"https://registry.yarnpkg.com/gulplog/-/gulplog-1.0.0.tgz#e28c4d45d05ecbbed818363ce8f9c5926229ffe5\"\n  dependencies:\n    glogg \"^1.0.0\"\n\nhar-schema@^1.0.5:\n  version \"1.0.5\"\n  resolved \"https://registry.yarnpkg.com/har-schema/-/har-schema-1.0.5.tgz#d263135f43307c02c602afc8fe95970c0151369e\"\n\nhar-schema@^2.0.0:\n  version \"2.0.0\"\n  resolved \"https://registry.yarnpkg.com/har-schema/-/har-schema-2.0.0.tgz#a94c2224ebcac04782a0d9035521f24735b7ec92\"\n\nhar-validator@~4.2.1:\n  version \"4.2.1\"\n  resolved \"https://registry.yarnpkg.com/har-validator/-/har-validator-4.2.1.tgz#33481d0f1bbff600dd203d75812a6a5fba002e2a\"\n  dependencies:\n    ajv \"^4.9.1\"\n    har-schema \"^1.0.5\"\n\nhar-validator@~5.0.3:\n  version \"5.0.3\"\n  resolved \"https://registry.yarnpkg.com/har-validator/-/har-validator-5.0.3.tgz#ba402c266194f15956ef15e0fcf242993f6a7dfd\"\n  dependencies:\n    ajv \"^5.1.0\"\n    har-schema \"^2.0.0\"\n\nhas-ansi@^2.0.0:\n  version \"2.0.0\"\n  resolved \"https://registry.yarnpkg.com/has-ansi/-/has-ansi-2.0.0.tgz#34f5049ce1ecdf2b0649af3ef24e45ed35416d91\"\n  dependencies:\n    ansi-regex \"^2.0.0\"\n\nhas-binary2@~1.0.2:\n  version \"1.0.3\"\n  resolved \"https://registry.yarnpkg.com/has-binary2/-/has-binary2-1.0.3.tgz#7776ac627f3ea77250cfc332dab7ddf5e4f5d11d\"\n  dependencies:\n    isarray \"2.0.1\"\n\nhas-cors@1.1.0:\n  version \"1.1.0\"\n  resolved \"https://registry.yarnpkg.com/has-cors/-/has-cors-1.1.0.tgz#5e474793f7ea9843d1bb99c23eef49ff126fff39\"\n\nhas-flag@^1.0.0:\n  version \"1.0.0\"\n  resolved \"https://registry.yarnpkg.com/has-flag/-/has-flag-1.0.0.tgz#9d9e793165ce017a00f00418c43f942a7b1d11fa\"\n\nhas-flag@^3.0.0:\n  version \"3.0.0\"\n  resolved \"https://registry.yarnpkg.com/has-flag/-/has-flag-3.0.0.tgz#b5d454dc2199ae225699f3467e5a07f3b955bafd\"\n\nhas-gulplog@^0.1.0:\n  version \"0.1.0\"\n  resolved \"https://registry.yarnpkg.com/has-gulplog/-/has-gulplog-0.1.0.tgz#6414c82913697da51590397dafb12f22967811ce\"\n  dependencies:\n    sparkles \"^1.0.0\"\n\nhas-symbols@^1.0.0:\n  version \"1.0.0\"\n  resolved \"https://registry.yarnpkg.com/has-symbols/-/has-symbols-1.0.0.tgz#ba1a8f1af2a0fc39650f5c850367704122063b44\"\n\nhas-unicode@^2.0.0:\n  version \"2.0.1\"\n  resolved \"https://registry.yarnpkg.com/has-unicode/-/has-unicode-2.0.1.tgz#e0e6fe6a28cf51138855e086d1691e771de2a8b9\"\n\nhas-value@^0.3.1:\n  version \"0.3.1\"\n  resolved \"https://registry.yarnpkg.com/has-value/-/has-value-0.3.1.tgz#7b1f58bada62ca827ec0a2078025654845995e1f\"\n  dependencies:\n    get-value \"^2.0.3\"\n    has-values \"^0.1.4\"\n    isobject \"^2.0.0\"\n\nhas-value@^1.0.0:\n  version \"1.0.0\"\n  resolved \"https://registry.yarnpkg.com/has-value/-/has-value-1.0.0.tgz#18b281da585b1c5c51def24c930ed29a0be6b177\"\n  dependencies:\n    get-value \"^2.0.6\"\n    has-values \"^1.0.0\"\n    isobject \"^3.0.0\"\n\nhas-values@^0.1.4:\n  version \"0.1.4\"\n  resolved \"https://registry.yarnpkg.com/has-values/-/has-values-0.1.4.tgz#6d61de95d91dfca9b9a02089ad384bff8f62b771\"\n\nhas-values@^1.0.0:\n  version \"1.0.0\"\n  resolved \"https://registry.yarnpkg.com/has-values/-/has-values-1.0.0.tgz#95b0b63fec2146619a6fe57fe75628d5a39efe4f\"\n  dependencies:\n    is-number \"^3.0.0\"\n    kind-of \"^4.0.0\"\n\nhas@^1.0.1:\n  version \"1.0.3\"\n  resolved \"https://registry.yarnpkg.com/has/-/has-1.0.3.tgz#722d7cbfc1f6aa8241f16dd814e011e1f41e8796\"\n  dependencies:\n    function-bind \"^1.1.1\"\n\nhash-base@^3.0.0:\n  version \"3.0.4\"\n  resolved \"https://registry.yarnpkg.com/hash-base/-/hash-base-3.0.4.tgz#5fc8686847ecd73499403319a6b0a3f3f6ae4918\"\n  dependencies:\n    inherits \"^2.0.1\"\n    safe-buffer \"^5.0.1\"\n\nhash.js@^1.0.0, hash.js@^1.0.3:\n  version \"1.1.5\"\n  resolved \"https://registry.yarnpkg.com/hash.js/-/hash.js-1.1.5.tgz#e38ab4b85dfb1e0c40fe9265c0e9b54854c23812\"\n  dependencies:\n    inherits \"^2.0.3\"\n    minimalistic-assert \"^1.0.1\"\n\nhasha@^2.2.0:\n  version \"2.2.0\"\n  resolved \"https://registry.yarnpkg.com/hasha/-/hasha-2.2.0.tgz#78d7cbfc1e6d66303fe79837365984517b2f6ee1\"\n  dependencies:\n    is-stream \"^1.0.1\"\n    pinkie-promise \"^2.0.0\"\n\nhawk@~1.0.0:\n  version \"1.0.0\"\n  resolved \"https://registry.yarnpkg.com/hawk/-/hawk-1.0.0.tgz#b90bb169807285411da7ffcb8dd2598502d3b52d\"\n  dependencies:\n    boom \"0.4.x\"\n    cryptiles \"0.2.x\"\n    hoek \"0.9.x\"\n    sntp \"0.2.x\"\n\nhawk@~3.1.3:\n  version \"3.1.3\"\n  resolved \"https://registry.yarnpkg.com/hawk/-/hawk-3.1.3.tgz#078444bd7c1640b0fe540d2c9b73d59678e8e1c4\"\n  dependencies:\n    boom \"2.x.x\"\n    cryptiles \"2.x.x\"\n    hoek \"2.x.x\"\n    sntp \"1.x.x\"\n\nhmac-drbg@^1.0.0:\n  version \"1.0.1\"\n  resolved \"https://registry.yarnpkg.com/hmac-drbg/-/hmac-drbg-1.0.1.tgz#d2745701025a6c775a6c545793ed502fc0c649a1\"\n  dependencies:\n    hash.js \"^1.0.3\"\n    minimalistic-assert \"^1.0.0\"\n    minimalistic-crypto-utils \"^1.0.1\"\n\nhoek@0.9.x:\n  version \"0.9.1\"\n  resolved \"https://registry.yarnpkg.com/hoek/-/hoek-0.9.1.tgz#3d322462badf07716ea7eb85baf88079cddce505\"\n\nhoek@2.x.x:\n  version \"2.16.3\"\n  resolved \"https://registry.yarnpkg.com/hoek/-/hoek-2.16.3.tgz#20bb7403d3cea398e91dc4710a8ff1b8274a25ed\"\n\nhome-or-tmp@^2.0.0:\n  version \"2.0.0\"\n  resolved \"https://registry.yarnpkg.com/home-or-tmp/-/home-or-tmp-2.0.0.tgz#e36c3f2d2cae7d746a857e38d18d5f32a7882db8\"\n  dependencies:\n    os-homedir \"^1.0.0\"\n    os-tmpdir \"^1.0.1\"\n\nhomedir-polyfill@^1.0.1:\n  version \"1.0.1\"\n  resolved \"https://registry.yarnpkg.com/homedir-polyfill/-/homedir-polyfill-1.0.1.tgz#4c2bbc8a758998feebf5ed68580f76d46768b4bc\"\n  dependencies:\n    parse-passwd \"^1.0.0\"\n\nhosted-git-info@^2.1.4:\n  version \"2.7.1\"\n  resolved \"https://registry.yarnpkg.com/hosted-git-info/-/hosted-git-info-2.7.1.tgz#97f236977bd6e125408930ff6de3eec6281ec047\"\n\nhtml-comment-regex@^1.1.0:\n  version \"1.1.1\"\n  resolved \"https://registry.yarnpkg.com/html-comment-regex/-/html-comment-regex-1.1.1.tgz#668b93776eaae55ebde8f3ad464b307a4963625e\"\n\nhtmlparser2@^3.8.3, htmlparser2@^3.9.1:\n  version \"3.9.2\"\n  resolved \"https://registry.yarnpkg.com/htmlparser2/-/htmlparser2-3.9.2.tgz#1bdf87acca0f3f9e53fa4fcceb0f4b4cbb00b338\"\n  dependencies:\n    domelementtype \"^1.3.0\"\n    domhandler \"^2.3.0\"\n    domutils \"^1.5.1\"\n    entities \"^1.1.1\"\n    inherits \"^2.0.1\"\n    readable-stream \"^2.0.2\"\n\nhttp-errors@1.6.3, http-errors@~1.6.2:\n  version \"1.6.3\"\n  resolved \"https://registry.yarnpkg.com/http-errors/-/http-errors-1.6.3.tgz#8b55680bb4be283a0b5bf4ea2e38580be1d9320d\"\n  dependencies:\n    depd \"~1.1.2\"\n    inherits \"2.0.3\"\n    setprototypeof \"1.1.0\"\n    statuses \">= 1.4.0 < 2\"\n\nhttp-proxy@1.15.2:\n  version \"1.15.2\"\n  resolved \"https://registry.yarnpkg.com/http-proxy/-/http-proxy-1.15.2.tgz#642fdcaffe52d3448d2bda3b0079e9409064da31\"\n  dependencies:\n    eventemitter3 \"1.x.x\"\n    requires-port \"1.x.x\"\n\nhttp-signature@~0.10.0:\n  version \"0.10.1\"\n  resolved \"https://registry.yarnpkg.com/http-signature/-/http-signature-0.10.1.tgz#4fbdac132559aa8323121e540779c0a012b27e66\"\n  dependencies:\n    asn1 \"0.1.11\"\n    assert-plus \"^0.1.5\"\n    ctype \"0.5.3\"\n\nhttp-signature@~1.1.0:\n  version \"1.1.1\"\n  resolved \"https://registry.yarnpkg.com/http-signature/-/http-signature-1.1.1.tgz#df72e267066cd0ac67fb76adf8e134a8fbcf91bf\"\n  dependencies:\n    assert-plus \"^0.2.0\"\n    jsprim \"^1.2.2\"\n    sshpk \"^1.7.0\"\n\nhttp-signature@~1.2.0:\n  version \"1.2.0\"\n  resolved \"https://registry.yarnpkg.com/http-signature/-/http-signature-1.2.0.tgz#9aecd925114772f3d95b65a60abb8f7c18fbace1\"\n  dependencies:\n    assert-plus \"^1.0.0\"\n    jsprim \"^1.2.2\"\n    sshpk \"^1.7.0\"\n\nhttps-browserify@0.0.1:\n  version \"0.0.1\"\n  resolved \"https://registry.yarnpkg.com/https-browserify/-/https-browserify-0.0.1.tgz#3f91365cabe60b77ed0ebba24b454e3e09d95a82\"\n\nhttps-browserify@^1.0.0:\n  version \"1.0.0\"\n  resolved \"https://registry.yarnpkg.com/https-browserify/-/https-browserify-1.0.0.tgz#ec06c10e0a34c0f2faf199f7fd7fc78fffd03c73\"\n\niconv-lite@0.4.23, iconv-lite@^0.4.4:\n  version \"0.4.23\"\n  resolved \"https://registry.yarnpkg.com/iconv-lite/-/iconv-lite-0.4.23.tgz#297871f63be507adcfbfca715d0cd0eed84e9a63\"\n  dependencies:\n    safer-buffer \">= 2.1.2 < 3\"\n\nieee754@^1.1.4:\n  version \"1.1.12\"\n  resolved \"https://registry.yarnpkg.com/ieee754/-/ieee754-1.1.12.tgz#50bf24e5b9c8bb98af4964c941cdb0918da7b60b\"\n\nignore-walk@^3.0.1:\n  version \"3.0.1\"\n  resolved \"https://registry.yarnpkg.com/ignore-walk/-/ignore-walk-3.0.1.tgz#a83e62e7d272ac0e3b551aaa82831a19b69f82f8\"\n  dependencies:\n    minimatch \"^3.0.4\"\n\nimage-size@~0.5.0:\n  version \"0.5.5\"\n  resolved \"https://registry.yarnpkg.com/image-size/-/image-size-0.5.5.tgz#09dfd4ab9d20e29eb1c3e80b8990378df9e3cb9c\"\n\nimagemin-gifsicle@^4.0.0:\n  version \"4.2.0\"\n  resolved \"https://registry.yarnpkg.com/imagemin-gifsicle/-/imagemin-gifsicle-4.2.0.tgz#0fef9bbad3476e6b76885736cc5b0b87a08757ca\"\n  dependencies:\n    gifsicle \"^3.0.0\"\n    is-gif \"^1.0.0\"\n    through2 \"^0.6.1\"\n\nimagemin-jpegtran@^4.0.0:\n  version \"4.3.2\"\n  resolved \"https://registry.yarnpkg.com/imagemin-jpegtran/-/imagemin-jpegtran-4.3.2.tgz#1bc6d1e2bd13fdb64d245526d635a7e5dfeb12fc\"\n  dependencies:\n    is-jpg \"^1.0.0\"\n    jpegtran-bin \"^3.0.0\"\n    through2 \"^2.0.0\"\n\nimagemin-optipng@^4.0.0:\n  version \"4.3.0\"\n  resolved \"https://registry.yarnpkg.com/imagemin-optipng/-/imagemin-optipng-4.3.0.tgz#7604663ab2ee315733274726fd1c374d2b44adb6\"\n  dependencies:\n    exec-buffer \"^2.0.0\"\n    is-png \"^1.0.0\"\n    optipng-bin \"^3.0.0\"\n    through2 \"^0.6.1\"\n\nimagemin-pngquant@^4.0.0, imagemin-pngquant@^4.2.2:\n  version \"4.2.2\"\n  resolved \"https://registry.yarnpkg.com/imagemin-pngquant/-/imagemin-pngquant-4.2.2.tgz#2ccd853e7af9fba26f2b2dd252d35ee8e155c542\"\n  dependencies:\n    is-png \"^1.0.0\"\n    pngquant-bin \"^3.0.0\"\n    through2 \"^2.0.0\"\n\nimagemin-svgo@^4.0.0:\n  version \"4.2.1\"\n  resolved \"https://registry.yarnpkg.com/imagemin-svgo/-/imagemin-svgo-4.2.1.tgz#54f07dc56f47260462df6a61c54befb44b57be55\"\n  dependencies:\n    is-svg \"^1.0.0\"\n    svgo \"^0.6.0\"\n    through2 \"^2.0.0\"\n\nimagemin-webp@^3.0.1:\n  version \"3.1.1\"\n  resolved \"https://registry.yarnpkg.com/imagemin-webp/-/imagemin-webp-3.1.1.tgz#6b7a5fe06f0c786b9ac5754036c060c09f997ad7\"\n  dependencies:\n    cwebp-bin \"^3.1.0\"\n    is-cwebp-readable \"^1.0.0\"\n    replace-ext \"^0.0.1\"\n    through2 \"^2.0.0\"\n\nimagemin@3.1.0:\n  version \"3.1.0\"\n  resolved \"https://registry.yarnpkg.com/imagemin/-/imagemin-3.1.0.tgz#6f3f094612e48be9139939dbd1968b116749e3d5\"\n  dependencies:\n    concat-stream \"^1.4.6\"\n    get-stdin \"^3.0.0\"\n    meow \"^2.0.0\"\n    optional \"^0.1.0\"\n    stream-combiner \"^0.2.1\"\n    through2 \"^0.6.1\"\n    vinyl \"^0.4.3\"\n    vinyl-fs \"^0.3.7\"\n  optionalDependencies:\n    imagemin-gifsicle \"^4.0.0\"\n    imagemin-jpegtran \"^4.0.0\"\n    imagemin-optipng \"^4.0.0\"\n    imagemin-pngquant \"^4.0.0\"\n    imagemin-svgo \"^4.0.0\"\n\nimagemin@^4.0.0:\n  version \"4.0.0\"\n  resolved \"https://registry.yarnpkg.com/imagemin/-/imagemin-4.0.0.tgz#e90e7f0936836595f18fa15fe906f4fa259ea847\"\n  dependencies:\n    buffer-to-vinyl \"^1.0.0\"\n    concat-stream \"^1.4.6\"\n    optional \"^0.1.0\"\n    readable-stream \"^2.0.0\"\n    stream-combiner2 \"^1.1.1\"\n    vinyl-fs \"^2.1.1\"\n  optionalDependencies:\n    imagemin-gifsicle \"^4.0.0\"\n    imagemin-jpegtran \"^4.0.0\"\n    imagemin-optipng \"^4.0.0\"\n    imagemin-svgo \"^4.0.0\"\n\nimmutable@3.8.2, immutable@^3.7.6:\n  version \"3.8.2\"\n  resolved \"https://registry.yarnpkg.com/immutable/-/immutable-3.8.2.tgz#c2439951455bb39913daf281376f1530e104adf3\"\n\nin-publish@^2.0.0:\n  version \"2.0.0\"\n  resolved \"https://registry.yarnpkg.com/in-publish/-/in-publish-2.0.0.tgz#e20ff5e3a2afc2690320b6dc552682a9c7fadf51\"\n\nindent-string@^1.1.0:\n  version \"1.2.2\"\n  resolved \"https://registry.yarnpkg.com/indent-string/-/indent-string-1.2.2.tgz#db99bcc583eb6abbb1e48dcbb1999a986041cb6b\"\n  dependencies:\n    get-stdin \"^4.0.1\"\n    minimist \"^1.1.0\"\n    repeating \"^1.1.0\"\n\nindent-string@^2.1.0:\n  version \"2.1.0\"\n  resolved \"https://registry.yarnpkg.com/indent-string/-/indent-string-2.1.0.tgz#8e2d48348742121b4a8218b7a137e9a52049dc80\"\n  dependencies:\n    repeating \"^2.0.0\"\n\nindexes-of@^1.0.1:\n  version \"1.0.1\"\n  resolved \"https://registry.yarnpkg.com/indexes-of/-/indexes-of-1.0.1.tgz#f30f716c8e2bd346c7b67d3df3915566a7c05607\"\n\nindexof@0.0.1:\n  version \"0.0.1\"\n  resolved \"https://registry.yarnpkg.com/indexof/-/indexof-0.0.1.tgz#82dc336d232b9062179d05ab3293a66059fd435d\"\n\nindx@^0.2.3:\n  version \"0.2.3\"\n  resolved \"https://registry.yarnpkg.com/indx/-/indx-0.2.3.tgz#15dcf56ee9cf65c0234c513c27fbd580e70fbc50\"\n\ninflight@^1.0.4:\n  version \"1.0.6\"\n  resolved \"https://registry.yarnpkg.com/inflight/-/inflight-1.0.6.tgz#49bd6331d7d02d0c09bc910a1075ba8165b56df9\"\n  dependencies:\n    once \"^1.3.0\"\n    wrappy \"1\"\n\ninherits@1:\n  version \"1.0.2\"\n  resolved \"https://registry.yarnpkg.com/inherits/-/inherits-1.0.2.tgz#ca4309dadee6b54cc0b8d247e8d7c7a0975bdc9b\"\n\ninherits@2, inherits@2.0.3, inherits@^2.0.1, inherits@^2.0.3, inherits@~2.0.0, inherits@~2.0.1, inherits@~2.0.3:\n  version \"2.0.3\"\n  resolved \"https://registry.yarnpkg.com/inherits/-/inherits-2.0.3.tgz#633c2c83e3da42a502f52466022480f4208261de\"\n\ninherits@2.0.1:\n  version \"2.0.1\"\n  resolved \"https://registry.yarnpkg.com/inherits/-/inherits-2.0.1.tgz#b17d08d326b4423e568eff719f91b0b1cbdf69f1\"\n\nini@^1.3.4, ini@~1.3.0:\n  version \"1.3.5\"\n  resolved \"https://registry.yarnpkg.com/ini/-/ini-1.3.5.tgz#eee25f56db1c9ec6085e0c22778083f596abf927\"\n\ninterpret@^0.6.4:\n  version \"0.6.6\"\n  resolved \"https://registry.yarnpkg.com/interpret/-/interpret-0.6.6.tgz#fecd7a18e7ce5ca6abfb953e1f86213a49f1625b\"\n\ninterpret@^1.0.0, interpret@^1.1.0:\n  version \"1.1.0\"\n  resolved \"https://registry.yarnpkg.com/interpret/-/interpret-1.1.0.tgz#7ed1b1410c6a0e0f78cf95d3b8440c63f78b8614\"\n\ninvariant@^2.2.2:\n  version \"2.2.4\"\n  resolved \"https://registry.yarnpkg.com/invariant/-/invariant-2.2.4.tgz#610f3c92c9359ce1db616e538008d23ff35158e6\"\n  dependencies:\n    loose-envify \"^1.0.0\"\n\ninvert-kv@^1.0.0:\n  version \"1.0.0\"\n  resolved \"https://registry.yarnpkg.com/invert-kv/-/invert-kv-1.0.0.tgz#104a8e4aaca6d3d8cd157a8ef8bfab2d7a3ffdb6\"\n\nip-regex@^1.0.1:\n  version \"1.0.3\"\n  resolved \"https://registry.yarnpkg.com/ip-regex/-/ip-regex-1.0.3.tgz#dc589076f659f419c222039a33316f1c7387effd\"\n\nirregular-plurals@^1.0.0:\n  version \"1.4.0\"\n  resolved \"https://registry.yarnpkg.com/irregular-plurals/-/irregular-plurals-1.4.0.tgz#2ca9b033651111855412f16be5d77c62a458a766\"\n\nis-absolute-url@^2.0.0:\n  version \"2.1.0\"\n  resolved \"https://registry.yarnpkg.com/is-absolute-url/-/is-absolute-url-2.1.0.tgz#50530dfb84fcc9aa7dbe7852e83a37b93b9f2aa6\"\n\nis-absolute@^0.1.5:\n  version \"0.1.7\"\n  resolved \"https://registry.yarnpkg.com/is-absolute/-/is-absolute-0.1.7.tgz#847491119fccb5fb436217cc737f7faad50f603f\"\n  dependencies:\n    is-relative \"^0.1.0\"\n\nis-absolute@^1.0.0:\n  version \"1.0.0\"\n  resolved \"https://registry.yarnpkg.com/is-absolute/-/is-absolute-1.0.0.tgz#395e1ae84b11f26ad1795e73c17378e48a301576\"\n  dependencies:\n    is-relative \"^1.0.0\"\n    is-windows \"^1.0.1\"\n\nis-accessor-descriptor@^0.1.6:\n  version \"0.1.6\"\n  resolved \"https://registry.yarnpkg.com/is-accessor-descriptor/-/is-accessor-descriptor-0.1.6.tgz#a9e12cb3ae8d876727eeef3843f8a0897b5c98d6\"\n  dependencies:\n    kind-of \"^3.0.2\"\n\nis-accessor-descriptor@^1.0.0:\n  version \"1.0.0\"\n  resolved \"https://registry.yarnpkg.com/is-accessor-descriptor/-/is-accessor-descriptor-1.0.0.tgz#169c2f6d3df1f992618072365c9b0ea1f6878656\"\n  dependencies:\n    kind-of \"^6.0.0\"\n\nis-arrayish@^0.2.1:\n  version \"0.2.1\"\n  resolved \"https://registry.yarnpkg.com/is-arrayish/-/is-arrayish-0.2.1.tgz#77c99840527aa8ecb1a8ba697b80645a7a926a9d\"\n\nis-arrayish@^0.3.1:\n  version \"0.3.2\"\n  resolved \"https://registry.yarnpkg.com/is-arrayish/-/is-arrayish-0.3.2.tgz#4574a2ae56f7ab206896fb431eaeed066fdf8f03\"\n\nis-binary-path@^1.0.0:\n  version \"1.0.1\"\n  resolved \"https://registry.yarnpkg.com/is-binary-path/-/is-binary-path-1.0.1.tgz#75f16642b480f187a711c814161fd3a4a7655898\"\n  dependencies:\n    binary-extensions \"^1.0.0\"\n\nis-buffer@^1.1.5:\n  version \"1.1.6\"\n  resolved \"https://registry.yarnpkg.com/is-buffer/-/is-buffer-1.1.6.tgz#efaa2ea9daa0d7ab2ea13a97b2b8ad51fefbe8be\"\n\nis-builtin-module@^1.0.0:\n  version \"1.0.0\"\n  resolved \"https://registry.yarnpkg.com/is-builtin-module/-/is-builtin-module-1.0.0.tgz#540572d34f7ac3119f8f76c30cbc1b1e037affbe\"\n  dependencies:\n    builtin-modules \"^1.0.0\"\n\nis-bzip2@^1.0.0:\n  version \"1.0.0\"\n  resolved \"https://registry.yarnpkg.com/is-bzip2/-/is-bzip2-1.0.0.tgz#5ee58eaa5a2e9c80e21407bedf23ae5ac091b3fc\"\n\nis-callable@^1.1.1, is-callable@^1.1.3:\n  version \"1.1.4\"\n  resolved \"https://registry.yarnpkg.com/is-callable/-/is-callable-1.1.4.tgz#1e1adf219e1eeb684d691f9d6a05ff0d30a24d75\"\n\nis-cwebp-readable@^1.0.0:\n  version \"1.0.3\"\n  resolved \"https://registry.yarnpkg.com/is-cwebp-readable/-/is-cwebp-readable-1.0.3.tgz#9a8fde2bed77f3417ae9371258c58e2ec3285118\"\n  dependencies:\n    file-type \"^3.1.0\"\n\nis-data-descriptor@^0.1.4:\n  version \"0.1.4\"\n  resolved \"https://registry.yarnpkg.com/is-data-descriptor/-/is-data-descriptor-0.1.4.tgz#0b5ee648388e2c860282e793f1856fec3f301b56\"\n  dependencies:\n    kind-of \"^3.0.2\"\n\nis-data-descriptor@^1.0.0:\n  version \"1.0.0\"\n  resolved \"https://registry.yarnpkg.com/is-data-descriptor/-/is-data-descriptor-1.0.0.tgz#d84876321d0e7add03990406abbbbd36ba9268c7\"\n  dependencies:\n    kind-of \"^6.0.0\"\n\nis-date-object@^1.0.1:\n  version \"1.0.1\"\n  resolved \"https://registry.yarnpkg.com/is-date-object/-/is-date-object-1.0.1.tgz#9aa20eb6aeebbff77fbd33e74ca01b33581d3a16\"\n\nis-descriptor@^0.1.0:\n  version \"0.1.6\"\n  resolved \"https://registry.yarnpkg.com/is-descriptor/-/is-descriptor-0.1.6.tgz#366d8240dde487ca51823b1ab9f07a10a78251ca\"\n  dependencies:\n    is-accessor-descriptor \"^0.1.6\"\n    is-data-descriptor \"^0.1.4\"\n    kind-of \"^5.0.0\"\n\nis-descriptor@^1.0.0, is-descriptor@^1.0.2:\n  version \"1.0.2\"\n  resolved \"https://registry.yarnpkg.com/is-descriptor/-/is-descriptor-1.0.2.tgz#3b159746a66604b04f8c81524ba365c5f14d86ec\"\n  dependencies:\n    is-accessor-descriptor \"^1.0.0\"\n    is-data-descriptor \"^1.0.0\"\n    kind-of \"^6.0.2\"\n\nis-directory@^0.3.1:\n  version \"0.3.1\"\n  resolved \"https://registry.yarnpkg.com/is-directory/-/is-directory-0.3.1.tgz#61339b6f2475fc772fd9c9d83f5c8575dc154ae1\"\n\nis-dotfile@^1.0.0:\n  version \"1.0.3\"\n  resolved \"https://registry.yarnpkg.com/is-dotfile/-/is-dotfile-1.0.3.tgz#a6a2f32ffd2dfb04f5ca25ecd0f6b83cf798a1e1\"\n\nis-equal-shallow@^0.1.3:\n  version \"0.1.3\"\n  resolved \"https://registry.yarnpkg.com/is-equal-shallow/-/is-equal-shallow-0.1.3.tgz#2238098fc221de0bcfa5d9eac4c45d638aa1c534\"\n  dependencies:\n    is-primitive \"^2.0.0\"\n\nis-extendable@^0.1.0, is-extendable@^0.1.1:\n  version \"0.1.1\"\n  resolved \"https://registry.yarnpkg.com/is-extendable/-/is-extendable-0.1.1.tgz#62b110e289a471418e3ec36a617d472e301dfc89\"\n\nis-extendable@^1.0.1:\n  version \"1.0.1\"\n  resolved \"https://registry.yarnpkg.com/is-extendable/-/is-extendable-1.0.1.tgz#a7470f9e426733d81bd81e1155264e3a3507cab4\"\n  dependencies:\n    is-plain-object \"^2.0.4\"\n\nis-extglob@^1.0.0:\n  version \"1.0.0\"\n  resolved \"https://registry.yarnpkg.com/is-extglob/-/is-extglob-1.0.0.tgz#ac468177c4943405a092fc8f29760c6ffc6206c0\"\n\nis-extglob@^2.1.0, is-extglob@^2.1.1:\n  version \"2.1.1\"\n  resolved \"https://registry.yarnpkg.com/is-extglob/-/is-extglob-2.1.1.tgz#a88c02535791f02ed37c76a1b9ea9773c833f8c2\"\n\nis-finite@^1.0.0:\n  version \"1.0.2\"\n  resolved \"https://registry.yarnpkg.com/is-finite/-/is-finite-1.0.2.tgz#cc6677695602be550ef11e8b4aa6305342b6d0aa\"\n  dependencies:\n    number-is-nan \"^1.0.0\"\n\nis-fullwidth-code-point@^1.0.0:\n  version \"1.0.0\"\n  resolved \"https://registry.yarnpkg.com/is-fullwidth-code-point/-/is-fullwidth-code-point-1.0.0.tgz#ef9e31386f031a7f0d643af82fde50c457ef00cb\"\n  dependencies:\n    number-is-nan \"^1.0.0\"\n\nis-fullwidth-code-point@^2.0.0:\n  version \"2.0.0\"\n  resolved \"https://registry.yarnpkg.com/is-fullwidth-code-point/-/is-fullwidth-code-point-2.0.0.tgz#a3b30a5c4f199183167aaab93beefae3ddfb654f\"\n\nis-function@^1.0.1:\n  version \"1.0.1\"\n  resolved \"https://registry.yarnpkg.com/is-function/-/is-function-1.0.1.tgz#12cfb98b65b57dd3d193a3121f5f6e2f437602b5\"\n\nis-gif@^1.0.0:\n  version \"1.0.0\"\n  resolved \"https://registry.yarnpkg.com/is-gif/-/is-gif-1.0.0.tgz#a6d2ae98893007bffa97a1d8c01d63205832097e\"\n\nis-glob@^2.0.0, is-glob@^2.0.1:\n  version \"2.0.1\"\n  resolved \"https://registry.yarnpkg.com/is-glob/-/is-glob-2.0.1.tgz#d096f926a3ded5600f3fdfd91198cb0888c2d863\"\n  dependencies:\n    is-extglob \"^1.0.0\"\n\nis-glob@^3.1.0:\n  version \"3.1.0\"\n  resolved \"https://registry.yarnpkg.com/is-glob/-/is-glob-3.1.0.tgz#7ba5ae24217804ac70707b96922567486cc3e84a\"\n  dependencies:\n    is-extglob \"^2.1.0\"\n\nis-glob@^4.0.0:\n  version \"4.0.0\"\n  resolved \"https://registry.yarnpkg.com/is-glob/-/is-glob-4.0.0.tgz#9521c76845cc2610a85203ddf080a958c2ffabc0\"\n  dependencies:\n    is-extglob \"^2.1.1\"\n\nis-gzip@^1.0.0:\n  version \"1.0.0\"\n  resolved \"https://registry.yarnpkg.com/is-gzip/-/is-gzip-1.0.0.tgz#6ca8b07b99c77998025900e555ced8ed80879a83\"\n\nis-jpg@^1.0.0:\n  version \"1.0.1\"\n  resolved \"https://registry.yarnpkg.com/is-jpg/-/is-jpg-1.0.1.tgz#296d57fdd99ce010434a7283e346ab9a1035e975\"\n\nis-natural-number@^2.0.0:\n  version \"2.1.1\"\n  resolved \"https://registry.yarnpkg.com/is-natural-number/-/is-natural-number-2.1.1.tgz#7d4c5728377ef386c3e194a9911bf57c6dc335e7\"\n\nis-negated-glob@^1.0.0:\n  version \"1.0.0\"\n  resolved \"https://registry.yarnpkg.com/is-negated-glob/-/is-negated-glob-1.0.0.tgz#6910bca5da8c95e784b5751b976cf5a10fee36d2\"\n\nis-number-like@^1.0.3:\n  version \"1.0.8\"\n  resolved \"https://registry.yarnpkg.com/is-number-like/-/is-number-like-1.0.8.tgz#2e129620b50891042e44e9bbbb30593e75cfbbe3\"\n  dependencies:\n    lodash.isfinite \"^3.3.2\"\n\nis-number@^2.1.0:\n  version \"2.1.0\"\n  resolved \"https://registry.yarnpkg.com/is-number/-/is-number-2.1.0.tgz#01fcbbb393463a548f2f466cce16dece49db908f\"\n  dependencies:\n    kind-of \"^3.0.2\"\n\nis-number@^3.0.0:\n  version \"3.0.0\"\n  resolved \"https://registry.yarnpkg.com/is-number/-/is-number-3.0.0.tgz#24fd6201a4782cf50561c810276afc7d12d71195\"\n  dependencies:\n    kind-of \"^3.0.2\"\n\nis-number@^4.0.0:\n  version \"4.0.0\"\n  resolved \"https://registry.yarnpkg.com/is-number/-/is-number-4.0.0.tgz#0026e37f5454d73e356dfe6564699867c6a7f0ff\"\n\nis-obj@^1.0.0:\n  version \"1.0.1\"\n  resolved \"https://registry.yarnpkg.com/is-obj/-/is-obj-1.0.1.tgz#3e4729ac1f5fde025cd7d83a896dab9f4f67db0f\"\n\nis-path-cwd@^1.0.0:\n  version \"1.0.0\"\n  resolved \"https://registry.yarnpkg.com/is-path-cwd/-/is-path-cwd-1.0.0.tgz#d225ec23132e89edd38fda767472e62e65f1106d\"\n\nis-path-in-cwd@^1.0.0:\n  version \"1.0.1\"\n  resolved \"https://registry.yarnpkg.com/is-path-in-cwd/-/is-path-in-cwd-1.0.1.tgz#5ac48b345ef675339bd6c7a48a912110b241cf52\"\n  dependencies:\n    is-path-inside \"^1.0.0\"\n\nis-path-inside@^1.0.0:\n  version \"1.0.1\"\n  resolved \"https://registry.yarnpkg.com/is-path-inside/-/is-path-inside-1.0.1.tgz#8ef5b7de50437a3fdca6b4e865ef7aa55cb48036\"\n  dependencies:\n    path-is-inside \"^1.0.1\"\n\nis-plain-obj@^1.0.0:\n  version \"1.1.0\"\n  resolved \"https://registry.yarnpkg.com/is-plain-obj/-/is-plain-obj-1.1.0.tgz#71a50c8429dfca773c92a390a4a03b39fcd51d3e\"\n\nis-plain-object@^2.0.1, is-plain-object@^2.0.3, is-plain-object@^2.0.4:\n  version \"2.0.4\"\n  resolved \"https://registry.yarnpkg.com/is-plain-object/-/is-plain-object-2.0.4.tgz#2c163b3fafb1b606d9d17928f05c2a1c38e07677\"\n  dependencies:\n    isobject \"^3.0.1\"\n\nis-png@^1.0.0:\n  version \"1.1.0\"\n  resolved \"https://registry.yarnpkg.com/is-png/-/is-png-1.1.0.tgz#d574b12bf275c0350455570b0e5b57ab062077ce\"\n\nis-posix-bracket@^0.1.0:\n  version \"0.1.1\"\n  resolved \"https://registry.yarnpkg.com/is-posix-bracket/-/is-posix-bracket-0.1.1.tgz#3334dc79774368e92f016e6fbc0a88f5cd6e6bc4\"\n\nis-primitive@^2.0.0:\n  version \"2.0.0\"\n  resolved \"https://registry.yarnpkg.com/is-primitive/-/is-primitive-2.0.0.tgz#207bab91638499c07b2adf240a41a87210034575\"\n\nis-redirect@^1.0.0:\n  version \"1.0.0\"\n  resolved \"https://registry.yarnpkg.com/is-redirect/-/is-redirect-1.0.0.tgz#1d03dded53bd8db0f30c26e4f95d36fc7c87dc24\"\n\nis-regex@^1.0.4:\n  version \"1.0.4\"\n  resolved \"https://registry.yarnpkg.com/is-regex/-/is-regex-1.0.4.tgz#5517489b547091b0930e095654ced25ee97e9491\"\n  dependencies:\n    has \"^1.0.1\"\n\nis-relative@^0.1.0:\n  version \"0.1.3\"\n  resolved \"https://registry.yarnpkg.com/is-relative/-/is-relative-0.1.3.tgz#905fee8ae86f45b3ec614bc3c15c869df0876e82\"\n\nis-relative@^1.0.0:\n  version \"1.0.0\"\n  resolved \"https://registry.yarnpkg.com/is-relative/-/is-relative-1.0.0.tgz#a1bb6935ce8c5dba1e8b9754b9b2dcc020e2260d\"\n  dependencies:\n    is-unc-path \"^1.0.0\"\n\nis-retry-allowed@^1.0.0:\n  version \"1.1.0\"\n  resolved \"https://registry.yarnpkg.com/is-retry-allowed/-/is-retry-allowed-1.1.0.tgz#11a060568b67339444033d0125a61a20d564fb34\"\n\nis-stream@^1.0.0, is-stream@^1.0.1, is-stream@^1.1.0:\n  version \"1.1.0\"\n  resolved \"https://registry.yarnpkg.com/is-stream/-/is-stream-1.1.0.tgz#12d4a3dd4e68e0b79ceb8dbc84173ae80d91ca44\"\n\nis-svg@^1.0.0:\n  version \"1.1.1\"\n  resolved \"https://registry.yarnpkg.com/is-svg/-/is-svg-1.1.1.tgz#ac0efaafb653ac58473708b1f873636ca110e31b\"\n\nis-svg@^2.0.0:\n  version \"2.1.0\"\n  resolved \"https://registry.yarnpkg.com/is-svg/-/is-svg-2.1.0.tgz#cf61090da0d9efbcab8722deba6f032208dbb0e9\"\n  dependencies:\n    html-comment-regex \"^1.1.0\"\n\nis-symbol@^1.0.1:\n  version \"1.0.1\"\n  resolved \"https://registry.yarnpkg.com/is-symbol/-/is-symbol-1.0.1.tgz#3cc59f00025194b6ab2e38dbae6689256b660572\"\n\nis-tar@^1.0.0:\n  version \"1.0.0\"\n  resolved \"https://registry.yarnpkg.com/is-tar/-/is-tar-1.0.0.tgz#2f6b2e1792c1f5bb36519acaa9d65c0d26fe853d\"\n\nis-typedarray@~1.0.0:\n  version \"1.0.0\"\n  resolved \"https://registry.yarnpkg.com/is-typedarray/-/is-typedarray-1.0.0.tgz#e479c80858df0c1b11ddda6940f96011fcda4a9a\"\n\nis-unc-path@^1.0.0:\n  version \"1.0.0\"\n  resolved \"https://registry.yarnpkg.com/is-unc-path/-/is-unc-path-1.0.0.tgz#d731e8898ed090a12c352ad2eaed5095ad322c9d\"\n  dependencies:\n    unc-path-regex \"^0.1.2\"\n\nis-url@^1.2.0:\n  version \"1.2.4\"\n  resolved \"https://registry.yarnpkg.com/is-url/-/is-url-1.2.4.tgz#04a4df46d28c4cff3d73d01ff06abeb318a1aa52\"\n\nis-utf8@^0.2.0, is-utf8@^0.2.1:\n  version \"0.2.1\"\n  resolved \"https://registry.yarnpkg.com/is-utf8/-/is-utf8-0.2.1.tgz#4b0da1442104d1b336340e80797e865cf39f7d72\"\n\nis-valid-glob@^0.3.0:\n  version \"0.3.0\"\n  resolved \"https://registry.yarnpkg.com/is-valid-glob/-/is-valid-glob-0.3.0.tgz#d4b55c69f51886f9b65c70d6c2622d37e29f48fe\"\n\nis-valid-glob@^1.0.0:\n  version \"1.0.0\"\n  resolved \"https://registry.yarnpkg.com/is-valid-glob/-/is-valid-glob-1.0.0.tgz#29bf3eff701be2d4d315dbacc39bc39fe8f601aa\"\n\nis-windows@^1.0.1, is-windows@^1.0.2:\n  version \"1.0.2\"\n  resolved \"https://registry.yarnpkg.com/is-windows/-/is-windows-1.0.2.tgz#d1850eb9791ecd18e6182ce12a30f396634bb19d\"\n\nis-zip@^1.0.0:\n  version \"1.0.0\"\n  resolved \"https://registry.yarnpkg.com/is-zip/-/is-zip-1.0.0.tgz#47b0a8ff4d38a76431ccfd99a8e15a4c86ba2325\"\n\nisarray@0.0.1:\n  version \"0.0.1\"\n  resolved \"https://registry.yarnpkg.com/isarray/-/isarray-0.0.1.tgz#8a18acfca9a8f4177e09abfc6038939b05d1eedf\"\n\nisarray@1.0.0, isarray@^1.0.0, isarray@~1.0.0:\n  version \"1.0.0\"\n  resolved \"https://registry.yarnpkg.com/isarray/-/isarray-1.0.0.tgz#bb935d48582cba168c06834957a54a3e07124f11\"\n\nisarray@2.0.1:\n  version \"2.0.1\"\n  resolved \"https://registry.yarnpkg.com/isarray/-/isarray-2.0.1.tgz#a37d94ed9cda2d59865c9f76fe596ee1f338741e\"\n\nisbinaryfile@^3.0.2:\n  version \"3.0.3\"\n  resolved \"https://registry.yarnpkg.com/isbinaryfile/-/isbinaryfile-3.0.3.tgz#5d6def3edebf6e8ca8cae9c30183a804b5f8be80\"\n  dependencies:\n    buffer-alloc \"^1.2.0\"\n\nisexe@^2.0.0:\n  version \"2.0.0\"\n  resolved \"https://registry.yarnpkg.com/isexe/-/isexe-2.0.0.tgz#e8fbf374dc556ff8947a10dcb0572d633f2cfa10\"\n\nisobject@^2.0.0:\n  version \"2.1.0\"\n  resolved \"https://registry.yarnpkg.com/isobject/-/isobject-2.1.0.tgz#f065561096a3f1da2ef46272f815c840d87e0c89\"\n  dependencies:\n    isarray \"1.0.0\"\n\nisobject@^3.0.0, isobject@^3.0.1:\n  version \"3.0.1\"\n  resolved \"https://registry.yarnpkg.com/isobject/-/isobject-3.0.1.tgz#4e431e92b11a9731636aa1f9c8d1ccbcfdab78df\"\n\nisstream@0.1.x, isstream@~0.1.2:\n  version \"0.1.2\"\n  resolved \"https://registry.yarnpkg.com/isstream/-/isstream-0.1.2.tgz#47e63f7af55afa6f92e1500e690eb8b8529c099a\"\n\nistextorbinary@1.0.2:\n  version \"1.0.2\"\n  resolved \"https://registry.yarnpkg.com/istextorbinary/-/istextorbinary-1.0.2.tgz#ace19354d1a9a0173efeb1084ce0f87b0ad7decf\"\n  dependencies:\n    binaryextensions \"~1.0.0\"\n    textextensions \"~1.0.0\"\n\njade@0.26.3:\n  version \"0.26.3\"\n  resolved \"https://registry.yarnpkg.com/jade/-/jade-0.26.3.tgz#8f10d7977d8d79f2f6ff862a81b0513ccb25686c\"\n  dependencies:\n    commander \"0.6.1\"\n    mkdirp \"0.3.0\"\n\njimp@^0.2.28:\n  version \"0.2.28\"\n  resolved \"https://registry.yarnpkg.com/jimp/-/jimp-0.2.28.tgz#dd529a937190f42957a7937d1acc3a7762996ea2\"\n  dependencies:\n    bignumber.js \"^2.1.0\"\n    bmp-js \"0.0.3\"\n    es6-promise \"^3.0.2\"\n    exif-parser \"^0.1.9\"\n    file-type \"^3.1.0\"\n    jpeg-js \"^0.2.0\"\n    load-bmfont \"^1.2.3\"\n    mime \"^1.3.4\"\n    mkdirp \"0.5.1\"\n    pixelmatch \"^4.0.0\"\n    pngjs \"^3.0.0\"\n    read-chunk \"^1.0.1\"\n    request \"^2.65.0\"\n    stream-to-buffer \"^0.1.0\"\n    tinycolor2 \"^1.1.2\"\n    url-regex \"^3.0.0\"\n\njpeg-js@^0.2.0:\n  version \"0.2.0\"\n  resolved \"https://registry.yarnpkg.com/jpeg-js/-/jpeg-js-0.2.0.tgz#53e448ec9d263e683266467e9442d2c5a2ef5482\"\n\njpegtran-bin@^3.0.0:\n  version \"3.2.0\"\n  resolved \"https://registry.yarnpkg.com/jpegtran-bin/-/jpegtran-bin-3.2.0.tgz#f60ecf4ae999c0bdad2e9fbcdf2b6f0981e7a29b\"\n  dependencies:\n    bin-build \"^2.0.0\"\n    bin-wrapper \"^3.0.0\"\n    logalot \"^2.0.0\"\n\njs-base64@^2.1.8, js-base64@^2.1.9:\n  version \"2.4.8\"\n  resolved \"https://registry.yarnpkg.com/js-base64/-/js-base64-2.4.8.tgz#57a9b130888f956834aa40c5b165ba59c758f033\"\n\n\"js-tokens@^3.0.0 || ^4.0.0\":\n  version \"4.0.0\"\n  resolved \"https://registry.yarnpkg.com/js-tokens/-/js-tokens-4.0.0.tgz#19203fb59991df98e3a287050d4647cdeaf32499\"\n\njs-tokens@^3.0.2:\n  version \"3.0.2\"\n  resolved \"https://registry.yarnpkg.com/js-tokens/-/js-tokens-3.0.2.tgz#9866df395102130e38f7f996bceb65443209c25b\"\n\njs-yaml@^3.11.0, js-yaml@^3.4.3:\n  version \"3.12.0\"\n  resolved \"https://registry.yarnpkg.com/js-yaml/-/js-yaml-3.12.0.tgz#eaed656ec8344f10f527c6bfa1b6e2244de167d1\"\n  dependencies:\n    argparse \"^1.0.7\"\n    esprima \"^4.0.0\"\n\njs-yaml@~3.10.0:\n  version \"3.10.0\"\n  resolved \"https://registry.yarnpkg.com/js-yaml/-/js-yaml-3.10.0.tgz#2e78441646bd4682e963f22b6e92823c309c62dc\"\n  dependencies:\n    argparse \"^1.0.7\"\n    esprima \"^4.0.0\"\n\njs-yaml@~3.6.0:\n  version \"3.6.1\"\n  resolved \"https://registry.yarnpkg.com/js-yaml/-/js-yaml-3.6.1.tgz#6e5fe67d8b205ce4d22fad05b7781e8dadcc4b30\"\n  dependencies:\n    argparse \"^1.0.7\"\n    esprima \"^2.6.0\"\n\njs-yaml@~3.7.0:\n  version \"3.7.0\"\n  resolved \"https://registry.yarnpkg.com/js-yaml/-/js-yaml-3.7.0.tgz#5c967ddd837a9bfdca5f2de84253abe8a1c03b80\"\n  dependencies:\n    argparse \"^1.0.7\"\n    esprima \"^2.6.0\"\n\njsbn@~0.1.0:\n  version \"0.1.1\"\n  resolved \"https://registry.yarnpkg.com/jsbn/-/jsbn-0.1.1.tgz#a5e654c2e5a2deb5f201d96cefbca80c0ef2f513\"\n\njsesc@^1.3.0:\n  version \"1.3.0\"\n  resolved \"https://registry.yarnpkg.com/jsesc/-/jsesc-1.3.0.tgz#46c3fec8c1892b12b0833db9bc7622176dbab34b\"\n\njsesc@~0.5.0:\n  version \"0.5.0\"\n  resolved \"https://registry.yarnpkg.com/jsesc/-/jsesc-0.5.0.tgz#e7dee66e35d6fc16f710fe91d5cf69f70f08911d\"\n\njsftp-mkdirp@^1.0.0:\n  version \"1.0.0\"\n  resolved \"https://registry.yarnpkg.com/jsftp-mkdirp/-/jsftp-mkdirp-1.0.0.tgz#72142c137f980b2bc88cff30199ba2bd02df66f2\"\n  dependencies:\n    parents \"^1.0.0\"\n\njsftp@^1.3.0:\n  version \"1.5.5\"\n  resolved \"https://registry.yarnpkg.com/jsftp/-/jsftp-1.5.5.tgz#3d034569a58221c8ffc67d088688f59d2e995cee\"\n  dependencies:\n    debug \"^2.2.0\"\n    ftp-response-parser \"^1.0.1\"\n    once \"^1.3.3\"\n    parse-listing \"^1.1.3\"\n    stream-combiner \"^0.2.2\"\n    unorm \"^1.4.1\"\n\njson-loader@^0.5.4:\n  version \"0.5.7\"\n  resolved \"https://registry.yarnpkg.com/json-loader/-/json-loader-0.5.7.tgz#dca14a70235ff82f0ac9a3abeb60d337a365185d\"\n\njson-schema-traverse@^0.3.0:\n  version \"0.3.1\"\n  resolved \"https://registry.yarnpkg.com/json-schema-traverse/-/json-schema-traverse-0.3.1.tgz#349a6d44c53a51de89b40805c5d5e59b417d3340\"\n\njson-schema@0.2.3:\n  version \"0.2.3\"\n  resolved \"https://registry.yarnpkg.com/json-schema/-/json-schema-0.2.3.tgz#b480c892e59a2f05954ce727bd3f2a4e882f9e13\"\n\njson-stable-stringify@^1.0.0, json-stable-stringify@^1.0.1:\n  version \"1.0.1\"\n  resolved \"https://registry.yarnpkg.com/json-stable-stringify/-/json-stable-stringify-1.0.1.tgz#9a759d39c5f2ff503fd5300646ed445f88c4f9af\"\n  dependencies:\n    jsonify \"~0.0.0\"\n\njson-stringify-safe@~5.0.0, json-stringify-safe@~5.0.1:\n  version \"5.0.1\"\n  resolved \"https://registry.yarnpkg.com/json-stringify-safe/-/json-stringify-safe-5.0.1.tgz#1296a2d58fd45f19a0f6ce01d65701e2c735b6eb\"\n\njson5@^0.5.0, json5@^0.5.1:\n  version \"0.5.1\"\n  resolved \"https://registry.yarnpkg.com/json5/-/json5-0.5.1.tgz#1eade7acc012034ad84e2396767ead9fa5495821\"\n\njsonfile@^2.1.0:\n  version \"2.4.0\"\n  resolved \"https://registry.yarnpkg.com/jsonfile/-/jsonfile-2.4.0.tgz#3736a2b428b87bbda0cc83b53fa3d633a35c2ae8\"\n  optionalDependencies:\n    graceful-fs \"^4.1.6\"\n\njsonfile@^3.0.0:\n  version \"3.0.1\"\n  resolved \"https://registry.yarnpkg.com/jsonfile/-/jsonfile-3.0.1.tgz#a5ecc6f65f53f662c4415c7675a0331d0992ec66\"\n  optionalDependencies:\n    graceful-fs \"^4.1.6\"\n\njsonify@~0.0.0:\n  version \"0.0.0\"\n  resolved \"https://registry.yarnpkg.com/jsonify/-/jsonify-0.0.0.tgz#2c74b6ee41d93ca51b7b5aaee8f503631d252a73\"\n\njsprim@^1.2.2:\n  version \"1.4.1\"\n  resolved \"https://registry.yarnpkg.com/jsprim/-/jsprim-1.4.1.tgz#313e66bc1e5cc06e438bc1b7499c2e5c56acb6a2\"\n  dependencies:\n    assert-plus \"1.0.0\"\n    extsprintf \"1.3.0\"\n    json-schema \"0.2.3\"\n    verror \"1.10.0\"\n\njust-debounce@^1.0.0:\n  version \"1.0.0\"\n  resolved \"https://registry.yarnpkg.com/just-debounce/-/just-debounce-1.0.0.tgz#87fccfaeffc0b68cd19d55f6722943f929ea35ea\"\n\nkew@^0.7.0:\n  version \"0.7.0\"\n  resolved \"https://registry.yarnpkg.com/kew/-/kew-0.7.0.tgz#79d93d2d33363d6fdd2970b335d9141ad591d79b\"\n\nkind-of@^1.1.0:\n  version \"1.1.0\"\n  resolved \"https://registry.yarnpkg.com/kind-of/-/kind-of-1.1.0.tgz#140a3d2d41a36d2efcfa9377b62c24f8495a5c44\"\n\nkind-of@^3.0.2, kind-of@^3.0.3, kind-of@^3.2.0:\n  version \"3.2.2\"\n  resolved \"https://registry.yarnpkg.com/kind-of/-/kind-of-3.2.2.tgz#31ea21a734bab9bbb0f32466d893aea51e4a3c64\"\n  dependencies:\n    is-buffer \"^1.1.5\"\n\nkind-of@^4.0.0:\n  version \"4.0.0\"\n  resolved \"https://registry.yarnpkg.com/kind-of/-/kind-of-4.0.0.tgz#20813df3d712928b207378691a45066fae72dd57\"\n  dependencies:\n    is-buffer \"^1.1.5\"\n\nkind-of@^5.0.0, kind-of@^5.0.2:\n  version \"5.1.0\"\n  resolved \"https://registry.yarnpkg.com/kind-of/-/kind-of-5.1.0.tgz#729c91e2d857b7a419a1f9aa65685c4c33f5845d\"\n\nkind-of@^6.0.0, kind-of@^6.0.2:\n  version \"6.0.2\"\n  resolved \"https://registry.yarnpkg.com/kind-of/-/kind-of-6.0.2.tgz#01146b36a6218e64e58f3a8d66de5d7fc6f6d051\"\n\nklaw@^1.0.0:\n  version \"1.3.1\"\n  resolved \"https://registry.yarnpkg.com/klaw/-/klaw-1.3.1.tgz#4088433b46b3b1ba259d78785d8e96f73ba02439\"\n  optionalDependencies:\n    graceful-fs \"^4.1.9\"\n\nlast-run@^1.1.0:\n  version \"1.1.1\"\n  resolved \"https://registry.yarnpkg.com/last-run/-/last-run-1.1.1.tgz#45b96942c17b1c79c772198259ba943bebf8ca5b\"\n  dependencies:\n    default-resolution \"^2.0.0\"\n    es6-weak-map \"^2.0.1\"\n\nlayout@^2.2.0:\n  version \"2.2.0\"\n  resolved \"https://registry.yarnpkg.com/layout/-/layout-2.2.0.tgz#31e44bfc18dd1019b3ffb208e402a4bbfe2e6af4\"\n  dependencies:\n    bin-pack \"~1.0.1\"\n\nlazy-cache@^1.0.3:\n  version \"1.0.4\"\n  resolved \"https://registry.yarnpkg.com/lazy-cache/-/lazy-cache-1.0.4.tgz#a1d78fc3a50474cb80845d3b3b6e1da49a446e8e\"\n\nlazy-req@^1.0.0:\n  version \"1.1.0\"\n  resolved \"https://registry.yarnpkg.com/lazy-req/-/lazy-req-1.1.0.tgz#bdaebead30f8d824039ce0ce149d4daa07ba1fac\"\n\nlazystream@^1.0.0:\n  version \"1.0.0\"\n  resolved \"https://registry.yarnpkg.com/lazystream/-/lazystream-1.0.0.tgz#f6995fe0f820392f61396be89462407bb77168e4\"\n  dependencies:\n    readable-stream \"^2.0.5\"\n\nlcid@^1.0.0:\n  version \"1.0.0\"\n  resolved \"https://registry.yarnpkg.com/lcid/-/lcid-1.0.0.tgz#308accafa0bc483a3867b4b6f2b9506251d1b835\"\n  dependencies:\n    invert-kv \"^1.0.0\"\n\nlead@^1.0.0:\n  version \"1.0.0\"\n  resolved \"https://registry.yarnpkg.com/lead/-/lead-1.0.0.tgz#6f14f99a37be3a9dd784f5495690e5903466ee42\"\n  dependencies:\n    flush-write-stream \"^1.0.2\"\n\n\"less@2.6.x || ^2.7.1\":\n  version \"2.7.3\"\n  resolved \"https://registry.yarnpkg.com/less/-/less-2.7.3.tgz#cc1260f51c900a9ec0d91fb6998139e02507b63b\"\n  optionalDependencies:\n    errno \"^0.1.1\"\n    graceful-fs \"^4.1.2\"\n    image-size \"~0.5.0\"\n    mime \"^1.2.11\"\n    mkdirp \"^0.5.0\"\n    promise \"^7.1.1\"\n    request \"2.81.0\"\n    source-map \"^0.5.3\"\n\nliftoff@^2.5.0:\n  version \"2.5.0\"\n  resolved \"https://registry.yarnpkg.com/liftoff/-/liftoff-2.5.0.tgz#2009291bb31cea861bbf10a7c15a28caf75c31ec\"\n  dependencies:\n    extend \"^3.0.0\"\n    findup-sync \"^2.0.0\"\n    fined \"^1.0.1\"\n    flagged-respawn \"^1.0.0\"\n    is-plain-object \"^2.0.4\"\n    object.map \"^1.0.0\"\n    rechoir \"^0.6.2\"\n    resolve \"^1.1.7\"\n\nlimiter@^1.0.5:\n  version \"1.1.3\"\n  resolved \"https://registry.yarnpkg.com/limiter/-/limiter-1.1.3.tgz#32e2eb55b2324076943e5d04c1185ffb387968ef\"\n\nload-bmfont@^1.2.3:\n  version \"1.3.0\"\n  resolved \"https://registry.yarnpkg.com/load-bmfont/-/load-bmfont-1.3.0.tgz#bb7e7c710de6bcafcb13cb3b8c81e0c0131ecbc9\"\n  dependencies:\n    buffer-equal \"0.0.1\"\n    mime \"^1.3.4\"\n    parse-bmfont-ascii \"^1.0.3\"\n    parse-bmfont-binary \"^1.0.5\"\n    parse-bmfont-xml \"^1.1.0\"\n    xhr \"^2.0.1\"\n    xtend \"^4.0.0\"\n\nload-json-file@^1.0.0:\n  version \"1.1.0\"\n  resolved \"https://registry.yarnpkg.com/load-json-file/-/load-json-file-1.1.0.tgz#956905708d58b4bab4c2261b04f59f31c99374c0\"\n  dependencies:\n    graceful-fs \"^4.1.2\"\n    parse-json \"^2.2.0\"\n    pify \"^2.0.0\"\n    pinkie-promise \"^2.0.0\"\n    strip-bom \"^2.0.0\"\n\nloader-runner@^2.3.0:\n  version \"2.3.0\"\n  resolved \"https://registry.yarnpkg.com/loader-runner/-/loader-runner-2.3.0.tgz#f482aea82d543e07921700d5a46ef26fdac6b8a2\"\n\nloader-utils@^0.2.11, loader-utils@^0.2.16:\n  version \"0.2.17\"\n  resolved \"https://registry.yarnpkg.com/loader-utils/-/loader-utils-0.2.17.tgz#f86e6374d43205a6e6c60e9196f17c0299bfb348\"\n  dependencies:\n    big.js \"^3.1.3\"\n    emojis-list \"^2.0.0\"\n    json5 \"^0.5.0\"\n    object-assign \"^4.0.1\"\n\nlocaltunnel@1.9.0:\n  version \"1.9.0\"\n  resolved \"https://registry.yarnpkg.com/localtunnel/-/localtunnel-1.9.0.tgz#8ffecdcf8c8a14f62df1056cf9d54acbb0bb9a8f\"\n  dependencies:\n    axios \"0.17.1\"\n    debug \"2.6.8\"\n    openurl \"1.1.1\"\n    yargs \"6.6.0\"\n\nlocate-path@^2.0.0:\n  version \"2.0.0\"\n  resolved \"https://registry.yarnpkg.com/locate-path/-/locate-path-2.0.0.tgz#2b568b265eec944c6d9c0de9c3dbbbca0354cd8e\"\n  dependencies:\n    p-locate \"^2.0.0\"\n    path-exists \"^3.0.0\"\n\nlodash._arraymap@^3.0.0:\n  version \"3.0.0\"\n  resolved \"https://registry.yarnpkg.com/lodash._arraymap/-/lodash._arraymap-3.0.0.tgz#1a8fd0f4c0df4b61dea076d717cdc97f0a3c3e66\"\n\nlodash._basecallback@^3.0.0:\n  version \"3.3.1\"\n  resolved \"https://registry.yarnpkg.com/lodash._basecallback/-/lodash._basecallback-3.3.1.tgz#b7b2bb43dc2160424a21ccf26c57e443772a8e27\"\n  dependencies:\n    lodash._baseisequal \"^3.0.0\"\n    lodash._bindcallback \"^3.0.0\"\n    lodash.isarray \"^3.0.0\"\n    lodash.pairs \"^3.0.0\"\n\nlodash._basecopy@^3.0.0:\n  version \"3.0.1\"\n  resolved \"https://registry.yarnpkg.com/lodash._basecopy/-/lodash._basecopy-3.0.1.tgz#8da0e6a876cf344c0ad8a54882111dd3c5c7ca36\"\n\nlodash._baseeach@^3.0.0:\n  version \"3.0.4\"\n  resolved \"https://registry.yarnpkg.com/lodash._baseeach/-/lodash._baseeach-3.0.4.tgz#cf8706572ca144e8d9d75227c990da982f932af3\"\n  dependencies:\n    lodash.keys \"^3.0.0\"\n\nlodash._baseget@^3.0.0:\n  version \"3.7.2\"\n  resolved \"https://registry.yarnpkg.com/lodash._baseget/-/lodash._baseget-3.7.2.tgz#1b6ae1d5facf3c25532350a13c1197cb8bb674f4\"\n\nlodash._baseisequal@^3.0.0:\n  version \"3.0.7\"\n  resolved \"https://registry.yarnpkg.com/lodash._baseisequal/-/lodash._baseisequal-3.0.7.tgz#d8025f76339d29342767dcc887ce5cb95a5b51f1\"\n  dependencies:\n    lodash.isarray \"^3.0.0\"\n    lodash.istypedarray \"^3.0.0\"\n    lodash.keys \"^3.0.0\"\n\nlodash._basetostring@^3.0.0:\n  version \"3.0.1\"\n  resolved \"https://registry.yarnpkg.com/lodash._basetostring/-/lodash._basetostring-3.0.1.tgz#d1861d877f824a52f669832dcaf3ee15566a07d5\"\n\nlodash._basevalues@^3.0.0:\n  version \"3.0.0\"\n  resolved \"https://registry.yarnpkg.com/lodash._basevalues/-/lodash._basevalues-3.0.0.tgz#5b775762802bde3d3297503e26300820fdf661b7\"\n\nlodash._bindcallback@^3.0.0:\n  version \"3.0.1\"\n  resolved \"https://registry.yarnpkg.com/lodash._bindcallback/-/lodash._bindcallback-3.0.1.tgz#e531c27644cf8b57a99e17ed95b35c748789392e\"\n\nlodash._getnative@^3.0.0:\n  version \"3.9.1\"\n  resolved \"https://registry.yarnpkg.com/lodash._getnative/-/lodash._getnative-3.9.1.tgz#570bc7dede46d61cdcde687d65d3eecbaa3aaff5\"\n\nlodash._isiterateecall@^3.0.0:\n  version \"3.0.9\"\n  resolved \"https://registry.yarnpkg.com/lodash._isiterateecall/-/lodash._isiterateecall-3.0.9.tgz#5203ad7ba425fae842460e696db9cf3e6aac057c\"\n\nlodash._reescape@^3.0.0:\n  version \"3.0.0\"\n  resolved \"https://registry.yarnpkg.com/lodash._reescape/-/lodash._reescape-3.0.0.tgz#2b1d6f5dfe07c8a355753e5f27fac7f1cde1616a\"\n\nlodash._reevaluate@^3.0.0:\n  version \"3.0.0\"\n  resolved \"https://registry.yarnpkg.com/lodash._reevaluate/-/lodash._reevaluate-3.0.0.tgz#58bc74c40664953ae0b124d806996daca431e2ed\"\n\nlodash._reinterpolate@^3.0.0:\n  version \"3.0.0\"\n  resolved \"https://registry.yarnpkg.com/lodash._reinterpolate/-/lodash._reinterpolate-3.0.0.tgz#0ccf2d89166af03b3663c796538b75ac6e114d9d\"\n\nlodash._root@^3.0.0:\n  version \"3.0.1\"\n  resolved \"https://registry.yarnpkg.com/lodash._root/-/lodash._root-3.0.1.tgz#fba1c4524c19ee9a5f8136b4609f017cf4ded692\"\n\nlodash._topath@^3.0.0:\n  version \"3.8.1\"\n  resolved \"https://registry.yarnpkg.com/lodash._topath/-/lodash._topath-3.8.1.tgz#3ec5e2606014f4cb97f755fe6914edd8bfc00eac\"\n  dependencies:\n    lodash.isarray \"^3.0.0\"\n\nlodash.assign@^4.2.0:\n  version \"4.2.0\"\n  resolved \"https://registry.yarnpkg.com/lodash.assign/-/lodash.assign-4.2.0.tgz#0d99f3ccd7a6d261d19bdaeb9245005d285808e7\"\n\nlodash.assignin@^4.0.9:\n  version \"4.2.0\"\n  resolved \"https://registry.yarnpkg.com/lodash.assignin/-/lodash.assignin-4.2.0.tgz#ba8df5fb841eb0a3e8044232b0e263a8dc6a28a2\"\n\nlodash.bind@^4.1.4:\n  version \"4.2.1\"\n  resolved \"https://registry.yarnpkg.com/lodash.bind/-/lodash.bind-4.2.1.tgz#7ae3017e939622ac31b7d7d7dcb1b34db1690d35\"\n\nlodash.clone@^4.3.2:\n  version \"4.5.0\"\n  resolved \"https://registry.yarnpkg.com/lodash.clone/-/lodash.clone-4.5.0.tgz#195870450f5a13192478df4bc3d23d2dea1907b6\"\n\nlodash.clonedeep@^4.3.2:\n  version \"4.5.0\"\n  resolved \"https://registry.yarnpkg.com/lodash.clonedeep/-/lodash.clonedeep-4.5.0.tgz#e23f3f9c4f8fbdde872529c1071857a086e5ccef\"\n\nlodash.debounce@^4.0.8:\n  version \"4.0.8\"\n  resolved \"https://registry.yarnpkg.com/lodash.debounce/-/lodash.debounce-4.0.8.tgz#82d79bff30a67c4005ffd5e2515300ad9ca4d7af\"\n\nlodash.defaults@^4.0.1:\n  version \"4.2.0\"\n  resolved \"https://registry.yarnpkg.com/lodash.defaults/-/lodash.defaults-4.2.0.tgz#d09178716ffea4dde9e5fb7b37f6f0802274580c\"\n\nlodash.escape@^3.0.0:\n  version \"3.2.0\"\n  resolved \"https://registry.yarnpkg.com/lodash.escape/-/lodash.escape-3.2.0.tgz#995ee0dc18c1b48cc92effae71a10aab5b487698\"\n  dependencies:\n    lodash._root \"^3.0.0\"\n\nlodash.filter@^4.4.0:\n  version \"4.6.0\"\n  resolved \"https://registry.yarnpkg.com/lodash.filter/-/lodash.filter-4.6.0.tgz#668b1d4981603ae1cc5a6fa760143e480b4c4ace\"\n\nlodash.flatten@^4.2.0:\n  version \"4.4.0\"\n  resolved \"https://registry.yarnpkg.com/lodash.flatten/-/lodash.flatten-4.4.0.tgz#f31c22225a9632d2bbf8e4addbef240aa765a61f\"\n\nlodash.foreach@^4.3.0:\n  version \"4.5.0\"\n  resolved \"https://registry.yarnpkg.com/lodash.foreach/-/lodash.foreach-4.5.0.tgz#1a6a35eace401280c7f06dddec35165ab27e3e53\"\n\nlodash.isarguments@^3.0.0:\n  version \"3.1.0\"\n  resolved \"https://registry.yarnpkg.com/lodash.isarguments/-/lodash.isarguments-3.1.0.tgz#2f573d85c6a24289ff00663b491c1d338ff3458a\"\n\nlodash.isarray@^3.0.0:\n  version \"3.0.4\"\n  resolved \"https://registry.yarnpkg.com/lodash.isarray/-/lodash.isarray-3.0.4.tgz#79e4eb88c36a8122af86f844aa9bcd851b5fbb55\"\n\nlodash.isequal@^4.0.0:\n  version \"4.5.0\"\n  resolved \"https://registry.yarnpkg.com/lodash.isequal/-/lodash.isequal-4.5.0.tgz#415c4478f2bcc30120c22ce10ed3226f7d3e18e0\"\n\nlodash.isfinite@^3.3.2:\n  version \"3.3.2\"\n  resolved \"https://registry.yarnpkg.com/lodash.isfinite/-/lodash.isfinite-3.3.2.tgz#fb89b65a9a80281833f0b7478b3a5104f898ebb3\"\n\nlodash.istypedarray@^3.0.0:\n  version \"3.0.6\"\n  resolved \"https://registry.yarnpkg.com/lodash.istypedarray/-/lodash.istypedarray-3.0.6.tgz#c9a477498607501d8e8494d283b87c39281cef62\"\n\nlodash.keys@^3.0.0:\n  version \"3.1.2\"\n  resolved \"https://registry.yarnpkg.com/lodash.keys/-/lodash.keys-3.1.2.tgz#4dbc0472b156be50a0b286855d1bd0b0c656098a\"\n  dependencies:\n    lodash._getnative \"^3.0.0\"\n    lodash.isarguments \"^3.0.0\"\n    lodash.isarray \"^3.0.0\"\n\nlodash.map@^3.0.0:\n  version \"3.1.4\"\n  resolved \"https://registry.yarnpkg.com/lodash.map/-/lodash.map-3.1.4.tgz#b483acd1b786c5c7b492c495f7b5266229bc00c2\"\n  dependencies:\n    lodash._arraymap \"^3.0.0\"\n    lodash._basecallback \"^3.0.0\"\n    lodash._baseeach \"^3.0.0\"\n    lodash.isarray \"^3.0.0\"\n    lodash.keys \"^3.0.0\"\n\nlodash.map@^4.4.0:\n  version \"4.6.0\"\n  resolved \"https://registry.yarnpkg.com/lodash.map/-/lodash.map-4.6.0.tgz#771ec7839e3473d9c4cde28b19394c3562f4f6d3\"\n\nlodash.memoize@^4.1.2:\n  version \"4.1.2\"\n  resolved \"https://registry.yarnpkg.com/lodash.memoize/-/lodash.memoize-4.1.2.tgz#bcc6c49a42a2840ed997f323eada5ecd182e0bfe\"\n\nlodash.merge@^4.4.0:\n  version \"4.6.1\"\n  resolved \"https://registry.yarnpkg.com/lodash.merge/-/lodash.merge-4.6.1.tgz#adc25d9cb99b9391c59624f379fbba60d7111d54\"\n\nlodash.pairs@^3.0.0:\n  version \"3.0.1\"\n  resolved \"https://registry.yarnpkg.com/lodash.pairs/-/lodash.pairs-3.0.1.tgz#bbe08d5786eeeaa09a15c91ebf0dcb7d2be326a9\"\n  dependencies:\n    lodash.keys \"^3.0.0\"\n\nlodash.partialright@^4.1.4:\n  version \"4.2.1\"\n  resolved \"https://registry.yarnpkg.com/lodash.partialright/-/lodash.partialright-4.2.1.tgz#0130d80e83363264d40074f329b8a3e7a8a1cc4b\"\n\nlodash.pick@^4.2.1:\n  version \"4.4.0\"\n  resolved \"https://registry.yarnpkg.com/lodash.pick/-/lodash.pick-4.4.0.tgz#52f05610fff9ded422611441ed1fc123a03001b3\"\n\nlodash.pluck@^3.1.2:\n  version \"3.1.2\"\n  resolved \"https://registry.yarnpkg.com/lodash.pluck/-/lodash.pluck-3.1.2.tgz#b347f0374c0169f0eeb04d672d89cec8632c2231\"\n  dependencies:\n    lodash._baseget \"^3.0.0\"\n    lodash._topath \"^3.0.0\"\n    lodash.isarray \"^3.0.0\"\n    lodash.map \"^3.0.0\"\n\nlodash.reduce@^4.4.0:\n  version \"4.6.0\"\n  resolved \"https://registry.yarnpkg.com/lodash.reduce/-/lodash.reduce-4.6.0.tgz#f1ab6b839299ad48f784abbf476596f03b914d3b\"\n\nlodash.reject@^4.4.0:\n  version \"4.6.0\"\n  resolved \"https://registry.yarnpkg.com/lodash.reject/-/lodash.reject-4.6.0.tgz#80d6492dc1470864bbf583533b651f42a9f52415\"\n\nlodash.restparam@^3.0.0:\n  version \"3.6.1\"\n  resolved \"https://registry.yarnpkg.com/lodash.restparam/-/lodash.restparam-3.6.1.tgz#936a4e309ef330a7645ed4145986c85ae5b20805\"\n\nlodash.some@^4.2.2, lodash.some@^4.4.0:\n  version \"4.6.0\"\n  resolved \"https://registry.yarnpkg.com/lodash.some/-/lodash.some-4.6.0.tgz#1bb9f314ef6b8baded13b549169b2a945eb68e4d\"\n\nlodash.template@^3.0.0:\n  version \"3.6.2\"\n  resolved \"https://registry.yarnpkg.com/lodash.template/-/lodash.template-3.6.2.tgz#f8cdecc6169a255be9098ae8b0c53d378931d14f\"\n  dependencies:\n    lodash._basecopy \"^3.0.0\"\n    lodash._basetostring \"^3.0.0\"\n    lodash._basevalues \"^3.0.0\"\n    lodash._isiterateecall \"^3.0.0\"\n    lodash._reinterpolate \"^3.0.0\"\n    lodash.escape \"^3.0.0\"\n    lodash.keys \"^3.0.0\"\n    lodash.restparam \"^3.0.0\"\n    lodash.templatesettings \"^3.0.0\"\n\nlodash.templatesettings@^3.0.0:\n  version \"3.1.1\"\n  resolved \"https://registry.yarnpkg.com/lodash.templatesettings/-/lodash.templatesettings-3.1.1.tgz#fb307844753b66b9f1afa54e262c745307dba8e5\"\n  dependencies:\n    lodash._reinterpolate \"^3.0.0\"\n    lodash.escape \"^3.0.0\"\n\nlodash.uniq@^4.3.0, lodash.uniq@^4.5.0:\n  version \"4.5.0\"\n  resolved \"https://registry.yarnpkg.com/lodash.uniq/-/lodash.uniq-4.5.0.tgz#d0225373aeb652adc1bc82e4945339a842754773\"\n\nlodash@^3.10.1, lodash@^3.5.0:\n  version \"3.10.1\"\n  resolved \"https://registry.yarnpkg.com/lodash/-/lodash-3.10.1.tgz#5bf45e8e49ba4189e17d482789dfd15bd140b7b6\"\n\nlodash@^4.0.0, lodash@^4.17.10, lodash@^4.17.4, lodash@^4.17.5, lodash@^4.5.1, lodash@~4.17.10:\n  version \"4.17.10\"\n  resolved \"https://registry.yarnpkg.com/lodash/-/lodash-4.17.10.tgz#1b7793cf7259ea38fb3661d4d38b3260af8ae4e7\"\n\nlodash@~1.0.1:\n  version \"1.0.2\"\n  resolved \"https://registry.yarnpkg.com/lodash/-/lodash-1.0.2.tgz#8f57560c83b59fc270bd3d561b690043430e2551\"\n\nlogalot@^2.0.0:\n  version \"2.1.0\"\n  resolved \"https://registry.yarnpkg.com/logalot/-/logalot-2.1.0.tgz#5f8e8c90d304edf12530951a5554abb8c5e3f552\"\n  dependencies:\n    figures \"^1.3.5\"\n    squeak \"^1.0.0\"\n\nlongest@^1.0.0, longest@^1.0.1:\n  version \"1.0.1\"\n  resolved \"https://registry.yarnpkg.com/longest/-/longest-1.0.1.tgz#30a0b2da38f73770e8294a0d22e6625ed77d0097\"\n\nloose-envify@^1.0.0:\n  version \"1.4.0\"\n  resolved \"https://registry.yarnpkg.com/loose-envify/-/loose-envify-1.4.0.tgz#71ee51fa7be4caec1a63839f7e682d8132d30caf\"\n  dependencies:\n    js-tokens \"^3.0.0 || ^4.0.0\"\n\nloud-rejection@^1.0.0:\n  version \"1.6.0\"\n  resolved \"https://registry.yarnpkg.com/loud-rejection/-/loud-rejection-1.6.0.tgz#5b46f80147edee578870f086d04821cf998e551f\"\n  dependencies:\n    currently-unhandled \"^0.4.1\"\n    signal-exit \"^3.0.0\"\n\nlowercase-keys@^1.0.0:\n  version \"1.0.1\"\n  resolved \"https://registry.yarnpkg.com/lowercase-keys/-/lowercase-keys-1.0.1.tgz#6f9e30b47084d971a7c820ff15a6c5167b74c26f\"\n\nlpad-align@^1.0.1:\n  version \"1.1.2\"\n  resolved \"https://registry.yarnpkg.com/lpad-align/-/lpad-align-1.1.2.tgz#21f600ac1c3095c3c6e497ee67271ee08481fe9e\"\n  dependencies:\n    get-stdin \"^4.0.1\"\n    indent-string \"^2.1.0\"\n    longest \"^1.0.0\"\n    meow \"^3.3.0\"\n\nlru-cache@2:\n  version \"2.7.3\"\n  resolved \"https://registry.yarnpkg.com/lru-cache/-/lru-cache-2.7.3.tgz#6d4524e8b955f95d4f5b58851ce21dd72fb4e952\"\n\nlru-cache@^4.0.1:\n  version \"4.1.3\"\n  resolved \"https://registry.yarnpkg.com/lru-cache/-/lru-cache-4.1.3.tgz#a1175cf3496dfc8436c156c334b4955992bce69c\"\n  dependencies:\n    pseudomap \"^1.0.2\"\n    yallist \"^2.1.2\"\n\nmake-iterator@^1.0.0:\n  version \"1.0.1\"\n  resolved \"https://registry.yarnpkg.com/make-iterator/-/make-iterator-1.0.1.tgz#29b33f312aa8f547c4a5e490f56afcec99133ad6\"\n  dependencies:\n    kind-of \"^6.0.2\"\n\nmap-cache@^0.2.0, map-cache@^0.2.2:\n  version \"0.2.2\"\n  resolved \"https://registry.yarnpkg.com/map-cache/-/map-cache-0.2.2.tgz#c32abd0bd6525d9b051645bb4f26ac5dc98a0dbf\"\n\nmap-obj@^1.0.0, map-obj@^1.0.1:\n  version \"1.0.1\"\n  resolved \"https://registry.yarnpkg.com/map-obj/-/map-obj-1.0.1.tgz#d933ceb9205d82bdcf4886f6742bdc2b4dea146d\"\n\nmap-visit@^1.0.0:\n  version \"1.0.0\"\n  resolved \"https://registry.yarnpkg.com/map-visit/-/map-visit-1.0.0.tgz#ecdca8f13144e660f1b5bd41f12f3479d98dfb8f\"\n  dependencies:\n    object-visit \"^1.0.0\"\n\nmatchdep@^2.0.0:\n  version \"2.0.0\"\n  resolved \"https://registry.yarnpkg.com/matchdep/-/matchdep-2.0.0.tgz#c6f34834a0d8dbc3b37c27ee8bbcb27c7775582e\"\n  dependencies:\n    findup-sync \"^2.0.0\"\n    micromatch \"^3.0.4\"\n    resolve \"^1.4.0\"\n    stack-trace \"0.0.10\"\n\nmath-expression-evaluator@^1.2.14:\n  version \"1.2.17\"\n  resolved \"https://registry.yarnpkg.com/math-expression-evaluator/-/math-expression-evaluator-1.2.17.tgz#de819fdbcd84dccd8fae59c6aeb79615b9d266ac\"\n\nmath-random@^1.0.1:\n  version \"1.0.1\"\n  resolved \"https://registry.yarnpkg.com/math-random/-/math-random-1.0.1.tgz#8b3aac588b8a66e4975e3cdea67f7bb329601fac\"\n\nmd5.js@^1.3.4:\n  version \"1.3.4\"\n  resolved \"https://registry.yarnpkg.com/md5.js/-/md5.js-1.3.4.tgz#e9bdbde94a20a5ac18b04340fc5764d5b09d901d\"\n  dependencies:\n    hash-base \"^3.0.0\"\n    inherits \"^2.0.1\"\n\nmdn-data@^1.0.0, mdn-data@~1.1.0:\n  version \"1.1.4\"\n  resolved \"https://registry.yarnpkg.com/mdn-data/-/mdn-data-1.1.4.tgz#50b5d4ffc4575276573c4eedb8780812a8419f01\"\n\nmem@^1.1.0:\n  version \"1.1.0\"\n  resolved \"https://registry.yarnpkg.com/mem/-/mem-1.1.0.tgz#5edd52b485ca1d900fe64895505399a0dfa45f76\"\n  dependencies:\n    mimic-fn \"^1.0.0\"\n\nmemory-fs@^0.2.0:\n  version \"0.2.0\"\n  resolved \"https://registry.yarnpkg.com/memory-fs/-/memory-fs-0.2.0.tgz#f2bb25368bc121e391c2520de92969caee0a0290\"\n\nmemory-fs@^0.3.0, memory-fs@~0.3.0:\n  version \"0.3.0\"\n  resolved \"https://registry.yarnpkg.com/memory-fs/-/memory-fs-0.3.0.tgz#7bcc6b629e3a43e871d7e29aca6ae8a7f15cbb20\"\n  dependencies:\n    errno \"^0.1.3\"\n    readable-stream \"^2.0.1\"\n\nmemory-fs@^0.4.0, memory-fs@~0.4.1:\n  version \"0.4.1\"\n  resolved \"https://registry.yarnpkg.com/memory-fs/-/memory-fs-0.4.1.tgz#3a9a20b8462523e447cfbc7e8bb80ed667bfc552\"\n  dependencies:\n    errno \"^0.1.3\"\n    readable-stream \"^2.0.1\"\n\nmeow@^2.0.0:\n  version \"2.1.0\"\n  resolved \"https://registry.yarnpkg.com/meow/-/meow-2.1.0.tgz#3a63f77977c150c16fd84484d0cef677c4182799\"\n  dependencies:\n    camelcase-keys \"^1.0.0\"\n    indent-string \"^1.1.0\"\n    minimist \"^1.1.0\"\n    object-assign \"^2.0.0\"\n\nmeow@^3.1.0, meow@^3.3.0, meow@^3.5.0, meow@^3.7.0:\n  version \"3.7.0\"\n  resolved \"https://registry.yarnpkg.com/meow/-/meow-3.7.0.tgz#72cb668b425228290abbfa856892587308a801fb\"\n  dependencies:\n    camelcase-keys \"^2.0.0\"\n    decamelize \"^1.1.2\"\n    loud-rejection \"^1.0.0\"\n    map-obj \"^1.0.1\"\n    minimist \"^1.1.3\"\n    normalize-package-data \"^2.3.4\"\n    object-assign \"^4.0.1\"\n    read-pkg-up \"^1.0.1\"\n    redent \"^1.0.0\"\n    trim-newlines \"^1.0.0\"\n\nmerge-stream@^1.0.0:\n  version \"1.0.1\"\n  resolved \"https://registry.yarnpkg.com/merge-stream/-/merge-stream-1.0.1.tgz#4041202d508a342ba00174008df0c251b8c135e1\"\n  dependencies:\n    readable-stream \"^2.0.1\"\n\nmerge@^1.2.0:\n  version \"1.2.0\"\n  resolved \"https://registry.yarnpkg.com/merge/-/merge-1.2.0.tgz#7531e39d4949c281a66b8c5a6e0265e8b05894da\"\n\nmicromatch@2.3.11, micromatch@^2.1.5, micromatch@^2.3.7:\n  version \"2.3.11\"\n  resolved \"https://registry.yarnpkg.com/micromatch/-/micromatch-2.3.11.tgz#86677c97d1720b363431d04d0d15293bd38c1565\"\n  dependencies:\n    arr-diff \"^2.0.0\"\n    array-unique \"^0.2.1\"\n    braces \"^1.8.2\"\n    expand-brackets \"^0.1.4\"\n    extglob \"^0.3.1\"\n    filename-regex \"^2.0.0\"\n    is-extglob \"^1.0.0\"\n    is-glob \"^2.0.1\"\n    kind-of \"^3.0.2\"\n    normalize-path \"^2.0.1\"\n    object.omit \"^2.0.0\"\n    parse-glob \"^3.0.4\"\n    regex-cache \"^0.4.2\"\n\nmicromatch@^3.0.4, micromatch@^3.1.10, micromatch@^3.1.4:\n  version \"3.1.10\"\n  resolved \"https://registry.yarnpkg.com/micromatch/-/micromatch-3.1.10.tgz#70859bc95c9840952f359a068a3fc49f9ecfac23\"\n  dependencies:\n    arr-diff \"^4.0.0\"\n    array-unique \"^0.3.2\"\n    braces \"^2.3.1\"\n    define-property \"^2.0.2\"\n    extend-shallow \"^3.0.2\"\n    extglob \"^2.0.4\"\n    fragment-cache \"^0.2.1\"\n    kind-of \"^6.0.2\"\n    nanomatch \"^1.2.9\"\n    object.pick \"^1.3.0\"\n    regex-not \"^1.0.0\"\n    snapdragon \"^0.8.1\"\n    to-regex \"^3.0.2\"\n\nmiller-rabin@^4.0.0:\n  version \"4.0.1\"\n  resolved \"https://registry.yarnpkg.com/miller-rabin/-/miller-rabin-4.0.1.tgz#f080351c865b0dc562a8462966daa53543c78a4d\"\n  dependencies:\n    bn.js \"^4.0.0\"\n    brorand \"^1.0.1\"\n\nmime-db@~1.35.0:\n  version \"1.35.0\"\n  resolved \"https://registry.yarnpkg.com/mime-db/-/mime-db-1.35.0.tgz#0569d657466491283709663ad379a99b90d9ab47\"\n\nmime-types@^2.1.12, mime-types@~2.1.17, mime-types@~2.1.18, mime-types@~2.1.7:\n  version \"2.1.19\"\n  resolved \"https://registry.yarnpkg.com/mime-types/-/mime-types-2.1.19.tgz#71e464537a7ef81c15f2db9d97e913fc0ff606f0\"\n  dependencies:\n    mime-db \"~1.35.0\"\n\nmime@1.4.1:\n  version \"1.4.1\"\n  resolved \"https://registry.yarnpkg.com/mime/-/mime-1.4.1.tgz#121f9ebc49e3766f311a76e1fa1c8003c4b03aa6\"\n\nmime@^1.2.11, mime@^1.3.4:\n  version \"1.6.0\"\n  resolved \"https://registry.yarnpkg.com/mime/-/mime-1.6.0.tgz#32cd9e5c64553bd58d19a568af452acff04981b1\"\n\nmime@~1.2.11, mime@~1.2.9:\n  version \"1.2.11\"\n  resolved \"https://registry.yarnpkg.com/mime/-/mime-1.2.11.tgz#58203eed86e3a5ef17aed2b7d9ebd47f0a60dd10\"\n\nmimic-fn@^1.0.0:\n  version \"1.2.0\"\n  resolved \"https://registry.yarnpkg.com/mimic-fn/-/mimic-fn-1.2.0.tgz#820c86a39334640e99516928bd03fca88057d022\"\n\nmin-document@^2.19.0:\n  version \"2.19.0\"\n  resolved \"https://registry.yarnpkg.com/min-document/-/min-document-2.19.0.tgz#7bd282e3f5842ed295bb748cdd9f1ffa2c824685\"\n  dependencies:\n    dom-walk \"^0.1.0\"\n\nminimalistic-assert@^1.0.0, minimalistic-assert@^1.0.1:\n  version \"1.0.1\"\n  resolved \"https://registry.yarnpkg.com/minimalistic-assert/-/minimalistic-assert-1.0.1.tgz#2e194de044626d4a10e7f7fbc00ce73e83e4d5c7\"\n\nminimalistic-crypto-utils@^1.0.0, minimalistic-crypto-utils@^1.0.1:\n  version \"1.0.1\"\n  resolved \"https://registry.yarnpkg.com/minimalistic-crypto-utils/-/minimalistic-crypto-utils-1.0.1.tgz#f6c00c1c0b082246e5c4d99dfb8c7c083b2b582a\"\n\nminimatch@0.3:\n  version \"0.3.0\"\n  resolved \"https://registry.yarnpkg.com/minimatch/-/minimatch-0.3.0.tgz#275d8edaac4f1bb3326472089e7949c8394699dd\"\n  dependencies:\n    lru-cache \"2\"\n    sigmund \"~1.0.0\"\n\n\"minimatch@2 || 3\", minimatch@^3.0.2, minimatch@^3.0.3, minimatch@^3.0.4, minimatch@~3.0.2:\n  version \"3.0.4\"\n  resolved \"https://registry.yarnpkg.com/minimatch/-/minimatch-3.0.4.tgz#5166e286457f03306064be5497e8dbb0c3d32083\"\n  dependencies:\n    brace-expansion \"^1.1.7\"\n\nminimatch@^2.0.1:\n  version \"2.0.10\"\n  resolved \"https://registry.yarnpkg.com/minimatch/-/minimatch-2.0.10.tgz#8d087c39c6b38c001b97fca7ce6d0e1e80afbac7\"\n  dependencies:\n    brace-expansion \"^1.0.0\"\n\nminimatch@~0.2.11:\n  version \"0.2.14\"\n  resolved \"https://registry.yarnpkg.com/minimatch/-/minimatch-0.2.14.tgz#c74e780574f63c6f9a090e90efbe6ef53a6a756a\"\n  dependencies:\n    lru-cache \"2\"\n    sigmund \"~1.0.0\"\n\nminimist@0.0.8:\n  version \"0.0.8\"\n  resolved \"https://registry.yarnpkg.com/minimist/-/minimist-0.0.8.tgz#857fcabfc3397d2625b8228262e86aa7a011b05d\"\n\nminimist@^1.1.0, minimist@^1.1.3, minimist@^1.2.0:\n  version \"1.2.0\"\n  resolved \"https://registry.yarnpkg.com/minimist/-/minimist-1.2.0.tgz#a35008b20f41383eec1fb914f4cd5df79a264284\"\n\nminimist@~0.0.1:\n  version \"0.0.10\"\n  resolved \"https://registry.yarnpkg.com/minimist/-/minimist-0.0.10.tgz#de3f98543dbf96082be48ad1a0c7cda836301dcf\"\n\nminipass@^2.2.1, minipass@^2.3.3:\n  version \"2.3.3\"\n  resolved \"https://registry.yarnpkg.com/minipass/-/minipass-2.3.3.tgz#a7dcc8b7b833f5d368759cce544dccb55f50f233\"\n  dependencies:\n    safe-buffer \"^5.1.2\"\n    yallist \"^3.0.0\"\n\nminizlib@^1.1.0:\n  version \"1.1.0\"\n  resolved \"https://registry.yarnpkg.com/minizlib/-/minizlib-1.1.0.tgz#11e13658ce46bc3a70a267aac58359d1e0c29ceb\"\n  dependencies:\n    minipass \"^2.2.1\"\n\nmixin-deep@^1.2.0:\n  version \"1.3.1\"\n  resolved \"https://registry.yarnpkg.com/mixin-deep/-/mixin-deep-1.3.1.tgz#a49e7268dce1a0d9698e45326c5626df3543d0fe\"\n  dependencies:\n    for-in \"^1.0.2\"\n    is-extendable \"^1.0.1\"\n\nmkdirp@0.3.0:\n  version \"0.3.0\"\n  resolved \"https://registry.yarnpkg.com/mkdirp/-/mkdirp-0.3.0.tgz#1bbf5ab1ba827af23575143490426455f481fe1e\"\n\nmkdirp@0.5.1, \"mkdirp@>=0.5 0\", mkdirp@^0.5.0, mkdirp@^0.5.1, mkdirp@~0.5.0, mkdirp@~0.5.1:\n  version \"0.5.1\"\n  resolved \"https://registry.yarnpkg.com/mkdirp/-/mkdirp-0.5.1.tgz#30057438eac6cf7f8c4767f38648d6697d75c903\"\n  dependencies:\n    minimist \"0.0.8\"\n\nmocha@^2.3.3:\n  version \"2.5.3\"\n  resolved \"https://registry.yarnpkg.com/mocha/-/mocha-2.5.3.tgz#161be5bdeb496771eb9b35745050b622b5aefc58\"\n  dependencies:\n    commander \"2.3.0\"\n    debug \"2.2.0\"\n    diff \"1.4.0\"\n    escape-string-regexp \"1.0.2\"\n    glob \"3.2.11\"\n    growl \"1.9.2\"\n    jade \"0.26.3\"\n    mkdirp \"0.5.1\"\n    supports-color \"1.2.0\"\n    to-iso-string \"0.0.2\"\n\nmodify-error-event@^1.0.0:\n  version \"1.0.0\"\n  resolved \"https://registry.yarnpkg.com/modify-error-event/-/modify-error-event-1.0.0.tgz#3677c76a77164b9d81502180d5f5f9db262f1c7e\"\n  dependencies:\n    modify-event \"^1.0.0\"\n\nmodify-event@^1.0.0:\n  version \"1.0.1\"\n  resolved \"https://registry.yarnpkg.com/modify-event/-/modify-event-1.0.1.tgz#ea1314e13ff6e79389f20ad74192f621de658ad6\"\n\nms@0.7.1:\n  version \"0.7.1\"\n  resolved \"https://registry.yarnpkg.com/ms/-/ms-0.7.1.tgz#9cd13c03adbff25b65effde7ce864ee952017098\"\n\nms@2.0.0:\n  version \"2.0.0\"\n  resolved \"https://registry.yarnpkg.com/ms/-/ms-2.0.0.tgz#5608aeadfc00be6c2901df5f9861788de0d597c8\"\n\nmultipipe@^0.1.2:\n  version \"0.1.2\"\n  resolved \"https://registry.yarnpkg.com/multipipe/-/multipipe-0.1.2.tgz#2a8f2ddf70eed564dff2d57f1e1a137d9f05078b\"\n  dependencies:\n    duplexer2 \"0.0.2\"\n\nmustache@^2.3.0:\n  version \"2.3.0\"\n  resolved \"https://registry.yarnpkg.com/mustache/-/mustache-2.3.0.tgz#4028f7778b17708a489930a6e52ac3bca0da41d0\"\n\nmute-stdout@^1.0.0:\n  version \"1.0.0\"\n  resolved \"https://registry.yarnpkg.com/mute-stdout/-/mute-stdout-1.0.0.tgz#5b32ea07eb43c9ded6130434cf926f46b2a7fd4d\"\n\nnan@^2.3.2, nan@^2.9.2:\n  version \"2.10.0\"\n  resolved \"https://registry.yarnpkg.com/nan/-/nan-2.10.0.tgz#96d0cd610ebd58d4b4de9cc0c6828cda99c7548f\"\n\nnanomatch@^1.2.9:\n  version \"1.2.13\"\n  resolved \"https://registry.yarnpkg.com/nanomatch/-/nanomatch-1.2.13.tgz#b87a8aa4fc0de8fe6be88895b38983ff265bd119\"\n  dependencies:\n    arr-diff \"^4.0.0\"\n    array-unique \"^0.3.2\"\n    define-property \"^2.0.2\"\n    extend-shallow \"^3.0.2\"\n    fragment-cache \"^0.2.1\"\n    is-windows \"^1.0.2\"\n    kind-of \"^6.0.2\"\n    object.pick \"^1.3.0\"\n    regex-not \"^1.0.0\"\n    snapdragon \"^0.8.1\"\n    to-regex \"^3.0.1\"\n\nnatives@^1.1.0:\n  version \"1.1.4\"\n  resolved \"https://registry.yarnpkg.com/natives/-/natives-1.1.4.tgz#2f0f224fc9a7dd53407c7667c84cf8dbe773de58\"\n\nneedle@^2.2.1:\n  version \"2.2.1\"\n  resolved \"https://registry.yarnpkg.com/needle/-/needle-2.2.1.tgz#b5e325bd3aae8c2678902fa296f729455d1d3a7d\"\n  dependencies:\n    debug \"^2.1.2\"\n    iconv-lite \"^0.4.4\"\n    sax \"^1.2.4\"\n\nnegotiator@0.6.1:\n  version \"0.6.1\"\n  resolved \"https://registry.yarnpkg.com/negotiator/-/negotiator-0.6.1.tgz#2b327184e8992101177b28563fb5e7102acd0ca9\"\n\nneo-async@^2.5.0:\n  version \"2.5.1\"\n  resolved \"https://registry.yarnpkg.com/neo-async/-/neo-async-2.5.1.tgz#acb909e327b1e87ec9ef15f41b8a269512ad41ee\"\n\nnext-tick@1:\n  version \"1.0.0\"\n  resolved \"https://registry.yarnpkg.com/next-tick/-/next-tick-1.0.0.tgz#ca86d1fe8828169b0120208e3dc8424b9db8342c\"\n\nnode-gyp@^3.3.1:\n  version \"3.7.0\"\n  resolved \"https://registry.yarnpkg.com/node-gyp/-/node-gyp-3.7.0.tgz#789478e8f6c45e277aa014f3e28f958f286f9203\"\n  dependencies:\n    fstream \"^1.0.0\"\n    glob \"^7.0.3\"\n    graceful-fs \"^4.1.2\"\n    mkdirp \"^0.5.0\"\n    nopt \"2 || 3\"\n    npmlog \"0 || 1 || 2 || 3 || 4\"\n    osenv \"0\"\n    request \">=2.9.0 <2.82.0\"\n    rimraf \"2\"\n    semver \"~5.3.0\"\n    tar \"^2.0.0\"\n    which \"1\"\n\nnode-libs-browser@^0.7.0:\n  version \"0.7.0\"\n  resolved \"https://registry.yarnpkg.com/node-libs-browser/-/node-libs-browser-0.7.0.tgz#3e272c0819e308935e26674408d7af0e1491b83b\"\n  dependencies:\n    assert \"^1.1.1\"\n    browserify-zlib \"^0.1.4\"\n    buffer \"^4.9.0\"\n    console-browserify \"^1.1.0\"\n    constants-browserify \"^1.0.0\"\n    crypto-browserify \"3.3.0\"\n    domain-browser \"^1.1.1\"\n    events \"^1.0.0\"\n    https-browserify \"0.0.1\"\n    os-browserify \"^0.2.0\"\n    path-browserify \"0.0.0\"\n    process \"^0.11.0\"\n    punycode \"^1.2.4\"\n    querystring-es3 \"^0.2.0\"\n    readable-stream \"^2.0.5\"\n    stream-browserify \"^2.0.1\"\n    stream-http \"^2.3.1\"\n    string_decoder \"^0.10.25\"\n    timers-browserify \"^2.0.2\"\n    tty-browserify \"0.0.0\"\n    url \"^0.11.0\"\n    util \"^0.10.3\"\n    vm-browserify \"0.0.4\"\n\nnode-libs-browser@^2.0.0:\n  version \"2.1.0\"\n  resolved \"https://registry.yarnpkg.com/node-libs-browser/-/node-libs-browser-2.1.0.tgz#5f94263d404f6e44767d726901fff05478d600df\"\n  dependencies:\n    assert \"^1.1.1\"\n    browserify-zlib \"^0.2.0\"\n    buffer \"^4.3.0\"\n    console-browserify \"^1.1.0\"\n    constants-browserify \"^1.0.0\"\n    crypto-browserify \"^3.11.0\"\n    domain-browser \"^1.1.1\"\n    events \"^1.0.0\"\n    https-browserify \"^1.0.0\"\n    os-browserify \"^0.3.0\"\n    path-browserify \"0.0.0\"\n    process \"^0.11.10\"\n    punycode \"^1.2.4\"\n    querystring-es3 \"^0.2.0\"\n    readable-stream \"^2.3.3\"\n    stream-browserify \"^2.0.1\"\n    stream-http \"^2.7.2\"\n    string_decoder \"^1.0.0\"\n    timers-browserify \"^2.0.4\"\n    tty-browserify \"0.0.0\"\n    url \"^0.11.0\"\n    util \"^0.10.3\"\n    vm-browserify \"0.0.4\"\n\nnode-pre-gyp@^0.10.0:\n  version \"0.10.3\"\n  resolved \"https://registry.yarnpkg.com/node-pre-gyp/-/node-pre-gyp-0.10.3.tgz#3070040716afdc778747b61b6887bf78880b80fc\"\n  dependencies:\n    detect-libc \"^1.0.2\"\n    mkdirp \"^0.5.1\"\n    needle \"^2.2.1\"\n    nopt \"^4.0.1\"\n    npm-packlist \"^1.1.6\"\n    npmlog \"^4.0.2\"\n    rc \"^1.2.7\"\n    rimraf \"^2.6.1\"\n    semver \"^5.3.0\"\n    tar \"^4\"\n\nnode-sass@^3.4.2:\n  version \"3.13.1\"\n  resolved \"https://registry.yarnpkg.com/node-sass/-/node-sass-3.13.1.tgz#7240fbbff2396304b4223527ed3020589c004fc2\"\n  dependencies:\n    async-foreach \"^0.1.3\"\n    chalk \"^1.1.1\"\n    cross-spawn \"^3.0.0\"\n    gaze \"^1.0.0\"\n    get-stdin \"^4.0.1\"\n    glob \"^7.0.3\"\n    in-publish \"^2.0.0\"\n    lodash.assign \"^4.2.0\"\n    lodash.clonedeep \"^4.3.2\"\n    meow \"^3.7.0\"\n    mkdirp \"^0.5.1\"\n    nan \"^2.3.2\"\n    node-gyp \"^3.3.1\"\n    npmlog \"^4.0.0\"\n    request \"^2.61.0\"\n    sass-graph \"^2.1.1\"\n\nnode-status-codes@^1.0.0:\n  version \"1.0.0\"\n  resolved \"https://registry.yarnpkg.com/node-status-codes/-/node-status-codes-1.0.0.tgz#5ae5541d024645d32a58fcddc9ceecea7ae3ac2f\"\n\nnode-uuid@~1.4.0:\n  version \"1.4.8\"\n  resolved \"https://registry.yarnpkg.com/node-uuid/-/node-uuid-1.4.8.tgz#b040eb0923968afabf8d32fb1f17f1167fdab907\"\n\n\"nopt@2 || 3\":\n  version \"3.0.6\"\n  resolved \"https://registry.yarnpkg.com/nopt/-/nopt-3.0.6.tgz#c6465dbf08abcd4db359317f79ac68a646b28ff9\"\n  dependencies:\n    abbrev \"1\"\n\nnopt@^4.0.1:\n  version \"4.0.1\"\n  resolved \"https://registry.yarnpkg.com/nopt/-/nopt-4.0.1.tgz#d0d4685afd5415193c8c7505602d0d17cd64474d\"\n  dependencies:\n    abbrev \"1\"\n    osenv \"^0.1.4\"\n\nnormalize-package-data@^2.3.2, normalize-package-data@^2.3.4:\n  version \"2.4.0\"\n  resolved \"https://registry.yarnpkg.com/normalize-package-data/-/normalize-package-data-2.4.0.tgz#12f95a307d58352075a04907b84ac8be98ac012f\"\n  dependencies:\n    hosted-git-info \"^2.1.4\"\n    is-builtin-module \"^1.0.0\"\n    semver \"2 || 3 || 4 || 5\"\n    validate-npm-package-license \"^3.0.1\"\n\nnormalize-path@^2.0.0, normalize-path@^2.0.1, normalize-path@^2.1.1:\n  version \"2.1.1\"\n  resolved \"https://registry.yarnpkg.com/normalize-path/-/normalize-path-2.1.1.tgz#1ab28b556e198363a8c1a6f7e6fa20137fe6aed9\"\n  dependencies:\n    remove-trailing-separator \"^1.0.1\"\n\nnormalize-path@^3.0.0:\n  version \"3.0.0\"\n  resolved \"https://registry.yarnpkg.com/normalize-path/-/normalize-path-3.0.0.tgz#0dcd69ff23a1c9b11fd0978316644a0388216a65\"\n\nnormalize-range@^0.1.2:\n  version \"0.1.2\"\n  resolved \"https://registry.yarnpkg.com/normalize-range/-/normalize-range-0.1.2.tgz#2d10c06bdfd312ea9777695a4d28439456b75942\"\n\nnormalize-url@^1.4.0:\n  version \"1.9.1\"\n  resolved \"https://registry.yarnpkg.com/normalize-url/-/normalize-url-1.9.1.tgz#2cc0d66b31ea23036458436e3620d85954c66c3c\"\n  dependencies:\n    object-assign \"^4.0.1\"\n    prepend-http \"^1.0.0\"\n    query-string \"^4.1.0\"\n    sort-keys \"^1.0.0\"\n\nnow-and-later@^2.0.0:\n  version \"2.0.0\"\n  resolved \"https://registry.yarnpkg.com/now-and-later/-/now-and-later-2.0.0.tgz#bc61cbb456d79cb32207ce47ca05136ff2e7d6ee\"\n  dependencies:\n    once \"^1.3.2\"\n\nnpm-bundled@^1.0.1:\n  version \"1.0.3\"\n  resolved \"https://registry.yarnpkg.com/npm-bundled/-/npm-bundled-1.0.3.tgz#7e71703d973af3370a9591bafe3a63aca0be2308\"\n\nnpm-packlist@^1.1.6:\n  version \"1.1.11\"\n  resolved \"https://registry.yarnpkg.com/npm-packlist/-/npm-packlist-1.1.11.tgz#84e8c683cbe7867d34b1d357d893ce29e28a02de\"\n  dependencies:\n    ignore-walk \"^3.0.1\"\n    npm-bundled \"^1.0.1\"\n\nnpm-run-path@^2.0.0:\n  version \"2.0.2\"\n  resolved \"https://registry.yarnpkg.com/npm-run-path/-/npm-run-path-2.0.2.tgz#35a9232dfa35d7067b4cb2ddf2357b1871536c5f\"\n  dependencies:\n    path-key \"^2.0.0\"\n\n\"npmlog@0 || 1 || 2 || 3 || 4\", npmlog@^4.0.0, npmlog@^4.0.2:\n  version \"4.1.2\"\n  resolved \"https://registry.yarnpkg.com/npmlog/-/npmlog-4.1.2.tgz#08a7f2a8bf734604779a9efa4ad5cc717abb954b\"\n  dependencies:\n    are-we-there-yet \"~1.1.2\"\n    console-control-strings \"~1.1.0\"\n    gauge \"~2.7.3\"\n    set-blocking \"~2.0.0\"\n\nnth-check@^1.0.1, nth-check@~1.0.1:\n  version \"1.0.1\"\n  resolved \"https://registry.yarnpkg.com/nth-check/-/nth-check-1.0.1.tgz#9929acdf628fc2c41098deab82ac580cf149aae4\"\n  dependencies:\n    boolbase \"~1.0.0\"\n\nnum2fraction@^1.2.2:\n  version \"1.2.2\"\n  resolved \"https://registry.yarnpkg.com/num2fraction/-/num2fraction-1.2.2.tgz#6f682b6a027a4e9ddfa4564cd2589d1d4e669ede\"\n\nnumber-is-nan@^1.0.0:\n  version \"1.0.1\"\n  resolved \"https://registry.yarnpkg.com/number-is-nan/-/number-is-nan-1.0.1.tgz#097b602b53422a522c1afb8790318336941a011d\"\n\noauth-sign@~0.3.0:\n  version \"0.3.0\"\n  resolved \"https://registry.yarnpkg.com/oauth-sign/-/oauth-sign-0.3.0.tgz#cb540f93bb2b22a7d5941691a288d60e8ea9386e\"\n\noauth-sign@~0.8.1, oauth-sign@~0.8.2:\n  version \"0.8.2\"\n  resolved \"https://registry.yarnpkg.com/oauth-sign/-/oauth-sign-0.8.2.tgz#46a6ab7f0aead8deae9ec0565780b7d4efeb9d43\"\n\nobject-assign@^2.0.0:\n  version \"2.1.1\"\n  resolved \"https://registry.yarnpkg.com/object-assign/-/object-assign-2.1.1.tgz#43c36e5d569ff8e4816c4efa8be02d26967c18aa\"\n\nobject-assign@^3.0.0:\n  version \"3.0.0\"\n  resolved \"https://registry.yarnpkg.com/object-assign/-/object-assign-3.0.0.tgz#9bedd5ca0897949bca47e7ff408062d549f587f2\"\n\nobject-assign@^4.0.0, object-assign@^4.0.1, object-assign@^4.1.0:\n  version \"4.1.1\"\n  resolved \"https://registry.yarnpkg.com/object-assign/-/object-assign-4.1.1.tgz#2109adc7965887cfc05cbbd442cac8bfbb360863\"\n\nobject-assign@~0.3.1:\n  version \"0.3.1\"\n  resolved \"https://registry.yarnpkg.com/object-assign/-/object-assign-0.3.1.tgz#060e2a2a27d7c0d77ec77b78f11aa47fd88008d2\"\n\nobject-component@0.0.3:\n  version \"0.0.3\"\n  resolved \"https://registry.yarnpkg.com/object-component/-/object-component-0.0.3.tgz#f0c69aa50efc95b866c186f400a33769cb2f1291\"\n\nobject-copy@^0.1.0:\n  version \"0.1.0\"\n  resolved \"https://registry.yarnpkg.com/object-copy/-/object-copy-0.1.0.tgz#7e7d858b781bd7c991a41ba975ed3812754e998c\"\n  dependencies:\n    copy-descriptor \"^0.1.0\"\n    define-property \"^0.2.5\"\n    kind-of \"^3.0.3\"\n\nobject-keys@^1.0.11, object-keys@^1.0.8:\n  version \"1.0.12\"\n  resolved \"https://registry.yarnpkg.com/object-keys/-/object-keys-1.0.12.tgz#09c53855377575310cca62f55bb334abff7b3ed2\"\n\nobject-keys@~0.4.0:\n  version \"0.4.0\"\n  resolved \"https://registry.yarnpkg.com/object-keys/-/object-keys-0.4.0.tgz#28a6aae7428dd2c3a92f3d95f21335dd204e0336\"\n\nobject-path@^0.9.0:\n  version \"0.9.2\"\n  resolved \"https://registry.yarnpkg.com/object-path/-/object-path-0.9.2.tgz#0fd9a74fc5fad1ae3968b586bda5c632bd6c05a5\"\n\nobject-visit@^1.0.0:\n  version \"1.0.1\"\n  resolved \"https://registry.yarnpkg.com/object-visit/-/object-visit-1.0.1.tgz#f79c4493af0c5377b59fe39d395e41042dd045bb\"\n  dependencies:\n    isobject \"^3.0.0\"\n\nobject.assign@^4.0.4:\n  version \"4.1.0\"\n  resolved \"https://registry.yarnpkg.com/object.assign/-/object.assign-4.1.0.tgz#968bf1100d7956bb3ca086f006f846b3bc4008da\"\n  dependencies:\n    define-properties \"^1.1.2\"\n    function-bind \"^1.1.1\"\n    has-symbols \"^1.0.0\"\n    object-keys \"^1.0.11\"\n\nobject.defaults@^1.0.0, object.defaults@^1.1.0:\n  version \"1.1.0\"\n  resolved \"https://registry.yarnpkg.com/object.defaults/-/object.defaults-1.1.0.tgz#3a7f868334b407dea06da16d88d5cd29e435fecf\"\n  dependencies:\n    array-each \"^1.0.1\"\n    array-slice \"^1.0.0\"\n    for-own \"^1.0.0\"\n    isobject \"^3.0.0\"\n\nobject.getownpropertydescriptors@^2.0.3:\n  version \"2.0.3\"\n  resolved \"https://registry.yarnpkg.com/object.getownpropertydescriptors/-/object.getownpropertydescriptors-2.0.3.tgz#8758c846f5b407adab0f236e0986f14b051caa16\"\n  dependencies:\n    define-properties \"^1.1.2\"\n    es-abstract \"^1.5.1\"\n\nobject.map@^1.0.0:\n  version \"1.0.1\"\n  resolved \"https://registry.yarnpkg.com/object.map/-/object.map-1.0.1.tgz#cf83e59dc8fcc0ad5f4250e1f78b3b81bd801d37\"\n  dependencies:\n    for-own \"^1.0.0\"\n    make-iterator \"^1.0.0\"\n\nobject.omit@^2.0.0:\n  version \"2.0.1\"\n  resolved \"https://registry.yarnpkg.com/object.omit/-/object.omit-2.0.1.tgz#1a9c744829f39dbb858c76ca3579ae2a54ebd1fa\"\n  dependencies:\n    for-own \"^0.1.4\"\n    is-extendable \"^0.1.1\"\n\nobject.pick@^1.2.0, object.pick@^1.3.0:\n  version \"1.3.0\"\n  resolved \"https://registry.yarnpkg.com/object.pick/-/object.pick-1.3.0.tgz#87a10ac4c1694bd2e1cbf53591a66141fb5dd747\"\n  dependencies:\n    isobject \"^3.0.1\"\n\nobject.reduce@^1.0.0:\n  version \"1.0.1\"\n  resolved \"https://registry.yarnpkg.com/object.reduce/-/object.reduce-1.0.1.tgz#6fe348f2ac7fa0f95ca621226599096825bb03ad\"\n  dependencies:\n    for-own \"^1.0.0\"\n    make-iterator \"^1.0.0\"\n\nobject.values@^1.0.4:\n  version \"1.0.4\"\n  resolved \"https://registry.yarnpkg.com/object.values/-/object.values-1.0.4.tgz#e524da09b4f66ff05df457546ec72ac99f13069a\"\n  dependencies:\n    define-properties \"^1.1.2\"\n    es-abstract \"^1.6.1\"\n    function-bind \"^1.1.0\"\n    has \"^1.0.1\"\n\non-finished@~2.3.0:\n  version \"2.3.0\"\n  resolved \"https://registry.yarnpkg.com/on-finished/-/on-finished-2.3.0.tgz#20f1336481b083cd75337992a16971aa2d906947\"\n  dependencies:\n    ee-first \"1.1.1\"\n\nonce@^1.3.0, once@^1.3.1, once@^1.3.2, once@^1.3.3, once@^1.4.0:\n  version \"1.4.0\"\n  resolved \"https://registry.yarnpkg.com/once/-/once-1.4.0.tgz#583b1aa775961d4b113ac17d9c50baef9dd76bd1\"\n  dependencies:\n    wrappy \"1\"\n\nonetime@^1.0.0:\n  version \"1.1.0\"\n  resolved \"http://registry.npmjs.org/onetime/-/onetime-1.1.0.tgz#a1f7838f8314c516f05ecefcbc4ccfe04b4ed789\"\n\nopenurl@1.1.1:\n  version \"1.1.1\"\n  resolved \"https://registry.yarnpkg.com/openurl/-/openurl-1.1.1.tgz#3875b4b0ef7a52c156f0db41d4609dbb0f94b387\"\n\nopn@4.0.2:\n  version \"4.0.2\"\n  resolved \"https://registry.yarnpkg.com/opn/-/opn-4.0.2.tgz#7abc22e644dff63b0a96d5ab7f2790c0f01abc95\"\n  dependencies:\n    object-assign \"^4.0.1\"\n    pinkie-promise \"^2.0.0\"\n\noptimist@~0.6.0:\n  version \"0.6.1\"\n  resolved \"https://registry.yarnpkg.com/optimist/-/optimist-0.6.1.tgz#da3ea74686fa21a19a111c326e90eb15a0196686\"\n  dependencies:\n    minimist \"~0.0.1\"\n    wordwrap \"~0.0.2\"\n\noptional@^0.1.0:\n  version \"0.1.4\"\n  resolved \"https://registry.yarnpkg.com/optional/-/optional-0.1.4.tgz#cdb1a9bedc737d2025f690ceeb50e049444fd5b3\"\n\noptipng-bin@^3.0.0:\n  version \"3.1.4\"\n  resolved \"https://registry.yarnpkg.com/optipng-bin/-/optipng-bin-3.1.4.tgz#95d34f2c488704f6fd70606bfea0c659f1d95d84\"\n  dependencies:\n    bin-build \"^2.0.0\"\n    bin-wrapper \"^3.0.0\"\n    logalot \"^2.0.0\"\n\nordered-read-streams@^0.1.0:\n  version \"0.1.0\"\n  resolved \"https://registry.yarnpkg.com/ordered-read-streams/-/ordered-read-streams-0.1.0.tgz#fd565a9af8eb4473ba69b6ed8a34352cb552f126\"\n\nordered-read-streams@^0.3.0:\n  version \"0.3.0\"\n  resolved \"https://registry.yarnpkg.com/ordered-read-streams/-/ordered-read-streams-0.3.0.tgz#7137e69b3298bb342247a1bbee3881c80e2fd78b\"\n  dependencies:\n    is-stream \"^1.0.1\"\n    readable-stream \"^2.0.1\"\n\nordered-read-streams@^1.0.0:\n  version \"1.0.1\"\n  resolved \"https://registry.yarnpkg.com/ordered-read-streams/-/ordered-read-streams-1.0.1.tgz#77c0cb37c41525d64166d990ffad7ec6a0e1363e\"\n  dependencies:\n    readable-stream \"^2.0.1\"\n\nos-browserify@^0.2.0:\n  version \"0.2.1\"\n  resolved \"https://registry.yarnpkg.com/os-browserify/-/os-browserify-0.2.1.tgz#63fc4ccee5d2d7763d26bbf8601078e6c2e0044f\"\n\nos-browserify@^0.3.0:\n  version \"0.3.0\"\n  resolved \"https://registry.yarnpkg.com/os-browserify/-/os-browserify-0.3.0.tgz#854373c7f5c2315914fc9bfc6bd8238fdda1ec27\"\n\nos-filter-obj@^1.0.0:\n  version \"1.0.3\"\n  resolved \"https://registry.yarnpkg.com/os-filter-obj/-/os-filter-obj-1.0.3.tgz#5915330d90eced557d2d938a31c6dd214d9c63ad\"\n\nos-homedir@^1.0.0, os-homedir@^1.0.1:\n  version \"1.0.2\"\n  resolved \"https://registry.yarnpkg.com/os-homedir/-/os-homedir-1.0.2.tgz#ffbc4988336e0e833de0c168c7ef152121aa7fb3\"\n\nos-locale@^1.4.0:\n  version \"1.4.0\"\n  resolved \"https://registry.yarnpkg.com/os-locale/-/os-locale-1.4.0.tgz#20f9f17ae29ed345e8bde583b13d2009803c14d9\"\n  dependencies:\n    lcid \"^1.0.0\"\n\nos-locale@^2.0.0:\n  version \"2.1.0\"\n  resolved \"https://registry.yarnpkg.com/os-locale/-/os-locale-2.1.0.tgz#42bc2900a6b5b8bd17376c8e882b65afccf24bf2\"\n  dependencies:\n    execa \"^0.7.0\"\n    lcid \"^1.0.0\"\n    mem \"^1.1.0\"\n\nos-tmpdir@^1.0.0, os-tmpdir@^1.0.1:\n  version \"1.0.2\"\n  resolved \"https://registry.yarnpkg.com/os-tmpdir/-/os-tmpdir-1.0.2.tgz#bbe67406c79aa85c5cfec766fe5734555dfa1274\"\n\nosenv@0, osenv@^0.1.4:\n  version \"0.1.5\"\n  resolved \"https://registry.yarnpkg.com/osenv/-/osenv-0.1.5.tgz#85cdfafaeb28e8677f416e287592b5f3f49ea410\"\n  dependencies:\n    os-homedir \"^1.0.0\"\n    os-tmpdir \"^1.0.0\"\n\np-finally@^1.0.0:\n  version \"1.0.0\"\n  resolved \"https://registry.yarnpkg.com/p-finally/-/p-finally-1.0.0.tgz#3fbcfb15b899a44123b34b6dcc18b724336a2cae\"\n\np-limit@^1.1.0:\n  version \"1.3.0\"\n  resolved \"https://registry.yarnpkg.com/p-limit/-/p-limit-1.3.0.tgz#b86bd5f0c25690911c7590fcbfc2010d54b3ccb8\"\n  dependencies:\n    p-try \"^1.0.0\"\n\np-locate@^2.0.0:\n  version \"2.0.0\"\n  resolved \"https://registry.yarnpkg.com/p-locate/-/p-locate-2.0.0.tgz#20a0103b222a70c8fd39cc2e580680f3dde5ec43\"\n  dependencies:\n    p-limit \"^1.1.0\"\n\np-try@^1.0.0:\n  version \"1.0.0\"\n  resolved \"https://registry.yarnpkg.com/p-try/-/p-try-1.0.0.tgz#cbc79cdbaf8fd4228e13f621f2b1a237c1b207b3\"\n\npako@~0.2.0:\n  version \"0.2.9\"\n  resolved \"https://registry.yarnpkg.com/pako/-/pako-0.2.9.tgz#f3f7522f4ef782348da8161bad9ecfd51bf83a75\"\n\npako@~1.0.5:\n  version \"1.0.6\"\n  resolved \"https://registry.yarnpkg.com/pako/-/pako-1.0.6.tgz#0101211baa70c4bca4a0f63f2206e97b7dfaf258\"\n\nparents@^1.0.0, parents@~1.0.0:\n  version \"1.0.1\"\n  resolved \"https://registry.yarnpkg.com/parents/-/parents-1.0.1.tgz#fedd4d2bf193a77745fe71e371d73c3307d9c751\"\n  dependencies:\n    path-platform \"~0.11.15\"\n\nparse-asn1@^5.0.0:\n  version \"5.1.1\"\n  resolved \"https://registry.yarnpkg.com/parse-asn1/-/parse-asn1-5.1.1.tgz#f6bf293818332bd0dab54efb16087724745e6ca8\"\n  dependencies:\n    asn1.js \"^4.0.0\"\n    browserify-aes \"^1.0.0\"\n    create-hash \"^1.1.0\"\n    evp_bytestokey \"^1.0.0\"\n    pbkdf2 \"^3.0.3\"\n\nparse-bmfont-ascii@^1.0.3:\n  version \"1.0.6\"\n  resolved \"https://registry.yarnpkg.com/parse-bmfont-ascii/-/parse-bmfont-ascii-1.0.6.tgz#11ac3c3ff58f7c2020ab22769079108d4dfa0285\"\n\nparse-bmfont-binary@^1.0.5:\n  version \"1.0.6\"\n  resolved \"https://registry.yarnpkg.com/parse-bmfont-binary/-/parse-bmfont-binary-1.0.6.tgz#d038b476d3e9dd9db1e11a0b0e53a22792b69006\"\n\nparse-bmfont-xml@^1.1.0:\n  version \"1.1.3\"\n  resolved \"https://registry.yarnpkg.com/parse-bmfont-xml/-/parse-bmfont-xml-1.1.3.tgz#d6b66a371afd39c5007d9f0eeb262a4f2cce7b7c\"\n  dependencies:\n    xml-parse-from-string \"^1.0.0\"\n    xml2js \"^0.4.5\"\n\nparse-filepath@^1.0.1:\n  version \"1.0.2\"\n  resolved \"https://registry.yarnpkg.com/parse-filepath/-/parse-filepath-1.0.2.tgz#a632127f53aaf3d15876f5872f3ffac763d6c891\"\n  dependencies:\n    is-absolute \"^1.0.0\"\n    map-cache \"^0.2.0\"\n    path-root \"^0.1.1\"\n\nparse-glob@^3.0.4:\n  version \"3.0.4\"\n  resolved \"https://registry.yarnpkg.com/parse-glob/-/parse-glob-3.0.4.tgz#b2c376cfb11f35513badd173ef0bb6e3a388391c\"\n  dependencies:\n    glob-base \"^0.3.0\"\n    is-dotfile \"^1.0.0\"\n    is-extglob \"^1.0.0\"\n    is-glob \"^2.0.0\"\n\nparse-headers@^2.0.0:\n  version \"2.0.1\"\n  resolved \"https://registry.yarnpkg.com/parse-headers/-/parse-headers-2.0.1.tgz#6ae83a7aa25a9d9b700acc28698cd1f1ed7e9536\"\n  dependencies:\n    for-each \"^0.3.2\"\n    trim \"0.0.1\"\n\nparse-json@^2.1.0, parse-json@^2.2.0:\n  version \"2.2.0\"\n  resolved \"https://registry.yarnpkg.com/parse-json/-/parse-json-2.2.0.tgz#f480f40434ef80741f8469099f8dea18f55a4dc9\"\n  dependencies:\n    error-ex \"^1.2.0\"\n\nparse-listing@^1.1.3:\n  version \"1.1.3\"\n  resolved \"https://registry.yarnpkg.com/parse-listing/-/parse-listing-1.1.3.tgz#aa546f57fdc129cfbf9945cd4b757b14b06182dd\"\n\nparse-passwd@^1.0.0:\n  version \"1.0.0\"\n  resolved \"https://registry.yarnpkg.com/parse-passwd/-/parse-passwd-1.0.0.tgz#6d5b934a456993b23d37f40a382d6f1666a8e5c6\"\n\nparseqs@0.0.5:\n  version \"0.0.5\"\n  resolved \"https://registry.yarnpkg.com/parseqs/-/parseqs-0.0.5.tgz#d5208a3738e46766e291ba2ea173684921a8b89d\"\n  dependencies:\n    better-assert \"~1.0.0\"\n\nparseuri@0.0.5:\n  version \"0.0.5\"\n  resolved \"https://registry.yarnpkg.com/parseuri/-/parseuri-0.0.5.tgz#80204a50d4dbb779bfdc6ebe2778d90e4bce320a\"\n  dependencies:\n    better-assert \"~1.0.0\"\n\nparseurl@~1.3.2:\n  version \"1.3.2\"\n  resolved \"https://registry.yarnpkg.com/parseurl/-/parseurl-1.3.2.tgz#fc289d4ed8993119460c156253262cdc8de65bf3\"\n\npascalcase@^0.1.1:\n  version \"0.1.1\"\n  resolved \"https://registry.yarnpkg.com/pascalcase/-/pascalcase-0.1.1.tgz#b363e55e8006ca6fe21784d2db22bd15d7917f14\"\n\npath-browserify@0.0.0:\n  version \"0.0.0\"\n  resolved \"https://registry.yarnpkg.com/path-browserify/-/path-browserify-0.0.0.tgz#a0b870729aae214005b7d5032ec2cbbb0fb4451a\"\n\npath-dirname@^1.0.0:\n  version \"1.0.2\"\n  resolved \"https://registry.yarnpkg.com/path-dirname/-/path-dirname-1.0.2.tgz#cc33d24d525e099a5388c0336c6e32b9160609e0\"\n\npath-exists@^2.0.0:\n  version \"2.1.0\"\n  resolved \"https://registry.yarnpkg.com/path-exists/-/path-exists-2.1.0.tgz#0feb6c64f0fc518d9a754dd5efb62c7022761f4b\"\n  dependencies:\n    pinkie-promise \"^2.0.0\"\n\npath-exists@^3.0.0:\n  version \"3.0.0\"\n  resolved \"https://registry.yarnpkg.com/path-exists/-/path-exists-3.0.0.tgz#ce0ebeaa5f78cb18925ea7d810d7b59b010fd515\"\n\npath-is-absolute@^1.0.0, path-is-absolute@^1.0.1:\n  version \"1.0.1\"\n  resolved \"https://registry.yarnpkg.com/path-is-absolute/-/path-is-absolute-1.0.1.tgz#174b9268735534ffbc7ace6bf53a5a9e1b5c5f5f\"\n\npath-is-inside@^1.0.1:\n  version \"1.0.2\"\n  resolved \"https://registry.yarnpkg.com/path-is-inside/-/path-is-inside-1.0.2.tgz#365417dede44430d1c11af61027facf074bdfc53\"\n\npath-key@^2.0.0:\n  version \"2.0.1\"\n  resolved \"https://registry.yarnpkg.com/path-key/-/path-key-2.0.1.tgz#411cadb574c5a140d3a4b1910d40d80cc9f40b40\"\n\npath-parse@^1.0.5:\n  version \"1.0.6\"\n  resolved \"https://registry.yarnpkg.com/path-parse/-/path-parse-1.0.6.tgz#d62dbb5679405d72c4737ec58600e9ddcf06d24c\"\n\npath-platform@~0.11.15:\n  version \"0.11.15\"\n  resolved \"https://registry.yarnpkg.com/path-platform/-/path-platform-0.11.15.tgz#e864217f74c36850f0852b78dc7bf7d4a5721bf2\"\n\npath-root-regex@^0.1.0:\n  version \"0.1.2\"\n  resolved \"https://registry.yarnpkg.com/path-root-regex/-/path-root-regex-0.1.2.tgz#bfccdc8df5b12dc52c8b43ec38d18d72c04ba96d\"\n\npath-root@^0.1.1:\n  version \"0.1.1\"\n  resolved \"https://registry.yarnpkg.com/path-root/-/path-root-0.1.1.tgz#9a4a6814cac1c0cd73360a95f32083c8ea4745b7\"\n  dependencies:\n    path-root-regex \"^0.1.0\"\n\npath-type@^1.0.0:\n  version \"1.1.0\"\n  resolved \"https://registry.yarnpkg.com/path-type/-/path-type-1.1.0.tgz#59c44f7ee491da704da415da5a4070ba4f8fe441\"\n  dependencies:\n    graceful-fs \"^4.1.2\"\n    pify \"^2.0.0\"\n    pinkie-promise \"^2.0.0\"\n\npbkdf2-compat@2.0.1:\n  version \"2.0.1\"\n  resolved \"https://registry.yarnpkg.com/pbkdf2-compat/-/pbkdf2-compat-2.0.1.tgz#b6e0c8fa99494d94e0511575802a59a5c142f288\"\n\npbkdf2@^3.0.3:\n  version \"3.0.16\"\n  resolved \"https://registry.yarnpkg.com/pbkdf2/-/pbkdf2-3.0.16.tgz#7404208ec6b01b62d85bf83853a8064f8d9c2a5c\"\n  dependencies:\n    create-hash \"^1.1.2\"\n    create-hmac \"^1.1.4\"\n    ripemd160 \"^2.0.1\"\n    safe-buffer \"^5.0.1\"\n    sha.js \"^2.4.8\"\n\npend@~1.2.0:\n  version \"1.2.0\"\n  resolved \"https://registry.yarnpkg.com/pend/-/pend-1.2.0.tgz#7a57eb550a6783f9115331fcf4663d5c8e007a50\"\n\nperformance-now@^0.2.0:\n  version \"0.2.0\"\n  resolved \"https://registry.yarnpkg.com/performance-now/-/performance-now-0.2.0.tgz#33ef30c5c77d4ea21c5a53869d91b56d8f2555e5\"\n\nperformance-now@^2.1.0:\n  version \"2.1.0\"\n  resolved \"https://registry.yarnpkg.com/performance-now/-/performance-now-2.1.0.tgz#6309f4e0e5fa913ec1c69307ae364b4b377c9e7b\"\n\nphantomjs-prebuilt@^2.1.16, phantomjs-prebuilt@^2.1.7:\n  version \"2.1.16\"\n  resolved \"https://registry.yarnpkg.com/phantomjs-prebuilt/-/phantomjs-prebuilt-2.1.16.tgz#efd212a4a3966d3647684ea8ba788549be2aefef\"\n  dependencies:\n    es6-promise \"^4.0.3\"\n    extract-zip \"^1.6.5\"\n    fs-extra \"^1.0.0\"\n    hasha \"^2.2.0\"\n    kew \"^0.7.0\"\n    progress \"^1.1.8\"\n    request \"^2.81.0\"\n    request-progress \"^2.0.1\"\n    which \"^1.2.10\"\n\npify@^2.0.0:\n  version \"2.3.0\"\n  resolved \"https://registry.yarnpkg.com/pify/-/pify-2.3.0.tgz#ed141a6ac043a849ea588498e7dca8b15330e90c\"\n\npinkie-promise@^2.0.0:\n  version \"2.0.1\"\n  resolved \"https://registry.yarnpkg.com/pinkie-promise/-/pinkie-promise-2.0.1.tgz#2135d6dfa7a358c069ac9b178776288228450ffa\"\n  dependencies:\n    pinkie \"^2.0.0\"\n\npinkie@^2.0.0:\n  version \"2.0.4\"\n  resolved \"https://registry.yarnpkg.com/pinkie/-/pinkie-2.0.4.tgz#72556b80cfa0d48a974e80e77248e80ed4f7f870\"\n\npixelmatch@^4.0.0:\n  version \"4.0.2\"\n  resolved \"https://registry.yarnpkg.com/pixelmatch/-/pixelmatch-4.0.2.tgz#8f47dcec5011b477b67db03c243bc1f3085e8854\"\n  dependencies:\n    pngjs \"^3.0.0\"\n\npkg-dir@^1.0.0:\n  version \"1.0.0\"\n  resolved \"https://registry.yarnpkg.com/pkg-dir/-/pkg-dir-1.0.0.tgz#7a4b508a8d5bb2d629d447056ff4e9c9314cf3d4\"\n  dependencies:\n    find-up \"^1.0.0\"\n\nplugin-error@^0.1.2:\n  version \"0.1.2\"\n  resolved \"https://registry.yarnpkg.com/plugin-error/-/plugin-error-0.1.2.tgz#3b9bb3335ccf00f425e07437e19276967da47ace\"\n  dependencies:\n    ansi-cyan \"^0.1.1\"\n    ansi-red \"^0.1.1\"\n    arr-diff \"^1.0.1\"\n    arr-union \"^2.0.1\"\n    extend-shallow \"^1.1.2\"\n\nplugin-error@^1.0.1, plugin-error@~1.0.1:\n  version \"1.0.1\"\n  resolved \"https://registry.yarnpkg.com/plugin-error/-/plugin-error-1.0.1.tgz#77016bd8919d0ac377fdcdd0322328953ca5781c\"\n  dependencies:\n    ansi-colors \"^1.0.1\"\n    arr-diff \"^4.0.0\"\n    arr-union \"^3.1.0\"\n    extend-shallow \"^3.0.2\"\n\nplur@^2.0.0, plur@^2.1.0:\n  version \"2.1.2\"\n  resolved \"https://registry.yarnpkg.com/plur/-/plur-2.1.2.tgz#7482452c1a0f508e3e344eaec312c91c29dc655a\"\n  dependencies:\n    irregular-plurals \"^1.0.0\"\n\npngjs@^3.0.0:\n  version \"3.3.3\"\n  resolved \"https://registry.yarnpkg.com/pngjs/-/pngjs-3.3.3.tgz#85173703bde3edac8998757b96e5821d0966a21b\"\n\npngquant-bin@^3.0.0:\n  version \"3.1.1\"\n  resolved \"https://registry.yarnpkg.com/pngquant-bin/-/pngquant-bin-3.1.1.tgz#d124d98a75a9487f40c1640b4dbfcbb2bd5a1fd1\"\n  dependencies:\n    bin-build \"^2.0.0\"\n    bin-wrapper \"^3.0.0\"\n    logalot \"^2.0.0\"\n\nportscanner@2.1.1:\n  version \"2.1.1\"\n  resolved \"https://registry.yarnpkg.com/portscanner/-/portscanner-2.1.1.tgz#eabb409e4de24950f5a2a516d35ae769343fbb96\"\n  dependencies:\n    async \"1.5.2\"\n    is-number-like \"^1.0.3\"\n\nposix-character-classes@^0.1.0:\n  version \"0.1.1\"\n  resolved \"https://registry.yarnpkg.com/posix-character-classes/-/posix-character-classes-0.1.1.tgz#01eac0fe3b5af71a2a6c02feabb8c1fef7e00eab\"\n\npostcss-calc@^5.2.0:\n  version \"5.3.1\"\n  resolved \"https://registry.yarnpkg.com/postcss-calc/-/postcss-calc-5.3.1.tgz#77bae7ca928ad85716e2fda42f261bf7c1d65b5e\"\n  dependencies:\n    postcss \"^5.0.2\"\n    postcss-message-helpers \"^2.0.0\"\n    reduce-css-calc \"^1.2.6\"\n\npostcss-colormin@^2.1.8:\n  version \"2.2.2\"\n  resolved \"https://registry.yarnpkg.com/postcss-colormin/-/postcss-colormin-2.2.2.tgz#6631417d5f0e909a3d7ec26b24c8a8d1e4f96e4b\"\n  dependencies:\n    colormin \"^1.0.5\"\n    postcss \"^5.0.13\"\n    postcss-value-parser \"^3.2.3\"\n\npostcss-convert-values@^2.3.4:\n  version \"2.6.1\"\n  resolved \"https://registry.yarnpkg.com/postcss-convert-values/-/postcss-convert-values-2.6.1.tgz#bbd8593c5c1fd2e3d1c322bb925dcae8dae4d62d\"\n  dependencies:\n    postcss \"^5.0.11\"\n    postcss-value-parser \"^3.1.2\"\n\npostcss-discard-comments@^2.0.4:\n  version \"2.0.4\"\n  resolved \"https://registry.yarnpkg.com/postcss-discard-comments/-/postcss-discard-comments-2.0.4.tgz#befe89fafd5b3dace5ccce51b76b81514be00e3d\"\n  dependencies:\n    postcss \"^5.0.14\"\n\npostcss-discard-duplicates@^2.0.1:\n  version \"2.1.0\"\n  resolved \"https://registry.yarnpkg.com/postcss-discard-duplicates/-/postcss-discard-duplicates-2.1.0.tgz#b9abf27b88ac188158a5eb12abcae20263b91932\"\n  dependencies:\n    postcss \"^5.0.4\"\n\npostcss-discard-empty@^2.0.1:\n  version \"2.1.0\"\n  resolved \"https://registry.yarnpkg.com/postcss-discard-empty/-/postcss-discard-empty-2.1.0.tgz#d2b4bd9d5ced5ebd8dcade7640c7d7cd7f4f92b5\"\n  dependencies:\n    postcss \"^5.0.14\"\n\npostcss-discard-overridden@^0.1.1:\n  version \"0.1.1\"\n  resolved \"https://registry.yarnpkg.com/postcss-discard-overridden/-/postcss-discard-overridden-0.1.1.tgz#8b1eaf554f686fb288cd874c55667b0aa3668d58\"\n  dependencies:\n    postcss \"^5.0.16\"\n\npostcss-discard-unused@^2.2.1:\n  version \"2.2.3\"\n  resolved \"https://registry.yarnpkg.com/postcss-discard-unused/-/postcss-discard-unused-2.2.3.tgz#bce30b2cc591ffc634322b5fb3464b6d934f4433\"\n  dependencies:\n    postcss \"^5.0.14\"\n    uniqs \"^2.0.0\"\n\npostcss-filter-plugins@^2.0.0:\n  version \"2.0.3\"\n  resolved \"https://registry.yarnpkg.com/postcss-filter-plugins/-/postcss-filter-plugins-2.0.3.tgz#82245fdf82337041645e477114d8e593aa18b8ec\"\n  dependencies:\n    postcss \"^5.0.4\"\n\npostcss-load-config@^1.2.0:\n  version \"1.2.0\"\n  resolved \"https://registry.yarnpkg.com/postcss-load-config/-/postcss-load-config-1.2.0.tgz#539e9afc9ddc8620121ebf9d8c3673e0ce50d28a\"\n  dependencies:\n    cosmiconfig \"^2.1.0\"\n    object-assign \"^4.1.0\"\n    postcss-load-options \"^1.2.0\"\n    postcss-load-plugins \"^2.3.0\"\n\npostcss-load-options@^1.2.0:\n  version \"1.2.0\"\n  resolved \"https://registry.yarnpkg.com/postcss-load-options/-/postcss-load-options-1.2.0.tgz#b098b1559ddac2df04bc0bb375f99a5cfe2b6d8c\"\n  dependencies:\n    cosmiconfig \"^2.1.0\"\n    object-assign \"^4.1.0\"\n\npostcss-load-plugins@^2.3.0:\n  version \"2.3.0\"\n  resolved \"https://registry.yarnpkg.com/postcss-load-plugins/-/postcss-load-plugins-2.3.0.tgz#745768116599aca2f009fad426b00175049d8d92\"\n  dependencies:\n    cosmiconfig \"^2.1.1\"\n    object-assign \"^4.1.0\"\n\npostcss-merge-idents@^2.1.5:\n  version \"2.1.7\"\n  resolved \"https://registry.yarnpkg.com/postcss-merge-idents/-/postcss-merge-idents-2.1.7.tgz#4c5530313c08e1d5b3bbf3d2bbc747e278eea270\"\n  dependencies:\n    has \"^1.0.1\"\n    postcss \"^5.0.10\"\n    postcss-value-parser \"^3.1.1\"\n\npostcss-merge-longhand@^2.0.1:\n  version \"2.0.2\"\n  resolved \"https://registry.yarnpkg.com/postcss-merge-longhand/-/postcss-merge-longhand-2.0.2.tgz#23d90cd127b0a77994915332739034a1a4f3d658\"\n  dependencies:\n    postcss \"^5.0.4\"\n\npostcss-merge-rules@^2.0.3:\n  version \"2.1.2\"\n  resolved \"https://registry.yarnpkg.com/postcss-merge-rules/-/postcss-merge-rules-2.1.2.tgz#d1df5dfaa7b1acc3be553f0e9e10e87c61b5f721\"\n  dependencies:\n    browserslist \"^1.5.2\"\n    caniuse-api \"^1.5.2\"\n    postcss \"^5.0.4\"\n    postcss-selector-parser \"^2.2.2\"\n    vendors \"^1.0.0\"\n\npostcss-message-helpers@^2.0.0:\n  version \"2.0.0\"\n  resolved \"https://registry.yarnpkg.com/postcss-message-helpers/-/postcss-message-helpers-2.0.0.tgz#a4f2f4fab6e4fe002f0aed000478cdf52f9ba60e\"\n\npostcss-minify-font-values@^1.0.2:\n  version \"1.0.5\"\n  resolved \"https://registry.yarnpkg.com/postcss-minify-font-values/-/postcss-minify-font-values-1.0.5.tgz#4b58edb56641eba7c8474ab3526cafd7bbdecb69\"\n  dependencies:\n    object-assign \"^4.0.1\"\n    postcss \"^5.0.4\"\n    postcss-value-parser \"^3.0.2\"\n\npostcss-minify-gradients@^1.0.1:\n  version \"1.0.5\"\n  resolved \"https://registry.yarnpkg.com/postcss-minify-gradients/-/postcss-minify-gradients-1.0.5.tgz#5dbda11373703f83cfb4a3ea3881d8d75ff5e6e1\"\n  dependencies:\n    postcss \"^5.0.12\"\n    postcss-value-parser \"^3.3.0\"\n\npostcss-minify-params@^1.0.4:\n  version \"1.2.2\"\n  resolved \"https://registry.yarnpkg.com/postcss-minify-params/-/postcss-minify-params-1.2.2.tgz#ad2ce071373b943b3d930a3fa59a358c28d6f1f3\"\n  dependencies:\n    alphanum-sort \"^1.0.1\"\n    postcss \"^5.0.2\"\n    postcss-value-parser \"^3.0.2\"\n    uniqs \"^2.0.0\"\n\npostcss-minify-selectors@^2.0.4:\n  version \"2.1.1\"\n  resolved \"https://registry.yarnpkg.com/postcss-minify-selectors/-/postcss-minify-selectors-2.1.1.tgz#b2c6a98c0072cf91b932d1a496508114311735bf\"\n  dependencies:\n    alphanum-sort \"^1.0.2\"\n    has \"^1.0.1\"\n    postcss \"^5.0.14\"\n    postcss-selector-parser \"^2.0.0\"\n\npostcss-normalize-charset@^1.1.0:\n  version \"1.1.1\"\n  resolved \"https://registry.yarnpkg.com/postcss-normalize-charset/-/postcss-normalize-charset-1.1.1.tgz#ef9ee71212d7fe759c78ed162f61ed62b5cb93f1\"\n  dependencies:\n    postcss \"^5.0.5\"\n\npostcss-normalize-url@^3.0.7:\n  version \"3.0.8\"\n  resolved \"https://registry.yarnpkg.com/postcss-normalize-url/-/postcss-normalize-url-3.0.8.tgz#108f74b3f2fcdaf891a2ffa3ea4592279fc78222\"\n  dependencies:\n    is-absolute-url \"^2.0.0\"\n    normalize-url \"^1.4.0\"\n    postcss \"^5.0.14\"\n    postcss-value-parser \"^3.2.3\"\n\npostcss-ordered-values@^2.1.0:\n  version \"2.2.3\"\n  resolved \"https://registry.yarnpkg.com/postcss-ordered-values/-/postcss-ordered-values-2.2.3.tgz#eec6c2a67b6c412a8db2042e77fe8da43f95c11d\"\n  dependencies:\n    postcss \"^5.0.4\"\n    postcss-value-parser \"^3.0.1\"\n\npostcss-pxtorem@^3.3.1:\n  version \"3.3.1\"\n  resolved \"https://registry.yarnpkg.com/postcss-pxtorem/-/postcss-pxtorem-3.3.1.tgz#0da39bf983b3c849ae0e3c74eca7269b13ad2044\"\n  dependencies:\n    object-assign \"^4.0.1\"\n    postcss \"^5.0.2\"\n\npostcss-reduce-idents@^2.2.2:\n  version \"2.4.0\"\n  resolved \"https://registry.yarnpkg.com/postcss-reduce-idents/-/postcss-reduce-idents-2.4.0.tgz#c2c6d20cc958284f6abfbe63f7609bf409059ad3\"\n  dependencies:\n    postcss \"^5.0.4\"\n    postcss-value-parser \"^3.0.2\"\n\npostcss-reduce-initial@^1.0.0:\n  version \"1.0.1\"\n  resolved \"https://registry.yarnpkg.com/postcss-reduce-initial/-/postcss-reduce-initial-1.0.1.tgz#68f80695f045d08263a879ad240df8dd64f644ea\"\n  dependencies:\n    postcss \"^5.0.4\"\n\npostcss-reduce-transforms@^1.0.3:\n  version \"1.0.4\"\n  resolved \"https://registry.yarnpkg.com/postcss-reduce-transforms/-/postcss-reduce-transforms-1.0.4.tgz#ff76f4d8212437b31c298a42d2e1444025771ae1\"\n  dependencies:\n    has \"^1.0.1\"\n    postcss \"^5.0.8\"\n    postcss-value-parser \"^3.0.1\"\n\npostcss-selector-parser@^2.0.0, postcss-selector-parser@^2.2.2:\n  version \"2.2.3\"\n  resolved \"https://registry.yarnpkg.com/postcss-selector-parser/-/postcss-selector-parser-2.2.3.tgz#f9437788606c3c9acee16ffe8d8b16297f27bb90\"\n  dependencies:\n    flatten \"^1.0.2\"\n    indexes-of \"^1.0.1\"\n    uniq \"^1.0.1\"\n\npostcss-svgo@^2.1.1:\n  version \"2.1.6\"\n  resolved \"https://registry.yarnpkg.com/postcss-svgo/-/postcss-svgo-2.1.6.tgz#b6df18aa613b666e133f08adb5219c2684ac108d\"\n  dependencies:\n    is-svg \"^2.0.0\"\n    postcss \"^5.0.14\"\n    postcss-value-parser \"^3.2.3\"\n    svgo \"^0.7.0\"\n\npostcss-unique-selectors@^2.0.2:\n  version \"2.0.2\"\n  resolved \"https://registry.yarnpkg.com/postcss-unique-selectors/-/postcss-unique-selectors-2.0.2.tgz#981d57d29ddcb33e7b1dfe1fd43b8649f933ca1d\"\n  dependencies:\n    alphanum-sort \"^1.0.1\"\n    postcss \"^5.0.4\"\n    uniqs \"^2.0.0\"\n\npostcss-value-parser@^3.0.1, postcss-value-parser@^3.0.2, postcss-value-parser@^3.1.1, postcss-value-parser@^3.1.2, postcss-value-parser@^3.2.3, postcss-value-parser@^3.3.0:\n  version \"3.3.0\"\n  resolved \"https://registry.yarnpkg.com/postcss-value-parser/-/postcss-value-parser-3.3.0.tgz#87f38f9f18f774a4ab4c8a232f5c5ce8872a9d15\"\n\npostcss-zindex@^2.0.1:\n  version \"2.2.0\"\n  resolved \"https://registry.yarnpkg.com/postcss-zindex/-/postcss-zindex-2.2.0.tgz#d2109ddc055b91af67fc4cb3b025946639d2af22\"\n  dependencies:\n    has \"^1.0.1\"\n    postcss \"^5.0.4\"\n    uniqs \"^2.0.0\"\n\npostcss@^5.0.10, postcss@^5.0.11, postcss@^5.0.12, postcss@^5.0.13, postcss@^5.0.14, postcss@^5.0.16, postcss@^5.0.2, postcss@^5.0.4, postcss@^5.0.5, postcss@^5.0.8, postcss@^5.2.12, postcss@^5.2.16:\n  version \"5.2.18\"\n  resolved \"https://registry.yarnpkg.com/postcss/-/postcss-5.2.18.tgz#badfa1497d46244f6390f58b319830d9107853c5\"\n  dependencies:\n    chalk \"^1.1.3\"\n    js-base64 \"^2.1.9\"\n    source-map \"^0.5.6\"\n    supports-color \"^3.2.3\"\n\nposthtml-attrs-parser@^0.1.0:\n  version \"0.1.1\"\n  resolved \"https://registry.yarnpkg.com/posthtml-attrs-parser/-/posthtml-attrs-parser-0.1.1.tgz#cc33e00155fb99ba96f67e25e330461f05742ac8\"\n  dependencies:\n    object-assign \"^4.0.1\"\n\nposthtml-parser@^0.1.3:\n  version \"0.1.3\"\n  resolved \"https://registry.yarnpkg.com/posthtml-parser/-/posthtml-parser-0.1.3.tgz#43251f575ba34e361032f79a11e0fc93ab232b24\"\n  dependencies:\n    htmlparser2 \"^3.8.3\"\n\nposthtml-px2rem@^0.0.3:\n  version \"0.0.3\"\n  resolved \"https://registry.yarnpkg.com/posthtml-px2rem/-/posthtml-px2rem-0.0.3.tgz#0c98d8db5f1358802ef10189596f87f2f5f432a2\"\n  dependencies:\n    lodash \"^3.10.1\"\n    posthtml-attrs-parser \"^0.1.0\"\n\nposthtml-render@^1.0.5:\n  version \"1.1.4\"\n  resolved \"https://registry.yarnpkg.com/posthtml-render/-/posthtml-render-1.1.4.tgz#95dac09892f4f183fad5ac823f08f42c0256551e\"\n\nposthtml@^0.8.0:\n  version \"0.8.7\"\n  resolved \"https://registry.yarnpkg.com/posthtml/-/posthtml-0.8.7.tgz#aba6124c6cf87b4ceea6bab5f7e50268f2c2006d\"\n  dependencies:\n    posthtml-parser \"^0.1.3\"\n    posthtml-render \"^1.0.5\"\n\nprepend-http@^1.0.0, prepend-http@^1.0.1:\n  version \"1.0.4\"\n  resolved \"https://registry.yarnpkg.com/prepend-http/-/prepend-http-1.0.4.tgz#d4f4562b0ce3696e41ac52d0e002e57a635dc6dc\"\n\npreserve@^0.2.0:\n  version \"0.2.0\"\n  resolved \"https://registry.yarnpkg.com/preserve/-/preserve-0.2.0.tgz#815ed1f6ebc65926f865b310c0713bcb3315ce4b\"\n\npretty-bytes@^2.0.1:\n  version \"2.0.1\"\n  resolved \"https://registry.yarnpkg.com/pretty-bytes/-/pretty-bytes-2.0.1.tgz#155ec4d0036f41391e7045d6dbe4963d525d264f\"\n  dependencies:\n    get-stdin \"^4.0.1\"\n    meow \"^3.1.0\"\n    number-is-nan \"^1.0.0\"\n\npretty-hrtime@^1.0.0:\n  version \"1.0.3\"\n  resolved \"https://registry.yarnpkg.com/pretty-hrtime/-/pretty-hrtime-1.0.3.tgz#b7e3ea42435a4c9b2759d99e0f201eb195802ee1\"\n\nprettysize@^1.1.0:\n  version \"1.1.0\"\n  resolved \"https://registry.yarnpkg.com/prettysize/-/prettysize-1.1.0.tgz#c6c52f87161ff172ea435f375f99831dd9a97bb0\"\n\nprivate@^0.1.6, private@^0.1.8:\n  version \"0.1.8\"\n  resolved \"https://registry.yarnpkg.com/private/-/private-0.1.8.tgz#2381edb3689f7a53d653190060fcf822d2f368ff\"\n\nprocess-nextick-args@^1.0.7:\n  version \"1.0.7\"\n  resolved \"https://registry.yarnpkg.com/process-nextick-args/-/process-nextick-args-1.0.7.tgz#150e20b756590ad3f91093f25a4f2ad8bff30ba3\"\n\nprocess-nextick-args@^2.0.0, process-nextick-args@~2.0.0:\n  version \"2.0.0\"\n  resolved \"https://registry.yarnpkg.com/process-nextick-args/-/process-nextick-args-2.0.0.tgz#a37d732f4271b4ab1ad070d35508e8290788ffaa\"\n\nprocess@^0.11.0, process@^0.11.10:\n  version \"0.11.10\"\n  resolved \"https://registry.yarnpkg.com/process/-/process-0.11.10.tgz#7332300e840161bda3e69a1d1d91a7d4bc16f182\"\n\nprocess@~0.5.1:\n  version \"0.5.2\"\n  resolved \"https://registry.yarnpkg.com/process/-/process-0.5.2.tgz#1638d8a8e34c2f440a91db95ab9aeb677fc185cf\"\n\nprogress@^1.1.8:\n  version \"1.1.8\"\n  resolved \"https://registry.yarnpkg.com/progress/-/progress-1.1.8.tgz#e260c78f6161cdd9b0e56cc3e0a85de17c7a57be\"\n\npromise@^7.1.1:\n  version \"7.3.1\"\n  resolved \"https://registry.yarnpkg.com/promise/-/promise-7.3.1.tgz#064b72602b18f90f29192b8b1bc418ffd1ebd3bf\"\n  dependencies:\n    asap \"~2.0.3\"\n\nprr@~1.0.1:\n  version \"1.0.1\"\n  resolved \"https://registry.yarnpkg.com/prr/-/prr-1.0.1.tgz#d3fc114ba06995a45ec6893f484ceb1d78f5f476\"\n\npseudomap@^1.0.2:\n  version \"1.0.2\"\n  resolved \"https://registry.yarnpkg.com/pseudomap/-/pseudomap-1.0.2.tgz#f052a28da70e618917ef0a8ac34c1ae5a68286b3\"\n\npsl@^1.1.24:\n  version \"1.1.29\"\n  resolved \"https://registry.yarnpkg.com/psl/-/psl-1.1.29.tgz#60f580d360170bb722a797cc704411e6da850c67\"\n\npublic-encrypt@^4.0.0:\n  version \"4.0.2\"\n  resolved \"https://registry.yarnpkg.com/public-encrypt/-/public-encrypt-4.0.2.tgz#46eb9107206bf73489f8b85b69d91334c6610994\"\n  dependencies:\n    bn.js \"^4.1.0\"\n    browserify-rsa \"^4.0.0\"\n    create-hash \"^1.1.0\"\n    parse-asn1 \"^5.0.0\"\n    randombytes \"^2.0.1\"\n\npump@^2.0.0:\n  version \"2.0.1\"\n  resolved \"https://registry.yarnpkg.com/pump/-/pump-2.0.1.tgz#12399add6e4cf7526d973cbc8b5ce2e2908b3909\"\n  dependencies:\n    end-of-stream \"^1.1.0\"\n    once \"^1.3.1\"\n\npumpify@^1.3.5:\n  version \"1.5.1\"\n  resolved \"https://registry.yarnpkg.com/pumpify/-/pumpify-1.5.1.tgz#36513be246ab27570b1a374a5ce278bfd74370ce\"\n  dependencies:\n    duplexify \"^3.6.0\"\n    inherits \"^2.0.3\"\n    pump \"^2.0.0\"\n\npunycode@1.3.2:\n  version \"1.3.2\"\n  resolved \"https://registry.yarnpkg.com/punycode/-/punycode-1.3.2.tgz#9653a036fb7c1ee42342f2325cceefea3926c48d\"\n\npunycode@^1.2.4, punycode@^1.4.1:\n  version \"1.4.1\"\n  resolved \"https://registry.yarnpkg.com/punycode/-/punycode-1.4.1.tgz#c0d5a63b2718800ad8e1eb0fa5269c84dd41845e\"\n\nq@^1.1.2:\n  version \"1.5.1\"\n  resolved \"https://registry.yarnpkg.com/q/-/q-1.5.1.tgz#7e32f75b41381291d04611f1bf14109ac00651d7\"\n\nqs@6.2.3:\n  version \"6.2.3\"\n  resolved \"https://registry.yarnpkg.com/qs/-/qs-6.2.3.tgz#1cfcb25c10a9b2b483053ff39f5dfc9233908cfe\"\n\nqs@~0.6.0:\n  version \"0.6.6\"\n  resolved \"https://registry.yarnpkg.com/qs/-/qs-0.6.6.tgz#6e015098ff51968b8a3c819001d5f2c89bc4b107\"\n\nqs@~6.4.0:\n  version \"6.4.0\"\n  resolved \"https://registry.yarnpkg.com/qs/-/qs-6.4.0.tgz#13e26d28ad6b0ffaa91312cd3bf708ed351e7233\"\n\nqs@~6.5.1:\n  version \"6.5.2\"\n  resolved \"https://registry.yarnpkg.com/qs/-/qs-6.5.2.tgz#cb3ae806e8740444584ef154ce8ee98d403f3e36\"\n\nquery-string@^4.1.0:\n  version \"4.3.4\"\n  resolved \"https://registry.yarnpkg.com/query-string/-/query-string-4.3.4.tgz#bbb693b9ca915c232515b228b1a02b609043dbeb\"\n  dependencies:\n    object-assign \"^4.1.0\"\n    strict-uri-encode \"^1.0.0\"\n\nquerystring-es3@^0.2.0:\n  version \"0.2.1\"\n  resolved \"https://registry.yarnpkg.com/querystring-es3/-/querystring-es3-0.2.1.tgz#9ec61f79049875707d69414596fd907a4d711e73\"\n\nquerystring@0.2.0:\n  version \"0.2.0\"\n  resolved \"https://registry.yarnpkg.com/querystring/-/querystring-0.2.0.tgz#b209849203bb25df820da756e747005878521620\"\n\nquick-local-ip@^1.0.7:\n  version \"1.0.7\"\n  resolved \"https://registry.yarnpkg.com/quick-local-ip/-/quick-local-ip-1.0.7.tgz#4bda1029e5e6da218db702df72c24adde14aa4c7\"\n  dependencies:\n    mocha \"^2.3.3\"\n\nrandomatic@^3.0.0:\n  version \"3.0.0\"\n  resolved \"https://registry.yarnpkg.com/randomatic/-/randomatic-3.0.0.tgz#d35490030eb4f7578de292ce6dfb04a91a128923\"\n  dependencies:\n    is-number \"^4.0.0\"\n    kind-of \"^6.0.0\"\n    math-random \"^1.0.1\"\n\nrandombytes@^2.0.0, randombytes@^2.0.1, randombytes@^2.0.5:\n  version \"2.0.6\"\n  resolved \"https://registry.yarnpkg.com/randombytes/-/randombytes-2.0.6.tgz#d302c522948588848a8d300c932b44c24231da80\"\n  dependencies:\n    safe-buffer \"^5.1.0\"\n\nrandomfill@^1.0.3:\n  version \"1.0.4\"\n  resolved \"https://registry.yarnpkg.com/randomfill/-/randomfill-1.0.4.tgz#c92196fc86ab42be983f1bf31778224931d61458\"\n  dependencies:\n    randombytes \"^2.0.5\"\n    safe-buffer \"^5.1.0\"\n\nrange-parser@~1.2.0:\n  version \"1.2.0\"\n  resolved \"https://registry.yarnpkg.com/range-parser/-/range-parser-1.2.0.tgz#f49be6b487894ddc40dcc94a322f611092e00d5e\"\n\nraw-body@^2.3.2:\n  version \"2.3.3\"\n  resolved \"https://registry.yarnpkg.com/raw-body/-/raw-body-2.3.3.tgz#1b324ece6b5706e153855bc1148c65bb7f6ea0c3\"\n  dependencies:\n    bytes \"3.0.0\"\n    http-errors \"1.6.3\"\n    iconv-lite \"0.4.23\"\n    unpipe \"1.0.0\"\n\nrc@^1.1.2, rc@^1.1.6, rc@^1.2.7:\n  version \"1.2.8\"\n  resolved \"https://registry.yarnpkg.com/rc/-/rc-1.2.8.tgz#cd924bf5200a075b83c188cd6b9e211b7fc0d3ed\"\n  dependencies:\n    deep-extend \"^0.6.0\"\n    ini \"~1.3.0\"\n    minimist \"^1.2.0\"\n    strip-json-comments \"~2.0.1\"\n\nrd@^0.0.2:\n  version \"0.0.2\"\n  resolved \"https://registry.yarnpkg.com/rd/-/rd-0.0.2.tgz#883ab18b8f4f8dcbbff4dc7b6fbb4373f505196a\"\n\nread-all-stream@^3.0.0:\n  version \"3.1.0\"\n  resolved \"https://registry.yarnpkg.com/read-all-stream/-/read-all-stream-3.1.0.tgz#35c3e177f2078ef789ee4bfafa4373074eaef4fa\"\n  dependencies:\n    pinkie-promise \"^2.0.0\"\n    readable-stream \"^2.0.0\"\n\nread-chunk@^1.0.1:\n  version \"1.0.1\"\n  resolved \"https://registry.yarnpkg.com/read-chunk/-/read-chunk-1.0.1.tgz#5f68cab307e663f19993527d9b589cace4661194\"\n\nread-pkg-up@^1.0.1:\n  version \"1.0.1\"\n  resolved \"https://registry.yarnpkg.com/read-pkg-up/-/read-pkg-up-1.0.1.tgz#9d63c13276c065918d57f002a57f40a1b643fb02\"\n  dependencies:\n    find-up \"^1.0.0\"\n    read-pkg \"^1.0.0\"\n\nread-pkg@^1.0.0:\n  version \"1.1.0\"\n  resolved \"https://registry.yarnpkg.com/read-pkg/-/read-pkg-1.1.0.tgz#f5ffaa5ecd29cb31c0474bca7d756b6bb29e3f28\"\n  dependencies:\n    load-json-file \"^1.0.0\"\n    normalize-package-data \"^2.3.2\"\n    path-type \"^1.0.0\"\n\nreadable-stream@1.0.27-1:\n  version \"1.0.27-1\"\n  resolved \"https://registry.yarnpkg.com/readable-stream/-/readable-stream-1.0.27-1.tgz#6b67983c20357cefd07f0165001a16d710d91078\"\n  dependencies:\n    core-util-is \"~1.0.0\"\n    inherits \"~2.0.1\"\n    isarray \"0.0.1\"\n    string_decoder \"~0.10.x\"\n\n\"readable-stream@>=1.0.33-1 <1.1.0-0\", readable-stream@~1.0.17:\n  version \"1.0.34\"\n  resolved \"https://registry.yarnpkg.com/readable-stream/-/readable-stream-1.0.34.tgz#125820e34bc842d2f2aaafafe4c2916ee32c157c\"\n  dependencies:\n    core-util-is \"~1.0.0\"\n    inherits \"~2.0.1\"\n    isarray \"0.0.1\"\n    string_decoder \"~0.10.x\"\n\nreadable-stream@^1.0.31, readable-stream@~1.1.9:\n  version \"1.1.14\"\n  resolved \"https://registry.yarnpkg.com/readable-stream/-/readable-stream-1.1.14.tgz#7cf4c54ef648e3813084c636dd2079e166c081d9\"\n  dependencies:\n    core-util-is \"~1.0.0\"\n    inherits \"~2.0.1\"\n    isarray \"0.0.1\"\n    string_decoder \"~0.10.x\"\n\nreadable-stream@^2.0.0, readable-stream@^2.0.1, readable-stream@^2.0.2, readable-stream@^2.0.4, readable-stream@^2.0.5, readable-stream@^2.0.6, readable-stream@^2.1.5, readable-stream@^2.2.2, readable-stream@^2.3.0, readable-stream@^2.3.3, readable-stream@^2.3.5, readable-stream@^2.3.6:\n  version \"2.3.6\"\n  resolved \"https://registry.yarnpkg.com/readable-stream/-/readable-stream-2.3.6.tgz#b11c27d88b8ff1fbe070643cf94b0c79ae1b0aaf\"\n  dependencies:\n    core-util-is \"~1.0.0\"\n    inherits \"~2.0.3\"\n    isarray \"~1.0.0\"\n    process-nextick-args \"~2.0.0\"\n    safe-buffer \"~5.1.1\"\n    string_decoder \"~1.1.1\"\n    util-deprecate \"~1.0.1\"\n\nreaddirp@^2.0.0:\n  version \"2.1.0\"\n  resolved \"https://registry.yarnpkg.com/readdirp/-/readdirp-2.1.0.tgz#4ed0ad060df3073300c48440373f72d1cc642d78\"\n  dependencies:\n    graceful-fs \"^4.1.2\"\n    minimatch \"^3.0.2\"\n    readable-stream \"^2.0.2\"\n    set-immediate-shim \"^1.0.1\"\n\nreaddirp@^2.2.1:\n  version \"2.2.1\"\n  resolved \"https://registry.yarnpkg.com/readdirp/-/readdirp-2.2.1.tgz#0e87622a3325aa33e892285caf8b4e846529a525\"\n  dependencies:\n    graceful-fs \"^4.1.11\"\n    micromatch \"^3.1.10\"\n    readable-stream \"^2.0.2\"\n\nrechoir@^0.6.2:\n  version \"0.6.2\"\n  resolved \"https://registry.yarnpkg.com/rechoir/-/rechoir-0.6.2.tgz#85204b54dba82d5742e28c96756ef43af50e3384\"\n  dependencies:\n    resolve \"^1.1.6\"\n\nredent@^1.0.0:\n  version \"1.0.0\"\n  resolved \"https://registry.yarnpkg.com/redent/-/redent-1.0.0.tgz#cf916ab1fd5f1f16dfb20822dd6ec7f730c2afde\"\n  dependencies:\n    indent-string \"^2.1.0\"\n    strip-indent \"^1.0.1\"\n\nreduce-css-calc@^1.2.6:\n  version \"1.3.0\"\n  resolved \"https://registry.yarnpkg.com/reduce-css-calc/-/reduce-css-calc-1.3.0.tgz#747c914e049614a4c9cfbba629871ad1d2927716\"\n  dependencies:\n    balanced-match \"^0.4.2\"\n    math-expression-evaluator \"^1.2.14\"\n    reduce-function-call \"^1.0.1\"\n\nreduce-function-call@^1.0.1:\n  version \"1.0.2\"\n  resolved \"https://registry.yarnpkg.com/reduce-function-call/-/reduce-function-call-1.0.2.tgz#5a200bf92e0e37751752fe45b0ab330fd4b6be99\"\n  dependencies:\n    balanced-match \"^0.4.2\"\n\nregenerate@^1.2.1:\n  version \"1.4.0\"\n  resolved \"https://registry.yarnpkg.com/regenerate/-/regenerate-1.4.0.tgz#4a856ec4b56e4077c557589cae85e7a4c8869a11\"\n\nregenerator-runtime@^0.11.0:\n  version \"0.11.1\"\n  resolved \"https://registry.yarnpkg.com/regenerator-runtime/-/regenerator-runtime-0.11.1.tgz#be05ad7f9bf7d22e056f9726cee5017fbf19e2e9\"\n\nregenerator-transform@^0.10.0:\n  version \"0.10.1\"\n  resolved \"https://registry.yarnpkg.com/regenerator-transform/-/regenerator-transform-0.10.1.tgz#1e4996837231da8b7f3cf4114d71b5691a0680dd\"\n  dependencies:\n    babel-runtime \"^6.18.0\"\n    babel-types \"^6.19.0\"\n    private \"^0.1.6\"\n\nregex-cache@^0.4.2:\n  version \"0.4.4\"\n  resolved \"https://registry.yarnpkg.com/regex-cache/-/regex-cache-0.4.4.tgz#75bdc58a2a1496cec48a12835bc54c8d562336dd\"\n  dependencies:\n    is-equal-shallow \"^0.1.3\"\n\nregex-not@^1.0.0, regex-not@^1.0.2:\n  version \"1.0.2\"\n  resolved \"https://registry.yarnpkg.com/regex-not/-/regex-not-1.0.2.tgz#1f4ece27e00b0b65e0247a6810e6a85d83a5752c\"\n  dependencies:\n    extend-shallow \"^3.0.2\"\n    safe-regex \"^1.1.0\"\n\nregexpu-core@^2.0.0:\n  version \"2.0.0\"\n  resolved \"https://registry.yarnpkg.com/regexpu-core/-/regexpu-core-2.0.0.tgz#49d038837b8dcf8bfa5b9a42139938e6ea2ae240\"\n  dependencies:\n    regenerate \"^1.2.1\"\n    regjsgen \"^0.2.0\"\n    regjsparser \"^0.1.4\"\n\nregjsgen@^0.2.0:\n  version \"0.2.0\"\n  resolved \"https://registry.yarnpkg.com/regjsgen/-/regjsgen-0.2.0.tgz#6c016adeac554f75823fe37ac05b92d5a4edb1f7\"\n\nregjsparser@^0.1.4:\n  version \"0.1.5\"\n  resolved \"https://registry.yarnpkg.com/regjsparser/-/regjsparser-0.1.5.tgz#7ee8f84dc6fa792d3fd0ae228d24bd949ead205c\"\n  dependencies:\n    jsesc \"~0.5.0\"\n\nremove-bom-buffer@^3.0.0:\n  version \"3.0.0\"\n  resolved \"https://registry.yarnpkg.com/remove-bom-buffer/-/remove-bom-buffer-3.0.0.tgz#c2bf1e377520d324f623892e33c10cac2c252b53\"\n  dependencies:\n    is-buffer \"^1.1.5\"\n    is-utf8 \"^0.2.1\"\n\nremove-bom-stream@^1.2.0:\n  version \"1.2.0\"\n  resolved \"https://registry.yarnpkg.com/remove-bom-stream/-/remove-bom-stream-1.2.0.tgz#05f1a593f16e42e1fb90ebf59de8e569525f9523\"\n  dependencies:\n    remove-bom-buffer \"^3.0.0\"\n    safe-buffer \"^5.1.0\"\n    through2 \"^2.0.3\"\n\nremove-trailing-separator@^1.0.1, remove-trailing-separator@^1.1.0:\n  version \"1.1.0\"\n  resolved \"https://registry.yarnpkg.com/remove-trailing-separator/-/remove-trailing-separator-1.1.0.tgz#c24bce2a283adad5bc3f58e0d48249b92379d8ef\"\n\nrepeat-element@^1.1.2:\n  version \"1.1.2\"\n  resolved \"https://registry.yarnpkg.com/repeat-element/-/repeat-element-1.1.2.tgz#ef089a178d1483baae4d93eb98b4f9e4e11d990a\"\n\nrepeat-string@^1.5.2, repeat-string@^1.6.1:\n  version \"1.6.1\"\n  resolved \"https://registry.yarnpkg.com/repeat-string/-/repeat-string-1.6.1.tgz#8dcae470e1c88abc2d600fff4a776286da75e637\"\n\nrepeating@^1.1.0:\n  version \"1.1.3\"\n  resolved \"https://registry.yarnpkg.com/repeating/-/repeating-1.1.3.tgz#3d4114218877537494f97f77f9785fab810fa4ac\"\n  dependencies:\n    is-finite \"^1.0.0\"\n\nrepeating@^2.0.0:\n  version \"2.0.1\"\n  resolved \"https://registry.yarnpkg.com/repeating/-/repeating-2.0.1.tgz#5214c53a926d3552707527fbab415dbc08d06dda\"\n  dependencies:\n    is-finite \"^1.0.0\"\n\nreplace-ext@0.0.1, replace-ext@^0.0.1:\n  version \"0.0.1\"\n  resolved \"https://registry.yarnpkg.com/replace-ext/-/replace-ext-0.0.1.tgz#29bbd92078a739f0bcce2b4ee41e837953522924\"\n\nreplace-ext@^1.0.0:\n  version \"1.0.0\"\n  resolved \"https://registry.yarnpkg.com/replace-ext/-/replace-ext-1.0.0.tgz#de63128373fcbf7c3ccfa4de5a480c45a67958eb\"\n\nreplace-homedir@^1.0.0:\n  version \"1.0.0\"\n  resolved \"https://registry.yarnpkg.com/replace-homedir/-/replace-homedir-1.0.0.tgz#e87f6d513b928dde808260c12be7fec6ff6e798c\"\n  dependencies:\n    homedir-polyfill \"^1.0.1\"\n    is-absolute \"^1.0.0\"\n    remove-trailing-separator \"^1.1.0\"\n\nreplacestream@^4.0.0:\n  version \"4.0.3\"\n  resolved \"https://registry.yarnpkg.com/replacestream/-/replacestream-4.0.3.tgz#3ee5798092be364b1cdb1484308492cb3dff2f36\"\n  dependencies:\n    escape-string-regexp \"^1.0.3\"\n    object-assign \"^4.0.1\"\n    readable-stream \"^2.0.2\"\n\nrequest-progress@^2.0.1:\n  version \"2.0.1\"\n  resolved \"https://registry.yarnpkg.com/request-progress/-/request-progress-2.0.1.tgz#5d36bb57961c673aa5b788dbc8141fdf23b44e08\"\n  dependencies:\n    throttleit \"^1.0.0\"\n\nrequest@2.81.0, \"request@>=2.9.0 <2.82.0\":\n  version \"2.81.0\"\n  resolved \"https://registry.yarnpkg.com/request/-/request-2.81.0.tgz#c6928946a0e06c5f8d6f8a9333469ffda46298a0\"\n  dependencies:\n    aws-sign2 \"~0.6.0\"\n    aws4 \"^1.2.1\"\n    caseless \"~0.12.0\"\n    combined-stream \"~1.0.5\"\n    extend \"~3.0.0\"\n    forever-agent \"~0.6.1\"\n    form-data \"~2.1.1\"\n    har-validator \"~4.2.1\"\n    hawk \"~3.1.3\"\n    http-signature \"~1.1.0\"\n    is-typedarray \"~1.0.0\"\n    isstream \"~0.1.2\"\n    json-stringify-safe \"~5.0.1\"\n    mime-types \"~2.1.7\"\n    oauth-sign \"~0.8.1\"\n    performance-now \"^0.2.0\"\n    qs \"~6.4.0\"\n    safe-buffer \"^5.0.1\"\n    stringstream \"~0.0.4\"\n    tough-cookie \"~2.3.0\"\n    tunnel-agent \"^0.6.0\"\n    uuid \"^3.0.0\"\n\nrequest@^2.61.0, request@^2.65.0, request@^2.81.0:\n  version \"2.87.0\"\n  resolved \"https://registry.yarnpkg.com/request/-/request-2.87.0.tgz#32f00235cd08d482b4d0d68db93a829c0ed5756e\"\n  dependencies:\n    aws-sign2 \"~0.7.0\"\n    aws4 \"^1.6.0\"\n    caseless \"~0.12.0\"\n    combined-stream \"~1.0.5\"\n    extend \"~3.0.1\"\n    forever-agent \"~0.6.1\"\n    form-data \"~2.3.1\"\n    har-validator \"~5.0.3\"\n    http-signature \"~1.2.0\"\n    is-typedarray \"~1.0.0\"\n    isstream \"~0.1.2\"\n    json-stringify-safe \"~5.0.1\"\n    mime-types \"~2.1.17\"\n    oauth-sign \"~0.8.2\"\n    performance-now \"^2.1.0\"\n    qs \"~6.5.1\"\n    safe-buffer \"^5.1.1\"\n    tough-cookie \"~2.3.3\"\n    tunnel-agent \"^0.6.0\"\n    uuid \"^3.1.0\"\n\nrequest@~2.33.0:\n  version \"2.33.0\"\n  resolved \"https://registry.yarnpkg.com/request/-/request-2.33.0.tgz#5167878131726070ec633752ea230a2379dc65ff\"\n  dependencies:\n    forever-agent \"~0.5.0\"\n    json-stringify-safe \"~5.0.0\"\n    mime \"~1.2.9\"\n    node-uuid \"~1.4.0\"\n    qs \"~0.6.0\"\n  optionalDependencies:\n    aws-sign2 \"~0.5.0\"\n    form-data \"~0.1.0\"\n    hawk \"~1.0.0\"\n    http-signature \"~0.10.0\"\n    oauth-sign \"~0.3.0\"\n    tough-cookie \">=0.12.0\"\n    tunnel-agent \"~0.3.0\"\n\nrequire-directory@^2.1.1:\n  version \"2.1.1\"\n  resolved \"https://registry.yarnpkg.com/require-directory/-/require-directory-2.1.1.tgz#8c64ad5fd30dab1c976e2344ffe7f792a6a6df42\"\n\nrequire-from-string@^1.1.0:\n  version \"1.2.1\"\n  resolved \"https://registry.yarnpkg.com/require-from-string/-/require-from-string-1.2.1.tgz#529c9ccef27380adfec9a2f965b649bbee636418\"\n\nrequire-main-filename@^1.0.1:\n  version \"1.0.1\"\n  resolved \"https://registry.yarnpkg.com/require-main-filename/-/require-main-filename-1.0.1.tgz#97f717b69d48784f5f526a6c5aa8ffdda055a4d1\"\n\nrequires-port@1.x.x:\n  version \"1.0.0\"\n  resolved \"https://registry.yarnpkg.com/requires-port/-/requires-port-1.0.0.tgz#925d2601d39ac485e091cf0da5c6e694dc3dcaff\"\n\nresolve-dir@^1.0.0, resolve-dir@^1.0.1:\n  version \"1.0.1\"\n  resolved \"https://registry.yarnpkg.com/resolve-dir/-/resolve-dir-1.0.1.tgz#79a40644c362be82f26effe739c9bb5382046f43\"\n  dependencies:\n    expand-tilde \"^2.0.0\"\n    global-modules \"^1.0.0\"\n\nresolve-options@^1.1.0:\n  version \"1.1.0\"\n  resolved \"https://registry.yarnpkg.com/resolve-options/-/resolve-options-1.1.0.tgz#32bb9e39c06d67338dc9378c0d6d6074566ad131\"\n  dependencies:\n    value-or-function \"^3.0.0\"\n\nresolve-url@^0.2.1:\n  version \"0.2.1\"\n  resolved \"https://registry.yarnpkg.com/resolve-url/-/resolve-url-0.2.1.tgz#2c637fe77c893afd2a663fe21aa9080068e2052a\"\n\nresolve@^1.1.6, resolve@^1.1.7, resolve@^1.4.0, resolve@^1.5.0:\n  version \"1.8.1\"\n  resolved \"https://registry.yarnpkg.com/resolve/-/resolve-1.8.1.tgz#82f1ec19a423ac1fbd080b0bab06ba36e84a7a26\"\n  dependencies:\n    path-parse \"^1.0.5\"\n\nresp-modifier@6.0.2:\n  version \"6.0.2\"\n  resolved \"https://registry.yarnpkg.com/resp-modifier/-/resp-modifier-6.0.2.tgz#b124de5c4fbafcba541f48ffa73970f4aa456b4f\"\n  dependencies:\n    debug \"^2.2.0\"\n    minimatch \"^3.0.2\"\n\nret@~0.1.10:\n  version \"0.1.15\"\n  resolved \"https://registry.yarnpkg.com/ret/-/ret-0.1.15.tgz#b8a4825d5bdb1fc3f6f53c2bc33f81388681c7bc\"\n\nright-align@^0.1.1:\n  version \"0.1.3\"\n  resolved \"https://registry.yarnpkg.com/right-align/-/right-align-0.1.3.tgz#61339b722fe6a3515689210d24e14c96148613ef\"\n  dependencies:\n    align-text \"^0.1.1\"\n\nrimraf@2, rimraf@^2.2.6, rimraf@^2.2.8, rimraf@^2.3.4, rimraf@^2.6.1:\n  version \"2.6.2\"\n  resolved \"https://registry.yarnpkg.com/rimraf/-/rimraf-2.6.2.tgz#2ed8150d24a16ea8651e6d6ef0f47c4158ce7a36\"\n  dependencies:\n    glob \"^7.0.5\"\n\nripemd160@0.2.0:\n  version \"0.2.0\"\n  resolved \"https://registry.yarnpkg.com/ripemd160/-/ripemd160-0.2.0.tgz#2bf198bde167cacfa51c0a928e84b68bbe171fce\"\n\nripemd160@^2.0.0, ripemd160@^2.0.1:\n  version \"2.0.2\"\n  resolved \"https://registry.yarnpkg.com/ripemd160/-/ripemd160-2.0.2.tgz#a1c1a6f624751577ba5d07914cbc92850585890c\"\n  dependencies:\n    hash-base \"^3.0.0\"\n    inherits \"^2.0.1\"\n\nrx@4.1.0:\n  version \"4.1.0\"\n  resolved \"https://registry.yarnpkg.com/rx/-/rx-4.1.0.tgz#a5f13ff79ef3b740fe30aa803fb09f98805d4782\"\n\nsafe-buffer@^5.0.1, safe-buffer@^5.1.0, safe-buffer@^5.1.1, safe-buffer@^5.1.2, safe-buffer@~5.1.0, safe-buffer@~5.1.1:\n  version \"5.1.2\"\n  resolved \"https://registry.yarnpkg.com/safe-buffer/-/safe-buffer-5.1.2.tgz#991ec69d296e0313747d59bdfd2b745c35f8828d\"\n\nsafe-regex@^1.1.0:\n  version \"1.1.0\"\n  resolved \"https://registry.yarnpkg.com/safe-regex/-/safe-regex-1.1.0.tgz#40a3669f3b077d1e943d44629e157dd48023bf2e\"\n  dependencies:\n    ret \"~0.1.10\"\n\n\"safer-buffer@>= 2.1.2 < 3\", safer-buffer@^2.0.2, safer-buffer@^2.1.0, safer-buffer@~2.1.0:\n  version \"2.1.2\"\n  resolved \"https://registry.yarnpkg.com/safer-buffer/-/safer-buffer-2.1.2.tgz#44fa161b0187b9549dd84bb91802f9bd8385cd6a\"\n\nsass-graph@^2.1.1:\n  version \"2.2.4\"\n  resolved \"https://registry.yarnpkg.com/sass-graph/-/sass-graph-2.2.4.tgz#13fbd63cd1caf0908b9fd93476ad43a51d1e0b49\"\n  dependencies:\n    glob \"^7.0.0\"\n    lodash \"^4.0.0\"\n    scss-tokenizer \"^0.2.3\"\n    yargs \"^7.0.0\"\n\nsax@>=0.6.0, sax@^1.2.4, sax@~1.2.1, sax@~1.2.4:\n  version \"1.2.4\"\n  resolved \"https://registry.yarnpkg.com/sax/-/sax-1.2.4.tgz#2816234e2378bddc4e5354fab5caa895df7100d9\"\n\nscss-tokenizer@^0.2.3:\n  version \"0.2.3\"\n  resolved \"https://registry.yarnpkg.com/scss-tokenizer/-/scss-tokenizer-0.2.3.tgz#8eb06db9a9723333824d3f5530641149847ce5d1\"\n  dependencies:\n    js-base64 \"^2.1.8\"\n    source-map \"^0.4.2\"\n\nseek-bzip@^1.0.3:\n  version \"1.0.5\"\n  resolved \"https://registry.yarnpkg.com/seek-bzip/-/seek-bzip-1.0.5.tgz#cfe917cb3d274bcffac792758af53173eb1fabdc\"\n  dependencies:\n    commander \"~2.8.1\"\n\nsemver-greatest-satisfied-range@^1.1.0:\n  version \"1.1.0\"\n  resolved \"https://registry.yarnpkg.com/semver-greatest-satisfied-range/-/semver-greatest-satisfied-range-1.1.0.tgz#13e8c2658ab9691cb0cd71093240280d36f77a5b\"\n  dependencies:\n    sver-compat \"^1.5.0\"\n\nsemver-regex@^1.0.0:\n  version \"1.0.0\"\n  resolved \"https://registry.yarnpkg.com/semver-regex/-/semver-regex-1.0.0.tgz#92a4969065f9c70c694753d55248fc68f8f652c9\"\n\nsemver-truncate@^1.0.0:\n  version \"1.1.2\"\n  resolved \"https://registry.yarnpkg.com/semver-truncate/-/semver-truncate-1.1.2.tgz#57f41de69707a62709a7e0104ba2117109ea47e8\"\n  dependencies:\n    semver \"^5.3.0\"\n\n\"semver@2 || 3 || 4 || 5\", semver@^5.3.0:\n  version \"5.5.0\"\n  resolved \"https://registry.yarnpkg.com/semver/-/semver-5.5.0.tgz#dc4bbc7a6ca9d916dee5d43516f0092b58f7b8ab\"\n\nsemver@^4.0.3:\n  version \"4.3.6\"\n  resolved \"https://registry.yarnpkg.com/semver/-/semver-4.3.6.tgz#300bc6e0e86374f7ba61068b5b1ecd57fc6532da\"\n\nsemver@~5.3.0:\n  version \"5.3.0\"\n  resolved \"https://registry.yarnpkg.com/semver/-/semver-5.3.0.tgz#9b2ce5d3de02d17c6012ad326aa6b4d0cf54f94f\"\n\nsend@0.16.2:\n  version \"0.16.2\"\n  resolved \"https://registry.yarnpkg.com/send/-/send-0.16.2.tgz#6ecca1e0f8c156d141597559848df64730a6bbc1\"\n  dependencies:\n    debug \"2.6.9\"\n    depd \"~1.1.2\"\n    destroy \"~1.0.4\"\n    encodeurl \"~1.0.2\"\n    escape-html \"~1.0.3\"\n    etag \"~1.8.1\"\n    fresh \"0.5.2\"\n    http-errors \"~1.6.2\"\n    mime \"1.4.1\"\n    ms \"2.0.0\"\n    on-finished \"~2.3.0\"\n    range-parser \"~1.2.0\"\n    statuses \"~1.4.0\"\n\nserve-index@1.9.1:\n  version \"1.9.1\"\n  resolved \"https://registry.yarnpkg.com/serve-index/-/serve-index-1.9.1.tgz#d3768d69b1e7d82e5ce050fff5b453bea12a9239\"\n  dependencies:\n    accepts \"~1.3.4\"\n    batch \"0.6.1\"\n    debug \"2.6.9\"\n    escape-html \"~1.0.3\"\n    http-errors \"~1.6.2\"\n    mime-types \"~2.1.17\"\n    parseurl \"~1.3.2\"\n\nserve-static@1.13.2:\n  version \"1.13.2\"\n  resolved \"https://registry.yarnpkg.com/serve-static/-/serve-static-1.13.2.tgz#095e8472fd5b46237db50ce486a43f4b86c6cec1\"\n  dependencies:\n    encodeurl \"~1.0.2\"\n    escape-html \"~1.0.3\"\n    parseurl \"~1.3.2\"\n    send \"0.16.2\"\n\nserver-destroy@1.0.1:\n  version \"1.0.1\"\n  resolved \"https://registry.yarnpkg.com/server-destroy/-/server-destroy-1.0.1.tgz#f13bf928e42b9c3e79383e61cc3998b5d14e6cdd\"\n\nset-blocking@^2.0.0, set-blocking@~2.0.0:\n  version \"2.0.0\"\n  resolved \"https://registry.yarnpkg.com/set-blocking/-/set-blocking-2.0.0.tgz#045f9782d011ae9a6803ddd382b24392b3d890f7\"\n\nset-immediate-shim@^1.0.0, set-immediate-shim@^1.0.1:\n  version \"1.0.1\"\n  resolved \"https://registry.yarnpkg.com/set-immediate-shim/-/set-immediate-shim-1.0.1.tgz#4b2b1b27eb808a9f8dcc481a58e5e56f599f3f61\"\n\nset-value@^0.4.3:\n  version \"0.4.3\"\n  resolved \"https://registry.yarnpkg.com/set-value/-/set-value-0.4.3.tgz#7db08f9d3d22dc7f78e53af3c3bf4666ecdfccf1\"\n  dependencies:\n    extend-shallow \"^2.0.1\"\n    is-extendable \"^0.1.1\"\n    is-plain-object \"^2.0.1\"\n    to-object-path \"^0.3.0\"\n\nset-value@^2.0.0:\n  version \"2.0.0\"\n  resolved \"https://registry.yarnpkg.com/set-value/-/set-value-2.0.0.tgz#71ae4a88f0feefbbf52d1ea604f3fb315ebb6274\"\n  dependencies:\n    extend-shallow \"^2.0.1\"\n    is-extendable \"^0.1.1\"\n    is-plain-object \"^2.0.3\"\n    split-string \"^3.0.1\"\n\nsetimmediate@^1.0.4:\n  version \"1.0.5\"\n  resolved \"https://registry.yarnpkg.com/setimmediate/-/setimmediate-1.0.5.tgz#290cbb232e306942d7d7ea9b83732ab7856f8285\"\n\nsetprototypeof@1.1.0:\n  version \"1.1.0\"\n  resolved \"https://registry.yarnpkg.com/setprototypeof/-/setprototypeof-1.1.0.tgz#d0bd85536887b6fe7c0d818cb962d9d91c54e656\"\n\nsha.js@2.2.6:\n  version \"2.2.6\"\n  resolved \"https://registry.yarnpkg.com/sha.js/-/sha.js-2.2.6.tgz#17ddeddc5f722fb66501658895461977867315ba\"\n\nsha.js@^2.4.0, sha.js@^2.4.8:\n  version \"2.4.11\"\n  resolved \"https://registry.yarnpkg.com/sha.js/-/sha.js-2.4.11.tgz#37a5cf0b81ecbc6943de109ba2960d1b26584ae7\"\n  dependencies:\n    inherits \"^2.0.1\"\n    safe-buffer \"^5.0.1\"\n\nshebang-command@^1.2.0:\n  version \"1.2.0\"\n  resolved \"https://registry.yarnpkg.com/shebang-command/-/shebang-command-1.2.0.tgz#44aac65b695b03398968c39f363fee5deafdf1ea\"\n  dependencies:\n    shebang-regex \"^1.0.0\"\n\nshebang-regex@^1.0.0:\n  version \"1.0.0\"\n  resolved \"https://registry.yarnpkg.com/shebang-regex/-/shebang-regex-1.0.0.tgz#da42f49740c0b42db2ca9728571cb190c98efea3\"\n\nsigmund@~1.0.0:\n  version \"1.0.1\"\n  resolved \"https://registry.yarnpkg.com/sigmund/-/sigmund-1.0.1.tgz#3ff21f198cad2175f9f3b781853fd94d0d19b590\"\n\nsignal-exit@^3.0.0:\n  version \"3.0.2\"\n  resolved \"https://registry.yarnpkg.com/signal-exit/-/signal-exit-3.0.2.tgz#b5fdc08f1287ea1178628e415e25132b73646c6d\"\n\nsimple-swizzle@^0.2.2:\n  version \"0.2.2\"\n  resolved \"https://registry.yarnpkg.com/simple-swizzle/-/simple-swizzle-0.2.2.tgz#a4da6b635ffcccca33f70d17cb92592de95e557a\"\n  dependencies:\n    is-arrayish \"^0.3.1\"\n\nslash@^1.0.0:\n  version \"1.0.0\"\n  resolved \"https://registry.yarnpkg.com/slash/-/slash-1.0.0.tgz#c41f2f6c39fc16d1cd17ad4b5d896114ae470d55\"\n\nsnapdragon-node@^2.0.1:\n  version \"2.1.1\"\n  resolved \"https://registry.yarnpkg.com/snapdragon-node/-/snapdragon-node-2.1.1.tgz#6c175f86ff14bdb0724563e8f3c1b021a286853b\"\n  dependencies:\n    define-property \"^1.0.0\"\n    isobject \"^3.0.0\"\n    snapdragon-util \"^3.0.1\"\n\nsnapdragon-util@^3.0.1:\n  version \"3.0.1\"\n  resolved \"https://registry.yarnpkg.com/snapdragon-util/-/snapdragon-util-3.0.1.tgz#f956479486f2acd79700693f6f7b805e45ab56e2\"\n  dependencies:\n    kind-of \"^3.2.0\"\n\nsnapdragon@^0.8.1:\n  version \"0.8.2\"\n  resolved \"https://registry.yarnpkg.com/snapdragon/-/snapdragon-0.8.2.tgz#64922e7c565b0e14204ba1aa7d6964278d25182d\"\n  dependencies:\n    base \"^0.11.1\"\n    debug \"^2.2.0\"\n    define-property \"^0.2.5\"\n    extend-shallow \"^2.0.1\"\n    map-cache \"^0.2.2\"\n    source-map \"^0.5.6\"\n    source-map-resolve \"^0.5.0\"\n    use \"^3.1.0\"\n\nsntp@0.2.x:\n  version \"0.2.4\"\n  resolved \"https://registry.yarnpkg.com/sntp/-/sntp-0.2.4.tgz#fb885f18b0f3aad189f824862536bceeec750900\"\n  dependencies:\n    hoek \"0.9.x\"\n\nsntp@1.x.x:\n  version \"1.0.9\"\n  resolved \"https://registry.yarnpkg.com/sntp/-/sntp-1.0.9.tgz#6541184cc90aeea6c6e7b35e2659082443c66198\"\n  dependencies:\n    hoek \"2.x.x\"\n\nsocket.io-adapter@~1.1.0:\n  version \"1.1.1\"\n  resolved \"https://registry.yarnpkg.com/socket.io-adapter/-/socket.io-adapter-1.1.1.tgz#2a805e8a14d6372124dd9159ad4502f8cb07f06b\"\n\nsocket.io-client@2.0.4:\n  version \"2.0.4\"\n  resolved \"https://registry.yarnpkg.com/socket.io-client/-/socket.io-client-2.0.4.tgz#0918a552406dc5e540b380dcd97afc4a64332f8e\"\n  dependencies:\n    backo2 \"1.0.2\"\n    base64-arraybuffer \"0.1.5\"\n    component-bind \"1.0.0\"\n    component-emitter \"1.2.1\"\n    debug \"~2.6.4\"\n    engine.io-client \"~3.1.0\"\n    has-cors \"1.1.0\"\n    indexof \"0.0.1\"\n    object-component \"0.0.3\"\n    parseqs \"0.0.5\"\n    parseuri \"0.0.5\"\n    socket.io-parser \"~3.1.1\"\n    to-array \"0.1.4\"\n\nsocket.io-client@2.1.1:\n  version \"2.1.1\"\n  resolved \"https://registry.yarnpkg.com/socket.io-client/-/socket.io-client-2.1.1.tgz#dcb38103436ab4578ddb026638ae2f21b623671f\"\n  dependencies:\n    backo2 \"1.0.2\"\n    base64-arraybuffer \"0.1.5\"\n    component-bind \"1.0.0\"\n    component-emitter \"1.2.1\"\n    debug \"~3.1.0\"\n    engine.io-client \"~3.2.0\"\n    has-binary2 \"~1.0.2\"\n    has-cors \"1.1.0\"\n    indexof \"0.0.1\"\n    object-component \"0.0.3\"\n    parseqs \"0.0.5\"\n    parseuri \"0.0.5\"\n    socket.io-parser \"~3.2.0\"\n    to-array \"0.1.4\"\n\nsocket.io-parser@~3.1.1:\n  version \"3.1.3\"\n  resolved \"https://registry.yarnpkg.com/socket.io-parser/-/socket.io-parser-3.1.3.tgz#ed2da5ee79f10955036e3da413bfd7f1e4d86c8e\"\n  dependencies:\n    component-emitter \"1.2.1\"\n    debug \"~3.1.0\"\n    has-binary2 \"~1.0.2\"\n    isarray \"2.0.1\"\n\nsocket.io-parser@~3.2.0:\n  version \"3.2.0\"\n  resolved \"https://registry.yarnpkg.com/socket.io-parser/-/socket.io-parser-3.2.0.tgz#e7c6228b6aa1f814e6148aea325b51aa9499e077\"\n  dependencies:\n    component-emitter \"1.2.1\"\n    debug \"~3.1.0\"\n    isarray \"2.0.1\"\n\nsocket.io@2.1.1:\n  version \"2.1.1\"\n  resolved \"https://registry.yarnpkg.com/socket.io/-/socket.io-2.1.1.tgz#a069c5feabee3e6b214a75b40ce0652e1cfb9980\"\n  dependencies:\n    debug \"~3.1.0\"\n    engine.io \"~3.2.0\"\n    has-binary2 \"~1.0.2\"\n    socket.io-adapter \"~1.1.0\"\n    socket.io-client \"2.1.1\"\n    socket.io-parser \"~3.2.0\"\n\nsort-keys@^1.0.0:\n  version \"1.1.2\"\n  resolved \"https://registry.yarnpkg.com/sort-keys/-/sort-keys-1.1.2.tgz#441b6d4d346798f1b4e49e8920adfba0e543f9ad\"\n  dependencies:\n    is-plain-obj \"^1.0.0\"\n\nsource-list-map@^2.0.0:\n  version \"2.0.0\"\n  resolved \"https://registry.yarnpkg.com/source-list-map/-/source-list-map-2.0.0.tgz#aaa47403f7b245a92fbc97ea08f250d6087ed085\"\n\nsource-list-map@~0.1.7:\n  version \"0.1.8\"\n  resolved \"https://registry.yarnpkg.com/source-list-map/-/source-list-map-0.1.8.tgz#c550b2ab5427f6b3f21f5afead88c4f5587b2106\"\n\nsource-map-resolve@^0.5.0, source-map-resolve@^0.5.1:\n  version \"0.5.2\"\n  resolved \"https://registry.yarnpkg.com/source-map-resolve/-/source-map-resolve-0.5.2.tgz#72e2cc34095543e43b2c62b2c4c10d4a9054f259\"\n  dependencies:\n    atob \"^2.1.1\"\n    decode-uri-component \"^0.2.0\"\n    resolve-url \"^0.2.1\"\n    source-map-url \"^0.4.0\"\n    urix \"^0.1.0\"\n\nsource-map-support@^0.4.15:\n  version \"0.4.18\"\n  resolved \"https://registry.yarnpkg.com/source-map-support/-/source-map-support-0.4.18.tgz#0286a6de8be42641338594e97ccea75f0a2c585f\"\n  dependencies:\n    source-map \"^0.5.6\"\n\nsource-map-url@^0.4.0:\n  version \"0.4.0\"\n  resolved \"https://registry.yarnpkg.com/source-map-url/-/source-map-url-0.4.0.tgz#3e935d7ddd73631b97659956d55128e87b5084a3\"\n\nsource-map@^0.1.38:\n  version \"0.1.43\"\n  resolved \"https://registry.yarnpkg.com/source-map/-/source-map-0.1.43.tgz#c24bc146ca517c1471f5dacbe2571b2b7f9e3346\"\n  dependencies:\n    amdefine \">=0.0.4\"\n\nsource-map@^0.4.2, source-map@~0.4.1:\n  version \"0.4.4\"\n  resolved \"https://registry.yarnpkg.com/source-map/-/source-map-0.4.4.tgz#eba4f5da9c0dc999de68032d8b4f76173652036b\"\n  dependencies:\n    amdefine \">=0.0.4\"\n\nsource-map@^0.5.1, source-map@^0.5.3, source-map@^0.5.6, source-map@^0.5.7, source-map@~0.5.1:\n  version \"0.5.7\"\n  resolved \"https://registry.yarnpkg.com/source-map/-/source-map-0.5.7.tgz#8a039d2d1021d22d1ea14c80d8ea468ba2ef3fcc\"\n\nsource-map@^0.6.1, source-map@~0.6.1:\n  version \"0.6.1\"\n  resolved \"https://registry.yarnpkg.com/source-map/-/source-map-0.6.1.tgz#74722af32e9614e9c287a8d0bbde48b5e2f1a263\"\n\nsparkles@^1.0.0:\n  version \"1.0.1\"\n  resolved \"https://registry.yarnpkg.com/sparkles/-/sparkles-1.0.1.tgz#008db65edce6c50eec0c5e228e1945061dd0437c\"\n\nspdx-correct@^3.0.0:\n  version \"3.0.0\"\n  resolved \"https://registry.yarnpkg.com/spdx-correct/-/spdx-correct-3.0.0.tgz#05a5b4d7153a195bc92c3c425b69f3b2a9524c82\"\n  dependencies:\n    spdx-expression-parse \"^3.0.0\"\n    spdx-license-ids \"^3.0.0\"\n\nspdx-exceptions@^2.1.0:\n  version \"2.1.0\"\n  resolved \"https://registry.yarnpkg.com/spdx-exceptions/-/spdx-exceptions-2.1.0.tgz#2c7ae61056c714a5b9b9b2b2af7d311ef5c78fe9\"\n\nspdx-expression-parse@^3.0.0:\n  version \"3.0.0\"\n  resolved \"https://registry.yarnpkg.com/spdx-expression-parse/-/spdx-expression-parse-3.0.0.tgz#99e119b7a5da00e05491c9fa338b7904823b41d0\"\n  dependencies:\n    spdx-exceptions \"^2.1.0\"\n    spdx-license-ids \"^3.0.0\"\n\nspdx-license-ids@^3.0.0:\n  version \"3.0.0\"\n  resolved \"https://registry.yarnpkg.com/spdx-license-ids/-/spdx-license-ids-3.0.0.tgz#7a7cd28470cc6d3a1cfe6d66886f6bc430d3ac87\"\n\nsplit-string@^3.0.1, split-string@^3.0.2:\n  version \"3.1.0\"\n  resolved \"https://registry.yarnpkg.com/split-string/-/split-string-3.1.0.tgz#7cb09dda3a86585705c64b39a6466038682e8fe2\"\n  dependencies:\n    extend-shallow \"^3.0.0\"\n\nsprintf-js@~1.0.2:\n  version \"1.0.3\"\n  resolved \"https://registry.yarnpkg.com/sprintf-js/-/sprintf-js-1.0.3.tgz#04e6926f662895354f3dd015203633b857297e2c\"\n\nsqueak@^1.0.0:\n  version \"1.3.0\"\n  resolved \"https://registry.yarnpkg.com/squeak/-/squeak-1.3.0.tgz#33045037b64388b567674b84322a6521073916c3\"\n  dependencies:\n    chalk \"^1.0.0\"\n    console-stream \"^0.1.1\"\n    lpad-align \"^1.0.1\"\n\nssh2@~0.3.3:\n  version \"0.3.6\"\n  resolved \"https://registry.yarnpkg.com/ssh2/-/ssh2-0.3.6.tgz#49034434aee3821ee5fc22b952081e7801ff92ed\"\n  dependencies:\n    asn1 \"0.2.1\"\n    readable-stream \"1.0.27-1\"\n    streamsearch \"0.1.2\"\n\nsshpk@^1.7.0:\n  version \"1.14.2\"\n  resolved \"https://registry.yarnpkg.com/sshpk/-/sshpk-1.14.2.tgz#c6fc61648a3d9c4e764fd3fcdf4ea105e492ba98\"\n  dependencies:\n    asn1 \"~0.2.3\"\n    assert-plus \"^1.0.0\"\n    dashdash \"^1.12.0\"\n    getpass \"^0.1.1\"\n    safer-buffer \"^2.0.2\"\n  optionalDependencies:\n    bcrypt-pbkdf \"^1.0.0\"\n    ecc-jsbn \"~0.1.1\"\n    jsbn \"~0.1.0\"\n    tweetnacl \"~0.14.0\"\n\nstable@~0.1.6:\n  version \"0.1.8\"\n  resolved \"https://registry.yarnpkg.com/stable/-/stable-0.1.8.tgz#836eb3c8382fe2936feaf544631017ce7d47a3cf\"\n\nstack-trace@0.0.10, stack-trace@0.0.x:\n  version \"0.0.10\"\n  resolved \"https://registry.yarnpkg.com/stack-trace/-/stack-trace-0.0.10.tgz#547c70b347e8d32b4e108ea1a2a159e5fdde19c0\"\n\nstat-mode@^0.2.0:\n  version \"0.2.2\"\n  resolved \"https://registry.yarnpkg.com/stat-mode/-/stat-mode-0.2.2.tgz#e6c80b623123d7d80cf132ce538f346289072502\"\n\nstatic-extend@^0.1.1:\n  version \"0.1.2\"\n  resolved \"https://registry.yarnpkg.com/static-extend/-/static-extend-0.1.2.tgz#60809c39cbff55337226fd5e0b520f341f1fb5c6\"\n  dependencies:\n    define-property \"^0.2.5\"\n    object-copy \"^0.1.0\"\n\n\"statuses@>= 1.4.0 < 2\":\n  version \"1.5.0\"\n  resolved \"https://registry.yarnpkg.com/statuses/-/statuses-1.5.0.tgz#161c7dac177659fd9811f43771fa99381478628c\"\n\nstatuses@~1.3.1:\n  version \"1.3.1\"\n  resolved \"https://registry.yarnpkg.com/statuses/-/statuses-1.3.1.tgz#faf51b9eb74aaef3b3acf4ad5f61abf24cb7b93e\"\n\nstatuses@~1.4.0:\n  version \"1.4.0\"\n  resolved \"https://registry.yarnpkg.com/statuses/-/statuses-1.4.0.tgz#bb73d446da2796106efcc1b601a253d6c46bd087\"\n\nstream-browserify@^2.0.1:\n  version \"2.0.1\"\n  resolved \"https://registry.yarnpkg.com/stream-browserify/-/stream-browserify-2.0.1.tgz#66266ee5f9bdb9940a4e4514cafb43bb71e5c9db\"\n  dependencies:\n    inherits \"~2.0.1\"\n    readable-stream \"^2.0.2\"\n\nstream-combiner2@^1.1.1:\n  version \"1.1.1\"\n  resolved \"https://registry.yarnpkg.com/stream-combiner2/-/stream-combiner2-1.1.1.tgz#fb4d8a1420ea362764e21ad4780397bebcb41cbe\"\n  dependencies:\n    duplexer2 \"~0.1.0\"\n    readable-stream \"^2.0.2\"\n\nstream-combiner@^0.2.1, stream-combiner@^0.2.2:\n  version \"0.2.2\"\n  resolved \"https://registry.yarnpkg.com/stream-combiner/-/stream-combiner-0.2.2.tgz#aec8cbac177b56b6f4fa479ced8c1912cee52858\"\n  dependencies:\n    duplexer \"~0.1.1\"\n    through \"~2.3.4\"\n\nstream-exhaust@^1.0.1:\n  version \"1.0.2\"\n  resolved \"https://registry.yarnpkg.com/stream-exhaust/-/stream-exhaust-1.0.2.tgz#acdac8da59ef2bc1e17a2c0ccf6c320d120e555d\"\n\nstream-http@^2.3.1, stream-http@^2.7.2:\n  version \"2.8.3\"\n  resolved \"https://registry.yarnpkg.com/stream-http/-/stream-http-2.8.3.tgz#b2d242469288a5a27ec4fe8933acf623de6514fc\"\n  dependencies:\n    builtin-status-codes \"^3.0.0\"\n    inherits \"^2.0.1\"\n    readable-stream \"^2.3.6\"\n    to-arraybuffer \"^1.0.0\"\n    xtend \"^4.0.0\"\n\nstream-shift@^1.0.0:\n  version \"1.0.0\"\n  resolved \"https://registry.yarnpkg.com/stream-shift/-/stream-shift-1.0.0.tgz#d5c752825e5367e786f78e18e445ea223a155952\"\n\nstream-throttle@^0.1.3:\n  version \"0.1.3\"\n  resolved \"https://registry.yarnpkg.com/stream-throttle/-/stream-throttle-0.1.3.tgz#add57c8d7cc73a81630d31cd55d3961cfafba9c3\"\n  dependencies:\n    commander \"^2.2.0\"\n    limiter \"^1.0.5\"\n\nstream-to-buffer@^0.1.0:\n  version \"0.1.0\"\n  resolved \"https://registry.yarnpkg.com/stream-to-buffer/-/stream-to-buffer-0.1.0.tgz#26799d903ab2025c9bd550ac47171b00f8dd80a9\"\n  dependencies:\n    stream-to \"~0.2.0\"\n\nstream-to@~0.2.0:\n  version \"0.2.2\"\n  resolved \"https://registry.yarnpkg.com/stream-to/-/stream-to-0.2.2.tgz#84306098d85fdb990b9fa300b1b3ccf55e8ef01d\"\n\nstreamsearch@0.1.2:\n  version \"0.1.2\"\n  resolved \"https://registry.yarnpkg.com/streamsearch/-/streamsearch-0.1.2.tgz#808b9d0e56fc273d809ba57338e929919a1a9f1a\"\n\nstrict-uri-encode@^1.0.0:\n  version \"1.1.0\"\n  resolved \"https://registry.yarnpkg.com/strict-uri-encode/-/strict-uri-encode-1.1.0.tgz#279b225df1d582b1f54e65addd4352e18faa0713\"\n\nstring-width@^1.0.1, string-width@^1.0.2:\n  version \"1.0.2\"\n  resolved \"https://registry.yarnpkg.com/string-width/-/string-width-1.0.2.tgz#118bdf5b8cdc51a2a7e70d211e07e2b0b9b107d3\"\n  dependencies:\n    code-point-at \"^1.0.0\"\n    is-fullwidth-code-point \"^1.0.0\"\n    strip-ansi \"^3.0.0\"\n\n\"string-width@^1.0.2 || 2\", string-width@^2.0.0, string-width@^2.1.1:\n  version \"2.1.1\"\n  resolved \"https://registry.yarnpkg.com/string-width/-/string-width-2.1.1.tgz#ab93f27a8dc13d28cac815c462143a6d9012ae9e\"\n  dependencies:\n    is-fullwidth-code-point \"^2.0.0\"\n    strip-ansi \"^4.0.0\"\n\nstring_decoder@^0.10.25, string_decoder@~0.10.x:\n  version \"0.10.31\"\n  resolved \"https://registry.yarnpkg.com/string_decoder/-/string_decoder-0.10.31.tgz#62e203bc41766c6c28c9fc84301dab1c5310fa94\"\n\nstring_decoder@^1.0.0, string_decoder@~1.1.1:\n  version \"1.1.1\"\n  resolved \"https://registry.yarnpkg.com/string_decoder/-/string_decoder-1.1.1.tgz#9cf1611ba62685d7030ae9e4ba34149c3af03fc8\"\n  dependencies:\n    safe-buffer \"~5.1.0\"\n\nstringstream@~0.0.4:\n  version \"0.0.6\"\n  resolved \"https://registry.yarnpkg.com/stringstream/-/stringstream-0.0.6.tgz#7880225b0d4ad10e30927d167a1d6f2fd3b33a72\"\n\nstrip-ansi@^3.0.0, strip-ansi@^3.0.1:\n  version \"3.0.1\"\n  resolved \"https://registry.yarnpkg.com/strip-ansi/-/strip-ansi-3.0.1.tgz#6a385fb8853d952d5ff05d0e8aaf94278dc63dcf\"\n  dependencies:\n    ansi-regex \"^2.0.0\"\n\nstrip-ansi@^4.0.0:\n  version \"4.0.0\"\n  resolved \"https://registry.yarnpkg.com/strip-ansi/-/strip-ansi-4.0.0.tgz#a8479022eb1ac368a871389b635262c505ee368f\"\n  dependencies:\n    ansi-regex \"^3.0.0\"\n\nstrip-bom-stream@^1.0.0:\n  version \"1.0.0\"\n  resolved \"https://registry.yarnpkg.com/strip-bom-stream/-/strip-bom-stream-1.0.0.tgz#e7144398577d51a6bed0fa1994fa05f43fd988ee\"\n  dependencies:\n    first-chunk-stream \"^1.0.0\"\n    strip-bom \"^2.0.0\"\n\nstrip-bom@^1.0.0:\n  version \"1.0.0\"\n  resolved \"https://registry.yarnpkg.com/strip-bom/-/strip-bom-1.0.0.tgz#85b8862f3844b5a6d5ec8467a93598173a36f794\"\n  dependencies:\n    first-chunk-stream \"^1.0.0\"\n    is-utf8 \"^0.2.0\"\n\nstrip-bom@^2.0.0:\n  version \"2.0.0\"\n  resolved \"https://registry.yarnpkg.com/strip-bom/-/strip-bom-2.0.0.tgz#6219a85616520491f35788bdbf1447a99c7e6b0e\"\n  dependencies:\n    is-utf8 \"^0.2.0\"\n\nstrip-dirs@^1.0.0:\n  version \"1.1.1\"\n  resolved \"https://registry.yarnpkg.com/strip-dirs/-/strip-dirs-1.1.1.tgz#960bbd1287844f3975a4558aa103a8255e2456a0\"\n  dependencies:\n    chalk \"^1.0.0\"\n    get-stdin \"^4.0.1\"\n    is-absolute \"^0.1.5\"\n    is-natural-number \"^2.0.0\"\n    minimist \"^1.1.0\"\n    sum-up \"^1.0.1\"\n\nstrip-eof@^1.0.0:\n  version \"1.0.0\"\n  resolved \"https://registry.yarnpkg.com/strip-eof/-/strip-eof-1.0.0.tgz#bb43ff5598a6eb05d89b59fcd129c983313606bf\"\n\nstrip-indent@^1.0.1:\n  version \"1.0.1\"\n  resolved \"https://registry.yarnpkg.com/strip-indent/-/strip-indent-1.0.1.tgz#0c7962a6adefa7bbd4ac366460a638552ae1a0a2\"\n  dependencies:\n    get-stdin \"^4.0.1\"\n\nstrip-json-comments@~2.0.1:\n  version \"2.0.1\"\n  resolved \"https://registry.yarnpkg.com/strip-json-comments/-/strip-json-comments-2.0.1.tgz#3c531942e908c2697c0ec344858c286c7ca0a60a\"\n\nstrip-outer@^1.0.0:\n  version \"1.0.1\"\n  resolved \"https://registry.yarnpkg.com/strip-outer/-/strip-outer-1.0.1.tgz#b2fd2abf6604b9d1e6013057195df836b8a9d631\"\n  dependencies:\n    escape-string-regexp \"^1.0.2\"\n\nsum-up@^1.0.1:\n  version \"1.0.3\"\n  resolved \"https://registry.yarnpkg.com/sum-up/-/sum-up-1.0.3.tgz#1c661f667057f63bcb7875aa1438bc162525156e\"\n  dependencies:\n    chalk \"^1.0.0\"\n\nsupports-color@1.2.0:\n  version \"1.2.0\"\n  resolved \"https://registry.yarnpkg.com/supports-color/-/supports-color-1.2.0.tgz#ff1ed1e61169d06b3cf2d588e188b18d8847e17e\"\n\nsupports-color@^2.0.0:\n  version \"2.0.0\"\n  resolved \"https://registry.yarnpkg.com/supports-color/-/supports-color-2.0.0.tgz#535d045ce6b6363fa40117084629995e9df324c7\"\n\nsupports-color@^3.1.0, supports-color@^3.2.3:\n  version \"3.2.3\"\n  resolved \"https://registry.yarnpkg.com/supports-color/-/supports-color-3.2.3.tgz#65ac0504b3954171d8a64946b2ae3cbb8a5f54f6\"\n  dependencies:\n    has-flag \"^1.0.0\"\n\nsupports-color@^5.3.0:\n  version \"5.4.0\"\n  resolved \"https://registry.yarnpkg.com/supports-color/-/supports-color-5.4.0.tgz#1c6b337402c2137605efe19f10fec390f6faab54\"\n  dependencies:\n    has-flag \"^3.0.0\"\n\nsver-compat@^1.5.0:\n  version \"1.5.0\"\n  resolved \"https://registry.yarnpkg.com/sver-compat/-/sver-compat-1.5.0.tgz#3cf87dfeb4d07b4a3f14827bc186b3fd0c645cd8\"\n  dependencies:\n    es6-iterator \"^2.0.1\"\n    es6-symbol \"^3.1.1\"\n\nsvg-sprite@~1.4.0:\n  version \"1.4.0\"\n  resolved \"https://registry.yarnpkg.com/svg-sprite/-/svg-sprite-1.4.0.tgz#583bddc86950ca3d5d8ac249b6f1cae2c41ff557\"\n  dependencies:\n    async \"^2.6.0\"\n    css-selector-parser \"^1.3.0\"\n    cssmin \"^0.4.3\"\n    cssom \"^0.3.2\"\n    dateformat \"^3.0.3\"\n    glob \"^7.1.2\"\n    js-yaml \"^3.11.0\"\n    lodash \"^4.17.5\"\n    lodash.pluck \"^3.1.2\"\n    mkdirp \"^0.5.1\"\n    mustache \"^2.3.0\"\n    phantomjs-prebuilt \"^2.1.16\"\n    prettysize \"^1.1.0\"\n    svgo \"^1.0.5\"\n    vinyl \"^2.1.0\"\n    winston \"^2.4.1\"\n    xmldom \"0.1.27\"\n    xpath \"^0.0.27\"\n    yargs \"^11.0.0\"\n\nsvg-to-png@^3.1.2:\n  version \"3.1.2\"\n  resolved \"https://registry.yarnpkg.com/svg-to-png/-/svg-to-png-3.1.2.tgz#1bd22321ff951778c7314f5d208beb0d31605401\"\n  dependencies:\n    phantomjs-prebuilt \"^2.1.7\"\n  optionalDependencies:\n    imagemin \"3.1.0\"\n\nsvgo@^0.6.0:\n  version \"0.6.6\"\n  resolved \"https://registry.yarnpkg.com/svgo/-/svgo-0.6.6.tgz#b340889036f20f9b447543077d0f5573ed044c08\"\n  dependencies:\n    coa \"~1.0.1\"\n    colors \"~1.1.2\"\n    csso \"~2.0.0\"\n    js-yaml \"~3.6.0\"\n    mkdirp \"~0.5.1\"\n    sax \"~1.2.1\"\n    whet.extend \"~0.9.9\"\n\nsvgo@^0.7.0:\n  version \"0.7.2\"\n  resolved \"https://registry.yarnpkg.com/svgo/-/svgo-0.7.2.tgz#9f5772413952135c6fefbf40afe6a4faa88b4bb5\"\n  dependencies:\n    coa \"~1.0.1\"\n    colors \"~1.1.2\"\n    csso \"~2.3.1\"\n    js-yaml \"~3.7.0\"\n    mkdirp \"~0.5.1\"\n    sax \"~1.2.1\"\n    whet.extend \"~0.9.9\"\n\nsvgo@^1.0.5:\n  version \"1.0.5\"\n  resolved \"https://registry.yarnpkg.com/svgo/-/svgo-1.0.5.tgz#7040364c062a0538abacff4401cea6a26a7a389a\"\n  dependencies:\n    coa \"~2.0.1\"\n    colors \"~1.1.2\"\n    css-select \"~1.3.0-rc0\"\n    css-select-base-adapter \"~0.1.0\"\n    css-tree \"1.0.0-alpha25\"\n    css-url-regex \"^1.1.0\"\n    csso \"^3.5.0\"\n    js-yaml \"~3.10.0\"\n    mkdirp \"~0.5.1\"\n    object.values \"^1.0.4\"\n    sax \"~1.2.4\"\n    stable \"~0.1.6\"\n    unquote \"~1.1.1\"\n    util.promisify \"~1.0.0\"\n\ntapable@^0.1.8, tapable@~0.1.8:\n  version \"0.1.10\"\n  resolved \"https://registry.yarnpkg.com/tapable/-/tapable-0.1.10.tgz#29c35707c2b70e50d07482b5d202e8ed446dafd4\"\n\ntapable@^0.2.7, tapable@~0.2.5:\n  version \"0.2.8\"\n  resolved \"https://registry.yarnpkg.com/tapable/-/tapable-0.2.8.tgz#99372a5c999bf2df160afc0d74bed4f47948cd22\"\n\ntar-stream@^1.1.1:\n  version \"1.6.1\"\n  resolved \"https://registry.yarnpkg.com/tar-stream/-/tar-stream-1.6.1.tgz#f84ef1696269d6223ca48f6e1eeede3f7e81f395\"\n  dependencies:\n    bl \"^1.0.0\"\n    buffer-alloc \"^1.1.0\"\n    end-of-stream \"^1.0.0\"\n    fs-constants \"^1.0.0\"\n    readable-stream \"^2.3.0\"\n    to-buffer \"^1.1.0\"\n    xtend \"^4.0.0\"\n\ntar@^2.0.0:\n  version \"2.2.1\"\n  resolved \"https://registry.yarnpkg.com/tar/-/tar-2.2.1.tgz#8e4d2a256c0e2185c6b18ad694aec968b83cb1d1\"\n  dependencies:\n    block-stream \"*\"\n    fstream \"^1.0.2\"\n    inherits \"2\"\n\ntar@^4:\n  version \"4.4.6\"\n  resolved \"https://registry.yarnpkg.com/tar/-/tar-4.4.6.tgz#63110f09c00b4e60ac8bcfe1bf3c8660235fbc9b\"\n  dependencies:\n    chownr \"^1.0.1\"\n    fs-minipass \"^1.2.5\"\n    minipass \"^2.3.3\"\n    minizlib \"^1.1.0\"\n    mkdirp \"^0.5.0\"\n    safe-buffer \"^5.1.2\"\n    yallist \"^3.0.2\"\n\ntempfile@^1.0.0:\n  version \"1.1.1\"\n  resolved \"https://registry.yarnpkg.com/tempfile/-/tempfile-1.1.1.tgz#5bcc4eaecc4ab2c707d8bc11d99ccc9a2cb287f2\"\n  dependencies:\n    os-tmpdir \"^1.0.0\"\n    uuid \"^2.0.1\"\n\nternary-stream@^2.0.1:\n  version \"2.0.1\"\n  resolved \"https://registry.yarnpkg.com/ternary-stream/-/ternary-stream-2.0.1.tgz#064e489b4b5bf60ba6a6b7bc7f2f5c274ecf8269\"\n  dependencies:\n    duplexify \"^3.5.0\"\n    fork-stream \"^0.0.4\"\n    merge-stream \"^1.0.0\"\n    through2 \"^2.0.1\"\n\ntextextensions@~1.0.0:\n  version \"1.0.2\"\n  resolved \"https://registry.yarnpkg.com/textextensions/-/textextensions-1.0.2.tgz#65486393ee1f2bb039a60cbba05b0b68bd9501d2\"\n\ntfunk@^3.0.1:\n  version \"3.1.0\"\n  resolved \"https://registry.yarnpkg.com/tfunk/-/tfunk-3.1.0.tgz#38e4414fc64977d87afdaa72facb6d29f82f7b5b\"\n  dependencies:\n    chalk \"^1.1.1\"\n    object-path \"^0.9.0\"\n\nthrottleit@^1.0.0:\n  version \"1.0.0\"\n  resolved \"https://registry.yarnpkg.com/throttleit/-/throttleit-1.0.0.tgz#9e785836daf46743145a5984b6268d828528ac6c\"\n\nthrough2-concurrent@^1.1.0:\n  version \"1.1.1\"\n  resolved \"https://registry.yarnpkg.com/through2-concurrent/-/through2-concurrent-1.1.1.tgz#11cb4ea4c9e31bca6e4c1e6dba48d1c728c3524b\"\n  dependencies:\n    through2 \"^2.0.0\"\n\nthrough2-filter@^2.0.0:\n  version \"2.0.0\"\n  resolved \"https://registry.yarnpkg.com/through2-filter/-/through2-filter-2.0.0.tgz#60bc55a0dacb76085db1f9dae99ab43f83d622ec\"\n  dependencies:\n    through2 \"~2.0.0\"\n    xtend \"~4.0.0\"\n\nthrough2@2.0.3, through2@^2.0.0, through2@^2.0.1, through2@^2.0.3, through2@~2.0.0, through2@~2.0.3:\n  version \"2.0.3\"\n  resolved \"https://registry.yarnpkg.com/through2/-/through2-2.0.3.tgz#0004569b37c7c74ba39c43f3ced78d1ad94140be\"\n  dependencies:\n    readable-stream \"^2.1.5\"\n    xtend \"~4.0.1\"\n\nthrough2@^0.6.0, through2@^0.6.1, through2@^0.6.5:\n  version \"0.6.5\"\n  resolved \"https://registry.yarnpkg.com/through2/-/through2-0.6.5.tgz#41ab9c67b29d57209071410e1d7a7a968cd3ad48\"\n  dependencies:\n    readable-stream \">=1.0.33-1 <1.1.0-0\"\n    xtend \">=4.0.0 <4.1.0-0\"\n\nthrough2@~0.4.1, through2@~0.4.2:\n  version \"0.4.2\"\n  resolved \"https://registry.yarnpkg.com/through2/-/through2-0.4.2.tgz#dbf5866031151ec8352bb6c4db64a2292a840b9b\"\n  dependencies:\n    readable-stream \"~1.0.17\"\n    xtend \"~2.1.1\"\n\nthrough@^2.3.8, through@~2.3.4:\n  version \"2.3.8\"\n  resolved \"https://registry.yarnpkg.com/through/-/through-2.3.8.tgz#0dd4c9ffaabc357960b1b724115d7e0e86a2e1f5\"\n\ntime-stamp@^1.0.0:\n  version \"1.1.0\"\n  resolved \"https://registry.yarnpkg.com/time-stamp/-/time-stamp-1.1.0.tgz#764a5a11af50561921b133f3b44e618687e0f5c3\"\n\ntimed-out@^3.0.0:\n  version \"3.1.3\"\n  resolved \"https://registry.yarnpkg.com/timed-out/-/timed-out-3.1.3.tgz#95860bfcc5c76c277f8f8326fd0f5b2e20eba217\"\n\ntimers-browserify@^2.0.2, timers-browserify@^2.0.4:\n  version \"2.0.10\"\n  resolved \"https://registry.yarnpkg.com/timers-browserify/-/timers-browserify-2.0.10.tgz#1d28e3d2aadf1d5a5996c4e9f95601cd053480ae\"\n  dependencies:\n    setimmediate \"^1.0.4\"\n\ntinycolor2@^1.1.2:\n  version \"1.4.1\"\n  resolved \"https://registry.yarnpkg.com/tinycolor2/-/tinycolor2-1.4.1.tgz#f4fad333447bc0b07d4dc8e9209d8f39a8ac77e8\"\n\ntmt-ejs-helper@^0.0.1:\n  version \"0.0.1\"\n  resolved \"https://registry.yarnpkg.com/tmt-ejs-helper/-/tmt-ejs-helper-0.0.1.tgz#2c8e0acc6f3087edee03b2f1d307accfbfbcc63a\"\n  dependencies:\n    ejs \"^2.3.1\"\n    lodash \"^3.5.0\"\n\nto-absolute-glob@^0.1.1:\n  version \"0.1.1\"\n  resolved \"https://registry.yarnpkg.com/to-absolute-glob/-/to-absolute-glob-0.1.1.tgz#1cdfa472a9ef50c239ee66999b662ca0eb39937f\"\n  dependencies:\n    extend-shallow \"^2.0.1\"\n\nto-absolute-glob@^2.0.0:\n  version \"2.0.2\"\n  resolved \"https://registry.yarnpkg.com/to-absolute-glob/-/to-absolute-glob-2.0.2.tgz#1865f43d9e74b0822db9f145b78cff7d0f7c849b\"\n  dependencies:\n    is-absolute \"^1.0.0\"\n    is-negated-glob \"^1.0.0\"\n\nto-array@0.1.4:\n  version \"0.1.4\"\n  resolved \"https://registry.yarnpkg.com/to-array/-/to-array-0.1.4.tgz#17e6c11f73dd4f3d74cda7a4ff3238e9ad9bf890\"\n\nto-arraybuffer@^1.0.0:\n  version \"1.0.1\"\n  resolved \"https://registry.yarnpkg.com/to-arraybuffer/-/to-arraybuffer-1.0.1.tgz#7d229b1fcc637e466ca081180836a7aabff83f43\"\n\nto-buffer@^1.1.0:\n  version \"1.1.1\"\n  resolved \"https://registry.yarnpkg.com/to-buffer/-/to-buffer-1.1.1.tgz#493bd48f62d7c43fcded313a03dcadb2e1213a80\"\n\nto-fast-properties@^1.0.3:\n  version \"1.0.3\"\n  resolved \"https://registry.yarnpkg.com/to-fast-properties/-/to-fast-properties-1.0.3.tgz#b83571fa4d8c25b82e231b06e3a3055de4ca1a47\"\n\nto-iso-string@0.0.2:\n  version \"0.0.2\"\n  resolved \"https://registry.yarnpkg.com/to-iso-string/-/to-iso-string-0.0.2.tgz#4dc19e664dfccbe25bd8db508b00c6da158255d1\"\n\nto-object-path@^0.3.0:\n  version \"0.3.0\"\n  resolved \"https://registry.yarnpkg.com/to-object-path/-/to-object-path-0.3.0.tgz#297588b7b0e7e0ac08e04e672f85c1f4999e17af\"\n  dependencies:\n    kind-of \"^3.0.2\"\n\nto-regex-range@^2.1.0:\n  version \"2.1.1\"\n  resolved \"https://registry.yarnpkg.com/to-regex-range/-/to-regex-range-2.1.1.tgz#7c80c17b9dfebe599e27367e0d4dd5590141db38\"\n  dependencies:\n    is-number \"^3.0.0\"\n    repeat-string \"^1.6.1\"\n\nto-regex@^3.0.1, to-regex@^3.0.2:\n  version \"3.0.2\"\n  resolved \"https://registry.yarnpkg.com/to-regex/-/to-regex-3.0.2.tgz#13cfdd9b336552f30b51f33a8ae1b42a7a7599ce\"\n  dependencies:\n    define-property \"^2.0.2\"\n    extend-shallow \"^3.0.2\"\n    regex-not \"^1.0.2\"\n    safe-regex \"^1.1.0\"\n\nto-through@^2.0.0:\n  version \"2.0.0\"\n  resolved \"https://registry.yarnpkg.com/to-through/-/to-through-2.0.0.tgz#fc92adaba072647bc0b67d6b03664aa195093af6\"\n  dependencies:\n    through2 \"^2.0.3\"\n\ntough-cookie@>=0.12.0:\n  version \"2.4.3\"\n  resolved \"https://registry.yarnpkg.com/tough-cookie/-/tough-cookie-2.4.3.tgz#53f36da3f47783b0925afa06ff9f3b165280f781\"\n  dependencies:\n    psl \"^1.1.24\"\n    punycode \"^1.4.1\"\n\ntough-cookie@~2.3.0, tough-cookie@~2.3.3:\n  version \"2.3.4\"\n  resolved \"https://registry.yarnpkg.com/tough-cookie/-/tough-cookie-2.3.4.tgz#ec60cee38ac675063ffc97a5c18970578ee83655\"\n  dependencies:\n    punycode \"^1.4.1\"\n\ntrim-newlines@^1.0.0:\n  version \"1.0.0\"\n  resolved \"https://registry.yarnpkg.com/trim-newlines/-/trim-newlines-1.0.0.tgz#5887966bb582a4503a41eb524f7d35011815a613\"\n\ntrim-repeated@^1.0.0:\n  version \"1.0.0\"\n  resolved \"https://registry.yarnpkg.com/trim-repeated/-/trim-repeated-1.0.0.tgz#e3646a2ea4e891312bf7eace6cfb05380bc01c21\"\n  dependencies:\n    escape-string-regexp \"^1.0.2\"\n\ntrim-right@^1.0.1:\n  version \"1.0.1\"\n  resolved \"https://registry.yarnpkg.com/trim-right/-/trim-right-1.0.1.tgz#cb2e1203067e0c8de1f614094b9fe45704ea6003\"\n\ntrim@0.0.1:\n  version \"0.0.1\"\n  resolved \"https://registry.yarnpkg.com/trim/-/trim-0.0.1.tgz#5858547f6b290757ee95cccc666fb50084c460dd\"\n\ntty-browserify@0.0.0:\n  version \"0.0.0\"\n  resolved \"https://registry.yarnpkg.com/tty-browserify/-/tty-browserify-0.0.0.tgz#a157ba402da24e9bf957f9aa69d524eed42901a6\"\n\ntunnel-agent@^0.4.0:\n  version \"0.4.3\"\n  resolved \"https://registry.yarnpkg.com/tunnel-agent/-/tunnel-agent-0.4.3.tgz#6373db76909fe570e08d73583365ed828a74eeeb\"\n\ntunnel-agent@^0.6.0:\n  version \"0.6.0\"\n  resolved \"https://registry.yarnpkg.com/tunnel-agent/-/tunnel-agent-0.6.0.tgz#27a5dea06b36b04a0a9966774b290868f0fc40fd\"\n  dependencies:\n    safe-buffer \"^5.0.1\"\n\ntunnel-agent@~0.3.0:\n  version \"0.3.0\"\n  resolved \"https://registry.yarnpkg.com/tunnel-agent/-/tunnel-agent-0.3.0.tgz#ad681b68f5321ad2827c4cfb1b7d5df2cfe942ee\"\n\ntweetnacl@^0.14.3, tweetnacl@~0.14.0:\n  version \"0.14.5\"\n  resolved \"https://registry.yarnpkg.com/tweetnacl/-/tweetnacl-0.14.5.tgz#5ae68177f192d4456269d108afa93ff8743f4f64\"\n\ntypedarray@^0.0.6:\n  version \"0.0.6\"\n  resolved \"https://registry.yarnpkg.com/typedarray/-/typedarray-0.0.6.tgz#867ac74e3864187b1d3d47d996a78ec5c8830777\"\n\nua-parser-js@0.7.17:\n  version \"0.7.17\"\n  resolved \"https://registry.yarnpkg.com/ua-parser-js/-/ua-parser-js-0.7.17.tgz#e9ec5f9498b9ec910e7ae3ac626a805c4d09ecac\"\n\nuglify-js@2.6.4:\n  version \"2.6.4\"\n  resolved \"https://registry.yarnpkg.com/uglify-js/-/uglify-js-2.6.4.tgz#65ea2fb3059c9394692f15fed87c2b36c16b9adf\"\n  dependencies:\n    async \"~0.2.6\"\n    source-map \"~0.5.1\"\n    uglify-to-browserify \"~1.0.0\"\n    yargs \"~3.10.0\"\n\nuglify-js@^2.8.22, uglify-js@^2.8.27:\n  version \"2.8.29\"\n  resolved \"https://registry.yarnpkg.com/uglify-js/-/uglify-js-2.8.29.tgz#29c5733148057bb4e1f75df35b7a9cb72e6a59dd\"\n  dependencies:\n    source-map \"~0.5.1\"\n    yargs \"~3.10.0\"\n  optionalDependencies:\n    uglify-to-browserify \"~1.0.0\"\n\nuglify-js@~2.7.3:\n  version \"2.7.5\"\n  resolved \"https://registry.yarnpkg.com/uglify-js/-/uglify-js-2.7.5.tgz#4612c0c7baaee2ba7c487de4904ae122079f2ca8\"\n  dependencies:\n    async \"~0.2.6\"\n    source-map \"~0.5.1\"\n    uglify-to-browserify \"~1.0.0\"\n    yargs \"~3.10.0\"\n\nuglify-save-license@^0.4.1:\n  version \"0.4.1\"\n  resolved \"https://registry.yarnpkg.com/uglify-save-license/-/uglify-save-license-0.4.1.tgz#95726c17cc6fd171c3617e3bf4d8d82aa8c4cce1\"\n\nuglify-to-browserify@~1.0.0:\n  version \"1.0.2\"\n  resolved \"https://registry.yarnpkg.com/uglify-to-browserify/-/uglify-to-browserify-1.0.2.tgz#6e0924d6bda6b5afe349e39a6d632850a0f882b7\"\n\nultron@~1.1.0:\n  version \"1.1.1\"\n  resolved \"https://registry.yarnpkg.com/ultron/-/ultron-1.1.1.tgz#9fe1536a10a664a65266a1e3ccf85fd36302bc9c\"\n\nunc-path-regex@^0.1.2:\n  version \"0.1.2\"\n  resolved \"https://registry.yarnpkg.com/unc-path-regex/-/unc-path-regex-0.1.2.tgz#e73dd3d7b0d7c5ed86fbac6b0ae7d8c6a69d50fa\"\n\nundertaker-registry@^1.0.0:\n  version \"1.0.1\"\n  resolved \"https://registry.yarnpkg.com/undertaker-registry/-/undertaker-registry-1.0.1.tgz#5e4bda308e4a8a2ae584f9b9a4359a499825cc50\"\n\nundertaker@^1.0.0:\n  version \"1.2.0\"\n  resolved \"https://registry.yarnpkg.com/undertaker/-/undertaker-1.2.0.tgz#339da4646252d082dc378e708067299750e11b49\"\n  dependencies:\n    arr-flatten \"^1.0.1\"\n    arr-map \"^2.0.0\"\n    bach \"^1.0.0\"\n    collection-map \"^1.0.0\"\n    es6-weak-map \"^2.0.1\"\n    last-run \"^1.1.0\"\n    object.defaults \"^1.0.0\"\n    object.reduce \"^1.0.0\"\n    undertaker-registry \"^1.0.0\"\n\nunion-value@^1.0.0:\n  version \"1.0.0\"\n  resolved \"https://registry.yarnpkg.com/union-value/-/union-value-1.0.0.tgz#5c71c34cb5bad5dcebe3ea0cd08207ba5aa1aea4\"\n  dependencies:\n    arr-union \"^3.1.0\"\n    get-value \"^2.0.6\"\n    is-extendable \"^0.1.1\"\n    set-value \"^0.4.3\"\n\nuniq@^1.0.1:\n  version \"1.0.1\"\n  resolved \"https://registry.yarnpkg.com/uniq/-/uniq-1.0.1.tgz#b31c5ae8254844a3a8281541ce2b04b865a734ff\"\n\nuniqs@^2.0.0:\n  version \"2.0.0\"\n  resolved \"https://registry.yarnpkg.com/uniqs/-/uniqs-2.0.0.tgz#ffede4b36b25290696e6e165d4a59edb998e6b02\"\n\nunique-stream@^1.0.0:\n  version \"1.0.0\"\n  resolved \"https://registry.yarnpkg.com/unique-stream/-/unique-stream-1.0.0.tgz#d59a4a75427447d9aa6c91e70263f8d26a4b104b\"\n\nunique-stream@^2.0.2:\n  version \"2.2.1\"\n  resolved \"https://registry.yarnpkg.com/unique-stream/-/unique-stream-2.2.1.tgz#5aa003cfbe94c5ff866c4e7d668bb1c4dbadb369\"\n  dependencies:\n    json-stable-stringify \"^1.0.0\"\n    through2-filter \"^2.0.0\"\n\nuniversalify@^0.1.0:\n  version \"0.1.2\"\n  resolved \"https://registry.yarnpkg.com/universalify/-/universalify-0.1.2.tgz#b646f69be3942dabcecc9d6639c80dc105efaa66\"\n\nunorm@^1.4.1:\n  version \"1.4.1\"\n  resolved \"https://registry.yarnpkg.com/unorm/-/unorm-1.4.1.tgz#364200d5f13646ca8bcd44490271335614792300\"\n\nunpipe@1.0.0, unpipe@~1.0.0:\n  version \"1.0.0\"\n  resolved \"https://registry.yarnpkg.com/unpipe/-/unpipe-1.0.0.tgz#b2bf4ee8514aae6165b4817829d21b2ef49904ec\"\n\nunquote@~1.1.1:\n  version \"1.1.1\"\n  resolved \"https://registry.yarnpkg.com/unquote/-/unquote-1.1.1.tgz#8fded7324ec6e88a0ff8b905e7c098cdc086d544\"\n\nunset-value@^1.0.0:\n  version \"1.0.0\"\n  resolved \"https://registry.yarnpkg.com/unset-value/-/unset-value-1.0.0.tgz#8376873f7d2335179ffb1e6fc3a8ed0dfc8ab559\"\n  dependencies:\n    has-value \"^0.3.1\"\n    isobject \"^3.0.0\"\n\nunzip-response@^1.0.2:\n  version \"1.0.2\"\n  resolved \"https://registry.yarnpkg.com/unzip-response/-/unzip-response-1.0.2.tgz#b984f0877fc0a89c2c773cc1ef7b5b232b5b06fe\"\n\nupath@^1.0.5:\n  version \"1.1.0\"\n  resolved \"https://registry.yarnpkg.com/upath/-/upath-1.1.0.tgz#35256597e46a581db4793d0ce47fa9aebfc9fabd\"\n\nupath@^1.1.0:\n  version \"1.1.2\"\n  resolved \"https://registry.yarnpkg.com/upath/-/upath-1.1.2.tgz#3db658600edaeeccbe6db5e684d67ee8c2acd068\"\n\nurix@^0.1.0:\n  version \"0.1.0\"\n  resolved \"https://registry.yarnpkg.com/urix/-/urix-0.1.0.tgz#da937f7a62e21fec1fd18d49b35c2935067a6c72\"\n\nurl-parse-lax@^1.0.0:\n  version \"1.0.0\"\n  resolved \"https://registry.yarnpkg.com/url-parse-lax/-/url-parse-lax-1.0.0.tgz#7af8f303645e9bd79a272e7a14ac68bc0609da73\"\n  dependencies:\n    prepend-http \"^1.0.1\"\n\nurl-regex@^3.0.0:\n  version \"3.2.0\"\n  resolved \"https://registry.yarnpkg.com/url-regex/-/url-regex-3.2.0.tgz#dbad1e0c9e29e105dd0b1f09f6862f7fdb482724\"\n  dependencies:\n    ip-regex \"^1.0.1\"\n\nurl@^0.11.0:\n  version \"0.11.0\"\n  resolved \"https://registry.yarnpkg.com/url/-/url-0.11.0.tgz#3838e97cfc60521eb73c525a8e55bfdd9e2e28f1\"\n  dependencies:\n    punycode \"1.3.2\"\n    querystring \"0.2.0\"\n\nuse@^3.1.0:\n  version \"3.1.1\"\n  resolved \"https://registry.yarnpkg.com/use/-/use-3.1.1.tgz#d50c8cac79a19fbc20f2911f56eb973f4e10070f\"\n\nutil-deprecate@~1.0.1:\n  version \"1.0.2\"\n  resolved \"https://registry.yarnpkg.com/util-deprecate/-/util-deprecate-1.0.2.tgz#450d4dc9fa70de732762fbd2d4a28981419a0ccf\"\n\nutil.promisify@~1.0.0:\n  version \"1.0.0\"\n  resolved \"https://registry.yarnpkg.com/util.promisify/-/util.promisify-1.0.0.tgz#440f7165a459c9a16dc145eb8e72f35687097030\"\n  dependencies:\n    define-properties \"^1.1.2\"\n    object.getownpropertydescriptors \"^2.0.3\"\n\nutil@0.10.3:\n  version \"0.10.3\"\n  resolved \"https://registry.yarnpkg.com/util/-/util-0.10.3.tgz#7afb1afe50805246489e3db7fe0ed379336ac0f9\"\n  dependencies:\n    inherits \"2.0.1\"\n\nutil@^0.10.3:\n  version \"0.10.4\"\n  resolved \"https://registry.yarnpkg.com/util/-/util-0.10.4.tgz#3aa0125bfe668a4672de58857d3ace27ecb76901\"\n  dependencies:\n    inherits \"2.0.3\"\n\nutils-merge@1.0.1:\n  version \"1.0.1\"\n  resolved \"https://registry.yarnpkg.com/utils-merge/-/utils-merge-1.0.1.tgz#9f95710f50a267947b2ccc124741c1028427e713\"\n\nuuid@^2.0.1:\n  version \"2.0.3\"\n  resolved \"https://registry.yarnpkg.com/uuid/-/uuid-2.0.3.tgz#67e2e863797215530dff318e5bf9dcebfd47b21a\"\n\nuuid@^3.0.0, uuid@^3.1.0:\n  version \"3.3.2\"\n  resolved \"https://registry.yarnpkg.com/uuid/-/uuid-3.3.2.tgz#1b4af4955eb3077c501c23872fc6513811587131\"\n\nv8flags@^3.0.1:\n  version \"3.1.1\"\n  resolved \"https://registry.yarnpkg.com/v8flags/-/v8flags-3.1.1.tgz#42259a1461c08397e37fe1d4f1cfb59cad85a053\"\n  dependencies:\n    homedir-polyfill \"^1.0.1\"\n\nvali-date@^1.0.0:\n  version \"1.0.0\"\n  resolved \"https://registry.yarnpkg.com/vali-date/-/vali-date-1.0.0.tgz#1b904a59609fb328ef078138420934f6b86709a6\"\n\nvalidate-npm-package-license@^3.0.1:\n  version \"3.0.4\"\n  resolved \"https://registry.yarnpkg.com/validate-npm-package-license/-/validate-npm-package-license-3.0.4.tgz#fc91f6b9c7ba15c857f4cb2c5defeec39d4f410a\"\n  dependencies:\n    spdx-correct \"^3.0.0\"\n    spdx-expression-parse \"^3.0.0\"\n\nvalue-or-function@^3.0.0:\n  version \"3.0.0\"\n  resolved \"https://registry.yarnpkg.com/value-or-function/-/value-or-function-3.0.0.tgz#1c243a50b595c1be54a754bfece8563b9ff8d813\"\n\nvendors@^1.0.0:\n  version \"1.0.2\"\n  resolved \"https://registry.yarnpkg.com/vendors/-/vendors-1.0.2.tgz#7fcb5eef9f5623b156bcea89ec37d63676f21801\"\n\nverror@1.10.0:\n  version \"1.10.0\"\n  resolved \"https://registry.yarnpkg.com/verror/-/verror-1.10.0.tgz#3a105ca17053af55d6e270c1f8288682e18da400\"\n  dependencies:\n    assert-plus \"^1.0.0\"\n    core-util-is \"1.0.2\"\n    extsprintf \"^1.2.0\"\n\nvinyl-assign@^1.0.1:\n  version \"1.2.1\"\n  resolved \"https://registry.yarnpkg.com/vinyl-assign/-/vinyl-assign-1.2.1.tgz#4d198891b5515911d771a8cd9c5480a46a074a45\"\n  dependencies:\n    object-assign \"^4.0.1\"\n    readable-stream \"^2.0.0\"\n\nvinyl-fs@^0.3.7:\n  version \"0.3.14\"\n  resolved \"https://registry.yarnpkg.com/vinyl-fs/-/vinyl-fs-0.3.14.tgz#9a6851ce1cac1c1cea5fe86c0931d620c2cfa9e6\"\n  dependencies:\n    defaults \"^1.0.0\"\n    glob-stream \"^3.1.5\"\n    glob-watcher \"^0.0.6\"\n    graceful-fs \"^3.0.0\"\n    mkdirp \"^0.5.0\"\n    strip-bom \"^1.0.0\"\n    through2 \"^0.6.1\"\n    vinyl \"^0.4.0\"\n\nvinyl-fs@^2.1.1, vinyl-fs@^2.2.0:\n  version \"2.4.4\"\n  resolved \"https://registry.yarnpkg.com/vinyl-fs/-/vinyl-fs-2.4.4.tgz#be6ff3270cb55dfd7d3063640de81f25d7532239\"\n  dependencies:\n    duplexify \"^3.2.0\"\n    glob-stream \"^5.3.2\"\n    graceful-fs \"^4.0.0\"\n    gulp-sourcemaps \"1.6.0\"\n    is-valid-glob \"^0.3.0\"\n    lazystream \"^1.0.0\"\n    lodash.isequal \"^4.0.0\"\n    merge-stream \"^1.0.0\"\n    mkdirp \"^0.5.0\"\n    object-assign \"^4.0.0\"\n    readable-stream \"^2.0.4\"\n    strip-bom \"^2.0.0\"\n    strip-bom-stream \"^1.0.0\"\n    through2 \"^2.0.0\"\n    through2-filter \"^2.0.0\"\n    vali-date \"^1.0.0\"\n    vinyl \"^1.0.0\"\n\nvinyl-fs@^3.0.0:\n  version \"3.0.3\"\n  resolved \"https://registry.yarnpkg.com/vinyl-fs/-/vinyl-fs-3.0.3.tgz#c85849405f67428feabbbd5c5dbdd64f47d31bc7\"\n  dependencies:\n    fs-mkdirp-stream \"^1.0.0\"\n    glob-stream \"^6.1.0\"\n    graceful-fs \"^4.0.0\"\n    is-valid-glob \"^1.0.0\"\n    lazystream \"^1.0.0\"\n    lead \"^1.0.0\"\n    object.assign \"^4.0.4\"\n    pumpify \"^1.3.5\"\n    readable-stream \"^2.3.3\"\n    remove-bom-buffer \"^3.0.0\"\n    remove-bom-stream \"^1.2.0\"\n    resolve-options \"^1.1.0\"\n    through2 \"^2.0.0\"\n    to-through \"^2.0.0\"\n    value-or-function \"^3.0.0\"\n    vinyl \"^2.0.0\"\n    vinyl-sourcemap \"^1.1.0\"\n\nvinyl-sourcemap@^1.1.0:\n  version \"1.1.0\"\n  resolved \"https://registry.yarnpkg.com/vinyl-sourcemap/-/vinyl-sourcemap-1.1.0.tgz#92a800593a38703a8cdb11d8b300ad4be63b3e16\"\n  dependencies:\n    append-buffer \"^1.0.2\"\n    convert-source-map \"^1.5.0\"\n    graceful-fs \"^4.1.6\"\n    normalize-path \"^2.1.1\"\n    now-and-later \"^2.0.0\"\n    remove-bom-buffer \"^3.0.0\"\n    vinyl \"^2.0.0\"\n\nvinyl-sourcemaps-apply@^0.2.0, vinyl-sourcemaps-apply@^0.2.1:\n  version \"0.2.1\"\n  resolved \"https://registry.yarnpkg.com/vinyl-sourcemaps-apply/-/vinyl-sourcemaps-apply-0.2.1.tgz#ab6549d61d172c2b1b87be5c508d239c8ef87705\"\n  dependencies:\n    source-map \"^0.5.1\"\n\nvinyl@^0.4.0, vinyl@^0.4.3:\n  version \"0.4.6\"\n  resolved \"https://registry.yarnpkg.com/vinyl/-/vinyl-0.4.6.tgz#2f356c87a550a255461f36bbeb2a5ba8bf784847\"\n  dependencies:\n    clone \"^0.2.0\"\n    clone-stats \"^0.0.1\"\n\nvinyl@^0.5.0:\n  version \"0.5.3\"\n  resolved \"https://registry.yarnpkg.com/vinyl/-/vinyl-0.5.3.tgz#b0455b38fc5e0cf30d4325132e461970c2091cde\"\n  dependencies:\n    clone \"^1.0.0\"\n    clone-stats \"^0.0.1\"\n    replace-ext \"0.0.1\"\n\nvinyl@^1.0.0, vinyl@^1.1.0:\n  version \"1.2.0\"\n  resolved \"https://registry.yarnpkg.com/vinyl/-/vinyl-1.2.0.tgz#5c88036cf565e5df05558bfc911f8656df218884\"\n  dependencies:\n    clone \"^1.0.0\"\n    clone-stats \"^0.0.1\"\n    replace-ext \"0.0.1\"\n\nvinyl@^2.0.0, vinyl@^2.0.1, vinyl@^2.1.0, vinyl@^2.2.0:\n  version \"2.2.0\"\n  resolved \"https://registry.yarnpkg.com/vinyl/-/vinyl-2.2.0.tgz#d85b07da96e458d25b2ffe19fece9f2caa13ed86\"\n  dependencies:\n    clone \"^2.1.1\"\n    clone-buffer \"^1.0.0\"\n    clone-stats \"^1.0.0\"\n    cloneable-readable \"^1.0.0\"\n    remove-trailing-separator \"^1.0.1\"\n    replace-ext \"^1.0.0\"\n\nvinyl@~2.1.0:\n  version \"2.1.0\"\n  resolved \"https://registry.yarnpkg.com/vinyl/-/vinyl-2.1.0.tgz#021f9c2cf951d6b939943c89eb5ee5add4fd924c\"\n  dependencies:\n    clone \"^2.1.1\"\n    clone-buffer \"^1.0.0\"\n    clone-stats \"^1.0.0\"\n    cloneable-readable \"^1.0.0\"\n    remove-trailing-separator \"^1.0.1\"\n    replace-ext \"^1.0.0\"\n\nvm-browserify@0.0.4:\n  version \"0.0.4\"\n  resolved \"https://registry.yarnpkg.com/vm-browserify/-/vm-browserify-0.0.4.tgz#5d7ea45bbef9e4a6ff65f95438e0a87c357d5a73\"\n  dependencies:\n    indexof \"0.0.1\"\n\nware@^1.2.0:\n  version \"1.3.0\"\n  resolved \"https://registry.yarnpkg.com/ware/-/ware-1.3.0.tgz#d1b14f39d2e2cb4ab8c4098f756fe4b164e473d4\"\n  dependencies:\n    wrap-fn \"^0.1.0\"\n\nwatchpack@^0.2.1:\n  version \"0.2.9\"\n  resolved \"https://registry.yarnpkg.com/watchpack/-/watchpack-0.2.9.tgz#62eaa4ab5e5ba35fdfc018275626e3c0f5e3fb0b\"\n  dependencies:\n    async \"^0.9.0\"\n    chokidar \"^1.0.0\"\n    graceful-fs \"^4.1.2\"\n\nwatchpack@^1.3.1:\n  version \"1.6.0\"\n  resolved \"https://registry.yarnpkg.com/watchpack/-/watchpack-1.6.0.tgz#4bc12c2ebe8aa277a71f1d3f14d685c7b446cd00\"\n  dependencies:\n    chokidar \"^2.0.2\"\n    graceful-fs \"^4.1.2\"\n    neo-async \"^2.5.0\"\n\nwebpack-core@~0.6.9:\n  version \"0.6.9\"\n  resolved \"https://registry.yarnpkg.com/webpack-core/-/webpack-core-0.6.9.tgz#fc571588c8558da77be9efb6debdc5a3b172bdc2\"\n  dependencies:\n    source-list-map \"~0.1.7\"\n    source-map \"~0.4.1\"\n\nwebpack-sources@^1.0.1:\n  version \"1.1.0\"\n  resolved \"https://registry.yarnpkg.com/webpack-sources/-/webpack-sources-1.1.0.tgz#a101ebae59d6507354d71d8013950a3a8b7a5a54\"\n  dependencies:\n    source-list-map \"^2.0.0\"\n    source-map \"~0.6.1\"\n\nwebpack-stream@^3.2.0:\n  version \"3.2.0\"\n  resolved \"https://registry.yarnpkg.com/webpack-stream/-/webpack-stream-3.2.0.tgz#3a1d160fb11d41727b7ce6f32f722464f98b2186\"\n  dependencies:\n    gulp-util \"^3.0.7\"\n    lodash.clone \"^4.3.2\"\n    lodash.some \"^4.2.2\"\n    memory-fs \"^0.3.0\"\n    through \"^2.3.8\"\n    vinyl \"^1.1.0\"\n    webpack \"^1.12.9\"\n\nwebpack@^1.12.9:\n  version \"1.15.0\"\n  resolved \"https://registry.yarnpkg.com/webpack/-/webpack-1.15.0.tgz#4ff31f53db03339e55164a9d468ee0324968fe98\"\n  dependencies:\n    acorn \"^3.0.0\"\n    async \"^1.3.0\"\n    clone \"^1.0.2\"\n    enhanced-resolve \"~0.9.0\"\n    interpret \"^0.6.4\"\n    loader-utils \"^0.2.11\"\n    memory-fs \"~0.3.0\"\n    mkdirp \"~0.5.0\"\n    node-libs-browser \"^0.7.0\"\n    optimist \"~0.6.0\"\n    supports-color \"^3.1.0\"\n    tapable \"~0.1.8\"\n    uglify-js \"~2.7.3\"\n    watchpack \"^0.2.1\"\n    webpack-core \"~0.6.9\"\n\nwebpack@^2.2.1:\n  version \"2.7.0\"\n  resolved \"https://registry.yarnpkg.com/webpack/-/webpack-2.7.0.tgz#b2a1226804373ffd3d03ea9c6bd525067034f6b1\"\n  dependencies:\n    acorn \"^5.0.0\"\n    acorn-dynamic-import \"^2.0.0\"\n    ajv \"^4.7.0\"\n    ajv-keywords \"^1.1.1\"\n    async \"^2.1.2\"\n    enhanced-resolve \"^3.3.0\"\n    interpret \"^1.0.0\"\n    json-loader \"^0.5.4\"\n    json5 \"^0.5.1\"\n    loader-runner \"^2.3.0\"\n    loader-utils \"^0.2.16\"\n    memory-fs \"~0.4.1\"\n    mkdirp \"~0.5.0\"\n    node-libs-browser \"^2.0.0\"\n    source-map \"^0.5.3\"\n    supports-color \"^3.1.0\"\n    tapable \"~0.2.5\"\n    uglify-js \"^2.8.27\"\n    watchpack \"^1.3.1\"\n    webpack-sources \"^1.0.1\"\n    yargs \"^6.0.0\"\n\nwhen@^3.7.8:\n  version \"3.7.8\"\n  resolved \"https://registry.yarnpkg.com/when/-/when-3.7.8.tgz#c7130b6a7ea04693e842cdc9e7a1f2aa39a39f82\"\n\nwhet.extend@~0.9.9:\n  version \"0.9.9\"\n  resolved \"https://registry.yarnpkg.com/whet.extend/-/whet.extend-0.9.9.tgz#f877d5bf648c97e5aa542fadc16d6a259b9c11a1\"\n\nwhich-module@^1.0.0:\n  version \"1.0.0\"\n  resolved \"https://registry.yarnpkg.com/which-module/-/which-module-1.0.0.tgz#bba63ca861948994ff307736089e3b96026c2a4f\"\n\nwhich-module@^2.0.0:\n  version \"2.0.0\"\n  resolved \"https://registry.yarnpkg.com/which-module/-/which-module-2.0.0.tgz#d9ef07dce77b9902b8a3a8fa4b31c3e3f7e6e87a\"\n\nwhich@1, which@^1.2.10, which@^1.2.14, which@^1.2.9:\n  version \"1.3.1\"\n  resolved \"https://registry.yarnpkg.com/which/-/which-1.3.1.tgz#a45043d54f5805316da8d62f9f50918d3da70b0a\"\n  dependencies:\n    isexe \"^2.0.0\"\n\nwide-align@^1.1.0:\n  version \"1.1.3\"\n  resolved \"https://registry.yarnpkg.com/wide-align/-/wide-align-1.1.3.tgz#ae074e6bdc0c14a431e804e624549c633b000457\"\n  dependencies:\n    string-width \"^1.0.2 || 2\"\n\nwindow-size@0.1.0:\n  version \"0.1.0\"\n  resolved \"https://registry.yarnpkg.com/window-size/-/window-size-0.1.0.tgz#5438cd2ea93b202efa3a19fe8887aee7c94f9c9d\"\n\nwindow-size@^0.2.0:\n  version \"0.2.0\"\n  resolved \"https://registry.yarnpkg.com/window-size/-/window-size-0.2.0.tgz#b4315bb4214a3d7058ebeee892e13fa24d98b075\"\n\nwinston@^2.4.1:\n  version \"2.4.3\"\n  resolved \"https://registry.yarnpkg.com/winston/-/winston-2.4.3.tgz#7a9fdab371b6d3d9b63a592947846d856948c517\"\n  dependencies:\n    async \"~1.0.0\"\n    colors \"1.0.x\"\n    cycle \"1.0.x\"\n    eyes \"0.1.x\"\n    isstream \"0.1.x\"\n    stack-trace \"0.0.x\"\n\nwordwrap@0.0.2:\n  version \"0.0.2\"\n  resolved \"https://registry.yarnpkg.com/wordwrap/-/wordwrap-0.0.2.tgz#b79669bb42ecb409f83d583cad52ca17eaa1643f\"\n\nwordwrap@~0.0.2:\n  version \"0.0.3\"\n  resolved \"https://registry.yarnpkg.com/wordwrap/-/wordwrap-0.0.3.tgz#a3d5da6cd5c0bc0008d37234bbaf1bed63059107\"\n\nwrap-ansi@^2.0.0:\n  version \"2.1.0\"\n  resolved \"https://registry.yarnpkg.com/wrap-ansi/-/wrap-ansi-2.1.0.tgz#d8fc3d284dd05794fe84973caecdd1cf824fdd85\"\n  dependencies:\n    string-width \"^1.0.1\"\n    strip-ansi \"^3.0.1\"\n\nwrap-fn@^0.1.0:\n  version \"0.1.5\"\n  resolved \"https://registry.yarnpkg.com/wrap-fn/-/wrap-fn-0.1.5.tgz#f21b6e41016ff4a7e31720dbc63a09016bdf9845\"\n  dependencies:\n    co \"3.1.0\"\n\nwrappy@1:\n  version \"1.0.2\"\n  resolved \"https://registry.yarnpkg.com/wrappy/-/wrappy-1.0.2.tgz#b5243d8f3ec1aa35f1364605bc0d1036e30ab69f\"\n\nws@~3.3.1:\n  version \"3.3.3\"\n  resolved \"https://registry.yarnpkg.com/ws/-/ws-3.3.3.tgz#f1cf84fe2d5e901ebce94efaece785f187a228f2\"\n  dependencies:\n    async-limiter \"~1.0.0\"\n    safe-buffer \"~5.1.0\"\n    ultron \"~1.1.0\"\n\nxhr@^2.0.1:\n  version \"2.5.0\"\n  resolved \"https://registry.yarnpkg.com/xhr/-/xhr-2.5.0.tgz#bed8d1676d5ca36108667692b74b316c496e49dd\"\n  dependencies:\n    global \"~4.3.0\"\n    is-function \"^1.0.1\"\n    parse-headers \"^2.0.0\"\n    xtend \"^4.0.0\"\n\nxml-parse-from-string@^1.0.0:\n  version \"1.0.1\"\n  resolved \"https://registry.yarnpkg.com/xml-parse-from-string/-/xml-parse-from-string-1.0.1.tgz#a9029e929d3dbcded169f3c6e28238d95a5d5a28\"\n\nxml2js@^0.4.5:\n  version \"0.4.19\"\n  resolved \"https://registry.yarnpkg.com/xml2js/-/xml2js-0.4.19.tgz#686c20f213209e94abf0d1bcf1efaa291c7827a7\"\n  dependencies:\n    sax \">=0.6.0\"\n    xmlbuilder \"~9.0.1\"\n\nxmlbuilder@~9.0.1:\n  version \"9.0.7\"\n  resolved \"https://registry.yarnpkg.com/xmlbuilder/-/xmlbuilder-9.0.7.tgz#132ee63d2ec5565c557e20f4c22df9aca686b10d\"\n\nxmldom@0.1.27:\n  version \"0.1.27\"\n  resolved \"https://registry.yarnpkg.com/xmldom/-/xmldom-0.1.27.tgz#d501f97b3bdb403af8ef9ecc20573187aadac0e9\"\n\nxmlhttprequest-ssl@~1.5.4:\n  version \"1.5.5\"\n  resolved \"https://registry.yarnpkg.com/xmlhttprequest-ssl/-/xmlhttprequest-ssl-1.5.5.tgz#c2876b06168aadc40e57d97e81191ac8f4398b3e\"\n\nxpath@^0.0.27:\n  version \"0.0.27\"\n  resolved \"https://registry.yarnpkg.com/xpath/-/xpath-0.0.27.tgz#dd3421fbdcc5646ac32c48531b4d7e9d0c2cfa92\"\n\n\"xtend@>=4.0.0 <4.1.0-0\", xtend@^4.0.0, xtend@~4.0.0, xtend@~4.0.1:\n  version \"4.0.1\"\n  resolved \"https://registry.yarnpkg.com/xtend/-/xtend-4.0.1.tgz#a5c6d532be656e23db820efb943a1f04998d63af\"\n\nxtend@~2.1.1:\n  version \"2.1.2\"\n  resolved \"https://registry.yarnpkg.com/xtend/-/xtend-2.1.2.tgz#6efecc2a4dad8e6962c4901b337ce7ba87b5d28b\"\n  dependencies:\n    object-keys \"~0.4.0\"\n\ny18n@^3.2.1:\n  version \"3.2.1\"\n  resolved \"https://registry.yarnpkg.com/y18n/-/y18n-3.2.1.tgz#6d15fba884c08679c0d77e88e7759e811e07fa41\"\n\nyallist@^2.1.2:\n  version \"2.1.2\"\n  resolved \"https://registry.yarnpkg.com/yallist/-/yallist-2.1.2.tgz#1c11f9218f076089a47dd512f93c6699a6a81d52\"\n\nyallist@^3.0.0, yallist@^3.0.2:\n  version \"3.0.2\"\n  resolved \"https://registry.yarnpkg.com/yallist/-/yallist-3.0.2.tgz#8452b4bb7e83c7c188d8041c1a837c773d6d8bb9\"\n\nyargs-parser@^4.1.0, yargs-parser@^4.2.0:\n  version \"4.2.1\"\n  resolved \"https://registry.yarnpkg.com/yargs-parser/-/yargs-parser-4.2.1.tgz#29cceac0dc4f03c6c87b4a9f217dd18c9f74871c\"\n  dependencies:\n    camelcase \"^3.0.0\"\n\nyargs-parser@^5.0.0:\n  version \"5.0.0\"\n  resolved \"https://registry.yarnpkg.com/yargs-parser/-/yargs-parser-5.0.0.tgz#275ecf0d7ffe05c77e64e7c86e4cd94bf0e1228a\"\n  dependencies:\n    camelcase \"^3.0.0\"\n\nyargs-parser@^9.0.2:\n  version \"9.0.2\"\n  resolved \"https://registry.yarnpkg.com/yargs-parser/-/yargs-parser-9.0.2.tgz#9ccf6a43460fe4ed40a9bb68f48d43b8a68cc077\"\n  dependencies:\n    camelcase \"^4.1.0\"\n\nyargs@6.4.0:\n  version \"6.4.0\"\n  resolved \"https://registry.yarnpkg.com/yargs/-/yargs-6.4.0.tgz#816e1a866d5598ccf34e5596ddce22d92da490d4\"\n  dependencies:\n    camelcase \"^3.0.0\"\n    cliui \"^3.2.0\"\n    decamelize \"^1.1.1\"\n    get-caller-file \"^1.0.1\"\n    os-locale \"^1.4.0\"\n    read-pkg-up \"^1.0.1\"\n    require-directory \"^2.1.1\"\n    require-main-filename \"^1.0.1\"\n    set-blocking \"^2.0.0\"\n    string-width \"^1.0.2\"\n    which-module \"^1.0.0\"\n    window-size \"^0.2.0\"\n    y18n \"^3.2.1\"\n    yargs-parser \"^4.1.0\"\n\nyargs@6.6.0, yargs@^6.0.0:\n  version \"6.6.0\"\n  resolved \"https://registry.yarnpkg.com/yargs/-/yargs-6.6.0.tgz#782ec21ef403345f830a808ca3d513af56065208\"\n  dependencies:\n    camelcase \"^3.0.0\"\n    cliui \"^3.2.0\"\n    decamelize \"^1.1.1\"\n    get-caller-file \"^1.0.1\"\n    os-locale \"^1.4.0\"\n    read-pkg-up \"^1.0.1\"\n    require-directory \"^2.1.1\"\n    require-main-filename \"^1.0.1\"\n    set-blocking \"^2.0.0\"\n    string-width \"^1.0.2\"\n    which-module \"^1.0.0\"\n    y18n \"^3.2.1\"\n    yargs-parser \"^4.2.0\"\n\nyargs@^11.0.0:\n  version \"11.1.0\"\n  resolved \"https://registry.yarnpkg.com/yargs/-/yargs-11.1.0.tgz#90b869934ed6e871115ea2ff58b03f4724ed2d77\"\n  dependencies:\n    cliui \"^4.0.0\"\n    decamelize \"^1.1.1\"\n    find-up \"^2.1.0\"\n    get-caller-file \"^1.0.1\"\n    os-locale \"^2.0.0\"\n    require-directory \"^2.1.1\"\n    require-main-filename \"^1.0.1\"\n    set-blocking \"^2.0.0\"\n    string-width \"^2.0.0\"\n    which-module \"^2.0.0\"\n    y18n \"^3.2.1\"\n    yargs-parser \"^9.0.2\"\n\nyargs@^7.0.0, yargs@^7.1.0:\n  version \"7.1.0\"\n  resolved \"https://registry.yarnpkg.com/yargs/-/yargs-7.1.0.tgz#6ba318eb16961727f5d284f8ea003e8d6154d0c8\"\n  dependencies:\n    camelcase \"^3.0.0\"\n    cliui \"^3.2.0\"\n    decamelize \"^1.1.1\"\n    get-caller-file \"^1.0.1\"\n    os-locale \"^1.4.0\"\n    read-pkg-up \"^1.0.1\"\n    require-directory \"^2.1.1\"\n    require-main-filename \"^1.0.1\"\n    set-blocking \"^2.0.0\"\n    string-width \"^1.0.2\"\n    which-module \"^1.0.0\"\n    y18n \"^3.2.1\"\n    yargs-parser \"^5.0.0\"\n\nyargs@~3.10.0:\n  version \"3.10.0\"\n  resolved \"https://registry.yarnpkg.com/yargs/-/yargs-3.10.0.tgz#f7ee7bd857dd7c1d2d38c0e74efbd681d1431fd1\"\n  dependencies:\n    camelcase \"^1.0.2\"\n    cliui \"^2.1.0\"\n    decamelize \"^1.0.0\"\n    window-size \"0.1.0\"\n\nyauzl@2.4.1:\n  version \"2.4.1\"\n  resolved \"https://registry.yarnpkg.com/yauzl/-/yauzl-2.4.1.tgz#9528f442dab1b2284e58b4379bb194e22e0c4005\"\n  dependencies:\n    fd-slicer \"~1.0.1\"\n\nyauzl@^2.2.1:\n  version \"2.10.0\"\n  resolved \"https://registry.yarnpkg.com/yauzl/-/yauzl-2.10.0.tgz#c7eb17c93e112cb1086fa6d8e51fb0667b79a5f9\"\n  dependencies:\n    buffer-crc32 \"~0.2.3\"\n    fd-slicer \"~1.1.0\"\n\nyazl@^2.1.0:\n  version \"2.4.3\"\n  resolved \"https://registry.yarnpkg.com/yazl/-/yazl-2.4.3.tgz#ec26e5cc87d5601b9df8432dbdd3cd2e5173a071\"\n  dependencies:\n    buffer-crc32 \"~0.2.3\"\n\nyeast@0.1.2:\n  version \"0.1.2\"\n  resolved \"https://registry.yarnpkg.com/yeast/-/yeast-0.1.2.tgz#008e06d8094320c372dbc2f8ed76a0ca6c8ac419\"\n"
        }
      ]
    }
  ]
}