{
  "metadata": {
    "timestamp": 1736711428008,
    "page": 220,
    "hasNextPage": true,
    "endCursor": "Y3Vyc29yOjIyMA==",
    "completionStatus": "IN_PROGRESS"
  },
  "repositories": [
    {
      "nameWithOwner": "Idered/chalk.ist",
      "stars": 1386,
      "defaultBranch": "main",
      "files": [
        {
          "name": ".github",
          "type": "tree",
          "content": null
        },
        {
          "name": ".gitignore",
          "type": "blob",
          "size": 0.3662109375,
          "content": "node_modules\n.DS_Store\ndist\ndist-ssr\n*.local\n.vercel\n\n# Logs\nlogs\n*.log\nnpm-debug.log*\nyarn-debug.log*\nyarn-error.log*\npnpm-debug.log*\nlerna-debug.log*\n\nnode_modules\ndist\ndist-ssr\n*.local\n\n# Editor directories and files\n.vscode/*\n!.vscode/extensions.json\n.idea\n.DS_Store\n*.suo\n*.ntvs*\n*.njsproj\n*.sln\n*.sw?\n\n.dev\n.env\nsupabase/.temp\n\n.nuxt\n.output\n\napp/components.d.ts\n\n.data"
        },
        {
          "name": ".vercelignore",
          "type": "blob",
          "size": 0.009765625,
          "content": "README.md\n"
        },
        {
          "name": ".vscode",
          "type": "tree",
          "content": null
        },
        {
          "name": "LICENSE",
          "type": "blob",
          "size": 1.052734375,
          "content": "MIT License\n\nCopyright (c) 2022-2024 Kasper Mikiewicz\n\nPermission is hereby granted, free of charge, to any person obtaining a copy\nof this software and associated documentation files (the \"Software\"), to deal\nin the Software without restriction, including without limitation the rights\nto use, copy, modify, merge, publish, distribute, sublicense, and/or sell\ncopies of the Software, and to permit persons to whom the Software is\nfurnished to do so, subject to the following conditions:\n\nThe above copyright notice and this permission notice shall be included in all\ncopies or substantial portions of the Software.\n\nTHE SOFTWARE IS PROVIDED \"AS IS\", WITHOUT WARRANTY OF ANY KIND, EXPRESS OR\nIMPLIED, INCLUDING BUT NOT LIMITED TO THE WARRANTIES OF MERCHANTABILITY,\nFITNESS FOR A PARTICULAR PURPOSE AND NONINFRINGEMENT. IN NO EVENT SHALL THE\nAUTHORS OR COPYRIGHT HOLDERS BE LIABLE FOR ANY CLAIM, DAMAGES OR OTHER\nLIABILITY, WHETHER IN AN ACTION OF CONTRACT, TORT OR OTHERWISE, ARISING FROM,\nOUT OF OR IN CONNECTION WITH THE SOFTWARE OR THE USE OR OTHER DEALINGS IN THE\nSOFTWARE.\n"
        },
        {
          "name": "README.md",
          "type": "blob",
          "size": 0.3154296875,
          "content": "<h1 align=\"center\">\nChalk.ist\n</h1>\n\n<p align=\"center\">Create beautiful images of your source code</p>\n\n<p align=\"center\">\n<a href=\"https://chalk.ist\">Go to App</a>\n</p>\n\n[![](./.github/screenshot.png)](https://chalk.ist)\n\n## Development\n\n```\npnpm install\n```\n\n```\npnpm run dev\n```\n\n## License\n\nMIT - Kasper Mikiewicz 2022\n"
        },
        {
          "name": "app",
          "type": "tree",
          "content": null
        },
        {
          "name": "drizzle.config.ts",
          "type": "blob",
          "size": 0.1796875,
          "content": "import { defineConfig } from \"drizzle-kit\";\n\nexport default defineConfig({\n  dialect: \"postgresql\",\n  schema: \"./server/database/schema.ts\",\n  out: \"./server/database/migrations\",\n});\n"
        },
        {
          "name": "modules",
          "type": "tree",
          "content": null
        },
        {
          "name": "nuxt.config.ts",
          "type": "blob",
          "size": 4.7158203125,
          "content": "import IconsResolver from \"unplugin-icons/resolver\";\nimport Components from \"unplugin-vue-components/vite\";\n\nexport default defineNuxtConfig({\n  hub: {\n    blob: true,\n    bindings: {\n      hyperdrive: {\n        POSTGRES: process.env.NUXT_HUB_HYPERDRIVE_ID,\n      },\n    },\n  },\n\n  future: { compatibilityVersion: 4 },\n\n  nitro: {\n    routeRules: {\n      \"/\": { prerender: true },\n    },\n  },\n\n  experimental: {\n    payloadExtraction: false,\n  },\n\n  typescript: {\n    tsConfig: {\n      compilerOptions: {\n        noUncheckedIndexedAccess: false,\n      },\n    },\n  },\n\n  components: {\n    dirs: [\n      \"~/components/shared\",\n      \"~/components/ui/editor\",\n      \"~/components/ui/sidebar\",\n      \"~/components/ui\",\n      \"~/components\",\n    ],\n  },\n\n  modules: [\n    \"@nuxtjs/tailwindcss\",\n    \"@pinia/nuxt\",\n    \"unplugin-icons/nuxt\",\n    \"@vite-pwa/nuxt\",\n    \"@nuxt/scripts\",\n    \"@nuxthub/core\",\n  ],\n\n  tailwindcss: {\n    viewer: false,\n  },\n\n  pwa: {\n    registerType: \"autoUpdate\",\n    workbox: {\n      navigateFallback: undefined,\n      navigateFallbackDenylist: [/^(?!\\/$).*/],\n      maximumFileSizeToCacheInBytes: 1024 * 1024 * 10,\n      globPatterns: [\n        \"**/*.{js,css,html,png,jpg,jpeg,svg,ico,json,txt,ttf,woff,woff2}\",\n      ],\n    },\n\n    manifest: {\n      name: \"Chalk\",\n      short_name: \"Chalk\",\n      theme_color: \"#18181b\",\n      background_color: \"#18181b\",\n      icons: [\n        {\n          src: \"/pwa-192x192.png\",\n          sizes: \"192x192\",\n          type: \"image/png\",\n        },\n        {\n          src: \"/pwa-512x512.png\",\n          sizes: \"512x512\",\n          type: \"image/png\",\n        },\n        {\n          src: \"/pwa-512x512.png\",\n          sizes: \"512x512\",\n          type: \"image/png\",\n          purpose: \"any maskable\",\n        },\n      ],\n    },\n  },\n\n  app: {\n    head: {\n      title: \"Create beautiful images of your source code\",\n      charset: \"utf-8\",\n      viewport: \"width=device-width, initial-scale=1.0\",\n      meta: [\n        {\n          name: \"description\",\n          content: \"Turn your source code into beautiful images\",\n        },\n        { name: \"twitter:card\", content: \"summary_large_image\" },\n        {\n          name: \"twitter:title\",\n          content: \"Chalk.ist - Create beautiful images of your source code\",\n        },\n        { name: \"twitter:domain\", content: \"https://chalk.ist\" },\n        { name: \"twitter:creator\", content: \"@idered\" },\n        { name: \"twitter:url\", content: \"https://chalk.ist\" },\n        { name: \"twitter:image\", content: \"https://chalk.ist/og-image.jpg\" },\n        {\n          name: \"twitter:description\",\n          content: \"Turn your source code into beautiful images\",\n        },\n        {\n          property: \"og:title\",\n          content: \"Chalk.ist - Create beautiful images of your source code\",\n        },\n        { property: \"og:type\", content: \"website\" },\n        { property: \"og:url\", content: \"https://chalk.ist\" },\n        { property: \"og:image\", content: \"https://chalk.ist/og-image.jpg\" },\n        {\n          property: \"og:description\",\n          content: \"Turn your source code into beautiful images\",\n        },\n      ],\n      link: [\n        { rel: \"icon\", href: \"/favicon.ico\" },\n        {\n          rel: \"apple-touch-icon\",\n          sizes: \"180x180\",\n          href: \"/apple-touch-icon.png\",\n        },\n      ],\n      htmlAttrs: {\n        lang: \"en\",\n        class: \"bg-slate-900\",\n      },\n      bodyAttrs: {\n        class:\n          \"font-inter text-slate-500 subpixel-antialiased selection:bg-blue-600/50 selection:text-white\",\n      },\n    },\n  },\n\n  scripts: {\n    globals: {\n      umami: [\n        {\n          src: \"https://umami.chalk.ist/script.js\",\n          \"data-website-id\": \"e26d67be-7367-4221-9f0d-28a4787bf633\",\n          crossorigin: false,\n        },\n        { trigger: \"onNuxtReady\" },\n      ],\n    },\n  },\n\n  vite: {\n    plugins: [\n      Components({\n        resolvers: [IconsResolver()],\n      }),\n    ],\n\n    optimizeDeps: {\n      include: [\n        \"@vueuse/core\",\n        \"@vueuse/head\",\n        \"@vueuse/components\",\n        \"@vueuse/integrations/useFuse\",\n      ],\n    },\n  },\n\n  css: [\n    \"~/styles/main.css\",\n    \"~/styles/color-picker.css\",\n    \"~/styles/geist-mono.css\",\n    \"~/styles/nova.css\",\n    \"@fontsource/fira-code/400.css\",\n    \"@fontsource/fira-code/700.css\",\n    \"@fontsource/ibm-plex-mono/400.css\",\n    \"@fontsource/ibm-plex-mono/700.css\",\n    \"@fontsource/inter/400.css\",\n    \"@fontsource/inter/500.css\",\n    \"@fontsource/inter/600.css\",\n    \"@fontsource/inter/700.css\",\n    \"@fontsource/jetbrains-mono/400.css\",\n    \"@fontsource/jetbrains-mono/700.css\",\n    \"@fontsource/source-code-pro/400.css\",\n    \"@fontsource/source-code-pro/700.css\",\n    \"@fontsource/overpass-mono/400.css\",\n    \"@fontsource/overpass-mono/700.css\",\n  ],\n\n  compatibilityDate: \"2024-10-23\",\n});\n"
        },
        {
          "name": "package.json",
          "type": "blob",
          "size": 2.482421875,
          "content": "{\n  \"name\": \"chalk.ist\",\n  \"private\": true,\n  \"version\": \"0.1.0\",\n  \"type\": \"module\",\n  \"scripts\": {\n    \"db:generate\": \"drizzle-kit generate\",\n    \"db:migrate\": \"drizzle-kit migrate\",\n    \"dev\": \"nuxt dev\",\n    \"prepare\": \"nuxi prepare\",\n    \"build\": \"vue-tsc --noEmit && nuxt build\",\n    \"serve\": \"nuxt preview\"\n  },\n  \"prettier\": {\n    \"tabWidth\": 2,\n    \"printWidth\": 80,\n    \"importOrderSeparation\": false,\n    \"importOrderSortSpecifiers\": true,\n    \"plugins\": [\n      \"prettier-plugin-tailwindcss\"\n    ]\n  },\n  \"dependencies\": {\n    \"@cloudflare/workers-types\": \"4.20241127.0\",\n    \"@fontsource-variable/pixelify-sans\": \"5.1.0\",\n    \"@fontsource/cutive-mono\": \"5.1.0\",\n    \"@fontsource/fira-code\": \"4.5.13\",\n    \"@fontsource/ibm-plex-mono\": \"4.5.13\",\n    \"@fontsource/inter\": \"4.5.10\",\n    \"@fontsource/jetbrains-mono\": \"4.5.8\",\n    \"@fontsource/overpass-mono\": \"^5.1.0\",\n    \"@fontsource/share-tech-mono\": \"5.1.0\",\n    \"@fontsource/source-code-pro\": \"4.5.14\",\n    \"@fontsource/unifontex\": \"5.1.0\",\n    \"@fontsource/vt323\": \"5.1.0\",\n    \"@iconify/vue\": \"4.1.1\",\n    \"@nuxt/scripts\": \"^0.9.5\",\n    \"@nuxthub/core\": \"^0.8.7\",\n    \"@nuxtjs/tailwindcss\": \"^6.12.2\",\n    \"@pinia/nuxt\": \"^0.5.5\",\n    \"@shikijs/markdown-it\": \"1.24.0\",\n    \"@shikijs/transformers\": \"1.24.0\",\n    \"@tailwindcss/typography\": \"0.5.15\",\n    \"@unhead/vue\": \"^1.11.13\",\n    \"@vite-pwa/nuxt\": \"^0.10.5\",\n    \"@vueuse/components\": \"11.1.0\",\n    \"@vueuse/core\": \"11.1.0\",\n    \"@vueuse/head\": \"^2.0.0\",\n    \"@vueuse/integrations\": \"11.1.0\",\n    \"drizzle-orm\": \"^0.36.4\",\n    \"fflate\": \"0.8.2\",\n    \"fuse.js\": \"6.5.3\",\n    \"markdown-it\": \"13.0.2\",\n    \"modern-screenshot\": \"4.4.39\",\n    \"mp4-muxer\": \"^2.3.0\",\n    \"nanoid\": \"5.0.9\",\n    \"nuxt\": \"^3.13.2\",\n    \"ofetch\": \"1.4.1\",\n    \"pathe\": \"1.1.2\",\n    \"pica\": \"7.1.0\",\n    \"pinia\": \"2.2.4\",\n    \"postgres\": \"^3.4.5\",\n    \"radix-vue\": \"^1.7.3\",\n    \"shiki\": \"1.24.0\",\n    \"tailwind-merge\": \"2.5.3\",\n    \"unplugin-icons\": \"0.19.3\",\n    \"unplugin-vue-components\": \"0.27.4\",\n    \"uuid\": \"10.0.0\",\n    \"vue\": \"^3.5.12\",\n    \"vue-color-kit\": \"github:Idered/vue-color-kit\",\n    \"vue-demi\": \"0.14.10\",\n    \"zod\": \"3.23.8\"\n  },\n  \"devDependencies\": {\n    \"@iconify/json\": \"2.2.274\",\n    \"@types/markdown-it\": \"^14.1.2\",\n    \"@types/pica\": \"^9.0.4\",\n    \"@types/uuid\": \"^10.0.0\",\n    \"drizzle-kit\": \"^0.28.1\",\n    \"prettier\": \"3.3.3\",\n    \"prettier-plugin-tailwindcss\": \"^0.6.8\",\n    \"tailwindcss\": \"3.4.13\",\n    \"tailwindcss-easing\": \"0.2.1\",\n    \"typescript\": \"^5.6.3\",\n    \"vue-tsc\": \"2.1.6\",\n    \"wrangler\": \"^3.91.0\"\n  }\n}\n"
        },
        {
          "name": "pnpm-lock.yaml",
          "type": "blob",
          "size": 457.9404296875,
          "content": "lockfileVersion: '9.0'\n\nsettings:\n  autoInstallPeers: true\n  excludeLinksFromLockfile: false\n\nimporters:\n\n  .:\n    dependencies:\n      '@cloudflare/workers-types':\n        specifier: 4.20241127.0\n        version: 4.20241127.0\n      '@fontsource-variable/pixelify-sans':\n        specifier: 5.1.0\n        version: 5.1.0\n      '@fontsource/cutive-mono':\n        specifier: 5.1.0\n        version: 5.1.0\n      '@fontsource/fira-code':\n        specifier: 4.5.13\n        version: 4.5.13\n      '@fontsource/ibm-plex-mono':\n        specifier: 4.5.13\n        version: 4.5.13\n      '@fontsource/inter':\n        specifier: 4.5.10\n        version: 4.5.10\n      '@fontsource/jetbrains-mono':\n        specifier: 4.5.8\n        version: 4.5.8\n      '@fontsource/overpass-mono':\n        specifier: ^5.1.0\n        version: 5.1.0\n      '@fontsource/share-tech-mono':\n        specifier: 5.1.0\n        version: 5.1.0\n      '@fontsource/source-code-pro':\n        specifier: 4.5.14\n        version: 4.5.14\n      '@fontsource/unifontex':\n        specifier: 5.1.0\n        version: 5.1.0\n      '@fontsource/vt323':\n        specifier: 5.1.0\n        version: 5.1.0\n      '@iconify/vue':\n        specifier: 4.1.1\n        version: 4.1.1(vue@3.5.12(typescript@5.6.3))\n      '@nuxt/scripts':\n        specifier: ^0.9.5\n        version: 0.9.5(@nuxt/devtools@1.6.0(rollup@4.24.0)(vite@5.4.8(@types/node@20.10.5)(terser@5.26.0))(vue@3.5.12(typescript@5.6.3))(webpack-sources@3.2.3))(@unocss/webpack@0.62.4(rollup@4.24.0)(webpack@5.95.0(esbuild@0.23.1)))(@vue/compiler-core@3.5.12)(fuse.js@6.5.3)(ioredis@5.4.1)(magicast@0.3.5)(nuxt@3.13.2(@parcel/watcher@2.4.1)(@types/node@20.10.5)(drizzle-orm@0.36.4(@cloudflare/workers-types@4.20241127.0)(@types/pg@8.11.10)(pg@8.13.1)(postgres@3.4.5))(ioredis@5.4.1)(magicast@0.3.5)(rollup@4.24.0)(terser@5.26.0)(typescript@5.6.3)(vite@5.4.8(@types/node@20.10.5)(terser@5.26.0))(vue-tsc@2.1.6(typescript@5.6.3))(webpack-sources@3.2.3))(postcss@8.4.47)(rollup@4.24.0)(typescript@5.6.3)(vite@5.4.8(@types/node@20.10.5)(terser@5.26.0))(vue@3.5.12(typescript@5.6.3))(webpack-sources@3.2.3)(webpack@5.95.0(esbuild@0.23.1))\n      '@nuxthub/core':\n        specifier: ^0.8.7\n        version: 0.8.7(ioredis@5.4.1)(magicast@0.3.5)(rollup@4.24.0)(vite@5.4.8(@types/node@20.10.5)(terser@5.26.0))(webpack-sources@3.2.3)\n      '@nuxtjs/tailwindcss':\n        specifier: ^6.12.2\n        version: 6.12.2(magicast@0.3.5)(rollup@4.24.0)(webpack-sources@3.2.3)\n      '@pinia/nuxt':\n        specifier: ^0.5.5\n        version: 0.5.5(magicast@0.3.5)(rollup@4.24.0)(typescript@5.6.3)(vue@3.5.12(typescript@5.6.3))(webpack-sources@3.2.3)\n      '@shikijs/markdown-it':\n        specifier: 1.24.0\n        version: 1.24.0\n      '@shikijs/transformers':\n        specifier: 1.24.0\n        version: 1.24.0\n      '@tailwindcss/typography':\n        specifier: 0.5.15\n        version: 0.5.15(tailwindcss@3.4.13)\n      '@unhead/vue':\n        specifier: ^1.11.13\n        version: 1.11.13(vue@3.5.12(typescript@5.6.3))\n      '@vite-pwa/nuxt':\n        specifier: ^0.10.5\n        version: 0.10.5(magicast@0.3.5)(rollup@4.24.0)(vite@5.4.8(@types/node@20.10.5)(terser@5.26.0))(webpack-sources@3.2.3)(workbox-build@7.0.0)(workbox-window@7.0.0)\n      '@vueuse/components':\n        specifier: 11.1.0\n        version: 11.1.0(vue@3.5.12(typescript@5.6.3))\n      '@vueuse/core':\n        specifier: 11.1.0\n        version: 11.1.0(vue@3.5.12(typescript@5.6.3))\n      '@vueuse/head':\n        specifier: ^2.0.0\n        version: 2.0.0(vue@3.5.12(typescript@5.6.3))\n      '@vueuse/integrations':\n        specifier: 11.1.0\n        version: 11.1.0(focus-trap@7.6.0)(fuse.js@6.5.3)(vue@3.5.12(typescript@5.6.3))\n      drizzle-orm:\n        specifier: ^0.36.4\n        version: 0.36.4(@cloudflare/workers-types@4.20241127.0)(@types/pg@8.11.10)(pg@8.13.1)(postgres@3.4.5)\n      fflate:\n        specifier: 0.8.2\n        version: 0.8.2\n      fuse.js:\n        specifier: 6.5.3\n        version: 6.5.3\n      markdown-it:\n        specifier: 13.0.2\n        version: 13.0.2\n      modern-screenshot:\n        specifier: 4.4.39\n        version: 4.4.39\n      mp4-muxer:\n        specifier: ^2.3.0\n        version: 2.3.0\n      nanoid:\n        specifier: 5.0.9\n        version: 5.0.9\n      nuxt:\n        specifier: ^3.13.2\n        version: 3.13.2(@parcel/watcher@2.4.1)(@types/node@20.10.5)(drizzle-orm@0.36.4(@cloudflare/workers-types@4.20241127.0)(@types/pg@8.11.10)(pg@8.13.1)(postgres@3.4.5))(ioredis@5.4.1)(magicast@0.3.5)(rollup@4.24.0)(terser@5.26.0)(typescript@5.6.3)(vite@5.4.8(@types/node@20.10.5)(terser@5.26.0))(vue-tsc@2.1.6(typescript@5.6.3))(webpack-sources@3.2.3)\n      ofetch:\n        specifier: 1.4.1\n        version: 1.4.1\n      pathe:\n        specifier: 1.1.2\n        version: 1.1.2\n      pica:\n        specifier: 7.1.0\n        version: 7.1.0\n      pinia:\n        specifier: 2.2.4\n        version: 2.2.4(typescript@5.6.3)(vue@3.5.12(typescript@5.6.3))\n      postgres:\n        specifier: ^3.4.5\n        version: 3.4.5\n      radix-vue:\n        specifier: ^1.7.3\n        version: 1.7.3(vue@3.5.12(typescript@5.6.3))\n      shiki:\n        specifier: 1.24.0\n        version: 1.24.0\n      tailwind-merge:\n        specifier: 2.5.3\n        version: 2.5.3\n      unplugin-icons:\n        specifier: 0.19.3\n        version: 0.19.3(@vue/compiler-sfc@3.5.12)(vue-template-compiler@2.7.16)(webpack-sources@3.2.3)\n      unplugin-vue-components:\n        specifier: 0.27.4\n        version: 0.27.4(@babel/parser@7.25.9)(@nuxt/kit@3.14.1592(magicast@0.3.5)(rollup@4.24.0)(webpack-sources@3.2.3))(rollup@4.24.0)(vue@3.5.12(typescript@5.6.3))(webpack-sources@3.2.3)\n      uuid:\n        specifier: 10.0.0\n        version: 10.0.0\n      vue:\n        specifier: ^3.5.12\n        version: 3.5.12(typescript@5.6.3)\n      vue-color-kit:\n        specifier: github:Idered/vue-color-kit\n        version: https://codeload.github.com/Idered/vue-color-kit/tar.gz/e75eb34d3473b6e1a4627869b7099ab07b1280e7(vue@3.5.12(typescript@5.6.3))\n      vue-demi:\n        specifier: 0.14.10\n        version: 0.14.10(vue@3.5.12(typescript@5.6.3))\n      zod:\n        specifier: 3.23.8\n        version: 3.23.8\n    devDependencies:\n      '@iconify/json':\n        specifier: 2.2.274\n        version: 2.2.274\n      '@types/markdown-it':\n        specifier: ^14.1.2\n        version: 14.1.2\n      '@types/pica':\n        specifier: ^9.0.4\n        version: 9.0.4\n      '@types/uuid':\n        specifier: ^10.0.0\n        version: 10.0.0\n      drizzle-kit:\n        specifier: ^0.28.1\n        version: 0.28.1\n      prettier:\n        specifier: 3.3.3\n        version: 3.3.3\n      prettier-plugin-tailwindcss:\n        specifier: ^0.6.8\n        version: 0.6.8(prettier@3.3.3)\n      tailwindcss:\n        specifier: 3.4.13\n        version: 3.4.13\n      tailwindcss-easing:\n        specifier: 0.2.1\n        version: 0.2.1(tailwindcss@3.4.13)\n      typescript:\n        specifier: ^5.6.3\n        version: 5.6.3\n      vue-tsc:\n        specifier: 2.1.6\n        version: 2.1.6(typescript@5.6.3)\n      wrangler:\n        specifier: ^3.91.0\n        version: 3.91.0(@cloudflare/workers-types@4.20241127.0)\n\npackages:\n\n  '@alloc/quick-lru@5.2.0':\n    resolution: {integrity: sha512-UrcABB+4bUrFABwbluTIBErXwvbsU/V7TZWfmbgJfbkwiBuziS9gxdODUyuiecfdGQ85jglMW6juS3+z5TsKLw==}\n    engines: {node: '>=10'}\n\n  '@ampproject/remapping@2.2.1':\n    resolution: {integrity: sha512-lFMjJTrFL3j7L9yBxwYfCq2k6qqwHyzuUl/XBnif78PWTJYyL/dfowQHWE3sp6U6ZzqWiiIZnpTMO96zhkjwtg==}\n    engines: {node: '>=6.0.0'}\n\n  '@ampproject/remapping@2.3.0':\n    resolution: {integrity: sha512-30iZtAPgz+LTIYoeivqYo853f02jBYSd5uGnGpkFV0M3xOt9aN73erkgYAmZU43x4VfqcnLxW9Kpg3R5LC4YYw==}\n    engines: {node: '>=6.0.0'}\n\n  '@antfu/install-pkg@0.4.1':\n    resolution: {integrity: sha512-T7yB5QNG29afhWVkVq7XeIMBa5U/vs9mX69YqayXypPRmYzUmzwnYltplHmPtZ4HPCn+sQKeXW8I47wCbuBOjw==}\n\n  '@antfu/utils@0.7.10':\n    resolution: {integrity: sha512-+562v9k4aI80m1+VuMHehNJWLOFjBnXn3tdOitzD0il5b7smkSBal4+a3oKiQTbrwMmN/TBUMDvbdoWDehgOww==}\n\n  '@apideck/better-ajv-errors@0.3.6':\n    resolution: {integrity: sha512-P+ZygBLZtkp0qqOAJJVX4oX/sFo5JR3eBWwwuqHHhK0GIgQOKWrAfiAaWX0aArHkRWHMuggFEgAZNxVPwPZYaA==}\n    engines: {node: '>=10'}\n    peerDependencies:\n      ajv: '>=8'\n\n  '@babel/code-frame@7.23.5':\n    resolution: {integrity: sha512-CgH3s1a96LipHCmSUmYFPwY7MNx8C3avkq7i4Wl3cfa662ldtUe4VM1TPXX70pfmrlWTb6jLqTYrZyT2ZTJBgA==}\n    engines: {node: '>=6.9.0'}\n\n  '@babel/code-frame@7.25.9':\n    resolution: {integrity: sha512-z88xeGxnzehn2sqZ8UdGQEvYErF1odv2CftxInpSYJt6uHuPe9YjahKZITGs3l5LeI9d2ROG+obuDAoSlqbNfQ==}\n    engines: {node: '>=6.9.0'}\n\n  '@babel/compat-data@7.23.5':\n    resolution: {integrity: sha512-uU27kfDRlhfKl+w1U6vp16IuvSLtjAxdArVXPa9BvLkrr7CYIsxH5adpHObeAGY/41+syctUWOZ140a2Rvkgjw==}\n    engines: {node: '>=6.9.0'}\n\n  '@babel/compat-data@7.25.9':\n    resolution: {integrity: sha512-yD+hEuJ/+wAJ4Ox2/rpNv5HIuPG82x3ZlQvYVn8iYCprdxzE7P1udpGF1jyjQVBU4dgznN+k2h103vxZ7NdPyw==}\n    engines: {node: '>=6.9.0'}\n\n  '@babel/core@7.23.7':\n    resolution: {integrity: sha512-+UpDgowcmqe36d4NwqvKsyPMlOLNGMsfMmQ5WGCu+siCe3t3dfe9njrzGfdN4qq+bcNUt0+Vw6haRxBOycs4dw==}\n    engines: {node: '>=6.9.0'}\n\n  '@babel/core@7.25.9':\n    resolution: {integrity: sha512-WYvQviPw+Qyib0v92AwNIrdLISTp7RfDkM7bPqBvpbnhY4wq8HvHBZREVdYDXk98C8BkOIVnHAY3yvj7AVISxQ==}\n    engines: {node: '>=6.9.0'}\n\n  '@babel/generator@7.23.6':\n    resolution: {integrity: sha512-qrSfCYxYQB5owCmGLbl8XRpX1ytXlpueOb0N0UmQwA073KZxejgQTzAmJezxvpwQD9uGtK2shHdi55QT+MbjIw==}\n    engines: {node: '>=6.9.0'}\n\n  '@babel/generator@7.25.9':\n    resolution: {integrity: sha512-omlUGkr5EaoIJrhLf9CJ0TvjBRpd9+AXRG//0GEQ9THSo8wPiTlbpy1/Ow8ZTrbXpjd9FHXfbFQx32I04ht0FA==}\n    engines: {node: '>=6.9.0'}\n\n  '@babel/helper-annotate-as-pure@7.25.9':\n    resolution: {integrity: sha512-gv7320KBUFJz1RnylIg5WWYPRXKZ884AGkYpgpWW02TH66Dl+HaC1t1CKd0z3R4b6hdYEcmrNZHUmfCP+1u3/g==}\n    engines: {node: '>=6.9.0'}\n\n  '@babel/helper-builder-binary-assignment-operator-visitor@7.22.15':\n    resolution: {integrity: sha512-QkBXwGgaoC2GtGZRoma6kv7Szfv06khvhFav67ZExau2RaXzy8MpHSMO2PNoP2XtmQphJQRHFfg77Bq731Yizw==}\n    engines: {node: '>=6.9.0'}\n\n  '@babel/helper-compilation-targets@7.23.6':\n    resolution: {integrity: sha512-9JB548GZoQVmzrFgp8o7KxdgkTGm6xs9DW0o/Pim72UDjzr5ObUQ6ZzYPqA+g9OTS2bBQoctLJrky0RDCAWRgQ==}\n    engines: {node: '>=6.9.0'}\n\n  '@babel/helper-compilation-targets@7.25.9':\n    resolution: {integrity: sha512-j9Db8Suy6yV/VHa4qzrj9yZfZxhLWQdVnRlXxmKLYlhWUVB1sB2G5sxuWYXk/whHD9iW76PmNzxZ4UCnTQTVEQ==}\n    engines: {node: '>=6.9.0'}\n\n  '@babel/helper-create-class-features-plugin@7.25.9':\n    resolution: {integrity: sha512-UTZQMvt0d/rSz6KI+qdu7GQze5TIajwTS++GUozlw8VBJDEOAqSXwm1WvmYEZwqdqSGQshRocPDqrt4HBZB3fQ==}\n    engines: {node: '>=6.9.0'}\n    peerDependencies:\n      '@babel/core': ^7.0.0\n\n  '@babel/helper-create-regexp-features-plugin@7.22.15':\n    resolution: {integrity: sha512-29FkPLFjn4TPEa3RE7GpW+qbE8tlsu3jntNYNfcGsc49LphF1PQIiD+vMZ1z1xVOKt+93khA9tc2JBs3kBjA7w==}\n    engines: {node: '>=6.9.0'}\n    peerDependencies:\n      '@babel/core': ^7.0.0\n\n  '@babel/helper-define-polyfill-provider@0.4.4':\n    resolution: {integrity: sha512-QcJMILQCu2jm5TFPGA3lCpJJTeEP+mqeXooG/NZbg/h5FTFi6V0+99ahlRsW8/kRLyb24LZVCCiclDedhLKcBA==}\n    peerDependencies:\n      '@babel/core': ^7.4.0 || ^8.0.0-0 <8.0.0\n\n  '@babel/helper-environment-visitor@7.22.20':\n    resolution: {integrity: sha512-zfedSIzFhat/gFhWfHtgWvlec0nqB9YEIVrpuwjruLlXfUSnA8cJB0miHKwqDnQ7d32aKo2xt88/xZptwxbfhA==}\n    engines: {node: '>=6.9.0'}\n\n  '@babel/helper-function-name@7.23.0':\n    resolution: {integrity: sha512-OErEqsrxjZTJciZ4Oo+eoZqeW9UIiOcuYKRJA4ZAgV9myA+pOXhhmpfNCKjEH/auVfEYVFJ6y1Tc4r0eIApqiw==}\n    engines: {node: '>=6.9.0'}\n\n  '@babel/helper-hoist-variables@7.22.5':\n    resolution: {integrity: sha512-wGjk9QZVzvknA6yKIUURb8zY3grXCcOZt+/7Wcy8O2uctxhplmUPkOdlgoNhmdVee2c92JXbf1xpMtVNbfoxRw==}\n    engines: {node: '>=6.9.0'}\n\n  '@babel/helper-member-expression-to-functions@7.25.9':\n    resolution: {integrity: sha512-wbfdZ9w5vk0C0oyHqAJbc62+vet5prjj01jjJ8sKn3j9h3MQQlflEdXYvuqRWjHnM12coDEqiC1IRCi0U/EKwQ==}\n    engines: {node: '>=6.9.0'}\n\n  '@babel/helper-module-imports@7.22.15':\n    resolution: {integrity: sha512-0pYVBnDKZO2fnSPCrgM/6WMc7eS20Fbok+0r88fp+YtWVLZrp4CkafFGIp+W0VKw4a22sgebPT99y+FDNMdP4w==}\n    engines: {node: '>=6.9.0'}\n\n  '@babel/helper-module-imports@7.25.9':\n    resolution: {integrity: sha512-tnUA4RsrmflIM6W6RFTLFSXITtl0wKjgpnLgXyowocVPrbYrLUXSBXDgTs8BlbmIzIdlBySRQjINYs2BAkiLtw==}\n    engines: {node: '>=6.9.0'}\n\n  '@babel/helper-module-transforms@7.23.3':\n    resolution: {integrity: sha512-7bBs4ED9OmswdfDzpz4MpWgSrV7FXlc3zIagvLFjS5H+Mk7Snr21vQ6QwrsoCGMfNC4e4LQPdoULEt4ykz0SRQ==}\n    engines: {node: '>=6.9.0'}\n    peerDependencies:\n      '@babel/core': ^7.0.0\n\n  '@babel/helper-module-transforms@7.25.9':\n    resolution: {integrity: sha512-TvLZY/F3+GvdRYFZFyxMvnsKi+4oJdgZzU3BoGN9Uc2d9C6zfNwJcKKhjqLAhK8i46mv93jsO74fDh3ih6rpHA==}\n    engines: {node: '>=6.9.0'}\n    peerDependencies:\n      '@babel/core': ^7.0.0\n\n  '@babel/helper-optimise-call-expression@7.25.9':\n    resolution: {integrity: sha512-FIpuNaz5ow8VyrYcnXQTDRGvV6tTjkNtCK/RYNDXGSLlUD6cBuQTSw43CShGxjvfBTfcUA/r6UhUCbtYqkhcuQ==}\n    engines: {node: '>=6.9.0'}\n\n  '@babel/helper-plugin-utils@7.22.5':\n    resolution: {integrity: sha512-uLls06UVKgFG9QD4OeFYLEGteMIAa5kpTPcFL28yuCIIzsf6ZyKZMllKVOCZFhiZ5ptnwX4mtKdWCBE/uT4amg==}\n    engines: {node: '>=6.9.0'}\n\n  '@babel/helper-plugin-utils@7.25.9':\n    resolution: {integrity: sha512-kSMlyUVdWe25rEsRGviIgOWnoT/nfABVWlqt9N19/dIPWViAOW2s9wznP5tURbs/IDuNk4gPy3YdYRgH3uxhBw==}\n    engines: {node: '>=6.9.0'}\n\n  '@babel/helper-remap-async-to-generator@7.22.20':\n    resolution: {integrity: sha512-pBGyV4uBqOns+0UvhsTO8qgl8hO89PmiDYv+/COyp1aeMcmfrfruz+/nCMFiYyFF/Knn0yfrC85ZzNFjembFTw==}\n    engines: {node: '>=6.9.0'}\n    peerDependencies:\n      '@babel/core': ^7.0.0\n\n  '@babel/helper-replace-supers@7.25.9':\n    resolution: {integrity: sha512-IiDqTOTBQy0sWyeXyGSC5TBJpGFXBkRynjBeXsvbhQFKj2viwJC76Epz35YLU1fpe/Am6Vppb7W7zM4fPQzLsQ==}\n    engines: {node: '>=6.9.0'}\n    peerDependencies:\n      '@babel/core': ^7.0.0\n\n  '@babel/helper-simple-access@7.22.5':\n    resolution: {integrity: sha512-n0H99E/K+Bika3++WNL17POvo4rKWZ7lZEp1Q+fStVbUi8nxPQEBOlTmCOxW/0JsS56SKKQ+ojAe2pHKJHN35w==}\n    engines: {node: '>=6.9.0'}\n\n  '@babel/helper-simple-access@7.25.9':\n    resolution: {integrity: sha512-c6WHXuiaRsJTyHYLJV75t9IqsmTbItYfdj99PnzYGQZkYKvan5/2jKJ7gu31J3/BJ/A18grImSPModuyG/Eo0Q==}\n    engines: {node: '>=6.9.0'}\n\n  '@babel/helper-skip-transparent-expression-wrappers@7.25.9':\n    resolution: {integrity: sha512-K4Du3BFa3gvyhzgPcntrkDgZzQaq6uozzcpGbOO1OEJaI+EJdqWIMTLgFgQf6lrfiDFo5FU+BxKepI9RmZqahA==}\n    engines: {node: '>=6.9.0'}\n\n  '@babel/helper-split-export-declaration@7.22.6':\n    resolution: {integrity: sha512-AsUnxuLhRYsisFiaJwvp1QF+I3KjD5FOxut14q/GzovUe6orHLesW2C7d754kRm53h5gqrz6sFl6sxc4BVtE/g==}\n    engines: {node: '>=6.9.0'}\n\n  '@babel/helper-string-parser@7.25.7':\n    resolution: {integrity: sha512-CbkjYdsJNHFk8uqpEkpCvRs3YRp9tY6FmFY7wLMSYuGYkrdUi7r2lc4/wqsvlHoMznX3WJ9IP8giGPq68T/Y6g==}\n    engines: {node: '>=6.9.0'}\n\n  '@babel/helper-string-parser@7.25.9':\n    resolution: {integrity: sha512-4A/SCr/2KLd5jrtOMFzaKjVtAei3+2r/NChoBNoZ3EyP/+GlhoaEGoWOZUmFmoITP7zOJyHIMm+DYRd8o3PvHA==}\n    engines: {node: '>=6.9.0'}\n\n  '@babel/helper-validator-identifier@7.25.7':\n    resolution: {integrity: sha512-AM6TzwYqGChO45oiuPqwL2t20/HdMC1rTPAesnBCgPCSF1x3oN9MVUwQV2iyz4xqWrctwK5RNC8LV22kaQCNYg==}\n    engines: {node: '>=6.9.0'}\n\n  '@babel/helper-validator-identifier@7.25.9':\n    resolution: {integrity: sha512-Ed61U6XJc3CVRfkERJWDz4dJwKe7iLmmJsbOGu9wSloNSFttHV0I8g6UAgb7qnK5ly5bGLPd4oXZlxCdANBOWQ==}\n    engines: {node: '>=6.9.0'}\n\n  '@babel/helper-validator-option@7.23.5':\n    resolution: {integrity: sha512-85ttAOMLsr53VgXkTbkx8oA6YTfT4q7/HzXSLEYmjcSTJPMPQtvq1BD79Byep5xMUYbGRzEpDsjUf3dyp54IKw==}\n    engines: {node: '>=6.9.0'}\n\n  '@babel/helper-validator-option@7.25.9':\n    resolution: {integrity: sha512-e/zv1co8pp55dNdEcCynfj9X7nyUKUXoUEwfXqaZt0omVOmDe9oOTdKStH4GmAw6zxMFs50ZayuMfHDKlO7Tfw==}\n    engines: {node: '>=6.9.0'}\n\n  '@babel/helper-wrap-function@7.22.20':\n    resolution: {integrity: sha512-pms/UwkOpnQe/PDAEdV/d7dVCoBbB+R4FvYoHGZz+4VPcg7RtYy2KP7S2lbuWM6FCSgob5wshfGESbC/hzNXZw==}\n    engines: {node: '>=6.9.0'}\n\n  '@babel/helpers@7.23.7':\n    resolution: {integrity: sha512-6AMnjCoC8wjqBzDHkuqpa7jAKwvMo4dC+lr/TFBz+ucfulO1XMpDnwWPGBNwClOKZ8h6xn5N81W/R5OrcKtCbQ==}\n    engines: {node: '>=6.9.0'}\n\n  '@babel/helpers@7.25.9':\n    resolution: {integrity: sha512-oKWp3+usOJSzDZOucZUAMayhPz/xVjzymyDzUN8dk0Wd3RWMlGLXi07UCQ/CgQVb8LvXx3XBajJH4XGgkt7H7g==}\n    engines: {node: '>=6.9.0'}\n\n  '@babel/highlight@7.23.4':\n    resolution: {integrity: sha512-acGdbYSfp2WheJoJm/EBBBLh/ID8KDc64ISZ9DYtBmC8/Q204PZJLHyzeB5qMzJ5trcOkybd78M4x2KWsUq++A==}\n    engines: {node: '>=6.9.0'}\n\n  '@babel/highlight@7.25.9':\n    resolution: {integrity: sha512-llL88JShoCsth8fF8R4SJnIn+WLvR6ccFxu1H3FlMhDontdcmZWf2HgIZ7AIqV3Xcck1idlohrN4EUBQz6klbw==}\n    engines: {node: '>=6.9.0'}\n\n  '@babel/parser@7.25.8':\n    resolution: {integrity: sha512-HcttkxzdPucv3nNFmfOOMfFf64KgdJVqm1KaCm25dPGMLElo9nsLvXeJECQg8UzPuBGLyTSA0ZzqCtDSzKTEoQ==}\n    engines: {node: '>=6.0.0'}\n    hasBin: true\n\n  '@babel/parser@7.25.9':\n    resolution: {integrity: sha512-aI3jjAAO1fh7vY/pBGsn1i9LDbRP43+asrRlkPuTXW5yHXtd1NgTEMudbBoDDxrf1daEEfPJqR+JBMakzrR4Dg==}\n    engines: {node: '>=6.0.0'}\n    hasBin: true\n\n  '@babel/plugin-bugfix-safari-id-destructuring-collision-in-function-expression@7.23.3':\n    resolution: {integrity: sha512-iRkKcCqb7iGnq9+3G6rZ+Ciz5VywC4XNRHe57lKM+jOeYAoR0lVqdeeDRfh0tQcTfw/+vBhHn926FmQhLtlFLQ==}\n    engines: {node: '>=6.9.0'}\n    peerDependencies:\n      '@babel/core': ^7.0.0\n\n  '@babel/plugin-bugfix-v8-spread-parameters-in-optional-chaining@7.23.3':\n    resolution: {integrity: sha512-WwlxbfMNdVEpQjZmK5mhm7oSwD3dS6eU+Iwsi4Knl9wAletWem7kaRsGOG+8UEbRyqxY4SS5zvtfXwX+jMxUwQ==}\n    engines: {node: '>=6.9.0'}\n    peerDependencies:\n      '@babel/core': ^7.13.0\n\n  '@babel/plugin-bugfix-v8-static-class-fields-redefine-readonly@7.23.7':\n    resolution: {integrity: sha512-LlRT7HgaifEpQA1ZgLVOIJZZFVPWN5iReq/7/JixwBtwcoeVGDBD53ZV28rrsLYOZs1Y/EHhA8N/Z6aazHR8cw==}\n    engines: {node: '>=6.9.0'}\n    peerDependencies:\n      '@babel/core': ^7.0.0\n\n  '@babel/plugin-proposal-decorators@7.25.9':\n    resolution: {integrity: sha512-smkNLL/O1ezy9Nhy4CNosc4Va+1wo5w4gzSZeLe6y6dM4mmHfYOCPolXQPHQxonZCF+ZyebxN9vqOolkYrSn5g==}\n    engines: {node: '>=6.9.0'}\n    peerDependencies:\n      '@babel/core': ^7.0.0-0\n\n  '@babel/plugin-proposal-private-property-in-object@7.21.0-placeholder-for-preset-env.2':\n    resolution: {integrity: sha512-SOSkfJDddaM7mak6cPEpswyTRnuRltl429hMraQEglW+OkovnCzsiszTmsrlY//qLFjCpQDFRvjdm2wA5pPm9w==}\n    engines: {node: '>=6.9.0'}\n    peerDependencies:\n      '@babel/core': ^7.0.0-0\n\n  '@babel/plugin-syntax-async-generators@7.8.4':\n    resolution: {integrity: sha512-tycmZxkGfZaxhMRbXlPXuVFpdWlXpir2W4AMhSJgRKzk/eDlIXOhb2LHWoLpDF7TEHylV5zNhykX6KAgHJmTNw==}\n    peerDependencies:\n      '@babel/core': ^7.0.0-0\n\n  '@babel/plugin-syntax-class-properties@7.12.13':\n    resolution: {integrity: sha512-fm4idjKla0YahUNgFNLCB0qySdsoPiZP3iQE3rky0mBUtMZ23yDJ9SJdg6dXTSDnulOVqiF3Hgr9nbXvXTQZYA==}\n    peerDependencies:\n      '@babel/core': ^7.0.0-0\n\n  '@babel/plugin-syntax-class-static-block@7.14.5':\n    resolution: {integrity: sha512-b+YyPmr6ldyNnM6sqYeMWE+bgJcJpO6yS4QD7ymxgH34GBPNDM/THBh8iunyvKIZztiwLH4CJZ0RxTk9emgpjw==}\n    engines: {node: '>=6.9.0'}\n    peerDependencies:\n      '@babel/core': ^7.0.0-0\n\n  '@babel/plugin-syntax-decorators@7.25.9':\n    resolution: {integrity: sha512-ryzI0McXUPJnRCvMo4lumIKZUzhYUO/ScI+Mz4YVaTLt04DHNSjEUjKVvbzQjZFLuod/cYEc07mJWhzl6v4DPg==}\n    engines: {node: '>=6.9.0'}\n    peerDependencies:\n      '@babel/core': ^7.0.0-0\n\n  '@babel/plugin-syntax-dynamic-import@7.8.3':\n    resolution: {integrity: sha512-5gdGbFon+PszYzqs83S3E5mpi7/y/8M9eC90MRTZfduQOYW76ig6SOSPNe41IG5LoP3FGBn2N0RjVDSQiS94kQ==}\n    peerDependencies:\n      '@babel/core': ^7.0.0-0\n\n  '@babel/plugin-syntax-export-namespace-from@7.8.3':\n    resolution: {integrity: sha512-MXf5laXo6c1IbEbegDmzGPwGNTsHZmEy6QGznu5Sh2UCWvueywb2ee+CCE4zQiZstxU9BMoQO9i6zUFSY0Kj0Q==}\n    peerDependencies:\n      '@babel/core': ^7.0.0-0\n\n  '@babel/plugin-syntax-import-assertions@7.23.3':\n    resolution: {integrity: sha512-lPgDSU+SJLK3xmFDTV2ZRQAiM7UuUjGidwBywFavObCiZc1BeAAcMtHJKUya92hPHO+at63JJPLygilZard8jw==}\n    engines: {node: '>=6.9.0'}\n    peerDependencies:\n      '@babel/core': ^7.0.0-0\n\n  '@babel/plugin-syntax-import-attributes@7.23.3':\n    resolution: {integrity: sha512-pawnE0P9g10xgoP7yKr6CK63K2FMsTE+FZidZO/1PwRdzmAPVs+HS1mAURUsgaoxammTJvULUdIkEK0gOcU2tA==}\n    engines: {node: '>=6.9.0'}\n    peerDependencies:\n      '@babel/core': ^7.0.0-0\n\n  '@babel/plugin-syntax-import-meta@7.10.4':\n    resolution: {integrity: sha512-Yqfm+XDx0+Prh3VSeEQCPU81yC+JWZ2pDPFSS4ZdpfZhp4MkFMaDC1UqseovEKwSUpnIL7+vK+Clp7bfh0iD7g==}\n    peerDependencies:\n      '@babel/core': ^7.0.0-0\n\n  '@babel/plugin-syntax-json-strings@7.8.3':\n    resolution: {integrity: sha512-lY6kdGpWHvjoe2vk4WrAapEuBR69EMxZl+RoGRhrFGNYVK8mOPAW8VfbT/ZgrFbXlDNiiaxQnAtgVCZ6jv30EA==}\n    peerDependencies:\n      '@babel/core': ^7.0.0-0\n\n  '@babel/plugin-syntax-jsx@7.25.9':\n    resolution: {integrity: sha512-ld6oezHQMZsZfp6pWtbjaNDF2tiiCYYDqQszHt5VV437lewP9aSi2Of99CK0D0XB21k7FLgnLcmQKyKzynfeAA==}\n    engines: {node: '>=6.9.0'}\n    peerDependencies:\n      '@babel/core': ^7.0.0-0\n\n  '@babel/plugin-syntax-logical-assignment-operators@7.10.4':\n    resolution: {integrity: sha512-d8waShlpFDinQ5MtvGU9xDAOzKH47+FFoney2baFIoMr952hKOLp1HR7VszoZvOsV/4+RRszNY7D17ba0te0ig==}\n    peerDependencies:\n      '@babel/core': ^7.0.0-0\n\n  '@babel/plugin-syntax-nullish-coalescing-operator@7.8.3':\n    resolution: {integrity: sha512-aSff4zPII1u2QD7y+F8oDsz19ew4IGEJg9SVW+bqwpwtfFleiQDMdzA/R+UlWDzfnHFCxxleFT0PMIrR36XLNQ==}\n    peerDependencies:\n      '@babel/core': ^7.0.0-0\n\n  '@babel/plugin-syntax-numeric-separator@7.10.4':\n    resolution: {integrity: sha512-9H6YdfkcK/uOnY/K7/aA2xpzaAgkQn37yzWUMRK7OaPOqOpGS1+n0H5hxT9AUw9EsSjPW8SVyMJwYRtWs3X3ug==}\n    peerDependencies:\n      '@babel/core': ^7.0.0-0\n\n  '@babel/plugin-syntax-object-rest-spread@7.8.3':\n    resolution: {integrity: sha512-XoqMijGZb9y3y2XskN+P1wUGiVwWZ5JmoDRwx5+3GmEplNyVM2s2Dg8ILFQm8rWM48orGy5YpI5Bl8U1y7ydlA==}\n    peerDependencies:\n      '@babel/core': ^7.0.0-0\n\n  '@babel/plugin-syntax-optional-catch-binding@7.8.3':\n    resolution: {integrity: sha512-6VPD0Pc1lpTqw0aKoeRTMiB+kWhAoT24PA+ksWSBrFtl5SIRVpZlwN3NNPQjehA2E/91FV3RjLWoVTglWcSV3Q==}\n    peerDependencies:\n      '@babel/core': ^7.0.0-0\n\n  '@babel/plugin-syntax-optional-chaining@7.8.3':\n    resolution: {integrity: sha512-KoK9ErH1MBlCPxV0VANkXW2/dw4vlbGDrFgz8bmUsBGYkFRcbRwMh6cIJubdPrkxRwuGdtCk0v/wPTKbQgBjkg==}\n    peerDependencies:\n      '@babel/core': ^7.0.0-0\n\n  '@babel/plugin-syntax-private-property-in-object@7.14.5':\n    resolution: {integrity: sha512-0wVnp9dxJ72ZUJDV27ZfbSj6iHLoytYZmh3rFcxNnvsJF3ktkzLDZPy/mA17HGsaQT3/DQsWYX1f1QGWkCoVUg==}\n    engines: {node: '>=6.9.0'}\n    peerDependencies:\n      '@babel/core': ^7.0.0-0\n\n  '@babel/plugin-syntax-top-level-await@7.14.5':\n    resolution: {integrity: sha512-hx++upLv5U1rgYfwe1xBQUhRmU41NEvpUvrp8jkrSCdvGSnM5/qdRMtylJ6PG5OFkBaHkbTAKTnd3/YyESRHFw==}\n    engines: {node: '>=6.9.0'}\n    peerDependencies:\n      '@babel/core': ^7.0.0-0\n\n  '@babel/plugin-syntax-typescript@7.25.9':\n    resolution: {integrity: sha512-hjMgRy5hb8uJJjUcdWunWVcoi9bGpJp8p5Ol1229PoN6aytsLwNMgmdftO23wnCLMfVmTwZDWMPNq/D1SY60JQ==}\n    engines: {node: '>=6.9.0'}\n    peerDependencies:\n      '@babel/core': ^7.0.0-0\n\n  '@babel/plugin-syntax-unicode-sets-regex@7.18.6':\n    resolution: {integrity: sha512-727YkEAPwSIQTv5im8QHz3upqp92JTWhidIC81Tdx4VJYIte/VndKf1qKrfnnhPLiPghStWfvC/iFaMCQu7Nqg==}\n    engines: {node: '>=6.9.0'}\n    peerDependencies:\n      '@babel/core': ^7.0.0\n\n  '@babel/plugin-transform-arrow-functions@7.23.3':\n    resolution: {integrity: sha512-NzQcQrzaQPkaEwoTm4Mhyl8jI1huEL/WWIEvudjTCMJ9aBZNpsJbMASx7EQECtQQPS/DcnFpo0FIh3LvEO9cxQ==}\n    engines: {node: '>=6.9.0'}\n    peerDependencies:\n      '@babel/core': ^7.0.0-0\n\n  '@babel/plugin-transform-async-generator-functions@7.23.7':\n    resolution: {integrity: sha512-PdxEpL71bJp1byMG0va5gwQcXHxuEYC/BgI/e88mGTtohbZN28O5Yit0Plkkm/dBzCF/BxmbNcses1RH1T+urA==}\n    engines: {node: '>=6.9.0'}\n    peerDependencies:\n      '@babel/core': ^7.0.0-0\n\n  '@babel/plugin-transform-async-to-generator@7.23.3':\n    resolution: {integrity: sha512-A7LFsKi4U4fomjqXJlZg/u0ft/n8/7n7lpffUP/ZULx/DtV9SGlNKZolHH6PE8Xl1ngCc0M11OaeZptXVkfKSw==}\n    engines: {node: '>=6.9.0'}\n    peerDependencies:\n      '@babel/core': ^7.0.0-0\n\n  '@babel/plugin-transform-block-scoped-functions@7.23.3':\n    resolution: {integrity: sha512-vI+0sIaPIO6CNuM9Kk5VmXcMVRiOpDh7w2zZt9GXzmE/9KD70CUEVhvPR/etAeNK/FAEkhxQtXOzVF3EuRL41A==}\n    engines: {node: '>=6.9.0'}\n    peerDependencies:\n      '@babel/core': ^7.0.0-0\n\n  '@babel/plugin-transform-block-scoping@7.23.4':\n    resolution: {integrity: sha512-0QqbP6B6HOh7/8iNR4CQU2Th/bbRtBp4KS9vcaZd1fZ0wSh5Fyssg0UCIHwxh+ka+pNDREbVLQnHCMHKZfPwfw==}\n    engines: {node: '>=6.9.0'}\n    peerDependencies:\n      '@babel/core': ^7.0.0-0\n\n  '@babel/plugin-transform-class-properties@7.23.3':\n    resolution: {integrity: sha512-uM+AN8yCIjDPccsKGlw271xjJtGii+xQIF/uMPS8H15L12jZTsLfF4o5vNO7d/oUguOyfdikHGc/yi9ge4SGIg==}\n    engines: {node: '>=6.9.0'}\n    peerDependencies:\n      '@babel/core': ^7.0.0-0\n\n  '@babel/plugin-transform-class-static-block@7.23.4':\n    resolution: {integrity: sha512-nsWu/1M+ggti1SOALj3hfx5FXzAY06fwPJsUZD4/A5e1bWi46VUIWtD+kOX6/IdhXGsXBWllLFDSnqSCdUNydQ==}\n    engines: {node: '>=6.9.0'}\n    peerDependencies:\n      '@babel/core': ^7.12.0\n\n  '@babel/plugin-transform-classes@7.23.5':\n    resolution: {integrity: sha512-jvOTR4nicqYC9yzOHIhXG5emiFEOpappSJAl73SDSEDcybD+Puuze8Tnpb9p9qEyYup24tq891gkaygIFvWDqg==}\n    engines: {node: '>=6.9.0'}\n    peerDependencies:\n      '@babel/core': ^7.0.0-0\n\n  '@babel/plugin-transform-computed-properties@7.23.3':\n    resolution: {integrity: sha512-dTj83UVTLw/+nbiHqQSFdwO9CbTtwq1DsDqm3CUEtDrZNET5rT5E6bIdTlOftDTDLMYxvxHNEYO4B9SLl8SLZw==}\n    engines: {node: '>=6.9.0'}\n    peerDependencies:\n      '@babel/core': ^7.0.0-0\n\n  '@babel/plugin-transform-destructuring@7.23.3':\n    resolution: {integrity: sha512-n225npDqjDIr967cMScVKHXJs7rout1q+tt50inyBCPkyZ8KxeI6d+GIbSBTT/w/9WdlWDOej3V9HE5Lgk57gw==}\n    engines: {node: '>=6.9.0'}\n    peerDependencies:\n      '@babel/core': ^7.0.0-0\n\n  '@babel/plugin-transform-dotall-regex@7.23.3':\n    resolution: {integrity: sha512-vgnFYDHAKzFaTVp+mneDsIEbnJ2Np/9ng9iviHw3P/KVcgONxpNULEW/51Z/BaFojG2GI2GwwXck5uV1+1NOYQ==}\n    engines: {node: '>=6.9.0'}\n    peerDependencies:\n      '@babel/core': ^7.0.0-0\n\n  '@babel/plugin-transform-duplicate-keys@7.23.3':\n    resolution: {integrity: sha512-RrqQ+BQmU3Oyav3J+7/myfvRCq7Tbz+kKLLshUmMwNlDHExbGL7ARhajvoBJEvc+fCguPPu887N+3RRXBVKZUA==}\n    engines: {node: '>=6.9.0'}\n    peerDependencies:\n      '@babel/core': ^7.0.0-0\n\n  '@babel/plugin-transform-dynamic-import@7.23.4':\n    resolution: {integrity: sha512-V6jIbLhdJK86MaLh4Jpghi8ho5fGzt3imHOBu/x0jlBaPYqDoWz4RDXjmMOfnh+JWNaQleEAByZLV0QzBT4YQQ==}\n    engines: {node: '>=6.9.0'}\n    peerDependencies:\n      '@babel/core': ^7.0.0-0\n\n  '@babel/plugin-transform-exponentiation-operator@7.23.3':\n    resolution: {integrity: sha512-5fhCsl1odX96u7ILKHBj4/Y8vipoqwsJMh4csSA8qFfxrZDEA4Ssku2DyNvMJSmZNOEBT750LfFPbtrnTP90BQ==}\n    engines: {node: '>=6.9.0'}\n    peerDependencies:\n      '@babel/core': ^7.0.0-0\n\n  '@babel/plugin-transform-export-namespace-from@7.23.4':\n    resolution: {integrity: sha512-GzuSBcKkx62dGzZI1WVgTWvkkz84FZO5TC5T8dl/Tht/rAla6Dg/Mz9Yhypg+ezVACf/rgDuQt3kbWEv7LdUDQ==}\n    engines: {node: '>=6.9.0'}\n    peerDependencies:\n      '@babel/core': ^7.0.0-0\n\n  '@babel/plugin-transform-for-of@7.23.6':\n    resolution: {integrity: sha512-aYH4ytZ0qSuBbpfhuofbg/e96oQ7U2w1Aw/UQmKT+1l39uEhUPoFS3fHevDc1G0OvewyDudfMKY1OulczHzWIw==}\n    engines: {node: '>=6.9.0'}\n    peerDependencies:\n      '@babel/core': ^7.0.0-0\n\n  '@babel/plugin-transform-function-name@7.23.3':\n    resolution: {integrity: sha512-I1QXp1LxIvt8yLaib49dRW5Okt7Q4oaxao6tFVKS/anCdEOMtYwWVKoiOA1p34GOWIZjUK0E+zCp7+l1pfQyiw==}\n    engines: {node: '>=6.9.0'}\n    peerDependencies:\n      '@babel/core': ^7.0.0-0\n\n  '@babel/plugin-transform-json-strings@7.23.4':\n    resolution: {integrity: sha512-81nTOqM1dMwZ/aRXQ59zVubN9wHGqk6UtqRK+/q+ciXmRy8fSolhGVvG09HHRGo4l6fr/c4ZhXUQH0uFW7PZbg==}\n    engines: {node: '>=6.9.0'}\n    peerDependencies:\n      '@babel/core': ^7.0.0-0\n\n  '@babel/plugin-transform-literals@7.23.3':\n    resolution: {integrity: sha512-wZ0PIXRxnwZvl9AYpqNUxpZ5BiTGrYt7kueGQ+N5FiQ7RCOD4cm8iShd6S6ggfVIWaJf2EMk8eRzAh52RfP4rQ==}\n    engines: {node: '>=6.9.0'}\n    peerDependencies:\n      '@babel/core': ^7.0.0-0\n\n  '@babel/plugin-transform-logical-assignment-operators@7.23.4':\n    resolution: {integrity: sha512-Mc/ALf1rmZTP4JKKEhUwiORU+vcfarFVLfcFiolKUo6sewoxSEgl36ak5t+4WamRsNr6nzjZXQjM35WsU+9vbg==}\n    engines: {node: '>=6.9.0'}\n    peerDependencies:\n      '@babel/core': ^7.0.0-0\n\n  '@babel/plugin-transform-member-expression-literals@7.23.3':\n    resolution: {integrity: sha512-sC3LdDBDi5x96LA+Ytekz2ZPk8i/Ck+DEuDbRAll5rknJ5XRTSaPKEYwomLcs1AA8wg9b3KjIQRsnApj+q51Ag==}\n    engines: {node: '>=6.9.0'}\n    peerDependencies:\n      '@babel/core': ^7.0.0-0\n\n  '@babel/plugin-transform-modules-amd@7.23.3':\n    resolution: {integrity: sha512-vJYQGxeKM4t8hYCKVBlZX/gtIY2I7mRGFNcm85sgXGMTBcoV3QdVtdpbcWEbzbfUIUZKwvgFT82mRvaQIebZzw==}\n    engines: {node: '>=6.9.0'}\n    peerDependencies:\n      '@babel/core': ^7.0.0-0\n\n  '@babel/plugin-transform-modules-commonjs@7.23.3':\n    resolution: {integrity: sha512-aVS0F65LKsdNOtcz6FRCpE4OgsP2OFnW46qNxNIX9h3wuzaNcSQsJysuMwqSibC98HPrf2vCgtxKNwS0DAlgcA==}\n    engines: {node: '>=6.9.0'}\n    peerDependencies:\n      '@babel/core': ^7.0.0-0\n\n  '@babel/plugin-transform-modules-systemjs@7.23.3':\n    resolution: {integrity: sha512-ZxyKGTkF9xT9YJuKQRo19ewf3pXpopuYQd8cDXqNzc3mUNbOME0RKMoZxviQk74hwzfQsEe66dE92MaZbdHKNQ==}\n    engines: {node: '>=6.9.0'}\n    peerDependencies:\n      '@babel/core': ^7.0.0-0\n\n  '@babel/plugin-transform-modules-umd@7.23.3':\n    resolution: {integrity: sha512-zHsy9iXX2nIsCBFPud3jKn1IRPWg3Ing1qOZgeKV39m1ZgIdpJqvlWVeiHBZC6ITRG0MfskhYe9cLgntfSFPIg==}\n    engines: {node: '>=6.9.0'}\n    peerDependencies:\n      '@babel/core': ^7.0.0-0\n\n  '@babel/plugin-transform-named-capturing-groups-regex@7.22.5':\n    resolution: {integrity: sha512-YgLLKmS3aUBhHaxp5hi1WJTgOUb/NCuDHzGT9z9WTt3YG+CPRhJs6nprbStx6DnWM4dh6gt7SU3sZodbZ08adQ==}\n    engines: {node: '>=6.9.0'}\n    peerDependencies:\n      '@babel/core': ^7.0.0\n\n  '@babel/plugin-transform-new-target@7.23.3':\n    resolution: {integrity: sha512-YJ3xKqtJMAT5/TIZnpAR3I+K+WaDowYbN3xyxI8zxx/Gsypwf9B9h0VB+1Nh6ACAAPRS5NSRje0uVv5i79HYGQ==}\n    engines: {node: '>=6.9.0'}\n    peerDependencies:\n      '@babel/core': ^7.0.0-0\n\n  '@babel/plugin-transform-nullish-coalescing-operator@7.23.4':\n    resolution: {integrity: sha512-jHE9EVVqHKAQx+VePv5LLGHjmHSJR76vawFPTdlxR/LVJPfOEGxREQwQfjuZEOPTwG92X3LINSh3M40Rv4zpVA==}\n    engines: {node: '>=6.9.0'}\n    peerDependencies:\n      '@babel/core': ^7.0.0-0\n\n  '@babel/plugin-transform-numeric-separator@7.23.4':\n    resolution: {integrity: sha512-mps6auzgwjRrwKEZA05cOwuDc9FAzoyFS4ZsG/8F43bTLf/TgkJg7QXOrPO1JO599iA3qgK9MXdMGOEC8O1h6Q==}\n    engines: {node: '>=6.9.0'}\n    peerDependencies:\n      '@babel/core': ^7.0.0-0\n\n  '@babel/plugin-transform-object-rest-spread@7.23.4':\n    resolution: {integrity: sha512-9x9K1YyeQVw0iOXJlIzwm8ltobIIv7j2iLyP2jIhEbqPRQ7ScNgwQufU2I0Gq11VjyG4gI4yMXt2VFags+1N3g==}\n    engines: {node: '>=6.9.0'}\n    peerDependencies:\n      '@babel/core': ^7.0.0-0\n\n  '@babel/plugin-transform-object-super@7.23.3':\n    resolution: {integrity: sha512-BwQ8q0x2JG+3lxCVFohg+KbQM7plfpBwThdW9A6TMtWwLsbDA01Ek2Zb/AgDN39BiZsExm4qrXxjk+P1/fzGrA==}\n    engines: {node: '>=6.9.0'}\n    peerDependencies:\n      '@babel/core': ^7.0.0-0\n\n  '@babel/plugin-transform-optional-catch-binding@7.23.4':\n    resolution: {integrity: sha512-XIq8t0rJPHf6Wvmbn9nFxU6ao4c7WhghTR5WyV8SrJfUFzyxhCm4nhC+iAp3HFhbAKLfYpgzhJ6t4XCtVwqO5A==}\n    engines: {node: '>=6.9.0'}\n    peerDependencies:\n      '@babel/core': ^7.0.0-0\n\n  '@babel/plugin-transform-optional-chaining@7.23.4':\n    resolution: {integrity: sha512-ZU8y5zWOfjM5vZ+asjgAPwDaBjJzgufjES89Rs4Lpq63O300R/kOz30WCLo6BxxX6QVEilwSlpClnG5cZaikTA==}\n    engines: {node: '>=6.9.0'}\n    peerDependencies:\n      '@babel/core': ^7.0.0-0\n\n  '@babel/plugin-transform-parameters@7.23.3':\n    resolution: {integrity: sha512-09lMt6UsUb3/34BbECKVbVwrT9bO6lILWln237z7sLaWnMsTi7Yc9fhX5DLpkJzAGfaReXI22wP41SZmnAA3Vw==}\n    engines: {node: '>=6.9.0'}\n    peerDependencies:\n      '@babel/core': ^7.0.0-0\n\n  '@babel/plugin-transform-private-methods@7.23.3':\n    resolution: {integrity: sha512-UzqRcRtWsDMTLrRWFvUBDwmw06tCQH9Rl1uAjfh6ijMSmGYQ+fpdB+cnqRC8EMh5tuuxSv0/TejGL+7vyj+50g==}\n    engines: {node: '>=6.9.0'}\n    peerDependencies:\n      '@babel/core': ^7.0.0-0\n\n  '@babel/plugin-transform-private-property-in-object@7.23.4':\n    resolution: {integrity: sha512-9G3K1YqTq3F4Vt88Djx1UZ79PDyj+yKRnUy7cZGSMe+a7jkwD259uKKuUzQlPkGam7R+8RJwh5z4xO27fA1o2A==}\n    engines: {node: '>=6.9.0'}\n    peerDependencies:\n      '@babel/core': ^7.0.0-0\n\n  '@babel/plugin-transform-property-literals@7.23.3':\n    resolution: {integrity: sha512-jR3Jn3y7cZp4oEWPFAlRsSWjxKe4PZILGBSd4nis1TsC5qeSpb+nrtihJuDhNI7QHiVbUaiXa0X2RZY3/TI6Nw==}\n    engines: {node: '>=6.9.0'}\n    peerDependencies:\n      '@babel/core': ^7.0.0-0\n\n  '@babel/plugin-transform-regenerator@7.23.3':\n    resolution: {integrity: sha512-KP+75h0KghBMcVpuKisx3XTu9Ncut8Q8TuvGO4IhY+9D5DFEckQefOuIsB/gQ2tG71lCke4NMrtIPS8pOj18BQ==}\n    engines: {node: '>=6.9.0'}\n    peerDependencies:\n      '@babel/core': ^7.0.0-0\n\n  '@babel/plugin-transform-reserved-words@7.23.3':\n    resolution: {integrity: sha512-QnNTazY54YqgGxwIexMZva9gqbPa15t/x9VS+0fsEFWplwVpXYZivtgl43Z1vMpc1bdPP2PP8siFeVcnFvA3Cg==}\n    engines: {node: '>=6.9.0'}\n    peerDependencies:\n      '@babel/core': ^7.0.0-0\n\n  '@babel/plugin-transform-shorthand-properties@7.23.3':\n    resolution: {integrity: sha512-ED2fgqZLmexWiN+YNFX26fx4gh5qHDhn1O2gvEhreLW2iI63Sqm4llRLCXALKrCnbN4Jy0VcMQZl/SAzqug/jg==}\n    engines: {node: '>=6.9.0'}\n    peerDependencies:\n      '@babel/core': ^7.0.0-0\n\n  '@babel/plugin-transform-spread@7.23.3':\n    resolution: {integrity: sha512-VvfVYlrlBVu+77xVTOAoxQ6mZbnIq5FM0aGBSFEcIh03qHf+zNqA4DC/3XMUozTg7bZV3e3mZQ0i13VB6v5yUg==}\n    engines: {node: '>=6.9.0'}\n    peerDependencies:\n      '@babel/core': ^7.0.0-0\n\n  '@babel/plugin-transform-sticky-regex@7.23.3':\n    resolution: {integrity: sha512-HZOyN9g+rtvnOU3Yh7kSxXrKbzgrm5X4GncPY1QOquu7epga5MxKHVpYu2hvQnry/H+JjckSYRb93iNfsioAGg==}\n    engines: {node: '>=6.9.0'}\n    peerDependencies:\n      '@babel/core': ^7.0.0-0\n\n  '@babel/plugin-transform-template-literals@7.23.3':\n    resolution: {integrity: sha512-Flok06AYNp7GV2oJPZZcP9vZdszev6vPBkHLwxwSpaIqx75wn6mUd3UFWsSsA0l8nXAKkyCmL/sR02m8RYGeHg==}\n    engines: {node: '>=6.9.0'}\n    peerDependencies:\n      '@babel/core': ^7.0.0-0\n\n  '@babel/plugin-transform-typeof-symbol@7.23.3':\n    resolution: {integrity: sha512-4t15ViVnaFdrPC74be1gXBSMzXk3B4Us9lP7uLRQHTFpV5Dvt33pn+2MyyNxmN3VTTm3oTrZVMUmuw3oBnQ2oQ==}\n    engines: {node: '>=6.9.0'}\n    peerDependencies:\n      '@babel/core': ^7.0.0-0\n\n  '@babel/plugin-transform-typescript@7.25.9':\n    resolution: {integrity: sha512-7PbZQZP50tzv2KGGnhh82GSyMB01yKY9scIjf1a+GfZCtInOWqUH5+1EBU4t9fyR5Oykkkc9vFTs4OHrhHXljQ==}\n    engines: {node: '>=6.9.0'}\n    peerDependencies:\n      '@babel/core': ^7.0.0-0\n\n  '@babel/plugin-transform-unicode-escapes@7.23.3':\n    resolution: {integrity: sha512-OMCUx/bU6ChE3r4+ZdylEqAjaQgHAgipgW8nsCfu5pGqDcFytVd91AwRvUJSBZDz0exPGgnjoqhgRYLRjFZc9Q==}\n    engines: {node: '>=6.9.0'}\n    peerDependencies:\n      '@babel/core': ^7.0.0-0\n\n  '@babel/plugin-transform-unicode-property-regex@7.23.3':\n    resolution: {integrity: sha512-KcLIm+pDZkWZQAFJ9pdfmh89EwVfmNovFBcXko8szpBeF8z68kWIPeKlmSOkT9BXJxs2C0uk+5LxoxIv62MROA==}\n    engines: {node: '>=6.9.0'}\n    peerDependencies:\n      '@babel/core': ^7.0.0-0\n\n  '@babel/plugin-transform-unicode-regex@7.23.3':\n    resolution: {integrity: sha512-wMHpNA4x2cIA32b/ci3AfwNgheiva2W0WUKWTK7vBHBhDKfPsc5cFGNWm69WBqpwd86u1qwZ9PWevKqm1A3yAw==}\n    engines: {node: '>=6.9.0'}\n    peerDependencies:\n      '@babel/core': ^7.0.0-0\n\n  '@babel/plugin-transform-unicode-sets-regex@7.23.3':\n    resolution: {integrity: sha512-W7lliA/v9bNR83Qc3q1ip9CQMZ09CcHDbHfbLRDNuAhn1Mvkr1ZNF7hPmztMQvtTGVLJ9m8IZqWsTkXOml8dbw==}\n    engines: {node: '>=6.9.0'}\n    peerDependencies:\n      '@babel/core': ^7.0.0\n\n  '@babel/preset-env@7.23.7':\n    resolution: {integrity: sha512-SY27X/GtTz/L4UryMNJ6p4fH4nsgWbz84y9FE0bQeWJP6O5BhgVCt53CotQKHCOeXJel8VyhlhujhlltKms/CA==}\n    engines: {node: '>=6.9.0'}\n    peerDependencies:\n      '@babel/core': ^7.0.0-0\n\n  '@babel/preset-modules@0.1.6-no-external-plugins':\n    resolution: {integrity: sha512-HrcgcIESLm9aIR842yhJ5RWan/gebQUJ6E/E5+rf0y9o6oj7w0Br+sWuL6kEQ/o/AdfvR1Je9jG18/gnpwjEyA==}\n    peerDependencies:\n      '@babel/core': ^7.0.0-0 || ^8.0.0-0 <8.0.0\n\n  '@babel/regjsgen@0.8.0':\n    resolution: {integrity: sha512-x/rqGMdzj+fWZvCOYForTghzbtqPDZ5gPwaoNGHdgDfF2QA/XZbCBp4Moo5scrkAMPhB7z26XM/AaHuIJdgauA==}\n\n  '@babel/runtime@7.23.7':\n    resolution: {integrity: sha512-w06OXVOFso7LcbzMiDGt+3X7Rh7Ho8MmgPoWU3rarH+8upf+wSU/grlGbWzQyr3DkdN6ZeuMFjpdwW0Q+HxobA==}\n    engines: {node: '>=6.9.0'}\n\n  '@babel/standalone@7.25.9':\n    resolution: {integrity: sha512-j37QF9mpPAneLBp9xX9FU8O9mWbuKvGbjDvjWtg4vu++08210X7FQNq+3df7MkeI1g56XFWsEqyN0byzuSe3dA==}\n    engines: {node: '>=6.9.0'}\n\n  '@babel/template@7.22.15':\n    resolution: {integrity: sha512-QPErUVm4uyJa60rkI73qneDacvdvzxshT3kksGqlGWYdOTIUOwJ7RDUL8sGqslY1uXWSL6xMFKEXDS3ox2uF0w==}\n    engines: {node: '>=6.9.0'}\n\n  '@babel/template@7.25.9':\n    resolution: {integrity: sha512-9DGttpmPvIxBb/2uwpVo3dqJ+O6RooAFOS+lB+xDqoE2PVCE8nfoHMdZLpfCQRLwvohzXISPZcgxt80xLfsuwg==}\n    engines: {node: '>=6.9.0'}\n\n  '@babel/traverse@7.23.7':\n    resolution: {integrity: sha512-tY3mM8rH9jM0YHFGyfC0/xf+SB5eKUu7HPj7/k3fpi9dAlsMc5YbQvDi0Sh2QTPXqMhyaAtzAr807TIyfQrmyg==}\n    engines: {node: '>=6.9.0'}\n\n  '@babel/traverse@7.25.9':\n    resolution: {integrity: sha512-ZCuvfwOwlz/bawvAuvcj8rrithP2/N55Tzz342AkTvq4qaWbGfmCk/tKhNaV2cthijKrPAA8SRJV5WWe7IBMJw==}\n    engines: {node: '>=6.9.0'}\n\n  '@babel/types@7.25.8':\n    resolution: {integrity: sha512-JWtuCu8VQsMladxVz/P4HzHUGCAwpuqacmowgXFs5XjxIgKuNjnLokQzuVjlTvIzODaDmpjT3oxcC48vyk9EWg==}\n    engines: {node: '>=6.9.0'}\n\n  '@babel/types@7.25.9':\n    resolution: {integrity: sha512-OwS2CM5KocvQ/k7dFJa8i5bNGJP0hXWfVCfDkqRFP1IreH1JDC7wG6eCYCi0+McbfT8OR/kNqsI0UU0xP9H6PQ==}\n    engines: {node: '>=6.9.0'}\n\n  '@cloudflare/kv-asset-handler@0.3.4':\n    resolution: {integrity: sha512-YLPHc8yASwjNkmcDMQMY35yiWjoKAKnhUbPRszBRS0YgH+IXtsMp61j+yTcnCE3oO2DgP0U3iejLC8FTtKDC8Q==}\n    engines: {node: '>=16.13'}\n\n  '@cloudflare/workerd-darwin-64@1.20241106.1':\n    resolution: {integrity: sha512-zxvaToi1m0qzAScrxFt7UvFVqU8DxrCO2CinM1yQkv5no7pA1HolpIrwZ0xOhR3ny64Is2s/J6BrRjpO5dM9Zw==}\n    engines: {node: '>=16'}\n    cpu: [x64]\n    os: [darwin]\n\n  '@cloudflare/workerd-darwin-arm64@1.20241106.1':\n    resolution: {integrity: sha512-j3dg/42D/bPgfNP3cRUBxF+4waCKO/5YKwXNj+lnVOwHxDu+ne5pFw9TIkKYcWTcwn0ZUkbNZNM5rhJqRn4xbg==}\n    engines: {node: '>=16'}\n    cpu: [arm64]\n    os: [darwin]\n\n  '@cloudflare/workerd-linux-64@1.20241106.1':\n    resolution: {integrity: sha512-Ih+Ye8E1DMBXcKrJktGfGztFqHKaX1CeByqshmTbODnWKHt6O65ax3oTecUwyC0+abuyraOpAtdhHNpFMhUkmw==}\n    engines: {node: '>=16'}\n    cpu: [x64]\n    os: [linux]\n\n  '@cloudflare/workerd-linux-arm64@1.20241106.1':\n    resolution: {integrity: sha512-mdQFPk4+14Yywn7n1xIzI+6olWM8Ybz10R7H3h+rk0XulMumCWUCy1CzIDauOx6GyIcSgKIibYMssVHZR30ObA==}\n    engines: {node: '>=16'}\n    cpu: [arm64]\n    os: [linux]\n\n  '@cloudflare/workerd-windows-64@1.20241106.1':\n    resolution: {integrity: sha512-4rtcss31E/Rb/PeFocZfr+B9i1MdrkhsTBWizh8siNR4KMmkslU2xs2wPaH1z8+ErxkOsHrKRa5EPLh5rIiFeg==}\n    engines: {node: '>=16'}\n    cpu: [x64]\n    os: [win32]\n\n  '@cloudflare/workers-shared@0.9.0':\n    resolution: {integrity: sha512-eP6Ir45uPbKnpADVzUCtkRUYxYxjB1Ew6n/whTJvHu8H4m93USHAceCMm736VBZdlxuhXXUjEP3fCUxKPn+cfw==}\n    engines: {node: '>=16.7.0'}\n\n  '@cloudflare/workers-types@4.20241127.0':\n    resolution: {integrity: sha512-UqlvtqV8eI0CdPR7nxlbVlE52+lcjHvGdbYXEPwisy23+39RsFV7OOy0da0moJAhqnL2OhDmWTOaKdsVcPHiJQ==}\n\n  '@cspotcode/source-map-support@0.8.1':\n    resolution: {integrity: sha512-IchNf6dN4tHoMFIn/7OE8LWZ19Y6q/67Bmf6vnGREv8RSbBVb9LPJxEcnwrcwX6ixSvaiGoomAUvu4YSxXrVgw==}\n    engines: {node: '>=12'}\n\n  '@csstools/selector-resolve-nested@2.0.0':\n    resolution: {integrity: sha512-oklSrRvOxNeeOW1yARd4WNCs/D09cQjunGZUgSq6vM8GpzFswN+8rBZyJA29YFZhOTQ6GFzxgLDNtVbt9wPZMA==}\n    engines: {node: '>=18'}\n    peerDependencies:\n      postcss-selector-parser: ^6.1.0\n\n  '@csstools/selector-specificity@4.0.0':\n    resolution: {integrity: sha512-189nelqtPd8++phaHNwYovKZI0FOzH1vQEE3QhHHkNIGrg5fSs9CbYP3RvfEH5geztnIA9Jwq91wyOIwAW5JIQ==}\n    engines: {node: '>=18'}\n    peerDependencies:\n      postcss-selector-parser: ^6.1.0\n\n  '@drizzle-team/brocli@0.10.2':\n    resolution: {integrity: sha512-z33Il7l5dKjUgGULTqBsQBQwckHh5AbIuxhdsIxDDiZAzBOrZO6q9ogcWC65kU382AfynTfgNumVcNIjuIua6w==}\n\n  '@esbuild-kit/core-utils@3.3.2':\n    resolution: {integrity: sha512-sPRAnw9CdSsRmEtnsl2WXWdyquogVpB3yZ3dgwJfe8zrOzTsV7cJvmwrKVa+0ma5BoiGJ+BoqkMvawbayKUsqQ==}\n    deprecated: 'Merged into tsx: https://tsx.is'\n\n  '@esbuild-kit/esm-loader@2.6.5':\n    resolution: {integrity: sha512-FxEMIkJKnodyA1OaCUoEvbYRkoZlLZ4d/eXFu9Fh8CbBBgP5EmZxrfTRyN0qpXZ4vOvqnE5YdRdcrmUUXuU+dA==}\n    deprecated: 'Merged into tsx: https://tsx.is'\n\n  '@esbuild-plugins/node-globals-polyfill@0.2.3':\n    resolution: {integrity: sha512-r3MIryXDeXDOZh7ih1l/yE9ZLORCd5e8vWg02azWRGj5SPTuoh69A2AIyn0Z31V/kHBfZ4HgWJ+OK3GTTwLmnw==}\n    peerDependencies:\n      esbuild: '*'\n\n  '@esbuild-plugins/node-modules-polyfill@0.2.2':\n    resolution: {integrity: sha512-LXV7QsWJxRuMYvKbiznh+U1ilIop3g2TeKRzUxOG5X3YITc8JyyTa90BmLwqqv0YnX4v32CSlG+vsziZp9dMvA==}\n    peerDependencies:\n      esbuild: '*'\n\n  '@esbuild/aix-ppc64@0.19.12':\n    resolution: {integrity: sha512-bmoCYyWdEL3wDQIVbcyzRyeKLgk2WtWLTWz1ZIAZF/EGbNOwSA6ew3PftJ1PqMiOOGu0OyFMzG53L0zqIpPeNA==}\n    engines: {node: '>=12'}\n    cpu: [ppc64]\n    os: [aix]\n\n  '@esbuild/aix-ppc64@0.20.2':\n    resolution: {integrity: sha512-D+EBOJHXdNZcLJRBkhENNG8Wji2kgc9AZ9KiPr1JuZjsNtyHzrsfLRrY0tk2H2aoFu6RANO1y1iPPUCDYWkb5g==}\n    engines: {node: '>=12'}\n    cpu: [ppc64]\n    os: [aix]\n\n  '@esbuild/aix-ppc64@0.21.5':\n    resolution: {integrity: sha512-1SDgH6ZSPTlggy1yI6+Dbkiz8xzpHJEVAlF/AM1tHPLsf5STom9rwtjE4hKAF20FfXXNTFqEYXyJNWh1GiZedQ==}\n    engines: {node: '>=12'}\n    cpu: [ppc64]\n    os: [aix]\n\n  '@esbuild/aix-ppc64@0.23.1':\n    resolution: {integrity: sha512-6VhYk1diRqrhBAqpJEdjASR/+WVRtfjpqKuNw11cLiaWpAT/Uu+nokB+UJnevzy/P9C/ty6AOe0dwueMrGh/iQ==}\n    engines: {node: '>=18'}\n    cpu: [ppc64]\n    os: [aix]\n\n  '@esbuild/android-arm64@0.17.19':\n    resolution: {integrity: sha512-KBMWvEZooR7+kzY0BtbTQn0OAYY7CsiydT63pVEaPtVYF0hXbUaOyZog37DKxK7NF3XacBJOpYT4adIJh+avxA==}\n    engines: {node: '>=12'}\n    cpu: [arm64]\n    os: [android]\n\n  '@esbuild/android-arm64@0.18.20':\n    resolution: {integrity: sha512-Nz4rJcchGDtENV0eMKUNa6L12zz2zBDXuhj/Vjh18zGqB44Bi7MBMSXjgunJgjRhCmKOjnPuZp4Mb6OKqtMHLQ==}\n    engines: {node: '>=12'}\n    cpu: [arm64]\n    os: [android]\n\n  '@esbuild/android-arm64@0.19.12':\n    resolution: {integrity: sha512-P0UVNGIienjZv3f5zq0DP3Nt2IE/3plFzuaS96vihvD0Hd6H/q4WXUGpCxD/E8YrSXfNyRPbpTq+T8ZQioSuPA==}\n    engines: {node: '>=12'}\n    cpu: [arm64]\n    os: [android]\n\n  '@esbuild/android-arm64@0.20.2':\n    resolution: {integrity: sha512-mRzjLacRtl/tWU0SvD8lUEwb61yP9cqQo6noDZP/O8VkwafSYwZ4yWy24kan8jE/IMERpYncRt2dw438LP3Xmg==}\n    engines: {node: '>=12'}\n    cpu: [arm64]\n    os: [android]\n\n  '@esbuild/android-arm64@0.21.5':\n    resolution: {integrity: sha512-c0uX9VAUBQ7dTDCjq+wdyGLowMdtR/GoC2U5IYk/7D1H1JYC0qseD7+11iMP2mRLN9RcCMRcjC4YMclCzGwS/A==}\n    engines: {node: '>=12'}\n    cpu: [arm64]\n    os: [android]\n\n  '@esbuild/android-arm64@0.23.1':\n    resolution: {integrity: sha512-xw50ipykXcLstLeWH7WRdQuysJqejuAGPd30vd1i5zSyKK3WE+ijzHmLKxdiCMtH1pHz78rOg0BKSYOSB/2Khw==}\n    engines: {node: '>=18'}\n    cpu: [arm64]\n    os: [android]\n\n  '@esbuild/android-arm@0.17.19':\n    resolution: {integrity: sha512-rIKddzqhmav7MSmoFCmDIb6e2W57geRsM94gV2l38fzhXMwq7hZoClug9USI2pFRGL06f4IOPHHpFNOkWieR8A==}\n    engines: {node: '>=12'}\n    cpu: [arm]\n    os: [android]\n\n  '@esbuild/android-arm@0.18.20':\n    resolution: {integrity: sha512-fyi7TDI/ijKKNZTUJAQqiG5T7YjJXgnzkURqmGj13C6dCqckZBLdl4h7bkhHt/t0WP+zO9/zwroDvANaOqO5Sw==}\n    engines: {node: '>=12'}\n    cpu: [arm]\n    os: [android]\n\n  '@esbuild/android-arm@0.19.12':\n    resolution: {integrity: sha512-qg/Lj1mu3CdQlDEEiWrlC4eaPZ1KztwGJ9B6J+/6G+/4ewxJg7gqj8eVYWvao1bXrqGiW2rsBZFSX3q2lcW05w==}\n    engines: {node: '>=12'}\n    cpu: [arm]\n    os: [android]\n\n  '@esbuild/android-arm@0.20.2':\n    resolution: {integrity: sha512-t98Ra6pw2VaDhqNWO2Oph2LXbz/EJcnLmKLGBJwEwXX/JAN83Fym1rU8l0JUWK6HkIbWONCSSatf4sf2NBRx/w==}\n    engines: {node: '>=12'}\n    cpu: [arm]\n    os: [android]\n\n  '@esbuild/android-arm@0.21.5':\n    resolution: {integrity: sha512-vCPvzSjpPHEi1siZdlvAlsPxXl7WbOVUBBAowWug4rJHb68Ox8KualB+1ocNvT5fjv6wpkX6o/iEpbDrf68zcg==}\n    engines: {node: '>=12'}\n    cpu: [arm]\n    os: [android]\n\n  '@esbuild/android-arm@0.23.1':\n    resolution: {integrity: sha512-uz6/tEy2IFm9RYOyvKl88zdzZfwEfKZmnX9Cj1BHjeSGNuGLuMD1kR8y5bteYmwqKm1tj8m4cb/aKEorr6fHWQ==}\n    engines: {node: '>=18'}\n    cpu: [arm]\n    os: [android]\n\n  '@esbuild/android-x64@0.17.19':\n    resolution: {integrity: sha512-uUTTc4xGNDT7YSArp/zbtmbhO0uEEK9/ETW29Wk1thYUJBz3IVnvgEiEwEa9IeLyvnpKrWK64Utw2bgUmDveww==}\n    engines: {node: '>=12'}\n    cpu: [x64]\n    os: [android]\n\n  '@esbuild/android-x64@0.18.20':\n    resolution: {integrity: sha512-8GDdlePJA8D6zlZYJV/jnrRAi6rOiNaCC/JclcXpB+KIuvfBN4owLtgzY2bsxnx666XjJx2kDPUmnTtR8qKQUg==}\n    engines: {node: '>=12'}\n    cpu: [x64]\n    os: [android]\n\n  '@esbuild/android-x64@0.19.12':\n    resolution: {integrity: sha512-3k7ZoUW6Q6YqhdhIaq/WZ7HwBpnFBlW905Fa4s4qWJyiNOgT1dOqDiVAQFwBH7gBRZr17gLrlFCRzF6jFh7Kew==}\n    engines: {node: '>=12'}\n    cpu: [x64]\n    os: [android]\n\n  '@esbuild/android-x64@0.20.2':\n    resolution: {integrity: sha512-btzExgV+/lMGDDa194CcUQm53ncxzeBrWJcncOBxuC6ndBkKxnHdFJn86mCIgTELsooUmwUm9FkhSp5HYu00Rg==}\n    engines: {node: '>=12'}\n    cpu: [x64]\n    os: [android]\n\n  '@esbuild/android-x64@0.21.5':\n    resolution: {integrity: sha512-D7aPRUUNHRBwHxzxRvp856rjUHRFW1SdQATKXH2hqA0kAZb1hKmi02OpYRacl0TxIGz/ZmXWlbZgjwWYaCakTA==}\n    engines: {node: '>=12'}\n    cpu: [x64]\n    os: [android]\n\n  '@esbuild/android-x64@0.23.1':\n    resolution: {integrity: sha512-nlN9B69St9BwUoB+jkyU090bru8L0NA3yFvAd7k8dNsVH8bi9a8cUAUSEcEEgTp2z3dbEDGJGfP6VUnkQnlReg==}\n    engines: {node: '>=18'}\n    cpu: [x64]\n    os: [android]\n\n  '@esbuild/darwin-arm64@0.17.19':\n    resolution: {integrity: sha512-80wEoCfF/hFKM6WE1FyBHc9SfUblloAWx6FJkFWTWiCoht9Mc0ARGEM47e67W9rI09YoUxJL68WHfDRYEAvOhg==}\n    engines: {node: '>=12'}\n    cpu: [arm64]\n    os: [darwin]\n\n  '@esbuild/darwin-arm64@0.18.20':\n    resolution: {integrity: sha512-bxRHW5kHU38zS2lPTPOyuyTm+S+eobPUnTNkdJEfAddYgEcll4xkT8DB9d2008DtTbl7uJag2HuE5NZAZgnNEA==}\n    engines: {node: '>=12'}\n    cpu: [arm64]\n    os: [darwin]\n\n  '@esbuild/darwin-arm64@0.19.12':\n    resolution: {integrity: sha512-B6IeSgZgtEzGC42jsI+YYu9Z3HKRxp8ZT3cqhvliEHovq8HSX2YX8lNocDn79gCKJXOSaEot9MVYky7AKjCs8g==}\n    engines: {node: '>=12'}\n    cpu: [arm64]\n    os: [darwin]\n\n  '@esbuild/darwin-arm64@0.20.2':\n    resolution: {integrity: sha512-4J6IRT+10J3aJH3l1yzEg9y3wkTDgDk7TSDFX+wKFiWjqWp/iCfLIYzGyasx9l0SAFPT1HwSCR+0w/h1ES/MjA==}\n    engines: {node: '>=12'}\n    cpu: [arm64]\n    os: [darwin]\n\n  '@esbuild/darwin-arm64@0.21.5':\n    resolution: {integrity: sha512-DwqXqZyuk5AiWWf3UfLiRDJ5EDd49zg6O9wclZ7kUMv2WRFr4HKjXp/5t8JZ11QbQfUS6/cRCKGwYhtNAY88kQ==}\n    engines: {node: '>=12'}\n    cpu: [arm64]\n    os: [darwin]\n\n  '@esbuild/darwin-arm64@0.23.1':\n    resolution: {integrity: sha512-YsS2e3Wtgnw7Wq53XXBLcV6JhRsEq8hkfg91ESVadIrzr9wO6jJDMZnCQbHm1Guc5t/CdDiFSSfWP58FNuvT3Q==}\n    engines: {node: '>=18'}\n    cpu: [arm64]\n    os: [darwin]\n\n  '@esbuild/darwin-x64@0.17.19':\n    resolution: {integrity: sha512-IJM4JJsLhRYr9xdtLytPLSH9k/oxR3boaUIYiHkAawtwNOXKE8KoU8tMvryogdcT8AU+Bflmh81Xn6Q0vTZbQw==}\n    engines: {node: '>=12'}\n    cpu: [x64]\n    os: [darwin]\n\n  '@esbuild/darwin-x64@0.18.20':\n    resolution: {integrity: sha512-pc5gxlMDxzm513qPGbCbDukOdsGtKhfxD1zJKXjCCcU7ju50O7MeAZ8c4krSJcOIJGFR+qx21yMMVYwiQvyTyQ==}\n    engines: {node: '>=12'}\n    cpu: [x64]\n    os: [darwin]\n\n  '@esbuild/darwin-x64@0.19.12':\n    resolution: {integrity: sha512-hKoVkKzFiToTgn+41qGhsUJXFlIjxI/jSYeZf3ugemDYZldIXIxhvwN6erJGlX4t5h417iFuheZ7l+YVn05N3A==}\n    engines: {node: '>=12'}\n    cpu: [x64]\n    os: [darwin]\n\n  '@esbuild/darwin-x64@0.20.2':\n    resolution: {integrity: sha512-tBcXp9KNphnNH0dfhv8KYkZhjc+H3XBkF5DKtswJblV7KlT9EI2+jeA8DgBjp908WEuYll6pF+UStUCfEpdysA==}\n    engines: {node: '>=12'}\n    cpu: [x64]\n    os: [darwin]\n\n  '@esbuild/darwin-x64@0.21.5':\n    resolution: {integrity: sha512-se/JjF8NlmKVG4kNIuyWMV/22ZaerB+qaSi5MdrXtd6R08kvs2qCN4C09miupktDitvh8jRFflwGFBQcxZRjbw==}\n    engines: {node: '>=12'}\n    cpu: [x64]\n    os: [darwin]\n\n  '@esbuild/darwin-x64@0.23.1':\n    resolution: {integrity: sha512-aClqdgTDVPSEGgoCS8QDG37Gu8yc9lTHNAQlsztQ6ENetKEO//b8y31MMu2ZaPbn4kVsIABzVLXYLhCGekGDqw==}\n    engines: {node: '>=18'}\n    cpu: [x64]\n    os: [darwin]\n\n  '@esbuild/freebsd-arm64@0.17.19':\n    resolution: {integrity: sha512-pBwbc7DufluUeGdjSU5Si+P3SoMF5DQ/F/UmTSb8HXO80ZEAJmrykPyzo1IfNbAoaqw48YRpv8shwd1NoI0jcQ==}\n    engines: {node: '>=12'}\n    cpu: [arm64]\n    os: [freebsd]\n\n  '@esbuild/freebsd-arm64@0.18.20':\n    resolution: {integrity: sha512-yqDQHy4QHevpMAaxhhIwYPMv1NECwOvIpGCZkECn8w2WFHXjEwrBn3CeNIYsibZ/iZEUemj++M26W3cNR5h+Tw==}\n    engines: {node: '>=12'}\n    cpu: [arm64]\n    os: [freebsd]\n\n  '@esbuild/freebsd-arm64@0.19.12':\n    resolution: {integrity: sha512-4aRvFIXmwAcDBw9AueDQ2YnGmz5L6obe5kmPT8Vd+/+x/JMVKCgdcRwH6APrbpNXsPz+K653Qg8HB/oXvXVukA==}\n    engines: {node: '>=12'}\n    cpu: [arm64]\n    os: [freebsd]\n\n  '@esbuild/freebsd-arm64@0.20.2':\n    resolution: {integrity: sha512-d3qI41G4SuLiCGCFGUrKsSeTXyWG6yem1KcGZVS+3FYlYhtNoNgYrWcvkOoaqMhwXSMrZRl69ArHsGJ9mYdbbw==}\n    engines: {node: '>=12'}\n    cpu: [arm64]\n    os: [freebsd]\n\n  '@esbuild/freebsd-arm64@0.21.5':\n    resolution: {integrity: sha512-5JcRxxRDUJLX8JXp/wcBCy3pENnCgBR9bN6JsY4OmhfUtIHe3ZW0mawA7+RDAcMLrMIZaf03NlQiX9DGyB8h4g==}\n    engines: {node: '>=12'}\n    cpu: [arm64]\n    os: [freebsd]\n\n  '@esbuild/freebsd-arm64@0.23.1':\n    resolution: {integrity: sha512-h1k6yS8/pN/NHlMl5+v4XPfikhJulk4G+tKGFIOwURBSFzE8bixw1ebjluLOjfwtLqY0kewfjLSrO6tN2MgIhA==}\n    engines: {node: '>=18'}\n    cpu: [arm64]\n    os: [freebsd]\n\n  '@esbuild/freebsd-x64@0.17.19':\n    resolution: {integrity: sha512-4lu+n8Wk0XlajEhbEffdy2xy53dpR06SlzvhGByyg36qJw6Kpfk7cp45DR/62aPH9mtJRmIyrXAS5UWBrJT6TQ==}\n    engines: {node: '>=12'}\n    cpu: [x64]\n    os: [freebsd]\n\n  '@esbuild/freebsd-x64@0.18.20':\n    resolution: {integrity: sha512-tgWRPPuQsd3RmBZwarGVHZQvtzfEBOreNuxEMKFcd5DaDn2PbBxfwLcj4+aenoh7ctXcbXmOQIn8HI6mCSw5MQ==}\n    engines: {node: '>=12'}\n    cpu: [x64]\n    os: [freebsd]\n\n  '@esbuild/freebsd-x64@0.19.12':\n    resolution: {integrity: sha512-EYoXZ4d8xtBoVN7CEwWY2IN4ho76xjYXqSXMNccFSx2lgqOG/1TBPW0yPx1bJZk94qu3tX0fycJeeQsKovA8gg==}\n    engines: {node: '>=12'}\n    cpu: [x64]\n    os: [freebsd]\n\n  '@esbuild/freebsd-x64@0.20.2':\n    resolution: {integrity: sha512-d+DipyvHRuqEeM5zDivKV1KuXn9WeRX6vqSqIDgwIfPQtwMP4jaDsQsDncjTDDsExT4lR/91OLjRo8bmC1e+Cw==}\n    engines: {node: '>=12'}\n    cpu: [x64]\n    os: [freebsd]\n\n  '@esbuild/freebsd-x64@0.21.5':\n    resolution: {integrity: sha512-J95kNBj1zkbMXtHVH29bBriQygMXqoVQOQYA+ISs0/2l3T9/kj42ow2mpqerRBxDJnmkUDCaQT/dfNXWX/ZZCQ==}\n    engines: {node: '>=12'}\n    cpu: [x64]\n    os: [freebsd]\n\n  '@esbuild/freebsd-x64@0.23.1':\n    resolution: {integrity: sha512-lK1eJeyk1ZX8UklqFd/3A60UuZ/6UVfGT2LuGo3Wp4/z7eRTRYY+0xOu2kpClP+vMTi9wKOfXi2vjUpO1Ro76g==}\n    engines: {node: '>=18'}\n    cpu: [x64]\n    os: [freebsd]\n\n  '@esbuild/linux-arm64@0.17.19':\n    resolution: {integrity: sha512-ct1Tg3WGwd3P+oZYqic+YZF4snNl2bsnMKRkb3ozHmnM0dGWuxcPTTntAF6bOP0Sp4x0PjSF+4uHQ1xvxfRKqg==}\n    engines: {node: '>=12'}\n    cpu: [arm64]\n    os: [linux]\n\n  '@esbuild/linux-arm64@0.18.20':\n    resolution: {integrity: sha512-2YbscF+UL7SQAVIpnWvYwM+3LskyDmPhe31pE7/aoTMFKKzIc9lLbyGUpmmb8a8AixOL61sQ/mFh3jEjHYFvdA==}\n    engines: {node: '>=12'}\n    cpu: [arm64]\n    os: [linux]\n\n  '@esbuild/linux-arm64@0.19.12':\n    resolution: {integrity: sha512-EoTjyYyLuVPfdPLsGVVVC8a0p1BFFvtpQDB/YLEhaXyf/5bczaGeN15QkR+O4S5LeJ92Tqotve7i1jn35qwvdA==}\n    engines: {node: '>=12'}\n    cpu: [arm64]\n    os: [linux]\n\n  '@esbuild/linux-arm64@0.20.2':\n    resolution: {integrity: sha512-9pb6rBjGvTFNira2FLIWqDk/uaf42sSyLE8j1rnUpuzsODBq7FvpwHYZxQ/It/8b+QOS1RYfqgGFNLRI+qlq2A==}\n    engines: {node: '>=12'}\n    cpu: [arm64]\n    os: [linux]\n\n  '@esbuild/linux-arm64@0.21.5':\n    resolution: {integrity: sha512-ibKvmyYzKsBeX8d8I7MH/TMfWDXBF3db4qM6sy+7re0YXya+K1cem3on9XgdT2EQGMu4hQyZhan7TeQ8XkGp4Q==}\n    engines: {node: '>=12'}\n    cpu: [arm64]\n    os: [linux]\n\n  '@esbuild/linux-arm64@0.23.1':\n    resolution: {integrity: sha512-/93bf2yxencYDnItMYV/v116zff6UyTjo4EtEQjUBeGiVpMmffDNUyD9UN2zV+V3LRV3/on4xdZ26NKzn6754g==}\n    engines: {node: '>=18'}\n    cpu: [arm64]\n    os: [linux]\n\n  '@esbuild/linux-arm@0.17.19':\n    resolution: {integrity: sha512-cdmT3KxjlOQ/gZ2cjfrQOtmhG4HJs6hhvm3mWSRDPtZ/lP5oe8FWceS10JaSJC13GBd4eH/haHnqf7hhGNLerA==}\n    engines: {node: '>=12'}\n    cpu: [arm]\n    os: [linux]\n\n  '@esbuild/linux-arm@0.18.20':\n    resolution: {integrity: sha512-/5bHkMWnq1EgKr1V+Ybz3s1hWXok7mDFUMQ4cG10AfW3wL02PSZi5kFpYKrptDsgb2WAJIvRcDm+qIvXf/apvg==}\n    engines: {node: '>=12'}\n    cpu: [arm]\n    os: [linux]\n\n  '@esbuild/linux-arm@0.19.12':\n    resolution: {integrity: sha512-J5jPms//KhSNv+LO1S1TX1UWp1ucM6N6XuL6ITdKWElCu8wXP72l9MM0zDTzzeikVyqFE6U8YAV9/tFyj0ti+w==}\n    engines: {node: '>=12'}\n    cpu: [arm]\n    os: [linux]\n\n  '@esbuild/linux-arm@0.20.2':\n    resolution: {integrity: sha512-VhLPeR8HTMPccbuWWcEUD1Az68TqaTYyj6nfE4QByZIQEQVWBB8vup8PpR7y1QHL3CpcF6xd5WVBU/+SBEvGTg==}\n    engines: {node: '>=12'}\n    cpu: [arm]\n    os: [linux]\n\n  '@esbuild/linux-arm@0.21.5':\n    resolution: {integrity: sha512-bPb5AHZtbeNGjCKVZ9UGqGwo8EUu4cLq68E95A53KlxAPRmUyYv2D6F0uUI65XisGOL1hBP5mTronbgo+0bFcA==}\n    engines: {node: '>=12'}\n    cpu: [arm]\n    os: [linux]\n\n  '@esbuild/linux-arm@0.23.1':\n    resolution: {integrity: sha512-CXXkzgn+dXAPs3WBwE+Kvnrf4WECwBdfjfeYHpMeVxWE0EceB6vhWGShs6wi0IYEqMSIzdOF1XjQ/Mkm5d7ZdQ==}\n    engines: {node: '>=18'}\n    cpu: [arm]\n    os: [linux]\n\n  '@esbuild/linux-ia32@0.17.19':\n    resolution: {integrity: sha512-w4IRhSy1VbsNxHRQpeGCHEmibqdTUx61Vc38APcsRbuVgK0OPEnQ0YD39Brymn96mOx48Y2laBQGqgZ0j9w6SQ==}\n    engines: {node: '>=12'}\n    cpu: [ia32]\n    os: [linux]\n\n  '@esbuild/linux-ia32@0.18.20':\n    resolution: {integrity: sha512-P4etWwq6IsReT0E1KHU40bOnzMHoH73aXp96Fs8TIT6z9Hu8G6+0SHSw9i2isWrD2nbx2qo5yUqACgdfVGx7TA==}\n    engines: {node: '>=12'}\n    cpu: [ia32]\n    os: [linux]\n\n  '@esbuild/linux-ia32@0.19.12':\n    resolution: {integrity: sha512-Thsa42rrP1+UIGaWz47uydHSBOgTUnwBwNq59khgIwktK6x60Hivfbux9iNR0eHCHzOLjLMLfUMLCypBkZXMHA==}\n    engines: {node: '>=12'}\n    cpu: [ia32]\n    os: [linux]\n\n  '@esbuild/linux-ia32@0.20.2':\n    resolution: {integrity: sha512-o10utieEkNPFDZFQm9CoP7Tvb33UutoJqg3qKf1PWVeeJhJw0Q347PxMvBgVVFgouYLGIhFYG0UGdBumROyiig==}\n    engines: {node: '>=12'}\n    cpu: [ia32]\n    os: [linux]\n\n  '@esbuild/linux-ia32@0.21.5':\n    resolution: {integrity: sha512-YvjXDqLRqPDl2dvRODYmmhz4rPeVKYvppfGYKSNGdyZkA01046pLWyRKKI3ax8fbJoK5QbxblURkwK/MWY18Tg==}\n    engines: {node: '>=12'}\n    cpu: [ia32]\n    os: [linux]\n\n  '@esbuild/linux-ia32@0.23.1':\n    resolution: {integrity: sha512-VTN4EuOHwXEkXzX5nTvVY4s7E/Krz7COC8xkftbbKRYAl96vPiUssGkeMELQMOnLOJ8k3BY1+ZY52tttZnHcXQ==}\n    engines: {node: '>=18'}\n    cpu: [ia32]\n    os: [linux]\n\n  '@esbuild/linux-loong64@0.17.19':\n    resolution: {integrity: sha512-2iAngUbBPMq439a+z//gE+9WBldoMp1s5GWsUSgqHLzLJ9WoZLZhpwWuym0u0u/4XmZ3gpHmzV84PonE+9IIdQ==}\n    engines: {node: '>=12'}\n    cpu: [loong64]\n    os: [linux]\n\n  '@esbuild/linux-loong64@0.18.20':\n    resolution: {integrity: sha512-nXW8nqBTrOpDLPgPY9uV+/1DjxoQ7DoB2N8eocyq8I9XuqJ7BiAMDMf9n1xZM9TgW0J8zrquIb/A7s3BJv7rjg==}\n    engines: {node: '>=12'}\n    cpu: [loong64]\n    os: [linux]\n\n  '@esbuild/linux-loong64@0.19.12':\n    resolution: {integrity: sha512-LiXdXA0s3IqRRjm6rV6XaWATScKAXjI4R4LoDlvO7+yQqFdlr1Bax62sRwkVvRIrwXxvtYEHHI4dm50jAXkuAA==}\n    engines: {node: '>=12'}\n    cpu: [loong64]\n    os: [linux]\n\n  '@esbuild/linux-loong64@0.20.2':\n    resolution: {integrity: sha512-PR7sp6R/UC4CFVomVINKJ80pMFlfDfMQMYynX7t1tNTeivQ6XdX5r2XovMmha/VjR1YN/HgHWsVcTRIMkymrgQ==}\n    engines: {node: '>=12'}\n    cpu: [loong64]\n    os: [linux]\n\n  '@esbuild/linux-loong64@0.21.5':\n    resolution: {integrity: sha512-uHf1BmMG8qEvzdrzAqg2SIG/02+4/DHB6a9Kbya0XDvwDEKCoC8ZRWI5JJvNdUjtciBGFQ5PuBlpEOXQj+JQSg==}\n    engines: {node: '>=12'}\n    cpu: [loong64]\n    os: [linux]\n\n  '@esbuild/linux-loong64@0.23.1':\n    resolution: {integrity: sha512-Vx09LzEoBa5zDnieH8LSMRToj7ir/Jeq0Gu6qJ/1GcBq9GkfoEAoXvLiW1U9J1qE/Y/Oyaq33w5p2ZWrNNHNEw==}\n    engines: {node: '>=18'}\n    cpu: [loong64]\n    os: [linux]\n\n  '@esbuild/linux-mips64el@0.17.19':\n    resolution: {integrity: sha512-LKJltc4LVdMKHsrFe4MGNPp0hqDFA1Wpt3jE1gEyM3nKUvOiO//9PheZZHfYRfYl6AwdTH4aTcXSqBerX0ml4A==}\n    engines: {node: '>=12'}\n    cpu: [mips64el]\n    os: [linux]\n\n  '@esbuild/linux-mips64el@0.18.20':\n    resolution: {integrity: sha512-d5NeaXZcHp8PzYy5VnXV3VSd2D328Zb+9dEq5HE6bw6+N86JVPExrA6O68OPwobntbNJ0pzCpUFZTo3w0GyetQ==}\n    engines: {node: '>=12'}\n    cpu: [mips64el]\n    os: [linux]\n\n  '@esbuild/linux-mips64el@0.19.12':\n    resolution: {integrity: sha512-fEnAuj5VGTanfJ07ff0gOA6IPsvrVHLVb6Lyd1g2/ed67oU1eFzL0r9WL7ZzscD+/N6i3dWumGE1Un4f7Amf+w==}\n    engines: {node: '>=12'}\n    cpu: [mips64el]\n    os: [linux]\n\n  '@esbuild/linux-mips64el@0.20.2':\n    resolution: {integrity: sha512-4BlTqeutE/KnOiTG5Y6Sb/Hw6hsBOZapOVF6njAESHInhlQAghVVZL1ZpIctBOoTFbQyGW+LsVYZ8lSSB3wkjA==}\n    engines: {node: '>=12'}\n    cpu: [mips64el]\n    os: [linux]\n\n  '@esbuild/linux-mips64el@0.21.5':\n    resolution: {integrity: sha512-IajOmO+KJK23bj52dFSNCMsz1QP1DqM6cwLUv3W1QwyxkyIWecfafnI555fvSGqEKwjMXVLokcV5ygHW5b3Jbg==}\n    engines: {node: '>=12'}\n    cpu: [mips64el]\n    os: [linux]\n\n  '@esbuild/linux-mips64el@0.23.1':\n    resolution: {integrity: sha512-nrFzzMQ7W4WRLNUOU5dlWAqa6yVeI0P78WKGUo7lg2HShq/yx+UYkeNSE0SSfSure0SqgnsxPvmAUu/vu0E+3Q==}\n    engines: {node: '>=18'}\n    cpu: [mips64el]\n    os: [linux]\n\n  '@esbuild/linux-ppc64@0.17.19':\n    resolution: {integrity: sha512-/c/DGybs95WXNS8y3Ti/ytqETiW7EU44MEKuCAcpPto3YjQbyK3IQVKfF6nbghD7EcLUGl0NbiL5Rt5DMhn5tg==}\n    engines: {node: '>=12'}\n    cpu: [ppc64]\n    os: [linux]\n\n  '@esbuild/linux-ppc64@0.18.20':\n    resolution: {integrity: sha512-WHPyeScRNcmANnLQkq6AfyXRFr5D6N2sKgkFo2FqguP44Nw2eyDlbTdZwd9GYk98DZG9QItIiTlFLHJHjxP3FA==}\n    engines: {node: '>=12'}\n    cpu: [ppc64]\n    os: [linux]\n\n  '@esbuild/linux-ppc64@0.19.12':\n    resolution: {integrity: sha512-nYJA2/QPimDQOh1rKWedNOe3Gfc8PabU7HT3iXWtNUbRzXS9+vgB0Fjaqr//XNbd82mCxHzik2qotuI89cfixg==}\n    engines: {node: '>=12'}\n    cpu: [ppc64]\n    os: [linux]\n\n  '@esbuild/linux-ppc64@0.20.2':\n    resolution: {integrity: sha512-rD3KsaDprDcfajSKdn25ooz5J5/fWBylaaXkuotBDGnMnDP1Uv5DLAN/45qfnf3JDYyJv/ytGHQaziHUdyzaAg==}\n    engines: {node: '>=12'}\n    cpu: [ppc64]\n    os: [linux]\n\n  '@esbuild/linux-ppc64@0.21.5':\n    resolution: {integrity: sha512-1hHV/Z4OEfMwpLO8rp7CvlhBDnjsC3CttJXIhBi+5Aj5r+MBvy4egg7wCbe//hSsT+RvDAG7s81tAvpL2XAE4w==}\n    engines: {node: '>=12'}\n    cpu: [ppc64]\n    os: [linux]\n\n  '@esbuild/linux-ppc64@0.23.1':\n    resolution: {integrity: sha512-dKN8fgVqd0vUIjxuJI6P/9SSSe/mB9rvA98CSH2sJnlZ/OCZWO1DJvxj8jvKTfYUdGfcq2dDxoKaC6bHuTlgcw==}\n    engines: {node: '>=18'}\n    cpu: [ppc64]\n    os: [linux]\n\n  '@esbuild/linux-riscv64@0.17.19':\n    resolution: {integrity: sha512-FC3nUAWhvFoutlhAkgHf8f5HwFWUL6bYdvLc/TTuxKlvLi3+pPzdZiFKSWz/PF30TB1K19SuCxDTI5KcqASJqA==}\n    engines: {node: '>=12'}\n    cpu: [riscv64]\n    os: [linux]\n\n  '@esbuild/linux-riscv64@0.18.20':\n    resolution: {integrity: sha512-WSxo6h5ecI5XH34KC7w5veNnKkju3zBRLEQNY7mv5mtBmrP/MjNBCAlsM2u5hDBlS3NGcTQpoBvRzqBcRtpq1A==}\n    engines: {node: '>=12'}\n    cpu: [riscv64]\n    os: [linux]\n\n  '@esbuild/linux-riscv64@0.19.12':\n    resolution: {integrity: sha512-2MueBrlPQCw5dVJJpQdUYgeqIzDQgw3QtiAHUC4RBz9FXPrskyyU3VI1hw7C0BSKB9OduwSJ79FTCqtGMWqJHg==}\n    engines: {node: '>=12'}\n    cpu: [riscv64]\n    os: [linux]\n\n  '@esbuild/linux-riscv64@0.20.2':\n    resolution: {integrity: sha512-snwmBKacKmwTMmhLlz/3aH1Q9T8v45bKYGE3j26TsaOVtjIag4wLfWSiZykXzXuE1kbCE+zJRmwp+ZbIHinnVg==}\n    engines: {node: '>=12'}\n    cpu: [riscv64]\n    os: [linux]\n\n  '@esbuild/linux-riscv64@0.21.5':\n    resolution: {integrity: sha512-2HdXDMd9GMgTGrPWnJzP2ALSokE/0O5HhTUvWIbD3YdjME8JwvSCnNGBnTThKGEB91OZhzrJ4qIIxk/SBmyDDA==}\n    engines: {node: '>=12'}\n    cpu: [riscv64]\n    os: [linux]\n\n  '@esbuild/linux-riscv64@0.23.1':\n    resolution: {integrity: sha512-5AV4Pzp80fhHL83JM6LoA6pTQVWgB1HovMBsLQ9OZWLDqVY8MVobBXNSmAJi//Csh6tcY7e7Lny2Hg1tElMjIA==}\n    engines: {node: '>=18'}\n    cpu: [riscv64]\n    os: [linux]\n\n  '@esbuild/linux-s390x@0.17.19':\n    resolution: {integrity: sha512-IbFsFbxMWLuKEbH+7sTkKzL6NJmG2vRyy6K7JJo55w+8xDk7RElYn6xvXtDW8HCfoKBFK69f3pgBJSUSQPr+4Q==}\n    engines: {node: '>=12'}\n    cpu: [s390x]\n    os: [linux]\n\n  '@esbuild/linux-s390x@0.18.20':\n    resolution: {integrity: sha512-+8231GMs3mAEth6Ja1iK0a1sQ3ohfcpzpRLH8uuc5/KVDFneH6jtAJLFGafpzpMRO6DzJ6AvXKze9LfFMrIHVQ==}\n    engines: {node: '>=12'}\n    cpu: [s390x]\n    os: [linux]\n\n  '@esbuild/linux-s390x@0.19.12':\n    resolution: {integrity: sha512-+Pil1Nv3Umes4m3AZKqA2anfhJiVmNCYkPchwFJNEJN5QxmTs1uzyy4TvmDrCRNT2ApwSari7ZIgrPeUx4UZDg==}\n    engines: {node: '>=12'}\n    cpu: [s390x]\n    os: [linux]\n\n  '@esbuild/linux-s390x@0.20.2':\n    resolution: {integrity: sha512-wcWISOobRWNm3cezm5HOZcYz1sKoHLd8VL1dl309DiixxVFoFe/o8HnwuIwn6sXre88Nwj+VwZUvJf4AFxkyrQ==}\n    engines: {node: '>=12'}\n    cpu: [s390x]\n    os: [linux]\n\n  '@esbuild/linux-s390x@0.21.5':\n    resolution: {integrity: sha512-zus5sxzqBJD3eXxwvjN1yQkRepANgxE9lgOW2qLnmr8ikMTphkjgXu1HR01K4FJg8h1kEEDAqDcZQtbrRnB41A==}\n    engines: {node: '>=12'}\n    cpu: [s390x]\n    os: [linux]\n\n  '@esbuild/linux-s390x@0.23.1':\n    resolution: {integrity: sha512-9ygs73tuFCe6f6m/Tb+9LtYxWR4c9yg7zjt2cYkjDbDpV/xVn+68cQxMXCjUpYwEkze2RcU/rMnfIXNRFmSoDw==}\n    engines: {node: '>=18'}\n    cpu: [s390x]\n    os: [linux]\n\n  '@esbuild/linux-x64@0.17.19':\n    resolution: {integrity: sha512-68ngA9lg2H6zkZcyp22tsVt38mlhWde8l3eJLWkyLrp4HwMUr3c1s/M2t7+kHIhvMjglIBrFpncX1SzMckomGw==}\n    engines: {node: '>=12'}\n    cpu: [x64]\n    os: [linux]\n\n  '@esbuild/linux-x64@0.18.20':\n    resolution: {integrity: sha512-UYqiqemphJcNsFEskc73jQ7B9jgwjWrSayxawS6UVFZGWrAAtkzjxSqnoclCXxWtfwLdzU+vTpcNYhpn43uP1w==}\n    engines: {node: '>=12'}\n    cpu: [x64]\n    os: [linux]\n\n  '@esbuild/linux-x64@0.19.12':\n    resolution: {integrity: sha512-B71g1QpxfwBvNrfyJdVDexenDIt1CiDN1TIXLbhOw0KhJzE78KIFGX6OJ9MrtC0oOqMWf+0xop4qEU8JrJTwCg==}\n    engines: {node: '>=12'}\n    cpu: [x64]\n    os: [linux]\n\n  '@esbuild/linux-x64@0.20.2':\n    resolution: {integrity: sha512-1MdwI6OOTsfQfek8sLwgyjOXAu+wKhLEoaOLTjbijk6E2WONYpH9ZU2mNtR+lZ2B4uwr+usqGuVfFT9tMtGvGw==}\n    engines: {node: '>=12'}\n    cpu: [x64]\n    os: [linux]\n\n  '@esbuild/linux-x64@0.21.5':\n    resolution: {integrity: sha512-1rYdTpyv03iycF1+BhzrzQJCdOuAOtaqHTWJZCWvijKD2N5Xu0TtVC8/+1faWqcP9iBCWOmjmhoH94dH82BxPQ==}\n    engines: {node: '>=12'}\n    cpu: [x64]\n    os: [linux]\n\n  '@esbuild/linux-x64@0.23.1':\n    resolution: {integrity: sha512-EV6+ovTsEXCPAp58g2dD68LxoP/wK5pRvgy0J/HxPGB009omFPv3Yet0HiaqvrIrgPTBuC6wCH1LTOY91EO5hQ==}\n    engines: {node: '>=18'}\n    cpu: [x64]\n    os: [linux]\n\n  '@esbuild/netbsd-x64@0.17.19':\n    resolution: {integrity: sha512-CwFq42rXCR8TYIjIfpXCbRX0rp1jo6cPIUPSaWwzbVI4aOfX96OXY8M6KNmtPcg7QjYeDmN+DD0Wp3LaBOLf4Q==}\n    engines: {node: '>=12'}\n    cpu: [x64]\n    os: [netbsd]\n\n  '@esbuild/netbsd-x64@0.18.20':\n    resolution: {integrity: sha512-iO1c++VP6xUBUmltHZoMtCUdPlnPGdBom6IrO4gyKPFFVBKioIImVooR5I83nTew5UOYrk3gIJhbZh8X44y06A==}\n    engines: {node: '>=12'}\n    cpu: [x64]\n    os: [netbsd]\n\n  '@esbuild/netbsd-x64@0.19.12':\n    resolution: {integrity: sha512-3ltjQ7n1owJgFbuC61Oj++XhtzmymoCihNFgT84UAmJnxJfm4sYCiSLTXZtE00VWYpPMYc+ZQmB6xbSdVh0JWA==}\n    engines: {node: '>=12'}\n    cpu: [x64]\n    os: [netbsd]\n\n  '@esbuild/netbsd-x64@0.20.2':\n    resolution: {integrity: sha512-K8/DhBxcVQkzYc43yJXDSyjlFeHQJBiowJ0uVL6Tor3jGQfSGHNNJcWxNbOI8v5k82prYqzPuwkzHt3J1T1iZQ==}\n    engines: {node: '>=12'}\n    cpu: [x64]\n    os: [netbsd]\n\n  '@esbuild/netbsd-x64@0.21.5':\n    resolution: {integrity: sha512-Woi2MXzXjMULccIwMnLciyZH4nCIMpWQAs049KEeMvOcNADVxo0UBIQPfSmxB3CWKedngg7sWZdLvLczpe0tLg==}\n    engines: {node: '>=12'}\n    cpu: [x64]\n    os: [netbsd]\n\n  '@esbuild/netbsd-x64@0.23.1':\n    resolution: {integrity: sha512-aevEkCNu7KlPRpYLjwmdcuNz6bDFiE7Z8XC4CPqExjTvrHugh28QzUXVOZtiYghciKUacNktqxdpymplil1beA==}\n    engines: {node: '>=18'}\n    cpu: [x64]\n    os: [netbsd]\n\n  '@esbuild/openbsd-arm64@0.23.1':\n    resolution: {integrity: sha512-3x37szhLexNA4bXhLrCC/LImN/YtWis6WXr1VESlfVtVeoFJBRINPJ3f0a/6LV8zpikqoUg4hyXw0sFBt5Cr+Q==}\n    engines: {node: '>=18'}\n    cpu: [arm64]\n    os: [openbsd]\n\n  '@esbuild/openbsd-x64@0.17.19':\n    resolution: {integrity: sha512-cnq5brJYrSZ2CF6c35eCmviIN3k3RczmHz8eYaVlNasVqsNY+JKohZU5MKmaOI+KkllCdzOKKdPs762VCPC20g==}\n    engines: {node: '>=12'}\n    cpu: [x64]\n    os: [openbsd]\n\n  '@esbuild/openbsd-x64@0.18.20':\n    resolution: {integrity: sha512-e5e4YSsuQfX4cxcygw/UCPIEP6wbIL+se3sxPdCiMbFLBWu0eiZOJ7WoD+ptCLrmjZBK1Wk7I6D/I3NglUGOxg==}\n    engines: {node: '>=12'}\n    cpu: [x64]\n    os: [openbsd]\n\n  '@esbuild/openbsd-x64@0.19.12':\n    resolution: {integrity: sha512-RbrfTB9SWsr0kWmb9srfF+L933uMDdu9BIzdA7os2t0TXhCRjrQyCeOt6wVxr79CKD4c+p+YhCj31HBkYcXebw==}\n    engines: {node: '>=12'}\n    cpu: [x64]\n    os: [openbsd]\n\n  '@esbuild/openbsd-x64@0.20.2':\n    resolution: {integrity: sha512-eMpKlV0SThJmmJgiVyN9jTPJ2VBPquf6Kt/nAoo6DgHAoN57K15ZghiHaMvqjCye/uU4X5u3YSMgVBI1h3vKrQ==}\n    engines: {node: '>=12'}\n    cpu: [x64]\n    os: [openbsd]\n\n  '@esbuild/openbsd-x64@0.21.5':\n    resolution: {integrity: sha512-HLNNw99xsvx12lFBUwoT8EVCsSvRNDVxNpjZ7bPn947b8gJPzeHWyNVhFsaerc0n3TsbOINvRP2byTZ5LKezow==}\n    engines: {node: '>=12'}\n    cpu: [x64]\n    os: [openbsd]\n\n  '@esbuild/openbsd-x64@0.23.1':\n    resolution: {integrity: sha512-aY2gMmKmPhxfU+0EdnN+XNtGbjfQgwZj43k8G3fyrDM/UdZww6xrWxmDkuz2eCZchqVeABjV5BpildOrUbBTqA==}\n    engines: {node: '>=18'}\n    cpu: [x64]\n    os: [openbsd]\n\n  '@esbuild/sunos-x64@0.17.19':\n    resolution: {integrity: sha512-vCRT7yP3zX+bKWFeP/zdS6SqdWB8OIpaRq/mbXQxTGHnIxspRtigpkUcDMlSCOejlHowLqII7K2JKevwyRP2rg==}\n    engines: {node: '>=12'}\n    cpu: [x64]\n    os: [sunos]\n\n  '@esbuild/sunos-x64@0.18.20':\n    resolution: {integrity: sha512-kDbFRFp0YpTQVVrqUd5FTYmWo45zGaXe0X8E1G/LKFC0v8x0vWrhOWSLITcCn63lmZIxfOMXtCfti/RxN/0wnQ==}\n    engines: {node: '>=12'}\n    cpu: [x64]\n    os: [sunos]\n\n  '@esbuild/sunos-x64@0.19.12':\n    resolution: {integrity: sha512-HKjJwRrW8uWtCQnQOz9qcU3mUZhTUQvi56Q8DPTLLB+DawoiQdjsYq+j+D3s9I8VFtDr+F9CjgXKKC4ss89IeA==}\n    engines: {node: '>=12'}\n    cpu: [x64]\n    os: [sunos]\n\n  '@esbuild/sunos-x64@0.20.2':\n    resolution: {integrity: sha512-2UyFtRC6cXLyejf/YEld4Hajo7UHILetzE1vsRcGL3earZEW77JxrFjH4Ez2qaTiEfMgAXxfAZCm1fvM/G/o8w==}\n    engines: {node: '>=12'}\n    cpu: [x64]\n    os: [sunos]\n\n  '@esbuild/sunos-x64@0.21.5':\n    resolution: {integrity: sha512-6+gjmFpfy0BHU5Tpptkuh8+uw3mnrvgs+dSPQXQOv3ekbordwnzTVEb4qnIvQcYXq6gzkyTnoZ9dZG+D4garKg==}\n    engines: {node: '>=12'}\n    cpu: [x64]\n    os: [sunos]\n\n  '@esbuild/sunos-x64@0.23.1':\n    resolution: {integrity: sha512-RBRT2gqEl0IKQABT4XTj78tpk9v7ehp+mazn2HbUeZl1YMdaGAQqhapjGTCe7uw7y0frDi4gS0uHzhvpFuI1sA==}\n    engines: {node: '>=18'}\n    cpu: [x64]\n    os: [sunos]\n\n  '@esbuild/win32-arm64@0.17.19':\n    resolution: {integrity: sha512-yYx+8jwowUstVdorcMdNlzklLYhPxjniHWFKgRqH7IFlUEa0Umu3KuYplf1HUZZ422e3NU9F4LGb+4O0Kdcaag==}\n    engines: {node: '>=12'}\n    cpu: [arm64]\n    os: [win32]\n\n  '@esbuild/win32-arm64@0.18.20':\n    resolution: {integrity: sha512-ddYFR6ItYgoaq4v4JmQQaAI5s7npztfV4Ag6NrhiaW0RrnOXqBkgwZLofVTlq1daVTQNhtI5oieTvkRPfZrePg==}\n    engines: {node: '>=12'}\n    cpu: [arm64]\n    os: [win32]\n\n  '@esbuild/win32-arm64@0.19.12':\n    resolution: {integrity: sha512-URgtR1dJnmGvX864pn1B2YUYNzjmXkuJOIqG2HdU62MVS4EHpU2946OZoTMnRUHklGtJdJZ33QfzdjGACXhn1A==}\n    engines: {node: '>=12'}\n    cpu: [arm64]\n    os: [win32]\n\n  '@esbuild/win32-arm64@0.20.2':\n    resolution: {integrity: sha512-GRibxoawM9ZCnDxnP3usoUDO9vUkpAxIIZ6GQI+IlVmr5kP3zUq+l17xELTHMWTWzjxa2guPNyrpq1GWmPvcGQ==}\n    engines: {node: '>=12'}\n    cpu: [arm64]\n    os: [win32]\n\n  '@esbuild/win32-arm64@0.21.5':\n    resolution: {integrity: sha512-Z0gOTd75VvXqyq7nsl93zwahcTROgqvuAcYDUr+vOv8uHhNSKROyU961kgtCD1e95IqPKSQKH7tBTslnS3tA8A==}\n    engines: {node: '>=12'}\n    cpu: [arm64]\n    os: [win32]\n\n  '@esbuild/win32-arm64@0.23.1':\n    resolution: {integrity: sha512-4O+gPR5rEBe2FpKOVyiJ7wNDPA8nGzDuJ6gN4okSA1gEOYZ67N8JPk58tkWtdtPeLz7lBnY6I5L3jdsr3S+A6A==}\n    engines: {node: '>=18'}\n    cpu: [arm64]\n    os: [win32]\n\n  '@esbuild/win32-ia32@0.17.19':\n    resolution: {integrity: sha512-eggDKanJszUtCdlVs0RB+h35wNlb5v4TWEkq4vZcmVt5u/HiDZrTXe2bWFQUez3RgNHwx/x4sk5++4NSSicKkw==}\n    engines: {node: '>=12'}\n    cpu: [ia32]\n    os: [win32]\n\n  '@esbuild/win32-ia32@0.18.20':\n    resolution: {integrity: sha512-Wv7QBi3ID/rROT08SABTS7eV4hX26sVduqDOTe1MvGMjNd3EjOz4b7zeexIR62GTIEKrfJXKL9LFxTYgkyeu7g==}\n    engines: {node: '>=12'}\n    cpu: [ia32]\n    os: [win32]\n\n  '@esbuild/win32-ia32@0.19.12':\n    resolution: {integrity: sha512-+ZOE6pUkMOJfmxmBZElNOx72NKpIa/HFOMGzu8fqzQJ5kgf6aTGrcJaFsNiVMH4JKpMipyK+7k0n2UXN7a8YKQ==}\n    engines: {node: '>=12'}\n    cpu: [ia32]\n    os: [win32]\n\n  '@esbuild/win32-ia32@0.20.2':\n    resolution: {integrity: sha512-HfLOfn9YWmkSKRQqovpnITazdtquEW8/SoHW7pWpuEeguaZI4QnCRW6b+oZTztdBnZOS2hqJ6im/D5cPzBTTlQ==}\n    engines: {node: '>=12'}\n    cpu: [ia32]\n    os: [win32]\n\n  '@esbuild/win32-ia32@0.21.5':\n    resolution: {integrity: sha512-SWXFF1CL2RVNMaVs+BBClwtfZSvDgtL//G/smwAc5oVK/UPu2Gu9tIaRgFmYFFKrmg3SyAjSrElf0TiJ1v8fYA==}\n    engines: {node: '>=12'}\n    cpu: [ia32]\n    os: [win32]\n\n  '@esbuild/win32-ia32@0.23.1':\n    resolution: {integrity: sha512-BcaL0Vn6QwCwre3Y717nVHZbAa4UBEigzFm6VdsVdT/MbZ38xoj1X9HPkZhbmaBGUD1W8vxAfffbDe8bA6AKnQ==}\n    engines: {node: '>=18'}\n    cpu: [ia32]\n    os: [win32]\n\n  '@esbuild/win32-x64@0.17.19':\n    resolution: {integrity: sha512-lAhycmKnVOuRYNtRtatQR1LPQf2oYCkRGkSFnseDAKPl8lu5SOsK/e1sXe5a0Pc5kHIHe6P2I/ilntNv2xf3cA==}\n    engines: {node: '>=12'}\n    cpu: [x64]\n    os: [win32]\n\n  '@esbuild/win32-x64@0.18.20':\n    resolution: {integrity: sha512-kTdfRcSiDfQca/y9QIkng02avJ+NCaQvrMejlsB3RRv5sE9rRoeBPISaZpKxHELzRxZyLvNts1P27W3wV+8geQ==}\n    engines: {node: '>=12'}\n    cpu: [x64]\n    os: [win32]\n\n  '@esbuild/win32-x64@0.19.12':\n    resolution: {integrity: sha512-T1QyPSDCyMXaO3pzBkF96E8xMkiRYbUEZADd29SyPGabqxMViNoii+NcK7eWJAEoU6RZyEm5lVSIjTmcdoB9HA==}\n    engines: {node: '>=12'}\n    cpu: [x64]\n    os: [win32]\n\n  '@esbuild/win32-x64@0.20.2':\n    resolution: {integrity: sha512-N49X4lJX27+l9jbLKSqZ6bKNjzQvHaT8IIFUy+YIqmXQdjYCToGWwOItDrfby14c78aDd5NHQl29xingXfCdLQ==}\n    engines: {node: '>=12'}\n    cpu: [x64]\n    os: [win32]\n\n  '@esbuild/win32-x64@0.21.5':\n    resolution: {integrity: sha512-tQd/1efJuzPC6rCFwEvLtci/xNFcTZknmXs98FYDfGE4wP9ClFV98nyKrzJKVPMhdDnjzLhdUyMX4PsQAPjwIw==}\n    engines: {node: '>=12'}\n    cpu: [x64]\n    os: [win32]\n\n  '@esbuild/win32-x64@0.23.1':\n    resolution: {integrity: sha512-BHpFFeslkWrXWyUPnbKm+xYYVYruCinGcftSBaa8zoF9hZO4BcSCFUvHVTtzpIY6YzUnYtuEhZ+C9iEXjxnasg==}\n    engines: {node: '>=18'}\n    cpu: [x64]\n    os: [win32]\n\n  '@fastify/busboy@2.1.1':\n    resolution: {integrity: sha512-vBZP4NlzfOlerQTnba4aqZoMhE/a9HY7HRqoOPaETQcSQuWEIyZMHGfVu6w9wGtGK5fED5qRs2DteVCjOH60sA==}\n    engines: {node: '>=14'}\n\n  '@floating-ui/core@1.5.2':\n    resolution: {integrity: sha512-Ii3MrfY/GAIN3OhXNzpCKaLxHQfJF9qvwq/kEJYdqDxeIHa01K8sldugal6TmeeXl+WMvhv9cnVzUTaFFJF09A==}\n\n  '@floating-ui/dom@1.6.3':\n    resolution: {integrity: sha512-RnDthu3mzPlQ31Ss/BTwQ1zjzIhr3lk1gZB1OC56h/1vEtaXkESrOqL5fQVMfXpwGtRwX+YsZBdyHtJMQnkArw==}\n\n  '@floating-ui/utils@0.1.6':\n    resolution: {integrity: sha512-OfX7E2oUDYxtBvsuS4e/jSn4Q9Qb6DzgeYtsAdkPZ47znpoNsMgZw0+tVijiv3uGNR6dgNlty6r9rzIzHjtd/A==}\n\n  '@floating-ui/utils@0.2.1':\n    resolution: {integrity: sha512-9TANp6GPoMtYzQdt54kfAyMmz1+osLlXdg2ENroU7zzrtflTLrrC/lgrIfaSe+Wu0b89GKccT7vxXA0MoAIO+Q==}\n\n  '@floating-ui/vue@1.0.6':\n    resolution: {integrity: sha512-EdrOljjkpkkqZnrpqUcPoz9NvHxuTjUtSInh6GMv3+Mcy+giY2cE2pHh9rpacRcZ2eMSCxel9jWkWXTjLmY55w==}\n\n  '@fontsource-variable/pixelify-sans@5.1.0':\n    resolution: {integrity: sha512-NBt2JLCcJCbx+gv4VgZ4VvukHPSTF1i4Pd7zG/rc5GWCYKSJ5G+FqVAKhLeeLdrtwZZoANcX/r08X+s7Q1iOzQ==}\n\n  '@fontsource/cutive-mono@5.1.0':\n    resolution: {integrity: sha512-dynCFSa+NNkmZIi/QOtmZoin7zRkbiogpew5eFNahBmnxQ3uxkk7eYFCEu1VZQmOCVwnGfIMyzE+VENPu5fwFQ==}\n\n  '@fontsource/fira-code@4.5.13':\n    resolution: {integrity: sha512-T1IG6/2AXSwEKwlrEm3kyIL3RQTMblPyj68HgnBGl0IBGFxgS5LZ7StRdDo/QimJ4Tz6FQGHuy1Y/ShNxaUefA==}\n\n  '@fontsource/ibm-plex-mono@4.5.13':\n    resolution: {integrity: sha512-KAE7X2LgCV4X6p7vj1h2phRnhPX4YUa8FBAB0Jj9xW7Q+p+k2ce4HEAMJJ2RFHI075ClgQx+KZuDBNuiKgp5yw==}\n\n  '@fontsource/inter@4.5.10':\n    resolution: {integrity: sha512-YOt2/K8yo25MVBjrTImHxVimmyZEt0GcrWp2w7O29sdFX9SJqbGlOqjFJ1wI5yBbP6AmTeimyPE0UC/jjFRoIA==}\n\n  '@fontsource/jetbrains-mono@4.5.8':\n    resolution: {integrity: sha512-Wp2oUcXNFqw7pwEZdstZLv09v8lWhMscuSbmPU8VpdxPpC+kbQb6u0sOF/wZX/GZcwJHZyXBaZan0iia16r30Q==}\n\n  '@fontsource/overpass-mono@5.1.0':\n    resolution: {integrity: sha512-Fr4zpSMloNHzqxVudoi0xc3ZjpBlmB232h8cajuZapQ2l85YpdpXhIv8uJfYifQcwiRTqoibYgWOKNHbM0OHEQ==}\n\n  '@fontsource/share-tech-mono@5.1.0':\n    resolution: {integrity: sha512-u160pF0vGTvg02bhwgiMw7lVhGLWC3aJryP/WGhiKhCVSEFb68sdQZlntiJh8vPGUsdMxFTfzm1+SzW4mR8AxQ==}\n\n  '@fontsource/source-code-pro@4.5.14':\n    resolution: {integrity: sha512-EWE0djE7wFCBmExWa9oT1vIp+qj5MUroVvXWb9G7Ig4t4aXDd9QDidYZzMzNemb8gQxTdOzGmhx6EZnDTFMh5Q==}\n\n  '@fontsource/unifontex@5.1.0':\n    resolution: {integrity: sha512-DEI4VDQoamRAF5ra/60ny+HtlfMyLc5WUG3KSkZG455RAl9yZDbGOrT8uMOzhcaOHy0QGkbuVxHIdM22OVmY/g==}\n\n  '@fontsource/vt323@5.1.0':\n    resolution: {integrity: sha512-Uw/aNcz6WkvFGEeWLPB/cuLXJxP93PiJLltR9zdRTYLA6H+VF4EhtZ/lzTXVKzAqbcgiVndmEmtrcxs7goSxsg==}\n\n  '@iconify-json/carbon@1.2.3':\n    resolution: {integrity: sha512-smQ1nMHZn1BcTBqr13SP/7z3F1mbGCjUT1PdcpmbRoBrB4nAA9ErkTvUp49zxCQ/6VHcJsVzLV2zVXY3jJ4Bnw==}\n\n  '@iconify-json/logos@1.2.3':\n    resolution: {integrity: sha512-JLHS5hgZP1b55EONAWNeqBUuriRfRNKWXK4cqYx0PpVaJfIIMiiMxFfvoQiX/bkE9XgkLhcKmDUqL3LXPdXPwQ==}\n\n  '@iconify-json/ri@1.2.2':\n    resolution: {integrity: sha512-7i6uxb8guYyyWtcf23QgKXlipvwaqBSnm3tGgo0eBlc1C8C1rHVEJXManwB7PrxWXLAecBL/Sb+0zaLfSYeQzg==}\n\n  '@iconify-json/tabler@1.2.6':\n    resolution: {integrity: sha512-+LjRsbx4tqaLNorQldahZRCepYVAC8Fj6hpkHuZFWB0xj81YasACT0f9JGtavG4+LePdvkXRTuz5RQOU6YcnXA==}\n\n  '@iconify/json@2.2.274':\n    resolution: {integrity: sha512-wU4zS3eMLZgPFHieCRGile/sVz7QXD3jiCaaQ72quMH4Tf8FzO2WH10un1g96YaNLY8CTKDV4MNZDO2/LtkwFA==}\n\n  '@iconify/types@2.0.0':\n    resolution: {integrity: sha512-+wluvCrRhXrhyOmRDJ3q8mux9JkKy5SJ/v8ol2tu4FVjyYvtEzkc/3pK15ET6RKg4b4w4BmTk1+gsCUhf21Ykg==}\n\n  '@iconify/utils@2.1.33':\n    resolution: {integrity: sha512-jP9h6v/g0BIZx0p7XGJJVtkVnydtbgTgt9mVNcGDYwaa7UhdHdI9dvoq+gKj9sijMSJKxUPEG2JyjsgXjxL7Kw==}\n\n  '@iconify/vue@4.1.1':\n    resolution: {integrity: sha512-RL85Bm/DAe8y6rT6pux7D2FJSiUEM/TPfyK7GrbAOfTSwrhvwJW+S5yijdGcmtXouA8MtuH9C7l4hiSE4mLMjg==}\n    peerDependencies:\n      vue: '>=3'\n\n  '@internationalized/date@3.5.2':\n    resolution: {integrity: sha512-vo1yOMUt2hzp63IutEaTUxROdvQg1qlMRsbCvbay2AK2Gai7wIgCyK5weEX3nHkiLgo4qCXHijFNC/ILhlRpOQ==}\n\n  '@ioredis/commands@1.2.0':\n    resolution: {integrity: sha512-Sx1pU8EM64o2BrqNpEO1CNLtKQwyhuXuqyfH7oGKCk+1a33d2r5saW8zNwm3j6BTExtjrv2BxTgzzkMwts6vGg==}\n\n  '@isaacs/cliui@8.0.2':\n    resolution: {integrity: sha512-O8jcjabXaleOG9DQ0+ARXWZBTfnP4WNAqzuiJK7ll44AmxGKv/J2M4TPjxjY3znBCfvBXFzucm1twdyFybFqEA==}\n    engines: {node: '>=12'}\n\n  '@jridgewell/gen-mapping@0.3.3':\n    resolution: {integrity: sha512-HLhSWOLRi875zjjMG/r+Nv0oCW8umGb0BgEhyX3dDX3egwZtB8PqLnjz3yedt8R5StBrzcg4aBpnh8UA9D1BoQ==}\n    engines: {node: '>=6.0.0'}\n\n  '@jridgewell/gen-mapping@0.3.5':\n    resolution: {integrity: sha512-IzL8ZoEDIBRWEzlCcRhOaCupYyN5gdIK+Q6fbFdPDg6HqX6jpkItn7DFIpW9LQzXG6Df9sA7+OKnq0qlz/GaQg==}\n    engines: {node: '>=6.0.0'}\n\n  '@jridgewell/resolve-uri@3.1.1':\n    resolution: {integrity: sha512-dSYZh7HhCDtCKm4QakX0xFpsRDqjjtZf/kjI/v3T3Nwt5r8/qz/M19F9ySyOqU94SXBmeG9ttTul+YnR4LOxFA==}\n    engines: {node: '>=6.0.0'}\n\n  '@jridgewell/set-array@1.1.2':\n    resolution: {integrity: sha512-xnkseuNADM0gt2bs+BvhO0p78Mk762YnZdsuzFV018NoG1Sj1SCQvpSqa7XUaTam5vAGasABV9qXASMKnFMwMw==}\n    engines: {node: '>=6.0.0'}\n\n  '@jridgewell/set-array@1.2.1':\n    resolution: {integrity: sha512-R8gLRTZeyp03ymzP/6Lil/28tGeGEzhx1q2k703KGWRAI1VdvPIXdG70VJc2pAMw3NA6JKL5hhFu1sJX0Mnn/A==}\n    engines: {node: '>=6.0.0'}\n\n  '@jridgewell/source-map@0.3.5':\n    resolution: {integrity: sha512-UTYAUj/wviwdsMfzoSJspJxbkH5o1snzwX0//0ENX1u/55kkZZkcTZP6u9bwKGkv+dkk9at4m1Cpt0uY80kcpQ==}\n\n  '@jridgewell/sourcemap-codec@1.4.15':\n    resolution: {integrity: sha512-eF2rxCRulEKXHTRiDrDy6erMYWqNw4LPdQ8UQA4huuxaQsVeRPFl2oM8oDGxMFhJUWZf9McpLtJasDDZb/Bpeg==}\n\n  '@jridgewell/sourcemap-codec@1.5.0':\n    resolution: {integrity: sha512-gv3ZRaISU3fjPAgNsriBRqGWQL6quFx04YMPW/zD8XMLsU32mhCCbfbO6KZFLjvYpCZ8zyDEgqsgf+PwPaM7GQ==}\n\n  '@jridgewell/trace-mapping@0.3.20':\n    resolution: {integrity: sha512-R8LcPeWZol2zR8mmH3JeKQ6QRCFb7XgUhV9ZlGhHLGyg4wpPiPZNQOOWhFZhxKw8u//yTbNGI42Bx/3paXEQ+Q==}\n\n  '@jridgewell/trace-mapping@0.3.25':\n    resolution: {integrity: sha512-vNk6aEwybGtawWmy/PzwnGDOjCkLWSD2wqvjGGAgOAwCGWySYXfYoxt00IJkTF+8Lb57DwOb3Aa0o9CApepiYQ==}\n\n  '@jridgewell/trace-mapping@0.3.9':\n    resolution: {integrity: sha512-3Belt6tdc8bPgAtbcmdtNJlirVoTmEb5e2gC94PnkwEW9jI6CAHUeoG85tjWP5WquqfavoMtMwiG4P926ZKKuQ==}\n\n  '@koa/router@12.0.2':\n    resolution: {integrity: sha512-sYcHglGKTxGF+hQ6x67xDfkE9o+NhVlRHBqq6gLywaMc6CojK/5vFZByphdonKinYlMLkEkacm+HEse9HzwgTA==}\n    engines: {node: '>= 12'}\n\n  '@kwsites/file-exists@1.1.1':\n    resolution: {integrity: sha512-m9/5YGR18lIwxSFDwfE3oA7bWuq9kdau6ugN4H2rJeyhFQZcG9AgSHkQtSD15a8WvTgfz9aikZMrKPHvbpqFiw==}\n\n  '@kwsites/promise-deferred@1.1.1':\n    resolution: {integrity: sha512-GaHYm+c0O9MjZRu0ongGBRbinu8gVAMd2UZjji6jVmqKtZluZnptXGWhz1E8j8D2HJ3f/yMxKAUC0b+57wncIw==}\n\n  '@mapbox/node-pre-gyp@1.0.11':\n    resolution: {integrity: sha512-Yhlar6v9WQgUp/He7BdgzOz8lqMQ8sU+jkCq7Wx8Myc5YFJLbEe7lgui/V7G1qB1DJykHSGwreceSaD60Y0PUQ==}\n    hasBin: true\n\n  '@netlify/functions@2.8.2':\n    resolution: {integrity: sha512-DeoAQh8LuNPvBE4qsKlezjKj0PyXDryOFJfJKo3Z1qZLKzQ21sT314KQKPVjfvw6knqijj+IO+0kHXy/TJiqNA==}\n    engines: {node: '>=14.0.0'}\n\n  '@netlify/node-cookies@0.1.0':\n    resolution: {integrity: sha512-OAs1xG+FfLX0LoRASpqzVntVV/RpYkgpI0VrUnw2u0Q1qiZUzcPffxRK8HF3gc4GjuhG5ahOEMJ9bswBiZPq0g==}\n    engines: {node: ^14.16.0 || >=16.0.0}\n\n  '@netlify/serverless-functions-api@1.26.1':\n    resolution: {integrity: sha512-q3L9i3HoNfz0SGpTIS4zTcKBbRkxzCRpd169eyiTuk3IwcPC3/85mzLHranlKo2b+HYT0gu37YxGB45aD8A3Tw==}\n    engines: {node: '>=18.0.0'}\n\n  '@nodelib/fs.scandir@2.1.5':\n    resolution: {integrity: sha512-vq24Bq3ym5HEQm2NKCr3yXDwjc7vTsEThRDnkp2DK9p1uqLR+DHurm/NOTo0KG7HYHU7eppKZj3MyqYuMBf62g==}\n    engines: {node: '>= 8'}\n\n  '@nodelib/fs.stat@2.0.5':\n    resolution: {integrity: sha512-RkhPPp2zrqDAQA/2jNhnztcPAlv64XdhIp7a7454A5ovI7Bukxgt7MX7udwAu3zg1DcpPU0rz3VV1SeaqvY4+A==}\n    engines: {node: '>= 8'}\n\n  '@nodelib/fs.walk@1.2.8':\n    resolution: {integrity: sha512-oGB+UxlgWcgQkgwo8GcEGwemoTFt3FIO9ababBmaGwXIoBKZ+GTy0pP185beGg7Llih/NSHSV2XAs1lnznocSg==}\n    engines: {node: '>= 8'}\n\n  '@nuxt/devalue@2.0.2':\n    resolution: {integrity: sha512-GBzP8zOc7CGWyFQS6dv1lQz8VVpz5C2yRszbXufwG/9zhStTIH50EtD87NmWbTMwXDvZLNg8GIpb1UFdH93JCA==}\n\n  '@nuxt/devtools-kit@1.6.0':\n    resolution: {integrity: sha512-kJ8mVKwTSN3tdEVNy7mxKCiQk9wsG5t3oOrRMWk6IEbTSov+5sOULqQSM/+OWxWsEDmDfA7QlS5sM3Ti9uMRqQ==}\n    peerDependencies:\n      vite: '*'\n\n  '@nuxt/devtools-ui-kit@1.6.0':\n    resolution: {integrity: sha512-7+faAlwDpCw0hPAYjwsW5aH9tzcV/tCfYsZklH5UU/WajhP9cJfWJuYMw+vkz6H07zE+cU8QAECaw55dQGGZwg==}\n    peerDependencies:\n      '@nuxt/devtools': 1.6.0\n\n  '@nuxt/devtools-wizard@1.6.0':\n    resolution: {integrity: sha512-n+mzz5NwnKZim0tq1oBi+x1nNXb21fp7QeBl7bYKyDT1eJ0XCxFkVTr/kB/ddkkLYZ+o8TykpeNPa74cN+xAyQ==}\n    hasBin: true\n\n  '@nuxt/devtools@1.6.0':\n    resolution: {integrity: sha512-xNorMapzpM8HaW7NnAsEEO38OrmrYBzGvkkqfBU5nNh5XEymmIfCbQc7IA/GIOH9pXOV4gRutCjHCWXHYbOl3A==}\n    hasBin: true\n    peerDependencies:\n      vite: '*'\n\n  '@nuxt/kit@3.13.2':\n    resolution: {integrity: sha512-KvRw21zU//wdz25IeE1E5m/aFSzhJloBRAQtv+evcFeZvuroIxpIQuUqhbzuwznaUwpiWbmwlcsp5uOWmi4vwA==}\n    engines: {node: ^14.18.0 || >=16.10.0}\n\n  '@nuxt/kit@3.14.1592':\n    resolution: {integrity: sha512-r9r8bISBBisvfcNgNL3dSIQHSBe0v5YkX5zwNblIC2T0CIEgxEVoM5rq9O5wqgb5OEydsHTtT2hL57vdv6VT2w==}\n    engines: {node: ^14.18.0 || >=16.10.0}\n\n  '@nuxt/schema@3.13.2':\n    resolution: {integrity: sha512-CCZgpm+MkqtOMDEgF9SWgGPBXlQ01hV/6+2reDEpJuqFPGzV8HYKPBcIFvn7/z5ahtgutHLzjP71Na+hYcqSpw==}\n    engines: {node: ^14.18.0 || >=16.10.0}\n\n  '@nuxt/schema@3.14.1592':\n    resolution: {integrity: sha512-A1d/08ueX8stTXNkvGqnr1eEXZgvKn+vj6s7jXhZNWApUSqMgItU4VK28vrrdpKbjIPwq2SwhnGOHUYvN9HwCQ==}\n    engines: {node: ^14.18.0 || >=16.10.0}\n\n  '@nuxt/scripts@0.9.5':\n    resolution: {integrity: sha512-E71sk4HP7HjwAFPu2CnCdW8Aed0uBv8zkdADyIe0BRvLNBnfwXluEBRLwh/XFarlGSvD5557jWSQ/3+FGZvbSA==}\n\n  '@nuxt/telemetry@2.6.0':\n    resolution: {integrity: sha512-h4YJ1d32cU7tDKjjhjtIIEck4WF/w3DTQBT348E9Pz85YLttnLqktLM0Ez9Xc2LzCeUgBDQv1el7Ob/zT3KUqg==}\n    hasBin: true\n\n  '@nuxt/vite-builder@3.13.2':\n    resolution: {integrity: sha512-3dzc3YH3UeTmzGtCevW1jTq0Q8/cm+yXqo/VS/EFM3aIO/tuNPS88is8ZF2YeBButFnLFllq/QenziPbq0YD6Q==}\n    engines: {node: ^14.18.0 || >=16.10.0}\n    peerDependencies:\n      vue: ^3.3.4\n\n  '@nuxthub/core@0.8.7':\n    resolution: {integrity: sha512-XPP+H/pdr3ubWY/V+EkAdqnBeNAP97Q0TtOXFebksP9yZ1LfMCXX/vjxdh747SWxMQVzY8HyandllJ3+6BNrkg==}\n\n  '@nuxtjs/tailwindcss@6.12.2':\n    resolution: {integrity: sha512-qPJiFH67CkTj/2kBGBzqXihOD1rQXMsbVS4vdQvfBxOBLPfGhU1yw7AATdhPl2BBjO2krjJLuZj39t7dnDYOwg==}\n\n  '@parcel/watcher-android-arm64@2.4.1':\n    resolution: {integrity: sha512-LOi/WTbbh3aTn2RYddrO8pnapixAziFl6SMxHM69r3tvdSm94JtCenaKgk1GRg5FJ5wpMCpHeW+7yqPlvZv7kg==}\n    engines: {node: '>= 10.0.0'}\n    cpu: [arm64]\n    os: [android]\n\n  '@parcel/watcher-darwin-arm64@2.4.1':\n    resolution: {integrity: sha512-ln41eihm5YXIY043vBrrHfn94SIBlqOWmoROhsMVTSXGh0QahKGy77tfEywQ7v3NywyxBBkGIfrWRHm0hsKtzA==}\n    engines: {node: '>= 10.0.0'}\n    cpu: [arm64]\n    os: [darwin]\n\n  '@parcel/watcher-darwin-x64@2.4.1':\n    resolution: {integrity: sha512-yrw81BRLjjtHyDu7J61oPuSoeYWR3lDElcPGJyOvIXmor6DEo7/G2u1o7I38cwlcoBHQFULqF6nesIX3tsEXMg==}\n    engines: {node: '>= 10.0.0'}\n    cpu: [x64]\n    os: [darwin]\n\n  '@parcel/watcher-freebsd-x64@2.4.1':\n    resolution: {integrity: sha512-TJa3Pex/gX3CWIx/Co8k+ykNdDCLx+TuZj3f3h7eOjgpdKM+Mnix37RYsYU4LHhiYJz3DK5nFCCra81p6g050w==}\n    engines: {node: '>= 10.0.0'}\n    cpu: [x64]\n    os: [freebsd]\n\n  '@parcel/watcher-linux-arm-glibc@2.4.1':\n    resolution: {integrity: sha512-4rVYDlsMEYfa537BRXxJ5UF4ddNwnr2/1O4MHM5PjI9cvV2qymvhwZSFgXqbS8YoTk5i/JR0L0JDs69BUn45YA==}\n    engines: {node: '>= 10.0.0'}\n    cpu: [arm]\n    os: [linux]\n\n  '@parcel/watcher-linux-arm64-glibc@2.4.1':\n    resolution: {integrity: sha512-BJ7mH985OADVLpbrzCLgrJ3TOpiZggE9FMblfO65PlOCdG++xJpKUJ0Aol74ZUIYfb8WsRlUdgrZxKkz3zXWYA==}\n    engines: {node: '>= 10.0.0'}\n    cpu: [arm64]\n    os: [linux]\n\n  '@parcel/watcher-linux-arm64-musl@2.4.1':\n    resolution: {integrity: sha512-p4Xb7JGq3MLgAfYhslU2SjoV9G0kI0Xry0kuxeG/41UfpjHGOhv7UoUDAz/jb1u2elbhazy4rRBL8PegPJFBhA==}\n    engines: {node: '>= 10.0.0'}\n    cpu: [arm64]\n    os: [linux]\n\n  '@parcel/watcher-linux-x64-glibc@2.4.1':\n    resolution: {integrity: sha512-s9O3fByZ/2pyYDPoLM6zt92yu6P4E39a03zvO0qCHOTjxmt3GHRMLuRZEWhWLASTMSrrnVNWdVI/+pUElJBBBg==}\n    engines: {node: '>= 10.0.0'}\n    cpu: [x64]\n    os: [linux]\n\n  '@parcel/watcher-linux-x64-musl@2.4.1':\n    resolution: {integrity: sha512-L2nZTYR1myLNST0O632g0Dx9LyMNHrn6TOt76sYxWLdff3cB22/GZX2UPtJnaqQPdCRoszoY5rcOj4oMTtp5fQ==}\n    engines: {node: '>= 10.0.0'}\n    cpu: [x64]\n    os: [linux]\n\n  '@parcel/watcher-wasm@2.4.1':\n    resolution: {integrity: sha512-/ZR0RxqxU/xxDGzbzosMjh4W6NdYFMqq2nvo2b8SLi7rsl/4jkL8S5stIikorNkdR50oVDvqb/3JT05WM+CRRA==}\n    engines: {node: '>= 10.0.0'}\n    bundledDependencies:\n      - napi-wasm\n\n  '@parcel/watcher-win32-arm64@2.4.1':\n    resolution: {integrity: sha512-Uq2BPp5GWhrq/lcuItCHoqxjULU1QYEcyjSO5jqqOK8RNFDBQnenMMx4gAl3v8GiWa59E9+uDM7yZ6LxwUIfRg==}\n    engines: {node: '>= 10.0.0'}\n    cpu: [arm64]\n    os: [win32]\n\n  '@parcel/watcher-win32-ia32@2.4.1':\n    resolution: {integrity: sha512-maNRit5QQV2kgHFSYwftmPBxiuK5u4DXjbXx7q6eKjq5dsLXZ4FJiVvlcw35QXzk0KrUecJmuVFbj4uV9oYrcw==}\n    engines: {node: '>= 10.0.0'}\n    cpu: [ia32]\n    os: [win32]\n\n  '@parcel/watcher-win32-x64@2.4.1':\n    resolution: {integrity: sha512-+DvS92F9ezicfswqrvIRM2njcYJbd5mb9CUgtrHCHmvn7pPPa+nMDRu1o1bYYz/l5IB2NVGNJWiH7h1E58IF2A==}\n    engines: {node: '>= 10.0.0'}\n    cpu: [x64]\n    os: [win32]\n\n  '@parcel/watcher@2.4.1':\n    resolution: {integrity: sha512-HNjmfLQEVRZmHRET336f20H/8kOozUGwk7yajvsonjNxbj2wBTK1WsQuHkD5yYh9RxFGL2EyDHryOihOwUoKDA==}\n    engines: {node: '>= 10.0.0'}\n\n  '@pinia/nuxt@0.5.5':\n    resolution: {integrity: sha512-wjxS7YqIesh4OLK+qE3ZjhdOJ5pYZQ+VlEmZNtTwzQn1Kavei/khovx7mzXVXNA/mvSPXVhb9xBzhyS3XMURtw==}\n\n  '@pkgjs/parseargs@0.11.0':\n    resolution: {integrity: sha512-+1VkjdD0QBLPodGrJUeqarH8VAIvQODIbwh9XpP5Syisf7YoQgsJKPNFoqqLQlu+VQ/tVSshMR6loPMn8U+dPg==}\n    engines: {node: '>=14'}\n\n  '@polka/url@1.0.0-next.28':\n    resolution: {integrity: sha512-8LduaNlMZGwdZ6qWrKlfa+2M4gahzFkprZiAt2TF8uS0qQgBizKXpXURqvTJ4WtmupWxaLqjRb2UCTe72mu+Aw==}\n\n  '@rollup/plugin-alias@5.1.1':\n    resolution: {integrity: sha512-PR9zDb+rOzkRb2VD+EuKB7UC41vU5DIwZ5qqCpk0KJudcWAyi8rvYOhS7+L5aZCspw1stTViLgN5v6FF1p5cgQ==}\n    engines: {node: '>=14.0.0'}\n    peerDependencies:\n      rollup: ^1.20.0||^2.0.0||^3.0.0||^4.0.0\n    peerDependenciesMeta:\n      rollup:\n        optional: true\n\n  '@rollup/plugin-babel@5.3.1':\n    resolution: {integrity: sha512-WFfdLWU/xVWKeRQnKmIAQULUI7Il0gZnBIH/ZFO069wYIfPu+8zrfp/KMW0atmELoRDq8FbiP3VCss9MhCut7Q==}\n    engines: {node: '>= 10.0.0'}\n    peerDependencies:\n      '@babel/core': ^7.0.0\n      '@types/babel__core': ^7.1.9\n      rollup: ^1.20.0||^2.0.0\n    peerDependenciesMeta:\n      '@types/babel__core':\n        optional: true\n\n  '@rollup/plugin-commonjs@25.0.8':\n    resolution: {integrity: sha512-ZEZWTK5n6Qde0to4vS9Mr5x/0UZoqCxPVR9KRUjU4kA2sO7GEUn1fop0DAwpO6z0Nw/kJON9bDmSxdWxO/TT1A==}\n    engines: {node: '>=14.0.0'}\n    peerDependencies:\n      rollup: ^2.68.0||^3.0.0||^4.0.0\n    peerDependenciesMeta:\n      rollup:\n        optional: true\n\n  '@rollup/plugin-inject@5.0.5':\n    resolution: {integrity: sha512-2+DEJbNBoPROPkgTDNe8/1YXWcqxbN5DTjASVIOx8HS+pITXushyNiBV56RB08zuptzz8gT3YfkqriTBVycepg==}\n    engines: {node: '>=14.0.0'}\n    peerDependencies:\n      rollup: ^1.20.0||^2.0.0||^3.0.0||^4.0.0\n    peerDependenciesMeta:\n      rollup:\n        optional: true\n\n  '@rollup/plugin-json@6.1.0':\n    resolution: {integrity: sha512-EGI2te5ENk1coGeADSIwZ7G2Q8CJS2sF120T7jLw4xFw9n7wIOXHo+kIYRAoVpJAN+kmqZSoO3Fp4JtoNF4ReA==}\n    engines: {node: '>=14.0.0'}\n    peerDependencies:\n      rollup: ^1.20.0||^2.0.0||^3.0.0||^4.0.0\n    peerDependenciesMeta:\n      rollup:\n        optional: true\n\n  '@rollup/plugin-node-resolve@11.2.1':\n    resolution: {integrity: sha512-yc2n43jcqVyGE2sqV5/YCmocy9ArjVAP/BeXyTtADTBBX6V0e5UMqwO8CdQ0kzjb6zu5P1qMzsScCMRvE9OlVg==}\n    engines: {node: '>= 10.0.0'}\n    peerDependencies:\n      rollup: ^1.20.0||^2.0.0\n\n  '@rollup/plugin-node-resolve@15.3.0':\n    resolution: {integrity: sha512-9eO5McEICxMzJpDW9OnMYSv4Sta3hmt7VtBFz5zR9273suNOydOyq/FrGeGy+KsTRFm8w0SLVhzig2ILFT63Ag==}\n    engines: {node: '>=14.0.0'}\n    peerDependencies:\n      rollup: ^2.78.0||^3.0.0||^4.0.0\n    peerDependenciesMeta:\n      rollup:\n        optional: true\n\n  '@rollup/plugin-replace@2.4.2':\n    resolution: {integrity: sha512-IGcu+cydlUMZ5En85jxHH4qj2hta/11BHq95iHEyb2sbgiN0eCdzvUcHw5gt9pBL5lTi4JDYJ1acCoMGpTvEZg==}\n    peerDependencies:\n      rollup: ^1.20.0 || ^2.0.0\n\n  '@rollup/plugin-replace@5.0.7':\n    resolution: {integrity: sha512-PqxSfuorkHz/SPpyngLyg5GCEkOcee9M1bkxiVDr41Pd61mqP1PLOoDPbpl44SB2mQGKwV/In74gqQmGITOhEQ==}\n    engines: {node: '>=14.0.0'}\n    peerDependencies:\n      rollup: ^1.20.0||^2.0.0||^3.0.0||^4.0.0\n    peerDependenciesMeta:\n      rollup:\n        optional: true\n\n  '@rollup/plugin-terser@0.4.4':\n    resolution: {integrity: sha512-XHeJC5Bgvs8LfukDwWZp7yeqin6ns8RTl2B9avbejt6tZqsqvVoWI7ZTQrcNsfKEDWBTnTxM8nMDkO2IFFbd0A==}\n    engines: {node: '>=14.0.0'}\n    peerDependencies:\n      rollup: ^2.0.0||^3.0.0||^4.0.0\n    peerDependenciesMeta:\n      rollup:\n        optional: true\n\n  '@rollup/pluginutils@3.1.0':\n    resolution: {integrity: sha512-GksZ6pr6TpIjHm8h9lSQ8pi8BE9VeubNT0OMJ3B5uZJ8pz73NPiqOtCog/x2/QzM1ENChPKxMDhiQuRHsqc+lg==}\n    engines: {node: '>= 8.0.0'}\n    peerDependencies:\n      rollup: ^1.20.0||^2.0.0\n\n  '@rollup/pluginutils@4.2.1':\n    resolution: {integrity: sha512-iKnFXr7NkdZAIHiIWE+BX5ULi/ucVFYWD6TbAV+rZctiRTY2PL6tsIKhoIOaoskiWAkgu+VsbXgUVDNLHf+InQ==}\n    engines: {node: '>= 8.0.0'}\n\n  '@rollup/pluginutils@5.1.0':\n    resolution: {integrity: sha512-XTIWOPPcpvyKI6L1NHo0lFlCyznUEyPmPY1mc3KpPVDYulHSTvyeLNVW00QTLIAFNhR3kYnJTQHeGqU4M3n09g==}\n    engines: {node: '>=14.0.0'}\n    peerDependencies:\n      rollup: ^1.20.0||^2.0.0||^3.0.0||^4.0.0\n    peerDependenciesMeta:\n      rollup:\n        optional: true\n\n  '@rollup/pluginutils@5.1.2':\n    resolution: {integrity: sha512-/FIdS3PyZ39bjZlwqFnWqCOVnW7o963LtKMwQOD0NhQqw22gSr2YY1afu3FxRip4ZCZNsD5jq6Aaz6QV3D/Njw==}\n    engines: {node: '>=14.0.0'}\n    peerDependencies:\n      rollup: ^1.20.0||^2.0.0||^3.0.0||^4.0.0\n    peerDependenciesMeta:\n      rollup:\n        optional: true\n\n  '@rollup/pluginutils@5.1.3':\n    resolution: {integrity: sha512-Pnsb6f32CD2W3uCaLZIzDmeFyQ2b8UWMFI7xtwUezpcGBDVDW6y9XgAWIlARiGAo6eNF5FK5aQTr0LFyNyqq5A==}\n    engines: {node: '>=14.0.0'}\n    peerDependencies:\n      rollup: ^1.20.0||^2.0.0||^3.0.0||^4.0.0\n    peerDependenciesMeta:\n      rollup:\n        optional: true\n\n  '@rollup/rollup-android-arm-eabi@4.24.0':\n    resolution: {integrity: sha512-Q6HJd7Y6xdB48x8ZNVDOqsbh2uByBhgK8PiQgPhwkIw/HC/YX5Ghq2mQY5sRMZWHb3VsFkWooUVOZHKr7DmDIA==}\n    cpu: [arm]\n    os: [android]\n\n  '@rollup/rollup-android-arm64@4.24.0':\n    resolution: {integrity: sha512-ijLnS1qFId8xhKjT81uBHuuJp2lU4x2yxa4ctFPtG+MqEE6+C5f/+X/bStmxapgmwLwiL3ih122xv8kVARNAZA==}\n    cpu: [arm64]\n    os: [android]\n\n  '@rollup/rollup-darwin-arm64@4.24.0':\n    resolution: {integrity: sha512-bIv+X9xeSs1XCk6DVvkO+S/z8/2AMt/2lMqdQbMrmVpgFvXlmde9mLcbQpztXm1tajC3raFDqegsH18HQPMYtA==}\n    cpu: [arm64]\n    os: [darwin]\n\n  '@rollup/rollup-darwin-x64@4.24.0':\n    resolution: {integrity: sha512-X6/nOwoFN7RT2svEQWUsW/5C/fYMBe4fnLK9DQk4SX4mgVBiTA9h64kjUYPvGQ0F/9xwJ5U5UfTbl6BEjaQdBQ==}\n    cpu: [x64]\n    os: [darwin]\n\n  '@rollup/rollup-linux-arm-gnueabihf@4.24.0':\n    resolution: {integrity: sha512-0KXvIJQMOImLCVCz9uvvdPgfyWo93aHHp8ui3FrtOP57svqrF/roSSR5pjqL2hcMp0ljeGlU4q9o/rQaAQ3AYA==}\n    cpu: [arm]\n    os: [linux]\n\n  '@rollup/rollup-linux-arm-musleabihf@4.24.0':\n    resolution: {integrity: sha512-it2BW6kKFVh8xk/BnHfakEeoLPv8STIISekpoF+nBgWM4d55CZKc7T4Dx1pEbTnYm/xEKMgy1MNtYuoA8RFIWw==}\n    cpu: [arm]\n    os: [linux]\n\n  '@rollup/rollup-linux-arm64-gnu@4.24.0':\n    resolution: {integrity: sha512-i0xTLXjqap2eRfulFVlSnM5dEbTVque/3Pi4g2y7cxrs7+a9De42z4XxKLYJ7+OhE3IgxvfQM7vQc43bwTgPwA==}\n    cpu: [arm64]\n    os: [linux]\n\n  '@rollup/rollup-linux-arm64-musl@4.24.0':\n    resolution: {integrity: sha512-9E6MKUJhDuDh604Qco5yP/3qn3y7SLXYuiC0Rpr89aMScS2UAmK1wHP2b7KAa1nSjWJc/f/Lc0Wl1L47qjiyQw==}\n    cpu: [arm64]\n    os: [linux]\n\n  '@rollup/rollup-linux-powerpc64le-gnu@4.24.0':\n    resolution: {integrity: sha512-2XFFPJ2XMEiF5Zi2EBf4h73oR1V/lycirxZxHZNc93SqDN/IWhYYSYj8I9381ikUFXZrz2v7r2tOVk2NBwxrWw==}\n    cpu: [ppc64]\n    os: [linux]\n\n  '@rollup/rollup-linux-riscv64-gnu@4.24.0':\n    resolution: {integrity: sha512-M3Dg4hlwuntUCdzU7KjYqbbd+BLq3JMAOhCKdBE3TcMGMZbKkDdJ5ivNdehOssMCIokNHFOsv7DO4rlEOfyKpg==}\n    cpu: [riscv64]\n    os: [linux]\n\n  '@rollup/rollup-linux-s390x-gnu@4.24.0':\n    resolution: {integrity: sha512-mjBaoo4ocxJppTorZVKWFpy1bfFj9FeCMJqzlMQGjpNPY9JwQi7OuS1axzNIk0nMX6jSgy6ZURDZ2w0QW6D56g==}\n    cpu: [s390x]\n    os: [linux]\n\n  '@rollup/rollup-linux-x64-gnu@4.24.0':\n    resolution: {integrity: sha512-ZXFk7M72R0YYFN5q13niV0B7G8/5dcQ9JDp8keJSfr3GoZeXEoMHP/HlvqROA3OMbMdfr19IjCeNAnPUG93b6A==}\n    cpu: [x64]\n    os: [linux]\n\n  '@rollup/rollup-linux-x64-musl@4.24.0':\n    resolution: {integrity: sha512-w1i+L7kAXZNdYl+vFvzSZy8Y1arS7vMgIy8wusXJzRrPyof5LAb02KGr1PD2EkRcl73kHulIID0M501lN+vobQ==}\n    cpu: [x64]\n    os: [linux]\n\n  '@rollup/rollup-win32-arm64-msvc@4.24.0':\n    resolution: {integrity: sha512-VXBrnPWgBpVDCVY6XF3LEW0pOU51KbaHhccHw6AS6vBWIC60eqsH19DAeeObl+g8nKAz04QFdl/Cefta0xQtUQ==}\n    cpu: [arm64]\n    os: [win32]\n\n  '@rollup/rollup-win32-ia32-msvc@4.24.0':\n    resolution: {integrity: sha512-xrNcGDU0OxVcPTH/8n/ShH4UevZxKIO6HJFK0e15XItZP2UcaiLFd5kiX7hJnqCbSztUF8Qot+JWBC/QXRPYWQ==}\n    cpu: [ia32]\n    os: [win32]\n\n  '@rollup/rollup-win32-x64-msvc@4.24.0':\n    resolution: {integrity: sha512-fbMkAF7fufku0N2dE5TBXcNlg0pt0cJue4xBRE2Qc5Vqikxr4VCgKj/ht6SMdFcOacVA9rqF70APJ8RN/4vMJw==}\n    cpu: [x64]\n    os: [win32]\n\n  '@shikijs/core@1.22.0':\n    resolution: {integrity: sha512-S8sMe4q71TJAW+qG93s5VaiihujRK6rqDFqBnxqvga/3LvqHEnxqBIOPkt//IdXVtHkQWKu4nOQNk0uBGicU7Q==}\n\n  '@shikijs/core@1.24.0':\n    resolution: {integrity: sha512-6pvdH0KoahMzr6689yh0QJ3rCgF4j1XsXRHNEeEN6M4xJTfQ6QPWrmHzIddotg+xPJUPEPzYzYCKzpYyhTI6Gw==}\n\n  '@shikijs/engine-javascript@1.22.0':\n    resolution: {integrity: sha512-AeEtF4Gcck2dwBqCFUKYfsCq0s+eEbCEbkUuFou53NZ0sTGnJnJ/05KHQFZxpii5HMXbocV9URYVowOP2wH5kw==}\n\n  '@shikijs/engine-javascript@1.24.0':\n    resolution: {integrity: sha512-ZA6sCeSsF3Mnlxxr+4wGEJ9Tto4RHmfIS7ox8KIAbH0MTVUkw3roHPHZN+LlJMOHJJOVupe6tvuAzRpN8qK1vA==}\n\n  '@shikijs/engine-oniguruma@1.22.0':\n    resolution: {integrity: sha512-5iBVjhu/DYs1HB0BKsRRFipRrD7rqjxlWTj4F2Pf+nQSPqc3kcyqFFeZXnBMzDf0HdqaFVvhDRAGiYNvyLP+Mw==}\n\n  '@shikijs/engine-oniguruma@1.24.0':\n    resolution: {integrity: sha512-Eua0qNOL73Y82lGA4GF5P+G2+VXX9XnuUxkiUuwcxQPH4wom+tE39kZpBFXfUuwNYxHSkrSxpB1p4kyRW0moSg==}\n\n  '@shikijs/markdown-it@1.24.0':\n    resolution: {integrity: sha512-YjYg8jJoTO0cUXUNlFHTZWWFt4wSDOcRd2nM2aB1rnX5RqRlcqwfS2x1vQjlPqmUisv+/GHClvz7uKHeK7ZDBw==}\n\n  '@shikijs/transformers@1.24.0':\n    resolution: {integrity: sha512-Qf/hby+PRPkoHncjYnJf5svK1aCsOUtQhuLzKPnmeXJtuUZCmbH0pTpdNtXe9tgln/RHlyRJnv7q46HHS1sO0Q==}\n\n  '@shikijs/types@1.22.0':\n    resolution: {integrity: sha512-Fw/Nr7FGFhlQqHfxzZY8Cwtwk5E9nKDUgeLjZgt3UuhcM3yJR9xj3ZGNravZZok8XmEZMiYkSMTPlPkULB8nww==}\n\n  '@shikijs/types@1.24.0':\n    resolution: {integrity: sha512-aptbEuq1Pk88DMlCe+FzXNnBZ17LCiLIGWAeCWhoFDzia5Q5Krx3DgnULLiouSdd6+LUM39XwXGppqYE0Ghtug==}\n\n  '@shikijs/vscode-textmate@9.3.0':\n    resolution: {integrity: sha512-jn7/7ky30idSkd/O5yDBfAnVt+JJpepofP/POZ1iMOxK59cOfqIgg/Dj0eFsjOTMw+4ycJN0uhZH/Eb0bs/EUA==}\n\n  '@sindresorhus/merge-streams@2.3.0':\n    resolution: {integrity: sha512-LtoMMhxAlorcGhmFYI+LhPgbPZCkgP6ra1YL604EeF6U98pLlQ3iWIGMdWSC+vWmPBWBNgmDBAhnAobLROJmwg==}\n    engines: {node: '>=18'}\n\n  '@stripe/stripe-js@4.9.0':\n    resolution: {integrity: sha512-tMPZQZZXGWyNX7hbgenq+1xEj2oigJ54XddbtSX36VedoKsPBq7dxwRXu4Xd5FdpT3JDyyDtnmvYkaSnH1yHTQ==}\n    engines: {node: '>=12.16'}\n\n  '@surma/rollup-plugin-off-main-thread@2.2.3':\n    resolution: {integrity: sha512-lR8q/9W7hZpMWweNiAKU7NQerBnzQQLvi8qnTDU/fxItPhtZVMbPV3lbCwjhIlNBe9Bbr5V+KHshvWmVSG9cxQ==}\n\n  '@swc/helpers@0.5.10':\n    resolution: {integrity: sha512-CU+RF9FySljn7HVSkkjiB84hWkvTaI3rtLvF433+jRSBL2hMu3zX5bGhHS8C80SM++h4xy8hBSnUHFQHmRXSBw==}\n\n  '@tailwindcss/typography@0.5.15':\n    resolution: {integrity: sha512-AqhlCXl+8grUz8uqExv5OTtgpjuVIwFTSXTrh8y9/pw6q2ek7fJ+Y8ZEVw7EB2DCcuCOtEjf9w3+J3rzts01uA==}\n    peerDependencies:\n      tailwindcss: '>=3.0.0 || insiders || >=4.0.0-alpha.20'\n\n  '@tanstack/virtual-core@3.3.0':\n    resolution: {integrity: sha512-A0004OAa1FcUkPHeeGoKgBrAgjH+uHdDPrw1L7RpkwnODYqRvoilqsHPs8cyTjMg1byZBbiNpQAq2TlFLIaQag==}\n\n  '@tanstack/vue-virtual@3.3.0':\n    resolution: {integrity: sha512-cB/zNPT35E826j5K5+wxO8yOpIyslHRpIVmBHQnlUNpT4yjJMoa+32EXZSCFpDmcIZevt5X2CjrPh9BoxLv/6w==}\n    peerDependencies:\n      vue: ^2.7.0 || ^3.0.0\n\n  '@trysound/sax@0.2.0':\n    resolution: {integrity: sha512-L7z9BgrNEcYyUYtF+HaEfiS5ebkh9jXqbszz7pC0hRBPaatV0XjSD3+eHrpqFemQfgwiFF0QPIarnIihIDn7OA==}\n    engines: {node: '>=10.13.0'}\n\n  '@types/dom-webcodecs@0.1.11':\n    resolution: {integrity: sha512-yPEZ3z7EohrmOxbk/QTAa0yonMFkNkjnVXqbGb7D4rMr+F1dGQ8ZUFxXkyLLJuiICPejZ0AZE9Rrk9wUCczx4A==}\n\n  '@types/estree@0.0.39':\n    resolution: {integrity: sha512-EYNwp3bU+98cpU4lAWYYL7Zz+2gryWH1qbdDTidVd6hkiR6weksdbMadyXKXNPEkQFhXM+hVO9ZygomHXp+AIw==}\n\n  '@types/estree@1.0.5':\n    resolution: {integrity: sha512-/kYRxGDLWzHOB7q+wtSUQlFrtcdUccpfy+X+9iMBpHK8QLLhx2wIPYuS5DYtR9Wa/YlZAbIovy7qVdB1Aq6Lyw==}\n\n  '@types/estree@1.0.6':\n    resolution: {integrity: sha512-AYnb1nQyY49te+VRAVgmzfcgjYS91mY5P0TKUDCLEM+gNnA+3T6rWITXRLYCpahpqSQbN5cE+gHpnPyXjHWxcw==}\n\n  '@types/google.maps@3.58.1':\n    resolution: {integrity: sha512-X9QTSvGJ0nCfMzYOnaVs/k6/4L+7F5uCS+4iUmkLEls6J9S/Phv+m/i3mDeyc49ZBgwab3EFO1HEoBY7k98EGQ==}\n\n  '@types/hast@3.0.4':\n    resolution: {integrity: sha512-WPs+bbQw5aCj+x6laNGWLH3wviHtoCv/P3+otBhbOhJgG8qtpdAMlTCxLtsTWA7LH1Oh/bFCHsBn0TPS5m30EQ==}\n\n  '@types/http-proxy@1.17.15':\n    resolution: {integrity: sha512-25g5atgiVNTIv0LBDTg1H74Hvayx0ajtJPLLcYE3whFv75J0pWNtOBzaXJQgDTmrX1bx5U9YC2w/n65BN1HwRQ==}\n\n  '@types/json-schema@7.0.15':\n    resolution: {integrity: sha512-5+fP8P8MFNC+AyZCDxrB2pkZFPGzqQWUzpSeuuVLvm8VMcorNYavBqoFcxK8bQz4Qsbn4oUEEem4wDLfcysGHA==}\n\n  '@types/linkify-it@5.0.0':\n    resolution: {integrity: sha512-sVDA58zAw4eWAffKOaQH5/5j3XeayukzDk+ewSsnv3p4yJEZHCCzMDiZM8e0OUrRvmpGZ85jf4yDHkHsgBNr9Q==}\n\n  '@types/markdown-it@14.1.2':\n    resolution: {integrity: sha512-promo4eFwuiW+TfGxhi+0x3czqTYJkG8qB17ZUJiVF10Xm7NLVRSLUsfRTU/6h1e24VvRnXCx+hG7li58lkzog==}\n\n  '@types/mdast@4.0.4':\n    resolution: {integrity: sha512-kGaNbPh1k7AFzgpud/gMdvIm5xuECykRR+JnWKQno9TAXVa6WIVCGTPvYGekIDL4uwCZQSYbUxNBSb1aUo79oA==}\n\n  '@types/mdurl@2.0.0':\n    resolution: {integrity: sha512-RGdgjQUZba5p6QEFAVx2OGb8rQDL/cPRG7GiedRzMcJ1tYnUANBncjbSB1NRGwbvjcPeikRABz2nshyPk1bhWg==}\n\n  '@types/node-forge@1.3.11':\n    resolution: {integrity: sha512-FQx220y22OKNTqaByeBGqHWYz4cl94tpcxeFdvBo3wjG6XPBuZ0BNgNZRV5J5TFmmcsJ4IzsLkmGRiQbnYsBEQ==}\n\n  '@types/node@20.10.5':\n    resolution: {integrity: sha512-nNPsNE65wjMxEKI93yOP+NPGGBJz/PoN3kZsVLee0XMiJolxSekEVD8wRwBUBqkwc7UWop0edW50yrCQW4CyRw==}\n\n  '@types/pg@8.11.10':\n    resolution: {integrity: sha512-LczQUW4dbOQzsH2RQ5qoeJ6qJPdrcM/DcMLoqWQkMLMsq83J5lAX3LXjdkWdpscFy67JSOWDnh7Ny/sPFykmkg==}\n\n  '@types/pica@9.0.4':\n    resolution: {integrity: sha512-Wr8bZ53IVjFWMLRsWEiGCfCDWoKORczxC04+XlvQrhn0tF3qDMQoLFHPPzZBcCi2uu5D6+alfrvidpTthFwKbw==}\n\n  '@types/resolve@1.17.1':\n    resolution: {integrity: sha512-yy7HuzQhj0dhGpD8RLXSZWEkLsV9ibvxvi6EiJ3bkqLAO1RGo0WbkWQiwpRlSFymTJRz0d3k5LM3kkx8ArDbLw==}\n\n  '@types/resolve@1.20.2':\n    resolution: {integrity: sha512-60BCwRFOZCQhDncwQdxxeOEEkbc5dIMccYLwbxsS4TUNeVECQ/pBJ0j09mrHOl/JJvpRPGwO9SvE4nR2Nb/a4Q==}\n\n  '@types/trusted-types@2.0.7':\n    resolution: {integrity: sha512-ScaPdn1dQczgbl0QFTeTOmVHFULt394XJgOQNoyVhZ6r2vLnMLJfBPd53SB52T/3G36VI1/g2MZaX0cwDuXsfw==}\n\n  '@types/unist@3.0.3':\n    resolution: {integrity: sha512-ko/gIFJRv177XgZsZcBwnqJN5x/Gien8qNOn0D5bQU/zAzVf9Zt3BlcUiLqhV9y4ARk0GbT3tnUiPNgnTXzc/Q==}\n\n  '@types/uuid@10.0.0':\n    resolution: {integrity: sha512-7gqG38EyHgyP1S+7+xomFtL+ZNHcKv6DwNaCZmJmo1vgMugyF3TCnXVg4t1uk89mLNwnLtnY3TpOpCOyp1/xHQ==}\n\n  '@types/vimeo__player@2.18.3':\n    resolution: {integrity: sha512-IzSzb6doT4I4uAnBHa+mBCiNtK7iAllEJjtpkX0sKY6/s1Vi+aX1134IAiPgiyFlMvFab/oZQpSeccK4r0/T2A==}\n\n  '@types/web-bluetooth@0.0.20':\n    resolution: {integrity: sha512-g9gZnnXVq7gM7v3tJCWV/qw7w+KeOlSHAhgF9RytFyifW6AF61hdT2ucrYhPq9hLs5JIryeupHV3qGk95dH9ow==}\n\n  '@types/wicg-file-system-access@2020.9.8':\n    resolution: {integrity: sha512-ggMz8nOygG7d/stpH40WVaNvBwuyYLnrg5Mbyf6bmsj/8+gb6Ei4ZZ9/4PNpcPNTT8th9Q8sM8wYmWGjMWLX/A==}\n\n  '@types/youtube@0.1.0':\n    resolution: {integrity: sha512-Pg33m3X2mFgdmhtvzOlAfUfgOa3341N3/2JCrVY/mXVxb4hagcqqEG6w4vGCfB64StQNWHSj/T8Eotb1Rko/FQ==}\n\n  '@ungap/structured-clone@1.2.0':\n    resolution: {integrity: sha512-zuVdFrMJiuCDQUMCzQaD6KL28MjnqqN8XnAqiEq9PNm/hCPTSGfrXCOfwj1ow4LFb/tNymJPwsNbVePc1xFqrQ==}\n\n  '@unhead/dom@1.11.13':\n    resolution: {integrity: sha512-8Bpo3e50i49/z0TMiskQk3OqUVJpWOO0cnEEydJeFnjsPczDH76H3mWLvB11cv1B/rjLdBiPgui7yetFta5LCw==}\n\n  '@unhead/dom@1.11.7':\n    resolution: {integrity: sha512-Nj2ulnbY5lvIcxqXwdO5YfdvLm8EYLjcaOje2b2aQnfyPAyOIVeR8iB79DDKk/uZZAPEwkdhSnUdEh9Ny0b3lw==}\n\n  '@unhead/dom@1.11.9':\n    resolution: {integrity: sha512-AOoCt05sLbkmp7ipCAs2JQdV0auLc5lCkLbCZj19kuPmWcFOoHNByQAG/AFKuSvi297OYp8abKGCStIgyz2x4A==}\n\n  '@unhead/schema@1.11.13':\n    resolution: {integrity: sha512-fIpQx6GCpl99l4qJXsPqkXxO7suMccuLADbhaMSkeXnVEi4ZIle+l+Ri0z+GHAEpJj17FMaQdO5n9FMSOMUxkw==}\n\n  '@unhead/schema@1.11.7':\n    resolution: {integrity: sha512-j9uN7T63aUXrZ6yx2CfjVT7xZHjn0PZO7TPMaWqMFjneIH/NONKvDVCMEqDlXeqdSIERIYtk/xTHgCUMer5eyw==}\n\n  '@unhead/schema@1.11.9':\n    resolution: {integrity: sha512-0V37bxG4sQuiLw3M5DMD+b99ndOOngecMlekQ122TDvBb24W8rWwkHhXvAu5eFg6bQXPdQF1A0U0PuRMcCj/ZA==}\n\n  '@unhead/shared@1.11.13':\n    resolution: {integrity: sha512-EiJ3nsEtf6dvZ6OwVYrrrrCUl4ZE/9GTjpexEMti8EJXweSuL7SifNNXtIFk7UMoM0ULYxb7K/AKQV/odwoZyQ==}\n\n  '@unhead/shared@1.11.7':\n    resolution: {integrity: sha512-5v3PmV1LMyikGyQi/URYS5ilH8dg1Iomtja7iFWke990O8RBDEzAdagJqcsUE/fw+o7cXRSOamyx5wCf5Q1TrA==}\n\n  '@unhead/shared@1.11.9':\n    resolution: {integrity: sha512-Df6Td9d87NM5EWf4ylAN98zwf50DwfMg3xoy6ofz3Qg1jSXewEIMD1w1C0/Q6KdpLo01TuoQ0RfpSyVtxt7oEA==}\n\n  '@unhead/ssr@1.11.7':\n    resolution: {integrity: sha512-qI1zNFY8fU5S9EhroxlXSA5Q/XKbWAKXrVVNG+6bIh/IRrMOMJrPk4d1GmphF4gmNri3ARqly+OWx4VVaj0scA==}\n\n  '@unhead/vue@1.11.13':\n    resolution: {integrity: sha512-s5++LqsNM01rkMQwtc4W19cP1fXC81o4YMyL+Kaqh9X0OPLeWnjONAh0U/Z2CIXBqhJHI+DoNXmDACXyuWPPxg==}\n    peerDependencies:\n      vue: '>=2.7 || >=3'\n\n  '@unhead/vue@1.11.9':\n    resolution: {integrity: sha512-vdl3H1bwJNindhRplMun7zhtNFggP8QqpPwc1e7kd2a0ORp776+QpFXKdYHFSlX+eAMmDVv8LQ+VL0N++pXxNg==}\n    peerDependencies:\n      vue: '>=2.7 || >=3'\n\n  '@unocss/astro@0.62.4':\n    resolution: {integrity: sha512-98KfkbrNhBLx2+uYxMiGsldIeIZ6/PbL4yaGRHeHoiHd7p4HmIyCF+auYe4Psntx3Yr8kU+XSIAhGDYebvTidQ==}\n    peerDependencies:\n      vite: ^2.9.0 || ^3.0.0-0 || ^4.0.0 || ^5.0.0-0\n    peerDependenciesMeta:\n      vite:\n        optional: true\n\n  '@unocss/cli@0.62.4':\n    resolution: {integrity: sha512-p4VyS40mzn4LCOkIsbIRzN0Zi50rRepesREi2S1+R4Kpvd4QFeeuxTuZNHEyi2uCboQ9ZWl1gfStCXIrNECwTg==}\n    engines: {node: '>=14'}\n    hasBin: true\n\n  '@unocss/config@0.62.4':\n    resolution: {integrity: sha512-XKudKxxW8P44JvlIdS6HBpfE3qZA9rhbemy6/sb8HyZjKYjgeM9jx5yjk+9+4hXNma/KlwDXwjAqY29z0S0SrA==}\n    engines: {node: '>=14'}\n\n  '@unocss/core@0.62.4':\n    resolution: {integrity: sha512-Cc+Vo6XlaQpyVejkJrrzzWtiK9pgMWzVVBpm9VCVtwZPUjD4GSc+g7VQCPXSsr7m03tmSuRySJx72QcASmauNQ==}\n\n  '@unocss/extractor-arbitrary-variants@0.62.4':\n    resolution: {integrity: sha512-e4hJfBMyFr6T6dYSTTjNv9CQwaU1CVEKxDlYP0GpfSgxsV58pguID9j1mt0/XZD6LvEDzwxj9RTRWKpUSWqp+Q==}\n\n  '@unocss/inspector@0.62.4':\n    resolution: {integrity: sha512-bRcnI99gZecNzrUr6kDMdwGHkhUuTPyvvadRdaOxHc9Ow3ANNyqymeFM1q5anZEUZt8h15TYN0mdyQyIWkU3zg==}\n\n  '@unocss/nuxt@0.62.4':\n    resolution: {integrity: sha512-ZNfXu/f2kIRc8rnstToR/s2ubcvWDaCPmV5jXL+SQytSPb1ONCkK7ITNgB2TtrTEqQyhNX33VlnHNF8KsM8PNA==}\n\n  '@unocss/postcss@0.62.4':\n    resolution: {integrity: sha512-kWdHy7UsSP4bDu8I7sCKeO0VuzvVpNHmn2rifK5gNstUx5dZ1H/SoyXTHx5sKtgfZBRzdNXFu2nZ3PzYGvEFbw==}\n    engines: {node: '>=14'}\n    peerDependencies:\n      postcss: ^8.4.21\n\n  '@unocss/preset-attributify@0.62.4':\n    resolution: {integrity: sha512-ei5nNT58GON9iyCGRRiIrphzyQbBIZ9iEqSBhIY0flcfi1uAPUXV32aO2slqJnWWAIwbRSb1GMpwYR8mmfuz8g==}\n\n  '@unocss/preset-icons@0.62.4':\n    resolution: {integrity: sha512-n9m2nRTxyiw0sqOwSioO3rro0kaPW0JJzWlzcfdwQ+ZORNR5WyJL298fLXYUFbZG3EOF+zSPg6CMDWudKk/tlA==}\n\n  '@unocss/preset-mini@0.62.4':\n    resolution: {integrity: sha512-1O+QpQFx7FT61aheAZEYemW5e4AGib8TFGm+rWLudKq2IBNnXHcS5xsq5QvqdC7rp9Dn3lnW5du6ijow5kCBuw==}\n\n  '@unocss/preset-tagify@0.62.4':\n    resolution: {integrity: sha512-8b2Kcsvt93xu1JqDqcD3QvvW0L5rqvH7ev3BlNEVx6n8ayBqfB5HEd4ILKr7wSC90re+EnCgnMm7EP2FiQAJkw==}\n\n  '@unocss/preset-typography@0.62.4':\n    resolution: {integrity: sha512-ZVh+NbcibMmD6ve8Deub/G+XAFcGPuzE2Fx/tMAfWfYlfyOAtrMxuL+AARMthpRxdE0JOtggXNTrJb0ZhGYl9g==}\n\n  '@unocss/preset-uno@0.62.4':\n    resolution: {integrity: sha512-2S6+molIz8dH/al0nfkU7i/pMS0oERPr4k9iW80Byt4cKDIhh/0jhZrC83kgZRtCf5hclSBO4oCoMTi1JF7SBw==}\n\n  '@unocss/preset-web-fonts@0.62.4':\n    resolution: {integrity: sha512-kaxgYBVyMdBlErseN8kWLiaS2N5OMlwg5ktAxUlei275fMoY7inQjOwppnjDVveJbN9SP6TcqqFpBIPfUayPkQ==}\n\n  '@unocss/preset-wind@0.62.4':\n    resolution: {integrity: sha512-YOzfQ11AmAnl1ZkcWLMMxCdezLjRKavLNk38LumUMtcdsa0DAy+1JjTp+KEvVQAnD+Et/ld5X+YcBWJkVy5WFQ==}\n\n  '@unocss/reset@0.62.4':\n    resolution: {integrity: sha512-CtxjeDgN39fY/eZDLIXN4wy7C8W7+SD+41AlzGVU5JwhcXmnb1XoDpOd2lzMxc/Yy3F5dIJt2+MRDj9RnpX9Ew==}\n\n  '@unocss/rule-utils@0.62.4':\n    resolution: {integrity: sha512-XUwLbLUzL+VSHCJNK5QBHC9RbFehumge1/XJmsRfmh0+oxgJoO1gvEvxi57gYEmdJdMRJHRJZ66se6+cB0Ymvw==}\n    engines: {node: '>=14'}\n\n  '@unocss/transformer-attributify-jsx@0.62.4':\n    resolution: {integrity: sha512-z9DDqS2DibDR9gno55diKfAVegeJ9uoyQXQhH3R0KY4YMF49N1fWy/t74gOiHtlPmvjQtDRZYgjgaMCc2w8oWg==}\n\n  '@unocss/transformer-compile-class@0.62.4':\n    resolution: {integrity: sha512-8yadY9T7LToJwSsrmYU3rUKlnDgPGVRvON7z9g1IjUCmFCGx7Gpg84x9KpKUG6eUTshPQFUI0YUHocrYFevAEA==}\n\n  '@unocss/transformer-directives@0.62.4':\n    resolution: {integrity: sha512-bq9ZDG6/mr6X2mAogAo0PBVrLSLT0900MPqnj/ixadYHc7mRpX+y6bc/1AgWytZIFYSdNzf7XDoquZuwf42Ucg==}\n\n  '@unocss/transformer-variant-group@0.62.4':\n    resolution: {integrity: sha512-W1fxMc2Lzxu4E+6JBQEBzK+AwoCQYI+EL2FT2BCUsAno37f3JdnwFFEVscck0epSdmdtidsSLDognyX8h10r8A==}\n\n  '@unocss/vite@0.62.4':\n    resolution: {integrity: sha512-JKq3V6bcevYl9X5Jl3p9crArbhzI8JVWQkOxKV2nGLFaqvnc47vMSDxlU4MUdRWp3aQvzDw132tcx27oSbrojw==}\n    peerDependencies:\n      vite: ^2.9.0 || ^3.0.0-0 || ^4.0.0 || ^5.0.0-0\n\n  '@unocss/webpack@0.62.4':\n    resolution: {integrity: sha512-hccXqpssqi1DyPJOwyIB3IhYe5SWND2JwTPxVTg8wO9fI1JvEK5DxK8FflJpXVps7QjotCmB/AXp0ezD0SutUg==}\n    peerDependencies:\n      webpack: ^4 || ^5\n\n  '@uploadthing/mime-types@0.3.2':\n    resolution: {integrity: sha512-WP/K75S/649lM0GUcd9jq4RjeTIc/0bO2UmLx4+usTSNy/x0K8gV0JdLWeUUbmTQtJoHd4ZTSvAdG7ZQgcmXvA==}\n\n  '@vercel/nft@0.26.5':\n    resolution: {integrity: sha512-NHxohEqad6Ra/r4lGknO52uc/GrWILXAMs1BB4401GTqww0fw1bAqzpG1XHuDO+dprg4GvsD9ZLLSsdo78p9hQ==}\n    engines: {node: '>=16'}\n    hasBin: true\n\n  '@vite-pwa/nuxt@0.10.5':\n    resolution: {integrity: sha512-I+qTkgQB2lvpoKQGgARgszsV/rBDys2xstczmTIgYoaNPALz2+zkhN/O8Fl8QI2ZHBL+ZnfpSOCOm/77ugrFHg==}\n    peerDependencies:\n      '@vite-pwa/assets-generator': ^0.2.6\n    peerDependenciesMeta:\n      '@vite-pwa/assets-generator':\n        optional: true\n\n  '@vitejs/plugin-vue-jsx@4.0.1':\n    resolution: {integrity: sha512-7mg9HFGnFHMEwCdB6AY83cVK4A6sCqnrjFYF4WIlebYAQVVJ/sC/CiTruVdrRlhrFoeZ8rlMxY9wYpPTIRhhAg==}\n    engines: {node: ^18.0.0 || >=20.0.0}\n    peerDependencies:\n      vite: ^5.0.0\n      vue: ^3.0.0\n\n  '@vitejs/plugin-vue@5.1.4':\n    resolution: {integrity: sha512-N2XSI2n3sQqp5w7Y/AN/L2XDjBIRGqXko+eDp42sydYSBeJuSm5a1sLf8zakmo8u7tA8NmBgoDLA1HeOESjp9A==}\n    engines: {node: ^18.0.0 || >=20.0.0}\n    peerDependencies:\n      vite: ^5.0.0\n      vue: ^3.2.25\n\n  '@volar/language-core@2.4.6':\n    resolution: {integrity: sha512-FxUfxaB8sCqvY46YjyAAV6c3mMIq/NWQMVvJ+uS4yxr1KzOvyg61gAuOnNvgCvO4TZ7HcLExBEsWcDu4+K4E8A==}\n\n  '@volar/source-map@2.4.6':\n    resolution: {integrity: sha512-Nsh7UW2ruK+uURIPzjJgF0YRGP5CX9nQHypA2OMqdM2FKy7rh+uv3XgPnWPw30JADbKvZ5HuBzG4gSbVDYVtiw==}\n\n  '@volar/typescript@2.4.6':\n    resolution: {integrity: sha512-NMIrA7y5OOqddL9VtngPWYmdQU03htNKFtAYidbYfWA0TOhyGVd9tfcP4TsLWQ+RBWDZCbBqsr8xzU0ZOxYTCQ==}\n\n  '@vue-macros/common@1.15.0':\n    resolution: {integrity: sha512-yg5VqW7+HRfJGimdKvFYzx8zorHUYo0hzPwuraoC1DWa7HHazbTMoVsHDvk3JHa1SGfSL87fRnzmlvgjEHhszA==}\n    engines: {node: '>=16.14.0'}\n    peerDependencies:\n      vue: ^2.7.0 || ^3.2.25\n    peerDependenciesMeta:\n      vue:\n        optional: true\n\n  '@vue/babel-helper-vue-transform-on@1.2.5':\n    resolution: {integrity: sha512-lOz4t39ZdmU4DJAa2hwPYmKc8EsuGa2U0L9KaZaOJUt0UwQNjNA3AZTq6uEivhOKhhG1Wvy96SvYBoFmCg3uuw==}\n\n  '@vue/babel-plugin-jsx@1.2.5':\n    resolution: {integrity: sha512-zTrNmOd4939H9KsRIGmmzn3q2zvv1mjxkYZHgqHZgDrXz5B1Q3WyGEjO2f+JrmKghvl1JIRcvo63LgM1kH5zFg==}\n    peerDependencies:\n      '@babel/core': ^7.0.0-0\n    peerDependenciesMeta:\n      '@babel/core':\n        optional: true\n\n  '@vue/babel-plugin-resolve-type@1.2.5':\n    resolution: {integrity: sha512-U/ibkQrf5sx0XXRnUZD1mo5F7PkpKyTbfXM3a3rC4YnUz6crHEz9Jg09jzzL6QYlXNto/9CePdOg/c87O4Nlfg==}\n    peerDependencies:\n      '@babel/core': ^7.0.0-0\n\n  '@vue/compiler-core@3.5.12':\n    resolution: {integrity: sha512-ISyBTRMmMYagUxhcpyEH0hpXRd/KqDU4ymofPgl2XAkY9ZhQ+h0ovEZJIiPop13UmR/54oA2cgMDjgroRelaEw==}\n\n  '@vue/compiler-dom@3.5.12':\n    resolution: {integrity: sha512-9G6PbJ03uwxLHKQ3P42cMTi85lDRvGLB2rSGOiQqtXELat6uI4n8cNz9yjfVHRPIu+MsK6TE418Giruvgptckg==}\n\n  '@vue/compiler-sfc@3.5.12':\n    resolution: {integrity: sha512-2k973OGo2JuAa5+ZlekuQJtitI5CgLMOwgl94BzMCsKZCX/xiqzJYzapl4opFogKHqwJk34vfsaKpfEhd1k5nw==}\n\n  '@vue/compiler-ssr@3.5.12':\n    resolution: {integrity: sha512-eLwc7v6bfGBSM7wZOGPmRavSWzNFF6+PdRhE+VFJhNCgHiF8AM7ccoqcv5kBXA2eWUfigD7byekvf/JsOfKvPA==}\n\n  '@vue/compiler-vue2@2.7.16':\n    resolution: {integrity: sha512-qYC3Psj9S/mfu9uVi5WvNZIzq+xnXMhOwbTFKKDD7b1lhpnn71jXSFdTQ+WsIEk0ONCd7VV2IMm7ONl6tbQ86A==}\n\n  '@vue/devtools-api@6.6.4':\n    resolution: {integrity: sha512-sGhTPMuXqZ1rVOk32RylztWkfXTRhuS7vgAKv0zjqk8gbsHkJ7xfFf+jbySxt7tWObEJwyKaHMikV/WGDiQm8g==}\n\n  '@vue/devtools-core@7.4.4':\n    resolution: {integrity: sha512-DLxgA3DfeADkRzhAfm3G2Rw/cWxub64SdP5b+s5dwL30+whOGj+QNhmyFpwZ8ZTrHDFRIPj0RqNzJ8IRR1pz7w==}\n    peerDependencies:\n      vue: ^3.0.0\n\n  '@vue/devtools-kit@7.4.4':\n    resolution: {integrity: sha512-awK/4NfsUG0nQ7qnTM37m7ZkEUMREyPh8taFCX+uQYps/MTFEum0AD05VeGDRMXwWvMmGIcWX9xp8ZiBddY0jw==}\n\n  '@vue/devtools-shared@7.5.3':\n    resolution: {integrity: sha512-i2tCUtAEQ0S8AmTuy6FSOmVKCB5ajmMaVrrw0ypX75koLSo1mssQ8zezds5IoUZHRiXBsgoGHbJGuGwyrSGhqQ==}\n\n  '@vue/language-core@2.1.6':\n    resolution: {integrity: sha512-MW569cSky9R/ooKMh6xa2g1D0AtRKbL56k83dzus/bx//RDJk24RHWkMzbAlXjMdDNyxAaagKPRquBIxkxlCkg==}\n    peerDependencies:\n      typescript: '*'\n    peerDependenciesMeta:\n      typescript:\n        optional: true\n\n  '@vue/reactivity@3.5.12':\n    resolution: {integrity: sha512-UzaN3Da7xnJXdz4Okb/BGbAaomRHc3RdoWqTzlvd9+WBR5m3J39J1fGcHes7U3za0ruYn/iYy/a1euhMEHvTAg==}\n\n  '@vue/runtime-core@3.5.12':\n    resolution: {integrity: sha512-hrMUYV6tpocr3TL3Ad8DqxOdpDe4zuQY4HPY3X/VRh+L2myQO8MFXPAMarIOSGNu0bFAjh1yBkMPXZBqCk62Uw==}\n\n  '@vue/runtime-dom@3.5.12':\n    resolution: {integrity: sha512-q8VFxR9A2MRfBr6/55Q3umyoN7ya836FzRXajPB6/Vvuv0zOPL+qltd9rIMzG/DbRLAIlREmnLsplEF/kotXKA==}\n\n  '@vue/server-renderer@3.5.12':\n    resolution: {integrity: sha512-I3QoeDDeEPZm8yR28JtY+rk880Oqmj43hreIBVTicisFTx/Dl7JpG72g/X7YF8hnQD3IFhkky5i2bPonwrTVPg==}\n    peerDependencies:\n      vue: 3.5.12\n\n  '@vue/shared@3.5.12':\n    resolution: {integrity: sha512-L2RPSAwUFbgZH20etwrXyVyCBu9OxRSi8T/38QsvnkJyvq2LufW2lDCOzm7t/U9C1mkhJGWYfCuFBCmIuNivrg==}\n\n  '@vueuse/components@11.1.0':\n    resolution: {integrity: sha512-8CTbvH1rHfAlqsMdMg6G2OiIvHiHn8HRx0yyJ+Ri/C8J6cLylXAd7VESawoCAkRdAXT4ucPnj/uYHZqEb0JbBQ==}\n\n  '@vueuse/core@10.7.0':\n    resolution: {integrity: sha512-4EUDESCHtwu44ZWK3Gc/hZUVhVo/ysvdtwocB5vcauSV4B7NiGY5972WnsojB3vRNdxvAt7kzJWE2h9h7C9d5w==}\n\n  '@vueuse/core@11.1.0':\n    resolution: {integrity: sha512-P6dk79QYA6sKQnghrUz/1tHi0n9mrb/iO1WTMk/ElLmTyNqgDeSZ3wcDf6fRBGzRJbeG1dxzEOvLENMjr+E3fg==}\n\n  '@vueuse/head@2.0.0':\n    resolution: {integrity: sha512-ykdOxTGs95xjD4WXE4na/umxZea2Itl0GWBILas+O4oqS7eXIods38INvk3XkJKjqMdWPcpCyLX/DioLQxU1KA==}\n    peerDependencies:\n      vue: '>=2.7 || >=3'\n\n  '@vueuse/integrations@11.1.0':\n    resolution: {integrity: sha512-O2ZgrAGPy0qAjpoI2YR3egNgyEqwG85fxfwmA9BshRIGjV4G6yu6CfOPpMHAOoCD+UfsIl7Vb1bXJ6ifrHYDDA==}\n    peerDependencies:\n      async-validator: ^4\n      axios: ^1\n      change-case: ^5\n      drauu: ^0.4\n      focus-trap: ^7\n      fuse.js: ^7\n      idb-keyval: ^6\n      jwt-decode: ^4\n      nprogress: ^0.2\n      qrcode: ^1.5\n      sortablejs: ^1\n      universal-cookie: ^7\n    peerDependenciesMeta:\n      async-validator:\n        optional: true\n      axios:\n        optional: true\n      change-case:\n        optional: true\n      drauu:\n        optional: true\n      focus-trap:\n        optional: true\n      fuse.js:\n        optional: true\n      idb-keyval:\n        optional: true\n      jwt-decode:\n        optional: true\n      nprogress:\n        optional: true\n      qrcode:\n        optional: true\n      sortablejs:\n        optional: true\n      universal-cookie:\n        optional: true\n\n  '@vueuse/metadata@10.7.0':\n    resolution: {integrity: sha512-GlaH7tKP2iBCZ3bHNZ6b0cl9g0CJK8lttkBNUX156gWvNYhTKEtbweWLm9rxCPIiwzYcr/5xML6T8ZUEt+DkvA==}\n\n  '@vueuse/metadata@11.1.0':\n    resolution: {integrity: sha512-l9Q502TBTaPYGanl1G+hPgd3QX5s4CGnpXriVBR5fEZ/goI6fvDaVmIl3Td8oKFurOxTmbXvBPSsgrd6eu6HYg==}\n\n  '@vueuse/nuxt@11.1.0':\n    resolution: {integrity: sha512-ZPYigcqgPPe9vk9nBHLF8p0zshX8qvWV/ox1Y4GdV4k2flPiw7+2THNTpU2NZDBXSOXlhB2sao+paGCsvJm/Qw==}\n    peerDependencies:\n      nuxt: ^3.0.0\n\n  '@vueuse/shared@10.7.0':\n    resolution: {integrity: sha512-kc00uV6CiaTdc3i1CDC4a3lBxzaBE9AgYNtFN87B5OOscqeWElj/uza8qVDmk7/U8JbqoONLbtqiLJ5LGRuqlw==}\n\n  '@vueuse/shared@11.1.0':\n    resolution: {integrity: sha512-YUtIpY122q7osj+zsNMFAfMTubGz0sn5QzE5gPzAIiCmtt2ha3uQUY1+JPyL4gRCTsLPX82Y9brNbo/aqlA91w==}\n\n  '@webassemblyjs/ast@1.12.1':\n    resolution: {integrity: sha512-EKfMUOPRRUTy5UII4qJDGPpqfwjOmZ5jeGFwid9mnoqIFK+e0vqoi1qH56JpmZSzEL53jKnNzScdmftJyG5xWg==}\n\n  '@webassemblyjs/floating-point-hex-parser@1.11.6':\n    resolution: {integrity: sha512-ejAj9hfRJ2XMsNHk/v6Fu2dGS+i4UaXBXGemOfQ/JfQ6mdQg/WXtwleQRLLS4OvfDhv8rYnVwH27YJLMyYsxhw==}\n\n  '@webassemblyjs/helper-api-error@1.11.6':\n    resolution: {integrity: sha512-o0YkoP4pVu4rN8aTJgAyj9hC2Sv5UlkzCHhxqWj8butaLvnpdc2jOwh4ewE6CX0txSfLn/UYaV/pheS2Txg//Q==}\n\n  '@webassemblyjs/helper-buffer@1.12.1':\n    resolution: {integrity: sha512-nzJwQw99DNDKr9BVCOZcLuJJUlqkJh+kVzVl6Fmq/tI5ZtEyWT1KZMyOXltXLZJmDtvLCDgwsyrkohEtopTXCw==}\n\n  '@webassemblyjs/helper-numbers@1.11.6':\n    resolution: {integrity: sha512-vUIhZ8LZoIWHBohiEObxVm6hwP034jwmc9kuq5GdHZH0wiLVLIPcMCdpJzG4C11cHoQ25TFIQj9kaVADVX7N3g==}\n\n  '@webassemblyjs/helper-wasm-bytecode@1.11.6':\n    resolution: {integrity: sha512-sFFHKwcmBprO9e7Icf0+gddyWYDViL8bpPjJJl0WHxCdETktXdmtWLGVzoHbqUcY4Be1LkNfwTmXOJUFZYSJdA==}\n\n  '@webassemblyjs/helper-wasm-section@1.12.1':\n    resolution: {integrity: sha512-Jif4vfB6FJlUlSbgEMHUyk1j234GTNG9dBJ4XJdOySoj518Xj0oGsNi59cUQF4RRMS9ouBUxDDdyBVfPTypa5g==}\n\n  '@webassemblyjs/ieee754@1.11.6':\n    resolution: {integrity: sha512-LM4p2csPNvbij6U1f19v6WR56QZ8JcHg3QIJTlSwzFcmx6WSORicYj6I63f9yU1kEUtrpG+kjkiIAkevHpDXrg==}\n\n  '@webassemblyjs/leb128@1.11.6':\n    resolution: {integrity: sha512-m7a0FhE67DQXgouf1tbN5XQcdWoNgaAuoULHIfGFIEVKA6tu/edls6XnIlkmS6FrXAquJRPni3ZZKjw6FSPjPQ==}\n\n  '@webassemblyjs/utf8@1.11.6':\n    resolution: {integrity: sha512-vtXf2wTQ3+up9Zsg8sa2yWiQpzSsMyXj0qViVP6xKGCUT8p8YJ6HqI7l5eCnWx1T/FYdsv07HQs2wTFbbof/RA==}\n\n  '@webassemblyjs/wasm-edit@1.12.1':\n    resolution: {integrity: sha512-1DuwbVvADvS5mGnXbE+c9NfA8QRcZ6iKquqjjmR10k6o+zzsRVesil54DKexiowcFCPdr/Q0qaMgB01+SQ1u6g==}\n\n  '@webassemblyjs/wasm-gen@1.12.1':\n    resolution: {integrity: sha512-TDq4Ojh9fcohAw6OIMXqiIcTq5KUXTGRkVxbSo1hQnSy6lAM5GSdfwWeSxpAo0YzgsgF182E/U0mDNhuA0tW7w==}\n\n  '@webassemblyjs/wasm-opt@1.12.1':\n    resolution: {integrity: sha512-Jg99j/2gG2iaz3hijw857AVYekZe2SAskcqlWIZXjji5WStnOpVoat3gQfT/Q5tb2djnCjBtMocY/Su1GfxPBg==}\n\n  '@webassemblyjs/wasm-parser@1.12.1':\n    resolution: {integrity: sha512-xikIi7c2FHXysxXe3COrVUPSheuBtpcfhbpFj4gmu7KRLYOzANztwUU0IbsqvMqzuNK2+glRGWCEqZo1WCLyAQ==}\n\n  '@webassemblyjs/wast-printer@1.12.1':\n    resolution: {integrity: sha512-+X4WAlOisVWQMikjbcvY2e0rwPsKQ9F688lksZhBcPycBBuii3O7m8FACbDMWDojpAqvjIncrG8J0XHKyQfVeA==}\n\n  '@xtuc/ieee754@1.2.0':\n    resolution: {integrity: sha512-DX8nKgqcGwsc0eJSqYt5lwP4DH5FlHnmuWWBRy7X0NcaGR0ZtuyeESgMwTYVEtxmsNGY+qit4QYT/MIYTOTPeA==}\n\n  '@xtuc/long@4.2.2':\n    resolution: {integrity: sha512-NuHqBY1PB/D8xU6s/thBgOAiAP7HOYDQ32+BFZILJ8ivkUkAHQnWfn6WhL79Owj1qmUnoN/YPhktdIoucipkAQ==}\n\n  abbrev@1.1.1:\n    resolution: {integrity: sha512-nne9/IiQ/hzIhY6pdDnbBtz7DjPTKrY00P/zvPSm5pOFkl6xuGrGnXn/VtTNNfNtAfZ9/1RtehkszU9qcTii0Q==}\n\n  abort-controller@3.0.0:\n    resolution: {integrity: sha512-h8lQ8tacZYnR3vNQTgibj+tODHI5/+l06Au2Pcriv/Gmet0eaj4TwWH41sO9wnHDiQsEj19q0drzdWdeAHtweg==}\n    engines: {node: '>=6.5'}\n\n  accepts@1.3.8:\n    resolution: {integrity: sha512-PYAthTa2m2VKxuvSD3DPC/Gy+U+sOA1LAuT8mkmRuvw+NACSaeXEQ+NHcVF7rONl6qcaxV3Uuemwawk+7+SJLw==}\n    engines: {node: '>= 0.6'}\n\n  acorn-import-attributes@1.9.5:\n    resolution: {integrity: sha512-n02Vykv5uA3eHGM/Z2dQrcD56kL8TyDb2p1+0P83PClMnC/nc+anbQRhIOWnSq4Ke/KvDPrY3C9hDtC/A3eHnQ==}\n    peerDependencies:\n      acorn: ^8\n\n  acorn-walk@8.3.4:\n    resolution: {integrity: sha512-ueEepnujpqee2o5aIYnvHU6C0A42MNdsIDeqy5BydrkuC5R1ZuUFnm27EeFJGoEHJQgn3uleRvmTXaJgfXbt4g==}\n    engines: {node: '>=0.4.0'}\n\n  acorn@8.11.3:\n    resolution: {integrity: sha512-Y9rRfJG5jcKOE0CLisYbojUjIrIEE7AGMzA/Sm4BslANhbS+cDMpgBdcPT91oJ7OuJ9hYJBx59RjbhxVnrF8Xg==}\n    engines: {node: '>=0.4.0'}\n    hasBin: true\n\n  acorn@8.12.1:\n    resolution: {integrity: sha512-tcpGyI9zbizT9JbV6oYE477V6mTlXvvi0T0G3SNIYE2apm/G5huBa1+K89VGeovbg+jycCrfhl3ADxErOuO6Jg==}\n    engines: {node: '>=0.4.0'}\n    hasBin: true\n\n  acorn@8.14.0:\n    resolution: {integrity: sha512-cl669nCJTZBsL97OF4kUQm5g5hC2uihk0NxY3WENAC0TYdILVkAyHymAntgxGkl7K+t0cXIrH5siy5S4XkFycA==}\n    engines: {node: '>=0.4.0'}\n    hasBin: true\n\n  agent-base@6.0.2:\n    resolution: {integrity: sha512-RZNwNclF7+MS/8bDg70amg32dyeZGZxiDuQmZxKLAlQjr3jGyLx+4Kkk58UO7D2QdgFIQCovuSuZESne6RG6XQ==}\n    engines: {node: '>= 6.0.0'}\n\n  ajv-keywords@3.5.2:\n    resolution: {integrity: sha512-5p6WTN0DdTGVQk6VjcEju19IgaHudalcfabD7yhDGeA6bcQnmL+CpveLJq/3hvfwd1aof6L386Ougkx6RfyMIQ==}\n    peerDependencies:\n      ajv: ^6.9.1\n\n  ajv@6.12.6:\n    resolution: {integrity: sha512-j3fVLgvTo527anyYyJOGTYJbG+vnnQYvE0m5mmkc1TK+nxAppkCLMIL0aZ4dblVCNoGShhm+kzE4ZUykBoMg4g==}\n\n  ajv@8.12.0:\n    resolution: {integrity: sha512-sRu1kpcO9yLtYxBKvqfTeh9KzZEwO3STyX1HT+4CaDzC6HpTGYhIhPIzj9XuKU7KYDwnaeh5hcOwjy1QuJzBPA==}\n\n  ansi-colors@4.1.3:\n    resolution: {integrity: sha512-/6w/C21Pm1A7aZitlI5Ni/2J6FFQN8i1Cvz3kHABAAbw93v/NlvKdVOqz7CCWz/3iv/JplRSEEZ83XION15ovw==}\n    engines: {node: '>=6'}\n\n  ansi-escapes@4.3.2:\n    resolution: {integrity: sha512-gKXj5ALrKWQLsYG9jlTRmR/xKluxHV+Z9QEwNIgCfM1/uwPMCuzVVnh5mwTd+OuBZcwSIMbqssNWRm1lE51QaQ==}\n    engines: {node: '>=8'}\n\n  ansi-regex@5.0.1:\n    resolution: {integrity: sha512-quJQXlTSUGL2LH9SUXo8VwsY4soanhgo6LNSm84E1LBcE8s3O0wpdiRzyR9z/ZZJMlMWv37qOOb9pdJlMUEKFQ==}\n    engines: {node: '>=8'}\n\n  ansi-regex@6.0.1:\n    resolution: {integrity: sha512-n5M855fKb2SsfMIiFFoVrABHJC8QtHwVx+mHWP3QcEqBHYienj5dHSgjbxtC0WEZXYt4wcD6zrQElDPhFuZgfA==}\n    engines: {node: '>=12'}\n\n  ansi-styles@3.2.1:\n    resolution: {integrity: sha512-VT0ZI6kZRdTh8YyJw3SMbYm/u+NqfsAxEpWO0Pf9sq8/e94WxxOpPKx9FR1FlyCtOVDNOQ+8ntlqFxiRc+r5qA==}\n    engines: {node: '>=4'}\n\n  ansi-styles@4.3.0:\n    resolution: {integrity: sha512-zbB9rCJAT1rbjiVDb2hqKFHNYLxgtk8NURxZ3IZwD3F6NtxbXZQCnnSi1Lkx+IDohdPlFp222wVALIheZJQSEg==}\n    engines: {node: '>=8'}\n\n  ansi-styles@6.2.1:\n    resolution: {integrity: sha512-bN798gFfQX+viw3R7yrGWRqnrN2oRkEkUjjl4JNn4E8GxxbjtG3FbrEIIY3l8/hrwUwIeCZvi4QuOTP4MErVug==}\n    engines: {node: '>=12'}\n\n  any-promise@1.3.0:\n    resolution: {integrity: sha512-7UvmKalWRt1wgjL1RrGxoSJW/0QZFIegpeGvZG9kjp8vrRu55XTHbwnqq2GpXm9uLbcuhxm3IqX9OB4MZR1b2A==}\n\n  anymatch@3.1.3:\n    resolution: {integrity: sha512-KMReFUr0B4t+D+OBkjR3KYqvocp2XaSzO55UcB6mgQMd3KbcE+mWTyvVV7D/zsdEbNnV6acZUutkiHQXvTr1Rw==}\n    engines: {node: '>= 8'}\n\n  aproba@2.0.0:\n    resolution: {integrity: sha512-lYe4Gx7QT+MKGbDsA+Z+he/Wtef0BiwDOlK/XkBrdfsh9J/jPPXbX0tE9x9cl27Tmu5gg3QUbUrQYa/y+KOHPQ==}\n\n  archiver-utils@5.0.2:\n    resolution: {integrity: sha512-wuLJMmIBQYCsGZgYLTy5FIB2pF6Lfb6cXMSF8Qywwk3t20zWnAi7zLcQFdKQmIB8wyZpY5ER38x08GbwtR2cLA==}\n    engines: {node: '>= 14'}\n\n  archiver@7.0.1:\n    resolution: {integrity: sha512-ZcbTaIqJOfCc03QwD468Unz/5Ir8ATtvAHsK+FdXbDIbGfihqh9mrvdcYunQzqn4HrvWWaFyaxJhGZagaJJpPQ==}\n    engines: {node: '>= 14'}\n\n  are-we-there-yet@2.0.0:\n    resolution: {integrity: sha512-Ci/qENmwHnsYo9xKIcUJN5LeDKdJ6R1Z1j9V/J5wyq8nh/mYPEpIKJbBZXtZjG04HiK7zV/p6Vs9952MrMeUIw==}\n    engines: {node: '>=10'}\n    deprecated: This package is no longer supported.\n\n  arg@5.0.2:\n    resolution: {integrity: sha512-PYjyFOLKQ9y57JvQ6QLo8dAgNqswh8M1RMJYdQduT6xbWSgK36P/Z/v+p888pM69jMMfS8Xd8F6I1kQ/I9HUGg==}\n\n  argparse@2.0.1:\n    resolution: {integrity: sha512-8+9WqebbFzpX9OR+Wa6O29asIogeRMzcGtAINdpMHHyAg10f05aSFVBbcEqGf/PXw1EjAZ+q2/bEBg3DvurK3Q==}\n\n  aria-hidden@1.2.4:\n    resolution: {integrity: sha512-y+CcFFwelSXpLZk/7fMB2mUbGtX9lKycf1MWJ7CaTIERyitVlyQx6C+sxcROU2BAJ24OiZyK+8wj2i8AlBoS3A==}\n    engines: {node: '>=10'}\n\n  array-buffer-byte-length@1.0.0:\n    resolution: {integrity: sha512-LPuwb2P+NrQw3XhxGc36+XSvuBPopovXYTR9Ew++Du9Yb/bx5AzBfrIsBoj0EZUifjQU+sHL21sseZ3jerWO/A==}\n\n  arraybuffer.prototype.slice@1.0.2:\n    resolution: {integrity: sha512-yMBKppFur/fbHu9/6USUe03bZ4knMYiwFBcyiaXB8Go0qNehwX6inYPzK9U0NeQvGxKthcmHcaR8P5MStSRBAw==}\n    engines: {node: '>= 0.4'}\n\n  as-table@1.0.55:\n    resolution: {integrity: sha512-xvsWESUJn0JN421Xb9MQw6AsMHRCUknCe0Wjlxvjud80mU4E6hQf1A6NzQKcYNmYw62MfzEtXc+badstZP3JpQ==}\n\n  ast-kit@1.3.0:\n    resolution: {integrity: sha512-ORycPY6qYSrAGMnSk1tlqy/Y0rFGk/WIYP/H6io0A+jXK2Jp3Il7h8vjfwaLvZUwanjiLwBeE5h3A9M+eQqeNw==}\n    engines: {node: '>=16.14.0'}\n\n  ast-walker-scope@0.6.2:\n    resolution: {integrity: sha512-1UWOyC50xI3QZkRuDj6PqDtpm1oHWtYs+NQGwqL/2R11eN3Q81PHAHPM0SWW3BNQm53UDwS//Jv8L4CCVLM1bQ==}\n    engines: {node: '>=16.14.0'}\n\n  async-sema@3.1.1:\n    resolution: {integrity: sha512-tLRNUXati5MFePdAk8dw7Qt7DpxPB60ofAgn8WRhW6a2rcimZnYBP9oxHiv0OHy+Wz7kPMG+t4LGdt31+4EmGg==}\n\n  async@2.6.4:\n    resolution: {integrity: sha512-mzo5dfJYwAn29PeiJ0zvwTo04zj8HDJj0Mn8TD7sno7q12prdbnasKJHhkm2c1LgrhlJ0teaea8860oxi51mGA==}\n\n  async@3.2.5:\n    resolution: {integrity: sha512-baNZyqaaLhyLVKm/DlvdW051MSgO6b8eVfIezl9E5PqWxFgzLm/wQntEW4zOytVburDEr0JlALEpdOFwvErLsg==}\n\n  at-least-node@1.0.0:\n    resolution: {integrity: sha512-+q/t7Ekv1EDY2l6Gda6LLiX14rU9TV20Wa3ofeQmwPFZbOMo9DXrLbOjFaaclkXKWidIaopwAObQDqwWtGUjqg==}\n    engines: {node: '>= 4.0.0'}\n\n  autoprefixer@10.4.20:\n    resolution: {integrity: sha512-XY25y5xSv/wEoqzDyXXME4AFfkZI0P23z6Fs3YgymDnKJkCGOnkL0iTxCa85UTqaSgfcqyf3UA6+c7wUvx/16g==}\n    engines: {node: ^10 || ^12 || >=14}\n    hasBin: true\n    peerDependencies:\n      postcss: ^8.1.0\n\n  available-typed-arrays@1.0.5:\n    resolution: {integrity: sha512-DMD0KiN46eipeziST1LPP/STfDU0sufISXmjSgvVsoU2tqxctQeASejWcfNtxYKqETM1UxQ8sp2OrSBWpHY6sw==}\n    engines: {node: '>= 0.4'}\n\n  b4a@1.6.7:\n    resolution: {integrity: sha512-OnAYlL5b7LEkALw87fUVafQw5rVR9RjwGd4KUwNQ6DrrNmaVaUCgLipfVlzrPQ4tWOR9P0IXGNOx50jYCCdSJg==}\n\n  babel-plugin-polyfill-corejs2@0.4.7:\n    resolution: {integrity: sha512-LidDk/tEGDfuHW2DWh/Hgo4rmnw3cduK6ZkOI1NPFceSK3n/yAGeOsNT7FLnSGHkXj3RHGSEVkN3FsCTY6w2CQ==}\n    peerDependencies:\n      '@babel/core': ^7.4.0 || ^8.0.0-0 <8.0.0\n\n  babel-plugin-polyfill-corejs3@0.8.7:\n    resolution: {integrity: sha512-KyDvZYxAzkC0Aj2dAPyDzi2Ym15e5JKZSK+maI7NAwSqofvuFglbSsxE7wUOvTg9oFVnHMzVzBKcqEb4PJgtOA==}\n    peerDependencies:\n      '@babel/core': ^7.4.0 || ^8.0.0-0 <8.0.0\n\n  babel-plugin-polyfill-regenerator@0.5.4:\n    resolution: {integrity: sha512-S/x2iOCvDaCASLYsOOgWOq4bCfKYVqvO/uxjkaYyZ3rVsVE3CeAI/c84NpyuBBymEgNvHgjEot3a9/Z/kXvqsg==}\n    peerDependencies:\n      '@babel/core': ^7.4.0 || ^8.0.0-0 <8.0.0\n\n  balanced-match@1.0.2:\n    resolution: {integrity: sha512-3oSeUO0TMV67hN1AmbXsK4yaqU7tjiHlbxRDZOpH0KW9+CeX4bRAaX0Anxt0tx2MrpRpWwQaPwIlISEJhYU5Pw==}\n\n  bare-events@2.5.0:\n    resolution: {integrity: sha512-/E8dDe9dsbLyh2qrZ64PEPadOQ0F4gbl1sUJOrmph7xOiIxfY8vwab/4bFLh4Y88/Hk/ujKcrQKc+ps0mv873A==}\n\n  base64-js@1.5.1:\n    resolution: {integrity: sha512-AKpaYlHn8t4SVbOHCy+b5+KKgvR4vrsD8vbvrbiQJps7fKDTkjkDry6ji0rUJjC0kzbNePLwzxq8iypo41qeWA==}\n\n  binary-extensions@2.2.0:\n    resolution: {integrity: sha512-jDctJ/IVQbZoJykoeHbhXpOlNBqGNcwXJKJog42E5HDPUwQTSdjCHdihjj0DlnheQ7blbT6dHOafNAiS8ooQKA==}\n    engines: {node: '>=8'}\n\n  bindings@1.5.0:\n    resolution: {integrity: sha512-p2q/t/mhvuOj/UeLlV6566GD/guowlr0hHxClI0W9m7MWYkL1F0hLo+0Aexs9HSPCtR1SXQ0TD3MMKrXZajbiQ==}\n\n  birpc@0.2.19:\n    resolution: {integrity: sha512-5WeXXAvTmitV1RqJFppT5QtUiz2p1mRSYU000Jkft5ZUCLJIk4uQriYNO50HknxKwM6jd8utNc66K1qGIwwWBQ==}\n\n  blake3-wasm@2.1.5:\n    resolution: {integrity: sha512-F1+K8EbfOZE49dtoPtmxUQrpXaBIl3ICvasLh+nJta0xkz+9kF/7uet9fLnwKqhDrmj6g+6K3Tw9yQPUg2ka5g==}\n\n  boolbase@1.0.0:\n    resolution: {integrity: sha512-JZOSA7Mo9sNGB8+UjSgzdLtokWAky1zbztM3WRLCbZ70/3cTANmQmOdR7y2g+J0e2WXywy1yS468tY+IruqEww==}\n\n  brace-expansion@1.1.11:\n    resolution: {integrity: sha512-iCuPHDFgrHX7H2vEI/5xpz07zSHB00TpugqhmYtVmMO6518mCuRMoOYFldEBl0g187ufozdaHgWKcYFb61qGiA==}\n\n  brace-expansion@2.0.1:\n    resolution: {integrity: sha512-XnAIvQ8eM+kC6aULx6wuQiwVsnzsi9d3WxzV3FpWTGA19F621kwdbsAcFKXgKUHZWsy+mY6iL1sHTxWEFCytDA==}\n\n  braces@3.0.2:\n    resolution: {integrity: sha512-b8um+L1RzM3WDSzvhm6gIz1yfTbBt6YTlcEKAvsmqCZZFw46z626lVj9j1yEPW33H5H+lBQpZMP1k8l+78Ha0A==}\n    engines: {node: '>=8'}\n\n  browserslist@4.24.0:\n    resolution: {integrity: sha512-Rmb62sR1Zpjql25eSanFGEhAxcFwfA1K0GuQcLoaJBAcENegrQut3hYdhXFF1obQfiDyqIW/cLM5HSJ/9k884A==}\n    engines: {node: ^6 || ^7 || ^8 || ^9 || ^10 || ^11 || ^12 || >=13.7}\n    hasBin: true\n\n  buffer-crc32@1.0.0:\n    resolution: {integrity: sha512-Db1SbgBS/fg/392AblrMJk97KggmvYhr4pB5ZIMTWtaivCPMWLkmb7m21cJvpvgK+J3nsU2CmmixNBZx4vFj/w==}\n    engines: {node: '>=8.0.0'}\n\n  buffer-from@1.1.2:\n    resolution: {integrity: sha512-E+XQCRwSbaaiChtv6k6Dwgc+bx+Bs6vuKJHHl5kox/BaKbhiXzqQOwK4cO22yElGp2OCmjwVhT3HmxgyPGnJfQ==}\n\n  buffer@6.0.3:\n    resolution: {integrity: sha512-FTiCpNxtwiZZHEZbcbTIcZjERVICn9yq/pDFkTl95/AxzD1naBctN7YO68riM/gLSDY7sdrMby8hofADYuuqOA==}\n\n  builtin-modules@3.3.0:\n    resolution: {integrity: sha512-zhaCDicdLuWN5UbN5IMnFqNMhNfo919sH85y2/ea+5Yg9TsTkeZxpL+JLbp6cgYFS4sRLp3YV4S6yDuqVWHYOw==}\n    engines: {node: '>=6'}\n\n  bundle-name@4.1.0:\n    resolution: {integrity: sha512-tjwM5exMg6BGRI+kNmTntNsvdZS1X8BFYS6tnJ2hdH0kVxM6/eVZ2xy+FqStSWvYmtfFMDLIxurorHwDKfDz5Q==}\n    engines: {node: '>=18'}\n\n  bundle-require@5.0.0:\n    resolution: {integrity: sha512-GuziW3fSSmopcx4KRymQEJVbZUfqlCqcq7dvs6TYwKRZiegK/2buMxQTPs6MGlNv50wms1699qYO54R8XfRX4w==}\n    engines: {node: ^12.20.0 || ^14.13.1 || >=16.0.0}\n    peerDependencies:\n      esbuild: '>=0.18'\n\n  c12@1.11.2:\n    resolution: {integrity: sha512-oBs8a4uvSDO9dm8b7OCFW7+dgtVrwmwnrVXYzLm43ta7ep2jCn/0MhoUFygIWtxhyy6+/MG7/agvpY0U1Iemew==}\n    peerDependencies:\n      magicast: ^0.3.4\n    peerDependenciesMeta:\n      magicast:\n        optional: true\n\n  c12@2.0.1:\n    resolution: {integrity: sha512-Z4JgsKXHG37C6PYUtIxCfLJZvo6FyhHJoClwwb9ftUkLpPSkuYqn6Tr+vnaN8hymm0kIbcg6Ey3kv/Q71k5w/A==}\n    peerDependencies:\n      magicast: ^0.3.5\n    peerDependenciesMeta:\n      magicast:\n        optional: true\n\n  cac@6.7.14:\n    resolution: {integrity: sha512-b6Ilus+c3RrdDk+JhLKUAQfzzgLEPy6wcXqS7f/xe1EETvsDP6GORG7SFuOs6cID5YkqchW/LXZbX5bc8j7ZcQ==}\n    engines: {node: '>=8'}\n\n  cache-content-type@1.0.1:\n    resolution: {integrity: sha512-IKufZ1o4Ut42YUrZSo8+qnMTrFuKkvyoLXUywKz9GJ5BrhOFGhLdkx9sG4KAnVvbY6kEcSFjLQul+DVmBm2bgA==}\n    engines: {node: '>= 6.0.0'}\n\n  call-bind@1.0.5:\n    resolution: {integrity: sha512-C3nQxfFZxFRVoJoGKKI8y3MOEo129NQ+FgQ08iye+Mk4zNZZGdjfs06bVTr+DBSlA66Q2VEcMki/cUCP4SercQ==}\n\n  camelcase-css@2.0.1:\n    resolution: {integrity: sha512-QOSvevhslijgYwRx6Rv7zKdMF8lbRmx+uQGx2+vDc+KI/eBnsy9kit5aj23AgGu3pa4t9AgwbnXWqS+iOY+2aA==}\n    engines: {node: '>= 6'}\n\n  caniuse-api@3.0.0:\n    resolution: {integrity: sha512-bsTwuIg/BZZK/vreVTYYbSWoe2F+71P7K5QGEX+pT250DZbfU1MQ5prOKpPR+LL6uWKK3KMwMCAS74QB3Um1uw==}\n\n  caniuse-lite@1.0.30001668:\n    resolution: {integrity: sha512-nWLrdxqCdblixUO+27JtGJJE/txpJlyUy5YN1u53wLZkP0emYCo5zgS6QYft7VUYR42LGgi/S5hdLZTrnyIddw==}\n\n  capnp-ts@0.7.0:\n    resolution: {integrity: sha512-XKxXAC3HVPv7r674zP0VC3RTXz+/JKhfyw94ljvF80yynK6VkTnqE3jMuN8b3dUVmmc43TjyxjW4KTsmB3c86g==}\n\n  ccount@2.0.1:\n    resolution: {integrity: sha512-eyrF0jiFpY+3drT6383f1qhkbGsLSifNAjA61IUjZjmLCWjItY6LB9ft9YhoDgwfmclB2zhu51Lc7+95b8NRAg==}\n\n  chalk@2.4.2:\n    resolution: {integrity: sha512-Mti+f9lpJNcwF4tWV8/OrTTtF1gZi+f8FqlyAdouralcFWFQWF2+NgCHShjkCb+IFBLq9buZwE1xckQU4peSuQ==}\n    engines: {node: '>=4'}\n\n  chalk@4.1.2:\n    resolution: {integrity: sha512-oKnbhFyRIXpUuez8iBMmyEa4nbj4IOQyuhc/wy9kY7/WVPcwIO9VA668Pu8RkO7+0G76SLROeyw9CpQ061i4mA==}\n    engines: {node: '>=10'}\n\n  chalk@5.3.0:\n    resolution: {integrity: sha512-dLitG79d+GV1Nb/VYcCDFivJeK1hiukt9QjRNVOsUtTy1rR1YJsmpGGTZ3qJos+uw7WmWF4wUwBd9jxjocFC2w==}\n    engines: {node: ^12.17.0 || ^14.13 || >=16.0.0}\n\n  character-entities-html4@2.1.0:\n    resolution: {integrity: sha512-1v7fgQRj6hnSwFpq1Eu0ynr/CDEw0rXo2B61qXrLNdHZmPKgb7fqS1a2JwF0rISo9q77jDI8VMEHoApn8qDoZA==}\n\n  character-entities-legacy@3.0.0:\n    resolution: {integrity: sha512-RpPp0asT/6ufRm//AJVwpViZbGM/MkjQFxJccQRHmISF/22NBtsHqAWmL+/pmkPWoIUJdWyeVleTl1wydHATVQ==}\n\n  chokidar@3.6.0:\n    resolution: {integrity: sha512-7VT13fmjotKpGipCW9JEQAusEPE+Ei8nl6/g4FBAmIm0GOOLMua9NDDo/DWp0ZAxCr3cPq5ZpBqmPAQgDda2Pw==}\n    engines: {node: '>= 8.10.0'}\n\n  chokidar@4.0.1:\n    resolution: {integrity: sha512-n8enUVCED/KVRQlab1hr3MVpcVMvxtZjmEa956u+4YijlmQED223XMSYj2tLuKvr4jcCTzNNMpQDUer72MMmzA==}\n    engines: {node: '>= 14.16.0'}\n\n  chownr@2.0.0:\n    resolution: {integrity: sha512-bIomtDF5KGpdogkLd9VspvFzk9KfpyyGlS8YFVZl7TGPBHL5snIOnxeshwVgPteQ9b4Eydl+pVbIyE1DcvCWgQ==}\n    engines: {node: '>=10'}\n\n  chrome-trace-event@1.0.4:\n    resolution: {integrity: sha512-rNjApaLzuwaOTjCiT8lSDdGN1APCiqkChLMJxJPWLunPAt5fy8xgU9/jNOchV84wfIxrA0lRQB7oCT8jrn/wrQ==}\n    engines: {node: '>=6.0'}\n\n  ci-info@4.0.0:\n    resolution: {integrity: sha512-TdHqgGf9odd8SXNuxtUBVx8Nv+qZOejE6qyqiy5NtbYYQOeFa6zmHkxlPzmaLxWWHsU6nJmB7AETdVPi+2NBUg==}\n    engines: {node: '>=8'}\n\n  citty@0.1.6:\n    resolution: {integrity: sha512-tskPPKEs8D2KPafUypv2gxwJP8h/OaJmC82QQGGDQcHvXX43xF2VDACcJVmZ0EuSxkpO9Kc4MlrA3q0+FG58AQ==}\n\n  clear@0.1.0:\n    resolution: {integrity: sha512-qMjRnoL+JDPJHeLePZJuao6+8orzHMGP04A8CdwCNsKhRbOnKRjefxONR7bwILT3MHecxKBjHkKL/tkZ8r4Uzw==}\n\n  clipboardy@4.0.0:\n    resolution: {integrity: sha512-5mOlNS0mhX0707P2I0aZ2V/cmHUEO/fL7VFLqszkhUsxt7RwnmrInf/eEQKlf5GzvYeHIjT+Ov1HRfNmymlG0w==}\n    engines: {node: '>=18'}\n\n  cliui@8.0.1:\n    resolution: {integrity: sha512-BSeNnyus75C4//NQ9gQt1/csTXyo/8Sb+afLAkzAptFuMsod9HFokGNudZpi/oQV73hnVK+sR+5PVRMd+Dr7YQ==}\n    engines: {node: '>=12'}\n\n  cluster-key-slot@1.1.2:\n    resolution: {integrity: sha512-RMr0FhtfXemyinomL4hrWcYJxmX6deFdCxpJzhDttxgO1+bcCnkk+9drydLVDmAMG7NE6aN/fl4F7ucU/90gAA==}\n    engines: {node: '>=0.10.0'}\n\n  co@4.6.0:\n    resolution: {integrity: sha512-QVb0dM5HvG+uaxitm8wONl7jltx8dqhfU33DcqtOZcLSVIKSDDLDi7+0LbAKiyI8hD9u42m2YxXSkMGWThaecQ==}\n    engines: {iojs: '>= 1.0.0', node: '>= 0.12.0'}\n\n  color-convert@1.9.3:\n    resolution: {integrity: sha512-QfAUtd+vFdAtFQcC8CCyYt1fYWxSqAiK2cSD6zDB8N3cpsEBAvRxp9zOGg6G/SHHJYAT88/az/IuDGALsNVbGg==}\n\n  color-convert@2.0.1:\n    resolution: {integrity: sha512-RRECPsj7iu/xb5oKYcsFHSppFNnsj/52OVTRKb4zP5onXwVF3zVmmToNcOfGC+CRDpfK/U584fMg38ZHCaElKQ==}\n    engines: {node: '>=7.0.0'}\n\n  color-name@1.1.3:\n    resolution: {integrity: sha512-72fSenhMw2HZMTVHeCA9KCmpEIbzWiQsjN+BHcBbS9vr1mtt+vJjPdksIBNUmKAW8TFUDPJK5SUU3QhE9NEXDw==}\n\n  color-name@1.1.4:\n    resolution: {integrity: sha512-dOy+3AuW3a2wNbZHIuMZpTcgjGuLU/uBL/ubcZF9OXbDo8ff4O8yVp5Bf0efS8uEoYo5q4Fx7dY9OgQGXgAsQA==}\n\n  color-support@1.1.3:\n    resolution: {integrity: sha512-qiBjkpbMLO/HL68y+lh4q0/O1MZFj2RX6X/KmMa3+gJD3z+WwI1ZzDHysvqHGS3mP6mznPckpXmw1nI9cJjyRg==}\n    hasBin: true\n\n  colord@2.9.3:\n    resolution: {integrity: sha512-jeC1axXpnb0/2nn/Y1LPuLdgXBLH7aDcHu4KEKfqw3CUhX7ZpfBSlPKyqXE6btIgEzfWtrX3/tyBCaCvXvMkOw==}\n\n  colorette@2.0.20:\n    resolution: {integrity: sha512-IfEDxwoWIjkeXL1eXcDiow4UbKjhLdq6/EuSVR9GMN7KVH3r9gQ83e73hsz1Nd1T3ijd5xv1wcWRYO+D6kCI2w==}\n\n  comma-separated-tokens@2.0.3:\n    resolution: {integrity: sha512-Fu4hJdvzeylCfQPp9SGWidpzrMs7tTrlu6Vb8XGaRGck8QSNZJJp538Wrb60Lax4fPwR64ViY468OIUTbRlGZg==}\n\n  commander@2.20.3:\n    resolution: {integrity: sha512-GpVkmM8vF2vQUkj2LvZmD35JxeJOLCwJ9cUkugyk2nuhbv3+mJvpLYYt+0+USMxE+oj+ey/lJEnhZw75x/OMcQ==}\n\n  commander@4.1.1:\n    resolution: {integrity: sha512-NOKm8xhkzAjzFx8B2v5OAHT+u5pRQc2UCa2Vq9jYL/31o2wi9mxBA7LIFs3sV5VSC49z6pEhfbMULvShKj26WA==}\n    engines: {node: '>= 6'}\n\n  commander@6.2.1:\n    resolution: {integrity: sha512-U7VdrJFnJgo4xjrHpTzu0yrHPGImdsmD95ZlgYSEajAn2JKzDhDTPG9kBTefmObL2w/ngeZnilk+OV9CG3d7UA==}\n    engines: {node: '>= 6'}\n\n  commander@7.2.0:\n    resolution: {integrity: sha512-QrWXB+ZQSVPmIWIhtEO9H+gwHaMGYiF5ChvoJ+K9ZGHG/sVsa6yiesAD1GC/x46sET00Xlwo1u49RVVVzvcSkw==}\n    engines: {node: '>= 10'}\n\n  commander@8.3.0:\n    resolution: {integrity: sha512-OkTL9umf+He2DZkUq8f8J9of7yL6RJKI24dVITBmNfZBmri9zYZQrKkuXiKhyfPSu8tUhnVBB1iKXevvnlR4Ww==}\n    engines: {node: '>= 12'}\n\n  common-tags@1.8.2:\n    resolution: {integrity: sha512-gk/Z852D2Wtb//0I+kRFNKKE9dIIVirjoqPoA1wJU+XePVXZfGeBpk45+A1rKO4Q43prqWBNY/MiIeRLbPWUaA==}\n    engines: {node: '>=4.0.0'}\n\n  commondir@1.0.1:\n    resolution: {integrity: sha512-W9pAhw0ja1Edb5GVdIF1mjZw/ASI0AlShXM83UUGe2DVr5TdAPEA1OA8m/g8zWp9x6On7gqufY+FatDbC3MDQg==}\n\n  compatx@0.1.8:\n    resolution: {integrity: sha512-jcbsEAR81Bt5s1qOFymBufmCbXCXbk0Ql+K5ouj6gCyx2yHlu6AgmGIi9HxfKixpUDO5bCFJUHQ5uM6ecbTebw==}\n\n  compress-commons@6.0.2:\n    resolution: {integrity: sha512-6FqVXeETqWPoGcfzrXb37E50NP0LXT8kAMu5ooZayhWWdgEY4lBEEcbQNXtkuKQsGduxiIcI4gOTsxTmuq/bSg==}\n    engines: {node: '>= 14'}\n\n  computeds@0.0.1:\n    resolution: {integrity: sha512-7CEBgcMjVmitjYo5q8JTJVra6X5mQ20uTThdK+0kR7UEaDrAWEQcRiBtWJzga4eRpP6afNwwLsX2SET2JhVB1Q==}\n\n  concat-map@0.0.1:\n    resolution: {integrity: sha512-/Srv4dswyQNBfohGpz9o6Yb3Gz3SrUDqBH5rTuhGR7ahtlbYKnVxw2bCFMRljaA7EXHaXZ8wsHdodFvbkhKmqg==}\n\n  confbox@0.1.8:\n    resolution: {integrity: sha512-RMtmw0iFkeR4YV+fUOSucriAQNb9g8zFR52MWCtl+cCZOFRNL6zeB395vPzFhEjjn4fMxXudmELnl/KF/WrK6w==}\n\n  consola@3.2.3:\n    resolution: {integrity: sha512-I5qxpzLv+sJhTVEoLYNcTW+bThDCPsit0vLNKShZx6rLtpilNpmmeTPaeqJb9ZE9dV3DGaeby6Vuhrw38WjeyQ==}\n    engines: {node: ^14.18.0 || >=16.10.0}\n\n  console-control-strings@1.1.0:\n    resolution: {integrity: sha512-ty/fTekppD2fIwRvnZAVdeOiGd1c7YXEixbgJTNzqcxJWKQnjJ/V1bNEEE6hygpM3WjwHFUVK6HTjWSzV4a8sQ==}\n\n  content-disposition@0.5.4:\n    resolution: {integrity: sha512-FveZTNuGw04cxlAiWbzi6zTAL/lhehaWbTtgluJh4/E95DqMwTmha3KZN1aAWA8cFIhHzMZUvLevkw5Rqk+tSQ==}\n    engines: {node: '>= 0.6'}\n\n  content-type@1.0.5:\n    resolution: {integrity: sha512-nTjqfcBFEipKdXCv4YDQWCfmcLZKm81ldF0pAopTvyrFGVbcR6P/VAAd5G7N+0tTr8QqiU0tFadD6FK4NtJwOA==}\n    engines: {node: '>= 0.6'}\n\n  convert-source-map@2.0.0:\n    resolution: {integrity: sha512-Kvp459HrV2FEJ1CAsi1Ku+MY3kasH19TFykTz2xWmMeq6bk2NU3XXvfJ+Q61m0xktWwt+1HSYf3JZsTms3aRJg==}\n\n  cookie-es@1.2.2:\n    resolution: {integrity: sha512-+W7VmiVINB+ywl1HGXJXmrqkOhpKrIiVZV6tQuV54ZyQC7MMuBt81Vc336GMLoHBq5hV/F9eXgt5Mnx0Rha5Fg==}\n\n  cookie@0.7.2:\n    resolution: {integrity: sha512-yki5XnKuf750l50uGTllt6kKILY4nQ1eNIQatoXEByZ5dWgnKqbnqmTrBE5B4N7lrMJKQ2ytWMiTO2o0v6Ew/w==}\n    engines: {node: '>= 0.6'}\n\n  cookies@0.9.1:\n    resolution: {integrity: sha512-TG2hpqe4ELx54QER/S3HQ9SRVnQnGBtKUz5bLQWtYAQ+o6GpgMs6sYUvaiJjVxb+UXwhRhAEP3m7LbsIZ77Hmw==}\n    engines: {node: '>= 0.8'}\n\n  copy-anything@3.0.5:\n    resolution: {integrity: sha512-yCEafptTtb4bk7GLEQoM8KVJpxAfdBJYaXyzQEgQQQgYrZiDp8SJmGKlYza6CYjEDNstAdNdKA3UuoULlEbS6w==}\n    engines: {node: '>=12.13'}\n\n  core-js-compat@3.35.0:\n    resolution: {integrity: sha512-5blwFAddknKeNgsjBzilkdQ0+YK8L1PfqPYq40NOYMYFSS38qj+hpTcLLWwpIwA2A5bje/x5jmVn2tzUMg9IVw==}\n\n  core-util-is@1.0.3:\n    resolution: {integrity: sha512-ZQBvi1DcpJ4GDqanjucZ2Hj3wEO5pZDS89BWbkcrvdxksJorwUDDZamX9ldFkp9aw2lmBDLgkObEA4DWNJ9FYQ==}\n\n  crc-32@1.2.2:\n    resolution: {integrity: sha512-ROmzCKrTnOwybPcJApAA6WBWij23HVfGVNKqqrZpuyZOHqK2CwHSvpGuyt/UNNvaIjEd8X5IFGp4Mh+Ie1IHJQ==}\n    engines: {node: '>=0.8'}\n    hasBin: true\n\n  crc32-stream@6.0.0:\n    resolution: {integrity: sha512-piICUB6ei4IlTv1+653yq5+KoqfBYmj9bw6LqXoOneTMDXk5nM1qt12mFW1caG3LlJXEKW1Bp0WggEmIfQB34g==}\n    engines: {node: '>= 14'}\n\n  create-require@1.1.1:\n    resolution: {integrity: sha512-dcKFX3jn0MpIaXjisoRvexIJVEKzaq7z2rZKxf+MSr9TkdmHmsU4m2lcLojrj/FHl8mk5VxMmYA+ftRkP/3oKQ==}\n\n  croner@8.1.2:\n    resolution: {integrity: sha512-ypfPFcAXHuAZRCzo3vJL6ltENzniTjwe/qsLleH1V2/7SRDjgvRQyrLmumFTLmjFax4IuSxfGXEn79fozXcJog==}\n    engines: {node: '>=18.0'}\n\n  cronstrue@2.50.0:\n    resolution: {integrity: sha512-ULYhWIonJzlScCCQrPUG5uMXzXxSixty4djud9SS37DoNxDdkeRocxzHuAo4ImRBUK+mAuU5X9TSwEDccnnuPg==}\n    hasBin: true\n\n  cross-spawn@7.0.3:\n    resolution: {integrity: sha512-iRDPJKUPVEND7dHPO8rkbOnPpyDygcDFtWjpeWNCgy8WP2rXcxXL8TskReQl6OrB2G7+UJrags1q15Fudc7G6w==}\n    engines: {node: '>= 8'}\n\n  crossws@0.2.4:\n    resolution: {integrity: sha512-DAxroI2uSOgUKLz00NX6A8U/8EE3SZHmIND+10jkVSaypvyt57J5JEOxAQOL6lQxyzi/wZbTIwssU1uy69h5Vg==}\n    peerDependencies:\n      uWebSockets.js: '*'\n    peerDependenciesMeta:\n      uWebSockets.js:\n        optional: true\n\n  crossws@0.3.1:\n    resolution: {integrity: sha512-HsZgeVYaG+b5zA+9PbIPGq4+J/CJynJuearykPsXx4V/eMhyQ5EDVg3Ak2FBZtVXCiOLu/U7IiwDHTr9MA+IKw==}\n\n  crypto-random-string@2.0.0:\n    resolution: {integrity: sha512-v1plID3y9r/lPhviJ1wrXpLeyUIGAZ2SHNYTEapm7/8A9nLPoyvVp3RK/EPFqn5kEznyWgYZNsRtYYIWbuG8KA==}\n    engines: {node: '>=8'}\n\n  css-declaration-sorter@7.2.0:\n    resolution: {integrity: sha512-h70rUM+3PNFuaBDTLe8wF/cdWu+dOZmb7pJt8Z2sedYbAcQVQV/tEchueg3GWxwqS0cxtbxmaHEdkNACqcvsow==}\n    engines: {node: ^14 || ^16 || >=18}\n    peerDependencies:\n      postcss: ^8.0.9\n\n  css-select@5.1.0:\n    resolution: {integrity: sha512-nwoRF1rvRRnnCqqY7updORDsuqKzqYJ28+oSMaJMMgOauh3fvwHqMS7EZpIPqK8GL+g9mKxF1vP/ZjSeNjEVHg==}\n\n  css-tree@2.2.1:\n    resolution: {integrity: sha512-OA0mILzGc1kCOCSJerOeqDxDQ4HOh+G8NbOJFOTgOCzpw7fCBubk0fEyxp8AgOL/jvLgYA/uV0cMbe43ElF1JA==}\n    engines: {node: ^10 || ^12.20.0 || ^14.13.0 || >=15.0.0, npm: '>=7.0.0'}\n\n  css-tree@2.3.1:\n    resolution: {integrity: sha512-6Fv1DV/TYw//QF5IzQdqsNDjx/wc8TrMBZsqjL9eW01tWb7R7k/mq+/VXfJCl7SoD5emsJop9cOByJZfs8hYIw==}\n    engines: {node: ^10 || ^12.20.0 || ^14.13.0 || >=15.0.0}\n\n  css-what@6.1.0:\n    resolution: {integrity: sha512-HTUrgRJ7r4dsZKU6GjmpfRK1O76h97Z8MfS1G0FozR+oF2kG6Vfe8JE6zwrkbxigziPHinCJ+gCPjA9EaBDtRw==}\n    engines: {node: '>= 6'}\n\n  cssesc@3.0.0:\n    resolution: {integrity: sha512-/Tb/JcjK111nNScGob5MNtsntNM1aCNUDipB/TkwZFhyDrrE47SOx/18wF2bbjgc3ZzCSKW1T5nt5EbFoAz/Vg==}\n    engines: {node: '>=4'}\n    hasBin: true\n\n  cssnano-preset-default@7.0.6:\n    resolution: {integrity: sha512-ZzrgYupYxEvdGGuqL+JKOY70s7+saoNlHSCK/OGn1vB2pQK8KSET8jvenzItcY+kA7NoWvfbb/YhlzuzNKjOhQ==}\n    engines: {node: ^18.12.0 || ^20.9.0 || >=22.0}\n    peerDependencies:\n      postcss: ^8.4.31\n\n  cssnano-utils@5.0.0:\n    resolution: {integrity: sha512-Uij0Xdxc24L6SirFr25MlwC2rCFX6scyUmuKpzI+JQ7cyqDEwD42fJ0xfB3yLfOnRDU5LKGgjQ9FA6LYh76GWQ==}\n    engines: {node: ^18.12.0 || ^20.9.0 || >=22.0}\n    peerDependencies:\n      postcss: ^8.4.31\n\n  cssnano@7.0.6:\n    resolution: {integrity: sha512-54woqx8SCbp8HwvNZYn68ZFAepuouZW4lTwiMVnBErM3VkO7/Sd4oTOt3Zz3bPx3kxQ36aISppyXj2Md4lg8bw==}\n    engines: {node: ^18.12.0 || ^20.9.0 || >=22.0}\n    peerDependencies:\n      postcss: ^8.4.31\n\n  csso@5.0.5:\n    resolution: {integrity: sha512-0LrrStPOdJj+SPCCrGhzryycLjwcgUSHBtxNA8aIDxf0GLsRh1cKYhB00Gd1lDOS4yGH69+SNn13+TWbVHETFQ==}\n    engines: {node: ^10 || ^12.20.0 || ^14.13.0 || >=15.0.0, npm: '>=7.0.0'}\n\n  csstype@3.1.3:\n    resolution: {integrity: sha512-M1uQkMl8rQK/szD0LNhtqxIPLpimGm8sOBwU7lLnCpSbTyY3yeU1Vc7l4KT5zT4s/yOxHH5O7tIuuLOCnLADRw==}\n\n  data-uri-to-buffer@2.0.2:\n    resolution: {integrity: sha512-ND9qDTLc6diwj+Xe5cdAgVTbLVdXbtxTJRXRhli8Mowuaan+0EJOtdqJ0QCHNSSPyoXGx9HX2/VMnKeC34AChA==}\n\n  date-fns@4.1.0:\n    resolution: {integrity: sha512-Ukq0owbQXxa/U3EGtsdVBkR1w7KOQ5gIBqdH2hkvknzZPYvBxb/aa6E8L7tmjFtkwZBu3UXBbjIgPo/Ez4xaNg==}\n\n  db0@0.1.4:\n    resolution: {integrity: sha512-Ft6eCwONYxlwLjBXSJxw0t0RYtA5gW9mq8JfBXn9TtC0nDPlqePAhpv9v4g9aONBi6JI1OXHTKKkUYGd+BOrCA==}\n    peerDependencies:\n      '@libsql/client': ^0.5.2\n      better-sqlite3: ^9.4.3\n      drizzle-orm: ^0.29.4\n    peerDependenciesMeta:\n      '@libsql/client':\n        optional: true\n      better-sqlite3:\n        optional: true\n      drizzle-orm:\n        optional: true\n\n  de-indent@1.0.2:\n    resolution: {integrity: sha512-e/1zu3xH5MQryN2zdVaF0OrdNLUbvWxzMbi+iNA6Bky7l1RoP8a2fIbRocyHclXt/arDrrR6lL3TqFD9pMQTsg==}\n\n  debug@2.6.9:\n    resolution: {integrity: sha512-bC7ElrdJaJnPbAP+1EotYvqZsb3ecl5wi6Bfi6BJTUcNowp6cvspg0jXznRTKDjm/E7AdgFBVeAPVMNcKGsHMA==}\n    peerDependencies:\n      supports-color: '*'\n    peerDependenciesMeta:\n      supports-color:\n        optional: true\n\n  debug@3.2.7:\n    resolution: {integrity: sha512-CFjzYYAi4ThfiQvizrFQevTTXHtnCqWfe7x1AhgEscTz6ZbLbfoLRLPugTQyBth6f8ZERVUSyWHFD/7Wu4t1XQ==}\n    peerDependencies:\n      supports-color: '*'\n    peerDependenciesMeta:\n      supports-color:\n        optional: true\n\n  debug@4.3.7:\n    resolution: {integrity: sha512-Er2nc/H7RrMXZBFCEim6TCmMk02Z8vLC2Rbi1KEBggpo0fS6l0S1nnapwmIi3yW/+GOJap1Krg4w0Hg80oCqgQ==}\n    engines: {node: '>=6.0'}\n    peerDependencies:\n      supports-color: '*'\n    peerDependenciesMeta:\n      supports-color:\n        optional: true\n\n  deep-equal@1.0.1:\n    resolution: {integrity: sha512-bHtC0iYvWhyaTzvV3CZgPeZQqCOBGyGsVV7v4eevpdkLHfiSrXUdBG+qAuSz4RI70sszvjQ1QSZ98An1yNwpSw==}\n\n  deepmerge@4.3.1:\n    resolution: {integrity: sha512-3sUqbMEc77XqpdNO7FRyRog+eW3ph+GYCbj+rK+uYyRMuwsVy0rMiVtPn+QJlKFvWP/1PYpapqYn0Me2knFn+A==}\n    engines: {node: '>=0.10.0'}\n\n  default-browser-id@5.0.0:\n    resolution: {integrity: sha512-A6p/pu/6fyBcA1TRz/GqWYPViplrftcW2gZC9q79ngNCKAeR/X3gcEdXQHl4KNXV+3wgIJ1CPkJQ3IHM6lcsyA==}\n    engines: {node: '>=18'}\n\n  default-browser@5.2.1:\n    resolution: {integrity: sha512-WY/3TUME0x3KPYdRRxEJJvXRHV4PyPoUsxtZa78lwItwRQRHhd2U9xOscaT/YTf8uCXIAjeJOFBVEh/7FtD8Xg==}\n    engines: {node: '>=18'}\n\n  define-data-property@1.1.1:\n    resolution: {integrity: sha512-E7uGkTzkk1d0ByLeSc6ZsFS79Axg+m1P/VsgYsxHgiuc3tFSj+MjMIwe90FC4lOAZzNBdY7kkO2P2wKdsQ1vgQ==}\n    engines: {node: '>= 0.4'}\n\n  define-lazy-prop@2.0.0:\n    resolution: {integrity: sha512-Ds09qNh8yw3khSjiJjiUInaGX9xlqZDY7JVryGxdxV7NPeuqQfplOpQ66yJFZut3jLa5zOwkXw1g9EI2uKh4Og==}\n    engines: {node: '>=8'}\n\n  define-lazy-prop@3.0.0:\n    resolution: {integrity: sha512-N+MeXYoqr3pOgn8xfyRPREN7gHakLYjhsHhWGT3fWAiL4IkAt0iDw14QiiEm2bE30c5XX5q0FtAA3CK5f9/BUg==}\n    engines: {node: '>=12'}\n\n  define-properties@1.2.1:\n    resolution: {integrity: sha512-8QmQKqEASLd5nx0U1B1okLElbUuuttJ/AnYmRXbbbGDWh6uS208EjD4Xqq/I9wK7u0v6O08XhTWnt5XtEbR6Dg==}\n    engines: {node: '>= 0.4'}\n\n  defu@6.1.4:\n    resolution: {integrity: sha512-mEQCMmwJu317oSz8CwdIOdwf3xMif1ttiM8LTufzc3g6kR+9Pe236twL8j3IYT1F7GfRgGcW6MWxzZjLIkuHIg==}\n\n  delegates@1.0.0:\n    resolution: {integrity: sha512-bd2L678uiWATM6m5Z1VzNCErI3jiGzt6HGY8OVICs40JQq/HALfbyNJmp0UDakEY4pMMaN0Ly5om/B1VI/+xfQ==}\n\n  denque@2.1.0:\n    resolution: {integrity: sha512-HVQE3AAb/pxF8fQAoiqpvg9i3evqug3hoiwakOyZAwJm+6vZehbkYXZ0l4JxS+I3QxM97v5aaRNhj8v5oBhekw==}\n    engines: {node: '>=0.10'}\n\n  depd@1.1.2:\n    resolution: {integrity: sha512-7emPTl6Dpo6JRXOXjLRxck+FlLRX5847cLKEn00PLAgc3g2hTZZgr+e4c2v6QpSmLeFP3n5yUo7ft6avBK/5jQ==}\n    engines: {node: '>= 0.6'}\n\n  depd@2.0.0:\n    resolution: {integrity: sha512-g7nH6P6dyDioJogAAGprGpCtVImJhpPk/roCzdb3fIh61/s/nPsfR6onyMwkCAR/OlC3yBC0lESvUoQEAssIrw==}\n    engines: {node: '>= 0.8'}\n\n  dequal@2.0.3:\n    resolution: {integrity: sha512-0je+qPKHEMohvfRTCEo3CrPG6cAzAYgmzKyxRiYSSDkS6eGJdyVJm7WaYA5ECaAD9wLB2T4EEeymA5aFVcYXCA==}\n    engines: {node: '>=6'}\n\n  destr@2.0.3:\n    resolution: {integrity: sha512-2N3BOUU4gYMpTP24s5rF5iP7BDr7uNTCs4ozw3kf/eKfvWSIu93GEBi5m427YoyJoeOzQ5smuu4nNAPGb8idSQ==}\n\n  destroy@1.2.0:\n    resolution: {integrity: sha512-2sJGJTaXIIaR1w4iJSNoN0hnMY7Gpc/n8D4qSCJw8QqFWXf7cuAgnEHxBpweaVcPevC2l3KpjYCx3NypQQgaJg==}\n    engines: {node: '>= 0.8', npm: 1.2.8000 || >= 1.4.16}\n\n  detect-libc@1.0.3:\n    resolution: {integrity: sha512-pGjwhsmsp4kL2RTz08wcOlGN83otlqHeD/Z5T8GXZB+/YcpQ/dgo+lbU8ZsGxV0HIvqqxo9l7mqYwyYMD9bKDg==}\n    engines: {node: '>=0.10'}\n    hasBin: true\n\n  detect-libc@2.0.3:\n    resolution: {integrity: sha512-bwy0MGW55bG41VqxxypOsdSdGqLwXPI/focwgTYCFMbdUiBAxLg9CFzG08sz2aqzknwiX7Hkl0bQENjg8iLByw==}\n    engines: {node: '>=8'}\n\n  devalue@5.1.1:\n    resolution: {integrity: sha512-maua5KUiapvEwiEAe+XnlZ3Rh0GD+qI1J/nb9vrJc3muPXvcF/8gXYTWF76+5DAqHyDUtOIImEuo0YKE9mshVw==}\n\n  devlop@1.1.0:\n    resolution: {integrity: sha512-RWmIqhcFf1lRYBvNmr7qTNuyCt/7/ns2jbpp1+PalgE/rDQcBT0fioSMUpJ93irlUhC5hrg4cYqe6U+0ImW0rA==}\n\n  didyoumean@1.2.2:\n    resolution: {integrity: sha512-gxtyfqMg7GKyhQmb056K7M3xszy/myH8w+B4RT+QXBQsvAOdc3XymqDDPHx1BgPgsdAA5SIifona89YtRATDzw==}\n\n  diff@7.0.0:\n    resolution: {integrity: sha512-PJWHUb1RFevKCwaFA9RlG5tCd+FO5iRh9A8HEtkmBH2Li03iJriB6m6JIN4rGz3K3JLawI7/veA1xzRKP6ISBw==}\n    engines: {node: '>=0.3.1'}\n\n  dlv@1.1.3:\n    resolution: {integrity: sha512-+HlytyjlPKnIG8XuRG8WvmBP8xs8P71y+SKKS6ZXWoEgLuePxtDoUEiH7WkdePWrQ5JBpE6aoVqfZfJUQkjXwA==}\n\n  dom-serializer@2.0.0:\n    resolution: {integrity: sha512-wIkAryiqt/nV5EQKqQpo3SToSOV9J0DnbJqwK7Wv/Trc92zIAYZ4FlMu+JPFW1DfGFt81ZTCGgDEabffXeLyJg==}\n\n  domelementtype@2.3.0:\n    resolution: {integrity: sha512-OLETBj6w0OsagBwdXnPdN0cnMfF9opN69co+7ZrbfPGrdpPVNBUj02spi6B1N7wChLQiPn4CSH/zJvXw56gmHw==}\n\n  domhandler@5.0.3:\n    resolution: {integrity: sha512-cgwlv/1iFQiFnU96XXgROh8xTeetsnJiDsTc7TYCLFd9+/WNkIqPTxiM/8pSd8VIrhXGTf1Ny1q1hquVqDJB5w==}\n    engines: {node: '>= 4'}\n\n  domutils@3.1.0:\n    resolution: {integrity: sha512-H78uMmQtI2AhgDJjWeQmHwJJ2bLPD3GMmO7Zja/ZZh84wkm+4ut+IUnUdRa8uCGX88DiVx1j6FRe1XfxEgjEZA==}\n\n  dot-prop@8.0.2:\n    resolution: {integrity: sha512-xaBe6ZT4DHPkg0k4Ytbvn5xoxgpG0jOS1dYxSOwAHPuNLjP3/OzN0gH55SrLqpx8cBfSaVt91lXYkApjb+nYdQ==}\n    engines: {node: '>=16'}\n\n  dotenv@16.4.5:\n    resolution: {integrity: sha512-ZmdL2rui+eB2YwhsWzjInR8LldtZHGDoQ1ugH85ppHKwpUHL7j7rN0Ti9NCnGiQbhaZ11FpR+7ao1dNsmduNUg==}\n    engines: {node: '>=12'}\n\n  drizzle-kit@0.28.1:\n    resolution: {integrity: sha512-JimOV+ystXTWMgZkLHYHf2w3oS28hxiH1FR0dkmJLc7GHzdGJoJAQtQS5DRppnabsRZwE2U1F6CuezVBgmsBBQ==}\n    hasBin: true\n\n  drizzle-orm@0.36.4:\n    resolution: {integrity: sha512-1OZY3PXD7BR00Gl61UUOFihslDldfH4NFRH2MbP54Yxi0G/PKn4HfO65JYZ7c16DeP3SpM3Aw+VXVG9j6CRSXA==}\n    peerDependencies:\n      '@aws-sdk/client-rds-data': '>=3'\n      '@cloudflare/workers-types': '>=3'\n      '@electric-sql/pglite': '>=0.2.0'\n      '@libsql/client': '>=0.10.0'\n      '@libsql/client-wasm': '>=0.10.0'\n      '@neondatabase/serverless': '>=0.10.0'\n      '@op-engineering/op-sqlite': '>=2'\n      '@opentelemetry/api': ^1.4.1\n      '@planetscale/database': '>=1'\n      '@prisma/client': '*'\n      '@tidbcloud/serverless': '*'\n      '@types/better-sqlite3': '*'\n      '@types/pg': '*'\n      '@types/react': '>=18'\n      '@types/sql.js': '*'\n      '@vercel/postgres': '>=0.8.0'\n      '@xata.io/client': '*'\n      better-sqlite3: '>=7'\n      bun-types: '*'\n      expo-sqlite: '>=14.0.0'\n      knex: '*'\n      kysely: '*'\n      mysql2: '>=2'\n      pg: '>=8'\n      postgres: '>=3'\n      prisma: '*'\n      react: '>=18'\n      sql.js: '>=1'\n      sqlite3: '>=5'\n    peerDependenciesMeta:\n      '@aws-sdk/client-rds-data':\n        optional: true\n      '@cloudflare/workers-types':\n        optional: true\n      '@electric-sql/pglite':\n        optional: true\n      '@libsql/client':\n        optional: true\n      '@libsql/client-wasm':\n        optional: true\n      '@neondatabase/serverless':\n        optional: true\n      '@op-engineering/op-sqlite':\n        optional: true\n      '@opentelemetry/api':\n        optional: true\n      '@planetscale/database':\n        optional: true\n      '@prisma/client':\n        optional: true\n      '@tidbcloud/serverless':\n        optional: true\n      '@types/better-sqlite3':\n        optional: true\n      '@types/pg':\n        optional: true\n      '@types/react':\n        optional: true\n      '@types/sql.js':\n        optional: true\n      '@vercel/postgres':\n        optional: true\n      '@xata.io/client':\n        optional: true\n      better-sqlite3:\n        optional: true\n      bun-types:\n        optional: true\n      expo-sqlite:\n        optional: true\n      knex:\n        optional: true\n      kysely:\n        optional: true\n      mysql2:\n        optional: true\n      pg:\n        optional: true\n      postgres:\n        optional: true\n      prisma:\n        optional: true\n      react:\n        optional: true\n      sql.js:\n        optional: true\n      sqlite3:\n        optional: true\n\n  duplexer@0.1.2:\n    resolution: {integrity: sha512-jtD6YG370ZCIi/9GTaJKQxWTZD045+4R4hTk/x1UyoqadyJ9x9CgSi1RlVDQF8U2sxLLSnFkCaMihqljHIWgMg==}\n\n  eastasianwidth@0.2.0:\n    resolution: {integrity: sha512-I88TYZWc9XiYHRQ4/3c5rjjfgkjhLyW2luGIheGERbNQ6OY7yTybanSpDXZa8y7VUP9YmDcYa+eyq4ca7iLqWA==}\n\n  ee-first@1.1.1:\n    resolution: {integrity: sha512-WMwm9LhRUo+WUaRN+vRuETqG89IgZphVSNkdFgeb6sS/E4OrDIN7t48CAewSHXc6C8lefD8KKfr5vY61brQlow==}\n\n  ejs@3.1.9:\n    resolution: {integrity: sha512-rC+QVNMJWv+MtPgkt0y+0rVEIdbtxVADApW9JXrUVlzHetgcyczP/E7DJmWJ4fJCZF2cPcBk0laWO9ZHMG3DmQ==}\n    engines: {node: '>=0.10.0'}\n    hasBin: true\n\n  electron-to-chromium@1.5.36:\n    resolution: {integrity: sha512-HYTX8tKge/VNp6FGO+f/uVDmUkq+cEfcxYhKf15Akc4M5yxt5YmorwlAitKWjWhWQnKcDRBAQKXkhqqXMqcrjw==}\n\n  emoji-regex-xs@1.0.0:\n    resolution: {integrity: sha512-LRlerrMYoIDrT6jgpeZ2YYl/L8EulRTt5hQcYjy5AInh7HWXKimpqx68aknBFpGL2+/IcogTcaydJEgaTmOpDg==}\n\n  emoji-regex@8.0.0:\n    resolution: {integrity: sha512-MSjYzcWNOA0ewAHpz0MxpYFvwg6yjy1NG3xteoqz644VCo/RPgnr1/GGt+ic3iJTzQ8Eu3TdM14SawnVUmGE6A==}\n\n  emoji-regex@9.2.2:\n    resolution: {integrity: sha512-L18DaJsXSUk2+42pv8mLs5jJT2hqFkFE4j21wOmgbUqsZ2hL72NsUU785g9RXgo3s0ZNgVl42TiHp3ZtOv/Vyg==}\n\n  encodeurl@1.0.2:\n    resolution: {integrity: sha512-TPJXq8JqFaVYm2CWmPvnP2Iyo4ZSM7/QKcSmuMLDObfpH5fi7RUGmd/rTDf+rut/saiDiQEeVTNgAmJEdAOx0w==}\n    engines: {node: '>= 0.8'}\n\n  encodeurl@2.0.0:\n    resolution: {integrity: sha512-Q0n9HRi4m6JuGIV1eFlmvJB7ZEVxu93IrMyiMsGC0lrMJMWzRgx6WGquyfQgZVb31vhGgXnfmPNNXmxnOkRBrg==}\n    engines: {node: '>= 0.8'}\n\n  enhanced-resolve@5.17.1:\n    resolution: {integrity: sha512-LMHl3dXhTcfv8gM4kEzIUeTQ+7fpdA0l2tUf34BddXPkz2A5xJ5L/Pchd5BL6rdccM9QGvu0sWZzK1Z1t4wwyg==}\n    engines: {node: '>=10.13.0'}\n\n  entities@3.0.1:\n    resolution: {integrity: sha512-WiyBqoomrwMdFG1e0kqvASYfnlb0lp8M5o5Fw2OFq1hNZxxcNk8Ik0Xm7LxzBhuidnZB/UtBqVCgUz3kBOP51Q==}\n    engines: {node: '>=0.12'}\n\n  entities@4.5.0:\n    resolution: {integrity: sha512-V0hjH4dGPh9Ao5p0MoRY6BVqtwCjhz6vI5LT8AJ55H+4g9/4vbHx1I54fS0XuclLhDHArPQCiMjDxjaL8fPxhw==}\n    engines: {node: '>=0.12'}\n\n  error-stack-parser-es@0.1.5:\n    resolution: {integrity: sha512-xHku1X40RO+fO8yJ8Wh2f2rZWVjqyhb1zgq1yZ8aZRQkv6OOKhKWRUaht3eSCUbAOBaKIgM+ykwFLE+QUxgGeg==}\n\n  errx@0.1.0:\n    resolution: {integrity: sha512-fZmsRiDNv07K6s2KkKFTiD2aIvECa7++PKyD5NC32tpRw46qZA3sOz+aM+/V9V0GDHxVTKLziveV4JhzBHDp9Q==}\n\n  es-abstract@1.22.3:\n    resolution: {integrity: sha512-eiiY8HQeYfYH2Con2berK+To6GrK2RxbPawDkGq4UiCQQfZHb6wX9qQqkbpPqaxQFcl8d9QzZqo0tGE0VcrdwA==}\n    engines: {node: '>= 0.4'}\n\n  es-module-lexer@1.5.4:\n    resolution: {integrity: sha512-MVNK56NiMrOwitFB7cqDwq0CQutbw+0BvLshJSse0MUNU+y1FC3bUS/AQg7oUng+/wKrrki7JfmwtVHkVfPLlw==}\n\n  es-set-tostringtag@2.0.2:\n    resolution: {integrity: sha512-BuDyupZt65P9D2D2vA/zqcI3G5xRsklm5N3xCwuiy+/vKy8i0ifdsQP1sLgO4tZDSCaQUSnmC48khknGMV3D2Q==}\n    engines: {node: '>= 0.4'}\n\n  es-to-primitive@1.2.1:\n    resolution: {integrity: sha512-QCOllgZJtaUo9miYBcLChTUaHNjJF3PYs1VidD7AwiEj1kYxKeQTctLAezAOH5ZKRH0g2IgPn6KwB4IT8iRpvA==}\n    engines: {node: '>= 0.4'}\n\n  esbuild-register@3.6.0:\n    resolution: {integrity: sha512-H2/S7Pm8a9CL1uhp9OvjwrBh5Pvx0H8qVOxNu8Wed9Y7qv56MPtq+GGM8RJpq6glYJn9Wspr8uw7l55uyinNeg==}\n    peerDependencies:\n      esbuild: '>=0.12 <1'\n\n  esbuild@0.17.19:\n    resolution: {integrity: sha512-XQ0jAPFkK/u3LcVRcvVHQcTIqD6E2H1fvZMA5dQPSOWb3suUbWbfbRf94pjc0bNzRYLfIrDRQXr7X+LHIm5oHw==}\n    engines: {node: '>=12'}\n    hasBin: true\n\n  esbuild@0.18.20:\n    resolution: {integrity: sha512-ceqxoedUrcayh7Y7ZX6NdbbDzGROiyVBgC4PriJThBKSVPWnnFHZAkfI1lJT8QFkOwH4qOS2SJkS4wvpGl8BpA==}\n    engines: {node: '>=12'}\n    hasBin: true\n\n  esbuild@0.19.12:\n    resolution: {integrity: sha512-aARqgq8roFBj054KvQr5f1sFu0D65G+miZRCuJyJ0G13Zwx7vRar5Zhn2tkQNzIXcBrNVsv/8stehpj+GAjgbg==}\n    engines: {node: '>=12'}\n    hasBin: true\n\n  esbuild@0.20.2:\n    resolution: {integrity: sha512-WdOOppmUNU+IbZ0PaDiTst80zjnrOkyJNHoKupIcVyU8Lvla3Ugx94VzkQ32Ijqd7UhHJy75gNWDMUekcrSJ6g==}\n    engines: {node: '>=12'}\n    hasBin: true\n\n  esbuild@0.21.5:\n    resolution: {integrity: sha512-mg3OPMV4hXywwpoDxu3Qda5xCKQi+vCTZq8S9J/EpkhB2HzKXq4SNFZE3+NK93JYxc8VMSep+lOUSC/RVKaBqw==}\n    engines: {node: '>=12'}\n    hasBin: true\n\n  esbuild@0.23.1:\n    resolution: {integrity: sha512-VVNz/9Sa0bs5SELtn3f7qhJCDPCF5oMEl5cO9/SSinpE9hbPVvxbd572HH5AKiP7WD8INO53GgfDDhRjkylHEg==}\n    engines: {node: '>=18'}\n    hasBin: true\n\n  escalade@3.1.1:\n    resolution: {integrity: sha512-k0er2gUkLf8O0zKJiAhmkTnJlTvINGv7ygDNPbeIsX/TJjGJZHuh9B2UxbsaEkmlEo9MfhrSzmhIlhRlI2GXnw==}\n    engines: {node: '>=6'}\n\n  escalade@3.2.0:\n    resolution: {integrity: sha512-WUj2qlxaQtO4g6Pq5c29GTcWGDyd8itL8zTlipgECz3JesAiiOKotd8JU6otB3PACgG6xkJUyVhboMS+bje/jA==}\n    engines: {node: '>=6'}\n\n  escape-html@1.0.3:\n    resolution: {integrity: sha512-NiSupZ4OeuGwr68lGIeym/ksIZMJodUGOSCZ/FSnTxcrekbvqrgdUxlJOMpijaKZVjAJrWrGs/6Jy8OMuyj9ow==}\n\n  escape-string-regexp@1.0.5:\n    resolution: {integrity: sha512-vbRorB5FUQWvla16U8R/qgaFIya2qGzwDrNmCZuYKrbdSUMG6I1ZCGQRefkRVhuOkIGVne7BQ35DSfo1qvJqFg==}\n    engines: {node: '>=0.8.0'}\n\n  escape-string-regexp@4.0.0:\n    resolution: {integrity: sha512-TtpcNJ3XAzx3Gq8sWRzJaVajRs0uVxA2YAkdb1jm2YkPz4G6egUFAyA3n5vtEIZefPk5Wa4UXbKuS5fKkJWdgA==}\n    engines: {node: '>=10'}\n\n  escape-string-regexp@5.0.0:\n    resolution: {integrity: sha512-/veY75JbMK4j1yjvuUxuVsiS/hr/4iHs9FTT6cgTexxdE0Ly/glccBAkloH/DofkjRbZU3bnoj38mOmhkZ0lHw==}\n    engines: {node: '>=12'}\n\n  eslint-scope@5.1.1:\n    resolution: {integrity: sha512-2NxwbF/hZ0KpepYN0cNbo+FN6XoK7GaHlQhgx/hIZl6Va0bF45RQOOwhLIy8lQDbuCiadSLCBnH2CFYquit5bw==}\n    engines: {node: '>=8.0.0'}\n\n  esrecurse@4.3.0:\n    resolution: {integrity: sha512-KmfKL3b6G+RXvP8N1vr3Tq1kL/oCFgn2NYXEtqP8/L3pKapUA4G8cFVaoF3SU323CD4XypR/ffioHmkti6/Tag==}\n    engines: {node: '>=4.0'}\n\n  estraverse@4.3.0:\n    resolution: {integrity: sha512-39nnKffWz8xN1BU/2c79n9nB9HDzo0niYUqx6xyqUnyoAnQyyWpOTdZEeiCch8BBu515t4wp9ZmgVfVhn9EBpw==}\n    engines: {node: '>=4.0'}\n\n  estraverse@5.3.0:\n    resolution: {integrity: sha512-MMdARuVEQziNTeJD8DgMqmhwR11BRQ/cBP+pLtYdSTnf3MIO8fFeiINEbX36ZdNlfU/7A9f3gUw49B3oQsvwBA==}\n    engines: {node: '>=4.0'}\n\n  estree-walker@0.6.1:\n    resolution: {integrity: sha512-SqmZANLWS0mnatqbSfRP5g8OXZC12Fgg1IwNtLsyHDzJizORW4khDfjPqJZsemPWBB2uqykUah5YpQ6epsqC/w==}\n\n  estree-walker@1.0.1:\n    resolution: {integrity: sha512-1fMXF3YP4pZZVozF8j/ZLfvnR8NSIljt56UhbZ5PeeDmmGHpgpdwQt7ITlGvYaQukCvuBRMLEiKiYC+oeIg4cg==}\n\n  estree-walker@2.0.2:\n    resolution: {integrity: sha512-Rfkk/Mp/DL7JVje3u18FxFujQlTNR2q6QfMSMB7AvCBx91NGj/ba3kCfza0f6dVDbw7YlRf/nDrn7pQrCCyQ/w==}\n\n  estree-walker@3.0.3:\n    resolution: {integrity: sha512-7RUKfXgSMMkzt6ZuXmqapOurLGPPfgj6l9uRZ7lRGolvk0y2yocc35LdcxKC5PQZdn2DMqioAQ2NoWcrTKmm6g==}\n\n  esutils@2.0.3:\n    resolution: {integrity: sha512-kVscqXk4OCp68SZ0dkgEKVi6/8ij300KBWTJq32P/dYeWTSwK41WyTxalN1eRmA5Z9UU/LX9D7FWSmV9SAYx6g==}\n    engines: {node: '>=0.10.0'}\n\n  etag@1.8.1:\n    resolution: {integrity: sha512-aIL5Fx7mawVa300al2BnEE4iNvo1qETxLrPI/o05L7z6go7fCw1J6EQmbK4FmJ2AS7kgVF/KEZWufBfdClMcPg==}\n    engines: {node: '>= 0.6'}\n\n  event-target-shim@5.0.1:\n    resolution: {integrity: sha512-i/2XbnSz/uxRCU6+NdVJgKWDTM427+MqYbkQzD321DuCQJUqOuJKIA0IM2+W2xtYHdKOmZ4dR6fExsd4SXL+WQ==}\n    engines: {node: '>=6'}\n\n  events@3.3.0:\n    resolution: {integrity: sha512-mQw+2fkQbALzQ7V0MY0IqdnXNOeTtP4r0lN9z7AAawCXgqea7bDii20AYrIBrFd/Hx0M2Ocz6S111CaFkUcb0Q==}\n    engines: {node: '>=0.8.x'}\n\n  execa@7.2.0:\n    resolution: {integrity: sha512-UduyVP7TLB5IcAQl+OzLyLcS/l32W/GLg+AhHJ+ow40FOk2U3SAllPwR44v4vmdFwIWqpdwxxpQbF1n5ta9seA==}\n    engines: {node: ^14.18.0 || ^16.14.0 || >=18.0.0}\n\n  execa@8.0.1:\n    resolution: {integrity: sha512-VyhnebXciFV2DESc+p6B+y0LjSm0krU4OgJN44qFAhBY0TJ+1V61tYD2+wHusZ6F9n5K+vl8k0sTy7PEfV4qpg==}\n    engines: {node: '>=16.17'}\n\n  exit-hook@2.2.1:\n    resolution: {integrity: sha512-eNTPlAD67BmP31LDINZ3U7HSF8l57TxOY2PmBJ1shpCvpnxBF93mWCE8YHBnXs8qiUZJc9WDcWIeC3a2HIAMfw==}\n    engines: {node: '>=6'}\n\n  externality@1.0.2:\n    resolution: {integrity: sha512-LyExtJWKxtgVzmgtEHyQtLFpw1KFhQphF9nTG8TpAIVkiI/xQ3FJh75tRFLYl4hkn7BNIIdLJInuDAavX35pMw==}\n\n  fast-deep-equal@3.1.3:\n    resolution: {integrity: sha512-f3qQ9oQy9j2AhBe/H9VC91wLmKBCCU/gDOnKNAYG5hswO7BLKj09Hc5HYNz9cGI++xlpDCIgDaitVs03ATR84Q==}\n\n  fast-fifo@1.3.2:\n    resolution: {integrity: sha512-/d9sfos4yxzpwkDkuN7k2SqFKtYNmCTzgfEpz82x34IM9/zc8KGxQoXg1liNC/izpRM/MBdt44Nmx41ZWqk+FQ==}\n\n  fast-glob@3.3.2:\n    resolution: {integrity: sha512-oX2ruAFQwf/Orj8m737Y5adxDQO0LAB7/S5MnxCdTNDd4p6BsyIVsv9JQsATbTSq8KHRpLwIHbVlUNatxd+1Ow==}\n    engines: {node: '>=8.6.0'}\n\n  fast-json-stable-stringify@2.1.0:\n    resolution: {integrity: sha512-lhd/wF+Lk98HZoTCtlVraHtfh5XYijIjalXck7saUtuanSDyLMxnHhSXEDJqHxD7msR8D0uCmqlkwjCV8xvwHw==}\n\n  fast-npm-meta@0.2.2:\n    resolution: {integrity: sha512-E+fdxeaOQGo/CMWc9f4uHFfgUPJRAu7N3uB8GBvB3SDPAIWJK4GKyYhkAGFq+GYrcbKNfQIz5VVQyJnDuPPCrg==}\n\n  fastq@1.16.0:\n    resolution: {integrity: sha512-ifCoaXsDrsdkWTtiNJX5uzHDsrck5TzfKKDcuFFTIrrc/BS076qgEIfoIy1VeZqViznfKiysPYTh/QeHtnIsYA==}\n\n  fdir@6.4.0:\n    resolution: {integrity: sha512-3oB133prH1o4j/L5lLW7uOCF1PlD+/It2L0eL/iAqWMB91RBbqTewABqxhj0ibBd90EEmWZq7ntIWzVaWcXTGQ==}\n    peerDependencies:\n      picomatch: ^3 || ^4\n    peerDependenciesMeta:\n      picomatch:\n        optional: true\n\n  fdir@6.4.2:\n    resolution: {integrity: sha512-KnhMXsKSPZlAhp7+IjUkRZKPb4fUyccpDrdFXbi4QL1qkmFh9kVY09Yox+n4MaOb3lHZ1Tv829C3oaaXoMYPDQ==}\n    peerDependencies:\n      picomatch: ^3 || ^4\n    peerDependenciesMeta:\n      picomatch:\n        optional: true\n\n  fflate@0.8.2:\n    resolution: {integrity: sha512-cPJU47OaAoCbg0pBvzsgpTPhmhqI5eJjh/JIu8tPj5q+T7iLvW/JAYUqmE7KOB4R1ZyEhzBaIQpQpardBF5z8A==}\n\n  file-uri-to-path@1.0.0:\n    resolution: {integrity: sha512-0Zt+s3L7Vf1biwWZ29aARiVYLx7iMGnEUl9x33fbB/j3jR81u/O2LbqK+Bm1CDSNDKVtJ/YjwY7TUd5SkeLQLw==}\n\n  filelist@1.0.4:\n    resolution: {integrity: sha512-w1cEuf3S+DrLCQL7ET6kz+gmlJdbq9J7yXCSjK/OZCPA+qEN1WyF4ZAf0YYJa4/shHJra2t/d/r8SV4Ji+x+8Q==}\n\n  fill-range@7.0.1:\n    resolution: {integrity: sha512-qOo9F+dMUmC2Lcb4BbVvnKJxTPjCm+RRpe4gDuGrzkL7mEVl/djYSu2OdQ2Pa302N4oqkSg9ir6jaLWJ2USVpQ==}\n    engines: {node: '>=8'}\n\n  flatted@3.3.1:\n    resolution: {integrity: sha512-X8cqMLLie7KsNUDSdzeN8FYK9rEt4Dt67OsG/DNGnYTSDBG4uFAJFBnUeiV+zCVAvwFy56IjM9sH51jVaEhNxw==}\n\n  focus-trap@7.6.0:\n    resolution: {integrity: sha512-1td0l3pMkWJLFipobUcGaf+5DTY4PLDDrcqoSaKP8ediO/CoWCCYk/fT/Y2A4e6TNB+Sh6clRJCjOPPnKoNHnQ==}\n\n  for-each@0.3.3:\n    resolution: {integrity: sha512-jqYfLp7mo9vIyQf8ykW2v7A+2N4QjeCeI5+Dz9XraiO1ign81wjiH7Fb9vSOWvQfNtmSa4H2RoQTrrXivdUZmw==}\n\n  foreground-child@3.1.1:\n    resolution: {integrity: sha512-TMKDUnIte6bfb5nWv7V/caI169OHgvwjb7V4WkeUvbQQdjr5rWKqHFiKWb/fcOwB+CzBT+qbWjvj+DVwRskpIg==}\n    engines: {node: '>=14'}\n\n  fraction.js@4.3.7:\n    resolution: {integrity: sha512-ZsDfxO51wGAXREY55a7la9LScWpwv9RxIrYABrlvOFBlH/ShPnrtsXeuUIfXKKOVicNxQ+o8JTbJvjS4M89yew==}\n\n  fresh@0.5.2:\n    resolution: {integrity: sha512-zJ2mQYM18rEFOudeV4GShTGIQ7RbzA7ozbU9I/XBpm7kqgMywgmylMwXHxZJmkVoYkna9d2pVXVXPdYTP9ej8Q==}\n    engines: {node: '>= 0.6'}\n\n  fs-extra@11.2.0:\n    resolution: {integrity: sha512-PmDi3uwK5nFuXh7XDTlVnS17xJS7vW36is2+w3xcv8SVxiB4NyATf4ctkVY5bkSjX0Y4nbvZCq1/EjtEyr9ktw==}\n    engines: {node: '>=14.14'}\n\n  fs-extra@9.1.0:\n    resolution: {integrity: sha512-hcg3ZmepS30/7BSFqRvoo3DOMQu7IjqxO5nCDt+zM9XWjb33Wg7ziNT+Qvqbuc3+gWpzO02JubVyk2G4Zvo1OQ==}\n    engines: {node: '>=10'}\n\n  fs-minipass@2.1.0:\n    resolution: {integrity: sha512-V/JgOLFCS+R6Vcq0slCuaeWEdNC3ouDlJMNIsacH2VtALiu9mV4LPrHc5cDl8k5aw6J8jwgWWpiTo5RYhmIzvg==}\n    engines: {node: '>= 8'}\n\n  fs.realpath@1.0.0:\n    resolution: {integrity: sha512-OO0pH2lK6a0hZnAdau5ItzHPI6pUlvI7jMVnxUQRtw4owF2wk8lOSabtGDCTP4Ggrg2MbGnWO9X8K1t4+fGMDw==}\n\n  fsevents@2.3.3:\n    resolution: {integrity: sha512-5xoDfX+fL7faATnagmWPpbFtwh/R77WmMMqqHGS65C3vvB0YHrgF+B1YmZ3441tMj5n63k0212XNoJwzlhffQw==}\n    engines: {node: ^8.16.0 || ^10.6.0 || >=11.0.0}\n    os: [darwin]\n\n  function-bind@1.1.2:\n    resolution: {integrity: sha512-7XHNxH7qX9xG5mIwxkhumTox/MIRNcOgDrxWsMt2pAr23WHp6MrRlN7FBSFpCpr+oVO0F744iUgR82nJMfG2SA==}\n\n  function.prototype.name@1.1.6:\n    resolution: {integrity: sha512-Z5kx79swU5P27WEayXM1tBi5Ze/lbIyiNgU3qyXUOf9b2rgXYyF9Dy9Cx+IQv/Lc8WCG6L82zwUPpSS9hGehIg==}\n    engines: {node: '>= 0.4'}\n\n  functions-have-names@1.2.3:\n    resolution: {integrity: sha512-xckBUXyTIqT97tq2x2AMb+g163b5JFysYk0x4qxNFwbfQkmNZoiRHb6sPzI9/QV33WeuvVYBUIiD4NzNIyqaRQ==}\n\n  fuse.js@6.5.3:\n    resolution: {integrity: sha512-sA5etGE7yD/pOqivZRBvUBd/NaL2sjAu6QuSaFoe1H2BrJSkH/T/UXAJ8CdXdw7DvY3Hs8CXKYkDWX7RiP5KOg==}\n    engines: {node: '>=10'}\n\n  gauge@3.0.2:\n    resolution: {integrity: sha512-+5J6MS/5XksCuXq++uFRsnUd7Ovu1XenbeuIuNRJxYWjgQbPuFhT14lAvsWfqfAmnwluf1OwMjz39HjfLPci0Q==}\n    engines: {node: '>=10'}\n    deprecated: This package is no longer supported.\n\n  gensync@1.0.0-beta.2:\n    resolution: {integrity: sha512-3hN7NaskYvMDLQY55gnW3NQ+mesEAepTqlg+VEbj7zzqEMBVNhzcGYYeqFo/TlYz6eQiFcp1HcsCZO+nGgS8zg==}\n    engines: {node: '>=6.9.0'}\n\n  get-caller-file@2.0.5:\n    resolution: {integrity: sha512-DyFP3BM/3YHTQOCUL/w0OZHR0lpKeGrxotcHWcqNEdnltqFwXVfhEBQ94eIo34AfQpo0rGki4cyIiftY06h2Fg==}\n    engines: {node: 6.* || 8.* || >= 10.*}\n\n  get-intrinsic@1.2.2:\n    resolution: {integrity: sha512-0gSo4ml/0j98Y3lngkFEot/zhiCeWsbYIlZ+uZOVgzLyLaUw7wxUL+nCTP0XJvJg1AXulJRI3UJi8GsbDuxdGA==}\n\n  get-own-enumerable-property-symbols@3.0.2:\n    resolution: {integrity: sha512-I0UBV/XOz1XkIJHEUDMZAbzCThU/H8DxmSfmdGcKPnVhu2VfFqr34jr9777IyaTYvxjedWhqVIilEDsCdP5G6g==}\n\n  get-port-please@3.1.2:\n    resolution: {integrity: sha512-Gxc29eLs1fbn6LQ4jSU4vXjlwyZhF5HsGuMAa7gqBP4Rw4yxxltyDUuF5MBclFzDTXO+ACchGQoeela4DSfzdQ==}\n\n  get-source@2.0.12:\n    resolution: {integrity: sha512-X5+4+iD+HoSeEED+uwrQ07BOQr0kEDFMVqqpBuI+RaZBpBpHCuXxo70bjar6f0b0u/DQJsJ7ssurpP0V60Az+w==}\n\n  get-stream@6.0.1:\n    resolution: {integrity: sha512-ts6Wi+2j3jQjqi70w5AlN8DFnkSwC+MqmxEzdEALB2qXZYV3X/b1CTfgPLGJNMeAWxdPfU8FO1ms3NUfaHCPYg==}\n    engines: {node: '>=10'}\n\n  get-stream@8.0.1:\n    resolution: {integrity: sha512-VaUJspBffn/LMCJVoMvSAdmscJyS1auj5Zulnn5UoYcY531UWmdwhRWkcGKnGU93m5HSXP9LP2usOryrBtQowA==}\n    engines: {node: '>=16'}\n\n  get-symbol-description@1.0.0:\n    resolution: {integrity: sha512-2EmdH1YvIQiZpltCNgkuiUnyukzxM/R6NDJX31Ke3BG1Nq5b0S2PhX59UKi9vZpPDQVdqn+1IcaAwnzTT5vCjw==}\n    engines: {node: '>= 0.4'}\n\n  get-tsconfig@4.8.1:\n    resolution: {integrity: sha512-k9PN+cFBmaLWtVz29SkUoqU5O0slLuHJXt/2P+tMVFT+phsSGXGkp9t3rQIqdz0e+06EHNGs3oM6ZX1s2zHxRg==}\n\n  giget@1.2.3:\n    resolution: {integrity: sha512-8EHPljDvs7qKykr6uw8b+lqLiUc/vUg+KVTI0uND4s63TdsZM2Xus3mflvF0DDG9SiM4RlCkFGL+7aAjRmV7KA==}\n    hasBin: true\n\n  git-config-path@2.0.0:\n    resolution: {integrity: sha512-qc8h1KIQbJpp+241id3GuAtkdyJ+IK+LIVtkiFTRKRrmddDzs3SI9CvP1QYmWBFvm1I/PWRwj//of8bgAc0ltA==}\n    engines: {node: '>=4'}\n\n  git-up@7.0.0:\n    resolution: {integrity: sha512-ONdIrbBCFusq1Oy0sC71F5azx8bVkvtZtMJAsv+a6lz5YAmbNnLD6HAB4gptHZVLPR8S2/kVN6Gab7lryq5+lQ==}\n\n  git-url-parse@15.0.0:\n    resolution: {integrity: sha512-5reeBufLi+i4QD3ZFftcJs9jC26aULFLBU23FeKM/b1rI0K6ofIeAblmDVO7Ht22zTDE9+CkJ3ZVb0CgJmz3UQ==}\n\n  glob-parent@5.1.2:\n    resolution: {integrity: sha512-AOIgSQCepiJYwP3ARnGx+5VnTu2HBYdzbGP45eLw1vr3zB3vZLeyed1sC9hnbcOc9/SrMyM5RPQrkGz4aS9Zow==}\n    engines: {node: '>= 6'}\n\n  glob-parent@6.0.2:\n    resolution: {integrity: sha512-XxwI8EOhVQgWp6iDL+3b0r86f4d6AX6zSU55HfB4ydCEuXLXc5FcYeOu+nnGftS4TEju/11rt4KJPTMgbfmv4A==}\n    engines: {node: '>=10.13.0'}\n\n  glob-to-regexp@0.4.1:\n    resolution: {integrity: sha512-lkX1HJXwyMcprw/5YUZc2s7DrpAiHB21/V+E1rHUrVNokkvB6bqMzT0VfV6/86ZNabt1k14YOIaT7nDvOX3Iiw==}\n\n  glob@10.3.10:\n    resolution: {integrity: sha512-fa46+tv1Ak0UPK1TOy/pZrIybNNt4HCv7SDzwyfiOZkvZLEbjsZkJBPtDHVshZjbecAoAGSC20MjLDG/qr679g==}\n    engines: {node: '>=16 || 14 >=14.17'}\n    hasBin: true\n\n  glob@7.2.3:\n    resolution: {integrity: sha512-nFR0zLpU2YCaRxwoCJvL6UvCH2JFyFVIvwTLsIf21AuHlMskA1hhTdk+LlYJtOlYt9v6dvszD2BGRqBL+iQK9Q==}\n    deprecated: Glob versions prior to v9 are no longer supported\n\n  glob@8.1.0:\n    resolution: {integrity: sha512-r8hpEjiQEYlF2QU0df3dS+nxxSIreXQS1qRhMJM0Q5NDdR386C7jb7Hwwod8Fgiuex+k0GFjgft18yvxm5XoCQ==}\n    engines: {node: '>=12'}\n    deprecated: Glob versions prior to v9 are no longer supported\n\n  global-directory@4.0.1:\n    resolution: {integrity: sha512-wHTUcDUoZ1H5/0iVqEudYW4/kAlN5cZ3j/bXn0Dpbizl9iaUVeWSHqiOjsgk6OW2bkLclbBjzewBz6weQ1zA2Q==}\n    engines: {node: '>=18'}\n\n  globals@11.12.0:\n    resolution: {integrity: sha512-WOBp/EEGUiIsJSp7wcv/y6MO+lV9UoncWqxuFfm8eBwzWNgyfBd6Gz+IeKQ9jCmyhoH99g15M3T+QaVHFjizVA==}\n    engines: {node: '>=4'}\n\n  globalthis@1.0.3:\n    resolution: {integrity: sha512-sFdI5LyBiNTHjRd7cGPWapiHWMOXKyuBNX/cWJ3NfzrZQVa8GI/8cofCl74AOVqq9W5kNmguTIzJ/1s2gyI9wA==}\n    engines: {node: '>= 0.4'}\n\n  globby@14.0.2:\n    resolution: {integrity: sha512-s3Fq41ZVh7vbbe2PN3nrW7yC7U7MFVc5c98/iTl9c2GawNMKx/J648KQRW6WKkuU8GIbbh2IXfIRQjOZnXcTnw==}\n    engines: {node: '>=18'}\n\n  glur@1.1.2:\n    resolution: {integrity: sha512-l+8esYHTKOx2G/Aao4lEQ0bnHWg4fWtJbVoZZT9Knxi01pB8C80BR85nONLFwkkQoFRCmXY+BUcGZN3yZ2QsRA==}\n\n  gopd@1.0.1:\n    resolution: {integrity: sha512-d65bNlIadxvpb/A2abVdlqKqV563juRnZ1Wtk6s1sIR8uNsXR70xqIzVqxVf1eTqDunwT2MkczEeaezCKTZhwA==}\n\n  graceful-fs@4.2.11:\n    resolution: {integrity: sha512-RbJ5/jmFcNNCcDV5o9eTnBLJ/HszWV0P73bc+Ff4nS/rJj+YaS6IGyiOL0VoBYX+l1Wrl3k63h/KrH+nhJ0XvQ==}\n\n  gzip-size@6.0.0:\n    resolution: {integrity: sha512-ax7ZYomf6jqPTQ4+XCpUGyXKHk5WweS+e05MBO4/y3WJ5RkmPXNKvX+bx1behVILVwr6JSQvZAku021CHPXG3Q==}\n    engines: {node: '>=10'}\n\n  gzip-size@7.0.0:\n    resolution: {integrity: sha512-O1Ld7Dr+nqPnmGpdhzLmMTQ4vAsD+rHwMm1NLUmoUFFymBOMKxCCrtDxqdBRYXdeEPEi3SyoR4TizJLQrnKBNA==}\n    engines: {node: ^12.20.0 || ^14.13.1 || >=16.0.0}\n\n  h3@1.13.0:\n    resolution: {integrity: sha512-vFEAu/yf8UMUcB4s43OaDaigcqpQd14yanmOsn+NcRX3/guSKncyE2rOYhq8RIchgJrPSs/QiIddnTTR1ddiAg==}\n\n  has-bigints@1.0.2:\n    resolution: {integrity: sha512-tSvCKtBr9lkF0Ex0aQiP9N+OpV4zi2r/Nee5VkRDbaqv35RLYMzbwQfFSZZH0kR+Rd6302UJZ2p/bJCEoR3VoQ==}\n\n  has-flag@3.0.0:\n    resolution: {integrity: sha512-sKJf1+ceQBr4SMkvQnBDNDtf4TXpVhVGateu0t918bl30FnbE2m4vNLX+VWe/dpjlb+HugGYzW7uQXH98HPEYw==}\n    engines: {node: '>=4'}\n\n  has-flag@4.0.0:\n    resolution: {integrity: sha512-EykJT/Q1KjTWctppgIAgfSO0tKVuZUjhgMr17kqTumMl6Afv3EISleU7qZUzoXDFTAHTDC4NOoG/ZxU3EvlMPQ==}\n    engines: {node: '>=8'}\n\n  has-property-descriptors@1.0.1:\n    resolution: {integrity: sha512-VsX8eaIewvas0xnvinAe9bw4WfIeODpGYikiWYLH+dma0Jw6KHYqWiWfhQlgOVK8D6PvjubK5Uc4P0iIhIcNVg==}\n\n  has-proto@1.0.1:\n    resolution: {integrity: sha512-7qE+iP+O+bgF9clE5+UoBFzE65mlBiVj3tKCrlNQ0Ogwm0BjpT/gK4SlLYDMybDh5I3TCTKnPPa0oMG7JDYrhg==}\n    engines: {node: '>= 0.4'}\n\n  has-symbols@1.0.3:\n    resolution: {integrity: sha512-l3LCuF6MgDNwTDKkdYGEihYjt5pRPbEg46rtlmnSPlUbgmB8LOIrKJbYYFBSbnPaJexMKtiPO8hmeRjRz2Td+A==}\n    engines: {node: '>= 0.4'}\n\n  has-tostringtag@1.0.0:\n    resolution: {integrity: sha512-kFjcSNhnlGV1kyoGk7OXKSawH5JOb/LzUc5w9B02hOTO0dfFRjbHQKvg1d6cf3HbeUmtU9VbbV3qzZ2Teh97WQ==}\n    engines: {node: '>= 0.4'}\n\n  has-unicode@2.0.1:\n    resolution: {integrity: sha512-8Rf9Y83NBReMnx0gFzA8JImQACstCYWUplepDa9xprwwtmgEZUF0h/i5xSA625zB/I37EtrswSST6OXxwaaIJQ==}\n\n  hash-sum@2.0.0:\n    resolution: {integrity: sha512-WdZTbAByD+pHfl/g9QSsBIIwy8IT+EsPiKDs0KNX+zSHhdDLFKdZu0BQHljvO+0QI/BasbMSUa8wYNCZTvhslg==}\n\n  hasown@2.0.0:\n    resolution: {integrity: sha512-vUptKVTpIJhcczKBbgnS+RtcuYMB8+oNzPK2/Hp3hanz8JmpATdmmgLgSaadVREkDm+e2giHwY3ZRkyjSIDDFA==}\n    engines: {node: '>= 0.4'}\n\n  hast-util-to-html@9.0.3:\n    resolution: {integrity: sha512-M17uBDzMJ9RPCqLMO92gNNUDuBSq10a25SDBI08iCCxmorf4Yy6sYHK57n9WAbRAAaU+DuR4W6GN9K4DFZesYg==}\n\n  hast-util-whitespace@3.0.0:\n    resolution: {integrity: sha512-88JUN06ipLwsnv+dVn+OIYOvAuvBMy/Qoi6O7mQHxdPXpjy+Cd6xRkWwux7DKO+4sYILtLBRIKgsdpS2gQc7qw==}\n\n  he@1.2.0:\n    resolution: {integrity: sha512-F/1DnUGPopORZi0ni+CvrCgHQ5FyEAHRLSApuYWMmrbSwoN2Mn/7k+Gl38gJnR7yyDZk6WLXwiGod1JOWNDKGw==}\n    hasBin: true\n\n  hookable@5.5.3:\n    resolution: {integrity: sha512-Yc+BQe8SvoXH1643Qez1zqLRmbA5rCL+sSmk6TVos0LWVfNIB7PGncdlId77WzLGSIB5KaWgTaNTs2lNVEI6VQ==}\n\n  html-tags@3.3.1:\n    resolution: {integrity: sha512-ztqyC3kLto0e9WbNp0aeP+M3kTt+nbaIveGmUxAtZa+8iFgKLUOD4YKM5j+f3QD89bra7UeumolZHKuOXnTmeQ==}\n    engines: {node: '>=8'}\n\n  html-void-elements@3.0.0:\n    resolution: {integrity: sha512-bEqo66MRXsUGxWHV5IP0PUiAWwoEjba4VCzg0LjFJBpchPaTfyfCKTG6bc5F8ucKec3q5y6qOdGyYTSBEvhCrg==}\n\n  http-assert@1.5.0:\n    resolution: {integrity: sha512-uPpH7OKX4H25hBmU6G1jWNaqJGpTXxey+YOUizJUAgu0AjLUeC8D73hTrhvDS5D+GJN1DN1+hhc/eF/wpxtp0w==}\n    engines: {node: '>= 0.8'}\n\n  http-errors@1.6.3:\n    resolution: {integrity: sha512-lks+lVC8dgGyh97jxvxeYTWQFvh4uw4yC12gVl63Cg30sjPX4wuGcdkICVXDAESr6OJGjqGA8Iz5mkeN6zlD7A==}\n    engines: {node: '>= 0.6'}\n\n  http-errors@1.8.1:\n    resolution: {integrity: sha512-Kpk9Sm7NmI+RHhnj6OIWDI1d6fIoFAtFt9RLaTMRlg/8w49juAStsrBgp0Dp4OdxdVbRIeKhtCUvoi/RuAhO4g==}\n    engines: {node: '>= 0.6'}\n\n  http-errors@2.0.0:\n    resolution: {integrity: sha512-FtwrG/euBzaEjYeRqOgly7G0qviiXoJWnvEH2Z1plBdXgbyjv34pHTSb9zoeHMyDy33+DWy5Wt9Wo+TURtOYSQ==}\n    engines: {node: '>= 0.8'}\n\n  http-shutdown@1.2.2:\n    resolution: {integrity: sha512-S9wWkJ/VSY9/k4qcjG318bqJNruzE4HySUhFYknwmu6LBP97KLLfwNf+n4V1BHurvFNkSKLFnK/RsuUnRTf9Vw==}\n    engines: {iojs: '>= 1.0.0', node: '>= 0.12.0'}\n\n  https-proxy-agent@5.0.1:\n    resolution: {integrity: sha512-dFcAjpTQFgoLMzC2VwU+C/CbS7uRL0lWmxDITmqm7C+7F0Odmj6s9l6alZc6AELXhrnggM2CeWSXHGOdX2YtwA==}\n    engines: {node: '>= 6'}\n\n  httpxy@0.1.5:\n    resolution: {integrity: sha512-hqLDO+rfststuyEUTWObQK6zHEEmZ/kaIP2/zclGGZn6X8h/ESTWg+WKecQ/e5k4nPswjzZD+q2VqZIbr15CoQ==}\n\n  human-signals@4.3.1:\n    resolution: {integrity: sha512-nZXjEF2nbo7lIw3mgYjItAfgQXog3OjJogSbKa2CQIIvSGWcKgeJnQlNXip6NglNzYH45nSRiEVimMvYL8DDqQ==}\n    engines: {node: '>=14.18.0'}\n\n  human-signals@5.0.0:\n    resolution: {integrity: sha512-AXcZb6vzzrFAUE61HnN4mpLqd/cSIwNQjtNWR0euPm6y0iqx3G4gOXaIDdtdDwZmhwe82LA6+zinmW4UBWVePQ==}\n    engines: {node: '>=16.17.0'}\n\n  idb@7.1.1:\n    resolution: {integrity: sha512-gchesWBzyvGHRO9W8tzUWFDycow5gwjvFKfyV9FF32Y7F50yZMp7mP+T2mJIWFx49zicqyC4uefHM17o6xKIVQ==}\n\n  ieee754@1.2.1:\n    resolution: {integrity: sha512-dcyqhDvX1C46lXZcVqCpK+FtMRQVdIMN6/Df5js2zouUsqG7I6sFxitIC+7KYK29KdXOLHdu9zL4sFnoVQnqaA==}\n\n  ignore@5.3.2:\n    resolution: {integrity: sha512-hsBTNUqQTDwkWtcdYI2i06Y/nUBEsNEDJKjWdigLvegy8kDuJAS8uRlpkkcQpyEXL0Z/pjDy5HBmMjRCJ2gq+g==}\n    engines: {node: '>= 4'}\n\n  ignore@6.0.2:\n    resolution: {integrity: sha512-InwqeHHN2XpumIkMvpl/DCJVrAHgCsG5+cn1XlnLWGwtZBm8QJfSusItfrwx81CTp5agNZqpKU2J/ccC5nGT4A==}\n    engines: {node: '>= 4'}\n\n  image-meta@0.2.1:\n    resolution: {integrity: sha512-K6acvFaelNxx8wc2VjbIzXKDVB0Khs0QT35U6NkGfTdCmjLNcO2945m7RFNR9/RPVFm48hq7QPzK8uGH18HCGw==}\n\n  importx@0.4.4:\n    resolution: {integrity: sha512-Lo1pukzAREqrBnnHC+tj+lreMTAvyxtkKsMxLY8H15M/bvLl54p3YuoTI70Tz7Il0AsgSlD7Lrk/FaApRcBL7w==}\n\n  impound@0.1.0:\n    resolution: {integrity: sha512-F9nJgOsDc3tysjN74edE0vGPEQrU7DAje6g5nNAL5Jc9Tv4JW3mH7XMGne+EaadTniDXLeUrVR21opkNfWO1zQ==}\n\n  inflight@1.0.6:\n    resolution: {integrity: sha512-k92I/b08q4wvFscXCLvqfsHCrjrF7yiXsQuIVvVE7N82W3+aqpzuUdBbfhWcy/FZR3/4IgflMgKLOsvPDrGCJA==}\n    deprecated: This module is not supported, and leaks memory. Do not use it. Check out lru-cache if you want a good and tested way to coalesce async requests by a key value, which is much more comprehensive and powerful.\n\n  inherits@2.0.3:\n    resolution: {integrity: sha512-x00IRNXNy63jwGkJmzPigoySHbaqpNuzKbBOmzK+g2OdZpQ9w+sxCN+VSB3ja7IAge2OP2qpfxTjeNcyjmW1uw==}\n\n  inherits@2.0.4:\n    resolution: {integrity: sha512-k/vGaX4/Yla3WzyMCvTQOXYeIHvqOKtnqBduzTHpzpQZzAskKMhZ2K+EnBiSM9zGSoIFeMpXKxa4dYeZIQqewQ==}\n\n  ini@1.3.8:\n    resolution: {integrity: sha512-JV/yugV2uzW5iMRSiZAyDtQd+nxtUnjeLt0acNdw98kKLrvuRVyB80tsREOE7yvGVgalhZ6RNXCmEHkUKBKxew==}\n\n  ini@4.1.1:\n    resolution: {integrity: sha512-QQnnxNyfvmHFIsj7gkPcYymR8Jdw/o7mp5ZFihxn6h8Ci6fh3Dx4E1gPjpQEpIuPo9XVNY/ZUwh4BPMjGyL01g==}\n    engines: {node: ^14.17.0 || ^16.13.0 || >=18.0.0}\n\n  internal-slot@1.0.6:\n    resolution: {integrity: sha512-Xj6dv+PsbtwyPpEflsejS+oIZxmMlV44zAhG479uYu89MsjcYOhCFnNyKrkJrihbsiasQyY0afoCl/9BLR65bg==}\n    engines: {node: '>= 0.4'}\n\n  ioredis@5.4.1:\n    resolution: {integrity: sha512-2YZsvl7jopIa1gaePkeMtd9rAcSjOOjPtpcLlOeusyO+XH2SK5ZcT+UCrElPP+WVIInh2TzeI4XW9ENaSLVVHA==}\n    engines: {node: '>=12.22.0'}\n\n  iron-webcrypto@1.2.1:\n    resolution: {integrity: sha512-feOM6FaSr6rEABp/eDfVseKyTMDt+KGpeB35SkVn9Tyn0CqvVsY3EwI0v5i8nMHyJnzCIQf7nsy3p41TPkJZhg==}\n\n  is-array-buffer@3.0.2:\n    resolution: {integrity: sha512-y+FyyR/w8vfIRq4eQcM1EYgSTnmHXPqaF+IgzgraytCFq5Xh8lllDVmAZolPJiZttZLeFSINPYMaEJ7/vWUa1w==}\n\n  is-bigint@1.0.4:\n    resolution: {integrity: sha512-zB9CruMamjym81i2JZ3UMn54PKGsQzsJeo6xvN3HJJ4CAsQNB6iRutp2To77OfCNuoxspsIhzaPoO1zyCEhFOg==}\n\n  is-binary-path@2.1.0:\n    resolution: {integrity: sha512-ZMERYes6pDydyuGidse7OsHxtbI7WVeUEozgR/g7rd0xUimYNlvZRE/K2MgZTjWy725IfelLeVcEM97mmtRGXw==}\n    engines: {node: '>=8'}\n\n  is-boolean-object@1.1.2:\n    resolution: {integrity: sha512-gDYaKHJmnj4aWxyj6YHyXVpdQawtVLHU5cb+eztPGczf6cjuTdwve5ZIEfgXqH4e57An1D1AKf8CZ3kYrQRqYA==}\n    engines: {node: '>= 0.4'}\n\n  is-callable@1.2.7:\n    resolution: {integrity: sha512-1BC0BVFhS/p0qtw6enp8e+8OD0UrK0oFLztSjNzhcKA3WDuJxxAPXzPuPtKkjEY9UUoEWlX/8fgKeu2S8i9JTA==}\n    engines: {node: '>= 0.4'}\n\n  is-core-module@2.13.1:\n    resolution: {integrity: sha512-hHrIjvZsftOsvKSn2TRYl63zvxsgE0K+0mYMoH6gD4omR5IWB2KynivBQczo3+wF1cCkjzvptnI9Q0sPU66ilw==}\n\n  is-date-object@1.0.5:\n    resolution: {integrity: sha512-9YQaSxsAiSwcvS33MBk3wTCVnWK+HhF8VZR2jRxehM16QcVOdHqPn4VPHmRK4lSr38n9JriurInLcP90xsYNfQ==}\n    engines: {node: '>= 0.4'}\n\n  is-docker@2.2.1:\n    resolution: {integrity: sha512-F+i2BKsFrH66iaUFc0woD8sLy8getkwTwtOBjvs56Cx4CgJDeKQeqfz8wAYiSb8JOprWhHH5p77PbmYCvvUuXQ==}\n    engines: {node: '>=8'}\n    hasBin: true\n\n  is-docker@3.0.0:\n    resolution: {integrity: sha512-eljcgEDlEns/7AXFosB5K/2nCM4P7FQPkGc/DWLy5rmFEWvZayGrik1d9/QIY5nJ4f9YsVvBkA6kJpHn9rISdQ==}\n    engines: {node: ^12.20.0 || ^14.13.1 || >=16.0.0}\n    hasBin: true\n\n  is-extglob@2.1.1:\n    resolution: {integrity: sha512-SbKbANkN603Vi4jEZv49LeVJMn4yGwsbzZworEoyEiutsN3nJYdbO36zfhGJ6QEDpOZIFkDtnq5JRxmvl3jsoQ==}\n    engines: {node: '>=0.10.0'}\n\n  is-fullwidth-code-point@3.0.0:\n    resolution: {integrity: sha512-zymm5+u+sCsSWyD9qNaejV3DFvhCKclKdizYaJUuHA83RLjb7nSuGnddCHGv0hk+KY7BMAlsWeK4Ueg6EV6XQg==}\n    engines: {node: '>=8'}\n\n  is-generator-function@1.0.10:\n    resolution: {integrity: sha512-jsEjy9l3yiXEQ+PsXdmBwEPcOxaXWLspKdplFUVI9vq1iZgIekeC0L167qeu86czQaxed3q/Uzuw0swL0irL8A==}\n    engines: {node: '>= 0.4'}\n\n  is-glob@4.0.3:\n    resolution: {integrity: sha512-xelSayHH36ZgE7ZWhli7pW34hNbNl8Ojv5KVmkJD4hBdD3th8Tfk9vYasLM+mXWOZhFkgZfxhLSnrwRr4elSSg==}\n    engines: {node: '>=0.10.0'}\n\n  is-inside-container@1.0.0:\n    resolution: {integrity: sha512-KIYLCCJghfHZxqjYBE7rEy0OBuTd5xCHS7tHVgvCLkx7StIoaxwNW3hCALgEUjFfeRk+MG/Qxmp/vtETEF3tRA==}\n    engines: {node: '>=14.16'}\n    hasBin: true\n\n  is-installed-globally@1.0.0:\n    resolution: {integrity: sha512-K55T22lfpQ63N4KEN57jZUAaAYqYHEe8veb/TycJRk9DdSCLLcovXz/mL6mOnhQaZsQGwPhuFopdQIlqGSEjiQ==}\n    engines: {node: '>=18'}\n\n  is-module@1.0.0:\n    resolution: {integrity: sha512-51ypPSPCoTEIN9dy5Oy+h4pShgJmPCygKfyRCISBI+JoWT/2oJvK8QPxmwv7b/p239jXrm9M1mlQbyKJ5A152g==}\n\n  is-negative-zero@2.0.2:\n    resolution: {integrity: sha512-dqJvarLawXsFbNDeJW7zAz8ItJ9cd28YufuuFzh0G8pNHjJMnY08Dv7sYX2uF5UpQOwieAeOExEYAWWfu7ZZUA==}\n    engines: {node: '>= 0.4'}\n\n  is-number-object@1.0.7:\n    resolution: {integrity: sha512-k1U0IRzLMo7ZlYIfzRu23Oh6MiIFasgpb9X76eqfFZAqwH44UI4KTBvBYIZ1dSL9ZzChTB9ShHfLkR4pdW5krQ==}\n    engines: {node: '>= 0.4'}\n\n  is-number@7.0.0:\n    resolution: {integrity: sha512-41Cifkg6e8TylSpdtTpeLVMqvSBEVzTttHvERD741+pnZ8ANv0004MRL43QKPDlK9cGvNp6NZWZUBlbGXYxxng==}\n    engines: {node: '>=0.12.0'}\n\n  is-obj@1.0.1:\n    resolution: {integrity: sha512-l4RyHgRqGN4Y3+9JHVrNqO+tN0rV5My76uW5/nuO4K1b6vw5G8d/cmFjP9tRfEsdhZNt0IFdZuK/c2Vr4Nb+Qg==}\n    engines: {node: '>=0.10.0'}\n\n  is-path-inside@4.0.0:\n    resolution: {integrity: sha512-lJJV/5dYS+RcL8uQdBDW9c9uWFLLBNRyFhnAKXw5tVqLlKZ4RMGZKv+YQ/IA3OhD+RpbJa1LLFM1FQPGyIXvOA==}\n    engines: {node: '>=12'}\n\n  is-reference@1.2.1:\n    resolution: {integrity: sha512-U82MsXXiFIrjCK4otLT+o2NA2Cd2g5MLoOVXUZjIOhLurrRxpEXzI8O0KZHr3IjLvlAH1kTPYSuqer5T9ZVBKQ==}\n\n  is-regex@1.1.4:\n    resolution: {integrity: sha512-kvRdxDsxZjhzUX07ZnLydzS1TU/TJlTUHHY4YLL87e37oUA49DfkLqgy+VjFocowy29cKvcSiu+kIv728jTTVg==}\n    engines: {node: '>= 0.4'}\n\n  is-regexp@1.0.0:\n    resolution: {integrity: sha512-7zjFAPO4/gwyQAAgRRmqeEeyIICSdmCqa3tsVHMdBzaXXRiqopZL4Cyghg/XulGWrtABTpbnYYzzIRffLkP4oA==}\n    engines: {node: '>=0.10.0'}\n\n  is-shared-array-buffer@1.0.2:\n    resolution: {integrity: sha512-sqN2UDu1/0y6uvXyStCOzyhAjCSlHceFoMKJW8W9EU9cvic/QdsZ0kEU93HEy3IUEFZIiH/3w+AH/UQbPHNdhA==}\n\n  is-ssh@1.4.0:\n    resolution: {integrity: sha512-x7+VxdxOdlV3CYpjvRLBv5Lo9OJerlYanjwFrPR9fuGPjCiNiCzFgAWpiLAohSbsnH4ZAys3SBh+hq5rJosxUQ==}\n\n  is-stream@2.0.1:\n    resolution: {integrity: sha512-hFoiJiTl63nn+kstHGBtewWSKnQLpyb155KHheA1l39uvtO9nWIop1p3udqPcUd/xbF1VLMO4n7OI6p7RbngDg==}\n    engines: {node: '>=8'}\n\n  is-stream@3.0.0:\n    resolution: {integrity: sha512-LnQR4bZ9IADDRSkvpqMGvt/tEJWclzklNgSw48V5EAaAeDd6qGvN8ei6k5p0tvxSR171VmGyHuTiAOfxAbr8kA==}\n    engines: {node: ^12.20.0 || ^14.13.1 || >=16.0.0}\n\n  is-string@1.0.7:\n    resolution: {integrity: sha512-tE2UXzivje6ofPW7l23cjDOMa09gb7xlAqG6jG5ej6uPV32TlWP3NKPigtaGeHNu9fohccRYvIiZMfOOnOYUtg==}\n    engines: {node: '>= 0.4'}\n\n  is-symbol@1.0.4:\n    resolution: {integrity: sha512-C/CPBqKWnvdcxqIARxyOh4v1UUEOCHpgDa0WYgpKDFMszcrPcffg5uhwSgPCLD2WWxmq6isisz87tzT01tuGhg==}\n    engines: {node: '>= 0.4'}\n\n  is-typed-array@1.1.12:\n    resolution: {integrity: sha512-Z14TF2JNG8Lss5/HMqt0//T9JeHXttXy5pH/DBU4vi98ozO2btxzq9MwYDZYnKwU8nRsz/+GVFVRDq3DkVuSPg==}\n    engines: {node: '>= 0.4'}\n\n  is-weakref@1.0.2:\n    resolution: {integrity: sha512-qctsuLZmIQ0+vSSMfoVvyFe2+GSEvnmZ2ezTup1SBse9+twCCeial6EEi3Nc2KFcf6+qz2FBPnjXsk8xhKSaPQ==}\n\n  is-what@4.1.16:\n    resolution: {integrity: sha512-ZhMwEosbFJkA0YhFnNDgTM4ZxDRsS6HqTo7qsZM08fehyRYIYa0yHu5R6mgo1n/8MgaPBXiPimPD77baVFYg+A==}\n    engines: {node: '>=12.13'}\n\n  is-wsl@2.2.0:\n    resolution: {integrity: sha512-fKzAra0rGJUUBwGBgNkHZuToZcn+TtXHpeCgmkMJMMYx1sQDYaCSyjJBSCa2nH1DGm7s3n1oBnohoVTBaN7Lww==}\n    engines: {node: '>=8'}\n\n  is-wsl@3.1.0:\n    resolution: {integrity: sha512-UcVfVfaK4Sc4m7X3dUSoHoozQGBEFeDC+zVo06t98xe8CzHSZZBekNXH+tu0NalHolcJ/QAGqS46Hef7QXBIMw==}\n    engines: {node: '>=16'}\n\n  is64bit@2.0.0:\n    resolution: {integrity: sha512-jv+8jaWCl0g2lSBkNSVXdzfBA0npK1HGC2KtWM9FumFRoGS94g3NbCCLVnCYHLjp4GrW2KZeeSTMo5ddtznmGw==}\n    engines: {node: '>=18'}\n\n  isarray@1.0.0:\n    resolution: {integrity: sha512-VLghIWNM6ELQzo7zwmcg0NmTVyWKYjvIeM83yjp0wRDTmUnrM678fQbcKBo6n2CJEF0szoG//ytg+TKla89ALQ==}\n\n  isarray@2.0.5:\n    resolution: {integrity: sha512-xHjhDr3cNBK0BzdUJSPXZntQUx/mwMS5Rw4A7lPJ90XGAO6ISP/ePDNuo0vhqOZU+UD5JoodwCAAoZQd3FeAKw==}\n\n  isexe@2.0.0:\n    resolution: {integrity: sha512-RHxMLp9lnKHGHRng9QFhRCMbYAcVpn69smSGcq3f36xjgVVWThj4qqLbTLlq7Ssj8B+fIQ1EuCEGI2lKsyQeIw==}\n\n  itty-time@1.0.6:\n    resolution: {integrity: sha512-+P8IZaLLBtFv8hCkIjcymZOp4UJ+xW6bSlQsXGqrkmJh7vSiMFSlNne0mCYagEE0N7HDNR5jJBRxwN0oYv61Rw==}\n\n  jackspeak@2.3.6:\n    resolution: {integrity: sha512-N3yCS/NegsOBokc8GAdM8UcmfsKiSS8cipheD/nivzr700H+nsMOxJjQnvwOcRYVuFkdH0wGUvW2WbXGmrZGbQ==}\n    engines: {node: '>=14'}\n\n  jake@10.8.7:\n    resolution: {integrity: sha512-ZDi3aP+fG/LchyBzUM804VjddnwfSfsdeYkwt8NcbKRvo4rFkjhs456iLFn3k2ZUWvNe4i48WACDbza8fhq2+w==}\n    engines: {node: '>=10'}\n    hasBin: true\n\n  jest-worker@26.6.2:\n    resolution: {integrity: sha512-KWYVV1c4i+jbMpaBC+U++4Va0cp8OisU185o73T1vo99hqi7w8tSJfUXYswwqqrjzwxa6KpRK54WhPvwf5w6PQ==}\n    engines: {node: '>= 10.13.0'}\n\n  jest-worker@27.5.1:\n    resolution: {integrity: sha512-7vuh85V5cdDofPyxn58nrPjBktZo0u9x1g8WtjQol+jZDaE+fhN+cIvTj11GndBnMnyfrUOG1sZQxCdjKh+DKg==}\n    engines: {node: '>= 10.13.0'}\n\n  jiti@1.21.0:\n    resolution: {integrity: sha512-gFqAIbuKyyso/3G2qhiO2OM6shY6EPP/R0+mkDbyspxKazh8BXDC5FiFsUjlczgdNz/vfra0da2y+aHrusLG/Q==}\n    hasBin: true\n\n  jiti@1.21.6:\n    resolution: {integrity: sha512-2yTgeWTWzMWkHu6Jp9NKgePDaYHbntiwvYuuJLbbN9vl7DC9DvXKOB2BC3ZZ92D3cvV/aflH0osDfwpHepQ53w==}\n    hasBin: true\n\n  jiti@2.0.0-beta.3:\n    resolution: {integrity: sha512-pmfRbVRs/7khFrSAYnSiJ8C0D5GvzkE4Ey2pAvUcJsw1ly/p+7ut27jbJrjY79BpAJQJ4gXYFtK6d1Aub+9baQ==}\n    hasBin: true\n\n  jiti@2.3.3:\n    resolution: {integrity: sha512-EX4oNDwcXSivPrw2qKH2LB5PoFxEvgtv2JgwW0bU858HoLQ+kutSvjLMUqBd0PeJYEinLWhoI9Ol0eYMqj/wNQ==}\n    hasBin: true\n\n  jiti@2.4.1:\n    resolution: {integrity: sha512-yPBThwecp1wS9DmoA4x4KR2h3QoslacnDR8ypuFM962kI4/456Iy1oHx2RAgh4jfZNdn0bctsdadceiBUgpU1g==}\n    hasBin: true\n\n  js-tokens@4.0.0:\n    resolution: {integrity: sha512-RdJUflcE3cUzKiMqQgsCu06FPu9UdIJO0beYbPhHN4k6apgJtifcoCtT9bcxOpYBtpD2kCM6Sbzg4CausW/PKQ==}\n\n  js-tokens@9.0.0:\n    resolution: {integrity: sha512-WriZw1luRMlmV3LGJaR6QOJjWwgLUTf89OwT2lUOyjX2dJGBwgmIkbcz+7WFZjrZM635JOIR517++e/67CP9dQ==}\n\n  js-tokens@9.0.1:\n    resolution: {integrity: sha512-mxa9E9ITFOt0ban3j6L5MpjwegGz6lBQmM1IJkWeBZGcMxto50+eWdjC/52xDbS2vy0k7vIMK0Fe2wfL9OQSpQ==}\n\n  js-yaml@4.1.0:\n    resolution: {integrity: sha512-wpxZs9NoxZaJESJGIZTyDEaYpl0FKSA+FB9aJiyemKhMwkxQg63h4T1KJgUGHpTqPDNRcmmYLugrRjJlBtWvRA==}\n    hasBin: true\n\n  jsesc@0.5.0:\n    resolution: {integrity: sha512-uZz5UnB7u4T9LvwmFqXii7pZSouaRPorGs5who1Ip7VO0wxanFvBL7GkM6dTHlgX+jhBApRetaWpnDabOeTcnA==}\n    hasBin: true\n\n  jsesc@2.5.2:\n    resolution: {integrity: sha512-OYu7XEzjkCQ3C5Ps3QIZsQfNpqoJyZZA99wd9aWd05NCtC5pWOkShK2mkL6HXQR6/Cy2lbNdPlZBpuQHXE63gA==}\n    engines: {node: '>=4'}\n    hasBin: true\n\n  jsesc@3.0.2:\n    resolution: {integrity: sha512-xKqzzWXDttJuOcawBt4KnKHHIf5oQ/Cxax+0PWFG+DFDgHNAdi+TXECADI+RYiFUMmx8792xsMbbgXj4CwnP4g==}\n    engines: {node: '>=6'}\n    hasBin: true\n\n  json-parse-even-better-errors@2.3.1:\n    resolution: {integrity: sha512-xyFwyhro/JEof6Ghe2iz2NcXoj2sloNsWr/XsERDK/oiPCfaNhl5ONfp+jQdAZRQQ0IJWNzH9zIZF7li91kh2w==}\n\n  json-schema-traverse@0.4.1:\n    resolution: {integrity: sha512-xbbCH5dCYU5T8LcEhhuh7HJ88HXuW3qsI3Y0zOZFKfZEHcpWiHU/Jxzk629Brsab/mMiHQti9wMP+845RPe3Vg==}\n\n  json-schema-traverse@1.0.0:\n    resolution: {integrity: sha512-NM8/P9n3XjXhIZn1lLhkFaACTOURQXjWhV4BA/RnOv8xvgqtqpAX9IO4mRQxSx1Rlo4tqzeqb0sOlruaOy3dug==}\n\n  json-schema@0.4.0:\n    resolution: {integrity: sha512-es94M3nTIfsEPisRafak+HDLfHXnKBhV3vU5eqPcS3flIWqcxJWgXHXiey3YrpaNsanY5ei1VoYEbOzijuq9BA==}\n\n  json5@2.2.3:\n    resolution: {integrity: sha512-XmOWe7eyHYH14cLdVPoyg+GOH3rYX++KpzrylJwSW98t3Nk+U8XOl8FWKOgwtzdb8lXGf6zYwDUzeHMWfxasyg==}\n    engines: {node: '>=6'}\n    hasBin: true\n\n  jsonc-parser@3.2.0:\n    resolution: {integrity: sha512-gfFQZrcTc8CnKXp6Y4/CBT3fTc0OVuDofpre4aEeEpSBPV5X5v4+Vmx+8snU7RLPrNHPKSgLxGo9YuQzz20o+w==}\n\n  jsonfile@6.1.0:\n    resolution: {integrity: sha512-5dgndWOriYSm5cnYaJNhalLNDKOqFwyDB/rr1E9ZsGciGvKPs8R2xYGCacuf3z6K1YKDz182fd+fY3cn3pMqXQ==}\n\n  jsonpointer@5.0.1:\n    resolution: {integrity: sha512-p/nXbhSEcu3pZRdkW1OfJhpsVtW1gd4Wa1fnQc9YLiTfAjn0312eMKimbdIQzuZl9aa9xUGaRlP9T/CJE/ditQ==}\n    engines: {node: '>=0.10.0'}\n\n  keygrip@1.1.0:\n    resolution: {integrity: sha512-iYSchDJ+liQ8iwbSI2QqsQOvqv58eJCEanyJPJi+Khyu8smkcKSFUCbPwzFcL7YVtZ6eONjqRX/38caJ7QjRAQ==}\n    engines: {node: '>= 0.6'}\n\n  kleur@3.0.3:\n    resolution: {integrity: sha512-eTIzlVOSUR+JxdDFepEYcBMtZ9Qqdef+rnzWdRZuMbOywu5tO2w2N7rqjoANZ5k9vywhL6Br1VRjUIgTQx4E8w==}\n    engines: {node: '>=6'}\n\n  klona@2.0.6:\n    resolution: {integrity: sha512-dhG34DXATL5hSxJbIexCft8FChFXtmskoZYnoPWjXQuebWYCNkVeV3KkGegCK9CP1oswI/vQibS2GY7Em/sJJA==}\n    engines: {node: '>= 8'}\n\n  knitwork@1.1.0:\n    resolution: {integrity: sha512-oHnmiBUVHz1V+URE77PNot2lv3QiYU2zQf1JjOVkMt3YDKGbu8NAFr+c4mcNOhdsGrB/VpVbRwPwhiXrPhxQbw==}\n\n  koa-compose@4.1.0:\n    resolution: {integrity: sha512-8ODW8TrDuMYvXRwra/Kh7/rJo9BtOfPc6qO8eAfC80CnCvSjSl0bkRM24X6/XBBEyj0v1nRUQ1LyOy3dbqOWXw==}\n\n  koa-convert@2.0.0:\n    resolution: {integrity: sha512-asOvN6bFlSnxewce2e/DK3p4tltyfC4VM7ZwuTuepI7dEQVcvpyFuBcEARu1+Hxg8DIwytce2n7jrZtRlPrARA==}\n    engines: {node: '>= 10'}\n\n  koa-send@5.0.1:\n    resolution: {integrity: sha512-tmcyQ/wXXuxpDxyNXv5yNNkdAMdFRqwtegBXUaowiQzUKqJehttS0x2j0eOZDQAyloAth5w6wwBImnFzkUz3pQ==}\n    engines: {node: '>= 8'}\n\n  koa-static@5.0.0:\n    resolution: {integrity: sha512-UqyYyH5YEXaJrf9S8E23GoJFQZXkBVJ9zYYMPGz919MSX1KuvAcycIuS0ci150HCoPf4XQVhQ84Qf8xRPWxFaQ==}\n    engines: {node: '>= 7.6.0'}\n\n  koa@2.15.3:\n    resolution: {integrity: sha512-j/8tY9j5t+GVMLeioLaxweJiKUayFhlGqNTzf2ZGwL0ZCQijd2RLHK0SLW5Tsko8YyyqCZC2cojIb0/s62qTAg==}\n    engines: {node: ^4.8.4 || ^6.10.1 || ^7.10.1 || >= 8.1.4}\n\n  kolorist@1.8.0:\n    resolution: {integrity: sha512-Y+60/zizpJ3HRH8DCss+q95yr6145JXZo46OTpFvDZWLfRCE4qChOyk1b26nMaNpfHHgxagk9dXT5OP0Tfe+dQ==}\n\n  launch-editor@2.9.1:\n    resolution: {integrity: sha512-Gcnl4Bd+hRO9P9icCP/RVVT2o8SFlPXofuCxvA2SaZuH45whSvf5p8x5oih5ftLiVhEI4sp5xDY+R+b3zJBh5w==}\n\n  lazystream@1.0.1:\n    resolution: {integrity: sha512-b94GiNHQNy6JNTrt5w6zNyffMrNkXZb3KTkCZJb2V1xaEGCk093vkZ2jk3tpaeP33/OiXC+WvK9AxUebnf5nbw==}\n    engines: {node: '>= 0.6.3'}\n\n  leven@3.1.0:\n    resolution: {integrity: sha512-qsda+H8jTaUaN/x5vzW2rzc+8Rw4TAQ/4KjB46IwK5VH+IlVeeeje/EoZRpiXvIqjFgK84QffqPztGI3VBLG1A==}\n    engines: {node: '>=6'}\n\n  lilconfig@2.1.0:\n    resolution: {integrity: sha512-utWOt/GHzuUxnLKxB6dk81RoOeoNeHgbrXiuGk4yyF5qlRz+iIVWu56E2fqGHFrXz0QNUhLB/8nKqvRH66JKGQ==}\n    engines: {node: '>=10'}\n\n  lilconfig@3.0.0:\n    resolution: {integrity: sha512-K2U4W2Ff5ibV7j7ydLr+zLAkIg5JJ4lPn1Ltsdt+Tz/IjQ8buJ55pZAxoP34lqIiwtF9iAvtLv3JGv7CAyAg+g==}\n    engines: {node: '>=14'}\n\n  lilconfig@3.1.2:\n    resolution: {integrity: sha512-eop+wDAvpItUys0FWkHIKeC9ybYrTGbU41U5K7+bttZZeohvnY7M9dZ5kB21GNWiFT2q1OoPTvncPCgSOVO5ow==}\n    engines: {node: '>=14'}\n\n  lines-and-columns@1.2.4:\n    resolution: {integrity: sha512-7ylylesZQ/PV29jhEDl3Ufjo6ZX7gCqJr5F7PKrqc93v7fzSymt1BpwEU8nAUXs8qzzvqhbjhK5QZg6Mt/HkBg==}\n\n  linkify-it@4.0.1:\n    resolution: {integrity: sha512-C7bfi1UZmoj8+PQx22XyeXCuBlokoyWQL5pWSP+EI6nzRylyThouddufc2c1NDIcP9k5agmN9fLpA7VNJfIiqw==}\n\n  linkify-it@5.0.0:\n    resolution: {integrity: sha512-5aHCbzQRADcdP+ATqnDuhhJ/MRIqDkZX5pyjFHRRysS8vZ5AbqGEoFIb6pYHPZ+L/OC2Lc+xT8uHVVR5CAK/wQ==}\n\n  listhen@1.9.0:\n    resolution: {integrity: sha512-I8oW2+QL5KJo8zXNWX046M134WchxsXC7SawLPvRQpogCbkyQIaFxPE89A2HiwR7vAK2Dm2ERBAmyjTYGYEpBg==}\n    hasBin: true\n\n  load-tsconfig@0.2.5:\n    resolution: {integrity: sha512-IXO6OCs9yg8tMKzfPZ1YmheJbZCiEsnBdcB03l0OcfK9prKnJb96siuHCr5Fl37/yo9DnKU+TLpxzTUspw9shg==}\n    engines: {node: ^12.20.0 || ^14.13.1 || >=16.0.0}\n\n  loader-runner@4.3.0:\n    resolution: {integrity: sha512-3R/1M+yS3j5ou80Me59j7F9IMs4PXs3VqRrm0TU3AbKPxlmpoY1TNscJV/oGJXo8qCatFGTfDbY6W6ipGOYXfg==}\n    engines: {node: '>=6.11.5'}\n\n  local-pkg@0.5.0:\n    resolution: {integrity: sha512-ok6z3qlYyCDS4ZEU27HaU6x/xZa9Whf8jD4ptH5UZTQYZVYeb9bnZ3ojVhiJNLiXK1Hfc0GNbLXcmZ5plLDDBg==}\n    engines: {node: '>=14'}\n\n  local-pkg@0.5.1:\n    resolution: {integrity: sha512-9rrA30MRRP3gBD3HTGnC6cDFpaE1kVDWxWgqWJUN0RvDNAo+Nz/9GxB+nHOH0ifbVFy0hSA1V6vFDvnx54lTEQ==}\n    engines: {node: '>=14'}\n\n  lodash.castarray@4.4.0:\n    resolution: {integrity: sha512-aVx8ztPv7/2ULbArGJ2Y42bG1mEQ5mGjpdvrbJcJFU3TbYybe+QlLS4pst9zV52ymy2in1KpFPiZnAOATxD4+Q==}\n\n  lodash.debounce@4.0.8:\n    resolution: {integrity: sha512-FT1yDzDYEoYWhnSGnpE/4Kj1fLZkDFyqRb7fNt6FdYOSxlUWAtp42Eh6Wb0rGIv/m9Bgo7x4GhQbm5Ys4SG5ow==}\n\n  lodash.defaults@4.2.0:\n    resolution: {integrity: sha512-qjxPLHd3r5DnsdGacqOMU6pb/avJzdh9tFX2ymgoZE27BmjXrNy/y4LoaiTeAb+O3gL8AfpJGtqfX/ae2leYYQ==}\n\n  lodash.isarguments@3.1.0:\n    resolution: {integrity: sha512-chi4NHZlZqZD18a0imDHnZPrDeBbTtVN7GXMwuGdRH9qotxAjYs3aVLKc7zNOG9eddR5Ksd8rvFEBc9SsggPpg==}\n\n  lodash.isplainobject@4.0.6:\n    resolution: {integrity: sha512-oSXzaWypCMHkPC3NvBEaPHf0KsA5mvPrOPgQWDsbg8n7orZ290M0BmC/jgRZ4vcJ6DTAhjrsSYgdsW/F+MFOBA==}\n\n  lodash.memoize@4.1.2:\n    resolution: {integrity: sha512-t7j+NzmgnQzTAYXcsHYLgimltOV1MXHtlOWf6GjL9Kj8GK5FInw5JotxvbOs+IvV1/Dzo04/fCGfLVs7aXb4Ag==}\n\n  lodash.merge@4.6.2:\n    resolution: {integrity: sha512-0KpjqXRVvrYyCsX1swR/XTK0va6VQkQM6MNo7PqW77ByjAhoARA8EfrP1N4+KlKj8YS0ZUCtRT/YUuhyYDujIQ==}\n\n  lodash.sortby@4.7.0:\n    resolution: {integrity: sha512-HDWXG8isMntAyRF5vZ7xKuEvOhT4AhlRt/3czTSjvGUxjYCBVRQY48ViDHyfYz9VIoBkW4TMGQNapx+l3RUwdA==}\n\n  lodash.uniq@4.5.0:\n    resolution: {integrity: sha512-xfBaXQd9ryd9dlSDvnvI0lvxfLJlYAZzXomUYzLKtUeOQvOP5piqAWuGtrhWeqaXK9hhoM/iyJc5AV+XfsX3HQ==}\n\n  lodash@4.17.21:\n    resolution: {integrity: sha512-v2kDEe57lecTulaDIuNTPy3Ry4gLGJ6Z1O3vE1krgXZNrsQ+LFTGHVxVjcXPs17LhbZVGedAJv8XZ1tvj5FvSg==}\n\n  lru-cache@10.4.3:\n    resolution: {integrity: sha512-JNAzZcXrCt42VGLuYz0zfAzDfAvJWW6AfYlDBQyDV5DClI2m5sAmK+OIO7s59XfsRsWHp02jAJrRadPRGTt6SQ==}\n\n  lru-cache@5.1.1:\n    resolution: {integrity: sha512-KpNARQA3Iwv+jTA0utUVVbrh+Jlrr1Fv0e56GGzAFOXN7dk/FviaDW8LHmK52DlcH4WP2n6gI8vN1aesBFgo9w==}\n\n  lru-cache@6.0.0:\n    resolution: {integrity: sha512-Jo6dJ04CmSjuznwJSS3pUeWmd/H0ffTlkXXgwZi+eq1UCmqQwCh+eLsYOYCwY991i2Fah4h1BEMCx4qThGbsiA==}\n    engines: {node: '>=10'}\n\n  magic-string-ast@0.6.2:\n    resolution: {integrity: sha512-oN3Bcd7ZVt+0VGEs7402qR/tjgjbM7kPlH/z7ufJnzTLVBzXJITRHOJiwMmmYMgZfdoWQsfQcY+iKlxiBppnMA==}\n    engines: {node: '>=16.14.0'}\n\n  magic-string@0.25.9:\n    resolution: {integrity: sha512-RmF0AsMzgt25qzqqLc1+MbHmhdx0ojF2Fvs4XnOqz2ZOBXzzkEwc/dJQZCYHAn7v1jbVOjAZfK8msRn4BxO4VQ==}\n\n  magic-string@0.30.12:\n    resolution: {integrity: sha512-Ea8I3sQMVXr8JhN4z+H/d8zwo+tYDgHE9+5G4Wnrwhs0gaK9fXTKx0Tw5Xwsd/bCPTTZNRAdpyzvoeORe9LYpw==}\n\n  magic-string@0.30.14:\n    resolution: {integrity: sha512-5c99P1WKTed11ZC0HMJOj6CDIue6F8ySu+bJL+85q1zBEIY8IklrJ1eiKC2NDRh3Ct3FcvmJPyQHb9erXMTJNw==}\n\n  magicast@0.3.5:\n    resolution: {integrity: sha512-L0WhttDl+2BOsybvEOLK7fW3UA0OQ0IQ2d6Zl2x/a6vVRs3bAY0ECOSHHeL5jD+SbOpOCUEi0y1DgHEn9Qn1AQ==}\n\n  make-dir@3.1.0:\n    resolution: {integrity: sha512-g3FeP20LNwhALb/6Cz6Dd4F2ngze0jz7tbzrD2wAV+o9FeNHe4rL+yK2md0J/fiSf1sa1ADhXqi5+oVwOM/eGw==}\n    engines: {node: '>=8'}\n\n  markdown-it@13.0.2:\n    resolution: {integrity: sha512-FtwnEuuK+2yVU7goGn/MJ0WBZMM9ZPgU9spqlFs7/A/pDIUNSOQZhUgOqYCficIuR2QaFnrt8LHqBWsbTAoI5w==}\n    hasBin: true\n\n  markdown-it@14.1.0:\n    resolution: {integrity: sha512-a54IwgWPaeBCAAsv13YgmALOF1elABB08FxO9i+r4VFk5Vl4pKokRPeX8u5TCgSsPi6ec1otfLjdOpVcgbpshg==}\n    hasBin: true\n\n  mdast-util-to-hast@13.2.0:\n    resolution: {integrity: sha512-QGYKEuUsYT9ykKBCMOEDLsU5JRObWQusAolFMeko/tYPufNkRffBAQjIE+99jbA87xv6FgmjLtwjh9wBWajwAA==}\n\n  mdn-data@2.0.28:\n    resolution: {integrity: sha512-aylIc7Z9y4yzHYAJNuESG3hfhC+0Ibp/MAMiaOZgNv4pmEdFyfZhhhny4MNiAfWdBQ1RQ2mfDWmM1x8SvGyp8g==}\n\n  mdn-data@2.0.30:\n    resolution: {integrity: sha512-GaqWWShW4kv/G9IEucWScBx9G1/vsFZZJUO+tD26M8J8z3Kw5RDQjaoZe03YAClgeS/SWPOcb4nkFBTEi5DUEA==}\n\n  mdurl@1.0.1:\n    resolution: {integrity: sha512-/sKlQJCBYVY9Ers9hqzKou4H6V5UWc/M59TH2dvkt+84itfnq7uFOMLpOiOS4ujvHP4etln18fmIxA5R5fll0g==}\n\n  mdurl@2.0.0:\n    resolution: {integrity: sha512-Lf+9+2r+Tdp5wXDXC4PcIBjTDtq4UKjCPMQhKIuzpJNW0b96kVqSwW0bT7FhRSfmAiFYgP+SCRvdrDozfh0U5w==}\n\n  media-typer@0.3.0:\n    resolution: {integrity: sha512-dq+qelQ9akHpcOl/gUVRTxVIOkAJ1wR3QAvb4RsVjS8oVoFjDGTc679wJYmUmknUF5HwMLOgb5O+a3KxfWapPQ==}\n    engines: {node: '>= 0.6'}\n\n  merge-stream@2.0.0:\n    resolution: {integrity: sha512-abv/qOcuPfk3URPfDzmZU1LKmuw8kT+0nIHvKrKgFrwifol/doWcdA4ZqsWQ8ENrFKkd67Mfpo/LovbIUsbt3w==}\n\n  merge2@1.4.1:\n    resolution: {integrity: sha512-8q7VEgMJW4J8tcfVPy8g09NcQwZdbwFEqhe/WZkoIzjn/3TGDwtOCYtXGxA3O8tPzpczCCDgv+P2P5y00ZJOOg==}\n    engines: {node: '>= 8'}\n\n  methods@1.1.2:\n    resolution: {integrity: sha512-iclAHeNqNm68zFtnZ0e+1L2yUIdvzNoauKU4WBA3VvH/vPFieF7qfRlwUZU+DA9P9bPXIS90ulxoUoCH23sV2w==}\n    engines: {node: '>= 0.6'}\n\n  micromark-util-character@2.1.0:\n    resolution: {integrity: sha512-KvOVV+X1yLBfs9dCBSopq/+G1PcgT3lAK07mC4BzXi5E7ahzMAF8oIupDDJ6mievI6F+lAATkbQQlQixJfT3aQ==}\n\n  micromark-util-encode@2.0.0:\n    resolution: {integrity: sha512-pS+ROfCXAGLWCOc8egcBvT0kf27GoWMqtdarNfDcjb6YLuV5cM3ioG45Ys2qOVqeqSbjaKg72vU+Wby3eddPsA==}\n\n  micromark-util-sanitize-uri@2.0.0:\n    resolution: {integrity: sha512-WhYv5UEcZrbAtlsnPuChHUAsu/iBPOVaEVsntLBIdpibO0ddy8OzavZz3iL2xVvBZOpolujSliP65Kq0/7KIYw==}\n\n  micromark-util-symbol@2.0.0:\n    resolution: {integrity: sha512-8JZt9ElZ5kyTnO94muPxIGS8oyElRJaiJO8EzV6ZSyGQ1Is8xwl4Q45qU5UOg+bGH4AikWziz0iN4sFLWs8PGw==}\n\n  micromark-util-types@2.0.0:\n    resolution: {integrity: sha512-oNh6S2WMHWRZrmutsRmDDfkzKtxF+bc2VxLC9dvtrDIRFln627VsFP6fLMgTryGDljgLPjkrzQSDcPrjPyDJ5w==}\n\n  micromatch@4.0.5:\n    resolution: {integrity: sha512-DMy+ERcEW2q8Z2Po+WNXuw3c5YaUSFjAO5GsJqfEl7UjvtIuFKO6ZrKvcItdy98dwFI2N1tg3zNIdKaQT+aNdA==}\n    engines: {node: '>=8.6'}\n\n  mime-db@1.52.0:\n    resolution: {integrity: sha512-sPU4uV7dYlvtWJxwwxHD0PuihVNiE7TyAbQ5SWxDCB9mUYvOgroQOwYQQOKPJ8CIbE+1ETVlOoK1UC2nU3gYvg==}\n    engines: {node: '>= 0.6'}\n\n  mime-types@2.1.35:\n    resolution: {integrity: sha512-ZDY+bPm5zTTF+YpCrAU9nK0UgICYPT0QtT1NZWFv4s++TNkcgVaT0g6+4R2uI4MjQjzysHB1zxuWL50hzaeXiw==}\n    engines: {node: '>= 0.6'}\n\n  mime@1.6.0:\n    resolution: {integrity: sha512-x0Vn8spI+wuJ1O6S7gnbaQg8Pxh4NNHb7KSINmEWKiPE4RKOplvijn+NkmYmmRgP68mc70j2EbeTFRsrswaQeg==}\n    engines: {node: '>=4'}\n    hasBin: true\n\n  mime@3.0.0:\n    resolution: {integrity: sha512-jSCU7/VB1loIWBZe14aEYHU/+1UMEHoaO7qxCOVJOw9GgH72VAWppxNcjU+x9a2k3GSIBXNKxXQFqRvvZ7vr3A==}\n    engines: {node: '>=10.0.0'}\n    hasBin: true\n\n  mime@4.0.4:\n    resolution: {integrity: sha512-v8yqInVjhXyqP6+Kw4fV3ZzeMRqEW6FotRsKXjRS5VMTNIuXsdRoAvklpoRgSqXm6o9VNH4/C0mgedko9DdLsQ==}\n    engines: {node: '>=16'}\n    hasBin: true\n\n  mimic-fn@4.0.0:\n    resolution: {integrity: sha512-vqiC06CuhBTUdZH+RYl8sFrL096vA45Ok5ISO6sE/Mr1jRbGH4Csnhi8f3wKVl7x8mO4Au7Ir9D3Oyv1VYMFJw==}\n    engines: {node: '>=12'}\n\n  miniflare@3.20241106.1:\n    resolution: {integrity: sha512-dM3RBlJE8rUFxnqlPCaFCq0E7qQqEQvKbYX7W/APGCK+rLcyLmEBzC4GQR/niXdNM/oV6gdg9AA50ghnn2ALuw==}\n    engines: {node: '>=16.13'}\n    hasBin: true\n\n  minimatch@3.1.2:\n    resolution: {integrity: sha512-J7p63hRiAjw1NDEww1W7i37+ByIrOWO5XQQAzZ3VOcL0PNybwpfmV/N05zFAzwQ9USyEcX6t3UO+K5aqBQOIHw==}\n\n  minimatch@5.1.6:\n    resolution: {integrity: sha512-lKwV/1brpG6mBUFHtb7NUmtABCb2WZZmm2wNiOA5hAb8VdCS4B3dtMWyvcoViccwAW/COERjXLt0zP1zXUN26g==}\n    engines: {node: '>=10'}\n\n  minimatch@9.0.3:\n    resolution: {integrity: sha512-RHiac9mvaRw0x3AYRgDC1CxAP7HTcNrrECeA8YYJeWnpo+2Q5CegtZjaotWTWxDG3UeGA1coE05iH1mPjT/2mg==}\n    engines: {node: '>=16 || 14 >=14.17'}\n\n  minimatch@9.0.5:\n    resolution: {integrity: sha512-G6T0ZX48xgozx7587koeX9Ys2NYy6Gmv//P89sEte9V9whIapMNF4idKxnW2QtCcLiTWlb/wfCabAtAFWhhBow==}\n    engines: {node: '>=16 || 14 >=14.17'}\n\n  minimist@1.2.8:\n    resolution: {integrity: sha512-2yyAR8qBkN3YuheJanUpWC5U3bb5osDywNB8RzDVlDwDHbocAJveqqj1u8+SVD7jkWT4yvsHCpWqqWqAxb0zCA==}\n\n  minipass@3.3.6:\n    resolution: {integrity: sha512-DxiNidxSEK+tHG6zOIklvNOwm3hvCrbUrdtzY74U6HKTJxvIDfOUL5W5P2Ghd3DTkhhKPYGqeNUIh5qcM4YBfw==}\n    engines: {node: '>=8'}\n\n  minipass@5.0.0:\n    resolution: {integrity: sha512-3FnjYuehv9k6ovOEbyOswadCDPX1piCfhV8ncmYtHOjuPwylVWsghTLo7rabjC3Rx5xD4HDx8Wm1xnMF7S5qFQ==}\n    engines: {node: '>=8'}\n\n  minipass@7.0.4:\n    resolution: {integrity: sha512-jYofLM5Dam9279rdkWzqHozUo4ybjdZmCsDHePy5V/PbBcVMiSZR97gmAy45aqi8CK1lG2ECd356FU86avfwUQ==}\n    engines: {node: '>=16 || 14 >=14.17'}\n\n  minizlib@2.1.2:\n    resolution: {integrity: sha512-bAxsR8BVfj60DWXHE3u30oHzfl4G7khkSuPW+qvpd7jFRHm7dLxOjUk1EHACJ/hxLY8phGJ0YhYHZo7jil7Qdg==}\n    engines: {node: '>= 8'}\n\n  mitt@3.0.1:\n    resolution: {integrity: sha512-vKivATfr97l2/QBCYAkXYDbrIWPM2IIKEl7YPhjCvKlG3kE2gm+uBo6nEXK3M5/Ffh/FLpKExzOQ3JJoJGFKBw==}\n\n  mkdirp@0.5.6:\n    resolution: {integrity: sha512-FP+p8RB8OWpF3YZBCrP5gtADmtXApB5AMLn+vdyA+PyxCjrCs00mjyUozssO33cwDeT3wNGdLxJ5M//YqtHAJw==}\n    hasBin: true\n\n  mkdirp@1.0.4:\n    resolution: {integrity: sha512-vVqVZQyf3WLx2Shd0qJ9xuvqgAyKPLAiqITEtqW0oIUjzo3PePDd6fW9iFz30ef7Ysp/oiWqbhszeGWW2T6Gzw==}\n    engines: {node: '>=10'}\n    hasBin: true\n\n  mlly@1.4.2:\n    resolution: {integrity: sha512-i/Ykufi2t1EZ6NaPLdfnZk2AX8cs0d+mTzVKuPfqPKPatxLApaBoxJQ9x1/uckXtrS/U5oisPMDkNs0yQTaBRg==}\n\n  mlly@1.7.2:\n    resolution: {integrity: sha512-tN3dvVHYVz4DhSXinXIk7u9syPYaJvio118uomkovAtWBT+RdbP6Lfh/5Lvo519YMmwBafwlh20IPTXIStscpA==}\n\n  mlly@1.7.3:\n    resolution: {integrity: sha512-xUsx5n/mN0uQf4V548PKQ+YShA4/IW0KI1dZhrNrPCLG+xizETbHTkOa1f8/xut9JRPp8kQuMnz0oqwkTiLo/A==}\n\n  modern-screenshot@4.4.39:\n    resolution: {integrity: sha512-p+I4yLZUDnoJMa5zoi+71nLQmoLQ6WRU4W8vZu1BZk2PlIYOz5mGnj9/7t2lGWKYeOr4zo6pajhY0/9TS5Zcdw==}\n\n  mp4-muxer@2.3.0:\n    resolution: {integrity: sha512-eupg1QMfcVJy/nZ2smUbC4OcEKdKBaLxKe+oeoDlklB5Dkb+4mv4CdPVYtzo1ZnzBKuVCclDk/znQwFQJIC32g==}\n\n  mri@1.2.0:\n    resolution: {integrity: sha512-tzzskb3bG8LvYGFF/mDTpq3jpI6Q9wc3LEmBaghu+DdCssd1FakN7Bc0hVNmEyGq1bq3RgfkCb3cmQLpNPOroA==}\n    engines: {node: '>=4'}\n\n  mrmime@2.0.0:\n    resolution: {integrity: sha512-eu38+hdgojoyq63s+yTpN4XMBdt5l8HhMhc4VKLO9KM5caLIBvUm4thi7fFaxyTmCKeNnXZ5pAlBwCUnhA09uw==}\n    engines: {node: '>=10'}\n\n  ms@2.0.0:\n    resolution: {integrity: sha512-Tpp60P6IUJDTuOq/5Z8cdskzJujfwqfOTkrwIwj7IRISpnkJnT6SyJ4PCPnGMoFjC9ddhal5KVIYtAt97ix05A==}\n\n  ms@2.1.3:\n    resolution: {integrity: sha512-6FlzubTLZG3J2a/NVCAleEhjzq5oxgHyaCU9yYXvcLsvoVaHJq/s5xXI6/XXP6tz7R9xAOtHnSO/tXtF3WRTlA==}\n\n  muggle-string@0.4.1:\n    resolution: {integrity: sha512-VNTrAak/KhO2i8dqqnqnAHOa3cYBwXEZe9h+D5h/1ZqFSTEFHdM65lR7RoIqq3tBBYavsOXV84NoHXZ0AkPyqQ==}\n\n  multimath@2.0.0:\n    resolution: {integrity: sha512-toRx66cAMJ+Ccz7pMIg38xSIrtnbozk0dchXezwQDMgQmbGpfxjtv68H+L00iFL8hxDaVjrmwAFSb3I6bg8Q2g==}\n\n  mustache@4.2.0:\n    resolution: {integrity: sha512-71ippSywq5Yb7/tVYyGbkBggbU8H3u5Rz56fH60jGFgr8uHwxs+aSKeqmluIVzM0m0kB7xQjKS6qPfd0b2ZoqQ==}\n    hasBin: true\n\n  mz@2.7.0:\n    resolution: {integrity: sha512-z81GNO7nnYMEhrGh9LeymoE4+Yr0Wn5McHIZMK5cfQCl+NDX08sCZgUc9/6MHni9IWuFLm1Z3HTCXu2z9fN62Q==}\n\n  nanoid@3.3.7:\n    resolution: {integrity: sha512-eSRppjcPIatRIMC1U6UngP8XFcz8MQWGQdt1MTBQ7NaAmvXDfvNxbvWV3x2y6CdEUciCSsDHDQZbhYaB8QEo2g==}\n    engines: {node: ^10 || ^12 || ^13.7 || ^14 || >=15.0.1}\n    hasBin: true\n\n  nanoid@5.0.9:\n    resolution: {integrity: sha512-Aooyr6MXU6HpvvWXKoVoXwKMs/KyVakWwg7xQfv5/S/RIgJMy0Ifa45H9qqYy7pTCszrHzP21Uk4PZq2HpEM8Q==}\n    engines: {node: ^18 || >=20}\n    hasBin: true\n\n  nanotar@0.1.1:\n    resolution: {integrity: sha512-AiJsGsSF3O0havL1BydvI4+wR76sKT+okKRwWIaK96cZUnXqH0uNBOsHlbwZq3+m2BR1VKqHDVudl3gO4mYjpQ==}\n\n  negotiator@0.6.3:\n    resolution: {integrity: sha512-+EUsqGPLsM+j/zdChZjsnX51g4XrHFOIXwfnCVPGlQk/k5giakcKsuxCObBRu6DSm9opw/O6slWbJdghQM4bBg==}\n    engines: {node: '>= 0.6'}\n\n  neo-async@2.6.2:\n    resolution: {integrity: sha512-Yd3UES5mWCSqR+qNT93S3UoYUkqAZ9lLg8a7g9rimsWmYGK8cVToA4/sF3RrshdyV3sAGMXVUmpMYOw+dLpOuw==}\n\n  nitro-cloudflare-dev@0.2.1:\n    resolution: {integrity: sha512-zHAN21dp+As0ldkAr5tWTop/I721j7MssZG6qb7a7EMorFwdRIhyTUwltr2L6v4qT4209S4eb2S9rszP1fxS7A==}\n\n  nitropack@2.9.7:\n    resolution: {integrity: sha512-aKXvtNrWkOCMsQbsk4A0qQdBjrJ1ZcvwlTQevI/LAgLWLYc5L7Q/YiYxGLal4ITyNSlzir1Cm1D2ZxnYhmpMEw==}\n    engines: {node: ^16.11.0 || >=17.0.0}\n    hasBin: true\n    peerDependencies:\n      xml2js: ^0.6.2\n    peerDependenciesMeta:\n      xml2js:\n        optional: true\n\n  node-addon-api@7.1.1:\n    resolution: {integrity: sha512-5m3bsyrjFWE1xf7nz7YXdN4udnVtXK6/Yfgn5qnahL6bCkf2yKt4k3nuTKAtT4r3IG8JNR2ncsIMdZuAzJjHQQ==}\n\n  node-fetch-native@1.6.4:\n    resolution: {integrity: sha512-IhOigYzAKHd244OC0JIMIUrjzctirCmPkaIfhDeGcEETWof5zKYUW7e7MYvChGWh/4CJeXEgsRyGzuF334rOOQ==}\n\n  node-fetch@2.7.0:\n    resolution: {integrity: sha512-c4FRfUm/dbcWZ7U+1Wq0AwCyFL+3nt2bEw05wfxSz+DWpWsitgmSgYmy2dQdWyKC1694ELPqMs/YzUSNozLt8A==}\n    engines: {node: 4.x || >=6.0.0}\n    peerDependencies:\n      encoding: ^0.1.0\n    peerDependenciesMeta:\n      encoding:\n        optional: true\n\n  node-forge@1.3.1:\n    resolution: {integrity: sha512-dPEtOeMvF9VMcYV/1Wb8CPoVAXtp6MKMlcbAt4ddqmGqUJ6fQZFXkNZNkNlfevtNkGtaSoXf/vNNNSvgrdXwtA==}\n    engines: {node: '>= 6.13.0'}\n\n  node-gyp-build@4.8.2:\n    resolution: {integrity: sha512-IRUxE4BVsHWXkV/SFOut4qTlagw2aM8T5/vnTsmrHJvVoKueJHRc/JaFND7QDDc61kLYUJ6qlZM3sqTSyx2dTw==}\n    hasBin: true\n\n  node-releases@2.0.18:\n    resolution: {integrity: sha512-d9VeXT4SJ7ZeOqGX6R5EM022wpL+eWPooLI+5UpWn2jCT1aosUQEhQP214x33Wkwx3JQMvIm+tIoVOdodFS40g==}\n\n  nopt@5.0.0:\n    resolution: {integrity: sha512-Tbj67rffqceeLpcRXrT7vKAN8CwfPeIBgM7E6iBkmKLV7bEMwpGgYLGv0jACUsECaa/vuxP0IjEont6umdMgtQ==}\n    engines: {node: '>=6'}\n    hasBin: true\n\n  normalize-path@3.0.0:\n    resolution: {integrity: sha512-6eZs5Ls3WtCisHWp9S2GUy8dqkpGi4BVSz3GaqiE6ezub0512ESztXUwUB6C6IKbQkY2Pnb/mD4WYojCRwcwLA==}\n    engines: {node: '>=0.10.0'}\n\n  normalize-range@0.1.2:\n    resolution: {integrity: sha512-bdok/XvKII3nUpklnV6P2hxtMNrCboOjAcyBuQnWEhO665FwrSNRxU+AqpsyvO6LgGYPspN+lu5CLtw4jPRKNA==}\n    engines: {node: '>=0.10.0'}\n\n  npm-run-path@4.0.1:\n    resolution: {integrity: sha512-S48WzZW777zhNIrn7gxOlISNAqi9ZC/uQFnRdbeIHhZhCA6UqpkOT8T1G7BvfdgP4Er8gF4sUbaS0i7QvIfCWw==}\n    engines: {node: '>=8'}\n\n  npm-run-path@5.3.0:\n    resolution: {integrity: sha512-ppwTtiJZq0O/ai0z7yfudtBpWIoxM8yE6nHi1X47eFR2EWORqfbu6CnPlNsjeN683eT0qG6H/Pyf9fCcvjnnnQ==}\n    engines: {node: ^12.20.0 || ^14.13.1 || >=16.0.0}\n\n  npmlog@5.0.1:\n    resolution: {integrity: sha512-AqZtDUWOMKs1G/8lwylVjrdYgqA4d9nu8hc+0gzRxlDb1I10+FHBGMXs6aiQHFdCUUlqH99MUMuLfzWDNDtfxw==}\n    deprecated: This package is no longer supported.\n\n  nth-check@2.1.1:\n    resolution: {integrity: sha512-lqjrjmaOoAnWfMmBPL+XNnynZh2+swxiX3WUE0s4yEHI6m+AwrK2UZOimIRl3X/4QctVqS8AiZjFqyOGrMXb/w==}\n\n  nuxi@3.15.0:\n    resolution: {integrity: sha512-ZVu45nuDrdb7nzKW2kLGY/N1vvFYLLbUVX6gUYw4BApKGGu4+GktTR5o48dGVgMYX9A8chaugl7TL9ZYmwC9Mg==}\n    engines: {node: ^16.10.0 || >=18.0.0}\n    hasBin: true\n\n  nuxt@3.13.2:\n    resolution: {integrity: sha512-Bjc2qRsipfBhjXsBEJCN+EUAukhdgFv/KoIR5HFB2hZOYRSqXBod3oWQs78k3ja1nlIhAEdBG533898KJxUtJw==}\n    engines: {node: ^14.18.0 || >=16.10.0}\n    hasBin: true\n    peerDependencies:\n      '@parcel/watcher': ^2.1.0\n      '@types/node': ^14.18.0 || >=16.10.0\n    peerDependenciesMeta:\n      '@parcel/watcher':\n        optional: true\n      '@types/node':\n        optional: true\n\n  nypm@0.3.12:\n    resolution: {integrity: sha512-D3pzNDWIvgA+7IORhD/IuWzEk4uXv6GsgOxiid4UU3h9oq5IqV1KtPDi63n4sZJ/xcWlr88c0QM2RgN5VbOhFA==}\n    engines: {node: ^14.16.0 || >=16.10.0}\n    hasBin: true\n\n  object-assign@4.1.1:\n    resolution: {integrity: sha512-rJgTQnkUnH1sFw8yT6VSU3zD3sWmu6sZhIseY8VX+GRu3P6F7Fu+JNDoXfklElbLJSnc3FUQHVe4cU5hj+BcUg==}\n    engines: {node: '>=0.10.0'}\n\n  object-hash@3.0.0:\n    resolution: {integrity: sha512-RSn9F68PjH9HqtltsSnqYC1XXoWe9Bju5+213R98cNGttag9q9yAOTzdbsqvIa7aNm5WffBZFpWYr2aWrklWAw==}\n    engines: {node: '>= 6'}\n\n  object-inspect@1.13.1:\n    resolution: {integrity: sha512-5qoj1RUiKOMsCCNLV1CBiPYE10sziTsnmNxkAI/rZhiD63CF7IqdFGC/XzjWjpSgLf0LxXX3bDFIh0E18f6UhQ==}\n\n  object-keys@1.1.1:\n    resolution: {integrity: sha512-NuAESUOUMrlIXOfHKzD6bpPu3tYt3xvjNdRIQ+FeT0lNb4K8WR70CaDxhuNguS2XG+GjkyMwOzsN5ZktImfhLA==}\n    engines: {node: '>= 0.4'}\n\n  object.assign@4.1.5:\n    resolution: {integrity: sha512-byy+U7gp+FVwmyzKPYhW2h5l3crpmGsxl7X2s8y43IgxvG4g3QZ6CffDtsNQy1WsmZpQbO+ybo0AlW7TY6DcBQ==}\n    engines: {node: '>= 0.4'}\n\n  obuf@1.1.2:\n    resolution: {integrity: sha512-PX1wu0AmAdPqOL1mWhqmlOd8kOIZQwGZw6rh7uby9fTc5lhaOWFLX3I6R1hrF9k3zUY40e6igsLGkDXK92LJNg==}\n\n  ofetch@1.4.1:\n    resolution: {integrity: sha512-QZj2DfGplQAr2oj9KzceK9Hwz6Whxazmn85yYeVuS3u9XTMOGMRx0kO95MQ+vLsj/S/NwBDMMLU5hpxvI6Tklw==}\n\n  ohash@1.1.4:\n    resolution: {integrity: sha512-FlDryZAahJmEF3VR3w1KogSEdWX3WhA5GPakFx4J81kEAiHyLMpdLLElS8n8dfNadMgAne/MywcvmogzscVt4g==}\n\n  on-finished@2.4.1:\n    resolution: {integrity: sha512-oVlzkg3ENAhCk2zdv7IJwd/QUD4z2RxRwpkcGY8psCVcCYZNq4wYnVWALHM+brtuJjePWiYF/ClmuDr8Ch5+kg==}\n    engines: {node: '>= 0.8'}\n\n  once@1.4.0:\n    resolution: {integrity: sha512-lNaJgI+2Q5URQBkccEKHTQOPaXdUxnZZElQTZY0MFUAuaEqe1E+Nyvgdz/aIyNi6Z9MzO5dv1H8n58/GELp3+w==}\n\n  onetime@6.0.0:\n    resolution: {integrity: sha512-1FlR+gjXK7X+AsAHso35MnyN5KqGwJRi/31ft6x0M194ht7S+rWAvd7PHss9xSKMzE0asv1pyIHaJYq+BbacAQ==}\n    engines: {node: '>=12'}\n\n  oniguruma-to-es@0.7.0:\n    resolution: {integrity: sha512-HRaRh09cE0gRS3+wi2zxekB+I5L8C/gN60S+vb11eADHUaB/q4u8wGGOX3GvwvitG8ixaeycZfeoyruKQzUgNg==}\n\n  oniguruma-to-js@0.4.3:\n    resolution: {integrity: sha512-X0jWUcAlxORhOqqBREgPMgnshB7ZGYszBNspP+tS9hPD3l13CdaXcHbgImoHUHlrvGx/7AvFEkTRhAGYh+jzjQ==}\n\n  only@0.0.2:\n    resolution: {integrity: sha512-Fvw+Jemq5fjjyWz6CpKx6w9s7xxqo3+JCyM0WXWeCSOboZ8ABkyvP8ID4CZuChA/wxSx+XSJmdOm8rGVyJ1hdQ==}\n\n  open@10.1.0:\n    resolution: {integrity: sha512-mnkeQ1qP5Ue2wd+aivTD3NHd/lZ96Lu0jgf0pwktLPtx6cTZiH7tyeGRRHs0zX0rbrahXPnXlUnbeXyaBBuIaw==}\n    engines: {node: '>=18'}\n\n  open@7.4.2:\n    resolution: {integrity: sha512-MVHddDVweXZF3awtlAS+6pgKLlm/JgxZ90+/NBurBoQctVOOB/zDdVjcyPzQ+0laDGbsWgrRkflI65sQeOgT9Q==}\n    engines: {node: '>=8'}\n\n  open@8.4.2:\n    resolution: {integrity: sha512-7x81NCL719oNbsq/3mh+hVrAWmFuEYUqrq/Iw3kUzH8ReypT9QQ0BLoJS7/G9k6N81XjW4qHWtjWwe/9eLy1EQ==}\n    engines: {node: '>=12'}\n\n  openapi-typescript@6.7.6:\n    resolution: {integrity: sha512-c/hfooPx+RBIOPM09GSxABOZhYPblDoyaGhqBkD/59vtpN21jEuWKDlM0KYTvqJVlSYjKs0tBcIdeXKChlSPtw==}\n    hasBin: true\n\n  package-manager-detector@0.2.2:\n    resolution: {integrity: sha512-VgXbyrSNsml4eHWIvxxG/nTL4wgybMTXCV2Un/+yEc3aDKKU6nQBZjbeP3Pl3qm9Qg92X/1ng4ffvCeD/zwHgg==}\n\n  parse-git-config@3.0.0:\n    resolution: {integrity: sha512-wXoQGL1D+2COYWCD35/xbiKma1Z15xvZL8cI25wvxzled58V51SJM04Urt/uznS900iQor7QO04SgdfT/XlbuA==}\n    engines: {node: '>=8'}\n\n  parse-path@7.0.0:\n    resolution: {integrity: sha512-Euf9GG8WT9CdqwuWJGdf3RkUcTBArppHABkO7Lm8IzRQp0e2r/kkFnmhu4TSK30Wcu5rVAZLmfPKSBBi9tWFog==}\n\n  parse-url@8.1.0:\n    resolution: {integrity: sha512-xDvOoLU5XRrcOZvnI6b8zA6n9O9ejNk/GExuz1yBuWUGn9KA97GI6HTs6u02wKara1CeVmZhH+0TZFdWScR89w==}\n\n  parseurl@1.3.3:\n    resolution: {integrity: sha512-CiyeOxFT/JZyN5m0z9PfXw4SCBJ6Sygz1Dpl0wqjlhDEGGBP1GnsUVEL0p63hoG1fcj3fHynXi9NYO4nWOL+qQ==}\n    engines: {node: '>= 0.8'}\n\n  path-browserify@1.0.1:\n    resolution: {integrity: sha512-b7uo2UCUOYZcnF/3ID0lulOJi/bafxa1xPe7ZPsammBSpjSWQkjNxlt635YGS2MiR9GjvuXCtz2emr3jbsz98g==}\n\n  path-is-absolute@1.0.1:\n    resolution: {integrity: sha512-AVbw3UJ2e9bq64vSaS9Am0fje1Pa8pbGqTTsmXfaIiMpnr5DlDhfJOuLj9Sf95ZPVDAUerDfEk88MPmPe7UCQg==}\n    engines: {node: '>=0.10.0'}\n\n  path-key@3.1.1:\n    resolution: {integrity: sha512-ojmeN0qd+y0jszEtoY48r0Peq5dwMEkIlCOu6Q5f41lfkswXuKtYrhgoTpLnyIcHm24Uhqx+5Tqm2InSwLhE6Q==}\n    engines: {node: '>=8'}\n\n  path-key@4.0.0:\n    resolution: {integrity: sha512-haREypq7xkM7ErfgIyA0z+Bj4AGKlMSdlQE2jvJo6huWD1EdkKYV+G/T4nq0YEF2vgTT8kqMFKo1uHn950r4SQ==}\n    engines: {node: '>=12'}\n\n  path-parse@1.0.7:\n    resolution: {integrity: sha512-LDJzPVEEEPR+y48z93A0Ed0yXb8pAByGWo/k5YYdYgpY2/2EsOsksJrq7lOHxryrVOn1ejG6oAp8ahvOIQD8sw==}\n\n  path-scurry@1.10.1:\n    resolution: {integrity: sha512-MkhCqzzBEpPvxxQ71Md0b1Kk51W01lrYvlMzSUaIzNsODdd7mqhiimSZlr+VegAz5Z6Vzt9Xg2ttE//XBhH3EQ==}\n    engines: {node: '>=16 || 14 >=14.17'}\n\n  path-to-regexp@6.3.0:\n    resolution: {integrity: sha512-Yhpw4T9C6hPpgPeA28us07OJeqZ5EzQTkbfwuhsUg0c237RomFoETJgmp2sa3F/41gfLE6G5cqcYwznmeEeOlQ==}\n\n  path-type@5.0.0:\n    resolution: {integrity: sha512-5HviZNaZcfqP95rwpv+1HDgUamezbqdSYTyzjTvwtJSnIH+3vnbmWsItli8OFEndS984VT55M3jduxZbX351gg==}\n    engines: {node: '>=12'}\n\n  pathe@1.1.2:\n    resolution: {integrity: sha512-whLdWMYL2TwI08hn8/ZqAbrVemu0LNaNNJZX73O6qaIdCTfXutsLhMkjdENX0qhsQ9uIimo4/aQOmXkoon2nDQ==}\n\n  perfect-debounce@1.0.0:\n    resolution: {integrity: sha512-xCy9V055GLEqoFaHoC1SoLIaLmWctgCUaBaWxDZ7/Zx4CTyX7cJQLJOok/orfjZAh9kEYpjJa4d0KcJmCbctZA==}\n\n  pg-cloudflare@1.1.1:\n    resolution: {integrity: sha512-xWPagP/4B6BgFO+EKz3JONXv3YDgvkbVrGw2mTo3D6tVDQRh1e7cqVGvyR3BE+eQgAvx1XhW/iEASj4/jCWl3Q==}\n\n  pg-connection-string@2.7.0:\n    resolution: {integrity: sha512-PI2W9mv53rXJQEOb8xNR8lH7Hr+EKa6oJa38zsK0S/ky2er16ios1wLKhZyxzD7jUReiWokc9WK5nxSnC7W1TA==}\n\n  pg-int8@1.0.1:\n    resolution: {integrity: sha512-WCtabS6t3c8SkpDBUlb1kjOs7l66xsGdKpIPZsg4wR+B3+u9UAum2odSsF9tnvxg80h4ZxLWMy4pRjOsFIqQpw==}\n    engines: {node: '>=4.0.0'}\n\n  pg-numeric@1.0.2:\n    resolution: {integrity: sha512-BM/Thnrw5jm2kKLE5uJkXqqExRUY/toLHda65XgFTBTFYZyopbKjBe29Ii3RbkvlsMoFwD+tHeGaCjjv0gHlyw==}\n    engines: {node: '>=4'}\n\n  pg-pool@3.7.0:\n    resolution: {integrity: sha512-ZOBQForurqh4zZWjrgSwwAtzJ7QiRX0ovFkZr2klsen3Nm0aoh33Ls0fzfv3imeH/nw/O27cjdz5kzYJfeGp/g==}\n    peerDependencies:\n      pg: '>=8.0'\n\n  pg-protocol@1.7.0:\n    resolution: {integrity: sha512-hTK/mE36i8fDDhgDFjy6xNOG+LCorxLG3WO17tku+ij6sVHXh1jQUJ8hYAnRhNla4QVD2H8er/FOjc/+EgC6yQ==}\n\n  pg-types@2.2.0:\n    resolution: {integrity: sha512-qTAAlrEsl8s4OiEQY69wDvcMIdQN6wdz5ojQiOy6YRMuynxenON0O5oCpJI6lshc6scgAY8qvJ2On/p+CXY0GA==}\n    engines: {node: '>=4'}\n\n  pg-types@4.0.2:\n    resolution: {integrity: sha512-cRL3JpS3lKMGsKaWndugWQoLOCoP+Cic8oseVcbr0qhPzYD5DWXK+RZ9LY9wxRf7RQia4SCwQlXk0q6FCPrVng==}\n    engines: {node: '>=10'}\n\n  pg@8.13.1:\n    resolution: {integrity: sha512-OUir1A0rPNZlX//c7ksiu7crsGZTKSOXJPgtNiHGIlC9H0lO+NC6ZDYksSgBYY/thSWhnSRBv8w1lieNNGATNQ==}\n    engines: {node: '>= 8.0.0'}\n    peerDependencies:\n      pg-native: '>=3.0.1'\n    peerDependenciesMeta:\n      pg-native:\n        optional: true\n\n  pgpass@1.0.5:\n    resolution: {integrity: sha512-FdW9r/jQZhSeohs1Z3sI1yxFQNFvMcnmfuj4WBMUTxOrAyLMaTcE1aAMBiTlbMNaXvBCQuVi0R7hd8udDSP7ug==}\n\n  pica@7.1.0:\n    resolution: {integrity: sha512-4D1E1lssL/yJD4La23Kbh5CSJPeXMO8NgJTsR/VWtG7aV92fD2g2t/PABg/Abp8Ug3yJNw7y7x1ftkJuIPLpEw==}\n\n  picocolors@1.1.0:\n    resolution: {integrity: sha512-TQ92mBOW0l3LeMeyLV6mzy/kWr8lkd/hp3mTg7wYK7zJhuBStmGMBG0BdeDZS/dZx1IukaX6Bk11zcln25o1Aw==}\n\n  picomatch@2.3.1:\n    resolution: {integrity: sha512-JU3teHTNjmE2VCGFzuY8EXzCDVwEqB2a8fsIvwaStHhAWJEeVd1o1QD80CU6+ZdEXXSLbSsuLwJjkCBWqRQUVA==}\n    engines: {node: '>=8.6'}\n\n  picomatch@4.0.2:\n    resolution: {integrity: sha512-M7BAV6Rlcy5u+m6oPhAPFgJTzAioX/6B0DxyvDlo9l8+T3nLKbrczg2WLUyzd45L8RqfUMyGPzekbMvX2Ldkwg==}\n    engines: {node: '>=12'}\n\n  pify@2.3.0:\n    resolution: {integrity: sha512-udgsAY+fTnvv7kI7aaxbqwWNb0AHiB0qBO89PZKPkoTmGOgdbrHDKD+0B2X4uTfJ/FT1R09r9gTsjUjNJotuog==}\n    engines: {node: '>=0.10.0'}\n\n  pinia@2.2.4:\n    resolution: {integrity: sha512-K7ZhpMY9iJ9ShTC0cR2+PnxdQRuwVIsXDO/WIEV/RnMC/vmSoKDTKW/exNQYPI+4ij10UjXqdNiEHwn47McANQ==}\n    peerDependencies:\n      '@vue/composition-api': ^1.4.0\n      typescript: '>=4.4.4'\n      vue: ^2.6.14 || ^3.3.0\n    peerDependenciesMeta:\n      '@vue/composition-api':\n        optional: true\n      typescript:\n        optional: true\n\n  pirates@4.0.6:\n    resolution: {integrity: sha512-saLsH7WeYYPiD25LDuLRRY/i+6HaPYr6G1OUlN39otzkSTxKnubR9RTxS3/Kk50s1g2JTgFwWQDQyplC5/SHZg==}\n    engines: {node: '>= 6'}\n\n  pkg-types@1.0.3:\n    resolution: {integrity: sha512-nN7pYi0AQqJnoLPC9eHFQ8AcyaixBUOwvqc5TDnIKCMEE6I0y8P7OKA7fPexsXGCGxQDl/cmrLAp26LhcwxZ4A==}\n\n  pkg-types@1.2.1:\n    resolution: {integrity: sha512-sQoqa8alT3nHjGuTjuKgOnvjo4cljkufdtLMnO2LBP/wRwuDlo1tkaEdMxCRhyGRPacv/ztlZgDPm2b7FAmEvw==}\n\n  portfinder@1.0.32:\n    resolution: {integrity: sha512-on2ZJVVDXRADWE6jnQaX0ioEylzgBpQk8r55NE4wjXW1ZxO+BgDlY6DXwj20i0V8eB4SenDQ00WEaxfiIQPcxg==}\n    engines: {node: '>= 0.12.0'}\n\n  postcss-calc@10.0.2:\n    resolution: {integrity: sha512-DT/Wwm6fCKgpYVI7ZEWuPJ4az8hiEHtCUeYjZXqU7Ou4QqYh1Df2yCQ7Ca6N7xqKPFkxN3fhf+u9KSoOCJNAjg==}\n    engines: {node: ^18.12 || ^20.9 || >=22.0}\n    peerDependencies:\n      postcss: ^8.4.38\n\n  postcss-colormin@7.0.2:\n    resolution: {integrity: sha512-YntRXNngcvEvDbEjTdRWGU606eZvB5prmHG4BF0yLmVpamXbpsRJzevyy6MZVyuecgzI2AWAlvFi8DAeCqwpvA==}\n    engines: {node: ^18.12.0 || ^20.9.0 || >=22.0}\n    peerDependencies:\n      postcss: ^8.4.31\n\n  postcss-convert-values@7.0.4:\n    resolution: {integrity: sha512-e2LSXPqEHVW6aoGbjV9RsSSNDO3A0rZLCBxN24zvxF25WknMPpX8Dm9UxxThyEbaytzggRuZxaGXqaOhxQ514Q==}\n    engines: {node: ^18.12.0 || ^20.9.0 || >=22.0}\n    peerDependencies:\n      postcss: ^8.4.31\n\n  postcss-discard-comments@7.0.3:\n    resolution: {integrity: sha512-q6fjd4WU4afNhWOA2WltHgCbkRhZPgQe7cXF74fuVB/ge4QbM9HEaOIzGSiMvM+g/cOsNAUGdf2JDzqA2F8iLA==}\n    engines: {node: ^18.12.0 || ^20.9.0 || >=22.0}\n    peerDependencies:\n      postcss: ^8.4.31\n\n  postcss-discard-duplicates@7.0.1:\n    resolution: {integrity: sha512-oZA+v8Jkpu1ct/xbbrntHRsfLGuzoP+cpt0nJe5ED2FQF8n8bJtn7Bo28jSmBYwqgqnqkuSXJfSUEE7if4nClQ==}\n    engines: {node: ^18.12.0 || ^20.9.0 || >=22.0}\n    peerDependencies:\n      postcss: ^8.4.31\n\n  postcss-discard-empty@7.0.0:\n    resolution: {integrity: sha512-e+QzoReTZ8IAwhnSdp/++7gBZ/F+nBq9y6PomfwORfP7q9nBpK5AMP64kOt0bA+lShBFbBDcgpJ3X4etHg4lzA==}\n    engines: {node: ^18.12.0 || ^20.9.0 || >=22.0}\n    peerDependencies:\n      postcss: ^8.4.31\n\n  postcss-discard-overridden@7.0.0:\n    resolution: {integrity: sha512-GmNAzx88u3k2+sBTZrJSDauR0ccpE24omTQCVmaTTZFz1du6AasspjaUPMJ2ud4RslZpoFKyf+6MSPETLojc6w==}\n    engines: {node: ^18.12.0 || ^20.9.0 || >=22.0}\n    peerDependencies:\n      postcss: ^8.4.31\n\n  postcss-import@15.1.0:\n    resolution: {integrity: sha512-hpr+J05B2FVYUAXHeK1YyI267J/dDDhMU6B6civm8hSY1jYJnBXxzKDKDswzJmtLHryrjhnDjqqp/49t8FALew==}\n    engines: {node: '>=14.0.0'}\n    peerDependencies:\n      postcss: ^8.0.0\n\n  postcss-js@4.0.1:\n    resolution: {integrity: sha512-dDLF8pEO191hJMtlHFPRa8xsizHaM82MLfNkUHdUtVEV3tgTp5oj+8qbEqYM57SLfc74KSbw//4SeJma2LRVIw==}\n    engines: {node: ^12 || ^14 || >= 16}\n    peerDependencies:\n      postcss: ^8.4.21\n\n  postcss-load-config@4.0.2:\n    resolution: {integrity: sha512-bSVhyJGL00wMVoPUzAVAnbEoWyqRxkjv64tUl427SKnPrENtq6hJwUojroMz2VB+Q1edmi4IfrAPpami5VVgMQ==}\n    engines: {node: '>= 14'}\n    peerDependencies:\n      postcss: '>=8.0.9'\n      ts-node: '>=9.0.0'\n    peerDependenciesMeta:\n      postcss:\n        optional: true\n      ts-node:\n        optional: true\n\n  postcss-merge-longhand@7.0.4:\n    resolution: {integrity: sha512-zer1KoZA54Q8RVHKOY5vMke0cCdNxMP3KBfDerjH/BYHh4nCIh+1Yy0t1pAEQF18ac/4z3OFclO+ZVH8azjR4A==}\n    engines: {node: ^18.12.0 || ^20.9.0 || >=22.0}\n    peerDependencies:\n      postcss: ^8.4.31\n\n  postcss-merge-rules@7.0.4:\n    resolution: {integrity: sha512-ZsaamiMVu7uBYsIdGtKJ64PkcQt6Pcpep/uO90EpLS3dxJi6OXamIobTYcImyXGoW0Wpugh7DSD3XzxZS9JCPg==}\n    engines: {node: ^18.12.0 || ^20.9.0 || >=22.0}\n    peerDependencies:\n      postcss: ^8.4.31\n\n  postcss-minify-font-values@7.0.0:\n    resolution: {integrity: sha512-2ckkZtgT0zG8SMc5aoNwtm5234eUx1GGFJKf2b1bSp8UflqaeFzR50lid4PfqVI9NtGqJ2J4Y7fwvnP/u1cQog==}\n    engines: {node: ^18.12.0 || ^20.9.0 || >=22.0}\n    peerDependencies:\n      postcss: ^8.4.31\n\n  postcss-minify-gradients@7.0.0:\n    resolution: {integrity: sha512-pdUIIdj/C93ryCHew0UgBnL2DtUS3hfFa5XtERrs4x+hmpMYGhbzo6l/Ir5de41O0GaKVpK1ZbDNXSY6GkXvtg==}\n    engines: {node: ^18.12.0 || ^20.9.0 || >=22.0}\n    peerDependencies:\n      postcss: ^8.4.31\n\n  postcss-minify-params@7.0.2:\n    resolution: {integrity: sha512-nyqVLu4MFl9df32zTsdcLqCFfE/z2+f8GE1KHPxWOAmegSo6lpV2GNy5XQvrzwbLmiU7d+fYay4cwto1oNdAaQ==}\n    engines: {node: ^18.12.0 || ^20.9.0 || >=22.0}\n    peerDependencies:\n      postcss: ^8.4.31\n\n  postcss-minify-selectors@7.0.4:\n    resolution: {integrity: sha512-JG55VADcNb4xFCf75hXkzc1rNeURhlo7ugf6JjiiKRfMsKlDzN9CXHZDyiG6x/zGchpjQS+UAgb1d4nqXqOpmA==}\n    engines: {node: ^18.12.0 || ^20.9.0 || >=22.0}\n    peerDependencies:\n      postcss: ^8.4.31\n\n  postcss-nested@6.0.1:\n    resolution: {integrity: sha512-mEp4xPMi5bSWiMbsgoPfcP74lsWLHkQbZc3sY+jWYd65CUwXrUaTp0fmNpa01ZcETKlIgUdFN/MpS2xZtqL9dQ==}\n    engines: {node: '>=12.0'}\n    peerDependencies:\n      postcss: ^8.2.14\n\n  postcss-nesting@13.0.0:\n    resolution: {integrity: sha512-TCGQOizyqvEkdeTPM+t6NYwJ3EJszYE/8t8ILxw/YoeUvz2rz7aM8XTAmBWh9/DJjfaaabL88fWrsVHSPF2zgA==}\n    engines: {node: '>=18'}\n    peerDependencies:\n      postcss: ^8.4\n\n  postcss-normalize-charset@7.0.0:\n    resolution: {integrity: sha512-ABisNUXMeZeDNzCQxPxBCkXexvBrUHV+p7/BXOY+ulxkcjUZO0cp8ekGBwvIh2LbCwnWbyMPNJVtBSdyhM2zYQ==}\n    engines: {node: ^18.12.0 || ^20.9.0 || >=22.0}\n    peerDependencies:\n      postcss: ^8.4.31\n\n  postcss-normalize-display-values@7.0.0:\n    resolution: {integrity: sha512-lnFZzNPeDf5uGMPYgGOw7v0BfB45+irSRz9gHQStdkkhiM0gTfvWkWB5BMxpn0OqgOQuZG/mRlZyJxp0EImr2Q==}\n    engines: {node: ^18.12.0 || ^20.9.0 || >=22.0}\n    peerDependencies:\n      postcss: ^8.4.31\n\n  postcss-normalize-positions@7.0.0:\n    resolution: {integrity: sha512-I0yt8wX529UKIGs2y/9Ybs2CelSvItfmvg/DBIjTnoUSrPxSV7Z0yZ8ShSVtKNaV/wAY+m7bgtyVQLhB00A1NQ==}\n    engines: {node: ^18.12.0 || ^20.9.0 || >=22.0}\n    peerDependencies:\n      postcss: ^8.4.31\n\n  postcss-normalize-repeat-style@7.0.0:\n    resolution: {integrity: sha512-o3uSGYH+2q30ieM3ppu9GTjSXIzOrRdCUn8UOMGNw7Af61bmurHTWI87hRybrP6xDHvOe5WlAj3XzN6vEO8jLw==}\n    engines: {node: ^18.12.0 || ^20.9.0 || >=22.0}\n    peerDependencies:\n      postcss: ^8.4.31\n\n  postcss-normalize-string@7.0.0:\n    resolution: {integrity: sha512-w/qzL212DFVOpMy3UGyxrND+Kb0fvCiBBujiaONIihq7VvtC7bswjWgKQU/w4VcRyDD8gpfqUiBQ4DUOwEJ6Qg==}\n    engines: {node: ^18.12.0 || ^20.9.0 || >=22.0}\n    peerDependencies:\n      postcss: ^8.4.31\n\n  postcss-normalize-timing-functions@7.0.0:\n    resolution: {integrity: sha512-tNgw3YV0LYoRwg43N3lTe3AEWZ66W7Dh7lVEpJbHoKOuHc1sLrzMLMFjP8SNULHaykzsonUEDbKedv8C+7ej6g==}\n    engines: {node: ^18.12.0 || ^20.9.0 || >=22.0}\n    peerDependencies:\n      postcss: ^8.4.31\n\n  postcss-normalize-unicode@7.0.2:\n    resolution: {integrity: sha512-ztisabK5C/+ZWBdYC+Y9JCkp3M9qBv/XFvDtSw0d/XwfT3UaKeW/YTm/MD/QrPNxuecia46vkfEhewjwcYFjkg==}\n    engines: {node: ^18.12.0 || ^20.9.0 || >=22.0}\n    peerDependencies:\n      postcss: ^8.4.31\n\n  postcss-normalize-url@7.0.0:\n    resolution: {integrity: sha512-+d7+PpE+jyPX1hDQZYG+NaFD+Nd2ris6r8fPTBAjE8z/U41n/bib3vze8x7rKs5H1uEw5ppe9IojewouHk0klQ==}\n    engines: {node: ^18.12.0 || ^20.9.0 || >=22.0}\n    peerDependencies:\n      postcss: ^8.4.31\n\n  postcss-normalize-whitespace@7.0.0:\n    resolution: {integrity: sha512-37/toN4wwZErqohedXYqWgvcHUGlT8O/m2jVkAfAe9Bd4MzRqlBmXrJRePH0e9Wgnz2X7KymTgTOaaFizQe3AQ==}\n    engines: {node: ^18.12.0 || ^20.9.0 || >=22.0}\n    peerDependencies:\n      postcss: ^8.4.31\n\n  postcss-ordered-values@7.0.1:\n    resolution: {integrity: sha512-irWScWRL6nRzYmBOXReIKch75RRhNS86UPUAxXdmW/l0FcAsg0lvAXQCby/1lymxn/o0gVa6Rv/0f03eJOwHxw==}\n    engines: {node: ^18.12.0 || ^20.9.0 || >=22.0}\n    peerDependencies:\n      postcss: ^8.4.31\n\n  postcss-reduce-initial@7.0.2:\n    resolution: {integrity: sha512-pOnu9zqQww7dEKf62Nuju6JgsW2V0KRNBHxeKohU+JkHd/GAH5uvoObqFLqkeB2n20mr6yrlWDvo5UBU5GnkfA==}\n    engines: {node: ^18.12.0 || ^20.9.0 || >=22.0}\n    peerDependencies:\n      postcss: ^8.4.31\n\n  postcss-reduce-transforms@7.0.0:\n    resolution: {integrity: sha512-pnt1HKKZ07/idH8cpATX/ujMbtOGhUfE+m8gbqwJE05aTaNw8gbo34a2e3if0xc0dlu75sUOiqvwCGY3fzOHew==}\n    engines: {node: ^18.12.0 || ^20.9.0 || >=22.0}\n    peerDependencies:\n      postcss: ^8.4.31\n\n  postcss-selector-parser@6.0.10:\n    resolution: {integrity: sha512-IQ7TZdoaqbT+LCpShg46jnZVlhWD2w6iQYAcYXfHARZ7X1t/UGhhceQDs5X0cGqKvYlHNOuv7Oa1xmb0oQuA3w==}\n    engines: {node: '>=4'}\n\n  postcss-selector-parser@6.0.15:\n    resolution: {integrity: sha512-rEYkQOMUCEMhsKbK66tbEU9QVIxbhN18YiniAwA7XQYTVBqrBy+P2p5JcdqsHgKM2zWylp8d7J6eszocfds5Sw==}\n    engines: {node: '>=4'}\n\n  postcss-selector-parser@6.1.2:\n    resolution: {integrity: sha512-Q8qQfPiZ+THO/3ZrOrO0cJJKfpYCagtMUkXbnEfmgUjwXg6z/WBeOyS9APBBPCTSiDV+s4SwQGu8yFsiMRIudg==}\n    engines: {node: '>=4'}\n\n  postcss-svgo@7.0.1:\n    resolution: {integrity: sha512-0WBUlSL4lhD9rA5k1e5D8EN5wCEyZD6HJk0jIvRxl+FDVOMlJ7DePHYWGGVc5QRqrJ3/06FTXM0bxjmJpmTPSA==}\n    engines: {node: ^18.12.0 || ^20.9.0 || >= 18}\n    peerDependencies:\n      postcss: ^8.4.31\n\n  postcss-unique-selectors@7.0.3:\n    resolution: {integrity: sha512-J+58u5Ic5T1QjP/LDV9g3Cx4CNOgB5vz+kM6+OxHHhFACdcDeKhBXjQmB7fnIZM12YSTvsL0Opwco83DmacW2g==}\n    engines: {node: ^18.12.0 || ^20.9.0 || >=22.0}\n    peerDependencies:\n      postcss: ^8.4.31\n\n  postcss-value-parser@4.2.0:\n    resolution: {integrity: sha512-1NNCs6uurfkVbeXG4S8JFT9t19m45ICnif8zWLd5oPSZ50QnwMfK+H3jv408d4jw/7Bttv5axS5IiHoLaVNHeQ==}\n\n  postcss@8.4.47:\n    resolution: {integrity: sha512-56rxCq7G/XfB4EkXq9Egn5GCqugWvDFjafDOThIdMBsI15iqPqR5r15TfSr1YPYeEI19YeaXMCbY6u88Y76GLQ==}\n    engines: {node: ^10 || ^12 || >=14}\n\n  postgres-array@2.0.0:\n    resolution: {integrity: sha512-VpZrUqU5A69eQyW2c5CA1jtLecCsN2U/bD6VilrFDWq5+5UIEVO7nazS3TEcHf1zuPYO/sqGvUvW62g86RXZuA==}\n    engines: {node: '>=4'}\n\n  postgres-array@3.0.2:\n    resolution: {integrity: sha512-6faShkdFugNQCLwucjPcY5ARoW1SlbnrZjmGl0IrrqewpvxvhSLHimCVzqeuULCbG0fQv7Dtk1yDbG3xv7Veog==}\n    engines: {node: '>=12'}\n\n  postgres-bytea@1.0.0:\n    resolution: {integrity: sha512-xy3pmLuQqRBZBXDULy7KbaitYqLcmxigw14Q5sj8QBVLqEwXfeybIKVWiqAXTlcvdvb0+xkOtDbfQMOf4lST1w==}\n    engines: {node: '>=0.10.0'}\n\n  postgres-bytea@3.0.0:\n    resolution: {integrity: sha512-CNd4jim9RFPkObHSjVHlVrxoVQXz7quwNFpz7RY1okNNme49+sVyiTvTRobiLV548Hx/hb1BG+iE7h9493WzFw==}\n    engines: {node: '>= 6'}\n\n  postgres-date@1.0.7:\n    resolution: {integrity: sha512-suDmjLVQg78nMK2UZ454hAG+OAW+HQPZ6n++TNDUX+L0+uUlLywnoxJKDou51Zm+zTCjrCl0Nq6J9C5hP9vK/Q==}\n    engines: {node: '>=0.10.0'}\n\n  postgres-date@2.1.0:\n    resolution: {integrity: sha512-K7Juri8gtgXVcDfZttFKVmhglp7epKb1K4pgrkLxehjqkrgPhfG6OO8LHLkfaqkbpjNRnra018XwAr1yQFWGcA==}\n    engines: {node: '>=12'}\n\n  postgres-interval@1.2.0:\n    resolution: {integrity: sha512-9ZhXKM/rw350N1ovuWHbGxnGh/SNJ4cnxHiM0rxE4VN41wsg8P8zWn9hv/buK00RP4WvlOyr/RBDiptyxVbkZQ==}\n    engines: {node: '>=0.10.0'}\n\n  postgres-interval@3.0.0:\n    resolution: {integrity: sha512-BSNDnbyZCXSxgA+1f5UU2GmwhoI0aU5yMxRGO8CdFEcY2BQF9xm/7MqKnYoM1nJDk8nONNWDk9WeSmePFhQdlw==}\n    engines: {node: '>=12'}\n\n  postgres-range@1.1.4:\n    resolution: {integrity: sha512-i/hbxIE9803Alj/6ytL7UHQxRvZkI9O4Sy+J3HGc4F4oo/2eQAjTSNJ0bfxyse3bH0nuVesCk+3IRLaMtG3H6w==}\n\n  postgres@3.4.5:\n    resolution: {integrity: sha512-cDWgoah1Gez9rN3H4165peY9qfpEo+SA61oQv65O3cRUE1pOEoJWwddwcqKE8XZYjbblOJlYDlLV4h67HrEVDg==}\n    engines: {node: '>=12'}\n\n  prettier-plugin-tailwindcss@0.6.8:\n    resolution: {integrity: sha512-dGu3kdm7SXPkiW4nzeWKCl3uoImdd5CTZEJGxyypEPL37Wj0HT2pLqjrvSei1nTeuQfO4PUfjeW5cTUNRLZ4sA==}\n    engines: {node: '>=14.21.3'}\n    peerDependencies:\n      '@ianvs/prettier-plugin-sort-imports': '*'\n      '@prettier/plugin-pug': '*'\n      '@shopify/prettier-plugin-liquid': '*'\n      '@trivago/prettier-plugin-sort-imports': '*'\n      '@zackad/prettier-plugin-twig-melody': '*'\n      prettier: ^3.0\n      prettier-plugin-astro: '*'\n      prettier-plugin-css-order: '*'\n      prettier-plugin-import-sort: '*'\n      prettier-plugin-jsdoc: '*'\n      prettier-plugin-marko: '*'\n      prettier-plugin-multiline-arrays: '*'\n      prettier-plugin-organize-attributes: '*'\n      prettier-plugin-organize-imports: '*'\n      prettier-plugin-sort-imports: '*'\n      prettier-plugin-style-order: '*'\n      prettier-plugin-svelte: '*'\n    peerDependenciesMeta:\n      '@ianvs/prettier-plugin-sort-imports':\n        optional: true\n      '@prettier/plugin-pug':\n        optional: true\n      '@shopify/prettier-plugin-liquid':\n        optional: true\n      '@trivago/prettier-plugin-sort-imports':\n        optional: true\n      '@zackad/prettier-plugin-twig-melody':\n        optional: true\n      prettier-plugin-astro:\n        optional: true\n      prettier-plugin-css-order:\n        optional: true\n      prettier-plugin-import-sort:\n        optional: true\n      prettier-plugin-jsdoc:\n        optional: true\n      prettier-plugin-marko:\n        optional: true\n      prettier-plugin-multiline-arrays:\n        optional: true\n      prettier-plugin-organize-attributes:\n        optional: true\n      prettier-plugin-organize-imports:\n        optional: true\n      prettier-plugin-sort-imports:\n        optional: true\n      prettier-plugin-style-order:\n        optional: true\n      prettier-plugin-svelte:\n        optional: true\n\n  prettier@3.3.3:\n    resolution: {integrity: sha512-i2tDNA0O5IrMO757lfrdQZCc2jPNDVntV0m/+4whiDfWaTKfMNgR7Qz0NAeGz/nRqF4m5/6CLzbP4/liHt12Ew==}\n    engines: {node: '>=14'}\n    hasBin: true\n\n  pretty-bytes@5.6.0:\n    resolution: {integrity: sha512-FFw039TmrBqFK8ma/7OL3sDz/VytdtJr044/QUJtH0wK9lb9jLq9tJyIxUwtQJHwar2BqtiA4iCWSwo9JLkzFg==}\n    engines: {node: '>=6'}\n\n  pretty-bytes@6.1.1:\n    resolution: {integrity: sha512-mQUvGU6aUFQ+rNvTIAcZuWGRT9a6f6Yrg9bHs4ImKF+HZCEK+plBvnAZYSIQztknZF2qnzNtr6F8s0+IuptdlQ==}\n    engines: {node: ^14.13.1 || >=16.0.0}\n\n  printable-characters@1.0.42:\n    resolution: {integrity: sha512-dKp+C4iXWK4vVYZmYSd0KBH5F/h1HoZRsbJ82AVKRO3PEo8L4lBS/vLwhVtpwwuYcoIsVY+1JYKR268yn480uQ==}\n\n  process-nextick-args@2.0.1:\n    resolution: {integrity: sha512-3ouUOpQhtgrbOa17J7+uxOTpITYWaGP7/AhoR3+A+/1e9skrzelGi/dXzEYyvbxubEF6Wn2ypscTKiKJFFn1ag==}\n\n  process@0.11.10:\n    resolution: {integrity: sha512-cdGef/drWFoydD1JsMzuFf8100nZl+GT+yacc2bEced5f9Rjk4z+WtFUTBu9PhOi9j/jfmBPu0mMEY4wIdAF8A==}\n    engines: {node: '>= 0.6.0'}\n\n  prompts@2.4.2:\n    resolution: {integrity: sha512-NxNv/kLguCA7p3jE8oL2aEBsrJWgAakBpgmgK6lpPWV+WuOmY6r2/zbAVnP+T8bQlA0nzHXSJSJW0Hq7ylaD2Q==}\n    engines: {node: '>= 6'}\n\n  property-information@6.5.0:\n    resolution: {integrity: sha512-PgTgs/BlvHxOu8QuEN7wi5A0OmXaBcHpmCSTehcs6Uuu9IkDIEo13Hy7n898RHfrQ49vKCoGeWZSaAK01nwVig==}\n\n  protocols@2.0.1:\n    resolution: {integrity: sha512-/XJ368cyBJ7fzLMwLKv1e4vLxOju2MNAIokcr7meSaNcVbWz/CPcW22cP04mwxOErdA5mwjA8Q6w/cdAQxVn7Q==}\n\n  punycode.js@2.3.1:\n    resolution: {integrity: sha512-uxFIHU0YlHYhDQtV4R9J6a52SLx28BCjT+4ieh7IGbgwVJWO+km431c4yRlREUAsAmt/uMjQUyQHNEPf0M39CA==}\n    engines: {node: '>=6'}\n\n  punycode@2.3.1:\n    resolution: {integrity: sha512-vYt7UD1U9Wg6138shLtLOvdAu+8DsC/ilFtEVHcH+wydcSpNE20AfSOduf6MkRFahL5FY7X1oU7nKVZFtfq8Fg==}\n    engines: {node: '>=6'}\n\n  queue-microtask@1.2.3:\n    resolution: {integrity: sha512-NuaNSa6flKT5JaSYQzJok04JzTL1CA6aGhv5rfLW3PgqA+M2ChpZQnAC8h8i4ZFkBS8X5RqkDBHA7r4hej3K9A==}\n\n  queue-tick@1.0.1:\n    resolution: {integrity: sha512-kJt5qhMxoszgU/62PLP1CJytzd2NKetjSRnyuj31fDd3Rlcz3fzlFdFLD1SItunPwyqEOkca6GbV612BWfaBag==}\n\n  radix-vue@1.7.3:\n    resolution: {integrity: sha512-GgUagGvpO1EtNvkQ27x3Hv26VrTffZ4XRyx8eMabXRxXtbo2GbjAd2HvGjL9A/D7QVHxw1ZUMBDcYWcpw4LEiQ==}\n    peerDependencies:\n      vue: '>= 3.2.0'\n\n  radix3@1.1.2:\n    resolution: {integrity: sha512-b484I/7b8rDEdSDKckSSBA8knMpcdsXudlE/LNL639wFoHKwLbEkQFZHWEYwDC0wa0FKUcCY+GAF73Z7wxNVFA==}\n\n  randombytes@2.1.0:\n    resolution: {integrity: sha512-vYl3iOX+4CKUWuxGi9Ukhie6fsqXqS9FE2Zaic4tNFD2N2QQaXOMFbuKK4QmDHC0JO6B1Zp41J0LpT0oR68amQ==}\n\n  range-parser@1.2.1:\n    resolution: {integrity: sha512-Hrgsx+orqoygnmhFbKaHE6c296J+HTAQXoxEF6gNupROmmGJRoyzfG3ccAveqCBrwr/2yxQ5BVd/GTl5agOwSg==}\n    engines: {node: '>= 0.6'}\n\n  rc9@2.1.2:\n    resolution: {integrity: sha512-btXCnMmRIBINM2LDZoEmOogIZU7Qe7zn4BpomSKZ/ykbLObuBdvG+mFq11DL6fjH1DRwHhrlgtYWG96bJiC7Cg==}\n\n  read-cache@1.0.0:\n    resolution: {integrity: sha512-Owdv/Ft7IjOgm/i0xvNDZ1LrRANRfew4b2prF3OWMQLxLfu3bS8FVhCsrSCMK4lR56Y9ya+AThoTpDCTxCmpRA==}\n\n  readable-stream@2.3.8:\n    resolution: {integrity: sha512-8p0AUk4XODgIewSi0l8Epjs+EVnWiK7NoDIEGU0HhE7+ZyY8D1IMY7odu5lRrFXGg71L15KG8QrPmum45RTtdA==}\n\n  readable-stream@3.6.2:\n    resolution: {integrity: sha512-9u/sniCrY3D5WdsERHzHE4G2YCXqoG5FTHUiCC4SIbr6XcLZBY05ya9EKjYek9O5xOAwjGq+1JdGBAS7Q9ScoA==}\n    engines: {node: '>= 6'}\n\n  readable-stream@4.5.2:\n    resolution: {integrity: sha512-yjavECdqeZ3GLXNgRXgeQEdz9fvDDkNKyHnbHRFtOr7/LcfgBcmct7t/ET+HaCTqfh06OzoAxrkN/IfjJBVe+g==}\n    engines: {node: ^12.22.0 || ^14.17.0 || >=16.0.0}\n\n  readdir-glob@1.1.3:\n    resolution: {integrity: sha512-v05I2k7xN8zXvPD9N+z/uhXPaj0sUFCe2rcWZIpBsqxfP7xXFQ0tipAd/wjj1YxWyWtUS5IDJpOG82JKt2EAVA==}\n\n  readdirp@3.6.0:\n    resolution: {integrity: sha512-hOS089on8RduqdbhvQ5Z37A0ESjsqz6qnRcffsMU3495FuTdqSm+7bhJ29JvIOsBDEEnan5DPu9t3To9VRlMzA==}\n    engines: {node: '>=8.10.0'}\n\n  readdirp@4.0.2:\n    resolution: {integrity: sha512-yDMz9g+VaZkqBYS/ozoBJwaBhTbZo3UNYQHNRw1D3UFQB8oHB4uS/tAODO+ZLjGWmUbKnIlOWO+aaIiAxrUWHA==}\n    engines: {node: '>= 14.16.0'}\n\n  redis-errors@1.2.0:\n    resolution: {integrity: sha512-1qny3OExCf0UvUV/5wpYKf2YwPcOqXzkwKKSmKHiE6ZMQs5heeE/c8eXK+PNllPvmjgAbfnsbpkGZWy8cBpn9w==}\n    engines: {node: '>=4'}\n\n  redis-parser@3.0.0:\n    resolution: {integrity: sha512-DJnGAeenTdpMEH6uAJRK/uiyEIH9WVsUmoLwzudwGJUwZPp80PDBWPHXSAGNPwNvIXAbe7MSUB1zQFugFml66A==}\n    engines: {node: '>=4'}\n\n  regenerate-unicode-properties@10.1.1:\n    resolution: {integrity: sha512-X007RyZLsCJVVrjgEFVpLUTZwyOZk3oiL75ZcuYjlIWd6rNJtOjkBwQc5AsRrpbKVkxN6sklw/k/9m2jJYOf8Q==}\n    engines: {node: '>=4'}\n\n  regenerate@1.4.2:\n    resolution: {integrity: sha512-zrceR/XhGYU/d/opr2EKO7aRHUeiBI8qjtfHqADTwZd6Szfy16la6kqD0MIUs5z5hx6AaKa+PixpPrR289+I0A==}\n\n  regenerator-runtime@0.14.1:\n    resolution: {integrity: sha512-dYnhHh0nJoMfnkZs6GmmhFknAGRrLznOu5nc9ML+EJxGvrx6H7teuevqVqCuPcPK//3eDrrjQhehXVx9cnkGdw==}\n\n  regenerator-transform@0.15.2:\n    resolution: {integrity: sha512-hfMp2BoF0qOk3uc5V20ALGDS2ddjQaLrdl7xrGXvAIow7qeWRM2VA2HuCHkUKk9slq3VwEwLNK3DFBqDfPGYtg==}\n\n  regex-recursion@4.3.0:\n    resolution: {integrity: sha512-5LcLnizwjcQ2ALfOj95MjcatxyqF5RPySx9yT+PaXu3Gox2vyAtLDjHB8NTJLtMGkvyau6nI3CfpwFCjPUIs/A==}\n\n  regex-utilities@2.3.0:\n    resolution: {integrity: sha512-8VhliFJAWRaUiVvREIiW2NXXTmHs4vMNnSzuJVhscgmGav3g9VDxLrQndI3dZZVVdp0ZO/5v0xmX516/7M9cng==}\n\n  regex@4.3.3:\n    resolution: {integrity: sha512-r/AadFO7owAq1QJVeZ/nq9jNS1vyZt+6t1p/E59B56Rn2GCya+gr1KSyOzNL/er+r+B7phv5jG2xU2Nz1YkmJg==}\n\n  regex@5.0.2:\n    resolution: {integrity: sha512-/pczGbKIQgfTMRV0XjABvc5RzLqQmwqxLHdQao2RTXPk+pmTXB2P0IaUHYdYyk412YLwUIkaeMd5T+RzVgTqnQ==}\n\n  regexp.prototype.flags@1.5.1:\n    resolution: {integrity: sha512-sy6TXMN+hnP/wMy+ISxg3krXx7BAtWVO4UouuCN/ziM9UEne0euamVNafDfvC83bRNr95y0V5iijeDQFUNpvrg==}\n    engines: {node: '>= 0.4'}\n\n  regexpu-core@5.3.2:\n    resolution: {integrity: sha512-RAM5FlZz+Lhmo7db9L298p2vHP5ZywrVXmVXpmAD9GuL5MPH6t9ROw1iA/wfHkQ76Qe7AaPF0nGuim96/IrQMQ==}\n    engines: {node: '>=4'}\n\n  regjsparser@0.9.1:\n    resolution: {integrity: sha512-dQUtn90WanSNl+7mQKcXAgZxvUe7Z0SqXlgzv0za4LwiUhyzBC58yQO3liFoUgu8GiJVInAhJjkj1N0EtQ5nkQ==}\n    hasBin: true\n\n  replace-in-file@6.3.5:\n    resolution: {integrity: sha512-arB9d3ENdKva2fxRnSjwBEXfK1npgyci7ZZuwysgAp7ORjHSyxz6oqIjTEv8R0Ydl4Ll7uOAZXL4vbkhGIizCg==}\n    engines: {node: '>=10'}\n    hasBin: true\n\n  require-directory@2.1.1:\n    resolution: {integrity: sha512-fGxEI7+wsG9xrvdjsrlmL22OMTTiHRwAMroiEeMgq8gzoLC/PQr7RsRDSTLUg/bZAZtF+TVIkHc6/4RIKrui+Q==}\n    engines: {node: '>=0.10.0'}\n\n  require-from-string@2.0.2:\n    resolution: {integrity: sha512-Xf0nWe6RseziFMu+Ap9biiUbmplq6S9/p+7w7YXP/JBHhrUDDUhwa+vANyubuqfZWTveU//DYVGsDG7RKL/vEw==}\n    engines: {node: '>=0.10.0'}\n\n  resolve-from@5.0.0:\n    resolution: {integrity: sha512-qYg9KP24dD5qka9J47d0aVky0N+b4fTU89LN9iDnjB5waksiC49rvMB0PrUJQGoTmH50XPiqOvAjDfaijGxYZw==}\n    engines: {node: '>=8'}\n\n  resolve-path@1.4.0:\n    resolution: {integrity: sha512-i1xevIst/Qa+nA9olDxLWnLk8YZbi8R/7JPbCMcgyWaFR6bKWaexgJgEB5oc2PKMjYdrHynyz0NY+if+H98t1w==}\n    engines: {node: '>= 0.8'}\n\n  resolve-pkg-maps@1.0.0:\n    resolution: {integrity: sha512-seS2Tj26TBVOC2NIc2rOe2y2ZO7efxITtLZcGSOnHHNOQ7CkiUBfw0Iw2ck6xkIhPwLhKNLS8BO+hEpngQlqzw==}\n\n  resolve.exports@2.0.2:\n    resolution: {integrity: sha512-X2UW6Nw3n/aMgDVy+0rSqgHlv39WZAlZrXCdnbyEiKm17DSqHX4MmQMaST3FbeWR5FTuRcUwYAziZajji0Y7mg==}\n    engines: {node: '>=10'}\n\n  resolve@1.22.8:\n    resolution: {integrity: sha512-oKWePCxqpd6FlLvGV1VU0x7bkPmmCNolxzjMf4NczoDnQcIWrAF+cPtZn5i6n+RfD2d9i0tzpKnG6Yk168yIyw==}\n    hasBin: true\n\n  reusify@1.0.4:\n    resolution: {integrity: sha512-U9nH88a3fc/ekCF1l0/UP1IosiuIjyTh7hBvXVMHYgVcfGvt897Xguj2UOLDeI5BG2m7/uwyaLVT6fbtCwTyzw==}\n    engines: {iojs: '>=1.0.0', node: '>=0.10.0'}\n\n  rfdc@1.4.1:\n    resolution: {integrity: sha512-q1b3N5QkRUWUl7iyylaaj3kOpIT0N2i9MqIEQXP73GVsN9cw3fdx8X63cEmWhJGi2PPCF23Ijp7ktmd39rawIA==}\n\n  rimraf@3.0.2:\n    resolution: {integrity: sha512-JZkJMZkAGFFPP2YqXZXPbMlMBgsxzE8ILs4lMIX/2o0L9UBw9O/Y3o6wFw/i9YLapcUJWwqbi3kdxIPdC62TIA==}\n    deprecated: Rimraf versions prior to v4 are no longer supported\n    hasBin: true\n\n  rollup-plugin-inject@3.0.2:\n    resolution: {integrity: sha512-ptg9PQwzs3orn4jkgXJ74bfs5vYz1NCZlSQMBUA0wKcGp5i5pA1AO3fOUEte8enhGUC+iapTCzEWw2jEFFUO/w==}\n    deprecated: This package has been deprecated and is no longer maintained. Please use @rollup/plugin-inject.\n\n  rollup-plugin-node-polyfills@0.2.1:\n    resolution: {integrity: sha512-4kCrKPTJ6sK4/gLL/U5QzVT8cxJcofO0OU74tnB19F40cmuAKSzH5/siithxlofFEjwvw1YAhPmbvGNA6jEroA==}\n\n  rollup-plugin-terser@7.0.2:\n    resolution: {integrity: sha512-w3iIaU4OxcF52UUXiZNsNeuXIMDvFrr+ZXK6bFZ0Q60qyVfq4uLptoS4bbq3paG3x216eQllFZX7zt6TIImguQ==}\n    deprecated: This package has been deprecated and is no longer maintained. Please use @rollup/plugin-terser\n    peerDependencies:\n      rollup: ^2.0.0\n\n  rollup-plugin-visualizer@5.12.0:\n    resolution: {integrity: sha512-8/NU9jXcHRs7Nnj07PF2o4gjxmm9lXIrZ8r175bT9dK8qoLlvKTwRMArRCMgpMGlq8CTLugRvEmyMeMXIU2pNQ==}\n    engines: {node: '>=14'}\n    hasBin: true\n    peerDependencies:\n      rollup: 2.x || 3.x || 4.x\n    peerDependenciesMeta:\n      rollup:\n        optional: true\n\n  rollup-pluginutils@2.8.2:\n    resolution: {integrity: sha512-EEp9NhnUkwY8aif6bxgovPHMoMoNr2FulJziTndpt5H9RdwC47GSGuII9XxpSdzVGM0GWrNPHV6ie1LTNJPaLQ==}\n\n  rollup@2.79.1:\n    resolution: {integrity: sha512-uKxbd0IhMZOhjAiD5oAFp7BqvkA4Dv47qpOCtaNvng4HBwdbWtdOh8f5nZNuk2rp51PMGk3bzfWu5oayNEuYnw==}\n    engines: {node: '>=10.0.0'}\n    hasBin: true\n\n  rollup@4.24.0:\n    resolution: {integrity: sha512-DOmrlGSXNk1DM0ljiQA+i+o0rSLhtii1je5wgk60j49d1jHT5YYttBv1iWOnYSTG+fZZESUOSNiAl89SIet+Cg==}\n    engines: {node: '>=18.0.0', npm: '>=8.0.0'}\n    hasBin: true\n\n  run-applescript@7.0.0:\n    resolution: {integrity: sha512-9by4Ij99JUr/MCFBUkDKLWK3G9HVXmabKz9U5MlIAIuvuzkiOicRYs8XJLxX+xahD+mLiiCYDqF9dKAgtzKP1A==}\n    engines: {node: '>=18'}\n\n  run-parallel@1.2.0:\n    resolution: {integrity: sha512-5l4VyZR86LZ/lDxZTR6jqL8AFE2S0IFLMP26AbjsLVADxHdhB/c0GUsH+y39UfCi3dzz8OlQuPmnaJOMoDHQBA==}\n\n  safe-array-concat@1.0.1:\n    resolution: {integrity: sha512-6XbUAseYE2KtOuGueyeobCySj9L4+66Tn6KQMOPQJrAJEowYKW/YR/MGJZl7FdydUdaFu4LYyDZjxf4/Nmo23Q==}\n    engines: {node: '>=0.4'}\n\n  safe-buffer@5.1.2:\n    resolution: {integrity: sha512-Gd2UZBJDkXlY7GbJxfsE8/nvKkUEU1G38c1siN6QP6a9PT9MmHB8GnpscSmMJSoF8LOIrt8ud/wPtojys4G6+g==}\n\n  safe-buffer@5.2.1:\n    resolution: {integrity: sha512-rp3So07KcdmmKbGvgaNxQSJr7bGVSVk5S9Eq1F+ppbRo70+YeaDxkw5Dd8NPN+GD6bjnYm2VuPuCXmpuYvmCXQ==}\n\n  safe-regex-test@1.0.0:\n    resolution: {integrity: sha512-JBUUzyOgEwXQY1NuPtvcj/qcBDbDmEvWufhlnXZIm75DEHp+afM1r1ujJpJsV/gSM4t59tpDyPi1sd6ZaPFfsA==}\n\n  schema-utils@3.3.0:\n    resolution: {integrity: sha512-pN/yOAvcC+5rQ5nERGuwrjLlYvLTbCibnZ1I7B1LaiAz9BRBlE9GMgE/eqV30P7aJQUf7Ddimy/RsbYO/GrVGg==}\n    engines: {node: '>= 10.13.0'}\n\n  scule@1.3.0:\n    resolution: {integrity: sha512-6FtHJEvt+pVMIB9IBY+IcCJ6Z5f1iQnytgyfKMhDKgmzYG+TeH/wx1y3l27rshSbLiSanrR9ffZDrEsmjlQF2g==}\n\n  selfsigned@2.4.1:\n    resolution: {integrity: sha512-th5B4L2U+eGLq1TVh7zNRGBapioSORUeymIydxgFpwww9d2qyKvtuPU2jJuHvYAwwqi2Y596QBL3eEqcPEYL8Q==}\n    engines: {node: '>=10'}\n\n  semver@6.3.1:\n    resolution: {integrity: sha512-BR7VvDCVHO+q2xBEWskxS6DJE1qRnb7DxzUrogb71CWoSficBxYsiAGd+Kl0mmq/MprG9yArRkyrQxTO6XjMzA==}\n    hasBin: true\n\n  semver@7.5.4:\n    resolution: {integrity: sha512-1bCSESV6Pv+i21Hvpxp3Dx+pSD8lIPt8uVjRrxAUt/nbswYc+tK6Y2btiULjd4+fnq15PX+nqQDC7Oft7WkwcA==}\n    engines: {node: '>=10'}\n    hasBin: true\n\n  semver@7.6.3:\n    resolution: {integrity: sha512-oVekP1cKtI+CTDvHWYFUcMtsK/00wmAEfyqKfNdARm8u1wNVhSgaX7A8d4UuIlUI5e84iEwOhs7ZPYRmzU9U6A==}\n    engines: {node: '>=10'}\n    hasBin: true\n\n  send@0.19.0:\n    resolution: {integrity: sha512-dW41u5VfLXu8SJh5bwRmyYUbAoSB3c9uQh6L8h/KtsFREPWpbX1lrljJo186Jc4nmci/sGUZ9a0a0J2zgfq2hw==}\n    engines: {node: '>= 0.8.0'}\n\n  serialize-javascript@4.0.0:\n    resolution: {integrity: sha512-GaNA54380uFefWghODBWEGisLZFj00nS5ACs6yHa9nLqlLpVLO8ChDGeKRjZnV4Nh4n0Qi7nhYZD/9fCPzEqkw==}\n\n  serialize-javascript@6.0.2:\n    resolution: {integrity: sha512-Saa1xPByTTq2gdeFZYLLo+RFE35NHZkAbqZeWNd3BpzppeVisAqpDjcp8dyf6uIvEqJRd46jemmyA4iFIeVk8g==}\n\n  serve-placeholder@2.0.2:\n    resolution: {integrity: sha512-/TMG8SboeiQbZJWRlfTCqMs2DD3SZgWp0kDQePz9yUuCnDfDh/92gf7/PxGhzXTKBIPASIHxFcZndoNbp6QOLQ==}\n\n  serve-static@1.16.2:\n    resolution: {integrity: sha512-VqpjJZKadQB/PEbEwvFdO43Ax5dFBZ2UECszz8bQ7pi7wt//PWe1P6MN7eCnjsatYtBT6EuiClbjSWP2WrIoTw==}\n    engines: {node: '>= 0.8.0'}\n\n  set-blocking@2.0.0:\n    resolution: {integrity: sha512-KiKBS8AnWGEyLzofFfmvKwpdPzqiy16LvQfK3yv/fVH7Bj13/wl3JSR1J+rfgRE9q7xUJK4qvgS8raSOeLUehw==}\n\n  set-function-length@1.1.1:\n    resolution: {integrity: sha512-VoaqjbBJKiWtg4yRcKBQ7g7wnGnLV3M8oLvVWwOk2PdYY6PEFegR1vezXR0tw6fZGF9csVakIRjrJiy2veSBFQ==}\n    engines: {node: '>= 0.4'}\n\n  set-function-name@2.0.1:\n    resolution: {integrity: sha512-tMNCiqYVkXIZgc2Hnoy2IvC/f8ezc5koaRFkCjrpWzGpCd3qbZXPzVy9MAZzK1ch/X0jvSkojys3oqJN0qCmdA==}\n    engines: {node: '>= 0.4'}\n\n  setprototypeof@1.1.0:\n    resolution: {integrity: sha512-BvE/TwpZX4FXExxOxZyRGQQv651MSwmWKZGqvmPcRIjDqWub67kTKuIMx43cZZrS/cBBzwBcNDWoFxt2XEFIpQ==}\n\n  setprototypeof@1.2.0:\n    resolution: {integrity: sha512-E5LDX7Wrp85Kil5bhZv46j8jOeboKq5JMmYM3gVGdGH8xFpPWXUMsNrlODCrkoxMEeNi/XZIwuRvY4XNwYMJpw==}\n\n  shebang-command@2.0.0:\n    resolution: {integrity: sha512-kHxr2zZpYtdmrN1qDjrrX/Z1rR1kG8Dx+gkpK1G4eXmvXswmcE1hTWBWYUzlraYw1/yZp6YuDY77YtvbN0dmDA==}\n    engines: {node: '>=8'}\n\n  shebang-regex@3.0.0:\n    resolution: {integrity: sha512-7++dFhtcx3353uBaq8DDR4NuxBetBzC7ZQOhmTQInHEd6bSrXdiEyzCvG07Z44UYdLShWUyXt5M/yhz8ekcb1A==}\n    engines: {node: '>=8'}\n\n  shell-quote@1.8.1:\n    resolution: {integrity: sha512-6j1W9l1iAs/4xYBI1SYOVZyFcCis9b4KCLQ8fgAGG07QvzaRLVVRQvAy85yNmmZSjYjg4MWh4gNvlPujU/5LpA==}\n\n  shiki@1.22.0:\n    resolution: {integrity: sha512-/t5LlhNs+UOKQCYBtl5ZsH/Vclz73GIqT2yQsCBygr8L/ppTdmpL4w3kPLoZJbMKVWtoG77Ue1feOjZfDxvMkw==}\n\n  shiki@1.24.0:\n    resolution: {integrity: sha512-qIneep7QRwxRd5oiHb8jaRzH15V/S8F3saCXOdjwRLgozZJr5x2yeBhQtqkO3FSzQDwYEFAYuifg4oHjpDghrg==}\n\n  side-channel@1.0.4:\n    resolution: {integrity: sha512-q5XPytqFEIKHkGdiMIrY10mvLRvnQh42/+GoBlFW3b2LXLE2xxJpZFdm94we0BaoV3RwJyGqg5wS7epxTv0Zvw==}\n\n  signal-exit@3.0.7:\n    resolution: {integrity: sha512-wnD2ZE+l+SPC/uoS0vXeE9L1+0wuaMqKlfz9AMUo38JsyLSBWSFcHR1Rri62LZc12vLr1gb3jl7iwQhgwpAbGQ==}\n\n  signal-exit@4.1.0:\n    resolution: {integrity: sha512-bzyZ1e88w9O1iNJbKnOlvYTrWPDl46O1bG0D3XInv+9tkPrxrN8jUUTiFlDkkmKWgn1M6CfIA13SuGqOa9Korw==}\n    engines: {node: '>=14'}\n\n  simple-git@3.27.0:\n    resolution: {integrity: sha512-ivHoFS9Yi9GY49ogc6/YAi3Fl9ROnF4VyubNylgCkA+RVqLaKWnDSzXOVzya8csELIaWaYNutsEuAhZrtOjozA==}\n\n  sirv@2.0.4:\n    resolution: {integrity: sha512-94Bdh3cC2PKrbgSOUqTiGPWVZeSiXfKOVZNJniWoqrWrRkB1CJzBU3NEbiTsPcYy1lDsANA/THzS+9WBiy5nfQ==}\n    engines: {node: '>= 10'}\n\n  sirv@3.0.0:\n    resolution: {integrity: sha512-BPwJGUeDaDCHihkORDchNyyTvWFhcusy1XMmhEVTQTwGeybFbp8YEmB+njbPnth1FibULBSBVwCQni25XlCUDg==}\n    engines: {node: '>=18'}\n\n  sisteransi@1.0.5:\n    resolution: {integrity: sha512-bLGGlR1QxBcynn2d5YmDX4MGjlZvy2MRBDRNHLJ8VI6l6+9FUiyTFNJ0IveOSP0bcXgVDPRcfGqA0pjaqUpfVg==}\n\n  slash@5.1.0:\n    resolution: {integrity: sha512-ZA6oR3T/pEyuqwMgAKT0/hAv8oAXckzbkmR0UkUosQ+Mc4RxGoJkRmwHgHufaenlyAgE1Mxgpdcrf75y6XcnDg==}\n    engines: {node: '>=14.16'}\n\n  smob@1.5.0:\n    resolution: {integrity: sha512-g6T+p7QO8npa+/hNx9ohv1E5pVCmWrVCUzUXJyLdMmftX6ER0oiWY/w9knEonLpnOp6b6FenKnMfR8gqwWdwig==}\n\n  source-map-js@1.2.1:\n    resolution: {integrity: sha512-UXWMKhLOwVKb728IUtQPXxfYU+usdybtUrK/8uGE8CQMvrhOpwvzDBwj0QhSL7MQc7vIsISBG8VQ8+IDQxpfQA==}\n    engines: {node: '>=0.10.0'}\n\n  source-map-support@0.5.21:\n    resolution: {integrity: sha512-uBHU3L3czsIyYXKX88fdrGovxdSCoTGDRZ6SYXtSRxLZUzHg5P/66Ht6uoUlHu9EZod+inXhKo3qQgwXUT/y1w==}\n\n  source-map@0.6.1:\n    resolution: {integrity: sha512-UjgapumWlbMhkBgzT7Ykc5YXUT46F0iKu8SGXq0bcwP5dz/h0Plj6enJqjz1Zbq2l5WaqYnrVbwWOWMyF3F47g==}\n    engines: {node: '>=0.10.0'}\n\n  source-map@0.7.4:\n    resolution: {integrity: sha512-l3BikUxvPOcn5E74dZiq5BGsTb5yEwhaTSzccU6t4sDOH8NWJCstKO5QT2CvtFoK6F0saL7p9xHAqHOlCPJygA==}\n    engines: {node: '>= 8'}\n\n  source-map@0.8.0-beta.0:\n    resolution: {integrity: sha512-2ymg6oRBpebeZi9UUNsgQ89bhx01TcTkmNTGnNO88imTmbSgy4nfujrgVEFKWpMTEGA11EDkTt7mqObTPdigIA==}\n    engines: {node: '>= 8'}\n\n  sourcemap-codec@1.4.8:\n    resolution: {integrity: sha512-9NykojV5Uih4lgo5So5dtw+f0JgJX30KCNI8gwhz2J9A15wD0Ml6tjHKwf6fTSa6fAdVBdZeNOs9eJ71qCk8vA==}\n    deprecated: Please use @jridgewell/sourcemap-codec instead\n\n  space-separated-tokens@2.0.2:\n    resolution: {integrity: sha512-PEGlAwrG8yXGXRjW32fGbg66JAlOAwbObuqVoJpv/mRgoWDQfgH1wDPvtzWyUSNAXBGSk8h755YDbbcEy3SH2Q==}\n\n  speakingurl@14.0.1:\n    resolution: {integrity: sha512-1POYv7uv2gXoyGFpBCmpDVSNV74IfsWlDW216UPjbWufNf+bSU6GdbDsxdcxtfwb4xlI3yxzOTKClUosxARYrQ==}\n    engines: {node: '>=0.10.0'}\n\n  split2@4.2.0:\n    resolution: {integrity: sha512-UcjcJOWknrNkF6PLX83qcHM6KHgVKNkV62Y8a5uYDVv9ydGQVwAHMKqHdJje1VTWpljG0WYpCDhrCdAOYH4TWg==}\n    engines: {node: '>= 10.x'}\n\n  splitpanes@3.1.5:\n    resolution: {integrity: sha512-r3Mq2ITFQ5a2VXLOy4/Sb2Ptp7OfEO8YIbhVJqJXoFc9hc5nTXXkCvtVDjIGbvC0vdE7tse+xTM9BMjsszP6bw==}\n\n  stacktracey@2.1.8:\n    resolution: {integrity: sha512-Kpij9riA+UNg7TnphqjH7/CzctQ/owJGNbFkfEeve4Z4uxT5+JapVLFXcsurIfN34gnTWZNJ/f7NMG0E8JDzTw==}\n\n  standard-as-callback@2.1.0:\n    resolution: {integrity: sha512-qoRRSyROncaz1z0mvYqIE4lCd9p2R90i6GxW3uZv5ucSu8tU7B5HXUP1gG8pVZsYNVaXjk8ClXHPttLyxAL48A==}\n\n  statuses@1.5.0:\n    resolution: {integrity: sha512-OpZ3zP+jT1PI7I8nemJX4AKmAX070ZkYPVWV/AaKTJl+tXCTGyVdC1a4SL8RUQYEwk/f34ZX8UTykN68FwrqAA==}\n    engines: {node: '>= 0.6'}\n\n  statuses@2.0.1:\n    resolution: {integrity: sha512-RwNA9Z/7PrK06rYLIzFMlaF+l73iwpzsqRIFgbMLbTcLD6cOao82TaWefPXQvB2fOC4AjuYSEndS7N/mTCbkdQ==}\n    engines: {node: '>= 0.8'}\n\n  std-env@3.7.0:\n    resolution: {integrity: sha512-JPbdCEQLj1w5GilpiHAx3qJvFndqybBysA3qUOnznweH4QbNYUsW/ea8QzSrnh0vNsezMMw5bcVool8lM0gwzg==}\n\n  std-env@3.8.0:\n    resolution: {integrity: sha512-Bc3YwwCB+OzldMxOXJIIvC6cPRWr/LxOp48CdQTOkPyk/t4JWWJbrilwBd7RJzKV8QW7tJkcgAmeuLLJugl5/w==}\n\n  stoppable@1.1.0:\n    resolution: {integrity: sha512-KXDYZ9dszj6bzvnEMRYvxgeTHU74QBFL54XKtP3nyMuJ81CFYtABZ3bAzL2EdFUaEwJOBOgENyFj3R7oTzDyyw==}\n    engines: {node: '>=4', npm: '>=6'}\n\n  streamx@2.20.1:\n    resolution: {integrity: sha512-uTa0mU6WUC65iUvzKH4X9hEdvSW7rbPxPtwfWiLMSj3qTdQbAiUboZTxauKfpFuGIGa1C2BYijZ7wgdUXICJhA==}\n\n  string-width@4.2.3:\n    resolution: {integrity: sha512-wKyQRQpjJ0sIp62ErSZdGsjMJWsap5oRNihHhu6G7JVO/9jIB6UyevL+tXuOqrng8j/cxKTWyWUwvSTriiZz/g==}\n    engines: {node: '>=8'}\n\n  string-width@5.1.2:\n    resolution: {integrity: sha512-HnLOCR3vjcY8beoNLtcjZ5/nxn2afmME6lhrDrebokqMap+XbeW8n9TXpPDOqdGK5qcI3oT0GKTW6wC7EMiVqA==}\n    engines: {node: '>=12'}\n\n  string.prototype.matchall@4.0.10:\n    resolution: {integrity: sha512-rGXbGmOEosIQi6Qva94HUjgPs9vKW+dkG7Y8Q5O2OYkWL6wFaTRZO8zM4mhP94uX55wgyrXzfS2aGtGzUL7EJQ==}\n\n  string.prototype.trim@1.2.8:\n    resolution: {integrity: sha512-lfjY4HcixfQXOfaqCvcBuOIapyaroTXhbkfJN3gcB1OtyupngWK4sEET9Knd0cXd28kTUqu/kHoV4HKSJdnjiQ==}\n    engines: {node: '>= 0.4'}\n\n  string.prototype.trimend@1.0.7:\n    resolution: {integrity: sha512-Ni79DqeB72ZFq1uH/L6zJ+DKZTkOtPIHovb3YZHQViE+HDouuU4mBrLOLDn5Dde3RF8qw5qVETEjhu9locMLvA==}\n\n  string.prototype.trimstart@1.0.7:\n    resolution: {integrity: sha512-NGhtDFu3jCEm7B4Fy0DpLewdJQOZcQ0rGbwQ/+stjnrp2i+rlKeCvos9hOIeCmqwratM47OBxY7uFZzjxHXmrg==}\n\n  string_decoder@1.1.1:\n    resolution: {integrity: sha512-n/ShnvDi6FHbbVfviro+WojiFzv+s8MPMHBczVePfUpDJLwoLT0ht1l4YwBCbi8pJAveEEdnkHyPyTP/mzRfwg==}\n\n  string_decoder@1.3.0:\n    resolution: {integrity: sha512-hkRX8U1WjJFd8LsDJ2yQ/wWWxaopEsABU1XfkM8A+j0+85JAGppt16cr1Whg6KIbb4okU6Mql6BOj+uup/wKeA==}\n\n  stringify-entities@4.0.4:\n    resolution: {integrity: sha512-IwfBptatlO+QCJUo19AqvrPNqlVMpW9YEL2LIVY+Rpv2qsjCGxaDLNRgeGsQWJhfItebuJhsGSLjaBbNSQ+ieg==}\n\n  stringify-object@3.3.0:\n    resolution: {integrity: sha512-rHqiFh1elqCQ9WPLIC8I0Q/g/wj5J1eMkyoiD6eoQApWHP0FtlK7rqnhmabL5VUY9JQCcqwwvlOaSuutekgyrw==}\n    engines: {node: '>=4'}\n\n  strip-ansi@6.0.1:\n    resolution: {integrity: sha512-Y38VPSHcqkFrCpFnQ9vuSXmquuv5oXOKpGeT6aGrr3o3Gc9AlVa6JBfUSOCnbxGGZF+/0ooI7KrPuUSztUdU5A==}\n    engines: {node: '>=8'}\n\n  strip-ansi@7.1.0:\n    resolution: {integrity: sha512-iq6eVVI64nQQTRYq2KtEg2d2uU7LElhTJwsH4YzIHZshxlgZms/wIc4VoDQTlG/IvVIrBKG06CrZnp0qv7hkcQ==}\n    engines: {node: '>=12'}\n\n  strip-comments@2.0.1:\n    resolution: {integrity: sha512-ZprKx+bBLXv067WTCALv8SSz5l2+XhpYCsVtSqlMnkAXMWDq+/ekVbl1ghqP9rUHTzv6sm/DwCOiYutU/yp1fw==}\n    engines: {node: '>=10'}\n\n  strip-final-newline@3.0.0:\n    resolution: {integrity: sha512-dOESqjYr96iWYylGObzd39EuNTa5VJxyvVAEm5Jnh7KGo75V43Hk1odPQkNDyXNmUR6k+gEiDVXnjB8HJ3crXw==}\n    engines: {node: '>=12'}\n\n  strip-literal@2.1.0:\n    resolution: {integrity: sha512-Op+UycaUt/8FbN/Z2TWPBLge3jWrP3xj10f3fnYxf052bKuS3EKs1ZQcVGjnEMdsNVAM+plXRdmjrZ/KgG3Skw==}\n\n  strip-literal@2.1.1:\n    resolution: {integrity: sha512-631UJ6O00eNGfMiWG78ck80dfBab8X6IVFB51jZK5Icd7XAs60Z5y7QdSd/wGIklnWvRbUNloVzhOKKmutxQ6Q==}\n\n  stylehacks@7.0.4:\n    resolution: {integrity: sha512-i4zfNrGMt9SB4xRK9L83rlsFCgdGANfeDAYacO1pkqcE7cRHPdWHwnKZVz7WY17Veq/FvyYsRAU++Ga+qDFIww==}\n    engines: {node: ^18.12.0 || ^20.9.0 || >=22.0}\n    peerDependencies:\n      postcss: ^8.4.31\n\n  sucrase@3.35.0:\n    resolution: {integrity: sha512-8EbVDiu9iN/nESwxeSxDKe0dunta1GOlHufmSSXxMD2z2/tMZpDMpvXQGsc+ajGo8y2uYUmixaSRUc/QPoQ0GA==}\n    engines: {node: '>=16 || 14 >=14.17'}\n    hasBin: true\n\n  superjson@2.2.1:\n    resolution: {integrity: sha512-8iGv75BYOa0xRJHK5vRLEjE2H/i4lulTjzpUXic3Eg8akftYjkmQDa8JARQ42rlczXyFR3IeRoeFCc7RxHsYZA==}\n    engines: {node: '>=16'}\n\n  supports-color@5.5.0:\n    resolution: {integrity: sha512-QjVjwdXIt408MIiAqCX4oUKsgU2EqAGzs2Ppkm4aQYbjm+ZEWEcW4SfFNTr4uMNZma0ey4f5lgLrkB0aX0QMow==}\n    engines: {node: '>=4'}\n\n  supports-color@7.2.0:\n    resolution: {integrity: sha512-qpCAvRl9stuOHveKsn7HncJRvv501qIacKzQlO/+Lwxc9+0q2wLyv4Dfvt80/DPn2pqOBsJdDiogXGR9+OvwRw==}\n    engines: {node: '>=8'}\n\n  supports-color@8.1.1:\n    resolution: {integrity: sha512-MpUEN2OodtUzxvKQl72cUF7RQ5EiHsGvSsVG0ia9c5RbWGL2CI4C7EpPS8UTBIplnlzZiNuV56w+FuNxy3ty2Q==}\n    engines: {node: '>=10'}\n\n  supports-color@9.4.0:\n    resolution: {integrity: sha512-VL+lNrEoIXww1coLPOmiEmK/0sGigko5COxI09KzHc2VJXJsQ37UaQ+8quuxjDeA7+KnLGTWRyOXSLLR2Wb4jw==}\n    engines: {node: '>=12'}\n\n  supports-preserve-symlinks-flag@1.0.0:\n    resolution: {integrity: sha512-ot0WnXS9fgdkgIcePe6RHNk1WA8+muPa6cSjeR3V8K27q9BB1rTE3R1p7Hv0z1ZyAc8s6Vvv8DIyWf681MAt0w==}\n    engines: {node: '>= 0.4'}\n\n  svg-tags@1.0.0:\n    resolution: {integrity: sha512-ovssysQTa+luh7A5Weu3Rta6FJlFBBbInjOh722LIt6klpU2/HtdUbszju/G4devcvk8PGt7FCLv5wftu3THUA==}\n\n  svgo@3.3.2:\n    resolution: {integrity: sha512-OoohrmuUlBs8B8o6MB2Aevn+pRIH9zDALSR+6hhqVfa6fRwG/Qw9VUMSMW9VNg2CFc/MTIfabtdOVl9ODIJjpw==}\n    engines: {node: '>=14.0.0'}\n    hasBin: true\n\n  system-architecture@0.1.0:\n    resolution: {integrity: sha512-ulAk51I9UVUyJgxlv9M6lFot2WP3e7t8Kz9+IS6D4rVba1tR9kON+Ey69f+1R4Q8cd45Lod6a4IcJIxnzGc/zA==}\n    engines: {node: '>=18'}\n\n  tabbable@6.2.0:\n    resolution: {integrity: sha512-Cat63mxsVJlzYvN51JmVXIgNoUokrIaT2zLclCXjRd8boZ0004U4KCs/sToJ75C6sdlByWxpYnb5Boif1VSFew==}\n\n  tailwind-config-viewer@2.0.4:\n    resolution: {integrity: sha512-icvcmdMmt9dphvas8wL40qttrHwAnW3QEN4ExJ2zICjwRsPj7gowd1cOceaWG3IfTuM/cTNGQcx+bsjMtmV+cw==}\n    engines: {node: '>=13'}\n    hasBin: true\n    peerDependencies:\n      tailwindcss: 1 || 2 || 2.0.1-compat || 3\n\n  tailwind-merge@2.5.3:\n    resolution: {integrity: sha512-d9ZolCAIzom1nf/5p4LdD5zvjmgSxY0BGgdSvmXIoMYAiPdAW/dSpP7joCDYFY7r/HkEa2qmPtkgsu0xjQeQtw==}\n\n  tailwindcss-easing@0.2.1:\n    resolution: {integrity: sha512-MfvXQGJOc3/o2ot98Baw7uc/yxon55AdIpC4eCG9H4dQsTzR8G4kvnzT5n6nYdRgixZhaovdPANSBlVHwYg0sA==}\n    peerDependencies:\n      tailwindcss: '>=2.0.0'\n\n  tailwindcss@3.4.13:\n    resolution: {integrity: sha512-KqjHOJKogOUt5Bs752ykCeiwvi0fKVkr5oqsFNt/8px/tA8scFPIlkygsf6jXrfCqGHz7VflA6+yytWuM+XhFw==}\n    engines: {node: '>=14.0.0'}\n    hasBin: true\n\n  tapable@2.2.1:\n    resolution: {integrity: sha512-GNzQvQTOIP6RyTfE2Qxb8ZVlNmw0n88vp1szwWRimP02mnTsx3Wtn5qRdqY9w2XduFNUgvOwhNnQsjwCp+kqaQ==}\n    engines: {node: '>=6'}\n\n  tar-stream@3.1.7:\n    resolution: {integrity: sha512-qJj60CXt7IU1Ffyc3NJMjh6EkuCFej46zUqJ4J7pqYlThyd9bO0XBTmcOIhSzZJVWfsLks0+nle/j538YAW9RQ==}\n\n  tar@6.2.1:\n    resolution: {integrity: sha512-DZ4yORTwrbTj/7MZYq2w+/ZFdI6OZ/f9SFHR+71gIVUZhOQPHzVCLpvRnPgyaMpfWxxk/4ONva3GQSyNIKRv6A==}\n    engines: {node: '>=10'}\n\n  temp-dir@2.0.0:\n    resolution: {integrity: sha512-aoBAniQmmwtcKp/7BzsH8Cxzv8OL736p7v1ihGb5e9DJ9kTwGWHrQrVB5+lfVDzfGrdRzXch+ig7LHaY1JTOrg==}\n    engines: {node: '>=8'}\n\n  tempy@0.6.0:\n    resolution: {integrity: sha512-G13vtMYPT/J8A4X2SjdtBTphZlrp1gKv6hZiOjw14RCWg6GbHuQBGtjlx75xLbYV/wEc0D7G5K4rxKP/cXk8Bw==}\n    engines: {node: '>=10'}\n\n  terser-webpack-plugin@5.3.10:\n    resolution: {integrity: sha512-BKFPWlPDndPs+NGGCr1U59t0XScL5317Y0UReNrHaw9/FwhPENlq6bfgs+4yPfyP51vqC1bQ4rp1EfXW5ZSH9w==}\n    engines: {node: '>= 10.13.0'}\n    peerDependencies:\n      '@swc/core': '*'\n      esbuild: '*'\n      uglify-js: '*'\n      webpack: ^5.1.0\n    peerDependenciesMeta:\n      '@swc/core':\n        optional: true\n      esbuild:\n        optional: true\n      uglify-js:\n        optional: true\n\n  terser@5.26.0:\n    resolution: {integrity: sha512-dytTGoE2oHgbNV9nTzgBEPaqAWvcJNl66VZ0BkJqlvp71IjO8CxdBx/ykCNb47cLnCmCvRZ6ZR0tLkqvZCdVBQ==}\n    engines: {node: '>=10'}\n    hasBin: true\n\n  text-decoder@1.2.1:\n    resolution: {integrity: sha512-x9v3H/lTKIJKQQe7RPQkLfKAnc9lUTkWDypIQgTzPJAq+5/GCDHonmshfvlsNSj58yyshbIJJDLmU15qNERrXQ==}\n\n  thenify-all@1.6.0:\n    resolution: {integrity: sha512-RNxQH/qI8/t3thXJDwcstUO4zeqo64+Uy/+sNVRBx4Xn2OX+OZ9oP+iJnNFqplFra2ZUVeKCSa2oVWi3T4uVmA==}\n    engines: {node: '>=0.8'}\n\n  thenify@3.3.1:\n    resolution: {integrity: sha512-RVZSIV5IG10Hk3enotrhvz0T9em6cyHBLkH/YAZuKqd8hRkKhSfCGIcP2KUY0EPxndzANBmNllzWPwak+bheSw==}\n\n  third-party-capital@2.3.0:\n    resolution: {integrity: sha512-p4rGOF4JCkI18HH3a1Vfd89Mg37TLlAsGmePBt20MA52frviYSBE6ToGOmTpqRC4EIlS5/4Owv6TpegFJUSkOg==}\n\n  tiny-invariant@1.3.3:\n    resolution: {integrity: sha512-+FbBPE1o9QAYvviau/qC5SE3caw21q3xkvWKBtja5vgqOWIHHJ3ioaq1VPfn/Szqctz2bU/oYeKd9/z5BL+PVg==}\n\n  tinyexec@0.3.0:\n    resolution: {integrity: sha512-tVGE0mVJPGb0chKhqmsoosjsS+qUnJVGJpZgsHYQcGoPlG3B51R3PouqTgEGH2Dc9jjFyOqOpix6ZHNMXp1FZg==}\n\n  tinyglobby@0.2.10:\n    resolution: {integrity: sha512-Zc+8eJlFMvgatPZTl6A9L/yht8QqdmUNtURHaKZLmKBE12hNPSrqNkUp2cs3M/UKmNVVAMFQYSjYIVHDjW5zew==}\n    engines: {node: '>=12.0.0'}\n\n  tinyglobby@0.2.6:\n    resolution: {integrity: sha512-NbBoFBpqfcgd1tCiO8Lkfdk+xrA7mlLR9zgvZcZWQQwU63XAfUePyd6wZBaU93Hqw347lHnwFzttAkemHzzz4g==}\n    engines: {node: '>=12.0.0'}\n\n  tinyglobby@0.2.9:\n    resolution: {integrity: sha512-8or1+BGEdk1Zkkw2ii16qSS7uVrQJPre5A9o/XkWPATkk23FZh/15BKFxPnlTy6vkljZxLqYCzzBMj30ZrSvjw==}\n    engines: {node: '>=12.0.0'}\n\n  to-fast-properties@2.0.0:\n    resolution: {integrity: sha512-/OaKK0xYrs3DmxRYqL/yDc+FxFUVYhDlXMhRmv3z915w2HF1tnN1omB354j8VUGO/hbRzyD6Y3sA7v7GS/ceog==}\n    engines: {node: '>=4'}\n\n  to-regex-range@5.0.1:\n    resolution: {integrity: sha512-65P7iz6X5yEr1cwcgvQxbbIw7Uk3gOy5dIdtZ4rDveLqhrdJP+Li/Hx6tyK0NEb+2GCyneCMJiGqrADCSNk8sQ==}\n    engines: {node: '>=8.0'}\n\n  toidentifier@1.0.1:\n    resolution: {integrity: sha512-o5sSPKEkg/DIQNmH43V0/uerLrpzVedkUh8tGNvaeXpfpuwjKenlSox/2O/BTlZUtEe+JG7s5YhEz608PlAHRA==}\n    engines: {node: '>=0.6'}\n\n  totalist@3.0.1:\n    resolution: {integrity: sha512-sf4i37nQ2LBx4m3wB74y+ubopq6W/dIzXg0FDGjsYnZHVa1Da8FH853wlL2gtUhg+xJXjfk3kUZS3BRoQeoQBQ==}\n    engines: {node: '>=6'}\n\n  tr46@0.0.3:\n    resolution: {integrity: sha512-N3WMsuqV66lT30CrXNbEjx4GEwlow3v6rr4mCcv6prnfwhS01rkgyFdjPNBYd9br7LpXV1+Emh01fHnq2Gdgrw==}\n\n  tr46@1.0.1:\n    resolution: {integrity: sha512-dTpowEjclQ7Kgx5SdBkqRzVhERQXov8/l9Ft9dVM9fmg0W0KQSVaXX9T4i6twCPNtYiZM53lpSSUAwJbFPOHxA==}\n\n  trim-lines@3.0.1:\n    resolution: {integrity: sha512-kRj8B+YHZCc9kQYdWfJB2/oUl9rA99qbowYYBtr4ui4mZyAQ2JpvVBd/6U2YloATfqBhBTSMhTpgBHtU0Mf3Rg==}\n\n  ts-interface-checker@0.1.13:\n    resolution: {integrity: sha512-Y/arvbn+rrz3JCKl9C4kVNfTfSm2/mEp5FSz5EsZSANGPSlQrpRI5M4PKF+mJnE52jOO90PnPSc3Ur3bTQw0gA==}\n\n  tslib@2.6.2:\n    resolution: {integrity: sha512-AEYxH93jGFPn/a2iVAwW87VuUIkR1FVUKB77NwMF7nBTDkDrrT/Hpt/IrCJ0QXhW27jTBDcf5ZY7w6RiqTMw2Q==}\n\n  tsscmp@1.0.6:\n    resolution: {integrity: sha512-LxhtAkPDTkVCMQjt2h6eBVY28KCjikZqZfMcC15YBeNjkgUpdCfBu5HoiOTDu86v6smE8yOjyEktJ8hlbANHQA==}\n    engines: {node: '>=0.6.x'}\n\n  tsx@4.19.1:\n    resolution: {integrity: sha512-0flMz1lh74BR4wOvBjuh9olbnwqCPc35OOlfyzHba0Dc+QNUeWX/Gq2YTbnwcWPO3BMd8fkzRVrHcsR+a7z7rA==}\n    engines: {node: '>=18.0.0'}\n    hasBin: true\n\n  type-fest@0.16.0:\n    resolution: {integrity: sha512-eaBzG6MxNzEn9kiwvtre90cXaNLkmadMWa1zQMs3XORCXNbsH/OewwbxC5ia9dCxIxnTAsSxXJaa/p5y8DlvJg==}\n    engines: {node: '>=10'}\n\n  type-fest@0.21.3:\n    resolution: {integrity: sha512-t0rzBq87m3fVcduHDUFhKmyyX+9eo6WQjZvf51Ea/M0Q7+T374Jp1aUiyUl0GKxp8M/OETVHSDvmkyPgvX+X2w==}\n    engines: {node: '>=10'}\n\n  type-fest@3.13.1:\n    resolution: {integrity: sha512-tLq3bSNx+xSpwvAJnzrK0Ep5CLNWjvFTOp71URMaAEWBfRb9nnJiBoUe0tF8bI4ZFO3omgBR6NvnbzVUT3Ly4g==}\n    engines: {node: '>=14.16'}\n\n  type-is@1.6.18:\n    resolution: {integrity: sha512-TkRKr9sUTxEH8MdfuCSP7VizJyzRNMjj2J2do2Jr3Kym598JVdEksuzPQCnlFPW4ky9Q+iA+ma9BGm06XQBy8g==}\n    engines: {node: '>= 0.6'}\n\n  typed-array-buffer@1.0.0:\n    resolution: {integrity: sha512-Y8KTSIglk9OZEr8zywiIHG/kmQ7KWyjseXs1CbSo8vC42w7hg2HgYTxSWwP0+is7bWDc1H+Fo026CpHFwm8tkw==}\n    engines: {node: '>= 0.4'}\n\n  typed-array-byte-length@1.0.0:\n    resolution: {integrity: sha512-Or/+kvLxNpeQ9DtSydonMxCx+9ZXOswtwJn17SNLvhptaXYDJvkFFP5zbfU/uLmvnBJlI4yrnXRxpdWH/M5tNA==}\n    engines: {node: '>= 0.4'}\n\n  typed-array-byte-offset@1.0.0:\n    resolution: {integrity: sha512-RD97prjEt9EL8YgAgpOkf3O4IF9lhJFr9g0htQkm0rchFp/Vx7LW5Q8fSXXub7BXAODyUQohRMyOc3faCPd0hg==}\n    engines: {node: '>= 0.4'}\n\n  typed-array-length@1.0.4:\n    resolution: {integrity: sha512-KjZypGq+I/H7HI5HlOoGHkWUUGq+Q0TPhQurLbyrVrvnKTBgzLhIJ7j6J/XTQOi0d1RjyZ0wdas8bKs2p0x3Ng==}\n\n  typescript@5.6.3:\n    resolution: {integrity: sha512-hjcS1mhfuyi4WW8IWtjP7brDrG2cuDZukyrYrSauoXGNgx0S7zceP07adYkJycEr56BOUTNPzbInooiN3fn1qw==}\n    engines: {node: '>=14.17'}\n    hasBin: true\n\n  uc.micro@1.0.6:\n    resolution: {integrity: sha512-8Y75pvTYkLJW2hWQHXxoqRgV7qb9B+9vFEtidML+7koHUFapnVJAZ6cKs+Qjz5Aw3aZWHMC6u0wJE3At+nSGwA==}\n\n  uc.micro@2.1.0:\n    resolution: {integrity: sha512-ARDJmphmdvUk6Glw7y9DQ2bFkKBHwQHLi2lsaH6PPmz/Ka9sFOBsBluozhDltWmnv9u/cF6Rt87znRTPV+yp/A==}\n\n  ufo@1.5.4:\n    resolution: {integrity: sha512-UsUk3byDzKd04EyoZ7U4DOlxQaD14JUKQl6/P7wiX4FNvUfm3XL246n9W5AmqwW5RSFJ27NAuM0iLscAOYUiGQ==}\n\n  ultrahtml@1.5.3:\n    resolution: {integrity: sha512-GykOvZwgDWZlTQMtp5jrD4BVL+gNn2NVlVafjcFUJ7taY20tqYdwdoWBFy6GBJsNTZe1GkGPkSl5knQAjtgceg==}\n\n  unbox-primitive@1.0.2:\n    resolution: {integrity: sha512-61pPlCD9h51VoreyJ0BReideM3MDKMKnh6+V9L08331ipq6Q8OFXZYiqP6n/tbHx4s5I9uRhcye6BrbkizkBDw==}\n\n  unconfig@0.5.5:\n    resolution: {integrity: sha512-VQZ5PT9HDX+qag0XdgQi8tJepPhXiR/yVOkn707gJDKo31lGjRilPREiQJ9Z6zd/Ugpv6ZvO5VxVIcatldYcNQ==}\n\n  uncrypto@0.1.3:\n    resolution: {integrity: sha512-Ql87qFHB3s/De2ClA9e0gsnS6zXG27SkTiSJwjCc9MebbfapQfuPzumMIUMi38ezPZVNFcHI9sUIepeQfw8J8Q==}\n\n  unctx@2.3.1:\n    resolution: {integrity: sha512-PhKke8ZYauiqh3FEMVNm7ljvzQiph0Mt3GBRve03IJm7ukfaON2OBK795tLwhbyfzknuRRkW0+Ze+CQUmzOZ+A==}\n\n  undici-types@5.26.5:\n    resolution: {integrity: sha512-JlCMO+ehdEIKqlFxk6IfVoAUVmgz7cU7zD/h9XZ0qzeosSHmUJVOzSQvvYSYWXkFXC+IfLKSIffhv0sVZup6pA==}\n\n  undici@5.28.4:\n    resolution: {integrity: sha512-72RFADWFqKmUb2hmmvNODKL3p9hcB6Gt2DOQMis1SEBaV6a4MH8soBvzg+95CYhCKPFedut2JY9bMfrDl9D23g==}\n    engines: {node: '>=14.0'}\n\n  unenv-nightly@2.0.0-20241121-161142-806b5c0:\n    resolution: {integrity: sha512-RnFOasE/O0Q55gBkNB1b84OgKttgLEijGO0JCWpbn+O4XxpyCQg89NmcqQ5RGUiy4y+rMIrKzePTquQcLQF5pQ==}\n\n  unenv@1.10.0:\n    resolution: {integrity: sha512-wY5bskBQFL9n3Eca5XnhH6KbUo/tfvkwm9OpcdCvLaeA7piBNbavbOKJySEwQ1V0RH6HvNlSAFRTpvTqgKRQXQ==}\n\n  unhead@1.11.13:\n    resolution: {integrity: sha512-I7yyvqRfpPPzXuCG7HKZkgAWJDbzXDDEVyib4C/78HREqhNGHVSyo4TqX1h1xB5cx7WYc21HHDRT2/8YkqOy2w==}\n\n  unhead@1.11.7:\n    resolution: {integrity: sha512-aA0+JBRryLhDKUq6L2JhMDLZEG/ElyyDASyC9wiwDl6nvvsj9hD26LgPWgmAsSd+9HtMGM2N1gU27CWEMo16CQ==}\n\n  unhead@1.11.9:\n    resolution: {integrity: sha512-EwEGMjbXVVn2O5vNfXUHiAjHWFHngPjkAx0yVZZsrTgqzs7+A/YvJ90TLvBna874+HCKZWtufo7QAI7luU2CgA==}\n\n  unicode-canonical-property-names-ecmascript@2.0.0:\n    resolution: {integrity: sha512-yY5PpDlfVIU5+y/BSCxAJRBIS1Zc2dDG3Ujq+sR0U+JjUevW2JhocOF+soROYDSaAezOzOKuyyixhD6mBknSmQ==}\n    engines: {node: '>=4'}\n\n  unicode-match-property-ecmascript@2.0.0:\n    resolution: {integrity: sha512-5kaZCrbp5mmbz5ulBkDkbY0SsPOjKqVS35VpL9ulMPfSl0J0Xsm+9Evphv9CoIZFwre7aJoa94AY6seMKGVN5Q==}\n    engines: {node: '>=4'}\n\n  unicode-match-property-value-ecmascript@2.1.0:\n    resolution: {integrity: sha512-qxkjQt6qjg/mYscYMC0XKRn3Rh0wFPlfxB0xkt9CfyTvpX1Ra0+rAmdX2QyAobptSEvuy4RtpPRui6XkV+8wjA==}\n    engines: {node: '>=4'}\n\n  unicode-property-aliases-ecmascript@2.1.0:\n    resolution: {integrity: sha512-6t3foTQI9qne+OZoVQB/8x8rk2k1eVy1gRXhV3oFQ5T6R1dqQ1xtin3XqSlx3+ATBkliTaR/hHyJBm+LVPNM8w==}\n    engines: {node: '>=4'}\n\n  unicorn-magic@0.1.0:\n    resolution: {integrity: sha512-lRfVq8fE8gz6QMBuDM6a+LO3IAzTi05H6gCVaUpir2E1Rwpo4ZUog45KpNXKC/Mn3Yb9UDuHumeFTo9iV/D9FQ==}\n    engines: {node: '>=18'}\n\n  unimport@3.13.1:\n    resolution: {integrity: sha512-nNrVzcs93yrZQOW77qnyOVHtb68LegvhYFwxFMfuuWScmwQmyVCG/NBuN8tYsaGzgQUVYv34E/af+Cc9u4og4A==}\n\n  unimport@3.14.2:\n    resolution: {integrity: sha512-FSxhbAylGGanyuTb3K0Ka3T9mnsD0+cRKbwOS11Li4Lh2whWS091e32JH4bIHrTckxlW9GnExAglADlxXjjzFw==}\n\n  unique-string@2.0.0:\n    resolution: {integrity: sha512-uNaeirEPvpZWSgzwsPGtU2zVSTrn/8L5q/IexZmH0eH6SA73CmAA5U4GwORTxQAZs95TAXLNqeLoPPNO5gZfWg==}\n    engines: {node: '>=8'}\n\n  unist-util-is@6.0.0:\n    resolution: {integrity: sha512-2qCTHimwdxLfz+YzdGfkqNlH0tLi9xjTnHddPmJwtIG9MGsdbutfTc4P+haPD7l7Cjxf/WZj+we5qfVPvvxfYw==}\n\n  unist-util-position@5.0.0:\n    resolution: {integrity: sha512-fucsC7HjXvkB5R3kTCO7kUjRdrS0BJt3M/FPxmHMBOm8JQi2BsHAHFsy27E0EolP8rp0NzXsJ+jNPyDWvOJZPA==}\n\n  unist-util-stringify-position@4.0.0:\n    resolution: {integrity: sha512-0ASV06AAoKCDkS2+xw5RXJywruurpbC4JZSm7nr7MOt1ojAzvyyaO+UxZf18j8FCF6kmzCZKcAgN/yu2gm2XgQ==}\n\n  unist-util-visit-parents@6.0.1:\n    resolution: {integrity: sha512-L/PqWzfTP9lzzEa6CKs0k2nARxTdZduw3zyh8d2NVBnsyvHjSX4TWse388YrrQKbvI8w20fGjGlhgT96WwKykw==}\n\n  unist-util-visit@5.0.0:\n    resolution: {integrity: sha512-MR04uvD+07cwl/yhVuVWAtw+3GOR/knlL55Nd/wAdblk27GCVt3lqpTivy/tkJcZoNPzTwS1Y+KMojlLDhoTzg==}\n\n  universalify@2.0.1:\n    resolution: {integrity: sha512-gptHNQghINnc/vTGIk0SOFGFNXw7JVrlRUtConJRlvaw6DuX0wO5Jeko9sWrMBhh+PsYAZ7oXAiOnf/UKogyiw==}\n    engines: {node: '>= 10.0.0'}\n\n  unocss@0.62.4:\n    resolution: {integrity: sha512-SaGbxXQkk8GDPeJpWsBCZ8a23Knu4ixVTt6pvcQWKjOCGTd9XBd+vLZzN2WwdwgBPVwmMmx5wp+/gPHKFNOmIw==}\n    engines: {node: '>=14'}\n    peerDependencies:\n      '@unocss/webpack': 0.62.4\n      vite: ^2.9.0 || ^3.0.0-0 || ^4.0.0 || ^5.0.0-0\n    peerDependenciesMeta:\n      '@unocss/webpack':\n        optional: true\n      vite:\n        optional: true\n\n  unplugin-icons@0.19.3:\n    resolution: {integrity: sha512-EUegRmsAI6+rrYr0vXjFlIP+lg4fSC4zb62zAZKx8FGXlWAGgEGBCa3JDe27aRAXhistObLPbBPhwa/0jYLFkQ==}\n    peerDependencies:\n      '@svgr/core': '>=7.0.0'\n      '@svgx/core': ^1.0.1\n      '@vue/compiler-sfc': ^3.0.2 || ^2.7.0\n      vue-template-compiler: ^2.6.12\n      vue-template-es2015-compiler: ^1.9.0\n    peerDependenciesMeta:\n      '@svgr/core':\n        optional: true\n      '@svgx/core':\n        optional: true\n      '@vue/compiler-sfc':\n        optional: true\n      vue-template-compiler:\n        optional: true\n      vue-template-es2015-compiler:\n        optional: true\n\n  unplugin-vue-components@0.27.4:\n    resolution: {integrity: sha512-1XVl5iXG7P1UrOMnaj2ogYa5YTq8aoh5jwDPQhemwO/OrXW+lPQKDXd1hMz15qxQPxgb/XXlbgo3HQ2rLEbmXQ==}\n    engines: {node: '>=14'}\n    peerDependencies:\n      '@babel/parser': ^7.15.8\n      '@nuxt/kit': ^3.2.2\n      vue: 2 || 3\n    peerDependenciesMeta:\n      '@babel/parser':\n        optional: true\n      '@nuxt/kit':\n        optional: true\n\n  unplugin-vue-router@0.10.8:\n    resolution: {integrity: sha512-xi+eLweYAqolIoTRSmumbi6Yx0z5M0PLvl+NFNVWHJgmE2ByJG1SZbrn+TqyuDtIyln20KKgq8tqmL7aLoiFjw==}\n    peerDependencies:\n      vue-router: ^4.4.0\n    peerDependenciesMeta:\n      vue-router:\n        optional: true\n\n  unplugin@1.14.1:\n    resolution: {integrity: sha512-lBlHbfSFPToDYp9pjXlUEFVxYLaue9f9T1HC+4OHlmj+HnMDdz9oZY+erXfoCe/5V/7gKUSY2jpXPb9S7f0f/w==}\n    engines: {node: '>=14.0.0'}\n    peerDependencies:\n      webpack-sources: ^3\n    peerDependenciesMeta:\n      webpack-sources:\n        optional: true\n\n  unplugin@1.16.0:\n    resolution: {integrity: sha512-5liCNPuJW8dqh3+DM6uNM2EI3MLLpCKp/KY+9pB5M2S2SR2qvvDHhKgBOaTWEbZTAws3CXfB0rKTIolWKL05VQ==}\n    engines: {node: '>=14.0.0'}\n\n  unstorage@1.13.1:\n    resolution: {integrity: sha512-ELexQHUrG05QVIM/iUeQNdl9FXDZhqLJ4yP59fnmn2jGUh0TEulwOgov1ubOb3Gt2ZGK/VMchJwPDNVEGWQpRg==}\n    peerDependencies:\n      '@azure/app-configuration': ^1.7.0\n      '@azure/cosmos': ^4.1.1\n      '@azure/data-tables': ^13.2.2\n      '@azure/identity': ^4.5.0\n      '@azure/keyvault-secrets': ^4.9.0\n      '@azure/storage-blob': ^12.25.0\n      '@capacitor/preferences': ^6.0.2\n      '@netlify/blobs': ^6.5.0 || ^7.0.0 || ^8.1.0\n      '@planetscale/database': ^1.19.0\n      '@upstash/redis': ^1.34.3\n      '@vercel/kv': ^1.0.1\n      idb-keyval: ^6.2.1\n      ioredis: ^5.4.1\n    peerDependenciesMeta:\n      '@azure/app-configuration':\n        optional: true\n      '@azure/cosmos':\n        optional: true\n      '@azure/data-tables':\n        optional: true\n      '@azure/identity':\n        optional: true\n      '@azure/keyvault-secrets':\n        optional: true\n      '@azure/storage-blob':\n        optional: true\n      '@capacitor/preferences':\n        optional: true\n      '@netlify/blobs':\n        optional: true\n      '@planetscale/database':\n        optional: true\n      '@upstash/redis':\n        optional: true\n      '@vercel/kv':\n        optional: true\n      idb-keyval:\n        optional: true\n      ioredis:\n        optional: true\n\n  untun@0.1.3:\n    resolution: {integrity: sha512-4luGP9LMYszMRZwsvyUd9MrxgEGZdZuZgpVQHEEX0lCYFESasVRvZd0EYpCkOIbJKHMuv0LskpXc/8Un+MJzEQ==}\n    hasBin: true\n\n  untyped@1.5.1:\n    resolution: {integrity: sha512-reBOnkJBFfBZ8pCKaeHgfZLcehXtM6UTxc+vqs1JvCps0c4amLNp3fhdGBZwYp+VLyoY9n3X5KOP7lCyWBUX9A==}\n    hasBin: true\n\n  unwasm@0.3.9:\n    resolution: {integrity: sha512-LDxTx/2DkFURUd+BU1vUsF/moj0JsoTvl+2tcg2AUOiEzVturhGGx17/IMgGvKUYdZwr33EJHtChCJuhu9Ouvg==}\n\n  upath@1.2.0:\n    resolution: {integrity: sha512-aZwGpamFO61g3OlfT7OQCHqhGnW43ieH9WZeP7QxN/G/jS4jfqUkZxoryvJgVPEcrl5NL/ggHsSmLMHuH64Lhg==}\n    engines: {node: '>=4'}\n\n  update-browserslist-db@1.1.1:\n    resolution: {integrity: sha512-R8UzCaa9Az+38REPiJ1tXlImTJXlVfgHZsglwBD/k6nj76ctsH1E3q4doGrukiLQd3sGQYu56r5+lo5r94l29A==}\n    hasBin: true\n    peerDependencies:\n      browserslist: '>= 4.21.0'\n\n  uqr@0.1.2:\n    resolution: {integrity: sha512-MJu7ypHq6QasgF5YRTjqscSzQp/W11zoUk6kvmlH+fmWEs63Y0Eib13hYFwAzagRJcVY8WVnlV+eBDUGMJ5IbA==}\n\n  uri-js@4.4.1:\n    resolution: {integrity: sha512-7rKUyy33Q1yc98pQ1DAmLtwX109F7TIfWlW1Ydo8Wl1ii1SeHieeh0HHfPeL2fMXK6z0s8ecKs9frCuLJvndBg==}\n\n  urlpattern-polyfill@8.0.2:\n    resolution: {integrity: sha512-Qp95D4TPJl1kC9SKigDcqgyM2VDVO4RiJc2d4qe5GrYm+zbIQCWWKAFaJNQ4BhdFeDGwBmAxqJBwWSJDb9T3BQ==}\n\n  util-deprecate@1.0.2:\n    resolution: {integrity: sha512-EPD5q1uXyFxJpCrLnCc1nHnq3gOa6DZBocAIiI2TaSCA7VCJ1UJDMagCzIkXNsUYfD1daK//LTEQ8xiIbrHtcw==}\n\n  uuid@10.0.0:\n    resolution: {integrity: sha512-8XkAphELsDnEGrDxUOHB3RGvXz6TeuYSGEZBOjtTtPm2lwhGBjLgOzLHB63IUWfBpNucQjND6d3AOudO+H3RWQ==}\n    hasBin: true\n\n  v-lazy-show@0.2.4:\n    resolution: {integrity: sha512-Lx9Str2i+HTh+zGzs9O3YyhGAZOAAfU+6MUUPcQPPiPxQO1sHBEv9sH3MO9bPc4T09gsjsS2+sbaCWQ1MdhpJQ==}\n    peerDependencies:\n      '@vue/compiler-core': ^3.3\n\n  valibot@0.42.1:\n    resolution: {integrity: sha512-3keXV29Ar5b//Hqi4MbSdV7lfVp6zuYLZuA9V1PvQUsXqogr+u5lvLPLk3A4f74VUXDnf/JfWMN6sB+koJ/FFw==}\n    peerDependencies:\n      typescript: '>=5'\n    peerDependenciesMeta:\n      typescript:\n        optional: true\n\n  vary@1.1.2:\n    resolution: {integrity: sha512-BNGbWLfd0eUPabhkXUVm0j8uuvREyTh5ovRa/dyow/BqAbZJyC+5fU+IzQOzmAKzYqYRAISoRhdQr3eIZ/PXqg==}\n    engines: {node: '>= 0.8'}\n\n  vfile-message@4.0.2:\n    resolution: {integrity: sha512-jRDZ1IMLttGj41KcZvlrYAaI3CfqpLpfpf+Mfig13viT6NKvRzWZ+lXz0Y5D60w6uJIBAOGq9mSHf0gktF0duw==}\n\n  vfile@6.0.3:\n    resolution: {integrity: sha512-KzIbH/9tXat2u30jf+smMwFCsno4wHVdNmzFyL+T/L3UGqqk6JKfVqOFOZEpZSHADH1k40ab6NUIXZq422ov3Q==}\n\n  vite-hot-client@0.2.3:\n    resolution: {integrity: sha512-rOGAV7rUlUHX89fP2p2v0A2WWvV3QMX2UYq0fRqsWSvFvev4atHWqjwGoKaZT1VTKyLGk533ecu3eyd0o59CAg==}\n    peerDependencies:\n      vite: ^2.6.0 || ^3.0.0 || ^4.0.0 || ^5.0.0-0\n\n  vite-node@2.1.3:\n    resolution: {integrity: sha512-I1JadzO+xYX887S39Do+paRePCKoiDrWRRjp9kkG5he0t7RXNvPAJPCQSJqbGN4uCrFFeS3Kj3sLqY8NMYBEdA==}\n    engines: {node: ^18.0.0 || >=20.0.0}\n    hasBin: true\n\n  vite-plugin-checker@0.8.0:\n    resolution: {integrity: sha512-UA5uzOGm97UvZRTdZHiQVYFnd86AVn8EVaD4L3PoVzxH+IZSfaAw14WGFwX9QS23UW3lV/5bVKZn6l0w+q9P0g==}\n    engines: {node: '>=14.16'}\n    peerDependencies:\n      '@biomejs/biome': '>=1.7'\n      eslint: '>=7'\n      meow: ^9.0.0\n      optionator: ^0.9.1\n      stylelint: '>=13'\n      typescript: '*'\n      vite: '>=2.0.0'\n      vls: '*'\n      vti: '*'\n      vue-tsc: ~2.1.6\n    peerDependenciesMeta:\n      '@biomejs/biome':\n        optional: true\n      eslint:\n        optional: true\n      meow:\n        optional: true\n      optionator:\n        optional: true\n      stylelint:\n        optional: true\n      typescript:\n        optional: true\n      vls:\n        optional: true\n      vti:\n        optional: true\n      vue-tsc:\n        optional: true\n\n  vite-plugin-inspect@0.8.7:\n    resolution: {integrity: sha512-/XXou3MVc13A5O9/2Nd6xczjrUwt7ZyI9h8pTnUMkr5SshLcb0PJUOVq2V+XVkdeU4njsqAtmK87THZuO2coGA==}\n    engines: {node: '>=14'}\n    peerDependencies:\n      '@nuxt/kit': '*'\n      vite: ^3.1.0 || ^4.0.0 || ^5.0.0-0\n    peerDependenciesMeta:\n      '@nuxt/kit':\n        optional: true\n\n  vite-plugin-pwa@0.20.5:\n    resolution: {integrity: sha512-aweuI/6G6n4C5Inn0vwHumElU/UEpNuO+9iZzwPZGTCH87TeZ6YFMrEY6ZUBQdIHHlhTsbMDryFARcSuOdsz9Q==}\n    engines: {node: '>=16.0.0'}\n    peerDependencies:\n      '@vite-pwa/assets-generator': ^0.2.6\n      vite: ^3.1.0 || ^4.0.0 || ^5.0.0\n      workbox-build: ^7.1.0\n      workbox-window: ^7.1.0\n    peerDependenciesMeta:\n      '@vite-pwa/assets-generator':\n        optional: true\n\n  vite-plugin-vue-inspector@5.1.3:\n    resolution: {integrity: sha512-pMrseXIDP1Gb38mOevY+BvtNGNqiqmqa2pKB99lnLsADQww9w9xMbAfT4GB6RUoaOkSPrtlXqpq2Fq+Dj2AgFg==}\n    peerDependencies:\n      vite: ^3.0.0-0 || ^4.0.0-0 || ^5.0.0-0\n\n  vite@5.4.8:\n    resolution: {integrity: sha512-FqrItQ4DT1NC4zCUqMB4c4AZORMKIa0m8/URVCZ77OZ/QSNeJ54bU1vrFADbDsuwfIPcgknRkmqakQcgnL4GiQ==}\n    engines: {node: ^18.0.0 || >=20.0.0}\n    hasBin: true\n    peerDependencies:\n      '@types/node': ^18.0.0 || >=20.0.0\n      less: '*'\n      lightningcss: ^1.21.0\n      sass: '*'\n      sass-embedded: '*'\n      stylus: '*'\n      sugarss: '*'\n      terser: ^5.4.0\n    peerDependenciesMeta:\n      '@types/node':\n        optional: true\n      less:\n        optional: true\n      lightningcss:\n        optional: true\n      sass:\n        optional: true\n      sass-embedded:\n        optional: true\n      stylus:\n        optional: true\n      sugarss:\n        optional: true\n      terser:\n        optional: true\n\n  vscode-jsonrpc@6.0.0:\n    resolution: {integrity: sha512-wnJA4BnEjOSyFMvjZdpiOwhSq9uDoK8e/kpRJDTaMYzwlkrhG1fwDIZI94CLsLzlCK5cIbMMtFlJlfR57Lavmg==}\n    engines: {node: '>=8.0.0 || >=10.0.0'}\n\n  vscode-languageclient@7.0.0:\n    resolution: {integrity: sha512-P9AXdAPlsCgslpP9pRxYPqkNYV7Xq8300/aZDpO35j1fJm/ncize8iGswzYlcvFw5DQUx4eVk+KvfXdL0rehNg==}\n    engines: {vscode: ^1.52.0}\n\n  vscode-languageserver-protocol@3.16.0:\n    resolution: {integrity: sha512-sdeUoAawceQdgIfTI+sdcwkiK2KU+2cbEYA0agzM2uqaUy2UpnnGHtWTHVEtS0ES4zHU0eMFRGN+oQgDxlD66A==}\n\n  vscode-languageserver-textdocument@1.0.12:\n    resolution: {integrity: sha512-cxWNPesCnQCcMPeenjKKsOCKQZ/L6Tv19DTRIGuLWe32lyzWhihGVJ/rcckZXJxfdKCFvRLS3fpBIsV/ZGX4zA==}\n\n  vscode-languageserver-types@3.16.0:\n    resolution: {integrity: sha512-k8luDIWJWyenLc5ToFQQMaSrqCHiLwyKPHKPQZ5zz21vM+vIVUSvsRpcbiECH4WR88K2XZqc4ScRcZ7nk/jbeA==}\n\n  vscode-languageserver@7.0.0:\n    resolution: {integrity: sha512-60HTx5ID+fLRcgdHfmz0LDZAXYEV68fzwG0JWwEPBode9NuMYTIxuYXPg4ngO8i8+Ou0lM7y6GzaYWbiDL0drw==}\n    hasBin: true\n\n  vscode-uri@3.0.8:\n    resolution: {integrity: sha512-AyFQ0EVmsOZOlAnxoFOGOq1SQDWAB7C6aqMGS23svWAllfOaxbuFvcT8D1i8z3Gyn8fraVeZNNmN6e9bxxXkKw==}\n\n  vue-bundle-renderer@2.1.1:\n    resolution: {integrity: sha512-+qALLI5cQncuetYOXp4yScwYvqh8c6SMXee3B+M7oTZxOgtESP0l4j/fXdEJoZ+EdMxkGWIj+aSEyjXkOdmd7g==}\n\n  vue-color-kit@https://codeload.github.com/Idered/vue-color-kit/tar.gz/e75eb34d3473b6e1a4627869b7099ab07b1280e7:\n    resolution: {tarball: https://codeload.github.com/Idered/vue-color-kit/tar.gz/e75eb34d3473b6e1a4627869b7099ab07b1280e7}\n    version: 1.0.6\n    peerDependencies:\n      vue: ^3.0.5\n\n  vue-demi@0.14.10:\n    resolution: {integrity: sha512-nMZBOwuzabUO0nLgIcc6rycZEebF6eeUfaiQx9+WSk8e29IbLvPU9feI6tqW4kTo3hvoYAJkMh8n8D0fuISphg==}\n    engines: {node: '>=12'}\n    hasBin: true\n    peerDependencies:\n      '@vue/composition-api': ^1.0.0-rc.1\n      vue: ^3.0.0-0 || ^2.6.0\n    peerDependenciesMeta:\n      '@vue/composition-api':\n        optional: true\n\n  vue-devtools-stub@0.1.0:\n    resolution: {integrity: sha512-RutnB7X8c5hjq39NceArgXg28WZtZpGc3+J16ljMiYnFhKvd8hITxSWQSQ5bvldxMDU6gG5mkxl1MTQLXckVSQ==}\n\n  vue-router@4.4.5:\n    resolution: {integrity: sha512-4fKZygS8cH1yCyuabAXGUAsyi1b2/o/OKgu/RUb+znIYOxPRxdkytJEx+0wGcpBE1pX6vUgh5jwWOKRGvuA/7Q==}\n    peerDependencies:\n      vue: ^3.2.0\n\n  vue-template-compiler@2.7.16:\n    resolution: {integrity: sha512-AYbUWAJHLGGQM7+cNTELw+KsOG9nl2CnSv467WobS5Cv9uk3wFcnr1Etsz2sEIHEZvw1U+o9mRlEO6QbZvUPGQ==}\n\n  vue-tsc@2.1.6:\n    resolution: {integrity: sha512-f98dyZp5FOukcYmbFpuSCJ4Z0vHSOSmxGttZJCsFeX0M4w/Rsq0s4uKXjcSRsZqsRgQa6z7SfuO+y0HVICE57Q==}\n    hasBin: true\n    peerDependencies:\n      typescript: '>=5.0.0'\n\n  vue@3.5.12:\n    resolution: {integrity: sha512-CLVZtXtn2ItBIi/zHZ0Sg1Xkb7+PU32bJJ8Bmy7ts3jxXTcbfsEfBivFYYWz1Hur+lalqGAh65Coin0r+HRUfg==}\n    peerDependencies:\n      typescript: '*'\n    peerDependenciesMeta:\n      typescript:\n        optional: true\n\n  watchpack@2.4.2:\n    resolution: {integrity: sha512-TnbFSbcOCcDgjZ4piURLCbJ3nJhznVh9kw6F6iokjiFPl8ONxe9A6nMDVXDiNbrSfLILs6vB07F7wLBrwPYzJw==}\n    engines: {node: '>=10.13.0'}\n\n  webidl-conversions@3.0.1:\n    resolution: {integrity: sha512-2JAn3z8AR6rjK8Sm8orRC0h/bcl/DqL7tRPdGZ4I1CjdF+EaMLmYxBHyXuKL849eucPFhvBoxMsflfOb8kxaeQ==}\n\n  webidl-conversions@4.0.2:\n    resolution: {integrity: sha512-YQ+BmxuTgd6UXZW3+ICGfyqRyHXVlD5GtQr5+qjiNW7bF0cqrzX500HVXPBOvgXb5YnzDd+h0zqyv61KUD7+Sg==}\n\n  webpack-sources@3.2.3:\n    resolution: {integrity: sha512-/DyMEOrDgLKKIG0fmvtz+4dUX/3Ghozwgm6iPp8KRhvn+eQf9+Q7GWxVNMk3+uCPWfdXYC4ExGBckIXdFEfH1w==}\n    engines: {node: '>=10.13.0'}\n\n  webpack-virtual-modules@0.6.2:\n    resolution: {integrity: sha512-66/V2i5hQanC51vBQKPH4aI8NMAcBW59FVBs+rC7eGHupMyfn34q7rZIE+ETlJ+XTevqfUhVVBgSUNSW2flEUQ==}\n\n  webpack@5.95.0:\n    resolution: {integrity: sha512-2t3XstrKULz41MNMBF+cJ97TyHdyQ8HCt//pqErqDvNjU9YQBnZxIHa11VXsi7F3mb5/aO2tuDxdeTPdU7xu9Q==}\n    engines: {node: '>=10.13.0'}\n    hasBin: true\n    peerDependencies:\n      webpack-cli: '*'\n    peerDependenciesMeta:\n      webpack-cli:\n        optional: true\n\n  webworkify@1.5.0:\n    resolution: {integrity: sha512-AMcUeyXAhbACL8S2hqqdqOLqvJ8ylmIbNwUIqQujRSouf4+eUFaXbG6F1Rbu+srlJMmxQWsiU7mOJi0nMBfM1g==}\n\n  whatwg-url@5.0.0:\n    resolution: {integrity: sha512-saE57nupxk6v3HY35+jzBwYa0rKSy0XR8JSxZPwgLr7ys0IBzhGviA1/TUGJLmSVqs8pb9AnvICXEuOHLprYTw==}\n\n  whatwg-url@7.1.0:\n    resolution: {integrity: sha512-WUu7Rg1DroM7oQvGWfOiAK21n74Gg+T4elXEQYkOhtyLeWiJFoOGLXPKI/9gzIie9CtwVLm8wtw6YJdKyxSjeg==}\n\n  which-boxed-primitive@1.0.2:\n    resolution: {integrity: sha512-bwZdv0AKLpplFY2KZRX6TvyuN7ojjr7lwkg6ml0roIy9YeuSr7JS372qlNW18UQYzgYK9ziGcerWqZOmEn9VNg==}\n\n  which-typed-array@1.1.13:\n    resolution: {integrity: sha512-P5Nra0qjSncduVPEAr7xhoF5guty49ArDTwzJ/yNuPIbZppyRxFQsRCWrocxIY+CnMVG+qfbU2FmDKyvSGClow==}\n    engines: {node: '>= 0.4'}\n\n  which@2.0.2:\n    resolution: {integrity: sha512-BLI3Tl1TW3Pvl70l3yq3Y64i+awpwXqsGBYWkkqMtnbXgrMD+yj7rhW0kuEDxzJaYXGjEW5ogapKNMEKNMjibA==}\n    engines: {node: '>= 8'}\n    hasBin: true\n\n  which@3.0.1:\n    resolution: {integrity: sha512-XA1b62dzQzLfaEOSQFTCOd5KFf/1VSzZo7/7TUjnya6u0vGGKzU96UQBZTAThCb2j4/xjBAyii1OhRLJEivHvg==}\n    engines: {node: ^14.17.0 || ^16.13.0 || >=18.0.0}\n    hasBin: true\n\n  wide-align@1.1.5:\n    resolution: {integrity: sha512-eDMORYaPNZ4sQIuuYPDHdQvf4gyCF9rEEV/yPxGfwPkRodwEgiMUUXTx/dex+Me0wxx53S+NgUHaP7y3MGlDmg==}\n\n  workbox-background-sync@7.0.0:\n    resolution: {integrity: sha512-S+m1+84gjdueM+jIKZ+I0Lx0BDHkk5Nu6a3kTVxP4fdj3gKouRNmhO8H290ybnJTOPfBDtTMXSQA/QLTvr7PeA==}\n\n  workbox-broadcast-update@7.0.0:\n    resolution: {integrity: sha512-oUuh4jzZrLySOo0tC0WoKiSg90bVAcnE98uW7F8GFiSOXnhogfNDGZelPJa+6KpGBO5+Qelv04Hqx2UD+BJqNQ==}\n\n  workbox-build@7.0.0:\n    resolution: {integrity: sha512-CttE7WCYW9sZC+nUYhQg3WzzGPr4IHmrPnjKiu3AMXsiNQKx+l4hHl63WTrnicLmKEKHScWDH8xsGBdrYgtBzg==}\n    engines: {node: '>=16.0.0'}\n\n  workbox-cacheable-response@7.0.0:\n    resolution: {integrity: sha512-0lrtyGHn/LH8kKAJVOQfSu3/80WDc9Ma8ng0p2i/5HuUndGttH+mGMSvOskjOdFImLs2XZIimErp7tSOPmu/6g==}\n\n  workbox-core@7.0.0:\n    resolution: {integrity: sha512-81JkAAZtfVP8darBpfRTovHg8DGAVrKFgHpOArZbdFd78VqHr5Iw65f2guwjE2NlCFbPFDoez3D3/6ZvhI/rwQ==}\n\n  workbox-expiration@7.0.0:\n    resolution: {integrity: sha512-MLK+fogW+pC3IWU9SFE+FRStvDVutwJMR5if1g7oBJx3qwmO69BNoJQVaMXq41R0gg3MzxVfwOGKx3i9P6sOLQ==}\n\n  workbox-google-analytics@7.0.0:\n    resolution: {integrity: sha512-MEYM1JTn/qiC3DbpvP2BVhyIH+dV/5BjHk756u9VbwuAhu0QHyKscTnisQuz21lfRpOwiS9z4XdqeVAKol0bzg==}\n    deprecated: It is not compatible with newer versions of GA starting with v4, as long as you are using GAv3 it should be ok, but the package is not longer being maintained\n\n  workbox-navigation-preload@7.0.0:\n    resolution: {integrity: sha512-juWCSrxo/fiMz3RsvDspeSLGmbgC0U9tKqcUPZBCf35s64wlaLXyn2KdHHXVQrb2cqF7I0Hc9siQalainmnXJA==}\n\n  workbox-precaching@7.0.0:\n    resolution: {integrity: sha512-EC0vol623LJqTJo1mkhD9DZmMP604vHqni3EohhQVwhJlTgyKyOkMrZNy5/QHfOby+39xqC01gv4LjOm4HSfnA==}\n\n  workbox-range-requests@7.0.0:\n    resolution: {integrity: sha512-SxAzoVl9j/zRU9OT5+IQs7pbJBOUOlriB8Gn9YMvi38BNZRbM+RvkujHMo8FOe9IWrqqwYgDFBfv6sk76I1yaQ==}\n\n  workbox-recipes@7.0.0:\n    resolution: {integrity: sha512-DntcK9wuG3rYQOONWC0PejxYYIDHyWWZB/ueTbOUDQgefaeIj1kJ7pdP3LZV2lfrj8XXXBWt+JDRSw1lLLOnww==}\n\n  workbox-routing@7.0.0:\n    resolution: {integrity: sha512-8YxLr3xvqidnbVeGyRGkaV4YdlKkn5qZ1LfEePW3dq+ydE73hUUJJuLmGEykW3fMX8x8mNdL0XrWgotcuZjIvA==}\n\n  workbox-strategies@7.0.0:\n    resolution: {integrity: sha512-dg3qJU7tR/Gcd/XXOOo7x9QoCI9nk74JopaJaYAQ+ugLi57gPsXycVdBnYbayVj34m6Y8ppPwIuecrzkpBVwbA==}\n\n  workbox-streams@7.0.0:\n    resolution: {integrity: sha512-moVsh+5to//l6IERWceYKGiftc+prNnqOp2sgALJJFbnNVpTXzKISlTIsrWY+ogMqt+x1oMazIdHj25kBSq/HQ==}\n\n  workbox-sw@7.0.0:\n    resolution: {integrity: sha512-SWfEouQfjRiZ7GNABzHUKUyj8pCoe+RwjfOIajcx6J5mtgKkN+t8UToHnpaJL5UVVOf5YhJh+OHhbVNIHe+LVA==}\n\n  workbox-window@7.0.0:\n    resolution: {integrity: sha512-j7P/bsAWE/a7sxqTzXo3P2ALb1reTfZdvVp6OJ/uLr/C2kZAMvjeWGm8V4htQhor7DOvYg0sSbFN2+flT5U0qA==}\n\n  workerd@1.20241106.1:\n    resolution: {integrity: sha512-1GdKl0kDw8rrirr/ThcK66Kbl4/jd4h8uHx5g7YHBrnenY5SX1UPuop2cnCzYUxlg55kPjzIqqYslz1muRFgFw==}\n    engines: {node: '>=16'}\n    hasBin: true\n\n  wrangler@3.91.0:\n    resolution: {integrity: sha512-Hdzn6wbY9cz5kL85ZUvWLwLIH7nPaEVRblfms40jhRf4qQO/Zf74aFlku8rQFbe8/2aVZFaxJVfBd6JQMeMSBQ==}\n    engines: {node: '>=16.17.0'}\n    hasBin: true\n    peerDependencies:\n      '@cloudflare/workers-types': ^4.20241106.0\n    peerDependenciesMeta:\n      '@cloudflare/workers-types':\n        optional: true\n\n  wrap-ansi@7.0.0:\n    resolution: {integrity: sha512-YVGIj2kamLSTxw6NsZjoBxfSwsn0ycdesmc4p+Q21c5zPuZ1pl+NfxVdxPtdHvmNVOQ6XSYG4AUtyt/Fi7D16Q==}\n    engines: {node: '>=10'}\n\n  wrap-ansi@8.1.0:\n    resolution: {integrity: sha512-si7QWI6zUMq56bESFvagtmzMdGOtoxfR+Sez11Mobfc7tm+VkUckk9bW2UeffTGVUbOksxmSw0AA2gs8g71NCQ==}\n    engines: {node: '>=12'}\n\n  wrappy@1.0.2:\n    resolution: {integrity: sha512-l4Sp/DRseor9wL6EvV2+TuQn63dMkPjZ/sp9XkghTEbV9KlPS1xUsZ3u7/IQO4wxtcFB4bgpQPRcR3QCvezPcQ==}\n\n  ws@8.18.0:\n    resolution: {integrity: sha512-8VbfWfHLbbwu3+N6OKsOMpBdT4kXPDDB9cJk2bJ6mh9ucxdlnNvH1e+roYkKmN9Nxw2yjz7VzeO9oOz2zJ04Pw==}\n    engines: {node: '>=10.0.0'}\n    peerDependencies:\n      bufferutil: ^4.0.1\n      utf-8-validate: '>=5.0.2'\n    peerDependenciesMeta:\n      bufferutil:\n        optional: true\n      utf-8-validate:\n        optional: true\n\n  xtend@4.0.2:\n    resolution: {integrity: sha512-LKYU1iAXJXUgAXn9URjiu+MWhyUXHsvfp7mcuYm9dSUKK0/CjtrUwFAxD82/mCWbtLsGjFIad0wIsod4zrTAEQ==}\n    engines: {node: '>=0.4'}\n\n  xxhash-wasm@1.1.0:\n    resolution: {integrity: sha512-147y/6YNh+tlp6nd/2pWq38i9h6mz/EuQ6njIrmW8D1BS5nCqs0P6DG+m6zTGnNz5I+uhZ0SHxBs9BsPrwcKDA==}\n\n  y18n@5.0.8:\n    resolution: {integrity: sha512-0pfFzegeDWJHJIAmTLRP2DwHjdF5s7jo9tuztdQxAhINCdvS+3nGINqPd00AphqJR/0LhANUS6/+7SCb98YOfA==}\n    engines: {node: '>=10'}\n\n  yallist@3.1.1:\n    resolution: {integrity: sha512-a4UGQaWPH59mOXUYnAG2ewncQS4i4F43Tv3JoAM+s2VDAmS9NsK8GpDMLrCHPksFT7h3K6TOoUNn2pb7RoXx4g==}\n\n  yallist@4.0.0:\n    resolution: {integrity: sha512-3wdGidZyq5PB084XLES5TpOSRA3wjXAlIWMhum2kRcv/41Sn2emQ0dycQW4uZXLejwKvg6EsvbdlVL+FYEct7A==}\n\n  yaml@2.3.4:\n    resolution: {integrity: sha512-8aAvwVUSHpfEqTQ4w/KMlf3HcRdt50E5ODIQJBw1fQ5RL34xabzxtUlzTXVqc4rkZsPbvrXKWnABCD7kWSmocA==}\n    engines: {node: '>= 14'}\n\n  yaml@2.6.0:\n    resolution: {integrity: sha512-a6ae//JvKDEra2kdi1qzCyrJW/WZCgFi8ydDV+eXExl95t+5R+ijnqHJbz9tmMh8FUjx3iv2fCQ4dclAQlO2UQ==}\n    engines: {node: '>= 14'}\n    hasBin: true\n\n  yargs-parser@21.1.1:\n    resolution: {integrity: sha512-tVpsJW7DdjecAiFpbIB1e3qxIQsE6NoPc5/eTdrbbIC4h0LVsWhnoa3g+m2HclBIujHzsxZ4VJVA+GUuc2/LBw==}\n    engines: {node: '>=12'}\n\n  yargs@17.7.2:\n    resolution: {integrity: sha512-7dSzzRQ++CKnNI/krKnYRV7JKKPUXMEh61soaHKg9mrWEhzFWhFnxPxGl+69cD1Ou63C13NUPCnmIcrvqCuM6w==}\n    engines: {node: '>=12'}\n\n  ylru@1.4.0:\n    resolution: {integrity: sha512-2OQsPNEmBCvXuFlIni/a+Rn+R2pHW9INm0BxXJ4hVDA8TirqMj+J/Rp9ItLatT/5pZqWwefVrTQcHpixsxnVlA==}\n    engines: {node: '>= 4.0.0'}\n\n  youch@3.3.4:\n    resolution: {integrity: sha512-UeVBXie8cA35DS6+nBkls68xaBBXCye0CNznrhszZjTbRVnJKQuNsyLKBTTL4ln1o1rh2PKtv35twV7irj5SEg==}\n\n  zhead@2.2.4:\n    resolution: {integrity: sha512-8F0OI5dpWIA5IGG5NHUg9staDwz/ZPxZtvGVf01j7vHqSyZ0raHY+78atOVxRqb73AotX22uV1pXt3gYSstGag==}\n\n  zip-stream@6.0.1:\n    resolution: {integrity: sha512-zK7YHHz4ZXpW89AHXUPbQVGKI7uvkd3hzusTdotCg1UxyaVtg0zFJSTfW/Dq5f7OBBVnq6cZIaC8Ti4hb6dtCA==}\n    engines: {node: '>= 14'}\n\n  zod@3.23.8:\n    resolution: {integrity: sha512-XBx9AXhXktjUqnepgTiE5flcKIYWi/rme0Eaj+5Y0lftuGBq+jyRu/md4WnuxqgP1ubdpNCsYEYPxrzVHD8d6g==}\n\n  zwitch@2.0.4:\n    resolution: {integrity: sha512-bXE4cR/kVZhKZX/RjPEflHaKVhUVl85noU3v6b8apfQEc1x4A+zBxjZ4lN8LqGd6WZ3dl98pY4o717VFmoPp+A==}\n\nsnapshots:\n\n  '@alloc/quick-lru@5.2.0': {}\n\n  '@ampproject/remapping@2.2.1':\n    dependencies:\n      '@jridgewell/gen-mapping': 0.3.3\n      '@jridgewell/trace-mapping': 0.3.20\n\n  '@ampproject/remapping@2.3.0':\n    dependencies:\n      '@jridgewell/gen-mapping': 0.3.5\n      '@jridgewell/trace-mapping': 0.3.25\n\n  '@antfu/install-pkg@0.4.1':\n    dependencies:\n      package-manager-detector: 0.2.2\n      tinyexec: 0.3.0\n\n  '@antfu/utils@0.7.10': {}\n\n  '@apideck/better-ajv-errors@0.3.6(ajv@8.12.0)':\n    dependencies:\n      ajv: 8.12.0\n      json-schema: 0.4.0\n      jsonpointer: 5.0.1\n      leven: 3.1.0\n\n  '@babel/code-frame@7.23.5':\n    dependencies:\n      '@babel/highlight': 7.23.4\n      chalk: 2.4.2\n\n  '@babel/code-frame@7.25.9':\n    dependencies:\n      '@babel/highlight': 7.25.9\n      picocolors: 1.1.0\n\n  '@babel/compat-data@7.23.5': {}\n\n  '@babel/compat-data@7.25.9': {}\n\n  '@babel/core@7.23.7':\n    dependencies:\n      '@ampproject/remapping': 2.2.1\n      '@babel/code-frame': 7.23.5\n      '@babel/generator': 7.23.6\n      '@babel/helper-compilation-targets': 7.23.6\n      '@babel/helper-module-transforms': 7.23.3(@babel/core@7.23.7)\n      '@babel/helpers': 7.23.7\n      '@babel/parser': 7.25.9\n      '@babel/template': 7.22.15\n      '@babel/traverse': 7.23.7\n      '@babel/types': 7.25.8\n      convert-source-map: 2.0.0\n      debug: 4.3.7\n      gensync: 1.0.0-beta.2\n      json5: 2.2.3\n      semver: 6.3.1\n    transitivePeerDependencies:\n      - supports-color\n\n  '@babel/core@7.25.9':\n    dependencies:\n      '@ampproject/remapping': 2.2.1\n      '@babel/code-frame': 7.25.9\n      '@babel/generator': 7.25.9\n      '@babel/helper-compilation-targets': 7.25.9\n      '@babel/helper-module-transforms': 7.25.9(@babel/core@7.25.9)\n      '@babel/helpers': 7.25.9\n      '@babel/parser': 7.25.9\n      '@babel/template': 7.25.9\n      '@babel/traverse': 7.25.9\n      '@babel/types': 7.25.9\n      convert-source-map: 2.0.0\n      debug: 4.3.7\n      gensync: 1.0.0-beta.2\n      json5: 2.2.3\n      semver: 6.3.1\n    transitivePeerDependencies:\n      - supports-color\n\n  '@babel/generator@7.23.6':\n    dependencies:\n      '@babel/types': 7.25.8\n      '@jridgewell/gen-mapping': 0.3.3\n      '@jridgewell/trace-mapping': 0.3.20\n      jsesc: 2.5.2\n\n  '@babel/generator@7.25.9':\n    dependencies:\n      '@babel/types': 7.25.9\n      '@jridgewell/gen-mapping': 0.3.5\n      '@jridgewell/trace-mapping': 0.3.25\n      jsesc: 3.0.2\n\n  '@babel/helper-annotate-as-pure@7.25.9':\n    dependencies:\n      '@babel/types': 7.25.9\n\n  '@babel/helper-builder-binary-assignment-operator-visitor@7.22.15':\n    dependencies:\n      '@babel/types': 7.25.9\n\n  '@babel/helper-compilation-targets@7.23.6':\n    dependencies:\n      '@babel/compat-data': 7.23.5\n      '@babel/helper-validator-option': 7.23.5\n      browserslist: 4.24.0\n      lru-cache: 5.1.1\n      semver: 6.3.1\n\n  '@babel/helper-compilation-targets@7.25.9':\n    dependencies:\n      '@babel/compat-data': 7.25.9\n      '@babel/helper-validator-option': 7.25.9\n      browserslist: 4.24.0\n      lru-cache: 5.1.1\n      semver: 6.3.1\n\n  '@babel/helper-create-class-features-plugin@7.25.9(@babel/core@7.23.7)':\n    dependencies:\n      '@babel/core': 7.23.7\n      '@babel/helper-annotate-as-pure': 7.25.9\n      '@babel/helper-member-expression-to-functions': 7.25.9\n      '@babel/helper-optimise-call-expression': 7.25.9\n      '@babel/helper-replace-supers': 7.25.9(@babel/core@7.23.7)\n      '@babel/helper-skip-transparent-expression-wrappers': 7.25.9\n      '@babel/traverse': 7.25.9\n      semver: 6.3.1\n    transitivePeerDependencies:\n      - supports-color\n\n  '@babel/helper-create-class-features-plugin@7.25.9(@babel/core@7.25.9)':\n    dependencies:\n      '@babel/core': 7.25.9\n      '@babel/helper-annotate-as-pure': 7.25.9\n      '@babel/helper-member-expression-to-functions': 7.25.9\n      '@babel/helper-optimise-call-expression': 7.25.9\n      '@babel/helper-replace-supers': 7.25.9(@babel/core@7.25.9)\n      '@babel/helper-skip-transparent-expression-wrappers': 7.25.9\n      '@babel/traverse': 7.25.9\n      semver: 6.3.1\n    transitivePeerDependencies:\n      - supports-color\n\n  '@babel/helper-create-regexp-features-plugin@7.22.15(@babel/core@7.25.9)':\n    dependencies:\n      '@babel/core': 7.25.9\n      '@babel/helper-annotate-as-pure': 7.25.9\n      regexpu-core: 5.3.2\n      semver: 6.3.1\n\n  '@babel/helper-define-polyfill-provider@0.4.4(@babel/core@7.25.9)':\n    dependencies:\n      '@babel/core': 7.25.9\n      '@babel/helper-compilation-targets': 7.25.9\n      '@babel/helper-plugin-utils': 7.25.9\n      debug: 4.3.7\n      lodash.debounce: 4.0.8\n      resolve: 1.22.8\n    transitivePeerDependencies:\n      - supports-color\n\n  '@babel/helper-environment-visitor@7.22.20': {}\n\n  '@babel/helper-function-name@7.23.0':\n    dependencies:\n      '@babel/template': 7.22.15\n      '@babel/types': 7.25.8\n\n  '@babel/helper-hoist-variables@7.22.5':\n    dependencies:\n      '@babel/types': 7.25.8\n\n  '@babel/helper-member-expression-to-functions@7.25.9':\n    dependencies:\n      '@babel/traverse': 7.25.9\n      '@babel/types': 7.25.9\n    transitivePeerDependencies:\n      - supports-color\n\n  '@babel/helper-module-imports@7.22.15':\n    dependencies:\n      '@babel/types': 7.25.8\n\n  '@babel/helper-module-imports@7.25.9':\n    dependencies:\n      '@babel/traverse': 7.25.9\n      '@babel/types': 7.25.9\n    transitivePeerDependencies:\n      - supports-color\n\n  '@babel/helper-module-transforms@7.23.3(@babel/core@7.23.7)':\n    dependencies:\n      '@babel/core': 7.23.7\n      '@babel/helper-environment-visitor': 7.22.20\n      '@babel/helper-module-imports': 7.22.15\n      '@babel/helper-simple-access': 7.22.5\n      '@babel/helper-split-export-declaration': 7.22.6\n      '@babel/helper-validator-identifier': 7.25.7\n\n  '@babel/helper-module-transforms@7.25.9(@babel/core@7.25.9)':\n    dependencies:\n      '@babel/core': 7.25.9\n      '@babel/helper-module-imports': 7.25.9\n      '@babel/helper-simple-access': 7.25.9\n      '@babel/helper-validator-identifier': 7.25.9\n      '@babel/traverse': 7.25.9\n    transitivePeerDependencies:\n      - supports-color\n\n  '@babel/helper-optimise-call-expression@7.25.9':\n    dependencies:\n      '@babel/types': 7.25.9\n\n  '@babel/helper-plugin-utils@7.22.5': {}\n\n  '@babel/helper-plugin-utils@7.25.9': {}\n\n  '@babel/helper-remap-async-to-generator@7.22.20(@babel/core@7.25.9)':\n    dependencies:\n      '@babel/core': 7.25.9\n      '@babel/helper-annotate-as-pure': 7.25.9\n      '@babel/helper-environment-visitor': 7.22.20\n      '@babel/helper-wrap-function': 7.22.20\n\n  '@babel/helper-replace-supers@7.25.9(@babel/core@7.23.7)':\n    dependencies:\n      '@babel/core': 7.23.7\n      '@babel/helper-member-expression-to-functions': 7.25.9\n      '@babel/helper-optimise-call-expression': 7.25.9\n      '@babel/traverse': 7.25.9\n    transitivePeerDependencies:\n      - supports-color\n\n  '@babel/helper-replace-supers@7.25.9(@babel/core@7.25.9)':\n    dependencies:\n      '@babel/core': 7.25.9\n      '@babel/helper-member-expression-to-functions': 7.25.9\n      '@babel/helper-optimise-call-expression': 7.25.9\n      '@babel/traverse': 7.25.9\n    transitivePeerDependencies:\n      - supports-color\n\n  '@babel/helper-simple-access@7.22.5':\n    dependencies:\n      '@babel/types': 7.25.8\n\n  '@babel/helper-simple-access@7.25.9':\n    dependencies:\n      '@babel/traverse': 7.25.9\n      '@babel/types': 7.25.9\n    transitivePeerDependencies:\n      - supports-color\n\n  '@babel/helper-skip-transparent-expression-wrappers@7.25.9':\n    dependencies:\n      '@babel/traverse': 7.25.9\n      '@babel/types': 7.25.9\n    transitivePeerDependencies:\n      - supports-color\n\n  '@babel/helper-split-export-declaration@7.22.6':\n    dependencies:\n      '@babel/types': 7.25.8\n\n  '@babel/helper-string-parser@7.25.7': {}\n\n  '@babel/helper-string-parser@7.25.9': {}\n\n  '@babel/helper-validator-identifier@7.25.7': {}\n\n  '@babel/helper-validator-identifier@7.25.9': {}\n\n  '@babel/helper-validator-option@7.23.5': {}\n\n  '@babel/helper-validator-option@7.25.9': {}\n\n  '@babel/helper-wrap-function@7.22.20':\n    dependencies:\n      '@babel/helper-function-name': 7.23.0\n      '@babel/template': 7.25.9\n      '@babel/types': 7.25.9\n\n  '@babel/helpers@7.23.7':\n    dependencies:\n      '@babel/template': 7.22.15\n      '@babel/traverse': 7.23.7\n      '@babel/types': 7.25.8\n    transitivePeerDependencies:\n      - supports-color\n\n  '@babel/helpers@7.25.9':\n    dependencies:\n      '@babel/template': 7.25.9\n      '@babel/types': 7.25.9\n\n  '@babel/highlight@7.23.4':\n    dependencies:\n      '@babel/helper-validator-identifier': 7.25.7\n      chalk: 2.4.2\n      js-tokens: 4.0.0\n\n  '@babel/highlight@7.25.9':\n    dependencies:\n      '@babel/helper-validator-identifier': 7.25.9\n      chalk: 2.4.2\n      js-tokens: 4.0.0\n      picocolors: 1.1.0\n\n  '@babel/parser@7.25.8':\n    dependencies:\n      '@babel/types': 7.25.8\n\n  '@babel/parser@7.25.9':\n    dependencies:\n      '@babel/types': 7.25.9\n\n  '@babel/plugin-bugfix-safari-id-destructuring-collision-in-function-expression@7.23.3(@babel/core@7.25.9)':\n    dependencies:\n      '@babel/core': 7.25.9\n      '@babel/helper-plugin-utils': 7.25.9\n\n  '@babel/plugin-bugfix-v8-spread-parameters-in-optional-chaining@7.23.3(@babel/core@7.25.9)':\n    dependencies:\n      '@babel/core': 7.25.9\n      '@babel/helper-plugin-utils': 7.25.9\n      '@babel/helper-skip-transparent-expression-wrappers': 7.25.9\n      '@babel/plugin-transform-optional-chaining': 7.23.4(@babel/core@7.25.9)\n    transitivePeerDependencies:\n      - supports-color\n\n  '@babel/plugin-bugfix-v8-static-class-fields-redefine-readonly@7.23.7(@babel/core@7.25.9)':\n    dependencies:\n      '@babel/core': 7.25.9\n      '@babel/helper-environment-visitor': 7.22.20\n      '@babel/helper-plugin-utils': 7.25.9\n\n  '@babel/plugin-proposal-decorators@7.25.9(@babel/core@7.23.7)':\n    dependencies:\n      '@babel/core': 7.23.7\n      '@babel/helper-create-class-features-plugin': 7.25.9(@babel/core@7.23.7)\n      '@babel/helper-plugin-utils': 7.25.9\n      '@babel/plugin-syntax-decorators': 7.25.9(@babel/core@7.23.7)\n    transitivePeerDependencies:\n      - supports-color\n\n  '@babel/plugin-proposal-private-property-in-object@7.21.0-placeholder-for-preset-env.2(@babel/core@7.25.9)':\n    dependencies:\n      '@babel/core': 7.25.9\n\n  '@babel/plugin-syntax-async-generators@7.8.4(@babel/core@7.25.9)':\n    dependencies:\n      '@babel/core': 7.25.9\n      '@babel/helper-plugin-utils': 7.25.9\n\n  '@babel/plugin-syntax-class-properties@7.12.13(@babel/core@7.25.9)':\n    dependencies:\n      '@babel/core': 7.25.9\n      '@babel/helper-plugin-utils': 7.25.9\n\n  '@babel/plugin-syntax-class-static-block@7.14.5(@babel/core@7.25.9)':\n    dependencies:\n      '@babel/core': 7.25.9\n      '@babel/helper-plugin-utils': 7.25.9\n\n  '@babel/plugin-syntax-decorators@7.25.9(@babel/core@7.23.7)':\n    dependencies:\n      '@babel/core': 7.23.7\n      '@babel/helper-plugin-utils': 7.25.9\n\n  '@babel/plugin-syntax-dynamic-import@7.8.3(@babel/core@7.25.9)':\n    dependencies:\n      '@babel/core': 7.25.9\n      '@babel/helper-plugin-utils': 7.25.9\n\n  '@babel/plugin-syntax-export-namespace-from@7.8.3(@babel/core@7.25.9)':\n    dependencies:\n      '@babel/core': 7.25.9\n      '@babel/helper-plugin-utils': 7.25.9\n\n  '@babel/plugin-syntax-import-assertions@7.23.3(@babel/core@7.25.9)':\n    dependencies:\n      '@babel/core': 7.25.9\n      '@babel/helper-plugin-utils': 7.25.9\n\n  '@babel/plugin-syntax-import-attributes@7.23.3(@babel/core@7.23.7)':\n    dependencies:\n      '@babel/core': 7.23.7\n      '@babel/helper-plugin-utils': 7.22.5\n\n  '@babel/plugin-syntax-import-attributes@7.23.3(@babel/core@7.25.9)':\n    dependencies:\n      '@babel/core': 7.25.9\n      '@babel/helper-plugin-utils': 7.22.5\n\n  '@babel/plugin-syntax-import-meta@7.10.4(@babel/core@7.23.7)':\n    dependencies:\n      '@babel/core': 7.23.7\n      '@babel/helper-plugin-utils': 7.22.5\n\n  '@babel/plugin-syntax-import-meta@7.10.4(@babel/core@7.25.9)':\n    dependencies:\n      '@babel/core': 7.25.9\n      '@babel/helper-plugin-utils': 7.22.5\n\n  '@babel/plugin-syntax-json-strings@7.8.3(@babel/core@7.25.9)':\n    dependencies:\n      '@babel/core': 7.25.9\n      '@babel/helper-plugin-utils': 7.25.9\n\n  '@babel/plugin-syntax-jsx@7.25.9(@babel/core@7.23.7)':\n    dependencies:\n      '@babel/core': 7.23.7\n      '@babel/helper-plugin-utils': 7.25.9\n\n  '@babel/plugin-syntax-jsx@7.25.9(@babel/core@7.25.9)':\n    dependencies:\n      '@babel/core': 7.25.9\n      '@babel/helper-plugin-utils': 7.25.9\n\n  '@babel/plugin-syntax-logical-assignment-operators@7.10.4(@babel/core@7.25.9)':\n    dependencies:\n      '@babel/core': 7.25.9\n      '@babel/helper-plugin-utils': 7.25.9\n\n  '@babel/plugin-syntax-nullish-coalescing-operator@7.8.3(@babel/core@7.25.9)':\n    dependencies:\n      '@babel/core': 7.25.9\n      '@babel/helper-plugin-utils': 7.25.9\n\n  '@babel/plugin-syntax-numeric-separator@7.10.4(@babel/core@7.25.9)':\n    dependencies:\n      '@babel/core': 7.25.9\n      '@babel/helper-plugin-utils': 7.25.9\n\n  '@babel/plugin-syntax-object-rest-spread@7.8.3(@babel/core@7.25.9)':\n    dependencies:\n      '@babel/core': 7.25.9\n      '@babel/helper-plugin-utils': 7.25.9\n\n  '@babel/plugin-syntax-optional-catch-binding@7.8.3(@babel/core@7.25.9)':\n    dependencies:\n      '@babel/core': 7.25.9\n      '@babel/helper-plugin-utils': 7.25.9\n\n  '@babel/plugin-syntax-optional-chaining@7.8.3(@babel/core@7.25.9)':\n    dependencies:\n      '@babel/core': 7.25.9\n      '@babel/helper-plugin-utils': 7.25.9\n\n  '@babel/plugin-syntax-private-property-in-object@7.14.5(@babel/core@7.25.9)':\n    dependencies:\n      '@babel/core': 7.25.9\n      '@babel/helper-plugin-utils': 7.25.9\n\n  '@babel/plugin-syntax-top-level-await@7.14.5(@babel/core@7.25.9)':\n    dependencies:\n      '@babel/core': 7.25.9\n      '@babel/helper-plugin-utils': 7.25.9\n\n  '@babel/plugin-syntax-typescript@7.25.9(@babel/core@7.23.7)':\n    dependencies:\n      '@babel/core': 7.23.7\n      '@babel/helper-plugin-utils': 7.25.9\n\n  '@babel/plugin-syntax-typescript@7.25.9(@babel/core@7.25.9)':\n    dependencies:\n      '@babel/core': 7.25.9\n      '@babel/helper-plugin-utils': 7.25.9\n\n  '@babel/plugin-syntax-unicode-sets-regex@7.18.6(@babel/core@7.25.9)':\n    dependencies:\n      '@babel/core': 7.25.9\n      '@babel/helper-create-regexp-features-plugin': 7.22.15(@babel/core@7.25.9)\n      '@babel/helper-plugin-utils': 7.25.9\n\n  '@babel/plugin-transform-arrow-functions@7.23.3(@babel/core@7.25.9)':\n    dependencies:\n      '@babel/core': 7.25.9\n      '@babel/helper-plugin-utils': 7.25.9\n\n  '@babel/plugin-transform-async-generator-functions@7.23.7(@babel/core@7.25.9)':\n    dependencies:\n      '@babel/core': 7.25.9\n      '@babel/helper-environment-visitor': 7.22.20\n      '@babel/helper-plugin-utils': 7.25.9\n      '@babel/helper-remap-async-to-generator': 7.22.20(@babel/core@7.25.9)\n      '@babel/plugin-syntax-async-generators': 7.8.4(@babel/core@7.25.9)\n\n  '@babel/plugin-transform-async-to-generator@7.23.3(@babel/core@7.25.9)':\n    dependencies:\n      '@babel/core': 7.25.9\n      '@babel/helper-module-imports': 7.25.9\n      '@babel/helper-plugin-utils': 7.25.9\n      '@babel/helper-remap-async-to-generator': 7.22.20(@babel/core@7.25.9)\n    transitivePeerDependencies:\n      - supports-color\n\n  '@babel/plugin-transform-block-scoped-functions@7.23.3(@babel/core@7.25.9)':\n    dependencies:\n      '@babel/core': 7.25.9\n      '@babel/helper-plugin-utils': 7.25.9\n\n  '@babel/plugin-transform-block-scoping@7.23.4(@babel/core@7.25.9)':\n    dependencies:\n      '@babel/core': 7.25.9\n      '@babel/helper-plugin-utils': 7.25.9\n\n  '@babel/plugin-transform-class-properties@7.23.3(@babel/core@7.25.9)':\n    dependencies:\n      '@babel/core': 7.25.9\n      '@babel/helper-create-class-features-plugin': 7.25.9(@babel/core@7.25.9)\n      '@babel/helper-plugin-utils': 7.25.9\n    transitivePeerDependencies:\n      - supports-color\n\n  '@babel/plugin-transform-class-static-block@7.23.4(@babel/core@7.25.9)':\n    dependencies:\n      '@babel/core': 7.25.9\n      '@babel/helper-create-class-features-plugin': 7.25.9(@babel/core@7.25.9)\n      '@babel/helper-plugin-utils': 7.25.9\n      '@babel/plugin-syntax-class-static-block': 7.14.5(@babel/core@7.25.9)\n    transitivePeerDependencies:\n      - supports-color\n\n  '@babel/plugin-transform-classes@7.23.5(@babel/core@7.25.9)':\n    dependencies:\n      '@babel/core': 7.25.9\n      '@babel/helper-annotate-as-pure': 7.25.9\n      '@babel/helper-compilation-targets': 7.25.9\n      '@babel/helper-environment-visitor': 7.22.20\n      '@babel/helper-function-name': 7.23.0\n      '@babel/helper-optimise-call-expression': 7.25.9\n      '@babel/helper-plugin-utils': 7.25.9\n      '@babel/helper-replace-supers': 7.25.9(@babel/core@7.25.9)\n      '@babel/helper-split-export-declaration': 7.22.6\n      globals: 11.12.0\n    transitivePeerDependencies:\n      - supports-color\n\n  '@babel/plugin-transform-computed-properties@7.23.3(@babel/core@7.25.9)':\n    dependencies:\n      '@babel/core': 7.25.9\n      '@babel/helper-plugin-utils': 7.25.9\n      '@babel/template': 7.25.9\n\n  '@babel/plugin-transform-destructuring@7.23.3(@babel/core@7.25.9)':\n    dependencies:\n      '@babel/core': 7.25.9\n      '@babel/helper-plugin-utils': 7.25.9\n\n  '@babel/plugin-transform-dotall-regex@7.23.3(@babel/core@7.25.9)':\n    dependencies:\n      '@babel/core': 7.25.9\n      '@babel/helper-create-regexp-features-plugin': 7.22.15(@babel/core@7.25.9)\n      '@babel/helper-plugin-utils': 7.25.9\n\n  '@babel/plugin-transform-duplicate-keys@7.23.3(@babel/core@7.25.9)':\n    dependencies:\n      '@babel/core': 7.25.9\n      '@babel/helper-plugin-utils': 7.25.9\n\n  '@babel/plugin-transform-dynamic-import@7.23.4(@babel/core@7.25.9)':\n    dependencies:\n      '@babel/core': 7.25.9\n      '@babel/helper-plugin-utils': 7.25.9\n      '@babel/plugin-syntax-dynamic-import': 7.8.3(@babel/core@7.25.9)\n\n  '@babel/plugin-transform-exponentiation-operator@7.23.3(@babel/core@7.25.9)':\n    dependencies:\n      '@babel/core': 7.25.9\n      '@babel/helper-builder-binary-assignment-operator-visitor': 7.22.15\n      '@babel/helper-plugin-utils': 7.25.9\n\n  '@babel/plugin-transform-export-namespace-from@7.23.4(@babel/core@7.25.9)':\n    dependencies:\n      '@babel/core': 7.25.9\n      '@babel/helper-plugin-utils': 7.25.9\n      '@babel/plugin-syntax-export-namespace-from': 7.8.3(@babel/core@7.25.9)\n\n  '@babel/plugin-transform-for-of@7.23.6(@babel/core@7.25.9)':\n    dependencies:\n      '@babel/core': 7.25.9\n      '@babel/helper-plugin-utils': 7.25.9\n      '@babel/helper-skip-transparent-expression-wrappers': 7.25.9\n    transitivePeerDependencies:\n      - supports-color\n\n  '@babel/plugin-transform-function-name@7.23.3(@babel/core@7.25.9)':\n    dependencies:\n      '@babel/core': 7.25.9\n      '@babel/helper-compilation-targets': 7.25.9\n      '@babel/helper-function-name': 7.23.0\n      '@babel/helper-plugin-utils': 7.25.9\n\n  '@babel/plugin-transform-json-strings@7.23.4(@babel/core@7.25.9)':\n    dependencies:\n      '@babel/core': 7.25.9\n      '@babel/helper-plugin-utils': 7.25.9\n      '@babel/plugin-syntax-json-strings': 7.8.3(@babel/core@7.25.9)\n\n  '@babel/plugin-transform-literals@7.23.3(@babel/core@7.25.9)':\n    dependencies:\n      '@babel/core': 7.25.9\n      '@babel/helper-plugin-utils': 7.25.9\n\n  '@babel/plugin-transform-logical-assignment-operators@7.23.4(@babel/core@7.25.9)':\n    dependencies:\n      '@babel/core': 7.25.9\n      '@babel/helper-plugin-utils': 7.25.9\n      '@babel/plugin-syntax-logical-assignment-operators': 7.10.4(@babel/core@7.25.9)\n\n  '@babel/plugin-transform-member-expression-literals@7.23.3(@babel/core@7.25.9)':\n    dependencies:\n      '@babel/core': 7.25.9\n      '@babel/helper-plugin-utils': 7.25.9\n\n  '@babel/plugin-transform-modules-amd@7.23.3(@babel/core@7.25.9)':\n    dependencies:\n      '@babel/core': 7.25.9\n      '@babel/helper-module-transforms': 7.25.9(@babel/core@7.25.9)\n      '@babel/helper-plugin-utils': 7.25.9\n    transitivePeerDependencies:\n      - supports-color\n\n  '@babel/plugin-transform-modules-commonjs@7.23.3(@babel/core@7.25.9)':\n    dependencies:\n      '@babel/core': 7.25.9\n      '@babel/helper-module-transforms': 7.25.9(@babel/core@7.25.9)\n      '@babel/helper-plugin-utils': 7.25.9\n      '@babel/helper-simple-access': 7.25.9\n    transitivePeerDependencies:\n      - supports-color\n\n  '@babel/plugin-transform-modules-systemjs@7.23.3(@babel/core@7.25.9)':\n    dependencies:\n      '@babel/core': 7.25.9\n      '@babel/helper-hoist-variables': 7.22.5\n      '@babel/helper-module-transforms': 7.25.9(@babel/core@7.25.9)\n      '@babel/helper-plugin-utils': 7.25.9\n      '@babel/helper-validator-identifier': 7.25.9\n    transitivePeerDependencies:\n      - supports-color\n\n  '@babel/plugin-transform-modules-umd@7.23.3(@babel/core@7.25.9)':\n    dependencies:\n      '@babel/core': 7.25.9\n      '@babel/helper-module-transforms': 7.25.9(@babel/core@7.25.9)\n      '@babel/helper-plugin-utils': 7.25.9\n    transitivePeerDependencies:\n      - supports-color\n\n  '@babel/plugin-transform-named-capturing-groups-regex@7.22.5(@babel/core@7.25.9)':\n    dependencies:\n      '@babel/core': 7.25.9\n      '@babel/helper-create-regexp-features-plugin': 7.22.15(@babel/core@7.25.9)\n      '@babel/helper-plugin-utils': 7.25.9\n\n  '@babel/plugin-transform-new-target@7.23.3(@babel/core@7.25.9)':\n    dependencies:\n      '@babel/core': 7.25.9\n      '@babel/helper-plugin-utils': 7.25.9\n\n  '@babel/plugin-transform-nullish-coalescing-operator@7.23.4(@babel/core@7.25.9)':\n    dependencies:\n      '@babel/core': 7.25.9\n      '@babel/helper-plugin-utils': 7.25.9\n      '@babel/plugin-syntax-nullish-coalescing-operator': 7.8.3(@babel/core@7.25.9)\n\n  '@babel/plugin-transform-numeric-separator@7.23.4(@babel/core@7.25.9)':\n    dependencies:\n      '@babel/core': 7.25.9\n      '@babel/helper-plugin-utils': 7.25.9\n      '@babel/plugin-syntax-numeric-separator': 7.10.4(@babel/core@7.25.9)\n\n  '@babel/plugin-transform-object-rest-spread@7.23.4(@babel/core@7.25.9)':\n    dependencies:\n      '@babel/compat-data': 7.25.9\n      '@babel/core': 7.25.9\n      '@babel/helper-compilation-targets': 7.25.9\n      '@babel/helper-plugin-utils': 7.25.9\n      '@babel/plugin-syntax-object-rest-spread': 7.8.3(@babel/core@7.25.9)\n      '@babel/plugin-transform-parameters': 7.23.3(@babel/core@7.25.9)\n\n  '@babel/plugin-transform-object-super@7.23.3(@babel/core@7.25.9)':\n    dependencies:\n      '@babel/core': 7.25.9\n      '@babel/helper-plugin-utils': 7.25.9\n      '@babel/helper-replace-supers': 7.25.9(@babel/core@7.25.9)\n    transitivePeerDependencies:\n      - supports-color\n\n  '@babel/plugin-transform-optional-catch-binding@7.23.4(@babel/core@7.25.9)':\n    dependencies:\n      '@babel/core': 7.25.9\n      '@babel/helper-plugin-utils': 7.25.9\n      '@babel/plugin-syntax-optional-catch-binding': 7.8.3(@babel/core@7.25.9)\n\n  '@babel/plugin-transform-optional-chaining@7.23.4(@babel/core@7.25.9)':\n    dependencies:\n      '@babel/core': 7.25.9\n      '@babel/helper-plugin-utils': 7.25.9\n      '@babel/helper-skip-transparent-expression-wrappers': 7.25.9\n      '@babel/plugin-syntax-optional-chaining': 7.8.3(@babel/core@7.25.9)\n    transitivePeerDependencies:\n      - supports-color\n\n  '@babel/plugin-transform-parameters@7.23.3(@babel/core@7.25.9)':\n    dependencies:\n      '@babel/core': 7.25.9\n      '@babel/helper-plugin-utils': 7.25.9\n\n  '@babel/plugin-transform-private-methods@7.23.3(@babel/core@7.25.9)':\n    dependencies:\n      '@babel/core': 7.25.9\n      '@babel/helper-create-class-features-plugin': 7.25.9(@babel/core@7.25.9)\n      '@babel/helper-plugin-utils': 7.25.9\n    transitivePeerDependencies:\n      - supports-color\n\n  '@babel/plugin-transform-private-property-in-object@7.23.4(@babel/core@7.25.9)':\n    dependencies:\n      '@babel/core': 7.25.9\n      '@babel/helper-annotate-as-pure': 7.25.9\n      '@babel/helper-create-class-features-plugin': 7.25.9(@babel/core@7.25.9)\n      '@babel/helper-plugin-utils': 7.25.9\n      '@babel/plugin-syntax-private-property-in-object': 7.14.5(@babel/core@7.25.9)\n    transitivePeerDependencies:\n      - supports-color\n\n  '@babel/plugin-transform-property-literals@7.23.3(@babel/core@7.25.9)':\n    dependencies:\n      '@babel/core': 7.25.9\n      '@babel/helper-plugin-utils': 7.25.9\n\n  '@babel/plugin-transform-regenerator@7.23.3(@babel/core@7.25.9)':\n    dependencies:\n      '@babel/core': 7.25.9\n      '@babel/helper-plugin-utils': 7.25.9\n      regenerator-transform: 0.15.2\n\n  '@babel/plugin-transform-reserved-words@7.23.3(@babel/core@7.25.9)':\n    dependencies:\n      '@babel/core': 7.25.9\n      '@babel/helper-plugin-utils': 7.25.9\n\n  '@babel/plugin-transform-shorthand-properties@7.23.3(@babel/core@7.25.9)':\n    dependencies:\n      '@babel/core': 7.25.9\n      '@babel/helper-plugin-utils': 7.25.9\n\n  '@babel/plugin-transform-spread@7.23.3(@babel/core@7.25.9)':\n    dependencies:\n      '@babel/core': 7.25.9\n      '@babel/helper-plugin-utils': 7.25.9\n      '@babel/helper-skip-transparent-expression-wrappers': 7.25.9\n    transitivePeerDependencies:\n      - supports-color\n\n  '@babel/plugin-transform-sticky-regex@7.23.3(@babel/core@7.25.9)':\n    dependencies:\n      '@babel/core': 7.25.9\n      '@babel/helper-plugin-utils': 7.25.9\n\n  '@babel/plugin-transform-template-literals@7.23.3(@babel/core@7.25.9)':\n    dependencies:\n      '@babel/core': 7.25.9\n      '@babel/helper-plugin-utils': 7.25.9\n\n  '@babel/plugin-transform-typeof-symbol@7.23.3(@babel/core@7.25.9)':\n    dependencies:\n      '@babel/core': 7.25.9\n      '@babel/helper-plugin-utils': 7.25.9\n\n  '@babel/plugin-transform-typescript@7.25.9(@babel/core@7.23.7)':\n    dependencies:\n      '@babel/core': 7.23.7\n      '@babel/helper-annotate-as-pure': 7.25.9\n      '@babel/helper-create-class-features-plugin': 7.25.9(@babel/core@7.23.7)\n      '@babel/helper-plugin-utils': 7.25.9\n      '@babel/helper-skip-transparent-expression-wrappers': 7.25.9\n      '@babel/plugin-syntax-typescript': 7.25.9(@babel/core@7.23.7)\n    transitivePeerDependencies:\n      - supports-color\n\n  '@babel/plugin-transform-typescript@7.25.9(@babel/core@7.25.9)':\n    dependencies:\n      '@babel/core': 7.25.9\n      '@babel/helper-annotate-as-pure': 7.25.9\n      '@babel/helper-create-class-features-plugin': 7.25.9(@babel/core@7.25.9)\n      '@babel/helper-plugin-utils': 7.25.9\n      '@babel/helper-skip-transparent-expression-wrappers': 7.25.9\n      '@babel/plugin-syntax-typescript': 7.25.9(@babel/core@7.25.9)\n    transitivePeerDependencies:\n      - supports-color\n\n  '@babel/plugin-transform-unicode-escapes@7.23.3(@babel/core@7.25.9)':\n    dependencies:\n      '@babel/core': 7.25.9\n      '@babel/helper-plugin-utils': 7.25.9\n\n  '@babel/plugin-transform-unicode-property-regex@7.23.3(@babel/core@7.25.9)':\n    dependencies:\n      '@babel/core': 7.25.9\n      '@babel/helper-create-regexp-features-plugin': 7.22.15(@babel/core@7.25.9)\n      '@babel/helper-plugin-utils': 7.25.9\n\n  '@babel/plugin-transform-unicode-regex@7.23.3(@babel/core@7.25.9)':\n    dependencies:\n      '@babel/core': 7.25.9\n      '@babel/helper-create-regexp-features-plugin': 7.22.15(@babel/core@7.25.9)\n      '@babel/helper-plugin-utils': 7.25.9\n\n  '@babel/plugin-transform-unicode-sets-regex@7.23.3(@babel/core@7.25.9)':\n    dependencies:\n      '@babel/core': 7.25.9\n      '@babel/helper-create-regexp-features-plugin': 7.22.15(@babel/core@7.25.9)\n      '@babel/helper-plugin-utils': 7.25.9\n\n  '@babel/preset-env@7.23.7(@babel/core@7.25.9)':\n    dependencies:\n      '@babel/compat-data': 7.25.9\n      '@babel/core': 7.25.9\n      '@babel/helper-compilation-targets': 7.25.9\n      '@babel/helper-plugin-utils': 7.25.9\n      '@babel/helper-validator-option': 7.25.9\n      '@babel/plugin-bugfix-safari-id-destructuring-collision-in-function-expression': 7.23.3(@babel/core@7.25.9)\n      '@babel/plugin-bugfix-v8-spread-parameters-in-optional-chaining': 7.23.3(@babel/core@7.25.9)\n      '@babel/plugin-bugfix-v8-static-class-fields-redefine-readonly': 7.23.7(@babel/core@7.25.9)\n      '@babel/plugin-proposal-private-property-in-object': 7.21.0-placeholder-for-preset-env.2(@babel/core@7.25.9)\n      '@babel/plugin-syntax-async-generators': 7.8.4(@babel/core@7.25.9)\n      '@babel/plugin-syntax-class-properties': 7.12.13(@babel/core@7.25.9)\n      '@babel/plugin-syntax-class-static-block': 7.14.5(@babel/core@7.25.9)\n      '@babel/plugin-syntax-dynamic-import': 7.8.3(@babel/core@7.25.9)\n      '@babel/plugin-syntax-export-namespace-from': 7.8.3(@babel/core@7.25.9)\n      '@babel/plugin-syntax-import-assertions': 7.23.3(@babel/core@7.25.9)\n      '@babel/plugin-syntax-import-attributes': 7.23.3(@babel/core@7.25.9)\n      '@babel/plugin-syntax-import-meta': 7.10.4(@babel/core@7.25.9)\n      '@babel/plugin-syntax-json-strings': 7.8.3(@babel/core@7.25.9)\n      '@babel/plugin-syntax-logical-assignment-operators': 7.10.4(@babel/core@7.25.9)\n      '@babel/plugin-syntax-nullish-coalescing-operator': 7.8.3(@babel/core@7.25.9)\n      '@babel/plugin-syntax-numeric-separator': 7.10.4(@babel/core@7.25.9)\n      '@babel/plugin-syntax-object-rest-spread': 7.8.3(@babel/core@7.25.9)\n      '@babel/plugin-syntax-optional-catch-binding': 7.8.3(@babel/core@7.25.9)\n      '@babel/plugin-syntax-optional-chaining': 7.8.3(@babel/core@7.25.9)\n      '@babel/plugin-syntax-private-property-in-object': 7.14.5(@babel/core@7.25.9)\n      '@babel/plugin-syntax-top-level-await': 7.14.5(@babel/core@7.25.9)\n      '@babel/plugin-syntax-unicode-sets-regex': 7.18.6(@babel/core@7.25.9)\n      '@babel/plugin-transform-arrow-functions': 7.23.3(@babel/core@7.25.9)\n      '@babel/plugin-transform-async-generator-functions': 7.23.7(@babel/core@7.25.9)\n      '@babel/plugin-transform-async-to-generator': 7.23.3(@babel/core@7.25.9)\n      '@babel/plugin-transform-block-scoped-functions': 7.23.3(@babel/core@7.25.9)\n      '@babel/plugin-transform-block-scoping': 7.23.4(@babel/core@7.25.9)\n      '@babel/plugin-transform-class-properties': 7.23.3(@babel/core@7.25.9)\n      '@babel/plugin-transform-class-static-block': 7.23.4(@babel/core@7.25.9)\n      '@babel/plugin-transform-classes': 7.23.5(@babel/core@7.25.9)\n      '@babel/plugin-transform-computed-properties': 7.23.3(@babel/core@7.25.9)\n      '@babel/plugin-transform-destructuring': 7.23.3(@babel/core@7.25.9)\n      '@babel/plugin-transform-dotall-regex': 7.23.3(@babel/core@7.25.9)\n      '@babel/plugin-transform-duplicate-keys': 7.23.3(@babel/core@7.25.9)\n      '@babel/plugin-transform-dynamic-import': 7.23.4(@babel/core@7.25.9)\n      '@babel/plugin-transform-exponentiation-operator': 7.23.3(@babel/core@7.25.9)\n      '@babel/plugin-transform-export-namespace-from': 7.23.4(@babel/core@7.25.9)\n      '@babel/plugin-transform-for-of': 7.23.6(@babel/core@7.25.9)\n      '@babel/plugin-transform-function-name': 7.23.3(@babel/core@7.25.9)\n      '@babel/plugin-transform-json-strings': 7.23.4(@babel/core@7.25.9)\n      '@babel/plugin-transform-literals': 7.23.3(@babel/core@7.25.9)\n      '@babel/plugin-transform-logical-assignment-operators': 7.23.4(@babel/core@7.25.9)\n      '@babel/plugin-transform-member-expression-literals': 7.23.3(@babel/core@7.25.9)\n      '@babel/plugin-transform-modules-amd': 7.23.3(@babel/core@7.25.9)\n      '@babel/plugin-transform-modules-commonjs': 7.23.3(@babel/core@7.25.9)\n      '@babel/plugin-transform-modules-systemjs': 7.23.3(@babel/core@7.25.9)\n      '@babel/plugin-transform-modules-umd': 7.23.3(@babel/core@7.25.9)\n      '@babel/plugin-transform-named-capturing-groups-regex': 7.22.5(@babel/core@7.25.9)\n      '@babel/plugin-transform-new-target': 7.23.3(@babel/core@7.25.9)\n      '@babel/plugin-transform-nullish-coalescing-operator': 7.23.4(@babel/core@7.25.9)\n      '@babel/plugin-transform-numeric-separator': 7.23.4(@babel/core@7.25.9)\n      '@babel/plugin-transform-object-rest-spread': 7.23.4(@babel/core@7.25.9)\n      '@babel/plugin-transform-object-super': 7.23.3(@babel/core@7.25.9)\n      '@babel/plugin-transform-optional-catch-binding': 7.23.4(@babel/core@7.25.9)\n      '@babel/plugin-transform-optional-chaining': 7.23.4(@babel/core@7.25.9)\n      '@babel/plugin-transform-parameters': 7.23.3(@babel/core@7.25.9)\n      '@babel/plugin-transform-private-methods': 7.23.3(@babel/core@7.25.9)\n      '@babel/plugin-transform-private-property-in-object': 7.23.4(@babel/core@7.25.9)\n      '@babel/plugin-transform-property-literals': 7.23.3(@babel/core@7.25.9)\n      '@babel/plugin-transform-regenerator': 7.23.3(@babel/core@7.25.9)\n      '@babel/plugin-transform-reserved-words': 7.23.3(@babel/core@7.25.9)\n      '@babel/plugin-transform-shorthand-properties': 7.23.3(@babel/core@7.25.9)\n      '@babel/plugin-transform-spread': 7.23.3(@babel/core@7.25.9)\n      '@babel/plugin-transform-sticky-regex': 7.23.3(@babel/core@7.25.9)\n      '@babel/plugin-transform-template-literals': 7.23.3(@babel/core@7.25.9)\n      '@babel/plugin-transform-typeof-symbol': 7.23.3(@babel/core@7.25.9)\n      '@babel/plugin-transform-unicode-escapes': 7.23.3(@babel/core@7.25.9)\n      '@babel/plugin-transform-unicode-property-regex': 7.23.3(@babel/core@7.25.9)\n      '@babel/plugin-transform-unicode-regex': 7.23.3(@babel/core@7.25.9)\n      '@babel/plugin-transform-unicode-sets-regex': 7.23.3(@babel/core@7.25.9)\n      '@babel/preset-modules': 0.1.6-no-external-plugins(@babel/core@7.25.9)\n      babel-plugin-polyfill-corejs2: 0.4.7(@babel/core@7.25.9)\n      babel-plugin-polyfill-corejs3: 0.8.7(@babel/core@7.25.9)\n      babel-plugin-polyfill-regenerator: 0.5.4(@babel/core@7.25.9)\n      core-js-compat: 3.35.0\n      semver: 6.3.1\n    transitivePeerDependencies:\n      - supports-color\n\n  '@babel/preset-modules@0.1.6-no-external-plugins(@babel/core@7.25.9)':\n    dependencies:\n      '@babel/core': 7.25.9\n      '@babel/helper-plugin-utils': 7.25.9\n      '@babel/types': 7.25.9\n      esutils: 2.0.3\n\n  '@babel/regjsgen@0.8.0': {}\n\n  '@babel/runtime@7.23.7':\n    dependencies:\n      regenerator-runtime: 0.14.1\n\n  '@babel/standalone@7.25.9': {}\n\n  '@babel/template@7.22.15':\n    dependencies:\n      '@babel/code-frame': 7.23.5\n      '@babel/parser': 7.25.9\n      '@babel/types': 7.25.8\n\n  '@babel/template@7.25.9':\n    dependencies:\n      '@babel/code-frame': 7.25.9\n      '@babel/parser': 7.25.9\n      '@babel/types': 7.25.9\n\n  '@babel/traverse@7.23.7':\n    dependencies:\n      '@babel/code-frame': 7.23.5\n      '@babel/generator': 7.23.6\n      '@babel/helper-environment-visitor': 7.22.20\n      '@babel/helper-function-name': 7.23.0\n      '@babel/helper-hoist-variables': 7.22.5\n      '@babel/helper-split-export-declaration': 7.22.6\n      '@babel/parser': 7.25.9\n      '@babel/types': 7.25.8\n      debug: 4.3.7\n      globals: 11.12.0\n    transitivePeerDependencies:\n      - supports-color\n\n  '@babel/traverse@7.25.9':\n    dependencies:\n      '@babel/code-frame': 7.25.9\n      '@babel/generator': 7.25.9\n      '@babel/parser': 7.25.9\n      '@babel/template': 7.25.9\n      '@babel/types': 7.25.9\n      debug: 4.3.7\n      globals: 11.12.0\n    transitivePeerDependencies:\n      - supports-color\n\n  '@babel/types@7.25.8':\n    dependencies:\n      '@babel/helper-string-parser': 7.25.7\n      '@babel/helper-validator-identifier': 7.25.7\n      to-fast-properties: 2.0.0\n\n  '@babel/types@7.25.9':\n    dependencies:\n      '@babel/helper-string-parser': 7.25.9\n      '@babel/helper-validator-identifier': 7.25.9\n\n  '@cloudflare/kv-asset-handler@0.3.4':\n    dependencies:\n      mime: 3.0.0\n\n  '@cloudflare/workerd-darwin-64@1.20241106.1':\n    optional: true\n\n  '@cloudflare/workerd-darwin-arm64@1.20241106.1':\n    optional: true\n\n  '@cloudflare/workerd-linux-64@1.20241106.1':\n    optional: true\n\n  '@cloudflare/workerd-linux-arm64@1.20241106.1':\n    optional: true\n\n  '@cloudflare/workerd-windows-64@1.20241106.1':\n    optional: true\n\n  '@cloudflare/workers-shared@0.9.0':\n    dependencies:\n      mime: 3.0.0\n      zod: 3.23.8\n\n  '@cloudflare/workers-types@4.20241127.0': {}\n\n  '@cspotcode/source-map-support@0.8.1':\n    dependencies:\n      '@jridgewell/trace-mapping': 0.3.9\n\n  '@csstools/selector-resolve-nested@2.0.0(postcss-selector-parser@6.1.2)':\n    dependencies:\n      postcss-selector-parser: 6.1.2\n\n  '@csstools/selector-specificity@4.0.0(postcss-selector-parser@6.1.2)':\n    dependencies:\n      postcss-selector-parser: 6.1.2\n\n  '@drizzle-team/brocli@0.10.2': {}\n\n  '@esbuild-kit/core-utils@3.3.2':\n    dependencies:\n      esbuild: 0.18.20\n      source-map-support: 0.5.21\n\n  '@esbuild-kit/esm-loader@2.6.5':\n    dependencies:\n      '@esbuild-kit/core-utils': 3.3.2\n      get-tsconfig: 4.8.1\n\n  '@esbuild-plugins/node-globals-polyfill@0.2.3(esbuild@0.17.19)':\n    dependencies:\n      esbuild: 0.17.19\n\n  '@esbuild-plugins/node-modules-polyfill@0.2.2(esbuild@0.17.19)':\n    dependencies:\n      esbuild: 0.17.19\n      escape-string-regexp: 4.0.0\n      rollup-plugin-node-polyfills: 0.2.1\n\n  '@esbuild/aix-ppc64@0.19.12':\n    optional: true\n\n  '@esbuild/aix-ppc64@0.20.2':\n    optional: true\n\n  '@esbuild/aix-ppc64@0.21.5':\n    optional: true\n\n  '@esbuild/aix-ppc64@0.23.1':\n    optional: true\n\n  '@esbuild/android-arm64@0.17.19':\n    optional: true\n\n  '@esbuild/android-arm64@0.18.20':\n    optional: true\n\n  '@esbuild/android-arm64@0.19.12':\n    optional: true\n\n  '@esbuild/android-arm64@0.20.2':\n    optional: true\n\n  '@esbuild/android-arm64@0.21.5':\n    optional: true\n\n  '@esbuild/android-arm64@0.23.1':\n    optional: true\n\n  '@esbuild/android-arm@0.17.19':\n    optional: true\n\n  '@esbuild/android-arm@0.18.20':\n    optional: true\n\n  '@esbuild/android-arm@0.19.12':\n    optional: true\n\n  '@esbuild/android-arm@0.20.2':\n    optional: true\n\n  '@esbuild/android-arm@0.21.5':\n    optional: true\n\n  '@esbuild/android-arm@0.23.1':\n    optional: true\n\n  '@esbuild/android-x64@0.17.19':\n    optional: true\n\n  '@esbuild/android-x64@0.18.20':\n    optional: true\n\n  '@esbuild/android-x64@0.19.12':\n    optional: true\n\n  '@esbuild/android-x64@0.20.2':\n    optional: true\n\n  '@esbuild/android-x64@0.21.5':\n    optional: true\n\n  '@esbuild/android-x64@0.23.1':\n    optional: true\n\n  '@esbuild/darwin-arm64@0.17.19':\n    optional: true\n\n  '@esbuild/darwin-arm64@0.18.20':\n    optional: true\n\n  '@esbuild/darwin-arm64@0.19.12':\n    optional: true\n\n  '@esbuild/darwin-arm64@0.20.2':\n    optional: true\n\n  '@esbuild/darwin-arm64@0.21.5':\n    optional: true\n\n  '@esbuild/darwin-arm64@0.23.1':\n    optional: true\n\n  '@esbuild/darwin-x64@0.17.19':\n    optional: true\n\n  '@esbuild/darwin-x64@0.18.20':\n    optional: true\n\n  '@esbuild/darwin-x64@0.19.12':\n    optional: true\n\n  '@esbuild/darwin-x64@0.20.2':\n    optional: true\n\n  '@esbuild/darwin-x64@0.21.5':\n    optional: true\n\n  '@esbuild/darwin-x64@0.23.1':\n    optional: true\n\n  '@esbuild/freebsd-arm64@0.17.19':\n    optional: true\n\n  '@esbuild/freebsd-arm64@0.18.20':\n    optional: true\n\n  '@esbuild/freebsd-arm64@0.19.12':\n    optional: true\n\n  '@esbuild/freebsd-arm64@0.20.2':\n    optional: true\n\n  '@esbuild/freebsd-arm64@0.21.5':\n    optional: true\n\n  '@esbuild/freebsd-arm64@0.23.1':\n    optional: true\n\n  '@esbuild/freebsd-x64@0.17.19':\n    optional: true\n\n  '@esbuild/freebsd-x64@0.18.20':\n    optional: true\n\n  '@esbuild/freebsd-x64@0.19.12':\n    optional: true\n\n  '@esbuild/freebsd-x64@0.20.2':\n    optional: true\n\n  '@esbuild/freebsd-x64@0.21.5':\n    optional: true\n\n  '@esbuild/freebsd-x64@0.23.1':\n    optional: true\n\n  '@esbuild/linux-arm64@0.17.19':\n    optional: true\n\n  '@esbuild/linux-arm64@0.18.20':\n    optional: true\n\n  '@esbuild/linux-arm64@0.19.12':\n    optional: true\n\n  '@esbuild/linux-arm64@0.20.2':\n    optional: true\n\n  '@esbuild/linux-arm64@0.21.5':\n    optional: true\n\n  '@esbuild/linux-arm64@0.23.1':\n    optional: true\n\n  '@esbuild/linux-arm@0.17.19':\n    optional: true\n\n  '@esbuild/linux-arm@0.18.20':\n    optional: true\n\n  '@esbuild/linux-arm@0.19.12':\n    optional: true\n\n  '@esbuild/linux-arm@0.20.2':\n    optional: true\n\n  '@esbuild/linux-arm@0.21.5':\n    optional: true\n\n  '@esbuild/linux-arm@0.23.1':\n    optional: true\n\n  '@esbuild/linux-ia32@0.17.19':\n    optional: true\n\n  '@esbuild/linux-ia32@0.18.20':\n    optional: true\n\n  '@esbuild/linux-ia32@0.19.12':\n    optional: true\n\n  '@esbuild/linux-ia32@0.20.2':\n    optional: true\n\n  '@esbuild/linux-ia32@0.21.5':\n    optional: true\n\n  '@esbuild/linux-ia32@0.23.1':\n    optional: true\n\n  '@esbuild/linux-loong64@0.17.19':\n    optional: true\n\n  '@esbuild/linux-loong64@0.18.20':\n    optional: true\n\n  '@esbuild/linux-loong64@0.19.12':\n    optional: true\n\n  '@esbuild/linux-loong64@0.20.2':\n    optional: true\n\n  '@esbuild/linux-loong64@0.21.5':\n    optional: true\n\n  '@esbuild/linux-loong64@0.23.1':\n    optional: true\n\n  '@esbuild/linux-mips64el@0.17.19':\n    optional: true\n\n  '@esbuild/linux-mips64el@0.18.20':\n    optional: true\n\n  '@esbuild/linux-mips64el@0.19.12':\n    optional: true\n\n  '@esbuild/linux-mips64el@0.20.2':\n    optional: true\n\n  '@esbuild/linux-mips64el@0.21.5':\n    optional: true\n\n  '@esbuild/linux-mips64el@0.23.1':\n    optional: true\n\n  '@esbuild/linux-ppc64@0.17.19':\n    optional: true\n\n  '@esbuild/linux-ppc64@0.18.20':\n    optional: true\n\n  '@esbuild/linux-ppc64@0.19.12':\n    optional: true\n\n  '@esbuild/linux-ppc64@0.20.2':\n    optional: true\n\n  '@esbuild/linux-ppc64@0.21.5':\n    optional: true\n\n  '@esbuild/linux-ppc64@0.23.1':\n    optional: true\n\n  '@esbuild/linux-riscv64@0.17.19':\n    optional: true\n\n  '@esbuild/linux-riscv64@0.18.20':\n    optional: true\n\n  '@esbuild/linux-riscv64@0.19.12':\n    optional: true\n\n  '@esbuild/linux-riscv64@0.20.2':\n    optional: true\n\n  '@esbuild/linux-riscv64@0.21.5':\n    optional: true\n\n  '@esbuild/linux-riscv64@0.23.1':\n    optional: true\n\n  '@esbuild/linux-s390x@0.17.19':\n    optional: true\n\n  '@esbuild/linux-s390x@0.18.20':\n    optional: true\n\n  '@esbuild/linux-s390x@0.19.12':\n    optional: true\n\n  '@esbuild/linux-s390x@0.20.2':\n    optional: true\n\n  '@esbuild/linux-s390x@0.21.5':\n    optional: true\n\n  '@esbuild/linux-s390x@0.23.1':\n    optional: true\n\n  '@esbuild/linux-x64@0.17.19':\n    optional: true\n\n  '@esbuild/linux-x64@0.18.20':\n    optional: true\n\n  '@esbuild/linux-x64@0.19.12':\n    optional: true\n\n  '@esbuild/linux-x64@0.20.2':\n    optional: true\n\n  '@esbuild/linux-x64@0.21.5':\n    optional: true\n\n  '@esbuild/linux-x64@0.23.1':\n    optional: true\n\n  '@esbuild/netbsd-x64@0.17.19':\n    optional: true\n\n  '@esbuild/netbsd-x64@0.18.20':\n    optional: true\n\n  '@esbuild/netbsd-x64@0.19.12':\n    optional: true\n\n  '@esbuild/netbsd-x64@0.20.2':\n    optional: true\n\n  '@esbuild/netbsd-x64@0.21.5':\n    optional: true\n\n  '@esbuild/netbsd-x64@0.23.1':\n    optional: true\n\n  '@esbuild/openbsd-arm64@0.23.1':\n    optional: true\n\n  '@esbuild/openbsd-x64@0.17.19':\n    optional: true\n\n  '@esbuild/openbsd-x64@0.18.20':\n    optional: true\n\n  '@esbuild/openbsd-x64@0.19.12':\n    optional: true\n\n  '@esbuild/openbsd-x64@0.20.2':\n    optional: true\n\n  '@esbuild/openbsd-x64@0.21.5':\n    optional: true\n\n  '@esbuild/openbsd-x64@0.23.1':\n    optional: true\n\n  '@esbuild/sunos-x64@0.17.19':\n    optional: true\n\n  '@esbuild/sunos-x64@0.18.20':\n    optional: true\n\n  '@esbuild/sunos-x64@0.19.12':\n    optional: true\n\n  '@esbuild/sunos-x64@0.20.2':\n    optional: true\n\n  '@esbuild/sunos-x64@0.21.5':\n    optional: true\n\n  '@esbuild/sunos-x64@0.23.1':\n    optional: true\n\n  '@esbuild/win32-arm64@0.17.19':\n    optional: true\n\n  '@esbuild/win32-arm64@0.18.20':\n    optional: true\n\n  '@esbuild/win32-arm64@0.19.12':\n    optional: true\n\n  '@esbuild/win32-arm64@0.20.2':\n    optional: true\n\n  '@esbuild/win32-arm64@0.21.5':\n    optional: true\n\n  '@esbuild/win32-arm64@0.23.1':\n    optional: true\n\n  '@esbuild/win32-ia32@0.17.19':\n    optional: true\n\n  '@esbuild/win32-ia32@0.18.20':\n    optional: true\n\n  '@esbuild/win32-ia32@0.19.12':\n    optional: true\n\n  '@esbuild/win32-ia32@0.20.2':\n    optional: true\n\n  '@esbuild/win32-ia32@0.21.5':\n    optional: true\n\n  '@esbuild/win32-ia32@0.23.1':\n    optional: true\n\n  '@esbuild/win32-x64@0.17.19':\n    optional: true\n\n  '@esbuild/win32-x64@0.18.20':\n    optional: true\n\n  '@esbuild/win32-x64@0.19.12':\n    optional: true\n\n  '@esbuild/win32-x64@0.20.2':\n    optional: true\n\n  '@esbuild/win32-x64@0.21.5':\n    optional: true\n\n  '@esbuild/win32-x64@0.23.1':\n    optional: true\n\n  '@fastify/busboy@2.1.1': {}\n\n  '@floating-ui/core@1.5.2':\n    dependencies:\n      '@floating-ui/utils': 0.1.6\n\n  '@floating-ui/dom@1.6.3':\n    dependencies:\n      '@floating-ui/core': 1.5.2\n      '@floating-ui/utils': 0.2.1\n\n  '@floating-ui/utils@0.1.6': {}\n\n  '@floating-ui/utils@0.2.1': {}\n\n  '@floating-ui/vue@1.0.6(vue@3.5.12(typescript@5.6.3))':\n    dependencies:\n      '@floating-ui/dom': 1.6.3\n      '@floating-ui/utils': 0.2.1\n      vue-demi: 0.14.10(vue@3.5.12(typescript@5.6.3))\n    transitivePeerDependencies:\n      - '@vue/composition-api'\n      - vue\n\n  '@fontsource-variable/pixelify-sans@5.1.0': {}\n\n  '@fontsource/cutive-mono@5.1.0': {}\n\n  '@fontsource/fira-code@4.5.13': {}\n\n  '@fontsource/ibm-plex-mono@4.5.13': {}\n\n  '@fontsource/inter@4.5.10': {}\n\n  '@fontsource/jetbrains-mono@4.5.8': {}\n\n  '@fontsource/overpass-mono@5.1.0': {}\n\n  '@fontsource/share-tech-mono@5.1.0': {}\n\n  '@fontsource/source-code-pro@4.5.14': {}\n\n  '@fontsource/unifontex@5.1.0': {}\n\n  '@fontsource/vt323@5.1.0': {}\n\n  '@iconify-json/carbon@1.2.3':\n    dependencies:\n      '@iconify/types': 2.0.0\n\n  '@iconify-json/logos@1.2.3':\n    dependencies:\n      '@iconify/types': 2.0.0\n\n  '@iconify-json/ri@1.2.2':\n    dependencies:\n      '@iconify/types': 2.0.0\n\n  '@iconify-json/tabler@1.2.6':\n    dependencies:\n      '@iconify/types': 2.0.0\n\n  '@iconify/json@2.2.274':\n    dependencies:\n      '@iconify/types': 2.0.0\n      pathe: 1.1.2\n\n  '@iconify/types@2.0.0': {}\n\n  '@iconify/utils@2.1.33':\n    dependencies:\n      '@antfu/install-pkg': 0.4.1\n      '@antfu/utils': 0.7.10\n      '@iconify/types': 2.0.0\n      debug: 4.3.7\n      kolorist: 1.8.0\n      local-pkg: 0.5.0\n      mlly: 1.7.2\n    transitivePeerDependencies:\n      - supports-color\n\n  '@iconify/vue@4.1.1(vue@3.5.12(typescript@5.6.3))':\n    dependencies:\n      '@iconify/types': 2.0.0\n      vue: 3.5.12(typescript@5.6.3)\n\n  '@internationalized/date@3.5.2':\n    dependencies:\n      '@swc/helpers': 0.5.10\n\n  '@ioredis/commands@1.2.0': {}\n\n  '@isaacs/cliui@8.0.2':\n    dependencies:\n      string-width: 5.1.2\n      string-width-cjs: string-width@4.2.3\n      strip-ansi: 7.1.0\n      strip-ansi-cjs: strip-ansi@6.0.1\n      wrap-ansi: 8.1.0\n      wrap-ansi-cjs: wrap-ansi@7.0.0\n\n  '@jridgewell/gen-mapping@0.3.3':\n    dependencies:\n      '@jridgewell/set-array': 1.1.2\n      '@jridgewell/sourcemap-codec': 1.4.15\n      '@jridgewell/trace-mapping': 0.3.20\n\n  '@jridgewell/gen-mapping@0.3.5':\n    dependencies:\n      '@jridgewell/set-array': 1.2.1\n      '@jridgewell/sourcemap-codec': 1.5.0\n      '@jridgewell/trace-mapping': 0.3.25\n\n  '@jridgewell/resolve-uri@3.1.1': {}\n\n  '@jridgewell/set-array@1.1.2': {}\n\n  '@jridgewell/set-array@1.2.1': {}\n\n  '@jridgewell/source-map@0.3.5':\n    dependencies:\n      '@jridgewell/gen-mapping': 0.3.3\n      '@jridgewell/trace-mapping': 0.3.20\n\n  '@jridgewell/sourcemap-codec@1.4.15': {}\n\n  '@jridgewell/sourcemap-codec@1.5.0': {}\n\n  '@jridgewell/trace-mapping@0.3.20':\n    dependencies:\n      '@jridgewell/resolve-uri': 3.1.1\n      '@jridgewell/sourcemap-codec': 1.4.15\n\n  '@jridgewell/trace-mapping@0.3.25':\n    dependencies:\n      '@jridgewell/resolve-uri': 3.1.1\n      '@jridgewell/sourcemap-codec': 1.5.0\n\n  '@jridgewell/trace-mapping@0.3.9':\n    dependencies:\n      '@jridgewell/resolve-uri': 3.1.1\n      '@jridgewell/sourcemap-codec': 1.5.0\n\n  '@koa/router@12.0.2':\n    dependencies:\n      debug: 4.3.7\n      http-errors: 2.0.0\n      koa-compose: 4.1.0\n      methods: 1.1.2\n      path-to-regexp: 6.3.0\n    transitivePeerDependencies:\n      - supports-color\n\n  '@kwsites/file-exists@1.1.1':\n    dependencies:\n      debug: 4.3.7\n    transitivePeerDependencies:\n      - supports-color\n\n  '@kwsites/promise-deferred@1.1.1': {}\n\n  '@mapbox/node-pre-gyp@1.0.11':\n    dependencies:\n      detect-libc: 2.0.3\n      https-proxy-agent: 5.0.1\n      make-dir: 3.1.0\n      node-fetch: 2.7.0\n      nopt: 5.0.0\n      npmlog: 5.0.1\n      rimraf: 3.0.2\n      semver: 7.6.3\n      tar: 6.2.1\n    transitivePeerDependencies:\n      - encoding\n      - supports-color\n\n  '@netlify/functions@2.8.2':\n    dependencies:\n      '@netlify/serverless-functions-api': 1.26.1\n\n  '@netlify/node-cookies@0.1.0': {}\n\n  '@netlify/serverless-functions-api@1.26.1':\n    dependencies:\n      '@netlify/node-cookies': 0.1.0\n      urlpattern-polyfill: 8.0.2\n\n  '@nodelib/fs.scandir@2.1.5':\n    dependencies:\n      '@nodelib/fs.stat': 2.0.5\n      run-parallel: 1.2.0\n\n  '@nodelib/fs.stat@2.0.5': {}\n\n  '@nodelib/fs.walk@1.2.8':\n    dependencies:\n      '@nodelib/fs.scandir': 2.1.5\n      fastq: 1.16.0\n\n  '@nuxt/devalue@2.0.2': {}\n\n  '@nuxt/devtools-kit@1.6.0(magicast@0.3.5)(rollup@4.24.0)(vite@5.4.8(@types/node@20.10.5)(terser@5.26.0))(webpack-sources@3.2.3)':\n    dependencies:\n      '@nuxt/kit': 3.13.2(magicast@0.3.5)(rollup@4.24.0)(webpack-sources@3.2.3)\n      '@nuxt/schema': 3.14.1592(magicast@0.3.5)(rollup@4.24.0)\n      execa: 7.2.0\n      vite: 5.4.8(@types/node@20.10.5)(terser@5.26.0)\n    transitivePeerDependencies:\n      - magicast\n      - rollup\n      - supports-color\n      - webpack-sources\n\n  '@nuxt/devtools-ui-kit@1.6.0(@nuxt/devtools@1.6.0(rollup@4.24.0)(vite@5.4.8(@types/node@20.10.5)(terser@5.26.0))(vue@3.5.12(typescript@5.6.3))(webpack-sources@3.2.3))(@unocss/webpack@0.62.4(rollup@4.24.0)(webpack@5.95.0(esbuild@0.23.1)))(@vue/compiler-core@3.5.12)(fuse.js@6.5.3)(magicast@0.3.5)(nuxt@3.13.2(@parcel/watcher@2.4.1)(@types/node@20.10.5)(drizzle-orm@0.36.4(@cloudflare/workers-types@4.20241127.0)(@types/pg@8.11.10)(pg@8.13.1)(postgres@3.4.5))(ioredis@5.4.1)(magicast@0.3.5)(rollup@4.24.0)(terser@5.26.0)(typescript@5.6.3)(vite@5.4.8(@types/node@20.10.5)(terser@5.26.0))(vue-tsc@2.1.6(typescript@5.6.3))(webpack-sources@3.2.3))(postcss@8.4.47)(rollup@4.24.0)(vite@5.4.8(@types/node@20.10.5)(terser@5.26.0))(vue@3.5.12(typescript@5.6.3))(webpack-sources@3.2.3)(webpack@5.95.0(esbuild@0.23.1))':\n    dependencies:\n      '@iconify-json/carbon': 1.2.3\n      '@iconify-json/logos': 1.2.3\n      '@iconify-json/ri': 1.2.2\n      '@iconify-json/tabler': 1.2.6\n      '@nuxt/devtools': 1.6.0(rollup@4.24.0)(vite@5.4.8(@types/node@20.10.5)(terser@5.26.0))(vue@3.5.12(typescript@5.6.3))(webpack-sources@3.2.3)\n      '@nuxt/devtools-kit': 1.6.0(magicast@0.3.5)(rollup@4.24.0)(vite@5.4.8(@types/node@20.10.5)(terser@5.26.0))(webpack-sources@3.2.3)\n      '@nuxt/kit': 3.13.2(magicast@0.3.5)(rollup@4.24.0)(webpack-sources@3.2.3)\n      '@unocss/core': 0.62.4\n      '@unocss/nuxt': 0.62.4(magicast@0.3.5)(postcss@8.4.47)(rollup@4.24.0)(vite@5.4.8(@types/node@20.10.5)(terser@5.26.0))(webpack-sources@3.2.3)(webpack@5.95.0(esbuild@0.23.1))\n      '@unocss/preset-attributify': 0.62.4\n      '@unocss/preset-icons': 0.62.4\n      '@unocss/preset-mini': 0.62.4\n      '@unocss/reset': 0.62.4\n      '@vueuse/core': 11.1.0(vue@3.5.12(typescript@5.6.3))\n      '@vueuse/integrations': 11.1.0(focus-trap@7.6.0)(fuse.js@6.5.3)(vue@3.5.12(typescript@5.6.3))\n      '@vueuse/nuxt': 11.1.0(magicast@0.3.5)(nuxt@3.13.2(@parcel/watcher@2.4.1)(@types/node@20.10.5)(drizzle-orm@0.36.4(@cloudflare/workers-types@4.20241127.0)(@types/pg@8.11.10)(pg@8.13.1)(postgres@3.4.5))(ioredis@5.4.1)(magicast@0.3.5)(rollup@4.24.0)(terser@5.26.0)(typescript@5.6.3)(vite@5.4.8(@types/node@20.10.5)(terser@5.26.0))(vue-tsc@2.1.6(typescript@5.6.3))(webpack-sources@3.2.3))(rollup@4.24.0)(vue@3.5.12(typescript@5.6.3))(webpack-sources@3.2.3)\n      defu: 6.1.4\n      focus-trap: 7.6.0\n      splitpanes: 3.1.5\n      unocss: 0.62.4(@unocss/webpack@0.62.4(rollup@4.24.0)(webpack@5.95.0(esbuild@0.23.1)))(postcss@8.4.47)(rollup@4.24.0)(vite@5.4.8(@types/node@20.10.5)(terser@5.26.0))\n      v-lazy-show: 0.2.4(@vue/compiler-core@3.5.12)\n    transitivePeerDependencies:\n      - '@unocss/webpack'\n      - '@vue/compiler-core'\n      - '@vue/composition-api'\n      - async-validator\n      - axios\n      - change-case\n      - drauu\n      - fuse.js\n      - idb-keyval\n      - jwt-decode\n      - magicast\n      - nprogress\n      - nuxt\n      - postcss\n      - qrcode\n      - rollup\n      - sortablejs\n      - supports-color\n      - universal-cookie\n      - vite\n      - vue\n      - webpack\n      - webpack-sources\n\n  '@nuxt/devtools-wizard@1.6.0':\n    dependencies:\n      consola: 3.2.3\n      diff: 7.0.0\n      execa: 7.2.0\n      global-directory: 4.0.1\n      magicast: 0.3.5\n      pathe: 1.1.2\n      pkg-types: 1.2.1\n      prompts: 2.4.2\n      rc9: 2.1.2\n      semver: 7.6.3\n\n  '@nuxt/devtools@1.6.0(rollup@4.24.0)(vite@5.4.8(@types/node@20.10.5)(terser@5.26.0))(vue@3.5.12(typescript@5.6.3))(webpack-sources@3.2.3)':\n    dependencies:\n      '@antfu/utils': 0.7.10\n      '@nuxt/devtools-kit': 1.6.0(magicast@0.3.5)(rollup@4.24.0)(vite@5.4.8(@types/node@20.10.5)(terser@5.26.0))(webpack-sources@3.2.3)\n      '@nuxt/devtools-wizard': 1.6.0\n      '@nuxt/kit': 3.13.2(magicast@0.3.5)(rollup@4.24.0)(webpack-sources@3.2.3)\n      '@vue/devtools-core': 7.4.4(vite@5.4.8(@types/node@20.10.5)(terser@5.26.0))(vue@3.5.12(typescript@5.6.3))\n      '@vue/devtools-kit': 7.4.4\n      birpc: 0.2.19\n      consola: 3.2.3\n      cronstrue: 2.50.0\n      destr: 2.0.3\n      error-stack-parser-es: 0.1.5\n      execa: 7.2.0\n      fast-npm-meta: 0.2.2\n      flatted: 3.3.1\n      get-port-please: 3.1.2\n      hookable: 5.5.3\n      image-meta: 0.2.1\n      is-installed-globally: 1.0.0\n      launch-editor: 2.9.1\n      local-pkg: 0.5.0\n      magicast: 0.3.5\n      nypm: 0.3.12\n      ohash: 1.1.4\n      pathe: 1.1.2\n      perfect-debounce: 1.0.0\n      pkg-types: 1.2.1\n      rc9: 2.1.2\n      scule: 1.3.0\n      semver: 7.6.3\n      simple-git: 3.27.0\n      sirv: 2.0.4\n      tinyglobby: 0.2.9\n      unimport: 3.13.1(rollup@4.24.0)(webpack-sources@3.2.3)\n      vite: 5.4.8(@types/node@20.10.5)(terser@5.26.0)\n      vite-plugin-inspect: 0.8.7(@nuxt/kit@3.13.2(magicast@0.3.5)(rollup@4.24.0)(webpack-sources@3.2.3))(rollup@4.24.0)(vite@5.4.8(@types/node@20.10.5)(terser@5.26.0))\n      vite-plugin-vue-inspector: 5.1.3(vite@5.4.8(@types/node@20.10.5)(terser@5.26.0))\n      which: 3.0.1\n      ws: 8.18.0\n    transitivePeerDependencies:\n      - bufferutil\n      - rollup\n      - supports-color\n      - utf-8-validate\n      - vue\n      - webpack-sources\n\n  '@nuxt/kit@3.13.2(magicast@0.3.5)(rollup@4.24.0)(webpack-sources@3.2.3)':\n    dependencies:\n      '@nuxt/schema': 3.13.2(rollup@4.24.0)(webpack-sources@3.2.3)\n      c12: 1.11.2(magicast@0.3.5)\n      consola: 3.2.3\n      defu: 6.1.4\n      destr: 2.0.3\n      globby: 14.0.2\n      hash-sum: 2.0.0\n      ignore: 5.3.2\n      jiti: 1.21.6\n      klona: 2.0.6\n      knitwork: 1.1.0\n      mlly: 1.7.2\n      pathe: 1.1.2\n      pkg-types: 1.2.1\n      scule: 1.3.0\n      semver: 7.6.3\n      ufo: 1.5.4\n      unctx: 2.3.1(webpack-sources@3.2.3)\n      unimport: 3.13.1(rollup@4.24.0)(webpack-sources@3.2.3)\n      untyped: 1.5.1\n    transitivePeerDependencies:\n      - magicast\n      - rollup\n      - supports-color\n      - webpack-sources\n\n  '@nuxt/kit@3.14.1592(magicast@0.3.5)(rollup@4.24.0)(webpack-sources@3.2.3)':\n    dependencies:\n      '@nuxt/schema': 3.14.1592(magicast@0.3.5)(rollup@4.24.0)\n      c12: 2.0.1(magicast@0.3.5)\n      consola: 3.2.3\n      defu: 6.1.4\n      destr: 2.0.3\n      globby: 14.0.2\n      hash-sum: 2.0.0\n      ignore: 6.0.2\n      jiti: 2.4.1\n      klona: 2.0.6\n      knitwork: 1.1.0\n      mlly: 1.7.3\n      pathe: 1.1.2\n      pkg-types: 1.2.1\n      scule: 1.3.0\n      semver: 7.6.3\n      ufo: 1.5.4\n      unctx: 2.3.1(webpack-sources@3.2.3)\n      unimport: 3.14.2(rollup@4.24.0)\n      untyped: 1.5.1\n    transitivePeerDependencies:\n      - magicast\n      - rollup\n      - supports-color\n      - webpack-sources\n\n  '@nuxt/schema@3.13.2(rollup@4.24.0)(webpack-sources@3.2.3)':\n    dependencies:\n      compatx: 0.1.8\n      consola: 3.2.3\n      defu: 6.1.4\n      hookable: 5.5.3\n      pathe: 1.1.2\n      pkg-types: 1.2.1\n      scule: 1.3.0\n      std-env: 3.7.0\n      ufo: 1.5.4\n      uncrypto: 0.1.3\n      unimport: 3.13.1(rollup@4.24.0)(webpack-sources@3.2.3)\n      untyped: 1.5.1\n    transitivePeerDependencies:\n      - rollup\n      - supports-color\n      - webpack-sources\n\n  '@nuxt/schema@3.14.1592(magicast@0.3.5)(rollup@4.24.0)':\n    dependencies:\n      c12: 2.0.1(magicast@0.3.5)\n      compatx: 0.1.8\n      consola: 3.2.3\n      defu: 6.1.4\n      hookable: 5.5.3\n      pathe: 1.1.2\n      pkg-types: 1.2.1\n      scule: 1.3.0\n      std-env: 3.8.0\n      ufo: 1.5.4\n      uncrypto: 0.1.3\n      unimport: 3.14.2(rollup@4.24.0)\n      untyped: 1.5.1\n    transitivePeerDependencies:\n      - magicast\n      - rollup\n      - supports-color\n\n  '@nuxt/scripts@0.9.5(@nuxt/devtools@1.6.0(rollup@4.24.0)(vite@5.4.8(@types/node@20.10.5)(terser@5.26.0))(vue@3.5.12(typescript@5.6.3))(webpack-sources@3.2.3))(@unocss/webpack@0.62.4(rollup@4.24.0)(webpack@5.95.0(esbuild@0.23.1)))(@vue/compiler-core@3.5.12)(fuse.js@6.5.3)(ioredis@5.4.1)(magicast@0.3.5)(nuxt@3.13.2(@parcel/watcher@2.4.1)(@types/node@20.10.5)(drizzle-orm@0.36.4(@cloudflare/workers-types@4.20241127.0)(@types/pg@8.11.10)(pg@8.13.1)(postgres@3.4.5))(ioredis@5.4.1)(magicast@0.3.5)(rollup@4.24.0)(terser@5.26.0)(typescript@5.6.3)(vite@5.4.8(@types/node@20.10.5)(terser@5.26.0))(vue-tsc@2.1.6(typescript@5.6.3))(webpack-sources@3.2.3))(postcss@8.4.47)(rollup@4.24.0)(typescript@5.6.3)(vite@5.4.8(@types/node@20.10.5)(terser@5.26.0))(vue@3.5.12(typescript@5.6.3))(webpack-sources@3.2.3)(webpack@5.95.0(esbuild@0.23.1))':\n    dependencies:\n      '@nuxt/devtools-kit': 1.6.0(magicast@0.3.5)(rollup@4.24.0)(vite@5.4.8(@types/node@20.10.5)(terser@5.26.0))(webpack-sources@3.2.3)\n      '@nuxt/devtools-ui-kit': 1.6.0(@nuxt/devtools@1.6.0(rollup@4.24.0)(vite@5.4.8(@types/node@20.10.5)(terser@5.26.0))(vue@3.5.12(typescript@5.6.3))(webpack-sources@3.2.3))(@unocss/webpack@0.62.4(rollup@4.24.0)(webpack@5.95.0(esbuild@0.23.1)))(@vue/compiler-core@3.5.12)(fuse.js@6.5.3)(magicast@0.3.5)(nuxt@3.13.2(@parcel/watcher@2.4.1)(@types/node@20.10.5)(drizzle-orm@0.36.4(@cloudflare/workers-types@4.20241127.0)(@types/pg@8.11.10)(pg@8.13.1)(postgres@3.4.5))(ioredis@5.4.1)(magicast@0.3.5)(rollup@4.24.0)(terser@5.26.0)(typescript@5.6.3)(vite@5.4.8(@types/node@20.10.5)(terser@5.26.0))(vue-tsc@2.1.6(typescript@5.6.3))(webpack-sources@3.2.3))(postcss@8.4.47)(rollup@4.24.0)(vite@5.4.8(@types/node@20.10.5)(terser@5.26.0))(vue@3.5.12(typescript@5.6.3))(webpack-sources@3.2.3)(webpack@5.95.0(esbuild@0.23.1))\n      '@nuxt/kit': 3.13.2(magicast@0.3.5)(rollup@4.24.0)(webpack-sources@3.2.3)\n      '@stripe/stripe-js': 4.9.0\n      '@types/google.maps': 3.58.1\n      '@types/vimeo__player': 2.18.3\n      '@types/youtube': 0.1.0\n      '@unhead/vue': 1.11.9(vue@3.5.12(typescript@5.6.3))\n      '@vueuse/core': 11.1.0(vue@3.5.12(typescript@5.6.3))\n      consola: 3.2.3\n      defu: 6.1.4\n      h3: 1.13.0\n      magic-string: 0.30.12\n      mlly: 1.7.2\n      ofetch: 1.4.1\n      ohash: 1.1.4\n      pathe: 1.1.2\n      pkg-types: 1.2.1\n      semver: 7.6.3\n      shiki: 1.22.0\n      sirv: 3.0.0\n      std-env: 3.7.0\n      third-party-capital: 2.3.0\n      ufo: 1.5.4\n      unimport: 3.13.1(rollup@4.24.0)(webpack-sources@3.2.3)\n      unplugin: 1.14.1(webpack-sources@3.2.3)\n      unstorage: 1.13.1(ioredis@5.4.1)\n      valibot: 0.42.1(typescript@5.6.3)\n    transitivePeerDependencies:\n      - '@azure/app-configuration'\n      - '@azure/cosmos'\n      - '@azure/data-tables'\n      - '@azure/identity'\n      - '@azure/keyvault-secrets'\n      - '@azure/storage-blob'\n      - '@capacitor/preferences'\n      - '@netlify/blobs'\n      - '@nuxt/devtools'\n      - '@planetscale/database'\n      - '@unocss/webpack'\n      - '@upstash/redis'\n      - '@vercel/kv'\n      - '@vue/compiler-core'\n      - '@vue/composition-api'\n      - async-validator\n      - axios\n      - change-case\n      - drauu\n      - fuse.js\n      - idb-keyval\n      - ioredis\n      - jwt-decode\n      - magicast\n      - nprogress\n      - nuxt\n      - postcss\n      - qrcode\n      - rollup\n      - sortablejs\n      - supports-color\n      - typescript\n      - universal-cookie\n      - vite\n      - vue\n      - webpack\n      - webpack-sources\n\n  '@nuxt/telemetry@2.6.0(magicast@0.3.5)(rollup@4.24.0)(webpack-sources@3.2.3)':\n    dependencies:\n      '@nuxt/kit': 3.13.2(magicast@0.3.5)(rollup@4.24.0)(webpack-sources@3.2.3)\n      ci-info: 4.0.0\n      consola: 3.2.3\n      create-require: 1.1.1\n      defu: 6.1.4\n      destr: 2.0.3\n      dotenv: 16.4.5\n      git-url-parse: 15.0.0\n      is-docker: 3.0.0\n      jiti: 1.21.6\n      mri: 1.2.0\n      nanoid: 5.0.9\n      ofetch: 1.4.1\n      package-manager-detector: 0.2.2\n      parse-git-config: 3.0.0\n      pathe: 1.1.2\n      rc9: 2.1.2\n      std-env: 3.7.0\n    transitivePeerDependencies:\n      - magicast\n      - rollup\n      - supports-color\n      - webpack-sources\n\n  '@nuxt/vite-builder@3.13.2(@types/node@20.10.5)(magicast@0.3.5)(rollup@4.24.0)(terser@5.26.0)(typescript@5.6.3)(vue-tsc@2.1.6(typescript@5.6.3))(vue@3.5.12(typescript@5.6.3))(webpack-sources@3.2.3)':\n    dependencies:\n      '@nuxt/kit': 3.13.2(magicast@0.3.5)(rollup@4.24.0)(webpack-sources@3.2.3)\n      '@rollup/plugin-replace': 5.0.7(rollup@4.24.0)\n      '@vitejs/plugin-vue': 5.1.4(vite@5.4.8(@types/node@20.10.5)(terser@5.26.0))(vue@3.5.12(typescript@5.6.3))\n      '@vitejs/plugin-vue-jsx': 4.0.1(vite@5.4.8(@types/node@20.10.5)(terser@5.26.0))(vue@3.5.12(typescript@5.6.3))\n      autoprefixer: 10.4.20(postcss@8.4.47)\n      clear: 0.1.0\n      consola: 3.2.3\n      cssnano: 7.0.6(postcss@8.4.47)\n      defu: 6.1.4\n      esbuild: 0.23.1\n      escape-string-regexp: 5.0.0\n      estree-walker: 3.0.3\n      externality: 1.0.2\n      get-port-please: 3.1.2\n      h3: 1.13.0\n      knitwork: 1.1.0\n      magic-string: 0.30.12\n      mlly: 1.7.2\n      ohash: 1.1.4\n      pathe: 1.1.2\n      perfect-debounce: 1.0.0\n      pkg-types: 1.2.1\n      postcss: 8.4.47\n      rollup-plugin-visualizer: 5.12.0(rollup@4.24.0)\n      std-env: 3.7.0\n      strip-literal: 2.1.0\n      ufo: 1.5.4\n      unenv: 1.10.0\n      unplugin: 1.14.1(webpack-sources@3.2.3)\n      vite: 5.4.8(@types/node@20.10.5)(terser@5.26.0)\n      vite-node: 2.1.3(@types/node@20.10.5)(terser@5.26.0)\n      vite-plugin-checker: 0.8.0(typescript@5.6.3)(vite@5.4.8(@types/node@20.10.5)(terser@5.26.0))(vue-tsc@2.1.6(typescript@5.6.3))\n      vue: 3.5.12(typescript@5.6.3)\n      vue-bundle-renderer: 2.1.1\n    transitivePeerDependencies:\n      - '@biomejs/biome'\n      - '@types/node'\n      - eslint\n      - less\n      - lightningcss\n      - magicast\n      - meow\n      - optionator\n      - rollup\n      - sass\n      - sass-embedded\n      - stylelint\n      - stylus\n      - sugarss\n      - supports-color\n      - terser\n      - typescript\n      - vls\n      - vti\n      - vue-tsc\n      - webpack-sources\n\n  '@nuxthub/core@0.8.7(ioredis@5.4.1)(magicast@0.3.5)(rollup@4.24.0)(vite@5.4.8(@types/node@20.10.5)(terser@5.26.0))(webpack-sources@3.2.3)':\n    dependencies:\n      '@cloudflare/workers-types': 4.20241127.0\n      '@nuxt/devtools-kit': 1.6.0(magicast@0.3.5)(rollup@4.24.0)(vite@5.4.8(@types/node@20.10.5)(terser@5.26.0))(webpack-sources@3.2.3)\n      '@nuxt/kit': 3.14.1592(magicast@0.3.5)(rollup@4.24.0)(webpack-sources@3.2.3)\n      '@uploadthing/mime-types': 0.3.2\n      citty: 0.1.6\n      confbox: 0.1.8\n      defu: 6.1.4\n      destr: 2.0.3\n      h3: 1.13.0\n      mime: 4.0.4\n      nitro-cloudflare-dev: 0.2.1\n      ofetch: 1.4.1\n      pathe: 1.1.2\n      pkg-types: 1.2.1\n      std-env: 3.8.0\n      ufo: 1.5.4\n      uncrypto: 0.1.3\n      unstorage: 1.13.1(ioredis@5.4.1)\n      zod: 3.23.8\n    transitivePeerDependencies:\n      - '@azure/app-configuration'\n      - '@azure/cosmos'\n      - '@azure/data-tables'\n      - '@azure/identity'\n      - '@azure/keyvault-secrets'\n      - '@azure/storage-blob'\n      - '@capacitor/preferences'\n      - '@netlify/blobs'\n      - '@planetscale/database'\n      - '@upstash/redis'\n      - '@vercel/kv'\n      - idb-keyval\n      - ioredis\n      - magicast\n      - rollup\n      - supports-color\n      - vite\n      - webpack-sources\n\n  '@nuxtjs/tailwindcss@6.12.2(magicast@0.3.5)(rollup@4.24.0)(webpack-sources@3.2.3)':\n    dependencies:\n      '@nuxt/kit': 3.13.2(magicast@0.3.5)(rollup@4.24.0)(webpack-sources@3.2.3)\n      autoprefixer: 10.4.20(postcss@8.4.47)\n      consola: 3.2.3\n      defu: 6.1.4\n      h3: 1.13.0\n      klona: 2.0.6\n      pathe: 1.1.2\n      postcss: 8.4.47\n      postcss-nesting: 13.0.0(postcss@8.4.47)\n      tailwind-config-viewer: 2.0.4(tailwindcss@3.4.13)\n      tailwindcss: 3.4.13\n      ufo: 1.5.4\n      unctx: 2.3.1(webpack-sources@3.2.3)\n    transitivePeerDependencies:\n      - magicast\n      - rollup\n      - supports-color\n      - ts-node\n      - webpack-sources\n\n  '@parcel/watcher-android-arm64@2.4.1':\n    optional: true\n\n  '@parcel/watcher-darwin-arm64@2.4.1':\n    optional: true\n\n  '@parcel/watcher-darwin-x64@2.4.1':\n    optional: true\n\n  '@parcel/watcher-freebsd-x64@2.4.1':\n    optional: true\n\n  '@parcel/watcher-linux-arm-glibc@2.4.1':\n    optional: true\n\n  '@parcel/watcher-linux-arm64-glibc@2.4.1':\n    optional: true\n\n  '@parcel/watcher-linux-arm64-musl@2.4.1':\n    optional: true\n\n  '@parcel/watcher-linux-x64-glibc@2.4.1':\n    optional: true\n\n  '@parcel/watcher-linux-x64-musl@2.4.1':\n    optional: true\n\n  '@parcel/watcher-wasm@2.4.1':\n    dependencies:\n      is-glob: 4.0.3\n      micromatch: 4.0.5\n\n  '@parcel/watcher-win32-arm64@2.4.1':\n    optional: true\n\n  '@parcel/watcher-win32-ia32@2.4.1':\n    optional: true\n\n  '@parcel/watcher-win32-x64@2.4.1':\n    optional: true\n\n  '@parcel/watcher@2.4.1':\n    dependencies:\n      detect-libc: 1.0.3\n      is-glob: 4.0.3\n      micromatch: 4.0.5\n      node-addon-api: 7.1.1\n    optionalDependencies:\n      '@parcel/watcher-android-arm64': 2.4.1\n      '@parcel/watcher-darwin-arm64': 2.4.1\n      '@parcel/watcher-darwin-x64': 2.4.1\n      '@parcel/watcher-freebsd-x64': 2.4.1\n      '@parcel/watcher-linux-arm-glibc': 2.4.1\n      '@parcel/watcher-linux-arm64-glibc': 2.4.1\n      '@parcel/watcher-linux-arm64-musl': 2.4.1\n      '@parcel/watcher-linux-x64-glibc': 2.4.1\n      '@parcel/watcher-linux-x64-musl': 2.4.1\n      '@parcel/watcher-win32-arm64': 2.4.1\n      '@parcel/watcher-win32-ia32': 2.4.1\n      '@parcel/watcher-win32-x64': 2.4.1\n\n  '@pinia/nuxt@0.5.5(magicast@0.3.5)(rollup@4.24.0)(typescript@5.6.3)(vue@3.5.12(typescript@5.6.3))(webpack-sources@3.2.3)':\n    dependencies:\n      '@nuxt/kit': 3.13.2(magicast@0.3.5)(rollup@4.24.0)(webpack-sources@3.2.3)\n      pinia: 2.2.4(typescript@5.6.3)(vue@3.5.12(typescript@5.6.3))\n    transitivePeerDependencies:\n      - '@vue/composition-api'\n      - magicast\n      - rollup\n      - supports-color\n      - typescript\n      - vue\n      - webpack-sources\n\n  '@pkgjs/parseargs@0.11.0':\n    optional: true\n\n  '@polka/url@1.0.0-next.28': {}\n\n  '@rollup/plugin-alias@5.1.1(rollup@4.24.0)':\n    optionalDependencies:\n      rollup: 4.24.0\n\n  '@rollup/plugin-babel@5.3.1(@babel/core@7.25.9)(rollup@2.79.1)':\n    dependencies:\n      '@babel/core': 7.25.9\n      '@babel/helper-module-imports': 7.25.9\n      '@rollup/pluginutils': 3.1.0(rollup@2.79.1)\n      rollup: 2.79.1\n    transitivePeerDependencies:\n      - supports-color\n\n  '@rollup/plugin-commonjs@25.0.8(rollup@4.24.0)':\n    dependencies:\n      '@rollup/pluginutils': 5.1.0(rollup@4.24.0)\n      commondir: 1.0.1\n      estree-walker: 2.0.2\n      glob: 8.1.0\n      is-reference: 1.2.1\n      magic-string: 0.30.12\n    optionalDependencies:\n      rollup: 4.24.0\n\n  '@rollup/plugin-inject@5.0.5(rollup@4.24.0)':\n    dependencies:\n      '@rollup/pluginutils': 5.1.0(rollup@4.24.0)\n      estree-walker: 2.0.2\n      magic-string: 0.30.12\n    optionalDependencies:\n      rollup: 4.24.0\n\n  '@rollup/plugin-json@6.1.0(rollup@4.24.0)':\n    dependencies:\n      '@rollup/pluginutils': 5.1.0(rollup@4.24.0)\n    optionalDependencies:\n      rollup: 4.24.0\n\n  '@rollup/plugin-node-resolve@11.2.1(rollup@2.79.1)':\n    dependencies:\n      '@rollup/pluginutils': 3.1.0(rollup@2.79.1)\n      '@types/resolve': 1.17.1\n      builtin-modules: 3.3.0\n      deepmerge: 4.3.1\n      is-module: 1.0.0\n      resolve: 1.22.8\n      rollup: 2.79.1\n\n  '@rollup/plugin-node-resolve@15.3.0(rollup@4.24.0)':\n    dependencies:\n      '@rollup/pluginutils': 5.1.0(rollup@4.24.0)\n      '@types/resolve': 1.20.2\n      deepmerge: 4.3.1\n      is-module: 1.0.0\n      resolve: 1.22.8\n    optionalDependencies:\n      rollup: 4.24.0\n\n  '@rollup/plugin-replace@2.4.2(rollup@2.79.1)':\n    dependencies:\n      '@rollup/pluginutils': 3.1.0(rollup@2.79.1)\n      magic-string: 0.25.9\n      rollup: 2.79.1\n\n  '@rollup/plugin-replace@5.0.7(rollup@4.24.0)':\n    dependencies:\n      '@rollup/pluginutils': 5.1.0(rollup@4.24.0)\n      magic-string: 0.30.12\n    optionalDependencies:\n      rollup: 4.24.0\n\n  '@rollup/plugin-terser@0.4.4(rollup@4.24.0)':\n    dependencies:\n      serialize-javascript: 6.0.2\n      smob: 1.5.0\n      terser: 5.26.0\n    optionalDependencies:\n      rollup: 4.24.0\n\n  '@rollup/pluginutils@3.1.0(rollup@2.79.1)':\n    dependencies:\n      '@types/estree': 0.0.39\n      estree-walker: 1.0.1\n      picomatch: 2.3.1\n      rollup: 2.79.1\n\n  '@rollup/pluginutils@4.2.1':\n    dependencies:\n      estree-walker: 2.0.2\n      picomatch: 2.3.1\n\n  '@rollup/pluginutils@5.1.0(rollup@4.24.0)':\n    dependencies:\n      '@types/estree': 1.0.5\n      estree-walker: 2.0.2\n      picomatch: 2.3.1\n    optionalDependencies:\n      rollup: 4.24.0\n\n  '@rollup/pluginutils@5.1.2(rollup@4.24.0)':\n    dependencies:\n      '@types/estree': 1.0.6\n      estree-walker: 2.0.2\n      picomatch: 2.3.1\n    optionalDependencies:\n      rollup: 4.24.0\n\n  '@rollup/pluginutils@5.1.3(rollup@4.24.0)':\n    dependencies:\n      '@types/estree': 1.0.6\n      estree-walker: 2.0.2\n      picomatch: 4.0.2\n    optionalDependencies:\n      rollup: 4.24.0\n\n  '@rollup/rollup-android-arm-eabi@4.24.0':\n    optional: true\n\n  '@rollup/rollup-android-arm64@4.24.0':\n    optional: true\n\n  '@rollup/rollup-darwin-arm64@4.24.0':\n    optional: true\n\n  '@rollup/rollup-darwin-x64@4.24.0':\n    optional: true\n\n  '@rollup/rollup-linux-arm-gnueabihf@4.24.0':\n    optional: true\n\n  '@rollup/rollup-linux-arm-musleabihf@4.24.0':\n    optional: true\n\n  '@rollup/rollup-linux-arm64-gnu@4.24.0':\n    optional: true\n\n  '@rollup/rollup-linux-arm64-musl@4.24.0':\n    optional: true\n\n  '@rollup/rollup-linux-powerpc64le-gnu@4.24.0':\n    optional: true\n\n  '@rollup/rollup-linux-riscv64-gnu@4.24.0':\n    optional: true\n\n  '@rollup/rollup-linux-s390x-gnu@4.24.0':\n    optional: true\n\n  '@rollup/rollup-linux-x64-gnu@4.24.0':\n    optional: true\n\n  '@rollup/rollup-linux-x64-musl@4.24.0':\n    optional: true\n\n  '@rollup/rollup-win32-arm64-msvc@4.24.0':\n    optional: true\n\n  '@rollup/rollup-win32-ia32-msvc@4.24.0':\n    optional: true\n\n  '@rollup/rollup-win32-x64-msvc@4.24.0':\n    optional: true\n\n  '@shikijs/core@1.22.0':\n    dependencies:\n      '@shikijs/engine-javascript': 1.22.0\n      '@shikijs/engine-oniguruma': 1.22.0\n      '@shikijs/types': 1.22.0\n      '@shikijs/vscode-textmate': 9.3.0\n      '@types/hast': 3.0.4\n      hast-util-to-html: 9.0.3\n\n  '@shikijs/core@1.24.0':\n    dependencies:\n      '@shikijs/engine-javascript': 1.24.0\n      '@shikijs/engine-oniguruma': 1.24.0\n      '@shikijs/types': 1.24.0\n      '@shikijs/vscode-textmate': 9.3.0\n      '@types/hast': 3.0.4\n      hast-util-to-html: 9.0.3\n\n  '@shikijs/engine-javascript@1.22.0':\n    dependencies:\n      '@shikijs/types': 1.22.0\n      '@shikijs/vscode-textmate': 9.3.0\n      oniguruma-to-js: 0.4.3\n\n  '@shikijs/engine-javascript@1.24.0':\n    dependencies:\n      '@shikijs/types': 1.24.0\n      '@shikijs/vscode-textmate': 9.3.0\n      oniguruma-to-es: 0.7.0\n\n  '@shikijs/engine-oniguruma@1.22.0':\n    dependencies:\n      '@shikijs/types': 1.22.0\n      '@shikijs/vscode-textmate': 9.3.0\n\n  '@shikijs/engine-oniguruma@1.24.0':\n    dependencies:\n      '@shikijs/types': 1.24.0\n      '@shikijs/vscode-textmate': 9.3.0\n\n  '@shikijs/markdown-it@1.24.0':\n    dependencies:\n      markdown-it: 14.1.0\n      shiki: 1.24.0\n\n  '@shikijs/transformers@1.24.0':\n    dependencies:\n      shiki: 1.24.0\n\n  '@shikijs/types@1.22.0':\n    dependencies:\n      '@shikijs/vscode-textmate': 9.3.0\n      '@types/hast': 3.0.4\n\n  '@shikijs/types@1.24.0':\n    dependencies:\n      '@shikijs/vscode-textmate': 9.3.0\n      '@types/hast': 3.0.4\n\n  '@shikijs/vscode-textmate@9.3.0': {}\n\n  '@sindresorhus/merge-streams@2.3.0': {}\n\n  '@stripe/stripe-js@4.9.0': {}\n\n  '@surma/rollup-plugin-off-main-thread@2.2.3':\n    dependencies:\n      ejs: 3.1.9\n      json5: 2.2.3\n      magic-string: 0.25.9\n      string.prototype.matchall: 4.0.10\n\n  '@swc/helpers@0.5.10':\n    dependencies:\n      tslib: 2.6.2\n\n  '@tailwindcss/typography@0.5.15(tailwindcss@3.4.13)':\n    dependencies:\n      lodash.castarray: 4.4.0\n      lodash.isplainobject: 4.0.6\n      lodash.merge: 4.6.2\n      postcss-selector-parser: 6.0.10\n      tailwindcss: 3.4.13\n\n  '@tanstack/virtual-core@3.3.0': {}\n\n  '@tanstack/vue-virtual@3.3.0(vue@3.5.12(typescript@5.6.3))':\n    dependencies:\n      '@tanstack/virtual-core': 3.3.0\n      vue: 3.5.12(typescript@5.6.3)\n\n  '@trysound/sax@0.2.0': {}\n\n  '@types/dom-webcodecs@0.1.11': {}\n\n  '@types/estree@0.0.39': {}\n\n  '@types/estree@1.0.5': {}\n\n  '@types/estree@1.0.6': {}\n\n  '@types/google.maps@3.58.1': {}\n\n  '@types/hast@3.0.4':\n    dependencies:\n      '@types/unist': 3.0.3\n\n  '@types/http-proxy@1.17.15':\n    dependencies:\n      '@types/node': 20.10.5\n\n  '@types/json-schema@7.0.15': {}\n\n  '@types/linkify-it@5.0.0': {}\n\n  '@types/markdown-it@14.1.2':\n    dependencies:\n      '@types/linkify-it': 5.0.0\n      '@types/mdurl': 2.0.0\n\n  '@types/mdast@4.0.4':\n    dependencies:\n      '@types/unist': 3.0.3\n\n  '@types/mdurl@2.0.0': {}\n\n  '@types/node-forge@1.3.11':\n    dependencies:\n      '@types/node': 20.10.5\n\n  '@types/node@20.10.5':\n    dependencies:\n      undici-types: 5.26.5\n\n  '@types/pg@8.11.10':\n    dependencies:\n      '@types/node': 20.10.5\n      pg-protocol: 1.7.0\n      pg-types: 4.0.2\n    optional: true\n\n  '@types/pica@9.0.4': {}\n\n  '@types/resolve@1.17.1':\n    dependencies:\n      '@types/node': 20.10.5\n\n  '@types/resolve@1.20.2': {}\n\n  '@types/trusted-types@2.0.7': {}\n\n  '@types/unist@3.0.3': {}\n\n  '@types/uuid@10.0.0': {}\n\n  '@types/vimeo__player@2.18.3': {}\n\n  '@types/web-bluetooth@0.0.20': {}\n\n  '@types/wicg-file-system-access@2020.9.8': {}\n\n  '@types/youtube@0.1.0': {}\n\n  '@ungap/structured-clone@1.2.0': {}\n\n  '@unhead/dom@1.11.13':\n    dependencies:\n      '@unhead/schema': 1.11.13\n      '@unhead/shared': 1.11.13\n\n  '@unhead/dom@1.11.7':\n    dependencies:\n      '@unhead/schema': 1.11.7\n      '@unhead/shared': 1.11.7\n\n  '@unhead/dom@1.11.9':\n    dependencies:\n      '@unhead/schema': 1.11.9\n      '@unhead/shared': 1.11.9\n\n  '@unhead/schema@1.11.13':\n    dependencies:\n      hookable: 5.5.3\n      zhead: 2.2.4\n\n  '@unhead/schema@1.11.7':\n    dependencies:\n      hookable: 5.5.3\n      zhead: 2.2.4\n\n  '@unhead/schema@1.11.9':\n    dependencies:\n      hookable: 5.5.3\n      zhead: 2.2.4\n\n  '@unhead/shared@1.11.13':\n    dependencies:\n      '@unhead/schema': 1.11.13\n\n  '@unhead/shared@1.11.7':\n    dependencies:\n      '@unhead/schema': 1.11.7\n\n  '@unhead/shared@1.11.9':\n    dependencies:\n      '@unhead/schema': 1.11.9\n\n  '@unhead/ssr@1.11.7':\n    dependencies:\n      '@unhead/schema': 1.11.7\n      '@unhead/shared': 1.11.7\n\n  '@unhead/vue@1.11.13(vue@3.5.12(typescript@5.6.3))':\n    dependencies:\n      '@unhead/schema': 1.11.13\n      '@unhead/shared': 1.11.13\n      defu: 6.1.4\n      hookable: 5.5.3\n      unhead: 1.11.13\n      vue: 3.5.12(typescript@5.6.3)\n\n  '@unhead/vue@1.11.9(vue@3.5.12(typescript@5.6.3))':\n    dependencies:\n      '@unhead/schema': 1.11.9\n      '@unhead/shared': 1.11.9\n      defu: 6.1.4\n      hookable: 5.5.3\n      unhead: 1.11.9\n      vue: 3.5.12(typescript@5.6.3)\n\n  '@unocss/astro@0.62.4(rollup@4.24.0)(vite@5.4.8(@types/node@20.10.5)(terser@5.26.0))':\n    dependencies:\n      '@unocss/core': 0.62.4\n      '@unocss/reset': 0.62.4\n      '@unocss/vite': 0.62.4(rollup@4.24.0)(vite@5.4.8(@types/node@20.10.5)(terser@5.26.0))\n    optionalDependencies:\n      vite: 5.4.8(@types/node@20.10.5)(terser@5.26.0)\n    transitivePeerDependencies:\n      - rollup\n      - supports-color\n\n  '@unocss/cli@0.62.4(rollup@4.24.0)':\n    dependencies:\n      '@ampproject/remapping': 2.3.0\n      '@rollup/pluginutils': 5.1.2(rollup@4.24.0)\n      '@unocss/config': 0.62.4\n      '@unocss/core': 0.62.4\n      '@unocss/preset-uno': 0.62.4\n      cac: 6.7.14\n      chokidar: 3.6.0\n      colorette: 2.0.20\n      consola: 3.2.3\n      magic-string: 0.30.12\n      pathe: 1.1.2\n      perfect-debounce: 1.0.0\n      tinyglobby: 0.2.9\n    transitivePeerDependencies:\n      - rollup\n      - supports-color\n\n  '@unocss/config@0.62.4':\n    dependencies:\n      '@unocss/core': 0.62.4\n      unconfig: 0.5.5\n    transitivePeerDependencies:\n      - supports-color\n\n  '@unocss/core@0.62.4': {}\n\n  '@unocss/extractor-arbitrary-variants@0.62.4':\n    dependencies:\n      '@unocss/core': 0.62.4\n\n  '@unocss/inspector@0.62.4':\n    dependencies:\n      '@unocss/core': 0.62.4\n      '@unocss/rule-utils': 0.62.4\n      gzip-size: 6.0.0\n      sirv: 2.0.4\n\n  '@unocss/nuxt@0.62.4(magicast@0.3.5)(postcss@8.4.47)(rollup@4.24.0)(vite@5.4.8(@types/node@20.10.5)(terser@5.26.0))(webpack-sources@3.2.3)(webpack@5.95.0(esbuild@0.23.1))':\n    dependencies:\n      '@nuxt/kit': 3.13.2(magicast@0.3.5)(rollup@4.24.0)(webpack-sources@3.2.3)\n      '@unocss/config': 0.62.4\n      '@unocss/core': 0.62.4\n      '@unocss/preset-attributify': 0.62.4\n      '@unocss/preset-icons': 0.62.4\n      '@unocss/preset-tagify': 0.62.4\n      '@unocss/preset-typography': 0.62.4\n      '@unocss/preset-uno': 0.62.4\n      '@unocss/preset-web-fonts': 0.62.4\n      '@unocss/preset-wind': 0.62.4\n      '@unocss/reset': 0.62.4\n      '@unocss/vite': 0.62.4(rollup@4.24.0)(vite@5.4.8(@types/node@20.10.5)(terser@5.26.0))\n      '@unocss/webpack': 0.62.4(rollup@4.24.0)(webpack@5.95.0(esbuild@0.23.1))\n      unocss: 0.62.4(@unocss/webpack@0.62.4(rollup@4.24.0)(webpack@5.95.0(esbuild@0.23.1)))(postcss@8.4.47)(rollup@4.24.0)(vite@5.4.8(@types/node@20.10.5)(terser@5.26.0))\n    transitivePeerDependencies:\n      - magicast\n      - postcss\n      - rollup\n      - supports-color\n      - vite\n      - webpack\n      - webpack-sources\n\n  '@unocss/postcss@0.62.4(postcss@8.4.47)':\n    dependencies:\n      '@unocss/config': 0.62.4\n      '@unocss/core': 0.62.4\n      '@unocss/rule-utils': 0.62.4\n      css-tree: 2.3.1\n      postcss: 8.4.47\n      tinyglobby: 0.2.9\n    transitivePeerDependencies:\n      - supports-color\n\n  '@unocss/preset-attributify@0.62.4':\n    dependencies:\n      '@unocss/core': 0.62.4\n\n  '@unocss/preset-icons@0.62.4':\n    dependencies:\n      '@iconify/utils': 2.1.33\n      '@unocss/core': 0.62.4\n      ofetch: 1.4.1\n    transitivePeerDependencies:\n      - supports-color\n\n  '@unocss/preset-mini@0.62.4':\n    dependencies:\n      '@unocss/core': 0.62.4\n      '@unocss/extractor-arbitrary-variants': 0.62.4\n      '@unocss/rule-utils': 0.62.4\n\n  '@unocss/preset-tagify@0.62.4':\n    dependencies:\n      '@unocss/core': 0.62.4\n\n  '@unocss/preset-typography@0.62.4':\n    dependencies:\n      '@unocss/core': 0.62.4\n      '@unocss/preset-mini': 0.62.4\n\n  '@unocss/preset-uno@0.62.4':\n    dependencies:\n      '@unocss/core': 0.62.4\n      '@unocss/preset-mini': 0.62.4\n      '@unocss/preset-wind': 0.62.4\n      '@unocss/rule-utils': 0.62.4\n\n  '@unocss/preset-web-fonts@0.62.4':\n    dependencies:\n      '@unocss/core': 0.62.4\n      ofetch: 1.4.1\n\n  '@unocss/preset-wind@0.62.4':\n    dependencies:\n      '@unocss/core': 0.62.4\n      '@unocss/preset-mini': 0.62.4\n      '@unocss/rule-utils': 0.62.4\n\n  '@unocss/reset@0.62.4': {}\n\n  '@unocss/rule-utils@0.62.4':\n    dependencies:\n      '@unocss/core': 0.62.4\n      magic-string: 0.30.12\n\n  '@unocss/transformer-attributify-jsx@0.62.4':\n    dependencies:\n      '@unocss/core': 0.62.4\n\n  '@unocss/transformer-compile-class@0.62.4':\n    dependencies:\n      '@unocss/core': 0.62.4\n\n  '@unocss/transformer-directives@0.62.4':\n    dependencies:\n      '@unocss/core': 0.62.4\n      '@unocss/rule-utils': 0.62.4\n      css-tree: 2.3.1\n\n  '@unocss/transformer-variant-group@0.62.4':\n    dependencies:\n      '@unocss/core': 0.62.4\n\n  '@unocss/vite@0.62.4(rollup@4.24.0)(vite@5.4.8(@types/node@20.10.5)(terser@5.26.0))':\n    dependencies:\n      '@ampproject/remapping': 2.3.0\n      '@rollup/pluginutils': 5.1.2(rollup@4.24.0)\n      '@unocss/config': 0.62.4\n      '@unocss/core': 0.62.4\n      '@unocss/inspector': 0.62.4\n      chokidar: 3.6.0\n      magic-string: 0.30.12\n      tinyglobby: 0.2.9\n      vite: 5.4.8(@types/node@20.10.5)(terser@5.26.0)\n    transitivePeerDependencies:\n      - rollup\n      - supports-color\n\n  '@unocss/webpack@0.62.4(rollup@4.24.0)(webpack@5.95.0(esbuild@0.23.1))':\n    dependencies:\n      '@ampproject/remapping': 2.3.0\n      '@rollup/pluginutils': 5.1.2(rollup@4.24.0)\n      '@unocss/config': 0.62.4\n      '@unocss/core': 0.62.4\n      chokidar: 3.6.0\n      magic-string: 0.30.12\n      tinyglobby: 0.2.9\n      unplugin: 1.14.1(webpack-sources@3.2.3)\n      webpack: 5.95.0(esbuild@0.23.1)\n      webpack-sources: 3.2.3\n    transitivePeerDependencies:\n      - rollup\n      - supports-color\n\n  '@uploadthing/mime-types@0.3.2': {}\n\n  '@vercel/nft@0.26.5':\n    dependencies:\n      '@mapbox/node-pre-gyp': 1.0.11\n      '@rollup/pluginutils': 4.2.1\n      acorn: 8.12.1\n      acorn-import-attributes: 1.9.5(acorn@8.12.1)\n      async-sema: 3.1.1\n      bindings: 1.5.0\n      estree-walker: 2.0.2\n      glob: 7.2.3\n      graceful-fs: 4.2.11\n      micromatch: 4.0.5\n      node-gyp-build: 4.8.2\n      resolve-from: 5.0.0\n    transitivePeerDependencies:\n      - encoding\n      - supports-color\n\n  '@vite-pwa/nuxt@0.10.5(magicast@0.3.5)(rollup@4.24.0)(vite@5.4.8(@types/node@20.10.5)(terser@5.26.0))(webpack-sources@3.2.3)(workbox-build@7.0.0)(workbox-window@7.0.0)':\n    dependencies:\n      '@nuxt/kit': 3.13.2(magicast@0.3.5)(rollup@4.24.0)(webpack-sources@3.2.3)\n      pathe: 1.1.2\n      ufo: 1.5.4\n      vite-plugin-pwa: 0.20.5(vite@5.4.8(@types/node@20.10.5)(terser@5.26.0))(workbox-build@7.0.0)(workbox-window@7.0.0)\n    transitivePeerDependencies:\n      - magicast\n      - rollup\n      - supports-color\n      - vite\n      - webpack-sources\n      - workbox-build\n      - workbox-window\n\n  '@vitejs/plugin-vue-jsx@4.0.1(vite@5.4.8(@types/node@20.10.5)(terser@5.26.0))(vue@3.5.12(typescript@5.6.3))':\n    dependencies:\n      '@babel/core': 7.25.9\n      '@babel/plugin-transform-typescript': 7.25.9(@babel/core@7.25.9)\n      '@vue/babel-plugin-jsx': 1.2.5(@babel/core@7.25.9)\n      vite: 5.4.8(@types/node@20.10.5)(terser@5.26.0)\n      vue: 3.5.12(typescript@5.6.3)\n    transitivePeerDependencies:\n      - supports-color\n\n  '@vitejs/plugin-vue@5.1.4(vite@5.4.8(@types/node@20.10.5)(terser@5.26.0))(vue@3.5.12(typescript@5.6.3))':\n    dependencies:\n      vite: 5.4.8(@types/node@20.10.5)(terser@5.26.0)\n      vue: 3.5.12(typescript@5.6.3)\n\n  '@volar/language-core@2.4.6':\n    dependencies:\n      '@volar/source-map': 2.4.6\n\n  '@volar/source-map@2.4.6': {}\n\n  '@volar/typescript@2.4.6':\n    dependencies:\n      '@volar/language-core': 2.4.6\n      path-browserify: 1.0.1\n      vscode-uri: 3.0.8\n\n  '@vue-macros/common@1.15.0(rollup@4.24.0)(vue@3.5.12(typescript@5.6.3))':\n    dependencies:\n      '@babel/types': 7.25.8\n      '@rollup/pluginutils': 5.1.2(rollup@4.24.0)\n      '@vue/compiler-sfc': 3.5.12\n      ast-kit: 1.3.0\n      local-pkg: 0.5.0\n      magic-string-ast: 0.6.2\n    optionalDependencies:\n      vue: 3.5.12(typescript@5.6.3)\n    transitivePeerDependencies:\n      - rollup\n\n  '@vue/babel-helper-vue-transform-on@1.2.5': {}\n\n  '@vue/babel-plugin-jsx@1.2.5(@babel/core@7.23.7)':\n    dependencies:\n      '@babel/helper-module-imports': 7.25.9\n      '@babel/helper-plugin-utils': 7.25.9\n      '@babel/plugin-syntax-jsx': 7.25.9(@babel/core@7.23.7)\n      '@babel/template': 7.25.9\n      '@babel/traverse': 7.25.9\n      '@babel/types': 7.25.8\n      '@vue/babel-helper-vue-transform-on': 1.2.5\n      '@vue/babel-plugin-resolve-type': 1.2.5(@babel/core@7.23.7)\n      html-tags: 3.3.1\n      svg-tags: 1.0.0\n    optionalDependencies:\n      '@babel/core': 7.23.7\n    transitivePeerDependencies:\n      - supports-color\n\n  '@vue/babel-plugin-jsx@1.2.5(@babel/core@7.25.9)':\n    dependencies:\n      '@babel/helper-module-imports': 7.25.9\n      '@babel/helper-plugin-utils': 7.25.9\n      '@babel/plugin-syntax-jsx': 7.25.9(@babel/core@7.25.9)\n      '@babel/template': 7.25.9\n      '@babel/traverse': 7.25.9\n      '@babel/types': 7.25.8\n      '@vue/babel-helper-vue-transform-on': 1.2.5\n      '@vue/babel-plugin-resolve-type': 1.2.5(@babel/core@7.25.9)\n      html-tags: 3.3.1\n      svg-tags: 1.0.0\n    optionalDependencies:\n      '@babel/core': 7.25.9\n    transitivePeerDependencies:\n      - supports-color\n\n  '@vue/babel-plugin-resolve-type@1.2.5(@babel/core@7.23.7)':\n    dependencies:\n      '@babel/code-frame': 7.25.9\n      '@babel/core': 7.23.7\n      '@babel/helper-module-imports': 7.25.9\n      '@babel/helper-plugin-utils': 7.25.9\n      '@babel/parser': 7.25.9\n      '@vue/compiler-sfc': 3.5.12\n    transitivePeerDependencies:\n      - supports-color\n\n  '@vue/babel-plugin-resolve-type@1.2.5(@babel/core@7.25.9)':\n    dependencies:\n      '@babel/code-frame': 7.25.9\n      '@babel/core': 7.25.9\n      '@babel/helper-module-imports': 7.25.9\n      '@babel/helper-plugin-utils': 7.25.9\n      '@babel/parser': 7.25.9\n      '@vue/compiler-sfc': 3.5.12\n    transitivePeerDependencies:\n      - supports-color\n\n  '@vue/compiler-core@3.5.12':\n    dependencies:\n      '@babel/parser': 7.25.9\n      '@vue/shared': 3.5.12\n      entities: 4.5.0\n      estree-walker: 2.0.2\n      source-map-js: 1.2.1\n\n  '@vue/compiler-dom@3.5.12':\n    dependencies:\n      '@vue/compiler-core': 3.5.12\n      '@vue/shared': 3.5.12\n\n  '@vue/compiler-sfc@3.5.12':\n    dependencies:\n      '@babel/parser': 7.25.9\n      '@vue/compiler-core': 3.5.12\n      '@vue/compiler-dom': 3.5.12\n      '@vue/compiler-ssr': 3.5.12\n      '@vue/shared': 3.5.12\n      estree-walker: 2.0.2\n      magic-string: 0.30.12\n      postcss: 8.4.47\n      source-map-js: 1.2.1\n\n  '@vue/compiler-ssr@3.5.12':\n    dependencies:\n      '@vue/compiler-dom': 3.5.12\n      '@vue/shared': 3.5.12\n\n  '@vue/compiler-vue2@2.7.16':\n    dependencies:\n      de-indent: 1.0.2\n      he: 1.2.0\n\n  '@vue/devtools-api@6.6.4': {}\n\n  '@vue/devtools-core@7.4.4(vite@5.4.8(@types/node@20.10.5)(terser@5.26.0))(vue@3.5.12(typescript@5.6.3))':\n    dependencies:\n      '@vue/devtools-kit': 7.4.4\n      '@vue/devtools-shared': 7.5.3\n      mitt: 3.0.1\n      nanoid: 3.3.7\n      pathe: 1.1.2\n      vite-hot-client: 0.2.3(vite@5.4.8(@types/node@20.10.5)(terser@5.26.0))\n      vue: 3.5.12(typescript@5.6.3)\n    transitivePeerDependencies:\n      - vite\n\n  '@vue/devtools-kit@7.4.4':\n    dependencies:\n      '@vue/devtools-shared': 7.5.3\n      birpc: 0.2.19\n      hookable: 5.5.3\n      mitt: 3.0.1\n      perfect-debounce: 1.0.0\n      speakingurl: 14.0.1\n      superjson: 2.2.1\n\n  '@vue/devtools-shared@7.5.3':\n    dependencies:\n      rfdc: 1.4.1\n\n  '@vue/language-core@2.1.6(typescript@5.6.3)':\n    dependencies:\n      '@volar/language-core': 2.4.6\n      '@vue/compiler-dom': 3.5.12\n      '@vue/compiler-vue2': 2.7.16\n      '@vue/shared': 3.5.12\n      computeds: 0.0.1\n      minimatch: 9.0.3\n      muggle-string: 0.4.1\n      path-browserify: 1.0.1\n    optionalDependencies:\n      typescript: 5.6.3\n\n  '@vue/reactivity@3.5.12':\n    dependencies:\n      '@vue/shared': 3.5.12\n\n  '@vue/runtime-core@3.5.12':\n    dependencies:\n      '@vue/reactivity': 3.5.12\n      '@vue/shared': 3.5.12\n\n  '@vue/runtime-dom@3.5.12':\n    dependencies:\n      '@vue/reactivity': 3.5.12\n      '@vue/runtime-core': 3.5.12\n      '@vue/shared': 3.5.12\n      csstype: 3.1.3\n\n  '@vue/server-renderer@3.5.12(vue@3.5.12(typescript@5.6.3))':\n    dependencies:\n      '@vue/compiler-ssr': 3.5.12\n      '@vue/shared': 3.5.12\n      vue: 3.5.12(typescript@5.6.3)\n\n  '@vue/shared@3.5.12': {}\n\n  '@vueuse/components@11.1.0(vue@3.5.12(typescript@5.6.3))':\n    dependencies:\n      '@vueuse/core': 11.1.0(vue@3.5.12(typescript@5.6.3))\n      '@vueuse/shared': 11.1.0(vue@3.5.12(typescript@5.6.3))\n      vue-demi: 0.14.10(vue@3.5.12(typescript@5.6.3))\n    transitivePeerDependencies:\n      - '@vue/composition-api'\n      - vue\n\n  '@vueuse/core@10.7.0(vue@3.5.12(typescript@5.6.3))':\n    dependencies:\n      '@types/web-bluetooth': 0.0.20\n      '@vueuse/metadata': 10.7.0\n      '@vueuse/shared': 10.7.0(vue@3.5.12(typescript@5.6.3))\n      vue-demi: 0.14.10(vue@3.5.12(typescript@5.6.3))\n    transitivePeerDependencies:\n      - '@vue/composition-api'\n      - vue\n\n  '@vueuse/core@11.1.0(vue@3.5.12(typescript@5.6.3))':\n    dependencies:\n      '@types/web-bluetooth': 0.0.20\n      '@vueuse/metadata': 11.1.0\n      '@vueuse/shared': 11.1.0(vue@3.5.12(typescript@5.6.3))\n      vue-demi: 0.14.10(vue@3.5.12(typescript@5.6.3))\n    transitivePeerDependencies:\n      - '@vue/composition-api'\n      - vue\n\n  '@vueuse/head@2.0.0(vue@3.5.12(typescript@5.6.3))':\n    dependencies:\n      '@unhead/dom': 1.11.9\n      '@unhead/schema': 1.11.9\n      '@unhead/ssr': 1.11.7\n      '@unhead/vue': 1.11.13(vue@3.5.12(typescript@5.6.3))\n      vue: 3.5.12(typescript@5.6.3)\n\n  '@vueuse/integrations@11.1.0(focus-trap@7.6.0)(fuse.js@6.5.3)(vue@3.5.12(typescript@5.6.3))':\n    dependencies:\n      '@vueuse/core': 11.1.0(vue@3.5.12(typescript@5.6.3))\n      '@vueuse/shared': 11.1.0(vue@3.5.12(typescript@5.6.3))\n      vue-demi: 0.14.10(vue@3.5.12(typescript@5.6.3))\n    optionalDependencies:\n      focus-trap: 7.6.0\n      fuse.js: 6.5.3\n    transitivePeerDependencies:\n      - '@vue/composition-api'\n      - vue\n\n  '@vueuse/metadata@10.7.0': {}\n\n  '@vueuse/metadata@11.1.0': {}\n\n  '@vueuse/nuxt@11.1.0(magicast@0.3.5)(nuxt@3.13.2(@parcel/watcher@2.4.1)(@types/node@20.10.5)(drizzle-orm@0.36.4(@cloudflare/workers-types@4.20241127.0)(@types/pg@8.11.10)(pg@8.13.1)(postgres@3.4.5))(ioredis@5.4.1)(magicast@0.3.5)(rollup@4.24.0)(terser@5.26.0)(typescript@5.6.3)(vite@5.4.8(@types/node@20.10.5)(terser@5.26.0))(vue-tsc@2.1.6(typescript@5.6.3))(webpack-sources@3.2.3))(rollup@4.24.0)(vue@3.5.12(typescript@5.6.3))(webpack-sources@3.2.3)':\n    dependencies:\n      '@nuxt/kit': 3.13.2(magicast@0.3.5)(rollup@4.24.0)(webpack-sources@3.2.3)\n      '@vueuse/core': 11.1.0(vue@3.5.12(typescript@5.6.3))\n      '@vueuse/metadata': 11.1.0\n      local-pkg: 0.5.0\n      nuxt: 3.13.2(@parcel/watcher@2.4.1)(@types/node@20.10.5)(drizzle-orm@0.36.4(@cloudflare/workers-types@4.20241127.0)(@types/pg@8.11.10)(pg@8.13.1)(postgres@3.4.5))(ioredis@5.4.1)(magicast@0.3.5)(rollup@4.24.0)(terser@5.26.0)(typescript@5.6.3)(vite@5.4.8(@types/node@20.10.5)(terser@5.26.0))(vue-tsc@2.1.6(typescript@5.6.3))(webpack-sources@3.2.3)\n      vue-demi: 0.14.10(vue@3.5.12(typescript@5.6.3))\n    transitivePeerDependencies:\n      - '@vue/composition-api'\n      - magicast\n      - rollup\n      - supports-color\n      - vue\n      - webpack-sources\n\n  '@vueuse/shared@10.7.0(vue@3.5.12(typescript@5.6.3))':\n    dependencies:\n      vue-demi: 0.14.10(vue@3.5.12(typescript@5.6.3))\n    transitivePeerDependencies:\n      - '@vue/composition-api'\n      - vue\n\n  '@vueuse/shared@11.1.0(vue@3.5.12(typescript@5.6.3))':\n    dependencies:\n      vue-demi: 0.14.10(vue@3.5.12(typescript@5.6.3))\n    transitivePeerDependencies:\n      - '@vue/composition-api'\n      - vue\n\n  '@webassemblyjs/ast@1.12.1':\n    dependencies:\n      '@webassemblyjs/helper-numbers': 1.11.6\n      '@webassemblyjs/helper-wasm-bytecode': 1.11.6\n\n  '@webassemblyjs/floating-point-hex-parser@1.11.6': {}\n\n  '@webassemblyjs/helper-api-error@1.11.6': {}\n\n  '@webassemblyjs/helper-buffer@1.12.1': {}\n\n  '@webassemblyjs/helper-numbers@1.11.6':\n    dependencies:\n      '@webassemblyjs/floating-point-hex-parser': 1.11.6\n      '@webassemblyjs/helper-api-error': 1.11.6\n      '@xtuc/long': 4.2.2\n\n  '@webassemblyjs/helper-wasm-bytecode@1.11.6': {}\n\n  '@webassemblyjs/helper-wasm-section@1.12.1':\n    dependencies:\n      '@webassemblyjs/ast': 1.12.1\n      '@webassemblyjs/helper-buffer': 1.12.1\n      '@webassemblyjs/helper-wasm-bytecode': 1.11.6\n      '@webassemblyjs/wasm-gen': 1.12.1\n\n  '@webassemblyjs/ieee754@1.11.6':\n    dependencies:\n      '@xtuc/ieee754': 1.2.0\n\n  '@webassemblyjs/leb128@1.11.6':\n    dependencies:\n      '@xtuc/long': 4.2.2\n\n  '@webassemblyjs/utf8@1.11.6': {}\n\n  '@webassemblyjs/wasm-edit@1.12.1':\n    dependencies:\n      '@webassemblyjs/ast': 1.12.1\n      '@webassemblyjs/helper-buffer': 1.12.1\n      '@webassemblyjs/helper-wasm-bytecode': 1.11.6\n      '@webassemblyjs/helper-wasm-section': 1.12.1\n      '@webassemblyjs/wasm-gen': 1.12.1\n      '@webassemblyjs/wasm-opt': 1.12.1\n      '@webassemblyjs/wasm-parser': 1.12.1\n      '@webassemblyjs/wast-printer': 1.12.1\n\n  '@webassemblyjs/wasm-gen@1.12.1':\n    dependencies:\n      '@webassemblyjs/ast': 1.12.1\n      '@webassemblyjs/helper-wasm-bytecode': 1.11.6\n      '@webassemblyjs/ieee754': 1.11.6\n      '@webassemblyjs/leb128': 1.11.6\n      '@webassemblyjs/utf8': 1.11.6\n\n  '@webassemblyjs/wasm-opt@1.12.1':\n    dependencies:\n      '@webassemblyjs/ast': 1.12.1\n      '@webassemblyjs/helper-buffer': 1.12.1\n      '@webassemblyjs/wasm-gen': 1.12.1\n      '@webassemblyjs/wasm-parser': 1.12.1\n\n  '@webassemblyjs/wasm-parser@1.12.1':\n    dependencies:\n      '@webassemblyjs/ast': 1.12.1\n      '@webassemblyjs/helper-api-error': 1.11.6\n      '@webassemblyjs/helper-wasm-bytecode': 1.11.6\n      '@webassemblyjs/ieee754': 1.11.6\n      '@webassemblyjs/leb128': 1.11.6\n      '@webassemblyjs/utf8': 1.11.6\n\n  '@webassemblyjs/wast-printer@1.12.1':\n    dependencies:\n      '@webassemblyjs/ast': 1.12.1\n      '@xtuc/long': 4.2.2\n\n  '@xtuc/ieee754@1.2.0': {}\n\n  '@xtuc/long@4.2.2': {}\n\n  abbrev@1.1.1: {}\n\n  abort-controller@3.0.0:\n    dependencies:\n      event-target-shim: 5.0.1\n\n  accepts@1.3.8:\n    dependencies:\n      mime-types: 2.1.35\n      negotiator: 0.6.3\n\n  acorn-import-attributes@1.9.5(acorn@8.12.1):\n    dependencies:\n      acorn: 8.12.1\n\n  acorn-import-attributes@1.9.5(acorn@8.14.0):\n    dependencies:\n      acorn: 8.14.0\n\n  acorn-walk@8.3.4:\n    dependencies:\n      acorn: 8.14.0\n\n  acorn@8.11.3: {}\n\n  acorn@8.12.1: {}\n\n  acorn@8.14.0: {}\n\n  agent-base@6.0.2:\n    dependencies:\n      debug: 4.3.7\n    transitivePeerDependencies:\n      - supports-color\n\n  ajv-keywords@3.5.2(ajv@6.12.6):\n    dependencies:\n      ajv: 6.12.6\n\n  ajv@6.12.6:\n    dependencies:\n      fast-deep-equal: 3.1.3\n      fast-json-stable-stringify: 2.1.0\n      json-schema-traverse: 0.4.1\n      uri-js: 4.4.1\n\n  ajv@8.12.0:\n    dependencies:\n      fast-deep-equal: 3.1.3\n      json-schema-traverse: 1.0.0\n      require-from-string: 2.0.2\n      uri-js: 4.4.1\n\n  ansi-colors@4.1.3: {}\n\n  ansi-escapes@4.3.2:\n    dependencies:\n      type-fest: 0.21.3\n\n  ansi-regex@5.0.1: {}\n\n  ansi-regex@6.0.1: {}\n\n  ansi-styles@3.2.1:\n    dependencies:\n      color-convert: 1.9.3\n\n  ansi-styles@4.3.0:\n    dependencies:\n      color-convert: 2.0.1\n\n  ansi-styles@6.2.1: {}\n\n  any-promise@1.3.0: {}\n\n  anymatch@3.1.3:\n    dependencies:\n      normalize-path: 3.0.0\n      picomatch: 2.3.1\n\n  aproba@2.0.0: {}\n\n  archiver-utils@5.0.2:\n    dependencies:\n      glob: 10.3.10\n      graceful-fs: 4.2.11\n      is-stream: 2.0.1\n      lazystream: 1.0.1\n      lodash: 4.17.21\n      normalize-path: 3.0.0\n      readable-stream: 4.5.2\n\n  archiver@7.0.1:\n    dependencies:\n      archiver-utils: 5.0.2\n      async: 3.2.5\n      buffer-crc32: 1.0.0\n      readable-stream: 4.5.2\n      readdir-glob: 1.1.3\n      tar-stream: 3.1.7\n      zip-stream: 6.0.1\n\n  are-we-there-yet@2.0.0:\n    dependencies:\n      delegates: 1.0.0\n      readable-stream: 3.6.2\n\n  arg@5.0.2: {}\n\n  argparse@2.0.1: {}\n\n  aria-hidden@1.2.4:\n    dependencies:\n      tslib: 2.6.2\n\n  array-buffer-byte-length@1.0.0:\n    dependencies:\n      call-bind: 1.0.5\n      is-array-buffer: 3.0.2\n\n  arraybuffer.prototype.slice@1.0.2:\n    dependencies:\n      array-buffer-byte-length: 1.0.0\n      call-bind: 1.0.5\n      define-properties: 1.2.1\n      es-abstract: 1.22.3\n      get-intrinsic: 1.2.2\n      is-array-buffer: 3.0.2\n      is-shared-array-buffer: 1.0.2\n\n  as-table@1.0.55:\n    dependencies:\n      printable-characters: 1.0.42\n\n  ast-kit@1.3.0:\n    dependencies:\n      '@babel/parser': 7.25.9\n      pathe: 1.1.2\n\n  ast-walker-scope@0.6.2:\n    dependencies:\n      '@babel/parser': 7.25.8\n      ast-kit: 1.3.0\n\n  async-sema@3.1.1: {}\n\n  async@2.6.4:\n    dependencies:\n      lodash: 4.17.21\n\n  async@3.2.5: {}\n\n  at-least-node@1.0.0: {}\n\n  autoprefixer@10.4.20(postcss@8.4.47):\n    dependencies:\n      browserslist: 4.24.0\n      caniuse-lite: 1.0.30001668\n      fraction.js: 4.3.7\n      normalize-range: 0.1.2\n      picocolors: 1.1.0\n      postcss: 8.4.47\n      postcss-value-parser: 4.2.0\n\n  available-typed-arrays@1.0.5: {}\n\n  b4a@1.6.7: {}\n\n  babel-plugin-polyfill-corejs2@0.4.7(@babel/core@7.25.9):\n    dependencies:\n      '@babel/compat-data': 7.25.9\n      '@babel/core': 7.25.9\n      '@babel/helper-define-polyfill-provider': 0.4.4(@babel/core@7.25.9)\n      semver: 6.3.1\n    transitivePeerDependencies:\n      - supports-color\n\n  babel-plugin-polyfill-corejs3@0.8.7(@babel/core@7.25.9):\n    dependencies:\n      '@babel/core': 7.25.9\n      '@babel/helper-define-polyfill-provider': 0.4.4(@babel/core@7.25.9)\n      core-js-compat: 3.35.0\n    transitivePeerDependencies:\n      - supports-color\n\n  babel-plugin-polyfill-regenerator@0.5.4(@babel/core@7.25.9):\n    dependencies:\n      '@babel/core': 7.25.9\n      '@babel/helper-define-polyfill-provider': 0.4.4(@babel/core@7.25.9)\n    transitivePeerDependencies:\n      - supports-color\n\n  balanced-match@1.0.2: {}\n\n  bare-events@2.5.0:\n    optional: true\n\n  base64-js@1.5.1: {}\n\n  binary-extensions@2.2.0: {}\n\n  bindings@1.5.0:\n    dependencies:\n      file-uri-to-path: 1.0.0\n\n  birpc@0.2.19: {}\n\n  blake3-wasm@2.1.5: {}\n\n  boolbase@1.0.0: {}\n\n  brace-expansion@1.1.11:\n    dependencies:\n      balanced-match: 1.0.2\n      concat-map: 0.0.1\n\n  brace-expansion@2.0.1:\n    dependencies:\n      balanced-match: 1.0.2\n\n  braces@3.0.2:\n    dependencies:\n      fill-range: 7.0.1\n\n  browserslist@4.24.0:\n    dependencies:\n      caniuse-lite: 1.0.30001668\n      electron-to-chromium: 1.5.36\n      node-releases: 2.0.18\n      update-browserslist-db: 1.1.1(browserslist@4.24.0)\n\n  buffer-crc32@1.0.0: {}\n\n  buffer-from@1.1.2: {}\n\n  buffer@6.0.3:\n    dependencies:\n      base64-js: 1.5.1\n      ieee754: 1.2.1\n\n  builtin-modules@3.3.0: {}\n\n  bundle-name@4.1.0:\n    dependencies:\n      run-applescript: 7.0.0\n\n  bundle-require@5.0.0(esbuild@0.23.1):\n    dependencies:\n      esbuild: 0.23.1\n      load-tsconfig: 0.2.5\n\n  c12@1.11.2(magicast@0.3.5):\n    dependencies:\n      chokidar: 3.6.0\n      confbox: 0.1.8\n      defu: 6.1.4\n      dotenv: 16.4.5\n      giget: 1.2.3\n      jiti: 1.21.6\n      mlly: 1.7.2\n      ohash: 1.1.4\n      pathe: 1.1.2\n      perfect-debounce: 1.0.0\n      pkg-types: 1.2.1\n      rc9: 2.1.2\n    optionalDependencies:\n      magicast: 0.3.5\n\n  c12@2.0.1(magicast@0.3.5):\n    dependencies:\n      chokidar: 4.0.1\n      confbox: 0.1.8\n      defu: 6.1.4\n      dotenv: 16.4.5\n      giget: 1.2.3\n      jiti: 2.4.1\n      mlly: 1.7.3\n      ohash: 1.1.4\n      pathe: 1.1.2\n      perfect-debounce: 1.0.0\n      pkg-types: 1.2.1\n      rc9: 2.1.2\n    optionalDependencies:\n      magicast: 0.3.5\n\n  cac@6.7.14: {}\n\n  cache-content-type@1.0.1:\n    dependencies:\n      mime-types: 2.1.35\n      ylru: 1.4.0\n\n  call-bind@1.0.5:\n    dependencies:\n      function-bind: 1.1.2\n      get-intrinsic: 1.2.2\n      set-function-length: 1.1.1\n\n  camelcase-css@2.0.1: {}\n\n  caniuse-api@3.0.0:\n    dependencies:\n      browserslist: 4.24.0\n      caniuse-lite: 1.0.30001668\n      lodash.memoize: 4.1.2\n      lodash.uniq: 4.5.0\n\n  caniuse-lite@1.0.30001668: {}\n\n  capnp-ts@0.7.0:\n    dependencies:\n      debug: 4.3.7\n      tslib: 2.6.2\n    transitivePeerDependencies:\n      - supports-color\n\n  ccount@2.0.1: {}\n\n  chalk@2.4.2:\n    dependencies:\n      ansi-styles: 3.2.1\n      escape-string-regexp: 1.0.5\n      supports-color: 5.5.0\n\n  chalk@4.1.2:\n    dependencies:\n      ansi-styles: 4.3.0\n      supports-color: 7.2.0\n\n  chalk@5.3.0: {}\n\n  character-entities-html4@2.1.0: {}\n\n  character-entities-legacy@3.0.0: {}\n\n  chokidar@3.6.0:\n    dependencies:\n      anymatch: 3.1.3\n      braces: 3.0.2\n      glob-parent: 5.1.2\n      is-binary-path: 2.1.0\n      is-glob: 4.0.3\n      normalize-path: 3.0.0\n      readdirp: 3.6.0\n    optionalDependencies:\n      fsevents: 2.3.3\n\n  chokidar@4.0.1:\n    dependencies:\n      readdirp: 4.0.2\n\n  chownr@2.0.0: {}\n\n  chrome-trace-event@1.0.4: {}\n\n  ci-info@4.0.0: {}\n\n  citty@0.1.6:\n    dependencies:\n      consola: 3.2.3\n\n  clear@0.1.0: {}\n\n  clipboardy@4.0.0:\n    dependencies:\n      execa: 8.0.1\n      is-wsl: 3.1.0\n      is64bit: 2.0.0\n\n  cliui@8.0.1:\n    dependencies:\n      string-width: 4.2.3\n      strip-ansi: 6.0.1\n      wrap-ansi: 7.0.0\n\n  cluster-key-slot@1.1.2: {}\n\n  co@4.6.0: {}\n\n  color-convert@1.9.3:\n    dependencies:\n      color-name: 1.1.3\n\n  color-convert@2.0.1:\n    dependencies:\n      color-name: 1.1.4\n\n  color-name@1.1.3: {}\n\n  color-name@1.1.4: {}\n\n  color-support@1.1.3: {}\n\n  colord@2.9.3: {}\n\n  colorette@2.0.20: {}\n\n  comma-separated-tokens@2.0.3: {}\n\n  commander@2.20.3: {}\n\n  commander@4.1.1: {}\n\n  commander@6.2.1: {}\n\n  commander@7.2.0: {}\n\n  commander@8.3.0: {}\n\n  common-tags@1.8.2: {}\n\n  commondir@1.0.1: {}\n\n  compatx@0.1.8: {}\n\n  compress-commons@6.0.2:\n    dependencies:\n      crc-32: 1.2.2\n      crc32-stream: 6.0.0\n      is-stream: 2.0.1\n      normalize-path: 3.0.0\n      readable-stream: 4.5.2\n\n  computeds@0.0.1: {}\n\n  concat-map@0.0.1: {}\n\n  confbox@0.1.8: {}\n\n  consola@3.2.3: {}\n\n  console-control-strings@1.1.0: {}\n\n  content-disposition@0.5.4:\n    dependencies:\n      safe-buffer: 5.2.1\n\n  content-type@1.0.5: {}\n\n  convert-source-map@2.0.0: {}\n\n  cookie-es@1.2.2: {}\n\n  cookie@0.7.2: {}\n\n  cookies@0.9.1:\n    dependencies:\n      depd: 2.0.0\n      keygrip: 1.1.0\n\n  copy-anything@3.0.5:\n    dependencies:\n      is-what: 4.1.16\n\n  core-js-compat@3.35.0:\n    dependencies:\n      browserslist: 4.24.0\n\n  core-util-is@1.0.3: {}\n\n  crc-32@1.2.2: {}\n\n  crc32-stream@6.0.0:\n    dependencies:\n      crc-32: 1.2.2\n      readable-stream: 4.5.2\n\n  create-require@1.1.1: {}\n\n  croner@8.1.2: {}\n\n  cronstrue@2.50.0: {}\n\n  cross-spawn@7.0.3:\n    dependencies:\n      path-key: 3.1.1\n      shebang-command: 2.0.0\n      which: 2.0.2\n\n  crossws@0.2.4: {}\n\n  crossws@0.3.1:\n    dependencies:\n      uncrypto: 0.1.3\n\n  crypto-random-string@2.0.0: {}\n\n  css-declaration-sorter@7.2.0(postcss@8.4.47):\n    dependencies:\n      postcss: 8.4.47\n\n  css-select@5.1.0:\n    dependencies:\n      boolbase: 1.0.0\n      css-what: 6.1.0\n      domhandler: 5.0.3\n      domutils: 3.1.0\n      nth-check: 2.1.1\n\n  css-tree@2.2.1:\n    dependencies:\n      mdn-data: 2.0.28\n      source-map-js: 1.2.1\n\n  css-tree@2.3.1:\n    dependencies:\n      mdn-data: 2.0.30\n      source-map-js: 1.2.1\n\n  css-what@6.1.0: {}\n\n  cssesc@3.0.0: {}\n\n  cssnano-preset-default@7.0.6(postcss@8.4.47):\n    dependencies:\n      browserslist: 4.24.0\n      css-declaration-sorter: 7.2.0(postcss@8.4.47)\n      cssnano-utils: 5.0.0(postcss@8.4.47)\n      postcss: 8.4.47\n      postcss-calc: 10.0.2(postcss@8.4.47)\n      postcss-colormin: 7.0.2(postcss@8.4.47)\n      postcss-convert-values: 7.0.4(postcss@8.4.47)\n      postcss-discard-comments: 7.0.3(postcss@8.4.47)\n      postcss-discard-duplicates: 7.0.1(postcss@8.4.47)\n      postcss-discard-empty: 7.0.0(postcss@8.4.47)\n      postcss-discard-overridden: 7.0.0(postcss@8.4.47)\n      postcss-merge-longhand: 7.0.4(postcss@8.4.47)\n      postcss-merge-rules: 7.0.4(postcss@8.4.47)\n      postcss-minify-font-values: 7.0.0(postcss@8.4.47)\n      postcss-minify-gradients: 7.0.0(postcss@8.4.47)\n      postcss-minify-params: 7.0.2(postcss@8.4.47)\n      postcss-minify-selectors: 7.0.4(postcss@8.4.47)\n      postcss-normalize-charset: 7.0.0(postcss@8.4.47)\n      postcss-normalize-display-values: 7.0.0(postcss@8.4.47)\n      postcss-normalize-positions: 7.0.0(postcss@8.4.47)\n      postcss-normalize-repeat-style: 7.0.0(postcss@8.4.47)\n      postcss-normalize-string: 7.0.0(postcss@8.4.47)\n      postcss-normalize-timing-functions: 7.0.0(postcss@8.4.47)\n      postcss-normalize-unicode: 7.0.2(postcss@8.4.47)\n      postcss-normalize-url: 7.0.0(postcss@8.4.47)\n      postcss-normalize-whitespace: 7.0.0(postcss@8.4.47)\n      postcss-ordered-values: 7.0.1(postcss@8.4.47)\n      postcss-reduce-initial: 7.0.2(postcss@8.4.47)\n      postcss-reduce-transforms: 7.0.0(postcss@8.4.47)\n      postcss-svgo: 7.0.1(postcss@8.4.47)\n      postcss-unique-selectors: 7.0.3(postcss@8.4.47)\n\n  cssnano-utils@5.0.0(postcss@8.4.47):\n    dependencies:\n      postcss: 8.4.47\n\n  cssnano@7.0.6(postcss@8.4.47):\n    dependencies:\n      cssnano-preset-default: 7.0.6(postcss@8.4.47)\n      lilconfig: 3.1.2\n      postcss: 8.4.47\n\n  csso@5.0.5:\n    dependencies:\n      css-tree: 2.2.1\n\n  csstype@3.1.3: {}\n\n  data-uri-to-buffer@2.0.2: {}\n\n  date-fns@4.1.0: {}\n\n  db0@0.1.4(drizzle-orm@0.36.4(@cloudflare/workers-types@4.20241127.0)(@types/pg@8.11.10)(pg@8.13.1)(postgres@3.4.5)):\n    optionalDependencies:\n      drizzle-orm: 0.36.4(@cloudflare/workers-types@4.20241127.0)(@types/pg@8.11.10)(pg@8.13.1)(postgres@3.4.5)\n\n  de-indent@1.0.2: {}\n\n  debug@2.6.9:\n    dependencies:\n      ms: 2.0.0\n\n  debug@3.2.7:\n    dependencies:\n      ms: 2.1.3\n\n  debug@4.3.7:\n    dependencies:\n      ms: 2.1.3\n\n  deep-equal@1.0.1: {}\n\n  deepmerge@4.3.1: {}\n\n  default-browser-id@5.0.0: {}\n\n  default-browser@5.2.1:\n    dependencies:\n      bundle-name: 4.1.0\n      default-browser-id: 5.0.0\n\n  define-data-property@1.1.1:\n    dependencies:\n      get-intrinsic: 1.2.2\n      gopd: 1.0.1\n      has-property-descriptors: 1.0.1\n\n  define-lazy-prop@2.0.0: {}\n\n  define-lazy-prop@3.0.0: {}\n\n  define-properties@1.2.1:\n    dependencies:\n      define-data-property: 1.1.1\n      has-property-descriptors: 1.0.1\n      object-keys: 1.1.1\n\n  defu@6.1.4: {}\n\n  delegates@1.0.0: {}\n\n  denque@2.1.0: {}\n\n  depd@1.1.2: {}\n\n  depd@2.0.0: {}\n\n  dequal@2.0.3: {}\n\n  destr@2.0.3: {}\n\n  destroy@1.2.0: {}\n\n  detect-libc@1.0.3: {}\n\n  detect-libc@2.0.3: {}\n\n  devalue@5.1.1: {}\n\n  devlop@1.1.0:\n    dependencies:\n      dequal: 2.0.3\n\n  didyoumean@1.2.2: {}\n\n  diff@7.0.0: {}\n\n  dlv@1.1.3: {}\n\n  dom-serializer@2.0.0:\n    dependencies:\n      domelementtype: 2.3.0\n      domhandler: 5.0.3\n      entities: 4.5.0\n\n  domelementtype@2.3.0: {}\n\n  domhandler@5.0.3:\n    dependencies:\n      domelementtype: 2.3.0\n\n  domutils@3.1.0:\n    dependencies:\n      dom-serializer: 2.0.0\n      domelementtype: 2.3.0\n      domhandler: 5.0.3\n\n  dot-prop@8.0.2:\n    dependencies:\n      type-fest: 3.13.1\n\n  dotenv@16.4.5: {}\n\n  drizzle-kit@0.28.1:\n    dependencies:\n      '@drizzle-team/brocli': 0.10.2\n      '@esbuild-kit/esm-loader': 2.6.5\n      esbuild: 0.19.12\n      esbuild-register: 3.6.0(esbuild@0.19.12)\n    transitivePeerDependencies:\n      - supports-color\n\n  drizzle-orm@0.36.4(@cloudflare/workers-types@4.20241127.0)(@types/pg@8.11.10)(pg@8.13.1)(postgres@3.4.5):\n    optionalDependencies:\n      '@cloudflare/workers-types': 4.20241127.0\n      '@types/pg': 8.11.10\n      pg: 8.13.1\n      postgres: 3.4.5\n\n  duplexer@0.1.2: {}\n\n  eastasianwidth@0.2.0: {}\n\n  ee-first@1.1.1: {}\n\n  ejs@3.1.9:\n    dependencies:\n      jake: 10.8.7\n\n  electron-to-chromium@1.5.36: {}\n\n  emoji-regex-xs@1.0.0: {}\n\n  emoji-regex@8.0.0: {}\n\n  emoji-regex@9.2.2: {}\n\n  encodeurl@1.0.2: {}\n\n  encodeurl@2.0.0: {}\n\n  enhanced-resolve@5.17.1:\n    dependencies:\n      graceful-fs: 4.2.11\n      tapable: 2.2.1\n\n  entities@3.0.1: {}\n\n  entities@4.5.0: {}\n\n  error-stack-parser-es@0.1.5: {}\n\n  errx@0.1.0: {}\n\n  es-abstract@1.22.3:\n    dependencies:\n      array-buffer-byte-length: 1.0.0\n      arraybuffer.prototype.slice: 1.0.2\n      available-typed-arrays: 1.0.5\n      call-bind: 1.0.5\n      es-set-tostringtag: 2.0.2\n      es-to-primitive: 1.2.1\n      function.prototype.name: 1.1.6\n      get-intrinsic: 1.2.2\n      get-symbol-description: 1.0.0\n      globalthis: 1.0.3\n      gopd: 1.0.1\n      has-property-descriptors: 1.0.1\n      has-proto: 1.0.1\n      has-symbols: 1.0.3\n      hasown: 2.0.0\n      internal-slot: 1.0.6\n      is-array-buffer: 3.0.2\n      is-callable: 1.2.7\n      is-negative-zero: 2.0.2\n      is-regex: 1.1.4\n      is-shared-array-buffer: 1.0.2\n      is-string: 1.0.7\n      is-typed-array: 1.1.12\n      is-weakref: 1.0.2\n      object-inspect: 1.13.1\n      object-keys: 1.1.1\n      object.assign: 4.1.5\n      regexp.prototype.flags: 1.5.1\n      safe-array-concat: 1.0.1\n      safe-regex-test: 1.0.0\n      string.prototype.trim: 1.2.8\n      string.prototype.trimend: 1.0.7\n      string.prototype.trimstart: 1.0.7\n      typed-array-buffer: 1.0.0\n      typed-array-byte-length: 1.0.0\n      typed-array-byte-offset: 1.0.0\n      typed-array-length: 1.0.4\n      unbox-primitive: 1.0.2\n      which-typed-array: 1.1.13\n\n  es-module-lexer@1.5.4: {}\n\n  es-set-tostringtag@2.0.2:\n    dependencies:\n      get-intrinsic: 1.2.2\n      has-tostringtag: 1.0.0\n      hasown: 2.0.0\n\n  es-to-primitive@1.2.1:\n    dependencies:\n      is-callable: 1.2.7\n      is-date-object: 1.0.5\n      is-symbol: 1.0.4\n\n  esbuild-register@3.6.0(esbuild@0.19.12):\n    dependencies:\n      debug: 4.3.7\n      esbuild: 0.19.12\n    transitivePeerDependencies:\n      - supports-color\n\n  esbuild@0.17.19:\n    optionalDependencies:\n      '@esbuild/android-arm': 0.17.19\n      '@esbuild/android-arm64': 0.17.19\n      '@esbuild/android-x64': 0.17.19\n      '@esbuild/darwin-arm64': 0.17.19\n      '@esbuild/darwin-x64': 0.17.19\n      '@esbuild/freebsd-arm64': 0.17.19\n      '@esbuild/freebsd-x64': 0.17.19\n      '@esbuild/linux-arm': 0.17.19\n      '@esbuild/linux-arm64': 0.17.19\n      '@esbuild/linux-ia32': 0.17.19\n      '@esbuild/linux-loong64': 0.17.19\n      '@esbuild/linux-mips64el': 0.17.19\n      '@esbuild/linux-ppc64': 0.17.19\n      '@esbuild/linux-riscv64': 0.17.19\n      '@esbuild/linux-s390x': 0.17.19\n      '@esbuild/linux-x64': 0.17.19\n      '@esbuild/netbsd-x64': 0.17.19\n      '@esbuild/openbsd-x64': 0.17.19\n      '@esbuild/sunos-x64': 0.17.19\n      '@esbuild/win32-arm64': 0.17.19\n      '@esbuild/win32-ia32': 0.17.19\n      '@esbuild/win32-x64': 0.17.19\n\n  esbuild@0.18.20:\n    optionalDependencies:\n      '@esbuild/android-arm': 0.18.20\n      '@esbuild/android-arm64': 0.18.20\n      '@esbuild/android-x64': 0.18.20\n      '@esbuild/darwin-arm64': 0.18.20\n      '@esbuild/darwin-x64': 0.18.20\n      '@esbuild/freebsd-arm64': 0.18.20\n      '@esbuild/freebsd-x64': 0.18.20\n      '@esbuild/linux-arm': 0.18.20\n      '@esbuild/linux-arm64': 0.18.20\n      '@esbuild/linux-ia32': 0.18.20\n      '@esbuild/linux-loong64': 0.18.20\n      '@esbuild/linux-mips64el': 0.18.20\n      '@esbuild/linux-ppc64': 0.18.20\n      '@esbuild/linux-riscv64': 0.18.20\n      '@esbuild/linux-s390x': 0.18.20\n      '@esbuild/linux-x64': 0.18.20\n      '@esbuild/netbsd-x64': 0.18.20\n      '@esbuild/openbsd-x64': 0.18.20\n      '@esbuild/sunos-x64': 0.18.20\n      '@esbuild/win32-arm64': 0.18.20\n      '@esbuild/win32-ia32': 0.18.20\n      '@esbuild/win32-x64': 0.18.20\n\n  esbuild@0.19.12:\n    optionalDependencies:\n      '@esbuild/aix-ppc64': 0.19.12\n      '@esbuild/android-arm': 0.19.12\n      '@esbuild/android-arm64': 0.19.12\n      '@esbuild/android-x64': 0.19.12\n      '@esbuild/darwin-arm64': 0.19.12\n      '@esbuild/darwin-x64': 0.19.12\n      '@esbuild/freebsd-arm64': 0.19.12\n      '@esbuild/freebsd-x64': 0.19.12\n      '@esbuild/linux-arm': 0.19.12\n      '@esbuild/linux-arm64': 0.19.12\n      '@esbuild/linux-ia32': 0.19.12\n      '@esbuild/linux-loong64': 0.19.12\n      '@esbuild/linux-mips64el': 0.19.12\n      '@esbuild/linux-ppc64': 0.19.12\n      '@esbuild/linux-riscv64': 0.19.12\n      '@esbuild/linux-s390x': 0.19.12\n      '@esbuild/linux-x64': 0.19.12\n      '@esbuild/netbsd-x64': 0.19.12\n      '@esbuild/openbsd-x64': 0.19.12\n      '@esbuild/sunos-x64': 0.19.12\n      '@esbuild/win32-arm64': 0.19.12\n      '@esbuild/win32-ia32': 0.19.12\n      '@esbuild/win32-x64': 0.19.12\n\n  esbuild@0.20.2:\n    optionalDependencies:\n      '@esbuild/aix-ppc64': 0.20.2\n      '@esbuild/android-arm': 0.20.2\n      '@esbuild/android-arm64': 0.20.2\n      '@esbuild/android-x64': 0.20.2\n      '@esbuild/darwin-arm64': 0.20.2\n      '@esbuild/darwin-x64': 0.20.2\n      '@esbuild/freebsd-arm64': 0.20.2\n      '@esbuild/freebsd-x64': 0.20.2\n      '@esbuild/linux-arm': 0.20.2\n      '@esbuild/linux-arm64': 0.20.2\n      '@esbuild/linux-ia32': 0.20.2\n      '@esbuild/linux-loong64': 0.20.2\n      '@esbuild/linux-mips64el': 0.20.2\n      '@esbuild/linux-ppc64': 0.20.2\n      '@esbuild/linux-riscv64': 0.20.2\n      '@esbuild/linux-s390x': 0.20.2\n      '@esbuild/linux-x64': 0.20.2\n      '@esbuild/netbsd-x64': 0.20.2\n      '@esbuild/openbsd-x64': 0.20.2\n      '@esbuild/sunos-x64': 0.20.2\n      '@esbuild/win32-arm64': 0.20.2\n      '@esbuild/win32-ia32': 0.20.2\n      '@esbuild/win32-x64': 0.20.2\n\n  esbuild@0.21.5:\n    optionalDependencies:\n      '@esbuild/aix-ppc64': 0.21.5\n      '@esbuild/android-arm': 0.21.5\n      '@esbuild/android-arm64': 0.21.5\n      '@esbuild/android-x64': 0.21.5\n      '@esbuild/darwin-arm64': 0.21.5\n      '@esbuild/darwin-x64': 0.21.5\n      '@esbuild/freebsd-arm64': 0.21.5\n      '@esbuild/freebsd-x64': 0.21.5\n      '@esbuild/linux-arm': 0.21.5\n      '@esbuild/linux-arm64': 0.21.5\n      '@esbuild/linux-ia32': 0.21.5\n      '@esbuild/linux-loong64': 0.21.5\n      '@esbuild/linux-mips64el': 0.21.5\n      '@esbuild/linux-ppc64': 0.21.5\n      '@esbuild/linux-riscv64': 0.21.5\n      '@esbuild/linux-s390x': 0.21.5\n      '@esbuild/linux-x64': 0.21.5\n      '@esbuild/netbsd-x64': 0.21.5\n      '@esbuild/openbsd-x64': 0.21.5\n      '@esbuild/sunos-x64': 0.21.5\n      '@esbuild/win32-arm64': 0.21.5\n      '@esbuild/win32-ia32': 0.21.5\n      '@esbuild/win32-x64': 0.21.5\n\n  esbuild@0.23.1:\n    optionalDependencies:\n      '@esbuild/aix-ppc64': 0.23.1\n      '@esbuild/android-arm': 0.23.1\n      '@esbuild/android-arm64': 0.23.1\n      '@esbuild/android-x64': 0.23.1\n      '@esbuild/darwin-arm64': 0.23.1\n      '@esbuild/darwin-x64': 0.23.1\n      '@esbuild/freebsd-arm64': 0.23.1\n      '@esbuild/freebsd-x64': 0.23.1\n      '@esbuild/linux-arm': 0.23.1\n      '@esbuild/linux-arm64': 0.23.1\n      '@esbuild/linux-ia32': 0.23.1\n      '@esbuild/linux-loong64': 0.23.1\n      '@esbuild/linux-mips64el': 0.23.1\n      '@esbuild/linux-ppc64': 0.23.1\n      '@esbuild/linux-riscv64': 0.23.1\n      '@esbuild/linux-s390x': 0.23.1\n      '@esbuild/linux-x64': 0.23.1\n      '@esbuild/netbsd-x64': 0.23.1\n      '@esbuild/openbsd-arm64': 0.23.1\n      '@esbuild/openbsd-x64': 0.23.1\n      '@esbuild/sunos-x64': 0.23.1\n      '@esbuild/win32-arm64': 0.23.1\n      '@esbuild/win32-ia32': 0.23.1\n      '@esbuild/win32-x64': 0.23.1\n\n  escalade@3.1.1: {}\n\n  escalade@3.2.0: {}\n\n  escape-html@1.0.3: {}\n\n  escape-string-regexp@1.0.5: {}\n\n  escape-string-regexp@4.0.0: {}\n\n  escape-string-regexp@5.0.0: {}\n\n  eslint-scope@5.1.1:\n    dependencies:\n      esrecurse: 4.3.0\n      estraverse: 4.3.0\n\n  esrecurse@4.3.0:\n    dependencies:\n      estraverse: 5.3.0\n\n  estraverse@4.3.0: {}\n\n  estraverse@5.3.0: {}\n\n  estree-walker@0.6.1: {}\n\n  estree-walker@1.0.1: {}\n\n  estree-walker@2.0.2: {}\n\n  estree-walker@3.0.3:\n    dependencies:\n      '@types/estree': 1.0.6\n\n  esutils@2.0.3: {}\n\n  etag@1.8.1: {}\n\n  event-target-shim@5.0.1: {}\n\n  events@3.3.0: {}\n\n  execa@7.2.0:\n    dependencies:\n      cross-spawn: 7.0.3\n      get-stream: 6.0.1\n      human-signals: 4.3.1\n      is-stream: 3.0.0\n      merge-stream: 2.0.0\n      npm-run-path: 5.3.0\n      onetime: 6.0.0\n      signal-exit: 3.0.7\n      strip-final-newline: 3.0.0\n\n  execa@8.0.1:\n    dependencies:\n      cross-spawn: 7.0.3\n      get-stream: 8.0.1\n      human-signals: 5.0.0\n      is-stream: 3.0.0\n      merge-stream: 2.0.0\n      npm-run-path: 5.3.0\n      onetime: 6.0.0\n      signal-exit: 4.1.0\n      strip-final-newline: 3.0.0\n\n  exit-hook@2.2.1: {}\n\n  externality@1.0.2:\n    dependencies:\n      enhanced-resolve: 5.17.1\n      mlly: 1.7.2\n      pathe: 1.1.2\n      ufo: 1.5.4\n\n  fast-deep-equal@3.1.3: {}\n\n  fast-fifo@1.3.2: {}\n\n  fast-glob@3.3.2:\n    dependencies:\n      '@nodelib/fs.stat': 2.0.5\n      '@nodelib/fs.walk': 1.2.8\n      glob-parent: 5.1.2\n      merge2: 1.4.1\n      micromatch: 4.0.5\n\n  fast-json-stable-stringify@2.1.0: {}\n\n  fast-npm-meta@0.2.2: {}\n\n  fastq@1.16.0:\n    dependencies:\n      reusify: 1.0.4\n\n  fdir@6.4.0(picomatch@4.0.2):\n    optionalDependencies:\n      picomatch: 4.0.2\n\n  fdir@6.4.2(picomatch@4.0.2):\n    optionalDependencies:\n      picomatch: 4.0.2\n\n  fflate@0.8.2: {}\n\n  file-uri-to-path@1.0.0: {}\n\n  filelist@1.0.4:\n    dependencies:\n      minimatch: 5.1.6\n\n  fill-range@7.0.1:\n    dependencies:\n      to-regex-range: 5.0.1\n\n  flatted@3.3.1: {}\n\n  focus-trap@7.6.0:\n    dependencies:\n      tabbable: 6.2.0\n\n  for-each@0.3.3:\n    dependencies:\n      is-callable: 1.2.7\n\n  foreground-child@3.1.1:\n    dependencies:\n      cross-spawn: 7.0.3\n      signal-exit: 4.1.0\n\n  fraction.js@4.3.7: {}\n\n  fresh@0.5.2: {}\n\n  fs-extra@11.2.0:\n    dependencies:\n      graceful-fs: 4.2.11\n      jsonfile: 6.1.0\n      universalify: 2.0.1\n\n  fs-extra@9.1.0:\n    dependencies:\n      at-least-node: 1.0.0\n      graceful-fs: 4.2.11\n      jsonfile: 6.1.0\n      universalify: 2.0.1\n\n  fs-minipass@2.1.0:\n    dependencies:\n      minipass: 3.3.6\n\n  fs.realpath@1.0.0: {}\n\n  fsevents@2.3.3:\n    optional: true\n\n  function-bind@1.1.2: {}\n\n  function.prototype.name@1.1.6:\n    dependencies:\n      call-bind: 1.0.5\n      define-properties: 1.2.1\n      es-abstract: 1.22.3\n      functions-have-names: 1.2.3\n\n  functions-have-names@1.2.3: {}\n\n  fuse.js@6.5.3: {}\n\n  gauge@3.0.2:\n    dependencies:\n      aproba: 2.0.0\n      color-support: 1.1.3\n      console-control-strings: 1.1.0\n      has-unicode: 2.0.1\n      object-assign: 4.1.1\n      signal-exit: 3.0.7\n      string-width: 4.2.3\n      strip-ansi: 6.0.1\n      wide-align: 1.1.5\n\n  gensync@1.0.0-beta.2: {}\n\n  get-caller-file@2.0.5: {}\n\n  get-intrinsic@1.2.2:\n    dependencies:\n      function-bind: 1.1.2\n      has-proto: 1.0.1\n      has-symbols: 1.0.3\n      hasown: 2.0.0\n\n  get-own-enumerable-property-symbols@3.0.2: {}\n\n  get-port-please@3.1.2: {}\n\n  get-source@2.0.12:\n    dependencies:\n      data-uri-to-buffer: 2.0.2\n      source-map: 0.6.1\n\n  get-stream@6.0.1: {}\n\n  get-stream@8.0.1: {}\n\n  get-symbol-description@1.0.0:\n    dependencies:\n      call-bind: 1.0.5\n      get-intrinsic: 1.2.2\n\n  get-tsconfig@4.8.1:\n    dependencies:\n      resolve-pkg-maps: 1.0.0\n\n  giget@1.2.3:\n    dependencies:\n      citty: 0.1.6\n      consola: 3.2.3\n      defu: 6.1.4\n      node-fetch-native: 1.6.4\n      nypm: 0.3.12\n      ohash: 1.1.4\n      pathe: 1.1.2\n      tar: 6.2.1\n\n  git-config-path@2.0.0: {}\n\n  git-up@7.0.0:\n    dependencies:\n      is-ssh: 1.4.0\n      parse-url: 8.1.0\n\n  git-url-parse@15.0.0:\n    dependencies:\n      git-up: 7.0.0\n\n  glob-parent@5.1.2:\n    dependencies:\n      is-glob: 4.0.3\n\n  glob-parent@6.0.2:\n    dependencies:\n      is-glob: 4.0.3\n\n  glob-to-regexp@0.4.1: {}\n\n  glob@10.3.10:\n    dependencies:\n      foreground-child: 3.1.1\n      jackspeak: 2.3.6\n      minimatch: 9.0.5\n      minipass: 7.0.4\n      path-scurry: 1.10.1\n\n  glob@7.2.3:\n    dependencies:\n      fs.realpath: 1.0.0\n      inflight: 1.0.6\n      inherits: 2.0.4\n      minimatch: 3.1.2\n      once: 1.4.0\n      path-is-absolute: 1.0.1\n\n  glob@8.1.0:\n    dependencies:\n      fs.realpath: 1.0.0\n      inflight: 1.0.6\n      inherits: 2.0.4\n      minimatch: 5.1.6\n      once: 1.4.0\n\n  global-directory@4.0.1:\n    dependencies:\n      ini: 4.1.1\n\n  globals@11.12.0: {}\n\n  globalthis@1.0.3:\n    dependencies:\n      define-properties: 1.2.1\n\n  globby@14.0.2:\n    dependencies:\n      '@sindresorhus/merge-streams': 2.3.0\n      fast-glob: 3.3.2\n      ignore: 5.3.2\n      path-type: 5.0.0\n      slash: 5.1.0\n      unicorn-magic: 0.1.0\n\n  glur@1.1.2: {}\n\n  gopd@1.0.1:\n    dependencies:\n      get-intrinsic: 1.2.2\n\n  graceful-fs@4.2.11: {}\n\n  gzip-size@6.0.0:\n    dependencies:\n      duplexer: 0.1.2\n\n  gzip-size@7.0.0:\n    dependencies:\n      duplexer: 0.1.2\n\n  h3@1.13.0:\n    dependencies:\n      cookie-es: 1.2.2\n      crossws: 0.3.1\n      defu: 6.1.4\n      destr: 2.0.3\n      iron-webcrypto: 1.2.1\n      ohash: 1.1.4\n      radix3: 1.1.2\n      ufo: 1.5.4\n      uncrypto: 0.1.3\n      unenv: 1.10.0\n\n  has-bigints@1.0.2: {}\n\n  has-flag@3.0.0: {}\n\n  has-flag@4.0.0: {}\n\n  has-property-descriptors@1.0.1:\n    dependencies:\n      get-intrinsic: 1.2.2\n\n  has-proto@1.0.1: {}\n\n  has-symbols@1.0.3: {}\n\n  has-tostringtag@1.0.0:\n    dependencies:\n      has-symbols: 1.0.3\n\n  has-unicode@2.0.1: {}\n\n  hash-sum@2.0.0: {}\n\n  hasown@2.0.0:\n    dependencies:\n      function-bind: 1.1.2\n\n  hast-util-to-html@9.0.3:\n    dependencies:\n      '@types/hast': 3.0.4\n      '@types/unist': 3.0.3\n      ccount: 2.0.1\n      comma-separated-tokens: 2.0.3\n      hast-util-whitespace: 3.0.0\n      html-void-elements: 3.0.0\n      mdast-util-to-hast: 13.2.0\n      property-information: 6.5.0\n      space-separated-tokens: 2.0.2\n      stringify-entities: 4.0.4\n      zwitch: 2.0.4\n\n  hast-util-whitespace@3.0.0:\n    dependencies:\n      '@types/hast': 3.0.4\n\n  he@1.2.0: {}\n\n  hookable@5.5.3: {}\n\n  html-tags@3.3.1: {}\n\n  html-void-elements@3.0.0: {}\n\n  http-assert@1.5.0:\n    dependencies:\n      deep-equal: 1.0.1\n      http-errors: 1.8.1\n\n  http-errors@1.6.3:\n    dependencies:\n      depd: 1.1.2\n      inherits: 2.0.3\n      setprototypeof: 1.1.0\n      statuses: 1.5.0\n\n  http-errors@1.8.1:\n    dependencies:\n      depd: 1.1.2\n      inherits: 2.0.4\n      setprototypeof: 1.2.0\n      statuses: 1.5.0\n      toidentifier: 1.0.1\n\n  http-errors@2.0.0:\n    dependencies:\n      depd: 2.0.0\n      inherits: 2.0.4\n      setprototypeof: 1.2.0\n      statuses: 2.0.1\n      toidentifier: 1.0.1\n\n  http-shutdown@1.2.2: {}\n\n  https-proxy-agent@5.0.1:\n    dependencies:\n      agent-base: 6.0.2\n      debug: 4.3.7\n    transitivePeerDependencies:\n      - supports-color\n\n  httpxy@0.1.5: {}\n\n  human-signals@4.3.1: {}\n\n  human-signals@5.0.0: {}\n\n  idb@7.1.1: {}\n\n  ieee754@1.2.1: {}\n\n  ignore@5.3.2: {}\n\n  ignore@6.0.2: {}\n\n  image-meta@0.2.1: {}\n\n  importx@0.4.4:\n    dependencies:\n      bundle-require: 5.0.0(esbuild@0.23.1)\n      debug: 4.3.7\n      esbuild: 0.23.1\n      jiti: 2.0.0-beta.3\n      jiti-v1: jiti@1.21.6\n      pathe: 1.1.2\n      tsx: 4.19.1\n    transitivePeerDependencies:\n      - supports-color\n\n  impound@0.1.0(rollup@4.24.0)(webpack-sources@3.2.3):\n    dependencies:\n      '@rollup/pluginutils': 5.1.0(rollup@4.24.0)\n      mlly: 1.7.2\n      pathe: 1.1.2\n      unenv: 1.10.0\n      unplugin: 1.14.1(webpack-sources@3.2.3)\n    transitivePeerDependencies:\n      - rollup\n      - webpack-sources\n\n  inflight@1.0.6:\n    dependencies:\n      once: 1.4.0\n      wrappy: 1.0.2\n\n  inherits@2.0.3: {}\n\n  inherits@2.0.4: {}\n\n  ini@1.3.8: {}\n\n  ini@4.1.1: {}\n\n  internal-slot@1.0.6:\n    dependencies:\n      get-intrinsic: 1.2.2\n      hasown: 2.0.0\n      side-channel: 1.0.4\n\n  ioredis@5.4.1:\n    dependencies:\n      '@ioredis/commands': 1.2.0\n      cluster-key-slot: 1.1.2\n      debug: 4.3.7\n      denque: 2.1.0\n      lodash.defaults: 4.2.0\n      lodash.isarguments: 3.1.0\n      redis-errors: 1.2.0\n      redis-parser: 3.0.0\n      standard-as-callback: 2.1.0\n    transitivePeerDependencies:\n      - supports-color\n\n  iron-webcrypto@1.2.1: {}\n\n  is-array-buffer@3.0.2:\n    dependencies:\n      call-bind: 1.0.5\n      get-intrinsic: 1.2.2\n      is-typed-array: 1.1.12\n\n  is-bigint@1.0.4:\n    dependencies:\n      has-bigints: 1.0.2\n\n  is-binary-path@2.1.0:\n    dependencies:\n      binary-extensions: 2.2.0\n\n  is-boolean-object@1.1.2:\n    dependencies:\n      call-bind: 1.0.5\n      has-tostringtag: 1.0.0\n\n  is-callable@1.2.7: {}\n\n  is-core-module@2.13.1:\n    dependencies:\n      hasown: 2.0.0\n\n  is-date-object@1.0.5:\n    dependencies:\n      has-tostringtag: 1.0.0\n\n  is-docker@2.2.1: {}\n\n  is-docker@3.0.0: {}\n\n  is-extglob@2.1.1: {}\n\n  is-fullwidth-code-point@3.0.0: {}\n\n  is-generator-function@1.0.10:\n    dependencies:\n      has-tostringtag: 1.0.0\n\n  is-glob@4.0.3:\n    dependencies:\n      is-extglob: 2.1.1\n\n  is-inside-container@1.0.0:\n    dependencies:\n      is-docker: 3.0.0\n\n  is-installed-globally@1.0.0:\n    dependencies:\n      global-directory: 4.0.1\n      is-path-inside: 4.0.0\n\n  is-module@1.0.0: {}\n\n  is-negative-zero@2.0.2: {}\n\n  is-number-object@1.0.7:\n    dependencies:\n      has-tostringtag: 1.0.0\n\n  is-number@7.0.0: {}\n\n  is-obj@1.0.1: {}\n\n  is-path-inside@4.0.0: {}\n\n  is-reference@1.2.1:\n    dependencies:\n      '@types/estree': 1.0.6\n\n  is-regex@1.1.4:\n    dependencies:\n      call-bind: 1.0.5\n      has-tostringtag: 1.0.0\n\n  is-regexp@1.0.0: {}\n\n  is-shared-array-buffer@1.0.2:\n    dependencies:\n      call-bind: 1.0.5\n\n  is-ssh@1.4.0:\n    dependencies:\n      protocols: 2.0.1\n\n  is-stream@2.0.1: {}\n\n  is-stream@3.0.0: {}\n\n  is-string@1.0.7:\n    dependencies:\n      has-tostringtag: 1.0.0\n\n  is-symbol@1.0.4:\n    dependencies:\n      has-symbols: 1.0.3\n\n  is-typed-array@1.1.12:\n    dependencies:\n      which-typed-array: 1.1.13\n\n  is-weakref@1.0.2:\n    dependencies:\n      call-bind: 1.0.5\n\n  is-what@4.1.16: {}\n\n  is-wsl@2.2.0:\n    dependencies:\n      is-docker: 2.2.1\n\n  is-wsl@3.1.0:\n    dependencies:\n      is-inside-container: 1.0.0\n\n  is64bit@2.0.0:\n    dependencies:\n      system-architecture: 0.1.0\n\n  isarray@1.0.0: {}\n\n  isarray@2.0.5: {}\n\n  isexe@2.0.0: {}\n\n  itty-time@1.0.6: {}\n\n  jackspeak@2.3.6:\n    dependencies:\n      '@isaacs/cliui': 8.0.2\n    optionalDependencies:\n      '@pkgjs/parseargs': 0.11.0\n\n  jake@10.8.7:\n    dependencies:\n      async: 3.2.5\n      chalk: 4.1.2\n      filelist: 1.0.4\n      minimatch: 3.1.2\n\n  jest-worker@26.6.2:\n    dependencies:\n      '@types/node': 20.10.5\n      merge-stream: 2.0.0\n      supports-color: 7.2.0\n\n  jest-worker@27.5.1:\n    dependencies:\n      '@types/node': 20.10.5\n      merge-stream: 2.0.0\n      supports-color: 8.1.1\n\n  jiti@1.21.0: {}\n\n  jiti@1.21.6: {}\n\n  jiti@2.0.0-beta.3: {}\n\n  jiti@2.3.3: {}\n\n  jiti@2.4.1: {}\n\n  js-tokens@4.0.0: {}\n\n  js-tokens@9.0.0: {}\n\n  js-tokens@9.0.1: {}\n\n  js-yaml@4.1.0:\n    dependencies:\n      argparse: 2.0.1\n\n  jsesc@0.5.0: {}\n\n  jsesc@2.5.2: {}\n\n  jsesc@3.0.2: {}\n\n  json-parse-even-better-errors@2.3.1: {}\n\n  json-schema-traverse@0.4.1: {}\n\n  json-schema-traverse@1.0.0: {}\n\n  json-schema@0.4.0: {}\n\n  json5@2.2.3: {}\n\n  jsonc-parser@3.2.0: {}\n\n  jsonfile@6.1.0:\n    dependencies:\n      universalify: 2.0.1\n    optionalDependencies:\n      graceful-fs: 4.2.11\n\n  jsonpointer@5.0.1: {}\n\n  keygrip@1.1.0:\n    dependencies:\n      tsscmp: 1.0.6\n\n  kleur@3.0.3: {}\n\n  klona@2.0.6: {}\n\n  knitwork@1.1.0: {}\n\n  koa-compose@4.1.0: {}\n\n  koa-convert@2.0.0:\n    dependencies:\n      co: 4.6.0\n      koa-compose: 4.1.0\n\n  koa-send@5.0.1:\n    dependencies:\n      debug: 4.3.7\n      http-errors: 1.8.1\n      resolve-path: 1.4.0\n    transitivePeerDependencies:\n      - supports-color\n\n  koa-static@5.0.0:\n    dependencies:\n      debug: 3.2.7\n      koa-send: 5.0.1\n    transitivePeerDependencies:\n      - supports-color\n\n  koa@2.15.3:\n    dependencies:\n      accepts: 1.3.8\n      cache-content-type: 1.0.1\n      content-disposition: 0.5.4\n      content-type: 1.0.5\n      cookies: 0.9.1\n      debug: 4.3.7\n      delegates: 1.0.0\n      depd: 2.0.0\n      destroy: 1.2.0\n      encodeurl: 1.0.2\n      escape-html: 1.0.3\n      fresh: 0.5.2\n      http-assert: 1.5.0\n      http-errors: 1.8.1\n      is-generator-function: 1.0.10\n      koa-compose: 4.1.0\n      koa-convert: 2.0.0\n      on-finished: 2.4.1\n      only: 0.0.2\n      parseurl: 1.3.3\n      statuses: 1.5.0\n      type-is: 1.6.18\n      vary: 1.1.2\n    transitivePeerDependencies:\n      - supports-color\n\n  kolorist@1.8.0: {}\n\n  launch-editor@2.9.1:\n    dependencies:\n      picocolors: 1.1.0\n      shell-quote: 1.8.1\n\n  lazystream@1.0.1:\n    dependencies:\n      readable-stream: 2.3.8\n\n  leven@3.1.0: {}\n\n  lilconfig@2.1.0: {}\n\n  lilconfig@3.0.0: {}\n\n  lilconfig@3.1.2: {}\n\n  lines-and-columns@1.2.4: {}\n\n  linkify-it@4.0.1:\n    dependencies:\n      uc.micro: 1.0.6\n\n  linkify-it@5.0.0:\n    dependencies:\n      uc.micro: 2.1.0\n\n  listhen@1.9.0:\n    dependencies:\n      '@parcel/watcher': 2.4.1\n      '@parcel/watcher-wasm': 2.4.1\n      citty: 0.1.6\n      clipboardy: 4.0.0\n      consola: 3.2.3\n      crossws: 0.3.1\n      defu: 6.1.4\n      get-port-please: 3.1.2\n      h3: 1.13.0\n      http-shutdown: 1.2.2\n      jiti: 2.4.1\n      mlly: 1.7.3\n      node-forge: 1.3.1\n      pathe: 1.1.2\n      std-env: 3.8.0\n      ufo: 1.5.4\n      untun: 0.1.3\n      uqr: 0.1.2\n\n  load-tsconfig@0.2.5: {}\n\n  loader-runner@4.3.0: {}\n\n  local-pkg@0.5.0:\n    dependencies:\n      mlly: 1.4.2\n      pkg-types: 1.0.3\n\n  local-pkg@0.5.1:\n    dependencies:\n      mlly: 1.7.3\n      pkg-types: 1.2.1\n\n  lodash.castarray@4.4.0: {}\n\n  lodash.debounce@4.0.8: {}\n\n  lodash.defaults@4.2.0: {}\n\n  lodash.isarguments@3.1.0: {}\n\n  lodash.isplainobject@4.0.6: {}\n\n  lodash.memoize@4.1.2: {}\n\n  lodash.merge@4.6.2: {}\n\n  lodash.sortby@4.7.0: {}\n\n  lodash.uniq@4.5.0: {}\n\n  lodash@4.17.21: {}\n\n  lru-cache@10.4.3: {}\n\n  lru-cache@5.1.1:\n    dependencies:\n      yallist: 3.1.1\n\n  lru-cache@6.0.0:\n    dependencies:\n      yallist: 4.0.0\n\n  magic-string-ast@0.6.2:\n    dependencies:\n      magic-string: 0.30.12\n\n  magic-string@0.25.9:\n    dependencies:\n      sourcemap-codec: 1.4.8\n\n  magic-string@0.30.12:\n    dependencies:\n      '@jridgewell/sourcemap-codec': 1.5.0\n\n  magic-string@0.30.14:\n    dependencies:\n      '@jridgewell/sourcemap-codec': 1.5.0\n\n  magicast@0.3.5:\n    dependencies:\n      '@babel/parser': 7.25.8\n      '@babel/types': 7.25.8\n      source-map-js: 1.2.1\n\n  make-dir@3.1.0:\n    dependencies:\n      semver: 6.3.1\n\n  markdown-it@13.0.2:\n    dependencies:\n      argparse: 2.0.1\n      entities: 3.0.1\n      linkify-it: 4.0.1\n      mdurl: 1.0.1\n      uc.micro: 1.0.6\n\n  markdown-it@14.1.0:\n    dependencies:\n      argparse: 2.0.1\n      entities: 4.5.0\n      linkify-it: 5.0.0\n      mdurl: 2.0.0\n      punycode.js: 2.3.1\n      uc.micro: 2.1.0\n\n  mdast-util-to-hast@13.2.0:\n    dependencies:\n      '@types/hast': 3.0.4\n      '@types/mdast': 4.0.4\n      '@ungap/structured-clone': 1.2.0\n      devlop: 1.1.0\n      micromark-util-sanitize-uri: 2.0.0\n      trim-lines: 3.0.1\n      unist-util-position: 5.0.0\n      unist-util-visit: 5.0.0\n      vfile: 6.0.3\n\n  mdn-data@2.0.28: {}\n\n  mdn-data@2.0.30: {}\n\n  mdurl@1.0.1: {}\n\n  mdurl@2.0.0: {}\n\n  media-typer@0.3.0: {}\n\n  merge-stream@2.0.0: {}\n\n  merge2@1.4.1: {}\n\n  methods@1.1.2: {}\n\n  micromark-util-character@2.1.0:\n    dependencies:\n      micromark-util-symbol: 2.0.0\n      micromark-util-types: 2.0.0\n\n  micromark-util-encode@2.0.0: {}\n\n  micromark-util-sanitize-uri@2.0.0:\n    dependencies:\n      micromark-util-character: 2.1.0\n      micromark-util-encode: 2.0.0\n      micromark-util-symbol: 2.0.0\n\n  micromark-util-symbol@2.0.0: {}\n\n  micromark-util-types@2.0.0: {}\n\n  micromatch@4.0.5:\n    dependencies:\n      braces: 3.0.2\n      picomatch: 2.3.1\n\n  mime-db@1.52.0: {}\n\n  mime-types@2.1.35:\n    dependencies:\n      mime-db: 1.52.0\n\n  mime@1.6.0: {}\n\n  mime@3.0.0: {}\n\n  mime@4.0.4: {}\n\n  mimic-fn@4.0.0: {}\n\n  miniflare@3.20241106.1:\n    dependencies:\n      '@cspotcode/source-map-support': 0.8.1\n      acorn: 8.14.0\n      acorn-walk: 8.3.4\n      capnp-ts: 0.7.0\n      exit-hook: 2.2.1\n      glob-to-regexp: 0.4.1\n      stoppable: 1.1.0\n      undici: 5.28.4\n      workerd: 1.20241106.1\n      ws: 8.18.0\n      youch: 3.3.4\n      zod: 3.23.8\n    transitivePeerDependencies:\n      - bufferutil\n      - supports-color\n      - utf-8-validate\n\n  minimatch@3.1.2:\n    dependencies:\n      brace-expansion: 1.1.11\n\n  minimatch@5.1.6:\n    dependencies:\n      brace-expansion: 2.0.1\n\n  minimatch@9.0.3:\n    dependencies:\n      brace-expansion: 2.0.1\n\n  minimatch@9.0.5:\n    dependencies:\n      brace-expansion: 2.0.1\n\n  minimist@1.2.8: {}\n\n  minipass@3.3.6:\n    dependencies:\n      yallist: 4.0.0\n\n  minipass@5.0.0: {}\n\n  minipass@7.0.4: {}\n\n  minizlib@2.1.2:\n    dependencies:\n      minipass: 3.3.6\n      yallist: 4.0.0\n\n  mitt@3.0.1: {}\n\n  mkdirp@0.5.6:\n    dependencies:\n      minimist: 1.2.8\n\n  mkdirp@1.0.4: {}\n\n  mlly@1.4.2:\n    dependencies:\n      acorn: 8.11.3\n      pathe: 1.1.2\n      pkg-types: 1.0.3\n      ufo: 1.5.4\n\n  mlly@1.7.2:\n    dependencies:\n      acorn: 8.12.1\n      pathe: 1.1.2\n      pkg-types: 1.2.1\n      ufo: 1.5.4\n\n  mlly@1.7.3:\n    dependencies:\n      acorn: 8.14.0\n      pathe: 1.1.2\n      pkg-types: 1.2.1\n      ufo: 1.5.4\n\n  modern-screenshot@4.4.39: {}\n\n  mp4-muxer@2.3.0:\n    dependencies:\n      '@types/dom-webcodecs': 0.1.11\n      '@types/wicg-file-system-access': 2020.9.8\n\n  mri@1.2.0: {}\n\n  mrmime@2.0.0: {}\n\n  ms@2.0.0: {}\n\n  ms@2.1.3: {}\n\n  muggle-string@0.4.1: {}\n\n  multimath@2.0.0:\n    dependencies:\n      glur: 1.1.2\n      object-assign: 4.1.1\n\n  mustache@4.2.0: {}\n\n  mz@2.7.0:\n    dependencies:\n      any-promise: 1.3.0\n      object-assign: 4.1.1\n      thenify-all: 1.6.0\n\n  nanoid@3.3.7: {}\n\n  nanoid@5.0.9: {}\n\n  nanotar@0.1.1: {}\n\n  negotiator@0.6.3: {}\n\n  neo-async@2.6.2: {}\n\n  nitro-cloudflare-dev@0.2.1:\n    dependencies:\n      consola: 3.2.3\n      mlly: 1.7.2\n      pkg-types: 1.2.1\n\n  nitropack@2.9.7(drizzle-orm@0.36.4(@cloudflare/workers-types@4.20241127.0)(@types/pg@8.11.10)(pg@8.13.1)(postgres@3.4.5))(magicast@0.3.5)(webpack-sources@3.2.3):\n    dependencies:\n      '@cloudflare/kv-asset-handler': 0.3.4\n      '@netlify/functions': 2.8.2\n      '@rollup/plugin-alias': 5.1.1(rollup@4.24.0)\n      '@rollup/plugin-commonjs': 25.0.8(rollup@4.24.0)\n      '@rollup/plugin-inject': 5.0.5(rollup@4.24.0)\n      '@rollup/plugin-json': 6.1.0(rollup@4.24.0)\n      '@rollup/plugin-node-resolve': 15.3.0(rollup@4.24.0)\n      '@rollup/plugin-replace': 5.0.7(rollup@4.24.0)\n      '@rollup/plugin-terser': 0.4.4(rollup@4.24.0)\n      '@rollup/pluginutils': 5.1.0(rollup@4.24.0)\n      '@types/http-proxy': 1.17.15\n      '@vercel/nft': 0.26.5\n      archiver: 7.0.1\n      c12: 1.11.2(magicast@0.3.5)\n      chalk: 5.3.0\n      chokidar: 3.6.0\n      citty: 0.1.6\n      consola: 3.2.3\n      cookie-es: 1.2.2\n      croner: 8.1.2\n      crossws: 0.2.4\n      db0: 0.1.4(drizzle-orm@0.36.4(@cloudflare/workers-types@4.20241127.0)(@types/pg@8.11.10)(pg@8.13.1)(postgres@3.4.5))\n      defu: 6.1.4\n      destr: 2.0.3\n      dot-prop: 8.0.2\n      esbuild: 0.20.2\n      escape-string-regexp: 5.0.0\n      etag: 1.8.1\n      fs-extra: 11.2.0\n      globby: 14.0.2\n      gzip-size: 7.0.0\n      h3: 1.13.0\n      hookable: 5.5.3\n      httpxy: 0.1.5\n      ioredis: 5.4.1\n      jiti: 1.21.6\n      klona: 2.0.6\n      knitwork: 1.1.0\n      listhen: 1.9.0\n      magic-string: 0.30.12\n      mime: 4.0.4\n      mlly: 1.7.2\n      mri: 1.2.0\n      node-fetch-native: 1.6.4\n      ofetch: 1.4.1\n      ohash: 1.1.4\n      openapi-typescript: 6.7.6\n      pathe: 1.1.2\n      perfect-debounce: 1.0.0\n      pkg-types: 1.2.1\n      pretty-bytes: 6.1.1\n      radix3: 1.1.2\n      rollup: 4.24.0\n      rollup-plugin-visualizer: 5.12.0(rollup@4.24.0)\n      scule: 1.3.0\n      semver: 7.6.3\n      serve-placeholder: 2.0.2\n      serve-static: 1.16.2\n      std-env: 3.7.0\n      ufo: 1.5.4\n      uncrypto: 0.1.3\n      unctx: 2.3.1(webpack-sources@3.2.3)\n      unenv: 1.10.0\n      unimport: 3.13.1(rollup@4.24.0)(webpack-sources@3.2.3)\n      unstorage: 1.13.1(ioredis@5.4.1)\n      unwasm: 0.3.9(webpack-sources@3.2.3)\n    transitivePeerDependencies:\n      - '@azure/app-configuration'\n      - '@azure/cosmos'\n      - '@azure/data-tables'\n      - '@azure/identity'\n      - '@azure/keyvault-secrets'\n      - '@azure/storage-blob'\n      - '@capacitor/preferences'\n      - '@libsql/client'\n      - '@netlify/blobs'\n      - '@planetscale/database'\n      - '@upstash/redis'\n      - '@vercel/kv'\n      - better-sqlite3\n      - drizzle-orm\n      - encoding\n      - idb-keyval\n      - magicast\n      - supports-color\n      - uWebSockets.js\n      - webpack-sources\n\n  node-addon-api@7.1.1: {}\n\n  node-fetch-native@1.6.4: {}\n\n  node-fetch@2.7.0:\n    dependencies:\n      whatwg-url: 5.0.0\n\n  node-forge@1.3.1: {}\n\n  node-gyp-build@4.8.2: {}\n\n  node-releases@2.0.18: {}\n\n  nopt@5.0.0:\n    dependencies:\n      abbrev: 1.1.1\n\n  normalize-path@3.0.0: {}\n\n  normalize-range@0.1.2: {}\n\n  npm-run-path@4.0.1:\n    dependencies:\n      path-key: 3.1.1\n\n  npm-run-path@5.3.0:\n    dependencies:\n      path-key: 4.0.0\n\n  npmlog@5.0.1:\n    dependencies:\n      are-we-there-yet: 2.0.0\n      console-control-strings: 1.1.0\n      gauge: 3.0.2\n      set-blocking: 2.0.0\n\n  nth-check@2.1.1:\n    dependencies:\n      boolbase: 1.0.0\n\n  nuxi@3.15.0: {}\n\n  nuxt@3.13.2(@parcel/watcher@2.4.1)(@types/node@20.10.5)(drizzle-orm@0.36.4(@cloudflare/workers-types@4.20241127.0)(@types/pg@8.11.10)(pg@8.13.1)(postgres@3.4.5))(ioredis@5.4.1)(magicast@0.3.5)(rollup@4.24.0)(terser@5.26.0)(typescript@5.6.3)(vite@5.4.8(@types/node@20.10.5)(terser@5.26.0))(vue-tsc@2.1.6(typescript@5.6.3))(webpack-sources@3.2.3):\n    dependencies:\n      '@nuxt/devalue': 2.0.2\n      '@nuxt/devtools': 1.6.0(rollup@4.24.0)(vite@5.4.8(@types/node@20.10.5)(terser@5.26.0))(vue@3.5.12(typescript@5.6.3))(webpack-sources@3.2.3)\n      '@nuxt/kit': 3.13.2(magicast@0.3.5)(rollup@4.24.0)(webpack-sources@3.2.3)\n      '@nuxt/schema': 3.13.2(rollup@4.24.0)(webpack-sources@3.2.3)\n      '@nuxt/telemetry': 2.6.0(magicast@0.3.5)(rollup@4.24.0)(webpack-sources@3.2.3)\n      '@nuxt/vite-builder': 3.13.2(@types/node@20.10.5)(magicast@0.3.5)(rollup@4.24.0)(terser@5.26.0)(typescript@5.6.3)(vue-tsc@2.1.6(typescript@5.6.3))(vue@3.5.12(typescript@5.6.3))(webpack-sources@3.2.3)\n      '@unhead/dom': 1.11.7\n      '@unhead/shared': 1.11.7\n      '@unhead/ssr': 1.11.7\n      '@unhead/vue': 1.11.13(vue@3.5.12(typescript@5.6.3))\n      '@vue/shared': 3.5.12\n      acorn: 8.12.1\n      c12: 1.11.2(magicast@0.3.5)\n      chokidar: 3.6.0\n      compatx: 0.1.8\n      consola: 3.2.3\n      cookie-es: 1.2.2\n      defu: 6.1.4\n      destr: 2.0.3\n      devalue: 5.1.1\n      errx: 0.1.0\n      esbuild: 0.23.1\n      escape-string-regexp: 5.0.0\n      estree-walker: 3.0.3\n      globby: 14.0.2\n      h3: 1.13.0\n      hookable: 5.5.3\n      ignore: 5.3.2\n      impound: 0.1.0(rollup@4.24.0)(webpack-sources@3.2.3)\n      jiti: 1.21.6\n      klona: 2.0.6\n      knitwork: 1.1.0\n      magic-string: 0.30.12\n      mlly: 1.7.2\n      nanotar: 0.1.1\n      nitropack: 2.9.7(drizzle-orm@0.36.4(@cloudflare/workers-types@4.20241127.0)(@types/pg@8.11.10)(pg@8.13.1)(postgres@3.4.5))(magicast@0.3.5)(webpack-sources@3.2.3)\n      nuxi: 3.15.0\n      nypm: 0.3.12\n      ofetch: 1.4.1\n      ohash: 1.1.4\n      pathe: 1.1.2\n      perfect-debounce: 1.0.0\n      pkg-types: 1.2.1\n      radix3: 1.1.2\n      scule: 1.3.0\n      semver: 7.6.3\n      std-env: 3.7.0\n      strip-literal: 2.1.0\n      tinyglobby: 0.2.6\n      ufo: 1.5.4\n      ultrahtml: 1.5.3\n      uncrypto: 0.1.3\n      unctx: 2.3.1(webpack-sources@3.2.3)\n      unenv: 1.10.0\n      unhead: 1.11.7\n      unimport: 3.13.1(rollup@4.24.0)(webpack-sources@3.2.3)\n      unplugin: 1.14.1(webpack-sources@3.2.3)\n      unplugin-vue-router: 0.10.8(rollup@4.24.0)(vue-router@4.4.5(vue@3.5.12(typescript@5.6.3)))(vue@3.5.12(typescript@5.6.3))(webpack-sources@3.2.3)\n      unstorage: 1.13.1(ioredis@5.4.1)\n      untyped: 1.5.1\n      vue: 3.5.12(typescript@5.6.3)\n      vue-bundle-renderer: 2.1.1\n      vue-devtools-stub: 0.1.0\n      vue-router: 4.4.5(vue@3.5.12(typescript@5.6.3))\n    optionalDependencies:\n      '@parcel/watcher': 2.4.1\n      '@types/node': 20.10.5\n    transitivePeerDependencies:\n      - '@azure/app-configuration'\n      - '@azure/cosmos'\n      - '@azure/data-tables'\n      - '@azure/identity'\n      - '@azure/keyvault-secrets'\n      - '@azure/storage-blob'\n      - '@biomejs/biome'\n      - '@capacitor/preferences'\n      - '@libsql/client'\n      - '@netlify/blobs'\n      - '@planetscale/database'\n      - '@upstash/redis'\n      - '@vercel/kv'\n      - better-sqlite3\n      - bufferutil\n      - drizzle-orm\n      - encoding\n      - eslint\n      - idb-keyval\n      - ioredis\n      - less\n      - lightningcss\n      - magicast\n      - meow\n      - optionator\n      - rollup\n      - sass\n      - sass-embedded\n      - stylelint\n      - stylus\n      - sugarss\n      - supports-color\n      - terser\n      - typescript\n      - uWebSockets.js\n      - utf-8-validate\n      - vite\n      - vls\n      - vti\n      - vue-tsc\n      - webpack-sources\n      - xml2js\n\n  nypm@0.3.12:\n    dependencies:\n      citty: 0.1.6\n      consola: 3.2.3\n      execa: 8.0.1\n      pathe: 1.1.2\n      pkg-types: 1.2.1\n      ufo: 1.5.4\n\n  object-assign@4.1.1: {}\n\n  object-hash@3.0.0: {}\n\n  object-inspect@1.13.1: {}\n\n  object-keys@1.1.1: {}\n\n  object.assign@4.1.5:\n    dependencies:\n      call-bind: 1.0.5\n      define-properties: 1.2.1\n      has-symbols: 1.0.3\n      object-keys: 1.1.1\n\n  obuf@1.1.2:\n    optional: true\n\n  ofetch@1.4.1:\n    dependencies:\n      destr: 2.0.3\n      node-fetch-native: 1.6.4\n      ufo: 1.5.4\n\n  ohash@1.1.4: {}\n\n  on-finished@2.4.1:\n    dependencies:\n      ee-first: 1.1.1\n\n  once@1.4.0:\n    dependencies:\n      wrappy: 1.0.2\n\n  onetime@6.0.0:\n    dependencies:\n      mimic-fn: 4.0.0\n\n  oniguruma-to-es@0.7.0:\n    dependencies:\n      emoji-regex-xs: 1.0.0\n      regex: 5.0.2\n      regex-recursion: 4.3.0\n\n  oniguruma-to-js@0.4.3:\n    dependencies:\n      regex: 4.3.3\n\n  only@0.0.2: {}\n\n  open@10.1.0:\n    dependencies:\n      default-browser: 5.2.1\n      define-lazy-prop: 3.0.0\n      is-inside-container: 1.0.0\n      is-wsl: 3.1.0\n\n  open@7.4.2:\n    dependencies:\n      is-docker: 2.2.1\n      is-wsl: 2.2.0\n\n  open@8.4.2:\n    dependencies:\n      define-lazy-prop: 2.0.0\n      is-docker: 2.2.1\n      is-wsl: 2.2.0\n\n  openapi-typescript@6.7.6:\n    dependencies:\n      ansi-colors: 4.1.3\n      fast-glob: 3.3.2\n      js-yaml: 4.1.0\n      supports-color: 9.4.0\n      undici: 5.28.4\n      yargs-parser: 21.1.1\n\n  package-manager-detector@0.2.2: {}\n\n  parse-git-config@3.0.0:\n    dependencies:\n      git-config-path: 2.0.0\n      ini: 1.3.8\n\n  parse-path@7.0.0:\n    dependencies:\n      protocols: 2.0.1\n\n  parse-url@8.1.0:\n    dependencies:\n      parse-path: 7.0.0\n\n  parseurl@1.3.3: {}\n\n  path-browserify@1.0.1: {}\n\n  path-is-absolute@1.0.1: {}\n\n  path-key@3.1.1: {}\n\n  path-key@4.0.0: {}\n\n  path-parse@1.0.7: {}\n\n  path-scurry@1.10.1:\n    dependencies:\n      lru-cache: 10.4.3\n      minipass: 7.0.4\n\n  path-to-regexp@6.3.0: {}\n\n  path-type@5.0.0: {}\n\n  pathe@1.1.2: {}\n\n  perfect-debounce@1.0.0: {}\n\n  pg-cloudflare@1.1.1:\n    optional: true\n\n  pg-connection-string@2.7.0:\n    optional: true\n\n  pg-int8@1.0.1:\n    optional: true\n\n  pg-numeric@1.0.2:\n    optional: true\n\n  pg-pool@3.7.0(pg@8.13.1):\n    dependencies:\n      pg: 8.13.1\n    optional: true\n\n  pg-protocol@1.7.0:\n    optional: true\n\n  pg-types@2.2.0:\n    dependencies:\n      pg-int8: 1.0.1\n      postgres-array: 2.0.0\n      postgres-bytea: 1.0.0\n      postgres-date: 1.0.7\n      postgres-interval: 1.2.0\n    optional: true\n\n  pg-types@4.0.2:\n    dependencies:\n      pg-int8: 1.0.1\n      pg-numeric: 1.0.2\n      postgres-array: 3.0.2\n      postgres-bytea: 3.0.0\n      postgres-date: 2.1.0\n      postgres-interval: 3.0.0\n      postgres-range: 1.1.4\n    optional: true\n\n  pg@8.13.1:\n    dependencies:\n      pg-connection-string: 2.7.0\n      pg-pool: 3.7.0(pg@8.13.1)\n      pg-protocol: 1.7.0\n      pg-types: 2.2.0\n      pgpass: 1.0.5\n    optionalDependencies:\n      pg-cloudflare: 1.1.1\n    optional: true\n\n  pgpass@1.0.5:\n    dependencies:\n      split2: 4.2.0\n    optional: true\n\n  pica@7.1.0:\n    dependencies:\n      glur: 1.1.2\n      inherits: 2.0.4\n      multimath: 2.0.0\n      object-assign: 4.1.1\n      webworkify: 1.5.0\n\n  picocolors@1.1.0: {}\n\n  picomatch@2.3.1: {}\n\n  picomatch@4.0.2: {}\n\n  pify@2.3.0: {}\n\n  pinia@2.2.4(typescript@5.6.3)(vue@3.5.12(typescript@5.6.3)):\n    dependencies:\n      '@vue/devtools-api': 6.6.4\n      vue: 3.5.12(typescript@5.6.3)\n      vue-demi: 0.14.10(vue@3.5.12(typescript@5.6.3))\n    optionalDependencies:\n      typescript: 5.6.3\n\n  pirates@4.0.6: {}\n\n  pkg-types@1.0.3:\n    dependencies:\n      jsonc-parser: 3.2.0\n      mlly: 1.4.2\n      pathe: 1.1.2\n\n  pkg-types@1.2.1:\n    dependencies:\n      confbox: 0.1.8\n      mlly: 1.7.2\n      pathe: 1.1.2\n\n  portfinder@1.0.32:\n    dependencies:\n      async: 2.6.4\n      debug: 3.2.7\n      mkdirp: 0.5.6\n    transitivePeerDependencies:\n      - supports-color\n\n  postcss-calc@10.0.2(postcss@8.4.47):\n    dependencies:\n      postcss: 8.4.47\n      postcss-selector-parser: 6.1.2\n      postcss-value-parser: 4.2.0\n\n  postcss-colormin@7.0.2(postcss@8.4.47):\n    dependencies:\n      browserslist: 4.24.0\n      caniuse-api: 3.0.0\n      colord: 2.9.3\n      postcss: 8.4.47\n      postcss-value-parser: 4.2.0\n\n  postcss-convert-values@7.0.4(postcss@8.4.47):\n    dependencies:\n      browserslist: 4.24.0\n      postcss: 8.4.47\n      postcss-value-parser: 4.2.0\n\n  postcss-discard-comments@7.0.3(postcss@8.4.47):\n    dependencies:\n      postcss: 8.4.47\n      postcss-selector-parser: 6.1.2\n\n  postcss-discard-duplicates@7.0.1(postcss@8.4.47):\n    dependencies:\n      postcss: 8.4.47\n\n  postcss-discard-empty@7.0.0(postcss@8.4.47):\n    dependencies:\n      postcss: 8.4.47\n\n  postcss-discard-overridden@7.0.0(postcss@8.4.47):\n    dependencies:\n      postcss: 8.4.47\n\n  postcss-import@15.1.0(postcss@8.4.47):\n    dependencies:\n      postcss: 8.4.47\n      postcss-value-parser: 4.2.0\n      read-cache: 1.0.0\n      resolve: 1.22.8\n\n  postcss-js@4.0.1(postcss@8.4.47):\n    dependencies:\n      camelcase-css: 2.0.1\n      postcss: 8.4.47\n\n  postcss-load-config@4.0.2(postcss@8.4.47):\n    dependencies:\n      lilconfig: 3.0.0\n      yaml: 2.3.4\n    optionalDependencies:\n      postcss: 8.4.47\n\n  postcss-merge-longhand@7.0.4(postcss@8.4.47):\n    dependencies:\n      postcss: 8.4.47\n      postcss-value-parser: 4.2.0\n      stylehacks: 7.0.4(postcss@8.4.47)\n\n  postcss-merge-rules@7.0.4(postcss@8.4.47):\n    dependencies:\n      browserslist: 4.24.0\n      caniuse-api: 3.0.0\n      cssnano-utils: 5.0.0(postcss@8.4.47)\n      postcss: 8.4.47\n      postcss-selector-parser: 6.1.2\n\n  postcss-minify-font-values@7.0.0(postcss@8.4.47):\n    dependencies:\n      postcss: 8.4.47\n      postcss-value-parser: 4.2.0\n\n  postcss-minify-gradients@7.0.0(postcss@8.4.47):\n    dependencies:\n      colord: 2.9.3\n      cssnano-utils: 5.0.0(postcss@8.4.47)\n      postcss: 8.4.47\n      postcss-value-parser: 4.2.0\n\n  postcss-minify-params@7.0.2(postcss@8.4.47):\n    dependencies:\n      browserslist: 4.24.0\n      cssnano-utils: 5.0.0(postcss@8.4.47)\n      postcss: 8.4.47\n      postcss-value-parser: 4.2.0\n\n  postcss-minify-selectors@7.0.4(postcss@8.4.47):\n    dependencies:\n      cssesc: 3.0.0\n      postcss: 8.4.47\n      postcss-selector-parser: 6.1.2\n\n  postcss-nested@6.0.1(postcss@8.4.47):\n    dependencies:\n      postcss: 8.4.47\n      postcss-selector-parser: 6.0.15\n\n  postcss-nesting@13.0.0(postcss@8.4.47):\n    dependencies:\n      '@csstools/selector-resolve-nested': 2.0.0(postcss-selector-parser@6.1.2)\n      '@csstools/selector-specificity': 4.0.0(postcss-selector-parser@6.1.2)\n      postcss: 8.4.47\n      postcss-selector-parser: 6.1.2\n\n  postcss-normalize-charset@7.0.0(postcss@8.4.47):\n    dependencies:\n      postcss: 8.4.47\n\n  postcss-normalize-display-values@7.0.0(postcss@8.4.47):\n    dependencies:\n      postcss: 8.4.47\n      postcss-value-parser: 4.2.0\n\n  postcss-normalize-positions@7.0.0(postcss@8.4.47):\n    dependencies:\n      postcss: 8.4.47\n      postcss-value-parser: 4.2.0\n\n  postcss-normalize-repeat-style@7.0.0(postcss@8.4.47):\n    dependencies:\n      postcss: 8.4.47\n      postcss-value-parser: 4.2.0\n\n  postcss-normalize-string@7.0.0(postcss@8.4.47):\n    dependencies:\n      postcss: 8.4.47\n      postcss-value-parser: 4.2.0\n\n  postcss-normalize-timing-functions@7.0.0(postcss@8.4.47):\n    dependencies:\n      postcss: 8.4.47\n      postcss-value-parser: 4.2.0\n\n  postcss-normalize-unicode@7.0.2(postcss@8.4.47):\n    dependencies:\n      browserslist: 4.24.0\n      postcss: 8.4.47\n      postcss-value-parser: 4.2.0\n\n  postcss-normalize-url@7.0.0(postcss@8.4.47):\n    dependencies:\n      postcss: 8.4.47\n      postcss-value-parser: 4.2.0\n\n  postcss-normalize-whitespace@7.0.0(postcss@8.4.47):\n    dependencies:\n      postcss: 8.4.47\n      postcss-value-parser: 4.2.0\n\n  postcss-ordered-values@7.0.1(postcss@8.4.47):\n    dependencies:\n      cssnano-utils: 5.0.0(postcss@8.4.47)\n      postcss: 8.4.47\n      postcss-value-parser: 4.2.0\n\n  postcss-reduce-initial@7.0.2(postcss@8.4.47):\n    dependencies:\n      browserslist: 4.24.0\n      caniuse-api: 3.0.0\n      postcss: 8.4.47\n\n  postcss-reduce-transforms@7.0.0(postcss@8.4.47):\n    dependencies:\n      postcss: 8.4.47\n      postcss-value-parser: 4.2.0\n\n  postcss-selector-parser@6.0.10:\n    dependencies:\n      cssesc: 3.0.0\n      util-deprecate: 1.0.2\n\n  postcss-selector-parser@6.0.15:\n    dependencies:\n      cssesc: 3.0.0\n      util-deprecate: 1.0.2\n\n  postcss-selector-parser@6.1.2:\n    dependencies:\n      cssesc: 3.0.0\n      util-deprecate: 1.0.2\n\n  postcss-svgo@7.0.1(postcss@8.4.47):\n    dependencies:\n      postcss: 8.4.47\n      postcss-value-parser: 4.2.0\n      svgo: 3.3.2\n\n  postcss-unique-selectors@7.0.3(postcss@8.4.47):\n    dependencies:\n      postcss: 8.4.47\n      postcss-selector-parser: 6.1.2\n\n  postcss-value-parser@4.2.0: {}\n\n  postcss@8.4.47:\n    dependencies:\n      nanoid: 3.3.7\n      picocolors: 1.1.0\n      source-map-js: 1.2.1\n\n  postgres-array@2.0.0:\n    optional: true\n\n  postgres-array@3.0.2:\n    optional: true\n\n  postgres-bytea@1.0.0:\n    optional: true\n\n  postgres-bytea@3.0.0:\n    dependencies:\n      obuf: 1.1.2\n    optional: true\n\n  postgres-date@1.0.7:\n    optional: true\n\n  postgres-date@2.1.0:\n    optional: true\n\n  postgres-interval@1.2.0:\n    dependencies:\n      xtend: 4.0.2\n    optional: true\n\n  postgres-interval@3.0.0:\n    optional: true\n\n  postgres-range@1.1.4:\n    optional: true\n\n  postgres@3.4.5: {}\n\n  prettier-plugin-tailwindcss@0.6.8(prettier@3.3.3):\n    dependencies:\n      prettier: 3.3.3\n\n  prettier@3.3.3: {}\n\n  pretty-bytes@5.6.0: {}\n\n  pretty-bytes@6.1.1: {}\n\n  printable-characters@1.0.42: {}\n\n  process-nextick-args@2.0.1: {}\n\n  process@0.11.10: {}\n\n  prompts@2.4.2:\n    dependencies:\n      kleur: 3.0.3\n      sisteransi: 1.0.5\n\n  property-information@6.5.0: {}\n\n  protocols@2.0.1: {}\n\n  punycode.js@2.3.1: {}\n\n  punycode@2.3.1: {}\n\n  queue-microtask@1.2.3: {}\n\n  queue-tick@1.0.1: {}\n\n  radix-vue@1.7.3(vue@3.5.12(typescript@5.6.3)):\n    dependencies:\n      '@floating-ui/dom': 1.6.3\n      '@floating-ui/vue': 1.0.6(vue@3.5.12(typescript@5.6.3))\n      '@internationalized/date': 3.5.2\n      '@tanstack/vue-virtual': 3.3.0(vue@3.5.12(typescript@5.6.3))\n      '@vueuse/core': 10.7.0(vue@3.5.12(typescript@5.6.3))\n      '@vueuse/shared': 10.7.0(vue@3.5.12(typescript@5.6.3))\n      aria-hidden: 1.2.4\n      defu: 6.1.4\n      fast-deep-equal: 3.1.3\n      nanoid: 5.0.9\n      vue: 3.5.12(typescript@5.6.3)\n    transitivePeerDependencies:\n      - '@vue/composition-api'\n\n  radix3@1.1.2: {}\n\n  randombytes@2.1.0:\n    dependencies:\n      safe-buffer: 5.2.1\n\n  range-parser@1.2.1: {}\n\n  rc9@2.1.2:\n    dependencies:\n      defu: 6.1.4\n      destr: 2.0.3\n\n  read-cache@1.0.0:\n    dependencies:\n      pify: 2.3.0\n\n  readable-stream@2.3.8:\n    dependencies:\n      core-util-is: 1.0.3\n      inherits: 2.0.4\n      isarray: 1.0.0\n      process-nextick-args: 2.0.1\n      safe-buffer: 5.1.2\n      string_decoder: 1.1.1\n      util-deprecate: 1.0.2\n\n  readable-stream@3.6.2:\n    dependencies:\n      inherits: 2.0.4\n      string_decoder: 1.3.0\n      util-deprecate: 1.0.2\n\n  readable-stream@4.5.2:\n    dependencies:\n      abort-controller: 3.0.0\n      buffer: 6.0.3\n      events: 3.3.0\n      process: 0.11.10\n      string_decoder: 1.3.0\n\n  readdir-glob@1.1.3:\n    dependencies:\n      minimatch: 5.1.6\n\n  readdirp@3.6.0:\n    dependencies:\n      picomatch: 2.3.1\n\n  readdirp@4.0.2: {}\n\n  redis-errors@1.2.0: {}\n\n  redis-parser@3.0.0:\n    dependencies:\n      redis-errors: 1.2.0\n\n  regenerate-unicode-properties@10.1.1:\n    dependencies:\n      regenerate: 1.4.2\n\n  regenerate@1.4.2: {}\n\n  regenerator-runtime@0.14.1: {}\n\n  regenerator-transform@0.15.2:\n    dependencies:\n      '@babel/runtime': 7.23.7\n\n  regex-recursion@4.3.0:\n    dependencies:\n      regex-utilities: 2.3.0\n\n  regex-utilities@2.3.0: {}\n\n  regex@4.3.3: {}\n\n  regex@5.0.2:\n    dependencies:\n      regex-utilities: 2.3.0\n\n  regexp.prototype.flags@1.5.1:\n    dependencies:\n      call-bind: 1.0.5\n      define-properties: 1.2.1\n      set-function-name: 2.0.1\n\n  regexpu-core@5.3.2:\n    dependencies:\n      '@babel/regjsgen': 0.8.0\n      regenerate: 1.4.2\n      regenerate-unicode-properties: 10.1.1\n      regjsparser: 0.9.1\n      unicode-match-property-ecmascript: 2.0.0\n      unicode-match-property-value-ecmascript: 2.1.0\n\n  regjsparser@0.9.1:\n    dependencies:\n      jsesc: 0.5.0\n\n  replace-in-file@6.3.5:\n    dependencies:\n      chalk: 4.1.2\n      glob: 7.2.3\n      yargs: 17.7.2\n\n  require-directory@2.1.1: {}\n\n  require-from-string@2.0.2: {}\n\n  resolve-from@5.0.0: {}\n\n  resolve-path@1.4.0:\n    dependencies:\n      http-errors: 1.6.3\n      path-is-absolute: 1.0.1\n\n  resolve-pkg-maps@1.0.0: {}\n\n  resolve.exports@2.0.2: {}\n\n  resolve@1.22.8:\n    dependencies:\n      is-core-module: 2.13.1\n      path-parse: 1.0.7\n      supports-preserve-symlinks-flag: 1.0.0\n\n  reusify@1.0.4: {}\n\n  rfdc@1.4.1: {}\n\n  rimraf@3.0.2:\n    dependencies:\n      glob: 7.2.3\n\n  rollup-plugin-inject@3.0.2:\n    dependencies:\n      estree-walker: 0.6.1\n      magic-string: 0.25.9\n      rollup-pluginutils: 2.8.2\n\n  rollup-plugin-node-polyfills@0.2.1:\n    dependencies:\n      rollup-plugin-inject: 3.0.2\n\n  rollup-plugin-terser@7.0.2(rollup@2.79.1):\n    dependencies:\n      '@babel/code-frame': 7.25.9\n      jest-worker: 26.6.2\n      rollup: 2.79.1\n      serialize-javascript: 4.0.0\n      terser: 5.26.0\n\n  rollup-plugin-visualizer@5.12.0(rollup@4.24.0):\n    dependencies:\n      open: 8.4.2\n      picomatch: 2.3.1\n      source-map: 0.7.4\n      yargs: 17.7.2\n    optionalDependencies:\n      rollup: 4.24.0\n\n  rollup-pluginutils@2.8.2:\n    dependencies:\n      estree-walker: 0.6.1\n\n  rollup@2.79.1:\n    optionalDependencies:\n      fsevents: 2.3.3\n\n  rollup@4.24.0:\n    dependencies:\n      '@types/estree': 1.0.6\n    optionalDependencies:\n      '@rollup/rollup-android-arm-eabi': 4.24.0\n      '@rollup/rollup-android-arm64': 4.24.0\n      '@rollup/rollup-darwin-arm64': 4.24.0\n      '@rollup/rollup-darwin-x64': 4.24.0\n      '@rollup/rollup-linux-arm-gnueabihf': 4.24.0\n      '@rollup/rollup-linux-arm-musleabihf': 4.24.0\n      '@rollup/rollup-linux-arm64-gnu': 4.24.0\n      '@rollup/rollup-linux-arm64-musl': 4.24.0\n      '@rollup/rollup-linux-powerpc64le-gnu': 4.24.0\n      '@rollup/rollup-linux-riscv64-gnu': 4.24.0\n      '@rollup/rollup-linux-s390x-gnu': 4.24.0\n      '@rollup/rollup-linux-x64-gnu': 4.24.0\n      '@rollup/rollup-linux-x64-musl': 4.24.0\n      '@rollup/rollup-win32-arm64-msvc': 4.24.0\n      '@rollup/rollup-win32-ia32-msvc': 4.24.0\n      '@rollup/rollup-win32-x64-msvc': 4.24.0\n      fsevents: 2.3.3\n\n  run-applescript@7.0.0: {}\n\n  run-parallel@1.2.0:\n    dependencies:\n      queue-microtask: 1.2.3\n\n  safe-array-concat@1.0.1:\n    dependencies:\n      call-bind: 1.0.5\n      get-intrinsic: 1.2.2\n      has-symbols: 1.0.3\n      isarray: 2.0.5\n\n  safe-buffer@5.1.2: {}\n\n  safe-buffer@5.2.1: {}\n\n  safe-regex-test@1.0.0:\n    dependencies:\n      call-bind: 1.0.5\n      get-intrinsic: 1.2.2\n      is-regex: 1.1.4\n\n  schema-utils@3.3.0:\n    dependencies:\n      '@types/json-schema': 7.0.15\n      ajv: 6.12.6\n      ajv-keywords: 3.5.2(ajv@6.12.6)\n\n  scule@1.3.0: {}\n\n  selfsigned@2.4.1:\n    dependencies:\n      '@types/node-forge': 1.3.11\n      node-forge: 1.3.1\n\n  semver@6.3.1: {}\n\n  semver@7.5.4:\n    dependencies:\n      lru-cache: 6.0.0\n\n  semver@7.6.3: {}\n\n  send@0.19.0:\n    dependencies:\n      debug: 2.6.9\n      depd: 2.0.0\n      destroy: 1.2.0\n      encodeurl: 1.0.2\n      escape-html: 1.0.3\n      etag: 1.8.1\n      fresh: 0.5.2\n      http-errors: 2.0.0\n      mime: 1.6.0\n      ms: 2.1.3\n      on-finished: 2.4.1\n      range-parser: 1.2.1\n      statuses: 2.0.1\n    transitivePeerDependencies:\n      - supports-color\n\n  serialize-javascript@4.0.0:\n    dependencies:\n      randombytes: 2.1.0\n\n  serialize-javascript@6.0.2:\n    dependencies:\n      randombytes: 2.1.0\n\n  serve-placeholder@2.0.2:\n    dependencies:\n      defu: 6.1.4\n\n  serve-static@1.16.2:\n    dependencies:\n      encodeurl: 2.0.0\n      escape-html: 1.0.3\n      parseurl: 1.3.3\n      send: 0.19.0\n    transitivePeerDependencies:\n      - supports-color\n\n  set-blocking@2.0.0: {}\n\n  set-function-length@1.1.1:\n    dependencies:\n      define-data-property: 1.1.1\n      get-intrinsic: 1.2.2\n      gopd: 1.0.1\n      has-property-descriptors: 1.0.1\n\n  set-function-name@2.0.1:\n    dependencies:\n      define-data-property: 1.1.1\n      functions-have-names: 1.2.3\n      has-property-descriptors: 1.0.1\n\n  setprototypeof@1.1.0: {}\n\n  setprototypeof@1.2.0: {}\n\n  shebang-command@2.0.0:\n    dependencies:\n      shebang-regex: 3.0.0\n\n  shebang-regex@3.0.0: {}\n\n  shell-quote@1.8.1: {}\n\n  shiki@1.22.0:\n    dependencies:\n      '@shikijs/core': 1.22.0\n      '@shikijs/engine-javascript': 1.22.0\n      '@shikijs/engine-oniguruma': 1.22.0\n      '@shikijs/types': 1.22.0\n      '@shikijs/vscode-textmate': 9.3.0\n      '@types/hast': 3.0.4\n\n  shiki@1.24.0:\n    dependencies:\n      '@shikijs/core': 1.24.0\n      '@shikijs/engine-javascript': 1.24.0\n      '@shikijs/engine-oniguruma': 1.24.0\n      '@shikijs/types': 1.24.0\n      '@shikijs/vscode-textmate': 9.3.0\n      '@types/hast': 3.0.4\n\n  side-channel@1.0.4:\n    dependencies:\n      call-bind: 1.0.5\n      get-intrinsic: 1.2.2\n      object-inspect: 1.13.1\n\n  signal-exit@3.0.7: {}\n\n  signal-exit@4.1.0: {}\n\n  simple-git@3.27.0:\n    dependencies:\n      '@kwsites/file-exists': 1.1.1\n      '@kwsites/promise-deferred': 1.1.1\n      debug: 4.3.7\n    transitivePeerDependencies:\n      - supports-color\n\n  sirv@2.0.4:\n    dependencies:\n      '@polka/url': 1.0.0-next.28\n      mrmime: 2.0.0\n      totalist: 3.0.1\n\n  sirv@3.0.0:\n    dependencies:\n      '@polka/url': 1.0.0-next.28\n      mrmime: 2.0.0\n      totalist: 3.0.1\n\n  sisteransi@1.0.5: {}\n\n  slash@5.1.0: {}\n\n  smob@1.5.0: {}\n\n  source-map-js@1.2.1: {}\n\n  source-map-support@0.5.21:\n    dependencies:\n      buffer-from: 1.1.2\n      source-map: 0.6.1\n\n  source-map@0.6.1: {}\n\n  source-map@0.7.4: {}\n\n  source-map@0.8.0-beta.0:\n    dependencies:\n      whatwg-url: 7.1.0\n\n  sourcemap-codec@1.4.8: {}\n\n  space-separated-tokens@2.0.2: {}\n\n  speakingurl@14.0.1: {}\n\n  split2@4.2.0:\n    optional: true\n\n  splitpanes@3.1.5: {}\n\n  stacktracey@2.1.8:\n    dependencies:\n      as-table: 1.0.55\n      get-source: 2.0.12\n\n  standard-as-callback@2.1.0: {}\n\n  statuses@1.5.0: {}\n\n  statuses@2.0.1: {}\n\n  std-env@3.7.0: {}\n\n  std-env@3.8.0: {}\n\n  stoppable@1.1.0: {}\n\n  streamx@2.20.1:\n    dependencies:\n      fast-fifo: 1.3.2\n      queue-tick: 1.0.1\n      text-decoder: 1.2.1\n    optionalDependencies:\n      bare-events: 2.5.0\n\n  string-width@4.2.3:\n    dependencies:\n      emoji-regex: 8.0.0\n      is-fullwidth-code-point: 3.0.0\n      strip-ansi: 6.0.1\n\n  string-width@5.1.2:\n    dependencies:\n      eastasianwidth: 0.2.0\n      emoji-regex: 9.2.2\n      strip-ansi: 7.1.0\n\n  string.prototype.matchall@4.0.10:\n    dependencies:\n      call-bind: 1.0.5\n      define-properties: 1.2.1\n      es-abstract: 1.22.3\n      get-intrinsic: 1.2.2\n      has-symbols: 1.0.3\n      internal-slot: 1.0.6\n      regexp.prototype.flags: 1.5.1\n      set-function-name: 2.0.1\n      side-channel: 1.0.4\n\n  string.prototype.trim@1.2.8:\n    dependencies:\n      call-bind: 1.0.5\n      define-properties: 1.2.1\n      es-abstract: 1.22.3\n\n  string.prototype.trimend@1.0.7:\n    dependencies:\n      call-bind: 1.0.5\n      define-properties: 1.2.1\n      es-abstract: 1.22.3\n\n  string.prototype.trimstart@1.0.7:\n    dependencies:\n      call-bind: 1.0.5\n      define-properties: 1.2.1\n      es-abstract: 1.22.3\n\n  string_decoder@1.1.1:\n    dependencies:\n      safe-buffer: 5.1.2\n\n  string_decoder@1.3.0:\n    dependencies:\n      safe-buffer: 5.2.1\n\n  stringify-entities@4.0.4:\n    dependencies:\n      character-entities-html4: 2.1.0\n      character-entities-legacy: 3.0.0\n\n  stringify-object@3.3.0:\n    dependencies:\n      get-own-enumerable-property-symbols: 3.0.2\n      is-obj: 1.0.1\n      is-regexp: 1.0.0\n\n  strip-ansi@6.0.1:\n    dependencies:\n      ansi-regex: 5.0.1\n\n  strip-ansi@7.1.0:\n    dependencies:\n      ansi-regex: 6.0.1\n\n  strip-comments@2.0.1: {}\n\n  strip-final-newline@3.0.0: {}\n\n  strip-literal@2.1.0:\n    dependencies:\n      js-tokens: 9.0.0\n\n  strip-literal@2.1.1:\n    dependencies:\n      js-tokens: 9.0.1\n\n  stylehacks@7.0.4(postcss@8.4.47):\n    dependencies:\n      browserslist: 4.24.0\n      postcss: 8.4.47\n      postcss-selector-parser: 6.1.2\n\n  sucrase@3.35.0:\n    dependencies:\n      '@jridgewell/gen-mapping': 0.3.3\n      commander: 4.1.1\n      glob: 10.3.10\n      lines-and-columns: 1.2.4\n      mz: 2.7.0\n      pirates: 4.0.6\n      ts-interface-checker: 0.1.13\n\n  superjson@2.2.1:\n    dependencies:\n      copy-anything: 3.0.5\n\n  supports-color@5.5.0:\n    dependencies:\n      has-flag: 3.0.0\n\n  supports-color@7.2.0:\n    dependencies:\n      has-flag: 4.0.0\n\n  supports-color@8.1.1:\n    dependencies:\n      has-flag: 4.0.0\n\n  supports-color@9.4.0: {}\n\n  supports-preserve-symlinks-flag@1.0.0: {}\n\n  svg-tags@1.0.0: {}\n\n  svgo@3.3.2:\n    dependencies:\n      '@trysound/sax': 0.2.0\n      commander: 7.2.0\n      css-select: 5.1.0\n      css-tree: 2.3.1\n      css-what: 6.1.0\n      csso: 5.0.5\n      picocolors: 1.1.0\n\n  system-architecture@0.1.0: {}\n\n  tabbable@6.2.0: {}\n\n  tailwind-config-viewer@2.0.4(tailwindcss@3.4.13):\n    dependencies:\n      '@koa/router': 12.0.2\n      commander: 6.2.1\n      fs-extra: 9.1.0\n      koa: 2.15.3\n      koa-static: 5.0.0\n      open: 7.4.2\n      portfinder: 1.0.32\n      replace-in-file: 6.3.5\n      tailwindcss: 3.4.13\n    transitivePeerDependencies:\n      - supports-color\n\n  tailwind-merge@2.5.3: {}\n\n  tailwindcss-easing@0.2.1(tailwindcss@3.4.13):\n    dependencies:\n      tailwindcss: 3.4.13\n\n  tailwindcss@3.4.13:\n    dependencies:\n      '@alloc/quick-lru': 5.2.0\n      arg: 5.0.2\n      chokidar: 3.6.0\n      didyoumean: 1.2.2\n      dlv: 1.1.3\n      fast-glob: 3.3.2\n      glob-parent: 6.0.2\n      is-glob: 4.0.3\n      jiti: 1.21.0\n      lilconfig: 2.1.0\n      micromatch: 4.0.5\n      normalize-path: 3.0.0\n      object-hash: 3.0.0\n      picocolors: 1.1.0\n      postcss: 8.4.47\n      postcss-import: 15.1.0(postcss@8.4.47)\n      postcss-js: 4.0.1(postcss@8.4.47)\n      postcss-load-config: 4.0.2(postcss@8.4.47)\n      postcss-nested: 6.0.1(postcss@8.4.47)\n      postcss-selector-parser: 6.0.15\n      resolve: 1.22.8\n      sucrase: 3.35.0\n    transitivePeerDependencies:\n      - ts-node\n\n  tapable@2.2.1: {}\n\n  tar-stream@3.1.7:\n    dependencies:\n      b4a: 1.6.7\n      fast-fifo: 1.3.2\n      streamx: 2.20.1\n\n  tar@6.2.1:\n    dependencies:\n      chownr: 2.0.0\n      fs-minipass: 2.1.0\n      minipass: 5.0.0\n      minizlib: 2.1.2\n      mkdirp: 1.0.4\n      yallist: 4.0.0\n\n  temp-dir@2.0.0: {}\n\n  tempy@0.6.0:\n    dependencies:\n      is-stream: 2.0.1\n      temp-dir: 2.0.0\n      type-fest: 0.16.0\n      unique-string: 2.0.0\n\n  terser-webpack-plugin@5.3.10(esbuild@0.23.1)(webpack@5.95.0(esbuild@0.23.1)):\n    dependencies:\n      '@jridgewell/trace-mapping': 0.3.25\n      jest-worker: 27.5.1\n      schema-utils: 3.3.0\n      serialize-javascript: 6.0.2\n      terser: 5.26.0\n      webpack: 5.95.0(esbuild@0.23.1)\n    optionalDependencies:\n      esbuild: 0.23.1\n\n  terser@5.26.0:\n    dependencies:\n      '@jridgewell/source-map': 0.3.5\n      acorn: 8.12.1\n      commander: 2.20.3\n      source-map-support: 0.5.21\n\n  text-decoder@1.2.1: {}\n\n  thenify-all@1.6.0:\n    dependencies:\n      thenify: 3.3.1\n\n  thenify@3.3.1:\n    dependencies:\n      any-promise: 1.3.0\n\n  third-party-capital@2.3.0:\n    dependencies:\n      semver: 7.6.3\n\n  tiny-invariant@1.3.3: {}\n\n  tinyexec@0.3.0: {}\n\n  tinyglobby@0.2.10:\n    dependencies:\n      fdir: 6.4.2(picomatch@4.0.2)\n      picomatch: 4.0.2\n\n  tinyglobby@0.2.6:\n    dependencies:\n      fdir: 6.4.0(picomatch@4.0.2)\n      picomatch: 4.0.2\n\n  tinyglobby@0.2.9:\n    dependencies:\n      fdir: 6.4.0(picomatch@4.0.2)\n      picomatch: 4.0.2\n\n  to-fast-properties@2.0.0: {}\n\n  to-regex-range@5.0.1:\n    dependencies:\n      is-number: 7.0.0\n\n  toidentifier@1.0.1: {}\n\n  totalist@3.0.1: {}\n\n  tr46@0.0.3: {}\n\n  tr46@1.0.1:\n    dependencies:\n      punycode: 2.3.1\n\n  trim-lines@3.0.1: {}\n\n  ts-interface-checker@0.1.13: {}\n\n  tslib@2.6.2: {}\n\n  tsscmp@1.0.6: {}\n\n  tsx@4.19.1:\n    dependencies:\n      esbuild: 0.23.1\n      get-tsconfig: 4.8.1\n    optionalDependencies:\n      fsevents: 2.3.3\n\n  type-fest@0.16.0: {}\n\n  type-fest@0.21.3: {}\n\n  type-fest@3.13.1: {}\n\n  type-is@1.6.18:\n    dependencies:\n      media-typer: 0.3.0\n      mime-types: 2.1.35\n\n  typed-array-buffer@1.0.0:\n    dependencies:\n      call-bind: 1.0.5\n      get-intrinsic: 1.2.2\n      is-typed-array: 1.1.12\n\n  typed-array-byte-length@1.0.0:\n    dependencies:\n      call-bind: 1.0.5\n      for-each: 0.3.3\n      has-proto: 1.0.1\n      is-typed-array: 1.1.12\n\n  typed-array-byte-offset@1.0.0:\n    dependencies:\n      available-typed-arrays: 1.0.5\n      call-bind: 1.0.5\n      for-each: 0.3.3\n      has-proto: 1.0.1\n      is-typed-array: 1.1.12\n\n  typed-array-length@1.0.4:\n    dependencies:\n      call-bind: 1.0.5\n      for-each: 0.3.3\n      is-typed-array: 1.1.12\n\n  typescript@5.6.3: {}\n\n  uc.micro@1.0.6: {}\n\n  uc.micro@2.1.0: {}\n\n  ufo@1.5.4: {}\n\n  ultrahtml@1.5.3: {}\n\n  unbox-primitive@1.0.2:\n    dependencies:\n      call-bind: 1.0.5\n      has-bigints: 1.0.2\n      has-symbols: 1.0.3\n      which-boxed-primitive: 1.0.2\n\n  unconfig@0.5.5:\n    dependencies:\n      '@antfu/utils': 0.7.10\n      defu: 6.1.4\n      importx: 0.4.4\n    transitivePeerDependencies:\n      - supports-color\n\n  uncrypto@0.1.3: {}\n\n  unctx@2.3.1(webpack-sources@3.2.3):\n    dependencies:\n      acorn: 8.12.1\n      estree-walker: 3.0.3\n      magic-string: 0.30.12\n      unplugin: 1.14.1(webpack-sources@3.2.3)\n    transitivePeerDependencies:\n      - webpack-sources\n\n  undici-types@5.26.5: {}\n\n  undici@5.28.4:\n    dependencies:\n      '@fastify/busboy': 2.1.1\n\n  unenv-nightly@2.0.0-20241121-161142-806b5c0:\n    dependencies:\n      defu: 6.1.4\n      ohash: 1.1.4\n      pathe: 1.1.2\n      ufo: 1.5.4\n\n  unenv@1.10.0:\n    dependencies:\n      consola: 3.2.3\n      defu: 6.1.4\n      mime: 3.0.0\n      node-fetch-native: 1.6.4\n      pathe: 1.1.2\n\n  unhead@1.11.13:\n    dependencies:\n      '@unhead/dom': 1.11.13\n      '@unhead/schema': 1.11.13\n      '@unhead/shared': 1.11.13\n      hookable: 5.5.3\n\n  unhead@1.11.7:\n    dependencies:\n      '@unhead/dom': 1.11.7\n      '@unhead/schema': 1.11.7\n      '@unhead/shared': 1.11.7\n      hookable: 5.5.3\n\n  unhead@1.11.9:\n    dependencies:\n      '@unhead/dom': 1.11.9\n      '@unhead/schema': 1.11.9\n      '@unhead/shared': 1.11.9\n      hookable: 5.5.3\n\n  unicode-canonical-property-names-ecmascript@2.0.0: {}\n\n  unicode-match-property-ecmascript@2.0.0:\n    dependencies:\n      unicode-canonical-property-names-ecmascript: 2.0.0\n      unicode-property-aliases-ecmascript: 2.1.0\n\n  unicode-match-property-value-ecmascript@2.1.0: {}\n\n  unicode-property-aliases-ecmascript@2.1.0: {}\n\n  unicorn-magic@0.1.0: {}\n\n  unimport@3.13.1(rollup@4.24.0)(webpack-sources@3.2.3):\n    dependencies:\n      '@rollup/pluginutils': 5.1.2(rollup@4.24.0)\n      acorn: 8.12.1\n      escape-string-regexp: 5.0.0\n      estree-walker: 3.0.3\n      fast-glob: 3.3.2\n      local-pkg: 0.5.0\n      magic-string: 0.30.12\n      mlly: 1.7.2\n      pathe: 1.1.2\n      pkg-types: 1.2.1\n      scule: 1.3.0\n      strip-literal: 2.1.0\n      unplugin: 1.14.1(webpack-sources@3.2.3)\n    transitivePeerDependencies:\n      - rollup\n      - webpack-sources\n\n  unimport@3.14.2(rollup@4.24.0):\n    dependencies:\n      '@rollup/pluginutils': 5.1.3(rollup@4.24.0)\n      acorn: 8.14.0\n      escape-string-regexp: 5.0.0\n      estree-walker: 3.0.3\n      local-pkg: 0.5.1\n      magic-string: 0.30.14\n      mlly: 1.7.3\n      pathe: 1.1.2\n      picomatch: 4.0.2\n      pkg-types: 1.2.1\n      scule: 1.3.0\n      strip-literal: 2.1.1\n      tinyglobby: 0.2.10\n      unplugin: 1.16.0\n    transitivePeerDependencies:\n      - rollup\n\n  unique-string@2.0.0:\n    dependencies:\n      crypto-random-string: 2.0.0\n\n  unist-util-is@6.0.0:\n    dependencies:\n      '@types/unist': 3.0.3\n\n  unist-util-position@5.0.0:\n    dependencies:\n      '@types/unist': 3.0.3\n\n  unist-util-stringify-position@4.0.0:\n    dependencies:\n      '@types/unist': 3.0.3\n\n  unist-util-visit-parents@6.0.1:\n    dependencies:\n      '@types/unist': 3.0.3\n      unist-util-is: 6.0.0\n\n  unist-util-visit@5.0.0:\n    dependencies:\n      '@types/unist': 3.0.3\n      unist-util-is: 6.0.0\n      unist-util-visit-parents: 6.0.1\n\n  universalify@2.0.1: {}\n\n  unocss@0.62.4(@unocss/webpack@0.62.4(rollup@4.24.0)(webpack@5.95.0(esbuild@0.23.1)))(postcss@8.4.47)(rollup@4.24.0)(vite@5.4.8(@types/node@20.10.5)(terser@5.26.0)):\n    dependencies:\n      '@unocss/astro': 0.62.4(rollup@4.24.0)(vite@5.4.8(@types/node@20.10.5)(terser@5.26.0))\n      '@unocss/cli': 0.62.4(rollup@4.24.0)\n      '@unocss/core': 0.62.4\n      '@unocss/postcss': 0.62.4(postcss@8.4.47)\n      '@unocss/preset-attributify': 0.62.4\n      '@unocss/preset-icons': 0.62.4\n      '@unocss/preset-mini': 0.62.4\n      '@unocss/preset-tagify': 0.62.4\n      '@unocss/preset-typography': 0.62.4\n      '@unocss/preset-uno': 0.62.4\n      '@unocss/preset-web-fonts': 0.62.4\n      '@unocss/preset-wind': 0.62.4\n      '@unocss/transformer-attributify-jsx': 0.62.4\n      '@unocss/transformer-compile-class': 0.62.4\n      '@unocss/transformer-directives': 0.62.4\n      '@unocss/transformer-variant-group': 0.62.4\n      '@unocss/vite': 0.62.4(rollup@4.24.0)(vite@5.4.8(@types/node@20.10.5)(terser@5.26.0))\n    optionalDependencies:\n      '@unocss/webpack': 0.62.4(rollup@4.24.0)(webpack@5.95.0(esbuild@0.23.1))\n      vite: 5.4.8(@types/node@20.10.5)(terser@5.26.0)\n    transitivePeerDependencies:\n      - postcss\n      - rollup\n      - supports-color\n\n  unplugin-icons@0.19.3(@vue/compiler-sfc@3.5.12)(vue-template-compiler@2.7.16)(webpack-sources@3.2.3):\n    dependencies:\n      '@antfu/install-pkg': 0.4.1\n      '@antfu/utils': 0.7.10\n      '@iconify/utils': 2.1.33\n      debug: 4.3.7\n      kolorist: 1.8.0\n      local-pkg: 0.5.0\n      unplugin: 1.14.1(webpack-sources@3.2.3)\n    optionalDependencies:\n      '@vue/compiler-sfc': 3.5.12\n      vue-template-compiler: 2.7.16\n    transitivePeerDependencies:\n      - supports-color\n      - webpack-sources\n\n  unplugin-vue-components@0.27.4(@babel/parser@7.25.9)(@nuxt/kit@3.14.1592(magicast@0.3.5)(rollup@4.24.0)(webpack-sources@3.2.3))(rollup@4.24.0)(vue@3.5.12(typescript@5.6.3))(webpack-sources@3.2.3):\n    dependencies:\n      '@antfu/utils': 0.7.10\n      '@rollup/pluginutils': 5.1.0(rollup@4.24.0)\n      chokidar: 3.6.0\n      debug: 4.3.7\n      fast-glob: 3.3.2\n      local-pkg: 0.5.0\n      magic-string: 0.30.12\n      minimatch: 9.0.5\n      mlly: 1.7.2\n      unplugin: 1.14.1(webpack-sources@3.2.3)\n      vue: 3.5.12(typescript@5.6.3)\n    optionalDependencies:\n      '@babel/parser': 7.25.9\n      '@nuxt/kit': 3.14.1592(magicast@0.3.5)(rollup@4.24.0)(webpack-sources@3.2.3)\n    transitivePeerDependencies:\n      - rollup\n      - supports-color\n      - webpack-sources\n\n  unplugin-vue-router@0.10.8(rollup@4.24.0)(vue-router@4.4.5(vue@3.5.12(typescript@5.6.3)))(vue@3.5.12(typescript@5.6.3))(webpack-sources@3.2.3):\n    dependencies:\n      '@babel/types': 7.25.8\n      '@rollup/pluginutils': 5.1.0(rollup@4.24.0)\n      '@vue-macros/common': 1.15.0(rollup@4.24.0)(vue@3.5.12(typescript@5.6.3))\n      ast-walker-scope: 0.6.2\n      chokidar: 3.6.0\n      fast-glob: 3.3.2\n      json5: 2.2.3\n      local-pkg: 0.5.0\n      magic-string: 0.30.12\n      mlly: 1.7.2\n      pathe: 1.1.2\n      scule: 1.3.0\n      unplugin: 1.14.1(webpack-sources@3.2.3)\n      yaml: 2.6.0\n    optionalDependencies:\n      vue-router: 4.4.5(vue@3.5.12(typescript@5.6.3))\n    transitivePeerDependencies:\n      - rollup\n      - vue\n      - webpack-sources\n\n  unplugin@1.14.1(webpack-sources@3.2.3):\n    dependencies:\n      acorn: 8.12.1\n      webpack-virtual-modules: 0.6.2\n    optionalDependencies:\n      webpack-sources: 3.2.3\n\n  unplugin@1.16.0:\n    dependencies:\n      acorn: 8.14.0\n      webpack-virtual-modules: 0.6.2\n\n  unstorage@1.13.1(ioredis@5.4.1):\n    dependencies:\n      anymatch: 3.1.3\n      chokidar: 3.6.0\n      citty: 0.1.6\n      destr: 2.0.3\n      h3: 1.13.0\n      listhen: 1.9.0\n      lru-cache: 10.4.3\n      node-fetch-native: 1.6.4\n      ofetch: 1.4.1\n      ufo: 1.5.4\n    optionalDependencies:\n      ioredis: 5.4.1\n\n  untun@0.1.3:\n    dependencies:\n      citty: 0.1.6\n      consola: 3.2.3\n      pathe: 1.1.2\n\n  untyped@1.5.1:\n    dependencies:\n      '@babel/core': 7.25.9\n      '@babel/standalone': 7.25.9\n      '@babel/types': 7.25.8\n      defu: 6.1.4\n      jiti: 2.3.3\n      mri: 1.2.0\n      scule: 1.3.0\n    transitivePeerDependencies:\n      - supports-color\n\n  unwasm@0.3.9(webpack-sources@3.2.3):\n    dependencies:\n      knitwork: 1.1.0\n      magic-string: 0.30.12\n      mlly: 1.7.2\n      pathe: 1.1.2\n      pkg-types: 1.2.1\n      unplugin: 1.14.1(webpack-sources@3.2.3)\n    transitivePeerDependencies:\n      - webpack-sources\n\n  upath@1.2.0: {}\n\n  update-browserslist-db@1.1.1(browserslist@4.24.0):\n    dependencies:\n      browserslist: 4.24.0\n      escalade: 3.2.0\n      picocolors: 1.1.0\n\n  uqr@0.1.2: {}\n\n  uri-js@4.4.1:\n    dependencies:\n      punycode: 2.3.1\n\n  urlpattern-polyfill@8.0.2: {}\n\n  util-deprecate@1.0.2: {}\n\n  uuid@10.0.0: {}\n\n  v-lazy-show@0.2.4(@vue/compiler-core@3.5.12):\n    dependencies:\n      '@vue/compiler-core': 3.5.12\n\n  valibot@0.42.1(typescript@5.6.3):\n    optionalDependencies:\n      typescript: 5.6.3\n\n  vary@1.1.2: {}\n\n  vfile-message@4.0.2:\n    dependencies:\n      '@types/unist': 3.0.3\n      unist-util-stringify-position: 4.0.0\n\n  vfile@6.0.3:\n    dependencies:\n      '@types/unist': 3.0.3\n      vfile-message: 4.0.2\n\n  vite-hot-client@0.2.3(vite@5.4.8(@types/node@20.10.5)(terser@5.26.0)):\n    dependencies:\n      vite: 5.4.8(@types/node@20.10.5)(terser@5.26.0)\n\n  vite-node@2.1.3(@types/node@20.10.5)(terser@5.26.0):\n    dependencies:\n      cac: 6.7.14\n      debug: 4.3.7\n      pathe: 1.1.2\n      vite: 5.4.8(@types/node@20.10.5)(terser@5.26.0)\n    transitivePeerDependencies:\n      - '@types/node'\n      - less\n      - lightningcss\n      - sass\n      - sass-embedded\n      - stylus\n      - sugarss\n      - supports-color\n      - terser\n\n  vite-plugin-checker@0.8.0(typescript@5.6.3)(vite@5.4.8(@types/node@20.10.5)(terser@5.26.0))(vue-tsc@2.1.6(typescript@5.6.3)):\n    dependencies:\n      '@babel/code-frame': 7.23.5\n      ansi-escapes: 4.3.2\n      chalk: 4.1.2\n      chokidar: 3.6.0\n      commander: 8.3.0\n      fast-glob: 3.3.2\n      fs-extra: 11.2.0\n      npm-run-path: 4.0.1\n      strip-ansi: 6.0.1\n      tiny-invariant: 1.3.3\n      vite: 5.4.8(@types/node@20.10.5)(terser@5.26.0)\n      vscode-languageclient: 7.0.0\n      vscode-languageserver: 7.0.0\n      vscode-languageserver-textdocument: 1.0.12\n      vscode-uri: 3.0.8\n    optionalDependencies:\n      typescript: 5.6.3\n      vue-tsc: 2.1.6(typescript@5.6.3)\n\n  vite-plugin-inspect@0.8.7(@nuxt/kit@3.13.2(magicast@0.3.5)(rollup@4.24.0)(webpack-sources@3.2.3))(rollup@4.24.0)(vite@5.4.8(@types/node@20.10.5)(terser@5.26.0)):\n    dependencies:\n      '@antfu/utils': 0.7.10\n      '@rollup/pluginutils': 5.1.0(rollup@4.24.0)\n      debug: 4.3.7\n      error-stack-parser-es: 0.1.5\n      fs-extra: 11.2.0\n      open: 10.1.0\n      perfect-debounce: 1.0.0\n      picocolors: 1.1.0\n      sirv: 2.0.4\n      vite: 5.4.8(@types/node@20.10.5)(terser@5.26.0)\n    optionalDependencies:\n      '@nuxt/kit': 3.13.2(magicast@0.3.5)(rollup@4.24.0)(webpack-sources@3.2.3)\n    transitivePeerDependencies:\n      - rollup\n      - supports-color\n\n  vite-plugin-pwa@0.20.5(vite@5.4.8(@types/node@20.10.5)(terser@5.26.0))(workbox-build@7.0.0)(workbox-window@7.0.0):\n    dependencies:\n      debug: 4.3.7\n      pretty-bytes: 6.1.1\n      tinyglobby: 0.2.9\n      vite: 5.4.8(@types/node@20.10.5)(terser@5.26.0)\n      workbox-build: 7.0.0\n      workbox-window: 7.0.0\n    transitivePeerDependencies:\n      - supports-color\n\n  vite-plugin-vue-inspector@5.1.3(vite@5.4.8(@types/node@20.10.5)(terser@5.26.0)):\n    dependencies:\n      '@babel/core': 7.23.7\n      '@babel/plugin-proposal-decorators': 7.25.9(@babel/core@7.23.7)\n      '@babel/plugin-syntax-import-attributes': 7.23.3(@babel/core@7.23.7)\n      '@babel/plugin-syntax-import-meta': 7.10.4(@babel/core@7.23.7)\n      '@babel/plugin-transform-typescript': 7.25.9(@babel/core@7.23.7)\n      '@vue/babel-plugin-jsx': 1.2.5(@babel/core@7.23.7)\n      '@vue/compiler-dom': 3.5.12\n      kolorist: 1.8.0\n      magic-string: 0.30.12\n      vite: 5.4.8(@types/node@20.10.5)(terser@5.26.0)\n    transitivePeerDependencies:\n      - supports-color\n\n  vite@5.4.8(@types/node@20.10.5)(terser@5.26.0):\n    dependencies:\n      esbuild: 0.21.5\n      postcss: 8.4.47\n      rollup: 4.24.0\n    optionalDependencies:\n      '@types/node': 20.10.5\n      fsevents: 2.3.3\n      terser: 5.26.0\n\n  vscode-jsonrpc@6.0.0: {}\n\n  vscode-languageclient@7.0.0:\n    dependencies:\n      minimatch: 3.1.2\n      semver: 7.6.3\n      vscode-languageserver-protocol: 3.16.0\n\n  vscode-languageserver-protocol@3.16.0:\n    dependencies:\n      vscode-jsonrpc: 6.0.0\n      vscode-languageserver-types: 3.16.0\n\n  vscode-languageserver-textdocument@1.0.12: {}\n\n  vscode-languageserver-types@3.16.0: {}\n\n  vscode-languageserver@7.0.0:\n    dependencies:\n      vscode-languageserver-protocol: 3.16.0\n\n  vscode-uri@3.0.8: {}\n\n  vue-bundle-renderer@2.1.1:\n    dependencies:\n      ufo: 1.5.4\n\n  vue-color-kit@https://codeload.github.com/Idered/vue-color-kit/tar.gz/e75eb34d3473b6e1a4627869b7099ab07b1280e7(vue@3.5.12(typescript@5.6.3)):\n    dependencies:\n      vue: 3.5.12(typescript@5.6.3)\n\n  vue-demi@0.14.10(vue@3.5.12(typescript@5.6.3)):\n    dependencies:\n      vue: 3.5.12(typescript@5.6.3)\n\n  vue-devtools-stub@0.1.0: {}\n\n  vue-router@4.4.5(vue@3.5.12(typescript@5.6.3)):\n    dependencies:\n      '@vue/devtools-api': 6.6.4\n      vue: 3.5.12(typescript@5.6.3)\n\n  vue-template-compiler@2.7.16:\n    dependencies:\n      de-indent: 1.0.2\n      he: 1.2.0\n    optional: true\n\n  vue-tsc@2.1.6(typescript@5.6.3):\n    dependencies:\n      '@volar/typescript': 2.4.6\n      '@vue/language-core': 2.1.6(typescript@5.6.3)\n      semver: 7.5.4\n      typescript: 5.6.3\n\n  vue@3.5.12(typescript@5.6.3):\n    dependencies:\n      '@vue/compiler-dom': 3.5.12\n      '@vue/compiler-sfc': 3.5.12\n      '@vue/runtime-dom': 3.5.12\n      '@vue/server-renderer': 3.5.12(vue@3.5.12(typescript@5.6.3))\n      '@vue/shared': 3.5.12\n    optionalDependencies:\n      typescript: 5.6.3\n\n  watchpack@2.4.2:\n    dependencies:\n      glob-to-regexp: 0.4.1\n      graceful-fs: 4.2.11\n\n  webidl-conversions@3.0.1: {}\n\n  webidl-conversions@4.0.2: {}\n\n  webpack-sources@3.2.3: {}\n\n  webpack-virtual-modules@0.6.2: {}\n\n  webpack@5.95.0(esbuild@0.23.1):\n    dependencies:\n      '@types/estree': 1.0.6\n      '@webassemblyjs/ast': 1.12.1\n      '@webassemblyjs/wasm-edit': 1.12.1\n      '@webassemblyjs/wasm-parser': 1.12.1\n      acorn: 8.14.0\n      acorn-import-attributes: 1.9.5(acorn@8.14.0)\n      browserslist: 4.24.0\n      chrome-trace-event: 1.0.4\n      enhanced-resolve: 5.17.1\n      es-module-lexer: 1.5.4\n      eslint-scope: 5.1.1\n      events: 3.3.0\n      glob-to-regexp: 0.4.1\n      graceful-fs: 4.2.11\n      json-parse-even-better-errors: 2.3.1\n      loader-runner: 4.3.0\n      mime-types: 2.1.35\n      neo-async: 2.6.2\n      schema-utils: 3.3.0\n      tapable: 2.2.1\n      terser-webpack-plugin: 5.3.10(esbuild@0.23.1)(webpack@5.95.0(esbuild@0.23.1))\n      watchpack: 2.4.2\n      webpack-sources: 3.2.3\n    transitivePeerDependencies:\n      - '@swc/core'\n      - esbuild\n      - uglify-js\n\n  webworkify@1.5.0: {}\n\n  whatwg-url@5.0.0:\n    dependencies:\n      tr46: 0.0.3\n      webidl-conversions: 3.0.1\n\n  whatwg-url@7.1.0:\n    dependencies:\n      lodash.sortby: 4.7.0\n      tr46: 1.0.1\n      webidl-conversions: 4.0.2\n\n  which-boxed-primitive@1.0.2:\n    dependencies:\n      is-bigint: 1.0.4\n      is-boolean-object: 1.1.2\n      is-number-object: 1.0.7\n      is-string: 1.0.7\n      is-symbol: 1.0.4\n\n  which-typed-array@1.1.13:\n    dependencies:\n      available-typed-arrays: 1.0.5\n      call-bind: 1.0.5\n      for-each: 0.3.3\n      gopd: 1.0.1\n      has-tostringtag: 1.0.0\n\n  which@2.0.2:\n    dependencies:\n      isexe: 2.0.0\n\n  which@3.0.1:\n    dependencies:\n      isexe: 2.0.0\n\n  wide-align@1.1.5:\n    dependencies:\n      string-width: 4.2.3\n\n  workbox-background-sync@7.0.0:\n    dependencies:\n      idb: 7.1.1\n      workbox-core: 7.0.0\n\n  workbox-broadcast-update@7.0.0:\n    dependencies:\n      workbox-core: 7.0.0\n\n  workbox-build@7.0.0:\n    dependencies:\n      '@apideck/better-ajv-errors': 0.3.6(ajv@8.12.0)\n      '@babel/core': 7.25.9\n      '@babel/preset-env': 7.23.7(@babel/core@7.25.9)\n      '@babel/runtime': 7.23.7\n      '@rollup/plugin-babel': 5.3.1(@babel/core@7.25.9)(rollup@2.79.1)\n      '@rollup/plugin-node-resolve': 11.2.1(rollup@2.79.1)\n      '@rollup/plugin-replace': 2.4.2(rollup@2.79.1)\n      '@surma/rollup-plugin-off-main-thread': 2.2.3\n      ajv: 8.12.0\n      common-tags: 1.8.2\n      fast-json-stable-stringify: 2.1.0\n      fs-extra: 9.1.0\n      glob: 7.2.3\n      lodash: 4.17.21\n      pretty-bytes: 5.6.0\n      rollup: 2.79.1\n      rollup-plugin-terser: 7.0.2(rollup@2.79.1)\n      source-map: 0.8.0-beta.0\n      stringify-object: 3.3.0\n      strip-comments: 2.0.1\n      tempy: 0.6.0\n      upath: 1.2.0\n      workbox-background-sync: 7.0.0\n      workbox-broadcast-update: 7.0.0\n      workbox-cacheable-response: 7.0.0\n      workbox-core: 7.0.0\n      workbox-expiration: 7.0.0\n      workbox-google-analytics: 7.0.0\n      workbox-navigation-preload: 7.0.0\n      workbox-precaching: 7.0.0\n      workbox-range-requests: 7.0.0\n      workbox-recipes: 7.0.0\n      workbox-routing: 7.0.0\n      workbox-strategies: 7.0.0\n      workbox-streams: 7.0.0\n      workbox-sw: 7.0.0\n      workbox-window: 7.0.0\n    transitivePeerDependencies:\n      - '@types/babel__core'\n      - supports-color\n\n  workbox-cacheable-response@7.0.0:\n    dependencies:\n      workbox-core: 7.0.0\n\n  workbox-core@7.0.0: {}\n\n  workbox-expiration@7.0.0:\n    dependencies:\n      idb: 7.1.1\n      workbox-core: 7.0.0\n\n  workbox-google-analytics@7.0.0:\n    dependencies:\n      workbox-background-sync: 7.0.0\n      workbox-core: 7.0.0\n      workbox-routing: 7.0.0\n      workbox-strategies: 7.0.0\n\n  workbox-navigation-preload@7.0.0:\n    dependencies:\n      workbox-core: 7.0.0\n\n  workbox-precaching@7.0.0:\n    dependencies:\n      workbox-core: 7.0.0\n      workbox-routing: 7.0.0\n      workbox-strategies: 7.0.0\n\n  workbox-range-requests@7.0.0:\n    dependencies:\n      workbox-core: 7.0.0\n\n  workbox-recipes@7.0.0:\n    dependencies:\n      workbox-cacheable-response: 7.0.0\n      workbox-core: 7.0.0\n      workbox-expiration: 7.0.0\n      workbox-precaching: 7.0.0\n      workbox-routing: 7.0.0\n      workbox-strategies: 7.0.0\n\n  workbox-routing@7.0.0:\n    dependencies:\n      workbox-core: 7.0.0\n\n  workbox-strategies@7.0.0:\n    dependencies:\n      workbox-core: 7.0.0\n\n  workbox-streams@7.0.0:\n    dependencies:\n      workbox-core: 7.0.0\n      workbox-routing: 7.0.0\n\n  workbox-sw@7.0.0: {}\n\n  workbox-window@7.0.0:\n    dependencies:\n      '@types/trusted-types': 2.0.7\n      workbox-core: 7.0.0\n\n  workerd@1.20241106.1:\n    optionalDependencies:\n      '@cloudflare/workerd-darwin-64': 1.20241106.1\n      '@cloudflare/workerd-darwin-arm64': 1.20241106.1\n      '@cloudflare/workerd-linux-64': 1.20241106.1\n      '@cloudflare/workerd-linux-arm64': 1.20241106.1\n      '@cloudflare/workerd-windows-64': 1.20241106.1\n\n  wrangler@3.91.0(@cloudflare/workers-types@4.20241127.0):\n    dependencies:\n      '@cloudflare/kv-asset-handler': 0.3.4\n      '@cloudflare/workers-shared': 0.9.0\n      '@esbuild-plugins/node-globals-polyfill': 0.2.3(esbuild@0.17.19)\n      '@esbuild-plugins/node-modules-polyfill': 0.2.2(esbuild@0.17.19)\n      blake3-wasm: 2.1.5\n      chokidar: 4.0.1\n      date-fns: 4.1.0\n      esbuild: 0.17.19\n      itty-time: 1.0.6\n      miniflare: 3.20241106.1\n      nanoid: 3.3.7\n      path-to-regexp: 6.3.0\n      resolve: 1.22.8\n      resolve.exports: 2.0.2\n      selfsigned: 2.4.1\n      source-map: 0.6.1\n      unenv: unenv-nightly@2.0.0-20241121-161142-806b5c0\n      workerd: 1.20241106.1\n      xxhash-wasm: 1.1.0\n    optionalDependencies:\n      '@cloudflare/workers-types': 4.20241127.0\n      fsevents: 2.3.3\n    transitivePeerDependencies:\n      - bufferutil\n      - supports-color\n      - utf-8-validate\n\n  wrap-ansi@7.0.0:\n    dependencies:\n      ansi-styles: 4.3.0\n      string-width: 4.2.3\n      strip-ansi: 6.0.1\n\n  wrap-ansi@8.1.0:\n    dependencies:\n      ansi-styles: 6.2.1\n      string-width: 5.1.2\n      strip-ansi: 7.1.0\n\n  wrappy@1.0.2: {}\n\n  ws@8.18.0: {}\n\n  xtend@4.0.2:\n    optional: true\n\n  xxhash-wasm@1.1.0: {}\n\n  y18n@5.0.8: {}\n\n  yallist@3.1.1: {}\n\n  yallist@4.0.0: {}\n\n  yaml@2.3.4: {}\n\n  yaml@2.6.0: {}\n\n  yargs-parser@21.1.1: {}\n\n  yargs@17.7.2:\n    dependencies:\n      cliui: 8.0.1\n      escalade: 3.1.1\n      get-caller-file: 2.0.5\n      require-directory: 2.1.1\n      string-width: 4.2.3\n      y18n: 5.0.8\n      yargs-parser: 21.1.1\n\n  ylru@1.4.0: {}\n\n  youch@3.3.4:\n    dependencies:\n      cookie: 0.7.2\n      mustache: 4.2.0\n      stacktracey: 2.1.8\n\n  zhead@2.2.4: {}\n\n  zip-stream@6.0.1:\n    dependencies:\n      archiver-utils: 5.0.2\n      compress-commons: 6.0.2\n      readable-stream: 4.5.2\n\n  zod@3.23.8: {}\n\n  zwitch@2.0.4: {}\n"
        },
        {
          "name": "public",
          "type": "tree",
          "content": null
        },
        {
          "name": "server",
          "type": "tree",
          "content": null
        },
        {
          "name": "tailwind.config.js",
          "type": "blob",
          "size": 3.2470703125,
          "content": "const plugin = require(\"tailwindcss/plugin\");\n/**\n * @typedef {import('tailwindcss/types').Config} BaseConfig\n *\n * @type {BaseConfig}\n */\nmodule.exports = {\n  content: [\"./nuxt.config.ts\", \"./src/**/*.{vue,js,ts,jsx,tsx}\"],\n  theme: {\n    extend: {\n      screens: {\n        pwa: { raw: \"(display-mode: standalone)\" },\n      },\n\n      keyframes: {\n        overlayShow: {\n          from: { opacity: 0 },\n          to: { opacity: 1 },\n        },\n        contentShow: {\n          from: { opacity: 0, transform: \"translate(-50%, -48%) scale(0.96)\" },\n          to: { opacity: 1, transform: \"translate(-50%, -50%) scale(1)\" },\n        },\n        slideDownAndFade: {\n          from: { opacity: 0, transform: \"translateY(-2px)\" },\n          to: { opacity: 1, transform: \"translateY(0)\" },\n        },\n        slideLeftAndFade: {\n          from: { opacity: 0, transform: \"translateX(2px)\" },\n          to: { opacity: 1, transform: \"translateX(0)\" },\n        },\n        slideUpAndFade: {\n          from: { opacity: 0, transform: \"translateY(2px)\" },\n          to: { opacity: 1, transform: \"translateY(0)\" },\n        },\n        slideRightAndFade: {\n          from: { opacity: 0, transform: \"translateX(-2px)\" },\n          to: { opacity: 1, transform: \"translateX(0)\" },\n        },\n        \"shine-r\": {\n          \"0%\": { right: \"100%\", opacity: 0 },\n          \"50%\": { opacity: 1 },\n          \"90%\": { right: \"-10%\" },\n          \"100%\": { opacity: 0 },\n        },\n        \"shine-b\": {\n          \"0%\": { bottom: \"100%\", opacity: 0 },\n          \"50%\": { opacity: 1 },\n          \"90%\": { bottom: \"-10%\" },\n          \"100%\": { opacity: 0 },\n        },\n        \"shine-l\": {\n          \"0%\": { left: \"100%\", opacity: 0 },\n          \"50%\": { opacity: 1 },\n          \"90%\": { left: \"-10%\" },\n          \"100%\": { opacity: 0 },\n        },\n        \"shine-t\": {\n          \"0%\": { top: \"100%\", opacity: 0 },\n          \"50%\": { opacity: 1 },\n          \"90%\": { top: \"-10%\" },\n          \"100%\": { opacity: 0 },\n        },\n      },\n      fontFamily: {\n        inter: [\"Inter\", \"sans-serif\"],\n        mono: [\"JetBrains Mono\", \"monospace\"],\n      },\n      animation: {\n        overlayShow: \"overlayShow 150ms cubic-bezier(0.16, 1, 0.3, 1)\",\n        contentShow: \"contentShow 150ms cubic-bezier(0.16, 1, 0.3, 1)\",\n        slideDownAndFade:\n          \"slideDownAndFade 400ms cubic-bezier(0.16, 1, 0.3, 1)\",\n        slideLeftAndFade:\n          \"slideLeftAndFade 400ms cubic-bezier(0.16, 1, 0.3, 1)\",\n        slideUpAndFade: \"slideUpAndFade 400ms cubic-bezier(0.16, 1, 0.3, 1)\",\n        slideRightAndFade:\n          \"slideRightAndFade 400ms cubic-bezier(0.16, 1, 0.3, 1)\",\n      },\n      colors: {\n        slate: {\n          500: \"hsl(240, 3%, 55%)\",\n          600: \"#6a6a71\",\n          700: \"#1e1e25\",\n          800: \"#101014\",\n          900: \"#0b0b0d\",\n        },\n\n        brand: {\n          50: \"#ebfef7\",\n          100: \"#cefdea\",\n          200: \"#a1f9da\",\n          300: \"#64f1c8\",\n          400: \"#27e0b1\",\n          500: \"#02e1af\",\n          600: \"#00a27f\",\n          700: \"#008269\",\n          800: \"#006654\",\n          900: \"#005447\",\n        },\n      },\n    },\n  },\n  plugins: [\n    require(\"tailwindcss-easing\"),\n    require(\"@tailwindcss/typography\"),\n    plugin(({ addVariant }) => {\n      addVariant(\"light\", \".is-light-theme &\");\n    }),\n  ],\n};\n"
        },
        {
          "name": "tsconfig.json",
          "type": "blob",
          "size": 0.0400390625,
          "content": "{\n  \"extends\": \"./.nuxt/tsconfig.json\"\n}\n"
        },
        {
          "name": "vercel.json",
          "type": "blob",
          "size": 0.080078125,
          "content": "{\n    \"rewrites\": [{ \"source\": \"/share/(.*)\", \"destination\": \"/index.html\" }]\n  }\n"
        }
      ]
    }
  ]
}