{
  "metadata": {
    "timestamp": 1736564022275,
    "page": 563,
    "hasNextPage": true,
    "endCursor": "Y3Vyc29yOjU3MA==",
    "completionStatus": "IN_PROGRESS"
  },
  "repositories": [
    {
      "nameWithOwner": "Musish/Musish",
      "stars": 3083,
      "defaultBranch": "master",
      "files": [
        {
          "name": ".babelrc",
          "type": "blob",
          "size": 0.0966796875,
          "content": "{\n  \"presets\": [\"@babel/preset-react\"],\n  \"plugins\": [\"@babel/plugin-proposal-class-properties\"]\n}\n"
        },
        {
          "name": ".circleci",
          "type": "tree",
          "content": null
        },
        {
          "name": ".env.example",
          "type": "blob",
          "size": 0.068359375,
          "content": "APPLE_TOKEN=your_apple_developer_token\nBACKEND_URL=https://musish.app\n"
        },
        {
          "name": ".github",
          "type": "tree",
          "content": null
        },
        {
          "name": ".gitignore",
          "type": "blob",
          "size": 1.5263671875,
          "content": "# Covers JetBrains IDEs: IntelliJ, RubyMine, PhpStorm, AppCode, PyCharm, CLion, Android Studio and WebStorm\n# Reference: https://intellij-support.jetbrains.com/hc/en-us/articles/206544839\n\n# User-specific stuff\n.idea/**/workspace.xml\n.idea/**/tasks.xml\n.idea/**/usage.statistics.xml\n.idea/**/dictionaries\n.idea/**/shelf\n.vscode/*\n\n# Generated files\n.idea/**/contentModel.xml\n\n# Sensitive or high-churn files\n.idea/**/dataSources/\n.idea/**/dataSources.ids\n.idea/**/dataSources.local.xml\n.idea/**/sqlDataSources.xml\n.idea/**/dynamic.xml\n.idea/**/uiDesigner.xml\n.idea/**/dbnavigator.xml\n\n# Gradle\n.idea/**/gradle.xml\n.idea/**/libraries\n\n# Gradle and Maven with auto-import\n# When using Gradle or Maven with auto-import, you should exclude module files,\n# since they will be recreated, and may cause churn.  Uncomment if using\n# auto-import.\n# .idea/modules.xml\n# .idea/*.iml\n# .idea/modules\n\n# CMake\ncmake-build-*/\n\n# Mongo Explorer plugin\n.idea/**/mongoSettings.xml\n\n# File-based project format\n*.iws\n\n# IntelliJ\nout/\n\n# mpeltonen/sbt-idea plugin\n.idea_modules/\n\n# JIRA plugin\natlassian-ide-plugin.xml\n\n# Cursive Clojure plugin\n.idea/replstate.xml\n\n# Crashlytics plugin (for Android Studio and IntelliJ)\ncom_crashlytics_export_strings.xml\ncrashlytics.properties\ncrashlytics-build.properties\nfabric.properties\n\n# Editor-based Rest Client\n.idea/httpRequests\n\n# Android studio 3.1+ serialized cache file\n.idea/caches/build_file_checksums.ser\n\n# macOS:\n.DS_Store\n\nbuild/\nnode_modules/\n.env\n.serverless\nsecrets.json\n*.scss.d.ts\n\n# Log-files\nyarn-error.log\nreport.*.json\n"
        },
        {
          "name": ".idea",
          "type": "tree",
          "content": null
        },
        {
          "name": ".prettierrc",
          "type": "blob",
          "size": 0.0966796875,
          "content": "{\n  \"printWidth\": 100,\n  \"singleQuote\": true,\n  \"jsxSingleQuote\": true,\n  \"trailingComma\": \"all\"\n}\n"
        },
        {
          "name": "LICENSE",
          "type": "blob",
          "size": 33.7138671875,
          "content": "                    GNU AFFERO GENERAL PUBLIC LICENSE\n                       Version 3, 19 November 2007\n\n Copyright (C) 2007 Free Software Foundation, Inc. <https://fsf.org/>\n Everyone is permitted to copy and distribute verbatim copies\n of this license document, but changing it is not allowed.\n\n                            Preamble\n\n  The GNU Affero General Public License is a free, copyleft license for\nsoftware and other kinds of works, specifically designed to ensure\ncooperation with the community in the case of network server software.\n\n  The licenses for most software and other practical works are designed\nto take away your freedom to share and change the works.  By contrast,\nour General Public Licenses are intended to guarantee your freedom to\nshare and change all versions of a program--to make sure it remains free\nsoftware for all its users.\n\n  When we speak of free software, we are referring to freedom, not\nprice.  Our General Public Licenses are designed to make sure that you\nhave the freedom to distribute copies of free software (and charge for\nthem if you wish), that you receive source code or can get it if you\nwant it, that you can change the software or use pieces of it in new\nfree programs, and that you know you can do these things.\n\n  Developers that use our General Public Licenses protect your rights\nwith two steps: (1) assert copyright on the software, and (2) offer\nyou this License which gives you legal permission to copy, distribute\nand/or modify the software.\n\n  A secondary benefit of defending all users' freedom is that\nimprovements made in alternate versions of the program, if they\nreceive widespread use, become available for other developers to\nincorporate.  Many developers of free software are heartened and\nencouraged by the resulting cooperation.  However, in the case of\nsoftware used on network servers, this result may fail to come about.\nThe GNU General Public License permits making a modified version and\nletting the public access it on a server without ever releasing its\nsource code to the public.\n\n  The GNU Affero General Public License is designed specifically to\nensure that, in such cases, the modified source code becomes available\nto the community.  It requires the operator of a network server to\nprovide the source code of the modified version running there to the\nusers of that server.  Therefore, public use of a modified version, on\na publicly accessible server, gives the public access to the source\ncode of the modified version.\n\n  An older license, called the Affero General Public License and\npublished by Affero, was designed to accomplish similar goals.  This is\na different license, not a version of the Affero GPL, but Affero has\nreleased a new version of the Affero GPL which permits relicensing under\nthis license.\n\n  The precise terms and conditions for copying, distribution and\nmodification follow.\n\n                       TERMS AND CONDITIONS\n\n  0. Definitions.\n\n  \"This License\" refers to version 3 of the GNU Affero General Public License.\n\n  \"Copyright\" also means copyright-like laws that apply to other kinds of\nworks, such as semiconductor masks.\n\n  \"The Program\" refers to any copyrightable work licensed under this\nLicense.  Each licensee is addressed as \"you\".  \"Licensees\" and\n\"recipients\" may be individuals or organizations.\n\n  To \"modify\" a work means to copy from or adapt all or part of the work\nin a fashion requiring copyright permission, other than the making of an\nexact copy.  The resulting work is called a \"modified version\" of the\nearlier work or a work \"based on\" the earlier work.\n\n  A \"covered work\" means either the unmodified Program or a work based\non the Program.\n\n  To \"propagate\" a work means to do anything with it that, without\npermission, would make you directly or secondarily liable for\ninfringement under applicable copyright law, except executing it on a\ncomputer or modifying a private copy.  Propagation includes copying,\ndistribution (with or without modification), making available to the\npublic, and in some countries other activities as well.\n\n  To \"convey\" a work means any kind of propagation that enables other\nparties to make or receive copies.  Mere interaction with a user through\na computer network, with no transfer of a copy, is not conveying.\n\n  An interactive user interface displays \"Appropriate Legal Notices\"\nto the extent that it includes a convenient and prominently visible\nfeature that (1) displays an appropriate copyright notice, and (2)\ntells the user that there is no warranty for the work (except to the\nextent that warranties are provided), that licensees may convey the\nwork under this License, and how to view a copy of this License.  If\nthe interface presents a list of user commands or options, such as a\nmenu, a prominent item in the list meets this criterion.\n\n  1. Source Code.\n\n  The \"source code\" for a work means the preferred form of the work\nfor making modifications to it.  \"Object code\" means any non-source\nform of a work.\n\n  A \"Standard Interface\" means an interface that either is an official\nstandard defined by a recognized standards body, or, in the case of\ninterfaces specified for a particular programming language, one that\nis widely used among developers working in that language.\n\n  The \"System Libraries\" of an executable work include anything, other\nthan the work as a whole, that (a) is included in the normal form of\npackaging a Major Component, but which is not part of that Major\nComponent, and (b) serves only to enable use of the work with that\nMajor Component, or to implement a Standard Interface for which an\nimplementation is available to the public in source code form.  A\n\"Major Component\", in this context, means a major essential component\n(kernel, window system, and so on) of the specific operating system\n(if any) on which the executable work runs, or a compiler used to\nproduce the work, or an object code interpreter used to run it.\n\n  The \"Corresponding Source\" for a work in object code form means all\nthe source code needed to generate, install, and (for an executable\nwork) run the object code and to modify the work, including scripts to\ncontrol those activities.  However, it does not include the work's\nSystem Libraries, or general-purpose tools or generally available free\nprograms which are used unmodified in performing those activities but\nwhich are not part of the work.  For example, Corresponding Source\nincludes interface definition files associated with source files for\nthe work, and the source code for shared libraries and dynamically\nlinked subprograms that the work is specifically designed to require,\nsuch as by intimate data communication or control flow between those\nsubprograms and other parts of the work.\n\n  The Corresponding Source need not include anything that users\ncan regenerate automatically from other parts of the Corresponding\nSource.\n\n  The Corresponding Source for a work in source code form is that\nsame work.\n\n  2. Basic Permissions.\n\n  All rights granted under this License are granted for the term of\ncopyright on the Program, and are irrevocable provided the stated\nconditions are met.  This License explicitly affirms your unlimited\npermission to run the unmodified Program.  The output from running a\ncovered work is covered by this License only if the output, given its\ncontent, constitutes a covered work.  This License acknowledges your\nrights of fair use or other equivalent, as provided by copyright law.\n\n  You may make, run and propagate covered works that you do not\nconvey, without conditions so long as your license otherwise remains\nin force.  You may convey covered works to others for the sole purpose\nof having them make modifications exclusively for you, or provide you\nwith facilities for running those works, provided that you comply with\nthe terms of this License in conveying all material for which you do\nnot control copyright.  Those thus making or running the covered works\nfor you must do so exclusively on your behalf, under your direction\nand control, on terms that prohibit them from making any copies of\nyour copyrighted material outside their relationship with you.\n\n  Conveying under any other circumstances is permitted solely under\nthe conditions stated below.  Sublicensing is not allowed; section 10\nmakes it unnecessary.\n\n  3. Protecting Users' Legal Rights From Anti-Circumvention Law.\n\n  No covered work shall be deemed part of an effective technological\nmeasure under any applicable law fulfilling obligations under article\n11 of the WIPO copyright treaty adopted on 20 December 1996, or\nsimilar laws prohibiting or restricting circumvention of such\nmeasures.\n\n  When you convey a covered work, you waive any legal power to forbid\ncircumvention of technological measures to the extent such circumvention\nis effected by exercising rights under this License with respect to\nthe covered work, and you disclaim any intention to limit operation or\nmodification of the work as a means of enforcing, against the work's\nusers, your or third parties' legal rights to forbid circumvention of\ntechnological measures.\n\n  4. Conveying Verbatim Copies.\n\n  You may convey verbatim copies of the Program's source code as you\nreceive it, in any medium, provided that you conspicuously and\nappropriately publish on each copy an appropriate copyright notice;\nkeep intact all notices stating that this License and any\nnon-permissive terms added in accord with section 7 apply to the code;\nkeep intact all notices of the absence of any warranty; and give all\nrecipients a copy of this License along with the Program.\n\n  You may charge any price or no price for each copy that you convey,\nand you may offer support or warranty protection for a fee.\n\n  5. Conveying Modified Source Versions.\n\n  You may convey a work based on the Program, or the modifications to\nproduce it from the Program, in the form of source code under the\nterms of section 4, provided that you also meet all of these conditions:\n\n    a) The work must carry prominent notices stating that you modified\n    it, and giving a relevant date.\n\n    b) The work must carry prominent notices stating that it is\n    released under this License and any conditions added under section\n    7.  This requirement modifies the requirement in section 4 to\n    \"keep intact all notices\".\n\n    c) You must license the entire work, as a whole, under this\n    License to anyone who comes into possession of a copy.  This\n    License will therefore apply, along with any applicable section 7\n    additional terms, to the whole of the work, and all its parts,\n    regardless of how they are packaged.  This License gives no\n    permission to license the work in any other way, but it does not\n    invalidate such permission if you have separately received it.\n\n    d) If the work has interactive user interfaces, each must display\n    Appropriate Legal Notices; however, if the Program has interactive\n    interfaces that do not display Appropriate Legal Notices, your\n    work need not make them do so.\n\n  A compilation of a covered work with other separate and independent\nworks, which are not by their nature extensions of the covered work,\nand which are not combined with it such as to form a larger program,\nin or on a volume of a storage or distribution medium, is called an\n\"aggregate\" if the compilation and its resulting copyright are not\nused to limit the access or legal rights of the compilation's users\nbeyond what the individual works permit.  Inclusion of a covered work\nin an aggregate does not cause this License to apply to the other\nparts of the aggregate.\n\n  6. Conveying Non-Source Forms.\n\n  You may convey a covered work in object code form under the terms\nof sections 4 and 5, provided that you also convey the\nmachine-readable Corresponding Source under the terms of this License,\nin one of these ways:\n\n    a) Convey the object code in, or embodied in, a physical product\n    (including a physical distribution medium), accompanied by the\n    Corresponding Source fixed on a durable physical medium\n    customarily used for software interchange.\n\n    b) Convey the object code in, or embodied in, a physical product\n    (including a physical distribution medium), accompanied by a\n    written offer, valid for at least three years and valid for as\n    long as you offer spare parts or customer support for that product\n    model, to give anyone who possesses the object code either (1) a\n    copy of the Corresponding Source for all the software in the\n    product that is covered by this License, on a durable physical\n    medium customarily used for software interchange, for a price no\n    more than your reasonable cost of physically performing this\n    conveying of source, or (2) access to copy the\n    Corresponding Source from a network server at no charge.\n\n    c) Convey individual copies of the object code with a copy of the\n    written offer to provide the Corresponding Source.  This\n    alternative is allowed only occasionally and noncommercially, and\n    only if you received the object code with such an offer, in accord\n    with subsection 6b.\n\n    d) Convey the object code by offering access from a designated\n    place (gratis or for a charge), and offer equivalent access to the\n    Corresponding Source in the same way through the same place at no\n    further charge.  You need not require recipients to copy the\n    Corresponding Source along with the object code.  If the place to\n    copy the object code is a network server, the Corresponding Source\n    may be on a different server (operated by you or a third party)\n    that supports equivalent copying facilities, provided you maintain\n    clear directions next to the object code saying where to find the\n    Corresponding Source.  Regardless of what server hosts the\n    Corresponding Source, you remain obligated to ensure that it is\n    available for as long as needed to satisfy these requirements.\n\n    e) Convey the object code using peer-to-peer transmission, provided\n    you inform other peers where the object code and Corresponding\n    Source of the work are being offered to the general public at no\n    charge under subsection 6d.\n\n  A separable portion of the object code, whose source code is excluded\nfrom the Corresponding Source as a System Library, need not be\nincluded in conveying the object code work.\n\n  A \"User Product\" is either (1) a \"consumer product\", which means any\ntangible personal property which is normally used for personal, family,\nor household purposes, or (2) anything designed or sold for incorporation\ninto a dwelling.  In determining whether a product is a consumer product,\ndoubtful cases shall be resolved in favor of coverage.  For a particular\nproduct received by a particular user, \"normally used\" refers to a\ntypical or common use of that class of product, regardless of the status\nof the particular user or of the way in which the particular user\nactually uses, or expects or is expected to use, the product.  A product\nis a consumer product regardless of whether the product has substantial\ncommercial, industrial or non-consumer uses, unless such uses represent\nthe only significant mode of use of the product.\n\n  \"Installation Information\" for a User Product means any methods,\nprocedures, authorization keys, or other information required to install\nand execute modified versions of a covered work in that User Product from\na modified version of its Corresponding Source.  The information must\nsuffice to ensure that the continued functioning of the modified object\ncode is in no case prevented or interfered with solely because\nmodification has been made.\n\n  If you convey an object code work under this section in, or with, or\nspecifically for use in, a User Product, and the conveying occurs as\npart of a transaction in which the right of possession and use of the\nUser Product is transferred to the recipient in perpetuity or for a\nfixed term (regardless of how the transaction is characterized), the\nCorresponding Source conveyed under this section must be accompanied\nby the Installation Information.  But this requirement does not apply\nif neither you nor any third party retains the ability to install\nmodified object code on the User Product (for example, the work has\nbeen installed in ROM).\n\n  The requirement to provide Installation Information does not include a\nrequirement to continue to provide support service, warranty, or updates\nfor a work that has been modified or installed by the recipient, or for\nthe User Product in which it has been modified or installed.  Access to a\nnetwork may be denied when the modification itself materially and\nadversely affects the operation of the network or violates the rules and\nprotocols for communication across the network.\n\n  Corresponding Source conveyed, and Installation Information provided,\nin accord with this section must be in a format that is publicly\ndocumented (and with an implementation available to the public in\nsource code form), and must require no special password or key for\nunpacking, reading or copying.\n\n  7. Additional Terms.\n\n  \"Additional permissions\" are terms that supplement the terms of this\nLicense by making exceptions from one or more of its conditions.\nAdditional permissions that are applicable to the entire Program shall\nbe treated as though they were included in this License, to the extent\nthat they are valid under applicable law.  If additional permissions\napply only to part of the Program, that part may be used separately\nunder those permissions, but the entire Program remains governed by\nthis License without regard to the additional permissions.\n\n  When you convey a copy of a covered work, you may at your option\nremove any additional permissions from that copy, or from any part of\nit.  (Additional permissions may be written to require their own\nremoval in certain cases when you modify the work.)  You may place\nadditional permissions on material, added by you to a covered work,\nfor which you have or can give appropriate copyright permission.\n\n  Notwithstanding any other provision of this License, for material you\nadd to a covered work, you may (if authorized by the copyright holders of\nthat material) supplement the terms of this License with terms:\n\n    a) Disclaiming warranty or limiting liability differently from the\n    terms of sections 15 and 16 of this License; or\n\n    b) Requiring preservation of specified reasonable legal notices or\n    author attributions in that material or in the Appropriate Legal\n    Notices displayed by works containing it; or\n\n    c) Prohibiting misrepresentation of the origin of that material, or\n    requiring that modified versions of such material be marked in\n    reasonable ways as different from the original version; or\n\n    d) Limiting the use for publicity purposes of names of licensors or\n    authors of the material; or\n\n    e) Declining to grant rights under trademark law for use of some\n    trade names, trademarks, or service marks; or\n\n    f) Requiring indemnification of licensors and authors of that\n    material by anyone who conveys the material (or modified versions of\n    it) with contractual assumptions of liability to the recipient, for\n    any liability that these contractual assumptions directly impose on\n    those licensors and authors.\n\n  All other non-permissive additional terms are considered \"further\nrestrictions\" within the meaning of section 10.  If the Program as you\nreceived it, or any part of it, contains a notice stating that it is\ngoverned by this License along with a term that is a further\nrestriction, you may remove that term.  If a license document contains\na further restriction but permits relicensing or conveying under this\nLicense, you may add to a covered work material governed by the terms\nof that license document, provided that the further restriction does\nnot survive such relicensing or conveying.\n\n  If you add terms to a covered work in accord with this section, you\nmust place, in the relevant source files, a statement of the\nadditional terms that apply to those files, or a notice indicating\nwhere to find the applicable terms.\n\n  Additional terms, permissive or non-permissive, may be stated in the\nform of a separately written license, or stated as exceptions;\nthe above requirements apply either way.\n\n  8. Termination.\n\n  You may not propagate or modify a covered work except as expressly\nprovided under this License.  Any attempt otherwise to propagate or\nmodify it is void, and will automatically terminate your rights under\nthis License (including any patent licenses granted under the third\nparagraph of section 11).\n\n  However, if you cease all violation of this License, then your\nlicense from a particular copyright holder is reinstated (a)\nprovisionally, unless and until the copyright holder explicitly and\nfinally terminates your license, and (b) permanently, if the copyright\nholder fails to notify you of the violation by some reasonable means\nprior to 60 days after the cessation.\n\n  Moreover, your license from a particular copyright holder is\nreinstated permanently if the copyright holder notifies you of the\nviolation by some reasonable means, this is the first time you have\nreceived notice of violation of this License (for any work) from that\ncopyright holder, and you cure the violation prior to 30 days after\nyour receipt of the notice.\n\n  Termination of your rights under this section does not terminate the\nlicenses of parties who have received copies or rights from you under\nthis License.  If your rights have been terminated and not permanently\nreinstated, you do not qualify to receive new licenses for the same\nmaterial under section 10.\n\n  9. Acceptance Not Required for Having Copies.\n\n  You are not required to accept this License in order to receive or\nrun a copy of the Program.  Ancillary propagation of a covered work\noccurring solely as a consequence of using peer-to-peer transmission\nto receive a copy likewise does not require acceptance.  However,\nnothing other than this License grants you permission to propagate or\nmodify any covered work.  These actions infringe copyright if you do\nnot accept this License.  Therefore, by modifying or propagating a\ncovered work, you indicate your acceptance of this License to do so.\n\n  10. Automatic Licensing of Downstream Recipients.\n\n  Each time you convey a covered work, the recipient automatically\nreceives a license from the original licensors, to run, modify and\npropagate that work, subject to this License.  You are not responsible\nfor enforcing compliance by third parties with this License.\n\n  An \"entity transaction\" is a transaction transferring control of an\norganization, or substantially all assets of one, or subdividing an\norganization, or merging organizations.  If propagation of a covered\nwork results from an entity transaction, each party to that\ntransaction who receives a copy of the work also receives whatever\nlicenses to the work the party's predecessor in interest had or could\ngive under the previous paragraph, plus a right to possession of the\nCorresponding Source of the work from the predecessor in interest, if\nthe predecessor has it or can get it with reasonable efforts.\n\n  You may not impose any further restrictions on the exercise of the\nrights granted or affirmed under this License.  For example, you may\nnot impose a license fee, royalty, or other charge for exercise of\nrights granted under this License, and you may not initiate litigation\n(including a cross-claim or counterclaim in a lawsuit) alleging that\nany patent claim is infringed by making, using, selling, offering for\nsale, or importing the Program or any portion of it.\n\n  11. Patents.\n\n  A \"contributor\" is a copyright holder who authorizes use under this\nLicense of the Program or a work on which the Program is based.  The\nwork thus licensed is called the contributor's \"contributor version\".\n\n  A contributor's \"essential patent claims\" are all patent claims\nowned or controlled by the contributor, whether already acquired or\nhereafter acquired, that would be infringed by some manner, permitted\nby this License, of making, using, or selling its contributor version,\nbut do not include claims that would be infringed only as a\nconsequence of further modification of the contributor version.  For\npurposes of this definition, \"control\" includes the right to grant\npatent sublicenses in a manner consistent with the requirements of\nthis License.\n\n  Each contributor grants you a non-exclusive, worldwide, royalty-free\npatent license under the contributor's essential patent claims, to\nmake, use, sell, offer for sale, import and otherwise run, modify and\npropagate the contents of its contributor version.\n\n  In the following three paragraphs, a \"patent license\" is any express\nagreement or commitment, however denominated, not to enforce a patent\n(such as an express permission to practice a patent or covenant not to\nsue for patent infringement).  To \"grant\" such a patent license to a\nparty means to make such an agreement or commitment not to enforce a\npatent against the party.\n\n  If you convey a covered work, knowingly relying on a patent license,\nand the Corresponding Source of the work is not available for anyone\nto copy, free of charge and under the terms of this License, through a\npublicly available network server or other readily accessible means,\nthen you must either (1) cause the Corresponding Source to be so\navailable, or (2) arrange to deprive yourself of the benefit of the\npatent license for this particular work, or (3) arrange, in a manner\nconsistent with the requirements of this License, to extend the patent\nlicense to downstream recipients.  \"Knowingly relying\" means you have\nactual knowledge that, but for the patent license, your conveying the\ncovered work in a country, or your recipient's use of the covered work\nin a country, would infringe one or more identifiable patents in that\ncountry that you have reason to believe are valid.\n\n  If, pursuant to or in connection with a single transaction or\narrangement, you convey, or propagate by procuring conveyance of, a\ncovered work, and grant a patent license to some of the parties\nreceiving the covered work authorizing them to use, propagate, modify\nor convey a specific copy of the covered work, then the patent license\nyou grant is automatically extended to all recipients of the covered\nwork and works based on it.\n\n  A patent license is \"discriminatory\" if it does not include within\nthe scope of its coverage, prohibits the exercise of, or is\nconditioned on the non-exercise of one or more of the rights that are\nspecifically granted under this License.  You may not convey a covered\nwork if you are a party to an arrangement with a third party that is\nin the business of distributing software, under which you make payment\nto the third party based on the extent of your activity of conveying\nthe work, and under which the third party grants, to any of the\nparties who would receive the covered work from you, a discriminatory\npatent license (a) in connection with copies of the covered work\nconveyed by you (or copies made from those copies), or (b) primarily\nfor and in connection with specific products or compilations that\ncontain the covered work, unless you entered into that arrangement,\nor that patent license was granted, prior to 28 March 2007.\n\n  Nothing in this License shall be construed as excluding or limiting\nany implied license or other defenses to infringement that may\notherwise be available to you under applicable patent law.\n\n  12. No Surrender of Others' Freedom.\n\n  If conditions are imposed on you (whether by court order, agreement or\notherwise) that contradict the conditions of this License, they do not\nexcuse you from the conditions of this License.  If you cannot convey a\ncovered work so as to satisfy simultaneously your obligations under this\nLicense and any other pertinent obligations, then as a consequence you may\nnot convey it at all.  For example, if you agree to terms that obligate you\nto collect a royalty for further conveying from those to whom you convey\nthe Program, the only way you could satisfy both those terms and this\nLicense would be to refrain entirely from conveying the Program.\n\n  13. Remote Network Interaction; Use with the GNU General Public License.\n\n  Notwithstanding any other provision of this License, if you modify the\nProgram, your modified version must prominently offer all users\ninteracting with it remotely through a computer network (if your version\nsupports such interaction) an opportunity to receive the Corresponding\nSource of your version by providing access to the Corresponding Source\nfrom a network server at no charge, through some standard or customary\nmeans of facilitating copying of software.  This Corresponding Source\nshall include the Corresponding Source for any work covered by version 3\nof the GNU General Public License that is incorporated pursuant to the\nfollowing paragraph.\n\n  Notwithstanding any other provision of this License, you have\npermission to link or combine any covered work with a work licensed\nunder version 3 of the GNU General Public License into a single\ncombined work, and to convey the resulting work.  The terms of this\nLicense will continue to apply to the part which is the covered work,\nbut the work with which it is combined will remain governed by version\n3 of the GNU General Public License.\n\n  14. Revised Versions of this License.\n\n  The Free Software Foundation may publish revised and/or new versions of\nthe GNU Affero General Public License from time to time.  Such new versions\nwill be similar in spirit to the present version, but may differ in detail to\naddress new problems or concerns.\n\n  Each version is given a distinguishing version number.  If the\nProgram specifies that a certain numbered version of the GNU Affero General\nPublic License \"or any later version\" applies to it, you have the\noption of following the terms and conditions either of that numbered\nversion or of any later version published by the Free Software\nFoundation.  If the Program does not specify a version number of the\nGNU Affero General Public License, you may choose any version ever published\nby the Free Software Foundation.\n\n  If the Program specifies that a proxy can decide which future\nversions of the GNU Affero General Public License can be used, that proxy's\npublic statement of acceptance of a version permanently authorizes you\nto choose that version for the Program.\n\n  Later license versions may give you additional or different\npermissions.  However, no additional obligations are imposed on any\nauthor or copyright holder as a result of your choosing to follow a\nlater version.\n\n  15. Disclaimer of Warranty.\n\n  THERE IS NO WARRANTY FOR THE PROGRAM, TO THE EXTENT PERMITTED BY\nAPPLICABLE LAW.  EXCEPT WHEN OTHERWISE STATED IN WRITING THE COPYRIGHT\nHOLDERS AND/OR OTHER PARTIES PROVIDE THE PROGRAM \"AS IS\" WITHOUT WARRANTY\nOF ANY KIND, EITHER EXPRESSED OR IMPLIED, INCLUDING, BUT NOT LIMITED TO,\nTHE IMPLIED WARRANTIES OF MERCHANTABILITY AND FITNESS FOR A PARTICULAR\nPURPOSE.  THE ENTIRE RISK AS TO THE QUALITY AND PERFORMANCE OF THE PROGRAM\nIS WITH YOU.  SHOULD THE PROGRAM PROVE DEFECTIVE, YOU ASSUME THE COST OF\nALL NECESSARY SERVICING, REPAIR OR CORRECTION.\n\n  16. Limitation of Liability.\n\n  IN NO EVENT UNLESS REQUIRED BY APPLICABLE LAW OR AGREED TO IN WRITING\nWILL ANY COPYRIGHT HOLDER, OR ANY OTHER PARTY WHO MODIFIES AND/OR CONVEYS\nTHE PROGRAM AS PERMITTED ABOVE, BE LIABLE TO YOU FOR DAMAGES, INCLUDING ANY\nGENERAL, SPECIAL, INCIDENTAL OR CONSEQUENTIAL DAMAGES ARISING OUT OF THE\nUSE OR INABILITY TO USE THE PROGRAM (INCLUDING BUT NOT LIMITED TO LOSS OF\nDATA OR DATA BEING RENDERED INACCURATE OR LOSSES SUSTAINED BY YOU OR THIRD\nPARTIES OR A FAILURE OF THE PROGRAM TO OPERATE WITH ANY OTHER PROGRAMS),\nEVEN IF SUCH HOLDER OR OTHER PARTY HAS BEEN ADVISED OF THE POSSIBILITY OF\nSUCH DAMAGES.\n\n  17. Interpretation of Sections 15 and 16.\n\n  If the disclaimer of warranty and limitation of liability provided\nabove cannot be given local legal effect according to their terms,\nreviewing courts shall apply local law that most closely approximates\nan absolute waiver of all civil liability in connection with the\nProgram, unless a warranty or assumption of liability accompanies a\ncopy of the Program in return for a fee.\n\n                     END OF TERMS AND CONDITIONS\n\n            How to Apply These Terms to Your New Programs\n\n  If you develop a new program, and you want it to be of the greatest\npossible use to the public, the best way to achieve this is to make it\nfree software which everyone can redistribute and change under these terms.\n\n  To do so, attach the following notices to the program.  It is safest\nto attach them to the start of each source file to most effectively\nstate the exclusion of warranty; and each file should have at least\nthe \"copyright\" line and a pointer to where the full notice is found.\n\n    <one line to give the program's name and a brief idea of what it does.>\n    Copyright (C) <year>  <name of author>\n\n    This program is free software: you can redistribute it and/or modify\n    it under the terms of the GNU Affero General Public License as published\n    by the Free Software Foundation, either version 3 of the License, or\n    (at your option) any later version.\n\n    This program is distributed in the hope that it will be useful,\n    but WITHOUT ANY WARRANTY; without even the implied warranty of\n    MERCHANTABILITY or FITNESS FOR A PARTICULAR PURPOSE.  See the\n    GNU Affero General Public License for more details.\n\n    You should have received a copy of the GNU Affero General Public License\n    along with this program.  If not, see <https://www.gnu.org/licenses/>.\n\nAlso add information on how to contact you by electronic and paper mail.\n\n  If your software can interact with users remotely through a computer\nnetwork, you should also make sure that it provides a way for users to\nget its source.  For example, if your program is a web application, its\ninterface could display a \"Source\" link that leads users to an archive\nof the code.  There are many ways you could offer source, and different\nsolutions will be better for different programs; see section 13 for the\nspecific requirements.\n\n  You should also get your employer (if you work as a programmer) or school,\nif any, to sign a \"copyright disclaimer\" for the program, if necessary.\nFor more information on this, and how to apply and follow the GNU AGPL, see\n<https://www.gnu.org/licenses/>.\n"
        },
        {
          "name": "README.md",
          "type": "blob",
          "size": 3.7744140625,
          "content": "![Musish](https://i.imgur.com/ROMO267.png)\n\n# Musish ([musi.sh](https://musi.sh/))\n\nThe unofficial open source Apple Music webapp.\n\nBuilt with React and Apple's MusicKit JS while utilising the official Apple Music API.\nContains some serverless functions deployed with AWS Lambda to speed up certain functionalities. (Found in [backend](https://github.com/Musish/Musish/tree/master/src/backend)).\n\n[![CircleCI](https://img.shields.io/circleci/project/github/Musish/Musish/master.svg)](https://circleci.com/gh/Musish/Musish) ![Dependencies](https://img.shields.io/david/musish/musish.svg) [![OpenCollective](https://opencollective.com/musish/backers/badge.svg)](https://opencollective.com/musish)\n\n![Musish Browse Page](https://i.imgur.com/TFJyZnu.png)\n\n## Looks neat, how can I contribute?\n\nThe Musish project welcomes contributions of all sorts; PRs, issues, feedback, comments, donations, or even just sharing the project would all be infinitely useful to us!\n\nPlease do remember to read our contributing guidelines before making a pull request.\n\nWe also welcome financial contributions in full transparency on our [open collective](https://opencollective.com/musish), and we are extremely thankful for all those who have contributed already:\n\n[![Backers on Open Collective](https://opencollective.com/musish/tiers/backer.svg?avatarHeight=36&width=600)](https://opencollective.com/Musish)\n\nA massive thank you also to our code contributors, who you can see [here](https://github.com/Musish/Musish/graphs/contributors)\n\n## Self hosting\n\nBuilding [Musi.sh](https://musi.sh/) requires [node](https://nodejs.org/en/) and [yarn](https://yarnpkg.com/lang/en/docs/install/).\n\n#### Running the Musish web app:\n\n##### 1. Generating an Apple Developer Token (JWT):\n\nMusish uses the Apple Music API and therefore you'll need a signed developer token from Apple.\n\nPlease reference [Apple's official guide](https://developer.apple.com/documentation/applemusicapi/getting_keys_and_creating_tokens) on generating the keys and an associated token.\n\n##### 2. Environment setup:\n\nMusish requires two environment variables to start. You'll need to enter your Apple Developer token as `APPLE_TOKEN`, and a link to your hosted Musish backend with `BACKEND_URL`.\n\n.env.example:\n\n```txt\nAPPLE_TOKEN=your_apple_music_token\nBACKEND_URL=https://musish.app\n```\n\n##### 3. Install dependencies:\n\n```shell\nyarn\n```\n\n##### 4. Launch Musish:\n\nStart webpack dev server on port 8080:\n\n```shell\nyarn start\n```\n\n_Or:_\n\n```shell\nyarn build\n```\n\nThis will create a directory called `dist` in the project root, these files can be served from a web server as static content.\n\n#### Running the Musish backend:\n\nWe use [Serverless](https://serverless.com) to run our backend on AWS lambdas, however you can choose differently here.\n\n##### Generating a Genius Developer Token:\n\nIf you wish to work on the Musish project's serverless backend, you will require a Genius Developer token.\n\nCreate a client access token via [Genius' developer portal](https://genius.com/developers).\n\n## Is it safe?\n\nMusish uses official Apple public APIs and libraries to handle authentication. The user is prompted to login directly on a new window under the Apple.com domain. Apple.com returns the user a temporary valid token to allow their browser to make requests to Apple Music data only.\n\nAt no point do we request, log, or gain access to information from a user of the site. The user's token is never sent to any server other than Apple's own. At no point do we ever intentionally pass any user information to any server which we control.\n\nOur official build (https://musi.sh/) is powered by Github Pages with an AWS lambda providing both lyrics and artist information, we send no cookies or headers related to your Apple account.\n\n---\n\nCredits:\n\n- Musish logo (headphone icon) provided by zidney from the Noun Project.\n"
        },
        {
          "name": "package.json",
          "type": "blob",
          "size": 2.6533203125,
          "content": "{\n  \"name\": \"Musish\",\n  \"version\": \"1.0.0\",\n  \"main\": \"index.js\",\n  \"license\": \"MIT\",\n  \"husky\": {\n    \"hooks\": {\n      \"pre-commit\": \"yarn tslint:check\"\n    }\n  },\n  \"dependencies\": {\n    \"@babel/plugin-proposal-class-properties\": \"^7.4.4\",\n    \"@babel/polyfill\": \"^7.0.0\",\n    \"@babel/preset-react\": \"^7.0.0\",\n    \"@sentry/browser\": \"^4.6.6\",\n    \"@symfony/webpack-encore\": \"^0.27.0\",\n    \"@types/classnames\": \"^2.2.7\",\n    \"@types/hoist-non-react-statics\": \"^3.3.1\",\n    \"@types/js-md5\": \"^0.4.2\",\n    \"@types/lodash\": \"^4.14.136\",\n    \"@types/mousetrap\": \"^1.6.3\",\n    \"@types/prop-types\": \"^15.7.1\",\n    \"@types/qs\": \"^6.5.3\",\n    \"@types/react\": \"^16.8.18\",\n    \"@types/react-dom\": \"^16.8.4\",\n    \"@types/react-router-dom\": \"^4.3.4\",\n    \"@types/react-s-alert\": \"^1.3.2\",\n    \"@types/react-virtualized\": \"^9.21.1\",\n    \"@types/webpack-env\": \"^1.14.0\",\n    \"axios\": \"^0.18.1\",\n    \"classnames\": \"^2.2.6\",\n    \"concurrently\": \"^4.1.0\",\n    \"dotenv-webpack\": \"^1.5.7\",\n    \"favicons-webpack-plugin\": \"^0.0.9\",\n    \"hoist-non-react-statics\": \"^3.2.1\",\n    \"html-loader\": \"^0.5.5\",\n    \"html-webpack-plugin\": \"^3.2.0\",\n    \"husky\": \"^1.3.0\",\n    \"include-media\": \"^1.4.9\",\n    \"js-md5\": \"^0.7.3\",\n    \"lodash\": \"^4.17.13\",\n    \"mousetrap\": \"^1.6.2\",\n    \"node-sass\": \"^4.14.1\",\n    \"normalize.css\": \"^8.0.1\",\n    \"prop-types\": \"^15.6.2\",\n    \"qs\": \"^6.7.0\",\n    \"react\": \"^16.8.6\",\n    \"react-content-loader\": \"^3.4.1\",\n    \"react-contextmenu\": \"^2.10.0\",\n    \"react-dnd\": \"^7.4.5\",\n    \"react-dnd-html5-backend\": \"^7.0.2\",\n    \"react-dom\": \"^16.8.6\",\n    \"react-draggable\": \"^3.0.5\",\n    \"react-lines-ellipsis\": \"^0.14.1\",\n    \"react-localization\": \"^1.0.13\",\n    \"react-router-dom\": \"^4.3.1\",\n    \"react-s-alert\": \"^1.4.1\",\n    \"react-sortable-hoc\": \"^1.6.1\",\n    \"react-virtualized\": \"^9.21.0\",\n    \"sass-loader\": \"^7.1.0\",\n    \"ts-loader\": \"^6.0.1\",\n    \"tslint\": \"^5.16.0\",\n    \"tslint-plugin-prettier\": \"^2.0.1\",\n    \"typed-scss-modules\": \"^0.0.10\",\n    \"typescript\": \"^3.4.5\",\n    \"vanilla-tilt\": \"^1.5.0\",\n    \"whatwg-fetch\": \"^3.0.0\"\n  },\n  \"scripts\": {\n    \"server\": \"encore dev-server --hot\",\n    \"tsmp\": \"tsm \\\"src/app/**/*.scss\\\" --aliasPrefixes.~ node_modules/\",\n    \"start\": \"concurrently --kill-others \\\"yarn server\\\" \\\"yarn tsmp -w\\\"\",\n    \"build\": \"yarn tsmp && yarn encore production\",\n    \"tslint\": \"tslint -c tslint.json --project .\",\n    \"tslint:fix\": \"yarn tslint --fix\",\n    \"tslint:check\": \"yarn tslint -c\",\n    \"tslint:check-config\": \"tslint-config-prettier-check ./tslint.json\"\n  },\n  \"devDependencies\": {\n    \"musickit-typescript\": \"^1.2.4\",\n    \"prettier\": \"^1.17.1\",\n    \"prettier-tslint\": \"^0.4.2\",\n    \"tslint-config-prettier\": \"^1.18.0\",\n    \"tslint-junit-formatter\": \"^5.1.0\"\n  }\n}\n"
        },
        {
          "name": "src",
          "type": "tree",
          "content": null
        },
        {
          "name": "tsconfig.json",
          "type": "blob",
          "size": 0.931640625,
          "content": "{\n  \"compilerOptions\": {\n    \"baseUrl\": \".\",\n    \"outDir\": \"./build/ts\",     // path to output directory\n    \"sourceMap\": true,          // allow sourcemap support\n    \"strictNullChecks\": true,   // enable strict null checks as a best practice\n    \"module\": \"es6\",            // specify module code generation\n    \"jsx\": \"react\",             // use typescript to transpile jsx to js\n    \"target\": \"es5\",            // specify ECMAScript target version\n    \"moduleResolution\": \"node\",\n    \"allowSyntheticDefaultImports\": true,\n    \"noImplicitReturns\": false,\n    \"noImplicitAny\": true,\n    \"noImplicitThis\": false,\n    \"noUnusedParameters\": true,\n    \"noUnusedLocals\": true,\n    \"resolveJsonModule\": true,\n    \"typeRoots\": [\n      \"node_modules/musickit-typescript\",\n      \"node_modules/@types\",\n      \"src/app/types\"\n    ],\n    \"lib\": [\n      \"es2015\",\n      \"es6\",\n      \"dom\",\n      \"es2017.object\"\n    ]\n  },\n  \"include\": [\n    \"./src/app/**/*\"\n  ]\n}\n"
        },
        {
          "name": "tslint.json",
          "type": "blob",
          "size": 0.3876953125,
          "content": "{\n  \"defaultSeverity\": \"error\",\n  \"extends\": [\n    \"tslint:recommended\",\n    \"tslint-config-prettier\"\n  ],\n  \"rulesDirectory\": [\n    \"tslint-plugin-prettier\"\n  ],\n  \"jsRules\": true,\n  \"rules\": {\n    \"prettier\": [true, \".prettierrc\"],\n    \"object-literal-sort-keys\": false,\n    \"interface-name\": [true, \"never-prefix\"]\n  },\n  \"linterOptions\": {\n    \"exclude\": [\n      \"node_modules/**\"\n    ]\n  }\n}\n"
        },
        {
          "name": "webpack.config.js",
          "type": "blob",
          "size": 2.4423828125,
          "content": "/* tslint:disable */\n\nconst webpack = require('webpack');\nconst Dotenv = require('dotenv-webpack');\nconst Encore = require('@symfony/webpack-encore');\nconst HtmlWebpackPlugin = require('html-webpack-plugin');\nconst FaviconsWebpackPlugin = require('favicons-webpack-plugin');\n\nEncore.setOutputPath('build/')\n  .setPublicPath('/')\n  .addEntry('app', './src/app/index.tsx')\n  .enableSingleRuntimeChunk()\n  .cleanupOutputBeforeBuild()\n  .enableSourceMaps(true)\n  // enables hashed filenames (e.g. app.abc123.css)\n  .enableVersioning(Encore.isProduction())\n  .configureCssLoader(config => {\n    config.modules = true;\n    if (Encore.isProduction()) {\n      config.localIdentName = '[sha1:hash:hex:4]';\n    } else {\n      config.localIdentName = '[name]__[local]--[sha1:hash:hex:4]';\n    }\n  })\n  .enableTypeScriptLoader()\n  .enableReactPreset()\n  .enableSassLoader();\n\nconst config = Encore.getWebpackConfig();\n\nconfig.plugins.push(\n  new HtmlWebpackPlugin({\n    template: 'src/app/app.html',\n    title: 'Musish',\n    meta: {\n      viewport: 'width=device-width, initial-scale=1, shrink-to-fit=no',\n    },\n    env: process.env,\n  }),\n);\n\nconfig.plugins.push(new Dotenv());\n\nif (!Encore.isProduction()) {\n  config.devServer.historyApiFallback = {\n    disableDotRule: true,\n  };\n}\n\nconfig.plugins.push(new FaviconsWebpackPlugin({\n  // Your source logo\n  logo: `${__dirname}/src/app/assets/images/musish-favicon.svg`,\n  // The prefix for all image files (might be a folder or a name)\n  prefix: 'icons-[hash]/',\n  // Emit all stats of the generated icons\n  emitStats: false,\n  // The name of the json containing all favicon information\n  statsFilename: 'iconstats-[hash].json',\n  // Generate a cache file with control hashes and\n  // don't rebuild the favicons until those hashes change\n  persistentCache: true,\n  // Inject the html into the html-webpack-plugin\n  inject: true,\n  // favicon background color (see https://github.com/haydenbleasel/favicons#usage)\n  background: 'transparent',\n  // favicon app title (see https://github.com/haydenbleasel/favicons#usage)\n  title: 'Musish',\n\n  // which icons should be generated (see https://github.com/haydenbleasel/favicons#usage)\n  icons: {\n    android: true,\n    appleIcon: true,\n    appleStartup: true,\n    coast: false,\n    favicons: true,\n    firefox: true,\n    opengraph: false,\n    twitter: false,\n    yandex: false,\n    windows: false\n  }\n}));\n\nconfig.plugins.push(\n  new webpack.WatchIgnorePlugin([\n    /scss\\.d\\.ts$/\n  ]),\n);\n\nmodule.exports = config;\n"
        },
        {
          "name": "yarn.lock",
          "type": "blob",
          "size": 273.1953125,
          "content": "# THIS IS AN AUTOGENERATED FILE. DO NOT EDIT THIS FILE DIRECTLY.\n# yarn lockfile v1\n\n\n\"@babel/code-frame@^7.0.0\":\n  version \"7.0.0\"\n  resolved \"https://registry.yarnpkg.com/@babel/code-frame/-/code-frame-7.0.0.tgz#06e2ab19bdb535385559aabb5ba59729482800f8\"\n  dependencies:\n    \"@babel/highlight\" \"^7.0.0\"\n\n\"@babel/core@^7.4.0\":\n  version \"7.4.5\"\n  resolved \"https://registry.yarnpkg.com/@babel/core/-/core-7.4.5.tgz#081f97e8ffca65a9b4b0fdc7e274e703f000c06a\"\n  dependencies:\n    \"@babel/code-frame\" \"^7.0.0\"\n    \"@babel/generator\" \"^7.4.4\"\n    \"@babel/helpers\" \"^7.4.4\"\n    \"@babel/parser\" \"^7.4.5\"\n    \"@babel/template\" \"^7.4.4\"\n    \"@babel/traverse\" \"^7.4.5\"\n    \"@babel/types\" \"^7.4.4\"\n    convert-source-map \"^1.1.0\"\n    debug \"^4.1.0\"\n    json5 \"^2.1.0\"\n    lodash \"^4.17.11\"\n    resolve \"^1.3.2\"\n    semver \"^5.4.1\"\n    source-map \"^0.5.0\"\n\n\"@babel/generator@^7.3.4\":\n  version \"7.3.4\"\n  resolved \"https://registry.yarnpkg.com/@babel/generator/-/generator-7.3.4.tgz#9aa48c1989257877a9d971296e5b73bfe72e446e\"\n  dependencies:\n    \"@babel/types\" \"^7.3.4\"\n    jsesc \"^2.5.1\"\n    lodash \"^4.17.11\"\n    source-map \"^0.5.0\"\n    trim-right \"^1.0.1\"\n\n\"@babel/generator@^7.4.4\":\n  version \"7.4.4\"\n  resolved \"https://registry.yarnpkg.com/@babel/generator/-/generator-7.4.4.tgz#174a215eb843fc392c7edcaabeaa873de6e8f041\"\n  dependencies:\n    \"@babel/types\" \"^7.4.4\"\n    jsesc \"^2.5.1\"\n    lodash \"^4.17.11\"\n    source-map \"^0.5.0\"\n    trim-right \"^1.0.1\"\n\n\"@babel/helper-annotate-as-pure@^7.0.0\":\n  version \"7.0.0\"\n  resolved \"https://registry.yarnpkg.com/@babel/helper-annotate-as-pure/-/helper-annotate-as-pure-7.0.0.tgz#323d39dd0b50e10c7c06ca7d7638e6864d8c5c32\"\n  dependencies:\n    \"@babel/types\" \"^7.0.0\"\n\n\"@babel/helper-builder-binary-assignment-operator-visitor@^7.1.0\":\n  version \"7.1.0\"\n  resolved \"https://registry.yarnpkg.com/@babel/helper-builder-binary-assignment-operator-visitor/-/helper-builder-binary-assignment-operator-visitor-7.1.0.tgz#6b69628dfe4087798e0c4ed98e3d4a6b2fbd2f5f\"\n  dependencies:\n    \"@babel/helper-explode-assignable-expression\" \"^7.1.0\"\n    \"@babel/types\" \"^7.0.0\"\n\n\"@babel/helper-builder-react-jsx@^7.3.0\":\n  version \"7.3.0\"\n  resolved \"https://registry.yarnpkg.com/@babel/helper-builder-react-jsx/-/helper-builder-react-jsx-7.3.0.tgz#a1ac95a5d2b3e88ae5e54846bf462eeb81b318a4\"\n  dependencies:\n    \"@babel/types\" \"^7.3.0\"\n    esutils \"^2.0.0\"\n\n\"@babel/helper-call-delegate@^7.4.4\":\n  version \"7.4.4\"\n  resolved \"https://registry.yarnpkg.com/@babel/helper-call-delegate/-/helper-call-delegate-7.4.4.tgz#87c1f8ca19ad552a736a7a27b1c1fcf8b1ff1f43\"\n  dependencies:\n    \"@babel/helper-hoist-variables\" \"^7.4.4\"\n    \"@babel/traverse\" \"^7.4.4\"\n    \"@babel/types\" \"^7.4.4\"\n\n\"@babel/helper-create-class-features-plugin@^7.4.4\":\n  version \"7.4.4\"\n  resolved \"https://registry.yarnpkg.com/@babel/helper-create-class-features-plugin/-/helper-create-class-features-plugin-7.4.4.tgz#fc3d690af6554cc9efc607364a82d48f58736dba\"\n  dependencies:\n    \"@babel/helper-function-name\" \"^7.1.0\"\n    \"@babel/helper-member-expression-to-functions\" \"^7.0.0\"\n    \"@babel/helper-optimise-call-expression\" \"^7.0.0\"\n    \"@babel/helper-plugin-utils\" \"^7.0.0\"\n    \"@babel/helper-replace-supers\" \"^7.4.4\"\n    \"@babel/helper-split-export-declaration\" \"^7.4.4\"\n\n\"@babel/helper-define-map@^7.4.4\":\n  version \"7.4.4\"\n  resolved \"https://registry.yarnpkg.com/@babel/helper-define-map/-/helper-define-map-7.4.4.tgz#6969d1f570b46bdc900d1eba8e5d59c48ba2c12a\"\n  dependencies:\n    \"@babel/helper-function-name\" \"^7.1.0\"\n    \"@babel/types\" \"^7.4.4\"\n    lodash \"^4.17.11\"\n\n\"@babel/helper-explode-assignable-expression@^7.1.0\":\n  version \"7.1.0\"\n  resolved \"https://registry.yarnpkg.com/@babel/helper-explode-assignable-expression/-/helper-explode-assignable-expression-7.1.0.tgz#537fa13f6f1674df745b0c00ec8fe4e99681c8f6\"\n  dependencies:\n    \"@babel/traverse\" \"^7.1.0\"\n    \"@babel/types\" \"^7.0.0\"\n\n\"@babel/helper-function-name@^7.1.0\":\n  version \"7.1.0\"\n  resolved \"https://registry.yarnpkg.com/@babel/helper-function-name/-/helper-function-name-7.1.0.tgz#a0ceb01685f73355d4360c1247f582bfafc8ff53\"\n  dependencies:\n    \"@babel/helper-get-function-arity\" \"^7.0.0\"\n    \"@babel/template\" \"^7.1.0\"\n    \"@babel/types\" \"^7.0.0\"\n\n\"@babel/helper-get-function-arity@^7.0.0\":\n  version \"7.0.0\"\n  resolved \"https://registry.yarnpkg.com/@babel/helper-get-function-arity/-/helper-get-function-arity-7.0.0.tgz#83572d4320e2a4657263734113c42868b64e49c3\"\n  dependencies:\n    \"@babel/types\" \"^7.0.0\"\n\n\"@babel/helper-hoist-variables@^7.4.4\":\n  version \"7.4.4\"\n  resolved \"https://registry.yarnpkg.com/@babel/helper-hoist-variables/-/helper-hoist-variables-7.4.4.tgz#0298b5f25c8c09c53102d52ac4a98f773eb2850a\"\n  dependencies:\n    \"@babel/types\" \"^7.4.4\"\n\n\"@babel/helper-member-expression-to-functions@^7.0.0\":\n  version \"7.0.0\"\n  resolved \"https://registry.yarnpkg.com/@babel/helper-member-expression-to-functions/-/helper-member-expression-to-functions-7.0.0.tgz#8cd14b0a0df7ff00f009e7d7a436945f47c7a16f\"\n  dependencies:\n    \"@babel/types\" \"^7.0.0\"\n\n\"@babel/helper-module-imports@^7.0.0\":\n  version \"7.0.0\"\n  resolved \"https://registry.yarnpkg.com/@babel/helper-module-imports/-/helper-module-imports-7.0.0.tgz#96081b7111e486da4d2cd971ad1a4fe216cc2e3d\"\n  dependencies:\n    \"@babel/types\" \"^7.0.0\"\n\n\"@babel/helper-module-transforms@^7.1.0\":\n  version \"7.2.2\"\n  resolved \"https://registry.yarnpkg.com/@babel/helper-module-transforms/-/helper-module-transforms-7.2.2.tgz#ab2f8e8d231409f8370c883d20c335190284b963\"\n  dependencies:\n    \"@babel/helper-module-imports\" \"^7.0.0\"\n    \"@babel/helper-simple-access\" \"^7.1.0\"\n    \"@babel/helper-split-export-declaration\" \"^7.0.0\"\n    \"@babel/template\" \"^7.2.2\"\n    \"@babel/types\" \"^7.2.2\"\n    lodash \"^4.17.10\"\n\n\"@babel/helper-module-transforms@^7.4.4\":\n  version \"7.4.4\"\n  resolved \"https://registry.yarnpkg.com/@babel/helper-module-transforms/-/helper-module-transforms-7.4.4.tgz#96115ea42a2f139e619e98ed46df6019b94414b8\"\n  dependencies:\n    \"@babel/helper-module-imports\" \"^7.0.0\"\n    \"@babel/helper-simple-access\" \"^7.1.0\"\n    \"@babel/helper-split-export-declaration\" \"^7.4.4\"\n    \"@babel/template\" \"^7.4.4\"\n    \"@babel/types\" \"^7.4.4\"\n    lodash \"^4.17.11\"\n\n\"@babel/helper-optimise-call-expression@^7.0.0\":\n  version \"7.0.0\"\n  resolved \"https://registry.yarnpkg.com/@babel/helper-optimise-call-expression/-/helper-optimise-call-expression-7.0.0.tgz#a2920c5702b073c15de51106200aa8cad20497d5\"\n  dependencies:\n    \"@babel/types\" \"^7.0.0\"\n\n\"@babel/helper-plugin-utils@^7.0.0\":\n  version \"7.0.0\"\n  resolved \"https://registry.yarnpkg.com/@babel/helper-plugin-utils/-/helper-plugin-utils-7.0.0.tgz#bbb3fbee98661c569034237cc03967ba99b4f250\"\n\n\"@babel/helper-regex@^7.0.0\":\n  version \"7.0.0\"\n  resolved \"https://registry.yarnpkg.com/@babel/helper-regex/-/helper-regex-7.0.0.tgz#2c1718923b57f9bbe64705ffe5640ac64d9bdb27\"\n  dependencies:\n    lodash \"^4.17.10\"\n\n\"@babel/helper-regex@^7.4.4\":\n  version \"7.4.4\"\n  resolved \"https://registry.yarnpkg.com/@babel/helper-regex/-/helper-regex-7.4.4.tgz#a47e02bc91fb259d2e6727c2a30013e3ac13c4a2\"\n  dependencies:\n    lodash \"^4.17.11\"\n\n\"@babel/helper-remap-async-to-generator@^7.1.0\":\n  version \"7.1.0\"\n  resolved \"https://registry.yarnpkg.com/@babel/helper-remap-async-to-generator/-/helper-remap-async-to-generator-7.1.0.tgz#361d80821b6f38da75bd3f0785ece20a88c5fe7f\"\n  dependencies:\n    \"@babel/helper-annotate-as-pure\" \"^7.0.0\"\n    \"@babel/helper-wrap-function\" \"^7.1.0\"\n    \"@babel/template\" \"^7.1.0\"\n    \"@babel/traverse\" \"^7.1.0\"\n    \"@babel/types\" \"^7.0.0\"\n\n\"@babel/helper-replace-supers@^7.1.0\":\n  version \"7.3.4\"\n  resolved \"https://registry.yarnpkg.com/@babel/helper-replace-supers/-/helper-replace-supers-7.3.4.tgz#a795208e9b911a6eeb08e5891faacf06e7013e13\"\n  dependencies:\n    \"@babel/helper-member-expression-to-functions\" \"^7.0.0\"\n    \"@babel/helper-optimise-call-expression\" \"^7.0.0\"\n    \"@babel/traverse\" \"^7.3.4\"\n    \"@babel/types\" \"^7.3.4\"\n\n\"@babel/helper-replace-supers@^7.4.4\":\n  version \"7.4.4\"\n  resolved \"https://registry.yarnpkg.com/@babel/helper-replace-supers/-/helper-replace-supers-7.4.4.tgz#aee41783ebe4f2d3ab3ae775e1cc6f1a90cefa27\"\n  dependencies:\n    \"@babel/helper-member-expression-to-functions\" \"^7.0.0\"\n    \"@babel/helper-optimise-call-expression\" \"^7.0.0\"\n    \"@babel/traverse\" \"^7.4.4\"\n    \"@babel/types\" \"^7.4.4\"\n\n\"@babel/helper-simple-access@^7.1.0\":\n  version \"7.1.0\"\n  resolved \"https://registry.yarnpkg.com/@babel/helper-simple-access/-/helper-simple-access-7.1.0.tgz#65eeb954c8c245beaa4e859da6188f39d71e585c\"\n  dependencies:\n    \"@babel/template\" \"^7.1.0\"\n    \"@babel/types\" \"^7.0.0\"\n\n\"@babel/helper-split-export-declaration@^7.0.0\":\n  version \"7.0.0\"\n  resolved \"https://registry.yarnpkg.com/@babel/helper-split-export-declaration/-/helper-split-export-declaration-7.0.0.tgz#3aae285c0311c2ab095d997b8c9a94cad547d813\"\n  dependencies:\n    \"@babel/types\" \"^7.0.0\"\n\n\"@babel/helper-split-export-declaration@^7.4.4\":\n  version \"7.4.4\"\n  resolved \"https://registry.yarnpkg.com/@babel/helper-split-export-declaration/-/helper-split-export-declaration-7.4.4.tgz#ff94894a340be78f53f06af038b205c49d993677\"\n  dependencies:\n    \"@babel/types\" \"^7.4.4\"\n\n\"@babel/helper-wrap-function@^7.1.0\":\n  version \"7.2.0\"\n  resolved \"https://registry.yarnpkg.com/@babel/helper-wrap-function/-/helper-wrap-function-7.2.0.tgz#c4e0012445769e2815b55296ead43a958549f6fa\"\n  dependencies:\n    \"@babel/helper-function-name\" \"^7.1.0\"\n    \"@babel/template\" \"^7.1.0\"\n    \"@babel/traverse\" \"^7.1.0\"\n    \"@babel/types\" \"^7.2.0\"\n\n\"@babel/helpers@^7.4.4\":\n  version \"7.4.4\"\n  resolved \"https://registry.yarnpkg.com/@babel/helpers/-/helpers-7.4.4.tgz#868b0ef59c1dd4e78744562d5ce1b59c89f2f2a5\"\n  dependencies:\n    \"@babel/template\" \"^7.4.4\"\n    \"@babel/traverse\" \"^7.4.4\"\n    \"@babel/types\" \"^7.4.4\"\n\n\"@babel/highlight@^7.0.0\":\n  version \"7.0.0\"\n  resolved \"https://registry.yarnpkg.com/@babel/highlight/-/highlight-7.0.0.tgz#f710c38c8d458e6dd9a201afb637fcb781ce99e4\"\n  dependencies:\n    chalk \"^2.0.0\"\n    esutils \"^2.0.2\"\n    js-tokens \"^4.0.0\"\n\n\"@babel/parser@^7.2.2\", \"@babel/parser@^7.3.4\":\n  version \"7.3.4\"\n  resolved \"https://registry.yarnpkg.com/@babel/parser/-/parser-7.3.4.tgz#a43357e4bbf4b92a437fb9e465c192848287f27c\"\n\n\"@babel/parser@^7.4.4\", \"@babel/parser@^7.4.5\":\n  version \"7.4.5\"\n  resolved \"https://registry.yarnpkg.com/@babel/parser/-/parser-7.4.5.tgz#04af8d5d5a2b044a2a1bffacc1e5e6673544e872\"\n\n\"@babel/plugin-proposal-async-generator-functions@^7.2.0\":\n  version \"7.2.0\"\n  resolved \"https://registry.yarnpkg.com/@babel/plugin-proposal-async-generator-functions/-/plugin-proposal-async-generator-functions-7.2.0.tgz#b289b306669dce4ad20b0252889a15768c9d417e\"\n  dependencies:\n    \"@babel/helper-plugin-utils\" \"^7.0.0\"\n    \"@babel/helper-remap-async-to-generator\" \"^7.1.0\"\n    \"@babel/plugin-syntax-async-generators\" \"^7.2.0\"\n\n\"@babel/plugin-proposal-class-properties@^7.4.4\":\n  version \"7.4.4\"\n  resolved \"https://registry.yarnpkg.com/@babel/plugin-proposal-class-properties/-/plugin-proposal-class-properties-7.4.4.tgz#93a6486eed86d53452ab9bab35e368e9461198ce\"\n  dependencies:\n    \"@babel/helper-create-class-features-plugin\" \"^7.4.4\"\n    \"@babel/helper-plugin-utils\" \"^7.0.0\"\n\n\"@babel/plugin-proposal-json-strings@^7.2.0\":\n  version \"7.2.0\"\n  resolved \"https://registry.yarnpkg.com/@babel/plugin-proposal-json-strings/-/plugin-proposal-json-strings-7.2.0.tgz#568ecc446c6148ae6b267f02551130891e29f317\"\n  dependencies:\n    \"@babel/helper-plugin-utils\" \"^7.0.0\"\n    \"@babel/plugin-syntax-json-strings\" \"^7.2.0\"\n\n\"@babel/plugin-proposal-object-rest-spread@^7.4.4\":\n  version \"7.4.4\"\n  resolved \"https://registry.yarnpkg.com/@babel/plugin-proposal-object-rest-spread/-/plugin-proposal-object-rest-spread-7.4.4.tgz#1ef173fcf24b3e2df92a678f027673b55e7e3005\"\n  dependencies:\n    \"@babel/helper-plugin-utils\" \"^7.0.0\"\n    \"@babel/plugin-syntax-object-rest-spread\" \"^7.2.0\"\n\n\"@babel/plugin-proposal-optional-catch-binding@^7.2.0\":\n  version \"7.2.0\"\n  resolved \"https://registry.yarnpkg.com/@babel/plugin-proposal-optional-catch-binding/-/plugin-proposal-optional-catch-binding-7.2.0.tgz#135d81edb68a081e55e56ec48541ece8065c38f5\"\n  dependencies:\n    \"@babel/helper-plugin-utils\" \"^7.0.0\"\n    \"@babel/plugin-syntax-optional-catch-binding\" \"^7.2.0\"\n\n\"@babel/plugin-proposal-unicode-property-regex@^7.4.4\":\n  version \"7.4.4\"\n  resolved \"https://registry.yarnpkg.com/@babel/plugin-proposal-unicode-property-regex/-/plugin-proposal-unicode-property-regex-7.4.4.tgz#501ffd9826c0b91da22690720722ac7cb1ca9c78\"\n  dependencies:\n    \"@babel/helper-plugin-utils\" \"^7.0.0\"\n    \"@babel/helper-regex\" \"^7.4.4\"\n    regexpu-core \"^4.5.4\"\n\n\"@babel/plugin-syntax-async-generators@^7.2.0\":\n  version \"7.2.0\"\n  resolved \"https://registry.yarnpkg.com/@babel/plugin-syntax-async-generators/-/plugin-syntax-async-generators-7.2.0.tgz#69e1f0db34c6f5a0cf7e2b3323bf159a76c8cb7f\"\n  dependencies:\n    \"@babel/helper-plugin-utils\" \"^7.0.0\"\n\n\"@babel/plugin-syntax-dynamic-import@^7.0.0\":\n  version \"7.2.0\"\n  resolved \"https://registry.yarnpkg.com/@babel/plugin-syntax-dynamic-import/-/plugin-syntax-dynamic-import-7.2.0.tgz#69c159ffaf4998122161ad8ebc5e6d1f55df8612\"\n  dependencies:\n    \"@babel/helper-plugin-utils\" \"^7.0.0\"\n\n\"@babel/plugin-syntax-json-strings@^7.2.0\":\n  version \"7.2.0\"\n  resolved \"https://registry.yarnpkg.com/@babel/plugin-syntax-json-strings/-/plugin-syntax-json-strings-7.2.0.tgz#72bd13f6ffe1d25938129d2a186b11fd62951470\"\n  dependencies:\n    \"@babel/helper-plugin-utils\" \"^7.0.0\"\n\n\"@babel/plugin-syntax-jsx@^7.2.0\":\n  version \"7.2.0\"\n  resolved \"https://registry.yarnpkg.com/@babel/plugin-syntax-jsx/-/plugin-syntax-jsx-7.2.0.tgz#0b85a3b4bc7cdf4cc4b8bf236335b907ca22e7c7\"\n  dependencies:\n    \"@babel/helper-plugin-utils\" \"^7.0.0\"\n\n\"@babel/plugin-syntax-object-rest-spread@^7.2.0\":\n  version \"7.2.0\"\n  resolved \"https://registry.yarnpkg.com/@babel/plugin-syntax-object-rest-spread/-/plugin-syntax-object-rest-spread-7.2.0.tgz#3b7a3e733510c57e820b9142a6579ac8b0dfad2e\"\n  dependencies:\n    \"@babel/helper-plugin-utils\" \"^7.0.0\"\n\n\"@babel/plugin-syntax-optional-catch-binding@^7.2.0\":\n  version \"7.2.0\"\n  resolved \"https://registry.yarnpkg.com/@babel/plugin-syntax-optional-catch-binding/-/plugin-syntax-optional-catch-binding-7.2.0.tgz#a94013d6eda8908dfe6a477e7f9eda85656ecf5c\"\n  dependencies:\n    \"@babel/helper-plugin-utils\" \"^7.0.0\"\n\n\"@babel/plugin-transform-arrow-functions@^7.2.0\":\n  version \"7.2.0\"\n  resolved \"https://registry.yarnpkg.com/@babel/plugin-transform-arrow-functions/-/plugin-transform-arrow-functions-7.2.0.tgz#9aeafbe4d6ffc6563bf8f8372091628f00779550\"\n  dependencies:\n    \"@babel/helper-plugin-utils\" \"^7.0.0\"\n\n\"@babel/plugin-transform-async-to-generator@^7.4.4\":\n  version \"7.4.4\"\n  resolved \"https://registry.yarnpkg.com/@babel/plugin-transform-async-to-generator/-/plugin-transform-async-to-generator-7.4.4.tgz#a3f1d01f2f21cadab20b33a82133116f14fb5894\"\n  dependencies:\n    \"@babel/helper-module-imports\" \"^7.0.0\"\n    \"@babel/helper-plugin-utils\" \"^7.0.0\"\n    \"@babel/helper-remap-async-to-generator\" \"^7.1.0\"\n\n\"@babel/plugin-transform-block-scoped-functions@^7.2.0\":\n  version \"7.2.0\"\n  resolved \"https://registry.yarnpkg.com/@babel/plugin-transform-block-scoped-functions/-/plugin-transform-block-scoped-functions-7.2.0.tgz#5d3cc11e8d5ddd752aa64c9148d0db6cb79fd190\"\n  dependencies:\n    \"@babel/helper-plugin-utils\" \"^7.0.0\"\n\n\"@babel/plugin-transform-block-scoping@^7.4.4\":\n  version \"7.4.4\"\n  resolved \"https://registry.yarnpkg.com/@babel/plugin-transform-block-scoping/-/plugin-transform-block-scoping-7.4.4.tgz#c13279fabf6b916661531841a23c4b7dae29646d\"\n  dependencies:\n    \"@babel/helper-plugin-utils\" \"^7.0.0\"\n    lodash \"^4.17.11\"\n\n\"@babel/plugin-transform-classes@^7.4.4\":\n  version \"7.4.4\"\n  resolved \"https://registry.yarnpkg.com/@babel/plugin-transform-classes/-/plugin-transform-classes-7.4.4.tgz#0ce4094cdafd709721076d3b9c38ad31ca715eb6\"\n  dependencies:\n    \"@babel/helper-annotate-as-pure\" \"^7.0.0\"\n    \"@babel/helper-define-map\" \"^7.4.4\"\n    \"@babel/helper-function-name\" \"^7.1.0\"\n    \"@babel/helper-optimise-call-expression\" \"^7.0.0\"\n    \"@babel/helper-plugin-utils\" \"^7.0.0\"\n    \"@babel/helper-replace-supers\" \"^7.4.4\"\n    \"@babel/helper-split-export-declaration\" \"^7.4.4\"\n    globals \"^11.1.0\"\n\n\"@babel/plugin-transform-computed-properties@^7.2.0\":\n  version \"7.2.0\"\n  resolved \"https://registry.yarnpkg.com/@babel/plugin-transform-computed-properties/-/plugin-transform-computed-properties-7.2.0.tgz#83a7df6a658865b1c8f641d510c6f3af220216da\"\n  dependencies:\n    \"@babel/helper-plugin-utils\" \"^7.0.0\"\n\n\"@babel/plugin-transform-destructuring@^7.4.4\":\n  version \"7.4.4\"\n  resolved \"https://registry.yarnpkg.com/@babel/plugin-transform-destructuring/-/plugin-transform-destructuring-7.4.4.tgz#9d964717829cc9e4b601fc82a26a71a4d8faf20f\"\n  dependencies:\n    \"@babel/helper-plugin-utils\" \"^7.0.0\"\n\n\"@babel/plugin-transform-dotall-regex@^7.4.4\":\n  version \"7.4.4\"\n  resolved \"https://registry.yarnpkg.com/@babel/plugin-transform-dotall-regex/-/plugin-transform-dotall-regex-7.4.4.tgz#361a148bc951444312c69446d76ed1ea8e4450c3\"\n  dependencies:\n    \"@babel/helper-plugin-utils\" \"^7.0.0\"\n    \"@babel/helper-regex\" \"^7.4.4\"\n    regexpu-core \"^4.5.4\"\n\n\"@babel/plugin-transform-duplicate-keys@^7.2.0\":\n  version \"7.2.0\"\n  resolved \"https://registry.yarnpkg.com/@babel/plugin-transform-duplicate-keys/-/plugin-transform-duplicate-keys-7.2.0.tgz#d952c4930f312a4dbfff18f0b2914e60c35530b3\"\n  dependencies:\n    \"@babel/helper-plugin-utils\" \"^7.0.0\"\n\n\"@babel/plugin-transform-exponentiation-operator@^7.2.0\":\n  version \"7.2.0\"\n  resolved \"https://registry.yarnpkg.com/@babel/plugin-transform-exponentiation-operator/-/plugin-transform-exponentiation-operator-7.2.0.tgz#a63868289e5b4007f7054d46491af51435766008\"\n  dependencies:\n    \"@babel/helper-builder-binary-assignment-operator-visitor\" \"^7.1.0\"\n    \"@babel/helper-plugin-utils\" \"^7.0.0\"\n\n\"@babel/plugin-transform-for-of@^7.4.4\":\n  version \"7.4.4\"\n  resolved \"https://registry.yarnpkg.com/@babel/plugin-transform-for-of/-/plugin-transform-for-of-7.4.4.tgz#0267fc735e24c808ba173866c6c4d1440fc3c556\"\n  dependencies:\n    \"@babel/helper-plugin-utils\" \"^7.0.0\"\n\n\"@babel/plugin-transform-function-name@^7.4.4\":\n  version \"7.4.4\"\n  resolved \"https://registry.yarnpkg.com/@babel/plugin-transform-function-name/-/plugin-transform-function-name-7.4.4.tgz#e1436116abb0610c2259094848754ac5230922ad\"\n  dependencies:\n    \"@babel/helper-function-name\" \"^7.1.0\"\n    \"@babel/helper-plugin-utils\" \"^7.0.0\"\n\n\"@babel/plugin-transform-literals@^7.2.0\":\n  version \"7.2.0\"\n  resolved \"https://registry.yarnpkg.com/@babel/plugin-transform-literals/-/plugin-transform-literals-7.2.0.tgz#690353e81f9267dad4fd8cfd77eafa86aba53ea1\"\n  dependencies:\n    \"@babel/helper-plugin-utils\" \"^7.0.0\"\n\n\"@babel/plugin-transform-member-expression-literals@^7.2.0\":\n  version \"7.2.0\"\n  resolved \"https://registry.yarnpkg.com/@babel/plugin-transform-member-expression-literals/-/plugin-transform-member-expression-literals-7.2.0.tgz#fa10aa5c58a2cb6afcf2c9ffa8cb4d8b3d489a2d\"\n  dependencies:\n    \"@babel/helper-plugin-utils\" \"^7.0.0\"\n\n\"@babel/plugin-transform-modules-amd@^7.2.0\":\n  version \"7.2.0\"\n  resolved \"https://registry.yarnpkg.com/@babel/plugin-transform-modules-amd/-/plugin-transform-modules-amd-7.2.0.tgz#82a9bce45b95441f617a24011dc89d12da7f4ee6\"\n  dependencies:\n    \"@babel/helper-module-transforms\" \"^7.1.0\"\n    \"@babel/helper-plugin-utils\" \"^7.0.0\"\n\n\"@babel/plugin-transform-modules-commonjs@^7.4.4\":\n  version \"7.4.4\"\n  resolved \"https://registry.yarnpkg.com/@babel/plugin-transform-modules-commonjs/-/plugin-transform-modules-commonjs-7.4.4.tgz#0bef4713d30f1d78c2e59b3d6db40e60192cac1e\"\n  dependencies:\n    \"@babel/helper-module-transforms\" \"^7.4.4\"\n    \"@babel/helper-plugin-utils\" \"^7.0.0\"\n    \"@babel/helper-simple-access\" \"^7.1.0\"\n\n\"@babel/plugin-transform-modules-systemjs@^7.4.4\":\n  version \"7.4.4\"\n  resolved \"https://registry.yarnpkg.com/@babel/plugin-transform-modules-systemjs/-/plugin-transform-modules-systemjs-7.4.4.tgz#dc83c5665b07d6c2a7b224c00ac63659ea36a405\"\n  dependencies:\n    \"@babel/helper-hoist-variables\" \"^7.4.4\"\n    \"@babel/helper-plugin-utils\" \"^7.0.0\"\n\n\"@babel/plugin-transform-modules-umd@^7.2.0\":\n  version \"7.2.0\"\n  resolved \"https://registry.yarnpkg.com/@babel/plugin-transform-modules-umd/-/plugin-transform-modules-umd-7.2.0.tgz#7678ce75169f0877b8eb2235538c074268dd01ae\"\n  dependencies:\n    \"@babel/helper-module-transforms\" \"^7.1.0\"\n    \"@babel/helper-plugin-utils\" \"^7.0.0\"\n\n\"@babel/plugin-transform-named-capturing-groups-regex@^7.4.5\":\n  version \"7.4.5\"\n  resolved \"https://registry.yarnpkg.com/@babel/plugin-transform-named-capturing-groups-regex/-/plugin-transform-named-capturing-groups-regex-7.4.5.tgz#9d269fd28a370258199b4294736813a60bbdd106\"\n  dependencies:\n    regexp-tree \"^0.1.6\"\n\n\"@babel/plugin-transform-new-target@^7.4.4\":\n  version \"7.4.4\"\n  resolved \"https://registry.yarnpkg.com/@babel/plugin-transform-new-target/-/plugin-transform-new-target-7.4.4.tgz#18d120438b0cc9ee95a47f2c72bc9768fbed60a5\"\n  dependencies:\n    \"@babel/helper-plugin-utils\" \"^7.0.0\"\n\n\"@babel/plugin-transform-object-super@^7.2.0\":\n  version \"7.2.0\"\n  resolved \"https://registry.yarnpkg.com/@babel/plugin-transform-object-super/-/plugin-transform-object-super-7.2.0.tgz#b35d4c10f56bab5d650047dad0f1d8e8814b6598\"\n  dependencies:\n    \"@babel/helper-plugin-utils\" \"^7.0.0\"\n    \"@babel/helper-replace-supers\" \"^7.1.0\"\n\n\"@babel/plugin-transform-parameters@^7.4.4\":\n  version \"7.4.4\"\n  resolved \"https://registry.yarnpkg.com/@babel/plugin-transform-parameters/-/plugin-transform-parameters-7.4.4.tgz#7556cf03f318bd2719fe4c922d2d808be5571e16\"\n  dependencies:\n    \"@babel/helper-call-delegate\" \"^7.4.4\"\n    \"@babel/helper-get-function-arity\" \"^7.0.0\"\n    \"@babel/helper-plugin-utils\" \"^7.0.0\"\n\n\"@babel/plugin-transform-property-literals@^7.2.0\":\n  version \"7.2.0\"\n  resolved \"https://registry.yarnpkg.com/@babel/plugin-transform-property-literals/-/plugin-transform-property-literals-7.2.0.tgz#03e33f653f5b25c4eb572c98b9485055b389e905\"\n  dependencies:\n    \"@babel/helper-plugin-utils\" \"^7.0.0\"\n\n\"@babel/plugin-transform-react-display-name@^7.0.0\":\n  version \"7.2.0\"\n  resolved \"https://registry.yarnpkg.com/@babel/plugin-transform-react-display-name/-/plugin-transform-react-display-name-7.2.0.tgz#ebfaed87834ce8dc4279609a4f0c324c156e3eb0\"\n  dependencies:\n    \"@babel/helper-plugin-utils\" \"^7.0.0\"\n\n\"@babel/plugin-transform-react-jsx-self@^7.0.0\":\n  version \"7.2.0\"\n  resolved \"https://registry.yarnpkg.com/@babel/plugin-transform-react-jsx-self/-/plugin-transform-react-jsx-self-7.2.0.tgz#461e21ad9478f1031dd5e276108d027f1b5240ba\"\n  dependencies:\n    \"@babel/helper-plugin-utils\" \"^7.0.0\"\n    \"@babel/plugin-syntax-jsx\" \"^7.2.0\"\n\n\"@babel/plugin-transform-react-jsx-source@^7.0.0\":\n  version \"7.2.0\"\n  resolved \"https://registry.yarnpkg.com/@babel/plugin-transform-react-jsx-source/-/plugin-transform-react-jsx-source-7.2.0.tgz#20c8c60f0140f5dd3cd63418d452801cf3f7180f\"\n  dependencies:\n    \"@babel/helper-plugin-utils\" \"^7.0.0\"\n    \"@babel/plugin-syntax-jsx\" \"^7.2.0\"\n\n\"@babel/plugin-transform-react-jsx@^7.0.0\":\n  version \"7.3.0\"\n  resolved \"https://registry.yarnpkg.com/@babel/plugin-transform-react-jsx/-/plugin-transform-react-jsx-7.3.0.tgz#f2cab99026631c767e2745a5368b331cfe8f5290\"\n  dependencies:\n    \"@babel/helper-builder-react-jsx\" \"^7.3.0\"\n    \"@babel/helper-plugin-utils\" \"^7.0.0\"\n    \"@babel/plugin-syntax-jsx\" \"^7.2.0\"\n\n\"@babel/plugin-transform-regenerator@^7.4.5\":\n  version \"7.4.5\"\n  resolved \"https://registry.yarnpkg.com/@babel/plugin-transform-regenerator/-/plugin-transform-regenerator-7.4.5.tgz#629dc82512c55cee01341fb27bdfcb210354680f\"\n  dependencies:\n    regenerator-transform \"^0.14.0\"\n\n\"@babel/plugin-transform-reserved-words@^7.2.0\":\n  version \"7.2.0\"\n  resolved \"https://registry.yarnpkg.com/@babel/plugin-transform-reserved-words/-/plugin-transform-reserved-words-7.2.0.tgz#4792af87c998a49367597d07fedf02636d2e1634\"\n  dependencies:\n    \"@babel/helper-plugin-utils\" \"^7.0.0\"\n\n\"@babel/plugin-transform-shorthand-properties@^7.2.0\":\n  version \"7.2.0\"\n  resolved \"https://registry.yarnpkg.com/@babel/plugin-transform-shorthand-properties/-/plugin-transform-shorthand-properties-7.2.0.tgz#6333aee2f8d6ee7e28615457298934a3b46198f0\"\n  dependencies:\n    \"@babel/helper-plugin-utils\" \"^7.0.0\"\n\n\"@babel/plugin-transform-spread@^7.2.0\":\n  version \"7.2.2\"\n  resolved \"https://registry.yarnpkg.com/@babel/plugin-transform-spread/-/plugin-transform-spread-7.2.2.tgz#3103a9abe22f742b6d406ecd3cd49b774919b406\"\n  dependencies:\n    \"@babel/helper-plugin-utils\" \"^7.0.0\"\n\n\"@babel/plugin-transform-sticky-regex@^7.2.0\":\n  version \"7.2.0\"\n  resolved \"https://registry.yarnpkg.com/@babel/plugin-transform-sticky-regex/-/plugin-transform-sticky-regex-7.2.0.tgz#a1e454b5995560a9c1e0d537dfc15061fd2687e1\"\n  dependencies:\n    \"@babel/helper-plugin-utils\" \"^7.0.0\"\n    \"@babel/helper-regex\" \"^7.0.0\"\n\n\"@babel/plugin-transform-template-literals@^7.4.4\":\n  version \"7.4.4\"\n  resolved \"https://registry.yarnpkg.com/@babel/plugin-transform-template-literals/-/plugin-transform-template-literals-7.4.4.tgz#9d28fea7bbce637fb7612a0750989d8321d4bcb0\"\n  dependencies:\n    \"@babel/helper-annotate-as-pure\" \"^7.0.0\"\n    \"@babel/helper-plugin-utils\" \"^7.0.0\"\n\n\"@babel/plugin-transform-typeof-symbol@^7.2.0\":\n  version \"7.2.0\"\n  resolved \"https://registry.yarnpkg.com/@babel/plugin-transform-typeof-symbol/-/plugin-transform-typeof-symbol-7.2.0.tgz#117d2bcec2fbf64b4b59d1f9819894682d29f2b2\"\n  dependencies:\n    \"@babel/helper-plugin-utils\" \"^7.0.0\"\n\n\"@babel/plugin-transform-unicode-regex@^7.4.4\":\n  version \"7.4.4\"\n  resolved \"https://registry.yarnpkg.com/@babel/plugin-transform-unicode-regex/-/plugin-transform-unicode-regex-7.4.4.tgz#ab4634bb4f14d36728bf5978322b35587787970f\"\n  dependencies:\n    \"@babel/helper-plugin-utils\" \"^7.0.0\"\n    \"@babel/helper-regex\" \"^7.4.4\"\n    regexpu-core \"^4.5.4\"\n\n\"@babel/polyfill@^7.0.0\":\n  version \"7.2.5\"\n  resolved \"https://registry.yarnpkg.com/@babel/polyfill/-/polyfill-7.2.5.tgz#6c54b964f71ad27edddc567d065e57e87ed7fa7d\"\n  dependencies:\n    core-js \"^2.5.7\"\n    regenerator-runtime \"^0.12.0\"\n\n\"@babel/preset-env@^7.4.0\":\n  version \"7.4.5\"\n  resolved \"https://registry.yarnpkg.com/@babel/preset-env/-/preset-env-7.4.5.tgz#2fad7f62983d5af563b5f3139242755884998a58\"\n  dependencies:\n    \"@babel/helper-module-imports\" \"^7.0.0\"\n    \"@babel/helper-plugin-utils\" \"^7.0.0\"\n    \"@babel/plugin-proposal-async-generator-functions\" \"^7.2.0\"\n    \"@babel/plugin-proposal-json-strings\" \"^7.2.0\"\n    \"@babel/plugin-proposal-object-rest-spread\" \"^7.4.4\"\n    \"@babel/plugin-proposal-optional-catch-binding\" \"^7.2.0\"\n    \"@babel/plugin-proposal-unicode-property-regex\" \"^7.4.4\"\n    \"@babel/plugin-syntax-async-generators\" \"^7.2.0\"\n    \"@babel/plugin-syntax-json-strings\" \"^7.2.0\"\n    \"@babel/plugin-syntax-object-rest-spread\" \"^7.2.0\"\n    \"@babel/plugin-syntax-optional-catch-binding\" \"^7.2.0\"\n    \"@babel/plugin-transform-arrow-functions\" \"^7.2.0\"\n    \"@babel/plugin-transform-async-to-generator\" \"^7.4.4\"\n    \"@babel/plugin-transform-block-scoped-functions\" \"^7.2.0\"\n    \"@babel/plugin-transform-block-scoping\" \"^7.4.4\"\n    \"@babel/plugin-transform-classes\" \"^7.4.4\"\n    \"@babel/plugin-transform-computed-properties\" \"^7.2.0\"\n    \"@babel/plugin-transform-destructuring\" \"^7.4.4\"\n    \"@babel/plugin-transform-dotall-regex\" \"^7.4.4\"\n    \"@babel/plugin-transform-duplicate-keys\" \"^7.2.0\"\n    \"@babel/plugin-transform-exponentiation-operator\" \"^7.2.0\"\n    \"@babel/plugin-transform-for-of\" \"^7.4.4\"\n    \"@babel/plugin-transform-function-name\" \"^7.4.4\"\n    \"@babel/plugin-transform-literals\" \"^7.2.0\"\n    \"@babel/plugin-transform-member-expression-literals\" \"^7.2.0\"\n    \"@babel/plugin-transform-modules-amd\" \"^7.2.0\"\n    \"@babel/plugin-transform-modules-commonjs\" \"^7.4.4\"\n    \"@babel/plugin-transform-modules-systemjs\" \"^7.4.4\"\n    \"@babel/plugin-transform-modules-umd\" \"^7.2.0\"\n    \"@babel/plugin-transform-named-capturing-groups-regex\" \"^7.4.5\"\n    \"@babel/plugin-transform-new-target\" \"^7.4.4\"\n    \"@babel/plugin-transform-object-super\" \"^7.2.0\"\n    \"@babel/plugin-transform-parameters\" \"^7.4.4\"\n    \"@babel/plugin-transform-property-literals\" \"^7.2.0\"\n    \"@babel/plugin-transform-regenerator\" \"^7.4.5\"\n    \"@babel/plugin-transform-reserved-words\" \"^7.2.0\"\n    \"@babel/plugin-transform-shorthand-properties\" \"^7.2.0\"\n    \"@babel/plugin-transform-spread\" \"^7.2.0\"\n    \"@babel/plugin-transform-sticky-regex\" \"^7.2.0\"\n    \"@babel/plugin-transform-template-literals\" \"^7.4.4\"\n    \"@babel/plugin-transform-typeof-symbol\" \"^7.2.0\"\n    \"@babel/plugin-transform-unicode-regex\" \"^7.4.4\"\n    \"@babel/types\" \"^7.4.4\"\n    browserslist \"^4.6.0\"\n    core-js-compat \"^3.1.1\"\n    invariant \"^2.2.2\"\n    js-levenshtein \"^1.1.3\"\n    semver \"^5.5.0\"\n\n\"@babel/preset-react@^7.0.0\":\n  version \"7.0.0\"\n  resolved \"https://registry.yarnpkg.com/@babel/preset-react/-/preset-react-7.0.0.tgz#e86b4b3d99433c7b3e9e91747e2653958bc6b3c0\"\n  dependencies:\n    \"@babel/helper-plugin-utils\" \"^7.0.0\"\n    \"@babel/plugin-transform-react-display-name\" \"^7.0.0\"\n    \"@babel/plugin-transform-react-jsx\" \"^7.0.0\"\n    \"@babel/plugin-transform-react-jsx-self\" \"^7.0.0\"\n    \"@babel/plugin-transform-react-jsx-source\" \"^7.0.0\"\n\n\"@babel/runtime@^7.1.2\", \"@babel/runtime@^7.2.0\":\n  version \"7.3.4\"\n  resolved \"https://registry.yarnpkg.com/@babel/runtime/-/runtime-7.3.4.tgz#73d12ba819e365fcf7fd152aed56d6df97d21c83\"\n  dependencies:\n    regenerator-runtime \"^0.12.0\"\n\n\"@babel/template@^7.1.0\", \"@babel/template@^7.2.2\":\n  version \"7.2.2\"\n  resolved \"https://registry.yarnpkg.com/@babel/template/-/template-7.2.2.tgz#005b3fdf0ed96e88041330379e0da9a708eb2907\"\n  dependencies:\n    \"@babel/code-frame\" \"^7.0.0\"\n    \"@babel/parser\" \"^7.2.2\"\n    \"@babel/types\" \"^7.2.2\"\n\n\"@babel/template@^7.4.4\":\n  version \"7.4.4\"\n  resolved \"https://registry.yarnpkg.com/@babel/template/-/template-7.4.4.tgz#f4b88d1225689a08f5bc3a17483545be9e4ed237\"\n  dependencies:\n    \"@babel/code-frame\" \"^7.0.0\"\n    \"@babel/parser\" \"^7.4.4\"\n    \"@babel/types\" \"^7.4.4\"\n\n\"@babel/traverse@^7.1.0\", \"@babel/traverse@^7.3.4\":\n  version \"7.3.4\"\n  resolved \"https://registry.yarnpkg.com/@babel/traverse/-/traverse-7.3.4.tgz#1330aab72234f8dea091b08c4f8b9d05c7119e06\"\n  dependencies:\n    \"@babel/code-frame\" \"^7.0.0\"\n    \"@babel/generator\" \"^7.3.4\"\n    \"@babel/helper-function-name\" \"^7.1.0\"\n    \"@babel/helper-split-export-declaration\" \"^7.0.0\"\n    \"@babel/parser\" \"^7.3.4\"\n    \"@babel/types\" \"^7.3.4\"\n    debug \"^4.1.0\"\n    globals \"^11.1.0\"\n    lodash \"^4.17.11\"\n\n\"@babel/traverse@^7.4.4\", \"@babel/traverse@^7.4.5\":\n  version \"7.4.5\"\n  resolved \"https://registry.yarnpkg.com/@babel/traverse/-/traverse-7.4.5.tgz#4e92d1728fd2f1897dafdd321efbff92156c3216\"\n  dependencies:\n    \"@babel/code-frame\" \"^7.0.0\"\n    \"@babel/generator\" \"^7.4.4\"\n    \"@babel/helper-function-name\" \"^7.1.0\"\n    \"@babel/helper-split-export-declaration\" \"^7.4.4\"\n    \"@babel/parser\" \"^7.4.5\"\n    \"@babel/types\" \"^7.4.4\"\n    debug \"^4.1.0\"\n    globals \"^11.1.0\"\n    lodash \"^4.17.11\"\n\n\"@babel/types@^7.0.0\", \"@babel/types@^7.2.0\", \"@babel/types@^7.2.2\", \"@babel/types@^7.3.0\", \"@babel/types@^7.3.4\":\n  version \"7.3.4\"\n  resolved \"https://registry.yarnpkg.com/@babel/types/-/types-7.3.4.tgz#bf482eaeaffb367a28abbf9357a94963235d90ed\"\n  dependencies:\n    esutils \"^2.0.2\"\n    lodash \"^4.17.11\"\n    to-fast-properties \"^2.0.0\"\n\n\"@babel/types@^7.4.4\":\n  version \"7.4.4\"\n  resolved \"https://registry.yarnpkg.com/@babel/types/-/types-7.4.4.tgz#8db9e9a629bb7c29370009b4b779ed93fe57d5f0\"\n  dependencies:\n    esutils \"^2.0.2\"\n    lodash \"^4.17.11\"\n    to-fast-properties \"^2.0.0\"\n\n\"@mrmlnc/readdir-enhanced@^2.2.1\":\n  version \"2.2.1\"\n  resolved \"https://registry.yarnpkg.com/@mrmlnc/readdir-enhanced/-/readdir-enhanced-2.2.1.tgz#524af240d1a360527b730475ecfa1344aa540dde\"\n  dependencies:\n    call-me-maybe \"^1.0.1\"\n    glob-to-regexp \"^0.3.0\"\n\n\"@nodelib/fs.stat@^1.1.2\":\n  version \"1.1.3\"\n  resolved \"https://registry.yarnpkg.com/@nodelib/fs.stat/-/fs.stat-1.1.3.tgz#2b5a3ab3f918cca48a8c754c08168e3f03eba61b\"\n\n\"@sentry/browser@^4.6.6\":\n  version \"4.6.6\"\n  resolved \"https://registry.yarnpkg.com/@sentry/browser/-/browser-4.6.6.tgz#58ac3de9956c8a7033f3830c3ee9e011c2bd133a\"\n  dependencies:\n    \"@sentry/core\" \"4.6.6\"\n    \"@sentry/types\" \"4.5.3\"\n    \"@sentry/utils\" \"4.6.5\"\n    tslib \"^1.9.3\"\n\n\"@sentry/core@4.6.6\":\n  version \"4.6.6\"\n  resolved \"https://registry.yarnpkg.com/@sentry/core/-/core-4.6.6.tgz#dea96a88533a3bdbdcc86ae18e35272c57e0fd20\"\n  dependencies:\n    \"@sentry/hub\" \"4.6.5\"\n    \"@sentry/minimal\" \"4.6.5\"\n    \"@sentry/types\" \"4.5.3\"\n    \"@sentry/utils\" \"4.6.5\"\n    tslib \"^1.9.3\"\n\n\"@sentry/hub@4.6.5\":\n  version \"4.6.5\"\n  resolved \"https://registry.yarnpkg.com/@sentry/hub/-/hub-4.6.5.tgz#451def7bc8d90d9cc007f58f364b3ce305c4701a\"\n  dependencies:\n    \"@sentry/types\" \"4.5.3\"\n    \"@sentry/utils\" \"4.6.5\"\n    tslib \"^1.9.3\"\n\n\"@sentry/minimal@4.6.5\":\n  version \"4.6.5\"\n  resolved \"https://registry.yarnpkg.com/@sentry/minimal/-/minimal-4.6.5.tgz#64433d2c9fda69eedbb61855a7ff8905f7b19218\"\n  dependencies:\n    \"@sentry/hub\" \"4.6.5\"\n    \"@sentry/types\" \"4.5.3\"\n    tslib \"^1.9.3\"\n\n\"@sentry/types@4.5.3\":\n  version \"4.5.3\"\n  resolved \"https://registry.yarnpkg.com/@sentry/types/-/types-4.5.3.tgz#3350dce2b7f9b936a8c327891c12e3aef7bd8852\"\n\n\"@sentry/utils@4.6.5\":\n  version \"4.6.5\"\n  resolved \"https://registry.yarnpkg.com/@sentry/utils/-/utils-4.6.5.tgz#4c960524914311eb76bbd6ca7f80f4d98c04db7f\"\n  dependencies:\n    \"@sentry/types\" \"4.5.3\"\n    tslib \"^1.9.3\"\n\n\"@symfony/webpack-encore@^0.27.0\":\n  version \"0.27.0\"\n  resolved \"https://registry.yarnpkg.com/@symfony/webpack-encore/-/webpack-encore-0.27.0.tgz#efc960967823b5ff93881222f16496f1fa709f24\"\n  dependencies:\n    \"@babel/core\" \"^7.4.0\"\n    \"@babel/plugin-syntax-dynamic-import\" \"^7.0.0\"\n    \"@babel/preset-env\" \"^7.4.0\"\n    assets-webpack-plugin \"^3.9.7\"\n    babel-loader \"^8.0.0\"\n    chalk \"^2.4.1\"\n    clean-webpack-plugin \"^0.1.19\"\n    css-loader \"^2.1.1\"\n    fast-levenshtein \"^2.0.6\"\n    file-loader \"^1.1.10\"\n    friendly-errors-webpack-plugin \"^1.7.0\"\n    fs-extra \"^2.0.0\"\n    loader-utils \"^1.1.0\"\n    lodash \">=3.5 <5\"\n    mini-css-extract-plugin \">=0.4.0 <0.4.3\"\n    optimize-css-assets-webpack-plugin \"^5.0.1\"\n    pkg-up \"^1.0.0\"\n    pretty-error \"^2.1.1\"\n    resolve-url-loader \"^3.0.1\"\n    semver \"^5.5.0\"\n    style-loader \"^0.21.0\"\n    terser-webpack-plugin \"^1.1.0\"\n    tmp \"^0.0.33\"\n    webpack \"^4.20.0\"\n    webpack-chunk-hash \"^0.6.0\"\n    webpack-cli \"^3.0.0\"\n    webpack-dev-server \"^3.1.14\"\n    webpack-manifest-plugin \"^2.0.2\"\n    webpack-sources \"^1.3.0\"\n    yargs-parser \"^12.0.0\"\n\n\"@types/anymatch@*\":\n  version \"1.3.1\"\n  resolved \"https://registry.yarnpkg.com/@types/anymatch/-/anymatch-1.3.1.tgz#336badc1beecb9dacc38bea2cf32adf627a8421a\"\n\n\"@types/classnames@^2.2.7\":\n  version \"2.2.7\"\n  resolved \"https://registry.yarnpkg.com/@types/classnames/-/classnames-2.2.7.tgz#fb68cc9be8487e6ea5b13700e759bfbab7e0fefd\"\n\n\"@types/history@*\":\n  version \"4.7.2\"\n  resolved \"https://registry.yarnpkg.com/@types/history/-/history-4.7.2.tgz#0e670ea254d559241b6eeb3894f8754991e73220\"\n  integrity sha512-ui3WwXmjTaY73fOQ3/m3nnajU/Orhi6cEu5rzX+BrAAJxa3eITXZ5ch9suPqtM03OWhAHhPSyBGCN4UKoxO20Q==\n\n\"@types/hoist-non-react-statics@^3.3.1\":\n  version \"3.3.1\"\n  resolved \"https://registry.yarnpkg.com/@types/hoist-non-react-statics/-/hoist-non-react-statics-3.3.1.tgz#1124aafe5118cb591977aeb1ceaaed1070eb039f\"\n  integrity sha512-iMIqiko6ooLrTh1joXodJK5X9xeEALT1kM5G3ZLhD3hszxBdIEd5C75U834D9mLcINgD4OyZf5uQXjkuYydWvA==\n  dependencies:\n    \"@types/react\" \"*\"\n    hoist-non-react-statics \"^3.3.0\"\n\n\"@types/js-md5@^0.4.2\":\n  version \"0.4.2\"\n  resolved \"https://registry.yarnpkg.com/@types/js-md5/-/js-md5-0.4.2.tgz#95b39911e2081bf2915436e61cc345e12459e5bb\"\n  integrity sha512-FUPoQkpQTzA5wz9ebrdVRjsjQsFehr+cW1CVhLcI2UwD/SO/4NHPO1esrXPPbx7ux762U0POmWFSrUjQq2ophw==\n\n\"@types/lodash@^4.14.136\":\n  version \"4.14.136\"\n  resolved \"https://registry.yarnpkg.com/@types/lodash/-/lodash-4.14.136.tgz#413e85089046b865d960c9ff1d400e04c31ab60f\"\n  integrity sha512-0GJhzBdvsW2RUccNHOBkabI8HZVdOXmXbXhuKlDEd5Vv12P7oAVGfomGp3Ne21o5D/qu1WmthlNKFaoZJJeErA==\n\n\"@types/mousetrap@^1.6.3\":\n  version \"1.6.3\"\n  resolved \"https://registry.yarnpkg.com/@types/mousetrap/-/mousetrap-1.6.3.tgz#3159a01a2b21c9155a3d8f85588885d725dc987d\"\n  integrity sha512-13gmo3M2qVvjQrWNseqM3+cR6S2Ss3grbR2NZltgMq94wOwqJYQdgn8qzwDshzgXqMlSUtyPZjysImmktu22ew==\n\n\"@types/node@*\":\n  version \"11.9.5\"\n  resolved \"https://registry.yarnpkg.com/@types/node/-/node-11.9.5.tgz#011eece9d3f839a806b63973e228f85967b79ed3\"\n\n\"@types/prop-types@*\", \"@types/prop-types@^15.7.1\":\n  version \"15.7.1\"\n  resolved \"https://registry.yarnpkg.com/@types/prop-types/-/prop-types-15.7.1.tgz#f1a11e7babb0c3cad68100be381d1e064c68f1f6\"\n\n\"@types/q@^1.5.1\":\n  version \"1.5.1\"\n  resolved \"https://registry.yarnpkg.com/@types/q/-/q-1.5.1.tgz#48fd98c1561fe718b61733daed46ff115b496e18\"\n\n\"@types/qs@^6.5.3\":\n  version \"6.5.3\"\n  resolved \"https://registry.yarnpkg.com/@types/qs/-/qs-6.5.3.tgz#1c3b71b091eaeaf5924538006b7f70603ce63d38\"\n  integrity sha512-Jugo5V/1bS0fRhy2z8+cUAHEyWOATaz4rbyLVvcFs7+dXp5HfwpEwzF1Q11bB10ApUqHf+yTauxI0UXQDwGrbA==\n\n\"@types/react-dom@^16.8.4\":\n  version \"16.8.4\"\n  resolved \"https://registry.yarnpkg.com/@types/react-dom/-/react-dom-16.8.4.tgz#7fb7ba368857c7aa0f4e4511c4710ca2c5a12a88\"\n  dependencies:\n    \"@types/react\" \"*\"\n\n\"@types/react-router-dom@^4.3.4\":\n  version \"4.3.4\"\n  resolved \"https://registry.yarnpkg.com/@types/react-router-dom/-/react-router-dom-4.3.4.tgz#63a7a8558129d2f4ff76e4bdd099bf4b98e25a0d\"\n  integrity sha512-xrwaWHpnxKk/TTRe7pmoGy3E4SyF/ojFqNfFJacw7OLdfLXRvGfk4r/XePVaZNVfeJzL8fcnNilPN7xOdJ/vGw==\n  dependencies:\n    \"@types/history\" \"*\"\n    \"@types/react\" \"*\"\n    \"@types/react-router\" \"*\"\n\n\"@types/react-router@*\":\n  version \"5.0.3\"\n  resolved \"https://registry.yarnpkg.com/@types/react-router/-/react-router-5.0.3.tgz#855a1606e62de3f4d69ea34fb3c0e50e98e964d5\"\n  integrity sha512-j2Gge5cvxca+5lK9wxovmGPgpVJMwjyu5lTA/Cd6fLGoPq7FXcUE1jFkEdxeyqGGz8VfHYSHCn5Lcn24BzaNKA==\n  dependencies:\n    \"@types/history\" \"*\"\n    \"@types/react\" \"*\"\n\n\"@types/react-s-alert@^1.3.2\":\n  version \"1.3.2\"\n  resolved \"https://registry.yarnpkg.com/@types/react-s-alert/-/react-s-alert-1.3.2.tgz#02a0879c83c64f9b8f89053f1879588341109c23\"\n  integrity sha512-rrq6WpNtyGLxGMP+eGlLLBOdojHhZWDEbNrLlBca0BkOIuamtfFigkIbPnmVAFkzOcTED3mFuKmYu58D+IIUfQ==\n  dependencies:\n    \"@types/react\" \"*\"\n\n\"@types/react-virtualized@^9.21.1\":\n  version \"9.21.1\"\n  resolved \"https://registry.yarnpkg.com/@types/react-virtualized/-/react-virtualized-9.21.1.tgz#c85770f5bb0ccaeb3496d97ff2a2d9028c8ed1fd\"\n  dependencies:\n    \"@types/prop-types\" \"*\"\n    \"@types/react\" \"*\"\n\n\"@types/react@*\", \"@types/react@^16.8.18\":\n  version \"16.8.18\"\n  resolved \"https://registry.yarnpkg.com/@types/react/-/react-16.8.18.tgz#fe66fb748b0b6ca9709d38b87b2d1356d960a511\"\n  dependencies:\n    \"@types/prop-types\" \"*\"\n    csstype \"^2.2.0\"\n\n\"@types/reserved-words@^0.1.0\":\n  version \"0.1.0\"\n  resolved \"https://registry.yarnpkg.com/@types/reserved-words/-/reserved-words-0.1.0.tgz#a9d5318bb4ac4466862b93fc702542b75d2cd3ac\"\n\n\"@types/tapable@*\":\n  version \"1.0.4\"\n  resolved \"https://registry.yarnpkg.com/@types/tapable/-/tapable-1.0.4.tgz#b4ffc7dc97b498c969b360a41eee247f82616370\"\n\n\"@types/uglify-js@*\":\n  version \"3.0.4\"\n  resolved \"https://registry.yarnpkg.com/@types/uglify-js/-/uglify-js-3.0.4.tgz#96beae23df6f561862a830b4288a49e86baac082\"\n  dependencies:\n    source-map \"^0.6.1\"\n\n\"@types/webpack-env@^1.14.0\":\n  version \"1.14.0\"\n  resolved \"https://registry.yarnpkg.com/@types/webpack-env/-/webpack-env-1.14.0.tgz#8edfc5f8e6eae20eeed3ca0d02974ed4ee5e4efc\"\n  integrity sha512-Fv+0gYJzE/czLoRKq+gnXWr4yBpPM3tO3C8pDLFwqVKlMICQUq5OsxwwFZYDaVr7+L6mgNDp16iOcJHEz3J5RQ==\n\n\"@types/webpack@^3.0.0 || ^4.0.0\":\n  version \"4.4.25\"\n  resolved \"https://registry.yarnpkg.com/@types/webpack/-/webpack-4.4.25.tgz#c8a1eb968a33a3e6da641f529c5add0d44d34809\"\n  dependencies:\n    \"@types/anymatch\" \"*\"\n    \"@types/node\" \"*\"\n    \"@types/tapable\" \"*\"\n    \"@types/uglify-js\" \"*\"\n    source-map \"^0.6.0\"\n\n\"@webassemblyjs/ast@1.8.3\":\n  version \"1.8.3\"\n  resolved \"https://registry.yarnpkg.com/@webassemblyjs/ast/-/ast-1.8.3.tgz#63a741bd715a6b6783f2ea5c6ab707516aa215eb\"\n  dependencies:\n    \"@webassemblyjs/helper-module-context\" \"1.8.3\"\n    \"@webassemblyjs/helper-wasm-bytecode\" \"1.8.3\"\n    \"@webassemblyjs/wast-parser\" \"1.8.3\"\n\n\"@webassemblyjs/floating-point-hex-parser@1.8.3\":\n  version \"1.8.3\"\n  resolved \"https://registry.yarnpkg.com/@webassemblyjs/floating-point-hex-parser/-/floating-point-hex-parser-1.8.3.tgz#f198a2d203b3c50846a064f5addd6a133ef9bc0e\"\n\n\"@webassemblyjs/helper-api-error@1.8.3\":\n  version \"1.8.3\"\n  resolved \"https://registry.yarnpkg.com/@webassemblyjs/helper-api-error/-/helper-api-error-1.8.3.tgz#3b708f6926accd64dcbaa7ba5b63db5660ff4f66\"\n\n\"@webassemblyjs/helper-buffer@1.8.3\":\n  version \"1.8.3\"\n  resolved \"https://registry.yarnpkg.com/@webassemblyjs/helper-buffer/-/helper-buffer-1.8.3.tgz#f3150a23ffaba68621e1f094c8a14bebfd53dd48\"\n\n\"@webassemblyjs/helper-code-frame@1.8.3\":\n  version \"1.8.3\"\n  resolved \"https://registry.yarnpkg.com/@webassemblyjs/helper-code-frame/-/helper-code-frame-1.8.3.tgz#f43ac605789b519d95784ef350fd2968aebdd3ef\"\n  dependencies:\n    \"@webassemblyjs/wast-printer\" \"1.8.3\"\n\n\"@webassemblyjs/helper-fsm@1.8.3\":\n  version \"1.8.3\"\n  resolved \"https://registry.yarnpkg.com/@webassemblyjs/helper-fsm/-/helper-fsm-1.8.3.tgz#46aaa03f41082a916850ebcb97e9fc198ef36a9c\"\n\n\"@webassemblyjs/helper-module-context@1.8.3\":\n  version \"1.8.3\"\n  resolved \"https://registry.yarnpkg.com/@webassemblyjs/helper-module-context/-/helper-module-context-1.8.3.tgz#150da405d90c8ea81ae0b0e1965b7b64e585634f\"\n  dependencies:\n    \"@webassemblyjs/ast\" \"1.8.3\"\n    mamacro \"^0.0.3\"\n\n\"@webassemblyjs/helper-wasm-bytecode@1.8.3\":\n  version \"1.8.3\"\n  resolved \"https://registry.yarnpkg.com/@webassemblyjs/helper-wasm-bytecode/-/helper-wasm-bytecode-1.8.3.tgz#12f55bbafbbc7ddf9d8059a072cb7b0c17987901\"\n\n\"@webassemblyjs/helper-wasm-section@1.8.3\":\n  version \"1.8.3\"\n  resolved \"https://registry.yarnpkg.com/@webassemblyjs/helper-wasm-section/-/helper-wasm-section-1.8.3.tgz#9e79456d9719e116f4f8998ee62ab54ba69a6cf3\"\n  dependencies:\n    \"@webassemblyjs/ast\" \"1.8.3\"\n    \"@webassemblyjs/helper-buffer\" \"1.8.3\"\n    \"@webassemblyjs/helper-wasm-bytecode\" \"1.8.3\"\n    \"@webassemblyjs/wasm-gen\" \"1.8.3\"\n\n\"@webassemblyjs/ieee754@1.8.3\":\n  version \"1.8.3\"\n  resolved \"https://registry.yarnpkg.com/@webassemblyjs/ieee754/-/ieee754-1.8.3.tgz#0a89355b1f6c9d08d0605c2acbc2a6fe3141f5b4\"\n  dependencies:\n    \"@xtuc/ieee754\" \"^1.2.0\"\n\n\"@webassemblyjs/leb128@1.8.3\":\n  version \"1.8.3\"\n  resolved \"https://registry.yarnpkg.com/@webassemblyjs/leb128/-/leb128-1.8.3.tgz#b7fd9d7c039e34e375c4473bd4dc89ce8228b920\"\n  dependencies:\n    \"@xtuc/long\" \"4.2.2\"\n\n\"@webassemblyjs/utf8@1.8.3\":\n  version \"1.8.3\"\n  resolved \"https://registry.yarnpkg.com/@webassemblyjs/utf8/-/utf8-1.8.3.tgz#75712db52cfdda868731569ddfe11046f1f1e7a2\"\n\n\"@webassemblyjs/wasm-edit@1.8.3\":\n  version \"1.8.3\"\n  resolved \"https://registry.yarnpkg.com/@webassemblyjs/wasm-edit/-/wasm-edit-1.8.3.tgz#23c3c6206b096f9f6aa49623a5310a102ef0fb87\"\n  dependencies:\n    \"@webassemblyjs/ast\" \"1.8.3\"\n    \"@webassemblyjs/helper-buffer\" \"1.8.3\"\n    \"@webassemblyjs/helper-wasm-bytecode\" \"1.8.3\"\n    \"@webassemblyjs/helper-wasm-section\" \"1.8.3\"\n    \"@webassemblyjs/wasm-gen\" \"1.8.3\"\n    \"@webassemblyjs/wasm-opt\" \"1.8.3\"\n    \"@webassemblyjs/wasm-parser\" \"1.8.3\"\n    \"@webassemblyjs/wast-printer\" \"1.8.3\"\n\n\"@webassemblyjs/wasm-gen@1.8.3\":\n  version \"1.8.3\"\n  resolved \"https://registry.yarnpkg.com/@webassemblyjs/wasm-gen/-/wasm-gen-1.8.3.tgz#1a433b8ab97e074e6ac2e25fcbc8cb6125400813\"\n  dependencies:\n    \"@webassemblyjs/ast\" \"1.8.3\"\n    \"@webassemblyjs/helper-wasm-bytecode\" \"1.8.3\"\n    \"@webassemblyjs/ieee754\" \"1.8.3\"\n    \"@webassemblyjs/leb128\" \"1.8.3\"\n    \"@webassemblyjs/utf8\" \"1.8.3\"\n\n\"@webassemblyjs/wasm-opt@1.8.3\":\n  version \"1.8.3\"\n  resolved \"https://registry.yarnpkg.com/@webassemblyjs/wasm-opt/-/wasm-opt-1.8.3.tgz#54754bcf88f88e92b909416a91125301cc81419c\"\n  dependencies:\n    \"@webassemblyjs/ast\" \"1.8.3\"\n    \"@webassemblyjs/helper-buffer\" \"1.8.3\"\n    \"@webassemblyjs/wasm-gen\" \"1.8.3\"\n    \"@webassemblyjs/wasm-parser\" \"1.8.3\"\n\n\"@webassemblyjs/wasm-parser@1.8.3\":\n  version \"1.8.3\"\n  resolved \"https://registry.yarnpkg.com/@webassemblyjs/wasm-parser/-/wasm-parser-1.8.3.tgz#d12ed19d1b8e8667a7bee040d2245aaaf215340b\"\n  dependencies:\n    \"@webassemblyjs/ast\" \"1.8.3\"\n    \"@webassemblyjs/helper-api-error\" \"1.8.3\"\n    \"@webassemblyjs/helper-wasm-bytecode\" \"1.8.3\"\n    \"@webassemblyjs/ieee754\" \"1.8.3\"\n    \"@webassemblyjs/leb128\" \"1.8.3\"\n    \"@webassemblyjs/utf8\" \"1.8.3\"\n\n\"@webassemblyjs/wast-parser@1.8.3\":\n  version \"1.8.3\"\n  resolved \"https://registry.yarnpkg.com/@webassemblyjs/wast-parser/-/wast-parser-1.8.3.tgz#44aa123e145503e995045dc3e5e2770069da117b\"\n  dependencies:\n    \"@webassemblyjs/ast\" \"1.8.3\"\n    \"@webassemblyjs/floating-point-hex-parser\" \"1.8.3\"\n    \"@webassemblyjs/helper-api-error\" \"1.8.3\"\n    \"@webassemblyjs/helper-code-frame\" \"1.8.3\"\n    \"@webassemblyjs/helper-fsm\" \"1.8.3\"\n    \"@xtuc/long\" \"4.2.2\"\n\n\"@webassemblyjs/wast-printer@1.8.3\":\n  version \"1.8.3\"\n  resolved \"https://registry.yarnpkg.com/@webassemblyjs/wast-printer/-/wast-printer-1.8.3.tgz#b1177780b266b1305f2eeba87c4d6aa732352060\"\n  dependencies:\n    \"@webassemblyjs/ast\" \"1.8.3\"\n    \"@webassemblyjs/wast-parser\" \"1.8.3\"\n    \"@xtuc/long\" \"4.2.2\"\n\n\"@xtuc/ieee754@^1.2.0\":\n  version \"1.2.0\"\n  resolved \"https://registry.yarnpkg.com/@xtuc/ieee754/-/ieee754-1.2.0.tgz#eef014a3145ae477a1cbc00cd1e552336dceb790\"\n\n\"@xtuc/long@4.2.2\":\n  version \"4.2.2\"\n  resolved \"https://registry.yarnpkg.com/@xtuc/long/-/long-4.2.2.tgz#d291c6a4e97989b5c61d9acf396ae4fe133a718d\"\n\nabbrev@1:\n  version \"1.1.1\"\n  resolved \"https://registry.yarnpkg.com/abbrev/-/abbrev-1.1.1.tgz#f8f2c887ad10bf67f634f005b6987fed3179aac8\"\n\naccepts@~1.3.4, accepts@~1.3.5:\n  version \"1.3.5\"\n  resolved \"https://registry.yarnpkg.com/accepts/-/accepts-1.3.5.tgz#eb777df6011723a3b14e8a72c0805c8e86746bd2\"\n  dependencies:\n    mime-types \"~2.1.18\"\n    negotiator \"0.6.1\"\n\nacorn-dynamic-import@^4.0.0:\n  version \"4.0.0\"\n  resolved \"https://registry.yarnpkg.com/acorn-dynamic-import/-/acorn-dynamic-import-4.0.0.tgz#482210140582a36b83c3e342e1cfebcaa9240948\"\n\nacorn@^6.0.5:\n  version \"6.1.1\"\n  resolved \"https://registry.yarnpkg.com/acorn/-/acorn-6.1.1.tgz#7d25ae05bb8ad1f9b699108e1094ecd7884adc1f\"\n\nadjust-sourcemap-loader@2.0.0:\n  version \"2.0.0\"\n  resolved \"https://registry.yarnpkg.com/adjust-sourcemap-loader/-/adjust-sourcemap-loader-2.0.0.tgz#6471143af75ec02334b219f54bc7970c52fb29a4\"\n  dependencies:\n    assert \"1.4.1\"\n    camelcase \"5.0.0\"\n    loader-utils \"1.2.3\"\n    object-path \"0.11.4\"\n    regex-parser \"2.2.10\"\n\najv-errors@^1.0.0:\n  version \"1.0.1\"\n  resolved \"https://registry.yarnpkg.com/ajv-errors/-/ajv-errors-1.0.1.tgz#f35986aceb91afadec4102fbd85014950cefa64d\"\n\najv-keywords@^3.1.0:\n  version \"3.4.0\"\n  resolved \"https://registry.yarnpkg.com/ajv-keywords/-/ajv-keywords-3.4.0.tgz#4b831e7b531415a7cc518cd404e73f6193c6349d\"\n\najv@^6.1.0, ajv@^6.5.5:\n  version \"6.9.2\"\n  resolved \"https://registry.yarnpkg.com/ajv/-/ajv-6.9.2.tgz#4927adb83e7f48e5a32b45729744c71ec39c9c7b\"\n  dependencies:\n    fast-deep-equal \"^2.0.1\"\n    fast-json-stable-stringify \"^2.0.0\"\n    json-schema-traverse \"^0.4.1\"\n    uri-js \"^4.2.2\"\n\nalphanum-sort@^1.0.0:\n  version \"1.0.2\"\n  resolved \"https://registry.yarnpkg.com/alphanum-sort/-/alphanum-sort-1.0.2.tgz#97a1119649b211ad33691d9f9f486a8ec9fbe0a3\"\n\namdefine@>=0.0.4:\n  version \"1.0.1\"\n  resolved \"https://registry.yarnpkg.com/amdefine/-/amdefine-1.0.1.tgz#4a5282ac164729e93619bcfd3ad151f817ce91f5\"\n\nansi-colors@^3.0.0:\n  version \"3.2.3\"\n  resolved \"https://registry.yarnpkg.com/ansi-colors/-/ansi-colors-3.2.3.tgz#57d35b8686e851e2cc04c403f1c00203976a1813\"\n\nansi-html@0.0.7:\n  version \"0.0.7\"\n  resolved \"https://registry.yarnpkg.com/ansi-html/-/ansi-html-0.0.7.tgz#813584021962a9e9e6fd039f940d12f56ca7859e\"\n\nansi-regex@^2.0.0:\n  version \"2.1.1\"\n  resolved \"https://registry.yarnpkg.com/ansi-regex/-/ansi-regex-2.1.1.tgz#c3b33ab5ee360d86e0e628f0468ae7ef27d654df\"\n\nansi-regex@^3.0.0:\n  version \"3.0.0\"\n  resolved \"https://registry.yarnpkg.com/ansi-regex/-/ansi-regex-3.0.0.tgz#ed0317c322064f79466c02966bddb605ab37d998\"\n\nansi-regex@^4.1.0:\n  version \"4.1.0\"\n  resolved \"https://registry.yarnpkg.com/ansi-regex/-/ansi-regex-4.1.0.tgz#8b9f8f08cf1acb843756a839ca8c7e3168c51997\"\n  integrity sha512-1apePfXM1UOSqw0o9IiFAovVz9M5S1Dg+4TrDwfMewQ6p/rmMueb7tWZjQ1rx4Loy1ArBggoqGpfqqdI4rondg==\n\nansi-styles@^2.2.1:\n  version \"2.2.1\"\n  resolved \"https://registry.yarnpkg.com/ansi-styles/-/ansi-styles-2.2.1.tgz#b432dd3358b634cf75e1e4664368240533c1ddbe\"\n\nansi-styles@^3.2.0, ansi-styles@^3.2.1:\n  version \"3.2.1\"\n  resolved \"https://registry.yarnpkg.com/ansi-styles/-/ansi-styles-3.2.1.tgz#41fbb20243e50b12be0f04b8dedbf07520ce841d\"\n  dependencies:\n    color-convert \"^1.9.0\"\n\nanymatch@^2.0.0:\n  version \"2.0.0\"\n  resolved \"https://registry.yarnpkg.com/anymatch/-/anymatch-2.0.0.tgz#bcb24b4f37934d9aa7ac17b4adaf89e7c76ef2eb\"\n  dependencies:\n    micromatch \"^3.1.4\"\n    normalize-path \"^2.1.1\"\n\naproba@^1.0.3, aproba@^1.1.1:\n  version \"1.2.0\"\n  resolved \"https://registry.yarnpkg.com/aproba/-/aproba-1.2.0.tgz#6802e6264efd18c790a1b0d517f0f2627bf2c94a\"\n\nare-we-there-yet@~1.1.2:\n  version \"1.1.5\"\n  resolved \"https://registry.yarnpkg.com/are-we-there-yet/-/are-we-there-yet-1.1.5.tgz#4b35c2944f062a8bfcda66410760350fe9ddfc21\"\n  dependencies:\n    delegates \"^1.0.0\"\n    readable-stream \"^2.0.6\"\n\nargparse@^1.0.7:\n  version \"1.0.10\"\n  resolved \"https://registry.yarnpkg.com/argparse/-/argparse-1.0.10.tgz#bcd6791ea5ae09725e17e5ad988134cd40b3d911\"\n  dependencies:\n    sprintf-js \"~1.0.2\"\n\narity-n@^1.0.4:\n  version \"1.0.4\"\n  resolved \"https://registry.yarnpkg.com/arity-n/-/arity-n-1.0.4.tgz#d9e76b11733e08569c0847ae7b39b2860b30b745\"\n\narr-diff@^4.0.0:\n  version \"4.0.0\"\n  resolved \"https://registry.yarnpkg.com/arr-diff/-/arr-diff-4.0.0.tgz#d6461074febfec71e7e15235761a329a5dc7c520\"\n\narr-flatten@^1.1.0:\n  version \"1.1.0\"\n  resolved \"https://registry.yarnpkg.com/arr-flatten/-/arr-flatten-1.1.0.tgz#36048bbff4e7b47e136644316c99669ea5ae91f1\"\n\narr-union@^3.1.0:\n  version \"3.1.0\"\n  resolved \"https://registry.yarnpkg.com/arr-union/-/arr-union-3.1.0.tgz#e39b09aea9def866a8f206e288af63919bae39c4\"\n\narray-find-index@^1.0.1:\n  version \"1.0.2\"\n  resolved \"https://registry.yarnpkg.com/array-find-index/-/array-find-index-1.0.2.tgz#df010aa1287e164bbda6f9723b0a96a1ec4187a1\"\n\narray-flatten@1.1.1:\n  version \"1.1.1\"\n  resolved \"https://registry.yarnpkg.com/array-flatten/-/array-flatten-1.1.1.tgz#9a5f699051b1e7073328f2a008968b64ea2955d2\"\n\narray-flatten@^2.1.0:\n  version \"2.1.2\"\n  resolved \"https://registry.yarnpkg.com/array-flatten/-/array-flatten-2.1.2.tgz#24ef80a28c1a893617e2149b0c6d0d788293b099\"\n\narray-union@^1.0.1:\n  version \"1.0.2\"\n  resolved \"https://registry.yarnpkg.com/array-union/-/array-union-1.0.2.tgz#9a34410e4f4e3da23dea375be5be70f24778ec39\"\n  dependencies:\n    array-uniq \"^1.0.1\"\n\narray-uniq@^1.0.1:\n  version \"1.0.3\"\n  resolved \"https://registry.yarnpkg.com/array-uniq/-/array-uniq-1.0.3.tgz#af6ac877a25cc7f74e058894753858dfdb24fdb6\"\n\narray-unique@^0.3.2:\n  version \"0.3.2\"\n  resolved \"https://registry.yarnpkg.com/array-unique/-/array-unique-0.3.2.tgz#a894b75d4bc4f6cd679ef3244a9fd8f46ae2d428\"\n\narrify@^1.0.1:\n  version \"1.0.1\"\n  resolved \"https://registry.yarnpkg.com/arrify/-/arrify-1.0.1.tgz#898508da2226f380df904728456849c1501a4b0d\"\n\nasap@^2.0.6:\n  version \"2.0.6\"\n  resolved \"https://registry.yarnpkg.com/asap/-/asap-2.0.6.tgz#e50347611d7e690943208bbdafebcbc2fb866d46\"\n\nasn1.js@^4.0.0:\n  version \"4.10.1\"\n  resolved \"https://registry.yarnpkg.com/asn1.js/-/asn1.js-4.10.1.tgz#b9c2bf5805f1e64aadeed6df3a2bfafb5a73f5a0\"\n  dependencies:\n    bn.js \"^4.0.0\"\n    inherits \"^2.0.1\"\n    minimalistic-assert \"^1.0.0\"\n\nasn1@~0.2.3:\n  version \"0.2.4\"\n  resolved \"https://registry.yarnpkg.com/asn1/-/asn1-0.2.4.tgz#8d2475dfab553bb33e77b54e59e880bb8ce23136\"\n  dependencies:\n    safer-buffer \"~2.1.0\"\n\nassert-plus@1.0.0, assert-plus@^1.0.0:\n  version \"1.0.0\"\n  resolved \"https://registry.yarnpkg.com/assert-plus/-/assert-plus-1.0.0.tgz#f12e0f3c5d77b0b1cdd9146942e4e96c1e4dd525\"\n\nassert@1.4.1, assert@^1.1.1:\n  version \"1.4.1\"\n  resolved \"https://registry.yarnpkg.com/assert/-/assert-1.4.1.tgz#99912d591836b5a6f5b345c0f07eefc08fc65d91\"\n  dependencies:\n    util \"0.10.3\"\n\nassets-webpack-plugin@^3.9.7:\n  version \"3.9.7\"\n  resolved \"https://registry.yarnpkg.com/assets-webpack-plugin/-/assets-webpack-plugin-3.9.7.tgz#0c3c13632cc4490b2ef79fd0bbb16c69a724f364\"\n  dependencies:\n    camelcase \"^5.0.0\"\n    escape-string-regexp \"^1.0.3\"\n    lodash.assign \"^4.2.0\"\n    lodash.merge \"^4.6.1\"\n    mkdirp \"^0.5.1\"\n\nassign-symbols@^1.0.0:\n  version \"1.0.0\"\n  resolved \"https://registry.yarnpkg.com/assign-symbols/-/assign-symbols-1.0.0.tgz#59667f41fadd4f20ccbc2bb96b8d4f7f78ec0367\"\n\nast-types@0.9.6:\n  version \"0.9.6\"\n  resolved \"https://registry.yarnpkg.com/ast-types/-/ast-types-0.9.6.tgz#102c9e9e9005d3e7e3829bf0c4fa24ee862ee9b9\"\n\nasync-each@^1.0.1:\n  version \"1.0.1\"\n  resolved \"https://registry.yarnpkg.com/async-each/-/async-each-1.0.1.tgz#19d386a1d9edc6e7c1c85d388aedbcc56d33602d\"\n\nasync-foreach@^0.1.3:\n  version \"0.1.3\"\n  resolved \"https://registry.yarnpkg.com/async-foreach/-/async-foreach-0.1.3.tgz#36121f845c0578172de419a97dbeb1d16ec34542\"\n\nasync@^1.5.0, async@^1.5.2:\n  version \"1.5.2\"\n  resolved \"https://registry.yarnpkg.com/async/-/async-1.5.2.tgz#ec6a61ae56480c0c3cb241c95618e20892f9672a\"\n\nasynckit@^0.4.0:\n  version \"0.4.0\"\n  resolved \"https://registry.yarnpkg.com/asynckit/-/asynckit-0.4.0.tgz#c79ed97f7f34cb8f2ba1bc9790bcc366474b4b79\"\n\natob@^2.1.1:\n  version \"2.1.2\"\n  resolved \"https://registry.yarnpkg.com/atob/-/atob-2.1.2.tgz#6d9517eb9e030d2436666651e86bd9f6f13533c9\"\n\naws-sign2@~0.7.0:\n  version \"0.7.0\"\n  resolved \"https://registry.yarnpkg.com/aws-sign2/-/aws-sign2-0.7.0.tgz#b46e890934a9591f2d2f6f86d7e6a9f1b3fe76a8\"\n\naws4@^1.8.0:\n  version \"1.8.0\"\n  resolved \"https://registry.yarnpkg.com/aws4/-/aws4-1.8.0.tgz#f0e003d9ca9e7f59c7a508945d7b2ef9a04a542f\"\n\naxios@^0.18.1:\n  version \"0.18.1\"\n  resolved \"https://registry.yarnpkg.com/axios/-/axios-0.18.1.tgz#ff3f0de2e7b5d180e757ad98000f1081b87bcea3\"\n  integrity sha512-0BfJq4NSfQXd+SkFdrvFbG7addhYSBA2mQwISr46pD6E5iqkWg02RAs8vyTT/j0RTnoYmeXauBuSv1qKwR179g==\n  dependencies:\n    follow-redirects \"1.5.10\"\n    is-buffer \"^2.0.2\"\n\nbabel-loader@^8.0.0:\n  version \"8.0.5\"\n  resolved \"https://registry.yarnpkg.com/babel-loader/-/babel-loader-8.0.5.tgz#225322d7509c2157655840bba52e46b6c2f2fe33\"\n  dependencies:\n    find-cache-dir \"^2.0.0\"\n    loader-utils \"^1.0.2\"\n    mkdirp \"^0.5.1\"\n    util.promisify \"^1.0.0\"\n\nbabel-runtime@^6.23.0, babel-runtime@^6.26.0:\n  version \"6.26.0\"\n  resolved \"https://registry.yarnpkg.com/babel-runtime/-/babel-runtime-6.26.0.tgz#965c7058668e82b55d7bfe04ff2337bc8b5647fe\"\n  dependencies:\n    core-js \"^2.4.0\"\n    regenerator-runtime \"^0.11.0\"\n\nbalanced-match@^1.0.0:\n  version \"1.0.0\"\n  resolved \"https://registry.yarnpkg.com/balanced-match/-/balanced-match-1.0.0.tgz#89b4d199ab2bee49de164ea02b89ce462d71b767\"\n\nbase64-js@^1.0.2:\n  version \"1.3.0\"\n  resolved \"https://registry.yarnpkg.com/base64-js/-/base64-js-1.3.0.tgz#cab1e6118f051095e58b5281aea8c1cd22bfc0e3\"\n\nbase@^0.11.1:\n  version \"0.11.2\"\n  resolved \"https://registry.yarnpkg.com/base/-/base-0.11.2.tgz#7bde5ced145b6d551a90db87f83c558b4eb48a8f\"\n  dependencies:\n    cache-base \"^1.0.1\"\n    class-utils \"^0.3.5\"\n    component-emitter \"^1.2.1\"\n    define-property \"^1.0.0\"\n    isobject \"^3.0.1\"\n    mixin-deep \"^1.2.0\"\n    pascalcase \"^0.1.1\"\n\nbatch@0.6.1:\n  version \"0.6.1\"\n  resolved \"https://registry.yarnpkg.com/batch/-/batch-0.6.1.tgz#dc34314f4e679318093fc760272525f94bf25c16\"\n\nbcrypt-pbkdf@^1.0.0:\n  version \"1.0.2\"\n  resolved \"https://registry.yarnpkg.com/bcrypt-pbkdf/-/bcrypt-pbkdf-1.0.2.tgz#a4301d389b6a43f9b67ff3ca11a3f6637e360e9e\"\n  dependencies:\n    tweetnacl \"^0.14.3\"\n\nbig.js@^3.1.3:\n  version \"3.2.0\"\n  resolved \"https://registry.yarnpkg.com/big.js/-/big.js-3.2.0.tgz#a5fc298b81b9e0dca2e458824784b65c52ba588e\"\n\nbig.js@^5.2.2:\n  version \"5.2.2\"\n  resolved \"https://registry.yarnpkg.com/big.js/-/big.js-5.2.2.tgz#65f0af382f578bcdc742bd9c281e9cb2d7768328\"\n\nbignumber.js@^2.1.0:\n  version \"2.4.0\"\n  resolved \"https://registry.yarnpkg.com/bignumber.js/-/bignumber.js-2.4.0.tgz#838a992da9f9d737e0f4b2db0be62bb09dd0c5e8\"\n\nbinary-extensions@^1.0.0:\n  version \"1.13.0\"\n  resolved \"https://registry.yarnpkg.com/binary-extensions/-/binary-extensions-1.13.0.tgz#9523e001306a32444b907423f1de2164222f6ab1\"\n\nblock-stream@*:\n  version \"0.0.9\"\n  resolved \"https://registry.yarnpkg.com/block-stream/-/block-stream-0.0.9.tgz#13ebfe778a03205cfe03751481ebb4b3300c126a\"\n  dependencies:\n    inherits \"~2.0.0\"\n\nbluebird@^3.5.3:\n  version \"3.5.3\"\n  resolved \"https://registry.yarnpkg.com/bluebird/-/bluebird-3.5.3.tgz#7d01c6f9616c9a51ab0f8c549a79dfe6ec33efa7\"\n\nbmp-js@0.0.1:\n  version \"0.0.1\"\n  resolved \"https://registry.yarnpkg.com/bmp-js/-/bmp-js-0.0.1.tgz#5ad0147099d13a9f38aa7b99af1d6e78666ed37f\"\n\nbmp-js@0.0.3:\n  version \"0.0.3\"\n  resolved \"https://registry.yarnpkg.com/bmp-js/-/bmp-js-0.0.3.tgz#64113e9c7cf1202b376ed607bf30626ebe57b18a\"\n\nbn.js@^4.0.0, bn.js@^4.1.0, bn.js@^4.1.1, bn.js@^4.4.0:\n  version \"4.11.8\"\n  resolved \"https://registry.yarnpkg.com/bn.js/-/bn.js-4.11.8.tgz#2cde09eb5ee341f484746bb0309b3253b1b1442f\"\n\nbody-parser@1.18.3:\n  version \"1.18.3\"\n  resolved \"https://registry.yarnpkg.com/body-parser/-/body-parser-1.18.3.tgz#5b292198ffdd553b3a0f20ded0592b956955c8b4\"\n  dependencies:\n    bytes \"3.0.0\"\n    content-type \"~1.0.4\"\n    debug \"2.6.9\"\n    depd \"~1.1.2\"\n    http-errors \"~1.6.3\"\n    iconv-lite \"0.4.23\"\n    on-finished \"~2.3.0\"\n    qs \"6.5.2\"\n    raw-body \"2.3.3\"\n    type-is \"~1.6.16\"\n\nbonjour@^3.5.0:\n  version \"3.5.0\"\n  resolved \"https://registry.yarnpkg.com/bonjour/-/bonjour-3.5.0.tgz#8e890a183d8ee9a2393b3844c691a42bcf7bc9f5\"\n  dependencies:\n    array-flatten \"^2.1.0\"\n    deep-equal \"^1.0.1\"\n    dns-equal \"^1.0.0\"\n    dns-txt \"^2.0.2\"\n    multicast-dns \"^6.0.1\"\n    multicast-dns-service-types \"^1.1.0\"\n\nboolbase@^1.0.0, boolbase@~1.0.0:\n  version \"1.0.0\"\n  resolved \"https://registry.yarnpkg.com/boolbase/-/boolbase-1.0.0.tgz#68dff5fbe60c51eb37725ea9e3ed310dcc1e776e\"\n\nbrace-expansion@^1.1.7:\n  version \"1.1.11\"\n  resolved \"https://registry.yarnpkg.com/brace-expansion/-/brace-expansion-1.1.11.tgz#3c7fcbf529d87226f3d2f52b966ff5271eb441dd\"\n  dependencies:\n    balanced-match \"^1.0.0\"\n    concat-map \"0.0.1\"\n\nbraces@^2.3.1, braces@^2.3.2:\n  version \"2.3.2\"\n  resolved \"https://registry.yarnpkg.com/braces/-/braces-2.3.2.tgz#5979fd3f14cd531565e5fa2df1abfff1dfaee729\"\n  dependencies:\n    arr-flatten \"^1.1.0\"\n    array-unique \"^0.3.2\"\n    extend-shallow \"^2.0.1\"\n    fill-range \"^4.0.0\"\n    isobject \"^3.0.1\"\n    repeat-element \"^1.1.2\"\n    snapdragon \"^0.8.1\"\n    snapdragon-node \"^2.0.1\"\n    split-string \"^3.0.2\"\n    to-regex \"^3.0.1\"\n\nbraces@^3.0.1:\n  version \"3.0.2\"\n  resolved \"https://registry.yarnpkg.com/braces/-/braces-3.0.2.tgz#3454e1a462ee8d599e236df336cd9ea4f8afe107\"\n  dependencies:\n    fill-range \"^7.0.1\"\n\nbrorand@^1.0.1:\n  version \"1.1.0\"\n  resolved \"https://registry.yarnpkg.com/brorand/-/brorand-1.1.0.tgz#12c25efe40a45e3c323eb8675a0a0ce57b22371f\"\n\nbrowserify-aes@^1.0.0, browserify-aes@^1.0.4:\n  version \"1.2.0\"\n  resolved \"https://registry.yarnpkg.com/browserify-aes/-/browserify-aes-1.2.0.tgz#326734642f403dabc3003209853bb70ad428ef48\"\n  dependencies:\n    buffer-xor \"^1.0.3\"\n    cipher-base \"^1.0.0\"\n    create-hash \"^1.1.0\"\n    evp_bytestokey \"^1.0.3\"\n    inherits \"^2.0.1\"\n    safe-buffer \"^5.0.1\"\n\nbrowserify-cipher@^1.0.0:\n  version \"1.0.1\"\n  resolved \"https://registry.yarnpkg.com/browserify-cipher/-/browserify-cipher-1.0.1.tgz#8d6474c1b870bfdabcd3bcfcc1934a10e94f15f0\"\n  dependencies:\n    browserify-aes \"^1.0.4\"\n    browserify-des \"^1.0.0\"\n    evp_bytestokey \"^1.0.0\"\n\nbrowserify-des@^1.0.0:\n  version \"1.0.2\"\n  resolved \"https://registry.yarnpkg.com/browserify-des/-/browserify-des-1.0.2.tgz#3af4f1f59839403572f1c66204375f7a7f703e9c\"\n  dependencies:\n    cipher-base \"^1.0.1\"\n    des.js \"^1.0.0\"\n    inherits \"^2.0.1\"\n    safe-buffer \"^5.1.2\"\n\nbrowserify-rsa@^4.0.0:\n  version \"4.0.1\"\n  resolved \"https://registry.yarnpkg.com/browserify-rsa/-/browserify-rsa-4.0.1.tgz#21e0abfaf6f2029cf2fafb133567a701d4135524\"\n  dependencies:\n    bn.js \"^4.1.0\"\n    randombytes \"^2.0.1\"\n\nbrowserify-sign@^4.0.0:\n  version \"4.0.4\"\n  resolved \"https://registry.yarnpkg.com/browserify-sign/-/browserify-sign-4.0.4.tgz#aa4eb68e5d7b658baa6bf6a57e630cbd7a93d298\"\n  dependencies:\n    bn.js \"^4.1.1\"\n    browserify-rsa \"^4.0.0\"\n    create-hash \"^1.1.0\"\n    create-hmac \"^1.1.2\"\n    elliptic \"^6.0.0\"\n    inherits \"^2.0.1\"\n    parse-asn1 \"^5.0.0\"\n\nbrowserify-zlib@^0.2.0:\n  version \"0.2.0\"\n  resolved \"https://registry.yarnpkg.com/browserify-zlib/-/browserify-zlib-0.2.0.tgz#2869459d9aa3be245fe8fe2ca1f46e2e7f54d73f\"\n  dependencies:\n    pako \"~1.0.5\"\n\nbrowserslist@^4.0.0:\n  version \"4.4.2\"\n  resolved \"https://registry.yarnpkg.com/browserslist/-/browserslist-4.4.2.tgz#6ea8a74d6464bb0bd549105f659b41197d8f0ba2\"\n  dependencies:\n    caniuse-lite \"^1.0.30000939\"\n    electron-to-chromium \"^1.3.113\"\n    node-releases \"^1.1.8\"\n\nbrowserslist@^4.6.0:\n  version \"4.6.0\"\n  resolved \"https://registry.yarnpkg.com/browserslist/-/browserslist-4.6.0.tgz#5274028c26f4d933d5b1323307c1d1da5084c9ff\"\n  dependencies:\n    caniuse-lite \"^1.0.30000967\"\n    electron-to-chromium \"^1.3.133\"\n    node-releases \"^1.1.19\"\n\nbuffer-alloc-unsafe@^1.1.0:\n  version \"1.1.0\"\n  resolved \"https://registry.yarnpkg.com/buffer-alloc-unsafe/-/buffer-alloc-unsafe-1.1.0.tgz#bd7dc26ae2972d0eda253be061dba992349c19f0\"\n\nbuffer-alloc@^1.1.0:\n  version \"1.2.0\"\n  resolved \"https://registry.yarnpkg.com/buffer-alloc/-/buffer-alloc-1.2.0.tgz#890dd90d923a873e08e10e5fd51a57e5b7cce0ec\"\n  dependencies:\n    buffer-alloc-unsafe \"^1.1.0\"\n    buffer-fill \"^1.0.0\"\n\nbuffer-equal@0.0.1:\n  version \"0.0.1\"\n  resolved \"https://registry.yarnpkg.com/buffer-equal/-/buffer-equal-0.0.1.tgz#91bc74b11ea405bc916bc6aa908faafa5b4aac4b\"\n\nbuffer-fill@^1.0.0:\n  version \"1.0.0\"\n  resolved \"https://registry.yarnpkg.com/buffer-fill/-/buffer-fill-1.0.0.tgz#f8f78b76789888ef39f205cd637f68e702122b2c\"\n\nbuffer-from@^1.0.0:\n  version \"1.1.1\"\n  resolved \"https://registry.yarnpkg.com/buffer-from/-/buffer-from-1.1.1.tgz#32713bc028f75c02fdb710d7c7bcec1f2c6070ef\"\n\nbuffer-indexof@^1.0.0:\n  version \"1.1.1\"\n  resolved \"https://registry.yarnpkg.com/buffer-indexof/-/buffer-indexof-1.1.1.tgz#52fabcc6a606d1a00302802648ef68f639da268c\"\n\nbuffer-xor@^1.0.3:\n  version \"1.0.3\"\n  resolved \"https://registry.yarnpkg.com/buffer-xor/-/buffer-xor-1.0.3.tgz#26e61ed1422fb70dd42e6e36729ed51d855fe8d9\"\n\nbuffer@^4.3.0:\n  version \"4.9.1\"\n  resolved \"https://registry.yarnpkg.com/buffer/-/buffer-4.9.1.tgz#6d1bb601b07a4efced97094132093027c95bc298\"\n  dependencies:\n    base64-js \"^1.0.2\"\n    ieee754 \"^1.1.4\"\n    isarray \"^1.0.0\"\n\nbuiltin-modules@^1.1.1:\n  version \"1.1.1\"\n  resolved \"https://registry.yarnpkg.com/builtin-modules/-/builtin-modules-1.1.1.tgz#270f076c5a72c02f5b65a47df94c5fe3a278892f\"\n\nbuiltin-status-codes@^3.0.0:\n  version \"3.0.0\"\n  resolved \"https://registry.yarnpkg.com/builtin-status-codes/-/builtin-status-codes-3.0.0.tgz#85982878e21b98e1c66425e03d0174788f569ee8\"\n\nbytes@3.0.0:\n  version \"3.0.0\"\n  resolved \"https://registry.yarnpkg.com/bytes/-/bytes-3.0.0.tgz#d32815404d689699f85a4ea4fa8755dd13a96048\"\n\ncacache@^11.0.2:\n  version \"11.3.2\"\n  resolved \"https://registry.yarnpkg.com/cacache/-/cacache-11.3.2.tgz#2d81e308e3d258ca38125b676b98b2ac9ce69bfa\"\n  dependencies:\n    bluebird \"^3.5.3\"\n    chownr \"^1.1.1\"\n    figgy-pudding \"^3.5.1\"\n    glob \"^7.1.3\"\n    graceful-fs \"^4.1.15\"\n    lru-cache \"^5.1.1\"\n    mississippi \"^3.0.0\"\n    mkdirp \"^0.5.1\"\n    move-concurrently \"^1.0.1\"\n    promise-inflight \"^1.0.1\"\n    rimraf \"^2.6.2\"\n    ssri \"^6.0.1\"\n    unique-filename \"^1.1.1\"\n    y18n \"^4.0.0\"\n\ncache-base@^1.0.1:\n  version \"1.0.1\"\n  resolved \"https://registry.yarnpkg.com/cache-base/-/cache-base-1.0.1.tgz#0a7f46416831c8b662ee36fe4e7c59d76f666ab2\"\n  dependencies:\n    collection-visit \"^1.0.0\"\n    component-emitter \"^1.2.1\"\n    get-value \"^2.0.6\"\n    has-value \"^1.0.0\"\n    isobject \"^3.0.1\"\n    set-value \"^2.0.0\"\n    to-object-path \"^0.3.0\"\n    union-value \"^1.0.0\"\n    unset-value \"^1.0.0\"\n\ncall-me-maybe@^1.0.1:\n  version \"1.0.1\"\n  resolved \"https://registry.yarnpkg.com/call-me-maybe/-/call-me-maybe-1.0.1.tgz#26d208ea89e37b5cbde60250a15f031c16a4d66b\"\n\ncaller-callsite@^2.0.0:\n  version \"2.0.0\"\n  resolved \"https://registry.yarnpkg.com/caller-callsite/-/caller-callsite-2.0.0.tgz#847e0fce0a223750a9a027c54b33731ad3154134\"\n  dependencies:\n    callsites \"^2.0.0\"\n\ncaller-path@^2.0.0:\n  version \"2.0.0\"\n  resolved \"https://registry.yarnpkg.com/caller-path/-/caller-path-2.0.0.tgz#468f83044e369ab2010fac5f06ceee15bb2cb1f4\"\n  dependencies:\n    caller-callsite \"^2.0.0\"\n\ncallsites@^2.0.0:\n  version \"2.0.0\"\n  resolved \"https://registry.yarnpkg.com/callsites/-/callsites-2.0.0.tgz#06eb84f00eea413da86affefacbffb36093b3c50\"\n\ncamel-case@3.0.x:\n  version \"3.0.0\"\n  resolved \"https://registry.yarnpkg.com/camel-case/-/camel-case-3.0.0.tgz#ca3c3688a4e9cf3a4cda777dc4dcbc713249cf73\"\n  dependencies:\n    no-case \"^2.2.0\"\n    upper-case \"^1.1.1\"\n\ncamelcase-keys@^2.0.0:\n  version \"2.1.0\"\n  resolved \"https://registry.yarnpkg.com/camelcase-keys/-/camelcase-keys-2.1.0.tgz#308beeaffdf28119051efa1d932213c91b8f92e7\"\n  dependencies:\n    camelcase \"^2.0.0\"\n    map-obj \"^1.0.0\"\n\ncamelcase@5.0.0, camelcase@^5.0.0:\n  version \"5.0.0\"\n  resolved \"https://registry.yarnpkg.com/camelcase/-/camelcase-5.0.0.tgz#03295527d58bd3cd4aa75363f35b2e8d97be2f42\"\n\ncamelcase@^2.0.0, camelcase@^2.0.1:\n  version \"2.1.1\"\n  resolved \"https://registry.yarnpkg.com/camelcase/-/camelcase-2.1.1.tgz#7c1d16d679a1bbe59ca02cacecfb011e201f5a1f\"\n\ncamelcase@^4.1.0:\n  version \"4.1.0\"\n  resolved \"https://registry.yarnpkg.com/camelcase/-/camelcase-4.1.0.tgz#d545635be1e33c542649c69173e5de6acfae34dd\"\n\ncamelcase@^5.2.0:\n  version \"5.3.1\"\n  resolved \"https://registry.yarnpkg.com/camelcase/-/camelcase-5.3.1.tgz#e3c9b31569e106811df242f715725a1f4c494320\"\n\ncaniuse-api@^3.0.0:\n  version \"3.0.0\"\n  resolved \"https://registry.yarnpkg.com/caniuse-api/-/caniuse-api-3.0.0.tgz#5e4d90e2274961d46291997df599e3ed008ee4c0\"\n  dependencies:\n    browserslist \"^4.0.0\"\n    caniuse-lite \"^1.0.0\"\n    lodash.memoize \"^4.1.2\"\n    lodash.uniq \"^4.5.0\"\n\ncaniuse-lite@^1.0.0, caniuse-lite@^1.0.30000939:\n  version \"1.0.30000939\"\n  resolved \"https://registry.yarnpkg.com/caniuse-lite/-/caniuse-lite-1.0.30000939.tgz#b9ab7ac9e861bf78840b80c5dfbc471a5cd7e679\"\n\ncaniuse-lite@^1.0.30000967:\n  version \"1.0.30000971\"\n  resolved \"https://registry.yarnpkg.com/caniuse-lite/-/caniuse-lite-1.0.30000971.tgz#d1000e4546486a6977756547352bc96a4cfd2b13\"\n\ncaseless@~0.12.0:\n  version \"0.12.0\"\n  resolved \"https://registry.yarnpkg.com/caseless/-/caseless-0.12.0.tgz#1b681c21ff84033c826543090689420d187151dc\"\n\nchalk@^1.1.1, chalk@^1.1.3:\n  version \"1.1.3\"\n  resolved \"https://registry.yarnpkg.com/chalk/-/chalk-1.1.3.tgz#a8115c55e4a702fe4d150abd3872822a7e09fc98\"\n  dependencies:\n    ansi-styles \"^2.2.1\"\n    escape-string-regexp \"^1.0.2\"\n    has-ansi \"^2.0.0\"\n    strip-ansi \"^3.0.0\"\n    supports-color \"^2.0.0\"\n\nchalk@^2.0.0, chalk@^2.3.0, chalk@^2.4.0, chalk@^2.4.1, chalk@^2.4.2:\n  version \"2.4.2\"\n  resolved \"https://registry.yarnpkg.com/chalk/-/chalk-2.4.2.tgz#cd42541677a54333cf541a49108c1432b44c9424\"\n  dependencies:\n    ansi-styles \"^3.2.1\"\n    escape-string-regexp \"^1.0.5\"\n    supports-color \"^5.3.0\"\n\ncheerio@^0.19.0:\n  version \"0.19.0\"\n  resolved \"https://registry.yarnpkg.com/cheerio/-/cheerio-0.19.0.tgz#772e7015f2ee29965096d71ea4175b75ab354925\"\n  dependencies:\n    css-select \"~1.0.0\"\n    dom-serializer \"~0.1.0\"\n    entities \"~1.1.1\"\n    htmlparser2 \"~3.8.1\"\n    lodash \"^3.2.0\"\n\nchokidar@^2.0.0, chokidar@^2.0.2:\n  version \"2.1.2\"\n  resolved \"https://registry.yarnpkg.com/chokidar/-/chokidar-2.1.2.tgz#9c23ea40b01638439e0513864d362aeacc5ad058\"\n  dependencies:\n    anymatch \"^2.0.0\"\n    async-each \"^1.0.1\"\n    braces \"^2.3.2\"\n    glob-parent \"^3.1.0\"\n    inherits \"^2.0.3\"\n    is-binary-path \"^1.0.0\"\n    is-glob \"^4.0.0\"\n    normalize-path \"^3.0.0\"\n    path-is-absolute \"^1.0.0\"\n    readdirp \"^2.2.1\"\n    upath \"^1.1.0\"\n  optionalDependencies:\n    fsevents \"^1.2.7\"\n\nchokidar@^2.1.2:\n  version \"2.1.6\"\n  resolved \"https://registry.yarnpkg.com/chokidar/-/chokidar-2.1.6.tgz#b6cad653a929e244ce8a834244164d241fa954c5\"\n  dependencies:\n    anymatch \"^2.0.0\"\n    async-each \"^1.0.1\"\n    braces \"^2.3.2\"\n    glob-parent \"^3.1.0\"\n    inherits \"^2.0.3\"\n    is-binary-path \"^1.0.0\"\n    is-glob \"^4.0.0\"\n    normalize-path \"^3.0.0\"\n    path-is-absolute \"^1.0.0\"\n    readdirp \"^2.2.1\"\n    upath \"^1.1.1\"\n  optionalDependencies:\n    fsevents \"^1.2.7\"\n\nchownr@^1.1.1:\n  version \"1.1.1\"\n  resolved \"https://registry.yarnpkg.com/chownr/-/chownr-1.1.1.tgz#54726b8b8fff4df053c42187e801fb4412df1494\"\n\nchrome-trace-event@^1.0.0:\n  version \"1.0.0\"\n  resolved \"https://registry.yarnpkg.com/chrome-trace-event/-/chrome-trace-event-1.0.0.tgz#45a91bd2c20c9411f0963b5aaeb9a1b95e09cc48\"\n  dependencies:\n    tslib \"^1.9.0\"\n\nci-info@^2.0.0:\n  version \"2.0.0\"\n  resolved \"https://registry.yarnpkg.com/ci-info/-/ci-info-2.0.0.tgz#67a9e964be31a51e15e5010d58e6f12834002f46\"\n\ncipher-base@^1.0.0, cipher-base@^1.0.1, cipher-base@^1.0.3:\n  version \"1.0.4\"\n  resolved \"https://registry.yarnpkg.com/cipher-base/-/cipher-base-1.0.4.tgz#8760e4ecc272f4c363532f926d874aae2c1397de\"\n  dependencies:\n    inherits \"^2.0.1\"\n    safe-buffer \"^5.0.1\"\n\nclass-utils@^0.3.5:\n  version \"0.3.6\"\n  resolved \"https://registry.yarnpkg.com/class-utils/-/class-utils-0.3.6.tgz#f93369ae8b9a7ce02fd41faad0ca83033190c463\"\n  dependencies:\n    arr-union \"^3.1.0\"\n    define-property \"^0.2.5\"\n    isobject \"^3.0.0\"\n    static-extend \"^0.1.1\"\n\nclassnames@^2.2.3, classnames@^2.2.5, classnames@^2.2.6:\n  version \"2.2.6\"\n  resolved \"https://registry.yarnpkg.com/classnames/-/classnames-2.2.6.tgz#43935bffdd291f326dad0a205309b38d00f650ce\"\n\nclean-css@4.2.x:\n  version \"4.2.1\"\n  resolved \"https://registry.yarnpkg.com/clean-css/-/clean-css-4.2.1.tgz#2d411ef76b8569b6d0c84068dabe85b0aa5e5c17\"\n  dependencies:\n    source-map \"~0.6.0\"\n\nclean-webpack-plugin@^0.1.19:\n  version \"0.1.19\"\n  resolved \"https://registry.yarnpkg.com/clean-webpack-plugin/-/clean-webpack-plugin-0.1.19.tgz#ceda8bb96b00fe168e9b080272960d20fdcadd6d\"\n  dependencies:\n    rimraf \"^2.6.1\"\n\ncliui@^3.0.3:\n  version \"3.2.0\"\n  resolved \"https://registry.yarnpkg.com/cliui/-/cliui-3.2.0.tgz#120601537a916d29940f934da3b48d585a39213d\"\n  dependencies:\n    string-width \"^1.0.1\"\n    strip-ansi \"^3.0.1\"\n    wrap-ansi \"^2.0.0\"\n\ncliui@^4.0.0:\n  version \"4.1.0\"\n  resolved \"https://registry.yarnpkg.com/cliui/-/cliui-4.1.0.tgz#348422dbe82d800b3022eef4f6ac10bf2e4d1b49\"\n  dependencies:\n    string-width \"^2.1.1\"\n    strip-ansi \"^4.0.0\"\n    wrap-ansi \"^2.0.0\"\n\ncliui@^5.0.0:\n  version \"5.0.0\"\n  resolved \"https://registry.yarnpkg.com/cliui/-/cliui-5.0.0.tgz#deefcfdb2e800784aa34f46fa08e06851c7bbbc5\"\n  integrity sha512-PYeGSEmmHM6zvoef2w8TPzlrnNpXIjTipYK780YswmIP9vjxmd6Y2a3CB2Ks6/AU8NHjZugXvo8w3oWM2qnwXA==\n  dependencies:\n    string-width \"^3.1.0\"\n    strip-ansi \"^5.2.0\"\n    wrap-ansi \"^5.1.0\"\n\nclone-deep@^2.0.1:\n  version \"2.0.2\"\n  resolved \"https://registry.yarnpkg.com/clone-deep/-/clone-deep-2.0.2.tgz#00db3a1e173656730d1188c3d6aced6d7ea97713\"\n  dependencies:\n    for-own \"^1.0.0\"\n    is-plain-object \"^2.0.4\"\n    kind-of \"^6.0.0\"\n    shallow-clone \"^1.0.0\"\n\nclone-stats@^0.0.1:\n  version \"0.0.1\"\n  resolved \"https://registry.yarnpkg.com/clone-stats/-/clone-stats-0.0.1.tgz#b88f94a82cf38b8791d58046ea4029ad88ca99d1\"\n\nclone@^1.0.0, clone@^1.0.2:\n  version \"1.0.4\"\n  resolved \"https://registry.yarnpkg.com/clone/-/clone-1.0.4.tgz#da309cc263df15994c688ca902179ca3c7cd7c7e\"\n\ncoa@^2.0.2:\n  version \"2.0.2\"\n  resolved \"https://registry.yarnpkg.com/coa/-/coa-2.0.2.tgz#43f6c21151b4ef2bf57187db0d73de229e3e7ec3\"\n  dependencies:\n    \"@types/q\" \"^1.5.1\"\n    chalk \"^2.4.1\"\n    q \"^1.1.2\"\n\ncode-point-at@^1.0.0:\n  version \"1.1.0\"\n  resolved \"https://registry.yarnpkg.com/code-point-at/-/code-point-at-1.1.0.tgz#0d070b4d043a5bea33a2f1a40e2edb3d9a4ccf77\"\n\ncollection-visit@^1.0.0:\n  version \"1.0.0\"\n  resolved \"https://registry.yarnpkg.com/collection-visit/-/collection-visit-1.0.0.tgz#4bc0373c164bc3291b4d368c829cf1a80a59dca0\"\n  dependencies:\n    map-visit \"^1.0.0\"\n    object-visit \"^1.0.0\"\n\ncolor-convert@^1.9.0, color-convert@^1.9.1:\n  version \"1.9.3\"\n  resolved \"https://registry.yarnpkg.com/color-convert/-/color-convert-1.9.3.tgz#bb71850690e1f136567de629d2d5471deda4c1e8\"\n  dependencies:\n    color-name \"1.1.3\"\n\ncolor-name@1.1.3:\n  version \"1.1.3\"\n  resolved \"https://registry.yarnpkg.com/color-name/-/color-name-1.1.3.tgz#a7d0558bd89c42f795dd42328f740831ca53bc25\"\n\ncolor-name@^1.0.0:\n  version \"1.1.4\"\n  resolved \"https://registry.yarnpkg.com/color-name/-/color-name-1.1.4.tgz#c2a09a87acbde69543de6f63fa3995c826c536a2\"\n\ncolor-string@^1.5.2:\n  version \"1.5.3\"\n  resolved \"https://registry.yarnpkg.com/color-string/-/color-string-1.5.3.tgz#c9bbc5f01b58b5492f3d6857459cb6590ce204cc\"\n  dependencies:\n    color-name \"^1.0.0\"\n    simple-swizzle \"^0.2.2\"\n\ncolor@^3.0.0:\n  version \"3.1.0\"\n  resolved \"https://registry.yarnpkg.com/color/-/color-3.1.0.tgz#d8e9fb096732875774c84bf922815df0308d0ffc\"\n  dependencies:\n    color-convert \"^1.9.1\"\n    color-string \"^1.5.2\"\n\ncolors@^1.1.2:\n  version \"1.3.3\"\n  resolved \"https://registry.yarnpkg.com/colors/-/colors-1.3.3.tgz#39e005d546afe01e01f9c4ca8fa50f686a01205d\"\n\ncombined-stream@^1.0.6, combined-stream@~1.0.6:\n  version \"1.0.7\"\n  resolved \"https://registry.yarnpkg.com/combined-stream/-/combined-stream-1.0.7.tgz#2d1d24317afb8abe95d6d2c0b07b57813539d828\"\n  dependencies:\n    delayed-stream \"~1.0.0\"\n\ncommander@2.17.x, commander@~2.17.1:\n  version \"2.17.1\"\n  resolved \"https://registry.yarnpkg.com/commander/-/commander-2.17.1.tgz#bd77ab7de6de94205ceacc72f1716d29f20a77bf\"\n\ncommander@^2.12.1:\n  version \"2.20.0\"\n  resolved \"https://registry.yarnpkg.com/commander/-/commander-2.20.0.tgz#d58bb2b5c1ee8f87b0d340027e9e94e222c5a422\"\n\ncommondir@^1.0.1:\n  version \"1.0.1\"\n  resolved \"https://registry.yarnpkg.com/commondir/-/commondir-1.0.1.tgz#ddd800da0c66127393cca5950ea968a3aaf1253b\"\n\ncomponent-emitter@^1.2.1:\n  version \"1.2.1\"\n  resolved \"https://registry.yarnpkg.com/component-emitter/-/component-emitter-1.2.1.tgz#137918d6d78283f7df7a6b7c5a63e140e69425e6\"\n\ncompose-function@3.0.3:\n  version \"3.0.3\"\n  resolved \"https://registry.yarnpkg.com/compose-function/-/compose-function-3.0.3.tgz#9ed675f13cc54501d30950a486ff6a7ba3ab185f\"\n  dependencies:\n    arity-n \"^1.0.4\"\n\ncompressible@~2.0.14:\n  version \"2.0.16\"\n  resolved \"https://registry.yarnpkg.com/compressible/-/compressible-2.0.16.tgz#a49bf9858f3821b64ce1be0296afc7380466a77f\"\n  dependencies:\n    mime-db \">= 1.38.0 < 2\"\n\ncompression@^1.5.2:\n  version \"1.7.3\"\n  resolved \"https://registry.yarnpkg.com/compression/-/compression-1.7.3.tgz#27e0e176aaf260f7f2c2813c3e440adb9f1993db\"\n  dependencies:\n    accepts \"~1.3.5\"\n    bytes \"3.0.0\"\n    compressible \"~2.0.14\"\n    debug \"2.6.9\"\n    on-headers \"~1.0.1\"\n    safe-buffer \"5.1.2\"\n    vary \"~1.1.2\"\n\nconcat-map@0.0.1:\n  version \"0.0.1\"\n  resolved \"https://registry.yarnpkg.com/concat-map/-/concat-map-0.0.1.tgz#d8a96bd77fd68df7793a73036a3ba0d5405d477b\"\n\nconcat-stream@1.6.2, concat-stream@^1.5.0:\n  version \"1.6.2\"\n  resolved \"https://registry.yarnpkg.com/concat-stream/-/concat-stream-1.6.2.tgz#904bdf194cd3122fc675c77fc4ac3d4ff0fd1a34\"\n  dependencies:\n    buffer-from \"^1.0.0\"\n    inherits \"^2.0.3\"\n    readable-stream \"^2.2.2\"\n    typedarray \"^0.0.6\"\n\nconcurrently@^4.1.0:\n  version \"4.1.0\"\n  resolved \"https://registry.yarnpkg.com/concurrently/-/concurrently-4.1.0.tgz#17fdf067da71210685d9ea554423ef239da30d33\"\n  dependencies:\n    chalk \"^2.4.1\"\n    date-fns \"^1.23.0\"\n    lodash \"^4.17.10\"\n    read-pkg \"^4.0.1\"\n    rxjs \"^6.3.3\"\n    spawn-command \"^0.0.2-1\"\n    supports-color \"^4.5.0\"\n    tree-kill \"^1.1.0\"\n    yargs \"^12.0.1\"\n\nconnect-history-api-fallback@^1.3.0:\n  version \"1.6.0\"\n  resolved \"https://registry.yarnpkg.com/connect-history-api-fallback/-/connect-history-api-fallback-1.6.0.tgz#8b32089359308d111115d81cad3fceab888f97bc\"\n\nconsole-browserify@^1.1.0:\n  version \"1.1.0\"\n  resolved \"https://registry.yarnpkg.com/console-browserify/-/console-browserify-1.1.0.tgz#f0241c45730a9fc6323b206dbf38edc741d0bb10\"\n  dependencies:\n    date-now \"^0.1.4\"\n\nconsole-control-strings@^1.0.0, console-control-strings@~1.1.0:\n  version \"1.1.0\"\n  resolved \"https://registry.yarnpkg.com/console-control-strings/-/console-control-strings-1.1.0.tgz#3d7cf4464db6446ea644bf4b39507f9851008e8e\"\n\nconstants-browserify@^1.0.0:\n  version \"1.0.0\"\n  resolved \"https://registry.yarnpkg.com/constants-browserify/-/constants-browserify-1.0.0.tgz#c20b96d8c617748aaf1c16021760cd27fcb8cb75\"\n\ncontent-disposition@0.5.2:\n  version \"0.5.2\"\n  resolved \"https://registry.yarnpkg.com/content-disposition/-/content-disposition-0.5.2.tgz#0cf68bb9ddf5f2be7961c3a85178cb85dba78cb4\"\n\ncontent-type@~1.0.4:\n  version \"1.0.4\"\n  resolved \"https://registry.yarnpkg.com/content-type/-/content-type-1.0.4.tgz#e138cc75e040c727b1966fe5e5f8c9aee256fe3b\"\n\nconvert-source-map@1.6.0, convert-source-map@^1.1.0:\n  version \"1.6.0\"\n  resolved \"https://registry.yarnpkg.com/convert-source-map/-/convert-source-map-1.6.0.tgz#51b537a8c43e0f04dec1993bffcdd504e758ac20\"\n  dependencies:\n    safe-buffer \"~5.1.1\"\n\nconvert-source-map@^0.3.3:\n  version \"0.3.5\"\n  resolved \"https://registry.yarnpkg.com/convert-source-map/-/convert-source-map-0.3.5.tgz#f1d802950af7dd2631a1febe0596550c86ab3190\"\n\ncookie-signature@1.0.6:\n  version \"1.0.6\"\n  resolved \"https://registry.yarnpkg.com/cookie-signature/-/cookie-signature-1.0.6.tgz#e303a882b342cc3ee8ca513a79999734dab3ae2c\"\n\ncookie@0.3.1:\n  version \"0.3.1\"\n  resolved \"https://registry.yarnpkg.com/cookie/-/cookie-0.3.1.tgz#e7e0a1f9ef43b4c8ba925c5c5a96e806d16873bb\"\n\ncopy-concurrently@^1.0.0:\n  version \"1.0.5\"\n  resolved \"https://registry.yarnpkg.com/copy-concurrently/-/copy-concurrently-1.0.5.tgz#92297398cae34937fcafd6ec8139c18051f0b5e0\"\n  dependencies:\n    aproba \"^1.1.1\"\n    fs-write-stream-atomic \"^1.0.8\"\n    iferr \"^0.1.5\"\n    mkdirp \"^0.5.1\"\n    rimraf \"^2.5.4\"\n    run-queue \"^1.0.0\"\n\ncopy-descriptor@^0.1.0:\n  version \"0.1.1\"\n  resolved \"https://registry.yarnpkg.com/copy-descriptor/-/copy-descriptor-0.1.1.tgz#676f6eb3c39997c2ee1ac3a924fd6124748f578d\"\n\ncore-js-compat@^3.1.1:\n  version \"3.1.2\"\n  resolved \"https://registry.yarnpkg.com/core-js-compat/-/core-js-compat-3.1.2.tgz#c29ab9722517094b98622175e2218c3b7398176d\"\n  dependencies:\n    browserslist \"^4.6.0\"\n    core-js-pure \"3.1.2\"\n    semver \"^6.0.0\"\n\ncore-js-pure@3.1.2:\n  version \"3.1.2\"\n  resolved \"https://registry.yarnpkg.com/core-js-pure/-/core-js-pure-3.1.2.tgz#62fc435f35b7374b9b782013cdcb2f97e9f6dffa\"\n\ncore-js@^2.4.0, core-js@^2.5.7:\n  version \"2.6.5\"\n  resolved \"https://registry.yarnpkg.com/core-js/-/core-js-2.6.5.tgz#44bc8d249e7fb2ff5d00e0341a7ffb94fbf67895\"\n\ncore-util-is@1.0.2, core-util-is@~1.0.0:\n  version \"1.0.2\"\n  resolved \"https://registry.yarnpkg.com/core-util-is/-/core-util-is-1.0.2.tgz#b5fd54220aa2bc5ab57aab7140c940754503c1a7\"\n\ncosmiconfig@^5.0.0, cosmiconfig@^5.0.7:\n  version \"5.1.0\"\n  resolved \"https://registry.yarnpkg.com/cosmiconfig/-/cosmiconfig-5.1.0.tgz#6c5c35e97f37f985061cdf653f114784231185cf\"\n  dependencies:\n    import-fresh \"^2.0.0\"\n    is-directory \"^0.3.1\"\n    js-yaml \"^3.9.0\"\n    lodash.get \"^4.4.2\"\n    parse-json \"^4.0.0\"\n\ncreate-ecdh@^4.0.0:\n  version \"4.0.3\"\n  resolved \"https://registry.yarnpkg.com/create-ecdh/-/create-ecdh-4.0.3.tgz#c9111b6f33045c4697f144787f9254cdc77c45ff\"\n  dependencies:\n    bn.js \"^4.1.0\"\n    elliptic \"^6.0.0\"\n\ncreate-hash@^1.1.0, create-hash@^1.1.2:\n  version \"1.2.0\"\n  resolved \"https://registry.yarnpkg.com/create-hash/-/create-hash-1.2.0.tgz#889078af11a63756bcfb59bd221996be3a9ef196\"\n  dependencies:\n    cipher-base \"^1.0.1\"\n    inherits \"^2.0.1\"\n    md5.js \"^1.3.4\"\n    ripemd160 \"^2.0.1\"\n    sha.js \"^2.4.0\"\n\ncreate-hmac@^1.1.0, create-hmac@^1.1.2, create-hmac@^1.1.4:\n  version \"1.1.7\"\n  resolved \"https://registry.yarnpkg.com/create-hmac/-/create-hmac-1.1.7.tgz#69170c78b3ab957147b2b8b04572e47ead2243ff\"\n  dependencies:\n    cipher-base \"^1.0.3\"\n    create-hash \"^1.1.0\"\n    inherits \"^2.0.1\"\n    ripemd160 \"^2.0.0\"\n    safe-buffer \"^5.0.1\"\n    sha.js \"^2.4.8\"\n\ncross-spawn@^3.0.0:\n  version \"3.0.1\"\n  resolved \"https://registry.yarnpkg.com/cross-spawn/-/cross-spawn-3.0.1.tgz#1256037ecb9f0c5f79e3d6ef135e30770184b982\"\n  dependencies:\n    lru-cache \"^4.0.1\"\n    which \"^1.2.9\"\n\ncross-spawn@^5.0.1:\n  version \"5.1.0\"\n  resolved \"https://registry.yarnpkg.com/cross-spawn/-/cross-spawn-5.1.0.tgz#e8bd0efee58fcff6f8f94510a0a554bbfa235449\"\n  dependencies:\n    lru-cache \"^4.0.1\"\n    shebang-command \"^1.2.0\"\n    which \"^1.2.9\"\n\ncross-spawn@^6.0.0, cross-spawn@^6.0.5:\n  version \"6.0.5\"\n  resolved \"https://registry.yarnpkg.com/cross-spawn/-/cross-spawn-6.0.5.tgz#4a5ec7c64dfae22c3a14124dbacdee846d80cbc4\"\n  dependencies:\n    nice-try \"^1.0.4\"\n    path-key \"^2.0.1\"\n    semver \"^5.5.0\"\n    shebang-command \"^1.2.0\"\n    which \"^1.2.9\"\n\ncrypto-browserify@^3.11.0:\n  version \"3.12.0\"\n  resolved \"https://registry.yarnpkg.com/crypto-browserify/-/crypto-browserify-3.12.0.tgz#396cf9f3137f03e4b8e532c58f698254e00f80ec\"\n  dependencies:\n    browserify-cipher \"^1.0.0\"\n    browserify-sign \"^4.0.0\"\n    create-ecdh \"^4.0.0\"\n    create-hash \"^1.1.0\"\n    create-hmac \"^1.1.0\"\n    diffie-hellman \"^5.0.0\"\n    inherits \"^2.0.1\"\n    pbkdf2 \"^3.0.3\"\n    public-encrypt \"^4.0.0\"\n    randombytes \"^2.0.0\"\n    randomfill \"^1.0.3\"\n\ncss-color-names@0.0.4, css-color-names@^0.0.4:\n  version \"0.0.4\"\n  resolved \"https://registry.yarnpkg.com/css-color-names/-/css-color-names-0.0.4.tgz#808adc2e79cf84738069b646cb20ec27beb629e0\"\n\ncss-declaration-sorter@^4.0.1:\n  version \"4.0.1\"\n  resolved \"https://registry.yarnpkg.com/css-declaration-sorter/-/css-declaration-sorter-4.0.1.tgz#c198940f63a76d7e36c1e71018b001721054cb22\"\n  dependencies:\n    postcss \"^7.0.1\"\n    timsort \"^0.3.0\"\n\ncss-loader@^2.1.1:\n  version \"2.1.1\"\n  resolved \"https://registry.yarnpkg.com/css-loader/-/css-loader-2.1.1.tgz#d8254f72e412bb2238bb44dd674ffbef497333ea\"\n  dependencies:\n    camelcase \"^5.2.0\"\n    icss-utils \"^4.1.0\"\n    loader-utils \"^1.2.3\"\n    normalize-path \"^3.0.0\"\n    postcss \"^7.0.14\"\n    postcss-modules-extract-imports \"^2.0.0\"\n    postcss-modules-local-by-default \"^2.0.6\"\n    postcss-modules-scope \"^2.1.0\"\n    postcss-modules-values \"^2.0.0\"\n    postcss-value-parser \"^3.3.0\"\n    schema-utils \"^1.0.0\"\n\ncss-modules-loader-core@^1.1.0:\n  version \"1.1.0\"\n  resolved \"https://registry.yarnpkg.com/css-modules-loader-core/-/css-modules-loader-core-1.1.0.tgz#5908668294a1becd261ae0a4ce21b0b551f21d16\"\n  dependencies:\n    icss-replace-symbols \"1.1.0\"\n    postcss \"6.0.1\"\n    postcss-modules-extract-imports \"1.1.0\"\n    postcss-modules-local-by-default \"1.2.0\"\n    postcss-modules-scope \"1.1.0\"\n    postcss-modules-values \"1.3.0\"\n\ncss-select-base-adapter@^0.1.1:\n  version \"0.1.1\"\n  resolved \"https://registry.yarnpkg.com/css-select-base-adapter/-/css-select-base-adapter-0.1.1.tgz#3b2ff4972cc362ab88561507a95408a1432135d7\"\n\ncss-select@^1.1.0:\n  version \"1.2.0\"\n  resolved \"https://registry.yarnpkg.com/css-select/-/css-select-1.2.0.tgz#2b3a110539c5355f1cd8d314623e870b121ec858\"\n  dependencies:\n    boolbase \"~1.0.0\"\n    css-what \"2.1\"\n    domutils \"1.5.1\"\n    nth-check \"~1.0.1\"\n\ncss-select@^2.0.0:\n  version \"2.0.2\"\n  resolved \"https://registry.yarnpkg.com/css-select/-/css-select-2.0.2.tgz#ab4386cec9e1f668855564b17c3733b43b2a5ede\"\n  dependencies:\n    boolbase \"^1.0.0\"\n    css-what \"^2.1.2\"\n    domutils \"^1.7.0\"\n    nth-check \"^1.0.2\"\n\ncss-select@~1.0.0:\n  version \"1.0.0\"\n  resolved \"https://registry.yarnpkg.com/css-select/-/css-select-1.0.0.tgz#b1121ca51848dd264e2244d058cee254deeb44b0\"\n  dependencies:\n    boolbase \"~1.0.0\"\n    css-what \"1.0\"\n    domutils \"1.4\"\n    nth-check \"~1.0.0\"\n\ncss-selector-tokenizer@^0.7.0:\n  version \"0.7.1\"\n  resolved \"https://registry.yarnpkg.com/css-selector-tokenizer/-/css-selector-tokenizer-0.7.1.tgz#a177271a8bca5019172f4f891fc6eed9cbf68d5d\"\n  dependencies:\n    cssesc \"^0.1.0\"\n    fastparse \"^1.1.1\"\n    regexpu-core \"^1.0.0\"\n\ncss-tree@1.0.0-alpha.28:\n  version \"1.0.0-alpha.28\"\n  resolved \"https://registry.yarnpkg.com/css-tree/-/css-tree-1.0.0-alpha.28.tgz#8e8968190d886c9477bc8d61e96f61af3f7ffa7f\"\n  dependencies:\n    mdn-data \"~1.1.0\"\n    source-map \"^0.5.3\"\n\ncss-tree@1.0.0-alpha.29:\n  version \"1.0.0-alpha.29\"\n  resolved \"https://registry.yarnpkg.com/css-tree/-/css-tree-1.0.0-alpha.29.tgz#3fa9d4ef3142cbd1c301e7664c1f352bd82f5a39\"\n  dependencies:\n    mdn-data \"~1.1.0\"\n    source-map \"^0.5.3\"\n\ncss-unit-converter@^1.1.1:\n  version \"1.1.1\"\n  resolved \"https://registry.yarnpkg.com/css-unit-converter/-/css-unit-converter-1.1.1.tgz#d9b9281adcfd8ced935bdbaba83786897f64e996\"\n\ncss-url-regex@^1.1.0:\n  version \"1.1.0\"\n  resolved \"https://registry.yarnpkg.com/css-url-regex/-/css-url-regex-1.1.0.tgz#83834230cc9f74c457de59eebd1543feeb83b7ec\"\n\ncss-what@1.0:\n  version \"1.0.0\"\n  resolved \"https://registry.yarnpkg.com/css-what/-/css-what-1.0.0.tgz#d7cc2df45180666f99d2b14462639469e00f736c\"\n\ncss-what@2.1, css-what@^2.1.2:\n  version \"2.1.3\"\n  resolved \"https://registry.yarnpkg.com/css-what/-/css-what-2.1.3.tgz#a6d7604573365fe74686c3f311c56513d88285f2\"\n\ncss@^2.0.0:\n  version \"2.2.4\"\n  resolved \"https://registry.yarnpkg.com/css/-/css-2.2.4.tgz#c646755c73971f2bba6a601e2cf2fd71b1298929\"\n  dependencies:\n    inherits \"^2.0.3\"\n    source-map \"^0.6.1\"\n    source-map-resolve \"^0.5.2\"\n    urix \"^0.1.0\"\n\ncssesc@^0.1.0:\n  version \"0.1.0\"\n  resolved \"https://registry.yarnpkg.com/cssesc/-/cssesc-0.1.0.tgz#c814903e45623371a0477b40109aaafbeeaddbb4\"\n\ncssesc@^2.0.0:\n  version \"2.0.0\"\n  resolved \"https://registry.yarnpkg.com/cssesc/-/cssesc-2.0.0.tgz#3b13bd1bb1cb36e1bcb5a4dcd27f54c5dcb35703\"\n\ncssesc@^3.0.0:\n  version \"3.0.0\"\n  resolved \"https://registry.yarnpkg.com/cssesc/-/cssesc-3.0.0.tgz#37741919903b868565e1c09ea747445cd18983ee\"\n\ncssnano-preset-default@^4.0.7:\n  version \"4.0.7\"\n  resolved \"https://registry.yarnpkg.com/cssnano-preset-default/-/cssnano-preset-default-4.0.7.tgz#51ec662ccfca0f88b396dcd9679cdb931be17f76\"\n  dependencies:\n    css-declaration-sorter \"^4.0.1\"\n    cssnano-util-raw-cache \"^4.0.1\"\n    postcss \"^7.0.0\"\n    postcss-calc \"^7.0.1\"\n    postcss-colormin \"^4.0.3\"\n    postcss-convert-values \"^4.0.1\"\n    postcss-discard-comments \"^4.0.2\"\n    postcss-discard-duplicates \"^4.0.2\"\n    postcss-discard-empty \"^4.0.1\"\n    postcss-discard-overridden \"^4.0.1\"\n    postcss-merge-longhand \"^4.0.11\"\n    postcss-merge-rules \"^4.0.3\"\n    postcss-minify-font-values \"^4.0.2\"\n    postcss-minify-gradients \"^4.0.2\"\n    postcss-minify-params \"^4.0.2\"\n    postcss-minify-selectors \"^4.0.2\"\n    postcss-normalize-charset \"^4.0.1\"\n    postcss-normalize-display-values \"^4.0.2\"\n    postcss-normalize-positions \"^4.0.2\"\n    postcss-normalize-repeat-style \"^4.0.2\"\n    postcss-normalize-string \"^4.0.2\"\n    postcss-normalize-timing-functions \"^4.0.2\"\n    postcss-normalize-unicode \"^4.0.1\"\n    postcss-normalize-url \"^4.0.1\"\n    postcss-normalize-whitespace \"^4.0.2\"\n    postcss-ordered-values \"^4.1.2\"\n    postcss-reduce-initial \"^4.0.3\"\n    postcss-reduce-transforms \"^4.0.2\"\n    postcss-svgo \"^4.0.2\"\n    postcss-unique-selectors \"^4.0.1\"\n\ncssnano-util-get-arguments@^4.0.0:\n  version \"4.0.0\"\n  resolved \"https://registry.yarnpkg.com/cssnano-util-get-arguments/-/cssnano-util-get-arguments-4.0.0.tgz#ed3a08299f21d75741b20f3b81f194ed49cc150f\"\n\ncssnano-util-get-match@^4.0.0:\n  version \"4.0.0\"\n  resolved \"https://registry.yarnpkg.com/cssnano-util-get-match/-/cssnano-util-get-match-4.0.0.tgz#c0e4ca07f5386bb17ec5e52250b4f5961365156d\"\n\ncssnano-util-raw-cache@^4.0.1:\n  version \"4.0.1\"\n  resolved \"https://registry.yarnpkg.com/cssnano-util-raw-cache/-/cssnano-util-raw-cache-4.0.1.tgz#b26d5fd5f72a11dfe7a7846fb4c67260f96bf282\"\n  dependencies:\n    postcss \"^7.0.0\"\n\ncssnano-util-same-parent@^4.0.0:\n  version \"4.0.1\"\n  resolved \"https://registry.yarnpkg.com/cssnano-util-same-parent/-/cssnano-util-same-parent-4.0.1.tgz#574082fb2859d2db433855835d9a8456ea18bbf3\"\n\ncssnano@^4.1.0:\n  version \"4.1.10\"\n  resolved \"https://registry.yarnpkg.com/cssnano/-/cssnano-4.1.10.tgz#0ac41f0b13d13d465487e111b778d42da631b8b2\"\n  dependencies:\n    cosmiconfig \"^5.0.0\"\n    cssnano-preset-default \"^4.0.7\"\n    is-resolvable \"^1.0.0\"\n    postcss \"^7.0.0\"\n\ncsso@^3.5.1:\n  version \"3.5.1\"\n  resolved \"https://registry.yarnpkg.com/csso/-/csso-3.5.1.tgz#7b9eb8be61628973c1b261e169d2f024008e758b\"\n  dependencies:\n    css-tree \"1.0.0-alpha.29\"\n\ncsstype@^2.2.0:\n  version \"2.6.4\"\n  resolved \"https://registry.yarnpkg.com/csstype/-/csstype-2.6.4.tgz#d585a6062096e324e7187f80e04f92bd0f00e37f\"\n\ncurrently-unhandled@^0.4.1:\n  version \"0.4.1\"\n  resolved \"https://registry.yarnpkg.com/currently-unhandled/-/currently-unhandled-0.4.1.tgz#988df33feab191ef799a61369dd76c17adf957ea\"\n  dependencies:\n    array-find-index \"^1.0.1\"\n\ncyclist@~0.2.2:\n  version \"0.2.2\"\n  resolved \"https://registry.yarnpkg.com/cyclist/-/cyclist-0.2.2.tgz#1b33792e11e914a2fd6d6ed6447464444e5fa640\"\n\nd@1:\n  version \"1.0.0\"\n  resolved \"https://registry.yarnpkg.com/d/-/d-1.0.0.tgz#754bb5bfe55451da69a58b94d45f4c5b0462d58f\"\n  dependencies:\n    es5-ext \"^0.10.9\"\n\ndashdash@^1.12.0:\n  version \"1.14.1\"\n  resolved \"https://registry.yarnpkg.com/dashdash/-/dashdash-1.14.1.tgz#853cfa0f7cbe2fed5de20326b8dd581035f6e2f0\"\n  dependencies:\n    assert-plus \"^1.0.0\"\n\ndate-fns@^1.23.0:\n  version \"1.30.1\"\n  resolved \"https://registry.yarnpkg.com/date-fns/-/date-fns-1.30.1.tgz#2e71bf0b119153dbb4cc4e88d9ea5acfb50dc05c\"\n\ndate-now@^0.1.4:\n  version \"0.1.4\"\n  resolved \"https://registry.yarnpkg.com/date-now/-/date-now-0.1.4.tgz#eaf439fd4d4848ad74e5cc7dbef200672b9e345b\"\n\ndebug@2.6.9, debug@^2.1.2, debug@^2.2.0, debug@^2.3.3:\n  version \"2.6.9\"\n  resolved \"https://registry.yarnpkg.com/debug/-/debug-2.6.9.tgz#5d128515df134ff327e90a4c93f4e077a536341f\"\n  dependencies:\n    ms \"2.0.0\"\n\ndebug@=3.1.0:\n  version \"3.1.0\"\n  resolved \"https://registry.yarnpkg.com/debug/-/debug-3.1.0.tgz#5bb5a0672628b64149566ba16819e61518c67261\"\n  integrity sha512-OX8XqP7/1a9cqkxYw2yXss15f26NKWBpDXQd0/uK/KPqdQhxbPa994hnzjcE2VqQpDslf55723cKPUOGSmMY3g==\n  dependencies:\n    ms \"2.0.0\"\n\ndebug@^3.2.5, debug@^3.2.6:\n  version \"3.2.6\"\n  resolved \"https://registry.yarnpkg.com/debug/-/debug-3.2.6.tgz#e83d17de16d8a7efb7717edbe5fb10135eee629b\"\n  dependencies:\n    ms \"^2.1.1\"\n\ndebug@^4.1.0, debug@^4.1.1:\n  version \"4.1.1\"\n  resolved \"https://registry.yarnpkg.com/debug/-/debug-4.1.1.tgz#3b72260255109c6b589cee050f1d516139664791\"\n  dependencies:\n    ms \"^2.1.1\"\n\ndebug@~2.2.0:\n  version \"2.2.0\"\n  resolved \"https://registry.yarnpkg.com/debug/-/debug-2.2.0.tgz#f87057e995b1a1f6ae6a4960664137bc56f039da\"\n  dependencies:\n    ms \"0.7.1\"\n\ndecamelize@^1.1.1, decamelize@^1.1.2, decamelize@^1.2.0:\n  version \"1.2.0\"\n  resolved \"https://registry.yarnpkg.com/decamelize/-/decamelize-1.2.0.tgz#f6534d15148269b20352e7bee26f501f9a191290\"\n\ndecamelize@^2.0.0:\n  version \"2.0.0\"\n  resolved \"https://registry.yarnpkg.com/decamelize/-/decamelize-2.0.0.tgz#656d7bbc8094c4c788ea53c5840908c9c7d063c7\"\n  dependencies:\n    xregexp \"4.0.0\"\n\ndecode-uri-component@^0.2.0:\n  version \"0.2.0\"\n  resolved \"https://registry.yarnpkg.com/decode-uri-component/-/decode-uri-component-0.2.0.tgz#eb3913333458775cb84cd1a1fae062106bb87545\"\n\ndeep-equal@^1.0.1:\n  version \"1.0.1\"\n  resolved \"https://registry.yarnpkg.com/deep-equal/-/deep-equal-1.0.1.tgz#f5d260292b660e084eff4cdbc9f08ad3247448b5\"\n\ndeep-extend@^0.6.0:\n  version \"0.6.0\"\n  resolved \"https://registry.yarnpkg.com/deep-extend/-/deep-extend-0.6.0.tgz#c4fa7c95404a17a9c3e8ca7e1537312b736330ac\"\n\ndefault-gateway@^4.0.1:\n  version \"4.1.2\"\n  resolved \"https://registry.yarnpkg.com/default-gateway/-/default-gateway-4.1.2.tgz#b49196b51b26609e5d1af636287517a11a9aaf42\"\n  dependencies:\n    execa \"^1.0.0\"\n    ip-regex \"^2.1.0\"\n\ndefine-properties@^1.1.2, define-properties@^1.1.3:\n  version \"1.1.3\"\n  resolved \"https://registry.yarnpkg.com/define-properties/-/define-properties-1.1.3.tgz#cf88da6cbee26fe6db7094f61d870cbd84cee9f1\"\n  dependencies:\n    object-keys \"^1.0.12\"\n\ndefine-property@^0.2.5:\n  version \"0.2.5\"\n  resolved \"https://registry.yarnpkg.com/define-property/-/define-property-0.2.5.tgz#c35b1ef918ec3c990f9a5bc57be04aacec5c8116\"\n  dependencies:\n    is-descriptor \"^0.1.0\"\n\ndefine-property@^1.0.0:\n  version \"1.0.0\"\n  resolved \"https://registry.yarnpkg.com/define-property/-/define-property-1.0.0.tgz#769ebaaf3f4a63aad3af9e8d304c9bbe79bfb0e6\"\n  dependencies:\n    is-descriptor \"^1.0.0\"\n\ndefine-property@^2.0.2:\n  version \"2.0.2\"\n  resolved \"https://registry.yarnpkg.com/define-property/-/define-property-2.0.2.tgz#d459689e8d654ba77e02a817f8710d702cb16e9d\"\n  dependencies:\n    is-descriptor \"^1.0.2\"\n    isobject \"^3.0.1\"\n\ndel@^3.0.0:\n  version \"3.0.0\"\n  resolved \"https://registry.yarnpkg.com/del/-/del-3.0.0.tgz#53ecf699ffcbcb39637691ab13baf160819766e5\"\n  dependencies:\n    globby \"^6.1.0\"\n    is-path-cwd \"^1.0.0\"\n    is-path-in-cwd \"^1.0.0\"\n    p-map \"^1.1.1\"\n    pify \"^3.0.0\"\n    rimraf \"^2.2.8\"\n\ndelayed-stream@~1.0.0:\n  version \"1.0.0\"\n  resolved \"https://registry.yarnpkg.com/delayed-stream/-/delayed-stream-1.0.0.tgz#df3ae199acadfb7d440aaae0b29e2272b24ec619\"\n\ndelegates@^1.0.0:\n  version \"1.0.0\"\n  resolved \"https://registry.yarnpkg.com/delegates/-/delegates-1.0.0.tgz#84c6e159b81904fdca59a0ef44cd870d31250f9a\"\n\ndepd@~1.1.2:\n  version \"1.1.2\"\n  resolved \"https://registry.yarnpkg.com/depd/-/depd-1.1.2.tgz#9bcd52e14c097763e749b274c4346ed2e560b5a9\"\n\ndes.js@^1.0.0:\n  version \"1.0.0\"\n  resolved \"https://registry.yarnpkg.com/des.js/-/des.js-1.0.0.tgz#c074d2e2aa6a8a9a07dbd61f9a15c2cd83ec8ecc\"\n  dependencies:\n    inherits \"^2.0.1\"\n    minimalistic-assert \"^1.0.0\"\n\ndestroy@~1.0.4:\n  version \"1.0.4\"\n  resolved \"https://registry.yarnpkg.com/destroy/-/destroy-1.0.4.tgz#978857442c44749e4206613e37946205826abd80\"\n\ndetect-file@^1.0.0:\n  version \"1.0.0\"\n  resolved \"https://registry.yarnpkg.com/detect-file/-/detect-file-1.0.0.tgz#f0d66d03672a825cb1b73bdb3fe62310c8e552b7\"\n\ndetect-libc@^1.0.2:\n  version \"1.0.3\"\n  resolved \"https://registry.yarnpkg.com/detect-libc/-/detect-libc-1.0.3.tgz#fa137c4bd698edf55cd5cd02ac559f91a4c4ba9b\"\n\ndetect-node@^2.0.4:\n  version \"2.0.4\"\n  resolved \"https://registry.yarnpkg.com/detect-node/-/detect-node-2.0.4.tgz#014ee8f8f669c5c58023da64b8179c083a28c46c\"\n\ndiff@^3.2.0:\n  version \"3.5.0\"\n  resolved \"https://registry.yarnpkg.com/diff/-/diff-3.5.0.tgz#800c0dd1e0a8bfbc95835c202ad220fe317e5a12\"\n\ndiffie-hellman@^5.0.0:\n  version \"5.0.3\"\n  resolved \"https://registry.yarnpkg.com/diffie-hellman/-/diffie-hellman-5.0.3.tgz#40e8ee98f55a2149607146921c63e1ae5f3d2875\"\n  dependencies:\n    bn.js \"^4.1.0\"\n    miller-rabin \"^4.0.0\"\n    randombytes \"^2.0.0\"\n\ndir-glob@2.0.0:\n  version \"2.0.0\"\n  resolved \"https://registry.yarnpkg.com/dir-glob/-/dir-glob-2.0.0.tgz#0b205d2b6aef98238ca286598a8204d29d0a0034\"\n  dependencies:\n    arrify \"^1.0.1\"\n    path-type \"^3.0.0\"\n\ndnd-core@^7.0.2:\n  version \"7.0.2\"\n  resolved \"https://registry.yarnpkg.com/dnd-core/-/dnd-core-7.0.2.tgz#6c080eb57243fa0372fd083b3db242d9eb525010\"\n  dependencies:\n    asap \"^2.0.6\"\n    invariant \"^2.2.4\"\n    lodash \"^4.17.11\"\n    redux \"^4.0.1\"\n\ndnd-core@^7.4.4:\n  version \"7.4.4\"\n  resolved \"https://registry.yarnpkg.com/dnd-core/-/dnd-core-7.4.4.tgz#9a27d991a1c1e2882fa7888ea6132db04c739db1\"\n  dependencies:\n    asap \"^2.0.6\"\n    invariant \"^2.2.4\"\n    redux \"^4.0.1\"\n\ndns-equal@^1.0.0:\n  version \"1.0.0\"\n  resolved \"https://registry.yarnpkg.com/dns-equal/-/dns-equal-1.0.0.tgz#b39e7f1da6eb0a75ba9c17324b34753c47e0654d\"\n\ndns-packet@^1.3.1:\n  version \"1.3.1\"\n  resolved \"https://registry.yarnpkg.com/dns-packet/-/dns-packet-1.3.1.tgz#12aa426981075be500b910eedcd0b47dd7deda5a\"\n  dependencies:\n    ip \"^1.1.0\"\n    safe-buffer \"^5.0.1\"\n\ndns-txt@^2.0.2:\n  version \"2.0.2\"\n  resolved \"https://registry.yarnpkg.com/dns-txt/-/dns-txt-2.0.2.tgz#b91d806f5d27188e4ab3e7d107d881a1cc4642b6\"\n  dependencies:\n    buffer-indexof \"^1.0.0\"\n\ndom-converter@^0.2:\n  version \"0.2.0\"\n  resolved \"https://registry.yarnpkg.com/dom-converter/-/dom-converter-0.2.0.tgz#6721a9daee2e293682955b6afe416771627bb768\"\n  dependencies:\n    utila \"~0.4\"\n\n\"dom-helpers@^2.4.0 || ^3.0.0\":\n  version \"3.4.0\"\n  resolved \"https://registry.yarnpkg.com/dom-helpers/-/dom-helpers-3.4.0.tgz#e9b369700f959f62ecde5a6babde4bccd9169af8\"\n  dependencies:\n    \"@babel/runtime\" \"^7.1.2\"\n\ndom-serializer@0, dom-serializer@~0.1.0:\n  version \"0.1.1\"\n  resolved \"https://registry.yarnpkg.com/dom-serializer/-/dom-serializer-0.1.1.tgz#1ec4059e284babed36eec2941d4a970a189ce7c0\"\n  dependencies:\n    domelementtype \"^1.3.0\"\n    entities \"^1.1.1\"\n\ndom-walk@^0.1.0:\n  version \"0.1.1\"\n  resolved \"https://registry.yarnpkg.com/dom-walk/-/dom-walk-0.1.1.tgz#672226dc74c8f799ad35307df936aba11acd6018\"\n\ndomain-browser@^1.1.1:\n  version \"1.2.0\"\n  resolved \"https://registry.yarnpkg.com/domain-browser/-/domain-browser-1.2.0.tgz#3d31f50191a6749dd1375a7f522e823d42e54eda\"\n\ndomelementtype@1, domelementtype@^1.3.0, domelementtype@^1.3.1:\n  version \"1.3.1\"\n  resolved \"https://registry.yarnpkg.com/domelementtype/-/domelementtype-1.3.1.tgz#d048c44b37b0d10a7f2a3d5fee3f4333d790481f\"\n\ndomhandler@2.3:\n  version \"2.3.0\"\n  resolved \"https://registry.yarnpkg.com/domhandler/-/domhandler-2.3.0.tgz#2de59a0822d5027fabff6f032c2b25a2a8abe738\"\n  dependencies:\n    domelementtype \"1\"\n\ndomhandler@^2.3.0:\n  version \"2.4.2\"\n  resolved \"https://registry.yarnpkg.com/domhandler/-/domhandler-2.4.2.tgz#8805097e933d65e85546f726d60f5eb88b44f803\"\n  dependencies:\n    domelementtype \"1\"\n\ndomutils@1.4:\n  version \"1.4.3\"\n  resolved \"https://registry.yarnpkg.com/domutils/-/domutils-1.4.3.tgz#0865513796c6b306031850e175516baf80b72a6f\"\n  dependencies:\n    domelementtype \"1\"\n\ndomutils@1.5, domutils@1.5.1:\n  version \"1.5.1\"\n  resolved \"https://registry.yarnpkg.com/domutils/-/domutils-1.5.1.tgz#dcd8488a26f563d61079e48c9f7b7e32373682cf\"\n  dependencies:\n    dom-serializer \"0\"\n    domelementtype \"1\"\n\ndomutils@^1.5.1, domutils@^1.7.0:\n  version \"1.7.0\"\n  resolved \"https://registry.yarnpkg.com/domutils/-/domutils-1.7.0.tgz#56ea341e834e06e6748af7a1cb25da67ea9f8c2a\"\n  dependencies:\n    dom-serializer \"0\"\n    domelementtype \"1\"\n\ndot-prop@^4.1.1:\n  version \"4.2.0\"\n  resolved \"https://registry.yarnpkg.com/dot-prop/-/dot-prop-4.2.0.tgz#1f19e0c2e1aa0e32797c49799f2837ac6af69c57\"\n  dependencies:\n    is-obj \"^1.0.0\"\n\ndotenv-defaults@^1.0.2:\n  version \"1.0.2\"\n  resolved \"https://registry.yarnpkg.com/dotenv-defaults/-/dotenv-defaults-1.0.2.tgz#441cf5f067653fca4bbdce9dd3b803f6f84c585d\"\n  dependencies:\n    dotenv \"^6.2.0\"\n\ndotenv-webpack@^1.5.7:\n  version \"1.7.0\"\n  resolved \"https://registry.yarnpkg.com/dotenv-webpack/-/dotenv-webpack-1.7.0.tgz#4384d8c57ee6f405c296278c14a9f9167856d3a1\"\n  dependencies:\n    dotenv-defaults \"^1.0.2\"\n\ndotenv@^6.2.0:\n  version \"6.2.0\"\n  resolved \"https://registry.yarnpkg.com/dotenv/-/dotenv-6.2.0.tgz#941c0410535d942c8becf28d3f357dbd9d476064\"\n\nduplexify@^3.4.2, duplexify@^3.6.0:\n  version \"3.7.1\"\n  resolved \"https://registry.yarnpkg.com/duplexify/-/duplexify-3.7.1.tgz#2a4df5317f6ccfd91f86d6fd25d8d8a103b88309\"\n  dependencies:\n    end-of-stream \"^1.0.0\"\n    inherits \"^2.0.1\"\n    readable-stream \"^2.0.0\"\n    stream-shift \"^1.0.0\"\n\necc-jsbn@~0.1.1:\n  version \"0.1.2\"\n  resolved \"https://registry.yarnpkg.com/ecc-jsbn/-/ecc-jsbn-0.1.2.tgz#3a83a904e54353287874c564b7549386849a98c9\"\n  dependencies:\n    jsbn \"~0.1.0\"\n    safer-buffer \"^2.1.0\"\n\nee-first@1.1.1:\n  version \"1.1.1\"\n  resolved \"https://registry.yarnpkg.com/ee-first/-/ee-first-1.1.1.tgz#590c61156b0ae2f4f0255732a158b266bc56b21d\"\n\nelectron-to-chromium@^1.3.113:\n  version \"1.3.113\"\n  resolved \"https://registry.yarnpkg.com/electron-to-chromium/-/electron-to-chromium-1.3.113.tgz#b1ccf619df7295aea17bc6951dc689632629e4a9\"\n\nelectron-to-chromium@^1.3.133:\n  version \"1.3.137\"\n  resolved \"https://registry.yarnpkg.com/electron-to-chromium/-/electron-to-chromium-1.3.137.tgz#ba7c88024984c038a5c5c434529aabcea7b42944\"\n\nelliptic@^6.0.0:\n  version \"6.4.1\"\n  resolved \"https://registry.yarnpkg.com/elliptic/-/elliptic-6.4.1.tgz#c2d0b7776911b86722c632c3c06c60f2f819939a\"\n  dependencies:\n    bn.js \"^4.4.0\"\n    brorand \"^1.0.1\"\n    hash.js \"^1.0.0\"\n    hmac-drbg \"^1.0.0\"\n    inherits \"^2.0.1\"\n    minimalistic-assert \"^1.0.0\"\n    minimalistic-crypto-utils \"^1.0.0\"\n\nemoji-regex@^7.0.1:\n  version \"7.0.3\"\n  resolved \"https://registry.yarnpkg.com/emoji-regex/-/emoji-regex-7.0.3.tgz#933a04052860c85e83c122479c4748a8e4c72156\"\n  integrity sha512-CwBLREIQ7LvYFB0WyRvwhq5N5qPhc6PMjD6bYggFlI5YyDgl+0vxq5VHbMOFqLg7hfWzmu8T5Z1QofhmTIhItA==\n\nemojis-list@^2.0.0:\n  version \"2.1.0\"\n  resolved \"https://registry.yarnpkg.com/emojis-list/-/emojis-list-2.1.0.tgz#4daa4d9db00f9819880c79fa457ae5b09a1fd389\"\n\nencodeurl@~1.0.2:\n  version \"1.0.2\"\n  resolved \"https://registry.yarnpkg.com/encodeurl/-/encodeurl-1.0.2.tgz#ad3ff4c86ec2d029322f5a02c3a9a606c95b3f59\"\n\nend-of-stream@^1.0.0, end-of-stream@^1.1.0:\n  version \"1.4.1\"\n  resolved \"https://registry.yarnpkg.com/end-of-stream/-/end-of-stream-1.4.1.tgz#ed29634d19baba463b6ce6b80a37213eab71ec43\"\n  dependencies:\n    once \"^1.4.0\"\n\nenhanced-resolve@^4.0.0, enhanced-resolve@^4.1.0:\n  version \"4.1.0\"\n  resolved \"https://registry.yarnpkg.com/enhanced-resolve/-/enhanced-resolve-4.1.0.tgz#41c7e0bfdfe74ac1ffe1e57ad6a5c6c9f3742a7f\"\n  dependencies:\n    graceful-fs \"^4.1.2\"\n    memory-fs \"^0.4.0\"\n    tapable \"^1.0.0\"\n\nentities@1.0:\n  version \"1.0.0\"\n  resolved \"https://registry.yarnpkg.com/entities/-/entities-1.0.0.tgz#b2987aa3821347fcde642b24fdfc9e4fb712bf26\"\n\nentities@^1.1.1, entities@~1.1.1:\n  version \"1.1.2\"\n  resolved \"https://registry.yarnpkg.com/entities/-/entities-1.1.2.tgz#bdfa735299664dfafd34529ed4f8522a275fea56\"\n\nerrno@^0.1.3, errno@~0.1.7:\n  version \"0.1.7\"\n  resolved \"https://registry.yarnpkg.com/errno/-/errno-0.1.7.tgz#4684d71779ad39af177e3f007996f7c67c852618\"\n  dependencies:\n    prr \"~1.0.1\"\n\nerror-ex@^1.2.0, error-ex@^1.3.1:\n  version \"1.3.2\"\n  resolved \"https://registry.yarnpkg.com/error-ex/-/error-ex-1.3.2.tgz#b4ac40648107fdcdcfae242f428bea8a14d4f1bf\"\n  dependencies:\n    is-arrayish \"^0.2.1\"\n\nerror-stack-parser@^2.0.0:\n  version \"2.0.2\"\n  resolved \"https://registry.yarnpkg.com/error-stack-parser/-/error-stack-parser-2.0.2.tgz#4ae8dbaa2bf90a8b450707b9149dcabca135520d\"\n  dependencies:\n    stackframe \"^1.0.4\"\n\nes-abstract@^1.12.0, es-abstract@^1.5.0, es-abstract@^1.5.1:\n  version \"1.13.0\"\n  resolved \"https://registry.yarnpkg.com/es-abstract/-/es-abstract-1.13.0.tgz#ac86145fdd5099d8dd49558ccba2eaf9b88e24e9\"\n  dependencies:\n    es-to-primitive \"^1.2.0\"\n    function-bind \"^1.1.1\"\n    has \"^1.0.3\"\n    is-callable \"^1.1.4\"\n    is-regex \"^1.0.4\"\n    object-keys \"^1.0.12\"\n\nes-to-primitive@^1.2.0:\n  version \"1.2.0\"\n  resolved \"https://registry.yarnpkg.com/es-to-primitive/-/es-to-primitive-1.2.0.tgz#edf72478033456e8dda8ef09e00ad9650707f377\"\n  dependencies:\n    is-callable \"^1.1.4\"\n    is-date-object \"^1.0.1\"\n    is-symbol \"^1.0.2\"\n\nes5-ext@^0.10.35, es5-ext@^0.10.9, es5-ext@~0.10.14:\n  version \"0.10.50\"\n  resolved \"https://registry.yarnpkg.com/es5-ext/-/es5-ext-0.10.50.tgz#6d0e23a0abdb27018e5ac4fd09b412bc5517a778\"\n  dependencies:\n    es6-iterator \"~2.0.3\"\n    es6-symbol \"~3.1.1\"\n    next-tick \"^1.0.0\"\n\nes6-iterator@2.0.3, es6-iterator@~2.0.3:\n  version \"2.0.3\"\n  resolved \"https://registry.yarnpkg.com/es6-iterator/-/es6-iterator-2.0.3.tgz#a7de889141a05a94b0854403b2d0a0fbfa98f3b7\"\n  dependencies:\n    d \"1\"\n    es5-ext \"^0.10.35\"\n    es6-symbol \"^3.1.1\"\n\nes6-promise@^3.0.2:\n  version \"3.3.1\"\n  resolved \"https://registry.yarnpkg.com/es6-promise/-/es6-promise-3.3.1.tgz#a08cdde84ccdbf34d027a1451bc91d4bcd28a613\"\n\nes6-promise@^4.0.3:\n  version \"4.2.6\"\n  resolved \"https://registry.yarnpkg.com/es6-promise/-/es6-promise-4.2.6.tgz#b685edd8258886365ea62b57d30de28fadcd974f\"\n\nes6-symbol@^3.1.1, es6-symbol@~3.1.1:\n  version \"3.1.1\"\n  resolved \"https://registry.yarnpkg.com/es6-symbol/-/es6-symbol-3.1.1.tgz#bf00ef4fdab6ba1b46ecb7b629b4c7ed5715cc77\"\n  dependencies:\n    d \"1\"\n    es5-ext \"~0.10.14\"\n\nes6-templates@^0.2.3:\n  version \"0.2.3\"\n  resolved \"https://registry.yarnpkg.com/es6-templates/-/es6-templates-0.2.3.tgz#5cb9ac9fb1ded6eb1239342b81d792bbb4078ee4\"\n  dependencies:\n    recast \"~0.11.12\"\n    through \"~2.3.6\"\n\nescape-html@~1.0.3:\n  version \"1.0.3\"\n  resolved \"https://registry.yarnpkg.com/escape-html/-/escape-html-1.0.3.tgz#0258eae4d3d0c0974de1c169188ef0051d1d1988\"\n\nescape-string-regexp@^1.0.2, escape-string-regexp@^1.0.3, escape-string-regexp@^1.0.5:\n  version \"1.0.5\"\n  resolved \"https://registry.yarnpkg.com/escape-string-regexp/-/escape-string-regexp-1.0.5.tgz#1b61c0562190a8dff6ae3bb2cf0200ca130b86d4\"\n\neslint-plugin-prettier@^2.2.0:\n  version \"2.7.0\"\n  resolved \"https://registry.yarnpkg.com/eslint-plugin-prettier/-/eslint-plugin-prettier-2.7.0.tgz#b4312dcf2c1d965379d7f9d5b5f8aaadc6a45904\"\n  dependencies:\n    fast-diff \"^1.1.1\"\n    jest-docblock \"^21.0.0\"\n\neslint-scope@^4.0.0:\n  version \"4.0.0\"\n  resolved \"https://registry.yarnpkg.com/eslint-scope/-/eslint-scope-4.0.0.tgz#50bf3071e9338bcdc43331794a0cb533f0136172\"\n  dependencies:\n    esrecurse \"^4.1.0\"\n    estraverse \"^4.1.1\"\n\nesprima@^4.0.0:\n  version \"4.0.1\"\n  resolved \"https://registry.yarnpkg.com/esprima/-/esprima-4.0.1.tgz#13b04cdb3e6c5d19df91ab6987a8695619b0aa71\"\n\nesprima@~3.1.0:\n  version \"3.1.3\"\n  resolved \"https://registry.yarnpkg.com/esprima/-/esprima-3.1.3.tgz#fdca51cee6133895e3c88d535ce49dbff62a4633\"\n\nesrecurse@^4.1.0:\n  version \"4.2.1\"\n  resolved \"https://registry.yarnpkg.com/esrecurse/-/esrecurse-4.2.1.tgz#007a3b9fdbc2b3bb87e4879ea19c92fdbd3942cf\"\n  dependencies:\n    estraverse \"^4.1.0\"\n\nestraverse@^4.1.0, estraverse@^4.1.1:\n  version \"4.2.0\"\n  resolved \"https://registry.yarnpkg.com/estraverse/-/estraverse-4.2.0.tgz#0dee3fed31fcd469618ce7342099fc1afa0bdb13\"\n\nesutils@^2.0.0, esutils@^2.0.2:\n  version \"2.0.2\"\n  resolved \"https://registry.yarnpkg.com/esutils/-/esutils-2.0.2.tgz#0abf4f1caa5bcb1f7a9d8acc6dea4faaa04bac9b\"\n\netag@~1.8.1:\n  version \"1.8.1\"\n  resolved \"https://registry.yarnpkg.com/etag/-/etag-1.8.1.tgz#41ae2eeb65efa62268aebfea83ac7d79299b0887\"\n\neventemitter3@^3.0.0:\n  version \"3.1.0\"\n  resolved \"https://registry.yarnpkg.com/eventemitter3/-/eventemitter3-3.1.0.tgz#090b4d6cdbd645ed10bf750d4b5407942d7ba163\"\n\nevents@^3.0.0:\n  version \"3.0.0\"\n  resolved \"https://registry.yarnpkg.com/events/-/events-3.0.0.tgz#9a0a0dfaf62893d92b875b8f2698ca4114973e88\"\n\neventsource@^1.0.7:\n  version \"1.0.7\"\n  resolved \"https://registry.yarnpkg.com/eventsource/-/eventsource-1.0.7.tgz#8fbc72c93fcd34088090bc0a4e64f4b5cee6d8d0\"\n  dependencies:\n    original \"^1.0.0\"\n\nevp_bytestokey@^1.0.0, evp_bytestokey@^1.0.3:\n  version \"1.0.3\"\n  resolved \"https://registry.yarnpkg.com/evp_bytestokey/-/evp_bytestokey-1.0.3.tgz#7fcbdb198dc71959432efe13842684e0525acb02\"\n  dependencies:\n    md5.js \"^1.3.4\"\n    safe-buffer \"^5.1.1\"\n\nexeca@^0.7.0:\n  version \"0.7.0\"\n  resolved \"https://registry.yarnpkg.com/execa/-/execa-0.7.0.tgz#944becd34cc41ee32a63a9faf27ad5a65fc59777\"\n  dependencies:\n    cross-spawn \"^5.0.1\"\n    get-stream \"^3.0.0\"\n    is-stream \"^1.1.0\"\n    npm-run-path \"^2.0.0\"\n    p-finally \"^1.0.0\"\n    signal-exit \"^3.0.0\"\n    strip-eof \"^1.0.0\"\n\nexeca@^1.0.0:\n  version \"1.0.0\"\n  resolved \"https://registry.yarnpkg.com/execa/-/execa-1.0.0.tgz#c6236a5bb4df6d6f15e88e7f017798216749ddd8\"\n  dependencies:\n    cross-spawn \"^6.0.0\"\n    get-stream \"^4.0.0\"\n    is-stream \"^1.1.0\"\n    npm-run-path \"^2.0.0\"\n    p-finally \"^1.0.0\"\n    signal-exit \"^3.0.0\"\n    strip-eof \"^1.0.0\"\n\nexif-parser@^0.1.9:\n  version \"0.1.12\"\n  resolved \"https://registry.yarnpkg.com/exif-parser/-/exif-parser-0.1.12.tgz#58a9d2d72c02c1f6f02a0ef4a9166272b7760922\"\n\nexpand-brackets@^2.1.4:\n  version \"2.1.4\"\n  resolved \"https://registry.yarnpkg.com/expand-brackets/-/expand-brackets-2.1.4.tgz#b77735e315ce30f6b6eff0f83b04151a22449622\"\n  dependencies:\n    debug \"^2.3.3\"\n    define-property \"^0.2.5\"\n    extend-shallow \"^2.0.1\"\n    posix-character-classes \"^0.1.0\"\n    regex-not \"^1.0.0\"\n    snapdragon \"^0.8.1\"\n    to-regex \"^3.0.1\"\n\nexpand-tilde@^2.0.0, expand-tilde@^2.0.2:\n  version \"2.0.2\"\n  resolved \"https://registry.yarnpkg.com/expand-tilde/-/expand-tilde-2.0.2.tgz#97e801aa052df02454de46b02bf621642cdc8502\"\n  dependencies:\n    homedir-polyfill \"^1.0.1\"\n\nexpress@^4.16.2:\n  version \"4.16.4\"\n  resolved \"https://registry.yarnpkg.com/express/-/express-4.16.4.tgz#fddef61926109e24c515ea97fd2f1bdbf62df12e\"\n  dependencies:\n    accepts \"~1.3.5\"\n    array-flatten \"1.1.1\"\n    body-parser \"1.18.3\"\n    content-disposition \"0.5.2\"\n    content-type \"~1.0.4\"\n    cookie \"0.3.1\"\n    cookie-signature \"1.0.6\"\n    debug \"2.6.9\"\n    depd \"~1.1.2\"\n    encodeurl \"~1.0.2\"\n    escape-html \"~1.0.3\"\n    etag \"~1.8.1\"\n    finalhandler \"1.1.1\"\n    fresh \"0.5.2\"\n    merge-descriptors \"1.0.1\"\n    methods \"~1.1.2\"\n    on-finished \"~2.3.0\"\n    parseurl \"~1.3.2\"\n    path-to-regexp \"0.1.7\"\n    proxy-addr \"~2.0.4\"\n    qs \"6.5.2\"\n    range-parser \"~1.2.0\"\n    safe-buffer \"5.1.2\"\n    send \"0.16.2\"\n    serve-static \"1.13.2\"\n    setprototypeof \"1.1.0\"\n    statuses \"~1.4.0\"\n    type-is \"~1.6.16\"\n    utils-merge \"1.0.1\"\n    vary \"~1.1.2\"\n\nextend-shallow@^2.0.1:\n  version \"2.0.1\"\n  resolved \"https://registry.yarnpkg.com/extend-shallow/-/extend-shallow-2.0.1.tgz#51af7d614ad9a9f610ea1bafbb989d6b1c56890f\"\n  dependencies:\n    is-extendable \"^0.1.0\"\n\nextend-shallow@^3.0.0, extend-shallow@^3.0.2:\n  version \"3.0.2\"\n  resolved \"https://registry.yarnpkg.com/extend-shallow/-/extend-shallow-3.0.2.tgz#26a71aaf073b39fb2127172746131c2704028db8\"\n  dependencies:\n    assign-symbols \"^1.0.0\"\n    is-extendable \"^1.0.1\"\n\nextend@~3.0.2:\n  version \"3.0.2\"\n  resolved \"https://registry.yarnpkg.com/extend/-/extend-3.0.2.tgz#f8b1136b4071fbd8eb140aff858b1019ec2915fa\"\n\nextglob@^2.0.4:\n  version \"2.0.4\"\n  resolved \"https://registry.yarnpkg.com/extglob/-/extglob-2.0.4.tgz#ad00fe4dc612a9232e8718711dc5cb5ab0285543\"\n  dependencies:\n    array-unique \"^0.3.2\"\n    define-property \"^1.0.0\"\n    expand-brackets \"^2.1.4\"\n    extend-shallow \"^2.0.1\"\n    fragment-cache \"^0.2.1\"\n    regex-not \"^1.0.0\"\n    snapdragon \"^0.8.1\"\n    to-regex \"^3.0.1\"\n\nextract-zip@^1.6.5:\n  version \"1.6.7\"\n  resolved \"https://registry.yarnpkg.com/extract-zip/-/extract-zip-1.6.7.tgz#a840b4b8af6403264c8db57f4f1a74333ef81fe9\"\n  dependencies:\n    concat-stream \"1.6.2\"\n    debug \"2.6.9\"\n    mkdirp \"0.5.1\"\n    yauzl \"2.4.1\"\n\nextsprintf@1.3.0:\n  version \"1.3.0\"\n  resolved \"https://registry.yarnpkg.com/extsprintf/-/extsprintf-1.3.0.tgz#96918440e3041a7a414f8c52e3c574eb3c3e1e05\"\n\nextsprintf@^1.2.0:\n  version \"1.4.0\"\n  resolved \"https://registry.yarnpkg.com/extsprintf/-/extsprintf-1.4.0.tgz#e2689f8f356fad62cca65a3a91c5df5f9551692f\"\n\nfast-deep-equal@^2.0.1:\n  version \"2.0.1\"\n  resolved \"https://registry.yarnpkg.com/fast-deep-equal/-/fast-deep-equal-2.0.1.tgz#7b05218ddf9667bf7f370bf7fdb2cb15fdd0aa49\"\n\nfast-diff@^1.1.1:\n  version \"1.2.0\"\n  resolved \"https://registry.yarnpkg.com/fast-diff/-/fast-diff-1.2.0.tgz#73ee11982d86caaf7959828d519cfe927fac5f03\"\n\nfast-glob@^2.0.2:\n  version \"2.2.7\"\n  resolved \"https://registry.yarnpkg.com/fast-glob/-/fast-glob-2.2.7.tgz#6953857c3afa475fff92ee6015d52da70a4cd39d\"\n  dependencies:\n    \"@mrmlnc/readdir-enhanced\" \"^2.2.1\"\n    \"@nodelib/fs.stat\" \"^1.1.2\"\n    glob-parent \"^3.1.0\"\n    is-glob \"^4.0.0\"\n    merge2 \"^1.2.3\"\n    micromatch \"^3.1.10\"\n\nfast-json-stable-stringify@^2.0.0:\n  version \"2.0.0\"\n  resolved \"https://registry.yarnpkg.com/fast-json-stable-stringify/-/fast-json-stable-stringify-2.0.0.tgz#d5142c0caee6b1189f87d3a76111064f86c8bbf2\"\n\nfast-levenshtein@^2.0.6:\n  version \"2.0.6\"\n  resolved \"https://registry.yarnpkg.com/fast-levenshtein/-/fast-levenshtein-2.0.6.tgz#3d8a5c66883a16a30ca8643e851f19baa7797917\"\n\nfastparse@^1.1.1:\n  version \"1.1.2\"\n  resolved \"https://registry.yarnpkg.com/fastparse/-/fastparse-1.1.2.tgz#91728c5a5942eced8531283c79441ee4122c35a9\"\n\nfavicons-webpack-plugin@^0.0.9:\n  version \"0.0.9\"\n  resolved \"https://registry.yarnpkg.com/favicons-webpack-plugin/-/favicons-webpack-plugin-0.0.9.tgz#df63e80c556b804e4925ec8e05bee36391573dc9\"\n  dependencies:\n    favicons \"^4.8.3\"\n    loader-utils \"^0.2.14\"\n    lodash \"^4.11.1\"\n\nfavicons@^4.8.3:\n  version \"4.8.6\"\n  resolved \"https://registry.yarnpkg.com/favicons/-/favicons-4.8.6.tgz#a2b13800ab3fec2715bc8f27fa841d038d4761e2\"\n  dependencies:\n    async \"^1.5.0\"\n    cheerio \"^0.19.0\"\n    clone \"^1.0.2\"\n    colors \"^1.1.2\"\n    harmony-reflect \"^1.4.2\"\n    image-size \"^0.4.0\"\n    jimp \"^0.2.13\"\n    jsontoxml \"0.0.11\"\n    merge-defaults \"^0.2.1\"\n    mkdirp \"^0.5.1\"\n    node-rest-client \"^1.5.1\"\n    require-directory \"^2.1.1\"\n    svg2png \"~3.0.1\"\n    through2 \"^2.0.0\"\n    tinycolor2 \"^1.1.2\"\n    to-ico \"^1.1.2\"\n    underscore \"^1.8.3\"\n    vinyl \"^1.1.0\"\n\nfaye-websocket@^0.10.0:\n  version \"0.10.0\"\n  resolved \"https://registry.yarnpkg.com/faye-websocket/-/faye-websocket-0.10.0.tgz#4e492f8d04dfb6f89003507f6edbf2d501e7c6f4\"\n  dependencies:\n    websocket-driver \">=0.5.1\"\n\nfaye-websocket@~0.11.1:\n  version \"0.11.1\"\n  resolved \"https://registry.yarnpkg.com/faye-websocket/-/faye-websocket-0.11.1.tgz#f0efe18c4f56e4f40afc7e06c719fd5ee6188f38\"\n  dependencies:\n    websocket-driver \">=0.5.1\"\n\nfd-slicer@~1.0.1:\n  version \"1.0.1\"\n  resolved \"https://registry.yarnpkg.com/fd-slicer/-/fd-slicer-1.0.1.tgz#8b5bcbd9ec327c5041bf9ab023fd6750f1177e65\"\n  dependencies:\n    pend \"~1.2.0\"\n\nfiggy-pudding@^3.5.1:\n  version \"3.5.1\"\n  resolved \"https://registry.yarnpkg.com/figgy-pudding/-/figgy-pudding-3.5.1.tgz#862470112901c727a0e495a80744bd5baa1d6790\"\n\nfile-loader@^1.1.10:\n  version \"1.1.11\"\n  resolved \"https://registry.yarnpkg.com/file-loader/-/file-loader-1.1.11.tgz#6fe886449b0f2a936e43cabaac0cdbfb369506f8\"\n  dependencies:\n    loader-utils \"^1.0.2\"\n    schema-utils \"^0.4.5\"\n\nfile-type@^3.1.0, file-type@^3.8.0:\n  version \"3.9.0\"\n  resolved \"https://registry.yarnpkg.com/file-type/-/file-type-3.9.0.tgz#257a078384d1db8087bc449d107d52a52672b9e9\"\n\nfill-range@^4.0.0:\n  version \"4.0.0\"\n  resolved \"https://registry.yarnpkg.com/fill-range/-/fill-range-4.0.0.tgz#d544811d428f98eb06a63dc402d2403c328c38f7\"\n  dependencies:\n    extend-shallow \"^2.0.1\"\n    is-number \"^3.0.0\"\n    repeat-string \"^1.6.1\"\n    to-regex-range \"^2.1.0\"\n\nfill-range@^7.0.1:\n  version \"7.0.1\"\n  resolved \"https://registry.yarnpkg.com/fill-range/-/fill-range-7.0.1.tgz#1919a6a7c75fe38b2c7c77e5198535da9acdda40\"\n  dependencies:\n    to-regex-range \"^5.0.1\"\n\nfinalhandler@1.1.1:\n  version \"1.1.1\"\n  resolved \"https://registry.yarnpkg.com/finalhandler/-/finalhandler-1.1.1.tgz#eebf4ed840079c83f4249038c9d703008301b105\"\n  dependencies:\n    debug \"2.6.9\"\n    encodeurl \"~1.0.2\"\n    escape-html \"~1.0.3\"\n    on-finished \"~2.3.0\"\n    parseurl \"~1.3.2\"\n    statuses \"~1.4.0\"\n    unpipe \"~1.0.0\"\n\nfind-cache-dir@^2.0.0:\n  version \"2.0.0\"\n  resolved \"https://registry.yarnpkg.com/find-cache-dir/-/find-cache-dir-2.0.0.tgz#4c1faed59f45184530fb9d7fa123a4d04a98472d\"\n  dependencies:\n    commondir \"^1.0.1\"\n    make-dir \"^1.0.0\"\n    pkg-dir \"^3.0.0\"\n\nfind-up@^1.0.0:\n  version \"1.1.2\"\n  resolved \"https://registry.yarnpkg.com/find-up/-/find-up-1.1.2.tgz#6b2e9822b1a2ce0a60ab64d610eccad53cb24d0f\"\n  dependencies:\n    path-exists \"^2.0.0\"\n    pinkie-promise \"^2.0.0\"\n\nfind-up@^2.1.0:\n  version \"2.1.0\"\n  resolved \"https://registry.yarnpkg.com/find-up/-/find-up-2.1.0.tgz#45d1b7e506c717ddd482775a2b77920a3c0c57a7\"\n  dependencies:\n    locate-path \"^2.0.0\"\n\nfind-up@^3.0.0:\n  version \"3.0.0\"\n  resolved \"https://registry.yarnpkg.com/find-up/-/find-up-3.0.0.tgz#49169f1d7993430646da61ecc5ae355c21c97b73\"\n  dependencies:\n    locate-path \"^3.0.0\"\n\nfindup-sync@^2.0.0:\n  version \"2.0.0\"\n  resolved \"https://registry.yarnpkg.com/findup-sync/-/findup-sync-2.0.0.tgz#9326b1488c22d1a6088650a86901b2d9a90a2cbc\"\n  dependencies:\n    detect-file \"^1.0.0\"\n    is-glob \"^3.1.0\"\n    micromatch \"^3.0.4\"\n    resolve-dir \"^1.0.1\"\n\nflush-write-stream@^1.0.0:\n  version \"1.1.1\"\n  resolved \"https://registry.yarnpkg.com/flush-write-stream/-/flush-write-stream-1.1.1.tgz#8dd7d873a1babc207d94ead0c2e0e44276ebf2e8\"\n  dependencies:\n    inherits \"^2.0.3\"\n    readable-stream \"^2.3.6\"\n\nfollow-redirects@1.5.10:\n  version \"1.5.10\"\n  resolved \"https://registry.yarnpkg.com/follow-redirects/-/follow-redirects-1.5.10.tgz#7b7a9f9aea2fdff36786a94ff643ed07f4ff5e2a\"\n  integrity sha512-0V5l4Cizzvqt5D44aTXbFZz+FtyXV1vrDN6qrelxtfYQKW0KO0W2T/hkE8xvGa/540LkZlkaUjO4ailYTFtHVQ==\n  dependencies:\n    debug \"=3.1.0\"\n\nfollow-redirects@^1.0.0:\n  version \"1.7.0\"\n  resolved \"https://registry.yarnpkg.com/follow-redirects/-/follow-redirects-1.7.0.tgz#489ebc198dc0e7f64167bd23b03c4c19b5784c76\"\n  dependencies:\n    debug \"^3.2.6\"\n\nfor-each@^0.3.3:\n  version \"0.3.3\"\n  resolved \"https://registry.yarnpkg.com/for-each/-/for-each-0.3.3.tgz#69b447e88a0a5d32c3e7084f3f1710034b21376e\"\n  dependencies:\n    is-callable \"^1.1.3\"\n\nfor-in@^0.1.3:\n  version \"0.1.8\"\n  resolved \"https://registry.yarnpkg.com/for-in/-/for-in-0.1.8.tgz#d8773908e31256109952b1fdb9b3fa867d2775e1\"\n\nfor-in@^1.0.1, for-in@^1.0.2:\n  version \"1.0.2\"\n  resolved \"https://registry.yarnpkg.com/for-in/-/for-in-1.0.2.tgz#81068d295a8142ec0ac726c6e2200c30fb6d5e80\"\n  integrity sha1-gQaNKVqBQuwKxybG4iAMMPttXoA=\n\nfor-own@^1.0.0:\n  version \"1.0.0\"\n  resolved \"https://registry.yarnpkg.com/for-own/-/for-own-1.0.0.tgz#c63332f415cedc4b04dbfe70cf836494c53cb44b\"\n  dependencies:\n    for-in \"^1.0.1\"\n\nforever-agent@~0.6.1:\n  version \"0.6.1\"\n  resolved \"https://registry.yarnpkg.com/forever-agent/-/forever-agent-0.6.1.tgz#fbc71f0c41adeb37f96c577ad1ed42d8fdacca91\"\n\nform-data@~2.3.2:\n  version \"2.3.3\"\n  resolved \"https://registry.yarnpkg.com/form-data/-/form-data-2.3.3.tgz#dcce52c05f644f298c6a7ab936bd724ceffbf3a6\"\n  dependencies:\n    asynckit \"^0.4.0\"\n    combined-stream \"^1.0.6\"\n    mime-types \"^2.1.12\"\n\nforwarded@~0.1.2:\n  version \"0.1.2\"\n  resolved \"https://registry.yarnpkg.com/forwarded/-/forwarded-0.1.2.tgz#98c23dab1175657b8c0573e8ceccd91b0ff18c84\"\n\nfragment-cache@^0.2.1:\n  version \"0.2.1\"\n  resolved \"https://registry.yarnpkg.com/fragment-cache/-/fragment-cache-0.2.1.tgz#4290fad27f13e89be7f33799c6bc5a0abfff0d19\"\n  dependencies:\n    map-cache \"^0.2.2\"\n\nfresh@0.5.2:\n  version \"0.5.2\"\n  resolved \"https://registry.yarnpkg.com/fresh/-/fresh-0.5.2.tgz#3d8cadd90d976569fa835ab1f8e4b23a105605a7\"\n\nfriendly-errors-webpack-plugin@^1.7.0:\n  version \"1.7.0\"\n  resolved \"https://registry.yarnpkg.com/friendly-errors-webpack-plugin/-/friendly-errors-webpack-plugin-1.7.0.tgz#efc86cbb816224565861a1be7a9d84d0aafea136\"\n  dependencies:\n    chalk \"^1.1.3\"\n    error-stack-parser \"^2.0.0\"\n    string-width \"^2.0.0\"\n\nfrom2@^2.1.0:\n  version \"2.3.0\"\n  resolved \"https://registry.yarnpkg.com/from2/-/from2-2.3.0.tgz#8bfb5502bde4a4d36cfdeea007fcca21d7e382af\"\n  dependencies:\n    inherits \"^2.0.1\"\n    readable-stream \"^2.0.0\"\n\nfs-extra@^1.0.0:\n  version \"1.0.0\"\n  resolved \"https://registry.yarnpkg.com/fs-extra/-/fs-extra-1.0.0.tgz#cd3ce5f7e7cb6145883fcae3191e9877f8587950\"\n  dependencies:\n    graceful-fs \"^4.1.2\"\n    jsonfile \"^2.1.0\"\n    klaw \"^1.0.0\"\n\nfs-extra@^2.0.0:\n  version \"2.1.2\"\n  resolved \"https://registry.yarnpkg.com/fs-extra/-/fs-extra-2.1.2.tgz#046c70163cef9aad46b0e4a7fa467fb22d71de35\"\n  dependencies:\n    graceful-fs \"^4.1.2\"\n    jsonfile \"^2.1.0\"\n\nfs-extra@^7.0.0:\n  version \"7.0.1\"\n  resolved \"https://registry.yarnpkg.com/fs-extra/-/fs-extra-7.0.1.tgz#4f189c44aa123b895f722804f55ea23eadc348e9\"\n  dependencies:\n    graceful-fs \"^4.1.2\"\n    jsonfile \"^4.0.0\"\n    universalify \"^0.1.0\"\n\nfs-minipass@^1.2.5:\n  version \"1.2.5\"\n  resolved \"https://registry.yarnpkg.com/fs-minipass/-/fs-minipass-1.2.5.tgz#06c277218454ec288df77ada54a03b8702aacb9d\"\n  dependencies:\n    minipass \"^2.2.1\"\n\nfs-write-stream-atomic@^1.0.8:\n  version \"1.0.10\"\n  resolved \"https://registry.yarnpkg.com/fs-write-stream-atomic/-/fs-write-stream-atomic-1.0.10.tgz#b47df53493ef911df75731e70a9ded0189db40c9\"\n  dependencies:\n    graceful-fs \"^4.1.2\"\n    iferr \"^0.1.5\"\n    imurmurhash \"^0.1.4\"\n    readable-stream \"1 || 2\"\n\nfs.realpath@^1.0.0:\n  version \"1.0.0\"\n  resolved \"https://registry.yarnpkg.com/fs.realpath/-/fs.realpath-1.0.0.tgz#1504ad2523158caa40db4a2787cb01411994ea4f\"\n\nfsevents@^1.2.7:\n  version \"1.2.7\"\n  resolved \"https://registry.yarnpkg.com/fsevents/-/fsevents-1.2.7.tgz#4851b664a3783e52003b3c66eb0eee1074933aa4\"\n  dependencies:\n    nan \"^2.9.2\"\n    node-pre-gyp \"^0.10.0\"\n\nfstream@^1.0.0, fstream@^1.0.2:\n  version \"1.0.11\"\n  resolved \"https://registry.yarnpkg.com/fstream/-/fstream-1.0.11.tgz#5c1fb1f117477114f0632a0eb4b71b3cb0fd3171\"\n  dependencies:\n    graceful-fs \"^4.1.2\"\n    inherits \"~2.0.0\"\n    mkdirp \">=0.5 0\"\n    rimraf \"2\"\n\nfunction-bind@^1.0.2, function-bind@^1.1.1:\n  version \"1.1.1\"\n  resolved \"https://registry.yarnpkg.com/function-bind/-/function-bind-1.1.1.tgz#a56899d3ea3c9bab874bb9773b7c5ede92f4895d\"\n\ngauge@~2.7.3:\n  version \"2.7.4\"\n  resolved \"https://registry.yarnpkg.com/gauge/-/gauge-2.7.4.tgz#2c03405c7538c39d7eb37b317022e325fb018bf7\"\n  dependencies:\n    aproba \"^1.0.3\"\n    console-control-strings \"^1.0.0\"\n    has-unicode \"^2.0.0\"\n    object-assign \"^4.1.0\"\n    signal-exit \"^3.0.0\"\n    string-width \"^1.0.1\"\n    strip-ansi \"^3.0.1\"\n    wide-align \"^1.1.0\"\n\ngaze@^1.0.0:\n  version \"1.1.3\"\n  resolved \"https://registry.yarnpkg.com/gaze/-/gaze-1.1.3.tgz#c441733e13b927ac8c0ff0b4c3b033f28812924a\"\n  dependencies:\n    globule \"^1.0.0\"\n\nget-caller-file@^1.0.1:\n  version \"1.0.3\"\n  resolved \"https://registry.yarnpkg.com/get-caller-file/-/get-caller-file-1.0.3.tgz#f978fa4c90d1dfe7ff2d6beda2a515e713bdcf4a\"\n\nget-caller-file@^2.0.1:\n  version \"2.0.5\"\n  resolved \"https://registry.yarnpkg.com/get-caller-file/-/get-caller-file-2.0.5.tgz#4f94412a82db32f36e3b0b9741f8a97feb031f7e\"\n  integrity sha512-DyFP3BM/3YHTQOCUL/w0OZHR0lpKeGrxotcHWcqNEdnltqFwXVfhEBQ94eIo34AfQpo0rGki4cyIiftY06h2Fg==\n\nget-stdin@^4.0.1:\n  version \"4.0.1\"\n  resolved \"https://registry.yarnpkg.com/get-stdin/-/get-stdin-4.0.1.tgz#b968c6b0a04384324902e8bf1a5df32579a450fe\"\n\nget-stdin@^6.0.0:\n  version \"6.0.0\"\n  resolved \"https://registry.yarnpkg.com/get-stdin/-/get-stdin-6.0.0.tgz#9e09bf712b360ab9225e812048f71fde9c89657b\"\n\nget-stream@^2.0.0:\n  version \"2.3.1\"\n  resolved \"https://registry.yarnpkg.com/get-stream/-/get-stream-2.3.1.tgz#5f38f93f346009666ee0150a054167f91bdd95de\"\n  dependencies:\n    object-assign \"^4.0.1\"\n    pinkie-promise \"^2.0.0\"\n\nget-stream@^3.0.0:\n  version \"3.0.0\"\n  resolved \"https://registry.yarnpkg.com/get-stream/-/get-stream-3.0.0.tgz#8e943d1358dc37555054ecbe2edb05aa174ede14\"\n\nget-stream@^4.0.0:\n  version \"4.1.0\"\n  resolved \"https://registry.yarnpkg.com/get-stream/-/get-stream-4.1.0.tgz#c1b255575f3dc21d59bfc79cd3d2b46b1c3a54b5\"\n  dependencies:\n    pump \"^3.0.0\"\n\nget-value@^2.0.3, get-value@^2.0.6:\n  version \"2.0.6\"\n  resolved \"https://registry.yarnpkg.com/get-value/-/get-value-2.0.6.tgz#dc15ca1c672387ca76bd37ac0a395ba2042a2c28\"\n\ngetpass@^0.1.1:\n  version \"0.1.7\"\n  resolved \"https://registry.yarnpkg.com/getpass/-/getpass-0.1.7.tgz#5eff8e3e684d569ae4cb2b1282604e8ba62149fa\"\n  dependencies:\n    assert-plus \"^1.0.0\"\n\nglob-parent@^3.1.0:\n  version \"3.1.0\"\n  resolved \"https://registry.yarnpkg.com/glob-parent/-/glob-parent-3.1.0.tgz#9e6af6299d8d3bd2bd40430832bd113df906c5ae\"\n  dependencies:\n    is-glob \"^3.1.0\"\n    path-dirname \"^1.0.0\"\n\nglob-to-regexp@^0.3.0:\n  version \"0.3.0\"\n  resolved \"https://registry.yarnpkg.com/glob-to-regexp/-/glob-to-regexp-0.3.0.tgz#8c5a1494d2066c570cc3bfe4496175acc4d502ab\"\n\nglob@^7.0.0, glob@^7.0.3, glob@^7.1.2, glob@^7.1.3, glob@~7.1.1:\n  version \"7.1.3\"\n  resolved \"https://registry.yarnpkg.com/glob/-/glob-7.1.3.tgz#3960832d3f1574108342dafd3a67b332c0969df1\"\n  dependencies:\n    fs.realpath \"^1.0.0\"\n    inflight \"^1.0.4\"\n    inherits \"2\"\n    minimatch \"^3.0.4\"\n    once \"^1.3.0\"\n    path-is-absolute \"^1.0.0\"\n\nglob@^7.1.1:\n  version \"7.1.4\"\n  resolved \"https://registry.yarnpkg.com/glob/-/glob-7.1.4.tgz#aa608a2f6c577ad357e1ae5a5c26d9a8d1969255\"\n  dependencies:\n    fs.realpath \"^1.0.0\"\n    inflight \"^1.0.4\"\n    inherits \"2\"\n    minimatch \"^3.0.4\"\n    once \"^1.3.0\"\n    path-is-absolute \"^1.0.0\"\n\nglobal-modules@^1.0.0:\n  version \"1.0.0\"\n  resolved \"https://registry.yarnpkg.com/global-modules/-/global-modules-1.0.0.tgz#6d770f0eb523ac78164d72b5e71a8877265cc3ea\"\n  dependencies:\n    global-prefix \"^1.0.1\"\n    is-windows \"^1.0.1\"\n    resolve-dir \"^1.0.0\"\n\nglobal-prefix@^1.0.1:\n  version \"1.0.2\"\n  resolved \"https://registry.yarnpkg.com/global-prefix/-/global-prefix-1.0.2.tgz#dbf743c6c14992593c655568cb66ed32c0122ebe\"\n  dependencies:\n    expand-tilde \"^2.0.2\"\n    homedir-polyfill \"^1.0.1\"\n    ini \"^1.3.4\"\n    is-windows \"^1.0.1\"\n    which \"^1.2.14\"\n\nglobal@~4.3.0:\n  version \"4.3.2\"\n  resolved \"https://registry.yarnpkg.com/global/-/global-4.3.2.tgz#e76989268a6c74c38908b1305b10fc0e394e9d0f\"\n  dependencies:\n    min-document \"^2.19.0\"\n    process \"~0.5.1\"\n\nglobals@^11.1.0:\n  version \"11.11.0\"\n  resolved \"https://registry.yarnpkg.com/globals/-/globals-11.11.0.tgz#dcf93757fa2de5486fbeed7118538adf789e9c2e\"\n\nglobby@^6.1.0:\n  version \"6.1.0\"\n  resolved \"https://registry.yarnpkg.com/globby/-/globby-6.1.0.tgz#f5a6d70e8395e21c858fb0489d64df02424d506c\"\n  dependencies:\n    array-union \"^1.0.1\"\n    glob \"^7.0.3\"\n    object-assign \"^4.0.1\"\n    pify \"^2.0.0\"\n    pinkie-promise \"^2.0.0\"\n\nglobby@^8.0.1:\n  version \"8.0.2\"\n  resolved \"https://registry.yarnpkg.com/globby/-/globby-8.0.2.tgz#5697619ccd95c5275dbb2d6faa42087c1a941d8d\"\n  dependencies:\n    array-union \"^1.0.1\"\n    dir-glob \"2.0.0\"\n    fast-glob \"^2.0.2\"\n    glob \"^7.1.2\"\n    ignore \"^3.3.5\"\n    pify \"^3.0.0\"\n    slash \"^1.0.0\"\n\nglobule@^1.0.0:\n  version \"1.2.1\"\n  resolved \"https://registry.yarnpkg.com/globule/-/globule-1.2.1.tgz#5dffb1b191f22d20797a9369b49eab4e9839696d\"\n  dependencies:\n    glob \"~7.1.1\"\n    lodash \"~4.17.10\"\n    minimatch \"~3.0.2\"\n\ngraceful-fs@^4.1.11, graceful-fs@^4.1.15, graceful-fs@^4.1.2, graceful-fs@^4.1.6, graceful-fs@^4.1.9:\n  version \"4.1.15\"\n  resolved \"https://registry.yarnpkg.com/graceful-fs/-/graceful-fs-4.1.15.tgz#ffb703e1066e8a0eeaa4c8b80ba9253eeefbfb00\"\n\nhandle-thing@^2.0.0:\n  version \"2.0.0\"\n  resolved \"https://registry.yarnpkg.com/handle-thing/-/handle-thing-2.0.0.tgz#0e039695ff50c93fc288557d696f3c1dc6776754\"\n\nhar-schema@^2.0.0:\n  version \"2.0.0\"\n  resolved \"https://registry.yarnpkg.com/har-schema/-/har-schema-2.0.0.tgz#a94c2224ebcac04782a0d9035521f24735b7ec92\"\n\nhar-validator@~5.1.0:\n  version \"5.1.3\"\n  resolved \"https://registry.yarnpkg.com/har-validator/-/har-validator-5.1.3.tgz#1ef89ebd3e4996557675eed9893110dc350fa080\"\n  dependencies:\n    ajv \"^6.5.5\"\n    har-schema \"^2.0.0\"\n\nharmony-reflect@^1.4.2:\n  version \"1.6.1\"\n  resolved \"https://registry.yarnpkg.com/harmony-reflect/-/harmony-reflect-1.6.1.tgz#c108d4f2bb451efef7a37861fdbdae72c9bdefa9\"\n\nhas-ansi@^2.0.0:\n  version \"2.0.0\"\n  resolved \"https://registry.yarnpkg.com/has-ansi/-/has-ansi-2.0.0.tgz#34f5049ce1ecdf2b0649af3ef24e45ed35416d91\"\n  dependencies:\n    ansi-regex \"^2.0.0\"\n\nhas-flag@^1.0.0:\n  version \"1.0.0\"\n  resolved \"https://registry.yarnpkg.com/has-flag/-/has-flag-1.0.0.tgz#9d9e793165ce017a00f00418c43f942a7b1d11fa\"\n\nhas-flag@^2.0.0:\n  version \"2.0.0\"\n  resolved \"https://registry.yarnpkg.com/has-flag/-/has-flag-2.0.0.tgz#e8207af1cc7b30d446cc70b734b5e8be18f88d51\"\n\nhas-flag@^3.0.0:\n  version \"3.0.0\"\n  resolved \"https://registry.yarnpkg.com/has-flag/-/has-flag-3.0.0.tgz#b5d454dc2199ae225699f3467e5a07f3b955bafd\"\n\nhas-symbols@^1.0.0:\n  version \"1.0.0\"\n  resolved \"https://registry.yarnpkg.com/has-symbols/-/has-symbols-1.0.0.tgz#ba1a8f1af2a0fc39650f5c850367704122063b44\"\n\nhas-unicode@^2.0.0:\n  version \"2.0.1\"\n  resolved \"https://registry.yarnpkg.com/has-unicode/-/has-unicode-2.0.1.tgz#e0e6fe6a28cf51138855e086d1691e771de2a8b9\"\n\nhas-value@^0.3.1:\n  version \"0.3.1\"\n  resolved \"https://registry.yarnpkg.com/has-value/-/has-value-0.3.1.tgz#7b1f58bada62ca827ec0a2078025654845995e1f\"\n  dependencies:\n    get-value \"^2.0.3\"\n    has-values \"^0.1.4\"\n    isobject \"^2.0.0\"\n\nhas-value@^1.0.0:\n  version \"1.0.0\"\n  resolved \"https://registry.yarnpkg.com/has-value/-/has-value-1.0.0.tgz#18b281da585b1c5c51def24c930ed29a0be6b177\"\n  dependencies:\n    get-value \"^2.0.6\"\n    has-values \"^1.0.0\"\n    isobject \"^3.0.0\"\n\nhas-values@^0.1.4:\n  version \"0.1.4\"\n  resolved \"https://registry.yarnpkg.com/has-values/-/has-values-0.1.4.tgz#6d61de95d91dfca9b9a02089ad384bff8f62b771\"\n\nhas-values@^1.0.0:\n  version \"1.0.0\"\n  resolved \"https://registry.yarnpkg.com/has-values/-/has-values-1.0.0.tgz#95b0b63fec2146619a6fe57fe75628d5a39efe4f\"\n  dependencies:\n    is-number \"^3.0.0\"\n    kind-of \"^4.0.0\"\n\nhas@^1.0.0, has@^1.0.1, has@^1.0.3:\n  version \"1.0.3\"\n  resolved \"https://registry.yarnpkg.com/has/-/has-1.0.3.tgz#722d7cbfc1f6aa8241f16dd814e011e1f41e8796\"\n  dependencies:\n    function-bind \"^1.1.1\"\n\nhash-base@^3.0.0:\n  version \"3.0.4\"\n  resolved \"https://registry.yarnpkg.com/hash-base/-/hash-base-3.0.4.tgz#5fc8686847ecd73499403319a6b0a3f3f6ae4918\"\n  dependencies:\n    inherits \"^2.0.1\"\n    safe-buffer \"^5.0.1\"\n\nhash.js@^1.0.0, hash.js@^1.0.3:\n  version \"1.1.7\"\n  resolved \"https://registry.yarnpkg.com/hash.js/-/hash.js-1.1.7.tgz#0babca538e8d4ee4a0f8988d68866537a003cf42\"\n  dependencies:\n    inherits \"^2.0.3\"\n    minimalistic-assert \"^1.0.1\"\n\nhasha@^2.2.0:\n  version \"2.2.0\"\n  resolved \"https://registry.yarnpkg.com/hasha/-/hasha-2.2.0.tgz#78d7cbfc1e6d66303fe79837365984517b2f6ee1\"\n  dependencies:\n    is-stream \"^1.0.1\"\n    pinkie-promise \"^2.0.0\"\n\nhe@1.2.x:\n  version \"1.2.0\"\n  resolved \"https://registry.yarnpkg.com/he/-/he-1.2.0.tgz#84ae65fa7eafb165fddb61566ae14baf05664f0f\"\n\nhex-color-regex@^1.1.0:\n  version \"1.1.0\"\n  resolved \"https://registry.yarnpkg.com/hex-color-regex/-/hex-color-regex-1.1.0.tgz#4c06fccb4602fe2602b3c93df82d7e7dbf1a8a8e\"\n\nhistory@^4.7.2:\n  version \"4.7.2\"\n  resolved \"https://registry.yarnpkg.com/history/-/history-4.7.2.tgz#22b5c7f31633c5b8021c7f4a8a954ac139ee8d5b\"\n  dependencies:\n    invariant \"^2.2.1\"\n    loose-envify \"^1.2.0\"\n    resolve-pathname \"^2.2.0\"\n    value-equal \"^0.4.0\"\n    warning \"^3.0.0\"\n\nhmac-drbg@^1.0.0:\n  version \"1.0.1\"\n  resolved \"https://registry.yarnpkg.com/hmac-drbg/-/hmac-drbg-1.0.1.tgz#d2745701025a6c775a6c545793ed502fc0c649a1\"\n  dependencies:\n    hash.js \"^1.0.3\"\n    minimalistic-assert \"^1.0.0\"\n    minimalistic-crypto-utils \"^1.0.1\"\n\nhoist-non-react-statics@^2.5.0:\n  version \"2.5.5\"\n  resolved \"https://registry.yarnpkg.com/hoist-non-react-statics/-/hoist-non-react-statics-2.5.5.tgz#c5903cf409c0dfd908f388e619d86b9c1174cb47\"\n\nhoist-non-react-statics@^3.2.1, hoist-non-react-statics@^3.3.0:\n  version \"3.3.0\"\n  resolved \"https://registry.yarnpkg.com/hoist-non-react-statics/-/hoist-non-react-statics-3.3.0.tgz#b09178f0122184fb95acf525daaecb4d8f45958b\"\n  dependencies:\n    react-is \"^16.7.0\"\n\nhomedir-polyfill@^1.0.1:\n  version \"1.0.3\"\n  resolved \"https://registry.yarnpkg.com/homedir-polyfill/-/homedir-polyfill-1.0.3.tgz#743298cef4e5af3e194161fbadcc2151d3a058e8\"\n  dependencies:\n    parse-passwd \"^1.0.0\"\n\nhosted-git-info@^2.1.4:\n  version \"2.7.1\"\n  resolved \"https://registry.yarnpkg.com/hosted-git-info/-/hosted-git-info-2.7.1.tgz#97f236977bd6e125408930ff6de3eec6281ec047\"\n\nhpack.js@^2.1.6:\n  version \"2.1.6\"\n  resolved \"https://registry.yarnpkg.com/hpack.js/-/hpack.js-2.1.6.tgz#87774c0949e513f42e84575b3c45681fade2a0b2\"\n  dependencies:\n    inherits \"^2.0.1\"\n    obuf \"^1.0.0\"\n    readable-stream \"^2.0.1\"\n    wbuf \"^1.1.0\"\n\nhsl-regex@^1.0.0:\n  version \"1.0.0\"\n  resolved \"https://registry.yarnpkg.com/hsl-regex/-/hsl-regex-1.0.0.tgz#d49330c789ed819e276a4c0d272dffa30b18fe6e\"\n\nhsla-regex@^1.0.0:\n  version \"1.0.0\"\n  resolved \"https://registry.yarnpkg.com/hsla-regex/-/hsla-regex-1.0.0.tgz#c1ce7a3168c8c6614033a4b5f7877f3b225f9c38\"\n\nhtml-comment-regex@^1.1.0:\n  version \"1.1.2\"\n  resolved \"https://registry.yarnpkg.com/html-comment-regex/-/html-comment-regex-1.1.2.tgz#97d4688aeb5c81886a364faa0cad1dda14d433a7\"\n\nhtml-entities@^1.2.0:\n  version \"1.2.1\"\n  resolved \"https://registry.yarnpkg.com/html-entities/-/html-entities-1.2.1.tgz#0df29351f0721163515dfb9e5543e5f6eed5162f\"\n\nhtml-loader@^0.5.5:\n  version \"0.5.5\"\n  resolved \"https://registry.yarnpkg.com/html-loader/-/html-loader-0.5.5.tgz#6356dbeb0c49756d8ebd5ca327f16ff06ab5faea\"\n  dependencies:\n    es6-templates \"^0.2.3\"\n    fastparse \"^1.1.1\"\n    html-minifier \"^3.5.8\"\n    loader-utils \"^1.1.0\"\n    object-assign \"^4.1.1\"\n\nhtml-minifier@^3.2.3, html-minifier@^3.5.8:\n  version \"3.5.21\"\n  resolved \"https://registry.yarnpkg.com/html-minifier/-/html-minifier-3.5.21.tgz#d0040e054730e354db008463593194015212d20c\"\n  dependencies:\n    camel-case \"3.0.x\"\n    clean-css \"4.2.x\"\n    commander \"2.17.x\"\n    he \"1.2.x\"\n    param-case \"2.1.x\"\n    relateurl \"0.2.x\"\n    uglify-js \"3.4.x\"\n\nhtml-webpack-plugin@^3.2.0:\n  version \"3.2.0\"\n  resolved \"https://registry.yarnpkg.com/html-webpack-plugin/-/html-webpack-plugin-3.2.0.tgz#b01abbd723acaaa7b37b6af4492ebda03d9dd37b\"\n  dependencies:\n    html-minifier \"^3.2.3\"\n    loader-utils \"^0.2.16\"\n    lodash \"^4.17.3\"\n    pretty-error \"^2.0.2\"\n    tapable \"^1.0.0\"\n    toposort \"^1.0.0\"\n    util.promisify \"1.0.0\"\n\nhtmlparser2@^3.3.0:\n  version \"3.10.1\"\n  resolved \"https://registry.yarnpkg.com/htmlparser2/-/htmlparser2-3.10.1.tgz#bd679dc3f59897b6a34bb10749c855bb53a9392f\"\n  dependencies:\n    domelementtype \"^1.3.1\"\n    domhandler \"^2.3.0\"\n    domutils \"^1.5.1\"\n    entities \"^1.1.1\"\n    inherits \"^2.0.1\"\n    readable-stream \"^3.1.1\"\n\nhtmlparser2@~3.8.1:\n  version \"3.8.3\"\n  resolved \"https://registry.yarnpkg.com/htmlparser2/-/htmlparser2-3.8.3.tgz#996c28b191516a8be86501a7d79757e5c70c1068\"\n  dependencies:\n    domelementtype \"1\"\n    domhandler \"2.3\"\n    domutils \"1.5\"\n    entities \"1.0\"\n    readable-stream \"1.1\"\n\nhttp-deceiver@^1.2.7:\n  version \"1.2.7\"\n  resolved \"https://registry.yarnpkg.com/http-deceiver/-/http-deceiver-1.2.7.tgz#fa7168944ab9a519d337cb0bec7284dc3e723d87\"\n\nhttp-errors@1.6.3, http-errors@~1.6.2, http-errors@~1.6.3:\n  version \"1.6.3\"\n  resolved \"https://registry.yarnpkg.com/http-errors/-/http-errors-1.6.3.tgz#8b55680bb4be283a0b5bf4ea2e38580be1d9320d\"\n  dependencies:\n    depd \"~1.1.2\"\n    inherits \"2.0.3\"\n    setprototypeof \"1.1.0\"\n    statuses \">= 1.4.0 < 2\"\n\nhttp-parser-js@>=0.4.0:\n  version \"0.5.0\"\n  resolved \"https://registry.yarnpkg.com/http-parser-js/-/http-parser-js-0.5.0.tgz#d65edbede84349d0dc30320815a15d39cc3cbbd8\"\n\nhttp-proxy-middleware@^0.19.1:\n  version \"0.19.1\"\n  resolved \"https://registry.yarnpkg.com/http-proxy-middleware/-/http-proxy-middleware-0.19.1.tgz#183c7dc4aa1479150306498c210cdaf96080a43a\"\n  dependencies:\n    http-proxy \"^1.17.0\"\n    is-glob \"^4.0.0\"\n    lodash \"^4.17.11\"\n    micromatch \"^3.1.10\"\n\nhttp-proxy@^1.17.0:\n  version \"1.17.0\"\n  resolved \"https://registry.yarnpkg.com/http-proxy/-/http-proxy-1.17.0.tgz#7ad38494658f84605e2f6db4436df410f4e5be9a\"\n  dependencies:\n    eventemitter3 \"^3.0.0\"\n    follow-redirects \"^1.0.0\"\n    requires-port \"^1.0.0\"\n\nhttp-signature@~1.2.0:\n  version \"1.2.0\"\n  resolved \"https://registry.yarnpkg.com/http-signature/-/http-signature-1.2.0.tgz#9aecd925114772f3d95b65a60abb8f7c18fbace1\"\n  dependencies:\n    assert-plus \"^1.0.0\"\n    jsprim \"^1.2.2\"\n    sshpk \"^1.7.0\"\n\nhttps-browserify@^1.0.0:\n  version \"1.0.0\"\n  resolved \"https://registry.yarnpkg.com/https-browserify/-/https-browserify-1.0.0.tgz#ec06c10e0a34c0f2faf199f7fd7fc78fffd03c73\"\n\nhusky@^1.3.0:\n  version \"1.3.1\"\n  resolved \"https://registry.yarnpkg.com/husky/-/husky-1.3.1.tgz#26823e399300388ca2afff11cfa8a86b0033fae0\"\n  dependencies:\n    cosmiconfig \"^5.0.7\"\n    execa \"^1.0.0\"\n    find-up \"^3.0.0\"\n    get-stdin \"^6.0.0\"\n    is-ci \"^2.0.0\"\n    pkg-dir \"^3.0.0\"\n    please-upgrade-node \"^3.1.1\"\n    read-pkg \"^4.0.1\"\n    run-node \"^1.0.0\"\n    slash \"^2.0.0\"\n\niconv-lite@0.4.23:\n  version \"0.4.23\"\n  resolved \"https://registry.yarnpkg.com/iconv-lite/-/iconv-lite-0.4.23.tgz#297871f63be507adcfbfca715d0cd0eed84e9a63\"\n  dependencies:\n    safer-buffer \">= 2.1.2 < 3\"\n\niconv-lite@^0.4.4:\n  version \"0.4.24\"\n  resolved \"https://registry.yarnpkg.com/iconv-lite/-/iconv-lite-0.4.24.tgz#2022b4b25fbddc21d2f524974a474aafe733908b\"\n  dependencies:\n    safer-buffer \">= 2.1.2 < 3\"\n\nicss-replace-symbols@1.1.0, icss-replace-symbols@^1.1.0:\n  version \"1.1.0\"\n  resolved \"https://registry.yarnpkg.com/icss-replace-symbols/-/icss-replace-symbols-1.1.0.tgz#06ea6f83679a7749e386cfe1fe812ae5db223ded\"\n\nicss-utils@^4.1.0:\n  version \"4.1.0\"\n  resolved \"https://registry.yarnpkg.com/icss-utils/-/icss-utils-4.1.0.tgz#339dbbffb9f8729a243b701e1c29d4cc58c52f0e\"\n  dependencies:\n    postcss \"^7.0.14\"\n\nieee754@^1.1.4:\n  version \"1.1.12\"\n  resolved \"https://registry.yarnpkg.com/ieee754/-/ieee754-1.1.12.tgz#50bf24e5b9c8bb98af4964c941cdb0918da7b60b\"\n\niferr@^0.1.5:\n  version \"0.1.5\"\n  resolved \"https://registry.yarnpkg.com/iferr/-/iferr-0.1.5.tgz#c60eed69e6d8fdb6b3104a1fcbca1c192dc5b501\"\n\nignore-walk@^3.0.1:\n  version \"3.0.1\"\n  resolved \"https://registry.yarnpkg.com/ignore-walk/-/ignore-walk-3.0.1.tgz#a83e62e7d272ac0e3b551aaa82831a19b69f82f8\"\n  dependencies:\n    minimatch \"^3.0.4\"\n\nignore@^3.3.5, ignore@^3.3.7:\n  version \"3.3.10\"\n  resolved \"https://registry.yarnpkg.com/ignore/-/ignore-3.3.10.tgz#0a97fb876986e8081c631160f8f9f389157f0043\"\n\nimage-size@^0.4.0:\n  version \"0.4.0\"\n  resolved \"https://registry.yarnpkg.com/image-size/-/image-size-0.4.0.tgz#d4b4e1f61952e4cbc1cea9a6b0c915fecb707510\"\n\nimage-size@^0.5.0:\n  version \"0.5.5\"\n  resolved \"https://registry.yarnpkg.com/image-size/-/image-size-0.5.5.tgz#09dfd4ab9d20e29eb1c3e80b8990378df9e3cb9c\"\n\nimport-fresh@^2.0.0:\n  version \"2.0.0\"\n  resolved \"https://registry.yarnpkg.com/import-fresh/-/import-fresh-2.0.0.tgz#d81355c15612d386c61f9ddd3922d4304822a546\"\n  dependencies:\n    caller-path \"^2.0.0\"\n    resolve-from \"^3.0.0\"\n\nimport-local@^2.0.0:\n  version \"2.0.0\"\n  resolved \"https://registry.yarnpkg.com/import-local/-/import-local-2.0.0.tgz#55070be38a5993cf18ef6db7e961f5bee5c5a09d\"\n  dependencies:\n    pkg-dir \"^3.0.0\"\n    resolve-cwd \"^2.0.0\"\n\nimurmurhash@^0.1.4:\n  version \"0.1.4\"\n  resolved \"https://registry.yarnpkg.com/imurmurhash/-/imurmurhash-0.1.4.tgz#9218b9b2b928a238b13dc4fb6b6d576f231453ea\"\n\nin-publish@^2.0.0:\n  version \"2.0.0\"\n  resolved \"https://registry.yarnpkg.com/in-publish/-/in-publish-2.0.0.tgz#e20ff5e3a2afc2690320b6dc552682a9c7fadf51\"\n\ninclude-media@^1.4.9:\n  version \"1.4.9\"\n  resolved \"https://registry.yarnpkg.com/include-media/-/include-media-1.4.9.tgz#d0020b7be3eb2d54868a20943595ce380e0bc43b\"\n\nindent-string@^2.1.0:\n  version \"2.1.0\"\n  resolved \"https://registry.yarnpkg.com/indent-string/-/indent-string-2.1.0.tgz#8e2d48348742121b4a8218b7a137e9a52049dc80\"\n  dependencies:\n    repeating \"^2.0.0\"\n\nindexes-of@^1.0.1:\n  version \"1.0.1\"\n  resolved \"https://registry.yarnpkg.com/indexes-of/-/indexes-of-1.0.1.tgz#f30f716c8e2bd346c7b67d3df3915566a7c05607\"\n\nindexof@0.0.1:\n  version \"0.0.1\"\n  resolved \"https://registry.yarnpkg.com/indexof/-/indexof-0.0.1.tgz#82dc336d232b9062179d05ab3293a66059fd435d\"\n\ninflight@^1.0.4:\n  version \"1.0.6\"\n  resolved \"https://registry.yarnpkg.com/inflight/-/inflight-1.0.6.tgz#49bd6331d7d02d0c09bc910a1075ba8165b56df9\"\n  dependencies:\n    once \"^1.3.0\"\n    wrappy \"1\"\n\ninherits@2, inherits@2.0.3, inherits@^2.0.1, inherits@^2.0.3, inherits@~2.0.0, inherits@~2.0.1, inherits@~2.0.3:\n  version \"2.0.3\"\n  resolved \"https://registry.yarnpkg.com/inherits/-/inherits-2.0.3.tgz#633c2c83e3da42a502f52466022480f4208261de\"\n\ninherits@2.0.1:\n  version \"2.0.1\"\n  resolved \"https://registry.yarnpkg.com/inherits/-/inherits-2.0.1.tgz#b17d08d326b4423e568eff719f91b0b1cbdf69f1\"\n\nini@^1.3.4, ini@~1.3.0:\n  version \"1.3.5\"\n  resolved \"https://registry.yarnpkg.com/ini/-/ini-1.3.5.tgz#eee25f56db1c9ec6085e0c22778083f596abf927\"\n\ninternal-ip@^4.2.0:\n  version \"4.2.0\"\n  resolved \"https://registry.yarnpkg.com/internal-ip/-/internal-ip-4.2.0.tgz#46e81b638d84c338e5c67e42b1a17db67d0814fa\"\n  dependencies:\n    default-gateway \"^4.0.1\"\n    ipaddr.js \"^1.9.0\"\n\ninterpret@^1.1.0:\n  version \"1.2.0\"\n  resolved \"https://registry.yarnpkg.com/interpret/-/interpret-1.2.0.tgz#d5061a6224be58e8083985f5014d844359576296\"\n\ninvariant@^2.1.0, invariant@^2.2.1, invariant@^2.2.2, invariant@^2.2.4:\n  version \"2.2.4\"\n  resolved \"https://registry.yarnpkg.com/invariant/-/invariant-2.2.4.tgz#610f3c92c9359ce1db616e538008d23ff35158e6\"\n  dependencies:\n    loose-envify \"^1.0.0\"\n\ninvert-kv@^1.0.0:\n  version \"1.0.0\"\n  resolved \"https://registry.yarnpkg.com/invert-kv/-/invert-kv-1.0.0.tgz#104a8e4aaca6d3d8cd157a8ef8bfab2d7a3ffdb6\"\n\ninvert-kv@^2.0.0:\n  version \"2.0.0\"\n  resolved \"https://registry.yarnpkg.com/invert-kv/-/invert-kv-2.0.0.tgz#7393f5afa59ec9ff5f67a27620d11c226e3eec02\"\n\nip-regex@^1.0.1:\n  version \"1.0.3\"\n  resolved \"https://registry.yarnpkg.com/ip-regex/-/ip-regex-1.0.3.tgz#dc589076f659f419c222039a33316f1c7387effd\"\n\nip-regex@^2.1.0:\n  version \"2.1.0\"\n  resolved \"https://registry.yarnpkg.com/ip-regex/-/ip-regex-2.1.0.tgz#fa78bf5d2e6913c911ce9f819ee5146bb6d844e9\"\n\nip@^1.1.0, ip@^1.1.5:\n  version \"1.1.5\"\n  resolved \"https://registry.yarnpkg.com/ip/-/ip-1.1.5.tgz#bdded70114290828c0a039e72ef25f5aaec4354a\"\n\nipaddr.js@1.8.0:\n  version \"1.8.0\"\n  resolved \"https://registry.yarnpkg.com/ipaddr.js/-/ipaddr.js-1.8.0.tgz#eaa33d6ddd7ace8f7f6fe0c9ca0440e706738b1e\"\n\nipaddr.js@^1.9.0:\n  version \"1.9.0\"\n  resolved \"https://registry.yarnpkg.com/ipaddr.js/-/ipaddr.js-1.9.0.tgz#37df74e430a0e47550fe54a2defe30d8acd95f65\"\n\nis-absolute-url@^2.0.0:\n  version \"2.1.0\"\n  resolved \"https://registry.yarnpkg.com/is-absolute-url/-/is-absolute-url-2.1.0.tgz#50530dfb84fcc9aa7dbe7852e83a37b93b9f2aa6\"\n\nis-accessor-descriptor@^0.1.6:\n  version \"0.1.6\"\n  resolved \"https://registry.yarnpkg.com/is-accessor-descriptor/-/is-accessor-descriptor-0.1.6.tgz#a9e12cb3ae8d876727eeef3843f8a0897b5c98d6\"\n  dependencies:\n    kind-of \"^3.0.2\"\n\nis-accessor-descriptor@^1.0.0:\n  version \"1.0.0\"\n  resolved \"https://registry.yarnpkg.com/is-accessor-descriptor/-/is-accessor-descriptor-1.0.0.tgz#169c2f6d3df1f992618072365c9b0ea1f6878656\"\n  dependencies:\n    kind-of \"^6.0.0\"\n\nis-arrayish@^0.2.1:\n  version \"0.2.1\"\n  resolved \"https://registry.yarnpkg.com/is-arrayish/-/is-arrayish-0.2.1.tgz#77c99840527aa8ecb1a8ba697b80645a7a926a9d\"\n\nis-arrayish@^0.3.1:\n  version \"0.3.2\"\n  resolved \"https://registry.yarnpkg.com/is-arrayish/-/is-arrayish-0.3.2.tgz#4574a2ae56f7ab206896fb431eaeed066fdf8f03\"\n\nis-binary-path@^1.0.0:\n  version \"1.0.1\"\n  resolved \"https://registry.yarnpkg.com/is-binary-path/-/is-binary-path-1.0.1.tgz#75f16642b480f187a711c814161fd3a4a7655898\"\n  dependencies:\n    binary-extensions \"^1.0.0\"\n\nis-buffer@^1.1.5:\n  version \"1.1.6\"\n  resolved \"https://registry.yarnpkg.com/is-buffer/-/is-buffer-1.1.6.tgz#efaa2ea9daa0d7ab2ea13a97b2b8ad51fefbe8be\"\n\nis-buffer@^2.0.2:\n  version \"2.0.4\"\n  resolved \"https://registry.yarnpkg.com/is-buffer/-/is-buffer-2.0.4.tgz#3e572f23c8411a5cfd9557c849e3665e0b290623\"\n  integrity sha512-Kq1rokWXOPXWuaMAqZiJW4XxsmD9zGx9q4aePabbn3qCRGedtH7Cm+zV8WETitMfu1wdh+Rvd6w5egwSngUX2A==\n\nis-callable@^1.1.3, is-callable@^1.1.4:\n  version \"1.1.4\"\n  resolved \"https://registry.yarnpkg.com/is-callable/-/is-callable-1.1.4.tgz#1e1adf219e1eeb684d691f9d6a05ff0d30a24d75\"\n\nis-ci@^2.0.0:\n  version \"2.0.0\"\n  resolved \"https://registry.yarnpkg.com/is-ci/-/is-ci-2.0.0.tgz#6bc6334181810e04b5c22b3d589fdca55026404c\"\n  dependencies:\n    ci-info \"^2.0.0\"\n\nis-color-stop@^1.0.0:\n  version \"1.1.0\"\n  resolved \"https://registry.yarnpkg.com/is-color-stop/-/is-color-stop-1.1.0.tgz#cfff471aee4dd5c9e158598fbe12967b5cdad345\"\n  dependencies:\n    css-color-names \"^0.0.4\"\n    hex-color-regex \"^1.1.0\"\n    hsl-regex \"^1.0.0\"\n    hsla-regex \"^1.0.0\"\n    rgb-regex \"^1.0.1\"\n    rgba-regex \"^1.0.0\"\n\nis-data-descriptor@^0.1.4:\n  version \"0.1.4\"\n  resolved \"https://registry.yarnpkg.com/is-data-descriptor/-/is-data-descriptor-0.1.4.tgz#0b5ee648388e2c860282e793f1856fec3f301b56\"\n  dependencies:\n    kind-of \"^3.0.2\"\n\nis-data-descriptor@^1.0.0:\n  version \"1.0.0\"\n  resolved \"https://registry.yarnpkg.com/is-data-descriptor/-/is-data-descriptor-1.0.0.tgz#d84876321d0e7add03990406abbbbd36ba9268c7\"\n  dependencies:\n    kind-of \"^6.0.0\"\n\nis-date-object@^1.0.1:\n  version \"1.0.1\"\n  resolved \"https://registry.yarnpkg.com/is-date-object/-/is-date-object-1.0.1.tgz#9aa20eb6aeebbff77fbd33e74ca01b33581d3a16\"\n\nis-descriptor@^0.1.0:\n  version \"0.1.6\"\n  resolved \"https://registry.yarnpkg.com/is-descriptor/-/is-descriptor-0.1.6.tgz#366d8240dde487ca51823b1ab9f07a10a78251ca\"\n  dependencies:\n    is-accessor-descriptor \"^0.1.6\"\n    is-data-descriptor \"^0.1.4\"\n    kind-of \"^5.0.0\"\n\nis-descriptor@^1.0.0, is-descriptor@^1.0.2:\n  version \"1.0.2\"\n  resolved \"https://registry.yarnpkg.com/is-descriptor/-/is-descriptor-1.0.2.tgz#3b159746a66604b04f8c81524ba365c5f14d86ec\"\n  dependencies:\n    is-accessor-descriptor \"^1.0.0\"\n    is-data-descriptor \"^1.0.0\"\n    kind-of \"^6.0.2\"\n\nis-directory@^0.3.1:\n  version \"0.3.1\"\n  resolved \"https://registry.yarnpkg.com/is-directory/-/is-directory-0.3.1.tgz#61339b6f2475fc772fd9c9d83f5c8575dc154ae1\"\n\nis-extendable@^0.1.0, is-extendable@^0.1.1:\n  version \"0.1.1\"\n  resolved \"https://registry.yarnpkg.com/is-extendable/-/is-extendable-0.1.1.tgz#62b110e289a471418e3ec36a617d472e301dfc89\"\n\nis-extendable@^1.0.1:\n  version \"1.0.1\"\n  resolved \"https://registry.yarnpkg.com/is-extendable/-/is-extendable-1.0.1.tgz#a7470f9e426733d81bd81e1155264e3a3507cab4\"\n  integrity sha512-arnXMxT1hhoKo9k1LZdmlNyJdDDfy2v0fXjFlmok4+i8ul/6WlbVge9bhM74OpNPQPMGUToDtz+KXa1PneJxOA==\n  dependencies:\n    is-plain-object \"^2.0.4\"\n\nis-extglob@^2.1.0, is-extglob@^2.1.1:\n  version \"2.1.1\"\n  resolved \"https://registry.yarnpkg.com/is-extglob/-/is-extglob-2.1.1.tgz#a88c02535791f02ed37c76a1b9ea9773c833f8c2\"\n\nis-finite@^1.0.0:\n  version \"1.0.2\"\n  resolved \"https://registry.yarnpkg.com/is-finite/-/is-finite-1.0.2.tgz#cc6677695602be550ef11e8b4aa6305342b6d0aa\"\n  dependencies:\n    number-is-nan \"^1.0.0\"\n\nis-fullwidth-code-point@^1.0.0:\n  version \"1.0.0\"\n  resolved \"https://registry.yarnpkg.com/is-fullwidth-code-point/-/is-fullwidth-code-point-1.0.0.tgz#ef9e31386f031a7f0d643af82fde50c457ef00cb\"\n  dependencies:\n    number-is-nan \"^1.0.0\"\n\nis-fullwidth-code-point@^2.0.0:\n  version \"2.0.0\"\n  resolved \"https://registry.yarnpkg.com/is-fullwidth-code-point/-/is-fullwidth-code-point-2.0.0.tgz#a3b30a5c4f199183167aaab93beefae3ddfb654f\"\n\nis-function@^1.0.1:\n  version \"1.0.1\"\n  resolved \"https://registry.yarnpkg.com/is-function/-/is-function-1.0.1.tgz#12cfb98b65b57dd3d193a3121f5f6e2f437602b5\"\n\nis-glob@^3.1.0:\n  version \"3.1.0\"\n  resolved \"https://registry.yarnpkg.com/is-glob/-/is-glob-3.1.0.tgz#7ba5ae24217804ac70707b96922567486cc3e84a\"\n  dependencies:\n    is-extglob \"^2.1.0\"\n\nis-glob@^4.0.0:\n  version \"4.0.0\"\n  resolved \"https://registry.yarnpkg.com/is-glob/-/is-glob-4.0.0.tgz#9521c76845cc2610a85203ddf080a958c2ffabc0\"\n  dependencies:\n    is-extglob \"^2.1.1\"\n\nis-number@^3.0.0:\n  version \"3.0.0\"\n  resolved \"https://registry.yarnpkg.com/is-number/-/is-number-3.0.0.tgz#24fd6201a4782cf50561c810276afc7d12d71195\"\n  dependencies:\n    kind-of \"^3.0.2\"\n\nis-number@^7.0.0:\n  version \"7.0.0\"\n  resolved \"https://registry.yarnpkg.com/is-number/-/is-number-7.0.0.tgz#7535345b896734d5f80c4d06c50955527a14f12b\"\n\nis-obj@^1.0.0:\n  version \"1.0.1\"\n  resolved \"https://registry.yarnpkg.com/is-obj/-/is-obj-1.0.1.tgz#3e4729ac1f5fde025cd7d83a896dab9f4f67db0f\"\n\nis-path-cwd@^1.0.0:\n  version \"1.0.0\"\n  resolved \"https://registry.yarnpkg.com/is-path-cwd/-/is-path-cwd-1.0.0.tgz#d225ec23132e89edd38fda767472e62e65f1106d\"\n\nis-path-in-cwd@^1.0.0:\n  version \"1.0.1\"\n  resolved \"https://registry.yarnpkg.com/is-path-in-cwd/-/is-path-in-cwd-1.0.1.tgz#5ac48b345ef675339bd6c7a48a912110b241cf52\"\n  dependencies:\n    is-path-inside \"^1.0.0\"\n\nis-path-inside@^1.0.0:\n  version \"1.0.1\"\n  resolved \"https://registry.yarnpkg.com/is-path-inside/-/is-path-inside-1.0.1.tgz#8ef5b7de50437a3fdca6b4e865ef7aa55cb48036\"\n  dependencies:\n    path-is-inside \"^1.0.1\"\n\nis-plain-object@^2.0.1, is-plain-object@^2.0.3, is-plain-object@^2.0.4:\n  version \"2.0.4\"\n  resolved \"https://registry.yarnpkg.com/is-plain-object/-/is-plain-object-2.0.4.tgz#2c163b3fafb1b606d9d17928f05c2a1c38e07677\"\n  integrity sha512-h5PpgXkWitc38BBMYawTYMWJHFZJVnBquFE57xFpjB8pJFiF6gZ+bU+WyI/yqXiFR5mdLsgYNaPe8uao6Uv9Og==\n  dependencies:\n    isobject \"^3.0.1\"\n\nis-regex@^1.0.4:\n  version \"1.0.4\"\n  resolved \"https://registry.yarnpkg.com/is-regex/-/is-regex-1.0.4.tgz#5517489b547091b0930e095654ced25ee97e9491\"\n  dependencies:\n    has \"^1.0.1\"\n\nis-resolvable@^1.0.0:\n  version \"1.1.0\"\n  resolved \"https://registry.yarnpkg.com/is-resolvable/-/is-resolvable-1.1.0.tgz#fb18f87ce1feb925169c9a407c19318a3206ed88\"\n\nis-stream@^1.0.1, is-stream@^1.1.0:\n  version \"1.1.0\"\n  resolved \"https://registry.yarnpkg.com/is-stream/-/is-stream-1.1.0.tgz#12d4a3dd4e68e0b79ceb8dbc84173ae80d91ca44\"\n\nis-svg@^3.0.0:\n  version \"3.0.0\"\n  resolved \"https://registry.yarnpkg.com/is-svg/-/is-svg-3.0.0.tgz#9321dbd29c212e5ca99c4fa9794c714bcafa2f75\"\n  dependencies:\n    html-comment-regex \"^1.1.0\"\n\nis-symbol@^1.0.2:\n  version \"1.0.2\"\n  resolved \"https://registry.yarnpkg.com/is-symbol/-/is-symbol-1.0.2.tgz#a055f6ae57192caee329e7a860118b497a950f38\"\n  dependencies:\n    has-symbols \"^1.0.0\"\n\nis-typedarray@~1.0.0:\n  version \"1.0.0\"\n  resolved \"https://registry.yarnpkg.com/is-typedarray/-/is-typedarray-1.0.0.tgz#e479c80858df0c1b11ddda6940f96011fcda4a9a\"\n\nis-utf8@^0.2.0:\n  version \"0.2.1\"\n  resolved \"https://registry.yarnpkg.com/is-utf8/-/is-utf8-0.2.1.tgz#4b0da1442104d1b336340e80797e865cf39f7d72\"\n\nis-windows@^1.0.1, is-windows@^1.0.2:\n  version \"1.0.2\"\n  resolved \"https://registry.yarnpkg.com/is-windows/-/is-windows-1.0.2.tgz#d1850eb9791ecd18e6182ce12a30f396634bb19d\"\n\nis-wsl@^1.1.0:\n  version \"1.1.0\"\n  resolved \"https://registry.yarnpkg.com/is-wsl/-/is-wsl-1.1.0.tgz#1f16e4aa22b04d1336b66188a66af3c600c3a66d\"\n\nisarray@0.0.1:\n  version \"0.0.1\"\n  resolved \"https://registry.yarnpkg.com/isarray/-/isarray-0.0.1.tgz#8a18acfca9a8f4177e09abfc6038939b05d1eedf\"\n\nisarray@1.0.0, isarray@^1.0.0, isarray@~1.0.0:\n  version \"1.0.0\"\n  resolved \"https://registry.yarnpkg.com/isarray/-/isarray-1.0.0.tgz#bb935d48582cba168c06834957a54a3e07124f11\"\n\nisexe@^2.0.0:\n  version \"2.0.0\"\n  resolved \"https://registry.yarnpkg.com/isexe/-/isexe-2.0.0.tgz#e8fbf374dc556ff8947a10dcb0572d633f2cfa10\"\n\nisobject@^2.0.0:\n  version \"2.1.0\"\n  resolved \"https://registry.yarnpkg.com/isobject/-/isobject-2.1.0.tgz#f065561096a3f1da2ef46272f815c840d87e0c89\"\n  dependencies:\n    isarray \"1.0.0\"\n\nisobject@^3.0.0, isobject@^3.0.1:\n  version \"3.0.1\"\n  resolved \"https://registry.yarnpkg.com/isobject/-/isobject-3.0.1.tgz#4e431e92b11a9731636aa1f9c8d1ccbcfdab78df\"\n  integrity sha1-TkMekrEalzFjaqH5yNHMvP2reN8=\n\nisstream@~0.1.2:\n  version \"0.1.2\"\n  resolved \"https://registry.yarnpkg.com/isstream/-/isstream-0.1.2.tgz#47e63f7af55afa6f92e1500e690eb8b8529c099a\"\n\njest-docblock@^21.0.0:\n  version \"21.2.0\"\n  resolved \"https://registry.yarnpkg.com/jest-docblock/-/jest-docblock-21.2.0.tgz#51529c3b30d5fd159da60c27ceedc195faf8d414\"\n\njimp@^0.2.13, jimp@^0.2.21:\n  version \"0.2.28\"\n  resolved \"https://registry.yarnpkg.com/jimp/-/jimp-0.2.28.tgz#dd529a937190f42957a7937d1acc3a7762996ea2\"\n  dependencies:\n    bignumber.js \"^2.1.0\"\n    bmp-js \"0.0.3\"\n    es6-promise \"^3.0.2\"\n    exif-parser \"^0.1.9\"\n    file-type \"^3.1.0\"\n    jpeg-js \"^0.2.0\"\n    load-bmfont \"^1.2.3\"\n    mime \"^1.3.4\"\n    mkdirp \"0.5.1\"\n    pixelmatch \"^4.0.0\"\n    pngjs \"^3.0.0\"\n    read-chunk \"^1.0.1\"\n    request \"^2.65.0\"\n    stream-to-buffer \"^0.1.0\"\n    tinycolor2 \"^1.1.2\"\n    url-regex \"^3.0.0\"\n\njpeg-js@^0.1.1:\n  version \"0.1.2\"\n  resolved \"https://registry.yarnpkg.com/jpeg-js/-/jpeg-js-0.1.2.tgz#135b992c0575c985cfa0f494a3227ed238583ece\"\n\njpeg-js@^0.2.0:\n  version \"0.2.0\"\n  resolved \"https://registry.yarnpkg.com/jpeg-js/-/jpeg-js-0.2.0.tgz#53e448ec9d263e683266467e9442d2c5a2ef5482\"\n\njs-base64@^2.1.8:\n  version \"2.5.1\"\n  resolved \"https://registry.yarnpkg.com/js-base64/-/js-base64-2.5.1.tgz#1efa39ef2c5f7980bb1784ade4a8af2de3291121\"\n\njs-levenshtein@^1.1.3:\n  version \"1.1.6\"\n  resolved \"https://registry.yarnpkg.com/js-levenshtein/-/js-levenshtein-1.1.6.tgz#c6cee58eb3550372df8deb85fad5ce66ce01d59d\"\n\njs-md5@^0.7.3:\n  version \"0.7.3\"\n  resolved \"https://registry.yarnpkg.com/js-md5/-/js-md5-0.7.3.tgz#b4f2fbb0b327455f598d6727e38ec272cd09c3f2\"\n\n\"js-tokens@^3.0.0 || ^4.0.0\", js-tokens@^4.0.0:\n  version \"4.0.0\"\n  resolved \"https://registry.yarnpkg.com/js-tokens/-/js-tokens-4.0.0.tgz#19203fb59991df98e3a287050d4647cdeaf32499\"\n\njs-yaml@^3.12.0, js-yaml@^3.9.0:\n  version \"3.12.2\"\n  resolved \"https://registry.yarnpkg.com/js-yaml/-/js-yaml-3.12.2.tgz#ef1d067c5a9d9cb65bd72f285b5d8105c77f14fc\"\n  dependencies:\n    argparse \"^1.0.7\"\n    esprima \"^4.0.0\"\n\njs-yaml@^3.13.0:\n  version \"3.13.1\"\n  resolved \"https://registry.yarnpkg.com/js-yaml/-/js-yaml-3.13.1.tgz#aff151b30bfdfa8e49e05da22e7415e9dfa37847\"\n  dependencies:\n    argparse \"^1.0.7\"\n    esprima \"^4.0.0\"\n\njsbn@~0.1.0:\n  version \"0.1.1\"\n  resolved \"https://registry.yarnpkg.com/jsbn/-/jsbn-0.1.1.tgz#a5e654c2e5a2deb5f201d96cefbca80c0ef2f513\"\n\njsesc@^2.5.1:\n  version \"2.5.2\"\n  resolved \"https://registry.yarnpkg.com/jsesc/-/jsesc-2.5.2.tgz#80564d2e483dacf6e8ef209650a67df3f0c283a4\"\n\njsesc@~0.5.0:\n  version \"0.5.0\"\n  resolved \"https://registry.yarnpkg.com/jsesc/-/jsesc-0.5.0.tgz#e7dee66e35d6fc16f710fe91d5cf69f70f08911d\"\n\njson-parse-better-errors@^1.0.1, json-parse-better-errors@^1.0.2:\n  version \"1.0.2\"\n  resolved \"https://registry.yarnpkg.com/json-parse-better-errors/-/json-parse-better-errors-1.0.2.tgz#bb867cfb3450e69107c131d1c514bab3dc8bcaa9\"\n\njson-schema-traverse@^0.4.1:\n  version \"0.4.1\"\n  resolved \"https://registry.yarnpkg.com/json-schema-traverse/-/json-schema-traverse-0.4.1.tgz#69f6a87d9513ab8bb8fe63bdb0979c448e684660\"\n\njson-schema@0.2.3:\n  version \"0.2.3\"\n  resolved \"https://registry.yarnpkg.com/json-schema/-/json-schema-0.2.3.tgz#b480c892e59a2f05954ce727bd3f2a4e882f9e13\"\n\njson-stringify-safe@~5.0.1:\n  version \"5.0.1\"\n  resolved \"https://registry.yarnpkg.com/json-stringify-safe/-/json-stringify-safe-5.0.1.tgz#1296a2d58fd45f19a0f6ce01d65701e2c735b6eb\"\n\njson3@^3.3.2:\n  version \"3.3.2\"\n  resolved \"https://registry.yarnpkg.com/json3/-/json3-3.3.2.tgz#3c0434743df93e2f5c42aee7b19bcb483575f4e1\"\n\njson5@^0.5.0:\n  version \"0.5.1\"\n  resolved \"https://registry.yarnpkg.com/json5/-/json5-0.5.1.tgz#1eade7acc012034ad84e2396767ead9fa5495821\"\n\njson5@^1.0.1:\n  version \"1.0.1\"\n  resolved \"https://registry.yarnpkg.com/json5/-/json5-1.0.1.tgz#779fb0018604fa854eacbf6252180d83543e3dbe\"\n  dependencies:\n    minimist \"^1.2.0\"\n\njson5@^2.1.0:\n  version \"2.1.0\"\n  resolved \"https://registry.yarnpkg.com/json5/-/json5-2.1.0.tgz#e7a0c62c48285c628d20a10b85c89bb807c32850\"\n  dependencies:\n    minimist \"^1.2.0\"\n\njsonfile@^2.1.0:\n  version \"2.4.0\"\n  resolved \"https://registry.yarnpkg.com/jsonfile/-/jsonfile-2.4.0.tgz#3736a2b428b87bbda0cc83b53fa3d633a35c2ae8\"\n  optionalDependencies:\n    graceful-fs \"^4.1.6\"\n\njsonfile@^4.0.0:\n  version \"4.0.0\"\n  resolved \"https://registry.yarnpkg.com/jsonfile/-/jsonfile-4.0.0.tgz#8771aae0799b64076b76640fca058f9c10e33ecb\"\n  optionalDependencies:\n    graceful-fs \"^4.1.6\"\n\njsontoxml@0.0.11:\n  version \"0.0.11\"\n  resolved \"https://registry.yarnpkg.com/jsontoxml/-/jsontoxml-0.0.11.tgz#373ab5b2070be3737a5fb3e32fd1b7b81870caa4\"\n\njsprim@^1.2.2:\n  version \"1.4.1\"\n  resolved \"https://registry.yarnpkg.com/jsprim/-/jsprim-1.4.1.tgz#313e66bc1e5cc06e438bc1b7499c2e5c56acb6a2\"\n  dependencies:\n    assert-plus \"1.0.0\"\n    extsprintf \"1.3.0\"\n    json-schema \"0.2.3\"\n    verror \"1.10.0\"\n\nkew@^0.7.0:\n  version \"0.7.0\"\n  resolved \"https://registry.yarnpkg.com/kew/-/kew-0.7.0.tgz#79d93d2d33363d6fdd2970b335d9141ad591d79b\"\n\nkillable@^1.0.0:\n  version \"1.0.1\"\n  resolved \"https://registry.yarnpkg.com/killable/-/killable-1.0.1.tgz#4c8ce441187a061c7474fb87ca08e2a638194892\"\n\nkind-of@^3.0.2, kind-of@^3.0.3, kind-of@^3.2.0:\n  version \"3.2.2\"\n  resolved \"https://registry.yarnpkg.com/kind-of/-/kind-of-3.2.2.tgz#31ea21a734bab9bbb0f32466d893aea51e4a3c64\"\n  dependencies:\n    is-buffer \"^1.1.5\"\n\nkind-of@^4.0.0:\n  version \"4.0.0\"\n  resolved \"https://registry.yarnpkg.com/kind-of/-/kind-of-4.0.0.tgz#20813df3d712928b207378691a45066fae72dd57\"\n  dependencies:\n    is-buffer \"^1.1.5\"\n\nkind-of@^5.0.0:\n  version \"5.1.0\"\n  resolved \"https://registry.yarnpkg.com/kind-of/-/kind-of-5.1.0.tgz#729c91e2d857b7a419a1f9aa65685c4c33f5845d\"\n\nkind-of@^6.0.0, kind-of@^6.0.2:\n  version \"6.0.2\"\n  resolved \"https://registry.yarnpkg.com/kind-of/-/kind-of-6.0.2.tgz#01146b36a6218e64e58f3a8d66de5d7fc6f6d051\"\n\nklaw@^1.0.0:\n  version \"1.3.1\"\n  resolved \"https://registry.yarnpkg.com/klaw/-/klaw-1.3.1.tgz#4088433b46b3b1ba259d78785d8e96f73ba02439\"\n  optionalDependencies:\n    graceful-fs \"^4.1.9\"\n\nlast-call-webpack-plugin@^3.0.0:\n  version \"3.0.0\"\n  resolved \"https://registry.yarnpkg.com/last-call-webpack-plugin/-/last-call-webpack-plugin-3.0.0.tgz#9742df0e10e3cf46e5c0381c2de90d3a7a2d7555\"\n  dependencies:\n    lodash \"^4.17.5\"\n    webpack-sources \"^1.1.0\"\n\nlcid@^1.0.0:\n  version \"1.0.0\"\n  resolved \"https://registry.yarnpkg.com/lcid/-/lcid-1.0.0.tgz#308accafa0bc483a3867b4b6f2b9506251d1b835\"\n  dependencies:\n    invert-kv \"^1.0.0\"\n\nlcid@^2.0.0:\n  version \"2.0.0\"\n  resolved \"https://registry.yarnpkg.com/lcid/-/lcid-2.0.0.tgz#6ef5d2df60e52f82eb228a4c373e8d1f397253cf\"\n  dependencies:\n    invert-kv \"^2.0.0\"\n\nlines-and-columns@^1.1.6:\n  version \"1.1.6\"\n  resolved \"https://registry.yarnpkg.com/lines-and-columns/-/lines-and-columns-1.1.6.tgz#1c00c743b433cd0a4e80758f7b64a57440d9ff00\"\n\nload-bmfont@^1.2.3:\n  version \"1.4.0\"\n  resolved \"https://registry.yarnpkg.com/load-bmfont/-/load-bmfont-1.4.0.tgz#75f17070b14a8c785fe7f5bee2e6fd4f98093b6b\"\n  dependencies:\n    buffer-equal \"0.0.1\"\n    mime \"^1.3.4\"\n    parse-bmfont-ascii \"^1.0.3\"\n    parse-bmfont-binary \"^1.0.5\"\n    parse-bmfont-xml \"^1.1.4\"\n    phin \"^2.9.1\"\n    xhr \"^2.0.1\"\n    xtend \"^4.0.0\"\n\nload-json-file@^1.0.0:\n  version \"1.1.0\"\n  resolved \"https://registry.yarnpkg.com/load-json-file/-/load-json-file-1.1.0.tgz#956905708d58b4bab4c2261b04f59f31c99374c0\"\n  dependencies:\n    graceful-fs \"^4.1.2\"\n    parse-json \"^2.2.0\"\n    pify \"^2.0.0\"\n    pinkie-promise \"^2.0.0\"\n    strip-bom \"^2.0.0\"\n\nloader-runner@^2.3.0:\n  version \"2.4.0\"\n  resolved \"https://registry.yarnpkg.com/loader-runner/-/loader-runner-2.4.0.tgz#ed47066bfe534d7e84c4c7b9998c2a75607d9357\"\n\nloader-utils@1.2.3, loader-utils@^1.0.1, loader-utils@^1.0.2, loader-utils@^1.1.0, loader-utils@^1.2.3:\n  version \"1.2.3\"\n  resolved \"https://registry.yarnpkg.com/loader-utils/-/loader-utils-1.2.3.tgz#1ff5dc6911c9f0a062531a4c04b609406108c2c7\"\n  dependencies:\n    big.js \"^5.2.2\"\n    emojis-list \"^2.0.0\"\n    json5 \"^1.0.1\"\n\nloader-utils@^0.2.14, loader-utils@^0.2.16:\n  version \"0.2.17\"\n  resolved \"https://registry.yarnpkg.com/loader-utils/-/loader-utils-0.2.17.tgz#f86e6374d43205a6e6c60e9196f17c0299bfb348\"\n  dependencies:\n    big.js \"^3.1.3\"\n    emojis-list \"^2.0.0\"\n    json5 \"^0.5.0\"\n    object-assign \"^4.0.1\"\n\nlocalized-strings@^0.2.00:\n  version \"0.2.1\"\n  resolved \"https://registry.yarnpkg.com/localized-strings/-/localized-strings-0.2.1.tgz#4ecd9458ac9894bfb13b307551d9d8b92e4b4c51\"\n\nlocate-path@^2.0.0:\n  version \"2.0.0\"\n  resolved \"https://registry.yarnpkg.com/locate-path/-/locate-path-2.0.0.tgz#2b568b265eec944c6d9c0de9c3dbbbca0354cd8e\"\n  dependencies:\n    p-locate \"^2.0.0\"\n    path-exists \"^3.0.0\"\n\nlocate-path@^3.0.0:\n  version \"3.0.0\"\n  resolved \"https://registry.yarnpkg.com/locate-path/-/locate-path-3.0.0.tgz#dbec3b3ab759758071b58fe59fc41871af21400e\"\n  dependencies:\n    p-locate \"^3.0.0\"\n    path-exists \"^3.0.0\"\n\nlodash.assign@^4.2.0:\n  version \"4.2.0\"\n  resolved \"https://registry.yarnpkg.com/lodash.assign/-/lodash.assign-4.2.0.tgz#0d99f3ccd7a6d261d19bdaeb9245005d285808e7\"\n\nlodash.get@^4.4.2:\n  version \"4.4.2\"\n  resolved \"https://registry.yarnpkg.com/lodash.get/-/lodash.get-4.4.2.tgz#2d177f652fa31e939b4438d5341499dfa3825e99\"\n\nlodash.memoize@^4.1.2:\n  version \"4.1.2\"\n  resolved \"https://registry.yarnpkg.com/lodash.memoize/-/lodash.memoize-4.1.2.tgz#bcc6c49a42a2840ed997f323eada5ecd182e0bfe\"\n\nlodash.merge@^4.6.1:\n  version \"4.6.2\"\n  resolved \"https://registry.yarnpkg.com/lodash.merge/-/lodash.merge-4.6.2.tgz#558aa53b43b661e1925a0afdfa36a9a1085fe57a\"\n  integrity sha512-0KpjqXRVvrYyCsX1swR/XTK0va6VQkQM6MNo7PqW77ByjAhoARA8EfrP1N4+KlKj8YS0ZUCtRT/YUuhyYDujIQ==\n\nlodash.tail@^4.1.1:\n  version \"4.1.1\"\n  resolved \"https://registry.yarnpkg.com/lodash.tail/-/lodash.tail-4.1.1.tgz#d2333a36d9e7717c8ad2f7cacafec7c32b444664\"\n\nlodash.uniq@^4.5.0:\n  version \"4.5.0\"\n  resolved \"https://registry.yarnpkg.com/lodash.uniq/-/lodash.uniq-4.5.0.tgz#d0225373aeb652adc1bc82e4945339a842754773\"\n\n\"lodash@>=3.5 <5\", lodash@^4.0.0, lodash@^4.11.1, lodash@^4.17.10, lodash@^4.17.11, lodash@^4.17.13, lodash@^4.17.3, lodash@^4.17.5, lodash@~4.17.10:\n  version \"4.17.13\"\n  resolved \"https://registry.yarnpkg.com/lodash/-/lodash-4.17.13.tgz#0bdc3a6adc873d2f4e0c4bac285df91b64fc7b93\"\n  integrity sha512-vm3/XWXfWtRua0FkUyEHBZy8kCPjErNBT9fJx8Zvs+U6zjqPbTUOpkaoum3O5uiA8sm+yNMHXfYkTUHFoMxFNA==\n\nlodash@^3.2.0:\n  version \"3.10.1\"\n  resolved \"https://registry.yarnpkg.com/lodash/-/lodash-3.10.1.tgz#5bf45e8e49ba4189e17d482789dfd15bd140b7b6\"\n\nlodash@^4.17.15:\n  version \"4.17.19\"\n  resolved \"https://registry.yarnpkg.com/lodash/-/lodash-4.17.19.tgz#e48ddedbe30b3321783c5b4301fbd353bc1e4a4b\"\n  integrity sha512-JNvd8XER9GQX0v2qJgsaN/mzFCNA5BRe/j8JN9d+tWyGLSodKQHKFicdwNYzWwI3wjRnaKPsGj1XkBjx/F96DQ==\n\nlodash@~2.4.1:\n  version \"2.4.2\"\n  resolved \"https://registry.yarnpkg.com/lodash/-/lodash-2.4.2.tgz#fadd834b9683073da179b3eae6d9c0d15053f73e\"\n\nloglevel@^1.4.1:\n  version \"1.6.1\"\n  resolved \"https://registry.yarnpkg.com/loglevel/-/loglevel-1.6.1.tgz#e0fc95133b6ef276cdc8887cdaf24aa6f156f8fa\"\n\nloose-envify@^1.0.0, loose-envify@^1.1.0, loose-envify@^1.2.0, loose-envify@^1.3.0, loose-envify@^1.3.1, loose-envify@^1.4.0:\n  version \"1.4.0\"\n  resolved \"https://registry.yarnpkg.com/loose-envify/-/loose-envify-1.4.0.tgz#71ee51fa7be4caec1a63839f7e682d8132d30caf\"\n  dependencies:\n    js-tokens \"^3.0.0 || ^4.0.0\"\n\nloud-rejection@^1.0.0:\n  version \"1.6.0\"\n  resolved \"https://registry.yarnpkg.com/loud-rejection/-/loud-rejection-1.6.0.tgz#5b46f80147edee578870f086d04821cf998e551f\"\n  dependencies:\n    currently-unhandled \"^0.4.1\"\n    signal-exit \"^3.0.0\"\n\nlower-case@^1.1.1:\n  version \"1.1.4\"\n  resolved \"https://registry.yarnpkg.com/lower-case/-/lower-case-1.1.4.tgz#9a2cabd1b9e8e0ae993a4bf7d5875c39c42e8eac\"\n\nlru-cache@^4.0.1:\n  version \"4.1.5\"\n  resolved \"https://registry.yarnpkg.com/lru-cache/-/lru-cache-4.1.5.tgz#8bbe50ea85bed59bc9e33dcab8235ee9bcf443cd\"\n  dependencies:\n    pseudomap \"^1.0.2\"\n    yallist \"^2.1.2\"\n\nlru-cache@^5.1.1:\n  version \"5.1.1\"\n  resolved \"https://registry.yarnpkg.com/lru-cache/-/lru-cache-5.1.1.tgz#1da27e6710271947695daf6848e847f01d84b920\"\n  dependencies:\n    yallist \"^3.0.2\"\n\nmake-dir@^1.0.0:\n  version \"1.3.0\"\n  resolved \"https://registry.yarnpkg.com/make-dir/-/make-dir-1.3.0.tgz#79c1033b80515bd6d24ec9933e860ca75ee27f0c\"\n  dependencies:\n    pify \"^3.0.0\"\n\nmamacro@^0.0.3:\n  version \"0.0.3\"\n  resolved \"https://registry.yarnpkg.com/mamacro/-/mamacro-0.0.3.tgz#ad2c9576197c9f1abf308d0787865bd975a3f3e4\"\n\nmap-age-cleaner@^0.1.1:\n  version \"0.1.3\"\n  resolved \"https://registry.yarnpkg.com/map-age-cleaner/-/map-age-cleaner-0.1.3.tgz#7d583a7306434c055fe474b0f45078e6e1b4b92a\"\n  dependencies:\n    p-defer \"^1.0.0\"\n\nmap-cache@^0.2.2:\n  version \"0.2.2\"\n  resolved \"https://registry.yarnpkg.com/map-cache/-/map-cache-0.2.2.tgz#c32abd0bd6525d9b051645bb4f26ac5dc98a0dbf\"\n\nmap-obj@^1.0.0, map-obj@^1.0.1:\n  version \"1.0.1\"\n  resolved \"https://registry.yarnpkg.com/map-obj/-/map-obj-1.0.1.tgz#d933ceb9205d82bdcf4886f6742bdc2b4dea146d\"\n\nmap-visit@^1.0.0:\n  version \"1.0.0\"\n  resolved \"https://registry.yarnpkg.com/map-visit/-/map-visit-1.0.0.tgz#ecdca8f13144e660f1b5bd41f12f3479d98dfb8f\"\n  dependencies:\n    object-visit \"^1.0.0\"\n\nmd5.js@^1.3.4:\n  version \"1.3.5\"\n  resolved \"https://registry.yarnpkg.com/md5.js/-/md5.js-1.3.5.tgz#b5d07b8e3216e3e27cd728d72f70d1e6a342005f\"\n  dependencies:\n    hash-base \"^3.0.0\"\n    inherits \"^2.0.1\"\n    safe-buffer \"^5.1.2\"\n\nmdn-data@~1.1.0:\n  version \"1.1.4\"\n  resolved \"https://registry.yarnpkg.com/mdn-data/-/mdn-data-1.1.4.tgz#50b5d4ffc4575276573c4eedb8780812a8419f01\"\n\nmedia-typer@0.3.0:\n  version \"0.3.0\"\n  resolved \"https://registry.yarnpkg.com/media-typer/-/media-typer-0.3.0.tgz#8710d7af0aa626f8fffa1ce00168545263255748\"\n\nmem@^1.1.0:\n  version \"1.1.0\"\n  resolved \"https://registry.yarnpkg.com/mem/-/mem-1.1.0.tgz#5edd52b485ca1d900fe64895505399a0dfa45f76\"\n  dependencies:\n    mimic-fn \"^1.0.0\"\n\nmem@^4.0.0:\n  version \"4.1.0\"\n  resolved \"https://registry.yarnpkg.com/mem/-/mem-4.1.0.tgz#aeb9be2d21f47e78af29e4ac5978e8afa2ca5b8a\"\n  dependencies:\n    map-age-cleaner \"^0.1.1\"\n    mimic-fn \"^1.0.0\"\n    p-is-promise \"^2.0.0\"\n\nmemory-fs@^0.4.0, memory-fs@^0.4.1, memory-fs@~0.4.1:\n  version \"0.4.1\"\n  resolved \"https://registry.yarnpkg.com/memory-fs/-/memory-fs-0.4.1.tgz#3a9a20b8462523e447cfbc7e8bb80ed667bfc552\"\n  dependencies:\n    errno \"^0.1.3\"\n    readable-stream \"^2.0.1\"\n\nmeow@^3.7.0:\n  version \"3.7.0\"\n  resolved \"https://registry.yarnpkg.com/meow/-/meow-3.7.0.tgz#72cb668b425228290abbfa856892587308a801fb\"\n  dependencies:\n    camelcase-keys \"^2.0.0\"\n    decamelize \"^1.1.2\"\n    loud-rejection \"^1.0.0\"\n    map-obj \"^1.0.1\"\n    minimist \"^1.1.3\"\n    normalize-package-data \"^2.3.4\"\n    object-assign \"^4.0.1\"\n    read-pkg-up \"^1.0.1\"\n    redent \"^1.0.0\"\n    trim-newlines \"^1.0.0\"\n\nmerge-defaults@^0.2.1:\n  version \"0.2.1\"\n  resolved \"https://registry.yarnpkg.com/merge-defaults/-/merge-defaults-0.2.1.tgz#dd42248eb96bb6a51521724321c72ff9583dde80\"\n  dependencies:\n    lodash \"~2.4.1\"\n\nmerge-descriptors@1.0.1:\n  version \"1.0.1\"\n  resolved \"https://registry.yarnpkg.com/merge-descriptors/-/merge-descriptors-1.0.1.tgz#b00aaa556dd8b44568150ec9d1b953f3f90cbb61\"\n\nmerge2@^1.2.3:\n  version \"1.2.3\"\n  resolved \"https://registry.yarnpkg.com/merge2/-/merge2-1.2.3.tgz#7ee99dbd69bb6481689253f018488a1b902b0ed5\"\n\nmethods@~1.1.2:\n  version \"1.1.2\"\n  resolved \"https://registry.yarnpkg.com/methods/-/methods-1.1.2.tgz#5529a4d67654134edcc5266656835b0f851afcee\"\n\nmicromatch@^3.0.4, micromatch@^3.1.10, micromatch@^3.1.4, micromatch@^3.1.8:\n  version \"3.1.10\"\n  resolved \"https://registry.yarnpkg.com/micromatch/-/micromatch-3.1.10.tgz#70859bc95c9840952f359a068a3fc49f9ecfac23\"\n  dependencies:\n    arr-diff \"^4.0.0\"\n    array-unique \"^0.3.2\"\n    braces \"^2.3.1\"\n    define-property \"^2.0.2\"\n    extend-shallow \"^3.0.2\"\n    extglob \"^2.0.4\"\n    fragment-cache \"^0.2.1\"\n    kind-of \"^6.0.2\"\n    nanomatch \"^1.2.9\"\n    object.pick \"^1.3.0\"\n    regex-not \"^1.0.0\"\n    snapdragon \"^0.8.1\"\n    to-regex \"^3.0.2\"\n\nmicromatch@^4.0.0:\n  version \"4.0.2\"\n  resolved \"https://registry.yarnpkg.com/micromatch/-/micromatch-4.0.2.tgz#4fcb0999bf9fbc2fcbdd212f6d629b9a56c39259\"\n  dependencies:\n    braces \"^3.0.1\"\n    picomatch \"^2.0.5\"\n\nmiller-rabin@^4.0.0:\n  version \"4.0.1\"\n  resolved \"https://registry.yarnpkg.com/miller-rabin/-/miller-rabin-4.0.1.tgz#f080351c865b0dc562a8462966daa53543c78a4d\"\n  dependencies:\n    bn.js \"^4.0.0\"\n    brorand \"^1.0.1\"\n\n\"mime-db@>= 1.38.0 < 2\", mime-db@~1.38.0:\n  version \"1.38.0\"\n  resolved \"https://registry.yarnpkg.com/mime-db/-/mime-db-1.38.0.tgz#1a2aab16da9eb167b49c6e4df2d9c68d63d8e2ad\"\n\nmime-types@^2.1.12, mime-types@~2.1.17, mime-types@~2.1.18, mime-types@~2.1.19:\n  version \"2.1.22\"\n  resolved \"https://registry.yarnpkg.com/mime-types/-/mime-types-2.1.22.tgz#fe6b355a190926ab7698c9a0556a11199b2199bd\"\n  dependencies:\n    mime-db \"~1.38.0\"\n\nmime@1.4.1:\n  version \"1.4.1\"\n  resolved \"https://registry.yarnpkg.com/mime/-/mime-1.4.1.tgz#121f9ebc49e3766f311a76e1fa1c8003c4b03aa6\"\n\nmime@^1.3.4:\n  version \"1.6.0\"\n  resolved \"https://registry.yarnpkg.com/mime/-/mime-1.6.0.tgz#32cd9e5c64553bd58d19a568af452acff04981b1\"\n\nmime@^2.3.1:\n  version \"2.4.0\"\n  resolved \"https://registry.yarnpkg.com/mime/-/mime-2.4.0.tgz#e051fd881358585f3279df333fe694da0bcffdd6\"\n\nmimic-fn@^1.0.0:\n  version \"1.2.0\"\n  resolved \"https://registry.yarnpkg.com/mimic-fn/-/mimic-fn-1.2.0.tgz#820c86a39334640e99516928bd03fca88057d022\"\n\nmin-document@^2.19.0:\n  version \"2.19.0\"\n  resolved \"https://registry.yarnpkg.com/min-document/-/min-document-2.19.0.tgz#7bd282e3f5842ed295bb748cdd9f1ffa2c824685\"\n  dependencies:\n    dom-walk \"^0.1.0\"\n\n\"mini-css-extract-plugin@>=0.4.0 <0.4.3\":\n  version \"0.4.2\"\n  resolved \"https://registry.yarnpkg.com/mini-css-extract-plugin/-/mini-css-extract-plugin-0.4.2.tgz#b3ecc0d6b1bbe5ff14add42b946a7b200cf78651\"\n  dependencies:\n    loader-utils \"^1.1.0\"\n    schema-utils \"^1.0.0\"\n    webpack-sources \"^1.1.0\"\n\nminimalistic-assert@^1.0.0, minimalistic-assert@^1.0.1:\n  version \"1.0.1\"\n  resolved \"https://registry.yarnpkg.com/minimalistic-assert/-/minimalistic-assert-1.0.1.tgz#2e194de044626d4a10e7f7fbc00ce73e83e4d5c7\"\n\nminimalistic-crypto-utils@^1.0.0, minimalistic-crypto-utils@^1.0.1:\n  version \"1.0.1\"\n  resolved \"https://registry.yarnpkg.com/minimalistic-crypto-utils/-/minimalistic-crypto-utils-1.0.1.tgz#f6c00c1c0b082246e5c4d99dfb8c7c083b2b582a\"\n\nminimatch@^3.0.4, minimatch@~3.0.2:\n  version \"3.0.4\"\n  resolved \"https://registry.yarnpkg.com/minimatch/-/minimatch-3.0.4.tgz#5166e286457f03306064be5497e8dbb0c3d32083\"\n  dependencies:\n    brace-expansion \"^1.1.7\"\n\nminimist@0.0.8:\n  version \"0.0.8\"\n  resolved \"https://registry.yarnpkg.com/minimist/-/minimist-0.0.8.tgz#857fcabfc3397d2625b8228262e86aa7a011b05d\"\n\nminimist@^1.1.3, minimist@^1.2.0:\n  version \"1.2.0\"\n  resolved \"https://registry.yarnpkg.com/minimist/-/minimist-1.2.0.tgz#a35008b20f41383eec1fb914f4cd5df79a264284\"\n\nminipass@^2.2.1, minipass@^2.3.4:\n  version \"2.3.5\"\n  resolved \"https://registry.yarnpkg.com/minipass/-/minipass-2.3.5.tgz#cacebe492022497f656b0f0f51e2682a9ed2d848\"\n  dependencies:\n    safe-buffer \"^5.1.2\"\n    yallist \"^3.0.0\"\n\nminizlib@^1.1.1:\n  version \"1.2.1\"\n  resolved \"https://registry.yarnpkg.com/minizlib/-/minizlib-1.2.1.tgz#dd27ea6136243c7c880684e8672bb3a45fd9b614\"\n  dependencies:\n    minipass \"^2.2.1\"\n\nmississippi@^3.0.0:\n  version \"3.0.0\"\n  resolved \"https://registry.yarnpkg.com/mississippi/-/mississippi-3.0.0.tgz#ea0a3291f97e0b5e8776b363d5f0a12d94c67022\"\n  dependencies:\n    concat-stream \"^1.5.0\"\n    duplexify \"^3.4.2\"\n    end-of-stream \"^1.1.0\"\n    flush-write-stream \"^1.0.0\"\n    from2 \"^2.1.0\"\n    parallel-transform \"^1.1.0\"\n    pump \"^3.0.0\"\n    pumpify \"^1.3.3\"\n    stream-each \"^1.1.0\"\n    through2 \"^2.0.0\"\n\nmixin-deep@^1.2.0:\n  version \"1.3.2\"\n  resolved \"https://registry.yarnpkg.com/mixin-deep/-/mixin-deep-1.3.2.tgz#1120b43dc359a785dce65b55b82e257ccf479566\"\n  integrity sha512-WRoDn//mXBiJ1H40rqa3vH0toePwSsGb45iInWlTySa+Uu4k3tYUSxa2v1KqAiLtvlrSzaExqS1gtk96A9zvEA==\n  dependencies:\n    for-in \"^1.0.2\"\n    is-extendable \"^1.0.1\"\n\nmixin-object@^2.0.1:\n  version \"2.0.1\"\n  resolved \"https://registry.yarnpkg.com/mixin-object/-/mixin-object-2.0.1.tgz#4fb949441dab182540f1fe035ba60e1947a5e57e\"\n  dependencies:\n    for-in \"^0.1.3\"\n    is-extendable \"^0.1.1\"\n\nmkdirp@0.5.1, mkdirp@0.5.x, \"mkdirp@>=0.5 0\", mkdirp@^0.5.0, mkdirp@^0.5.1, mkdirp@~0.5.0, mkdirp@~0.5.1:\n  version \"0.5.1\"\n  resolved \"https://registry.yarnpkg.com/mkdirp/-/mkdirp-0.5.1.tgz#30057438eac6cf7f8c4767f38648d6697d75c903\"\n  dependencies:\n    minimist \"0.0.8\"\n\nmousetrap@^1.6.2:\n  version \"1.6.2\"\n  resolved \"https://registry.yarnpkg.com/mousetrap/-/mousetrap-1.6.2.tgz#caadd9cf886db0986fb2fee59a82f6bd37527587\"\n\nmove-concurrently@^1.0.1:\n  version \"1.0.1\"\n  resolved \"https://registry.yarnpkg.com/move-concurrently/-/move-concurrently-1.0.1.tgz#be2c005fda32e0b29af1f05d7c4b33214c701f92\"\n  dependencies:\n    aproba \"^1.1.1\"\n    copy-concurrently \"^1.0.0\"\n    fs-write-stream-atomic \"^1.0.8\"\n    mkdirp \"^0.5.1\"\n    rimraf \"^2.5.4\"\n    run-queue \"^1.0.3\"\n\nms@0.7.1:\n  version \"0.7.1\"\n  resolved \"https://registry.yarnpkg.com/ms/-/ms-0.7.1.tgz#9cd13c03adbff25b65effde7ce864ee952017098\"\n\nms@2.0.0:\n  version \"2.0.0\"\n  resolved \"https://registry.yarnpkg.com/ms/-/ms-2.0.0.tgz#5608aeadfc00be6c2901df5f9861788de0d597c8\"\n\nms@^2.1.1:\n  version \"2.1.1\"\n  resolved \"https://registry.yarnpkg.com/ms/-/ms-2.1.1.tgz#30a5864eb3ebb0a66f2ebe6d727af06a09d86e0a\"\n\nmulticast-dns-service-types@^1.1.0:\n  version \"1.1.0\"\n  resolved \"https://registry.yarnpkg.com/multicast-dns-service-types/-/multicast-dns-service-types-1.1.0.tgz#899f11d9686e5e05cb91b35d5f0e63b773cfc901\"\n\nmulticast-dns@^6.0.1:\n  version \"6.2.3\"\n  resolved \"https://registry.yarnpkg.com/multicast-dns/-/multicast-dns-6.2.3.tgz#a0ec7bd9055c4282f790c3c82f4e28db3b31b229\"\n  dependencies:\n    dns-packet \"^1.3.1\"\n    thunky \"^1.0.2\"\n\nmusickit-typescript@^1.2.4:\n  version \"1.2.4\"\n  resolved \"https://registry.yarnpkg.com/musickit-typescript/-/musickit-typescript-1.2.4.tgz#d055117e2c897c4ebc570f0d969ad31649744837\"\n\nnan@^2.13.2:\n  version \"2.14.1\"\n  resolved \"https://registry.yarnpkg.com/nan/-/nan-2.14.1.tgz#d7be34dfa3105b91494c3147089315eff8874b01\"\n  integrity sha512-isWHgVjnFjh2x2yuJ/tj3JbwoHu3UC2dX5G/88Cm24yB6YopVgxvBObDY7n5xW6ExmFhJpSEQqFPvq9zaXc8Jw==\n\nnan@^2.9.2:\n  version \"2.12.1\"\n  resolved \"https://registry.yarnpkg.com/nan/-/nan-2.12.1.tgz#7b1aa193e9aa86057e3c7bbd0ac448e770925552\"\n\nnanomatch@^1.2.9:\n  version \"1.2.13\"\n  resolved \"https://registry.yarnpkg.com/nanomatch/-/nanomatch-1.2.13.tgz#b87a8aa4fc0de8fe6be88895b38983ff265bd119\"\n  dependencies:\n    arr-diff \"^4.0.0\"\n    array-unique \"^0.3.2\"\n    define-property \"^2.0.2\"\n    extend-shallow \"^3.0.2\"\n    fragment-cache \"^0.2.1\"\n    is-windows \"^1.0.2\"\n    kind-of \"^6.0.2\"\n    object.pick \"^1.3.0\"\n    regex-not \"^1.0.0\"\n    snapdragon \"^0.8.1\"\n    to-regex \"^3.0.1\"\n\nneedle@^2.2.1:\n  version \"2.2.4\"\n  resolved \"https://registry.yarnpkg.com/needle/-/needle-2.2.4.tgz#51931bff82533b1928b7d1d69e01f1b00ffd2a4e\"\n  dependencies:\n    debug \"^2.1.2\"\n    iconv-lite \"^0.4.4\"\n    sax \"^1.2.4\"\n\nnegotiator@0.6.1:\n  version \"0.6.1\"\n  resolved \"https://registry.yarnpkg.com/negotiator/-/negotiator-0.6.1.tgz#2b327184e8992101177b28563fb5e7102acd0ca9\"\n\nneo-async@^2.5.0:\n  version \"2.6.0\"\n  resolved \"https://registry.yarnpkg.com/neo-async/-/neo-async-2.6.0.tgz#b9d15e4d71c6762908654b5183ed38b753340835\"\n\nnext-tick@^1.0.0:\n  version \"1.0.0\"\n  resolved \"https://registry.yarnpkg.com/next-tick/-/next-tick-1.0.0.tgz#ca86d1fe8828169b0120208e3dc8424b9db8342c\"\n\nnice-try@^1.0.4:\n  version \"1.0.5\"\n  resolved \"https://registry.yarnpkg.com/nice-try/-/nice-try-1.0.5.tgz#a3378a7696ce7d223e88fc9b764bd7ef1089e366\"\n\nno-case@^2.2.0:\n  version \"2.3.2\"\n  resolved \"https://registry.yarnpkg.com/no-case/-/no-case-2.3.2.tgz#60b813396be39b3f1288a4c1ed5d1e7d28b464ac\"\n  dependencies:\n    lower-case \"^1.1.1\"\n\nnode-forge@0.7.5:\n  version \"0.7.5\"\n  resolved \"https://registry.yarnpkg.com/node-forge/-/node-forge-0.7.5.tgz#6c152c345ce11c52f465c2abd957e8639cd674df\"\n\nnode-gyp@^3.8.0:\n  version \"3.8.0\"\n  resolved \"https://registry.yarnpkg.com/node-gyp/-/node-gyp-3.8.0.tgz#540304261c330e80d0d5edce253a68cb3964218c\"\n  dependencies:\n    fstream \"^1.0.0\"\n    glob \"^7.0.3\"\n    graceful-fs \"^4.1.2\"\n    mkdirp \"^0.5.0\"\n    nopt \"2 || 3\"\n    npmlog \"0 || 1 || 2 || 3 || 4\"\n    osenv \"0\"\n    request \"^2.87.0\"\n    rimraf \"2\"\n    semver \"~5.3.0\"\n    tar \"^2.0.0\"\n    which \"1\"\n\nnode-libs-browser@^2.0.0:\n  version \"2.2.0\"\n  resolved \"https://registry.yarnpkg.com/node-libs-browser/-/node-libs-browser-2.2.0.tgz#c72f60d9d46de08a940dedbb25f3ffa2f9bbaa77\"\n  dependencies:\n    assert \"^1.1.1\"\n    browserify-zlib \"^0.2.0\"\n    buffer \"^4.3.0\"\n    console-browserify \"^1.1.0\"\n    constants-browserify \"^1.0.0\"\n    crypto-browserify \"^3.11.0\"\n    domain-browser \"^1.1.1\"\n    events \"^3.0.0\"\n    https-browserify \"^1.0.0\"\n    os-browserify \"^0.3.0\"\n    path-browserify \"0.0.0\"\n    process \"^0.11.10\"\n    punycode \"^1.2.4\"\n    querystring-es3 \"^0.2.0\"\n    readable-stream \"^2.3.3\"\n    stream-browserify \"^2.0.1\"\n    stream-http \"^2.7.2\"\n    string_decoder \"^1.0.0\"\n    timers-browserify \"^2.0.4\"\n    tty-browserify \"0.0.0\"\n    url \"^0.11.0\"\n    util \"^0.11.0\"\n    vm-browserify \"0.0.4\"\n\nnode-pre-gyp@^0.10.0:\n  version \"0.10.3\"\n  resolved \"https://registry.yarnpkg.com/node-pre-gyp/-/node-pre-gyp-0.10.3.tgz#3070040716afdc778747b61b6887bf78880b80fc\"\n  dependencies:\n    detect-libc \"^1.0.2\"\n    mkdirp \"^0.5.1\"\n    needle \"^2.2.1\"\n    nopt \"^4.0.1\"\n    npm-packlist \"^1.1.6\"\n    npmlog \"^4.0.2\"\n    rc \"^1.2.7\"\n    rimraf \"^2.6.1\"\n    semver \"^5.3.0\"\n    tar \"^4\"\n\nnode-releases@^1.1.19:\n  version \"1.1.21\"\n  resolved \"https://registry.yarnpkg.com/node-releases/-/node-releases-1.1.21.tgz#46c86f9adaceae4d63c75d3c2f2e6eee618e55f3\"\n  dependencies:\n    semver \"^5.3.0\"\n\nnode-releases@^1.1.8:\n  version \"1.1.8\"\n  resolved \"https://registry.yarnpkg.com/node-releases/-/node-releases-1.1.8.tgz#32a63fff63c5e51b7e0f540ac95947d220fc6862\"\n  dependencies:\n    semver \"^5.3.0\"\n\nnode-rest-client@^1.5.1:\n  version \"1.8.0\"\n  resolved \"https://registry.yarnpkg.com/node-rest-client/-/node-rest-client-1.8.0.tgz#8d3c566b817e27394cb7273783a41caefe3e5955\"\n  dependencies:\n    debug \"~2.2.0\"\n    xml2js \">=0.2.4\"\n\nnode-sass@^4.14.1:\n  version \"4.14.1\"\n  resolved \"https://registry.yarnpkg.com/node-sass/-/node-sass-4.14.1.tgz#99c87ec2efb7047ed638fb4c9db7f3a42e2217b5\"\n  integrity sha512-sjCuOlvGyCJS40R8BscF5vhVlQjNN069NtQ1gSxyK1u9iqvn6tf7O1R4GNowVZfiZUCRt5MmMs1xd+4V/7Yr0g==\n  dependencies:\n    async-foreach \"^0.1.3\"\n    chalk \"^1.1.1\"\n    cross-spawn \"^3.0.0\"\n    gaze \"^1.0.0\"\n    get-stdin \"^4.0.1\"\n    glob \"^7.0.3\"\n    in-publish \"^2.0.0\"\n    lodash \"^4.17.15\"\n    meow \"^3.7.0\"\n    mkdirp \"^0.5.1\"\n    nan \"^2.13.2\"\n    node-gyp \"^3.8.0\"\n    npmlog \"^4.0.0\"\n    request \"^2.88.0\"\n    sass-graph \"2.2.5\"\n    stdout-stream \"^1.4.0\"\n    \"true-case-path\" \"^1.0.2\"\n\n\"nopt@2 || 3\":\n  version \"3.0.6\"\n  resolved \"https://registry.yarnpkg.com/nopt/-/nopt-3.0.6.tgz#c6465dbf08abcd4db359317f79ac68a646b28ff9\"\n  dependencies:\n    abbrev \"1\"\n\nnopt@^4.0.1:\n  version \"4.0.1\"\n  resolved \"https://registry.yarnpkg.com/nopt/-/nopt-4.0.1.tgz#d0d4685afd5415193c8c7505602d0d17cd64474d\"\n  dependencies:\n    abbrev \"1\"\n    osenv \"^0.1.4\"\n\nnormalize-package-data@^2.3.2, normalize-package-data@^2.3.4:\n  version \"2.5.0\"\n  resolved \"https://registry.yarnpkg.com/normalize-package-data/-/normalize-package-data-2.5.0.tgz#e66db1838b200c1dfc233225d12cb36520e234a8\"\n  dependencies:\n    hosted-git-info \"^2.1.4\"\n    resolve \"^1.10.0\"\n    semver \"2 || 3 || 4 || 5\"\n    validate-npm-package-license \"^3.0.1\"\n\nnormalize-path@^2.1.1:\n  version \"2.1.1\"\n  resolved \"https://registry.yarnpkg.com/normalize-path/-/normalize-path-2.1.1.tgz#1ab28b556e198363a8c1a6f7e6fa20137fe6aed9\"\n  dependencies:\n    remove-trailing-separator \"^1.0.1\"\n\nnormalize-path@^3.0.0:\n  version \"3.0.0\"\n  resolved \"https://registry.yarnpkg.com/normalize-path/-/normalize-path-3.0.0.tgz#0dcd69ff23a1c9b11fd0978316644a0388216a65\"\n\nnormalize-url@^3.0.0:\n  version \"3.3.0\"\n  resolved \"https://registry.yarnpkg.com/normalize-url/-/normalize-url-3.3.0.tgz#b2e1c4dc4f7c6d57743df733a4f5978d18650559\"\n\nnormalize.css@^8.0.1:\n  version \"8.0.1\"\n  resolved \"https://registry.yarnpkg.com/normalize.css/-/normalize.css-8.0.1.tgz#9b98a208738b9cc2634caacbc42d131c97487bf3\"\n\nnpm-bundled@^1.0.1:\n  version \"1.0.6\"\n  resolved \"https://registry.yarnpkg.com/npm-bundled/-/npm-bundled-1.0.6.tgz#e7ba9aadcef962bb61248f91721cd932b3fe6bdd\"\n\nnpm-packlist@^1.1.6:\n  version \"1.4.1\"\n  resolved \"https://registry.yarnpkg.com/npm-packlist/-/npm-packlist-1.4.1.tgz#19064cdf988da80ea3cee45533879d90192bbfbc\"\n  dependencies:\n    ignore-walk \"^3.0.1\"\n    npm-bundled \"^1.0.1\"\n\nnpm-run-path@^2.0.0:\n  version \"2.0.2\"\n  resolved \"https://registry.yarnpkg.com/npm-run-path/-/npm-run-path-2.0.2.tgz#35a9232dfa35d7067b4cb2ddf2357b1871536c5f\"\n  dependencies:\n    path-key \"^2.0.0\"\n\n\"npmlog@0 || 1 || 2 || 3 || 4\", npmlog@^4.0.0, npmlog@^4.0.2:\n  version \"4.1.2\"\n  resolved \"https://registry.yarnpkg.com/npmlog/-/npmlog-4.1.2.tgz#08a7f2a8bf734604779a9efa4ad5cc717abb954b\"\n  dependencies:\n    are-we-there-yet \"~1.1.2\"\n    console-control-strings \"~1.1.0\"\n    gauge \"~2.7.3\"\n    set-blocking \"~2.0.0\"\n\nnth-check@^1.0.2, nth-check@~1.0.0, nth-check@~1.0.1:\n  version \"1.0.2\"\n  resolved \"https://registry.yarnpkg.com/nth-check/-/nth-check-1.0.2.tgz#b2bd295c37e3dd58a3bf0700376663ba4d9cf05c\"\n  dependencies:\n    boolbase \"~1.0.0\"\n\nnumber-is-nan@^1.0.0:\n  version \"1.0.1\"\n  resolved \"https://registry.yarnpkg.com/number-is-nan/-/number-is-nan-1.0.1.tgz#097b602b53422a522c1afb8790318336941a011d\"\n\noauth-sign@~0.9.0:\n  version \"0.9.0\"\n  resolved \"https://registry.yarnpkg.com/oauth-sign/-/oauth-sign-0.9.0.tgz#47a7b016baa68b5fa0ecf3dee08a85c679ac6455\"\n\nobject-assign@^4.0.1, object-assign@^4.1.0, object-assign@^4.1.1:\n  version \"4.1.1\"\n  resolved \"https://registry.yarnpkg.com/object-assign/-/object-assign-4.1.1.tgz#2109adc7965887cfc05cbbd442cac8bfbb360863\"\n\nobject-copy@^0.1.0:\n  version \"0.1.0\"\n  resolved \"https://registry.yarnpkg.com/object-copy/-/object-copy-0.1.0.tgz#7e7d858b781bd7c991a41ba975ed3812754e998c\"\n  dependencies:\n    copy-descriptor \"^0.1.0\"\n    define-property \"^0.2.5\"\n    kind-of \"^3.0.3\"\n\nobject-keys@^1.0.12:\n  version \"1.1.0\"\n  resolved \"https://registry.yarnpkg.com/object-keys/-/object-keys-1.1.0.tgz#11bd22348dd2e096a045ab06f6c85bcc340fa032\"\n\nobject-path@0.11.4:\n  version \"0.11.4\"\n  resolved \"https://registry.yarnpkg.com/object-path/-/object-path-0.11.4.tgz#370ae752fbf37de3ea70a861c23bba8915691949\"\n\nobject-visit@^1.0.0:\n  version \"1.0.1\"\n  resolved \"https://registry.yarnpkg.com/object-visit/-/object-visit-1.0.1.tgz#f79c4493af0c5377b59fe39d395e41042dd045bb\"\n  dependencies:\n    isobject \"^3.0.0\"\n\nobject.getownpropertydescriptors@^2.0.3:\n  version \"2.0.3\"\n  resolved \"https://registry.yarnpkg.com/object.getownpropertydescriptors/-/object.getownpropertydescriptors-2.0.3.tgz#8758c846f5b407adab0f236e0986f14b051caa16\"\n  dependencies:\n    define-properties \"^1.1.2\"\n    es-abstract \"^1.5.1\"\n\nobject.pick@^1.3.0:\n  version \"1.3.0\"\n  resolved \"https://registry.yarnpkg.com/object.pick/-/object.pick-1.3.0.tgz#87a10ac4c1694bd2e1cbf53591a66141fb5dd747\"\n  dependencies:\n    isobject \"^3.0.1\"\n\nobject.values@^1.1.0:\n  version \"1.1.0\"\n  resolved \"https://registry.yarnpkg.com/object.values/-/object.values-1.1.0.tgz#bf6810ef5da3e5325790eaaa2be213ea84624da9\"\n  dependencies:\n    define-properties \"^1.1.3\"\n    es-abstract \"^1.12.0\"\n    function-bind \"^1.1.1\"\n    has \"^1.0.3\"\n\nobuf@^1.0.0, obuf@^1.1.2:\n  version \"1.1.2\"\n  resolved \"https://registry.yarnpkg.com/obuf/-/obuf-1.1.2.tgz#09bea3343d41859ebd446292d11c9d4db619084e\"\n\non-finished@~2.3.0:\n  version \"2.3.0\"\n  resolved \"https://registry.yarnpkg.com/on-finished/-/on-finished-2.3.0.tgz#20f1336481b083cd75337992a16971aa2d906947\"\n  dependencies:\n    ee-first \"1.1.1\"\n\non-headers@~1.0.1:\n  version \"1.0.2\"\n  resolved \"https://registry.yarnpkg.com/on-headers/-/on-headers-1.0.2.tgz#772b0ae6aaa525c399e489adfad90c403eb3c28f\"\n\nonce@^1.3.0, once@^1.3.1, once@^1.4.0:\n  version \"1.4.0\"\n  resolved \"https://registry.yarnpkg.com/once/-/once-1.4.0.tgz#583b1aa775961d4b113ac17d9c50baef9dd76bd1\"\n  dependencies:\n    wrappy \"1\"\n\nopn@^5.1.0:\n  version \"5.4.0\"\n  resolved \"https://registry.yarnpkg.com/opn/-/opn-5.4.0.tgz#cb545e7aab78562beb11aa3bfabc7042e1761035\"\n  dependencies:\n    is-wsl \"^1.1.0\"\n\noptimize-css-assets-webpack-plugin@^5.0.1:\n  version \"5.0.1\"\n  resolved \"https://registry.yarnpkg.com/optimize-css-assets-webpack-plugin/-/optimize-css-assets-webpack-plugin-5.0.1.tgz#9eb500711d35165b45e7fd60ba2df40cb3eb9159\"\n  dependencies:\n    cssnano \"^4.1.0\"\n    last-call-webpack-plugin \"^3.0.0\"\n\noriginal@^1.0.0:\n  version \"1.0.2\"\n  resolved \"https://registry.yarnpkg.com/original/-/original-1.0.2.tgz#e442a61cffe1c5fd20a65f3261c26663b303f25f\"\n  dependencies:\n    url-parse \"^1.4.3\"\n\nos-browserify@^0.3.0:\n  version \"0.3.0\"\n  resolved \"https://registry.yarnpkg.com/os-browserify/-/os-browserify-0.3.0.tgz#854373c7f5c2315914fc9bfc6bd8238fdda1ec27\"\n\nos-homedir@^1.0.0:\n  version \"1.0.2\"\n  resolved \"https://registry.yarnpkg.com/os-homedir/-/os-homedir-1.0.2.tgz#ffbc4988336e0e833de0c168c7ef152121aa7fb3\"\n\nos-locale@^1.4.0:\n  version \"1.4.0\"\n  resolved \"https://registry.yarnpkg.com/os-locale/-/os-locale-1.4.0.tgz#20f9f17ae29ed345e8bde583b13d2009803c14d9\"\n  dependencies:\n    lcid \"^1.0.0\"\n\nos-locale@^2.0.0:\n  version \"2.1.0\"\n  resolved \"https://registry.yarnpkg.com/os-locale/-/os-locale-2.1.0.tgz#42bc2900a6b5b8bd17376c8e882b65afccf24bf2\"\n  dependencies:\n    execa \"^0.7.0\"\n    lcid \"^1.0.0\"\n    mem \"^1.1.0\"\n\nos-locale@^3.0.0:\n  version \"3.1.0\"\n  resolved \"https://registry.yarnpkg.com/os-locale/-/os-locale-3.1.0.tgz#a802a6ee17f24c10483ab9935719cef4ed16bf1a\"\n  dependencies:\n    execa \"^1.0.0\"\n    lcid \"^2.0.0\"\n    mem \"^4.0.0\"\n\nos-tmpdir@^1.0.0, os-tmpdir@~1.0.2:\n  version \"1.0.2\"\n  resolved \"https://registry.yarnpkg.com/os-tmpdir/-/os-tmpdir-1.0.2.tgz#bbe67406c79aa85c5cfec766fe5734555dfa1274\"\n\nosenv@0, osenv@^0.1.4:\n  version \"0.1.5\"\n  resolved \"https://registry.yarnpkg.com/osenv/-/osenv-0.1.5.tgz#85cdfafaeb28e8677f416e287592b5f3f49ea410\"\n  dependencies:\n    os-homedir \"^1.0.0\"\n    os-tmpdir \"^1.0.0\"\n\np-defer@^1.0.0:\n  version \"1.0.0\"\n  resolved \"https://registry.yarnpkg.com/p-defer/-/p-defer-1.0.0.tgz#9f6eb182f6c9aa8cd743004a7d4f96b196b0fb0c\"\n\np-finally@^1.0.0:\n  version \"1.0.0\"\n  resolved \"https://registry.yarnpkg.com/p-finally/-/p-finally-1.0.0.tgz#3fbcfb15b899a44123b34b6dcc18b724336a2cae\"\n\np-is-promise@^2.0.0:\n  version \"2.0.0\"\n  resolved \"https://registry.yarnpkg.com/p-is-promise/-/p-is-promise-2.0.0.tgz#7554e3d572109a87e1f3f53f6a7d85d1b194f4c5\"\n\np-limit@^1.1.0:\n  version \"1.3.0\"\n  resolved \"https://registry.yarnpkg.com/p-limit/-/p-limit-1.3.0.tgz#b86bd5f0c25690911c7590fcbfc2010d54b3ccb8\"\n  dependencies:\n    p-try \"^1.0.0\"\n\np-limit@^2.0.0:\n  version \"2.1.0\"\n  resolved \"https://registry.yarnpkg.com/p-limit/-/p-limit-2.1.0.tgz#1d5a0d20fb12707c758a655f6bbc4386b5930d68\"\n  dependencies:\n    p-try \"^2.0.0\"\n\np-locate@^2.0.0:\n  version \"2.0.0\"\n  resolved \"https://registry.yarnpkg.com/p-locate/-/p-locate-2.0.0.tgz#20a0103b222a70c8fd39cc2e580680f3dde5ec43\"\n  dependencies:\n    p-limit \"^1.1.0\"\n\np-locate@^3.0.0:\n  version \"3.0.0\"\n  resolved \"https://registry.yarnpkg.com/p-locate/-/p-locate-3.0.0.tgz#322d69a05c0264b25997d9f40cd8a891ab0064a4\"\n  dependencies:\n    p-limit \"^2.0.0\"\n\np-map@^1.1.1:\n  version \"1.2.0\"\n  resolved \"https://registry.yarnpkg.com/p-map/-/p-map-1.2.0.tgz#e4e94f311eabbc8633a1e79908165fca26241b6b\"\n\np-try@^1.0.0:\n  version \"1.0.0\"\n  resolved \"https://registry.yarnpkg.com/p-try/-/p-try-1.0.0.tgz#cbc79cdbaf8fd4228e13f621f2b1a237c1b207b3\"\n\np-try@^2.0.0:\n  version \"2.0.0\"\n  resolved \"https://registry.yarnpkg.com/p-try/-/p-try-2.0.0.tgz#85080bb87c64688fa47996fe8f7dfbe8211760b1\"\n\npako@~1.0.5:\n  version \"1.0.8\"\n  resolved \"https://registry.yarnpkg.com/pako/-/pako-1.0.8.tgz#6844890aab9c635af868ad5fecc62e8acbba3ea4\"\n\nparallel-transform@^1.1.0:\n  version \"1.1.0\"\n  resolved \"https://registry.yarnpkg.com/parallel-transform/-/parallel-transform-1.1.0.tgz#d410f065b05da23081fcd10f28854c29bda33b06\"\n  dependencies:\n    cyclist \"~0.2.2\"\n    inherits \"^2.0.3\"\n    readable-stream \"^2.1.5\"\n\nparam-case@2.1.x, param-case@^2.1.1:\n  version \"2.1.1\"\n  resolved \"https://registry.yarnpkg.com/param-case/-/param-case-2.1.1.tgz#df94fd8cf6531ecf75e6bef9a0858fbc72be2247\"\n  dependencies:\n    no-case \"^2.2.0\"\n\nparse-asn1@^5.0.0:\n  version \"5.1.4\"\n  resolved \"https://registry.yarnpkg.com/parse-asn1/-/parse-asn1-5.1.4.tgz#37f6628f823fbdeb2273b4d540434a22f3ef1fcc\"\n  dependencies:\n    asn1.js \"^4.0.0\"\n    browserify-aes \"^1.0.0\"\n    create-hash \"^1.1.0\"\n    evp_bytestokey \"^1.0.0\"\n    pbkdf2 \"^3.0.3\"\n    safe-buffer \"^5.1.1\"\n\nparse-bmfont-ascii@^1.0.3:\n  version \"1.0.6\"\n  resolved \"https://registry.yarnpkg.com/parse-bmfont-ascii/-/parse-bmfont-ascii-1.0.6.tgz#11ac3c3ff58f7c2020ab22769079108d4dfa0285\"\n\nparse-bmfont-binary@^1.0.5:\n  version \"1.0.6\"\n  resolved \"https://registry.yarnpkg.com/parse-bmfont-binary/-/parse-bmfont-binary-1.0.6.tgz#d038b476d3e9dd9db1e11a0b0e53a22792b69006\"\n\nparse-bmfont-xml@^1.1.4:\n  version \"1.1.4\"\n  resolved \"https://registry.yarnpkg.com/parse-bmfont-xml/-/parse-bmfont-xml-1.1.4.tgz#015319797e3e12f9e739c4d513872cd2fa35f389\"\n  dependencies:\n    xml-parse-from-string \"^1.0.0\"\n    xml2js \"^0.4.5\"\n\nparse-headers@^2.0.0:\n  version \"2.0.2\"\n  resolved \"https://registry.yarnpkg.com/parse-headers/-/parse-headers-2.0.2.tgz#9545e8a4c1ae5eaea7d24992bca890281ed26e34\"\n  dependencies:\n    for-each \"^0.3.3\"\n    string.prototype.trim \"^1.1.2\"\n\nparse-json@^2.2.0:\n  version \"2.2.0\"\n  resolved \"https://registry.yarnpkg.com/parse-json/-/parse-json-2.2.0.tgz#f480f40434ef80741f8469099f8dea18f55a4dc9\"\n  dependencies:\n    error-ex \"^1.2.0\"\n\nparse-json@^4.0.0:\n  version \"4.0.0\"\n  resolved \"https://registry.yarnpkg.com/parse-json/-/parse-json-4.0.0.tgz#be35f5425be1f7f6c747184f98a788cb99477ee0\"\n  dependencies:\n    error-ex \"^1.3.1\"\n    json-parse-better-errors \"^1.0.1\"\n\nparse-passwd@^1.0.0:\n  version \"1.0.0\"\n  resolved \"https://registry.yarnpkg.com/parse-passwd/-/parse-passwd-1.0.0.tgz#6d5b934a456993b23d37f40a382d6f1666a8e5c6\"\n\nparse-png@^1.0.0, parse-png@^1.1.1:\n  version \"1.1.2\"\n  resolved \"https://registry.yarnpkg.com/parse-png/-/parse-png-1.1.2.tgz#f5c2ad7c7993490986020a284c19aee459711ff2\"\n  dependencies:\n    pngjs \"^3.2.0\"\n\nparseurl@~1.3.2:\n  version \"1.3.2\"\n  resolved \"https://registry.yarnpkg.com/parseurl/-/parseurl-1.3.2.tgz#fc289d4ed8993119460c156253262cdc8de65bf3\"\n\npascalcase@^0.1.1:\n  version \"0.1.1\"\n  resolved \"https://registry.yarnpkg.com/pascalcase/-/pascalcase-0.1.1.tgz#b363e55e8006ca6fe21784d2db22bd15d7917f14\"\n\npath-browserify@0.0.0:\n  version \"0.0.0\"\n  resolved \"https://registry.yarnpkg.com/path-browserify/-/path-browserify-0.0.0.tgz#a0b870729aae214005b7d5032ec2cbbb0fb4451a\"\n\npath-dirname@^1.0.0:\n  version \"1.0.2\"\n  resolved \"https://registry.yarnpkg.com/path-dirname/-/path-dirname-1.0.2.tgz#cc33d24d525e099a5388c0336c6e32b9160609e0\"\n\npath-exists@^2.0.0:\n  version \"2.1.0\"\n  resolved \"https://registry.yarnpkg.com/path-exists/-/path-exists-2.1.0.tgz#0feb6c64f0fc518d9a754dd5efb62c7022761f4b\"\n  dependencies:\n    pinkie-promise \"^2.0.0\"\n\npath-exists@^3.0.0:\n  version \"3.0.0\"\n  resolved \"https://registry.yarnpkg.com/path-exists/-/path-exists-3.0.0.tgz#ce0ebeaa5f78cb18925ea7d810d7b59b010fd515\"\n\npath-is-absolute@^1.0.0:\n  version \"1.0.1\"\n  resolved \"https://registry.yarnpkg.com/path-is-absolute/-/path-is-absolute-1.0.1.tgz#174b9268735534ffbc7ace6bf53a5a9e1b5c5f5f\"\n\npath-is-inside@^1.0.1:\n  version \"1.0.2\"\n  resolved \"https://registry.yarnpkg.com/path-is-inside/-/path-is-inside-1.0.2.tgz#365417dede44430d1c11af61027facf074bdfc53\"\n\npath-key@^2.0.0, path-key@^2.0.1:\n  version \"2.0.1\"\n  resolved \"https://registry.yarnpkg.com/path-key/-/path-key-2.0.1.tgz#411cadb574c5a140d3a4b1910d40d80cc9f40b40\"\n\npath-parse@^1.0.6:\n  version \"1.0.6\"\n  resolved \"https://registry.yarnpkg.com/path-parse/-/path-parse-1.0.6.tgz#d62dbb5679405d72c4737ec58600e9ddcf06d24c\"\n\npath-to-regexp@0.1.7:\n  version \"0.1.7\"\n  resolved \"https://registry.yarnpkg.com/path-to-regexp/-/path-to-regexp-0.1.7.tgz#df604178005f522f15eb4490e7247a1bfaa67f8c\"\n\npath-to-regexp@^1.7.0:\n  version \"1.7.0\"\n  resolved \"https://registry.yarnpkg.com/path-to-regexp/-/path-to-regexp-1.7.0.tgz#59fde0f435badacba103a84e9d3bc64e96b9937d\"\n  dependencies:\n    isarray \"0.0.1\"\n\npath-type@^1.0.0:\n  version \"1.1.0\"\n  resolved \"https://registry.yarnpkg.com/path-type/-/path-type-1.1.0.tgz#59c44f7ee491da704da415da5a4070ba4f8fe441\"\n  dependencies:\n    graceful-fs \"^4.1.2\"\n    pify \"^2.0.0\"\n    pinkie-promise \"^2.0.0\"\n\npath-type@^3.0.0:\n  version \"3.0.0\"\n  resolved \"https://registry.yarnpkg.com/path-type/-/path-type-3.0.0.tgz#cef31dc8e0a1a3bb0d105c0cd97cf3bf47f4e36f\"\n  dependencies:\n    pify \"^3.0.0\"\n\npath@^0.12.7:\n  version \"0.12.7\"\n  resolved \"https://registry.yarnpkg.com/path/-/path-0.12.7.tgz#d4dc2a506c4ce2197eb481ebfcd5b36c0140b10f\"\n  dependencies:\n    process \"^0.11.1\"\n    util \"^0.10.3\"\n\npbkdf2@^3.0.3:\n  version \"3.0.17\"\n  resolved \"https://registry.yarnpkg.com/pbkdf2/-/pbkdf2-3.0.17.tgz#976c206530617b14ebb32114239f7b09336e93a6\"\n  dependencies:\n    create-hash \"^1.1.2\"\n    create-hmac \"^1.1.4\"\n    ripemd160 \"^2.0.1\"\n    safe-buffer \"^5.0.1\"\n    sha.js \"^2.4.8\"\n\npend@~1.2.0:\n  version \"1.2.0\"\n  resolved \"https://registry.yarnpkg.com/pend/-/pend-1.2.0.tgz#7a57eb550a6783f9115331fcf4663d5c8e007a50\"\n\nperformance-now@^2.1.0:\n  version \"2.1.0\"\n  resolved \"https://registry.yarnpkg.com/performance-now/-/performance-now-2.1.0.tgz#6309f4e0e5fa913ec1c69307ae364b4b377c9e7b\"\n\nphantomjs-prebuilt@^2.1.10:\n  version \"2.1.16\"\n  resolved \"https://registry.yarnpkg.com/phantomjs-prebuilt/-/phantomjs-prebuilt-2.1.16.tgz#efd212a4a3966d3647684ea8ba788549be2aefef\"\n  dependencies:\n    es6-promise \"^4.0.3\"\n    extract-zip \"^1.6.5\"\n    fs-extra \"^1.0.0\"\n    hasha \"^2.2.0\"\n    kew \"^0.7.0\"\n    progress \"^1.1.8\"\n    request \"^2.81.0\"\n    request-progress \"^2.0.1\"\n    which \"^1.2.10\"\n\nphin@^2.9.1:\n  version \"2.9.3\"\n  resolved \"https://registry.yarnpkg.com/phin/-/phin-2.9.3.tgz#f9b6ac10a035636fb65dfc576aaaa17b8743125c\"\n\npicomatch@^2.0.5:\n  version \"2.0.7\"\n  resolved \"https://registry.yarnpkg.com/picomatch/-/picomatch-2.0.7.tgz#514169d8c7cd0bdbeecc8a2609e34a7163de69f6\"\n\npify@^2.0.0:\n  version \"2.3.0\"\n  resolved \"https://registry.yarnpkg.com/pify/-/pify-2.3.0.tgz#ed141a6ac043a849ea588498e7dca8b15330e90c\"\n\npify@^3.0.0:\n  version \"3.0.0\"\n  resolved \"https://registry.yarnpkg.com/pify/-/pify-3.0.0.tgz#e5a4acd2c101fdf3d9a4d07f0dbc4db49dd28176\"\n\npinkie-promise@^2.0.0:\n  version \"2.0.1\"\n  resolved \"https://registry.yarnpkg.com/pinkie-promise/-/pinkie-promise-2.0.1.tgz#2135d6dfa7a358c069ac9b178776288228450ffa\"\n  dependencies:\n    pinkie \"^2.0.0\"\n\npinkie@^2.0.0:\n  version \"2.0.4\"\n  resolved \"https://registry.yarnpkg.com/pinkie/-/pinkie-2.0.4.tgz#72556b80cfa0d48a974e80e77248e80ed4f7f870\"\n\npixelmatch@^4.0.0:\n  version \"4.0.2\"\n  resolved \"https://registry.yarnpkg.com/pixelmatch/-/pixelmatch-4.0.2.tgz#8f47dcec5011b477b67db03c243bc1f3085e8854\"\n  dependencies:\n    pngjs \"^3.0.0\"\n\npkg-dir@^3.0.0:\n  version \"3.0.0\"\n  resolved \"https://registry.yarnpkg.com/pkg-dir/-/pkg-dir-3.0.0.tgz#2749020f239ed990881b1f71210d51eb6523bea3\"\n  dependencies:\n    find-up \"^3.0.0\"\n\npkg-up@^1.0.0:\n  version \"1.0.0\"\n  resolved \"https://registry.yarnpkg.com/pkg-up/-/pkg-up-1.0.0.tgz#3e08fb461525c4421624a33b9f7e6d0af5b05a26\"\n  dependencies:\n    find-up \"^1.0.0\"\n\nplease-upgrade-node@^3.1.1:\n  version \"3.1.1\"\n  resolved \"https://registry.yarnpkg.com/please-upgrade-node/-/please-upgrade-node-3.1.1.tgz#ed320051dfcc5024fae696712c8288993595e8ac\"\n  dependencies:\n    semver-compare \"^1.0.0\"\n\npn@^1.0.0:\n  version \"1.1.0\"\n  resolved \"https://registry.yarnpkg.com/pn/-/pn-1.1.0.tgz#e2f4cef0e219f463c179ab37463e4e1ecdccbafb\"\n\npngjs@^3.0.0, pngjs@^3.2.0:\n  version \"3.4.0\"\n  resolved \"https://registry.yarnpkg.com/pngjs/-/pngjs-3.4.0.tgz#99ca7d725965fb655814eaf65f38f12bbdbf555f\"\n\nportfinder@^1.0.9:\n  version \"1.0.20\"\n  resolved \"https://registry.yarnpkg.com/portfinder/-/portfinder-1.0.20.tgz#bea68632e54b2e13ab7b0c4775e9b41bf270e44a\"\n  dependencies:\n    async \"^1.5.2\"\n    debug \"^2.2.0\"\n    mkdirp \"0.5.x\"\n\nposix-character-classes@^0.1.0:\n  version \"0.1.1\"\n  resolved \"https://registry.yarnpkg.com/posix-character-classes/-/posix-character-classes-0.1.1.tgz#01eac0fe3b5af71a2a6c02feabb8c1fef7e00eab\"\n\npostcss-calc@^7.0.1:\n  version \"7.0.1\"\n  resolved \"https://registry.yarnpkg.com/postcss-calc/-/postcss-calc-7.0.1.tgz#36d77bab023b0ecbb9789d84dcb23c4941145436\"\n  dependencies:\n    css-unit-converter \"^1.1.1\"\n    postcss \"^7.0.5\"\n    postcss-selector-parser \"^5.0.0-rc.4\"\n    postcss-value-parser \"^3.3.1\"\n\npostcss-colormin@^4.0.3:\n  version \"4.0.3\"\n  resolved \"https://registry.yarnpkg.com/postcss-colormin/-/postcss-colormin-4.0.3.tgz#ae060bce93ed794ac71264f08132d550956bd381\"\n  dependencies:\n    browserslist \"^4.0.0\"\n    color \"^3.0.0\"\n    has \"^1.0.0\"\n    postcss \"^7.0.0\"\n    postcss-value-parser \"^3.0.0\"\n\npostcss-convert-values@^4.0.1:\n  version \"4.0.1\"\n  resolved \"https://registry.yarnpkg.com/postcss-convert-values/-/postcss-convert-values-4.0.1.tgz#ca3813ed4da0f812f9d43703584e449ebe189a7f\"\n  dependencies:\n    postcss \"^7.0.0\"\n    postcss-value-parser \"^3.0.0\"\n\npostcss-discard-comments@^4.0.2:\n  version \"4.0.2\"\n  resolved \"https://registry.yarnpkg.com/postcss-discard-comments/-/postcss-discard-comments-4.0.2.tgz#1fbabd2c246bff6aaad7997b2b0918f4d7af4033\"\n  dependencies:\n    postcss \"^7.0.0\"\n\npostcss-discard-duplicates@^4.0.2:\n  version \"4.0.2\"\n  resolved \"https://registry.yarnpkg.com/postcss-discard-duplicates/-/postcss-discard-duplicates-4.0.2.tgz#3fe133cd3c82282e550fc9b239176a9207b784eb\"\n  dependencies:\n    postcss \"^7.0.0\"\n\npostcss-discard-empty@^4.0.1:\n  version \"4.0.1\"\n  resolved \"https://registry.yarnpkg.com/postcss-discard-empty/-/postcss-discard-empty-4.0.1.tgz#c8c951e9f73ed9428019458444a02ad90bb9f765\"\n  dependencies:\n    postcss \"^7.0.0\"\n\npostcss-discard-overridden@^4.0.1:\n  version \"4.0.1\"\n  resolved \"https://registry.yarnpkg.com/postcss-discard-overridden/-/postcss-discard-overridden-4.0.1.tgz#652aef8a96726f029f5e3e00146ee7a4e755ff57\"\n  dependencies:\n    postcss \"^7.0.0\"\n\npostcss-merge-longhand@^4.0.11:\n  version \"4.0.11\"\n  resolved \"https://registry.yarnpkg.com/postcss-merge-longhand/-/postcss-merge-longhand-4.0.11.tgz#62f49a13e4a0ee04e7b98f42bb16062ca2549e24\"\n  dependencies:\n    css-color-names \"0.0.4\"\n    postcss \"^7.0.0\"\n    postcss-value-parser \"^3.0.0\"\n    stylehacks \"^4.0.0\"\n\npostcss-merge-rules@^4.0.3:\n  version \"4.0.3\"\n  resolved \"https://registry.yarnpkg.com/postcss-merge-rules/-/postcss-merge-rules-4.0.3.tgz#362bea4ff5a1f98e4075a713c6cb25aefef9a650\"\n  dependencies:\n    browserslist \"^4.0.0\"\n    caniuse-api \"^3.0.0\"\n    cssnano-util-same-parent \"^4.0.0\"\n    postcss \"^7.0.0\"\n    postcss-selector-parser \"^3.0.0\"\n    vendors \"^1.0.0\"\n\npostcss-minify-font-values@^4.0.2:\n  version \"4.0.2\"\n  resolved \"https://registry.yarnpkg.com/postcss-minify-font-values/-/postcss-minify-font-values-4.0.2.tgz#cd4c344cce474343fac5d82206ab2cbcb8afd5a6\"\n  dependencies:\n    postcss \"^7.0.0\"\n    postcss-value-parser \"^3.0.0\"\n\npostcss-minify-gradients@^4.0.2:\n  version \"4.0.2\"\n  resolved \"https://registry.yarnpkg.com/postcss-minify-gradients/-/postcss-minify-gradients-4.0.2.tgz#93b29c2ff5099c535eecda56c4aa6e665a663471\"\n  dependencies:\n    cssnano-util-get-arguments \"^4.0.0\"\n    is-color-stop \"^1.0.0\"\n    postcss \"^7.0.0\"\n    postcss-value-parser \"^3.0.0\"\n\npostcss-minify-params@^4.0.2:\n  version \"4.0.2\"\n  resolved \"https://registry.yarnpkg.com/postcss-minify-params/-/postcss-minify-params-4.0.2.tgz#6b9cef030c11e35261f95f618c90036d680db874\"\n  dependencies:\n    alphanum-sort \"^1.0.0\"\n    browserslist \"^4.0.0\"\n    cssnano-util-get-arguments \"^4.0.0\"\n    postcss \"^7.0.0\"\n    postcss-value-parser \"^3.0.0\"\n    uniqs \"^2.0.0\"\n\npostcss-minify-selectors@^4.0.2:\n  version \"4.0.2\"\n  resolved \"https://registry.yarnpkg.com/postcss-minify-selectors/-/postcss-minify-selectors-4.0.2.tgz#e2e5eb40bfee500d0cd9243500f5f8ea4262fbd8\"\n  dependencies:\n    alphanum-sort \"^1.0.0\"\n    has \"^1.0.0\"\n    postcss \"^7.0.0\"\n    postcss-selector-parser \"^3.0.0\"\n\npostcss-modules-extract-imports@1.1.0:\n  version \"1.1.0\"\n  resolved \"https://registry.yarnpkg.com/postcss-modules-extract-imports/-/postcss-modules-extract-imports-1.1.0.tgz#b614c9720be6816eaee35fb3a5faa1dba6a05ddb\"\n  dependencies:\n    postcss \"^6.0.1\"\n\npostcss-modules-extract-imports@^2.0.0:\n  version \"2.0.0\"\n  resolved \"https://registry.yarnpkg.com/postcss-modules-extract-imports/-/postcss-modules-extract-imports-2.0.0.tgz#818719a1ae1da325f9832446b01136eeb493cd7e\"\n  dependencies:\n    postcss \"^7.0.5\"\n\npostcss-modules-local-by-default@1.2.0:\n  version \"1.2.0\"\n  resolved \"https://registry.yarnpkg.com/postcss-modules-local-by-default/-/postcss-modules-local-by-default-1.2.0.tgz#f7d80c398c5a393fa7964466bd19500a7d61c069\"\n  dependencies:\n    css-selector-tokenizer \"^0.7.0\"\n    postcss \"^6.0.1\"\n\npostcss-modules-local-by-default@^2.0.6:\n  version \"2.0.6\"\n  resolved \"https://registry.yarnpkg.com/postcss-modules-local-by-default/-/postcss-modules-local-by-default-2.0.6.tgz#dd9953f6dd476b5fd1ef2d8830c8929760b56e63\"\n  dependencies:\n    postcss \"^7.0.6\"\n    postcss-selector-parser \"^6.0.0\"\n    postcss-value-parser \"^3.3.1\"\n\npostcss-modules-scope@1.1.0:\n  version \"1.1.0\"\n  resolved \"https://registry.yarnpkg.com/postcss-modules-scope/-/postcss-modules-scope-1.1.0.tgz#d6ea64994c79f97b62a72b426fbe6056a194bb90\"\n  dependencies:\n    css-selector-tokenizer \"^0.7.0\"\n    postcss \"^6.0.1\"\n\npostcss-modules-scope@^2.1.0:\n  version \"2.1.0\"\n  resolved \"https://registry.yarnpkg.com/postcss-modules-scope/-/postcss-modules-scope-2.1.0.tgz#ad3f5bf7856114f6fcab901b0502e2a2bc39d4eb\"\n  dependencies:\n    postcss \"^7.0.6\"\n    postcss-selector-parser \"^6.0.0\"\n\npostcss-modules-values@1.3.0:\n  version \"1.3.0\"\n  resolved \"https://registry.yarnpkg.com/postcss-modules-values/-/postcss-modules-values-1.3.0.tgz#ecffa9d7e192518389f42ad0e83f72aec456ea20\"\n  dependencies:\n    icss-replace-symbols \"^1.1.0\"\n    postcss \"^6.0.1\"\n\npostcss-modules-values@^2.0.0:\n  version \"2.0.0\"\n  resolved \"https://registry.yarnpkg.com/postcss-modules-values/-/postcss-modules-values-2.0.0.tgz#479b46dc0c5ca3dc7fa5270851836b9ec7152f64\"\n  dependencies:\n    icss-replace-symbols \"^1.1.0\"\n    postcss \"^7.0.6\"\n\npostcss-normalize-charset@^4.0.1:\n  version \"4.0.1\"\n  resolved \"https://registry.yarnpkg.com/postcss-normalize-charset/-/postcss-normalize-charset-4.0.1.tgz#8b35add3aee83a136b0471e0d59be58a50285dd4\"\n  dependencies:\n    postcss \"^7.0.0\"\n\npostcss-normalize-display-values@^4.0.2:\n  version \"4.0.2\"\n  resolved \"https://registry.yarnpkg.com/postcss-normalize-display-values/-/postcss-normalize-display-values-4.0.2.tgz#0dbe04a4ce9063d4667ed2be476bb830c825935a\"\n  dependencies:\n    cssnano-util-get-match \"^4.0.0\"\n    postcss \"^7.0.0\"\n    postcss-value-parser \"^3.0.0\"\n\npostcss-normalize-positions@^4.0.2:\n  version \"4.0.2\"\n  resolved \"https://registry.yarnpkg.com/postcss-normalize-positions/-/postcss-normalize-positions-4.0.2.tgz#05f757f84f260437378368a91f8932d4b102917f\"\n  dependencies:\n    cssnano-util-get-arguments \"^4.0.0\"\n    has \"^1.0.0\"\n    postcss \"^7.0.0\"\n    postcss-value-parser \"^3.0.0\"\n\npostcss-normalize-repeat-style@^4.0.2:\n  version \"4.0.2\"\n  resolved \"https://registry.yarnpkg.com/postcss-normalize-repeat-style/-/postcss-normalize-repeat-style-4.0.2.tgz#c4ebbc289f3991a028d44751cbdd11918b17910c\"\n  dependencies:\n    cssnano-util-get-arguments \"^4.0.0\"\n    cssnano-util-get-match \"^4.0.0\"\n    postcss \"^7.0.0\"\n    postcss-value-parser \"^3.0.0\"\n\npostcss-normalize-string@^4.0.2:\n  version \"4.0.2\"\n  resolved \"https://registry.yarnpkg.com/postcss-normalize-string/-/postcss-normalize-string-4.0.2.tgz#cd44c40ab07a0c7a36dc5e99aace1eca4ec2690c\"\n  dependencies:\n    has \"^1.0.0\"\n    postcss \"^7.0.0\"\n    postcss-value-parser \"^3.0.0\"\n\npostcss-normalize-timing-functions@^4.0.2:\n  version \"4.0.2\"\n  resolved \"https://registry.yarnpkg.com/postcss-normalize-timing-functions/-/postcss-normalize-timing-functions-4.0.2.tgz#8e009ca2a3949cdaf8ad23e6b6ab99cb5e7d28d9\"\n  dependencies:\n    cssnano-util-get-match \"^4.0.0\"\n    postcss \"^7.0.0\"\n    postcss-value-parser \"^3.0.0\"\n\npostcss-normalize-unicode@^4.0.1:\n  version \"4.0.1\"\n  resolved \"https://registry.yarnpkg.com/postcss-normalize-unicode/-/postcss-normalize-unicode-4.0.1.tgz#841bd48fdcf3019ad4baa7493a3d363b52ae1cfb\"\n  dependencies:\n    browserslist \"^4.0.0\"\n    postcss \"^7.0.0\"\n    postcss-value-parser \"^3.0.0\"\n\npostcss-normalize-url@^4.0.1:\n  version \"4.0.1\"\n  resolved \"https://registry.yarnpkg.com/postcss-normalize-url/-/postcss-normalize-url-4.0.1.tgz#10e437f86bc7c7e58f7b9652ed878daaa95faae1\"\n  dependencies:\n    is-absolute-url \"^2.0.0\"\n    normalize-url \"^3.0.0\"\n    postcss \"^7.0.0\"\n    postcss-value-parser \"^3.0.0\"\n\npostcss-normalize-whitespace@^4.0.2:\n  version \"4.0.2\"\n  resolved \"https://registry.yarnpkg.com/postcss-normalize-whitespace/-/postcss-normalize-whitespace-4.0.2.tgz#bf1d4070fe4fcea87d1348e825d8cc0c5faa7d82\"\n  dependencies:\n    postcss \"^7.0.0\"\n    postcss-value-parser \"^3.0.0\"\n\npostcss-ordered-values@^4.1.2:\n  version \"4.1.2\"\n  resolved \"https://registry.yarnpkg.com/postcss-ordered-values/-/postcss-ordered-values-4.1.2.tgz#0cf75c820ec7d5c4d280189559e0b571ebac0eee\"\n  dependencies:\n    cssnano-util-get-arguments \"^4.0.0\"\n    postcss \"^7.0.0\"\n    postcss-value-parser \"^3.0.0\"\n\npostcss-reduce-initial@^4.0.3:\n  version \"4.0.3\"\n  resolved \"https://registry.yarnpkg.com/postcss-reduce-initial/-/postcss-reduce-initial-4.0.3.tgz#7fd42ebea5e9c814609639e2c2e84ae270ba48df\"\n  dependencies:\n    browserslist \"^4.0.0\"\n    caniuse-api \"^3.0.0\"\n    has \"^1.0.0\"\n    postcss \"^7.0.0\"\n\npostcss-reduce-transforms@^4.0.2:\n  version \"4.0.2\"\n  resolved \"https://registry.yarnpkg.com/postcss-reduce-transforms/-/postcss-reduce-transforms-4.0.2.tgz#17efa405eacc6e07be3414a5ca2d1074681d4e29\"\n  dependencies:\n    cssnano-util-get-match \"^4.0.0\"\n    has \"^1.0.0\"\n    postcss \"^7.0.0\"\n    postcss-value-parser \"^3.0.0\"\n\npostcss-selector-parser@^3.0.0:\n  version \"3.1.1\"\n  resolved \"https://registry.yarnpkg.com/postcss-selector-parser/-/postcss-selector-parser-3.1.1.tgz#4f875f4afb0c96573d5cf4d74011aee250a7e865\"\n  dependencies:\n    dot-prop \"^4.1.1\"\n    indexes-of \"^1.0.1\"\n    uniq \"^1.0.1\"\n\npostcss-selector-parser@^5.0.0-rc.4:\n  version \"5.0.0\"\n  resolved \"https://registry.yarnpkg.com/postcss-selector-parser/-/postcss-selector-parser-5.0.0.tgz#249044356697b33b64f1a8f7c80922dddee7195c\"\n  dependencies:\n    cssesc \"^2.0.0\"\n    indexes-of \"^1.0.1\"\n    uniq \"^1.0.1\"\n\npostcss-selector-parser@^6.0.0:\n  version \"6.0.2\"\n  resolved \"https://registry.yarnpkg.com/postcss-selector-parser/-/postcss-selector-parser-6.0.2.tgz#934cf799d016c83411859e09dcecade01286ec5c\"\n  dependencies:\n    cssesc \"^3.0.0\"\n    indexes-of \"^1.0.1\"\n    uniq \"^1.0.1\"\n\npostcss-svgo@^4.0.2:\n  version \"4.0.2\"\n  resolved \"https://registry.yarnpkg.com/postcss-svgo/-/postcss-svgo-4.0.2.tgz#17b997bc711b333bab143aaed3b8d3d6e3d38258\"\n  dependencies:\n    is-svg \"^3.0.0\"\n    postcss \"^7.0.0\"\n    postcss-value-parser \"^3.0.0\"\n    svgo \"^1.0.0\"\n\npostcss-unique-selectors@^4.0.1:\n  version \"4.0.1\"\n  resolved \"https://registry.yarnpkg.com/postcss-unique-selectors/-/postcss-unique-selectors-4.0.1.tgz#9446911f3289bfd64c6d680f073c03b1f9ee4bac\"\n  dependencies:\n    alphanum-sort \"^1.0.0\"\n    postcss \"^7.0.0\"\n    uniqs \"^2.0.0\"\n\npostcss-value-parser@^3.0.0, postcss-value-parser@^3.3.0, postcss-value-parser@^3.3.1:\n  version \"3.3.1\"\n  resolved \"https://registry.yarnpkg.com/postcss-value-parser/-/postcss-value-parser-3.3.1.tgz#9ff822547e2893213cf1c30efa51ac5fd1ba8281\"\n\npostcss@6.0.1:\n  version \"6.0.1\"\n  resolved \"https://registry.yarnpkg.com/postcss/-/postcss-6.0.1.tgz#000dbd1f8eef217aa368b9a212c5fc40b2a8f3f2\"\n  dependencies:\n    chalk \"^1.1.3\"\n    source-map \"^0.5.6\"\n    supports-color \"^3.2.3\"\n\npostcss@7.0.14, postcss@^7.0.0, postcss@^7.0.1, postcss@^7.0.5:\n  version \"7.0.14\"\n  resolved \"https://registry.yarnpkg.com/postcss/-/postcss-7.0.14.tgz#4527ed6b1ca0d82c53ce5ec1a2041c2346bbd6e5\"\n  dependencies:\n    chalk \"^2.4.2\"\n    source-map \"^0.6.1\"\n    supports-color \"^6.1.0\"\n\npostcss@^6.0.1:\n  version \"6.0.23\"\n  resolved \"https://registry.yarnpkg.com/postcss/-/postcss-6.0.23.tgz#61c82cc328ac60e677645f979054eb98bc0e3324\"\n  dependencies:\n    chalk \"^2.4.1\"\n    source-map \"^0.6.1\"\n    supports-color \"^5.4.0\"\n\npostcss@^7.0.14, postcss@^7.0.6:\n  version \"7.0.16\"\n  resolved \"https://registry.yarnpkg.com/postcss/-/postcss-7.0.16.tgz#48f64f1b4b558cb8b52c88987724359acb010da2\"\n  dependencies:\n    chalk \"^2.4.2\"\n    source-map \"^0.6.1\"\n    supports-color \"^6.1.0\"\n\nprettier-tslint@^0.4.2:\n  version \"0.4.2\"\n  resolved \"https://registry.yarnpkg.com/prettier-tslint/-/prettier-tslint-0.4.2.tgz#37dd009ad6a482ea8101f40cf70b777bc86f3438\"\n  dependencies:\n    chalk \"^2.4.0\"\n    globby \"^8.0.1\"\n    ignore \"^3.3.7\"\n    require-relative \"^0.8.7\"\n    tslint \"^5.9.1\"\n    yargs \"^11.0.0\"\n\nprettier@^1.17.1:\n  version \"1.17.1\"\n  resolved \"https://registry.yarnpkg.com/prettier/-/prettier-1.17.1.tgz#ed64b4e93e370cb8a25b9ef7fef3e4fd1c0995db\"\n\npretty-error@^2.0.2, pretty-error@^2.1.1:\n  version \"2.1.1\"\n  resolved \"https://registry.yarnpkg.com/pretty-error/-/pretty-error-2.1.1.tgz#5f4f87c8f91e5ae3f3ba87ab4cf5e03b1a17f1a3\"\n  dependencies:\n    renderkid \"^2.0.1\"\n    utila \"~0.4\"\n\nprivate@^0.1.6, private@~0.1.5:\n  version \"0.1.8\"\n  resolved \"https://registry.yarnpkg.com/private/-/private-0.1.8.tgz#2381edb3689f7a53d653190060fcf822d2f368ff\"\n\nprocess-nextick-args@~2.0.0:\n  version \"2.0.0\"\n  resolved \"https://registry.yarnpkg.com/process-nextick-args/-/process-nextick-args-2.0.0.tgz#a37d732f4271b4ab1ad070d35508e8290788ffaa\"\n\nprocess@^0.11.1, process@^0.11.10:\n  version \"0.11.10\"\n  resolved \"https://registry.yarnpkg.com/process/-/process-0.11.10.tgz#7332300e840161bda3e69a1d1d91a7d4bc16f182\"\n\nprocess@~0.5.1:\n  version \"0.5.2\"\n  resolved \"https://registry.yarnpkg.com/process/-/process-0.5.2.tgz#1638d8a8e34c2f440a91db95ab9aeb677fc185cf\"\n\nprogress@^1.1.8:\n  version \"1.1.8\"\n  resolved \"https://registry.yarnpkg.com/progress/-/progress-1.1.8.tgz#e260c78f6161cdd9b0e56cc3e0a85de17c7a57be\"\n\npromise-inflight@^1.0.1:\n  version \"1.0.1\"\n  resolved \"https://registry.yarnpkg.com/promise-inflight/-/promise-inflight-1.0.1.tgz#98472870bf228132fcbdd868129bad12c3c029e3\"\n\nprop-types@^15.5.7, prop-types@^15.6.0, prop-types@^15.6.1, prop-types@^15.6.2:\n  version \"15.7.2\"\n  resolved \"https://registry.yarnpkg.com/prop-types/-/prop-types-15.7.2.tgz#52c41e75b8c87e72b9d9360e0206b99dcbffa6c5\"\n  dependencies:\n    loose-envify \"^1.4.0\"\n    object-assign \"^4.1.1\"\n    react-is \"^16.8.1\"\n\nproxy-addr@~2.0.4:\n  version \"2.0.4\"\n  resolved \"https://registry.yarnpkg.com/proxy-addr/-/proxy-addr-2.0.4.tgz#ecfc733bf22ff8c6f407fa275327b9ab67e48b93\"\n  dependencies:\n    forwarded \"~0.1.2\"\n    ipaddr.js \"1.8.0\"\n\nprr@~1.0.1:\n  version \"1.0.1\"\n  resolved \"https://registry.yarnpkg.com/prr/-/prr-1.0.1.tgz#d3fc114ba06995a45ec6893f484ceb1d78f5f476\"\n\npseudomap@^1.0.2:\n  version \"1.0.2\"\n  resolved \"https://registry.yarnpkg.com/pseudomap/-/pseudomap-1.0.2.tgz#f052a28da70e618917ef0a8ac34c1ae5a68286b3\"\n\npsl@^1.1.24:\n  version \"1.1.31\"\n  resolved \"https://registry.yarnpkg.com/psl/-/psl-1.1.31.tgz#e9aa86d0101b5b105cbe93ac6b784cd547276184\"\n\npublic-encrypt@^4.0.0:\n  version \"4.0.3\"\n  resolved \"https://registry.yarnpkg.com/public-encrypt/-/public-encrypt-4.0.3.tgz#4fcc9d77a07e48ba7527e7cbe0de33d0701331e0\"\n  dependencies:\n    bn.js \"^4.1.0\"\n    browserify-rsa \"^4.0.0\"\n    create-hash \"^1.1.0\"\n    parse-asn1 \"^5.0.0\"\n    randombytes \"^2.0.1\"\n    safe-buffer \"^5.1.2\"\n\npump@^2.0.0:\n  version \"2.0.1\"\n  resolved \"https://registry.yarnpkg.com/pump/-/pump-2.0.1.tgz#12399add6e4cf7526d973cbc8b5ce2e2908b3909\"\n  dependencies:\n    end-of-stream \"^1.1.0\"\n    once \"^1.3.1\"\n\npump@^3.0.0:\n  version \"3.0.0\"\n  resolved \"https://registry.yarnpkg.com/pump/-/pump-3.0.0.tgz#b4a2116815bde2f4e1ea602354e8c75565107a64\"\n  dependencies:\n    end-of-stream \"^1.1.0\"\n    once \"^1.3.1\"\n\npumpify@^1.3.3:\n  version \"1.5.1\"\n  resolved \"https://registry.yarnpkg.com/pumpify/-/pumpify-1.5.1.tgz#36513be246ab27570b1a374a5ce278bfd74370ce\"\n  dependencies:\n    duplexify \"^3.6.0\"\n    inherits \"^2.0.3\"\n    pump \"^2.0.0\"\n\npunycode@1.3.2:\n  version \"1.3.2\"\n  resolved \"https://registry.yarnpkg.com/punycode/-/punycode-1.3.2.tgz#9653a036fb7c1ee42342f2325cceefea3926c48d\"\n\npunycode@^1.2.4, punycode@^1.4.1:\n  version \"1.4.1\"\n  resolved \"https://registry.yarnpkg.com/punycode/-/punycode-1.4.1.tgz#c0d5a63b2718800ad8e1eb0fa5269c84dd41845e\"\n\npunycode@^2.1.0:\n  version \"2.1.1\"\n  resolved \"https://registry.yarnpkg.com/punycode/-/punycode-2.1.1.tgz#b58b010ac40c22c5657616c8d2c2c02c7bf479ec\"\n\nq@^1.1.2:\n  version \"1.5.1\"\n  resolved \"https://registry.yarnpkg.com/q/-/q-1.5.1.tgz#7e32f75b41381291d04611f1bf14109ac00651d7\"\n\nqs@6.5.2, qs@~6.5.2:\n  version \"6.5.2\"\n  resolved \"https://registry.yarnpkg.com/qs/-/qs-6.5.2.tgz#cb3ae806e8740444584ef154ce8ee98d403f3e36\"\n\nqs@^6.7.0:\n  version \"6.7.0\"\n  resolved \"https://registry.yarnpkg.com/qs/-/qs-6.7.0.tgz#41dc1a015e3d581f1621776be31afb2876a9b1bc\"\n\nquerystring-es3@^0.2.0:\n  version \"0.2.1\"\n  resolved \"https://registry.yarnpkg.com/querystring-es3/-/querystring-es3-0.2.1.tgz#9ec61f79049875707d69414596fd907a4d711e73\"\n\nquerystring@0.2.0:\n  version \"0.2.0\"\n  resolved \"https://registry.yarnpkg.com/querystring/-/querystring-0.2.0.tgz#b209849203bb25df820da756e747005878521620\"\n\nquerystringify@^2.0.0:\n  version \"2.1.0\"\n  resolved \"https://registry.yarnpkg.com/querystringify/-/querystringify-2.1.0.tgz#7ded8dfbf7879dcc60d0a644ac6754b283ad17ef\"\n\nrandombytes@^2.0.0, randombytes@^2.0.1, randombytes@^2.0.5:\n  version \"2.1.0\"\n  resolved \"https://registry.yarnpkg.com/randombytes/-/randombytes-2.1.0.tgz#df6f84372f0270dc65cdf6291349ab7a473d4f2a\"\n  dependencies:\n    safe-buffer \"^5.1.0\"\n\nrandomfill@^1.0.3:\n  version \"1.0.4\"\n  resolved \"https://registry.yarnpkg.com/randomfill/-/randomfill-1.0.4.tgz#c92196fc86ab42be983f1bf31778224931d61458\"\n  dependencies:\n    randombytes \"^2.0.5\"\n    safe-buffer \"^5.1.0\"\n\nrange-parser@^1.0.3, range-parser@~1.2.0:\n  version \"1.2.0\"\n  resolved \"https://registry.yarnpkg.com/range-parser/-/range-parser-1.2.0.tgz#f49be6b487894ddc40dcc94a322f611092e00d5e\"\n\nraw-body@2.3.3:\n  version \"2.3.3\"\n  resolved \"https://registry.yarnpkg.com/raw-body/-/raw-body-2.3.3.tgz#1b324ece6b5706e153855bc1148c65bb7f6ea0c3\"\n  dependencies:\n    bytes \"3.0.0\"\n    http-errors \"1.6.3\"\n    iconv-lite \"0.4.23\"\n    unpipe \"1.0.0\"\n\nrc@^1.2.7:\n  version \"1.2.8\"\n  resolved \"https://registry.yarnpkg.com/rc/-/rc-1.2.8.tgz#cd924bf5200a075b83c188cd6b9e211b7fc0d3ed\"\n  dependencies:\n    deep-extend \"^0.6.0\"\n    ini \"~1.3.0\"\n    minimist \"^1.2.0\"\n    strip-json-comments \"~2.0.1\"\n\nreact-content-loader@^3.4.1:\n  version \"3.4.2\"\n  resolved \"https://registry.yarnpkg.com/react-content-loader/-/react-content-loader-3.4.2.tgz#187fbec2aa389635e4613faa046713f196173f40\"\n\nreact-contextmenu@^2.10.0:\n  version \"2.10.0\"\n  resolved \"https://registry.yarnpkg.com/react-contextmenu/-/react-contextmenu-2.10.0.tgz#3a5338a552964db85c300072f719bc1f6b969838\"\n  dependencies:\n    classnames \"^2.2.5\"\n    object-assign \"^4.1.0\"\n\nreact-dnd-html5-backend@^7.0.2:\n  version \"7.0.2\"\n  resolved \"https://registry.yarnpkg.com/react-dnd-html5-backend/-/react-dnd-html5-backend-7.0.2.tgz#f74181ca0ff05be13eb6094629c5ad560f558a7e\"\n  dependencies:\n    dnd-core \"^7.0.2\"\n    lodash \"^4.17.11\"\n\nreact-dnd@^7.4.5:\n  version \"7.4.5\"\n  resolved \"https://registry.yarnpkg.com/react-dnd/-/react-dnd-7.4.5.tgz#cb4a2c97cd81f514d892c6cc2f020908ca7382a5\"\n  dependencies:\n    dnd-core \"^7.4.4\"\n    hoist-non-react-statics \"^3.3.0\"\n    invariant \"^2.1.0\"\n    shallowequal \"^1.1.0\"\n\nreact-dom@^16.8.6:\n  version \"16.8.6\"\n  resolved \"https://registry.yarnpkg.com/react-dom/-/react-dom-16.8.6.tgz#71d6303f631e8b0097f56165ef608f051ff6e10f\"\n  dependencies:\n    loose-envify \"^1.1.0\"\n    object-assign \"^4.1.1\"\n    prop-types \"^15.6.2\"\n    scheduler \"^0.13.6\"\n\nreact-draggable@^3.0.5:\n  version \"3.1.1\"\n  resolved \"https://registry.yarnpkg.com/react-draggable/-/react-draggable-3.1.1.tgz#ed1db43e09b146805f6d158296e58eae4f768d36\"\n  dependencies:\n    classnames \"^2.2.5\"\n    prop-types \"^15.6.0\"\n\nreact-is@^16.7.0, react-is@^16.8.1:\n  version \"16.8.3\"\n  resolved \"https://registry.yarnpkg.com/react-is/-/react-is-16.8.3.tgz#4ad8b029c2a718fc0cfc746c8d4e1b7221e5387d\"\n\nreact-lifecycles-compat@^3.0.4:\n  version \"3.0.4\"\n  resolved \"https://registry.yarnpkg.com/react-lifecycles-compat/-/react-lifecycles-compat-3.0.4.tgz#4f1a273afdfc8f3488a8c516bfda78f872352362\"\n\nreact-lines-ellipsis@^0.14.1:\n  version \"0.14.1\"\n  resolved \"https://registry.yarnpkg.com/react-lines-ellipsis/-/react-lines-ellipsis-0.14.1.tgz#dbc045b9c3bd0c46d2c1dee893d46e9260d53969\"\n\nreact-localization@^1.0.13:\n  version \"1.0.13\"\n  resolved \"https://registry.yarnpkg.com/react-localization/-/react-localization-1.0.13.tgz#7a1da114c61c8b4814fed2abc699b45ad6bb32b8\"\n  dependencies:\n    localized-strings \"^0.2.00\"\n    react \"^16.0.0\"\n\nreact-router-dom@^4.3.1:\n  version \"4.3.1\"\n  resolved \"https://registry.yarnpkg.com/react-router-dom/-/react-router-dom-4.3.1.tgz#4c2619fc24c4fa87c9fd18f4fb4a43fe63fbd5c6\"\n  dependencies:\n    history \"^4.7.2\"\n    invariant \"^2.2.4\"\n    loose-envify \"^1.3.1\"\n    prop-types \"^15.6.1\"\n    react-router \"^4.3.1\"\n    warning \"^4.0.1\"\n\nreact-router@^4.3.1:\n  version \"4.3.1\"\n  resolved \"https://registry.yarnpkg.com/react-router/-/react-router-4.3.1.tgz#aada4aef14c809cb2e686b05cee4742234506c4e\"\n  dependencies:\n    history \"^4.7.2\"\n    hoist-non-react-statics \"^2.5.0\"\n    invariant \"^2.2.4\"\n    loose-envify \"^1.3.1\"\n    path-to-regexp \"^1.7.0\"\n    prop-types \"^15.6.1\"\n    warning \"^4.0.1\"\n\nreact-s-alert@^1.4.1:\n  version \"1.4.1\"\n  resolved \"https://registry.yarnpkg.com/react-s-alert/-/react-s-alert-1.4.1.tgz#ef3665a9d98c4cf2e448fc2d84e48aeca799bb5a\"\n  dependencies:\n    babel-runtime \"^6.23.0\"\n\nreact-sortable-hoc@^1.6.1:\n  version \"1.6.1\"\n  resolved \"https://registry.yarnpkg.com/react-sortable-hoc/-/react-sortable-hoc-1.6.1.tgz#2e9b551a7a1733201477571ad82608a7801309c6\"\n  dependencies:\n    \"@babel/runtime\" \"^7.2.0\"\n    invariant \"^2.2.4\"\n    prop-types \"^15.5.7\"\n\nreact-virtualized@^9.21.0:\n  version \"9.21.0\"\n  resolved \"https://registry.yarnpkg.com/react-virtualized/-/react-virtualized-9.21.0.tgz#8267c40ffb48db35b242a36dea85edcf280a6506\"\n  dependencies:\n    babel-runtime \"^6.26.0\"\n    classnames \"^2.2.3\"\n    dom-helpers \"^2.4.0 || ^3.0.0\"\n    loose-envify \"^1.3.0\"\n    prop-types \"^15.6.0\"\n    react-lifecycles-compat \"^3.0.4\"\n\nreact@^16.0.0:\n  version \"16.8.3\"\n  resolved \"https://registry.yarnpkg.com/react/-/react-16.8.3.tgz#c6f988a2ce895375de216edcfaedd6b9a76451d9\"\n  dependencies:\n    loose-envify \"^1.1.0\"\n    object-assign \"^4.1.1\"\n    prop-types \"^15.6.2\"\n    scheduler \"^0.13.3\"\n\nreact@^16.8.6:\n  version \"16.8.6\"\n  resolved \"https://registry.yarnpkg.com/react/-/react-16.8.6.tgz#ad6c3a9614fd3a4e9ef51117f54d888da01f2bbe\"\n  dependencies:\n    loose-envify \"^1.1.0\"\n    object-assign \"^4.1.1\"\n    prop-types \"^15.6.2\"\n    scheduler \"^0.13.6\"\n\nread-chunk@^1.0.1:\n  version \"1.0.1\"\n  resolved \"https://registry.yarnpkg.com/read-chunk/-/read-chunk-1.0.1.tgz#5f68cab307e663f19993527d9b589cace4661194\"\n\nread-pkg-up@^1.0.1:\n  version \"1.0.1\"\n  resolved \"https://registry.yarnpkg.com/read-pkg-up/-/read-pkg-up-1.0.1.tgz#9d63c13276c065918d57f002a57f40a1b643fb02\"\n  dependencies:\n    find-up \"^1.0.0\"\n    read-pkg \"^1.0.0\"\n\nread-pkg@^1.0.0:\n  version \"1.1.0\"\n  resolved \"https://registry.yarnpkg.com/read-pkg/-/read-pkg-1.1.0.tgz#f5ffaa5ecd29cb31c0474bca7d756b6bb29e3f28\"\n  dependencies:\n    load-json-file \"^1.0.0\"\n    normalize-package-data \"^2.3.2\"\n    path-type \"^1.0.0\"\n\nread-pkg@^4.0.1:\n  version \"4.0.1\"\n  resolved \"https://registry.yarnpkg.com/read-pkg/-/read-pkg-4.0.1.tgz#963625378f3e1c4d48c85872b5a6ec7d5d093237\"\n  dependencies:\n    normalize-package-data \"^2.3.2\"\n    parse-json \"^4.0.0\"\n    pify \"^3.0.0\"\n\n\"readable-stream@1 || 2\", readable-stream@^2.0.0, readable-stream@^2.0.1, readable-stream@^2.0.2, readable-stream@^2.0.6, readable-stream@^2.1.5, readable-stream@^2.2.2, readable-stream@^2.3.3, readable-stream@^2.3.6, readable-stream@~2.3.6:\n  version \"2.3.6\"\n  resolved \"https://registry.yarnpkg.com/readable-stream/-/readable-stream-2.3.6.tgz#b11c27d88b8ff1fbe070643cf94b0c79ae1b0aaf\"\n  dependencies:\n    core-util-is \"~1.0.0\"\n    inherits \"~2.0.3\"\n    isarray \"~1.0.0\"\n    process-nextick-args \"~2.0.0\"\n    safe-buffer \"~5.1.1\"\n    string_decoder \"~1.1.1\"\n    util-deprecate \"~1.0.1\"\n\nreadable-stream@1.1:\n  version \"1.1.13\"\n  resolved \"https://registry.yarnpkg.com/readable-stream/-/readable-stream-1.1.13.tgz#f6eef764f514c89e2b9e23146a75ba106756d23e\"\n  dependencies:\n    core-util-is \"~1.0.0\"\n    inherits \"~2.0.1\"\n    isarray \"0.0.1\"\n    string_decoder \"~0.10.x\"\n\nreadable-stream@^3.0.6, readable-stream@^3.1.1:\n  version \"3.1.1\"\n  resolved \"https://registry.yarnpkg.com/readable-stream/-/readable-stream-3.1.1.tgz#ed6bbc6c5ba58b090039ff18ce670515795aeb06\"\n  dependencies:\n    inherits \"^2.0.3\"\n    string_decoder \"^1.1.1\"\n    util-deprecate \"^1.0.1\"\n\nreaddirp@^2.2.1:\n  version \"2.2.1\"\n  resolved \"https://registry.yarnpkg.com/readdirp/-/readdirp-2.2.1.tgz#0e87622a3325aa33e892285caf8b4e846529a525\"\n  dependencies:\n    graceful-fs \"^4.1.11\"\n    micromatch \"^3.1.10\"\n    readable-stream \"^2.0.2\"\n\nrecast@~0.11.12:\n  version \"0.11.23\"\n  resolved \"https://registry.yarnpkg.com/recast/-/recast-0.11.23.tgz#451fd3004ab1e4df9b4e4b66376b2a21912462d3\"\n  dependencies:\n    ast-types \"0.9.6\"\n    esprima \"~3.1.0\"\n    private \"~0.1.5\"\n    source-map \"~0.5.0\"\n\nredent@^1.0.0:\n  version \"1.0.0\"\n  resolved \"https://registry.yarnpkg.com/redent/-/redent-1.0.0.tgz#cf916ab1fd5f1f16dfb20822dd6ec7f730c2afde\"\n  dependencies:\n    indent-string \"^2.1.0\"\n    strip-indent \"^1.0.1\"\n\nredux@^4.0.1:\n  version \"4.0.1\"\n  resolved \"https://registry.yarnpkg.com/redux/-/redux-4.0.1.tgz#436cae6cc40fbe4727689d7c8fae44808f1bfef5\"\n  dependencies:\n    loose-envify \"^1.4.0\"\n    symbol-observable \"^1.2.0\"\n\nregenerate-unicode-properties@^8.0.2:\n  version \"8.1.0\"\n  resolved \"https://registry.yarnpkg.com/regenerate-unicode-properties/-/regenerate-unicode-properties-8.1.0.tgz#ef51e0f0ea4ad424b77bf7cb41f3e015c70a3f0e\"\n  dependencies:\n    regenerate \"^1.4.0\"\n\nregenerate@^1.2.1, regenerate@^1.4.0:\n  version \"1.4.0\"\n  resolved \"https://registry.yarnpkg.com/regenerate/-/regenerate-1.4.0.tgz#4a856ec4b56e4077c557589cae85e7a4c8869a11\"\n\nregenerator-runtime@^0.11.0:\n  version \"0.11.1\"\n  resolved \"https://registry.yarnpkg.com/regenerator-runtime/-/regenerator-runtime-0.11.1.tgz#be05ad7f9bf7d22e056f9726cee5017fbf19e2e9\"\n\nregenerator-runtime@^0.12.0:\n  version \"0.12.1\"\n  resolved \"https://registry.yarnpkg.com/regenerator-runtime/-/regenerator-runtime-0.12.1.tgz#fa1a71544764c036f8c49b13a08b2594c9f8a0de\"\n\nregenerator-transform@^0.14.0:\n  version \"0.14.0\"\n  resolved \"https://registry.yarnpkg.com/regenerator-transform/-/regenerator-transform-0.14.0.tgz#2ca9aaf7a2c239dd32e4761218425b8c7a86ecaf\"\n  dependencies:\n    private \"^0.1.6\"\n\nregex-not@^1.0.0, regex-not@^1.0.2:\n  version \"1.0.2\"\n  resolved \"https://registry.yarnpkg.com/regex-not/-/regex-not-1.0.2.tgz#1f4ece27e00b0b65e0247a6810e6a85d83a5752c\"\n  dependencies:\n    extend-shallow \"^3.0.2\"\n    safe-regex \"^1.1.0\"\n\nregex-parser@2.2.10:\n  version \"2.2.10\"\n  resolved \"https://registry.yarnpkg.com/regex-parser/-/regex-parser-2.2.10.tgz#9e66a8f73d89a107616e63b39d4deddfee912b37\"\n\nregexp-tree@^0.1.6:\n  version \"0.1.10\"\n  resolved \"https://registry.yarnpkg.com/regexp-tree/-/regexp-tree-0.1.10.tgz#d837816a039c7af8a8d64d7a7c3cf6a1d93450bc\"\n\nregexpu-core@^1.0.0:\n  version \"1.0.0\"\n  resolved \"https://registry.yarnpkg.com/regexpu-core/-/regexpu-core-1.0.0.tgz#86a763f58ee4d7c2f6b102e4764050de7ed90c6b\"\n  dependencies:\n    regenerate \"^1.2.1\"\n    regjsgen \"^0.2.0\"\n    regjsparser \"^0.1.4\"\n\nregexpu-core@^4.5.4:\n  version \"4.5.4\"\n  resolved \"https://registry.yarnpkg.com/regexpu-core/-/regexpu-core-4.5.4.tgz#080d9d02289aa87fe1667a4f5136bc98a6aebaae\"\n  dependencies:\n    regenerate \"^1.4.0\"\n    regenerate-unicode-properties \"^8.0.2\"\n    regjsgen \"^0.5.0\"\n    regjsparser \"^0.6.0\"\n    unicode-match-property-ecmascript \"^1.0.4\"\n    unicode-match-property-value-ecmascript \"^1.1.0\"\n\nregjsgen@^0.2.0:\n  version \"0.2.0\"\n  resolved \"https://registry.yarnpkg.com/regjsgen/-/regjsgen-0.2.0.tgz#6c016adeac554f75823fe37ac05b92d5a4edb1f7\"\n\nregjsgen@^0.5.0:\n  version \"0.5.0\"\n  resolved \"https://registry.yarnpkg.com/regjsgen/-/regjsgen-0.5.0.tgz#a7634dc08f89209c2049adda3525711fb97265dd\"\n\nregjsparser@^0.1.4:\n  version \"0.1.5\"\n  resolved \"https://registry.yarnpkg.com/regjsparser/-/regjsparser-0.1.5.tgz#7ee8f84dc6fa792d3fd0ae228d24bd949ead205c\"\n  dependencies:\n    jsesc \"~0.5.0\"\n\nregjsparser@^0.6.0:\n  version \"0.6.0\"\n  resolved \"https://registry.yarnpkg.com/regjsparser/-/regjsparser-0.6.0.tgz#f1e6ae8b7da2bae96c99399b868cd6c933a2ba9c\"\n  dependencies:\n    jsesc \"~0.5.0\"\n\nrelateurl@0.2.x:\n  version \"0.2.7\"\n  resolved \"https://registry.yarnpkg.com/relateurl/-/relateurl-0.2.7.tgz#54dbf377e51440aca90a4cd274600d3ff2d888a9\"\n\nremove-trailing-separator@^1.0.1:\n  version \"1.1.0\"\n  resolved \"https://registry.yarnpkg.com/remove-trailing-separator/-/remove-trailing-separator-1.1.0.tgz#c24bce2a283adad5bc3f58e0d48249b92379d8ef\"\n\nrenderkid@^2.0.1:\n  version \"2.0.3\"\n  resolved \"https://registry.yarnpkg.com/renderkid/-/renderkid-2.0.3.tgz#380179c2ff5ae1365c522bf2fcfcff01c5b74149\"\n  dependencies:\n    css-select \"^1.1.0\"\n    dom-converter \"^0.2\"\n    htmlparser2 \"^3.3.0\"\n    strip-ansi \"^3.0.0\"\n    utila \"^0.4.0\"\n\nrepeat-element@^1.1.2:\n  version \"1.1.3\"\n  resolved \"https://registry.yarnpkg.com/repeat-element/-/repeat-element-1.1.3.tgz#782e0d825c0c5a3bb39731f84efee6b742e6b1ce\"\n\nrepeat-string@^1.6.1:\n  version \"1.6.1\"\n  resolved \"https://registry.yarnpkg.com/repeat-string/-/repeat-string-1.6.1.tgz#8dcae470e1c88abc2d600fff4a776286da75e637\"\n\nrepeating@^2.0.0:\n  version \"2.0.1\"\n  resolved \"https://registry.yarnpkg.com/repeating/-/repeating-2.0.1.tgz#5214c53a926d3552707527fbab415dbc08d06dda\"\n  dependencies:\n    is-finite \"^1.0.0\"\n\nreplace-ext@0.0.1:\n  version \"0.0.1\"\n  resolved \"https://registry.yarnpkg.com/replace-ext/-/replace-ext-0.0.1.tgz#29bbd92078a739f0bcce2b4ee41e837953522924\"\n\nrequest-progress@^2.0.1:\n  version \"2.0.1\"\n  resolved \"https://registry.yarnpkg.com/request-progress/-/request-progress-2.0.1.tgz#5d36bb57961c673aa5b788dbc8141fdf23b44e08\"\n  dependencies:\n    throttleit \"^1.0.0\"\n\nrequest@^2.65.0, request@^2.81.0, request@^2.87.0, request@^2.88.0:\n  version \"2.88.0\"\n  resolved \"https://registry.yarnpkg.com/request/-/request-2.88.0.tgz#9c2fca4f7d35b592efe57c7f0a55e81052124fef\"\n  dependencies:\n    aws-sign2 \"~0.7.0\"\n    aws4 \"^1.8.0\"\n    caseless \"~0.12.0\"\n    combined-stream \"~1.0.6\"\n    extend \"~3.0.2\"\n    forever-agent \"~0.6.1\"\n    form-data \"~2.3.2\"\n    har-validator \"~5.1.0\"\n    http-signature \"~1.2.0\"\n    is-typedarray \"~1.0.0\"\n    isstream \"~0.1.2\"\n    json-stringify-safe \"~5.0.1\"\n    mime-types \"~2.1.19\"\n    oauth-sign \"~0.9.0\"\n    performance-now \"^2.1.0\"\n    qs \"~6.5.2\"\n    safe-buffer \"^5.1.2\"\n    tough-cookie \"~2.4.3\"\n    tunnel-agent \"^0.6.0\"\n    uuid \"^3.3.2\"\n\nrequire-directory@^2.1.1:\n  version \"2.1.1\"\n  resolved \"https://registry.yarnpkg.com/require-directory/-/require-directory-2.1.1.tgz#8c64ad5fd30dab1c976e2344ffe7f792a6a6df42\"\n\nrequire-main-filename@^1.0.1:\n  version \"1.0.1\"\n  resolved \"https://registry.yarnpkg.com/require-main-filename/-/require-main-filename-1.0.1.tgz#97f717b69d48784f5f526a6c5aa8ffdda055a4d1\"\n\nrequire-main-filename@^2.0.0:\n  version \"2.0.0\"\n  resolved \"https://registry.yarnpkg.com/require-main-filename/-/require-main-filename-2.0.0.tgz#d0b329ecc7cc0f61649f62215be69af54aa8989b\"\n  integrity sha512-NKN5kMDylKuldxYLSUfrbo5Tuzh4hd+2E8NPPX02mZtn1VuREQToYe/ZdlJy+J3uCpfaiGF05e7B8W0iXbQHmg==\n\nrequire-relative@^0.8.7:\n  version \"0.8.7\"\n  resolved \"https://registry.yarnpkg.com/require-relative/-/require-relative-0.8.7.tgz#7999539fc9e047a37928fa196f8e1563dabd36de\"\n\nrequires-port@^1.0.0:\n  version \"1.0.0\"\n  resolved \"https://registry.yarnpkg.com/requires-port/-/requires-port-1.0.0.tgz#925d2601d39ac485e091cf0da5c6e694dc3dcaff\"\n\nreserved-words@^0.1.2:\n  version \"0.1.2\"\n  resolved \"https://registry.yarnpkg.com/reserved-words/-/reserved-words-0.1.2.tgz#00a0940f98cd501aeaaac316411d9adc52b31ab1\"\n\nresize-img@^1.1.0:\n  version \"1.1.2\"\n  resolved \"https://registry.yarnpkg.com/resize-img/-/resize-img-1.1.2.tgz#fad650faf3ef2c53ea63112bc272d95e9d92550e\"\n  dependencies:\n    bmp-js \"0.0.1\"\n    file-type \"^3.8.0\"\n    get-stream \"^2.0.0\"\n    jimp \"^0.2.21\"\n    jpeg-js \"^0.1.1\"\n    parse-png \"^1.1.1\"\n\nresolve-cwd@^2.0.0:\n  version \"2.0.0\"\n  resolved \"https://registry.yarnpkg.com/resolve-cwd/-/resolve-cwd-2.0.0.tgz#00a9f7387556e27038eae232caa372a6a59b665a\"\n  dependencies:\n    resolve-from \"^3.0.0\"\n\nresolve-dir@^1.0.0, resolve-dir@^1.0.1:\n  version \"1.0.1\"\n  resolved \"https://registry.yarnpkg.com/resolve-dir/-/resolve-dir-1.0.1.tgz#79a40644c362be82f26effe739c9bb5382046f43\"\n  dependencies:\n    expand-tilde \"^2.0.0\"\n    global-modules \"^1.0.0\"\n\nresolve-from@^3.0.0:\n  version \"3.0.0\"\n  resolved \"https://registry.yarnpkg.com/resolve-from/-/resolve-from-3.0.0.tgz#b22c7af7d9d6881bc8b6e653335eebcb0a188748\"\n\nresolve-pathname@^2.2.0:\n  version \"2.2.0\"\n  resolved \"https://registry.yarnpkg.com/resolve-pathname/-/resolve-pathname-2.2.0.tgz#7e9ae21ed815fd63ab189adeee64dc831eefa879\"\n\nresolve-url-loader@^3.0.1:\n  version \"3.1.0\"\n  resolved \"https://registry.yarnpkg.com/resolve-url-loader/-/resolve-url-loader-3.1.0.tgz#54d8181d33cd1b66a59544d05cadf8e4aa7d37cc\"\n  dependencies:\n    adjust-sourcemap-loader \"2.0.0\"\n    camelcase \"5.0.0\"\n    compose-function \"3.0.3\"\n    convert-source-map \"1.6.0\"\n    es6-iterator \"2.0.3\"\n    loader-utils \"1.2.3\"\n    postcss \"7.0.14\"\n    rework \"1.0.1\"\n    rework-visit \"1.0.0\"\n    source-map \"0.6.1\"\n\nresolve-url@^0.2.1:\n  version \"0.2.1\"\n  resolved \"https://registry.yarnpkg.com/resolve-url/-/resolve-url-0.2.1.tgz#2c637fe77c893afd2a663fe21aa9080068e2052a\"\n\nresolve@^1.10.0, resolve@^1.3.2:\n  version \"1.10.0\"\n  resolved \"https://registry.yarnpkg.com/resolve/-/resolve-1.10.0.tgz#3bdaaeaf45cc07f375656dfd2e54ed0810b101ba\"\n  dependencies:\n    path-parse \"^1.0.6\"\n\nret@~0.1.10:\n  version \"0.1.15\"\n  resolved \"https://registry.yarnpkg.com/ret/-/ret-0.1.15.tgz#b8a4825d5bdb1fc3f6f53c2bc33f81388681c7bc\"\n\nrework-visit@1.0.0:\n  version \"1.0.0\"\n  resolved \"https://registry.yarnpkg.com/rework-visit/-/rework-visit-1.0.0.tgz#9945b2803f219e2f7aca00adb8bc9f640f842c9a\"\n\nrework@1.0.1:\n  version \"1.0.1\"\n  resolved \"https://registry.yarnpkg.com/rework/-/rework-1.0.1.tgz#30806a841342b54510aa4110850cd48534144aa7\"\n  dependencies:\n    convert-source-map \"^0.3.3\"\n    css \"^2.0.0\"\n\nrgb-regex@^1.0.1:\n  version \"1.0.1\"\n  resolved \"https://registry.yarnpkg.com/rgb-regex/-/rgb-regex-1.0.1.tgz#c0e0d6882df0e23be254a475e8edd41915feaeb1\"\n\nrgba-regex@^1.0.0:\n  version \"1.0.0\"\n  resolved \"https://registry.yarnpkg.com/rgba-regex/-/rgba-regex-1.0.0.tgz#43374e2e2ca0968b0ef1523460b7d730ff22eeb3\"\n\nrimraf@2, rimraf@^2.2.8, rimraf@^2.5.4, rimraf@^2.6.1, rimraf@^2.6.2:\n  version \"2.6.3\"\n  resolved \"https://registry.yarnpkg.com/rimraf/-/rimraf-2.6.3.tgz#b2d104fe0d8fb27cf9e0a1cda8262dd3833c6cab\"\n  dependencies:\n    glob \"^7.1.3\"\n\nripemd160@^2.0.0, ripemd160@^2.0.1:\n  version \"2.0.2\"\n  resolved \"https://registry.yarnpkg.com/ripemd160/-/ripemd160-2.0.2.tgz#a1c1a6f624751577ba5d07914cbc92850585890c\"\n  dependencies:\n    hash-base \"^3.0.0\"\n    inherits \"^2.0.1\"\n\nrun-node@^1.0.0:\n  version \"1.0.0\"\n  resolved \"https://registry.yarnpkg.com/run-node/-/run-node-1.0.0.tgz#46b50b946a2aa2d4947ae1d886e9856fd9cabe5e\"\n\nrun-queue@^1.0.0, run-queue@^1.0.3:\n  version \"1.0.3\"\n  resolved \"https://registry.yarnpkg.com/run-queue/-/run-queue-1.0.3.tgz#e848396f057d223f24386924618e25694161ec47\"\n  dependencies:\n    aproba \"^1.1.1\"\n\nrxjs@^6.3.3:\n  version \"6.5.2\"\n  resolved \"https://registry.yarnpkg.com/rxjs/-/rxjs-6.5.2.tgz#2e35ce815cd46d84d02a209fb4e5921e051dbec7\"\n  dependencies:\n    tslib \"^1.9.0\"\n\nsafe-buffer@5.1.2, safe-buffer@^5.0.1, safe-buffer@^5.1.0, safe-buffer@^5.1.1, safe-buffer@^5.1.2, safe-buffer@~5.1.0, safe-buffer@~5.1.1:\n  version \"5.1.2\"\n  resolved \"https://registry.yarnpkg.com/safe-buffer/-/safe-buffer-5.1.2.tgz#991ec69d296e0313747d59bdfd2b745c35f8828d\"\n\nsafe-regex@^1.1.0:\n  version \"1.1.0\"\n  resolved \"https://registry.yarnpkg.com/safe-regex/-/safe-regex-1.1.0.tgz#40a3669f3b077d1e943d44629e157dd48023bf2e\"\n  dependencies:\n    ret \"~0.1.10\"\n\n\"safer-buffer@>= 2.1.2 < 3\", safer-buffer@^2.0.2, safer-buffer@^2.1.0, safer-buffer@~2.1.0:\n  version \"2.1.2\"\n  resolved \"https://registry.yarnpkg.com/safer-buffer/-/safer-buffer-2.1.2.tgz#44fa161b0187b9549dd84bb91802f9bd8385cd6a\"\n\nsass-graph@2.2.5:\n  version \"2.2.5\"\n  resolved \"https://registry.yarnpkg.com/sass-graph/-/sass-graph-2.2.5.tgz#a981c87446b8319d96dce0671e487879bd24c2e8\"\n  integrity sha512-VFWDAHOe6mRuT4mZRd4eKE+d8Uedrk6Xnh7Sh9b4NGufQLQjOrvf/MQoOdx+0s92L89FeyUUNfU597j/3uNpag==\n  dependencies:\n    glob \"^7.0.0\"\n    lodash \"^4.0.0\"\n    scss-tokenizer \"^0.2.3\"\n    yargs \"^13.3.2\"\n\nsass-loader@^7.1.0:\n  version \"7.1.0\"\n  resolved \"https://registry.yarnpkg.com/sass-loader/-/sass-loader-7.1.0.tgz#16fd5138cb8b424bf8a759528a1972d72aad069d\"\n  dependencies:\n    clone-deep \"^2.0.1\"\n    loader-utils \"^1.0.1\"\n    lodash.tail \"^4.1.1\"\n    neo-async \"^2.5.0\"\n    pify \"^3.0.0\"\n    semver \"^5.5.0\"\n\nsax@>=0.6.0, sax@^1.2.4, sax@~1.2.4:\n  version \"1.2.4\"\n  resolved \"https://registry.yarnpkg.com/sax/-/sax-1.2.4.tgz#2816234e2378bddc4e5354fab5caa895df7100d9\"\n\nscheduler@^0.13.3:\n  version \"0.13.3\"\n  resolved \"https://registry.yarnpkg.com/scheduler/-/scheduler-0.13.3.tgz#bed3c5850f62ea9c716a4d781f9daeb9b2a58896\"\n  dependencies:\n    loose-envify \"^1.1.0\"\n    object-assign \"^4.1.1\"\n\nscheduler@^0.13.6:\n  version \"0.13.6\"\n  resolved \"https://registry.yarnpkg.com/scheduler/-/scheduler-0.13.6.tgz#466a4ec332467b31a91b9bf74e5347072e4cd889\"\n  dependencies:\n    loose-envify \"^1.1.0\"\n    object-assign \"^4.1.1\"\n\nschema-utils@^0.4.5:\n  version \"0.4.7\"\n  resolved \"https://registry.yarnpkg.com/schema-utils/-/schema-utils-0.4.7.tgz#ba74f597d2be2ea880131746ee17d0a093c68187\"\n  dependencies:\n    ajv \"^6.1.0\"\n    ajv-keywords \"^3.1.0\"\n\nschema-utils@^1.0.0:\n  version \"1.0.0\"\n  resolved \"https://registry.yarnpkg.com/schema-utils/-/schema-utils-1.0.0.tgz#0b79a93204d7b600d4b2850d1f66c2a34951c770\"\n  dependencies:\n    ajv \"^6.1.0\"\n    ajv-errors \"^1.0.0\"\n    ajv-keywords \"^3.1.0\"\n\nscss-tokenizer@^0.2.3:\n  version \"0.2.3\"\n  resolved \"https://registry.yarnpkg.com/scss-tokenizer/-/scss-tokenizer-0.2.3.tgz#8eb06db9a9723333824d3f5530641149847ce5d1\"\n  dependencies:\n    js-base64 \"^2.1.8\"\n    source-map \"^0.4.2\"\n\nselect-hose@^2.0.0:\n  version \"2.0.0\"\n  resolved \"https://registry.yarnpkg.com/select-hose/-/select-hose-2.0.0.tgz#625d8658f865af43ec962bfc376a37359a4994ca\"\n\nselfsigned@^1.9.1:\n  version \"1.10.4\"\n  resolved \"https://registry.yarnpkg.com/selfsigned/-/selfsigned-1.10.4.tgz#cdd7eccfca4ed7635d47a08bf2d5d3074092e2cd\"\n  dependencies:\n    node-forge \"0.7.5\"\n\nsemver-compare@^1.0.0:\n  version \"1.0.0\"\n  resolved \"https://registry.yarnpkg.com/semver-compare/-/semver-compare-1.0.0.tgz#0dee216a1c941ab37e9efb1788f6afc5ff5537fc\"\n\n\"semver@2 || 3 || 4 || 5\", semver@^5.3.0, semver@^5.4.1, semver@^5.5.0, semver@^5.6.0:\n  version \"5.6.0\"\n  resolved \"https://registry.yarnpkg.com/semver/-/semver-5.6.0.tgz#7e74256fbaa49c75aa7c7a205cc22799cac80004\"\n\nsemver@^6.0.0:\n  version \"6.1.0\"\n  resolved \"https://registry.yarnpkg.com/semver/-/semver-6.1.0.tgz#e95dc415d45ecf03f2f9f83b264a6b11f49c0cca\"\n\nsemver@~5.3.0:\n  version \"5.3.0\"\n  resolved \"https://registry.yarnpkg.com/semver/-/semver-5.3.0.tgz#9b2ce5d3de02d17c6012ad326aa6b4d0cf54f94f\"\n\nsend@0.16.2:\n  version \"0.16.2\"\n  resolved \"https://registry.yarnpkg.com/send/-/send-0.16.2.tgz#6ecca1e0f8c156d141597559848df64730a6bbc1\"\n  dependencies:\n    debug \"2.6.9\"\n    depd \"~1.1.2\"\n    destroy \"~1.0.4\"\n    encodeurl \"~1.0.2\"\n    escape-html \"~1.0.3\"\n    etag \"~1.8.1\"\n    fresh \"0.5.2\"\n    http-errors \"~1.6.2\"\n    mime \"1.4.1\"\n    ms \"2.0.0\"\n    on-finished \"~2.3.0\"\n    range-parser \"~1.2.0\"\n    statuses \"~1.4.0\"\n\nserialize-javascript@^1.4.0:\n  version \"1.6.1\"\n  resolved \"https://registry.yarnpkg.com/serialize-javascript/-/serialize-javascript-1.6.1.tgz#4d1f697ec49429a847ca6f442a2a755126c4d879\"\n\nserve-index@^1.7.2:\n  version \"1.9.1\"\n  resolved \"https://registry.yarnpkg.com/serve-index/-/serve-index-1.9.1.tgz#d3768d69b1e7d82e5ce050fff5b453bea12a9239\"\n  dependencies:\n    accepts \"~1.3.4\"\n    batch \"0.6.1\"\n    debug \"2.6.9\"\n    escape-html \"~1.0.3\"\n    http-errors \"~1.6.2\"\n    mime-types \"~2.1.17\"\n    parseurl \"~1.3.2\"\n\nserve-static@1.13.2:\n  version \"1.13.2\"\n  resolved \"https://registry.yarnpkg.com/serve-static/-/serve-static-1.13.2.tgz#095e8472fd5b46237db50ce486a43f4b86c6cec1\"\n  dependencies:\n    encodeurl \"~1.0.2\"\n    escape-html \"~1.0.3\"\n    parseurl \"~1.3.2\"\n    send \"0.16.2\"\n\nset-blocking@^2.0.0, set-blocking@~2.0.0:\n  version \"2.0.0\"\n  resolved \"https://registry.yarnpkg.com/set-blocking/-/set-blocking-2.0.0.tgz#045f9782d011ae9a6803ddd382b24392b3d890f7\"\n\nset-value@^0.4.3:\n  version \"0.4.3\"\n  resolved \"https://registry.yarnpkg.com/set-value/-/set-value-0.4.3.tgz#7db08f9d3d22dc7f78e53af3c3bf4666ecdfccf1\"\n  dependencies:\n    extend-shallow \"^2.0.1\"\n    is-extendable \"^0.1.1\"\n    is-plain-object \"^2.0.1\"\n    to-object-path \"^0.3.0\"\n\nset-value@^2.0.0:\n  version \"2.0.0\"\n  resolved \"https://registry.yarnpkg.com/set-value/-/set-value-2.0.0.tgz#71ae4a88f0feefbbf52d1ea604f3fb315ebb6274\"\n  dependencies:\n    extend-shallow \"^2.0.1\"\n    is-extendable \"^0.1.1\"\n    is-plain-object \"^2.0.3\"\n    split-string \"^3.0.1\"\n\nsetimmediate@^1.0.4:\n  version \"1.0.5\"\n  resolved \"https://registry.yarnpkg.com/setimmediate/-/setimmediate-1.0.5.tgz#290cbb232e306942d7d7ea9b83732ab7856f8285\"\n\nsetprototypeof@1.1.0:\n  version \"1.1.0\"\n  resolved \"https://registry.yarnpkg.com/setprototypeof/-/setprototypeof-1.1.0.tgz#d0bd85536887b6fe7c0d818cb962d9d91c54e656\"\n\nsha.js@^2.4.0, sha.js@^2.4.8:\n  version \"2.4.11\"\n  resolved \"https://registry.yarnpkg.com/sha.js/-/sha.js-2.4.11.tgz#37a5cf0b81ecbc6943de109ba2960d1b26584ae7\"\n  dependencies:\n    inherits \"^2.0.1\"\n    safe-buffer \"^5.0.1\"\n\nshallow-clone@^1.0.0:\n  version \"1.0.0\"\n  resolved \"https://registry.yarnpkg.com/shallow-clone/-/shallow-clone-1.0.0.tgz#4480cd06e882ef68b2ad88a3ea54832e2c48b571\"\n  dependencies:\n    is-extendable \"^0.1.1\"\n    kind-of \"^5.0.0\"\n    mixin-object \"^2.0.1\"\n\nshallowequal@^1.1.0:\n  version \"1.1.0\"\n  resolved \"https://registry.yarnpkg.com/shallowequal/-/shallowequal-1.1.0.tgz#188d521de95b9087404fd4dcb68b13df0ae4e7f8\"\n\nshebang-command@^1.2.0:\n  version \"1.2.0\"\n  resolved \"https://registry.yarnpkg.com/shebang-command/-/shebang-command-1.2.0.tgz#44aac65b695b03398968c39f363fee5deafdf1ea\"\n  dependencies:\n    shebang-regex \"^1.0.0\"\n\nshebang-regex@^1.0.0:\n  version \"1.0.0\"\n  resolved \"https://registry.yarnpkg.com/shebang-regex/-/shebang-regex-1.0.0.tgz#da42f49740c0b42db2ca9728571cb190c98efea3\"\n\nsignal-exit@^3.0.0:\n  version \"3.0.2\"\n  resolved \"https://registry.yarnpkg.com/signal-exit/-/signal-exit-3.0.2.tgz#b5fdc08f1287ea1178628e415e25132b73646c6d\"\n\nsimple-swizzle@^0.2.2:\n  version \"0.2.2\"\n  resolved \"https://registry.yarnpkg.com/simple-swizzle/-/simple-swizzle-0.2.2.tgz#a4da6b635ffcccca33f70d17cb92592de95e557a\"\n  dependencies:\n    is-arrayish \"^0.3.1\"\n\nslash@^1.0.0:\n  version \"1.0.0\"\n  resolved \"https://registry.yarnpkg.com/slash/-/slash-1.0.0.tgz#c41f2f6c39fc16d1cd17ad4b5d896114ae470d55\"\n\nslash@^2.0.0:\n  version \"2.0.0\"\n  resolved \"https://registry.yarnpkg.com/slash/-/slash-2.0.0.tgz#de552851a1759df3a8f206535442f5ec4ddeab44\"\n\nsnapdragon-node@^2.0.1:\n  version \"2.1.1\"\n  resolved \"https://registry.yarnpkg.com/snapdragon-node/-/snapdragon-node-2.1.1.tgz#6c175f86ff14bdb0724563e8f3c1b021a286853b\"\n  dependencies:\n    define-property \"^1.0.0\"\n    isobject \"^3.0.0\"\n    snapdragon-util \"^3.0.1\"\n\nsnapdragon-util@^3.0.1:\n  version \"3.0.1\"\n  resolved \"https://registry.yarnpkg.com/snapdragon-util/-/snapdragon-util-3.0.1.tgz#f956479486f2acd79700693f6f7b805e45ab56e2\"\n  dependencies:\n    kind-of \"^3.2.0\"\n\nsnapdragon@^0.8.1:\n  version \"0.8.2\"\n  resolved \"https://registry.yarnpkg.com/snapdragon/-/snapdragon-0.8.2.tgz#64922e7c565b0e14204ba1aa7d6964278d25182d\"\n  dependencies:\n    base \"^0.11.1\"\n    debug \"^2.2.0\"\n    define-property \"^0.2.5\"\n    extend-shallow \"^2.0.1\"\n    map-cache \"^0.2.2\"\n    source-map \"^0.5.6\"\n    source-map-resolve \"^0.5.0\"\n    use \"^3.1.0\"\n\nsockjs-client@1.3.0:\n  version \"1.3.0\"\n  resolved \"https://registry.yarnpkg.com/sockjs-client/-/sockjs-client-1.3.0.tgz#12fc9d6cb663da5739d3dc5fb6e8687da95cb177\"\n  dependencies:\n    debug \"^3.2.5\"\n    eventsource \"^1.0.7\"\n    faye-websocket \"~0.11.1\"\n    inherits \"^2.0.3\"\n    json3 \"^3.3.2\"\n    url-parse \"^1.4.3\"\n\nsockjs@0.3.19:\n  version \"0.3.19\"\n  resolved \"https://registry.yarnpkg.com/sockjs/-/sockjs-0.3.19.tgz#d976bbe800af7bd20ae08598d582393508993c0d\"\n  dependencies:\n    faye-websocket \"^0.10.0\"\n    uuid \"^3.0.1\"\n\nsource-list-map@^2.0.0:\n  version \"2.0.1\"\n  resolved \"https://registry.yarnpkg.com/source-list-map/-/source-list-map-2.0.1.tgz#3993bd873bfc48479cca9ea3a547835c7c154b34\"\n\nsource-map-resolve@^0.5.0, source-map-resolve@^0.5.2:\n  version \"0.5.2\"\n  resolved \"https://registry.yarnpkg.com/source-map-resolve/-/source-map-resolve-0.5.2.tgz#72e2cc34095543e43b2c62b2c4c10d4a9054f259\"\n  dependencies:\n    atob \"^2.1.1\"\n    decode-uri-component \"^0.2.0\"\n    resolve-url \"^0.2.1\"\n    source-map-url \"^0.4.0\"\n    urix \"^0.1.0\"\n\nsource-map-support@~0.5.9:\n  version \"0.5.10\"\n  resolved \"https://registry.yarnpkg.com/source-map-support/-/source-map-support-0.5.10.tgz#2214080bc9d51832511ee2bab96e3c2f9353120c\"\n  dependencies:\n    buffer-from \"^1.0.0\"\n    source-map \"^0.6.0\"\n\nsource-map-url@^0.4.0:\n  version \"0.4.0\"\n  resolved \"https://registry.yarnpkg.com/source-map-url/-/source-map-url-0.4.0.tgz#3e935d7ddd73631b97659956d55128e87b5084a3\"\n\nsource-map@0.6.1, source-map@^0.6.0, source-map@^0.6.1, source-map@~0.6.0, source-map@~0.6.1:\n  version \"0.6.1\"\n  resolved \"https://registry.yarnpkg.com/source-map/-/source-map-0.6.1.tgz#74722af32e9614e9c287a8d0bbde48b5e2f1a263\"\n\nsource-map@^0.4.2:\n  version \"0.4.4\"\n  resolved \"https://registry.yarnpkg.com/source-map/-/source-map-0.4.4.tgz#eba4f5da9c0dc999de68032d8b4f76173652036b\"\n  dependencies:\n    amdefine \">=0.0.4\"\n\nsource-map@^0.5.0, source-map@^0.5.3, source-map@^0.5.6, source-map@~0.5.0:\n  version \"0.5.7\"\n  resolved \"https://registry.yarnpkg.com/source-map/-/source-map-0.5.7.tgz#8a039d2d1021d22d1ea14c80d8ea468ba2ef3fcc\"\n\nspawn-command@^0.0.2-1:\n  version \"0.0.2-1\"\n  resolved \"https://registry.yarnpkg.com/spawn-command/-/spawn-command-0.0.2-1.tgz#62f5e9466981c1b796dc5929937e11c9c6921bd0\"\n\nspdx-correct@^3.0.0:\n  version \"3.1.0\"\n  resolved \"https://registry.yarnpkg.com/spdx-correct/-/spdx-correct-3.1.0.tgz#fb83e504445268f154b074e218c87c003cd31df4\"\n  dependencies:\n    spdx-expression-parse \"^3.0.0\"\n    spdx-license-ids \"^3.0.0\"\n\nspdx-exceptions@^2.1.0:\n  version \"2.2.0\"\n  resolved \"https://registry.yarnpkg.com/spdx-exceptions/-/spdx-exceptions-2.2.0.tgz#2ea450aee74f2a89bfb94519c07fcd6f41322977\"\n\nspdx-expression-parse@^3.0.0:\n  version \"3.0.0\"\n  resolved \"https://registry.yarnpkg.com/spdx-expression-parse/-/spdx-expression-parse-3.0.0.tgz#99e119b7a5da00e05491c9fa338b7904823b41d0\"\n  dependencies:\n    spdx-exceptions \"^2.1.0\"\n    spdx-license-ids \"^3.0.0\"\n\nspdx-license-ids@^3.0.0:\n  version \"3.0.3\"\n  resolved \"https://registry.yarnpkg.com/spdx-license-ids/-/spdx-license-ids-3.0.3.tgz#81c0ce8f21474756148bbb5f3bfc0f36bf15d76e\"\n\nspdy-transport@^3.0.0:\n  version \"3.0.0\"\n  resolved \"https://registry.yarnpkg.com/spdy-transport/-/spdy-transport-3.0.0.tgz#00d4863a6400ad75df93361a1608605e5dcdcf31\"\n  dependencies:\n    debug \"^4.1.0\"\n    detect-node \"^2.0.4\"\n    hpack.js \"^2.1.6\"\n    obuf \"^1.1.2\"\n    readable-stream \"^3.0.6\"\n    wbuf \"^1.7.3\"\n\nspdy@^4.0.0:\n  version \"4.0.0\"\n  resolved \"https://registry.yarnpkg.com/spdy/-/spdy-4.0.0.tgz#81f222b5a743a329aa12cea6a390e60e9b613c52\"\n  dependencies:\n    debug \"^4.1.0\"\n    handle-thing \"^2.0.0\"\n    http-deceiver \"^1.2.7\"\n    select-hose \"^2.0.0\"\n    spdy-transport \"^3.0.0\"\n\nsplit-string@^3.0.1, split-string@^3.0.2:\n  version \"3.1.0\"\n  resolved \"https://registry.yarnpkg.com/split-string/-/split-string-3.1.0.tgz#7cb09dda3a86585705c64b39a6466038682e8fe2\"\n  dependencies:\n    extend-shallow \"^3.0.0\"\n\nsprintf-js@~1.0.2:\n  version \"1.0.3\"\n  resolved \"https://registry.yarnpkg.com/sprintf-js/-/sprintf-js-1.0.3.tgz#04e6926f662895354f3dd015203633b857297e2c\"\n\nsshpk@^1.7.0:\n  version \"1.16.1\"\n  resolved \"https://registry.yarnpkg.com/sshpk/-/sshpk-1.16.1.tgz#fb661c0bef29b39db40769ee39fa70093d6f6877\"\n  dependencies:\n    asn1 \"~0.2.3\"\n    assert-plus \"^1.0.0\"\n    bcrypt-pbkdf \"^1.0.0\"\n    dashdash \"^1.12.0\"\n    ecc-jsbn \"~0.1.1\"\n    getpass \"^0.1.1\"\n    jsbn \"~0.1.0\"\n    safer-buffer \"^2.0.2\"\n    tweetnacl \"~0.14.0\"\n\nssri@^6.0.1:\n  version \"6.0.1\"\n  resolved \"https://registry.yarnpkg.com/ssri/-/ssri-6.0.1.tgz#2a3c41b28dd45b62b63676ecb74001265ae9edd8\"\n  dependencies:\n    figgy-pudding \"^3.5.1\"\n\nstable@^0.1.8:\n  version \"0.1.8\"\n  resolved \"https://registry.yarnpkg.com/stable/-/stable-0.1.8.tgz#836eb3c8382fe2936feaf544631017ce7d47a3cf\"\n\nstackframe@^1.0.4:\n  version \"1.0.4\"\n  resolved \"https://registry.yarnpkg.com/stackframe/-/stackframe-1.0.4.tgz#357b24a992f9427cba6b545d96a14ed2cbca187b\"\n\nstatic-extend@^0.1.1:\n  version \"0.1.2\"\n  resolved \"https://registry.yarnpkg.com/static-extend/-/static-extend-0.1.2.tgz#60809c39cbff55337226fd5e0b520f341f1fb5c6\"\n  dependencies:\n    define-property \"^0.2.5\"\n    object-copy \"^0.1.0\"\n\n\"statuses@>= 1.4.0 < 2\":\n  version \"1.5.0\"\n  resolved \"https://registry.yarnpkg.com/statuses/-/statuses-1.5.0.tgz#161c7dac177659fd9811f43771fa99381478628c\"\n\nstatuses@~1.4.0:\n  version \"1.4.0\"\n  resolved \"https://registry.yarnpkg.com/statuses/-/statuses-1.4.0.tgz#bb73d446da2796106efcc1b601a253d6c46bd087\"\n\nstdout-stream@^1.4.0:\n  version \"1.4.1\"\n  resolved \"https://registry.yarnpkg.com/stdout-stream/-/stdout-stream-1.4.1.tgz#5ac174cdd5cd726104aa0c0b2bd83815d8d535de\"\n  dependencies:\n    readable-stream \"^2.0.1\"\n\nstream-browserify@^2.0.1:\n  version \"2.0.2\"\n  resolved \"https://registry.yarnpkg.com/stream-browserify/-/stream-browserify-2.0.2.tgz#87521d38a44aa7ee91ce1cd2a47df0cb49dd660b\"\n  dependencies:\n    inherits \"~2.0.1\"\n    readable-stream \"^2.0.2\"\n\nstream-each@^1.1.0:\n  version \"1.2.3\"\n  resolved \"https://registry.yarnpkg.com/stream-each/-/stream-each-1.2.3.tgz#ebe27a0c389b04fbcc233642952e10731afa9bae\"\n  dependencies:\n    end-of-stream \"^1.1.0\"\n    stream-shift \"^1.0.0\"\n\nstream-http@^2.7.2:\n  version \"2.8.3\"\n  resolved \"https://registry.yarnpkg.com/stream-http/-/stream-http-2.8.3.tgz#b2d242469288a5a27ec4fe8933acf623de6514fc\"\n  dependencies:\n    builtin-status-codes \"^3.0.0\"\n    inherits \"^2.0.1\"\n    readable-stream \"^2.3.6\"\n    to-arraybuffer \"^1.0.0\"\n    xtend \"^4.0.0\"\n\nstream-shift@^1.0.0:\n  version \"1.0.0\"\n  resolved \"https://registry.yarnpkg.com/stream-shift/-/stream-shift-1.0.0.tgz#d5c752825e5367e786f78e18e445ea223a155952\"\n\nstream-to-buffer@^0.1.0:\n  version \"0.1.0\"\n  resolved \"https://registry.yarnpkg.com/stream-to-buffer/-/stream-to-buffer-0.1.0.tgz#26799d903ab2025c9bd550ac47171b00f8dd80a9\"\n  dependencies:\n    stream-to \"~0.2.0\"\n\nstream-to@~0.2.0:\n  version \"0.2.2\"\n  resolved \"https://registry.yarnpkg.com/stream-to/-/stream-to-0.2.2.tgz#84306098d85fdb990b9fa300b1b3ccf55e8ef01d\"\n\nstring-width@^1.0.1:\n  version \"1.0.2\"\n  resolved \"https://registry.yarnpkg.com/string-width/-/string-width-1.0.2.tgz#118bdf5b8cdc51a2a7e70d211e07e2b0b9b107d3\"\n  dependencies:\n    code-point-at \"^1.0.0\"\n    is-fullwidth-code-point \"^1.0.0\"\n    strip-ansi \"^3.0.0\"\n\n\"string-width@^1.0.2 || 2\", string-width@^2.0.0, string-width@^2.1.1:\n  version \"2.1.1\"\n  resolved \"https://registry.yarnpkg.com/string-width/-/string-width-2.1.1.tgz#ab93f27a8dc13d28cac815c462143a6d9012ae9e\"\n  dependencies:\n    is-fullwidth-code-point \"^2.0.0\"\n    strip-ansi \"^4.0.0\"\n\nstring-width@^3.0.0, string-width@^3.1.0:\n  version \"3.1.0\"\n  resolved \"https://registry.yarnpkg.com/string-width/-/string-width-3.1.0.tgz#22767be21b62af1081574306f69ac51b62203961\"\n  integrity sha512-vafcv6KjVZKSgz06oM/H6GDBrAtz8vdhQakGjFIvNrHA6y3HCF1CInLy+QLq8dTJPQ1b+KDUqDFctkdRW44e1w==\n  dependencies:\n    emoji-regex \"^7.0.1\"\n    is-fullwidth-code-point \"^2.0.0\"\n    strip-ansi \"^5.1.0\"\n\nstring.prototype.trim@^1.1.2:\n  version \"1.1.2\"\n  resolved \"https://registry.yarnpkg.com/string.prototype.trim/-/string.prototype.trim-1.1.2.tgz#d04de2c89e137f4d7d206f086b5ed2fae6be8cea\"\n  dependencies:\n    define-properties \"^1.1.2\"\n    es-abstract \"^1.5.0\"\n    function-bind \"^1.0.2\"\n\nstring_decoder@^1.0.0, string_decoder@^1.1.1:\n  version \"1.2.0\"\n  resolved \"https://registry.yarnpkg.com/string_decoder/-/string_decoder-1.2.0.tgz#fe86e738b19544afe70469243b2a1ee9240eae8d\"\n  dependencies:\n    safe-buffer \"~5.1.0\"\n\nstring_decoder@~0.10.x:\n  version \"0.10.31\"\n  resolved \"https://registry.yarnpkg.com/string_decoder/-/string_decoder-0.10.31.tgz#62e203bc41766c6c28c9fc84301dab1c5310fa94\"\n\nstring_decoder@~1.1.1:\n  version \"1.1.1\"\n  resolved \"https://registry.yarnpkg.com/string_decoder/-/string_decoder-1.1.1.tgz#9cf1611ba62685d7030ae9e4ba34149c3af03fc8\"\n  dependencies:\n    safe-buffer \"~5.1.0\"\n\nstrip-ansi@^3.0.0, strip-ansi@^3.0.1:\n  version \"3.0.1\"\n  resolved \"https://registry.yarnpkg.com/strip-ansi/-/strip-ansi-3.0.1.tgz#6a385fb8853d952d5ff05d0e8aaf94278dc63dcf\"\n  dependencies:\n    ansi-regex \"^2.0.0\"\n\nstrip-ansi@^4.0.0:\n  version \"4.0.0\"\n  resolved \"https://registry.yarnpkg.com/strip-ansi/-/strip-ansi-4.0.0.tgz#a8479022eb1ac368a871389b635262c505ee368f\"\n  dependencies:\n    ansi-regex \"^3.0.0\"\n\nstrip-ansi@^5.0.0, strip-ansi@^5.1.0, strip-ansi@^5.2.0:\n  version \"5.2.0\"\n  resolved \"https://registry.yarnpkg.com/strip-ansi/-/strip-ansi-5.2.0.tgz#8c9a536feb6afc962bdfa5b104a5091c1ad9c0ae\"\n  integrity sha512-DuRs1gKbBqsMKIZlrffwlug8MHkcnpjs5VPmL1PAh+mA30U0DTotfDZ0d2UUsXpPmPmMMJ6W773MaA3J+lbiWA==\n  dependencies:\n    ansi-regex \"^4.1.0\"\n\nstrip-bom@^2.0.0:\n  version \"2.0.0\"\n  resolved \"https://registry.yarnpkg.com/strip-bom/-/strip-bom-2.0.0.tgz#6219a85616520491f35788bdbf1447a99c7e6b0e\"\n  dependencies:\n    is-utf8 \"^0.2.0\"\n\nstrip-eof@^1.0.0:\n  version \"1.0.0\"\n  resolved \"https://registry.yarnpkg.com/strip-eof/-/strip-eof-1.0.0.tgz#bb43ff5598a6eb05d89b59fcd129c983313606bf\"\n\nstrip-indent@^1.0.1:\n  version \"1.0.1\"\n  resolved \"https://registry.yarnpkg.com/strip-indent/-/strip-indent-1.0.1.tgz#0c7962a6adefa7bbd4ac366460a638552ae1a0a2\"\n  dependencies:\n    get-stdin \"^4.0.1\"\n\nstrip-json-comments@~2.0.1:\n  version \"2.0.1\"\n  resolved \"https://registry.yarnpkg.com/strip-json-comments/-/strip-json-comments-2.0.1.tgz#3c531942e908c2697c0ec344858c286c7ca0a60a\"\n\nstyle-loader@^0.21.0:\n  version \"0.21.0\"\n  resolved \"https://registry.yarnpkg.com/style-loader/-/style-loader-0.21.0.tgz#68c52e5eb2afc9ca92b6274be277ee59aea3a852\"\n  dependencies:\n    loader-utils \"^1.1.0\"\n    schema-utils \"^0.4.5\"\n\nstylehacks@^4.0.0:\n  version \"4.0.3\"\n  resolved \"https://registry.yarnpkg.com/stylehacks/-/stylehacks-4.0.3.tgz#6718fcaf4d1e07d8a1318690881e8d96726a71d5\"\n  dependencies:\n    browserslist \"^4.0.0\"\n    postcss \"^7.0.0\"\n    postcss-selector-parser \"^3.0.0\"\n\nsupports-color@^2.0.0:\n  version \"2.0.0\"\n  resolved \"https://registry.yarnpkg.com/supports-color/-/supports-color-2.0.0.tgz#535d045ce6b6363fa40117084629995e9df324c7\"\n\nsupports-color@^3.2.3:\n  version \"3.2.3\"\n  resolved \"https://registry.yarnpkg.com/supports-color/-/supports-color-3.2.3.tgz#65ac0504b3954171d8a64946b2ae3cbb8a5f54f6\"\n  dependencies:\n    has-flag \"^1.0.0\"\n\nsupports-color@^4.5.0:\n  version \"4.5.0\"\n  resolved \"https://registry.yarnpkg.com/supports-color/-/supports-color-4.5.0.tgz#be7a0de484dec5c5cddf8b3d59125044912f635b\"\n  dependencies:\n    has-flag \"^2.0.0\"\n\nsupports-color@^5.3.0, supports-color@^5.4.0, supports-color@^5.5.0:\n  version \"5.5.0\"\n  resolved \"https://registry.yarnpkg.com/supports-color/-/supports-color-5.5.0.tgz#e2e69a44ac8772f78a1ec0b35b689df6530efc8f\"\n  dependencies:\n    has-flag \"^3.0.0\"\n\nsupports-color@^6.1.0:\n  version \"6.1.0\"\n  resolved \"https://registry.yarnpkg.com/supports-color/-/supports-color-6.1.0.tgz#0764abc69c63d5ac842dd4867e8d025e880df8f3\"\n  dependencies:\n    has-flag \"^3.0.0\"\n\nsvg2png@~3.0.1:\n  version \"3.0.1\"\n  resolved \"https://registry.yarnpkg.com/svg2png/-/svg2png-3.0.1.tgz#a2644d68b0231ac00af431aa163714ff17106447\"\n  dependencies:\n    phantomjs-prebuilt \"^2.1.10\"\n    pn \"^1.0.0\"\n    yargs \"^3.31.0\"\n\nsvgo@^1.0.0:\n  version \"1.2.0\"\n  resolved \"https://registry.yarnpkg.com/svgo/-/svgo-1.2.0.tgz#305a8fc0f4f9710828c65039bb93d5793225ffc3\"\n  dependencies:\n    chalk \"^2.4.1\"\n    coa \"^2.0.2\"\n    css-select \"^2.0.0\"\n    css-select-base-adapter \"^0.1.1\"\n    css-tree \"1.0.0-alpha.28\"\n    css-url-regex \"^1.1.0\"\n    csso \"^3.5.1\"\n    js-yaml \"^3.12.0\"\n    mkdirp \"~0.5.1\"\n    object.values \"^1.1.0\"\n    sax \"~1.2.4\"\n    stable \"^0.1.8\"\n    unquote \"~1.1.1\"\n    util.promisify \"~1.0.0\"\n\nsymbol-observable@^1.2.0:\n  version \"1.2.0\"\n  resolved \"https://registry.yarnpkg.com/symbol-observable/-/symbol-observable-1.2.0.tgz#c22688aed4eab3cdc2dfeacbb561660560a00804\"\n\ntapable@^1.0.0, tapable@^1.1.0:\n  version \"1.1.1\"\n  resolved \"https://registry.yarnpkg.com/tapable/-/tapable-1.1.1.tgz#4d297923c5a72a42360de2ab52dadfaaec00018e\"\n\ntar@^2.0.0:\n  version \"2.2.1\"\n  resolved \"https://registry.yarnpkg.com/tar/-/tar-2.2.1.tgz#8e4d2a256c0e2185c6b18ad694aec968b83cb1d1\"\n  dependencies:\n    block-stream \"*\"\n    fstream \"^1.0.2\"\n    inherits \"2\"\n\ntar@^4:\n  version \"4.4.8\"\n  resolved \"https://registry.yarnpkg.com/tar/-/tar-4.4.8.tgz#b19eec3fde2a96e64666df9fdb40c5ca1bc3747d\"\n  dependencies:\n    chownr \"^1.1.1\"\n    fs-minipass \"^1.2.5\"\n    minipass \"^2.3.4\"\n    minizlib \"^1.1.1\"\n    mkdirp \"^0.5.0\"\n    safe-buffer \"^5.1.2\"\n    yallist \"^3.0.2\"\n\nterser-webpack-plugin@^1.1.0:\n  version \"1.2.3\"\n  resolved \"https://registry.yarnpkg.com/terser-webpack-plugin/-/terser-webpack-plugin-1.2.3.tgz#3f98bc902fac3e5d0de730869f50668561262ec8\"\n  dependencies:\n    cacache \"^11.0.2\"\n    find-cache-dir \"^2.0.0\"\n    schema-utils \"^1.0.0\"\n    serialize-javascript \"^1.4.0\"\n    source-map \"^0.6.1\"\n    terser \"^3.16.1\"\n    webpack-sources \"^1.1.0\"\n    worker-farm \"^1.5.2\"\n\nterser@^3.16.1:\n  version \"3.16.1\"\n  resolved \"https://registry.yarnpkg.com/terser/-/terser-3.16.1.tgz#5b0dd4fa1ffd0b0b43c2493b2c364fd179160493\"\n  dependencies:\n    commander \"~2.17.1\"\n    source-map \"~0.6.1\"\n    source-map-support \"~0.5.9\"\n\nthrottleit@^1.0.0:\n  version \"1.0.0\"\n  resolved \"https://registry.yarnpkg.com/throttleit/-/throttleit-1.0.0.tgz#9e785836daf46743145a5984b6268d828528ac6c\"\n\nthrough2@^2.0.0:\n  version \"2.0.5\"\n  resolved \"https://registry.yarnpkg.com/through2/-/through2-2.0.5.tgz#01c1e39eb31d07cb7d03a96a70823260b23132cd\"\n  dependencies:\n    readable-stream \"~2.3.6\"\n    xtend \"~4.0.1\"\n\nthrough@~2.3.6:\n  version \"2.3.8\"\n  resolved \"https://registry.yarnpkg.com/through/-/through-2.3.8.tgz#0dd4c9ffaabc357960b1b724115d7e0e86a2e1f5\"\n\nthunky@^1.0.2:\n  version \"1.0.3\"\n  resolved \"https://registry.yarnpkg.com/thunky/-/thunky-1.0.3.tgz#f5df732453407b09191dae73e2a8cc73f381a826\"\n\ntimers-browserify@^2.0.4:\n  version \"2.0.10\"\n  resolved \"https://registry.yarnpkg.com/timers-browserify/-/timers-browserify-2.0.10.tgz#1d28e3d2aadf1d5a5996c4e9f95601cd053480ae\"\n  dependencies:\n    setimmediate \"^1.0.4\"\n\ntimsort@^0.3.0:\n  version \"0.3.0\"\n  resolved \"https://registry.yarnpkg.com/timsort/-/timsort-0.3.0.tgz#405411a8e7e6339fe64db9a234de11dc31e02bd4\"\n\ntinycolor2@^1.1.2:\n  version \"1.4.1\"\n  resolved \"https://registry.yarnpkg.com/tinycolor2/-/tinycolor2-1.4.1.tgz#f4fad333447bc0b07d4dc8e9209d8f39a8ac77e8\"\n\ntmp@^0.0.33:\n  version \"0.0.33\"\n  resolved \"https://registry.yarnpkg.com/tmp/-/tmp-0.0.33.tgz#6d34335889768d21b2bcda0aa277ced3b1bfadf9\"\n  dependencies:\n    os-tmpdir \"~1.0.2\"\n\nto-arraybuffer@^1.0.0:\n  version \"1.0.1\"\n  resolved \"https://registry.yarnpkg.com/to-arraybuffer/-/to-arraybuffer-1.0.1.tgz#7d229b1fcc637e466ca081180836a7aabff83f43\"\n\nto-fast-properties@^2.0.0:\n  version \"2.0.0\"\n  resolved \"https://registry.yarnpkg.com/to-fast-properties/-/to-fast-properties-2.0.0.tgz#dc5e698cbd079265bc73e0377681a4e4e83f616e\"\n\nto-ico@^1.1.2:\n  version \"1.1.5\"\n  resolved \"https://registry.yarnpkg.com/to-ico/-/to-ico-1.1.5.tgz#1d32da5f2c90922edee6b686d610c54527b5a8d5\"\n  dependencies:\n    arrify \"^1.0.1\"\n    buffer-alloc \"^1.1.0\"\n    image-size \"^0.5.0\"\n    parse-png \"^1.0.0\"\n    resize-img \"^1.1.0\"\n\nto-object-path@^0.3.0:\n  version \"0.3.0\"\n  resolved \"https://registry.yarnpkg.com/to-object-path/-/to-object-path-0.3.0.tgz#297588b7b0e7e0ac08e04e672f85c1f4999e17af\"\n  dependencies:\n    kind-of \"^3.0.2\"\n\nto-regex-range@^2.1.0:\n  version \"2.1.1\"\n  resolved \"https://registry.yarnpkg.com/to-regex-range/-/to-regex-range-2.1.1.tgz#7c80c17b9dfebe599e27367e0d4dd5590141db38\"\n  dependencies:\n    is-number \"^3.0.0\"\n    repeat-string \"^1.6.1\"\n\nto-regex-range@^5.0.1:\n  version \"5.0.1\"\n  resolved \"https://registry.yarnpkg.com/to-regex-range/-/to-regex-range-5.0.1.tgz#1648c44aae7c8d988a326018ed72f5b4dd0392e4\"\n  dependencies:\n    is-number \"^7.0.0\"\n\nto-regex@^3.0.1, to-regex@^3.0.2:\n  version \"3.0.2\"\n  resolved \"https://registry.yarnpkg.com/to-regex/-/to-regex-3.0.2.tgz#13cfdd9b336552f30b51f33a8ae1b42a7a7599ce\"\n  dependencies:\n    define-property \"^2.0.2\"\n    extend-shallow \"^3.0.2\"\n    regex-not \"^1.0.2\"\n    safe-regex \"^1.1.0\"\n\ntoposort@^1.0.0:\n  version \"1.0.7\"\n  resolved \"https://registry.yarnpkg.com/toposort/-/toposort-1.0.7.tgz#2e68442d9f64ec720b8cc89e6443ac6caa950029\"\n\ntough-cookie@~2.4.3:\n  version \"2.4.3\"\n  resolved \"https://registry.yarnpkg.com/tough-cookie/-/tough-cookie-2.4.3.tgz#53f36da3f47783b0925afa06ff9f3b165280f781\"\n  dependencies:\n    psl \"^1.1.24\"\n    punycode \"^1.4.1\"\n\ntree-kill@^1.1.0:\n  version \"1.2.1\"\n  resolved \"https://registry.yarnpkg.com/tree-kill/-/tree-kill-1.2.1.tgz#5398f374e2f292b9dcc7b2e71e30a5c3bb6c743a\"\n\ntrim-newlines@^1.0.0:\n  version \"1.0.0\"\n  resolved \"https://registry.yarnpkg.com/trim-newlines/-/trim-newlines-1.0.0.tgz#5887966bb582a4503a41eb524f7d35011815a613\"\n\ntrim-right@^1.0.1:\n  version \"1.0.1\"\n  resolved \"https://registry.yarnpkg.com/trim-right/-/trim-right-1.0.1.tgz#cb2e1203067e0c8de1f614094b9fe45704ea6003\"\n\n\"true-case-path@^1.0.2\":\n  version \"1.0.3\"\n  resolved \"https://registry.yarnpkg.com/true-case-path/-/true-case-path-1.0.3.tgz#f813b5a8c86b40da59606722b144e3225799f47d\"\n  dependencies:\n    glob \"^7.1.2\"\n\nts-loader@^6.0.1:\n  version \"6.0.1\"\n  resolved \"https://registry.yarnpkg.com/ts-loader/-/ts-loader-6.0.1.tgz#abe8ba59356da8cbc85c01ab5feb85ae998db315\"\n  dependencies:\n    chalk \"^2.3.0\"\n    enhanced-resolve \"^4.0.0\"\n    loader-utils \"^1.0.2\"\n    micromatch \"^4.0.0\"\n    semver \"^6.0.0\"\n\ntslib@^1.7.1, tslib@^1.8.0, tslib@^1.8.1, tslib@^1.9.0, tslib@^1.9.3:\n  version \"1.9.3\"\n  resolved \"https://registry.yarnpkg.com/tslib/-/tslib-1.9.3.tgz#d7e4dd79245d85428c4d7e4822a79917954ca286\"\n\ntslint-config-prettier@^1.18.0:\n  version \"1.18.0\"\n  resolved \"https://registry.yarnpkg.com/tslint-config-prettier/-/tslint-config-prettier-1.18.0.tgz#75f140bde947d35d8f0d238e0ebf809d64592c37\"\n\ntslint-junit-formatter@^5.1.0:\n  version \"5.1.0\"\n  resolved \"https://registry.yarnpkg.com/tslint-junit-formatter/-/tslint-junit-formatter-5.1.0.tgz#afd2071466227aad41c044191bbd1c6f9ba7541e\"\n\ntslint-plugin-prettier@^2.0.1:\n  version \"2.0.1\"\n  resolved \"https://registry.yarnpkg.com/tslint-plugin-prettier/-/tslint-plugin-prettier-2.0.1.tgz#95b6a3b766622ffc44375825d7760225c50c3680\"\n  dependencies:\n    eslint-plugin-prettier \"^2.2.0\"\n    lines-and-columns \"^1.1.6\"\n    tslib \"^1.7.1\"\n\ntslint@^5.16.0, tslint@^5.9.1:\n  version \"5.16.0\"\n  resolved \"https://registry.yarnpkg.com/tslint/-/tslint-5.16.0.tgz#ae61f9c5a98d295b9a4f4553b1b1e831c1984d67\"\n  dependencies:\n    \"@babel/code-frame\" \"^7.0.0\"\n    builtin-modules \"^1.1.1\"\n    chalk \"^2.3.0\"\n    commander \"^2.12.1\"\n    diff \"^3.2.0\"\n    glob \"^7.1.1\"\n    js-yaml \"^3.13.0\"\n    minimatch \"^3.0.4\"\n    mkdirp \"^0.5.1\"\n    resolve \"^1.3.2\"\n    semver \"^5.3.0\"\n    tslib \"^1.8.0\"\n    tsutils \"^2.29.0\"\n\ntsutils@^2.29.0:\n  version \"2.29.0\"\n  resolved \"https://registry.yarnpkg.com/tsutils/-/tsutils-2.29.0.tgz#32b488501467acbedd4b85498673a0812aca0b99\"\n  dependencies:\n    tslib \"^1.8.1\"\n\ntty-browserify@0.0.0:\n  version \"0.0.0\"\n  resolved \"https://registry.yarnpkg.com/tty-browserify/-/tty-browserify-0.0.0.tgz#a157ba402da24e9bf957f9aa69d524eed42901a6\"\n\ntunnel-agent@^0.6.0:\n  version \"0.6.0\"\n  resolved \"https://registry.yarnpkg.com/tunnel-agent/-/tunnel-agent-0.6.0.tgz#27a5dea06b36b04a0a9966774b290868f0fc40fd\"\n  dependencies:\n    safe-buffer \"^5.0.1\"\n\ntweetnacl@^0.14.3, tweetnacl@~0.14.0:\n  version \"0.14.5\"\n  resolved \"https://registry.yarnpkg.com/tweetnacl/-/tweetnacl-0.14.5.tgz#5ae68177f192d4456269d108afa93ff8743f4f64\"\n\ntype-is@~1.6.16:\n  version \"1.6.16\"\n  resolved \"https://registry.yarnpkg.com/type-is/-/type-is-1.6.16.tgz#f89ce341541c672b25ee7ae3c73dee3b2be50194\"\n  dependencies:\n    media-typer \"0.3.0\"\n    mime-types \"~2.1.18\"\n\ntyped-scss-modules@^0.0.10:\n  version \"0.0.10\"\n  resolved \"https://registry.yarnpkg.com/typed-scss-modules/-/typed-scss-modules-0.0.10.tgz#2a9f8d1657b5e299b630df195b84ee21bffd1d9e\"\n  dependencies:\n    \"@types/reserved-words\" \"^0.1.0\"\n    camelcase \"^5.0.0\"\n    chalk \"^2.4.2\"\n    chokidar \"^2.1.2\"\n    css-modules-loader-core \"^1.1.0\"\n    glob \"^7.1.3\"\n    param-case \"^2.1.1\"\n    path \"^0.12.7\"\n    reserved-words \"^0.1.2\"\n    yargs \"^12.0.5\"\n\ntypedarray@^0.0.6:\n  version \"0.0.6\"\n  resolved \"https://registry.yarnpkg.com/typedarray/-/typedarray-0.0.6.tgz#867ac74e3864187b1d3d47d996a78ec5c8830777\"\n\ntypescript@^3.4.5:\n  version \"3.4.5\"\n  resolved \"https://registry.yarnpkg.com/typescript/-/typescript-3.4.5.tgz#2d2618d10bb566572b8d7aad5180d84257d70a99\"\n\nuglify-js@3.4.x:\n  version \"3.4.9\"\n  resolved \"https://registry.yarnpkg.com/uglify-js/-/uglify-js-3.4.9.tgz#af02f180c1207d76432e473ed24a28f4a782bae3\"\n  dependencies:\n    commander \"~2.17.1\"\n    source-map \"~0.6.1\"\n\nunderscore@^1.8.3:\n  version \"1.9.1\"\n  resolved \"https://registry.yarnpkg.com/underscore/-/underscore-1.9.1.tgz#06dce34a0e68a7babc29b365b8e74b8925203961\"\n\nunicode-canonical-property-names-ecmascript@^1.0.4:\n  version \"1.0.4\"\n  resolved \"https://registry.yarnpkg.com/unicode-canonical-property-names-ecmascript/-/unicode-canonical-property-names-ecmascript-1.0.4.tgz#2619800c4c825800efdd8343af7dd9933cbe2818\"\n\nunicode-match-property-ecmascript@^1.0.4:\n  version \"1.0.4\"\n  resolved \"https://registry.yarnpkg.com/unicode-match-property-ecmascript/-/unicode-match-property-ecmascript-1.0.4.tgz#8ed2a32569961bce9227d09cd3ffbb8fed5f020c\"\n  dependencies:\n    unicode-canonical-property-names-ecmascript \"^1.0.4\"\n    unicode-property-aliases-ecmascript \"^1.0.4\"\n\nunicode-match-property-value-ecmascript@^1.1.0:\n  version \"1.1.0\"\n  resolved \"https://registry.yarnpkg.com/unicode-match-property-value-ecmascript/-/unicode-match-property-value-ecmascript-1.1.0.tgz#5b4b426e08d13a80365e0d657ac7a6c1ec46a277\"\n\nunicode-property-aliases-ecmascript@^1.0.4:\n  version \"1.0.4\"\n  resolved \"https://registry.yarnpkg.com/unicode-property-aliases-ecmascript/-/unicode-property-aliases-ecmascript-1.0.4.tgz#5a533f31b4317ea76f17d807fa0d116546111dd0\"\n\nunion-value@^1.0.0:\n  version \"1.0.0\"\n  resolved \"https://registry.yarnpkg.com/union-value/-/union-value-1.0.0.tgz#5c71c34cb5bad5dcebe3ea0cd08207ba5aa1aea4\"\n  dependencies:\n    arr-union \"^3.1.0\"\n    get-value \"^2.0.6\"\n    is-extendable \"^0.1.1\"\n    set-value \"^0.4.3\"\n\nuniq@^1.0.1:\n  version \"1.0.1\"\n  resolved \"https://registry.yarnpkg.com/uniq/-/uniq-1.0.1.tgz#b31c5ae8254844a3a8281541ce2b04b865a734ff\"\n\nuniqs@^2.0.0:\n  version \"2.0.0\"\n  resolved \"https://registry.yarnpkg.com/uniqs/-/uniqs-2.0.0.tgz#ffede4b36b25290696e6e165d4a59edb998e6b02\"\n\nunique-filename@^1.1.1:\n  version \"1.1.1\"\n  resolved \"https://registry.yarnpkg.com/unique-filename/-/unique-filename-1.1.1.tgz#1d69769369ada0583103a1e6ae87681b56573230\"\n  dependencies:\n    unique-slug \"^2.0.0\"\n\nunique-slug@^2.0.0:\n  version \"2.0.1\"\n  resolved \"https://registry.yarnpkg.com/unique-slug/-/unique-slug-2.0.1.tgz#5e9edc6d1ce8fb264db18a507ef9bd8544451ca6\"\n  dependencies:\n    imurmurhash \"^0.1.4\"\n\nuniversalify@^0.1.0:\n  version \"0.1.2\"\n  resolved \"https://registry.yarnpkg.com/universalify/-/universalify-0.1.2.tgz#b646f69be3942dabcecc9d6639c80dc105efaa66\"\n\nunpipe@1.0.0, unpipe@~1.0.0:\n  version \"1.0.0\"\n  resolved \"https://registry.yarnpkg.com/unpipe/-/unpipe-1.0.0.tgz#b2bf4ee8514aae6165b4817829d21b2ef49904ec\"\n\nunquote@~1.1.1:\n  version \"1.1.1\"\n  resolved \"https://registry.yarnpkg.com/unquote/-/unquote-1.1.1.tgz#8fded7324ec6e88a0ff8b905e7c098cdc086d544\"\n\nunset-value@^1.0.0:\n  version \"1.0.0\"\n  resolved \"https://registry.yarnpkg.com/unset-value/-/unset-value-1.0.0.tgz#8376873f7d2335179ffb1e6fc3a8ed0dfc8ab559\"\n  dependencies:\n    has-value \"^0.3.1\"\n    isobject \"^3.0.0\"\n\nupath@^1.1.0:\n  version \"1.1.0\"\n  resolved \"https://registry.yarnpkg.com/upath/-/upath-1.1.0.tgz#35256597e46a581db4793d0ce47fa9aebfc9fabd\"\n\nupath@^1.1.1:\n  version \"1.1.2\"\n  resolved \"https://registry.yarnpkg.com/upath/-/upath-1.1.2.tgz#3db658600edaeeccbe6db5e684d67ee8c2acd068\"\n\nupper-case@^1.1.1:\n  version \"1.1.3\"\n  resolved \"https://registry.yarnpkg.com/upper-case/-/upper-case-1.1.3.tgz#f6b4501c2ec4cdd26ba78be7222961de77621598\"\n\nuri-js@^4.2.2:\n  version \"4.2.2\"\n  resolved \"https://registry.yarnpkg.com/uri-js/-/uri-js-4.2.2.tgz#94c540e1ff772956e2299507c010aea6c8838eb0\"\n  dependencies:\n    punycode \"^2.1.0\"\n\nurix@^0.1.0:\n  version \"0.1.0\"\n  resolved \"https://registry.yarnpkg.com/urix/-/urix-0.1.0.tgz#da937f7a62e21fec1fd18d49b35c2935067a6c72\"\n\nurl-parse@^1.4.3:\n  version \"1.4.4\"\n  resolved \"https://registry.yarnpkg.com/url-parse/-/url-parse-1.4.4.tgz#cac1556e95faa0303691fec5cf9d5a1bc34648f8\"\n  dependencies:\n    querystringify \"^2.0.0\"\n    requires-port \"^1.0.0\"\n\nurl-regex@^3.0.0:\n  version \"3.2.0\"\n  resolved \"https://registry.yarnpkg.com/url-regex/-/url-regex-3.2.0.tgz#dbad1e0c9e29e105dd0b1f09f6862f7fdb482724\"\n  dependencies:\n    ip-regex \"^1.0.1\"\n\nurl@^0.11.0:\n  version \"0.11.0\"\n  resolved \"https://registry.yarnpkg.com/url/-/url-0.11.0.tgz#3838e97cfc60521eb73c525a8e55bfdd9e2e28f1\"\n  dependencies:\n    punycode \"1.3.2\"\n    querystring \"0.2.0\"\n\nuse@^3.1.0:\n  version \"3.1.1\"\n  resolved \"https://registry.yarnpkg.com/use/-/use-3.1.1.tgz#d50c8cac79a19fbc20f2911f56eb973f4e10070f\"\n\nutil-deprecate@^1.0.1, util-deprecate@~1.0.1:\n  version \"1.0.2\"\n  resolved \"https://registry.yarnpkg.com/util-deprecate/-/util-deprecate-1.0.2.tgz#450d4dc9fa70de732762fbd2d4a28981419a0ccf\"\n\nutil.promisify@1.0.0, util.promisify@^1.0.0, util.promisify@~1.0.0:\n  version \"1.0.0\"\n  resolved \"https://registry.yarnpkg.com/util.promisify/-/util.promisify-1.0.0.tgz#440f7165a459c9a16dc145eb8e72f35687097030\"\n  dependencies:\n    define-properties \"^1.1.2\"\n    object.getownpropertydescriptors \"^2.0.3\"\n\nutil@0.10.3:\n  version \"0.10.3\"\n  resolved \"https://registry.yarnpkg.com/util/-/util-0.10.3.tgz#7afb1afe50805246489e3db7fe0ed379336ac0f9\"\n  dependencies:\n    inherits \"2.0.1\"\n\nutil@^0.10.3:\n  version \"0.10.4\"\n  resolved \"https://registry.yarnpkg.com/util/-/util-0.10.4.tgz#3aa0125bfe668a4672de58857d3ace27ecb76901\"\n  dependencies:\n    inherits \"2.0.3\"\n\nutil@^0.11.0:\n  version \"0.11.1\"\n  resolved \"https://registry.yarnpkg.com/util/-/util-0.11.1.tgz#3236733720ec64bb27f6e26f421aaa2e1b588d61\"\n  dependencies:\n    inherits \"2.0.3\"\n\nutila@^0.4.0, utila@~0.4:\n  version \"0.4.0\"\n  resolved \"https://registry.yarnpkg.com/utila/-/utila-0.4.0.tgz#8a16a05d445657a3aea5eecc5b12a4fa5379772c\"\n\nutils-merge@1.0.1:\n  version \"1.0.1\"\n  resolved \"https://registry.yarnpkg.com/utils-merge/-/utils-merge-1.0.1.tgz#9f95710f50a267947b2ccc124741c1028427e713\"\n\nuuid@^3.0.1, uuid@^3.3.2:\n  version \"3.3.2\"\n  resolved \"https://registry.yarnpkg.com/uuid/-/uuid-3.3.2.tgz#1b4af4955eb3077c501c23872fc6513811587131\"\n\nv8-compile-cache@^2.0.2:\n  version \"2.0.2\"\n  resolved \"https://registry.yarnpkg.com/v8-compile-cache/-/v8-compile-cache-2.0.2.tgz#a428b28bb26790734c4fc8bc9fa106fccebf6a6c\"\n\nvalidate-npm-package-license@^3.0.1:\n  version \"3.0.4\"\n  resolved \"https://registry.yarnpkg.com/validate-npm-package-license/-/validate-npm-package-license-3.0.4.tgz#fc91f6b9c7ba15c857f4cb2c5defeec39d4f410a\"\n  dependencies:\n    spdx-correct \"^3.0.0\"\n    spdx-expression-parse \"^3.0.0\"\n\nvalue-equal@^0.4.0:\n  version \"0.4.0\"\n  resolved \"https://registry.yarnpkg.com/value-equal/-/value-equal-0.4.0.tgz#c5bdd2f54ee093c04839d71ce2e4758a6890abc7\"\n\nvanilla-tilt@^1.5.0:\n  version \"1.6.1\"\n  resolved \"https://registry.yarnpkg.com/vanilla-tilt/-/vanilla-tilt-1.6.1.tgz#7472eda102f565c077b76e6240f36941436f2e24\"\n\nvary@~1.1.2:\n  version \"1.1.2\"\n  resolved \"https://registry.yarnpkg.com/vary/-/vary-1.1.2.tgz#2299f02c6ded30d4a5961b0b9f74524a18f634fc\"\n\nvendors@^1.0.0:\n  version \"1.0.2\"\n  resolved \"https://registry.yarnpkg.com/vendors/-/vendors-1.0.2.tgz#7fcb5eef9f5623b156bcea89ec37d63676f21801\"\n\nverror@1.10.0:\n  version \"1.10.0\"\n  resolved \"https://registry.yarnpkg.com/verror/-/verror-1.10.0.tgz#3a105ca17053af55d6e270c1f8288682e18da400\"\n  dependencies:\n    assert-plus \"^1.0.0\"\n    core-util-is \"1.0.2\"\n    extsprintf \"^1.2.0\"\n\nvinyl@^1.1.0:\n  version \"1.2.0\"\n  resolved \"https://registry.yarnpkg.com/vinyl/-/vinyl-1.2.0.tgz#5c88036cf565e5df05558bfc911f8656df218884\"\n  dependencies:\n    clone \"^1.0.0\"\n    clone-stats \"^0.0.1\"\n    replace-ext \"0.0.1\"\n\nvm-browserify@0.0.4:\n  version \"0.0.4\"\n  resolved \"https://registry.yarnpkg.com/vm-browserify/-/vm-browserify-0.0.4.tgz#5d7ea45bbef9e4a6ff65f95438e0a87c357d5a73\"\n  dependencies:\n    indexof \"0.0.1\"\n\nwarning@^3.0.0:\n  version \"3.0.0\"\n  resolved \"https://registry.yarnpkg.com/warning/-/warning-3.0.0.tgz#32e5377cb572de4ab04753bdf8821c01ed605b7c\"\n  dependencies:\n    loose-envify \"^1.0.0\"\n\nwarning@^4.0.1:\n  version \"4.0.3\"\n  resolved \"https://registry.yarnpkg.com/warning/-/warning-4.0.3.tgz#16e9e077eb8a86d6af7d64aa1e05fd85b4678ca3\"\n  dependencies:\n    loose-envify \"^1.0.0\"\n\nwatchpack@^1.5.0:\n  version \"1.6.0\"\n  resolved \"https://registry.yarnpkg.com/watchpack/-/watchpack-1.6.0.tgz#4bc12c2ebe8aa277a71f1d3f14d685c7b446cd00\"\n  dependencies:\n    chokidar \"^2.0.2\"\n    graceful-fs \"^4.1.2\"\n    neo-async \"^2.5.0\"\n\nwbuf@^1.1.0, wbuf@^1.7.3:\n  version \"1.7.3\"\n  resolved \"https://registry.yarnpkg.com/wbuf/-/wbuf-1.7.3.tgz#c1d8d149316d3ea852848895cb6a0bfe887b87df\"\n  dependencies:\n    minimalistic-assert \"^1.0.0\"\n\nwebpack-chunk-hash@^0.6.0:\n  version \"0.6.0\"\n  resolved \"https://registry.yarnpkg.com/webpack-chunk-hash/-/webpack-chunk-hash-0.6.0.tgz#eca36aff76e327d08a18a3e7990eb46e68376818\"\n  dependencies:\n    \"@types/webpack\" \"^3.0.0 || ^4.0.0\"\n\nwebpack-cli@^3.0.0:\n  version \"3.2.3\"\n  resolved \"https://registry.yarnpkg.com/webpack-cli/-/webpack-cli-3.2.3.tgz#13653549adfd8ccd920ad7be1ef868bacc22e346\"\n  dependencies:\n    chalk \"^2.4.1\"\n    cross-spawn \"^6.0.5\"\n    enhanced-resolve \"^4.1.0\"\n    findup-sync \"^2.0.0\"\n    global-modules \"^1.0.0\"\n    import-local \"^2.0.0\"\n    interpret \"^1.1.0\"\n    loader-utils \"^1.1.0\"\n    supports-color \"^5.5.0\"\n    v8-compile-cache \"^2.0.2\"\n    yargs \"^12.0.4\"\n\nwebpack-dev-middleware@^3.5.1:\n  version \"3.6.0\"\n  resolved \"https://registry.yarnpkg.com/webpack-dev-middleware/-/webpack-dev-middleware-3.6.0.tgz#71f1b04e52ff8d442757af2be3a658237d53a3e5\"\n  dependencies:\n    memory-fs \"^0.4.1\"\n    mime \"^2.3.1\"\n    range-parser \"^1.0.3\"\n    webpack-log \"^2.0.0\"\n\nwebpack-dev-server@^3.1.14:\n  version \"3.2.1\"\n  resolved \"https://registry.yarnpkg.com/webpack-dev-server/-/webpack-dev-server-3.2.1.tgz#1b45ce3ecfc55b6ebe5e36dab2777c02bc508c4e\"\n  dependencies:\n    ansi-html \"0.0.7\"\n    bonjour \"^3.5.0\"\n    chokidar \"^2.0.0\"\n    compression \"^1.5.2\"\n    connect-history-api-fallback \"^1.3.0\"\n    debug \"^4.1.1\"\n    del \"^3.0.0\"\n    express \"^4.16.2\"\n    html-entities \"^1.2.0\"\n    http-proxy-middleware \"^0.19.1\"\n    import-local \"^2.0.0\"\n    internal-ip \"^4.2.0\"\n    ip \"^1.1.5\"\n    killable \"^1.0.0\"\n    loglevel \"^1.4.1\"\n    opn \"^5.1.0\"\n    portfinder \"^1.0.9\"\n    schema-utils \"^1.0.0\"\n    selfsigned \"^1.9.1\"\n    semver \"^5.6.0\"\n    serve-index \"^1.7.2\"\n    sockjs \"0.3.19\"\n    sockjs-client \"1.3.0\"\n    spdy \"^4.0.0\"\n    strip-ansi \"^3.0.0\"\n    supports-color \"^6.1.0\"\n    url \"^0.11.0\"\n    webpack-dev-middleware \"^3.5.1\"\n    webpack-log \"^2.0.0\"\n    yargs \"12.0.2\"\n\nwebpack-log@^2.0.0:\n  version \"2.0.0\"\n  resolved \"https://registry.yarnpkg.com/webpack-log/-/webpack-log-2.0.0.tgz#5b7928e0637593f119d32f6227c1e0ac31e1b47f\"\n  dependencies:\n    ansi-colors \"^3.0.0\"\n    uuid \"^3.3.2\"\n\nwebpack-manifest-plugin@^2.0.2:\n  version \"2.0.4\"\n  resolved \"https://registry.yarnpkg.com/webpack-manifest-plugin/-/webpack-manifest-plugin-2.0.4.tgz#e4ca2999b09557716b8ba4475fb79fab5986f0cd\"\n  dependencies:\n    fs-extra \"^7.0.0\"\n    lodash \">=3.5 <5\"\n    tapable \"^1.0.0\"\n\nwebpack-sources@^1.1.0, webpack-sources@^1.3.0:\n  version \"1.3.0\"\n  resolved \"https://registry.yarnpkg.com/webpack-sources/-/webpack-sources-1.3.0.tgz#2a28dcb9f1f45fe960d8f1493252b5ee6530fa85\"\n  dependencies:\n    source-list-map \"^2.0.0\"\n    source-map \"~0.6.1\"\n\nwebpack@^4.20.0:\n  version \"4.29.5\"\n  resolved \"https://registry.yarnpkg.com/webpack/-/webpack-4.29.5.tgz#52b60a7b0838427c3a894cd801a11dc0836bc79f\"\n  dependencies:\n    \"@webassemblyjs/ast\" \"1.8.3\"\n    \"@webassemblyjs/helper-module-context\" \"1.8.3\"\n    \"@webassemblyjs/wasm-edit\" \"1.8.3\"\n    \"@webassemblyjs/wasm-parser\" \"1.8.3\"\n    acorn \"^6.0.5\"\n    acorn-dynamic-import \"^4.0.0\"\n    ajv \"^6.1.0\"\n    ajv-keywords \"^3.1.0\"\n    chrome-trace-event \"^1.0.0\"\n    enhanced-resolve \"^4.1.0\"\n    eslint-scope \"^4.0.0\"\n    json-parse-better-errors \"^1.0.2\"\n    loader-runner \"^2.3.0\"\n    loader-utils \"^1.1.0\"\n    memory-fs \"~0.4.1\"\n    micromatch \"^3.1.8\"\n    mkdirp \"~0.5.0\"\n    neo-async \"^2.5.0\"\n    node-libs-browser \"^2.0.0\"\n    schema-utils \"^1.0.0\"\n    tapable \"^1.1.0\"\n    terser-webpack-plugin \"^1.1.0\"\n    watchpack \"^1.5.0\"\n    webpack-sources \"^1.3.0\"\n\nwebsocket-driver@>=0.5.1:\n  version \"0.7.0\"\n  resolved \"https://registry.yarnpkg.com/websocket-driver/-/websocket-driver-0.7.0.tgz#0caf9d2d755d93aee049d4bdd0d3fe2cca2a24eb\"\n  dependencies:\n    http-parser-js \">=0.4.0\"\n    websocket-extensions \">=0.1.1\"\n\nwebsocket-extensions@>=0.1.1:\n  version \"0.1.3\"\n  resolved \"https://registry.yarnpkg.com/websocket-extensions/-/websocket-extensions-0.1.3.tgz#5d2ff22977003ec687a4b87073dfbbac146ccf29\"\n\nwhatwg-fetch@^3.0.0:\n  version \"3.0.0\"\n  resolved \"https://registry.yarnpkg.com/whatwg-fetch/-/whatwg-fetch-3.0.0.tgz#fc804e458cc460009b1a2b966bc8817d2578aefb\"\n\nwhich-module@^2.0.0:\n  version \"2.0.0\"\n  resolved \"https://registry.yarnpkg.com/which-module/-/which-module-2.0.0.tgz#d9ef07dce77b9902b8a3a8fa4b31c3e3f7e6e87a\"\n\nwhich@1, which@^1.2.10, which@^1.2.14, which@^1.2.9:\n  version \"1.3.1\"\n  resolved \"https://registry.yarnpkg.com/which/-/which-1.3.1.tgz#a45043d54f5805316da8d62f9f50918d3da70b0a\"\n  dependencies:\n    isexe \"^2.0.0\"\n\nwide-align@^1.1.0:\n  version \"1.1.3\"\n  resolved \"https://registry.yarnpkg.com/wide-align/-/wide-align-1.1.3.tgz#ae074e6bdc0c14a431e804e624549c633b000457\"\n  dependencies:\n    string-width \"^1.0.2 || 2\"\n\nwindow-size@^0.1.4:\n  version \"0.1.4\"\n  resolved \"https://registry.yarnpkg.com/window-size/-/window-size-0.1.4.tgz#f8e1aa1ee5a53ec5bf151ffa09742a6ad7697876\"\n\nworker-farm@^1.5.2:\n  version \"1.6.0\"\n  resolved \"https://registry.yarnpkg.com/worker-farm/-/worker-farm-1.6.0.tgz#aecc405976fab5a95526180846f0dba288f3a4a0\"\n  dependencies:\n    errno \"~0.1.7\"\n\nwrap-ansi@^2.0.0:\n  version \"2.1.0\"\n  resolved \"https://registry.yarnpkg.com/wrap-ansi/-/wrap-ansi-2.1.0.tgz#d8fc3d284dd05794fe84973caecdd1cf824fdd85\"\n  dependencies:\n    string-width \"^1.0.1\"\n    strip-ansi \"^3.0.1\"\n\nwrap-ansi@^5.1.0:\n  version \"5.1.0\"\n  resolved \"https://registry.yarnpkg.com/wrap-ansi/-/wrap-ansi-5.1.0.tgz#1fd1f67235d5b6d0fee781056001bfb694c03b09\"\n  integrity sha512-QC1/iN/2/RPVJ5jYK8BGttj5z83LmSKmvbvrXPNCLZSEb32KKVDJDl/MOt2N01qU2H/FkzEa9PKto1BqDjtd7Q==\n  dependencies:\n    ansi-styles \"^3.2.0\"\n    string-width \"^3.0.0\"\n    strip-ansi \"^5.0.0\"\n\nwrappy@1:\n  version \"1.0.2\"\n  resolved \"https://registry.yarnpkg.com/wrappy/-/wrappy-1.0.2.tgz#b5243d8f3ec1aa35f1364605bc0d1036e30ab69f\"\n\nxhr@^2.0.1:\n  version \"2.5.0\"\n  resolved \"https://registry.yarnpkg.com/xhr/-/xhr-2.5.0.tgz#bed8d1676d5ca36108667692b74b316c496e49dd\"\n  dependencies:\n    global \"~4.3.0\"\n    is-function \"^1.0.1\"\n    parse-headers \"^2.0.0\"\n    xtend \"^4.0.0\"\n\nxml-parse-from-string@^1.0.0:\n  version \"1.0.1\"\n  resolved \"https://registry.yarnpkg.com/xml-parse-from-string/-/xml-parse-from-string-1.0.1.tgz#a9029e929d3dbcded169f3c6e28238d95a5d5a28\"\n\nxml2js@>=0.2.4, xml2js@^0.4.5:\n  version \"0.4.19\"\n  resolved \"https://registry.yarnpkg.com/xml2js/-/xml2js-0.4.19.tgz#686c20f213209e94abf0d1bcf1efaa291c7827a7\"\n  dependencies:\n    sax \">=0.6.0\"\n    xmlbuilder \"~9.0.1\"\n\nxmlbuilder@~9.0.1:\n  version \"9.0.7\"\n  resolved \"https://registry.yarnpkg.com/xmlbuilder/-/xmlbuilder-9.0.7.tgz#132ee63d2ec5565c557e20f4c22df9aca686b10d\"\n\nxregexp@4.0.0:\n  version \"4.0.0\"\n  resolved \"https://registry.yarnpkg.com/xregexp/-/xregexp-4.0.0.tgz#e698189de49dd2a18cc5687b05e17c8e43943020\"\n\nxtend@^4.0.0, xtend@~4.0.1:\n  version \"4.0.1\"\n  resolved \"https://registry.yarnpkg.com/xtend/-/xtend-4.0.1.tgz#a5c6d532be656e23db820efb943a1f04998d63af\"\n\ny18n@^3.2.0, y18n@^3.2.1:\n  version \"3.2.1\"\n  resolved \"https://registry.yarnpkg.com/y18n/-/y18n-3.2.1.tgz#6d15fba884c08679c0d77e88e7759e811e07fa41\"\n\n\"y18n@^3.2.1 || ^4.0.0\", y18n@^4.0.0:\n  version \"4.0.0\"\n  resolved \"https://registry.yarnpkg.com/y18n/-/y18n-4.0.0.tgz#95ef94f85ecc81d007c264e190a120f0a3c8566b\"\n\nyallist@^2.1.2:\n  version \"2.1.2\"\n  resolved \"https://registry.yarnpkg.com/yallist/-/yallist-2.1.2.tgz#1c11f9218f076089a47dd512f93c6699a6a81d52\"\n\nyallist@^3.0.0, yallist@^3.0.2:\n  version \"3.0.3\"\n  resolved \"https://registry.yarnpkg.com/yallist/-/yallist-3.0.3.tgz#b4b049e314be545e3ce802236d6cd22cd91c3de9\"\n\nyargs-parser@^10.1.0:\n  version \"10.1.0\"\n  resolved \"https://registry.yarnpkg.com/yargs-parser/-/yargs-parser-10.1.0.tgz#7202265b89f7e9e9f2e5765e0fe735a905edbaa8\"\n  dependencies:\n    camelcase \"^4.1.0\"\n\nyargs-parser@^11.1.1:\n  version \"11.1.1\"\n  resolved \"https://registry.yarnpkg.com/yargs-parser/-/yargs-parser-11.1.1.tgz#879a0865973bca9f6bab5cbdf3b1c67ec7d3bcf4\"\n  dependencies:\n    camelcase \"^5.0.0\"\n    decamelize \"^1.2.0\"\n\nyargs-parser@^12.0.0:\n  version \"12.0.0\"\n  resolved \"https://registry.yarnpkg.com/yargs-parser/-/yargs-parser-12.0.0.tgz#18aa348854747dfe1002d01bd87d65df10d40a84\"\n  dependencies:\n    camelcase \"^5.0.0\"\n    decamelize \"^1.2.0\"\n\nyargs-parser@^13.1.2:\n  version \"13.1.2\"\n  resolved \"https://registry.yarnpkg.com/yargs-parser/-/yargs-parser-13.1.2.tgz#130f09702ebaeef2650d54ce6e3e5706f7a4fb38\"\n  integrity sha512-3lbsNRf/j+A4QuSZfDRA7HRSfWrzO0YjqTJd5kjAq37Zep1CEgaYmrH9Q3GwPiB9cHyd1Y1UwggGhJGoxipbzg==\n  dependencies:\n    camelcase \"^5.0.0\"\n    decamelize \"^1.2.0\"\n\nyargs-parser@^9.0.2:\n  version \"9.0.2\"\n  resolved \"https://registry.yarnpkg.com/yargs-parser/-/yargs-parser-9.0.2.tgz#9ccf6a43460fe4ed40a9bb68f48d43b8a68cc077\"\n  dependencies:\n    camelcase \"^4.1.0\"\n\nyargs@12.0.2:\n  version \"12.0.2\"\n  resolved \"https://registry.yarnpkg.com/yargs/-/yargs-12.0.2.tgz#fe58234369392af33ecbef53819171eff0f5aadc\"\n  dependencies:\n    cliui \"^4.0.0\"\n    decamelize \"^2.0.0\"\n    find-up \"^3.0.0\"\n    get-caller-file \"^1.0.1\"\n    os-locale \"^3.0.0\"\n    require-directory \"^2.1.1\"\n    require-main-filename \"^1.0.1\"\n    set-blocking \"^2.0.0\"\n    string-width \"^2.0.0\"\n    which-module \"^2.0.0\"\n    y18n \"^3.2.1 || ^4.0.0\"\n    yargs-parser \"^10.1.0\"\n\nyargs@^11.0.0:\n  version \"11.1.0\"\n  resolved \"https://registry.yarnpkg.com/yargs/-/yargs-11.1.0.tgz#90b869934ed6e871115ea2ff58b03f4724ed2d77\"\n  dependencies:\n    cliui \"^4.0.0\"\n    decamelize \"^1.1.1\"\n    find-up \"^2.1.0\"\n    get-caller-file \"^1.0.1\"\n    os-locale \"^2.0.0\"\n    require-directory \"^2.1.1\"\n    require-main-filename \"^1.0.1\"\n    set-blocking \"^2.0.0\"\n    string-width \"^2.0.0\"\n    which-module \"^2.0.0\"\n    y18n \"^3.2.1\"\n    yargs-parser \"^9.0.2\"\n\nyargs@^12.0.1, yargs@^12.0.4, yargs@^12.0.5:\n  version \"12.0.5\"\n  resolved \"https://registry.yarnpkg.com/yargs/-/yargs-12.0.5.tgz#05f5997b609647b64f66b81e3b4b10a368e7ad13\"\n  dependencies:\n    cliui \"^4.0.0\"\n    decamelize \"^1.2.0\"\n    find-up \"^3.0.0\"\n    get-caller-file \"^1.0.1\"\n    os-locale \"^3.0.0\"\n    require-directory \"^2.1.1\"\n    require-main-filename \"^1.0.1\"\n    set-blocking \"^2.0.0\"\n    string-width \"^2.0.0\"\n    which-module \"^2.0.0\"\n    y18n \"^3.2.1 || ^4.0.0\"\n    yargs-parser \"^11.1.1\"\n\nyargs@^13.3.2:\n  version \"13.3.2\"\n  resolved \"https://registry.yarnpkg.com/yargs/-/yargs-13.3.2.tgz#ad7ffefec1aa59565ac915f82dccb38a9c31a2dd\"\n  integrity sha512-AX3Zw5iPruN5ie6xGRIDgqkT+ZhnRlZMLMHAs8tg7nRruy2Nb+i5o9bwghAogtM08q1dpr2LVoS8KSTMYpWXUw==\n  dependencies:\n    cliui \"^5.0.0\"\n    find-up \"^3.0.0\"\n    get-caller-file \"^2.0.1\"\n    require-directory \"^2.1.1\"\n    require-main-filename \"^2.0.0\"\n    set-blocking \"^2.0.0\"\n    string-width \"^3.0.0\"\n    which-module \"^2.0.0\"\n    y18n \"^4.0.0\"\n    yargs-parser \"^13.1.2\"\n\nyargs@^3.31.0:\n  version \"3.32.0\"\n  resolved \"https://registry.yarnpkg.com/yargs/-/yargs-3.32.0.tgz#03088e9ebf9e756b69751611d2a5ef591482c995\"\n  dependencies:\n    camelcase \"^2.0.1\"\n    cliui \"^3.0.3\"\n    decamelize \"^1.1.1\"\n    os-locale \"^1.4.0\"\n    string-width \"^1.0.1\"\n    window-size \"^0.1.4\"\n    y18n \"^3.2.0\"\n\nyauzl@2.4.1:\n  version \"2.4.1\"\n  resolved \"https://registry.yarnpkg.com/yauzl/-/yauzl-2.4.1.tgz#9528f442dab1b2284e58b4379bb194e22e0c4005\"\n  dependencies:\n    fd-slicer \"~1.0.1\"\n"
        }
      ]
    }
  ]
}